library/src/blas3/Tensile/Logic/aldebaran/arcturus_Cijk_Alik_Bjlk_SB.yaml
- {MinimumRequiredVersion: 4.6.0}
- arcturus
- gfx908
- [Device 7380, Device 7388, Device 738c, Device 7390]
    SolutionIndex: 0
    SolutionNameMin: Cijk_Alik_Bjlk_SB_MT016x016x08_GRVW02_GSU01_SNLL0_TT02_02_VW02_WG08_08_01
    SolutionIndex: 1
    SolutionNameMin: Cijk_Alik_Bjlk_SB_MT016x032x08_GRVW02_GSU01_SNLL0_TT02_04_VW02_WG08_08_01
    SolutionIndex: 2
    SolutionNameMin: Cijk_Alik_Bjlk_SB_MT032x032x08_GRVW02_GSU01_SNLL0_TT02_02_VW02_WG16_16_01
    SolutionIndex: 3
    SolutionNameMin: Cijk_Alik_Bjlk_SB_MT032x064x08_GRVW02_GSU01_SNLL0_TT02_04_VW02_WG16_16_01
    SolutionIndex: 4
    SolutionNameMin: Cijk_Alik_Bjlk_SB_MT128x128x08_GRVW04_GSU01_SNLL0_TT08_08_VW04_WG16_16_01
    SolutionIndex: 5
    SolutionNameMin: Cijk_Alik_Bjlk_SB_MT032x016x08_GRVW02_GSU01_SNLL0_TT02_02_VW02_WG16_08_01
    SolutionIndex: 6
    SolutionNameMin: Cijk_Alik_Bjlk_SB_MT032x032x08_GRVW02_GSU01_SNLL0_TT02_04_VW02_WG16_08_01
    SolutionIndex: 7
    SolutionNameMin: Cijk_Alik_Bjlk_SB_MT016x032x08_GRVW02_GSU01_SNLL0_TT02_02_VW02_WG08_16_01
    SolutionIndex: 8
    SolutionNameMin: Cijk_Alik_Bjlk_SB_MT016x064x08_GRVW02_GSU01_SNLL0_TT02_04_VW02_WG08_16_01
    SolutionIndex: 9
    SolutionNameMin: Cijk_Alik_Bjlk_SB_MT016x016x08_GRVW02_GSU01_SNLL0_TT02_02_VW02_WG08_08_01
    SolutionIndex: 10
    SolutionNameMin: Cijk_Alik_Bjlk_SB_MT016x032x08_GRVW02_GSU01_SNLL0_TT02_04_VW02_WG08_08_01
    SolutionIndex: 11
    SolutionNameMin: Cijk_Alik_Bjlk_SB_MT032x032x08_GRVW02_GSU01_SNLL0_TT02_02_VW02_WG16_16_01
    SolutionIndex: 12
    SolutionNameMin: Cijk_Alik_Bjlk_SB_MT032x064x08_GRVW02_GSU01_SNLL0_TT02_04_VW02_WG16_16_01
    SolutionIndex: 13
    SolutionNameMin: Cijk_Alik_Bjlk_SB_MT128x128x08_GRVW04_GSU01_SNLL0_TT08_08_VW04_WG16_16_01
    SolutionIndex: 14
    SolutionNameMin: Cijk_Alik_Bjlk_SB_MT032x016x08_GRVW02_GSU01_SNLL0_TT02_02_VW02_WG16_08_01
    SolutionIndex: 15
    SolutionNameMin: Cijk_Alik_Bjlk_SB_MT032x032x08_GRVW02_GSU01_SNLL0_TT02_04_VW02_WG16_08_01
    SolutionIndex: 16
    SolutionNameMin: Cijk_Alik_Bjlk_SB_MT016x032x08_GRVW02_GSU01_SNLL0_TT02_02_VW02_WG08_16_01
    SolutionIndex: 17
    SolutionNameMin: Cijk_Alik_Bjlk_SB_MT016x016x08_GRVW02_GSU02_SNLL0_TT02_02_VW02_WG08_08_02
    SolutionIndex: 18
    SolutionNameMin: Cijk_Alik_Bjlk_SB_MT016x016x08_GRVW02_GSU04_SNLL0_TT02_02_VW02_WG08_08_02
    SolutionIndex: 19
    SolutionNameMin: Cijk_Alik_Bjlk_SB_MT016x016x08_GRVW02_GSU08_SNLL0_TT02_02_VW02_WG08_08_02
    SolutionIndex: 20
    SolutionNameMin: Cijk_Alik_Bjlk_SB_MT008x016x16_GRVW02_GSU02_SNLL0_TT02_02_VW02_WG04_08_04
    SolutionIndex: 21
    SolutionNameMin: Cijk_Alik_Bjlk_SB_MT016x032x16_GRVW02_GSU02_SNLL0_TT02_04_VW02_WG08_08_02
    SolutionIndex: 22
    SolutionNameMin: Cijk_Alik_Bjlk_SB_MT032x032x16_GRVW04_GSU02_SNLL0_TT04_04_VW04_WG08_08_02
    SolutionIndex: 23
    SolutionNameMin: Cijk_Alik_Bjlk_SB_MT032x064x16_GRVW04_GSU02_SNLL0_TT04_08_VW04_WG08_08_02
    SolutionIndex: 24
    SolutionNameMin: Cijk_Alik_Bjlk_SB_MT016x032x16_GRVW02_GSU02_SNLL0_TT02_02_VW02_WG08_16_02
    SolutionIndex: 25
    SolutionNameMin: Cijk_Alik_Bjlk_SB_MT016x064x16_GRVW02_GSU02_SNLL0_TT02_04_VW02_WG08_16_02
    SolutionIndex: 26
    SolutionNameMin: Cijk_Alik_Bjlk_SB_MT008x016x16_GRVW02_GSU02_SNLL0_TT02_02_VW02_WG04_08_04
    SolutionIndex: 27
    SolutionNameMin: Cijk_Alik_Bjlk_SB_MT032x032x16_GRVW04_GSU02_SNLL0_TT04_04_VW04_WG08_08_02
    SolutionIndex: 28
    SolutionNameMin: Cijk_Alik_Bjlk_SB_MT032x064x16_GRVW04_GSU02_SNLL0_TT04_08_VW04_WG08_08_02
    SolutionIndex: 29
    SolutionNameMin: Cijk_Alik_Bjlk_SB_MT016x032x16_GRVW02_GSU02_SNLL0_TT02_02_VW02_WG08_16_02
    SolutionIndex: 30
    SolutionNameMin: Cijk_Alik_Bjlk_SB_MT016x064x16_GRVW02_GSU02_SNLL0_TT02_04_VW02_WG08_16_02
    SolutionIndex: 31
    SolutionNameMin: Cijk_Alik_Bjlk_SB_MT008x016x16_GRVW02_GSU04_SNLL0_TT02_02_VW02_WG04_08_04
    SolutionIndex: 32
    SolutionNameMin: Cijk_Alik_Bjlk_SB_MT008x032x16_GRVW02_GSU04_SNLL0_TT02_04_VW02_WG04_08_04
    SolutionIndex: 33
    SolutionNameMin: Cijk_Alik_Bjlk_SB_MT032x032x16_GRVW04_GSU04_SNLL0_TT04_04_VW04_WG08_08_02
    SolutionIndex: 34
    SolutionNameMin: Cijk_Alik_Bjlk_SB_MT032x064x16_GRVW04_GSU04_SNLL0_TT04_08_VW04_WG08_08_02
    SolutionIndex: 35
    SolutionNameMin: Cijk_Alik_Bjlk_SB_MT016x064x16_GRVW02_GSU04_SNLL0_TT02_04_VW02_WG08_16_02
    SolutionIndex: 36
    SolutionNameMin: Cijk_Alik_Bjlk_SB_MT032x032x16_GRVW04_GSU04_SNLL0_TT04_04_VW04_WG08_08_02
    SolutionIndex: 37
    SolutionNameMin: Cijk_Alik_Bjlk_SB_MT032x064x16_GRVW04_GSU04_SNLL0_TT04_08_VW04_WG08_08_02
    SolutionIndex: 38
    SolutionNameMin: Cijk_Alik_Bjlk_SB_MT008x016x16_GRVW02_GSU08_SNLL0_TT02_02_VW02_WG04_08_04
    SolutionIndex: 39
    SolutionNameMin: Cijk_Alik_Bjlk_SB_MT008x032x16_GRVW02_GSU08_SNLL0_TT02_04_VW02_WG04_08_04
    SolutionIndex: 40
    SolutionNameMin: Cijk_Alik_Bjlk_SB_MT064x064x24_GRVW04_GSU02_SNLL0_TT08_08_VW04_WG08_08_02
    SolutionIndex: 41
    SolutionNameMin: Cijk_Alik_Bjlk_SB_MT064x064x24_GRVW04_GSU02_SNLL0_TT08_08_VW04_WG08_08_02
    SolutionIndex: 42
    SolutionNameMin: Cijk_Alik_Bjlk_SB_MT008x016x32_GRVW02_GSU02_SNLL0_TT02_02_VW02_WG04_08_04
    SolutionIndex: 43
    SolutionNameMin: Cijk_Alik_Bjlk_SB_MT008x032x32_GRVW02_GSU02_SNLL0_TT02_04_VW02_WG04_08_04
    SolutionIndex: 44
    SolutionNameMin: Cijk_Alik_Bjlk_SB_MT032x032x32_GRVW02_GSU02_SNLL0_TT02_04_VW02_WG16_08_04
    SolutionIndex: 45
    SolutionNameMin: Cijk_Alik_Bjlk_SB_MT032x064x32_GRVW04_GSU02_SNLL0_TT04_04_VW04_WG08_16_02
    SolutionIndex: 46
    SolutionNameMin: Cijk_Alik_Bjlk_SB_MT008x032x32_GRVW02_GSU02_SNLL0_TT02_04_VW02_WG04_08_04
    SolutionIndex: 47
    SolutionNameMin: Cijk_Alik_Bjlk_SB_MT016x032x32_GRVW04_GSU02_SNLL0_TT04_04_VW04_WG04_08_04
    SolutionIndex: 48
    SolutionNameMin: Cijk_Alik_Bjlk_SB_MT064x064x32_GRVW04_GSU02_SNLL0_TT04_08_VW04_WG16_08_04
    SolutionIndex: 49
    SolutionNameMin: Cijk_Alik_Bjlk_SB_MT032x064x32_GRVW04_GSU02_SNLL0_TT04_04_VW04_WG08_16_02
    SolutionIndex: 50
    SolutionNameMin: Cijk_Alik_Bjlk_SB_MT008x016x32_GRVW02_GSU04_SNLL0_TT02_02_VW02_WG04_08_04
    SolutionIndex: 51
    SolutionNameMin: Cijk_Alik_Bjlk_SB_MT016x032x32_GRVW04_GSU04_SNLL0_TT04_04_VW04_WG04_08_04
    SolutionIndex: 52
    SolutionNameMin: Cijk_Alik_Bjlk_SB_MT032x016x32_GRVW02_GSU04_SNLL0_TT02_02_VW02_WG16_08_04
    SolutionIndex: 53
    SolutionNameMin: Cijk_Alik_Bjlk_SB_MT032x032x32_GRVW02_GSU04_SNLL0_TT02_04_VW02_WG16_08_04
    SolutionIndex: 54
    SolutionNameMin: Cijk_Alik_Bjlk_SB_MT032x064x32_GRVW04_GSU04_SNLL0_TT04_04_VW04_WG08_16_02
    SolutionIndex: 55
    SolutionNameMin: Cijk_Alik_Bjlk_SB_MT008x016x32_GRVW02_GSU04_SNLL0_TT02_02_VW02_WG04_08_04
    SolutionIndex: 56
    SolutionNameMin: Cijk_Alik_Bjlk_SB_MT008x032x32_GRVW02_GSU04_SNLL0_TT02_04_VW02_WG04_08_04
    SolutionIndex: 57
    SolutionNameMin: Cijk_Alik_Bjlk_SB_MT016x032x32_GRVW04_GSU04_SNLL0_TT04_04_VW04_WG04_08_04
    SolutionIndex: 58
    SolutionNameMin: Cijk_Alik_Bjlk_SB_MT008x016x32_GRVW02_GSU08_SNLL0_TT02_02_VW02_WG04_08_04
    SolutionIndex: 59
    SolutionNameMin: Cijk_Alik_Bjlk_SB_MT128x128x08_GRVW04_GSU01_SNLL0_TT08_08_VW04_WG16_16_01
    SolutionIndex: 60
    SolutionNameMin: Cijk_Alik_Bjlk_SB_MT128x128x08_GRVW04_GSU01_SNLL0_TT08_08_VW04_WG16_16_01
    SolutionIndex: 61
    SolutionNameMin: Cijk_Alik_Bjlk_SB_MT128x128x08_GRVW04_GSU01_SNLL1_TT08_08_VW04_WG16_16_01
    SolutionIndex: 62
    SolutionNameMin: Cijk_Alik_Bjlk_SB_MT128x128x08_GRVW04_GSU01_SNLL1_TT08_08_VW04_WG16_16_01
    SolutionIndex: 63
    SolutionNameMin: Cijk_Alik_Bjlk_SB_MT064x064x16_GRVW04_GSU01_SNLL0_TT04_04_VW04_WG16_16_01
    SolutionIndex: 64
    SolutionNameMin: Cijk_Alik_Bjlk_SB_MT064x064x16_GRVW04_GSU01_SNLL1_TT04_04_VW04_WG16_16_01
    SolutionIndex: 65
    SolutionNameMin: Cijk_Alik_Bjlk_SB_MT064x128x16_GRVW04_GSU01_SNLL0_TT04_08_VW04_WG16_16_01
    SolutionIndex: 66
    SolutionNameMin: Cijk_Alik_Bjlk_SB_MT064x128x16_GRVW04_GSU01_SNLL1_TT04_08_VW04_WG16_16_01
    SolutionIndex: 67
    SolutionNameMin: Cijk_Alik_Bjlk_SB_MT096x128x16_GRVW02_GSU01_SNLL1_TT06_08_VW02_WG16_16_01
    SolutionIndex: 68
    SolutionNameMin: Cijk_Alik_Bjlk_SB_MT128x064x16_GRVW04_GSU01_SNLL0_TT08_04_VW04_WG16_16_01
    SolutionIndex: 69
    SolutionNameMin: Cijk_Alik_Bjlk_SB_MT128x064x16_GRVW04_GSU01_SNLL1_TT08_04_VW04_WG16_16_01
    SolutionIndex: 70
    SolutionNameMin: Cijk_Alik_Bjlk_SB_MT128x096x16_GRVW02_GSU01_SNLL1_TT08_06_VW02_WG16_16_01
    SolutionIndex: 71
    SolutionNameMin: Cijk_Alik_Bjlk_SB_MT128x128x16_GRVW04_GSU01_SNLL0_TT08_08_VW04_WG16_16_01
    SolutionIndex: 72
    SolutionNameMin: Cijk_Alik_Bjlk_SB_MT128x128x16_GRVW04_GSU01_SNLL1_TT08_08_VW04_WG16_16_01
    SolutionIndex: 73
    SolutionNameMin: Cijk_Alik_Bjlk_SB_MT064x064x16_GRVW04_GSU01_SNLL0_TT04_04_VW04_WG16_16_01
    SolutionIndex: 74
    SolutionNameMin: Cijk_Alik_Bjlk_SB_MT064x064x16_GRVW04_GSU01_SNLL1_TT04_04_VW04_WG16_16_01
    SolutionIndex: 75
    SolutionNameMin: Cijk_Alik_Bjlk_SB_MT064x128x16_GRVW04_GSU01_SNLL0_TT04_08_VW04_WG16_16_01
    SolutionIndex: 76
    SolutionNameMin: Cijk_Alik_Bjlk_SB_MT064x128x16_GRVW04_GSU01_SNLL1_TT04_08_VW04_WG16_16_01
    SolutionIndex: 77
    SolutionNameMin: Cijk_Alik_Bjlk_SB_MT096x128x16_GRVW02_GSU01_SNLL1_TT06_08_VW02_WG16_16_01
    SolutionIndex: 78
    SolutionNameMin: Cijk_Alik_Bjlk_SB_MT128x064x16_GRVW04_GSU01_SNLL0_TT08_04_VW04_WG16_16_01
    SolutionIndex: 79
    SolutionNameMin: Cijk_Alik_Bjlk_SB_MT128x064x16_GRVW04_GSU01_SNLL1_TT08_04_VW04_WG16_16_01
    SolutionIndex: 80
    SolutionNameMin: Cijk_Alik_Bjlk_SB_MT128x096x16_GRVW02_GSU01_SNLL1_TT08_06_VW02_WG16_16_01
    SolutionIndex: 81
    SolutionNameMin: Cijk_Alik_Bjlk_SB_MT128x128x16_GRVW04_GSU01_SNLL0_TT08_08_VW04_WG16_16_01
    SolutionIndex: 82
    SolutionNameMin: Cijk_Alik_Bjlk_SB_MT128x128x16_GRVW04_GSU01_SNLL1_TT08_08_VW04_WG16_16_01
    SolutionIndex: 83
    SolutionNameMin: Cijk_Alik_Bjlk_SB_MT128x128x24_GRVW04_GSU01_SNLL0_TT08_08_VW04_WG16_16_01
    SolutionIndex: 84
    SolutionNameMin: Cijk_Alik_Bjlk_SB_MT128x128x24_GRVW04_GSU01_SNLL0_TT08_08_VW04_WG16_16_01
    SolutionIndex: 85
    SolutionNameMin: Cijk_Alik_Bjlk_SB_MT064x064x32_GRVW04_GSU01_SNLL0_TT04_04_VW04_WG16_16_01
    SolutionIndex: 86
    SolutionNameMin: Cijk_Alik_Bjlk_SB_MT064x064x32_GRVW04_GSU01_SNLL1_TT04_04_VW04_WG16_16_01
    SolutionIndex: 87
    SolutionNameMin: Cijk_Alik_Bjlk_SB_MT064x128x32_GRVW04_GSU01_SNLL0_TT04_08_VW04_WG16_16_01
    SolutionIndex: 88
    SolutionNameMin: Cijk_Alik_Bjlk_SB_MT128x128x32_GRVW04_GSU01_SNLL0_TT08_08_VW04_WG16_16_01
    SolutionIndex: 89
    SolutionNameMin: Cijk_Alik_Bjlk_SB_MT064x064x32_GRVW04_GSU01_SNLL0_TT04_04_VW04_WG16_16_01
    SolutionIndex: 90
    SolutionNameMin: Cijk_Alik_Bjlk_SB_MT064x064x32_GRVW04_GSU01_SNLL1_TT04_04_VW04_WG16_16_01
    SolutionIndex: 91
    SolutionNameMin: Cijk_Alik_Bjlk_SB_MT064x128x32_GRVW04_GSU01_SNLL0_TT04_08_VW04_WG16_16_01
    SolutionIndex: 92
    SolutionNameMin: Cijk_Alik_Bjlk_SB_MT064x128x32_GRVW04_GSU01_SNLL1_TT04_08_VW04_WG16_16_01
    SolutionIndex: 93
    SolutionNameMin: Cijk_Alik_Bjlk_SB_MT128x064x32_GRVW04_GSU01_SNLL0_TT08_04_VW04_WG16_16_01
    SolutionIndex: 94
    SolutionNameMin: Cijk_Alik_Bjlk_SB_MT128x128x32_GRVW04_GSU01_SNLL0_TT08_08_VW04_WG16_16_01
    SolutionIndex: 95
    SolutionNameMin: Cijk_Alik_Bjlk_SB_MT016x016x04_GRVW02_GSU01_SNLL0_TT02_02_VW02_WG08_08_01
    SolutionIndex: 96
    SolutionNameMin: Cijk_Alik_Bjlk_SB_MT032x032x02_GRVW04_GSU01_SNLL0_TT04_04_VW04_WG08_08_01
    SolutionIndex: 97
    SolutionNameMin: Cijk_Alik_Bjlk_SB_MT008x008x08_GRVW02_GSU02_SNLL0_TT02_02_VW02_WG04_04_04
    SolutionIndex: 98
    SolutionNameMin: Cijk_Alik_Bjlk_SB_MT016x016x16_GRVW02_GSU02_SNLL0_TT02_02_VW02_WG08_08_04
    SolutionIndex: 99
    SolutionNameMin: Cijk_Alik_Bjlk_SB_MT008x008x08_GRVW02_GSU04_SNLL0_TT02_02_VW02_WG04_04_04
    SolutionIndex: 100
    SolutionNameMin: Cijk_Alik_Bjlk_SB_MT016x016x16_GRVW02_GSU04_SNLL0_TT02_02_VW02_WG08_08_04
    SolutionIndex: 101
    SolutionNameMin: Cijk_Alik_Bjlk_SB_MT016x016x04_GRVW02_GSU08_SNLL0_TT02_02_VW02_WG08_08_01
    SolutionIndex: 102
    SolutionNameMin: Cijk_Alik_Bjlk_SB_MT032x032x02_GRVW04_GSU08_SNLL0_TT04_04_VW04_WG08_08_01
    SolutionIndex: 103
    SolutionNameMin: Cijk_Alik_Bjlk_SB_MT008x008x08_GRVW02_GSU08_SNLL0_TT02_02_VW02_WG04_04_04
    SolutionIndex: 104
    SolutionNameMin: Cijk_Alik_Bjlk_SB_MT016x016x16_GRVW02_GSU08_SNLL0_TT02_02_VW02_WG08_08_04
    SolutionIndex: 105
    SolutionNameMin: Cijk_Alik_Bjlk_SB_MT008x008x08_GRVW02_GSU16_SNLL0_TT02_02_VW02_WG04_04_04
    SolutionIndex: 106
    SolutionNameMin: Cijk_Alik_Bjlk_SB_MT016x016x16_GRVW02_GSU16_SNLL0_TT02_02_VW02_WG08_08_04
    SolutionIndex: 107
    SolutionNameMin: Cijk_Alik_Bjlk_SB_MT64x128x8_MI32x32x1x2_SE_DTL0_NLCB1_TT1_32_TLDS1_WG64_4_1_WGM4
    SolutionIndex: 108
    SolutionNameMin: Cijk_Alik_Bjlk_SB_MT128x256x8_MI32x32x1x2_SE_DTL1_NLCB1_TT2_64_TLDS1_WG64_4_1_WGM8
    SolutionIndex: 109
    SolutionNameMin: Cijk_Alik_Bjlk_SB_MT64x256x8_MI32x32x1x2_SE_DTL1_NLCB1_TT1_64_TLDS1_WG64_4_1_WGM4
    SolutionIndex: 110
    SolutionNameMin: Cijk_Alik_Bjlk_SB_MT128x256x8_MI32x32x1x2_SE_DTL1_NLCB1_TT2_64_TLDS1_WG64_4_1_WGM16
    SolutionIndex: 111
    SolutionNameMin: Cijk_Alik_Bjlk_SB_MT128x256x8_MI32x32x1x2_SE_DTL1_NLCB1_TT4_32_TLDS0_WG16_16_1_WGM8
    SolutionIndex: 112
    SolutionNameMin: Cijk_Alik_Bjlk_SB_MT32x128x16_MI32x32x2x1_SE_DTL0_NLCB1_TT1_32_TLDS0_WG16_16_1_WGM8
    SolutionIndex: 113
    SolutionNameMin: Cijk_Alik_Bjlk_SB_MT32x128x8_MI32x32x2x1_SE_DTL0_NLCB1_TT1_32_TLDS0_WG16_16_1_WGM4
    SolutionIndex: 114
    SolutionNameMin: Cijk_Alik_Bjlk_SB_MT64x128x8_MI32x32x1x2_SE_DTL1_NLCB1_TT1_32_TLDS1_WG64_4_1_WGM4
    SolutionIndex: 115
    SolutionNameMin: Cijk_Alik_Bjlk_SB_MT64x256x8_MI32x32x1x2_SE_DTL1_NLCB1_TT1_64_TLDS1_WG64_4_1_WGM8
    SolutionIndex: 116
    SolutionNameMin: Cijk_Alik_Bjlk_SB_MT64x256x8_MI32x32x1x2_SE_DTL0_NLCB1_TT2_32_TLDS0_WG16_16_1_WGM8
    SolutionIndex: 117
    SolutionNameMin: Cijk_Alik_Bjlk_SB_MT128x256x8_MI32x32x1x2_SE_DTL1_NLCB1_TT4_32_TLDS0_WG16_16_1_WGM16
    SolutionIndex: 118
    SolutionNameMin: Cijk_Alik_Bjlk_SB_MT32x128x16_MI32x32x2x1_SE_DTL0_NLCB1_TT1_32_TLDS0_WG16_16_1_WGM16
    SolutionIndex: 119
    SolutionNameMin: Cijk_Alik_Bjlk_SB_MT64x128x8_MI32x32x1x2_SE_DTL0_NLCB1_TT1_32_TLDS0_WG64_4_1_WGM4
    SolutionIndex: 120
    SolutionNameMin: Cijk_Alik_Bjlk_SB_MT64x128x8_MI32x32x1x2_SE_DTL0_NLCB1_TT1_32_TLDS0_WG64_4_1_WGM8
    SolutionIndex: 121
    SolutionNameMin: Cijk_Alik_Bjlk_SB_MT128x128x8_MI32x32x1x2_SE_DTL0_NLCB1_TT2_32_TLDS0_WG64_4_1_WGM4
    SolutionIndex: 122
    SolutionNameMin: Cijk_Alik_Bjlk_SB_MT128x256x8_MI32x32x1x2_SE_DTL1_NLCB1_TT2_64_TLDS1_WG64_4_1_WGM4
    SolutionIndex: 123
    SolutionNameMin: Cijk_Alik_Bjlk_SB_MT64x256x8_MI32x32x1x2_SE_DTL1_NLCB1_TT1_64_TLDS0_WG64_4_1_WGM16
    SolutionIndex: 124
    SolutionNameMin: Cijk_Alik_Bjlk_SB_MT64x256x8_MI32x32x1x2_SE_DTL1_NLCB1_TT1_64_TLDS0_WG64_4_1_WGM8
    SolutionIndex: 125
    SolutionNameMin: Cijk_Alik_Bjlk_SB_MT64x256x8_MI32x32x1x2_SE_DTL1_NLCB1_TT2_32_TLDS0_WG16_16_1_WGM16
- - - [1024, 128, 1, 128]
    - [2, 0.0]
  - - [4, 704, 1, 1280]
    - [100, 0.0]
  - - [4, 1856, 1, 3328]
    - [105, 0.0]
  - - [1856, 448, 1, 3328]
    - [61, 0.0]
  - - [2944, 4288, 1, 1280]
    - [78, 0.0]
  - - [2368, 64, 1, 3328]
    - [36, 0.0]
  - - [2368, 5888, 1, 256]
    - [76, 0.0]
  - - [128, 64, 1, 256]
    - [50, 0.0]
  - - [5888, 1024, 1, 1280]
    - [61, 0.0]
  - - [128, 6784, 1, 3328]
    - [66, 0.0]
  - - [64, 4, 1, 256]
    - [100, 0.0]
  - - [5888, 1856, 1, 3328]
    - [68, 0.0]
  - - [5056, 704, 1, 256]
    - [64, 0.0]
  - - [5888, 2944, 1, 3328]
    - [84, 0.0]
  - - [1856, 4288, 1, 256]
    - [61, 0.0]
  - - [1024, 5056, 1, 128]
    - [60, 0.0]
  - - [5056, 5056, 1, 3328]
    - [62, 0.0]
  - - [1408, 5888, 1, 1280]
    - [84, 0.0]
  - - [2368, 448, 1, 128]
    - [4, 0.0]
  - - [1024, 3584, 1, 3328]
    - [82, 0.0]
  - - [4, 2944, 1, 1280]
    - [98, 0.0]
  - - [1408, 64, 1, 128]
    - [7, 0.0]
  - - [256, 4288, 1, 3328]
    - [74, 0.0]
  - - [5888, 1408, 1, 1280]
    - [83, 0.0]
  - - [704, 1856, 1, 3328]
    - [89, 0.0]
  - - [4, 1408, 1, 128]
    - [95, 0.0]
  - - [1024, 2368, 1, 256]
    - [74, 0.0]
  - - [1408, 1856, 1, 1280]
    - [61, 0.0]
  - - [1408, 64, 1, 1280]
    - [22, 0.0]
  - - [448, 1024, 1, 1280]
    - [74, 0.0]
  - - [256, 1408, 1, 3328]
    - [74, 0.0]
  - - [5056, 5056, 1, 1280]
    - [69, 0.0]
  - - [448, 5056, 1, 256]
    - [74, 0.0]
  - - [704, 1856, 1, 1280]
    - [64, 0.0]
  - - [128, 5056, 1, 128]
    - [12, 0.0]
  - - [2368, 128, 1, 256]
    - [73, 0.0]
  - - [1856, 1408, 1, 128]
    - [59, 0.0]
  - - [64, 5056, 1, 256]
    - [64, 0.0]
  - - [6784, 256, 1, 3328]
    - [63, 0.0]
  - - [6784, 4288, 1, 3328]
    - [75, 0.0]
  - - [4288, 448, 1, 256]
    - [74, 0.0]
  - - [64, 704, 1, 128]
    - [0, 0.0]
  - - [1856, 2368, 1, 3328]
    - [79, 0.0]
  - - [4288, 2944, 1, 1280]
    - [77, 0.0]
  - - [704, 5056, 1, 1280]
    - [80, 0.0]
  - - [2368, 704, 1, 3328]
    - [74, 0.0]
  - - [256, 5888, 1, 256]
    - [74, 0.0]
  - - [1856, 4288, 1, 3328]
    - [82, 0.0]
  - - [256, 2944, 1, 256]
    - [74, 0.0]
  - - [5888, 1024, 1, 256]
    - [82, 0.0]
  - - [448, 64, 1, 1280]
    - [43, 0.0]
  - - [448, 5056, 1, 3328]
    - [73, 0.0]
  - - [3584, 4, 1, 1280]
    - [100, 0.0]
  - - [2944, 64, 1, 256]
    - [74, 0.0]
  - - [128, 4, 1, 1280]
    - [104, 0.0]
  - - [1408, 2944, 1, 256]
    - [88, 0.0]
  - - [256, 1856, 1, 1280]
    - [64, 0.0]
  - - [6784, 5056, 1, 3328]
    - [65, 0.0]
  - - [5056, 5056, 1, 256]
    - [73, 0.0]
  - - [1408, 6784, 1, 128]
    - [13, 0.0]
  - - [64, 1024, 1, 1280]
    - [21, 0.0]
  - - [2944, 4, 1, 256]
    - [98, 0.0]
  - - [704, 5056, 1, 128]
    - [60, 0.0]
  - - [4, 2368, 1, 1280]
    - [98, 0.0]
  - - [2368, 2944, 1, 1280]
    - [61, 0.0]
  - - [128, 3584, 1, 1280]
    - [64, 0.0]
  - - [6784, 6784, 1, 1280]
    - [94, 0.0]
  - - [1024, 256, 1, 3328]
    - [64, 0.0]
  - - [1408, 4288, 1, 1280]
    - [65, 0.0]
  - - [3584, 4288, 1, 1280]
    - [69, 0.0]
  - - [2368, 704, 1, 1280]
    - [74, 0.0]
  - - [5056, 4288, 1, 3328]
    - [75, 0.0]
  - - [3584, 2368, 1, 3328]
    - [72, 0.0]
  - - [64, 704, 1, 1280]
    - [35, 0.0]
  - - [4288, 256, 1, 256]
    - [64, 0.0]
  - - [2944, 128, 1, 128]
    - [15, 0.0]
  - - [6784, 448, 1, 1280]
    - [74, 0.0]
  - - [1408, 2944, 1, 128]
    - [4, 0.0]
  - - [4288, 2944, 1, 256]
    - [91, 0.0]
  - - [5888, 704, 1, 1280]
    - [63, 0.0]
  - - [1856, 64, 1, 1280]
    - [27, 0.0]
  - - [448, 5888, 1, 128]
    - [13, 0.0]
  - - [5888, 64, 1, 3328]
    - [45, 0.0]
  - - [2944, 256, 1, 3328]
    - [64, 0.0]
  - - [1024, 64, 1, 128]
    - [15, 0.0]
  - - [5056, 2368, 1, 1280]
    - [74, 0.0]
  - - [448, 3584, 1, 1280]
    - [74, 0.0]
  - - [6784, 5888, 1, 256]
    - [72, 0.0]
  - - [64, 1024, 1, 3328]
    - [36, 0.0]
  - - [704, 128, 1, 1280]
    - [22, 0.0]
  - - [5888, 2944, 1, 128]
    - [4, 0.0]
  - - [4, 3584, 1, 128]
    - [95, 0.0]
  - - [1408, 448, 1, 1280]
    - [64, 0.0]
  - - [1024, 1408, 1, 256]
    - [74, 0.0]
  - - [2368, 2368, 1, 3328]
    - [76, 0.0]
  - - [1856, 6784, 1, 128]
    - [4, 0.0]
  - - [5056, 704, 1, 3328]
    - [62, 0.0]
  - - [1408, 1856, 1, 256]
    - [64, 0.0]
  - - [1408, 704, 1, 3328]
    - [74, 0.0]
  - - [2368, 5056, 1, 256]
    - [65, 0.0]
  - - [5888, 1856, 1, 256]
    - [82, 0.0]
  - - [4288, 64, 1, 3328]
    - [45, 0.0]
  - - [2368, 4, 1, 1280]
    - [104, 0.0]
  - - [704, 5888, 1, 256]
    - [91, 0.0]
  - - [4288, 64, 1, 256]
    - [64, 0.0]
  - - [6784, 64, 1, 256]
    - [74, 0.0]
  - - [2944, 256, 1, 256]
    - [64, 0.0]
  - - [2944, 6784, 1, 3328]
    - [65, 0.0]
  - - [704, 1408, 1, 3328]
    - [66, 0.0]
  - - [3584, 704, 1, 3328]
    - [74, 0.0]
  - - [2944, 256, 1, 128]
    - [4, 0.0]
  - - [6784, 4, 1, 1280]
    - [100, 0.0]
  - - [1024, 64, 1, 1280]
    - [47, 0.0]
  - - [448, 4288, 1, 256]
    - [90, 0.0]
  - - [64, 3584, 1, 3328]
    - [40, 0.0]
  - - [704, 2368, 1, 1280]
    - [82, 0.0]
  - - [448, 2944, 1, 128]
    - [59, 0.0]
  - - [1856, 2368, 1, 1280]
    - [79, 0.0]
  - - [2368, 128, 1, 3328]
    - [45, 0.0]
  - - [2944, 128, 1, 256]
    - [74, 0.0]
  - - [448, 1408, 1, 256]
    - [74, 0.0]
  - - [1856, 4288, 1, 1280]
    - [72, 0.0]
  - - [64, 5056, 1, 3328]
    - [28, 0.0]
  - - [4, 704, 1, 256]
    - [98, 0.0]
  - - [1024, 448, 1, 128]
    - [59, 0.0]
  - - [704, 4, 1, 1280]
    - [104, 0.0]
  - - [704, 256, 1, 128]
    - [4, 0.0]
  - - [704, 2944, 1, 128]
    - [59, 0.0]
  - - [1408, 1024, 1, 1280]
    - [76, 0.0]
  - - [704, 6784, 1, 256]
    - [88, 0.0]
  - - [6784, 704, 1, 256]
    - [74, 0.0]
  - - [5056, 1408, 1, 128]
    - [13, 0.0]
  - - [256, 3584, 1, 3328]
    - [64, 0.0]
  - - [4, 5888, 1, 3328]
    - [18, 0.0]
  - - [128, 1408, 1, 128]
    - [3, 0.0]
  - - [3584, 4288, 1, 3328]
    - [72, 0.0]
  - - [5888, 1856, 1, 1280]
    - [78, 0.0]
  - - [5056, 1024, 1, 3328]
    - [72, 0.0]
  - - [5056, 64, 1, 1280]
    - [45, 0.0]
  - - [1024, 704, 1, 256]
    - [64, 0.0]
  - - [1024, 4288, 1, 128]
    - [60, 0.0]
  - - [4288, 64, 1, 1280]
    - [27, 0.0]
  - - [2368, 3584, 1, 1280]
    - [73, 0.0]
  - - [2368, 6784, 1, 1280]
    - [74, 0.0]
  - - [1024, 256, 1, 256]
    - [89, 0.0]
  - - [1856, 4, 1, 1280]
    - [104, 0.0]
  - - [448, 448, 1, 256]
    - [64, 0.0]
  - - [2944, 3584, 1, 3328]
    - [68, 0.0]
  - - [128, 4288, 1, 128]
    - [6, 0.0]
  - - [64, 448, 1, 256]
    - [26, 0.0]
  - - [128, 1024, 1, 3328]
    - [48, 0.0]
  - - [4, 1408, 1, 3328]
    - [105, 0.0]
  - - [6784, 2944, 1, 256]
    - [75, 0.0]
  - - [64, 1856, 1, 1280]
    - [27, 0.0]
  - - [64, 1024, 1, 128]
    - [5, 0.0]
  - - [4288, 2368, 1, 3328]
    - [68, 0.0]
  - - [1856, 2368, 1, 256]
    - [74, 0.0]
  - - [3584, 256, 1, 128]
    - [13, 0.0]
  - - [3584, 6784, 1, 3328]
    - [62, 0.0]
  - - [256, 1024, 1, 256]
    - [64, 0.0]
  - - [4, 6784, 1, 3328]
    - [18, 0.0]
  - - [1024, 5888, 1, 3328]
    - [72, 0.0]
  - - [1024, 128, 1, 1280]
    - [48, 0.0]
  - - [4288, 128, 1, 1280]
    - [27, 0.0]
  - - [5056, 4288, 1, 1280]
    - [62, 0.0]
  - - [5888, 64, 1, 256]
    - [74, 0.0]
  - - [1408, 5056, 1, 1280]
    - [77, 0.0]
  - - [1856, 256, 1, 1280]
    - [74, 0.0]
  - - [64, 5888, 1, 3328]
    - [45, 0.0]
  - - [2944, 5888, 1, 128]
    - [4, 0.0]
  - - [704, 5888, 1, 1280]
    - [76, 0.0]
  - - [2368, 3584, 1, 128]
    - [59, 0.0]
  - - [6784, 5888, 1, 3328]
    - [61, 0.0]
  - - [704, 1024, 1, 1280]
    - [74, 0.0]
  - - [448, 256, 1, 3328]
    - [27, 0.0]
  - - [448, 1856, 1, 128]
    - [59, 0.0]
  - - [128, 1024, 1, 128]
    - [7, 0.0]
  - - [2944, 4, 1, 128]
    - [96, 0.0]
  - - [1024, 704, 1, 1280]
    - [74, 0.0]
  - - [128, 5888, 1, 256]
    - [64, 0.0]
  - - [1024, 5056, 1, 1280]
    - [94, 0.0]
  - - [4288, 1024, 1, 256]
    - [61, 0.0]
  - - [2944, 2368, 1, 128]
    - [13, 0.0]
  - - [704, 704, 1, 3328]
    - [74, 0.0]
  - - [704, 1408, 1, 1280]
    - [66, 0.0]
  - - [5888, 448, 1, 1280]
    - [64, 0.0]
  - - [3584, 256, 1, 3328]
    - [66, 0.0]
  - - [704, 5888, 1, 3328]
    - [66, 0.0]
  - - [704, 1856, 1, 128]
    - [4, 0.0]
  - - [128, 3584, 1, 3328]
    - [64, 0.0]
  - - [4, 4288, 1, 128]
    - [95, 0.0]
  - - [128, 704, 1, 1280]
    - [27, 0.0]
  - - [3584, 2944, 1, 256]
    - [82, 0.0]
  - - [1856, 128, 1, 3328]
    - [23, 0.0]
  - - [4, 64, 1, 1280]
    - [104, 0.0]
  - - [4, 5056, 1, 3328]
    - [102, 0.0]
  - - [128, 2944, 1, 1280]
    - [74, 0.0]
  - - [2368, 1024, 1, 3328]
    - [73, 0.0]
  - - [128, 256, 1, 3328]
    - [57, 0.0]
  - - [1408, 5056, 1, 3328]
    - [76, 0.0]
  - - [1856, 1856, 1, 3328]
    - [66, 0.0]
  - - [3584, 128, 1, 256]
    - [74, 0.0]
  - - [448, 1408, 1, 3328]
    - [74, 0.0]
  - - [2368, 2368, 1, 256]
    - [78, 0.0]
  - - [4288, 4288, 1, 1280]
    - [74, 0.0]
  - - [64, 448, 1, 1280]
    - [46, 0.0]
  - - [1408, 4288, 1, 256]
    - [75, 0.0]
  - - [448, 4, 1, 256]
    - [103, 0.0]
  - - [5888, 448, 1, 128]
    - [59, 0.0]
  - - [448, 4, 1, 1280]
    - [106, 0.0]
  - - [704, 6784, 1, 3328]
    - [62, 0.0]
  - - [5888, 5888, 1, 1280]
    - [75, 0.0]
  - - [5056, 1024, 1, 1280]
    - [75, 0.0]
  - - [448, 5888, 1, 3328]
    - [64, 0.0]
  - - [128, 4, 1, 128]
    - [95, 0.0]
  - - [1024, 2944, 1, 1280]
    - [72, 0.0]
  - - [5056, 5888, 1, 1280]
    - [82, 0.0]
  - - [4288, 5888, 1, 128]
    - [4, 0.0]
  - - [256, 3584, 1, 256]
    - [74, 0.0]
  - - [1408, 3584, 1, 128]
    - [4, 0.0]
  - - [256, 2944, 1, 3328]
    - [86, 0.0]
  - - [448, 3584, 1, 128]
    - [59, 0.0]
  - - [5888, 2944, 1, 1280]
    - [65, 0.0]
  - - [4, 6784, 1, 1280]
    - [18, 0.0]
  - - [2368, 5888, 1, 128]
    - [59, 0.0]
  - - [64, 2944, 1, 128]
    - [1, 0.0]
  - - [3584, 5888, 1, 256]
    - [68, 0.0]
  - - [2368, 704, 1, 128]
    - [4, 0.0]
  - - [3584, 2944, 1, 1280]
    - [74, 0.0]
  - - [3584, 2368, 1, 128]
    - [4, 0.0]
  - - [5056, 704, 1, 128]
    - [4, 0.0]
  - - [448, 2368, 1, 128]
    - [59, 0.0]
  - - [5056, 1408, 1, 3328]
    - [61, 0.0]
  - - [1408, 704, 1, 256]
    - [64, 0.0]
  - - [6784, 1024, 1, 3328]
    - [75, 0.0]
  - - [6784, 2944, 1, 3328]
    - [61, 0.0]
  - - [2944, 5056, 1, 3328]
    - [61, 0.0]
  - - [1856, 1856, 1, 256]
    - [94, 0.0]
  - - [1024, 5888, 1, 128]
    - [13, 0.0]
  - - [6784, 2368, 1, 1280]
    - [75, 0.0]
  - - [256, 4, 1, 128]
    - [95, 0.0]
  - - [4288, 5888, 1, 1280]
    - [78, 0.0]
  - - [4288, 4288, 1, 256]
    - [78, 0.0]
  - - [448, 2944, 1, 3328]
    - [79, 0.0]
  - - [4288, 1856, 1, 1280]
    - [65, 0.0]
  - - [1856, 2944, 1, 3328]
    - [74, 0.0]
  - - [256, 6784, 1, 3328]
    - [74, 0.0]
  - - [64, 5888, 1, 256]
    - [63, 0.0]
  - - [256, 5056, 1, 128]
    - [13, 0.0]
  - - [5056, 1024, 1, 256]
    - [62, 0.0]
  - - [704, 64, 1, 3328]
    - [33, 0.0]
  - - [5056, 1856, 1, 3328]
    - [62, 0.0]
  - - [4, 2944, 1, 3328]
    - [19, 0.0]
  - - [4, 5056, 1, 256]
    - [17, 0.0]
  - - [1856, 1408, 1, 256]
    - [64, 0.0]
  - - [3584, 4, 1, 128]
    - [95, 0.0]
  - - [448, 448, 1, 3328]
    - [41, 0.0]
  - - [6784, 128, 1, 3328]
    - [82, 0.0]
  - - [4288, 1408, 1, 128]
    - [4, 0.0]
  - - [4288, 5056, 1, 256]
    - [82, 0.0]
  - - [1408, 128, 1, 1280]
    - [23, 0.0]
  - - [5056, 256, 1, 3328]
    - [63, 0.0]
  - - [704, 704, 1, 256]
    - [64, 0.0]
  - - [1024, 5888, 1, 1280]
    - [76, 0.0]
  - - [6784, 2368, 1, 128]
    - [4, 0.0]
  - - [4, 5056, 1, 1280]
    - [17, 0.0]
  - - [64, 128, 1, 256]
    - [31, 0.0]
  - - [128, 1856, 1, 1280]
    - [27, 0.0]
  - - [5056, 3584, 1, 256]
    - [65, 0.0]
  - - [1856, 1024, 1, 1280]
    - [72, 0.0]
  - - [6784, 4288, 1, 1280]
    - [61, 0.0]
  - - [1856, 1856, 1, 1280]
    - [76, 0.0]
  - - [6784, 2944, 1, 128]
    - [4, 0.0]
  - - [128, 4288, 1, 3328]
    - [49, 0.0]
  - - [4, 2368, 1, 3328]
    - [18, 0.0]
  - - [5888, 1856, 1, 128]
    - [13, 0.0]
  - - [448, 704, 1, 1280]
    - [64, 0.0]
  - - [2368, 1024, 1, 128]
    - [59, 0.0]
  - - [1024, 448, 1, 3328]
    - [76, 0.0]
  - - [1856, 704, 1, 1280]
    - [64, 0.0]
  - - [5056, 3584, 1, 128]
    - [13, 0.0]
  - - [5888, 5888, 1, 3328]
    - [72, 0.0]
  - - [6784, 1024, 1, 256]
    - [65, 0.0]
  - - [2944, 2368, 1, 256]
    - [82, 0.0]
  - - [256, 448, 1, 256]
    - [29, 0.0]
  - - [5056, 5888, 1, 3328]
    - [62, 0.0]
  - - [1856, 1024, 1, 256]
    - [74, 0.0]
  - - [448, 1408, 1, 1280]
    - [64, 0.0]
  - - [3584, 448, 1, 1280]
    - [74, 0.0]
  - - [1024, 1024, 1, 1280]
    - [76, 0.0]
  - - [448, 5888, 1, 256]
    - [89, 0.0]
  - - [704, 64, 1, 128]
    - [16, 0.0]
  - - [1408, 6784, 1, 3328]
    - [76, 0.0]
  - - [448, 1024, 1, 128]
    - [60, 0.0]
  - - [4288, 704, 1, 128]
    - [4, 0.0]
  - - [128, 1856, 1, 128]
    - [5, 0.0]
  - - [448, 2368, 1, 3328]
    - [64, 0.0]
  - - [5056, 64, 1, 128]
    - [8, 0.0]
  - - [5056, 2944, 1, 256]
    - [94, 0.0]
  - - [6784, 5888, 1, 128]
    - [13, 0.0]
  - - [704, 1024, 1, 256]
    - [64, 0.0]
  - - [1024, 4, 1, 256]
    - [99, 0.0]
  - - [2368, 1856, 1, 256]
    - [89, 0.0]
  - - [128, 6784, 1, 1280]
    - [76, 0.0]
  - - [1408, 3584, 1, 3328]
    - [76, 0.0]
  - - [2368, 6784, 1, 256]
    - [89, 0.0]
  - - [5056, 1408, 1, 1280]
    - [78, 0.0]
  - - [256, 256, 1, 128]
    - [11, 0.0]
  - - [5056, 4288, 1, 128]
    - [13, 0.0]
  - - [1408, 1856, 1, 128]
    - [13, 0.0]
  - - [1408, 5888, 1, 3328]
    - [76, 0.0]
  - - [1856, 256, 1, 256]
    - [64, 0.0]
  - - [6784, 6784, 1, 256]
    - [66, 0.0]
  - - [64, 256, 1, 128]
    - [7, 0.0]
  - - [4288, 2368, 1, 128]
    - [13, 0.0]
  - - [1856, 4288, 1, 128]
    - [4, 0.0]
  - - [256, 4288, 1, 1280]
    - [64, 0.0]
  - - [2368, 2944, 1, 256]
    - [89, 0.0]
  - - [4, 1856, 1, 256]
    - [99, 0.0]
  - - [3584, 1856, 1, 1280]
    - [62, 0.0]
  - - [6784, 6784, 1, 128]
    - [60, 0.0]
  - - [256, 1856, 1, 128]
    - [4, 0.0]
  - - [704, 64, 1, 1280]
    - [21, 0.0]
  - - [5888, 5056, 1, 256]
    - [75, 0.0]
  - - [3584, 448, 1, 256]
    - [64, 0.0]
  - - [448, 4288, 1, 128]
    - [59, 0.0]
  - - [2944, 4288, 1, 3328]
    - [78, 0.0]
  - - [256, 6784, 1, 256]
    - [74, 0.0]
  - - [1408, 4288, 1, 128]
    - [4, 0.0]
  - - [2944, 704, 1, 3328]
    - [77, 0.0]
  - - [128, 448, 1, 256]
    - [29, 0.0]
  - - [3584, 3584, 1, 256]
    - [82, 0.0]
  - - [448, 1408, 1, 128]
    - [4, 0.0]
  - - [128, 256, 1, 1280]
    - [43, 0.0]
  - - [3584, 5056, 1, 256]
    - [82, 0.0]
  - - [6784, 128, 1, 256]
    - [64, 0.0]
  - - [4288, 4, 1, 256]
    - [98, 0.0]
  - - [64, 1408, 1, 3328]
    - [33, 0.0]
  - - [704, 448, 1, 256]
    - [73, 0.0]
  - - [2944, 2368, 1, 1280]
    - [80, 0.0]
  - - [448, 64, 1, 3328]
    - [51, 0.0]
  - - [1408, 3584, 1, 256]
    - [62, 0.0]
  - - [3584, 4, 1, 3328]
    - [98, 0.0]
  - - [6784, 3584, 1, 256]
    - [82, 0.0]
  - - [256, 128, 1, 128]
    - [5, 0.0]
  - - [704, 1408, 1, 128]
    - [59, 0.0]
  - - [4, 2368, 1, 256]
    - [99, 0.0]
  - - [2944, 448, 1, 128]
    - [60, 0.0]
  - - [128, 1408, 1, 256]
    - [64, 0.0]
  - - [4, 2944, 1, 256]
    - [97, 0.0]
  - - [64, 128, 1, 3328]
    - [38, 0.0]
  - - [5056, 2368, 1, 128]
    - [4, 0.0]
  - - [2944, 2944, 1, 3328]
    - [61, 0.0]
  - - [5056, 6784, 1, 256]
    - [72, 0.0]
  - - [1856, 3584, 1, 128]
    - [4, 0.0]
  - - [128, 2944, 1, 128]
    - [3, 0.0]
  - - [1024, 704, 1, 3328]
    - [74, 0.0]
  - - [6784, 448, 1, 256]
    - [89, 0.0]
  - - [3584, 6784, 1, 128]
    - [60, 0.0]
  - - [128, 4288, 1, 256]
    - [74, 0.0]
  - - [704, 448, 1, 3328]
    - [64, 0.0]
  - - [1024, 1024, 1, 3328]
    - [82, 0.0]
  - - [128, 128, 1, 3328]
    - [39, 0.0]
  - - [5056, 1856, 1, 256]
    - [74, 0.0]
  - - [256, 128, 1, 256]
    - [42, 0.0]
  - - [1024, 1856, 1, 256]
    - [74, 0.0]
  - - [4288, 64, 1, 128]
    - [1, 0.0]
  - - [256, 448, 1, 3328]
    - [27, 0.0]
  - - [1408, 6784, 1, 1280]
    - [82, 0.0]
  - - [3584, 3584, 1, 1280]
    - [75, 0.0]
  - - [64, 2368, 1, 1280]
    - [27, 0.0]
  - - [448, 2368, 1, 1280]
    - [64, 0.0]
  - - [5888, 5888, 1, 128]
    - [13, 0.0]
  - - [64, 6784, 1, 3328]
    - [74, 0.0]
  - - [2944, 256, 1, 1280]
    - [90, 0.0]
  - - [5056, 5888, 1, 128]
    - [60, 0.0]
  - - [256, 2368, 1, 128]
    - [59, 0.0]
  - - [5056, 2368, 1, 3328]
    - [82, 0.0]
  - - [2944, 4288, 1, 256]
    - [61, 0.0]
  - - [1408, 3584, 1, 1280]
    - [76, 0.0]
  - - [2368, 64, 1, 256]
    - [74, 0.0]
  - - [64, 448, 1, 3328]
    - [57, 0.0]
  - - [256, 256, 1, 3328]
    - [45, 0.0]
  - - [5888, 4, 1, 128]
    - [95, 0.0]
  - - [1856, 704, 1, 256]
    - [73, 0.0]
  - - [4, 4288, 1, 1280]
    - [17, 0.0]
  - - [1408, 448, 1, 3328]
    - [90, 0.0]
  - - [1024, 4, 1, 3328]
    - [104, 0.0]
  - - [2368, 256, 1, 256]
    - [64, 0.0]
  - - [2368, 6784, 1, 3328]
    - [61, 0.0]
  - - [1856, 1408, 1, 1280]
    - [65, 0.0]
  - - [1856, 448, 1, 1280]
    - [64, 0.0]
  - - [6784, 704, 1, 128]
    - [13, 0.0]
  - - [4, 4, 1, 256]
    - [100, 0.0]
  - - [128, 5888, 1, 128]
    - [6, 0.0]
  - - [1408, 5888, 1, 256]
    - [93, 0.0]
  - - [704, 2944, 1, 1280]
    - [64, 0.0]
  - - [1856, 2368, 1, 128]
    - [13, 0.0]
  - - [256, 64, 1, 256]
    - [42, 0.0]
  - - [1024, 1024, 1, 256]
    - [76, 0.0]
  - - [704, 1856, 1, 256]
    - [63, 0.0]
  - - [64, 6784, 1, 256]
    - [86, 0.0]
  - - [3584, 704, 1, 1280]
    - [74, 0.0]
  - - [256, 128, 1, 1280]
    - [46, 0.0]
  - - [2368, 4, 1, 256]
    - [99, 0.0]
  - - [256, 2368, 1, 1280]
    - [64, 0.0]
  - - [2944, 6784, 1, 128]
    - [59, 0.0]
  - - [3584, 448, 1, 3328]
    - [62, 0.0]
  - - [1408, 4, 1, 256]
    - [99, 0.0]
  - - [704, 2368, 1, 3328]
    - [64, 0.0]
  - - [2944, 448, 1, 256]
    - [63, 0.0]
  - - [1856, 448, 1, 128]
    - [59, 0.0]
  - - [2368, 128, 1, 1280]
    - [22, 0.0]
  - - [256, 5888, 1, 128]
    - [13, 0.0]
  - - [2368, 256, 1, 128]
    - [4, 0.0]
  - - [64, 5056, 1, 1280]
    - [28, 0.0]
  - - [4, 6784, 1, 128]
    - [95, 0.0]
  - - [2944, 2944, 1, 1280]
    - [72, 0.0]
  - - [5888, 2368, 1, 256]
    - [61, 0.0]
  - - [4, 3584, 1, 1280]
    - [101, 0.0]
  - - [1408, 128, 1, 128]
    - [6, 0.0]
  - - [6784, 704, 1, 3328]
    - [83, 0.0]
  - - [128, 64, 1, 1280]
    - [50, 0.0]
  - - [2368, 256, 1, 1280]
    - [64, 0.0]
  - - [4, 448, 1, 3328]
    - [106, 0.0]
  - - [5888, 4288, 1, 128]
    - [59, 0.0]
  - - [4, 5888, 1, 256]
    - [98, 0.0]
  - - [1408, 2944, 1, 3328]
    - [61, 0.0]
  - - [3584, 704, 1, 128]
    - [13, 0.0]
  - - [64, 1024, 1, 256]
    - [44, 0.0]
  - - [5056, 5056, 1, 128]
    - [13, 0.0]
  - - [2368, 448, 1, 1280]
    - [74, 0.0]
  - - [128, 3584, 1, 256]
    - [74, 0.0]
  - - [704, 448, 1, 1280]
    - [86, 0.0]
  - - [448, 5056, 1, 128]
    - [60, 0.0]
  - - [256, 4, 1, 1280]
    - [104, 0.0]
  - - [128, 5056, 1, 256]
    - [64, 0.0]
  - - [1408, 5056, 1, 128]
    - [13, 0.0]
  - - [2944, 3584, 1, 128]
    - [4, 0.0]
  - - [3584, 2368, 1, 256]
    - [75, 0.0]
  - - [5888, 5056, 1, 1280]
    - [82, 0.0]
  - - [2368, 5056, 1, 128]
    - [13, 0.0]
  - - [64, 704, 1, 256]
    - [20, 0.0]
  - - [4288, 256, 1, 1280]
    - [74, 0.0]
  - - [3584, 3584, 1, 3328]
    - [82, 0.0]
  - - [1024, 256, 1, 128]
    - [13, 0.0]
  - - [4, 704, 1, 128]
    - [95, 0.0]
  - - [5888, 6784, 1, 256]
    - [62, 0.0]
  - - [4288, 2944, 1, 3328]
    - [69, 0.0]
  - - [2944, 64, 1, 128]
    - [3, 0.0]
  - - [1856, 64, 1, 256]
    - [44, 0.0]
  - - [4288, 128, 1, 3328]
    - [34, 0.0]
  - - [4288, 704, 1, 1280]
    - [74, 0.0]
  - - [256, 5056, 1, 1280]
    - [74, 0.0]
  - - [1408, 256, 1, 128]
    - [59, 0.0]
  - - [2944, 5888, 1, 3328]
    - [71, 0.0]
  - - [6784, 5888, 1, 1280]
    - [82, 0.0]
  - - [704, 128, 1, 256]
    - [25, 0.0]
  - - [5888, 4288, 1, 1280]
    - [72, 0.0]
  - - [448, 256, 1, 1280]
    - [22, 0.0]
  - - [5888, 3584, 1, 128]
    - [13, 0.0]
  - - [1856, 1856, 1, 128]
    - [13, 0.0]
  - - [5056, 4, 1, 1280]
    - [104, 0.0]
  - - [256, 1408, 1, 1280]
    - [74, 0.0]
  - - [3584, 1024, 1, 3328]
    - [67, 0.0]
  - - [704, 3584, 1, 128]
    - [4, 0.0]
  - - [5888, 448, 1, 3328]
    - [61, 0.0]
  - - [2368, 4288, 1, 1280]
    - [79, 0.0]
  - - [4288, 2944, 1, 128]
    - [60, 0.0]
  - - [1024, 6784, 1, 3328]
    - [72, 0.0]
  - - [128, 2368, 1, 256]
    - [64, 0.0]
  - - [6784, 64, 1, 3328]
    - [37, 0.0]
  - - [5056, 2944, 1, 3328]
    - [68, 0.0]
  - - [448, 128, 1, 256]
    - [20, 0.0]
  - - [2944, 3584, 1, 256]
    - [65, 0.0]
  - - [1408, 1408, 1, 3328]
    - [79, 0.0]
  - - [1856, 128, 1, 1280]
    - [28, 0.0]
  - - [3584, 3584, 1, 128]
    - [4, 0.0]
  - - [64, 3584, 1, 256]
    - [64, 0.0]
  - - [1408, 4, 1, 3328]
    - [104, 0.0]
  - - [128, 2944, 1, 3328]
    - [49, 0.0]
  - - [3584, 704, 1, 256]
    - [69, 0.0]
  - - [2944, 448, 1, 3328]
    - [76, 0.0]
  - - [3584, 1408, 1, 3328]
    - [84, 0.0]
  - - [704, 3584, 1, 1280]
    - [76, 0.0]
  - - [2944, 6784, 1, 1280]
    - [62, 0.0]
  - - [1856, 6784, 1, 256]
    - [82, 0.0]
  - - [4288, 448, 1, 3328]
    - [89, 0.0]
  - - [6784, 4288, 1, 128]
    - [60, 0.0]
  - - [6784, 704, 1, 1280]
    - [82, 0.0]
  - - [256, 4288, 1, 256]
    - [73, 0.0]
  - - [3584, 64, 1, 128]
    - [7, 0.0]
  - - [5888, 1024, 1, 3328]
    - [82, 0.0]
  - - [448, 64, 1, 128]
    - [16, 0.0]
  - - [704, 6784, 1, 1280]
    - [62, 0.0]
  - - [5888, 128, 1, 256]
    - [64, 0.0]
  - - [2368, 448, 1, 3328]
    - [86, 0.0]
  - - [1856, 5056, 1, 3328]
    - [63, 0.0]
  - - [4, 6784, 1, 256]
    - [17, 0.0]
  - - [1024, 3584, 1, 128]
    - [60, 0.0]
  - - [1024, 1408, 1, 128]
    - [13, 0.0]
  - - [2368, 2944, 1, 128]
    - [4, 0.0]
  - - [5056, 64, 1, 256]
    - [24, 0.0]
  - - [4, 448, 1, 1280]
    - [100, 0.0]
  - - [5056, 2944, 1, 128]
    - [13, 0.0]
  - - [5888, 5056, 1, 3328]
    - [62, 0.0]
  - - [1024, 704, 1, 128]
    - [13, 0.0]
  - - [1408, 2368, 1, 128]
    - [4, 0.0]
  - - [5888, 2368, 1, 128]
    - [59, 0.0]
  - - [128, 5056, 1, 3328]
    - [64, 0.0]
  - - [3584, 6784, 1, 1280]
    - [61, 0.0]
  - - [1856, 5888, 1, 256]
    - [65, 0.0]
  - - [256, 256, 1, 256]
    - [44, 0.0]
  - - [256, 64, 1, 128]
    - [6, 0.0]
  - - [4288, 4288, 1, 3328]
    - [65, 0.0]
  - - [4288, 1408, 1, 1280]
    - [61, 0.0]
  - - [3584, 5056, 1, 128]
    - [60, 0.0]
  - - [4, 1024, 1, 3328]
    - [19, 0.0]
  - - [4288, 2368, 1, 256]
    - [65, 0.0]
  - - [2944, 5056, 1, 1280]
    - [62, 0.0]
  - - [448, 6784, 1, 256]
    - [74, 0.0]
  - - [704, 1024, 1, 128]
    - [59, 0.0]
  - - [6784, 2368, 1, 3328]
    - [61, 0.0]
  - - [256, 1024, 1, 1280]
    - [64, 0.0]
  - - [704, 4, 1, 128]
    - [95, 0.0]
  - - [256, 4, 1, 256]
    - [100, 0.0]
  - - [4288, 128, 1, 256]
    - [74, 0.0]
  - - [4288, 1856, 1, 3328]
    - [72, 0.0]
  - - [3584, 448, 1, 128]
    - [13, 0.0]
  - - [256, 4, 1, 3328]
    - [104, 0.0]
  - - [4, 1408, 1, 1280]
    - [19, 0.0]
  - - [3584, 64, 1, 1280]
    - [22, 0.0]
  - - [1408, 448, 1, 128]
    - [59, 0.0]
  - - [3584, 1024, 1, 1280]
    - [73, 0.0]
  - - [1856, 5056, 1, 256]
    - [74, 0.0]
  - - [4, 3584, 1, 256]
    - [17, 0.0]
  - - [1024, 4288, 1, 256]
    - [73, 0.0]
  - - [5888, 3584, 1, 3328]
    - [72, 0.0]
  - - [4, 256, 1, 256]
    - [100, 0.0]
  - - [5056, 3584, 1, 3328]
    - [76, 0.0]
  - - [128, 5888, 1, 1280]
    - [74, 0.0]
  - - [704, 448, 1, 128]
    - [4, 0.0]
  - - [2368, 1408, 1, 1280]
    - [63, 0.0]
  - - [5056, 2944, 1, 1280]
    - [61, 0.0]
  - - [4, 4, 1, 128]
    - [96, 0.0]
  - - [3584, 256, 1, 256]
    - [74, 0.0]
  - - [128, 1856, 1, 3328]
    - [27, 0.0]
  - - [1024, 6784, 1, 256]
    - [94, 0.0]
  - - [4, 128, 1, 256]
    - [19, 0.0]
  - - [64, 64, 1, 1280]
    - [50, 0.0]
  - - [6784, 4, 1, 128]
    - [95, 0.0]
  - - [2944, 1408, 1, 128]
    - [4, 0.0]
  - - [448, 128, 1, 3328]
    - [33, 0.0]
  - - [64, 2944, 1, 3328]
    - [22, 0.0]
  - - [64, 4288, 1, 3328]
    - [27, 0.0]
  - - [5056, 6784, 1, 3328]
    - [82, 0.0]
  - - [128, 2944, 1, 256]
    - [74, 0.0]
  - - [128, 6784, 1, 128]
    - [7, 0.0]
  - - [3584, 4288, 1, 256]
    - [82, 0.0]
  - - [448, 1856, 1, 256]
    - [64, 0.0]
  - - [1856, 6784, 1, 3328]
    - [65, 0.0]
  - - [3584, 128, 1, 3328]
    - [74, 0.0]
  - - [64, 1856, 1, 256]
    - [25, 0.0]
  - - [1024, 448, 1, 1280]
    - [74, 0.0]
  - - [5888, 4288, 1, 256]
    - [75, 0.0]
  - - [4, 448, 1, 128]
    - [95, 0.0]
  - - [5056, 1408, 1, 256]
    - [72, 0.0]
  - - [64, 256, 1, 1280]
    - [42, 0.0]
  - - [3584, 1024, 1, 256]
    - [61, 0.0]
  - - [256, 704, 1, 256]
    - [74, 0.0]
  - - [5888, 5888, 1, 256]
    - [75, 0.0]
  - - [4288, 1024, 1, 1280]
    - [75, 0.0]
  - - [5888, 128, 1, 3328]
    - [67, 0.0]
  - - [448, 6784, 1, 3328]
    - [66, 0.0]
  - - [2944, 1408, 1, 1280]
    - [61, 0.0]
  - - [2944, 1856, 1, 3328]
    - [75, 0.0]
  - - [2368, 64, 1, 128]
    - [7, 0.0]
  - - [2944, 2944, 1, 128]
    - [13, 0.0]
  - - [4, 128, 1, 3328]
    - [106, 0.0]
  - - [3584, 5888, 1, 1280]
    - [62, 0.0]
  - - [64, 4, 1, 128]
    - [95, 0.0]
  - - [6784, 1856, 1, 1280]
    - [82, 0.0]
  - - [2944, 5056, 1, 256]
    - [68, 0.0]
  - - [5888, 256, 1, 3328]
    - [74, 0.0]
  - - [1856, 5888, 1, 3328]
    - [72, 0.0]
  - - [3584, 1408, 1, 256]
    - [72, 0.0]
  - - [704, 3584, 1, 3328]
    - [72, 0.0]
  - - [5056, 448, 1, 1280]
    - [73, 0.0]
  - - [3584, 1856, 1, 3328]
    - [67, 0.0]
  - - [64, 1408, 1, 128]
    - [7, 0.0]
  - - [1408, 704, 1, 1280]
    - [79, 0.0]
  - - [2944, 1024, 1, 256]
    - [76, 0.0]
  - - [1024, 2368, 1, 128]
    - [13, 0.0]
  - - [2368, 4288, 1, 3328]
    - [74, 0.0]
  - - [4, 1408, 1, 256]
    - [98, 0.0]
  - - [1024, 1408, 1, 1280]
    - [80, 0.0]
  - - [64, 64, 1, 256]
    - [52, 0.0]
  - - [704, 256, 1, 3328]
    - [64, 0.0]
  - - [6784, 5056, 1, 256]
    - [65, 0.0]
  - - [4, 4288, 1, 3328]
    - [19, 0.0]
  - - [448, 6784, 1, 128]
    - [4, 0.0]
  - - [4, 704, 1, 3328]
    - [105, 0.0]
  - - [448, 2944, 1, 256]
    - [64, 0.0]
  - - [2944, 6784, 1, 256]
    - [75, 0.0]
  - - [2368, 2368, 1, 1280]
    - [62, 0.0]
  - - [4, 4, 1, 1280]
    - [104, 0.0]
  - - [1856, 3584, 1, 1280]
    - [65, 0.0]
  - - [64, 2944, 1, 256]
    - [74, 0.0]
  - - [3584, 1408, 1, 1280]
    - [81, 0.0]
  - - [448, 256, 1, 128]
    - [12, 0.0]
  - - [4288, 448, 1, 128]
    - [4, 0.0]
  - - [5056, 256, 1, 1280]
    - [73, 0.0]
  - - [1856, 1408, 1, 3328]
    - [64, 0.0]
  - - [128, 128, 1, 128]
    - [6, 0.0]
  - - [1024, 4288, 1, 3328]
    - [69, 0.0]
  - - [448, 2368, 1, 256]
    - [64, 0.0]
  - - [1024, 4, 1, 128]
    - [96, 0.0]
  - - [5056, 448, 1, 256]
    - [64, 0.0]
  - - [2944, 2368, 1, 3328]
    - [70, 0.0]
  - - [704, 128, 1, 3328]
    - [36, 0.0]
  - - [64, 64, 1, 3328]
    - [58, 0.0]
  - - [1024, 1856, 1, 1280]
    - [72, 0.0]
  - - [6784, 1856, 1, 256]
    - [88, 0.0]
  - - [128, 2368, 1, 3328]
    - [49, 0.0]
  - - [1024, 5888, 1, 256]
    - [62, 0.0]
  - - [5056, 128, 1, 1280]
    - [90, 0.0]
  - - [5056, 64, 1, 3328]
    - [54, 0.0]
  - - [128, 704, 1, 128]
    - [0, 0.0]
  - - [1408, 2368, 1, 256]
    - [94, 0.0]
  - - [1408, 1408, 1, 256]
    - [82, 0.0]
  - - [4, 64, 1, 128]
    - [95, 0.0]
  - - [64, 128, 1, 1280]
    - [55, 0.0]
  - - [2368, 2368, 1, 128]
    - [4, 0.0]
  - - [64, 5888, 1, 128]
    - [8, 0.0]
  - - [5888, 4, 1, 3328]
    - [100, 0.0]
  - - [6784, 1408, 1, 128]
    - [4, 0.0]
  - - [4288, 5888, 1, 256]
    - [75, 0.0]
  - - [1408, 5056, 1, 256]
    - [82, 0.0]
  - - [5056, 128, 1, 3328]
    - [64, 0.0]
  - - [128, 128, 1, 1280]
    - [31, 0.0]
  - - [448, 704, 1, 256]
    - [64, 0.0]
  - - [4288, 3584, 1, 128]
    - [13, 0.0]
  - - [2944, 128, 1, 3328]
    - [27, 0.0]
  - - [128, 5056, 1, 1280]
    - [64, 0.0]
  - - [3584, 5056, 1, 1280]
    - [62, 0.0]
  - - [256, 448, 1, 1280]
    - [49, 0.0]
  - - [704, 704, 1, 128]
    - [13, 0.0]
  - - [5056, 4, 1, 128]
    - [95, 0.0]
  - - [704, 256, 1, 1280]
    - [64, 0.0]
  - - [64, 2368, 1, 3328]
    - [27, 0.0]
  - - [1856, 1024, 1, 128]
    - [13, 0.0]
  - - [1856, 64, 1, 128]
    - [7, 0.0]
  - - [64, 6784, 1, 1280]
    - [90, 0.0]
  - - [704, 4288, 1, 256]
    - [75, 0.0]
  - - [5888, 2368, 1, 1280]
    - [77, 0.0]
  - - [128, 256, 1, 256]
    - [20, 0.0]
  - - [256, 64, 1, 1280]
    - [32, 0.0]
  - - [2368, 5888, 1, 1280]
    - [72, 0.0]
  - - [5888, 256, 1, 1280]
    - [64, 0.0]
  - - [4, 5888, 1, 1280]
    - [17, 0.0]
  - - [704, 128, 1, 128]
    - [2, 0.0]
  - - [1024, 4, 1, 1280]
    - [104, 0.0]
  - - [2368, 1856, 1, 3328]
    - [79, 0.0]
  - - [2368, 128, 1, 128]
    - [3, 0.0]
  - - [2944, 704, 1, 256]
    - [69, 0.0]
  - - [5056, 128, 1, 128]
    - [6, 0.0]
  - - [256, 704, 1, 3328]
    - [64, 0.0]
  - - [704, 3584, 1, 256]
    - [89, 0.0]
  - - [1024, 1024, 1, 1024]
    - [113, 45.676]
  - - [704, 2944, 1, 3328]
    - [77, 0.0]
  - - [6784, 1024, 1, 128]
    - [13, 0.0]
  - - [256, 448, 1, 128]
    - [5, 0.0]
  - - [448, 1024, 1, 3328]
    - [64, 0.0]
  - - [2944, 1024, 1, 3328]
    - [64, 0.0]
  - - [2944, 5056, 1, 128]
    - [13, 0.0]
  - - [1408, 6784, 1, 256]
    - [76, 0.0]
  - - [6784, 1408, 1, 3328]
    - [78, 0.0]
  - - [4288, 6784, 1, 128]
    - [13, 0.0]
  - - [704, 64, 1, 256]
    - [20, 0.0]
  - - [5888, 4, 1, 1280]
    - [19, 0.0]
  - - [256, 2368, 1, 3328]
    - [64, 0.0]
  - - [6784, 2944, 1, 1280]
    - [75, 0.0]
  - - [4288, 1856, 1, 128]
    - [60, 0.0]
  - - [1856, 2944, 1, 128]
    - [4, 0.0]
  - - [6784, 448, 1, 128]
    - [4, 0.0]
  - - [64, 3584, 1, 128]
    - [1, 0.0]
  - - [448, 5056, 1, 1280]
    - [64, 0.0]
  - - [2368, 1856, 1, 128]
    - [59, 0.0]
  - - [128, 448, 1, 1280]
    - [47, 0.0]
  - - [4288, 704, 1, 256]
    - [74, 0.0]
  - - [256, 3584, 1, 128]
    - [60, 0.0]
  - - [5888, 704, 1, 256]
    - [64, 0.0]
  - - [3584, 1024, 1, 128]
    - [4, 0.0]
  - - [256, 5888, 1, 3328]
    - [76, 0.0]
  - - [1408, 4288, 1, 3328]
    - [72, 0.0]
  - - [6784, 4288, 1, 256]
    - [65, 0.0]
  - - [4288, 256, 1, 128]
    - [4, 0.0]
  - - [5888, 256, 1, 256]
    - [64, 0.0]
  - - [6784, 1024, 1, 1280]
    - [64, 0.0]
  - - [5888, 1024, 1, 128]
    - [4, 0.0]
  - - [1024, 128, 1, 256]
    - [64, 0.0]
  - - [128, 64, 1, 3328]
    - [50, 0.0]
  - - [448, 64, 1, 256]
    - [20, 0.0]
  - - [2944, 704, 1, 1280]
    - [74, 0.0]
  - - [6784, 3584, 1, 1280]
    - [82, 0.0]
  - - [1024, 6784, 1, 1280]
    - [62, 0.0]
  - - [2944, 64, 1, 1280]
    - [27, 0.0]
  - - [1408, 2944, 1, 1280]
    - [72, 0.0]
  - - [256, 1856, 1, 256]
    - [74, 0.0]
  - - [1408, 2368, 1, 3328]
    - [64, 0.0]
  - - [2944, 4, 1, 3328]
    - [100, 0.0]
  - - [128, 1408, 1, 3328]
    - [22, 0.0]
  - - [2944, 1856, 1, 128]
    - [59, 0.0]
  - - [256, 2944, 1, 128]
    - [59, 0.0]
  - - [256, 6784, 1, 128]
    - [4, 0.0]
  - - [2368, 4, 1, 128]
    - [95, 0.0]
  - - [1408, 256, 1, 3328]
    - [64, 0.0]
  - - [1856, 4, 1, 128]
    - [96, 0.0]
  - - [5056, 6784, 1, 128]
    - [4, 0.0]
  - - [4288, 5056, 1, 128]
    - [59, 0.0]
  - - [1856, 5888, 1, 128]
    - [4, 0.0]
  - - [2944, 5888, 1, 256]
    - [65, 0.0]
  - - [3584, 1856, 1, 256]
    - [74, 0.0]
  - - [4288, 3584, 1, 1280]
    - [65, 0.0]
  - - [2368, 448, 1, 256]
    - [74, 0.0]
  - - [4288, 256, 1, 3328]
    - [64, 0.0]
  - - [1856, 704, 1, 128]
    - [4, 0.0]
  - - [1408, 64, 1, 256]
    - [24, 0.0]
  - - [64, 1856, 1, 128]
    - [7, 0.0]
  - - [4, 256, 1, 128]
    - [95, 0.0]
  - - [704, 4288, 1, 3328]
    - [92, 0.0]
  - - [704, 5888, 1, 128]
    - [59, 0.0]
  - - [6784, 3584, 1, 128]
    - [13, 0.0]
  - - [1024, 64, 1, 256]
    - [25, 0.0]
  - - [64, 2368, 1, 256]
    - [25, 0.0]
  - - [4288, 5056, 1, 3328]
    - [82, 0.0]
  - - [4, 1856, 1, 1280]
    - [18, 0.0]
  - - [4288, 128, 1, 128]
    - [8, 0.0]
  - - [1408, 1408, 1, 128]
    - [4, 0.0]
  - - [1024, 128, 1, 3328]
    - [48, 0.0]
  - - [1856, 128, 1, 128]
    - [3, 0.0]
  - - [5056, 2368, 1, 256]
    - [82, 0.0]
  - - [4288, 704, 1, 3328]
    - [68, 0.0]
  - - [448, 3584, 1, 256]
    - [89, 0.0]
  - - [64, 128, 1, 128]
    - [5, 0.0]
  - - [2368, 64, 1, 1280]
    - [27, 0.0]
  - - [2368, 1024, 1, 1280]
    - [65, 0.0]
  - - [2944, 1408, 1, 3328]
    - [82, 0.0]
  - - [1408, 448, 1, 256]
    - [74, 0.0]
  - - [1024, 1408, 1, 3328]
    - [66, 0.0]
  - - [2944, 5888, 1, 1280]
    - [65, 0.0]
  - - [1408, 4, 1, 1280]
    - [104, 0.0]
  - - [5888, 3584, 1, 256]
    - [75, 0.0]
  - - [128, 1024, 1, 1280]
    - [22, 0.0]
  - - [1408, 1856, 1, 3328]
    - [69, 0.0]
  - - [4, 4, 1, 3328]
    - [105, 0.0]
  - - [6784, 1408, 1, 1280]
    - [75, 0.0]
  - - [4, 1024, 1, 1280]
    - [100, 0.0]
  - - [704, 2944, 1, 256]
    - [73, 0.0]
  - - [704, 4288, 1, 128]
    - [13, 0.0]
  - - [2368, 4288, 1, 128]
    - [59, 0.0]
  - - [64, 4288, 1, 1280]
    - [27, 0.0]
  - - [6784, 64, 1, 1280]
    - [74, 0.0]
  - - [3584, 128, 1, 128]
    - [6, 0.0]
  - - [1024, 6784, 1, 128]
    - [60, 0.0]
  - - [4, 1856, 1, 128]
    - [95, 0.0]
  - - [1408, 64, 1, 3328]
    - [33, 0.0]
  - - [6784, 4, 1, 256]
    - [98, 0.0]
  - - [1408, 1408, 1, 1280]
    - [76, 0.0]
  - - [256, 2368, 1, 256]
    - [64, 0.0]
  - - [448, 4288, 1, 3328]
    - [87, 0.0]
  - - [2368, 1408, 1, 256]
    - [85, 0.0]
  - - [5888, 5056, 1, 128]
    - [13, 0.0]
  - - [704, 2368, 1, 256]
    - [89, 0.0]
  - - [2944, 448, 1, 1280]
    - [64, 0.0]
  - - [5888, 2368, 1, 3328]
    - [74, 0.0]
  - - [64, 2944, 1, 1280]
    - [27, 0.0]
  - - [448, 1856, 1, 1280]
    - [64, 0.0]
  - - [4288, 448, 1, 1280]
    - [63, 0.0]
  - - [5888, 704, 1, 3328]
    - [74, 0.0]
  - - [5056, 256, 1, 128]
    - [59, 0.0]
  - - [1856, 256, 1, 128]
    - [59, 0.0]
  - - [5056, 128, 1, 256]
    - [64, 0.0]
  - - [704, 4, 1, 256]
    - [100, 0.0]
  - - [1408, 5888, 1, 128]
    - [4, 0.0]
  - - [4288, 4, 1, 128]
    - [96, 0.0]
  - - [1408, 1024, 1, 256]
    - [89, 0.0]
  - - [1024, 1856, 1, 128]
    - [13, 0.0]
  - - [256, 704, 1, 128]
    - [59, 0.0]
  - - [256, 1024, 1, 128]
    - [13, 0.0]
  - - [448, 1024, 1, 256]
    - [74, 0.0]
  - - [128, 4, 1, 3328]
    - [106, 0.0]
  - - [5056, 6784, 1, 1280]
    - [72, 0.0]
  - - [704, 5056, 1, 3328]
    - [75, 0.0]
  - - [64, 1408, 1, 1280]
    - [45, 0.0]
  - - [3584, 5056, 1, 3328]
    - [61, 0.0]
  - - [1856, 4, 1, 3328]
    - [104, 0.0]
  - - [4, 2944, 1, 128]
    - [95, 0.0]
  - - [2368, 2944, 1, 3328]
    - [66, 0.0]
  - - [448, 448, 1, 1280]
    - [27, 0.0]
  - - [2368, 3584, 1, 256]
    - [75, 0.0]
  - - [1024, 256, 1, 1280]
    - [86, 0.0]
  - - [5056, 3584, 1, 1280]
    - [78, 0.0]
  - - [448, 4, 1, 3328]
    - [106, 0.0]
  - - [1856, 2944, 1, 1280]
    - [68, 0.0]
  - - [3584, 2368, 1, 1280]
    - [76, 0.0]
  - - [128, 1024, 1, 256]
    - [30, 0.0]
  - - [2944, 1408, 1, 256]
    - [94, 0.0]
  - - [4288, 1408, 1, 3328]
    - [66, 0.0]
  - - [3584, 64, 1, 3328]
    - [23, 0.0]
  - - [1408, 128, 1, 256]
    - [64, 0.0]
  - - [2944, 1024, 1, 128]
    - [59, 0.0]
  - - [4288, 5056, 1, 1280]
    - [82, 0.0]
  - - [5888, 6784, 1, 1280]
    - [82, 0.0]
  - - [6784, 5056, 1, 128]
    - [60, 0.0]
  - - [256, 1024, 1, 3328]
    - [74, 0.0]
  - - [3584, 4, 1, 256]
    - [100, 0.0]
  - - [1856, 64, 1, 3328]
    - [22, 0.0]
  - - [64, 6784, 1, 128]
    - [1, 0.0]
  - - [5888, 1408, 1, 3328]
    - [61, 0.0]
  - - [5888, 64, 1, 1280]
    - [27, 0.0]
  - - [256, 5056, 1, 256]
    - [63, 0.0]
  - - [128, 3584, 1, 128]
    - [12, 0.0]
  - - [448, 3584, 1, 3328]
    - [64, 0.0]
  - - [704, 2368, 1, 128]
    - [13, 0.0]
  - - [5888, 256, 1, 128]
    - [60, 0.0]
  - - [4, 5056, 1, 128]
    - [95, 0.0]
  - - [448, 256, 1, 256]
    - [21, 0.0]
  - - [704, 4, 1, 3328]
    - [106, 0.0]
  - - [1408, 256, 1, 256]
    - [64, 0.0]
  - - [3584, 1856, 1, 128]
    - [13, 0.0]
  - - [4288, 4288, 1, 128]
    - [4, 0.0]
  - - [1856, 1024, 1, 3328]
    - [82, 0.0]
  - - [128, 5888, 1, 3328]
    - [64, 0.0]
  - - [1024, 5056, 1, 256]
    - [74, 0.0]
  - - [2368, 1408, 1, 3328]
    - [64, 0.0]
  - - [5888, 448, 1, 256]
    - [74, 0.0]
  - - [5888, 6784, 1, 128]
    - [4, 0.0]
  - - [2368, 4, 1, 3328]
    - [104, 0.0]
  - - [6784, 5056, 1, 1280]
    - [72, 0.0]
  - - [5056, 704, 1, 1280]
    - [74, 0.0]
  - - [1408, 256, 1, 1280]
    - [64, 0.0]
  - - [4288, 6784, 1, 1280]
    - [82, 0.0]
  - - [128, 704, 1, 256]
    - [25, 0.0]
  - - [1024, 1024, 1, 128]
    - [60, 0.0]
  - - [448, 128, 1, 1280]
    - [47, 0.0]
  - - [6784, 4, 1, 3328]
    - [100, 0.0]
  - - [4288, 4, 1, 1280]
    - [100, 0.0]
  - - [1024, 64, 1, 3328]
    - [30, 0.0]
  - - [1856, 4, 1, 256]
    - [98, 0.0]
  - - [64, 3584, 1, 1280]
    - [28, 0.0]
  - - [6784, 1408, 1, 256]
    - [75, 0.0]
  - - [3584, 5888, 1, 128]
    - [13, 0.0]
  - - [5056, 5888, 1, 256]
    - [72, 0.0]
  - - [2368, 1024, 1, 256]
    - [65, 0.0]
  - - [2944, 1856, 1, 256]
    - [64, 0.0]
  - - [1856, 6784, 1, 1280]
    - [75, 0.0]
  - - [64, 5056, 1, 128]
    - [1, 0.0]
  - - [5888, 64, 1, 128]
    - [1, 0.0]
  - - [448, 704, 1, 128]
    - [60, 0.0]
  - - [4, 1024, 1, 128]
    - [95, 0.0]
  - - [4288, 3584, 1, 256]
    - [72, 0.0]
  - - [1408, 704, 1, 128]
    - [4, 0.0]
  - - [64, 256, 1, 3328]
    - [53, 0.0]
  - - [5056, 1856, 1, 1280]
    - [75, 0.0]
  - - [1408, 1024, 1, 3328]
    - [77, 0.0]
  - - [2368, 256, 1, 3328]
    - [67, 0.0]
  - - [5888, 3584, 1, 1280]
    - [75, 0.0]
  - - [1856, 3584, 1, 3328]
    - [66, 0.0]
  - - [5888, 128, 1, 1280]
    - [74, 0.0]
  - - [1024, 2944, 1, 256]
    - [74, 0.0]
  - - [448, 6784, 1, 1280]
    - [66, 0.0]
  - - [256, 3584, 1, 1280]
    - [66, 0.0]
  - - [448, 128, 1, 128]
    - [2, 0.0]
  - - [704, 5056, 1, 256]
    - [64, 0.0]
  - - [2944, 1856, 1, 1280]
    - [75, 0.0]
  - - [128, 256, 1, 128]
    - [7, 0.0]
  - - [5056, 256, 1, 256]
    - [74, 0.0]
  - - [2368, 3584, 1, 3328]
    - [82, 0.0]
  - - [3584, 5888, 1, 3328]
    - [82, 0.0]
  - - [128, 4, 1, 256]
    - [98, 0.0]
  - - [2944, 3584, 1, 1280]
    - [69, 0.0]
  - - [1856, 5888, 1, 1280]
    - [82, 0.0]
  - - [256, 256, 1, 1280]
    - [25, 0.0]
  - - [5056, 448, 1, 3328]
    - [74, 0.0]
  - - [4288, 1408, 1, 256]
    - [72, 0.0]
  - - [3584, 64, 1, 256]
    - [64, 0.0]
  - - [64, 1856, 1, 3328]
    - [48, 0.0]
  - - [256, 1408, 1, 128]
    - [59, 0.0]
  - - [5888, 1408, 1, 128]
    - [13, 0.0]
  - - [4288, 2368, 1, 1280]
    - [64, 0.0]
  - - [4, 4288, 1, 256]
    - [97, 0.0]
  - - [256, 4288, 1, 128]
    - [13, 0.0]
  - - [256, 128, 1, 3328]
    - [35, 0.0]
  - - [6784, 2368, 1, 256]
    - [82, 0.0]
  - - [5888, 128, 1, 128]
    - [6, 0.0]
  - - [4288, 1856, 1, 256]
    - [62, 0.0]
  - - [1856, 256, 1, 3328]
    - [64, 0.0]
  - - [1856, 2944, 1, 256]
    - [82, 0.0]
  - - [5056, 1024, 1, 128]
    - [13, 0.0]
  - - [64, 5888, 1, 1280]
    - [27, 0.0]
  - - [6784, 256, 1, 128]
    - [60, 0.0]
  - - [5888, 704, 1, 128]
    - [4, 0.0]
  - - [6784, 64, 1, 128]
    - [1, 0.0]
  - - [1024, 4288, 1, 1280]
    - [61, 0.0]
  - - [2368, 5056, 1, 3328]
    - [82, 0.0]
  - - [448, 4, 1, 128]
    - [95, 0.0]
  - - [4, 256, 1, 3328]
    - [106, 0.0]
  - - [4288, 1024, 1, 3328]
    - [78, 0.0]
  - - [1024, 5056, 1, 3328]
    - [75, 0.0]
  - - [1024, 1856, 1, 3328]
    - [72, 0.0]
  - - [704, 704, 1, 1280]
    - [86, 0.0]
  - - [128, 2368, 1, 1280]
    - [23, 0.0]
  - - [1408, 128, 1, 3328]
    - [49, 0.0]
  - - [3584, 256, 1, 1280]
    - [66, 0.0]
  - - [4, 128, 1, 128]
    - [95, 0.0]
  - - [704, 6784, 1, 128]
    - [60, 0.0]
  - - [3584, 128, 1, 1280]
    - [64, 0.0]
  - - [4, 256, 1, 1280]
    - [104, 0.0]
  - - [128, 704, 1, 3328]
    - [36, 0.0]
  - - [4288, 6784, 1, 256]
    - [62, 0.0]
  - - [3584, 2944, 1, 3328]
    - [79, 0.0]
  - - [128, 1856, 1, 256]
    - [64, 0.0]
  - - [64, 4288, 1, 256]
    - [64, 0.0]
  - - [4, 3584, 1, 3328]
    - [18, 0.0]
  - - [64, 4, 1, 3328]
    - [106, 0.0]
  - - [4, 64, 1, 3328]
    - [104, 0.0]
  - - [5888, 2944, 1, 256]
    - [61, 0.0]
  - - [2368, 6784, 1, 128]
    - [60, 0.0]
  - - [448, 4288, 1, 1280]
    - [76, 0.0]
  - - [448, 1856, 1, 3328]
    - [76, 0.0]
  - - [4, 1024, 1, 256]
    - [99, 0.0]
  - - [5056, 4288, 1, 256]
    - [65, 0.0]
  - - [1024, 448, 1, 256]
    - [64, 0.0]
  - - [1024, 3584, 1, 256]
    - [74, 0.0]
  - - [2944, 128, 1, 1280]
    - [22, 0.0]
  - - [1856, 5056, 1, 128]
    - [59, 0.0]
  - - [64, 256, 1, 256]
    - [42, 0.0]
  - - [1408, 4, 1, 128]
    - [96, 0.0]
  - - [128, 2368, 1, 128]
    - [16, 0.0]
  - - [256, 704, 1, 1280]
    - [64, 0.0]
  - - [64, 2368, 1, 128]
    - [7, 0.0]
  - - [6784, 6784, 1, 3328]
    - [75, 0.0]
  - - [448, 5888, 1, 1280]
    - [82, 0.0]
  - - [5056, 448, 1, 128]
    - [4, 0.0]
  - - [3584, 2944, 1, 128]
    - [13, 0.0]
  - - [6784, 256, 1, 1280]
    - [91, 0.0]
  - - [256, 2944, 1, 1280]
    - [63, 0.0]
  - - [64, 4288, 1, 128]
    - [8, 0.0]
  - - [2368, 5888, 1, 3328]
    - [61, 0.0]
  - - [4, 64, 1, 256]
    - [99, 0.0]
  - - [704, 1024, 1, 3328]
    - [86, 0.0]
  - - [2368, 1856, 1, 1280]
    - [66, 0.0]
  - - [128, 448, 1, 128]
    - [5, 0.0]
  - - [128, 6784, 1, 256]
    - [64, 0.0]
  - - [3584, 4288, 1, 128]
    - [4, 0.0]
  - - [64, 448, 1, 128]
    - [10, 0.0]
  - - [5888, 4288, 1, 3328]
    - [84, 0.0]
  - - [2368, 704, 1, 256]
    - [90, 0.0]
  - - [256, 1856, 1, 3328]
    - [64, 0.0]
  - - [1856, 128, 1, 256]
    - [90, 0.0]
  - - [6784, 128, 1, 128]
    - [3, 0.0]
  - - [3584, 1408, 1, 128]
    - [13, 0.0]
  - - [1856, 5056, 1, 1280]
    - [68, 0.0]
  - - [2944, 1024, 1, 1280]
    - [61, 0.0]
  - - [5056, 4, 1, 256]
    - [98, 0.0]
  - - [2368, 4288, 1, 256]
    - [88, 0.0]
  - - [1024, 2368, 1, 3328]
    - [74, 0.0]
  - - [64, 704, 1, 3328]
    - [33, 0.0]
  - - [704, 1408, 1, 256]
    - [64, 0.0]
  - - [6784, 1856, 1, 3328]
    - [64, 0.0]
  - - [1024, 2944, 1, 128]
    - [60, 0.0]
  - - [1024, 3584, 1, 1280]
    - [76, 0.0]
  - - [4288, 5888, 1, 3328]
    - [82, 0.0]
  - - [4288, 4, 1, 3328]
    - [100, 0.0]
  - - [256, 1408, 1, 256]
    - [64, 0.0]
  - - [448, 2944, 1, 1280]
    - [66, 0.0]
  - - [4, 5888, 1, 128]
    - [95, 0.0]
  - - [1024, 2944, 1, 3328]
    - [61, 0.0]
  - - [3584, 6784, 1, 256]
    - [78, 0.0]
  - - [256, 6784, 1, 1280]
    - [74, 0.0]
  - - [1856, 3584, 1, 256]
    - [89, 0.0]
  - - [128, 448, 1, 3328]
    - [33, 0.0]
  - - [6784, 1856, 1, 128]
    - [13, 0.0]
  - - [4, 448, 1, 256]
    - [103, 0.0]
  - - [2944, 704, 1, 128]
    - [59, 0.0]
  - - [256, 5888, 1, 1280]
    - [79, 0.0]
  - - [4, 128, 1, 1280]
    - [106, 0.0]
  - - [4288, 6784, 1, 3328]
    - [75, 0.0]
  - - [6784, 128, 1, 1280]
    - [66, 0.0]
  - - [64, 1408, 1, 256]
    - [44, 0.0]
  - - [2368, 1408, 1, 128]
    - [13, 0.0]
  - - [1856, 448, 1, 256]
    - [66, 0.0]
  - - [1408, 1024, 1, 128]
    - [13, 0.0]
  - - [128, 64, 1, 128]
    - [14, 0.0]
  - - [6784, 3584, 1, 3328]
    - [72, 0.0]
  - - [2944, 64, 1, 3328]
    - [22, 0.0]
  - - [64, 64, 1, 128]
    - [9, 0.0]
  - - [2368, 5056, 1, 1280]
    - [69, 0.0]
  - - [64, 4, 1, 1280]
    - [104, 0.0]
  - - [1408, 2368, 1, 1280]
    - [64, 0.0]
  - - [128, 1408, 1, 1280]
    - [22, 0.0]
  - - [256, 64, 1, 3328]
    - [56, 0.0]
  - - [2944, 4288, 1, 128]
    - [59, 0.0]
  - - [2944, 2944, 1, 256]
    - [68, 0.0]
  - - [2944, 4, 1, 1280]
    - [104, 0.0]
  - - [5888, 4, 1, 256]
    - [100, 0.0]
  - - [6784, 256, 1, 256]
    - [64, 0.0]
  - - [256, 5056, 1, 3328]
    - [89, 0.0]
  - - [128, 4288, 1, 1280]
    - [27, 0.0]
  - - [5056, 1856, 1, 128]
    - [13, 0.0]
  - - [5888, 1408, 1, 256]
    - [72, 0.0]
  - - [128, 128, 1, 256]
    - [20, 0.0]
  - - [5056, 4, 1, 3328]
    - [100, 0.0]
  - - [4288, 3584, 1, 3328]
    - [62, 0.0]
  - - [448, 704, 1, 3328]
    - [74, 0.0]
  - - [448, 448, 1, 128]
    - [2, 0.0]
  - - [1024, 2368, 1, 1280]
    - [91, 0.0]
  - - [1856, 704, 1, 3328]
    - [73, 0.0]
  - - [4, 2368, 1, 128]
    - [95, 0.0]
  - - [5888, 6784, 1, 3328]
    - [68, 0.0]
  - - [704, 4288, 1, 1280]
    - [66, 0.0]
  - - [704, 256, 1, 256]
    - [74, 0.0]
  - - [6784, 448, 1, 3328]
    - [64, 0.0]
  - - [4288, 1024, 1, 128]
    - [4, 0.0]
  - - [960, 1024, 1, 1024]
    - [107, 54.453]
  - - [1920, 2048, 1, 2048]
    - [108, 82.75]
  - - [2880, 3072, 1, 3072]
    - [109, 79.591]
  - - [3840, 4096, 1, 4096]
    - [110, 92.519]
  - - [7680, 8192, 1, 8192]
    - [111, 94.612]
  - - [512, 512, 1, 512]
    - [112, 19.25]
  - - [2048, 2048, 1, 2048]
    - [114, 63.285]
  - - [3072, 3072, 1, 3072]
    - [115, 84.871]
  - - [4096, 4096, 1, 4096]
    - [116, 85.574]
  - - [8192, 8192, 1, 8192]
    - [117, 90.444]
  - - [384, 384, 1, 384]
    - [118, 10.652]
  - - [768, 768, 1, 768]
    - [118, 36.003]
  - - [1152, 1152, 1, 1152]
    - [119, 50.871]
  - - [1536, 1536, 1, 1536]
    - [120, 64.048]
  - - [1920, 1920, 1, 1920]
    - [121, 78.528]
  - - [2304, 2304, 1, 2304]
    - [109, 77.3]
  - - [2688, 2688, 1, 2688]
    - [122, 81.016]
  - - [3456, 3456, 1, 3456]
    - [123, 77.62]
  - - [3840, 3840, 1, 3840]
    - [110, 87.063]
  - - [4224, 4224, 1, 4224]
    - [111, 84.371]
  - - [4608, 4608, 1, 4608]
    - [124, 89.297]
  - - [4992, 4992, 1, 4992]
    - [115, 88.042]
  - - [5376, 5376, 1, 5376]
    - [123, 89.656]
  - - [5760, 5760, 1, 5760]
    - [111, 88.404]
  - - [6144, 6144, 1, 6144]
    - [111, 90.644]
  - - [6528, 6528, 1, 6528]
    - [123, 86.868]
  - - [6912, 6912, 1, 6912]
    - [125, 89.776]
  - - [7296, 7296, 1, 7296]
    - [117, 91.495]
  - - [7680, 7680, 1, 7680]
    - [111, 94.418]
- null
