library/src/blas3/Tensile/Logic/aldebaran/arcturus_Cijk_Alik_Bljk_BBH_GB.yaml
- {MinimumRequiredVersion: 4.25.0}
- arcturus
- gfx908
- [Device 7380, Device 7388, Device 738c, Device 7390]
    SolutionIndex: 0
    SolutionNameMin: Cijk_Alik_Bljk_BBH_GB_MT32x32x64_MI16x16x8x1_SN_1LDSB0_EPS0_GRVW4_LPA16_LPB16_PGR2_SU0_SUS128_TT1_16_WG32_8_1_WGM1
    SolutionIndex: 1
    SolutionNameMin: Cijk_Alik_Bljk_BBH_GB_MT64x64x32_MI32x32x4x1_SN_1LDSB0_EPS0_GRVW8_LPA8_LPB8_PGR2_SU0_SUS128_TT1_32_WG64_4_1_WGM1
    SolutionIndex: 2
    SolutionNameMin: Cijk_Alik_Bljk_BBH_GB_MT32x32x64_MI16x16x8x1_SN_1LDSB0_EPS0_GRVW8_LPA16_LPB16_PGR2_SU0_SUS128_TT1_16_WG32_8_1_WGM1
    SolutionIndex: 3
    SolutionNameMin: Cijk_Alik_Bljk_BBH_GB_MT32x32x64_MI16x16x8x1_SN_1LDSB0_EPS0_GRVW4_LPA16_LPB16_PGR2_SU0_SUS256_TT1_16_WG32_8_1_WGM1
    SolutionIndex: 4
    SolutionNameMin: Cijk_Alik_Bljk_BBH_GB_MT32x32x64_MI16x16x8x1_SN_1LDSB0_EPS0_GRVW8_LPA16_LPB16_PGR2_SU0_SUS256_TT1_16_WG32_8_1_WGM1
    SolutionIndex: 5
    SolutionNameMin: Cijk_Alik_Bljk_BBH_GB_MT32x32x64_MI16x16x8x1_SN_1LDSB0_EPS0_GRVW8_LPA16_LPB16_PGR2_SU0_SUS256_TT1_16_WG32_8_1_WGM2
    SolutionIndex: 6
    SolutionNameMin: Cijk_Alik_Bljk_BBH_GB_MT32x32x64_MI16x16x8x1_SN_1LDSB0_EPS0_GRVW8_LPA16_LPB16_PGR2_SU0_SUS128_TT1_16_WG32_8_1_WGM15
    SolutionIndex: 7
    SolutionNameMin: Cijk_Alik_Bljk_BBH_GB_MT64x64x32_MI32x32x4x1_SN_1LDSB1_EPS1_GRVW8_LPA8_LPB8_PGR1_SU0_SUS128_TT1_32_WG64_4_1_WGM1
    SolutionIndex: 8
    SolutionNameMin: Cijk_Alik_Bljk_BBH_GB_MT32x32x64_MI16x16x8x1_SN_1LDSB1_EPS0_GRVW8_LPA16_LPB16_PGR2_SU0_SUS128_TT1_16_WG32_8_1_WGM1
    SolutionIndex: 9
    SolutionNameMin: Cijk_Alik_Bljk_BBH_GB_MT64x64x32_MI32x32x4x1_SN_1LDSB1_EPS1_GRVW8_LPA8_LPB8_PGR1_SU0_SUS256_TT1_32_WG64_4_1_WGM1
    SolutionIndex: 10
    SolutionNameMin: Cijk_Alik_Bljk_BBH_GB_MT32x32x64_MI16x16x8x1_SN_1LDSB1_EPS1_GRVW8_LPA16_LPB16_PGR1_SU0_SUS256_TT1_16_WG32_8_1_WGM1
    SolutionIndex: 11
    SolutionNameMin: Cijk_Alik_Bljk_BBH_GB_MT32x32x64_MI16x16x8x1_SN_1LDSB1_EPS0_GRVW8_LPA16_LPB16_PGR2_SU0_SUS256_TT1_16_WG32_8_1_WGM1
    SolutionIndex: 12
    SolutionNameMin: Cijk_Alik_Bljk_BBH_GB_MT32x32x64_MI16x16x8x1_SN_1LDSB1_EPS0_GRVW8_LPA16_LPB16_PGR2_SU32_SUS128_TT1_16_WG32_8_1_WGM1
    SolutionIndex: 13
    SolutionNameMin: Cijk_Alik_Bljk_BBH_GB_MT32x32x64_MI16x16x8x1_SN_1LDSB1_EPS0_GRVW8_LPA16_LPB16_PGR2_SU0_SUS128_TT1_16_WG32_8_1_WGM2
    SolutionIndex: 14
    SolutionNameMin: Cijk_Alik_Bljk_BBH_GB_MT32x64x64_MI16x16x8x1_SN_1LDSB1_EPS0_GRVW8_LPA16_LPB16_PGR2_SU32_SUS256_TT1_32_WG32_8_1_WGM2
    SolutionIndex: 15
    SolutionNameMin: Cijk_Alik_Bljk_BBH_GB_MT64x64x32_MI32x32x4x1_SN_1LDSB1_EPS1_GRVW8_LPA8_LPB8_PGR1_SU0_SUS128_TT1_32_WG64_4_1_WGM15
    SolutionIndex: 16
    SolutionNameMin: Cijk_Alik_Bljk_BBH_GB_MT32x32x64_MI16x16x8x1_SN_1LDSB1_EPS0_GRVW4_LPA16_LPB16_PGR2_SU0_SUS256_TT1_16_WG32_8_1_WGM15
    SolutionIndex: 17
    SolutionNameMin: Cijk_Alik_Bljk_BBH_GB_MT32x32x64_MI16x16x8x1_SN_1LDSB1_EPS0_GRVW8_LPA16_LPB16_PGR2_SU0_SUS256_TT1_16_WG32_8_1_WGM15
- - - [32, 32, 8, 128, 32, 32, 128, 128]
    - [0, 180.0]
  - - [128, 128, 8, 128, 128, 128, 128, 128]
    - [8, 2796.0]
  - - [256, 256, 8, 128, 256, 256, 128, 128]
    - [16, 8389.0]
  - - [512, 512, 8, 128, 512, 512, 128, 128]
    - [7, 21237.0]
  - - [32, 32, 8, 512, 32, 32, 512, 512]
    - [0, 541.0]
  - - [128, 128, 8, 512, 128, 128, 512, 512]
    - [4, 8144.0]
  - - [256, 256, 8, 512, 256, 256, 512, 512]
    - [14, 17296.0]
  - - [512, 512, 8, 512, 512, 512, 512, 512]
    - [15, 35136.0]
  - - [32, 32, 8, 1024, 32, 32, 1024, 1024]
    - [2, 794.0]
  - - [128, 128, 8, 1024, 128, 128, 1024, 1024]
    - [8, 11260.0]
  - - [256, 256, 8, 1024, 256, 256, 1024, 1024]
    - [1, 22370.0]
  - - [512, 512, 8, 1024, 512, 512, 1024, 1024]
    - [9, 39946.0]
  - - [32, 128, 8, 128, 32, 32, 128, 128]
    - [3, 728.0]
  - - [32, 256, 8, 128, 32, 32, 128, 128]
    - [3, 1417.0]
  - - [32, 512, 8, 128, 32, 32, 128, 128]
    - [3, 2834.0]
  - - [32, 128, 8, 512, 32, 32, 512, 512]
    - [11, 2185.0]
  - - [32, 256, 8, 512, 32, 32, 512, 512]
    - [3, 4280.0]
  - - [32, 512, 8, 512, 32, 32, 512, 512]
    - [3, 8066.0]
  - - [32, 128, 8, 1024, 32, 32, 1024, 1024]
    - [5, 3383.0]
  - - [32, 256, 8, 1024, 32, 32, 1024, 1024]
    - [6, 6605.0]
  - - [32, 512, 8, 1024, 32, 32, 1024, 1024]
    - [17, 10755.0]
  - - [128, 32, 8, 128, 128, 128, 128, 128]
    - [13, 708.0]
  - - [256, 32, 8, 128, 256, 256, 128, 128]
    - [10, 1456.0]
  - - [512, 32, 8, 128, 512, 512, 128, 128]
    - [8, 2834.0]
  - - [128, 32, 8, 512, 128, 128, 512, 512]
    - [6, 2208.0]
  - - [256, 32, 8, 512, 256, 256, 512, 512]
    - [11, 4369.0]
  - - [512, 32, 8, 512, 512, 512, 512, 512]
    - [2, 7989.0]
  - - [128, 32, 8, 1024, 128, 128, 1024, 1024]
    - [4, 3383.0]
  - - [256, 32, 8, 1024, 256, 256, 1024, 1024]
    - [4, 6554.0]
  - - [512, 32, 8, 1024, 512, 512, 1024, 1024]
    - [12, 10894.0]
- null
