library/src/blas3/Tensile/Logic/aldebaran/arcturus_Cijk_Ailk_Bjlk_SB_GB.yaml
- {MinimumRequiredVersion: 4.26.0}
- arcturus
- gfx908
- [Device 7380, Device 7388, Device 738c, Device 7390]
    SolutionIndex: 0
    SolutionNameMin: Cijk_Ailk_Bjlk_SB_GB_MT32x64x8_MI16x16x4x1_SN_1LDSB0_EPS1_GRVW1_NLCA1_NLCB1_PGR1_SRVW2_TT1_32_WG32_8_1_WGM1
    SolutionIndex: 1
    SolutionNameMin: Cijk_Ailk_Bjlk_SB_GB_MT64x32x8_MI16x16x4x1_SN_1LDSB0_EPS1_GRVW1_NLCA1_NLCB1_PGR1_SRVW2_TT2_16_WG32_8_1_WGM1
    SolutionIndex: 2
    SolutionNameMin: Cijk_Ailk_Bjlk_SB_GB_MT32x32x8_MI16x16x4x1_SN_1LDSB0_EPS0_GRVW1_NLCA1_NLCB1_PGR2_SRVW2_TT1_16_WG32_8_1_WGM1
    SolutionIndex: 3
    SolutionNameMin: Cijk_Ailk_Bjlk_SB_GB_MT64x32x8_MI16x16x4x1_SN_1LDSB0_EPS0_GRVW1_NLCA1_NLCB1_PGR2_SRVW2_TT2_16_WG32_8_1_WGM1
    SolutionIndex: 4
    SolutionNameMin: Cijk_Ailk_Bjlk_SB_GB_MT64x64x8_MI32x32x2x1_SN_1LDSB0_EPS0_GRVW1_NLCA1_NLCB1_PGR2_SRVW2_TT1_32_WG64_4_1_WGM1
    SolutionIndex: 5
    SolutionNameMin: Cijk_Ailk_Bjlk_SB_GB_MT64x128x8_MI32x32x2x1_SN_1LDSB0_EPS0_GRVW1_NLCA1_NLCB2_PGR2_SRVW2_TT1_64_WG64_4_1_WGM1
    SolutionIndex: 6
    SolutionNameMin: Cijk_Ailk_Bjlk_SB_GB_MT32x32x16_MI16x16x4x1_SN_1LDSB0_EPS1_GRVW1_NLCA1_NLCB1_PGR1_SRVW2_TT1_16_WG32_8_1_WGM1
    SolutionIndex: 7
    SolutionNameMin: Cijk_Ailk_Bjlk_SB_GB_MT32x32x16_MI16x16x4x1_SN_1LDSB0_EPS0_GRVW1_NLCA1_NLCB1_PGR2_SRVW2_TT1_16_WG32_8_1_WGM1
    SolutionIndex: 8
    SolutionNameMin: Cijk_Ailk_Bjlk_SB_GB_MT64x32x16_MI16x16x4x1_SN_1LDSB0_EPS0_GRVW1_NLCA1_NLCB1_PGR2_SRVW2_TT2_16_WG32_8_1_WGM1
    SolutionIndex: 9
    SolutionNameMin: Cijk_Ailk_Bjlk_SB_GB_MT64x64x16_MI32x32x2x1_SN_1LDSB0_EPS0_GRVW1_NLCA1_NLCB1_PGR2_SRVW2_TT1_32_WG64_4_1_WGM1
    SolutionIndex: 10
    SolutionNameMin: Cijk_Ailk_Bjlk_SB_GB_MT32x32x32_MI16x16x4x1_SN_1LDSB0_EPS1_GRVW1_NLCA1_NLCB1_PGR1_SRVW2_TT1_16_WG32_8_1_WGM1
    SolutionIndex: 11
    SolutionNameMin: Cijk_Ailk_Bjlk_SB_GB_MT32x32x32_MI16x16x4x1_SN_1LDSB0_EPS0_GRVW1_NLCA1_NLCB1_PGR2_SRVW2_TT1_16_WG32_8_1_WGM1
    SolutionIndex: 12
    SolutionNameMin: Cijk_Ailk_Bjlk_SB_GB_MT64x64x8_MI32x32x2x1_SN_1LDSB0_EPS0_GRVW2_NLCA1_NLCB1_PGR2_SRVW2_TT1_32_WG64_4_1_WGM1
    SolutionIndex: 13
    SolutionNameMin: Cijk_Ailk_Bjlk_SB_GB_MT64x128x8_MI32x32x2x1_SN_1LDSB0_EPS0_GRVW2_NLCA1_NLCB1_PGR2_SRVW2_TT1_64_WG64_4_1_WGM1
    SolutionIndex: 14
    SolutionNameMin: Cijk_Ailk_Bjlk_SB_GB_MT64x32x16_MI16x16x4x1_SN_1LDSB0_EPS1_GRVW2_NLCA1_NLCB1_PGR1_SRVW2_TT2_16_WG32_8_1_WGM1
    SolutionIndex: 15
    SolutionNameMin: Cijk_Ailk_Bjlk_SB_GB_MT32x32x16_MI16x16x4x1_SN_1LDSB0_EPS0_GRVW2_NLCA1_NLCB1_PGR2_SRVW2_TT1_16_WG32_8_1_WGM1
    SolutionIndex: 16
    SolutionNameMin: Cijk_Ailk_Bjlk_SB_GB_MT64x64x16_MI32x32x2x1_SN_1LDSB0_EPS0_GRVW2_NLCA1_NLCB1_PGR2_SRVW2_TT1_32_WG64_4_1_WGM1
    SolutionIndex: 17
    SolutionNameMin: Cijk_Ailk_Bjlk_SB_GB_MT32x32x32_MI16x16x4x1_SN_1LDSB0_EPS0_GRVW2_NLCA1_NLCB1_PGR2_SRVW2_TT1_16_WG32_8_1_WGM1
    SolutionIndex: 18
    SolutionNameMin: Cijk_Ailk_Bjlk_SB_GB_MT64x128x8_MI32x32x2x1_SN_1LDSB0_EPS1_GRVW4_NLCA1_NLCB1_PGR1_SRVW2_TT1_64_WG64_4_1_WGM1
    SolutionIndex: 19
    SolutionNameMin: Cijk_Ailk_Bjlk_SB_GB_MT64x32x8_MI16x16x4x1_SN_1LDSB0_EPS0_GRVW4_NLCA1_NLCB1_PGR2_SRVW2_TT2_16_WG32_8_1_WGM1
    SolutionIndex: 20
    SolutionNameMin: Cijk_Ailk_Bjlk_SB_GB_MT64x64x8_MI32x32x2x1_SN_1LDSB0_EPS0_GRVW4_NLCA1_NLCB1_PGR2_SRVW2_TT1_32_WG64_4_1_WGM1
    SolutionIndex: 21
    SolutionNameMin: Cijk_Ailk_Bjlk_SB_GB_MT64x128x8_MI32x32x2x1_SN_1LDSB0_EPS0_GRVW4_NLCA1_NLCB1_PGR2_SRVW2_TT1_64_WG64_4_1_WGM1
    SolutionIndex: 22
    SolutionNameMin: Cijk_Ailk_Bjlk_SB_GB_MT64x32x16_MI16x16x4x1_SN_1LDSB0_EPS1_GRVW4_NLCA1_NLCB1_PGR1_SRVW2_TT2_16_WG32_8_1_WGM1
    SolutionIndex: 23
    SolutionNameMin: Cijk_Ailk_Bjlk_SB_GB_MT64x64x16_MI32x32x2x1_SN_1LDSB0_EPS1_GRVW4_NLCA1_NLCB1_PGR1_SRVW2_TT1_32_WG64_4_1_WGM1
    SolutionIndex: 24
    SolutionNameMin: Cijk_Ailk_Bjlk_SB_GB_MT64x128x16_MI32x32x2x1_SN_1LDSB0_EPS1_GRVW4_NLCA1_NLCB1_PGR1_SRVW2_TT1_64_WG64_4_1_WGM1
    SolutionIndex: 25
    SolutionNameMin: Cijk_Ailk_Bjlk_SB_GB_MT32x32x16_MI16x16x4x1_SN_1LDSB0_EPS0_GRVW4_NLCA1_NLCB1_PGR2_SRVW2_TT1_16_WG32_8_1_WGM1
    SolutionIndex: 26
    SolutionNameMin: Cijk_Ailk_Bjlk_SB_GB_MT64x32x16_MI16x16x4x1_SN_1LDSB0_EPS0_GRVW4_NLCA1_NLCB1_PGR2_SRVW2_TT2_16_WG32_8_1_WGM1
    SolutionIndex: 27
    SolutionNameMin: Cijk_Ailk_Bjlk_SB_GB_MT64x64x16_MI32x32x2x1_SN_1LDSB0_EPS0_GRVW4_NLCA1_NLCB1_PGR2_SRVW2_TT1_32_WG64_4_1_WGM1
    SolutionIndex: 28
    SolutionNameMin: Cijk_Ailk_Bjlk_SB_GB_MT32x32x32_MI16x16x4x1_SN_1LDSB0_EPS1_GRVW4_NLCA1_NLCB1_PGR1_SRVW2_TT1_16_WG32_8_1_WGM1
    SolutionIndex: 29
    SolutionNameMin: Cijk_Ailk_Bjlk_SB_GB_MT64x32x32_MI16x16x4x1_SN_1LDSB0_EPS1_GRVW4_NLCA1_NLCB1_PGR1_SRVW2_TT2_16_WG32_8_1_WGM1
    SolutionIndex: 30
    SolutionNameMin: Cijk_Ailk_Bjlk_SB_GB_MT64x64x32_MI32x32x2x1_SN_1LDSB0_EPS1_GRVW4_NLCA1_NLCB1_PGR1_SRVW2_TT1_32_WG64_4_1_WGM1
    SolutionIndex: 31
    SolutionNameMin: Cijk_Ailk_Bjlk_SB_GB_MT32x32x32_MI16x16x4x1_SN_1LDSB0_EPS0_GRVW4_NLCA1_NLCB1_PGR2_SRVW2_TT1_16_WG32_8_1_WGM1
    SolutionIndex: 32
    SolutionNameMin: Cijk_Ailk_Bjlk_SB_GB_MT64x32x32_MI16x16x4x1_SN_1LDSB0_EPS0_GRVW4_NLCA1_NLCB1_PGR2_SRVW2_TT2_16_WG32_8_1_WGM1
    SolutionIndex: 33
    SolutionNameMin: Cijk_Ailk_Bjlk_SB_GB_MT64x32x8_MI16x16x4x1_SN_1LDSB0_EPS0_GRVW1_NLCA1_NLCB1_PGR2_SRVW2_TT2_16_WG32_8_1_WGM2
    SolutionIndex: 34
    SolutionNameMin: Cijk_Ailk_Bjlk_SB_GB_MT64x64x8_MI32x32x2x1_SN_1LDSB0_EPS0_GRVW1_NLCA1_NLCB1_PGR2_SRVW2_TT1_32_WG64_4_1_WGM2
    SolutionIndex: 35
    SolutionNameMin: Cijk_Ailk_Bjlk_SB_GB_MT64x128x8_MI32x32x2x1_SN_1LDSB0_EPS0_GRVW1_NLCA1_NLCB2_PGR2_SRVW2_TT1_64_WG64_4_1_WGM2
    SolutionIndex: 36
    SolutionNameMin: Cijk_Ailk_Bjlk_SB_GB_MT32x32x16_MI16x16x4x1_SN_1LDSB0_EPS1_GRVW1_NLCA1_NLCB1_PGR1_SRVW2_TT1_16_WG32_8_1_WGM2
    SolutionIndex: 37
    SolutionNameMin: Cijk_Ailk_Bjlk_SB_GB_MT64x64x16_MI32x32x2x1_SN_1LDSB0_EPS1_GRVW1_NLCA1_NLCB1_PGR1_SRVW2_TT1_32_WG64_4_1_WGM2
    SolutionIndex: 38
    SolutionNameMin: Cijk_Ailk_Bjlk_SB_GB_MT32x32x16_MI16x16x4x1_SN_1LDSB0_EPS0_GRVW1_NLCA1_NLCB1_PGR2_SRVW2_TT1_16_WG32_8_1_WGM2
    SolutionIndex: 39
    SolutionNameMin: Cijk_Ailk_Bjlk_SB_GB_MT32x32x32_MI16x16x4x1_SN_1LDSB0_EPS1_GRVW1_NLCA1_NLCB1_PGR1_SRVW2_TT1_16_WG32_8_1_WGM2
    SolutionIndex: 40
    SolutionNameMin: Cijk_Ailk_Bjlk_SB_GB_MT32x32x32_MI16x16x4x1_SN_1LDSB0_EPS0_GRVW1_NLCA1_NLCB1_PGR2_SRVW2_TT1_16_WG32_8_1_WGM2
    SolutionIndex: 41
    SolutionNameMin: Cijk_Ailk_Bjlk_SB_GB_MT64x32x8_MI16x16x4x1_SN_1LDSB0_EPS0_GRVW2_NLCA1_NLCB1_PGR2_SRVW2_TT2_16_WG32_8_1_WGM2
    SolutionIndex: 42
    SolutionNameMin: Cijk_Ailk_Bjlk_SB_GB_MT64x64x8_MI32x32x2x1_SN_1LDSB0_EPS0_GRVW2_NLCA1_NLCB1_PGR2_SRVW2_TT1_32_WG64_4_1_WGM2
    SolutionIndex: 43
    SolutionNameMin: Cijk_Ailk_Bjlk_SB_GB_MT32x32x16_MI16x16x4x1_SN_1LDSB0_EPS0_GRVW2_NLCA1_NLCB1_PGR2_SRVW2_TT1_16_WG32_8_1_WGM2
    SolutionIndex: 44
    SolutionNameMin: Cijk_Ailk_Bjlk_SB_GB_MT64x64x16_MI32x32x2x1_SN_1LDSB0_EPS0_GRVW2_NLCA1_NLCB1_PGR2_SRVW2_TT1_32_WG64_4_1_WGM2
    SolutionIndex: 45
    SolutionNameMin: Cijk_Ailk_Bjlk_SB_GB_MT64x32x8_MI16x16x4x1_SN_1LDSB0_EPS0_GRVW4_NLCA1_NLCB1_PGR2_SRVW2_TT2_16_WG32_8_1_WGM2
    SolutionIndex: 46
    SolutionNameMin: Cijk_Ailk_Bjlk_SB_GB_MT64x64x8_MI32x32x2x1_SN_1LDSB0_EPS0_GRVW4_NLCA1_NLCB1_PGR2_SRVW2_TT1_32_WG64_4_1_WGM2
    SolutionIndex: 47
    SolutionNameMin: Cijk_Ailk_Bjlk_SB_GB_MT64x128x8_MI32x32x2x1_SN_1LDSB0_EPS0_GRVW4_NLCA1_NLCB1_PGR2_SRVW2_TT1_64_WG64_4_1_WGM2
    SolutionIndex: 48
    SolutionNameMin: Cijk_Ailk_Bjlk_SB_GB_MT64x32x16_MI16x16x4x1_SN_1LDSB0_EPS1_GRVW4_NLCA1_NLCB1_PGR1_SRVW2_TT2_16_WG32_8_1_WGM2
    SolutionIndex: 49
    SolutionNameMin: Cijk_Ailk_Bjlk_SB_GB_MT64x64x16_MI32x32x2x1_SN_1LDSB0_EPS1_GRVW4_NLCA1_NLCB1_PGR1_SRVW2_TT1_32_WG64_4_1_WGM2
    SolutionIndex: 50
    SolutionNameMin: Cijk_Ailk_Bjlk_SB_GB_MT64x32x16_MI16x16x4x1_SN_1LDSB0_EPS0_GRVW4_NLCA1_NLCB1_PGR2_SRVW2_TT2_16_WG32_8_1_WGM2
    SolutionIndex: 51
    SolutionNameMin: Cijk_Ailk_Bjlk_SB_GB_MT64x64x16_MI32x32x2x1_SN_1LDSB0_EPS0_GRVW4_NLCA1_NLCB1_PGR2_SRVW2_TT1_32_WG64_4_1_WGM2
    SolutionIndex: 52
    SolutionNameMin: Cijk_Ailk_Bjlk_SB_GB_MT32x32x32_MI16x16x4x1_SN_1LDSB0_EPS1_GRVW4_NLCA1_NLCB1_PGR1_SRVW2_TT1_16_WG32_8_1_WGM2
    SolutionIndex: 53
    SolutionNameMin: Cijk_Ailk_Bjlk_SB_GB_MT64x64x32_MI32x32x2x1_SN_1LDSB0_EPS1_GRVW4_NLCA1_NLCB1_PGR1_SRVW2_TT1_32_WG64_4_1_WGM2
    SolutionIndex: 54
    SolutionNameMin: Cijk_Ailk_Bjlk_SB_GB_MT32x32x32_MI16x16x4x1_SN_1LDSB0_EPS0_GRVW4_NLCA1_NLCB1_PGR2_SRVW2_TT1_16_WG32_8_1_WGM2
    SolutionIndex: 55
    SolutionNameMin: Cijk_Ailk_Bjlk_SB_GB_MT64x32x32_MI16x16x4x1_SN_1LDSB0_EPS0_GRVW4_NLCA1_NLCB1_PGR2_SRVW2_TT2_16_WG32_8_1_WGM2
    SolutionIndex: 56
    SolutionNameMin: Cijk_Ailk_Bjlk_SB_GB_MT64x64x32_MI32x32x2x1_SN_1LDSB0_EPS0_GRVW4_NLCA1_NLCB1_PGR2_SRVW2_TT1_32_WG64_4_1_WGM2
    SolutionIndex: 57
    SolutionNameMin: Cijk_Ailk_Bjlk_SB_GB_MT128x32x32_MI32x32x2x1_SN_1LDSB0_EPS0_GRVW4_NLCA1_NLCB1_PGR2_SRVW2_TT1_32_WG128_2_1_WGM2
    SolutionIndex: 58
    SolutionNameMin: Cijk_Ailk_Bjlk_SB_GB_MT64x32x8_MI16x16x4x1_SN_1LDSB0_EPS1_GRVW1_NLCA1_NLCB1_PGR1_SRVW2_TT2_16_WG32_8_1_WGM15
    SolutionIndex: 59
    SolutionNameMin: Cijk_Ailk_Bjlk_SB_GB_MT64x32x8_MI16x16x4x1_SN_1LDSB0_EPS0_GRVW1_NLCA1_NLCB1_PGR2_SRVW2_TT2_16_WG32_8_1_WGM15
    SolutionIndex: 60
    SolutionNameMin: Cijk_Ailk_Bjlk_SB_GB_MT64x64x8_MI32x32x2x1_SN_1LDSB0_EPS0_GRVW1_NLCA1_NLCB1_PGR2_SRVW2_TT1_32_WG64_4_1_WGM15
    SolutionIndex: 61
    SolutionNameMin: Cijk_Ailk_Bjlk_SB_GB_MT64x128x8_MI32x32x2x1_SN_1LDSB0_EPS0_GRVW1_NLCA1_NLCB2_PGR2_SRVW2_TT1_64_WG64_4_1_WGM15
    SolutionIndex: 62
    SolutionNameMin: Cijk_Ailk_Bjlk_SB_GB_MT32x32x16_MI16x16x4x1_SN_1LDSB0_EPS1_GRVW1_NLCA1_NLCB1_PGR1_SRVW2_TT1_16_WG32_8_1_WGM15
    SolutionIndex: 63
    SolutionNameMin: Cijk_Ailk_Bjlk_SB_GB_MT32x32x16_MI16x16x4x1_SN_1LDSB0_EPS0_GRVW1_NLCA1_NLCB1_PGR2_SRVW2_TT1_16_WG32_8_1_WGM15
    SolutionIndex: 64
    SolutionNameMin: Cijk_Ailk_Bjlk_SB_GB_MT64x32x16_MI16x16x4x1_SN_1LDSB0_EPS0_GRVW1_NLCA1_NLCB1_PGR2_SRVW2_TT2_16_WG32_8_1_WGM15
    SolutionIndex: 65
    SolutionNameMin: Cijk_Ailk_Bjlk_SB_GB_MT64x64x16_MI32x32x2x1_SN_1LDSB0_EPS0_GRVW1_NLCA1_NLCB1_PGR2_SRVW2_TT1_32_WG64_4_1_WGM15
    SolutionIndex: 66
    SolutionNameMin: Cijk_Ailk_Bjlk_SB_GB_MT32x32x32_MI16x16x4x1_SN_1LDSB0_EPS1_GRVW1_NLCA1_NLCB1_PGR1_SRVW2_TT1_16_WG32_8_1_WGM15
    SolutionIndex: 67
    SolutionNameMin: Cijk_Ailk_Bjlk_SB_GB_MT64x32x8_MI16x16x4x1_SN_1LDSB0_EPS0_GRVW2_NLCA1_NLCB1_PGR2_SRVW2_TT2_16_WG32_8_1_WGM15
    SolutionIndex: 68
    SolutionNameMin: Cijk_Ailk_Bjlk_SB_GB_MT64x64x8_MI32x32x2x1_SN_1LDSB0_EPS0_GRVW2_NLCA1_NLCB1_PGR2_SRVW2_TT1_32_WG64_4_1_WGM15
    SolutionIndex: 69
    SolutionNameMin: Cijk_Ailk_Bjlk_SB_GB_MT64x128x8_MI32x32x2x1_SN_1LDSB0_EPS0_GRVW2_NLCA1_NLCB1_PGR2_SRVW2_TT1_64_WG64_4_1_WGM15
    SolutionIndex: 70
    SolutionNameMin: Cijk_Ailk_Bjlk_SB_GB_MT64x32x16_MI16x16x4x1_SN_1LDSB0_EPS1_GRVW2_NLCA1_NLCB1_PGR1_SRVW2_TT2_16_WG32_8_1_WGM15
    SolutionIndex: 71
    SolutionNameMin: Cijk_Ailk_Bjlk_SB_GB_MT64x64x16_MI32x32x2x1_SN_1LDSB0_EPS1_GRVW2_NLCA1_NLCB1_PGR1_SRVW2_TT1_32_WG64_4_1_WGM15
    SolutionIndex: 72
    SolutionNameMin: Cijk_Ailk_Bjlk_SB_GB_MT64x32x16_MI16x16x4x1_SN_1LDSB0_EPS0_GRVW2_NLCA1_NLCB1_PGR2_SRVW2_TT2_16_WG32_8_1_WGM15
    SolutionIndex: 73
    SolutionNameMin: Cijk_Ailk_Bjlk_SB_GB_MT64x64x16_MI32x32x2x1_SN_1LDSB0_EPS0_GRVW2_NLCA1_NLCB1_PGR2_SRVW2_TT1_32_WG64_4_1_WGM15
    SolutionIndex: 74
    SolutionNameMin: Cijk_Ailk_Bjlk_SB_GB_MT32x32x32_MI16x16x4x1_SN_1LDSB0_EPS1_GRVW2_NLCA1_NLCB1_PGR1_SRVW2_TT1_16_WG32_8_1_WGM15
    SolutionIndex: 75
    SolutionNameMin: Cijk_Ailk_Bjlk_SB_GB_MT32x32x32_MI16x16x4x1_SN_1LDSB0_EPS0_GRVW2_NLCA1_NLCB1_PGR2_SRVW2_TT1_16_WG32_8_1_WGM15
    SolutionIndex: 76
    SolutionNameMin: Cijk_Ailk_Bjlk_SB_GB_MT64x32x8_MI16x16x4x1_SN_1LDSB0_EPS0_GRVW4_NLCA1_NLCB1_PGR2_SRVW2_TT2_16_WG32_8_1_WGM15
    SolutionIndex: 77
    SolutionNameMin: Cijk_Ailk_Bjlk_SB_GB_MT64x64x8_MI32x32x2x1_SN_1LDSB0_EPS0_GRVW4_NLCA1_NLCB1_PGR2_SRVW2_TT1_32_WG64_4_1_WGM15
    SolutionIndex: 78
    SolutionNameMin: Cijk_Ailk_Bjlk_SB_GB_MT64x128x8_MI32x32x2x1_SN_1LDSB0_EPS0_GRVW4_NLCA1_NLCB1_PGR2_SRVW2_TT1_64_WG64_4_1_WGM15
    SolutionIndex: 79
    SolutionNameMin: Cijk_Ailk_Bjlk_SB_GB_MT64x64x16_MI32x32x2x1_SN_1LDSB0_EPS1_GRVW4_NLCA1_NLCB1_PGR1_SRVW2_TT1_32_WG64_4_1_WGM15
    SolutionIndex: 80
    SolutionNameMin: Cijk_Ailk_Bjlk_SB_GB_MT64x128x16_MI32x32x2x1_SN_1LDSB0_EPS1_GRVW4_NLCA1_NLCB1_PGR1_SRVW2_TT1_64_WG64_4_1_WGM15
    SolutionIndex: 81
    SolutionNameMin: Cijk_Ailk_Bjlk_SB_GB_MT32x32x16_MI16x16x4x1_SN_1LDSB0_EPS0_GRVW4_NLCA1_NLCB1_PGR2_SRVW2_TT1_16_WG32_8_1_WGM15
    SolutionIndex: 82
    SolutionNameMin: Cijk_Ailk_Bjlk_SB_GB_MT64x32x16_MI16x16x4x1_SN_1LDSB0_EPS0_GRVW4_NLCA1_NLCB1_PGR2_SRVW2_TT2_16_WG32_8_1_WGM15
    SolutionIndex: 83
    SolutionNameMin: Cijk_Ailk_Bjlk_SB_GB_MT64x64x16_MI32x32x2x1_SN_1LDSB0_EPS0_GRVW4_NLCA1_NLCB1_PGR2_SRVW2_TT1_32_WG64_4_1_WGM15
    SolutionIndex: 84
    SolutionNameMin: Cijk_Ailk_Bjlk_SB_GB_MT32x32x32_MI16x16x4x1_SN_1LDSB0_EPS1_GRVW4_NLCA1_NLCB1_PGR1_SRVW2_TT1_16_WG32_8_1_WGM15
    SolutionIndex: 85
    SolutionNameMin: Cijk_Ailk_Bjlk_SB_GB_MT64x32x32_MI16x16x4x1_SN_1LDSB0_EPS1_GRVW4_NLCA1_NLCB1_PGR1_SRVW2_TT2_16_WG32_8_1_WGM15
    SolutionIndex: 86
    SolutionNameMin: Cijk_Ailk_Bjlk_SB_GB_MT64x64x32_MI32x32x2x1_SN_1LDSB0_EPS1_GRVW4_NLCA1_NLCB1_PGR1_SRVW2_TT1_32_WG64_4_1_WGM15
    SolutionIndex: 87
    SolutionNameMin: Cijk_Ailk_Bjlk_SB_GB_MT32x32x32_MI16x16x4x1_SN_1LDSB0_EPS0_GRVW4_NLCA1_NLCB1_PGR2_SRVW2_TT1_16_WG32_8_1_WGM15
    SolutionIndex: 88
    SolutionNameMin: Cijk_Ailk_Bjlk_SB_GB_MT64x32x32_MI16x16x4x1_SN_1LDSB0_EPS0_GRVW4_NLCA1_NLCB1_PGR2_SRVW2_TT2_16_WG32_8_1_WGM15
    SolutionIndex: 89
    SolutionNameMin: Cijk_Ailk_Bjlk_SB_GB_MT64x64x32_MI32x32x2x1_SN_1LDSB0_EPS0_GRVW4_NLCA1_NLCB1_PGR2_SRVW2_TT1_32_WG64_4_1_WGM15
    SolutionIndex: 90
    SolutionNameMin: Cijk_Ailk_Bjlk_SB_GB_MT16x16x4_MI16x16x4x1_SN_1LDSB0_EPS1_GRVW1_NLCA1_NLCB1_PGR1_SRVW2_TT1_16_WG16_4_1_WGM1
    SolutionIndex: 91
    SolutionNameMin: Cijk_Ailk_Bjlk_SB_GB_MT16x16x8_MI16x16x4x1_SN_1LDSB0_EPS1_GRVW1_NLCA1_NLCB1_PGR1_SRVW2_TT1_16_WG16_4_1_WGM1
    SolutionIndex: 92
    SolutionNameMin: Cijk_Ailk_Bjlk_SB_GB_MT32x32x8_MI32x32x2x1_SN_1LDSB0_EPS1_GRVW1_NLCA1_NLCB1_PGR1_SRVW2_TT1_32_WG32_2_1_WGM1
    SolutionIndex: 93
    SolutionNameMin: Cijk_Ailk_Bjlk_SB_GB_MT32x32x8_MI32x32x2x1_SN_1LDSB0_EPS0_GRVW1_NLCA1_NLCB1_PGR2_SRVW2_TT1_32_WG32_2_1_WGM1
    SolutionIndex: 94
    SolutionNameMin: Cijk_Ailk_Bjlk_SB_GB_MT16x16x16_MI16x16x4x1_SN_1LDSB0_EPS1_GRVW1_NLCA1_NLCB1_PGR1_SRVW2_TT1_16_WG16_4_1_WGM1
    SolutionIndex: 95
    SolutionNameMin: Cijk_Ailk_Bjlk_SB_GB_MT16x16x16_MI16x16x4x1_SN_1LDSB0_EPS0_GRVW1_NLCA1_NLCB1_PGR2_SRVW2_TT1_16_WG16_4_1_WGM1
    SolutionIndex: 96
    SolutionNameMin: Cijk_Ailk_Bjlk_SB_GB_MT32x32x8_MI32x32x2x1_SN_1LDSB0_EPS0_GRVW1_NLCA1_NLCB1_PGR2_SRVW2_TT1_32_WG32_2_1_WGM2
    SolutionIndex: 97
    SolutionNameMin: Cijk_Ailk_Bjlk_SB_GB_MT16x16x16_MI16x16x4x1_SN_1LDSB0_EPS1_GRVW1_NLCA1_NLCB1_PGR1_SRVW2_TT1_16_WG16_4_1_WGM2
    SolutionIndex: 98
    SolutionNameMin: Cijk_Ailk_Bjlk_SB_GB_MT16x16x16_MI16x16x4x1_SN_1LDSB0_EPS0_GRVW1_NLCA1_NLCB1_PGR2_SRVW2_TT1_16_WG16_4_1_WGM2
    SolutionIndex: 99
    SolutionNameMin: Cijk_Ailk_Bjlk_SB_GB_MT16x16x16_MI16x16x4x1_SN_1LDSB0_EPS1_GRVW4_NLCA1_NLCB1_PGR1_SRVW2_TT1_16_WG16_4_1_WGM2
    SolutionIndex: 100
    SolutionNameMin: Cijk_Ailk_Bjlk_SB_GB_MT16x16x8_MI16x16x4x1_SN_1LDSB0_EPS1_GRVW1_NLCA1_NLCB1_PGR1_SRVW2_TT1_16_WG16_4_1_WGM15
    SolutionIndex: 101
    SolutionNameMin: Cijk_Ailk_Bjlk_SB_GB_MT32x32x8_MI32x32x2x1_SN_1LDSB0_EPS1_GRVW1_NLCA1_NLCB1_PGR1_SRVW2_TT1_32_WG32_2_1_WGM15
    SolutionIndex: 102
    SolutionNameMin: Cijk_Ailk_Bjlk_SB_GB_MT32x32x8_MI32x32x2x1_SN_1LDSB0_EPS0_GRVW1_NLCA1_NLCB1_PGR2_SRVW2_TT1_32_WG32_2_1_WGM15
    SolutionIndex: 103
    SolutionNameMin: Cijk_Ailk_Bjlk_SB_GB_MT96x96x8_MI16x16x4x1_SN_1LDSB0_EPS0_GRVW1_NLCA3_NLCB3_PGR2_SRVW0_TT3_48_WG32_8_1_WGM2
    SolutionIndex: 104
    SolutionNameMin: Cijk_Ailk_Bjlk_SB_GB_MT64x256x8_MI32x32x2x1_SN_1LDSB1_EPS1_GRVW4_NLCA1_NLCB1_PGR1_SRVW2_TT1_128_WG64_4_1_WGM1
    SolutionIndex: 105
    SolutionNameMin: Cijk_Ailk_Bjlk_SB_GB_MT64x256x8_MI32x32x2x1_SN_1LDSB1_EPS0_GRVW4_NLCA1_NLCB1_PGR2_SRVW2_TT1_128_WG64_4_1_WGM1
    SolutionIndex: 106
    SolutionNameMin: Cijk_Ailk_Bjlk_SB_GB_MT64x256x8_MI32x32x2x1_SN_1LDSB1_EPS1_GRVW1_NLCA1_NLCB4_PGR1_SRVW2_TT1_128_WG64_4_1_WGM2
    SolutionIndex: 107
    SolutionNameMin: Cijk_Ailk_Bjlk_SB_GB_MT64x256x8_MI32x32x2x1_SN_1LDSB1_EPS1_GRVW4_NLCA1_NLCB1_PGR1_SRVW2_TT1_128_WG64_4_1_WGM2
    SolutionIndex: 108
    SolutionNameMin: Cijk_Ailk_Bjlk_SB_GB_MT64x256x8_MI32x32x2x1_SN_1LDSB1_EPS0_GRVW4_NLCA1_NLCB1_PGR2_SRVW2_TT1_128_WG64_4_1_WGM2
    SolutionIndex: 109
    SolutionNameMin: Cijk_Ailk_Bjlk_SB_GB_MT64x256x8_MI32x32x2x1_SN_1LDSB1_EPS1_GRVW4_NLCA1_NLCB1_PGR1_SRVW2_TT1_128_WG64_4_1_WGM15
- - - [192, 192, 1000, 32, 192, 192, 192, 192]
    - [65, 10947.0]
  - - [1536, 1536, 168, 32, 1536, 1536, 1536, 1536]
    - [78, 12940.0]
  - - [1536, 32, 168, 1536, 1536, 1536, 1536, 32]
    - [57, 15231.0]
  - - [32, 1536, 168, 32, 32, 32, 32, 1536]
    - [0, 7088.0]
  - - [384, 384, 1024, 384, 384, 384, 384, 384]
    - [21, 30676.0]
  - - [1, 1, 1000, 1, 1, 1, 1, 1]
    - [90, 0.0]
  - - [2, 2, 1000, 2, 2, 2, 2, 2]
    - [90, 2.0]
  - - [3, 3, 1000, 3, 3, 3, 3, 3]
    - [94, 7.0]
  - - [4, 4, 1000, 4, 4, 4, 4, 4]
    - [90, 16.0]
  - - [5, 5, 1000, 5, 5, 5, 5, 5]
    - [90, 29.0]
  - - [6, 6, 1000, 6, 6, 6, 6, 6]
    - [91, 51.0]
  - - [7, 7, 1000, 7, 7, 7, 7, 7]
    - [91, 79.0]
  - - [8, 8, 1000, 8, 8, 8, 8, 8]
    - [100, 123.0]
  - - [9, 9, 1000, 9, 9, 9, 9, 9]
    - [91, 160.0]
  - - [10, 10, 1000, 10, 10, 10, 10, 10]
    - [95, 223.0]
  - - [11, 11, 1000, 11, 11, 11, 11, 11]
    - [97, 292.0]
  - - [12, 12, 1000, 12, 12, 12, 12, 12]
    - [94, 379.0]
  - - [13, 13, 1000, 13, 13, 13, 13, 13]
    - [94, 473.0]
  - - [14, 14, 1000, 14, 14, 14, 14, 14]
    - [98, 591.0]
  - - [15, 15, 1000, 15, 15, 15, 15, 15]
    - [94, 703.0]
  - - [16, 16, 1000, 16, 16, 16, 16, 16]
    - [99, 966.0]
  - - [17, 17, 1000, 17, 17, 17, 17, 17]
    - [101, 731.0]
  - - [18, 18, 1000, 18, 18, 18, 18, 18]
    - [93, 858.0]
  - - [19, 19, 1000, 19, 19, 19, 19, 19]
    - [92, 985.0]
  - - [20, 20, 1000, 20, 20, 20, 20, 20]
    - [93, 1149.0]
  - - [21, 21, 1000, 21, 21, 21, 21, 21]
    - [93, 1286.0]
  - - [22, 22, 1000, 22, 22, 22, 22, 22]
    - [96, 1447.0]
  - - [23, 23, 1000, 23, 23, 23, 23, 23]
    - [96, 1635.0]
  - - [24, 24, 1000, 24, 24, 24, 24, 24]
    - [2, 1838.0]
  - - [25, 25, 1000, 25, 25, 25, 25, 25]
    - [7, 1973.0]
  - - [26, 26, 1000, 26, 26, 26, 26, 26]
    - [63, 2197.0]
  - - [27, 27, 1000, 27, 27, 27, 27, 27]
    - [38, 2412.0]
  - - [28, 28, 1000, 28, 28, 28, 28, 28]
    - [62, 2690.0]
  - - [29, 29, 1000, 29, 29, 29, 29, 29]
    - [36, 2849.0]
  - - [30, 30, 1000, 30, 30, 30, 30, 30]
    - [36, 2961.0]
  - - [31, 31, 1000, 31, 31, 31, 31, 31]
    - [38, 3238.0]
  - - [32, 32, 1000, 32, 32, 32, 32, 32]
    - [102, 4055.0]
  - - [33, 33, 1000, 33, 33, 33, 33, 33]
    - [3, 2089.0]
  - - [34, 34, 1000, 34, 34, 34, 34, 34]
    - [3, 2317.0]
  - - [35, 35, 1000, 35, 35, 35, 35, 35]
    - [3, 2481.0]
  - - [36, 36, 1000, 36, 36, 36, 36, 36]
    - [3, 2675.0]
  - - [37, 37, 1000, 37, 37, 37, 37, 37]
    - [59, 2802.0]
  - - [38, 38, 1000, 38, 38, 38, 38, 38]
    - [3, 3022.0]
  - - [39, 39, 1000, 39, 39, 39, 39, 39]
    - [33, 3077.0]
  - - [40, 40, 1000, 40, 40, 40, 40, 40]
    - [3, 3653.0]
  - - [41, 41, 1000, 41, 41, 41, 41, 41]
    - [33, 3545.0]
  - - [42, 42, 1000, 42, 42, 42, 42, 42]
    - [33, 3765.0]
  - - [43, 43, 1000, 43, 43, 43, 43, 43]
    - [3, 3975.0]
  - - [44, 44, 1000, 44, 44, 44, 44, 44]
    - [3, 4192.0]
  - - [45, 45, 1000, 45, 45, 45, 45, 45]
    - [9, 4127.0]
  - - [46, 46, 1000, 46, 46, 46, 46, 46]
    - [9, 4473.0]
  - - [47, 47, 1000, 47, 47, 47, 47, 47]
    - [59, 4719.0]
  - - [48, 48, 1000, 48, 48, 48, 48, 48]
    - [59, 5178.0]
  - - [49, 49, 1000, 49, 49, 49, 49, 49]
    - [59, 4985.0]
  - - [50, 50, 1000, 50, 50, 50, 50, 50]
    - [33, 5261.0]
  - - [51, 51, 1000, 51, 51, 51, 51, 51]
    - [33, 5366.0]
  - - [52, 52, 1000, 52, 52, 52, 52, 52]
    - [33, 5801.0]
  - - [53, 53, 1000, 53, 53, 53, 53, 53]
    - [59, 5816.0]
  - - [54, 54, 1000, 54, 54, 54, 54, 54]
    - [33, 5983.0]
  - - [55, 55, 1000, 55, 55, 55, 55, 55]
    - [33, 6245.0]
  - - [56, 56, 1000, 56, 56, 56, 56, 56]
    - [59, 6612.0]
  - - [57, 57, 1000, 57, 57, 57, 57, 57]
    - [3, 6448.0]
  - - [58, 58, 1000, 58, 58, 58, 58, 58]
    - [33, 6592.0]
  - - [59, 59, 1000, 59, 59, 59, 59, 59]
    - [59, 6920.0]
  - - [60, 60, 1000, 60, 60, 60, 60, 60]
    - [58, 7050.0]
  - - [61, 61, 1000, 61, 61, 61, 61, 61]
    - [1, 7275.0]
  - - [62, 62, 1000, 62, 62, 62, 62, 62]
    - [33, 7600.0]
  - - [63, 63, 1000, 63, 63, 63, 63, 63]
    - [3, 7775.0]
  - - [64, 64, 1000, 64, 64, 64, 64, 64]
    - [37, 8880.0]
  - - [65, 65, 1000, 65, 65, 65, 65, 65]
    - [41, 4774.0]
  - - [66, 66, 1000, 66, 66, 66, 66, 66]
    - [41, 4998.0]
  - - [67, 67, 1000, 67, 67, 67, 67, 67]
    - [45, 5143.0]
  - - [68, 68, 1000, 68, 68, 68, 68, 68]
    - [41, 5406.0]
  - - [69, 69, 1000, 69, 69, 69, 69, 69]
    - [41, 5382.0]
  - - [70, 70, 1000, 70, 70, 70, 70, 70]
    - [41, 5590.0]
  - - [71, 71, 1000, 71, 71, 71, 71, 71]
    - [76, 5678.0]
  - - [72, 72, 1000, 72, 72, 72, 72, 72]
    - [41, 6391.0]
  - - [73, 73, 1000, 73, 73, 73, 73, 73]
    - [76, 5909.0]
  - - [74, 74, 1000, 74, 74, 74, 74, 74]
    - [45, 6074.0]
  - - [75, 75, 1000, 75, 75, 75, 75, 75]
    - [67, 6132.0]
  - - [76, 76, 1000, 76, 76, 76, 76, 76]
    - [76, 6525.0]
  - - [77, 77, 1000, 77, 77, 77, 77, 77]
    - [41, 6320.0]
  - - [78, 78, 1000, 78, 78, 78, 78, 78]
    - [76, 6533.0]
  - - [79, 79, 1000, 79, 79, 79, 79, 79]
    - [41, 6570.0]
  - - [80, 80, 1000, 80, 80, 80, 80, 80]
    - [25, 8568.0]
  - - [81, 81, 1000, 81, 81, 81, 81, 81]
    - [47, 7022.0]
  - - [82, 82, 1000, 82, 82, 82, 82, 82]
    - [21, 7217.0]
  - - [83, 83, 1000, 83, 83, 83, 83, 83]
    - [21, 7346.0]
  - - [84, 84, 1000, 84, 84, 84, 84, 84]
    - [47, 7678.0]
  - - [85, 85, 1000, 85, 85, 85, 85, 85]
    - [21, 7762.0]
  - - [86, 86, 1000, 86, 86, 86, 86, 86]
    - [21, 7927.0]
  - - [87, 87, 1000, 87, 87, 87, 87, 87]
    - [5, 8086.0]
  - - [88, 88, 1000, 88, 88, 88, 88, 88]
    - [78, 9024.0]
  - - [89, 89, 1000, 89, 89, 89, 89, 89]
    - [21, 8614.0]
  - - [90, 90, 1000, 90, 90, 90, 90, 90]
    - [21, 8796.0]
  - - [91, 91, 1000, 91, 91, 91, 91, 91]
    - [47, 9005.0]
  - - [92, 92, 1000, 92, 92, 92, 92, 92]
    - [78, 9323.0]
  - - [93, 93, 1000, 93, 93, 93, 93, 93]
    - [78, 9362.0]
  - - [94, 94, 1000, 94, 94, 94, 94, 94]
    - [61, 9560.0]
  - - [95, 95, 1000, 95, 95, 95, 95, 95]
    - [5, 9664.0]
  - - [96, 96, 1000, 96, 96, 96, 96, 96]
    - [103, 13704.0]
  - - [97, 97, 1000, 97, 97, 97, 97, 97]
    - [61, 10025.0]
  - - [98, 98, 1000, 98, 98, 98, 98, 98]
    - [5, 10347.0]
  - - [99, 99, 1000, 99, 99, 99, 99, 99]
    - [5, 10565.0]
  - - [100, 100, 1000, 100, 100, 100, 100, 100]
    - [5, 10946.0]
  - - [101, 101, 1000, 101, 101, 101, 101, 101]
    - [35, 10841.0]
  - - [102, 102, 1000, 102, 102, 102, 102, 102]
    - [61, 11318.0]
  - - [103, 103, 1000, 103, 103, 103, 103, 103]
    - [5, 11585.0]
  - - [104, 104, 1000, 104, 104, 104, 104, 104]
    - [47, 12510.0]
  - - [105, 105, 1000, 105, 105, 105, 105, 105]
    - [5, 11813.0]
  - - [106, 106, 1000, 106, 106, 106, 106, 106]
    - [35, 12163.0]
  - - [107, 107, 1000, 107, 107, 107, 107, 107]
    - [61, 12329.0]
  - - [108, 108, 1000, 108, 108, 108, 108, 108]
    - [35, 12844.0]
  - - [109, 109, 1000, 109, 109, 109, 109, 109]
    - [35, 12848.0]
  - - [110, 110, 1000, 110, 110, 110, 110, 110]
    - [35, 13183.0]
  - - [111, 111, 1000, 111, 111, 111, 111, 111]
    - [61, 13090.0]
  - - [112, 112, 1000, 112, 112, 112, 112, 112]
    - [47, 14807.0]
  - - [113, 113, 1000, 113, 113, 113, 113, 113]
    - [35, 13653.0]
  - - [114, 114, 1000, 114, 114, 114, 114, 114]
    - [5, 14137.0]
  - - [115, 115, 1000, 115, 115, 115, 115, 115]
    - [47, 14579.0]
  - - [116, 116, 1000, 116, 116, 116, 116, 116]
    - [61, 14737.0]
  - - [117, 117, 1000, 117, 117, 117, 117, 117]
    - [5, 14874.0]
  - - [118, 118, 1000, 118, 118, 118, 118, 118]
    - [21, 15046.0]
  - - [119, 119, 1000, 119, 119, 119, 119, 119]
    - [78, 15187.0]
  - - [120, 120, 1000, 120, 120, 120, 120, 120]
    - [21, 15906.0]
  - - [121, 121, 1000, 121, 121, 121, 121, 121]
    - [78, 15966.0]
  - - [122, 122, 1000, 122, 122, 122, 122, 122]
    - [21, 16259.0]
  - - [123, 123, 1000, 123, 123, 123, 123, 123]
    - [21, 16404.0]
  - - [124, 124, 1000, 124, 124, 124, 124, 124]
    - [21, 16562.0]
  - - [125, 125, 1000, 125, 125, 125, 125, 125]
    - [21, 16688.0]
  - - [126, 126, 1000, 126, 126, 126, 126, 126]
    - [47, 16804.0]
  - - [127, 127, 1000, 127, 127, 127, 127, 127]
    - [21, 16746.0]
  - - [128, 128, 1000, 128, 128, 128, 128, 128]
    - [56, 18091.0]
  - - [129, 129, 1000, 129, 129, 129, 129, 129]
    - [27, 9851.0]
  - - [130, 130, 1000, 130, 130, 130, 130, 130]
    - [27, 10123.0]
  - - [131, 131, 1000, 131, 131, 131, 131, 131]
    - [27, 10207.0]
  - - [132, 132, 1000, 132, 132, 132, 132, 132]
    - [27, 10493.0]
  - - [133, 133, 1000, 133, 133, 133, 133, 133]
    - [27, 10447.0]
  - - [134, 134, 1000, 134, 134, 134, 134, 134]
    - [27, 10624.0]
  - - [135, 135, 1000, 135, 135, 135, 135, 135]
    - [27, 10605.0]
  - - [136, 136, 1000, 136, 136, 136, 136, 136]
    - [27, 10790.0]
  - - [137, 137, 1000, 137, 137, 137, 137, 137]
    - [27, 10625.0]
  - - [138, 138, 1000, 138, 138, 138, 138, 138]
    - [27, 10788.0]
  - - [139, 139, 1000, 139, 139, 139, 139, 139]
    - [73, 10850.0]
  - - [140, 140, 1000, 140, 140, 140, 140, 140]
    - [73, 11169.0]
  - - [141, 141, 1000, 141, 141, 141, 141, 141]
    - [44, 11177.0]
  - - [142, 142, 1000, 142, 142, 142, 142, 142]
    - [73, 11417.0]
  - - [143, 143, 1000, 143, 143, 143, 143, 143]
    - [73, 11476.0]
  - - [144, 144, 1000, 144, 144, 144, 144, 144]
    - [27, 13737.0]
  - - [145, 145, 1000, 145, 145, 145, 145, 145]
    - [27, 12413.0]
  - - [146, 146, 1000, 146, 146, 146, 146, 146]
    - [27, 12630.0]
  - - [147, 147, 1000, 147, 147, 147, 147, 147]
    - [51, 12641.0]
  - - [148, 148, 1000, 148, 148, 148, 148, 148]
    - [27, 13051.0]
  - - [149, 149, 1000, 149, 149, 149, 149, 149]
    - [27, 12853.0]
  - - [150, 150, 1000, 150, 150, 150, 150, 150]
    - [27, 13073.0]
  - - [32, 32, 8, 32, 32, 32, 32, 32]
    - [38, 67.0]
  - - [32, 32, 8, 64, 32, 32, 32, 32]
    - [75, 129.0]
  - - [32, 32, 8, 128, 32, 32, 32, 32]
    - [10, 187.0]
  - - [32, 32, 8, 256, 32, 32, 32, 32]
    - [31, 267.0]
  - - [32, 32, 8, 512, 32, 32, 32, 32]
    - [17, 413.0]
  - - [32, 32, 8, 1024, 32, 32, 32, 32]
    - [87, 549.0]
  - - [32, 32, 8, 2048, 32, 32, 32, 32]
    - [54, 634.0]
  - - [32, 64, 8, 32, 32, 32, 32, 64]
    - [10, 111.0]
  - - [32, 64, 8, 64, 32, 32, 32, 64]
    - [87, 193.0]
  - - [32, 64, 8, 128, 32, 32, 32, 64]
    - [87, 345.0]
  - - [32, 64, 8, 256, 32, 32, 32, 64]
    - [87, 570.0]
  - - [32, 64, 8, 512, 32, 32, 32, 64]
    - [87, 839.0]
  - - [32, 64, 8, 1024, 32, 32, 32, 64]
    - [31, 1104.0]
  - - [32, 64, 8, 2048, 32, 32, 32, 64]
    - [31, 1357.0]
  - - [32, 128, 8, 32, 32, 32, 32, 128]
    - [87, 218.0]
  - - [32, 128, 8, 64, 32, 32, 32, 128]
    - [81, 369.0]
  - - [32, 128, 8, 128, 32, 32, 32, 128]
    - [87, 699.0]
  - - [32, 128, 8, 256, 32, 32, 32, 128]
    - [31, 1104.0]
  - - [32, 128, 8, 512, 32, 32, 32, 128]
    - [87, 1719.0]
  - - [32, 128, 8, 1024, 32, 32, 32, 128]
    - [54, 2255.0]
  - - [32, 128, 8, 2048, 32, 32, 32, 128]
    - [87, 2769.0]
  - - [32, 256, 8, 32, 32, 32, 32, 256]
    - [87, 430.0]
  - - [32, 256, 8, 64, 32, 32, 32, 256]
    - [31, 760.0]
  - - [32, 256, 8, 128, 32, 32, 32, 256]
    - [87, 1311.0]
  - - [32, 256, 8, 256, 32, 32, 32, 256]
    - [87, 2330.0]
  - - [32, 256, 8, 512, 32, 32, 32, 256]
    - [87, 3438.0]
  - - [32, 256, 8, 1024, 32, 32, 32, 256]
    - [31, 4584.0]
  - - [32, 256, 8, 2048, 32, 32, 32, 256]
    - [87, 5519.0]
  - - [32, 512, 8, 32, 32, 32, 32, 512]
    - [10, 989.0]
  - - [32, 512, 8, 64, 32, 32, 32, 512]
    - [10, 1691.0]
  - - [32, 512, 8, 128, 32, 32, 32, 512]
    - [87, 2796.0]
  - - [32, 512, 8, 256, 32, 32, 32, 512]
    - [31, 4280.0]
  - - [32, 512, 8, 512, 32, 32, 32, 512]
    - [54, 5949.0]
  - - [32, 512, 8, 1024, 32, 32, 32, 512]
    - [54, 7696.0]
  - - [32, 512, 8, 2048, 32, 32, 32, 512]
    - [87, 8626.0]
  - - [32, 1024, 8, 32, 32, 32, 32, 1024]
    - [11, 1808.0]
  - - [32, 1024, 8, 64, 32, 32, 32, 1024]
    - [63, 2873.0]
  - - [32, 1024, 8, 128, 32, 32, 32, 1024]
    - [52, 4559.0]
  - - [32, 1024, 8, 256, 32, 32, 32, 1024]
    - [28, 6453.0]
  - - [32, 1024, 8, 512, 32, 32, 32, 1024]
    - [28, 8347.0]
  - - [32, 1024, 8, 1024, 32, 32, 32, 1024]
    - [25, 8996.0]
  - - [32, 1024, 8, 2048, 32, 32, 32, 1024]
    - [74, 10153.0]
  - - [32, 2048, 8, 32, 32, 32, 32, 2048]
    - [7, 2796.0]
  - - [32, 2048, 8, 64, 32, 32, 32, 2048]
    - [75, 4369.0]
  - - [32, 2048, 8, 128, 32, 32, 32, 2048]
    - [25, 6214.0]
  - - [32, 2048, 8, 256, 32, 32, 32, 2048]
    - [17, 7914.0]
  - - [32, 2048, 8, 512, 32, 32, 32, 2048]
    - [54, 9587.0]
  - - [32, 2048, 8, 1024, 32, 32, 32, 2048]
    - [54, 10404.0]
  - - [32, 2048, 8, 2048, 32, 32, 32, 2048]
    - [87, 10948.0]
  - - [64, 32, 8, 32, 64, 64, 64, 32]
    - [10, 111.0]
  - - [64, 32, 8, 64, 64, 64, 64, 32]
    - [11, 196.0]
  - - [64, 32, 8, 128, 64, 64, 64, 32]
    - [52, 340.0]
  - - [64, 32, 8, 256, 64, 64, 64, 32]
    - [87, 552.0]
  - - [64, 32, 8, 512, 64, 64, 64, 32]
    - [54, 846.0]
  - - [64, 32, 8, 1024, 64, 64, 64, 32]
    - [87, 1134.0]
  - - [64, 32, 8, 2048, 64, 64, 64, 32]
    - [31, 1349.0]
  - - [64, 64, 8, 32, 64, 64, 64, 64]
    - [87, 226.0]
  - - [64, 64, 8, 64, 64, 64, 64, 64]
    - [10, 369.0]
  - - [64, 64, 8, 128, 64, 64, 64, 64]
    - [87, 664.0]
  - - [64, 64, 8, 256, 64, 64, 64, 64]
    - [87, 1152.0]
  - - [64, 64, 8, 512, 64, 64, 64, 64]
    - [87, 1733.0]
  - - [64, 64, 8, 1024, 64, 64, 64, 64]
    - [87, 2292.0]
  - - [64, 64, 8, 2048, 64, 64, 64, 64]
    - [31, 2724.0]
  - - [64, 128, 8, 32, 64, 64, 64, 128]
    - [11, 452.0]
  - - [64, 128, 8, 64, 64, 64, 64, 128]
    - [87, 783.0]
  - - [64, 128, 8, 128, 64, 64, 64, 128]
    - [87, 1344.0]
  - - [64, 128, 8, 256, 64, 64, 64, 128]
    - [87, 2231.0]
  - - [64, 128, 8, 512, 64, 64, 64, 128]
    - [87, 3329.0]
  - - [64, 128, 8, 1024, 64, 64, 64, 128]
    - [87, 4534.0]
  - - [64, 128, 8, 2048, 64, 64, 64, 128]
    - [87, 5519.0]
  - - [64, 256, 8, 32, 64, 64, 64, 256]
    - [6, 1008.0]
  - - [64, 256, 8, 64, 64, 64, 64, 256]
    - [11, 1777.0]
  - - [64, 256, 8, 128, 64, 64, 64, 256]
    - [87, 2873.0]
  - - [64, 256, 8, 256, 64, 64, 64, 256]
    - [54, 4415.0]
  - - [64, 256, 8, 512, 64, 64, 64, 256]
    - [31, 6079.0]
  - - [64, 256, 8, 1024, 64, 64, 64, 256]
    - [87, 7803.0]
  - - [64, 256, 8, 2048, 64, 64, 64, 256]
    - [87, 9069.0]
  - - [64, 512, 8, 32, 64, 64, 64, 512]
    - [39, 1777.0]
  - - [64, 512, 8, 64, 64, 64, 64, 512]
    - [84, 3039.0]
  - - [64, 512, 8, 128, 64, 64, 64, 512]
    - [52, 4609.0]
  - - [64, 512, 8, 256, 64, 64, 64, 512]
    - [55, 6933.0]
  - - [64, 512, 8, 512, 64, 64, 64, 512]
    - [55, 8604.0]
  - - [64, 512, 8, 1024, 64, 64, 64, 512]
    - [53, 10552.0]
  - - [64, 512, 8, 2048, 64, 64, 64, 512]
    - [30, 11712.0]
  - - [64, 1024, 8, 32, 64, 64, 64, 1024]
    - [14, 2954.0]
  - - [64, 1024, 8, 64, 64, 64, 64, 1024]
    - [22, 4877.0]
  - - [64, 1024, 8, 128, 64, 64, 64, 1024]
    - [26, 7424.0]
  - - [64, 1024, 8, 256, 64, 64, 64, 1024]
    - [64, 9754.0]
  - - [64, 1024, 8, 512, 64, 64, 64, 1024]
    - [16, 11857.0]
  - - [64, 1024, 8, 1024, 64, 64, 64, 1024]
    - [73, 13724.0]
  - - [64, 1024, 8, 2048, 64, 64, 64, 1024]
    - [44, 14463.0]
  - - [64, 2048, 8, 32, 64, 64, 64, 2048]
    - [46, 5053.0]
  - - [64, 2048, 8, 64, 64, 64, 64, 2048]
    - [42, 7696.0]
  - - [64, 2048, 8, 128, 64, 64, 64, 2048]
    - [12, 10356.0]
  - - [64, 2048, 8, 256, 64, 64, 64, 2048]
    - [73, 14218.0]
  - - [64, 2048, 8, 512, 64, 64, 64, 2048]
    - [20, 15790.0]
  - - [64, 2048, 8, 1024, 64, 64, 64, 2048]
    - [86, 17185.0]
  - - [64, 2048, 8, 2048, 64, 64, 64, 2048]
    - [89, 18052.0]
  - - [128, 32, 8, 32, 128, 128, 128, 32]
    - [52, 222.0]
  - - [128, 32, 8, 64, 128, 128, 128, 32]
    - [52, 380.0]
  - - [128, 32, 8, 128, 128, 128, 128, 32]
    - [87, 690.0]
  - - [128, 32, 8, 256, 128, 128, 128, 32]
    - [87, 1116.0]
  - - [128, 32, 8, 512, 128, 128, 128, 32]
    - [31, 1664.0]
  - - [128, 32, 8, 1024, 128, 128, 128, 32]
    - [87, 2356.0]
  - - [128, 32, 8, 2048, 128, 128, 128, 32]
    - [87, 2778.0]
  - - [128, 64, 8, 32, 128, 128, 128, 64]
    - [10, 437.0]
  - - [128, 64, 8, 64, 128, 128, 128, 64]
    - [10, 738.0]
  - - [128, 64, 8, 128, 128, 128, 128, 64]
    - [84, 1344.0]
  - - [128, 64, 8, 256, 128, 128, 128, 64]
    - [31, 2208.0]
  - - [128, 64, 8, 512, 128, 128, 128, 64]
    - [87, 3383.0]
  - - [128, 64, 8, 1024, 128, 128, 128, 64]
    - [31, 4559.0]
  - - [128, 64, 8, 2048, 128, 128, 128, 64]
    - [87, 5611.0]
  - - [128, 128, 8, 32, 128, 128, 128, 128]
    - [25, 1008.0]
  - - [128, 128, 8, 64, 128, 128, 128, 128]
    - [11, 1777.0]
  - - [128, 128, 8, 128, 128, 128, 128, 128]
    - [54, 2954.0]
  - - [128, 128, 8, 256, 128, 128, 128, 128]
    - [31, 4237.0]
  - - [128, 128, 8, 512, 128, 128, 128, 128]
    - [54, 6035.0]
  - - [128, 128, 8, 1024, 128, 128, 128, 128]
    - [87, 7592.0]
  - - [128, 128, 8, 2048, 128, 128, 128, 128]
    - [87, 9295.0]
  - - [128, 256, 8, 32, 128, 128, 128, 256]
    - [66, 1808.0]
  - - [128, 256, 8, 64, 128, 128, 128, 256]
    - [81, 3084.0]
  - - [128, 256, 8, 128, 128, 128, 128, 256]
    - [25, 4766.0]
  - - [128, 256, 8, 256, 128, 128, 128, 256]
    - [85, 6503.0]
  - - [128, 256, 8, 512, 128, 128, 128, 256]
    - [50, 8516.0]
  - - [128, 256, 8, 1024, 128, 128, 128, 256]
    - [53, 10486.0]
  - - [128, 256, 8, 2048, 128, 128, 128, 256]
    - [53, 12005.0]
  - - [128, 512, 8, 32, 128, 128, 128, 512]
    - [14, 3084.0]
  - - [128, 512, 8, 64, 128, 128, 128, 512]
    - [70, 5115.0]
  - - [128, 512, 8, 128, 128, 128, 128, 512]
    - [48, 7358.0]
  - - [128, 512, 8, 256, 128, 128, 128, 512]
    - [73, 9869.0]
  - - [128, 512, 8, 512, 128, 128, 128, 512]
    - [16, 11984.0]
  - - [128, 512, 8, 1024, 128, 128, 128, 512]
    - [73, 13668.0]
  - - [128, 512, 8, 2048, 128, 128, 128, 512]
    - [16, 14765.0]
  - - [128, 1024, 8, 32, 128, 128, 128, 1024]
    - [77, 5115.0]
  - - [128, 1024, 8, 64, 128, 128, 128, 1024]
    - [79, 7696.0]
  - - [128, 1024, 8, 128, 128, 128, 128, 1024]
    - [68, 10552.0]
  - - [128, 1024, 8, 256, 128, 128, 128, 1024]
    - [34, 13210.0]
  - - [128, 1024, 8, 512, 128, 128, 128, 1024]
    - [42, 15978.0]
  - - [128, 1024, 8, 1024, 128, 128, 128, 1024]
    - [77, 17522.0]
  - - [128, 1024, 8, 2048, 128, 128, 128, 1024]
    - [77, 18487.0]
  - - [128, 2048, 8, 32, 128, 128, 128, 2048]
    - [83, 6820.0]
  - - [128, 2048, 8, 64, 128, 128, 128, 2048]
    - [69, 10421.0]
  - - [128, 2048, 8, 128, 128, 128, 128, 2048]
    - [51, 14218.0]
  - - [128, 2048, 8, 256, 128, 128, 128, 2048]
    - [83, 17076.0]
  - - [128, 2048, 8, 512, 128, 128, 128, 2048]
    - [73, 19973.0]
  - - [128, 2048, 8, 1024, 128, 128, 128, 2048]
    - [44, 21789.0]
  - - [128, 2048, 8, 2048, 128, 128, 128, 2048]
    - [27, 22577.0]
  - - [256, 32, 8, 32, 256, 256, 256, 32]
    - [52, 452.0]
  - - [256, 32, 8, 64, 256, 256, 256, 32]
    - [43, 760.0]
  - - [256, 32, 8, 128, 256, 256, 256, 32]
    - [31, 1311.0]
  - - [256, 32, 8, 256, 256, 256, 256, 32]
    - [31, 2208.0]
  - - [256, 32, 8, 512, 256, 256, 256, 32]
    - [54, 3303.0]
  - - [256, 32, 8, 1024, 256, 256, 256, 32]
    - [31, 4415.0]
  - - [256, 32, 8, 2048, 256, 256, 256, 32]
    - [54, 5555.0]
  - - [256, 64, 8, 32, 256, 256, 256, 64]
    - [38, 1028.0]
  - - [256, 64, 8, 64, 256, 256, 256, 64]
    - [11, 1748.0]
  - - [256, 64, 8, 128, 256, 256, 256, 64]
    - [28, 2834.0]
  - - [256, 64, 8, 256, 256, 256, 256, 64]
    - [54, 4462.0]
  - - [256, 64, 8, 512, 256, 256, 256, 64]
    - [54, 6168.0]
  - - [256, 64, 8, 1024, 256, 256, 256, 64]
    - [87, 7877.0]
  - - [256, 64, 8, 2048, 256, 256, 256, 64]
    - [31, 9093.0]
  - - [256, 128, 8, 32, 256, 256, 256, 128]
    - [87, 1840.0]
  - - [256, 128, 8, 64, 256, 256, 256, 128]
    - [28, 3130.0]
  - - [256, 128, 8, 128, 256, 256, 256, 128]
    - [43, 4877.0]
  - - [256, 128, 8, 256, 256, 256, 256, 128]
    - [84, 6991.0]
  - - [256, 128, 8, 512, 256, 256, 256, 128]
    - [81, 8830.0]
  - - [256, 128, 8, 1024, 256, 256, 256, 128]
    - [30, 10453.0]
  - - [256, 128, 8, 2048, 256, 256, 256, 128]
    - [53, 11899.0]
  - - [256, 256, 8, 32, 256, 256, 256, 256]
    - [19, 3039.0]
  - - [256, 256, 8, 64, 256, 256, 256, 256]
    - [22, 5115.0]
  - - [256, 256, 8, 128, 256, 256, 256, 256]
    - [44, 7358.0]
  - - [256, 256, 8, 256, 256, 256, 256, 256]
    - [49, 9168.0]
  - - [256, 256, 8, 512, 256, 256, 256, 256]
    - [44, 11941.0]
  - - [256, 256, 8, 1024, 256, 256, 256, 256]
    - [16, 13696.0]
  - - [256, 256, 8, 2048, 256, 256, 256, 256]
    - [44, 14589.0]
  - - [256, 512, 8, 32, 256, 256, 256, 512]
    - [68, 5178.0]
  - - [256, 512, 8, 64, 256, 256, 256, 512]
    - [34, 7626.0]
  - - [256, 512, 8, 128, 256, 256, 256, 512]
    - [46, 10824.0]
  - - [256, 512, 8, 256, 256, 256, 256, 512]
    - [34, 11984.0]
  - - [256, 512, 8, 512, 256, 256, 256, 512]
    - [42, 15643.0]
  - - [256, 512, 8, 1024, 256, 256, 256, 512]
    - [71, 17545.0]
  - - [256, 512, 8, 2048, 256, 256, 256, 512]
    - [30, 18526.0]
  - - [256, 1024, 8, 32, 256, 256, 256, 1024]
    - [78, 7424.0]
  - - [256, 1024, 8, 64, 256, 256, 256, 1024]
    - [23, 10618.0]
  - - [256, 1024, 8, 128, 256, 256, 256, 1024]
    - [80, 13752.0]
  - - [256, 1024, 8, 256, 256, 256, 256, 1024]
    - [24, 15903.0]
  - - [256, 1024, 8, 512, 256, 256, 256, 1024]
    - [83, 18957.0]
  - - [256, 1024, 8, 1024, 256, 256, 256, 1024]
    - [83, 21509.0]
  - - [256, 1024, 8, 2048, 256, 256, 256, 1024]
    - [83, 22855.0]
  - - [256, 2048, 8, 32, 256, 256, 256, 2048]
    - [78, 8693.0]
  - - [256, 2048, 8, 64, 256, 256, 256, 2048]
    - [78, 13981.0]
  - - [256, 2048, 8, 128, 256, 256, 256, 2048]
    - [47, 18187.0]
  - - [256, 2048, 8, 256, 256, 256, 256, 2048]
    - [78, 20032.0]
  - - [256, 2048, 8, 512, 256, 256, 256, 2048]
    - [78, 22787.0]
  - - [256, 2048, 8, 1024, 256, 256, 256, 2048]
    - [47, 24381.0]
  - - [256, 2048, 8, 2048, 256, 256, 256, 2048]
    - [69, 25128.0]
  - - [512, 32, 8, 32, 512, 512, 512, 32]
    - [11, 989.0]
  - - [512, 32, 8, 64, 512, 512, 512, 32]
    - [40, 1748.0]
  - - [512, 32, 8, 128, 512, 512, 512, 32]
    - [54, 2834.0]
  - - [512, 32, 8, 256, 512, 512, 512, 32]
    - [31, 4194.0]
  - - [512, 32, 8, 512, 512, 512, 512, 32]
    - [87, 5785.0]
  - - [512, 32, 8, 1024, 512, 512, 512, 32]
    - [31, 7232.0]
  - - [512, 32, 8, 2048, 512, 512, 512, 32]
    - [87, 8085.0]
  - - [512, 64, 8, 32, 512, 512, 512, 64]
    - [7, 1840.0]
  - - [512, 64, 8, 64, 512, 512, 512, 64]
    - [15, 3039.0]
  - - [512, 64, 8, 128, 512, 512, 512, 64]
    - [82, 4766.0]
  - - [512, 64, 8, 256, 512, 512, 512, 64]
    - [31, 6658.0]
  - - [512, 64, 8, 512, 512, 512, 512, 64]
    - [40, 8738.0]
  - - [512, 64, 8, 1024, 512, 512, 512, 64]
    - [86, 10324.0]
  - - [512, 64, 8, 2048, 512, 512, 512, 64]
    - [30, 11857.0]
  - - [512, 128, 8, 32, 512, 512, 512, 128]
    - [8, 3084.0]
  - - [512, 128, 8, 64, 512, 512, 512, 128]
    - [41, 4934.0]
  - - [512, 128, 8, 128, 512, 512, 512, 128]
    - [23, 7424.0]
  - - [512, 128, 8, 256, 512, 512, 512, 128]
    - [49, 9754.0]
  - - [512, 128, 8, 512, 512, 512, 512, 128]
    - [16, 11984.0]
  - - [512, 128, 8, 1024, 512, 512, 512, 128]
    - [16, 13696.0]
  - - [512, 128, 8, 2048, 512, 512, 512, 128]
    - [16, 14557.0]
  - - [512, 256, 8, 32, 512, 512, 512, 256]
    - [20, 5053.0]
  - - [512, 256, 8, 64, 512, 512, 512, 256]
    - [60, 7696.0]
  - - [512, 256, 8, 128, 512, 512, 512, 256]
    - [20, 11260.0]
  - - [512, 256, 8, 256, 512, 512, 512, 256]
    - [42, 13981.0]
  - - [512, 256, 8, 512, 512, 512, 512, 256]
    - [42, 15865.0]
  - - [512, 256, 8, 1024, 512, 512, 512, 256]
    - [68, 17637.0]
  - - [512, 256, 8, 2048, 512, 512, 512, 256]
    - [77, 18590.0]
  - - [512, 512, 8, 32, 512, 512, 512, 512]
    - [13, 7049.0]
  - - [512, 512, 8, 64, 512, 512, 512, 512]
    - [78, 10486.0]
  - - [512, 512, 8, 128, 512, 512, 512, 512]
    - [27, 14980.0]
  - - [512, 512, 8, 256, 512, 512, 512, 512]
    - [83, 18798.0]
  - - [512, 512, 8, 512, 512, 512, 512, 512]
    - [83, 21004.0]
  - - [512, 512, 8, 1024, 512, 512, 512, 512]
    - [83, 22596.0]
  - - [512, 512, 8, 2048, 512, 512, 512, 512]
    - [83, 23651.0]
  - - [512, 1024, 8, 32, 512, 512, 512, 1024]
    - [21, 8830.0]
  - - [512, 1024, 8, 64, 512, 512, 512, 1024]
    - [21, 14158.0]
  - - [512, 1024, 8, 128, 512, 512, 512, 1024]
    - [21, 18798.0]
  - - [512, 1024, 8, 256, 512, 512, 512, 1024]
    - [21, 22444.0]
  - - [512, 1024, 8, 512, 512, 512, 512, 1024]
    - [78, 23081.0]
  - - [512, 1024, 8, 1024, 512, 512, 512, 1024]
    - [78, 24798.0]
  - - [512, 1024, 8, 2048, 512, 512, 512, 1024]
    - [21, 25474.0]
  - - [512, 2048, 8, 32, 512, 512, 512, 2048]
    - [21, 10421.0]
  - - [512, 2048, 8, 64, 512, 512, 512, 2048]
    - [105, 16289.0]
  - - [512, 2048, 8, 128, 512, 512, 512, 2048]
    - [47, 21338.0]
  - - [512, 2048, 8, 256, 512, 512, 512, 2048]
    - [21, 24097.0]
  - - [512, 2048, 8, 512, 512, 512, 512, 2048]
    - [69, 25134.0]
  - - [512, 2048, 8, 1024, 512, 512, 512, 2048]
    - [78, 27080.0]
  - - [512, 2048, 8, 2048, 512, 512, 512, 2048]
    - [78, 27458.0]
  - - [1024, 32, 8, 32, 1024, 1024, 1024, 32]
    - [11, 1777.0]
  - - [1024, 32, 8, 64, 1024, 1024, 1024, 32]
    - [29, 2913.0]
  - - [1024, 32, 8, 128, 1024, 1024, 1024, 32]
    - [28, 4559.0]
  - - [1024, 32, 8, 256, 1024, 1024, 1024, 32]
    - [29, 6260.0]
  - - [1024, 32, 8, 512, 1024, 1024, 1024, 32]
    - [55, 8027.0]
  - - [1024, 32, 8, 1024, 1024, 1024, 1024, 32]
    - [88, 9506.0]
  - - [1024, 32, 8, 2048, 1024, 1024, 1024, 32]
    - [32, 10309.0]
  - - [1024, 64, 8, 32, 1024, 1024, 1024, 64]
    - [82, 3084.0]
  - - [1024, 64, 8, 64, 1024, 1024, 1024, 64]
    - [8, 4934.0]
  - - [1024, 64, 8, 128, 1024, 1024, 1024, 64]
    - [16, 7109.0]
  - - [1024, 64, 8, 256, 1024, 1024, 1024, 64]
    - [72, 9533.0]
  - - [1024, 64, 8, 512, 1024, 1024, 1024, 64]
    - [16, 11815.0]
  - - [1024, 64, 8, 1024, 1024, 1024, 1024, 64]
    - [73, 13530.0]
  - - [1024, 64, 8, 2048, 1024, 1024, 1024, 64]
    - [44, 14324.0]
  - - [1024, 128, 8, 32, 1024, 1024, 1024, 128]
    - [77, 5115.0]
  - - [1024, 128, 8, 64, 1024, 1024, 1024, 128]
    - [12, 7989.0]
  - - [1024, 128, 8, 128, 1024, 1024, 1024, 128]
    - [77, 11111.0]
  - - [1024, 128, 8, 256, 1024, 1024, 1024, 128]
    - [4, 13263.0]
  - - [1024, 128, 8, 512, 1024, 1024, 1024, 128]
    - [12, 16055.0]
  - - [1024, 128, 8, 1024, 1024, 1024, 1024, 128]
    - [77, 17341.0]
  - - [1024, 128, 8, 2048, 1024, 1024, 1024, 128]
    - [53, 18187.0]
  - - [1024, 256, 8, 32, 1024, 1024, 1024, 256]
    - [21, 7358.0]
  - - [1024, 256, 8, 64, 1024, 1024, 1024, 256]
    - [79, 10618.0]
  - - [1024, 256, 8, 128, 1024, 1024, 1024, 256]
    - [51, 14463.0]
  - - [1024, 256, 8, 256, 1024, 1024, 1024, 256]
    - [44, 18236.0]
  - - [1024, 256, 8, 512, 1024, 1024, 1024, 256]
    - [51, 20939.0]
  - - [1024, 256, 8, 1024, 1024, 1024, 1024, 256]
    - [83, 22093.0]
  - - [1024, 256, 8, 2048, 1024, 1024, 1024, 256]
    - [51, 22739.0]
  - - [1024, 512, 8, 32, 1024, 1024, 1024, 512]
    - [69, 8830.0]
  - - [1024, 512, 8, 64, 1024, 1024, 1024, 512]
    - [21, 13981.0]
  - - [1024, 512, 8, 128, 1024, 1024, 1024, 512]
    - [47, 18745.0]
  - - [1024, 512, 8, 256, 1024, 1024, 1024, 512]
    - [47, 22295.0]
  - - [1024, 512, 8, 512, 1024, 1024, 1024, 512]
    - [47, 24010.0]
  - - [1024, 512, 8, 1024, 1024, 1024, 1024, 512]
    - [78, 24425.0]
  - - [1024, 512, 8, 2048, 1024, 1024, 1024, 512]
    - [78, 25384.0]
  - - [1024, 1024, 8, 32, 1024, 1024, 1024, 1024]
    - [21, 10585.0]
  - - [1024, 1024, 8, 64, 1024, 1024, 1024, 1024]
    - [105, 16570.0]
  - - [1024, 1024, 8, 128, 1024, 1024, 1024, 1024]
    - [47, 21648.0]
  - - [1024, 1024, 8, 256, 1024, 1024, 1024, 1024]
    - [21, 25229.0]
  - - [1024, 1024, 8, 512, 1024, 1024, 1024, 1024]
    - [78, 27238.0]
  - - [1024, 1024, 8, 1024, 1024, 1024, 1024, 1024]
    - [78, 28301.0]
  - - [1024, 1024, 8, 2048, 1024, 1024, 1024, 1024]
    - [78, 29126.0]
  - - [1024, 2048, 8, 32, 1024, 1024, 1024, 2048]
    - [106, 11984.0]
  - - [1024, 2048, 8, 64, 1024, 1024, 1024, 2048]
    - [105, 18851.0]
  - - [1024, 2048, 8, 128, 1024, 1024, 1024, 2048]
    - [105, 23444.0]
  - - [1024, 2048, 8, 256, 1024, 1024, 1024, 2048]
    - [104, 27197.0]
  - - [1024, 2048, 8, 512, 1024, 1024, 1024, 2048]
    - [104, 28264.0]
  - - [1024, 2048, 8, 1024, 1024, 1024, 1024, 2048]
    - [109, 28383.0]
  - - [1024, 2048, 8, 2048, 1024, 1024, 1024, 2048]
    - [109, 29401.0]
  - - [2048, 32, 8, 32, 2048, 2048, 2048, 32]
    - [82, 2913.0]
  - - [2048, 32, 8, 64, 2048, 2048, 2048, 32]
    - [8, 4609.0]
  - - [2048, 32, 8, 128, 2048, 2048, 2048, 32]
    - [82, 6933.0]
  - - [2048, 32, 8, 256, 2048, 2048, 2048, 32]
    - [82, 9479.0]
  - - [2048, 32, 8, 512, 2048, 2048, 2048, 32]
    - [82, 11260.0]
  - - [2048, 32, 8, 1024, 2048, 2048, 2048, 32]
    - [82, 12544.0]
  - - [2048, 32, 8, 2048, 2048, 2048, 2048, 32]
    - [50, 12336.0]
  - - [2048, 64, 8, 32, 2048, 2048, 2048, 64]
    - [20, 4993.0]
  - - [2048, 64, 8, 64, 2048, 2048, 2048, 64]
    - [46, 7490.0]
  - - [2048, 64, 8, 128, 2048, 2048, 2048, 64]
    - [20, 10356.0]
  - - [2048, 64, 8, 256, 2048, 2048, 2048, 64]
    - [34, 13530.0]
  - - [2048, 64, 8, 512, 2048, 2048, 2048, 64]
    - [12, 15607.0]
  - - [2048, 64, 8, 1024, 2048, 2048, 2048, 64]
    - [30, 16947.0]
  - - [2048, 64, 8, 2048, 2048, 2048, 2048, 64]
    - [27, 16893.0]
  - - [2048, 128, 8, 32, 2048, 2048, 2048, 128]
    - [21, 6991.0]
  - - [2048, 128, 8, 64, 2048, 2048, 2048, 128]
    - [78, 10230.0]
  - - [2048, 128, 8, 128, 2048, 2048, 2048, 128]
    - [51, 14526.0]
  - - [2048, 128, 8, 256, 2048, 2048, 2048, 128]
    - [16, 17801.0]
  - - [2048, 128, 8, 512, 2048, 2048, 2048, 128]
    - [16, 20554.0]
  - - [2048, 128, 8, 1024, 2048, 2048, 2048, 128]
    - [16, 21985.0]
  - - [2048, 128, 8, 2048, 2048, 2048, 2048, 128]
    - [51, 21967.0]
  - - [2048, 256, 8, 32, 2048, 2048, 2048, 256]
    - [21, 8560.0]
  - - [2048, 256, 8, 64, 2048, 2048, 2048, 256]
    - [13, 13476.0]
  - - [2048, 256, 8, 128, 2048, 2048, 2048, 256]
    - [47, 18693.0]
  - - [2048, 256, 8, 256, 2048, 2048, 2048, 256]
    - [21, 21967.0]
  - - [2048, 256, 8, 512, 2048, 2048, 2048, 256]
    - [78, 24032.0]
  - - [2048, 256, 8, 1024, 2048, 2048, 2048, 256]
    - [47, 25006.0]
  - - [2048, 256, 8, 2048, 2048, 2048, 2048, 256]
    - [80, 24780.0]
  - - [2048, 512, 8, 32, 2048, 2048, 2048, 512]
    - [18, 10324.0]
  - - [2048, 512, 8, 64, 2048, 2048, 2048, 512]
    - [107, 16055.0]
  - - [2048, 512, 8, 128, 2048, 2048, 2048, 512]
    - [21, 21237.0]
  - - [2048, 512, 8, 256, 2048, 2048, 2048, 512]
    - [47, 25253.0]
  - - [2048, 512, 8, 512, 2048, 2048, 2048, 512]
    - [21, 27363.0]
  - - [2048, 512, 8, 1024, 2048, 2048, 2048, 512]
    - [21, 28153.0]
  - - [2048, 512, 8, 2048, 2048, 2048, 2048, 512]
    - [78, 28466.0]
  - - [2048, 1024, 8, 32, 2048, 2048, 2048, 1024]
    - [104, 12005.0]
  - - [2048, 1024, 8, 64, 2048, 2048, 2048, 1024]
    - [104, 18538.0]
  - - [2048, 1024, 8, 128, 2048, 2048, 2048, 1024]
    - [108, 23609.0]
  - - [2048, 1024, 8, 256, 2048, 2048, 2048, 1024]
    - [104, 27308.0]
  - - [2048, 1024, 8, 512, 2048, 2048, 2048, 1024]
    - [104, 28580.0]
  - - [2048, 1024, 8, 1024, 2048, 2048, 2048, 1024]
    - [109, 29063.0]
  - - [2048, 1024, 8, 2048, 2048, 2048, 2048, 1024]
    - [78, 29547.0]
  - - [2048, 2048, 8, 32, 2048, 2048, 2048, 2048]
    - [104, 12710.0]
  - - [2048, 2048, 8, 64, 2048, 2048, 2048, 2048]
    - [105, 18311.0]
  - - [2048, 2048, 8, 128, 2048, 2048, 2048, 2048]
    - [109, 22855.0]
  - - [2048, 2048, 8, 256, 2048, 2048, 2048, 2048]
    - [109, 28145.0]
  - - [2048, 2048, 8, 512, 2048, 2048, 2048, 2048]
    - [109, 29337.0]
  - - [2048, 2048, 8, 1024, 2048, 2048, 2048, 2048]
    - [109, 29772.0]
  - - [2048, 2048, 8, 2048, 2048, 2048, 2048, 2048]
    - [109, 30022.0]
- null
