library/src/blas3/Tensile/Logic/aldebaran/arcturus_Cijk_Alik_Bjlk_BBH_GB.yaml
- {MinimumRequiredVersion: 4.25.0}
- arcturus
- gfx908
- [Device 7380, Device 7388, Device 738c, Device 7390]
    SolutionIndex: 0
    SolutionNameMin: Cijk_Alik_Bjlk_BBH_GB_MT32x32x64_MI16x16x8x1_SN_EPS1_GRVW8_PGR1_SU0_SUS128_TT1_16_WGM1
    SolutionIndex: 1
    SolutionNameMin: Cijk_Alik_Bjlk_BBH_GB_MT64x32x64_MI16x16x8x1_SN_EPS1_GRVW8_PGR1_SU0_SUS128_TT2_16_WGM1
    SolutionIndex: 2
    SolutionNameMin: Cijk_Alik_Bjlk_BBH_GB_MT32x32x64_MI16x16x8x1_SN_EPS0_GRVW8_PGR2_SU0_SUS128_TT1_16_WGM1
    SolutionIndex: 3
    SolutionNameMin: Cijk_Alik_Bjlk_BBH_GB_MT64x32x64_MI16x16x8x1_SN_EPS0_GRVW8_PGR2_SU0_SUS128_TT2_16_WGM1
    SolutionIndex: 4
    SolutionNameMin: Cijk_Alik_Bjlk_BBH_GB_MT32x32x64_MI16x16x8x1_SN_EPS1_GRVW4_PGR1_SU0_SUS256_TT1_16_WGM1
    SolutionIndex: 5
    SolutionNameMin: Cijk_Alik_Bjlk_BBH_GB_MT32x32x64_MI16x16x8x1_SN_EPS1_GRVW8_PGR1_SU0_SUS256_TT1_16_WGM1
    SolutionIndex: 6
    SolutionNameMin: Cijk_Alik_Bjlk_BBH_GB_MT32x32x64_MI16x16x8x1_SN_EPS0_GRVW8_PGR2_SU0_SUS256_TT1_16_WGM1
    SolutionIndex: 7
    SolutionNameMin: Cijk_Alik_Bjlk_BBH_GB_MT32x32x64_MI16x16x8x1_SN_EPS0_GRVW8_PGR2_SU32_SUS256_TT1_16_WGM1
    SolutionIndex: 8
    SolutionNameMin: Cijk_Alik_Bjlk_BBH_GB_MT32x32x64_MI16x16x8x1_SN_EPS0_GRVW8_PGR2_SU0_SUS128_TT1_16_WGM15
    SolutionIndex: 9
    SolutionNameMin: Cijk_Alik_Bjlk_BBH_GB_MT64x32x64_MI16x16x8x1_SN_EPS0_GRVW8_PGR2_SU0_SUS128_TT2_16_WGM15
    SolutionIndex: 10
    SolutionNameMin: Cijk_Alik_Bjlk_BBH_GB_MT64x32x64_MI16x16x8x1_SN_EPS1_GRVW8_PGR1_SU0_SUS256_TT2_16_WGM15
    SolutionIndex: 11
    SolutionNameMin: Cijk_Alik_Bjlk_BBH_GB_MT32x32x64_MI16x16x8x1_SN_EPS0_GRVW8_PGR2_SU0_SUS256_TT1_16_WGM15
- - - [32, 32, 8, 128, 32, 32, 128, 32]
    - [6, 160.0]
  - - [128, 128, 8, 128, 128, 128, 128, 128]
    - [5, 2439.0]
  - - [256, 256, 8, 128, 256, 256, 128, 256]
    - [1, 6404.0]
  - - [512, 512, 8, 128, 512, 512, 128, 512]
    - [3, 13640.0]
  - - [32, 32, 8, 512, 32, 32, 512, 32]
    - [6, 490.0]
  - - [128, 128, 8, 512, 128, 128, 512, 128]
    - [8, 7170.0]
  - - [256, 256, 8, 512, 256, 256, 512, 256]
    - [9, 14717.0]
  - - [512, 512, 8, 512, 512, 512, 512, 512]
    - [10, 26525.0]
  - - [32, 32, 8, 1024, 32, 32, 1024, 32]
    - [8, 713.0]
  - - [128, 128, 8, 1024, 128, 128, 1024, 128]
    - [2, 10107.0]
  - - [256, 256, 8, 1024, 256, 256, 1024, 256]
    - [1, 18487.0]
  - - [512, 512, 8, 1024, 512, 512, 1024, 512]
    - [10, 30026.0]
  - - [32, 128, 8, 128, 32, 32, 128, 128]
    - [4, 639.0]
  - - [32, 256, 8, 128, 32, 32, 128, 256]
    - [5, 1263.0]
  - - [32, 512, 8, 128, 32, 32, 128, 512]
    - [11, 2558.0]
  - - [32, 128, 8, 512, 32, 32, 512, 128]
    - [11, 1889.0]
  - - [32, 256, 8, 512, 32, 32, 512, 256]
    - [11, 3813.0]
  - - [32, 512, 8, 512, 32, 32, 512, 512]
    - [11, 7294.0]
  - - [32, 128, 8, 1024, 32, 32, 1024, 128]
    - [8, 2778.0]
  - - [32, 256, 8, 1024, 32, 32, 1024, 256]
    - [6, 5555.0]
  - - [32, 512, 8, 1024, 32, 32, 1024, 512]
    - [11, 9642.0]
  - - [128, 32, 8, 128, 128, 128, 128, 32]
    - [6, 655.0]
  - - [256, 32, 8, 128, 256, 256, 128, 32]
    - [5, 1279.0]
  - - [512, 32, 8, 128, 512, 512, 128, 32]
    - [0, 2467.0]
  - - [128, 32, 8, 512, 128, 128, 512, 32]
    - [6, 1942.0]
  - - [256, 32, 8, 512, 256, 256, 512, 32]
    - [6, 3745.0]
  - - [512, 32, 8, 512, 512, 512, 512, 32]
    - [6, 7424.0]
  - - [128, 32, 8, 1024, 128, 128, 1024, 32]
    - [7, 2853.0]
  - - [256, 32, 8, 1024, 256, 256, 1024, 32]
    - [6, 5992.0]
  - - [512, 32, 8, 1024, 512, 512, 1024, 32]
    - [6, 10486.0]
- null
