library/src/blas3/Tensile/Logic/aldebaran/arcturus_Cijk_Ailk_Bljk_I8II_BH_GB.yaml
- {MinimumRequiredVersion: 4.26.0}
- arcturus
- gfx908
- [Device 7380, Device 7388, Device 738c, Device 7390]
    SolutionIndex: 0
    SolutionNameMin: Cijk_Ailk_Bljk_I8II_BH_GB_MT64x64x32_MI32x32x8x1_SN_1LDSB0_EPS1_GRVW4_LPB4_OPLV0_PK0_PAP0_PGR1_PLR1_SU32_SUS256_SRVW0_TT1_32_WG64_4_1_WGM8
    SolutionIndex: 1
    SolutionNameMin: Cijk_Ailk_Bljk_I8II_BH_GB_MT64x64x64_MI32x32x8x1_SN_1LDSB0_EPS1_GRVW4_LPB4_OPLV0_PK0_PAP0_PGR1_PLR1_SU32_SUS256_SRVW0_TT1_32_WG64_4_1_WGM8
    SolutionIndex: 2
    SolutionNameMin: Cijk_Ailk_Bljk_I8II_BH_GB_MT64x128x64_MI32x32x8x1_SN_1LDSB0_EPS0_GRVW16_LPB16_OPLV0_PKn1_PAP0_PGR2_PLR9_SU0_SUS128_SRVW4_TT1_64_WG64_4_1_WGM1
    SolutionIndex: 3
    SolutionNameMin: Cijk_Ailk_Bljk_I8II_BH_GB_MT128x256x64_MI32x32x8x1_SN_1LDSB1_EPS1_GRVW16_LPB16_OPLV0_PKn1_PAP0_PGR1_PLR9_SU0_SUS128_SRVW0_TT2_128_WG64_4_1_WGM1
    SolutionIndex: 4
    SolutionNameMin: Cijk_Ailk_Bljk_I8II_BH_GB_MT64x128x64_MI32x32x8x1_SN_1LDSB0_EPS0_GRVW4_LPB16_OPLV0_PKn1_PAP0_PGR2_PLR9_SU0_SUS256_SRVW4_TT1_64_WG64_4_1_WGM1
    SolutionIndex: 5
    SolutionNameMin: Cijk_Ailk_Bljk_I8II_BH_GB_MT64x128x64_MI32x32x8x1_SN_1LDSB0_EPS1_GRVW16_LPB16_OPLV0_PKn1_PAP0_PGR1_PLR9_SU0_SUS128_SRVW4_TT1_64_WG64_4_1_WGM2
    SolutionIndex: 6
    SolutionNameMin: Cijk_Ailk_Bljk_I8II_BH_GB_MT64x128x64_MI32x32x8x1_SN_1LDSB0_EPS0_GRVW16_LPB16_OPLV0_PKn1_PAP0_PGR2_PLR9_SU0_SUS128_SRVW4_TT1_64_WG64_4_1_WGM2
    SolutionIndex: 7
    SolutionNameMin: Cijk_Ailk_Bljk_I8II_BH_GB_MT64x128x64_MI32x32x8x1_SN_1LDSB0_EPS1_GRVW16_LPB16_OPLV0_PKn1_PAP0_PGR1_PLR9_SU0_SUS256_SRVW4_TT1_64_WG64_4_1_WGM2
    SolutionIndex: 8
    SolutionNameMin: Cijk_Ailk_Bljk_I8II_BH_GB_MT64x64x64_MI32x32x8x1_SN_1LDSB0_EPS0_GRVW16_LPB16_OPLV0_PKn1_PAP0_PGR2_PLR9_SU0_SUS256_SRVW4_TT1_32_WG64_4_1_WGM2
    SolutionIndex: 9
    SolutionNameMin: Cijk_Ailk_Bljk_I8II_BH_GB_MT64x64x64_MI32x32x8x1_SN_1LDSB0_EPS1_GRVW8_LPB16_OPLV0_PK0_PAP0_PGR1_PLR9_SU0_SUS128_SRVW0_TT1_32_WG64_4_1_WGM1
    SolutionIndex: 10
    SolutionNameMin: Cijk_Ailk_Bljk_I8II_BH_GB_MT32x32x128_MI16x16x16x1_SN_1LDSB0_EPS1_GRVW8_LPB32_OPLV0_PK0_PAP0_PGR1_PLR9_SU0_SUS128_SRVW0_TT1_16_WG32_8_1_WGM1
    SolutionIndex: 11
    SolutionNameMin: Cijk_Ailk_Bljk_I8II_BH_GB_MT32x32x128_MI16x16x16x1_SN_1LDSB0_EPS1_GRVW16_LPB32_OPLV0_PK0_PAP0_PGR1_PLR9_SU0_SUS128_SRVW0_TT1_16_WG32_8_1_WGM1
    SolutionIndex: 12
    SolutionNameMin: Cijk_Ailk_Bljk_I8II_BH_GB_MT32x64x128_MI16x16x16x1_SN_1LDSB0_EPS1_GRVW16_LPB32_OPLV0_PK0_PAP0_PGR1_PLR9_SU0_SUS128_SRVW0_TT1_32_WG32_8_1_WGM1
    SolutionIndex: 13
    SolutionNameMin: Cijk_Ailk_Bljk_I8II_BH_GB_MT64x32x128_MI16x16x16x1_SN_1LDSB0_EPS1_GRVW16_LPB32_OPLV0_PK0_PAP0_PGR1_PLR9_SU0_SUS128_SRVW0_TT2_16_WG32_8_1_WGM1
    SolutionIndex: 14
    SolutionNameMin: Cijk_Ailk_Bljk_I8II_BH_GB_MT32x32x128_MI16x16x16x1_SN_1LDSB0_EPS0_GRVW4_LPB32_OPLV0_PK0_PAP0_PGR2_PLR9_SU0_SUS128_SRVW0_TT1_16_WG32_8_1_WGM1
    SolutionIndex: 15
    SolutionNameMin: Cijk_Ailk_Bljk_I8II_BH_GB_MT32x32x128_MI16x16x16x1_SN_1LDSB0_EPS0_GRVW8_LPB32_OPLV0_PK0_PAP0_PGR2_PLR9_SU0_SUS128_SRVW0_TT1_16_WG32_8_1_WGM1
    SolutionIndex: 16
    SolutionNameMin: Cijk_Ailk_Bljk_I8II_BH_GB_MT128x64x64_MI32x32x8x1_SN_1LDSB0_EPS0_GRVW16_LPB16_OPLV0_PK0_PAP0_PGR2_PLR9_SU0_SUS128_SRVW0_TT2_32_WG64_4_1_WGM1
    SolutionIndex: 17
    SolutionNameMin: Cijk_Ailk_Bljk_I8II_BH_GB_MT32x32x128_MI16x16x16x1_SN_1LDSB0_EPS0_GRVW16_LPB32_OPLV0_PK0_PAP0_PGR2_PLR9_SU0_SUS128_SRVW0_TT1_16_WG32_8_1_WGM1
    SolutionIndex: 18
    SolutionNameMin: Cijk_Ailk_Bljk_I8II_BH_GB_MT32x64x128_MI16x16x16x1_SN_1LDSB0_EPS0_GRVW16_LPB32_OPLV0_PK0_PAP0_PGR2_PLR9_SU0_SUS128_SRVW0_TT1_32_WG32_8_1_WGM1
    SolutionIndex: 19
    SolutionNameMin: Cijk_Ailk_Bljk_I8II_BH_GB_MT64x64x64_MI32x32x8x1_SN_1LDSB0_EPS1_GRVW4_LPB16_OPLV0_PK0_PAP0_PGR1_PLR9_SU0_SUS128_SRVW4_TT1_32_WG64_4_1_WGM1
    SolutionIndex: 20
    SolutionNameMin: Cijk_Ailk_Bljk_I8II_BH_GB_MT64x64x64_MI32x32x8x1_SN_1LDSB0_EPS1_GRVW8_LPB16_OPLV0_PK0_PAP0_PGR1_PLR9_SU0_SUS128_SRVW4_TT1_32_WG64_4_1_WGM1
    SolutionIndex: 21
    SolutionNameMin: Cijk_Ailk_Bljk_I8II_BH_GB_MT32x32x128_MI16x16x16x1_SN_1LDSB0_EPS1_GRVW8_LPB32_OPLV0_PK0_PAP0_PGR1_PLR9_SU0_SUS128_SRVW4_TT1_16_WG32_8_1_WGM1
    SolutionIndex: 22
    SolutionNameMin: Cijk_Ailk_Bljk_I8II_BH_GB_MT64x64x64_MI32x32x8x1_SN_1LDSB0_EPS1_GRVW16_LPB16_OPLV0_PK0_PAP0_PGR1_PLR9_SU0_SUS128_SRVW4_TT1_32_WG64_4_1_WGM1
    SolutionIndex: 23
    SolutionNameMin: Cijk_Ailk_Bljk_I8II_BH_GB_MT64x128x64_MI32x32x8x1_SN_1LDSB0_EPS1_GRVW16_LPB16_OPLV0_PK0_PAP0_PGR1_PLR9_SU0_SUS128_SRVW4_TT1_64_WG64_4_1_WGM1
    SolutionIndex: 24
    SolutionNameMin: Cijk_Ailk_Bljk_I8II_BH_GB_MT64x64x64_MI32x32x8x1_SN_1LDSB0_EPS0_GRVW4_LPB16_OPLV0_PK0_PAP0_PGR2_PLR9_SU0_SUS128_SRVW4_TT1_32_WG64_4_1_WGM1
    SolutionIndex: 25
    SolutionNameMin: Cijk_Ailk_Bljk_I8II_BH_GB_MT64x128x64_MI32x32x8x1_SN_1LDSB0_EPS0_GRVW4_LPB16_OPLV0_PK0_PAP0_PGR2_PLR9_SU0_SUS128_SRVW4_TT1_64_WG64_4_1_WGM1
    SolutionIndex: 26
    SolutionNameMin: Cijk_Ailk_Bljk_I8II_BH_GB_MT64x128x64_MI32x32x8x1_SN_1LDSB0_EPS0_GRVW8_LPB16_OPLV0_PK0_PAP0_PGR2_PLR9_SU0_SUS128_SRVW4_TT1_64_WG64_4_1_WGM1
    SolutionIndex: 27
    SolutionNameMin: Cijk_Ailk_Bljk_I8II_BH_GB_MT64x64x64_MI32x32x8x1_SN_1LDSB0_EPS0_GRVW16_LPB16_OPLV0_PK0_PAP0_PGR2_PLR9_SU0_SUS128_SRVW4_TT1_32_WG64_4_1_WGM1
    SolutionIndex: 28
    SolutionNameMin: Cijk_Ailk_Bljk_I8II_BH_GB_MT64x128x64_MI32x32x8x1_SN_1LDSB0_EPS0_GRVW16_LPB16_OPLV0_PK0_PAP0_PGR2_PLR9_SU0_SUS128_SRVW4_TT1_64_WG64_4_1_WGM1
    SolutionIndex: 29
    SolutionNameMin: Cijk_Ailk_Bljk_I8II_BH_GB_MT32x32x128_MI16x16x16x1_SN_1LDSB0_EPS0_GRVW16_LPB32_OPLV0_PK0_PAP0_PGR2_PLR9_SU0_SUS128_SRVW4_TT1_16_WG32_8_1_WGM1
    SolutionIndex: 30
    SolutionNameMin: Cijk_Ailk_Bljk_I8II_BH_GB_MT32x64x128_MI16x16x16x1_SN_1LDSB0_EPS0_GRVW16_LPB32_OPLV0_PK0_PAP0_PGR2_PLR9_SU0_SUS128_SRVW4_TT1_32_WG32_8_1_WGM1
    SolutionIndex: 31
    SolutionNameMin: Cijk_Ailk_Bljk_I8II_BH_GB_MT64x32x128_MI16x16x16x1_SN_1LDSB0_EPS0_GRVW16_LPB32_OPLV0_PK0_PAP0_PGR2_PLR9_SU0_SUS128_SRVW4_TT2_16_WG32_8_1_WGM1
    SolutionIndex: 32
    SolutionNameMin: Cijk_Ailk_Bljk_I8II_BH_GB_MT128x256x64_MI32x32x8x1_SN_1LDSB1_EPS1_GRVW8_LPB16_OPLV0_PK0_PAP0_PGR1_PLR9_SU0_SUS128_SRVW0_TT2_128_WG64_4_1_WGM1
    SolutionIndex: 33
    SolutionNameMin: Cijk_Ailk_Bljk_I8II_BH_GB_MT32x32x128_MI16x16x16x1_SN_1LDSB0_EPS1_GRVW8_LPB32_OPLV0_PK0_PAP0_PGR1_PLR9_SU0_SUS256_SRVW0_TT1_16_WG32_8_1_WGM1
    SolutionIndex: 34
    SolutionNameMin: Cijk_Ailk_Bljk_I8II_BH_GB_MT32x32x128_MI16x16x16x1_SN_1LDSB0_EPS1_GRVW16_LPB32_OPLV0_PK0_PAP0_PGR1_PLR9_SU0_SUS256_SRVW0_TT1_16_WG32_8_1_WGM1
    SolutionIndex: 35
    SolutionNameMin: Cijk_Ailk_Bljk_I8II_BH_GB_MT32x64x128_MI16x16x16x1_SN_1LDSB0_EPS1_GRVW16_LPB32_OPLV0_PK0_PAP0_PGR1_PLR9_SU0_SUS256_SRVW0_TT1_32_WG32_8_1_WGM1
    SolutionIndex: 36
    SolutionNameMin: Cijk_Ailk_Bljk_I8II_BH_GB_MT64x32x128_MI16x16x16x1_SN_1LDSB0_EPS0_GRVW4_LPB32_OPLV0_PK0_PAP0_PGR2_PLR9_SU0_SUS256_SRVW0_TT2_16_WG32_8_1_WGM1
    SolutionIndex: 37
    SolutionNameMin: Cijk_Ailk_Bljk_I8II_BH_GB_MT32x32x128_MI16x16x16x1_SN_1LDSB0_EPS0_GRVW16_LPB32_OPLV0_PK0_PAP0_PGR2_PLR9_SU0_SUS256_SRVW0_TT1_16_WG32_8_1_WGM1
    SolutionIndex: 38
    SolutionNameMin: Cijk_Ailk_Bljk_I8II_BH_GB_MT32x64x128_MI16x16x16x1_SN_1LDSB0_EPS0_GRVW16_LPB32_OPLV0_PK0_PAP0_PGR2_PLR9_SU0_SUS256_SRVW0_TT1_32_WG32_8_1_WGM1
    SolutionIndex: 39
    SolutionNameMin: Cijk_Ailk_Bljk_I8II_BH_GB_MT64x64x64_MI32x32x8x1_SN_1LDSB0_EPS1_GRVW4_LPB16_OPLV0_PK0_PAP0_PGR1_PLR9_SU0_SUS256_SRVW4_TT1_32_WG64_4_1_WGM1
    SolutionIndex: 40
    SolutionNameMin: Cijk_Ailk_Bljk_I8II_BH_GB_MT64x64x64_MI32x32x8x1_SN_1LDSB0_EPS1_GRVW8_LPB16_OPLV0_PK0_PAP0_PGR1_PLR9_SU0_SUS256_SRVW4_TT1_32_WG64_4_1_WGM1
    SolutionIndex: 41
    SolutionNameMin: Cijk_Ailk_Bljk_I8II_BH_GB_MT32x32x128_MI16x16x16x1_SN_1LDSB0_EPS1_GRVW8_LPB32_OPLV0_PK0_PAP0_PGR1_PLR9_SU0_SUS256_SRVW4_TT1_16_WG32_8_1_WGM1
    SolutionIndex: 42
    SolutionNameMin: Cijk_Ailk_Bljk_I8II_BH_GB_MT64x64x64_MI32x32x8x1_SN_1LDSB0_EPS1_GRVW16_LPB16_OPLV0_PK0_PAP0_PGR1_PLR9_SU0_SUS256_SRVW4_TT1_32_WG64_4_1_WGM1
    SolutionIndex: 43
    SolutionNameMin: Cijk_Ailk_Bljk_I8II_BH_GB_MT64x128x64_MI32x32x8x1_SN_1LDSB0_EPS1_GRVW16_LPB16_OPLV0_PK0_PAP0_PGR1_PLR9_SU0_SUS256_SRVW4_TT1_64_WG64_4_1_WGM1
    SolutionIndex: 44
    SolutionNameMin: Cijk_Ailk_Bljk_I8II_BH_GB_MT64x128x64_MI32x32x8x1_SN_1LDSB0_EPS0_GRVW4_LPB16_OPLV0_PK0_PAP0_PGR2_PLR9_SU0_SUS256_SRVW4_TT1_64_WG64_4_1_WGM1
    SolutionIndex: 45
    SolutionNameMin: Cijk_Ailk_Bljk_I8II_BH_GB_MT64x64x64_MI32x32x8x1_SN_1LDSB0_EPS0_GRVW8_LPB16_OPLV0_PK0_PAP0_PGR2_PLR9_SU0_SUS256_SRVW4_TT1_32_WG64_4_1_WGM1
    SolutionIndex: 46
    SolutionNameMin: Cijk_Ailk_Bljk_I8II_BH_GB_MT64x128x64_MI32x32x8x1_SN_1LDSB0_EPS0_GRVW8_LPB16_OPLV0_PK0_PAP0_PGR2_PLR9_SU0_SUS256_SRVW4_TT1_64_WG64_4_1_WGM1
    SolutionIndex: 47
    SolutionNameMin: Cijk_Ailk_Bljk_I8II_BH_GB_MT64x64x64_MI32x32x8x1_SN_1LDSB0_EPS0_GRVW16_LPB16_OPLV0_PK0_PAP0_PGR2_PLR9_SU0_SUS256_SRVW4_TT1_32_WG64_4_1_WGM1
    SolutionIndex: 48
    SolutionNameMin: Cijk_Ailk_Bljk_I8II_BH_GB_MT64x128x64_MI32x32x8x1_SN_1LDSB0_EPS0_GRVW16_LPB16_OPLV0_PK0_PAP0_PGR2_PLR9_SU0_SUS256_SRVW4_TT1_64_WG64_4_1_WGM1
    SolutionIndex: 49
    SolutionNameMin: Cijk_Ailk_Bljk_I8II_BH_GB_MT32x32x128_MI16x16x16x1_SN_1LDSB0_EPS0_GRVW16_LPB32_OPLV0_PK0_PAP0_PGR2_PLR9_SU0_SUS256_SRVW4_TT1_16_WG32_8_1_WGM1
    SolutionIndex: 50
    SolutionNameMin: Cijk_Ailk_Bljk_I8II_BH_GB_MT64x32x128_MI16x16x16x1_SN_1LDSB0_EPS0_GRVW16_LPB32_OPLV0_PK0_PAP0_PGR2_PLR9_SU0_SUS256_SRVW4_TT2_16_WG32_8_1_WGM1
    SolutionIndex: 51
    SolutionNameMin: Cijk_Ailk_Bljk_I8II_BH_GB_MT32x64x128_MI16x16x16x1_SN_1LDSB0_EPS1_GRVW16_LPB32_OPLV0_PK0_PAP0_PGR1_PLR9_SU32_SUS128_SRVW0_TT1_32_WG32_8_1_WGM1
    SolutionIndex: 52
    SolutionNameMin: Cijk_Ailk_Bljk_I8II_BH_GB_MT32x32x128_MI16x16x16x1_SN_1LDSB0_EPS0_GRVW16_LPB32_OPLV0_PK0_PAP0_PGR2_PLR9_SU32_SUS128_SRVW0_TT1_16_WG32_8_1_WGM1
    SolutionIndex: 53
    SolutionNameMin: Cijk_Ailk_Bljk_I8II_BH_GB_MT32x64x128_MI16x16x16x1_SN_1LDSB0_EPS0_GRVW16_LPB32_OPLV0_PK0_PAP0_PGR2_PLR9_SU32_SUS128_SRVW0_TT1_32_WG32_8_1_WGM1
    SolutionIndex: 54
    SolutionNameMin: Cijk_Ailk_Bljk_I8II_BH_GB_MT64x64x64_MI32x32x8x1_SN_1LDSB0_EPS1_GRVW16_LPB16_OPLV0_PK0_PAP0_PGR1_PLR9_SU32_SUS128_SRVW4_TT1_32_WG64_4_1_WGM1
    SolutionIndex: 55
    SolutionNameMin: Cijk_Ailk_Bljk_I8II_BH_GB_MT64x128x64_MI32x32x8x1_SN_1LDSB0_EPS1_GRVW16_LPB16_OPLV0_PK0_PAP0_PGR1_PLR9_SU32_SUS128_SRVW4_TT1_64_WG64_4_1_WGM1
    SolutionIndex: 56
    SolutionNameMin: Cijk_Ailk_Bljk_I8II_BH_GB_MT64x128x64_MI32x32x8x1_SN_1LDSB0_EPS0_GRVW16_LPB16_OPLV0_PK0_PAP0_PGR2_PLR9_SU32_SUS128_SRVW4_TT1_64_WG64_4_1_WGM1
    SolutionIndex: 57
    SolutionNameMin: Cijk_Ailk_Bljk_I8II_BH_GB_MT32x32x128_MI16x16x16x1_SN_1LDSB0_EPS0_GRVW16_LPB32_OPLV0_PK0_PAP0_PGR2_PLR9_SU32_SUS128_SRVW4_TT1_16_WG32_8_1_WGM1
    SolutionIndex: 58
    SolutionNameMin: Cijk_Ailk_Bljk_I8II_BH_GB_MT32x64x128_MI16x16x16x1_SN_1LDSB0_EPS1_GRVW16_LPB32_OPLV0_PK0_PAP0_PGR1_PLR9_SU32_SUS256_SRVW0_TT1_32_WG32_8_1_WGM1
    SolutionIndex: 59
    SolutionNameMin: Cijk_Ailk_Bljk_I8II_BH_GB_MT64x32x128_MI16x16x16x1_SN_1LDSB0_EPS1_GRVW16_LPB32_OPLV0_PK0_PAP0_PGR1_PLR9_SU32_SUS256_SRVW0_TT2_16_WG32_8_1_WGM1
    SolutionIndex: 60
    SolutionNameMin: Cijk_Ailk_Bljk_I8II_BH_GB_MT32x64x128_MI16x16x16x1_SN_1LDSB0_EPS0_GRVW16_LPB32_OPLV0_PK0_PAP0_PGR2_PLR9_SU32_SUS256_SRVW0_TT1_32_WG32_8_1_WGM1
    SolutionIndex: 61
    SolutionNameMin: Cijk_Ailk_Bljk_I8II_BH_GB_MT64x128x64_MI32x32x8x1_SN_1LDSB0_EPS1_GRVW4_LPB16_OPLV0_PK0_PAP0_PGR1_PLR9_SU32_SUS256_SRVW4_TT1_64_WG64_4_1_WGM1
    SolutionIndex: 62
    SolutionNameMin: Cijk_Ailk_Bljk_I8II_BH_GB_MT64x64x64_MI32x32x8x1_SN_1LDSB0_EPS1_GRVW16_LPB16_OPLV0_PK0_PAP0_PGR1_PLR9_SU32_SUS256_SRVW4_TT1_32_WG64_4_1_WGM1
    SolutionIndex: 63
    SolutionNameMin: Cijk_Ailk_Bljk_I8II_BH_GB_MT64x128x64_MI32x32x8x1_SN_1LDSB0_EPS1_GRVW16_LPB16_OPLV0_PK0_PAP0_PGR1_PLR9_SU32_SUS256_SRVW4_TT1_64_WG64_4_1_WGM1
    SolutionIndex: 64
    SolutionNameMin: Cijk_Ailk_Bljk_I8II_BH_GB_MT64x64x64_MI32x32x8x1_SN_1LDSB0_EPS0_GRVW16_LPB16_OPLV0_PK0_PAP0_PGR2_PLR9_SU32_SUS256_SRVW4_TT1_32_WG64_4_1_WGM1
    SolutionIndex: 65
    SolutionNameMin: Cijk_Ailk_Bljk_I8II_BH_GB_MT64x128x64_MI32x32x8x1_SN_1LDSB0_EPS0_GRVW16_LPB16_OPLV0_PK0_PAP0_PGR2_PLR9_SU32_SUS256_SRVW4_TT1_64_WG64_4_1_WGM1
    SolutionIndex: 66
    SolutionNameMin: Cijk_Ailk_Bljk_I8II_BH_GB_MT32x32x128_MI16x16x16x1_SN_1LDSB0_EPS0_GRVW16_LPB32_OPLV0_PK0_PAP0_PGR2_PLR9_SU32_SUS256_SRVW4_TT1_16_WG32_8_1_WGM1
    SolutionIndex: 67
    SolutionNameMin: Cijk_Ailk_Bljk_I8II_BH_GB_MT32x64x128_MI16x16x16x1_SN_1LDSB0_EPS1_GRVW16_LPB32_OPLV0_PK0_PAP0_PGR1_PLR9_SU0_SUS128_SRVW0_TT1_32_WG32_8_1_WGM2
    SolutionIndex: 68
    SolutionNameMin: Cijk_Ailk_Bljk_I8II_BH_GB_MT32x32x128_MI16x16x16x1_SN_1LDSB0_EPS0_GRVW4_LPB32_OPLV0_PK0_PAP0_PGR2_PLR9_SU0_SUS128_SRVW0_TT1_16_WG32_8_1_WGM2
    SolutionIndex: 69
    SolutionNameMin: Cijk_Ailk_Bljk_I8II_BH_GB_MT32x32x128_MI16x16x16x1_SN_1LDSB0_EPS0_GRVW16_LPB32_OPLV0_PK0_PAP0_PGR2_PLR9_SU0_SUS128_SRVW0_TT1_16_WG32_8_1_WGM2
    SolutionIndex: 70
    SolutionNameMin: Cijk_Ailk_Bljk_I8II_BH_GB_MT64x64x64_MI32x32x8x1_SN_1LDSB0_EPS1_GRVW16_LPB16_OPLV0_PK0_PAP0_PGR1_PLR9_SU0_SUS128_SRVW4_TT1_32_WG64_4_1_WGM2
    SolutionIndex: 71
    SolutionNameMin: Cijk_Ailk_Bljk_I8II_BH_GB_MT64x128x64_MI32x32x8x1_SN_1LDSB0_EPS1_GRVW16_LPB16_OPLV0_PK0_PAP0_PGR1_PLR9_SU0_SUS128_SRVW4_TT1_64_WG64_4_1_WGM2
    SolutionIndex: 72
    SolutionNameMin: Cijk_Ailk_Bljk_I8II_BH_GB_MT64x128x64_MI32x32x8x1_SN_1LDSB0_EPS0_GRVW4_LPB16_OPLV0_PK0_PAP0_PGR2_PLR9_SU0_SUS128_SRVW4_TT1_64_WG64_4_1_WGM2
    SolutionIndex: 73
    SolutionNameMin: Cijk_Ailk_Bljk_I8II_BH_GB_MT64x64x64_MI32x32x8x1_SN_1LDSB0_EPS0_GRVW8_LPB16_OPLV0_PK0_PAP0_PGR2_PLR9_SU0_SUS128_SRVW4_TT1_32_WG64_4_1_WGM2
    SolutionIndex: 74
    SolutionNameMin: Cijk_Ailk_Bljk_I8II_BH_GB_MT64x128x64_MI32x32x8x1_SN_1LDSB0_EPS0_GRVW8_LPB16_OPLV0_PK0_PAP0_PGR2_PLR9_SU0_SUS128_SRVW4_TT1_64_WG64_4_1_WGM2
    SolutionIndex: 75
    SolutionNameMin: Cijk_Ailk_Bljk_I8II_BH_GB_MT64x64x64_MI32x32x8x1_SN_1LDSB0_EPS0_GRVW16_LPB16_OPLV0_PK0_PAP0_PGR2_PLR9_SU0_SUS128_SRVW4_TT1_32_WG64_4_1_WGM2
    SolutionIndex: 76
    SolutionNameMin: Cijk_Ailk_Bljk_I8II_BH_GB_MT64x128x64_MI32x32x8x1_SN_1LDSB0_EPS0_GRVW16_LPB16_OPLV0_PK0_PAP0_PGR2_PLR9_SU0_SUS128_SRVW4_TT1_64_WG64_4_1_WGM2
    SolutionIndex: 77
    SolutionNameMin: Cijk_Ailk_Bljk_I8II_BH_GB_MT64x32x128_MI16x16x16x1_SN_1LDSB0_EPS0_GRVW8_LPB32_OPLV0_PK0_PAP0_PGR2_PLR9_SU0_SUS256_SRVW0_TT2_16_WG32_8_1_WGM2
    SolutionIndex: 78
    SolutionNameMin: Cijk_Ailk_Bljk_I8II_BH_GB_MT32x32x128_MI16x16x16x1_SN_1LDSB0_EPS0_GRVW16_LPB32_OPLV0_PK0_PAP0_PGR2_PLR9_SU0_SUS256_SRVW0_TT1_16_WG32_8_1_WGM2
    SolutionIndex: 79
    SolutionNameMin: Cijk_Ailk_Bljk_I8II_BH_GB_MT32x64x128_MI16x16x16x1_SN_1LDSB0_EPS0_GRVW16_LPB32_OPLV0_PK0_PAP0_PGR2_PLR9_SU0_SUS256_SRVW0_TT1_32_WG32_8_1_WGM2
    SolutionIndex: 80
    SolutionNameMin: Cijk_Ailk_Bljk_I8II_BH_GB_MT128x128x64_MI32x32x8x1_SN_1LDSB0_EPS1_GRVW4_LPB16_OPLV0_PK0_PAP0_PGR1_PLR9_SU0_SUS256_SRVW4_TT2_64_WG64_4_1_WGM2
    SolutionIndex: 81
    SolutionNameMin: Cijk_Ailk_Bljk_I8II_BH_GB_MT64x128x64_MI32x32x8x1_SN_1LDSB0_EPS1_GRVW16_LPB16_OPLV0_PK0_PAP0_PGR1_PLR9_SU0_SUS256_SRVW4_TT1_64_WG64_4_1_WGM2
    SolutionIndex: 82
    SolutionNameMin: Cijk_Ailk_Bljk_I8II_BH_GB_MT64x128x64_MI32x32x8x1_SN_1LDSB0_EPS0_GRVW4_LPB16_OPLV0_PK0_PAP0_PGR2_PLR9_SU0_SUS256_SRVW4_TT1_64_WG64_4_1_WGM2
    SolutionIndex: 83
    SolutionNameMin: Cijk_Ailk_Bljk_I8II_BH_GB_MT64x64x64_MI32x32x8x1_SN_1LDSB0_EPS0_GRVW8_LPB16_OPLV0_PK0_PAP0_PGR2_PLR9_SU0_SUS256_SRVW4_TT1_32_WG64_4_1_WGM2
    SolutionIndex: 84
    SolutionNameMin: Cijk_Ailk_Bljk_I8II_BH_GB_MT64x64x64_MI32x32x8x1_SN_1LDSB0_EPS0_GRVW16_LPB16_OPLV0_PK0_PAP0_PGR2_PLR9_SU0_SUS256_SRVW4_TT1_32_WG64_4_1_WGM2
    SolutionIndex: 85
    SolutionNameMin: Cijk_Ailk_Bljk_I8II_BH_GB_MT64x128x64_MI32x32x8x1_SN_1LDSB0_EPS0_GRVW16_LPB16_OPLV0_PK0_PAP0_PGR2_PLR9_SU0_SUS256_SRVW4_TT1_64_WG64_4_1_WGM2
    SolutionIndex: 86
    SolutionNameMin: Cijk_Ailk_Bljk_I8II_BH_GB_MT32x32x128_MI16x16x16x1_SN_1LDSB0_EPS0_GRVW16_LPB32_OPLV0_PK0_PAP0_PGR2_PLR9_SU32_SUS128_SRVW0_TT1_16_WG32_8_1_WGM2
    SolutionIndex: 87
    SolutionNameMin: Cijk_Ailk_Bljk_I8II_BH_GB_MT64x128x64_MI32x32x8x1_SN_1LDSB0_EPS1_GRVW16_LPB16_OPLV0_PK0_PAP0_PGR1_PLR9_SU32_SUS128_SRVW4_TT1_64_WG64_4_1_WGM2
    SolutionIndex: 88
    SolutionNameMin: Cijk_Ailk_Bljk_I8II_BH_GB_MT64x128x64_MI32x32x8x1_SN_1LDSB0_EPS0_GRVW16_LPB16_OPLV0_PK0_PAP0_PGR2_PLR9_SU32_SUS128_SRVW4_TT1_64_WG64_4_1_WGM2
    SolutionIndex: 89
    SolutionNameMin: Cijk_Ailk_Bljk_I8II_BH_GB_MT64x64x64_MI32x32x8x1_SN_1LDSB0_EPS1_GRVW4_LPB16_OPLV0_PK0_PAP0_PGR1_PLR9_SU32_SUS256_SRVW4_TT1_32_WG64_4_1_WGM2
    SolutionIndex: 90
    SolutionNameMin: Cijk_Ailk_Bljk_I8II_BH_GB_MT32x64x128_MI16x16x16x1_SN_1LDSB0_EPS1_GRVW8_LPB32_OPLV0_PK0_PAP0_PGR1_PLR9_SU0_SUS128_SRVW0_TT1_32_WG32_8_1_WGM15
    SolutionIndex: 91
    SolutionNameMin: Cijk_Ailk_Bljk_I8II_BH_GB_MT32x32x128_MI16x16x16x1_SN_1LDSB0_EPS0_GRVW4_LPB32_OPLV0_PK0_PAP0_PGR2_PLR9_SU0_SUS128_SRVW0_TT1_16_WG32_8_1_WGM15
    SolutionIndex: 92
    SolutionNameMin: Cijk_Ailk_Bljk_I8II_BH_GB_MT32x64x128_MI16x16x16x1_SN_1LDSB0_EPS0_GRVW4_LPB32_OPLV0_PK0_PAP0_PGR2_PLR9_SU0_SUS128_SRVW0_TT1_32_WG32_8_1_WGM15
    SolutionIndex: 93
    SolutionNameMin: Cijk_Ailk_Bljk_I8II_BH_GB_MT32x64x128_MI16x16x16x1_SN_1LDSB0_EPS0_GRVW8_LPB32_OPLV0_PK0_PAP0_PGR2_PLR9_SU0_SUS128_SRVW0_TT1_32_WG32_8_1_WGM15
    SolutionIndex: 94
    SolutionNameMin: Cijk_Ailk_Bljk_I8II_BH_GB_MT32x32x128_MI16x16x16x1_SN_1LDSB0_EPS0_GRVW16_LPB32_OPLV0_PK0_PAP0_PGR2_PLR9_SU0_SUS128_SRVW0_TT1_16_WG32_8_1_WGM15
    SolutionIndex: 95
    SolutionNameMin: Cijk_Ailk_Bljk_I8II_BH_GB_MT32x64x128_MI16x16x16x1_SN_1LDSB0_EPS0_GRVW16_LPB32_OPLV0_PK0_PAP0_PGR2_PLR9_SU0_SUS128_SRVW0_TT1_32_WG32_8_1_WGM15
    SolutionIndex: 96
    SolutionNameMin: Cijk_Ailk_Bljk_I8II_BH_GB_MT64x128x64_MI32x32x8x1_SN_1LDSB0_EPS1_GRVW16_LPB16_OPLV0_PK0_PAP0_PGR1_PLR9_SU0_SUS128_SRVW4_TT1_64_WG64_4_1_WGM15
    SolutionIndex: 97
    SolutionNameMin: Cijk_Ailk_Bljk_I8II_BH_GB_MT32x64x128_MI16x16x16x1_SN_1LDSB0_EPS1_GRVW16_LPB32_OPLV0_PK0_PAP0_PGR1_PLR9_SU0_SUS128_SRVW4_TT1_32_WG32_8_1_WGM15
    SolutionIndex: 98
    SolutionNameMin: Cijk_Ailk_Bljk_I8II_BH_GB_MT64x128x64_MI32x32x8x1_SN_1LDSB0_EPS0_GRVW4_LPB16_OPLV0_PK0_PAP0_PGR2_PLR9_SU0_SUS128_SRVW4_TT1_64_WG64_4_1_WGM15
    SolutionIndex: 99
    SolutionNameMin: Cijk_Ailk_Bljk_I8II_BH_GB_MT64x64x64_MI32x32x8x1_SN_1LDSB0_EPS0_GRVW8_LPB16_OPLV0_PK0_PAP0_PGR2_PLR9_SU0_SUS128_SRVW4_TT1_32_WG64_4_1_WGM15
    SolutionIndex: 100
    SolutionNameMin: Cijk_Ailk_Bljk_I8II_BH_GB_MT64x64x64_MI32x32x8x1_SN_1LDSB0_EPS0_GRVW16_LPB16_OPLV0_PK0_PAP0_PGR2_PLR9_SU0_SUS128_SRVW4_TT1_32_WG64_4_1_WGM15
    SolutionIndex: 101
    SolutionNameMin: Cijk_Ailk_Bljk_I8II_BH_GB_MT64x128x64_MI32x32x8x1_SN_1LDSB0_EPS0_GRVW16_LPB16_OPLV0_PK0_PAP0_PGR2_PLR9_SU0_SUS128_SRVW4_TT1_64_WG64_4_1_WGM15
    SolutionIndex: 102
    SolutionNameMin: Cijk_Ailk_Bljk_I8II_BH_GB_MT32x64x128_MI16x16x16x1_SN_1LDSB0_EPS0_GRVW16_LPB32_OPLV0_PK0_PAP0_PGR2_PLR9_SU0_SUS128_SRVW4_TT1_32_WG32_8_1_WGM15
    SolutionIndex: 103
    SolutionNameMin: Cijk_Ailk_Bljk_I8II_BH_GB_MT64x32x128_MI16x16x16x1_SN_1LDSB0_EPS0_GRVW16_LPB32_OPLV0_PK0_PAP0_PGR2_PLR9_SU0_SUS128_SRVW4_TT2_16_WG32_8_1_WGM15
    SolutionIndex: 104
    SolutionNameMin: Cijk_Ailk_Bljk_I8II_BH_GB_MT32x64x128_MI16x16x16x1_SN_1LDSB0_EPS1_GRVW16_LPB32_OPLV0_PK0_PAP0_PGR1_PLR9_SU0_SUS256_SRVW0_TT1_32_WG32_8_1_WGM15
    SolutionIndex: 105
    SolutionNameMin: Cijk_Ailk_Bljk_I8II_BH_GB_MT32x32x128_MI16x16x16x1_SN_1LDSB0_EPS0_GRVW4_LPB32_OPLV0_PK0_PAP0_PGR2_PLR9_SU0_SUS256_SRVW0_TT1_16_WG32_8_1_WGM15
    SolutionIndex: 106
    SolutionNameMin: Cijk_Ailk_Bljk_I8II_BH_GB_MT32x64x128_MI16x16x16x1_SN_1LDSB0_EPS0_GRVW8_LPB32_OPLV0_PK0_PAP0_PGR2_PLR9_SU0_SUS256_SRVW0_TT1_32_WG32_8_1_WGM15
    SolutionIndex: 107
    SolutionNameMin: Cijk_Ailk_Bljk_I8II_BH_GB_MT32x32x128_MI16x16x16x1_SN_1LDSB0_EPS0_GRVW16_LPB32_OPLV0_PK0_PAP0_PGR2_PLR9_SU0_SUS256_SRVW0_TT1_16_WG32_8_1_WGM15
    SolutionIndex: 108
    SolutionNameMin: Cijk_Ailk_Bljk_I8II_BH_GB_MT64x128x64_MI32x32x8x1_SN_1LDSB0_EPS1_GRVW8_LPB16_OPLV0_PK0_PAP0_PGR1_PLR9_SU0_SUS256_SRVW4_TT1_64_WG64_4_1_WGM15
    SolutionIndex: 109
    SolutionNameMin: Cijk_Ailk_Bljk_I8II_BH_GB_MT64x128x64_MI32x32x8x1_SN_1LDSB0_EPS1_GRVW16_LPB16_OPLV0_PK0_PAP0_PGR1_PLR9_SU0_SUS256_SRVW4_TT1_64_WG64_4_1_WGM15
    SolutionIndex: 110
    SolutionNameMin: Cijk_Ailk_Bljk_I8II_BH_GB_MT64x128x64_MI32x32x8x1_SN_1LDSB0_EPS0_GRVW4_LPB16_OPLV0_PK0_PAP0_PGR2_PLR9_SU0_SUS256_SRVW4_TT1_64_WG64_4_1_WGM15
    SolutionIndex: 111
    SolutionNameMin: Cijk_Ailk_Bljk_I8II_BH_GB_MT64x64x64_MI32x32x8x1_SN_1LDSB0_EPS0_GRVW8_LPB16_OPLV0_PK0_PAP0_PGR2_PLR9_SU0_SUS256_SRVW4_TT1_32_WG64_4_1_WGM15
    SolutionIndex: 112
    SolutionNameMin: Cijk_Ailk_Bljk_I8II_BH_GB_MT64x128x64_MI32x32x8x1_SN_1LDSB0_EPS0_GRVW8_LPB16_OPLV0_PK0_PAP0_PGR2_PLR9_SU0_SUS256_SRVW4_TT1_64_WG64_4_1_WGM15
    SolutionIndex: 113
    SolutionNameMin: Cijk_Ailk_Bljk_I8II_BH_GB_MT64x64x64_MI32x32x8x1_SN_1LDSB0_EPS0_GRVW16_LPB16_OPLV0_PK0_PAP0_PGR2_PLR9_SU0_SUS256_SRVW4_TT1_32_WG64_4_1_WGM15
    SolutionIndex: 114
    SolutionNameMin: Cijk_Ailk_Bljk_I8II_BH_GB_MT64x128x64_MI32x32x8x1_SN_1LDSB0_EPS0_GRVW16_LPB16_OPLV0_PK0_PAP0_PGR2_PLR9_SU0_SUS256_SRVW4_TT1_64_WG64_4_1_WGM15
    SolutionIndex: 115
    SolutionNameMin: Cijk_Ailk_Bljk_I8II_BH_GB_MT32x32x128_MI16x16x16x1_SN_1LDSB0_EPS0_GRVW16_LPB32_OPLV0_PK0_PAP0_PGR2_PLR9_SU32_SUS128_SRVW0_TT1_16_WG32_8_1_WGM15
    SolutionIndex: 116
    SolutionNameMin: Cijk_Ailk_Bljk_I8II_BH_GB_MT64x128x64_MI32x32x8x1_SN_1LDSB0_EPS1_GRVW16_LPB16_OPLV0_PK0_PAP0_PGR1_PLR9_SU32_SUS128_SRVW4_TT1_64_WG64_4_1_WGM15
    SolutionIndex: 117
    SolutionNameMin: Cijk_Ailk_Bljk_I8II_BH_GB_MT64x128x64_MI32x32x8x1_SN_1LDSB0_EPS0_GRVW16_LPB16_OPLV0_PK0_PAP0_PGR2_PLR9_SU32_SUS128_SRVW4_TT1_64_WG64_4_1_WGM15
    SolutionIndex: 118
    SolutionNameMin: Cijk_Ailk_Bljk_I8II_BH_GB_MT64x64x64_MI32x32x8x1_SN_1LDSB0_EPS0_GRVW8_LPB16_OPLV0_PK0_PAP0_PGR2_PLR9_SU32_SUS256_SRVW0_TT1_32_WG64_4_1_WGM15
    SolutionIndex: 119
    SolutionNameMin: Cijk_Ailk_Bljk_I8II_BH_GB_MT64x128x64_MI32x32x8x1_SN_1LDSB0_EPS1_GRVW16_LPB16_OPLV0_PK0_PAP0_PGR1_PLR9_SU32_SUS256_SRVW4_TT1_64_WG64_4_1_WGM15
    SolutionIndex: 120
    SolutionNameMin: Cijk_Ailk_Bljk_I8II_BH_GB_MT64x128x64_MI32x32x8x1_SN_1LDSB0_EPS0_GRVW16_LPB16_OPLV0_PK0_PAP0_PGR2_PLR9_SU32_SUS256_SRVW4_TT1_64_WG64_4_1_WGM15
- - - [35, 35, 1, 512, 35, 35, 35, 512]
    - [1, 47.0]
  - - [4, 64, 1, 128, 4, 4, 4, 128]
    - [0, 4.0]
  - - [480, 512, 1, 512, 704, 704, 704, 704]
    - [78, 16050.0]
  - - [960, 1024, 1, 1024, 1152, 1152, 1152, 1152]
    - [27, 71494.0]
  - - [1920, 2048, 1, 2048, 2240, 2240, 2240, 2240]
    - [88, 118149.0]
  - - [3840, 4096, 1, 4096, 4288, 4288, 4288, 4288]
    - [3, 136770.0]
  - - [32, 32, 8, 32, 32, 32, 32, 32]
    - [68, 43.0]
  - - [32, 32, 8, 64, 32, 32, 32, 64]
    - [10, 78.0]
  - - [32, 32, 8, 128, 32, 32, 32, 128]
    - [37, 215.0]
  - - [32, 32, 8, 256, 32, 32, 32, 256]
    - [115, 350.0]
  - - [32, 32, 8, 512, 32, 32, 32, 512]
    - [29, 589.0]
  - - [32, 32, 8, 1024, 32, 32, 32, 1024]
    - [37, 971.0]
  - - [32, 32, 8, 2048, 32, 32, 32, 2048]
    - [17, 1446.0]
  - - [32, 64, 8, 32, 32, 32, 32, 32]
    - [29, 83.0]
  - - [32, 64, 8, 64, 32, 32, 32, 64]
    - [10, 156.0]
  - - [32, 64, 8, 128, 32, 32, 32, 128]
    - [37, 444.0]
  - - [32, 64, 8, 256, 32, 32, 32, 256]
    - [37, 699.0]
  - - [32, 64, 8, 512, 32, 32, 32, 512]
    - [37, 1178.0]
  - - [32, 64, 8, 1024, 32, 32, 32, 1024]
    - [107, 1960.0]
  - - [32, 64, 8, 2048, 32, 32, 32, 2048]
    - [37, 2954.0]
  - - [32, 128, 8, 32, 32, 32, 32, 32]
    - [29, 170.0]
  - - [32, 128, 8, 64, 32, 32, 32, 64]
    - [15, 324.0]
  - - [32, 128, 8, 128, 32, 32, 32, 128]
    - [17, 846.0]
  - - [32, 128, 8, 256, 32, 32, 32, 256]
    - [105, 1398.0]
  - - [32, 128, 8, 512, 32, 32, 32, 512]
    - [107, 2305.0]
  - - [32, 128, 8, 1024, 32, 32, 32, 1024]
    - [94, 3813.0]
  - - [32, 128, 8, 2048, 32, 32, 32, 2048]
    - [17, 5668.0]
  - - [32, 256, 8, 32, 32, 32, 32, 32]
    - [68, 345.0]
  - - [32, 256, 8, 64, 32, 32, 32, 64]
    - [15, 639.0]
  - - [32, 256, 8, 128, 32, 32, 32, 128]
    - [17, 1719.0]
  - - [32, 256, 8, 256, 32, 32, 32, 256]
    - [52, 2724.0]
  - - [32, 256, 8, 512, 32, 32, 32, 512]
    - [57, 4462.0]
  - - [32, 256, 8, 1024, 32, 32, 32, 1024]
    - [37, 7767.0]
  - - [32, 256, 8, 2048, 32, 32, 32, 2048]
    - [37, 11413.0]
  - - [32, 512, 8, 32, 32, 32, 32, 32]
    - [68, 647.0]
  - - [32, 512, 8, 64, 32, 32, 32, 64]
    - [68, 1205.0]
  - - [32, 512, 8, 128, 32, 32, 32, 128]
    - [91, 3277.0]
  - - [32, 512, 8, 256, 32, 32, 32, 256]
    - [107, 5447.0]
  - - [32, 512, 8, 512, 32, 32, 32, 512]
    - [17, 8830.0]
  - - [32, 512, 8, 1024, 32, 32, 32, 1024]
    - [17, 14717.0]
  - - [32, 512, 8, 2048, 32, 32, 32, 2048]
    - [107, 21237.0]
  - - [32, 1024, 8, 32, 32, 32, 32, 32]
    - [92, 1059.0]
  - - [32, 1024, 8, 64, 32, 32, 32, 64]
    - [19, 1978.0]
  - - [32, 1024, 8, 128, 32, 32, 32, 128]
    - [104, 5668.0]
  - - [32, 1024, 8, 256, 32, 32, 32, 256]
    - [51, 9642.0]
  - - [32, 1024, 8, 512, 32, 32, 32, 512]
    - [51, 14847.0]
  - - [32, 1024, 8, 1024, 32, 32, 32, 1024]
    - [93, 23302.0]
  - - [32, 1024, 8, 2048, 32, 32, 32, 2048]
    - [93, 31213.0]
  - - [32, 2048, 8, 32, 32, 32, 32, 32]
    - [79, 1520.0]
  - - [32, 2048, 8, 64, 32, 32, 32, 64]
    - [42, 3017.0]
  - - [32, 2048, 8, 128, 32, 32, 32, 128]
    - [53, 8924.0]
  - - [32, 2048, 8, 256, 32, 32, 32, 256]
    - [35, 13981.0]
  - - [32, 2048, 8, 512, 32, 32, 32, 512]
    - [18, 20972.0]
  - - [32, 2048, 8, 1024, 32, 32, 32, 1024]
    - [60, 28926.0]
  - - [32, 2048, 8, 2048, 32, 32, 32, 2048]
    - [17, 35602.0]
  - - [64, 32, 8, 32, 64, 64, 64, 32]
    - [15, 80.0]
  - - [64, 32, 8, 64, 64, 64, 64, 64]
    - [21, 147.0]
  - - [64, 32, 8, 128, 64, 64, 64, 128]
    - [94, 423.0]
  - - [64, 32, 8, 256, 64, 64, 64, 256]
    - [37, 699.0]
  - - [64, 32, 8, 512, 64, 64, 64, 512]
    - [37, 1116.0]
  - - [64, 32, 8, 1024, 64, 64, 64, 1024]
    - [107, 1907.0]
  - - [64, 32, 8, 2048, 64, 64, 64, 2048]
    - [17, 2815.0]
  - - [64, 64, 8, 32, 64, 64, 64, 32]
    - [14, 158.0]
  - - [64, 64, 8, 64, 64, 64, 64, 64]
    - [47, 369.0]
  - - [64, 64, 8, 128, 64, 64, 64, 128]
    - [37, 846.0]
  - - [64, 64, 8, 256, 64, 64, 64, 256]
    - [49, 1380.0]
  - - [64, 64, 8, 512, 64, 64, 64, 512]
    - [49, 2330.0]
  - - [64, 64, 8, 1024, 64, 64, 64, 1024]
    - [49, 3813.0]
  - - [64, 64, 8, 2048, 64, 64, 64, 2048]
    - [17, 5630.0]
  - - [64, 128, 8, 32, 64, 64, 64, 32]
    - [37, 320.0]
  - - [64, 128, 8, 64, 64, 64, 64, 64]
    - [39, 771.0]
  - - [64, 128, 8, 128, 64, 64, 64, 128]
    - [37, 1691.0]
  - - [64, 128, 8, 256, 64, 64, 64, 256]
    - [17, 2759.0]
  - - [64, 128, 8, 512, 64, 64, 64, 512]
    - [37, 4609.0]
  - - [64, 128, 8, 1024, 64, 64, 64, 1024]
    - [69, 7424.0]
  - - [64, 128, 8, 2048, 64, 64, 64, 2048]
    - [49, 11185.0]
  - - [64, 256, 8, 32, 64, 64, 64, 32]
    - [29, 610.0]
  - - [64, 256, 8, 64, 64, 64, 64, 64]
    - [47, 1498.0]
  - - [64, 256, 8, 128, 64, 64, 64, 128]
    - [34, 3277.0]
  - - [64, 256, 8, 256, 64, 64, 64, 256]
    - [17, 5243.0]
  - - [64, 256, 8, 512, 64, 64, 64, 512]
    - [69, 8924.0]
  - - [64, 256, 8, 1024, 64, 64, 64, 1024]
    - [17, 14589.0]
  - - [64, 256, 8, 2048, 64, 64, 64, 2048]
    - [78, 21103.0]
  - - [64, 512, 8, 32, 64, 64, 64, 32]
    - [39, 1152.0]
  - - [64, 512, 8, 64, 64, 64, 64, 64]
    - [9, 2996.0]
  - - [64, 512, 8, 128, 64, 64, 64, 128]
    - [90, 5746.0]
  - - [64, 512, 8, 256, 64, 64, 64, 256]
    - [12, 9642.0]
  - - [64, 512, 8, 512, 64, 64, 64, 512]
    - [18, 15534.0]
  - - [64, 512, 8, 1024, 64, 64, 64, 1024]
    - [95, 23966.0]
  - - [64, 512, 8, 2048, 64, 64, 64, 2048]
    - [18, 32897.0]
  - - [64, 1024, 8, 32, 64, 64, 64, 32]
    - [83, 2162.0]
  - - [64, 1024, 8, 64, 64, 64, 64, 64]
    - [47, 5592.0]
  - - [64, 1024, 8, 128, 64, 64, 64, 128]
    - [73, 9425.0]
  - - [64, 1024, 8, 256, 64, 64, 64, 256]
    - [73, 15392.0]
  - - [64, 1024, 8, 512, 64, 64, 64, 512]
    - [27, 25811.0]
  - - [64, 1024, 8, 1024, 64, 64, 64, 1024]
    - [24, 36080.0]
  - - [64, 1024, 8, 2048, 64, 64, 64, 2048]
    - [84, 45498.0]
  - - [64, 2048, 8, 32, 64, 64, 64, 32]
    - [46, 3329.0]
  - - [64, 2048, 8, 64, 64, 64, 64, 64]
    - [23, 9425.0]
  - - [64, 2048, 8, 128, 64, 64, 64, 128]
    - [81, 15828.0]
  - - [64, 2048, 8, 256, 64, 64, 64, 256]
    - [23, 24855.0]
  - - [64, 2048, 8, 512, 64, 64, 64, 512]
    - [72, 36873.0]
  - - [64, 2048, 8, 1024, 64, 64, 64, 1024]
    - [98, 50647.0]
  - - [64, 2048, 8, 2048, 64, 64, 64, 2048]
    - [25, 61427.0]
  - - [128, 32, 8, 32, 128, 128, 128, 32]
    - [33, 156.0]
  - - [128, 32, 8, 64, 128, 128, 128, 64]
    - [21, 288.0]
  - - [128, 32, 8, 128, 128, 128, 128, 128]
    - [29, 859.0]
  - - [128, 32, 8, 256, 128, 128, 128, 256]
    - [37, 1380.0]
  - - [128, 32, 8, 512, 128, 128, 128, 512]
    - [49, 2208.0]
  - - [128, 32, 8, 1024, 128, 128, 128, 1024]
    - [37, 3616.0]
  - - [128, 32, 8, 2048, 128, 128, 128, 2048]
    - [115, 5483.0]
  - - [128, 64, 8, 32, 128, 128, 128, 32]
    - [33, 316.0]
  - - [128, 64, 8, 64, 128, 128, 128, 64]
    - [39, 749.0]
  - - [128, 64, 8, 128, 128, 128, 128, 128]
    - [105, 1638.0]
  - - [128, 64, 8, 256, 128, 128, 128, 256]
    - [37, 2655.0]
  - - [128, 64, 8, 512, 128, 128, 128, 512]
    - [17, 4415.0]
  - - [128, 64, 8, 1024, 128, 128, 128, 1024]
    - [86, 7294.0]
  - - [128, 64, 8, 2048, 128, 128, 128, 2048]
    - [86, 10824.0]
  - - [128, 128, 8, 32, 128, 128, 128, 32]
    - [29, 596.0]
  - - [128, 128, 8, 64, 128, 128, 128, 64]
    - [118, 1456.0]
  - - [128, 128, 8, 128, 128, 128, 128, 128]
    - [17, 3178.0]
  - - [128, 128, 8, 256, 128, 128, 128, 256]
    - [17, 5178.0]
  - - [128, 128, 8, 512, 128, 128, 128, 512]
    - [37, 8648.0]
  - - [128, 128, 8, 1024, 128, 128, 128, 1024]
    - [17, 14218.0]
  - - [128, 128, 8, 2048, 128, 128, 128, 2048]
    - [17, 19738.0]
  - - [128, 256, 8, 32, 128, 128, 128, 32]
    - [83, 1049.0]
  - - [128, 256, 8, 64, 128, 128, 128, 64]
    - [47, 2834.0]
  - - [128, 256, 8, 128, 128, 128, 128, 128]
    - [58, 5825.0]
  - - [128, 256, 8, 256, 128, 128, 128, 256]
    - [12, 9218.0]
  - - [128, 256, 8, 512, 128, 128, 128, 512]
    - [18, 15534.0]
  - - [128, 256, 8, 1024, 128, 128, 128, 1024]
    - [51, 23797.0]
  - - [128, 256, 8, 2048, 128, 128, 128, 2048]
    - [30, 31213.0]
  - - [128, 512, 8, 32, 128, 128, 128, 32]
    - [83, 2016.0]
  - - [128, 512, 8, 64, 128, 128, 128, 64]
    - [111, 5447.0]
  - - [128, 512, 8, 128, 128, 128, 128, 128]
    - [35, 9425.0]
  - - [128, 512, 8, 256, 128, 128, 128, 256]
    - [70, 15115.0]
  - - [128, 512, 8, 512, 128, 128, 128, 512]
    - [47, 26214.0]
  - - [128, 512, 8, 1024, 128, 128, 128, 1024]
    - [47, 38130.0]
  - - [128, 512, 8, 2048, 128, 128, 128, 2048]
    - [84, 48280.0]
  - - [128, 1024, 8, 32, 128, 128, 128, 32]
    - [43, 3277.0]
  - - [128, 1024, 8, 64, 128, 128, 128, 64]
    - [56, 9321.0]
  - - [128, 1024, 8, 128, 128, 128, 128, 128]
    - [43, 15978.0]
  - - [128, 1024, 8, 256, 128, 128, 128, 256]
    - [23, 26421.0]
  - - [128, 1024, 8, 512, 128, 128, 128, 512]
    - [112, 40185.0]
  - - [128, 1024, 8, 1024, 128, 128, 128, 1024]
    - [110, 52842.0]
  - - [128, 1024, 8, 2048, 128, 128, 128, 2048]
    - [44, 64373.0]
  - - [128, 2048, 8, 32, 128, 128, 128, 32]
    - [76, 4302.0]
  - - [128, 2048, 8, 64, 128, 128, 128, 64]
    - [99, 13210.0]
  - - [128, 2048, 8, 128, 128, 128, 128, 128]
    - [23, 21509.0]
  - - [128, 2048, 8, 256, 128, 128, 128, 256]
    - [96, 33554.0]
  - - [128, 2048, 8, 512, 128, 128, 128, 512]
    - [28, 51032.0]
  - - [128, 2048, 8, 1024, 128, 128, 128, 1024]
    - [113, 65313.0]
  - - [128, 2048, 8, 2048, 128, 128, 128, 2048]
    - [84, 74051.0]
  - - [256, 32, 8, 32, 256, 256, 256, 32]
    - [29, 288.0]
  - - [256, 32, 8, 64, 256, 256, 256, 64]
    - [33, 558.0]
  - - [256, 32, 8, 128, 256, 256, 256, 128]
    - [68, 1638.0]
  - - [256, 32, 8, 256, 256, 256, 256, 256]
    - [49, 2621.0]
  - - [256, 32, 8, 512, 256, 256, 256, 512]
    - [37, 4324.0]
  - - [256, 32, 8, 1024, 256, 256, 256, 1024]
    - [86, 6933.0]
  - - [256, 32, 8, 2048, 256, 256, 256, 2048]
    - [66, 9869.0]
  - - [256, 64, 8, 32, 256, 256, 256, 32]
    - [37, 570.0]
  - - [256, 64, 8, 64, 256, 256, 256, 64]
    - [47, 1456.0]
  - - [256, 64, 8, 128, 256, 256, 256, 128]
    - [17, 3130.0]
  - - [256, 64, 8, 256, 256, 256, 256, 256]
    - [41, 5115.0]
  - - [256, 64, 8, 512, 256, 256, 256, 512]
    - [49, 8389.0]
  - - [256, 64, 8, 1024, 256, 256, 256, 1024]
    - [52, 13640.0]
  - - [256, 64, 8, 2048, 256, 256, 256, 2048]
    - [29, 18957.0]
  - - [256, 128, 8, 32, 256, 256, 256, 32]
    - [111, 1059.0]
  - - [256, 128, 8, 64, 256, 256, 256, 64]
    - [47, 2873.0]
  - - [256, 128, 8, 128, 256, 256, 256, 128]
    - [18, 5519.0]
  - - [256, 128, 8, 256, 256, 256, 256, 256]
    - [38, 9218.0]
  - - [256, 128, 8, 512, 256, 256, 256, 512]
    - [18, 15115.0]
  - - [256, 128, 8, 1024, 256, 256, 256, 1024]
    - [53, 23967.0]
  - - [256, 128, 8, 2048, 256, 256, 256, 2048]
    - [18, 31956.0]
  - - [256, 256, 8, 32, 256, 256, 256, 32]
    - [83, 1942.0]
  - - [256, 256, 8, 64, 256, 256, 256, 64]
    - [45, 5243.0]
  - - [256, 256, 8, 128, 256, 256, 256, 128]
    - [35, 9118.0]
  - - [256, 256, 8, 256, 256, 256, 256, 256]
    - [22, 14980.0]
  - - [256, 256, 8, 512, 256, 256, 256, 512]
    - [47, 25810.0]
  - - [256, 256, 8, 1024, 256, 256, 256, 1024]
    - [84, 39017.0]
  - - [256, 256, 8, 2048, 256, 256, 256, 2048]
    - [75, 50269.0]
  - - [256, 512, 8, 32, 256, 256, 256, 32]
    - [108, 3153.0]
  - - [256, 512, 8, 64, 256, 256, 256, 64]
    - [43, 9118.0]
  - - [256, 512, 8, 128, 256, 256, 256, 128]
    - [23, 15828.0]
  - - [256, 512, 8, 256, 256, 256, 256, 256]
    - [23, 26420.0]
  - - [256, 512, 8, 512, 256, 256, 256, 512]
    - [28, 40185.0]
  - - [256, 512, 8, 1024, 256, 256, 256, 1024]
    - [44, 51228.0]
  - - [256, 512, 8, 2048, 256, 256, 256, 2048]
    - [72, 63913.0]
  - - [256, 1024, 8, 32, 256, 256, 256, 32]
    - [47, 4324.0]
  - - [256, 1024, 8, 64, 256, 256, 256, 64]
    - [27, 13107.0]
  - - [256, 1024, 8, 128, 256, 256, 256, 128]
    - [55, 21648.0]
  - - [256, 1024, 8, 256, 256, 256, 256, 256]
    - [43, 34239.0]
  - - [256, 1024, 8, 512, 256, 256, 256, 512]
    - [96, 51228.0]
  - - [256, 1024, 8, 1024, 256, 256, 256, 1024]
    - [75, 66117.0]
  - - [256, 1024, 8, 2048, 256, 256, 256, 2048]
    - [75, 76695.0]
  - - [256, 2048, 8, 32, 256, 256, 256, 32]
    - [76, 5928.0]
  - - [256, 2048, 8, 64, 256, 256, 256, 64]
    - [23, 18040.0]
  - - [256, 2048, 8, 128, 256, 256, 256, 128]
    - [23, 30784.0]
  - - [256, 2048, 8, 256, 256, 256, 256, 256]
    - [23, 46603.0]
  - - [256, 2048, 8, 512, 256, 256, 256, 512]
    - [48, 66940.0]
  - - [256, 2048, 8, 1024, 256, 256, 256, 1024]
    - [114, 83624.0]
  - - [256, 2048, 8, 2048, 256, 256, 256, 2048]
    - [28, 90154.0]
  - - [512, 32, 8, 32, 512, 512, 512, 32]
    - [68, 617.0]
  - - [512, 32, 8, 64, 512, 512, 512, 64]
    - [10, 1128.0]
  - - [512, 32, 8, 128, 512, 512, 512, 128]
    - [68, 3130.0]
  - - [512, 32, 8, 256, 512, 512, 512, 256]
    - [91, 5243.0]
  - - [512, 32, 8, 512, 512, 512, 512, 512]
    - [11, 8389.0]
  - - [512, 32, 8, 1024, 512, 512, 512, 1024]
    - [69, 12520.0]
  - - [512, 32, 8, 2048, 512, 512, 512, 2048]
    - [69, 15978.0]
  - - [512, 64, 8, 32, 512, 512, 512, 32]
    - [54, 1059.0]
  - - [512, 64, 8, 64, 512, 512, 512, 64]
    - [20, 2873.0]
  - - [512, 64, 8, 128, 512, 512, 512, 128]
    - [106, 5746.0]
  - - [512, 64, 8, 256, 512, 512, 512, 256]
    - [12, 9425.0]
  - - [512, 64, 8, 512, 512, 512, 512, 512]
    - [35, 15115.0]
  - - [512, 64, 8, 1024, 512, 512, 512, 1024]
    - [102, 21931.0]
  - - [512, 64, 8, 2048, 512, 512, 512, 2048]
    - [97, 27731.0]
  - - [512, 128, 8, 32, 512, 512, 512, 32]
    - [22, 1960.0]
  - - [512, 128, 8, 64, 512, 512, 512, 64]
    - [19, 5309.0]
  - - [512, 128, 8, 128, 512, 512, 512, 128]
    - [18, 9321.0]
  - - [512, 128, 8, 256, 512, 512, 512, 256]
    - [27, 15115.0]
  - - [512, 128, 8, 512, 512, 512, 512, 512]
    - [47, 25041.0]
  - - [512, 128, 8, 1024, 512, 512, 512, 1024]
    - [47, 39017.0]
  - - [512, 128, 8, 2048, 512, 512, 512, 2048]
    - [47, 50081.0]
  - - [512, 256, 8, 32, 512, 512, 512, 32]
    - [26, 3154.0]
  - - [512, 256, 8, 64, 512, 512, 512, 64]
    - [23, 9020.0]
  - - [512, 256, 8, 128, 512, 512, 512, 128]
    - [23, 15534.0]
  - - [512, 256, 8, 256, 512, 512, 512, 256]
    - [28, 25614.0]
  - - [512, 256, 8, 512, 512, 512, 512, 512]
    - [48, 40672.0]
  - - [512, 256, 8, 1024, 512, 512, 512, 1024]
    - [48, 52022.0]
  - - [512, 256, 8, 2048, 512, 512, 512, 2048]
    - [25, 63013.0]
  - - [512, 512, 8, 32, 512, 512, 512, 32]
    - [47, 4369.0]
  - - [512, 512, 8, 64, 512, 512, 512, 64]
    - [62, 13006.0]
  - - [512, 512, 8, 128, 512, 512, 512, 128]
    - [43, 21237.0]
  - - [512, 512, 8, 256, 512, 512, 512, 256]
    - [23, 34592.0]
  - - [512, 512, 8, 512, 512, 512, 512, 512]
    - [43, 51424.0]
  - - [512, 512, 8, 1024, 512, 512, 512, 1024]
    - [113, 67446.0]
  - - [512, 512, 8, 2048, 512, 512, 512, 2048]
    - [113, 77358.0]
  - - [512, 1024, 8, 32, 512, 512, 512, 32]
    - [43, 5825.0]
  - - [512, 1024, 8, 64, 512, 512, 512, 64]
    - [71, 18236.0]
  - - [512, 1024, 8, 128, 512, 512, 512, 128]
    - [23, 30784.0]
  - - [512, 1024, 8, 256, 512, 512, 512, 256]
    - [43, 48280.0]
  - - [512, 1024, 8, 512, 512, 512, 512, 512]
    - [65, 68304.0]
  - - [512, 1024, 8, 1024, 512, 512, 512, 1024]
    - [114, 85899.0]
  - - [512, 1024, 8, 2048, 512, 512, 512, 2048]
    - [28, 91149.0]
  - - [512, 2048, 8, 32, 512, 512, 512, 32]
    - [28, 7407.0]
  - - [512, 2048, 8, 64, 512, 512, 512, 64]
    - [48, 22826.0]
  - - [512, 2048, 8, 128, 512, 512, 512, 128]
    - [55, 38130.0]
  - - [512, 2048, 8, 256, 512, 512, 512, 256]
    - [63, 57852.0]
  - - [512, 2048, 8, 512, 512, 512, 512, 512]
    - [87, 80976.0]
  - - [512, 2048, 8, 1024, 512, 512, 512, 1024]
    - [28, 94686.0]
  - - [512, 2048, 8, 2048, 512, 512, 512, 2048]
    - [48, 98148.0]
  - - [1024, 32, 8, 32, 1024, 1024, 1024, 32]
    - [36, 1008.0]
  - - [1024, 32, 8, 64, 1024, 1024, 1024, 64]
    - [42, 1978.0]
  - - [1024, 32, 8, 128, 1024, 1024, 1024, 128]
    - [13, 5377.0]
  - - [1024, 32, 8, 256, 1024, 1024, 1024, 256]
    - [59, 8389.0]
  - - [1024, 32, 8, 512, 1024, 1024, 1024, 512]
    - [59, 12807.0]
  - - [1024, 32, 8, 1024, 1024, 1024, 1024, 1024]
    - [50, 18641.0]
  - - [1024, 32, 8, 2048, 1024, 1024, 1024, 2048]
    - [77, 23221.0]
  - - [1024, 64, 8, 32, 1024, 1024, 1024, 32]
    - [19, 2056.0]
  - - [1024, 64, 8, 64, 1024, 1024, 1024, 64]
    - [62, 5447.0]
  - - [1024, 64, 8, 128, 1024, 1024, 1024, 128]
    - [40, 9020.0]
  - - [1024, 64, 8, 256, 1024, 1024, 1024, 256]
    - [27, 15828.0]
  - - [1024, 64, 8, 512, 1024, 1024, 1024, 512]
    - [27, 26011.0]
  - - [1024, 64, 8, 1024, 1024, 1024, 1024, 1024]
    - [47, 36274.0]
  - - [1024, 64, 8, 2048, 1024, 1024, 1024, 2048]
    - [84, 45344.0]
  - - [1024, 128, 8, 32, 1024, 1024, 1024, 32]
    - [114, 3251.0]
  - - [1024, 128, 8, 64, 1024, 1024, 1024, 64]
    - [28, 8924.0]
  - - [1024, 128, 8, 128, 1024, 1024, 1024, 128]
    - [48, 15392.0]
  - - [1024, 128, 8, 256, 1024, 1024, 1024, 256]
    - [28, 25229.0]
  - - [1024, 128, 8, 512, 1024, 1024, 1024, 512]
    - [48, 39017.0]
  - - [1024, 128, 8, 1024, 1024, 1024, 1024, 1024]
    - [82, 50648.0]
  - - [1024, 128, 8, 2048, 1024, 1024, 1024, 2048]
    - [25, 60323.0]
  - - [1024, 256, 8, 32, 1024, 1024, 1024, 32]
    - [27, 4369.0]
  - - [1024, 256, 8, 64, 1024, 1024, 1024, 64]
    - [70, 13752.0]
  - - [1024, 256, 8, 128, 1024, 1024, 1024, 128]
    - [71, 21789.0]
  - - [1024, 256, 8, 256, 1024, 1024, 1024, 256]
    - [48, 34592.0]
  - - [1024, 256, 8, 512, 1024, 1024, 1024, 512]
    - [88, 51423.0]
  - - [1024, 256, 8, 1024, 1024, 1024, 1024, 1024]
    - [113, 67277.0]
  - - [1024, 256, 8, 2048, 1024, 1024, 1024, 2048]
    - [113, 76696.0]
  - - [1024, 512, 8, 32, 1024, 1024, 1024, 32]
    - [101, 5887.0]
  - - [1024, 512, 8, 64, 1024, 1024, 1024, 64]
    - [85, 17848.0]
  - - [1024, 512, 8, 128, 1024, 1024, 1024, 128]
    - [119, 30365.0]
  - - [1024, 512, 8, 256, 1024, 1024, 1024, 256]
    - [109, 47935.0]
  - - [1024, 512, 8, 512, 1024, 1024, 1024, 512]
    - [114, 68654.0]
  - - [1024, 512, 8, 1024, 1024, 1024, 1024, 1024]
    - [88, 86872.0]
  - - [1024, 512, 8, 2048, 1024, 1024, 1024, 2048]
    - [114, 92166.0]
  - - [1024, 1024, 8, 32, 1024, 1024, 1024, 32]
    - [43, 7375.0]
  - - [1024, 1024, 8, 64, 1024, 1024, 1024, 64]
    - [23, 22826.0]
  - - [1024, 1024, 8, 128, 1024, 1024, 1024, 128]
    - [5, 38348.0]
  - - [1024, 1024, 8, 256, 1024, 1024, 1024, 256]
    - [76, 57728.0]
  - - [1024, 1024, 8, 512, 1024, 1024, 1024, 512]
    - [56, 81221.0]
  - - [1024, 1024, 8, 1024, 1024, 1024, 1024, 1024]
    - [117, 94022.0]
  - - [1024, 1024, 8, 2048, 1024, 1024, 1024, 2048]
    - [114, 97171.0]
  - - [1024, 2048, 8, 32, 1024, 1024, 1024, 32]
    - [6, 8027.0]
  - - [1024, 2048, 8, 64, 1024, 1024, 1024, 64]
    - [8, 20336.0]
  - - [1024, 2048, 8, 128, 1024, 1024, 1024, 128]
    - [7, 36032.0]
  - - [1024, 2048, 8, 256, 1024, 1024, 1024, 256]
    - [56, 58166.0]
  - - [1024, 2048, 8, 512, 1024, 1024, 1024, 512]
    - [88, 79301.0]
  - - [1024, 2048, 8, 1024, 1024, 1024, 1024, 1024]
    - [71, 98238.0]
  - - [1024, 2048, 8, 2048, 1024, 1024, 1024, 2048]
    - [116, 109761.0]
  - - [2048, 32, 8, 32, 2048, 2048, 2048, 32]
    - [36, 1319.0]
  - - [2048, 32, 8, 64, 2048, 2048, 2048, 64]
    - [64, 2655.0]
  - - [2048, 32, 8, 128, 2048, 2048, 2048, 128]
    - [17, 7767.0]
  - - [2048, 32, 8, 256, 2048, 2048, 2048, 256]
    - [13, 11413.0]
  - - [2048, 32, 8, 512, 2048, 2048, 2048, 512]
    - [13, 15680.0]
  - - [2048, 32, 8, 1024, 2048, 2048, 2048, 1024]
    - [31, 20777.0]
  - - [2048, 32, 8, 2048, 2048, 2048, 2048, 2048]
    - [103, 25041.0]
  - - [2048, 64, 8, 32, 2048, 2048, 2048, 32]
    - [47, 2724.0]
  - - [2048, 64, 8, 64, 2048, 2048, 2048, 64]
    - [111, 8066.0]
  - - [2048, 64, 8, 128, 2048, 2048, 2048, 128]
    - [67, 13640.0]
  - - [2048, 64, 8, 256, 2048, 2048, 2048, 256]
    - [84, 20713.0]
  - - [2048, 64, 8, 512, 2048, 2048, 2048, 512]
    - [16, 29826.0]
  - - [2048, 64, 8, 1024, 2048, 2048, 2048, 1024]
    - [27, 39709.0]
  - - [2048, 64, 8, 2048, 2048, 2048, 2048, 2048]
    - [100, 45965.0]
  - - [2048, 128, 8, 32, 2048, 2048, 2048, 32]
    - [27, 4280.0]
  - - [2048, 128, 8, 64, 2048, 2048, 2048, 64]
    - [47, 12614.0]
  - - [2048, 128, 8, 128, 2048, 2048, 2048, 128]
    - [22, 19973.0]
  - - [2048, 128, 8, 256, 2048, 2048, 2048, 256]
    - [109, 30504.0]
  - - [2048, 128, 8, 512, 2048, 2048, 2048, 512]
    - [87, 43157.0]
  - - [2048, 128, 8, 1024, 2048, 2048, 2048, 1024]
    - [87, 54783.0]
  - - [2048, 128, 8, 2048, 2048, 2048, 2048, 2048]
    - [100, 62572.0]
  - - [2048, 256, 8, 32, 2048, 2048, 2048, 32]
    - [114, 5259.0]
  - - [2048, 256, 8, 64, 2048, 2048, 2048, 64]
    - [120, 15828.0]
  - - [2048, 256, 8, 128, 2048, 2048, 2048, 128]
    - [23, 26844.0]
  - - [2048, 256, 8, 256, 2048, 2048, 2048, 256]
    - [109, 41045.0]
  - - [2048, 256, 8, 512, 2048, 2048, 2048, 512]
    - [88, 57852.0]
  - - [2048, 256, 8, 1024, 2048, 2048, 2048, 1024]
    - [88, 72747.0]
  - - [2048, 256, 8, 2048, 2048, 2048, 2048, 2048]
    - [120, 81529.0]
  - - [2048, 512, 8, 32, 2048, 2048, 2048, 32]
    - [48, 6478.0]
  - - [2048, 512, 8, 64, 2048, 2048, 2048, 64]
    - [61, 18187.0]
  - - [2048, 512, 8, 128, 2048, 2048, 2048, 128]
    - [74, 32897.0]
  - - [2048, 512, 8, 256, 2048, 2048, 2048, 256]
    - [76, 49802.0]
  - - [2048, 512, 8, 512, 2048, 2048, 2048, 512]
    - [56, 70455.0]
  - - [2048, 512, 8, 1024, 2048, 2048, 2048, 1024]
    - [117, 88228.0]
  - - [2048, 512, 8, 2048, 2048, 2048, 2048, 2048]
    - [120, 98148.0]
  - - [2048, 1024, 8, 32, 2048, 2048, 2048, 32]
    - [76, 7415.0]
  - - [2048, 1024, 8, 64, 2048, 2048, 2048, 64]
    - [89, 19796.0]
  - - [2048, 1024, 8, 128, 2048, 2048, 2048, 128]
    - [56, 35367.0]
  - - [2048, 1024, 8, 256, 2048, 2048, 2048, 256]
    - [88, 55982.0]
  - - [2048, 1024, 8, 512, 2048, 2048, 2048, 512]
    - [56, 76750.0]
  - - [2048, 1024, 8, 1024, 2048, 2048, 2048, 1024]
    - [101, 96472.0]
  - - [2048, 1024, 8, 2048, 2048, 2048, 2048, 2048]
    - [101, 109037.0]
  - - [2048, 2048, 8, 32, 2048, 2048, 2048, 32]
    - [2, 8511.0]
  - - [2048, 2048, 8, 64, 2048, 2048, 2048, 64]
    - [80, 21389.0]
  - - [2048, 2048, 8, 128, 2048, 2048, 2048, 128]
    - [81, 38988.0]
  - - [2048, 2048, 8, 256, 2048, 2048, 2048, 256]
    - [88, 60255.0]
  - - [2048, 2048, 8, 512, 2048, 2048, 2048, 512]
    - [55, 79654.0]
  - - [2048, 2048, 8, 1024, 2048, 2048, 2048, 1024]
    - [4, 101945.0]
  - - [2048, 2048, 8, 2048, 2048, 2048, 2048, 2048]
    - [32, 114838.0]
- null
