library/src/blas3/Tensile/Logic/aldebaran/arcturus_Cijk_Ailk_Bjlk_BBH_GB.yaml
- {MinimumRequiredVersion: 4.25.0}
- arcturus
- gfx908
- [Device 7380, Device 7388, Device 738c, Device 7390]
    SolutionIndex: 0
    SolutionNameMin: Cijk_Ailk_Bjlk_BBH_GB_MT32x32x32_MI16x16x8x1_SN_1LDSB0_EPS0_GRVW4_NLCA1_NLCB1_PGR2_SU0_SUS128_TT1_16_WG32_8_1_WGM1
    SolutionIndex: 1
    SolutionNameMin: Cijk_Ailk_Bjlk_BBH_GB_MT64x32x32_MI16x16x8x1_SN_1LDSB0_EPS0_GRVW4_NLCA1_NLCB1_PGR2_SU0_SUS128_TT2_16_WG32_8_1_WGM1
    SolutionIndex: 2
    SolutionNameMin: Cijk_Ailk_Bjlk_BBH_GB_MT64x64x32_MI32x32x4x1_SN_1LDSB0_EPS0_GRVW4_NLCA1_NLCB1_PGR2_SU0_SUS128_TT1_32_WG64_4_1_WGM1
    SolutionIndex: 3
    SolutionNameMin: Cijk_Ailk_Bjlk_BBH_GB_MT32x32x64_MI16x16x8x1_SN_1LDSB0_EPS0_GRVW8_NLCA1_NLCB1_PGR2_SU0_SUS128_TT1_16_WG32_8_1_WGM1
    SolutionIndex: 4
    SolutionNameMin: Cijk_Ailk_Bjlk_BBH_GB_MT32x32x32_MI16x16x8x1_SN_1LDSB0_EPS0_GRVW4_NLCA1_NLCB1_PGR2_SU0_SUS256_TT1_16_WG32_8_1_WGM1
    SolutionIndex: 5
    SolutionNameMin: Cijk_Ailk_Bjlk_BBH_GB_MT64x64x16_MI32x32x4x1_SN_1LDSB0_EPS0_GRVW8_NLCA1_NLCB1_PGR2_SU0_SUS256_TT1_32_WG64_4_1_WGM1
    SolutionIndex: 6
    SolutionNameMin: Cijk_Ailk_Bjlk_BBH_GB_MT64x64x32_MI32x32x4x1_SN_1LDSB0_EPS0_GRVW8_NLCA1_NLCB1_PGR2_SU0_SUS256_TT1_32_WG64_4_1_WGM1
    SolutionIndex: 7
    SolutionNameMin: Cijk_Ailk_Bjlk_BBH_GB_MT32x32x64_MI16x16x8x1_SN_1LDSB0_EPS0_GRVW8_NLCA1_NLCB1_PGR2_SU0_SUS256_TT1_16_WG32_8_1_WGM1
    SolutionIndex: 8
    SolutionNameMin: Cijk_Ailk_Bjlk_BBH_GB_MT32x32x32_MI16x16x8x1_SN_1LDSB0_EPS0_GRVW4_NLCA1_NLCB1_PGR2_SU0_SUS128_TT1_16_WG32_8_1_WGM2
    SolutionIndex: 9
    SolutionNameMin: Cijk_Ailk_Bjlk_BBH_GB_MT32x32x64_MI16x16x8x1_SN_1LDSB0_EPS0_GRVW8_NLCA1_NLCB1_PGR2_SU0_SUS128_TT1_16_WG32_8_1_WGM2
    SolutionIndex: 10
    SolutionNameMin: Cijk_Ailk_Bjlk_BBH_GB_MT32x32x32_MI16x16x8x1_SN_1LDSB0_EPS0_GRVW4_NLCA1_NLCB1_PGR2_SU0_SUS256_TT1_16_WG32_8_1_WGM2
    SolutionIndex: 11
    SolutionNameMin: Cijk_Ailk_Bjlk_BBH_GB_MT32x32x32_MI16x16x8x1_SN_1LDSB0_EPS0_GRVW4_NLCA1_NLCB1_PGR2_SU0_SUS128_TT1_16_WG32_8_1_WGM15
    SolutionIndex: 12
    SolutionNameMin: Cijk_Ailk_Bjlk_BBH_GB_MT32x32x64_MI16x16x8x1_SN_1LDSB0_EPS0_GRVW8_NLCA1_NLCB1_PGR2_SU0_SUS128_TT1_16_WG32_8_1_WGM15
    SolutionIndex: 13
    SolutionNameMin: Cijk_Ailk_Bjlk_BBH_GB_MT32x32x32_MI16x16x8x1_SN_1LDSB0_EPS0_GRVW4_NLCA1_NLCB1_PGR2_SU0_SUS256_TT1_16_WG32_8_1_WGM15
    SolutionIndex: 14
    SolutionNameMin: Cijk_Ailk_Bjlk_BBH_GB_MT64x64x32_MI32x32x4x1_SN_1LDSB0_EPS0_GRVW8_NLCA1_NLCB1_PGR2_SU32_SUS128_TT1_32_WG64_4_1_WGM15
    SolutionIndex: 15
    SolutionNameMin: Cijk_Ailk_Bjlk_BBH_GB_MT32x32x64_MI16x16x8x1_SN_1LDSB0_EPS0_GRVW8_NLCA1_NLCB1_PGR2_SU32_SUS128_TT1_16_WG32_8_1_WGM15
    SolutionIndex: 16
    SolutionNameMin: Cijk_Ailk_Bjlk_BBH_GB_MT64x64x16_MI32x32x4x1_SN_1LDSB0_EPS0_GRVW4_NLCA1_NLCB1_PGR2_SU32_SUS256_TT1_32_WG64_4_1_WGM15
- - - [32, 32, 8, 128, 32, 32, 32, 32]
    - [4, 162.0]
  - - [128, 128, 8, 128, 128, 128, 128, 128]
    - [13, 2356.0]
  - - [256, 256, 8, 128, 256, 256, 256, 256]
    - [1, 7914.0]
  - - [512, 512, 8, 128, 512, 512, 512, 512]
    - [5, 20841.0]
  - - [32, 32, 8, 512, 32, 32, 32, 32]
    - [15, 423.0]
  - - [128, 128, 8, 512, 128, 128, 128, 128]
    - [7, 6605.0]
  - - [256, 256, 8, 512, 256, 256, 256, 256]
    - [6, 17754.0]
  - - [512, 512, 8, 512, 512, 512, 512, 512]
    - [16, 34592.0]
  - - [32, 32, 8, 1024, 32, 32, 32, 32]
    - [12, 636.0]
  - - [128, 128, 8, 1024, 128, 128, 128, 128]
    - [7, 8924.0]
  - - [256, 256, 8, 1024, 256, 256, 256, 256]
    - [2, 21789.0]
  - - [512, 512, 8, 1024, 512, 512, 512, 512]
    - [14, 39827.0]
  - - [32, 128, 8, 128, 32, 32, 32, 128]
    - [8, 617.0]
  - - [32, 256, 8, 128, 32, 32, 32, 256]
    - [8, 1192.0]
  - - [32, 512, 8, 128, 32, 32, 32, 512]
    - [13, 2383.0]
  - - [32, 128, 8, 512, 32, 32, 32, 128]
    - [8, 1589.0]
  - - [32, 256, 8, 512, 32, 32, 32, 256]
    - [11, 3251.0]
  - - [32, 512, 8, 512, 32, 32, 32, 512]
    - [10, 6404.0]
  - - [32, 128, 8, 1024, 32, 32, 32, 128]
    - [3, 2305.0]
  - - [32, 256, 8, 1024, 32, 32, 32, 256]
    - [3, 4534.0]
  - - [32, 512, 8, 1024, 32, 32, 32, 512]
    - [11, 8347.0]
  - - [128, 32, 8, 128, 128, 128, 128, 32]
    - [4, 610.0]
  - - [256, 32, 8, 128, 256, 256, 256, 32]
    - [0, 1248.0]
  - - [512, 32, 8, 128, 512, 512, 512, 32]
    - [8, 2383.0]
  - - [128, 32, 8, 512, 128, 128, 128, 32]
    - [7, 1638.0]
  - - [256, 32, 8, 512, 256, 256, 256, 32]
    - [7, 3303.0]
  - - [512, 32, 8, 512, 512, 512, 512, 32]
    - [9, 6123.0]
  - - [128, 32, 8, 1024, 128, 128, 128, 32]
    - [7, 2397.0]
  - - [256, 32, 8, 1024, 256, 256, 256, 32]
    - [3, 4766.0]
  - - [512, 32, 8, 1024, 512, 512, 512, 32]
    - [3, 8306.0]
- null
