library/src/blas3/Tensile/Logic/aldebaran/arcturus_Cijk_Alik_Bjlk_DB_GB.yaml
- {MinimumRequiredVersion: 4.26.0}
- arcturus
- gfx908
- [Device 7380, Device 7388, Device 738c, Device 7390]
    SolutionIndex: 0
    SolutionNameMin: Cijk_Alik_Bjlk_DB_GB_MT32x128x8_SN_PLR1_SU0_SUM0_SUS256_SNLL1_TT4_4_WG8_32_1_WGM1
    SolutionIndex: 1
    SolutionNameMin: Cijk_Alik_Bjlk_DB_GB_MT64x64x8_SN_PLR1_SU0_SUM0_SUS256_SNLL1_TT4_4_WG16_16_1_WGM1
    SolutionIndex: 2
    SolutionNameMin: Cijk_Alik_Bjlk_DB_GB_MT128x32x8_SN_PLR1_SU0_SUM0_SUS256_SNLL1_TT4_4_WG32_8_1_WGM1
    SolutionIndex: 3
    SolutionNameMin: Cijk_Alik_Bjlk_DB_GB_MT192x32x8_SN_PLR1_SU0_SUM0_SUS256_SNLL1_TT6_4_WG32_8_1_WGM1
    SolutionIndex: 4
    SolutionNameMin: Cijk_Alik_Bjlk_DB_GB_MT32x128x16_SN_PLR1_SU0_SUM0_SUS256_SNLL1_TT4_4_WG8_32_1_WGM1
    SolutionIndex: 5
    SolutionNameMin: Cijk_Alik_Bjlk_DB_GB_MT128x32x16_SN_PLR1_SU0_SUM0_SUS256_SNLL1_TT4_4_WG32_8_1_WGM1
    SolutionIndex: 6
    SolutionNameMin: Cijk_Alik_Bjlk_DB_GB_MT32x128x8_SN_PLR1_SU32_SUM0_SUS128_SNLL1_TT4_4_WG8_32_1_WGM1
    SolutionIndex: 7
    SolutionNameMin: Cijk_Alik_Bjlk_DB_GB_MT128x32x8_SN_PLR1_SU32_SUM0_SUS128_SNLL1_TT4_4_WG32_8_1_WGM1
    SolutionIndex: 8
    SolutionNameMin: Cijk_Alik_Bjlk_DB_GB_MT32x128x16_SN_PLR1_SU32_SUM0_SUS128_SNLL1_TT4_4_WG8_32_1_WGM1
    SolutionIndex: 9
    SolutionNameMin: Cijk_Alik_Bjlk_DB_GB_MT64x64x8_SN_PLR1_SU32_SUM3_SUS128_SNLL1_TT4_4_WG16_16_1_WGM1
    SolutionIndex: 10
    SolutionNameMin: Cijk_Alik_Bjlk_DB_GB_MT128x32x8_SN_PLR0_SU32_SUM3_SUS128_SNLL1_TT4_4_WG32_8_1_WGM1
    SolutionIndex: 11
    SolutionNameMin: Cijk_Alik_Bjlk_DB_GB_MT32x128x16_SN_PLR1_SU32_SUM3_SUS128_SNLL1_TT4_4_WG8_32_1_WGM1
    SolutionIndex: 12
    SolutionNameMin: Cijk_Alik_Bjlk_DB_GB_MT64x64x8_SN_PLR1_SU32_SUM3_SUS256_SNLL1_TT4_4_WG16_16_1_WGM1
    SolutionIndex: 13
    SolutionNameMin: Cijk_Alik_Bjlk_DB_GB_MT32x128x8_SN_PLR1_SU0_SUM0_SUS256_SNLL1_TT4_4_WG8_32_1_WGM8
    SolutionIndex: 14
    SolutionNameMin: Cijk_Alik_Bjlk_DB_GB_MT64x64x8_SN_PLR1_SU0_SUM0_SUS256_SNLL1_TT4_4_WG16_16_1_WGM8
    SolutionIndex: 15
    SolutionNameMin: Cijk_Alik_Bjlk_DB_GB_MT128x32x8_SN_PLR1_SU0_SUM0_SUS256_SNLL1_TT4_4_WG32_8_1_WGM8
    SolutionIndex: 16
    SolutionNameMin: Cijk_Alik_Bjlk_DB_GB_MT32x128x16_SN_PLR1_SU0_SUM0_SUS256_SNLL1_TT4_4_WG8_32_1_WGM8
    SolutionIndex: 17
    SolutionNameMin: Cijk_Alik_Bjlk_DB_GB_MT64x64x16_SN_PLR1_SU0_SUM0_SUS256_SNLL1_TT4_4_WG16_16_1_WGM8
    SolutionIndex: 18
    SolutionNameMin: Cijk_Alik_Bjlk_DB_GB_MT32x192x8_SN_PLR1_SU32_SUM0_SUS128_SNLL1_TT4_6_WG8_32_1_WGM8
    SolutionIndex: 19
    SolutionNameMin: Cijk_Alik_Bjlk_DB_GB_MT64x64x8_SN_PLR1_SU32_SUM0_SUS128_SNLL1_TT4_4_WG16_16_1_WGM8
    SolutionIndex: 20
    SolutionNameMin: Cijk_Alik_Bjlk_DB_GB_MT32x128x8_SN_PLR1_SU32_SUM0_SUS256_SNLL1_TT4_4_WG8_32_1_WGM8
    SolutionIndex: 21
    SolutionNameMin: Cijk_Alik_Bjlk_DB_GB_MT64x64x8_SN_PLR1_SU32_SUM0_SUS256_SNLL1_TT4_4_WG16_16_1_WGM8
    SolutionIndex: 22
    SolutionNameMin: Cijk_Alik_Bjlk_DB_GB_MT32x128x16_SN_PLR1_SU32_SUM0_SUS256_SNLL1_TT4_4_WG8_32_1_WGM8
    SolutionIndex: 23
    SolutionNameMin: Cijk_Alik_Bjlk_DB_GB_MT32x128x8_SN_PLR1_SU32_SUM3_SUS256_SNLL1_TT4_4_WG8_32_1_WGM8
    SolutionIndex: 24
    SolutionNameMin: Cijk_Alik_Bjlk_DB_GB_MT32x128x8_SN_PLR1_SU0_SUM0_SUS256_SNLL1_TT4_4_WG8_32_1_WGM15
    SolutionIndex: 25
    SolutionNameMin: Cijk_Alik_Bjlk_DB_GB_MT64x64x8_SN_PLR1_SU0_SUM0_SUS256_SNLL1_TT4_4_WG16_16_1_WGM15
    SolutionIndex: 26
    SolutionNameMin: Cijk_Alik_Bjlk_DB_GB_MT128x32x8_SN_PLR1_SU0_SUM0_SUS256_SNLL1_TT4_4_WG32_8_1_WGM15
    SolutionIndex: 27
    SolutionNameMin: Cijk_Alik_Bjlk_DB_GB_MT128x32x8_SN_PLR0_SU0_SUM0_SUS256_SNLL1_TT4_4_WG32_8_1_WGM15
    SolutionIndex: 28
    SolutionNameMin: Cijk_Alik_Bjlk_DB_GB_MT32x128x16_SN_PLR1_SU0_SUM0_SUS256_SNLL1_TT4_4_WG8_32_1_WGM15
    SolutionIndex: 29
    SolutionNameMin: Cijk_Alik_Bjlk_DB_GB_MT64x64x16_SN_PLR1_SU0_SUM0_SUS256_SNLL1_TT4_4_WG16_16_1_WGM15
    SolutionIndex: 30
    SolutionNameMin: Cijk_Alik_Bjlk_DB_GB_MT64x64x8_SN_PLR1_SU32_SUM0_SUS128_SNLL1_TT4_4_WG16_16_1_WGM15
    SolutionIndex: 31
    SolutionNameMin: Cijk_Alik_Bjlk_DB_GB_MT64x64x8_SN_PLR1_SU32_SUM3_SUS128_SNLL1_TT4_4_WG16_16_1_WGM15
    SolutionIndex: 32
    SolutionNameMin: Cijk_Alik_Bjlk_DB_GB_MT128x32x8_SN_PLR1_SU32_SUM3_SUS128_SNLL1_TT4_4_WG32_8_1_WGM15
    SolutionIndex: 33
    SolutionNameMin: Cijk_Alik_Bjlk_DB_GB_MT32x128x16_SN_PLR1_SU32_SUM3_SUS256_SNLL1_TT4_4_WG8_32_1_WGM15
    SolutionIndex: 34
    SolutionNameMin: Cijk_Alik_Bjlk_DB_GB_MT64x64x8_SN_PLR1_SU0_SUM0_SUS256_SNLL0_TT4_4_WG16_16_1_WGM1
    SolutionIndex: 35
    SolutionNameMin: Cijk_Alik_Bjlk_DB_GB_MT64x64x8_SN_PLR0_SU0_SUM0_SUS256_SNLL0_TT4_4_WG16_16_1_WGM1
    SolutionIndex: 36
    SolutionNameMin: Cijk_Alik_Bjlk_DB_GB_MT128x32x8_SN_PLR1_SU0_SUM0_SUS256_SNLL0_TT4_4_WG32_8_1_WGM1
    SolutionIndex: 37
    SolutionNameMin: Cijk_Alik_Bjlk_DB_GB_MT128x32x8_SN_PLR0_SU0_SUM0_SUS256_SNLL0_TT4_4_WG32_8_1_WGM1
    SolutionIndex: 38
    SolutionNameMin: Cijk_Alik_Bjlk_DB_GB_MT32x128x8_SN_PLR1_SU32_SUM0_SUS128_SNLL0_TT4_4_WG8_32_1_WGM1
    SolutionIndex: 39
    SolutionNameMin: Cijk_Alik_Bjlk_DB_GB_MT64x64x8_SN_PLR1_SU32_SUM0_SUS128_SNLL0_TT4_4_WG16_16_1_WGM1
    SolutionIndex: 40
    SolutionNameMin: Cijk_Alik_Bjlk_DB_GB_MT64x64x8_SN_PLR0_SU32_SUM0_SUS128_SNLL0_TT4_4_WG16_16_1_WGM1
    SolutionIndex: 41
    SolutionNameMin: Cijk_Alik_Bjlk_DB_GB_MT128x32x8_SN_PLR1_SU32_SUM0_SUS128_SNLL0_TT4_4_WG32_8_1_WGM1
    SolutionIndex: 42
    SolutionNameMin: Cijk_Alik_Bjlk_DB_GB_MT32x128x16_SN_PLR1_SU32_SUM0_SUS128_SNLL0_TT4_4_WG8_32_1_WGM1
    SolutionIndex: 43
    SolutionNameMin: Cijk_Alik_Bjlk_DB_GB_MT64x64x8_SN_PLR1_SU32_SUM3_SUS128_SNLL0_TT4_4_WG16_16_1_WGM1
    SolutionIndex: 44
    SolutionNameMin: Cijk_Alik_Bjlk_DB_GB_MT32x128x8_SN_PLR1_SU32_SUM0_SUS256_SNLL0_TT4_4_WG8_32_1_WGM1
    SolutionIndex: 45
    SolutionNameMin: Cijk_Alik_Bjlk_DB_GB_MT64x64x8_SN_PLR1_SU32_SUM0_SUS256_SNLL0_TT4_4_WG16_16_1_WGM1
    SolutionIndex: 46
    SolutionNameMin: Cijk_Alik_Bjlk_DB_GB_MT64x64x8_SN_PLR0_SU32_SUM0_SUS256_SNLL0_TT4_4_WG16_16_1_WGM1
    SolutionIndex: 47
    SolutionNameMin: Cijk_Alik_Bjlk_DB_GB_MT32x128x16_SN_PLR1_SU32_SUM0_SUS256_SNLL0_TT4_4_WG8_32_1_WGM1
    SolutionIndex: 48
    SolutionNameMin: Cijk_Alik_Bjlk_DB_GB_MT64x64x8_SN_PLR1_SU32_SUM3_SUS256_SNLL0_TT4_4_WG16_16_1_WGM1
    SolutionIndex: 49
    SolutionNameMin: Cijk_Alik_Bjlk_DB_GB_MT64x64x8_SN_PLR0_SU32_SUM3_SUS256_SNLL0_TT4_4_WG16_16_1_WGM1
    SolutionIndex: 50
    SolutionNameMin: Cijk_Alik_Bjlk_DB_GB_MT32x128x8_SN_PLR1_SU0_SUM0_SUS256_SNLL0_TT4_4_WG8_32_1_WGM8
    SolutionIndex: 51
    SolutionNameMin: Cijk_Alik_Bjlk_DB_GB_MT64x64x8_SN_PLR1_SU0_SUM0_SUS256_SNLL0_TT4_4_WG16_16_1_WGM8
    SolutionIndex: 52
    SolutionNameMin: Cijk_Alik_Bjlk_DB_GB_MT64x64x8_SN_PLR0_SU0_SUM0_SUS256_SNLL0_TT4_4_WG16_16_1_WGM8
    SolutionIndex: 53
    SolutionNameMin: Cijk_Alik_Bjlk_DB_GB_MT128x32x8_SN_PLR0_SU0_SUM0_SUS256_SNLL0_TT4_4_WG32_8_1_WGM8
    SolutionIndex: 54
    SolutionNameMin: Cijk_Alik_Bjlk_DB_GB_MT32x128x16_SN_PLR1_SU0_SUM0_SUS256_SNLL0_TT4_4_WG8_32_1_WGM8
    SolutionIndex: 55
    SolutionNameMin: Cijk_Alik_Bjlk_DB_GB_MT32x128x8_SN_PLR1_SU32_SUM0_SUS128_SNLL0_TT4_4_WG8_32_1_WGM8
    SolutionIndex: 56
    SolutionNameMin: Cijk_Alik_Bjlk_DB_GB_MT64x64x8_SN_PLR1_SU32_SUM0_SUS128_SNLL0_TT4_4_WG16_16_1_WGM8
    SolutionIndex: 57
    SolutionNameMin: Cijk_Alik_Bjlk_DB_GB_MT64x64x8_SN_PLR0_SU32_SUM0_SUS128_SNLL0_TT4_4_WG16_16_1_WGM8
    SolutionIndex: 58
    SolutionNameMin: Cijk_Alik_Bjlk_DB_GB_MT32x128x16_SN_PLR1_SU32_SUM0_SUS128_SNLL0_TT4_4_WG8_32_1_WGM8
    SolutionIndex: 59
    SolutionNameMin: Cijk_Alik_Bjlk_DB_GB_MT64x64x8_SN_PLR1_SU32_SUM3_SUS128_SNLL0_TT4_4_WG16_16_1_WGM8
    SolutionIndex: 60
    SolutionNameMin: Cijk_Alik_Bjlk_DB_GB_MT64x64x8_SN_PLR0_SU32_SUM3_SUS128_SNLL0_TT4_4_WG16_16_1_WGM8
    SolutionIndex: 61
    SolutionNameMin: Cijk_Alik_Bjlk_DB_GB_MT32x128x16_SN_PLR1_SU32_SUM3_SUS128_SNLL0_TT4_4_WG8_32_1_WGM8
    SolutionIndex: 62
    SolutionNameMin: Cijk_Alik_Bjlk_DB_GB_MT32x128x8_SN_PLR1_SU32_SUM0_SUS256_SNLL0_TT4_4_WG8_32_1_WGM8
    SolutionIndex: 63
    SolutionNameMin: Cijk_Alik_Bjlk_DB_GB_MT64x64x8_SN_PLR1_SU32_SUM0_SUS256_SNLL0_TT4_4_WG16_16_1_WGM8
    SolutionIndex: 64
    SolutionNameMin: Cijk_Alik_Bjlk_DB_GB_MT128x32x8_SN_PLR0_SU32_SUM0_SUS256_SNLL0_TT4_4_WG32_8_1_WGM8
    SolutionIndex: 65
    SolutionNameMin: Cijk_Alik_Bjlk_DB_GB_MT32x128x16_SN_PLR1_SU32_SUM0_SUS256_SNLL0_TT4_4_WG8_32_1_WGM8
    SolutionIndex: 66
    SolutionNameMin: Cijk_Alik_Bjlk_DB_GB_MT64x64x32_SN_PLR1_SU32_SUM0_SUS256_SNLL0_TT4_4_WG16_16_1_WGM8
    SolutionIndex: 67
    SolutionNameMin: Cijk_Alik_Bjlk_DB_GB_MT32x128x8_SN_PLR1_SU32_SUM3_SUS256_SNLL0_TT4_4_WG8_32_1_WGM8
    SolutionIndex: 68
    SolutionNameMin: Cijk_Alik_Bjlk_DB_GB_MT64x64x8_SN_PLR1_SU32_SUM3_SUS256_SNLL0_TT4_4_WG16_16_1_WGM8
    SolutionIndex: 69
    SolutionNameMin: Cijk_Alik_Bjlk_DB_GB_MT64x64x8_SN_PLR0_SU32_SUM3_SUS256_SNLL0_TT4_4_WG16_16_1_WGM8
    SolutionIndex: 70
    SolutionNameMin: Cijk_Alik_Bjlk_DB_GB_MT32x128x16_SN_PLR1_SU32_SUM3_SUS256_SNLL0_TT4_4_WG8_32_1_WGM8
    SolutionIndex: 71
    SolutionNameMin: Cijk_Alik_Bjlk_DB_GB_MT32x128x8_SN_PLR1_SU0_SUM0_SUS256_SNLL0_TT4_4_WG8_32_1_WGM15
    SolutionIndex: 72
    SolutionNameMin: Cijk_Alik_Bjlk_DB_GB_MT64x64x8_SN_PLR1_SU0_SUM0_SUS256_SNLL0_TT4_4_WG16_16_1_WGM15
    SolutionIndex: 73
    SolutionNameMin: Cijk_Alik_Bjlk_DB_GB_MT64x64x8_SN_PLR0_SU0_SUM0_SUS256_SNLL0_TT4_4_WG16_16_1_WGM15
    SolutionIndex: 74
    SolutionNameMin: Cijk_Alik_Bjlk_DB_GB_MT128x32x8_SN_PLR0_SU0_SUM0_SUS256_SNLL0_TT4_4_WG32_8_1_WGM15
    SolutionIndex: 75
    SolutionNameMin: Cijk_Alik_Bjlk_DB_GB_MT32x128x16_SN_PLR1_SU0_SUM0_SUS256_SNLL0_TT4_4_WG8_32_1_WGM15
    SolutionIndex: 76
    SolutionNameMin: Cijk_Alik_Bjlk_DB_GB_MT128x32x16_SN_PLR1_SU0_SUM0_SUS256_SNLL0_TT4_4_WG32_8_1_WGM15
    SolutionIndex: 77
    SolutionNameMin: Cijk_Alik_Bjlk_DB_GB_MT32x128x8_SN_PLR1_SU32_SUM0_SUS128_SNLL0_TT4_4_WG8_32_1_WGM15
    SolutionIndex: 78
    SolutionNameMin: Cijk_Alik_Bjlk_DB_GB_MT64x64x8_SN_PLR1_SU32_SUM0_SUS128_SNLL0_TT4_4_WG16_16_1_WGM15
    SolutionIndex: 79
    SolutionNameMin: Cijk_Alik_Bjlk_DB_GB_MT32x128x16_SN_PLR1_SU32_SUM0_SUS128_SNLL0_TT4_4_WG8_32_1_WGM15
    SolutionIndex: 80
    SolutionNameMin: Cijk_Alik_Bjlk_DB_GB_MT64x64x8_SN_PLR1_SU32_SUM3_SUS128_SNLL0_TT4_4_WG16_16_1_WGM15
    SolutionIndex: 81
    SolutionNameMin: Cijk_Alik_Bjlk_DB_GB_MT64x64x8_SN_PLR1_SU32_SUM0_SUS256_SNLL0_TT4_4_WG16_16_1_WGM15
    SolutionIndex: 82
    SolutionNameMin: Cijk_Alik_Bjlk_DB_GB_MT64x64x16_SN_PLR1_SU32_SUM0_SUS256_SNLL0_TT4_4_WG16_16_1_WGM15
    SolutionIndex: 83
    SolutionNameMin: Cijk_Alik_Bjlk_DB_GB_MT64x64x8_SN_PLR1_SU32_SUM3_SUS256_SNLL0_TT4_4_WG16_16_1_WGM15
    SolutionIndex: 84
    SolutionNameMin: Cijk_Alik_Bjlk_DB_GB_MT16x16x4_SN_PLR1_SU0_SUM0_SUS256_SNLL1_TT2_2_WG8_8_1_WGM1
    SolutionIndex: 85
    SolutionNameMin: Cijk_Alik_Bjlk_DB_GB_MT8x8x8_SN_PLR1_SU0_SUM0_SUS256_SNLL1_TT1_1_WG8_8_1_WGM1
    SolutionIndex: 86
    SolutionNameMin: Cijk_Alik_Bjlk_DB_GB_MT8x8x8_SN_PLR0_SU0_SUM0_SUS256_SNLL1_TT1_1_WG8_8_1_WGM1
    SolutionIndex: 87
    SolutionNameMin: Cijk_Alik_Bjlk_DB_GB_MT16x16x4_SN_PLR1_SU0_SUM0_SUS256_SNLL0_TT2_2_WG8_8_1_WGM1
    SolutionIndex: 88
    SolutionNameMin: Cijk_Alik_Bjlk_DB_GB_MT8x8x8_SN_PLR1_SU0_SUM0_SUS256_SNLL0_TT1_1_WG8_8_1_WGM1
    SolutionIndex: 89
    SolutionNameMin: Cijk_Alik_Bjlk_DB_GB_MT16x16x8_SN_PLR1_SU0_SUM0_SUS256_SNLL0_TT2_2_WG8_8_1_WGM1
    SolutionIndex: 90
    SolutionNameMin: Cijk_Alik_Bjlk_DB_GB_MT8x8x8_SN_PLR1_SU32_SUM0_SUS128_SNLL0_TT1_1_WG8_8_1_WGM1
    SolutionIndex: 91
    SolutionNameMin: Cijk_Alik_Bjlk_DB_GB_MT16x16x8_SN_PLR1_SU32_SUM0_SUS128_SNLL0_TT2_2_WG8_8_1_WGM1
    SolutionIndex: 92
    SolutionNameMin: Cijk_Alik_Bjlk_DB_GB_MT32x32x8_SN_PLR1_SU32_SUM0_SUS128_SNLL0_TT2_2_WG16_16_1_WGM1
    SolutionIndex: 93
    SolutionNameMin: Cijk_Alik_Bjlk_DB_GB_MT32x32x8_SN_PLR1_SU32_SUM3_SUS128_SNLL0_TT2_2_WG16_16_1_WGM1
    SolutionIndex: 94
    SolutionNameMin: Cijk_Alik_Bjlk_DB_GB_MT32x32x8_SN_PLR1_SU0_SUM0_SUS256_SNLL0_TT2_2_WG16_16_1_WGM8
    SolutionIndex: 95
    SolutionNameMin: Cijk_Alik_Bjlk_DB_GB_MT32x32x8_SN_PLR1_SU32_SUM0_SUS128_SNLL0_TT2_2_WG16_16_1_WGM8
    SolutionIndex: 96
    SolutionNameMin: Cijk_Alik_Bjlk_DB_GB_MT8x16x8_SN_PLR1_SU32_SUM3_SUS128_SNLL0_TT1_2_WG8_8_1_WGM8
    SolutionIndex: 97
    SolutionNameMin: Cijk_Alik_Bjlk_DB_GB_MT32x32x8_SN_PLR1_SU32_SUM3_SUS128_SNLL0_TT2_2_WG16_16_1_WGM8
    SolutionIndex: 98
    SolutionNameMin: Cijk_Alik_Bjlk_DB_GB_MT32x32x8_SN_PLR1_SU32_SUM0_SUS256_SNLL0_TT2_2_WG16_16_1_WGM8
    SolutionIndex: 99
    SolutionNameMin: Cijk_Alik_Bjlk_DB_GB_MT16x16x8_SN_PLR1_SU32_SUM3_SUS256_SNLL0_TT2_1_WG8_16_1_WGM8
    SolutionIndex: 100
    SolutionNameMin: Cijk_Alik_Bjlk_DB_GB_MT16x16x4_SN_PLR1_SU0_SUM0_SUS256_SNLL0_TT2_2_WG8_8_1_WGM15
    SolutionIndex: 101
    SolutionNameMin: Cijk_Alik_Bjlk_DB_GB_MT32x32x8_SN_PLR1_SU32_SUM0_SUS128_SNLL0_TT2_2_WG16_16_1_WGM15
    SolutionIndex: 102
    SolutionNameMin: Cijk_Alik_Bjlk_DB_GB_MT32x32x8_SN_PLR1_SU32_SUM3_SUS128_SNLL0_TT2_2_WG16_16_1_WGM15
    SolutionIndex: 103
    SolutionNameMin: Cijk_Alik_Bjlk_DB_GB_MT32x32x8_SN_PLR0_SU32_SUM3_SUS128_SNLL0_TT2_2_WG16_16_1_WGM15
    SolutionIndex: 104
    SolutionNameMin: Cijk_Alik_Bjlk_DB_GB_MT32x32x8_SN_PLR1_SU32_SUM0_SUS256_SNLL0_TT2_2_WG16_16_1_WGM15
    SolutionIndex: 105
    SolutionNameMin: Cijk_Alik_Bjlk_DB_GB_MT16x16x4_SN_PLR1_SU32_SUM3_SUS256_SNLL0_TT2_2_WG8_8_1_WGM15
    SolutionIndex: 106
    SolutionNameMin: Cijk_Alik_Bjlk_DB_GB_MT32x32x8_SN_PLR0_SU32_SUM3_SUS256_SNLL0_TT2_2_WG16_16_1_WGM15
    SolutionIndex: 107
    SolutionNameMin: Cijk_Alik_Bjlk_DB_GB_MT32x32x8_SN_PLR1_SU0_SUM0_SUS256_SNLL1_TT4_4_WG8_8_1_WGM1
    SolutionIndex: 108
    SolutionNameMin: Cijk_Alik_Bjlk_DB_GB_MT24x24x8_SN_PLR1_SU0_SUM0_SUS256_SNLL1_TT3_3_WG8_8_1_WGM8
    SolutionIndex: 109
    SolutionNameMin: Cijk_Alik_Bjlk_DB_GB_MT24x24x8_SN_PLR1_SU0_SUM0_SUS256_SNLL1_TT3_3_WG8_8_1_WGM15
    SolutionIndex: 110
    SolutionNameMin: Cijk_Alik_Bjlk_DB_GB_MT24x24x8_SN_PLR1_SU0_SUM0_SUS256_SNLL0_TT3_3_WG8_8_1_WGM1
    SolutionIndex: 111
    SolutionNameMin: Cijk_Alik_Bjlk_DB_GB_MT32x32x8_SN_PLR1_SU0_SUM0_SUS256_SNLL0_TT4_4_WG8_8_1_WGM1
    SolutionIndex: 112
    SolutionNameMin: Cijk_Alik_Bjlk_DB_GB_MT40x40x8_SN_PLR1_SU0_SUM0_SUS256_SNLL0_TT5_5_WG8_8_1_WGM1
    SolutionIndex: 113
    SolutionNameMin: Cijk_Alik_Bjlk_DB_GB_MT48x48x8_SN_PLR1_SU0_SUM0_SUS256_SNLL0_TT6_6_WG8_8_1_WGM1
    SolutionIndex: 114
    SolutionNameMin: Cijk_Alik_Bjlk_DB_GB_MT24x24x8_SN_PLR1_SU32_SUM0_SUS128_SNLL0_TT3_3_WG8_8_1_WGM1
    SolutionIndex: 115
    SolutionNameMin: Cijk_Alik_Bjlk_DB_GB_MT32x32x8_SN_PLR1_SU32_SUM0_SUS256_SNLL0_TT4_4_WG8_8_1_WGM1
    SolutionIndex: 116
    SolutionNameMin: Cijk_Alik_Bjlk_DB_GB_MT40x40x8_SN_PLR1_SU32_SUM0_SUS256_SNLL0_TT5_5_WG8_8_1_WGM1
    SolutionIndex: 117
    SolutionNameMin: Cijk_Alik_Bjlk_DB_GB_MT40x40x8_SN_PLR1_SU32_SUM3_SUS256_SNLL0_TT5_5_WG8_8_1_WGM1
    SolutionIndex: 118
    SolutionNameMin: Cijk_Alik_Bjlk_DB_GB_MT24x24x8_SN_PLR1_SU0_SUM0_SUS256_SNLL0_TT3_3_WG8_8_1_WGM8
    SolutionIndex: 119
    SolutionNameMin: Cijk_Alik_Bjlk_DB_GB_MT32x32x8_SN_PLR1_SU0_SUM0_SUS256_SNLL0_TT4_4_WG8_8_1_WGM8
    SolutionIndex: 120
    SolutionNameMin: Cijk_Alik_Bjlk_DB_GB_MT48x48x8_SN_PLR1_SU0_SUM0_SUS256_SNLL0_TT6_6_WG8_8_1_WGM8
    SolutionIndex: 121
    SolutionNameMin: Cijk_Alik_Bjlk_DB_GB_MT24x24x8_SN_PLR1_SU32_SUM0_SUS256_SNLL0_TT3_3_WG8_8_1_WGM8
    SolutionIndex: 122
    SolutionNameMin: Cijk_Alik_Bjlk_DB_GB_MT24x24x8_SN_PLR1_SU0_SUM0_SUS256_SNLL0_TT3_3_WG8_8_1_WGM15
    SolutionIndex: 123
    SolutionNameMin: Cijk_Alik_Bjlk_DB_GB_MT32x32x8_SN_PLR1_SU0_SUM0_SUS256_SNLL0_TT4_4_WG8_8_1_WGM15
    SolutionIndex: 124
    SolutionNameMin: Cijk_Alik_Bjlk_DB_GB_MT40x40x8_SN_PLR1_SU0_SUM0_SUS256_SNLL0_TT5_5_WG8_8_1_WGM15
    SolutionIndex: 125
    SolutionNameMin: Cijk_Alik_Bjlk_DB_GB_MT48x48x8_SN_PLR1_SU0_SUM0_SUS256_SNLL0_TT6_6_WG8_8_1_WGM15
    SolutionIndex: 126
    SolutionNameMin: Cijk_Alik_Bjlk_DB_GB_MT24x24x8_SN_PLR1_SU32_SUM0_SUS128_SNLL0_TT3_3_WG8_8_1_WGM15
    SolutionIndex: 127
    SolutionNameMin: Cijk_Alik_Bjlk_DB_GB_MT24x24x8_SN_PLR1_SU32_SUM0_SUS256_SNLL0_TT3_3_WG8_8_1_WGM15
    SolutionIndex: 128
    SolutionNameMin: Cijk_Alik_Bjlk_DB_GB_MT24x24x8_SN_PLR1_SU32_SUM3_SUS256_SNLL0_TT3_3_WG8_8_1_WGM15
    SolutionIndex: 129
    SolutionNameMin: Cijk_Alik_Bjlk_DB_GB_MT40x40x8_SN_PLR1_SU32_SUM3_SUS256_SNLL0_TT5_5_WG8_8_1_WGM15
    SolutionIndex: 130
    SolutionNameMin: Cijk_Alik_Bjlk_DB_GB_MT64x128x8_SN_PLR0_SU0_SUM0_SUS256_SNLL0_TT8_4_WG8_32_1_WGM8
    SolutionIndex: 131
    SolutionNameMin: Cijk_Alik_Bjlk_DB_GB_MT64x128x8_SN_PLR0_SU32_SUM0_SUS128_SNLL0_TT8_4_WG8_32_1_WGM8
    SolutionIndex: 132
    SolutionNameMin: Cijk_Alik_Bjlk_DB_GB_MT32x256x8_SN_PLR1_SU32_SUM3_SUS128_SNLL0_TT4_8_WG8_32_1_WGM8
    SolutionIndex: 133
    SolutionNameMin: Cijk_Alik_Bjlk_DB_GB_MT64x128x8_SN_PLR0_SU32_SUM0_SUS256_SNLL0_TT4_8_WG16_16_1_WGM8
    SolutionIndex: 134
    SolutionNameMin: Cijk_Alik_Bjlk_DB_GB_MT64x128x8_SN_PLR0_SU0_SUM0_SUS256_SNLL0_TT8_4_WG8_32_1_WGM15
    SolutionIndex: 135
    SolutionNameMin: Cijk_Alik_Bjlk_DB_GB_MT64x128x8_SN_PLR0_SU0_SUM0_SUS256_SNLL0_TT4_8_WG16_16_1_WGM15
    SolutionIndex: 136
    SolutionNameMin: Cijk_Alik_Bjlk_DB_GB_MT64x128x8_SN_PLR0_SU32_SUM0_SUS128_SNLL0_TT4_8_WG16_16_1_WGM15
    SolutionIndex: 137
    SolutionNameMin: Cijk_Alik_Bjlk_DB_GB_MT64x128x8_SN_PLR0_SU32_SUM0_SUS256_SNLL0_TT8_4_WG8_32_1_WGM15
    SolutionIndex: 138
    SolutionNameMin: Cijk_Alik_Bjlk_DB_GB_MT64x128x8_SN_PLR0_SU32_SUM0_SUS256_SNLL0_TT4_8_WG16_16_1_WGM15
- - - [192, 192, 1000, 32, 192, 192, 32, 192]
    - [81, 4950.0]
  - - [1536, 1536, 168, 32, 1536, 1536, 32, 1536]
    - [35, 5485.0]
  - - [1536, 32, 168, 1536, 1536, 1536, 1536, 32]
    - [3, 4489.0]
  - - [32, 1536, 168, 32, 32, 32, 32, 1536]
    - [77, 3536.0]
  - - [384, 384, 1024, 384, 384, 384, 384, 384]
    - [18, 7139.0]
  - - [1, 1, 1000, 1, 1, 1, 1, 1]
    - [84, 0.0]
  - - [2, 2, 1000, 2, 2, 2, 2, 2]
    - [84, 2.0]
  - - [3, 3, 1000, 3, 3, 3, 3, 3]
    - [86, 8.0]
  - - [4, 4, 1000, 4, 4, 4, 4, 4]
    - [88, 18.0]
  - - [5, 5, 1000, 5, 5, 5, 5, 5]
    - [85, 33.0]
  - - [6, 6, 1000, 6, 6, 6, 6, 6]
    - [85, 57.0]
  - - [7, 7, 1000, 7, 7, 7, 7, 7]
    - [85, 89.0]
  - - [8, 8, 1000, 8, 8, 8, 8, 8]
    - [90, 136.0]
  - - [9, 9, 1000, 9, 9, 9, 9, 9]
    - [87, 160.0]
  - - [10, 10, 1000, 10, 10, 10, 10, 10]
    - [100, 208.0]
  - - [11, 11, 1000, 11, 11, 11, 11, 11]
    - [89, 260.0]
  - - [12, 12, 1000, 12, 12, 12, 12, 12]
    - [105, 354.0]
  - - [13, 13, 1000, 13, 13, 13, 13, 13]
    - [91, 381.0]
  - - [14, 14, 1000, 14, 14, 14, 14, 14]
    - [99, 457.0]
  - - [15, 15, 1000, 15, 15, 15, 15, 15]
    - [96, 527.0]
  - - [16, 16, 1000, 16, 16, 16, 16, 16]
    - [100, 742.0]
  - - [17, 17, 1000, 17, 17, 17, 17, 17]
    - [93, 476.0]
  - - [18, 18, 1000, 18, 18, 18, 18, 18]
    - [94, 552.0]
  - - [19, 19, 1000, 19, 19, 19, 19, 19]
    - [104, 626.0]
  - - [20, 20, 1000, 20, 20, 20, 20, 20]
    - [94, 704.0]
  - - [21, 21, 1000, 21, 21, 21, 21, 21]
    - [106, 793.0]
  - - [22, 22, 1000, 22, 22, 22, 22, 22]
    - [103, 881.0]
  - - [23, 23, 1000, 23, 23, 23, 23, 23]
    - [101, 963.0]
  - - [24, 24, 1000, 24, 24, 24, 24, 24]
    - [101, 1152.0]
  - - [25, 25, 1000, 25, 25, 25, 25, 25]
    - [92, 1116.0]
  - - [26, 26, 1000, 26, 26, 26, 26, 26]
    - [95, 1214.0]
  - - [27, 27, 1000, 27, 27, 27, 27, 27]
    - [93, 1281.0]
  - - [28, 28, 1000, 28, 28, 28, 28, 28]
    - [93, 1400.0]
  - - [29, 29, 1000, 29, 29, 29, 29, 29]
    - [97, 1445.0]
  - - [30, 30, 1000, 30, 30, 30, 30, 30]
    - [98, 1534.0]
  - - [31, 31, 1000, 31, 31, 31, 31, 31]
    - [102, 1605.0]
  - - [32, 32, 1000, 32, 32, 32, 32, 32]
    - [101, 2038.0]
  - - [33, 33, 1000, 33, 33, 33, 33, 33]
    - [112, 1231.0]
  - - [34, 34, 1000, 34, 34, 34, 34, 34]
    - [116, 1324.0]
  - - [35, 35, 1000, 35, 35, 35, 35, 35]
    - [112, 1385.0]
  - - [36, 36, 1000, 36, 36, 36, 36, 36]
    - [129, 1531.0]
  - - [37, 37, 1000, 37, 37, 37, 37, 37]
    - [124, 1548.0]
  - - [38, 38, 1000, 38, 38, 38, 38, 38]
    - [117, 1633.0]
  - - [39, 39, 1000, 39, 39, 39, 39, 39]
    - [112, 1685.0]
  - - [40, 40, 1000, 40, 40, 40, 40, 40]
    - [124, 2174.0]
  - - [41, 41, 1000, 41, 41, 41, 41, 41]
    - [121, 1747.0]
  - - [42, 42, 1000, 42, 42, 42, 42, 42]
    - [127, 1902.0]
  - - [43, 43, 1000, 43, 43, 43, 43, 43]
    - [122, 1886.0]
  - - [44, 44, 1000, 44, 44, 44, 44, 44]
    - [118, 2214.0]
  - - [45, 45, 1000, 45, 45, 45, 45, 45]
    - [128, 2041.0]
  - - [46, 46, 1000, 46, 46, 46, 46, 46]
    - [122, 2262.0]
  - - [47, 47, 1000, 47, 47, 47, 47, 47]
    - [122, 2281.0]
  - - [48, 48, 1000, 48, 48, 48, 48, 48]
    - [110, 2954.0]
  - - [49, 49, 1000, 49, 49, 49, 49, 49]
    - [14, 2323.0]
  - - [50, 50, 1000, 50, 50, 50, 50, 50]
    - [51, 2449.0]
  - - [51, 51, 1000, 51, 51, 51, 51, 51]
    - [14, 2490.0]
  - - [52, 52, 1000, 52, 52, 52, 52, 52]
    - [12, 2655.0]
  - - [53, 53, 1000, 53, 53, 53, 53, 53]
    - [43, 2651.0]
  - - [54, 54, 1000, 54, 54, 54, 54, 54]
    - [63, 2776.0]
  - - [55, 55, 1000, 55, 55, 55, 55, 55]
    - [34, 2865.0]
  - - [56, 56, 1000, 56, 56, 56, 56, 56]
    - [51, 3362.0]
  - - [57, 57, 1000, 57, 57, 57, 57, 57]
    - [1, 3042.0]
  - - [58, 58, 1000, 58, 58, 58, 58, 58]
    - [31, 3155.0]
  - - [59, 59, 1000, 59, 59, 59, 59, 59]
    - [68, 3181.0]
  - - [60, 60, 1000, 60, 60, 60, 60, 60]
    - [72, 3409.0]
  - - [61, 61, 1000, 61, 61, 61, 61, 61]
    - [30, 3315.0]
  - - [62, 62, 1000, 62, 62, 62, 62, 62]
    - [14, 3452.0]
  - - [63, 63, 1000, 63, 63, 63, 63, 63]
    - [51, 3520.0]
  - - [64, 64, 1000, 64, 64, 64, 64, 64]
    - [43, 4283.0]
  - - [65, 65, 1000, 65, 65, 65, 65, 65]
    - [109, 2324.0]
  - - [66, 66, 1000, 66, 66, 66, 66, 66]
    - [110, 2552.0]
  - - [67, 67, 1000, 67, 67, 67, 67, 67]
    - [122, 2482.0]
  - - [68, 68, 1000, 68, 68, 68, 68, 68]
    - [114, 2920.0]
  - - [69, 69, 1000, 69, 69, 69, 69, 69]
    - [118, 2622.0]
  - - [70, 70, 1000, 70, 70, 70, 70, 70]
    - [108, 2834.0]
  - - [71, 71, 1000, 71, 71, 71, 71, 71]
    - [126, 2775.0]
  - - [72, 72, 1000, 72, 72, 72, 72, 72]
    - [122, 3769.0]
  - - [73, 73, 1000, 73, 73, 73, 73, 73]
    - [119, 2662.0]
  - - [74, 74, 1000, 74, 74, 74, 74, 74]
    - [111, 2833.0]
  - - [75, 75, 1000, 75, 75, 75, 75, 75]
    - [111, 2807.0]
  - - [76, 76, 1000, 76, 76, 76, 76, 76]
    - [111, 3083.0]
  - - [77, 77, 1000, 77, 77, 77, 77, 77]
    - [111, 2942.0]
  - - [78, 78, 1000, 78, 78, 78, 78, 78]
    - [111, 3062.0]
  - - [79, 79, 1000, 79, 79, 79, 79, 79]
    - [112, 3074.0]
  - - [80, 80, 1000, 80, 80, 80, 80, 80]
    - [111, 3649.0]
  - - [81, 81, 1000, 81, 81, 81, 81, 81]
    - [119, 3083.0]
  - - [82, 82, 1000, 82, 82, 82, 82, 82]
    - [123, 3230.0]
  - - [83, 83, 1000, 83, 83, 83, 83, 83]
    - [123, 3174.0]
  - - [84, 84, 1000, 84, 84, 84, 84, 84]
    - [111, 3581.0]
  - - [85, 85, 1000, 85, 85, 85, 85, 85]
    - [115, 3150.0]
  - - [86, 86, 1000, 86, 86, 86, 86, 86]
    - [111, 3443.0]
  - - [87, 87, 1000, 87, 87, 87, 87, 87]
    - [119, 3394.0]
  - - [88, 88, 1000, 88, 88, 88, 88, 88]
    - [111, 4398.0]
  - - [89, 89, 1000, 89, 89, 89, 89, 89]
    - [123, 3449.0]
  - - [90, 90, 1000, 90, 90, 90, 90, 90]
    - [111, 3648.0]
  - - [91, 91, 1000, 91, 91, 91, 91, 91]
    - [123, 3555.0]
  - - [92, 92, 1000, 92, 92, 92, 92, 92]
    - [107, 4064.0]
  - - [93, 93, 1000, 93, 93, 93, 93, 93]
    - [113, 3678.0]
  - - [94, 94, 1000, 94, 94, 94, 94, 94]
    - [111, 3817.0]
  - - [95, 95, 1000, 95, 95, 95, 95, 95]
    - [125, 3803.0]
  - - [96, 96, 1000, 96, 96, 96, 96, 96]
    - [119, 5106.0]
  - - [97, 97, 1000, 97, 97, 97, 97, 97]
    - [52, 3462.0]
  - - [98, 98, 1000, 98, 98, 98, 98, 98]
    - [35, 3550.0]
  - - [99, 99, 1000, 99, 99, 99, 99, 99]
    - [52, 3617.0]
  - - [100, 100, 1000, 100, 100, 100, 100, 100]
    - [73, 3739.0]
  - - [101, 101, 1000, 101, 101, 101, 101, 101]
    - [52, 3775.0]
  - - [102, 102, 1000, 102, 102, 102, 102, 102]
    - [52, 3839.0]
  - - [103, 103, 1000, 103, 103, 103, 103, 103]
    - [52, 3921.0]
  - - [104, 104, 1000, 104, 104, 104, 104, 104]
    - [73, 4132.0]
  - - [105, 105, 1000, 105, 105, 105, 105, 105]
    - [73, 4024.0]
  - - [106, 106, 1000, 106, 106, 106, 106, 106]
    - [35, 4115.0]
  - - [107, 107, 1000, 107, 107, 107, 107, 107]
    - [35, 4191.0]
  - - [108, 108, 1000, 108, 108, 108, 108, 108]
    - [35, 4341.0]
  - - [109, 109, 1000, 109, 109, 109, 109, 109]
    - [73, 4363.0]
  - - [110, 110, 1000, 110, 110, 110, 110, 110]
    - [52, 4460.0]
  - - [111, 111, 1000, 111, 111, 111, 111, 111]
    - [35, 4504.0]
  - - [112, 112, 1000, 112, 112, 112, 112, 112]
    - [35, 4752.0]
  - - [113, 113, 1000, 113, 113, 113, 113, 113]
    - [73, 4585.0]
  - - [114, 114, 1000, 114, 114, 114, 114, 114]
    - [35, 4675.0]
  - - [115, 115, 1000, 115, 115, 115, 115, 115]
    - [35, 4773.0]
  - - [116, 116, 1000, 116, 116, 116, 116, 116]
    - [35, 4953.0]
  - - [117, 117, 1000, 117, 117, 117, 117, 117]
    - [35, 4926.0]
  - - [118, 118, 1000, 118, 118, 118, 118, 118]
    - [35, 5046.0]
  - - [119, 119, 1000, 119, 119, 119, 119, 119]
    - [35, 5056.0]
  - - [120, 120, 1000, 120, 120, 120, 120, 120]
    - [35, 5393.0]
  - - [121, 121, 1000, 121, 121, 121, 121, 121]
    - [35, 5131.0]
  - - [122, 122, 1000, 122, 122, 122, 122, 122]
    - [35, 5246.0]
  - - [123, 123, 1000, 123, 123, 123, 123, 123]
    - [73, 5277.0]
  - - [124, 124, 1000, 124, 124, 124, 124, 124]
    - [35, 5539.0]
  - - [125, 125, 1000, 125, 125, 125, 125, 125]
    - [35, 5446.0]
  - - [126, 126, 1000, 126, 126, 126, 126, 126]
    - [73, 5553.0]
  - - [127, 127, 1000, 127, 127, 127, 127, 127]
    - [52, 5495.0]
  - - [128, 128, 1000, 128, 128, 128, 128, 128]
    - [35, 6190.0]
  - - [129, 129, 1000, 129, 129, 129, 129, 129]
    - [125, 3839.0]
  - - [130, 130, 1000, 130, 130, 130, 130, 130]
    - [113, 3960.0]
  - - [131, 131, 1000, 131, 131, 131, 131, 131]
    - [113, 3989.0]
  - - [132, 132, 1000, 132, 132, 132, 132, 132]
    - [113, 4178.0]
  - - [133, 133, 1000, 133, 133, 133, 133, 133]
    - [125, 4120.0]
  - - [134, 134, 1000, 134, 134, 134, 134, 134]
    - [125, 4224.0]
  - - [135, 135, 1000, 135, 135, 135, 135, 135]
    - [125, 4241.0]
  - - [136, 136, 1000, 136, 136, 136, 136, 136]
    - [113, 4666.0]
  - - [137, 137, 1000, 137, 137, 137, 137, 137]
    - [125, 4370.0]
  - - [138, 138, 1000, 138, 138, 138, 138, 138]
    - [120, 4477.0]
  - - [139, 139, 1000, 139, 139, 139, 139, 139]
    - [120, 4482.0]
  - - [140, 140, 1000, 140, 140, 140, 140, 140]
    - [125, 4698.0]
  - - [141, 141, 1000, 141, 141, 141, 141, 141]
    - [125, 4615.0]
  - - [142, 142, 1000, 142, 142, 142, 142, 142]
    - [125, 4734.0]
  - - [143, 143, 1000, 143, 143, 143, 143, 143]
    - [125, 4712.0]
  - - [144, 144, 1000, 144, 144, 144, 144, 144]
    - [113, 5301.0]
  - - [145, 145, 1000, 145, 145, 145, 145, 145]
    - [111, 3782.0]
  - - [146, 146, 1000, 146, 146, 146, 146, 146]
    - [107, 3941.0]
  - - [147, 147, 1000, 147, 147, 147, 147, 147]
    - [52, 3823.0]
  - - [148, 148, 1000, 148, 148, 148, 148, 148]
    - [111, 4507.0]
  - - [149, 149, 1000, 149, 149, 149, 149, 149]
    - [123, 3982.0]
  - - [150, 150, 1000, 150, 150, 150, 150, 150]
    - [119, 4228.0]
  - - [32, 32, 8, 32, 32, 32, 32, 32]
    - [82, 36.0]
  - - [32, 32, 8, 64, 32, 32, 64, 32]
    - [47, 50.0]
  - - [32, 32, 8, 128, 32, 32, 128, 32]
    - [75, 61.0]
  - - [32, 32, 8, 256, 32, 32, 256, 32]
    - [33, 69.0]
  - - [32, 32, 8, 512, 32, 32, 512, 32]
    - [58, 74.0]
  - - [32, 32, 8, 1024, 32, 32, 1024, 32]
    - [28, 76.0]
  - - [32, 32, 8, 2048, 32, 32, 2048, 32]
    - [47, 78.0]
  - - [32, 64, 8, 32, 32, 32, 32, 64]
    - [66, 72.0]
  - - [32, 64, 8, 64, 32, 32, 64, 64]
    - [70, 97.0]
  - - [32, 64, 8, 128, 32, 32, 128, 64]
    - [54, 121.0]
  - - [32, 64, 8, 256, 32, 32, 256, 64]
    - [42, 137.0]
  - - [32, 64, 8, 512, 32, 32, 512, 64]
    - [61, 147.0]
  - - [32, 64, 8, 1024, 32, 32, 1024, 64]
    - [16, 152.0]
  - - [32, 64, 8, 2048, 32, 32, 2048, 64]
    - [8, 155.0]
  - - [32, 128, 8, 32, 32, 32, 32, 128]
    - [75, 151.0]
  - - [32, 128, 8, 64, 32, 32, 64, 128]
    - [67, 199.0]
  - - [32, 128, 8, 128, 32, 32, 128, 128]
    - [79, 245.0]
  - - [32, 128, 8, 256, 32, 32, 256, 128]
    - [70, 277.0]
  - - [32, 128, 8, 512, 32, 32, 512, 128]
    - [22, 290.0]
  - - [32, 128, 8, 1024, 32, 32, 1024, 128]
    - [75, 307.0]
  - - [32, 128, 8, 2048, 32, 32, 2048, 128]
    - [65, 310.0]
  - - [32, 256, 8, 32, 32, 32, 32, 256]
    - [132, 199.0]
  - - [32, 256, 8, 64, 32, 32, 64, 256]
    - [24, 288.0]
  - - [32, 256, 8, 128, 32, 32, 128, 256]
    - [0, 384.0]
  - - [32, 256, 8, 256, 32, 32, 256, 256]
    - [0, 477.0]
  - - [32, 256, 8, 512, 32, 32, 512, 256]
    - [14, 539.0]
  - - [32, 256, 8, 1024, 32, 32, 1024, 256]
    - [25, 583.0]
  - - [32, 256, 8, 2048, 32, 32, 2048, 256]
    - [25, 609.0]
  - - [32, 512, 8, 32, 32, 32, 32, 512]
    - [36, 433.0]
  - - [32, 512, 8, 64, 32, 32, 64, 512]
    - [24, 570.0]
  - - [32, 512, 8, 128, 32, 32, 128, 512]
    - [0, 771.0]
  - - [32, 512, 8, 256, 32, 32, 256, 512]
    - [0, 951.0]
  - - [32, 512, 8, 512, 32, 32, 512, 512]
    - [25, 1082.0]
  - - [32, 512, 8, 1024, 32, 32, 1024, 512]
    - [25, 1163.0]
  - - [32, 512, 8, 2048, 32, 32, 2048, 512]
    - [14, 1214.0]
  - - [32, 1024, 8, 32, 32, 32, 32, 1024]
    - [43, 881.0]
  - - [32, 1024, 8, 64, 32, 32, 64, 1024]
    - [45, 1205.0]
  - - [32, 1024, 8, 128, 32, 32, 128, 1024]
    - [6, 1553.0]
  - - [32, 1024, 8, 256, 32, 32, 256, 1024]
    - [50, 1889.0]
  - - [32, 1024, 8, 512, 32, 32, 512, 1024]
    - [13, 2137.0]
  - - [32, 1024, 8, 1024, 32, 32, 1024, 1024]
    - [16, 2295.0]
  - - [32, 1024, 8, 2048, 32, 32, 2048, 1024]
    - [4, 2411.0]
  - - [32, 2048, 8, 32, 32, 32, 32, 2048]
    - [44, 1777.0]
  - - [32, 2048, 8, 64, 32, 32, 64, 2048]
    - [44, 2317.0]
  - - [32, 2048, 8, 128, 32, 32, 128, 2048]
    - [71, 2706.0]
  - - [32, 2048, 8, 256, 32, 32, 256, 2048]
    - [77, 2991.0]
  - - [32, 2048, 8, 512, 32, 32, 512, 2048]
    - [62, 3160.0]
  - - [32, 2048, 8, 1024, 32, 32, 1024, 2048]
    - [71, 3239.0]
  - - [32, 2048, 8, 2048, 32, 32, 2048, 2048]
    - [55, 3291.0]
  - - [64, 32, 8, 32, 64, 64, 32, 32]
    - [2, 43.0]
  - - [64, 32, 8, 64, 64, 64, 64, 32]
    - [9, 66.0]
  - - [64, 32, 8, 128, 64, 64, 128, 32]
    - [6, 91.0]
  - - [64, 32, 8, 256, 64, 64, 256, 32]
    - [20, 114.0]
  - - [64, 32, 8, 512, 64, 64, 512, 32]
    - [24, 131.0]
  - - [64, 32, 8, 1024, 64, 64, 1024, 32]
    - [4, 143.0]
  - - [64, 32, 8, 2048, 64, 64, 2048, 32]
    - [4, 150.0]
  - - [64, 64, 8, 32, 64, 64, 32, 64]
    - [1, 93.0]
  - - [64, 64, 8, 64, 64, 64, 64, 64]
    - [1, 145.0]
  - - [64, 64, 8, 128, 64, 64, 128, 64]
    - [9, 193.0]
  - - [64, 64, 8, 256, 64, 64, 256, 64]
    - [14, 234.0]
  - - [64, 64, 8, 512, 64, 64, 512, 64]
    - [34, 262.0]
  - - [64, 64, 8, 1024, 64, 64, 1024, 64]
    - [16, 286.0]
  - - [64, 64, 8, 2048, 64, 64, 2048, 64]
    - [4, 301.0]
  - - [64, 128, 8, 32, 64, 64, 32, 128]
    - [1, 197.0]
  - - [64, 128, 8, 64, 64, 64, 64, 128]
    - [25, 301.0]
  - - [64, 128, 8, 128, 64, 64, 128, 128]
    - [25, 403.0]
  - - [64, 128, 8, 256, 64, 64, 256, 128]
    - [34, 480.0]
  - - [64, 128, 8, 512, 64, 64, 512, 128]
    - [24, 536.0]
  - - [64, 128, 8, 1024, 64, 64, 1024, 128]
    - [11, 575.0]
  - - [64, 128, 8, 2048, 64, 64, 2048, 128]
    - [16, 604.0]
  - - [64, 256, 8, 32, 64, 64, 32, 256]
    - [24, 372.0]
  - - [64, 256, 8, 64, 64, 64, 64, 256]
    - [1, 589.0]
  - - [64, 256, 8, 128, 64, 64, 128, 256]
    - [34, 788.0]
  - - [64, 256, 8, 256, 64, 64, 256, 256]
    - [25, 962.0]
  - - [64, 256, 8, 512, 64, 64, 512, 256]
    - [72, 1073.0]
  - - [64, 256, 8, 1024, 64, 64, 1024, 256]
    - [4, 1150.0]
  - - [64, 256, 8, 2048, 64, 64, 2048, 256]
    - [4, 1210.0]
  - - [64, 512, 8, 32, 64, 64, 32, 512]
    - [41, 867.0]
  - - [64, 512, 8, 64, 64, 64, 64, 512]
    - [14, 1152.0]
  - - [64, 512, 8, 128, 64, 64, 128, 512]
    - [14, 1613.0]
  - - [64, 512, 8, 256, 64, 64, 256, 512]
    - [72, 1933.0]
  - - [64, 512, 8, 512, 64, 64, 512, 512]
    - [51, 2156.0]
  - - [64, 512, 8, 1024, 64, 64, 1024, 512]
    - [4, 2294.0]
  - - [64, 512, 8, 2048, 64, 64, 2048, 512]
    - [28, 2417.0]
  - - [64, 1024, 8, 32, 64, 64, 32, 1024]
    - [34, 1889.0]
  - - [64, 1024, 8, 64, 64, 64, 64, 1024]
    - [72, 2424.0]
  - - [64, 1024, 8, 128, 64, 64, 128, 1024]
    - [56, 2853.0]
  - - [64, 1024, 8, 256, 64, 64, 256, 1024]
    - [78, 3124.0]
  - - [64, 1024, 8, 512, 64, 64, 512, 1024]
    - [56, 3261.0]
  - - [64, 1024, 8, 1024, 64, 64, 1024, 1024]
    - [51, 3339.0]
  - - [64, 1024, 8, 2048, 64, 64, 2048, 1024]
    - [56, 3380.0]
  - - [64, 2048, 8, 32, 64, 64, 32, 2048]
    - [35, 2741.0]
  - - [64, 2048, 8, 64, 64, 64, 64, 2048]
    - [39, 3466.0]
  - - [64, 2048, 8, 128, 64, 64, 128, 2048]
    - [68, 4004.0]
  - - [64, 2048, 8, 256, 64, 64, 256, 2048]
    - [81, 4341.0]
  - - [64, 2048, 8, 512, 64, 64, 512, 2048]
    - [78, 4504.0]
  - - [64, 2048, 8, 1024, 64, 64, 1024, 2048]
    - [45, 4600.0]
  - - [64, 2048, 8, 2048, 64, 64, 2048, 2048]
    - [56, 4642.0]
  - - [128, 32, 8, 32, 128, 128, 32, 32]
    - [26, 94.0]
  - - [128, 32, 8, 64, 128, 128, 64, 32]
    - [15, 139.0]
  - - [128, 32, 8, 128, 128, 128, 128, 32]
    - [1, 185.0]
  - - [128, 32, 8, 256, 128, 128, 256, 32]
    - [24, 226.0]
  - - [128, 32, 8, 512, 128, 128, 512, 32]
    - [24, 260.0]
  - - [128, 32, 8, 1024, 128, 128, 1024, 32]
    - [16, 283.0]
  - - [128, 32, 8, 2048, 128, 128, 2048, 32]
    - [4, 300.0]
  - - [128, 64, 8, 32, 128, 128, 32, 64]
    - [2, 196.0]
  - - [128, 64, 8, 64, 128, 128, 64, 64]
    - [1, 291.0]
  - - [128, 64, 8, 128, 128, 128, 128, 64]
    - [1, 384.0]
  - - [128, 64, 8, 256, 128, 128, 256, 64]
    - [14, 469.0]
  - - [128, 64, 8, 512, 128, 128, 512, 64]
    - [25, 526.0]
  - - [128, 64, 8, 1024, 128, 128, 1024, 64]
    - [4, 570.0]
  - - [128, 64, 8, 2048, 128, 128, 2048, 64]
    - [16, 600.0]
  - - [128, 128, 8, 32, 128, 128, 32, 128]
    - [2, 386.0]
  - - [128, 128, 8, 64, 128, 128, 64, 128]
    - [1, 586.0]
  - - [128, 128, 8, 128, 128, 128, 128, 128]
    - [1, 788.0]
  - - [128, 128, 8, 256, 128, 128, 256, 128]
    - [51, 966.0]
  - - [128, 128, 8, 512, 128, 128, 512, 128]
    - [13, 1067.0]
  - - [128, 128, 8, 1024, 128, 128, 1024, 128]
    - [4, 1151.0]
  - - [128, 128, 8, 2048, 128, 128, 2048, 128]
    - [16, 1206.0]
  - - [128, 256, 8, 32, 128, 128, 32, 256]
    - [25, 760.0]
  - - [128, 256, 8, 64, 128, 128, 64, 256]
    - [19, 1165.0]
  - - [128, 256, 8, 128, 128, 128, 128, 256]
    - [25, 1577.0]
  - - [128, 256, 8, 256, 128, 128, 256, 256]
    - [34, 1920.0]
  - - [128, 256, 8, 512, 128, 128, 512, 256]
    - [34, 2148.0]
  - - [128, 256, 8, 1024, 128, 128, 1024, 256]
    - [4, 2301.0]
  - - [128, 256, 8, 2048, 128, 128, 2048, 256]
    - [4, 2411.0]
  - - [128, 512, 8, 32, 128, 128, 32, 512]
    - [34, 1889.0]
  - - [128, 512, 8, 64, 128, 128, 64, 512]
    - [56, 2439.0]
  - - [128, 512, 8, 128, 128, 128, 128, 512]
    - [51, 2883.0]
  - - [128, 512, 8, 256, 128, 128, 256, 512]
    - [51, 3113.0]
  - - [128, 512, 8, 512, 128, 128, 512, 512]
    - [34, 3280.0]
  - - [128, 512, 8, 1024, 128, 128, 1024, 512]
    - [34, 3349.0]
  - - [128, 512, 8, 2048, 128, 128, 2048, 512]
    - [34, 3382.0]
  - - [128, 1024, 8, 32, 128, 128, 32, 1024]
    - [73, 2706.0]
  - - [128, 1024, 8, 64, 128, 128, 64, 1024]
    - [52, 3539.0]
  - - [128, 1024, 8, 128, 128, 128, 128, 1024]
    - [63, 3985.0]
  - - [128, 1024, 8, 256, 128, 128, 256, 1024]
    - [39, 4346.0]
  - - [128, 1024, 8, 512, 128, 128, 512, 1024]
    - [56, 4510.0]
  - - [128, 1024, 8, 1024, 128, 128, 1024, 1024]
    - [63, 4595.0]
  - - [128, 1024, 8, 2048, 128, 128, 2048, 1024]
    - [56, 4635.0]
  - - [128, 2048, 8, 32, 128, 128, 32, 2048]
    - [72, 3383.0]
  - - [128, 2048, 8, 64, 128, 128, 64, 2048]
    - [34, 4415.0]
  - - [128, 2048, 8, 128, 128, 128, 128, 2048]
    - [51, 5069.0]
  - - [128, 2048, 8, 256, 128, 128, 256, 2048]
    - [72, 5390.0]
  - - [128, 2048, 8, 512, 128, 128, 512, 2048]
    - [72, 5539.0]
  - - [128, 2048, 8, 1024, 128, 128, 1024, 2048]
    - [72, 5606.0]
  - - [128, 2048, 8, 2048, 128, 128, 2048, 2048]
    - [78, 5647.0]
  - - [256, 32, 8, 32, 256, 256, 32, 32]
    - [2, 190.0]
  - - [256, 32, 8, 64, 256, 256, 64, 32]
    - [2, 274.0]
  - - [256, 32, 8, 128, 256, 256, 128, 32]
    - [23, 365.0]
  - - [256, 32, 8, 256, 256, 256, 256, 32]
    - [13, 455.0]
  - - [256, 32, 8, 512, 256, 256, 512, 32]
    - [13, 521.0]
  - - [256, 32, 8, 1024, 256, 256, 1024, 32]
    - [16, 565.0]
  - - [256, 32, 8, 2048, 256, 256, 2048, 32]
    - [4, 599.0]
  - - [256, 64, 8, 32, 256, 256, 32, 64]
    - [7, 374.0]
  - - [256, 64, 8, 64, 256, 256, 64, 64]
    - [32, 567.0]
  - - [256, 64, 8, 128, 256, 256, 128, 64]
    - [1, 765.0]
  - - [256, 64, 8, 256, 256, 256, 256, 64]
    - [25, 920.0]
  - - [256, 64, 8, 512, 256, 256, 512, 64]
    - [1, 1043.0]
  - - [256, 64, 8, 1024, 256, 256, 1024, 64]
    - [4, 1131.0]
  - - [256, 64, 8, 2048, 256, 256, 2048, 64]
    - [4, 1195.0]
  - - [256, 128, 8, 32, 256, 256, 32, 128]
    - [15, 754.0]
  - - [256, 128, 8, 64, 256, 256, 64, 128]
    - [21, 1140.0]
  - - [256, 128, 8, 128, 256, 256, 128, 128]
    - [0, 1531.0]
  - - [256, 128, 8, 256, 256, 256, 256, 128]
    - [0, 1877.0]
  - - [256, 128, 8, 512, 256, 256, 512, 128]
    - [14, 2124.0]
  - - [256, 128, 8, 1024, 256, 256, 1024, 128]
    - [28, 2295.0]
  - - [256, 128, 8, 2048, 256, 256, 2048, 128]
    - [4, 2410.0]
  - - [256, 256, 8, 32, 256, 256, 32, 256]
    - [50, 1808.0]
  - - [256, 256, 8, 64, 256, 256, 64, 256]
    - [39, 2439.0]
  - - [256, 256, 8, 128, 256, 256, 128, 256]
    - [43, 2806.0]
  - - [256, 256, 8, 256, 256, 256, 256, 256]
    - [34, 3107.0]
  - - [256, 256, 8, 512, 256, 256, 512, 256]
    - [34, 3280.0]
  - - [256, 256, 8, 1024, 256, 256, 1024, 256]
    - [34, 3357.0]
  - - [256, 256, 8, 2048, 256, 256, 2048, 256]
    - [81, 3361.0]
  - - [256, 512, 8, 32, 256, 256, 32, 512]
    - [40, 2542.0]
  - - [256, 512, 8, 64, 256, 256, 64, 512]
    - [69, 3466.0]
  - - [256, 512, 8, 128, 256, 256, 128, 512]
    - [56, 4004.0]
  - - [256, 512, 8, 256, 256, 256, 256, 512]
    - [56, 4324.0]
  - - [256, 512, 8, 512, 256, 256, 512, 512]
    - [72, 4501.0]
  - - [256, 512, 8, 1024, 256, 256, 1024, 512]
    - [78, 4606.0]
  - - [256, 512, 8, 2048, 256, 256, 2048, 512]
    - [63, 4643.0]
  - - [256, 1024, 8, 32, 256, 256, 32, 1024]
    - [72, 3190.0]
  - - [256, 1024, 8, 64, 256, 256, 64, 1024]
    - [51, 4291.0]
  - - [256, 1024, 8, 128, 256, 256, 128, 1024]
    - [51, 5023.0]
  - - [256, 1024, 8, 256, 256, 256, 256, 1024]
    - [51, 5352.0]
  - - [256, 1024, 8, 512, 256, 256, 512, 1024]
    - [56, 5517.0]
  - - [256, 1024, 8, 1024, 256, 256, 1024, 1024]
    - [56, 5602.0]
  - - [256, 1024, 8, 2048, 256, 256, 2048, 1024]
    - [51, 5641.0]
  - - [256, 2048, 8, 32, 256, 256, 32, 2048]
    - [14, 3737.0]
  - - [256, 2048, 8, 64, 256, 256, 64, 2048]
    - [51, 5076.0]
  - - [256, 2048, 8, 128, 256, 256, 128, 2048]
    - [51, 5741.0]
  - - [256, 2048, 8, 256, 256, 256, 256, 2048]
    - [51, 6065.0]
  - - [256, 2048, 8, 512, 256, 256, 512, 2048]
    - [56, 6231.0]
  - - [256, 2048, 8, 1024, 256, 256, 1024, 2048]
    - [51, 6328.0]
  - - [256, 2048, 8, 2048, 256, 256, 2048, 2048]
    - [51, 6364.0]
  - - [512, 32, 8, 32, 512, 512, 32, 32]
    - [71, 441.0]
  - - [512, 32, 8, 64, 512, 512, 64, 32]
    - [38, 586.0]
  - - [512, 32, 8, 128, 512, 512, 128, 32]
    - [25, 721.0]
  - - [512, 32, 8, 256, 512, 512, 256, 32]
    - [25, 898.0]
  - - [512, 32, 8, 512, 512, 512, 512, 32]
    - [14, 1032.0]
  - - [512, 32, 8, 1024, 512, 512, 1024, 32]
    - [25, 1120.0]
  - - [512, 32, 8, 2048, 512, 512, 2048, 32]
    - [17, 1170.0]
  - - [512, 64, 8, 32, 512, 512, 32, 64]
    - [38, 807.0]
  - - [512, 64, 8, 64, 512, 512, 64, 64]
    - [38, 1140.0]
  - - [512, 64, 8, 128, 512, 512, 128, 64]
    - [25, 1509.0]
  - - [512, 64, 8, 256, 512, 512, 256, 64]
    - [14, 1852.0]
  - - [512, 64, 8, 512, 512, 512, 512, 64]
    - [25, 2100.0]
  - - [512, 64, 8, 1024, 512, 512, 1024, 64]
    - [25, 2249.0]
  - - [512, 64, 8, 2048, 512, 512, 2048, 64]
    - [29, 2346.0]
  - - [512, 128, 8, 32, 512, 512, 32, 128]
    - [44, 1856.0]
  - - [512, 128, 8, 64, 512, 512, 64, 128]
    - [48, 2439.0]
  - - [512, 128, 8, 128, 512, 512, 128, 128]
    - [48, 2853.0]
  - - [512, 128, 8, 256, 512, 512, 256, 128]
    - [34, 3107.0]
  - - [512, 128, 8, 512, 512, 512, 512, 128]
    - [34, 3245.0]
  - - [512, 128, 8, 1024, 512, 512, 1024, 128]
    - [34, 3301.0]
  - - [512, 128, 8, 2048, 512, 512, 2048, 128]
    - [81, 3348.0]
  - - [512, 256, 8, 32, 512, 512, 32, 256]
    - [35, 2621.0]
  - - [512, 256, 8, 64, 512, 512, 64, 256]
    - [73, 3495.0]
  - - [512, 256, 8, 128, 512, 512, 128, 256]
    - [68, 3976.0]
  - - [512, 256, 8, 256, 512, 512, 256, 256]
    - [78, 4313.0]
  - - [512, 256, 8, 512, 512, 512, 512, 256]
    - [63, 4486.0]
  - - [512, 256, 8, 1024, 512, 512, 1024, 256]
    - [72, 4584.0]
  - - [512, 256, 8, 2048, 512, 512, 2048, 256]
    - [81, 4625.0]
  - - [512, 512, 8, 32, 512, 512, 32, 512]
    - [34, 3303.0]
  - - [512, 512, 8, 64, 512, 512, 64, 512]
    - [45, 4358.0]
  - - [512, 512, 8, 128, 512, 512, 128, 512]
    - [34, 5046.0]
  - - [512, 512, 8, 256, 512, 512, 256, 512]
    - [51, 5347.0]
  - - [512, 512, 8, 512, 512, 512, 512, 512]
    - [72, 5523.0]
  - - [512, 512, 8, 1024, 512, 512, 1024, 512]
    - [51, 5606.0]
  - - [512, 512, 8, 2048, 512, 512, 2048, 512]
    - [72, 5636.0]
  - - [512, 1024, 8, 32, 512, 512, 32, 1024]
    - [34, 3966.0]
  - - [512, 1024, 8, 64, 512, 512, 64, 1024]
    - [81, 5107.0]
  - - [512, 1024, 8, 128, 512, 512, 128, 1024]
    - [39, 5746.0]
  - - [512, 1024, 8, 256, 512, 512, 256, 1024]
    - [34, 6068.0]
  - - [512, 1024, 8, 512, 512, 512, 512, 1024]
    - [51, 6237.0]
  - - [512, 1024, 8, 1024, 512, 512, 1024, 1024]
    - [56, 6315.0]
  - - [512, 1024, 8, 2048, 512, 512, 2048, 1024]
    - [56, 6355.0]
  - - [512, 2048, 8, 32, 512, 512, 32, 2048]
    - [45, 4403.0]
  - - [512, 2048, 8, 64, 512, 512, 64, 2048]
    - [39, 5528.0]
  - - [512, 2048, 8, 128, 512, 512, 128, 2048]
    - [51, 6087.0]
  - - [512, 2048, 8, 256, 512, 512, 256, 2048]
    - [56, 6273.0]
  - - [512, 2048, 8, 512, 512, 512, 512, 2048]
    - [51, 6372.0]
  - - [512, 2048, 8, 1024, 512, 512, 1024, 2048]
    - [51, 6432.0]
  - - [512, 2048, 8, 2048, 512, 512, 2048, 2048]
    - [51, 6448.0]
  - - [1024, 32, 8, 32, 1024, 1024, 32, 32]
    - [81, 859.0]
  - - [1024, 32, 8, 64, 1024, 1024, 64, 32]
    - [45, 1140.0]
  - - [1024, 32, 8, 128, 1024, 1024, 128, 32]
    - [26, 1384.0]
  - - [1024, 32, 8, 256, 1024, 1024, 256, 32]
    - [15, 1604.0]
  - - [1024, 32, 8, 512, 1024, 1024, 512, 32]
    - [5, 1800.0]
  - - [1024, 32, 8, 1024, 1024, 1024, 1024, 32]
    - [5, 1961.0]
  - - [1024, 32, 8, 2048, 1024, 1024, 2048, 32]
    - [76, 2055.0]
  - - [1024, 64, 8, 32, 1024, 1024, 32, 64]
    - [63, 1856.0]
  - - [1024, 64, 8, 64, 1024, 1024, 64, 64]
    - [80, 2356.0]
  - - [1024, 64, 8, 128, 1024, 1024, 128, 64]
    - [51, 2778.0]
  - - [1024, 64, 8, 256, 1024, 1024, 256, 64]
    - [34, 3034.0]
  - - [1024, 64, 8, 512, 1024, 1024, 512, 64]
    - [56, 3169.0]
  - - [1024, 64, 8, 1024, 1024, 1024, 1024, 64]
    - [51, 3258.0]
  - - [1024, 64, 8, 2048, 1024, 1024, 2048, 64]
    - [81, 3309.0]
  - - [1024, 128, 8, 32, 1024, 1024, 32, 128]
    - [12, 2655.0]
  - - [1024, 128, 8, 64, 1024, 1024, 64, 128]
    - [46, 3510.0]
  - - [1024, 128, 8, 128, 1024, 1024, 128, 128]
    - [56, 3948.0]
  - - [1024, 128, 8, 256, 1024, 1024, 256, 128]
    - [63, 4307.0]
  - - [1024, 128, 8, 512, 1024, 1024, 512, 128]
    - [63, 4459.0]
  - - [1024, 128, 8, 1024, 1024, 1024, 1024, 128]
    - [51, 4559.0]
  - - [1024, 128, 8, 2048, 1024, 1024, 2048, 128]
    - [56, 4604.0]
  - - [1024, 256, 8, 32, 1024, 1024, 32, 256]
    - [34, 3369.0]
  - - [1024, 256, 8, 64, 1024, 1024, 64, 256]
    - [48, 4380.0]
  - - [1024, 256, 8, 128, 1024, 1024, 128, 256]
    - [45, 4993.0]
  - - [1024, 256, 8, 256, 1024, 1024, 256, 256]
    - [72, 5339.0]
  - - [1024, 256, 8, 512, 1024, 1024, 512, 256]
    - [51, 5505.0]
  - - [1024, 256, 8, 1024, 1024, 1024, 1024, 256]
    - [72, 5585.0]
  - - [1024, 256, 8, 2048, 1024, 1024, 2048, 256]
    - [51, 5620.0]
  - - [1024, 512, 8, 32, 1024, 1024, 32, 512]
    - [81, 3995.0]
  - - [1024, 512, 8, 64, 1024, 1024, 64, 512]
    - [59, 5092.0]
  - - [1024, 512, 8, 128, 1024, 1024, 128, 512]
    - [59, 5790.0]
  - - [1024, 512, 8, 256, 1024, 1024, 256, 512]
    - [80, 6081.0]
  - - [1024, 512, 8, 512, 1024, 1024, 512, 512]
    - [72, 6251.0]
  - - [1024, 512, 8, 1024, 1024, 1024, 1024, 512]
    - [72, 6330.0]
  - - [1024, 512, 8, 2048, 1024, 1024, 2048, 512]
    - [51, 6367.0]
  - - [1024, 1024, 8, 32, 1024, 1024, 32, 1024]
    - [45, 4421.0]
  - - [1024, 1024, 8, 64, 1024, 1024, 64, 1024]
    - [34, 5505.0]
  - - [1024, 1024, 8, 128, 1024, 1024, 128, 1024]
    - [80, 6051.0]
  - - [1024, 1024, 8, 256, 1024, 1024, 256, 1024]
    - [63, 6270.0]
  - - [1024, 1024, 8, 512, 1024, 1024, 512, 1024]
    - [51, 6382.0]
  - - [1024, 1024, 8, 1024, 1024, 1024, 1024, 1024]
    - [51, 6433.0]
  - - [1024, 1024, 8, 2048, 1024, 1024, 2048, 1024]
    - [51, 6449.0]
  - - [1024, 2048, 8, 32, 1024, 1024, 32, 2048]
    - [43, 4703.0]
  - - [1024, 2048, 8, 64, 1024, 1024, 64, 2048]
    - [73, 5892.0]
  - - [1024, 2048, 8, 128, 1024, 1024, 128, 2048]
    - [52, 6352.0]
  - - [1024, 2048, 8, 256, 1024, 1024, 256, 2048]
    - [130, 6558.0]
  - - [1024, 2048, 8, 512, 1024, 1024, 512, 2048]
    - [130, 6822.0]
  - - [1024, 2048, 8, 1024, 1024, 1024, 1024, 2048]
    - [130, 6970.0]
  - - [1024, 2048, 8, 2048, 1024, 1024, 2048, 2048]
    - [131, 7034.0]
  - - [2048, 32, 8, 32, 2048, 2048, 32, 32]
    - [74, 1509.0]
  - - [2048, 32, 8, 64, 2048, 2048, 64, 32]
    - [10, 1924.0]
  - - [2048, 32, 8, 128, 2048, 2048, 128, 32]
    - [64, 2273.0]
  - - [2048, 32, 8, 256, 2048, 2048, 256, 32]
    - [27, 2435.0]
  - - [2048, 32, 8, 512, 2048, 2048, 512, 32]
    - [53, 2569.0]
  - - [2048, 32, 8, 1024, 2048, 2048, 1024, 32]
    - [53, 2637.0]
  - - [2048, 32, 8, 2048, 2048, 2048, 2048, 32]
    - [37, 2634.0]
  - - [2048, 64, 8, 32, 2048, 2048, 32, 64]
    - [19, 2605.0]
  - - [2048, 64, 8, 64, 2048, 2048, 64, 64]
    - [35, 3329.0]
  - - [2048, 64, 8, 128, 2048, 2048, 128, 64]
    - [68, 3875.0]
  - - [2048, 64, 8, 256, 2048, 2048, 256, 64]
    - [51, 4221.0]
  - - [2048, 64, 8, 512, 2048, 2048, 512, 64]
    - [72, 4406.0]
  - - [2048, 64, 8, 1024, 2048, 2048, 1024, 64]
    - [80, 4518.0]
  - - [2048, 64, 8, 2048, 2048, 2048, 2048, 64]
    - [45, 4566.0]
  - - [2048, 128, 8, 32, 2048, 2048, 32, 128]
    - [72, 3303.0]
  - - [2048, 128, 8, 64, 2048, 2048, 64, 128]
    - [48, 4369.0]
  - - [2048, 128, 8, 128, 2048, 2048, 128, 128]
    - [72, 4964.0]
  - - [2048, 128, 8, 256, 2048, 2048, 256, 128]
    - [56, 5288.0]
  - - [2048, 128, 8, 512, 2048, 2048, 512, 128]
    - [51, 5465.0]
  - - [2048, 128, 8, 1024, 2048, 2048, 1024, 128]
    - [72, 5552.0]
  - - [2048, 128, 8, 2048, 2048, 2048, 2048, 128]
    - [51, 5586.0]
  - - [2048, 256, 8, 32, 2048, 2048, 32, 256]
    - [83, 3976.0]
  - - [2048, 256, 8, 64, 2048, 2048, 64, 256]
    - [56, 5123.0]
  - - [2048, 256, 8, 128, 2048, 2048, 128, 256]
    - [51, 5770.0]
  - - [2048, 256, 8, 256, 2048, 2048, 256, 256]
    - [68, 6065.0]
  - - [2048, 256, 8, 512, 2048, 2048, 512, 256]
    - [51, 6233.0]
  - - [2048, 256, 8, 1024, 2048, 2048, 1024, 256]
    - [72, 6310.0]
  - - [2048, 256, 8, 2048, 2048, 2048, 2048, 256]
    - [72, 6345.0]
  - - [2048, 512, 8, 32, 2048, 2048, 32, 512]
    - [34, 4433.0]
  - - [2048, 512, 8, 64, 2048, 2048, 64, 512]
    - [34, 5523.0]
  - - [2048, 512, 8, 128, 2048, 2048, 128, 512]
    - [83, 6011.0]
  - - [2048, 512, 8, 256, 2048, 2048, 256, 512]
    - [72, 6259.0]
  - - [2048, 512, 8, 512, 2048, 2048, 512, 512]
    - [72, 6373.0]
  - - [2048, 512, 8, 1024, 2048, 2048, 1024, 512]
    - [51, 6425.0]
  - - [2048, 512, 8, 2048, 2048, 2048, 2048, 512]
    - [72, 6447.0]
  - - [2048, 1024, 8, 32, 2048, 2048, 32, 1024]
    - [49, 4612.0]
  - - [2048, 1024, 8, 64, 2048, 2048, 64, 1024]
    - [73, 5760.0]
  - - [2048, 1024, 8, 128, 2048, 2048, 128, 1024]
    - [57, 6300.0]
  - - [2048, 1024, 8, 256, 2048, 2048, 256, 1024]
    - [134, 6526.0]
  - - [2048, 1024, 8, 512, 2048, 2048, 512, 1024]
    - [138, 6799.0]
  - - [2048, 1024, 8, 1024, 2048, 2048, 1024, 1024]
    - [130, 6957.0]
  - - [2048, 1024, 8, 2048, 2048, 2048, 2048, 1024]
    - [138, 7012.0]
  - - [2048, 2048, 8, 32, 2048, 2048, 32, 2048]
    - [49, 4814.0]
  - - [2048, 2048, 8, 64, 2048, 2048, 64, 2048]
    - [40, 6097.0]
  - - [2048, 2048, 8, 128, 2048, 2048, 128, 2048]
    - [60, 6480.0]
  - - [2048, 2048, 8, 256, 2048, 2048, 256, 2048]
    - [133, 6673.0]
  - - [2048, 2048, 8, 512, 2048, 2048, 512, 2048]
    - [136, 6898.0]
  - - [2048, 2048, 8, 1024, 2048, 2048, 1024, 2048]
    - [135, 7024.0]
  - - [2048, 2048, 8, 2048, 2048, 2048, 2048, 2048]
    - [137, 7093.0]
- null
