library/src/blas3/Tensile/Logic/aldebaran/arcturus_Cijk_Ailk_Bjlk_ZB_GB.yaml
- {MinimumRequiredVersion: 4.26.0}
- arcturus
- gfx908
- [Device 7380, Device 7388, Device 738c, Device 7390]
    SolutionIndex: 0
    SolutionNameMin: Cijk_Ailk_Bjlk_ZB_GB_MT32x128x8_SN_PLR1_SU0_SUM0_SUS256_SNLL1_TT4_4_WG8_32_1_WGM1
    SolutionIndex: 1
    SolutionNameMin: Cijk_Ailk_Bjlk_ZB_GB_MT32x128x8_SN_PLR0_SU0_SUM0_SUS256_SNLL1_TT4_4_WG8_32_1_WGM1
    SolutionIndex: 2
    SolutionNameMin: Cijk_Ailk_Bjlk_ZB_GB_MT64x64x8_SN_PLR1_SU0_SUM0_SUS256_SNLL1_TT4_4_WG16_16_1_WGM1
    SolutionIndex: 3
    SolutionNameMin: Cijk_Ailk_Bjlk_ZB_GB_MT64x64x8_SN_PLR0_SU0_SUM0_SUS256_SNLL1_TT4_4_WG16_16_1_WGM1
    SolutionIndex: 4
    SolutionNameMin: Cijk_Ailk_Bjlk_ZB_GB_MT128x32x8_SN_PLR1_SU0_SUM0_SUS256_SNLL1_TT4_4_WG32_8_1_WGM1
    SolutionIndex: 5
    SolutionNameMin: Cijk_Ailk_Bjlk_ZB_GB_MT64x64x16_SN_PLR1_SU0_SUM0_SUS256_SNLL1_TT4_4_WG16_16_1_WGM1
    SolutionIndex: 6
    SolutionNameMin: Cijk_Ailk_Bjlk_ZB_GB_MT32x128x8_SN_PLR1_SU32_SUM0_SUS128_SNLL1_TT4_4_WG8_32_1_WGM1
    SolutionIndex: 7
    SolutionNameMin: Cijk_Ailk_Bjlk_ZB_GB_MT64x64x8_SN_PLR1_SU32_SUM0_SUS128_SNLL1_TT4_4_WG16_16_1_WGM1
    SolutionIndex: 8
    SolutionNameMin: Cijk_Ailk_Bjlk_ZB_GB_MT64x64x8_SN_PLR0_SU32_SUM0_SUS128_SNLL1_TT4_4_WG16_16_1_WGM1
    SolutionIndex: 9
    SolutionNameMin: Cijk_Ailk_Bjlk_ZB_GB_MT128x32x8_SN_PLR1_SU32_SUM0_SUS128_SNLL1_TT4_4_WG32_8_1_WGM1
    SolutionIndex: 10
    SolutionNameMin: Cijk_Ailk_Bjlk_ZB_GB_MT32x128x8_SN_PLR1_SU32_SUM3_SUS128_SNLL1_TT4_4_WG8_32_1_WGM1
    SolutionIndex: 11
    SolutionNameMin: Cijk_Ailk_Bjlk_ZB_GB_MT64x64x8_SN_PLR1_SU32_SUM3_SUS128_SNLL1_TT4_4_WG16_16_1_WGM1
    SolutionIndex: 12
    SolutionNameMin: Cijk_Ailk_Bjlk_ZB_GB_MT64x64x8_SN_PLR0_SU32_SUM3_SUS128_SNLL1_TT4_4_WG16_16_1_WGM1
    SolutionIndex: 13
    SolutionNameMin: Cijk_Ailk_Bjlk_ZB_GB_MT64x64x8_SN_PLR1_SU32_SUM0_SUS256_SNLL1_TT4_4_WG16_16_1_WGM1
    SolutionIndex: 14
    SolutionNameMin: Cijk_Ailk_Bjlk_ZB_GB_MT64x64x8_SN_PLR0_SU32_SUM0_SUS256_SNLL1_TT4_4_WG16_16_1_WGM1
    SolutionIndex: 15
    SolutionNameMin: Cijk_Ailk_Bjlk_ZB_GB_MT128x32x8_SN_PLR1_SU32_SUM0_SUS256_SNLL1_TT4_4_WG32_8_1_WGM1
    SolutionIndex: 16
    SolutionNameMin: Cijk_Ailk_Bjlk_ZB_GB_MT64x64x8_SN_PLR0_SU32_SUM3_SUS256_SNLL1_TT4_4_WG16_16_1_WGM1
    SolutionIndex: 17
    SolutionNameMin: Cijk_Ailk_Bjlk_ZB_GB_MT32x128x8_SN_PLR1_SU0_SUM0_SUS256_SNLL1_TT4_4_WG8_32_1_WGM8
    SolutionIndex: 18
    SolutionNameMin: Cijk_Ailk_Bjlk_ZB_GB_MT64x64x8_SN_PLR1_SU0_SUM0_SUS256_SNLL1_TT4_4_WG16_16_1_WGM8
    SolutionIndex: 19
    SolutionNameMin: Cijk_Ailk_Bjlk_ZB_GB_MT64x64x8_SN_PLR0_SU0_SUM0_SUS256_SNLL1_TT4_4_WG16_16_1_WGM8
    SolutionIndex: 20
    SolutionNameMin: Cijk_Ailk_Bjlk_ZB_GB_MT128x32x8_SN_PLR1_SU0_SUM0_SUS256_SNLL1_TT4_4_WG32_8_1_WGM8
    SolutionIndex: 21
    SolutionNameMin: Cijk_Ailk_Bjlk_ZB_GB_MT64x64x16_SN_PLR1_SU0_SUM0_SUS256_SNLL1_TT4_4_WG16_16_1_WGM8
    SolutionIndex: 22
    SolutionNameMin: Cijk_Ailk_Bjlk_ZB_GB_MT64x64x8_SN_PLR1_SU32_SUM0_SUS128_SNLL1_TT4_4_WG16_16_1_WGM8
    SolutionIndex: 23
    SolutionNameMin: Cijk_Ailk_Bjlk_ZB_GB_MT64x64x8_SN_PLR0_SU32_SUM0_SUS128_SNLL1_TT4_4_WG16_16_1_WGM8
    SolutionIndex: 24
    SolutionNameMin: Cijk_Ailk_Bjlk_ZB_GB_MT64x64x8_SN_PLR1_SU32_SUM3_SUS128_SNLL1_TT4_4_WG16_16_1_WGM8
    SolutionIndex: 25
    SolutionNameMin: Cijk_Ailk_Bjlk_ZB_GB_MT64x64x8_SN_PLR0_SU32_SUM0_SUS256_SNLL1_TT4_4_WG16_16_1_WGM8
    SolutionIndex: 26
    SolutionNameMin: Cijk_Ailk_Bjlk_ZB_GB_MT128x32x8_SN_PLR1_SU32_SUM0_SUS256_SNLL1_TT4_4_WG32_8_1_WGM8
    SolutionIndex: 27
    SolutionNameMin: Cijk_Ailk_Bjlk_ZB_GB_MT64x64x8_SN_PLR0_SU32_SUM3_SUS256_SNLL1_TT4_4_WG16_16_1_WGM8
    SolutionIndex: 28
    SolutionNameMin: Cijk_Ailk_Bjlk_ZB_GB_MT32x128x8_SN_PLR1_SU0_SUM0_SUS256_SNLL1_TT4_4_WG8_32_1_WGM15
    SolutionIndex: 29
    SolutionNameMin: Cijk_Ailk_Bjlk_ZB_GB_MT64x64x8_SN_PLR1_SU0_SUM0_SUS256_SNLL1_TT4_4_WG16_16_1_WGM15
    SolutionIndex: 30
    SolutionNameMin: Cijk_Ailk_Bjlk_ZB_GB_MT64x64x8_SN_PLR0_SU0_SUM0_SUS256_SNLL1_TT4_4_WG16_16_1_WGM15
    SolutionIndex: 31
    SolutionNameMin: Cijk_Ailk_Bjlk_ZB_GB_MT128x32x8_SN_PLR1_SU0_SUM0_SUS256_SNLL1_TT4_4_WG32_8_1_WGM15
    SolutionIndex: 32
    SolutionNameMin: Cijk_Ailk_Bjlk_ZB_GB_MT64x64x16_SN_PLR1_SU0_SUM0_SUS256_SNLL1_TT4_4_WG16_16_1_WGM15
    SolutionIndex: 33
    SolutionNameMin: Cijk_Ailk_Bjlk_ZB_GB_MT64x64x8_SN_PLR0_SU32_SUM0_SUS128_SNLL1_TT4_4_WG16_16_1_WGM15
    SolutionIndex: 34
    SolutionNameMin: Cijk_Ailk_Bjlk_ZB_GB_MT128x32x8_SN_PLR1_SU32_SUM0_SUS128_SNLL1_TT4_4_WG32_8_1_WGM15
    SolutionIndex: 35
    SolutionNameMin: Cijk_Ailk_Bjlk_ZB_GB_MT64x64x8_SN_PLR1_SU32_SUM3_SUS128_SNLL1_TT4_4_WG16_16_1_WGM15
    SolutionIndex: 36
    SolutionNameMin: Cijk_Ailk_Bjlk_ZB_GB_MT64x64x8_SN_PLR1_SU32_SUM0_SUS256_SNLL1_TT4_4_WG16_16_1_WGM15
    SolutionIndex: 37
    SolutionNameMin: Cijk_Ailk_Bjlk_ZB_GB_MT64x64x8_SN_PLR0_SU32_SUM0_SUS256_SNLL1_TT4_4_WG16_16_1_WGM15
    SolutionIndex: 38
    SolutionNameMin: Cijk_Ailk_Bjlk_ZB_GB_MT64x64x8_SN_PLR1_SU32_SUM3_SUS256_SNLL1_TT4_4_WG16_16_1_WGM15
    SolutionIndex: 39
    SolutionNameMin: Cijk_Ailk_Bjlk_ZB_GB_MT32x128x8_SN_PLR1_SU0_SUM0_SUS256_SNLL0_TT4_4_WG8_32_1_WGM1
    SolutionIndex: 40
    SolutionNameMin: Cijk_Ailk_Bjlk_ZB_GB_MT64x64x8_SN_PLR0_SU0_SUM0_SUS256_SNLL0_TT4_4_WG16_16_1_WGM1
    SolutionIndex: 41
    SolutionNameMin: Cijk_Ailk_Bjlk_ZB_GB_MT128x32x8_SN_PLR1_SU0_SUM0_SUS256_SNLL0_TT4_4_WG32_8_1_WGM1
    SolutionIndex: 42
    SolutionNameMin: Cijk_Ailk_Bjlk_ZB_GB_MT32x128x8_SN_PLR1_SU32_SUM0_SUS128_SNLL0_TT4_4_WG8_32_1_WGM1
    SolutionIndex: 43
    SolutionNameMin: Cijk_Ailk_Bjlk_ZB_GB_MT64x64x8_SN_PLR0_SU32_SUM0_SUS128_SNLL0_TT4_4_WG16_16_1_WGM1
    SolutionIndex: 44
    SolutionNameMin: Cijk_Ailk_Bjlk_ZB_GB_MT128x32x8_SN_PLR1_SU32_SUM0_SUS128_SNLL0_TT4_4_WG32_8_1_WGM1
    SolutionIndex: 45
    SolutionNameMin: Cijk_Ailk_Bjlk_ZB_GB_MT64x64x8_SN_PLR0_SU32_SUM3_SUS128_SNLL0_TT4_4_WG16_16_1_WGM1
    SolutionIndex: 46
    SolutionNameMin: Cijk_Ailk_Bjlk_ZB_GB_MT32x128x8_SN_PLR1_SU32_SUM0_SUS256_SNLL0_TT4_4_WG8_32_1_WGM1
    SolutionIndex: 47
    SolutionNameMin: Cijk_Ailk_Bjlk_ZB_GB_MT64x64x8_SN_PLR0_SU32_SUM0_SUS256_SNLL0_TT4_4_WG16_16_1_WGM1
    SolutionIndex: 48
    SolutionNameMin: Cijk_Ailk_Bjlk_ZB_GB_MT64x64x8_SN_PLR0_SU32_SUM3_SUS256_SNLL0_TT4_4_WG16_16_1_WGM1
    SolutionIndex: 49
    SolutionNameMin: Cijk_Ailk_Bjlk_ZB_GB_MT128x32x8_SN_PLR1_SU32_SUM3_SUS256_SNLL0_TT4_4_WG32_8_1_WGM1
    SolutionIndex: 50
    SolutionNameMin: Cijk_Ailk_Bjlk_ZB_GB_MT32x128x8_SN_PLR1_SU0_SUM0_SUS256_SNLL0_TT4_4_WG8_32_1_WGM8
    SolutionIndex: 51
    SolutionNameMin: Cijk_Ailk_Bjlk_ZB_GB_MT64x64x8_SN_PLR1_SU0_SUM0_SUS256_SNLL0_TT4_4_WG16_16_1_WGM8
    SolutionIndex: 52
    SolutionNameMin: Cijk_Ailk_Bjlk_ZB_GB_MT64x64x8_SN_PLR0_SU0_SUM0_SUS256_SNLL0_TT4_4_WG16_16_1_WGM8
    SolutionIndex: 53
    SolutionNameMin: Cijk_Ailk_Bjlk_ZB_GB_MT128x32x8_SN_PLR1_SU0_SUM0_SUS256_SNLL0_TT4_4_WG32_8_1_WGM8
    SolutionIndex: 54
    SolutionNameMin: Cijk_Ailk_Bjlk_ZB_GB_MT64x64x16_SN_PLR1_SU0_SUM0_SUS256_SNLL0_TT4_4_WG16_16_1_WGM8
    SolutionIndex: 55
    SolutionNameMin: Cijk_Ailk_Bjlk_ZB_GB_MT64x64x8_SN_PLR0_SU32_SUM0_SUS128_SNLL0_TT4_4_WG16_16_1_WGM8
    SolutionIndex: 56
    SolutionNameMin: Cijk_Ailk_Bjlk_ZB_GB_MT64x64x8_SN_PLR0_SU32_SUM3_SUS128_SNLL0_TT4_4_WG16_16_1_WGM8
    SolutionIndex: 57
    SolutionNameMin: Cijk_Ailk_Bjlk_ZB_GB_MT64x64x8_SN_PLR0_SU32_SUM0_SUS256_SNLL0_TT4_4_WG16_16_1_WGM8
    SolutionIndex: 58
    SolutionNameMin: Cijk_Ailk_Bjlk_ZB_GB_MT64x64x8_SN_PLR1_SU32_SUM3_SUS256_SNLL0_TT4_4_WG16_16_1_WGM8
    SolutionIndex: 59
    SolutionNameMin: Cijk_Ailk_Bjlk_ZB_GB_MT32x128x8_SN_PLR1_SU0_SUM0_SUS256_SNLL0_TT4_4_WG8_32_1_WGM15
    SolutionIndex: 60
    SolutionNameMin: Cijk_Ailk_Bjlk_ZB_GB_MT64x64x8_SN_PLR0_SU0_SUM0_SUS256_SNLL0_TT4_4_WG16_16_1_WGM15
    SolutionIndex: 61
    SolutionNameMin: Cijk_Ailk_Bjlk_ZB_GB_MT128x32x8_SN_PLR1_SU0_SUM0_SUS256_SNLL0_TT4_4_WG32_8_1_WGM15
    SolutionIndex: 62
    SolutionNameMin: Cijk_Ailk_Bjlk_ZB_GB_MT64x64x8_SN_PLR0_SU32_SUM0_SUS128_SNLL0_TT4_4_WG16_16_1_WGM15
    SolutionIndex: 63
    SolutionNameMin: Cijk_Ailk_Bjlk_ZB_GB_MT64x64x8_SN_PLR0_SU32_SUM3_SUS128_SNLL0_TT4_4_WG16_16_1_WGM15
    SolutionIndex: 64
    SolutionNameMin: Cijk_Ailk_Bjlk_ZB_GB_MT64x64x8_SN_PLR0_SU32_SUM0_SUS256_SNLL0_TT4_4_WG16_16_1_WGM15
    SolutionIndex: 65
    SolutionNameMin: Cijk_Ailk_Bjlk_ZB_GB_MT64x64x8_SN_PLR0_SU32_SUM3_SUS256_SNLL0_TT4_4_WG16_16_1_WGM15
    SolutionIndex: 66
    SolutionNameMin: Cijk_Ailk_Bjlk_ZB_GB_MT16x16x4_SN_PLR1_SU0_SUM0_SUS256_SNLL1_TT2_2_WG8_8_1_WGM1
    SolutionIndex: 67
    SolutionNameMin: Cijk_Ailk_Bjlk_ZB_GB_MT8x8x8_SN_PLR1_SU0_SUM0_SUS256_SNLL1_TT1_1_WG8_8_1_WGM1
    SolutionIndex: 68
    SolutionNameMin: Cijk_Ailk_Bjlk_ZB_GB_MT8x8x8_SN_PLR0_SU0_SUM0_SUS256_SNLL1_TT1_1_WG8_8_1_WGM1
    SolutionIndex: 69
    SolutionNameMin: Cijk_Ailk_Bjlk_ZB_GB_MT16x16x4_SN_PLR1_SU32_SUM0_SUS128_SNLL1_TT2_2_WG8_8_1_WGM1
    SolutionIndex: 70
    SolutionNameMin: Cijk_Ailk_Bjlk_ZB_GB_MT8x8x8_SN_PLR1_SU32_SUM3_SUS256_SNLL1_TT1_1_WG8_8_1_WGM8
    SolutionIndex: 71
    SolutionNameMin: Cijk_Ailk_Bjlk_ZB_GB_MT16x16x4_SN_PLR1_SU0_SUM0_SUS256_SNLL1_TT2_2_WG8_8_1_WGM15
    SolutionIndex: 72
    SolutionNameMin: Cijk_Ailk_Bjlk_ZB_GB_MT8x8x8_SN_PLR1_SU0_SUM0_SUS256_SNLL1_TT1_1_WG8_8_1_WGM15
    SolutionIndex: 73
    SolutionNameMin: Cijk_Ailk_Bjlk_ZB_GB_MT32x32x8_SN_PLR1_SU0_SUM0_SUS256_SNLL1_TT2_2_WG16_16_1_WGM15
    SolutionIndex: 74
    SolutionNameMin: Cijk_Ailk_Bjlk_ZB_GB_MT16x16x4_SN_PLR1_SU0_SUM0_SUS256_SNLL0_TT2_2_WG8_8_1_WGM1
    SolutionIndex: 75
    SolutionNameMin: Cijk_Ailk_Bjlk_ZB_GB_MT8x8x8_SN_PLR1_SU0_SUM0_SUS256_SNLL0_TT1_1_WG8_8_1_WGM1
    SolutionIndex: 76
    SolutionNameMin: Cijk_Ailk_Bjlk_ZB_GB_MT16x16x8_SN_PLR1_SU0_SUM0_SUS256_SNLL0_TT2_2_WG8_8_1_WGM1
    SolutionIndex: 77
    SolutionNameMin: Cijk_Ailk_Bjlk_ZB_GB_MT32x32x8_SN_PLR1_SU0_SUM0_SUS256_SNLL0_TT2_2_WG16_16_1_WGM1
    SolutionIndex: 78
    SolutionNameMin: Cijk_Ailk_Bjlk_ZB_GB_MT32x32x8_SN_PLR1_SU32_SUM0_SUS128_SNLL0_TT2_2_WG16_16_1_WGM1
    SolutionIndex: 79
    SolutionNameMin: Cijk_Ailk_Bjlk_ZB_GB_MT16x16x4_SN_PLR1_SU32_SUM3_SUS128_SNLL0_TT2_2_WG8_8_1_WGM1
    SolutionIndex: 80
    SolutionNameMin: Cijk_Ailk_Bjlk_ZB_GB_MT32x32x8_SN_PLR1_SU32_SUM3_SUS128_SNLL0_TT2_2_WG16_16_1_WGM1
    SolutionIndex: 81
    SolutionNameMin: Cijk_Ailk_Bjlk_ZB_GB_MT16x16x4_SN_PLR1_SU0_SUM0_SUS256_SNLL0_TT2_2_WG8_8_1_WGM8
    SolutionIndex: 82
    SolutionNameMin: Cijk_Ailk_Bjlk_ZB_GB_MT16x16x4_SN_PLR0_SU0_SUM0_SUS256_SNLL0_TT2_2_WG8_8_1_WGM8
    SolutionIndex: 83
    SolutionNameMin: Cijk_Ailk_Bjlk_ZB_GB_MT16x16x8_SN_PLR1_SU0_SUM0_SUS256_SNLL0_TT2_2_WG8_8_1_WGM8
    SolutionIndex: 84
    SolutionNameMin: Cijk_Ailk_Bjlk_ZB_GB_MT32x32x8_SN_PLR1_SU0_SUM0_SUS256_SNLL0_TT2_2_WG16_16_1_WGM8
    SolutionIndex: 85
    SolutionNameMin: Cijk_Ailk_Bjlk_ZB_GB_MT16x16x4_SN_PLR1_SU32_SUM0_SUS128_SNLL0_TT2_2_WG8_8_1_WGM8
    SolutionIndex: 86
    SolutionNameMin: Cijk_Ailk_Bjlk_ZB_GB_MT32x32x8_SN_PLR1_SU32_SUM0_SUS128_SNLL0_TT2_2_WG16_16_1_WGM8
    SolutionIndex: 87
    SolutionNameMin: Cijk_Ailk_Bjlk_ZB_GB_MT16x16x4_SN_PLR1_SU32_SUM3_SUS128_SNLL0_TT2_2_WG8_8_1_WGM8
    SolutionIndex: 88
    SolutionNameMin: Cijk_Ailk_Bjlk_ZB_GB_MT16x16x4_SN_PLR1_SU32_SUM0_SUS256_SNLL0_TT2_2_WG8_8_1_WGM8
    SolutionIndex: 89
    SolutionNameMin: Cijk_Ailk_Bjlk_ZB_GB_MT16x16x4_SN_PLR1_SU32_SUM3_SUS256_SNLL0_TT2_2_WG8_8_1_WGM8
    SolutionIndex: 90
    SolutionNameMin: Cijk_Ailk_Bjlk_ZB_GB_MT32x32x8_SN_PLR1_SU32_SUM3_SUS256_SNLL0_TT2_2_WG16_16_1_WGM8
    SolutionIndex: 91
    SolutionNameMin: Cijk_Ailk_Bjlk_ZB_GB_MT16x16x4_SN_PLR1_SU0_SUM0_SUS256_SNLL0_TT2_2_WG8_8_1_WGM15
    SolutionIndex: 92
    SolutionNameMin: Cijk_Ailk_Bjlk_ZB_GB_MT8x8x8_SN_PLR0_SU0_SUM0_SUS256_SNLL0_TT1_1_WG8_8_1_WGM15
    SolutionIndex: 93
    SolutionNameMin: Cijk_Ailk_Bjlk_ZB_GB_MT16x16x8_SN_PLR1_SU0_SUM0_SUS256_SNLL0_TT2_2_WG8_8_1_WGM15
    SolutionIndex: 94
    SolutionNameMin: Cijk_Ailk_Bjlk_ZB_GB_MT32x32x8_SN_PLR1_SU0_SUM0_SUS256_SNLL0_TT2_2_WG16_16_1_WGM15
    SolutionIndex: 95
    SolutionNameMin: Cijk_Ailk_Bjlk_ZB_GB_MT16x16x4_SN_PLR1_SU32_SUM3_SUS128_SNLL0_TT2_2_WG8_8_1_WGM15
    SolutionIndex: 96
    SolutionNameMin: Cijk_Ailk_Bjlk_ZB_GB_MT16x16x4_SN_PLR1_SU32_SUM0_SUS256_SNLL0_TT2_2_WG8_8_1_WGM15
    SolutionIndex: 97
    SolutionNameMin: Cijk_Ailk_Bjlk_ZB_GB_MT16x16x4_SN_PLR1_SU32_SUM3_SUS256_SNLL0_TT2_2_WG8_8_1_WGM15
    SolutionIndex: 98
    SolutionNameMin: Cijk_Ailk_Bjlk_ZB_GB_MT64x128x8_SN_PLR0_SU0_SUM0_SUS256_SNLL0_TT4_8_WG16_16_1_WGM1
- - - [192, 192, 1000, 32, 192, 192, 192, 192]
    - [40, 1650.0]
  - - [1536, 1536, 168, 32, 1536, 1536, 1536, 1536]
    - [40, 1709.0]
  - - [1536, 32, 168, 1536, 1536, 1536, 1536, 32]
    - [4, 1532.0]
  - - [32, 1536, 168, 32, 32, 32, 32, 1536]
    - [42, 1196.0]
  - - [384, 384, 1024, 384, 384, 384, 384, 384]
    - [8, 1988.0]
  - - [1, 1, 1000, 1, 1, 1, 1, 1]
    - [66, 0.0]
  - - [2, 2, 1000, 2, 2, 2, 2, 2]
    - [66, 2.0]
  - - [3, 3, 1000, 3, 3, 3, 3, 3]
    - [67, 7.0]
  - - [4, 4, 1000, 4, 4, 4, 4, 4]
    - [72, 17.0]
  - - [5, 5, 1000, 5, 5, 5, 5, 5]
    - [68, 32.0]
  - - [6, 6, 1000, 6, 6, 6, 6, 6]
    - [75, 54.0]
  - - [7, 7, 1000, 7, 7, 7, 7, 7]
    - [92, 84.0]
  - - [8, 8, 1000, 8, 8, 8, 8, 8]
    - [70, 116.0]
  - - [9, 9, 1000, 9, 9, 9, 9, 9]
    - [95, 123.0]
  - - [10, 10, 1000, 10, 10, 10, 10, 10]
    - [81, 162.0]
  - - [11, 11, 1000, 11, 11, 11, 11, 11]
    - [69, 198.0]
  - - [12, 12, 1000, 12, 12, 12, 12, 12]
    - [89, 260.0]
  - - [13, 13, 1000, 13, 13, 13, 13, 13]
    - [87, 289.0]
  - - [14, 14, 1000, 14, 14, 14, 14, 14]
    - [95, 346.0]
  - - [15, 15, 1000, 15, 15, 15, 15, 15]
    - [74, 406.0]
  - - [16, 16, 1000, 16, 16, 16, 16, 16]
    - [79, 497.0]
  - - [17, 17, 1000, 17, 17, 17, 17, 17]
    - [94, 294.0]
  - - [18, 18, 1000, 18, 18, 18, 18, 18]
    - [84, 333.0]
  - - [19, 19, 1000, 19, 19, 19, 19, 19]
    - [77, 376.0]
  - - [20, 20, 1000, 20, 20, 20, 20, 20]
    - [78, 420.0]
  - - [21, 21, 1000, 21, 21, 21, 21, 21]
    - [78, 465.0]
  - - [22, 22, 1000, 22, 22, 22, 22, 22]
    - [78, 518.0]
  - - [23, 23, 1000, 23, 23, 23, 23, 23]
    - [80, 563.0]
  - - [24, 24, 1000, 24, 24, 24, 24, 24]
    - [73, 647.0]
  - - [25, 25, 1000, 25, 25, 25, 25, 25]
    - [77, 683.0]
  - - [26, 26, 1000, 26, 26, 26, 26, 26]
    - [77, 742.0]
  - - [27, 27, 1000, 27, 27, 27, 27, 27]
    - [77, 791.0]
  - - [28, 28, 1000, 28, 28, 28, 28, 28]
    - [94, 847.0]
  - - [29, 29, 1000, 29, 29, 29, 29, 29]
    - [77, 879.0]
  - - [30, 30, 1000, 30, 30, 30, 30, 30]
    - [86, 930.0]
  - - [31, 31, 1000, 31, 31, 31, 31, 31]
    - [90, 975.0]
  - - [32, 32, 1000, 32, 32, 32, 32, 32]
    - [84, 1104.0]
  - - [33, 33, 1000, 33, 33, 33, 33, 33]
    - [91, 582.0]
  - - [34, 34, 1000, 34, 34, 34, 34, 34]
    - [97, 648.0]
  - - [35, 35, 1000, 35, 35, 35, 35, 35]
    - [88, 657.0]
  - - [36, 36, 1000, 36, 36, 36, 36, 36]
    - [96, 804.0]
  - - [37, 37, 1000, 37, 37, 37, 37, 37]
    - [81, 730.0]
  - - [38, 38, 1000, 38, 38, 38, 38, 38]
    - [91, 810.0]
  - - [39, 39, 1000, 39, 39, 39, 39, 39]
    - [85, 797.0]
  - - [40, 40, 1000, 40, 40, 40, 40, 40]
    - [91, 996.0]
  - - [41, 41, 1000, 41, 41, 41, 41, 41]
    - [71, 888.0]
  - - [42, 42, 1000, 42, 42, 42, 42, 42]
    - [91, 986.0]
  - - [43, 43, 1000, 43, 43, 43, 43, 43]
    - [91, 986.0]
  - - [44, 44, 1000, 44, 44, 44, 44, 44]
    - [91, 1213.0]
  - - [45, 45, 1000, 45, 45, 45, 45, 45]
    - [74, 1064.0]
  - - [46, 46, 1000, 46, 46, 46, 46, 46]
    - [66, 1171.0]
  - - [47, 47, 1000, 47, 47, 47, 47, 47]
    - [82, 1139.0]
  - - [48, 48, 1000, 48, 48, 48, 48, 48]
    - [71, 1402.0]
  - - [49, 49, 1000, 49, 49, 49, 49, 49]
    - [77, 966.0]
  - - [50, 50, 1000, 50, 50, 50, 50, 50]
    - [77, 1008.0]
  - - [51, 51, 1000, 51, 51, 51, 51, 51]
    - [77, 1049.0]
  - - [52, 52, 1000, 52, 52, 52, 52, 52]
    - [84, 1092.0]
  - - [53, 53, 1000, 53, 53, 53, 53, 53]
    - [77, 1130.0]
  - - [54, 54, 1000, 54, 54, 54, 54, 54]
    - [77, 1177.0]
  - - [55, 55, 1000, 55, 55, 55, 55, 55]
    - [84, 1220.0]
  - - [56, 56, 1000, 56, 56, 56, 56, 56]
    - [77, 1310.0]
  - - [57, 57, 1000, 57, 57, 57, 57, 57]
    - [77, 1330.0]
  - - [58, 58, 1000, 58, 58, 58, 58, 58]
    - [77, 1378.0]
  - - [59, 59, 1000, 59, 59, 59, 59, 59]
    - [77, 1418.0]
  - - [60, 60, 1000, 60, 60, 60, 60, 60]
    - [77, 1475.0]
  - - [61, 61, 1000, 61, 61, 61, 61, 61]
    - [77, 1512.0]
  - - [62, 62, 1000, 62, 62, 62, 62, 62]
    - [77, 1564.0]
  - - [63, 63, 1000, 63, 63, 63, 63, 63]
    - [77, 1612.0]
  - - [64, 64, 1000, 64, 64, 64, 64, 64]
    - [84, 1733.0]
  - - [65, 65, 1000, 65, 65, 65, 65, 65]
    - [76, 891.0]
  - - [66, 66, 1000, 66, 66, 66, 66, 66]
    - [93, 938.0]
  - - [67, 67, 1000, 67, 67, 67, 67, 67]
    - [76, 945.0]
  - - [68, 68, 1000, 68, 68, 68, 68, 68]
    - [76, 1009.0]
  - - [69, 69, 1000, 69, 69, 69, 69, 69]
    - [93, 1000.0]
  - - [70, 70, 1000, 70, 70, 70, 70, 70]
    - [83, 1051.0]
  - - [71, 71, 1000, 71, 71, 71, 71, 71]
    - [93, 1056.0]
  - - [72, 72, 1000, 72, 72, 72, 72, 72]
    - [93, 1176.0]
  - - [73, 73, 1000, 73, 73, 73, 73, 73]
    - [76, 1122.0]
  - - [74, 74, 1000, 74, 74, 74, 74, 74]
    - [83, 1186.0]
  - - [75, 75, 1000, 75, 75, 75, 75, 75]
    - [93, 1181.0]
  - - [76, 76, 1000, 76, 76, 76, 76, 76]
    - [76, 1277.0]
  - - [77, 77, 1000, 77, 77, 77, 77, 77]
    - [76, 1244.0]
  - - [78, 78, 1000, 78, 78, 78, 78, 78]
    - [83, 1312.0]
  - - [79, 79, 1000, 79, 79, 79, 79, 79]
    - [76, 1304.0]
  - - [80, 80, 1000, 80, 80, 80, 80, 80]
    - [76, 1465.0]
  - - [81, 81, 1000, 81, 81, 81, 81, 81]
    - [84, 1275.0]
  - - [82, 82, 1000, 82, 82, 82, 82, 82]
    - [84, 1309.0]
  - - [83, 83, 1000, 83, 83, 83, 83, 83]
    - [94, 1341.0]
  - - [84, 84, 1000, 84, 84, 84, 84, 84]
    - [77, 1379.0]
  - - [85, 85, 1000, 85, 85, 85, 85, 85]
    - [77, 1405.0]
  - - [86, 86, 1000, 86, 86, 86, 86, 86]
    - [77, 1440.0]
  - - [87, 87, 1000, 87, 87, 87, 87, 87]
    - [77, 1472.0]
  - - [88, 88, 1000, 88, 88, 88, 88, 88]
    - [77, 1517.0]
  - - [89, 89, 1000, 89, 89, 89, 89, 89]
    - [77, 1541.0]
  - - [90, 90, 1000, 90, 90, 90, 90, 90]
    - [94, 1578.0]
  - - [91, 91, 1000, 91, 91, 91, 91, 91]
    - [84, 1614.0]
  - - [92, 92, 1000, 92, 92, 92, 92, 92]
    - [77, 1656.0]
  - - [93, 93, 1000, 93, 93, 93, 93, 93]
    - [84, 1690.0]
  - - [94, 94, 1000, 94, 94, 94, 94, 94]
    - [77, 1730.0]
  - - [95, 95, 1000, 95, 95, 95, 95, 95]
    - [77, 1764.0]
  - - [96, 96, 1000, 96, 96, 96, 96, 96]
    - [84, 1828.0]
  - - [97, 97, 1000, 97, 97, 97, 97, 97]
    - [83, 1070.0]
  - - [98, 98, 1000, 98, 98, 98, 98, 98]
    - [83, 1119.0]
  - - [99, 99, 1000, 99, 99, 99, 99, 99]
    - [83, 1109.0]
  - - [100, 100, 1000, 100, 100, 100, 100, 100]
    - [93, 1182.0]
  - - [101, 101, 1000, 101, 101, 101, 101, 101]
    - [76, 1140.0]
  - - [102, 102, 1000, 102, 102, 102, 102, 102]
    - [76, 1195.0]
  - - [103, 103, 1000, 103, 103, 103, 103, 103]
    - [76, 1183.0]
  - - [104, 104, 1000, 104, 104, 104, 104, 104]
    - [76, 1311.0]
  - - [105, 105, 1000, 105, 105, 105, 105, 105]
    - [76, 1237.0]
  - - [106, 106, 1000, 106, 106, 106, 106, 106]
    - [76, 1307.0]
  - - [107, 107, 1000, 107, 107, 107, 107, 107]
    - [76, 1294.0]
  - - [108, 108, 1000, 108, 108, 108, 108, 108]
    - [76, 1388.0]
  - - [109, 109, 1000, 109, 109, 109, 109, 109]
    - [76, 1344.0]
  - - [110, 110, 1000, 110, 110, 110, 110, 110]
    - [76, 1409.0]
  - - [111, 111, 1000, 111, 111, 111, 111, 111]
    - [83, 1392.0]
  - - [112, 112, 1000, 112, 112, 112, 112, 112]
    - [76, 1529.0]
  - - [113, 113, 1000, 113, 113, 113, 113, 113]
    - [94, 1414.0]
  - - [114, 114, 1000, 114, 114, 114, 114, 114]
    - [77, 1438.0]
  - - [115, 115, 1000, 115, 115, 115, 115, 115]
    - [84, 1464.0]
  - - [116, 116, 1000, 116, 116, 116, 116, 116]
    - [19, 1494.0]
  - - [117, 117, 1000, 117, 117, 117, 117, 117]
    - [84, 1516.0]
  - - [118, 118, 1000, 118, 118, 118, 118, 118]
    - [84, 1544.0]
  - - [119, 119, 1000, 119, 119, 119, 119, 119]
    - [84, 1572.0]
  - - [120, 120, 1000, 120, 120, 120, 120, 120]
    - [33, 1607.0]
  - - [121, 121, 1000, 121, 121, 121, 121, 121]
    - [84, 1624.0]
  - - [122, 122, 1000, 122, 122, 122, 122, 122]
    - [77, 1649.0]
  - - [123, 123, 1000, 123, 123, 123, 123, 123]
    - [77, 1676.0]
  - - [124, 124, 1000, 124, 124, 124, 124, 124]
    - [94, 1706.0]
  - - [125, 125, 1000, 125, 125, 125, 125, 125]
    - [84, 1732.0]
  - - [126, 126, 1000, 126, 126, 126, 126, 126]
    - [77, 1761.0]
  - - [127, 127, 1000, 127, 127, 127, 127, 127]
    - [77, 1788.0]
  - - [128, 128, 1000, 128, 128, 128, 128, 128]
    - [55, 1858.0]
  - - [129, 129, 1000, 129, 129, 129, 129, 129]
    - [77, 1188.0]
  - - [130, 130, 1000, 130, 130, 130, 130, 130]
    - [77, 1207.0]
  - - [131, 131, 1000, 131, 131, 131, 131, 131]
    - [77, 1226.0]
  - - [132, 132, 1000, 132, 132, 132, 132, 132]
    - [93, 1278.0]
  - - [133, 133, 1000, 133, 133, 133, 133, 133]
    - [77, 1265.0]
  - - [134, 134, 1000, 134, 134, 134, 134, 134]
    - [83, 1288.0]
  - - [135, 135, 1000, 135, 135, 135, 135, 135]
    - [77, 1304.0]
  - - [136, 136, 1000, 136, 136, 136, 136, 136]
    - [93, 1386.0]
  - - [137, 137, 1000, 137, 137, 137, 137, 137]
    - [77, 1342.0]
  - - [138, 138, 1000, 138, 138, 138, 138, 138]
    - [83, 1379.0]
  - - [139, 139, 1000, 139, 139, 139, 139, 139]
    - [77, 1382.0]
  - - [140, 140, 1000, 140, 140, 140, 140, 140]
    - [93, 1446.0]
  - - [141, 141, 1000, 141, 141, 141, 141, 141]
    - [77, 1424.0]
  - - [142, 142, 1000, 142, 142, 142, 142, 142]
    - [76, 1459.0]
  - - [143, 143, 1000, 143, 143, 143, 143, 143]
    - [77, 1466.0]
  - - [144, 144, 1000, 144, 144, 144, 144, 144]
    - [76, 1554.0]
  - - [145, 145, 1000, 145, 145, 145, 145, 145]
    - [77, 1505.0]
  - - [146, 146, 1000, 146, 146, 146, 146, 146]
    - [77, 1525.0]
  - - [147, 147, 1000, 147, 147, 147, 147, 147]
    - [77, 1546.0]
  - - [148, 148, 1000, 148, 148, 148, 148, 148]
    - [77, 1571.0]
  - - [149, 149, 1000, 149, 149, 149, 149, 149]
    - [77, 1591.0]
  - - [150, 150, 1000, 150, 150, 150, 150, 150]
    - [77, 1614.0]
  - - [32, 32, 8, 32, 32, 32, 32, 32]
    - [10, 10.0]
  - - [32, 32, 8, 64, 32, 32, 32, 32]
    - [18, 15.0]
  - - [32, 32, 8, 128, 32, 32, 32, 32]
    - [0, 19.0]
  - - [32, 32, 8, 256, 32, 32, 32, 32]
    - [0, 22.0]
  - - [32, 32, 8, 512, 32, 32, 32, 32]
    - [0, 24.0]
  - - [32, 32, 8, 1024, 32, 32, 32, 32]
    - [2, 26.0]
  - - [32, 32, 8, 2048, 32, 32, 32, 32]
    - [0, 26.0]
  - - [32, 64, 8, 32, 32, 32, 32, 64]
    - [1, 19.0]
  - - [32, 64, 8, 64, 32, 32, 32, 64]
    - [2, 29.0]
  - - [32, 64, 8, 128, 32, 32, 32, 64]
    - [0, 37.0]
  - - [32, 64, 8, 256, 32, 32, 32, 64]
    - [0, 44.0]
  - - [32, 64, 8, 512, 32, 32, 32, 64]
    - [2, 49.0]
  - - [32, 64, 8, 1024, 32, 32, 32, 64]
    - [0, 51.0]
  - - [32, 64, 8, 2048, 32, 32, 32, 64]
    - [2, 53.0]
  - - [32, 128, 8, 32, 32, 32, 32, 128]
    - [6, 40.0]
  - - [32, 128, 8, 64, 32, 32, 32, 128]
    - [0, 58.0]
  - - [32, 128, 8, 128, 32, 32, 32, 128]
    - [0, 75.0]
  - - [32, 128, 8, 256, 32, 32, 32, 128]
    - [2, 89.0]
  - - [32, 128, 8, 512, 32, 32, 32, 128]
    - [2, 98.0]
  - - [32, 128, 8, 1024, 32, 32, 32, 128]
    - [2, 103.0]
  - - [32, 128, 8, 2048, 32, 32, 32, 128]
    - [2, 105.0]
  - - [32, 256, 8, 32, 32, 32, 32, 256]
    - [17, 82.0]
  - - [32, 256, 8, 64, 32, 32, 32, 256]
    - [6, 118.0]
  - - [32, 256, 8, 128, 32, 32, 32, 256]
    - [13, 151.0]
  - - [32, 256, 8, 256, 32, 32, 32, 256]
    - [2, 178.0]
  - - [32, 256, 8, 512, 32, 32, 32, 256]
    - [2, 195.0]
  - - [32, 256, 8, 1024, 32, 32, 32, 256]
    - [2, 205.0]
  - - [32, 256, 8, 2048, 32, 32, 32, 256]
    - [2, 211.0]
  - - [32, 512, 8, 32, 32, 32, 32, 512]
    - [44, 162.0]
  - - [32, 512, 8, 64, 32, 32, 32, 512]
    - [17, 235.0]
  - - [32, 512, 8, 128, 32, 32, 32, 512]
    - [2, 301.0]
  - - [32, 512, 8, 256, 32, 32, 32, 512]
    - [36, 355.0]
  - - [32, 512, 8, 512, 32, 32, 32, 512]
    - [29, 390.0]
  - - [32, 512, 8, 1024, 32, 32, 32, 512]
    - [29, 410.0]
  - - [32, 512, 8, 2048, 32, 32, 32, 512]
    - [2, 422.0]
  - - [32, 1024, 8, 32, 32, 32, 32, 1024]
    - [12, 399.0]
  - - [32, 1024, 8, 64, 32, 32, 32, 1024]
    - [33, 466.0]
  - - [32, 1024, 8, 128, 32, 32, 32, 1024]
    - [6, 597.0]
  - - [32, 1024, 8, 256, 32, 32, 32, 1024]
    - [28, 701.0]
  - - [32, 1024, 8, 512, 32, 32, 32, 1024]
    - [17, 764.0]
  - - [32, 1024, 8, 1024, 32, 32, 32, 1024]
    - [0, 800.0]
  - - [32, 1024, 8, 2048, 32, 32, 32, 1024]
    - [0, 819.0]
  - - [32, 2048, 8, 32, 32, 32, 32, 2048]
    - [59, 594.0]
  - - [32, 2048, 8, 64, 32, 32, 32, 2048]
    - [50, 697.0]
  - - [32, 2048, 8, 128, 32, 32, 32, 2048]
    - [39, 761.0]
  - - [32, 2048, 8, 256, 32, 32, 32, 2048]
    - [59, 796.0]
  - - [32, 2048, 8, 512, 32, 32, 32, 2048]
    - [59, 816.0]
  - - [32, 2048, 8, 1024, 32, 32, 32, 2048]
    - [39, 826.0]
  - - [32, 2048, 8, 2048, 32, 32, 32, 2048]
    - [39, 831.0]
  - - [64, 32, 8, 32, 64, 64, 64, 32]
    - [38, 37.0]
  - - [64, 32, 8, 64, 64, 64, 64, 32]
    - [53, 44.0]
  - - [64, 32, 8, 128, 64, 64, 64, 32]
    - [5, 48.0]
  - - [64, 32, 8, 256, 64, 64, 64, 32]
    - [58, 51.0]
  - - [64, 32, 8, 512, 64, 64, 64, 32]
    - [20, 52.0]
  - - [64, 32, 8, 1024, 64, 64, 64, 32]
    - [32, 53.0]
  - - [64, 32, 8, 2048, 64, 64, 64, 32]
    - [2, 53.0]
  - - [64, 64, 8, 32, 64, 64, 64, 64]
    - [62, 67.0]
  - - [64, 64, 8, 64, 64, 64, 64, 64]
    - [24, 87.0]
  - - [64, 64, 8, 128, 64, 64, 64, 64]
    - [21, 95.0]
  - - [64, 64, 8, 256, 64, 64, 64, 64]
    - [51, 103.0]
  - - [64, 64, 8, 512, 64, 64, 64, 64]
    - [54, 105.0]
  - - [64, 64, 8, 1024, 64, 64, 64, 64]
    - [2, 103.0]
  - - [64, 64, 8, 2048, 64, 64, 64, 64]
    - [7, 107.0]
  - - [64, 128, 8, 32, 64, 64, 64, 128]
    - [98, 83.0]
  - - [64, 128, 8, 64, 64, 64, 64, 128]
    - [11, 118.0]
  - - [64, 128, 8, 128, 64, 64, 64, 128]
    - [2, 153.0]
  - - [64, 128, 8, 256, 64, 64, 64, 128]
    - [2, 178.0]
  - - [64, 128, 8, 512, 64, 64, 64, 128]
    - [2, 196.0]
  - - [64, 128, 8, 1024, 64, 64, 64, 128]
    - [2, 206.0]
  - - [64, 128, 8, 2048, 64, 64, 64, 128]
    - [2, 211.0]
  - - [64, 256, 8, 32, 64, 64, 64, 256]
    - [36, 163.0]
  - - [64, 256, 8, 64, 64, 64, 64, 256]
    - [24, 236.0]
  - - [64, 256, 8, 128, 64, 64, 64, 256]
    - [13, 306.0]
  - - [64, 256, 8, 256, 64, 64, 64, 256]
    - [2, 358.0]
  - - [64, 256, 8, 512, 64, 64, 64, 256]
    - [29, 393.0]
  - - [64, 256, 8, 1024, 64, 64, 64, 256]
    - [18, 412.0]
  - - [64, 256, 8, 2048, 64, 64, 64, 256]
    - [2, 422.0]
  - - [64, 512, 8, 32, 64, 64, 64, 512]
    - [13, 321.0]
  - - [64, 512, 8, 64, 64, 64, 64, 512]
    - [18, 473.0]
  - - [64, 512, 8, 128, 64, 64, 64, 512]
    - [2, 611.0]
  - - [64, 512, 8, 256, 64, 64, 64, 512]
    - [29, 716.0]
  - - [64, 512, 8, 512, 64, 64, 64, 512]
    - [29, 783.0]
  - - [64, 512, 8, 1024, 64, 64, 64, 512]
    - [2, 822.0]
  - - [64, 512, 8, 2048, 64, 64, 64, 512]
    - [18, 843.0]
  - - [64, 1024, 8, 32, 64, 64, 64, 1024]
    - [12, 771.0]
  - - [64, 1024, 8, 64, 64, 64, 64, 1024]
    - [3, 908.0]
  - - [64, 1024, 8, 128, 64, 64, 64, 1024]
    - [40, 994.0]
  - - [64, 1024, 8, 256, 64, 64, 64, 1024]
    - [14, 1043.0]
  - - [64, 1024, 8, 512, 64, 64, 64, 1024]
    - [3, 1071.0]
  - - [64, 1024, 8, 1024, 64, 64, 64, 1024]
    - [47, 1085.0]
  - - [64, 1024, 8, 2048, 64, 64, 64, 1024]
    - [12, 1092.0]
  - - [64, 2048, 8, 32, 64, 64, 64, 2048]
    - [47, 863.0]
  - - [64, 2048, 8, 64, 64, 64, 64, 2048]
    - [56, 1046.0]
  - - [64, 2048, 8, 128, 64, 64, 64, 2048]
    - [43, 1127.0]
  - - [64, 2048, 8, 256, 64, 64, 64, 2048]
    - [40, 1183.0]
  - - [64, 2048, 8, 512, 64, 64, 64, 2048]
    - [43, 1219.0]
  - - [64, 2048, 8, 1024, 64, 64, 64, 2048]
    - [40, 1234.0]
  - - [64, 2048, 8, 2048, 64, 64, 64, 2048]
    - [40, 1241.0]
  - - [128, 32, 8, 32, 128, 128, 128, 32]
    - [26, 41.0]
  - - [128, 32, 8, 64, 128, 128, 128, 32]
    - [4, 59.0]
  - - [128, 32, 8, 128, 128, 128, 128, 32]
    - [2, 75.0]
  - - [128, 32, 8, 256, 128, 128, 128, 32]
    - [11, 89.0]
  - - [128, 32, 8, 512, 128, 128, 128, 32]
    - [2, 98.0]
  - - [128, 32, 8, 1024, 128, 128, 128, 32]
    - [2, 103.0]
  - - [128, 32, 8, 2048, 128, 128, 128, 32]
    - [2, 106.0]
  - - [128, 64, 8, 32, 128, 128, 128, 64]
    - [4, 81.0]
  - - [128, 64, 8, 64, 128, 128, 128, 64]
    - [35, 119.0]
  - - [128, 64, 8, 128, 128, 128, 128, 64]
    - [13, 153.0]
  - - [128, 64, 8, 256, 128, 128, 128, 64]
    - [13, 179.0]
  - - [128, 64, 8, 512, 128, 128, 128, 64]
    - [2, 196.0]
  - - [128, 64, 8, 1024, 128, 128, 128, 64]
    - [2, 206.0]
  - - [128, 64, 8, 2048, 128, 128, 128, 64]
    - [2, 211.0]
  - - [128, 128, 8, 32, 128, 128, 128, 128]
    - [18, 162.0]
  - - [128, 128, 8, 64, 128, 128, 128, 128]
    - [11, 235.0]
  - - [128, 128, 8, 128, 128, 128, 128, 128]
    - [11, 305.0]
  - - [128, 128, 8, 256, 128, 128, 128, 128]
    - [18, 357.0]
  - - [128, 128, 8, 512, 128, 128, 128, 128]
    - [2, 391.0]
  - - [128, 128, 8, 1024, 128, 128, 128, 128]
    - [2, 412.0]
  - - [128, 128, 8, 2048, 128, 128, 128, 128]
    - [2, 422.0]
  - - [128, 256, 8, 32, 128, 128, 128, 256]
    - [20, 319.0]
  - - [128, 256, 8, 64, 128, 128, 128, 256]
    - [26, 465.0]
  - - [128, 256, 8, 128, 128, 128, 128, 256]
    - [18, 608.0]
  - - [128, 256, 8, 256, 128, 128, 128, 256]
    - [22, 711.0]
  - - [128, 256, 8, 512, 128, 128, 128, 256]
    - [2, 780.0]
  - - [128, 256, 8, 1024, 128, 128, 128, 256]
    - [2, 822.0]
  - - [128, 256, 8, 2048, 128, 128, 128, 256]
    - [2, 844.0]
  - - [128, 512, 8, 32, 128, 128, 128, 512]
    - [40, 785.0]
  - - [128, 512, 8, 64, 128, 128, 128, 512]
    - [3, 912.0]
  - - [128, 512, 8, 128, 128, 128, 128, 512]
    - [3, 999.0]
  - - [128, 512, 8, 256, 128, 128, 128, 512]
    - [30, 1045.0]
  - - [128, 512, 8, 512, 128, 128, 128, 512]
    - [23, 1073.0]
  - - [128, 512, 8, 1024, 128, 128, 128, 512]
    - [25, 1087.0]
  - - [128, 512, 8, 2048, 128, 128, 128, 512]
    - [33, 1094.0]
  - - [128, 1024, 8, 32, 128, 128, 128, 1024]
    - [52, 879.0]
  - - [128, 1024, 8, 64, 128, 128, 128, 1024]
    - [3, 1026.0]
  - - [128, 1024, 8, 128, 128, 128, 128, 1024]
    - [56, 1145.0]
  - - [128, 1024, 8, 256, 128, 128, 128, 1024]
    - [40, 1187.0]
  - - [128, 1024, 8, 512, 128, 128, 128, 1024]
    - [52, 1220.0]
  - - [128, 1024, 8, 1024, 128, 128, 128, 1024]
    - [43, 1236.0]
  - - [128, 1024, 8, 2048, 128, 128, 128, 1024]
    - [60, 1244.0]
  - - [128, 2048, 8, 32, 128, 128, 128, 2048]
    - [47, 1091.0]
  - - [128, 2048, 8, 64, 128, 128, 128, 2048]
    - [57, 1305.0]
  - - [128, 2048, 8, 128, 128, 128, 128, 2048]
    - [57, 1431.0]
  - - [128, 2048, 8, 256, 128, 128, 128, 2048]
    - [52, 1505.0]
  - - [128, 2048, 8, 512, 128, 128, 128, 2048]
    - [52, 1543.0]
  - - [128, 2048, 8, 1024, 128, 128, 128, 2048]
    - [60, 1564.0]
  - - [128, 2048, 8, 2048, 128, 128, 128, 2048]
    - [23, 1574.0]
  - - [256, 32, 8, 32, 256, 256, 256, 32]
    - [9, 79.0]
  - - [256, 32, 8, 64, 256, 256, 256, 32]
    - [26, 116.0]
  - - [256, 32, 8, 128, 256, 256, 256, 32]
    - [4, 151.0]
  - - [256, 32, 8, 256, 256, 256, 256, 32]
    - [18, 178.0]
  - - [256, 32, 8, 512, 256, 256, 256, 32]
    - [29, 195.0]
  - - [256, 32, 8, 1024, 256, 256, 256, 32]
    - [2, 205.0]
  - - [256, 32, 8, 2048, 256, 256, 256, 32]
    - [2, 211.0]
  - - [256, 64, 8, 32, 256, 256, 256, 64]
    - [9, 158.0]
  - - [256, 64, 8, 64, 256, 256, 256, 64]
    - [2, 233.0]
  - - [256, 64, 8, 128, 256, 256, 256, 64]
    - [35, 305.0]
  - - [256, 64, 8, 256, 256, 256, 256, 64]
    - [13, 357.0]
  - - [256, 64, 8, 512, 256, 256, 256, 64]
    - [18, 391.0]
  - - [256, 64, 8, 1024, 256, 256, 256, 64]
    - [2, 411.0]
  - - [256, 64, 8, 2048, 256, 256, 256, 64]
    - [2, 422.0]
  - - [256, 128, 8, 32, 256, 256, 256, 128]
    - [18, 318.0]
  - - [256, 128, 8, 64, 256, 256, 256, 128]
    - [29, 465.0]
  - - [256, 128, 8, 128, 256, 256, 256, 128]
    - [18, 610.0]
  - - [256, 128, 8, 256, 256, 256, 256, 128]
    - [18, 714.0]
  - - [256, 128, 8, 512, 256, 256, 256, 128]
    - [36, 781.0]
  - - [256, 128, 8, 1024, 256, 256, 256, 128]
    - [18, 821.0]
  - - [256, 128, 8, 2048, 256, 256, 256, 128]
    - [2, 843.0]
  - - [256, 256, 8, 32, 256, 256, 256, 256]
    - [52, 791.0]
  - - [256, 256, 8, 64, 256, 256, 256, 256]
    - [3, 914.0]
  - - [256, 256, 8, 128, 256, 256, 256, 256]
    - [19, 999.0]
  - - [256, 256, 8, 256, 256, 256, 256, 256]
    - [52, 1047.0]
  - - [256, 256, 8, 512, 256, 256, 256, 256]
    - [3, 1073.0]
  - - [256, 256, 8, 1024, 256, 256, 256, 256]
    - [47, 1087.0]
  - - [256, 256, 8, 2048, 256, 256, 256, 256]
    - [3, 1094.0]
  - - [256, 512, 8, 32, 256, 256, 256, 512]
    - [40, 887.0]
  - - [256, 512, 8, 64, 256, 256, 256, 512]
    - [55, 1041.0]
  - - [256, 512, 8, 128, 256, 256, 256, 512]
    - [40, 1139.0]
  - - [256, 512, 8, 256, 256, 256, 256, 512]
    - [52, 1193.0]
  - - [256, 512, 8, 512, 256, 256, 256, 512]
    - [40, 1222.0]
  - - [256, 512, 8, 1024, 256, 256, 256, 512]
    - [3, 1238.0]
  - - [256, 512, 8, 2048, 256, 256, 256, 512]
    - [52, 1244.0]
  - - [256, 1024, 8, 32, 256, 256, 256, 1024]
    - [60, 1111.0]
  - - [256, 1024, 8, 64, 256, 256, 256, 1024]
    - [57, 1300.0]
  - - [256, 1024, 8, 128, 256, 256, 256, 1024]
    - [19, 1434.0]
  - - [256, 1024, 8, 256, 256, 256, 256, 1024]
    - [19, 1502.0]
  - - [256, 1024, 8, 512, 256, 256, 256, 1024]
    - [52, 1546.0]
  - - [256, 1024, 8, 1024, 256, 256, 256, 1024]
    - [3, 1566.0]
  - - [256, 1024, 8, 2048, 256, 256, 256, 1024]
    - [30, 1577.0]
  - - [256, 2048, 8, 32, 256, 256, 256, 2048]
    - [60, 1313.0]
  - - [256, 2048, 8, 64, 256, 256, 256, 2048]
    - [48, 1505.0]
  - - [256, 2048, 8, 128, 256, 256, 256, 2048]
    - [47, 1614.0]
  - - [256, 2048, 8, 256, 256, 256, 256, 2048]
    - [45, 1670.0]
  - - [256, 2048, 8, 512, 256, 256, 256, 2048]
    - [37, 1704.0]
  - - [256, 2048, 8, 1024, 256, 256, 256, 2048]
    - [47, 1724.0]
  - - [256, 2048, 8, 2048, 256, 256, 256, 2048]
    - [40, 1733.0]
  - - [512, 32, 8, 32, 512, 512, 512, 32]
    - [46, 160.0]
  - - [512, 32, 8, 64, 512, 512, 512, 32]
    - [20, 231.0]
  - - [512, 32, 8, 128, 512, 512, 512, 32]
    - [31, 299.0]
  - - [512, 32, 8, 256, 512, 512, 512, 32]
    - [18, 352.0]
  - - [512, 32, 8, 512, 512, 512, 512, 32]
    - [2, 389.0]
  - - [512, 32, 8, 1024, 512, 512, 512, 32]
    - [2, 409.0]
  - - [512, 32, 8, 2048, 512, 512, 512, 32]
    - [2, 421.0]
  - - [512, 64, 8, 32, 512, 512, 512, 64]
    - [15, 314.0]
  - - [512, 64, 8, 64, 512, 512, 512, 64]
    - [34, 459.0]
  - - [512, 64, 8, 128, 512, 512, 512, 64]
    - [2, 599.0]
  - - [512, 64, 8, 256, 512, 512, 512, 64]
    - [2, 711.0]
  - - [512, 64, 8, 512, 512, 512, 512, 64]
    - [2, 779.0]
  - - [512, 64, 8, 1024, 512, 512, 512, 64]
    - [29, 821.0]
  - - [512, 64, 8, 2048, 512, 512, 512, 64]
    - [2, 843.0]
  - - [512, 128, 8, 32, 512, 512, 512, 128]
    - [27, 783.0]
  - - [512, 128, 8, 64, 512, 512, 512, 128]
    - [60, 914.0]
  - - [512, 128, 8, 128, 512, 512, 512, 128]
    - [30, 999.0]
  - - [512, 128, 8, 256, 512, 512, 512, 128]
    - [8, 1043.0]
  - - [512, 128, 8, 512, 512, 512, 512, 128]
    - [52, 1073.0]
  - - [512, 128, 8, 1024, 512, 512, 512, 128]
    - [3, 1087.0]
  - - [512, 128, 8, 2048, 512, 512, 512, 128]
    - [43, 1094.0]
  - - [512, 256, 8, 32, 512, 512, 512, 256]
    - [48, 885.0]
  - - [512, 256, 8, 64, 512, 512, 512, 256]
    - [60, 1037.0]
  - - [512, 256, 8, 128, 512, 512, 512, 256]
    - [40, 1136.0]
  - - [512, 256, 8, 256, 512, 512, 512, 256]
    - [60, 1189.0]
  - - [512, 256, 8, 512, 512, 512, 512, 256]
    - [60, 1221.0]
  - - [512, 256, 8, 1024, 512, 512, 512, 256]
    - [40, 1238.0]
  - - [512, 256, 8, 2048, 512, 512, 512, 256]
    - [40, 1245.0]
  - - [512, 512, 8, 32, 512, 512, 512, 512]
    - [47, 1148.0]
  - - [512, 512, 8, 64, 512, 512, 512, 512]
    - [40, 1320.0]
  - - [512, 512, 8, 128, 512, 512, 512, 512]
    - [48, 1435.0]
  - - [512, 512, 8, 256, 512, 512, 512, 512]
    - [3, 1507.0]
  - - [512, 512, 8, 512, 512, 512, 512, 512]
    - [40, 1551.0]
  - - [512, 512, 8, 1024, 512, 512, 512, 512]
    - [64, 1569.0]
  - - [512, 512, 8, 2048, 512, 512, 512, 512]
    - [40, 1577.0]
  - - [512, 1024, 8, 32, 512, 512, 512, 1024]
    - [52, 1348.0]
  - - [512, 1024, 8, 64, 512, 512, 512, 1024]
    - [40, 1532.0]
  - - [512, 1024, 8, 128, 512, 512, 512, 1024]
    - [52, 1617.0]
  - - [512, 1024, 8, 256, 512, 512, 512, 1024]
    - [52, 1680.0]
  - - [512, 1024, 8, 512, 512, 512, 512, 1024]
    - [52, 1706.0]
  - - [512, 1024, 8, 1024, 512, 512, 512, 1024]
    - [55, 1724.0]
  - - [512, 1024, 8, 2048, 512, 512, 512, 1024]
    - [12, 1731.0]
  - - [512, 2048, 8, 32, 512, 512, 512, 2048]
    - [52, 1476.0]
  - - [512, 2048, 8, 64, 512, 512, 512, 2048]
    - [40, 1677.0]
  - - [512, 2048, 8, 128, 512, 512, 512, 2048]
    - [40, 1794.0]
  - - [512, 2048, 8, 256, 512, 512, 512, 2048]
    - [3, 1859.0]
  - - [512, 2048, 8, 512, 512, 512, 512, 2048]
    - [40, 1894.0]
  - - [512, 2048, 8, 1024, 512, 512, 512, 2048]
    - [3, 1913.0]
  - - [512, 2048, 8, 2048, 512, 512, 512, 2048]
    - [3, 1920.0]
  - - [1024, 32, 8, 32, 1024, 1024, 1024, 32]
    - [12, 399.0]
  - - [1024, 32, 8, 64, 1024, 1024, 1024, 32]
    - [3, 461.0]
  - - [1024, 32, 8, 128, 1024, 1024, 1024, 32]
    - [20, 592.0]
  - - [1024, 32, 8, 256, 1024, 1024, 1024, 32]
    - [4, 694.0]
  - - [1024, 32, 8, 512, 1024, 1024, 1024, 32]
    - [31, 762.0]
  - - [1024, 32, 8, 1024, 1024, 1024, 1024, 32]
    - [4, 799.0]
  - - [1024, 32, 8, 2048, 1024, 1024, 1024, 32]
    - [4, 820.0]
  - - [1024, 64, 8, 32, 1024, 1024, 1024, 64]
    - [40, 777.0]
  - - [1024, 64, 8, 64, 1024, 1024, 1024, 64]
    - [40, 908.0]
  - - [1024, 64, 8, 128, 1024, 1024, 1024, 64]
    - [52, 994.0]
  - - [1024, 64, 8, 256, 1024, 1024, 1024, 64]
    - [30, 1041.0]
  - - [1024, 64, 8, 512, 1024, 1024, 1024, 64]
    - [3, 1070.0]
  - - [1024, 64, 8, 1024, 1024, 1024, 1024, 64]
    - [3, 1084.0]
  - - [1024, 64, 8, 2048, 1024, 1024, 1024, 64]
    - [3, 1091.0]
  - - [1024, 128, 8, 32, 1024, 1024, 1024, 128]
    - [48, 868.0]
  - - [1024, 128, 8, 64, 1024, 1024, 1024, 128]
    - [60, 1019.0]
  - - [1024, 128, 8, 128, 1024, 1024, 1024, 128]
    - [57, 1144.0]
  - - [1024, 128, 8, 256, 1024, 1024, 1024, 128]
    - [40, 1184.0]
  - - [1024, 128, 8, 512, 1024, 1024, 1024, 128]
    - [40, 1218.0]
  - - [1024, 128, 8, 1024, 1024, 1024, 1024, 128]
    - [52, 1235.0]
  - - [1024, 128, 8, 2048, 1024, 1024, 1024, 128]
    - [40, 1243.0]
  - - [1024, 256, 8, 32, 1024, 1024, 1024, 256]
    - [30, 1097.0]
  - - [1024, 256, 8, 64, 1024, 1024, 1024, 256]
    - [40, 1302.0]
  - - [1024, 256, 8, 128, 1024, 1024, 1024, 256]
    - [40, 1434.0]
  - - [1024, 256, 8, 256, 1024, 1024, 1024, 256]
    - [30, 1503.0]
  - - [1024, 256, 8, 512, 1024, 1024, 1024, 256]
    - [40, 1544.0]
  - - [1024, 256, 8, 1024, 1024, 1024, 1024, 256]
    - [60, 1564.0]
  - - [1024, 256, 8, 2048, 1024, 1024, 1024, 256]
    - [19, 1573.0]
  - - [1024, 512, 8, 32, 1024, 1024, 1024, 512]
    - [40, 1333.0]
  - - [1024, 512, 8, 64, 1024, 1024, 1024, 512]
    - [60, 1522.0]
  - - [1024, 512, 8, 128, 1024, 1024, 1024, 512]
    - [40, 1621.0]
  - - [1024, 512, 8, 256, 1024, 1024, 1024, 512]
    - [40, 1675.0]
  - - [1024, 512, 8, 512, 1024, 1024, 1024, 512]
    - [19, 1707.0]
  - - [1024, 512, 8, 1024, 1024, 1024, 1024, 512]
    - [30, 1720.0]
  - - [1024, 512, 8, 2048, 1024, 1024, 1024, 512]
    - [60, 1731.0]
  - - [1024, 1024, 8, 32, 1024, 1024, 1024, 1024]
    - [52, 1497.0]
  - - [1024, 1024, 8, 64, 1024, 1024, 1024, 1024]
    - [52, 1679.0]
  - - [1024, 1024, 8, 128, 1024, 1024, 1024, 1024]
    - [52, 1791.0]
  - - [1024, 1024, 8, 256, 1024, 1024, 1024, 1024]
    - [52, 1858.0]
  - - [1024, 1024, 8, 512, 1024, 1024, 1024, 1024]
    - [3, 1895.0]
  - - [1024, 1024, 8, 1024, 1024, 1024, 1024, 1024]
    - [40, 1910.0]
  - - [1024, 1024, 8, 2048, 1024, 1024, 1024, 1024]
    - [3, 1917.0]
  - - [1024, 2048, 8, 32, 1024, 1024, 1024, 2048]
    - [40, 1597.0]
  - - [1024, 2048, 8, 64, 1024, 1024, 1024, 2048]
    - [3, 1756.0]
  - - [1024, 2048, 8, 128, 1024, 1024, 1024, 2048]
    - [3, 1846.0]
  - - [1024, 2048, 8, 256, 1024, 1024, 1024, 2048]
    - [43, 1895.0]
  - - [1024, 2048, 8, 512, 1024, 1024, 1024, 2048]
    - [8, 1921.0]
  - - [1024, 2048, 8, 1024, 1024, 1024, 1024, 2048]
    - [12, 1934.0]
  - - [1024, 2048, 8, 2048, 1024, 1024, 1024, 2048]
    - [19, 1940.0]
  - - [2048, 32, 8, 32, 2048, 2048, 2048, 32]
    - [49, 591.0]
  - - [2048, 32, 8, 64, 2048, 2048, 2048, 32]
    - [53, 700.0]
  - - [2048, 32, 8, 128, 2048, 2048, 2048, 32]
    - [41, 758.0]
  - - [2048, 32, 8, 256, 2048, 2048, 2048, 32]
    - [61, 795.0]
  - - [2048, 32, 8, 512, 2048, 2048, 2048, 32]
    - [53, 816.0]
  - - [2048, 32, 8, 1024, 2048, 2048, 2048, 32]
    - [61, 826.0]
  - - [2048, 32, 8, 2048, 2048, 2048, 2048, 32]
    - [41, 830.0]
  - - [2048, 64, 8, 32, 2048, 2048, 2048, 64]
    - [60, 870.0]
  - - [2048, 64, 8, 64, 2048, 2048, 2048, 64]
    - [63, 1042.0]
  - - [2048, 64, 8, 128, 2048, 2048, 2048, 64]
    - [40, 1122.0]
  - - [2048, 64, 8, 256, 2048, 2048, 2048, 64]
    - [60, 1185.0]
  - - [2048, 64, 8, 512, 2048, 2048, 2048, 64]
    - [52, 1215.0]
  - - [2048, 64, 8, 1024, 2048, 2048, 2048, 64]
    - [52, 1232.0]
  - - [2048, 64, 8, 2048, 2048, 2048, 2048, 64]
    - [40, 1239.0]
  - - [2048, 128, 8, 32, 2048, 2048, 2048, 128]
    - [65, 1082.0]
  - - [2048, 128, 8, 64, 2048, 2048, 2048, 128]
    - [16, 1286.0]
  - - [2048, 128, 8, 128, 2048, 2048, 2048, 128]
    - [48, 1345.0]
  - - [2048, 128, 8, 256, 2048, 2048, 2048, 128]
    - [40, 1496.0]
  - - [2048, 128, 8, 512, 2048, 2048, 2048, 128]
    - [40, 1538.0]
  - - [2048, 128, 8, 1024, 2048, 2048, 2048, 128]
    - [40, 1561.0]
  - - [2048, 128, 8, 2048, 2048, 2048, 2048, 128]
    - [30, 1569.0]
  - - [2048, 256, 8, 32, 2048, 2048, 2048, 256]
    - [52, 1285.0]
  - - [2048, 256, 8, 64, 2048, 2048, 2048, 256]
    - [45, 1481.0]
  - - [2048, 256, 8, 128, 2048, 2048, 2048, 256]
    - [30, 1593.0]
  - - [2048, 256, 8, 256, 2048, 2048, 2048, 256]
    - [19, 1663.0]
  - - [2048, 256, 8, 512, 2048, 2048, 2048, 256]
    - [40, 1699.0]
  - - [2048, 256, 8, 1024, 2048, 2048, 2048, 256]
    - [57, 1719.0]
  - - [2048, 256, 8, 2048, 2048, 2048, 2048, 256]
    - [30, 1727.0]
  - - [2048, 512, 8, 32, 2048, 2048, 2048, 512]
    - [64, 1451.0]
  - - [2048, 512, 8, 64, 2048, 2048, 2048, 512]
    - [60, 1661.0]
  - - [2048, 512, 8, 128, 2048, 2048, 2048, 512]
    - [40, 1782.0]
  - - [2048, 512, 8, 256, 2048, 2048, 2048, 512]
    - [3, 1850.0]
  - - [2048, 512, 8, 512, 2048, 2048, 2048, 512]
    - [60, 1886.0]
  - - [2048, 512, 8, 1024, 2048, 2048, 2048, 512]
    - [40, 1904.0]
  - - [2048, 512, 8, 2048, 2048, 2048, 2048, 512]
    - [40, 1915.0]
  - - [2048, 1024, 8, 32, 2048, 2048, 2048, 1024]
    - [3, 1567.0]
  - - [2048, 1024, 8, 64, 2048, 2048, 2048, 1024]
    - [14, 1743.0]
  - - [2048, 1024, 8, 128, 2048, 2048, 2048, 1024]
    - [16, 1842.0]
  - - [2048, 1024, 8, 256, 2048, 2048, 2048, 1024]
    - [19, 1885.0]
  - - [2048, 1024, 8, 512, 2048, 2048, 2048, 1024]
    - [3, 1918.0]
  - - [2048, 1024, 8, 1024, 2048, 2048, 2048, 1024]
    - [16, 1932.0]
  - - [2048, 1024, 8, 2048, 2048, 2048, 2048, 1024]
    - [52, 1941.0]
  - - [2048, 2048, 8, 32, 2048, 2048, 2048, 2048]
    - [48, 1629.0]
  - - [2048, 2048, 8, 64, 2048, 2048, 2048, 2048]
    - [40, 1799.0]
  - - [2048, 2048, 8, 128, 2048, 2048, 2048, 2048]
    - [43, 1879.0]
  - - [2048, 2048, 8, 256, 2048, 2048, 2048, 2048]
    - [40, 1927.0]
  - - [2048, 2048, 8, 512, 2048, 2048, 2048, 2048]
    - [37, 1954.0]
  - - [2048, 2048, 8, 1024, 2048, 2048, 2048, 2048]
    - [47, 1963.0]
  - - [2048, 2048, 8, 2048, 2048, 2048, 2048, 2048]
    - [48, 1969.0]
- null
