library/src/blas3/Tensile/Logic/aldebaran/arcturus_Cijk_Ailk_Bljk_BBH.yaml
- {MinimumRequiredVersion: 4.14.0}
- arcturus
- gfx908
- [Device 7380, Device 7388, Device 738c, Device 7390]
    SolutionIndex: 0
    SolutionIndex: 1
    SolutionIndex: 2
    SolutionIndex: 3
    SolutionIndex: 4
    SolutionIndex: 5
    SolutionIndex: 6
    SolutionIndex: 7
    SolutionIndex: 8
    SolutionIndex: 9
    SolutionIndex: 10
    SolutionIndex: 11
    SolutionIndex: 12
    SolutionIndex: 13
    SolutionIndex: 14
    SolutionIndex: 15
    SolutionIndex: 16
    SolutionIndex: 17
    SolutionIndex: 18
    SolutionIndex: 19
    SolutionNameMin: Cijk_Ailk_Bljk_BBH_MT128x160x32_MI32x32x4x1_SE_AF0EM4_GRVW4_LBSPP128_LPB4_NLCA1_SU0_SUS256_SRVW0_TT1_160_WG128_2_1_WGM2
    SolutionIndex: 20
    SolutionNameMin: Cijk_Ailk_Bljk_BBH_MT32x32x128_MI16x16x8x1_SE_AF0EM1_GRVW8_LBSPP256_LPB8_NLCA1_SU32_SUS256_SRVW0_TT1_16_WG32_8_1_WGM1
    SolutionIndex: 21
    SolutionNameMin: Cijk_Ailk_Bljk_BBH_MT64x80x32_MI16x16x8x1_SE_AF0EM4_GRVW2_LBSPP128_LPB2_NLCA1_SU32_SUS256_SRVW0_TT1_80_WG64_4_1_WGM2
    SolutionIndex: 22
    SolutionNameMin: Cijk_Ailk_Bljk_BBH_MT64x32x32_MI16x16x8x1_SE_AF0EM4_GRVW2_LBSPP128_LPB2_NLCA1_SU0_SUS256_SRVW0_TT2_16_WG32_8_1_WGM1
    SolutionIndex: 23
    SolutionNameMin: Cijk_Ailk_Bljk_BBH_MT128x96x32_MI32x32x4x1_SE_AF0EM4_GRVW4_LBSPP128_LPB4_NLCA1_SU16_SUS128_SRVW4_TT1_96_WG128_2_1_WGM2
    SolutionIndex: 24
    SolutionNameMin: Cijk_Ailk_Bljk_BBH_MT128x96x32_MI32x32x4x1_SE_AF0EM4_GRVW4_LBSPP128_LPB4_NLCA1_SU0_SUS256_SRVW4_TT1_96_WG128_2_1_WGM2
    SolutionIndex: 25
    SolutionNameMin: Cijk_Ailk_Bljk_BBH_MT64x128x32_MI32x32x4x1_SE_AF0EM4_GRVW8_LBSPP128_LPB8_NLCA1_SU32_SUS128_SRVW4_TT1_64_WG64_4_1_WGM1
    SolutionIndex: 26
    SolutionNameMin: Cijk_Ailk_Bljk_BBH_MT128x80x64_MI16x16x8x1_SE_AF0EM4_GRVW2_LBSPP128_LPB2_NLCA1_SU32_SUS256_SRVW0_TT2_80_WG64_4_1_WGM2
    SolutionIndex: 27
    SolutionNameMin: Cijk_Ailk_Bljk_BBH_MT128x160x32_MI32x32x4x1_SE_AF0EM4_GRVW4_LBSPP128_LPB4_NLCA1_SU0_SUS256_SRVW0_TT1_160_WG128_2_1_WGM15
    SolutionIndex: 28
    SolutionNameMin: Cijk_Ailk_Bljk_BBH_MT32x32x32_MI16x16x8x1_SE_AF0EM4_GRVW2_LBSPP128_LPB2_NLCA1_SU0_SUS256_SRVW0_TT1_16_WG32_8_1_WGM15
    SolutionIndex: 29
    SolutionNameMin: Cijk_Ailk_Bljk_BBH_MT128x96x32_MI32x32x4x1_SE_AF0EM4_GRVW4_LBSPP128_LPB4_NLCA1_SU0_SUS256_SRVW4_TT1_96_WG128_2_1_WGM15
    SolutionIndex: 30
    SolutionNameMin: Cijk_Ailk_Bljk_BBH_MT32x32x32_MI16x16x8x1_SE_AF0EM4_GRVW4_LBSPP128_LPB4_NLCA1_SU0_SUS256_SRVW0_TT1_16_WG32_8_1_WGM2
    SolutionIndex: 31
    SolutionNameMin: Cijk_Ailk_Bljk_BBH_MT128x96x32_MI32x32x4x1_SE_AF0EM4_GRVW4_LBSPP128_LPB4_NLCA1_SU16_SUS256_SRVW4_TT1_96_WG128_2_1_WGM2
    SolutionIndex: 32
    SolutionNameMin: Cijk_Ailk_Bljk_BBH_MT128x160x32_MI32x32x4x1_SE_AF0EM4_GRVW4_LBSPP128_LPB4_NLCA1_SU0_SUS256_SRVW0_TT1_160_WG128_2_1_WGM1
    SolutionIndex: 33
    SolutionNameMin: Cijk_Ailk_Bljk_BBH_MT32x32x128_MI16x16x8x1_SE_AF0EM4_GRVW8_LBSPP256_LPB8_NLCA1_SU16_SUS256_SRVW0_TT1_16_WG32_8_1_WGM2
    SolutionIndex: 34
    SolutionNameMin: Cijk_Ailk_Bljk_BBH_MT128x96x32_MI32x32x4x1_SE_AF0EM4_GRVW4_LBSPP128_LPB4_NLCA1_SU32_SUS128_SRVW4_TT1_96_WG128_2_1_WGM2
    SolutionIndex: 35
    SolutionNameMin: Cijk_Ailk_Bljk_BBH_MT32x32x32_MI16x16x8x1_SE_AF0EM4_GRVW4_LBSPP128_LPB4_NLCA1_SU0_SUS256_SRVW0_TT1_16_WG32_8_1_WGM1
    SolutionIndex: 36
    SolutionNameMin: Cijk_Ailk_Bljk_BBH_MT64x80x32_MI16x16x8x1_SE_AF0EM4_GRVW2_LBSPP128_LPB2_NLCA1_SU16_SUS128_SRVW0_TT1_80_WG64_4_1_WGM15
    SolutionIndex: 37
    SolutionNameMin: Cijk_Ailk_Bljk_BBH_MT32x32x32_MI16x16x8x1_SE_AF0EM4_GRVW2_LBSPP128_LPB2_NLCA1_SU0_SUS256_SRVW0_TT1_16_WG32_8_1_WGM1
    SolutionIndex: 38
    SolutionNameMin: Cijk_Ailk_Bljk_BBH_MT32x64x32_MI16x16x8x1_SE_AF0EM4_GRVW2_LBSPP128_LPB2_NLCA1_SU0_SUS256_SRVW0_TT1_32_WG32_8_1_WGM1
    SolutionIndex: 39
    SolutionNameMin: Cijk_Ailk_Bljk_BBH_MT64x80x64_MI16x16x8x1_SE_AF0EM4_GRVW2_LBSPP128_LPB2_NLCA1_SU0_SUS256_SRVW0_TT1_80_WG64_4_1_WGM15
    SolutionIndex: 40
    SolutionNameMin: Cijk_Ailk_Bljk_BBH_MT128x288x32_MI32x32x4x1_SE_AF0EM4_GRVW2_LBSPP128_LPB2_NLCA1_SU0_SUS256_SRVW0_TT1_288_WG128_2_1_WGM2
    SolutionIndex: 41
    SolutionNameMin: Cijk_Ailk_Bljk_BBH_MT128x80x64_MI16x16x8x1_SE_AF0EM4_GRVW2_LBSPP128_LPB2_NLCA1_SU32_SUS256_SRVW0_TT2_80_WG64_4_1_WGM15
    SolutionIndex: 42
    SolutionNameMin: Cijk_Ailk_Bljk_BBH_MT64x64x32_MI32x32x4x1_SE_AF0EM4_GRVW8_LBSPP128_LPB8_NLCA1_SU32_SUS128_SRVW0_TT1_32_WG64_4_1_WGM1
    SolutionIndex: 43
    SolutionNameMin: Cijk_Ailk_Bljk_BBH_MT64x32x32_MI16x16x8x1_SE_AF0EM4_GRVW2_LBSPP128_LPB2_NLCA1_SU0_SUS256_SRVW0_TT2_16_WG32_8_1_WGM2
    SolutionIndex: 44
    SolutionNameMin: Cijk_Ailk_Bljk_BBH_MT128x96x32_MI32x32x4x1_SE_AF0EM4_GRVW4_LBSPP128_LPB4_NLCA1_SU16_SUS128_SRVW4_TT1_96_WG128_2_1_WGM1
    SolutionIndex: 45
    SolutionNameMin: Cijk_Ailk_Bljk_BBH_MT128x80x64_MI16x16x8x1_SE_AF0EM4_GRVW2_LBSPP128_LPB2_NLCA1_SU0_SUS256_SRVW0_TT2_80_WG64_4_1_WGM1
    SolutionIndex: 46
    SolutionNameMin: Cijk_Ailk_Bljk_BBH_MT128x96x32_MI32x32x4x1_SE_AF0EM4_GRVW2_LBSPP128_LPB2_NLCA1_SU16_SUS256_SRVW4_TT1_96_WG128_2_1_WGM2
    SolutionIndex: 47
    SolutionNameMin: Cijk_Ailk_Bljk_BBH_MT64x64x32_MI32x32x4x1_SE_AF0EM4_GRVW2_LBSPP128_LPB2_NLCA1_SU0_SUS256_SRVW0_TT1_32_WG64_4_1_WGM15
    SolutionIndex: 48
    SolutionNameMin: Cijk_Ailk_Bljk_BBH_MT64x80x64_MI16x16x8x1_SE_AF0EM4_GRVW4_LBSPP128_LPB4_NLCA1_SU32_SUS256_SRVW0_TT1_80_WG64_4_1_WGM15
    SolutionIndex: 49
    SolutionNameMin: Cijk_Ailk_Bljk_BBH_MT128x80x64_MI16x16x8x1_SE_AF0EM4_GRVW2_LBSPP128_LPB2_NLCA1_SU0_SUS256_SRVW0_TT2_80_WG64_4_1_WGM2
    SolutionIndex: 50
    SolutionNameMin: Cijk_Ailk_Bljk_BBH_MT128x96x32_MI32x32x4x1_SE_AF0EM4_GRVW4_LBSPP128_LPB4_NLCA1_SU0_SUS256_SRVW4_TT1_96_WG128_2_1_WGM1
    SolutionIndex: 51
    SolutionNameMin: Cijk_Ailk_Bljk_BBH_MT32x32x32_MI16x16x8x1_SE_AF0EM4_GRVW4_LBSPP128_LPB4_NLCA1_SU32_SUS128_SRVW0_TT1_16_WG32_8_1_WGM2
    SolutionIndex: 52
    SolutionNameMin: Cijk_Ailk_Bljk_BBH_MT128x160x32_MI32x32x4x1_SE_AF0EM4_GRVW4_LBSPP128_LPB4_NLCA1_SU32_SUS128_SRVW0_TT1_160_WG128_2_1_WGM1
    SolutionIndex: 53
    SolutionNameMin: Cijk_Ailk_Bljk_BBH_MT128x160x32_MI32x32x4x1_SE_AF0EM4_GRVW4_LBSPP128_LPB4_NLCA1_SU32_SUS256_SRVW0_TT1_160_WG128_2_1_WGM1
    SolutionIndex: 54
    SolutionNameMin: Cijk_Ailk_Bljk_BBH_MT64x128x64_MI32x32x4x1_SE_AF0EM4_GRVW4_LBSPP128_LPB4_NLCA1_SU0_SUS256_SRVW0_TT1_64_WG64_4_1_WGM1
    SolutionIndex: 55
    SolutionNameMin: Cijk_Ailk_Bljk_BBH_MT32x32x64_MI16x16x8x1_SE_AF0EM4_GRVW8_LBSPP128_LPB8_NLCA1_SU16_SUS256_SRVW0_TT1_16_WG32_8_1_WGM2
    SolutionIndex: 56
    SolutionNameMin: Cijk_Ailk_Bljk_BBH_MT64x128x32_MI32x32x4x1_SE_AF0EM1_GRVW8_LBSPP128_LPB8_NLCA1_SU16_SUS128_SRVW4_TT1_64_WG64_4_1_WGM15
    SolutionIndex: 57
    SolutionNameMin: Cijk_Ailk_Bljk_BBH_MT64x80x64_MI16x16x8x1_SE_AF0EM4_GRVW2_LBSPP128_LPB2_NLCA1_SU16_SUS256_SRVW0_TT1_80_WG64_4_1_WGM15
    SolutionIndex: 58
    SolutionNameMin: Cijk_Ailk_Bljk_BBH_MT32x32x128_MI16x16x8x1_SE_AF0EM4_GRVW8_LBSPP256_LPB8_NLCA1_SU0_SUS256_SRVW0_TT1_16_WG32_8_1_WGM1
    SolutionIndex: 59
    SolutionNameMin: Cijk_Ailk_Bljk_BBH_MT64x32x32_MI16x16x8x1_SE_AF0EM1_ASBE01_GRVW2_LPB2_PBD0_SRVW4_TT1_32_WG64_4_1_WGM1
    SolutionIndex: 60
    SolutionNameMin: Cijk_Ailk_Bljk_BBH_MT128x64x32_MI32x32x4x1_SE_AF0EM4_ASBE01_GRVW4_LPB4_PBD0_SRVW4_TT2_32_WG64_4_1_WGM1
    SolutionIndex: 61
    SolutionNameMin: Cijk_Ailk_Bljk_BBH_MT64x64x32_MI32x32x4x1_SE_AF0EM1_ASBE01_GRVW2_LPB2_PBD0_SRVW4_TT1_32_WG64_4_1_WGM1
    SolutionIndex: 62
    SolutionNameMin: Cijk_Ailk_Bljk_BBH_MT64x128x32_MI32x32x4x1_SE_AF0EM8_ASBE01_GRVW8_LPB8_PBD0_SRVW4_TT2_32_WG32_8_1_WGM1
    SolutionIndex: 63
    SolutionNameMin: Cijk_Ailk_Bljk_BBH_MT128x64x32_MI32x32x4x1_SE_AF0EM8_ASBE01_GRVW8_LPB8_PBD0_SRVW4_TT2_32_WG64_4_1_WGM4
    SolutionIndex: 64
    SolutionNameMin: Cijk_Ailk_Bljk_BBH_MT128x64x32_MI32x32x4x1_SE_AF0EM8_ASBE01_GRVW4_LPB4_PBD0_SRVW4_TT2_32_WG64_4_1_WGM1
    SolutionIndex: 65
    SolutionNameMin: Cijk_Ailk_Bljk_BBH_MT128x64x32_MI32x32x2x2_SE_AF0EM8_ASBE01_GRVW8_LPB8_PBD0_SRVW4_TT1_32_WG128_2_1_WGM1
    SolutionIndex: 66
    SolutionNameMin: Cijk_Ailk_Bljk_BBH_MT128x64x32_MI32x32x2x2_SE_AF0EM4_ASBE01_GRVW4_LPB4_PBD0_SRVW4_TT1_32_WG128_2_1_WGM4
    SolutionIndex: 67
    SolutionNameMin: Cijk_Ailk_Bljk_BBH_MT128x64x32_MI32x32x2x2_SE_AF0EM4_ASBE01_GRVW4_LPB4_PBD0_SRVW4_TT1_32_WG128_2_1_WGM10
    SolutionIndex: 68
    SolutionNameMin: Cijk_Ailk_Bljk_BBH_MT64x128x32_MI16x16x2x4_SE_AF0EM4_ASBE01_GRVW2_LPB2_PBD0_SRVW4_TT1_32_WG64_4_1_WGM4
    SolutionIndex: 69
    SolutionNameMin: Cijk_Ailk_Bljk_BBH_MT64x64x32_MI32x32x4x1_SE_AF0EM4_ASBE01_GRVW2_LPB2_PBD0_SRVW4_TT1_32_WG64_4_1_WGM10
    SolutionIndex: 70
    SolutionNameMin: Cijk_Ailk_Bljk_BBH_MT64x128x32_MI32x32x4x1_SE_AF0EM1_ASBE01_GRVW2_LPB2_PBD0_SRVW4_TT2_32_WG32_8_1_WGM10
    SolutionIndex: 71
    SolutionNameMin: Cijk_Ailk_Bljk_BBH_MT64x32x64_MI16x16x8x1_SE_AF0EM1_ASBE01_GRVW2_LPB2_PBD0_SRVW4_TT1_32_WG128_2_1_WGM10
    SolutionIndex: 72
    SolutionNameMin: Cijk_Ailk_Bljk_BBH_MT128x64x32_MI32x32x4x1_SE_AF0EM4_ASBE01_GRVW4_LPB4_PBD0_SRVW4_TT2_32_WG64_4_1_WGM4
    SolutionIndex: 73
    SolutionNameMin: Cijk_Ailk_Bljk_BBH_MT64x32x32_MI16x16x8x1_SE_AF0EM1_ASBE01_GRVW4_LPB4_PBD0_SRVW4_TT1_32_WG128_2_1_WGM1
    SolutionIndex: 74
    SolutionNameMin: Cijk_Ailk_Bljk_BBH_MT64x32x32_MI16x16x8x1_SE_AF0EM4_ASBE01_GRVW2_LPB2_PBD0_SRVW0_TT1_32_WG128_2_1_WGM1
    SolutionIndex: 75
    SolutionNameMin: Cijk_Ailk_Bljk_BBH_MT128x256x32_MI32x32x4x1_SE_GRVW8_GSU1_LPB8_PLR9_SU0_SUS256_SRVW4_WGM15
    SolutionIndex: 76
    SolutionNameMin: Cijk_Ailk_Bljk_BBH_MT128x256x32_MI32x32x4x1_SE_GRVW8_GSU1_LPB8_PLR9_SU0_SUS256_SRVW4_WGM2
    SolutionIndex: 77
    SolutionNameMin: Cijk_Ailk_Bljk_BBH_MT128x256x32_MI32x32x4x1_SE_GRVW8_GSU1_LPB8_PLR9_SU32_SUS128_SRVW4_WGM15
    SolutionIndex: 78
    SolutionNameMin: Cijk_Ailk_Bljk_BBH_MT128x96x32_MI32x32x4x1_SE_GRVW4_GSU1_LPB4_PLR9_SU32_SUS128_SRVW4_WGM15
    SolutionIndex: 79
    SolutionNameMin: Cijk_Ailk_Bljk_BBH_MT128x144x32_MI16x16x8x1_SE_GRVW2_GSU1_LPB4_PLR5_SU0_SUS256_SRVW4_WGM15
    SolutionIndex: 80
    SolutionNameMin: Cijk_Ailk_Bljk_BBH_MT128x96x32_MI32x32x4x1_SE_GRVW4_GSU1_LPB4_PLR9_SU0_SUS256_SRVW4_WGM15
    SolutionIndex: 81
    SolutionNameMin: Cijk_Ailk_Bljk_BBH_MT128x96x32_MI32x32x4x1_SE_GRVW4_GSU1_LPB4_PLR9_SU0_SUS256_SRVW4_WGM2
    SolutionIndex: 82
    SolutionNameMin: Cijk_Ailk_Bljk_BBH_MT96x96x64_MI16x16x8x1_SE_GRVW8_GSU1_LPB8_PLR9_SU0_SUS256_SRVW0_WGM1
    SolutionIndex: 83
    SolutionNameMin: Cijk_Ailk_Bljk_BBH_MT128x96x32_MI32x32x4x1_SE_GRVW4_GSU1_LPB4_PLR9_SU32_SUS128_SRVW4_WGM2
    SolutionIndex: 84
    SolutionNameMin: Cijk_Ailk_Bljk_BBH_MT128x96x32_MI32x32x4x1_SE_GRVW4_GSU1_LPB4_PLR9_SU32_SUS256_SRVW4_WGM15
    SolutionIndex: 85
    SolutionNameMin: Cijk_Ailk_Bljk_BBH_MT128x96x32_MI32x32x4x1_SE_GRVW4_GSU1_LPB4_PLR9_SU0_SUS256_SRVW4_WGM1
    SolutionIndex: 86
    SolutionNameMin: Cijk_Ailk_Bljk_BBH_MT128x144x32_MI16x16x8x1_SE_GRVW2_GSU1_LPB4_PLR5_SU0_SUS256_SRVW4_WGM2
    SolutionIndex: 87
    SolutionNameMin: Cijk_Ailk_Bljk_BBH_MT128x160x32_MI32x32x4x1_SE_GRVW2_GSU1_LPB4_PLR9_SU32_SUS256_SRVW4_WGM15
    SolutionIndex: 88
    SolutionNameMin: Cijk_Ailk_Bljk_BBH_MT128x96x32_MI32x32x4x1_SE_GRVW2_GSU1_LPB4_PLR9_SU32_SUS256_SRVW4_WGM2
    SolutionIndex: 89
    SolutionNameMin: Cijk_Ailk_Bljk_BBH_MT128x144x32_MI16x16x8x1_SE_GRVW2_GSU1_LPB4_PLR5_SU32_SUS256_SRVW4_WGM15
    SolutionIndex: 90
    SolutionNameMin: Cijk_Ailk_Bljk_BBH_MT128x96x32_MI32x32x4x1_SE_GRVW2_GSU1_LPB4_PLR9_SU0_SUS256_SRVW4_WGM15
    SolutionIndex: 91
    SolutionNameMin: Cijk_Ailk_Bljk_BBH_MT64x128x64_MI32x32x4x1_SE_GRVW8_GSU1_LPB8_PLR17_SU0_SUS256_SRVW4_WGM2
    SolutionIndex: 92
    SolutionNameMin: Cijk_Ailk_Bljk_BBH_MT128x160x32_MI32x32x4x1_SE_GRVW2_GSU1_LPB4_PLR9_SU32_SUS128_SRVW4_WGM15
    SolutionIndex: 93
    SolutionNameMin: Cijk_Ailk_Bljk_BBH_MT128x144x32_MI16x16x8x1_SE_GRVW2_GSU1_LPB4_PLR5_SU32_SUS128_SRVW4_WGM15
    SolutionIndex: 94
    SolutionNameMin: Cijk_Ailk_Bljk_BBH_MT128x144x32_MI16x16x8x1_SE_GRVW2_GSU1_LPB4_PLR5_SU0_SUS256_SRVW4_WGM1
    SolutionIndex: 95
    SolutionNameMin: Cijk_Ailk_Bljk_BBH_MT128x256x32_MI32x32x4x1_SE_GRVW8_GSU1_LPB8_PLR9_SU32_SUS256_SRVW4_WGM2
    SolutionIndex: 96
    SolutionNameMin: Cijk_Ailk_Bljk_BBH_MT128x96x32_MI32x32x4x1_SE_GRVW4_GSU1_LPB4_PLR9_SU32_SUS256_SRVW4_WGM2
    SolutionIndex: 97
    SolutionNameMin: Cijk_Ailk_Bljk_BBH_MT128x160x32_MI32x32x4x1_SE_GRVW2_GSU1_LPB4_PLR9_SU32_SUS256_SRVW4_WGM2
    SolutionIndex: 98
    SolutionNameMin: Cijk_Ailk_Bljk_BBH_MT144x128x32_MI16x16x8x1_SE_GRVW2_GSU1_LPB4_PLR5_SU0_SUS256_SRVW0_WGM15
    SolutionIndex: 99
    SolutionNameMin: Cijk_Ailk_Bljk_BBH_MT96x96x64_MI16x16x8x1_SE_GRVW8_GSU1_LPB8_PLR9_SU0_SUS256_SRVW0_WGM15
    SolutionIndex: 100
    SolutionNameMin: Cijk_Ailk_Bljk_BBH_MT128x64x32_MI32x32x4x1_SE_GRVW8_GSU1_LPB8_PLR9_SU0_SUS256_SRVW4_WGM15
    SolutionIndex: 101
    SolutionNameMin: Cijk_Ailk_Bljk_BBH_MT128x64x64_MI32x32x4x1_SE_GRVW8_GSU1_LPB8_PLR17_SU0_SUS256_SRVW4_WGM1
    SolutionIndex: 102
    SolutionNameMin: Cijk_Ailk_Bljk_BBH_MT128x160x32_MI32x32x4x1_SE_GRVW2_GSU1_LPB4_PLR9_SU32_SUS128_SRVW4_WGM2
    SolutionIndex: 103
    SolutionNameMin: Cijk_Ailk_Bljk_BBH_MT128x96x64_MI32x32x4x1_SE_GRVW2_GSU1_LPB4_PLR17_SU32_SUS256_SRVW4_WGM15
    SolutionIndex: 104
    SolutionNameMin: Cijk_Ailk_Bljk_BBH_MT128x96x64_MI32x32x4x1_SE_GRVW2_GSU1_LPB4_PLR17_SU0_SUS256_SRVW4_WGM2
    SolutionIndex: 105
    SolutionNameMin: Cijk_Ailk_Bljk_BBH_MT128x128x32_MI32x32x4x1_SE_GRVW8_GSU1_LPB8_PLR9_SU0_SUS256_SRVW4_WGM1
    SolutionIndex: 106
    SolutionNameMin: Cijk_Ailk_Bljk_BBH_MT128x96x32_MI32x32x4x1_SE_GRVW4_GSU1_LPB4_PLR9_SU0_SUS256_SRVW4_WGM15
    SolutionIndex: 107
    SolutionNameMin: Cijk_Ailk_Bljk_BBH_MT64x128x32_MI32x32x4x1_SE_1LDSB0_GRVW8_LPB8_NLCA1_PLR9_SU0_SUS256_SRVW4_TT1_64_WG64_4_1_WGM1
    SolutionIndex: 108
    SolutionNameMin: Cijk_Ailk_Bljk_BBH_MT128x96x32_MI32x32x4x1_SE_1LDSB0_GRVW4_LPB4_NLCA1_PLR9_SU0_SUS256_SRVW4_TT1_96_WG128_2_1_WGM15
    SolutionIndex: 109
    SolutionNameMin: Cijk_Ailk_Bljk_BBH_MT128x256x32_MI32x32x4x1_SE_GRVW2_LPB4_PLR9_SU0_SUS256_SRVW4_WGM1
    SolutionIndex: 110
    SolutionNameMin: Cijk_Ailk_Bljk_BBH_MT64x128x64_MI32x32x4x1_SE_GRVW8_LPB8_PLR17_SU0_SUS256_SRVW4_WGM1
    SolutionIndex: 111
    SolutionNameMin: Cijk_Ailk_Bljk_BBH_MT32x64x64_MI16x16x8x1_SE_GRVW8_LPB8_PLR9_SU32_SUS128_SRVW4_WGM1
    SolutionIndex: 112
    SolutionNameMin: Cijk_Ailk_Bljk_BBH_MT256x128x32_MI32x32x4x1_SE_GRVW8_LPB8_PLR9_SU0_SUS256_SRVW4_WGM15
    SolutionIndex: 113
    SolutionNameMin: Cijk_Ailk_Bljk_BBH_MT128x64x64_MI32x32x4x1_SE_GRVW8_LPB8_PLR17_SU0_SUS256_SRVW4_WGM2
    SolutionIndex: 114
    SolutionNameMin: Cijk_Ailk_Bljk_BBH_MT32x32x64_MI16x16x8x1_SE_GRVW8_LPB8_PLR9_SU0_SUS256_SRVW4_WGM15
    SolutionIndex: 115
    SolutionNameMin: Cijk_Ailk_Bljk_BBH_MT128x160x32_MI32x32x4x1_SE_GRVW2_LPB4_PLR9_SU0_SUS256_SRVW4_WGM15
    SolutionIndex: 116
    SolutionNameMin: Cijk_Ailk_Bljk_BBH_MT128x144x32_MI16x16x8x1_SE_GRVW2_LPB4_PLR5_SU0_SUS256_SRVW4_WGM15
    SolutionIndex: 117
    SolutionNameMin: Cijk_Ailk_Bljk_BBH_MT32x64x64_MI16x16x8x1_SE_GRVW4_LPB4_PLR9_SU32_SUS256_SRVW4_WGM2
    SolutionIndex: 118
    SolutionNameMin: Cijk_Ailk_Bljk_BBH_MT64x64x32_MI32x32x4x1_SE_GRVW8_LPB8_PLR9_SU32_SUS256_SRVW4_WGM2
    SolutionIndex: 119
    SolutionNameMin: Cijk_Ailk_Bljk_BBH_MT64x128x32_MI32x32x4x1_SE_GRVW2_LPB4_PLR9_SU32_SUS128_SRVW4_WGM1
    SolutionIndex: 120
    SolutionNameMin: Cijk_Ailk_Bljk_BBH_MT32x32x32_MI16x16x8x1_SE_GRVW2_LPB4_PLR5_SU0_SUS256_SRVW4_WGM1
    SolutionIndex: 121
    SolutionNameMin: Cijk_Ailk_Bljk_BBH_MT32x32x64_MI16x16x8x1_SE_GRVW8_LPB8_PLR9_SU0_SUS256_SRVW0_WGM2
    SolutionIndex: 122
    SolutionNameMin: Cijk_Ailk_Bljk_BBH_MT128x96x32_MI32x32x4x1_SE_GRVW4_LPB4_PLR9_SU0_SUS256_SRVW0_WGM1
    SolutionIndex: 123
    SolutionNameMin: Cijk_Ailk_Bljk_BBH_MT64x64x32_MI32x32x4x1_SE_GRVW2_LPB4_PLR9_SU0_SUS256_SRVW4_WGM2
    SolutionIndex: 124
    SolutionNameMin: Cijk_Ailk_Bljk_BBH_MT64x64x32_MI32x32x4x1_SE_GRVW8_LPB8_PLR9_SU32_SUS256_SRVW4_WGM15
    SolutionIndex: 125
    SolutionNameMin: Cijk_Ailk_Bljk_BBH_MT128x256x32_MI32x32x4x1_SE_GRVW8_LPB8_PLR9_SU32_SUS256_SRVW4_WGM1
    SolutionIndex: 126
    SolutionNameMin: Cijk_Ailk_Bljk_BBH_MT144x128x32_MI16x16x8x1_SE_GRVW2_LPB4_PLR5_SU32_SUS128_SRVW0_WGM2
    SolutionIndex: 127
    SolutionNameMin: Cijk_Ailk_Bljk_BBH_MT128x96x32_MI32x32x4x1_SE_GRVW4_LPB4_PLR9_SU0_SUS256_SRVW4_WGM1
    SolutionIndex: 128
    SolutionNameMin: Cijk_Ailk_Bljk_BBH_MT64x128x32_MI32x32x4x1_SE_GRVW8_LPB8_PLR9_SU32_SUS128_SRVW4_WGM15
    SolutionIndex: 129
    SolutionNameMin: Cijk_Ailk_Bljk_BBH_MT64x128x32_MI32x32x4x1_SE_GRVW8_LPB8_PLR9_SU0_SUS256_SRVW4_WGM1
    SolutionIndex: 130
    SolutionNameMin: Cijk_Ailk_Bljk_BBH_MT32x32x64_MI16x16x8x1_SE_GRVW4_LPB4_PLR9_SU0_SUS256_SRVW0_WGM1
    SolutionIndex: 131
    SolutionNameMin: Cijk_Ailk_Bljk_BBH_MT32x32x64_MI16x16x8x1_SE_GRVW8_LPB8_PLR9_SU32_SUS128_SRVW4_WGM15
    SolutionIndex: 132
    SolutionNameMin: Cijk_Ailk_Bljk_BBH_MT128x128x32_MI32x32x4x1_SE_GRVW4_LPB4_PLR9_SU0_SUS256_SRVW0_WGM1
    SolutionIndex: 133
    SolutionNameMin: Cijk_Ailk_Bljk_BBH_MT64x128x32_MI32x32x4x1_SE_GRVW4_LPB4_PLR9_SU32_SUS256_SRVW4_WGM15
    SolutionIndex: 134
    SolutionNameMin: Cijk_Ailk_Bljk_BBH_MT64x128x32_MI32x32x4x1_SE_GRVW4_LPB4_PLR9_SU0_SUS256_SRVW4_WGM1
    SolutionIndex: 135
    SolutionNameMin: Cijk_Ailk_Bljk_BBH_MT128x96x32_MI32x32x4x1_SE_GRVW2_LPB4_PLR9_SU32_SUS128_SRVW4_WGM15
    SolutionIndex: 136
    SolutionNameMin: Cijk_Ailk_Bljk_BBH_MT128x96x64_MI32x32x4x1_SE_GRVW4_LPB4_PLR17_SU32_SUS256_SRVW4_WGM2
    SolutionIndex: 137
    SolutionNameMin: Cijk_Ailk_Bljk_BBH_MT64x128x32_MI32x32x4x1_SE_GRVW2_LPB4_PLR9_SU0_SUS256_SRVW4_WGM15
    SolutionIndex: 138
    SolutionNameMin: Cijk_Ailk_Bljk_BBH_MT32x32x64_MI16x16x8x1_SE_GRVW4_LPB4_PLR9_SU32_SUS128_SRVW0_WGM1
    SolutionIndex: 139
    SolutionNameMin: Cijk_Ailk_Bljk_BBH_MT64x128x64_MI32x32x4x1_SE_GRVW8_LPB8_PLR17_SU0_SUS256_SRVW4_WGM15
    SolutionIndex: 140
    SolutionNameMin: Cijk_Ailk_Bljk_BBH_MT128x160x32_MI32x32x4x1_SE_GRVW2_LPB4_PLR9_SU0_SUS256_SRVW0_WGM15
    SolutionIndex: 141
    SolutionNameMin: Cijk_Ailk_Bljk_BBH_MT128x96x32_MI32x32x4x1_SE_GRVW4_LPB4_PLR9_SU0_SUS256_SRVW4_WGM2
    SolutionIndex: 142
    SolutionNameMin: Cijk_Ailk_Bljk_BBH_MT32x32x64_MI16x16x8x1_SE_GRVW8_LPB8_PLR9_SU0_SUS256_SRVW4_WGM2
    SolutionIndex: 143
    SolutionNameMin: Cijk_Ailk_Bljk_BBH_MT32x32x64_MI16x16x8x1_SE_GRVW8_LPB8_PLR9_SU0_SUS256_SRVW0_WGM1
    SolutionIndex: 144
    SolutionNameMin: Cijk_Ailk_Bljk_BBH_MT32x64x64_MI16x16x8x1_SE_GRVW4_LPB4_PLR9_SU32_SUS256_SRVW4_WGM15
    SolutionIndex: 145
    SolutionNameMin: Cijk_Ailk_Bljk_BBH_MT128x160x32_MI32x32x4x1_SE_GRVW2_LPB4_PLR9_SU32_SUS128_SRVW0_WGM15
    SolutionIndex: 146
    SolutionNameMin: Cijk_Ailk_Bljk_BBH_MT128x144x32_MI16x16x8x1_SE_GRVW2_LPB4_PLR5_SU0_SUS256_SRVW4_WGM2
    SolutionIndex: 147
    SolutionNameMin: Cijk_Ailk_Bljk_BBH_MT128x144x32_MI16x16x8x1_SE_GRVW2_LPB4_PLR5_SU0_SUS256_SRVW4_WGM15
    SolutionIndex: 148
    SolutionNameMin: Cijk_Ailk_Bljk_BBH_MT128x96x32_MI32x32x4x1_SE_GRVW4_LPB4_PLR9_SU32_SUS128_SRVW4_WGM2
    SolutionIndex: 149
    SolutionNameMin: Cijk_Ailk_Bljk_BBH_MT32x32x64_MI16x16x8x1_SE_GRVW2_LPB4_PLR9_SU32_SUS128_SRVW0_WGM1
    SolutionIndex: 150
    SolutionNameMin: Cijk_Ailk_Bljk_BBH_MT128x256x32_MI32x32x4x1_SE_GRVW8_LPB8_PLR9_SU0_SUS256_SRVW4_WGM15
    SolutionIndex: 151
    SolutionNameMin: Cijk_Ailk_Bljk_BBH_MT128x64x32_MI32x32x4x1_SE_GRVW8_LPB8_PLR9_SU0_SUS256_SRVW4_WGM2
    SolutionIndex: 152
    SolutionNameMin: Cijk_Ailk_Bljk_BBH_MT128x96x32_MI32x32x4x1_SE_GRVW4_LPB4_PLR9_SU32_SUS256_SRVW4_WGM15
    SolutionIndex: 153
    SolutionNameMin: Cijk_Ailk_Bljk_BBH_MT32x32x64_MI16x16x8x1_SE_GRVW8_LPB8_PLR9_SU32_SUS128_SRVW0_WGM1
    SolutionIndex: 154
    SolutionNameMin: Cijk_Ailk_Bljk_BBH_MT64x128x64_MI32x32x4x1_SE_GRVW4_LPB4_PLR17_SU0_SUS256_SRVW4_WGM15
    SolutionIndex: 155
    SolutionNameMin: Cijk_Ailk_Bljk_BBH_MT128x144x32_MI16x16x8x1_SE_GRVW2_LPB4_PLR5_SU0_SUS256_SRVW0_WGM15
    SolutionIndex: 156
    SolutionNameMin: Cijk_Ailk_Bljk_BBH_MT64x128x32_MI32x32x4x1_SE_GRVW4_LPB4_PLR9_SU0_SUS256_SRVW4_WGM2
    SolutionIndex: 157
    SolutionNameMin: Cijk_Ailk_Bljk_BBH_MT128x64x32_MI32x32x4x1_SE_GRVW8_LPB8_PLR9_SU0_SUS256_SRVW4_WGM15
    SolutionIndex: 158
    SolutionNameMin: Cijk_Ailk_Bljk_BBH_MT64x128x64_MI32x32x4x1_SE_GRVW8_LPB8_PLR17_SU32_SUS128_SRVW4_WGM2
    SolutionIndex: 159
    SolutionNameMin: Cijk_Ailk_Bljk_BBH_MT32x64x32_MI16x16x8x1_SE_GRVW2_LPB4_PLR5_SU0_SUS256_SRVW4_WGM1
    SolutionIndex: 160
    SolutionNameMin: Cijk_Ailk_Bljk_BBH_MT32x64x64_MI16x16x8x1_SE_GRVW2_LPB4_PLR9_SU0_SUS256_SRVW0_WGM1
    SolutionIndex: 161
    SolutionNameMin: Cijk_Ailk_Bljk_BBH_MT64x64x64_MI32x32x4x1_SE_GRVW8_LPB8_PLR17_SU32_SUS256_SRVW4_WGM2
    SolutionIndex: 162
    SolutionNameMin: Cijk_Ailk_Bljk_BBH_MT128x144x32_MI16x16x8x1_SE_GRVW2_LPB4_PLR5_SU0_SUS256_SRVW0_WGM1
    SolutionIndex: 163
    SolutionNameMin: Cijk_Ailk_Bljk_BBH_MT64x128x32_MI32x32x4x1_SE_GRVW8_LPB8_PLR9_SU0_SUS256_SRVW4_WGM15
    SolutionIndex: 164
    SolutionNameMin: Cijk_Ailk_Bljk_BBH_MT128x96x64_MI32x32x4x1_SE_GRVW2_LPB4_PLR17_SU0_SUS256_SRVW4_WGM15
    SolutionIndex: 165
    SolutionNameMin: Cijk_Ailk_Bljk_BBH_MT64x16x32_MI16x16x8x1_SE_GRVW8_LPB8_PLR5_SU0_SUS256_SRVW0_WGM2
    SolutionIndex: 166
    SolutionNameMin: Cijk_Ailk_Bljk_BBH_MT128x96x64_MI32x32x4x1_SE_GRVW2_LPB4_PLR17_SU32_SUS128_SRVW0_WGM2
    SolutionIndex: 167
    SolutionNameMin: Cijk_Ailk_Bljk_BBH_MT96x96x64_MI16x16x8x1_SE_GRVW8_LPB8_PLR9_SU0_SUS256_SRVW0_WGM1
    SolutionIndex: 168
    SolutionNameMin: Cijk_Ailk_Bljk_BBH_MT128x160x32_MI32x32x4x1_SE_GRVW4_LPB4_PLR9_SU0_SUS256_SRVW0_WGM1
    SolutionIndex: 169
    SolutionNameMin: Cijk_Ailk_Bljk_BBH_MT64x128x32_MI32x32x4x1_SE_GRVW8_LPB8_PLR9_SU32_SUS128_SRVW4_WGM1
    SolutionIndex: 170
    SolutionNameMin: Cijk_Ailk_Bljk_BBH_MT32x32x32_MI16x16x8x1_SE_GRVW8_LPB8_PLR5_SU0_SUS256_SRVW4_WGM15
    SolutionIndex: 171
    SolutionNameMin: Cijk_Ailk_Bljk_BBH_MT32x32x64_MI16x16x8x1_SE_GRVW8_LPB8_PLR9_SU32_SUS256_SRVW4_WGM15
    SolutionIndex: 172
    SolutionNameMin: Cijk_Ailk_Bljk_BBH_MT128x96x64_MI32x32x4x1_SE_GRVW8_LPB8_PLR17_SU32_SUS128_SRVW0_WGM15
    SolutionIndex: 173
    SolutionNameMin: Cijk_Ailk_Bljk_BBH_MT64x128x32_MI32x32x4x1_SE_GRVW2_LPB4_PLR9_SU0_SUS256_SRVW4_WGM1
    SolutionIndex: 174
    SolutionNameMin: Cijk_Ailk_Bljk_BBH_MT64x128x32_MI32x32x4x1_SE_GRVW8_LPB8_PLR9_SU32_SUS256_SRVW4_WGM1
    SolutionIndex: 175
    SolutionNameMin: Cijk_Ailk_Bljk_BBH_MT128x144x32_MI16x16x8x1_SE_GRVW2_LPB4_PLR5_SU32_SUS256_SRVW4_WGM1
    SolutionIndex: 176
    SolutionNameMin: Cijk_Ailk_Bljk_BBH_MT64x128x32_MI32x32x4x1_SE_GRVW8_LPB8_PLR9_SU32_SUS128_SRVW4_WGM2
    SolutionIndex: 177
    SolutionNameMin: Cijk_Ailk_Bljk_BBH_MT64x16x32_MI16x16x8x1_SE_GRVW2_LPB4_PLR5_SU0_SUS256_SRVW0_WGM1
    SolutionIndex: 178
    SolutionNameMin: Cijk_Ailk_Bljk_BBH_MT128x96x32_MI32x32x4x1_SE_GRVW2_LPB4_PLR9_SU0_SUS256_SRVW4_WGM2
    SolutionIndex: 179
    SolutionNameMin: Cijk_Ailk_Bljk_BBH_MT256x160x32_MI32x32x4x1_SE_GRVW2_LPB4_PLR9_SU0_SUS256_SRVW4_WGM15
    SolutionIndex: 180
    SolutionNameMin: Cijk_Ailk_Bljk_BBH_MT256x160x32_MI32x32x4x1_SE_GRVW2_LPB4_PLR9_SU0_SUS256_SRVW4_WGM15
    SolutionIndex: 181
    SolutionNameMin: Cijk_Ailk_Bljk_BBH_MT64x128x32_MI32x32x4x1_SE_GRVW8_LPB8_PLR9_SU32_SUS256_SRVW4_WGM2
    SolutionIndex: 182
    SolutionNameMin: Cijk_Ailk_Bljk_BBH_MT128x256x32_MI32x32x4x1_SE_GRVW2_LPB4_PLR9_SU0_SUS256_SRVW4_WGM2
    SolutionIndex: 183
    SolutionNameMin: Cijk_Ailk_Bljk_BBH_MT256x128x32_MI32x32x4x1_SE_GRVW8_LPB8_PLR9_SU0_SUS256_SRVW4_WGM15
    SolutionIndex: 184
    SolutionNameMin: Cijk_Ailk_Bljk_BBH_MT128x64x64_MI32x32x4x1_SE_GRVW8_LPB8_PLR17_SU0_SUS256_SRVW4_WGM1
    SolutionIndex: 185
    SolutionNameMin: Cijk_Ailk_Bljk_BBH_MT128x96x32_MI32x32x4x1_SE_GRVW4_LPB4_PLR9_SU0_SUS256_SRVW4_WGM15
    SolutionIndex: 186
    SolutionNameMin: Cijk_Ailk_Bljk_BBH_MT256x160x32_MI32x32x4x1_SE_GRVW4_LPB4_PLR9_SU0_SUS256_SRVW4_WGM2
    SolutionIndex: 187
    SolutionNameMin: Cijk_Ailk_Bljk_BBH_MT128x160x32_MI32x32x4x1_SE_GRVW4_LPB4_PLR9_SU0_SUS256_SRVW4_WGM2
    SolutionIndex: 188
    SolutionNameMin: Cijk_Ailk_Bljk_BBH_MT128x160x32_MI32x32x4x1_SE_GRVW2_LPB4_PLR9_SU0_SUS256_SRVW4_WGM2
    SolutionIndex: 189
    SolutionNameMin: Cijk_Ailk_Bljk_BBH_MT128x96x32_MI32x32x4x1_SE_GRVW4_LPB4_PLR9_SU32_SUS256_SRVW4_WGM2
    SolutionIndex: 190
    SolutionNameMin: Cijk_Ailk_Bljk_BBH_MT128x144x32_MI16x16x8x1_SE_GRVW2_LPB4_PLR5_SU0_SUS256_SRVW4_WGM1
    SolutionIndex: 191
    SolutionNameMin: Cijk_Ailk_Bljk_BBH_MT64x32x32_MI16x16x8x1_SE_GRVW4_LPB4_PLR5_SU0_SUS256_SRVW4_WGM1
    SolutionIndex: 192
    SolutionNameMin: Cijk_Ailk_Bljk_BBH_MT32x64x64_MI16x16x8x1_SE_GRVW8_LPB8_PLR9_SU32_SUS256_SRVW4_WGM2
    SolutionIndex: 193
    SolutionNameMin: Cijk_Ailk_Bljk_BBH_MT64x32x64_MI16x16x8x1_SE_GRVW4_LPB4_PLR9_SU32_SUS128_SRVW4_WGM1
    SolutionIndex: 194
    SolutionNameMin: Cijk_Ailk_Bljk_BBH_MT32x32x64_MI16x16x8x1_SE_GRVW4_LPB4_PLR9_SU0_SUS256_SRVW4_WGM2
    SolutionIndex: 195
    SolutionNameMin: Cijk_Ailk_Bljk_BBH_MT64x64x32_MI32x32x4x1_SE_GRVW8_LPB8_PLR9_SU0_SUS256_SRVW4_WGM2
    SolutionIndex: 196
    SolutionNameMin: Cijk_Ailk_Bljk_BBH_MT128x64x64_MI32x32x4x1_SE_GRVW4_LPB4_PLR17_SU32_SUS256_SRVW4_WGM1
    SolutionIndex: 197
    SolutionNameMin: Cijk_Ailk_Bljk_BBH_MT64x64x32_MI32x32x4x1_SE_GRVW4_LPB4_PLR9_SU0_SUS256_SRVW4_WGM1
    SolutionIndex: 198
    SolutionNameMin: Cijk_Ailk_Bljk_BBH_MT64x16x32_MI16x16x8x1_SE_GRVW4_LPB4_PLR5_SU0_SUS256_SRVW0_WGM2
    SolutionIndex: 199
    SolutionNameMin: Cijk_Ailk_Bljk_BBH_MT64x32x32_MI16x16x8x1_SE_GRVW2_LPB4_PLR5_SU0_SUS256_SRVW4_WGM1
    SolutionIndex: 200
    SolutionNameMin: Cijk_Ailk_Bljk_BBH_MT96x96x64_MI16x16x8x1_SE_GRVW8_LPB8_PLR9_SU0_SUS256_SRVW0_WGM15
    SolutionIndex: 201
    SolutionNameMin: Cijk_Ailk_Bljk_BBH_MT32x32x32_MI16x16x8x1_SE_GRVW2_LPB4_PLR5_SU0_SUS256_SRVW4_WGM2
    SolutionIndex: 202
    SolutionNameMin: Cijk_Ailk_Bljk_BBH_MT32x32x32_MI16x16x8x1_SE_GRVW4_LPB4_PLR5_SU0_SUS256_SRVW4_WGM2
    SolutionIndex: 203
    SolutionNameMin: Cijk_Ailk_Bljk_BBH_MT64x32x32_MI16x16x8x1_SE_GRVW8_LPB8_PLR5_SU32_SUS256_SRVW0_WGM1
    SolutionIndex: 204
    SolutionNameMin: Cijk_Ailk_Bljk_BBH_MT64x64x64_MI32x32x4x1_SE_GRVW8_LPB8_PLR17_SU0_SUS256_SRVW0_WGM1
    SolutionIndex: 205
    SolutionNameMin: Cijk_Ailk_Bljk_BBH_MT96x96x64_MI16x16x8x1_SE_GRVW8_LPB8_PLR9_SU0_SUS256_SRVW0_WGM1
    SolutionIndex: 206
    SolutionNameMin: Cijk_Ailk_Bljk_BBH_MT96x96x64_MI16x16x8x1_SE_GRVW8_LPB8_PLR9_SU32_SUS128_SRVW0_WGM1
    SolutionIndex: 207
    SolutionNameMin: Cijk_Ailk_Bljk_BBH_MT64x16x32_MI16x16x8x1_SE_GRVW8_LPB8_PLR5_SU0_SUS256_SRVW0_WGM1
    SolutionIndex: 208
    SolutionNameMin: Cijk_Ailk_Bljk_BBH_MT32x32x64_MI16x16x8x1_SE_GRVW8_LPB8_PLR9_SU32_SUS256_SRVW0_WGM2
    SolutionIndex: 209
    SolutionNameMin: Cijk_Ailk_Bljk_BBH_MT64x64x32_MI32x32x4x1_SE_GRVW8_LPB8_PLR9_SU32_SUS128_SRVW4_WGM1
    SolutionIndex: 210
    SolutionNameMin: Cijk_Ailk_Bljk_BBH_MT64x64x32_MI32x32x4x1_SE_GRVW8_LPB8_PLR9_SU32_SUS128_SRVW4_WGM15
    SolutionIndex: 211
    SolutionNameMin: Cijk_Ailk_Bljk_BBH_MT128x64x32_MI32x32x4x1_SE_GRVW2_LPB4_PLR9_SU0_SUS256_SRVW4_WGM1
    SolutionIndex: 212
    SolutionNameMin: Cijk_Ailk_Bljk_BBH_MT128x128x32_MI32x32x4x1_SE_GRVW8_LPB8_PLR9_SU32_SUS256_SRVW4_WGM15
    SolutionIndex: 213
    SolutionNameMin: Cijk_Ailk_Bljk_BBH_MT128x256x32_MI32x32x4x1_SE_GRVW8_LPB8_PLR9_SU32_SUS256_SRVW4_WGM2
    SolutionIndex: 214
    SolutionNameMin: Cijk_Ailk_Bljk_BBH_MT128x144x32_MI16x16x8x1_SE_GRVW2_LPB4_PLR5_SU32_SUS256_SRVW4_WGM15
    SolutionIndex: 215
    SolutionNameMin: Cijk_Ailk_Bljk_BBH_MT128x256x32_MI32x32x4x1_SE_GRVW8_LPB8_PLR9_SU32_SUS256_SRVW4_WGM15
    SolutionIndex: 216
    SolutionNameMin: Cijk_Ailk_Bljk_BBH_MT128x96x32_MI32x32x4x1_SE_GRVW4_LPB4_PLR9_SU32_SUS128_SRVW4_WGM15
    SolutionIndex: 217
    SolutionNameMin: Cijk_Ailk_Bljk_BBH_MT128x96x32_MI32x32x4x1_SE_GRVW2_LPB4_PLR9_SU32_SUS128_SRVW4_WGM2
    SolutionIndex: 218
    SolutionNameMin: Cijk_Ailk_Bljk_BBH_MT64x64x32_MI32x32x4x1_SE_GRVW8_LPB8_PLR9_SU0_SUS256_SRVW4_WGM1
    SolutionIndex: 219
    SolutionNameMin: Cijk_Ailk_Bljk_BBH_MT32x32x64_MI16x16x8x1_SE_GRVW2_LPB4_PLR9_SU0_SUS256_SRVW0_WGM15
    SolutionIndex: 220
    SolutionNameMin: Cijk_Ailk_Bljk_BBH_MT256x64x32_MI32x32x4x1_SE_GRVW4_LPB4_PLR9_SU0_SUS256_SRVW4_WGM15
    SolutionIndex: 221
    SolutionNameMin: Cijk_Ailk_Bljk_BBH_MT128x128x32_MI32x32x4x1_SE_GRVW8_LPB8_PLR9_SU0_SUS256_SRVW4_WGM1
    SolutionIndex: 222
    SolutionNameMin: Cijk_Ailk_Bljk_BBH_MT128x96x32_MI32x32x4x1_SE_GRVW2_LPB4_PLR9_SU32_SUS256_SRVW4_WGM15
    SolutionIndex: 223
    SolutionNameMin: Cijk_Ailk_Bljk_BBH_MT144x128x32_MI16x16x8x1_SE_GRVW2_LPB4_PLR5_SU0_SUS256_SRVW0_WGM2
    SolutionIndex: 224
    SolutionNameMin: Cijk_Ailk_Bljk_BBH_MT144x128x32_MI16x16x8x1_SE_GRVW2_LPB4_PLR5_SU0_SUS256_SRVW0_WGM15
    SolutionIndex: 225
    SolutionNameMin: Cijk_Ailk_Bljk_BBH_MT32x32x32_MI16x16x8x1_SE_GRVW4_LPB4_PLR5_SU0_SUS256_SRVW4_WGM1
    SolutionIndex: 226
    SolutionNameMin: Cijk_Ailk_Bljk_BBH_MT64x32x64_MI16x16x8x1_SE_GRVW8_LPB8_PLR9_SU0_SUS256_SRVW0_WGM1
    SolutionIndex: 227
    SolutionNameMin: Cijk_Ailk_Bljk_BBH_MT96x96x32_MI16x16x8x1_SE_GRVW4_LPB4_PLR5_SU32_SUS128_SRVW0_WGM15
    SolutionIndex: 228
    SolutionNameMin: Cijk_Ailk_Bljk_BBH_MT128x96x64_MI32x32x4x1_SE_GRVW2_LPB4_PLR17_SU32_SUS128_SRVW4_WGM2
    SolutionIndex: 229
    SolutionNameMin: Cijk_Ailk_Bljk_BBH_MT128x256x32_MI32x32x4x1_SE_GRVW8_LPB8_PLR9_SU32_SUS128_SRVW4_WGM1
    SolutionIndex: 230
    SolutionNameMin: Cijk_Ailk_Bljk_BBH_MT128x64x32_MI32x32x4x1_SE_GRVW8_LPB8_PLR9_SU0_SUS256_SRVW4_WGM1
    SolutionIndex: 231
    SolutionNameMin: Cijk_Ailk_Bljk_BBH_MT128x256x32_MI32x32x4x1_SE_GRVW8_LPB8_PLR9_SU0_SUS256_SRVW4_WGM1
    SolutionIndex: 232
    SolutionNameMin: Cijk_Ailk_Bljk_BBH_MT96x96x64_MI16x16x8x1_SE_GRVW8_LPB8_PLR9_SU32_SUS128_SRVW0_WGM15
    SolutionIndex: 233
    SolutionNameMin: Cijk_Ailk_Bljk_BBH_MT128x256x32_MI32x32x4x1_SE_GRVW8_LPB8_PLR9_SU0_SUS256_SRVW4_WGM2
    SolutionIndex: 234
    SolutionNameMin: Cijk_Ailk_Bljk_BBH_MT64x128x64_MI32x32x4x1_SE_GRVW8_LPB8_PLR17_SU0_SUS256_SRVW4_WGM2
    SolutionIndex: 235
    SolutionNameMin: Cijk_Ailk_Bljk_BBH_MT64x128x64_MI32x32x4x1_SE_GRVW8_LPB8_PLR17_SU32_SUS256_SRVW4_WGM15
    SolutionIndex: 236
    SolutionNameMin: Cijk_Ailk_Bljk_BBH_MT128x144x32_MI16x16x8x1_SE_GRVW2_LPB4_PLR5_SU32_SUS256_SRVW4_WGM2
    SolutionIndex: 237
    SolutionNameMin: Cijk_Ailk_Bljk_BBH_MT64x32x32_MI16x16x8x1_SE_GRVW8_LPB8_PLR5_SU32_SUS128_SRVW4_WGM1
    SolutionIndex: 238
    SolutionNameMin: Cijk_Ailk_Bljk_BBH_MT32x32x64_MI16x16x8x1_SE_GRVW4_LPB4_PLR9_SU32_SUS256_SRVW0_WGM2
    SolutionIndex: 239
    SolutionNameMin: Cijk_Ailk_Bljk_BBH_MT256x128x32_MI32x32x4x1_SE_GRVW4_LPB4_PLR9_SU32_SUS256_SRVW4_WGM15
    SolutionIndex: 240
    SolutionNameMin: Cijk_Ailk_Bljk_BBH_MT128x96x32_MI32x32x4x1_SE_GRVW4_LPB4_PLR9_SU32_SUS128_SRVW4_WGM1
    SolutionIndex: 241
    SolutionNameMin: Cijk_Ailk_Bljk_BBH_MT128x64x64_MI32x32x4x1_SE_GRVW4_LPB4_PLR17_SU32_SUS128_SRVW4_WGM2
    SolutionIndex: 242
    SolutionNameMin: Cijk_Ailk_Bljk_BBH_MT64x64x32_MI32x32x4x1_SE_GRVW8_LPB8_PLR9_SU32_SUS128_SRVW4_WGM2
    SolutionIndex: 243
    SolutionNameMin: Cijk_Ailk_Bljk_BBH_MT64x64x32_MI32x32x4x1_SE_GRVW8_LPB8_PLR9_SU0_SUS256_SRVW4_WGM15
    SolutionIndex: 244
    SolutionNameMin: Cijk_Ailk_Bljk_BBH_MT64x128x32_MI32x32x4x1_SE_GRVW8_LPB8_PLR9_SU32_SUS256_SRVW4_WGM15
    SolutionIndex: 245
    SolutionNameMin: Cijk_Ailk_Bljk_BBH_MT64x32x64_MI16x16x8x1_SE_GRVW4_LPB4_PLR9_SU0_SUS256_SRVW4_WGM1
    SolutionIndex: 246
    SolutionNameMin: Cijk_Ailk_Bljk_BBH_MT128x128x32_MI32x32x4x1_SE_GRVW4_LPB4_PLR9_SU0_SUS256_SRVW4_WGM1
    SolutionIndex: 247
    SolutionNameMin: Cijk_Ailk_Bljk_BBH_MT96x96x32_MI16x16x8x1_SE_GRVW4_LPB4_PLR5_SU0_SUS256_SRVW0_WGM15
    SolutionIndex: 248
    SolutionNameMin: Cijk_Ailk_Bljk_BBH_MT64x64x64_MI32x32x4x1_SE_GRVW8_LPB8_PLR17_SU32_SUS128_SRVW4_WGM15
    SolutionIndex: 249
    SolutionNameMin: Cijk_Ailk_Bljk_BBH_MT64x64x64_MI32x32x4x1_SE_GRVW4_LPB4_PLR17_SU0_SUS256_SRVW4_WGM2
    SolutionIndex: 250
    SolutionNameMin: Cijk_Ailk_Bljk_BBH_MT128x128x32_MI32x32x4x1_SE_GRVW2_LPB4_PLR9_SU0_SUS256_SRVW0_WGM15
    SolutionIndex: 251
    SolutionNameMin: Cijk_Ailk_Bljk_BBH_MT256x128x32_MI32x32x4x1_SE_GRVW8_LPB8_PLR9_SU32_SUS256_SRVW0_WGM15
    SolutionIndex: 252
    SolutionNameMin: Cijk_Ailk_Bljk_BBH_MT256x160x32_MI32x32x4x1_SE_GRVW2_LPB4_PLR9_SU0_SUS256_SRVW0_WGM1
    SolutionIndex: 253
    SolutionNameMin: Cijk_Ailk_Bljk_BBH_MT32x32x64_MI16x16x8x1_SE_GRVW8_LPB8_PLR9_SU32_SUS128_SRVW4_WGM2
    SolutionIndex: 254
    SolutionNameMin: Cijk_Ailk_Bljk_BBH_MT32x32x32_MI16x16x8x1_SE_GRVW8_LPB8_PLR5_SU0_SUS256_SRVW4_WGM1
    SolutionIndex: 255
    SolutionNameMin: Cijk_Ailk_Bljk_BBH_MT128x144x32_MI16x16x8x1_SE_GRVW2_LPB4_PLR5_SU32_SUS128_SRVW4_WGM1
    SolutionIndex: 256
    SolutionNameMin: Cijk_Ailk_Bljk_BBH_MT64x32x32_MI16x16x8x1_SE_GRVW8_LPB8_PLR5_SU32_SUS128_SRVW4_WGM15
    SolutionIndex: 257
    SolutionNameMin: Cijk_Ailk_Bljk_BBH_MT32x32x64_MI16x16x8x1_SE_GRVW8_LPB8_PLR9_SU32_SUS256_SRVW4_WGM1
    SolutionIndex: 258
    SolutionNameMin: Cijk_Ailk_Bljk_BBH_MT32x32x64_MI16x16x8x1_SE_GRVW2_LPB4_PLR9_SU32_SUS128_SRVW4_WGM1
    SolutionIndex: 259
    SolutionNameMin: Cijk_Ailk_Bljk_BBH_MT256x64x32_MI32x32x4x1_SE_GRVW8_LPB8_PLR9_SU0_SUS256_SRVW0_WGM15
    SolutionIndex: 260
    SolutionNameMin: Cijk_Ailk_Bljk_BBH_MT128x64x32_MI32x32x4x1_SE_GRVW4_LPB4_PLR9_SU0_SUS256_SRVW4_WGM1
    SolutionIndex: 261
    SolutionNameMin: Cijk_Ailk_Bljk_BBH_MT32x64x64_MI16x16x8x1_SE_GRVW8_LPB8_PLR9_SU0_SUS256_SRVW4_WGM1
    SolutionIndex: 262
    SolutionNameMin: Cijk_Ailk_Bljk_BBH_MT64x128x64_MI32x32x4x1_SE_GRVW8_LPB8_PLR17_SU32_SUS256_SRVW4_WGM1
    SolutionIndex: 263
    SolutionNameMin: Cijk_Ailk_Bljk_BBH_MT64x64x64_MI32x32x4x1_SE_GRVW8_LPB8_PLR17_SU32_SUS256_SRVW4_WGM15
    SolutionIndex: 264
    SolutionNameMin: Cijk_Ailk_Bljk_BBH_MT64x128x64_MI32x32x4x1_SE_GRVW8_LPB8_PLR17_SU32_SUS128_SRVW4_WGM1
    SolutionIndex: 265
    SolutionNameMin: Cijk_Ailk_Bljk_BBH_MT128x144x32_MI16x16x8x1_SE_GRVW2_LPB4_PLR5_SU0_SUS256_SRVW4_WGM2
    SolutionIndex: 266
    SolutionNameMin: Cijk_Ailk_Bljk_BBH_MT32x32x64_MI16x16x8x1_SE_GRVW4_LPB4_PLR9_SU32_SUS256_SRVW4_WGM2
    SolutionIndex: 267
    SolutionNameMin: Cijk_Ailk_Bljk_BBH_MT32x64x64_MI16x16x8x1_SE_GRVW4_LPB4_PLR9_SU32_SUS128_SRVW0_WGM1
    SolutionIndex: 268
    SolutionNameMin: Cijk_Ailk_Bljk_BBH_MT128x64x32_MI32x32x4x1_SE_GRVW8_LPB8_PLR9_SU32_SUS128_SRVW4_WGM1
    SolutionIndex: 269
    SolutionNameMin: Cijk_Ailk_Bljk_BBH_MT64x128x32_MI32x32x4x1_SE_GRVW8_LPB8_PLR9_SU0_SUS256_SRVW4_WGM2
    SolutionIndex: 270
    SolutionNameMin: Cijk_Ailk_Bljk_BBH_MT256x128x32_MI32x32x4x1_SE_GRVW4_LPB4_PLR9_SU0_SUS256_SRVW0_WGM1
    SolutionIndex: 271
    SolutionNameMin: Cijk_Ailk_Bljk_BBH_MT64x32x32_MI16x16x8x1_SE_GRVW8_LPB8_PLR5_SU0_SUS256_SRVW4_WGM1
    SolutionIndex: 272
    SolutionNameMin: Cijk_Ailk_Bljk_BBH_MT32x32x64_MI16x16x8x1_SE_GRVW8_LPB8_PLR9_SU32_SUS128_SRVW4_WGM1
    SolutionIndex: 273
    SolutionNameMin: Cijk_Ailk_Bljk_BBH_MT128x64x32_MI32x32x4x1_SE_GRVW8_LPB8_PLR9_SU32_SUS256_SRVW4_WGM1
    SolutionIndex: 274
    SolutionNameMin: Cijk_Ailk_Bljk_BBH_MT128x256x32_MI32x32x4x1_SE_GRVW8_LPB8_PLR9_SU32_SUS128_SRVW4_WGM1
    SolutionIndex: 275
    SolutionNameMin: Cijk_Ailk_Bljk_BBH_MT256x128x32_MI32x32x4x1_SE_GRVW8_LPB8_PLR9_SU0_SUS256_SRVW4_WGM1
    SolutionIndex: 276
    SolutionNameMin: Cijk_Ailk_Bljk_BBH_MT128x96x32_MI32x32x4x1_SE_GRVW4_LPB4_PLR9_SU32_SUS256_SRVW4_WGM1
    SolutionIndex: 277
    SolutionNameMin: Cijk_Ailk_Bljk_BBH_MT256x160x32_MI32x32x4x1_SE_GRVW4_LPB4_PLR9_SU0_SUS256_SRVW4_WGM1
    SolutionIndex: 278
    SolutionNameMin: Cijk_Ailk_Bljk_BBH_MT32x32x64_MI16x16x8x1_SE_GRVW2_LPB4_PLR9_SU0_SUS256_SRVW0_WGM1
    SolutionIndex: 279
    SolutionNameMin: Cijk_Ailk_Bljk_BBH_MT32x32x64_MI16x16x8x1_SE_GRVW4_LPB4_PLR9_SU0_SUS256_SRVW0_WGM1
    SolutionIndex: 280
    SolutionNameMin: Cijk_Ailk_Bljk_BBH_MT32x64x64_MI16x16x8x1_SE_GRVW4_LPB4_PLR9_SU0_SUS256_SRVW0_WGM1
    SolutionIndex: 281
    SolutionNameMin: Cijk_Ailk_Bljk_BBH_MT64x128x64_MI32x32x4x1_SE_GRVW2_LPB4_PLR17_SU0_SUS256_SRVW0_WGM1
    SolutionIndex: 282
    SolutionNameMin: Cijk_Ailk_Bljk_BBH_MT128x96x32_MI32x32x4x1_SE_GRVW4_LPB4_PLR9_SU0_SUS256_SRVW4_WGM2
    SolutionIndex: 283
    SolutionNameMin: Cijk_Ailk_Bljk_BBH_MT64x128x32_MI32x32x4x1_SE_GRVW4_LPB4_PLR9_SU0_SUS256_SRVW4_WGM2
    SolutionIndex: 284
    SolutionNameMin: Cijk_Ailk_Bljk_BBH_MT64x128x64_MI32x32x4x1_SE_GRVW4_LPB4_PLR17_SU0_SUS256_SRVW4_WGM1
    SolutionIndex: 285
    SolutionNameMin: Cijk_Ailk_Bljk_BBH_MT64x128x64_MI32x32x4x1_SE_GRVW8_LPB8_PLR17_SU32_SUS128_SRVW4_WGM1
    SolutionIndex: 286
    SolutionNameMin: Cijk_Ailk_Bljk_BBH_MT64x128x64_MI32x32x4x1_SE_GRVW8_LPB8_PLR17_SU0_SUS256_SRVW4_WGM1
    SolutionIndex: 287
    SolutionNameMin: Cijk_Ailk_Bljk_BBH_MT128x96x32_MI32x32x4x1_SE_GRVW4_LPB4_PLR9_SU0_SUS256_SRVW4_WGM15
    SolutionIndex: 288
    SolutionNameMin: Cijk_Ailk_Bljk_BBH_MT64x128x32_MI32x32x4x1_SE_GRVW4_LPB4_PLR9_SU0_SUS256_SRVW4_WGM15
    SolutionIndex: 289
    SolutionNameMin: Cijk_Ailk_Bljk_BBH_MT64x128x64_MI32x32x4x1_SE_GRVW8_LPB8_PLR17_SU0_SUS256_SRVW4_WGM15
    SolutionIndex: 290
    SolutionNameMin: Cijk_Ailk_Bljk_BBH_MT64x32x32_MI16x16x8x1_SE_GRVW2_LPB4_PLR5_SU32_SUS256_SRVW4_WGM1
    SolutionIndex: 291
    SolutionNameMin: Cijk_Ailk_Bljk_BBH_MT128x64x32_MI32x32x4x1_SE_GRVW2_LPB4_PLR9_SU0_SUS256_SRVW4_WGM15
    SolutionIndex: 292
    SolutionNameMin: Cijk_Ailk_Bljk_BBH_MT128x64x32_MI32x32x4x1_SE_GRVW8_LPB8_PLR9_SU0_SUS256_SRVW4_WGM15
    SolutionIndex: 293
    SolutionNameMin: Cijk_Ailk_Bljk_BBH_MT128x64x32_MI32x32x4x1_SE_GRVW4_LPB4_PLR9_SU0_SUS256_SRVW4_WGM2
    SolutionIndex: 294
    SolutionNameMin: Cijk_Ailk_Bljk_BBH_MT128x64x32_MI32x32x4x1_SE_GRVW4_LPB4_PLR9_SU0_SUS256_SRVW4_WGM1
    SolutionIndex: 295
    SolutionNameMin: Cijk_Ailk_Bljk_BBH_MT128x64x32_MI32x32x4x1_SE_GRVW8_LPB8_PLR9_SU0_SUS256_SRVW4_WGM1
    SolutionIndex: 296
    SolutionNameMin: Cijk_Ailk_Bljk_BBH_MT64x128x32_MI32x32x4x1_SE_GRVW8_LPB8_PLR9_SU0_SUS256_SRVW4_WGM15
    SolutionIndex: 297
    SolutionNameMin: Cijk_Ailk_Bljk_BBH_MT128x64x32_MI32x32x4x1_SE_GRVW8_LPB8_PLR9_SU0_SUS256_SRVW4_WGM2
    SolutionIndex: 298
    SolutionNameMin: Cijk_Ailk_Bljk_BBH_MT64x32x32_MI16x16x8x1_SE_GRVW4_LPB4_PLR5_SU32_SUS256_SRVW4_WGM1
    SolutionIndex: 299
    SolutionNameMin: Cijk_Ailk_Bljk_BBH_MT128x64x32_MI32x32x4x1_SE_GRVW8_LPB8_PLR9_SU32_SUS256_SRVW4_WGM15
    SolutionIndex: 300
    SolutionNameMin: Cijk_Ailk_Bljk_BBH_MT64x64x32_MI32x32x4x1_SE_GRVW2_LPB4_PLR9_SU0_SUS256_SRVW4_WGM15
    SolutionIndex: 301
    SolutionNameMin: Cijk_Ailk_Bljk_BBH_MT64x64x32_MI32x32x4x1_SE_GRVW8_LPB8_PLR9_SU0_SUS256_SRVW4_WGM1
    SolutionIndex: 302
    SolutionNameMin: Cijk_Ailk_Bljk_BBH_MT64x64x64_MI32x32x4x1_SE_GRVW4_LPB4_PLR17_SU32_SUS256_SRVW0_WGM1
    SolutionIndex: 303
    SolutionNameMin: Cijk_Ailk_Bljk_BBH_MT32x64x64_MI16x16x8x1_SE_GRVW2_LPB4_PLR9_SU0_SUS256_SRVW0_WGM15
    SolutionIndex: 304
    SolutionNameMin: Cijk_Ailk_Bljk_BBH_MT128x256x32_MI32x32x4x1_SE_GRVW8_LPB8_PLR9_SU0_SUS256_SRVW4_WGM2
    SolutionIndex: 305
    SolutionNameMin: Cijk_Ailk_Bljk_BBH_MT64x128x32_MI32x32x4x1_SE_GRVW8_LPB8_PLR9_SU0_SUS256_SRVW4_WGM1
    SolutionIndex: 306
    SolutionNameMin: Cijk_Ailk_Bljk_BBH_MT64x128x32_MI32x32x4x1_SE_GRVW8_LPB8_PLR9_SU32_SUS128_SRVW4_WGM1
    SolutionIndex: 307
    SolutionNameMin: Cijk_Ailk_Bljk_BBH_MT64x128x32_MI32x32x4x1_SE_GRVW8_LPB8_PLR9_SU32_SUS256_SRVW4_WGM15
    SolutionIndex: 308
    SolutionNameMin: Cijk_Ailk_Bljk_BBH_MT64x128x64_MI32x32x4x1_SE_GRVW4_LPB4_PLR17_SU32_SUS128_SRVW4_WGM15
    SolutionIndex: 309
    SolutionNameMin: Cijk_Ailk_Bljk_BBH_MT64x128x64_MI32x32x4x1_SE_GRVW4_LPB4_PLR17_SU32_SUS256_SRVW4_WGM15
    SolutionIndex: 310
    SolutionNameMin: Cijk_Ailk_Bljk_BBH_MT128x256x32_MI32x32x4x1_SE_AF0EM8_EPS1_GRVW8_LPB8_PGR1_PLR9_SRVW4_TT2_128_WG64_4_1_WGM1
    SolutionIndex: 311
    SolutionNameMin: Cijk_Ailk_Bljk_BBH_MT96x96x64_MI16x16x8x1_SE_AF0EM8_EPS1_GRVW8_LPB8_PGR1_PLR9_SRVW0_TT3_48_WG32_8_1_WGM2
    SolutionIndex: 312
    SolutionNameMin: Cijk_Ailk_Bljk_BBH_MT128x256x32_MI32x32x4x1_SE_AF0EM8_EPS1_GRVW2_LPB4_PGR1_PLR9_SRVW4_TT2_128_WG64_4_1_WGM1
    SolutionIndex: 313
    SolutionNameMin: Cijk_Ailk_Bljk_BBH_MT128x256x32_MI32x32x4x1_SE_AF0EM8_EPS0_GRVW8_LPB8_PGR2_PLR9_SRVW4_TT2_128_WG64_4_1_WGM2
    SolutionIndex: 314
    SolutionNameMin: Cijk_Ailk_Bljk_BBH_MT128x256x32_MI32x32x4x1_SE_AF0EM8_EPS1_GRVW8_LPB8_PGR1_PLR9_SRVW4_TT2_128_WG64_4_1_WGM2
    SolutionIndex: 315
    SolutionNameMin: Cijk_Ailk_Bljk_BBH_MT64x128x32_MI32x32x4x1_SE_AF0EM8_EPS0_GRVW8_LPB8_PGR2_PLR9_SRVW4_TT1_64_WG64_4_1_WGM2
    SolutionIndex: 316
    SolutionNameMin: Cijk_Ailk_Bljk_BBH_MT128x256x32_MI32x32x4x1_SE_AF0EM8_EPS1_GRVW8_LPB8_PGR1_PLR9_SRVW4_TT2_128_WG64_4_1_WGM15
    SolutionIndex: 317
    SolutionNameMin: Cijk_Ailk_Bljk_BBH_MT128x256x32_MI32x32x4x1_SE_AF0EM8_EPS1_GRVW8_LPB8_PGR1_PLR9_SRVW4_TT2_128_WG64_4_1_WGM15
    SolutionIndex: 318
    SolutionNameMin: Cijk_Ailk_Bljk_BBH_MT96x96x32_MI16x16x8x1_SE_AF0EM8_EPS0_GRVW4_LPB4_PGR2_PLR5_SRVW0_TT3_48_WG32_8_1_WGM1
    SolutionIndex: 319
    SolutionNameMin: Cijk_Ailk_Bljk_BBH_MT128x256x32_MI32x32x4x1_SE_AF0EM8_EPS1_GRVW2_LPB4_PGR1_PLR9_SRVW4_TT2_128_WG64_4_1_WGM15
    SolutionIndex: 320
    SolutionNameMin: Cijk_Ailk_Bljk_BBH_MT64x256x32_MI32x32x4x1_SE_AF0EM8_EPS0_GRVW8_LPB8_PGR2_PLR9_SRVW4_TT1_128_WG64_4_1_WGM15
    SolutionIndex: 321
    SolutionNameMin: Cijk_Ailk_Bljk_BBH_MT96x96x64_MI16x16x8x1_SE_AF0EM8_EPS1_GRVW8_LPB8_PGR1_PLR9_SRVW0_TT3_48_WG32_8_1_WGM15
    SolutionIndex: 322
    SolutionNameMin: Cijk_Ailk_Bljk_BBH_MT64x128x32_MI32x32x4x1_SE_AF0EM8_EPS0_GRVW8_LPB8_PGR2_PLR9_SRVW4_TT1_64_WG64_4_1_WGM1
    SolutionIndex: 323
    SolutionNameMin: Cijk_Ailk_Bljk_BBH_MT128x192x32_MI32x32x4x1_SE_AF0EM8_EPS0_GRVW8_LPB8_PGR2_PLR9_SRVW4_TT2_96_WG64_4_1_WGM15
    SolutionIndex: 324
    SolutionNameMin: Cijk_Ailk_Bljk_BBH_MT128x96x32_MI32x32x4x1_SE_AF0EM8_EPS0_GRVW4_LPB4_PGR2_PLR9_SRVW4_TT1_96_WG128_2_1_WGM1
    SolutionIndex: 325
    SolutionNameMin: Cijk_Ailk_Bljk_BBH_MT64x128x32_MI32x32x4x1_SE_AF0EM8_EPS0_GRVW8_LPB8_PGR2_PLR9_SRVW4_TT1_64_WG64_4_1_WGM1
    SolutionIndex: 326
    SolutionNameMin: Cijk_Ailk_Bljk_BBH_MT128x96x32_MI32x32x4x1_SE_AF0EM8_EPS1_GRVW4_LPB4_PGR1_PLR9_SRVW4_TT1_96_WG128_2_1_WGM15
    SolutionIndex: 327
    SolutionNameMin: Cijk_Ailk_Bljk_BBH_MT128x256x32_MI32x32x4x1_SE_AF0EM8_EPS1_GRVW8_LPB8_PGR1_PLR9_SRVW4_TT2_128_WG64_4_1_WGM2
    SolutionIndex: 328
    SolutionNameMin: Cijk_Ailk_Bljk_BBH_MT96x128x32_MI32x32x4x1_SE_AF0EM8_EPS0_GRVW4_LPB4_PGR2_PLR9_SRVW0_TT3_32_WG32_8_1_WGM1
    SolutionIndex: 329
    SolutionNameMin: Cijk_Ailk_Bljk_BBH_MT256x160x32_MI32x32x4x1_SE_AF0EM8_EPS1_GRVW4_LPB4_PGR1_PLR9_SRVW4_TT2_160_WG128_2_1_WGM2
    SolutionIndex: 330
    SolutionNameMin: Cijk_Ailk_Bljk_BBH_MT128x64x32_MI32x32x4x1_SE_AF0EM8_EPS0_GRVW8_LPB8_PGR2_PLR9_SRVW4_TT2_32_WG64_4_1_WGM1
    SolutionIndex: 331
    SolutionNameMin: Cijk_Ailk_Bljk_BBH_MT64x64x64_MI32x32x4x1_SE_AF0EM8_EPS0_GRVW4_LPB4_PGR2_PLR17_SRVW4_TT1_32_WG64_4_1_WGM1
    SolutionIndex: 332
    SolutionNameMin: Cijk_Ailk_Bljk_BBH_MT128x96x32_MI32x32x4x1_SE_AF0EM8_EPS1_GRVW4_LPB4_PGR1_PLR9_SRVW4_TT1_96_WG128_2_1_WGM15
    SolutionIndex: 333
    SolutionNameMin: Cijk_Ailk_Bljk_BBH_MT128x96x32_MI32x32x4x1_SE_AF0EM8_EPS0_GRVW4_LPB4_PGR2_PLR9_SRVW4_TT1_96_WG128_2_1_WGM2
    SolutionIndex: 334
    SolutionNameMin: Cijk_Ailk_Bljk_BBH_MT96x96x64_MI16x16x8x1_SE_AF0EM8_EPS0_GRVW8_LPB8_PGR2_PLR9_SRVW0_TT3_48_WG32_8_1_WGM2
    SolutionIndex: 335
    SolutionNameMin: Cijk_Ailk_Bljk_BBH_MT64x128x32_MI32x32x4x1_SE_AF0EM8_EPS0_GRVW4_LPB4_PGR2_PLR9_SRVW4_TT1_64_WG64_4_1_WGM1
    SolutionIndex: 336
    SolutionNameMin: Cijk_Ailk_Bljk_BBH_MT128x144x32_MI16x16x8x1_SE_AF0EM8_EPS1_GRVW2_LPB4_PGR1_PLR5_SRVW4_TT2_144_WG64_4_1_WGM1
    SolutionIndex: 337
    SolutionNameMin: Cijk_Ailk_Bljk_BBH_MT96x96x32_MI16x16x8x1_SE_AF0EM8_EPS0_GRVW2_LPB4_PGR2_PLR5_SRVW0_TT3_48_WG32_8_1_WGM15
    SolutionIndex: 338
    SolutionNameMin: Cijk_Ailk_Bljk_BBH_MT128x64x32_MI32x32x4x1_SE_AF0EM8_EPS0_GRVW8_LPB8_PGR2_PLR9_SRVW4_TT2_32_WG64_4_1_WGM15
    SolutionIndex: 339
    SolutionNameMin: Cijk_Ailk_Bljk_BBH_MT96x96x64_MI16x16x8x1_SE_AF0EM8_EPS1_GRVW8_LPB8_PGR1_PLR9_SRVW0_TT3_48_WG32_8_1_WGM1
    SolutionIndex: 340
    SolutionNameMin: Cijk_Ailk_Bljk_BBH_MT128x256x32_MI32x32x4x1_SE_AF0EM8_EPS1_GRVW4_LPB4_PGR1_PLR9_SRVW4_TT2_128_WG64_4_1_WGM15
    SolutionIndex: 341
    SolutionNameMin: Cijk_Ailk_Bljk_BBH_MT128x256x32_MI32x32x4x1_SE_AF0EM8_EPS1_GRVW4_LPB4_PGR1_PLR9_SRVW4_TT2_128_WG64_4_1_WGM2
    SolutionIndex: 342
    SolutionNameMin: Cijk_Ailk_Bljk_BBH_MT128x256x32_MI32x32x4x1_SE_AF0EM8_EPS1_GRVW4_LPB4_PGR1_PLR9_SRVW4_TT2_128_WG64_4_1_WGM1
    SolutionIndex: 343
    SolutionNameMin: Cijk_Ailk_Bljk_BBH_MT128x256x32_MI32x32x4x1_SE_AF0EM8_EPS1_GRVW4_LPB4_PGR1_PLR9_SRVW4_TT2_128_WG64_4_1_WGM2
    SolutionIndex: 344
    SolutionNameMin: Cijk_Ailk_Bljk_BBH_MT128x256x32_MI32x32x4x1_SE_AF0EM8_EPS1_GRVW4_LPB4_PGR1_PLR9_SRVW4_TT2_128_WG64_4_1_WGM15
    SolutionIndex: 345
    SolutionNameMin: Cijk_Ailk_Bljk_BBH_MT128x256x32_MI32x32x4x1_SE_AF0EM8_EPS1_GRVW4_LPB4_PGR1_PLR9_SRVW4_TT2_128_WG64_4_1_WGM15
    SolutionIndex: 346
    SolutionNameMin: Cijk_Ailk_Bljk_BBH_MT128x96x64_MI32x32x4x1_SE_AF0EM8_EPS1_GRVW8_LPB8_PGR1_PLR17_SRVW4_TT1_96_WG128_2_1_WGM1
    SolutionIndex: 347
    SolutionNameMin: Cijk_Ailk_Bljk_BBH_MT128x96x64_MI32x32x4x1_SE_AF0EM8_EPS1_GRVW2_LPB4_PGR1_PLR17_SRVW4_TT1_96_WG128_2_1_WGM1
    SolutionIndex: 348
    SolutionNameMin: Cijk_Ailk_Bljk_BBH_MT128x96x64_MI32x32x4x1_SE_AF0EM8_EPS1_GRVW8_LPB8_PGR1_PLR17_SRVW4_TT1_96_WG128_2_1_WGM15
    SolutionIndex: 349
    SolutionNameMin: Cijk_Ailk_Bljk_BBH_MT128x96x64_MI32x32x4x1_SE_AF0EM8_EPS1_GRVW8_LPB8_PGR1_PLR17_SRVW4_TT1_96_WG128_2_1_WGM15
    SolutionIndex: 350
    SolutionNameMin: Cijk_Ailk_Bljk_BBH_MT256x64x32_MI32x32x4x1_SE_AF0EM8_EPS0_GRVW2_LPB4_PGR2_PLR9_SRVW0_TT4_32_WG64_4_1_WGM15
    SolutionIndex: 351
    SolutionNameMin: Cijk_Ailk_Bljk_BBH_MT256x128x32_MI32x32x4x1_SE_AF0EM8_EPS1_GRVW8_LPB8_PGR1_PLR9_SRVW0_TT4_64_WG64_4_1_WGM1
    SolutionIndex: 352
    SolutionNameMin: Cijk_Ailk_Bljk_BBH_MT128x96x32_MI32x32x4x1_SE_AF0EM8_EPS1_GRVW4_LPB4_PGR1_PLR9_SRVW4_TT1_96_WG128_2_1_WGM2
    SolutionIndex: 353
    SolutionNameMin: Cijk_Ailk_Bljk_BBH_MT16x16x64_MI16x16x8x1_SE_AF0EM1_EPS1_GRVW2_LPB16_PGR1_PLR9_SRVW0_TT1_16_WG16_4_1_WGM1
    SolutionIndex: 354
    SolutionNameMin: Cijk_Ailk_Bljk_BBH_MT64x32x32_MI16x16x8x1_SE_AF0EM8_EPS0_GRVW4_LPB4_PGR2_PLR5_SRVW4_TT2_16_WG32_8_1_WGM2
    SolutionIndex: 355
    SolutionNameMin: Cijk_Ailk_Bljk_BBH_MT128x160x32_MI32x32x4x1_SE_AF0EM8_EPS1_GRVW2_LPB4_PGR1_PLR9_SRVW4_TT1_160_WG128_2_1_WGM15
    SolutionIndex: 356
    SolutionNameMin: Cijk_Ailk_Bljk_BBH_MT128x160x32_MI32x32x4x1_SE_AF0EM8_EPS0_GRVW4_LPB4_PGR2_PLR9_SRVW4_TT1_160_WG128_2_1_WGM15
    SolutionIndex: 357
    SolutionNameMin: Cijk_Ailk_Bljk_BBH_MT128x256x32_MI32x32x4x1_SE_AF0EM8_EPS1_GRVW8_LPB8_PGR1_PLR9_SRVW4_TT2_128_WG64_4_1_WGM1
    SolutionIndex: 358
    SolutionNameMin: Cijk_Ailk_Bljk_BBH_MT64x128x32_MI32x32x4x1_SE_AF0EM8_EPS1_GRVW2_LPB4_PGR1_PLR9_SRVW4_TT1_64_WG64_4_1_WGM15
    SolutionIndex: 359
    SolutionNameMin: Cijk_Ailk_Bljk_BBH_MT32x32x64_MI16x16x8x1_SE_AF0EM8_EPS0_GRVW8_LPB8_PGR2_PLR9_SRVW4_TT1_16_WG32_8_1_WGM1
    SolutionIndex: 360
    SolutionNameMin: Cijk_Ailk_Bljk_BBH_MT32x32x32_MI16x16x8x1_SE_AF0EM8_EPS0_GRVW4_LPB4_PGR2_PLR5_SRVW4_TT1_16_WG32_8_1_WGM1
    SolutionIndex: 361
    SolutionNameMin: Cijk_Ailk_Bljk_BBH_MT128x192x32_MI32x32x4x1_SE_AF0EM8_EPS1_GRVW4_LPB4_PGR1_PLR9_SRVW4_TT2_96_WG64_4_1_WGM15
    SolutionIndex: 362
    SolutionNameMin: Cijk_Ailk_Bljk_BBH_MT128x192x32_MI32x32x4x1_SE_AF0EM8_EPS1_GRVW4_LPB4_PGR1_PLR9_SRVW4_TT2_96_WG64_4_1_WGM2
    SolutionIndex: 363
    SolutionNameMin: Cijk_Ailk_Bljk_BBH_MT128x128x32_MI32x32x4x1_SE_AF0EM8_EPS0_GRVW4_LPB4_PGR2_PLR9_SRVW4_TT2_64_WG64_4_1_WGM15
    SolutionIndex: 364
    SolutionNameMin: Cijk_Ailk_Bljk_BBH_MT128x128x32_MI32x32x4x1_SE_AF0EM8_EPS0_GRVW4_LPB4_PGR2_PLR9_SRVW4_TT2_64_WG64_4_1_WGM15
    SolutionIndex: 365
    SolutionNameMin: Cijk_Ailk_Bljk_BBH_MT128x128x32_MI32x32x4x1_SE_AF0EM8_EPS0_GRVW4_LPB4_PGR2_PLR9_SRVW4_TT2_64_WG64_4_1_WGM15
    SolutionIndex: 366
    SolutionNameMin: Cijk_Ailk_Bljk_BBH_MT128x96x64_MI32x32x4x1_SE_AF0EM8_EPS1_GRVW2_LPB4_PGR1_PLR17_SRVW4_TT1_96_WG128_2_1_WGM2
    SolutionIndex: 367
    SolutionNameMin: Cijk_Ailk_Bljk_BBH_MT128x96x64_MI32x32x4x1_SE_AF0EM8_EPS1_GRVW8_LPB8_PGR1_PLR17_SRVW4_TT1_96_WG128_2_1_WGM2
    SolutionIndex: 368
    SolutionNameMin: Cijk_Ailk_Bljk_BBH_MT128x96x64_MI32x32x4x1_SE_AF0EM8_EPS1_GRVW8_LPB8_PGR1_PLR17_SRVW4_TT1_96_WG128_2_1_WGM15
    SolutionIndex: 369
    SolutionNameMin: Cijk_Ailk_Bljk_BBH_MT128x96x64_MI32x32x4x1_SE_AF0EM8_EPS1_GRVW8_LPB8_PGR1_PLR17_SRVW4_TT1_96_WG128_2_1_WGM2
    SolutionIndex: 370
    SolutionNameMin: Cijk_Ailk_Bljk_BBH_MT128x144x32_MI16x16x8x1_SE_AF0EM8_EPS1_GRVW2_LPB4_PGR1_PLR5_SRVW4_TT2_144_WG64_4_1_WGM15
    SolutionIndex: 371
    SolutionNameMin: Cijk_Ailk_Bljk_BBH_MT128x144x32_MI16x16x8x1_SE_AF0EM8_EPS1_GRVW2_LPB4_PGR1_PLR5_SRVW4_TT2_144_WG64_4_1_WGM2
    SolutionIndex: 372
    SolutionNameMin: Cijk_Ailk_Bljk_BBH_MT128x256x32_MI32x32x4x1_SE_AF0EM8_EPS1_GRVW4_LPB4_PGR1_PLR9_SRVW4_TT2_128_WG64_4_1_WGM2
    SolutionIndex: 373
    SolutionNameMin: Cijk_Ailk_Bljk_BBH_MT128x256x32_MI32x32x4x1_SE_AF0EM8_EPS0_GRVW8_LPB8_PGR2_PLR9_SRVW4_TT2_128_WG64_4_1_WGM1
    SolutionIndex: 374
    SolutionNameMin: Cijk_Ailk_Bljk_BBH_MT128x192x32_MI32x32x4x1_SE_AF0EM8_EPS1_GRVW2_LPB4_PGR1_PLR9_SRVW4_TT2_96_WG64_4_1_WGM1
    SolutionIndex: 375
    SolutionNameMin: Cijk_Ailk_Bljk_BBH_MT128x64x64_MI32x32x4x1_SE_AF0EM8_EPS0_GRVW4_LPB4_PGR2_PLR17_SRVW4_TT2_32_WG64_4_1_WGM15
    SolutionIndex: 376
    SolutionNameMin: Cijk_Ailk_Bljk_BBH_MT128x64x64_MI32x32x4x1_SE_AF0EM8_EPS0_GRVW4_LPB4_PGR2_PLR17_SRVW4_TT2_32_WG64_4_1_WGM2
    SolutionIndex: 377
    SolutionNameMin: Cijk_Ailk_Bljk_BBH_MT32x32x32_MI16x16x8x1_SE_AF0EM8_EPS1_GRVW2_LPB4_PGR1_PLR5_SRVW4_TT1_16_WG32_8_1_WGM1
    SolutionIndex: 378
    SolutionNameMin: Cijk_Ailk_Bljk_BBH_MT64x32x64_MI16x16x8x1_SE_AF0EM8_EPS0_GRVW2_LPB4_PGR2_PLR9_SRVW4_TT2_16_WG32_8_1_WGM1
    SolutionIndex: 379
    SolutionNameMin: Cijk_Ailk_Bljk_BBH_MT64x32x64_MI16x16x8x1_SE_AF0EM8_EPS0_GRVW2_LPB4_PGR2_PLR9_SRVW4_TT2_16_WG32_8_1_WGM2
    SolutionIndex: 380
    SolutionNameMin: Cijk_Ailk_Bljk_BBH_MT64x64x64_MI32x32x4x1_SE_AF0EM8_EPS0_GRVW2_LPB4_PGR2_PLR17_SRVW4_TT1_32_WG64_4_1_WGM15
    SolutionIndex: 381
    SolutionNameMin: Cijk_Ailk_Bljk_BBH_MT64x64x64_MI32x32x4x1_SE_AF0EM8_EPS0_GRVW2_LPB4_PGR2_PLR17_SRVW4_TT1_32_WG64_4_1_WGM1
    SolutionIndex: 382
    SolutionNameMin: Cijk_Ailk_Bljk_BBH_MT128x64x64_MI32x32x4x1_SE_AF0EM8_EPS1_GRVW8_LPB8_PGR1_PLR17_SRVW4_TT2_32_WG64_4_1_WGM1
    SolutionIndex: 383
    SolutionNameMin: Cijk_Ailk_Bljk_BBH_MT128x64x64_MI32x32x4x1_SE_AF0EM8_EPS1_GRVW4_LPB4_PGR1_PLR17_SRVW4_TT2_32_WG64_4_1_WGM15
    SolutionIndex: 384
    SolutionNameMin: Cijk_Ailk_Bljk_BBH_MT128x64x64_MI32x32x4x1_SE_AF0EM8_EPS1_GRVW8_LPB8_PGR1_PLR17_SRVW4_TT2_32_WG64_4_1_WGM2
    SolutionIndex: 385
    SolutionNameMin: Cijk_Ailk_Bljk_BBH_MT128x64x64_MI32x32x4x1_SE_AF0EM8_EPS0_GRVW8_LPB8_PGR2_PLR17_SRVW4_TT2_32_WG64_4_1_WGM2
    SolutionIndex: 386
    SolutionNameMin: Cijk_Ailk_Bljk_BBH_MT128x64x64_MI32x32x4x1_SE_AF0EM8_EPS1_GRVW4_LPB4_PGR1_PLR17_SRVW4_TT2_32_WG64_4_1_WGM15
    SolutionIndex: 387
    SolutionNameMin: Cijk_Ailk_Bljk_BBH_MT128x64x32_MI32x32x4x1_SE_AF0EM8_EPS0_GRVW4_LPB4_PGR2_PLR9_SRVW4_TT2_32_WG64_4_1_WGM15
    SolutionIndex: 388
    SolutionNameMin: Cijk_Ailk_Bljk_BBH_MT128x64x32_MI32x32x4x1_SE_AF0EM8_EPS0_GRVW8_LPB8_PGR2_PLR9_SRVW4_TT2_32_WG64_4_1_WGM1
    SolutionIndex: 389
    SolutionNameMin: Cijk_Ailk_Bljk_BBH_MT128x64x64_MI32x32x4x1_SE_AF0EM8_EPS1_GRVW8_LPB8_PGR1_PLR17_SRVW4_TT2_32_WG64_4_1_WGM2
    SolutionIndex: 390
    SolutionNameMin: Cijk_Ailk_Bljk_BBH_MT128x64x64_MI32x32x4x1_SE_AF0EM8_EPS1_GRVW4_LPB4_PGR1_PLR17_SRVW4_TT2_32_WG64_4_1_WGM1
    SolutionIndex: 391
    SolutionNameMin: Cijk_Ailk_Bljk_BBH_MT128x64x64_MI32x32x4x1_SE_AF0EM8_EPS1_GRVW8_LPB8_PGR1_PLR17_SRVW4_TT2_32_WG64_4_1_WGM1
    SolutionIndex: 392
    SolutionNameMin: Cijk_Ailk_Bljk_BBH_MT128x64x64_MI32x32x4x1_SE_AF0EM8_EPS0_GRVW8_LPB8_PGR2_PLR17_SRVW4_TT2_32_WG64_4_1_WGM1
    SolutionIndex: 393
    SolutionNameMin: Cijk_Ailk_Bljk_BBH_MT128x64x64_MI32x32x4x1_SE_AF0EM8_EPS1_GRVW8_LPB8_PGR1_PLR17_SRVW4_TT2_32_WG64_4_1_WGM15
    SolutionIndex: 394
    SolutionNameMin: Cijk_Ailk_Bljk_BBH_MT128x96x32_MI32x32x4x1_SE_AF0EM8_EPS1_GRVW4_LPB4_PGR1_PLR9_SRVW4_TT1_96_WG128_2_1_WGM2
    SolutionIndex: 395
    SolutionNameMin: Cijk_Ailk_Bljk_BBH_MT128x96x32_MI32x32x4x1_SE_AF0EM8_EPS1_GRVW4_LPB4_PGR1_PLR9_SRVW4_TT1_96_WG128_2_1_WGM1
    SolutionIndex: 396
    SolutionNameMin: Cijk_Ailk_Bljk_BBH_MT128x96x32_MI32x32x4x1_SE_AF0EM8_EPS1_GRVW4_LPB4_PGR1_PLR9_SRVW4_TT1_96_WG128_2_1_WGM1
    SolutionIndex: 397
    SolutionNameMin: Cijk_Ailk_Bljk_BBH_MT128x96x32_MI32x32x4x1_SE_AF0EM8_EPS1_GRVW4_LPB4_PGR1_PLR9_SRVW4_TT1_96_WG128_2_1_WGM1
    SolutionIndex: 398
    SolutionNameMin: Cijk_Ailk_Bljk_BBH_MT128x96x64_MI32x32x4x1_SE_AF0EM8_EPS1_GRVW2_LPB4_PGR1_PLR17_SRVW4_TT1_96_WG128_2_1_WGM15
    SolutionIndex: 399
    SolutionNameMin: Cijk_Ailk_Bljk_BBH_MT128x96x32_MI32x32x4x1_SE_AF0EM8_EPS1_GRVW4_LPB4_PGR1_PLR9_SRVW4_TT1_96_WG128_2_1_WGM15
    SolutionIndex: 400
    SolutionNameMin: Cijk_Ailk_Bljk_BBH_MT128x96x32_MI32x32x4x1_SE_AF0EM8_EPS1_GRVW4_LPB4_PGR1_PLR9_SRVW4_TT1_96_WG128_2_1_WGM2
    SolutionIndex: 401
    SolutionNameMin: Cijk_Ailk_Bljk_BBH_MT128x96x32_MI32x32x4x1_SE_AF0EM8_EPS1_GRVW4_LPB4_PGR1_PLR9_SRVW4_TT1_96_WG128_2_1_WGM2
    SolutionIndex: 402
    SolutionNameMin: Cijk_Ailk_Bljk_BBH_MT128x96x64_MI32x32x4x1_SE_AF0EM8_EPS1_GRVW8_LPB8_PGR1_PLR17_SRVW4_TT1_96_WG128_2_1_WGM2
    SolutionIndex: 403
    SolutionNameMin: Cijk_Ailk_Bljk_BBH_MT128x96x32_MI32x32x4x1_SE_AF0EM8_EPS1_GRVW4_LPB4_PGR1_PLR9_SRVW4_TT1_96_WG128_2_1_WGM15
    SolutionIndex: 404
    SolutionNameMin: Cijk_Ailk_Bljk_BBH_MT128x64x64_MI32x32x4x1_SE_AF0EM8_EPS1_GRVW4_LPB4_PGR1_PLR17_SRVW4_TT2_32_WG64_4_1_WGM1
    SolutionIndex: 405
    SolutionNameMin: Cijk_Ailk_Bljk_BBH_MT64x128x64_MI32x32x4x1_SE_AF0EM8_EPS0_GRVW8_LPB8_PGR2_PLR17_SRVW4_TT1_64_WG64_4_1_WGM1
    SolutionIndex: 406
    SolutionNameMin: Cijk_Ailk_Bljk_BBH_MT128x96x32_MI32x32x4x1_SE_AF0EM8_EPS0_GRVW4_LPB4_PGR2_PLR9_SRVW4_TT1_96_WG128_2_1_WGM15
    SolutionIndex: 407
    SolutionNameMin: Cijk_Ailk_Bljk_BBH_MT128x96x64_MI32x32x4x1_SE_AF0EM8_EPS1_GRVW2_LPB4_PGR1_PLR17_SRVW4_TT1_96_WG128_2_1_WGM1
    SolutionIndex: 408
    SolutionNameMin: Cijk_Ailk_Bljk_BBH_MT128x96x32_MI32x32x4x1_SE_AF0EM8_EPS0_GRVW2_LPB4_PGR2_PLR9_SRVW4_TT1_96_WG128_2_1_WGM2
    SolutionIndex: 409
    SolutionNameMin: Cijk_Ailk_Bljk_BBH_MT64x64x32_MI32x32x4x1_SE_AF0EM8_EPS0_GRVW8_LPB8_PGR2_PLR9_SRVW4_TT1_32_WG64_4_1_WGM15
    SolutionIndex: 410
    SolutionNameMin: Cijk_Ailk_Bljk_BBH_MT128x64x32_MI32x32x4x1_SE_AF0EM1_EPS0_GRVW4_LPB4_PGR2_PLR9_SRVW4_TT2_32_WG64_4_1_WGM1
    SolutionIndex: 411
    SolutionNameMin: Cijk_Ailk_Bljk_BBH_MT128x64x32_MI32x32x4x1_SE_AF0EM1_EPS0_GRVW4_LPB4_PGR2_PLR9_SRVW4_TT2_32_WG64_4_1_WGM2
    SolutionIndex: 412
    SolutionNameMin: Cijk_Ailk_Bljk_BBH_MT64x32x32_MI16x16x8x1_SE_AF0EM1_EPS1_GRVW2_LPB4_PGR1_PLR5_SRVW4_TT2_16_WG32_8_1_WGM1
- - - [64, 35, 1, 35]
    - [2, 0.005]
  - - [64, 35, 1, 32]
    - [1, 0.005]
  - - [64, 15, 1, 15]
    - [0, 0.001]
  - - [64, 15, 1, 17]
    - [3, 0.001]
  - - [64, 17, 1, 17]
    - [1, 0.001]
  - - [64, 30, 1, 30]
    - [0, 0.004]
  - - [64, 32, 1, 32]
    - [7, 0.005]
  - - [64, 31, 1, 31]
    - [5, 0.004]
  - - [64, 24, 1, 24]
    - [3, 0.003]
  - - [64, 15, 1, 15]
    - [4, 0.001]
  - - [64, 17, 1, 17]
    - [1, 0.001]
  - - [64, 34, 1, 34]
    - [1, 0.004]
  - - [64, 14, 1, 15]
    - [0, 0.001]
  - - [64, 17, 1, 21]
    - [0, 0.001]
  - - [64, 14, 1, 14]
    - [0, 0.001]
  - - [64, 24, 1, 34]
    - [8, 0.004]
  - - [64, 21, 1, 21]
    - [2, 0.002]
  - - [64, 31, 1, 30]
    - [6, 0.004]
  - - [64, 128, 512, 128]
    - [174, 30.267]
  - - [64, 512, 1, 512]
    - [58, 3.237]
  - - [64, 512, 64, 512]
    - [36, 44.66]
  - - [128, 128, 512, 64]
    - [129, 34.412]
  - - [512, 512, 1, 64]
    - [192, 5.608]
  - - [512, 512, 64, 64]
    - [125, 45.675]
  - - [1024, 4, 1, 2]
    - [142, 0.003]
  - - [1024, 4, 1, 1024]
    - [143, 0.66]
  - - [1024, 32, 1, 2]
    - [35, 0.022]
  - - [1024, 32, 1, 1024]
    - [20, 4.759]
  - - [1024, 2048, 1, 2]
    - [146, 0.818]
  - - [1024, 2048, 1, 1024]
    - [116, 76.414]
  - - [1024, 2048, 1, 4096]
    - [147, 86.253]
  - - [1024, 2048, 1, 30528]
    - [86, 89.711]
  - - [1024, 4096, 1, 1024]
    - [29, 80.307]
  - - [1024, 4096, 1, 4096]
    - [80, 89.047]
  - - [1024, 4096, 1, 30528]
    - [81, 92.724]
  - - [4096, 2048, 1, 1024]
    - [148, 84.707]
  - - [4096, 4096, 1, 1024]
    - [127, 87.974]
  - - [32, 33, 1600, 33]
    - [38, 4.517]
  - - [32, 200, 1, 1]
    - [120, 0.001]
  - - [64, 3, 512, 3]
    - [177, 0.069]
  - - [64, 5, 512, 5]
    - [198, 0.184]
  - - [64, 5, 960, 5]
    - [177, 0.281]
  - - [64, 9, 512, 9]
    - [177, 0.547]
  - - [64, 512, 1, 1]
    - [35, 0.012]
  - - [67, 512, 1, 2048]
    - [279, 9.006]
  - - [74, 512, 1, 2048]
    - [278, 9.617]
  - - [74, 960, 1, 2048]
    - [280, 14.719]
  - - [100, 512, 1, 2048]
    - [280, 11.753]
  - - [128, 27, 32768, 27]
    - [22, 7.871]
  - - [256, 1024, 1, 1]
    - [199, 0.106]
  - - [256, 8976, 1, 1536]
    - [32, 76.37]
  - - [256, 8976, 1, 2048]
    - [32, 79.784]
  - - [256, 8976, 1, 2304]
    - [32, 81.09]
  - - [256, 8976, 1, 2560]
    - [53, 81.921]
  - - [256, 8976, 1, 2816]
    - [32, 82.557]
  - - [256, 8976, 1, 3072]
    - [32, 83.199]
  - - [256, 8976, 1, 4352]
    - [52, 85.155]
  - - [256, 8976, 1, 4864]
    - [32, 86.052]
  - - [256, 8976, 1, 5376]
    - [19, 86.694]
  - - [256, 8976, 1, 5632]
    - [19, 86.848]
  - - [256, 8976, 1, 5888]
    - [32, 87.17]
  - - [256, 8976, 1, 6144]
    - [19, 87.325]
  - - [256, 8976, 1, 6656]
    - [19, 87.462]
  - - [256, 8976, 1, 7168]
    - [19, 87.73]
  - - [256, 8976, 1, 7424]
    - [19, 87.79]
  - - [256, 8976, 1, 8192]
    - [19, 88.28]
  - - [256, 8976, 1, 8448]
    - [19, 88.359]
  - - [256, 8976, 1, 8960]
    - [19, 88.546]
  - - [256, 8976, 1, 9472]
    - [27, 88.597]
  - - [256, 8976, 1, 9728]
    - [19, 88.716]
  - - [256, 8976, 1, 9984]
    - [19, 88.864]
  - - [256, 8976, 1, 10240]
    - [19, 89.06]
  - - [256, 8976, 1, 10496]
    - [19, 88.966]
  - - [256, 8976, 1, 11008]
    - [19, 89.091]
  - - [256, 8976, 1, 11520]
    - [19, 89.142]
  - - [256, 8976, 1, 12288]
    - [19, 89.361]
  - - [256, 8976, 1, 14336]
    - [27, 89.604]
  - - [256, 8976, 1, 14848]
    - [19, 89.701]
  - - [256, 8976, 1, 15104]
    - [19, 89.834]
  - - [256, 8976, 1, 15872]
    - [27, 89.855]
  - - [256, 8976, 1, 17152]
    - [19, 89.939]
  - - [256, 8976, 1, 19712]
    - [27, 90.15]
  - - [256, 8976, 1, 19968]
    - [19, 90.191]
  - - [256, 8976, 1, 20480]
    - [87, 90.164]
  - - [256, 8976, 1, 20992]
    - [19, 90.319]
  - - [256, 8976, 1, 22016]
    - [27, 90.307]
  - - [256, 8976, 1, 26112]
    - [19, 90.515]
  - - [256, 8976, 1, 33536]
    - [92, 91.004]
  - - [256, 8976, 1, 44505]
    - [97, 90.671]
  - - [256, 32768, 1, 128]
    - [175, 54.761]
  - - [257, 1024, 1, 4096]
    - [281, 44.245]
  - - [480, 32768, 1, 1024]
    - [200, 85.787]
  - - [512, 200, 1, 1]
    - [201, 0.046]
  - - [512, 200, 1, 32]
    - [202, 1.136]
  - - [512, 215, 1, 2048]
    - [203, 20.584]
  - - [512, 256, 1, 2048]
    - [204, 23.812]
  - - [512, 1600, 1, 32]
    - [197, 8.46]
  - - [512, 1600, 1, 512]
    - [196, 44.353]
  - - [512, 32768, 1, 256]
    - [176, 74.71]
  - - [560, 200, 1, 1024]
    - [131, 14.123]
  - - [560, 1600, 1, 1024]
    - [54, 57.626]
  - - [768, 215, 1, 2048]
    - [205, 27.639]
  - - [768, 256, 1, 2048]
    - [206, 32.206]
  - - [1024, 200, 1, 1]
    - [170, 0.09]
  - - [1024, 512, 1, 1]
    - [209, 0.186]
  - - [1024, 512, 1, 64]
    - [195, 10.129]
  - - [1024, 512, 1, 1024]
    - [48, 39.561]
  - - [1024, 960, 1, 64]
    - [210, 17.317]
  - - [1024, 960, 1, 1024]
    - [113, 71.911]
  - - [1024, 1600, 1, 1]
    - [211, 0.409]
  - - [1024, 1600, 1, 1024]
    - [163, 65.284]
  - - [1024, 1792, 1, 256]
    - [212, 51.417]
  - - [1024, 2048, 1, 256]
    - [147, 52.064]
  - - [1024, 2560, 1, 256]
    - [181, 55.578]
  - - [1024, 3072, 1, 256]
    - [163, 54.611]
  - - [1024, 3328, 1, 256]
    - [169, 58.317]
  - - [1024, 3840, 1, 256]
    - [213, 64.303]
  - - [1024, 4096, 1, 256]
    - [176, 60.352]
  - - [1024, 4608, 1, 256]
    - [181, 63.688]
  - - [1024, 4864, 1, 256]
    - [176, 62.148]
  - - [1024, 5120, 1, 256]
    - [176, 63.76]
  - - [1024, 5632, 1, 256]
    - [127, 65.327]
  - - [1024, 6144, 1, 256]
    - [148, 65.82]
  - - [1024, 6400, 1, 256]
    - [214, 68.713]
  - - [1024, 7168, 1, 256]
    - [189, 69.369]
  - - [1024, 7424, 1, 256]
    - [75, 70.456]
  - - [1024, 7680, 1, 256]
    - [215, 72.326]
  - - [1024, 7936, 1, 256]
    - [216, 70.924]
  - - [1024, 8192, 1, 256]
    - [141, 70.64]
  - - [1024, 8448, 1, 256]
    - [148, 71.712]
  - - [1024, 8704, 1, 256]
    - [181, 68.88]
  - - [1024, 8960, 1, 256]
    - [169, 70.003]
  - - [1024, 9728, 1, 256]
    - [217, 71.992]
  - - [1024, 9984, 1, 256]
    - [141, 72.573]
  - - [1024, 10240, 1, 256]
    - [169, 70.565]
  - - [1024, 10496, 1, 256]
    - [169, 70.837]
  - - [1024, 11008, 1, 256]
    - [150, 73.483]
  - - [1024, 11264, 1, 256]
    - [150, 75.193]
  - - [1024, 11520, 1, 256]
    - [215, 76.692]
  - - [1024, 12288, 1, 256]
    - [216, 75.175]
  - - [1024, 13312, 1, 256]
    - [176, 73.14]
  - - [1024, 13568, 1, 256]
    - [176, 73.396]
  - - [1024, 14336, 1, 256]
    - [189, 74.12]
  - - [1024, 14592, 1, 256]
    - [150, 75.364]
  - - [1024, 14848, 1, 256]
    - [150, 76.767]
  - - [1024, 15104, 1, 256]
    - [215, 77.844]
  - - [1024, 16128, 1, 256]
    - [148, 76.752]
  - - [1024, 17152, 1, 256]
    - [141, 76.297]
  - - [1024, 18944, 1, 256]
    - [150, 79.579]
  - - [1024, 19712, 1, 256]
    - [34, 77.373]
  - - [1024, 19968, 1, 256]
    - [148, 78.504]
  - - [1024, 20480, 1, 256]
    - [44, 76.298]
  - - [1024, 20992, 1, 256]
    - [23, 77.616]
  - - [1024, 21504, 1, 256]
    - [141, 79.151]
  - - [1024, 22016, 1, 256]
    - [215, 78.39]
  - - [1024, 23552, 1, 256]
    - [148, 77.659]
  - - [1024, 28672, 1, 256]
    - [216, 78.591]
  - - [1024, 32768, 1, 512]
    - [24, 87.497]
  - - [1024, 32768, 1, 1024]
    - [141, 92.465]
  - - [1024, 33536, 1, 256]
    - [150, 81.337]
  - - [1024, 40448, 1, 256]
    - [34, 80.937]
  - - [1600, 512, 1, 1024]
    - [218, 54.141]
  - - [2048, 512, 1, 1]
    - [156, 0.28]
  - - [2048, 512, 1, 2048]
    - [45, 62.219]
  - - [2048, 960, 1, 2048]
    - [220, 81.386]
  - - [2048, 1024, 1, 1]
    - [134, 0.382]
  - - [2048, 1024, 1, 256]
    - [126, 48.779]
  - - [3200, 1024, 1, 2048]
    - [221, 76.125]
  - - [4096, 1024, 1, 1]
    - [222, 0.52]
  - - [64, 14, 10880, 14]
    - [177, 2.825]
  - - [64, 14, 10880, 15]
    - [177, 3.008]
  - - [64, 15, 7680, 15]
    - [177, 3.113]
  - - [64, 15, 10880, 15]
    - [177, 3.209]
  - - [64, 15, 7680, 17]
    - [177, 3.327]
  - - [64, 17, 6144, 17]
    - [22, 3.203]
  - - [64, 17, 7680, 17]
    - [22, 3.303]
  - - [64, 17, 6144, 21]
    - [22, 3.853]
  - - [64, 21, 6144, 21]
    - [22, 4.718]
  - - [64, 24, 4736, 24]
    - [22, 6.007]
  - - [64, 24, 4736, 34]
    - [22, 7.407]
  - - [64, 30, 2048, 30]
    - [43, 6.987]
  - - [64, 31, 2048, 30]
    - [22, 7.198]
  - - [64, 31, 2048, 31]
    - [22, 7.344]
  - - [64, 32, 4608, 32]
    - [191, 13.236]
  - - [64, 34, 4736, 34]
    - [47, 6.754]
  - - [64, 35, 4608, 32]
    - [22, 10.252]
  - - [64, 35, 4608, 35]
    - [42, 6.714]
  - - [1024, 3840, 1, 1024]
    - [182, 86.624]
  - - [1024, 3840, 1, 4096]
    - [183, 94.826]
  - - [1024, 3968, 1, 1024]
    - [29, 78.032]
  - - [1024, 3968, 1, 4096]
    - [80, 86.217]
  - - [1024, 3968, 1, 42720]
    - [80, 89.943]
  - - [1024, 6528, 1, 1024]
    - [129, 83.247]
  - - [1024, 6528, 1, 4096]
    - [184, 87.289]
  - - [1024, 6528, 1, 42720]
    - [91, 93.413]
  - - [1024, 7104, 1, 1024]
    - [185, 87.576]
  - - [1024, 7104, 1, 4096]
    - [80, 93.682]
  - - [1024, 7104, 1, 42720]
    - [92, 96.572]
  - - [1024, 7200, 1, 1024]
    - [115, 87.226]
  - - [1024, 7200, 1, 4096]
    - [115, 94.804]
  - - [1024, 7200, 1, 42720]
    - [92, 97.776]
  - - [1024, 8064, 1, 1024]
    - [185, 85.779]
  - - [1024, 8064, 1, 4096]
    - [80, 89.948]
  - - [1024, 8160, 1, 1024]
    - [185, 86.565]
  - - [1024, 8160, 1, 4096]
    - [80, 90.812]
  - - [1024, 9216, 1, 1024]
    - [129, 85.236]
  - - [1024, 9216, 1, 4096]
    - [186, 90.971]
  - - [1024, 9520, 1, 1024]
    - [187, 85.666]
  - - [1024, 9520, 1, 4096]
    - [188, 93.747]
  - - [1024, 9520, 1, 42720]
    - [87, 97.056]
  - - [1024, 10064, 1, 1024]
    - [148, 87.823]
  - - [1024, 10064, 1, 4096]
    - [90, 92.817]
  - - [1024, 10080, 1, 1024]
    - [80, 88.991]
  - - [1024, 10080, 1, 4096]
    - [164, 92.976]
  - - [1024, 10080, 1, 42720]
    - [84, 97.243]
  - - [1024, 10200, 1, 1024]
    - [181, 85.257]
  - - [1024, 10200, 1, 4096]
    - [79, 90.509]
  - - [4096, 3840, 1, 1024]
    - [95, 92.612]
  - - [4096, 3968, 1, 1024]
    - [25, 85.955]
  - - [4096, 6528, 1, 1024]
    - [78, 90.113]
  - - [4096, 7104, 1, 1024]
    - [189, 91.755]
  - - [4096, 7200, 1, 1024]
    - [46, 90.277]
  - - [4096, 8064, 1, 1024]
    - [94, 93.48]
  - - [4096, 8160, 1, 1024]
    - [96, 91.999]
  - - [4096, 9216, 1, 1024]
    - [85, 92.14]
  - - [4096, 9520, 1, 1024]
    - [190, 91.778]
  - - [4096, 10064, 1, 1024]
    - [93, 92.103]
  - - [4096, 10080, 1, 1024]
    - [94, 93.009]
  - - [4096, 10200, 1, 1024]
    - [94, 93.043]
  - - [64, 27, 1920, 27]
    - [9, 2.212]
  - - [64, 33, 1920, 27]
    - [11, 2.176]
  - - [64, 33, 1920, 33]
    - [12, 2.734]
  - - [1024, 3240, 1, 1024]
    - [13, 34.747]
  - - [1024, 3240, 1, 4096]
    - [17, 38.008]
  - - [1024, 3960, 1, 1024]
    - [15, 34.758]
  - - [1024, 3960, 1, 4096]
    - [16, 37.079]
  - - [1024, 3960, 1, 42720]
    - [14, 39.481]
  - - [4096, 3240, 1, 1024]
    - [18, 40.489]
  - - [4096, 3960, 1, 1024]
    - [10, 41.988]
  - - [64, 192, 64, 1280]
    - [195, 50.511]
  - - [64, 320, 64, 1280]
    - [62, 52.865]
  - - [64, 384, 64, 1280]
    - [169, 61.672]
  - - [64, 448, 64, 1280]
    - [195, 61.058]
  - - [64, 192, 64, 2048]
    - [61, 48.544]
  - - [64, 320, 64, 2048]
    - [68, 52.446]
  - - [64, 384, 64, 2048]
    - [244, 59.634]
  - - [64, 448, 64, 2048]
    - [69, 59.408]
  - - [1225, 32, 64, 192]
    - [290, 27.238]
  - - [1225, 48, 64, 192]
    - [291, 27.265]
  - - [1225, 64, 64, 192]
    - [292, 43.033]
  - - [1225, 48, 64, 256]
    - [293, 31.523]
  - - [1225, 64, 64, 256]
    - [294, 47.233]
  - - [1225, 48, 64, 288]
    - [295, 33.979]
  - - [1225, 64, 64, 288]
    - [294, 51.42]
  - - [5329, 80, 64, 64]
    - [73, 22.903]
  - - [289, 128, 64, 768]
    - [296, 55.698]
  - - [289, 160, 64, 768]
    - [295, 47.476]
  - - [289, 192, 64, 768]
    - [297, 56.972]
  - - [64, 192, 32, 1280]
    - [261, 40.781]
  - - [64, 320, 32, 1280]
    - [262, 44.987]
  - - [64, 384, 32, 1280]
    - [243, 52.923]
  - - [64, 448, 32, 1280]
    - [210, 59.408]
  - - [64, 192, 32, 2048]
    - [263, 42.102]
  - - [64, 320, 32, 2048]
    - [264, 50.343]
  - - [64, 384, 32, 2048]
    - [264, 57.093]
  - - [64, 448, 32, 2048]
    - [218, 58.714]
  - - [1225, 32, 32, 192]
    - [298, 23.478]
  - - [1225, 48, 32, 192]
    - [292, 24.499]
  - - [1225, 64, 32, 192]
    - [299, 37.255]
  - - [1225, 48, 32, 256]
    - [294, 28.896]
  - - [1225, 64, 32, 256]
    - [295, 41.885]
  - - [1225, 48, 32, 288]
    - [292, 30.736]
  - - [1225, 64, 32, 288]
    - [297, 45.381]
  - - [5329, 80, 32, 64]
    - [59, 21.759]
  - - [289, 128, 32, 768]
    - [296, 43.408]
  - - [289, 160, 32, 768]
    - [300, 41.38]
  - - [289, 192, 32, 768]
    - [301, 47.796]
  - - [3136, 256, 64, 64]
    - [229, 53.706]
  - - [3136, 64, 64, 64]
    - [151, 32.669]
  - - [3136, 64, 64, 256]
    - [260, 58.118]
  - - [784, 512, 64, 128]
    - [233, 59.465]
  - - [784, 128, 64, 512]
    - [163, 68.921]
  - - [196, 1024, 64, 256]
    - [287, 52.604]
  - - [196, 256, 64, 1024]
    - [66, 54.226]
  - - [49, 2048, 64, 512]
    - [288, 42.92]
  - - [49, 512, 64, 2048]
    - [289, 39.53]
  - - [3136, 256, 32, 64]
    - [175, 45.793]
  - - [3136, 64, 32, 64]
    - [74, 26.9]
  - - [3136, 64, 32, 256]
    - [64, 52.336]
  - - [784, 512, 32, 128]
    - [63, 49.002]
  - - [784, 128, 32, 512]
    - [65, 60.817]
  - - [196, 1024, 32, 256]
    - [66, 48.692]
  - - [196, 256, 32, 1024]
    - [67, 42.8]
  - - [49, 2048, 32, 512]
    - [70, 35.577]
  - - [49, 512, 32, 2048]
    - [71, 32.983]
  - - [3136, 128, 64, 64]
    - [255, 44.535]
  - - [3136, 256, 64, 128]
    - [233, 72.112]
  - - [784, 512, 64, 256]
    - [169, 70.743]
  - - [3136, 128, 64, 256]
    - [230, 74.197]
  - - [3136, 256, 64, 256]
    - [125, 79.007]
  - - [196, 1024, 64, 512]
    - [282, 61.088]
  - - [784, 256, 64, 512]
    - [107, 75.425]
  - - [784, 512, 64, 512]
    - [129, 79.621]
  - - [196, 512, 64, 1024]
    - [72, 62.231]
  - - [196, 1024, 64, 1024]
    - [108, 65.615]
  - - [49, 2048, 64, 1024]
    - [283, 48.577]
  - - [49, 1024, 64, 2048]
    - [284, 47.527]
  - - [3136, 128, 32, 64]
    - [255, 39.862]
  - - [3136, 256, 32, 128]
    - [229, 63.581]
  - - [784, 512, 32, 256]
    - [169, 67.485]
  - - [3136, 128, 32, 256]
    - [230, 70.099]
  - - [3136, 256, 32, 256]
    - [229, 76.078]
  - - [196, 1024, 32, 512]
    - [282, 58.282]
  - - [784, 256, 32, 512]
    - [174, 71.483]
  - - [784, 512, 32, 512]
    - [244, 76.598]
  - - [196, 512, 32, 1024]
    - [60, 54.178]
  - - [196, 1024, 32, 1024]
    - [282, 63.812]
  - - [49, 2048, 32, 1024]
    - [285, 43.806]
  - - [49, 1024, 32, 2048]
    - [286, 40.174]
  - - [64, 128, 624, 128]
    - [137, 31.242]
  - - [1024, 10, 1, 1024]
    - [130, 1.677]
  - - [2048, 2048, 1, 2048]
    - [116, 86.765]
  - - [1024, 10, 1, 2]
    - [51, 0.007]
  - - [1024, 5, 1, 2]
    - [159, 0.003]
  - - [1024, 5, 1, 1024]
    - [160, 0.846]
  - - [64, 512, 16, 512]
    - [118, 29.906]
  - - [1024, 1024, 1, 1024]
    - [21, 54.463]
  - - [1024, 9600, 1, 4096]
    - [180, 95.433]
  - - [1024, 8192, 1, 1024]
    - [178, 85.156]
  - - [1024, 1280, 1, 4096]
    - [136, 78.504]
  - - [512, 512, 1, 512]
    - [117, 21.111]
  - - [1024, 1152, 1, 1024]
    - [26, 57.676]
  - - [1024, 5248, 1, 2]
    - [156, 1.124]
  - - [1024, 820, 1, 1024]
    - [154, 52.765]
  - - [4096, 1152, 1, 1024]
    - [174, 80.103]
  - - [1024, 308, 1, 30522]
    - [145, 75.671]
  - - [1024, 39, 1, 1024]
    - [138, 5.843]
  - - [1024, 616, 1, 1024]
    - [124, 41.689]
  - - [64, 512, 96, 512]
    - [129, 53.639]
  - - [1024, 39, 1, 2]
    - [28, 0.028]
  - - [128, 128, 1, 64]
    - [193, 0.409]
  - - [1024, 160, 1, 30522]
    - [168, 72.669]
  - - [1024, 2560, 1, 1024]
    - [157, 73.453]
  - - [4096, 9600, 1, 1024]
    - [89, 92.595]
  - - [1024, 8, 1, 2]
    - [30, 0.006]
  - - [1024, 800, 1, 1024]
    - [128, 50.977]
  - - [64, 128, 640, 128]
    - [134, 31.718]
  - - [4096, 1024, 1, 1024]
    - [31, 80.307]
  - - [1024, 8, 1, 1024]
    - [121, 1.39]
  - - [1024, 1024, 1, 2]
    - [133, 0.545]
  - - [4096, 5248, 1, 1024]
    - [78, 90.071]
  - - [4096, 4096, 1, 4096]
    - [115, 92.002]
  - - [1024, 77, 1, 30522]
    - [122, 54.009]
  - - [1024, 9, 1, 2]
    - [170, 0.006]
  - - [1024, 1024, 1, 4096]
    - [41, 69.78]
  - - [1024, 9, 1, 1024]
    - [143, 1.497]
  - - [1024, 780, 1, 1024]
    - [139, 50.859]
  - - [64, 4, 38400, 4]
    - [177, 0.271]
  - - [1024, 4096, 1, 2]
    - [125, 1.047]
  - - [4096, 2560, 1, 1024]
    - [25, 84.37]
  - - [64, 128, 144, 128]
    - [169, 22.791]
  - - [1024, 780, 1, 30522]
    - [140, 88.633]
  - - [8192, 7680, 1, 8192]
    - [77, 98.227]
  - - [1024, 3072, 1, 2]
    - [134, 0.942]
  - - [8192, 8192, 1, 8192]
    - [78, 96.611]
  - - [1024, 180, 1, 1024]
    - [171, 22.358]
  - - [1024, 180, 1, 30522]
    - [172, 68.508]
  - - [1024, 512, 1, 2]
    - [123, 0.344]
  - - [1024, 8192, 1, 4096]
    - [80, 90.757]
  - - [1024, 385, 1, 30522]
    - [162, 76.866]
  - - [4096, 512, 1, 1024]
    - [126, 67.102]
  - - [1024, 160, 1, 1024]
    - [55, 20.524]
  - - [1024, 5120, 1, 4096]
    - [82, 85.92]
  - - [2048, 1920, 1, 2048]
    - [112, 92.131]
  - - [1024, 462, 1, 1024]
    - [39, 35.418]
  - - [1024, 462, 1, 30522]
    - [166, 84.695]
  - - [1024, 77, 1, 1024]
    - [33, 10.872]
  - - [960, 1024, 1, 1024]
    - [110, 73.027]
  - - [1024, 40, 1, 2]
    - [28, 0.028]
  - - [64, 5, 1, 5]
    - [120, 0.0]
  - - [1024, 40, 1, 1024]
    - [149, 5.947]
  - - [4096, 5120, 1, 1024]
    - [152, 88.338]
  - - [1024, 200, 1, 30522]
    - [132, 61.223]
  - - [1024, 41, 1, 2]
    - [35, 0.028]
  - - [1024, 200, 1, 1024]
    - [131, 22.559]
  - - [4096, 8192, 1, 1024]
    - [88, 90.718]
  - - [1024, 41, 1, 1024]
    - [153, 6.19]
  - - [1024, 4992, 1, 4096]
    - [82, 84.897]
  - - [4096, 1280, 1, 1024]
    - [78, 78.688]
  - - [1024, 2560, 1, 4096]
    - [164, 82.771]
  - - [1024, 4992, 1, 2]
    - [127, 1.25]
  - - [32, 33, 1, 33]
    - [37, 0.01]
  - - [7680, 8192, 1, 8192]
    - [75, 98.453]
  - - [4096, 3072, 1, 1024]
    - [85, 87.983]
  - - [1024, 9600, 1, 1024]
    - [179, 88.704]
  - - [1024, 385, 1, 1024]
    - [161, 38.55]
  - - [64, 4, 32768, 4]
    - [177, 0.27]
  - - [64, 128, 656, 128]
    - [128, 32.268]
  - - [64, 512, 128, 512]
    - [119, 52.268]
  - - [1024, 4992, 1, 1024]
    - [141, 78.63]
  - - [1024, 1152, 1, 2]
    - [173, 0.605]
  - - [1024, 5248, 1, 4096]
    - [29, 86.57]
  - - [1024, 9600, 1, 33712]
    - [179, 97.574]
  - - [1024, 3072, 1, 4096]
    - [82, 84.917]
  - - [4096, 3840, 1, 4096]
    - [75, 97.456]
  - - [1024, 6, 1, 1024]
    - [121, 1.101]
  - - [1024, 5120, 1, 1024]
    - [151, 78.258]
  - - [1024, 8192, 1, 33712]
    - [80, 92.582]
  - - [1024, 308, 1, 1024]
    - [144, 31.158]
  - - [3840, 4096, 1, 4096]
    - [76, 97.55]
  - - [1024, 2560, 1, 2]
    - [163, 0.876]
  - - [1024, 6, 1, 2]
    - [165, 0.004]
  - - [64, 128, 160, 128]
    - [129, 24.922]
  - - [1024, 512, 1, 4096]
    - [57, 54.389]
  - - [64, 128, 128, 128]
    - [128, 20.761]
  - - [1024, 5248, 1, 1024]
    - [157, 80.028]
  - - [1024, 820, 1, 30522]
    - [155, 84.243]
  - - [1024, 1280, 1, 2]
    - [134, 0.672]
  - - [1024, 1280, 1, 1024]
    - [135, 64.084]
  - - [1920, 2048, 1, 2048]
    - [109, 92.528]
  - - [1024, 3072, 1, 1024]
    - [167, 74.617]
  - - [1024, 800, 1, 30522]
    - [140, 90.554]
  - - [64, 128, 1, 128]
    - [194, 0.377]
  - - [64, 512, 80, 512]
    - [158, 51.69]
  - - [480, 512, 1, 512]
    - [111, 22.646]
  - - [512, 480, 1, 512]
    - [114, 22.646]
  - - [4096, 4992, 1, 1024]
    - [83, 90.947]
  - - [479, 32768, 1, 1024]
    - [106, 81.129]
  - - [1024, 1152, 1, 4096]
    - [49, 78.504]
  - - [1024, 5120, 1, 2]
    - [150, 1.243]
  - - [1024, 1024, 64, 64]
    - [229, 55.864]
  - - [64, 1024, 32, 1024]
    - [234, 52.404]
  - - [1024, 16384, 1, 3072]
    - [85, 91.074]
  - - [1024, 2048, 1, 30592]
    - [86, 89.946]
  - - [640, 2048, 1, 2560]
    - [228, 78.601]
  - - [1024, 1024, 64, 96]
    - [231, 70.351]
  - - [2048, 2, 1, 2048]
    - [226, 1.129]
  - - [2048, 2, 1, 2]
    - [225, 0.003]
  - - [1536, 4096, 1, 4608]
    - [79, 89.584]
  - - [512, 512, 256, 64]
    - [125, 56.891]
  - - [2048, 1024, 1, 8192]
    - [224, 87.118]
  - - [4096, 16384, 1, 1024]
    - [93, 93.047]
  - - [1024, 8192, 1, 50304]
    - [104, 92.721]
  - - [1536, 8192, 1, 50304]
    - [101, 95.659]
  - - [6144, 8192, 1, 1536]
    - [79, 95.165]
  - - [1024, 4096, 1, 30592]
    - [40, 92.103]
  - - [1536, 4096, 1, 6144]
    - [94, 90.436]
  - - [1024, 16384, 1, 4096]
    - [115, 92.022]
  - - [1024, 16384, 1, 50304]
    - [102, 95.813]
  - - [1024, 4096, 1, 3072]
    - [29, 87.951]
  - - [1536, 8192, 1, 1536]
    - [230, 90.64]
  - - [1024, 2048, 1, 3072]
    - [116, 84.917]
  - - [2560, 2048, 1, 7680]
    - [99, 88.496]
  - - [96, 1024, 64, 1024]
    - [167, 76.902]
  - - [2048, 1024, 1, 2048]
    - [223, 80.955]
  - - [2048, 1024, 1, 30592]
    - [98, 88.593]
  - - [64, 1024, 256, 1024]
    - [139, 69.948]
  - - [8192, 1024, 1, 2048]
    - [78, 88.217]
  - - [2560, 2048, 1, 2560]
    - [200, 85.041]
  - - [1536, 8192, 1, 4608]
    - [100, 93.369]
  - - [64, 512, 256, 512]
    - [173, 58.634]
  - - [1024, 2048, 1, 50304]
    - [79, 90.637]
  - - [1024, 1024, 32, 64]
    - [233, 52.956]
  - - [1536, 8192, 1, 6144]
    - [100, 93.667]
  - - [1024, 1024, 256, 64]
    - [229, 58.699]
  - - [512, 512, 40, 64]
    - [229, 40.388]
  - - [1536, 4096, 1, 50304]
    - [79, 92.186]
  - - [1024, 1024, 128, 96]
    - [231, 73.39]
  - - [1024, 8192, 1, 3072]
    - [29, 90.069]
  - - [64, 1024, 64, 1024]
    - [235, 62.219]
  - - [1024, 1024, 128, 64]
    - [229, 57.875]
  - - [64, 1024, 128, 1024]
    - [139, 68.795]
  - - [1024, 4096, 1, 50304]
    - [103, 92.544]
  - - [96, 1024, 128, 1024]
    - [232, 81.254]
  - - [6144, 4096, 1, 1536]
    - [56, 91.719]
  - - [1024, 16, 1, 2]
    - [28, 0.012]
  - - [1024, 16, 1, 1024]
    - [121, 2.661]
  - - [2560, 4, 1, 2]
    - [120, 0.006]
  - - [1024, 16384, 1, 1024]
    - [50, 87.639]
  - - [2560, 2048, 1, 1920]
    - [227, 83.589]
  - - [2048, 1024, 1, 6144]
    - [223, 86.16]
  - - [2560, 4, 1, 2560]
    - [121, 2.887]
  - - [512, 512, 128, 64]
    - [125, 53.308]
  - - [1024, 8192, 1, 30592]
    - [79, 92.799]
  - - [1536, 4096, 1, 1536]
    - [230, 83.815]
  - - [64, 512, 40, 512]
    - [129, 46.693]
  - - [1024, 1, 1, 2]
    - [120, 0.0]
  - - [1024, 1, 1, 1024]
    - [121, 0.166]
  - - [1024, 1, 1, 200]
    - [207, 0.04]
  - - [1024, 1, 1, 1600]
    - [208, 0.286]
  - - [2048, 1, 1, 512]
    - [219, 0.207]
  - - [128, 128, 1024, 64]
    - [236, 37.634]
  - - [64, 128, 1024, 128]
    - [237, 33.606]
  - - [1024, 64, 1, 2]
    - [120, 0.037]
  - - [1024, 8192, 1, 30528]
    - [80, 92.851]
  - - [1024, 64, 1, 1024]
    - [238, 9.168]
  - - [1024, 3456, 1, 1024]
    - [239, 77.517]
  - - [1024, 3456, 1, 512]
    - [174, 69.638]
  - - [1024, 4096, 1, 512]
    - [240, 69.661]
  - - [1024, 6912, 1, 1024]
    - [80, 86.57]
  - - [1024, 6912, 1, 512]
    - [141, 79.796]
  - - [1024, 864, 1, 1024]
    - [241, 60.777]
  - - [1024, 864, 1, 512]
    - [242, 42.393]
  - - [256, 3456, 1, 128]
    - [243, 26.167]
  - - [256, 4096, 1, 128]
    - [129, 23.26]
  - - [256, 55296, 1, 128]
    - [216, 63.036]
  - - [256, 6912, 1, 128]
    - [244, 36.863]
  - - [256, 864, 1, 128]
    - [245, 8.547]
  - - [480, 3456, 1, 1024]
    - [246, 68.967]
  - - [480, 4096, 1, 1024]
    - [167, 67.289]
  - - [480, 6912, 1, 1024]
    - [247, 80.187]
  - - [480, 864, 1, 1024]
    - [248, 39.742]
  - - [512, 3456, 1, 256]
    - [157, 50.168]
  - - [512, 4096, 1, 256]
    - [176, 46.955]
  - - [512, 55296, 1, 256]
    - [214, 80.316]
  - - [512, 6912, 1, 256]
    - [169, 60.13]
  - - [512, 864, 1, 256]
    - [249, 23.552]
  - - [1024, 640, 1, 30528]
    - [250, 91.087]
  - - [1024, 1280, 1, 30528]
    - [251, 93.266]
  - - [1024, 1600, 1, 30528]
    - [252, 93.494]
  - - [1024, 10240, 1, 1024]
    - [129, 86.104]
  - - [1024, 10240, 1, 4096]
    - [79, 90.659]
  - - [4096, 10240, 1, 1024]
    - [76, 92.687]
  - - [1024, 80, 1, 1024]
    - [253, 11.136]
  - - [1024, 80, 1, 2]
    - [254, 0.051]
  - - [128, 128, 1280, 64]
    - [255, 39.498]
  - - [64, 128, 1280, 128]
    - [256, 34.225]
  - - [1024, 1640, 1, 30528]
    - [105, 82.942]
  - - [1024, 10496, 1, 1024]
    - [116, 85.652]
  - - [1024, 10496, 1, 4096]
    - [79, 92.832]
  - - [4096, 10496, 1, 1024]
    - [76, 94.513]
  - - [1024, 82, 1, 1024]
    - [257, 11.254]
  - - [1024, 82, 1, 2]
    - [258, 0.063]
  - - [128, 128, 1312, 64]
    - [190, 39.432]
  - - [64, 128, 1312, 128]
    - [237, 34.15]
  - - [1024, 160, 1, 30528]
    - [168, 75.741]
  - - [1024, 240, 1, 30528]
    - [259, 75.012]
  - - [1024, 6144, 1, 4096]
    - [79, 89.237]
  - - [1024, 12, 1, 1024]
    - [130, 1.947]
  - - [4096, 6144, 1, 1024]
    - [78, 89.518]
  - - [1024, 6144, 1, 1024]
    - [157, 80.765]
  - - [1024, 12, 1, 2]
    - [142, 0.007]
  - - [512, 512, 192, 64]
    - [125, 54.96]
  - - [64, 512, 192, 512]
    - [137, 56.399]
  - - [256, 4096, 1, 1]
    - [260, 0.255]
  - - [256, 6912, 1, 1]
    - [211, 0.413]
  - - [1024, 10224, 1, 1024]
    - [116, 86.826]
  - - [1024, 10192, 1, 1024]
    - [129, 85.372]
  - - [1024, 10208, 1, 1024]
    - [129, 85.288]
  - - [1024, 10224, 1, 4096]
    - [116, 90.866]
  - - [1024, 10224, 1, 3072]
    - [116, 90.345]
  - - [4096, 10224, 1, 1024]
    - [190, 93.437]
  - - [1024, 10240, 1, 3072]
    - [129, 89.584]
  - - [1024, 10192, 1, 3072]
    - [129, 89.298]
  - - [4096, 10192, 1, 1024]
    - [190, 92.392]
  - - [1024, 10192, 1, 4096]
    - [265, 89.638]
  - - [1024, 10200, 1, 3072]
    - [129, 89.568]
  - - [1024, 10184, 1, 1024]
    - [129, 84.835]
  - - [4096, 10208, 1, 1024]
    - [255, 92.408]
  - - [1024, 10208, 1, 3072]
    - [129, 89.478]
  - - [1024, 10208, 1, 4096]
    - [265, 89.648]
  - - [1024, 10224, 1, 2048]
    - [116, 89.439]
  - - [1024, 10240, 1, 2048]
    - [116, 87.682]
  - - [1024, 10120, 1, 1024]
    - [129, 85.095]
  - - [1024, 10192, 1, 2048]
    - [129, 87.347]
  - - [64, 24, 6816, 24]
    - [199, 5.208]
  - - [1024, 10152, 1, 1024]
    - [129, 85.696]
  - - [1024, 10080, 1, 3072]
    - [141, 92.501]
  - - [64, 26, 6272, 26]
    - [199, 5.706]
  - - [100352, 512, 1, 256]
    - [125, 81.41]
  - - [12544, 2048, 1, 1024]
    - [216, 90.08]
  - - [12544, 64, 1, 147]
    - [197, 18.407]
  - - [200704, 512, 1, 256]
    - [150, 84.805]
  - - [25088, 1024, 1, 512]
    - [185, 85.869]
  - - [3136, 64, 1, 576]
    - [266, 19.494]
  - - [50176, 1024, 1, 512]
    - [152, 87.007]
  - - [6272, 2048, 1, 1024]
    - [185, 88.747]
  - - [784, 128, 1, 1152]
    - [267, 13.96]
  - - [3136, 128, 128, 256]
    - [230, 76.101]
  - - [3136, 128, 256, 256]
    - [230, 77.198]
  - - [3136, 256, 128, 64]
    - [229, 56.387]
  - - [3136, 256, 256, 64]
    - [229, 58.393]
  - - [3136, 64, 128, 256]
    - [260, 60.907]
  - - [3136, 64, 256, 256]
    - [230, 62.803]
  - - [3136, 64, 128, 64]
    - [157, 36.766]
  - - [3136, 64, 256, 64]
    - [268, 39.077]
  - - [784, 128, 128, 512]
    - [269, 73.009]
  - - [784, 128, 256, 512]
    - [163, 75.704]
  - - [784, 256, 128, 512]
    - [129, 78.303]
  - - [784, 256, 256, 512]
    - [129, 80.308]
  - - [784, 512, 128, 128]
    - [233, 66.003]
  - - [784, 512, 256, 128]
    - [229, 68.082]
  - - [128, 128, 2048, 64]
    - [190, 42.175]
  - - [64, 128, 2048, 128]
    - [256, 35.319]
  - - [1024, 2560, 1, 30528]
    - [270, 93.359]
  - - [1024, 128, 1, 1024]
    - [253, 17.206]
  - - [1024, 128, 1, 2]
    - [201, 0.114]
  - - [128, 128, 1536, 64]
    - [236, 40.518]
  - - [64, 128, 1536, 128]
    - [271, 34.65]
  - - [1024, 12288, 1, 4096]
    - [127, 91.203]
  - - [1024, 12288, 1, 1024]
    - [185, 88.015]
  - - [4096, 12288, 1, 1024]
    - [233, 93.347]
  - - [1024, 1920, 1, 30528]
    - [220, 96.544]
  - - [1024, 96, 1, 1024]
    - [272, 13.458]
  - - [1024, 96, 1, 2]
    - [120, 0.06]
  - - [128, 128, 192, 64]
    - [151, 24.79]
  - - [64, 128, 192, 128]
    - [129, 28.12]
  - - [768, 2048, 1, 2]
    - [134, 0.795]
  - - [3072, 2048, 1, 768]
    - [116, 81.843]
  - - [768, 2048, 1, 3072]
    - [110, 72.176]
  - - [768, 2048, 1, 768]
    - [273, 62.629]
  - - [384, 384, 144, 64]
    - [127, 47.102]
  - - [64, 384, 144, 384]
    - [244, 51.384]
  - - [768, 4608, 1, 2]
    - [274, 1.104]
  - - [3072, 4608, 1, 768]
    - [141, 88.202]
  - - [768, 4608, 1, 3072]
    - [275, 84.924]
  - - [768, 4608, 1, 768]
    - [231, 75.925]
  - - [512, 512, 48, 64]
    - [255, 41.07]
  - - [64, 512, 48, 512]
    - [129, 54.415]
  - - [128, 128, 256, 64]
    - [169, 25.765]
  - - [64, 128, 256, 128]
    - [163, 26.443]
  - - [384, 384, 192, 64]
    - [276, 48.241]
  - - [64, 384, 192, 384]
    - [169, 50.093]
  - - [1024, 4608, 1, 2]
    - [116, 1.201]
  - - [4096, 4608, 1, 1024]
    - [189, 90.685]
  - - [1024, 4608, 1, 4096]
    - [188, 88.359]
  - - [1024, 4608, 1, 1024]
    - [181, 80.891]
  - - [8192, 1024, 1, 1024]
    - [135, 84.842]
  - - [8192, 4096, 1, 1024]
    - [216, 91.622]
  - - [16384, 16384, 1, 16384]
    - [277, 96.857]
  - - [196, 256, 1, 2304]
    - [302, 13.524]
  - - [49, 512, 1, 4608]
    - [303, 11.889]
  - - [196, 1024, 128, 256]
    - [304, 56.7]
  - - [196, 1024, 256, 256]
    - [304, 59.08]
  - - [196, 256, 128, 1024]
    - [305, 61.362]
  - - [196, 256, 256, 1024]
    - [305, 63.303]
  - - [196, 512, 128, 1024]
    - [305, 63.763]
  - - [196, 512, 256, 1024]
    - [304, 66.582]
  - - [49, 2048, 128, 512]
    - [306, 44.892]
  - - [49, 2048, 256, 512]
    - [307, 45.666]
  - - [49, 512, 128, 2048]
    - [308, 46.432]
  - - [49, 512, 256, 2048]
    - [309, 50.686]
  - - [1024, 1024, 160, 96]
    - [310, 74.212]
  - - [96, 1024, 160, 1024]
    - [311, 82.006]
  - - [1920, 16384, 1, 25216]
    - [312, 97.52]
  - - [3840, 16384, 1, 1920]
    - [313, 96.22]
  - - [1920, 16384, 1, 3840]
    - [314, 96.885]
  - - [960, 16384, 1, 1920]
    - [315, 92.751]
  - - [1920, 16384, 1, 2880]
    - [316, 96.604]
  - - [1024, 1024, 40, 96]
    - [317, 67.957]
  - - [96, 1024, 40, 1024]
    - [318, 71.98]
  - - [1920, 4096, 1, 25216]
    - [319, 97.044]
  - - [3840, 4096, 1, 1920]
    - [314, 95.06]
  - - [1920, 4096, 1, 3840]
    - [310, 95.948]
  - - [960, 4096, 1, 1920]
    - [320, 89.322]
  - - [1920, 4096, 1, 2880]
    - [310, 95.198]
  - - [1024, 1024, 80, 96]
    - [310, 71.604]
  - - [96, 1024, 80, 1024]
    - [321, 75.514]
  - - [1920, 8192, 1, 25216]
    - [319, 97.048]
  - - [3840, 8192, 1, 1920]
    - [314, 95.801]
  - - [1920, 8192, 1, 3840]
    - [316, 96.357]
  - - [960, 8192, 1, 1920]
    - [322, 91.107]
  - - [1920, 8192, 1, 2880]
    - [316, 96.083]
  - - [1024, 1024, 96, 96]
    - [310, 72.61]
  - - [96, 1024, 96, 1024]
    - [321, 79.609]
  - - [2304, 16384, 1, 12672]
    - [323, 95.689]
  - - [2304, 16384, 1, 2304]
    - [324, 94.263]
  - - [576, 16384, 1, 2304]
    - [325, 90.921]
  - - [2304, 16384, 1, 1728]
    - [326, 94.001]
  - - [1024, 1024, 24, 96]
    - [327, 62.89]
  - - [96, 1024, 24, 1024]
    - [328, 65.062]
  - - [2304, 4096, 1, 12672]
    - [329, 93.254]
  - - [2304, 4096, 1, 2304]
    - [330, 90.739]
  - - [576, 4096, 1, 2304]
    - [331, 76.728]
  - - [2304, 4096, 1, 1728]
    - [325, 90.409]
  - - [1024, 1024, 48, 96]
    - [327, 69.674]
  - - [96, 1024, 48, 1024]
    - [321, 71.321]
  - - [2304, 8192, 1, 12672]
    - [332, 95.527]
  - - [2304, 8192, 1, 2304]
    - [324, 93.522]
  - - [576, 8192, 1, 2304]
    - [325, 89.09]
  - - [2304, 8192, 1, 1728]
    - [332, 93.212]
  - - [1024, 1024, 16, 96]
    - [333, 57.093]
  - - [96, 1024, 16, 1024]
    - [334, 55.517]
  - - [3072, 4096, 1, 6400]
    - [335, 94.364]
  - - [1536, 4096, 1, 3072]
    - [336, 87.504]
  - - [3072, 4096, 1, 1536]
    - [325, 91.465]
  - - [384, 4096, 1, 3072]
    - [330, 73.227]
  - - [3072, 4096, 1, 1152]
    - [325, 90.709]
  - - [1024, 1024, 32, 96]
    - [327, 66.254]
  - - [96, 1024, 32, 1024]
    - [337, 72.118]
  - - [3072, 8192, 1, 6400]
    - [338, 94.802]
  - - [1536, 8192, 1, 3072]
    - [325, 93.741]
  - - [3072, 8192, 1, 1536]
    - [325, 93.185]
  - - [384, 8192, 1, 3072]
    - [339, 84.718]
  - - [3072, 8192, 1, 1152]
    - [325, 92.407]
  - - [2048, 199, 1, 29000]
    - [340, 65.39]
  - - [2048, 221, 1, 29000]
    - [341, 71.686]
  - - [2048, 224, 1, 29000]
    - [342, 72.616]
  - - [2048, 229, 1, 29000]
    - [343, 74.302]
  - - [2048, 234, 1, 29000]
    - [343, 75.529]
  - - [2048, 242, 1, 29000]
    - [344, 78.088]
  - - [2048, 246, 1, 29000]
    - [345, 79.401]
  - - [2048, 247, 1, 29000]
    - [342, 79.817]
  - - [2048, 256, 1, 29000]
    - [342, 82.105]
  - - [2048, 262, 1, 29000]
    - [346, 80.254]
  - - [2048, 264, 1, 29000]
    - [346, 80.846]
  - - [2048, 265, 1, 29000]
    - [346, 81.084]
  - - [2048, 274, 1, 29000]
    - [347, 83.768]
  - - [2048, 277, 1, 29000]
    - [348, 84.339]
  - - [2048, 279, 1, 29000]
    - [349, 85.227]
  - - [2048, 288, 1, 29000]
    - [347, 87.952]
  - - [2048, 296, 1, 29000]
    - [350, 79.172]
  - - [2048, 315, 1, 29000]
    - [350, 83.273]
  - - [2048, 335, 1, 29000]
    - [351, 78.73]
  - - [2048, 4096, 1, 2048]
    - [326, 88.508]
  - - [2048, 4096, 1, 4096]
    - [352, 90.757]
  - - [2048, 8, 1, 2]
    - [353, 0.01]
  - - [2048, 8, 1, 2048]
    - [354, 4.243]
  - - [4096, 4096, 1, 2048]
    - [326, 89.906]
  - - [1024, 2283, 1, 29000]
    - [355, 91.698]
  - - [1024, 2296, 1, 29000]
    - [355, 92.213]
  - - [1024, 2306, 1, 29000]
    - [355, 92.528]
  - - [1024, 2309, 1, 29000]
    - [355, 92.702]
  - - [1024, 2318, 1, 29000]
    - [355, 92.983]
  - - [1024, 2320, 1, 29000]
    - [355, 93.016]
  - - [1024, 2324, 1, 29000]
    - [355, 93.284]
  - - [1024, 2325, 1, 29000]
    - [355, 93.303]
  - - [1024, 2329, 1, 29000]
    - [355, 93.477]
  - - [1024, 2338, 1, 29000]
    - [355, 93.703]
  - - [1024, 2345, 1, 29000]
    - [355, 94.087]
  - - [1024, 2350, 1, 29000]
    - [355, 94.253]
  - - [1024, 2362, 1, 29000]
    - [355, 94.727]
  - - [1024, 2366, 1, 29000]
    - [355, 94.84]
  - - [1024, 2368, 1, 29000]
    - [355, 94.927]
  - - [1024, 2374, 1, 29000]
    - [355, 95.208]
  - - [1024, 2390, 1, 29000]
    - [356, 95.856]
  - - [512, 512, 320, 64]
    - [357, 56.834]
  - - [64, 512, 320, 512]
    - [358, 60.135]
  - - [1024, 20, 1, 1024]
    - [359, 3.243]
  - - [1024, 20, 1, 2]
    - [360, 0.012]
  - - [1024, 561, 1, 29000]
    - [361, 87.735]
  - - [1024, 574, 1, 29000]
    - [362, 89.566]
  - - [1024, 600, 1, 29000]
    - [363, 85.728]
  - - [1024, 608, 1, 29000]
    - [363, 86.715]
  - - [1024, 615, 1, 29000]
    - [363, 87.669]
  - - [1024, 622, 1, 29000]
    - [363, 88.328]
  - - [1024, 625, 1, 29000]
    - [364, 88.437]
  - - [1024, 626, 1, 29000]
    - [364, 88.533]
  - - [1024, 628, 1, 29000]
    - [363, 88.726]
  - - [1024, 636, 1, 29000]
    - [365, 89.47]
  - - [1024, 651, 1, 29000]
    - [366, 83.758]
  - - [1024, 658, 1, 29000]
    - [367, 84.697]
  - - [1024, 669, 1, 29000]
    - [368, 86.013]
  - - [1024, 670, 1, 29000]
    - [369, 86.163]
  - - [1024, 672, 1, 29000]
    - [366, 86.44]
  - - [1024, 684, 1, 29000]
    - [370, 84.709]
  - - [1024, 716, 1, 29000]
    - [371, 88.93]
  - - [1024, 730, 1, 29000]
    - [372, 85.98]
  - - [512, 512, 80, 64]
    - [373, 48.403]
  - - [2560, 1024, 1, 2560]
    - [374, 82.148]
  - - [2560, 1024, 1, 4096]
    - [374, 84.051]
  - - [2560, 109, 1, 29000]
    - [375, 73.882]
  - - [2560, 121, 1, 29000]
    - [376, 81.816]
  - - [2560, 2, 1, 2]
    - [377, 0.003]
  - - [2560, 2, 1, 2560]
    - [378, 1.524]
  - - [2560, 27, 1, 29000]
    - [379, 32.596]
  - - [2560, 35, 1, 29000]
    - [380, 39.443]
  - - [2560, 36, 1, 29000]
    - [381, 40.901]
  - - [2560, 39, 1, 29000]
    - [382, 42.941]
  - - [2560, 40, 1, 29000]
    - [382, 44.537]
  - - [2560, 42, 1, 29000]
    - [380, 45.989]
  - - [2560, 43, 1, 29000]
    - [383, 47.084]
  - - [2560, 44, 1, 29000]
    - [384, 48.066]
  - - [2560, 46, 1, 29000]
    - [384, 50.014]
  - - [2560, 48, 1, 29000]
    - [384, 52.107]
  - - [2560, 49, 1, 29000]
    - [382, 53.443]
  - - [2560, 50, 1, 29000]
    - [385, 54.705]
  - - [2560, 51, 1, 29000]
    - [386, 55.451]
  - - [2560, 53, 1, 29000]
    - [387, 56.737]
  - - [2560, 54, 1, 29000]
    - [388, 57.719]
  - - [2560, 55, 1, 29000]
    - [388, 58.562]
  - - [2560, 56, 1, 29000]
    - [389, 59.627]
  - - [2560, 57, 1, 29000]
    - [390, 60.925]
  - - [2560, 58, 1, 29000]
    - [391, 61.756]
  - - [2560, 59, 1, 29000]
    - [392, 63.749]
  - - [2560, 61, 1, 29000]
    - [393, 66.013]
  - - [2560, 63, 1, 29000]
    - [393, 68.497]
  - - [2560, 65, 1, 29000]
    - [394, 50.011]
  - - [2560, 66, 1, 29000]
    - [395, 50.893]
  - - [2560, 67, 1, 29000]
    - [395, 51.492]
  - - [2560, 69, 1, 29000]
    - [396, 53.325]
  - - [2560, 70, 1, 29000]
    - [348, 53.709]
  - - [2560, 71, 1, 29000]
    - [397, 54.177]
  - - [2560, 73, 1, 29000]
    - [398, 55.734]
  - - [2560, 74, 1, 29000]
    - [397, 57.093]
  - - [2560, 75, 1, 29000]
    - [397, 57.704]
  - - [2560, 77, 1, 29000]
    - [399, 58.982]
  - - [2560, 78, 1, 29000]
    - [400, 59.616]
  - - [2560, 80, 1, 29000]
    - [399, 61.045]
  - - [2560, 81, 1, 29000]
    - [401, 61.774]
  - - [2560, 82, 1, 29000]
    - [402, 62.605]
  - - [2560, 83, 1, 29000]
    - [403, 62.987]
  - - [2560, 84, 1, 29000]
    - [400, 63.643]
  - - [2560, 88, 1, 29000]
    - [399, 67.001]
  - - [2560, 89, 1, 29000]
    - [397, 67.689]
  - - [2560, 90, 1, 29000]
    - [403, 68.412]
  - - [2560, 92, 1, 29000]
    - [403, 69.971]
  - - [2560, 95, 1, 29000]
    - [401, 72.291]
  - - [2560, 98, 1, 29000]
    - [404, 66.949]
  - - [4096, 1024, 1, 2560]
    - [352, 86.476]
  - - [1024, 1024, 512, 64]
    - [314, 59.0]
  - - [64, 1024, 512, 1024]
    - [405, 74.684]
  - - [1024, 32768, 1, 3072]
    - [406, 94.847]
  - - [1024, 32768, 1, 4096]
    - [406, 95.193]
  - - [1024, 32768, 1, 50304]
    - [407, 96.104]
  - - [4096, 32768, 1, 1024]
    - [323, 94.31]
  - - [1024, 1024, 24, 128]
    - [408, 67.364]
  - - [128, 1024, 24, 1024]
    - [409, 70.268]
  - - [1909283, 40, 1, 40]
    - [410, 7.681]
  - - [3818566, 40, 1, 40]
    - [411, 7.708]
  - - [1909283, 11, 1, 11]
    - [412, 1.21]
  - - [3818566, 11, 1, 11]
    - [412, 1.225]
- null
