library/src/blas3/Tensile/Logic/aldebaran/arcturus_Cijk_Alik_Bljk_CB_GB.yaml
- {MinimumRequiredVersion: 4.26.0}
- arcturus
- gfx908
- [Device 7380, Device 7388, Device 738c, Device 7390]
    SolutionIndex: 0
    SolutionNameMin: Cijk_Alik_Bljk_CB_GB_MT32x32x16_MI16x16x4x1_SN_1LDSB0_EPS1_GRVW1_LBSPP128_LPA4_LPB4_PGR1_PLR5_SRVW1_TT1_16_WG32_8_1_WGM1
    SolutionIndex: 1
    SolutionNameMin: Cijk_Alik_Bljk_CB_GB_MT32x32x16_MI16x16x4x1_SN_1LDSB0_EPS0_GRVW1_LBSPP128_LPA4_LPB4_PGR2_PLR5_SRVW1_TT1_16_WG32_8_1_WGM1
    SolutionIndex: 2
    SolutionNameMin: Cijk_Alik_Bljk_CB_GB_MT32x32x16_MI16x16x4x1_SN_1LDSB0_EPS1_GRVW2_LBSPP128_LPA4_LPB4_PGR1_PLR5_SRVW1_TT1_16_WG32_8_1_WGM1
    SolutionIndex: 3
    SolutionNameMin: Cijk_Alik_Bljk_CB_GB_MT32x32x16_MI16x16x4x1_SN_1LDSB0_EPS0_GRVW2_LBSPP128_LPA4_LPB4_PGR2_PLR5_SRVW1_TT1_16_WG32_8_1_WGM1
    SolutionIndex: 4
    SolutionNameMin: Cijk_Alik_Bljk_CB_GB_MT32x32x32_MI16x16x4x1_SN_1LDSB0_EPS1_GRVW2_LBSPP256_LPA4_LPB4_PGR1_PLR9_SRVW1_TT1_16_WG32_8_1_WGM1
    SolutionIndex: 5
    SolutionNameMin: Cijk_Alik_Bljk_CB_GB_MT32x32x32_MI16x16x4x1_SN_1LDSB0_EPS0_GRVW2_LBSPP256_LPA4_LPB4_PGR2_PLR9_SRVW1_TT1_16_WG32_8_1_WGM1
    SolutionIndex: 6
    SolutionNameMin: Cijk_Alik_Bljk_CB_GB_MT32x32x32_MI16x16x4x1_SN_1LDSB0_EPS1_GRVW1_LBSPP256_LPA4_LPB4_PGR1_PLR9_SRVW1_TT1_16_WG32_8_1_WGM2
    SolutionIndex: 7
    SolutionNameMin: Cijk_Alik_Bljk_CB_GB_MT32x32x16_MI16x16x4x1_SN_1LDSB0_EPS1_GRVW2_LBSPP128_LPA4_LPB4_PGR1_PLR5_SRVW1_TT1_16_WG32_8_1_WGM2
    SolutionIndex: 8
    SolutionNameMin: Cijk_Alik_Bljk_CB_GB_MT32x32x32_MI16x16x4x1_SN_1LDSB0_EPS1_GRVW2_LBSPP256_LPA4_LPB4_PGR1_PLR9_SRVW1_TT1_16_WG32_8_1_WGM2
    SolutionIndex: 9
    SolutionNameMin: Cijk_Alik_Bljk_CB_GB_MT32x32x32_MI16x16x4x1_SN_1LDSB0_EPS0_GRVW2_LBSPP256_LPA4_LPB4_PGR2_PLR9_SRVW1_TT1_16_WG32_8_1_WGM2
    SolutionIndex: 10
    SolutionNameMin: Cijk_Alik_Bljk_CB_GB_MT32x32x16_MI16x16x4x1_SN_1LDSB0_EPS1_GRVW2_LBSPP128_LPA4_LPB4_PGR1_PLR5_SRVW1_TT1_16_WG32_8_1_WGM15
    SolutionIndex: 11
    SolutionNameMin: Cijk_Alik_Bljk_CB_GB_MT32x32x16_MI16x16x4x1_SN_1LDSB0_EPS0_GRVW2_LBSPP128_LPA4_LPB4_PGR2_PLR5_SRVW1_TT1_16_WG32_8_1_WGM15
    SolutionIndex: 12
    SolutionNameMin: Cijk_Alik_Bljk_CB_GB_MT32x32x32_MI16x16x4x1_SN_1LDSB0_EPS1_GRVW2_LBSPP256_LPA4_LPB4_PGR1_PLR9_SRVW1_TT1_16_WG32_8_1_WGM15
    SolutionIndex: 13
    SolutionNameMin: Cijk_Alik_Bljk_CB_GB_MT32x32x16_MI16x16x4x1_SN_1LDSB1_EPS1_GRVW1_LBSPP128_LPA4_LPB4_PGR1_PLR5_SRVW1_TT1_16_WG32_8_1_WGM1
    SolutionIndex: 14
    SolutionNameMin: Cijk_Alik_Bljk_CB_GB_MT64x32x16_MI16x16x4x1_SN_1LDSB1_EPS1_GRVW1_LBSPP128_LPA4_LPB4_PGR1_PLR5_SRVW1_TT2_16_WG32_8_1_WGM1
    SolutionIndex: 15
    SolutionNameMin: Cijk_Alik_Bljk_CB_GB_MT32x32x16_MI16x16x4x1_SN_1LDSB1_EPS0_GRVW1_LBSPP128_LPA4_LPB4_PGR2_PLR5_SRVW1_TT1_16_WG32_8_1_WGM1
    SolutionIndex: 16
    SolutionNameMin: Cijk_Alik_Bljk_CB_GB_MT32x32x32_MI16x16x4x1_SN_1LDSB1_EPS1_GRVW1_LBSPP256_LPA4_LPB4_PGR1_PLR9_SRVW1_TT1_16_WG32_8_1_WGM1
    SolutionIndex: 17
    SolutionNameMin: Cijk_Alik_Bljk_CB_GB_MT32x32x32_MI16x16x4x1_SN_1LDSB1_EPS0_GRVW1_LBSPP256_LPA4_LPB4_PGR2_PLR9_SRVW1_TT1_16_WG32_8_1_WGM1
    SolutionIndex: 18
    SolutionNameMin: Cijk_Alik_Bljk_CB_GB_MT32x32x16_MI16x16x4x1_SN_1LDSB1_EPS1_GRVW2_LBSPP128_LPA4_LPB4_PGR1_PLR5_SRVW1_TT1_16_WG32_8_1_WGM1
    SolutionIndex: 19
    SolutionNameMin: Cijk_Alik_Bljk_CB_GB_MT32x64x16_MI16x16x4x1_SN_1LDSB1_EPS1_GRVW2_LBSPP128_LPA4_LPB4_PGR1_PLR5_SRVW1_TT1_32_WG32_8_1_WGM1
    SolutionIndex: 20
    SolutionNameMin: Cijk_Alik_Bljk_CB_GB_MT64x32x16_MI16x16x4x1_SN_1LDSB1_EPS1_GRVW2_LBSPP128_LPA4_LPB4_PGR1_PLR5_SRVW1_TT2_16_WG32_8_1_WGM1
    SolutionIndex: 21
    SolutionNameMin: Cijk_Alik_Bljk_CB_GB_MT32x32x16_MI16x16x4x1_SN_1LDSB1_EPS0_GRVW2_LBSPP128_LPA4_LPB4_PGR2_PLR5_SRVW1_TT1_16_WG32_8_1_WGM1
    SolutionIndex: 22
    SolutionNameMin: Cijk_Alik_Bljk_CB_GB_MT64x32x16_MI16x16x4x1_SN_1LDSB1_EPS0_GRVW2_LBSPP128_LPA4_LPB4_PGR2_PLR5_SRVW1_TT2_16_WG32_8_1_WGM1
    SolutionIndex: 23
    SolutionNameMin: Cijk_Alik_Bljk_CB_GB_MT32x32x32_MI16x16x4x1_SN_1LDSB1_EPS1_GRVW2_LBSPP256_LPA4_LPB4_PGR1_PLR9_SRVW1_TT1_16_WG32_8_1_WGM1
    SolutionIndex: 24
    SolutionNameMin: Cijk_Alik_Bljk_CB_GB_MT32x32x32_MI16x16x4x1_SN_1LDSB1_EPS0_GRVW2_LBSPP256_LPA4_LPB4_PGR2_PLR9_SRVW1_TT1_16_WG32_8_1_WGM1
    SolutionIndex: 25
    SolutionNameMin: Cijk_Alik_Bljk_CB_GB_MT32x32x16_MI16x16x4x1_SN_1LDSB1_EPS1_GRVW1_LBSPP128_LPA4_LPB4_PGR1_PLR5_SRVW1_TT1_16_WG32_8_1_WGM2
    SolutionIndex: 26
    SolutionNameMin: Cijk_Alik_Bljk_CB_GB_MT32x32x16_MI16x16x4x1_SN_1LDSB1_EPS0_GRVW1_LBSPP128_LPA4_LPB4_PGR2_PLR5_SRVW1_TT1_16_WG32_8_1_WGM2
    SolutionIndex: 27
    SolutionNameMin: Cijk_Alik_Bljk_CB_GB_MT32x32x32_MI16x16x4x1_SN_1LDSB1_EPS1_GRVW1_LBSPP256_LPA4_LPB4_PGR1_PLR9_SRVW1_TT1_16_WG32_8_1_WGM2
    SolutionIndex: 28
    SolutionNameMin: Cijk_Alik_Bljk_CB_GB_MT32x32x32_MI16x16x4x1_SN_1LDSB1_EPS0_GRVW1_LBSPP256_LPA4_LPB4_PGR2_PLR9_SRVW1_TT1_16_WG32_8_1_WGM2
    SolutionIndex: 29
    SolutionNameMin: Cijk_Alik_Bljk_CB_GB_MT32x32x16_MI16x16x4x1_SN_1LDSB1_EPS1_GRVW2_LBSPP128_LPA4_LPB4_PGR1_PLR5_SRVW1_TT1_16_WG32_8_1_WGM2
    SolutionIndex: 30
    SolutionNameMin: Cijk_Alik_Bljk_CB_GB_MT64x32x16_MI16x16x4x1_SN_1LDSB1_EPS1_GRVW2_LBSPP128_LPA4_LPB4_PGR1_PLR5_SRVW1_TT2_16_WG32_8_1_WGM2
    SolutionIndex: 31
    SolutionNameMin: Cijk_Alik_Bljk_CB_GB_MT32x32x16_MI16x16x4x1_SN_1LDSB1_EPS0_GRVW2_LBSPP128_LPA4_LPB4_PGR2_PLR5_SRVW1_TT1_16_WG32_8_1_WGM2
    SolutionIndex: 32
    SolutionNameMin: Cijk_Alik_Bljk_CB_GB_MT32x32x32_MI16x16x4x1_SN_1LDSB1_EPS1_GRVW2_LBSPP256_LPA4_LPB4_PGR1_PLR9_SRVW1_TT1_16_WG32_8_1_WGM2
    SolutionIndex: 33
    SolutionNameMin: Cijk_Alik_Bljk_CB_GB_MT32x32x32_MI16x16x4x1_SN_1LDSB1_EPS0_GRVW2_LBSPP256_LPA4_LPB4_PGR2_PLR9_SRVW1_TT1_16_WG32_8_1_WGM2
    SolutionIndex: 34
    SolutionNameMin: Cijk_Alik_Bljk_CB_GB_MT32x32x16_MI16x16x4x1_SN_1LDSB1_EPS1_GRVW1_LBSPP128_LPA4_LPB4_PGR1_PLR5_SRVW1_TT1_16_WG32_8_1_WGM15
    SolutionIndex: 35
    SolutionNameMin: Cijk_Alik_Bljk_CB_GB_MT32x32x16_MI16x16x4x1_SN_1LDSB1_EPS0_GRVW1_LBSPP128_LPA4_LPB4_PGR2_PLR5_SRVW1_TT1_16_WG32_8_1_WGM15
    SolutionIndex: 36
    SolutionNameMin: Cijk_Alik_Bljk_CB_GB_MT32x64x16_MI16x16x4x1_SN_1LDSB1_EPS0_GRVW1_LBSPP128_LPA4_LPB4_PGR2_PLR5_SRVW1_TT1_32_WG32_8_1_WGM15
    SolutionIndex: 37
    SolutionNameMin: Cijk_Alik_Bljk_CB_GB_MT32x32x32_MI16x16x4x1_SN_1LDSB1_EPS1_GRVW1_LBSPP256_LPA4_LPB4_PGR1_PLR9_SRVW1_TT1_16_WG32_8_1_WGM15
    SolutionIndex: 38
    SolutionNameMin: Cijk_Alik_Bljk_CB_GB_MT32x32x16_MI16x16x4x1_SN_1LDSB1_EPS1_GRVW2_LBSPP128_LPA4_LPB4_PGR1_PLR5_SRVW1_TT1_16_WG32_8_1_WGM15
    SolutionIndex: 39
    SolutionNameMin: Cijk_Alik_Bljk_CB_GB_MT32x64x16_MI16x16x4x1_SN_1LDSB1_EPS1_GRVW2_LBSPP128_LPA4_LPB4_PGR1_PLR5_SRVW1_TT1_32_WG32_8_1_WGM15
    SolutionIndex: 40
    SolutionNameMin: Cijk_Alik_Bljk_CB_GB_MT64x32x16_MI16x16x4x1_SN_1LDSB1_EPS1_GRVW2_LBSPP128_LPA4_LPB4_PGR1_PLR5_SRVW1_TT2_16_WG32_8_1_WGM15
    SolutionIndex: 41
    SolutionNameMin: Cijk_Alik_Bljk_CB_GB_MT32x32x16_MI16x16x4x1_SN_1LDSB1_EPS0_GRVW2_LBSPP128_LPA4_LPB4_PGR2_PLR5_SRVW1_TT1_16_WG32_8_1_WGM15
    SolutionIndex: 42
    SolutionNameMin: Cijk_Alik_Bljk_CB_GB_MT64x32x16_MI16x16x4x1_SN_1LDSB1_EPS0_GRVW2_LBSPP128_LPA4_LPB4_PGR2_PLR5_SRVW1_TT2_16_WG32_8_1_WGM15
    SolutionIndex: 43
    SolutionNameMin: Cijk_Alik_Bljk_CB_GB_MT32x32x32_MI16x16x4x1_SN_1LDSB1_EPS1_GRVW2_LBSPP256_LPA4_LPB4_PGR1_PLR9_SRVW1_TT1_16_WG32_8_1_WGM15
    SolutionIndex: 44
    SolutionNameMin: Cijk_Alik_Bljk_CB_GB_MT64x32x32_MI16x16x4x1_SN_1LDSB1_EPS1_GRVW2_LBSPP256_LPA4_LPB4_PGR1_PLR9_SRVW1_TT2_16_WG32_8_1_WGM15
    SolutionIndex: 45
    SolutionNameMin: Cijk_Alik_Bljk_CB_GB_MT32x32x32_MI16x16x4x1_SN_1LDSB1_EPS0_GRVW2_LBSPP256_LPA4_LPB4_PGR2_PLR9_SRVW1_TT1_16_WG32_8_1_WGM15
    SolutionIndex: 46
    SolutionNameMin: Cijk_Alik_Bljk_CB_GB_MT32x32x8_MI32x32x2x1_SN_1LDSB0_EPS1_GRVW1_LBSPP128_LPA2_LPB2_PGR1_PLR5_SRVW1_TT1_32_WG32_2_1_WGM1
    SolutionIndex: 47
    SolutionNameMin: Cijk_Alik_Bljk_CB_GB_MT16x16x16_MI16x16x4x1_SN_1LDSB1_EPS1_GRVW1_LBSPP128_LPA4_LPB4_PGR1_PLR5_SRVW1_TT1_16_WG16_4_1_WGM1
    SolutionIndex: 48
    SolutionNameMin: Cijk_Alik_Bljk_CB_GB_MT16x32x16_MI16x16x4x1_SN_1LDSB1_EPS0_GRVW1_LBSPP128_LPA4_LPB4_PGR2_PLR5_SRVW1_TT1_16_WG16_8_1_WGM1
    SolutionIndex: 49
    SolutionNameMin: Cijk_Alik_Bljk_CB_GB_MT16x16x16_MI16x16x4x1_SN_1LDSB1_EPS1_GRVW2_LBSPP128_LPA4_LPB4_PGR1_PLR5_SRVW1_TT1_16_WG16_4_1_WGM1
    SolutionIndex: 50
    SolutionNameMin: Cijk_Alik_Bljk_CB_GB_MT16x32x16_MI16x16x4x1_SN_1LDSB1_EPS1_GRVW2_LBSPP128_LPA4_LPB4_PGR1_PLR5_SRVW1_TT1_16_WG16_8_1_WGM1
    SolutionIndex: 51
    SolutionNameMin: Cijk_Alik_Bljk_CB_GB_MT16x16x16_MI16x16x4x1_SN_1LDSB1_EPS0_GRVW2_LBSPP128_LPA4_LPB4_PGR2_PLR5_SRVW1_TT1_16_WG16_4_1_WGM1
    SolutionIndex: 52
    SolutionNameMin: Cijk_Alik_Bljk_CB_GB_MT16x32x16_MI16x16x4x1_SN_1LDSB1_EPS0_GRVW2_LBSPP128_LPA4_LPB4_PGR2_PLR5_SRVW1_TT1_16_WG16_8_1_WGM1
    SolutionIndex: 53
    SolutionNameMin: Cijk_Alik_Bljk_CB_GB_MT16x16x16_MI16x16x4x1_SN_1LDSB1_EPS1_GRVW1_LBSPP128_LPA4_LPB4_PGR1_PLR5_SRVW1_TT1_16_WG16_4_1_WGM2
    SolutionIndex: 54
    SolutionNameMin: Cijk_Alik_Bljk_CB_GB_MT16x16x16_MI16x16x4x1_SN_1LDSB1_EPS1_GRVW2_LBSPP128_LPA4_LPB4_PGR1_PLR5_SRVW1_TT1_16_WG16_4_1_WGM2
    SolutionIndex: 55
    SolutionNameMin: Cijk_Alik_Bljk_CB_GB_MT32x16x16_MI16x16x4x1_SN_1LDSB1_EPS0_GRVW1_LBSPP128_LPA4_LPB4_PGR2_PLR5_SRVW1_TT1_16_WG32_4_1_WGM15
    SolutionIndex: 56
    SolutionNameMin: Cijk_Alik_Bljk_CB_GB_MT32x16x16_MI16x16x4x1_SN_1LDSB1_EPS0_GRVW2_LBSPP128_LPA4_LPB4_PGR2_PLR5_SRVW1_TT1_16_WG32_4_1_WGM15
- - - [192, 192, 1000, 32, 192, 192, 32, 32]
    - [36, 4638.0]
  - - [1536, 1536, 168, 32, 1536, 1536, 32, 32]
    - [19, 4851.0]
  - - [1536, 32, 168, 1536, 1536, 1536, 1536, 1536]
    - [44, 6702.0]
  - - [32, 1536, 168, 32, 32, 32, 32, 32]
    - [26, 3521.0]
  - - [384, 384, 1024, 384, 384, 384, 384, 384]
    - [39, 7761.0]
  - - [1, 1, 1000, 1, 1, 1, 1, 1]
    - [46, 0.0]
  - - [2, 2, 1000, 2, 2, 2, 2, 2]
    - [47, 2.0]
  - - [3, 3, 1000, 3, 3, 3, 3, 3]
    - [47, 6.0]
  - - [4, 4, 1000, 4, 4, 4, 4, 4]
    - [47, 14.0]
  - - [5, 5, 1000, 5, 5, 5, 5, 5]
    - [47, 26.0]
  - - [6, 6, 1000, 6, 6, 6, 6, 6]
    - [47, 44.0]
  - - [7, 7, 1000, 7, 7, 7, 7, 7]
    - [54, 70.0]
  - - [8, 8, 1000, 8, 8, 8, 8, 8]
    - [49, 107.0]
  - - [9, 9, 1000, 9, 9, 9, 9, 9]
    - [47, 142.0]
  - - [10, 10, 1000, 10, 10, 10, 10, 10]
    - [51, 195.0]
  - - [11, 11, 1000, 11, 11, 11, 11, 11]
    - [49, 260.0]
  - - [12, 12, 1000, 12, 12, 12, 12, 12]
    - [53, 327.0]
  - - [13, 13, 1000, 13, 13, 13, 13, 13]
    - [53, 387.0]
  - - [14, 14, 1000, 14, 14, 14, 14, 14]
    - [47, 464.0]
  - - [15, 15, 1000, 15, 15, 15, 15, 15]
    - [51, 555.0]
  - - [16, 16, 1000, 16, 16, 16, 16, 16]
    - [49, 711.0]
  - - [17, 17, 1000, 17, 17, 17, 17, 17]
    - [13, 469.0]
  - - [18, 18, 1000, 18, 18, 18, 18, 18]
    - [29, 561.0]
  - - [19, 19, 1000, 19, 19, 19, 19, 19]
    - [34, 650.0]
  - - [20, 20, 1000, 20, 20, 20, 20, 20]
    - [38, 741.0]
  - - [21, 21, 1000, 21, 21, 21, 21, 21]
    - [13, 798.0]
  - - [22, 22, 1000, 22, 22, 22, 22, 22]
    - [15, 893.0]
  - - [23, 23, 1000, 23, 23, 23, 23, 23]
    - [25, 994.0]
  - - [24, 24, 1000, 24, 24, 24, 24, 24]
    - [18, 1137.0]
  - - [25, 25, 1000, 25, 25, 25, 25, 25]
    - [26, 1156.0]
  - - [26, 26, 1000, 26, 26, 26, 26, 26]
    - [26, 1263.0]
  - - [27, 27, 1000, 27, 27, 27, 27, 27]
    - [15, 1382.0]
  - - [28, 28, 1000, 28, 28, 28, 28, 28]
    - [15, 1533.0]
  - - [29, 29, 1000, 29, 29, 29, 29, 29]
    - [15, 1571.0]
  - - [30, 30, 1000, 30, 30, 30, 30, 30]
    - [26, 1740.0]
  - - [31, 31, 1000, 31, 31, 31, 31, 31]
    - [15, 1817.0]
  - - [32, 32, 1000, 32, 32, 32, 32, 32]
    - [35, 2101.0]
  - - [33, 33, 1000, 33, 33, 33, 33, 33]
    - [55, 1003.0]
  - - [34, 34, 1000, 34, 34, 34, 34, 34]
    - [52, 1099.0]
  - - [35, 35, 1000, 35, 35, 35, 35, 35]
    - [56, 1170.0]
  - - [36, 36, 1000, 36, 36, 36, 36, 36]
    - [52, 1311.0]
  - - [37, 37, 1000, 37, 37, 37, 37, 37]
    - [56, 1311.0]
  - - [38, 38, 1000, 38, 38, 38, 38, 38]
    - [56, 1414.0]
  - - [39, 39, 1000, 39, 39, 39, 39, 39]
    - [56, 1471.0]
  - - [40, 40, 1000, 40, 40, 40, 40, 40]
    - [51, 1843.0]
  - - [41, 41, 1000, 41, 41, 41, 41, 41]
    - [56, 1619.0]
  - - [42, 42, 1000, 42, 42, 42, 42, 42]
    - [48, 1751.0]
  - - [43, 43, 1000, 43, 43, 43, 43, 43]
    - [15, 1814.0]
  - - [44, 44, 1000, 44, 44, 44, 44, 44]
    - [56, 2068.0]
  - - [45, 45, 1000, 45, 45, 45, 45, 45]
    - [55, 1978.0]
  - - [46, 46, 1000, 46, 46, 46, 46, 46]
    - [56, 2146.0]
  - - [47, 47, 1000, 47, 47, 47, 47, 47]
    - [35, 2222.0]
  - - [48, 48, 1000, 48, 48, 48, 48, 48]
    - [50, 2850.0]
  - - [49, 49, 1000, 49, 49, 49, 49, 49]
    - [20, 2331.0]
  - - [50, 50, 1000, 50, 50, 50, 50, 50]
    - [20, 2476.0]
  - - [51, 51, 1000, 51, 51, 51, 51, 51]
    - [20, 2555.0]
  - - [52, 52, 1000, 52, 52, 52, 52, 52]
    - [22, 2817.0]
  - - [53, 53, 1000, 53, 53, 53, 53, 53]
    - [40, 2709.0]
  - - [54, 54, 1000, 54, 54, 54, 54, 54]
    - [22, 2873.0]
  - - [55, 55, 1000, 55, 55, 55, 55, 55]
    - [22, 2992.0]
  - - [56, 56, 1000, 56, 56, 56, 56, 56]
    - [18, 3393.0]
  - - [57, 57, 1000, 57, 57, 57, 57, 57]
    - [42, 3128.0]
  - - [58, 58, 1000, 58, 58, 58, 58, 58]
    - [22, 3332.0]
  - - [59, 59, 1000, 59, 59, 59, 59, 59]
    - [20, 3405.0]
  - - [60, 60, 1000, 60, 60, 60, 60, 60]
    - [22, 3595.0]
  - - [61, 61, 1000, 61, 61, 61, 61, 61]
    - [20, 3569.0]
  - - [62, 62, 1000, 62, 62, 62, 62, 62]
    - [20, 3757.0]
  - - [63, 63, 1000, 63, 63, 63, 63, 63]
    - [22, 3807.0]
  - - [64, 64, 1000, 64, 64, 64, 64, 64]
    - [17, 4317.0]
  - - [65, 65, 1000, 65, 65, 65, 65, 65]
    - [29, 2366.0]
  - - [66, 66, 1000, 66, 66, 66, 66, 66]
    - [18, 2513.0]
  - - [67, 67, 1000, 67, 67, 67, 67, 67]
    - [29, 2523.0]
  - - [68, 68, 1000, 68, 68, 68, 68, 68]
    - [18, 2778.0]
  - - [69, 69, 1000, 69, 69, 69, 69, 69]
    - [38, 2641.0]
  - - [70, 70, 1000, 70, 70, 70, 70, 70]
    - [29, 2821.0]
  - - [71, 71, 1000, 71, 71, 71, 71, 71]
    - [29, 2851.0]
  - - [72, 72, 1000, 72, 72, 72, 72, 72]
    - [18, 3185.0]
  - - [73, 73, 1000, 73, 73, 73, 73, 73]
    - [29, 2945.0]
  - - [74, 74, 1000, 74, 74, 74, 74, 74]
    - [18, 3117.0]
  - - [75, 75, 1000, 75, 75, 75, 75, 75]
    - [18, 3145.0]
  - - [76, 76, 1000, 76, 76, 76, 76, 76]
    - [29, 3447.0]
  - - [77, 77, 1000, 77, 77, 77, 77, 77]
    - [38, 3278.0]
  - - [78, 78, 1000, 78, 78, 78, 78, 78]
    - [38, 3453.0]
  - - [79, 79, 1000, 79, 79, 79, 79, 79]
    - [29, 3433.0]
  - - [80, 80, 1000, 80, 80, 80, 80, 80]
    - [18, 4342.0]
  - - [81, 81, 1000, 81, 81, 81, 81, 81]
    - [29, 3226.0]
  - - [82, 82, 1000, 82, 82, 82, 82, 82]
    - [18, 3443.0]
  - - [83, 83, 1000, 83, 83, 83, 83, 83]
    - [38, 3383.0]
  - - [84, 84, 1000, 84, 84, 84, 84, 84]
    - [18, 3835.0]
  - - [85, 85, 1000, 85, 85, 85, 85, 85]
    - [24, 3469.0]
  - - [86, 86, 1000, 86, 86, 86, 86, 86]
    - [25, 3666.0]
  - - [87, 87, 1000, 87, 87, 87, 87, 87]
    - [24, 3725.0]
  - - [88, 88, 1000, 88, 88, 88, 88, 88]
    - [29, 4868.0]
  - - [89, 89, 1000, 89, 89, 89, 89, 89]
    - [24, 3873.0]
  - - [90, 90, 1000, 90, 90, 90, 90, 90]
    - [29, 4110.0]
  - - [91, 91, 1000, 91, 91, 91, 91, 91]
    - [24, 4097.0]
  - - [92, 92, 1000, 92, 92, 92, 92, 92]
    - [38, 4576.0]
  - - [93, 93, 1000, 93, 93, 93, 93, 93]
    - [17, 4212.0]
  - - [94, 94, 1000, 94, 94, 94, 94, 94]
    - [41, 4388.0]
  - - [95, 95, 1000, 95, 95, 95, 95, 95]
    - [17, 4460.0]
  - - [96, 96, 1000, 96, 96, 96, 96, 96]
    - [38, 5745.0]
  - - [97, 97, 1000, 97, 97, 97, 97, 97]
    - [30, 3280.0]
  - - [98, 98, 1000, 98, 98, 98, 98, 98]
    - [30, 3399.0]
  - - [99, 99, 1000, 99, 99, 99, 99, 99]
    - [30, 3462.0]
  - - [100, 100, 1000, 100, 100, 100, 100, 100]
    - [30, 3698.0]
  - - [101, 101, 1000, 101, 101, 101, 101, 101]
    - [30, 3515.0]
  - - [102, 102, 1000, 102, 102, 102, 102, 102]
    - [30, 3618.0]
  - - [103, 103, 1000, 103, 103, 103, 103, 103]
    - [30, 3674.0]
  - - [104, 104, 1000, 104, 104, 104, 104, 104]
    - [30, 4138.0]
  - - [105, 105, 1000, 105, 105, 105, 105, 105]
    - [30, 3905.0]
  - - [106, 106, 1000, 106, 106, 106, 106, 106]
    - [30, 4051.0]
  - - [107, 107, 1000, 107, 107, 107, 107, 107]
    - [30, 4103.0]
  - - [108, 108, 1000, 108, 108, 108, 108, 108]
    - [30, 4373.0]
  - - [109, 109, 1000, 109, 109, 109, 109, 109]
    - [30, 4253.0]
  - - [110, 110, 1000, 110, 110, 110, 110, 110]
    - [30, 4404.0]
  - - [111, 111, 1000, 111, 111, 111, 111, 111]
    - [30, 4455.0]
  - - [112, 112, 1000, 112, 112, 112, 112, 112]
    - [20, 5090.0]
  - - [113, 113, 1000, 113, 113, 113, 113, 113]
    - [30, 4327.0]
  - - [114, 114, 1000, 114, 114, 114, 114, 114]
    - [30, 4499.0]
  - - [115, 115, 1000, 115, 115, 115, 115, 115]
    - [30, 4557.0]
  - - [116, 116, 1000, 116, 116, 116, 116, 116]
    - [30, 4957.0]
  - - [117, 117, 1000, 117, 117, 117, 117, 117]
    - [30, 4728.0]
  - - [118, 118, 1000, 118, 118, 118, 118, 118]
    - [30, 4924.0]
  - - [119, 119, 1000, 119, 119, 119, 119, 119]
    - [30, 4918.0]
  - - [120, 120, 1000, 120, 120, 120, 120, 120]
    - [30, 5533.0]
  - - [121, 121, 1000, 121, 121, 121, 121, 121]
    - [30, 5027.0]
  - - [122, 122, 1000, 122, 122, 122, 122, 122]
    - [30, 5249.0]
  - - [123, 123, 1000, 123, 123, 123, 123, 123]
    - [30, 5226.0]
  - - [124, 124, 1000, 124, 124, 124, 124, 124]
    - [40, 5661.0]
  - - [125, 125, 1000, 125, 125, 125, 125, 125]
    - [40, 5336.0]
  - - [126, 126, 1000, 126, 126, 126, 126, 126]
    - [40, 5499.0]
  - - [127, 127, 1000, 127, 127, 127, 127, 127]
    - [30, 5444.0]
  - - [128, 128, 1000, 128, 128, 128, 128, 128]
    - [30, 6329.0]
  - - [129, 129, 1000, 129, 129, 129, 129, 129]
    - [18, 3473.0]
  - - [130, 130, 1000, 130, 130, 130, 130, 130]
    - [21, 3682.0]
  - - [131, 131, 1000, 131, 131, 131, 131, 131]
    - [20, 3637.0]
  - - [132, 132, 1000, 132, 132, 132, 132, 132]
    - [18, 4190.0]
  - - [133, 133, 1000, 133, 133, 133, 133, 133]
    - [29, 3731.0]
  - - [134, 134, 1000, 134, 134, 134, 134, 134]
    - [41, 3943.0]
  - - [135, 135, 1000, 135, 135, 135, 135, 135]
    - [20, 3869.0]
  - - [136, 136, 1000, 136, 136, 136, 136, 136]
    - [18, 4937.0]
  - - [137, 137, 1000, 137, 137, 137, 137, 137]
    - [21, 3938.0]
  - - [138, 138, 1000, 138, 138, 138, 138, 138]
    - [18, 4187.0]
  - - [139, 139, 1000, 139, 139, 139, 139, 139]
    - [20, 4097.0]
  - - [140, 140, 1000, 140, 140, 140, 140, 140]
    - [41, 4701.0]
  - - [141, 141, 1000, 141, 141, 141, 141, 141]
    - [24, 4189.0]
  - - [142, 142, 1000, 142, 142, 142, 142, 142]
    - [38, 4421.0]
  - - [143, 143, 1000, 143, 143, 143, 143, 143]
    - [40, 4333.0]
  - - [144, 144, 1000, 144, 144, 144, 144, 144]
    - [38, 5769.0]
  - - [145, 145, 1000, 145, 145, 145, 145, 145]
    - [20, 4360.0]
  - - [146, 146, 1000, 146, 146, 146, 146, 146]
    - [20, 4466.0]
  - - [147, 147, 1000, 147, 147, 147, 147, 147]
    - [20, 4476.0]
  - - [148, 148, 1000, 148, 148, 148, 148, 148]
    - [40, 4796.0]
  - - [149, 149, 1000, 149, 149, 149, 149, 149]
    - [20, 4642.0]
  - - [150, 150, 1000, 150, 150, 150, 150, 150]
    - [20, 4786.0]
  - - [32, 32, 8, 32, 32, 32, 32, 32]
    - [4, 48.0]
  - - [32, 32, 8, 64, 32, 32, 64, 64]
    - [24, 80.0]
  - - [32, 32, 8, 128, 32, 32, 128, 128]
    - [33, 130.0]
  - - [32, 32, 8, 256, 32, 32, 256, 256]
    - [23, 190.0]
  - - [32, 32, 8, 512, 32, 32, 512, 512]
    - [4, 248.0]
  - - [32, 32, 8, 1024, 32, 32, 1024, 1024]
    - [8, 297.0]
  - - [32, 32, 8, 2048, 32, 32, 2048, 2048]
    - [12, 330.0]
  - - [32, 64, 8, 32, 32, 32, 32, 32]
    - [6, 94.0]
  - - [32, 64, 8, 64, 32, 32, 64, 64]
    - [32, 164.0]
  - - [32, 64, 8, 128, 32, 32, 128, 128]
    - [43, 267.0]
  - - [32, 64, 8, 256, 32, 32, 256, 256]
    - [8, 383.0]
  - - [32, 64, 8, 512, 32, 32, 512, 512]
    - [4, 507.0]
  - - [32, 64, 8, 1024, 32, 32, 1024, 1024]
    - [4, 601.0]
  - - [32, 64, 8, 2048, 32, 32, 2048, 2048]
    - [4, 662.0]
  - - [32, 128, 8, 32, 32, 32, 32, 32]
    - [24, 190.0]
  - - [32, 128, 8, 64, 32, 32, 64, 64]
    - [32, 324.0]
  - - [32, 128, 8, 128, 32, 32, 128, 128]
    - [4, 524.0]
  - - [32, 128, 8, 256, 32, 32, 256, 256]
    - [9, 760.0]
  - - [32, 128, 8, 512, 32, 32, 512, 512]
    - [12, 1008.0]
  - - [32, 128, 8, 1024, 32, 32, 1024, 1024]
    - [23, 1202.0]
  - - [32, 128, 8, 2048, 32, 32, 2048, 2048]
    - [32, 1327.0]
  - - [32, 256, 8, 32, 32, 32, 32, 32]
    - [32, 380.0]
  - - [32, 256, 8, 64, 32, 32, 64, 64]
    - [5, 647.0]
  - - [32, 256, 8, 128, 32, 32, 128, 128]
    - [21, 1038.0]
  - - [32, 256, 8, 256, 32, 32, 256, 256]
    - [32, 1520.0]
  - - [32, 256, 8, 512, 32, 32, 512, 512]
    - [43, 2016.0]
  - - [32, 256, 8, 1024, 32, 32, 1024, 1024]
    - [4, 2404.0]
  - - [32, 256, 8, 2048, 32, 32, 2048, 2048]
    - [12, 2676.0]
  - - [32, 512, 8, 32, 32, 32, 32, 32]
    - [23, 771.0]
  - - [32, 512, 8, 64, 32, 32, 64, 64]
    - [1, 1219.0]
  - - [32, 512, 8, 128, 32, 32, 128, 128]
    - [11, 1762.0]
  - - [32, 512, 8, 256, 32, 32, 256, 256]
    - [21, 2383.0]
  - - [32, 512, 8, 512, 32, 32, 512, 512]
    - [43, 2759.0]
  - - [32, 512, 8, 1024, 32, 32, 1024, 1024]
    - [41, 3034.0]
  - - [32, 512, 8, 2048, 32, 32, 2048, 2048]
    - [23, 3303.0]
  - - [32, 1024, 8, 32, 32, 32, 32, 32]
    - [33, 1327.0]
  - - [32, 1024, 8, 64, 32, 32, 64, 64]
    - [38, 1924.0]
  - - [32, 1024, 8, 128, 32, 32, 128, 128]
    - [38, 2689.0]
  - - [32, 1024, 8, 256, 32, 32, 256, 256]
    - [21, 3342.0]
  - - [32, 1024, 8, 512, 32, 32, 512, 512]
    - [27, 3779.0]
  - - [32, 1024, 8, 1024, 32, 32, 1024, 1024]
    - [43, 4127.0]
  - - [32, 1024, 8, 2048, 32, 32, 2048, 2048]
    - [23, 4492.0]
  - - [32, 2048, 8, 32, 32, 32, 32, 32]
    - [15, 1960.0]
  - - [32, 2048, 8, 64, 32, 32, 64, 64]
    - [13, 2621.0]
  - - [32, 2048, 8, 128, 32, 32, 128, 128]
    - [18, 3316.0]
  - - [32, 2048, 8, 256, 32, 32, 256, 256]
    - [33, 3957.0]
  - - [32, 2048, 8, 512, 32, 32, 512, 512]
    - [29, 4352.0]
  - - [32, 2048, 8, 1024, 32, 32, 1024, 1024]
    - [43, 4453.0]
  - - [32, 2048, 8, 2048, 32, 32, 2048, 2048]
    - [27, 5170.0]
  - - [64, 32, 8, 32, 64, 64, 32, 32]
    - [16, 95.0]
  - - [64, 32, 8, 64, 64, 64, 64, 64]
    - [32, 158.0]
  - - [64, 32, 8, 128, 64, 64, 128, 128]
    - [32, 262.0]
  - - [64, 32, 8, 256, 64, 64, 256, 256]
    - [33, 380.0]
  - - [64, 32, 8, 512, 64, 64, 512, 512]
    - [43, 502.0]
  - - [64, 32, 8, 1024, 64, 64, 1024, 1024]
    - [23, 601.0]
  - - [64, 32, 8, 2048, 64, 64, 2048, 2048]
    - [4, 658.0]
  - - [64, 64, 8, 32, 64, 64, 32, 32]
    - [32, 187.0]
  - - [64, 64, 8, 64, 64, 64, 64, 64]
    - [21, 320.0]
  - - [64, 64, 8, 128, 64, 64, 128, 128]
    - [29, 514.0]
  - - [64, 64, 8, 256, 64, 64, 256, 256]
    - [4, 749.0]
  - - [64, 64, 8, 512, 64, 64, 512, 512]
    - [23, 1013.0]
  - - [64, 64, 8, 1024, 64, 64, 1024, 1024]
    - [4, 1198.0]
  - - [64, 64, 8, 2048, 64, 64, 2048, 2048]
    - [32, 1319.0]
  - - [64, 128, 8, 32, 64, 64, 32, 32]
    - [32, 380.0]
  - - [64, 128, 8, 64, 64, 64, 64, 64]
    - [0, 624.0]
  - - [64, 128, 8, 128, 64, 64, 128, 128]
    - [3, 1018.0]
  - - [64, 128, 8, 256, 64, 64, 256, 256]
    - [8, 1553.0]
  - - [64, 128, 8, 512, 64, 64, 512, 512]
    - [23, 2046.0]
  - - [64, 128, 8, 1024, 64, 64, 1024, 1024]
    - [32, 2411.0]
  - - [64, 128, 8, 2048, 64, 64, 2048, 2048]
    - [12, 2676.0]
  - - [64, 256, 8, 32, 64, 64, 32, 32]
    - [3, 771.0]
  - - [64, 256, 8, 64, 64, 64, 64, 64]
    - [41, 1263.0]
  - - [64, 256, 8, 128, 64, 64, 128, 128]
    - [7, 1808.0]
  - - [64, 256, 8, 256, 64, 64, 256, 256]
    - [31, 2317.0]
  - - [64, 256, 8, 512, 64, 64, 512, 512]
    - [43, 2824.0]
  - - [64, 256, 8, 1024, 64, 64, 1024, 1024]
    - [43, 3124.0]
  - - [64, 256, 8, 2048, 64, 64, 2048, 2048]
    - [43, 3306.0]
  - - [64, 512, 8, 32, 64, 64, 32, 32]
    - [37, 1327.0]
  - - [64, 512, 8, 64, 64, 64, 64, 64]
    - [41, 1997.0]
  - - [64, 512, 8, 128, 64, 64, 128, 128]
    - [41, 2778.0]
  - - [64, 512, 8, 256, 64, 64, 256, 256]
    - [29, 3290.0]
  - - [64, 512, 8, 512, 64, 64, 512, 512]
    - [25, 3720.0]
  - - [64, 512, 8, 1024, 64, 64, 1024, 1024]
    - [41, 4097.0]
  - - [64, 512, 8, 2048, 64, 64, 2048, 2048]
    - [41, 4453.0]
  - - [64, 1024, 8, 32, 64, 64, 32, 32]
    - [26, 1960.0]
  - - [64, 1024, 8, 64, 64, 64, 64, 64]
    - [17, 2778.0]
  - - [64, 1024, 8, 128, 64, 64, 128, 128]
    - [29, 3663.0]
  - - [64, 1024, 8, 256, 64, 64, 256, 256]
    - [20, 4184.0]
  - - [64, 1024, 8, 512, 64, 64, 512, 512]
    - [40, 4596.0]
  - - [64, 1024, 8, 1024, 64, 64, 1024, 1024]
    - [32, 4807.0]
  - - [64, 1024, 8, 2048, 64, 64, 2048, 2048]
    - [43, 5375.0]
  - - [64, 2048, 8, 32, 64, 64, 32, 32]
    - [21, 2706.0]
  - - [64, 2048, 8, 64, 64, 64, 64, 64]
    - [29, 3712.0]
  - - [64, 2048, 8, 128, 64, 64, 128, 128]
    - [29, 4547.0]
  - - [64, 2048, 8, 256, 64, 64, 256, 256]
    - [30, 5227.0]
  - - [64, 2048, 8, 512, 64, 64, 512, 512]
    - [14, 5487.0]
  - - [64, 2048, 8, 1024, 64, 64, 1024, 1024]
    - [30, 5858.0]
  - - [64, 2048, 8, 2048, 64, 64, 2048, 2048]
    - [30, 6167.0]
  - - [128, 32, 8, 32, 128, 128, 32, 32]
    - [8, 187.0]
  - - [128, 32, 8, 64, 128, 128, 64, 64]
    - [38, 320.0]
  - - [128, 32, 8, 128, 128, 128, 128, 128]
    - [32, 519.0]
  - - [128, 32, 8, 256, 128, 128, 256, 256]
    - [24, 718.0]
  - - [128, 32, 8, 512, 128, 128, 512, 512]
    - [4, 1003.0]
  - - [128, 32, 8, 1024, 128, 128, 1024, 1024]
    - [12, 1198.0]
  - - [128, 32, 8, 2048, 128, 128, 2048, 2048]
    - [4, 1334.0]
  - - [128, 64, 8, 32, 128, 128, 32, 32]
    - [24, 369.0]
  - - [128, 64, 8, 64, 128, 128, 64, 64]
    - [38, 647.0]
  - - [128, 64, 8, 128, 128, 128, 128, 128]
    - [32, 1070.0]
  - - [128, 64, 8, 256, 128, 128, 256, 256]
    - [23, 1509.0]
  - - [128, 64, 8, 512, 128, 128, 512, 512]
    - [32, 2066.0]
  - - [128, 64, 8, 1024, 128, 128, 1024, 1024]
    - [4, 2404.0]
  - - [128, 64, 8, 2048, 128, 128, 2048, 2048]
    - [12, 2710.0]
  - - [128, 128, 8, 32, 128, 128, 32, 32]
    - [21, 794.0]
  - - [128, 128, 8, 64, 128, 128, 64, 64]
    - [21, 1263.0]
  - - [128, 128, 8, 128, 128, 128, 128, 128]
    - [10, 1808.0]
  - - [128, 128, 8, 256, 128, 128, 256, 256]
    - [32, 2305.0]
  - - [128, 128, 8, 512, 128, 128, 512, 512]
    - [7, 2715.0]
  - - [128, 128, 8, 1024, 128, 128, 1024, 1024]
    - [23, 3084.0]
  - - [128, 128, 8, 2048, 128, 128, 2048, 2048]
    - [43, 3239.0]
  - - [128, 256, 8, 32, 128, 128, 32, 32]
    - [45, 1344.0]
  - - [128, 256, 8, 64, 128, 128, 64, 64]
    - [25, 2016.0]
  - - [128, 256, 8, 128, 128, 128, 128, 128]
    - [18, 2778.0]
  - - [128, 256, 8, 256, 128, 128, 256, 256]
    - [31, 3342.0]
  - - [128, 256, 8, 512, 128, 128, 512, 512]
    - [31, 3704.0]
  - - [128, 256, 8, 1024, 128, 128, 1024, 1024]
    - [32, 4258.0]
  - - [128, 256, 8, 2048, 128, 128, 2048, 2048]
    - [18, 4395.0]
  - - [128, 512, 8, 32, 128, 128, 32, 32]
    - [26, 1978.0]
  - - [128, 512, 8, 64, 128, 128, 64, 64]
    - [28, 2796.0]
  - - [128, 512, 8, 128, 128, 128, 128, 128]
    - [29, 3728.0]
  - - [128, 512, 8, 256, 128, 128, 256, 256]
    - [33, 4194.0]
  - - [128, 512, 8, 512, 128, 128, 512, 512]
    - [16, 4870.0]
  - - [128, 512, 8, 1024, 128, 128, 1024, 1024]
    - [16, 5008.0]
  - - [128, 512, 8, 2048, 128, 128, 2048, 2048]
    - [18, 5373.0]
  - - [128, 1024, 8, 32, 128, 128, 32, 32]
    - [21, 2724.0]
  - - [128, 1024, 8, 64, 128, 128, 64, 64]
    - [29, 3848.0]
  - - [128, 1024, 8, 128, 128, 128, 128, 128]
    - [29, 4780.0]
  - - [128, 1024, 8, 256, 128, 128, 256, 256]
    - [30, 5326.0]
  - - [128, 1024, 8, 512, 128, 128, 512, 512]
    - [40, 5800.0]
  - - [128, 1024, 8, 1024, 128, 128, 1024, 1024]
    - [40, 6035.0]
  - - [128, 1024, 8, 2048, 128, 128, 2048, 2048]
    - [22, 6212.0]
  - - [128, 2048, 8, 32, 128, 128, 32, 32]
    - [31, 3396.0]
  - - [128, 2048, 8, 64, 128, 128, 64, 64]
    - [29, 4622.0]
  - - [128, 2048, 8, 128, 128, 128, 128, 128]
    - [40, 5292.0]
  - - [128, 2048, 8, 256, 128, 128, 256, 256]
    - [30, 6035.0]
  - - [128, 2048, 8, 512, 128, 128, 512, 512]
    - [30, 6443.0]
  - - [128, 2048, 8, 1024, 128, 128, 1024, 1024]
    - [42, 6612.0]
  - - [128, 2048, 8, 2048, 128, 128, 2048, 2048]
    - [40, 7122.0]
  - - [256, 32, 8, 32, 256, 256, 32, 32]
    - [32, 380.0]
  - - [256, 32, 8, 64, 256, 256, 64, 64]
    - [27, 624.0]
  - - [256, 32, 8, 128, 256, 256, 128, 128]
    - [21, 1008.0]
  - - [256, 32, 8, 256, 256, 256, 256, 256]
    - [45, 1477.0]
  - - [256, 32, 8, 512, 256, 256, 512, 512]
    - [32, 2066.0]
  - - [256, 32, 8, 1024, 256, 256, 1024, 1024]
    - [8, 2424.0]
  - - [256, 32, 8, 2048, 256, 256, 2048, 2048]
    - [12, 2724.0]
  - - [256, 64, 8, 32, 256, 256, 32, 32]
    - [27, 783.0]
  - - [256, 64, 8, 64, 256, 256, 64, 64]
    - [38, 1234.0]
  - - [256, 64, 8, 128, 256, 256, 128, 128]
    - [21, 1808.0]
  - - [256, 64, 8, 256, 256, 256, 256, 256]
    - [10, 2185.0]
  - - [256, 64, 8, 512, 256, 256, 512, 512]
    - [32, 2715.0]
  - - [256, 64, 8, 1024, 256, 256, 1024, 1024]
    - [43, 3107.0]
  - - [256, 64, 8, 2048, 256, 256, 2048, 2048]
    - [32, 3329.0]
  - - [256, 128, 8, 32, 256, 256, 32, 32]
    - [24, 1327.0]
  - - [256, 128, 8, 64, 256, 256, 64, 64]
    - [18, 2016.0]
  - - [256, 128, 8, 128, 256, 256, 128, 128]
    - [38, 2853.0]
  - - [256, 128, 8, 256, 256, 256, 256, 256]
    - [41, 3107.0]
  - - [256, 128, 8, 512, 256, 256, 512, 512]
    - [34, 3839.0]
  - - [256, 128, 8, 1024, 256, 256, 1024, 1024]
    - [34, 4189.0]
  - - [256, 128, 8, 2048, 256, 256, 2048, 2048]
    - [41, 4550.0]
  - - [256, 256, 8, 32, 256, 256, 32, 32]
    - [35, 1997.0]
  - - [256, 256, 8, 64, 256, 256, 64, 64]
    - [20, 2796.0]
  - - [256, 256, 8, 128, 256, 256, 128, 128]
    - [25, 3796.0]
  - - [256, 256, 8, 256, 256, 256, 256, 256]
    - [40, 4072.0]
  - - [256, 256, 8, 512, 256, 256, 512, 512]
    - [37, 4753.0]
  - - [256, 256, 8, 1024, 256, 256, 1024, 1024]
    - [27, 5123.0]
  - - [256, 256, 8, 2048, 256, 256, 2048, 2048]
    - [32, 5373.0]
  - - [256, 512, 8, 32, 256, 256, 32, 32]
    - [18, 2724.0]
  - - [256, 512, 8, 64, 256, 256, 64, 64]
    - [25, 3830.0]
  - - [256, 512, 8, 128, 256, 256, 128, 128]
    - [29, 4906.0]
  - - [256, 512, 8, 256, 256, 256, 256, 256]
    - [22, 5276.0]
  - - [256, 512, 8, 512, 256, 256, 512, 512]
    - [40, 5736.0]
  - - [256, 512, 8, 1024, 256, 256, 1024, 1024]
    - [30, 5987.0]
  - - [256, 512, 8, 2048, 256, 256, 2048, 2048]
    - [20, 6224.0]
  - - [256, 1024, 8, 32, 256, 256, 32, 32]
    - [15, 3342.0]
  - - [256, 1024, 8, 64, 256, 256, 64, 64]
    - [29, 4559.0]
  - - [256, 1024, 8, 128, 256, 256, 128, 128]
    - [29, 5546.0]
  - - [256, 1024, 8, 256, 256, 256, 256, 256]
    - [20, 6220.0]
  - - [256, 1024, 8, 512, 256, 256, 512, 512]
    - [40, 6651.0]
  - - [256, 1024, 8, 1024, 256, 256, 1024, 1024]
    - [40, 6846.0]
  - - [256, 1024, 8, 2048, 256, 256, 2048, 2048]
    - [30, 7123.0]
  - - [256, 2048, 8, 32, 256, 256, 32, 32]
    - [15, 3875.0]
  - - [256, 2048, 8, 64, 256, 256, 64, 64]
    - [18, 5154.0]
  - - [256, 2048, 8, 128, 256, 256, 128, 128]
    - [18, 6035.0]
  - - [256, 2048, 8, 256, 256, 256, 256, 256]
    - [30, 6641.0]
  - - [256, 2048, 8, 512, 256, 256, 512, 512]
    - [40, 6940.0]
  - - [256, 2048, 8, 1024, 256, 256, 1024, 1024]
    - [40, 7097.0]
  - - [256, 2048, 8, 2048, 256, 256, 2048, 2048]
    - [30, 7335.0]
  - - [512, 32, 8, 32, 512, 512, 32, 32]
    - [3, 771.0]
  - - [512, 32, 8, 64, 512, 512, 64, 64]
    - [38, 1219.0]
  - - [512, 32, 8, 128, 512, 512, 128, 128]
    - [2, 1808.0]
  - - [512, 32, 8, 256, 512, 512, 256, 256]
    - [7, 2231.0]
  - - [512, 32, 8, 512, 512, 512, 512, 512]
    - [43, 2778.0]
  - - [512, 32, 8, 1024, 512, 512, 1024, 1024]
    - [43, 3045.0]
  - - [512, 32, 8, 2048, 512, 512, 2048, 2048]
    - [23, 3196.0]
  - - [512, 64, 8, 32, 512, 512, 32, 32]
    - [23, 1311.0]
  - - [512, 64, 8, 64, 512, 512, 64, 64]
    - [38, 1978.0]
  - - [512, 64, 8, 128, 512, 512, 128, 128]
    - [38, 2834.0]
  - - [512, 64, 8, 256, 512, 512, 256, 256]
    - [32, 3166.0]
  - - [512, 64, 8, 512, 512, 512, 512, 512]
    - [31, 3902.0]
  - - [512, 64, 8, 1024, 512, 512, 1024, 1024]
    - [32, 4296.0]
  - - [512, 64, 8, 2048, 512, 512, 2048, 2048]
    - [32, 4483.0]
  - - [512, 128, 8, 32, 512, 512, 32, 32]
    - [45, 1960.0]
  - - [512, 128, 8, 64, 512, 512, 64, 64]
    - [30, 2796.0]
  - - [512, 128, 8, 128, 512, 512, 128, 128]
    - [43, 3796.0]
  - - [512, 128, 8, 256, 512, 512, 256, 256]
    - [30, 4184.0]
  - - [512, 128, 8, 512, 512, 512, 512, 512]
    - [43, 5031.0]
  - - [512, 128, 8, 1024, 512, 512, 1024, 1024]
    - [27, 5170.0]
  - - [512, 128, 8, 2048, 512, 512, 2048, 2048]
    - [29, 5501.0]
  - - [512, 256, 8, 32, 512, 512, 32, 32]
    - [15, 2724.0]
  - - [512, 256, 8, 64, 512, 512, 64, 64]
    - [38, 3830.0]
  - - [512, 256, 8, 128, 512, 512, 128, 128]
    - [38, 4863.0]
  - - [512, 256, 8, 256, 512, 512, 256, 256]
    - [30, 5360.0]
  - - [512, 256, 8, 512, 512, 512, 512, 512]
    - [30, 5780.0]
  - - [512, 256, 8, 1024, 512, 512, 1024, 1024]
    - [40, 5976.0]
  - - [512, 256, 8, 2048, 512, 512, 2048, 2048]
    - [40, 6187.0]
  - - [512, 512, 8, 32, 512, 512, 32, 32]
    - [15, 3290.0]
  - - [512, 512, 8, 64, 512, 512, 64, 64]
    - [38, 4534.0]
  - - [512, 512, 8, 128, 512, 512, 128, 128]
    - [38, 5474.0]
  - - [512, 512, 8, 256, 512, 512, 256, 256]
    - [30, 6260.0]
  - - [512, 512, 8, 512, 512, 512, 512, 512]
    - [30, 6658.0]
  - - [512, 512, 8, 1024, 512, 512, 1024, 1024]
    - [42, 6743.0]
  - - [512, 512, 8, 2048, 512, 512, 2048, 2048]
    - [30, 7111.0]
  - - [512, 1024, 8, 32, 512, 512, 32, 32]
    - [15, 3796.0]
  - - [512, 1024, 8, 64, 512, 512, 64, 64]
    - [38, 5061.0]
  - - [512, 1024, 8, 128, 512, 512, 128, 128]
    - [38, 5955.0]
  - - [512, 1024, 8, 256, 512, 512, 256, 256]
    - [30, 6697.0]
  - - [512, 1024, 8, 512, 512, 512, 512, 512]
    - [40, 6943.0]
  - - [512, 1024, 8, 1024, 512, 512, 1024, 1024]
    - [40, 7072.0]
  - - [512, 1024, 8, 2048, 512, 512, 2048, 2048]
    - [40, 7287.0]
  - - [512, 2048, 8, 32, 512, 512, 32, 32]
    - [20, 3990.0]
  - - [512, 2048, 8, 64, 512, 512, 64, 64]
    - [18, 5352.0]
  - - [512, 2048, 8, 128, 512, 512, 128, 128]
    - [30, 6431.0]
  - - [512, 2048, 8, 256, 512, 512, 256, 256]
    - [30, 6994.0]
  - - [512, 2048, 8, 512, 512, 512, 512, 512]
    - [30, 7216.0]
  - - [512, 2048, 8, 1024, 512, 512, 1024, 1024]
    - [40, 7233.0]
  - - [512, 2048, 8, 2048, 512, 512, 2048, 2048]
    - [40, 7587.0]
  - - [1024, 32, 8, 32, 1024, 1024, 32, 32]
    - [43, 1327.0]
  - - [1024, 32, 8, 64, 1024, 1024, 64, 64]
    - [18, 1924.0]
  - - [1024, 32, 8, 128, 1024, 1024, 128, 128]
    - [41, 2638.0]
  - - [1024, 32, 8, 256, 1024, 1024, 256, 256]
    - [43, 3277.0]
  - - [1024, 32, 8, 512, 1024, 1024, 512, 512]
    - [43, 3866.0]
  - - [1024, 32, 8, 1024, 1024, 1024, 1024, 1024]
    - [32, 4226.0]
  - - [1024, 32, 8, 2048, 1024, 1024, 2048, 2048]
    - [23, 4363.0]
  - - [1024, 64, 8, 32, 1024, 1024, 32, 32]
    - [26, 1978.0]
  - - [1024, 64, 8, 64, 1024, 1024, 64, 64]
    - [20, 2759.0]
  - - [1024, 64, 8, 128, 1024, 1024, 128, 128]
    - [38, 3712.0]
  - - [1024, 64, 8, 256, 1024, 1024, 256, 256]
    - [24, 4072.0]
  - - [1024, 64, 8, 512, 1024, 1024, 512, 512]
    - [23, 5023.0]
  - - [1024, 64, 8, 1024, 1024, 1024, 1024, 1024]
    - [32, 5162.0]
  - - [1024, 64, 8, 2048, 1024, 1024, 2048, 2048]
    - [37, 5371.0]
  - - [1024, 128, 8, 32, 1024, 1024, 32, 32]
    - [31, 2724.0]
  - - [1024, 128, 8, 64, 1024, 1024, 64, 64]
    - [29, 3848.0]
  - - [1024, 128, 8, 128, 1024, 1024, 128, 128]
    - [38, 4821.0]
  - - [1024, 128, 8, 256, 1024, 1024, 256, 256]
    - [42, 5352.0]
  - - [1024, 128, 8, 512, 1024, 1024, 512, 512]
    - [40, 5731.0]
  - - [1024, 128, 8, 1024, 1024, 1024, 1024, 1024]
    - [40, 5920.0]
  - - [1024, 128, 8, 2048, 1024, 1024, 2048, 2048]
    - [40, 6158.0]
  - - [1024, 256, 8, 32, 1024, 1024, 32, 32]
    - [41, 3355.0]
  - - [1024, 256, 8, 64, 1024, 1024, 64, 64]
    - [29, 4547.0]
  - - [1024, 256, 8, 128, 1024, 1024, 128, 128]
    - [41, 5377.0]
  - - [1024, 256, 8, 256, 1024, 1024, 256, 256]
    - [40, 6337.0]
  - - [1024, 256, 8, 512, 1024, 1024, 512, 512]
    - [40, 6704.0]
  - - [1024, 256, 8, 1024, 1024, 1024, 1024, 1024]
    - [40, 6848.0]
  - - [1024, 256, 8, 2048, 1024, 1024, 2048, 2048]
    - [40, 7130.0]
  - - [1024, 512, 8, 32, 1024, 1024, 32, 32]
    - [21, 3804.0]
  - - [1024, 512, 8, 64, 1024, 1024, 64, 64]
    - [29, 5061.0]
  - - [1024, 512, 8, 128, 1024, 1024, 128, 128]
    - [38, 5892.0]
  - - [1024, 512, 8, 256, 1024, 1024, 256, 256]
    - [40, 6628.0]
  - - [1024, 512, 8, 512, 1024, 1024, 512, 512]
    - [30, 6918.0]
  - - [1024, 512, 8, 1024, 1024, 1024, 1024, 1024]
    - [40, 7025.0]
  - - [1024, 512, 8, 2048, 1024, 1024, 2048, 2048]
    - [40, 7242.0]
  - - [1024, 1024, 8, 32, 1024, 1024, 32, 32]
    - [41, 4057.0]
  - - [1024, 1024, 8, 64, 1024, 1024, 64, 64]
    - [29, 5373.0]
  - - [1024, 1024, 8, 128, 1024, 1024, 128, 128]
    - [20, 6234.0]
  - - [1024, 1024, 8, 256, 1024, 1024, 256, 256]
    - [30, 6860.0]
  - - [1024, 1024, 8, 512, 1024, 1024, 512, 512]
    - [40, 7241.0]
  - - [1024, 1024, 8, 1024, 1024, 1024, 1024, 1024]
    - [42, 7270.0]
  - - [1024, 1024, 8, 2048, 1024, 1024, 2048, 2048]
    - [40, 7583.0]
  - - [1024, 2048, 8, 32, 1024, 1024, 32, 32]
    - [35, 4250.0]
  - - [1024, 2048, 8, 64, 1024, 1024, 64, 64]
    - [29, 5539.0]
  - - [1024, 2048, 8, 128, 1024, 1024, 128, 128]
    - [20, 6547.0]
  - - [1024, 2048, 8, 256, 1024, 1024, 256, 256]
    - [20, 7049.0]
  - - [1024, 2048, 8, 512, 1024, 1024, 512, 512]
    - [40, 7322.0]
  - - [1024, 2048, 8, 1024, 1024, 1024, 1024, 1024]
    - [40, 7389.0]
  - - [1024, 2048, 8, 2048, 1024, 1024, 2048, 2048]
    - [40, 7728.0]
  - - [2048, 32, 8, 32, 2048, 2048, 32, 32]
    - [15, 1907.0]
  - - [2048, 32, 8, 64, 2048, 2048, 64, 64]
    - [29, 2638.0]
  - - [2048, 32, 8, 128, 2048, 2048, 128, 128]
    - [23, 3600.0]
  - - [2048, 32, 8, 256, 2048, 2048, 256, 256]
    - [32, 3995.0]
  - - [2048, 32, 8, 512, 2048, 2048, 512, 512]
    - [23, 4913.0]
  - - [2048, 32, 8, 1024, 2048, 2048, 1024, 1024]
    - [23, 5115.0]
  - - [2048, 32, 8, 2048, 2048, 2048, 2048, 2048]
    - [32, 5343.0]
  - - [2048, 64, 8, 32, 2048, 2048, 32, 32]
    - [31, 2706.0]
  - - [2048, 64, 8, 64, 2048, 2048, 64, 64]
    - [38, 3813.0]
  - - [2048, 64, 8, 128, 2048, 2048, 128, 128]
    - [38, 4596.0]
  - - [2048, 64, 8, 256, 2048, 2048, 256, 256]
    - [30, 5227.0]
  - - [2048, 64, 8, 512, 2048, 2048, 512, 512]
    - [34, 5644.0]
  - - [2048, 64, 8, 1024, 2048, 2048, 1024, 1024]
    - [40, 5825.0]
  - - [2048, 64, 8, 2048, 2048, 2048, 2048, 2048]
    - [30, 6083.0]
  - - [2048, 128, 8, 32, 2048, 2048, 32, 32]
    - [15, 3303.0]
  - - [2048, 128, 8, 64, 2048, 2048, 64, 64]
    - [29, 4522.0]
  - - [2048, 128, 8, 128, 2048, 2048, 128, 128]
    - [38, 5537.0]
  - - [2048, 128, 8, 256, 2048, 2048, 256, 256]
    - [40, 6307.0]
  - - [2048, 128, 8, 512, 2048, 2048, 512, 512]
    - [40, 6664.0]
  - - [2048, 128, 8, 1024, 2048, 2048, 1024, 1024]
    - [40, 6775.0]
  - - [2048, 128, 8, 2048, 2048, 2048, 2048, 2048]
    - [40, 7075.0]
  - - [2048, 256, 8, 32, 2048, 2048, 32, 32]
    - [41, 3893.0]
  - - [2048, 256, 8, 64, 2048, 2048, 64, 64]
    - [38, 5194.0]
  - - [2048, 256, 8, 128, 2048, 2048, 128, 128]
    - [38, 6106.0]
  - - [2048, 256, 8, 256, 2048, 2048, 256, 256]
    - [40, 6661.0]
  - - [2048, 256, 8, 512, 2048, 2048, 512, 512]
    - [40, 6942.0]
  - - [2048, 256, 8, 1024, 2048, 2048, 1024, 1024]
    - [40, 7059.0]
  - - [2048, 256, 8, 2048, 2048, 2048, 2048, 2048]
    - [40, 7306.0]
  - - [2048, 512, 8, 32, 2048, 2048, 32, 32]
    - [20, 4067.0]
  - - [2048, 512, 8, 64, 2048, 2048, 64, 64]
    - [29, 5478.0]
  - - [2048, 512, 8, 128, 2048, 2048, 128, 128]
    - [38, 6222.0]
  - - [2048, 512, 8, 256, 2048, 2048, 256, 256]
    - [30, 6918.0]
  - - [2048, 512, 8, 512, 2048, 2048, 512, 512]
    - [40, 7196.0]
  - - [2048, 512, 8, 1024, 2048, 2048, 1024, 1024]
    - [42, 7280.0]
  - - [2048, 512, 8, 2048, 2048, 2048, 2048, 2048]
    - [40, 7568.0]
  - - [2048, 1024, 8, 32, 2048, 2048, 32, 32]
    - [30, 4253.0]
  - - [2048, 1024, 8, 64, 2048, 2048, 64, 64]
    - [29, 5630.0]
  - - [2048, 1024, 8, 128, 2048, 2048, 128, 128]
    - [20, 6554.0]
  - - [2048, 1024, 8, 256, 2048, 2048, 256, 256]
    - [40, 7066.0]
  - - [2048, 1024, 8, 512, 2048, 2048, 512, 512]
    - [40, 7325.0]
  - - [2048, 1024, 8, 1024, 2048, 2048, 1024, 1024]
    - [40, 7392.0]
  - - [2048, 1024, 8, 2048, 2048, 2048, 2048, 2048]
    - [40, 7739.0]
  - - [2048, 2048, 8, 32, 2048, 2048, 32, 32]
    - [31, 4351.0]
  - - [2048, 2048, 8, 64, 2048, 2048, 64, 64]
    - [29, 5719.0]
  - - [2048, 2048, 8, 128, 2048, 2048, 128, 128]
    - [20, 6762.0]
  - - [2048, 2048, 8, 256, 2048, 2048, 256, 256]
    - [40, 7164.0]
  - - [2048, 2048, 8, 512, 2048, 2048, 512, 512]
    - [40, 7405.0]
  - - [2048, 2048, 8, 1024, 2048, 2048, 1024, 1024]
    - [40, 7450.0]
  - - [2048, 2048, 8, 2048, 2048, 2048, 2048, 2048]
    - [40, 7772.0]
- null
