library/src/blas3/Tensile/Logic/aldebaran/arcturus_Cijk_Ailk_Bljk_HBH_GB.yaml
- {MinimumRequiredVersion: 4.25.0}
- arcturus
- gfx908
- [Device 7380, Device 7388, Device 738c, Device 7390]
    SolutionIndex: 0
    SolutionNameMin: Cijk_Ailk_Bljk_HBH_GB_MT64x64x32_MI32x32x8x1_SN_1LDSB0_EPS0_GRVW8_LPB8_NLCA1_PGR2_PLR5_SU0_SUS128_TT1_32_WG64_4_1_WGM1
    SolutionIndex: 1
    SolutionNameMin: Cijk_Ailk_Bljk_HBH_GB_MT32x32x64_MI16x16x16x1_SN_1LDSB0_EPS1_GRVW8_LPB16_NLCA1_PGR1_PLR5_SU0_SUS128_TT1_16_WG32_8_1_WGM1
    SolutionIndex: 2
    SolutionNameMin: Cijk_Ailk_Bljk_HBH_GB_MT32x32x64_MI16x16x16x1_SN_1LDSB0_EPS0_GRVW8_LPB16_NLCA1_PGR2_PLR5_SU0_SUS128_TT1_16_WG32_8_1_WGM1
    SolutionIndex: 3
    SolutionNameMin: Cijk_Ailk_Bljk_HBH_GB_MT32x32x64_MI16x16x16x1_SN_1LDSB0_EPS1_GRVW4_LPB16_NLCA1_PGR1_PLR5_SU0_SUS256_TT1_16_WG32_8_1_WGM1
    SolutionIndex: 4
    SolutionNameMin: Cijk_Ailk_Bljk_HBH_GB_MT32x32x64_MI16x16x16x1_SN_1LDSB0_EPS0_GRVW4_LPB16_NLCA1_PGR2_PLR5_SU0_SUS256_TT1_16_WG32_8_1_WGM1
    SolutionIndex: 5
    SolutionNameMin: Cijk_Ailk_Bljk_HBH_GB_MT32x64x32_MI16x16x16x1_SN_1LDSB0_EPS1_GRVW8_LPB16_NLCA1_PGR1_PLR2_SU0_SUS256_TT1_32_WG32_8_1_WGM1
    SolutionIndex: 6
    SolutionNameMin: Cijk_Ailk_Bljk_HBH_GB_MT64x64x32_MI32x32x8x1_SN_1LDSB0_EPS0_GRVW8_LPB8_NLCA1_PGR2_PLR5_SU0_SUS256_TT1_32_WG64_4_1_WGM1
    SolutionIndex: 7
    SolutionNameMin: Cijk_Ailk_Bljk_HBH_GB_MT32x32x64_MI16x16x16x1_SN_1LDSB0_EPS0_GRVW8_LPB16_NLCA1_PGR2_PLR5_SU0_SUS256_TT1_16_WG32_8_1_WGM1
    SolutionIndex: 8
    SolutionNameMin: Cijk_Ailk_Bljk_HBH_GB_MT32x32x32_MI16x16x16x1_SN_1LDSB0_EPS0_GRVW4_LPB16_NLCA1_PGR2_PLR2_SU0_SUS128_TT1_16_WG32_8_1_WGM15
    SolutionIndex: 9
    SolutionNameMin: Cijk_Ailk_Bljk_HBH_GB_MT64x256x32_MI32x32x8x1_SN_1LDSB1_EPS1_GRVW4_LPB8_NLCA1_PGR1_PLR5_SU0_SUS256_TT1_128_WG64_4_1_WGM2
- - - [32, 32, 8, 128, 32, 32, 32, 128]
    - [2, 170.0]
  - - [128, 128, 8, 128, 128, 128, 128, 128]
    - [3, 2589.0]
  - - [256, 256, 8, 128, 256, 256, 256, 128]
    - [5, 8738.0]
  - - [512, 512, 8, 128, 512, 512, 512, 128]
    - [6, 18138.0]
  - - [32, 32, 8, 512, 32, 32, 32, 512]
    - [2, 490.0]
  - - [128, 128, 8, 512, 128, 128, 128, 512]
    - [7, 7490.0]
  - - [256, 256, 8, 512, 256, 256, 256, 512]
    - [6, 19508.0]
  - - [512, 512, 8, 512, 512, 512, 512, 512]
    - [9, 34862.0]
  - - [32, 32, 8, 1024, 32, 32, 32, 1024]
    - [7, 760.0]
  - - [128, 128, 8, 1024, 128, 128, 128, 1024]
    - [2, 10107.0]
  - - [256, 256, 8, 1024, 256, 256, 256, 1024]
    - [0, 24763.0]
  - - [512, 512, 8, 1024, 512, 512, 512, 1024]
    - [9, 40005.0]
  - - [32, 128, 8, 128, 32, 32, 32, 128]
    - [2, 690.0]
  - - [32, 256, 8, 128, 32, 32, 32, 128]
    - [2, 1417.0]
  - - [32, 512, 8, 128, 32, 32, 32, 128]
    - [7, 2759.0]
  - - [32, 128, 8, 512, 32, 32, 32, 512]
    - [2, 2036.0]
  - - [32, 256, 8, 512, 32, 32, 32, 512]
    - [2, 4112.0]
  - - [32, 512, 8, 512, 32, 32, 32, 512]
    - [2, 7557.0]
  - - [32, 128, 8, 1024, 32, 32, 32, 1024]
    - [7, 3039.0]
  - - [32, 256, 8, 1024, 32, 32, 32, 1024]
    - [7, 6168.0]
  - - [32, 512, 8, 1024, 32, 32, 32, 1024]
    - [7, 10356.0]
  - - [128, 32, 8, 128, 128, 128, 128, 128]
    - [4, 672.0]
  - - [256, 32, 8, 128, 256, 256, 256, 128]
    - [1, 1327.0]
  - - [512, 32, 8, 128, 512, 512, 512, 128]
    - [8, 2621.0]
  - - [128, 32, 8, 512, 128, 128, 128, 512]
    - [7, 1907.0]
  - - [256, 32, 8, 512, 256, 256, 256, 512]
    - [7, 3779.0]
  - - [512, 32, 8, 512, 512, 512, 512, 512]
    - [7, 6765.0]
  - - [128, 32, 8, 1024, 128, 128, 128, 1024]
    - [2, 2672.0]
  - - [256, 32, 8, 1024, 256, 256, 256, 1024]
    - [2, 5483.0]
  - - [512, 32, 8, 1024, 512, 512, 512, 1024]
    - [2, 9168.0]
- null
