library/src/blas3/Tensile/Logic/aldebaran/arcturus_Cijk_Alik_Bljk_4xi8BH.yaml
- {MinimumRequiredVersion: 4.6.0}
- arcturus
- gfx908
- [Device 7380, Device 7388, Device 738c, Device 7390]
    SolutionIndex: 0
    SolutionNameMin: Cijk_Alik_Bljk_4xi8BH_MT128x016x32_GRVW04_GSU16_SNLL0_TT04_04_VW04_WG32_04_02
    SolutionIndex: 1
    SolutionNameMin: Cijk_Alik_Bljk_4xi8BH_MT128x008x32_GRVW04_GSU16_SNLL0_TT04_04_VW04_WG32_02_04
    SolutionIndex: 2
    SolutionNameMin: Cijk_Alik_Bljk_4xi8BH_MT064x008x32_GRVW04_GSU16_SNLL0_TT04_04_VW04_WG16_02_08
    SolutionIndex: 3
    SolutionNameMin: Cijk_Alik_Bljk_4xi8BH_MT128x016x32_GRVW04_GSU32_SNLL0_TT04_04_VW04_WG32_04_02
    SolutionIndex: 4
    SolutionNameMin: Cijk_Alik_Bljk_4xi8BH_MT036x048x16_GRVW01_GSU04_SNLL0_TT03_03_VW01_WG12_16_01
    SolutionIndex: 5
    SolutionNameMin: Cijk_Alik_Bljk_4xi8BH_MT036x048x16_GRVW01_GSU08_SNLL0_TT03_03_VW01_WG12_16_01
    SolutionIndex: 6
    SolutionNameMin: Cijk_Alik_Bljk_4xi8BH_MT016x016x08_GRVW02_GSU01_SNLL0_TT02_02_VW02_WG08_08_01
    SolutionIndex: 7
    SolutionNameMin: Cijk_Alik_Bljk_4xi8BH_MT032x016x08_GRVW02_GSU01_SNLL0_TT04_02_VW02_WG08_08_01
    SolutionIndex: 8
    SolutionNameMin: Cijk_Alik_Bljk_4xi8BH_MT032x032x08_GRVW04_GSU01_SNLL0_TT04_04_VW04_WG08_08_01
    SolutionIndex: 9
    SolutionNameMin: Cijk_Alik_Bljk_4xi8BH_MT032x016x08_GRVW02_GSU01_SNLL0_TT02_02_VW02_WG16_08_01
    SolutionIndex: 10
    SolutionNameMin: Cijk_Alik_Bljk_4xi8BH_MT032x016x08_GRVW02_GSU01_SNLL0_TT02_02_VW02_WG16_08_01
    SolutionIndex: 11
    SolutionNameMin: Cijk_Alik_Bljk_4xi8BH_MT016x016x16_GRVW02_GSU01_SNLL0_TT02_02_VW02_WG08_08_01
    SolutionIndex: 12
    SolutionNameMin: Cijk_Alik_Bljk_4xi8BH_MT032x016x16_GRVW02_GSU01_SNLL0_TT02_02_VW02_WG16_08_01
    SolutionIndex: 13
    SolutionNameMin: Cijk_Alik_Bljk_4xi8BH_MT128x016x16_GRVW04_GSU02_SNLL0_TT04_04_VW04_WG32_04_02
    SolutionIndex: 14
    SolutionNameMin: Cijk_Alik_Bljk_4xi8BH_MT064x016x16_GRVW04_GSU02_SNLL0_TT04_04_VW04_WG16_04_04
    SolutionIndex: 15
    SolutionNameMin: Cijk_Alik_Bljk_4xi8BH_MT032x032x16_GRVW04_GSU02_SNLL0_TT04_04_VW04_WG08_08_02
    SolutionIndex: 16
    SolutionNameMin: Cijk_Alik_Bljk_4xi8BH_MT064x032x16_GRVW04_GSU02_SNLL0_TT08_04_VW04_WG08_08_02
    SolutionIndex: 17
    SolutionNameMin: Cijk_Alik_Bljk_4xi8BH_MT032x016x16_GRVW02_GSU02_SNLL0_TT04_02_VW02_WG08_08_04
    SolutionIndex: 18
    SolutionNameMin: Cijk_Alik_Bljk_4xi8BH_MT032x032x16_GRVW04_GSU02_SNLL0_TT04_04_VW04_WG08_08_04
    SolutionIndex: 19
    SolutionNameMin: Cijk_Alik_Bljk_4xi8BH_MT032x016x16_GRVW02_GSU02_SNLL0_TT02_02_VW02_WG16_08_02
    SolutionIndex: 20
    SolutionNameMin: Cijk_Alik_Bljk_4xi8BH_MT064x032x16_GRVW04_GSU02_SNLL0_TT04_04_VW04_WG16_08_02
    SolutionIndex: 21
    SolutionNameMin: Cijk_Alik_Bljk_4xi8BH_MT128x032x16_GRVW04_GSU02_SNLL0_TT08_04_VW04_WG16_08_02
    SolutionIndex: 22
    SolutionNameMin: Cijk_Alik_Bljk_4xi8BH_MT128x016x16_GRVW04_GSU02_SNLL0_TT04_04_VW04_WG32_04_02
    SolutionIndex: 23
    SolutionNameMin: Cijk_Alik_Bljk_4xi8BH_MT064x016x16_GRVW04_GSU02_SNLL0_TT04_04_VW04_WG16_04_04
    SolutionIndex: 24
    SolutionNameMin: Cijk_Alik_Bljk_4xi8BH_MT032x032x16_GRVW04_GSU02_SNLL0_TT04_04_VW04_WG08_08_02
    SolutionIndex: 25
    SolutionNameMin: Cijk_Alik_Bljk_4xi8BH_MT064x032x16_GRVW04_GSU02_SNLL0_TT08_04_VW04_WG08_08_02
    SolutionIndex: 26
    SolutionNameMin: Cijk_Alik_Bljk_4xi8BH_MT016x016x16_GRVW02_GSU02_SNLL0_TT02_02_VW02_WG08_08_04
    SolutionIndex: 27
    SolutionNameMin: Cijk_Alik_Bljk_4xi8BH_MT032x016x16_GRVW02_GSU02_SNLL0_TT04_02_VW02_WG08_08_04
    SolutionIndex: 28
    SolutionNameMin: Cijk_Alik_Bljk_4xi8BH_MT032x032x16_GRVW04_GSU02_SNLL0_TT04_04_VW04_WG08_08_04
    SolutionIndex: 29
    SolutionNameMin: Cijk_Alik_Bljk_4xi8BH_MT064x032x16_GRVW04_GSU02_SNLL0_TT08_04_VW04_WG08_08_04
    SolutionIndex: 30
    SolutionNameMin: Cijk_Alik_Bljk_4xi8BH_MT064x032x16_GRVW04_GSU02_SNLL0_TT04_04_VW04_WG16_08_02
    SolutionIndex: 31
    SolutionNameMin: Cijk_Alik_Bljk_4xi8BH_MT128x032x16_GRVW04_GSU02_SNLL0_TT08_04_VW04_WG16_08_02
    SolutionIndex: 32
    SolutionNameMin: Cijk_Alik_Bljk_4xi8BH_MT032x032x16_GRVW04_GSU04_SNLL0_TT04_04_VW04_WG08_08_02
    SolutionIndex: 33
    SolutionNameMin: Cijk_Alik_Bljk_4xi8BH_MT016x016x16_GRVW02_GSU04_SNLL0_TT02_02_VW02_WG08_08_04
    SolutionIndex: 34
    SolutionNameMin: Cijk_Alik_Bljk_4xi8BH_MT032x016x16_GRVW02_GSU04_SNLL0_TT04_02_VW02_WG08_08_04
    SolutionIndex: 35
    SolutionNameMin: Cijk_Alik_Bljk_4xi8BH_MT032x032x16_GRVW04_GSU04_SNLL0_TT04_04_VW04_WG08_08_04
    SolutionIndex: 36
    SolutionNameMin: Cijk_Alik_Bljk_4xi8BH_MT032x016x16_GRVW02_GSU04_SNLL0_TT02_02_VW02_WG16_08_02
    SolutionIndex: 37
    SolutionNameMin: Cijk_Alik_Bljk_4xi8BH_MT064x032x16_GRVW04_GSU04_SNLL0_TT04_04_VW04_WG16_08_02
    SolutionIndex: 38
    SolutionNameMin: Cijk_Alik_Bljk_4xi8BH_MT032x032x16_GRVW04_GSU04_SNLL0_TT04_04_VW04_WG08_08_02
    SolutionIndex: 39
    SolutionNameMin: Cijk_Alik_Bljk_4xi8BH_MT016x016x16_GRVW02_GSU04_SNLL0_TT02_02_VW02_WG08_08_04
    SolutionIndex: 40
    SolutionNameMin: Cijk_Alik_Bljk_4xi8BH_MT032x016x16_GRVW02_GSU04_SNLL0_TT04_02_VW02_WG08_08_04
    SolutionIndex: 41
    SolutionNameMin: Cijk_Alik_Bljk_4xi8BH_MT064x032x16_GRVW04_GSU04_SNLL0_TT04_04_VW04_WG16_08_02
    SolutionIndex: 42
    SolutionNameMin: Cijk_Alik_Bljk_4xi8BH_MT128x032x16_GRVW04_GSU04_SNLL0_TT08_04_VW04_WG16_08_02
    SolutionIndex: 43
    SolutionNameMin: Cijk_Alik_Bljk_4xi8BH_MT016x016x16_GRVW02_GSU08_SNLL0_TT02_02_VW02_WG08_08_04
    SolutionIndex: 44
    SolutionNameMin: Cijk_Alik_Bljk_4xi8BH_MT032x016x16_GRVW02_GSU08_SNLL0_TT04_02_VW02_WG08_08_04
    SolutionIndex: 45
    SolutionNameMin: Cijk_Alik_Bljk_4xi8BH_MT016x016x16_GRVW02_GSU08_SNLL0_TT02_02_VW02_WG08_08_04
    SolutionIndex: 46
    SolutionNameMin: Cijk_Alik_Bljk_4xi8BH_MT032x008x32_GRVW02_GSU02_SNLL0_TT02_02_VW02_WG16_04_04
    SolutionIndex: 47
    SolutionNameMin: Cijk_Alik_Bljk_4xi8BH_MT064x016x32_GRVW04_GSU02_SNLL0_TT04_04_VW04_WG16_04_04
    SolutionIndex: 48
    SolutionNameMin: Cijk_Alik_Bljk_4xi8BH_MT016x016x32_GRVW02_GSU02_SNLL0_TT02_02_VW02_WG08_08_04
    SolutionIndex: 49
    SolutionNameMin: Cijk_Alik_Bljk_4xi8BH_MT032x032x32_GRVW04_GSU02_SNLL0_TT04_04_VW04_WG08_08_04
    SolutionIndex: 50
    SolutionNameMin: Cijk_Alik_Bljk_4xi8BH_MT032x008x32_GRVW02_GSU02_SNLL0_TT02_02_VW02_WG16_04_04
    SolutionIndex: 51
    SolutionNameMin: Cijk_Alik_Bljk_4xi8BH_MT032x032x32_GRVW04_GSU02_SNLL0_TT04_04_VW04_WG08_08_02
    SolutionIndex: 52
    SolutionNameMin: Cijk_Alik_Bljk_4xi8BH_MT032x032x32_GRVW04_GSU02_SNLL0_TT04_04_VW04_WG08_08_04
    SolutionIndex: 53
    SolutionNameMin: Cijk_Alik_Bljk_4xi8BH_MT032x032x32_GRVW04_GSU04_SNLL0_TT04_04_VW04_WG08_08_04
    SolutionIndex: 54
    SolutionNameMin: Cijk_Alik_Bljk_4xi8BH_MT032x008x32_GRVW02_GSU04_SNLL0_TT02_02_VW02_WG16_04_04
    SolutionIndex: 55
    SolutionNameMin: Cijk_Alik_Bljk_4xi8BH_MT032x032x32_GRVW04_GSU04_SNLL0_TT04_04_VW04_WG08_08_04
    SolutionIndex: 56
    SolutionNameMin: Cijk_Alik_Bljk_4xi8BH_MT064x064x16_GRVW04_GSU01_SNLL0_TT04_04_VW04_WG16_16_01
    SolutionIndex: 57
    SolutionNameMin: Cijk_Alik_Bljk_4xi8BH_MT064x064x16_GRVW04_GSU01_SNLL0_TT04_04_VW04_WG16_16_01
    SolutionIndex: 58
    SolutionNameMin: Cijk_Alik_Bljk_4xi8BH_MT064x064x08_GRVW04_GSU01_SNLL1_TT04_04_VW04_WG16_16_01
    SolutionIndex: 59
    SolutionNameMin: Cijk_Alik_Bljk_4xi8BH_MT064x128x08_GRVW04_GSU01_SNLL1_TT04_08_VW04_WG16_16_01
    SolutionIndex: 60
    SolutionNameMin: Cijk_Alik_Bljk_4xi8BH_MT128x064x08_GRVW04_GSU01_SNLL1_TT08_04_VW04_WG16_16_01
    SolutionIndex: 61
    SolutionNameMin: Cijk_Alik_Bljk_4xi8BH_MT064x064x08_GRVW04_GSU01_SNLL1_TT04_04_VW04_WG16_16_01
    SolutionIndex: 62
    SolutionNameMin: Cijk_Alik_Bljk_4xi8BH_MT064x128x08_GRVW04_GSU01_SNLL1_TT04_08_VW04_WG16_16_01
    SolutionIndex: 63
    SolutionNameMin: Cijk_Alik_Bljk_4xi8BH_MT128x064x08_GRVW04_GSU01_SNLL1_TT08_04_VW04_WG16_16_01
    SolutionIndex: 64
    SolutionNameMin: Cijk_Alik_Bljk_4xi8BH_MT064x064x16_GRVW04_GSU01_SNLL1_TT04_04_VW04_WG16_16_01
    SolutionIndex: 65
    SolutionNameMin: Cijk_Alik_Bljk_4xi8BH_MT064x128x16_GRVW04_GSU01_SNLL1_TT04_08_VW04_WG16_16_01
    SolutionIndex: 66
    SolutionNameMin: Cijk_Alik_Bljk_4xi8BH_MT128x064x16_GRVW04_GSU01_SNLL1_TT08_04_VW04_WG16_16_01
    SolutionIndex: 67
    SolutionNameMin: Cijk_Alik_Bljk_4xi8BH_MT128x096x16_GRVW02_GSU01_SNLL1_TT08_06_VW02_WG16_16_01
    SolutionIndex: 68
    SolutionNameMin: Cijk_Alik_Bljk_4xi8BH_MT128x128x16_GRVW04_GSU01_SNLL1_TT08_08_VW04_WG16_16_01
    SolutionIndex: 69
    SolutionNameMin: Cijk_Alik_Bljk_4xi8BH_MT064x064x16_GRVW04_GSU01_SNLL1_TT04_04_VW04_WG16_16_01
    SolutionIndex: 70
    SolutionNameMin: Cijk_Alik_Bljk_4xi8BH_MT064x128x16_GRVW04_GSU01_SNLL1_TT04_08_VW04_WG16_16_01
    SolutionIndex: 71
    SolutionNameMin: Cijk_Alik_Bljk_4xi8BH_MT128x064x16_GRVW04_GSU01_SNLL1_TT08_04_VW04_WG16_16_01
    SolutionIndex: 72
    SolutionNameMin: Cijk_Alik_Bljk_4xi8BH_MT128x128x16_GRVW04_GSU01_SNLL1_TT08_08_VW04_WG16_16_01
    SolutionIndex: 73
    SolutionNameMin: Cijk_Alik_Bljk_4xi8BH_MT064x064x32_GRVW04_GSU01_SNLL1_TT04_04_VW04_WG16_16_01
    SolutionIndex: 74
    SolutionNameMin: Cijk_Alik_Bljk_4xi8BH_MT016x016x04_GRVW02_GSU01_SNLL0_TT02_02_VW02_WG08_08_01
    SolutionIndex: 75
    SolutionNameMin: Cijk_Alik_Bljk_4xi8BH_MT032x032x02_GRVW04_GSU01_SNLL0_TT04_04_VW04_WG08_08_01
    SolutionIndex: 76
    SolutionNameMin: Cijk_Alik_Bljk_4xi8BH_MT008x008x08_GRVW02_GSU01_SNLL1_TT02_02_VW02_WG04_04_04
    SolutionIndex: 77
    SolutionNameMin: Cijk_Alik_Bljk_4xi8BH_MT016x016x16_GRVW02_GSU01_SNLL1_TT02_02_VW02_WG08_08_04
    SolutionIndex: 78
    SolutionNameMin: Cijk_Alik_Bljk_4xi8BH_MT008x008x08_GRVW02_GSU04_SNLL0_TT02_02_VW02_WG04_04_04
    SolutionIndex: 79
    SolutionNameMin: Cijk_Alik_Bljk_4xi8BH_MT008x008x08_GRVW02_GSU08_SNLL0_TT02_02_VW02_WG04_04_04
    SolutionIndex: 80
    SolutionNameMin: Cijk_Alik_Bljk_4xi8BH_MT008x008x08_GRVW02_GSU16_SNLL0_TT02_02_VW02_WG04_04_04
    SolutionIndex: 81
    SolutionNameMin: Cijk_Alik_Bljk_4xi8BH_MT016x016x16_GRVW02_GSU16_SNLL0_TT02_02_VW02_WG08_08_04
    SolutionIndex: 82
    SolutionNameMin: Cijk_Alik_Bljk_4xi8BH_MT064x128x08_GRVW04_NLCA01_NLCB01_TT04_08_VW04_WGM08
    SolutionIndex: 83
    SolutionNameMin: Cijk_Alik_Bljk_4xi8BH_MT064x032x08_GRVW04_GSU01_NLCA01_NLCB01_SNLL1_TT04_04_VW04_WG16_08_02_WGM01
    SolutionIndex: 84
    SolutionNameMin: Cijk_Alik_Bljk_4xi8BH_MT064x064x08_GRVW04_GSU01_NLCA01_NLCB01_SNLL1_TT04_04_VW04_WG16_16_01_WGM01
    SolutionIndex: 85
    SolutionNameMin: Cijk_Alik_Bljk_4xi8BH_MT128x064x08_GRVW04_GSU01_NLCA01_NLCB01_SNLL1_TT08_04_VW04_WG16_16_01_WGM01
    SolutionIndex: 86
    SolutionNameMin: Cijk_Alik_Bljk_4xi8BH_MT064x016x16_GRVW04_GSU01_NLCA01_NLCB01_SNLL1_TT04_04_VW04_WG16_04_04_WGM01
    SolutionIndex: 87
    SolutionNameMin: Cijk_Alik_Bljk_4xi8BH_MT032x032x32_GRVW04_GSU01_NLCA01_NLCB01_SNLL1_TT04_08_VW04_WG08_04_08_WGM01
    SolutionIndex: 88
    SolutionNameMin: Cijk_Alik_Bljk_4xi8BH_MT032x032x32_GRVW04_GSU04_NLCA01_NLCB01_SNLL0_TT04_08_VW04_WG08_04_08_WGM08
    SolutionIndex: 89
    SolutionNameMin: Cijk_Alik_Bljk_4xi8BH_MT032x064x08_GRVW04_GSU01_NLCA01_NLCB01_SNLL1_TT04_04_VW04_WG08_16_02_WGM01
    SolutionIndex: 90
    SolutionNameMin: Cijk_Alik_Bljk_4xi8BH_MT128x064x08_GRVW04_GSU01_NLCA01_NLCB01_SNLL1_TT08_04_VW04_WG16_16_01_WGM08
    SolutionIndex: 91
    SolutionNameMin: Cijk_Alik_Bljk_4xi8BH_MT032x016x16_GRVW04_GSU01_NLCA01_NLCB01_SNLL1_TT04_04_VW04_WG08_04_08_WGM08
    SolutionIndex: 92
    SolutionNameMin: Cijk_Alik_Bljk_4xi8BH_MT032x008x32_GRVW04_GSU01_NLCA01_NLCB01_SNLL1_TT04_04_VW04_WG08_02_16_WGM01
- - - [1024, 128, 1, 128]
    - [9, 0.0]
  - - [4, 704, 1, 1280]
    - [79, 0.0]
  - - [4, 1856, 1, 3328]
    - [43, 0.0]
  - - [1856, 448, 1, 3328]
    - [70, 0.0]
  - - [2944, 4288, 1, 1280]
    - [72, 0.0]
  - - [2368, 64, 1, 3328]
    - [24, 0.0]
  - - [1760, 32, 1, 1760]
    - [55, 0.0]
  - - [2368, 5888, 1, 256]
    - [62, 0.0]
  - - [5888, 1856, 1, 256]
    - [63, 0.0]
  - - [128, 64, 1, 256]
    - [48, 0.0]
  - - [512, 24000, 1, 1536]
    - [72, 0.0]
  - - [128, 6784, 1, 3328]
    - [65, 0.0]
  - - [5888, 1408, 1, 256]
    - [72, 0.0]
  - - [5888, 1856, 1, 3328]
    - [72, 0.0]
  - - [5056, 704, 1, 256]
    - [63, 0.0]
  - - [2048, 400, 1, 512]
    - [70, 0.0]
  - - [5888, 2944, 1, 3328]
    - [72, 0.0]
  - - [1856, 4288, 1, 256]
    - [59, 0.0]
  - - [1024, 5056, 1, 128]
    - [56, 0.0]
  - - [5056, 5056, 1, 3328]
    - [72, 0.0]
  - - [1408, 5888, 1, 1280]
    - [68, 0.0]
  - - [2368, 448, 1, 128]
    - [56, 0.0]
  - - [2368, 6784, 1, 128]
    - [56, 0.0]
  - - [1024, 3584, 1, 3328]
    - [60, 0.0]
  - - [512, 48000, 1, 2048]
    - [68, 0.0]
  - - [128, 448, 1, 1280]
    - [49, 0.0]
  - - [256, 4288, 1, 3328]
    - [64, 0.0]
  - - [5888, 1408, 1, 1280]
    - [72, 0.0]
  - - [704, 1856, 1, 3328]
    - [69, 0.0]
  - - [4, 1408, 1, 128]
    - [74, 0.0]
  - - [1024, 2368, 1, 256]
    - [63, 0.0]
  - - [64, 4, 1, 256]
    - [77, 0.0]
  - - [1408, 1856, 1, 1280]
    - [63, 0.0]
  - - [1408, 64, 1, 1280]
    - [14, 0.0]
  - - [448, 1024, 1, 1280]
    - [69, 0.0]
  - - [6144, 24000, 1, 2048]
    - [68, 0.0]
  - - [4096, 32, 1, 4096]
    - [42, 0.0]
  - - [256, 1408, 1, 3328]
    - [69, 0.0]
  - - [5056, 5056, 1, 1280]
    - [72, 0.0]
  - - [448, 5056, 1, 256]
    - [69, 0.0]
  - - [704, 1856, 1, 1280]
    - [64, 0.0]
  - - [128, 5056, 1, 128]
    - [7, 0.0]
  - - [2368, 128, 1, 256]
    - [64, 0.0]
  - - [1760, 6400, 1, 1760]
    - [63, 0.0]
  - - [1856, 1408, 1, 128]
    - [56, 0.0]
  - - [64, 5056, 1, 256]
    - [64, 0.0]
  - - [6784, 256, 1, 3328]
    - [69, 0.0]
  - - [6784, 4288, 1, 3328]
    - [72, 0.0]
  - - [4288, 448, 1, 256]
    - [69, 0.0]
  - - [64, 704, 1, 128]
    - [6, 0.0]
  - - [1856, 2368, 1, 3328]
    - [69, 0.0]
  - - [4288, 2944, 1, 1280]
    - [72, 0.0]
  - - [704, 5056, 1, 1280]
    - [59, 0.0]
  - - [2368, 704, 1, 3328]
    - [69, 0.0]
  - - [256, 5888, 1, 256]
    - [62, 0.0]
  - - [1856, 4288, 1, 3328]
    - [72, 0.0]
  - - [256, 2944, 1, 256]
    - [64, 0.0]
  - - [5888, 1024, 1, 256]
    - [62, 0.0]
  - - [448, 64, 1, 1280]
    - [34, 0.0]
  - - [3072, 64, 1, 1024]
    - [24, 0.0]
  - - [3584, 4, 1, 1280]
    - [77, 0.0]
  - - [16384, 3200, 1, 4096]
    - [68, 0.0]
  - - [2944, 64, 1, 256]
    - [64, 0.0]
  - - [128, 4, 1, 1280]
    - [43, 0.0]
  - - [1408, 2944, 1, 256]
    - [59, 0.0]
  - - [256, 1856, 1, 1280]
    - [69, 0.0]
  - - [6784, 5056, 1, 3328]
    - [72, 0.0]
  - - [5056, 5056, 1, 256]
    - [68, 0.0]
  - - [1408, 6784, 1, 128]
    - [56, 0.0]
  - - [64, 1024, 1, 1280]
    - [49, 0.0]
  - - [2944, 4, 1, 256]
    - [77, 0.0]
  - - [704, 5056, 1, 128]
    - [56, 0.0]
  - - [4, 2368, 1, 1280]
    - [77, 0.0]
  - - [2368, 2944, 1, 1280]
    - [68, 0.0]
  - - [128, 3584, 1, 1280]
    - [64, 0.0]
  - - [6784, 6784, 1, 1280]
    - [72, 0.0]
  - - [1024, 256, 1, 3328]
    - [73, 0.0]
  - - [1408, 4288, 1, 1280]
    - [68, 0.0]
  - - [3584, 4288, 1, 1280]
    - [72, 0.0]
  - - [2368, 704, 1, 1280]
    - [69, 0.0]
  - - [5056, 4288, 1, 3328]
    - [72, 0.0]
  - - [3584, 2368, 1, 3328]
    - [72, 0.0]
  - - [64, 704, 1, 1280]
    - [18, 0.0]
  - - [4288, 256, 1, 256]
    - [69, 0.0]
  - - [2944, 128, 1, 128]
    - [12, 0.0]
  - - [6144, 32, 1, 2560]
    - [15, 0.0]
  - - [6784, 448, 1, 1280]
    - [63, 0.0]
  - - [1408, 2944, 1, 128]
    - [56, 0.0]
  - - [4288, 2944, 1, 256]
    - [62, 0.0]
  - - [5888, 704, 1, 1280]
    - [63, 0.0]
  - - [5056, 4, 1, 3328]
    - [77, 0.0]
  - - [1856, 64, 1, 1280]
    - [15, 0.0]
  - - [1760, 16, 1, 1760]
    - [44, 0.0]
  - - [448, 5888, 1, 128]
    - [56, 0.0]
  - - [5888, 64, 1, 3328]
    - [20, 0.0]
  - - [2944, 256, 1, 3328]
    - [69, 0.0]
  - - [1024, 64, 1, 128]
    - [6, 0.0]
  - - [5056, 2368, 1, 1280]
    - [72, 0.0]
  - - [448, 3584, 1, 1280]
    - [69, 0.0]
  - - [6784, 5888, 1, 256]
    - [72, 0.0]
  - - [704, 1024, 1, 128]
    - [56, 0.0]
  - - [704, 128, 1, 1280]
    - [14, 0.0]
  - - [4, 3584, 1, 128]
    - [74, 0.0]
  - - [1408, 448, 1, 1280]
    - [69, 0.0]
  - - [1024, 1408, 1, 256]
    - [63, 0.0]
  - - [2368, 2368, 1, 3328]
    - [72, 0.0]
  - - [1856, 6784, 1, 128]
    - [56, 0.0]
  - - [5056, 704, 1, 3328]
    - [63, 0.0]
  - - [1408, 1856, 1, 256]
    - [64, 0.0]
  - - [1408, 704, 1, 3328]
    - [71, 0.0]
  - - [2368, 5056, 1, 256]
    - [68, 0.0]
  - - [1408, 256, 1, 1280]
    - [69, 0.0]
  - - [3072, 128, 1, 1024]
    - [31, 0.0]
  - - [3584, 2368, 1, 1280]
    - [72, 0.0]
  - - [4288, 64, 1, 3328]
    - [41, 0.0]
  - - [2368, 4, 1, 1280]
    - [77, 0.0]
  - - [704, 5888, 1, 256]
    - [59, 0.0]
  - - [6784, 2944, 1, 128]
    - [56, 0.0]
  - - [2560, 1600, 1, 2560]
    - [66, 0.0]
  - - [4288, 6784, 1, 3328]
    - [72, 0.0]
  - - [2944, 256, 1, 256]
    - [64, 0.0]
  - - [2944, 6784, 1, 3328]
    - [72, 0.0]
  - - [704, 1408, 1, 3328]
    - [65, 0.0]
  - - [6144, 5984, 1, 2048]
    - [68, 0.0]
  - - [3584, 704, 1, 3328]
    - [71, 0.0]
  - - [2944, 256, 1, 128]
    - [56, 0.0]
  - - [6784, 4, 1, 1280]
    - [77, 0.0]
  - - [1024, 64, 1, 1280]
    - [28, 0.0]
  - - [2048, 1600, 1, 512]
    - [69, 0.0]
  - - [448, 4288, 1, 256]
    - [64, 0.0]
  - - [64, 3584, 1, 3328]
    - [25, 0.0]
  - - [1856, 4288, 1, 128]
    - [56, 0.0]
  - - [704, 2368, 1, 1280]
    - [69, 0.0]
  - - [1856, 2368, 1, 1280]
    - [69, 0.0]
  - - [2368, 128, 1, 3328]
    - [30, 0.0]
  - - [2944, 128, 1, 256]
    - [64, 0.0]
  - - [448, 1408, 1, 256]
    - [64, 0.0]
  - - [1856, 4288, 1, 1280]
    - [72, 0.0]
  - - [64, 5056, 1, 3328]
    - [20, 0.0]
  - - [4, 704, 1, 256]
    - [77, 0.0]
  - - [1024, 448, 1, 128]
    - [56, 0.0]
  - - [704, 4, 1, 1280]
    - [79, 0.0]
  - - [704, 256, 1, 128]
    - [56, 0.0]
  - - [704, 2944, 1, 128]
    - [56, 0.0]
  - - [1408, 1024, 1, 1280]
    - [63, 0.0]
  - - [704, 6784, 1, 256]
    - [64, 0.0]
  - - [6784, 704, 1, 256]
    - [69, 0.0]
  - - [5056, 1408, 1, 128]
    - [56, 0.0]
  - - [2048, 7000, 1, 2048]
    - [68, 0.0]
  - - [256, 3584, 1, 3328]
    - [65, 0.0]
  - - [4, 5888, 1, 3328]
    - [33, 0.0]
  - - [128, 1408, 1, 128]
    - [6, 0.0]
  - - [3584, 4288, 1, 3328]
    - [72, 0.0]
  - - [5888, 1856, 1, 1280]
    - [68, 0.0]
  - - [256, 1408, 1, 256]
    - [61, 0.0]
  - - [5056, 64, 1, 1280]
    - [69, 0.0]
  - - [1024, 704, 1, 256]
    - [64, 0.0]
  - - [448, 128, 1, 128]
    - [6, 0.0]
  - - [2368, 3584, 1, 1280]
    - [72, 0.0]
  - - [2368, 6784, 1, 1280]
    - [72, 0.0]
  - - [1024, 256, 1, 256]
    - [69, 0.0]
  - - [1856, 4, 1, 1280]
    - [79, 0.0]
  - - [448, 448, 1, 256]
    - [64, 0.0]
  - - [2944, 3584, 1, 3328]
    - [72, 0.0]
  - - [7680, 32, 1, 2560]
    - [31, 0.0]
  - - [128, 4288, 1, 128]
    - [7, 0.0]
  - - [256, 256, 1, 3328]
    - [18, 0.0]
  - - [128, 1024, 1, 3328]
    - [15, 0.0]
  - - [4, 1408, 1, 3328]
    - [79, 0.0]
  - - [6784, 2944, 1, 256]
    - [72, 0.0]
  - - [64, 1856, 1, 1280]
    - [15, 0.0]
  - - [6784, 64, 1, 128]
    - [8, 0.0]
  - - [4288, 2368, 1, 3328]
    - [72, 0.0]
  - - [1856, 2368, 1, 256]
    - [69, 0.0]
  - - [3584, 256, 1, 128]
    - [56, 0.0]
  - - [3584, 6784, 1, 3328]
    - [72, 0.0]
  - - [256, 1024, 1, 256]
    - [64, 0.0]
  - - [4, 6784, 1, 3328]
    - [33, 0.0]
  - - [1024, 5888, 1, 3328]
    - [68, 0.0]
  - - [1024, 128, 1, 1280]
    - [18, 0.0]
  - - [3072, 32, 1, 1024]
    - [51, 0.0]
  - - [6144, 24000, 1, 2560]
    - [72, 0.0]
  - - [5056, 4288, 1, 1280]
    - [72, 0.0]
  - - [5888, 64, 1, 256]
    - [64, 0.0]
  - - [6784, 1856, 1, 3328]
    - [72, 0.0]
  - - [1408, 5056, 1, 1280]
    - [68, 0.0]
  - - [1856, 256, 1, 1280]
    - [69, 0.0]
  - - [64, 5888, 1, 3328]
    - [30, 0.0]
  - - [2368, 2368, 1, 1280]
    - [59, 0.0]
  - - [2944, 5888, 1, 128]
    - [56, 0.0]
  - - [704, 5888, 1, 1280]
    - [70, 0.0]
  - - [2368, 3584, 1, 128]
    - [56, 0.0]
  - - [1856, 5056, 1, 128]
    - [56, 0.0]
  - - [704, 1024, 1, 1280]
    - [64, 0.0]
  - - [448, 256, 1, 3328]
    - [15, 0.0]
  - - [448, 1856, 1, 128]
    - [56, 0.0]
  - - [8192, 3200, 1, 2048]
    - [68, 0.0]
  - - [128, 1024, 1, 128]
    - [6, 0.0]
  - - [2944, 4, 1, 128]
    - [74, 0.0]
  - - [1024, 704, 1, 1280]
    - [64, 0.0]
  - - [128, 5888, 1, 256]
    - [64, 0.0]
  - - [1024, 5056, 1, 1280]
    - [68, 0.0]
  - - [4288, 1024, 1, 256]
    - [69, 0.0]
  - - [2944, 2368, 1, 128]
    - [56, 0.0]
  - - [704, 704, 1, 3328]
    - [69, 0.0]
  - - [704, 1408, 1, 1280]
    - [70, 0.0]
  - - [5888, 448, 1, 1280]
    - [69, 0.0]
  - - [3584, 256, 1, 3328]
    - [71, 0.0]
  - - [704, 5888, 1, 3328]
    - [70, 0.0]
  - - [704, 1856, 1, 128]
    - [56, 0.0]
  - - [448, 448, 1, 3328]
    - [24, 0.0]
  - - [4, 4288, 1, 128]
    - [74, 0.0]
  - - [128, 704, 1, 1280]
    - [15, 0.0]
  - - [3584, 2944, 1, 256]
    - [68, 0.0]
  - - [3584, 4, 1, 128]
    - [74, 0.0]
  - - [1856, 128, 1, 3328]
    - [24, 0.0]
  - - [4, 64, 1, 1280]
    - [43, 0.0]
  - - [2944, 448, 1, 128]
    - [56, 0.0]
  - - [128, 2944, 1, 1280]
    - [69, 0.0]
  - - [64, 64, 1, 3328]
    - [43, 0.0]
  - - [448, 2944, 1, 1280]
    - [60, 0.0]
  - - [512, 24000, 1, 2048]
    - [72, 0.0]
  - - [128, 256, 1, 3328]
    - [53, 0.0]
  - - [1408, 5056, 1, 3328]
    - [72, 0.0]
  - - [1856, 1856, 1, 3328]
    - [62, 0.0]
  - - [3584, 128, 1, 256]
    - [58, 0.0]
  - - [2560, 800, 1, 2560]
    - [67, 0.0]
  - - [448, 1408, 1, 3328]
    - [64, 0.0]
  - - [2368, 2368, 1, 256]
    - [59, 0.0]
  - - [4288, 4288, 1, 1280]
    - [72, 0.0]
  - - [64, 448, 1, 1280]
    - [17, 0.0]
  - - [5888, 1024, 1, 1280]
    - [68, 0.0]
  - - [1408, 4288, 1, 256]
    - [59, 0.0]
  - - [448, 4, 1, 256]
    - [77, 0.0]
  - - [5888, 448, 1, 128]
    - [56, 0.0]
  - - [512, 48000, 1, 2560]
    - [72, 0.0]
  - - [35, 8457, 1, 1760]
    - [4, 0.0]
  - - [704, 6784, 1, 3328]
    - [72, 0.0]
  - - [2560, 6400, 1, 2560]
    - [72, 0.0]
  - - [5056, 1024, 1, 1280]
    - [68, 0.0]
  - - [448, 5888, 1, 3328]
    - [68, 0.0]
  - - [128, 4, 1, 128]
    - [74, 0.0]
  - - [1024, 2944, 1, 1280]
    - [72, 0.0]
  - - [5056, 5888, 1, 1280]
    - [72, 0.0]
  - - [4288, 5888, 1, 128]
    - [56, 0.0]
  - - [256, 3584, 1, 256]
    - [64, 0.0]
  - - [1408, 3584, 1, 128]
    - [56, 0.0]
  - - [256, 2944, 1, 3328]
    - [69, 0.0]
  - - [448, 3584, 1, 128]
    - [56, 0.0]
  - - [5888, 2944, 1, 1280]
    - [72, 0.0]
  - - [4, 6784, 1, 1280]
    - [77, 0.0]
  - - [2368, 5888, 1, 128]
    - [56, 0.0]
  - - [8448, 16, 1, 2816]
    - [34, 0.0]
  - - [64, 2944, 1, 128]
    - [6, 0.0]
  - - [2368, 4, 1, 256]
    - [77, 0.0]
  - - [3584, 5888, 1, 256]
    - [68, 0.0]
  - - [2368, 1024, 1, 128]
    - [56, 0.0]
  - - [2368, 704, 1, 128]
    - [57, 0.0]
  - - [3584, 2944, 1, 1280]
    - [72, 0.0]
  - - [3584, 2368, 1, 128]
    - [56, 0.0]
  - - [5056, 704, 1, 128]
    - [56, 0.0]
  - - [448, 2368, 1, 128]
    - [56, 0.0]
  - - [5056, 1408, 1, 3328]
    - [68, 0.0]
  - - [1408, 704, 1, 256]
    - [64, 0.0]
  - - [6784, 1024, 1, 3328]
    - [72, 0.0]
  - - [6784, 2944, 1, 3328]
    - [72, 0.0]
  - - [2944, 5056, 1, 3328]
    - [72, 0.0]
  - - [1856, 1856, 1, 256]
    - [59, 0.0]
  - - [1024, 5888, 1, 128]
    - [56, 0.0]
  - - [6784, 2368, 1, 1280]
    - [72, 0.0]
  - - [256, 4, 1, 128]
    - [74, 0.0]
  - - [4288, 5888, 1, 1280]
    - [72, 0.0]
  - - [4288, 4288, 1, 256]
    - [62, 0.0]
  - - [8448, 32, 1, 2816]
    - [20, 0.0]
  - - [448, 2944, 1, 3328]
    - [60, 0.0]
  - - [5888, 4, 1, 128]
    - [74, 0.0]
  - - [4288, 1856, 1, 1280]
    - [68, 0.0]
  - - [1856, 2944, 1, 3328]
    - [68, 0.0]
  - - [256, 6784, 1, 3328]
    - [64, 0.0]
  - - [64, 5888, 1, 256]
    - [64, 0.0]
  - - [256, 5056, 1, 128]
    - [56, 0.0]
  - - [5056, 1024, 1, 256]
    - [59, 0.0]
  - - [704, 64, 1, 3328]
    - [35, 0.0]
  - - [5056, 1856, 1, 3328]
    - [72, 0.0]
  - - [4, 2944, 1, 3328]
    - [43, 0.0]
  - - [4, 5056, 1, 256]
    - [77, 0.0]
  - - [1856, 1408, 1, 256]
    - [59, 0.0]
  - - [8448, 12000, 1, 2816]
    - [72, 0.0]
  - - [6784, 128, 1, 3328]
    - [70, 0.0]
  - - [4288, 1408, 1, 128]
    - [56, 0.0]
  - - [1856, 5888, 1, 3328]
    - [72, 0.0]
  - - [4288, 5056, 1, 256]
    - [62, 0.0]
  - - [1408, 128, 1, 1280]
    - [15, 0.0]
  - - [4096, 800, 1, 1024]
    - [69, 0.0]
  - - [5056, 256, 1, 3328]
    - [69, 0.0]
  - - [704, 704, 1, 256]
    - [58, 0.0]
  - - [1024, 5888, 1, 1280]
    - [68, 0.0]
  - - [6784, 2368, 1, 128]
    - [56, 0.0]
  - - [4, 5056, 1, 1280]
    - [77, 0.0]
  - - [256, 64, 1, 1280]
    - [34, 0.0]
  - - [128, 1856, 1, 1280]
    - [69, 0.0]
  - - [1856, 1024, 1, 1280]
    - [68, 0.0]
  - - [6784, 4288, 1, 1280]
    - [72, 0.0]
  - - [2560, 64, 1, 2560]
    - [15, 0.0]
  - - [1856, 1856, 1, 1280]
    - [63, 0.0]
  - - [4096, 400, 1, 1024]
    - [69, 0.0]
  - - [3072, 24000, 1, 1024]
    - [68, 0.0]
  - - [128, 4288, 1, 3328]
    - [20, 0.0]
  - - [4, 2368, 1, 3328]
    - [80, 0.0]
  - - [5888, 1856, 1, 128]
    - [56, 0.0]
  - - [448, 704, 1, 1280]
    - [69, 0.0]
  - - [128, 5056, 1, 1280]
    - [69, 0.0]
  - - [1024, 448, 1, 3328]
    - [69, 0.0]
  - - [1856, 704, 1, 1280]
    - [69, 0.0]
  - - [5056, 3584, 1, 128]
    - [56, 0.0]
  - - [5888, 5888, 1, 3328]
    - [72, 0.0]
  - - [6784, 1024, 1, 256]
    - [62, 0.0]
  - - [2944, 2368, 1, 256]
    - [62, 0.0]
  - - [256, 448, 1, 256]
    - [64, 0.0]
  - - [5056, 5888, 1, 3328]
    - [72, 0.0]
  - - [1856, 1024, 1, 256]
    - [59, 0.0]
  - - [512, 48000, 1, 1536]
    - [72, 0.0]
  - - [3584, 448, 1, 1280]
    - [69, 0.0]
  - - [8448, 5984, 1, 2816]
    - [72, 0.0]
  - - [1024, 1024, 1, 1280]
    - [71, 0.0]
  - - [448, 5888, 1, 256]
    - [64, 0.0]
  - - [704, 64, 1, 128]
    - [6, 0.0]
  - - [1408, 6784, 1, 3328]
    - [72, 0.0]
  - - [448, 1024, 1, 128]
    - [56, 0.0]
  - - [4288, 704, 1, 128]
    - [56, 0.0]
  - - [128, 1856, 1, 128]
    - [7, 0.0]
  - - [448, 2368, 1, 3328]
    - [69, 0.0]
  - - [5056, 64, 1, 128]
    - [6, 0.0]
  - - [5056, 2944, 1, 256]
    - [62, 0.0]
  - - [6784, 5888, 1, 128]
    - [56, 0.0]
  - - [1024, 700, 1, 512]
    - [64, 0.0]
  - - [704, 1024, 1, 256]
    - [64, 0.0]
  - - [1024, 4, 1, 256]
    - [77, 0.0]
  - - [2944, 704, 1, 128]
    - [56, 0.0]
  - - [128, 6784, 1, 1280]
    - [65, 0.0]
  - - [1408, 3584, 1, 3328]
    - [72, 0.0]
  - - [2368, 6784, 1, 256]
    - [59, 0.0]
  - - [5056, 1408, 1, 1280]
    - [72, 0.0]
  - - [256, 256, 1, 128]
    - [6, 0.0]
  - - [5056, 4288, 1, 128]
    - [56, 0.0]
  - - [1408, 1856, 1, 128]
    - [56, 0.0]
  - - [1408, 5888, 1, 3328]
    - [72, 0.0]
  - - [1856, 256, 1, 256]
    - [58, 0.0]
  - - [6784, 6784, 1, 256]
    - [72, 0.0]
  - - [64, 256, 1, 128]
    - [9, 0.0]
  - - [4288, 2368, 1, 128]
    - [56, 0.0]
  - - [1024, 1024, 1, 128]
    - [56, 0.0]
  - - [256, 4288, 1, 1280]
    - [64, 0.0]
  - - [2368, 2944, 1, 256]
    - [62, 0.0]
  - - [4, 1856, 1, 256]
    - [77, 0.0]
  - - [3584, 1856, 1, 1280]
    - [68, 0.0]
  - - [6784, 6784, 1, 128]
    - [56, 0.0]
  - - [256, 1856, 1, 128]
    - [56, 0.0]
  - - [704, 64, 1, 1280]
    - [53, 0.0]
  - - [5888, 5056, 1, 256]
    - [68, 0.0]
  - - [8448, 48000, 1, 2816]
    - [72, 0.0]
  - - [3584, 448, 1, 256]
    - [69, 0.0]
  - - [448, 4288, 1, 128]
    - [56, 0.0]
  - - [7680, 64, 1, 2560]
    - [21, 0.0]
  - - [256, 6784, 1, 256]
    - [64, 0.0]
  - - [1408, 4288, 1, 128]
    - [56, 0.0]
  - - [2944, 704, 1, 3328]
    - [71, 0.0]
  - - [128, 448, 1, 256]
    - [69, 0.0]
  - - [5056, 256, 1, 1280]
    - [69, 0.0]
  - - [2560, 32, 1, 2560]
    - [14, 0.0]
  - - [3584, 3584, 1, 256]
    - [68, 0.0]
  - - [448, 1408, 1, 128]
    - [56, 0.0]
  - - [128, 256, 1, 1280]
    - [17, 0.0]
  - - [3584, 5056, 1, 256]
    - [68, 0.0]
  - - [6784, 128, 1, 256]
    - [69, 0.0]
  - - [4288, 4, 1, 256]
    - [76, 0.0]
  - - [704, 448, 1, 256]
    - [64, 0.0]
  - - [2944, 2368, 1, 1280]
    - [72, 0.0]
  - - [448, 64, 1, 3328]
    - [53, 0.0]
  - - [1408, 3584, 1, 256]
    - [59, 0.0]
  - - [3584, 4, 1, 3328]
    - [78, 0.0]
  - - [6784, 3584, 1, 256]
    - [72, 0.0]
  - - [256, 128, 1, 128]
    - [9, 0.0]
  - - [704, 1408, 1, 128]
    - [56, 0.0]
  - - [4, 2368, 1, 256]
    - [77, 0.0]
  - - [4288, 128, 1, 1280]
    - [69, 0.0]
  - - [128, 1408, 1, 256]
    - [64, 0.0]
  - - [4, 2944, 1, 256]
    - [77, 0.0]
  - - [64, 128, 1, 3328]
    - [44, 0.0]
  - - [5056, 2368, 1, 128]
    - [56, 0.0]
  - - [2944, 2944, 1, 3328]
    - [72, 0.0]
  - - [5056, 6784, 1, 256]
    - [62, 0.0]
  - - [1856, 3584, 1, 128]
    - [56, 0.0]
  - - [128, 2944, 1, 128]
    - [12, 0.0]
  - - [35, 8457, 1, 2560]
    - [4, 0.0]
  - - [1024, 704, 1, 3328]
    - [69, 0.0]
  - - [6784, 448, 1, 256]
    - [69, 0.0]
  - - [3584, 6784, 1, 128]
    - [56, 0.0]
  - - [128, 4288, 1, 256]
    - [69, 0.0]
  - - [704, 448, 1, 3328]
    - [69, 0.0]
  - - [1024, 1024, 1, 3328]
    - [71, 0.0]
  - - [128, 128, 1, 3328]
    - [44, 0.0]
  - - [5056, 1856, 1, 256]
    - [62, 0.0]
  - - [4608, 5984, 1, 1536]
    - [72, 0.0]
  - - [256, 128, 1, 256]
    - [19, 0.0]
  - - [1760, 3200, 1, 1760]
    - [62, 0.0]
  - - [1024, 1856, 1, 256]
    - [63, 0.0]
  - - [4096, 1600, 1, 1024]
    - [68, 0.0]
  - - [4288, 64, 1, 128]
    - [9, 0.0]
  - - [256, 448, 1, 3328]
    - [15, 0.0]
  - - [1408, 6784, 1, 1280]
    - [72, 0.0]
  - - [3584, 3584, 1, 1280]
    - [72, 0.0]
  - - [7680, 24000, 1, 2560]
    - [68, 0.0]
  - - [64, 2368, 1, 1280]
    - [24, 0.0]
  - - [448, 2368, 1, 1280]
    - [69, 0.0]
  - - [4608, 48000, 1, 1536]
    - [68, 0.0]
  - - [5888, 5888, 1, 128]
    - [56, 0.0]
  - - [64, 6784, 1, 3328]
    - [64, 0.0]
  - - [2944, 256, 1, 1280]
    - [69, 0.0]
  - - [2048, 16, 1, 2048]
    - [34, 0.0]
  - - [256, 2368, 1, 128]
    - [56, 0.0]
  - - [5056, 2368, 1, 3328]
    - [72, 0.0]
  - - [2944, 4288, 1, 256]
    - [62, 0.0]
  - - [1408, 3584, 1, 1280]
    - [68, 0.0]
  - - [2368, 64, 1, 256]
    - [64, 0.0]
  - - [64, 448, 1, 3328]
    - [53, 0.0]
  - - [704, 128, 1, 3328]
    - [14, 0.0]
  - - [8192, 1600, 1, 2048]
    - [68, 0.0]
  - - [1856, 704, 1, 256]
    - [69, 0.0]
  - - [4, 4288, 1, 1280]
    - [77, 0.0]
  - - [1408, 448, 1, 3328]
    - [69, 0.0]
  - - [1024, 4, 1, 3328]
    - [79, 0.0]
  - - [512, 24000, 1, 2560]
    - [68, 0.0]
  - - [2368, 6784, 1, 3328]
    - [72, 0.0]
  - - [1856, 1408, 1, 1280]
    - [59, 0.0]
  - - [1856, 448, 1, 1280]
    - [71, 0.0]
  - - [6784, 704, 1, 128]
    - [56, 0.0]
  - - [4, 4, 1, 256]
    - [77, 0.0]
  - - [128, 5888, 1, 128]
    - [7, 0.0]
  - - [1408, 5888, 1, 256]
    - [68, 0.0]
  - - [704, 2944, 1, 1280]
    - [65, 0.0]
  - - [4288, 64, 1, 1280]
    - [24, 0.0]
  - - [256, 64, 1, 256]
    - [26, 0.0]
  - - [1024, 1024, 1, 256]
    - [69, 0.0]
  - - [704, 1856, 1, 256]
    - [64, 0.0]
  - - [704, 6784, 1, 128]
    - [56, 0.0]
  - - [3584, 704, 1, 1280]
    - [63, 0.0]
  - - [256, 128, 1, 1280]
    - [17, 0.0]
  - - [5888, 2368, 1, 256]
    - [68, 0.0]
  - - [256, 2368, 1, 1280]
    - [64, 0.0]
  - - [2944, 6784, 1, 128]
    - [56, 0.0]
  - - [3584, 448, 1, 3328]
    - [69, 0.0]
  - - [1408, 4, 1, 256]
    - [77, 0.0]
  - - [704, 2368, 1, 3328]
    - [69, 0.0]
  - - [2944, 448, 1, 256]
    - [63, 0.0]
  - - [1856, 448, 1, 128]
    - [56, 0.0]
  - - [4288, 4, 1, 3328]
    - [33, 0.0]
  - - [2368, 128, 1, 1280]
    - [64, 0.0]
  - - [256, 5888, 1, 128]
    - [56, 0.0]
  - - [64, 6784, 1, 256]
    - [64, 0.0]
  - - [64, 5056, 1, 1280]
    - [64, 0.0]
  - - [4, 6784, 1, 128]
    - [74, 0.0]
  - - [2048, 3200, 1, 512]
    - [68, 0.0]
  - - [2944, 2944, 1, 1280]
    - [72, 0.0]
  - - [5056, 448, 1, 3328]
    - [69, 0.0]
  - - [4, 3584, 1, 1280]
    - [78, 0.0]
  - - [1408, 128, 1, 128]
    - [6, 0.0]
  - - [6784, 704, 1, 3328]
    - [68, 0.0]
  - - [128, 64, 1, 1280]
    - [33, 0.0]
  - - [2368, 256, 1, 1280]
    - [69, 0.0]
  - - [4, 448, 1, 3328]
    - [80, 0.0]
  - - [5888, 4288, 1, 128]
    - [56, 0.0]
  - - [4, 5888, 1, 256]
    - [77, 0.0]
  - - [1408, 2944, 1, 3328]
    - [72, 0.0]
  - - [3584, 704, 1, 128]
    - [56, 0.0]
  - - [4608, 12000, 1, 1536]
    - [72, 0.0]
  - - [64, 1024, 1, 256]
    - [64, 0.0]
  - - [5056, 5056, 1, 128]
    - [56, 0.0]
  - - [2368, 448, 1, 1280]
    - [69, 0.0]
  - - [128, 3584, 1, 256]
    - [69, 0.0]
  - - [704, 448, 1, 1280]
    - [69, 0.0]
  - - [8192, 800, 1, 2048]
    - [68, 0.0]
  - - [448, 5056, 1, 128]
    - [56, 0.0]
  - - [256, 4, 1, 1280]
    - [43, 0.0]
  - - [5056, 3584, 1, 256]
    - [62, 0.0]
  - - [2368, 4, 1, 3328]
    - [43, 0.0]
  - - [1408, 5056, 1, 128]
    - [56, 0.0]
  - - [2944, 3584, 1, 128]
    - [56, 0.0]
  - - [3584, 2368, 1, 256]
    - [69, 0.0]
  - - [128, 3584, 1, 3328]
    - [64, 0.0]
  - - [128, 1024, 1, 1280]
    - [15, 0.0]
  - - [8448, 24000, 1, 2816]
    - [72, 0.0]
  - - [64, 704, 1, 256]
    - [64, 0.0]
  - - [4288, 256, 1, 1280]
    - [69, 0.0]
  - - [3584, 3584, 1, 3328]
    - [72, 0.0]
  - - [1024, 256, 1, 128]
    - [56, 0.0]
  - - [4, 704, 1, 128]
    - [74, 0.0]
  - - [5888, 6784, 1, 256]
    - [72, 0.0]
  - - [4288, 2944, 1, 3328]
    - [72, 0.0]
  - - [2944, 64, 1, 128]
    - [11, 0.0]
  - - [1024, 128, 1, 3328]
    - [20, 0.0]
  - - [1024, 16, 1, 500000]
    - [0, 0.0]
  - - [4288, 128, 1, 3328]
    - [30, 0.0]
  - - [7680, 128, 1, 2560]
    - [30, 0.0]
  - - [256, 5056, 1, 1280]
    - [69, 0.0]
  - - [1408, 256, 1, 128]
    - [56, 0.0]
  - - [2944, 5888, 1, 3328]
    - [72, 0.0]
  - - [6784, 5888, 1, 1280]
    - [72, 0.0]
  - - [2048, 800, 1, 512]
    - [69, 0.0]
  - - [704, 128, 1, 256]
    - [64, 0.0]
  - - [5888, 4288, 1, 1280]
    - [72, 0.0]
  - - [1024, 24000, 1, 2048]
    - [68, 0.0]
  - - [448, 256, 1, 1280]
    - [15, 0.0]
  - - [5888, 3584, 1, 128]
    - [56, 0.0]
  - - [1024, 2944, 1, 128]
    - [56, 0.0]
  - - [5056, 4, 1, 1280]
    - [77, 0.0]
  - - [256, 1408, 1, 1280]
    - [69, 0.0]
  - - [3072, 16, 1, 1024]
    - [17, 0.0]
  - - [704, 3584, 1, 128]
    - [56, 0.0]
  - - [5888, 448, 1, 3328]
    - [72, 0.0]
  - - [2368, 4288, 1, 1280]
    - [59, 0.0]
  - - [4288, 2944, 1, 128]
    - [56, 0.0]
  - - [1024, 6784, 1, 3328]
    - [68, 0.0]
  - - [128, 2368, 1, 256]
    - [64, 0.0]
  - - [6784, 64, 1, 3328]
    - [69, 0.0]
  - - [5056, 2944, 1, 3328]
    - [72, 0.0]
  - - [448, 128, 1, 256]
    - [64, 0.0]
  - - [2944, 3584, 1, 256]
    - [62, 0.0]
  - - [1408, 1408, 1, 3328]
    - [68, 0.0]
  - - [1856, 128, 1, 1280]
    - [64, 0.0]
  - - [3584, 3584, 1, 128]
    - [56, 0.0]
  - - [64, 3584, 1, 256]
    - [64, 0.0]
  - - [1408, 4, 1, 3328]
    - [79, 0.0]
  - - [128, 2944, 1, 3328]
    - [20, 0.0]
  - - [3584, 704, 1, 256]
    - [69, 0.0]
  - - [2944, 448, 1, 3328]
    - [63, 0.0]
  - - [3584, 1408, 1, 3328]
    - [68, 0.0]
  - - [704, 3584, 1, 1280]
    - [59, 0.0]
  - - [2944, 6784, 1, 1280]
    - [72, 0.0]
  - - [1856, 6784, 1, 256]
    - [62, 0.0]
  - - [4288, 448, 1, 3328]
    - [71, 0.0]
  - - [6784, 4288, 1, 128]
    - [56, 0.0]
  - - [6784, 704, 1, 1280]
    - [68, 0.0]
  - - [256, 4288, 1, 256]
    - [64, 0.0]
  - - [3584, 6784, 1, 256]
    - [72, 0.0]
  - - [6144, 12000, 1, 2048]
    - [68, 0.0]
  - - [6144, 16, 1, 2560]
    - [22, 0.0]
  - - [3584, 64, 1, 128]
    - [9, 0.0]
  - - [5888, 1024, 1, 3328]
    - [68, 0.0]
  - - [448, 64, 1, 128]
    - [9, 0.0]
  - - [704, 6784, 1, 1280]
    - [72, 0.0]
  - - [4, 1024, 1, 1280]
    - [79, 0.0]
  - - [5888, 128, 1, 256]
    - [69, 0.0]
  - - [4096, 16, 1, 4096]
    - [47, 0.0]
  - - [1856, 5056, 1, 3328]
    - [72, 0.0]
  - - [4, 6784, 1, 256]
    - [77, 0.0]
  - - [1024, 3584, 1, 128]
    - [56, 0.0]
  - - [1024, 1408, 1, 128]
    - [56, 0.0]
  - - [2368, 2944, 1, 128]
    - [56, 0.0]
  - - [5056, 64, 1, 256]
    - [69, 0.0]
  - - [4, 448, 1, 1280]
    - [33, 0.0]
  - - [5056, 2944, 1, 128]
    - [56, 0.0]
  - - [5888, 5056, 1, 3328]
    - [72, 0.0]
  - - [1024, 704, 1, 128]
    - [56, 0.0]
  - - [5888, 2368, 1, 128]
    - [56, 0.0]
  - - [128, 5056, 1, 3328]
    - [64, 0.0]
  - - [3584, 6784, 1, 1280]
    - [72, 0.0]
  - - [448, 4, 1, 1280]
    - [43, 0.0]
  - - [1856, 5888, 1, 256]
    - [59, 0.0]
  - - [256, 256, 1, 256]
    - [64, 0.0]
  - - [256, 64, 1, 128]
    - [9, 0.0]
  - - [4288, 4288, 1, 3328]
    - [72, 0.0]
  - - [4288, 1408, 1, 1280]
    - [68, 0.0]
  - - [3584, 5056, 1, 128]
    - [56, 0.0]
  - - [4, 1024, 1, 3328]
    - [79, 0.0]
  - - [4288, 2368, 1, 256]
    - [62, 0.0]
  - - [2944, 5056, 1, 1280]
    - [72, 0.0]
  - - [448, 6784, 1, 256]
    - [59, 0.0]
  - - [64, 128, 1, 128]
    - [6, 0.0]
  - - [1856, 2368, 1, 128]
    - [56, 0.0]
  - - [6784, 2368, 1, 3328]
    - [72, 0.0]
  - - [256, 1024, 1, 1280]
    - [69, 0.0]
  - - [704, 4, 1, 128]
    - [74, 0.0]
  - - [256, 4, 1, 256]
    - [77, 0.0]
  - - [4288, 128, 1, 256]
    - [58, 0.0]
  - - [4288, 1856, 1, 3328]
    - [72, 0.0]
  - - [3584, 448, 1, 128]
    - [56, 0.0]
  - - [2048, 1600, 1, 2048]
    - [64, 0.0]
  - - [256, 4, 1, 3328]
    - [81, 0.0]
  - - [4, 1408, 1, 1280]
    - [79, 0.0]
  - - [3584, 64, 1, 1280]
    - [69, 0.0]
  - - [1408, 448, 1, 128]
    - [56, 0.0]
  - - [3584, 1024, 1, 1280]
    - [60, 0.0]
  - - [1856, 5056, 1, 256]
    - [62, 0.0]
  - - [4, 3584, 1, 256]
    - [77, 0.0]
  - - [4, 2944, 1, 1280]
    - [77, 0.0]
  - - [1024, 4288, 1, 256]
    - [64, 0.0]
  - - [5888, 3584, 1, 3328]
    - [72, 0.0]
  - - [1856, 4, 1, 256]
    - [77, 0.0]
  - - [4, 256, 1, 256]
    - [77, 0.0]
  - - [5056, 3584, 1, 3328]
    - [72, 0.0]
  - - [704, 448, 1, 128]
    - [56, 0.0]
  - - [2368, 1408, 1, 1280]
    - [69, 0.0]
  - - [5056, 2944, 1, 1280]
    - [72, 0.0]
  - - [4, 4, 1, 128]
    - [75, 0.0]
  - - [3584, 256, 1, 256]
    - [69, 0.0]
  - - [1024, 6784, 1, 256]
    - [72, 0.0]
  - - [4, 128, 1, 256]
    - [77, 0.0]
  - - [64, 64, 1, 1280]
    - [45, 0.0]
  - - [5124, 9124, 1, 2048]
    - [68, 0.0]
  - - [6784, 4, 1, 128]
    - [74, 0.0]
  - - [2944, 1408, 1, 128]
    - [56, 0.0]
  - - [448, 128, 1, 3328]
    - [38, 0.0]
  - - [3584, 1408, 1, 1280]
    - [72, 0.0]
  - - [64, 4288, 1, 3328]
    - [37, 0.0]
  - - [5056, 6784, 1, 3328]
    - [72, 0.0]
  - - [128, 2944, 1, 256]
    - [64, 0.0]
  - - [128, 6784, 1, 128]
    - [7, 0.0]
  - - [3584, 4288, 1, 256]
    - [68, 0.0]
  - - [448, 1856, 1, 256]
    - [64, 0.0]
  - - [1856, 6784, 1, 3328]
    - [72, 0.0]
  - - [3584, 128, 1, 3328]
    - [69, 0.0]
  - - [64, 1856, 1, 256]
    - [64, 0.0]
  - - [64, 448, 1, 256]
    - [17, 0.0]
  - - [5888, 4288, 1, 256]
    - [68, 0.0]
  - - [4, 448, 1, 128]
    - [74, 0.0]
  - - [5056, 1408, 1, 256]
    - [62, 0.0]
  - - [35, 8457, 1, 2048]
    - [5, 0.0]
  - - [64, 256, 1, 1280]
    - [40, 0.0]
  - - [3584, 1024, 1, 256]
    - [59, 0.0]
  - - [256, 704, 1, 256]
    - [64, 0.0]
  - - [5888, 5888, 1, 256]
    - [68, 0.0]
  - - [4288, 1024, 1, 1280]
    - [63, 0.0]
  - - [5888, 128, 1, 3328]
    - [64, 0.0]
  - - [448, 6784, 1, 3328]
    - [70, 0.0]
  - - [2944, 1408, 1, 1280]
    - [68, 0.0]
  - - [64, 128, 1, 1280]
    - [39, 0.0]
  - - [2944, 1856, 1, 3328]
    - [63, 0.0]
  - - [2368, 64, 1, 128]
    - [9, 0.0]
  - - [256, 1024, 1, 128]
    - [56, 0.0]
  - - [3584, 5888, 1, 1280]
    - [72, 0.0]
  - - [64, 4, 1, 128]
    - [74, 0.0]
  - - [6784, 1856, 1, 1280]
    - [72, 0.0]
  - - [2944, 5056, 1, 256]
    - [59, 0.0]
  - - [4288, 4, 1, 128]
    - [74, 0.0]
  - - [5888, 256, 1, 3328]
    - [63, 0.0]
  - - [2944, 4288, 1, 128]
    - [56, 0.0]
  - - [3584, 1408, 1, 256]
    - [68, 0.0]
  - - [704, 3584, 1, 3328]
    - [65, 0.0]
  - - [4096, 3200, 1, 1024]
    - [68, 0.0]
  - - [5056, 448, 1, 1280]
    - [69, 0.0]
  - - [3584, 1856, 1, 3328]
    - [72, 0.0]
  - - [4288, 6784, 1, 1280]
    - [72, 0.0]
  - - [2560, 7000, 1, 2560]
    - [72, 0.0]
  - - [1408, 704, 1, 1280]
    - [71, 0.0]
  - - [2944, 1024, 1, 256]
    - [59, 0.0]
  - - [6784, 64, 1, 256]
    - [69, 0.0]
  - - [2368, 4288, 1, 3328]
    - [72, 0.0]
  - - [4, 1408, 1, 256]
    - [77, 0.0]
  - - [1024, 1408, 1, 1280]
    - [60, 0.0]
  - - [64, 64, 1, 256]
    - [46, 0.0]
  - - [704, 256, 1, 3328]
    - [73, 0.0]
  - - [6784, 5056, 1, 256]
    - [72, 0.0]
  - - [1856, 1856, 1, 128]
    - [56, 0.0]
  - - [3584, 5056, 1, 3328]
    - [72, 0.0]
  - - [448, 6784, 1, 128]
    - [56, 0.0]
  - - [4, 704, 1, 3328]
    - [79, 0.0]
  - - [35, 8457, 1, 4096]
    - [5, 0.0]
  - - [448, 2944, 1, 256]
    - [59, 0.0]
  - - [4, 4288, 1, 3328]
    - [33, 0.0]
  - - [2944, 6784, 1, 256]
    - [68, 0.0]
  - - [2944, 2944, 1, 128]
    - [56, 0.0]
  - - [4, 4, 1, 1280]
    - [43, 0.0]
  - - [1856, 3584, 1, 1280]
    - [68, 0.0]
  - - [64, 2944, 1, 256]
    - [64, 0.0]
  - - [448, 256, 1, 128]
    - [9, 0.0]
  - - [4288, 448, 1, 128]
    - [56, 0.0]
  - - [4608, 24000, 1, 1536]
    - [72, 0.0]
  - - [1856, 1408, 1, 3328]
    - [70, 0.0]
  - - [128, 128, 1, 128]
    - [9, 0.0]
  - - [1024, 4288, 1, 3328]
    - [69, 0.0]
  - - [448, 2368, 1, 256]
    - [69, 0.0]
  - - [1024, 4, 1, 128]
    - [74, 0.0]
  - - [64, 1408, 1, 1280]
    - [49, 0.0]
  - - [64, 6784, 1, 1280]
    - [64, 0.0]
  - - [5056, 448, 1, 256]
    - [69, 0.0]
  - - [2944, 2368, 1, 3328]
    - [72, 0.0]
  - - [704, 4288, 1, 3328]
    - [70, 0.0]
  - - [1408, 128, 1, 256]
    - [64, 0.0]
  - - [1024, 1856, 1, 1280]
    - [72, 0.0]
  - - [2048, 6400, 1, 2048]
    - [68, 0.0]
  - - [512, 48000, 1, 2816]
    - [72, 0.0]
  - - [5124, 9124, 1, 2560]
    - [72, 0.0]
  - - [128, 2368, 1, 3328]
    - [30, 0.0]
  - - [1024, 5888, 1, 256]
    - [72, 0.0]
  - - [64, 2944, 1, 1280]
    - [24, 0.0]
  - - [5056, 64, 1, 3328]
    - [30, 0.0]
  - - [128, 704, 1, 128]
    - [9, 0.0]
  - - [1408, 2368, 1, 256]
    - [64, 0.0]
  - - [1408, 1408, 1, 256]
    - [59, 0.0]
  - - [4, 64, 1, 128]
    - [74, 0.0]
  - - [64, 1024, 1, 128]
    - [6, 0.0]
  - - [1024, 8, 1, 500000]
    - [1, 0.0]
  - - [2368, 2368, 1, 128]
    - [56, 0.0]
  - - [64, 5888, 1, 128]
    - [6, 0.0]
  - - [5888, 4, 1, 3328]
    - [33, 0.0]
  - - [6784, 1408, 1, 128]
    - [56, 0.0]
  - - [4288, 5888, 1, 256]
    - [62, 0.0]
  - - [1408, 5056, 1, 256]
    - [59, 0.0]
  - - [5056, 128, 1, 3328]
    - [69, 0.0]
  - - [128, 128, 1, 1280]
    - [40, 0.0]
  - - [448, 704, 1, 256]
    - [64, 0.0]
  - - [4288, 3584, 1, 128]
    - [56, 0.0]
  - - [2944, 128, 1, 3328]
    - [30, 0.0]
  - - [64, 1408, 1, 3328]
    - [15, 0.0]
  - - [3584, 5056, 1, 1280]
    - [72, 0.0]
  - - [256, 448, 1, 1280]
    - [15, 0.0]
  - - [704, 704, 1, 128]
    - [56, 0.0]
  - - [5056, 4, 1, 128]
    - [74, 0.0]
  - - [704, 256, 1, 1280]
    - [64, 0.0]
  - - [64, 2368, 1, 3328]
    - [15, 0.0]
  - - [1856, 1024, 1, 128]
    - [56, 0.0]
  - - [1856, 64, 1, 128]
    - [12, 0.0]
  - - [4096, 64, 1, 4096]
    - [25, 0.0]
  - - [1024, 24000, 1, 1536]
    - [72, 0.0]
  - - [704, 4288, 1, 256]
    - [59, 0.0]
  - - [5888, 2368, 1, 1280]
    - [72, 0.0]
  - - [128, 256, 1, 256]
    - [69, 0.0]
  - - [64, 128, 1, 256]
    - [54, 0.0]
  - - [2368, 5888, 1, 1280]
    - [68, 0.0]
  - - [5888, 256, 1, 1280]
    - [59, 0.0]
  - - [1760, 128, 1, 1760]
    - [15, 0.0]
  - - [4, 5888, 1, 1280]
    - [77, 0.0]
  - - [704, 128, 1, 128]
    - [9, 0.0]
  - - [1024, 4, 1, 1280]
    - [79, 0.0]
  - - [2368, 1856, 1, 3328]
    - [69, 0.0]
  - - [2368, 128, 1, 128]
    - [6, 0.0]
  - - [2944, 704, 1, 256]
    - [64, 0.0]
  - - [5056, 128, 1, 128]
    - [7, 0.0]
  - - [2368, 1024, 1, 3328]
    - [62, 0.0]
  - - [256, 704, 1, 3328]
    - [73, 0.0]
  - - [704, 3584, 1, 256]
    - [59, 0.0]
  - - [1024, 1024, 1, 1024]
    - [70, 0.0]
  - - [704, 2944, 1, 3328]
    - [65, 0.0]
  - - [6784, 1024, 1, 128]
    - [56, 0.0]
  - - [256, 448, 1, 128]
    - [12, 0.0]
  - - [448, 1024, 1, 3328]
    - [64, 0.0]
  - - [2944, 1024, 1, 3328]
    - [72, 0.0]
  - - [2944, 5056, 1, 128]
    - [56, 0.0]
  - - [2368, 256, 1, 256]
    - [64, 0.0]
  - - [1408, 6784, 1, 256]
    - [59, 0.0]
  - - [6784, 1408, 1, 3328]
    - [72, 0.0]
  - - [4288, 6784, 1, 128]
    - [56, 0.0]
  - - [704, 64, 1, 256]
    - [64, 0.0]
  - - [5888, 4, 1, 1280]
    - [77, 0.0]
  - - [256, 2368, 1, 3328]
    - [69, 0.0]
  - - [6784, 2944, 1, 1280]
    - [72, 0.0]
  - - [4288, 1856, 1, 128]
    - [56, 0.0]
  - - [1856, 2944, 1, 128]
    - [56, 0.0]
  - - [6784, 448, 1, 128]
    - [56, 0.0]
  - - [64, 3584, 1, 128]
    - [7, 0.0]
  - - [448, 5056, 1, 1280]
    - [64, 0.0]
  - - [2368, 1856, 1, 128]
    - [56, 0.0]
  - - [64, 2944, 1, 3328]
    - [30, 0.0]
  - - [4288, 704, 1, 256]
    - [63, 0.0]
  - - [256, 3584, 1, 128]
    - [56, 0.0]
  - - [5888, 704, 1, 256]
    - [69, 0.0]
  - - [3584, 1024, 1, 128]
    - [56, 0.0]
  - - [256, 5888, 1, 3328]
    - [59, 0.0]
  - - [1408, 4288, 1, 3328]
    - [68, 0.0]
  - - [6784, 4288, 1, 256]
    - [72, 0.0]
  - - [4288, 256, 1, 128]
    - [56, 0.0]
  - - [5888, 256, 1, 256]
    - [59, 0.0]
  - - [6784, 1024, 1, 1280]
    - [72, 0.0]
  - - [5888, 1024, 1, 128]
    - [56, 0.0]
  - - [1024, 128, 1, 256]
    - [69, 0.0]
  - - [512, 16, 1, 500000]
    - [3, 0.0]
  - - [128, 64, 1, 3328]
    - [43, 0.0]
  - - [448, 64, 1, 256]
    - [39, 0.0]
  - - [2368, 256, 1, 128]
    - [56, 0.0]
  - - [6784, 3584, 1, 1280]
    - [72, 0.0]
  - - [1024, 6784, 1, 1280]
    - [72, 0.0]
  - - [2944, 64, 1, 1280]
    - [15, 0.0]
  - - [1408, 2944, 1, 1280]
    - [72, 0.0]
  - - [256, 1856, 1, 256]
    - [58, 0.0]
  - - [2048, 800, 1, 2048]
    - [69, 0.0]
  - - [1408, 2368, 1, 3328]
    - [69, 0.0]
  - - [2944, 4, 1, 3328]
    - [77, 0.0]
  - - [128, 1408, 1, 3328]
    - [20, 0.0]
  - - [2944, 1856, 1, 128]
    - [56, 0.0]
  - - [256, 2944, 1, 128]
    - [56, 0.0]
  - - [256, 6784, 1, 128]
    - [56, 0.0]
  - - [2368, 4, 1, 128]
    - [74, 0.0]
  - - [1408, 256, 1, 3328]
    - [69, 0.0]
  - - [1856, 4, 1, 128]
    - [74, 0.0]
  - - [5056, 6784, 1, 128]
    - [56, 0.0]
  - - [4288, 5056, 1, 128]
    - [56, 0.0]
  - - [1856, 5888, 1, 128]
    - [56, 0.0]
  - - [2944, 5888, 1, 256]
    - [68, 0.0]
  - - [3584, 1856, 1, 256]
    - [60, 0.0]
  - - [4288, 3584, 1, 1280]
    - [72, 0.0]
  - - [2368, 448, 1, 256]
    - [64, 0.0]
  - - [4288, 256, 1, 3328]
    - [69, 0.0]
  - - [1856, 704, 1, 128]
    - [56, 0.0]
  - - [1408, 64, 1, 256]
    - [64, 0.0]
  - - [64, 1856, 1, 128]
    - [6, 0.0]
  - - [4, 256, 1, 128]
    - [74, 0.0]
  - - [2560, 16, 1, 2560]
    - [34, 0.0]
  - - [704, 5888, 1, 128]
    - [56, 0.0]
  - - [6784, 3584, 1, 128]
    - [56, 0.0]
  - - [1024, 64, 1, 256]
    - [64, 0.0]
  - - [64, 2368, 1, 256]
    - [64, 0.0]
  - - [4288, 5056, 1, 3328]
    - [72, 0.0]
  - - [4, 1856, 1, 1280]
    - [77, 0.0]
  - - [4288, 128, 1, 128]
    - [12, 0.0]
  - - [1408, 1408, 1, 128]
    - [56, 0.0]
  - - [7680, 16, 1, 2560]
    - [13, 0.0]
  - - [1856, 128, 1, 128]
    - [12, 0.0]
  - - [5056, 2368, 1, 256]
    - [62, 0.0]
  - - [4288, 704, 1, 3328]
    - [71, 0.0]
  - - [448, 3584, 1, 256]
    - [64, 0.0]
  - - [2368, 64, 1, 1280]
    - [15, 0.0]
  - - [2368, 1024, 1, 1280]
    - [63, 0.0]
  - - [2944, 1408, 1, 3328]
    - [72, 0.0]
  - - [1408, 448, 1, 256]
    - [58, 0.0]
  - - [1024, 1408, 1, 3328]
    - [60, 0.0]
  - - [2944, 5888, 1, 1280]
    - [72, 0.0]
  - - [1408, 4, 1, 1280]
    - [79, 0.0]
  - - [5888, 3584, 1, 256]
    - [72, 0.0]
  - - [2368, 5056, 1, 128]
    - [56, 0.0]
  - - [1408, 1856, 1, 3328]
    - [71, 0.0]
  - - [4, 4, 1, 3328]
    - [81, 0.0]
  - - [6784, 1408, 1, 1280]
    - [72, 0.0]
  - - [4096, 7000, 1, 4096]
    - [68, 0.0]
  - - [704, 2944, 1, 256]
    - [64, 0.0]
  - - [4288, 64, 1, 256]
    - [64, 0.0]
  - - [6784, 5888, 1, 3328]
    - [72, 0.0]
  - - [2368, 4288, 1, 128]
    - [56, 0.0]
  - - [64, 4288, 1, 1280]
    - [24, 0.0]
  - - [6784, 64, 1, 1280]
    - [69, 0.0]
  - - [3584, 128, 1, 128]
    - [8, 0.0]
  - - [1024, 6784, 1, 128]
    - [56, 0.0]
  - - [4, 1856, 1, 128]
    - [74, 0.0]
  - - [1408, 64, 1, 3328]
    - [32, 0.0]
  - - [6784, 4, 1, 256]
    - [76, 0.0]
  - - [1408, 1408, 1, 1280]
    - [68, 0.0]
  - - [16384, 400, 1, 4096]
    - [68, 0.0]
  - - [256, 2368, 1, 256]
    - [58, 0.0]
  - - [448, 4288, 1, 3328]
    - [65, 0.0]
  - - [2368, 1408, 1, 256]
    - [69, 0.0]
  - - [5888, 5056, 1, 128]
    - [56, 0.0]
  - - [704, 2368, 1, 256]
    - [64, 0.0]
  - - [1024, 24000, 1, 2560]
    - [68, 0.0]
  - - [2944, 448, 1, 1280]
    - [59, 0.0]
  - - [5888, 2368, 1, 3328]
    - [72, 0.0]
  - - [5124, 9124, 1, 1760]
    - [62, 0.0]
  - - [448, 1408, 1, 1280]
    - [64, 0.0]
  - - [448, 1856, 1, 1280]
    - [71, 0.0]
  - - [4288, 448, 1, 1280]
    - [63, 0.0]
  - - [5888, 704, 1, 3328]
    - [71, 0.0]
  - - [5056, 256, 1, 128]
    - [56, 0.0]
  - - [1856, 256, 1, 128]
    - [56, 0.0]
  - - [64, 1408, 1, 128]
    - [9, 0.0]
  - - [704, 4, 1, 256]
    - [77, 0.0]
  - - [1408, 5888, 1, 128]
    - [56, 0.0]
  - - [7680, 12000, 1, 2560]
    - [72, 0.0]
  - - [1408, 1024, 1, 256]
    - [59, 0.0]
  - - [8192, 400, 1, 2048]
    - [72, 0.0]
  - - [1024, 1856, 1, 128]
    - [56, 0.0]
  - - [256, 704, 1, 128]
    - [56, 0.0]
  - - [2560, 128, 1, 2560]
    - [16, 0.0]
  - - [448, 1024, 1, 256]
    - [64, 0.0]
  - - [128, 4, 1, 3328]
    - [81, 0.0]
  - - [5056, 6784, 1, 1280]
    - [72, 0.0]
  - - [1408, 64, 1, 128]
    - [12, 0.0]
  - - [1024, 448, 1, 1280]
    - [69, 0.0]
  - - [704, 5056, 1, 3328]
    - [70, 0.0]
  - - [128, 5056, 1, 256]
    - [64, 0.0]
  - - [64, 1024, 1, 3328]
    - [18, 0.0]
  - - [1856, 4, 1, 3328]
    - [43, 0.0]
  - - [4, 2944, 1, 128]
    - [74, 0.0]
  - - [2368, 2944, 1, 3328]
    - [68, 0.0]
  - - [448, 448, 1, 1280]
    - [15, 0.0]
  - - [2368, 3584, 1, 256]
    - [62, 0.0]
  - - [1024, 256, 1, 1280]
    - [69, 0.0]
  - - [5056, 3584, 1, 1280]
    - [72, 0.0]
  - - [5124, 9124, 1, 4096]
    - [68, 0.0]
  - - [7680, 48000, 1, 2560]
    - [68, 0.0]
  - - [448, 4, 1, 3328]
    - [81, 0.0]
  - - [1856, 2944, 1, 1280]
    - [63, 0.0]
  - - [1024, 48000, 1, 2816]
    - [68, 0.0]
  - - [128, 1024, 1, 256]
    - [64, 0.0]
  - - [2944, 1408, 1, 256]
    - [59, 0.0]
  - - [4288, 1408, 1, 3328]
    - [68, 0.0]
  - - [3584, 64, 1, 3328]
    - [21, 0.0]
  - - [5888, 2944, 1, 128]
    - [56, 0.0]
  - - [2944, 1024, 1, 128]
    - [56, 0.0]
  - - [4288, 5056, 1, 1280]
    - [72, 0.0]
  - - [5888, 6784, 1, 1280]
    - [72, 0.0]
  - - [6784, 5056, 1, 128]
    - [56, 0.0]
  - - [256, 1024, 1, 3328]
    - [73, 0.0]
  - - [3584, 4, 1, 256]
    - [77, 0.0]
  - - [1760, 1600, 1, 1760]
    - [62, 0.0]
  - - [1856, 64, 1, 3328]
    - [29, 0.0]
  - - [4, 128, 1, 3328]
    - [81, 0.0]
  - - [5888, 1408, 1, 3328]
    - [68, 0.0]
  - - [448, 2944, 1, 128]
    - [56, 0.0]
  - - [2368, 1856, 1, 256]
    - [69, 0.0]
  - - [256, 5056, 1, 256]
    - [69, 0.0]
  - - [128, 3584, 1, 128]
    - [7, 0.0]
  - - [448, 3584, 1, 3328]
    - [69, 0.0]
  - - [4, 5056, 1, 3328]
    - [80, 0.0]
  - - [704, 2368, 1, 128]
    - [56, 0.0]
  - - [5888, 256, 1, 128]
    - [56, 0.0]
  - - [4, 5056, 1, 128]
    - [74, 0.0]
  - - [448, 256, 1, 256]
    - [64, 0.0]
  - - [704, 4, 1, 3328]
    - [80, 0.0]
  - - [1408, 256, 1, 256]
    - [64, 0.0]
  - - [3584, 1856, 1, 128]
    - [56, 0.0]
  - - [4288, 4288, 1, 128]
    - [56, 0.0]
  - - [1856, 1024, 1, 3328]
    - [72, 0.0]
  - - [128, 5888, 1, 3328]
    - [69, 0.0]
  - - [1024, 5056, 1, 256]
    - [72, 0.0]
  - - [5888, 5888, 1, 1280]
    - [72, 0.0]
  - - [5056, 5888, 1, 128]
    - [56, 0.0]
  - - [2368, 1408, 1, 3328]
    - [69, 0.0]
  - - [1024, 48000, 1, 1536]
    - [68, 0.0]
  - - [5888, 448, 1, 256]
    - [69, 0.0]
  - - [2560, 3200, 1, 2560]
    - [72, 0.0]
  - - [5888, 6784, 1, 128]
    - [56, 0.0]
  - - [6144, 48000, 1, 2048]
    - [68, 0.0]
  - - [6784, 5056, 1, 1280]
    - [72, 0.0]
  - - [5056, 704, 1, 1280]
    - [63, 0.0]
  - - [1024, 48000, 1, 2560]
    - [68, 0.0]
  - - [4608, 32, 1, 1536]
    - [20, 0.0]
  - - [1024, 2368, 1, 128]
    - [57, 0.0]
  - - [128, 704, 1, 256]
    - [64, 0.0]
  - - [2368, 448, 1, 3328]
    - [69, 0.0]
  - - [128, 5888, 1, 1280]
    - [69, 0.0]
  - - [16384, 800, 1, 4096]
    - [68, 0.0]
  - - [448, 128, 1, 1280]
    - [28, 0.0]
  - - [6784, 4, 1, 3328]
    - [33, 0.0]
  - - [5888, 5056, 1, 1280]
    - [72, 0.0]
  - - [1024, 64, 1, 3328]
    - [38, 0.0]
  - - [3072, 48000, 1, 1024]
    - [68, 0.0]
  - - [64, 3584, 1, 1280]
    - [15, 0.0]
  - - [6784, 1408, 1, 256]
    - [62, 0.0]
  - - [3584, 5888, 1, 128]
    - [56, 0.0]
  - - [5056, 5888, 1, 256]
    - [68, 0.0]
  - - [2368, 1024, 1, 256]
    - [62, 0.0]
  - - [2944, 1856, 1, 256]
    - [69, 0.0]
  - - [1856, 6784, 1, 1280]
    - [72, 0.0]
  - - [64, 5056, 1, 128]
    - [6, 0.0]
  - - [64, 6784, 1, 128]
    - [8, 0.0]
  - - [448, 704, 1, 128]
    - [56, 0.0]
  - - [4, 1024, 1, 128]
    - [74, 0.0]
  - - [4288, 3584, 1, 256]
    - [68, 0.0]
  - - [1408, 704, 1, 128]
    - [56, 0.0]
  - - [64, 256, 1, 3328]
    - [40, 0.0]
  - - [6784, 448, 1, 3328]
    - [63, 0.0]
  - - [5056, 1856, 1, 1280]
    - [72, 0.0]
  - - [1408, 1024, 1, 3328]
    - [63, 0.0]
  - - [2368, 256, 1, 3328]
    - [69, 0.0]
  - - [5888, 3584, 1, 1280]
    - [72, 0.0]
  - - [1856, 3584, 1, 3328]
    - [68, 0.0]
  - - [5888, 128, 1, 1280]
    - [64, 0.0]
  - - [1024, 2944, 1, 256]
    - [60, 0.0]
  - - [448, 6784, 1, 1280]
    - [59, 0.0]
  - - [256, 3584, 1, 1280]
    - [65, 0.0]
  - - [704, 5056, 1, 256]
    - [59, 0.0]
  - - [3584, 1024, 1, 3328]
    - [63, 0.0]
  - - [2944, 1856, 1, 1280]
    - [59, 0.0]
  - - [128, 256, 1, 128]
    - [9, 0.0]
  - - [5056, 256, 1, 256]
    - [69, 0.0]
  - - [2944, 4288, 1, 3328]
    - [72, 0.0]
  - - [2368, 3584, 1, 3328]
    - [72, 0.0]
  - - [2944, 704, 1, 1280]
    - [71, 0.0]
  - - [128, 4, 1, 256]
    - [77, 0.0]
  - - [2944, 3584, 1, 1280]
    - [72, 0.0]
  - - [1856, 5888, 1, 1280]
    - [72, 0.0]
  - - [256, 256, 1, 1280]
    - [23, 0.0]
  - - [2048, 3200, 1, 2048]
    - [68, 0.0]
  - - [4288, 1408, 1, 256]
    - [62, 0.0]
  - - [3584, 64, 1, 256]
    - [64, 0.0]
  - - [64, 1856, 1, 3328]
    - [15, 0.0]
  - - [256, 1408, 1, 128]
    - [57, 0.0]
  - - [5888, 1408, 1, 128]
    - [56, 0.0]
  - - [4288, 2368, 1, 1280]
    - [59, 0.0]
  - - [4, 4288, 1, 256]
    - [77, 0.0]
  - - [256, 4288, 1, 128]
    - [56, 0.0]
  - - [2048, 128, 1, 2048]
    - [31, 0.0]
  - - [256, 128, 1, 3328]
    - [55, 0.0]
  - - [512, 8, 1, 500000]
    - [2, 0.0]
  - - [6784, 2368, 1, 256]
    - [63, 0.0]
  - - [5888, 128, 1, 128]
    - [8, 0.0]
  - - [1024, 24000, 1, 2816]
    - [68, 0.0]
  - - [7680, 5984, 1, 2560]
    - [72, 0.0]
  - - [4288, 1856, 1, 256]
    - [62, 0.0]
  - - [1856, 256, 1, 3328]
    - [69, 0.0]
  - - [1856, 2944, 1, 256]
    - [59, 0.0]
  - - [5056, 1024, 1, 128]
    - [56, 0.0]
  - - [64, 5888, 1, 1280]
    - [64, 0.0]
  - - [1760, 800, 1, 1760]
    - [63, 0.0]
  - - [6784, 256, 1, 128]
    - [56, 0.0]
  - - [5888, 704, 1, 128]
    - [56, 0.0]
  - - [1408, 2368, 1, 128]
    - [56, 0.0]
  - - [1024, 4288, 1, 1280]
    - [60, 0.0]
  - - [2368, 5056, 1, 3328]
    - [72, 0.0]
  - - [448, 4, 1, 128]
    - [74, 0.0]
  - - [4, 256, 1, 3328]
    - [80, 0.0]
  - - [4288, 1024, 1, 3328]
    - [63, 0.0]
  - - [6144, 48000, 1, 2560]
    - [68, 0.0]
  - - [1024, 5056, 1, 3328]
    - [68, 0.0]
  - - [1024, 1856, 1, 3328]
    - [68, 0.0]
  - - [704, 704, 1, 1280]
    - [69, 0.0]
  - - [128, 2368, 1, 1280]
    - [20, 0.0]
  - - [1408, 128, 1, 3328]
    - [20, 0.0]
  - - [3584, 256, 1, 1280]
    - [70, 0.0]
  - - [4, 128, 1, 128]
    - [74, 0.0]
  - - [5888, 64, 1, 1280]
    - [64, 0.0]
  - - [3584, 128, 1, 1280]
    - [69, 0.0]
  - - [4, 256, 1, 1280]
    - [80, 0.0]
  - - [128, 704, 1, 3328]
    - [23, 0.0]
  - - [4288, 6784, 1, 256]
    - [62, 0.0]
  - - [3584, 2944, 1, 3328]
    - [72, 0.0]
  - - [128, 1856, 1, 256]
    - [64, 0.0]
  - - [64, 4288, 1, 256]
    - [64, 0.0]
  - - [4, 3584, 1, 3328]
    - [33, 0.0]
  - - [64, 4, 1, 3328]
    - [81, 0.0]
  - - [4, 64, 1, 3328]
    - [43, 0.0]
  - - [5888, 2944, 1, 256]
    - [72, 0.0]
  - - [1856, 64, 1, 256]
    - [64, 0.0]
  - - [5056, 128, 1, 1280]
    - [64, 0.0]
  - - [448, 4288, 1, 1280]
    - [65, 0.0]
  - - [448, 1856, 1, 3328]
    - [70, 0.0]
  - - [1024, 4288, 1, 128]
    - [56, 0.0]
  - - [4, 1024, 1, 256]
    - [77, 0.0]
  - - [5056, 4288, 1, 256]
    - [62, 0.0]
  - - [1024, 448, 1, 256]
    - [58, 0.0]
  - - [1024, 3584, 1, 256]
    - [63, 0.0]
  - - [2944, 128, 1, 1280]
    - [64, 0.0]
  - - [2048, 32, 1, 2048]
    - [52, 0.0]
  - - [64, 256, 1, 256]
    - [50, 0.0]
  - - [1408, 4, 1, 128]
    - [74, 0.0]
  - - [128, 2368, 1, 128]
    - [6, 0.0]
  - - [256, 704, 1, 1280]
    - [69, 0.0]
  - - [64, 2368, 1, 128]
    - [9, 0.0]
  - - [6784, 6784, 1, 3328]
    - [72, 0.0]
  - - [448, 5888, 1, 1280]
    - [69, 0.0]
  - - [5056, 448, 1, 128]
    - [56, 0.0]
  - - [4288, 704, 1, 1280]
    - [63, 0.0]
  - - [3584, 2944, 1, 128]
    - [56, 0.0]
  - - [6784, 256, 1, 1280]
    - [69, 0.0]
  - - [256, 2944, 1, 1280]
    - [64, 0.0]
  - - [64, 4288, 1, 128]
    - [12, 0.0]
  - - [2368, 5888, 1, 3328]
    - [72, 0.0]
  - - [4, 64, 1, 256]
    - [77, 0.0]
  - - [704, 1024, 1, 3328]
    - [64, 0.0]
  - - [2368, 1856, 1, 1280]
    - [63, 0.0]
  - - [448, 5056, 1, 3328]
    - [69, 0.0]
  - - [128, 448, 1, 128]
    - [6, 0.0]
  - - [128, 6784, 1, 256]
    - [64, 0.0]
  - - [3584, 4288, 1, 128]
    - [56, 0.0]
  - - [64, 448, 1, 128]
    - [6, 0.0]
  - - [5888, 4288, 1, 3328]
    - [72, 0.0]
  - - [2368, 704, 1, 256]
    - [64, 0.0]
  - - [256, 1856, 1, 3328]
    - [69, 0.0]
  - - [1856, 128, 1, 256]
    - [64, 0.0]
  - - [6784, 128, 1, 128]
    - [7, 0.0]
  - - [3584, 1408, 1, 128]
    - [56, 0.0]
  - - [1856, 5056, 1, 1280]
    - [72, 0.0]
  - - [2944, 1024, 1, 1280]
    - [68, 0.0]
  - - [5056, 4, 1, 256]
    - [76, 0.0]
  - - [3584, 5888, 1, 3328]
    - [72, 0.0]
  - - [2368, 4288, 1, 256]
    - [59, 0.0]
  - - [1024, 2368, 1, 3328]
    - [63, 0.0]
  - - [64, 704, 1, 3328]
    - [53, 0.0]
  - - [704, 1408, 1, 256]
    - [64, 0.0]
  - - [4096, 128, 1, 4096]
    - [25, 0.0]
  - - [1024, 3584, 1, 1280]
    - [60, 0.0]
  - - [4288, 5888, 1, 3328]
    - [72, 0.0]
  - - [4288, 4, 1, 1280]
    - [77, 0.0]
  - - [4608, 16, 1, 1536]
    - [27, 0.0]
  - - [5888, 64, 1, 128]
    - [6, 0.0]
  - - [4, 5888, 1, 128]
    - [74, 0.0]
  - - [1024, 2944, 1, 3328]
    - [72, 0.0]
  - - [6784, 1856, 1, 256]
    - [63, 0.0]
  - - [2048, 64, 1, 2048]
    - [24, 0.0]
  - - [256, 6784, 1, 1280]
    - [64, 0.0]
  - - [1856, 3584, 1, 256]
    - [62, 0.0]
  - - [128, 448, 1, 3328]
    - [32, 0.0]
  - - [6784, 1856, 1, 128]
    - [56, 0.0]
  - - [4, 448, 1, 256]
    - [77, 0.0]
  - - [5056, 128, 1, 256]
    - [64, 0.0]
  - - [512, 24000, 1, 2816]
    - [72, 0.0]
  - - [256, 5888, 1, 1280]
    - [59, 0.0]
  - - [4, 128, 1, 1280]
    - [43, 0.0]
  - - [16384, 1600, 1, 4096]
    - [68, 0.0]
  - - [6784, 128, 1, 1280]
    - [65, 0.0]
  - - [64, 1408, 1, 256]
    - [64, 0.0]
  - - [2368, 1408, 1, 128]
    - [56, 0.0]
  - - [1856, 448, 1, 256]
    - [64, 0.0]
  - - [1408, 1024, 1, 128]
    - [56, 0.0]
  - - [128, 64, 1, 128]
    - [9, 0.0]
  - - [6784, 3584, 1, 3328]
    - [72, 0.0]
  - - [1760, 7000, 1, 1760]
    - [63, 0.0]
  - - [2944, 64, 1, 3328]
    - [30, 0.0]
  - - [64, 64, 1, 128]
    - [10, 0.0]
  - - [2368, 5056, 1, 1280]
    - [68, 0.0]
  - - [64, 4, 1, 1280]
    - [43, 0.0]
  - - [1408, 2368, 1, 1280]
    - [64, 0.0]
  - - [128, 1408, 1, 1280]
    - [20, 0.0]
  - - [256, 64, 1, 3328]
    - [36, 0.0]
  - - [704, 4288, 1, 128]
    - [56, 0.0]
  - - [128, 1856, 1, 3328]
    - [15, 0.0]
  - - [2944, 2944, 1, 256]
    - [59, 0.0]
  - - [2944, 4, 1, 1280]
    - [77, 0.0]
  - - [5888, 4, 1, 256]
    - [76, 0.0]
  - - [6784, 256, 1, 256]
    - [69, 0.0]
  - - [256, 5056, 1, 3328]
    - [64, 0.0]
  - - [128, 4288, 1, 1280]
    - [64, 0.0]
  - - [5056, 1856, 1, 128]
    - [56, 0.0]
  - - [5056, 1024, 1, 3328]
    - [68, 0.0]
  - - [128, 128, 1, 256]
    - [64, 0.0]
  - - [1760, 64, 1, 1760]
    - [24, 0.0]
  - - [4288, 3584, 1, 3328]
    - [72, 0.0]
  - - [448, 704, 1, 3328]
    - [64, 0.0]
  - - [448, 448, 1, 128]
    - [12, 0.0]
  - - [1024, 2368, 1, 1280]
    - [60, 0.0]
  - - [1856, 704, 1, 3328]
    - [69, 0.0]
  - - [4, 2368, 1, 128]
    - [74, 0.0]
  - - [5888, 6784, 1, 3328]
    - [72, 0.0]
  - - [704, 4288, 1, 1280]
    - [59, 0.0]
  - - [704, 256, 1, 256]
    - [64, 0.0]
  - - [1024, 48000, 1, 2048]
    - [68, 0.0]
  - - [4288, 1024, 1, 128]
    - [56, 0.0]
  - - [3136, 2048, 1, 128]
    - [82, 0.0]
  - - [3025, 64, 1, 144]
    - [83, 0.0]
  - - [3025, 256, 1, 64]
    - [84, 0.0]
  - - [196, 256, 1, 2304]
    - [87, 0.0]
  - - [784, 128, 1, 512]
    - [86, 0.0]
  - - [49, 512, 1, 4608]
    - [88, 0.0]
  - - [3025, 64, 1, 256]
    - [86, 0.0]
  - - [50176, 63, 1, 784]
    - [85, 0.0]
  - - [784, 512, 1, 128]
    - [84, 0.0]
  - - [3025, 64, 1, 64]
    - [86, 0.0]
  - - [49, 512, 1, 1024]
    - [92, 0.0]
  - - [196, 256, 1, 576]
    - [91, 0.0]
  - - [784, 512, 1, 32]
    - [89, 0.0]
  - - [784, 128, 1, 128]
    - [86, 0.0]
  - - [50176, 63, 1, 196]
    - [90, 0.0]
- null
