library/src/blas3/Tensile/Logic/aldebaran/arcturus_Cijk_Ailk_Bjlk_HBH_GB.yaml
- {MinimumRequiredVersion: 4.25.0}
- arcturus
- gfx908
- [Device 7380, Device 7388, Device 738c, Device 7390]
    SolutionIndex: 0
    SolutionNameMin: Cijk_Ailk_Bjlk_HBH_GB_MT32x32x32_MI16x16x16x1_SN_1LDSB0_EPS0_GRVW2_NLCA1_NLCB1_PGR2_SU0_SUS128_TT1_16_WG32_8_1_WGM1
    SolutionIndex: 1
    SolutionNameMin: Cijk_Ailk_Bjlk_HBH_GB_MT32x32x32_MI16x16x16x1_SN_1LDSB0_EPS0_GRVW4_NLCA1_NLCB1_PGR2_SU0_SUS128_TT1_16_WG32_8_1_WGM1
    SolutionIndex: 2
    SolutionNameMin: Cijk_Ailk_Bjlk_HBH_GB_MT64x128x16_MI32x32x8x1_SN_1LDSB0_EPS0_GRVW8_NLCA1_NLCB1_PGR2_SU0_SUS128_TT1_64_WG64_4_1_WGM1
    SolutionIndex: 3
    SolutionNameMin: Cijk_Ailk_Bjlk_HBH_GB_MT32x32x32_MI16x16x16x1_SN_1LDSB0_EPS1_GRVW8_NLCA1_NLCB1_PGR1_SU0_SUS128_TT1_16_WG32_8_1_WGM1
    SolutionIndex: 4
    SolutionNameMin: Cijk_Ailk_Bjlk_HBH_GB_MT32x32x32_MI16x16x16x1_SN_1LDSB0_EPS0_GRVW8_NLCA1_NLCB1_PGR2_SU0_SUS128_TT1_16_WG32_8_1_WGM1
    SolutionIndex: 5
    SolutionNameMin: Cijk_Ailk_Bjlk_HBH_GB_MT32x32x64_MI16x16x16x1_SN_1LDSB0_EPS0_GRVW8_NLCA1_NLCB1_PGR2_SU0_SUS128_TT1_16_WG32_8_1_WGM1
    SolutionIndex: 6
    SolutionNameMin: Cijk_Ailk_Bjlk_HBH_GB_MT64x64x64_MI32x32x8x1_SN_1LDSB0_EPS0_GRVW8_NLCA1_NLCB1_PGR2_SU0_SUS128_TT1_32_WG64_4_1_WGM1
    SolutionIndex: 7
    SolutionNameMin: Cijk_Ailk_Bjlk_HBH_GB_MT64x128x16_MI32x32x8x1_SN_1LDSB0_EPS0_GRVW8_NLCA1_NLCB1_PGR2_SU0_SUS256_TT1_64_WG64_4_1_WGM1
    SolutionIndex: 8
    SolutionNameMin: Cijk_Ailk_Bjlk_HBH_GB_MT32x32x32_MI16x16x16x1_SN_1LDSB0_EPS0_GRVW8_NLCA1_NLCB1_PGR2_SU0_SUS256_TT1_16_WG32_8_1_WGM1
    SolutionIndex: 9
    SolutionNameMin: Cijk_Ailk_Bjlk_HBH_GB_MT64x64x32_MI32x32x8x1_SN_1LDSB0_EPS0_GRVW8_NLCA1_NLCB1_PGR2_SU0_SUS256_TT1_32_WG64_4_1_WGM1
    SolutionIndex: 10
    SolutionNameMin: Cijk_Ailk_Bjlk_HBH_GB_MT32x32x64_MI16x16x16x1_SN_1LDSB0_EPS0_GRVW8_NLCA1_NLCB1_PGR2_SU0_SUS256_TT1_16_WG32_8_1_WGM1
    SolutionIndex: 11
    SolutionNameMin: Cijk_Ailk_Bjlk_HBH_GB_MT32x32x64_MI16x16x16x1_SN_1LDSB0_EPS0_GRVW8_NLCA1_NLCB1_PGR2_SU0_SUS256_TT1_16_WG32_8_1_WGM2
    SolutionIndex: 12
    SolutionNameMin: Cijk_Ailk_Bjlk_HBH_GB_MT32x32x64_MI16x16x16x1_SN_1LDSB0_EPS0_GRVW8_NLCA1_NLCB1_PGR2_SU0_SUS128_TT1_16_WG32_8_1_WGM15
    SolutionIndex: 13
    SolutionNameMin: Cijk_Ailk_Bjlk_HBH_GB_MT64x128x16_MI32x32x8x1_SN_1LDSB0_EPS0_GRVW8_NLCA1_NLCB1_PGR2_SU0_SUS256_TT1_64_WG64_4_1_WGM15
- - - [32, 32, 8, 128, 32, 32, 32, 32]
    - [4, 172.0]
  - - [128, 128, 8, 128, 128, 128, 128, 128]
    - [8, 2589.0]
  - - [256, 256, 8, 128, 256, 256, 256, 256]
    - [3, 8066.0]
  - - [512, 512, 8, 128, 512, 512, 512, 512]
    - [2, 23967.0]
  - - [32, 32, 8, 512, 32, 32, 32, 32]
    - [5, 456.0]
  - - [128, 128, 8, 512, 128, 128, 128, 128]
    - [11, 6355.0]
  - - [256, 256, 8, 512, 256, 256, 256, 256]
    - [9, 19396.0]
  - - [512, 512, 8, 512, 512, 512, 512, 512]
    - [7, 43719.0]
  - - [32, 32, 8, 1024, 32, 32, 32, 32]
    - [5, 651.0]
  - - [128, 128, 8, 1024, 128, 128, 128, 128]
    - [12, 8473.0]
  - - [256, 256, 8, 1024, 256, 256, 256, 256]
    - [6, 25229.0]
  - - [512, 512, 8, 1024, 512, 512, 512, 512]
    - [13, 50840.0]
  - - [32, 128, 8, 128, 32, 32, 32, 128]
    - [4, 672.0]
  - - [32, 256, 8, 128, 32, 32, 32, 256]
    - [4, 1327.0]
  - - [32, 512, 8, 128, 32, 32, 32, 512]
    - [0, 2724.0]
  - - [32, 128, 8, 512, 32, 32, 32, 128]
    - [8, 1691.0]
  - - [32, 256, 8, 512, 32, 32, 32, 256]
    - [8, 3438.0]
  - - [32, 512, 8, 512, 32, 32, 32, 512]
    - [10, 6355.0]
  - - [32, 128, 8, 1024, 32, 32, 32, 128]
    - [11, 2383.0]
  - - [32, 256, 8, 1024, 32, 32, 32, 256]
    - [5, 4739.0]
  - - [32, 512, 8, 1024, 32, 32, 32, 512]
    - [11, 8473.0]
  - - [128, 32, 8, 128, 128, 128, 128, 32]
    - [8, 664.0]
  - - [256, 32, 8, 128, 256, 256, 256, 32]
    - [8, 1295.0]
  - - [512, 32, 8, 128, 512, 512, 512, 32]
    - [4, 2655.0]
  - - [128, 32, 8, 512, 128, 128, 128, 32]
    - [5, 1678.0]
  - - [256, 32, 8, 512, 256, 256, 256, 32]
    - [1, 3383.0]
  - - [512, 32, 8, 512, 512, 512, 512, 32]
    - [5, 6079.0]
  - - [128, 32, 8, 1024, 128, 128, 128, 32]
    - [5, 2439.0]
  - - [256, 32, 8, 1024, 256, 256, 256, 32]
    - [5, 4877.0]
  - - [512, 32, 8, 1024, 512, 512, 512, 32]
    - [5, 8144.0]
- null
