library/src/blas3/Tensile/Logic/aldebaran/arcturus_Cijk_Alik_Bjlk_HBH.yaml
- {MinimumRequiredVersion: 4.6.0}
- arcturus
- gfx908
- [Device 7380, Device 7388, Device 738c, Device 7390]
    SolutionIndex: 0
    SolutionNameMin: Cijk_Alik_Bjlk_HBH_MT016x128x08_PGR1_PLR1_TT04_04
    SolutionIndex: 1
    SolutionNameMin: Cijk_Alik_Bjlk_HBH_MT016x016x08_PGR1_PLR1_TT02_02
    SolutionIndex: 2
    SolutionNameMin: Cijk_Alik_Bjlk_HBH_MT064x064x08_PGR1_PLR1_TT08_08
    SolutionIndex: 3
    SolutionNameMin: Cijk_Alik_Bjlk_HBH_MT032x032x16_PGR1_PLR1_TT02_02
    SolutionIndex: 4
    SolutionNameMin: Cijk_Alik_Bjlk_HBH_MT016x016x32_PGR1_PLR1_TT02_02
    SolutionIndex: 5
    SolutionNameMin: Cijk_Alik_Bjlk_HBH_MT064x064x04_PGR0_PLR0_TT04_04
    SolutionIndex: 6
    SolutionNameMin: Cijk_Alik_Bjlk_HBH_MT064x064x04_PGR1_PLR0_TT04_04
    SolutionIndex: 7
    SolutionNameMin: Cijk_Alik_Bjlk_HBH_MT064x128x04_PGR0_PLR1_TT04_08
    SolutionIndex: 8
    SolutionNameMin: Cijk_Alik_Bjlk_HBH_MT064x064x04_PGR0_PLR1_TT04_04
    SolutionIndex: 9
    SolutionNameMin: Cijk_Alik_Bjlk_HBH_MT064x064x04_PGR1_PLR1_TT04_04
    SolutionIndex: 10
    SolutionNameMin: Cijk_Alik_Bjlk_HBH_MT064x064x08_PGR0_PLR0_TT04_04
    SolutionIndex: 11
    SolutionNameMin: Cijk_Alik_Bjlk_HBH_MT064x064x08_PGR1_PLR0_TT04_04
    SolutionIndex: 12
    SolutionNameMin: Cijk_Alik_Bjlk_HBH_MT064x064x08_PGR1_PLR1_TT04_04
    SolutionIndex: 13
    SolutionNameMin: Cijk_Alik_Bjlk_HBH_MT064x064x16_PGR1_PLR1_TT04_04
    SolutionIndex: 0
    SolutionNameMin: Cijk_Alik_Bjlk_HBH_MT032x032x08_PGR1_PLR1_TT04_04
    SolutionIndex: 1
    SolutionNameMin: Cijk_Alik_Bjlk_HBH_MT032x032x08_PGR1_PLR1_TT04_04
    SolutionIndex: 2
    SolutionNameMin: Cijk_Alik_Bjlk_HBH_MT032x064x08_PGR1_PLR1_TT04_08
    SolutionIndex: 3
    SolutionNameMin: Cijk_Alik_Bjlk_HBH_MT128x128x08_PGR1_PLR1_TT08_08
    SolutionIndex: 4
    SolutionNameMin: Cijk_Alik_Bjlk_HBH_MT032x032x16_PGR1_PLR1_TT04_04
    SolutionIndex: 5
    SolutionNameMin: Cijk_Alik_Bjlk_HBH_MT032x064x16_PGR1_PLR1_TT04_08
    SolutionIndex: 6
    SolutionNameMin: Cijk_Alik_Bjlk_HBH_MT032x064x16_PGR1_PLR1_TT04_04
    SolutionIndex: 7
    SolutionNameMin: Cijk_Alik_Bjlk_HBH_MT032x128x16_PGR1_PLR1_TT04_08
    SolutionIndex: 8
    SolutionNameMin: Cijk_Alik_Bjlk_HBH_MT064x064x16_PGR1_PLR1_TT04_04
    SolutionIndex: 9
    SolutionNameMin: Cijk_Alik_Bjlk_HBH_MT064x128x16_PGR1_PLR1_TT04_08
    SolutionIndex: 10
    SolutionNameMin: Cijk_Alik_Bjlk_HBH_MT032x032x16_PGR1_PLR1_TT04_04
    SolutionIndex: 11
    SolutionNameMin: Cijk_Alik_Bjlk_HBH_MT032x064x16_PGR1_PLR1_TT04_08
    SolutionIndex: 12
    SolutionNameMin: Cijk_Alik_Bjlk_HBH_MT032x064x16_PGR1_PLR1_TT04_04
    SolutionIndex: 13
    SolutionNameMin: Cijk_Alik_Bjlk_HBH_MT064x064x16_PGR1_PLR1_TT04_04
    SolutionIndex: 14
    SolutionNameMin: Cijk_Alik_Bjlk_HBH_MT064x128x16_PGR1_PLR1_TT04_08
    SolutionIndex: 15
    SolutionNameMin: Cijk_Alik_Bjlk_HBH_MT032x032x32_PGR1_PLR1_TT04_04
    SolutionIndex: 16
    SolutionNameMin: Cijk_Alik_Bjlk_HBH_MT032x064x32_PGR1_PLR1_TT04_04
    SolutionIndex: 17
    SolutionNameMin: Cijk_Alik_Bjlk_HBH_MT032x128x32_PGR1_PLR1_TT04_04
    SolutionIndex: 18
    SolutionNameMin: Cijk_Alik_Bjlk_HBH_MT032x064x32_PGR1_PLR1_TT04_04
    SolutionIndex: 19
    SolutionNameMin: Cijk_Alik_Bjlk_HBH_MT032x064x64_PGR1_PLR1_TT04_04
    SolutionIndex: 20
    SolutionNameMin: Cijk_Alik_Bjlk_HBH_MT032x128x64_PGR1_PLR1_TT04_04
    SolutionIndex: 21
    SolutionNameMin: Cijk_Alik_Bjlk_HBH_MT032x032x64_PGR1_PLR1_TT04_04
    SolutionIndex: 22
    SolutionNameMin: Cijk_Alik_Bjlk_HBH_MT064x064x08_PGR1_PLR1_TT08_08
    SolutionIndex: 23
    SolutionNameMin: Cijk_Alik_Bjlk_HBH_MT064x064x16_PGR1_PLR1_TT08_08
    SolutionIndex: 24
    SolutionNameMin: Cijk_Alik_Bjlk_HBH_MT128x128x16_PGR1_PLR1_TT08_08
    SolutionIndex: 25
    SolutionNameMin: Cijk_Alik_Bjlk_HBH_MT064x064x16_PGR1_PLR1_TT08_08
    SolutionIndex: 26
    SolutionNameMin: Cijk_Alik_Bjlk_HBH_MT128x128x16_PGR1_PLR1_TT08_08
    SolutionIndex: 27
    SolutionNameMin: Cijk_Alik_Bjlk_HBH_MT128x128x32_PGR1_PLR1_TT08_08
    SolutionIndex: 28
    SolutionNameMin: Cijk_Alik_Bjlk_HBH_MT064x128x04_PGR0_PLR0_TT04_08
    SolutionIndex: 29
    SolutionNameMin: Cijk_Alik_Bjlk_HBH_MT064x064x04_PGR0_PLR0_TT04_04
    SolutionIndex: 30
    SolutionNameMin: Cijk_Alik_Bjlk_HBH_MT064x064x04_PGR1_PLR0_TT04_04
    SolutionIndex: 31
    SolutionNameMin: Cijk_Alik_Bjlk_HBH_MT064x064x04_PGR0_PLR1_TT04_04
    SolutionIndex: 32
    SolutionNameMin: Cijk_Alik_Bjlk_HBH_MT064x128x04_PGR1_PLR1_TT04_08
    SolutionIndex: 33
    SolutionNameMin: Cijk_Alik_Bjlk_HBH_MT064x128x08_PGR0_PLR0_TT04_08
    SolutionIndex: 34
    SolutionNameMin: Cijk_Alik_Bjlk_HBH_MT064x064x08_PGR0_PLR0_TT04_04
    SolutionIndex: 35
    SolutionNameMin: Cijk_Alik_Bjlk_HBH_MT064x128x08_PGR1_PLR0_TT04_08
    SolutionIndex: 36
    SolutionNameMin: Cijk_Alik_Bjlk_HBH_MT064x064x08_PGR1_PLR0_TT04_04
    SolutionIndex: 37
    SolutionNameMin: Cijk_Alik_Bjlk_HBH_MT064x064x08_PGR0_PLR1_TT04_04
    SolutionIndex: 38
    SolutionNameMin: Cijk_Alik_Bjlk_HBH_MT064x064x08_PGR1_PLR1_TT04_04
    SolutionIndex: 39
    SolutionNameMin: Cijk_Alik_Bjlk_HBH_MT064x064x16_PGR0_PLR0_TT04_04
    SolutionIndex: 40
    SolutionNameMin: Cijk_Alik_Bjlk_HBH_MT064x064x16_PGR1_PLR0_TT04_04
    SolutionIndex: 41
    SolutionNameMin: Cijk_Alik_Bjlk_HBH_MT064x128x16_PGR1_PLR1_TT04_08
    SolutionIndex: 42
    SolutionNameMin: Cijk_Alik_Bjlk_HBH_MT064x064x16_PGR1_PLR1_TT04_04
    SolutionIndex: 43
    SolutionNameMin: Cijk_Alik_Bjlk_HBH_MT064x128x04_PGR0_PLR0_TT04_08
    SolutionIndex: 44
    SolutionNameMin: Cijk_Alik_Bjlk_HBH_MT064x064x04_PGR0_PLR0_TT04_04
    SolutionIndex: 45
    SolutionNameMin: Cijk_Alik_Bjlk_HBH_MT064x128x04_PGR1_PLR0_TT04_08
    SolutionIndex: 46
    SolutionNameMin: Cijk_Alik_Bjlk_HBH_MT064x064x04_PGR1_PLR0_TT04_04
    SolutionIndex: 47
    SolutionNameMin: Cijk_Alik_Bjlk_HBH_MT128x128x04_PGR0_PLR1_TT08_08
    SolutionIndex: 48
    SolutionNameMin: Cijk_Alik_Bjlk_HBH_MT064x128x04_PGR0_PLR1_TT04_08
    SolutionIndex: 49
    SolutionNameMin: Cijk_Alik_Bjlk_HBH_MT064x064x04_PGR0_PLR1_TT04_04
    SolutionIndex: 50
    SolutionNameMin: Cijk_Alik_Bjlk_HBH_MT128x128x04_PGR1_PLR1_TT08_08
    SolutionIndex: 51
    SolutionNameMin: Cijk_Alik_Bjlk_HBH_MT064x128x04_PGR1_PLR1_TT04_08
    SolutionIndex: 52
    SolutionNameMin: Cijk_Alik_Bjlk_HBH_MT064x064x04_PGR1_PLR1_TT04_04
    SolutionIndex: 53
    SolutionNameMin: Cijk_Alik_Bjlk_HBH_MT064x128x08_PGR0_PLR0_TT04_08
    SolutionIndex: 54
    SolutionNameMin: Cijk_Alik_Bjlk_HBH_MT064x064x08_PGR0_PLR0_TT04_04
    SolutionIndex: 55
    SolutionNameMin: Cijk_Alik_Bjlk_HBH_MT064x128x08_PGR1_PLR0_TT04_08
    SolutionIndex: 56
    SolutionNameMin: Cijk_Alik_Bjlk_HBH_MT064x064x08_PGR1_PLR0_TT04_04
    SolutionIndex: 57
    SolutionNameMin: Cijk_Alik_Bjlk_HBH_MT064x128x08_PGR0_PLR1_TT04_08
    SolutionIndex: 58
    SolutionNameMin: Cijk_Alik_Bjlk_HBH_MT064x064x08_PGR0_PLR1_TT04_04
    SolutionIndex: 59
    SolutionNameMin: Cijk_Alik_Bjlk_HBH_MT064x064x08_PGR1_PLR1_TT04_04
    SolutionIndex: 60
    SolutionNameMin: Cijk_Alik_Bjlk_HBH_MT064x128x16_PGR0_PLR0_TT04_08
    SolutionIndex: 61
    SolutionNameMin: Cijk_Alik_Bjlk_HBH_MT064x064x16_PGR0_PLR0_TT04_04
    SolutionIndex: 62
    SolutionNameMin: Cijk_Alik_Bjlk_HBH_MT064x064x16_PGR1_PLR0_TT04_04
    SolutionIndex: 63
    SolutionNameMin: Cijk_Alik_Bjlk_HBH_MT064x064x16_PGR0_PLR1_TT04_04
    SolutionIndex: 64
    SolutionNameMin: Cijk_Alik_Bjlk_HBH_MT064x064x16_PGR1_PLR1_TT04_04
- - - [64, 448, 1, 3328]
    - [0, 0.0]
  - - [1, 64, 1, 1280]
    - [13, 0.0]
  - - [1, 2944, 1, 3328]
    - [13, 0.0]
  - - [64, 128, 1, 256]
    - [0, 0.0]
  - - [128, 64, 1, 1280]
    - [1, 0.0]
  - - [1, 2368, 1, 1280]
    - [13, 0.0]
  - - [1, 128, 1, 1]
    - [5, 0.0]
  - - [64, 1408, 1, 3328]
    - [0, 0.0]
  - - [64, 1024, 1, 3328]
    - [0, 0.0]
  - - [1, 64, 1, 3328]
    - [13, 0.0]
  - - [64, 448, 1, 1280]
    - [0, 0.0]
  - - [1, 256, 1, 1280]
    - [13, 0.0]
  - - [64, 64, 1, 1280]
    - [4, 0.0]
  - - [64, 5056, 1, 256]
    - [0, 0.0]
  - - [1, 1, 1, 3328]
    - [13, 0.0]
  - - [1, 1408, 1, 1280]
    - [11, 0.0]
  - - [1, 2368, 1, 3328]
    - [13, 0.0]
  - - [1, 64, 1, 1]
    - [5, 0.0]
  - - [1, 128, 1, 1280]
    - [13, 0.0]
  - - [64, 1856, 1, 256]
    - [0, 0.0]
  - - [64, 1024, 1, 1280]
    - [0, 0.0]
  - - [64, 256, 1, 1280]
    - [0, 0.0]
  - - [1, 1024, 1, 256]
    - [9, 0.0]
  - - [1, 704, 1, 3328]
    - [13, 0.0]
  - - [64, 2368, 1, 3328]
    - [0, 0.0]
  - - [64, 3584, 1, 1280]
    - [0, 0.0]
  - - [1, 256, 1, 1]
    - [12, 0.0]
  - - [1, 3584, 1, 1280]
    - [13, 0.0]
  - - [128, 64, 1, 256]
    - [0, 0.0]
  - - [64, 128, 1, 3328]
    - [0, 0.0]
  - - [64, 256, 1, 3328]
    - [0, 0.0]
  - - [1, 1, 1, 256]
    - [11, 0.0]
  - - [1, 2944, 1, 1]
    - [9, 0.0]
  - - [1, 1408, 1, 3328]
    - [13, 0.0]
  - - [64, 2944, 1, 256]
    - [0, 0.0]
  - - [64, 1408, 1, 1280]
    - [0, 0.0]
  - - [64, 2368, 1, 1280]
    - [0, 0.0]
  - - [64, 3584, 1, 3328]
    - [0, 0.0]
  - - [1, 704, 1, 1]
    - [10, 0.0]
  - - [64, 6784, 1, 3328]
    - [0, 0.0]
  - - [1, 704, 1, 1280]
    - [13, 0.0]
  - - [1, 2944, 1, 256]
    - [9, 0.0]
  - - [64, 1856, 1, 3328]
    - [0, 0.0]
  - - [64, 448, 1, 256]
    - [0, 0.0]
  - - [1, 448, 1, 1280]
    - [13, 0.0]
  - - [64, 5056, 1, 3328]
    - [0, 0.0]
  - - [64, 128, 1, 1280]
    - [0, 0.0]
  - - [1, 5056, 1, 256]
    - [11, 0.0]
  - - [1, 1856, 1, 256]
    - [6, 0.0]
  - - [1, 1856, 1, 1280]
    - [11, 0.0]
  - - [1, 1, 1, 1]
    - [13, 0.0]
  - - [256, 64, 1, 256]
    - [1, 0.0]
  - - [1, 4288, 1, 1280]
    - [6, 0.0]
  - - [1, 1408, 1, 1]
    - [5, 0.0]
  - - [64, 6784, 1, 1280]
    - [0, 0.0]
  - - [64, 1856, 1, 1280]
    - [0, 0.0]
  - - [64, 6784, 1, 256]
    - [0, 0.0]
  - - [64, 5056, 1, 1280]
    - [0, 0.0]
  - - [1, 448, 1, 3328]
    - [13, 0.0]
  - - [64, 4288, 1, 256]
    - [0, 0.0]
  - - [1, 1408, 1, 256]
    - [9, 0.0]
  - - [1, 2368, 1, 256]
    - [9, 0.0]
  - - [1, 4288, 1, 1]
    - [9, 0.0]
  - - [1, 128, 1, 256]
    - [9, 0.0]
  - - [64, 5888, 1, 3328]
    - [0, 0.0]
  - - [1, 1024, 1, 3328]
    - [13, 0.0]
  - - [1, 1856, 1, 3328]
    - [13, 0.0]
  - - [64, 1024, 1, 256]
    - [0, 0.0]
  - - [64, 256, 1, 256]
    - [0, 0.0]
  - - [1, 4288, 1, 3328]
    - [11, 0.0]
  - - [1, 1024, 1, 1280]
    - [13, 0.0]
  - - [1, 2368, 1, 1]
    - [5, 0.0]
  - - [1, 3584, 1, 3328]
    - [13, 0.0]
  - - [1, 1, 1, 1280]
    - [13, 0.0]
  - - [64, 704, 1, 256]
    - [0, 0.0]
  - - [64, 2944, 1, 3328]
    - [0, 0.0]
  - - [64, 64, 1, 256]
    - [3, 0.0]
  - - [1, 5056, 1, 1]
    - [5, 0.0]
  - - [128, 64, 1, 3328]
    - [1, 0.0]
  - - [1, 448, 1, 256]
    - [9, 0.0]
  - - [1, 3584, 1, 256]
    - [13, 0.0]
  - - [64, 4288, 1, 1280]
    - [0, 0.0]
  - - [1, 1024, 1, 1]
    - [11, 0.0]
  - - [64, 2944, 1, 1280]
    - [0, 0.0]
  - - [64, 5888, 1, 1280]
    - [0, 0.0]
  - - [64, 704, 1, 3328]
    - [0, 0.0]
  - - [1, 256, 1, 256]
    - [12, 0.0]
  - - [64, 1408, 1, 256]
    - [0, 0.0]
  - - [64, 2368, 1, 256]
    - [0, 0.0]
  - - [64, 3584, 1, 256]
    - [0, 0.0]
  - - [1, 5056, 1, 1280]
    - [11, 0.0]
  - - [1, 3584, 1, 1]
    - [8, 0.0]
  - - [1, 704, 1, 256]
    - [11, 0.0]
  - - [1, 128, 1, 3328]
    - [13, 0.0]
  - - [1, 2944, 1, 1280]
    - [11, 0.0]
  - - [64, 4288, 1, 3328]
    - [0, 0.0]
  - - [64, 64, 1, 3328]
    - [2, 0.0]
  - - [1, 448, 1, 1]
    - [7, 0.0]
  - - [1, 64, 1, 256]
    - [6, 0.0]
  - - [64, 5888, 1, 256]
    - [0, 0.0]
  - - [64, 704, 1, 1280]
    - [0, 0.0]
  - - [1, 1856, 1, 1]
    - [6, 0.0]
  - - [1, 256, 1, 3328]
    - [13, 0.0]
  - - [1, 4288, 1, 256]
    - [11, 0.0]
  - - [1024, 1024, 1, 1024]
    - [41, 0.0]
- null
