library/src/blas3/Tensile/Logic/aldebaran/hip_Cijk_Ailk_Bljk_BBH.yaml
- {MinimumRequiredVersion: 4.9.6}
- hip
- fallback
- [Device 0000]
    SolutionIndex: 0
    SolutionNameMin: Cijk_Ailk_Bljk_BBH_MT64x32x8_SE_NLCA1_TT4_2_WG16_16_1
    SolutionIndex: 1
    SolutionNameMin: Cijk_Ailk_Bljk_BBH_MT128x32x16_SE_NLCA1_TT8_2_WG16_16_1
    SolutionIndex: 2
    SolutionNameMin: Cijk_Ailk_Bljk_BBH_MT16x64x16_SE_NLCA1_TT2_8_WG8_8_1
    SolutionIndex: 3
    SolutionNameMin: Cijk_Ailk_Bljk_BBH_MT128x32x16_SE_NLCA1_TT8_2_WG16_16_1
    SolutionIndex: 4
    SolutionNameMin: Cijk_Ailk_Bljk_BBH_MT32x128x16_SE_NLCA1_TT2_8_WG16_16_1
    SolutionIndex: 5
    SolutionNameMin: Cijk_Ailk_Bljk_BBH_MT64x16x16_SE_NLCA1_TT8_2_WG8_8_1
    SolutionIndex: 6
    SolutionNameMin: Cijk_Ailk_Bljk_BBH_MT16x64x16_SE_NLCA1_TT2_8_WG8_8_1
    SolutionIndex: 7
    SolutionNameMin: Cijk_Ailk_Bljk_BBH_MT64x32x8_SE_NLCA1_TT4_2_WG16_16_1
    SolutionIndex: 8
    SolutionNameMin: Cijk_Ailk_Bljk_BBH_MT128x32x16_SE_NLCA1_TT8_2_WG16_16_1
    SolutionIndex: 9
    SolutionNameMin: Cijk_Ailk_Bljk_BBH_MT16x64x16_SE_NLCA1_TT2_8_WG8_8_1
    SolutionIndex: 10
    SolutionNameMin: Cijk_Ailk_Bljk_BBH_MT128x32x16_SE_NLCA1_TT8_2_WG16_16_1
    SolutionIndex: 11
    SolutionNameMin: Cijk_Ailk_Bljk_BBH_MT32x128x16_SE_NLCA1_TT2_8_WG16_16_1
    SolutionIndex: 12
    SolutionNameMin: Cijk_Ailk_Bljk_BBH_MT64x16x16_SE_NLCA1_TT8_2_WG8_8_1
    SolutionIndex: 13
    SolutionNameMin: Cijk_Ailk_Bljk_BBH_MT16x64x16_SE_NLCA1_TT2_8_WG8_8_1
- - - [1, 128, 2, 64, 1, 1, 1, 64]
    - [3, 0.87421]
  - - [127, 129, 2, 1, 127, 127, 127, 1]
    - [3, 3.00895]
  - - [128, 128, 2, 1, 128, 128, 128, 1]
    - [4, 3.32603]
  - - [129, 129, 2, 1, 129, 129, 129, 1]
    - [4, 3.16414]
  - - [129, 1, 2, 63, 129, 129, 129, 63]
    - [6, 0.953985]
  - - [1, 129, 2, 63, 1, 1, 1, 63]
    - [6, 0.918072]
  - - [127, 1, 2, 64, 127, 127, 127, 64]
    - [3, 0.857226]
  - - [129, 1, 2, 64, 129, 129, 129, 64]
    - [4, 0.906108]
  - - [129, 129, 2, 64, 129, 129, 129, 64]
    - [0, 167.181]
  - - [129, 129, 2, 65, 129, 129, 129, 65]
    - [0, 167.837]
  - - [1, 127, 2, 65, 1, 1, 1, 65]
    - [3, 0.898699]
  - - [1, 127, 2, 64, 1, 1, 1, 64]
    - [4, 0.767299]
  - - [128, 128, 2, 63, 128, 128, 128, 63]
    - [0, 149.031]
  - - [128, 127, 2, 1, 128, 128, 128, 1]
    - [4, 3.20363]
  - - [128, 128, 2, 64, 128, 128, 128, 64]
    - [0, 175.84]
  - - [1, 128, 2, 65, 1, 1, 1, 65]
    - [3, 0.793761]
  - - [128, 1, 2, 63, 128, 128, 128, 63]
    - [6, 0.899674]
  - - [1, 129, 2, 64, 1, 1, 1, 64]
    - [4, 0.906108]
  - - [127, 1, 2, 63, 127, 127, 127, 63]
    - [5, 1.06414]
  - - [127, 127, 2, 64, 127, 127, 127, 64]
    - [1, 126.68]
  - - [1, 127, 2, 63, 1, 1, 1, 63]
    - [3, 0.80008]
  - - [1, 1, 2, 1, 1, 1, 1, 1]
    - [5, 0.000167694]
  - - [128, 1, 2, 65, 128, 128, 128, 65]
    - [4, 1.0748]
  - - [127, 127, 2, 65, 127, 127, 127, 65]
    - [0, 155.524]
  - - [129, 127, 2, 1, 129, 129, 129, 1]
    - [3, 2.87219]
  - - [127, 127, 2, 1, 127, 127, 127, 1]
    - [3, 2.77369]
  - - [127, 128, 2, 1, 127, 127, 127, 1]
    - [4, 3.32502]
  - - [128, 1, 2, 64, 128, 128, 128, 64]
    - [3, 0.853978]
  - - [128, 129, 2, 1, 128, 128, 128, 1]
    - [3, 2.97206]
  - - [129, 128, 2, 1, 129, 129, 129, 1]
    - [6, 2.83955]
  - - [129, 1, 2, 65, 129, 129, 129, 65]
    - [5, 0.880893]
  - - [129, 129, 2, 63, 129, 129, 129, 63]
    - [0, 165.523]
  - - [1, 129, 2, 65, 1, 1, 1, 65]
    - [3, 0.955202]
  - - [127, 1, 2, 65, 127, 127, 127, 65]
    - [4, 0.795989]
  - - [1, 128, 2, 63, 1, 1, 1, 63]
    - [4, 0.803387]
  - - [127, 127, 2, 63, 127, 127, 127, 63]
    - [2, 101.61]
  - - [128, 128, 2, 65, 128, 128, 128, 65]
    - [0, 171.147]
  - - [1, 128, 2, 64, 1, 1, 1, 64]
    - [10, 0.97421]
  - - [127, 129, 2, 1, 127, 127, 127, 1]
    - [10, 3.10895]
  - - [128, 128, 2, 1, 128, 128, 128, 1]
    - [11, 3.42603]
  - - [129, 129, 2, 1, 129, 129, 129, 1]
    - [11, 3.26414]
  - - [129, 1, 2, 63, 129, 129, 129, 63]
    - [13, 1.053985]
  - - [1, 129, 2, 63, 1, 1, 1, 63]
    - [13, 1.018072]
  - - [127, 1, 2, 64, 127, 127, 127, 64]
    - [10, 0.957226]
  - - [129, 1, 2, 64, 129, 129, 129, 64]
    - [11, 1.006108]
  - - [129, 129, 2, 64, 129, 129, 129, 64]
    - [7, 167.281]
  - - [129, 129, 2, 65, 129, 129, 129, 65]
    - [7, 167.937]
  - - [1, 127, 2, 65, 1, 1, 1, 65]
    - [10, 0.998699]
  - - [1, 127, 2, 64, 1, 1, 1, 64]
    - [11, 0.867299]
  - - [128, 128, 2, 63, 128, 128, 128, 63]
    - [7, 149.131]
  - - [128, 127, 2, 1, 128, 128, 128, 1]
    - [11, 3.30363]
  - - [128, 128, 2, 64, 128, 128, 128, 64]
    - [7, 175.94]
  - - [1, 128, 2, 65, 1, 1, 1, 65]
    - [10, 0.893761]
  - - [128, 1, 2, 63, 128, 128, 128, 63]
    - [13, 0.999674]
  - - [1, 129, 2, 64, 1, 1, 1, 64]
    - [11, 1.006108]
  - - [127, 1, 2, 63, 127, 127, 127, 63]
    - [12, 1.16414]
  - - [127, 127, 2, 64, 127, 127, 127, 64]
    - [8, 126.78]
  - - [1, 127, 2, 63, 1, 1, 1, 63]
    - [10, 0.90008]
  - - [1, 1, 2, 1, 1, 1, 1, 1]
    - [12, 0.100167694]
  - - [128, 1, 2, 65, 128, 128, 128, 65]
    - [11, 1.1748]
  - - [127, 127, 2, 65, 127, 127, 127, 65]
    - [7, 155.624]
  - - [129, 127, 2, 1, 129, 129, 129, 1]
    - [10, 2.97219]
  - - [127, 127, 2, 1, 127, 127, 127, 1]
    - [10, 2.87369]
  - - [127, 128, 2, 1, 127, 127, 127, 1]
    - [11, 3.42502]
  - - [128, 1, 2, 64, 128, 128, 128, 64]
    - [10, 0.953978]
  - - [128, 129, 2, 1, 128, 128, 128, 1]
    - [10, 3.07206]
  - - [129, 128, 2, 1, 129, 129, 129, 1]
    - [13, 2.93955]
  - - [129, 1, 2, 65, 129, 129, 129, 65]
    - [12, 0.980893]
  - - [129, 129, 2, 63, 129, 129, 129, 63]
    - [7, 165.623]
  - - [1, 129, 2, 65, 1, 1, 1, 65]
    - [10, 1.055202]
  - - [127, 1, 2, 65, 127, 127, 127, 65]
    - [11, 0.895989]
  - - [1, 128, 2, 63, 1, 1, 1, 63]
    - [11, 0.903387]
  - - [127, 127, 2, 63, 127, 127, 127, 63]
    - [9, 101.71]
  - - [128, 128, 2, 65, 128, 128, 128, 65]
    - [7, 171.247]
- null
