library/src/blas3/Tensile/Logic/aldebaran/vega20_Cijk_Alik_Bjlk_HB_GB.yaml
- {MinimumRequiredVersion: 4.26.0}
- vega20
- gfx906
- [Device 66a0, Device 66a1, Device 66a7, Device 66af, Vega 20]
    SolutionIndex: 0
    SolutionNameMin: Cijk_Alik_Bjlk_HB_GB_MT32x32x8_SN_GRVW4_LRVW4_TT4_4_VW4_WG8_8_1_WGM1
    SolutionIndex: 1
    SolutionNameMin: Cijk_Alik_Bjlk_HB_GB_MT64x64x8_SN_GRVW4_LRVW4_TT4_4_VW4_WG16_16_1_WGM1
    SolutionIndex: 2
    SolutionNameMin: Cijk_Alik_Bjlk_HB_GB_MT32x32x16_SN_GRVW4_LRVW4_TT4_4_VW4_WG8_8_1_WGM1
    SolutionIndex: 3
    SolutionNameMin: Cijk_Alik_Bjlk_HB_GB_MT64x64x16_SN_GRVW4_LRVW4_TT4_4_VW4_WG16_16_1_WGM1
    SolutionIndex: 4
    SolutionNameMin: Cijk_Alik_Bjlk_HB_GB_MT64x128x16_SN_GRVW4_LRVW4_TT4_8_VW4_WG16_16_1_WGM1
    SolutionIndex: 5
    SolutionNameMin: Cijk_Alik_Bjlk_HB_GB_MT32x32x8_SN_GRVW2_LRVW2_TT4_4_VW2_WG8_8_1_WGM1
    SolutionIndex: 6
    SolutionNameMin: Cijk_Alik_Bjlk_HB_GB_MT64x64x8_SN_GRVW2_LRVW2_TT4_4_VW2_WG16_16_1_WGM1
    SolutionIndex: 7
    SolutionNameMin: Cijk_Alik_Bjlk_HB_GB_MT32x32x8_SN_GRVW4_LRVW4_TT4_4_VW4_WG8_8_1_WGM8
    SolutionIndex: 8
    SolutionNameMin: Cijk_Alik_Bjlk_HB_GB_MT32x32x16_SN_GRVW4_LRVW4_TT4_4_VW4_WG8_8_1_WGM8
    SolutionIndex: 9
    SolutionNameMin: Cijk_Alik_Bjlk_HB_GB_MT64x64x16_SN_GRVW4_LRVW4_TT4_4_VW4_WG16_16_1_WGM8
    SolutionIndex: 10
    SolutionNameMin: Cijk_Alik_Bjlk_HB_GB_MT64x128x16_SN_GRVW4_LRVW4_TT4_8_VW4_WG16_16_1_WGM8
- - - [32, 32, 8, 32, 32, 32, 32, 32]
    - [5, 93.0]
  - - [32, 32, 8, 64, 32, 32, 64, 32]
    - [0, 148.0]
  - - [32, 32, 8, 128, 32, 32, 128, 32]
    - [7, 209.0]
  - - [32, 32, 8, 256, 32, 32, 256, 32]
    - [2, 267.0]
  - - [32, 32, 8, 512, 32, 32, 512, 32]
    - [8, 315.0]
  - - [32, 64, 8, 32, 32, 32, 32, 64]
    - [0, 196.0]
  - - [32, 64, 8, 64, 32, 32, 64, 64]
    - [0, 306.0]
  - - [32, 64, 8, 128, 32, 32, 128, 64]
    - [0, 428.0]
  - - [32, 64, 8, 256, 32, 32, 256, 64]
    - [8, 551.0]
  - - [32, 64, 8, 512, 32, 32, 512, 64]
    - [8, 640.0]
  - - [32, 128, 8, 32, 32, 32, 32, 128]
    - [0, 419.0]
  - - [32, 128, 8, 64, 32, 32, 64, 128]
    - [7, 632.0]
  - - [32, 128, 8, 128, 32, 32, 128, 128]
    - [2, 878.0]
  - - [32, 128, 8, 256, 32, 32, 256, 128]
    - [8, 1120.0]
  - - [32, 128, 8, 512, 32, 32, 512, 128]
    - [8, 1298.0]
  - - [32, 256, 8, 32, 32, 32, 32, 256]
    - [0, 819.0]
  - - [32, 256, 8, 64, 32, 32, 64, 256]
    - [0, 1257.0]
  - - [32, 256, 8, 128, 32, 32, 128, 256]
    - [2, 1786.0]
  - - [32, 256, 8, 256, 32, 32, 256, 256]
    - [8, 2236.0]
  - - [32, 256, 8, 512, 32, 32, 512, 256]
    - [8, 2536.0]
  - - [32, 512, 8, 32, 32, 32, 32, 512]
    - [0, 1598.0]
  - - [32, 512, 8, 64, 32, 32, 64, 512]
    - [0, 2485.0]
  - - [32, 512, 8, 128, 32, 32, 128, 512]
    - [2, 3478.0]
  - - [32, 512, 8, 256, 32, 32, 256, 512]
    - [2, 4289.0]
  - - [32, 512, 8, 512, 32, 32, 512, 512]
    - [8, 4955.0]
  - - [64, 32, 8, 32, 64, 64, 32, 32]
    - [0, 198.0]
  - - [64, 32, 8, 64, 64, 64, 64, 32]
    - [0, 310.0]
  - - [64, 32, 8, 128, 64, 64, 128, 32]
    - [7, 429.0]
  - - [64, 32, 8, 256, 64, 64, 256, 32]
    - [8, 551.0]
  - - [64, 32, 8, 512, 64, 64, 512, 32]
    - [8, 642.0]
  - - [64, 64, 8, 32, 64, 64, 32, 64]
    - [0, 412.0]
  - - [64, 64, 8, 64, 64, 64, 64, 64]
    - [7, 630.0]
  - - [64, 64, 8, 128, 64, 64, 128, 64]
    - [8, 878.0]
  - - [64, 64, 8, 256, 64, 64, 256, 64]
    - [2, 1119.0]
  - - [64, 64, 8, 512, 64, 64, 512, 64]
    - [8, 1296.0]
  - - [64, 128, 8, 32, 64, 64, 32, 128]
    - [2, 809.0]
  - - [64, 128, 8, 64, 64, 64, 64, 128]
    - [0, 1269.0]
  - - [64, 128, 8, 128, 64, 64, 128, 128]
    - [2, 1768.0]
  - - [64, 128, 8, 256, 64, 64, 256, 128]
    - [2, 2243.0]
  - - [64, 128, 8, 512, 64, 64, 512, 128]
    - [8, 2581.0]
  - - [64, 256, 8, 32, 64, 64, 32, 256]
    - [0, 1618.0]
  - - [64, 256, 8, 64, 64, 64, 64, 256]
    - [0, 2467.0]
  - - [64, 256, 8, 128, 64, 64, 128, 256]
    - [2, 3466.0]
  - - [64, 256, 8, 256, 64, 64, 256, 256]
    - [2, 4410.0]
  - - [64, 256, 8, 512, 64, 64, 512, 256]
    - [8, 5050.0]
  - - [64, 512, 8, 32, 64, 64, 32, 512]
    - [1, 3084.0]
  - - [64, 512, 8, 64, 64, 64, 64, 512]
    - [1, 4788.0]
  - - [64, 512, 8, 128, 64, 64, 128, 512]
    - [1, 6513.0]
  - - [64, 512, 8, 256, 64, 64, 256, 512]
    - [2, 8128.0]
  - - [64, 512, 8, 512, 64, 64, 512, 512]
    - [9, 9103.0]
  - - [128, 32, 8, 32, 128, 128, 32, 32]
    - [7, 415.0]
  - - [128, 32, 8, 64, 128, 128, 64, 32]
    - [0, 630.0]
  - - [128, 32, 8, 128, 128, 128, 128, 32]
    - [2, 877.0]
  - - [128, 32, 8, 256, 128, 128, 256, 32]
    - [2, 1119.0]
  - - [128, 32, 8, 512, 128, 128, 512, 32]
    - [8, 1299.0]
  - - [128, 64, 8, 32, 128, 128, 32, 64]
    - [0, 822.0]
  - - [128, 64, 8, 64, 128, 128, 64, 64]
    - [0, 1260.0]
  - - [128, 64, 8, 128, 128, 128, 128, 64]
    - [2, 1756.0]
  - - [128, 64, 8, 256, 128, 128, 256, 64]
    - [8, 2241.0]
  - - [128, 64, 8, 512, 128, 128, 512, 64]
    - [8, 2595.0]
  - - [128, 128, 8, 32, 128, 128, 32, 128]
    - [1, 1603.0]
  - - [128, 128, 8, 64, 128, 128, 64, 128]
    - [0, 2450.0]
  - - [128, 128, 8, 128, 128, 128, 128, 128]
    - [8, 3416.0]
  - - [128, 128, 8, 256, 128, 128, 256, 128]
    - [2, 4397.0]
  - - [128, 128, 8, 512, 128, 128, 512, 128]
    - [8, 5096.0]
  - - [128, 256, 8, 32, 128, 128, 32, 256]
    - [1, 3022.0]
  - - [128, 256, 8, 64, 128, 128, 64, 256]
    - [1, 4692.0]
  - - [128, 256, 8, 128, 128, 128, 128, 256]
    - [2, 6513.0]
  - - [128, 256, 8, 256, 128, 128, 256, 256]
    - [2, 8232.0]
  - - [128, 256, 8, 512, 128, 128, 512, 256]
    - [8, 9495.0]
  - - [128, 512, 8, 32, 128, 128, 32, 512]
    - [1, 5548.0]
  - - [128, 512, 8, 64, 128, 128, 64, 512]
    - [1, 8160.0]
  - - [128, 512, 8, 128, 128, 128, 128, 512]
    - [3, 10994.0]
  - - [128, 512, 8, 256, 128, 128, 256, 512]
    - [3, 13508.0]
  - - [128, 512, 8, 512, 128, 128, 512, 512]
    - [3, 15000.0]
  - - [256, 32, 8, 32, 256, 256, 32, 32]
    - [0, 824.0]
  - - [256, 32, 8, 64, 256, 256, 64, 32]
    - [7, 1254.0]
  - - [256, 32, 8, 128, 256, 256, 128, 32]
    - [8, 1748.0]
  - - [256, 32, 8, 256, 256, 256, 256, 32]
    - [2, 2217.0]
  - - [256, 32, 8, 512, 256, 256, 512, 32]
    - [8, 2576.0]
  - - [256, 64, 8, 32, 256, 256, 32, 64]
    - [1, 1579.0]
  - - [256, 64, 8, 64, 256, 256, 64, 64]
    - [1, 2450.0]
  - - [256, 64, 8, 128, 256, 256, 128, 64]
    - [8, 3421.0]
  - - [256, 64, 8, 256, 256, 256, 256, 64]
    - [8, 4378.0]
  - - [256, 64, 8, 512, 256, 256, 512, 64]
    - [8, 5038.0]
  - - [256, 128, 8, 32, 256, 256, 32, 128]
    - [6, 2970.0]
  - - [256, 128, 8, 64, 256, 256, 64, 128]
    - [1, 4650.0]
  - - [256, 128, 8, 128, 256, 256, 128, 128]
    - [2, 6483.0]
  - - [256, 128, 8, 256, 256, 256, 256, 128]
    - [2, 8224.0]
  - - [256, 128, 8, 512, 256, 256, 512, 128]
    - [9, 9378.0]
  - - [256, 256, 8, 32, 256, 256, 32, 256]
    - [1, 5377.0]
  - - [256, 256, 8, 64, 256, 256, 64, 256]
    - [1, 8192.0]
  - - [256, 256, 8, 128, 256, 256, 128, 256]
    - [3, 11038.0]
  - - [256, 256, 8, 256, 256, 256, 256, 256]
    - [3, 13433.0]
  - - [256, 256, 8, 512, 256, 256, 512, 256]
    - [3, 15252.0]
  - - [256, 512, 8, 32, 256, 256, 32, 512]
    - [1, 8405.0]
  - - [256, 512, 8, 64, 256, 256, 64, 512]
    - [3, 11635.0]
  - - [256, 512, 8, 128, 256, 256, 128, 512]
    - [3, 14501.0]
  - - [256, 512, 8, 256, 256, 256, 256, 512]
    - [4, 16786.0]
  - - [256, 512, 8, 512, 256, 256, 512, 512]
    - [4, 18579.0]
  - - [512, 32, 8, 32, 512, 512, 32, 32]
    - [0, 1574.0]
  - - [512, 32, 8, 64, 512, 512, 64, 32]
    - [0, 2378.0]
  - - [512, 32, 8, 128, 512, 512, 128, 32]
    - [8, 3383.0]
  - - [512, 32, 8, 256, 512, 512, 256, 32]
    - [2, 4250.0]
  - - [512, 32, 8, 512, 512, 512, 512, 32]
    - [8, 4984.0]
  - - [512, 64, 8, 32, 512, 512, 32, 64]
    - [1, 2921.0]
  - - [512, 64, 8, 64, 512, 512, 64, 64]
    - [1, 4599.0]
  - - [512, 64, 8, 128, 512, 512, 128, 64]
    - [2, 6384.0]
  - - [512, 64, 8, 256, 512, 512, 256, 64]
    - [8, 8105.0]
  - - [512, 64, 8, 512, 512, 512, 512, 64]
    - [8, 9336.0]
  - - [512, 128, 8, 32, 512, 512, 32, 128]
    - [1, 5391.0]
  - - [512, 128, 8, 64, 512, 512, 64, 128]
    - [1, 8082.0]
  - - [512, 128, 8, 128, 512, 512, 128, 128]
    - [3, 10937.0]
  - - [512, 128, 8, 256, 512, 512, 256, 128]
    - [3, 13411.0]
  - - [512, 128, 8, 512, 512, 512, 512, 128]
    - [3, 15204.0]
  - - [512, 256, 8, 32, 512, 512, 32, 256]
    - [1, 8339.0]
  - - [512, 256, 8, 64, 512, 512, 64, 256]
    - [3, 11351.0]
  - - [512, 256, 8, 128, 512, 512, 128, 256]
    - [9, 14254.0]
  - - [512, 256, 8, 256, 512, 512, 256, 256]
    - [10, 16521.0]
  - - [512, 256, 8, 512, 512, 512, 512, 256]
    - [4, 18631.0]
  - - [512, 512, 8, 32, 512, 512, 32, 512]
    - [10, 11052.0]
  - - [512, 512, 8, 64, 512, 512, 64, 512]
    - [10, 15336.0]
  - - [512, 512, 8, 128, 512, 512, 128, 512]
    - [10, 18714.0]
  - - [512, 512, 8, 256, 512, 512, 256, 512]
    - [10, 21284.0]
  - - [512, 512, 8, 512, 512, 512, 512, 512]
    - [10, 22971.0]
- null
