library/src/blas3/Tensile/Logic/aldebaran/vega20_Cijk_Alik_Bljk_ZB_GB.yaml
- {MinimumRequiredVersion: 4.26.0}
- vega20
- gfx906
- [Device 66a0, Device 66a1, Device 66a7, Device 66af, Vega 20]
    SolutionIndex: 0
    SolutionNameMin: Cijk_Alik_Bljk_ZB_GB_MT32x32x8_SN_WG8_8_1_WGM1
    SolutionIndex: 1
    SolutionNameMin: Cijk_Alik_Bljk_ZB_GB_MT64x64x8_SN_WG16_16_1_WGM1
    SolutionIndex: 2
    SolutionNameMin: Cijk_Alik_Bljk_ZB_GB_MT32x32x16_SN_WG8_8_1_WGM1
    SolutionIndex: 3
    SolutionNameMin: Cijk_Alik_Bljk_ZB_GB_MT32x32x8_SN_WG8_8_1_WGM8
    SolutionIndex: 4
    SolutionNameMin: Cijk_Alik_Bljk_ZB_GB_MT64x64x8_SN_WG16_16_1_WGM8
    SolutionIndex: 5
    SolutionNameMin: Cijk_Alik_Bljk_ZB_GB_MT32x32x16_SN_WG8_8_1_WGM8
- - - [32, 32, 8, 32, 32, 32, 32, 32]
    - [0, 29.0]
  - - [32, 32, 8, 64, 32, 32, 64, 64]
    - [0, 36.0]
  - - [32, 32, 8, 128, 32, 32, 128, 128]
    - [0, 41.0]
  - - [32, 32, 8, 256, 32, 32, 256, 256]
    - [0, 44.0]
  - - [32, 32, 8, 512, 32, 32, 512, 512]
    - [0, 44.0]
  - - [32, 64, 8, 32, 32, 32, 32, 32]
    - [0, 62.0]
  - - [32, 64, 8, 64, 32, 32, 64, 64]
    - [0, 75.0]
  - - [32, 64, 8, 128, 32, 32, 128, 128]
    - [0, 83.0]
  - - [32, 64, 8, 256, 32, 32, 256, 256]
    - [0, 87.0]
  - - [32, 64, 8, 512, 32, 32, 512, 512]
    - [0, 86.0]
  - - [32, 128, 8, 32, 32, 32, 32, 32]
    - [0, 126.0]
  - - [32, 128, 8, 64, 32, 32, 64, 64]
    - [0, 150.0]
  - - [32, 128, 8, 128, 32, 32, 128, 128]
    - [0, 165.0]
  - - [32, 128, 8, 256, 32, 32, 256, 256]
    - [3, 163.0]
  - - [32, 128, 8, 512, 32, 32, 512, 512]
    - [0, 164.0]
  - - [32, 256, 8, 32, 32, 32, 32, 32]
    - [0, 245.0]
  - - [32, 256, 8, 64, 32, 32, 64, 64]
    - [0, 288.0]
  - - [32, 256, 8, 128, 32, 32, 128, 128]
    - [0, 289.0]
  - - [32, 256, 8, 256, 32, 32, 256, 256]
    - [1, 270.0]
  - - [32, 256, 8, 512, 32, 32, 512, 512]
    - [3, 283.0]
  - - [32, 512, 8, 32, 32, 32, 32, 32]
    - [0, 448.0]
  - - [32, 512, 8, 64, 32, 32, 64, 64]
    - [0, 451.0]
  - - [32, 512, 8, 128, 32, 32, 128, 128]
    - [1, 400.0]
  - - [32, 512, 8, 256, 32, 32, 256, 256]
    - [1, 408.0]
  - - [32, 512, 8, 512, 32, 32, 512, 512]
    - [1, 405.0]
  - - [64, 32, 8, 32, 64, 64, 32, 32]
    - [0, 62.0]
  - - [64, 32, 8, 64, 64, 64, 64, 64]
    - [0, 76.0]
  - - [64, 32, 8, 128, 64, 64, 128, 128]
    - [0, 84.0]
  - - [64, 32, 8, 256, 64, 64, 256, 256]
    - [0, 87.0]
  - - [64, 32, 8, 512, 64, 64, 512, 512]
    - [0, 89.0]
  - - [64, 64, 8, 32, 64, 64, 32, 32]
    - [0, 127.0]
  - - [64, 64, 8, 64, 64, 64, 64, 64]
    - [0, 151.0]
  - - [64, 64, 8, 128, 64, 64, 128, 128]
    - [0, 167.0]
  - - [64, 64, 8, 256, 64, 64, 256, 256]
    - [0, 174.0]
  - - [64, 64, 8, 512, 64, 64, 512, 512]
    - [0, 172.0]
  - - [64, 128, 8, 32, 64, 64, 32, 32]
    - [0, 249.0]
  - - [64, 128, 8, 64, 64, 64, 64, 64]
    - [0, 297.0]
  - - [64, 128, 8, 128, 64, 64, 128, 128]
    - [0, 326.0]
  - - [64, 128, 8, 256, 64, 64, 256, 256]
    - [0, 310.0]
  - - [64, 128, 8, 512, 64, 64, 512, 512]
    - [0, 319.0]
  - - [64, 256, 8, 32, 64, 64, 32, 32]
    - [0, 463.0]
  - - [64, 256, 8, 64, 64, 64, 64, 64]
    - [0, 552.0]
  - - [64, 256, 8, 128, 64, 64, 128, 128]
    - [3, 479.0]
  - - [64, 256, 8, 256, 64, 64, 256, 256]
    - [1, 488.0]
  - - [64, 256, 8, 512, 64, 64, 512, 512]
    - [1, 502.0]
  - - [64, 512, 8, 32, 64, 64, 32, 32]
    - [0, 763.0]
  - - [64, 512, 8, 64, 64, 64, 64, 64]
    - [0, 798.0]
  - - [64, 512, 8, 128, 64, 64, 128, 128]
    - [1, 728.0]
  - - [64, 512, 8, 256, 64, 64, 256, 256]
    - [1, 709.0]
  - - [64, 512, 8, 512, 64, 64, 512, 512]
    - [1, 744.0]
  - - [128, 32, 8, 32, 128, 128, 32, 32]
    - [0, 127.0]
  - - [128, 32, 8, 64, 128, 128, 64, 64]
    - [0, 152.0]
  - - [128, 32, 8, 128, 128, 128, 128, 128]
    - [0, 167.0]
  - - [128, 32, 8, 256, 128, 128, 256, 256]
    - [0, 174.0]
  - - [128, 32, 8, 512, 128, 128, 512, 512]
    - [0, 180.0]
  - - [128, 64, 8, 32, 128, 128, 32, 32]
    - [0, 246.0]
  - - [128, 64, 8, 64, 128, 128, 64, 64]
    - [0, 299.0]
  - - [128, 64, 8, 128, 128, 128, 128, 128]
    - [0, 330.0]
  - - [128, 64, 8, 256, 128, 128, 256, 256]
    - [0, 349.0]
  - - [128, 64, 8, 512, 128, 128, 512, 512]
    - [0, 339.0]
  - - [128, 128, 8, 32, 128, 128, 32, 32]
    - [0, 456.0]
  - - [128, 128, 8, 64, 128, 128, 64, 64]
    - [0, 564.0]
  - - [128, 128, 8, 128, 128, 128, 128, 128]
    - [0, 633.0]
  - - [128, 128, 8, 256, 128, 128, 256, 256]
    - [0, 579.0]
  - - [128, 128, 8, 512, 128, 128, 512, 512]
    - [5, 556.0]
  - - [128, 256, 8, 32, 128, 128, 32, 32]
    - [0, 773.0]
  - - [128, 256, 8, 64, 128, 128, 64, 64]
    - [0, 976.0]
  - - [128, 256, 8, 128, 128, 128, 128, 128]
    - [0, 876.0]
  - - [128, 256, 8, 256, 128, 128, 256, 256]
    - [1, 853.0]
  - - [128, 256, 8, 512, 128, 128, 512, 512]
    - [1, 885.0]
  - - [128, 512, 8, 32, 128, 128, 32, 32]
    - [0, 873.0]
  - - [128, 512, 8, 64, 128, 128, 64, 64]
    - [0, 1035.0]
  - - [128, 512, 8, 128, 128, 128, 128, 128]
    - [1, 1033.0]
  - - [128, 512, 8, 256, 128, 128, 256, 256]
    - [1, 984.0]
  - - [128, 512, 8, 512, 128, 128, 512, 512]
    - [4, 1097.0]
  - - [256, 32, 8, 32, 256, 256, 32, 32]
    - [0, 241.0]
  - - [256, 32, 8, 64, 256, 256, 64, 64]
    - [0, 294.0]
  - - [256, 32, 8, 128, 256, 256, 128, 128]
    - [0, 328.0]
  - - [256, 32, 8, 256, 256, 256, 256, 256]
    - [0, 349.0]
  - - [256, 32, 8, 512, 256, 256, 512, 512]
    - [0, 361.0]
  - - [256, 64, 8, 32, 256, 256, 32, 32]
    - [4, 439.0]
  - - [256, 64, 8, 64, 256, 256, 64, 64]
    - [0, 549.0]
  - - [256, 64, 8, 128, 256, 256, 128, 128]
    - [0, 631.0]
  - - [256, 64, 8, 256, 256, 256, 256, 256]
    - [0, 683.0]
  - - [256, 64, 8, 512, 256, 256, 512, 512]
    - [2, 619.0]
  - - [256, 128, 8, 32, 256, 256, 32, 32]
    - [3, 788.0]
  - - [256, 128, 8, 64, 256, 256, 64, 64]
    - [1, 995.0]
  - - [256, 128, 8, 128, 256, 256, 128, 128]
    - [0, 1109.0]
  - - [256, 128, 8, 256, 256, 256, 256, 256]
    - [1, 970.0]
  - - [256, 128, 8, 512, 256, 256, 512, 512]
    - [1, 960.0]
  - - [256, 256, 8, 32, 256, 256, 32, 32]
    - [1, 861.0]
  - - [256, 256, 8, 64, 256, 256, 64, 64]
    - [1, 1072.0]
  - - [256, 256, 8, 128, 256, 256, 128, 128]
    - [3, 1171.0]
  - - [256, 256, 8, 256, 256, 256, 256, 256]
    - [1, 1108.0]
  - - [256, 256, 8, 512, 256, 256, 512, 512]
    - [4, 1135.0]
  - - [256, 512, 8, 32, 256, 256, 32, 32]
    - [0, 917.0]
  - - [256, 512, 8, 64, 256, 256, 64, 64]
    - [1, 1116.0]
  - - [256, 512, 8, 128, 256, 256, 128, 128]
    - [1, 1218.0]
  - - [256, 512, 8, 256, 256, 256, 256, 256]
    - [1, 1214.0]
  - - [256, 512, 8, 512, 256, 256, 512, 512]
    - [1, 1214.0]
  - - [512, 32, 8, 32, 512, 512, 32, 32]
    - [0, 429.0]
  - - [512, 32, 8, 64, 512, 512, 64, 64]
    - [0, 544.0]
  - - [512, 32, 8, 128, 512, 512, 128, 128]
    - [0, 632.0]
  - - [512, 32, 8, 256, 512, 512, 256, 256]
    - [0, 691.0]
  - - [512, 32, 8, 512, 512, 512, 512, 512]
    - [0, 720.0]
  - - [512, 64, 8, 32, 512, 512, 32, 32]
    - [4, 759.0]
  - - [512, 64, 8, 64, 512, 512, 64, 64]
    - [4, 980.0]
  - - [512, 64, 8, 128, 512, 512, 128, 128]
    - [4, 1149.0]
  - - [512, 64, 8, 256, 512, 512, 256, 256]
    - [1, 1008.0]
  - - [512, 64, 8, 512, 512, 512, 512, 512]
    - [3, 1260.0]
  - - [512, 128, 8, 32, 512, 512, 32, 32]
    - [1, 867.0]
  - - [512, 128, 8, 64, 512, 512, 64, 64]
    - [1, 1078.0]
  - - [512, 128, 8, 128, 512, 512, 128, 128]
    - [1, 1216.0]
  - - [512, 128, 8, 256, 512, 512, 256, 256]
    - [3, 1246.0]
  - - [512, 128, 8, 512, 512, 512, 512, 512]
    - [3, 1277.0]
  - - [512, 256, 8, 32, 512, 512, 32, 32]
    - [0, 917.0]
  - - [512, 256, 8, 64, 512, 512, 64, 64]
    - [1, 1123.0]
  - - [512, 256, 8, 128, 512, 512, 128, 128]
    - [1, 1248.0]
  - - [512, 256, 8, 256, 512, 512, 256, 256]
    - [1, 1308.0]
  - - [512, 256, 8, 512, 512, 512, 512, 512]
    - [1, 1280.0]
  - - [512, 512, 8, 32, 512, 512, 32, 32]
    - [0, 975.0]
  - - [512, 512, 8, 64, 512, 512, 64, 64]
    - [1, 1143.0]
  - - [512, 512, 8, 128, 512, 512, 128, 128]
    - [1, 1271.0]
  - - [512, 512, 8, 256, 512, 512, 256, 256]
    - [1, 1306.0]
  - - [512, 512, 8, 512, 512, 512, 512, 512]
    - [1, 1312.0]
- null
