library/src/blas3/Tensile/Logic/aldebaran/vega20_Cijk_Ailk_Bjlk_HSS_BH.yaml
- {MinimumRequiredVersion: 4.24.0}
- vega20
- gfx906
- [Device 66a0, Device 66a1, Device 66a7, Device 66af, Vega 20]
    SolutionIndex: 0
    SolutionNameMin: Cijk_Ailk_Bjlk_HSS_BH_MT32x16x8_SE_GSU1_PGR1_PLR1_TT4_2_VAW2
    SolutionIndex: 1
    SolutionNameMin: Cijk_Ailk_Bjlk_HSS_BH_MT32x32x8_SE_GSU1_PGR1_PLR1_TT4_4_VAW2
    SolutionIndex: 2
    SolutionNameMin: Cijk_Ailk_Bjlk_HSS_BH_MT32x16x8_SE_GSU1_PGR1_PLR1_TT4_2_VAW2
    SolutionIndex: 3
    SolutionNameMin: Cijk_Ailk_Bjlk_HSS_BH_MT32x32x8_SE_GSU1_PGR1_PLR1_TT4_4_VAW2
    SolutionIndex: 4
    SolutionNameMin: Cijk_Ailk_Bjlk_HSS_BH_MT64x32x8_SE_GSU1_PGR1_PLR1_TT8_4_VAW2
    SolutionIndex: 5
    SolutionNameMin: Cijk_Ailk_Bjlk_HSS_BH_MT16x16x16_SE_GSU1_PGR1_PLR1_TT2_2_VAW2
    SolutionIndex: 6
    SolutionNameMin: Cijk_Ailk_Bjlk_HSS_BH_MT32x16x16_SE_GSU1_PGR1_PLR1_TT4_2_VAW2
    SolutionIndex: 7
    SolutionNameMin: Cijk_Ailk_Bjlk_HSS_BH_MT32x32x16_SE_GSU1_PGR1_PLR1_TT4_4_VAW2
    SolutionIndex: 8
    SolutionNameMin: Cijk_Ailk_Bjlk_HSS_BH_MT32x16x16_SE_GSU1_PGR1_PLR1_TT2_2_VAW2
    SolutionIndex: 9
    SolutionNameMin: Cijk_Ailk_Bjlk_HSS_BH_MT64x16x16_SE_GSU1_PGR1_PLR1_TT4_2_VAW2
    SolutionIndex: 10
    SolutionNameMin: Cijk_Ailk_Bjlk_HSS_BH_MT32x16x16_SE_GSU1_PGR1_PLR1_TT4_2_VAW2
    SolutionIndex: 11
    SolutionNameMin: Cijk_Ailk_Bjlk_HSS_BH_MT32x32x16_SE_GSU1_PGR1_PLR1_TT4_4_VAW2
    SolutionIndex: 12
    SolutionNameMin: Cijk_Ailk_Bjlk_HSS_BH_MT64x16x16_SE_GSU1_PGR1_PLR1_TT4_2_VAW2
    SolutionIndex: 13
    SolutionNameMin: Cijk_Ailk_Bjlk_HSS_BH_MT16x16x32_SE_GSU1_PGR1_PLR1_TT2_2_VAW2
    SolutionIndex: 14
    SolutionNameMin: Cijk_Ailk_Bjlk_HSS_BH_MT32x16x32_SE_GSU1_PGR1_PLR1_TT2_2_VAW2
    SolutionIndex: 15
    SolutionNameMin: Cijk_Ailk_Bjlk_HSS_BH_MT64x16x32_SE_GSU1_PGR1_PLR1_TT2_2_VAW2
    SolutionIndex: 16
    SolutionNameMin: Cijk_Ailk_Bjlk_HSS_BH_MT128x16x32_SE_GSU1_PGR1_PLR1_TT4_2_VAW2
    SolutionIndex: 17
    SolutionNameMin: Cijk_Ailk_Bjlk_HSS_BH_MT32x8x32_SE_GSU1_PGR1_PLR1_TT2_2_VAW2
    SolutionIndex: 18
    SolutionNameMin: Cijk_Ailk_Bjlk_HSS_BH_MT16x16x32_SE_GSU1_PGR1_PLR1_TT2_2_VAW2
    SolutionIndex: 19
    SolutionNameMin: Cijk_Ailk_Bjlk_HSS_BH_MT32x16x32_SE_GSU1_PGR1_PLR1_TT4_2_VAW2
    SolutionIndex: 20
    SolutionNameMin: Cijk_Ailk_Bjlk_HSS_BH_MT32x32x32_SE_GSU1_PGR1_PLR1_TT4_4_VAW2
    SolutionIndex: 21
    SolutionNameMin: Cijk_Ailk_Bjlk_HSS_BH_MT32x16x32_SE_GSU1_PGR1_PLR1_TT2_2_VAW2
    SolutionIndex: 22
    SolutionNameMin: Cijk_Ailk_Bjlk_HSS_BH_MT64x16x32_SE_GSU1_PGR1_PLR1_TT2_2_VAW2
    SolutionIndex: 23
    SolutionNameMin: Cijk_Ailk_Bjlk_HSS_BH_MT16x16x64_SE_GSU1_PGR1_PLR1_TT2_2_VAW2
    SolutionIndex: 24
    SolutionNameMin: Cijk_Ailk_Bjlk_HSS_BH_MT32x16x64_SE_GSU1_PGR1_PLR1_TT2_2_VAW2
    SolutionIndex: 25
    SolutionNameMin: Cijk_Ailk_Bjlk_HSS_BH_MT64x16x64_SE_GSU1_PGR1_PLR1_TT2_2_VAW2
    SolutionIndex: 26
    SolutionNameMin: Cijk_Ailk_Bjlk_HSS_BH_MT16x16x64_SE_GSU1_PGR1_PLR1_TT2_2_VAW2
    SolutionIndex: 27
    SolutionNameMin: Cijk_Ailk_Bjlk_HSS_BH_MT32x16x64_SE_GSU1_PGR1_PLR1_TT2_2_VAW2
    SolutionIndex: 28
    SolutionNameMin: Cijk_Ailk_Bjlk_HSS_BH_MT64x16x64_SE_GSU1_PGR1_PLR1_TT2_2_VAW2
    SolutionIndex: 29
    SolutionNameMin: Cijk_Ailk_Bjlk_HSS_BH_MT64x128x8_SE_GSU1_PGR1_PLR1_TT4_8_VAW2
    SolutionIndex: 30
    SolutionNameMin: Cijk_Ailk_Bjlk_HSS_BH_MT64x64x16_SE_GSU1_PGR1_PLR1_TT4_4_VAW2
    SolutionIndex: 31
    SolutionNameMin: Cijk_Ailk_Bjlk_HSS_BH_MT64x128x16_SE_GSU1_PGR1_PLR1_TT4_8_VAW2
    SolutionIndex: 32
    SolutionNameMin: Cijk_Ailk_Bjlk_HSS_BH_MT128x64x16_SE_GSU1_PGR1_PLR1_TT8_4_VAW2
    SolutionIndex: 33
    SolutionNameMin: Cijk_Ailk_Bjlk_HSS_BH_MT64x64x32_SE_GSU1_PGR1_PLR1_TT4_4_VAW2
    SolutionIndex: 34
    SolutionNameMin: Cijk_Ailk_Bjlk_HSS_BH_MT32x32x16_SE_GSU1_PGR1_PLR1_TT2_2_VAW2
    SolutionIndex: 35
    SolutionNameMin: Cijk_Ailk_Bjlk_HSS_BH_MT32x32x32_SE_GSU1_PGR1_PLR1_TT2_2_VAW2
    SolutionIndex: 36
    SolutionNameMin: Cijk_Ailk_Bjlk_HSS_BH_MT32x32x64_SE_GSU1_PGR1_PLR1_TT2_2_VAW2
    SolutionIndex: 37
    SolutionNameMin: Cijk_Ailk_Bjlk_HSS_BH_MT64x64x4_SE_GSU1_PGR0_PLR0_TT4_4_VAW2
    SolutionIndex: 38
    SolutionNameMin: Cijk_Ailk_Bjlk_HSS_BH_MT64x64x4_SE_GSU1_PGR1_PLR0_TT4_4_VAW2
    SolutionIndex: 39
    SolutionNameMin: Cijk_Ailk_Bjlk_HSS_BH_MT64x64x4_SE_GSU1_PGR0_PLR1_TT4_4_VAW2
    SolutionIndex: 40
    SolutionNameMin: Cijk_Ailk_Bjlk_HSS_BH_MT64x128x8_SE_GSU1_PGR0_PLR0_TT4_8_VAW2
    SolutionIndex: 41
    SolutionNameMin: Cijk_Ailk_Bjlk_HSS_BH_MT64x64x8_SE_GSU1_PGR0_PLR0_TT4_4_VAW2
    SolutionIndex: 42
    SolutionNameMin: Cijk_Ailk_Bjlk_HSS_BH_MT64x64x8_SE_GSU1_PGR1_PLR0_TT4_4_VAW2
    SolutionIndex: 43
    SolutionNameMin: Cijk_Ailk_Bjlk_HSS_BH_MT64x128x8_SE_GSU1_PGR0_PLR1_TT4_8_VAW2
    SolutionIndex: 44
    SolutionNameMin: Cijk_Ailk_Bjlk_HSS_BH_MT64x64x8_SE_GSU1_PGR0_PLR1_TT4_4_VAW2
    SolutionIndex: 45
    SolutionNameMin: Cijk_Ailk_Bjlk_HSS_BH_MT64x128x8_SE_GSU1_PGR1_PLR1_TT4_8_VAW2
    SolutionIndex: 46
    SolutionNameMin: Cijk_Ailk_Bjlk_HSS_BH_MT64x64x8_SE_GSU1_PGR1_PLR1_TT4_4_VAW2
    SolutionIndex: 47
    SolutionNameMin: Cijk_Ailk_Bjlk_HSS_BH_MT64x128x16_SE_GSU1_PGR0_PLR0_TT4_8_VAW2
    SolutionIndex: 48
    SolutionNameMin: Cijk_Ailk_Bjlk_HSS_BH_MT64x64x16_SE_GSU1_PGR0_PLR0_TT4_4_VAW2
    SolutionIndex: 49
    SolutionNameMin: Cijk_Ailk_Bjlk_HSS_BH_MT64x128x16_SE_GSU1_PGR1_PLR0_TT4_8_VAW2
    SolutionIndex: 50
    SolutionNameMin: Cijk_Ailk_Bjlk_HSS_BH_MT64x64x16_SE_GSU1_PGR1_PLR0_TT4_4_VAW2
    SolutionIndex: 51
    SolutionNameMin: Cijk_Ailk_Bjlk_HSS_BH_MT64x64x16_SE_GSU1_PGR0_PLR1_TT4_4_VAW2
    SolutionIndex: 52
    SolutionNameMin: Cijk_Ailk_Bjlk_HSS_BH_MT64x64x16_SE_GSU1_PGR1_PLR1_TT4_4_VAW2
    SolutionIndex: 53
    SolutionNameMin: Cijk_Ailk_Bjlk_HSS_BH_MT64x64x8_SE_GSU3_PGR0_PLR0_TT4_4_VAW1
    SolutionIndex: 54
    SolutionNameMin: Cijk_Ailk_Bjlk_HSS_BH_MT64x64x8_SE_GSU3_PGR0_PLR1_TT4_4_VAW1
    SolutionIndex: 55
    SolutionNameMin: Cijk_Ailk_Bjlk_HSS_BH_MT64x64x8_SE_GSU5_PGR0_PLR0_TT4_4_VAW1
    SolutionIndex: 56
    SolutionNameMin: Cijk_Ailk_Bjlk_HSS_BH_MT64x64x8_SE_GSU5_PGR1_PLR0_TT4_4_VAW1
    SolutionIndex: 57
    SolutionNameMin: Cijk_Ailk_Bjlk_HSS_BH_MT64x64x8_SE_GSU5_PGR0_PLR1_TT4_4_VAW1
    SolutionIndex: 58
    SolutionNameMin: Cijk_Ailk_Bjlk_HSS_BH_MT64x64x16_SE_GSU5_PGR0_PLR1_TT4_4_VAW1
    SolutionIndex: 59
    SolutionNameMin: Cijk_Ailk_Bjlk_HSS_BH_MT64x64x16_SE_GSU5_PGR1_PLR1_TT4_4_VAW1
    SolutionIndex: 60
    SolutionNameMin: Cijk_Ailk_Bjlk_HSS_BH_MT64x64x8_SE_GSU7_PGR0_PLR0_TT4_4_VAW1
    SolutionIndex: 61
    SolutionNameMin: Cijk_Ailk_Bjlk_HSS_BH_MT64x64x8_SE_GSU7_PGR0_PLR1_TT4_4_VAW1
    SolutionIndex: 62
    SolutionNameMin: Cijk_Ailk_Bjlk_HSS_BH_MT64x64x16_SE_GSU7_PGR0_PLR1_TT4_4_VAW1
    SolutionIndex: 63
    SolutionNameMin: Cijk_Ailk_Bjlk_HSS_BH_MT64x64x16_SE_GSU7_PGR1_PLR1_TT4_4_VAW1
    SolutionIndex: 64
    SolutionNameMin: Cijk_Ailk_Bjlk_HSS_BH_MT128x128x4_SE_GSU1_PGR0_PLR0_TT8_8_VAW2
    SolutionIndex: 65
    SolutionNameMin: Cijk_Ailk_Bjlk_HSS_BH_MT64x128x4_SE_GSU1_PGR0_PLR0_TT4_8_VAW2
    SolutionIndex: 66
    SolutionNameMin: Cijk_Ailk_Bjlk_HSS_BH_MT64x64x4_SE_GSU1_PGR0_PLR0_TT4_4_VAW2
    SolutionIndex: 67
    SolutionNameMin: Cijk_Ailk_Bjlk_HSS_BH_MT64x128x4_SE_GSU1_PGR1_PLR0_TT4_8_VAW2
    SolutionIndex: 68
    SolutionNameMin: Cijk_Ailk_Bjlk_HSS_BH_MT64x64x4_SE_GSU1_PGR1_PLR0_TT4_4_VAW2
    SolutionIndex: 69
    SolutionNameMin: Cijk_Ailk_Bjlk_HSS_BH_MT64x128x4_SE_GSU1_PGR0_PLR1_TT4_8_VAW2
    SolutionIndex: 70
    SolutionNameMin: Cijk_Ailk_Bjlk_HSS_BH_MT64x64x4_SE_GSU1_PGR0_PLR1_TT4_4_VAW2
    SolutionIndex: 71
    SolutionNameMin: Cijk_Ailk_Bjlk_HSS_BH_MT64x128x4_SE_GSU1_PGR1_PLR1_TT4_8_VAW2
    SolutionIndex: 72
    SolutionNameMin: Cijk_Ailk_Bjlk_HSS_BH_MT64x64x4_SE_GSU1_PGR1_PLR1_TT4_4_VAW2
    SolutionIndex: 73
    SolutionNameMin: Cijk_Ailk_Bjlk_HSS_BH_MT64x128x8_SE_GSU1_PGR0_PLR0_TT4_8_VAW2
    SolutionIndex: 74
    SolutionNameMin: Cijk_Ailk_Bjlk_HSS_BH_MT64x64x8_SE_GSU1_PGR0_PLR0_TT4_4_VAW2
    SolutionIndex: 75
    SolutionNameMin: Cijk_Ailk_Bjlk_HSS_BH_MT64x128x8_SE_GSU1_PGR1_PLR0_TT4_8_VAW2
    SolutionIndex: 76
    SolutionNameMin: Cijk_Ailk_Bjlk_HSS_BH_MT64x64x8_SE_GSU1_PGR1_PLR0_TT4_4_VAW2
    SolutionIndex: 77
    SolutionNameMin: Cijk_Ailk_Bjlk_HSS_BH_MT64x128x8_SE_GSU1_PGR0_PLR1_TT4_8_VAW2
    SolutionIndex: 78
    SolutionNameMin: Cijk_Ailk_Bjlk_HSS_BH_MT64x64x8_SE_GSU1_PGR1_PLR1_TT4_4_VAW2
    SolutionIndex: 79
    SolutionNameMin: Cijk_Ailk_Bjlk_HSS_BH_MT64x64x16_SE_GSU1_PGR0_PLR0_TT4_4_VAW2
    SolutionIndex: 80
    SolutionNameMin: Cijk_Ailk_Bjlk_HSS_BH_MT64x64x16_SE_GSU1_PGR0_PLR1_TT4_4_VAW2
    SolutionIndex: 81
    SolutionNameMin: Cijk_Ailk_Bjlk_HSS_BH_MT64x64x16_SE_GSU1_PGR1_PLR1_TT4_4_VAW2
    SolutionIndex: 82
    SolutionNameMin: Cijk_Ailk_Bjlk_HSS_BH_MT64x64x4_SE_GSU3_PGR1_PLR0_TT4_4_VAW1
    SolutionIndex: 83
    SolutionNameMin: Cijk_Ailk_Bjlk_HSS_BH_MT64x64x8_SE_GSU3_PGR0_PLR0_TT4_4_VAW1
    SolutionIndex: 84
    SolutionNameMin: Cijk_Ailk_Bjlk_HSS_BH_MT64x128x8_SE_GSU3_PGR1_PLR0_TT4_8_VAW1
    SolutionIndex: 85
    SolutionNameMin: Cijk_Ailk_Bjlk_HSS_BH_MT64x64x8_SE_GSU3_PGR1_PLR0_TT4_4_VAW1
    SolutionIndex: 86
    SolutionNameMin: Cijk_Ailk_Bjlk_HSS_BH_MT64x64x16_SE_GSU3_PGR0_PLR0_TT4_4_VAW1
    SolutionIndex: 87
    SolutionNameMin: Cijk_Ailk_Bjlk_HSS_BH_MT64x64x4_SE_GSU5_PGR0_PLR0_TT4_4_VAW1
    SolutionIndex: 88
    SolutionNameMin: Cijk_Ailk_Bjlk_HSS_BH_MT64x64x4_SE_GSU5_PGR1_PLR0_TT4_4_VAW1
    SolutionIndex: 89
    SolutionNameMin: Cijk_Ailk_Bjlk_HSS_BH_MT64x128x8_SE_GSU5_PGR0_PLR0_TT4_8_VAW1
    SolutionIndex: 90
    SolutionNameMin: Cijk_Ailk_Bjlk_HSS_BH_MT64x64x8_SE_GSU5_PGR0_PLR0_TT4_4_VAW1
    SolutionIndex: 91
    SolutionNameMin: Cijk_Ailk_Bjlk_HSS_BH_MT64x64x8_SE_GSU5_PGR1_PLR0_TT4_4_VAW1
    SolutionIndex: 92
    SolutionNameMin: Cijk_Ailk_Bjlk_HSS_BH_MT64x128x8_SE_GSU5_PGR0_PLR1_TT4_8_VAW1
    SolutionIndex: 93
    SolutionNameMin: Cijk_Ailk_Bjlk_HSS_BH_MT64x64x8_SE_GSU5_PGR0_PLR1_TT4_4_VAW1
    SolutionIndex: 94
    SolutionNameMin: Cijk_Ailk_Bjlk_HSS_BH_MT64x128x16_SE_GSU5_PGR0_PLR0_TT4_8_VAW1
    SolutionIndex: 95
    SolutionNameMin: Cijk_Ailk_Bjlk_HSS_BH_MT64x64x16_SE_GSU5_PGR0_PLR0_TT4_4_VAW1
    SolutionIndex: 96
    SolutionNameMin: Cijk_Ailk_Bjlk_HSS_BH_MT64x64x16_SE_GSU5_PGR1_PLR0_TT4_4_VAW1
    SolutionIndex: 97
    SolutionNameMin: Cijk_Ailk_Bjlk_HSS_BH_MT64x64x16_SE_GSU5_PGR0_PLR1_TT4_4_VAW1
    SolutionIndex: 98
    SolutionNameMin: Cijk_Ailk_Bjlk_HSS_BH_MT64x64x16_SE_GSU5_PGR1_PLR1_TT4_4_VAW1
    SolutionIndex: 99
    SolutionNameMin: Cijk_Ailk_Bjlk_HSS_BH_MT64x64x4_SE_GSU7_PGR1_PLR0_TT4_4_VAW1
    SolutionIndex: 100
    SolutionNameMin: Cijk_Ailk_Bjlk_HSS_BH_MT64x128x8_SE_GSU7_PGR0_PLR0_TT4_8_VAW1
    SolutionIndex: 101
    SolutionNameMin: Cijk_Ailk_Bjlk_HSS_BH_MT64x64x8_SE_GSU7_PGR0_PLR0_TT4_4_VAW1
    SolutionIndex: 102
    SolutionNameMin: Cijk_Ailk_Bjlk_HSS_BH_MT64x64x8_SE_GSU7_PGR1_PLR0_TT4_4_VAW1
    SolutionIndex: 103
    SolutionNameMin: Cijk_Ailk_Bjlk_HSS_BH_MT64x64x8_SE_GSU7_PGR0_PLR1_TT4_4_VAW1
    SolutionIndex: 104
    SolutionNameMin: Cijk_Ailk_Bjlk_HSS_BH_MT64x64x16_SE_GSU7_PGR0_PLR0_TT4_4_VAW1
    SolutionIndex: 105
    SolutionNameMin: Cijk_Ailk_Bjlk_HSS_BH_MT64x64x16_SE_GSU7_PGR1_PLR0_TT4_4_VAW1
    SolutionIndex: 106
    SolutionNameMin: Cijk_Ailk_Bjlk_HSS_BH_MT64x64x16_SE_GSU7_PGR0_PLR1_TT4_4_VAW1
- - - [64, 64, 1, 256, 64, 64, 64, 64]
    - [36, 135.0]
  - - [128, 64, 1, 256, 128, 128, 128, 64]
    - [34, 252.0]
  - - [64, 128, 1, 256, 64, 64, 64, 128]
    - [35, 255.0]
  - - [128, 128, 1, 256, 128, 128, 128, 128]
    - [13, 535.0]
  - - [64, 256, 1, 256, 64, 64, 64, 256]
    - [13, 535.0]
  - - [128, 256, 1, 256, 128, 128, 128, 256]
    - [14, 1070.0]
  - - [64, 448, 1, 256, 64, 64, 64, 448]
    - [24, 936.0]
  - - [128, 448, 1, 256, 128, 128, 128, 448]
    - [15, 1799.0]
  - - [64, 704, 1, 256, 64, 64, 64, 704]
    - [18, 1428.0]
  - - [128, 704, 1, 256, 128, 128, 128, 704]
    - [14, 2621.0]
  - - [64, 1024, 1, 256, 64, 64, 64, 1024]
    - [36, 2097.0]
  - - [128, 1024, 1, 256, 128, 128, 128, 1024]
    - [15, 3679.0]
  - - [64, 1408, 1, 256, 64, 64, 64, 1408]
    - [14, 2645.0]
  - - [128, 1408, 1, 256, 128, 128, 128, 1408]
    - [15, 4272.0]
  - - [64, 1856, 1, 256, 64, 64, 64, 1856]
    - [36, 3456.0]
  - - [128, 1856, 1, 256, 128, 128, 128, 1856]
    - [16, 4812.0]
  - - [64, 2368, 1, 256, 64, 64, 64, 2368]
    - [14, 3849.0]
  - - [128, 2368, 1, 256, 128, 128, 128, 2368]
    - [9, 4755.0]
  - - [64, 2944, 1, 256, 64, 64, 64, 2944]
    - [36, 4638.0]
  - - [128, 2944, 1, 256, 128, 128, 128, 2944]
    - [6, 5715.0]
  - - [64, 3584, 1, 256, 64, 64, 64, 3584]
    - [14, 4766.0]
  - - [128, 3584, 1, 256, 128, 128, 128, 3584]
    - [6, 5968.0]
  - - [64, 4288, 1, 256, 64, 64, 64, 4288]
    - [8, 4413.0]
  - - [128, 4288, 1, 256, 128, 128, 128, 4288]
    - [6, 5759.0]
  - - [64, 5056, 1, 256, 64, 64, 64, 5056]
    - [34, 5152.0]
  - - [128, 5056, 1, 256, 128, 128, 128, 5056]
    - [0, 6574.0]
  - - [64, 5888, 1, 256, 64, 64, 64, 5888]
    - [6, 5557.0]
  - - [128, 5888, 1, 256, 128, 128, 128, 5888]
    - [1, 6970.0]
  - - [64, 6784, 1, 256, 64, 64, 64, 6784]
    - [9, 5648.0]
  - - [128, 6784, 1, 256, 128, 128, 128, 6784]
    - [2, 6744.0]
  - - [64, 64, 1, 1280, 64, 64, 64, 64]
    - [25, 173.0]
  - - [128, 64, 1, 1280, 128, 128, 128, 64]
    - [5, 307.0]
  - - [64, 128, 1, 1280, 64, 64, 64, 128]
    - [5, 306.0]
  - - [128, 128, 1, 1280, 128, 128, 128, 128]
    - [26, 694.0]
  - - [64, 256, 1, 1280, 64, 64, 64, 256]
    - [23, 694.0]
  - - [128, 256, 1, 1280, 128, 128, 128, 256]
    - [24, 1391.0]
  - - [64, 448, 1, 1280, 64, 64, 64, 448]
    - [24, 1217.0]
  - - [128, 448, 1, 1280, 128, 128, 128, 448]
    - [25, 2389.0]
  - - [64, 704, 1, 1280, 64, 64, 64, 704]
    - [18, 1830.0]
  - - [128, 704, 1, 1280, 128, 128, 128, 704]
    - [27, 3483.0]
  - - [64, 1024, 1, 1280, 64, 64, 64, 1024]
    - [36, 2767.0]
  - - [128, 1024, 1, 1280, 128, 128, 128, 1024]
    - [25, 4866.0]
  - - [64, 1408, 1, 1280, 64, 64, 64, 1408]
    - [24, 3483.0]
  - - [128, 1408, 1, 1280, 128, 128, 128, 1408]
    - [15, 5390.0]
  - - [64, 1856, 1, 1280, 64, 64, 64, 1856]
    - [36, 4514.0]
  - - [128, 1856, 1, 1280, 128, 128, 128, 1856]
    - [16, 5875.0]
  - - [64, 2368, 1, 1280, 64, 64, 64, 2368]
    - [14, 4821.0]
  - - [128, 2368, 1, 1280, 128, 128, 128, 2368]
    - [10, 5801.0]
  - - [64, 2944, 1, 1280, 64, 64, 64, 2944]
    - [36, 5934.0]
  - - [128, 2944, 1, 1280, 128, 128, 128, 2944]
    - [10, 6899.0]
  - - [64, 3584, 1, 1280, 64, 64, 64, 3584]
    - [14, 5891.0]
  - - [128, 3584, 1, 1280, 128, 128, 128, 3584]
    - [9, 7065.0]
  - - [64, 4288, 1, 1280, 64, 64, 64, 4288]
    - [35, 5455.0]
  - - [128, 4288, 1, 1280, 128, 128, 128, 4288]
    - [6, 6568.0]
  - - [64, 5056, 1, 1280, 64, 64, 64, 5056]
    - [35, 6392.0]
  - - [128, 5056, 1, 1280, 128, 128, 128, 5056]
    - [0, 7498.0]
  - - [64, 5888, 1, 1280, 64, 64, 64, 5888]
    - [10, 6922.0]
  - - [128, 5888, 1, 1280, 128, 128, 128, 5888]
    - [11, 7912.0]
  - - [64, 6784, 1, 1280, 64, 64, 64, 6784]
    - [9, 6673.0]
  - - [128, 6784, 1, 1280, 128, 128, 128, 6784]
    - [33, 7143.0]
  - - [64, 64, 1, 3328, 64, 64, 64, 64]
    - [36, 183.0]
  - - [128, 64, 1, 3328, 128, 128, 128, 64]
    - [13, 336.0]
  - - [64, 128, 1, 3328, 64, 64, 64, 128]
    - [13, 336.0]
  - - [128, 128, 1, 3328, 128, 128, 128, 128]
    - [26, 728.0]
  - - [64, 256, 1, 3328, 64, 64, 64, 256]
    - [26, 727.0]
  - - [128, 256, 1, 3328, 128, 128, 128, 256]
    - [24, 1458.0]
  - - [64, 448, 1, 3328, 64, 64, 64, 448]
    - [24, 1276.0]
  - - [128, 448, 1, 3328, 128, 128, 128, 448]
    - [25, 2532.0]
  - - [64, 704, 1, 3328, 64, 64, 64, 704]
    - [23, 1934.0]
  - - [128, 704, 1, 3328, 128, 128, 128, 704]
    - [24, 3704.0]
  - - [64, 1024, 1, 3328, 64, 64, 64, 1024]
    - [36, 2907.0]
  - - [128, 1024, 1, 3328, 128, 128, 128, 1024]
    - [28, 5183.0]
  - - [64, 1408, 1, 3328, 64, 64, 64, 1408]
    - [27, 3704.0]
  - - [128, 1408, 1, 3328, 128, 128, 128, 1408]
    - [22, 5620.0]
  - - [64, 1856, 1, 3328, 64, 64, 64, 1856]
    - [36, 4774.0]
  - - [128, 1856, 1, 3328, 128, 128, 128, 1856]
    - [16, 6082.0]
  - - [64, 2368, 1, 3328, 64, 64, 64, 2368]
    - [14, 5052.0]
  - - [128, 2368, 1, 3328, 128, 128, 128, 2368]
    - [10, 6013.0]
  - - [64, 2944, 1, 3328, 64, 64, 64, 2944]
    - [36, 6216.0]
  - - [128, 2944, 1, 3328, 128, 128, 128, 2944]
    - [6, 7161.0]
  - - [64, 3584, 1, 3328, 64, 64, 64, 3584]
    - [14, 6140.0]
  - - [128, 3584, 1, 3328, 128, 128, 128, 3584]
    - [9, 7276.0]
  - - [64, 4288, 1, 3328, 64, 64, 64, 4288]
    - [35, 5663.0]
  - - [128, 4288, 1, 3328, 128, 128, 128, 4288]
    - [6, 6729.0]
  - - [64, 5056, 1, 3328, 64, 64, 64, 5056]
    - [35, 6647.0]
  - - [128, 5056, 1, 3328, 128, 128, 128, 5056]
    - [0, 7681.0]
  - - [64, 5888, 1, 3328, 64, 64, 64, 5888]
    - [10, 7171.0]
  - - [128, 5888, 1, 3328, 128, 128, 128, 5888]
    - [33, 8124.0]
  - - [64, 6784, 1, 3328, 64, 64, 64, 6784]
    - [10, 6899.0]
  - - [128, 6784, 1, 3328, 128, 128, 128, 6784]
    - [33, 7281.0]
  - - [256, 64, 1, 256, 256, 256, 256, 64]
    - [18, 535.0]
  - - [448, 64, 1, 256, 448, 448, 448, 64]
    - [24, 936.0]
  - - [704, 64, 1, 256, 704, 704, 704, 64]
    - [17, 1386.0]
  - - [1024, 64, 1, 256, 1024, 1024, 1024, 64]
    - [35, 2056.0]
  - - [1408, 64, 1, 256, 1408, 1408, 1408, 64]
    - [36, 2645.0]
  - - [1856, 64, 1, 256, 1856, 1856, 1856, 64]
    - [36, 3394.0]
  - - [2368, 64, 1, 256, 2368, 2368, 2368, 64]
    - [14, 3789.0]
  - - [2944, 64, 1, 256, 2944, 2944, 2944, 64]
    - [35, 4603.0]
  - - [3584, 64, 1, 256, 3584, 3584, 3584, 64]
    - [8, 4705.0]
  - - [4288, 64, 1, 256, 4288, 4288, 4288, 64]
    - [34, 4435.0]
  - - [5056, 64, 1, 256, 5056, 5056, 5056, 64]
    - [34, 5152.0]
  - - [5888, 64, 1, 256, 5888, 5888, 5888, 64]
    - [10, 5506.0]
  - - [6784, 64, 1, 256, 6784, 6784, 6784, 64]
    - [9, 5513.0]
  - - [256, 128, 1, 256, 256, 256, 256, 128]
    - [24, 1059.0]
  - - [448, 128, 1, 256, 448, 448, 448, 128]
    - [25, 1817.0]
  - - [704, 128, 1, 256, 704, 704, 704, 128]
    - [14, 2621.0]
  - - [1024, 128, 1, 256, 1024, 1024, 1024, 128]
    - [14, 3616.0]
  - - [1408, 128, 1, 256, 1408, 1408, 1408, 128]
    - [15, 4241.0]
  - - [1856, 128, 1, 256, 1856, 1856, 1856, 128]
    - [19, 4781.0]
  - - [2368, 128, 1, 256, 2368, 2368, 2368, 128]
    - [12, 4686.0]
  - - [2944, 128, 1, 256, 2944, 2944, 2944, 128]
    - [6, 5583.0]
  - - [3584, 128, 1, 256, 3584, 3584, 3584, 128]
    - [12, 5896.0]
  - - [4288, 128, 1, 256, 4288, 4288, 4288, 128]
    - [2, 5647.0]
  - - [5056, 128, 1, 256, 5056, 5056, 5056, 128]
    - [0, 6512.0]
  - - [5888, 128, 1, 256, 5888, 5888, 5888, 128]
    - [11, 6832.0]
  - - [6784, 128, 1, 256, 6784, 6784, 6784, 128]
    - [0, 6569.0]
  - - [256, 64, 1, 1280, 256, 256, 256, 64]
    - [26, 694.0]
  - - [448, 64, 1, 1280, 448, 448, 448, 64]
    - [24, 1217.0]
  - - [704, 64, 1, 1280, 704, 704, 704, 64]
    - [18, 1830.0]
  - - [1024, 64, 1, 1280, 1024, 1024, 1024, 64]
    - [28, 2724.0]
  - - [1408, 64, 1, 1280, 1408, 1408, 1408, 64]
    - [27, 3508.0]
  - - [1856, 64, 1, 1280, 1856, 1856, 1856, 64]
    - [36, 4514.0]
  - - [2368, 64, 1, 1280, 2368, 2368, 2368, 64]
    - [21, 4821.0]
  - - [2944, 64, 1, 1280, 2944, 2944, 2944, 64]
    - [36, 5900.0]
  - - [3584, 64, 1, 1280, 3584, 3584, 3584, 64]
    - [21, 5919.0]
  - - [4288, 64, 1, 1280, 4288, 4288, 4288, 64]
    - [35, 5448.0]
  - - [5056, 64, 1, 1280, 5056, 5056, 5056, 64]
    - [35, 6416.0]
  - - [5888, 64, 1, 1280, 5888, 5888, 5888, 64]
    - [10, 6891.0]
  - - [6784, 64, 1, 1280, 6784, 6784, 6784, 64]
    - [10, 6673.0]
  - - [256, 128, 1, 1280, 256, 256, 256, 128]
    - [24, 1391.0]
  - - [448, 128, 1, 1280, 448, 448, 448, 128]
    - [25, 2402.0]
  - - [704, 128, 1, 1280, 704, 704, 704, 128]
    - [27, 3491.0]
  - - [1024, 128, 1, 1280, 1024, 1024, 1024, 128]
    - [28, 4832.0]
  - - [1408, 128, 1, 1280, 1408, 1408, 1408, 128]
    - [22, 5380.0]
  - - [1856, 128, 1, 1280, 1856, 1856, 1856, 128]
    - [19, 5866.0]
  - - [2368, 128, 1, 1280, 2368, 2368, 2368, 128]
    - [10, 5780.0]
  - - [2944, 128, 1, 1280, 2944, 2944, 2944, 128]
    - [10, 6891.0]
  - - [3584, 128, 1, 1280, 3584, 3584, 3584, 128]
    - [12, 7037.0]
  - - [4288, 128, 1, 1280, 4288, 4288, 4288, 128]
    - [10, 6539.0]
  - - [5056, 128, 1, 1280, 5056, 5056, 5056, 128]
    - [2, 7498.0]
  - - [5888, 128, 1, 1280, 5888, 5888, 5888, 128]
    - [7, 7892.0]
  - - [6784, 128, 1, 1280, 6784, 6784, 6784, 128]
    - [0, 7320.0]
  - - [256, 64, 1, 3328, 256, 256, 256, 64]
    - [26, 728.0]
  - - [448, 64, 1, 3328, 448, 448, 448, 64]
    - [27, 1276.0]
  - - [704, 64, 1, 3328, 704, 704, 704, 64]
    - [26, 1932.0]
  - - [1024, 64, 1, 3328, 1024, 1024, 1024, 64]
    - [36, 2903.0]
  - - [1408, 64, 1, 3328, 1408, 1408, 1408, 64]
    - [24, 3697.0]
  - - [1856, 64, 1, 3328, 1856, 1856, 1856, 64]
    - [36, 4779.0]
  - - [2368, 64, 1, 3328, 2368, 2368, 2368, 64]
    - [14, 5032.0]
  - - [2944, 64, 1, 3328, 2944, 2944, 2944, 64]
    - [36, 6191.0]
  - - [3584, 64, 1, 3328, 3584, 3584, 3584, 64]
    - [21, 6140.0]
  - - [4288, 64, 1, 3328, 4288, 4288, 4288, 64]
    - [35, 5652.0]
  - - [5056, 64, 1, 3328, 5056, 5056, 5056, 64]
    - [35, 6641.0]
  - - [5888, 64, 1, 3328, 5888, 5888, 5888, 64]
    - [10, 7178.0]
  - - [6784, 64, 1, 3328, 6784, 6784, 6784, 64]
    - [10, 6894.0]
  - - [256, 128, 1, 3328, 256, 256, 256, 128]
    - [24, 1456.0]
  - - [448, 128, 1, 3328, 448, 448, 448, 128]
    - [26, 2449.0]
  - - [704, 128, 1, 3328, 704, 704, 704, 128]
    - [24, 3690.0]
  - - [1024, 128, 1, 3328, 1024, 1024, 1024, 128]
    - [28, 5168.0]
  - - [1408, 128, 1, 3328, 1408, 1408, 1408, 128]
    - [22, 5620.0]
  - - [1856, 128, 1, 3328, 1856, 1856, 1856, 128]
    - [19, 6082.0]
  - - [2368, 128, 1, 3328, 2368, 2368, 2368, 128]
    - [9, 5962.0]
  - - [2944, 128, 1, 3328, 2944, 2944, 2944, 128]
    - [10, 7135.0]
  - - [3584, 128, 1, 3328, 3584, 3584, 3584, 128]
    - [12, 7180.0]
  - - [4288, 128, 1, 3328, 4288, 4288, 4288, 128]
    - [10, 6696.0]
  - - [5056, 128, 1, 3328, 5056, 5056, 5056, 128]
    - [2, 7699.0]
  - - [5888, 128, 1, 3328, 5888, 5888, 5888, 128]
    - [33, 8085.0]
  - - [6784, 128, 1, 3328, 6784, 6784, 6784, 128]
    - [0, 7440.0]
  - - [256, 256, 1, 256, 256, 256, 256, 256]
    - [25, 2056.0]
  - - [448, 256, 1, 256, 448, 448, 448, 256]
    - [14, 3219.0]
  - - [256, 448, 1, 256, 256, 256, 256, 448]
    - [25, 3277.0]
  - - [448, 448, 1, 256, 448, 448, 448, 448]
    - [14, 4170.0]
  - - [256, 256, 1, 1280, 256, 256, 256, 256]
    - [25, 2724.0]
  - - [448, 256, 1, 1280, 448, 448, 448, 256]
    - [25, 4277.0]
  - - [256, 448, 1, 1280, 256, 256, 256, 448]
    - [28, 4277.0]
  - - [448, 448, 1, 1280, 448, 448, 448, 448]
    - [21, 5222.0]
  - - [256, 256, 1, 3328, 256, 256, 256, 256]
    - [25, 2885.0]
  - - [448, 256, 1, 3328, 448, 448, 448, 256]
    - [28, 4557.0]
  - - [256, 448, 1, 3328, 256, 256, 256, 448]
    - [25, 4553.0]
  - - [448, 448, 1, 3328, 448, 448, 448, 448]
    - [14, 5408.0]
  - - [512, 16, 1, 512, 512, 512, 512, 16]
    - [8, 245.0]
  - - [512, 32, 1, 512, 512, 512, 512, 32]
    - [23, 620.0]
  - - [1024, 16, 1, 512, 1024, 1024, 1024, 16]
    - [23, 620.0]
  - - [1024, 32, 1, 512, 1024, 1024, 1024, 32]
    - [24, 1234.0]
  - - [704, 256, 1, 256, 704, 704, 704, 256]
    - [20, 3068.0]
  - - [1024, 256, 1, 256, 1024, 1024, 1024, 256]
    - [33, 4258.0]
  - - [1408, 256, 1, 256, 1408, 1408, 1408, 256]
    - [30, 4164.0]
  - - [1856, 256, 1, 256, 1856, 1856, 1856, 256]
    - [30, 5430.0]
  - - [2368, 256, 1, 256, 2368, 2368, 2368, 256]
    - [30, 5590.0]
  - - [2944, 256, 1, 256, 2944, 2944, 2944, 256]
    - [33, 6851.0]
  - - [3584, 256, 1, 256, 3584, 3584, 3584, 256]
    - [30, 6688.0]
  - - [4288, 256, 1, 256, 4288, 4288, 4288, 256]
    - [30, 6445.0]
  - - [5056, 256, 1, 256, 5056, 5056, 5056, 256]
    - [30, 7531.0]
  - - [5888, 256, 1, 256, 5888, 5888, 5888, 256]
    - [30, 7560.0]
  - - [6784, 256, 1, 256, 6784, 6784, 6784, 256]
    - [30, 7655.0]
  - - [704, 448, 1, 256, 704, 704, 704, 448]
    - [30, 3683.0]
  - - [1024, 448, 1, 256, 1024, 1024, 1024, 448]
    - [11, 5151.0]
  - - [1408, 448, 1, 256, 1408, 1408, 1408, 448]
    - [30, 5767.0]
  - - [1856, 448, 1, 256, 1856, 1856, 1856, 448]
    - [30, 6089.0]
  - - [2368, 448, 1, 256, 2368, 2368, 2368, 448]
    - [30, 6287.0]
  - - [2944, 448, 1, 256, 2944, 2944, 2944, 448]
    - [30, 6667.0]
  - - [3584, 448, 1, 256, 3584, 3584, 3584, 448]
    - [30, 7077.0]
  - - [4288, 448, 1, 256, 4288, 4288, 4288, 448]
    - [30, 7580.0]
  - - [5056, 448, 1, 256, 5056, 5056, 5056, 448]
    - [30, 7930.0]
  - - [5888, 448, 1, 256, 5888, 5888, 5888, 448]
    - [30, 7737.0]
  - - [6784, 448, 1, 256, 6784, 6784, 6784, 448]
    - [30, 8180.0]
  - - [256, 704, 1, 256, 256, 256, 256, 704]
    - [11, 3019.0]
  - - [448, 704, 1, 256, 448, 448, 448, 704]
    - [30, 3657.0]
  - - [704, 704, 1, 256, 704, 704, 704, 704]
    - [30, 5664.0]
  - - [1024, 704, 1, 256, 1024, 1024, 1024, 704]
    - [3, 6426.0]
  - - [1408, 704, 1, 256, 1408, 1408, 1408, 704]
    - [30, 7275.0]
  - - [1856, 704, 1, 256, 1856, 1856, 1856, 704]
    - [30, 7602.0]
  - - [2368, 704, 1, 256, 2368, 2368, 2368, 704]
    - [30, 7368.0]
  - - [2944, 704, 1, 256, 2944, 2944, 2944, 704]
    - [30, 8108.0]
  - - [3584, 704, 1, 256, 3584, 3584, 3584, 704]
    - [30, 8018.0]
  - - [4288, 704, 1, 256, 4288, 4288, 4288, 704]
    - [30, 8138.0]
  - - [5056, 704, 1, 256, 5056, 5056, 5056, 704]
    - [30, 8302.0]
  - - [5888, 704, 1, 256, 5888, 5888, 5888, 704]
    - [30, 8503.0]
  - - [6784, 704, 1, 256, 6784, 6784, 6784, 704]
    - [30, 8356.0]
  - - [256, 1024, 1, 256, 256, 256, 256, 1024]
    - [11, 4302.0]
  - - [448, 1024, 1, 256, 448, 448, 448, 1024]
    - [11, 5224.0]
  - - [704, 1024, 1, 256, 704, 704, 704, 1024]
    - [3, 6610.0]
  - - [1024, 1024, 1, 256, 1024, 1024, 1024, 1024]
    - [3, 7407.0]
  - - [1408, 1024, 1, 256, 1408, 1408, 1408, 1024]
    - [30, 7277.0]
  - - [1856, 1024, 1, 256, 1856, 1856, 1856, 1024]
    - [30, 7490.0]
  - - [2368, 1024, 1, 256, 2368, 2368, 2368, 1024]
    - [30, 7767.0]
  - - [2944, 1024, 1, 256, 2944, 2944, 2944, 1024]
    - [30, 8107.0]
  - - [3584, 1024, 1, 256, 3584, 3584, 3584, 1024]
    - [30, 8492.0]
  - - [4288, 1024, 1, 256, 4288, 4288, 4288, 1024]
    - [30, 8511.0]
  - - [5056, 1024, 1, 256, 5056, 5056, 5056, 1024]
    - [30, 8598.0]
  - - [5888, 1024, 1, 256, 5888, 5888, 5888, 1024]
    - [30, 8734.0]
  - - [6784, 1024, 1, 256, 6784, 6784, 6784, 1024]
    - [30, 8650.0]
  - - [256, 1408, 1, 256, 256, 256, 256, 1408]
    - [20, 4164.0]
  - - [448, 1408, 1, 256, 448, 448, 448, 1408]
    - [30, 5800.0]
  - - [704, 1408, 1, 256, 704, 704, 704, 1408]
    - [30, 7275.0]
  - - [1024, 1408, 1, 256, 1024, 1024, 1024, 1408]
    - [3, 7131.0]
  - - [1408, 1408, 1, 256, 1408, 1408, 1408, 1408]
    - [30, 7774.0]
  - - [1856, 1408, 1, 256, 1856, 1856, 1856, 1408]
    - [30, 8321.0]
  - - [2368, 1408, 1, 256, 2368, 2368, 2368, 1408]
    - [30, 8342.0]
  - - [2944, 1408, 1, 256, 2944, 2944, 2944, 1408]
    - [30, 8492.0]
  - - [3584, 1408, 1, 256, 3584, 3584, 3584, 1408]
    - [30, 8402.0]
  - - [4288, 1408, 1, 256, 4288, 4288, 4288, 1408]
    - [30, 8448.0]
  - - [5056, 1408, 1, 256, 5056, 5056, 5056, 1408]
    - [31, 8577.0]
  - - [5888, 1408, 1, 256, 5888, 5888, 5888, 1408]
    - [30, 8747.0]
  - - [6784, 1408, 1, 256, 6784, 6784, 6784, 1408]
    - [30, 8756.0]
  - - [256, 1856, 1, 256, 256, 256, 256, 1856]
    - [33, 5373.0]
  - - [448, 1856, 1, 256, 448, 448, 448, 1856]
    - [30, 6131.0]
  - - [704, 1856, 1, 256, 704, 704, 704, 1856]
    - [30, 7575.0]
  - - [1024, 1856, 1, 256, 1024, 1024, 1024, 1856]
    - [3, 7435.0]
  - - [1408, 1856, 1, 256, 1408, 1408, 1408, 1856]
    - [30, 8304.0]
  - - [1856, 1856, 1, 256, 1856, 1856, 1856, 1856]
    - [30, 8064.0]
  - - [2368, 1856, 1, 256, 2368, 2368, 2368, 1856]
    - [30, 8534.0]
  - - [2944, 1856, 1, 256, 2944, 2944, 2944, 1856]
    - [30, 8669.0]
  - - [3584, 1856, 1, 256, 3584, 3584, 3584, 1856]
    - [30, 8587.0]
  - - [4288, 1856, 1, 256, 4288, 4288, 4288, 1856]
    - [30, 8680.0]
  - - [5056, 1856, 1, 256, 5056, 5056, 5056, 1856]
    - [30, 8832.0]
  - - [5888, 1856, 1, 256, 5888, 5888, 5888, 1856]
    - [32, 8867.0]
  - - [6784, 1856, 1, 256, 6784, 6784, 6784, 1856]
    - [30, 8770.0]
  - - [256, 2368, 1, 256, 256, 256, 256, 2368]
    - [33, 5542.0]
  - - [448, 2368, 1, 256, 448, 448, 448, 2368]
    - [30, 6240.0]
  - - [704, 2368, 1, 256, 704, 704, 704, 2368]
    - [30, 7389.0]
  - - [1024, 2368, 1, 256, 1024, 1024, 1024, 2368]
    - [30, 7683.0]
  - - [1408, 2368, 1, 256, 1408, 1408, 1408, 2368]
    - [30, 8309.0]
  - - [1856, 2368, 1, 256, 1856, 1856, 1856, 2368]
    - [30, 8524.0]
  - - [2368, 2368, 1, 256, 2368, 2368, 2368, 2368]
    - [30, 8504.0]
  - - [2944, 2368, 1, 256, 2944, 2944, 2944, 2368]
    - [30, 8687.0]
  - - [3584, 2368, 1, 256, 3584, 3584, 3584, 2368]
    - [30, 8702.0]
  - - [4288, 2368, 1, 256, 4288, 4288, 4288, 2368]
    - [30, 8846.0]
  - - [5056, 2368, 1, 256, 5056, 5056, 5056, 2368]
    - [4, 8881.0]
  - - [5888, 2368, 1, 256, 5888, 5888, 5888, 2368]
    - [32, 8870.0]
  - - [6784, 2368, 1, 256, 6784, 6784, 6784, 2368]
    - [32, 8937.0]
  - - [256, 2944, 1, 256, 256, 256, 256, 2944]
    - [3, 6756.0]
  - - [448, 2944, 1, 256, 448, 448, 448, 2944]
    - [30, 6710.0]
  - - [704, 2944, 1, 256, 704, 704, 704, 2944]
    - [30, 8128.0]
  - - [1024, 2944, 1, 256, 1024, 1024, 1024, 2944]
    - [3, 8053.0]
  - - [1408, 2944, 1, 256, 1408, 1408, 1408, 2944]
    - [30, 8514.0]
  - - [1856, 2944, 1, 256, 1856, 1856, 1856, 2944]
    - [30, 8673.0]
  - - [2368, 2944, 1, 256, 2368, 2368, 2368, 2944]
    - [30, 8677.0]
  - - [2944, 2944, 1, 256, 2944, 2944, 2944, 2944]
    - [32, 8654.0]
  - - [3584, 2944, 1, 256, 3584, 3584, 3584, 2944]
    - [30, 8745.0]
  - - [4288, 2944, 1, 256, 4288, 4288, 4288, 2944]
    - [30, 8795.0]
  - - [5056, 2944, 1, 256, 5056, 5056, 5056, 2944]
    - [30, 8938.0]
  - - [5888, 2944, 1, 256, 5888, 5888, 5888, 2944]
    - [30, 8882.0]
  - - [6784, 2944, 1, 256, 6784, 6784, 6784, 2944]
    - [30, 8919.0]
  - - [256, 3584, 1, 256, 256, 256, 256, 3584]
    - [30, 6703.0]
  - - [448, 3584, 1, 256, 448, 448, 448, 3584]
    - [30, 7126.0]
  - - [704, 3584, 1, 256, 704, 704, 704, 3584]
    - [30, 8074.0]
  - - [1024, 3584, 1, 256, 1024, 1024, 1024, 3584]
    - [3, 8437.0]
  - - [1408, 3584, 1, 256, 1408, 1408, 1408, 3584]
    - [30, 8402.0]
  - - [1856, 3584, 1, 256, 1856, 1856, 1856, 3584]
    - [30, 8590.0]
  - - [2368, 3584, 1, 256, 2368, 2368, 2368, 3584]
    - [30, 8705.0]
  - - [2944, 3584, 1, 256, 2944, 2944, 2944, 3584]
    - [30, 8747.0]
  - - [3584, 3584, 1, 256, 3584, 3584, 3584, 3584]
    - [30, 8940.0]
  - - [4288, 3584, 1, 256, 4288, 4288, 4288, 3584]
    - [30, 8914.0]
  - - [5056, 3584, 1, 256, 5056, 5056, 5056, 3584]
    - [31, 8978.0]
  - - [5888, 3584, 1, 256, 5888, 5888, 5888, 3584]
    - [30, 8950.0]
  - - [6784, 3584, 1, 256, 6784, 6784, 6784, 3584]
    - [31, 9003.0]
  - - [256, 4288, 1, 256, 256, 256, 256, 4288]
    - [30, 6410.0]
  - - [448, 4288, 1, 256, 448, 448, 448, 4288]
    - [30, 7543.0]
  - - [704, 4288, 1, 256, 704, 704, 704, 4288]
    - [3, 8138.0]
  - - [1024, 4288, 1, 256, 1024, 1024, 1024, 4288]
    - [3, 8419.0]
  - - [1408, 4288, 1, 256, 1408, 1408, 1408, 4288]
    - [30, 8444.0]
  - - [1856, 4288, 1, 256, 1856, 1856, 1856, 4288]
    - [30, 8680.0]
  - - [2368, 4288, 1, 256, 2368, 2368, 2368, 4288]
    - [30, 8832.0]
  - - [2944, 4288, 1, 256, 2944, 2944, 2944, 4288]
    - [30, 8797.0]
  - - [3584, 4288, 1, 256, 3584, 3584, 3584, 4288]
    - [30, 8914.0]
  - - [4288, 4288, 1, 256, 4288, 4288, 4288, 4288]
    - [30, 8895.0]
  - - [5056, 4288, 1, 256, 5056, 5056, 5056, 4288]
    - [30, 8984.0]
  - - [5888, 4288, 1, 256, 5888, 5888, 5888, 4288]
    - [32, 8977.0]
  - - [6784, 4288, 1, 256, 6784, 6784, 6784, 4288]
    - [32, 9063.0]
  - - [256, 5056, 1, 256, 256, 256, 256, 5056]
    - [30, 7476.0]
  - - [448, 5056, 1, 256, 448, 448, 448, 5056]
    - [30, 7922.0]
  - - [704, 5056, 1, 256, 704, 704, 704, 5056]
    - [30, 8308.0]
  - - [1024, 5056, 1, 256, 1024, 1024, 1024, 5056]
    - [3, 8549.0]
  - - [1408, 5056, 1, 256, 1408, 1408, 1408, 5056]
    - [30, 8574.0]
  - - [1856, 5056, 1, 256, 1856, 1856, 1856, 5056]
    - [4, 8822.0]
  - - [2368, 5056, 1, 256, 2368, 2368, 2368, 5056]
    - [4, 8879.0]
  - - [2944, 5056, 1, 256, 2944, 2944, 2944, 5056]
    - [30, 8935.0]
  - - [3584, 5056, 1, 256, 3584, 3584, 3584, 5056]
    - [32, 8921.0]
  - - [4288, 5056, 1, 256, 4288, 4288, 4288, 5056]
    - [30, 8985.0]
  - - [5056, 5056, 1, 256, 5056, 5056, 5056, 5056]
    - [4, 9047.0]
  - - [5888, 5056, 1, 256, 5888, 5888, 5888, 5056]
    - [32, 9097.0]
  - - [6784, 5056, 1, 256, 6784, 6784, 6784, 5056]
    - [32, 9082.0]
  - - [256, 5888, 1, 256, 256, 256, 256, 5888]
    - [30, 7513.0]
  - - [448, 5888, 1, 256, 448, 448, 448, 5888]
    - [30, 7744.0]
  - - [704, 5888, 1, 256, 704, 704, 704, 5888]
    - [30, 8525.0]
  - - [1024, 5888, 1, 256, 1024, 1024, 1024, 5888]
    - [3, 8675.0]
  - - [1408, 5888, 1, 256, 1408, 1408, 1408, 5888]
    - [31, 8761.0]
  - - [1856, 5888, 1, 256, 1856, 1856, 1856, 5888]
    - [31, 8905.0]
  - - [2368, 5888, 1, 256, 2368, 2368, 2368, 5888]
    - [31, 8904.0]
  - - [2944, 5888, 1, 256, 2944, 2944, 2944, 5888]
    - [30, 8874.0]
  - - [3584, 5888, 1, 256, 3584, 3584, 3584, 5888]
    - [30, 8952.0]
  - - [4288, 5888, 1, 256, 4288, 4288, 4288, 5888]
    - [29, 8994.0]
  - - [5056, 5888, 1, 256, 5056, 5056, 5056, 5888]
    - [29, 9120.0]
  - - [5888, 5888, 1, 256, 5888, 5888, 5888, 5888]
    - [32, 9050.0]
  - - [6784, 5888, 1, 256, 6784, 6784, 6784, 5888]
    - [31, 9081.0]
  - - [256, 6784, 1, 256, 256, 256, 256, 6784]
    - [3, 7592.0]
  - - [448, 6784, 1, 256, 448, 448, 448, 6784]
    - [30, 8214.0]
  - - [704, 6784, 1, 256, 704, 704, 704, 6784]
    - [30, 8342.0]
  - - [1024, 6784, 1, 256, 1024, 1024, 1024, 6784]
    - [3, 8583.0]
  - - [1408, 6784, 1, 256, 1408, 1408, 1408, 6784]
    - [30, 8766.0]
  - - [1856, 6784, 1, 256, 1856, 1856, 1856, 6784]
    - [30, 8774.0]
  - - [2368, 6784, 1, 256, 2368, 2368, 2368, 6784]
    - [29, 8964.0]
  - - [2944, 6784, 1, 256, 2944, 2944, 2944, 6784]
    - [30, 8907.0]
  - - [3584, 6784, 1, 256, 3584, 3584, 3584, 6784]
    - [30, 9003.0]
  - - [4288, 6784, 1, 256, 4288, 4288, 4288, 6784]
    - [31, 9069.0]
  - - [5056, 6784, 1, 256, 5056, 5056, 5056, 6784]
    - [29, 9093.0]
  - - [5888, 6784, 1, 256, 5888, 5888, 5888, 6784]
    - [32, 9072.0]
  - - [6784, 6784, 1, 256, 6784, 6784, 6784, 6784]
    - [29, 9158.0]
  - - [704, 256, 1, 1280, 704, 704, 704, 256]
    - [20, 3614.0]
  - - [1024, 256, 1, 1280, 1024, 1024, 1024, 256]
    - [33, 5159.0]
  - - [1408, 256, 1, 1280, 1408, 1408, 1408, 256]
    - [11, 4933.0]
  - - [1856, 256, 1, 1280, 1856, 1856, 1856, 256]
    - [11, 6453.0]
  - - [2368, 256, 1, 1280, 2368, 2368, 2368, 256]
    - [33, 6394.0]
  - - [2944, 256, 1, 1280, 2944, 2944, 2944, 256]
    - [33, 7892.0]
  - - [3584, 256, 1, 1280, 3584, 3584, 3584, 256]
    - [33, 7513.0]
  - - [4288, 256, 1, 1280, 4288, 4288, 4288, 256]
    - [30, 7020.0]
  - - [5056, 256, 1, 1280, 5056, 5056, 5056, 256]
    - [30, 8257.0]
  - - [5888, 256, 1, 1280, 5888, 5888, 5888, 256]
    - [30, 8248.0]
  - - [6784, 256, 1, 1280, 6784, 6784, 6784, 256]
    - [33, 8277.0]
  - - [704, 448, 1, 1280, 704, 704, 704, 448]
    - [20, 4324.0]
  - - [1024, 448, 1, 1280, 1024, 1024, 1024, 448]
    - [11, 6231.0]
  - - [1408, 448, 1, 1280, 1408, 1408, 1408, 448]
    - [33, 6644.0]
  - - [1856, 448, 1, 1280, 1856, 1856, 1856, 448]
    - [33, 6840.0]
  - - [2368, 448, 1, 1280, 2368, 2368, 2368, 448]
    - [30, 6792.0]
  - - [2944, 448, 1, 1280, 2944, 2944, 2944, 448]
    - [33, 7252.0]
  - - [3584, 448, 1, 1280, 3584, 3584, 3584, 448]
    - [33, 7657.0]
  - - [4288, 448, 1, 1280, 4288, 4288, 4288, 448]
    - [33, 8142.0]
  - - [5056, 448, 1, 1280, 5056, 5056, 5056, 448]
    - [30, 8470.0]
  - - [5888, 448, 1, 1280, 5888, 5888, 5888, 448]
    - [30, 8190.0]
  - - [6784, 448, 1, 1280, 6784, 6784, 6784, 448]
    - [33, 8705.0]
  - - [256, 704, 1, 1280, 256, 256, 256, 704]
    - [20, 3604.0]
  - - [448, 704, 1, 1280, 448, 448, 448, 704]
    - [11, 4335.0]
  - - [704, 704, 1, 1280, 704, 704, 704, 704]
    - [33, 6749.0]
  - - [1024, 704, 1, 1280, 1024, 1024, 1024, 704]
    - [33, 7544.0]
  - - [1408, 704, 1, 1280, 1408, 1408, 1408, 704]
    - [33, 8121.0]
  - - [1856, 704, 1, 1280, 1856, 1856, 1856, 704]
    - [30, 8306.0]
  - - [2368, 704, 1, 1280, 2368, 2368, 2368, 704]
    - [33, 7967.0]
  - - [2944, 704, 1, 1280, 2944, 2944, 2944, 704]
    - [33, 8764.0]
  - - [3584, 704, 1, 1280, 3584, 3584, 3584, 704]
    - [33, 8588.0]
  - - [4288, 704, 1, 1280, 4288, 4288, 4288, 704]
    - [33, 8653.0]
  - - [5056, 704, 1, 1280, 5056, 5056, 5056, 704]
    - [33, 8774.0]
  - - [5888, 704, 1, 1280, 5888, 5888, 5888, 704]
    - [33, 8970.0]
  - - [6784, 704, 1, 1280, 6784, 6784, 6784, 704]
    - [30, 8744.0]
  - - [256, 1024, 1, 1280, 256, 256, 256, 1024]
    - [33, 5165.0]
  - - [448, 1024, 1, 1280, 448, 448, 448, 1024]
    - [11, 6220.0]
  - - [704, 1024, 1, 1280, 704, 704, 704, 1024]
    - [33, 7568.0]
  - - [1024, 1024, 1, 1280, 1024, 1024, 1024, 1024]
    - [11, 8486.0]
  - - [1408, 1024, 1, 1280, 1408, 1408, 1408, 1024]
    - [33, 7906.0]
  - - [1856, 1024, 1, 1280, 1856, 1856, 1856, 1024]
    - [33, 8053.0]
  - - [2368, 1024, 1, 1280, 2368, 2368, 2368, 1024]
    - [33, 8265.0]
  - - [2944, 1024, 1, 1280, 2944, 2944, 2944, 1024]
    - [33, 8636.0]
  - - [3584, 1024, 1, 1280, 3584, 3584, 3584, 1024]
    - [30, 9019.0]
  - - [4288, 1024, 1, 1280, 4288, 4288, 4288, 1024]
    - [30, 8950.0]
  - - [5056, 1024, 1, 1280, 5056, 5056, 5056, 1024]
    - [33, 9017.0]
  - - [5888, 1024, 1, 1280, 5888, 5888, 5888, 1024]
    - [30, 9151.0]
  - - [6784, 1024, 1, 1280, 6784, 6784, 6784, 1024]
    - [30, 9023.0]
  - - [256, 1408, 1, 1280, 256, 256, 256, 1408]
    - [20, 4925.0]
  - - [448, 1408, 1, 1280, 448, 448, 448, 1408]
    - [33, 6644.0]
  - - [704, 1408, 1, 1280, 704, 704, 704, 1408]
    - [33, 8117.0]
  - - [1024, 1408, 1, 1280, 1024, 1024, 1024, 1408]
    - [3, 7868.0]
  - - [1408, 1408, 1, 1280, 1408, 1408, 1408, 1408]
    - [33, 8394.0]
  - - [1856, 1408, 1, 1280, 1856, 1856, 1856, 1408]
    - [33, 8887.0]
  - - [2368, 1408, 1, 1280, 2368, 2368, 2368, 1408]
    - [33, 8807.0]
  - - [2944, 1408, 1, 1280, 2944, 2944, 2944, 1408]
    - [33, 8972.0]
  - - [3584, 1408, 1, 1280, 3584, 3584, 3584, 1408]
    - [33, 8792.0]
  - - [4288, 1408, 1, 1280, 4288, 4288, 4288, 1408]
    - [33, 8815.0]
  - - [5056, 1408, 1, 1280, 5056, 5056, 5056, 1408]
    - [33, 8920.0]
  - - [5888, 1408, 1, 1280, 5888, 5888, 5888, 1408]
    - [30, 9107.0]
  - - [6784, 1408, 1, 1280, 6784, 6784, 6784, 1408]
    - [30, 9094.0]
  - - [256, 1856, 1, 1280, 256, 256, 256, 1856]
    - [33, 6464.0]
  - - [448, 1856, 1, 1280, 448, 448, 448, 1856]
    - [33, 6847.0]
  - - [704, 1856, 1, 1280, 704, 704, 704, 1856]
    - [30, 8332.0]
  - - [1024, 1856, 1, 1280, 1024, 1024, 1024, 1856]
    - [33, 8028.0]
  - - [1408, 1856, 1, 1280, 1408, 1408, 1408, 1856]
    - [30, 8870.0]
  - - [1856, 1856, 1, 1280, 1856, 1856, 1856, 1856]
    - [33, 8499.0]
  - - [2368, 1856, 1, 1280, 2368, 2368, 2368, 1856]
    - [30, 8964.0]
  - - [2944, 1856, 1, 1280, 2944, 2944, 2944, 1856]
    - [30, 9071.0]
  - - [3584, 1856, 1, 1280, 3584, 3584, 3584, 1856]
    - [30, 8961.0]
  - - [4288, 1856, 1, 1280, 4288, 4288, 4288, 1856]
    - [30, 9021.0]
  - - [5056, 1856, 1, 1280, 5056, 5056, 5056, 1856]
    - [30, 9181.0]
  - - [5888, 1856, 1, 1280, 5888, 5888, 5888, 1856]
    - [30, 9179.0]
  - - [6784, 1856, 1, 1280, 6784, 6784, 6784, 1856]
    - [30, 9084.0]
  - - [256, 2368, 1, 1280, 256, 256, 256, 2368]
    - [33, 6394.0]
  - - [448, 2368, 1, 1280, 448, 448, 448, 2368]
    - [30, 6814.0]
  - - [704, 2368, 1, 1280, 704, 704, 704, 2368]
    - [33, 7960.0]
  - - [1024, 2368, 1, 1280, 1024, 1024, 1024, 2368]
    - [33, 8249.0]
  - - [1408, 2368, 1, 1280, 1408, 1408, 1408, 2368]
    - [30, 8797.0]
  - - [1856, 2368, 1, 1280, 1856, 1856, 1856, 2368]
    - [30, 8963.0]
  - - [2368, 2368, 1, 1280, 2368, 2368, 2368, 2368]
    - [30, 8900.0]
  - - [2944, 2368, 1, 1280, 2944, 2944, 2944, 2368]
    - [30, 9050.0]
  - - [3584, 2368, 1, 1280, 3584, 3584, 3584, 2368]
    - [30, 9044.0]
  - - [4288, 2368, 1, 1280, 4288, 4288, 4288, 2368]
    - [30, 9174.0]
  - - [5056, 2368, 1, 1280, 5056, 5056, 5056, 2368]
    - [30, 9192.0]
  - - [5888, 2368, 1, 1280, 5888, 5888, 5888, 2368]
    - [30, 9140.0]
  - - [6784, 2368, 1, 1280, 6784, 6784, 6784, 2368]
    - [30, 9177.0]
  - - [256, 2944, 1, 1280, 256, 256, 256, 2944]
    - [33, 7876.0]
  - - [448, 2944, 1, 1280, 448, 448, 448, 2944]
    - [33, 7249.0]
  - - [704, 2944, 1, 1280, 704, 704, 704, 2944]
    - [33, 8759.0]
  - - [1024, 2944, 1, 1280, 1024, 1024, 1024, 2944]
    - [30, 8589.0]
  - - [1408, 2944, 1, 1280, 1408, 1408, 1408, 2944]
    - [33, 8976.0]
  - - [1856, 2944, 1, 1280, 1856, 1856, 1856, 2944]
    - [30, 9069.0]
  - - [2368, 2944, 1, 1280, 2368, 2368, 2368, 2944]
    - [30, 9047.0]
  - - [2944, 2944, 1, 1280, 2944, 2944, 2944, 2944]
    - [30, 8972.0]
  - - [3584, 2944, 1, 1280, 3584, 3584, 3584, 2944]
    - [30, 9076.0]
  - - [4288, 2944, 1, 1280, 4288, 4288, 4288, 2944]
    - [30, 9110.0]
  - - [5056, 2944, 1, 1280, 5056, 5056, 5056, 2944]
    - [30, 9242.0]
  - - [5888, 2944, 1, 1280, 5888, 5888, 5888, 2944]
    - [30, 9170.0]
  - - [6784, 2944, 1, 1280, 6784, 6784, 6784, 2944]
    - [30, 9200.0]
  - - [256, 3584, 1, 1280, 256, 256, 256, 3584]
    - [33, 7505.0]
  - - [448, 3584, 1, 1280, 448, 448, 448, 3584]
    - [33, 7662.0]
  - - [704, 3584, 1, 1280, 704, 704, 704, 3584]
    - [33, 8562.0]
  - - [1024, 3584, 1, 1280, 1024, 1024, 1024, 3584]
    - [3, 8984.0]
  - - [1408, 3584, 1, 1280, 1408, 1408, 1408, 3584]
    - [30, 8790.0]
  - - [1856, 3584, 1, 1280, 1856, 1856, 1856, 3584]
    - [30, 8959.0]
  - - [2368, 3584, 1, 1280, 2368, 2368, 2368, 3584]
    - [30, 9044.0]
  - - [2944, 3584, 1, 1280, 2944, 2944, 2944, 3584]
    - [30, 9080.0]
  - - [3584, 3584, 1, 1280, 3584, 3584, 3584, 3584]
    - [30, 9258.0]
  - - [4288, 3584, 1, 1280, 4288, 4288, 4288, 3584]
    - [30, 9218.0]
  - - [5056, 3584, 1, 1280, 5056, 5056, 5056, 3584]
    - [31, 9179.0]
  - - [5888, 3584, 1, 1280, 5888, 5888, 5888, 3584]
    - [30, 9253.0]
  - - [6784, 3584, 1, 1280, 6784, 6784, 6784, 3584]
    - [33, 9301.0]
  - - [256, 4288, 1, 1280, 256, 256, 256, 4288]
    - [30, 7014.0]
  - - [448, 4288, 1, 1280, 448, 448, 448, 4288]
    - [33, 8127.0]
  - - [704, 4288, 1, 1280, 704, 704, 704, 4288]
    - [33, 8636.0]
  - - [1024, 4288, 1, 1280, 1024, 1024, 1024, 4288]
    - [30, 8933.0]
  - - [1408, 4288, 1, 1280, 1408, 1408, 1408, 4288]
    - [33, 8804.0]
  - - [1856, 4288, 1, 1280, 1856, 1856, 1856, 4288]
    - [30, 9019.0]
  - - [2368, 4288, 1, 1280, 2368, 2368, 2368, 4288]
    - [30, 9177.0]
  - - [2944, 4288, 1, 1280, 2944, 2944, 2944, 4288]
    - [30, 9108.0]
  - - [3584, 4288, 1, 1280, 3584, 3584, 3584, 4288]
    - [30, 9217.0]
  - - [4288, 4288, 1, 1280, 4288, 4288, 4288, 4288]
    - [30, 9182.0]
  - - [5056, 4288, 1, 1280, 5056, 5056, 5056, 4288]
    - [30, 9268.0]
  - - [5888, 4288, 1, 1280, 5888, 5888, 5888, 4288]
    - [30, 9262.0]
  - - [6784, 4288, 1, 1280, 6784, 6784, 6784, 4288]
    - [30, 9331.0]
  - - [256, 5056, 1, 1280, 256, 256, 256, 5056]
    - [30, 8234.0]
  - - [448, 5056, 1, 1280, 448, 448, 448, 5056]
    - [33, 8474.0]
  - - [704, 5056, 1, 1280, 704, 704, 704, 5056]
    - [30, 8762.0]
  - - [1024, 5056, 1, 1280, 1024, 1024, 1024, 5056]
    - [30, 9004.0]
  - - [1408, 5056, 1, 1280, 1408, 1408, 1408, 5056]
    - [33, 8924.0]
  - - [1856, 5056, 1, 1280, 1856, 1856, 1856, 5056]
    - [30, 9176.0]
  - - [2368, 5056, 1, 1280, 2368, 2368, 2368, 5056]
    - [30, 9190.0]
  - - [2944, 5056, 1, 1280, 2944, 2944, 2944, 5056]
    - [30, 9252.0]
  - - [3584, 5056, 1, 1280, 3584, 3584, 3584, 5056]
    - [32, 9224.0]
  - - [4288, 5056, 1, 1280, 4288, 4288, 4288, 5056]
    - [30, 9292.0]
  - - [5056, 5056, 1, 1280, 5056, 5056, 5056, 5056]
    - [30, 9288.0]
  - - [5888, 5056, 1, 1280, 5888, 5888, 5888, 5056]
    - [32, 9344.0]
  - - [6784, 5056, 1, 1280, 6784, 6784, 6784, 5056]
    - [33, 9333.0]
  - - [256, 5888, 1, 1280, 256, 256, 256, 5888]
    - [33, 8254.0]
  - - [448, 5888, 1, 1280, 448, 448, 448, 5888]
    - [33, 8195.0]
  - - [704, 5888, 1, 1280, 704, 704, 704, 5888]
    - [30, 8982.0]
  - - [1024, 5888, 1, 1280, 1024, 1024, 1024, 5888]
    - [30, 9135.0]
  - - [1408, 5888, 1, 1280, 1408, 1408, 1408, 5888]
    - [30, 9106.0]
  - - [1856, 5888, 1, 1280, 1856, 1856, 1856, 5888]
    - [30, 9179.0]
  - - [2368, 5888, 1, 1280, 2368, 2368, 2368, 5888]
    - [30, 9157.0]
  - - [2944, 5888, 1, 1280, 2944, 2944, 2944, 5888]
    - [30, 9169.0]
  - - [3584, 5888, 1, 1280, 3584, 3584, 3584, 5888]
    - [30, 9263.0]
  - - [4288, 5888, 1, 1280, 4288, 4288, 4288, 5888]
    - [30, 9275.0]
  - - [5056, 5888, 1, 1280, 5056, 5056, 5056, 5888]
    - [31, 9346.0]
  - - [5888, 5888, 1, 1280, 5888, 5888, 5888, 5888]
    - [30, 9296.0]
  - - [6784, 5888, 1, 1280, 6784, 6784, 6784, 5888]
    - [31, 9317.0]
  - - [256, 6784, 1, 1280, 256, 256, 256, 6784]
    - [33, 8282.0]
  - - [448, 6784, 1, 1280, 448, 448, 448, 6784]
    - [33, 8710.0]
  - - [704, 6784, 1, 1280, 704, 704, 704, 6784]
    - [33, 8744.0]
  - - [1024, 6784, 1, 1280, 1024, 1024, 1024, 6784]
    - [30, 9005.0]
  - - [1408, 6784, 1, 1280, 1408, 1408, 1408, 6784]
    - [30, 9113.0]
  - - [1856, 6784, 1, 1280, 1856, 1856, 1856, 6784]
    - [30, 9085.0]
  - - [2368, 6784, 1, 1280, 2368, 2368, 2368, 6784]
    - [31, 9225.0]
  - - [2944, 6784, 1, 1280, 2944, 2944, 2944, 6784]
    - [30, 9225.0]
  - - [3584, 6784, 1, 1280, 3584, 3584, 3584, 6784]
    - [30, 9307.0]
  - - [4288, 6784, 1, 1280, 4288, 4288, 4288, 6784]
    - [33, 9331.0]
  - - [5056, 6784, 1, 1280, 5056, 5056, 5056, 6784]
    - [30, 9336.0]
  - - [5888, 6784, 1, 1280, 5888, 5888, 5888, 6784]
    - [30, 9312.0]
  - - [6784, 6784, 1, 1280, 6784, 6784, 6784, 6784]
    - [31, 9393.0]
  - - [704, 256, 1, 3328, 704, 704, 704, 256]
    - [20, 3697.0]
  - - [1024, 256, 1, 3328, 1024, 1024, 1024, 256]
    - [33, 5377.0]
  - - [1408, 256, 1, 3328, 1408, 1408, 1408, 256]
    - [20, 5102.0]
  - - [1856, 256, 1, 3328, 1856, 1856, 1856, 256]
    - [33, 6671.0]
  - - [2368, 256, 1, 3328, 2368, 2368, 2368, 256]
    - [33, 6548.0]
  - - [2944, 256, 1, 3328, 2944, 2944, 2944, 256]
    - [33, 8103.0]
  - - [3584, 256, 1, 3328, 3584, 3584, 3584, 256]
    - [33, 7677.0]
  - - [4288, 256, 1, 3328, 4288, 4288, 4288, 256]
    - [30, 7126.0]
  - - [5056, 256, 1, 3328, 5056, 5056, 5056, 256]
    - [30, 8374.0]
  - - [5888, 256, 1, 3328, 5888, 5888, 5888, 256]
    - [33, 8392.0]
  - - [6784, 256, 1, 3328, 6784, 6784, 6784, 256]
    - [33, 8387.0]
  - - [704, 448, 1, 3328, 704, 704, 704, 448]
    - [20, 4472.0]
  - - [1024, 448, 1, 3328, 1024, 1024, 1024, 448]
    - [20, 6432.0]
  - - [1408, 448, 1, 3328, 1408, 1408, 1408, 448]
    - [33, 6802.0]
  - - [1856, 448, 1, 3328, 1856, 1856, 1856, 448]
    - [33, 6949.0]
  - - [2368, 448, 1, 3328, 2368, 2368, 2368, 448]
    - [30, 6901.0]
  - - [2944, 448, 1, 3328, 2944, 2944, 2944, 448]
    - [33, 7365.0]
  - - [3584, 448, 1, 3328, 3584, 3584, 3584, 448]
    - [33, 7753.0]
  - - [4288, 448, 1, 3328, 4288, 4288, 4288, 448]
    - [33, 8239.0]
  - - [5056, 448, 1, 3328, 5056, 5056, 5056, 448]
    - [33, 8575.0]
  - - [5888, 448, 1, 3328, 5888, 5888, 5888, 448]
    - [33, 8271.0]
  - - [6784, 448, 1, 3328, 6784, 6784, 6784, 448]
    - [33, 8789.0]
  - - [256, 704, 1, 3328, 256, 256, 256, 704]
    - [20, 3695.0]
  - - [448, 704, 1, 3328, 448, 448, 448, 704]
    - [20, 4472.0]
  - - [704, 704, 1, 3328, 704, 704, 704, 704]
    - [33, 6956.0]
  - - [1024, 704, 1, 3328, 1024, 1024, 1024, 704]
    - [33, 7739.0]
  - - [1408, 704, 1, 3328, 1408, 1408, 1408, 704]
    - [33, 8280.0]
  - - [1856, 704, 1, 3328, 1856, 1856, 1856, 704]
    - [30, 8456.0]
  - - [2368, 704, 1, 3328, 2368, 2368, 2368, 704]
    - [33, 8071.0]
  - - [2944, 704, 1, 3328, 2944, 2944, 2944, 704]
    - [33, 8866.0]
  - - [3584, 704, 1, 3328, 3584, 3584, 3584, 704]
    - [33, 8682.0]
  - - [4288, 704, 1, 3328, 4288, 4288, 4288, 704]
    - [33, 8720.0]
  - - [5056, 704, 1, 3328, 5056, 5056, 5056, 704]
    - [33, 8851.0]
  - - [5888, 704, 1, 3328, 5888, 5888, 5888, 704]
    - [33, 9055.0]
  - - [6784, 704, 1, 3328, 6784, 6784, 6784, 704]
    - [30, 8810.0]
  - - [256, 1024, 1, 3328, 256, 256, 256, 1024]
    - [33, 5356.0]
  - - [448, 1024, 1, 3328, 448, 448, 448, 1024]
    - [33, 6443.0]
  - - [704, 1024, 1, 3328, 704, 704, 704, 1024]
    - [33, 7749.0]
  - - [1024, 1024, 1, 3328, 1024, 1024, 1024, 1024]
    - [33, 8708.0]
  - - [1408, 1024, 1, 3328, 1408, 1408, 1408, 1024]
    - [33, 8023.0]
  - - [1856, 1024, 1, 3328, 1856, 1856, 1856, 1024]
    - [33, 8148.0]
  - - [2368, 1024, 1, 3328, 2368, 2368, 2368, 1024]
    - [33, 8344.0]
  - - [2944, 1024, 1, 3328, 2944, 2944, 2944, 1024]
    - [33, 8701.0]
  - - [3584, 1024, 1, 3328, 3584, 3584, 3584, 1024]
    - [33, 9102.0]
  - - [4288, 1024, 1, 3328, 4288, 4288, 4288, 1024]
    - [30, 9017.0]
  - - [5056, 1024, 1, 3328, 5056, 5056, 5056, 1024]
    - [33, 9082.0]
  - - [5888, 1024, 1, 3328, 5888, 5888, 5888, 1024]
    - [33, 9229.0]
  - - [6784, 1024, 1, 3328, 6784, 6784, 6784, 1024]
    - [30, 9071.0]
  - - [256, 1408, 1, 3328, 256, 256, 256, 1408]
    - [20, 5098.0]
  - - [448, 1408, 1, 3328, 448, 448, 448, 1408]
    - [33, 6805.0]
  - - [704, 1408, 1, 3328, 704, 704, 704, 1408]
    - [33, 8288.0]
  - - [1024, 1408, 1, 3328, 1024, 1024, 1024, 1408]
    - [33, 8025.0]
  - - [1408, 1408, 1, 3328, 1408, 1408, 1408, 1408]
    - [33, 8499.0]
  - - [1856, 1408, 1, 3328, 1856, 1856, 1856, 1408]
    - [33, 8968.0]
  - - [2368, 1408, 1, 3328, 2368, 2368, 2368, 1408]
    - [33, 8881.0]
  - - [2944, 1408, 1, 3328, 2944, 2944, 2944, 1408]
    - [33, 9047.0]
  - - [3584, 1408, 1, 3328, 3584, 3584, 3584, 1408]
    - [30, 8853.0]
  - - [4288, 1408, 1, 3328, 4288, 4288, 4288, 1408]
    - [33, 8892.0]
  - - [5056, 1408, 1, 3328, 5056, 5056, 5056, 1408]
    - [30, 8995.0]
  - - [5888, 1408, 1, 3328, 5888, 5888, 5888, 1408]
    - [33, 9162.0]
  - - [6784, 1408, 1, 3328, 6784, 6784, 6784, 1408]
    - [33, 9170.0]
  - - [256, 1856, 1, 3328, 256, 256, 256, 1856]
    - [33, 6678.0]
  - - [448, 1856, 1, 3328, 448, 448, 448, 1856]
    - [30, 6928.0]
  - - [704, 1856, 1, 3328, 704, 704, 704, 1856]
    - [30, 8460.0]
  - - [1024, 1856, 1, 3328, 1024, 1024, 1024, 1856]
    - [33, 8123.0]
  - - [1408, 1856, 1, 3328, 1408, 1408, 1408, 1856]
    - [33, 8965.0]
  - - [1856, 1856, 1, 3328, 1856, 1856, 1856, 1856]
    - [33, 8599.0]
  - - [2368, 1856, 1, 3328, 2368, 2368, 2368, 1856]
    - [33, 9026.0]
  - - [2944, 1856, 1, 3328, 2944, 2944, 2944, 1856]
    - [30, 9129.0]
  - - [3584, 1856, 1, 3328, 3584, 3584, 3584, 1856]
    - [33, 9050.0]
  - - [4288, 1856, 1, 3328, 4288, 4288, 4288, 1856]
    - [33, 9098.0]
  - - [5056, 1856, 1, 3328, 5056, 5056, 5056, 1856]
    - [33, 9254.0]
  - - [5888, 1856, 1, 3328, 5888, 5888, 5888, 1856]
    - [30, 9257.0]
  - - [6784, 1856, 1, 3328, 6784, 6784, 6784, 1856]
    - [33, 9159.0]
  - - [256, 2368, 1, 3328, 256, 256, 256, 2368]
    - [33, 6550.0]
  - - [448, 2368, 1, 3328, 448, 448, 448, 2368]
    - [30, 6893.0]
  - - [704, 2368, 1, 3328, 704, 704, 704, 2368]
    - [33, 8071.0]
  - - [1024, 2368, 1, 3328, 1024, 1024, 1024, 2368]
    - [30, 8351.0]
  - - [1408, 2368, 1, 3328, 1408, 1408, 1408, 2368]
    - [33, 8893.0]
  - - [1856, 2368, 1, 3328, 1856, 1856, 1856, 2368]
    - [30, 9055.0]
  - - [2368, 2368, 1, 3328, 2368, 2368, 2368, 2368]
    - [33, 8983.0]
  - - [2944, 2368, 1, 3328, 2944, 2944, 2944, 2368]
    - [33, 9131.0]
  - - [3584, 2368, 1, 3328, 3584, 3584, 3584, 2368]
    - [30, 9119.0]
  - - [4288, 2368, 1, 3328, 4288, 4288, 4288, 2368]
    - [30, 9257.0]
  - - [5056, 2368, 1, 3328, 5056, 5056, 5056, 2368]
    - [33, 9267.0]
  - - [5888, 2368, 1, 3328, 5888, 5888, 5888, 2368]
    - [33, 9209.0]
  - - [6784, 2368, 1, 3328, 6784, 6784, 6784, 2368]
    - [32, 9270.0]
  - - [256, 2944, 1, 3328, 256, 256, 256, 2944]
    - [33, 8095.0]
  - - [448, 2944, 1, 3328, 448, 448, 448, 2944]
    - [33, 7377.0]
  - - [704, 2944, 1, 3328, 704, 704, 704, 2944]
    - [33, 8887.0]
  - - [1024, 2944, 1, 3328, 1024, 1024, 1024, 2944]
    - [33, 8729.0]
  - - [1408, 2944, 1, 3328, 1408, 1408, 1408, 2944]
    - [33, 9080.0]
  - - [1856, 2944, 1, 3328, 1856, 1856, 1856, 2944]
    - [33, 9173.0]
  - - [2368, 2944, 1, 3328, 2368, 2368, 2368, 2944]
    - [33, 9146.0]
  - - [2944, 2944, 1, 3328, 2944, 2944, 2944, 2944]
    - [33, 9064.0]
  - - [3584, 2944, 1, 3328, 3584, 3584, 3584, 2944]
    - [30, 9152.0]
  - - [4288, 2944, 1, 3328, 4288, 4288, 4288, 2944]
    - [33, 9190.0]
  - - [5056, 2944, 1, 3328, 5056, 5056, 5056, 2944]
    - [30, 9320.0]
  - - [5888, 2944, 1, 3328, 5888, 5888, 5888, 2944]
    - [30, 9240.0]
  - - [6784, 2944, 1, 3328, 6784, 6784, 6784, 2944]
    - [33, 9269.0]
  - - [256, 3584, 1, 3328, 256, 256, 256, 3584]
    - [33, 7684.0]
  - - [448, 3584, 1, 3328, 448, 448, 448, 3584]
    - [33, 7792.0]
  - - [704, 3584, 1, 3328, 704, 704, 704, 3584]
    - [33, 8706.0]
  - - [1024, 3584, 1, 3328, 1024, 1024, 1024, 3584]
    - [33, 9122.0]
  - - [1408, 3584, 1, 3328, 1408, 1408, 1408, 3584]
    - [33, 8880.0]
  - - [1856, 3584, 1, 3328, 1856, 1856, 1856, 3584]
    - [33, 9050.0]
  - - [2368, 3584, 1, 3328, 2368, 2368, 2368, 3584]
    - [33, 9121.0]
  - - [2944, 3584, 1, 3328, 2944, 2944, 2944, 3584]
    - [33, 9152.0]
  - - [3584, 3584, 1, 3328, 3584, 3584, 3584, 3584]
    - [30, 9339.0]
  - - [4288, 3584, 1, 3328, 4288, 4288, 4288, 3584]
    - [33, 9289.0]
  - - [5056, 3584, 1, 3328, 5056, 5056, 5056, 3584]
    - [32, 9272.0]
  - - [5888, 3584, 1, 3328, 5888, 5888, 5888, 3584]
    - [30, 9312.0]
  - - [6784, 3584, 1, 3328, 6784, 6784, 6784, 3584]
    - [30, 9352.0]
  - - [256, 4288, 1, 3328, 256, 256, 256, 4288]
    - [33, 7134.0]
  - - [448, 4288, 1, 3328, 448, 448, 448, 4288]
    - [33, 8262.0]
  - - [704, 4288, 1, 3328, 704, 704, 704, 4288]
    - [33, 8745.0]
  - - [1024, 4288, 1, 3328, 1024, 1024, 1024, 4288]
    - [33, 9025.0]
  - - [1408, 4288, 1, 3328, 1408, 1408, 1408, 4288]
    - [33, 8891.0]
  - - [1856, 4288, 1, 3328, 1856, 1856, 1856, 4288]
    - [30, 9096.0]
  - - [2368, 4288, 1, 3328, 2368, 2368, 2368, 4288]
    - [30, 9249.0]
  - - [2944, 4288, 1, 3328, 2944, 2944, 2944, 4288]
    - [30, 9172.0]
  - - [3584, 4288, 1, 3328, 3584, 3584, 3584, 4288]
    - [30, 9287.0]
  - - [4288, 4288, 1, 3328, 4288, 4288, 4288, 4288]
    - [33, 9249.0]
  - - [5056, 4288, 1, 3328, 5056, 5056, 5056, 4288]
    - [30, 9330.0]
  - - [5888, 4288, 1, 3328, 5888, 5888, 5888, 4288]
    - [30, 9310.0]
  - - [6784, 4288, 1, 3328, 6784, 6784, 6784, 4288]
    - [30, 9372.0]
  - - [256, 5056, 1, 3328, 256, 256, 256, 5056]
    - [33, 8386.0]
  - - [448, 5056, 1, 3328, 448, 448, 448, 5056]
    - [33, 8591.0]
  - - [704, 5056, 1, 3328, 704, 704, 704, 5056]
    - [33, 8869.0]
  - - [1024, 5056, 1, 3328, 1024, 1024, 1024, 5056]
    - [30, 9090.0]
  - - [1408, 5056, 1, 3328, 1408, 1408, 1408, 5056]
    - [30, 8998.0]
  - - [1856, 5056, 1, 3328, 1856, 1856, 1856, 5056]
    - [33, 9250.0]
  - - [2368, 5056, 1, 3328, 2368, 2368, 2368, 5056]
    - [30, 9257.0]
  - - [2944, 5056, 1, 3328, 2944, 2944, 2944, 5056]
    - [30, 9311.0]
  - - [3584, 5056, 1, 3328, 3584, 3584, 3584, 5056]
    - [32, 9259.0]
  - - [4288, 5056, 1, 3328, 4288, 4288, 4288, 5056]
    - [30, 9328.0]
  - - [5056, 5056, 1, 3328, 5056, 5056, 5056, 5056]
    - [30, 9329.0]
  - - [5888, 5056, 1, 3328, 5888, 5888, 5888, 5056]
    - [32, 9368.0]
  - - [6784, 5056, 1, 3328, 6784, 6784, 6784, 5056]
    - [30, 9374.0]
  - - [256, 5888, 1, 3328, 256, 256, 256, 5888]
    - [33, 8408.0]
  - - [448, 5888, 1, 3328, 448, 448, 448, 5888]
    - [33, 8306.0]
  - - [704, 5888, 1, 3328, 704, 704, 704, 5888]
    - [33, 9072.0]
  - - [1024, 5888, 1, 3328, 1024, 1024, 1024, 5888]
    - [30, 9234.0]
  - - [1408, 5888, 1, 3328, 1408, 1408, 1408, 5888]
    - [30, 9184.0]
  - - [1856, 5888, 1, 3328, 1856, 1856, 1856, 5888]
    - [30, 9256.0]
  - - [2368, 5888, 1, 3328, 2368, 2368, 2368, 5888]
    - [30, 9208.0]
  - - [2944, 5888, 1, 3328, 2944, 2944, 2944, 5888]
    - [30, 9235.0]
  - - [3584, 5888, 1, 3328, 3584, 3584, 3584, 5888]
    - [30, 9317.0]
  - - [4288, 5888, 1, 3328, 4288, 4288, 4288, 5888]
    - [30, 9309.0]
  - - [5056, 5888, 1, 3328, 5056, 5056, 5056, 5888]
    - [31, 9372.0]
  - - [5888, 5888, 1, 3328, 5888, 5888, 5888, 5888]
    - [30, 9343.0]
  - - [6784, 5888, 1, 3328, 6784, 6784, 6784, 5888]
    - [30, 9353.0]
  - - [256, 6784, 1, 3328, 256, 256, 256, 6784]
    - [33, 8427.0]
  - - [448, 6784, 1, 3328, 448, 448, 448, 6784]
    - [33, 8804.0]
  - - [704, 6784, 1, 3328, 704, 704, 704, 6784]
    - [33, 8824.0]
  - - [1024, 6784, 1, 3328, 1024, 1024, 1024, 6784]
    - [30, 9087.0]
  - - [1408, 6784, 1, 3328, 1408, 1408, 1408, 6784]
    - [33, 9170.0]
  - - [1856, 6784, 1, 3328, 1856, 1856, 1856, 6784]
    - [33, 9147.0]
  - - [2368, 6784, 1, 3328, 2368, 2368, 2368, 6784]
    - [31, 9246.0]
  - - [2944, 6784, 1, 3328, 2944, 2944, 2944, 6784]
    - [30, 9257.0]
  - - [3584, 6784, 1, 3328, 3584, 3584, 3584, 6784]
    - [30, 9341.0]
  - - [4288, 6784, 1, 3328, 4288, 4288, 4288, 6784]
    - [30, 9368.0]
  - - [5056, 6784, 1, 3328, 5056, 5056, 5056, 6784]
    - [30, 9369.0]
  - - [5888, 6784, 1, 3328, 5888, 5888, 5888, 6784]
    - [30, 9350.0]
  - - [6784, 6784, 1, 3328, 6784, 6784, 6784, 6784]
    - [31, 9397.0]
  - - [1024, 1024, 1, 1024, 1024, 1024, 1024, 1024]
    - [33, 8452.0]
  - - [1760, 7133, 1, 1760, 1760, 1760, 1760, 7133]
    - [3, 9245.0]
  - - [2048, 7133, 1, 2048, 2048, 2048, 2048, 7133]
    - [32, 9279.0]
  - - [2560, 7133, 1, 2560, 2560, 2560, 2560, 7133]
    - [32, 9318.0]
  - - [3072, 7435, 1, 1024, 3072, 3072, 3072, 7435]
    - [32, 9249.0]
  - - [4096, 7133, 1, 4096, 4096, 4096, 4096, 7133]
    - [32, 9364.0]
  - - [7680, 5481, 1, 2560, 7680, 7680, 7680, 5481]
    - [32, 9327.0]
  - - [32, 32, 1, 32, 32, 32, 32, 32]
    - [37, 4.0]
  - - [32, 64, 1, 256, 32, 32, 32, 64]
    - [41, 19.0]
  - - [32, 128, 1, 256, 32, 32, 32, 128]
    - [41, 39.0]
  - - [32, 256, 1, 256, 32, 32, 32, 256]
    - [41, 80.0]
  - - [32, 448, 1, 256, 32, 32, 32, 448]
    - [41, 141.0]
  - - [32, 704, 1, 256, 32, 32, 32, 704]
    - [44, 223.0]
  - - [32, 1024, 1, 256, 32, 32, 32, 1024]
    - [41, 324.0]
  - - [32, 1408, 1, 256, 32, 32, 32, 1408]
    - [44, 448.0]
  - - [32, 1856, 1, 256, 32, 32, 32, 1856]
    - [44, 590.0]
  - - [32, 2368, 1, 256, 32, 32, 32, 2368]
    - [44, 728.0]
  - - [32, 2944, 1, 256, 32, 32, 32, 2944]
    - [41, 887.0]
  - - [32, 3584, 1, 256, 32, 32, 32, 3584]
    - [50, 1253.0]
  - - [32, 4288, 1, 256, 32, 32, 32, 4288]
    - [44, 1343.0]
  - - [32, 5056, 1, 256, 32, 32, 32, 5056]
    - [44, 1527.0]
  - - [32, 5888, 1, 256, 32, 32, 32, 5888]
    - [41, 1861.0]
  - - [32, 6784, 1, 256, 32, 32, 32, 6784]
    - [41, 2043.0]
  - - [32, 64, 1, 1280, 32, 32, 32, 64]
    - [55, 88.0]
  - - [32, 128, 1, 1280, 32, 32, 32, 128]
    - [57, 169.0]
  - - [32, 256, 1, 1280, 32, 32, 32, 256]
    - [57, 354.0]
  - - [32, 448, 1, 1280, 32, 32, 32, 448]
    - [57, 605.0]
  - - [32, 704, 1, 1280, 32, 32, 32, 704]
    - [56, 1033.0]
  - - [32, 1024, 1, 1280, 32, 32, 32, 1024]
    - [55, 1307.0]
  - - [32, 1408, 1, 1280, 32, 32, 32, 1408]
    - [55, 1754.0]
  - - [32, 1856, 1, 1280, 32, 32, 32, 1856]
    - [55, 1813.0]
  - - [32, 2368, 1, 1280, 32, 32, 32, 2368]
    - [55, 2258.0]
  - - [32, 2944, 1, 1280, 32, 32, 32, 2944]
    - [55, 2333.0]
  - - [32, 3584, 1, 1280, 32, 32, 32, 3584]
    - [55, 2294.0]
  - - [32, 4288, 1, 1280, 32, 32, 32, 4288]
    - [55, 2478.0]
  - - [32, 5056, 1, 1280, 32, 32, 32, 5056]
    - [54, 2610.0]
  - - [32, 5888, 1, 1280, 32, 32, 32, 5888]
    - [57, 2637.0]
  - - [32, 6784, 1, 1280, 32, 32, 32, 6784]
    - [53, 2892.0]
  - - [32, 64, 1, 3328, 32, 32, 32, 64]
    - [61, 146.0]
  - - [32, 128, 1, 3328, 32, 32, 32, 128]
    - [60, 291.0]
  - - [32, 256, 1, 3328, 32, 32, 32, 256]
    - [61, 577.0]
  - - [32, 448, 1, 3328, 32, 32, 32, 448]
    - [60, 1004.0]
  - - [32, 704, 1, 3328, 32, 32, 32, 704]
    - [61, 1422.0]
  - - [32, 1024, 1, 3328, 32, 32, 32, 1024]
    - [60, 2038.0]
  - - [32, 1408, 1, 3328, 32, 32, 32, 1408]
    - [60, 2132.0]
  - - [32, 1856, 1, 3328, 32, 32, 32, 1856]
    - [60, 2294.0]
  - - [32, 2368, 1, 3328, 32, 32, 32, 2368]
    - [55, 2584.0]
  - - [32, 2944, 1, 3328, 32, 32, 32, 2944]
    - [57, 2708.0]
  - - [32, 3584, 1, 3328, 32, 32, 32, 3584]
    - [61, 2753.0]
  - - [32, 4288, 1, 3328, 32, 32, 32, 4288]
    - [60, 2958.0]
  - - [32, 5056, 1, 3328, 32, 32, 32, 5056]
    - [60, 3138.0]
  - - [32, 5888, 1, 3328, 32, 32, 32, 5888]
    - [60, 3058.0]
  - - [32, 6784, 1, 3328, 32, 32, 32, 6784]
    - [60, 3243.0]
  - - [64, 32, 1, 256, 64, 64, 64, 32]
    - [41, 20.0]
  - - [128, 32, 1, 256, 128, 128, 128, 32]
    - [41, 40.0]
  - - [256, 32, 1, 256, 256, 256, 256, 32]
    - [41, 80.0]
  - - [448, 32, 1, 256, 448, 448, 448, 32]
    - [44, 141.0]
  - - [704, 32, 1, 256, 704, 704, 704, 32]
    - [41, 222.0]
  - - [1024, 32, 1, 256, 1024, 1024, 1024, 32]
    - [44, 326.0]
  - - [1408, 32, 1, 256, 1408, 1408, 1408, 32]
    - [44, 449.0]
  - - [1856, 32, 1, 256, 1856, 1856, 1856, 32]
    - [41, 585.0]
  - - [2368, 32, 1, 256, 2368, 2368, 2368, 32]
    - [44, 748.0]
  - - [2944, 32, 1, 256, 2944, 2944, 2944, 32]
    - [44, 930.0]
  - - [3584, 32, 1, 256, 3584, 3584, 3584, 32]
    - [52, 1288.0]
  - - [4288, 32, 1, 256, 4288, 4288, 4288, 32]
    - [44, 1319.0]
  - - [5056, 32, 1, 256, 5056, 5056, 5056, 32]
    - [44, 1559.0]
  - - [5888, 32, 1, 256, 5888, 5888, 5888, 32]
    - [41, 1784.0]
  - - [6784, 32, 1, 256, 6784, 6784, 6784, 32]
    - [44, 2031.0]
  - - [64, 32, 1, 1280, 64, 64, 64, 32]
    - [55, 88.0]
  - - [128, 32, 1, 1280, 128, 128, 128, 32]
    - [55, 176.0]
  - - [256, 32, 1, 1280, 256, 256, 256, 32]
    - [55, 353.0]
  - - [448, 32, 1, 1280, 448, 448, 448, 32]
    - [55, 607.0]
  - - [704, 32, 1, 1280, 704, 704, 704, 32]
    - [59, 1033.0]
  - - [1024, 32, 1, 1280, 1024, 1024, 1024, 32]
    - [55, 1257.0]
  - - [1408, 32, 1, 1280, 1408, 1408, 1408, 32]
    - [55, 1763.0]
  - - [1856, 32, 1, 1280, 1856, 1856, 1856, 32]
    - [57, 1813.0]
  - - [2368, 32, 1, 1280, 2368, 2368, 2368, 32]
    - [57, 2262.0]
  - - [2944, 32, 1, 1280, 2944, 2944, 2944, 32]
    - [55, 2200.0]
  - - [3584, 32, 1, 1280, 3584, 3584, 3584, 32]
    - [58, 2350.0]
  - - [4288, 32, 1, 1280, 4288, 4288, 4288, 32]
    - [57, 2399.0]
  - - [5056, 32, 1, 1280, 5056, 5056, 5056, 32]
    - [54, 2617.0]
  - - [5888, 32, 1, 1280, 5888, 5888, 5888, 32]
    - [55, 2682.0]
  - - [6784, 32, 1, 1280, 6784, 6784, 6784, 32]
    - [53, 2815.0]
  - - [64, 32, 1, 3328, 64, 64, 64, 32]
    - [61, 143.0]
  - - [128, 32, 1, 3328, 128, 128, 128, 32]
    - [61, 294.0]
  - - [256, 32, 1, 3328, 256, 256, 256, 32]
    - [63, 613.0]
  - - [448, 32, 1, 3328, 448, 448, 448, 32]
    - [60, 954.0]
  - - [704, 32, 1, 3328, 704, 704, 704, 32]
    - [61, 1435.0]
  - - [1024, 32, 1, 3328, 1024, 1024, 1024, 32]
    - [61, 2014.0]
  - - [1408, 32, 1, 3328, 1408, 1408, 1408, 32]
    - [61, 2152.0]
  - - [1856, 32, 1, 3328, 1856, 1856, 1856, 32]
    - [61, 2316.0]
  - - [2368, 32, 1, 3328, 2368, 2368, 2368, 32]
    - [57, 2607.0]
  - - [2944, 32, 1, 3328, 2944, 2944, 2944, 32]
    - [55, 2708.0]
  - - [3584, 32, 1, 3328, 3584, 3584, 3584, 32]
    - [62, 2797.0]
  - - [4288, 32, 1, 3328, 4288, 4288, 4288, 32]
    - [60, 2971.0]
  - - [5056, 32, 1, 3328, 5056, 5056, 5056, 32]
    - [61, 3150.0]
  - - [5888, 32, 1, 3328, 5888, 5888, 5888, 32]
    - [62, 3092.0]
  - - [6784, 32, 1, 3328, 6784, 6784, 6784, 32]
    - [62, 3285.0]
  - - [64, 64, 1, 32, 64, 64, 64, 64]
    - [41, 12.0]
  - - [128, 64, 1, 32, 128, 128, 128, 64]
    - [39, 24.0]
  - - [256, 64, 1, 32, 256, 256, 256, 64]
    - [38, 84.0]
  - - [448, 64, 1, 32, 448, 448, 448, 64]
    - [49, 112.0]
  - - [704, 64, 1, 32, 704, 704, 704, 64]
    - [41, 141.0]
  - - [1024, 64, 1, 32, 1024, 1024, 1024, 64]
    - [44, 203.0]
  - - [1408, 64, 1, 32, 1408, 1408, 1408, 64]
    - [41, 277.0]
  - - [1856, 64, 1, 32, 1856, 1856, 1856, 64]
    - [44, 371.0]
  - - [2368, 64, 1, 32, 2368, 2368, 2368, 64]
    - [44, 474.0]
  - - [2944, 64, 1, 32, 2944, 2944, 2944, 64]
    - [41, 584.0]
  - - [3584, 64, 1, 32, 3584, 3584, 3584, 64]
    - [52, 1019.0]
  - - [4288, 64, 1, 32, 4288, 4288, 4288, 64]
    - [41, 1036.0]
  - - [5056, 64, 1, 32, 5056, 5056, 5056, 64]
    - [44, 1187.0]
  - - [5888, 64, 1, 32, 5888, 5888, 5888, 64]
    - [44, 1311.0]
  - - [6784, 64, 1, 32, 6784, 6784, 6784, 64]
    - [41, 1484.0]
  - - [64, 128, 1, 32, 64, 64, 64, 128]
    - [41, 25.0]
  - - [128, 128, 1, 32, 128, 128, 128, 128]
    - [38, 84.0]
  - - [256, 128, 1, 32, 256, 256, 256, 128]
    - [49, 107.0]
  - - [448, 128, 1, 32, 448, 448, 448, 128]
    - [39, 178.0]
  - - [704, 128, 1, 32, 704, 704, 704, 128]
    - [41, 284.0]
  - - [1024, 128, 1, 32, 1024, 1024, 1024, 128]
    - [44, 391.0]
  - - [1408, 128, 1, 32, 1408, 1408, 1408, 128]
    - [39, 581.0]
  - - [1856, 128, 1, 32, 1856, 1856, 1856, 128]
    - [41, 1145.0]
  - - [2368, 128, 1, 32, 2368, 2368, 2368, 128]
    - [41, 1112.0]
  - - [2944, 128, 1, 32, 2944, 2944, 2944, 128]
    - [51, 1299.0]
  - - [3584, 128, 1, 32, 3584, 3584, 3584, 128]
    - [45, 1240.0]
  - - [4288, 128, 1, 32, 4288, 4288, 4288, 128]
    - [41, 1651.0]
  - - [5056, 128, 1, 32, 5056, 5056, 5056, 128]
    - [41, 1932.0]
  - - [5888, 128, 1, 32, 5888, 5888, 5888, 128]
    - [42, 2010.0]
  - - [6784, 128, 1, 32, 6784, 6784, 6784, 128]
    - [41, 2019.0]
  - - [64, 256, 1, 32, 64, 64, 64, 256]
    - [41, 84.0]
  - - [128, 256, 1, 32, 128, 128, 128, 256]
    - [45, 110.0]
  - - [256, 256, 1, 32, 256, 256, 256, 256]
    - [41, 213.0]
  - - [448, 256, 1, 32, 448, 448, 448, 256]
    - [37, 370.0]
  - - [704, 256, 1, 32, 704, 704, 704, 256]
    - [44, 577.0]
  - - [1024, 256, 1, 32, 1024, 1024, 1024, 256]
    - [41, 1018.0]
  - - [1408, 256, 1, 32, 1408, 1408, 1408, 256]
    - [44, 1243.0]
  - - [1856, 256, 1, 32, 1856, 1856, 1856, 256]
    - [41, 1638.0]
  - - [2368, 256, 1, 32, 2368, 2368, 2368, 256]
    - [48, 1757.0]
  - - [2944, 256, 1, 32, 2944, 2944, 2944, 256]
    - [42, 1958.0]
  - - [3584, 256, 1, 32, 3584, 3584, 3584, 256]
    - [50, 2028.0]
  - - [4288, 256, 1, 32, 4288, 4288, 4288, 256]
    - [51, 2218.0]
  - - [5056, 256, 1, 32, 5056, 5056, 5056, 256]
    - [48, 2550.0]
  - - [5888, 256, 1, 32, 5888, 5888, 5888, 256]
    - [46, 2512.0]
  - - [6784, 256, 1, 32, 6784, 6784, 6784, 256]
    - [48, 2768.0]
  - - [64, 448, 1, 32, 64, 64, 64, 448]
    - [42, 135.0]
  - - [128, 448, 1, 32, 128, 128, 128, 448]
    - [49, 194.0]
  - - [256, 448, 1, 32, 256, 256, 256, 448]
    - [41, 356.0]
  - - [448, 448, 1, 32, 448, 448, 448, 448]
    - [39, 595.0]
  - - [704, 448, 1, 32, 704, 704, 704, 448]
    - [44, 1009.0]
  - - [1024, 448, 1, 32, 1024, 1024, 1024, 448]
    - [41, 1119.0]
  - - [1408, 448, 1, 32, 1408, 1408, 1408, 448]
    - [52, 1777.0]
  - - [1856, 448, 1, 32, 1856, 1856, 1856, 448]
    - [41, 2118.0]
  - - [2368, 448, 1, 32, 2368, 2368, 2368, 448]
    - [44, 2187.0]
  - - [2944, 448, 1, 32, 2944, 2944, 2944, 448]
    - [41, 2561.0]
  - - [3584, 448, 1, 32, 3584, 3584, 3584, 448]
    - [51, 2621.0]
  - - [4288, 448, 1, 32, 4288, 4288, 4288, 448]
    - [41, 2933.0]
  - - [5056, 448, 1, 32, 5056, 5056, 5056, 448]
    - [48, 3103.0]
  - - [5888, 448, 1, 32, 5888, 5888, 5888, 448]
    - [41, 3140.0]
  - - [6784, 448, 1, 32, 6784, 6784, 6784, 448]
    - [48, 3133.0]
  - - [64, 704, 1, 32, 64, 64, 64, 704]
    - [41, 143.0]
  - - [128, 704, 1, 32, 128, 128, 128, 704]
    - [41, 286.0]
  - - [256, 704, 1, 32, 256, 256, 256, 704]
    - [41, 581.0]
  - - [448, 704, 1, 32, 448, 448, 448, 704]
    - [44, 1107.0]
  - - [704, 704, 1, 32, 704, 704, 704, 704]
    - [48, 1739.0]
  - - [1024, 704, 1, 32, 1024, 1024, 1024, 704]
    - [51, 1872.0]
  - - [1408, 704, 1, 32, 1408, 1408, 1408, 704]
    - [46, 2463.0]
  - - [1856, 704, 1, 32, 1856, 1856, 1856, 704]
    - [51, 2856.0]
  - - [2368, 704, 1, 32, 2368, 2368, 2368, 704]
    - [41, 2826.0]
  - - [2944, 704, 1, 32, 2944, 2944, 2944, 704]
    - [41, 3082.0]
  - - [3584, 704, 1, 32, 3584, 3584, 3584, 704]
    - [51, 2909.0]
  - - [4288, 704, 1, 32, 4288, 4288, 4288, 704]
    - [44, 3186.0]
  - - [5056, 704, 1, 32, 5056, 5056, 5056, 704]
    - [41, 3251.0]
  - - [5888, 704, 1, 32, 5888, 5888, 5888, 704]
    - [51, 3370.0]
  - - [6784, 704, 1, 32, 6784, 6784, 6784, 704]
    - [40, 3393.0]
  - - [64, 1024, 1, 32, 64, 64, 64, 1024]
    - [41, 205.0]
  - - [128, 1024, 1, 32, 128, 128, 128, 1024]
    - [41, 410.0]
  - - [256, 1024, 1, 32, 256, 256, 256, 1024]
    - [41, 1263.0]
  - - [448, 1024, 1, 32, 448, 448, 448, 1024]
    - [51, 1468.0]
  - - [704, 1024, 1, 32, 704, 704, 704, 1024]
    - [41, 2105.0]
  - - [1024, 1024, 1, 32, 1024, 1024, 1024, 1024]
    - [52, 2076.0]
  - - [1408, 1024, 1, 32, 1408, 1408, 1408, 1024]
    - [51, 2518.0]
  - - [1856, 1024, 1, 32, 1856, 1856, 1856, 1024]
    - [41, 2935.0]
  - - [2368, 1024, 1, 32, 2368, 2368, 2368, 1024]
    - [44, 3109.0]
  - - [2944, 1024, 1, 32, 2944, 2944, 2944, 1024]
    - [48, 3242.0]
  - - [3584, 1024, 1, 32, 3584, 3584, 3584, 1024]
    - [51, 3150.0]
  - - [4288, 1024, 1, 32, 4288, 4288, 4288, 1024]
    - [40, 3534.0]
  - - [5056, 1024, 1, 32, 5056, 5056, 5056, 1024]
    - [40, 3745.0]
  - - [5888, 1024, 1, 32, 5888, 5888, 5888, 1024]
    - [40, 3573.0]
  - - [6784, 1024, 1, 32, 6784, 6784, 6784, 1024]
    - [43, 3730.0]
  - - [64, 1408, 1, 32, 64, 64, 64, 1408]
    - [44, 284.0]
  - - [128, 1408, 1, 32, 128, 128, 128, 1408]
    - [37, 577.0]
  - - [256, 1408, 1, 32, 256, 256, 256, 1408]
    - [44, 1265.0]
  - - [448, 1408, 1, 32, 448, 448, 448, 1408]
    - [41, 1883.0]
  - - [704, 1408, 1, 32, 704, 704, 704, 1408]
    - [41, 2525.0]
  - - [1024, 1408, 1, 32, 1024, 1024, 1024, 1408]
    - [47, 2518.0]
  - - [1408, 1408, 1, 32, 1408, 1408, 1408, 1408]
    - [44, 2992.0]
  - - [1856, 1408, 1, 32, 1856, 1856, 1856, 1408]
    - [48, 3287.0]
  - - [2368, 1408, 1, 32, 2368, 2368, 2368, 1408]
    - [44, 3411.0]
  - - [2944, 1408, 1, 32, 2944, 2944, 2944, 1408]
    - [40, 3612.0]
  - - [3584, 1408, 1, 32, 3584, 3584, 3584, 1408]
    - [40, 3462.0]
  - - [4288, 1408, 1, 32, 4288, 4288, 4288, 1408]
    - [43, 3773.0]
  - - [5056, 1408, 1, 32, 5056, 5056, 5056, 1408]
    - [43, 3879.0]
  - - [5888, 1408, 1, 32, 5888, 5888, 5888, 1408]
    - [40, 3892.0]
  - - [6784, 1408, 1, 32, 6784, 6784, 6784, 1408]
    - [40, 3911.0]
  - - [64, 1856, 1, 32, 64, 64, 64, 1856]
    - [44, 377.0]
  - - [128, 1856, 1, 32, 128, 128, 128, 1856]
    - [52, 1159.0]
  - - [256, 1856, 1, 32, 256, 256, 256, 1856]
    - [44, 1571.0]
  - - [448, 1856, 1, 32, 448, 448, 448, 1856]
    - [41, 2132.0]
  - - [704, 1856, 1, 32, 704, 704, 704, 1856]
    - [48, 2872.0]
  - - [1024, 1856, 1, 32, 1024, 1024, 1024, 1856]
    - [48, 2551.0]
  - - [1408, 1856, 1, 32, 1408, 1408, 1408, 1856]
    - [44, 3267.0]
  - - [1856, 1856, 1, 32, 1856, 1856, 1856, 1856]
    - [43, 3369.0]
  - - [2368, 1856, 1, 32, 2368, 2368, 2368, 1856]
    - [44, 3566.0]
  - - [2944, 1856, 1, 32, 2944, 2944, 2944, 1856]
    - [41, 3655.0]
  - - [3584, 1856, 1, 32, 3584, 3584, 3584, 1856]
    - [51, 3567.0]
  - - [4288, 1856, 1, 32, 4288, 4288, 4288, 1856]
    - [40, 3863.0]
  - - [5056, 1856, 1, 32, 5056, 5056, 5056, 1856]
    - [40, 3930.0]
  - - [5888, 1856, 1, 32, 5888, 5888, 5888, 1856]
    - [44, 3821.0]
  - - [6784, 1856, 1, 32, 6784, 6784, 6784, 1856]
    - [40, 3929.0]
  - - [64, 2368, 1, 32, 64, 64, 64, 2368]
    - [41, 446.0]
  - - [128, 2368, 1, 32, 128, 128, 128, 2368]
    - [41, 1112.0]
  - - [256, 2368, 1, 32, 256, 256, 256, 2368]
    - [42, 1757.0]
  - - [448, 2368, 1, 32, 448, 448, 448, 2368]
    - [48, 2371.0]
  - - [704, 2368, 1, 32, 704, 704, 704, 2368]
    - [44, 2850.0]
  - - [1024, 2368, 1, 32, 1024, 1024, 1024, 2368]
    - [46, 2694.0]
  - - [1408, 2368, 1, 32, 1408, 1408, 1408, 2368]
    - [44, 3402.0]
  - - [1856, 2368, 1, 32, 1856, 1856, 1856, 2368]
    - [41, 3552.0]
  - - [2368, 2368, 1, 32, 2368, 2368, 2368, 2368]
    - [43, 3763.0]
  - - [2944, 2368, 1, 32, 2944, 2944, 2944, 2368]
    - [40, 3738.0]
  - - [3584, 2368, 1, 32, 3584, 3584, 3584, 2368]
    - [40, 3581.0]
  - - [4288, 2368, 1, 32, 4288, 4288, 4288, 2368]
    - [43, 4002.0]
  - - [5056, 2368, 1, 32, 5056, 5056, 5056, 2368]
    - [40, 4024.0]
  - - [5888, 2368, 1, 32, 5888, 5888, 5888, 2368]
    - [43, 4024.0]
  - - [6784, 2368, 1, 32, 6784, 6784, 6784, 2368]
    - [43, 4098.0]
  - - [64, 2944, 1, 32, 64, 64, 64, 2944]
    - [39, 584.0]
  - - [128, 2944, 1, 32, 128, 128, 128, 2944]
    - [41, 1370.0]
  - - [256, 2944, 1, 32, 256, 256, 256, 2944]
    - [42, 2153.0]
  - - [448, 2944, 1, 32, 448, 448, 448, 2944]
    - [41, 2573.0]
  - - [704, 2944, 1, 32, 704, 704, 704, 2944]
    - [40, 3277.0]
  - - [1024, 2944, 1, 32, 1024, 1024, 1024, 2944]
    - [51, 2977.0]
  - - [1408, 2944, 1, 32, 1408, 1408, 1408, 2944]
    - [44, 3528.0]
  - - [1856, 2944, 1, 32, 1856, 1856, 1856, 2944]
    - [40, 3711.0]
  - - [2368, 2944, 1, 32, 2368, 2368, 2368, 2944]
    - [40, 3830.0]
  - - [2944, 2944, 1, 32, 2944, 2944, 2944, 2944]
    - [40, 3913.0]
  - - [3584, 2944, 1, 32, 3584, 3584, 3584, 2944]
    - [51, 3667.0]
  - - [4288, 2944, 1, 32, 4288, 4288, 4288, 2944]
    - [43, 4020.0]
  - - [5056, 2944, 1, 32, 5056, 5056, 5056, 2944]
    - [40, 4143.0]
  - - [5888, 2944, 1, 32, 5888, 5888, 5888, 2944]
    - [40, 4074.0]
  - - [6784, 2944, 1, 32, 6784, 6784, 6784, 2944]
    - [40, 4167.0]
  - - [64, 3584, 1, 32, 64, 64, 64, 3584]
    - [42, 936.0]
  - - [128, 3584, 1, 32, 128, 128, 128, 3584]
    - [51, 1596.0]
  - - [256, 3584, 1, 32, 256, 256, 256, 3584]
    - [51, 2308.0]
  - - [448, 3584, 1, 32, 448, 448, 448, 3584]
    - [51, 2745.0]
  - - [704, 3584, 1, 32, 704, 704, 704, 3584]
    - [37, 3068.0]
  - - [1024, 3584, 1, 32, 1024, 1024, 1024, 3584]
    - [51, 2936.0]
  - - [1408, 3584, 1, 32, 1408, 1408, 1408, 3584]
    - [43, 3731.0]
  - - [1856, 3584, 1, 32, 1856, 1856, 1856, 3584]
    - [43, 3817.0]
  - - [2368, 3584, 1, 32, 2368, 2368, 2368, 3584]
    - [40, 3880.0]
  - - [2944, 3584, 1, 32, 2944, 2944, 2944, 3584]
    - [43, 3970.0]
  - - [3584, 3584, 1, 32, 3584, 3584, 3584, 3584]
    - [40, 3854.0]
  - - [4288, 3584, 1, 32, 4288, 4288, 4288, 3584]
    - [43, 4131.0]
  - - [5056, 3584, 1, 32, 5056, 5056, 5056, 3584]
    - [40, 4199.0]
  - - [5888, 3584, 1, 32, 5888, 5888, 5888, 3584]
    - [43, 4216.0]
  - - [6784, 3584, 1, 32, 6784, 6784, 6784, 3584]
    - [43, 4267.0]
  - - [64, 4288, 1, 32, 64, 64, 64, 4288]
    - [41, 907.0]
  - - [128, 4288, 1, 32, 128, 128, 128, 4288]
    - [42, 1444.0]
  - - [256, 4288, 1, 32, 256, 256, 256, 4288]
    - [41, 2240.0]
  - - [448, 4288, 1, 32, 448, 448, 448, 4288]
    - [40, 2857.0]
  - - [704, 4288, 1, 32, 704, 704, 704, 4288]
    - [40, 3237.0]
  - - [1024, 4288, 1, 32, 1024, 1024, 1024, 4288]
    - [37, 2865.0]
  - - [1408, 4288, 1, 32, 1408, 1408, 1408, 4288]
    - [40, 3715.0]
  - - [1856, 4288, 1, 32, 1856, 1856, 1856, 4288]
    - [40, 3882.0]
  - - [2368, 4288, 1, 32, 2368, 2368, 2368, 4288]
    - [40, 3986.0]
  - - [2944, 4288, 1, 32, 2944, 2944, 2944, 4288]
    - [40, 3982.0]
  - - [3584, 4288, 1, 32, 3584, 3584, 3584, 4288]
    - [43, 3923.0]
  - - [4288, 4288, 1, 32, 4288, 4288, 4288, 4288]
    - [40, 4176.0]
  - - [5056, 4288, 1, 32, 5056, 5056, 5056, 4288]
    - [40, 4234.0]
  - - [5888, 4288, 1, 32, 5888, 5888, 5888, 4288]
    - [40, 4204.0]
  - - [6784, 4288, 1, 32, 6784, 6784, 6784, 4288]
    - [43, 4261.0]
  - - [64, 5056, 1, 32, 64, 64, 64, 5056]
    - [41, 1019.0]
  - - [128, 5056, 1, 32, 128, 128, 128, 5056]
    - [42, 1836.0]
  - - [256, 5056, 1, 32, 256, 256, 256, 5056]
    - [48, 2739.0]
  - - [448, 5056, 1, 32, 448, 448, 448, 5056]
    - [44, 3135.0]
  - - [704, 5056, 1, 32, 704, 704, 704, 5056]
    - [40, 3507.0]
  - - [1024, 5056, 1, 32, 1024, 1024, 1024, 5056]
    - [51, 3138.0]
  - - [1408, 5056, 1, 32, 1408, 1408, 1408, 5056]
    - [40, 3802.0]
  - - [1856, 5056, 1, 32, 1856, 1856, 1856, 5056]
    - [40, 3943.0]
  - - [2368, 5056, 1, 32, 2368, 2368, 2368, 5056]
    - [40, 4038.0]
  - - [2944, 5056, 1, 32, 2944, 2944, 2944, 5056]
    - [43, 4175.0]
  - - [3584, 5056, 1, 32, 3584, 3584, 3584, 5056]
    - [40, 3959.0]
  - - [4288, 5056, 1, 32, 4288, 4288, 4288, 5056]
    - [40, 4257.0]
  - - [5056, 5056, 1, 32, 5056, 5056, 5056, 5056]
    - [40, 4275.0]
  - - [5888, 5056, 1, 32, 5888, 5888, 5888, 5056]
    - [43, 4191.0]
  - - [6784, 5056, 1, 32, 6784, 6784, 6784, 5056]
    - [40, 4233.0]
  - - [64, 5888, 1, 32, 64, 64, 64, 5888]
    - [44, 1236.0]
  - - [128, 5888, 1, 32, 128, 128, 128, 5888]
    - [41, 1996.0]
  - - [256, 5888, 1, 32, 256, 256, 256, 5888]
    - [44, 2621.0]
  - - [448, 5888, 1, 32, 448, 448, 448, 5888]
    - [41, 2989.0]
  - - [704, 5888, 1, 32, 704, 704, 704, 5888]
    - [43, 3558.0]
  - - [1024, 5888, 1, 32, 1024, 1024, 1024, 5888]
    - [51, 3084.0]
  - - [1408, 5888, 1, 32, 1408, 1408, 1408, 5888]
    - [43, 3911.0]
  - - [1856, 5888, 1, 32, 1856, 1856, 1856, 5888]
    - [40, 4089.0]
  - - [2368, 5888, 1, 32, 2368, 2368, 2368, 5888]
    - [40, 4143.0]
  - - [2944, 5888, 1, 32, 2944, 2944, 2944, 5888]
    - [43, 4159.0]
  - - [3584, 5888, 1, 32, 3584, 3584, 3584, 5888]
    - [43, 4000.0]
  - - [4288, 5888, 1, 32, 4288, 4288, 4288, 5888]
    - [43, 4261.0]
  - - [5056, 5888, 1, 32, 5056, 5056, 5056, 5888]
    - [40, 4348.0]
  - - [5888, 5888, 1, 32, 5888, 5888, 5888, 5888]
    - [40, 4292.0]
  - - [6784, 5888, 1, 32, 6784, 6784, 6784, 5888]
    - [40, 4364.0]
  - - [64, 6784, 1, 32, 64, 64, 64, 6784]
    - [38, 1472.0]
  - - [128, 6784, 1, 32, 128, 128, 128, 6784]
    - [38, 1985.0]
  - - [256, 6784, 1, 32, 256, 256, 256, 6784]
    - [48, 2682.0]
  - - [448, 6784, 1, 32, 448, 448, 448, 6784]
    - [40, 3268.0]
  - - [704, 6784, 1, 32, 704, 704, 704, 6784]
    - [43, 3473.0]
  - - [1024, 6784, 1, 32, 1024, 1024, 1024, 6784]
    - [48, 3265.0]
  - - [1408, 6784, 1, 32, 1408, 1408, 1408, 6784]
    - [40, 3903.0]
  - - [1856, 6784, 1, 32, 1856, 1856, 1856, 6784]
    - [43, 4029.0]
  - - [2368, 6784, 1, 32, 2368, 2368, 2368, 6784]
    - [40, 4230.0]
  - - [2944, 6784, 1, 32, 2944, 2944, 2944, 6784]
    - [43, 4218.0]
  - - [3584, 6784, 1, 32, 3584, 3584, 3584, 6784]
    - [40, 4006.0]
  - - [4288, 6784, 1, 32, 4288, 4288, 4288, 6784]
    - [40, 4311.0]
  - - [5056, 6784, 1, 32, 5056, 5056, 5056, 6784]
    - [43, 4374.0]
  - - [5888, 6784, 1, 32, 5888, 5888, 5888, 6784]
    - [43, 4334.0]
  - - [6784, 6784, 1, 32, 6784, 6784, 6784, 6784]
    - [40, 4388.0]
  - - [32, 32, 1, 256, 32, 32, 32, 32]
    - [41, 10.0]
  - - [32, 32, 1, 1280, 32, 32, 32, 32]
    - [55, 44.0]
  - - [32, 32, 1, 3328, 32, 32, 32, 32]
    - [60, 72.0]
  - - [32, 64, 1, 32, 32, 32, 32, 64]
    - [37, 7.0]
  - - [32, 128, 1, 32, 32, 32, 32, 128]
    - [41, 15.0]
  - - [32, 256, 1, 32, 32, 32, 32, 256]
    - [39, 30.0]
  - - [32, 448, 1, 32, 32, 32, 32, 448]
    - [44, 53.0]
  - - [32, 704, 1, 32, 32, 32, 32, 704]
    - [41, 84.0]
  - - [32, 1024, 1, 32, 32, 32, 32, 1024]
    - [41, 121.0]
  - - [32, 1408, 1, 32, 32, 32, 32, 1408]
    - [44, 168.0]
  - - [32, 1856, 1, 32, 32, 32, 32, 1856]
    - [44, 220.0]
  - - [32, 2368, 1, 32, 32, 32, 32, 2368]
    - [44, 278.0]
  - - [32, 2944, 1, 32, 32, 32, 32, 2944]
    - [41, 343.0]
  - - [32, 3584, 1, 32, 32, 32, 32, 3584]
    - [41, 402.0]
  - - [32, 4288, 1, 32, 32, 32, 32, 4288]
    - [44, 695.0]
  - - [32, 5056, 1, 32, 32, 32, 32, 5056]
    - [41, 789.0]
  - - [32, 5888, 1, 32, 32, 32, 32, 5888]
    - [44, 942.0]
  - - [32, 6784, 1, 32, 32, 32, 32, 6784]
    - [41, 1072.0]
  - - [64, 32, 1, 32, 64, 64, 64, 32]
    - [37, 7.0]
  - - [128, 32, 1, 32, 128, 128, 128, 32]
    - [41, 15.0]
  - - [256, 32, 1, 32, 256, 256, 256, 32]
    - [38, 48.0]
  - - [448, 32, 1, 32, 448, 448, 448, 32]
    - [41, 53.0]
  - - [704, 32, 1, 32, 704, 704, 704, 32]
    - [41, 84.0]
  - - [1024, 32, 1, 32, 1024, 1024, 1024, 32]
    - [41, 121.0]
  - - [1408, 32, 1, 32, 1408, 1408, 1408, 32]
    - [41, 170.0]
  - - [1856, 32, 1, 32, 1856, 1856, 1856, 32]
    - [44, 222.0]
  - - [2368, 32, 1, 32, 2368, 2368, 2368, 32]
    - [41, 281.0]
  - - [2944, 32, 1, 32, 2944, 2944, 2944, 32]
    - [41, 343.0]
  - - [3584, 32, 1, 32, 3584, 3584, 3584, 32]
    - [44, 604.0]
  - - [4288, 32, 1, 32, 4288, 4288, 4288, 32]
    - [41, 695.0]
  - - [5056, 32, 1, 32, 5056, 5056, 5056, 32]
    - [41, 819.0]
  - - [5888, 32, 1, 32, 5888, 5888, 5888, 32]
    - [41, 954.0]
  - - [6784, 32, 1, 32, 6784, 6784, 6784, 32]
    - [44, 1046.0]
  - - [1, 1, 1, 1, 1, 1, 1, 1]
    - [70, 0.00021551724412012296]
  - - [1, 64, 1, 256, 1, 1, 1, 64]
    - [68, 1.0]
  - - [1, 128, 1, 256, 1, 1, 1, 128]
    - [66, 1.0]
  - - [1, 256, 1, 256, 1, 1, 1, 256]
    - [68, 3.0]
  - - [1, 448, 1, 256, 1, 1, 1, 448]
    - [68, 4.0]
  - - [1, 704, 1, 256, 1, 1, 1, 704]
    - [68, 6.0]
  - - [1, 1024, 1, 256, 1, 1, 1, 1024]
    - [68, 9.0]
  - - [1, 1408, 1, 256, 1, 1, 1, 1408]
    - [68, 13.0]
  - - [1, 1856, 1, 256, 1, 1, 1, 1856]
    - [68, 17.0]
  - - [1, 2368, 1, 256, 1, 1, 1, 2368]
    - [68, 22.0]
  - - [1, 2944, 1, 256, 1, 1, 1, 2944]
    - [68, 27.0]
  - - [1, 3584, 1, 256, 1, 1, 1, 3584]
    - [81, 39.0]
  - - [1, 4288, 1, 256, 1, 1, 1, 4288]
    - [76, 34.0]
  - - [1, 5056, 1, 256, 1, 1, 1, 5056]
    - [76, 40.0]
  - - [1, 5888, 1, 256, 1, 1, 1, 5888]
    - [80, 47.0]
  - - [1, 6784, 1, 256, 1, 1, 1, 6784]
    - [80, 54.0]
  - - [1, 64, 1, 1280, 1, 1, 1, 64]
    - [82, 2.0]
  - - [1, 128, 1, 1280, 1, 1, 1, 128]
    - [88, 5.0]
  - - [1, 256, 1, 1280, 1, 1, 1, 256]
    - [88, 10.0]
  - - [1, 448, 1, 1280, 1, 1, 1, 448]
    - [88, 17.0]
  - - [1, 704, 1, 1280, 1, 1, 1, 704]
    - [98, 30.0]
  - - [1, 1024, 1, 1280, 1, 1, 1, 1024]
    - [97, 35.0]
  - - [1, 1408, 1, 1280, 1, 1, 1, 1408]
    - [96, 47.0]
  - - [1, 1856, 1, 1280, 1, 1, 1, 1856]
    - [97, 51.0]
  - - [1, 2368, 1, 1280, 1, 1, 1, 2368]
    - [97, 63.0]
  - - [1, 2944, 1, 1280, 1, 1, 1, 2944]
    - [93, 63.0]
  - - [1, 3584, 1, 1280, 1, 1, 1, 3584]
    - [91, 65.0]
  - - [1, 4288, 1, 1280, 1, 1, 1, 4288]
    - [92, 72.0]
  - - [1, 5056, 1, 1280, 1, 1, 1, 5056]
    - [84, 70.0]
  - - [1, 5888, 1, 1280, 1, 1, 1, 5888]
    - [89, 74.0]
  - - [1, 6784, 1, 1280, 1, 1, 1, 6784]
    - [85, 77.0]
  - - [1, 64, 1, 3328, 1, 1, 1, 64]
    - [99, 4.0]
  - - [1, 128, 1, 3328, 1, 1, 1, 128]
    - [99, 8.0]
  - - [1, 256, 1, 3328, 1, 1, 1, 256]
    - [105, 17.0]
  - - [1, 448, 1, 3328, 1, 1, 1, 448]
    - [102, 28.0]
  - - [1, 704, 1, 3328, 1, 1, 1, 704]
    - [98, 37.0]
  - - [1, 1024, 1, 3328, 1, 1, 1, 1024]
    - [106, 54.0]
  - - [1, 1408, 1, 3328, 1, 1, 1, 1408]
    - [104, 59.0]
  - - [1, 1856, 1, 3328, 1, 1, 1, 1856]
    - [103, 62.0]
  - - [1, 2368, 1, 3328, 1, 1, 1, 2368]
    - [95, 73.0]
  - - [1, 2944, 1, 3328, 1, 1, 1, 2944]
    - [94, 72.0]
  - - [1, 3584, 1, 3328, 1, 1, 1, 3584]
    - [102, 74.0]
  - - [1, 4288, 1, 3328, 1, 1, 1, 4288]
    - [101, 78.0]
  - - [1, 5056, 1, 3328, 1, 1, 1, 5056]
    - [102, 83.0]
  - - [1, 5888, 1, 3328, 1, 1, 1, 5888]
    - [101, 82.0]
  - - [1, 6784, 1, 3328, 1, 1, 1, 6784]
    - [100, 89.0]
  - - [64, 1, 1, 256, 64, 64, 64, 1]
    - [68, 1.0]
  - - [128, 1, 1, 256, 128, 128, 128, 1]
    - [66, 1.0]
  - - [256, 1, 1, 256, 256, 256, 256, 1]
    - [68, 3.0]
  - - [448, 1, 1, 256, 448, 448, 448, 1]
    - [68, 4.0]
  - - [704, 1, 1, 256, 704, 704, 704, 1]
    - [68, 7.0]
  - - [1024, 1, 1, 256, 1024, 1024, 1024, 1]
    - [68, 9.0]
  - - [1408, 1, 1, 256, 1408, 1408, 1408, 1]
    - [68, 13.0]
  - - [1856, 1, 1, 256, 1856, 1856, 1856, 1]
    - [68, 17.0]
  - - [2368, 1, 1, 256, 2368, 2368, 2368, 1]
    - [68, 21.0]
  - - [2944, 1, 1, 256, 2944, 2944, 2944, 1]
    - [68, 26.0]
  - - [3584, 1, 1, 256, 3584, 3584, 3584, 1]
    - [79, 37.0]
  - - [4288, 1, 1, 256, 4288, 4288, 4288, 1]
    - [81, 35.0]
  - - [5056, 1, 1, 256, 5056, 5056, 5056, 1]
    - [81, 41.0]
  - - [5888, 1, 1, 256, 5888, 5888, 5888, 1]
    - [76, 47.0]
  - - [6784, 1, 1, 256, 6784, 6784, 6784, 1]
    - [76, 54.0]
  - - [64, 1, 1, 1280, 64, 64, 64, 1]
    - [88, 3.0]
  - - [128, 1, 1, 1280, 128, 128, 128, 1]
    - [88, 5.0]
  - - [256, 1, 1, 1280, 256, 256, 256, 1]
    - [88, 10.0]
  - - [448, 1, 1, 1280, 448, 448, 448, 1]
    - [88, 18.0]
  - - [704, 1, 1, 1280, 704, 704, 704, 1]
    - [98, 30.0]
  - - [1024, 1, 1, 1280, 1024, 1024, 1024, 1]
    - [95, 35.0]
  - - [1408, 1, 1, 1280, 1408, 1408, 1408, 1]
    - [95, 47.0]
  - - [1856, 1, 1, 1280, 1856, 1856, 1856, 1]
    - [95, 51.0]
  - - [2368, 1, 1, 1280, 2368, 2368, 2368, 1]
    - [95, 63.0]
  - - [2944, 1, 1, 1280, 2944, 2944, 2944, 1]
    - [90, 63.0]
  - - [3584, 1, 1, 1280, 3584, 3584, 3584, 1]
    - [95, 65.0]
  - - [4288, 1, 1, 1280, 4288, 4288, 4288, 1]
    - [91, 67.0]
  - - [5056, 1, 1, 1280, 5056, 5056, 5056, 1]
    - [83, 71.0]
  - - [5888, 1, 1, 1280, 5888, 5888, 5888, 1]
    - [90, 73.0]
  - - [6784, 1, 1, 1280, 6784, 6784, 6784, 1]
    - [86, 78.0]
  - - [64, 1, 1, 3328, 64, 64, 64, 1]
    - [99, 4.0]
  - - [128, 1, 1, 3328, 128, 128, 128, 1]
    - [99, 8.0]
  - - [256, 1, 1, 3328, 256, 256, 256, 1]
    - [99, 17.0]
  - - [448, 1, 1, 3328, 448, 448, 448, 1]
    - [99, 29.0]
  - - [704, 1, 1, 3328, 704, 704, 704, 1]
    - [104, 39.0]
  - - [1024, 1, 1, 3328, 1024, 1024, 1024, 1]
    - [104, 54.0]
  - - [1408, 1, 1, 3328, 1408, 1408, 1408, 1]
    - [104, 61.0]
  - - [1856, 1, 1, 3328, 1856, 1856, 1856, 1]
    - [101, 62.0]
  - - [2368, 1, 1, 3328, 2368, 2368, 2368, 1]
    - [97, 74.0]
  - - [2944, 1, 1, 3328, 2944, 2944, 2944, 1]
    - [90, 71.0]
  - - [3584, 1, 1, 3328, 3584, 3584, 3584, 1]
    - [102, 74.0]
  - - [4288, 1, 1, 3328, 4288, 4288, 4288, 1]
    - [101, 79.0]
  - - [5056, 1, 1, 3328, 5056, 5056, 5056, 1]
    - [101, 83.0]
  - - [5888, 1, 1, 3328, 5888, 5888, 5888, 1]
    - [101, 82.0]
  - - [6784, 1, 1, 3328, 6784, 6784, 6784, 1]
    - [101, 87.0]
  - - [64, 64, 1, 1, 64, 64, 64, 64]
    - [66, 1.0]
  - - [128, 64, 1, 1, 128, 128, 128, 64]
    - [64, 1.0]
  - - [256, 64, 1, 1, 256, 256, 256, 64]
    - [68, 4.0]
  - - [448, 64, 1, 1, 448, 448, 448, 64]
    - [77, 6.0]
  - - [704, 64, 1, 1, 704, 704, 704, 64]
    - [66, 6.0]
  - - [1024, 64, 1, 1, 1024, 1024, 1024, 64]
    - [66, 9.0]
  - - [1408, 64, 1, 1, 1408, 1408, 1408, 64]
    - [66, 13.0]
  - - [1856, 64, 1, 1, 1856, 1856, 1856, 64]
    - [66, 17.0]
  - - [2368, 64, 1, 1, 2368, 2368, 2368, 64]
    - [72, 20.0]
  - - [2944, 64, 1, 1, 2944, 2944, 2944, 64]
    - [66, 24.0]
  - - [3584, 64, 1, 1, 3584, 3584, 3584, 64]
    - [70, 42.0]
  - - [4288, 64, 1, 1, 4288, 4288, 4288, 64]
    - [68, 39.0]
  - - [5056, 64, 1, 1, 5056, 5056, 5056, 64]
    - [72, 52.0]
  - - [5888, 64, 1, 1, 5888, 5888, 5888, 64]
    - [70, 62.0]
  - - [6784, 64, 1, 1, 6784, 6784, 6784, 64]
    - [66, 70.0]
  - - [64, 128, 1, 1, 64, 64, 64, 128]
    - [64, 1.0]
  - - [128, 128, 1, 1, 128, 128, 128, 128]
    - [74, 4.0]
  - - [256, 128, 1, 1, 256, 256, 256, 128]
    - [67, 6.0]
  - - [448, 128, 1, 1, 448, 448, 448, 128]
    - [72, 9.0]
  - - [704, 128, 1, 1, 704, 704, 704, 128]
    - [66, 13.0]
  - - [1024, 128, 1, 1, 1024, 1024, 1024, 128]
    - [72, 20.0]
  - - [1408, 128, 1, 1, 1408, 1408, 1408, 128]
    - [70, 27.0]
  - - [1856, 128, 1, 1, 1856, 1856, 1856, 128]
    - [72, 59.0]
  - - [2368, 128, 1, 1, 2368, 2368, 2368, 128]
    - [66, 49.0]
  - - [2944, 128, 1, 1, 2944, 2944, 2944, 128]
    - [66, 61.0]
  - - [3584, 128, 1, 1, 3584, 3584, 3584, 128]
    - [66, 74.0]
  - - [4288, 128, 1, 1, 4288, 4288, 4288, 128]
    - [70, 81.0]
  - - [5056, 128, 1, 1, 5056, 5056, 5056, 128]
    - [68, 95.0]
  - - [5888, 128, 1, 1, 5888, 5888, 5888, 128]
    - [68, 105.0]
  - - [6784, 128, 1, 1, 6784, 6784, 6784, 128]
    - [68, 112.0]
  - - [64, 256, 1, 1, 64, 64, 64, 256]
    - [66, 2.0]
  - - [128, 256, 1, 1, 128, 128, 128, 256]
    - [75, 6.0]
  - - [256, 256, 1, 1, 256, 256, 256, 256]
    - [70, 10.0]
  - - [448, 256, 1, 1, 448, 448, 448, 256]
    - [70, 17.0]
  - - [704, 256, 1, 1, 704, 704, 704, 256]
    - [66, 26.0]
  - - [1024, 256, 1, 1, 1024, 1024, 1024, 256]
    - [66, 47.0]
  - - [1408, 256, 1, 1, 1408, 1408, 1408, 256]
    - [66, 50.0]
  - - [1856, 256, 1, 1, 1856, 1856, 1856, 256]
    - [68, 65.0]
  - - [2368, 256, 1, 1, 2368, 2368, 2368, 256]
    - [70, 77.0]
  - - [2944, 256, 1, 1, 2944, 2944, 2944, 256]
    - [68, 89.0]
  - - [3584, 256, 1, 1, 3584, 3584, 3584, 256]
    - [66, 98.0]
  - - [4288, 256, 1, 1, 4288, 4288, 4288, 256]
    - [66, 111.0]
  - - [5056, 256, 1, 1, 5056, 5056, 5056, 256]
    - [67, 122.0]
  - - [5888, 256, 1, 1, 5888, 5888, 5888, 256]
    - [73, 138.0]
  - - [6784, 256, 1, 1, 6784, 6784, 6784, 256]
    - [68, 143.0]
  - - [64, 448, 1, 1, 64, 64, 64, 448]
    - [73, 5.0]
  - - [128, 448, 1, 1, 128, 128, 128, 448]
    - [66, 8.0]
  - - [256, 448, 1, 1, 256, 256, 256, 448]
    - [66, 16.0]
  - - [448, 448, 1, 1, 448, 448, 448, 448]
    - [72, 24.0]
  - - [704, 448, 1, 1, 704, 704, 704, 448]
    - [66, 44.0]
  - - [1024, 448, 1, 1, 1024, 1024, 1024, 448]
    - [78, 62.0]
  - - [1408, 448, 1, 1, 1408, 1408, 1408, 448]
    - [66, 74.0]
  - - [1856, 448, 1, 1, 1856, 1856, 1856, 448]
    - [68, 97.0]
  - - [2368, 448, 1, 1, 2368, 2368, 2368, 448]
    - [70, 109.0]
  - - [2944, 448, 1, 1, 2944, 2944, 2944, 448]
    - [68, 123.0]
  - - [3584, 448, 1, 1, 3584, 3584, 3584, 448]
    - [66, 134.0]
  - - [4288, 448, 1, 1, 4288, 4288, 4288, 448]
    - [72, 147.0]
  - - [5056, 448, 1, 1, 5056, 5056, 5056, 448]
    - [72, 161.0]
  - - [5888, 448, 1, 1, 5888, 5888, 5888, 448]
    - [66, 166.0]
  - - [6784, 448, 1, 1, 6784, 6784, 6784, 448]
    - [72, 176.0]
  - - [64, 704, 1, 1, 64, 64, 64, 704]
    - [66, 6.0]
  - - [128, 704, 1, 1, 128, 128, 128, 704]
    - [68, 13.0]
  - - [256, 704, 1, 1, 256, 256, 256, 704]
    - [72, 23.0]
  - - [448, 704, 1, 1, 448, 448, 448, 704]
    - [68, 53.0]
  - - [704, 704, 1, 1, 704, 704, 704, 704]
    - [66, 79.0]
  - - [1024, 704, 1, 1, 1024, 1024, 1024, 704]
    - [76, 86.0]
  - - [1408, 704, 1, 1, 1408, 1408, 1408, 704]
    - [70, 114.0]
  - - [1856, 704, 1, 1, 1856, 1856, 1856, 704]
    - [68, 126.0]
  - - [2368, 704, 1, 1, 2368, 2368, 2368, 704]
    - [72, 144.0]
  - - [2944, 704, 1, 1, 2944, 2944, 2944, 704]
    - [72, 158.0]
  - - [3584, 704, 1, 1, 3584, 3584, 3584, 704]
    - [66, 163.0]
  - - [4288, 704, 1, 1, 4288, 4288, 4288, 704]
    - [70, 190.0]
  - - [5056, 704, 1, 1, 5056, 5056, 5056, 704]
    - [68, 194.0]
  - - [5888, 704, 1, 1, 5888, 5888, 5888, 704]
    - [65, 201.0]
  - - [6784, 704, 1, 1, 6784, 6784, 6784, 704]
    - [65, 212.0]
  - - [64, 1024, 1, 1, 64, 64, 64, 1024]
    - [72, 10.0]
  - - [128, 1024, 1, 1, 128, 128, 128, 1024]
    - [66, 19.0]
  - - [256, 1024, 1, 1, 256, 256, 256, 1024]
    - [66, 66.0]
  - - [448, 1024, 1, 1, 448, 448, 448, 1024]
    - [72, 80.0]
  - - [704, 1024, 1, 1, 704, 704, 704, 1024]
    - [70, 99.0]
  - - [1024, 1024, 1, 1, 1024, 1024, 1024, 1024]
    - [69, 120.0]
  - - [1408, 1024, 1, 1, 1408, 1408, 1408, 1024]
    - [71, 151.0]
  - - [1856, 1024, 1, 1, 1856, 1856, 1856, 1024]
    - [70, 162.0]
  - - [2368, 1024, 1, 1, 2368, 2368, 2368, 1024]
    - [68, 178.0]
  - - [2944, 1024, 1, 1, 2944, 2944, 2944, 1024]
    - [65, 192.0]
  - - [3584, 1024, 1, 1, 3584, 3584, 3584, 1024]
    - [70, 197.0]
  - - [4288, 1024, 1, 1, 4288, 4288, 4288, 1024]
    - [65, 206.0]
  - - [5056, 1024, 1, 1, 5056, 5056, 5056, 1024]
    - [65, 217.0]
  - - [5888, 1024, 1, 1, 5888, 5888, 5888, 1024]
    - [65, 230.0]
  - - [6784, 1024, 1, 1, 6784, 6784, 6784, 1024]
    - [65, 236.0]
  - - [64, 1408, 1, 1, 64, 64, 64, 1408]
    - [66, 13.0]
  - - [128, 1408, 1, 1, 128, 128, 128, 1408]
    - [66, 26.0]
  - - [256, 1408, 1, 1, 256, 256, 256, 1408]
    - [66, 63.0]
  - - [448, 1408, 1, 1, 448, 448, 448, 1408]
    - [66, 97.0]
  - - [704, 1408, 1, 1, 704, 704, 704, 1408]
    - [68, 123.0]
  - - [1024, 1408, 1, 1, 1024, 1024, 1024, 1408]
    - [65, 141.0]
  - - [1408, 1408, 1, 1, 1408, 1408, 1408, 1408]
    - [70, 164.0]
  - - [1856, 1408, 1, 1, 1856, 1856, 1856, 1408]
    - [72, 179.0]
  - - [2368, 1408, 1, 1, 2368, 2368, 2368, 1408]
    - [65, 201.0]
  - - [2944, 1408, 1, 1, 2944, 2944, 2944, 1408]
    - [65, 213.0]
  - - [3584, 1408, 1, 1, 3584, 3584, 3584, 1408]
    - [65, 217.0]
  - - [4288, 1408, 1, 1, 4288, 4288, 4288, 1408]
    - [65, 223.0]
  - - [5056, 1408, 1, 1, 5056, 5056, 5056, 1408]
    - [65, 244.0]
  - - [5888, 1408, 1, 1, 5888, 5888, 5888, 1408]
    - [65, 240.0]
  - - [6784, 1408, 1, 1, 6784, 6784, 6784, 1408]
    - [65, 243.0]
  - - [64, 1856, 1, 1, 64, 64, 64, 1856]
    - [72, 17.0]
  - - [128, 1856, 1, 1, 128, 128, 128, 1856]
    - [70, 58.0]
  - - [256, 1856, 1, 1, 256, 256, 256, 1856]
    - [68, 84.0]
  - - [448, 1856, 1, 1, 448, 448, 448, 1856]
    - [72, 109.0]
  - - [704, 1856, 1, 1, 704, 704, 704, 1856]
    - [72, 134.0]
  - - [1024, 1856, 1, 1, 1024, 1024, 1024, 1856]
    - [72, 155.0]
  - - [1408, 1856, 1, 1, 1408, 1408, 1408, 1856]
    - [72, 182.0]
  - - [1856, 1856, 1, 1, 1856, 1856, 1856, 1856]
    - [68, 197.0]
  - - [2368, 1856, 1, 1, 2368, 2368, 2368, 1856]
    - [65, 207.0]
  - - [2944, 1856, 1, 1, 2944, 2944, 2944, 1856]
    - [65, 219.0]
  - - [3584, 1856, 1, 1, 3584, 3584, 3584, 1856]
    - [71, 217.0]
  - - [4288, 1856, 1, 1, 4288, 4288, 4288, 1856]
    - [65, 233.0]
  - - [5056, 1856, 1, 1, 5056, 5056, 5056, 1856]
    - [65, 252.0]
  - - [5888, 1856, 1, 1, 5888, 5888, 5888, 1856]
    - [65, 250.0]
  - - [6784, 1856, 1, 1, 6784, 6784, 6784, 1856]
    - [65, 260.0]
  - - [64, 2368, 1, 1, 64, 64, 64, 2368]
    - [66, 20.0]
  - - [128, 2368, 1, 1, 128, 128, 128, 2368]
    - [70, 53.0]
  - - [256, 2368, 1, 1, 256, 256, 256, 2368]
    - [70, 95.0]
  - - [448, 2368, 1, 1, 448, 448, 448, 2368]
    - [72, 125.0]
  - - [704, 2368, 1, 1, 704, 704, 704, 2368]
    - [70, 150.0]
  - - [1024, 2368, 1, 1, 1024, 1024, 1024, 2368]
    - [68, 161.0]
  - - [1408, 2368, 1, 1, 1408, 1408, 1408, 2368]
    - [72, 192.0]
  - - [1856, 2368, 1, 1, 1856, 1856, 1856, 2368]
    - [65, 201.0]
  - - [2368, 2368, 1, 1, 2368, 2368, 2368, 2368]
    - [65, 217.0]
  - - [2944, 2368, 1, 1, 2944, 2944, 2944, 2368]
    - [65, 230.0]
  - - [3584, 2368, 1, 1, 3584, 3584, 3584, 2368]
    - [65, 227.0]
  - - [4288, 2368, 1, 1, 4288, 4288, 4288, 2368]
    - [65, 239.0]
  - - [5056, 2368, 1, 1, 5056, 5056, 5056, 2368]
    - [65, 251.0]
  - - [5888, 2368, 1, 1, 5888, 5888, 5888, 2368]
    - [65, 261.0]
  - - [6784, 2368, 1, 1, 6784, 6784, 6784, 2368]
    - [65, 263.0]
  - - [64, 2944, 1, 1, 64, 64, 64, 2944]
    - [70, 27.0]
  - - [128, 2944, 1, 1, 128, 128, 128, 2944]
    - [66, 65.0]
  - - [256, 2944, 1, 1, 256, 256, 256, 2944]
    - [72, 118.0]
  - - [448, 2944, 1, 1, 448, 448, 448, 2944]
    - [66, 134.0]
  - - [704, 2944, 1, 1, 704, 704, 704, 2944]
    - [65, 151.0]
  - - [1024, 2944, 1, 1, 1024, 1024, 1024, 2944]
    - [70, 167.0]
  - - [1408, 2944, 1, 1, 1408, 1408, 1408, 2944]
    - [65, 199.0]
  - - [1856, 2944, 1, 1, 1856, 1856, 1856, 2944]
    - [65, 219.0]
  - - [2368, 2944, 1, 1, 2368, 2368, 2368, 2944]
    - [65, 241.0]
  - - [2944, 2944, 1, 1, 2944, 2944, 2944, 2944]
    - [65, 239.0]
  - - [3584, 2944, 1, 1, 3584, 3584, 3584, 2944]
    - [65, 248.0]
  - - [4288, 2944, 1, 1, 4288, 4288, 4288, 2944]
    - [65, 255.0]
  - - [5056, 2944, 1, 1, 5056, 5056, 5056, 2944]
    - [65, 263.0]
  - - [5888, 2944, 1, 1, 5888, 5888, 5888, 2944]
    - [65, 267.0]
  - - [6784, 2944, 1, 1, 6784, 6784, 6784, 2944]
    - [65, 272.0]
  - - [64, 3584, 1, 1, 64, 64, 64, 3584]
    - [68, 43.0]
  - - [128, 3584, 1, 1, 128, 128, 128, 3584]
    - [72, 66.0]
  - - [256, 3584, 1, 1, 256, 256, 256, 3584]
    - [72, 104.0]
  - - [448, 3584, 1, 1, 448, 448, 448, 3584]
    - [70, 136.0]
  - - [704, 3584, 1, 1, 704, 704, 704, 3584]
    - [72, 160.0]
  - - [1024, 3584, 1, 1, 1024, 1024, 1024, 3584]
    - [65, 181.0]
  - - [1408, 3584, 1, 1, 1408, 1408, 1408, 3584]
    - [65, 215.0]
  - - [1856, 3584, 1, 1, 1856, 1856, 1856, 3584]
    - [65, 232.0]
  - - [2368, 3584, 1, 1, 2368, 2368, 2368, 3584]
    - [65, 238.0]
  - - [2944, 3584, 1, 1, 2944, 2944, 2944, 3584]
    - [65, 249.0]
  - - [3584, 3584, 1, 1, 3584, 3584, 3584, 3584]
    - [65, 254.0]
  - - [4288, 3584, 1, 1, 4288, 4288, 4288, 3584]
    - [65, 260.0]
  - - [5056, 3584, 1, 1, 5056, 5056, 5056, 3584]
    - [65, 280.0]
  - - [5888, 3584, 1, 1, 5888, 5888, 5888, 3584]
    - [65, 276.0]
  - - [6784, 3584, 1, 1, 6784, 6784, 6784, 3584]
    - [65, 282.0]
  - - [64, 4288, 1, 1, 64, 64, 64, 4288]
    - [66, 47.0]
  - - [128, 4288, 1, 1, 128, 128, 128, 4288]
    - [68, 72.0]
  - - [256, 4288, 1, 1, 256, 256, 256, 4288]
    - [68, 115.0]
  - - [448, 4288, 1, 1, 448, 448, 448, 4288]
    - [68, 148.0]
  - - [704, 4288, 1, 1, 704, 704, 704, 4288]
    - [66, 181.0]
  - - [1024, 4288, 1, 1, 1024, 1024, 1024, 4288]
    - [68, 188.0]
  - - [1408, 4288, 1, 1, 1408, 1408, 1408, 4288]
    - [65, 212.0]
  - - [1856, 4288, 1, 1, 1856, 1856, 1856, 4288]
    - [65, 240.0]
  - - [2368, 4288, 1, 1, 2368, 2368, 2368, 4288]
    - [65, 250.0]
  - - [2944, 4288, 1, 1, 2944, 2944, 2944, 4288]
    - [65, 257.0]
  - - [3584, 4288, 1, 1, 3584, 3584, 3584, 4288]
    - [65, 257.0]
  - - [4288, 4288, 1, 1, 4288, 4288, 4288, 4288]
    - [65, 261.0]
  - - [5056, 4288, 1, 1, 5056, 5056, 5056, 4288]
    - [65, 277.0]
  - - [5888, 4288, 1, 1, 5888, 5888, 5888, 4288]
    - [65, 274.0]
  - - [6784, 4288, 1, 1, 6784, 6784, 6784, 4288]
    - [65, 281.0]
  - - [64, 5056, 1, 1, 64, 64, 64, 5056]
    - [68, 47.0]
  - - [128, 5056, 1, 1, 128, 128, 128, 5056]
    - [70, 86.0]
  - - [256, 5056, 1, 1, 256, 256, 256, 5056]
    - [68, 124.0]
  - - [448, 5056, 1, 1, 448, 448, 448, 5056]
    - [68, 158.0]
  - - [704, 5056, 1, 1, 704, 704, 704, 5056]
    - [65, 189.0]
  - - [1024, 5056, 1, 1, 1024, 1024, 1024, 5056]
    - [65, 199.0]
  - - [1408, 5056, 1, 1, 1408, 1408, 1408, 5056]
    - [65, 225.0]
  - - [1856, 5056, 1, 1, 1856, 1856, 1856, 5056]
    - [65, 247.0]
  - - [2368, 5056, 1, 1, 2368, 2368, 2368, 5056]
    - [65, 258.0]
  - - [2944, 5056, 1, 1, 2944, 2944, 2944, 5056]
    - [65, 263.0]
  - - [3584, 5056, 1, 1, 3584, 3584, 3584, 5056]
    - [65, 262.0]
  - - [4288, 5056, 1, 1, 4288, 4288, 4288, 5056]
    - [65, 270.0]
  - - [5056, 5056, 1, 1, 5056, 5056, 5056, 5056]
    - [65, 279.0]
  - - [5888, 5056, 1, 1, 5888, 5888, 5888, 5056]
    - [65, 277.0]
  - - [6784, 5056, 1, 1, 6784, 6784, 6784, 5056]
    - [65, 282.0]
  - - [64, 5888, 1, 1, 64, 64, 64, 5888]
    - [68, 55.0]
  - - [128, 5888, 1, 1, 128, 128, 128, 5888]
    - [78, 99.0]
  - - [256, 5888, 1, 1, 256, 256, 256, 5888]
    - [66, 138.0]
  - - [448, 5888, 1, 1, 448, 448, 448, 5888]
    - [66, 168.0]
  - - [704, 5888, 1, 1, 704, 704, 704, 5888]
    - [67, 206.0]
  - - [1024, 5888, 1, 1, 1024, 1024, 1024, 5888]
    - [65, 206.0]
  - - [1408, 5888, 1, 1, 1408, 1408, 1408, 5888]
    - [65, 233.0]
  - - [1856, 5888, 1, 1, 1856, 1856, 1856, 5888]
    - [65, 256.0]
  - - [2368, 5888, 1, 1, 2368, 2368, 2368, 5888]
    - [65, 264.0]
  - - [2944, 5888, 1, 1, 2944, 2944, 2944, 5888]
    - [65, 267.0]
  - - [3584, 5888, 1, 1, 3584, 3584, 3584, 5888]
    - [65, 272.0]
  - - [4288, 5888, 1, 1, 4288, 4288, 4288, 5888]
    - [65, 276.0]
  - - [5056, 5888, 1, 1, 5056, 5056, 5056, 5888]
    - [65, 286.0]
  - - [5888, 5888, 1, 1, 5888, 5888, 5888, 5888]
    - [65, 284.0]
  - - [6784, 5888, 1, 1, 6784, 6784, 6784, 5888]
    - [65, 289.0]
  - - [64, 6784, 1, 1, 64, 64, 64, 6784]
    - [68, 74.0]
  - - [128, 6784, 1, 1, 128, 128, 128, 6784]
    - [68, 123.0]
  - - [256, 6784, 1, 1, 256, 256, 256, 6784]
    - [68, 164.0]
  - - [448, 6784, 1, 1, 448, 448, 448, 6784]
    - [68, 192.0]
  - - [704, 6784, 1, 1, 704, 704, 704, 6784]
    - [65, 222.0]
  - - [1024, 6784, 1, 1, 1024, 1024, 1024, 6784]
    - [65, 229.0]
  - - [1408, 6784, 1, 1, 1408, 1408, 1408, 6784]
    - [65, 250.0]
  - - [1856, 6784, 1, 1, 1856, 1856, 1856, 6784]
    - [65, 268.0]
  - - [2368, 6784, 1, 1, 2368, 2368, 2368, 6784]
    - [65, 276.0]
  - - [2944, 6784, 1, 1, 2944, 2944, 2944, 6784]
    - [65, 279.0]
  - - [3584, 6784, 1, 1, 3584, 3584, 3584, 6784]
    - [65, 274.0]
  - - [4288, 6784, 1, 1, 4288, 4288, 4288, 6784]
    - [65, 280.0]
  - - [5056, 6784, 1, 1, 5056, 5056, 5056, 6784]
    - [65, 287.0]
  - - [5888, 6784, 1, 1, 5888, 5888, 5888, 6784]
    - [65, 283.0]
  - - [6784, 6784, 1, 1, 6784, 6784, 6784, 6784]
    - [65, 292.0]
  - - [1, 1, 1, 256, 1, 1, 1, 1]
    - [68, 0.00903954815805965]
  - - [1, 1, 1, 1280, 1, 1, 1, 1]
    - [87, 0.04]
  - - [1, 1, 1, 3328, 1, 1, 1, 1]
    - [104, 0.07]
  - - [1, 64, 1, 1, 1, 1, 1, 64]
    - [66, 0.01]
  - - [1, 128, 1, 1, 1, 1, 1, 128]
    - [65, 0.02]
  - - [1, 256, 1, 1, 1, 1, 1, 256]
    - [70, 0.08]
  - - [1, 448, 1, 1, 1, 1, 1, 448]
    - [65, 0.11]
  - - [1, 704, 1, 1, 1, 1, 1, 704]
    - [70, 0.14]
  - - [1, 1024, 1, 1, 1, 1, 1, 1024]
    - [68, 0.2]
  - - [1, 1408, 1, 1, 1, 1, 1, 1408]
    - [72, 0.27]
  - - [1, 1856, 1, 1, 1, 1, 1, 1856]
    - [68, 0.35]
  - - [1, 2368, 1, 1, 1, 1, 1, 2368]
    - [72, 0.41]
  - - [1, 2944, 1, 1, 1, 1, 1, 2944]
    - [72, 0.47]
  - - [1, 3584, 1, 1, 1, 1, 1, 3584]
    - [66, 1.0]
  - - [1, 4288, 1, 1, 1, 1, 1, 4288]
    - [65, 1.0]
  - - [1, 5056, 1, 1, 1, 1, 1, 5056]
    - [65, 1.0]
  - - [1, 5888, 1, 1, 1, 1, 1, 5888]
    - [64, 1.0]
  - - [1, 6784, 1, 1, 1, 1, 1, 6784]
    - [68, 2.0]
  - - [64, 1, 1, 1, 64, 64, 64, 1]
    - [81, 0.02]
  - - [128, 1, 1, 1, 128, 128, 128, 1]
    - [66, 0.03]
  - - [256, 1, 1, 1, 256, 256, 256, 1]
    - [78, 0.09]
  - - [448, 1, 1, 1, 448, 448, 448, 1]
    - [66, 0.11]
  - - [704, 1, 1, 1, 704, 704, 704, 1]
    - [66, 0.17]
  - - [1024, 1, 1, 1, 1024, 1024, 1024, 1]
    - [66, 0.23]
  - - [1408, 1, 1, 1, 1408, 1408, 1408, 1]
    - [70, 0.31]
  - - [1856, 1, 1, 1, 1856, 1856, 1856, 1]
    - [70, 0.41]
  - - [2368, 1, 1, 1, 2368, 2368, 2368, 1]
    - [66, 1.0]
  - - [2944, 1, 1, 1, 2944, 2944, 2944, 1]
    - [66, 1.0]
  - - [3584, 1, 1, 1, 3584, 3584, 3584, 1]
    - [65, 1.0]
  - - [4288, 1, 1, 1, 4288, 4288, 4288, 1]
    - [64, 1.0]
  - - [5056, 1, 1, 1, 5056, 5056, 5056, 1]
    - [64, 1.0]
  - - [5888, 1, 1, 1, 5888, 5888, 5888, 1]
    - [64, 1.0]
  - - [6784, 1, 1, 1, 6784, 6784, 6784, 1]
    - [66, 2.0]
- null
