library/src/blas3/Tensile/Logic/aldebaran/vega10_Cijk_Alik_Bjlk_HBH_GB.yaml
- {MinimumRequiredVersion: 4.26.0}
- vega10
- gfx900
- [Device 6863, Device 6862, Device 687f, Device 6860, Device 6861, 'Vega 10 XTX [Radeon
    SolutionIndex: 0
    SolutionNameMin: Cijk_Alik_Bjlk_HBH_GB_MT32x32x8_SN_GRVW4_LRVW4_TT4_4_VW4_WG8_8_1_WGM1
    SolutionIndex: 1
    SolutionNameMin: Cijk_Alik_Bjlk_HBH_GB_MT64x128x8_SN_GRVW4_LRVW4_TT4_8_VW4_WG16_16_1_WGM1
    SolutionIndex: 2
    SolutionNameMin: Cijk_Alik_Bjlk_HBH_GB_MT32x32x16_SN_GRVW4_LRVW4_TT4_4_VW4_WG8_8_1_WGM1
    SolutionIndex: 3
    SolutionNameMin: Cijk_Alik_Bjlk_HBH_GB_MT64x64x16_SN_GRVW4_LRVW4_TT4_4_VW4_WG16_16_1_WGM1
    SolutionIndex: 4
    SolutionNameMin: Cijk_Alik_Bjlk_HBH_GB_MT128x64x16_SN_GRVW4_LRVW4_TT8_4_VW4_WG16_16_1_WGM1
    SolutionIndex: 5
    SolutionNameMin: Cijk_Alik_Bjlk_HBH_GB_MT64x128x16_SN_GRVW4_LRVW4_TT4_8_VW4_WG16_16_1_WGM1
    SolutionIndex: 6
    SolutionNameMin: Cijk_Alik_Bjlk_HBH_GB_MT64x64x8_SN_GRVW2_LRVW2_TT4_4_VW2_WG16_16_1_WGM1
    SolutionIndex: 7
    SolutionNameMin: Cijk_Alik_Bjlk_HBH_GB_MT64x128x16_SN_GRVW2_LRVW2_TT4_8_VW2_WG16_16_1_WGM1
    SolutionIndex: 8
    SolutionNameMin: Cijk_Alik_Bjlk_HBH_GB_MT32x32x8_SN_GRVW4_LRVW4_TT4_4_VW4_WG8_8_1_WGM8
    SolutionIndex: 9
    SolutionNameMin: Cijk_Alik_Bjlk_HBH_GB_MT64x128x8_SN_GRVW4_LRVW4_TT4_8_VW4_WG16_16_1_WGM8
    SolutionIndex: 10
    SolutionNameMin: Cijk_Alik_Bjlk_HBH_GB_MT32x32x16_SN_GRVW4_LRVW4_TT4_4_VW4_WG8_8_1_WGM8
    SolutionIndex: 11
    SolutionNameMin: Cijk_Alik_Bjlk_HBH_GB_MT64x64x16_SN_GRVW4_LRVW4_TT4_4_VW4_WG16_16_1_WGM8
    SolutionIndex: 12
    SolutionNameMin: Cijk_Alik_Bjlk_HBH_GB_MT128x64x16_SN_GRVW4_LRVW4_TT8_4_VW4_WG16_16_1_WGM8
    SolutionIndex: 13
    SolutionNameMin: Cijk_Alik_Bjlk_HBH_GB_MT64x128x16_SN_GRVW4_LRVW4_TT4_8_VW4_WG16_16_1_WGM8
    SolutionIndex: 14
    SolutionNameMin: Cijk_Alik_Bjlk_HBH_GB_MT32x32x32_SN_GRVW4_LRVW4_TT4_4_VW4_WG8_8_1_WGM8
- - - [32, 32, 8, 32, 32, 32, 32, 32]
    - [0, 60.0]
  - - [32, 32, 8, 64, 32, 32, 64, 32]
    - [0, 92.0]
  - - [32, 32, 8, 128, 32, 32, 128, 32]
    - [0, 128.0]
  - - [32, 32, 8, 256, 32, 32, 256, 32]
    - [8, 155.0]
  - - [32, 32, 8, 512, 32, 32, 512, 32]
    - [10, 177.0]
  - - [32, 64, 8, 32, 32, 32, 32, 64]
    - [0, 127.0]
  - - [32, 64, 8, 64, 32, 32, 64, 64]
    - [0, 193.0]
  - - [32, 64, 8, 128, 32, 32, 128, 64]
    - [8, 260.0]
  - - [32, 64, 8, 256, 32, 32, 256, 64]
    - [8, 315.0]
  - - [32, 64, 8, 512, 32, 32, 512, 64]
    - [10, 361.0]
  - - [32, 128, 8, 32, 32, 32, 32, 128]
    - [0, 264.0]
  - - [32, 128, 8, 64, 32, 32, 64, 128]
    - [0, 397.0]
  - - [32, 128, 8, 128, 32, 32, 128, 128]
    - [8, 528.0]
  - - [32, 128, 8, 256, 32, 32, 256, 128]
    - [10, 645.0]
  - - [32, 128, 8, 512, 32, 32, 512, 128]
    - [10, 730.0]
  - - [32, 256, 8, 32, 32, 32, 32, 256]
    - [0, 530.0]
  - - [32, 256, 8, 64, 32, 32, 64, 256]
    - [0, 791.0]
  - - [32, 256, 8, 128, 32, 32, 128, 256]
    - [10, 1049.0]
  - - [32, 256, 8, 256, 32, 32, 256, 256]
    - [2, 1244.0]
  - - [32, 256, 8, 512, 32, 32, 512, 256]
    - [10, 1405.0]
  - - [32, 512, 8, 32, 32, 32, 32, 512]
    - [0, 924.0]
  - - [32, 512, 8, 64, 32, 32, 64, 512]
    - [0, 1284.0]
  - - [32, 512, 8, 128, 32, 32, 128, 512]
    - [2, 1508.0]
  - - [32, 512, 8, 256, 32, 32, 256, 512]
    - [8, 1605.0]
  - - [32, 512, 8, 512, 32, 32, 512, 512]
    - [2, 1708.0]
  - - [64, 32, 8, 32, 64, 64, 32, 32]
    - [0, 127.0]
  - - [64, 32, 8, 64, 64, 64, 64, 32]
    - [0, 193.0]
  - - [64, 32, 8, 128, 64, 64, 128, 32]
    - [0, 259.0]
  - - [64, 32, 8, 256, 64, 64, 256, 32]
    - [10, 319.0]
  - - [64, 32, 8, 512, 64, 64, 512, 32]
    - [10, 361.0]
  - - [64, 64, 8, 32, 64, 64, 32, 64]
    - [8, 260.0]
  - - [64, 64, 8, 64, 64, 64, 64, 64]
    - [8, 395.0]
  - - [64, 64, 8, 128, 64, 64, 128, 64]
    - [0, 525.0]
  - - [64, 64, 8, 256, 64, 64, 256, 64]
    - [10, 647.0]
  - - [64, 64, 8, 512, 64, 64, 512, 64]
    - [10, 729.0]
  - - [64, 128, 8, 32, 64, 64, 32, 128]
    - [0, 529.0]
  - - [64, 128, 8, 64, 64, 64, 64, 128]
    - [0, 801.0]
  - - [64, 128, 8, 128, 64, 64, 128, 128]
    - [0, 1043.0]
  - - [64, 128, 8, 256, 64, 64, 256, 128]
    - [11, 1246.0]
  - - [64, 128, 8, 512, 64, 64, 512, 128]
    - [10, 1424.0]
  - - [64, 256, 8, 32, 64, 64, 32, 256]
    - [3, 1004.0]
  - - [64, 256, 8, 64, 64, 64, 64, 256]
    - [11, 1494.0]
  - - [64, 256, 8, 128, 64, 64, 128, 256]
    - [3, 1944.0]
  - - [64, 256, 8, 256, 64, 64, 256, 256]
    - [3, 2150.0]
  - - [64, 256, 8, 512, 64, 64, 512, 256]
    - [3, 2447.0]
  - - [64, 512, 8, 32, 64, 64, 32, 512]
    - [11, 1721.0]
  - - [64, 512, 8, 64, 64, 64, 64, 512]
    - [11, 2362.0]
  - - [64, 512, 8, 128, 64, 64, 128, 512]
    - [3, 2742.0]
  - - [64, 512, 8, 256, 64, 64, 256, 512]
    - [1, 2683.0]
  - - [64, 512, 8, 512, 64, 64, 512, 512]
    - [5, 3093.0]
  - - [128, 32, 8, 32, 128, 128, 32, 32]
    - [8, 261.0]
  - - [128, 32, 8, 64, 128, 128, 64, 32]
    - [0, 394.0]
  - - [128, 32, 8, 128, 128, 128, 128, 32]
    - [0, 529.0]
  - - [128, 32, 8, 256, 128, 128, 256, 32]
    - [10, 643.0]
  - - [128, 32, 8, 512, 128, 128, 512, 32]
    - [10, 729.0]
  - - [128, 64, 8, 32, 128, 128, 32, 64]
    - [0, 526.0]
  - - [128, 64, 8, 64, 128, 128, 64, 64]
    - [8, 783.0]
  - - [128, 64, 8, 128, 128, 128, 128, 64]
    - [2, 1030.0]
  - - [128, 64, 8, 256, 128, 128, 256, 64]
    - [11, 1245.0]
  - - [128, 64, 8, 512, 128, 128, 512, 64]
    - [11, 1419.0]
  - - [128, 128, 8, 32, 128, 128, 32, 128]
    - [3, 997.0]
  - - [128, 128, 8, 64, 128, 128, 64, 128]
    - [11, 1476.0]
  - - [128, 128, 8, 128, 128, 128, 128, 128]
    - [3, 1919.0]
  - - [128, 128, 8, 256, 128, 128, 256, 128]
    - [3, 2165.0]
  - - [128, 128, 8, 512, 128, 128, 512, 128]
    - [3, 2440.0]
  - - [128, 256, 8, 32, 128, 128, 32, 256]
    - [3, 1705.0]
  - - [128, 256, 8, 64, 128, 128, 64, 256]
    - [11, 2372.0]
  - - [128, 256, 8, 128, 128, 128, 128, 256]
    - [3, 2721.0]
  - - [128, 256, 8, 256, 128, 128, 256, 256]
    - [4, 2771.0]
  - - [128, 256, 8, 512, 128, 128, 512, 256]
    - [4, 3054.0]
  - - [128, 512, 8, 32, 128, 128, 32, 512]
    - [3, 2900.0]
  - - [128, 512, 8, 64, 128, 128, 64, 512]
    - [6, 3787.0]
  - - [128, 512, 8, 128, 128, 128, 128, 512]
    - [3, 3539.0]
  - - [128, 512, 8, 256, 128, 128, 256, 512]
    - [11, 3903.0]
  - - [128, 512, 8, 512, 128, 128, 512, 512]
    - [3, 4215.0]
  - - [256, 32, 8, 32, 256, 256, 32, 32]
    - [8, 519.0]
  - - [256, 32, 8, 64, 256, 256, 64, 32]
    - [0, 782.0]
  - - [256, 32, 8, 128, 256, 256, 128, 32]
    - [8, 1020.0]
  - - [256, 32, 8, 256, 256, 256, 256, 32]
    - [2, 1240.0]
  - - [256, 32, 8, 512, 256, 256, 512, 32]
    - [2, 1389.0]
  - - [256, 64, 8, 32, 256, 256, 32, 64]
    - [11, 999.0]
  - - [256, 64, 8, 64, 256, 256, 64, 64]
    - [11, 1476.0]
  - - [256, 64, 8, 128, 256, 256, 128, 64]
    - [3, 1898.0]
  - - [256, 64, 8, 256, 256, 256, 256, 64]
    - [11, 2122.0]
  - - [256, 64, 8, 512, 256, 256, 512, 64]
    - [11, 2383.0]
  - - [256, 128, 8, 32, 256, 256, 32, 128]
    - [11, 1698.0]
  - - [256, 128, 8, 64, 256, 256, 64, 128]
    - [6, 2359.0]
  - - [256, 128, 8, 128, 256, 256, 128, 128]
    - [3, 2716.0]
  - - [256, 128, 8, 256, 256, 256, 256, 128]
    - [11, 2842.0]
  - - [256, 128, 8, 512, 256, 256, 512, 128]
    - [1, 3108.0]
  - - [256, 256, 8, 32, 256, 256, 32, 256]
    - [6, 2907.0]
  - - [256, 256, 8, 64, 256, 256, 64, 256]
    - [6, 3756.0]
  - - [256, 256, 8, 128, 256, 256, 128, 256]
    - [3, 3513.0]
  - - [256, 256, 8, 256, 256, 256, 256, 256]
    - [11, 3818.0]
  - - [256, 256, 8, 512, 256, 256, 512, 256]
    - [3, 4281.0]
  - - [256, 512, 8, 32, 256, 256, 32, 512]
    - [3, 3810.0]
  - - [256, 512, 8, 64, 256, 256, 64, 512]
    - [0, 3883.0]
  - - [256, 512, 8, 128, 256, 256, 128, 512]
    - [7, 3947.0]
  - - [256, 512, 8, 256, 256, 256, 256, 512]
    - [11, 4957.0]
  - - [256, 512, 8, 512, 256, 256, 512, 512]
    - [3, 5034.0]
  - - [512, 32, 8, 32, 512, 512, 32, 32]
    - [10, 993.0]
  - - [512, 32, 8, 64, 512, 512, 64, 32]
    - [0, 1475.0]
  - - [512, 32, 8, 128, 512, 512, 128, 32]
    - [10, 1852.0]
  - - [512, 32, 8, 256, 512, 512, 256, 32]
    - [2, 1999.0]
  - - [512, 32, 8, 512, 512, 512, 512, 32]
    - [14, 2222.0]
  - - [512, 64, 8, 32, 512, 512, 32, 64]
    - [3, 1660.0]
  - - [512, 64, 8, 64, 512, 512, 64, 64]
    - [11, 2357.0]
  - - [512, 64, 8, 128, 512, 512, 128, 64]
    - [3, 2765.0]
  - - [512, 64, 8, 256, 512, 512, 256, 64]
    - [11, 2751.0]
  - - [512, 64, 8, 512, 512, 512, 512, 64]
    - [11, 2990.0]
  - - [512, 128, 8, 32, 512, 512, 32, 128]
    - [6, 2712.0]
  - - [512, 128, 8, 64, 512, 512, 64, 128]
    - [6, 3668.0]
  - - [512, 128, 8, 128, 512, 512, 128, 128]
    - [11, 3407.0]
  - - [512, 128, 8, 256, 512, 512, 256, 128]
    - [11, 3956.0]
  - - [512, 128, 8, 512, 512, 512, 512, 128]
    - [3, 4438.0]
  - - [512, 256, 8, 32, 512, 512, 32, 256]
    - [3, 3800.0]
  - - [512, 256, 8, 64, 512, 512, 64, 256]
    - [1, 3897.0]
  - - [512, 256, 8, 128, 512, 512, 128, 256]
    - [12, 3950.0]
  - - [512, 256, 8, 256, 512, 512, 256, 256]
    - [3, 4912.0]
  - - [512, 256, 8, 512, 512, 512, 512, 256]
    - [11, 5004.0]
  - - [512, 512, 8, 32, 512, 512, 32, 512]
    - [1, 3905.0]
  - - [512, 512, 8, 64, 512, 512, 64, 512]
    - [9, 3877.0]
  - - [512, 512, 8, 128, 512, 512, 128, 512]
    - [4, 4904.0]
  - - [512, 512, 8, 256, 512, 512, 256, 512]
    - [13, 5506.0]
  - - [512, 512, 8, 512, 512, 512, 512, 512]
    - [1, 5727.0]
- null
