library/src/blas3/Tensile/Logic/aldebaran/vega20_Cijk_Alik_Bjlk_CB_GB.yaml
- {MinimumRequiredVersion: 4.26.0}
- vega20
- gfx906
- [Device 66a0, Device 66a1, Device 66a7, Device 66af, Vega 20]
    SolutionIndex: 0
    SolutionNameMin: Cijk_Alik_Bjlk_CB_GB_MT32x32x8_SN_AMAS3_GRVW2_LRVW2_TT4_4_VW2_WG8_8_1_WGM1
    SolutionIndex: 1
    SolutionNameMin: Cijk_Alik_Bjlk_CB_GB_MT64x64x8_SN_AMAS3_GRVW2_LRVW2_TT4_4_VW2_WG16_16_1_WGM1
    SolutionIndex: 2
    SolutionNameMin: Cijk_Alik_Bjlk_CB_GB_MT32x32x16_SN_AMAS3_GRVW2_LRVW2_TT4_4_VW2_WG8_8_1_WGM1
    SolutionIndex: 3
    SolutionNameMin: Cijk_Alik_Bjlk_CB_GB_MT64x64x16_SN_AMAS3_GRVW2_LRVW2_TT4_4_VW2_WG16_16_1_WGM1
    SolutionIndex: 4
    SolutionNameMin: Cijk_Alik_Bjlk_CB_GB_MT64x64x8_SN_AMAS0_GRVW1_LRVW1_TT4_4_VW1_WG16_16_1_WGM1
    SolutionIndex: 5
    SolutionNameMin: Cijk_Alik_Bjlk_CB_GB_MT32x32x8_SN_AMAS3_GRVW2_LRVW2_TT4_4_VW2_WG8_8_1_WGM8
    SolutionIndex: 6
    SolutionNameMin: Cijk_Alik_Bjlk_CB_GB_MT64x64x8_SN_AMAS3_GRVW2_LRVW2_TT4_4_VW2_WG16_16_1_WGM8
    SolutionIndex: 7
    SolutionNameMin: Cijk_Alik_Bjlk_CB_GB_MT64x64x16_SN_AMAS3_GRVW2_LRVW2_TT4_4_VW2_WG16_16_1_WGM8
    SolutionIndex: 8
    SolutionNameMin: Cijk_Alik_Bjlk_CB_GB_MT32x32x8_SN_AMAS0_GRVW1_LRVW1_TT4_4_VW1_WG8_8_1_WGM8
    SolutionIndex: 9
    SolutionNameMin: Cijk_Alik_Bjlk_CB_GB_MT64x64x8_SN_AMAS0_GRVW1_LRVW1_TT4_4_VW1_WG16_16_1_WGM8
- - - [32, 32, 8, 32, 32, 32, 32, 32]
    - [0, 45.0]
  - - [32, 32, 8, 64, 32, 32, 64, 32]
    - [0, 61.0]
  - - [32, 32, 8, 128, 32, 32, 128, 32]
    - [0, 74.0]
  - - [32, 32, 8, 256, 32, 32, 256, 32]
    - [0, 82.0]
  - - [32, 32, 8, 512, 32, 32, 512, 32]
    - [0, 87.0]
  - - [32, 64, 8, 32, 32, 32, 32, 64]
    - [0, 97.0]
  - - [32, 64, 8, 64, 32, 32, 64, 64]
    - [0, 127.0]
  - - [32, 64, 8, 128, 32, 32, 128, 64]
    - [0, 151.0]
  - - [32, 64, 8, 256, 32, 32, 256, 64]
    - [0, 166.0]
  - - [32, 64, 8, 512, 32, 32, 512, 64]
    - [5, 174.0]
  - - [32, 128, 8, 32, 32, 32, 32, 128]
    - [5, 200.0]
  - - [32, 128, 8, 64, 32, 32, 64, 128]
    - [0, 261.0]
  - - [32, 128, 8, 128, 32, 32, 128, 128]
    - [0, 306.0]
  - - [32, 128, 8, 256, 32, 32, 256, 128]
    - [5, 332.0]
  - - [32, 128, 8, 512, 32, 32, 512, 128]
    - [5, 346.0]
  - - [32, 256, 8, 32, 32, 32, 32, 256]
    - [0, 394.0]
  - - [32, 256, 8, 64, 32, 32, 64, 256]
    - [0, 514.0]
  - - [32, 256, 8, 128, 32, 32, 128, 256]
    - [5, 600.0]
  - - [32, 256, 8, 256, 32, 32, 256, 256]
    - [5, 658.0]
  - - [32, 256, 8, 512, 32, 32, 512, 256]
    - [5, 688.0]
  - - [32, 512, 8, 32, 32, 32, 32, 512]
    - [5, 746.0]
  - - [32, 512, 8, 64, 32, 32, 64, 512]
    - [0, 973.0]
  - - [32, 512, 8, 128, 32, 32, 128, 512]
    - [0, 1153.0]
  - - [32, 512, 8, 256, 32, 32, 256, 512]
    - [0, 1243.0]
  - - [32, 512, 8, 512, 32, 32, 512, 512]
    - [6, 1316.0]
  - - [64, 32, 8, 32, 64, 64, 32, 32]
    - [5, 97.0]
  - - [64, 32, 8, 64, 64, 64, 64, 32]
    - [5, 128.0]
  - - [64, 32, 8, 128, 64, 64, 128, 32]
    - [5, 152.0]
  - - [64, 32, 8, 256, 64, 64, 256, 32]
    - [5, 167.0]
  - - [64, 32, 8, 512, 64, 64, 512, 32]
    - [0, 174.0]
  - - [64, 64, 8, 32, 64, 64, 32, 64]
    - [0, 199.0]
  - - [64, 64, 8, 64, 64, 64, 64, 64]
    - [0, 261.0]
  - - [64, 64, 8, 128, 64, 64, 128, 64]
    - [5, 307.0]
  - - [64, 64, 8, 256, 64, 64, 256, 64]
    - [0, 334.0]
  - - [64, 64, 8, 512, 64, 64, 512, 64]
    - [5, 349.0]
  - - [64, 128, 8, 32, 64, 64, 32, 128]
    - [0, 394.0]
  - - [64, 128, 8, 64, 64, 64, 64, 128]
    - [0, 517.0]
  - - [64, 128, 8, 128, 64, 64, 128, 128]
    - [0, 608.0]
  - - [64, 128, 8, 256, 64, 64, 256, 128]
    - [0, 662.0]
  - - [64, 128, 8, 512, 64, 64, 512, 128]
    - [2, 699.0]
  - - [64, 256, 8, 32, 64, 64, 32, 256]
    - [0, 754.0]
  - - [64, 256, 8, 64, 64, 64, 64, 256]
    - [0, 996.0]
  - - [64, 256, 8, 128, 64, 64, 128, 256]
    - [0, 1178.0]
  - - [64, 256, 8, 256, 64, 64, 256, 256]
    - [0, 1306.0]
  - - [64, 256, 8, 512, 64, 64, 512, 256]
    - [0, 1373.0]
  - - [64, 512, 8, 32, 64, 64, 32, 512]
    - [0, 1357.0]
  - - [64, 512, 8, 64, 64, 64, 64, 512]
    - [6, 1780.0]
  - - [64, 512, 8, 128, 64, 64, 128, 512]
    - [0, 2183.0]
  - - [64, 512, 8, 256, 64, 64, 256, 512]
    - [1, 2384.0]
  - - [64, 512, 8, 512, 64, 64, 512, 512]
    - [3, 2075.0]
  - - [128, 32, 8, 32, 128, 128, 32, 32]
    - [0, 200.0]
  - - [128, 32, 8, 64, 128, 128, 64, 32]
    - [0, 260.0]
  - - [128, 32, 8, 128, 128, 128, 128, 32]
    - [5, 307.0]
  - - [128, 32, 8, 256, 128, 128, 256, 32]
    - [0, 333.0]
  - - [128, 32, 8, 512, 128, 128, 512, 32]
    - [5, 347.0]
  - - [128, 64, 8, 32, 128, 128, 32, 64]
    - [0, 394.0]
  - - [128, 64, 8, 64, 128, 128, 64, 64]
    - [0, 515.0]
  - - [128, 64, 8, 128, 128, 128, 128, 64]
    - [0, 609.0]
  - - [128, 64, 8, 256, 128, 128, 256, 64]
    - [0, 666.0]
  - - [128, 64, 8, 512, 128, 128, 512, 64]
    - [2, 701.0]
  - - [128, 128, 8, 32, 128, 128, 32, 128]
    - [0, 757.0]
  - - [128, 128, 8, 64, 128, 128, 64, 128]
    - [0, 998.0]
  - - [128, 128, 8, 128, 128, 128, 128, 128]
    - [0, 1181.0]
  - - [128, 128, 8, 256, 128, 128, 256, 128]
    - [0, 1315.0]
  - - [128, 128, 8, 512, 128, 128, 512, 128]
    - [0, 1393.0]
  - - [128, 256, 8, 32, 128, 128, 32, 256]
    - [0, 1382.0]
  - - [128, 256, 8, 64, 128, 128, 64, 256]
    - [0, 1840.0]
  - - [128, 256, 8, 128, 128, 128, 128, 256]
    - [0, 2199.0]
  - - [128, 256, 8, 256, 128, 128, 256, 256]
    - [0, 2480.0]
  - - [128, 256, 8, 512, 128, 128, 512, 256]
    - [1, 2584.0]
  - - [128, 512, 8, 32, 128, 128, 32, 512]
    - [0, 1844.0]
  - - [128, 512, 8, 64, 128, 128, 64, 512]
    - [4, 2461.0]
  - - [128, 512, 8, 128, 128, 128, 128, 512]
    - [4, 2898.0]
  - - [128, 512, 8, 256, 128, 128, 256, 512]
    - [4, 3174.0]
  - - [128, 512, 8, 512, 128, 128, 512, 512]
    - [3, 3018.0]
  - - [256, 32, 8, 32, 256, 256, 32, 32]
    - [0, 386.0]
  - - [256, 32, 8, 64, 256, 256, 64, 32]
    - [0, 507.0]
  - - [256, 32, 8, 128, 256, 256, 128, 32]
    - [5, 597.0]
  - - [256, 32, 8, 256, 256, 256, 256, 32]
    - [5, 661.0]
  - - [256, 32, 8, 512, 256, 256, 512, 32]
    - [2, 698.0]
  - - [256, 64, 8, 32, 256, 256, 32, 64]
    - [0, 717.0]
  - - [256, 64, 8, 64, 256, 256, 64, 64]
    - [0, 966.0]
  - - [256, 64, 8, 128, 256, 256, 128, 64]
    - [0, 1164.0]
  - - [256, 64, 8, 256, 256, 256, 256, 64]
    - [0, 1301.0]
  - - [256, 64, 8, 512, 256, 256, 512, 64]
    - [0, 1388.0]
  - - [256, 128, 8, 32, 256, 256, 32, 128]
    - [4, 1301.0]
  - - [256, 128, 8, 64, 256, 256, 64, 128]
    - [1, 1770.0]
  - - [256, 128, 8, 128, 256, 256, 128, 128]
    - [5, 2174.0]
  - - [256, 128, 8, 256, 256, 256, 256, 128]
    - [5, 2456.0]
  - - [256, 128, 8, 512, 256, 256, 512, 128]
    - [5, 2631.0]
  - - [256, 256, 8, 32, 256, 256, 32, 256]
    - [4, 1905.0]
  - - [256, 256, 8, 64, 256, 256, 64, 256]
    - [4, 2454.0]
  - - [256, 256, 8, 128, 256, 256, 128, 256]
    - [4, 2857.0]
  - - [256, 256, 8, 256, 256, 256, 256, 256]
    - [4, 3143.0]
  - - [256, 256, 8, 512, 256, 256, 512, 256]
    - [4, 3308.0]
  - - [256, 512, 8, 32, 256, 256, 32, 512]
    - [4, 2243.0]
  - - [256, 512, 8, 64, 256, 256, 64, 512]
    - [1, 2763.0]
  - - [256, 512, 8, 128, 256, 256, 128, 512]
    - [1, 3081.0]
  - - [256, 512, 8, 256, 256, 256, 256, 512]
    - [1, 3265.0]
  - - [256, 512, 8, 512, 256, 256, 512, 512]
    - [1, 3260.0]
  - - [512, 32, 8, 32, 512, 512, 32, 32]
    - [0, 662.0]
  - - [512, 32, 8, 64, 512, 512, 64, 32]
    - [0, 901.0]
  - - [512, 32, 8, 128, 512, 512, 128, 32]
    - [5, 1117.0]
  - - [512, 32, 8, 256, 512, 512, 256, 32]
    - [5, 1273.0]
  - - [512, 32, 8, 512, 512, 512, 512, 32]
    - [0, 1367.0]
  - - [512, 64, 8, 32, 512, 512, 32, 64]
    - [1, 1266.0]
  - - [512, 64, 8, 64, 512, 512, 64, 64]
    - [1, 1716.0]
  - - [512, 64, 8, 128, 512, 512, 128, 64]
    - [6, 2107.0]
  - - [512, 64, 8, 256, 512, 512, 256, 64]
    - [5, 2463.0]
  - - [512, 64, 8, 512, 512, 512, 512, 64]
    - [3, 2587.0]
  - - [512, 128, 8, 32, 512, 512, 32, 128]
    - [1, 1749.0]
  - - [512, 128, 8, 64, 512, 512, 64, 128]
    - [1, 2338.0]
  - - [512, 128, 8, 128, 512, 512, 128, 128]
    - [1, 2785.0]
  - - [512, 128, 8, 256, 512, 512, 256, 128]
    - [9, 3091.0]
  - - [512, 128, 8, 512, 512, 512, 512, 128]
    - [1, 3287.0]
  - - [512, 256, 8, 32, 512, 512, 32, 256]
    - [1, 2139.0]
  - - [512, 256, 8, 64, 512, 512, 64, 256]
    - [1, 2683.0]
  - - [512, 256, 8, 128, 512, 512, 128, 256]
    - [1, 3057.0]
  - - [512, 256, 8, 256, 512, 512, 256, 256]
    - [1, 3245.0]
  - - [512, 256, 8, 512, 512, 512, 512, 256]
    - [8, 3245.0]
  - - [512, 512, 8, 32, 512, 512, 32, 512]
    - [4, 2497.0]
  - - [512, 512, 8, 64, 512, 512, 64, 512]
    - [1, 3000.0]
  - - [512, 512, 8, 128, 512, 512, 128, 512]
    - [1, 3283.0]
  - - [512, 512, 8, 256, 512, 512, 256, 512]
    - [1, 3318.0]
  - - [512, 512, 8, 512, 512, 512, 512, 512]
    - [7, 3292.0]
- null
