library/src/blas3/Tensile/Logic/aldebaran/vega20_Cijk_Ailk_Bjlk_HBH_GB.yaml
- {MinimumRequiredVersion: 4.26.0}
- vega20
- gfx906
- [Device 66a0, Device 66a1, Device 66a7, Device 66af, Vega 20]
    SolutionIndex: 0
    SolutionNameMin: Cijk_Ailk_Bjlk_HBH_GB_MT32x32x8_SN_GRVW4_LRVW4_TT4_4_VW4_WG8_8_1_WGM1
    SolutionIndex: 1
    SolutionNameMin: Cijk_Ailk_Bjlk_HBH_GB_MT32x32x16_SN_GRVW4_LRVW4_TT4_4_VW4_WG8_8_1_WGM1
    SolutionIndex: 2
    SolutionNameMin: Cijk_Ailk_Bjlk_HBH_GB_MT64x64x16_SN_GRVW4_LRVW4_TT4_4_VW4_WG16_16_1_WGM1
    SolutionIndex: 3
    SolutionNameMin: Cijk_Ailk_Bjlk_HBH_GB_MT64x64x8_SN_GRVW2_LRVW2_TT4_4_VW2_WG16_16_1_WGM1
    SolutionIndex: 4
    SolutionNameMin: Cijk_Ailk_Bjlk_HBH_GB_MT128x64x8_SN_GRVW2_LRVW2_TT8_4_VW2_WG16_16_1_WGM1
    SolutionIndex: 5
    SolutionNameMin: Cijk_Ailk_Bjlk_HBH_GB_MT64x128x8_SN_GRVW2_LRVW2_TT4_8_VW2_WG16_16_1_WGM1
    SolutionIndex: 6
    SolutionNameMin: Cijk_Ailk_Bjlk_HBH_GB_MT64x64x16_SN_GRVW2_LRVW2_TT4_4_VW2_WG16_16_1_WGM1
    SolutionIndex: 7
    SolutionNameMin: Cijk_Ailk_Bjlk_HBH_GB_MT32x32x8_SN_GRVW4_LRVW4_TT4_4_VW4_WG8_8_1_WGM8
    SolutionIndex: 8
    SolutionNameMin: Cijk_Ailk_Bjlk_HBH_GB_MT32x32x16_SN_GRVW4_LRVW4_TT4_4_VW4_WG8_8_1_WGM8
    SolutionIndex: 9
    SolutionNameMin: Cijk_Ailk_Bjlk_HBH_GB_MT64x64x16_SN_GRVW4_LRVW4_TT4_4_VW4_WG16_16_1_WGM8
    SolutionIndex: 10
    SolutionNameMin: Cijk_Ailk_Bjlk_HBH_GB_MT64x128x16_SN_GRVW4_LRVW4_TT4_8_VW4_WG16_16_1_WGM8
- - - [32, 32, 8, 32, 32, 32, 32, 32]
    - [7, 74.0]
  - - [32, 32, 8, 64, 32, 32, 32, 32]
    - [0, 116.0]
  - - [32, 32, 8, 128, 32, 32, 32, 32]
    - [0, 157.0]
  - - [32, 32, 8, 256, 32, 32, 32, 32]
    - [0, 192.0]
  - - [32, 32, 8, 512, 32, 32, 32, 32]
    - [8, 218.0]
  - - [32, 64, 8, 32, 32, 32, 32, 64]
    - [0, 162.0]
  - - [32, 64, 8, 64, 32, 32, 32, 64]
    - [0, 244.0]
  - - [32, 64, 8, 128, 32, 32, 32, 64]
    - [0, 327.0]
  - - [32, 64, 8, 256, 32, 32, 32, 64]
    - [0, 393.0]
  - - [32, 64, 8, 512, 32, 32, 32, 64]
    - [8, 445.0]
  - - [32, 128, 8, 32, 32, 32, 32, 128]
    - [0, 334.0]
  - - [32, 128, 8, 64, 32, 32, 32, 128]
    - [0, 501.0]
  - - [32, 128, 8, 128, 32, 32, 32, 128]
    - [0, 668.0]
  - - [32, 128, 8, 256, 32, 32, 32, 128]
    - [8, 799.0]
  - - [32, 128, 8, 512, 32, 32, 32, 128]
    - [8, 902.0]
  - - [32, 256, 8, 32, 32, 32, 32, 256]
    - [0, 683.0]
  - - [32, 256, 8, 64, 32, 32, 32, 256]
    - [7, 1002.0]
  - - [32, 256, 8, 128, 32, 32, 32, 256]
    - [0, 1336.0]
  - - [32, 256, 8, 256, 32, 32, 32, 256]
    - [8, 1608.0]
  - - [32, 256, 8, 512, 32, 32, 32, 256]
    - [8, 1795.0]
  - - [32, 512, 8, 32, 32, 32, 32, 512]
    - [0, 1348.0]
  - - [32, 512, 8, 64, 32, 32, 32, 512]
    - [0, 1945.0]
  - - [32, 512, 8, 128, 32, 32, 32, 512]
    - [0, 2608.0]
  - - [32, 512, 8, 256, 32, 32, 32, 512]
    - [8, 3128.0]
  - - [32, 512, 8, 512, 32, 32, 32, 512]
    - [8, 3541.0]
  - - [64, 32, 8, 32, 64, 64, 64, 32]
    - [0, 164.0]
  - - [64, 32, 8, 64, 64, 64, 64, 32]
    - [0, 245.0]
  - - [64, 32, 8, 128, 64, 64, 64, 32]
    - [0, 327.0]
  - - [64, 32, 8, 256, 64, 64, 64, 32]
    - [0, 392.0]
  - - [64, 32, 8, 512, 64, 64, 64, 32]
    - [8, 445.0]
  - - [64, 64, 8, 32, 64, 64, 64, 64]
    - [0, 336.0]
  - - [64, 64, 8, 64, 64, 64, 64, 64]
    - [0, 503.0]
  - - [64, 64, 8, 128, 64, 64, 64, 64]
    - [0, 668.0]
  - - [64, 64, 8, 256, 64, 64, 64, 64]
    - [1, 799.0]
  - - [64, 64, 8, 512, 64, 64, 64, 64]
    - [8, 903.0]
  - - [64, 128, 8, 32, 64, 64, 64, 128]
    - [0, 694.0]
  - - [64, 128, 8, 64, 64, 64, 64, 128]
    - [0, 1024.0]
  - - [64, 128, 8, 128, 64, 64, 64, 128]
    - [0, 1350.0]
  - - [64, 128, 8, 256, 64, 64, 64, 128]
    - [8, 1617.0]
  - - [64, 128, 8, 512, 64, 64, 64, 128]
    - [8, 1813.0]
  - - [64, 256, 8, 32, 64, 64, 64, 256]
    - [0, 1372.0]
  - - [64, 256, 8, 64, 64, 64, 64, 256]
    - [0, 2016.0]
  - - [64, 256, 8, 128, 64, 64, 64, 256]
    - [0, 2661.0]
  - - [64, 256, 8, 256, 64, 64, 64, 256]
    - [8, 3199.0]
  - - [64, 256, 8, 512, 64, 64, 64, 256]
    - [8, 3573.0]
  - - [64, 512, 8, 32, 64, 64, 64, 512]
    - [0, 2621.0]
  - - [64, 512, 8, 64, 64, 64, 64, 512]
    - [7, 3869.0]
  - - [64, 512, 8, 128, 64, 64, 64, 512]
    - [0, 5153.0]
  - - [64, 512, 8, 256, 64, 64, 64, 512]
    - [1, 6105.0]
  - - [64, 512, 8, 512, 64, 64, 64, 512]
    - [8, 6941.0]
  - - [128, 32, 8, 32, 128, 128, 128, 32]
    - [0, 342.0]
  - - [128, 32, 8, 64, 128, 128, 128, 32]
    - [0, 512.0]
  - - [128, 32, 8, 128, 128, 128, 128, 32]
    - [0, 674.0]
  - - [128, 32, 8, 256, 128, 128, 128, 32]
    - [8, 804.0]
  - - [128, 32, 8, 512, 128, 128, 128, 32]
    - [8, 903.0]
  - - [128, 64, 8, 32, 128, 128, 128, 64]
    - [7, 695.0]
  - - [128, 64, 8, 64, 128, 128, 128, 64]
    - [7, 1020.0]
  - - [128, 64, 8, 128, 128, 128, 128, 64]
    - [0, 1351.0]
  - - [128, 64, 8, 256, 128, 128, 128, 64]
    - [1, 1616.0]
  - - [128, 64, 8, 512, 128, 128, 128, 64]
    - [8, 1814.0]
  - - [128, 128, 8, 32, 128, 128, 128, 128]
    - [7, 1355.0]
  - - [128, 128, 8, 64, 128, 128, 128, 128]
    - [0, 2013.0]
  - - [128, 128, 8, 128, 128, 128, 128, 128]
    - [0, 2655.0]
  - - [128, 128, 8, 256, 128, 128, 128, 128]
    - [8, 3173.0]
  - - [128, 128, 8, 512, 128, 128, 128, 128]
    - [8, 3583.0]
  - - [128, 256, 8, 32, 128, 128, 128, 256]
    - [0, 2589.0]
  - - [128, 256, 8, 64, 128, 128, 128, 256]
    - [0, 3806.0]
  - - [128, 256, 8, 128, 128, 128, 128, 256]
    - [0, 5109.0]
  - - [128, 256, 8, 256, 128, 128, 128, 256]
    - [8, 6200.0]
  - - [128, 256, 8, 512, 128, 128, 128, 256]
    - [8, 6979.0]
  - - [128, 512, 8, 32, 128, 128, 128, 512]
    - [3, 4280.0]
  - - [128, 512, 8, 64, 128, 128, 128, 512]
    - [0, 6132.0]
  - - [128, 512, 8, 128, 128, 128, 128, 512]
    - [0, 7982.0]
  - - [128, 512, 8, 256, 128, 128, 128, 512]
    - [1, 9249.0]
  - - [128, 512, 8, 512, 128, 128, 128, 512]
    - [1, 10104.0]
  - - [256, 32, 8, 32, 256, 256, 256, 32]
    - [7, 676.0]
  - - [256, 32, 8, 64, 256, 256, 256, 32]
    - [0, 1028.0]
  - - [256, 32, 8, 128, 256, 256, 256, 32]
    - [0, 1343.0]
  - - [256, 32, 8, 256, 256, 256, 256, 32]
    - [8, 1608.0]
  - - [256, 32, 8, 512, 256, 256, 256, 32]
    - [8, 1804.0]
  - - [256, 64, 8, 32, 256, 256, 256, 64]
    - [7, 1334.0]
  - - [256, 64, 8, 64, 256, 256, 256, 64]
    - [0, 1997.0]
  - - [256, 64, 8, 128, 256, 256, 256, 64]
    - [0, 2651.0]
  - - [256, 64, 8, 256, 256, 256, 256, 64]
    - [8, 3180.0]
  - - [256, 64, 8, 512, 256, 256, 256, 64]
    - [8, 3576.0]
  - - [256, 128, 8, 32, 256, 256, 256, 128]
    - [0, 2589.0]
  - - [256, 128, 8, 64, 256, 256, 256, 128]
    - [0, 3855.0]
  - - [256, 128, 8, 128, 256, 256, 256, 128]
    - [0, 5128.0]
  - - [256, 128, 8, 256, 256, 256, 256, 128]
    - [8, 6228.0]
  - - [256, 128, 8, 512, 256, 256, 256, 128]
    - [8, 6988.0]
  - - [256, 256, 8, 32, 256, 256, 256, 256]
    - [0, 4297.0]
  - - [256, 256, 8, 64, 256, 256, 256, 256]
    - [0, 6159.0]
  - - [256, 256, 8, 128, 256, 256, 256, 256]
    - [0, 7989.0]
  - - [256, 256, 8, 256, 256, 256, 256, 256]
    - [1, 9274.0]
  - - [256, 256, 8, 512, 256, 256, 256, 256]
    - [1, 10162.0]
  - - [256, 512, 8, 32, 256, 256, 256, 512]
    - [3, 6463.0]
  - - [256, 512, 8, 64, 256, 256, 256, 512]
    - [3, 8666.0]
  - - [256, 512, 8, 128, 256, 256, 256, 512]
    - [2, 10395.0]
  - - [256, 512, 8, 256, 256, 256, 256, 512]
    - [2, 11659.0]
  - - [256, 512, 8, 512, 256, 256, 256, 512]
    - [2, 12402.0]
  - - [512, 32, 8, 32, 512, 512, 512, 32]
    - [0, 1341.0]
  - - [512, 32, 8, 64, 512, 512, 512, 32]
    - [7, 1967.0]
  - - [512, 32, 8, 128, 512, 512, 512, 32]
    - [0, 2605.0]
  - - [512, 32, 8, 256, 512, 512, 512, 32]
    - [1, 3132.0]
  - - [512, 32, 8, 512, 512, 512, 512, 32]
    - [8, 3568.0]
  - - [512, 64, 8, 32, 512, 512, 512, 64]
    - [0, 2558.0]
  - - [512, 64, 8, 64, 512, 512, 512, 64]
    - [0, 3841.0]
  - - [512, 64, 8, 128, 512, 512, 512, 64]
    - [7, 5084.0]
  - - [512, 64, 8, 256, 512, 512, 512, 64]
    - [1, 6146.0]
  - - [512, 64, 8, 512, 512, 512, 512, 64]
    - [8, 6979.0]
  - - [512, 128, 8, 32, 512, 512, 512, 128]
    - [3, 4351.0]
  - - [512, 128, 8, 64, 512, 512, 512, 128]
    - [0, 6150.0]
  - - [512, 128, 8, 128, 512, 512, 512, 128]
    - [7, 7959.0]
  - - [512, 128, 8, 256, 512, 512, 512, 128]
    - [1, 9290.0]
  - - [512, 128, 8, 512, 512, 512, 512, 128]
    - [1, 10156.0]
  - - [512, 256, 8, 32, 512, 512, 512, 256]
    - [2, 6223.0]
  - - [512, 256, 8, 64, 512, 512, 512, 256]
    - [3, 8508.0]
  - - [512, 256, 8, 128, 512, 512, 512, 256]
    - [2, 10305.0]
  - - [512, 256, 8, 256, 512, 512, 512, 256]
    - [2, 11619.0]
  - - [512, 256, 8, 512, 512, 512, 512, 256]
    - [2, 12375.0]
  - - [512, 512, 8, 32, 512, 512, 512, 512]
    - [5, 8105.0]
  - - [512, 512, 8, 64, 512, 512, 512, 512]
    - [4, 10064.0]
  - - [512, 512, 8, 128, 512, 512, 512, 512]
    - [10, 11386.0]
  - - [512, 512, 8, 256, 512, 512, 512, 512]
    - [6, 12345.0]
  - - [512, 512, 8, 512, 512, 512, 512, 512]
    - [9, 12933.0]
- null
