library/src/blas3/Tensile/Logic/aldebaran/vega20_Cijk_Alik_Bljk_HBH_GB.yaml
- {MinimumRequiredVersion: 4.26.0}
- vega20
- gfx906
- [Device 66a0, Device 66a1, Device 66a7, Device 66af, Vega 20]
    SolutionIndex: 0
    SolutionNameMin: Cijk_Alik_Bljk_HBH_GB_MT32x32x8_SN_GRVW4_LRVW4_TT4_4_VW4_WG8_8_1_WGM1
    SolutionIndex: 1
    SolutionNameMin: Cijk_Alik_Bljk_HBH_GB_MT64x64x8_SN_GRVW4_LRVW4_TT4_4_VW4_WG16_16_1_WGM1
    SolutionIndex: 2
    SolutionNameMin: Cijk_Alik_Bljk_HBH_GB_MT64x128x8_SN_GRVW4_LRVW4_TT4_8_VW4_WG16_16_1_WGM1
    SolutionIndex: 3
    SolutionNameMin: Cijk_Alik_Bljk_HBH_GB_MT32x32x16_SN_GRVW4_LRVW4_TT4_4_VW4_WG8_8_1_WGM1
    SolutionIndex: 4
    SolutionNameMin: Cijk_Alik_Bljk_HBH_GB_MT64x64x16_SN_GRVW4_LRVW4_TT4_4_VW4_WG16_16_1_WGM1
    SolutionIndex: 5
    SolutionNameMin: Cijk_Alik_Bljk_HBH_GB_MT32x32x32_SN_GRVW4_LRVW4_TT4_4_VW4_WG8_8_1_WGM1
    SolutionIndex: 6
    SolutionNameMin: Cijk_Alik_Bljk_HBH_GB_MT64x64x8_SN_GRVW2_LRVW2_TT4_4_VW2_WG16_16_1_WGM1
    SolutionIndex: 7
    SolutionNameMin: Cijk_Alik_Bljk_HBH_GB_MT32x32x8_SN_GRVW4_LRVW4_TT4_4_VW4_WG8_8_1_WGM8
    SolutionIndex: 8
    SolutionNameMin: Cijk_Alik_Bljk_HBH_GB_MT64x64x8_SN_GRVW4_LRVW4_TT4_4_VW4_WG16_16_1_WGM8
    SolutionIndex: 9
    SolutionNameMin: Cijk_Alik_Bljk_HBH_GB_MT32x32x16_SN_GRVW4_LRVW4_TT4_4_VW4_WG8_8_1_WGM8
    SolutionIndex: 10
    SolutionNameMin: Cijk_Alik_Bljk_HBH_GB_MT64x64x16_SN_GRVW4_LRVW4_TT4_4_VW4_WG16_16_1_WGM8
- - - [32, 32, 8, 32, 32, 32, 32, 32]
    - [7, 79.0]
  - - [32, 32, 8, 64, 32, 32, 64, 64]
    - [0, 118.0]
  - - [32, 32, 8, 128, 32, 32, 128, 128]
    - [0, 159.0]
  - - [32, 32, 8, 256, 32, 32, 256, 256]
    - [0, 189.0]
  - - [32, 32, 8, 512, 32, 32, 512, 512]
    - [3, 211.0]
  - - [32, 64, 8, 32, 32, 32, 32, 32]
    - [7, 168.0]
  - - [32, 64, 8, 64, 32, 32, 64, 64]
    - [0, 249.0]
  - - [32, 64, 8, 128, 32, 32, 128, 128]
    - [0, 326.0]
  - - [32, 64, 8, 256, 32, 32, 256, 256]
    - [0, 386.0]
  - - [32, 64, 8, 512, 32, 32, 512, 512]
    - [3, 430.0]
  - - [32, 128, 8, 32, 32, 32, 32, 32]
    - [7, 346.0]
  - - [32, 128, 8, 64, 32, 32, 64, 64]
    - [7, 508.0]
  - - [32, 128, 8, 128, 32, 32, 128, 128]
    - [0, 665.0]
  - - [32, 128, 8, 256, 32, 32, 256, 256]
    - [3, 779.0]
  - - [32, 128, 8, 512, 32, 32, 512, 512]
    - [3, 867.0]
  - - [32, 256, 8, 32, 32, 32, 32, 32]
    - [0, 688.0]
  - - [32, 256, 8, 64, 32, 32, 64, 64]
    - [7, 1022.0]
  - - [32, 256, 8, 128, 32, 32, 128, 128]
    - [0, 1322.0]
  - - [32, 256, 8, 256, 32, 32, 256, 256]
    - [3, 1562.0]
  - - [32, 256, 8, 512, 32, 32, 512, 512]
    - [9, 1711.0]
  - - [32, 512, 8, 32, 32, 32, 32, 32]
    - [7, 1355.0]
  - - [32, 512, 8, 64, 32, 32, 64, 64]
    - [7, 1997.0]
  - - [32, 512, 8, 128, 32, 32, 128, 128]
    - [0, 2608.0]
  - - [32, 512, 8, 256, 32, 32, 256, 256]
    - [3, 3026.0]
  - - [32, 512, 8, 512, 32, 32, 512, 512]
    - [5, 3267.0]
  - - [64, 32, 8, 32, 64, 64, 32, 32]
    - [7, 168.0]
  - - [64, 32, 8, 64, 64, 64, 64, 64]
    - [7, 248.0]
  - - [64, 32, 8, 128, 64, 64, 128, 128]
    - [7, 327.0]
  - - [64, 32, 8, 256, 64, 64, 256, 256]
    - [0, 386.0]
  - - [64, 32, 8, 512, 64, 64, 512, 512]
    - [3, 430.0]
  - - [64, 64, 8, 32, 64, 64, 32, 32]
    - [0, 345.0]
  - - [64, 64, 8, 64, 64, 64, 64, 64]
    - [0, 509.0]
  - - [64, 64, 8, 128, 64, 64, 128, 128]
    - [0, 665.0]
  - - [64, 64, 8, 256, 64, 64, 256, 256]
    - [3, 785.0]
  - - [64, 64, 8, 512, 64, 64, 512, 512]
    - [9, 871.0]
  - - [64, 128, 8, 32, 64, 64, 32, 32]
    - [0, 679.0]
  - - [64, 128, 8, 64, 64, 64, 64, 64]
    - [7, 1024.0]
  - - [64, 128, 8, 128, 64, 64, 128, 128]
    - [0, 1327.0]
  - - [64, 128, 8, 256, 64, 64, 256, 256]
    - [3, 1572.0]
  - - [64, 128, 8, 512, 64, 64, 512, 512]
    - [3, 1743.0]
  - - [64, 256, 8, 32, 64, 64, 32, 32]
    - [0, 1334.0]
  - - [64, 256, 8, 64, 64, 64, 64, 64]
    - [7, 1993.0]
  - - [64, 256, 8, 128, 64, 64, 128, 128]
    - [0, 2612.0]
  - - [64, 256, 8, 256, 64, 64, 256, 256]
    - [3, 3100.0]
  - - [64, 256, 8, 512, 64, 64, 512, 512]
    - [3, 3417.0]
  - - [64, 512, 8, 32, 64, 64, 32, 32]
    - [4, 2533.0]
  - - [64, 512, 8, 64, 64, 64, 64, 64]
    - [1, 3738.0]
  - - [64, 512, 8, 128, 64, 64, 128, 128]
    - [4, 4906.0]
  - - [64, 512, 8, 256, 64, 64, 256, 256]
    - [4, 5801.0]
  - - [64, 512, 8, 512, 64, 64, 512, 512]
    - [4, 5985.0]
  - - [128, 32, 8, 32, 128, 128, 32, 32]
    - [0, 346.0]
  - - [128, 32, 8, 64, 128, 128, 64, 64]
    - [0, 515.0]
  - - [128, 32, 8, 128, 128, 128, 128, 128]
    - [0, 666.0]
  - - [128, 32, 8, 256, 128, 128, 256, 256]
    - [3, 784.0]
  - - [128, 32, 8, 512, 128, 128, 512, 512]
    - [9, 873.0]
  - - [128, 64, 8, 32, 128, 128, 32, 32]
    - [0, 697.0]
  - - [128, 64, 8, 64, 128, 128, 64, 64]
    - [0, 1022.0]
  - - [128, 64, 8, 128, 128, 128, 128, 128]
    - [0, 1324.0]
  - - [128, 64, 8, 256, 128, 128, 256, 256]
    - [3, 1574.0]
  - - [128, 64, 8, 512, 128, 128, 512, 512]
    - [3, 1748.0]
  - - [128, 128, 8, 32, 128, 128, 32, 32]
    - [0, 1331.0]
  - - [128, 128, 8, 64, 128, 128, 64, 64]
    - [0, 1982.0]
  - - [128, 128, 8, 128, 128, 128, 128, 128]
    - [0, 2599.0]
  - - [128, 128, 8, 256, 128, 128, 256, 256]
    - [3, 3109.0]
  - - [128, 128, 8, 512, 128, 128, 512, 512]
    - [3, 3449.0]
  - - [128, 256, 8, 32, 128, 128, 32, 32]
    - [4, 2521.0]
  - - [128, 256, 8, 64, 128, 128, 64, 64]
    - [8, 3732.0]
  - - [128, 256, 8, 128, 128, 128, 128, 128]
    - [4, 4894.0]
  - - [128, 256, 8, 256, 128, 128, 256, 256]
    - [3, 5958.0]
  - - [128, 256, 8, 512, 128, 128, 512, 512]
    - [3, 6543.0]
  - - [128, 512, 8, 32, 128, 128, 32, 32]
    - [4, 4289.0]
  - - [128, 512, 8, 64, 128, 128, 64, 64]
    - [8, 6150.0]
  - - [128, 512, 8, 128, 128, 128, 128, 128]
    - [8, 7760.0]
  - - [128, 512, 8, 256, 128, 128, 256, 256]
    - [10, 8844.0]
  - - [128, 512, 8, 512, 128, 128, 512, 512]
    - [3, 9449.0]
  - - [256, 32, 8, 32, 256, 256, 32, 32]
    - [7, 684.0]
  - - [256, 32, 8, 64, 256, 256, 64, 64]
    - [0, 1024.0]
  - - [256, 32, 8, 128, 256, 256, 128, 128]
    - [0, 1324.0]
  - - [256, 32, 8, 256, 256, 256, 256, 256]
    - [3, 1576.0]
  - - [256, 32, 8, 512, 256, 256, 512, 512]
    - [9, 1746.0]
  - - [256, 64, 8, 32, 256, 256, 32, 32]
    - [7, 1344.0]
  - - [256, 64, 8, 64, 256, 256, 64, 64]
    - [7, 1986.0]
  - - [256, 64, 8, 128, 256, 256, 128, 128]
    - [0, 2608.0]
  - - [256, 64, 8, 256, 256, 256, 256, 256]
    - [3, 3114.0]
  - - [256, 64, 8, 512, 256, 256, 512, 512]
    - [3, 3435.0]
  - - [256, 128, 8, 32, 256, 256, 32, 32]
    - [4, 2521.0]
  - - [256, 128, 8, 64, 256, 256, 64, 64]
    - [0, 3738.0]
  - - [256, 128, 8, 128, 256, 256, 128, 128]
    - [3, 4934.0]
  - - [256, 128, 8, 256, 256, 256, 256, 256]
    - [3, 5958.0]
  - - [256, 128, 8, 512, 256, 256, 512, 512]
    - [3, 6536.0]
  - - [256, 256, 8, 32, 256, 256, 32, 32]
    - [4, 4342.0]
  - - [256, 256, 8, 64, 256, 256, 64, 64]
    - [1, 6205.0]
  - - [256, 256, 8, 128, 256, 256, 128, 128]
    - [1, 7818.0]
  - - [256, 256, 8, 256, 256, 256, 256, 256]
    - [10, 8784.0]
  - - [256, 256, 8, 512, 256, 256, 512, 512]
    - [3, 9516.0]
  - - [256, 512, 8, 32, 256, 256, 32, 32]
    - [4, 6503.0]
  - - [256, 512, 8, 64, 256, 256, 64, 64]
    - [6, 8621.0]
  - - [256, 512, 8, 128, 256, 256, 128, 128]
    - [10, 10243.0]
  - - [256, 512, 8, 256, 256, 256, 256, 256]
    - [10, 11267.0]
  - - [256, 512, 8, 512, 256, 256, 512, 512]
    - [10, 11975.0]
  - - [512, 32, 8, 32, 512, 512, 32, 32]
    - [0, 1324.0]
  - - [512, 32, 8, 64, 512, 512, 64, 64]
    - [0, 1982.0]
  - - [512, 32, 8, 128, 512, 512, 128, 128]
    - [0, 2602.0]
  - - [512, 32, 8, 256, 512, 512, 256, 256]
    - [3, 3053.0]
  - - [512, 32, 8, 512, 512, 512, 512, 512]
    - [3, 3414.0]
  - - [512, 64, 8, 32, 512, 512, 32, 32]
    - [7, 2509.0]
  - - [512, 64, 8, 64, 512, 512, 64, 64]
    - [0, 3705.0]
  - - [512, 64, 8, 128, 512, 512, 128, 128]
    - [4, 4871.0]
  - - [512, 64, 8, 256, 512, 512, 256, 256]
    - [4, 5829.0]
  - - [512, 64, 8, 512, 512, 512, 512, 512]
    - [9, 6561.0]
  - - [512, 128, 8, 32, 512, 512, 32, 32]
    - [6, 4315.0]
  - - [512, 128, 8, 64, 512, 512, 64, 64]
    - [1, 6105.0]
  - - [512, 128, 8, 128, 512, 512, 128, 128]
    - [1, 7717.0]
  - - [512, 128, 8, 256, 512, 512, 256, 256]
    - [10, 8872.0]
  - - [512, 128, 8, 512, 512, 512, 512, 512]
    - [10, 9667.0]
  - - [512, 256, 8, 32, 512, 512, 32, 32]
    - [4, 6463.0]
  - - [512, 256, 8, 64, 512, 512, 64, 64]
    - [6, 8621.0]
  - - [512, 256, 8, 128, 512, 512, 128, 128]
    - [10, 10174.0]
  - - [512, 256, 8, 256, 512, 512, 256, 256]
    - [10, 11264.0]
  - - [512, 256, 8, 512, 512, 512, 512, 512]
    - [4, 11800.0]
  - - [512, 512, 8, 32, 512, 512, 32, 32]
    - [2, 8027.0]
  - - [512, 512, 8, 64, 512, 512, 64, 64]
    - [4, 9904.0]
  - - [512, 512, 8, 128, 512, 512, 128, 128]
    - [10, 11283.0]
  - - [512, 512, 8, 256, 512, 512, 256, 256]
    - [4, 12228.0]
  - - [512, 512, 8, 512, 512, 512, 512, 512]
    - [4, 12593.0]
- null
