library/src/blas3/Tensile/Logic/aldebaran/vega20_Cijk_Alik_Bjlk_HSS_BH.yaml
- {MinimumRequiredVersion: 4.24.0}
- vega20
- gfx906
- [Device 66a0, Device 66a1, Device 66a7, Device 66af, Vega 20]
    SolutionIndex: 0
    SolutionNameMin: Cijk_Alik_Bjlk_HSS_BH_MT16x32x8_SE_GSU1_PGR1_PLR1_TT2_4_VAW2
    SolutionIndex: 1
    SolutionNameMin: Cijk_Alik_Bjlk_HSS_BH_MT32x32x8_SE_GSU1_PGR1_PLR1_TT4_4_VAW2
    SolutionIndex: 2
    SolutionNameMin: Cijk_Alik_Bjlk_HSS_BH_MT16x32x8_SE_GSU1_PGR1_PLR1_TT2_4_VAW2
    SolutionIndex: 3
    SolutionNameMin: Cijk_Alik_Bjlk_HSS_BH_MT32x32x8_SE_GSU1_PGR1_PLR1_TT4_4_VAW2
    SolutionIndex: 4
    SolutionNameMin: Cijk_Alik_Bjlk_HSS_BH_MT16x16x16_SE_GSU1_PGR1_PLR1_TT2_2_VAW2
    SolutionIndex: 5
    SolutionNameMin: Cijk_Alik_Bjlk_HSS_BH_MT16x32x16_SE_GSU1_PGR1_PLR1_TT2_4_VAW2
    SolutionIndex: 6
    SolutionNameMin: Cijk_Alik_Bjlk_HSS_BH_MT32x32x16_SE_GSU1_PGR1_PLR1_TT4_4_VAW2
    SolutionIndex: 7
    SolutionNameMin: Cijk_Alik_Bjlk_HSS_BH_MT16x32x16_SE_GSU1_PGR1_PLR1_TT2_2_VAW2
    SolutionIndex: 8
    SolutionNameMin: Cijk_Alik_Bjlk_HSS_BH_MT16x64x16_SE_GSU1_PGR1_PLR1_TT2_4_VAW2
    SolutionIndex: 9
    SolutionNameMin: Cijk_Alik_Bjlk_HSS_BH_MT32x128x16_SE_GSU1_PGR1_PLR1_TT4_4_VAW2
    SolutionIndex: 10
    SolutionNameMin: Cijk_Alik_Bjlk_HSS_BH_MT32x64x16_SE_GSU1_PGR1_PLR1_TT2_4_VAW2
    SolutionIndex: 11
    SolutionNameMin: Cijk_Alik_Bjlk_HSS_BH_MT64x64x16_SE_GSU1_PGR1_PLR1_TT4_4_VAW2
    SolutionIndex: 12
    SolutionNameMin: Cijk_Alik_Bjlk_HSS_BH_MT64x128x16_SE_GSU1_PGR1_PLR1_TT4_8_VAW2
    SolutionIndex: 13
    SolutionNameMin: Cijk_Alik_Bjlk_HSS_BH_MT16x32x16_SE_GSU1_PGR1_PLR1_TT2_4_VAW2
    SolutionIndex: 14
    SolutionNameMin: Cijk_Alik_Bjlk_HSS_BH_MT32x32x16_SE_GSU1_PGR1_PLR1_TT4_4_VAW2
    SolutionIndex: 15
    SolutionNameMin: Cijk_Alik_Bjlk_HSS_BH_MT16x64x16_SE_GSU1_PGR1_PLR1_TT2_4_VAW2
    SolutionIndex: 16
    SolutionNameMin: Cijk_Alik_Bjlk_HSS_BH_MT32x64x16_SE_GSU1_PGR1_PLR1_TT4_4_VAW2
    SolutionIndex: 17
    SolutionNameMin: Cijk_Alik_Bjlk_HSS_BH_MT32x64x16_SE_GSU1_PGR1_PLR1_TT2_4_VAW2
    SolutionIndex: 18
    SolutionNameMin: Cijk_Alik_Bjlk_HSS_BH_MT64x64x16_SE_GSU1_PGR1_PLR1_TT4_4_VAW2
    SolutionIndex: 19
    SolutionNameMin: Cijk_Alik_Bjlk_HSS_BH_MT64x128x16_SE_GSU1_PGR1_PLR1_TT4_8_VAW2
    SolutionIndex: 20
    SolutionNameMin: Cijk_Alik_Bjlk_HSS_BH_MT16x16x24_SE_GSU1_PGR1_PLR1_TT2_2_VAW2
    SolutionIndex: 21
    SolutionNameMin: Cijk_Alik_Bjlk_HSS_BH_MT16x32x24_SE_GSU1_PGR1_PLR1_TT2_4_VAW2
    SolutionIndex: 22
    SolutionNameMin: Cijk_Alik_Bjlk_HSS_BH_MT32x32x24_SE_GSU1_PGR1_PLR1_TT4_4_VAW2
    SolutionIndex: 23
    SolutionNameMin: Cijk_Alik_Bjlk_HSS_BH_MT8x64x32_SE_GSU1_PGR1_PLR1_TT2_2_VAW2
    SolutionIndex: 24
    SolutionNameMin: Cijk_Alik_Bjlk_HSS_BH_MT16x16x32_SE_GSU1_PGR1_PLR1_TT2_2_VAW2
    SolutionIndex: 25
    SolutionNameMin: Cijk_Alik_Bjlk_HSS_BH_MT16x32x32_SE_GSU1_PGR1_PLR1_TT2_2_VAW2
    SolutionIndex: 26
    SolutionNameMin: Cijk_Alik_Bjlk_HSS_BH_MT16x64x32_SE_GSU1_PGR1_PLR1_TT2_2_VAW2
    SolutionIndex: 27
    SolutionNameMin: Cijk_Alik_Bjlk_HSS_BH_MT8x64x32_SE_GSU1_PGR1_PLR1_TT2_2_VAW2
    SolutionIndex: 28
    SolutionNameMin: Cijk_Alik_Bjlk_HSS_BH_MT16x16x32_SE_GSU1_PGR1_PLR1_TT2_2_VAW2
    SolutionIndex: 29
    SolutionNameMin: Cijk_Alik_Bjlk_HSS_BH_MT16x32x32_SE_GSU1_PGR1_PLR1_TT2_2_VAW2
    SolutionIndex: 30
    SolutionNameMin: Cijk_Alik_Bjlk_HSS_BH_MT16x64x32_SE_GSU1_PGR1_PLR1_TT2_2_VAW2
    SolutionIndex: 31
    SolutionNameMin: Cijk_Alik_Bjlk_HSS_BH_MT8x64x64_SE_GSU1_PGR1_PLR1_TT2_2_VAW2
    SolutionIndex: 32
    SolutionNameMin: Cijk_Alik_Bjlk_HSS_BH_MT8x64x64_SE_GSU1_PGR1_PLR1_TT2_2_VAW2
    SolutionIndex: 33
    SolutionNameMin: Cijk_Alik_Bjlk_HSS_BH_MT128x64x16_SE_GSU1_PGR1_PLR1_TT8_4_VAW2
    SolutionIndex: 34
    SolutionNameMin: Cijk_Alik_Bjlk_HSS_BH_MT64x128x4_SE_GSU1_PGR0_PLR0_TT4_8_VAW2
    SolutionIndex: 35
    SolutionNameMin: Cijk_Alik_Bjlk_HSS_BH_MT64x64x4_SE_GSU1_PGR0_PLR0_TT4_4_VAW2
    SolutionIndex: 36
    SolutionNameMin: Cijk_Alik_Bjlk_HSS_BH_MT64x64x4_SE_GSU1_PGR1_PLR0_TT4_4_VAW2
    SolutionIndex: 37
    SolutionNameMin: Cijk_Alik_Bjlk_HSS_BH_MT64x128x4_SE_GSU1_PGR0_PLR1_TT4_8_VAW2
    SolutionIndex: 38
    SolutionNameMin: Cijk_Alik_Bjlk_HSS_BH_MT64x64x4_SE_GSU1_PGR0_PLR1_TT4_4_VAW2
    SolutionIndex: 39
    SolutionNameMin: Cijk_Alik_Bjlk_HSS_BH_MT64x128x8_SE_GSU1_PGR0_PLR0_TT4_8_VAW2
    SolutionIndex: 40
    SolutionNameMin: Cijk_Alik_Bjlk_HSS_BH_MT64x64x8_SE_GSU1_PGR0_PLR0_TT4_4_VAW2
    SolutionIndex: 41
    SolutionNameMin: Cijk_Alik_Bjlk_HSS_BH_MT64x128x8_SE_GSU1_PGR1_PLR0_TT4_8_VAW2
    SolutionIndex: 42
    SolutionNameMin: Cijk_Alik_Bjlk_HSS_BH_MT64x64x8_SE_GSU1_PGR1_PLR0_TT4_4_VAW2
    SolutionIndex: 43
    SolutionNameMin: Cijk_Alik_Bjlk_HSS_BH_MT64x128x8_SE_GSU1_PGR0_PLR1_TT4_8_VAW2
    SolutionIndex: 44
    SolutionNameMin: Cijk_Alik_Bjlk_HSS_BH_MT64x64x8_SE_GSU1_PGR0_PLR1_TT4_4_VAW2
    SolutionIndex: 45
    SolutionNameMin: Cijk_Alik_Bjlk_HSS_BH_MT64x64x8_SE_GSU1_PGR1_PLR1_TT4_4_VAW2
    SolutionIndex: 46
    SolutionNameMin: Cijk_Alik_Bjlk_HSS_BH_MT64x64x16_SE_GSU1_PGR0_PLR0_TT4_4_VAW2
    SolutionIndex: 47
    SolutionNameMin: Cijk_Alik_Bjlk_HSS_BH_MT64x128x16_SE_GSU1_PGR1_PLR0_TT4_8_VAW2
    SolutionIndex: 48
    SolutionNameMin: Cijk_Alik_Bjlk_HSS_BH_MT64x64x16_SE_GSU1_PGR1_PLR0_TT4_4_VAW2
    SolutionIndex: 49
    SolutionNameMin: Cijk_Alik_Bjlk_HSS_BH_MT64x64x16_SE_GSU1_PGR0_PLR1_TT4_4_VAW2
    SolutionIndex: 50
    SolutionNameMin: Cijk_Alik_Bjlk_HSS_BH_MT64x64x16_SE_GSU1_PGR1_PLR1_TT4_4_VAW2
    SolutionIndex: 51
    SolutionNameMin: Cijk_Alik_Bjlk_HSS_BH_MT64x64x8_SE_GSU3_PGR0_PLR0_TT4_4_VAW1
    SolutionIndex: 52
    SolutionNameMin: Cijk_Alik_Bjlk_HSS_BH_MT64x64x8_SE_GSU3_PGR0_PLR1_TT4_4_VAW1
    SolutionIndex: 53
    SolutionNameMin: Cijk_Alik_Bjlk_HSS_BH_MT64x64x8_SE_GSU5_PGR0_PLR0_TT4_4_VAW1
    SolutionIndex: 54
    SolutionNameMin: Cijk_Alik_Bjlk_HSS_BH_MT64x64x8_SE_GSU5_PGR1_PLR0_TT4_4_VAW1
    SolutionIndex: 55
    SolutionNameMin: Cijk_Alik_Bjlk_HSS_BH_MT64x64x8_SE_GSU5_PGR0_PLR1_TT4_4_VAW1
    SolutionIndex: 56
    SolutionNameMin: Cijk_Alik_Bjlk_HSS_BH_MT64x64x16_SE_GSU5_PGR1_PLR1_TT4_4_VAW1
    SolutionIndex: 57
    SolutionNameMin: Cijk_Alik_Bjlk_HSS_BH_MT64x64x8_SE_GSU7_PGR0_PLR0_TT4_4_VAW1
    SolutionIndex: 58
    SolutionNameMin: Cijk_Alik_Bjlk_HSS_BH_MT64x64x8_SE_GSU7_PGR1_PLR0_TT4_4_VAW1
    SolutionIndex: 59
    SolutionNameMin: Cijk_Alik_Bjlk_HSS_BH_MT64x64x8_SE_GSU7_PGR0_PLR1_TT4_4_VAW1
    SolutionIndex: 60
    SolutionNameMin: Cijk_Alik_Bjlk_HSS_BH_MT128x128x4_SE_GSU1_PGR0_PLR0_TT8_8_VAW2
    SolutionIndex: 61
    SolutionNameMin: Cijk_Alik_Bjlk_HSS_BH_MT64x128x4_SE_GSU1_PGR0_PLR0_TT4_8_VAW2
    SolutionIndex: 62
    SolutionNameMin: Cijk_Alik_Bjlk_HSS_BH_MT64x64x4_SE_GSU1_PGR0_PLR0_TT4_4_VAW2
    SolutionIndex: 63
    SolutionNameMin: Cijk_Alik_Bjlk_HSS_BH_MT64x128x4_SE_GSU1_PGR1_PLR0_TT4_8_VAW2
    SolutionIndex: 64
    SolutionNameMin: Cijk_Alik_Bjlk_HSS_BH_MT64x64x4_SE_GSU1_PGR1_PLR0_TT4_4_VAW2
    SolutionIndex: 65
    SolutionNameMin: Cijk_Alik_Bjlk_HSS_BH_MT128x128x4_SE_GSU1_PGR0_PLR1_TT8_8_VAW2
    SolutionIndex: 66
    SolutionNameMin: Cijk_Alik_Bjlk_HSS_BH_MT64x128x4_SE_GSU1_PGR0_PLR1_TT4_8_VAW2
    SolutionIndex: 67
    SolutionNameMin: Cijk_Alik_Bjlk_HSS_BH_MT64x64x4_SE_GSU1_PGR0_PLR1_TT4_4_VAW2
    SolutionIndex: 68
    SolutionNameMin: Cijk_Alik_Bjlk_HSS_BH_MT64x128x4_SE_GSU1_PGR1_PLR1_TT4_8_VAW2
    SolutionIndex: 69
    SolutionNameMin: Cijk_Alik_Bjlk_HSS_BH_MT64x64x4_SE_GSU1_PGR1_PLR1_TT4_4_VAW2
    SolutionIndex: 70
    SolutionNameMin: Cijk_Alik_Bjlk_HSS_BH_MT128x128x8_SE_GSU1_PGR0_PLR0_TT8_8_VAW2
    SolutionIndex: 71
    SolutionNameMin: Cijk_Alik_Bjlk_HSS_BH_MT64x128x8_SE_GSU1_PGR0_PLR0_TT4_8_VAW2
    SolutionIndex: 72
    SolutionNameMin: Cijk_Alik_Bjlk_HSS_BH_MT64x64x8_SE_GSU1_PGR0_PLR0_TT4_4_VAW2
    SolutionIndex: 73
    SolutionNameMin: Cijk_Alik_Bjlk_HSS_BH_MT64x64x8_SE_GSU1_PGR1_PLR0_TT4_4_VAW2
    SolutionIndex: 74
    SolutionNameMin: Cijk_Alik_Bjlk_HSS_BH_MT64x128x8_SE_GSU1_PGR0_PLR1_TT4_8_VAW2
    SolutionIndex: 75
    SolutionNameMin: Cijk_Alik_Bjlk_HSS_BH_MT64x64x8_SE_GSU1_PGR0_PLR1_TT4_4_VAW2
    SolutionIndex: 76
    SolutionNameMin: Cijk_Alik_Bjlk_HSS_BH_MT64x64x8_SE_GSU1_PGR1_PLR1_TT4_4_VAW2
    SolutionIndex: 77
    SolutionNameMin: Cijk_Alik_Bjlk_HSS_BH_MT128x128x16_SE_GSU1_PGR0_PLR0_TT8_8_VAW2
    SolutionIndex: 78
    SolutionNameMin: Cijk_Alik_Bjlk_HSS_BH_MT64x64x16_SE_GSU1_PGR0_PLR0_TT4_4_VAW2
    SolutionIndex: 79
    SolutionNameMin: Cijk_Alik_Bjlk_HSS_BH_MT64x64x16_SE_GSU1_PGR1_PLR0_TT4_4_VAW2
    SolutionIndex: 80
    SolutionNameMin: Cijk_Alik_Bjlk_HSS_BH_MT64x128x16_SE_GSU1_PGR0_PLR1_TT4_8_VAW2
    SolutionIndex: 81
    SolutionNameMin: Cijk_Alik_Bjlk_HSS_BH_MT64x64x16_SE_GSU1_PGR0_PLR1_TT4_4_VAW2
    SolutionIndex: 82
    SolutionNameMin: Cijk_Alik_Bjlk_HSS_BH_MT64x128x8_SE_GSU3_PGR1_PLR0_TT4_8_VAW1
    SolutionIndex: 83
    SolutionNameMin: Cijk_Alik_Bjlk_HSS_BH_MT64x64x8_SE_GSU3_PGR1_PLR0_TT4_4_VAW1
    SolutionIndex: 84
    SolutionNameMin: Cijk_Alik_Bjlk_HSS_BH_MT64x64x4_SE_GSU5_PGR0_PLR0_TT4_4_VAW1
    SolutionIndex: 85
    SolutionNameMin: Cijk_Alik_Bjlk_HSS_BH_MT64x128x4_SE_GSU5_PGR1_PLR0_TT4_8_VAW1
    SolutionIndex: 86
    SolutionNameMin: Cijk_Alik_Bjlk_HSS_BH_MT64x64x4_SE_GSU5_PGR1_PLR0_TT4_4_VAW1
    SolutionIndex: 87
    SolutionNameMin: Cijk_Alik_Bjlk_HSS_BH_MT64x128x8_SE_GSU5_PGR1_PLR0_TT4_8_VAW1
    SolutionIndex: 88
    SolutionNameMin: Cijk_Alik_Bjlk_HSS_BH_MT64x64x8_SE_GSU5_PGR1_PLR0_TT4_4_VAW1
    SolutionIndex: 89
    SolutionNameMin: Cijk_Alik_Bjlk_HSS_BH_MT64x64x8_SE_GSU5_PGR1_PLR1_TT4_4_VAW1
    SolutionIndex: 90
    SolutionNameMin: Cijk_Alik_Bjlk_HSS_BH_MT64x128x4_SE_GSU7_PGR1_PLR0_TT4_8_VAW1
    SolutionIndex: 91
    SolutionNameMin: Cijk_Alik_Bjlk_HSS_BH_MT64x64x4_SE_GSU7_PGR1_PLR0_TT4_4_VAW1
    SolutionIndex: 92
    SolutionNameMin: Cijk_Alik_Bjlk_HSS_BH_MT64x64x8_SE_GSU7_PGR1_PLR0_TT4_4_VAW1
- - - [64, 64, 1, 256, 64, 64, 256, 64]
    - [30, 122.0]
  - - [128, 64, 1, 256, 128, 128, 256, 64]
    - [4, 205.0]
  - - [64, 128, 1, 256, 64, 64, 256, 128]
    - [4, 206.0]
  - - [128, 128, 1, 256, 128, 128, 256, 128]
    - [24, 519.0]
  - - [64, 256, 1, 256, 64, 64, 256, 256]
    - [24, 519.0]
  - - [128, 256, 1, 256, 128, 128, 256, 256]
    - [29, 1038.0]
  - - [64, 448, 1, 256, 64, 64, 256, 448]
    - [25, 908.0]
  - - [128, 448, 1, 256, 128, 128, 256, 448]
    - [4, 1731.0]
  - - [64, 704, 1, 256, 64, 64, 256, 704]
    - [4, 1386.0]
  - - [128, 704, 1, 256, 128, 128, 256, 704]
    - [7, 2465.0]
  - - [64, 1024, 1, 256, 64, 64, 256, 1024]
    - [26, 1978.0]
  - - [128, 1024, 1, 256, 128, 128, 256, 1024]
    - [26, 3383.0]
  - - [64, 1408, 1, 256, 64, 64, 256, 1408]
    - [23, 2507.0]
  - - [128, 1408, 1, 256, 128, 128, 256, 1408]
    - [26, 3871.0]
  - - [64, 1856, 1, 256, 64, 64, 256, 1856]
    - [27, 3168.0]
  - - [128, 1856, 1, 256, 128, 128, 256, 1856]
    - [8, 4607.0]
  - - [64, 2368, 1, 256, 64, 64, 256, 2368]
    - [23, 3566.0]
  - - [128, 2368, 1, 256, 128, 128, 256, 2368]
    - [15, 4532.0]
  - - [64, 2944, 1, 256, 64, 64, 256, 2944]
    - [26, 4047.0]
  - - [128, 2944, 1, 256, 128, 128, 256, 2944]
    - [0, 5289.0]
  - - [64, 3584, 1, 256, 64, 64, 256, 3584]
    - [8, 4449.0]
  - - [128, 3584, 1, 256, 128, 128, 256, 3584]
    - [8, 5712.0]
  - - [64, 4288, 1, 256, 64, 64, 256, 4288]
    - [15, 4104.0]
  - - [128, 4288, 1, 256, 128, 128, 256, 4288]
    - [8, 5541.0]
  - - [64, 5056, 1, 256, 64, 64, 256, 5056]
    - [8, 4794.0]
  - - [128, 5056, 1, 256, 128, 128, 256, 5056]
    - [0, 6392.0]
  - - [64, 5888, 1, 256, 64, 64, 256, 5888]
    - [0, 5243.0]
  - - [128, 5888, 1, 256, 128, 128, 256, 5888]
    - [3, 6851.0]
  - - [64, 6784, 1, 256, 64, 64, 256, 6784]
    - [8, 5427.0]
  - - [128, 6784, 1, 256, 128, 128, 256, 6784]
    - [0, 6648.0]
  - - [64, 64, 1, 1280, 64, 64, 1280, 64]
    - [26, 160.0]
  - - [128, 64, 1, 1280, 128, 128, 1280, 64]
    - [4, 301.0]
  - - [64, 128, 1, 1280, 64, 64, 1280, 128]
    - [4, 302.0]
  - - [128, 128, 1, 1280, 128, 128, 1280, 128]
    - [28, 662.0]
  - - [64, 256, 1, 1280, 64, 64, 1280, 256]
    - [28, 662.0]
  - - [128, 256, 1, 1280, 128, 128, 1280, 256]
    - [31, 1337.0]
  - - [64, 448, 1, 1280, 64, 64, 1280, 448]
    - [31, 1176.0]
  - - [128, 448, 1, 1280, 128, 128, 1280, 448]
    - [26, 2222.0]
  - - [64, 704, 1, 1280, 64, 64, 1280, 704]
    - [31, 1750.0]
  - - [128, 704, 1, 1280, 128, 128, 1280, 704]
    - [23, 3277.0]
  - - [64, 1024, 1, 1280, 64, 64, 1280, 1024]
    - [26, 2533.0]
  - - [128, 1024, 1, 1280, 128, 128, 1280, 1024]
    - [27, 4424.0]
  - - [64, 1408, 1, 1280, 64, 64, 1280, 1408]
    - [27, 3284.0]
  - - [128, 1408, 1, 1280, 128, 128, 1280, 1408]
    - [26, 4735.0]
  - - [64, 1856, 1, 1280, 64, 64, 1280, 1856]
    - [27, 4061.0]
  - - [128, 1856, 1, 1280, 128, 128, 1280, 1856]
    - [21, 5541.0]
  - - [64, 2368, 1, 1280, 64, 64, 1280, 2368]
    - [23, 4466.0]
  - - [128, 2368, 1, 1280, 128, 128, 1280, 2368]
    - [15, 5542.0]
  - - [64, 2944, 1, 1280, 64, 64, 1280, 2944]
    - [26, 4950.0]
  - - [128, 2944, 1, 1280, 128, 128, 1280, 2944]
    - [0, 6165.0]
  - - [64, 3584, 1, 1280, 64, 64, 1280, 3584]
    - [21, 5350.0]
  - - [128, 3584, 1, 1280, 128, 128, 1280, 3584]
    - [8, 6771.0]
  - - [64, 4288, 1, 1280, 64, 64, 1280, 4288]
    - [15, 5007.0]
  - - [128, 4288, 1, 1280, 128, 128, 1280, 4288]
    - [15, 6373.0]
  - - [64, 5056, 1, 1280, 64, 64, 1280, 5056]
    - [8, 5937.0]
  - - [128, 5056, 1, 1280, 128, 128, 1280, 5056]
    - [2, 7141.0]
  - - [64, 5888, 1, 1280, 64, 64, 1280, 5888]
    - [2, 6159.0]
  - - [128, 5888, 1, 1280, 128, 128, 1280, 5888]
    - [18, 7795.0]
  - - [64, 6784, 1, 1280, 64, 64, 1280, 6784]
    - [15, 6414.0]
  - - [128, 6784, 1, 1280, 128, 128, 1280, 6784]
    - [16, 7063.0]
  - - [64, 64, 1, 3328, 64, 64, 3328, 64]
    - [26, 166.0]
  - - [128, 64, 1, 3328, 128, 128, 3328, 64]
    - [20, 326.0]
  - - [64, 128, 1, 3328, 64, 64, 3328, 128]
    - [24, 328.0]
  - - [128, 128, 1, 3328, 128, 128, 3328, 128]
    - [28, 690.0]
  - - [64, 256, 1, 3328, 64, 64, 3328, 256]
    - [28, 690.0]
  - - [128, 256, 1, 3328, 128, 128, 3328, 256]
    - [31, 1407.0]
  - - [64, 448, 1, 3328, 64, 64, 3328, 448]
    - [31, 1235.0]
  - - [128, 448, 1, 3328, 128, 128, 3328, 448]
    - [31, 2343.0]
  - - [64, 704, 1, 3328, 64, 64, 3328, 704]
    - [31, 1838.0]
  - - [128, 704, 1, 3328, 128, 128, 3328, 704]
    - [27, 3452.0]
  - - [64, 1024, 1, 3328, 64, 64, 3328, 1024]
    - [31, 2655.0]
  - - [128, 1024, 1, 3328, 128, 128, 3328, 1024]
    - [27, 4664.0]
  - - [64, 1408, 1, 3328, 64, 64, 3328, 1408]
    - [27, 3455.0]
  - - [128, 1408, 1, 3328, 128, 128, 3328, 1408]
    - [26, 4910.0]
  - - [64, 1856, 1, 3328, 64, 64, 3328, 1856]
    - [27, 4260.0]
  - - [128, 1856, 1, 3328, 128, 128, 3328, 1856]
    - [21, 5749.0]
  - - [64, 2368, 1, 3328, 64, 64, 3328, 2368]
    - [27, 4639.0]
  - - [128, 2368, 1, 3328, 128, 128, 3328, 2368]
    - [8, 5768.0]
  - - [64, 2944, 1, 3328, 64, 64, 3328, 2944]
    - [26, 5133.0]
  - - [128, 2944, 1, 3328, 128, 128, 3328, 2944]
    - [5, 6438.0]
  - - [64, 3584, 1, 3328, 64, 64, 3328, 3584]
    - [21, 5557.0]
  - - [128, 3584, 1, 3328, 128, 128, 3328, 3584]
    - [8, 7006.0]
  - - [64, 4288, 1, 3328, 64, 64, 3328, 4288]
    - [8, 5254.0]
  - - [128, 4288, 1, 3328, 128, 128, 3328, 4288]
    - [8, 6569.0]
  - - [64, 5056, 1, 3328, 64, 64, 3328, 5056]
    - [8, 6141.0]
  - - [128, 5056, 1, 3328, 128, 128, 3328, 5056]
    - [0, 7316.0]
  - - [64, 5888, 1, 3328, 64, 64, 3328, 5888]
    - [13, 6419.0]
  - - [128, 5888, 1, 3328, 128, 128, 3328, 5888]
    - [18, 7984.0]
  - - [64, 6784, 1, 3328, 64, 64, 3328, 6784]
    - [8, 6655.0]
  - - [128, 6784, 1, 3328, 128, 128, 3328, 6784]
    - [18, 7196.0]
  - - [256, 64, 1, 256, 256, 256, 256, 64]
    - [24, 530.0]
  - - [448, 64, 1, 256, 448, 448, 256, 64]
    - [23, 900.0]
  - - [704, 64, 1, 256, 704, 704, 256, 64]
    - [4, 1347.0]
  - - [1024, 64, 1, 256, 1024, 1024, 256, 64]
    - [26, 1960.0]
  - - [1408, 64, 1, 256, 1408, 1408, 256, 64]
    - [23, 2552.0]
  - - [1856, 64, 1, 256, 1856, 1856, 256, 64]
    - [23, 3194.0]
  - - [2368, 64, 1, 256, 2368, 2368, 256, 64]
    - [23, 3566.0]
  - - [2944, 64, 1, 256, 2944, 2944, 256, 64]
    - [26, 3993.0]
  - - [3584, 64, 1, 256, 3584, 3584, 256, 64]
    - [8, 4449.0]
  - - [4288, 64, 1, 256, 4288, 4288, 256, 64]
    - [15, 4182.0]
  - - [5056, 64, 1, 256, 5056, 5056, 256, 64]
    - [15, 4861.0]
  - - [5888, 64, 1, 256, 5888, 5888, 256, 64]
    - [2, 5088.0]
  - - [6784, 64, 1, 256, 6784, 6784, 256, 64]
    - [15, 5448.0]
  - - [256, 128, 1, 256, 256, 256, 256, 128]
    - [29, 1028.0]
  - - [448, 128, 1, 256, 448, 448, 256, 128]
    - [26, 1748.0]
  - - [704, 128, 1, 256, 704, 704, 256, 128]
    - [27, 2552.0]
  - - [1024, 128, 1, 256, 1024, 1024, 256, 128]
    - [27, 3410.0]
  - - [1408, 128, 1, 256, 1408, 1408, 256, 128]
    - [26, 3897.0]
  - - [1856, 128, 1, 256, 1856, 1856, 256, 128]
    - [8, 4525.0]
  - - [2368, 128, 1, 256, 2368, 2368, 256, 128]
    - [8, 4619.0]
  - - [2944, 128, 1, 256, 2944, 2944, 256, 128]
    - [0, 5131.0]
  - - [3584, 128, 1, 256, 3584, 3584, 256, 128]
    - [15, 5757.0]
  - - [4288, 128, 1, 256, 4288, 4288, 256, 128]
    - [15, 5629.0]
  - - [5056, 128, 1, 256, 5056, 5056, 256, 128]
    - [0, 6038.0]
  - - [5888, 128, 1, 256, 5888, 5888, 256, 128]
    - [9, 6794.0]
  - - [6784, 128, 1, 256, 6784, 6784, 256, 128]
    - [16, 6447.0]
  - - [256, 64, 1, 1280, 256, 256, 1280, 64]
    - [28, 660.0]
  - - [448, 64, 1, 1280, 448, 448, 1280, 64]
    - [31, 1173.0]
  - - [704, 64, 1, 1280, 704, 704, 1280, 64]
    - [31, 1750.0]
  - - [1024, 64, 1, 1280, 1024, 1024, 1280, 64]
    - [26, 2527.0]
  - - [1408, 64, 1, 1280, 1408, 1408, 1280, 64]
    - [23, 3292.0]
  - - [1856, 64, 1, 1280, 1856, 1856, 1280, 64]
    - [27, 4087.0]
  - - [2368, 64, 1, 1280, 2368, 2368, 1280, 64]
    - [23, 4449.0]
  - - [2944, 64, 1, 1280, 2944, 2944, 1280, 64]
    - [30, 4958.0]
  - - [3584, 64, 1, 1280, 3584, 3584, 1280, 64]
    - [21, 5334.0]
  - - [4288, 64, 1, 1280, 4288, 4288, 1280, 64]
    - [15, 4950.0]
  - - [5056, 64, 1, 1280, 5056, 5056, 1280, 64]
    - [8, 5811.0]
  - - [5888, 64, 1, 1280, 5888, 5888, 1280, 64]
    - [13, 6109.0]
  - - [6784, 64, 1, 1280, 6784, 6784, 1280, 64]
    - [8, 6275.0]
  - - [256, 128, 1, 1280, 256, 256, 1280, 128]
    - [31, 1341.0]
  - - [448, 128, 1, 1280, 448, 448, 1280, 128]
    - [31, 2216.0]
  - - [704, 128, 1, 1280, 704, 704, 1280, 128]
    - [27, 3299.0]
  - - [1024, 128, 1, 1280, 1024, 1024, 1280, 128]
    - [27, 4481.0]
  - - [1408, 128, 1, 1280, 1408, 1408, 1280, 128]
    - [26, 4735.0]
  - - [1856, 128, 1, 1280, 1856, 1856, 1280, 128]
    - [21, 5509.0]
  - - [2368, 128, 1, 1280, 2368, 2368, 1280, 128]
    - [8, 5562.0]
  - - [2944, 128, 1, 1280, 2944, 2944, 1280, 128]
    - [5, 6216.0]
  - - [3584, 128, 1, 1280, 3584, 3584, 1280, 128]
    - [8, 6734.0]
  - - [4288, 128, 1, 1280, 4288, 4288, 1280, 128]
    - [8, 6350.0]
  - - [5056, 128, 1, 1280, 5056, 5056, 1280, 128]
    - [10, 6755.0]
  - - [5888, 128, 1, 1280, 5888, 5888, 1280, 128]
    - [18, 7681.0]
  - - [6784, 128, 1, 1280, 6784, 6784, 1280, 128]
    - [18, 6999.0]
  - - [256, 64, 1, 3328, 256, 256, 3328, 64]
    - [28, 690.0]
  - - [448, 64, 1, 3328, 448, 448, 3328, 64]
    - [31, 1233.0]
  - - [704, 64, 1, 3328, 704, 704, 3328, 64]
    - [31, 1845.0]
  - - [1024, 64, 1, 3328, 1024, 1024, 3328, 64]
    - [31, 2670.0]
  - - [1408, 64, 1, 3328, 1408, 1408, 3328, 64]
    - [23, 3455.0]
  - - [1856, 64, 1, 3328, 1856, 1856, 3328, 64]
    - [27, 4278.0]
  - - [2368, 64, 1, 3328, 2368, 2368, 3328, 64]
    - [27, 4639.0]
  - - [2944, 64, 1, 3328, 2944, 2944, 3328, 64]
    - [26, 5136.0]
  - - [3584, 64, 1, 3328, 3584, 3584, 3328, 64]
    - [8, 5453.0]
  - - [4288, 64, 1, 3328, 4288, 4288, 3328, 64]
    - [8, 5187.0]
  - - [5056, 64, 1, 3328, 5056, 5056, 3328, 64]
    - [8, 6091.0]
  - - [5888, 64, 1, 3328, 5888, 5888, 3328, 64]
    - [17, 6119.0]
  - - [6784, 64, 1, 3328, 6784, 6784, 3328, 64]
    - [8, 6276.0]
  - - [256, 128, 1, 3328, 256, 256, 3328, 128]
    - [31, 1408.0]
  - - [448, 128, 1, 3328, 448, 448, 3328, 128]
    - [31, 2346.0]
  - - [704, 128, 1, 3328, 704, 704, 3328, 128]
    - [27, 3465.0]
  - - [1024, 128, 1, 3328, 1024, 1024, 3328, 128]
    - [27, 4692.0]
  - - [1408, 128, 1, 3328, 1408, 1408, 3328, 128]
    - [26, 4913.0]
  - - [1856, 128, 1, 3328, 1856, 1856, 3328, 128]
    - [8, 5651.0]
  - - [2368, 128, 1, 3328, 2368, 2368, 3328, 128]
    - [8, 5760.0]
  - - [2944, 128, 1, 3328, 2944, 2944, 3328, 128]
    - [17, 6167.0]
  - - [3584, 128, 1, 3328, 3584, 3584, 3328, 128]
    - [8, 6549.0]
  - - [4288, 128, 1, 3328, 4288, 4288, 3328, 128]
    - [8, 5974.0]
  - - [5056, 128, 1, 3328, 5056, 5056, 3328, 128]
    - [10, 6937.0]
  - - [5888, 128, 1, 3328, 5888, 5888, 3328, 128]
    - [18, 7903.0]
  - - [6784, 128, 1, 3328, 6784, 6784, 3328, 128]
    - [9, 7143.0]
  - - [256, 256, 1, 256, 256, 256, 256, 256]
    - [30, 1978.0]
  - - [448, 256, 1, 256, 448, 448, 256, 256]
    - [27, 3084.0]
  - - [256, 448, 1, 256, 256, 256, 256, 448]
    - [27, 3058.0]
  - - [448, 448, 1, 256, 448, 448, 256, 448]
    - [8, 3940.0]
  - - [256, 256, 1, 1280, 256, 256, 1280, 256]
    - [26, 2527.0]
  - - [448, 256, 1, 1280, 448, 448, 1280, 256]
    - [27, 3946.0]
  - - [256, 448, 1, 1280, 256, 256, 1280, 448]
    - [23, 3929.0]
  - - [448, 448, 1, 1280, 448, 448, 1280, 448]
    - [8, 4722.0]
  - - [256, 256, 1, 3328, 256, 256, 3328, 256]
    - [32, 2665.0]
  - - [448, 256, 1, 3328, 448, 448, 3328, 256]
    - [27, 4134.0]
  - - [256, 448, 1, 3328, 256, 256, 3328, 448]
    - [27, 4138.0]
  - - [448, 448, 1, 3328, 448, 448, 3328, 448]
    - [21, 4891.0]
  - - [704, 256, 1, 256, 704, 704, 256, 256]
    - [6, 2988.0]
  - - [1024, 256, 1, 256, 1024, 1024, 256, 256]
    - [14, 4237.0]
  - - [1408, 256, 1, 256, 1408, 1408, 256, 256]
    - [6, 4179.0]
  - - [1856, 256, 1, 256, 1856, 1856, 256, 256]
    - [18, 5469.0]
  - - [2368, 256, 1, 256, 2368, 2368, 256, 256]
    - [18, 5607.0]
  - - [2944, 256, 1, 256, 2944, 2944, 256, 256]
    - [11, 6794.0]
  - - [3584, 256, 1, 256, 3584, 3584, 256, 256]
    - [11, 6688.0]
  - - [4288, 256, 1, 256, 4288, 4288, 256, 256]
    - [18, 6469.0]
  - - [5056, 256, 1, 256, 5056, 5056, 256, 256]
    - [18, 7544.0]
  - - [5888, 256, 1, 256, 5888, 5888, 256, 256]
    - [18, 7596.0]
  - - [6784, 256, 1, 256, 6784, 6784, 256, 256]
    - [18, 7708.0]
  - - [704, 448, 1, 256, 704, 704, 256, 448]
    - [18, 3683.0]
  - - [1024, 448, 1, 256, 1024, 1024, 256, 448]
    - [14, 5187.0]
  - - [1408, 448, 1, 256, 1408, 1408, 256, 448]
    - [18, 5851.0]
  - - [1856, 448, 1, 256, 1856, 1856, 256, 448]
    - [18, 6145.0]
  - - [2368, 448, 1, 256, 2368, 2368, 256, 448]
    - [3, 6263.0]
  - - [2944, 448, 1, 256, 2944, 2944, 256, 448]
    - [18, 6731.0]
  - - [3584, 448, 1, 256, 3584, 3584, 256, 448]
    - [18, 7146.0]
  - - [4288, 448, 1, 256, 4288, 4288, 256, 448]
    - [18, 7580.0]
  - - [5056, 448, 1, 256, 5056, 5056, 256, 448]
    - [18, 7974.0]
  - - [5888, 448, 1, 256, 5888, 5888, 256, 448]
    - [11, 7787.0]
  - - [6784, 448, 1, 256, 6784, 6784, 256, 448]
    - [18, 8228.0]
  - - [256, 704, 1, 256, 256, 256, 256, 704]
    - [14, 2958.0]
  - - [448, 704, 1, 256, 448, 448, 256, 704]
    - [18, 3697.0]
  - - [704, 704, 1, 256, 704, 704, 256, 704]
    - [18, 5746.0]
  - - [1024, 704, 1, 256, 1024, 1024, 256, 704]
    - [14, 6462.0]
  - - [1408, 704, 1, 256, 1408, 1408, 256, 704]
    - [18, 7292.0]
  - - [1856, 704, 1, 256, 1856, 1856, 256, 704]
    - [11, 7672.0]
  - - [2368, 704, 1, 256, 2368, 2368, 256, 704]
    - [11, 7420.0]
  - - [2944, 704, 1, 256, 2944, 2944, 256, 704]
    - [18, 8158.0]
  - - [3584, 704, 1, 256, 3584, 3584, 256, 704]
    - [18, 8082.0]
  - - [4288, 704, 1, 256, 4288, 4288, 256, 704]
    - [18, 8214.0]
  - - [5056, 704, 1, 256, 5056, 5056, 256, 704]
    - [18, 8363.0]
  - - [5888, 704, 1, 256, 5888, 5888, 256, 704]
    - [11, 8547.0]
  - - [6784, 704, 1, 256, 6784, 6784, 256, 704]
    - [18, 8393.0]
  - - [256, 1024, 1, 256, 256, 256, 256, 1024]
    - [14, 4237.0]
  - - [448, 1024, 1, 256, 448, 448, 256, 1024]
    - [18, 5300.0]
  - - [704, 1024, 1, 256, 704, 704, 256, 1024]
    - [18, 6629.0]
  - - [1024, 1024, 1, 256, 1024, 1024, 256, 1024]
    - [18, 7457.0]
  - - [1408, 1024, 1, 256, 1408, 1408, 256, 1024]
    - [11, 7277.0]
  - - [1856, 1024, 1, 256, 1856, 1856, 256, 1024]
    - [18, 7546.0]
  - - [2368, 1024, 1, 256, 2368, 2368, 256, 1024]
    - [18, 7798.0]
  - - [2944, 1024, 1, 256, 2944, 2944, 256, 1024]
    - [18, 8175.0]
  - - [3584, 1024, 1, 256, 3584, 3584, 256, 1024]
    - [18, 8455.0]
  - - [4288, 1024, 1, 256, 4288, 4288, 256, 1024]
    - [18, 8568.0]
  - - [5056, 1024, 1, 256, 5056, 5056, 256, 1024]
    - [18, 8642.0]
  - - [5888, 1024, 1, 256, 5888, 5888, 256, 1024]
    - [18, 8738.0]
  - - [6784, 1024, 1, 256, 6784, 6784, 256, 1024]
    - [18, 8697.0]
  - - [256, 1408, 1, 256, 256, 256, 256, 1408]
    - [6, 4179.0]
  - - [448, 1408, 1, 256, 448, 448, 256, 1408]
    - [18, 5834.0]
  - - [704, 1408, 1, 256, 704, 704, 256, 1408]
    - [18, 7309.0]
  - - [1024, 1408, 1, 256, 1024, 1024, 256, 1408]
    - [11, 7120.0]
  - - [1408, 1408, 1, 256, 1408, 1408, 256, 1408]
    - [18, 7803.0]
  - - [1856, 1408, 1, 256, 1856, 1856, 256, 1408]
    - [18, 8379.0]
  - - [2368, 1408, 1, 256, 2368, 2368, 256, 1408]
    - [11, 8381.0]
  - - [2944, 1408, 1, 256, 2944, 2944, 256, 1408]
    - [11, 8558.0]
  - - [3584, 1408, 1, 256, 3584, 3584, 256, 1408]
    - [18, 8441.0]
  - - [4288, 1408, 1, 256, 4288, 4288, 256, 1408]
    - [18, 8500.0]
  - - [5056, 1408, 1, 256, 5056, 5056, 256, 1408]
    - [11, 8619.0]
  - - [5888, 1408, 1, 256, 5888, 5888, 256, 1408]
    - [18, 8808.0]
  - - [6784, 1408, 1, 256, 6784, 6784, 256, 1408]
    - [18, 8816.0]
  - - [256, 1856, 1, 256, 256, 256, 256, 1856]
    - [14, 5430.0]
  - - [448, 1856, 1, 256, 448, 448, 256, 1856]
    - [18, 6173.0]
  - - [704, 1856, 1, 256, 704, 704, 256, 1856]
    - [18, 7672.0]
  - - [1024, 1856, 1, 256, 1024, 1024, 256, 1856]
    - [18, 7471.0]
  - - [1408, 1856, 1, 256, 1408, 1408, 256, 1856]
    - [11, 8362.0]
  - - [1856, 1856, 1, 256, 1856, 1856, 256, 1856]
    - [18, 8111.0]
  - - [2368, 1856, 1, 256, 2368, 2368, 256, 1856]
    - [11, 8581.0]
  - - [2944, 1856, 1, 256, 2944, 2944, 256, 1856]
    - [11, 8712.0]
  - - [3584, 1856, 1, 256, 3584, 3584, 256, 1856]
    - [18, 8642.0]
  - - [4288, 1856, 1, 256, 4288, 4288, 256, 1856]
    - [18, 8722.0]
  - - [5056, 1856, 1, 256, 5056, 5056, 256, 1856]
    - [18, 8887.0]
  - - [5888, 1856, 1, 256, 5888, 5888, 256, 1856]
    - [11, 8898.0]
  - - [6784, 1856, 1, 256, 6784, 6784, 256, 1856]
    - [18, 8826.0]
  - - [256, 2368, 1, 256, 256, 256, 256, 2368]
    - [6, 5542.0]
  - - [448, 2368, 1, 256, 448, 448, 256, 2368]
    - [18, 6275.0]
  - - [704, 2368, 1, 256, 704, 704, 256, 2368]
    - [11, 7420.0]
  - - [1024, 2368, 1, 256, 1024, 1024, 256, 2368]
    - [18, 7759.0]
  - - [1408, 2368, 1, 256, 1408, 1408, 256, 2368]
    - [11, 8381.0]
  - - [1856, 2368, 1, 256, 1856, 1856, 256, 2368]
    - [18, 8581.0]
  - - [2368, 2368, 1, 256, 2368, 2368, 256, 2368]
    - [18, 8561.0]
  - - [2944, 2368, 1, 256, 2944, 2944, 256, 2368]
    - [18, 8728.0]
  - - [3584, 2368, 1, 256, 3584, 3584, 256, 2368]
    - [18, 8749.0]
  - - [4288, 2368, 1, 256, 4288, 4288, 256, 2368]
    - [18, 8892.0]
  - - [5056, 2368, 1, 256, 5056, 5056, 256, 2368]
    - [11, 8916.0]
  - - [5888, 2368, 1, 256, 5888, 5888, 256, 2368]
    - [18, 8883.0]
  - - [6784, 2368, 1, 256, 6784, 6784, 256, 2368]
    - [11, 8928.0]
  - - [256, 2944, 1, 256, 256, 256, 256, 2944]
    - [6, 6775.0]
  - - [448, 2944, 1, 256, 448, 448, 256, 2944]
    - [18, 6721.0]
  - - [704, 2944, 1, 256, 704, 704, 256, 2944]
    - [18, 8158.0]
  - - [1024, 2944, 1, 256, 1024, 1024, 256, 2944]
    - [18, 8148.0]
  - - [1408, 2944, 1, 256, 1408, 1408, 256, 2944]
    - [18, 8574.0]
  - - [1856, 2944, 1, 256, 1856, 1856, 256, 2944]
    - [11, 8708.0]
  - - [2368, 2944, 1, 256, 2368, 2368, 256, 2944]
    - [11, 8735.0]
  - - [2944, 2944, 1, 256, 2944, 2944, 256, 2944]
    - [11, 8697.0]
  - - [3584, 2944, 1, 256, 3584, 3584, 256, 2944]
    - [11, 8797.0]
  - - [4288, 2944, 1, 256, 4288, 4288, 256, 2944]
    - [11, 8843.0]
  - - [5056, 2944, 1, 256, 5056, 5056, 256, 2944]
    - [18, 8987.0]
  - - [5888, 2944, 1, 256, 5888, 5888, 256, 2944]
    - [18, 8922.0]
  - - [6784, 2944, 1, 256, 6784, 6784, 256, 2944]
    - [18, 8965.0]
  - - [256, 3584, 1, 256, 256, 256, 256, 3584]
    - [3, 6781.0]
  - - [448, 3584, 1, 256, 448, 448, 256, 3584]
    - [18, 7176.0]
  - - [704, 3584, 1, 256, 704, 704, 256, 3584]
    - [11, 8106.0]
  - - [1024, 3584, 1, 256, 1024, 1024, 256, 3584]
    - [18, 8510.0]
  - - [1408, 3584, 1, 256, 1408, 1408, 256, 3584]
    - [11, 8441.0]
  - - [1856, 3584, 1, 256, 1856, 1856, 256, 3584]
    - [11, 8642.0]
  - - [2368, 3584, 1, 256, 2368, 2368, 256, 3584]
    - [18, 8758.0]
  - - [2944, 3584, 1, 256, 2944, 2944, 256, 3584]
    - [11, 8809.0]
  - - [3584, 3584, 1, 256, 3584, 3584, 256, 3584]
    - [11, 8983.0]
  - - [4288, 3584, 1, 256, 4288, 4288, 256, 3584]
    - [18, 8966.0]
  - - [5056, 3584, 1, 256, 5056, 5056, 256, 3584]
    - [19, 8987.0]
  - - [5888, 3584, 1, 256, 5888, 5888, 256, 3584]
    - [18, 9005.0]
  - - [6784, 3584, 1, 256, 6784, 6784, 256, 3584]
    - [18, 9052.0]
  - - [256, 4288, 1, 256, 256, 256, 256, 4288]
    - [11, 6493.0]
  - - [448, 4288, 1, 256, 448, 448, 256, 4288]
    - [18, 7589.0]
  - - [704, 4288, 1, 256, 704, 704, 256, 4288]
    - [11, 8180.0]
  - - [1024, 4288, 1, 256, 1024, 1024, 256, 4288]
    - [18, 8485.0]
  - - [1408, 4288, 1, 256, 1408, 1408, 256, 4288]
    - [18, 8489.0]
  - - [1856, 4288, 1, 256, 1856, 1856, 256, 4288]
    - [18, 8719.0]
  - - [2368, 4288, 1, 256, 2368, 2368, 256, 4288]
    - [18, 8888.0]
  - - [2944, 4288, 1, 256, 2944, 2944, 256, 4288]
    - [11, 8849.0]
  - - [3584, 4288, 1, 256, 3584, 3584, 256, 4288]
    - [11, 8964.0]
  - - [4288, 4288, 1, 256, 4288, 4288, 256, 4288]
    - [18, 8950.0]
  - - [5056, 4288, 1, 256, 5056, 5056, 256, 4288]
    - [18, 9037.0]
  - - [5888, 4288, 1, 256, 5888, 5888, 256, 4288]
    - [11, 9017.0]
  - - [6784, 4288, 1, 256, 6784, 6784, 256, 4288]
    - [11, 9084.0]
  - - [256, 5056, 1, 256, 256, 256, 256, 5056]
    - [11, 7476.0]
  - - [448, 5056, 1, 256, 448, 448, 256, 5056]
    - [11, 7956.0]
  - - [704, 5056, 1, 256, 704, 704, 256, 5056]
    - [18, 8344.0]
  - - [1024, 5056, 1, 256, 1024, 1024, 256, 5056]
    - [18, 8620.0]
  - - [1408, 5056, 1, 256, 1408, 1408, 256, 5056]
    - [18, 8616.0]
  - - [1856, 5056, 1, 256, 1856, 1856, 256, 5056]
    - [18, 8887.0]
  - - [2368, 5056, 1, 256, 2368, 2368, 256, 5056]
    - [18, 8924.0]
  - - [2944, 5056, 1, 256, 2944, 2944, 256, 5056]
    - [18, 8982.0]
  - - [3584, 5056, 1, 256, 3584, 3584, 256, 5056]
    - [11, 8942.0]
  - - [4288, 5056, 1, 256, 4288, 4288, 256, 5056]
    - [18, 9036.0]
  - - [5056, 5056, 1, 256, 5056, 5056, 256, 5056]
    - [11, 9036.0]
  - - [5888, 5056, 1, 256, 5888, 5888, 256, 5056]
    - [33, 9086.0]
  - - [6784, 5056, 1, 256, 6784, 6784, 256, 5056]
    - [11, 9096.0]
  - - [256, 5888, 1, 256, 256, 256, 256, 5888]
    - [11, 7572.0]
  - - [448, 5888, 1, 256, 448, 448, 256, 5888]
    - [11, 7773.0]
  - - [704, 5888, 1, 256, 704, 704, 256, 5888]
    - [18, 8569.0]
  - - [1024, 5888, 1, 256, 1024, 1024, 256, 5888]
    - [18, 8679.0]
  - - [1408, 5888, 1, 256, 1408, 1408, 256, 5888]
    - [18, 8802.0]
  - - [1856, 5888, 1, 256, 1856, 1856, 256, 5888]
    - [12, 8925.0]
  - - [2368, 5888, 1, 256, 2368, 2368, 256, 5888]
    - [12, 8918.0]
  - - [2944, 5888, 1, 256, 2944, 2944, 256, 5888]
    - [18, 8928.0]
  - - [3584, 5888, 1, 256, 3584, 3584, 256, 5888]
    - [11, 9004.0]
  - - [4288, 5888, 1, 256, 4288, 4288, 256, 5888]
    - [11, 9020.0]
  - - [5056, 5888, 1, 256, 5056, 5056, 256, 5888]
    - [12, 9131.0]
  - - [5888, 5888, 1, 256, 5888, 5888, 256, 5888]
    - [18, 9055.0]
  - - [6784, 5888, 1, 256, 6784, 6784, 256, 5888]
    - [19, 9105.0]
  - - [256, 6784, 1, 256, 256, 256, 256, 6784]
    - [1, 7634.0]
  - - [448, 6784, 1, 256, 448, 448, 256, 6784]
    - [18, 8249.0]
  - - [704, 6784, 1, 256, 704, 704, 256, 6784]
    - [11, 8402.0]
  - - [1024, 6784, 1, 256, 1024, 1024, 256, 6784]
    - [18, 8663.0]
  - - [1408, 6784, 1, 256, 1408, 1408, 256, 6784]
    - [18, 8809.0]
  - - [1856, 6784, 1, 256, 1856, 1856, 256, 6784]
    - [18, 8826.0]
  - - [2368, 6784, 1, 256, 2368, 2368, 256, 6784]
    - [12, 8979.0]
  - - [2944, 6784, 1, 256, 2944, 2944, 256, 6784]
    - [11, 8969.0]
  - - [3584, 6784, 1, 256, 3584, 3584, 256, 6784]
    - [18, 9045.0]
  - - [4288, 6784, 1, 256, 4288, 4288, 256, 6784]
    - [11, 9088.0]
  - - [5056, 6784, 1, 256, 5056, 5056, 256, 6784]
    - [19, 9101.0]
  - - [5888, 6784, 1, 256, 5888, 5888, 256, 6784]
    - [12, 9085.0]
  - - [6784, 6784, 1, 256, 6784, 6784, 256, 6784]
    - [19, 9172.0]
  - - [704, 256, 1, 1280, 704, 704, 1280, 256]
    - [14, 3483.0]
  - - [1024, 256, 1, 1280, 1024, 1024, 1280, 256]
    - [14, 4999.0]
  - - [1408, 256, 1, 1280, 1408, 1408, 1280, 256]
    - [14, 4875.0]
  - - [1856, 256, 1, 1280, 1856, 1856, 1280, 256]
    - [6, 6356.0]
  - - [2368, 256, 1, 1280, 2368, 2368, 1280, 256]
    - [6, 6306.0]
  - - [2944, 256, 1, 1280, 2944, 2944, 1280, 256]
    - [11, 7740.0]
  - - [3584, 256, 1, 1280, 3584, 3584, 1280, 256]
    - [6, 7407.0]
  - - [4288, 256, 1, 1280, 4288, 4288, 1280, 256]
    - [11, 6956.0]
  - - [5056, 256, 1, 1280, 5056, 5056, 1280, 256]
    - [11, 8179.0]
  - - [5888, 256, 1, 1280, 5888, 5888, 1280, 256]
    - [18, 8115.0]
  - - [6784, 256, 1, 1280, 6784, 6784, 1280, 256]
    - [11, 8168.0]
  - - [704, 448, 1, 1280, 704, 704, 1280, 448]
    - [6, 4287.0]
  - - [1024, 448, 1, 1280, 1024, 1024, 1280, 448]
    - [6, 6101.0]
  - - [1408, 448, 1, 1280, 1408, 1408, 1280, 448]
    - [6, 6562.0]
  - - [1856, 448, 1, 1280, 1856, 1856, 1280, 448]
    - [6, 6760.0]
  - - [2368, 448, 1, 1280, 2368, 2368, 1280, 448]
    - [11, 6787.0]
  - - [2944, 448, 1, 1280, 2944, 2944, 1280, 448]
    - [11, 7175.0]
  - - [3584, 448, 1, 1280, 3584, 3584, 1280, 448]
    - [18, 7585.0]
  - - [4288, 448, 1, 1280, 4288, 4288, 1280, 448]
    - [18, 8061.0]
  - - [5056, 448, 1, 1280, 5056, 5056, 1280, 448]
    - [11, 8438.0]
  - - [5888, 448, 1, 1280, 5888, 5888, 1280, 448]
    - [11, 8152.0]
  - - [6784, 448, 1, 1280, 6784, 6784, 1280, 448]
    - [11, 8634.0]
  - - [256, 704, 1, 1280, 256, 256, 1280, 704]
    - [22, 3478.0]
  - - [448, 704, 1, 1280, 448, 448, 1280, 704]
    - [6, 4302.0]
  - - [704, 704, 1, 1280, 704, 704, 1280, 704]
    - [6, 6625.0]
  - - [1024, 704, 1, 1280, 1024, 1024, 1280, 704]
    - [6, 7403.0]
  - - [1408, 704, 1, 1280, 1408, 1408, 1280, 704]
    - [18, 8002.0]
  - - [1856, 704, 1, 1280, 1856, 1856, 1280, 704]
    - [11, 8280.0]
  - - [2368, 704, 1, 1280, 2368, 2368, 1280, 704]
    - [11, 7903.0]
  - - [2944, 704, 1, 1280, 2944, 2944, 1280, 704]
    - [18, 8661.0]
  - - [3584, 704, 1, 1280, 3584, 3584, 1280, 704]
    - [11, 8531.0]
  - - [4288, 704, 1, 1280, 4288, 4288, 1280, 704]
    - [11, 8582.0]
  - - [5056, 704, 1, 1280, 5056, 5056, 1280, 704]
    - [11, 8731.0]
  - - [5888, 704, 1, 1280, 5888, 5888, 1280, 704]
    - [18, 8925.0]
  - - [6784, 704, 1, 1280, 6784, 6784, 1280, 704]
    - [11, 8723.0]
  - - [256, 1024, 1, 1280, 256, 256, 1280, 1024]
    - [14, 5011.0]
  - - [448, 1024, 1, 1280, 448, 448, 1280, 1024]
    - [6, 6132.0]
  - - [704, 1024, 1, 1280, 704, 704, 1280, 1024]
    - [18, 7456.0]
  - - [1024, 1024, 1, 1280, 1024, 1024, 1280, 1024]
    - [18, 8435.0]
  - - [1408, 1024, 1, 1280, 1408, 1408, 1280, 1024]
    - [18, 7852.0]
  - - [1856, 1024, 1, 1280, 1856, 1856, 1280, 1024]
    - [18, 7996.0]
  - - [2368, 1024, 1, 1280, 2368, 2368, 1280, 1024]
    - [18, 8213.0]
  - - [2944, 1024, 1, 1280, 2944, 2944, 1280, 1024]
    - [18, 8580.0]
  - - [3584, 1024, 1, 1280, 3584, 3584, 1280, 1024]
    - [18, 8988.0]
  - - [4288, 1024, 1, 1280, 4288, 4288, 1280, 1024]
    - [11, 8917.0]
  - - [5056, 1024, 1, 1280, 5056, 5056, 1280, 1024]
    - [18, 8984.0]
  - - [5888, 1024, 1, 1280, 5888, 5888, 1280, 1024]
    - [18, 9110.0]
  - - [6784, 1024, 1, 1280, 6784, 6784, 1280, 1024]
    - [18, 8994.0]
  - - [256, 1408, 1, 1280, 256, 256, 1280, 1408]
    - [14, 4892.0]
  - - [448, 1408, 1, 1280, 448, 448, 1280, 1408]
    - [6, 6575.0]
  - - [704, 1408, 1, 1280, 704, 704, 1280, 1408]
    - [18, 8038.0]
  - - [1024, 1408, 1, 1280, 1024, 1024, 1280, 1408]
    - [18, 7855.0]
  - - [1408, 1408, 1, 1280, 1408, 1408, 1280, 1408]
    - [18, 8330.0]
  - - [1856, 1408, 1, 1280, 1856, 1856, 1280, 1408]
    - [18, 8840.0]
  - - [2368, 1408, 1, 1280, 2368, 2368, 1280, 1408]
    - [18, 8784.0]
  - - [2944, 1408, 1, 1280, 2944, 2944, 1280, 1408]
    - [11, 8946.0]
  - - [3584, 1408, 1, 1280, 3584, 3584, 1280, 1408]
    - [11, 8780.0]
  - - [4288, 1408, 1, 1280, 4288, 4288, 1280, 1408]
    - [11, 8794.0]
  - - [5056, 1408, 1, 1280, 5056, 5056, 1280, 1408]
    - [18, 8912.0]
  - - [5888, 1408, 1, 1280, 5888, 5888, 1280, 1408]
    - [11, 9096.0]
  - - [6784, 1408, 1, 1280, 6784, 6784, 1280, 1408]
    - [11, 9083.0]
  - - [256, 1856, 1, 1280, 256, 256, 1280, 1856]
    - [14, 6335.0]
  - - [448, 1856, 1, 1280, 448, 448, 1280, 1856]
    - [18, 6774.0]
  - - [704, 1856, 1, 1280, 704, 704, 1280, 1856]
    - [11, 8293.0]
  - - [1024, 1856, 1, 1280, 1024, 1024, 1280, 1856]
    - [18, 7996.0]
  - - [1408, 1856, 1, 1280, 1408, 1408, 1280, 1856]
    - [18, 8847.0]
  - - [1856, 1856, 1, 1280, 1856, 1856, 1280, 1856]
    - [18, 8468.0]
  - - [2368, 1856, 1, 1280, 2368, 2368, 1280, 1856]
    - [11, 8947.0]
  - - [2944, 1856, 1, 1280, 2944, 2944, 1280, 1856]
    - [11, 9058.0]
  - - [3584, 1856, 1, 1280, 3584, 3584, 1280, 1856]
    - [11, 8951.0]
  - - [4288, 1856, 1, 1280, 4288, 4288, 1280, 1856]
    - [11, 9017.0]
  - - [5056, 1856, 1, 1280, 5056, 5056, 1280, 1856]
    - [18, 9170.0]
  - - [5888, 1856, 1, 1280, 5888, 5888, 1280, 1856]
    - [11, 9176.0]
  - - [6784, 1856, 1, 1280, 6784, 6784, 1280, 1856]
    - [11, 9081.0]
  - - [256, 2368, 1, 1280, 256, 256, 1280, 2368]
    - [18, 6294.0]
  - - [448, 2368, 1, 1280, 448, 448, 1280, 2368]
    - [18, 6771.0]
  - - [704, 2368, 1, 1280, 704, 704, 1280, 2368]
    - [18, 7910.0]
  - - [1024, 2368, 1, 1280, 1024, 1024, 1280, 2368]
    - [18, 8220.0]
  - - [1408, 2368, 1, 1280, 1408, 1408, 1280, 2368]
    - [18, 8791.0]
  - - [1856, 2368, 1, 1280, 1856, 1856, 1280, 2368]
    - [11, 8942.0]
  - - [2368, 2368, 1, 1280, 2368, 2368, 1280, 2368]
    - [11, 8887.0]
  - - [2944, 2368, 1, 1280, 2944, 2944, 1280, 2368]
    - [11, 9041.0]
  - - [3584, 2368, 1, 1280, 3584, 3584, 1280, 2368]
    - [11, 9045.0]
  - - [4288, 2368, 1, 1280, 4288, 4288, 1280, 2368]
    - [11, 9176.0]
  - - [5056, 2368, 1, 1280, 5056, 5056, 1280, 2368]
    - [11, 9185.0]
  - - [5888, 2368, 1, 1280, 5888, 5888, 1280, 2368]
    - [11, 9136.0]
  - - [6784, 2368, 1, 1280, 6784, 6784, 1280, 2368]
    - [18, 9178.0]
  - - [256, 2944, 1, 1280, 256, 256, 1280, 2944]
    - [18, 7745.0]
  - - [448, 2944, 1, 1280, 448, 448, 1280, 2944]
    - [18, 7205.0]
  - - [704, 2944, 1, 1280, 704, 704, 1280, 2944]
    - [18, 8695.0]
  - - [1024, 2944, 1, 1280, 1024, 1024, 1280, 2944]
    - [18, 8589.0]
  - - [1408, 2944, 1, 1280, 1408, 1408, 1280, 2944]
    - [18, 8955.0]
  - - [1856, 2944, 1, 1280, 1856, 1856, 1280, 2944]
    - [11, 9058.0]
  - - [2368, 2944, 1, 1280, 2368, 2368, 1280, 2944]
    - [18, 9049.0]
  - - [2944, 2944, 1, 1280, 2944, 2944, 1280, 2944]
    - [11, 8972.0]
  - - [3584, 2944, 1, 1280, 3584, 3584, 1280, 2944]
    - [18, 9074.0]
  - - [4288, 2944, 1, 1280, 4288, 4288, 1280, 2944]
    - [11, 9106.0]
  - - [5056, 2944, 1, 1280, 5056, 5056, 1280, 2944]
    - [11, 9237.0]
  - - [5888, 2944, 1, 1280, 5888, 5888, 1280, 2944]
    - [18, 9190.0]
  - - [6784, 2944, 1, 1280, 6784, 6784, 1280, 2944]
    - [11, 9203.0]
  - - [256, 3584, 1, 1280, 256, 256, 1280, 3584]
    - [18, 7452.0]
  - - [448, 3584, 1, 1280, 448, 448, 1280, 3584]
    - [18, 7619.0]
  - - [704, 3584, 1, 1280, 704, 704, 1280, 3584]
    - [18, 8558.0]
  - - [1024, 3584, 1, 1280, 1024, 1024, 1280, 3584]
    - [18, 8981.0]
  - - [1408, 3584, 1, 1280, 1408, 1408, 1280, 3584]
    - [18, 8779.0]
  - - [1856, 3584, 1, 1280, 1856, 1856, 1280, 3584]
    - [11, 8955.0]
  - - [2368, 3584, 1, 1280, 2368, 2368, 1280, 3584]
    - [18, 9044.0]
  - - [2944, 3584, 1, 1280, 2944, 2944, 1280, 3584]
    - [11, 9078.0]
  - - [3584, 3584, 1, 1280, 3584, 3584, 1280, 3584]
    - [11, 9259.0]
  - - [4288, 3584, 1, 1280, 4288, 4288, 1280, 3584]
    - [11, 9223.0]
  - - [5056, 3584, 1, 1280, 5056, 5056, 1280, 3584]
    - [12, 9217.0]
  - - [5888, 3584, 1, 1280, 5888, 5888, 1280, 3584]
    - [11, 9267.0]
  - - [6784, 3584, 1, 1280, 6784, 6784, 1280, 3584]
    - [11, 9301.0]
  - - [256, 4288, 1, 1280, 256, 256, 1280, 4288]
    - [11, 6995.0]
  - - [448, 4288, 1, 1280, 448, 448, 1280, 4288]
    - [18, 8063.0]
  - - [704, 4288, 1, 1280, 704, 704, 1280, 4288]
    - [18, 8602.0]
  - - [1024, 4288, 1, 1280, 1024, 1024, 1280, 4288]
    - [18, 8921.0]
  - - [1408, 4288, 1, 1280, 1408, 1408, 1280, 4288]
    - [18, 8800.0]
  - - [1856, 4288, 1, 1280, 1856, 1856, 1280, 4288]
    - [18, 9020.0]
  - - [2368, 4288, 1, 1280, 2368, 2368, 1280, 4288]
    - [11, 9174.0]
  - - [2944, 4288, 1, 1280, 2944, 2944, 1280, 4288]
    - [11, 9107.0]
  - - [3584, 4288, 1, 1280, 3584, 3584, 1280, 4288]
    - [11, 9224.0]
  - - [4288, 4288, 1, 1280, 4288, 4288, 1280, 4288]
    - [18, 9195.0]
  - - [5056, 4288, 1, 1280, 5056, 5056, 1280, 4288]
    - [11, 9282.0]
  - - [5888, 4288, 1, 1280, 5888, 5888, 1280, 4288]
    - [18, 9269.0]
  - - [6784, 4288, 1, 1280, 6784, 6784, 1280, 4288]
    - [11, 9340.0]
  - - [256, 5056, 1, 1280, 256, 256, 1280, 5056]
    - [11, 8218.0]
  - - [448, 5056, 1, 1280, 448, 448, 1280, 5056]
    - [18, 8440.0]
  - - [704, 5056, 1, 1280, 704, 704, 1280, 5056]
    - [18, 8747.0]
  - - [1024, 5056, 1, 1280, 1024, 1024, 1280, 5056]
    - [18, 8994.0]
  - - [1408, 5056, 1, 1280, 1408, 1408, 1280, 5056]
    - [18, 8918.0]
  - - [1856, 5056, 1, 1280, 1856, 1856, 1280, 5056]
    - [11, 9175.0]
  - - [2368, 5056, 1, 1280, 2368, 2368, 1280, 5056]
    - [18, 9192.0]
  - - [2944, 5056, 1, 1280, 2944, 2944, 1280, 5056]
    - [11, 9244.0]
  - - [3584, 5056, 1, 1280, 3584, 3584, 1280, 5056]
    - [33, 9200.0]
  - - [4288, 5056, 1, 1280, 4288, 4288, 1280, 5056]
    - [11, 9282.0]
  - - [5056, 5056, 1, 1280, 5056, 5056, 1280, 5056]
    - [11, 9280.0]
  - - [5888, 5056, 1, 1280, 5888, 5888, 1280, 5056]
    - [33, 9316.0]
  - - [6784, 5056, 1, 1280, 6784, 6784, 1280, 5056]
    - [11, 9334.0]
  - - [256, 5888, 1, 1280, 256, 256, 1280, 5888]
    - [18, 8203.0]
  - - [448, 5888, 1, 1280, 448, 448, 1280, 5888]
    - [18, 8163.0]
  - - [704, 5888, 1, 1280, 704, 704, 1280, 5888]
    - [18, 8944.0]
  - - [1024, 5888, 1, 1280, 1024, 1024, 1280, 5888]
    - [18, 9137.0]
  - - [1408, 5888, 1, 1280, 1408, 1408, 1280, 5888]
    - [18, 9103.0]
  - - [1856, 5888, 1, 1280, 1856, 1856, 1280, 5888]
    - [18, 9177.0]
  - - [2368, 5888, 1, 1280, 2368, 2368, 1280, 5888]
    - [11, 9136.0]
  - - [2944, 5888, 1, 1280, 2944, 2944, 1280, 5888]
    - [11, 9176.0]
  - - [3584, 5888, 1, 1280, 3584, 3584, 1280, 5888]
    - [18, 9261.0]
  - - [4288, 5888, 1, 1280, 4288, 4288, 1280, 5888]
    - [11, 9268.0]
  - - [5056, 5888, 1, 1280, 5056, 5056, 1280, 5888]
    - [19, 9328.0]
  - - [5888, 5888, 1, 1280, 5888, 5888, 1280, 5888]
    - [11, 9293.0]
  - - [6784, 5888, 1, 1280, 6784, 6784, 1280, 5888]
    - [11, 9314.0]
  - - [256, 6784, 1, 1280, 256, 256, 1280, 6784]
    - [18, 8221.0]
  - - [448, 6784, 1, 1280, 448, 448, 1280, 6784]
    - [18, 8659.0]
  - - [704, 6784, 1, 1280, 704, 704, 1280, 6784]
    - [11, 8730.0]
  - - [1024, 6784, 1, 1280, 1024, 1024, 1280, 6784]
    - [18, 9003.0]
  - - [1408, 6784, 1, 1280, 1408, 1408, 1280, 6784]
    - [11, 9092.0]
  - - [1856, 6784, 1, 1280, 1856, 1856, 1280, 6784]
    - [11, 9089.0]
  - - [2368, 6784, 1, 1280, 2368, 2368, 1280, 6784]
    - [11, 9180.0]
  - - [2944, 6784, 1, 1280, 2944, 2944, 1280, 6784]
    - [11, 9219.0]
  - - [3584, 6784, 1, 1280, 3584, 3584, 1280, 6784]
    - [18, 9306.0]
  - - [4288, 6784, 1, 1280, 4288, 4288, 1280, 6784]
    - [11, 9339.0]
  - - [5056, 6784, 1, 1280, 5056, 5056, 1280, 6784]
    - [11, 9335.0]
  - - [5888, 6784, 1, 1280, 5888, 5888, 1280, 6784]
    - [11, 9309.0]
  - - [6784, 6784, 1, 1280, 6784, 6784, 1280, 6784]
    - [12, 9379.0]
  - - [704, 256, 1, 3328, 704, 704, 3328, 256]
    - [22, 3575.0]
  - - [1024, 256, 1, 3328, 1024, 1024, 3328, 256]
    - [22, 5176.0]
  - - [1408, 256, 1, 3328, 1408, 1408, 3328, 256]
    - [6, 5028.0]
  - - [1856, 256, 1, 3328, 1856, 1856, 3328, 256]
    - [18, 6485.0]
  - - [2368, 256, 1, 3328, 2368, 2368, 3328, 256]
    - [18, 6389.0]
  - - [2944, 256, 1, 3328, 2944, 2944, 3328, 256]
    - [11, 7891.0]
  - - [3584, 256, 1, 3328, 3584, 3584, 3328, 256]
    - [11, 7510.0]
  - - [4288, 256, 1, 3328, 4288, 4288, 3328, 256]
    - [11, 7095.0]
  - - [5056, 256, 1, 3328, 5056, 5056, 3328, 256]
    - [11, 8329.0]
  - - [5888, 256, 1, 3328, 5888, 5888, 3328, 256]
    - [18, 8278.0]
  - - [6784, 256, 1, 3328, 6784, 6784, 3328, 256]
    - [11, 8305.0]
  - - [704, 448, 1, 3328, 704, 704, 3328, 448]
    - [6, 4421.0]
  - - [1024, 448, 1, 3328, 1024, 1024, 3328, 448]
    - [6, 6347.0]
  - - [1408, 448, 1, 3328, 1408, 1408, 3328, 448]
    - [18, 6660.0]
  - - [1856, 448, 1, 3328, 1856, 1856, 3328, 448]
    - [18, 6867.0]
  - - [2368, 448, 1, 3328, 2368, 2368, 3328, 448]
    - [11, 6871.0]
  - - [2944, 448, 1, 3328, 2944, 2944, 3328, 448]
    - [18, 7292.0]
  - - [3584, 448, 1, 3328, 3584, 3584, 3328, 448]
    - [11, 7699.0]
  - - [4288, 448, 1, 3328, 4288, 4288, 3328, 448]
    - [18, 8170.0]
  - - [5056, 448, 1, 3328, 5056, 5056, 3328, 448]
    - [11, 8542.0]
  - - [5888, 448, 1, 3328, 5888, 5888, 3328, 448]
    - [11, 8230.0]
  - - [6784, 448, 1, 3328, 6784, 6784, 3328, 448]
    - [18, 8723.0]
  - - [256, 704, 1, 3328, 256, 256, 3328, 704]
    - [22, 3570.0]
  - - [448, 704, 1, 3328, 448, 448, 3328, 704]
    - [6, 4404.0]
  - - [704, 704, 1, 3328, 704, 704, 3328, 704]
    - [6, 6811.0]
  - - [1024, 704, 1, 3328, 1024, 1024, 3328, 704]
    - [6, 7608.0]
  - - [1408, 704, 1, 3328, 1408, 1408, 3328, 704]
    - [18, 8148.0]
  - - [1856, 704, 1, 3328, 1856, 1856, 3328, 704]
    - [11, 8408.0]
  - - [2368, 704, 1, 3328, 2368, 2368, 3328, 704]
    - [11, 7988.0]
  - - [2944, 704, 1, 3328, 2944, 2944, 3328, 704]
    - [18, 8776.0]
  - - [3584, 704, 1, 3328, 3584, 3584, 3328, 704]
    - [18, 8626.0]
  - - [4288, 704, 1, 3328, 4288, 4288, 3328, 704]
    - [18, 8679.0]
  - - [5056, 704, 1, 3328, 5056, 5056, 3328, 704]
    - [18, 8803.0]
  - - [5888, 704, 1, 3328, 5888, 5888, 3328, 704]
    - [18, 9009.0]
  - - [6784, 704, 1, 3328, 6784, 6784, 3328, 704]
    - [11, 8783.0]
  - - [256, 1024, 1, 3328, 256, 256, 3328, 1024]
    - [22, 5163.0]
  - - [448, 1024, 1, 3328, 448, 448, 3328, 1024]
    - [6, 6311.0]
  - - [704, 1024, 1, 3328, 704, 704, 3328, 1024]
    - [18, 7619.0]
  - - [1024, 1024, 1, 3328, 1024, 1024, 3328, 1024]
    - [6, 8583.0]
  - - [1408, 1024, 1, 3328, 1408, 1408, 3328, 1024]
    - [18, 7951.0]
  - - [1856, 1024, 1, 3328, 1856, 1856, 3328, 1024]
    - [18, 8082.0]
  - - [2368, 1024, 1, 3328, 2368, 2368, 3328, 1024]
    - [18, 8295.0]
  - - [2944, 1024, 1, 3328, 2944, 2944, 3328, 1024]
    - [18, 8664.0]
  - - [3584, 1024, 1, 3328, 3584, 3584, 3328, 1024]
    - [18, 9066.0]
  - - [4288, 1024, 1, 3328, 4288, 4288, 3328, 1024]
    - [18, 8994.0]
  - - [5056, 1024, 1, 3328, 5056, 5056, 3328, 1024]
    - [18, 9052.0]
  - - [5888, 1024, 1, 3328, 5888, 5888, 3328, 1024]
    - [18, 9200.0]
  - - [6784, 1024, 1, 3328, 6784, 6784, 3328, 1024]
    - [18, 9070.0]
  - - [256, 1408, 1, 3328, 256, 256, 3328, 1408]
    - [6, 5037.0]
  - - [448, 1408, 1, 3328, 448, 448, 3328, 1408]
    - [6, 6697.0]
  - - [704, 1408, 1, 3328, 704, 704, 3328, 1408]
    - [18, 8173.0]
  - - [1024, 1408, 1, 3328, 1024, 1024, 3328, 1408]
    - [18, 7968.0]
  - - [1408, 1408, 1, 3328, 1408, 1408, 3328, 1408]
    - [18, 8409.0]
  - - [1856, 1408, 1, 3328, 1856, 1856, 3328, 1408]
    - [18, 8930.0]
  - - [2368, 1408, 1, 3328, 2368, 2368, 3328, 1408]
    - [11, 8845.0]
  - - [2944, 1408, 1, 3328, 2944, 2944, 3328, 1408]
    - [18, 9017.0]
  - - [3584, 1408, 1, 3328, 3584, 3584, 3328, 1408]
    - [11, 8844.0]
  - - [4288, 1408, 1, 3328, 4288, 4288, 3328, 1408]
    - [18, 8848.0]
  - - [5056, 1408, 1, 3328, 5056, 5056, 3328, 1408]
    - [11, 8972.0]
  - - [5888, 1408, 1, 3328, 5888, 5888, 3328, 1408]
    - [11, 9154.0]
  - - [6784, 1408, 1, 3328, 6784, 6784, 3328, 1408]
    - [11, 9149.0]
  - - [256, 1856, 1, 3328, 256, 256, 3328, 1856]
    - [6, 6541.0]
  - - [448, 1856, 1, 3328, 448, 448, 3328, 1856]
    - [18, 6881.0]
  - - [704, 1856, 1, 3328, 704, 704, 3328, 1856]
    - [11, 8421.0]
  - - [1024, 1856, 1, 3328, 1024, 1024, 3328, 1856]
    - [18, 8087.0]
  - - [1408, 1856, 1, 3328, 1408, 1408, 3328, 1856]
    - [18, 8906.0]
  - - [1856, 1856, 1, 3328, 1856, 1856, 3328, 1856]
    - [18, 8540.0]
  - - [2368, 1856, 1, 3328, 2368, 2368, 3328, 1856]
    - [11, 8997.0]
  - - [2944, 1856, 1, 3328, 2944, 2944, 3328, 1856]
    - [18, 9114.0]
  - - [3584, 1856, 1, 3328, 3584, 3584, 3328, 1856]
    - [18, 9018.0]
  - - [4288, 1856, 1, 3328, 4288, 4288, 3328, 1856]
    - [11, 9074.0]
  - - [5056, 1856, 1, 3328, 5056, 5056, 3328, 1856]
    - [11, 9232.0]
  - - [5888, 1856, 1, 3328, 5888, 5888, 3328, 1856]
    - [11, 9229.0]
  - - [6784, 1856, 1, 3328, 6784, 6784, 3328, 1856]
    - [11, 9137.0]
  - - [256, 2368, 1, 3328, 256, 256, 3328, 2368]
    - [6, 6471.0]
  - - [448, 2368, 1, 3328, 448, 448, 3328, 2368]
    - [11, 6868.0]
  - - [704, 2368, 1, 3328, 704, 704, 3328, 2368]
    - [18, 7996.0]
  - - [1024, 2368, 1, 3328, 1024, 1024, 3328, 2368]
    - [18, 8305.0]
  - - [1408, 2368, 1, 3328, 1408, 1408, 3328, 2368]
    - [11, 8853.0]
  - - [1856, 2368, 1, 3328, 1856, 1856, 3328, 2368]
    - [18, 9004.0]
  - - [2368, 2368, 1, 3328, 2368, 2368, 3328, 2368]
    - [18, 8946.0]
  - - [2944, 2368, 1, 3328, 2944, 2944, 3328, 2368]
    - [18, 9094.0]
  - - [3584, 2368, 1, 3328, 3584, 3584, 3328, 2368]
    - [11, 9097.0]
  - - [4288, 2368, 1, 3328, 4288, 4288, 3328, 2368]
    - [11, 9231.0]
  - - [5056, 2368, 1, 3328, 5056, 5056, 3328, 2368]
    - [18, 9246.0]
  - - [5888, 2368, 1, 3328, 5888, 5888, 3328, 2368]
    - [11, 9185.0]
  - - [6784, 2368, 1, 3328, 6784, 6784, 3328, 2368]
    - [11, 9228.0]
  - - [256, 2944, 1, 3328, 256, 256, 3328, 2944]
    - [18, 7945.0]
  - - [448, 2944, 1, 3328, 448, 448, 3328, 2944]
    - [18, 7309.0]
  - - [704, 2944, 1, 3328, 704, 704, 3328, 2944]
    - [18, 8799.0]
  - - [1024, 2944, 1, 3328, 1024, 1024, 3328, 2944]
    - [18, 8677.0]
  - - [1408, 2944, 1, 3328, 1408, 1408, 3328, 2944]
    - [11, 9009.0]
  - - [1856, 2944, 1, 3328, 1856, 1856, 3328, 2944]
    - [18, 9104.0]
  - - [2368, 2944, 1, 3328, 2368, 2368, 3328, 2944]
    - [18, 9102.0]
  - - [2944, 2944, 1, 3328, 2944, 2944, 3328, 2944]
    - [18, 9025.0]
  - - [3584, 2944, 1, 3328, 3584, 3584, 3328, 2944]
    - [11, 9132.0]
  - - [4288, 2944, 1, 3328, 4288, 4288, 3328, 2944]
    - [11, 9165.0]
  - - [5056, 2944, 1, 3328, 5056, 5056, 3328, 2944]
    - [18, 9300.0]
  - - [5888, 2944, 1, 3328, 5888, 5888, 3328, 2944]
    - [18, 9224.0]
  - - [6784, 2944, 1, 3328, 6784, 6784, 3328, 2944]
    - [18, 9258.0]
  - - [256, 3584, 1, 3328, 256, 256, 3328, 3584]
    - [6, 7599.0]
  - - [448, 3584, 1, 3328, 448, 448, 3328, 3584]
    - [18, 7711.0]
  - - [704, 3584, 1, 3328, 704, 704, 3328, 3584]
    - [18, 8640.0]
  - - [1024, 3584, 1, 3328, 1024, 1024, 3328, 3584]
    - [18, 9078.0]
  - - [1408, 3584, 1, 3328, 1408, 1408, 3328, 3584]
    - [18, 8835.0]
  - - [1856, 3584, 1, 3328, 1856, 1856, 3328, 3584]
    - [18, 9005.0]
  - - [2368, 3584, 1, 3328, 2368, 2368, 3328, 3584]
    - [11, 9097.0]
  - - [2944, 3584, 1, 3328, 2944, 2944, 3328, 3584]
    - [11, 9132.0]
  - - [3584, 3584, 1, 3328, 3584, 3584, 3328, 3584]
    - [11, 9316.0]
  - - [4288, 3584, 1, 3328, 4288, 4288, 3328, 3584]
    - [11, 9280.0]
  - - [5056, 3584, 1, 3328, 5056, 5056, 3328, 3584]
    - [12, 9237.0]
  - - [5888, 3584, 1, 3328, 5888, 5888, 3328, 3584]
    - [11, 9296.0]
  - - [6784, 3584, 1, 3328, 6784, 6784, 3328, 3584]
    - [11, 9337.0]
  - - [256, 4288, 1, 3328, 256, 256, 3328, 4288]
    - [11, 7096.0]
  - - [448, 4288, 1, 3328, 448, 448, 3328, 4288]
    - [18, 8173.0]
  - - [704, 4288, 1, 3328, 704, 704, 3328, 4288]
    - [18, 8689.0]
  - - [1024, 4288, 1, 3328, 1024, 1024, 3328, 4288]
    - [18, 8994.0]
  - - [1408, 4288, 1, 3328, 1408, 1408, 3328, 4288]
    - [18, 8859.0]
  - - [1856, 4288, 1, 3328, 1856, 1856, 3328, 4288]
    - [18, 9078.0]
  - - [2368, 4288, 1, 3328, 2368, 2368, 3328, 4288]
    - [18, 9228.0]
  - - [2944, 4288, 1, 3328, 2944, 2944, 3328, 4288]
    - [11, 9160.0]
  - - [3584, 4288, 1, 3328, 3584, 3584, 3328, 4288]
    - [11, 9277.0]
  - - [4288, 4288, 1, 3328, 4288, 4288, 3328, 4288]
    - [11, 9239.0]
  - - [5056, 4288, 1, 3328, 5056, 5056, 3328, 4288]
    - [11, 9321.0]
  - - [5888, 4288, 1, 3328, 5888, 5888, 3328, 4288]
    - [11, 9300.0]
  - - [6784, 4288, 1, 3328, 6784, 6784, 3328, 4288]
    - [11, 9364.0]
  - - [256, 5056, 1, 3328, 256, 256, 3328, 5056]
    - [11, 8340.0]
  - - [448, 5056, 1, 3328, 448, 448, 3328, 5056]
    - [18, 8545.0]
  - - [704, 5056, 1, 3328, 704, 704, 3328, 5056]
    - [18, 8819.0]
  - - [1024, 5056, 1, 3328, 1024, 1024, 3328, 5056]
    - [11, 9072.0]
  - - [1408, 5056, 1, 3328, 1408, 1408, 3328, 5056]
    - [18, 8966.0]
  - - [1856, 5056, 1, 3328, 1856, 1856, 3328, 5056]
    - [18, 9233.0]
  - - [2368, 5056, 1, 3328, 2368, 2368, 3328, 5056]
    - [11, 9245.0]
  - - [2944, 5056, 1, 3328, 2944, 2944, 3328, 5056]
    - [18, 9291.0]
  - - [3584, 5056, 1, 3328, 3584, 3584, 3328, 5056]
    - [19, 9235.0]
  - - [4288, 5056, 1, 3328, 4288, 4288, 3328, 5056]
    - [11, 9323.0]
  - - [5056, 5056, 1, 3328, 5056, 5056, 3328, 5056]
    - [11, 9322.0]
  - - [5888, 5056, 1, 3328, 5888, 5888, 3328, 5056]
    - [11, 9340.0]
  - - [6784, 5056, 1, 3328, 6784, 6784, 3328, 5056]
    - [11, 9370.0]
  - - [256, 5888, 1, 3328, 256, 256, 3328, 5888]
    - [18, 8341.0]
  - - [448, 5888, 1, 3328, 448, 448, 3328, 5888]
    - [11, 8238.0]
  - - [704, 5888, 1, 3328, 704, 704, 3328, 5888]
    - [18, 9019.0]
  - - [1024, 5888, 1, 3328, 1024, 1024, 3328, 5888]
    - [18, 9213.0]
  - - [1408, 5888, 1, 3328, 1408, 1408, 3328, 5888]
    - [18, 9165.0]
  - - [1856, 5888, 1, 3328, 1856, 1856, 3328, 5888]
    - [18, 9233.0]
  - - [2368, 5888, 1, 3328, 2368, 2368, 3328, 5888]
    - [11, 9187.0]
  - - [2944, 5888, 1, 3328, 2944, 2944, 3328, 5888]
    - [18, 9225.0]
  - - [3584, 5888, 1, 3328, 3584, 3584, 3328, 5888]
    - [11, 9299.0]
  - - [4288, 5888, 1, 3328, 4288, 4288, 3328, 5888]
    - [11, 9302.0]
  - - [5056, 5888, 1, 3328, 5056, 5056, 3328, 5888]
    - [12, 9362.0]
  - - [5888, 5888, 1, 3328, 5888, 5888, 3328, 5888]
    - [11, 9323.0]
  - - [6784, 5888, 1, 3328, 6784, 6784, 3328, 5888]
    - [11, 9344.0]
  - - [256, 6784, 1, 3328, 256, 256, 3328, 6784]
    - [18, 8317.0]
  - - [448, 6784, 1, 3328, 448, 448, 3328, 6784]
    - [18, 8747.0]
  - - [704, 6784, 1, 3328, 704, 704, 3328, 6784]
    - [18, 8792.0]
  - - [1024, 6784, 1, 3328, 1024, 1024, 3328, 6784]
    - [18, 9073.0]
  - - [1408, 6784, 1, 3328, 1408, 1408, 3328, 6784]
    - [18, 9149.0]
  - - [1856, 6784, 1, 3328, 1856, 1856, 3328, 6784]
    - [18, 9135.0]
  - - [2368, 6784, 1, 3328, 2368, 2368, 3328, 6784]
    - [12, 9231.0]
  - - [2944, 6784, 1, 3328, 2944, 2944, 3328, 6784]
    - [18, 9251.0]
  - - [3584, 6784, 1, 3328, 3584, 3584, 3328, 6784]
    - [11, 9338.0]
  - - [4288, 6784, 1, 3328, 4288, 4288, 3328, 6784]
    - [11, 9362.0]
  - - [5056, 6784, 1, 3328, 5056, 5056, 3328, 6784]
    - [11, 9364.0]
  - - [5888, 6784, 1, 3328, 5888, 5888, 3328, 6784]
    - [11, 9345.0]
  - - [6784, 6784, 1, 3328, 6784, 6784, 3328, 6784]
    - [19, 9373.0]
  - - [1024, 1024, 1, 1024, 1024, 1024, 1024, 1024]
    - [18, 8399.0]
  - - [32, 32, 1, 32, 32, 32, 32, 32]
    - [35, 4.0]
  - - [32, 64, 1, 256, 32, 32, 256, 64]
    - [42, 19.0]
  - - [32, 128, 1, 256, 32, 32, 256, 128]
    - [36, 37.0]
  - - [32, 256, 1, 256, 32, 32, 256, 256]
    - [42, 75.0]
  - - [32, 448, 1, 256, 32, 32, 256, 448]
    - [42, 133.0]
  - - [32, 704, 1, 256, 32, 32, 256, 704]
    - [42, 210.0]
  - - [32, 1024, 1, 256, 32, 32, 256, 1024]
    - [42, 308.0]
  - - [32, 1408, 1, 256, 32, 32, 256, 1408]
    - [42, 423.0]
  - - [32, 1856, 1, 256, 32, 32, 256, 1856]
    - [42, 552.0]
  - - [32, 2368, 1, 256, 32, 32, 256, 2368]
    - [42, 711.0]
  - - [32, 2944, 1, 256, 32, 32, 256, 2944]
    - [42, 837.0]
  - - [32, 3584, 1, 256, 32, 32, 256, 3584]
    - [42, 981.0]
  - - [32, 4288, 1, 256, 32, 32, 256, 4288]
    - [44, 1193.0]
  - - [32, 5056, 1, 256, 32, 32, 256, 5056]
    - [44, 1388.0]
  - - [32, 5888, 1, 256, 32, 32, 256, 5888]
    - [40, 1643.0]
  - - [32, 6784, 1, 256, 32, 32, 256, 6784]
    - [40, 1893.0]
  - - [32, 64, 1, 1280, 32, 32, 1280, 64]
    - [54, 81.0]
  - - [32, 128, 1, 1280, 32, 32, 1280, 128]
    - [54, 165.0]
  - - [32, 256, 1, 1280, 32, 32, 1280, 256]
    - [54, 333.0]
  - - [32, 448, 1, 1280, 32, 32, 1280, 448]
    - [54, 572.0]
  - - [32, 704, 1, 1280, 32, 32, 1280, 704]
    - [56, 1015.0]
  - - [32, 1024, 1, 1280, 32, 32, 1280, 1024]
    - [53, 1165.0]
  - - [32, 1408, 1, 1280, 32, 32, 1280, 1408]
    - [55, 1638.0]
  - - [32, 1856, 1, 1280, 32, 32, 1280, 1856]
    - [53, 1682.0]
  - - [32, 2368, 1, 1280, 32, 32, 1280, 2368]
    - [53, 2094.0]
  - - [32, 2944, 1, 1280, 32, 32, 1280, 2944]
    - [53, 2200.0]
  - - [32, 3584, 1, 1280, 32, 32, 1280, 3584]
    - [55, 2308.0]
  - - [32, 4288, 1, 1280, 32, 32, 1280, 4288]
    - [53, 2358.0]
  - - [32, 5056, 1, 1280, 32, 32, 1280, 5056]
    - [52, 2465.0]
  - - [32, 5888, 1, 1280, 32, 32, 1280, 5888]
    - [53, 2599.0]
  - - [32, 6784, 1, 1280, 32, 32, 1280, 6784]
    - [52, 2794.0]
  - - [32, 64, 1, 3328, 32, 32, 3328, 64]
    - [58, 140.0]
  - - [32, 128, 1, 3328, 32, 32, 3328, 128]
    - [58, 282.0]
  - - [32, 256, 1, 3328, 32, 32, 3328, 256]
    - [58, 563.0]
  - - [32, 448, 1, 3328, 32, 32, 3328, 448]
    - [58, 979.0]
  - - [32, 704, 1, 3328, 32, 32, 3328, 704]
    - [57, 1243.0]
  - - [32, 1024, 1, 3328, 32, 32, 3328, 1024]
    - [57, 1880.0]
  - - [32, 1408, 1, 3328, 32, 32, 3328, 1408]
    - [57, 1907.0]
  - - [32, 1856, 1, 3328, 32, 32, 3328, 1856]
    - [59, 2135.0]
  - - [32, 2368, 1, 3328, 32, 32, 3328, 2368]
    - [53, 2390.0]
  - - [32, 2944, 1, 3328, 32, 32, 3328, 2944]
    - [53, 2546.0]
  - - [32, 3584, 1, 3328, 32, 32, 3328, 3584]
    - [57, 2662.0]
  - - [32, 4288, 1, 3328, 32, 32, 3328, 4288]
    - [57, 2834.0]
  - - [32, 5056, 1, 3328, 32, 32, 3328, 5056]
    - [59, 3022.0]
  - - [32, 5888, 1, 3328, 32, 32, 3328, 5888]
    - [57, 3017.0]
  - - [32, 6784, 1, 3328, 32, 32, 3328, 6784]
    - [59, 3160.0]
  - - [64, 32, 1, 256, 64, 64, 256, 32]
    - [42, 19.0]
  - - [128, 32, 1, 256, 128, 128, 256, 32]
    - [42, 38.0]
  - - [256, 32, 1, 256, 256, 256, 256, 32]
    - [42, 76.0]
  - - [448, 32, 1, 256, 448, 448, 256, 32]
    - [42, 134.0]
  - - [704, 32, 1, 256, 704, 704, 256, 32]
    - [42, 208.0]
  - - [1024, 32, 1, 256, 1024, 1024, 256, 32]
    - [42, 304.0]
  - - [1408, 32, 1, 256, 1408, 1408, 256, 32]
    - [42, 420.0]
  - - [1856, 32, 1, 256, 1856, 1856, 256, 32]
    - [42, 541.0]
  - - [2368, 32, 1, 256, 2368, 2368, 256, 32]
    - [42, 689.0]
  - - [2944, 32, 1, 256, 2944, 2944, 256, 32]
    - [42, 840.0]
  - - [3584, 32, 1, 256, 3584, 3584, 256, 32]
    - [50, 1192.0]
  - - [4288, 32, 1, 256, 4288, 4288, 256, 32]
    - [40, 1159.0]
  - - [5056, 32, 1, 256, 5056, 5056, 256, 32]
    - [44, 1345.0]
  - - [5888, 32, 1, 256, 5888, 5888, 256, 32]
    - [40, 1534.0]
  - - [6784, 32, 1, 256, 6784, 6784, 256, 32]
    - [40, 1838.0]
  - - [64, 32, 1, 1280, 64, 64, 1280, 32]
    - [54, 83.0]
  - - [128, 32, 1, 1280, 128, 128, 1280, 32]
    - [54, 165.0]
  - - [256, 32, 1, 1280, 256, 256, 1280, 32]
    - [54, 334.0]
  - - [448, 32, 1, 1280, 448, 448, 1280, 32]
    - [54, 585.0]
  - - [704, 32, 1, 1280, 704, 704, 1280, 32]
    - [56, 910.0]
  - - [1024, 32, 1, 1280, 1024, 1024, 1280, 32]
    - [55, 1163.0]
  - - [1408, 32, 1, 1280, 1408, 1408, 1280, 32]
    - [53, 1499.0]
  - - [1856, 32, 1, 1280, 1856, 1856, 1280, 32]
    - [53, 1540.0]
  - - [2368, 32, 1, 1280, 2368, 2368, 1280, 32]
    - [53, 1924.0]
  - - [2944, 32, 1, 1280, 2944, 2944, 1280, 32]
    - [53, 2018.0]
  - - [3584, 32, 1, 1280, 3584, 3584, 1280, 32]
    - [55, 2131.0]
  - - [4288, 32, 1, 1280, 4288, 4288, 1280, 32]
    - [53, 2174.0]
  - - [5056, 32, 1, 1280, 5056, 5056, 1280, 32]
    - [55, 2338.0]
  - - [5888, 32, 1, 1280, 5888, 5888, 1280, 32]
    - [55, 2447.0]
  - - [6784, 32, 1, 1280, 6784, 6784, 1280, 32]
    - [51, 2617.0]
  - - [64, 32, 1, 3328, 64, 64, 3328, 32]
    - [58, 139.0]
  - - [128, 32, 1, 3328, 128, 128, 3328, 32]
    - [58, 276.0]
  - - [256, 32, 1, 3328, 256, 256, 3328, 32]
    - [58, 604.0]
  - - [448, 32, 1, 3328, 448, 448, 3328, 32]
    - [58, 911.0]
  - - [704, 32, 1, 3328, 704, 704, 3328, 32]
    - [59, 1228.0]
  - - [1024, 32, 1, 3328, 1024, 1024, 3328, 32]
    - [57, 1796.0]
  - - [1408, 32, 1, 3328, 1408, 1408, 3328, 32]
    - [57, 1880.0]
  - - [1856, 32, 1, 3328, 1856, 1856, 3328, 32]
    - [57, 2066.0]
  - - [2368, 32, 1, 3328, 2368, 2368, 3328, 32]
    - [53, 2325.0]
  - - [2944, 32, 1, 3328, 2944, 2944, 3328, 32]
    - [55, 2361.0]
  - - [3584, 32, 1, 3328, 3584, 3584, 3328, 32]
    - [57, 2564.0]
  - - [4288, 32, 1, 3328, 4288, 4288, 3328, 32]
    - [59, 2730.0]
  - - [5056, 32, 1, 3328, 5056, 5056, 3328, 32]
    - [59, 2900.0]
  - - [5888, 32, 1, 3328, 5888, 5888, 3328, 32]
    - [57, 2850.0]
  - - [6784, 32, 1, 3328, 6784, 6784, 3328, 32]
    - [59, 3007.0]
  - - [64, 64, 1, 32, 64, 64, 32, 64]
    - [35, 11.0]
  - - [128, 64, 1, 32, 128, 128, 32, 64]
    - [35, 23.0]
  - - [256, 64, 1, 32, 256, 256, 32, 64]
    - [42, 80.0]
  - - [448, 64, 1, 32, 448, 448, 32, 64]
    - [35, 90.0]
  - - [704, 64, 1, 32, 704, 704, 32, 64]
    - [35, 140.0]
  - - [1024, 64, 1, 32, 1024, 1024, 32, 64]
    - [35, 199.0]
  - - [1408, 64, 1, 32, 1408, 1408, 32, 64]
    - [38, 286.0]
  - - [1856, 64, 1, 32, 1856, 1856, 32, 64]
    - [35, 371.0]
  - - [2368, 64, 1, 32, 2368, 2368, 32, 64]
    - [35, 442.0]
  - - [2944, 64, 1, 32, 2944, 2944, 32, 64]
    - [35, 520.0]
  - - [3584, 64, 1, 32, 3584, 3584, 32, 64]
    - [40, 882.0]
  - - [4288, 64, 1, 32, 4288, 4288, 32, 64]
    - [44, 907.0]
  - - [5056, 64, 1, 32, 5056, 5056, 32, 64]
    - [44, 1011.0]
  - - [5888, 64, 1, 32, 5888, 5888, 32, 64]
    - [44, 1225.0]
  - - [6784, 64, 1, 32, 6784, 6784, 32, 64]
    - [40, 1378.0]
  - - [64, 128, 1, 32, 64, 64, 32, 128]
    - [40, 24.0]
  - - [128, 128, 1, 32, 128, 128, 32, 128]
    - [35, 68.0]
  - - [256, 128, 1, 32, 256, 256, 32, 128]
    - [41, 104.0]
  - - [448, 128, 1, 32, 448, 448, 32, 128]
    - [38, 178.0]
  - - [704, 128, 1, 32, 704, 704, 32, 128]
    - [35, 291.0]
  - - [1024, 128, 1, 32, 1024, 1024, 32, 128]
    - [35, 416.0]
  - - [1408, 128, 1, 32, 1408, 1408, 32, 128]
    - [35, 563.0]
  - - [1856, 128, 1, 32, 1856, 1856, 32, 128]
    - [42, 1105.0]
  - - [2368, 128, 1, 32, 2368, 2368, 32, 128]
    - [44, 1102.0]
  - - [2944, 128, 1, 32, 2944, 2944, 32, 128]
    - [40, 1334.0]
  - - [3584, 128, 1, 32, 3584, 3584, 32, 128]
    - [42, 1169.0]
  - - [4288, 128, 1, 32, 4288, 4288, 32, 128]
    - [40, 1638.0]
  - - [5056, 128, 1, 32, 5056, 5056, 32, 128]
    - [40, 1918.0]
  - - [5888, 128, 1, 32, 5888, 5888, 32, 128]
    - [42, 1805.0]
  - - [6784, 128, 1, 32, 6784, 6784, 32, 128]
    - [44, 2241.0]
  - - [64, 256, 1, 32, 64, 64, 32, 256]
    - [36, 47.0]
  - - [128, 256, 1, 32, 128, 128, 32, 256]
    - [40, 105.0]
  - - [256, 256, 1, 32, 256, 256, 32, 256]
    - [35, 205.0]
  - - [448, 256, 1, 32, 448, 448, 32, 256]
    - [38, 364.0]
  - - [704, 256, 1, 32, 704, 704, 32, 256]
    - [38, 572.0]
  - - [1024, 256, 1, 32, 1024, 1024, 32, 256]
    - [44, 1234.0]
  - - [1408, 256, 1, 32, 1408, 1408, 32, 256]
    - [40, 1311.0]
  - - [1856, 256, 1, 32, 1856, 1856, 32, 256]
    - [40, 1712.0]
  - - [2368, 256, 1, 32, 2368, 2368, 32, 256]
    - [40, 1744.0]
  - - [2944, 256, 1, 32, 2944, 2944, 32, 256]
    - [35, 1996.0]
  - - [3584, 256, 1, 32, 3584, 3584, 32, 256]
    - [44, 2121.0]
  - - [4288, 256, 1, 32, 4288, 4288, 32, 256]
    - [44, 2229.0]
  - - [5056, 256, 1, 32, 5056, 5056, 32, 256]
    - [40, 2526.0]
  - - [5888, 256, 1, 32, 5888, 5888, 32, 256]
    - [46, 2610.0]
  - - [6784, 256, 1, 32, 6784, 6784, 32, 256]
    - [42, 2746.0]
  - - [64, 448, 1, 32, 64, 64, 32, 448]
    - [47, 89.0]
  - - [128, 448, 1, 32, 128, 128, 32, 448]
    - [38, 184.0]
  - - [256, 448, 1, 32, 256, 256, 32, 448]
    - [35, 364.0]
  - - [448, 448, 1, 32, 448, 448, 32, 448]
    - [38, 637.0]
  - - [704, 448, 1, 32, 704, 704, 32, 448]
    - [44, 1147.0]
  - - [1024, 448, 1, 32, 1024, 1024, 32, 448]
    - [40, 1301.0]
  - - [1408, 448, 1, 32, 1408, 1408, 32, 448]
    - [42, 1828.0]
  - - [1856, 448, 1, 32, 1856, 1856, 32, 448]
    - [44, 2079.0]
  - - [2368, 448, 1, 32, 2368, 2368, 32, 448]
    - [35, 2154.0]
  - - [2944, 448, 1, 32, 2944, 2944, 32, 448]
    - [44, 2294.0]
  - - [3584, 448, 1, 32, 3584, 3584, 32, 448]
    - [40, 2590.0]
  - - [4288, 448, 1, 32, 4288, 4288, 32, 448]
    - [44, 2900.0]
  - - [5056, 448, 1, 32, 5056, 5056, 32, 448]
    - [40, 2904.0]
  - - [5888, 448, 1, 32, 5888, 5888, 32, 448]
    - [40, 2981.0]
  - - [6784, 448, 1, 32, 6784, 6784, 32, 448]
    - [40, 3141.0]
  - - [64, 704, 1, 32, 64, 64, 32, 704]
    - [35, 133.0]
  - - [128, 704, 1, 32, 128, 128, 32, 704]
    - [35, 286.0]
  - - [256, 704, 1, 32, 256, 256, 32, 704]
    - [35, 559.0]
  - - [448, 704, 1, 32, 448, 448, 32, 704]
    - [35, 1051.0]
  - - [704, 704, 1, 32, 704, 704, 32, 704]
    - [44, 1786.0]
  - - [1024, 704, 1, 32, 1024, 1024, 32, 704]
    - [40, 1814.0]
  - - [1408, 704, 1, 32, 1408, 1408, 32, 704]
    - [42, 2447.0]
  - - [1856, 704, 1, 32, 1856, 1856, 32, 704]
    - [44, 2465.0]
  - - [2368, 704, 1, 32, 2368, 2368, 32, 704]
    - [40, 2646.0]
  - - [2944, 704, 1, 32, 2944, 2944, 32, 704]
    - [44, 2940.0]
  - - [3584, 704, 1, 32, 3584, 3584, 32, 704]
    - [40, 2851.0]
  - - [4288, 704, 1, 32, 4288, 4288, 32, 704]
    - [44, 3178.0]
  - - [5056, 704, 1, 32, 5056, 5056, 32, 704]
    - [44, 3258.0]
  - - [5888, 704, 1, 32, 5888, 5888, 32, 704]
    - [40, 3296.0]
  - - [6784, 704, 1, 32, 6784, 6784, 32, 704]
    - [40, 3430.0]
  - - [64, 1024, 1, 32, 64, 64, 32, 1024]
    - [36, 194.0]
  - - [128, 1024, 1, 32, 128, 128, 32, 1024]
    - [35, 397.0]
  - - [256, 1024, 1, 32, 256, 256, 32, 1024]
    - [50, 1028.0]
  - - [448, 1024, 1, 32, 448, 448, 32, 1024]
    - [46, 1434.0]
  - - [704, 1024, 1, 32, 704, 704, 32, 1024]
    - [45, 1860.0]
  - - [1024, 1024, 1, 32, 1024, 1024, 32, 1024]
    - [42, 2140.0]
  - - [1408, 1024, 1, 32, 1408, 1408, 32, 1024]
    - [44, 2393.0]
  - - [1856, 1024, 1, 32, 1856, 1856, 32, 1024]
    - [40, 2754.0]
  - - [2368, 1024, 1, 32, 2368, 2368, 32, 1024]
    - [44, 2930.0]
  - - [2944, 1024, 1, 32, 2944, 2944, 32, 1024]
    - [40, 3165.0]
  - - [3584, 1024, 1, 32, 3584, 3584, 32, 1024]
    - [44, 3039.0]
  - - [4288, 1024, 1, 32, 4288, 4288, 32, 1024]
    - [44, 3378.0]
  - - [5056, 1024, 1, 32, 5056, 5056, 32, 1024]
    - [39, 3534.0]
  - - [5888, 1024, 1, 32, 5888, 5888, 32, 1024]
    - [39, 3495.0]
  - - [6784, 1024, 1, 32, 6784, 6784, 32, 1024]
    - [44, 3595.0]
  - - [64, 1408, 1, 32, 64, 64, 32, 1408]
    - [35, 263.0]
  - - [128, 1408, 1, 32, 128, 128, 32, 1408]
    - [44, 538.0]
  - - [256, 1408, 1, 32, 256, 256, 32, 1408]
    - [40, 1135.0]
  - - [448, 1408, 1, 32, 448, 448, 32, 1408]
    - [40, 1649.0]
  - - [704, 1408, 1, 32, 704, 704, 32, 1408]
    - [42, 2266.0]
  - - [1024, 1408, 1, 32, 1024, 1024, 32, 1408]
    - [39, 2413.0]
  - - [1408, 1408, 1, 32, 1408, 1408, 32, 1408]
    - [44, 2782.0]
  - - [1856, 1408, 1, 32, 1856, 1856, 32, 1408]
    - [40, 3083.0]
  - - [2368, 1408, 1, 32, 2368, 2368, 32, 1408]
    - [44, 3285.0]
  - - [2944, 1408, 1, 32, 2944, 2944, 32, 1408]
    - [40, 3290.0]
  - - [3584, 1408, 1, 32, 3584, 3584, 32, 1408]
    - [41, 3347.0]
  - - [4288, 1408, 1, 32, 4288, 4288, 32, 1408]
    - [40, 3654.0]
  - - [5056, 1408, 1, 32, 5056, 5056, 32, 1408]
    - [43, 3737.0]
  - - [5888, 1408, 1, 32, 5888, 5888, 32, 1408]
    - [43, 3790.0]
  - - [6784, 1408, 1, 32, 6784, 6784, 32, 1408]
    - [44, 3772.0]
  - - [64, 1856, 1, 32, 64, 64, 32, 1856]
    - [35, 357.0]
  - - [128, 1856, 1, 32, 128, 128, 32, 1856]
    - [42, 923.0]
  - - [256, 1856, 1, 32, 256, 256, 32, 1856]
    - [44, 1496.0]
  - - [448, 1856, 1, 32, 448, 448, 32, 1856]
    - [44, 2105.0]
  - - [704, 1856, 1, 32, 704, 704, 32, 1856]
    - [44, 2795.0]
  - - [1024, 1856, 1, 32, 1024, 1024, 32, 1856]
    - [44, 2534.0]
  - - [1408, 1856, 1, 32, 1408, 1408, 32, 1856]
    - [40, 3111.0]
  - - [1856, 1856, 1, 32, 1856, 1856, 32, 1856]
    - [44, 3361.0]
  - - [2368, 1856, 1, 32, 2368, 2368, 32, 1856]
    - [40, 3447.0]
  - - [2944, 1856, 1, 32, 2944, 2944, 32, 1856]
    - [40, 3655.0]
  - - [3584, 1856, 1, 32, 3584, 3584, 32, 1856]
    - [43, 3424.0]
  - - [4288, 1856, 1, 32, 4288, 4288, 32, 1856]
    - [44, 3736.0]
  - - [5056, 1856, 1, 32, 5056, 5056, 32, 1856]
    - [44, 3834.0]
  - - [5888, 1856, 1, 32, 5888, 5888, 32, 1856]
    - [44, 3794.0]
  - - [6784, 1856, 1, 32, 6784, 6784, 32, 1856]
    - [40, 3892.0]
  - - [64, 2368, 1, 32, 64, 64, 32, 2368]
    - [35, 456.0]
  - - [128, 2368, 1, 32, 128, 128, 32, 2368]
    - [40, 1054.0]
  - - [256, 2368, 1, 32, 256, 256, 32, 2368]
    - [46, 1461.0]
  - - [448, 2368, 1, 32, 448, 448, 32, 2368]
    - [40, 2187.0]
  - - [704, 2368, 1, 32, 704, 704, 32, 2368]
    - [40, 2790.0]
  - - [1024, 2368, 1, 32, 1024, 1024, 32, 2368]
    - [49, 2513.0]
  - - [1408, 2368, 1, 32, 1408, 1408, 32, 2368]
    - [40, 3293.0]
  - - [1856, 2368, 1, 32, 1856, 1856, 32, 2368]
    - [44, 3573.0]
  - - [2368, 2368, 1, 32, 2368, 2368, 32, 2368]
    - [44, 3612.0]
  - - [2944, 2368, 1, 32, 2944, 2944, 32, 2368]
    - [40, 3636.0]
  - - [3584, 2368, 1, 32, 3584, 3584, 32, 2368]
    - [44, 3457.0]
  - - [4288, 2368, 1, 32, 4288, 4288, 32, 2368]
    - [40, 3782.0]
  - - [5056, 2368, 1, 32, 5056, 5056, 32, 2368]
    - [40, 3837.0]
  - - [5888, 2368, 1, 32, 5888, 5888, 32, 2368]
    - [40, 3807.0]
  - - [6784, 2368, 1, 32, 6784, 6784, 32, 2368]
    - [40, 3873.0]
  - - [64, 2944, 1, 32, 64, 64, 32, 2944]
    - [40, 567.0]
  - - [128, 2944, 1, 32, 128, 128, 32, 2944]
    - [44, 1436.0]
  - - [256, 2944, 1, 32, 256, 256, 32, 2944]
    - [42, 2169.0]
  - - [448, 2944, 1, 32, 448, 448, 32, 2944]
    - [44, 2599.0]
  - - [704, 2944, 1, 32, 704, 704, 32, 2944]
    - [40, 3128.0]
  - - [1024, 2944, 1, 32, 1024, 1024, 32, 2944]
    - [44, 2716.0]
  - - [1408, 2944, 1, 32, 1408, 1408, 32, 2944]
    - [39, 3528.0]
  - - [1856, 2944, 1, 32, 1856, 1856, 32, 2944]
    - [40, 3655.0]
  - - [2368, 2944, 1, 32, 2368, 2368, 32, 2944]
    - [40, 3728.0]
  - - [2944, 2944, 1, 32, 2944, 2944, 32, 2944]
    - [44, 3785.0]
  - - [3584, 2944, 1, 32, 3584, 3584, 32, 2944]
    - [39, 3623.0]
  - - [4288, 2944, 1, 32, 4288, 4288, 32, 2944]
    - [43, 3899.0]
  - - [5056, 2944, 1, 32, 5056, 5056, 32, 2944]
    - [43, 3969.0]
  - - [5888, 2944, 1, 32, 5888, 5888, 32, 2944]
    - [43, 3962.0]
  - - [6784, 2944, 1, 32, 6784, 6784, 32, 2944]
    - [39, 3949.0]
  - - [64, 3584, 1, 32, 64, 64, 32, 3584]
    - [42, 1043.0]
  - - [128, 3584, 1, 32, 128, 128, 32, 3584]
    - [40, 1731.0]
  - - [256, 3584, 1, 32, 256, 256, 32, 3584]
    - [44, 2399.0]
  - - [448, 3584, 1, 32, 448, 448, 32, 3584]
    - [35, 2611.0]
  - - [704, 3584, 1, 32, 704, 704, 32, 3584]
    - [40, 3049.0]
  - - [1024, 3584, 1, 32, 1024, 1024, 32, 3584]
    - [44, 2689.0]
  - - [1408, 3584, 1, 32, 1408, 1408, 32, 3584]
    - [40, 3535.0]
  - - [1856, 3584, 1, 32, 1856, 1856, 32, 3584]
    - [39, 3716.0]
  - - [2368, 3584, 1, 32, 2368, 2368, 32, 3584]
    - [40, 3789.0]
  - - [2944, 3584, 1, 32, 2944, 2944, 32, 3584]
    - [44, 3823.0]
  - - [3584, 3584, 1, 32, 3584, 3584, 32, 3584]
    - [39, 3601.0]
  - - [4288, 3584, 1, 32, 4288, 4288, 32, 3584]
    - [43, 3979.0]
  - - [5056, 3584, 1, 32, 5056, 5056, 32, 3584]
    - [34, 4034.0]
  - - [5888, 3584, 1, 32, 5888, 5888, 32, 3584]
    - [43, 3965.0]
  - - [6784, 3584, 1, 32, 6784, 6784, 32, 3584]
    - [39, 4047.0]
  - - [64, 4288, 1, 32, 64, 64, 32, 4288]
    - [40, 915.0]
  - - [128, 4288, 1, 32, 128, 128, 32, 4288]
    - [44, 1535.0]
  - - [256, 4288, 1, 32, 256, 256, 32, 4288]
    - [44, 2132.0]
  - - [448, 4288, 1, 32, 448, 448, 32, 4288]
    - [44, 2825.0]
  - - [704, 4288, 1, 32, 704, 704, 32, 4288]
    - [40, 3194.0]
  - - [1024, 4288, 1, 32, 1024, 1024, 32, 4288]
    - [48, 2706.0]
  - - [1408, 4288, 1, 32, 1408, 1408, 32, 4288]
    - [40, 3594.0]
  - - [1856, 4288, 1, 32, 1856, 1856, 32, 4288]
    - [40, 3710.0]
  - - [2368, 4288, 1, 32, 2368, 2368, 32, 4288]
    - [44, 3861.0]
  - - [2944, 4288, 1, 32, 2944, 2944, 32, 4288]
    - [43, 3887.0]
  - - [3584, 4288, 1, 32, 3584, 3584, 32, 4288]
    - [43, 3714.0]
  - - [4288, 4288, 1, 32, 4288, 4288, 32, 4288]
    - [43, 3980.0]
  - - [5056, 4288, 1, 32, 5056, 5056, 32, 4288]
    - [34, 4043.0]
  - - [5888, 4288, 1, 32, 5888, 5888, 32, 4288]
    - [43, 3964.0]
  - - [6784, 4288, 1, 32, 6784, 6784, 32, 4288]
    - [39, 4046.0]
  - - [64, 5056, 1, 32, 64, 64, 32, 5056]
    - [40, 1221.0]
  - - [128, 5056, 1, 32, 128, 128, 32, 5056]
    - [42, 1836.0]
  - - [256, 5056, 1, 32, 256, 256, 32, 5056]
    - [38, 2602.0]
  - - [448, 5056, 1, 32, 448, 448, 32, 5056]
    - [44, 3179.0]
  - - [704, 5056, 1, 32, 704, 704, 32, 5056]
    - [40, 3390.0]
  - - [1024, 5056, 1, 32, 1024, 1024, 32, 5056]
    - [40, 2913.0]
  - - [1408, 5056, 1, 32, 1408, 1408, 32, 5056]
    - [40, 3703.0]
  - - [1856, 5056, 1, 32, 1856, 1856, 32, 5056]
    - [40, 3776.0]
  - - [2368, 5056, 1, 32, 2368, 2368, 32, 5056]
    - [44, 3847.0]
  - - [2944, 5056, 1, 32, 2944, 2944, 32, 5056]
    - [43, 3874.0]
  - - [3584, 5056, 1, 32, 3584, 3584, 32, 5056]
    - [43, 3704.0]
  - - [4288, 5056, 1, 32, 4288, 4288, 32, 5056]
    - [39, 4007.0]
  - - [5056, 5056, 1, 32, 5056, 5056, 32, 5056]
    - [37, 4035.0]
  - - [5888, 5056, 1, 32, 5888, 5888, 32, 5056]
    - [43, 3989.0]
  - - [6784, 5056, 1, 32, 6784, 6784, 32, 5056]
    - [39, 4056.0]
  - - [64, 5888, 1, 32, 64, 64, 32, 5888]
    - [40, 1277.0]
  - - [128, 5888, 1, 32, 128, 128, 32, 5888]
    - [42, 1945.0]
  - - [256, 5888, 1, 32, 256, 256, 32, 5888]
    - [41, 2566.0]
  - - [448, 5888, 1, 32, 448, 448, 32, 5888]
    - [44, 3032.0]
  - - [704, 5888, 1, 32, 704, 704, 32, 5888]
    - [39, 3391.0]
  - - [1024, 5888, 1, 32, 1024, 1024, 32, 5888]
    - [44, 2956.0]
  - - [1408, 5888, 1, 32, 1408, 1408, 32, 5888]
    - [44, 3773.0]
  - - [1856, 5888, 1, 32, 1856, 1856, 32, 5888]
    - [39, 3931.0]
  - - [2368, 5888, 1, 32, 2368, 2368, 32, 5888]
    - [39, 3972.0]
  - - [2944, 5888, 1, 32, 2944, 2944, 32, 5888]
    - [43, 3953.0]
  - - [3584, 5888, 1, 32, 3584, 3584, 32, 5888]
    - [43, 3790.0]
  - - [4288, 5888, 1, 32, 4288, 4288, 32, 5888]
    - [43, 4080.0]
  - - [5056, 5888, 1, 32, 5056, 5056, 32, 5888]
    - [34, 4139.0]
  - - [5888, 5888, 1, 32, 5888, 5888, 32, 5888]
    - [39, 4071.0]
  - - [6784, 5888, 1, 32, 6784, 6784, 32, 5888]
    - [43, 4128.0]
  - - [64, 6784, 1, 32, 64, 64, 32, 6784]
    - [44, 1623.0]
  - - [128, 6784, 1, 32, 128, 128, 32, 6784]
    - [48, 1838.0]
  - - [256, 6784, 1, 32, 256, 256, 32, 6784]
    - [44, 2651.0]
  - - [448, 6784, 1, 32, 448, 448, 32, 6784]
    - [40, 3208.0]
  - - [704, 6784, 1, 32, 704, 704, 32, 6784]
    - [40, 3538.0]
  - - [1024, 6784, 1, 32, 1024, 1024, 32, 6784]
    - [42, 2891.0]
  - - [1408, 6784, 1, 32, 1408, 1408, 32, 6784]
    - [44, 3790.0]
  - - [1856, 6784, 1, 32, 1856, 1856, 32, 6784]
    - [39, 3922.0]
  - - [2368, 6784, 1, 32, 2368, 2368, 32, 6784]
    - [39, 4011.0]
  - - [2944, 6784, 1, 32, 2944, 2944, 32, 6784]
    - [43, 4006.0]
  - - [3584, 6784, 1, 32, 3584, 3584, 32, 6784]
    - [43, 3818.0]
  - - [4288, 6784, 1, 32, 4288, 4288, 32, 6784]
    - [34, 4128.0]
  - - [5056, 6784, 1, 32, 5056, 5056, 32, 6784]
    - [37, 4156.0]
  - - [5888, 6784, 1, 32, 5888, 5888, 32, 6784]
    - [39, 4088.0]
  - - [6784, 6784, 1, 32, 6784, 6784, 32, 6784]
    - [39, 4142.0]
  - - [32, 32, 1, 256, 32, 32, 256, 32]
    - [42, 10.0]
  - - [32, 32, 1, 1280, 32, 32, 1280, 32]
    - [54, 41.0]
  - - [32, 32, 1, 3328, 32, 32, 3328, 32]
    - [58, 71.0]
  - - [32, 64, 1, 32, 32, 32, 32, 64]
    - [35, 7.0]
  - - [32, 128, 1, 32, 32, 32, 32, 128]
    - [36, 14.0]
  - - [32, 256, 1, 32, 32, 32, 32, 256]
    - [38, 29.0]
  - - [32, 448, 1, 32, 32, 32, 32, 448]
    - [46, 65.0]
  - - [32, 704, 1, 32, 32, 32, 32, 704]
    - [36, 78.0]
  - - [32, 1024, 1, 32, 32, 32, 32, 1024]
    - [40, 115.0]
  - - [32, 1408, 1, 32, 32, 32, 32, 1408]
    - [44, 158.0]
  - - [32, 1856, 1, 32, 32, 32, 32, 1856]
    - [35, 205.0]
  - - [32, 2368, 1, 32, 32, 32, 32, 2368]
    - [36, 253.0]
  - - [32, 2944, 1, 32, 32, 32, 32, 2944]
    - [40, 297.0]
  - - [32, 3584, 1, 32, 32, 32, 32, 3584]
    - [44, 332.0]
  - - [32, 4288, 1, 32, 32, 32, 32, 4288]
    - [40, 560.0]
  - - [32, 5056, 1, 32, 32, 32, 32, 5056]
    - [46, 647.0]
  - - [32, 5888, 1, 32, 32, 32, 32, 5888]
    - [44, 769.0]
  - - [32, 6784, 1, 32, 32, 32, 32, 6784]
    - [40, 851.0]
  - - [64, 32, 1, 32, 64, 64, 32, 32]
    - [35, 7.0]
  - - [128, 32, 1, 32, 128, 128, 32, 32]
    - [35, 13.0]
  - - [256, 32, 1, 32, 256, 256, 32, 32]
    - [36, 42.0]
  - - [448, 32, 1, 32, 448, 448, 32, 32]
    - [38, 53.0]
  - - [704, 32, 1, 32, 704, 704, 32, 32]
    - [35, 83.0]
  - - [1024, 32, 1, 32, 1024, 1024, 32, 32]
    - [35, 121.0]
  - - [1408, 32, 1, 32, 1408, 1408, 32, 32]
    - [35, 164.0]
  - - [1856, 32, 1, 32, 1856, 1856, 32, 32]
    - [35, 220.0]
  - - [2368, 32, 1, 32, 2368, 2368, 32, 32]
    - [38, 261.0]
  - - [2944, 32, 1, 32, 2944, 2944, 32, 32]
    - [38, 336.0]
  - - [3584, 32, 1, 32, 3584, 3584, 32, 32]
    - [44, 566.0]
  - - [4288, 32, 1, 32, 4288, 4288, 32, 32]
    - [40, 669.0]
  - - [5056, 32, 1, 32, 5056, 5056, 32, 32]
    - [40, 780.0]
  - - [5888, 32, 1, 32, 5888, 5888, 32, 32]
    - [44, 919.0]
  - - [6784, 32, 1, 32, 6784, 6784, 32, 32]
    - [44, 1046.0]
  - - [1, 1, 1, 1, 1, 1, 1, 1]
    - [62, 0.0001865671699052136]
  - - [1, 64, 1, 256, 1, 1, 256, 64]
    - [64, 1.0]
  - - [1, 128, 1, 256, 1, 1, 256, 128]
    - [61, 1.0]
  - - [1, 256, 1, 256, 1, 1, 256, 256]
    - [64, 3.0]
  - - [1, 448, 1, 256, 1, 1, 256, 448]
    - [64, 4.0]
  - - [1, 704, 1, 256, 1, 1, 256, 704]
    - [64, 6.0]
  - - [1, 1024, 1, 256, 1, 1, 256, 1024]
    - [64, 9.0]
  - - [1, 1408, 1, 256, 1, 1, 256, 1408]
    - [64, 13.0]
  - - [1, 1856, 1, 256, 1, 1, 256, 1856]
    - [64, 17.0]
  - - [1, 2368, 1, 256, 1, 1, 256, 2368]
    - [64, 21.0]
  - - [1, 2944, 1, 256, 1, 1, 256, 2944]
    - [64, 26.0]
  - - [1, 3584, 1, 256, 1, 1, 256, 3584]
    - [64, 36.0]
  - - [1, 4288, 1, 256, 1, 1, 256, 4288]
    - [64, 32.0]
  - - [1, 5056, 1, 256, 1, 1, 256, 5056]
    - [73, 38.0]
  - - [1, 5888, 1, 256, 1, 1, 256, 5888]
    - [64, 42.0]
  - - [1, 6784, 1, 256, 1, 1, 256, 6784]
    - [73, 50.0]
  - - [1, 64, 1, 1280, 1, 1, 1280, 64]
    - [88, 3.0]
  - - [1, 128, 1, 1280, 1, 1, 1280, 128]
    - [86, 5.0]
  - - [1, 256, 1, 1280, 1, 1, 1280, 256]
    - [86, 10.0]
  - - [1, 448, 1, 1280, 1, 1, 1280, 448]
    - [88, 18.0]
  - - [1, 704, 1, 1280, 1, 1, 1280, 704]
    - [86, 27.0]
  - - [1, 1024, 1, 1280, 1, 1, 1280, 1024]
    - [88, 34.0]
  - - [1, 1408, 1, 1280, 1, 1, 1280, 1408]
    - [88, 47.0]
  - - [1, 1856, 1, 1280, 1, 1, 1280, 1856]
    - [88, 49.0]
  - - [1, 2368, 1, 1280, 1, 1, 1280, 2368]
    - [88, 63.0]
  - - [1, 2944, 1, 1280, 1, 1, 1280, 2944]
    - [87, 64.0]
  - - [1, 3584, 1, 1280, 1, 1, 1280, 3584]
    - [88, 65.0]
  - - [1, 4288, 1, 1280, 1, 1, 1280, 4288]
    - [85, 68.0]
  - - [1, 5056, 1, 1280, 1, 1, 1280, 5056]
    - [82, 70.0]
  - - [1, 5888, 1, 1280, 1, 1, 1280, 5888]
    - [85, 74.0]
  - - [1, 6784, 1, 1280, 1, 1, 1280, 6784]
    - [83, 78.0]
  - - [1, 64, 1, 3328, 1, 1, 3328, 64]
    - [91, 4.0]
  - - [1, 128, 1, 3328, 1, 1, 3328, 128]
    - [91, 8.0]
  - - [1, 256, 1, 3328, 1, 1, 3328, 256]
    - [91, 17.0]
  - - [1, 448, 1, 3328, 1, 1, 3328, 448]
    - [91, 29.0]
  - - [1, 704, 1, 3328, 1, 1, 3328, 704]
    - [88, 38.0]
  - - [1, 1024, 1, 3328, 1, 1, 3328, 1024]
    - [92, 53.0]
  - - [1, 1408, 1, 3328, 1, 1, 3328, 1408]
    - [92, 57.0]
  - - [1, 1856, 1, 3328, 1, 1, 3328, 1856]
    - [92, 61.0]
  - - [1, 2368, 1, 3328, 1, 1, 3328, 2368]
    - [88, 71.0]
  - - [1, 2944, 1, 3328, 1, 1, 3328, 2944]
    - [88, 72.0]
  - - [1, 3584, 1, 3328, 1, 1, 3328, 3584]
    - [92, 74.0]
  - - [1, 4288, 1, 3328, 1, 1, 3328, 4288]
    - [90, 79.0]
  - - [1, 5056, 1, 3328, 1, 1, 3328, 5056]
    - [92, 83.0]
  - - [1, 5888, 1, 3328, 1, 1, 3328, 5888]
    - [92, 81.0]
  - - [1, 6784, 1, 3328, 1, 1, 3328, 6784]
    - [90, 90.0]
  - - [64, 1, 1, 256, 64, 64, 256, 1]
    - [64, 1.0]
  - - [128, 1, 1, 256, 128, 128, 256, 1]
    - [61, 1.0]
  - - [256, 1, 1, 256, 256, 256, 256, 1]
    - [62, 2.0]
  - - [448, 1, 1, 256, 448, 448, 256, 1]
    - [64, 4.0]
  - - [704, 1, 1, 256, 704, 704, 256, 1]
    - [64, 6.0]
  - - [1024, 1, 1, 256, 1024, 1024, 256, 1]
    - [64, 9.0]
  - - [1408, 1, 1, 256, 1408, 1408, 256, 1]
    - [64, 13.0]
  - - [1856, 1, 1, 256, 1856, 1856, 256, 1]
    - [64, 17.0]
  - - [2368, 1, 1, 256, 2368, 2368, 256, 1]
    - [64, 22.0]
  - - [2944, 1, 1, 256, 2944, 2944, 256, 1]
    - [64, 27.0]
  - - [3584, 1, 1, 256, 3584, 3584, 256, 1]
    - [78, 33.0]
  - - [4288, 1, 1, 256, 4288, 4288, 256, 1]
    - [64, 32.0]
  - - [5056, 1, 1, 256, 5056, 5056, 256, 1]
    - [73, 38.0]
  - - [5888, 1, 1, 256, 5888, 5888, 256, 1]
    - [73, 44.0]
  - - [6784, 1, 1, 256, 6784, 6784, 256, 1]
    - [73, 51.0]
  - - [64, 1, 1, 1280, 64, 64, 1280, 1]
    - [86, 3.0]
  - - [128, 1, 1, 1280, 128, 128, 1280, 1]
    - [86, 5.0]
  - - [256, 1, 1, 1280, 256, 256, 1280, 1]
    - [86, 10.0]
  - - [448, 1, 1, 1280, 448, 448, 1280, 1]
    - [86, 18.0]
  - - [704, 1, 1, 1280, 704, 704, 1280, 1]
    - [88, 32.0]
  - - [1024, 1, 1, 1280, 1024, 1024, 1280, 1]
    - [88, 35.0]
  - - [1408, 1, 1, 1280, 1408, 1408, 1280, 1]
    - [88, 47.0]
  - - [1856, 1, 1, 1280, 1856, 1856, 1280, 1]
    - [88, 49.0]
  - - [2368, 1, 1, 1280, 2368, 2368, 1280, 1]
    - [88, 63.0]
  - - [2944, 1, 1, 1280, 2944, 2944, 1280, 1]
    - [88, 62.0]
  - - [3584, 1, 1, 1280, 3584, 3584, 1280, 1]
    - [88, 63.0]
  - - [4288, 1, 1, 1280, 4288, 4288, 1280, 1]
    - [88, 68.0]
  - - [5056, 1, 1, 1280, 5056, 5056, 1280, 1]
    - [83, 71.0]
  - - [5888, 1, 1, 1280, 5888, 5888, 1280, 1]
    - [88, 73.0]
  - - [6784, 1, 1, 1280, 6784, 6784, 1280, 1]
    - [83, 78.0]
  - - [64, 1, 1, 3328, 64, 64, 3328, 1]
    - [91, 4.0]
  - - [128, 1, 1, 3328, 128, 128, 3328, 1]
    - [92, 9.0]
  - - [256, 1, 1, 3328, 256, 256, 3328, 1]
    - [91, 17.0]
  - - [448, 1, 1, 3328, 448, 448, 3328, 1]
    - [91, 29.0]
  - - [704, 1, 1, 3328, 704, 704, 3328, 1]
    - [89, 37.0]
  - - [1024, 1, 1, 3328, 1024, 1024, 3328, 1]
    - [92, 54.0]
  - - [1408, 1, 1, 3328, 1408, 1408, 3328, 1]
    - [92, 57.0]
  - - [1856, 1, 1, 3328, 1856, 1856, 3328, 1]
    - [92, 61.0]
  - - [2368, 1, 1, 3328, 2368, 2368, 3328, 1]
    - [88, 71.0]
  - - [2944, 1, 1, 3328, 2944, 2944, 3328, 1]
    - [88, 72.0]
  - - [3584, 1, 1, 3328, 3584, 3584, 3328, 1]
    - [92, 74.0]
  - - [4288, 1, 1, 3328, 4288, 4288, 3328, 1]
    - [92, 79.0]
  - - [5056, 1, 1, 3328, 5056, 5056, 3328, 1]
    - [92, 83.0]
  - - [5888, 1, 1, 3328, 5888, 5888, 3328, 1]
    - [92, 81.0]
  - - [6784, 1, 1, 3328, 6784, 6784, 3328, 1]
    - [92, 86.0]
  - - [64, 64, 1, 1, 64, 64, 1, 64]
    - [62, 1.0]
  - - [128, 64, 1, 1, 128, 128, 1, 64]
    - [60, 1.0]
  - - [256, 64, 1, 1, 256, 256, 1, 64]
    - [61, 4.0]
  - - [448, 64, 1, 1, 448, 448, 1, 64]
    - [65, 5.0]
  - - [704, 64, 1, 1, 704, 704, 1, 64]
    - [62, 7.0]
  - - [1024, 64, 1, 1, 1024, 1024, 1, 64]
    - [62, 9.0]
  - - [1408, 64, 1, 1, 1408, 1408, 1, 64]
    - [67, 13.0]
  - - [1856, 64, 1, 1, 1856, 1856, 1, 64]
    - [62, 16.0]
  - - [2368, 64, 1, 1, 2368, 2368, 1, 64]
    - [62, 21.0]
  - - [2944, 64, 1, 1, 2944, 2944, 1, 64]
    - [62, 26.0]
  - - [3584, 64, 1, 1, 3584, 3584, 1, 64]
    - [62, 55.0]
  - - [4288, 64, 1, 1, 4288, 4288, 1, 64]
    - [62, 47.0]
  - - [5056, 64, 1, 1, 5056, 5056, 1, 64]
    - [67, 54.0]
  - - [5888, 64, 1, 1, 5888, 5888, 1, 64]
    - [64, 64.0]
  - - [6784, 64, 1, 1, 6784, 6784, 1, 64]
    - [62, 72.0]
  - - [64, 128, 1, 1, 64, 64, 1, 128]
    - [60, 1.0]
  - - [128, 128, 1, 1, 128, 128, 1, 128]
    - [73, 4.0]
  - - [256, 128, 1, 1, 256, 256, 1, 128]
    - [61, 6.0]
  - - [448, 128, 1, 1, 448, 448, 1, 128]
    - [62, 8.0]
  - - [704, 128, 1, 1, 704, 704, 1, 128]
    - [62, 13.0]
  - - [1024, 128, 1, 1, 1024, 1024, 1, 128]
    - [62, 18.0]
  - - [1408, 128, 1, 1, 1408, 1408, 1, 128]
    - [69, 25.0]
  - - [1856, 128, 1, 1, 1856, 1856, 1, 128]
    - [62, 57.0]
  - - [2368, 128, 1, 1, 2368, 2368, 1, 128]
    - [62, 51.0]
  - - [2944, 128, 1, 1, 2944, 2944, 1, 128]
    - [62, 63.0]
  - - [3584, 128, 1, 1, 3584, 3584, 1, 128]
    - [62, 76.0]
  - - [4288, 128, 1, 1, 4288, 4288, 1, 128]
    - [64, 85.0]
  - - [5056, 128, 1, 1, 5056, 5056, 1, 128]
    - [64, 97.0]
  - - [5888, 128, 1, 1, 5888, 5888, 1, 128]
    - [64, 106.0]
  - - [6784, 128, 1, 1, 6784, 6784, 1, 128]
    - [69, 114.0]
  - - [64, 256, 1, 1, 64, 64, 1, 256]
    - [62, 2.0]
  - - [128, 256, 1, 1, 128, 128, 1, 256]
    - [71, 6.0]
  - - [256, 256, 1, 1, 256, 256, 1, 256]
    - [62, 9.0]
  - - [448, 256, 1, 1, 448, 448, 1, 256]
    - [62, 16.0]
  - - [704, 256, 1, 1, 704, 704, 1, 256]
    - [64, 25.0]
  - - [1024, 256, 1, 1, 1024, 1024, 1, 256]
    - [62, 64.0]
  - - [1408, 256, 1, 1, 1408, 1408, 1, 256]
    - [64, 60.0]
  - - [1856, 256, 1, 1, 1856, 1856, 1, 256]
    - [62, 79.0]
  - - [2368, 256, 1, 1, 2368, 2368, 1, 256]
    - [64, 91.0]
  - - [2944, 256, 1, 1, 2944, 2944, 1, 256]
    - [75, 111.0]
  - - [3584, 256, 1, 1, 3584, 3584, 1, 256]
    - [81, 111.0]
  - - [4288, 256, 1, 1, 4288, 4288, 1, 256]
    - [69, 119.0]
  - - [5056, 256, 1, 1, 5056, 5056, 1, 256]
    - [68, 134.0]
  - - [5888, 256, 1, 1, 5888, 5888, 1, 256]
    - [74, 153.0]
  - - [6784, 256, 1, 1, 6784, 6784, 1, 256]
    - [75, 156.0]
  - - [64, 448, 1, 1, 64, 64, 1, 448]
    - [70, 5.0]
  - - [128, 448, 1, 1, 128, 128, 1, 448]
    - [62, 8.0]
  - - [256, 448, 1, 1, 256, 256, 1, 448]
    - [62, 16.0]
  - - [448, 448, 1, 1, 448, 448, 1, 448]
    - [67, 28.0]
  - - [704, 448, 1, 1, 704, 704, 1, 448]
    - [64, 53.0]
  - - [1024, 448, 1, 1, 1024, 1024, 1, 448]
    - [69, 74.0]
  - - [1408, 448, 1, 1, 1408, 1408, 1, 448]
    - [76, 93.0]
  - - [1856, 448, 1, 1, 1856, 1856, 1, 448]
    - [64, 111.0]
  - - [2368, 448, 1, 1, 2368, 2368, 1, 448]
    - [62, 126.0]
  - - [2944, 448, 1, 1, 2944, 2944, 1, 448]
    - [68, 136.0]
  - - [3584, 448, 1, 1, 3584, 3584, 1, 448]
    - [67, 151.0]
  - - [4288, 448, 1, 1, 4288, 4288, 1, 448]
    - [64, 160.0]
  - - [5056, 448, 1, 1, 5056, 5056, 1, 448]
    - [69, 172.0]
  - - [5888, 448, 1, 1, 5888, 5888, 1, 448]
    - [64, 177.0]
  - - [6784, 448, 1, 1, 6784, 6784, 1, 448]
    - [69, 187.0]
  - - [64, 704, 1, 1, 64, 64, 1, 704]
    - [77, 7.0]
  - - [128, 704, 1, 1, 128, 128, 1, 704]
    - [64, 13.0]
  - - [256, 704, 1, 1, 256, 256, 1, 704]
    - [64, 26.0]
  - - [448, 704, 1, 1, 448, 448, 1, 704]
    - [62, 55.0]
  - - [704, 704, 1, 1, 704, 704, 1, 704]
    - [62, 84.0]
  - - [1024, 704, 1, 1, 1024, 1024, 1, 704]
    - [69, 101.0]
  - - [1408, 704, 1, 1, 1408, 1408, 1, 704]
    - [64, 133.0]
  - - [1856, 704, 1, 1, 1856, 1856, 1, 704]
    - [61, 137.0]
  - - [2368, 704, 1, 1, 2368, 2368, 1, 704]
    - [64, 157.0]
  - - [2944, 704, 1, 1, 2944, 2944, 1, 704]
    - [75, 166.0]
  - - [3584, 704, 1, 1, 3584, 3584, 1, 704]
    - [69, 175.0]
  - - [4288, 704, 1, 1, 4288, 4288, 1, 704]
    - [72, 183.0]
  - - [5056, 704, 1, 1, 5056, 5056, 1, 704]
    - [67, 191.0]
  - - [5888, 704, 1, 1, 5888, 5888, 1, 704]
    - [64, 199.0]
  - - [6784, 704, 1, 1, 6784, 6784, 1, 704]
    - [61, 200.0]
  - - [64, 1024, 1, 1, 64, 64, 1, 1024]
    - [62, 9.0]
  - - [128, 1024, 1, 1, 128, 128, 1, 1024]
    - [69, 19.0]
  - - [256, 1024, 1, 1, 256, 256, 1, 1024]
    - [62, 64.0]
  - - [448, 1024, 1, 1, 448, 448, 1, 1024]
    - [62, 79.0]
  - - [704, 1024, 1, 1, 704, 704, 1, 1024]
    - [64, 100.0]
  - - [1024, 1024, 1, 1, 1024, 1024, 1, 1024]
    - [61, 132.0]
  - - [1408, 1024, 1, 1, 1408, 1408, 1, 1024]
    - [71, 145.0]
  - - [1856, 1024, 1, 1, 1856, 1856, 1, 1024]
    - [69, 167.0]
  - - [2368, 1024, 1, 1, 2368, 2368, 1, 1024]
    - [64, 172.0]
  - - [2944, 1024, 1, 1, 2944, 2944, 1, 1024]
    - [62, 186.0]
  - - [3584, 1024, 1, 1, 3584, 3584, 1, 1024]
    - [62, 195.0]
  - - [4288, 1024, 1, 1, 4288, 4288, 1, 1024]
    - [69, 203.0]
  - - [5056, 1024, 1, 1, 5056, 5056, 1, 1024]
    - [68, 218.0]
  - - [5888, 1024, 1, 1, 5888, 5888, 1, 1024]
    - [66, 218.0]
  - - [6784, 1024, 1, 1, 6784, 6784, 1, 1024]
    - [61, 225.0]
  - - [64, 1408, 1, 1, 64, 64, 1, 1408]
    - [64, 13.0]
  - - [128, 1408, 1, 1, 128, 128, 1, 1408]
    - [64, 25.0]
  - - [256, 1408, 1, 1, 256, 256, 1, 1408]
    - [62, 63.0]
  - - [448, 1408, 1, 1, 448, 448, 1, 1408]
    - [62, 96.0]
  - - [704, 1408, 1, 1, 704, 704, 1, 1408]
    - [68, 124.0]
  - - [1024, 1408, 1, 1, 1024, 1024, 1, 1408]
    - [71, 142.0]
  - - [1408, 1408, 1, 1, 1408, 1408, 1, 1408]
    - [62, 165.0]
  - - [1856, 1408, 1, 1, 1856, 1856, 1, 1408]
    - [67, 187.0]
  - - [2368, 1408, 1, 1, 2368, 2368, 1, 1408]
    - [69, 193.0]
  - - [2944, 1408, 1, 1, 2944, 2944, 1, 1408]
    - [63, 193.0]
  - - [3584, 1408, 1, 1, 3584, 3584, 1, 1408]
    - [67, 194.0]
  - - [4288, 1408, 1, 1, 4288, 4288, 1, 1408]
    - [69, 203.0]
  - - [5056, 1408, 1, 1, 5056, 5056, 1, 1408]
    - [61, 219.0]
  - - [5888, 1408, 1, 1, 5888, 5888, 1, 1408]
    - [61, 222.0]
  - - [6784, 1408, 1, 1, 6784, 6784, 1, 1408]
    - [61, 228.0]
  - - [64, 1856, 1, 1, 64, 64, 1, 1856]
    - [64, 16.0]
  - - [128, 1856, 1, 1, 128, 128, 1, 1856]
    - [69, 45.0]
  - - [256, 1856, 1, 1, 256, 256, 1, 1856]
    - [64, 72.0]
  - - [448, 1856, 1, 1, 448, 448, 1, 1856]
    - [76, 94.0]
  - - [704, 1856, 1, 1, 704, 704, 1, 1856]
    - [64, 120.0]
  - - [1024, 1856, 1, 1, 1024, 1024, 1, 1856]
    - [66, 142.0]
  - - [1408, 1856, 1, 1, 1408, 1408, 1, 1856]
    - [67, 170.0]
  - - [1856, 1856, 1, 1, 1856, 1856, 1, 1856]
    - [64, 186.0]
  - - [2368, 1856, 1, 1, 2368, 2368, 1, 1856]
    - [67, 197.0]
  - - [2944, 1856, 1, 1, 2944, 2944, 1, 1856]
    - [69, 207.0]
  - - [3584, 1856, 1, 1, 3584, 3584, 1, 1856]
    - [69, 209.0]
  - - [4288, 1856, 1, 1, 4288, 4288, 1, 1856]
    - [64, 216.0]
  - - [5056, 1856, 1, 1, 5056, 5056, 1, 1856]
    - [64, 225.0]
  - - [5888, 1856, 1, 1, 5888, 5888, 1, 1856]
    - [66, 238.0]
  - - [6784, 1856, 1, 1, 6784, 6784, 1, 1856]
    - [61, 242.0]
  - - [64, 2368, 1, 1, 64, 64, 1, 2368]
    - [64, 21.0]
  - - [128, 2368, 1, 1, 128, 128, 1, 2368]
    - [64, 56.0]
  - - [256, 2368, 1, 1, 256, 256, 1, 2368]
    - [62, 95.0]
  - - [448, 2368, 1, 1, 448, 448, 1, 2368]
    - [64, 129.0]
  - - [704, 2368, 1, 1, 704, 704, 1, 2368]
    - [64, 154.0]
  - - [1024, 2368, 1, 1, 1024, 1024, 1, 2368]
    - [67, 166.0]
  - - [1408, 2368, 1, 1, 1408, 1408, 1, 2368]
    - [69, 194.0]
  - - [1856, 2368, 1, 1, 1856, 1856, 1, 2368]
    - [64, 210.0]
  - - [2368, 2368, 1, 1, 2368, 2368, 1, 2368]
    - [64, 217.0]
  - - [2944, 2368, 1, 1, 2944, 2944, 1, 2368]
    - [68, 223.0]
  - - [3584, 2368, 1, 1, 3584, 3584, 1, 2368]
    - [69, 226.0]
  - - [4288, 2368, 1, 1, 4288, 4288, 1, 2368]
    - [69, 230.0]
  - - [5056, 2368, 1, 1, 5056, 5056, 1, 2368]
    - [63, 242.0]
  - - [5888, 2368, 1, 1, 5888, 5888, 1, 2368]
    - [66, 244.0]
  - - [6784, 2368, 1, 1, 6784, 6784, 1, 2368]
    - [68, 248.0]
  - - [64, 2944, 1, 1, 64, 64, 1, 2944]
    - [62, 26.0]
  - - [128, 2944, 1, 1, 128, 128, 1, 2944]
    - [69, 69.0]
  - - [256, 2944, 1, 1, 256, 256, 1, 2944]
    - [64, 115.0]
  - - [448, 2944, 1, 1, 448, 448, 1, 2944]
    - [61, 139.0]
  - - [704, 2944, 1, 1, 704, 704, 1, 2944]
    - [62, 163.0]
  - - [1024, 2944, 1, 1, 1024, 1024, 1, 2944]
    - [68, 167.0]
  - - [1408, 2944, 1, 1, 1408, 1408, 1, 2944]
    - [66, 202.0]
  - - [1856, 2944, 1, 1, 1856, 1856, 1, 2944]
    - [61, 215.0]
  - - [2368, 2944, 1, 1, 2368, 2368, 1, 2944]
    - [66, 217.0]
  - - [2944, 2944, 1, 1, 2944, 2944, 1, 2944]
    - [61, 228.0]
  - - [3584, 2944, 1, 1, 3584, 3584, 1, 2944]
    - [61, 227.0]
  - - [4288, 2944, 1, 1, 4288, 4288, 1, 2944]
    - [68, 238.0]
  - - [5056, 2944, 1, 1, 5056, 5056, 1, 2944]
    - [63, 244.0]
  - - [5888, 2944, 1, 1, 5888, 5888, 1, 2944]
    - [63, 249.0]
  - - [6784, 2944, 1, 1, 6784, 6784, 1, 2944]
    - [61, 256.0]
  - - [64, 3584, 1, 1, 64, 64, 1, 3584]
    - [64, 57.0]
  - - [128, 3584, 1, 1, 128, 128, 1, 3584]
    - [62, 83.0]
  - - [256, 3584, 1, 1, 256, 256, 1, 3584]
    - [62, 118.0]
  - - [448, 3584, 1, 1, 448, 448, 1, 3584]
    - [64, 152.0]
  - - [704, 3584, 1, 1, 704, 704, 1, 3584]
    - [62, 176.0]
  - - [1024, 3584, 1, 1, 1024, 1024, 1, 3584]
    - [64, 190.0]
  - - [1408, 3584, 1, 1, 1408, 1408, 1, 3584]
    - [68, 211.0]
  - - [1856, 3584, 1, 1, 1856, 1856, 1, 3584]
    - [63, 225.0]
  - - [2368, 3584, 1, 1, 2368, 2368, 1, 3584]
    - [66, 232.0]
  - - [2944, 3584, 1, 1, 2944, 2944, 1, 3584]
    - [61, 241.0]
  - - [3584, 3584, 1, 1, 3584, 3584, 1, 3584]
    - [63, 245.0]
  - - [4288, 3584, 1, 1, 4288, 4288, 1, 3584]
    - [66, 247.0]
  - - [5056, 3584, 1, 1, 5056, 5056, 1, 3584]
    - [63, 255.0]
  - - [5888, 3584, 1, 1, 5888, 5888, 1, 3584]
    - [61, 255.0]
  - - [6784, 3584, 1, 1, 6784, 6784, 1, 3584]
    - [61, 261.0]
  - - [64, 4288, 1, 1, 64, 64, 1, 4288]
    - [64, 51.0]
  - - [128, 4288, 1, 1, 128, 128, 1, 4288]
    - [76, 89.0]
  - - [256, 4288, 1, 1, 256, 256, 1, 4288]
    - [67, 126.0]
  - - [448, 4288, 1, 1, 448, 448, 1, 4288]
    - [62, 163.0]
  - - [704, 4288, 1, 1, 704, 704, 1, 4288]
    - [61, 189.0]
  - - [1024, 4288, 1, 1, 1024, 1024, 1, 4288]
    - [68, 197.0]
  - - [1408, 4288, 1, 1, 1408, 1408, 1, 4288]
    - [61, 220.0]
  - - [1856, 4288, 1, 1, 1856, 1856, 1, 4288]
    - [61, 232.0]
  - - [2368, 4288, 1, 1, 2368, 2368, 1, 4288]
    - [61, 239.0]
  - - [2944, 4288, 1, 1, 2944, 2944, 1, 4288]
    - [61, 245.0]
  - - [3584, 4288, 1, 1, 3584, 3584, 1, 4288]
    - [66, 248.0]
  - - [4288, 4288, 1, 1, 4288, 4288, 1, 4288]
    - [63, 249.0]
  - - [5056, 4288, 1, 1, 5056, 5056, 1, 4288]
    - [61, 256.0]
  - - [5888, 4288, 1, 1, 5888, 5888, 1, 4288]
    - [61, 256.0]
  - - [6784, 4288, 1, 1, 6784, 6784, 1, 4288]
    - [66, 260.0]
  - - [64, 5056, 1, 1, 64, 64, 1, 5056]
    - [62, 59.0]
  - - [128, 5056, 1, 1, 128, 128, 1, 5056]
    - [67, 104.0]
  - - [256, 5056, 1, 1, 256, 256, 1, 5056]
    - [64, 136.0]
  - - [448, 5056, 1, 1, 448, 448, 1, 5056]
    - [64, 173.0]
  - - [704, 5056, 1, 1, 704, 704, 1, 5056]
    - [62, 193.0]
  - - [1024, 5056, 1, 1, 1024, 1024, 1, 5056]
    - [64, 205.0]
  - - [1408, 5056, 1, 1, 1408, 1408, 1, 5056]
    - [63, 232.0]
  - - [1856, 5056, 1, 1, 1856, 1856, 1, 5056]
    - [63, 237.0]
  - - [2368, 5056, 1, 1, 2368, 2368, 1, 5056]
    - [61, 243.0]
  - - [2944, 5056, 1, 1, 2944, 2944, 1, 5056]
    - [61, 249.0]
  - - [3584, 5056, 1, 1, 3584, 3584, 1, 5056]
    - [63, 249.0]
  - - [4288, 5056, 1, 1, 4288, 4288, 1, 5056]
    - [61, 253.0]
  - - [5056, 5056, 1, 1, 5056, 5056, 1, 5056]
    - [61, 259.0]
  - - [5888, 5056, 1, 1, 5888, 5888, 1, 5056]
    - [61, 258.0]
  - - [6784, 5056, 1, 1, 6784, 6784, 1, 5056]
    - [66, 264.0]
  - - [64, 5888, 1, 1, 64, 64, 1, 5888]
    - [62, 69.0]
  - - [128, 5888, 1, 1, 128, 128, 1, 5888]
    - [64, 118.0]
  - - [256, 5888, 1, 1, 256, 256, 1, 5888]
    - [68, 152.0]
  - - [448, 5888, 1, 1, 448, 448, 1, 5888]
    - [64, 181.0]
  - - [704, 5888, 1, 1, 704, 704, 1, 5888]
    - [66, 210.0]
  - - [1024, 5888, 1, 1, 1024, 1024, 1, 5888]
    - [64, 210.0]
  - - [1408, 5888, 1, 1, 1408, 1408, 1, 5888]
    - [63, 235.0]
  - - [1856, 5888, 1, 1, 1856, 1856, 1, 5888]
    - [63, 246.0]
  - - [2368, 5888, 1, 1, 2368, 2368, 1, 5888]
    - [66, 251.0]
  - - [2944, 5888, 1, 1, 2944, 2944, 1, 5888]
    - [66, 254.0]
  - - [3584, 5888, 1, 1, 3584, 3584, 1, 5888]
    - [61, 253.0]
  - - [4288, 5888, 1, 1, 4288, 4288, 1, 5888]
    - [66, 259.0]
  - - [5056, 5888, 1, 1, 5056, 5056, 1, 5888]
    - [66, 264.0]
  - - [5888, 5888, 1, 1, 5888, 5888, 1, 5888]
    - [66, 262.0]
  - - [6784, 5888, 1, 1, 6784, 6784, 1, 5888]
    - [61, 268.0]
  - - [64, 6784, 1, 1, 64, 64, 1, 6784]
    - [62, 79.0]
  - - [128, 6784, 1, 1, 128, 128, 1, 6784]
    - [69, 122.0]
  - - [256, 6784, 1, 1, 256, 256, 1, 6784]
    - [64, 161.0]
  - - [448, 6784, 1, 1, 448, 448, 1, 6784]
    - [62, 190.0]
  - - [704, 6784, 1, 1, 704, 704, 1, 6784]
    - [66, 210.0]
  - - [1024, 6784, 1, 1, 1024, 1024, 1, 6784]
    - [64, 218.0]
  - - [1408, 6784, 1, 1, 1408, 1408, 1, 6784]
    - [63, 241.0]
  - - [1856, 6784, 1, 1, 1856, 1856, 1, 6784]
    - [66, 247.0]
  - - [2368, 6784, 1, 1, 2368, 2368, 1, 6784]
    - [61, 256.0]
  - - [2944, 6784, 1, 1, 2944, 2944, 1, 6784]
    - [61, 256.0]
  - - [3584, 6784, 1, 1, 3584, 3584, 1, 6784]
    - [66, 258.0]
  - - [4288, 6784, 1, 1, 4288, 4288, 1, 6784]
    - [61, 262.0]
  - - [5056, 6784, 1, 1, 5056, 5056, 1, 6784]
    - [61, 266.0]
  - - [5888, 6784, 1, 1, 5888, 5888, 1, 6784]
    - [66, 263.0]
  - - [6784, 6784, 1, 1, 6784, 6784, 1, 6784]
    - [61, 270.0]
  - - [1, 1, 1, 256, 1, 1, 256, 1]
    - [64, 0.00906515554122075]
  - - [1, 1, 1, 1280, 1, 1, 1280, 1]
    - [84, 0.04]
  - - [1, 1, 1, 3328, 1, 1, 3328, 1]
    - [91, 0.07]
  - - [1, 64, 1, 1, 1, 1, 1, 64]
    - [62, 0.01]
  - - [1, 128, 1, 1, 1, 1, 1, 128]
    - [61, 0.02]
  - - [1, 256, 1, 1, 1, 1, 1, 256]
    - [64, 0.08]
  - - [1, 448, 1, 1, 1, 1, 1, 448]
    - [79, 0.13]
  - - [1, 704, 1, 1, 1, 1, 1, 704]
    - [80, 0.16]
  - - [1, 1024, 1, 1, 1, 1, 1, 1024]
    - [62, 0.21]
  - - [1, 1408, 1, 1, 1, 1, 1, 1408]
    - [62, 0.26]
  - - [1, 1856, 1, 1, 1, 1, 1, 1856]
    - [64, 0.35]
  - - [1, 2368, 1, 1, 1, 1, 1, 2368]
    - [64, 0.44]
  - - [1, 2944, 1, 1, 1, 1, 1, 2944]
    - [62, 1.0]
  - - [1, 3584, 1, 1, 1, 1, 1, 3584]
    - [62, 1.0]
  - - [1, 4288, 1, 1, 1, 1, 1, 4288]
    - [61, 1.0]
  - - [1, 5056, 1, 1, 1, 1, 1, 5056]
    - [60, 1.0]
  - - [1, 5888, 1, 1, 1, 1, 1, 5888]
    - [62, 2.0]
  - - [1, 6784, 1, 1, 1, 1, 1, 6784]
    - [62, 2.0]
  - - [64, 1, 1, 1, 64, 64, 1, 1]
    - [61, 0.01]
  - - [128, 1, 1, 1, 128, 128, 1, 1]
    - [62, 0.03]
  - - [256, 1, 1, 1, 256, 256, 1, 1]
    - [67, 0.09]
  - - [448, 1, 1, 1, 448, 448, 1, 1]
    - [67, 0.15]
  - - [704, 1, 1, 1, 704, 704, 1, 1]
    - [65, 0.17]
  - - [1024, 1, 1, 1, 1024, 1024, 1, 1]
    - [62, 0.22]
  - - [1408, 1, 1, 1, 1408, 1408, 1, 1]
    - [62, 0.3]
  - - [1856, 1, 1, 1, 1856, 1856, 1, 1]
    - [75, 0.4]
  - - [2368, 1, 1, 1, 2368, 2368, 1, 1]
    - [67, 1.0]
  - - [2944, 1, 1, 1, 2944, 2944, 1, 1]
    - [62, 1.0]
  - - [3584, 1, 1, 1, 3584, 3584, 1, 1]
    - [61, 1.0]
  - - [4288, 1, 1, 1, 4288, 4288, 1, 1]
    - [60, 1.0]
  - - [5056, 1, 1, 1, 5056, 5056, 1, 1]
    - [62, 2.0]
  - - [5888, 1, 1, 1, 5888, 5888, 1, 1]
    - [61, 2.0]
  - - [6784, 1, 1, 1, 6784, 6784, 1, 1]
    - [60, 2.0]
- null
