library/src/blas3/Tensile/Logic/aldebaran/vega20_Cijk_Ailk_Bljk_HB_GB.yaml
- {MinimumRequiredVersion: 4.26.0}
- vega20
- gfx906
- [Device 66a0, Device 66a1, Device 66a7, Device 66af, Vega 20]
    SolutionIndex: 0
    SolutionNameMin: Cijk_Ailk_Bljk_HB_GB_MT32x32x8_SN_GRVW4_LRVW4_TT4_4_VW4_WG8_8_1_WGM1
    SolutionIndex: 1
    SolutionNameMin: Cijk_Ailk_Bljk_HB_GB_MT64x64x8_SN_GRVW4_LRVW4_TT4_4_VW4_WG16_16_1_WGM1
    SolutionIndex: 2
    SolutionNameMin: Cijk_Ailk_Bljk_HB_GB_MT32x32x16_SN_GRVW4_LRVW4_TT4_4_VW4_WG8_8_1_WGM1
    SolutionIndex: 3
    SolutionNameMin: Cijk_Ailk_Bljk_HB_GB_MT64x64x16_SN_GRVW4_LRVW4_TT4_4_VW4_WG16_16_1_WGM1
    SolutionIndex: 4
    SolutionNameMin: Cijk_Ailk_Bljk_HB_GB_MT128x64x16_SN_GRVW4_LRVW4_TT8_4_VW4_WG16_16_1_WGM1
    SolutionIndex: 5
    SolutionNameMin: Cijk_Ailk_Bljk_HB_GB_MT64x64x32_SN_GRVW4_LRVW4_TT4_4_VW4_WG16_16_1_WGM1
    SolutionIndex: 6
    SolutionNameMin: Cijk_Ailk_Bljk_HB_GB_MT128x64x8_SN_GRVW2_LRVW2_TT8_4_VW2_WG16_16_1_WGM1
    SolutionIndex: 7
    SolutionNameMin: Cijk_Ailk_Bljk_HB_GB_MT32x32x8_SN_GRVW4_LRVW4_TT4_4_VW4_WG8_8_1_WGM8
    SolutionIndex: 8
    SolutionNameMin: Cijk_Ailk_Bljk_HB_GB_MT32x32x16_SN_GRVW4_LRVW4_TT4_4_VW4_WG8_8_1_WGM8
    SolutionIndex: 9
    SolutionNameMin: Cijk_Ailk_Bljk_HB_GB_MT64x64x16_SN_GRVW4_LRVW4_TT4_4_VW4_WG16_16_1_WGM8
    SolutionIndex: 10
    SolutionNameMin: Cijk_Ailk_Bljk_HB_GB_MT128x64x16_SN_GRVW4_LRVW4_TT8_4_VW4_WG16_16_1_WGM8
    SolutionIndex: 11
    SolutionNameMin: Cijk_Ailk_Bljk_HB_GB_MT32x32x32_SN_GRVW4_LRVW4_TT4_4_VW4_WG8_8_1_WGM8
    SolutionIndex: 12
    SolutionNameMin: Cijk_Ailk_Bljk_HB_GB_MT32x32x8_SN_GRVW2_LRVW2_TT4_4_VW2_WG8_8_1_WGM8
    SolutionIndex: 13
    SolutionNameMin: Cijk_Ailk_Bljk_HB_GB_MT64x64x8_SN_GRVW2_LRVW2_TT4_4_VW2_WG16_16_1_WGM8
    SolutionIndex: 14
    SolutionNameMin: Cijk_Ailk_Bljk_HB_GB_MT128x64x8_SN_GRVW2_LRVW2_TT8_4_VW2_WG16_16_1_WGM8
- - - [32, 32, 8, 32, 32, 32, 32, 32]
    - [12, 91.0]
  - - [32, 32, 8, 64, 32, 32, 32, 64]
    - [0, 149.0]
  - - [32, 32, 8, 128, 32, 32, 32, 128]
    - [0, 207.0]
  - - [32, 32, 8, 256, 32, 32, 32, 256]
    - [8, 268.0]
  - - [32, 32, 8, 512, 32, 32, 32, 512]
    - [8, 315.0]
  - - [32, 64, 8, 32, 32, 32, 32, 32]
    - [0, 200.0]
  - - [32, 64, 8, 64, 32, 32, 32, 64]
    - [0, 306.0]
  - - [32, 64, 8, 128, 32, 32, 32, 128]
    - [8, 428.0]
  - - [32, 64, 8, 256, 32, 32, 32, 256]
    - [8, 550.0]
  - - [32, 64, 8, 512, 32, 32, 32, 512]
    - [8, 640.0]
  - - [32, 128, 8, 32, 32, 32, 32, 32]
    - [0, 408.0]
  - - [32, 128, 8, 64, 32, 32, 32, 64]
    - [0, 630.0]
  - - [32, 128, 8, 128, 32, 32, 32, 128]
    - [8, 872.0]
  - - [32, 128, 8, 256, 32, 32, 32, 256]
    - [8, 1117.0]
  - - [32, 128, 8, 512, 32, 32, 32, 512]
    - [8, 1290.0]
  - - [32, 256, 8, 32, 32, 32, 32, 32]
    - [0, 817.0]
  - - [32, 256, 8, 64, 32, 32, 32, 64]
    - [0, 1237.0]
  - - [32, 256, 8, 128, 32, 32, 32, 128]
    - [8, 1751.0]
  - - [32, 256, 8, 256, 32, 32, 32, 256]
    - [2, 2198.0]
  - - [32, 256, 8, 512, 32, 32, 32, 512]
    - [8, 2513.0]
  - - [32, 512, 8, 32, 32, 32, 32, 32]
    - [7, 1570.0]
  - - [32, 512, 8, 64, 32, 32, 32, 64]
    - [7, 2372.0]
  - - [32, 512, 8, 128, 32, 32, 32, 128]
    - [8, 3404.0]
  - - [32, 512, 8, 256, 32, 32, 32, 256]
    - [8, 4207.0]
  - - [32, 512, 8, 512, 32, 32, 32, 512]
    - [11, 4758.0]
  - - [64, 32, 8, 32, 64, 64, 64, 32]
    - [0, 201.0]
  - - [64, 32, 8, 64, 64, 64, 64, 64]
    - [0, 308.0]
  - - [64, 32, 8, 128, 64, 64, 64, 128]
    - [0, 428.0]
  - - [64, 32, 8, 256, 64, 64, 64, 256]
    - [8, 550.0]
  - - [64, 32, 8, 512, 64, 64, 64, 512]
    - [8, 642.0]
  - - [64, 64, 8, 32, 64, 64, 64, 32]
    - [0, 412.0]
  - - [64, 64, 8, 64, 64, 64, 64, 64]
    - [0, 633.0]
  - - [64, 64, 8, 128, 64, 64, 64, 128]
    - [8, 883.0]
  - - [64, 64, 8, 256, 64, 64, 64, 256]
    - [8, 1119.0]
  - - [64, 64, 8, 512, 64, 64, 64, 512]
    - [8, 1292.0]
  - - [64, 128, 8, 32, 64, 64, 64, 32]
    - [0, 824.0]
  - - [64, 128, 8, 64, 64, 64, 64, 64]
    - [0, 1248.0]
  - - [64, 128, 8, 128, 64, 64, 64, 128]
    - [8, 1762.0]
  - - [64, 128, 8, 256, 64, 64, 64, 256]
    - [8, 2238.0]
  - - [64, 128, 8, 512, 64, 64, 64, 512]
    - [8, 2583.0]
  - - [64, 256, 8, 32, 64, 64, 64, 32]
    - [7, 1603.0]
  - - [64, 256, 8, 64, 64, 64, 64, 64]
    - [7, 2456.0]
  - - [64, 256, 8, 128, 64, 64, 64, 128]
    - [2, 3438.0]
  - - [64, 256, 8, 256, 64, 64, 64, 256]
    - [8, 4374.0]
  - - [64, 256, 8, 512, 64, 64, 64, 512]
    - [8, 4981.0]
  - - [64, 512, 8, 32, 64, 64, 64, 32]
    - [1, 3013.0]
  - - [64, 512, 8, 64, 64, 64, 64, 64]
    - [1, 4650.0]
  - - [64, 512, 8, 128, 64, 64, 64, 128]
    - [3, 6453.0]
  - - [64, 512, 8, 256, 64, 64, 64, 256]
    - [2, 8027.0]
  - - [64, 512, 8, 512, 64, 64, 64, 512]
    - [5, 8573.0]
  - - [128, 32, 8, 32, 128, 128, 128, 32]
    - [0, 408.0]
  - - [128, 32, 8, 64, 128, 128, 128, 64]
    - [7, 633.0]
  - - [128, 32, 8, 128, 128, 128, 128, 128]
    - [2, 880.0]
  - - [128, 32, 8, 256, 128, 128, 128, 256]
    - [8, 1123.0]
  - - [128, 32, 8, 512, 128, 128, 128, 512]
    - [8, 1298.0]
  - - [128, 64, 8, 32, 128, 128, 128, 32]
    - [0, 827.0]
  - - [128, 64, 8, 64, 128, 128, 128, 64]
    - [7, 1257.0]
  - - [128, 64, 8, 128, 128, 128, 128, 128]
    - [2, 1765.0]
  - - [128, 64, 8, 256, 128, 128, 128, 256]
    - [8, 2236.0]
  - - [128, 64, 8, 512, 128, 128, 128, 512]
    - [8, 2587.0]
  - - [128, 128, 8, 32, 128, 128, 128, 32]
    - [1, 1613.0]
  - - [128, 128, 8, 64, 128, 128, 128, 64]
    - [0, 2422.0]
  - - [128, 128, 8, 128, 128, 128, 128, 128]
    - [8, 3410.0]
  - - [128, 128, 8, 256, 128, 128, 128, 256]
    - [8, 4369.0]
  - - [128, 128, 8, 512, 128, 128, 128, 512]
    - [8, 5050.0]
  - - [128, 256, 8, 32, 128, 128, 128, 32]
    - [0, 3022.0]
  - - [128, 256, 8, 64, 128, 128, 128, 64]
    - [1, 4640.0]
  - - [128, 256, 8, 128, 128, 128, 128, 128]
    - [3, 6473.0]
  - - [128, 256, 8, 256, 128, 128, 128, 256]
    - [8, 8216.0]
  - - [128, 256, 8, 512, 128, 128, 128, 512]
    - [2, 9347.0]
  - - [128, 512, 8, 32, 128, 128, 128, 32]
    - [1, 5419.0]
  - - [128, 512, 8, 64, 128, 128, 128, 64]
    - [1, 8208.0]
  - - [128, 512, 8, 128, 128, 128, 128, 128]
    - [3, 10994.0]
  - - [128, 512, 8, 256, 128, 128, 128, 256]
    - [3, 13422.0]
  - - [128, 512, 8, 512, 128, 128, 128, 512]
    - [9, 14110.0]
  - - [256, 32, 8, 32, 256, 256, 256, 32]
    - [2, 819.0]
  - - [256, 32, 8, 64, 256, 256, 256, 64]
    - [0, 1266.0]
  - - [256, 32, 8, 128, 256, 256, 256, 128]
    - [2, 1756.0]
  - - [256, 32, 8, 256, 256, 256, 256, 256]
    - [8, 2250.0]
  - - [256, 32, 8, 512, 256, 256, 256, 512]
    - [8, 2576.0]
  - - [256, 64, 8, 32, 256, 256, 256, 32]
    - [1, 1598.0]
  - - [256, 64, 8, 64, 256, 256, 256, 64]
    - [0, 2433.0]
  - - [256, 64, 8, 128, 256, 256, 256, 128]
    - [2, 3410.0]
  - - [256, 64, 8, 256, 256, 256, 256, 256]
    - [8, 4346.0]
  - - [256, 64, 8, 512, 256, 256, 256, 512]
    - [8, 5005.0]
  - - [256, 128, 8, 32, 256, 256, 256, 32]
    - [0, 2987.0]
  - - [256, 128, 8, 64, 256, 256, 256, 64]
    - [7, 4629.0]
  - - [256, 128, 8, 128, 256, 256, 256, 128]
    - [0, 6483.0]
  - - [256, 128, 8, 256, 256, 256, 256, 256]
    - [8, 8200.0]
  - - [256, 128, 8, 512, 256, 256, 256, 512]
    - [8, 9388.0]
  - - [256, 256, 8, 32, 256, 256, 256, 32]
    - [1, 5377.0]
  - - [256, 256, 8, 64, 256, 256, 256, 64]
    - [1, 8240.0]
  - - [256, 256, 8, 128, 256, 256, 256, 128]
    - [3, 11052.0]
  - - [256, 256, 8, 256, 256, 256, 256, 256]
    - [3, 13508.0]
  - - [256, 256, 8, 512, 256, 256, 256, 512]
    - [3, 15273.0]
  - - [256, 512, 8, 32, 256, 256, 256, 32]
    - [1, 8372.0]
  - - [256, 512, 8, 64, 256, 256, 256, 64]
    - [3, 11700.0]
  - - [256, 512, 8, 128, 256, 256, 256, 128]
    - [3, 14513.0]
  - - [256, 512, 8, 256, 256, 256, 256, 256]
    - [4, 16628.0]
  - - [256, 512, 8, 512, 256, 256, 256, 512]
    - [10, 18301.0]
  - - [512, 32, 8, 32, 512, 512, 512, 32]
    - [0, 1584.0]
  - - [512, 32, 8, 64, 512, 512, 512, 64]
    - [0, 2399.0]
  - - [512, 32, 8, 128, 512, 512, 512, 128]
    - [8, 3383.0]
  - - [512, 32, 8, 256, 512, 512, 512, 256]
    - [8, 4258.0]
  - - [512, 32, 8, 512, 512, 512, 512, 512]
    - [8, 4987.0]
  - - [512, 64, 8, 32, 512, 512, 512, 32]
    - [7, 2865.0]
  - - [512, 64, 8, 64, 512, 512, 512, 64]
    - [7, 4569.0]
  - - [512, 64, 8, 128, 512, 512, 512, 128]
    - [8, 6355.0]
  - - [512, 64, 8, 256, 512, 512, 512, 256]
    - [8, 8097.0]
  - - [512, 64, 8, 512, 512, 512, 512, 512]
    - [2, 9316.0]
  - - [512, 128, 8, 32, 512, 512, 512, 32]
    - [7, 5153.0]
  - - [512, 128, 8, 64, 512, 512, 512, 64]
    - [1, 7825.0]
  - - [512, 128, 8, 128, 512, 512, 512, 128]
    - [3, 10796.0]
  - - [512, 128, 8, 256, 512, 512, 512, 256]
    - [3, 13221.0]
  - - [512, 128, 8, 512, 512, 512, 512, 512]
    - [3, 15169.0]
  - - [512, 256, 8, 32, 512, 512, 512, 32]
    - [13, 7944.0]
  - - [512, 256, 8, 64, 512, 512, 512, 64]
    - [9, 11429.0]
  - - [512, 256, 8, 128, 512, 512, 512, 128]
    - [9, 14194.0]
  - - [512, 256, 8, 256, 512, 512, 512, 256]
    - [4, 16694.0]
  - - [512, 256, 8, 512, 512, 512, 512, 512]
    - [4, 18549.0]
  - - [512, 512, 8, 32, 512, 512, 512, 32]
    - [14, 11155.0]
  - - [512, 512, 8, 64, 512, 512, 512, 64]
    - [6, 15336.0]
  - - [512, 512, 8, 128, 512, 512, 512, 128]
    - [4, 18947.0]
  - - [512, 512, 8, 256, 512, 512, 512, 256]
    - [4, 21565.0]
  - - [512, 512, 8, 512, 512, 512, 512, 512]
    - [4, 23169.0]
- null
