library/src/blas3/Tensile/Logic/aldebaran/vega10_Cijk_Alik_Bljk_SB_GB.yaml
- {MinimumRequiredVersion: 4.26.0}
- vega10
- gfx900
- [Device 6863, Device 6862, Device 687f, Device 6860, Device 6861, 'Vega 10 XTX [Radeon
    SolutionIndex: 0
    SolutionNameMin: Cijk_Alik_Bljk_SB_GB_MT32x32x8_SN_AMAS3_GRVW4_LRVW4_TT4_4_VW4_WG8_8_1_WGM1
    SolutionIndex: 1
    SolutionNameMin: Cijk_Alik_Bljk_SB_GB_MT64x64x8_SN_AMAS3_GRVW4_LRVW4_TT4_4_VW4_WG16_16_1_WGM1
    SolutionIndex: 2
    SolutionNameMin: Cijk_Alik_Bljk_SB_GB_MT128x64x8_SN_AMAS3_GRVW4_LRVW4_TT8_4_VW4_WG16_16_1_WGM1
    SolutionIndex: 3
    SolutionNameMin: Cijk_Alik_Bljk_SB_GB_MT64x128x8_SN_AMAS3_GRVW4_LRVW4_TT4_8_VW4_WG16_16_1_WGM1
    SolutionIndex: 4
    SolutionNameMin: Cijk_Alik_Bljk_SB_GB_MT128x128x8_SN_AMAS3_GRVW4_LRVW4_TT8_8_VW4_WG16_16_1_WGM1
    SolutionIndex: 5
    SolutionNameMin: Cijk_Alik_Bljk_SB_GB_MT32x32x16_SN_AMAS3_GRVW4_LRVW4_TT4_4_VW4_WG8_8_1_WGM1
    SolutionIndex: 6
    SolutionNameMin: Cijk_Alik_Bljk_SB_GB_MT64x32x16_SN_AMAS3_GRVW4_LRVW4_TT8_4_VW4_WG8_8_1_WGM1
    SolutionIndex: 7
    SolutionNameMin: Cijk_Alik_Bljk_SB_GB_MT64x64x16_SN_AMAS3_GRVW4_LRVW4_TT4_4_VW4_WG16_16_1_WGM1
    SolutionIndex: 8
    SolutionNameMin: Cijk_Alik_Bljk_SB_GB_MT128x64x16_SN_AMAS3_GRVW4_LRVW4_TT8_4_VW4_WG16_16_1_WGM1
    SolutionIndex: 9
    SolutionNameMin: Cijk_Alik_Bljk_SB_GB_MT64x128x16_SN_AMAS3_GRVW4_LRVW4_TT4_8_VW4_WG16_16_1_WGM1
    SolutionIndex: 10
    SolutionNameMin: Cijk_Alik_Bljk_SB_GB_MT32x32x32_SN_AMAS3_GRVW4_LRVW4_TT4_4_VW4_WG8_8_1_WGM1
    SolutionIndex: 11
    SolutionNameMin: Cijk_Alik_Bljk_SB_GB_MT64x64x32_SN_AMAS3_GRVW4_LRVW4_TT4_4_VW4_WG16_16_1_WGM1
    SolutionIndex: 12
    SolutionNameMin: Cijk_Alik_Bljk_SB_GB_MT64x128x32_SN_AMAS3_GRVW4_LRVW4_TT4_8_VW4_WG16_16_1_WGM1
    SolutionIndex: 13
    SolutionNameMin: Cijk_Alik_Bljk_SB_GB_MT32x32x8_SN_AMAS3_GRVW4_LRVW4_TT4_4_VW4_WG8_8_1_WGM8
    SolutionIndex: 14
    SolutionNameMin: Cijk_Alik_Bljk_SB_GB_MT32x64x8_SN_AMAS3_GRVW4_LRVW4_TT4_8_VW4_WG8_8_1_WGM8
    SolutionIndex: 15
    SolutionNameMin: Cijk_Alik_Bljk_SB_GB_MT64x64x8_SN_AMAS3_GRVW4_LRVW4_TT4_4_VW4_WG16_16_1_WGM8
    SolutionIndex: 16
    SolutionNameMin: Cijk_Alik_Bljk_SB_GB_MT128x64x8_SN_AMAS3_GRVW4_LRVW4_TT8_4_VW4_WG16_16_1_WGM8
    SolutionIndex: 17
    SolutionNameMin: Cijk_Alik_Bljk_SB_GB_MT64x128x8_SN_AMAS3_GRVW4_LRVW4_TT4_8_VW4_WG16_16_1_WGM8
    SolutionIndex: 18
    SolutionNameMin: Cijk_Alik_Bljk_SB_GB_MT32x32x16_SN_AMAS3_GRVW4_LRVW4_TT4_4_VW4_WG8_8_1_WGM8
    SolutionIndex: 19
    SolutionNameMin: Cijk_Alik_Bljk_SB_GB_MT64x64x16_SN_AMAS3_GRVW4_LRVW4_TT4_4_VW4_WG16_16_1_WGM8
    SolutionIndex: 20
    SolutionNameMin: Cijk_Alik_Bljk_SB_GB_MT128x128x16_SN_AMAS3_GRVW4_LRVW4_TT8_8_VW4_WG16_16_1_WGM8
    SolutionIndex: 21
    SolutionNameMin: Cijk_Alik_Bljk_SB_GB_MT32x32x32_SN_AMAS3_GRVW4_LRVW4_TT4_4_VW4_WG8_8_1_WGM8
    SolutionIndex: 22
    SolutionNameMin: Cijk_Alik_Bljk_SB_GB_MT64x64x32_SN_AMAS3_GRVW4_LRVW4_TT4_4_VW4_WG16_16_1_WGM8
    SolutionIndex: 23
    SolutionNameMin: Cijk_Alik_Bljk_SB_GB_MT64x128x32_SN_AMAS3_GRVW4_LRVW4_TT4_8_VW4_WG16_16_1_WGM8
- - - [32, 32, 8, 32, 32, 32, 32, 32]
    - [13, 74.0]
  - - [32, 32, 8, 64, 32, 32, 64, 64]
    - [0, 110.0]
  - - [32, 32, 8, 128, 32, 32, 128, 128]
    - [0, 148.0]
  - - [32, 32, 8, 256, 32, 32, 256, 256]
    - [18, 180.0]
  - - [32, 32, 8, 512, 32, 32, 512, 512]
    - [5, 201.0]
  - - [32, 64, 8, 32, 32, 32, 32, 32]
    - [0, 151.0]
  - - [32, 64, 8, 64, 32, 32, 64, 64]
    - [13, 225.0]
  - - [32, 64, 8, 128, 32, 32, 128, 128]
    - [18, 300.0]
  - - [32, 64, 8, 256, 32, 32, 256, 256]
    - [5, 364.0]
  - - [32, 64, 8, 512, 32, 32, 512, 512]
    - [18, 406.0]
  - - [32, 128, 8, 32, 32, 32, 32, 32]
    - [0, 302.0]
  - - [32, 128, 8, 64, 32, 32, 64, 64]
    - [0, 454.0]
  - - [32, 128, 8, 128, 32, 32, 128, 128]
    - [5, 599.0]
  - - [32, 128, 8, 256, 32, 32, 256, 256]
    - [18, 725.0]
  - - [32, 128, 8, 512, 32, 32, 512, 512]
    - [18, 786.0]
  - - [32, 256, 8, 32, 32, 32, 32, 32]
    - [0, 599.0]
  - - [32, 256, 8, 64, 32, 32, 64, 64]
    - [0, 893.0]
  - - [32, 256, 8, 128, 32, 32, 128, 128]
    - [18, 1142.0]
  - - [32, 256, 8, 256, 32, 32, 256, 256]
    - [18, 1173.0]
  - - [32, 256, 8, 512, 32, 32, 512, 512]
    - [21, 1095.0]
  - - [32, 512, 8, 32, 32, 32, 32, 32]
    - [13, 1135.0]
  - - [32, 512, 8, 64, 32, 32, 64, 64]
    - [18, 1632.0]
  - - [32, 512, 8, 128, 32, 32, 128, 128]
    - [18, 1895.0]
  - - [32, 512, 8, 256, 32, 32, 256, 256]
    - [18, 1428.0]
  - - [32, 512, 8, 512, 32, 32, 512, 512]
    - [10, 1129.0]
  - - [64, 32, 8, 32, 64, 64, 32, 32]
    - [10, 150.0]
  - - [64, 32, 8, 64, 64, 64, 64, 64]
    - [0, 224.0]
  - - [64, 32, 8, 128, 64, 64, 128, 128]
    - [5, 302.0]
  - - [64, 32, 8, 256, 64, 64, 256, 256]
    - [5, 365.0]
  - - [64, 32, 8, 512, 64, 64, 512, 512]
    - [5, 404.0]
  - - [64, 64, 8, 32, 64, 64, 32, 32]
    - [5, 307.0]
  - - [64, 64, 8, 64, 64, 64, 64, 64]
    - [5, 448.0]
  - - [64, 64, 8, 128, 64, 64, 128, 128]
    - [18, 602.0]
  - - [64, 64, 8, 256, 64, 64, 256, 256]
    - [18, 730.0]
  - - [64, 64, 8, 512, 64, 64, 512, 512]
    - [18, 808.0]
  - - [64, 128, 8, 32, 64, 64, 32, 32]
    - [5, 597.0]
  - - [64, 128, 8, 64, 64, 64, 64, 64]
    - [0, 894.0]
  - - [64, 128, 8, 128, 64, 64, 128, 128]
    - [5, 1166.0]
  - - [64, 128, 8, 256, 64, 64, 256, 256]
    - [19, 1351.0]
  - - [64, 128, 8, 512, 64, 64, 512, 512]
    - [19, 1391.0]
  - - [64, 256, 8, 32, 64, 64, 32, 32]
    - [0, 1137.0]
  - - [64, 256, 8, 64, 64, 64, 64, 64]
    - [5, 1618.0]
  - - [64, 256, 8, 128, 64, 64, 128, 128]
    - [13, 1999.0]
  - - [64, 256, 8, 256, 64, 64, 256, 256]
    - [19, 2004.0]
  - - [64, 256, 8, 512, 64, 64, 512, 512]
    - [11, 1712.0]
  - - [64, 512, 8, 32, 64, 64, 32, 32]
    - [13, 1800.0]
  - - [64, 512, 8, 64, 64, 64, 64, 64]
    - [13, 2459.0]
  - - [64, 512, 8, 128, 64, 64, 128, 128]
    - [18, 2730.0]
  - - [64, 512, 8, 256, 64, 64, 256, 256]
    - [23, 1991.0]
  - - [64, 512, 8, 512, 64, 64, 512, 512]
    - [22, 1885.0]
  - - [128, 32, 8, 32, 128, 128, 32, 32]
    - [5, 299.0]
  - - [128, 32, 8, 64, 128, 128, 64, 64]
    - [0, 452.0]
  - - [128, 32, 8, 128, 128, 128, 128, 128]
    - [5, 602.0]
  - - [128, 32, 8, 256, 128, 128, 256, 256]
    - [18, 732.0]
  - - [128, 32, 8, 512, 128, 128, 512, 512]
    - [18, 816.0]
  - - [128, 64, 8, 32, 128, 128, 32, 32]
    - [5, 599.0]
  - - [128, 64, 8, 64, 128, 128, 64, 64]
    - [0, 886.0]
  - - [128, 64, 8, 128, 128, 128, 128, 128]
    - [18, 1145.0]
  - - [128, 64, 8, 256, 128, 128, 256, 256]
    - [7, 1363.0]
  - - [128, 64, 8, 512, 128, 128, 512, 512]
    - [7, 1446.0]
  - - [128, 128, 8, 32, 128, 128, 32, 32]
    - [0, 1132.0]
  - - [128, 128, 8, 64, 128, 128, 64, 64]
    - [5, 1618.0]
  - - [128, 128, 8, 128, 128, 128, 128, 128]
    - [5, 2022.0]
  - - [128, 128, 8, 256, 128, 128, 256, 256]
    - [7, 2061.0]
  - - [128, 128, 8, 512, 128, 128, 512, 512]
    - [5, 2096.0]
  - - [128, 256, 8, 32, 128, 128, 32, 32]
    - [5, 1792.0]
  - - [128, 256, 8, 64, 128, 128, 64, 64]
    - [15, 2420.0]
  - - [128, 256, 8, 128, 128, 128, 128, 128]
    - [7, 2759.0]
  - - [128, 256, 8, 256, 128, 128, 256, 256]
    - [9, 2635.0]
  - - [128, 256, 8, 512, 128, 128, 512, 512]
    - [12, 2319.0]
  - - [128, 512, 8, 32, 128, 128, 32, 32]
    - [7, 2824.0]
  - - [128, 512, 8, 64, 128, 128, 64, 64]
    - [7, 3254.0]
  - - [128, 512, 8, 128, 128, 128, 128, 128]
    - [7, 3342.0]
  - - [128, 512, 8, 256, 128, 128, 256, 256]
    - [14, 2690.0]
  - - [128, 512, 8, 512, 128, 128, 512, 512]
    - [19, 2663.0]
  - - [256, 32, 8, 32, 256, 256, 32, 32]
    - [5, 574.0]
  - - [256, 32, 8, 64, 256, 256, 64, 64]
    - [13, 855.0]
  - - [256, 32, 8, 128, 256, 256, 128, 128]
    - [5, 1120.0]
  - - [256, 32, 8, 256, 256, 256, 256, 256]
    - [5, 1184.0]
  - - [256, 32, 8, 512, 256, 256, 512, 512]
    - [5, 1345.0]
  - - [256, 64, 8, 32, 256, 256, 32, 32]
    - [5, 1072.0]
  - - [256, 64, 8, 64, 256, 256, 64, 64]
    - [5, 1566.0]
  - - [256, 64, 8, 128, 256, 256, 128, 128]
    - [7, 1990.0]
  - - [256, 64, 8, 256, 256, 256, 256, 256]
    - [19, 2033.0]
  - - [256, 64, 8, 512, 256, 256, 512, 512]
    - [19, 2205.0]
  - - [256, 128, 8, 32, 256, 256, 32, 32]
    - [7, 1761.0]
  - - [256, 128, 8, 64, 256, 256, 64, 64]
    - [1, 2281.0]
  - - [256, 128, 8, 128, 256, 256, 128, 128]
    - [7, 2803.0]
  - - [256, 128, 8, 256, 256, 256, 256, 256]
    - [19, 2752.0]
  - - [256, 128, 8, 512, 256, 256, 512, 512]
    - [12, 2679.0]
  - - [256, 256, 8, 32, 256, 256, 32, 32]
    - [7, 2696.0]
  - - [256, 256, 8, 64, 256, 256, 64, 64]
    - [7, 3252.0]
  - - [256, 256, 8, 128, 256, 256, 128, 128]
    - [7, 3309.0]
  - - [256, 256, 8, 256, 256, 256, 256, 256]
    - [20, 3012.0]
  - - [256, 256, 8, 512, 256, 256, 512, 512]
    - [7, 3196.0]
  - - [256, 512, 8, 32, 256, 256, 32, 32]
    - [7, 3240.0]
  - - [256, 512, 8, 64, 256, 256, 64, 64]
    - [3, 3589.0]
  - - [256, 512, 8, 128, 256, 256, 128, 128]
    - [2, 3759.0]
  - - [256, 512, 8, 256, 256, 256, 256, 256]
    - [19, 3974.0]
  - - [256, 512, 8, 512, 256, 256, 512, 512]
    - [22, 3717.0]
  - - [512, 32, 8, 32, 512, 512, 32, 32]
    - [5, 1087.0]
  - - [512, 32, 8, 64, 512, 512, 64, 64]
    - [5, 1571.0]
  - - [512, 32, 8, 128, 512, 512, 128, 128]
    - [18, 1947.0]
  - - [512, 32, 8, 256, 512, 512, 256, 256]
    - [21, 1869.0]
  - - [512, 32, 8, 512, 512, 512, 512, 512]
    - [5, 2184.0]
  - - [512, 64, 8, 32, 512, 512, 32, 32]
    - [18, 1769.0]
  - - [512, 64, 8, 64, 512, 512, 64, 64]
    - [18, 2394.0]
  - - [512, 64, 8, 128, 512, 512, 128, 128]
    - [5, 2805.0]
  - - [512, 64, 8, 256, 512, 512, 256, 256]
    - [19, 2721.0]
  - - [512, 64, 8, 512, 512, 512, 512, 512]
    - [6, 2824.0]
  - - [512, 128, 8, 32, 512, 512, 32, 32]
    - [2, 2313.0]
  - - [512, 128, 8, 64, 512, 512, 64, 64]
    - [7, 3192.0]
  - - [512, 128, 8, 128, 512, 512, 128, 128]
    - [19, 3224.0]
  - - [512, 128, 8, 256, 512, 512, 256, 256]
    - [20, 3082.0]
  - - [512, 128, 8, 512, 512, 512, 512, 512]
    - [7, 3623.0]
  - - [512, 256, 8, 32, 512, 512, 32, 32]
    - [2, 3183.0]
  - - [512, 256, 8, 64, 512, 512, 64, 64]
    - [2, 3447.0]
  - - [512, 256, 8, 128, 512, 512, 128, 128]
    - [16, 3728.0]
  - - [512, 256, 8, 256, 512, 512, 256, 256]
    - [7, 4140.0]
  - - [512, 256, 8, 512, 512, 512, 512, 512]
    - [19, 4203.0]
  - - [512, 512, 8, 32, 512, 512, 32, 32]
    - [4, 2824.0]
  - - [512, 512, 8, 64, 512, 512, 64, 64]
    - [8, 3660.0]
  - - [512, 512, 8, 128, 512, 512, 128, 128]
    - [17, 4187.0]
  - - [512, 512, 8, 256, 512, 512, 256, 256]
    - [3, 4697.0]
  - - [512, 512, 8, 512, 512, 512, 512, 512]
    - [8, 4683.0]
- null
