library/src/blas3/Tensile/Logic/aldebaran/vega20_Cijk_Alik_Bljk_HSS_BH.yaml
- {MinimumRequiredVersion: 4.24.0}
- vega20
- gfx906
- [Device 66a0, Device 66a1, Device 66a7, Device 66af, Vega 20]
    SolutionIndex: 0
    SolutionNameMin: Cijk_Alik_Bljk_HSS_BH_MT16x16x8_SE_GSU1_PGR1_PLR1_TT2_2_VAW2
    SolutionIndex: 1
    SolutionNameMin: Cijk_Alik_Bljk_HSS_BH_MT32x16x8_SE_GSU1_PGR1_PLR1_TT4_2_VAW2
    SolutionIndex: 2
    SolutionNameMin: Cijk_Alik_Bljk_HSS_BH_MT16x16x16_SE_GSU1_PGR1_PLR1_TT2_2_VAW2
    SolutionIndex: 3
    SolutionNameMin: Cijk_Alik_Bljk_HSS_BH_MT32x32x16_SE_GSU1_PGR1_PLR1_TT4_4_VAW2
    SolutionIndex: 4
    SolutionNameMin: Cijk_Alik_Bljk_HSS_BH_MT32x16x16_SE_GSU1_PGR1_PLR1_TT2_2_VAW2
    SolutionIndex: 5
    SolutionNameMin: Cijk_Alik_Bljk_HSS_BH_MT64x32x16_SE_GSU1_PGR1_PLR1_TT4_4_VAW2
    SolutionIndex: 6
    SolutionNameMin: Cijk_Alik_Bljk_HSS_BH_MT32x32x16_SE_GSU1_PGR1_PLR1_TT2_2_VAW2
    SolutionIndex: 7
    SolutionNameMin: Cijk_Alik_Bljk_HSS_BH_MT64x64x16_SE_GSU1_PGR1_PLR1_TT4_4_VAW2
    SolutionIndex: 8
    SolutionNameMin: Cijk_Alik_Bljk_HSS_BH_MT128x32x16_SE_GSU1_PGR1_PLR1_TT4_4_VAW2
    SolutionIndex: 9
    SolutionNameMin: Cijk_Alik_Bljk_HSS_BH_MT16x16x32_SE_GSU1_PGR1_PLR1_TT2_2_VAW2
    SolutionIndex: 10
    SolutionNameMin: Cijk_Alik_Bljk_HSS_BH_MT16x16x8_SE_GSU1_PGR1_PLR1_TT2_2_VAW2
    SolutionIndex: 11
    SolutionNameMin: Cijk_Alik_Bljk_HSS_BH_MT16x16x16_SE_GSU1_PGR1_PLR1_TT2_2_VAW2
    SolutionIndex: 12
    SolutionNameMin: Cijk_Alik_Bljk_HSS_BH_MT32x32x16_SE_GSU1_PGR1_PLR1_TT4_4_VAW2
    SolutionIndex: 13
    SolutionNameMin: Cijk_Alik_Bljk_HSS_BH_MT64x64x16_SE_GSU1_PGR1_PLR1_TT8_8_VAW2
    SolutionIndex: 14
    SolutionNameMin: Cijk_Alik_Bljk_HSS_BH_MT32x16x16_SE_GSU1_PGR1_PLR1_TT2_2_VAW2
    SolutionIndex: 15
    SolutionNameMin: Cijk_Alik_Bljk_HSS_BH_MT64x32x16_SE_GSU1_PGR1_PLR1_TT4_4_VAW2
    SolutionIndex: 16
    SolutionNameMin: Cijk_Alik_Bljk_HSS_BH_MT128x32x16_SE_GSU1_PGR1_PLR1_TT4_4_VAW2
    SolutionIndex: 17
    SolutionNameMin: Cijk_Alik_Bljk_HSS_BH_MT16x16x24_SE_GSU1_PGR1_PLR1_TT2_2_VAW2
    SolutionIndex: 18
    SolutionNameMin: Cijk_Alik_Bljk_HSS_BH_MT32x16x24_SE_GSU1_PGR1_PLR1_TT4_2_VAW2
    SolutionIndex: 19
    SolutionNameMin: Cijk_Alik_Bljk_HSS_BH_MT16x16x24_SE_GSU1_PGR1_PLR1_TT2_2_VAW2
    SolutionIndex: 20
    SolutionNameMin: Cijk_Alik_Bljk_HSS_BH_MT32x16x24_SE_GSU1_PGR1_PLR1_TT4_2_VAW2
    SolutionIndex: 21
    SolutionNameMin: Cijk_Alik_Bljk_HSS_BH_MT32x32x24_SE_GSU1_PGR1_PLR1_TT4_4_VAW2
    SolutionIndex: 22
    SolutionNameMin: Cijk_Alik_Bljk_HSS_BH_MT64x64x8_SE_GSU1_PGR1_PLR1_TT4_4_VAW2
    SolutionIndex: 23
    SolutionNameMin: Cijk_Alik_Bljk_HSS_BH_MT64x64x16_SE_GSU1_PGR1_PLR1_TT4_4_VAW2
    SolutionIndex: 24
    SolutionNameMin: Cijk_Alik_Bljk_HSS_BH_MT64x128x16_SE_GSU1_PGR1_PLR1_TT4_8_VAW2
    SolutionIndex: 25
    SolutionNameMin: Cijk_Alik_Bljk_HSS_BH_MT128x64x16_SE_GSU1_PGR1_PLR1_TT8_4_VAW2
    SolutionIndex: 26
    SolutionNameMin: Cijk_Alik_Bljk_HSS_BH_MT128x96x16_SE_GSU1_PGR1_PLR1_TT8_6_VAW2
    SolutionIndex: 27
    SolutionNameMin: Cijk_Alik_Bljk_HSS_BH_MT64x128x4_SE_GSU1_PGR0_PLR0_TT4_8_VAW2
    SolutionIndex: 28
    SolutionNameMin: Cijk_Alik_Bljk_HSS_BH_MT64x64x4_SE_GSU1_PGR0_PLR0_TT4_4_VAW2
    SolutionIndex: 29
    SolutionNameMin: Cijk_Alik_Bljk_HSS_BH_MT64x128x4_SE_GSU1_PGR1_PLR0_TT4_8_VAW2
    SolutionIndex: 30
    SolutionNameMin: Cijk_Alik_Bljk_HSS_BH_MT64x64x4_SE_GSU1_PGR1_PLR0_TT4_4_VAW2
    SolutionIndex: 31
    SolutionNameMin: Cijk_Alik_Bljk_HSS_BH_MT64x128x4_SE_GSU1_PGR0_PLR1_TT4_8_VAW2
    SolutionIndex: 32
    SolutionNameMin: Cijk_Alik_Bljk_HSS_BH_MT64x64x4_SE_GSU1_PGR0_PLR1_TT4_4_VAW2
    SolutionIndex: 33
    SolutionNameMin: Cijk_Alik_Bljk_HSS_BH_MT64x128x4_SE_GSU1_PGR1_PLR1_TT4_8_VAW2
    SolutionIndex: 34
    SolutionNameMin: Cijk_Alik_Bljk_HSS_BH_MT64x128x8_SE_GSU1_PGR0_PLR0_TT4_8_VAW2
    SolutionIndex: 35
    SolutionNameMin: Cijk_Alik_Bljk_HSS_BH_MT64x64x8_SE_GSU1_PGR0_PLR0_TT4_4_VAW2
    SolutionIndex: 36
    SolutionNameMin: Cijk_Alik_Bljk_HSS_BH_MT64x128x8_SE_GSU1_PGR1_PLR0_TT4_8_VAW2
    SolutionIndex: 37
    SolutionNameMin: Cijk_Alik_Bljk_HSS_BH_MT64x64x8_SE_GSU1_PGR1_PLR0_TT4_4_VAW2
    SolutionIndex: 38
    SolutionNameMin: Cijk_Alik_Bljk_HSS_BH_MT64x128x8_SE_GSU1_PGR0_PLR1_TT4_8_VAW2
    SolutionIndex: 39
    SolutionNameMin: Cijk_Alik_Bljk_HSS_BH_MT64x64x8_SE_GSU1_PGR0_PLR1_TT4_4_VAW2
    SolutionIndex: 40
    SolutionNameMin: Cijk_Alik_Bljk_HSS_BH_MT64x64x16_SE_GSU1_PGR0_PLR0_TT4_4_VAW2
    SolutionIndex: 41
    SolutionNameMin: Cijk_Alik_Bljk_HSS_BH_MT64x64x16_SE_GSU1_PGR1_PLR0_TT4_4_VAW2
    SolutionIndex: 42
    SolutionNameMin: Cijk_Alik_Bljk_HSS_BH_MT64x64x16_SE_GSU1_PGR0_PLR1_TT4_4_VAW2
    SolutionIndex: 43
    SolutionNameMin: Cijk_Alik_Bljk_HSS_BH_MT64x64x8_SE_GSU2_PGR0_PLR0_TT4_4_VAW1
    SolutionIndex: 44
    SolutionNameMin: Cijk_Alik_Bljk_HSS_BH_MT64x64x8_SE_GSU2_PGR0_PLR1_TT4_4_VAW1
    SolutionIndex: 45
    SolutionNameMin: Cijk_Alik_Bljk_HSS_BH_MT64x64x4_SE_GSU3_PGR0_PLR0_TT4_4_VAW1
    SolutionIndex: 46
    SolutionNameMin: Cijk_Alik_Bljk_HSS_BH_MT64x64x4_SE_GSU3_PGR1_PLR0_TT4_4_VAW1
    SolutionIndex: 47
    SolutionNameMin: Cijk_Alik_Bljk_HSS_BH_MT64x64x8_SE_GSU3_PGR0_PLR0_TT4_4_VAW1
    SolutionIndex: 48
    SolutionNameMin: Cijk_Alik_Bljk_HSS_BH_MT64x64x8_SE_GSU3_PGR1_PLR0_TT4_4_VAW1
    SolutionIndex: 49
    SolutionNameMin: Cijk_Alik_Bljk_HSS_BH_MT64x64x8_SE_GSU3_PGR0_PLR1_TT4_4_VAW1
    SolutionIndex: 50
    SolutionNameMin: Cijk_Alik_Bljk_HSS_BH_MT64x64x4_SE_GSU5_PGR1_PLR0_TT4_4_VAW1
    SolutionIndex: 51
    SolutionNameMin: Cijk_Alik_Bljk_HSS_BH_MT64x64x8_SE_GSU5_PGR0_PLR0_TT4_4_VAW1
    SolutionIndex: 52
    SolutionNameMin: Cijk_Alik_Bljk_HSS_BH_MT64x128x8_SE_GSU5_PGR1_PLR0_TT4_8_VAW1
    SolutionIndex: 53
    SolutionNameMin: Cijk_Alik_Bljk_HSS_BH_MT64x64x8_SE_GSU5_PGR1_PLR0_TT4_4_VAW1
    SolutionIndex: 54
    SolutionNameMin: Cijk_Alik_Bljk_HSS_BH_MT64x64x8_SE_GSU5_PGR0_PLR1_TT4_4_VAW1
    SolutionIndex: 55
    SolutionNameMin: Cijk_Alik_Bljk_HSS_BH_MT64x64x8_SE_GSU5_PGR1_PLR1_TT4_4_VAW1
    SolutionIndex: 56
    SolutionNameMin: Cijk_Alik_Bljk_HSS_BH_MT64x64x8_SE_GSU7_PGR0_PLR0_TT4_4_VAW1
    SolutionIndex: 57
    SolutionNameMin: Cijk_Alik_Bljk_HSS_BH_MT64x64x8_SE_GSU7_PGR1_PLR0_TT4_4_VAW1
    SolutionIndex: 58
    SolutionNameMin: Cijk_Alik_Bljk_HSS_BH_MT64x128x8_SE_GSU7_PGR0_PLR1_TT4_8_VAW1
    SolutionIndex: 59
    SolutionNameMin: Cijk_Alik_Bljk_HSS_BH_MT64x64x8_SE_GSU7_PGR0_PLR1_TT4_4_VAW1
    SolutionIndex: 60
    SolutionNameMin: Cijk_Alik_Bljk_HSS_BH_MT64x128x8_SE_GSU7_PGR1_PLR1_TT4_8_VAW1
    SolutionIndex: 61
    SolutionNameMin: Cijk_Alik_Bljk_HSS_BH_MT64x64x16_SE_GSU7_PGR1_PLR0_TT4_4_VAW1
    SolutionIndex: 62
    SolutionNameMin: Cijk_Alik_Bljk_HSS_BH_MT64x64x16_SE_GSU7_PGR0_PLR1_TT4_4_VAW1
    SolutionIndex: 63
    SolutionNameMin: Cijk_Alik_Bljk_HSS_BH_MT128x128x4_SE_GSU1_PGR0_PLR0_TT8_8_VAW2
    SolutionIndex: 64
    SolutionNameMin: Cijk_Alik_Bljk_HSS_BH_MT64x128x4_SE_GSU1_PGR0_PLR0_TT4_8_VAW2
    SolutionIndex: 65
    SolutionNameMin: Cijk_Alik_Bljk_HSS_BH_MT64x64x4_SE_GSU1_PGR0_PLR0_TT4_4_VAW2
    SolutionIndex: 66
    SolutionNameMin: Cijk_Alik_Bljk_HSS_BH_MT64x128x4_SE_GSU1_PGR1_PLR0_TT4_8_VAW2
    SolutionIndex: 67
    SolutionNameMin: Cijk_Alik_Bljk_HSS_BH_MT64x64x4_SE_GSU1_PGR1_PLR0_TT4_4_VAW2
    SolutionIndex: 68
    SolutionNameMin: Cijk_Alik_Bljk_HSS_BH_MT64x128x4_SE_GSU1_PGR0_PLR1_TT4_8_VAW2
    SolutionIndex: 69
    SolutionNameMin: Cijk_Alik_Bljk_HSS_BH_MT64x64x4_SE_GSU1_PGR0_PLR1_TT4_4_VAW2
    SolutionIndex: 70
    SolutionNameMin: Cijk_Alik_Bljk_HSS_BH_MT64x128x4_SE_GSU1_PGR1_PLR1_TT4_8_VAW2
    SolutionIndex: 71
    SolutionNameMin: Cijk_Alik_Bljk_HSS_BH_MT64x64x4_SE_GSU1_PGR1_PLR1_TT4_4_VAW2
    SolutionIndex: 72
    SolutionNameMin: Cijk_Alik_Bljk_HSS_BH_MT64x128x8_SE_GSU1_PGR0_PLR0_TT4_8_VAW2
    SolutionIndex: 73
    SolutionNameMin: Cijk_Alik_Bljk_HSS_BH_MT64x64x8_SE_GSU1_PGR0_PLR0_TT4_4_VAW2
    SolutionIndex: 74
    SolutionNameMin: Cijk_Alik_Bljk_HSS_BH_MT64x64x8_SE_GSU1_PGR1_PLR0_TT4_4_VAW2
    SolutionIndex: 75
    SolutionNameMin: Cijk_Alik_Bljk_HSS_BH_MT64x64x8_SE_GSU1_PGR0_PLR1_TT4_4_VAW2
    SolutionIndex: 76
    SolutionNameMin: Cijk_Alik_Bljk_HSS_BH_MT64x64x8_SE_GSU1_PGR1_PLR1_TT4_4_VAW2
    SolutionIndex: 77
    SolutionNameMin: Cijk_Alik_Bljk_HSS_BH_MT64x64x8_SE_GSU3_PGR1_PLR0_TT4_4_VAW1
    SolutionIndex: 78
    SolutionNameMin: Cijk_Alik_Bljk_HSS_BH_MT64x64x4_SE_GSU5_PGR1_PLR0_TT4_4_VAW1
    SolutionIndex: 79
    SolutionNameMin: Cijk_Alik_Bljk_HSS_BH_MT64x128x8_SE_GSU5_PGR1_PLR0_TT4_8_VAW1
    SolutionIndex: 80
    SolutionNameMin: Cijk_Alik_Bljk_HSS_BH_MT64x64x8_SE_GSU5_PGR1_PLR0_TT4_4_VAW1
    SolutionIndex: 81
    SolutionNameMin: Cijk_Alik_Bljk_HSS_BH_MT64x64x8_SE_GSU5_PGR1_PLR1_TT4_4_VAW1
    SolutionIndex: 82
    SolutionNameMin: Cijk_Alik_Bljk_HSS_BH_MT64x64x4_SE_GSU7_PGR1_PLR0_TT4_4_VAW1
    SolutionIndex: 83
    SolutionNameMin: Cijk_Alik_Bljk_HSS_BH_MT64x128x8_SE_GSU7_PGR1_PLR0_TT4_8_VAW1
    SolutionIndex: 84
    SolutionNameMin: Cijk_Alik_Bljk_HSS_BH_MT64x64x8_SE_GSU7_PGR1_PLR0_TT4_4_VAW1
- - - [512, 8, 1, 500000, 512, 512, 500000, 500000]
    - [9, 169.0]
  - - [512, 16, 1, 500000, 512, 512, 500000, 500000]
    - [9, 338.0]
  - - [1024, 8, 1, 500000, 1024, 1024, 500000, 500000]
    - [9, 338.0]
  - - [1024, 16, 1, 500000, 1024, 1024, 500000, 500000]
    - [9, 676.0]
  - - [1760, 16, 1, 1760, 1760, 1760, 1760, 1760]
    - [17, 1098.0]
  - - [3072, 16, 1, 1024, 3072, 3072, 1024, 1024]
    - [11, 1762.0]
  - - [2048, 16, 1, 2048, 2048, 2048, 2048, 2048]
    - [17, 1258.0]
  - - [2560, 16, 1, 2560, 2560, 2560, 2560, 2560]
    - [17, 1568.0]
  - - [4608, 16, 1, 1536, 4608, 4608, 1536, 1536]
    - [17, 2519.0]
  - - [6144, 16, 1, 2560, 6144, 6144, 2560, 2560]
    - [4, 2831.0]
  - - [4096, 16, 1, 4096, 4096, 4096, 4096, 4096]
    - [19, 2284.0]
  - - [7680, 16, 1, 2560, 7680, 7680, 2560, 2560]
    - [20, 3341.0]
  - - [8448, 16, 1, 2816, 8448, 8448, 2816, 2816]
    - [18, 3195.0]
  - - [64, 64, 1, 256, 64, 64, 256, 256]
    - [6, 110.0]
  - - [128, 64, 1, 256, 128, 128, 256, 256]
    - [2, 202.0]
  - - [64, 128, 1, 256, 64, 64, 256, 256]
    - [2, 203.0]
  - - [128, 128, 1, 256, 128, 128, 256, 256]
    - [9, 514.0]
  - - [64, 256, 1, 256, 64, 64, 256, 256]
    - [9, 514.0]
  - - [128, 256, 1, 256, 128, 128, 256, 256]
    - [2, 999.0]
  - - [64, 448, 1, 256, 64, 64, 256, 256]
    - [2, 874.0]
  - - [128, 448, 1, 256, 128, 128, 256, 256]
    - [2, 1668.0]
  - - [64, 704, 1, 256, 64, 64, 256, 256]
    - [2, 1323.0]
  - - [128, 704, 1, 256, 128, 128, 256, 256]
    - [2, 2271.0]
  - - [64, 1024, 1, 256, 64, 64, 256, 256]
    - [2, 1872.0]
  - - [128, 1024, 1, 256, 128, 128, 256, 256]
    - [2, 2996.0]
  - - [64, 1408, 1, 256, 64, 64, 256, 256]
    - [2, 2289.0]
  - - [128, 1408, 1, 256, 128, 128, 256, 256]
    - [0, 3277.0]
  - - [64, 1856, 1, 256, 64, 64, 256, 256]
    - [11, 2754.0]
  - - [128, 1856, 1, 256, 128, 128, 256, 256]
    - [1, 4001.0]
  - - [64, 2368, 1, 256, 64, 64, 256, 256]
    - [0, 3012.0]
  - - [128, 2368, 1, 256, 128, 128, 256, 256]
    - [1, 3959.0]
  - - [64, 2944, 1, 256, 64, 64, 256, 256]
    - [18, 3387.0]
  - - [128, 2944, 1, 256, 128, 128, 256, 256]
    - [1, 4401.0]
  - - [64, 3584, 1, 256, 64, 64, 256, 256]
    - [20, 3884.0]
  - - [128, 3584, 1, 256, 128, 128, 256, 256]
    - [3, 5027.0]
  - - [64, 4288, 1, 256, 64, 64, 256, 256]
    - [1, 3555.0]
  - - [128, 4288, 1, 256, 128, 128, 256, 256]
    - [15, 4920.0]
  - - [64, 5056, 1, 256, 64, 64, 256, 256]
    - [1, 4077.0]
  - - [128, 5056, 1, 256, 128, 128, 256, 256]
    - [5, 5753.0]
  - - [64, 5888, 1, 256, 64, 64, 256, 256]
    - [5, 4322.0]
  - - [128, 5888, 1, 256, 128, 128, 256, 256]
    - [23, 6466.0]
  - - [64, 6784, 1, 256, 64, 64, 256, 256]
    - [3, 4774.0]
  - - [128, 6784, 1, 256, 128, 128, 256, 256]
    - [5, 6230.0]
  - - [64, 64, 1, 1280, 64, 64, 1280, 1280]
    - [9, 149.0]
  - - [128, 64, 1, 1280, 128, 128, 1280, 1280]
    - [2, 293.0]
  - - [64, 128, 1, 1280, 64, 64, 1280, 1280]
    - [2, 293.0]
  - - [128, 128, 1, 1280, 128, 128, 1280, 1280]
    - [9, 638.0]
  - - [64, 256, 1, 1280, 64, 64, 1280, 1280]
    - [9, 638.0]
  - - [128, 256, 1, 1280, 128, 128, 1280, 1280]
    - [17, 1257.0]
  - - [64, 448, 1, 1280, 64, 64, 1280, 1280]
    - [17, 1103.0]
  - - [128, 448, 1, 1280, 128, 128, 1280, 1280]
    - [17, 2119.0]
  - - [64, 704, 1, 1280, 64, 64, 1280, 1280]
    - [17, 1673.0]
  - - [128, 704, 1, 1280, 128, 128, 1280, 1280]
    - [17, 2997.0]
  - - [64, 1024, 1, 1280, 64, 64, 1280, 1280]
    - [17, 2427.0]
  - - [128, 1024, 1, 1280, 128, 128, 1280, 1280]
    - [17, 4025.0]
  - - [64, 1408, 1, 1280, 64, 64, 1280, 1280]
    - [17, 3004.0]
  - - [128, 1408, 1, 1280, 128, 128, 1280, 1280]
    - [17, 4336.0]
  - - [64, 1856, 1, 1280, 64, 64, 1280, 1280]
    - [17, 3676.0]
  - - [128, 1856, 1, 1280, 128, 128, 1280, 1280]
    - [20, 4917.0]
  - - [64, 2368, 1, 1280, 64, 64, 1280, 1280]
    - [17, 3956.0]
  - - [128, 2368, 1, 1280, 128, 128, 1280, 1280]
    - [1, 4338.0]
  - - [64, 2944, 1, 1280, 64, 64, 1280, 1280]
    - [18, 4282.0]
  - - [128, 2944, 1, 1280, 128, 128, 1280, 1280]
    - [5, 4991.0]
  - - [64, 3584, 1, 1280, 64, 64, 1280, 1280]
    - [20, 4867.0]
  - - [128, 3584, 1, 1280, 128, 128, 1280, 1280]
    - [21, 5830.0]
  - - [64, 4288, 1, 1280, 64, 64, 1280, 1280]
    - [18, 4186.0]
  - - [128, 4288, 1, 1280, 128, 128, 1280, 1280]
    - [15, 5506.0]
  - - [64, 5056, 1, 1280, 64, 64, 1280, 1280]
    - [5, 4282.0]
  - - [128, 5056, 1, 1280, 128, 128, 1280, 1280]
    - [15, 6488.0]
  - - [64, 5888, 1, 1280, 64, 64, 1280, 1280]
    - [5, 4946.0]
  - - [128, 5888, 1, 1280, 128, 128, 1280, 1280]
    - [23, 7407.0]
  - - [64, 6784, 1, 1280, 64, 64, 1280, 1280]
    - [23, 5483.0]
  - - [128, 6784, 1, 1280, 128, 128, 1280, 1280]
    - [5, 6824.0]
  - - [64, 64, 1, 3328, 64, 64, 3328, 3328]
    - [9, 161.0]
  - - [128, 64, 1, 3328, 128, 128, 3328, 3328]
    - [17, 317.0]
  - - [64, 128, 1, 3328, 64, 64, 3328, 3328]
    - [17, 316.0]
  - - [128, 128, 1, 3328, 128, 128, 3328, 3328]
    - [9, 660.0]
  - - [64, 256, 1, 3328, 64, 64, 3328, 3328]
    - [9, 660.0]
  - - [128, 256, 1, 3328, 128, 128, 3328, 3328]
    - [17, 1316.0]
  - - [64, 448, 1, 3328, 64, 64, 3328, 3328]
    - [17, 1152.0]
  - - [128, 448, 1, 3328, 128, 128, 3328, 3328]
    - [17, 2238.0]
  - - [64, 704, 1, 3328, 64, 64, 3328, 3328]
    - [17, 1763.0]
  - - [128, 704, 1, 3328, 128, 128, 3328, 3328]
    - [17, 3145.0]
  - - [64, 1024, 1, 3328, 64, 64, 3328, 3328]
    - [17, 2550.0]
  - - [128, 1024, 1, 3328, 128, 128, 3328, 3328]
    - [17, 4227.0]
  - - [64, 1408, 1, 3328, 64, 64, 3328, 3328]
    - [17, 3140.0]
  - - [128, 1408, 1, 3328, 128, 128, 3328, 3328]
    - [17, 4344.0]
  - - [64, 1856, 1, 3328, 64, 64, 3328, 3328]
    - [18, 3283.0]
  - - [128, 1856, 1, 3328, 128, 128, 3328, 3328]
    - [21, 4533.0]
  - - [64, 2368, 1, 3328, 64, 64, 3328, 3328]
    - [18, 3327.0]
  - - [128, 2368, 1, 3328, 128, 128, 3328, 3328]
    - [5, 4178.0]
  - - [64, 2944, 1, 3328, 64, 64, 3328, 3328]
    - [6, 3736.0]
  - - [128, 2944, 1, 3328, 128, 128, 3328, 3328]
    - [5, 5157.0]
  - - [64, 3584, 1, 3328, 64, 64, 3328, 3328]
    - [21, 4367.0]
  - - [128, 3584, 1, 3328, 128, 128, 3328, 3328]
    - [23, 5982.0]
  - - [64, 4288, 1, 3328, 64, 64, 3328, 3328]
    - [5, 3779.0]
  - - [128, 4288, 1, 3328, 128, 128, 3328, 3328]
    - [5, 5620.0]
  - - [64, 5056, 1, 3328, 64, 64, 3328, 3328]
    - [5, 4457.0]
  - - [128, 5056, 1, 3328, 128, 128, 3328, 3328]
    - [23, 6550.0]
  - - [64, 5888, 1, 3328, 64, 64, 3328, 3328]
    - [5, 5174.0]
  - - [128, 5888, 1, 3328, 128, 128, 3328, 3328]
    - [23, 7602.0]
  - - [64, 6784, 1, 3328, 64, 64, 3328, 3328]
    - [23, 5667.0]
  - - [128, 6784, 1, 3328, 128, 128, 3328, 3328]
    - [23, 6896.0]
  - - [256, 64, 1, 256, 256, 256, 256, 256]
    - [9, 519.0]
  - - [448, 64, 1, 256, 448, 448, 256, 256]
    - [2, 882.0]
  - - [704, 64, 1, 256, 704, 704, 256, 256]
    - [11, 1335.0]
  - - [1024, 64, 1, 256, 1024, 1024, 256, 256]
    - [2, 1889.0]
  - - [1408, 64, 1, 256, 1408, 1408, 256, 256]
    - [2, 2271.0]
  - - [1856, 64, 1, 256, 1856, 1856, 256, 256]
    - [2, 2735.0]
  - - [2368, 64, 1, 256, 2368, 2368, 256, 256]
    - [10, 2975.0]
  - - [2944, 64, 1, 256, 2944, 2944, 256, 256]
    - [2, 3277.0]
  - - [3584, 64, 1, 256, 3584, 3584, 256, 256]
    - [12, 3652.0]
  - - [4288, 64, 1, 256, 4288, 4288, 256, 256]
    - [3, 3182.0]
  - - [5056, 64, 1, 256, 5056, 5056, 256, 256]
    - [5, 3685.0]
  - - [5888, 64, 1, 256, 5888, 5888, 256, 256]
    - [5, 4307.0]
  - - [6784, 64, 1, 256, 6784, 6784, 256, 256]
    - [7, 4774.0]
  - - [256, 128, 1, 256, 256, 256, 256, 256]
    - [2, 989.0]
  - - [448, 128, 1, 256, 448, 448, 256, 256]
    - [2, 1653.0]
  - - [704, 128, 1, 256, 704, 704, 256, 256]
    - [2, 2289.0]
  - - [1024, 128, 1, 256, 1024, 1024, 256, 256]
    - [2, 2954.0]
  - - [1408, 128, 1, 256, 1408, 1408, 256, 256]
    - [2, 3134.0]
  - - [1856, 128, 1, 256, 1856, 1856, 256, 256]
    - [12, 3839.0]
  - - [2368, 128, 1, 256, 2368, 2368, 256, 256]
    - [5, 3514.0]
  - - [2944, 128, 1, 256, 2944, 2944, 256, 256]
    - [5, 4322.0]
  - - [3584, 128, 1, 256, 3584, 3584, 256, 256]
    - [12, 5062.0]
  - - [4288, 128, 1, 256, 4288, 4288, 256, 256]
    - [22, 4934.0]
  - - [5056, 128, 1, 256, 5056, 5056, 256, 256]
    - [15, 5769.0]
  - - [5888, 128, 1, 256, 5888, 5888, 256, 256]
    - [23, 6536.0]
  - - [6784, 128, 1, 256, 6784, 6784, 256, 256]
    - [22, 6230.0]
  - - [256, 64, 1, 1280, 256, 256, 1280, 1280]
    - [9, 638.0]
  - - [448, 64, 1, 1280, 448, 448, 1280, 1280]
    - [17, 1100.0]
  - - [704, 64, 1, 1280, 704, 704, 1280, 1280]
    - [17, 1673.0]
  - - [1024, 64, 1, 1280, 1024, 1024, 1280, 1280]
    - [17, 2416.0]
  - - [1408, 64, 1, 1280, 1408, 1408, 1280, 1280]
    - [17, 2997.0]
  - - [1856, 64, 1, 1280, 1856, 1856, 1280, 1280]
    - [17, 3669.0]
  - - [2368, 64, 1, 1280, 2368, 2368, 1280, 1280]
    - [19, 3982.0]
  - - [2944, 64, 1, 1280, 2944, 2944, 1280, 1280]
    - [19, 4375.0]
  - - [3584, 64, 1, 1280, 3584, 3584, 1280, 1280]
    - [18, 4804.0]
  - - [4288, 64, 1, 1280, 4288, 4288, 1280, 1280]
    - [18, 4214.0]
  - - [5056, 64, 1, 1280, 5056, 5056, 1280, 1280]
    - [5, 4325.0]
  - - [5888, 64, 1, 1280, 5888, 5888, 1280, 1280]
    - [15, 4987.0]
  - - [6784, 64, 1, 1280, 6784, 6784, 1280, 1280]
    - [22, 5553.0]
  - - [256, 128, 1, 1280, 256, 256, 1280, 1280]
    - [17, 1257.0]
  - - [448, 128, 1, 1280, 448, 448, 1280, 1280]
    - [17, 2119.0]
  - - [704, 128, 1, 1280, 704, 704, 1280, 1280]
    - [17, 2985.0]
  - - [1024, 128, 1, 1280, 1024, 1024, 1280, 1280]
    - [17, 4041.0]
  - - [1408, 128, 1, 1280, 1408, 1408, 1280, 1280]
    - [19, 4330.0]
  - - [1856, 128, 1, 1280, 1856, 1856, 1280, 1280]
    - [20, 4873.0]
  - - [2368, 128, 1, 1280, 2368, 2368, 1280, 1280]
    - [5, 4038.0]
  - - [2944, 128, 1, 1280, 2944, 2944, 1280, 1280]
    - [15, 4979.0]
  - - [3584, 128, 1, 1280, 3584, 3584, 1280, 1280]
    - [22, 5886.0]
  - - [4288, 128, 1, 1280, 4288, 4288, 1280, 1280]
    - [22, 5576.0]
  - - [5056, 128, 1, 1280, 5056, 5056, 1280, 1280]
    - [22, 6558.0]
  - - [5888, 128, 1, 1280, 5888, 5888, 1280, 1280]
    - [23, 7389.0]
  - - [6784, 128, 1, 1280, 6784, 6784, 1280, 1280]
    - [22, 6827.0]
  - - [256, 64, 1, 3328, 256, 256, 3328, 3328]
    - [9, 660.0]
  - - [448, 64, 1, 3328, 448, 448, 3328, 3328]
    - [17, 1151.0]
  - - [704, 64, 1, 3328, 704, 704, 3328, 3328]
    - [17, 1762.0]
  - - [1024, 64, 1, 3328, 1024, 1024, 3328, 3328]
    - [17, 2553.0]
  - - [1408, 64, 1, 3328, 1408, 1408, 3328, 3328]
    - [17, 3121.0]
  - - [1856, 64, 1, 3328, 1856, 1856, 3328, 3328]
    - [18, 3296.0]
  - - [2368, 64, 1, 3328, 2368, 2368, 3328, 3328]
    - [6, 3014.0]
  - - [2944, 64, 1, 3328, 2944, 2944, 3328, 3328]
    - [6, 3738.0]
  - - [3584, 64, 1, 3328, 3584, 3584, 3328, 3328]
    - [21, 4351.0]
  - - [4288, 64, 1, 3328, 4288, 4288, 3328, 3328]
    - [3, 3789.0]
  - - [5056, 64, 1, 3328, 5056, 5056, 3328, 3328]
    - [5, 4469.0]
  - - [5888, 64, 1, 3328, 5888, 5888, 3328, 3328]
    - [5, 5141.0]
  - - [6784, 64, 1, 3328, 6784, 6784, 3328, 3328]
    - [22, 5712.0]
  - - [256, 128, 1, 3328, 256, 256, 3328, 3328]
    - [17, 1315.0]
  - - [448, 128, 1, 3328, 448, 448, 3328, 3328]
    - [17, 2234.0]
  - - [704, 128, 1, 3328, 704, 704, 3328, 3328]
    - [17, 3129.0]
  - - [1024, 128, 1, 3328, 1024, 1024, 3328, 3328]
    - [17, 4220.0]
  - - [1408, 128, 1, 3328, 1408, 1408, 3328, 3328]
    - [20, 4277.0]
  - - [1856, 128, 1, 3328, 1856, 1856, 3328, 3328]
    - [21, 4515.0]
  - - [2368, 128, 1, 3328, 2368, 2368, 3328, 3328]
    - [5, 4200.0]
  - - [2944, 128, 1, 3328, 2944, 2944, 3328, 3328]
    - [5, 5177.0]
  - - [3584, 128, 1, 3328, 3584, 3584, 3328, 3328]
    - [22, 6009.0]
  - - [4288, 128, 1, 3328, 4288, 4288, 3328, 3328]
    - [22, 5707.0]
  - - [5056, 128, 1, 3328, 5056, 5056, 3328, 3328]
    - [22, 6612.0]
  - - [5888, 128, 1, 3328, 5888, 5888, 3328, 3328]
    - [23, 7602.0]
  - - [6784, 128, 1, 3328, 6784, 6784, 3328, 3328]
    - [23, 6903.0]
  - - [256, 256, 1, 256, 256, 256, 256, 256]
    - [2, 1856.0]
  - - [448, 256, 1, 256, 448, 448, 256, 256]
    - [2, 2699.0]
  - - [256, 448, 1, 256, 256, 256, 256, 256]
    - [2, 2759.0]
  - - [448, 448, 1, 256, 448, 448, 256, 256]
    - [12, 3260.0]
  - - [256, 256, 1, 1280, 256, 256, 1280, 1280]
    - [17, 2416.0]
  - - [448, 256, 1, 1280, 448, 448, 1280, 1280]
    - [19, 3549.0]
  - - [256, 448, 1, 1280, 256, 256, 1280, 1280]
    - [19, 3556.0]
  - - [448, 448, 1, 1280, 448, 448, 1280, 1280]
    - [20, 4276.0]
  - - [256, 256, 1, 3328, 256, 256, 3328, 3328]
    - [17, 2546.0]
  - - [448, 256, 1, 3328, 448, 448, 3328, 3328]
    - [17, 3710.0]
  - - [256, 448, 1, 3328, 256, 256, 3328, 3328]
    - [17, 3727.0]
  - - [448, 448, 1, 3328, 448, 448, 3328, 3328]
    - [20, 4434.0]
  - - [1760, 32, 1, 1760, 1760, 1760, 1760, 1760]
    - [17, 2129.0]
  - - [3072, 32, 1, 1024, 3072, 3072, 1024, 1024]
    - [17, 3138.0]
  - - [2048, 32, 1, 2048, 2048, 2048, 2048, 2048]
    - [17, 2442.0]
  - - [1760, 64, 1, 1760, 1760, 1760, 1760, 1760]
    - [17, 3576.0]
  - - [3072, 64, 1, 1024, 3072, 3072, 1024, 1024]
    - [20, 3995.0]
  - - [2560, 32, 1, 2560, 2560, 2560, 2560, 2560]
    - [9, 2360.0]
  - - [4608, 32, 1, 1536, 4608, 4608, 1536, 1536]
    - [17, 3921.0]
  - - [2048, 64, 1, 2048, 2048, 2048, 2048, 2048]
    - [11, 3783.0]
  - - [1760, 128, 1, 1760, 1760, 1760, 1760, 1760]
    - [20, 4854.0]
  - - [3072, 128, 1, 1024, 3072, 3072, 1024, 1024]
    - [12, 4998.0]
  - - [2560, 64, 1, 2560, 2560, 2560, 2560, 2560]
    - [2, 3402.0]
  - - [6144, 32, 1, 2560, 6144, 6144, 2560, 2560]
    - [18, 4491.0]
  - - [2048, 128, 1, 2048, 2048, 2048, 2048, 2048]
    - [16, 4696.0]
  - - [4096, 32, 1, 4096, 4096, 4096, 4096, 4096]
    - [14, 3372.0]
  - - [7680, 32, 1, 2560, 7680, 7680, 2560, 2560]
    - [21, 4615.0]
  - - [8448, 32, 1, 2816, 8448, 8448, 2816, 2816]
    - [5, 3724.0]
  - - [2560, 128, 1, 2560, 2560, 2560, 2560, 2560]
    - [5, 4496.0]
  - - [4096, 64, 1, 4096, 4096, 4096, 4096, 4096]
    - [12, 4471.0]
  - - [7680, 64, 1, 2560, 7680, 7680, 2560, 2560]
    - [8, 6212.0]
  - - [4096, 128, 1, 4096, 4096, 4096, 4096, 4096]
    - [16, 6217.0]
  - - [7680, 128, 1, 2560, 7680, 7680, 2560, 2560]
    - [8, 7379.0]
  - - [704, 256, 1, 256, 704, 704, 256, 256]
    - [12, 2898.0]
  - - [1024, 256, 1, 256, 1024, 1024, 256, 256]
    - [12, 4014.0]
  - - [1408, 256, 1, 256, 1408, 1408, 256, 256]
    - [12, 3991.0]
  - - [1856, 256, 1, 256, 1856, 1856, 256, 256]
    - [23, 5207.0]
  - - [2368, 256, 1, 256, 2368, 2368, 256, 256]
    - [23, 5374.0]
  - - [2944, 256, 1, 256, 2944, 2944, 256, 256]
    - [23, 6607.0]
  - - [3584, 256, 1, 256, 3584, 3584, 256, 256]
    - [23, 6439.0]
  - - [4288, 256, 1, 256, 4288, 4288, 256, 256]
    - [23, 6318.0]
  - - [5056, 256, 1, 256, 5056, 5056, 256, 256]
    - [23, 7436.0]
  - - [5888, 256, 1, 256, 5888, 5888, 256, 256]
    - [23, 7455.0]
  - - [6784, 256, 1, 256, 6784, 6784, 256, 256]
    - [23, 7603.0]
  - - [704, 448, 1, 256, 704, 704, 256, 256]
    - [22, 3517.0]
  - - [1024, 448, 1, 256, 1024, 1024, 256, 256]
    - [12, 4993.0]
  - - [1408, 448, 1, 256, 1408, 1408, 256, 256]
    - [23, 5576.0]
  - - [1856, 448, 1, 256, 1856, 1856, 256, 256]
    - [22, 5952.0]
  - - [2368, 448, 1, 256, 2368, 2368, 256, 256]
    - [23, 6150.0]
  - - [2944, 448, 1, 256, 2944, 2944, 256, 256]
    - [23, 6584.0]
  - - [3584, 448, 1, 256, 3584, 3584, 256, 256]
    - [23, 7067.0]
  - - [4288, 448, 1, 256, 4288, 4288, 256, 256]
    - [23, 7478.0]
  - - [5056, 448, 1, 256, 5056, 5056, 256, 256]
    - [23, 7930.0]
  - - [5888, 448, 1, 256, 5888, 5888, 256, 256]
    - [23, 7716.0]
  - - [6784, 448, 1, 256, 6784, 6784, 256, 256]
    - [23, 8193.0]
  - - [256, 704, 1, 256, 256, 256, 256, 256]
    - [12, 2927.0]
  - - [448, 704, 1, 256, 448, 448, 256, 256]
    - [12, 3579.0]
  - - [704, 704, 1, 256, 704, 704, 256, 256]
    - [23, 5450.0]
  - - [1024, 704, 1, 256, 1024, 1024, 256, 256]
    - [23, 6201.0]
  - - [1408, 704, 1, 256, 1408, 1408, 256, 256]
    - [23, 7033.0]
  - - [1856, 704, 1, 256, 1856, 1856, 256, 256]
    - [23, 7507.0]
  - - [2368, 704, 1, 256, 2368, 2368, 256, 256]
    - [23, 7298.0]
  - - [2944, 704, 1, 256, 2944, 2944, 256, 256]
    - [23, 8020.0]
  - - [3584, 704, 1, 256, 3584, 3584, 256, 256]
    - [23, 7986.0]
  - - [4288, 704, 1, 256, 4288, 4288, 256, 256]
    - [23, 8138.0]
  - - [5056, 704, 1, 256, 5056, 5056, 256, 256]
    - [23, 8206.0]
  - - [5888, 704, 1, 256, 5888, 5888, 256, 256]
    - [23, 8492.0]
  - - [6784, 704, 1, 256, 6784, 6784, 256, 256]
    - [23, 8365.0]
  - - [256, 1024, 1, 256, 256, 256, 256, 256]
    - [12, 4132.0]
  - - [448, 1024, 1, 256, 448, 448, 256, 256]
    - [23, 5062.0]
  - - [704, 1024, 1, 256, 704, 704, 256, 256]
    - [23, 6390.0]
  - - [1024, 1024, 1, 256, 1024, 1024, 256, 256]
    - [23, 6848.0]
  - - [1408, 1024, 1, 256, 1408, 1408, 256, 256]
    - [23, 7198.0]
  - - [1856, 1024, 1, 256, 1856, 1856, 256, 256]
    - [23, 7417.0]
  - - [2368, 1024, 1, 256, 2368, 2368, 256, 256]
    - [23, 7744.0]
  - - [2944, 1024, 1, 256, 2944, 2944, 256, 256]
    - [23, 8113.0]
  - - [3584, 1024, 1, 256, 3584, 3584, 256, 256]
    - [23, 8498.0]
  - - [4288, 1024, 1, 256, 4288, 4288, 256, 256]
    - [23, 8526.0]
  - - [5056, 1024, 1, 256, 5056, 5056, 256, 256]
    - [23, 8615.0]
  - - [5888, 1024, 1, 256, 5888, 5888, 256, 256]
    - [23, 8782.0]
  - - [6784, 1024, 1, 256, 6784, 6784, 256, 256]
    - [23, 8684.0]
  - - [256, 1408, 1, 256, 256, 256, 256, 256]
    - [12, 4076.0]
  - - [448, 1408, 1, 256, 448, 448, 256, 256]
    - [22, 5623.0]
  - - [704, 1408, 1, 256, 704, 704, 256, 256]
    - [23, 7033.0]
  - - [1024, 1408, 1, 256, 1024, 1024, 256, 256]
    - [23, 6928.0]
  - - [1408, 1408, 1, 256, 1408, 1408, 256, 256]
    - [23, 7718.0]
  - - [1856, 1408, 1, 256, 1856, 1856, 256, 256]
    - [23, 8280.0]
  - - [2368, 1408, 1, 256, 2368, 2368, 256, 256]
    - [23, 8303.0]
  - - [2944, 1408, 1, 256, 2944, 2944, 256, 256]
    - [23, 8530.0]
  - - [3584, 1408, 1, 256, 3584, 3584, 256, 256]
    - [23, 8410.0]
  - - [4288, 1408, 1, 256, 4288, 4288, 256, 256]
    - [23, 8485.0]
  - - [5056, 1408, 1, 256, 5056, 5056, 256, 256]
    - [23, 8613.0]
  - - [5888, 1408, 1, 256, 5888, 5888, 256, 256]
    - [23, 8750.0]
  - - [6784, 1408, 1, 256, 6784, 6784, 256, 256]
    - [23, 8793.0]
  - - [256, 1856, 1, 256, 256, 256, 256, 256]
    - [23, 5119.0]
  - - [448, 1856, 1, 256, 448, 448, 256, 256]
    - [23, 5900.0]
  - - [704, 1856, 1, 256, 704, 704, 256, 256]
    - [23, 7453.0]
  - - [1024, 1856, 1, 256, 1024, 1024, 256, 256]
    - [23, 7292.0]
  - - [1408, 1856, 1, 256, 1408, 1408, 256, 256]
    - [23, 8313.0]
  - - [1856, 1856, 1, 256, 1856, 1856, 256, 256]
    - [23, 8046.0]
  - - [2368, 1856, 1, 256, 2368, 2368, 256, 256]
    - [23, 8539.0]
  - - [2944, 1856, 1, 256, 2944, 2944, 256, 256]
    - [23, 8673.0]
  - - [3584, 1856, 1, 256, 3584, 3584, 256, 256]
    - [23, 8604.0]
  - - [4288, 1856, 1, 256, 4288, 4288, 256, 256]
    - [23, 8698.0]
  - - [5056, 1856, 1, 256, 5056, 5056, 256, 256]
    - [23, 8837.0]
  - - [5888, 1856, 1, 256, 5888, 5888, 256, 256]
    - [23, 8831.0]
  - - [6784, 1856, 1, 256, 6784, 6784, 256, 256]
    - [23, 8830.0]
  - - [256, 2368, 1, 256, 256, 256, 256, 256]
    - [23, 5329.0]
  - - [448, 2368, 1, 256, 448, 448, 256, 256]
    - [23, 6128.0]
  - - [704, 2368, 1, 256, 704, 704, 256, 256]
    - [23, 7328.0]
  - - [1024, 2368, 1, 256, 1024, 1024, 256, 256]
    - [25, 7432.0]
  - - [1408, 2368, 1, 256, 1408, 1408, 256, 256]
    - [23, 8316.0]
  - - [1856, 2368, 1, 256, 1856, 1856, 256, 256]
    - [23, 8529.0]
  - - [2368, 2368, 1, 256, 2368, 2368, 256, 256]
    - [23, 8545.0]
  - - [2944, 2368, 1, 256, 2944, 2944, 256, 256]
    - [23, 8707.0]
  - - [3584, 2368, 1, 256, 3584, 3584, 256, 256]
    - [23, 8730.0]
  - - [4288, 2368, 1, 256, 4288, 4288, 256, 256]
    - [23, 8883.0]
  - - [5056, 2368, 1, 256, 5056, 5056, 256, 256]
    - [23, 8891.0]
  - - [5888, 2368, 1, 256, 5888, 5888, 256, 256]
    - [23, 8875.0]
  - - [6784, 2368, 1, 256, 6784, 6784, 256, 256]
    - [23, 8931.0]
  - - [256, 2944, 1, 256, 256, 256, 256, 256]
    - [23, 6536.0]
  - - [448, 2944, 1, 256, 448, 448, 256, 256]
    - [23, 6636.0]
  - - [704, 2944, 1, 256, 704, 704, 256, 256]
    - [23, 8039.0]
  - - [1024, 2944, 1, 256, 1024, 1024, 256, 256]
    - [23, 7767.0]
  - - [1408, 2944, 1, 256, 1408, 1408, 256, 256]
    - [23, 8411.0]
  - - [1856, 2944, 1, 256, 1856, 1856, 256, 256]
    - [23, 8673.0]
  - - [2368, 2944, 1, 256, 2368, 2368, 256, 256]
    - [23, 8711.0]
  - - [2944, 2944, 1, 256, 2944, 2944, 256, 256]
    - [23, 8681.0]
  - - [3584, 2944, 1, 256, 3584, 3584, 256, 256]
    - [23, 8793.0]
  - - [4288, 2944, 1, 256, 4288, 4288, 256, 256]
    - [23, 8843.0]
  - - [5056, 2944, 1, 256, 5056, 5056, 256, 256]
    - [23, 8972.0]
  - - [5888, 2944, 1, 256, 5888, 5888, 256, 256]
    - [23, 8929.0]
  - - [6784, 2944, 1, 256, 6784, 6784, 256, 256]
    - [23, 8960.0]
  - - [256, 3584, 1, 256, 256, 256, 256, 256]
    - [23, 6510.0]
  - - [448, 3584, 1, 256, 448, 448, 256, 256]
    - [23, 7058.0]
  - - [704, 3584, 1, 256, 704, 704, 256, 256]
    - [23, 8026.0]
  - - [1024, 3584, 1, 256, 1024, 1024, 256, 256]
    - [25, 8259.0]
  - - [1408, 3584, 1, 256, 1408, 1408, 256, 256]
    - [23, 8397.0]
  - - [1856, 3584, 1, 256, 1856, 1856, 256, 256]
    - [23, 8618.0]
  - - [2368, 3584, 1, 256, 2368, 2368, 256, 256]
    - [23, 8730.0]
  - - [2944, 3584, 1, 256, 2944, 2944, 256, 256]
    - [23, 8793.0]
  - - [3584, 3584, 1, 256, 3584, 3584, 256, 256]
    - [23, 8973.0]
  - - [4288, 3584, 1, 256, 4288, 4288, 256, 256]
    - [23, 8955.0]
  - - [5056, 3584, 1, 256, 5056, 5056, 256, 256]
    - [24, 8965.0]
  - - [5888, 3584, 1, 256, 5888, 5888, 256, 256]
    - [23, 8988.0]
  - - [6784, 3584, 1, 256, 6784, 6784, 256, 256]
    - [23, 9047.0]
  - - [256, 4288, 1, 256, 256, 256, 256, 256]
    - [23, 6184.0]
  - - [448, 4288, 1, 256, 448, 448, 256, 256]
    - [23, 7469.0]
  - - [704, 4288, 1, 256, 704, 704, 256, 256]
    - [23, 8131.0]
  - - [1024, 4288, 1, 256, 1024, 1024, 256, 256]
    - [23, 8061.0]
  - - [1408, 4288, 1, 256, 1408, 1408, 256, 256]
    - [23, 8463.0]
  - - [1856, 4288, 1, 256, 1856, 1856, 256, 256]
    - [23, 8698.0]
  - - [2368, 4288, 1, 256, 2368, 2368, 256, 256]
    - [23, 8880.0]
  - - [2944, 4288, 1, 256, 2944, 2944, 256, 256]
    - [23, 8845.0]
  - - [3584, 4288, 1, 256, 3584, 3584, 256, 256]
    - [23, 8950.0]
  - - [4288, 4288, 1, 256, 4288, 4288, 256, 256]
    - [23, 8949.0]
  - - [5056, 4288, 1, 256, 5056, 5056, 256, 256]
    - [23, 9044.0]
  - - [5888, 4288, 1, 256, 5888, 5888, 256, 256]
    - [23, 9016.0]
  - - [6784, 4288, 1, 256, 6784, 6784, 256, 256]
    - [23, 9085.0]
  - - [256, 5056, 1, 256, 256, 256, 256, 256]
    - [23, 7318.0]
  - - [448, 5056, 1, 256, 448, 448, 256, 256]
    - [23, 7904.0]
  - - [704, 5056, 1, 256, 704, 704, 256, 256]
    - [23, 8296.0]
  - - [1024, 5056, 1, 256, 1024, 1024, 256, 256]
    - [25, 8414.0]
  - - [1408, 5056, 1, 256, 1408, 1408, 256, 256]
    - [23, 8596.0]
  - - [1856, 5056, 1, 256, 1856, 1856, 256, 256]
    - [23, 8871.0]
  - - [2368, 5056, 1, 256, 2368, 2368, 256, 256]
    - [23, 8908.0]
  - - [2944, 5056, 1, 256, 2944, 2944, 256, 256]
    - [23, 8977.0]
  - - [3584, 5056, 1, 256, 3584, 3584, 256, 256]
    - [23, 8936.0]
  - - [4288, 5056, 1, 256, 4288, 4288, 256, 256]
    - [23, 9033.0]
  - - [5056, 5056, 1, 256, 5056, 5056, 256, 256]
    - [23, 9035.0]
  - - [5888, 5056, 1, 256, 5888, 5888, 256, 256]
    - [25, 9084.0]
  - - [6784, 5056, 1, 256, 6784, 6784, 256, 256]
    - [23, 9091.0]
  - - [256, 5888, 1, 256, 256, 256, 256, 256]
    - [23, 7319.0]
  - - [448, 5888, 1, 256, 448, 448, 256, 256]
    - [23, 7730.0]
  - - [704, 5888, 1, 256, 704, 704, 256, 256]
    - [23, 8514.0]
  - - [1024, 5888, 1, 256, 1024, 1024, 256, 256]
    - [25, 8245.0]
  - - [1408, 5888, 1, 256, 1408, 1408, 256, 256]
    - [23, 8741.0]
  - - [1856, 5888, 1, 256, 1856, 1856, 256, 256]
    - [23, 8880.0]
  - - [2368, 5888, 1, 256, 2368, 2368, 256, 256]
    - [24, 8900.0]
  - - [2944, 5888, 1, 256, 2944, 2944, 256, 256]
    - [23, 8934.0]
  - - [3584, 5888, 1, 256, 3584, 3584, 256, 256]
    - [23, 8995.0]
  - - [4288, 5888, 1, 256, 4288, 4288, 256, 256]
    - [23, 9020.0]
  - - [5056, 5888, 1, 256, 5056, 5056, 256, 256]
    - [24, 9100.0]
  - - [5888, 5888, 1, 256, 5888, 5888, 256, 256]
    - [23, 9056.0]
  - - [6784, 5888, 1, 256, 6784, 6784, 256, 256]
    - [23, 9082.0]
  - - [256, 6784, 1, 256, 256, 256, 256, 256]
    - [23, 7582.0]
  - - [448, 6784, 1, 256, 448, 448, 256, 256]
    - [23, 8159.0]
  - - [704, 6784, 1, 256, 704, 704, 256, 256]
    - [23, 8374.0]
  - - [1024, 6784, 1, 256, 1024, 1024, 256, 256]
    - [25, 8267.0]
  - - [1408, 6784, 1, 256, 1408, 1408, 256, 256]
    - [23, 8791.0]
  - - [1856, 6784, 1, 256, 1856, 1856, 256, 256]
    - [23, 8834.0]
  - - [2368, 6784, 1, 256, 2368, 2368, 256, 256]
    - [24, 8950.0]
  - - [2944, 6784, 1, 256, 2944, 2944, 256, 256]
    - [23, 8969.0]
  - - [3584, 6784, 1, 256, 3584, 3584, 256, 256]
    - [23, 9046.0]
  - - [4288, 6784, 1, 256, 4288, 4288, 256, 256]
    - [23, 9088.0]
  - - [5056, 6784, 1, 256, 5056, 5056, 256, 256]
    - [23, 9088.0]
  - - [5888, 6784, 1, 256, 5888, 5888, 256, 256]
    - [23, 9083.0]
  - - [6784, 6784, 1, 256, 6784, 6784, 256, 256]
    - [24, 9146.0]
  - - [704, 256, 1, 1280, 704, 704, 1280, 1280]
    - [12, 3369.0]
  - - [1024, 256, 1, 1280, 1024, 1024, 1280, 1280]
    - [12, 4866.0]
  - - [1408, 256, 1, 1280, 1408, 1408, 1280, 1280]
    - [21, 4731.0]
  - - [1856, 256, 1, 1280, 1856, 1856, 1280, 1280]
    - [22, 6077.0]
  - - [2368, 256, 1, 1280, 2368, 2368, 1280, 1280]
    - [23, 6032.0]
  - - [2944, 256, 1, 1280, 2944, 2944, 1280, 1280]
    - [23, 7398.0]
  - - [3584, 256, 1, 1280, 3584, 3584, 1280, 1280]
    - [22, 7172.0]
  - - [4288, 256, 1, 1280, 4288, 4288, 1280, 1280]
    - [23, 6823.0]
  - - [5056, 256, 1, 1280, 5056, 5056, 1280, 1280]
    - [23, 7987.0]
  - - [5888, 256, 1, 1280, 5888, 5888, 1280, 1280]
    - [23, 7983.0]
  - - [6784, 256, 1, 1280, 6784, 6784, 1280, 1280]
    - [23, 8061.0]
  - - [704, 448, 1, 1280, 704, 704, 1280, 1280]
    - [12, 4184.0]
  - - [1024, 448, 1, 1280, 1024, 1024, 1280, 1280]
    - [21, 5891.0]
  - - [1408, 448, 1, 1280, 1408, 1408, 1280, 1280]
    - [23, 6257.0]
  - - [1856, 448, 1, 1280, 1856, 1856, 1280, 1280]
    - [23, 6521.0]
  - - [2368, 448, 1, 1280, 2368, 2368, 1280, 1280]
    - [23, 6620.0]
  - - [2944, 448, 1, 1280, 2944, 2944, 1280, 1280]
    - [23, 7062.0]
  - - [3584, 448, 1, 1280, 3584, 3584, 1280, 1280]
    - [23, 7472.0]
  - - [4288, 448, 1, 1280, 4288, 4288, 1280, 1280]
    - [23, 7918.0]
  - - [5056, 448, 1, 1280, 5056, 5056, 1280, 1280]
    - [23, 8337.0]
  - - [5888, 448, 1, 1280, 5888, 5888, 1280, 1280]
    - [23, 8047.0]
  - - [6784, 448, 1, 1280, 6784, 6784, 1280, 1280]
    - [23, 8549.0]
  - - [256, 704, 1, 1280, 256, 256, 1280, 1280]
    - [12, 3361.0]
  - - [448, 704, 1, 1280, 448, 448, 1280, 1280]
    - [21, 4170.0]
  - - [704, 704, 1, 1280, 704, 704, 1280, 1280]
    - [23, 6284.0]
  - - [1024, 704, 1, 1280, 1024, 1024, 1280, 1280]
    - [23, 7050.0]
  - - [1408, 704, 1, 1280, 1408, 1408, 1280, 1280]
    - [23, 7740.0]
  - - [1856, 704, 1, 1280, 1856, 1856, 1280, 1280]
    - [23, 8091.0]
  - - [2368, 704, 1, 1280, 2368, 2368, 1280, 1280]
    - [23, 7774.0]
  - - [2944, 704, 1, 1280, 2944, 2944, 1280, 1280]
    - [23, 8516.0]
  - - [3584, 704, 1, 1280, 3584, 3584, 1280, 1280]
    - [23, 8395.0]
  - - [4288, 704, 1, 1280, 4288, 4288, 1280, 1280]
    - [23, 8498.0]
  - - [5056, 704, 1, 1280, 5056, 5056, 1280, 1280]
    - [23, 8651.0]
  - - [5888, 704, 1, 1280, 5888, 5888, 1280, 1280]
    - [23, 8852.0]
  - - [6784, 704, 1, 1280, 6784, 6784, 1280, 1280]
    - [23, 8658.0]
  - - [256, 1024, 1, 1280, 256, 256, 1280, 1280]
    - [12, 4827.0]
  - - [448, 1024, 1, 1280, 448, 448, 1280, 1280]
    - [23, 5849.0]
  - - [704, 1024, 1, 1280, 704, 704, 1280, 1280]
    - [23, 7142.0]
  - - [1024, 1024, 1, 1280, 1024, 1024, 1280, 1280]
    - [23, 8047.0]
  - - [1408, 1024, 1, 1280, 1408, 1408, 1280, 1280]
    - [23, 7677.0]
  - - [1856, 1024, 1, 1280, 1856, 1856, 1280, 1280]
    - [23, 7841.0]
  - - [2368, 1024, 1, 1280, 2368, 2368, 1280, 1280]
    - [23, 8110.0]
  - - [2944, 1024, 1, 1280, 2944, 2944, 1280, 1280]
    - [23, 8483.0]
  - - [3584, 1024, 1, 1280, 3584, 3584, 1280, 1280]
    - [23, 8894.0]
  - - [4288, 1024, 1, 1280, 4288, 4288, 1280, 1280]
    - [23, 8848.0]
  - - [5056, 1024, 1, 1280, 5056, 5056, 1280, 1280]
    - [23, 8922.0]
  - - [5888, 1024, 1, 1280, 5888, 5888, 1280, 1280]
    - [23, 9047.0]
  - - [6784, 1024, 1, 1280, 6784, 6784, 1280, 1280]
    - [23, 8948.0]
  - - [256, 1408, 1, 1280, 256, 256, 1280, 1280]
    - [21, 4723.0]
  - - [448, 1408, 1, 1280, 448, 448, 1280, 1280]
    - [23, 6273.0]
  - - [704, 1408, 1, 1280, 704, 704, 1280, 1280]
    - [23, 7763.0]
  - - [1024, 1408, 1, 1280, 1024, 1024, 1280, 1280]
    - [23, 7596.0]
  - - [1408, 1408, 1, 1280, 1408, 1408, 1280, 1280]
    - [23, 8150.0]
  - - [1856, 1408, 1, 1280, 1856, 1856, 1280, 1280]
    - [23, 8713.0]
  - - [2368, 1408, 1, 1280, 2368, 2368, 1280, 1280]
    - [23, 8683.0]
  - - [2944, 1408, 1, 1280, 2944, 2944, 1280, 1280]
    - [23, 8836.0]
  - - [3584, 1408, 1, 1280, 3584, 3584, 1280, 1280]
    - [23, 8697.0]
  - - [4288, 1408, 1, 1280, 4288, 4288, 1280, 1280]
    - [23, 8730.0]
  - - [5056, 1408, 1, 1280, 5056, 5056, 1280, 1280]
    - [23, 8849.0]
  - - [5888, 1408, 1, 1280, 5888, 5888, 1280, 1280]
    - [23, 9038.0]
  - - [6784, 1408, 1, 1280, 6784, 6784, 1280, 1280]
    - [23, 9031.0]
  - - [256, 1856, 1, 1280, 256, 256, 1280, 1280]
    - [23, 6000.0]
  - - [448, 1856, 1, 1280, 448, 448, 1280, 1280]
    - [23, 6528.0]
  - - [704, 1856, 1, 1280, 704, 704, 1280, 1280]
    - [23, 8100.0]
  - - [1024, 1856, 1, 1280, 1024, 1024, 1280, 1280]
    - [23, 7795.0]
  - - [1408, 1856, 1, 1280, 1408, 1408, 1280, 1280]
    - [23, 8731.0]
  - - [1856, 1856, 1, 1280, 1856, 1856, 1280, 1280]
    - [23, 8371.0]
  - - [2368, 1856, 1, 1280, 2368, 2368, 1280, 1280]
    - [23, 8846.0]
  - - [2944, 1856, 1, 1280, 2944, 2944, 1280, 1280]
    - [23, 8969.0]
  - - [3584, 1856, 1, 1280, 3584, 3584, 1280, 1280]
    - [23, 8883.0]
  - - [4288, 1856, 1, 1280, 4288, 4288, 1280, 1280]
    - [23, 8953.0]
  - - [5056, 1856, 1, 1280, 5056, 5056, 1280, 1280]
    - [23, 9106.0]
  - - [5888, 1856, 1, 1280, 5888, 5888, 1280, 1280]
    - [23, 9112.0]
  - - [6784, 1856, 1, 1280, 6784, 6784, 1280, 1280]
    - [23, 9032.0]
  - - [256, 2368, 1, 1280, 256, 256, 1280, 1280]
    - [23, 5991.0]
  - - [448, 2368, 1, 1280, 448, 448, 1280, 1280]
    - [23, 6623.0]
  - - [704, 2368, 1, 1280, 704, 704, 1280, 1280]
    - [23, 7756.0]
  - - [1024, 2368, 1, 1280, 1024, 1024, 1280, 1280]
    - [23, 8086.0]
  - - [1408, 2368, 1, 1280, 1408, 1408, 1280, 1280]
    - [23, 8681.0]
  - - [1856, 2368, 1, 1280, 1856, 1856, 1280, 1280]
    - [23, 8859.0]
  - - [2368, 2368, 1, 1280, 2368, 2368, 1280, 1280]
    - [23, 8820.0]
  - - [2944, 2368, 1, 1280, 2944, 2944, 1280, 1280]
    - [23, 8968.0]
  - - [3584, 2368, 1, 1280, 3584, 3584, 1280, 1280]
    - [23, 8974.0]
  - - [4288, 2368, 1, 1280, 4288, 4288, 1280, 1280]
    - [23, 9114.0]
  - - [5056, 2368, 1, 1280, 5056, 5056, 1280, 1280]
    - [23, 9131.0]
  - - [5888, 2368, 1, 1280, 5888, 5888, 1280, 1280]
    - [23, 9085.0]
  - - [6784, 2368, 1, 1280, 6784, 6784, 1280, 1280]
    - [25, 9127.0]
  - - [256, 2944, 1, 1280, 256, 256, 1280, 1280]
    - [22, 7434.0]
  - - [448, 2944, 1, 1280, 448, 448, 1280, 1280]
    - [23, 7055.0]
  - - [704, 2944, 1, 1280, 704, 704, 1280, 1280]
    - [23, 8520.0]
  - - [1024, 2944, 1, 1280, 1024, 1024, 1280, 1280]
    - [23, 8365.0]
  - - [1408, 2944, 1, 1280, 1408, 1408, 1280, 1280]
    - [23, 8856.0]
  - - [1856, 2944, 1, 1280, 1856, 1856, 1280, 1280]
    - [23, 8972.0]
  - - [2368, 2944, 1, 1280, 2368, 2368, 1280, 1280]
    - [23, 8974.0]
  - - [2944, 2944, 1, 1280, 2944, 2944, 1280, 1280]
    - [23, 8909.0]
  - - [3584, 2944, 1, 1280, 3584, 3584, 1280, 1280]
    - [23, 9014.0]
  - - [4288, 2944, 1, 1280, 4288, 4288, 1280, 1280]
    - [23, 9049.0]
  - - [5056, 2944, 1, 1280, 5056, 5056, 1280, 1280]
    - [23, 9187.0]
  - - [5888, 2944, 1, 1280, 5888, 5888, 1280, 1280]
    - [23, 9122.0]
  - - [6784, 2944, 1, 1280, 6784, 6784, 1280, 1280]
    - [23, 9158.0]
  - - [256, 3584, 1, 1280, 256, 256, 1280, 1280]
    - [23, 7144.0]
  - - [448, 3584, 1, 1280, 448, 448, 1280, 1280]
    - [23, 7490.0]
  - - [704, 3584, 1, 1280, 704, 704, 1280, 1280]
    - [23, 8428.0]
  - - [1024, 3584, 1, 1280, 1024, 1024, 1280, 1280]
    - [25, 8775.0]
  - - [1408, 3584, 1, 1280, 1408, 1408, 1280, 1280]
    - [23, 8693.0]
  - - [1856, 3584, 1, 1280, 1856, 1856, 1280, 1280]
    - [23, 8888.0]
  - - [2368, 3584, 1, 1280, 2368, 2368, 1280, 1280]
    - [23, 8980.0]
  - - [2944, 3584, 1, 1280, 2944, 2944, 1280, 1280]
    - [23, 9017.0]
  - - [3584, 3584, 1, 1280, 3584, 3584, 1280, 1280]
    - [23, 9192.0]
  - - [4288, 3584, 1, 1280, 4288, 4288, 1280, 1280]
    - [23, 9165.0]
  - - [5056, 3584, 1, 1280, 5056, 5056, 1280, 1280]
    - [24, 9138.0]
  - - [5888, 3584, 1, 1280, 5888, 5888, 1280, 1280]
    - [23, 9200.0]
  - - [6784, 3584, 1, 1280, 6784, 6784, 1280, 1280]
    - [23, 9237.0]
  - - [256, 4288, 1, 1280, 256, 256, 1280, 1280]
    - [23, 6839.0]
  - - [448, 4288, 1, 1280, 448, 448, 1280, 1280]
    - [23, 7920.0]
  - - [704, 4288, 1, 1280, 704, 704, 1280, 1280]
    - [23, 8493.0]
  - - [1024, 4288, 1, 1280, 1024, 1024, 1280, 1280]
    - [23, 8799.0]
  - - [1408, 4288, 1, 1280, 1408, 1408, 1280, 1280]
    - [23, 8726.0]
  - - [1856, 4288, 1, 1280, 1856, 1856, 1280, 1280]
    - [23, 8951.0]
  - - [2368, 4288, 1, 1280, 2368, 2368, 1280, 1280]
    - [23, 9107.0]
  - - [2944, 4288, 1, 1280, 2944, 2944, 1280, 1280]
    - [23, 9050.0]
  - - [3584, 4288, 1, 1280, 3584, 3584, 1280, 1280]
    - [23, 9166.0]
  - - [4288, 4288, 1, 1280, 4288, 4288, 1280, 1280]
    - [23, 9138.0]
  - - [5056, 4288, 1, 1280, 5056, 5056, 1280, 1280]
    - [23, 9223.0]
  - - [5888, 4288, 1, 1280, 5888, 5888, 1280, 1280]
    - [23, 9204.0]
  - - [6784, 4288, 1, 1280, 6784, 6784, 1280, 1280]
    - [23, 9269.0]
  - - [256, 5056, 1, 1280, 256, 256, 1280, 1280]
    - [23, 7984.0]
  - - [448, 5056, 1, 1280, 448, 448, 1280, 1280]
    - [23, 8333.0]
  - - [704, 5056, 1, 1280, 704, 704, 1280, 1280]
    - [23, 8643.0]
  - - [1024, 5056, 1, 1280, 1024, 1024, 1280, 1280]
    - [23, 8879.0]
  - - [1408, 5056, 1, 1280, 1408, 1408, 1280, 1280]
    - [23, 8849.0]
  - - [1856, 5056, 1, 1280, 1856, 1856, 1280, 1280]
    - [23, 9109.0]
  - - [2368, 5056, 1, 1280, 2368, 2368, 1280, 1280]
    - [23, 9134.0]
  - - [2944, 5056, 1, 1280, 2944, 2944, 1280, 1280]
    - [23, 9186.0]
  - - [3584, 5056, 1, 1280, 3584, 3584, 1280, 1280]
    - [25, 9132.0]
  - - [4288, 5056, 1, 1280, 4288, 4288, 1280, 1280]
    - [23, 9222.0]
  - - [5056, 5056, 1, 1280, 5056, 5056, 1280, 1280]
    - [23, 9223.0]
  - - [5888, 5056, 1, 1280, 5888, 5888, 1280, 1280]
    - [25, 9254.0]
  - - [6784, 5056, 1, 1280, 6784, 6784, 1280, 1280]
    - [23, 9271.0]
  - - [256, 5888, 1, 1280, 256, 256, 1280, 1280]
    - [23, 8002.0]
  - - [448, 5888, 1, 1280, 448, 448, 1280, 1280]
    - [23, 8061.0]
  - - [704, 5888, 1, 1280, 704, 704, 1280, 1280]
    - [23, 8850.0]
  - - [1024, 5888, 1, 1280, 1024, 1024, 1280, 1280]
    - [23, 9007.0]
  - - [1408, 5888, 1, 1280, 1408, 1408, 1280, 1280]
    - [23, 9026.0]
  - - [1856, 5888, 1, 1280, 1856, 1856, 1280, 1280]
    - [23, 9117.0]
  - - [2368, 5888, 1, 1280, 2368, 2368, 1280, 1280]
    - [23, 9083.0]
  - - [2944, 5888, 1, 1280, 2944, 2944, 1280, 1280]
    - [23, 9123.0]
  - - [3584, 5888, 1, 1280, 3584, 3584, 1280, 1280]
    - [23, 9199.0]
  - - [4288, 5888, 1, 1280, 4288, 4288, 1280, 1280]
    - [23, 9205.0]
  - - [5056, 5888, 1, 1280, 5056, 5056, 1280, 1280]
    - [24, 9259.0]
  - - [5888, 5888, 1, 1280, 5888, 5888, 1280, 1280]
    - [23, 9232.0]
  - - [6784, 5888, 1, 1280, 6784, 6784, 1280, 1280]
    - [23, 9254.0]
  - - [256, 6784, 1, 1280, 256, 256, 1280, 1280]
    - [23, 8022.0]
  - - [448, 6784, 1, 1280, 448, 448, 1280, 1280]
    - [23, 8552.0]
  - - [704, 6784, 1, 1280, 704, 704, 1280, 1280]
    - [23, 8651.0]
  - - [1024, 6784, 1, 1280, 1024, 1024, 1280, 1280]
    - [23, 8913.0]
  - - [1408, 6784, 1, 1280, 1408, 1408, 1280, 1280]
    - [23, 9032.0]
  - - [1856, 6784, 1, 1280, 1856, 1856, 1280, 1280]
    - [23, 9033.0]
  - - [2368, 6784, 1, 1280, 2368, 2368, 1280, 1280]
    - [23, 9127.0]
  - - [2944, 6784, 1, 1280, 2944, 2944, 1280, 1280]
    - [23, 9156.0]
  - - [3584, 6784, 1, 1280, 3584, 3584, 1280, 1280]
    - [23, 9239.0]
  - - [4288, 6784, 1, 1280, 4288, 4288, 1280, 1280]
    - [23, 9270.0]
  - - [5056, 6784, 1, 1280, 5056, 5056, 1280, 1280]
    - [23, 9270.0]
  - - [5888, 6784, 1, 1280, 5888, 5888, 1280, 1280]
    - [23, 9254.0]
  - - [6784, 6784, 1, 1280, 6784, 6784, 1280, 1280]
    - [24, 9298.0]
  - - [704, 256, 1, 3328, 704, 704, 3328, 3328]
    - [12, 3453.0]
  - - [1024, 256, 1, 3328, 1024, 1024, 3328, 3328]
    - [21, 4966.0]
  - - [1408, 256, 1, 3328, 1408, 1408, 3328, 3328]
    - [22, 4817.0]
  - - [1856, 256, 1, 3328, 1856, 1856, 3328, 3328]
    - [22, 6267.0]
  - - [2368, 256, 1, 3328, 2368, 2368, 3328, 3328]
    - [23, 6170.0]
  - - [2944, 256, 1, 3328, 2944, 2944, 3328, 3328]
    - [23, 7619.0]
  - - [3584, 256, 1, 3328, 3584, 3584, 3328, 3328]
    - [23, 7290.0]
  - - [4288, 256, 1, 3328, 4288, 4288, 3328, 3328]
    - [23, 6934.0]
  - - [5056, 256, 1, 3328, 5056, 5056, 3328, 3328]
    - [23, 8131.0]
  - - [5888, 256, 1, 3328, 5888, 5888, 3328, 3328]
    - [23, 8109.0]
  - - [6784, 256, 1, 3328, 6784, 6784, 3328, 3328]
    - [23, 8113.0]
  - - [704, 448, 1, 3328, 704, 704, 3328, 3328]
    - [21, 4330.0]
  - - [1024, 448, 1, 3328, 1024, 1024, 3328, 3328]
    - [22, 6003.0]
  - - [1408, 448, 1, 3328, 1408, 1408, 3328, 3328]
    - [23, 6405.0]
  - - [1856, 448, 1, 3328, 1856, 1856, 3328, 3328]
    - [23, 6643.0]
  - - [2368, 448, 1, 3328, 2368, 2368, 3328, 3328]
    - [23, 6200.0]
  - - [2944, 448, 1, 3328, 2944, 2944, 3328, 3328]
    - [25, 7085.0]
  - - [3584, 448, 1, 3328, 3584, 3584, 3328, 3328]
    - [23, 6690.0]
  - - [4288, 448, 1, 3328, 4288, 4288, 3328, 3328]
    - [25, 7905.0]
  - - [5056, 448, 1, 3328, 5056, 5056, 3328, 3328]
    - [25, 7453.0]
  - - [5888, 448, 1, 3328, 5888, 5888, 3328, 3328]
    - [23, 7444.0]
  - - [6784, 448, 1, 3328, 6784, 6784, 3328, 3328]
    - [25, 8484.0]
  - - [256, 704, 1, 3328, 256, 256, 3328, 3328]
    - [12, 3457.0]
  - - [448, 704, 1, 3328, 448, 448, 3328, 3328]
    - [21, 4319.0]
  - - [704, 704, 1, 3328, 704, 704, 3328, 3328]
    - [23, 6473.0]
  - - [1024, 704, 1, 3328, 1024, 1024, 3328, 3328]
    - [23, 7290.0]
  - - [1408, 704, 1, 3328, 1408, 1408, 3328, 3328]
    - [23, 7881.0]
  - - [1856, 704, 1, 3328, 1856, 1856, 3328, 3328]
    - [23, 8220.0]
  - - [2368, 704, 1, 3328, 2368, 2368, 3328, 3328]
    - [23, 7854.0]
  - - [2944, 704, 1, 3328, 2944, 2944, 3328, 3328]
    - [23, 8603.0]
  - - [3584, 704, 1, 3328, 3584, 3584, 3328, 3328]
    - [23, 8496.0]
  - - [4288, 704, 1, 3328, 4288, 4288, 3328, 3328]
    - [23, 8557.0]
  - - [5056, 704, 1, 3328, 5056, 5056, 3328, 3328]
    - [23, 8693.0]
  - - [5888, 704, 1, 3328, 5888, 5888, 3328, 3328]
    - [23, 8904.0]
  - - [6784, 704, 1, 3328, 6784, 6784, 3328, 3328]
    - [23, 8433.0]
  - - [256, 1024, 1, 3328, 256, 256, 3328, 3328]
    - [21, 4991.0]
  - - [448, 1024, 1, 3328, 448, 448, 3328, 3328]
    - [21, 6011.0]
  - - [704, 1024, 1, 3328, 704, 704, 3328, 3328]
    - [23, 7311.0]
  - - [1024, 1024, 1, 3328, 1024, 1024, 3328, 3328]
    - [23, 8279.0]
  - - [1408, 1024, 1, 3328, 1408, 1408, 3328, 3328]
    - [23, 7787.0]
  - - [1856, 1024, 1, 3328, 1856, 1856, 3328, 3328]
    - [23, 7897.0]
  - - [2368, 1024, 1, 3328, 2368, 2368, 3328, 3328]
    - [23, 8161.0]
  - - [2944, 1024, 1, 3328, 2944, 2944, 3328, 3328]
    - [23, 8529.0]
  - - [3584, 1024, 1, 3328, 3584, 3584, 3328, 3328]
    - [23, 8952.0]
  - - [4288, 1024, 1, 3328, 4288, 4288, 3328, 3328]
    - [23, 8642.0]
  - - [5056, 1024, 1, 3328, 5056, 5056, 3328, 3328]
    - [24, 8913.0]
  - - [5888, 1024, 1, 3328, 5888, 5888, 3328, 3328]
    - [23, 8942.0]
  - - [6784, 1024, 1, 3328, 6784, 6784, 3328, 3328]
    - [23, 8861.0]
  - - [256, 1408, 1, 3328, 256, 256, 3328, 3328]
    - [21, 4862.0]
  - - [448, 1408, 1, 3328, 448, 448, 3328, 3328]
    - [22, 6463.0]
  - - [704, 1408, 1, 3328, 704, 704, 3328, 3328]
    - [23, 7884.0]
  - - [1024, 1408, 1, 3328, 1024, 1024, 3328, 3328]
    - [23, 7766.0]
  - - [1408, 1408, 1, 3328, 1408, 1408, 3328, 3328]
    - [23, 8258.0]
  - - [1856, 1408, 1, 3328, 1856, 1856, 3328, 3328]
    - [23, 8740.0]
  - - [2368, 1408, 1, 3328, 2368, 2368, 3328, 3328]
    - [23, 8752.0]
  - - [2944, 1408, 1, 3328, 2944, 2944, 3328, 3328]
    - [23, 8909.0]
  - - [3584, 1408, 1, 3328, 3584, 3584, 3328, 3328]
    - [23, 8742.0]
  - - [4288, 1408, 1, 3328, 4288, 4288, 3328, 3328]
    - [24, 8728.0]
  - - [5056, 1408, 1, 3328, 5056, 5056, 3328, 3328]
    - [24, 8854.0]
  - - [5888, 1408, 1, 3328, 5888, 5888, 3328, 3328]
    - [24, 9053.0]
  - - [6784, 1408, 1, 3328, 6784, 6784, 3328, 3328]
    - [24, 8824.0]
  - - [256, 1856, 1, 3328, 256, 256, 3328, 3328]
    - [23, 6184.0]
  - - [448, 1856, 1, 3328, 448, 448, 3328, 3328]
    - [23, 6642.0]
  - - [704, 1856, 1, 3328, 704, 704, 3328, 3328]
    - [23, 8229.0]
  - - [1024, 1856, 1, 3328, 1024, 1024, 3328, 3328]
    - [23, 7913.0]
  - - [1408, 1856, 1, 3328, 1408, 1408, 3328, 3328]
    - [23, 8768.0]
  - - [1856, 1856, 1, 3328, 1856, 1856, 3328, 3328]
    - [23, 8412.0]
  - - [2368, 1856, 1, 3328, 2368, 2368, 3328, 3328]
    - [23, 8909.0]
  - - [2944, 1856, 1, 3328, 2944, 2944, 3328, 3328]
    - [23, 9024.0]
  - - [3584, 1856, 1, 3328, 3584, 3584, 3328, 3328]
    - [25, 8883.0]
  - - [4288, 1856, 1, 3328, 4288, 4288, 3328, 3328]
    - [25, 8696.0]
  - - [5056, 1856, 1, 3328, 5056, 5056, 3328, 3328]
    - [25, 8665.0]
  - - [5888, 1856, 1, 3328, 5888, 5888, 3328, 3328]
    - [25, 9144.0]
  - - [6784, 1856, 1, 3328, 6784, 6784, 3328, 3328]
    - [25, 8881.0]
  - - [256, 2368, 1, 3328, 256, 256, 3328, 3328]
    - [23, 6164.0]
  - - [448, 2368, 1, 3328, 448, 448, 3328, 3328]
    - [23, 6696.0]
  - - [704, 2368, 1, 3328, 704, 704, 3328, 3328]
    - [23, 7199.0]
  - - [1024, 2368, 1, 3328, 1024, 1024, 3328, 3328]
    - [23, 8178.0]
  - - [1408, 2368, 1, 3328, 1408, 1408, 3328, 3328]
    - [23, 8750.0]
  - - [1856, 2368, 1, 3328, 1856, 1856, 3328, 3328]
    - [23, 8897.0]
  - - [2368, 2368, 1, 3328, 2368, 2368, 3328, 3328]
    - [23, 8852.0]
  - - [2944, 2368, 1, 3328, 2944, 2944, 3328, 3328]
    - [23, 9014.0]
  - - [3584, 2368, 1, 3328, 3584, 3584, 3328, 3328]
    - [26, 8769.0]
  - - [4288, 2368, 1, 3328, 4288, 4288, 3328, 3328]
    - [24, 8914.0]
  - - [5056, 2368, 1, 3328, 5056, 5056, 3328, 3328]
    - [24, 8795.0]
  - - [5888, 2368, 1, 3328, 5888, 5888, 3328, 3328]
    - [25, 9106.0]
  - - [6784, 2368, 1, 3328, 6784, 6784, 3328, 3328]
    - [25, 9161.0]
  - - [256, 2944, 1, 3328, 256, 256, 3328, 3328]
    - [23, 7593.0]
  - - [448, 2944, 1, 3328, 448, 448, 3328, 3328]
    - [24, 7096.0]
  - - [704, 2944, 1, 3328, 704, 704, 3328, 3328]
    - [24, 8519.0]
  - - [1024, 2944, 1, 3328, 1024, 1024, 3328, 3328]
    - [23, 8540.0]
  - - [1408, 2944, 1, 3328, 1408, 1408, 3328, 3328]
    - [23, 8907.0]
  - - [1856, 2944, 1, 3328, 1856, 1856, 3328, 3328]
    - [23, 9022.0]
  - - [2368, 2944, 1, 3328, 2368, 2368, 3328, 3328]
    - [23, 9012.0]
  - - [2944, 2944, 1, 3328, 2944, 2944, 3328, 3328]
    - [23, 8926.0]
  - - [3584, 2944, 1, 3328, 3584, 3584, 3328, 3328]
    - [25, 8833.0]
  - - [4288, 2944, 1, 3328, 4288, 4288, 3328, 3328]
    - [24, 8905.0]
  - - [5056, 2944, 1, 3328, 5056, 5056, 3328, 3328]
    - [24, 9068.0]
  - - [5888, 2944, 1, 3328, 5888, 5888, 3328, 3328]
    - [24, 9027.0]
  - - [6784, 2944, 1, 3328, 6784, 6784, 3328, 3328]
    - [24, 9082.0]
  - - [256, 3584, 1, 3328, 256, 256, 3328, 3328]
    - [23, 7287.0]
  - - [448, 3584, 1, 3328, 448, 448, 3328, 3328]
    - [23, 6685.0]
  - - [704, 3584, 1, 3328, 704, 704, 3328, 3328]
    - [24, 8292.0]
  - - [1024, 3584, 1, 3328, 1024, 1024, 3328, 3328]
    - [23, 8941.0]
  - - [1408, 3584, 1, 3328, 1408, 1408, 3328, 3328]
    - [23, 8747.0]
  - - [1856, 3584, 1, 3328, 1856, 1856, 3328, 3328]
    - [23, 8926.0]
  - - [2368, 3584, 1, 3328, 2368, 2368, 3328, 3328]
    - [23, 8962.0]
  - - [2944, 3584, 1, 3328, 2944, 2944, 3328, 3328]
    - [23, 9037.0]
  - - [3584, 3584, 1, 3328, 3584, 3584, 3328, 3328]
    - [25, 9057.0]
  - - [4288, 3584, 1, 3328, 4288, 4288, 3328, 3328]
    - [24, 9055.0]
  - - [5056, 3584, 1, 3328, 5056, 5056, 3328, 3328]
    - [24, 9169.0]
  - - [5888, 3584, 1, 3328, 5888, 5888, 3328, 3328]
    - [25, 9126.0]
  - - [6784, 3584, 1, 3328, 6784, 6784, 3328, 3328]
    - [24, 9185.0]
  - - [256, 4288, 1, 3328, 256, 256, 3328, 3328]
    - [23, 6914.0]
  - - [448, 4288, 1, 3328, 448, 448, 3328, 3328]
    - [24, 7910.0]
  - - [704, 4288, 1, 3328, 704, 704, 3328, 3328]
    - [24, 8440.0]
  - - [1024, 4288, 1, 3328, 1024, 1024, 3328, 3328]
    - [23, 8891.0]
  - - [1408, 4288, 1, 3328, 1408, 1408, 3328, 3328]
    - [23, 8774.0]
  - - [1856, 4288, 1, 3328, 1856, 1856, 3328, 3328]
    - [23, 8983.0]
  - - [2368, 4288, 1, 3328, 2368, 2368, 3328, 3328]
    - [23, 9120.0]
  - - [2944, 4288, 1, 3328, 2944, 2944, 3328, 3328]
    - [25, 8904.0]
  - - [3584, 4288, 1, 3328, 3584, 3584, 3328, 3328]
    - [25, 9050.0]
  - - [4288, 4288, 1, 3328, 4288, 4288, 3328, 3328]
    - [25, 9046.0]
  - - [5056, 4288, 1, 3328, 5056, 5056, 3328, 3328]
    - [24, 9156.0]
  - - [5888, 4288, 1, 3328, 5888, 5888, 3328, 3328]
    - [25, 9151.0]
  - - [6784, 4288, 1, 3328, 6784, 6784, 3328, 3328]
    - [25, 9234.0]
  - - [256, 5056, 1, 3328, 256, 256, 3328, 3328]
    - [23, 8115.0]
  - - [448, 5056, 1, 3328, 448, 448, 3328, 3328]
    - [24, 7451.0]
  - - [704, 5056, 1, 3328, 704, 704, 3328, 3328]
    - [24, 8616.0]
  - - [1024, 5056, 1, 3328, 1024, 1024, 3328, 3328]
    - [23, 8961.0]
  - - [1408, 5056, 1, 3328, 1408, 1408, 3328, 3328]
    - [23, 8887.0]
  - - [1856, 5056, 1, 3328, 1856, 1856, 3328, 3328]
    - [23, 9148.0]
  - - [2368, 5056, 1, 3328, 2368, 2368, 3328, 3328]
    - [24, 8794.0]
  - - [2944, 5056, 1, 3328, 2944, 2944, 3328, 3328]
    - [25, 9071.0]
  - - [3584, 5056, 1, 3328, 3584, 3584, 3328, 3328]
    - [25, 9162.0]
  - - [4288, 5056, 1, 3328, 4288, 4288, 3328, 3328]
    - [25, 9158.0]
  - - [5056, 5056, 1, 3328, 5056, 5056, 3328, 3328]
    - [24, 9083.0]
  - - [5888, 5056, 1, 3328, 5888, 5888, 3328, 3328]
    - [25, 9288.0]
  - - [6784, 5056, 1, 3328, 6784, 6784, 3328, 3328]
    - [25, 9250.0]
  - - [256, 5888, 1, 3328, 256, 256, 3328, 3328]
    - [23, 8071.0]
  - - [448, 5888, 1, 3328, 448, 448, 3328, 3328]
    - [24, 7403.0]
  - - [704, 5888, 1, 3328, 704, 704, 3328, 3328]
    - [24, 8841.0]
  - - [1024, 5888, 1, 3328, 1024, 1024, 3328, 3328]
    - [23, 9094.0]
  - - [1408, 5888, 1, 3328, 1408, 1408, 3328, 3328]
    - [23, 9068.0]
  - - [1856, 5888, 1, 3328, 1856, 1856, 3328, 3328]
    - [23, 9144.0]
  - - [2368, 5888, 1, 3328, 2368, 2368, 3328, 3328]
    - [24, 9111.0]
  - - [2944, 5888, 1, 3328, 2944, 2944, 3328, 3328]
    - [23, 9072.0]
  - - [3584, 5888, 1, 3328, 3584, 3584, 3328, 3328]
    - [24, 9130.0]
  - - [4288, 5888, 1, 3328, 4288, 4288, 3328, 3328]
    - [24, 9155.0]
  - - [5056, 5888, 1, 3328, 5056, 5056, 3328, 3328]
    - [24, 9285.0]
  - - [5888, 5888, 1, 3328, 5888, 5888, 3328, 3328]
    - [24, 9213.0]
  - - [6784, 5888, 1, 3328, 6784, 6784, 3328, 3328]
    - [25, 9243.0]
  - - [256, 6784, 1, 3328, 256, 256, 3328, 3328]
    - [23, 8057.0]
  - - [448, 6784, 1, 3328, 448, 448, 3328, 3328]
    - [24, 8506.0]
  - - [704, 6784, 1, 3328, 704, 704, 3328, 3328]
    - [23, 8550.0]
  - - [1024, 6784, 1, 3328, 1024, 1024, 3328, 3328]
    - [23, 8974.0]
  - - [1408, 6784, 1, 3328, 1408, 1408, 3328, 3328]
    - [23, 9069.0]
  - - [1856, 6784, 1, 3328, 1856, 1856, 3328, 3328]
    - [23, 9064.0]
  - - [2368, 6784, 1, 3328, 2368, 2368, 3328, 3328]
    - [24, 9161.0]
  - - [2944, 6784, 1, 3328, 2944, 2944, 3328, 3328]
    - [23, 9135.0]
  - - [3584, 6784, 1, 3328, 3584, 3584, 3328, 3328]
    - [23, 9186.0]
  - - [4288, 6784, 1, 3328, 4288, 4288, 3328, 3328]
    - [24, 9234.0]
  - - [5056, 6784, 1, 3328, 5056, 5056, 3328, 3328]
    - [24, 9247.0]
  - - [5888, 6784, 1, 3328, 5888, 5888, 3328, 3328]
    - [25, 9247.0]
  - - [6784, 6784, 1, 3328, 6784, 6784, 3328, 3328]
    - [24, 9335.0]
  - - [1024, 1024, 1, 1024, 1024, 1024, 1024, 1024]
    - [23, 8023.0]
  - - [1760, 800, 1, 1760, 1760, 1760, 1760, 1760]
    - [23, 7544.0]
  - - [1760, 1600, 1, 1760, 1760, 1760, 1760, 1760]
    - [23, 8620.0]
  - - [1760, 3200, 1, 1760, 1760, 1760, 1760, 1760]
    - [23, 8860.0]
  - - [1760, 6400, 1, 1760, 1760, 1760, 1760, 1760]
    - [22, 9010.0]
  - - [2048, 800, 1, 2048, 2048, 2048, 2048, 2048]
    - [23, 7590.0]
  - - [2048, 1600, 1, 2048, 2048, 2048, 2048, 2048]
    - [23, 8159.0]
  - - [2048, 3200, 1, 2048, 2048, 2048, 2048, 2048]
    - [25, 8640.0]
  - - [2048, 6400, 1, 2048, 2048, 2048, 2048, 2048]
    - [23, 8802.0]
  - - [2560, 800, 1, 2560, 2560, 2560, 2560, 2560]
    - [23, 7600.0]
  - - [2560, 1600, 1, 2560, 2560, 2560, 2560, 2560]
    - [23, 8783.0]
  - - [2560, 3200, 1, 2560, 2560, 2560, 2560, 2560]
    - [23, 8958.0]
  - - [2560, 6400, 1, 2560, 2560, 2560, 2560, 2560]
    - [23, 9184.0]
  - - [2048, 400, 1, 512, 2048, 2048, 512, 512]
    - [23, 6118.0]
  - - [2048, 800, 1, 512, 2048, 2048, 512, 512]
    - [23, 7348.0]
  - - [2048, 1600, 1, 512, 2048, 2048, 512, 512]
    - [23, 8276.0]
  - - [2048, 3200, 1, 512, 2048, 2048, 512, 512]
    - [23, 8826.0]
  - - [4096, 400, 1, 1024, 4096, 4096, 1024, 1024]
    - [23, 7431.0]
  - - [4096, 800, 1, 1024, 4096, 4096, 1024, 1024]
    - [23, 8407.0]
  - - [4096, 1600, 1, 1024, 4096, 4096, 1024, 1024]
    - [23, 8972.0]
  - - [4096, 3200, 1, 1024, 4096, 4096, 1024, 1024]
    - [25, 9133.0]
  - - [8192, 400, 1, 2048, 8192, 8192, 2048, 2048]
    - [25, 7731.0]
  - - [8192, 800, 1, 2048, 8192, 8192, 2048, 2048]
    - [23, 8283.0]
  - - [8192, 1600, 1, 2048, 8192, 8192, 2048, 2048]
    - [23, 8837.0]
  - - [8192, 3200, 1, 2048, 8192, 8192, 2048, 2048]
    - [23, 8967.0]
  - - [16384, 400, 1, 4096, 16384, 16384, 4096, 4096]
    - [23, 7669.0]
  - - [16384, 800, 1, 4096, 16384, 16384, 4096, 4096]
    - [13, 8327.0]
  - - [16384, 1600, 1, 4096, 16384, 16384, 4096, 4096]
    - [23, 8836.0]
  - - [16384, 3200, 1, 4096, 16384, 16384, 4096, 4096]
    - [23, 8997.0]
  - - [8448, 48000, 1, 2816, 8448, 8448, 2816, 2816]
    - [24, 9398.0]
  - - [8448, 24000, 1, 2816, 8448, 8448, 2816, 2816]
    - [25, 9390.0]
  - - [8448, 12000, 1, 2816, 8448, 8448, 2816, 2816]
    - [24, 9355.0]
  - - [8448, 5984, 1, 2816, 8448, 8448, 2816, 2816]
    - [25, 9306.0]
  - - [6144, 48000, 1, 2048, 6144, 6144, 2048, 2048]
    - [24, 9184.0]
  - - [6144, 24000, 1, 2048, 6144, 6144, 2048, 2048]
    - [24, 9131.0]
  - - [6144, 12000, 1, 2048, 6144, 6144, 2048, 2048]
    - [25, 9036.0]
  - - [6144, 5984, 1, 2048, 6144, 6144, 2048, 2048]
    - [23, 8928.0]
  - - [4608, 48000, 1, 1536, 4608, 4608, 1536, 1536]
    - [25, 9382.0]
  - - [4608, 24000, 1, 1536, 4608, 4608, 1536, 1536]
    - [25, 9369.0]
  - - [4608, 12000, 1, 1536, 4608, 4608, 1536, 1536]
    - [25, 9282.0]
  - - [4608, 5984, 1, 1536, 4608, 4608, 1536, 1536]
    - [25, 9218.0]
  - - [7680, 48000, 1, 2560, 7680, 7680, 2560, 2560]
    - [25, 9388.0]
  - - [7680, 24000, 1, 2560, 7680, 7680, 2560, 2560]
    - [25, 9380.0]
  - - [7680, 12000, 1, 2560, 7680, 7680, 2560, 2560]
    - [25, 9323.0]
  - - [7680, 5984, 1, 2560, 7680, 7680, 2560, 2560]
    - [25, 9216.0]
  - - [1024, 700, 1, 512, 1024, 1024, 512, 512]
    - [23, 6563.0]
  - - [512, 24000, 1, 1536, 512, 512, 1536, 1536]
    - [23, 9179.0]
  - - [1760, 7000, 1, 1760, 1760, 1760, 1760, 1760]
    - [22, 8880.0]
  - - [512, 24000, 1, 2048, 512, 512, 2048, 2048]
    - [24, 8820.0]
  - - [2048, 7000, 1, 2048, 2048, 2048, 2048, 2048]
    - [23, 8785.0]
  - - [512, 24000, 1, 2560, 512, 512, 2560, 2560]
    - [23, 9193.0]
  - - [512, 24000, 1, 2816, 512, 512, 2816, 2816]
    - [23, 9204.0]
  - - [512, 48000, 1, 1536, 512, 512, 1536, 1536]
    - [25, 9251.0]
  - - [1024, 24000, 1, 1536, 1024, 1024, 1536, 1536]
    - [25, 9247.0]
  - - [2560, 7000, 1, 2560, 2560, 2560, 2560, 2560]
    - [23, 9174.0]
  - - [512, 48000, 1, 2048, 512, 512, 2048, 2048]
    - [23, 9036.0]
  - - [1024, 24000, 1, 2048, 1024, 1024, 2048, 2048]
    - [25, 9016.0]
  - - [512, 48000, 1, 2560, 512, 512, 2560, 2560]
    - [25, 9278.0]
  - - [1024, 24000, 1, 2560, 1024, 1024, 2560, 2560]
    - [25, 9272.0]
  - - [512, 48000, 1, 2816, 512, 512, 2816, 2816]
    - [25, 9282.0]
  - - [1024, 24000, 1, 2816, 1024, 1024, 2816, 2816]
    - [25, 9276.0]
  - - [1024, 48000, 1, 1536, 1024, 1024, 1536, 1536]
    - [25, 9295.0]
  - - [3072, 24000, 1, 1024, 3072, 3072, 1024, 1024]
    - [25, 9281.0]
  - - [5124, 9124, 1, 1760, 5124, 5124, 1760, 1760]
    - [23, 9169.0]
  - - [5124, 9124, 1, 2048, 5124, 5124, 2048, 2048]
    - [23, 8876.0]
  - - [1024, 48000, 1, 2048, 1024, 1024, 2048, 2048]
    - [25, 9183.0]
  - - [4096, 7000, 1, 4096, 4096, 4096, 4096, 4096]
    - [26, 9055.0]
  - - [5124, 9124, 1, 2560, 5124, 5124, 2560, 2560]
    - [24, 9080.0]
  - - [1024, 48000, 1, 2560, 1024, 1024, 2560, 2560]
    - [25, 9310.0]
  - - [1024, 48000, 1, 2816, 1024, 1024, 2816, 2816]
    - [25, 9341.0]
  - - [3072, 48000, 1, 1024, 3072, 3072, 1024, 1024]
    - [25, 9300.0]
  - - [5124, 9124, 1, 4096, 5124, 5124, 4096, 4096]
    - [23, 8898.0]
  - - [6144, 24000, 1, 2560, 6144, 6144, 2560, 2560]
    - [25, 9370.0]
  - - [6144, 48000, 1, 2560, 6144, 6144, 2560, 2560]
    - [25, 9380.0]
  - - [32, 32, 1, 32, 32, 32, 32, 32]
    - [28, 4.0]
  - - [32, 64, 1, 256, 32, 32, 256, 256]
    - [37, 18.0]
  - - [32, 128, 1, 256, 32, 32, 256, 256]
    - [37, 37.0]
  - - [32, 256, 1, 256, 32, 32, 256, 256]
    - [37, 74.0]
  - - [32, 448, 1, 256, 32, 32, 256, 256]
    - [37, 131.0]
  - - [32, 704, 1, 256, 32, 32, 256, 256]
    - [37, 208.0]
  - - [32, 1024, 1, 256, 32, 32, 256, 256]
    - [37, 303.0]
  - - [32, 1408, 1, 256, 32, 32, 256, 256]
    - [37, 422.0]
  - - [32, 1856, 1, 256, 32, 32, 256, 256]
    - [37, 549.0]
  - - [32, 2368, 1, 256, 32, 32, 256, 256]
    - [37, 689.0]
  - - [32, 2944, 1, 256, 32, 32, 256, 256]
    - [37, 821.0]
  - - [32, 3584, 1, 256, 32, 32, 256, 256]
    - [41, 1173.0]
  - - [32, 4288, 1, 256, 32, 32, 256, 256]
    - [35, 1026.0]
  - - [32, 5056, 1, 256, 32, 32, 256, 256]
    - [35, 1201.0]
  - - [32, 5888, 1, 256, 32, 32, 256, 256]
    - [39, 1399.0]
  - - [32, 6784, 1, 256, 32, 32, 256, 256]
    - [35, 1604.0]
  - - [32, 64, 1, 1280, 32, 32, 1280, 1280]
    - [53, 78.0]
  - - [32, 128, 1, 1280, 32, 32, 1280, 1280]
    - [53, 157.0]
  - - [32, 256, 1, 1280, 32, 32, 1280, 1280]
    - [53, 314.0]
  - - [32, 448, 1, 1280, 32, 32, 1280, 1280]
    - [53, 533.0]
  - - [32, 704, 1, 1280, 32, 32, 1280, 1280]
    - [53, 888.0]
  - - [32, 1024, 1, 1280, 32, 32, 1280, 1280]
    - [55, 989.0]
  - - [32, 1408, 1, 1280, 32, 32, 1280, 1280]
    - [53, 1347.0]
  - - [32, 1856, 1, 1280, 32, 32, 1280, 1280]
    - [51, 1600.0]
  - - [32, 2368, 1, 1280, 32, 32, 1280, 1280]
    - [54, 1981.0]
  - - [32, 2944, 1, 1280, 32, 32, 1280, 1280]
    - [55, 1879.0]
  - - [32, 3584, 1, 1280, 32, 32, 1280, 1280]
    - [47, 2107.0]
  - - [32, 4288, 1, 1280, 32, 32, 1280, 1280]
    - [52, 1953.0]
  - - [32, 5056, 1, 1280, 32, 32, 1280, 1280]
    - [48, 2089.0]
  - - [32, 5888, 1, 1280, 32, 32, 1280, 1280]
    - [44, 2332.0]
  - - [32, 6784, 1, 1280, 32, 32, 1280, 1280]
    - [47, 2247.0]
  - - [32, 64, 1, 3328, 32, 32, 3328, 3328]
    - [57, 137.0]
  - - [32, 128, 1, 3328, 32, 32, 3328, 3328]
    - [57, 274.0]
  - - [32, 256, 1, 3328, 32, 32, 3328, 3328]
    - [57, 542.0]
  - - [32, 448, 1, 3328, 32, 32, 3328, 3328]
    - [57, 913.0]
  - - [32, 704, 1, 3328, 32, 32, 3328, 3328]
    - [53, 1214.0]
  - - [32, 1024, 1, 3328, 32, 32, 3328, 3328]
    - [57, 1549.0]
  - - [32, 1408, 1, 3328, 32, 32, 3328, 3328]
    - [59, 1854.0]
  - - [32, 1856, 1, 3328, 32, 32, 3328, 3328]
    - [54, 1840.0]
  - - [32, 2368, 1, 3328, 32, 32, 3328, 3328]
    - [54, 2299.0]
  - - [32, 2944, 1, 3328, 32, 32, 3328, 3328]
    - [53, 2071.0]
  - - [32, 3584, 1, 3328, 32, 32, 3328, 3328]
    - [49, 2222.0]
  - - [32, 4288, 1, 3328, 32, 32, 3328, 3328]
    - [58, 2273.0]
  - - [32, 5056, 1, 3328, 32, 32, 3328, 3328]
    - [57, 2332.0]
  - - [32, 5888, 1, 3328, 32, 32, 3328, 3328]
    - [44, 2464.0]
  - - [32, 6784, 1, 3328, 32, 32, 3328, 3328]
    - [60, 2480.0]
  - - [64, 32, 1, 256, 64, 64, 256, 256]
    - [30, 18.0]
  - - [128, 32, 1, 256, 128, 128, 256, 256]
    - [37, 38.0]
  - - [256, 32, 1, 256, 256, 256, 256, 256]
    - [37, 76.0]
  - - [448, 32, 1, 256, 448, 448, 256, 256]
    - [37, 133.0]
  - - [704, 32, 1, 256, 704, 704, 256, 256]
    - [37, 208.0]
  - - [1024, 32, 1, 256, 1024, 1024, 256, 256]
    - [37, 305.0]
  - - [1408, 32, 1, 256, 1408, 1408, 256, 256]
    - [37, 417.0]
  - - [1856, 32, 1, 256, 1856, 1856, 256, 256]
    - [37, 541.0]
  - - [2368, 32, 1, 256, 2368, 2368, 256, 256]
    - [37, 685.0]
  - - [2944, 32, 1, 256, 2944, 2944, 256, 256]
    - [37, 876.0]
  - - [3584, 32, 1, 256, 3584, 3584, 256, 256]
    - [37, 1227.0]
  - - [4288, 32, 1, 256, 4288, 4288, 256, 256]
    - [35, 1063.0]
  - - [5056, 32, 1, 256, 5056, 5056, 256, 256]
    - [35, 1251.0]
  - - [5888, 32, 1, 256, 5888, 5888, 256, 256]
    - [35, 1446.0]
  - - [6784, 32, 1, 256, 6784, 6784, 256, 256]
    - [35, 1658.0]
  - - [64, 32, 1, 1280, 64, 64, 1280, 1280]
    - [53, 80.0]
  - - [128, 32, 1, 1280, 128, 128, 1280, 1280]
    - [53, 164.0]
  - - [256, 32, 1, 1280, 256, 256, 1280, 1280]
    - [53, 334.0]
  - - [448, 32, 1, 1280, 448, 448, 1280, 1280]
    - [53, 576.0]
  - - [704, 32, 1, 1280, 704, 704, 1280, 1280]
    - [53, 982.0]
  - - [1024, 32, 1, 1280, 1024, 1024, 1280, 1280]
    - [51, 964.0]
  - - [1408, 32, 1, 1280, 1408, 1408, 1280, 1280]
    - [51, 1340.0]
  - - [1856, 32, 1, 1280, 1856, 1856, 1280, 1280]
    - [54, 1608.0]
  - - [2368, 32, 1, 1280, 2368, 2368, 1280, 1280]
    - [54, 2127.0]
  - - [2944, 32, 1, 1280, 2944, 2944, 1280, 1280]
    - [50, 1908.0]
  - - [3584, 32, 1, 1280, 3584, 3584, 1280, 1280]
    - [47, 2126.0]
  - - [4288, 32, 1, 1280, 4288, 4288, 1280, 1280]
    - [50, 1911.0]
  - - [5056, 32, 1, 1280, 5056, 5056, 1280, 1280]
    - [46, 2115.0]
  - - [5888, 32, 1, 1280, 5888, 5888, 1280, 1280]
    - [43, 2250.0]
  - - [6784, 32, 1, 1280, 6784, 6784, 1280, 1280]
    - [45, 2250.0]
  - - [64, 32, 1, 3328, 64, 64, 3328, 3328]
    - [57, 137.0]
  - - [128, 32, 1, 3328, 128, 128, 3328, 3328]
    - [57, 272.0]
  - - [256, 32, 1, 3328, 256, 256, 3328, 3328]
    - [57, 556.0]
  - - [448, 32, 1, 3328, 448, 448, 3328, 3328]
    - [57, 981.0]
  - - [704, 32, 1, 3328, 704, 704, 3328, 3328]
    - [53, 1177.0]
  - - [1024, 32, 1, 3328, 1024, 1024, 3328, 3328]
    - [57, 1604.0]
  - - [1408, 32, 1, 3328, 1408, 1408, 3328, 3328]
    - [56, 1897.0]
  - - [1856, 32, 1, 3328, 1856, 1856, 3328, 3328]
    - [54, 1836.0]
  - - [2368, 32, 1, 3328, 2368, 2368, 3328, 3328]
    - [54, 2313.0]
  - - [2944, 32, 1, 3328, 2944, 2944, 3328, 3328]
    - [53, 2064.0]
  - - [3584, 32, 1, 3328, 3584, 3584, 3328, 3328]
    - [49, 2214.0]
  - - [4288, 32, 1, 3328, 4288, 4288, 3328, 3328]
    - [57, 2156.0]
  - - [5056, 32, 1, 3328, 5056, 5056, 3328, 3328]
    - [61, 2251.0]
  - - [5888, 32, 1, 3328, 5888, 5888, 3328, 3328]
    - [44, 2364.0]
  - - [6784, 32, 1, 3328, 6784, 6784, 3328, 3328]
    - [62, 2395.0]
  - - [64, 64, 1, 32, 64, 64, 32, 32]
    - [32, 13.0]
  - - [128, 64, 1, 32, 128, 128, 32, 32]
    - [28, 26.0]
  - - [256, 64, 1, 32, 256, 256, 32, 32]
    - [35, 74.0]
  - - [448, 64, 1, 32, 448, 448, 32, 32]
    - [28, 93.0]
  - - [704, 64, 1, 32, 704, 704, 32, 32]
    - [28, 144.0]
  - - [1024, 64, 1, 32, 1024, 1024, 32, 32]
    - [28, 205.0]
  - - [1408, 64, 1, 32, 1408, 1408, 32, 32]
    - [32, 295.0]
  - - [1856, 64, 1, 32, 1856, 1856, 32, 32]
    - [28, 393.0]
  - - [2368, 64, 1, 32, 2368, 2368, 32, 32]
    - [28, 493.0]
  - - [2944, 64, 1, 32, 2944, 2944, 32, 32]
    - [28, 608.0]
  - - [3584, 64, 1, 32, 3584, 3584, 32, 32]
    - [30, 1008.0]
  - - [4288, 64, 1, 32, 4288, 4288, 32, 32]
    - [39, 915.0]
  - - [5056, 64, 1, 32, 5056, 5056, 32, 32]
    - [35, 1061.0]
  - - [5888, 64, 1, 32, 5888, 5888, 32, 32]
    - [35, 1236.0]
  - - [6784, 64, 1, 32, 6784, 6784, 32, 32]
    - [28, 1389.0]
  - - [64, 128, 1, 32, 64, 64, 32, 32]
    - [32, 26.0]
  - - [128, 128, 1, 32, 128, 128, 32, 32]
    - [41, 78.0]
  - - [256, 128, 1, 32, 256, 256, 32, 32]
    - [32, 108.0]
  - - [448, 128, 1, 32, 448, 448, 32, 32]
    - [28, 188.0]
  - - [704, 128, 1, 32, 704, 704, 32, 32]
    - [28, 303.0]
  - - [1024, 128, 1, 32, 1024, 1024, 32, 32]
    - [28, 426.0]
  - - [1408, 128, 1, 32, 1408, 1408, 32, 32]
    - [28, 601.0]
  - - [1856, 128, 1, 32, 1856, 1856, 32, 32]
    - [30, 1145.0]
  - - [2368, 128, 1, 32, 2368, 2368, 32, 32]
    - [35, 994.0]
  - - [2944, 128, 1, 32, 2944, 2944, 32, 32]
    - [28, 1206.0]
  - - [3584, 128, 1, 32, 3584, 3584, 32, 32]
    - [33, 1061.0]
  - - [4288, 128, 1, 32, 4288, 4288, 32, 32]
    - [28, 1525.0]
  - - [5056, 128, 1, 32, 5056, 5056, 32, 32]
    - [39, 1761.0]
  - - [5888, 128, 1, 32, 5888, 5888, 32, 32]
    - [41, 1838.0]
  - - [6784, 128, 1, 32, 6784, 6784, 32, 32]
    - [28, 1985.0]
  - - [64, 256, 1, 32, 64, 64, 32, 32]
    - [28, 52.0]
  - - [128, 256, 1, 32, 128, 128, 32, 32]
    - [28, 106.0]
  - - [256, 256, 1, 32, 256, 256, 32, 32]
    - [28, 210.0]
  - - [448, 256, 1, 32, 448, 448, 32, 32]
    - [28, 364.0]
  - - [704, 256, 1, 32, 704, 704, 32, 32]
    - [32, 586.0]
  - - [1024, 256, 1, 32, 1024, 1024, 32, 32]
    - [30, 1165.0]
  - - [1408, 256, 1, 32, 1408, 1408, 32, 32]
    - [35, 1153.0]
  - - [1856, 256, 1, 32, 1856, 1856, 32, 32]
    - [35, 1558.0]
  - - [2368, 256, 1, 32, 2368, 2368, 32, 32]
    - [35, 1661.0]
  - - [2944, 256, 1, 32, 2944, 2944, 32, 32]
    - [40, 2010.0]
  - - [3584, 256, 1, 32, 3584, 3584, 32, 32]
    - [30, 1882.0]
  - - [4288, 256, 1, 32, 4288, 4288, 32, 32]
    - [28, 2240.0]
  - - [5056, 256, 1, 32, 5056, 5056, 32, 32]
    - [28, 2550.0]
  - - [5888, 256, 1, 32, 5888, 5888, 32, 32]
    - [36, 2364.0]
  - - [6784, 256, 1, 32, 6784, 6784, 32, 32]
    - [28, 2517.0]
  - - [64, 448, 1, 32, 64, 64, 32, 32]
    - [28, 94.0]
  - - [128, 448, 1, 32, 128, 128, 32, 32]
    - [28, 186.0]
  - - [256, 448, 1, 32, 256, 256, 32, 32]
    - [32, 373.0]
  - - [448, 448, 1, 32, 448, 448, 32, 32]
    - [28, 642.0]
  - - [704, 448, 1, 32, 704, 704, 32, 32]
    - [39, 1043.0]
  - - [1024, 448, 1, 32, 1024, 1024, 32, 32]
    - [32, 1330.0]
  - - [1408, 448, 1, 32, 1408, 1408, 32, 32]
    - [32, 1728.0]
  - - [1856, 448, 1, 32, 1856, 1856, 32, 32]
    - [28, 1945.0]
  - - [2368, 448, 1, 32, 2368, 2368, 32, 32]
    - [39, 2050.0]
  - - [2944, 448, 1, 32, 2944, 2944, 32, 32]
    - [29, 2304.0]
  - - [3584, 448, 1, 32, 3584, 3584, 32, 32]
    - [42, 2294.0]
  - - [4288, 448, 1, 32, 4288, 4288, 32, 32]
    - [40, 2544.0]
  - - [5056, 448, 1, 32, 5056, 5056, 32, 32]
    - [42, 2657.0]
  - - [5888, 448, 1, 32, 5888, 5888, 32, 32]
    - [42, 2678.0]
  - - [6784, 448, 1, 32, 6784, 6784, 32, 32]
    - [40, 2847.0]
  - - [64, 704, 1, 32, 64, 64, 32, 32]
    - [32, 150.0]
  - - [128, 704, 1, 32, 128, 128, 32, 32]
    - [32, 293.0]
  - - [256, 704, 1, 32, 256, 256, 32, 32]
    - [28, 586.0]
  - - [448, 704, 1, 32, 448, 448, 32, 32]
    - [39, 1051.0]
  - - [704, 704, 1, 32, 704, 704, 32, 32]
    - [39, 1638.0]
  - - [1024, 704, 1, 32, 1024, 1024, 32, 32]
    - [40, 1802.0]
  - - [1408, 704, 1, 32, 1408, 1408, 32, 32]
    - [35, 2227.0]
  - - [1856, 704, 1, 32, 1856, 1856, 32, 32]
    - [32, 2525.0]
  - - [2368, 704, 1, 32, 2368, 2368, 32, 32]
    - [28, 2545.0]
  - - [2944, 704, 1, 32, 2944, 2944, 32, 32]
    - [40, 2718.0]
  - - [3584, 704, 1, 32, 3584, 3584, 32, 32]
    - [40, 2684.0]
  - - [4288, 704, 1, 32, 4288, 4288, 32, 32]
    - [32, 2903.0]
  - - [5056, 704, 1, 32, 5056, 5056, 32, 32]
    - [30, 3004.0]
  - - [5888, 704, 1, 32, 5888, 5888, 32, 32]
    - [40, 2982.0]
  - - [6784, 704, 1, 32, 6784, 6784, 32, 32]
    - [40, 3008.0]
  - - [64, 1024, 1, 32, 64, 64, 32, 32]
    - [32, 217.0]
  - - [128, 1024, 1, 32, 128, 128, 32, 32]
    - [28, 437.0]
  - - [256, 1024, 1, 32, 256, 256, 32, 32]
    - [30, 1205.0]
  - - [448, 1024, 1, 32, 448, 448, 32, 32]
    - [39, 1517.0]
  - - [704, 1024, 1, 32, 704, 704, 32, 32]
    - [39, 1989.0]
  - - [1024, 1024, 1, 32, 1024, 1024, 32, 32]
    - [42, 1942.0]
  - - [1408, 1024, 1, 32, 1408, 1408, 32, 32]
    - [32, 2486.0]
  - - [1856, 1024, 1, 32, 1856, 1856, 32, 32]
    - [27, 2640.0]
  - - [2368, 1024, 1, 32, 2368, 2368, 32, 32]
    - [32, 2687.0]
  - - [2944, 1024, 1, 32, 2944, 2944, 32, 32]
    - [40, 2747.0]
  - - [3584, 1024, 1, 32, 3584, 3584, 32, 32]
    - [40, 2862.0]
  - - [4288, 1024, 1, 32, 4288, 4288, 32, 32]
    - [30, 3125.0]
  - - [5056, 1024, 1, 32, 5056, 5056, 32, 32]
    - [31, 3216.0]
  - - [5888, 1024, 1, 32, 5888, 5888, 32, 32]
    - [42, 3037.0]
  - - [6784, 1024, 1, 32, 6784, 6784, 32, 32]
    - [30, 3224.0]
  - - [64, 1408, 1, 32, 64, 64, 32, 32]
    - [28, 295.0]
  - - [128, 1408, 1, 32, 128, 128, 32, 32]
    - [28, 581.0]
  - - [256, 1408, 1, 32, 256, 256, 32, 32]
    - [35, 1192.0]
  - - [448, 1408, 1, 32, 448, 448, 32, 32]
    - [28, 1728.0]
  - - [704, 1408, 1, 32, 704, 704, 32, 32]
    - [35, 2266.0]
  - - [1024, 1408, 1, 32, 1024, 1024, 32, 32]
    - [29, 1975.0]
  - - [1408, 1408, 1, 32, 1408, 1408, 32, 32]
    - [34, 2706.0]
  - - [1856, 1408, 1, 32, 1856, 1856, 32, 32]
    - [29, 2880.0]
  - - [2368, 1408, 1, 32, 2368, 2368, 32, 32]
    - [32, 2938.0]
  - - [2944, 1408, 1, 32, 2944, 2944, 32, 32]
    - [34, 3042.0]
  - - [3584, 1408, 1, 32, 3584, 3584, 32, 32]
    - [40, 2938.0]
  - - [4288, 1408, 1, 32, 4288, 4288, 32, 32]
    - [30, 3233.0]
  - - [5056, 1408, 1, 32, 5056, 5056, 32, 32]
    - [27, 3262.0]
  - - [5888, 1408, 1, 32, 5888, 5888, 32, 32]
    - [38, 3216.0]
  - - [6784, 1408, 1, 32, 6784, 6784, 32, 32]
    - [30, 3299.0]
  - - [64, 1856, 1, 32, 64, 64, 32, 32]
    - [28, 389.0]
  - - [128, 1856, 1, 32, 128, 128, 32, 32]
    - [28, 1092.0]
  - - [256, 1856, 1, 32, 256, 256, 32, 32]
    - [28, 1533.0]
  - - [448, 1856, 1, 32, 448, 448, 32, 32]
    - [28, 1945.0]
  - - [704, 1856, 1, 32, 704, 704, 32, 32]
    - [28, 2431.0]
  - - [1024, 1856, 1, 32, 1024, 1024, 32, 32]
    - [38, 2129.0]
  - - [1408, 1856, 1, 32, 1408, 1408, 32, 32]
    - [40, 2856.0]
  - - [1856, 1856, 1, 32, 1856, 1856, 32, 32]
    - [30, 2957.0]
  - - [2368, 1856, 1, 32, 2368, 2368, 32, 32]
    - [30, 3101.0]
  - - [2944, 1856, 1, 32, 2944, 2944, 32, 32]
    - [30, 2990.0]
  - - [3584, 1856, 1, 32, 3584, 3584, 32, 32]
    - [42, 3017.0]
  - - [4288, 1856, 1, 32, 4288, 4288, 32, 32]
    - [30, 3295.0]
  - - [5056, 1856, 1, 32, 5056, 5056, 32, 32]
    - [30, 3354.0]
  - - [5888, 1856, 1, 32, 5888, 5888, 32, 32]
    - [40, 3267.0]
  - - [6784, 1856, 1, 32, 6784, 6784, 32, 32]
    - [30, 3398.0]
  - - [64, 2368, 1, 32, 64, 64, 32, 32]
    - [28, 501.0]
  - - [128, 2368, 1, 32, 128, 128, 32, 32]
    - [32, 1019.0]
  - - [256, 2368, 1, 32, 256, 256, 32, 32]
    - [28, 1684.0]
  - - [448, 2368, 1, 32, 448, 448, 32, 32]
    - [35, 2040.0]
  - - [704, 2368, 1, 32, 704, 704, 32, 32]
    - [42, 2443.0]
  - - [1024, 2368, 1, 32, 1024, 1024, 32, 32]
    - [38, 2343.0]
  - - [1408, 2368, 1, 32, 1408, 1408, 32, 32]
    - [42, 2880.0]
  - - [1856, 2368, 1, 32, 1856, 1856, 32, 32]
    - [30, 3095.0]
  - - [2368, 2368, 1, 32, 2368, 2368, 32, 32]
    - [30, 3191.0]
  - - [2944, 2368, 1, 32, 2944, 2944, 32, 32]
    - [30, 3162.0]
  - - [3584, 2368, 1, 32, 3584, 3584, 32, 32]
    - [40, 3103.0]
  - - [4288, 2368, 1, 32, 4288, 4288, 32, 32]
    - [30, 3371.0]
  - - [5056, 2368, 1, 32, 5056, 5056, 32, 32]
    - [30, 3411.0]
  - - [5888, 2368, 1, 32, 5888, 5888, 32, 32]
    - [34, 3310.0]
  - - [6784, 2368, 1, 32, 6784, 6784, 32, 32]
    - [30, 3453.0]
  - - [64, 2944, 1, 32, 64, 64, 32, 32]
    - [28, 598.0]
  - - [128, 2944, 1, 32, 128, 128, 32, 32]
    - [28, 1225.0]
  - - [256, 2944, 1, 32, 256, 256, 32, 32]
    - [42, 1816.0]
  - - [448, 2944, 1, 32, 448, 448, 32, 32]
    - [29, 2127.0]
  - - [704, 2944, 1, 32, 704, 704, 32, 32]
    - [31, 2683.0]
  - - [1024, 2944, 1, 32, 1024, 1024, 32, 32]
    - [42, 2323.0]
  - - [1408, 2944, 1, 32, 1408, 1408, 32, 32]
    - [40, 3037.0]
  - - [1856, 2944, 1, 32, 1856, 1856, 32, 32]
    - [30, 3191.0]
  - - [2368, 2944, 1, 32, 2368, 2368, 32, 32]
    - [30, 3273.0]
  - - [2944, 2944, 1, 32, 2944, 2944, 32, 32]
    - [30, 3327.0]
  - - [3584, 2944, 1, 32, 3584, 3584, 32, 32]
    - [42, 3152.0]
  - - [4288, 2944, 1, 32, 4288, 4288, 32, 32]
    - [29, 3452.0]
  - - [5056, 2944, 1, 32, 5056, 5056, 32, 32]
    - [34, 3500.0]
  - - [5888, 2944, 1, 32, 5888, 5888, 32, 32]
    - [38, 3411.0]
  - - [6784, 2944, 1, 32, 6784, 6784, 32, 32]
    - [38, 3544.0]
  - - [64, 3584, 1, 32, 64, 64, 32, 32]
    - [28, 695.0]
  - - [128, 3584, 1, 32, 128, 128, 32, 32]
    - [28, 1492.0]
  - - [256, 3584, 1, 32, 256, 256, 32, 32]
    - [28, 1984.0]
  - - [448, 3584, 1, 32, 448, 448, 32, 32]
    - [42, 2269.0]
  - - [704, 3584, 1, 32, 704, 704, 32, 32]
    - [42, 2684.0]
  - - [1024, 3584, 1, 32, 1024, 1024, 32, 32]
    - [40, 2484.0]
  - - [1408, 3584, 1, 32, 1408, 1408, 32, 32]
    - [38, 3115.0]
  - - [1856, 3584, 1, 32, 1856, 1856, 32, 32]
    - [27, 3253.0]
  - - [2368, 3584, 1, 32, 2368, 2368, 32, 32]
    - [29, 3312.0]
  - - [2944, 3584, 1, 32, 2944, 2944, 32, 32]
    - [30, 3321.0]
  - - [3584, 3584, 1, 32, 3584, 3584, 32, 32]
    - [42, 3154.0]
  - - [4288, 3584, 1, 32, 4288, 4288, 32, 32]
    - [29, 3493.0]
  - - [5056, 3584, 1, 32, 5056, 5056, 32, 32]
    - [27, 3529.0]
  - - [5888, 3584, 1, 32, 5888, 5888, 32, 32]
    - [34, 3424.0]
  - - [6784, 3584, 1, 32, 6784, 6784, 32, 32]
    - [29, 3546.0]
  - - [64, 4288, 1, 32, 64, 64, 32, 32]
    - [35, 851.0]
  - - [128, 4288, 1, 32, 128, 128, 32, 32]
    - [40, 1372.0]
  - - [256, 4288, 1, 32, 256, 256, 32, 32]
    - [28, 1978.0]
  - - [448, 4288, 1, 32, 448, 448, 32, 32]
    - [34, 2650.0]
  - - [704, 4288, 1, 32, 704, 704, 32, 32]
    - [29, 2882.0]
  - - [1024, 4288, 1, 32, 1024, 1024, 32, 32]
    - [40, 2433.0]
  - - [1408, 4288, 1, 32, 1408, 1408, 32, 32]
    - [40, 3120.0]
  - - [1856, 4288, 1, 32, 1856, 1856, 32, 32]
    - [30, 3323.0]
  - - [2368, 4288, 1, 32, 2368, 2368, 32, 32]
    - [38, 3373.0]
  - - [2944, 4288, 1, 32, 2944, 2944, 32, 32]
    - [30, 3360.0]
  - - [3584, 4288, 1, 32, 3584, 3584, 32, 32]
    - [40, 3207.0]
  - - [4288, 4288, 1, 32, 4288, 4288, 32, 32]
    - [34, 3509.0]
  - - [5056, 4288, 1, 32, 5056, 5056, 32, 32]
    - [29, 3563.0]
  - - [5888, 4288, 1, 32, 5888, 5888, 32, 32]
    - [38, 3467.0]
  - - [6784, 4288, 1, 32, 6784, 6784, 32, 32]
    - [30, 3544.0]
  - - [64, 5056, 1, 32, 64, 64, 32, 32]
    - [35, 1097.0]
  - - [128, 5056, 1, 32, 128, 128, 32, 32]
    - [30, 1692.0]
  - - [256, 5056, 1, 32, 256, 256, 32, 32]
    - [32, 2576.0]
  - - [448, 5056, 1, 32, 448, 448, 32, 32]
    - [40, 2673.0]
  - - [704, 5056, 1, 32, 704, 704, 32, 32]
    - [38, 2972.0]
  - - [1024, 5056, 1, 32, 1024, 1024, 32, 32]
    - [40, 2519.0]
  - - [1408, 5056, 1, 32, 1408, 1408, 32, 32]
    - [40, 3175.0]
  - - [1856, 5056, 1, 32, 1856, 1856, 32, 32]
    - [30, 3366.0]
  - - [2368, 5056, 1, 32, 2368, 2368, 32, 32]
    - [29, 3433.0]
  - - [2944, 5056, 1, 32, 2944, 2944, 32, 32]
    - [30, 3406.0]
  - - [3584, 5056, 1, 32, 3584, 3584, 32, 32]
    - [34, 3224.0]
  - - [4288, 5056, 1, 32, 4288, 4288, 32, 32]
    - [38, 3560.0]
  - - [5056, 5056, 1, 32, 5056, 5056, 32, 32]
    - [29, 3609.0]
  - - [5888, 5056, 1, 32, 5888, 5888, 32, 32]
    - [34, 3491.0]
  - - [6784, 5056, 1, 32, 6784, 6784, 32, 32]
    - [34, 3572.0]
  - - [64, 5888, 1, 32, 64, 64, 32, 32]
    - [35, 1277.0]
  - - [128, 5888, 1, 32, 128, 128, 32, 32]
    - [40, 2010.0]
  - - [256, 5888, 1, 32, 256, 256, 32, 32]
    - [32, 2566.0]
  - - [448, 5888, 1, 32, 448, 448, 32, 32]
    - [40, 2685.0]
  - - [704, 5888, 1, 32, 704, 704, 32, 32]
    - [27, 3088.0]
  - - [1024, 5888, 1, 32, 1024, 1024, 32, 32]
    - [40, 2621.0]
  - - [1408, 5888, 1, 32, 1408, 1408, 32, 32]
    - [34, 3346.0]
  - - [1856, 5888, 1, 32, 1856, 1856, 32, 32]
    - [34, 3447.0]
  - - [2368, 5888, 1, 32, 2368, 2368, 32, 32]
    - [34, 3499.0]
  - - [2944, 5888, 1, 32, 2944, 2944, 32, 32]
    - [34, 3484.0]
  - - [3584, 5888, 1, 32, 3584, 3584, 32, 32]
    - [42, 3276.0]
  - - [4288, 5888, 1, 32, 4288, 4288, 32, 32]
    - [29, 3617.0]
  - - [5056, 5888, 1, 32, 5056, 5056, 32, 32]
    - [29, 3648.0]
  - - [5888, 5888, 1, 32, 5888, 5888, 32, 32]
    - [38, 3542.0]
  - - [6784, 5888, 1, 32, 6784, 6784, 32, 32]
    - [38, 3627.0]
  - - [64, 6784, 1, 32, 64, 64, 32, 32]
    - [35, 1472.0]
  - - [128, 6784, 1, 32, 128, 128, 32, 32]
    - [28, 1888.0]
  - - [256, 6784, 1, 32, 256, 256, 32, 32]
    - [32, 2429.0]
  - - [448, 6784, 1, 32, 448, 448, 32, 32]
    - [29, 2782.0]
  - - [704, 6784, 1, 32, 704, 704, 32, 32]
    - [29, 2962.0]
  - - [1024, 6784, 1, 32, 1024, 1024, 32, 32]
    - [40, 2592.0]
  - - [1408, 6784, 1, 32, 1408, 1408, 32, 32]
    - [40, 3238.0]
  - - [1856, 6784, 1, 32, 1856, 1856, 32, 32]
    - [38, 3431.0]
  - - [2368, 6784, 1, 32, 2368, 2368, 32, 32]
    - [34, 3498.0]
  - - [2944, 6784, 1, 32, 2944, 2944, 32, 32]
    - [38, 3530.0]
  - - [3584, 6784, 1, 32, 3584, 3584, 32, 32]
    - [38, 3290.0]
  - - [4288, 6784, 1, 32, 4288, 4288, 32, 32]
    - [29, 3637.0]
  - - [5056, 6784, 1, 32, 5056, 5056, 32, 32]
    - [29, 3678.0]
  - - [5888, 6784, 1, 32, 5888, 5888, 32, 32]
    - [38, 3598.0]
  - - [6784, 6784, 1, 32, 6784, 6784, 32, 32]
    - [38, 3643.0]
  - - [32, 32, 1, 256, 32, 32, 256, 256]
    - [37, 10.0]
  - - [32, 32, 1, 1280, 32, 32, 1280, 1280]
    - [53, 42.0]
  - - [32, 32, 1, 3328, 32, 32, 3328, 3328]
    - [57, 70.0]
  - - [32, 64, 1, 32, 32, 32, 32, 32]
    - [28, 7.0]
  - - [32, 128, 1, 32, 32, 32, 32, 32]
    - [28, 15.0]
  - - [32, 256, 1, 32, 32, 32, 32, 32]
    - [28, 31.0]
  - - [32, 448, 1, 32, 32, 32, 32, 32]
    - [28, 54.0]
  - - [32, 704, 1, 32, 32, 32, 32, 32]
    - [28, 85.0]
  - - [32, 1024, 1, 32, 32, 32, 32, 32]
    - [28, 124.0]
  - - [32, 1408, 1, 32, 32, 32, 32, 32]
    - [28, 172.0]
  - - [32, 1856, 1, 32, 32, 32, 32, 32]
    - [28, 224.0]
  - - [32, 2368, 1, 32, 32, 32, 32, 32]
    - [32, 291.0]
  - - [32, 2944, 1, 32, 32, 32, 32, 32]
    - [28, 349.0]
  - - [32, 3584, 1, 32, 32, 32, 32, 32]
    - [32, 410.0]
  - - [32, 4288, 1, 32, 32, 32, 32, 32]
    - [35, 543.0]
  - - [32, 5056, 1, 32, 32, 32, 32, 32]
    - [28, 628.0]
  - - [32, 5888, 1, 32, 32, 32, 32, 32]
    - [35, 725.0]
  - - [32, 6784, 1, 32, 32, 32, 32, 32]
    - [28, 819.0]
  - - [64, 32, 1, 32, 64, 64, 32, 32]
    - [28, 8.0]
  - - [128, 32, 1, 32, 128, 128, 32, 32]
    - [28, 15.0]
  - - [256, 32, 1, 32, 256, 256, 32, 32]
    - [39, 43.0]
  - - [448, 32, 1, 32, 448, 448, 32, 32]
    - [32, 55.0]
  - - [704, 32, 1, 32, 704, 704, 32, 32]
    - [32, 87.0]
  - - [1024, 32, 1, 32, 1024, 1024, 32, 32]
    - [28, 122.0]
  - - [1408, 32, 1, 32, 1408, 1408, 32, 32]
    - [28, 170.0]
  - - [1856, 32, 1, 32, 1856, 1856, 32, 32]
    - [28, 222.0]
  - - [2368, 32, 1, 32, 2368, 2368, 32, 32]
    - [32, 271.0]
  - - [2944, 32, 1, 32, 2944, 2944, 32, 32]
    - [39, 319.0]
  - - [3584, 32, 1, 32, 3584, 3584, 32, 32]
    - [28, 473.0]
  - - [4288, 32, 1, 32, 4288, 4288, 32, 32]
    - [35, 533.0]
  - - [5056, 32, 1, 32, 5056, 5056, 32, 32]
    - [28, 634.0]
  - - [5888, 32, 1, 32, 5888, 5888, 32, 32]
    - [35, 739.0]
  - - [6784, 32, 1, 32, 6784, 6784, 32, 32]
    - [32, 812.0]
  - - [1, 1, 1, 1, 1, 1, 1, 1]
    - [69, 0.0002232142797524553]
  - - [1, 64, 1, 256, 1, 1, 256, 256]
    - [67, 1.0]
  - - [1, 128, 1, 256, 1, 1, 256, 256]
    - [64, 1.0]
  - - [1, 256, 1, 256, 1, 1, 256, 256]
    - [65, 2.0]
  - - [1, 448, 1, 256, 1, 1, 256, 256]
    - [67, 4.0]
  - - [1, 704, 1, 256, 1, 1, 256, 256]
    - [67, 6.0]
  - - [1, 1024, 1, 256, 1, 1, 256, 256]
    - [67, 9.0]
  - - [1, 1408, 1, 256, 1, 1, 256, 256]
    - [67, 13.0]
  - - [1, 1856, 1, 256, 1, 1, 256, 256]
    - [67, 17.0]
  - - [1, 2368, 1, 256, 1, 1, 256, 256]
    - [67, 22.0]
  - - [1, 2944, 1, 256, 1, 1, 256, 256]
    - [67, 26.0]
  - - [1, 3584, 1, 256, 1, 1, 256, 256]
    - [67, 32.0]
  - - [1, 4288, 1, 256, 1, 1, 256, 256]
    - [67, 32.0]
  - - [1, 5056, 1, 256, 1, 1, 256, 256]
    - [67, 38.0]
  - - [1, 5888, 1, 256, 1, 1, 256, 256]
    - [67, 44.0]
  - - [1, 6784, 1, 256, 1, 1, 256, 256]
    - [67, 51.0]
  - - [1, 64, 1, 1280, 1, 1, 1280, 1280]
    - [78, 3.0]
  - - [1, 128, 1, 1280, 1, 1, 1280, 1280]
    - [78, 5.0]
  - - [1, 256, 1, 1280, 1, 1, 1280, 1280]
    - [78, 10.0]
  - - [1, 448, 1, 1280, 1, 1, 1280, 1280]
    - [78, 18.0]
  - - [1, 704, 1, 1280, 1, 1, 1280, 1280]
    - [80, 31.0]
  - - [1, 1024, 1, 1280, 1, 1, 1280, 1280]
    - [78, 34.0]
  - - [1, 1408, 1, 1280, 1, 1, 1280, 1280]
    - [78, 44.0]
  - - [1, 1856, 1, 1280, 1, 1, 1280, 1280]
    - [78, 48.0]
  - - [1, 2368, 1, 1280, 1, 1, 1280, 1280]
    - [80, 61.0]
  - - [1, 2944, 1, 1280, 1, 1, 1280, 1280]
    - [79, 63.0]
  - - [1, 3584, 1, 1280, 1, 1, 1280, 1280]
    - [78, 62.0]
  - - [1, 4288, 1, 1280, 1, 1, 1280, 1280]
    - [79, 70.0]
  - - [1, 5056, 1, 1280, 1, 1, 1280, 1280]
    - [77, 69.0]
  - - [1, 5888, 1, 1280, 1, 1, 1280, 1280]
    - [79, 73.0]
  - - [1, 6784, 1, 1280, 1, 1, 1280, 1280]
    - [77, 76.0]
  - - [1, 64, 1, 3328, 1, 1, 3328, 3328]
    - [82, 4.0]
  - - [1, 128, 1, 3328, 1, 1, 3328, 3328]
    - [84, 9.0]
  - - [1, 256, 1, 3328, 1, 1, 3328, 3328]
    - [82, 17.0]
  - - [1, 448, 1, 3328, 1, 1, 3328, 3328]
    - [84, 30.0]
  - - [1, 704, 1, 3328, 1, 1, 3328, 3328]
    - [81, 36.0]
  - - [1, 1024, 1, 3328, 1, 1, 3328, 3328]
    - [82, 52.0]
  - - [1, 1408, 1, 3328, 1, 1, 3328, 3328]
    - [82, 54.0]
  - - [1, 1856, 1, 3328, 1, 1, 3328, 3328]
    - [82, 58.0]
  - - [1, 2368, 1, 3328, 1, 1, 3328, 3328]
    - [78, 67.0]
  - - [1, 2944, 1, 3328, 1, 1, 3328, 3328]
    - [79, 69.0]
  - - [1, 3584, 1, 3328, 1, 1, 3328, 3328]
    - [82, 71.0]
  - - [1, 4288, 1, 3328, 1, 1, 3328, 3328]
    - [83, 77.0]
  - - [1, 5056, 1, 3328, 1, 1, 3328, 3328]
    - [82, 80.0]
  - - [1, 5888, 1, 3328, 1, 1, 3328, 3328]
    - [79, 78.0]
  - - [1, 6784, 1, 3328, 1, 1, 3328, 3328]
    - [83, 85.0]
  - - [64, 1, 1, 256, 64, 64, 256, 256]
    - [67, 1.0]
  - - [128, 1, 1, 256, 128, 128, 256, 256]
    - [64, 1.0]
  - - [256, 1, 1, 256, 256, 256, 256, 256]
    - [74, 3.0]
  - - [448, 1, 1, 256, 448, 448, 256, 256]
    - [67, 4.0]
  - - [704, 1, 1, 256, 704, 704, 256, 256]
    - [67, 7.0]
  - - [1024, 1, 1, 256, 1024, 1024, 256, 256]
    - [67, 10.0]
  - - [1408, 1, 1, 256, 1408, 1408, 256, 256]
    - [67, 13.0]
  - - [1856, 1, 1, 256, 1856, 1856, 256, 256]
    - [67, 17.0]
  - - [2368, 1, 1, 256, 2368, 2368, 256, 256]
    - [67, 22.0]
  - - [2944, 1, 1, 256, 2944, 2944, 256, 256]
    - [67, 27.0]
  - - [3584, 1, 1, 256, 3584, 3584, 256, 256]
    - [67, 33.0]
  - - [4288, 1, 1, 256, 4288, 4288, 256, 256]
    - [67, 32.0]
  - - [5056, 1, 1, 256, 5056, 5056, 256, 256]
    - [67, 38.0]
  - - [5888, 1, 1, 256, 5888, 5888, 256, 256]
    - [67, 44.0]
  - - [6784, 1, 1, 256, 6784, 6784, 256, 256]
    - [67, 48.0]
  - - [64, 1, 1, 1280, 64, 64, 1280, 1280]
    - [78, 3.0]
  - - [128, 1, 1, 1280, 128, 128, 1280, 1280]
    - [78, 5.0]
  - - [256, 1, 1, 1280, 256, 256, 1280, 1280]
    - [78, 10.0]
  - - [448, 1, 1, 1280, 448, 448, 1280, 1280]
    - [78, 18.0]
  - - [704, 1, 1, 1280, 704, 704, 1280, 1280]
    - [78, 28.0]
  - - [1024, 1, 1, 1280, 1024, 1024, 1280, 1280]
    - [78, 34.0]
  - - [1408, 1, 1, 1280, 1408, 1408, 1280, 1280]
    - [78, 46.0]
  - - [1856, 1, 1, 1280, 1856, 1856, 1280, 1280]
    - [78, 48.0]
  - - [2368, 1, 1, 1280, 2368, 2368, 1280, 1280]
    - [78, 61.0]
  - - [2944, 1, 1, 1280, 2944, 2944, 1280, 1280]
    - [78, 63.0]
  - - [3584, 1, 1, 1280, 3584, 3584, 1280, 1280]
    - [78, 63.0]
  - - [4288, 1, 1, 1280, 4288, 4288, 1280, 1280]
    - [78, 66.0]
  - - [5056, 1, 1, 1280, 5056, 5056, 1280, 1280]
    - [77, 70.0]
  - - [5888, 1, 1, 1280, 5888, 5888, 1280, 1280]
    - [78, 69.0]
  - - [6784, 1, 1, 1280, 6784, 6784, 1280, 1280]
    - [77, 77.0]
  - - [64, 1, 1, 3328, 64, 64, 3328, 3328]
    - [82, 4.0]
  - - [128, 1, 1, 3328, 128, 128, 3328, 3328]
    - [84, 9.0]
  - - [256, 1, 1, 3328, 256, 256, 3328, 3328]
    - [82, 17.0]
  - - [448, 1, 1, 3328, 448, 448, 3328, 3328]
    - [82, 29.0]
  - - [704, 1, 1, 3328, 704, 704, 3328, 3328]
    - [81, 36.0]
  - - [1024, 1, 1, 3328, 1024, 1024, 3328, 3328]
    - [84, 53.0]
  - - [1408, 1, 1, 3328, 1408, 1408, 3328, 3328]
    - [84, 55.0]
  - - [1856, 1, 1, 3328, 1856, 1856, 3328, 3328]
    - [82, 59.0]
  - - [2368, 1, 1, 3328, 2368, 2368, 3328, 3328]
    - [80, 68.0]
  - - [2944, 1, 1, 3328, 2944, 2944, 3328, 3328]
    - [78, 68.0]
  - - [3584, 1, 1, 3328, 3584, 3584, 3328, 3328]
    - [84, 71.0]
  - - [4288, 1, 1, 3328, 4288, 4288, 3328, 3328]
    - [84, 76.0]
  - - [5056, 1, 1, 3328, 5056, 5056, 3328, 3328]
    - [84, 80.0]
  - - [5888, 1, 1, 3328, 5888, 5888, 3328, 3328]
    - [84, 78.0]
  - - [6784, 1, 1, 3328, 6784, 6784, 3328, 3328]
    - [84, 82.0]
  - - [64, 64, 1, 1, 64, 64, 1, 1]
    - [65, 1.0]
  - - [128, 64, 1, 1, 128, 128, 1, 1]
    - [63, 1.0]
  - - [256, 64, 1, 1, 256, 256, 1, 1]
    - [71, 4.0]
  - - [448, 64, 1, 1, 448, 448, 1, 1]
    - [76, 6.0]
  - - [704, 64, 1, 1, 704, 704, 1, 1]
    - [69, 7.0]
  - - [1024, 64, 1, 1, 1024, 1024, 1, 1]
    - [65, 9.0]
  - - [1408, 64, 1, 1, 1408, 1408, 1, 1]
    - [65, 13.0]
  - - [1856, 64, 1, 1, 1856, 1856, 1, 1]
    - [65, 17.0]
  - - [2368, 64, 1, 1, 2368, 2368, 1, 1]
    - [65, 20.0]
  - - [2944, 64, 1, 1, 2944, 2944, 1, 1]
    - [71, 25.0]
  - - [3584, 64, 1, 1, 3584, 3584, 1, 1]
    - [65, 56.0]
  - - [4288, 64, 1, 1, 4288, 4288, 1, 1]
    - [67, 43.0]
  - - [5056, 64, 1, 1, 5056, 5056, 1, 1]
    - [67, 46.0]
  - - [5888, 64, 1, 1, 5888, 5888, 1, 1]
    - [67, 56.0]
  - - [6784, 64, 1, 1, 6784, 6784, 1, 1]
    - [67, 61.0]
  - - [64, 128, 1, 1, 64, 64, 1, 1]
    - [63, 1.0]
  - - [128, 128, 1, 1, 128, 128, 1, 1]
    - [71, 4.0]
  - - [256, 128, 1, 1, 256, 256, 1, 1]
    - [68, 6.0]
  - - [448, 128, 1, 1, 448, 448, 1, 1]
    - [69, 9.0]
  - - [704, 128, 1, 1, 704, 704, 1, 1]
    - [69, 13.0]
  - - [1024, 128, 1, 1, 1024, 1024, 1, 1]
    - [65, 19.0]
  - - [1408, 128, 1, 1, 1408, 1408, 1, 1]
    - [67, 27.0]
  - - [1856, 128, 1, 1, 1856, 1856, 1, 1]
    - [67, 59.0]
  - - [2368, 128, 1, 1, 2368, 2368, 1, 1]
    - [65, 49.0]
  - - [2944, 128, 1, 1, 2944, 2944, 1, 1]
    - [65, 60.0]
  - - [3584, 128, 1, 1, 3584, 3584, 1, 1]
    - [65, 63.0]
  - - [4288, 128, 1, 1, 4288, 4288, 1, 1]
    - [71, 74.0]
  - - [5056, 128, 1, 1, 5056, 5056, 1, 1]
    - [71, 81.0]
  - - [5888, 128, 1, 1, 5888, 5888, 1, 1]
    - [67, 91.0]
  - - [6784, 128, 1, 1, 6784, 6784, 1, 1]
    - [65, 101.0]
  - - [64, 256, 1, 1, 64, 64, 1, 1]
    - [67, 4.0]
  - - [128, 256, 1, 1, 128, 128, 1, 1]
    - [75, 7.0]
  - - [256, 256, 1, 1, 256, 256, 1, 1]
    - [65, 9.0]
  - - [448, 256, 1, 1, 448, 448, 1, 1]
    - [69, 16.0]
  - - [704, 256, 1, 1, 704, 704, 1, 1]
    - [67, 24.0]
  - - [1024, 256, 1, 1, 1024, 1024, 1, 1]
    - [71, 49.0]
  - - [1408, 256, 1, 1, 1408, 1408, 1, 1]
    - [65, 51.0]
  - - [1856, 256, 1, 1, 1856, 1856, 1, 1]
    - [67, 69.0]
  - - [2368, 256, 1, 1, 2368, 2368, 1, 1]
    - [67, 81.0]
  - - [2944, 256, 1, 1, 2944, 2944, 1, 1]
    - [71, 96.0]
  - - [3584, 256, 1, 1, 3584, 3584, 1, 1]
    - [67, 96.0]
  - - [4288, 256, 1, 1, 4288, 4288, 1, 1]
    - [73, 106.0]
  - - [5056, 256, 1, 1, 5056, 5056, 1, 1]
    - [70, 123.0]
  - - [5888, 256, 1, 1, 5888, 5888, 1, 1]
    - [64, 140.0]
  - - [6784, 256, 1, 1, 6784, 6784, 1, 1]
    - [71, 149.0]
  - - [64, 448, 1, 1, 64, 64, 1, 1]
    - [70, 5.0]
  - - [128, 448, 1, 1, 128, 128, 1, 1]
    - [65, 8.0]
  - - [256, 448, 1, 1, 256, 256, 1, 1]
    - [65, 16.0]
  - - [448, 448, 1, 1, 448, 448, 1, 1]
    - [67, 26.0]
  - - [704, 448, 1, 1, 704, 704, 1, 1]
    - [67, 46.0]
  - - [1024, 448, 1, 1, 1024, 1024, 1, 1]
    - [71, 64.0]
  - - [1408, 448, 1, 1, 1408, 1408, 1, 1]
    - [67, 80.0]
  - - [1856, 448, 1, 1, 1856, 1856, 1, 1]
    - [71, 95.0]
  - - [2368, 448, 1, 1, 2368, 2368, 1, 1]
    - [67, 111.0]
  - - [2944, 448, 1, 1, 2944, 2944, 1, 1]
    - [69, 136.0]
  - - [3584, 448, 1, 1, 3584, 3584, 1, 1]
    - [71, 157.0]
  - - [4288, 448, 1, 1, 4288, 4288, 1, 1]
    - [67, 167.0]
  - - [5056, 448, 1, 1, 5056, 5056, 1, 1]
    - [65, 174.0]
  - - [5888, 448, 1, 1, 5888, 5888, 1, 1]
    - [65, 178.0]
  - - [6784, 448, 1, 1, 6784, 6784, 1, 1]
    - [71, 178.0]
  - - [64, 704, 1, 1, 64, 64, 1, 1]
    - [65, 7.0]
  - - [128, 704, 1, 1, 128, 128, 1, 1]
    - [71, 13.0]
  - - [256, 704, 1, 1, 256, 256, 1, 1]
    - [67, 24.0]
  - - [448, 704, 1, 1, 448, 448, 1, 1]
    - [67, 47.0]
  - - [704, 704, 1, 1, 704, 704, 1, 1]
    - [67, 83.0]
  - - [1024, 704, 1, 1, 1024, 1024, 1, 1]
    - [69, 93.0]
  - - [1408, 704, 1, 1, 1408, 1408, 1, 1]
    - [67, 132.0]
  - - [1856, 704, 1, 1, 1856, 1856, 1, 1]
    - [65, 138.0]
  - - [2368, 704, 1, 1, 2368, 2368, 1, 1]
    - [69, 157.0]
  - - [2944, 704, 1, 1, 2944, 2944, 1, 1]
    - [67, 175.0]
  - - [3584, 704, 1, 1, 3584, 3584, 1, 1]
    - [71, 183.0]
  - - [4288, 704, 1, 1, 4288, 4288, 1, 1]
    - [67, 194.0]
  - - [5056, 704, 1, 1, 5056, 5056, 1, 1]
    - [69, 199.0]
  - - [5888, 704, 1, 1, 5888, 5888, 1, 1]
    - [64, 208.0]
  - - [6784, 704, 1, 1, 6784, 6784, 1, 1]
    - [64, 212.0]
  - - [64, 1024, 1, 1, 64, 64, 1, 1]
    - [65, 10.0]
  - - [128, 1024, 1, 1, 128, 128, 1, 1]
    - [71, 20.0]
  - - [256, 1024, 1, 1, 256, 256, 1, 1]
    - [67, 67.0]
  - - [448, 1024, 1, 1, 448, 448, 1, 1]
    - [65, 77.0]
  - - [704, 1024, 1, 1, 704, 704, 1, 1]
    - [71, 98.0]
  - - [1024, 1024, 1, 1, 1024, 1024, 1, 1]
    - [64, 125.0]
  - - [1408, 1024, 1, 1, 1408, 1408, 1, 1]
    - [72, 131.0]
  - - [1856, 1024, 1, 1, 1856, 1856, 1, 1]
    - [65, 150.0]
  - - [2368, 1024, 1, 1, 2368, 2368, 1, 1]
    - [64, 168.0]
  - - [2944, 1024, 1, 1, 2944, 2944, 1, 1]
    - [66, 180.0]
  - - [3584, 1024, 1, 1, 3584, 3584, 1, 1]
    - [71, 202.0]
  - - [4288, 1024, 1, 1, 4288, 4288, 1, 1]
    - [71, 200.0]
  - - [5056, 1024, 1, 1, 5056, 5056, 1, 1]
    - [64, 214.0]
  - - [5888, 1024, 1, 1, 5888, 5888, 1, 1]
    - [64, 217.0]
  - - [6784, 1024, 1, 1, 6784, 6784, 1, 1]
    - [64, 231.0]
  - - [64, 1408, 1, 1, 64, 64, 1, 1]
    - [69, 13.0]
  - - [128, 1408, 1, 1, 128, 128, 1, 1]
    - [67, 24.0]
  - - [256, 1408, 1, 1, 256, 256, 1, 1]
    - [67, 55.0]
  - - [448, 1408, 1, 1, 448, 448, 1, 1]
    - [71, 82.0]
  - - [704, 1408, 1, 1, 704, 704, 1, 1]
    - [67, 121.0]
  - - [1024, 1408, 1, 1, 1024, 1024, 1, 1]
    - [68, 140.0]
  - - [1408, 1408, 1, 1, 1408, 1408, 1, 1]
    - [69, 164.0]
  - - [1856, 1408, 1, 1, 1856, 1856, 1, 1]
    - [71, 187.0]
  - - [2368, 1408, 1, 1, 2368, 2368, 1, 1]
    - [64, 198.0]
  - - [2944, 1408, 1, 1, 2944, 2944, 1, 1]
    - [64, 213.0]
  - - [3584, 1408, 1, 1, 3584, 3584, 1, 1]
    - [64, 215.0]
  - - [4288, 1408, 1, 1, 4288, 4288, 1, 1]
    - [64, 231.0]
  - - [5056, 1408, 1, 1, 5056, 5056, 1, 1]
    - [64, 251.0]
  - - [5888, 1408, 1, 1, 5888, 5888, 1, 1]
    - [64, 253.0]
  - - [6784, 1408, 1, 1, 6784, 6784, 1, 1]
    - [64, 256.0]
  - - [64, 1856, 1, 1, 64, 64, 1, 1]
    - [71, 18.0]
  - - [128, 1856, 1, 1, 128, 128, 1, 1]
    - [67, 59.0]
  - - [256, 1856, 1, 1, 256, 256, 1, 1]
    - [71, 84.0]
  - - [448, 1856, 1, 1, 448, 448, 1, 1]
    - [69, 112.0]
  - - [704, 1856, 1, 1, 704, 704, 1, 1]
    - [67, 135.0]
  - - [1024, 1856, 1, 1, 1024, 1024, 1, 1]
    - [65, 153.0]
  - - [1408, 1856, 1, 1, 1408, 1408, 1, 1]
    - [71, 186.0]
  - - [1856, 1856, 1, 1, 1856, 1856, 1, 1]
    - [67, 200.0]
  - - [2368, 1856, 1, 1, 2368, 2368, 1, 1]
    - [64, 213.0]
  - - [2944, 1856, 1, 1, 2944, 2944, 1, 1]
    - [67, 220.0]
  - - [3584, 1856, 1, 1, 3584, 3584, 1, 1]
    - [64, 237.0]
  - - [4288, 1856, 1, 1, 4288, 4288, 1, 1]
    - [64, 250.0]
  - - [5056, 1856, 1, 1, 5056, 5056, 1, 1]
    - [64, 256.0]
  - - [5888, 1856, 1, 1, 5888, 5888, 1, 1]
    - [64, 255.0]
  - - [6784, 1856, 1, 1, 6784, 6784, 1, 1]
    - [64, 262.0]
  - - [64, 2368, 1, 1, 64, 64, 1, 1]
    - [71, 21.0]
  - - [128, 2368, 1, 1, 128, 128, 1, 1]
    - [67, 46.0]
  - - [256, 2368, 1, 1, 256, 256, 1, 1]
    - [67, 89.0]
  - - [448, 2368, 1, 1, 448, 448, 1, 1]
    - [67, 122.0]
  - - [704, 2368, 1, 1, 704, 704, 1, 1]
    - [71, 140.0]
  - - [1024, 2368, 1, 1, 1024, 1024, 1, 1]
    - [71, 160.0]
  - - [1408, 2368, 1, 1, 1408, 1408, 1, 1]
    - [71, 188.0]
  - - [1856, 2368, 1, 1, 1856, 1856, 1, 1]
    - [64, 203.0]
  - - [2368, 2368, 1, 1, 2368, 2368, 1, 1]
    - [71, 218.0]
  - - [2944, 2368, 1, 1, 2944, 2944, 1, 1]
    - [64, 227.0]
  - - [3584, 2368, 1, 1, 3584, 3584, 1, 1]
    - [64, 239.0]
  - - [4288, 2368, 1, 1, 4288, 4288, 1, 1]
    - [64, 247.0]
  - - [5056, 2368, 1, 1, 5056, 5056, 1, 1]
    - [64, 255.0]
  - - [5888, 2368, 1, 1, 5888, 5888, 1, 1]
    - [64, 263.0]
  - - [6784, 2368, 1, 1, 6784, 6784, 1, 1]
    - [64, 264.0]
  - - [64, 2944, 1, 1, 64, 64, 1, 1]
    - [65, 24.0]
  - - [128, 2944, 1, 1, 128, 128, 1, 1]
    - [71, 60.0]
  - - [256, 2944, 1, 1, 256, 256, 1, 1]
    - [67, 98.0]
  - - [448, 2944, 1, 1, 448, 448, 1, 1]
    - [67, 126.0]
  - - [704, 2944, 1, 1, 704, 704, 1, 1]
    - [71, 158.0]
  - - [1024, 2944, 1, 1, 1024, 1024, 1, 1]
    - [71, 173.0]
  - - [1408, 2944, 1, 1, 1408, 1408, 1, 1]
    - [64, 202.0]
  - - [1856, 2944, 1, 1, 1856, 1856, 1, 1]
    - [64, 227.0]
  - - [2368, 2944, 1, 1, 2368, 2368, 1, 1]
    - [64, 232.0]
  - - [2944, 2944, 1, 1, 2944, 2944, 1, 1]
    - [64, 245.0]
  - - [3584, 2944, 1, 1, 3584, 3584, 1, 1]
    - [64, 254.0]
  - - [4288, 2944, 1, 1, 4288, 4288, 1, 1]
    - [64, 256.0]
  - - [5056, 2944, 1, 1, 5056, 5056, 1, 1]
    - [64, 267.0]
  - - [5888, 2944, 1, 1, 5888, 5888, 1, 1]
    - [64, 270.0]
  - - [6784, 2944, 1, 1, 6784, 6784, 1, 1]
    - [64, 278.0]
  - - [64, 3584, 1, 1, 64, 64, 1, 1]
    - [65, 43.0]
  - - [128, 3584, 1, 1, 128, 128, 1, 1]
    - [71, 69.0]
  - - [256, 3584, 1, 1, 256, 256, 1, 1]
    - [69, 107.0]
  - - [448, 3584, 1, 1, 448, 448, 1, 1]
    - [67, 138.0]
  - - [704, 3584, 1, 1, 704, 704, 1, 1]
    - [71, 175.0]
  - - [1024, 3584, 1, 1, 1024, 1024, 1, 1]
    - [67, 181.0]
  - - [1408, 3584, 1, 1, 1408, 1408, 1, 1]
    - [64, 210.0]
  - - [1856, 3584, 1, 1, 1856, 1856, 1, 1]
    - [64, 240.0]
  - - [2368, 3584, 1, 1, 2368, 2368, 1, 1]
    - [64, 246.0]
  - - [2944, 3584, 1, 1, 2944, 2944, 1, 1]
    - [64, 251.0]
  - - [3584, 3584, 1, 1, 3584, 3584, 1, 1]
    - [64, 256.0]
  - - [4288, 3584, 1, 1, 4288, 4288, 1, 1]
    - [64, 268.0]
  - - [5056, 3584, 1, 1, 5056, 5056, 1, 1]
    - [64, 279.0]
  - - [5888, 3584, 1, 1, 5888, 5888, 1, 1]
    - [64, 276.0]
  - - [6784, 3584, 1, 1, 6784, 6784, 1, 1]
    - [64, 279.0]
  - - [64, 4288, 1, 1, 64, 64, 1, 1]
    - [71, 43.0]
  - - [128, 4288, 1, 1, 128, 128, 1, 1]
    - [65, 75.0]
  - - [256, 4288, 1, 1, 256, 256, 1, 1]
    - [67, 116.0]
  - - [448, 4288, 1, 1, 448, 448, 1, 1]
    - [67, 162.0]
  - - [704, 4288, 1, 1, 704, 704, 1, 1]
    - [64, 194.0]
  - - [1024, 4288, 1, 1, 1024, 1024, 1, 1]
    - [65, 200.0]
  - - [1408, 4288, 1, 1, 1408, 1408, 1, 1]
    - [64, 225.0]
  - - [1856, 4288, 1, 1, 1856, 1856, 1, 1]
    - [64, 240.0]
  - - [2368, 4288, 1, 1, 2368, 2368, 1, 1]
    - [64, 253.0]
  - - [2944, 4288, 1, 1, 2944, 2944, 1, 1]
    - [64, 261.0]
  - - [3584, 4288, 1, 1, 3584, 3584, 1, 1]
    - [64, 262.0]
  - - [4288, 4288, 1, 1, 4288, 4288, 1, 1]
    - [64, 270.0]
  - - [5056, 4288, 1, 1, 5056, 5056, 1, 1]
    - [64, 278.0]
  - - [5888, 4288, 1, 1, 5888, 5888, 1, 1]
    - [64, 273.0]
  - - [6784, 4288, 1, 1, 6784, 6784, 1, 1]
    - [64, 286.0]
  - - [64, 5056, 1, 1, 64, 64, 1, 1]
    - [71, 54.0]
  - - [128, 5056, 1, 1, 128, 128, 1, 1]
    - [71, 88.0]
  - - [256, 5056, 1, 1, 256, 256, 1, 1]
    - [71, 130.0]
  - - [448, 5056, 1, 1, 448, 448, 1, 1]
    - [67, 162.0]
  - - [704, 5056, 1, 1, 704, 704, 1, 1]
    - [67, 189.0]
  - - [1024, 5056, 1, 1, 1024, 1024, 1, 1]
    - [67, 199.0]
  - - [1408, 5056, 1, 1, 1408, 1408, 1, 1]
    - [64, 232.0]
  - - [1856, 5056, 1, 1, 1856, 1856, 1, 1]
    - [64, 250.0]
  - - [2368, 5056, 1, 1, 2368, 2368, 1, 1]
    - [64, 259.0]
  - - [2944, 5056, 1, 1, 2944, 2944, 1, 1]
    - [64, 262.0]
  - - [3584, 5056, 1, 1, 3584, 3584, 1, 1]
    - [64, 267.0]
  - - [4288, 5056, 1, 1, 4288, 4288, 1, 1]
    - [64, 278.0]
  - - [5056, 5056, 1, 1, 5056, 5056, 1, 1]
    - [64, 283.0]
  - - [5888, 5056, 1, 1, 5888, 5888, 1, 1]
    - [64, 284.0]
  - - [6784, 5056, 1, 1, 6784, 6784, 1, 1]
    - [64, 287.0]
  - - [64, 5888, 1, 1, 64, 64, 1, 1]
    - [67, 60.0]
  - - [128, 5888, 1, 1, 128, 128, 1, 1]
    - [67, 102.0]
  - - [256, 5888, 1, 1, 256, 256, 1, 1]
    - [67, 140.0]
  - - [448, 5888, 1, 1, 448, 448, 1, 1]
    - [67, 171.0]
  - - [704, 5888, 1, 1, 704, 704, 1, 1]
    - [64, 206.0]
  - - [1024, 5888, 1, 1, 1024, 1024, 1, 1]
    - [67, 216.0]
  - - [1408, 5888, 1, 1, 1408, 1408, 1, 1]
    - [64, 250.0]
  - - [1856, 5888, 1, 1, 1856, 1856, 1, 1]
    - [64, 271.0]
  - - [2368, 5888, 1, 1, 2368, 2368, 1, 1]
    - [64, 275.0]
  - - [2944, 5888, 1, 1, 2944, 2944, 1, 1]
    - [64, 279.0]
  - - [3584, 5888, 1, 1, 3584, 3584, 1, 1]
    - [64, 276.0]
  - - [4288, 5888, 1, 1, 4288, 4288, 1, 1]
    - [64, 286.0]
  - - [5056, 5888, 1, 1, 5056, 5056, 1, 1]
    - [64, 293.0]
  - - [5888, 5888, 1, 1, 5888, 5888, 1, 1]
    - [64, 287.0]
  - - [6784, 5888, 1, 1, 6784, 6784, 1, 1]
    - [64, 295.0]
  - - [64, 6784, 1, 1, 64, 64, 1, 1]
    - [67, 65.0]
  - - [128, 6784, 1, 1, 128, 128, 1, 1]
    - [67, 110.0]
  - - [256, 6784, 1, 1, 256, 256, 1, 1]
    - [71, 150.0]
  - - [448, 6784, 1, 1, 448, 448, 1, 1]
    - [67, 192.0]
  - - [704, 6784, 1, 1, 704, 704, 1, 1]
    - [64, 223.0]
  - - [1024, 6784, 1, 1, 1024, 1024, 1, 1]
    - [64, 229.0]
  - - [1408, 6784, 1, 1, 1408, 1408, 1, 1]
    - [64, 250.0]
  - - [1856, 6784, 1, 1, 1856, 1856, 1, 1]
    - [64, 271.0]
  - - [2368, 6784, 1, 1, 2368, 2368, 1, 1]
    - [64, 281.0]
  - - [2944, 6784, 1, 1, 2944, 2944, 1, 1]
    - [64, 286.0]
  - - [3584, 6784, 1, 1, 3584, 3584, 1, 1]
    - [64, 280.0]
  - - [4288, 6784, 1, 1, 4288, 4288, 1, 1]
    - [64, 291.0]
  - - [5056, 6784, 1, 1, 5056, 5056, 1, 1]
    - [64, 292.0]
  - - [5888, 6784, 1, 1, 5888, 5888, 1, 1]
    - [64, 290.0]
  - - [6784, 6784, 1, 1, 6784, 6784, 1, 1]
    - [64, 299.0]
  - - [1, 1, 1, 256, 1, 1, 256, 256]
    - [67, 0.0093841645300187]
  - - [1, 1, 1, 1280, 1, 1, 1280, 1280]
    - [78, 0.04]
  - - [1, 1, 1, 3328, 1, 1, 3328, 3328]
    - [82, 0.07]
  - - [1, 64, 1, 1, 1, 1, 1, 1]
    - [65, 0.01]
  - - [1, 128, 1, 1, 1, 1, 1, 1]
    - [69, 0.03]
  - - [1, 256, 1, 1, 1, 1, 1, 1]
    - [69, 0.08]
  - - [1, 448, 1, 1, 1, 1, 1, 1]
    - [70, 0.12]
  - - [1, 704, 1, 1, 1, 1, 1, 1]
    - [65, 0.16]
  - - [1, 1024, 1, 1, 1, 1, 1, 1]
    - [65, 0.2]
  - - [1, 1408, 1, 1, 1, 1, 1, 1]
    - [69, 0.29]
  - - [1, 1856, 1, 1, 1, 1, 1, 1]
    - [69, 0.39]
  - - [1, 2368, 1, 1, 1, 1, 1, 1]
    - [67, 0.47]
  - - [1, 2944, 1, 1, 1, 1, 1, 1]
    - [65, 1.0]
  - - [1, 3584, 1, 1, 1, 1, 1, 1]
    - [65, 1.0]
  - - [1, 4288, 1, 1, 1, 1, 1, 1]
    - [64, 1.0]
  - - [1, 5056, 1, 1, 1, 1, 1, 1]
    - [65, 2.0]
  - - [1, 5888, 1, 1, 1, 1, 1, 1]
    - [65, 2.0]
  - - [1, 6784, 1, 1, 1, 1, 1, 1]
    - [65, 2.0]
  - - [64, 1, 1, 1, 64, 64, 1, 1]
    - [69, 0.02]
  - - [128, 1, 1, 1, 128, 128, 1, 1]
    - [65, 0.03]
  - - [256, 1, 1, 1, 256, 256, 1, 1]
    - [67, 0.1]
  - - [448, 1, 1, 1, 448, 448, 1, 1]
    - [65, 0.11]
  - - [704, 1, 1, 1, 704, 704, 1, 1]
    - [71, 0.18]
  - - [1024, 1, 1, 1, 1024, 1024, 1, 1]
    - [65, 0.25]
  - - [1408, 1, 1, 1, 1408, 1408, 1, 1]
    - [69, 0.33]
  - - [1856, 1, 1, 1, 1856, 1856, 1, 1]
    - [69, 0.45]
  - - [2368, 1, 1, 1, 2368, 2368, 1, 1]
    - [67, 0.49]
  - - [2944, 1, 1, 1, 2944, 2944, 1, 1]
    - [65, 1.0]
  - - [3584, 1, 1, 1, 3584, 3584, 1, 1]
    - [64, 1.0]
  - - [4288, 1, 1, 1, 4288, 4288, 1, 1]
    - [63, 1.0]
  - - [5056, 1, 1, 1, 5056, 5056, 1, 1]
    - [63, 1.0]
  - - [5888, 1, 1, 1, 5888, 5888, 1, 1]
    - [64, 2.0]
  - - [6784, 1, 1, 1, 6784, 6784, 1, 1]
    - [64, 2.0]
- null
