library/src/blas3/Tensile/Logic/aldebaran/vega20_Cijk_Alik_Bjlk_HBH_GB.yaml
- {MinimumRequiredVersion: 4.26.0}
- vega20
- gfx906
- [Device 66a0, Device 66a1, Device 66a7, Device 66af, Vega 20]
    SolutionIndex: 0
    SolutionNameMin: Cijk_Alik_Bjlk_HBH_GB_MT32x32x8_SN_GRVW4_LRVW4_TT4_4_VW4_WG8_8_1_WGM1
    SolutionIndex: 1
    SolutionNameMin: Cijk_Alik_Bjlk_HBH_GB_MT32x64x8_SN_GRVW4_LRVW4_TT4_8_VW4_WG8_8_1_WGM1
    SolutionIndex: 2
    SolutionNameMin: Cijk_Alik_Bjlk_HBH_GB_MT64x128x8_SN_GRVW4_LRVW4_TT4_8_VW4_WG16_16_1_WGM1
    SolutionIndex: 3
    SolutionNameMin: Cijk_Alik_Bjlk_HBH_GB_MT32x32x16_SN_GRVW4_LRVW4_TT4_4_VW4_WG8_8_1_WGM1
    SolutionIndex: 4
    SolutionNameMin: Cijk_Alik_Bjlk_HBH_GB_MT64x64x16_SN_GRVW4_LRVW4_TT4_4_VW4_WG16_16_1_WGM1
    SolutionIndex: 5
    SolutionNameMin: Cijk_Alik_Bjlk_HBH_GB_MT64x64x8_SN_GRVW2_LRVW2_TT4_4_VW2_WG16_16_1_WGM1
    SolutionIndex: 6
    SolutionNameMin: Cijk_Alik_Bjlk_HBH_GB_MT32x32x8_SN_GRVW4_LRVW4_TT4_4_VW4_WG8_8_1_WGM8
    SolutionIndex: 7
    SolutionNameMin: Cijk_Alik_Bjlk_HBH_GB_MT64x128x8_SN_GRVW4_LRVW4_TT4_8_VW4_WG16_16_1_WGM8
    SolutionIndex: 8
    SolutionNameMin: Cijk_Alik_Bjlk_HBH_GB_MT32x32x16_SN_GRVW4_LRVW4_TT4_4_VW4_WG8_8_1_WGM8
    SolutionIndex: 9
    SolutionNameMin: Cijk_Alik_Bjlk_HBH_GB_MT64x64x16_SN_GRVW4_LRVW4_TT4_4_VW4_WG16_16_1_WGM8
    SolutionIndex: 10
    SolutionNameMin: Cijk_Alik_Bjlk_HBH_GB_MT64x64x8_SN_GRVW2_LRVW2_TT4_4_VW2_WG16_16_1_WGM8
- - - [32, 32, 8, 32, 32, 32, 32, 32]
    - [6, 76.0]
  - - [32, 32, 8, 64, 32, 32, 64, 32]
    - [0, 118.0]
  - - [32, 32, 8, 128, 32, 32, 128, 32]
    - [0, 158.0]
  - - [32, 32, 8, 256, 32, 32, 256, 32]
    - [6, 190.0]
  - - [32, 32, 8, 512, 32, 32, 512, 32]
    - [8, 215.0]
  - - [32, 64, 8, 32, 32, 32, 32, 64]
    - [0, 165.0]
  - - [32, 64, 8, 64, 32, 32, 64, 64]
    - [0, 247.0]
  - - [32, 64, 8, 128, 32, 32, 128, 64]
    - [0, 325.0]
  - - [32, 64, 8, 256, 32, 32, 256, 64]
    - [6, 388.0]
  - - [32, 64, 8, 512, 32, 32, 512, 64]
    - [8, 438.0]
  - - [32, 128, 8, 32, 32, 32, 32, 128]
    - [0, 350.0]
  - - [32, 128, 8, 64, 32, 32, 64, 128]
    - [0, 510.0]
  - - [32, 128, 8, 128, 32, 32, 128, 128]
    - [0, 664.0]
  - - [32, 128, 8, 256, 32, 32, 256, 128]
    - [8, 792.0]
  - - [32, 128, 8, 512, 32, 32, 512, 128]
    - [8, 887.0]
  - - [32, 256, 8, 32, 32, 32, 32, 256]
    - [0, 695.0]
  - - [32, 256, 8, 64, 32, 32, 64, 256]
    - [0, 1024.0]
  - - [32, 256, 8, 128, 32, 32, 128, 256]
    - [0, 1331.0]
  - - [32, 256, 8, 256, 32, 32, 256, 256]
    - [8, 1592.0]
  - - [32, 256, 8, 512, 32, 32, 512, 256]
    - [8, 1756.0]
  - - [32, 512, 8, 32, 32, 32, 32, 512]
    - [0, 1365.0]
  - - [32, 512, 8, 64, 32, 32, 64, 512]
    - [0, 2009.0]
  - - [32, 512, 8, 128, 32, 32, 128, 512]
    - [0, 2621.0]
  - - [32, 512, 8, 256, 32, 32, 256, 512]
    - [8, 3089.0]
  - - [32, 512, 8, 512, 32, 32, 512, 512]
    - [8, 3462.0]
  - - [64, 32, 8, 32, 64, 64, 32, 32]
    - [0, 166.0]
  - - [64, 32, 8, 64, 64, 64, 64, 32]
    - [0, 248.0]
  - - [64, 32, 8, 128, 64, 64, 128, 32]
    - [0, 325.0]
  - - [64, 32, 8, 256, 64, 64, 256, 32]
    - [6, 388.0]
  - - [64, 32, 8, 512, 64, 64, 512, 32]
    - [8, 437.0]
  - - [64, 64, 8, 32, 64, 64, 32, 64]
    - [0, 343.0]
  - - [64, 64, 8, 64, 64, 64, 64, 64]
    - [0, 509.0]
  - - [64, 64, 8, 128, 64, 64, 128, 64]
    - [0, 663.0]
  - - [64, 64, 8, 256, 64, 64, 256, 64]
    - [8, 792.0]
  - - [64, 64, 8, 512, 64, 64, 512, 64]
    - [8, 884.0]
  - - [64, 128, 8, 32, 64, 64, 32, 128]
    - [0, 690.0]
  - - [64, 128, 8, 64, 64, 64, 64, 128]
    - [0, 1020.0]
  - - [64, 128, 8, 128, 64, 64, 128, 128]
    - [6, 1339.0]
  - - [64, 128, 8, 256, 64, 64, 256, 128]
    - [8, 1591.0]
  - - [64, 128, 8, 512, 64, 64, 512, 128]
    - [8, 1779.0]
  - - [64, 256, 8, 32, 64, 64, 32, 256]
    - [0, 1376.0]
  - - [64, 256, 8, 64, 64, 64, 64, 256]
    - [6, 2028.0]
  - - [64, 256, 8, 128, 64, 64, 128, 256]
    - [6, 2648.0]
  - - [64, 256, 8, 256, 64, 64, 256, 256]
    - [8, 3151.0]
  - - [64, 256, 8, 512, 64, 64, 512, 256]
    - [8, 3508.0]
  - - [64, 512, 8, 32, 64, 64, 32, 512]
    - [0, 2641.0]
  - - [64, 512, 8, 64, 64, 64, 64, 512]
    - [0, 3855.0]
  - - [64, 512, 8, 128, 64, 64, 128, 512]
    - [0, 5047.0]
  - - [64, 512, 8, 256, 64, 64, 256, 512]
    - [3, 5996.0]
  - - [64, 512, 8, 512, 64, 64, 512, 512]
    - [9, 6743.0]
  - - [128, 32, 8, 32, 128, 128, 32, 32]
    - [0, 343.0]
  - - [128, 32, 8, 64, 128, 128, 64, 32]
    - [0, 511.0]
  - - [128, 32, 8, 128, 128, 128, 128, 32]
    - [0, 666.0]
  - - [128, 32, 8, 256, 128, 128, 256, 32]
    - [8, 793.0]
  - - [128, 32, 8, 512, 128, 128, 512, 32]
    - [8, 887.0]
  - - [128, 64, 8, 32, 128, 128, 32, 64]
    - [0, 701.0]
  - - [128, 64, 8, 64, 128, 128, 64, 64]
    - [6, 1016.0]
  - - [128, 64, 8, 128, 128, 128, 128, 64]
    - [0, 1337.0]
  - - [128, 64, 8, 256, 128, 128, 256, 64]
    - [8, 1594.0]
  - - [128, 64, 8, 512, 128, 128, 512, 64]
    - [8, 1784.0]
  - - [128, 128, 8, 32, 128, 128, 32, 128]
    - [0, 1362.0]
  - - [128, 128, 8, 64, 128, 128, 64, 128]
    - [0, 1993.0]
  - - [128, 128, 8, 128, 128, 128, 128, 128]
    - [6, 2625.0]
  - - [128, 128, 8, 256, 128, 128, 256, 128]
    - [8, 3142.0]
  - - [128, 128, 8, 512, 128, 128, 512, 128]
    - [8, 3528.0]
  - - [128, 256, 8, 32, 128, 128, 32, 256]
    - [0, 2558.0]
  - - [128, 256, 8, 64, 128, 128, 64, 256]
    - [0, 3820.0]
  - - [128, 256, 8, 128, 128, 128, 128, 256]
    - [0, 5059.0]
  - - [128, 256, 8, 256, 128, 128, 256, 256]
    - [3, 6088.0]
  - - [128, 256, 8, 512, 128, 128, 512, 256]
    - [3, 6814.0]
  - - [128, 512, 8, 32, 128, 128, 32, 512]
    - [0, 4406.0]
  - - [128, 512, 8, 64, 128, 128, 64, 512]
    - [0, 6096.0]
  - - [128, 512, 8, 128, 128, 128, 128, 512]
    - [9, 7796.0]
  - - [128, 512, 8, 256, 128, 128, 256, 512]
    - [9, 9138.0]
  - - [128, 512, 8, 512, 128, 128, 512, 512]
    - [9, 9898.0]
  - - [256, 32, 8, 32, 256, 256, 32, 32]
    - [0, 694.0]
  - - [256, 32, 8, 64, 256, 256, 64, 32]
    - [6, 1018.0]
  - - [256, 32, 8, 128, 256, 256, 128, 32]
    - [6, 1329.0]
  - - [256, 32, 8, 256, 256, 256, 256, 32]
    - [8, 1588.0]
  - - [256, 32, 8, 512, 256, 256, 512, 32]
    - [8, 1774.0]
  - - [256, 64, 8, 32, 256, 256, 32, 64]
    - [0, 1344.0]
  - - [256, 64, 8, 64, 256, 256, 64, 64]
    - [6, 1993.0]
  - - [256, 64, 8, 128, 256, 256, 128, 64]
    - [6, 2621.0]
  - - [256, 64, 8, 256, 256, 256, 256, 64]
    - [8, 3142.0]
  - - [256, 64, 8, 512, 256, 256, 512, 64]
    - [8, 3501.0]
  - - [256, 128, 8, 32, 256, 256, 32, 128]
    - [0, 2545.0]
  - - [256, 128, 8, 64, 256, 256, 64, 128]
    - [0, 3820.0]
  - - [256, 128, 8, 128, 256, 256, 128, 128]
    - [6, 5035.0]
  - - [256, 128, 8, 256, 256, 256, 256, 128]
    - [3, 6070.0]
  - - [256, 128, 8, 512, 256, 256, 512, 128]
    - [3, 6806.0]
  - - [256, 256, 8, 32, 256, 256, 32, 256]
    - [0, 4324.0]
  - - [256, 256, 8, 64, 256, 256, 64, 256]
    - [0, 6079.0]
  - - [256, 256, 8, 128, 256, 256, 128, 256]
    - [4, 7724.0]
  - - [256, 256, 8, 256, 256, 256, 256, 256]
    - [9, 9103.0]
  - - [256, 256, 8, 512, 256, 256, 512, 256]
    - [3, 9954.0]
  - - [256, 512, 8, 32, 256, 256, 32, 512]
    - [5, 6493.0]
  - - [256, 512, 8, 64, 256, 256, 64, 512]
    - [5, 8756.0]
  - - [256, 512, 8, 128, 256, 256, 128, 512]
    - [9, 10466.0]
  - - [256, 512, 8, 256, 256, 256, 256, 512]
    - [4, 11582.0]
  - - [256, 512, 8, 512, 256, 256, 512, 512]
    - [9, 12354.0]
  - - [512, 32, 8, 32, 512, 512, 32, 32]
    - [0, 1307.0]
  - - [512, 32, 8, 64, 512, 512, 64, 32]
    - [0, 1949.0]
  - - [512, 32, 8, 128, 512, 512, 128, 32]
    - [6, 2576.0]
  - - [512, 32, 8, 256, 512, 512, 256, 32]
    - [8, 3086.0]
  - - [512, 32, 8, 512, 512, 512, 512, 32]
    - [8, 3479.0]
  - - [512, 64, 8, 32, 512, 512, 32, 64]
    - [6, 2503.0]
  - - [512, 64, 8, 64, 512, 512, 64, 64]
    - [6, 3725.0]
  - - [512, 64, 8, 128, 512, 512, 128, 64]
    - [6, 4923.0]
  - - [512, 64, 8, 256, 512, 512, 256, 64]
    - [8, 6000.0]
  - - [512, 64, 8, 512, 512, 512, 512, 64]
    - [8, 6762.0]
  - - [512, 128, 8, 32, 512, 512, 32, 128]
    - [6, 4112.0]
  - - [512, 128, 8, 64, 512, 512, 64, 128]
    - [8, 5883.0]
  - - [512, 128, 8, 128, 512, 512, 128, 128]
    - [8, 7675.0]
  - - [512, 128, 8, 256, 512, 512, 256, 128]
    - [8, 9025.0]
  - - [512, 128, 8, 512, 512, 512, 512, 128]
    - [3, 9913.0]
  - - [512, 256, 8, 32, 512, 512, 32, 256]
    - [10, 6326.0]
  - - [512, 256, 8, 64, 512, 512, 64, 256]
    - [5, 8684.0]
  - - [512, 256, 8, 128, 512, 512, 128, 256]
    - [9, 10434.0]
  - - [512, 256, 8, 256, 512, 512, 256, 256]
    - [9, 11594.0]
  - - [512, 256, 8, 512, 512, 512, 512, 256]
    - [9, 12307.0]
  - - [512, 512, 8, 32, 512, 512, 32, 512]
    - [2, 8089.0]
  - - [512, 512, 8, 64, 512, 512, 64, 512]
    - [7, 10040.0]
  - - [512, 512, 8, 128, 512, 512, 128, 512]
    - [9, 11378.0]
  - - [512, 512, 8, 256, 512, 512, 256, 512]
    - [4, 12287.0]
  - - [512, 512, 8, 512, 512, 512, 512, 512]
    - [1, 12611.0]
- null
