library/src/blas3/Tensile/Logic/aldebaran/vega20_Cijk_Ailk_Bljk_ZB.yaml
- {MinimumRequiredVersion: 4.11.0}
- vega20
- gfx906
- [Device 66af, Device 66a0, Device 66a1, Device 66a7, Vega 20]
    SolutionIndex: 0
    SolutionNameMin: Cijk_Ailk_Bljk_ZB_MT64x64x4_SE_
    SolutionIndex: 1
    SolutionNameMin: Cijk_Ailk_Bljk_ZB_MT64x64x8_SE_
    SolutionIndex: 2
    SolutionNameMin: Cijk_Ailk_Bljk_ZB_MT32x32x4_SE_IU1_LPA0_LPB0_PLR0_TT4_4_WG8_8_1_WGM1
    SolutionIndex: 3
    SolutionNameMin: Cijk_Ailk_Bljk_ZB_MT64x64x4_SE_IU1_LPA0_LPB1_PLR0_TT4_4_WG16_16_1_WGM1
    SolutionIndex: 4
    SolutionNameMin: Cijk_Ailk_Bljk_ZB_MT64x64x4_SE_IU1_LPA1_LPB1_PLR0_TT4_4_WG16_16_1_WGM1
    SolutionIndex: 5
    SolutionNameMin: Cijk_Ailk_Bljk_ZB_MT16x16x4_SE_IU1_LPA1_LPB1_PLR0_TT2_2_WG8_8_1_WGM1
    SolutionIndex: 6
    SolutionNameMin: Cijk_Ailk_Bljk_ZB_MT32x32x4_SE_IU1_LPA0_LPB0_PLR0_TT4_4_WG8_8_1_WGM8
    SolutionIndex: 7
    SolutionNameMin: Cijk_Ailk_Bljk_ZB_MT64x64x4_SE_IU1_LPA1_LPB0_PLR0_TT4_4_WG16_16_1_WGM8
    SolutionIndex: 8
    SolutionNameMin: Cijk_Ailk_Bljk_ZB_MT64x64x4_SE_
    SolutionIndex: 9
    SolutionNameMin: Cijk_Ailk_Bljk_ZB_MT64x64x8_SE_
    SolutionIndex: 10
    SolutionNameMin: Cijk_Ailk_Bljk_ZB_MT32x32x4_SE_IU1_LPA0_LPB0_PLR0_TT4_4_WG8_8_1_WGM1
    SolutionIndex: 11
    SolutionNameMin: Cijk_Ailk_Bljk_ZB_MT64x64x4_SE_IU1_LPA0_LPB1_PLR0_TT4_4_WG16_16_1_WGM1
    SolutionIndex: 12
    SolutionNameMin: Cijk_Ailk_Bljk_ZB_MT64x64x4_SE_IU1_LPA1_LPB1_PLR0_TT4_4_WG16_16_1_WGM1
    SolutionIndex: 13
    SolutionNameMin: Cijk_Ailk_Bljk_ZB_MT16x16x4_SE_IU1_LPA1_LPB1_PLR0_TT2_2_WG8_8_1_WGM1
    SolutionIndex: 14
    SolutionNameMin: Cijk_Ailk_Bljk_ZB_MT32x32x4_SE_IU1_LPA0_LPB0_PLR0_TT4_4_WG8_8_1_WGM8
    SolutionIndex: 15
    SolutionNameMin: Cijk_Ailk_Bljk_ZB_MT64x64x4_SE_IU1_LPA1_LPB0_PLR0_TT4_4_WG16_16_1_WGM8
- - - [64, 1, 1, 256]
    - [1, 0.645039]
  - - [64, 64, 1, 256]
    - [0, 40.3298]
  - - [1, 64, 1, 256]
    - [1, 0.638009]
  - - [1, 1, 1, 256]
    - [0, 0.00926198]
  - - [364, 364, 1024, 364]
    - [2, 4271.82]
  - - [364, 364, 16, 364]
    - [7, 3774.79]
  - - [364, 364, 32, 364]
    - [4, 3932.78]
  - - [364, 364, 256, 364]
    - [4, 4241.23]
  - - [364, 364, 1, 364]
    - [5, 314.592]
  - - [364, 364, 128, 364]
    - [3, 4164.41]
  - - [364, 364, 512, 364]
    - [6, 4261.02]
  - - [364, 364, 64, 364]
    - [7, 4016.29]
  - - [64, 1, 1, 256]
    - [9, 0.645039]
  - - [64, 64, 1, 256]
    - [8, 40.3298]
  - - [1, 64, 1, 256]
    - [9, 0.638009]
  - - [1, 1, 1, 256]
    - [8, 0.00926198]
  - - [364, 364, 1024, 364]
    - [10, 4271.82]
  - - [364, 364, 16, 364]
    - [15, 3774.79]
  - - [364, 364, 32, 364]
    - [12, 3932.78]
  - - [364, 364, 256, 364]
    - [12, 4241.23]
  - - [364, 364, 1, 364]
    - [13, 314.592]
  - - [364, 364, 128, 364]
    - [11, 4164.41]
  - - [364, 364, 512, 364]
    - [14, 4261.02]
  - - [364, 364, 64, 364]
    - [15, 4016.29]
- null
