library/src/blas3/Tensile/Logic/aldebaran/vega20_Cijk_Ailk_Bjlk_HB.yaml
- {MinimumRequiredVersion: 4.6.0}
- vega20
- gfx906
- [Device 66a0, Device 66a1, Device 66a7, Device 66af, Vega 20]
    SolutionIndex: 0
    SolutionNameMin: Cijk_Ailk_Bjlk_HB_MT032x016x08_GRVW02_TT04_02_USFGRO0_VW02_WG08_08_01
    SolutionIndex: 1
    SolutionNameMin: Cijk_Ailk_Bjlk_HB_MT032x032x08_GRVW04_TT04_04_USFGRO0_VW04_WG08_08_01
    SolutionIndex: 2
    SolutionNameMin: Cijk_Ailk_Bjlk_HB_MT064x016x08_GRVW02_TT04_02_USFGRO01_VW02_WG16_08_01
    SolutionIndex: 3
    SolutionNameMin: Cijk_Ailk_Bjlk_HB_MT128x032x08_GRVW04_TT04_04_USFGRO0_VW04_WG32_08_01
    SolutionIndex: 4
    SolutionNameMin: Cijk_Ailk_Bjlk_HB_MT032x008x08_GRVW02_TT02_02_USFGRO01_VW02_WG16_04_01
    SolutionIndex: 5
    SolutionNameMin: Cijk_Ailk_Bjlk_HB_MT032x032x08_GRVW04_TT04_04_USFGRO0_VW04_WG08_08_01
    SolutionIndex: 6
    SolutionNameMin: Cijk_Ailk_Bjlk_HB_MT064x032x08_GRVW04_TT08_04_USFGRO0_VW04_WG08_08_01
    SolutionIndex: 7
    SolutionNameMin: Cijk_Ailk_Bjlk_HB_MT064x064x08_GRVW08_TT08_08_USFGRO0_VW08_WG08_08_01
    SolutionIndex: 8
    SolutionNameMin: Cijk_Ailk_Bjlk_HB_MT016x016x16_GRVW02_TT02_02_USFGRO0_VW02_WG08_08_01
    SolutionIndex: 9
    SolutionNameMin: Cijk_Ailk_Bjlk_HB_MT032x016x16_GRVW02_TT04_02_USFGRO0_VW02_WG08_08_01
    SolutionIndex: 10
    SolutionNameMin: Cijk_Ailk_Bjlk_HB_MT032x032x16_GRVW04_TT04_04_USFGRO0_VW04_WG08_08_01
    SolutionIndex: 11
    SolutionNameMin: Cijk_Ailk_Bjlk_HB_MT032x016x16_GRVW02_TT02_02_USFGRO0_VW02_WG16_08_01
    SolutionIndex: 12
    SolutionNameMin: Cijk_Ailk_Bjlk_HB_MT064x016x16_GRVW02_TT04_02_USFGRO0_VW02_WG16_08_01
    SolutionIndex: 13
    SolutionNameMin: Cijk_Ailk_Bjlk_HB_MT064x032x16_GRVW04_TT04_04_USFGRO0_VW04_WG16_08_01
    SolutionIndex: 14
    SolutionNameMin: Cijk_Ailk_Bjlk_HB_MT064x016x16_GRVW02_TT02_02_USFGRO01_VW02_WG32_08_01
    SolutionIndex: 15
    SolutionNameMin: Cijk_Ailk_Bjlk_HB_MT032x032x16_GRVW04_TT04_04_USFGRO0_VW04_WG08_08_01
    SolutionIndex: 16
    SolutionNameMin: Cijk_Ailk_Bjlk_HB_MT032x016x16_GRVW02_TT02_02_USFGRO0_VW02_WG16_08_01
    SolutionIndex: 17
    SolutionNameMin: Cijk_Ailk_Bjlk_HB_MT064x016x16_GRVW02_TT04_02_USFGRO0_VW02_WG16_08_01
    SolutionIndex: 18
    SolutionNameMin: Cijk_Ailk_Bjlk_HB_MT064x032x16_GRVW04_TT04_04_USFGRO0_VW04_WG16_08_01
    SolutionIndex: 19
    SolutionNameMin: Cijk_Ailk_Bjlk_HB_MT016x016x32_GRVW02_TT02_02_USFGRO0_VW02_WG08_08_01
    SolutionIndex: 20
    SolutionNameMin: Cijk_Ailk_Bjlk_HB_MT032x016x32_GRVW02_TT02_02_USFGRO0_VW02_WG16_08_01
    SolutionIndex: 21
    SolutionNameMin: Cijk_Ailk_Bjlk_HB_MT064x016x32_GRVW02_TT04_02_USFGRO0_VW02_WG16_08_01
    SolutionIndex: 22
    SolutionNameMin: Cijk_Ailk_Bjlk_HB_MT064x016x32_GRVW02_TT02_02_USFGRO0_VW02_WG32_08_01
    SolutionIndex: 23
    SolutionNameMin: Cijk_Ailk_Bjlk_HB_MT032x016x32_GRVW02_TT04_02_USFGRO0_VW02_WG08_08_01
    SolutionIndex: 24
    SolutionNameMin: Cijk_Ailk_Bjlk_HB_MT032x016x32_GRVW02_TT02_02_USFGRO0_VW02_WG16_08_01
    SolutionIndex: 25
    SolutionNameMin: Cijk_Ailk_Bjlk_HB_MT064x016x32_GRVW02_TT04_02_USFGRO0_VW02_WG16_08_01
    SolutionIndex: 26
    SolutionNameMin: Cijk_Ailk_Bjlk_HB_MT064x016x32_GRVW02_TT02_02_USFGRO0_VW02_WG32_08_01
    SolutionIndex: 27
    SolutionNameMin: Cijk_Ailk_Bjlk_HB_MT016x016x64_GRVW02_TT02_02_USFGRO0_VW02_WG08_08_01
    SolutionIndex: 28
    SolutionNameMin: Cijk_Ailk_Bjlk_HB_MT032x016x64_GRVW02_TT02_02_USFGRO0_VW02_WG16_08_01
    SolutionIndex: 29
    SolutionNameMin: Cijk_Ailk_Bjlk_HB_MT064x016x64_GRVW02_TT02_02_USFGRO0_VW02_WG32_08_01
    SolutionIndex: 30
    SolutionNameMin: Cijk_Ailk_Bjlk_HB_MT064x016x64_GRVW02_TT02_02_USFGRO0_VW02_WG32_08_01
    SolutionIndex: 31
    SolutionNameMin: Cijk_Ailk_Bjlk_HB_MT064x128x08_GRVW04_TT04_08_USFGRO0_VW04_WG16_16_01
    SolutionIndex: 32
    SolutionNameMin: Cijk_Ailk_Bjlk_HB_MT064x064x16_GRVW04_TT04_04_USFGRO0_VW04_WG16_16_01
    SolutionIndex: 33
    SolutionNameMin: Cijk_Ailk_Bjlk_HB_MT064x128x16_GRVW04_TT04_08_USFGRO0_VW04_WG16_16_01
    SolutionIndex: 34
    SolutionNameMin: Cijk_Ailk_Bjlk_HB_MT096x128x16_GRVW02_TT06_08_USFGRO0_VW02_WG16_16_01
    SolutionIndex: 35
    SolutionNameMin: Cijk_Ailk_Bjlk_HB_MT128x064x16_GRVW04_TT08_04_USFGRO0_VW04_WG16_16_01
    SolutionIndex: 36
    SolutionNameMin: Cijk_Ailk_Bjlk_HB_MT128x096x16_GRVW02_TT08_06_USFGRO0_VW02_WG16_16_01
    SolutionIndex: 37
    SolutionNameMin: Cijk_Ailk_Bjlk_HB_MT128x128x16_GRVW08_TT08_08_USFGRO0_VW08_WG16_16_01
    SolutionIndex: 38
    SolutionNameMin: Cijk_Ailk_Bjlk_HB_MT064x064x32_GRVW04_TT04_04_USFGRO0_VW04_WG16_16_01
    SolutionIndex: 39
    SolutionNameMin: Cijk_Ailk_Bjlk_HB_MT032x032x16_GRVW02_TT02_02_USFGRO0_VW02_WG16_16_01
    SolutionIndex: 40
    SolutionNameMin: Cijk_Ailk_Bjlk_HB_MT064x064x16_GRVW04_TT04_04_USFGRO0_VW04_WG16_16_01
    SolutionIndex: 41
    SolutionNameMin: Cijk_Ailk_Bjlk_HB_MT032x032x32_GRVW02_TT02_02_USFGRO0_VW02_WG16_16_01
    SolutionIndex: 42
    SolutionNameMin: Cijk_Ailk_Bjlk_HB_MT064x064x32_GRVW04_TT04_04_USFGRO0_VW04_WG16_16_01
    SolutionIndex: 43
    SolutionNameMin: Cijk_Ailk_Bjlk_HB_MT032x032x64_GRVW02_TT02_02_USFGRO0_VW02_WG16_16_01
    SolutionIndex: 44
    SolutionNameMin: Cijk_Ailk_Bjlk_HB_MT032x128x08_GRVW08_GSU01_PGR1_PLR1_TT04_04_USFGRO0_VW04_WG08_32_01_WGM01
    SolutionIndex: 45
    SolutionNameMin: Cijk_Ailk_Bjlk_HB_MT064x128x08_GRVW08_GSU01_PGR1_PLR1_TT08_04_USFGRO0_VW04_WG08_32_01_WGM01
    SolutionIndex: 46
    SolutionNameMin: Cijk_Ailk_Bjlk_HB_MT064x064x16_GRVW08_GSU01_PGR1_PLR1_TT04_04_USFGRO0_VW04_WG16_16_01_WGM01
    SolutionIndex: 47
    SolutionNameMin: Cijk_Ailk_Bjlk_HB_MT064x256x08_GRVW08_GSU01_PGR1_PLR1_TT08_08_USFGRO0_VW08_WG08_32_01_WGM01
    SolutionIndex: 48
    SolutionNameMin: Cijk_Ailk_Bjlk_HB_MT128x064x16_GRVW08_GSU01_PGR0_PLR1_TT08_08_USFGRO0_VW08_WG16_08_01_WGM01
    SolutionIndex: 49
    SolutionNameMin: Cijk_Ailk_Bjlk_HB_MT128x128x16_GRVW08_GSU01_PGR1_PLR1_TT08_08_USFGRO0_VW08_WG16_16_01_WGM01
    SolutionIndex: 50
    SolutionNameMin: Cijk_Ailk_Bjlk_HB_MT64x64x16_SE_EPS1_FL0_GRVW4_PGR1_PLR1_TT4_4_VW4_WG16_16_1_WGM1
    SolutionIndex: 51
    SolutionNameMin: Cijk_Ailk_Bjlk_HB_MT64x32x16_SE_EPS1_GRVW4_LPA0_LPB0_PGR1_PLR0_TT4_4_VW4_WG16_8_1_WGM8
    SolutionIndex: 52
    SolutionNameMin: Cijk_Ailk_Bjlk_HB_MT032x016x08_GRVW02_TT04_02_USFGRO0_VW02_WG08_08_01
    SolutionIndex: 53
    SolutionNameMin: Cijk_Ailk_Bjlk_HB_MT032x032x08_GRVW04_TT04_04_USFGRO0_VW04_WG08_08_01
    SolutionIndex: 54
    SolutionNameMin: Cijk_Ailk_Bjlk_HB_MT064x016x08_GRVW02_TT04_02_USFGRO01_VW02_WG16_08_01
    SolutionIndex: 55
    SolutionNameMin: Cijk_Ailk_Bjlk_HB_MT128x032x08_GRVW04_TT04_04_USFGRO0_VW04_WG32_08_01
    SolutionIndex: 56
    SolutionNameMin: Cijk_Ailk_Bjlk_HB_MT032x008x08_GRVW02_TT02_02_USFGRO01_VW02_WG16_04_01
    SolutionIndex: 57
    SolutionNameMin: Cijk_Ailk_Bjlk_HB_MT032x032x08_GRVW04_TT04_04_USFGRO0_VW04_WG08_08_01
    SolutionIndex: 58
    SolutionNameMin: Cijk_Ailk_Bjlk_HB_MT064x032x08_GRVW04_TT08_04_USFGRO0_VW04_WG08_08_01
    SolutionIndex: 59
    SolutionNameMin: Cijk_Ailk_Bjlk_HB_MT064x064x08_GRVW08_TT08_08_USFGRO0_VW08_WG08_08_01
    SolutionIndex: 60
    SolutionNameMin: Cijk_Ailk_Bjlk_HB_MT016x016x16_GRVW02_TT02_02_USFGRO0_VW02_WG08_08_01
    SolutionIndex: 61
    SolutionNameMin: Cijk_Ailk_Bjlk_HB_MT032x016x16_GRVW02_TT04_02_USFGRO0_VW02_WG08_08_01
    SolutionIndex: 62
    SolutionNameMin: Cijk_Ailk_Bjlk_HB_MT032x032x16_GRVW04_TT04_04_USFGRO0_VW04_WG08_08_01
    SolutionIndex: 63
    SolutionNameMin: Cijk_Ailk_Bjlk_HB_MT032x016x16_GRVW02_TT02_02_USFGRO0_VW02_WG16_08_01
    SolutionIndex: 64
    SolutionNameMin: Cijk_Ailk_Bjlk_HB_MT064x016x16_GRVW02_TT04_02_USFGRO0_VW02_WG16_08_01
    SolutionIndex: 65
    SolutionNameMin: Cijk_Ailk_Bjlk_HB_MT064x032x16_GRVW04_TT04_04_USFGRO0_VW04_WG16_08_01
    SolutionIndex: 66
    SolutionNameMin: Cijk_Ailk_Bjlk_HB_MT064x016x16_GRVW02_TT02_02_USFGRO01_VW02_WG32_08_01
    SolutionIndex: 67
    SolutionNameMin: Cijk_Ailk_Bjlk_HB_MT032x032x16_GRVW04_TT04_04_USFGRO0_VW04_WG08_08_01
    SolutionIndex: 68
    SolutionNameMin: Cijk_Ailk_Bjlk_HB_MT032x016x16_GRVW02_TT02_02_USFGRO0_VW02_WG16_08_01
    SolutionIndex: 69
    SolutionNameMin: Cijk_Ailk_Bjlk_HB_MT064x016x16_GRVW02_TT04_02_USFGRO0_VW02_WG16_08_01
    SolutionIndex: 70
    SolutionNameMin: Cijk_Ailk_Bjlk_HB_MT064x032x16_GRVW04_TT04_04_USFGRO0_VW04_WG16_08_01
    SolutionIndex: 71
    SolutionNameMin: Cijk_Ailk_Bjlk_HB_MT016x016x32_GRVW02_TT02_02_USFGRO0_VW02_WG08_08_01
    SolutionIndex: 72
    SolutionNameMin: Cijk_Ailk_Bjlk_HB_MT032x016x32_GRVW02_TT02_02_USFGRO0_VW02_WG16_08_01
    SolutionIndex: 73
    SolutionNameMin: Cijk_Ailk_Bjlk_HB_MT064x016x32_GRVW02_TT04_02_USFGRO0_VW02_WG16_08_01
    SolutionIndex: 74
    SolutionNameMin: Cijk_Ailk_Bjlk_HB_MT064x016x32_GRVW02_TT02_02_USFGRO0_VW02_WG32_08_01
    SolutionIndex: 75
    SolutionNameMin: Cijk_Ailk_Bjlk_HB_MT032x016x32_GRVW02_TT04_02_USFGRO0_VW02_WG08_08_01
    SolutionIndex: 76
    SolutionNameMin: Cijk_Ailk_Bjlk_HB_MT032x016x32_GRVW02_TT02_02_USFGRO0_VW02_WG16_08_01
    SolutionIndex: 77
    SolutionNameMin: Cijk_Ailk_Bjlk_HB_MT064x016x32_GRVW02_TT04_02_USFGRO0_VW02_WG16_08_01
    SolutionIndex: 78
    SolutionNameMin: Cijk_Ailk_Bjlk_HB_MT064x016x32_GRVW02_TT02_02_USFGRO0_VW02_WG32_08_01
    SolutionIndex: 79
    SolutionNameMin: Cijk_Ailk_Bjlk_HB_MT016x016x64_GRVW02_TT02_02_USFGRO0_VW02_WG08_08_01
    SolutionIndex: 80
    SolutionNameMin: Cijk_Ailk_Bjlk_HB_MT032x016x64_GRVW02_TT02_02_USFGRO0_VW02_WG16_08_01
    SolutionIndex: 81
    SolutionNameMin: Cijk_Ailk_Bjlk_HB_MT064x016x64_GRVW02_TT02_02_USFGRO0_VW02_WG32_08_01
    SolutionIndex: 82
    SolutionNameMin: Cijk_Ailk_Bjlk_HB_MT064x016x64_GRVW02_TT02_02_USFGRO0_VW02_WG32_08_01
    SolutionIndex: 83
    SolutionNameMin: Cijk_Ailk_Bjlk_HB_MT064x128x08_GRVW04_TT04_08_USFGRO0_VW04_WG16_16_01
    SolutionIndex: 84
    SolutionNameMin: Cijk_Ailk_Bjlk_HB_MT064x064x16_GRVW04_TT04_04_USFGRO0_VW04_WG16_16_01
    SolutionIndex: 85
    SolutionNameMin: Cijk_Ailk_Bjlk_HB_MT064x128x16_GRVW04_TT04_08_USFGRO0_VW04_WG16_16_01
    SolutionIndex: 86
    SolutionNameMin: Cijk_Ailk_Bjlk_HB_MT096x128x16_GRVW02_TT06_08_USFGRO0_VW02_WG16_16_01
    SolutionIndex: 87
    SolutionNameMin: Cijk_Ailk_Bjlk_HB_MT128x064x16_GRVW04_TT08_04_USFGRO0_VW04_WG16_16_01
    SolutionIndex: 88
    SolutionNameMin: Cijk_Ailk_Bjlk_HB_MT128x096x16_GRVW02_TT08_06_USFGRO0_VW02_WG16_16_01
    SolutionIndex: 89
    SolutionNameMin: Cijk_Ailk_Bjlk_HB_MT128x128x16_GRVW08_TT08_08_USFGRO0_VW08_WG16_16_01
    SolutionIndex: 90
    SolutionNameMin: Cijk_Ailk_Bjlk_HB_MT064x064x32_GRVW04_TT04_04_USFGRO0_VW04_WG16_16_01
    SolutionIndex: 91
    SolutionNameMin: Cijk_Ailk_Bjlk_HB_MT032x032x16_GRVW02_TT02_02_USFGRO0_VW02_WG16_16_01
    SolutionIndex: 92
    SolutionNameMin: Cijk_Ailk_Bjlk_HB_MT064x064x16_GRVW04_TT04_04_USFGRO0_VW04_WG16_16_01
    SolutionIndex: 93
    SolutionNameMin: Cijk_Ailk_Bjlk_HB_MT032x032x32_GRVW02_TT02_02_USFGRO0_VW02_WG16_16_01
    SolutionIndex: 94
    SolutionNameMin: Cijk_Ailk_Bjlk_HB_MT064x064x32_GRVW04_TT04_04_USFGRO0_VW04_WG16_16_01
    SolutionIndex: 95
    SolutionNameMin: Cijk_Ailk_Bjlk_HB_MT032x032x64_GRVW02_TT02_02_USFGRO0_VW02_WG16_16_01
    SolutionIndex: 96
    SolutionNameMin: Cijk_Ailk_Bjlk_HB_MT032x128x08_GRVW08_GSU01_PGR1_PLR1_TT04_04_USFGRO0_VW04_WG08_32_01_WGM01
    SolutionIndex: 97
    SolutionNameMin: Cijk_Ailk_Bjlk_HB_MT064x128x08_GRVW08_GSU01_PGR1_PLR1_TT08_04_USFGRO0_VW04_WG08_32_01_WGM01
    SolutionIndex: 98
    SolutionNameMin: Cijk_Ailk_Bjlk_HB_MT064x064x16_GRVW08_GSU01_PGR1_PLR1_TT04_04_USFGRO0_VW04_WG16_16_01_WGM01
    SolutionIndex: 99
    SolutionNameMin: Cijk_Ailk_Bjlk_HB_MT064x256x08_GRVW08_GSU01_PGR1_PLR1_TT08_08_USFGRO0_VW08_WG08_32_01_WGM01
    SolutionIndex: 100
    SolutionNameMin: Cijk_Ailk_Bjlk_HB_MT128x064x16_GRVW08_GSU01_PGR0_PLR1_TT08_08_USFGRO0_VW08_WG16_08_01_WGM01
    SolutionIndex: 101
    SolutionNameMin: Cijk_Ailk_Bjlk_HB_MT128x128x16_GRVW08_GSU01_PGR1_PLR1_TT08_08_USFGRO0_VW08_WG16_16_01_WGM01
    SolutionIndex: 102
    SolutionNameMin: Cijk_Ailk_Bjlk_HB_MT64x64x16_SE_EPS1_FL0_GRVW4_PGR1_PLR1_TT4_4_VW4_WG16_16_1_WGM1
    SolutionIndex: 103
    SolutionNameMin: Cijk_Ailk_Bjlk_HB_MT64x32x16_SE_EPS1_GRVW4_LPA0_LPB0_PGR1_PLR0_TT4_4_VW4_WG16_8_1_WGM8
    SolutionIndex: 104
    SolutionIndex: 105
    SolutionIndex: 106
    SolutionIndex: 107
    SolutionIndex: 108
    SolutionIndex: 109
    SolutionIndex: 110
    SolutionIndex: 111
    SolutionIndex: 112
    SolutionIndex: 113
    SolutionIndex: 114
    SolutionIndex: 115
    SolutionIndex: 116
    SolutionIndex: 117
    SolutionIndex: 118
- - - [1024, 1024, 1, 3328]
    - [35, 16240.0]
  - - [64, 6784, 1, 256]
    - [1, 7390.23]
  - - [2944, 4288, 1, 1280]
    - [31, 19284.1]
  - - [2368, 64, 1, 3328]
    - [20, 6056.26]
  - - [2368, 5888, 1, 256]
    - [31, 18668.2]
  - - [1024, 5056, 1, 3328]
    - [7, 19406.9]
  - - [5888, 1024, 1, 1280]
    - [7, 18739.1]
  - - [128, 6784, 1, 3328]
    - [35, 13554.8]
  - - [5888, 1856, 1, 3328]
    - [35, 19893.7]
  - - [5056, 704, 1, 256]
    - [35, 15863.7]
  - - [5888, 2944, 1, 3328]
    - [37, 20046.9]
  - - [1856, 4288, 1, 256]
    - [7, 17685.6]
  - - [5056, 5056, 1, 3328]
    - [37, 20199.2]
  - - [1408, 5888, 1, 1280]
    - [37, 19680.2]
  - - [448, 3584, 1, 3328]
    - [32, 15081.1]
  - - [256, 4288, 1, 3328]
    - [32, 13939.4]
  - - [5888, 1408, 1, 1280]
    - [37, 19624.9]
  - - [704, 1856, 1, 3328]
    - [32, 16521.4]
  - - [3584, 1856, 1, 3328]
    - [35, 19309.1]
  - - [5056, 6784, 1, 1280]
    - [7, 20380.2]
  - - [1408, 64, 1, 1280]
    - [43, 3896.74]
  - - [448, 1024, 1, 1280]
    - [32, 10922.7]
  - - [5056, 5056, 1, 1280]
    - [37, 20006.4]
  - - [448, 5056, 1, 256]
    - [32, 14554.8]
  - - [6784, 448, 1, 256]
    - [35, 15486.5]
  - - [2368, 128, 1, 256]
    - [12, 5418.62]
  - - [5888, 704, 1, 1280]
    - [7, 18745.7]
  - - [3584, 1024, 1, 256]
    - [31, 16825.3]
  - - [6784, 4288, 1, 3328]
    - [7, 20474.0]
  - - [1856, 2368, 1, 3328]
    - [33, 18096.8]
  - - [5888, 2944, 1, 1280]
    - [37, 19891.6]
  - - [5888, 1024, 1, 256]
    - [7, 17257.4]
  - - [448, 64, 1, 1280]
    - [43, 1415.9]
  - - [2944, 64, 1, 256]
    - [39, 4187.02]
  - - [1408, 2944, 1, 256]
    - [7, 16962.3]
  - - [256, 1856, 1, 1280]
    - [32, 11245.8]
  - - [6784, 5056, 1, 3328]
    - [7, 20507.9]
  - - [5056, 5056, 1, 256]
    - [7, 19202.4]
  - - [448, 704, 1, 1280]
    - [32, 7554.3]
  - - [64, 1024, 1, 1280]
    - [43, 3177.5]
  - - [1024, 3584, 1, 1280]
    - [35, 18647.3]
  - - [2368, 2944, 1, 1280]
    - [7, 18765.5]
  - - [128, 3584, 1, 1280]
    - [32, 10826.0]
  - - [1024, 256, 1, 3328]
    - [38, 9064.95]
  - - [1408, 4288, 1, 1280]
    - [7, 18815.7]
  - - [3584, 4288, 1, 1280]
    - [37, 19889.3]
  - - [2368, 704, 1, 1280]
    - [32, 15233.0]
  - - [5056, 4288, 1, 3328]
    - [7, 20260.0]
  - - [3584, 2368, 1, 3328]
    - [36, 19164.9]
  - - [64, 704, 1, 1280]
    - [43, 2224.99]
  - - [4288, 256, 1, 256]
    - [32, 10977.3]
  - - [6784, 448, 1, 1280]
    - [35, 17799.3]
  - - [64, 64, 1, 1280]
    - [20, 189.41]
  - - [4288, 2944, 1, 256]
    - [31, 18245.9]
  - - [1856, 64, 1, 1280]
    - [41, 5054.64]
  - - [5888, 64, 1, 3328]
    - [42, 9676.67]
  - - [2944, 256, 1, 3328]
    - [32, 14643.8]
  - - [5056, 2368, 1, 1280]
    - [7, 19223.5]
  - - [448, 3584, 1, 1280]
    - [32, 14739.0]
  - - [6784, 5888, 1, 256]
    - [37, 19493.9]
  - - [256, 4288, 1, 1280]
    - [32, 13427.9]
  - - [704, 128, 1, 1280]
    - [24, 3907.3]
  - - [1408, 448, 1, 1280]
    - [32, 11694.7]
  - - [1024, 1408, 1, 256]
    - [32, 12745.1]
  - - [2368, 2368, 1, 3328]
    - [35, 19075.1]
  - - [5056, 704, 1, 3328]
    - [35, 18479.0]
  - - [1408, 1856, 1, 256]
    - [32, 15315.7]
  - - [5888, 1856, 1, 256]
    - [35, 18138.0]
  - - [4288, 64, 1, 3328]
    - [17, 7082.12]
  - - [704, 5888, 1, 256]
    - [7, 17093.3]
  - - [6784, 128, 1, 1280]
    - [33, 12828.8]
  - - [4288, 6784, 1, 3328]
    - [7, 20498.6]
  - - [3584, 704, 1, 3328]
    - [35, 17844.7]
  - - [1408, 1408, 1, 256]
    - [35, 14288.0]
  - - [1856, 128, 1, 256]
    - [12, 4904.63]
  - - [2944, 64, 1, 1280]
    - [41, 6215.79]
  - - [448, 4288, 1, 256]
    - [6, 13876.5]
  - - [64, 3584, 1, 3328]
    - [42, 7991.66]
  - - [704, 2368, 1, 1280]
    - [32, 15172.4]
  - - [1856, 2368, 1, 1280]
    - [33, 17753.1]
  - - [2368, 128, 1, 3328]
    - [12, 7822.04]
  - - [2944, 128, 1, 256]
    - [1, 6518.18]
  - - [448, 1408, 1, 256]
    - [5, 8892.11]
  - - [64, 5056, 1, 3328]
    - [12, 8355.71]
  - - [1408, 1024, 1, 1280]
    - [33, 15277.2]
  - - [2368, 256, 1, 1280]
    - [32, 11252.1]
  - - [6784, 704, 1, 256]
    - [32, 16121.3]
  - - [256, 3584, 1, 3328]
    - [35, 14316.6]
  - - [1408, 3584, 1, 256]
    - [7, 17015.9]
  - - [3584, 4288, 1, 3328]
    - [37, 20084.1]
  - - [5888, 1856, 1, 1280]
    - [35, 19652.7]
  - - [5056, 1024, 1, 3328]
    - [37, 19363.3]
  - - [5056, 64, 1, 1280]
    - [12, 7880.28]
  - - [1024, 704, 1, 256]
    - [32, 9816.46]
  - - [128, 448, 1, 256]
    - [11, 1595.66]
  - - [2368, 3584, 1, 1280]
    - [34, 18915.0]
  - - [1024, 256, 1, 256]
    - [32, 4766.25]
  - - [448, 448, 1, 256]
    - [12, 4197.73]
  - - [2944, 3584, 1, 3328]
    - [33, 19267.5]
  - - [256, 256, 1, 3328]
    - [20, 3276.8]
  - - [128, 1024, 1, 3328]
    - [29, 5965.64]
  - - [6784, 2944, 1, 256]
    - [31, 18775.2]
  - - [64, 1856, 1, 1280]
    - [41, 5136.61]
  - - [1024, 2368, 1, 256]
    - [31, 14396.0]
  - - [4288, 2368, 1, 3328]
    - [7, 19625.8]
  - - [1856, 2368, 1, 256]
    - [32, 16410.8]
  - - [3584, 6784, 1, 3328]
    - [31, 20159.0]
  - - [6784, 1856, 1, 3328]
    - [31, 19375.9]
  - - [1024, 128, 1, 1280]
    - [26, 5433.04]
  - - [4288, 128, 1, 1280]
    - [18, 10223.3]
  - - [5056, 4288, 1, 1280]
    - [7, 20139.5]
  - - [5888, 64, 1, 256]
    - [1, 6414.16]
  - - [1408, 5056, 1, 1280]
    - [7, 19172.1]
  - - [1856, 256, 1, 1280]
    - [32, 11196.1]
  - - [64, 5888, 1, 3328]
    - [13, 9658.75]
  - - [6784, 5888, 1, 3328]
    - [37, 20370.4]
  - - [448, 256, 1, 3328]
    - [20, 5225.65]
  - - [2368, 5056, 1, 1280]
    - [7, 19225.4]
  - - [256, 1408, 1, 3328]
    - [38, 9255.95]
  - - [6784, 128, 1, 3328]
    - [35, 13514.2]
  - - [1024, 5056, 1, 1280]
    - [37, 18960.3]
  - - [4288, 1024, 1, 256]
    - [31, 16319.3]
  - - [2368, 1408, 1, 256]
    - [32, 15462.7]
  - - [704, 704, 1, 3328]
    - [38, 12633.3]
  - - [5888, 448, 1, 1280]
    - [32, 16035.4]
  - - [3584, 256, 1, 3328]
    - [35, 14316.6]
  - - [704, 5888, 1, 3328]
    - [7, 19127.9]
  - - [1024, 6784, 1, 1280]
    - [7, 18689.9]
  - - [128, 3584, 1, 3328]
    - [38, 11729.6]
  - - [6784, 2368, 1, 1280]
    - [35, 19771.7]
  - - [128, 704, 1, 1280]
    - [19, 3907.3]
  - - [3584, 2944, 1, 1280]
    - [31, 19086.6]
  - - [1856, 128, 1, 3328]
    - [38, 8242.56]
  - - [128, 2944, 1, 1280]
    - [13, 9053.02]
  - - [2368, 1024, 1, 3328]
    - [33, 17167.0]
  - - [448, 1856, 1, 1280]
    - [32, 12295.6]
  - - [1408, 5056, 1, 3328]
    - [7, 19405.3]
  - - [1856, 1856, 1, 3328]
    - [35, 17937.3]
  - - [3584, 128, 1, 256]
    - [1, 7850.3]
  - - [448, 1408, 1, 3328]
    - [32, 12331.1]
  - - [2368, 2368, 1, 256]
    - [31, 17204.0]
  - - [4288, 4288, 1, 1280]
    - [7, 19885.8]
  - - [64, 448, 1, 1280]
    - [43, 1438.09]
  - - [704, 6784, 1, 3328]
    - [7, 17910.3]
  - - [5888, 5888, 1, 3328]
    - [37, 20274.6]
  - - [5056, 1024, 1, 1280]
    - [7, 19100.2]
  - - [448, 5888, 1, 3328]
    - [32, 16336.7]
  - - [5056, 5888, 1, 1280]
    - [31, 20248.1]
  - - [448, 6784, 1, 256]
    - [31, 15891.4]
  - - [256, 3584, 1, 256]
    - [32, 10834.0]
  - - [256, 2944, 1, 3328]
    - [32, 14637.0]
  - - [256, 448, 1, 256]
    - [8, 2983.75]
  - - [3584, 5888, 1, 256]
    - [31, 18878.5]
  - - [2944, 3584, 1, 256]
    - [31, 17959.7]
  - - [1408, 704, 1, 256]
    - [32, 11576.4]
  - - [6784, 2944, 1, 3328]
    - [31, 19914.6]
  - - [2944, 5056, 1, 3328]
    - [31, 19842.0]
  - - [64, 64, 1, 3328]
    - [28, 225.388]
  - - [2048, 7133, 1, 2048]
    - [37, 20207.2]
  - - [4288, 5888, 1, 1280]
    - [31, 19948.8]
  - - [4288, 4288, 1, 256]
    - [7, 18980.1]
  - - [448, 2944, 1, 3328]
    - [33, 14503.5]
  - - [4288, 1856, 1, 1280]
    - [7, 18859.1]
  - - [1856, 2944, 1, 3328]
    - [33, 18599.5]
  - - [256, 6784, 1, 3328]
    - [32, 16304.9]
  - - [64, 5888, 1, 256]
    - [1, 6483.13]
  - - [5056, 1024, 1, 256]
    - [31, 17494.7]
  - - [256, 1024, 1, 256]
    - [15, 4686.37]
  - - [5056, 1856, 1, 3328]
    - [7, 20052.0]
  - - [1856, 1408, 1, 256]
    - [31, 15778.1]
  - - [448, 448, 1, 3328]
    - [38, 6986.85]
  - - [448, 2368, 1, 1280]
    - [38, 12648.2]
  - - [1408, 128, 1, 1280]
    - [12, 5837.21]
  - - [5056, 256, 1, 3328]
    - [32, 16356.1]
  - - [256, 64, 1, 1280]
    - [28, 816.648]
  - - [128, 1856, 1, 1280]
    - [10, 7338.01]
  - - [5056, 3584, 1, 256]
    - [31, 18900.3]
  - - [1856, 1024, 1, 1280]
    - [33, 16089.3]
  - - [1856, 1856, 1, 1280]
    - [35, 17547.2]
  - - [6784, 6784, 1, 1280]
    - [37, 20691.9]
  - - [128, 4288, 1, 3328]
    - [18, 10785.4]
  - - [1856, 1024, 1, 3328]
    - [33, 16495.4]
  - - [256, 2368, 1, 256]
    - [15, 8508.18]
  - - [1024, 448, 1, 3328]
    - [32, 11715.2]
  - - [1856, 704, 1, 1280]
    - [32, 15946.6]
  - - [6784, 1024, 1, 256]
    - [7, 17407.8]
  - - [5056, 5888, 1, 3328]
    - [31, 20393.9]
  - - [1856, 1024, 1, 256]
    - [31, 13697.6]
  - - [5056, 1408, 1, 3328]
    - [37, 19378.6]
  - - [1024, 1024, 1, 1280]
    - [32, 15363.8]
  - - [4288, 1024, 1, 3328]
    - [33, 18083.5]
  - - [2944, 1408, 1, 3328]
    - [7, 19134.3]
  - - [2944, 4288, 1, 3328]
    - [31, 19442.9]
  - - [256, 2944, 1, 256]
    - [32, 10262.7]
  - - [5056, 2944, 1, 256]
    - [31, 18635.2]
  - - [2368, 1856, 1, 256]
    - [32, 16315.6]
  - - [128, 448, 1, 1280]
    - [30, 2682.76]
  - - [128, 6784, 1, 1280]
    - [18, 12912.3]
  - - [1408, 3584, 1, 3328]
    - [7, 18907.0]
  - - [2368, 6784, 1, 256]
    - [31, 18830.2]
  - - [5056, 1408, 1, 1280]
    - [7, 19136.7]
  - - [1408, 5888, 1, 3328]
    - [37, 19918.9]
  - - [1856, 5056, 1, 256]
    - [7, 18686.0]
  - - [6784, 6784, 1, 256]
    - [37, 19890.9]
  - - [1408, 704, 1, 3328]
    - [35, 15415.0]
  - - [128, 5888, 1, 1280]
    - [32, 13828.7]
  - - [2368, 4288, 1, 1280]
    - [7, 19433.5]
  - - [3584, 1856, 1, 1280]
    - [35, 18985.1]
  - - [704, 1408, 1, 3328]
    - [33, 15426.5]
  - - [704, 64, 1, 1280]
    - [43, 2171.37]
  - - [5888, 5056, 1, 256]
    - [7, 19354.6]
  - - [3584, 448, 1, 256]
    - [32, 12562.4]
  - - [3072, 7435, 1, 1024]
    - [7, 20147.2]
  - - [256, 6784, 1, 256]
    - [32, 13423.8]
  - - [1856, 3584, 1, 3328]
    - [33, 19301.1]
  - - [5056, 256, 1, 1280]
    - [32, 15820.8]
  - - [512, 32, 1, 512]
    - [29, 672.164]
  - - [3584, 3584, 1, 256]
    - [31, 18482.1]
  - - [6784, 4288, 1, 1280]
    - [7, 20362.1]
  - - [704, 5056, 1, 256]
    - [31, 16318.1]
  - - [6784, 128, 1, 256]
    - [13, 10329.8]
  - - [64, 1408, 1, 3328]
    - [20, 4289.08]
  - - [704, 448, 1, 256]
    - [5, 5256.53]
  - - [2944, 2368, 1, 1280]
    - [7, 18771.8]
  - - [448, 64, 1, 3328]
    - [43, 1519.43]
  - - [6784, 3584, 1, 256]
    - [31, 19027.7]
  - - [256, 1856, 1, 3328]
    - [38, 12126.2]
  - - [704, 6784, 1, 256]
    - [7, 16206.8]
  - - [1024, 3584, 1, 3328]
    - [35, 19086.5]
  - - [64, 128, 1, 3328]
    - [27, 449.584]
  - - [2944, 2944, 1, 3328]
    - [31, 19416.9]
  - - [5056, 6784, 1, 256]
    - [7, 19631.5]
  - - [1408, 4288, 1, 3328]
    - [7, 19056.2]
  - - [6784, 256, 1, 1280]
    - [32, 15851.3]
  - - [2368, 704, 1, 3328]
    - [32, 15640.5]
  - - [128, 4288, 1, 256]
    - [1, 7876.08]
  - - [3584, 6784, 1, 256]
    - [7, 19027.7]
  - - [128, 128, 1, 3328]
    - [28, 880.587]
  - - [5056, 1856, 1, 256]
    - [7, 18570.6]
  - - [256, 128, 1, 256]
    - [14, 979.978]
  - - [704, 4288, 1, 256]
    - [31, 15835.9]
  - - [256, 448, 1, 3328]
    - [29, 5219.94]
  - - [1408, 6784, 1, 1280]
    - [31, 19044.2]
  - - [3584, 3584, 1, 1280]
    - [31, 19603.3]
  - - [64, 2368, 1, 1280]
    - [20, 5498.49]
  - - [64, 6784, 1, 3328]
    - [40, 11101.2]
  - - [2944, 256, 1, 1280]
    - [32, 13892.4]
  - - [5056, 2368, 1, 3328]
    - [37, 19403.9]
  - - [2944, 4288, 1, 256]
    - [31, 18147.5]
  - - [1408, 3584, 1, 1280]
    - [7, 18625.2]
  - - [2368, 64, 1, 256]
    - [16, 3592.34]
  - - [64, 448, 1, 3328]
    - [43, 1525.26]
  - - [1024, 1408, 1, 1280]
    - [35, 15257.0]
  - - [1856, 704, 1, 256]
    - [32, 13066.2]
  - - [1408, 448, 1, 3328]
    - [32, 12313.8]
  - - [2368, 256, 1, 256]
    - [5, 8583.48]
  - - [2368, 6784, 1, 3328]
    - [31, 20072.2]
  - - [5056, 704, 1, 1280]
    - [35, 18079.6]
  - - [1856, 4288, 1, 3328]
    - [7, 19107.4]
  - - [1408, 5888, 1, 256]
    - [7, 18422.9]
  - - [4288, 64, 1, 1280]
    - [12, 6673.12]
  - - [4096, 7133, 1, 4096]
    - [37, 20625.4]
  - - [256, 64, 1, 256]
    - [43, 557.753]
  - - [704, 1856, 1, 256]
    - [32, 12985.1]
  - - [5888, 64, 1, 1280]
    - [13, 9012.42]
  - - [3584, 704, 1, 1280]
    - [35, 17371.0]
  - - [256, 128, 1, 1280]
    - [28, 1588.75]
  - - [256, 2368, 1, 1280]
    - [32, 11265.2]
  - - [3584, 448, 1, 3328]
    - [32, 15091.3]
  - - [704, 2368, 1, 3328]
    - [32, 15651.1]
  - - [2944, 448, 1, 256]
    - [32, 11822.2]
  - - [448, 5056, 1, 3328]
    - [32, 16868.5]
  - - [2368, 128, 1, 1280]
    - [12, 7370.31]
  - - [4288, 448, 1, 256]
    - [6, 13752.3]
  - - [448, 5888, 1, 256]
    - [32, 14355.5]
  - - [64, 5056, 1, 1280]
    - [12, 7808.97]
  - - [5888, 2368, 1, 256]
    - [7, 18278.1]
  - - [704, 448, 1, 3328]
    - [38, 8059.13]
  - - [6784, 704, 1, 3328]
    - [7, 17899.0]
  - - [128, 64, 1, 1280]
    - [28, 412.176]
  - - [1408, 2944, 1, 3328]
    - [7, 19134.3]
  - - [64, 1024, 1, 256]
    - [8, 1959.96]
  - - [5056, 64, 1, 3328]
    - [17, 8345.38]
  - - [2368, 448, 1, 1280]
    - [32, 13087.0]
  - - [128, 3584, 1, 256]
    - [3, 7892.51]
  - - [1856, 448, 1, 3328]
    - [35, 12969.6]
  - - [128, 5056, 1, 256]
    - [1, 9245.26]
  - - [2368, 704, 1, 256]
    - [32, 13043.1]
  - - [3584, 2368, 1, 256]
    - [31, 17510.0]
  - - [5888, 5056, 1, 1280]
    - [37, 20176.0]
  - - [128, 1024, 1, 1280]
    - [26, 5461.33]
  - - [64, 704, 1, 256]
    - [39, 1413.52]
  - - [4288, 256, 1, 1280]
    - [32, 13479.4]
  - - [3584, 3584, 1, 3328]
    - [31, 19796.8]
  - - [704, 704, 1, 256]
    - [32, 8260.27]
  - - [5888, 6784, 1, 256]
    - [37, 19482.0]
  - - [4288, 2944, 1, 3328]
    - [31, 19459.5]
  - - [1856, 64, 1, 256]
    - [39, 3115.65]
  - - [4288, 128, 1, 3328]
    - [13, 10816.1]
  - - [4288, 704, 1, 1280]
    - [7, 17672.9]
  - - [256, 5056, 1, 1280]
    - [32, 15796.6]
  - - [6784, 5888, 1, 1280]
    - [37, 20233.2]
  - - [704, 128, 1, 256]
    - [16, 2363.59]
  - - [5888, 4288, 1, 1280]
    - [31, 19924.2]
  - - [448, 256, 1, 1280]
    - [22, 4854.52]
  - - [704, 64, 1, 3328]
    - [43, 2299.79]
  - - [256, 1408, 1, 1280]
    - [5, 8506.15]
  - - [512, 16, 1, 512]
    - [8, 306.601]
  - - [1408, 1856, 1, 1280]
    - [35, 17968.2]
  - - [5888, 448, 1, 3328]
    - [32, 16331.8]
  - - [704, 5888, 1, 1280]
    - [7, 18804.2]
  - - [1024, 6784, 1, 3328]
    - [36, 18973.6]
  - - [704, 2944, 1, 1280]
    - [33, 17434.9]
  - - [6784, 64, 1, 3328]
    - [42, 11128.6]
  - - [5056, 2944, 1, 3328]
    - [31, 19833.1]
  - - [448, 128, 1, 256]
    - [14, 1555.09]
  - - [1408, 1408, 1, 3328]
    - [35, 17202.9]
  - - [1856, 128, 1, 1280]
    - [10, 7309.78]
  - - [448, 4288, 1, 1280]
    - [33, 16185.5]
  - - [64, 3584, 1, 256]
    - [9, 4705.15]
  - - [128, 2944, 1, 3328]
    - [13, 9664.74]
  - - [3584, 704, 1, 256]
    - [32, 14760.6]
  - - [2944, 448, 1, 3328]
    - [35, 14503.5]
  - - [3584, 1408, 1, 3328]
    - [37, 18910.5]
  - - [2368, 1024, 1, 1280]
    - [33, 16723.0]
  - - [1856, 6784, 1, 256]
    - [31, 18182.1]
  - - [4288, 448, 1, 3328]
    - [35, 16659.3]
  - - [4288, 3584, 1, 1280]
    - [37, 19868.4]
  - - [1760, 7133, 1, 1760]
    - [31, 19244.0]
  - - [5888, 1024, 1, 3328]
    - [37, 19018.7]
  - - [704, 6784, 1, 1280]
    - [7, 17668.2]
  - - [1024, 2944, 1, 3328]
    - [33, 18107.1]
  - - [2368, 448, 1, 3328]
    - [32, 13487.7]
  - - [704, 5056, 1, 1280]
    - [33, 18102.6]
  - - [1024, 5888, 1, 1280]
    - [7, 18779.2]
  - - [2944, 1856, 1, 256]
    - [31, 16877.4]
  - - [5056, 64, 1, 256]
    - [12, 5689.39]
  - - [3584, 5056, 1, 256]
    - [31, 18784.0]
  - - [5888, 5056, 1, 3328]
    - [37, 20351.7]
  - - [128, 5056, 1, 3328]
    - [13, 12681.2]
  - - [3584, 6784, 1, 1280]
    - [31, 20028.9]
  - - [1856, 5888, 1, 256]
    - [31, 18601.1]
  - - [256, 256, 1, 256]
    - [26, 1839.61]
  - - [4288, 4288, 1, 3328]
    - [7, 20028.2]
  - - [4288, 1408, 1, 1280]
    - [7, 18750.0]
  - - [64, 1856, 1, 256]
    - [39, 3221.26]
  - - [4288, 2368, 1, 256]
    - [7, 18326.4]
  - - [2944, 5056, 1, 1280]
    - [31, 19672.7]
  - - [6784, 64, 1, 256]
    - [40, 7312.44]
  - - [6784, 2368, 1, 3328]
    - [35, 19982.2]
  - - [256, 1024, 1, 1280]
    - [15, 8128.5]
  - - [4288, 1856, 1, 3328]
    - [7, 19087.6]
  - - [1856, 2944, 1, 1280]
    - [31, 18301.2]
  - - [3584, 64, 1, 1280]
    - [10, 7057.72]
  - - [2944, 5888, 1, 1280]
    - [37, 19877.3]
  - - [3584, 1024, 1, 1280]
    - [33, 18641.4]
  - - [1024, 4288, 1, 256]
    - [32, 16243.8]
  - - [5888, 3584, 1, 3328]
    - [31, 20006.6]
  - - [5056, 3584, 1, 3328]
    - [31, 20074.1]
  - - [1408, 128, 1, 3328]
    - [21, 6582.37]
  - - [2368, 1408, 1, 1280]
    - [32, 17292.2]
  - - [5056, 2944, 1, 1280]
    - [31, 19658.1]
  - - [128, 2368, 1, 256]
    - [9, 5388.52]
  - - [3584, 256, 1, 256]
    - [32, 10794.2]
  - - [1024, 6784, 1, 256]
    - [7, 17353.5]
  - - [3584, 2944, 1, 256]
    - [31, 17969.2]
  - - [448, 128, 1, 3328]
    - [28, 2877.58]
  - - [3584, 1408, 1, 1280]
    - [7, 18612.3]
  - - [64, 4288, 1, 3328]
    - [17, 7099.71]
  - - [5056, 6784, 1, 3328]
    - [7, 20525.6]
  - - [128, 2944, 1, 256]
    - [3, 6414.16]
  - - [3584, 4288, 1, 256]
    - [7, 18820.6]
  - - [1856, 6784, 1, 3328]
    - [31, 19401.8]
  - - [3584, 128, 1, 3328]
    - [38, 11715.2]
  - - [128, 256, 1, 1280]
    - [28, 1574.44]
  - - [1024, 448, 1, 1280]
    - [32, 10826.0]
  - - [5056, 1408, 1, 256]
    - [7, 17838.9]
  - - [64, 256, 1, 1280]
    - [43, 819.2]
  - - [256, 704, 1, 256]
    - [32, 3392.45]
  - - [5888, 5888, 1, 256]
    - [7, 19324.0]
  - - [4288, 1024, 1, 1280]
    - [33, 17763.5]
  - - [5888, 128, 1, 3328]
    - [32, 14637.0]
  - - [448, 6784, 1, 3328]
    - [33, 18244.1]
  - - [2944, 1408, 1, 1280]
    - [7, 18788.2]
  - - [1024, 32, 1, 512]
    - [22, 1294.54]
  - - [2944, 1856, 1, 3328]
    - [35, 18604.1]
  - - [128, 1024, 1, 256]
    - [11, 3328.81]
  - - [3584, 5888, 1, 1280]
    - [31, 19858.9]
  - - [6784, 1856, 1, 1280]
    - [31, 19197.4]
  - - [5888, 256, 1, 3328]
    - [33, 16527.4]
  - - [1856, 5888, 1, 3328]
    - [31, 19961.8]
  - - [3584, 1408, 1, 256]
    - [7, 17033.8]
  - - [64, 448, 1, 256]
    - [43, 976.068]
  - - [704, 3584, 1, 3328]
    - [33, 17847.7]
  - - [5056, 448, 1, 1280]
    - [32, 16503.4]
  - - [4288, 704, 1, 256]
    - [7, 15530.6]
  - - [1408, 704, 1, 1280]
    - [35, 14630.7]
  - - [2944, 1024, 1, 256]
    - [31, 15711.6]
  - - [448, 1408, 1, 1280]
    - [32, 11627.4]
  - - [2368, 4288, 1, 3328]
    - [7, 19624.9]
  - - [64, 64, 1, 256]
    - [8, 110.145]
  - - [704, 1408, 1, 1280]
    - [32, 14644.2]
  - - [6784, 5056, 1, 256]
    - [7, 19621.0]
  - - [3584, 5056, 1, 3328]
    - [31, 20067.6]
  - - [4288, 5888, 1, 256]
    - [31, 18992.2]
  - - [448, 2944, 1, 256]
    - [32, 11789.2]
  - - [2944, 6784, 1, 256]
    - [31, 18775.2]
  - - [2368, 2368, 1, 1280]
    - [31, 18730.4]
  - - [1856, 3584, 1, 1280]
    - [31, 19029.2]
  - - [64, 2944, 1, 256]
    - [41, 4245.99]
  - - [5056, 3584, 1, 1280]
    - [31, 19912.9]
  - - [256, 5888, 1, 256]
    - [32, 13142.9]
  - - [128, 256, 1, 3328]
    - [28, 1721.15]
  - - [1856, 1408, 1, 3328]
    - [33, 18466.3]
  - - [1024, 4288, 1, 3328]
    - [35, 18094.3]
  - - [448, 2368, 1, 256]
    - [5, 10542.7]
  - - [64, 1408, 1, 1280]
    - [41, 3950.11]
  - - [2944, 2368, 1, 3328]
    - [36, 19018.3]
  - - [704, 128, 1, 3328]
    - [20, 4298.92]
  - - [1408, 128, 1, 256]
    - [12, 3923.24]
  - - [1024, 1856, 1, 1280]
    - [35, 16046.8]
  - - [6784, 1856, 1, 256]
    - [31, 18043.7]
  - - [1024, 5888, 1, 256]
    - [7, 17288.3]
  - - [64, 2944, 1, 1280]
    - [41, 6215.79]
  - - [64, 5056, 1, 256]
    - [2, 5689.39]
  - - [1408, 2368, 1, 256]
    - [32, 15690.1]
  - - [2944, 704, 1, 3328]
    - [35, 17958.6]
  - - [64, 128, 1, 1280]
    - [28, 417.427]
  - - [2944, 2944, 1, 1280]
    - [31, 19214.9]
  - - [6784, 256, 1, 3328]
    - [32, 16271.8]
  - - [1408, 5056, 1, 256]
    - [7, 17797.0]
  - - [5056, 128, 1, 3328]
    - [13, 12687.2]
  - - [128, 128, 1, 1280]
    - [28, 814.112]
  - - [448, 704, 1, 256]
    - [5, 5368.37]
  - - [1856, 256, 1, 3328]
    - [38, 12126.1]
  - - [2944, 128, 1, 3328]
    - [13, 9652.84]
  - - [704, 256, 1, 1280]
    - [38, 5848.98]
  - - [256, 448, 1, 1280]
    - [24, 4880.34]
  - - [5056, 256, 1, 256]
    - [32, 12783.6]
  - - [64, 2368, 1, 3328]
    - [20, 6004.35]
  - - [256, 704, 1, 3328]
    - [38, 6294.98]
  - - [64, 6784, 1, 1280]
    - [40, 10322.2]
  - - [1408, 4288, 1, 256]
    - [7, 17389.8]
  - - [5888, 2368, 1, 1280]
    - [35, 19630.8]
  - - [128, 256, 1, 256]
    - [22, 1018.03]
  - - [64, 128, 1, 256]
    - [28, 281.875]
  - - [2368, 5888, 1, 1280]
    - [31, 19759.5]
  - - [5888, 256, 1, 1280]
    - [35, 15919.0]
  - - [704, 1024, 1, 1280]
    - [32, 13288.4]
  - - [2368, 1856, 1, 3328]
    - [35, 18095.0]
  - - [2944, 704, 1, 256]
    - [6, 14837.2]
  - - [2368, 6784, 1, 1280]
    - [31, 19901.8]
  - - [1856, 4288, 1, 1280]
    - [7, 18870.3]
  - - [704, 3584, 1, 256]
    - [31, 15320.7]
  - - [704, 2944, 1, 3328]
    - [33, 17996.1]
  - - [1856, 5056, 1, 3328]
    - [7, 20073.6]
  - - [3584, 5056, 1, 1280]
    - [31, 19904.7]
  - - [2944, 1024, 1, 3328]
    - [35, 18109.7]
  - - [256, 4288, 1, 256]
    - [32, 11151.5]
  - - [1408, 6784, 1, 256]
    - [31, 17864.3]
  - - [6784, 1408, 1, 3328]
    - [31, 19206.2]
  - - [1024, 2368, 1, 1280]
    - [35, 16715.8]
  - - [704, 64, 1, 256]
    - [22, 1373.14]
  - - [256, 2368, 1, 3328]
    - [32, 11839.6]
  - - [6784, 2944, 1, 1280]
    - [31, 19729.2]
  - - [3584, 448, 1, 1280]
    - [32, 14671.7]
  - - [2944, 6784, 1, 3328]
    - [31, 19923.2]
  - - [448, 5056, 1, 1280]
    - [32, 16495.8]
  - - [64, 2944, 1, 3328]
    - [21, 6875.49]
  - - [128, 1408, 1, 256]
    - [14, 3923.24]
  - - [1408, 256, 1, 1280]
    - [5, 8531.31]
  - - [5888, 704, 1, 256]
    - [7, 16875.9]
  - - [256, 5888, 1, 3328]
    - [33, 16553.5]
  - - [6784, 4288, 1, 256]
    - [7, 19535.6]
  - - [5888, 256, 1, 256]
    - [32, 13142.9]
  - - [128, 1408, 1, 3328]
    - [23, 6479.96]
  - - [6784, 1024, 1, 1280]
    - [7, 18693.1]
  - - [704, 448, 1, 1280]
    - [32, 7645.79]
  - - [128, 64, 1, 3328]
    - [28, 448.404]
  - - [448, 64, 1, 256]
    - [43, 908.42]
  - - [2944, 704, 1, 1280]
    - [35, 17453.3]
  - - [6784, 3584, 1, 1280]
    - [31, 20017.6]
  - - [1024, 704, 1, 1280]
    - [32, 13319.0]
  - - [1408, 2944, 1, 1280]
    - [7, 18782.9]
  - - [256, 1856, 1, 256]
    - [32, 7797.1]
  - - [1408, 2368, 1, 3328]
    - [32, 17594.9]
  - - [1024, 3584, 1, 256]
    - [31, 16611.1]
  - - [2368, 2944, 1, 256]
    - [7, 17483.1]
  - - [704, 1856, 1, 1280]
    - [32, 15995.3]
  - - [1408, 256, 1, 3328]
    - [38, 9250.2]
  - - [1024, 16, 1, 512]
    - [11, 599.186]
  - - [5888, 128, 1, 256]
    - [3, 10577.7]
  - - [2944, 5888, 1, 256]
    - [7, 18931.6]
  - - [3584, 1856, 1, 256]
    - [35, 17193.9]
  - - [2368, 448, 1, 256]
    - [32, 10950.9]
  - - [4288, 256, 1, 3328]
    - [32, 13926.6]
  - - [1408, 64, 1, 256]
    - [8, 2402.99]
  - - [704, 4288, 1, 3328]
    - [33, 18102.9]
  - - [4288, 2944, 1, 1280]
    - [31, 19282.3]
  - - [1024, 64, 1, 256]
    - [20, 1959.96]
  - - [64, 2368, 1, 256]
    - [11, 3673.99]
  - - [4288, 5056, 1, 3328]
    - [7, 20281.8]
  - - [2944, 256, 1, 256]
    - [32, 10395.4]
  - - [1024, 128, 1, 3328]
    - [26, 5926.73]
  - - [256, 5056, 1, 3328]
    - [32, 16381.0]
  - - [5056, 2368, 1, 256]
    - [7, 18217.9]
  - - [4288, 704, 1, 3328]
    - [35, 18118.6]
  - - [448, 3584, 1, 256]
    - [32, 12531.8]
  - - [2368, 64, 1, 1280]
    - [20, 5498.49]
  - - [1408, 448, 1, 256]
    - [5, 8776.13]
  - - [1024, 1408, 1, 3328]
    - [35, 15863.1]
  - - [2560, 7133, 1, 2560]
    - [31, 20183.6]
  - - [5888, 3584, 1, 256]
    - [31, 18867.9]
  - - [1408, 1856, 1, 3328]
    - [35, 18463.2]
  - - [6784, 1408, 1, 1280]
    - [31, 19013.4]
  - - [704, 2944, 1, 256]
    - [31, 14870.3]
  - - [4288, 64, 1, 256]
    - [12, 4989.67]
  - - [2944, 5888, 1, 3328]
    - [37, 20063.6]
  - - [64, 4288, 1, 1280]
    - [12, 6703.68]
  - - [6784, 64, 1, 1280]
    - [40, 10399.4]
  - - [1408, 6784, 1, 3328]
    - [31, 19223.0]
  - - [1408, 64, 1, 3328]
    - [20, 4279.29]
  - - [1408, 1408, 1, 1280]
    - [35, 16765.0]
  - - [448, 1024, 1, 3328]
    - [38, 11736.8]
  - - [448, 4288, 1, 3328]
    - [33, 16669.7]
  - - [704, 2368, 1, 256]
    - [32, 12701.3]
  - - [2944, 448, 1, 1280]
    - [35, 13975.2]
  - - [5888, 2368, 1, 3328]
    - [35, 19864.4]
  - - [4288, 5056, 1, 256]
    - [7, 19271.2]
  - - [4288, 448, 1, 1280]
    - [35, 16151.5]
  - - [5888, 704, 1, 3328]
    - [7, 19094.0]
  - - [4288, 3584, 1, 3328]
    - [37, 20089.8]
  - - [5056, 128, 1, 256]
    - [13, 9204.17]
  - - [128, 64, 1, 256]
    - [4, 231.986]
  - - [448, 1024, 1, 256]
    - [5, 7567.04]
  - - [6784, 6784, 1, 3328]
    - [37, 20797.3]
  - - [704, 5056, 1, 3328]
    - [33, 18534.5]
  - - [1024, 64, 1, 1280]
    - [43, 3093.14]
  - - [64, 1024, 1, 3328]
    - [43, 3328.81]
  - - [2368, 2944, 1, 3328]
    - [34, 19069.6]
  - - [448, 448, 1, 1280]
    - [38, 6487.4]
  - - [2368, 3584, 1, 256]
    - [31, 17681.0]
  - - [1024, 256, 1, 1280]
    - [15, 8112.77]
  - - [128, 5056, 1, 1280]
    - [13, 12012.4]
  - - [3584, 2368, 1, 1280]
    - [36, 18846.7]
  - - [1856, 1856, 1, 256]
    - [31, 15815.0]
  - - [4288, 1408, 1, 3328]
    - [37, 19044.6]
  - - [3584, 64, 1, 3328]
    - [42, 7958.33]
  - - [4288, 5056, 1, 1280]
    - [7, 20150.0]
  - - [5888, 6784, 1, 1280]
    - [37, 20255.0]
  - - [256, 1024, 1, 3328]
    - [38, 9042.45]
  - - [1856, 64, 1, 3328]
    - [41, 5577.22]
  - - [5888, 1408, 1, 3328]
    - [37, 19898.3]
  - - [256, 5056, 1, 256]
    - [32, 12943.4]
  - - [1408, 1024, 1, 256]
    - [32, 12710.0]
  - - [448, 256, 1, 256]
    - [14, 2959.69]
  - - [1408, 256, 1, 256]
    - [5, 6135.29]
  - - [2368, 5056, 1, 256]
    - [7, 18244.0]
  - - [128, 5888, 1, 3328]
    - [32, 14657.5]
  - - [1024, 5056, 1, 256]
    - [7, 17366.4]
  - - [2368, 1408, 1, 3328]
    - [32, 17603.8]
  - - [5888, 448, 1, 256]
    - [32, 14331.1]
  - - [6784, 5056, 1, 1280]
    - [7, 20378.7]
  - - [4288, 6784, 1, 1280]
    - [7, 20385.3]
  - - [128, 704, 1, 256]
    - [11, 2423.18]
  - - [1024, 128, 1, 256]
    - [14, 3355.44]
  - - [448, 128, 1, 1280]
    - [20, 2682.76]
  - - [1024, 64, 1, 3328]
    - [43, 3320.7]
  - - [64, 3584, 1, 1280]
    - [10, 7098.68]
  - - [6784, 1408, 1, 256]
    - [31, 17895.8]
  - - [5888, 4288, 1, 256]
    - [7, 18992.2]
  - - [5056, 5888, 1, 256]
    - [7, 19370.3]
  - - [2368, 1024, 1, 256]
    - [31, 14668.2]
  - - [1856, 6784, 1, 1280]
    - [31, 19256.1]
  - - [3584, 128, 1, 1280]
    - [32, 10842.0]
  - - [4288, 128, 1, 256]
    - [1, 7983.48]
  - - [4288, 3584, 1, 256]
    - [7, 18878.4]
  - - [64, 256, 1, 3328]
    - [27, 893.275]
  - - [5056, 1856, 1, 1280]
    - [7, 19831.3]
  - - [1408, 1024, 1, 3328]
    - [33, 15858.9]
  - - [2368, 256, 1, 3328]
    - [32, 11845.1]
  - - [5888, 3584, 1, 1280]
    - [31, 19854.2]
  - - [5888, 128, 1, 1280]
    - [32, 13797.1]
  - - [1024, 2944, 1, 256]
    - [31, 15435.0]
  - - [448, 6784, 1, 1280]
    - [33, 17825.4]
  - - [256, 3584, 1, 1280]
    - [32, 13480.3]
  - - [3584, 1024, 1, 3328]
    - [33, 19081.7]
  - - [2944, 1856, 1, 1280]
    - [31, 18293.6]
  - - [128, 5888, 1, 256]
    - [1, 10350.8]
  - - [2368, 3584, 1, 3328]
    - [34, 19184.7]
  - - [3584, 5888, 1, 3328]
    - [31, 20032.6]
  - - [2944, 3584, 1, 1280]
    - [31, 19084.4]
  - - [1856, 5888, 1, 1280]
    - [31, 19763.8]
  - - [256, 256, 1, 1280]
    - [28, 3057.07]
  - - [5056, 448, 1, 3328]
    - [32, 16841.4]
  - - [4288, 1408, 1, 256]
    - [7, 17421.1]
  - - [3584, 64, 1, 256]
    - [12, 4735.5]
  - - [64, 1856, 1, 3328]
    - [43, 5602.51]
  - - [1024, 1024, 1, 256]
    - [32, 11983.7]
  - - [4288, 2368, 1, 1280]
    - [7, 19440.4]
  - - [2944, 5056, 1, 256]
    - [31, 18519.3]
  - - [256, 128, 1, 3328]
    - [28, 1732.08]
  - - [6784, 2368, 1, 256]
    - [7, 18551.6]
  - - [1024, 1024, 1, 1024]
    - [32, 15063.7]
  - - [2944, 64, 1, 3328]
    - [21, 6863.49]
  - - [4288, 1856, 1, 256]
    - [7, 17697.9]
  - - [1856, 2944, 1, 256]
    - [31, 16959.3]
  - - [64, 5888, 1, 1280]
    - [13, 8972.19]
  - - [1856, 1408, 1, 1280]
    - [33, 17960.4]
  - - [704, 1024, 1, 256]
    - [32, 10073.4]
  - - [1024, 4288, 1, 1280]
    - [35, 17741.1]
  - - [2368, 5056, 1, 3328]
    - [37, 19432.0]
  - - [1024, 1856, 1, 3328]
    - [35, 16505.8]
  - - [704, 704, 1, 1280]
    - [32, 11678.6]
  - - [128, 2368, 1, 1280]
    - [12, 7381.53]
  - - [3584, 256, 1, 1280]
    - [32, 13530.0]
  - - [704, 3584, 1, 1280]
    - [33, 17378.5]
  - - [128, 704, 1, 3328]
    - [28, 4308.8]
  - - [4288, 6784, 1, 256]
    - [7, 19543.8]
  - - [3584, 2944, 1, 3328]
    - [31, 19261.6]
  - - [128, 1856, 1, 256]
    - [12, 4936.48]
  - - [64, 4288, 1, 256]
    - [0, 4825.18]
  - - [5888, 2944, 1, 256]
    - [7, 18873.7]
  - - [5056, 128, 1, 1280]
    - [13, 12040.3]
  - - [448, 1856, 1, 3328]
    - [33, 12969.6]
  - - [5056, 4288, 1, 256]
    - [7, 19244.5]
  - - [1024, 448, 1, 256]
    - [32, 7606.25]
  - - [2944, 128, 1, 1280]
    - [13, 8972.19]
  - - [6784, 1024, 1, 3328]
    - [34, 18986.1]
  - - [64, 256, 1, 256]
    - [41, 563.751]
  - - [704, 256, 1, 3328]
    - [38, 6289.66]
  - - [256, 704, 1, 1280]
    - [38, 5813.68]
  - - [5888, 5888, 1, 1280]
    - [37, 20112.3]
  - - [448, 5888, 1, 1280]
    - [32, 16047.6]
  - - [2944, 1408, 1, 256]
    - [7, 17093.4]
  - - [256, 2944, 1, 1280]
    - [32, 13892.4]
  - - [1024, 2944, 1, 1280]
    - [35, 17668.3]
  - - [2368, 5888, 1, 3328]
    - [31, 19942.2]
  - - [704, 1024, 1, 3328]
    - [32, 14079.5]
  - - [2368, 1856, 1, 1280]
    - [35, 17748.6]
  - - [1856, 448, 1, 1280]
    - [32, 12272.9]
  - - [128, 6784, 1, 256]
    - [13, 10368.4]
  - - [5888, 4288, 1, 3328]
    - [31, 20077.3]
  - - [6784, 704, 1, 1280]
    - [7, 17635.6]
  - - [5056, 448, 1, 256]
    - [32, 14438.8]
  - - [1856, 5056, 1, 1280]
    - [7, 19878.6]
  - - [2944, 1024, 1, 1280]
    - [33, 17674.8]
  - - [2368, 4288, 1, 256]
    - [7, 18305.8]
  - - [1024, 2368, 1, 3328]
    - [35, 17169.9]
  - - [64, 704, 1, 3328]
    - [41, 2313.99]
  - - [704, 1408, 1, 256]
    - [32, 11618.8]
  - - [4288, 5888, 1, 3328]
    - [31, 20112.3]
  - - [256, 1408, 1, 256]
    - [5, 6070.7]
  - - [448, 2944, 1, 1280]
    - [33, 13947.5]
  - - [2944, 6784, 1, 1280]
    - [31, 19743.8]
  - - [256, 6784, 1, 1280]
    - [38, 15602.1]
  - - [1856, 3584, 1, 256]
    - [31, 17679.5]
  - - [128, 448, 1, 3328]
    - [28, 2877.58]
  - - [1856, 256, 1, 256]
    - [5, 7877.9]
  - - [128, 2368, 1, 3328]
    - [12, 7865.96]
  - - [256, 5888, 1, 1280]
    - [33, 15929.5]
  - - [448, 2368, 1, 3328]
    - [32, 13471.3]
  - - [64, 1408, 1, 256]
    - [8, 2485.85]
  - - [7680, 5481, 1, 2560]
    - [37, 20375.0]
  - - [2944, 2368, 1, 256]
    - [7, 17538.1]
  - - [1856, 448, 1, 256]
    - [32, 9928.22]
  - - [1024, 1856, 1, 256]
    - [6, 13605.7]
  - - [6784, 3584, 1, 3328]
    - [31, 20154.5]
  - - [1024, 704, 1, 3328]
    - [32, 14059.7]
  - - [1024, 5888, 1, 3328]
    - [7, 19056.3]
  - - [1408, 2368, 1, 1280]
    - [32, 17320.2]
  - - [128, 1408, 1, 1280]
    - [25, 5872.88]
  - - [256, 64, 1, 3328]
    - [43, 884.013]
  - - [128, 1856, 1, 3328]
    - [38, 8215.15]
  - - [2944, 2944, 1, 256]
    - [31, 17939.7]
  - - [6784, 256, 1, 256]
    - [32, 13456.3]
  - - [128, 4288, 1, 1280]
    - [13, 10235.2]
  - - [5888, 1408, 1, 256]
    - [7, 18308.5]
  - - [128, 128, 1, 256]
    - [20, 534.988]
  - - [448, 704, 1, 3328]
    - [32, 8059.16]
  - - [448, 1856, 1, 256]
    - [32, 9818.31]
  - - [1856, 704, 1, 3328]
    - [32, 16501.4]
  - - [5888, 6784, 1, 3328]
    - [37, 20361.4]
  - - [704, 4288, 1, 1280]
    - [7, 17659.9]
  - - [704, 256, 1, 256]
    - [32, 3432.71]
  - - [6784, 448, 1, 3328]
    - [35, 18238.9]
  - - [3136, 256, 64, 64]
    - [47, 18044.0]
  - - [784, 512, 64, 128]
    - [47, 17307.0]
  - - [784, 128, 64, 512]
    - [45, 17476.3]
  - - [3136, 64, 128, 64]
    - [48, 16056.3]
  - - [196, 256, 128, 1024]
    - [49, 15084.1]
  - - [196, 256, 64, 1024]
    - [44, 14493.7]
  - - [196, 1024, 128, 256]
    - [44, 15064.8]
  - - [784, 128, 256, 512]
    - [45, 18341.9]
  - - [3136, 64, 64, 256]
    - [46, 17871.4]
  - - [3136, 64, 256, 256]
    - [48, 18842.2]
  - - [3136, 256, 256, 64]
    - [47, 18620.2]
  - - [3136, 64, 128, 256]
    - [48, 18309.2]
  - - [784, 128, 128, 512]
    - [45, 18040.0]
  - - [784, 512, 128, 128]
    - [47, 17794.0]
  - - [784, 512, 256, 128]
    - [47, 18095.6]
  - - [196, 1024, 64, 256]
    - [44, 14817.7]
  - - [3136, 64, 64, 64]
    - [48, 14936.1]
  - - [196, 1024, 256, 256]
    - [44, 15208.3]
  - - [196, 256, 256, 1024]
    - [49, 15458.5]
  - - [3136, 256, 128, 64]
    - [47, 18415.9]
  - - [3136, 64, 256, 64]
    - [48, 16702.2]
  - - [64, 128, 1024, 128]
    - [50, 16269.4]
  - - [1024, 1024, 1, 8192]
    - [51, 18496.8]
  - - [1024, 1024, 1, 3328]
    - [87, 16240.0]
  - - [64, 6784, 1, 256]
    - [53, 7390.23]
  - - [2944, 4288, 1, 1280]
    - [83, 19284.1]
  - - [2368, 64, 1, 3328]
    - [72, 6056.26]
  - - [2368, 5888, 1, 256]
    - [83, 18668.2]
  - - [1024, 5056, 1, 3328]
    - [59, 19406.9]
  - - [5888, 1024, 1, 1280]
    - [59, 18739.1]
  - - [128, 6784, 1, 3328]
    - [87, 13554.8]
  - - [5888, 1856, 1, 3328]
    - [87, 19893.7]
  - - [5056, 704, 1, 256]
    - [87, 15863.7]
  - - [5888, 2944, 1, 3328]
    - [89, 20046.9]
  - - [1856, 4288, 1, 256]
    - [59, 17685.6]
  - - [5056, 5056, 1, 3328]
    - [89, 20199.2]
  - - [1408, 5888, 1, 1280]
    - [89, 19680.2]
  - - [448, 3584, 1, 3328]
    - [84, 15081.1]
  - - [256, 4288, 1, 3328]
    - [84, 13939.4]
  - - [5888, 1408, 1, 1280]
    - [89, 19624.9]
  - - [704, 1856, 1, 3328]
    - [84, 16521.4]
  - - [3584, 1856, 1, 3328]
    - [87, 19309.1]
  - - [5056, 6784, 1, 1280]
    - [59, 20380.2]
  - - [1408, 64, 1, 1280]
    - [95, 3896.74]
  - - [448, 1024, 1, 1280]
    - [84, 10922.7]
  - - [5056, 5056, 1, 1280]
    - [89, 20006.4]
  - - [448, 5056, 1, 256]
    - [84, 14554.8]
  - - [6784, 448, 1, 256]
    - [87, 15486.5]
  - - [2368, 128, 1, 256]
    - [64, 5418.62]
  - - [5888, 704, 1, 1280]
    - [59, 18745.7]
  - - [3584, 1024, 1, 256]
    - [83, 16825.3]
  - - [6784, 4288, 1, 3328]
    - [59, 20474.0]
  - - [1856, 2368, 1, 3328]
    - [85, 18096.8]
  - - [5888, 2944, 1, 1280]
    - [89, 19891.6]
  - - [5888, 1024, 1, 256]
    - [59, 17257.4]
  - - [448, 64, 1, 1280]
    - [95, 1415.9]
  - - [2944, 64, 1, 256]
    - [91, 4187.02]
  - - [1408, 2944, 1, 256]
    - [59, 16962.3]
  - - [256, 1856, 1, 1280]
    - [84, 11245.8]
  - - [6784, 5056, 1, 3328]
    - [59, 20507.9]
  - - [5056, 5056, 1, 256]
    - [59, 19202.4]
  - - [448, 704, 1, 1280]
    - [84, 7554.3]
  - - [64, 1024, 1, 1280]
    - [95, 3177.5]
  - - [1024, 3584, 1, 1280]
    - [87, 18647.3]
  - - [2368, 2944, 1, 1280]
    - [59, 18765.5]
  - - [128, 3584, 1, 1280]
    - [84, 10826.0]
  - - [1024, 256, 1, 3328]
    - [90, 9064.95]
  - - [1408, 4288, 1, 1280]
    - [59, 18815.7]
  - - [3584, 4288, 1, 1280]
    - [89, 19889.3]
  - - [2368, 704, 1, 1280]
    - [84, 15233.0]
  - - [5056, 4288, 1, 3328]
    - [59, 20260.0]
  - - [3584, 2368, 1, 3328]
    - [88, 19164.9]
  - - [64, 704, 1, 1280]
    - [95, 2224.99]
  - - [4288, 256, 1, 256]
    - [84, 10977.3]
  - - [6784, 448, 1, 1280]
    - [87, 17799.3]
  - - [64, 64, 1, 1280]
    - [72, 189.41]
  - - [4288, 2944, 1, 256]
    - [83, 18245.9]
  - - [1856, 64, 1, 1280]
    - [93, 5054.64]
  - - [5888, 64, 1, 3328]
    - [94, 9676.67]
  - - [2944, 256, 1, 3328]
    - [84, 14643.8]
  - - [5056, 2368, 1, 1280]
    - [59, 19223.5]
  - - [448, 3584, 1, 1280]
    - [84, 14739.0]
  - - [6784, 5888, 1, 256]
    - [89, 19493.9]
  - - [256, 4288, 1, 1280]
    - [84, 13427.9]
  - - [704, 128, 1, 1280]
    - [76, 3907.3]
  - - [1408, 448, 1, 1280]
    - [84, 11694.7]
  - - [1024, 1408, 1, 256]
    - [84, 12745.1]
  - - [2368, 2368, 1, 3328]
    - [87, 19075.1]
  - - [5056, 704, 1, 3328]
    - [87, 18479.0]
  - - [1408, 1856, 1, 256]
    - [84, 15315.7]
  - - [5888, 1856, 1, 256]
    - [87, 18138.0]
  - - [4288, 64, 1, 3328]
    - [69, 7082.12]
  - - [704, 5888, 1, 256]
    - [59, 17093.3]
  - - [6784, 128, 1, 1280]
    - [85, 12828.8]
  - - [4288, 6784, 1, 3328]
    - [59, 20498.6]
  - - [3584, 704, 1, 3328]
    - [87, 17844.7]
  - - [1408, 1408, 1, 256]
    - [87, 14288.0]
  - - [1856, 128, 1, 256]
    - [64, 4904.63]
  - - [2944, 64, 1, 1280]
    - [93, 6215.79]
  - - [448, 4288, 1, 256]
    - [58, 13876.5]
  - - [64, 3584, 1, 3328]
    - [94, 7991.66]
  - - [704, 2368, 1, 1280]
    - [84, 15172.4]
  - - [1856, 2368, 1, 1280]
    - [85, 17753.1]
  - - [2368, 128, 1, 3328]
    - [64, 7822.04]
  - - [2944, 128, 1, 256]
    - [53, 6518.18]
  - - [448, 1408, 1, 256]
    - [57, 8892.11]
  - - [64, 5056, 1, 3328]
    - [64, 8355.71]
  - - [1408, 1024, 1, 1280]
    - [85, 15277.2]
  - - [2368, 256, 1, 1280]
    - [84, 11252.1]
  - - [6784, 704, 1, 256]
    - [84, 16121.3]
  - - [256, 3584, 1, 3328]
    - [87, 14316.6]
  - - [1408, 3584, 1, 256]
    - [59, 17015.9]
  - - [3584, 4288, 1, 3328]
    - [89, 20084.1]
  - - [5888, 1856, 1, 1280]
    - [87, 19652.7]
  - - [5056, 1024, 1, 3328]
    - [89, 19363.3]
  - - [5056, 64, 1, 1280]
    - [64, 7880.28]
  - - [1024, 704, 1, 256]
    - [84, 9816.46]
  - - [128, 448, 1, 256]
    - [63, 1595.66]
  - - [2368, 3584, 1, 1280]
    - [86, 18915.0]
  - - [1024, 256, 1, 256]
    - [84, 4766.25]
  - - [448, 448, 1, 256]
    - [64, 4197.73]
  - - [2944, 3584, 1, 3328]
    - [85, 19267.5]
  - - [256, 256, 1, 3328]
    - [72, 3276.8]
  - - [128, 1024, 1, 3328]
    - [81, 5965.64]
  - - [6784, 2944, 1, 256]
    - [83, 18775.2]
  - - [64, 1856, 1, 1280]
    - [93, 5136.61]
  - - [1024, 2368, 1, 256]
    - [83, 14396.0]
  - - [4288, 2368, 1, 3328]
    - [59, 19625.8]
  - - [1856, 2368, 1, 256]
    - [84, 16410.8]
  - - [3584, 6784, 1, 3328]
    - [83, 20159.0]
  - - [6784, 1856, 1, 3328]
    - [83, 19375.9]
  - - [1024, 128, 1, 1280]
    - [78, 5433.04]
  - - [4288, 128, 1, 1280]
    - [70, 10223.3]
  - - [5056, 4288, 1, 1280]
    - [59, 20139.5]
  - - [5888, 64, 1, 256]
    - [53, 6414.16]
  - - [1408, 5056, 1, 1280]
    - [59, 19172.1]
  - - [1856, 256, 1, 1280]
    - [84, 11196.1]
  - - [64, 5888, 1, 3328]
    - [65, 9658.75]
  - - [6784, 5888, 1, 3328]
    - [89, 20370.4]
  - - [448, 256, 1, 3328]
    - [72, 5225.65]
  - - [2368, 5056, 1, 1280]
    - [59, 19225.4]
  - - [256, 1408, 1, 3328]
    - [90, 9255.95]
  - - [6784, 128, 1, 3328]
    - [87, 13514.2]
  - - [1024, 5056, 1, 1280]
    - [89, 18960.3]
  - - [4288, 1024, 1, 256]
    - [83, 16319.3]
  - - [2368, 1408, 1, 256]
    - [84, 15462.7]
  - - [704, 704, 1, 3328]
    - [90, 12633.3]
  - - [5888, 448, 1, 1280]
    - [84, 16035.4]
  - - [3584, 256, 1, 3328]
    - [87, 14316.6]
  - - [704, 5888, 1, 3328]
    - [59, 19127.9]
  - - [1024, 6784, 1, 1280]
    - [59, 18689.9]
  - - [128, 3584, 1, 3328]
    - [90, 11729.6]
  - - [6784, 2368, 1, 1280]
    - [87, 19771.7]
  - - [128, 704, 1, 1280]
    - [71, 3907.3]
  - - [3584, 2944, 1, 1280]
    - [83, 19086.6]
  - - [1856, 128, 1, 3328]
    - [90, 8242.56]
  - - [128, 2944, 1, 1280]
    - [65, 9053.02]
  - - [2368, 1024, 1, 3328]
    - [85, 17167.0]
  - - [448, 1856, 1, 1280]
    - [84, 12295.6]
  - - [1408, 5056, 1, 3328]
    - [59, 19405.3]
  - - [1856, 1856, 1, 3328]
    - [87, 17937.3]
  - - [3584, 128, 1, 256]
    - [53, 7850.3]
  - - [448, 1408, 1, 3328]
    - [84, 12331.1]
  - - [2368, 2368, 1, 256]
    - [83, 17204.0]
  - - [4288, 4288, 1, 1280]
    - [59, 19885.8]
  - - [64, 448, 1, 1280]
    - [95, 1438.09]
  - - [704, 6784, 1, 3328]
    - [59, 17910.3]
  - - [5888, 5888, 1, 3328]
    - [89, 20274.6]
  - - [5056, 1024, 1, 1280]
    - [59, 19100.2]
  - - [448, 5888, 1, 3328]
    - [84, 16336.7]
  - - [5056, 5888, 1, 1280]
    - [83, 20248.1]
  - - [448, 6784, 1, 256]
    - [83, 15891.4]
  - - [256, 3584, 1, 256]
    - [84, 10834.0]
  - - [256, 2944, 1, 3328]
    - [84, 14637.0]
  - - [256, 448, 1, 256]
    - [60, 2983.75]
  - - [3584, 5888, 1, 256]
    - [83, 18878.5]
  - - [2944, 3584, 1, 256]
    - [83, 17959.7]
  - - [1408, 704, 1, 256]
    - [84, 11576.4]
  - - [6784, 2944, 1, 3328]
    - [83, 19914.6]
  - - [2944, 5056, 1, 3328]
    - [83, 19842.0]
  - - [64, 64, 1, 3328]
    - [80, 225.388]
  - - [2048, 7133, 1, 2048]
    - [89, 20207.2]
  - - [4288, 5888, 1, 1280]
    - [83, 19948.8]
  - - [4288, 4288, 1, 256]
    - [59, 18980.1]
  - - [448, 2944, 1, 3328]
    - [85, 14503.5]
  - - [4288, 1856, 1, 1280]
    - [59, 18859.1]
  - - [1856, 2944, 1, 3328]
    - [85, 18599.5]
  - - [256, 6784, 1, 3328]
    - [84, 16304.9]
  - - [64, 5888, 1, 256]
    - [53, 6483.13]
  - - [5056, 1024, 1, 256]
    - [83, 17494.7]
  - - [256, 1024, 1, 256]
    - [67, 4686.37]
  - - [5056, 1856, 1, 3328]
    - [59, 20052.0]
  - - [1856, 1408, 1, 256]
    - [83, 15778.1]
  - - [448, 448, 1, 3328]
    - [90, 6986.85]
  - - [448, 2368, 1, 1280]
    - [90, 12648.2]
  - - [1408, 128, 1, 1280]
    - [64, 5837.21]
  - - [5056, 256, 1, 3328]
    - [84, 16356.1]
  - - [256, 64, 1, 1280]
    - [80, 816.648]
  - - [128, 1856, 1, 1280]
    - [62, 7338.01]
  - - [5056, 3584, 1, 256]
    - [83, 18900.3]
  - - [1856, 1024, 1, 1280]
    - [85, 16089.3]
  - - [1856, 1856, 1, 1280]
    - [87, 17547.2]
  - - [6784, 6784, 1, 1280]
    - [89, 20691.9]
  - - [128, 4288, 1, 3328]
    - [70, 10785.4]
  - - [1856, 1024, 1, 3328]
    - [85, 16495.4]
  - - [256, 2368, 1, 256]
    - [67, 8508.18]
  - - [1024, 448, 1, 3328]
    - [84, 11715.2]
  - - [1856, 704, 1, 1280]
    - [84, 15946.6]
  - - [6784, 1024, 1, 256]
    - [59, 17407.8]
  - - [5056, 5888, 1, 3328]
    - [83, 20393.9]
  - - [1856, 1024, 1, 256]
    - [83, 13697.6]
  - - [5056, 1408, 1, 3328]
    - [89, 19378.6]
  - - [1024, 1024, 1, 1280]
    - [84, 15363.8]
  - - [4288, 1024, 1, 3328]
    - [85, 18083.5]
  - - [2944, 1408, 1, 3328]
    - [59, 19134.3]
  - - [2944, 4288, 1, 3328]
    - [83, 19442.9]
  - - [256, 2944, 1, 256]
    - [84, 10262.7]
  - - [5056, 2944, 1, 256]
    - [83, 18635.2]
  - - [2368, 1856, 1, 256]
    - [84, 16315.6]
  - - [128, 448, 1, 1280]
    - [82, 2682.76]
  - - [128, 6784, 1, 1280]
    - [70, 12912.3]
  - - [1408, 3584, 1, 3328]
    - [59, 18907.0]
  - - [2368, 6784, 1, 256]
    - [83, 18830.2]
  - - [5056, 1408, 1, 1280]
    - [59, 19136.7]
  - - [1408, 5888, 1, 3328]
    - [89, 19918.9]
  - - [1856, 5056, 1, 256]
    - [59, 18686.0]
  - - [6784, 6784, 1, 256]
    - [89, 19890.9]
  - - [1408, 704, 1, 3328]
    - [87, 15415.0]
  - - [128, 5888, 1, 1280]
    - [84, 13828.7]
  - - [2368, 4288, 1, 1280]
    - [59, 19433.5]
  - - [3584, 1856, 1, 1280]
    - [87, 18985.1]
  - - [704, 1408, 1, 3328]
    - [85, 15426.5]
  - - [704, 64, 1, 1280]
    - [95, 2171.37]
  - - [5888, 5056, 1, 256]
    - [59, 19354.6]
  - - [3584, 448, 1, 256]
    - [84, 12562.4]
  - - [3072, 7435, 1, 1024]
    - [59, 20147.2]
  - - [256, 6784, 1, 256]
    - [84, 13423.8]
  - - [1856, 3584, 1, 3328]
    - [85, 19301.1]
  - - [5056, 256, 1, 1280]
    - [84, 15820.8]
  - - [512, 32, 1, 512]
    - [81, 672.164]
  - - [3584, 3584, 1, 256]
    - [83, 18482.1]
  - - [6784, 4288, 1, 1280]
    - [59, 20362.1]
  - - [704, 5056, 1, 256]
    - [83, 16318.1]
  - - [6784, 128, 1, 256]
    - [65, 10329.8]
  - - [64, 1408, 1, 3328]
    - [72, 4289.08]
  - - [704, 448, 1, 256]
    - [57, 5256.53]
  - - [2944, 2368, 1, 1280]
    - [59, 18771.8]
  - - [448, 64, 1, 3328]
    - [95, 1519.43]
  - - [6784, 3584, 1, 256]
    - [83, 19027.7]
  - - [256, 1856, 1, 3328]
    - [90, 12126.2]
  - - [704, 6784, 1, 256]
    - [59, 16206.8]
  - - [1024, 3584, 1, 3328]
    - [87, 19086.5]
  - - [64, 128, 1, 3328]
    - [79, 449.584]
  - - [2944, 2944, 1, 3328]
    - [83, 19416.9]
  - - [5056, 6784, 1, 256]
    - [59, 19631.5]
  - - [1408, 4288, 1, 3328]
    - [59, 19056.2]
  - - [6784, 256, 1, 1280]
    - [84, 15851.3]
  - - [2368, 704, 1, 3328]
    - [84, 15640.5]
  - - [128, 4288, 1, 256]
    - [53, 7876.08]
  - - [3584, 6784, 1, 256]
    - [59, 19027.7]
  - - [128, 128, 1, 3328]
    - [80, 880.587]
  - - [5056, 1856, 1, 256]
    - [59, 18570.6]
  - - [256, 128, 1, 256]
    - [66, 979.978]
  - - [704, 4288, 1, 256]
    - [83, 15835.9]
  - - [256, 448, 1, 3328]
    - [81, 5219.94]
  - - [1408, 6784, 1, 1280]
    - [83, 19044.2]
  - - [3584, 3584, 1, 1280]
    - [83, 19603.3]
  - - [64, 2368, 1, 1280]
    - [72, 5498.49]
  - - [64, 6784, 1, 3328]
    - [92, 11101.2]
  - - [2944, 256, 1, 1280]
    - [84, 13892.4]
  - - [5056, 2368, 1, 3328]
    - [89, 19403.9]
  - - [2944, 4288, 1, 256]
    - [83, 18147.5]
  - - [1408, 3584, 1, 1280]
    - [59, 18625.2]
  - - [2368, 64, 1, 256]
    - [68, 3592.34]
  - - [64, 448, 1, 3328]
    - [95, 1525.26]
  - - [1024, 1408, 1, 1280]
    - [87, 15257.0]
  - - [1856, 704, 1, 256]
    - [84, 13066.2]
  - - [1408, 448, 1, 3328]
    - [84, 12313.8]
  - - [2368, 256, 1, 256]
    - [57, 8583.48]
  - - [2368, 6784, 1, 3328]
    - [83, 20072.2]
  - - [5056, 704, 1, 1280]
    - [87, 18079.6]
  - - [1856, 4288, 1, 3328]
    - [59, 19107.4]
  - - [1408, 5888, 1, 256]
    - [59, 18422.9]
  - - [4288, 64, 1, 1280]
    - [64, 6673.12]
  - - [4096, 7133, 1, 4096]
    - [89, 20625.4]
  - - [256, 64, 1, 256]
    - [95, 557.753]
  - - [704, 1856, 1, 256]
    - [84, 12985.1]
  - - [5888, 64, 1, 1280]
    - [65, 9012.42]
  - - [3584, 704, 1, 1280]
    - [87, 17371.0]
  - - [256, 128, 1, 1280]
    - [80, 1588.75]
  - - [256, 2368, 1, 1280]
    - [84, 11265.2]
  - - [3584, 448, 1, 3328]
    - [84, 15091.3]
  - - [704, 2368, 1, 3328]
    - [84, 15651.1]
  - - [2944, 448, 1, 256]
    - [84, 11822.2]
  - - [448, 5056, 1, 3328]
    - [84, 16868.5]
  - - [2368, 128, 1, 1280]
    - [64, 7370.31]
  - - [4288, 448, 1, 256]
    - [58, 13752.3]
  - - [448, 5888, 1, 256]
    - [84, 14355.5]
  - - [64, 5056, 1, 1280]
    - [64, 7808.97]
  - - [5888, 2368, 1, 256]
    - [59, 18278.1]
  - - [704, 448, 1, 3328]
    - [90, 8059.13]
  - - [6784, 704, 1, 3328]
    - [59, 17899.0]
  - - [128, 64, 1, 1280]
    - [80, 412.176]
  - - [1408, 2944, 1, 3328]
    - [59, 19134.3]
  - - [64, 1024, 1, 256]
    - [60, 1959.96]
  - - [5056, 64, 1, 3328]
    - [69, 8345.38]
  - - [2368, 448, 1, 1280]
    - [84, 13087.0]
  - - [128, 3584, 1, 256]
    - [55, 7892.51]
  - - [1856, 448, 1, 3328]
    - [87, 12969.6]
  - - [128, 5056, 1, 256]
    - [53, 9245.26]
  - - [2368, 704, 1, 256]
    - [84, 13043.1]
  - - [3584, 2368, 1, 256]
    - [83, 17510.0]
  - - [5888, 5056, 1, 1280]
    - [89, 20176.0]
  - - [128, 1024, 1, 1280]
    - [78, 5461.33]
  - - [64, 704, 1, 256]
    - [91, 1413.52]
  - - [4288, 256, 1, 1280]
    - [84, 13479.4]
  - - [3584, 3584, 1, 3328]
    - [83, 19796.8]
  - - [704, 704, 1, 256]
    - [84, 8260.27]
  - - [5888, 6784, 1, 256]
    - [89, 19482.0]
  - - [4288, 2944, 1, 3328]
    - [83, 19459.5]
  - - [1856, 64, 1, 256]
    - [91, 3115.65]
  - - [4288, 128, 1, 3328]
    - [65, 10816.1]
  - - [4288, 704, 1, 1280]
    - [59, 17672.9]
  - - [256, 5056, 1, 1280]
    - [84, 15796.6]
  - - [6784, 5888, 1, 1280]
    - [89, 20233.2]
  - - [704, 128, 1, 256]
    - [68, 2363.59]
  - - [5888, 4288, 1, 1280]
    - [83, 19924.2]
  - - [448, 256, 1, 1280]
    - [74, 4854.52]
  - - [704, 64, 1, 3328]
    - [95, 2299.79]
  - - [256, 1408, 1, 1280]
    - [57, 8506.15]
  - - [512, 16, 1, 512]
    - [60, 306.601]
  - - [1408, 1856, 1, 1280]
    - [87, 17968.2]
  - - [5888, 448, 1, 3328]
    - [84, 16331.8]
  - - [704, 5888, 1, 1280]
    - [59, 18804.2]
  - - [1024, 6784, 1, 3328]
    - [88, 18973.6]
  - - [704, 2944, 1, 1280]
    - [85, 17434.9]
  - - [6784, 64, 1, 3328]
    - [94, 11128.6]
  - - [5056, 2944, 1, 3328]
    - [83, 19833.1]
  - - [448, 128, 1, 256]
    - [66, 1555.09]
  - - [1408, 1408, 1, 3328]
    - [87, 17202.9]
  - - [1856, 128, 1, 1280]
    - [62, 7309.78]
  - - [448, 4288, 1, 1280]
    - [85, 16185.5]
  - - [64, 3584, 1, 256]
    - [61, 4705.15]
  - - [128, 2944, 1, 3328]
    - [65, 9664.74]
  - - [3584, 704, 1, 256]
    - [84, 14760.6]
  - - [2944, 448, 1, 3328]
    - [87, 14503.5]
  - - [3584, 1408, 1, 3328]
    - [89, 18910.5]
  - - [2368, 1024, 1, 1280]
    - [85, 16723.0]
  - - [1856, 6784, 1, 256]
    - [83, 18182.1]
  - - [4288, 448, 1, 3328]
    - [87, 16659.3]
  - - [4288, 3584, 1, 1280]
    - [89, 19868.4]
  - - [1760, 7133, 1, 1760]
    - [83, 19244.0]
  - - [5888, 1024, 1, 3328]
    - [89, 19018.7]
  - - [704, 6784, 1, 1280]
    - [59, 17668.2]
  - - [1024, 2944, 1, 3328]
    - [85, 18107.1]
  - - [2368, 448, 1, 3328]
    - [84, 13487.7]
  - - [704, 5056, 1, 1280]
    - [85, 18102.6]
  - - [1024, 5888, 1, 1280]
    - [59, 18779.2]
  - - [2944, 1856, 1, 256]
    - [83, 16877.4]
  - - [5056, 64, 1, 256]
    - [64, 5689.39]
  - - [3584, 5056, 1, 256]
    - [83, 18784.0]
  - - [5888, 5056, 1, 3328]
    - [89, 20351.7]
  - - [128, 5056, 1, 3328]
    - [65, 12681.2]
  - - [3584, 6784, 1, 1280]
    - [83, 20028.9]
  - - [1856, 5888, 1, 256]
    - [83, 18601.1]
  - - [256, 256, 1, 256]
    - [78, 1839.61]
  - - [4288, 4288, 1, 3328]
    - [59, 20028.2]
  - - [4288, 1408, 1, 1280]
    - [59, 18750.0]
  - - [64, 1856, 1, 256]
    - [91, 3221.26]
  - - [4288, 2368, 1, 256]
    - [59, 18326.4]
  - - [2944, 5056, 1, 1280]
    - [83, 19672.7]
  - - [6784, 64, 1, 256]
    - [92, 7312.44]
  - - [6784, 2368, 1, 3328]
    - [87, 19982.2]
  - - [256, 1024, 1, 1280]
    - [67, 8128.5]
  - - [4288, 1856, 1, 3328]
    - [59, 19087.6]
  - - [1856, 2944, 1, 1280]
    - [83, 18301.2]
  - - [3584, 64, 1, 1280]
    - [62, 7057.72]
  - - [2944, 5888, 1, 1280]
    - [89, 19877.3]
  - - [3584, 1024, 1, 1280]
    - [85, 18641.4]
  - - [1024, 4288, 1, 256]
    - [84, 16243.8]
  - - [5888, 3584, 1, 3328]
    - [83, 20006.6]
  - - [5056, 3584, 1, 3328]
    - [83, 20074.1]
  - - [1408, 128, 1, 3328]
    - [73, 6582.37]
  - - [2368, 1408, 1, 1280]
    - [84, 17292.2]
  - - [5056, 2944, 1, 1280]
    - [83, 19658.1]
  - - [128, 2368, 1, 256]
    - [61, 5388.52]
  - - [3584, 256, 1, 256]
    - [84, 10794.2]
  - - [1024, 6784, 1, 256]
    - [59, 17353.5]
  - - [3584, 2944, 1, 256]
    - [83, 17969.2]
  - - [448, 128, 1, 3328]
    - [80, 2877.58]
  - - [3584, 1408, 1, 1280]
    - [59, 18612.3]
  - - [64, 4288, 1, 3328]
    - [69, 7099.71]
  - - [5056, 6784, 1, 3328]
    - [59, 20525.6]
  - - [128, 2944, 1, 256]
    - [55, 6414.16]
  - - [3584, 4288, 1, 256]
    - [59, 18820.6]
  - - [1856, 6784, 1, 3328]
    - [83, 19401.8]
  - - [3584, 128, 1, 3328]
    - [90, 11715.2]
  - - [128, 256, 1, 1280]
    - [80, 1574.44]
  - - [1024, 448, 1, 1280]
    - [84, 10826.0]
  - - [5056, 1408, 1, 256]
    - [59, 17838.9]
  - - [64, 256, 1, 1280]
    - [95, 819.2]
  - - [256, 704, 1, 256]
    - [84, 3392.45]
  - - [5888, 5888, 1, 256]
    - [59, 19324.0]
  - - [4288, 1024, 1, 1280]
    - [85, 17763.5]
  - - [5888, 128, 1, 3328]
    - [84, 14637.0]
  - - [448, 6784, 1, 3328]
    - [85, 18244.1]
  - - [2944, 1408, 1, 1280]
    - [59, 18788.2]
  - - [1024, 32, 1, 512]
    - [74, 1294.54]
  - - [2944, 1856, 1, 3328]
    - [87, 18604.1]
  - - [128, 1024, 1, 256]
    - [63, 3328.81]
  - - [3584, 5888, 1, 1280]
    - [83, 19858.9]
  - - [6784, 1856, 1, 1280]
    - [83, 19197.4]
  - - [5888, 256, 1, 3328]
    - [85, 16527.4]
  - - [1856, 5888, 1, 3328]
    - [83, 19961.8]
  - - [3584, 1408, 1, 256]
    - [59, 17033.8]
  - - [64, 448, 1, 256]
    - [95, 976.068]
  - - [704, 3584, 1, 3328]
    - [85, 17847.7]
  - - [5056, 448, 1, 1280]
    - [84, 16503.4]
  - - [4288, 704, 1, 256]
    - [59, 15530.6]
  - - [1408, 704, 1, 1280]
    - [87, 14630.7]
  - - [2944, 1024, 1, 256]
    - [83, 15711.6]
  - - [448, 1408, 1, 1280]
    - [84, 11627.4]
  - - [2368, 4288, 1, 3328]
    - [59, 19624.9]
  - - [64, 64, 1, 256]
    - [60, 110.145]
  - - [704, 1408, 1, 1280]
    - [84, 14644.2]
  - - [6784, 5056, 1, 256]
    - [59, 19621.0]
  - - [3584, 5056, 1, 3328]
    - [83, 20067.6]
  - - [4288, 5888, 1, 256]
    - [83, 18992.2]
  - - [448, 2944, 1, 256]
    - [84, 11789.2]
  - - [2944, 6784, 1, 256]
    - [83, 18775.2]
  - - [2368, 2368, 1, 1280]
    - [83, 18730.4]
  - - [1856, 3584, 1, 1280]
    - [83, 19029.2]
  - - [64, 2944, 1, 256]
    - [93, 4245.99]
  - - [5056, 3584, 1, 1280]
    - [83, 19912.9]
  - - [256, 5888, 1, 256]
    - [84, 13142.9]
  - - [128, 256, 1, 3328]
    - [80, 1721.15]
  - - [1856, 1408, 1, 3328]
    - [85, 18466.3]
  - - [1024, 4288, 1, 3328]
    - [87, 18094.3]
  - - [448, 2368, 1, 256]
    - [57, 10542.7]
  - - [64, 1408, 1, 1280]
    - [93, 3950.11]
  - - [2944, 2368, 1, 3328]
    - [88, 19018.3]
  - - [704, 128, 1, 3328]
    - [72, 4298.92]
  - - [1408, 128, 1, 256]
    - [64, 3923.24]
  - - [1024, 1856, 1, 1280]
    - [87, 16046.8]
  - - [6784, 1856, 1, 256]
    - [83, 18043.7]
  - - [1024, 5888, 1, 256]
    - [59, 17288.3]
  - - [64, 2944, 1, 1280]
    - [93, 6215.79]
  - - [64, 5056, 1, 256]
    - [54, 5689.39]
  - - [1408, 2368, 1, 256]
    - [84, 15690.1]
  - - [2944, 704, 1, 3328]
    - [87, 17958.6]
  - - [64, 128, 1, 1280]
    - [80, 417.427]
  - - [2944, 2944, 1, 1280]
    - [83, 19214.9]
  - - [6784, 256, 1, 3328]
    - [84, 16271.8]
  - - [1408, 5056, 1, 256]
    - [59, 17797.0]
  - - [5056, 128, 1, 3328]
    - [65, 12687.2]
  - - [128, 128, 1, 1280]
    - [80, 814.112]
  - - [448, 704, 1, 256]
    - [57, 5368.37]
  - - [1856, 256, 1, 3328]
    - [90, 12126.1]
  - - [2944, 128, 1, 3328]
    - [65, 9652.84]
  - - [704, 256, 1, 1280]
    - [90, 5848.98]
  - - [256, 448, 1, 1280]
    - [76, 4880.34]
  - - [5056, 256, 1, 256]
    - [84, 12783.6]
  - - [64, 2368, 1, 3328]
    - [72, 6004.35]
  - - [256, 704, 1, 3328]
    - [90, 6294.98]
  - - [64, 6784, 1, 1280]
    - [92, 10322.2]
  - - [1408, 4288, 1, 256]
    - [59, 17389.8]
  - - [5888, 2368, 1, 1280]
    - [87, 19630.8]
  - - [128, 256, 1, 256]
    - [74, 1018.03]
  - - [64, 128, 1, 256]
    - [80, 281.875]
  - - [2368, 5888, 1, 1280]
    - [83, 19759.5]
  - - [5888, 256, 1, 1280]
    - [87, 15919.0]
  - - [704, 1024, 1, 1280]
    - [84, 13288.4]
  - - [2368, 1856, 1, 3328]
    - [87, 18095.0]
  - - [2944, 704, 1, 256]
    - [58, 14837.2]
  - - [2368, 6784, 1, 1280]
    - [83, 19901.8]
  - - [1856, 4288, 1, 1280]
    - [59, 18870.3]
  - - [704, 3584, 1, 256]
    - [83, 15320.7]
  - - [704, 2944, 1, 3328]
    - [85, 17996.1]
  - - [1856, 5056, 1, 3328]
    - [59, 20073.6]
  - - [3584, 5056, 1, 1280]
    - [83, 19904.7]
  - - [2944, 1024, 1, 3328]
    - [87, 18109.7]
  - - [256, 4288, 1, 256]
    - [84, 11151.5]
  - - [1408, 6784, 1, 256]
    - [83, 17864.3]
  - - [6784, 1408, 1, 3328]
    - [83, 19206.2]
  - - [1024, 2368, 1, 1280]
    - [87, 16715.8]
  - - [704, 64, 1, 256]
    - [74, 1373.14]
  - - [256, 2368, 1, 3328]
    - [84, 11839.6]
  - - [6784, 2944, 1, 1280]
    - [83, 19729.2]
  - - [3584, 448, 1, 1280]
    - [84, 14671.7]
  - - [2944, 6784, 1, 3328]
    - [83, 19923.2]
  - - [448, 5056, 1, 1280]
    - [84, 16495.8]
  - - [64, 2944, 1, 3328]
    - [73, 6875.49]
  - - [128, 1408, 1, 256]
    - [66, 3923.24]
  - - [1408, 256, 1, 1280]
    - [57, 8531.31]
  - - [5888, 704, 1, 256]
    - [59, 16875.9]
  - - [256, 5888, 1, 3328]
    - [85, 16553.5]
  - - [6784, 4288, 1, 256]
    - [59, 19535.6]
  - - [5888, 256, 1, 256]
    - [84, 13142.9]
  - - [128, 1408, 1, 3328]
    - [75, 6479.96]
  - - [6784, 1024, 1, 1280]
    - [59, 18693.1]
  - - [704, 448, 1, 1280]
    - [84, 7645.79]
  - - [128, 64, 1, 3328]
    - [80, 448.404]
  - - [448, 64, 1, 256]
    - [95, 908.42]
  - - [2944, 704, 1, 1280]
    - [87, 17453.3]
  - - [6784, 3584, 1, 1280]
    - [83, 20017.6]
  - - [1024, 704, 1, 1280]
    - [84, 13319.0]
  - - [1408, 2944, 1, 1280]
    - [59, 18782.9]
  - - [256, 1856, 1, 256]
    - [84, 7797.1]
  - - [1408, 2368, 1, 3328]
    - [84, 17594.9]
  - - [1024, 3584, 1, 256]
    - [83, 16611.1]
  - - [2368, 2944, 1, 256]
    - [59, 17483.1]
  - - [704, 1856, 1, 1280]
    - [84, 15995.3]
  - - [1408, 256, 1, 3328]
    - [90, 9250.2]
  - - [1024, 16, 1, 512]
    - [63, 599.186]
  - - [5888, 128, 1, 256]
    - [55, 10577.7]
  - - [2944, 5888, 1, 256]
    - [59, 18931.6]
  - - [3584, 1856, 1, 256]
    - [87, 17193.9]
  - - [2368, 448, 1, 256]
    - [84, 10950.9]
  - - [4288, 256, 1, 3328]
    - [84, 13926.6]
  - - [1408, 64, 1, 256]
    - [60, 2402.99]
  - - [704, 4288, 1, 3328]
    - [85, 18102.9]
  - - [4288, 2944, 1, 1280]
    - [83, 19282.3]
  - - [1024, 64, 1, 256]
    - [72, 1959.96]
  - - [64, 2368, 1, 256]
    - [63, 3673.99]
  - - [4288, 5056, 1, 3328]
    - [59, 20281.8]
  - - [2944, 256, 1, 256]
    - [84, 10395.4]
  - - [1024, 128, 1, 3328]
    - [78, 5926.73]
  - - [256, 5056, 1, 3328]
    - [84, 16381.0]
  - - [5056, 2368, 1, 256]
    - [59, 18217.9]
  - - [4288, 704, 1, 3328]
    - [87, 18118.6]
  - - [448, 3584, 1, 256]
    - [84, 12531.8]
  - - [2368, 64, 1, 1280]
    - [72, 5498.49]
  - - [1408, 448, 1, 256]
    - [57, 8776.13]
  - - [1024, 1408, 1, 3328]
    - [87, 15863.1]
  - - [2560, 7133, 1, 2560]
    - [83, 20183.6]
  - - [5888, 3584, 1, 256]
    - [83, 18867.9]
  - - [1408, 1856, 1, 3328]
    - [87, 18463.2]
  - - [6784, 1408, 1, 1280]
    - [83, 19013.4]
  - - [704, 2944, 1, 256]
    - [83, 14870.3]
  - - [4288, 64, 1, 256]
    - [64, 4989.67]
  - - [2944, 5888, 1, 3328]
    - [89, 20063.6]
  - - [64, 4288, 1, 1280]
    - [64, 6703.68]
  - - [6784, 64, 1, 1280]
    - [92, 10399.4]
  - - [1408, 6784, 1, 3328]
    - [83, 19223.0]
  - - [1408, 64, 1, 3328]
    - [72, 4279.29]
  - - [1408, 1408, 1, 1280]
    - [87, 16765.0]
  - - [448, 1024, 1, 3328]
    - [90, 11736.8]
  - - [448, 4288, 1, 3328]
    - [85, 16669.7]
  - - [704, 2368, 1, 256]
    - [84, 12701.3]
  - - [2944, 448, 1, 1280]
    - [87, 13975.2]
  - - [5888, 2368, 1, 3328]
    - [87, 19864.4]
  - - [4288, 5056, 1, 256]
    - [59, 19271.2]
  - - [4288, 448, 1, 1280]
    - [87, 16151.5]
  - - [5888, 704, 1, 3328]
    - [59, 19094.0]
  - - [4288, 3584, 1, 3328]
    - [89, 20089.8]
  - - [5056, 128, 1, 256]
    - [65, 9204.17]
  - - [128, 64, 1, 256]
    - [56, 231.986]
  - - [448, 1024, 1, 256]
    - [57, 7567.04]
  - - [6784, 6784, 1, 3328]
    - [89, 20797.3]
  - - [704, 5056, 1, 3328]
    - [85, 18534.5]
  - - [1024, 64, 1, 1280]
    - [95, 3093.14]
  - - [64, 1024, 1, 3328]
    - [95, 3328.81]
  - - [2368, 2944, 1, 3328]
    - [86, 19069.6]
  - - [448, 448, 1, 1280]
    - [90, 6487.4]
  - - [2368, 3584, 1, 256]
    - [83, 17681.0]
  - - [1024, 256, 1, 1280]
    - [67, 8112.77]
  - - [128, 5056, 1, 1280]
    - [65, 12012.4]
  - - [3584, 2368, 1, 1280]
    - [88, 18846.7]
  - - [1856, 1856, 1, 256]
    - [83, 15815.0]
  - - [4288, 1408, 1, 3328]
    - [89, 19044.6]
  - - [3584, 64, 1, 3328]
    - [94, 7958.33]
  - - [4288, 5056, 1, 1280]
    - [59, 20150.0]
  - - [5888, 6784, 1, 1280]
    - [89, 20255.0]
  - - [256, 1024, 1, 3328]
    - [90, 9042.45]
  - - [1856, 64, 1, 3328]
    - [93, 5577.22]
  - - [5888, 1408, 1, 3328]
    - [89, 19898.3]
  - - [256, 5056, 1, 256]
    - [84, 12943.4]
  - - [1408, 1024, 1, 256]
    - [84, 12710.0]
  - - [448, 256, 1, 256]
    - [66, 2959.69]
  - - [1408, 256, 1, 256]
    - [57, 6135.29]
  - - [2368, 5056, 1, 256]
    - [59, 18244.0]
  - - [128, 5888, 1, 3328]
    - [84, 14657.5]
  - - [1024, 5056, 1, 256]
    - [59, 17366.4]
  - - [2368, 1408, 1, 3328]
    - [84, 17603.8]
  - - [5888, 448, 1, 256]
    - [84, 14331.1]
  - - [6784, 5056, 1, 1280]
    - [59, 20378.7]
  - - [4288, 6784, 1, 1280]
    - [59, 20385.3]
  - - [128, 704, 1, 256]
    - [63, 2423.18]
  - - [1024, 128, 1, 256]
    - [66, 3355.44]
  - - [448, 128, 1, 1280]
    - [72, 2682.76]
  - - [1024, 64, 1, 3328]
    - [95, 3320.7]
  - - [64, 3584, 1, 1280]
    - [62, 7098.68]
  - - [6784, 1408, 1, 256]
    - [83, 17895.8]
  - - [5888, 4288, 1, 256]
    - [59, 18992.2]
  - - [5056, 5888, 1, 256]
    - [59, 19370.3]
  - - [2368, 1024, 1, 256]
    - [83, 14668.2]
  - - [1856, 6784, 1, 1280]
    - [83, 19256.1]
  - - [3584, 128, 1, 1280]
    - [84, 10842.0]
  - - [4288, 128, 1, 256]
    - [53, 7983.48]
  - - [4288, 3584, 1, 256]
    - [59, 18878.4]
  - - [64, 256, 1, 3328]
    - [79, 893.275]
  - - [5056, 1856, 1, 1280]
    - [59, 19831.3]
  - - [1408, 1024, 1, 3328]
    - [85, 15858.9]
  - - [2368, 256, 1, 3328]
    - [84, 11845.1]
  - - [5888, 3584, 1, 1280]
    - [83, 19854.2]
  - - [5888, 128, 1, 1280]
    - [84, 13797.1]
  - - [1024, 2944, 1, 256]
    - [83, 15435.0]
  - - [448, 6784, 1, 1280]
    - [85, 17825.4]
  - - [256, 3584, 1, 1280]
    - [84, 13480.3]
  - - [3584, 1024, 1, 3328]
    - [85, 19081.7]
  - - [2944, 1856, 1, 1280]
    - [83, 18293.6]
  - - [128, 5888, 1, 256]
    - [53, 10350.8]
  - - [2368, 3584, 1, 3328]
    - [86, 19184.7]
  - - [3584, 5888, 1, 3328]
    - [83, 20032.6]
  - - [2944, 3584, 1, 1280]
    - [83, 19084.4]
  - - [1856, 5888, 1, 1280]
    - [83, 19763.8]
  - - [256, 256, 1, 1280]
    - [80, 3057.07]
  - - [5056, 448, 1, 3328]
    - [84, 16841.4]
  - - [4288, 1408, 1, 256]
    - [59, 17421.1]
  - - [3584, 64, 1, 256]
    - [64, 4735.5]
  - - [64, 1856, 1, 3328]
    - [95, 5602.51]
  - - [1024, 1024, 1, 256]
    - [84, 11983.7]
  - - [4288, 2368, 1, 1280]
    - [59, 19440.4]
  - - [2944, 5056, 1, 256]
    - [83, 18519.3]
  - - [256, 128, 1, 3328]
    - [80, 1732.08]
  - - [6784, 2368, 1, 256]
    - [59, 18551.6]
  - - [1024, 1024, 1, 1024]
    - [84, 15063.7]
  - - [2944, 64, 1, 3328]
    - [73, 6863.49]
  - - [4288, 1856, 1, 256]
    - [59, 17697.9]
  - - [1856, 2944, 1, 256]
    - [83, 16959.3]
  - - [64, 5888, 1, 1280]
    - [65, 8972.19]
  - - [1856, 1408, 1, 1280]
    - [85, 17960.4]
  - - [704, 1024, 1, 256]
    - [84, 10073.4]
  - - [1024, 4288, 1, 1280]
    - [87, 17741.1]
  - - [2368, 5056, 1, 3328]
    - [89, 19432.0]
  - - [1024, 1856, 1, 3328]
    - [87, 16505.8]
  - - [704, 704, 1, 1280]
    - [84, 11678.6]
  - - [128, 2368, 1, 1280]
    - [64, 7381.53]
  - - [3584, 256, 1, 1280]
    - [84, 13530.0]
  - - [704, 3584, 1, 1280]
    - [85, 17378.5]
  - - [128, 704, 1, 3328]
    - [80, 4308.8]
  - - [4288, 6784, 1, 256]
    - [59, 19543.8]
  - - [3584, 2944, 1, 3328]
    - [83, 19261.6]
  - - [128, 1856, 1, 256]
    - [64, 4936.48]
  - - [64, 4288, 1, 256]
    - [52, 4825.18]
  - - [5888, 2944, 1, 256]
    - [59, 18873.7]
  - - [5056, 128, 1, 1280]
    - [65, 12040.3]
  - - [448, 1856, 1, 3328]
    - [85, 12969.6]
  - - [5056, 4288, 1, 256]
    - [59, 19244.5]
  - - [1024, 448, 1, 256]
    - [84, 7606.25]
  - - [2944, 128, 1, 1280]
    - [65, 8972.19]
  - - [6784, 1024, 1, 3328]
    - [86, 18986.1]
  - - [64, 256, 1, 256]
    - [93, 563.751]
  - - [704, 256, 1, 3328]
    - [90, 6289.66]
  - - [256, 704, 1, 1280]
    - [90, 5813.68]
  - - [5888, 5888, 1, 1280]
    - [89, 20112.3]
  - - [448, 5888, 1, 1280]
    - [84, 16047.6]
  - - [2944, 1408, 1, 256]
    - [59, 17093.4]
  - - [256, 2944, 1, 1280]
    - [84, 13892.4]
  - - [1024, 2944, 1, 1280]
    - [87, 17668.3]
  - - [2368, 5888, 1, 3328]
    - [83, 19942.2]
  - - [704, 1024, 1, 3328]
    - [84, 14079.5]
  - - [2368, 1856, 1, 1280]
    - [87, 17748.6]
  - - [1856, 448, 1, 1280]
    - [84, 12272.9]
  - - [128, 6784, 1, 256]
    - [65, 10368.4]
  - - [5888, 4288, 1, 3328]
    - [83, 20077.3]
  - - [6784, 704, 1, 1280]
    - [59, 17635.6]
  - - [5056, 448, 1, 256]
    - [84, 14438.8]
  - - [1856, 5056, 1, 1280]
    - [59, 19878.6]
  - - [2944, 1024, 1, 1280]
    - [85, 17674.8]
  - - [2368, 4288, 1, 256]
    - [59, 18305.8]
  - - [1024, 2368, 1, 3328]
    - [87, 17169.9]
  - - [64, 704, 1, 3328]
    - [93, 2313.99]
  - - [704, 1408, 1, 256]
    - [84, 11618.8]
  - - [4288, 5888, 1, 3328]
    - [83, 20112.3]
  - - [256, 1408, 1, 256]
    - [57, 6070.7]
  - - [448, 2944, 1, 1280]
    - [85, 13947.5]
  - - [2944, 6784, 1, 1280]
    - [83, 19743.8]
  - - [256, 6784, 1, 1280]
    - [90, 15602.1]
  - - [1856, 3584, 1, 256]
    - [83, 17679.5]
  - - [128, 448, 1, 3328]
    - [80, 2877.58]
  - - [1856, 256, 1, 256]
    - [57, 7877.9]
  - - [128, 2368, 1, 3328]
    - [64, 7865.96]
  - - [256, 5888, 1, 1280]
    - [85, 15929.5]
  - - [448, 2368, 1, 3328]
    - [84, 13471.3]
  - - [64, 1408, 1, 256]
    - [60, 2485.85]
  - - [7680, 5481, 1, 2560]
    - [89, 20375.0]
  - - [2944, 2368, 1, 256]
    - [59, 17538.1]
  - - [1856, 448, 1, 256]
    - [84, 9928.22]
  - - [1024, 1856, 1, 256]
    - [58, 13605.7]
  - - [6784, 3584, 1, 3328]
    - [83, 20154.5]
  - - [1024, 704, 1, 3328]
    - [84, 14059.7]
  - - [1024, 5888, 1, 3328]
    - [59, 19056.3]
  - - [1408, 2368, 1, 1280]
    - [84, 17320.2]
  - - [128, 1408, 1, 1280]
    - [77, 5872.88]
  - - [256, 64, 1, 3328]
    - [95, 884.013]
  - - [128, 1856, 1, 3328]
    - [90, 8215.15]
  - - [2944, 2944, 1, 256]
    - [83, 17939.7]
  - - [6784, 256, 1, 256]
    - [84, 13456.3]
  - - [128, 4288, 1, 1280]
    - [65, 10235.2]
  - - [5888, 1408, 1, 256]
    - [59, 18308.5]
  - - [128, 128, 1, 256]
    - [72, 534.988]
  - - [448, 704, 1, 3328]
    - [84, 8059.16]
  - - [448, 1856, 1, 256]
    - [84, 9818.31]
  - - [1856, 704, 1, 3328]
    - [84, 16501.4]
  - - [5888, 6784, 1, 3328]
    - [89, 20361.4]
  - - [704, 4288, 1, 1280]
    - [59, 17659.9]
  - - [704, 256, 1, 256]
    - [84, 3432.71]
  - - [6784, 448, 1, 3328]
    - [87, 18238.9]
  - - [3136, 256, 64, 64]
    - [99, 18044.0]
  - - [784, 512, 64, 128]
    - [99, 17307.0]
  - - [784, 128, 64, 512]
    - [97, 17476.3]
  - - [3136, 64, 128, 64]
    - [100, 16056.3]
  - - [196, 256, 128, 1024]
    - [101, 15084.1]
  - - [196, 256, 64, 1024]
    - [96, 14493.7]
  - - [196, 1024, 128, 256]
    - [96, 15064.8]
  - - [784, 128, 256, 512]
    - [97, 18341.9]
  - - [3136, 64, 64, 256]
    - [98, 17871.4]
  - - [3136, 64, 256, 256]
    - [100, 18842.2]
  - - [3136, 256, 256, 64]
    - [99, 18620.2]
  - - [3136, 64, 128, 256]
    - [100, 18309.2]
  - - [784, 128, 128, 512]
    - [97, 18040.0]
  - - [784, 512, 128, 128]
    - [99, 17794.0]
  - - [784, 512, 256, 128]
    - [99, 18095.6]
  - - [196, 1024, 64, 256]
    - [96, 14817.7]
  - - [3136, 64, 64, 64]
    - [100, 14936.1]
  - - [196, 1024, 256, 256]
    - [96, 15208.3]
  - - [196, 256, 256, 1024]
    - [101, 15458.5]
  - - [3136, 256, 128, 64]
    - [99, 18415.9]
  - - [3136, 64, 256, 64]
    - [100, 16702.2]
  - - [64, 128, 1024, 128]
    - [102, 16269.4]
  - - [1024, 1024, 1, 8192]
    - [103, 18496.8]
  - - [1024, 2, 1, 32]
    - [118, 15.0]
  - - [1024, 2, 1, 4]
    - [108, 3.0]
  - - [1024, 30528, 1, 4096]
    - [114, 27324.0]
  - - [1024, 1024, 1, 4096]
    - [117, 25217.0]
  - - [1024, 1024, 1, 32]
    - [104, 4766.0]
  - - [4096, 1024, 1, 4096]
    - [113, 26637.0]
  - - [1024, 4096, 1, 4096]
    - [112, 26780.0]
  - - [1024, 1024, 1, 2048]
    - [116, 24118.0]
  - - [4096, 1024, 1, 2048]
    - [111, 26253.0]
  - - [1024, 30528, 1, 2048]
    - [109, 27506.0]
  - - [1024, 1024, 1, 4]
    - [107, 718.0]
  - - [1024, 4096, 1, 2048]
    - [112, 26408.0]
  - - [128, 64, 512, 128]
    - [106, 16611.0]
  - - [64, 128, 512, 128]
    - [105, 16904.0]
  - - [512, 64, 64, 512]
    - [115, 21613.0]
  - - [64, 512, 64, 512]
    - [110, 22221.0]
- null
