library/src/blas3/Tensile/Logic/aldebaran/vega20_Cijk_Ailk_Bljk_HSS_BH.yaml
- {MinimumRequiredVersion: 4.24.0}
- vega20
- gfx906
- [Device 66a0, Device 66a1, Device 66a7, Device 66af, Vega 20]
    SolutionIndex: 0
    SolutionNameMin: Cijk_Ailk_Bljk_HSS_BH_MT32x16x8_SE_GSU1_PGR1_PLR1_TT4_2_VAW2
    SolutionIndex: 1
    SolutionNameMin: Cijk_Ailk_Bljk_HSS_BH_MT64x16x8_SE_GSU1_PGR1_PLR1_TT4_4_VAW2
    SolutionIndex: 2
    SolutionNameMin: Cijk_Ailk_Bljk_HSS_BH_MT64x64x8_SE_GSU1_PGR1_PLR1_TT4_4_VAW2
    SolutionIndex: 3
    SolutionNameMin: Cijk_Ailk_Bljk_HSS_BH_MT16x16x16_SE_GSU1_PGR1_PLR1_TT2_2_VAW2
    SolutionIndex: 4
    SolutionNameMin: Cijk_Ailk_Bljk_HSS_BH_MT32x16x16_SE_GSU1_PGR1_PLR1_TT4_2_VAW2
    SolutionIndex: 5
    SolutionNameMin: Cijk_Ailk_Bljk_HSS_BH_MT32x16x16_SE_GSU1_PGR1_PLR1_TT2_2_VAW2
    SolutionIndex: 6
    SolutionNameMin: Cijk_Ailk_Bljk_HSS_BH_MT64x16x16_SE_GSU1_PGR1_PLR1_TT4_2_VAW2
    SolutionIndex: 7
    SolutionNameMin: Cijk_Ailk_Bljk_HSS_BH_MT64x32x16_SE_GSU1_PGR1_PLR1_TT4_4_VAW2
    SolutionIndex: 8
    SolutionNameMin: Cijk_Ailk_Bljk_HSS_BH_MT64x64x16_SE_GSU1_PGR1_PLR1_TT4_4_VAW2
    SolutionIndex: 9
    SolutionNameMin: Cijk_Ailk_Bljk_HSS_BH_MT128x32x16_SE_GSU1_PGR1_PLR1_TT4_4_VAW2
    SolutionIndex: 10
    SolutionNameMin: Cijk_Ailk_Bljk_HSS_BH_MT16x16x32_SE_GSU1_PGR1_PLR1_TT2_2_VAW2
    SolutionIndex: 11
    SolutionNameMin: Cijk_Ailk_Bljk_HSS_BH_MT32x8x32_SE_GSU1_PGR1_PLR1_TT2_2_VAW2
    SolutionIndex: 12
    SolutionNameMin: Cijk_Ailk_Bljk_HSS_BH_MT64x8x32_SE_GSU1_PGR1_PLR1_TT2_2_VAW2
    SolutionIndex: 13
    SolutionNameMin: Cijk_Ailk_Bljk_HSS_BH_MT64x16x32_SE_GSU1_PGR1_PLR1_TT2_2_VAW2
    SolutionIndex: 14
    SolutionNameMin: Cijk_Ailk_Bljk_HSS_BH_MT128x16x32_SE_GSU1_PGR1_PLR1_TT4_2_VAW2
    SolutionIndex: 15
    SolutionNameMin: Cijk_Ailk_Bljk_HSS_BH_MT32x8x64_SE_GSU1_PGR1_PLR1_TT2_2_VAW2
    SolutionIndex: 16
    SolutionNameMin: Cijk_Ailk_Bljk_HSS_BH_MT64x8x64_SE_GSU1_PGR1_PLR1_TT2_2_VAW2
    SolutionIndex: 17
    SolutionNameMin: Cijk_Ailk_Bljk_HSS_BH_MT32x16x8_SE_GSU1_PGR1_PLR1_TT4_2_VAW2
    SolutionIndex: 18
    SolutionNameMin: Cijk_Ailk_Bljk_HSS_BH_MT32x32x8_SE_GSU1_PGR1_PLR1_TT4_4_VAW2
    SolutionIndex: 19
    SolutionNameMin: Cijk_Ailk_Bljk_HSS_BH_MT64x32x8_SE_GSU1_PGR1_PLR1_TT8_4_VAW2
    SolutionIndex: 20
    SolutionNameMin: Cijk_Ailk_Bljk_HSS_BH_MT32x16x16_SE_GSU1_PGR1_PLR1_TT4_2_VAW2
    SolutionIndex: 21
    SolutionNameMin: Cijk_Ailk_Bljk_HSS_BH_MT32x32x16_SE_GSU1_PGR1_PLR1_TT4_4_VAW2
    SolutionIndex: 22
    SolutionNameMin: Cijk_Ailk_Bljk_HSS_BH_MT64x16x16_SE_GSU1_PGR1_PLR1_TT4_2_VAW2
    SolutionIndex: 23
    SolutionNameMin: Cijk_Ailk_Bljk_HSS_BH_MT64x32x16_SE_GSU1_PGR1_PLR1_TT4_4_VAW2
    SolutionIndex: 24
    SolutionNameMin: Cijk_Ailk_Bljk_HSS_BH_MT128x32x16_SE_GSU1_PGR1_PLR1_TT4_4_VAW2
    SolutionIndex: 25
    SolutionNameMin: Cijk_Ailk_Bljk_HSS_BH_MT32x8x16_SE_GSU1_PGR1_PLR1_TT2_2_VAW2
    SolutionIndex: 26
    SolutionNameMin: Cijk_Ailk_Bljk_HSS_BH_MT16x16x24_SE_GSU1_PGR1_PLR1_TT2_2_VAW2
    SolutionIndex: 27
    SolutionNameMin: Cijk_Ailk_Bljk_HSS_BH_MT32x16x24_SE_GSU1_PGR1_PLR1_TT4_2_VAW2
    SolutionIndex: 28
    SolutionNameMin: Cijk_Ailk_Bljk_HSS_BH_MT32x16x24_SE_GSU1_PGR1_PLR1_TT4_2_VAW2
    SolutionIndex: 29
    SolutionNameMin: Cijk_Ailk_Bljk_HSS_BH_MT32x32x24_SE_GSU1_PGR1_PLR1_TT4_4_VAW2
    SolutionIndex: 30
    SolutionNameMin: Cijk_Ailk_Bljk_HSS_BH_MT16x16x32_SE_GSU1_PGR1_PLR1_TT2_2_VAW2
    SolutionIndex: 31
    SolutionNameMin: Cijk_Ailk_Bljk_HSS_BH_MT64x16x32_SE_GSU1_PGR1_PLR1_TT2_2_VAW2
    SolutionIndex: 32
    SolutionNameMin: Cijk_Ailk_Bljk_HSS_BH_MT32x8x32_SE_GSU1_PGR1_PLR1_TT2_2_VAW2
    SolutionIndex: 33
    SolutionNameMin: Cijk_Ailk_Bljk_HSS_BH_MT64x8x32_SE_GSU1_PGR1_PLR1_TT2_2_VAW2
    SolutionIndex: 34
    SolutionNameMin: Cijk_Ailk_Bljk_HSS_BH_MT32x8x64_SE_GSU1_PGR1_PLR1_TT2_2_VAW2
    SolutionIndex: 35
    SolutionNameMin: Cijk_Ailk_Bljk_HSS_BH_MT64x64x8_SE_GSU1_PGR1_PLR1_TT4_4_VAW2
    SolutionIndex: 36
    SolutionNameMin: Cijk_Ailk_Bljk_HSS_BH_MT64x64x16_SE_GSU1_PGR1_PLR1_TT4_4_VAW2
    SolutionIndex: 37
    SolutionNameMin: Cijk_Ailk_Bljk_HSS_BH_MT64x128x16_SE_GSU1_PGR1_PLR1_TT4_8_VAW2
    SolutionIndex: 38
    SolutionNameMin: Cijk_Ailk_Bljk_HSS_BH_MT128x64x16_SE_GSU1_PGR1_PLR1_TT8_4_VAW2
    SolutionIndex: 39
    SolutionNameMin: Cijk_Ailk_Bljk_HSS_BH_MT128x64x16_SE_GSU1_PGR1_PLR1_TT4_8_VAW2
    SolutionIndex: 40
    SolutionNameMin: Cijk_Ailk_Bljk_HSS_BH_MT64x32x16_SE_GSU1_PGR1_PLR1_TT2_4_VAW2
    SolutionIndex: 41
    SolutionNameMin: Cijk_Ailk_Bljk_HSS_BH_MT64x32x16_SE_GSU1_PGR1_PLR1_TT4_2_VAW2
    SolutionIndex: 42
    SolutionNameMin: Cijk_Ailk_Bljk_HSS_BH_MT64x32x16_SE_GSU1_PGR1_PLR1_TT2_4_VAW2
    SolutionIndex: 43
    SolutionNameMin: Cijk_Ailk_Bljk_HSS_BH_MT64x64x16_SE_GSU1_PGR1_PLR1_TT4_4_VAW2
    SolutionIndex: 44
    SolutionNameMin: Cijk_Ailk_Bljk_HSS_BH_MT32x128x16_SE_GSU1_PGR0_PLR0_TT4_4_VAW2
    SolutionIndex: 45
    SolutionNameMin: Cijk_Ailk_Bljk_HSS_BH_MT32x128x16_SE_GSU1_PGR1_PLR0_TT4_4_VAW2
    SolutionIndex: 46
    SolutionNameMin: Cijk_Ailk_Bljk_HSS_BH_MT32x128x16_SE_GSU1_PGR0_PLR0_TT4_4_VAW2
    SolutionIndex: 47
    SolutionNameMin: Cijk_Ailk_Bljk_HSS_BH_MT64x64x16_SE_GSU1_PGR1_PLR0_TT4_4_VAW2
    SolutionIndex: 48
    SolutionNameMin: Cijk_Ailk_Bljk_HSS_BH_MT64x64x4_SE_GSU1_PGR0_PLR0_TT4_4_VAW2
    SolutionIndex: 49
    SolutionNameMin: Cijk_Ailk_Bljk_HSS_BH_MT64x128x4_SE_GSU1_PGR1_PLR0_TT4_8_VAW2
    SolutionIndex: 50
    SolutionNameMin: Cijk_Ailk_Bljk_HSS_BH_MT64x64x4_SE_GSU1_PGR1_PLR0_TT4_4_VAW2
    SolutionIndex: 51
    SolutionNameMin: Cijk_Ailk_Bljk_HSS_BH_MT64x64x4_SE_GSU1_PGR0_PLR1_TT4_4_VAW2
    SolutionIndex: 52
    SolutionNameMin: Cijk_Ailk_Bljk_HSS_BH_MT64x64x4_SE_GSU1_PGR1_PLR1_TT4_4_VAW2
    SolutionIndex: 53
    SolutionNameMin: Cijk_Ailk_Bljk_HSS_BH_MT64x64x8_SE_GSU1_PGR0_PLR0_TT4_4_VAW2
    SolutionIndex: 54
    SolutionNameMin: Cijk_Ailk_Bljk_HSS_BH_MT64x128x8_SE_GSU1_PGR1_PLR0_TT4_8_VAW2
    SolutionIndex: 55
    SolutionNameMin: Cijk_Ailk_Bljk_HSS_BH_MT64x64x8_SE_GSU1_PGR1_PLR0_TT4_4_VAW2
    SolutionIndex: 56
    SolutionNameMin: Cijk_Ailk_Bljk_HSS_BH_MT64x128x8_SE_GSU1_PGR0_PLR1_TT4_8_VAW2
    SolutionIndex: 57
    SolutionNameMin: Cijk_Ailk_Bljk_HSS_BH_MT64x64x8_SE_GSU1_PGR0_PLR1_TT4_4_VAW2
    SolutionIndex: 58
    SolutionNameMin: Cijk_Ailk_Bljk_HSS_BH_MT64x64x8_SE_GSU1_PGR1_PLR1_TT4_4_VAW2
    SolutionIndex: 59
    SolutionNameMin: Cijk_Ailk_Bljk_HSS_BH_MT64x64x16_SE_GSU1_PGR0_PLR0_TT4_4_VAW2
    SolutionIndex: 60
    SolutionNameMin: Cijk_Ailk_Bljk_HSS_BH_MT64x64x16_SE_GSU1_PGR0_PLR1_TT4_4_VAW2
    SolutionIndex: 61
    SolutionNameMin: Cijk_Ailk_Bljk_HSS_BH_MT64x64x16_SE_GSU1_PGR1_PLR1_TT4_4_VAW2
    SolutionIndex: 62
    SolutionNameMin: Cijk_Ailk_Bljk_HSS_BH_MT64x64x8_SE_GSU3_PGR0_PLR0_TT4_4_VAW1
    SolutionIndex: 63
    SolutionNameMin: Cijk_Ailk_Bljk_HSS_BH_MT64x64x8_SE_GSU3_PGR0_PLR1_TT4_4_VAW1
    SolutionIndex: 64
    SolutionNameMin: Cijk_Ailk_Bljk_HSS_BH_MT64x64x8_SE_GSU5_PGR0_PLR0_TT4_4_VAW1
    SolutionIndex: 65
    SolutionNameMin: Cijk_Ailk_Bljk_HSS_BH_MT64x64x8_SE_GSU5_PGR1_PLR0_TT4_4_VAW1
    SolutionIndex: 66
    SolutionNameMin: Cijk_Ailk_Bljk_HSS_BH_MT64x64x8_SE_GSU5_PGR0_PLR1_TT4_4_VAW1
    SolutionIndex: 67
    SolutionNameMin: Cijk_Ailk_Bljk_HSS_BH_MT64x64x16_SE_GSU5_PGR1_PLR0_TT4_4_VAW1
    SolutionIndex: 68
    SolutionNameMin: Cijk_Ailk_Bljk_HSS_BH_MT64x64x16_SE_GSU5_PGR1_PLR1_TT4_4_VAW1
    SolutionIndex: 69
    SolutionNameMin: Cijk_Ailk_Bljk_HSS_BH_MT64x64x8_SE_GSU7_PGR0_PLR0_TT4_4_VAW1
    SolutionIndex: 70
    SolutionNameMin: Cijk_Ailk_Bljk_HSS_BH_MT64x64x8_SE_GSU7_PGR1_PLR0_TT4_4_VAW1
    SolutionIndex: 71
    SolutionNameMin: Cijk_Ailk_Bljk_HSS_BH_MT64x64x8_SE_GSU7_PGR0_PLR1_TT4_4_VAW1
    SolutionIndex: 72
    SolutionNameMin: Cijk_Ailk_Bljk_HSS_BH_MT64x64x16_SE_GSU7_PGR1_PLR0_TT4_4_VAW1
    SolutionIndex: 73
    SolutionNameMin: Cijk_Ailk_Bljk_HSS_BH_MT128x128x4_SE_GSU1_PGR0_PLR0_TT8_8_VAW2
    SolutionIndex: 74
    SolutionNameMin: Cijk_Ailk_Bljk_HSS_BH_MT64x128x4_SE_GSU1_PGR0_PLR0_TT4_8_VAW2
    SolutionIndex: 75
    SolutionNameMin: Cijk_Ailk_Bljk_HSS_BH_MT64x64x4_SE_GSU1_PGR0_PLR0_TT4_4_VAW2
    SolutionIndex: 76
    SolutionNameMin: Cijk_Ailk_Bljk_HSS_BH_MT64x128x4_SE_GSU1_PGR1_PLR0_TT4_8_VAW2
    SolutionIndex: 77
    SolutionNameMin: Cijk_Ailk_Bljk_HSS_BH_MT64x64x4_SE_GSU1_PGR1_PLR0_TT4_4_VAW2
    SolutionIndex: 78
    SolutionNameMin: Cijk_Ailk_Bljk_HSS_BH_MT64x128x4_SE_GSU1_PGR0_PLR1_TT4_8_VAW2
    SolutionIndex: 79
    SolutionNameMin: Cijk_Ailk_Bljk_HSS_BH_MT64x64x4_SE_GSU1_PGR0_PLR1_TT4_4_VAW2
    SolutionIndex: 80
    SolutionNameMin: Cijk_Ailk_Bljk_HSS_BH_MT64x128x4_SE_GSU1_PGR1_PLR1_TT4_8_VAW2
    SolutionIndex: 81
    SolutionNameMin: Cijk_Ailk_Bljk_HSS_BH_MT64x64x4_SE_GSU1_PGR1_PLR1_TT4_4_VAW2
    SolutionIndex: 82
    SolutionNameMin: Cijk_Ailk_Bljk_HSS_BH_MT64x128x8_SE_GSU1_PGR0_PLR0_TT4_8_VAW2
    SolutionIndex: 83
    SolutionNameMin: Cijk_Ailk_Bljk_HSS_BH_MT64x64x8_SE_GSU1_PGR0_PLR0_TT4_4_VAW2
    SolutionIndex: 84
    SolutionNameMin: Cijk_Ailk_Bljk_HSS_BH_MT64x64x8_SE_GSU1_PGR1_PLR0_TT4_4_VAW2
    SolutionIndex: 85
    SolutionNameMin: Cijk_Ailk_Bljk_HSS_BH_MT64x64x8_SE_GSU1_PGR0_PLR1_TT4_4_VAW2
    SolutionIndex: 86
    SolutionNameMin: Cijk_Ailk_Bljk_HSS_BH_MT64x64x8_SE_GSU1_PGR1_PLR1_TT4_4_VAW2
    SolutionIndex: 87
    SolutionNameMin: Cijk_Ailk_Bljk_HSS_BH_MT64x128x16_SE_GSU1_PGR1_PLR0_TT4_8_VAW2
    SolutionIndex: 88
    SolutionNameMin: Cijk_Ailk_Bljk_HSS_BH_MT64x64x16_SE_GSU1_PGR0_PLR1_TT4_4_VAW2
    SolutionIndex: 89
    SolutionNameMin: Cijk_Ailk_Bljk_HSS_BH_MT64x64x16_SE_GSU1_PGR1_PLR1_TT4_4_VAW2
    SolutionIndex: 90
    SolutionNameMin: Cijk_Ailk_Bljk_HSS_BH_MT64x64x4_SE_GSU3_PGR1_PLR0_TT4_4_VAW1
    SolutionIndex: 91
    SolutionNameMin: Cijk_Ailk_Bljk_HSS_BH_MT64x64x8_SE_GSU3_PGR1_PLR0_TT4_4_VAW1
    SolutionIndex: 92
    SolutionNameMin: Cijk_Ailk_Bljk_HSS_BH_MT64x128x4_SE_GSU5_PGR1_PLR0_TT4_8_VAW1
    SolutionIndex: 93
    SolutionNameMin: Cijk_Ailk_Bljk_HSS_BH_MT64x64x4_SE_GSU5_PGR1_PLR0_TT4_4_VAW1
    SolutionIndex: 94
    SolutionNameMin: Cijk_Ailk_Bljk_HSS_BH_MT64x64x8_SE_GSU5_PGR1_PLR0_TT4_4_VAW1
    SolutionIndex: 95
    SolutionNameMin: Cijk_Ailk_Bljk_HSS_BH_MT64x64x4_SE_GSU7_PGR1_PLR0_TT4_4_VAW1
    SolutionIndex: 96
    SolutionNameMin: Cijk_Ailk_Bljk_HSS_BH_MT64x128x8_SE_GSU7_PGR1_PLR0_TT4_8_VAW1
    SolutionIndex: 97
    SolutionNameMin: Cijk_Ailk_Bljk_HSS_BH_MT64x64x8_SE_GSU7_PGR1_PLR0_TT4_4_VAW1
    SolutionIndex: 98
    SolutionNameMin: Cijk_Ailk_Bljk_HSS_BH_MT64x64x8_SE_GSU7_PGR1_PLR1_TT4_4_VAW1
- - - [512, 1, 1, 500000, 512, 512, 512, 500000]
    - [10, 22.0]
  - - [512, 2, 1, 500000, 512, 512, 512, 500000]
    - [15, 45.0]
  - - [512, 4, 1, 500000, 512, 512, 512, 500000]
    - [15, 89.0]
  - - [512, 8, 1, 500000, 512, 512, 512, 500000]
    - [15, 178.0]
  - - [512, 16, 1, 500000, 512, 512, 512, 500000]
    - [15, 357.0]
  - - [1024, 1, 1, 500000, 1024, 1024, 1024, 500000]
    - [15, 45.0]
  - - [1024, 2, 1, 500000, 1024, 1024, 1024, 500000]
    - [15, 89.0]
  - - [1024, 4, 1, 500000, 1024, 1024, 1024, 500000]
    - [15, 178.0]
  - - [1024, 8, 1, 500000, 1024, 1024, 1024, 500000]
    - [15, 357.0]
  - - [1024, 16, 1, 500000, 1024, 1024, 1024, 500000]
    - [15, 714.0]
  - - [64, 1, 1, 1216, 64, 64, 64, 1216]
    - [10, 3.0]
  - - [128, 1, 1, 1024, 128, 128, 128, 1024]
    - [5, 5.0]
  - - [128, 1, 1, 1408, 128, 128, 128, 1408]
    - [3, 5.0]
  - - [512, 1, 1, 512, 512, 512, 512, 512]
    - [3, 15.0]
  - - [3072, 1, 1, 128, 3072, 3072, 3072, 128]
    - [11, 78.0]
  - - [512, 2, 1, 512, 512, 512, 512, 512]
    - [3, 30.0]
  - - [1024, 1, 1, 512, 1024, 1024, 1024, 512]
    - [10, 37.0]
  - - [4224, 1, 1, 128, 4224, 4224, 4224, 128]
    - [25, 104.0]
  - - [512, 4, 1, 512, 512, 512, 512, 512]
    - [3, 60.0]
  - - [1024, 2, 1, 512, 1024, 1024, 1024, 512]
    - [10, 74.0]
  - - [1024, 4, 1, 512, 1024, 1024, 1024, 512]
    - [10, 148.0]
  - - [3072, 1, 1, 1024, 3072, 3072, 3072, 1024]
    - [15, 122.0]
  - - [512, 16, 1, 512, 512, 512, 512, 512]
    - [3, 244.0]
  - - [3072, 2, 1, 1024, 3072, 3072, 3072, 1024]
    - [15, 243.0]
  - - [4608, 1, 1, 1536, 4608, 4608, 4608, 1536]
    - [32, 181.0]
  - - [1024, 16, 1, 512, 1024, 1024, 1024, 512]
    - [34, 606.0]
  - - [3072, 4, 1, 1024, 3072, 3072, 3072, 1024]
    - [15, 484.0]
  - - [4608, 2, 1, 1536, 4608, 4608, 4608, 1536]
    - [32, 360.0]
  - - [6144, 1, 1, 2560, 6144, 6144, 6144, 2560]
    - [32, 247.0]
  - - [7680, 1, 1, 2560, 7680, 7680, 7680, 2560]
    - [32, 306.0]
  - - [8448, 1, 1, 2816, 8448, 8448, 8448, 2816]
    - [12, 317.0]
  - - [4608, 4, 1, 1536, 4608, 4608, 4608, 1536]
    - [11, 718.0]
  - - [6144, 2, 1, 2560, 6144, 6144, 6144, 2560]
    - [34, 491.0]
  - - [7680, 2, 1, 2560, 7680, 7680, 7680, 2560]
    - [32, 610.0]
  - - [8448, 2, 1, 2816, 8448, 8448, 8448, 2816]
    - [12, 635.0]
  - - [1760, 16, 1, 1760, 1760, 1760, 1760, 1760]
    - [11, 1139.0]
  - - [3072, 16, 1, 1024, 3072, 3072, 3072, 1024]
    - [32, 1861.0]
  - - [6144, 4, 1, 2560, 6144, 6144, 6144, 2560]
    - [15, 983.0]
  - - [2048, 16, 1, 2048, 2048, 2048, 2048, 2048]
    - [15, 1351.0]
  - - [7680, 4, 1, 2560, 7680, 7680, 7680, 2560]
    - [32, 1227.0]
  - - [8448, 4, 1, 2816, 8448, 8448, 8448, 2816]
    - [12, 1269.0]
  - - [2560, 16, 1, 2560, 2560, 2560, 2560, 2560]
    - [15, 1647.0]
  - - [4608, 16, 1, 1536, 4608, 4608, 4608, 1536]
    - [12, 2681.0]
  - - [6144, 16, 1, 2560, 6144, 6144, 6144, 2560]
    - [12, 3628.0]
  - - [4096, 16, 1, 4096, 4096, 4096, 4096, 4096]
    - [32, 2646.0]
  - - [7680, 16, 1, 2560, 7680, 7680, 7680, 2560]
    - [12, 4274.0]
  - - [8448, 16, 1, 2816, 8448, 8448, 8448, 2816]
    - [12, 4091.0]
  - - [64, 64, 1, 256, 64, 64, 64, 256]
    - [13, 127.0]
  - - [128, 64, 1, 256, 128, 128, 128, 256]
    - [3, 208.0]
  - - [64, 128, 1, 256, 64, 64, 64, 256]
    - [3, 210.0]
  - - [128, 128, 1, 256, 128, 128, 128, 256]
    - [15, 530.0]
  - - [64, 256, 1, 256, 64, 64, 64, 256]
    - [15, 530.0]
  - - [128, 256, 1, 256, 128, 128, 128, 256]
    - [11, 1049.0]
  - - [64, 448, 1, 256, 64, 64, 64, 256]
    - [12, 918.0]
  - - [128, 448, 1, 256, 128, 128, 128, 256]
    - [11, 1799.0]
  - - [64, 704, 1, 256, 64, 64, 64, 256]
    - [11, 1414.0]
  - - [128, 704, 1, 256, 128, 128, 128, 256]
    - [11, 2552.0]
  - - [64, 1024, 1, 256, 64, 64, 64, 256]
    - [11, 2036.0]
  - - [128, 1024, 1, 256, 128, 128, 128, 256]
    - [12, 3525.0]
  - - [64, 1408, 1, 256, 64, 64, 64, 256]
    - [12, 2575.0]
  - - [128, 1408, 1, 256, 128, 128, 128, 256]
    - [13, 4033.0]
  - - [64, 1856, 1, 256, 64, 64, 64, 256]
    - [13, 3221.0]
  - - [128, 1856, 1, 256, 128, 128, 128, 256]
    - [22, 4635.0]
  - - [64, 2368, 1, 256, 64, 64, 64, 256]
    - [12, 3619.0]
  - - [128, 2368, 1, 256, 128, 128, 128, 256]
    - [6, 4731.0]
  - - [64, 2944, 1, 256, 64, 64, 64, 256]
    - [13, 4158.0]
  - - [128, 2944, 1, 256, 128, 128, 128, 256]
    - [20, 5312.0]
  - - [64, 3584, 1, 256, 64, 64, 64, 256]
    - [4, 4503.0]
  - - [128, 3584, 1, 256, 128, 128, 128, 256]
    - [6, 5919.0]
  - - [64, 4288, 1, 256, 64, 64, 64, 256]
    - [6, 4284.0]
  - - [128, 4288, 1, 256, 128, 128, 128, 256]
    - [22, 5721.0]
  - - [64, 5056, 1, 256, 64, 64, 64, 256]
    - [6, 4954.0]
  - - [128, 5056, 1, 256, 128, 128, 128, 256]
    - [0, 6238.0]
  - - [64, 5888, 1, 256, 64, 64, 64, 256]
    - [20, 5153.0]
  - - [128, 5888, 1, 256, 128, 128, 128, 256]
    - [1, 6891.0]
  - - [64, 6784, 1, 256, 64, 64, 64, 256]
    - [6, 5513.0]
  - - [128, 6784, 1, 256, 128, 128, 128, 256]
    - [23, 6462.0]
  - - [64, 64, 1, 1280, 64, 64, 64, 1280]
    - [13, 158.0]
  - - [128, 64, 1, 1280, 128, 128, 128, 1280]
    - [3, 300.0]
  - - [64, 128, 1, 1280, 64, 64, 64, 1280]
    - [3, 299.0]
  - - [128, 128, 1, 1280, 128, 128, 128, 1280]
    - [15, 665.0]
  - - [64, 256, 1, 1280, 64, 64, 64, 1280]
    - [15, 667.0]
  - - [128, 256, 1, 1280, 128, 128, 128, 1280]
    - [16, 1321.0]
  - - [64, 448, 1, 1280, 64, 64, 64, 1280]
    - [15, 1158.0]
  - - [128, 448, 1, 1280, 128, 128, 128, 1280]
    - [32, 2222.0]
  - - [64, 704, 1, 1280, 64, 64, 64, 1280]
    - [32, 1784.0]
  - - [128, 704, 1, 1280, 128, 128, 128, 1280]
    - [12, 3211.0]
  - - [64, 1024, 1, 1280, 64, 64, 64, 1280]
    - [32, 2527.0]
  - - [128, 1024, 1, 1280, 128, 128, 128, 1280]
    - [12, 4406.0]
  - - [64, 1408, 1, 1280, 64, 64, 64, 1280]
    - [12, 3233.0]
  - - [128, 1408, 1, 1280, 128, 128, 128, 1280]
    - [13, 4838.0]
  - - [64, 1856, 1, 1280, 64, 64, 64, 1280]
    - [12, 4018.0]
  - - [128, 1856, 1, 1280, 128, 128, 128, 1280]
    - [14, 5565.0]
  - - [64, 2368, 1, 1280, 64, 64, 64, 1280]
    - [12, 4409.0]
  - - [128, 2368, 1, 1280, 128, 128, 128, 1280]
    - [22, 5511.0]
  - - [64, 2944, 1, 1280, 64, 64, 64, 1280]
    - [13, 5041.0]
  - - [128, 2944, 1, 1280, 128, 128, 128, 1280]
    - [20, 6134.0]
  - - [64, 3584, 1, 1280, 64, 64, 64, 1280]
    - [27, 5334.0]
  - - [128, 3584, 1, 1280, 128, 128, 128, 1280]
    - [6, 6679.0]
  - - [64, 4288, 1, 1280, 64, 64, 64, 1280]
    - [22, 4973.0]
  - - [128, 4288, 1, 1280, 128, 128, 128, 1280]
    - [22, 6242.0]
  - - [64, 5056, 1, 1280, 64, 64, 64, 1280]
    - [22, 5759.0]
  - - [128, 5056, 1, 1280, 128, 128, 128, 1280]
    - [9, 6659.0]
  - - [64, 5888, 1, 1280, 64, 64, 64, 1280]
    - [20, 6109.0]
  - - [128, 5888, 1, 1280, 128, 128, 128, 1280]
    - [24, 7705.0]
  - - [64, 6784, 1, 1280, 64, 64, 64, 1280]
    - [22, 6315.0]
  - - [128, 6784, 1, 1280, 128, 128, 128, 1280]
    - [36, 6999.0]
  - - [64, 64, 1, 3328, 64, 64, 64, 3328]
    - [10, 165.0]
  - - [128, 64, 1, 3328, 128, 128, 128, 3328]
    - [26, 322.0]
  - - [64, 128, 1, 3328, 64, 64, 64, 3328]
    - [31, 327.0]
  - - [128, 128, 1, 3328, 128, 128, 128, 3328]
    - [15, 695.0]
  - - [64, 256, 1, 3328, 64, 64, 64, 3328]
    - [15, 695.0]
  - - [128, 256, 1, 3328, 128, 128, 128, 3328]
    - [15, 1383.0]
  - - [64, 448, 1, 3328, 64, 64, 64, 3328]
    - [16, 1212.0]
  - - [128, 448, 1, 3328, 128, 128, 128, 3328]
    - [32, 2318.0]
  - - [64, 704, 1, 3328, 64, 64, 64, 3328]
    - [32, 1832.0]
  - - [128, 704, 1, 3328, 128, 128, 128, 3328]
    - [12, 3386.0]
  - - [64, 1024, 1, 3328, 64, 64, 64, 3328]
    - [32, 2644.0]
  - - [128, 1024, 1, 3328, 128, 128, 128, 3328]
    - [12, 4586.0]
  - - [64, 1408, 1, 3328, 64, 64, 64, 3328]
    - [12, 3383.0]
  - - [128, 1408, 1, 3328, 128, 128, 128, 3328]
    - [31, 4988.0]
  - - [64, 1856, 1, 3328, 64, 64, 64, 3328]
    - [12, 4166.0]
  - - [128, 1856, 1, 3328, 128, 128, 128, 3328]
    - [14, 5739.0]
  - - [64, 2368, 1, 3328, 64, 64, 64, 3328]
    - [12, 4572.0]
  - - [128, 2368, 1, 3328, 128, 128, 128, 3328]
    - [6, 5726.0]
  - - [64, 2944, 1, 3328, 64, 64, 64, 3328]
    - [13, 5222.0]
  - - [128, 2944, 1, 3328, 128, 128, 128, 3328]
    - [22, 5961.0]
  - - [64, 3584, 1, 3328, 64, 64, 64, 3328]
    - [22, 5431.0]
  - - [128, 3584, 1, 3328, 128, 128, 128, 3328]
    - [6, 6905.0]
  - - [64, 4288, 1, 3328, 64, 64, 64, 3328]
    - [22, 5211.0]
  - - [128, 4288, 1, 3328, 128, 128, 128, 3328]
    - [22, 6173.0]
  - - [64, 5056, 1, 3328, 64, 64, 64, 3328]
    - [22, 6108.0]
  - - [128, 5056, 1, 3328, 128, 128, 128, 3328]
    - [7, 6831.0]
  - - [64, 5888, 1, 3328, 64, 64, 64, 3328]
    - [22, 5967.0]
  - - [128, 5888, 1, 3328, 128, 128, 128, 3328]
    - [24, 7915.0]
  - - [64, 6784, 1, 3328, 64, 64, 64, 3328]
    - [6, 6594.0]
  - - [128, 6784, 1, 3328, 128, 128, 128, 3328]
    - [9, 7136.0]
  - - [256, 64, 1, 256, 256, 256, 256, 256]
    - [30, 524.0]
  - - [448, 64, 1, 256, 448, 448, 448, 256]
    - [11, 918.0]
  - - [704, 64, 1, 256, 704, 704, 704, 256]
    - [11, 1373.0]
  - - [1024, 64, 1, 256, 1024, 1024, 1024, 256]
    - [11, 1960.0]
  - - [1408, 64, 1, 256, 1408, 1408, 1408, 256]
    - [12, 2552.0]
  - - [1856, 64, 1, 256, 1856, 1856, 1856, 256]
    - [13, 3168.0]
  - - [2368, 64, 1, 256, 2368, 2368, 2368, 256]
    - [12, 3566.0]
  - - [2944, 64, 1, 256, 2944, 2944, 2944, 256]
    - [13, 4187.0]
  - - [3584, 64, 1, 256, 3584, 3584, 3584, 256]
    - [20, 4503.0]
  - - [4288, 64, 1, 256, 4288, 4288, 4288, 256]
    - [22, 4162.0]
  - - [5056, 64, 1, 256, 5056, 5056, 5056, 256]
    - [6, 4839.0]
  - - [5888, 64, 1, 256, 5888, 5888, 5888, 256]
    - [17, 5088.0]
  - - [6784, 64, 1, 256, 6784, 6784, 6784, 256]
    - [22, 5448.0]
  - - [256, 128, 1, 256, 256, 256, 256, 256]
    - [11, 1059.0]
  - - [448, 128, 1, 256, 448, 448, 448, 256]
    - [13, 1748.0]
  - - [704, 128, 1, 256, 704, 704, 704, 256]
    - [12, 2575.0]
  - - [1024, 128, 1, 256, 1024, 1024, 1024, 256]
    - [11, 3495.0]
  - - [1408, 128, 1, 256, 1408, 1408, 1408, 256]
    - [13, 3950.0]
  - - [1856, 128, 1, 256, 1856, 1856, 1856, 256]
    - [22, 4607.0]
  - - [2368, 128, 1, 256, 2368, 2368, 2368, 256]
    - [6, 4575.0]
  - - [2944, 128, 1, 256, 2944, 2944, 2944, 256]
    - [17, 5198.0]
  - - [3584, 128, 1, 256, 3584, 3584, 3584, 256]
    - [22, 5780.0]
  - - [4288, 128, 1, 256, 4288, 4288, 4288, 256]
    - [0, 5541.0]
  - - [5056, 128, 1, 256, 5056, 5056, 5056, 256]
    - [0, 6353.0]
  - - [5888, 128, 1, 256, 5888, 5888, 5888, 256]
    - [24, 6851.0]
  - - [6784, 128, 1, 256, 6784, 6784, 6784, 256]
    - [17, 6523.0]
  - - [256, 64, 1, 1280, 256, 256, 256, 1280]
    - [15, 667.0]
  - - [448, 64, 1, 1280, 448, 448, 448, 1280]
    - [16, 1161.0]
  - - [704, 64, 1, 1280, 704, 704, 704, 1280]
    - [32, 1746.0]
  - - [1024, 64, 1, 1280, 1024, 1024, 1024, 1280]
    - [11, 2527.0]
  - - [1408, 64, 1, 1280, 1408, 1408, 1408, 1280]
    - [12, 3204.0]
  - - [1856, 64, 1, 1280, 1856, 1856, 1856, 1280]
    - [12, 3993.0]
  - - [2368, 64, 1, 1280, 2368, 2368, 2368, 1280]
    - [12, 4393.0]
  - - [2944, 64, 1, 1280, 2944, 2944, 2944, 1280]
    - [13, 5050.0]
  - - [3584, 64, 1, 1280, 3584, 3584, 3584, 1280]
    - [14, 5366.0]
  - - [4288, 64, 1, 1280, 4288, 4288, 4288, 1280]
    - [22, 5100.0]
  - - [5056, 64, 1, 1280, 5056, 5056, 5056, 1280]
    - [22, 5978.0]
  - - [5888, 64, 1, 1280, 5888, 5888, 5888, 1280]
    - [17, 6307.0]
  - - [6784, 64, 1, 1280, 6784, 6784, 6784, 1280]
    - [22, 6505.0]
  - - [256, 128, 1, 1280, 256, 256, 256, 1280]
    - [16, 1321.0]
  - - [448, 128, 1, 1280, 448, 448, 448, 1280]
    - [32, 2206.0]
  - - [704, 128, 1, 1280, 704, 704, 704, 1280]
    - [12, 3233.0]
  - - [1024, 128, 1, 1280, 1024, 1024, 1024, 1280]
    - [33, 4369.0]
  - - [1408, 128, 1, 1280, 1408, 1408, 1408, 1280]
    - [13, 4830.0]
  - - [1856, 128, 1, 1280, 1856, 1856, 1856, 1280]
    - [14, 5557.0]
  - - [2368, 128, 1, 1280, 2368, 2368, 2368, 1280]
    - [22, 5613.0]
  - - [2944, 128, 1, 1280, 2944, 2944, 2944, 1280]
    - [17, 6333.0]
  - - [3584, 128, 1, 1280, 3584, 3584, 3584, 1280]
    - [22, 6790.0]
  - - [4288, 128, 1, 1280, 4288, 4288, 4288, 1280]
    - [6, 6387.0]
  - - [5056, 128, 1, 1280, 5056, 5056, 5056, 1280]
    - [17, 7231.0]
  - - [5888, 128, 1, 1280, 5888, 5888, 5888, 1280]
    - [9, 7805.0]
  - - [6784, 128, 1, 1280, 6784, 6784, 6784, 1280]
    - [17, 7375.0]
  - - [256, 64, 1, 3328, 256, 256, 256, 3328]
    - [15, 695.0]
  - - [448, 64, 1, 3328, 448, 448, 448, 3328]
    - [16, 1213.0]
  - - [704, 64, 1, 3328, 704, 704, 704, 3328]
    - [32, 1827.0]
  - - [1024, 64, 1, 3328, 1024, 1024, 1024, 3328]
    - [32, 2637.0]
  - - [1408, 64, 1, 3328, 1408, 1408, 1408, 3328]
    - [33, 3350.0]
  - - [1856, 64, 1, 3328, 1856, 1856, 1856, 3328]
    - [12, 4152.0]
  - - [2368, 64, 1, 3328, 2368, 2368, 2368, 3328]
    - [12, 4592.0]
  - - [2944, 64, 1, 3328, 2944, 2944, 2944, 3328]
    - [13, 5218.0]
  - - [3584, 64, 1, 3328, 3584, 3584, 3584, 3328]
    - [14, 5548.0]
  - - [4288, 64, 1, 3328, 4288, 4288, 4288, 3328]
    - [22, 5249.0]
  - - [5056, 64, 1, 3328, 5056, 5056, 5056, 3328]
    - [22, 6183.0]
  - - [5888, 64, 1, 3328, 5888, 5888, 5888, 3328]
    - [17, 6507.0]
  - - [6784, 64, 1, 3328, 6784, 6784, 6784, 3328]
    - [22, 6672.0]
  - - [256, 128, 1, 3328, 256, 256, 256, 3328]
    - [16, 1384.0]
  - - [448, 128, 1, 3328, 448, 448, 448, 3328]
    - [32, 2314.0]
  - - [704, 128, 1, 3328, 704, 704, 704, 3328]
    - [12, 3362.0]
  - - [1024, 128, 1, 3328, 1024, 1024, 1024, 3328]
    - [33, 4551.0]
  - - [1408, 128, 1, 3328, 1408, 1408, 1408, 3328]
    - [13, 4995.0]
  - - [1856, 128, 1, 3328, 1856, 1856, 1856, 3328]
    - [14, 5739.0]
  - - [2368, 128, 1, 3328, 2368, 2368, 2368, 3328]
    - [22, 5760.0]
  - - [2944, 128, 1, 3328, 2944, 2944, 2944, 3328]
    - [17, 6486.0]
  - - [3584, 128, 1, 3328, 3584, 3584, 3584, 3328]
    - [22, 7011.0]
  - - [4288, 128, 1, 3328, 4288, 4288, 4288, 3328]
    - [6, 6544.0]
  - - [5056, 128, 1, 3328, 5056, 5056, 5056, 3328]
    - [17, 7183.0]
  - - [5888, 128, 1, 3328, 5888, 5888, 5888, 3328]
    - [24, 7955.0]
  - - [6784, 128, 1, 3328, 6784, 6784, 6784, 3328]
    - [23, 7219.0]
  - - [256, 256, 1, 256, 256, 256, 256, 256]
    - [11, 2016.0]
  - - [448, 256, 1, 256, 448, 448, 448, 256]
    - [33, 3033.0]
  - - [256, 448, 1, 256, 256, 256, 256, 256]
    - [13, 3110.0]
  - - [448, 448, 1, 256, 448, 448, 448, 256]
    - [4, 3989.0]
  - - [256, 256, 1, 1280, 256, 256, 256, 1280]
    - [32, 2527.0]
  - - [448, 256, 1, 1280, 448, 448, 448, 1280]
    - [12, 3871.0]
  - - [256, 448, 1, 1280, 256, 256, 256, 1280]
    - [12, 3871.0]
  - - [448, 448, 1, 1280, 448, 448, 448, 1280]
    - [14, 4695.0]
  - - [256, 256, 1, 3328, 256, 256, 256, 3328]
    - [32, 2639.0]
  - - [448, 256, 1, 3328, 448, 448, 448, 3328]
    - [12, 4023.0]
  - - [256, 448, 1, 3328, 256, 256, 256, 3328]
    - [12, 4030.0]
  - - [448, 448, 1, 3328, 448, 448, 448, 3328]
    - [27, 4874.0]
  - - [512, 32, 1, 512, 512, 512, 512, 512]
    - [34, 603.0]
  - - [1024, 32, 1, 512, 1024, 1024, 1024, 512]
    - [32, 1185.0]
  - - [1760, 32, 1, 1760, 1760, 1760, 1760, 1760]
    - [32, 2213.0]
  - - [3072, 32, 1, 1024, 3072, 3072, 3072, 1024]
    - [32, 3373.0]
  - - [2048, 32, 1, 2048, 2048, 2048, 2048, 2048]
    - [32, 2577.0]
  - - [1760, 64, 1, 1760, 1760, 1760, 1760, 1760]
    - [12, 3866.0]
  - - [3072, 64, 1, 1024, 3072, 3072, 3072, 1024]
    - [31, 5146.0]
  - - [2560, 32, 1, 2560, 2560, 2560, 2560, 2560]
    - [12, 3045.0]
  - - [4608, 32, 1, 1536, 4608, 4608, 4608, 1536]
    - [33, 4270.0]
  - - [128, 1500, 1, 1280, 128, 128, 128, 1280]
    - [13, 5129.0]
  - - [2048, 64, 1, 2048, 2048, 2048, 2048, 2048]
    - [12, 4498.0]
  - - [176, 1500, 1, 1408, 176, 176, 176, 1408]
    - [22, 4865.0]
  - - [1760, 128, 1, 1760, 1760, 1760, 1760, 1760]
    - [14, 5352.0]
  - - [3072, 128, 1, 1024, 3072, 3072, 3072, 1024]
    - [17, 6445.0]
  - - [2560, 64, 1, 2560, 2560, 2560, 2560, 2560]
    - [12, 4914.0]
  - - [6144, 32, 1, 2560, 6144, 6144, 6144, 2560]
    - [13, 5391.0]
  - - [2048, 128, 1, 2048, 2048, 2048, 2048, 2048]
    - [28, 6146.0]
  - - [4096, 32, 1, 4096, 4096, 4096, 4096, 4096]
    - [13, 4575.0]
  - - [7680, 32, 1, 2560, 7680, 7680, 7680, 2560]
    - [14, 5886.0]
  - - [8448, 32, 1, 2816, 8448, 8448, 8448, 2816]
    - [22, 5149.0]
  - - [2560, 128, 1, 2560, 2560, 2560, 2560, 2560]
    - [22, 6186.0]
  - - [4096, 64, 1, 4096, 4096, 4096, 4096, 4096]
    - [28, 6287.0]
  - - [7680, 64, 1, 2560, 7680, 7680, 7680, 2560]
    - [22, 7179.0]
  - - [4096, 128, 1, 4096, 4096, 4096, 4096, 4096]
    - [22, 7650.0]
  - - [7680, 128, 1, 2560, 7680, 7680, 7680, 2560]
    - [9, 8076.0]
  - - [704, 256, 1, 256, 704, 704, 704, 256]
    - [21, 2988.0]
  - - [1024, 256, 1, 256, 1024, 1024, 1024, 256]
    - [21, 4173.0]
  - - [1408, 256, 1, 256, 1408, 1408, 1408, 256]
    - [35, 4090.0]
  - - [1856, 256, 1, 256, 1856, 1856, 1856, 256]
    - [36, 5354.0]
  - - [2368, 256, 1, 256, 2368, 2368, 2368, 256]
    - [35, 5527.0]
  - - [2944, 256, 1, 256, 2944, 2944, 2944, 256]
    - [18, 6775.0]
  - - [3584, 256, 1, 256, 3584, 3584, 3584, 256]
    - [18, 6688.0]
  - - [4288, 256, 1, 256, 4288, 4288, 4288, 256]
    - [36, 6422.0]
  - - [5056, 256, 1, 256, 5056, 5056, 5056, 256]
    - [35, 7449.0]
  - - [5888, 256, 1, 256, 5888, 5888, 5888, 256]
    - [18, 7548.0]
  - - [6784, 256, 1, 256, 6784, 6784, 6784, 256]
    - [35, 7676.0]
  - - [704, 448, 1, 256, 704, 704, 704, 256]
    - [21, 3630.0]
  - - [1024, 448, 1, 256, 1024, 1024, 1024, 256]
    - [21, 4993.0]
  - - [1408, 448, 1, 256, 1408, 1408, 1408, 256]
    - [36, 5767.0]
  - - [1856, 448, 1, 256, 1856, 1856, 1856, 256]
    - [35, 6145.0]
  - - [2368, 448, 1, 256, 2368, 2368, 2368, 256]
    - [35, 6229.0]
  - - [2944, 448, 1, 256, 2944, 2944, 2944, 256]
    - [35, 6710.0]
  - - [3584, 448, 1, 256, 3584, 3584, 3584, 256]
    - [36, 7048.0]
  - - [4288, 448, 1, 256, 4288, 4288, 4288, 256]
    - [35, 7627.0]
  - - [5056, 448, 1, 256, 5056, 5056, 5056, 256]
    - [36, 7939.0]
  - - [5888, 448, 1, 256, 5888, 5888, 5888, 256]
    - [35, 7751.0]
  - - [6784, 448, 1, 256, 6784, 6784, 6784, 256]
    - [35, 8235.0]
  - - [256, 704, 1, 256, 256, 256, 256, 256]
    - [21, 2973.0]
  - - [448, 704, 1, 256, 448, 448, 448, 256]
    - [36, 3617.0]
  - - [704, 704, 1, 256, 704, 704, 704, 256]
    - [36, 5644.0]
  - - [1024, 704, 1, 256, 1024, 1024, 1024, 256]
    - [21, 6373.0]
  - - [1408, 704, 1, 256, 1408, 1408, 1408, 256]
    - [36, 7225.0]
  - - [1856, 704, 1, 256, 1856, 1856, 1856, 256]
    - [35, 7547.0]
  - - [2368, 704, 1, 256, 2368, 2368, 2368, 256]
    - [35, 7399.0]
  - - [2944, 704, 1, 256, 2944, 2944, 2944, 256]
    - [36, 8088.0]
  - - [3584, 704, 1, 256, 3584, 3584, 3584, 256]
    - [36, 8058.0]
  - - [4288, 704, 1, 256, 4288, 4288, 4288, 256]
    - [35, 8180.0]
  - - [5056, 704, 1, 256, 5056, 5056, 5056, 256]
    - [35, 8375.0]
  - - [5888, 704, 1, 256, 5888, 5888, 5888, 256]
    - [36, 8536.0]
  - - [6784, 704, 1, 256, 6784, 6784, 6784, 256]
    - [35, 8383.0]
  - - [256, 1024, 1, 256, 256, 256, 256, 256]
    - [21, 4258.0]
  - - [448, 1024, 1, 256, 448, 448, 448, 256]
    - [36, 5206.0]
  - - [704, 1024, 1, 256, 704, 704, 704, 256]
    - [36, 6554.0]
  - - [1024, 1024, 1, 256, 1024, 1024, 1024, 256]
    - [18, 7375.0]
  - - [1408, 1024, 1, 256, 1408, 1408, 1408, 256]
    - [35, 7243.0]
  - - [1856, 1024, 1, 256, 1856, 1856, 1856, 256]
    - [35, 7536.0]
  - - [2368, 1024, 1, 256, 2368, 2368, 2368, 256]
    - [35, 7822.0]
  - - [2944, 1024, 1, 256, 2944, 2944, 2944, 256]
    - [35, 8168.0]
  - - [3584, 1024, 1, 256, 3584, 3584, 3584, 256]
    - [36, 8541.0]
  - - [4288, 1024, 1, 256, 4288, 4288, 4288, 256]
    - [35, 8578.0]
  - - [5056, 1024, 1, 256, 5056, 5056, 5056, 256]
    - [35, 8670.0]
  - - [5888, 1024, 1, 256, 5888, 5888, 5888, 256]
    - [36, 8742.0]
  - - [6784, 1024, 1, 256, 6784, 6784, 6784, 256]
    - [35, 8687.0]
  - - [256, 1408, 1, 256, 256, 256, 256, 256]
    - [21, 4134.0]
  - - [448, 1408, 1, 256, 448, 448, 448, 256]
    - [36, 5751.0]
  - - [704, 1408, 1, 256, 704, 704, 704, 256]
    - [36, 7225.0]
  - - [1024, 1408, 1, 256, 1024, 1024, 1024, 256]
    - [38, 7098.0]
  - - [1408, 1408, 1, 256, 1408, 1408, 1408, 256]
    - [35, 7803.0]
  - - [1856, 1408, 1, 256, 1856, 1856, 1856, 256]
    - [36, 8354.0]
  - - [2368, 1408, 1, 256, 2368, 2368, 2368, 256]
    - [35, 8375.0]
  - - [2944, 1408, 1, 256, 2944, 2944, 2944, 256]
    - [35, 8574.0]
  - - [3584, 1408, 1, 256, 3584, 3584, 3584, 256]
    - [36, 8428.0]
  - - [4288, 1408, 1, 256, 4288, 4288, 4288, 256]
    - [35, 8526.0]
  - - [5056, 1408, 1, 256, 5056, 5056, 5056, 256]
    - [35, 8655.0]
  - - [5888, 1408, 1, 256, 5888, 5888, 5888, 256]
    - [35, 8808.0]
  - - [6784, 1408, 1, 256, 6784, 6784, 6784, 256]
    - [35, 8837.0]
  - - [256, 1856, 1, 256, 256, 256, 256, 256]
    - [21, 5261.0]
  - - [448, 1856, 1, 256, 448, 448, 448, 256]
    - [35, 6089.0]
  - - [704, 1856, 1, 256, 704, 704, 704, 256]
    - [36, 7588.0]
  - - [1024, 1856, 1, 256, 1024, 1024, 1024, 256]
    - [36, 7417.0]
  - - [1408, 1856, 1, 256, 1408, 1408, 1408, 256]
    - [36, 8337.0]
  - - [1856, 1856, 1, 256, 1856, 1856, 1856, 256]
    - [35, 8129.0]
  - - [2368, 1856, 1, 256, 2368, 2368, 2368, 256]
    - [35, 8591.0]
  - - [2944, 1856, 1, 256, 2944, 2944, 2944, 256]
    - [35, 8721.0]
  - - [3584, 1856, 1, 256, 3584, 3584, 3584, 256]
    - [36, 8621.0]
  - - [4288, 1856, 1, 256, 4288, 4288, 4288, 256]
    - [35, 8752.0]
  - - [5056, 1856, 1, 256, 5056, 5056, 5056, 256]
    - [35, 8913.0]
  - - [5888, 1856, 1, 256, 5888, 5888, 5888, 256]
    - [35, 8896.0]
  - - [6784, 1856, 1, 256, 6784, 6784, 6784, 256]
    - [35, 8873.0]
  - - [256, 2368, 1, 256, 256, 256, 256, 256]
    - [21, 5542.0]
  - - [448, 2368, 1, 256, 448, 448, 448, 256]
    - [36, 6240.0]
  - - [704, 2368, 1, 256, 704, 704, 704, 256]
    - [35, 7399.0]
  - - [1024, 2368, 1, 256, 1024, 1024, 1024, 256]
    - [36, 7683.0]
  - - [1408, 2368, 1, 256, 1408, 1408, 1408, 256]
    - [36, 8342.0]
  - - [1856, 2368, 1, 256, 1856, 1856, 1856, 256]
    - [35, 8591.0]
  - - [2368, 2368, 1, 256, 2368, 2368, 2368, 256]
    - [35, 8586.0]
  - - [2944, 2368, 1, 256, 2944, 2944, 2944, 256]
    - [35, 8745.0]
  - - [3584, 2368, 1, 256, 3584, 3584, 3584, 256]
    - [36, 8721.0]
  - - [4288, 2368, 1, 256, 4288, 4288, 4288, 256]
    - [35, 8927.0]
  - - [5056, 2368, 1, 256, 5056, 5056, 5056, 256]
    - [35, 8958.0]
  - - [5888, 2368, 1, 256, 5888, 5888, 5888, 256]
    - [35, 8902.0]
  - - [6784, 2368, 1, 256, 6784, 6784, 6784, 256]
    - [35, 8968.0]
  - - [256, 2944, 1, 256, 256, 256, 256, 256]
    - [21, 6644.0]
  - - [448, 2944, 1, 256, 448, 448, 448, 256]
    - [35, 6710.0]
  - - [704, 2944, 1, 256, 704, 704, 704, 256]
    - [36, 8108.0]
  - - [1024, 2944, 1, 256, 1024, 1024, 1024, 256]
    - [36, 8046.0]
  - - [1408, 2944, 1, 256, 1408, 1408, 1408, 256]
    - [36, 8552.0]
  - - [1856, 2944, 1, 256, 1856, 1856, 1856, 256]
    - [35, 8734.0]
  - - [2368, 2944, 1, 256, 2368, 2368, 2368, 256]
    - [35, 8762.0]
  - - [2944, 2944, 1, 256, 2944, 2944, 2944, 256]
    - [35, 8727.0]
  - - [3584, 2944, 1, 256, 3584, 3584, 3584, 256]
    - [36, 8786.0]
  - - [4288, 2944, 1, 256, 4288, 4288, 4288, 256]
    - [35, 8886.0]
  - - [5056, 2944, 1, 256, 5056, 5056, 5056, 256]
    - [35, 9025.0]
  - - [5888, 2944, 1, 256, 5888, 5888, 5888, 256]
    - [35, 8953.0]
  - - [6784, 2944, 1, 256, 6784, 6784, 6784, 256]
    - [35, 9003.0]
  - - [256, 3584, 1, 256, 256, 256, 256, 256]
    - [36, 6703.0]
  - - [448, 3584, 1, 256, 448, 448, 448, 256]
    - [35, 7136.0]
  - - [704, 3584, 1, 256, 704, 704, 704, 256]
    - [35, 8098.0]
  - - [1024, 3584, 1, 256, 1024, 1024, 1024, 256]
    - [36, 8288.0]
  - - [1408, 3584, 1, 256, 1408, 1408, 1408, 256]
    - [35, 8459.0]
  - - [1856, 3584, 1, 256, 1856, 1856, 1856, 256]
    - [35, 8678.0]
  - - [2368, 3584, 1, 256, 2368, 2368, 2368, 256]
    - [35, 8795.0]
  - - [2944, 3584, 1, 256, 2944, 2944, 2944, 256]
    - [35, 8836.0]
  - - [3584, 3584, 1, 256, 3584, 3584, 3584, 256]
    - [36, 8971.0]
  - - [4288, 3584, 1, 256, 4288, 4288, 4288, 256]
    - [35, 9012.0]
  - - [5056, 3584, 1, 256, 5056, 5056, 5056, 256]
    - [35, 8990.0]
  - - [5888, 3584, 1, 256, 5888, 5888, 5888, 256]
    - [35, 9022.0]
  - - [6784, 3584, 1, 256, 6784, 6784, 6784, 256]
    - [35, 9087.0]
  - - [256, 4288, 1, 256, 256, 256, 256, 256]
    - [36, 6307.0]
  - - [448, 4288, 1, 256, 448, 448, 448, 256]
    - [35, 7589.0]
  - - [704, 4288, 1, 256, 704, 704, 704, 256]
    - [35, 8193.0]
  - - [1024, 4288, 1, 256, 1024, 1024, 1024, 256]
    - [36, 8444.0]
  - - [1408, 4288, 1, 256, 1408, 1408, 1408, 256]
    - [35, 8526.0]
  - - [1856, 4288, 1, 256, 1856, 1856, 1856, 256]
    - [35, 8758.0]
  - - [2368, 4288, 1, 256, 2368, 2368, 2368, 256]
    - [35, 8927.0]
  - - [2944, 4288, 1, 256, 2944, 2944, 2944, 256]
    - [35, 8882.0]
  - - [3584, 4288, 1, 256, 3584, 3584, 3584, 256]
    - [36, 8959.0]
  - - [4288, 4288, 1, 256, 4288, 4288, 4288, 256]
    - [35, 8990.0]
  - - [5056, 4288, 1, 256, 5056, 5056, 5056, 256]
    - [35, 9077.0]
  - - [5888, 4288, 1, 256, 5888, 5888, 5888, 256]
    - [35, 9040.0]
  - - [6784, 4288, 1, 256, 6784, 6784, 6784, 256]
    - [35, 9125.0]
  - - [256, 5056, 1, 256, 256, 256, 256, 256]
    - [36, 7423.0]
  - - [448, 5056, 1, 256, 448, 448, 448, 256]
    - [36, 7939.0]
  - - [704, 5056, 1, 256, 704, 704, 704, 256]
    - [35, 8357.0]
  - - [1024, 5056, 1, 256, 1024, 1024, 1024, 256]
    - [36, 8505.0]
  - - [1408, 5056, 1, 256, 1408, 1408, 1408, 256]
    - [35, 8642.0]
  - - [1856, 5056, 1, 256, 1856, 1856, 1856, 256]
    - [35, 8924.0]
  - - [2368, 5056, 1, 256, 2368, 2368, 2368, 256]
    - [35, 8964.0]
  - - [2944, 5056, 1, 256, 2944, 2944, 2944, 256]
    - [35, 9019.0]
  - - [3584, 5056, 1, 256, 3584, 3584, 3584, 256]
    - [38, 8939.0]
  - - [4288, 5056, 1, 256, 4288, 4288, 4288, 256]
    - [35, 9077.0]
  - - [5056, 5056, 1, 256, 5056, 5056, 5056, 256]
    - [35, 9081.0]
  - - [5888, 5056, 1, 256, 5888, 5888, 5888, 256]
    - [38, 9100.0]
  - - [6784, 5056, 1, 256, 6784, 6784, 6784, 256]
    - [35, 9130.0]
  - - [256, 5888, 1, 256, 256, 256, 256, 256]
    - [36, 7560.0]
  - - [448, 5888, 1, 256, 448, 448, 448, 256]
    - [35, 7765.0]
  - - [704, 5888, 1, 256, 704, 704, 704, 256]
    - [35, 8574.0]
  - - [1024, 5888, 1, 256, 1024, 1024, 1024, 256]
    - [36, 8583.0]
  - - [1408, 5888, 1, 256, 1408, 1408, 1408, 256]
    - [35, 8811.0]
  - - [1856, 5888, 1, 256, 1856, 1856, 1856, 256]
    - [35, 8939.0]
  - - [2368, 5888, 1, 256, 2368, 2368, 2368, 256]
    - [35, 8931.0]
  - - [2944, 5888, 1, 256, 2944, 2944, 2944, 256]
    - [35, 8961.0]
  - - [3584, 5888, 1, 256, 3584, 3584, 3584, 256]
    - [36, 8992.0]
  - - [4288, 5888, 1, 256, 4288, 4288, 4288, 256]
    - [35, 9065.0]
  - - [5056, 5888, 1, 256, 5056, 5056, 5056, 256]
    - [37, 9107.0]
  - - [5888, 5888, 1, 256, 5888, 5888, 5888, 256]
    - [35, 9079.0]
  - - [6784, 5888, 1, 256, 6784, 6784, 6784, 256]
    - [35, 9118.0]
  - - [256, 6784, 1, 256, 256, 256, 256, 256]
    - [36, 7644.0]
  - - [448, 6784, 1, 256, 448, 448, 448, 256]
    - [35, 8228.0]
  - - [704, 6784, 1, 256, 704, 704, 704, 256]
    - [35, 8420.0]
  - - [1024, 6784, 1, 256, 1024, 1024, 1024, 256]
    - [36, 8606.0]
  - - [1408, 6784, 1, 256, 1408, 1408, 1408, 256]
    - [35, 8832.0]
  - - [1856, 6784, 1, 256, 1856, 1856, 1856, 256]
    - [35, 8871.0]
  - - [2368, 6784, 1, 256, 2368, 2368, 2368, 256]
    - [35, 8975.0]
  - - [2944, 6784, 1, 256, 2944, 2944, 2944, 256]
    - [35, 9005.0]
  - - [3584, 6784, 1, 256, 3584, 3584, 3584, 256]
    - [36, 9044.0]
  - - [4288, 6784, 1, 256, 4288, 4288, 4288, 256]
    - [35, 9127.0]
  - - [5056, 6784, 1, 256, 5056, 5056, 5056, 256]
    - [35, 9136.0]
  - - [5888, 6784, 1, 256, 5888, 5888, 5888, 256]
    - [35, 9109.0]
  - - [6784, 6784, 1, 256, 6784, 6784, 6784, 256]
    - [38, 9166.0]
  - - [704, 256, 1, 1280, 704, 704, 704, 1280]
    - [21, 3478.0]
  - - [1024, 256, 1, 1280, 1024, 1024, 1024, 1280]
    - [21, 4958.0]
  - - [1408, 256, 1, 1280, 1408, 1408, 1408, 1280]
    - [21, 4871.0]
  - - [1856, 256, 1, 1280, 1856, 1856, 1856, 1280]
    - [21, 6304.0]
  - - [2368, 256, 1, 1280, 2368, 2368, 2368, 1280]
    - [36, 6282.0]
  - - [2944, 256, 1, 1280, 2944, 2944, 2944, 1280]
    - [18, 7755.0]
  - - [3584, 256, 1, 1280, 3584, 3584, 3584, 1280]
    - [36, 7429.0]
  - - [4288, 256, 1, 1280, 4288, 4288, 4288, 1280]
    - [36, 6945.0]
  - - [5056, 256, 1, 1280, 5056, 5056, 5056, 1280]
    - [36, 8179.0]
  - - [5888, 256, 1, 1280, 5888, 5888, 5888, 1280]
    - [36, 8209.0]
  - - [6784, 256, 1, 1280, 6784, 6784, 6784, 1280]
    - [36, 8231.0]
  - - [704, 448, 1, 1280, 704, 704, 704, 1280]
    - [21, 4266.0]
  - - [1024, 448, 1, 1280, 1024, 1024, 1024, 1280]
    - [21, 6086.0]
  - - [1408, 448, 1, 1280, 1408, 1408, 1408, 1280]
    - [21, 6549.0]
  - - [1856, 448, 1, 1280, 1856, 1856, 1856, 1280]
    - [36, 6753.0]
  - - [2368, 448, 1, 1280, 2368, 2368, 2368, 1280]
    - [36, 6733.0]
  - - [2944, 448, 1, 1280, 2944, 2944, 2944, 1280]
    - [36, 7210.0]
  - - [3584, 448, 1, 1280, 3584, 3584, 3584, 1280]
    - [36, 7594.0]
  - - [4288, 448, 1, 1280, 4288, 4288, 4288, 1280]
    - [36, 8069.0]
  - - [5056, 448, 1, 1280, 5056, 5056, 5056, 1280]
    - [36, 8440.0]
  - - [5888, 448, 1, 1280, 5888, 5888, 5888, 1280]
    - [36, 8154.0]
  - - [6784, 448, 1, 1280, 6784, 6784, 6784, 1280]
    - [36, 8662.0]
  - - [256, 704, 1, 1280, 256, 256, 256, 1280]
    - [29, 3449.0]
  - - [448, 704, 1, 1280, 448, 448, 448, 1280]
    - [21, 4262.0]
  - - [704, 704, 1, 1280, 704, 704, 704, 1280]
    - [21, 6586.0]
  - - [1024, 704, 1, 1280, 1024, 1024, 1024, 1280]
    - [21, 7384.0]
  - - [1408, 704, 1, 1280, 1408, 1408, 1408, 1280]
    - [36, 8010.0]
  - - [1856, 704, 1, 1280, 1856, 1856, 1856, 1280]
    - [36, 8247.0]
  - - [2368, 704, 1, 1280, 2368, 2368, 2368, 1280]
    - [36, 7903.0]
  - - [2944, 704, 1, 1280, 2944, 2944, 2944, 1280]
    - [36, 8690.0]
  - - [3584, 704, 1, 1280, 3584, 3584, 3584, 1280]
    - [36, 8548.0]
  - - [4288, 704, 1, 1280, 4288, 4288, 4288, 1280]
    - [36, 8604.0]
  - - [5056, 704, 1, 1280, 5056, 5056, 5056, 1280]
    - [36, 8747.0]
  - - [5888, 704, 1, 1280, 5888, 5888, 5888, 1280]
    - [36, 8954.0]
  - - [6784, 704, 1, 1280, 6784, 6784, 6784, 1280]
    - [36, 8734.0]
  - - [256, 1024, 1, 1280, 256, 256, 256, 1280]
    - [21, 4993.0]
  - - [448, 1024, 1, 1280, 448, 448, 448, 1280]
    - [21, 6107.0]
  - - [704, 1024, 1, 1280, 704, 704, 704, 1280]
    - [36, 7394.0]
  - - [1024, 1024, 1, 1280, 1024, 1024, 1024, 1280]
    - [21, 8351.0]
  - - [1408, 1024, 1, 1280, 1408, 1408, 1408, 1280]
    - [36, 7852.0]
  - - [1856, 1024, 1, 1280, 1856, 1856, 1856, 1280]
    - [36, 7985.0]
  - - [2368, 1024, 1, 1280, 2368, 2368, 2368, 1280]
    - [36, 8206.0]
  - - [2944, 1024, 1, 1280, 2944, 2944, 2944, 1280]
    - [36, 8590.0]
  - - [3584, 1024, 1, 1280, 3584, 3584, 3584, 1280]
    - [36, 8998.0]
  - - [4288, 1024, 1, 1280, 4288, 4288, 4288, 1280]
    - [36, 8935.0]
  - - [5056, 1024, 1, 1280, 5056, 5056, 5056, 1280]
    - [36, 8999.0]
  - - [5888, 1024, 1, 1280, 5888, 5888, 5888, 1280]
    - [36, 9137.0]
  - - [6784, 1024, 1, 1280, 6784, 6784, 6784, 1280]
    - [36, 9009.0]
  - - [256, 1408, 1, 1280, 256, 256, 256, 1280]
    - [21, 4850.0]
  - - [448, 1408, 1, 1280, 448, 448, 448, 1280]
    - [21, 6516.0]
  - - [704, 1408, 1, 1280, 704, 704, 704, 1280]
    - [36, 7974.0]
  - - [1024, 1408, 1, 1280, 1024, 1024, 1024, 1280]
    - [36, 7804.0]
  - - [1408, 1408, 1, 1280, 1408, 1408, 1408, 1280]
    - [36, 8312.0]
  - - [1856, 1408, 1, 1280, 1856, 1856, 1856, 1280]
    - [36, 8840.0]
  - - [2368, 1408, 1, 1280, 2368, 2368, 2368, 1280]
    - [36, 8777.0]
  - - [2944, 1408, 1, 1280, 2944, 2944, 2944, 1280]
    - [36, 8948.0]
  - - [3584, 1408, 1, 1280, 3584, 3584, 3584, 1280]
    - [36, 8778.0]
  - - [4288, 1408, 1, 1280, 4288, 4288, 4288, 1280]
    - [36, 8791.0]
  - - [5056, 1408, 1, 1280, 5056, 5056, 5056, 1280]
    - [36, 8913.0]
  - - [5888, 1408, 1, 1280, 5888, 5888, 5888, 1280]
    - [36, 9096.0]
  - - [6784, 1408, 1, 1280, 6784, 6784, 6784, 1280]
    - [36, 9090.0]
  - - [256, 1856, 1, 1280, 256, 256, 256, 1280]
    - [21, 6247.0]
  - - [448, 1856, 1, 1280, 448, 448, 448, 1280]
    - [36, 6740.0]
  - - [704, 1856, 1, 1280, 704, 704, 704, 1280]
    - [36, 8205.0]
  - - [1024, 1856, 1, 1280, 1024, 1024, 1024, 1280]
    - [36, 7967.0]
  - - [1408, 1856, 1, 1280, 1408, 1408, 1408, 1280]
    - [36, 8827.0]
  - - [1856, 1856, 1, 1280, 1856, 1856, 1856, 1280]
    - [36, 8465.0]
  - - [2368, 1856, 1, 1280, 2368, 2368, 2368, 1280]
    - [36, 8932.0]
  - - [2944, 1856, 1, 1280, 2944, 2944, 2944, 1280]
    - [36, 9054.0]
  - - [3584, 1856, 1, 1280, 3584, 3584, 3584, 1280]
    - [36, 8952.0]
  - - [4288, 1856, 1, 1280, 4288, 4288, 4288, 1280]
    - [36, 9014.0]
  - - [5056, 1856, 1, 1280, 5056, 5056, 5056, 1280]
    - [36, 9171.0]
  - - [5888, 1856, 1, 1280, 5888, 5888, 5888, 1280]
    - [36, 9175.0]
  - - [6784, 1856, 1, 1280, 6784, 6784, 6784, 1280]
    - [36, 9083.0]
  - - [256, 2368, 1, 1280, 256, 256, 256, 1280]
    - [21, 6246.0]
  - - [448, 2368, 1, 1280, 448, 448, 448, 1280]
    - [36, 6659.0]
  - - [704, 2368, 1, 1280, 704, 704, 704, 1280]
    - [36, 7871.0]
  - - [1024, 2368, 1, 1280, 1024, 1024, 1024, 1280]
    - [36, 8192.0]
  - - [1408, 2368, 1, 1280, 1408, 1408, 1408, 1280]
    - [36, 8783.0]
  - - [1856, 2368, 1, 1280, 1856, 1856, 1856, 1280]
    - [36, 8937.0]
  - - [2368, 2368, 1, 1280, 2368, 2368, 2368, 1280]
    - [36, 8887.0]
  - - [2944, 2368, 1, 1280, 2944, 2944, 2944, 1280]
    - [36, 9038.0]
  - - [3584, 2368, 1, 1280, 3584, 3584, 3584, 1280]
    - [36, 9044.0]
  - - [4288, 2368, 1, 1280, 4288, 4288, 4288, 1280]
    - [35, 9173.0]
  - - [5056, 2368, 1, 1280, 5056, 5056, 5056, 1280]
    - [36, 9191.0]
  - - [5888, 2368, 1, 1280, 5888, 5888, 5888, 1280]
    - [36, 9135.0]
  - - [6784, 2368, 1, 1280, 6784, 6784, 6784, 1280]
    - [36, 9180.0]
  - - [256, 2944, 1, 1280, 256, 256, 256, 1280]
    - [36, 7710.0]
  - - [448, 2944, 1, 1280, 448, 448, 448, 1280]
    - [36, 7192.0]
  - - [704, 2944, 1, 1280, 704, 704, 704, 1280]
    - [36, 8645.0]
  - - [1024, 2944, 1, 1280, 1024, 1024, 1024, 1280]
    - [36, 8548.0]
  - - [1408, 2944, 1, 1280, 1408, 1408, 1408, 1280]
    - [36, 8942.0]
  - - [1856, 2944, 1, 1280, 1856, 1856, 1856, 1280]
    - [36, 9053.0]
  - - [2368, 2944, 1, 1280, 2368, 2368, 2368, 1280]
    - [36, 9040.0]
  - - [2944, 2944, 1, 1280, 2944, 2944, 2944, 1280]
    - [36, 8973.0]
  - - [3584, 2944, 1, 1280, 3584, 3584, 3584, 1280]
    - [36, 9073.0]
  - - [4288, 2944, 1, 1280, 4288, 4288, 4288, 1280]
    - [35, 9107.0]
  - - [5056, 2944, 1, 1280, 5056, 5056, 5056, 1280]
    - [35, 9243.0]
  - - [5888, 2944, 1, 1280, 5888, 5888, 5888, 1280]
    - [36, 9171.0]
  - - [6784, 2944, 1, 1280, 6784, 6784, 6784, 1280]
    - [35, 9207.0]
  - - [256, 3584, 1, 1280, 256, 256, 256, 1280]
    - [36, 7322.0]
  - - [448, 3584, 1, 1280, 448, 448, 448, 1280]
    - [36, 7578.0]
  - - [704, 3584, 1, 1280, 704, 704, 704, 1280]
    - [36, 8522.0]
  - - [1024, 3584, 1, 1280, 1024, 1024, 1024, 1280]
    - [36, 8955.0]
  - - [1408, 3584, 1, 1280, 1408, 1408, 1408, 1280]
    - [36, 8777.0]
  - - [1856, 3584, 1, 1280, 1856, 1856, 1856, 1280]
    - [35, 8951.0]
  - - [2368, 3584, 1, 1280, 2368, 2368, 2368, 1280]
    - [36, 9040.0]
  - - [2944, 3584, 1, 1280, 2944, 2944, 2944, 1280]
    - [36, 9079.0]
  - - [3584, 3584, 1, 1280, 3584, 3584, 3584, 1280]
    - [36, 9259.0]
  - - [4288, 3584, 1, 1280, 4288, 4288, 4288, 1280]
    - [35, 9223.0]
  - - [5056, 3584, 1, 1280, 5056, 5056, 5056, 1280]
    - [35, 9181.0]
  - - [5888, 3584, 1, 1280, 5888, 5888, 5888, 1280]
    - [36, 9250.0]
  - - [6784, 3584, 1, 1280, 6784, 6784, 6784, 1280]
    - [35, 9290.0]
  - - [256, 4288, 1, 1280, 256, 256, 256, 1280]
    - [36, 6904.0]
  - - [448, 4288, 1, 1280, 448, 448, 448, 1280]
    - [36, 8061.0]
  - - [704, 4288, 1, 1280, 704, 704, 704, 1280]
    - [36, 8581.0]
  - - [1024, 4288, 1, 1280, 1024, 1024, 1024, 1280]
    - [36, 8890.0]
  - - [1408, 4288, 1, 1280, 1408, 1408, 1408, 1280]
    - [36, 8796.0]
  - - [1856, 4288, 1, 1280, 1856, 1856, 1856, 1280]
    - [36, 9011.0]
  - - [2368, 4288, 1, 1280, 2368, 2368, 2368, 1280]
    - [36, 9170.0]
  - - [2944, 4288, 1, 1280, 2944, 2944, 2944, 1280]
    - [36, 9107.0]
  - - [3584, 4288, 1, 1280, 3584, 3584, 3584, 1280]
    - [36, 9223.0]
  - - [4288, 4288, 1, 1280, 4288, 4288, 4288, 1280]
    - [35, 9187.0]
  - - [5056, 4288, 1, 1280, 5056, 5056, 5056, 1280]
    - [35, 9275.0]
  - - [5888, 4288, 1, 1280, 5888, 5888, 5888, 1280]
    - [36, 9249.0]
  - - [6784, 4288, 1, 1280, 6784, 6784, 6784, 1280]
    - [35, 9320.0]
  - - [256, 5056, 1, 1280, 256, 256, 256, 1280]
    - [36, 8090.0]
  - - [448, 5056, 1, 1280, 448, 448, 448, 1280]
    - [36, 8426.0]
  - - [704, 5056, 1, 1280, 704, 704, 704, 1280]
    - [36, 8731.0]
  - - [1024, 5056, 1, 1280, 1024, 1024, 1024, 1280]
    - [36, 8972.0]
  - - [1408, 5056, 1, 1280, 1408, 1408, 1408, 1280]
    - [36, 8915.0]
  - - [1856, 5056, 1, 1280, 1856, 1856, 1856, 1280]
    - [36, 9176.0]
  - - [2368, 5056, 1, 1280, 2368, 2368, 2368, 1280]
    - [36, 9190.0]
  - - [2944, 5056, 1, 1280, 2944, 2944, 2944, 1280]
    - [36, 9242.0]
  - - [3584, 5056, 1, 1280, 3584, 3584, 3584, 1280]
    - [36, 9183.0]
  - - [4288, 5056, 1, 1280, 4288, 4288, 4288, 1280]
    - [35, 9276.0]
  - - [5056, 5056, 1, 1280, 5056, 5056, 5056, 1280]
    - [35, 9272.0]
  - - [5888, 5056, 1, 1280, 5888, 5888, 5888, 1280]
    - [38, 9305.0]
  - - [6784, 5056, 1, 1280, 6784, 6784, 6784, 1280]
    - [35, 9321.0]
  - - [256, 5888, 1, 1280, 256, 256, 256, 1280]
    - [36, 8120.0]
  - - [448, 5888, 1, 1280, 448, 448, 448, 1280]
    - [36, 8146.0]
  - - [704, 5888, 1, 1280, 704, 704, 704, 1280]
    - [36, 8941.0]
  - - [1024, 5888, 1, 1280, 1024, 1024, 1024, 1280]
    - [36, 9101.0]
  - - [1408, 5888, 1, 1280, 1408, 1408, 1408, 1280]
    - [36, 9100.0]
  - - [1856, 5888, 1, 1280, 1856, 1856, 1856, 1280]
    - [36, 9178.0]
  - - [2368, 5888, 1, 1280, 2368, 2368, 2368, 1280]
    - [36, 9136.0]
  - - [2944, 5888, 1, 1280, 2944, 2944, 2944, 1280]
    - [36, 9172.0]
  - - [3584, 5888, 1, 1280, 3584, 3584, 3584, 1280]
    - [36, 9249.0]
  - - [4288, 5888, 1, 1280, 4288, 4288, 4288, 1280]
    - [35, 9253.0]
  - - [5056, 5888, 1, 1280, 5056, 5056, 5056, 1280]
    - [35, 9292.0]
  - - [5888, 5888, 1, 1280, 5888, 5888, 5888, 1280]
    - [35, 9280.0]
  - - [6784, 5888, 1, 1280, 6784, 6784, 6784, 1280]
    - [35, 9301.0]
  - - [256, 6784, 1, 1280, 256, 256, 256, 1280]
    - [36, 8158.0]
  - - [448, 6784, 1, 1280, 448, 448, 448, 1280]
    - [36, 8642.0]
  - - [704, 6784, 1, 1280, 704, 704, 704, 1280]
    - [36, 8720.0]
  - - [1024, 6784, 1, 1280, 1024, 1024, 1024, 1280]
    - [36, 8993.0]
  - - [1408, 6784, 1, 1280, 1408, 1408, 1408, 1280]
    - [36, 9089.0]
  - - [1856, 6784, 1, 1280, 1856, 1856, 1856, 1280]
    - [35, 9085.0]
  - - [2368, 6784, 1, 1280, 2368, 2368, 2368, 1280]
    - [36, 9180.0]
  - - [2944, 6784, 1, 1280, 2944, 2944, 2944, 1280]
    - [35, 9203.0]
  - - [3584, 6784, 1, 1280, 3584, 3584, 3584, 1280]
    - [36, 9286.0]
  - - [4288, 6784, 1, 1280, 4288, 4288, 4288, 1280]
    - [35, 9321.0]
  - - [5056, 6784, 1, 1280, 5056, 5056, 5056, 1280]
    - [35, 9321.0]
  - - [5888, 6784, 1, 1280, 5888, 5888, 5888, 1280]
    - [35, 9299.0]
  - - [6784, 6784, 1, 1280, 6784, 6784, 6784, 1280]
    - [38, 9336.0]
  - - [704, 256, 1, 3328, 704, 704, 704, 3328]
    - [29, 3562.0]
  - - [1024, 256, 1, 3328, 1024, 1024, 1024, 3328]
    - [29, 5142.0]
  - - [1408, 256, 1, 3328, 1408, 1408, 1408, 3328]
    - [29, 5010.0]
  - - [1856, 256, 1, 3328, 1856, 1856, 1856, 3328]
    - [21, 6489.0]
  - - [2368, 256, 1, 3328, 2368, 2368, 2368, 3328]
    - [21, 6450.0]
  - - [2944, 256, 1, 3328, 2944, 2944, 2944, 3328]
    - [36, 7945.0]
  - - [3584, 256, 1, 3328, 3584, 3584, 3584, 3328]
    - [21, 7572.0]
  - - [4288, 256, 1, 3328, 4288, 4288, 4288, 3328]
    - [36, 7048.0]
  - - [5056, 256, 1, 3328, 5056, 5056, 5056, 3328]
    - [36, 8291.0]
  - - [5888, 256, 1, 3328, 5888, 5888, 5888, 3328]
    - [36, 8309.0]
  - - [6784, 256, 1, 3328, 6784, 6784, 6784, 3328]
    - [36, 8321.0]
  - - [704, 448, 1, 3328, 704, 704, 704, 3328]
    - [21, 4397.0]
  - - [1024, 448, 1, 3328, 1024, 1024, 1024, 3328]
    - [29, 6288.0]
  - - [1408, 448, 1, 3328, 1408, 1408, 1408, 3328]
    - [21, 6675.0]
  - - [1856, 448, 1, 3328, 1856, 1856, 1856, 3328]
    - [36, 6875.0]
  - - [2368, 448, 1, 3328, 2368, 2368, 2368, 3328]
    - [36, 6843.0]
  - - [2944, 448, 1, 3328, 2944, 2944, 2944, 3328]
    - [36, 7292.0]
  - - [3584, 448, 1, 3328, 3584, 3584, 3584, 3328]
    - [36, 7699.0]
  - - [4288, 448, 1, 3328, 4288, 4288, 4288, 3328]
    - [36, 8161.0]
  - - [5056, 448, 1, 3328, 5056, 5056, 5056, 3328]
    - [36, 8512.0]
  - - [5888, 448, 1, 3328, 5888, 5888, 5888, 3328]
    - [36, 8229.0]
  - - [6784, 448, 1, 3328, 6784, 6784, 6784, 3328]
    - [36, 8740.0]
  - - [256, 704, 1, 3328, 256, 256, 256, 3328]
    - [29, 3562.0]
  - - [448, 704, 1, 3328, 448, 448, 448, 3328]
    - [21, 4376.0]
  - - [704, 704, 1, 3328, 704, 704, 704, 3328]
    - [29, 6758.0]
  - - [1024, 704, 1, 3328, 1024, 1024, 1024, 3328]
    - [36, 7577.0]
  - - [1408, 704, 1, 3328, 1408, 1408, 1408, 3328]
    - [36, 8175.0]
  - - [1856, 704, 1, 3328, 1856, 1856, 1856, 3328]
    - [36, 8359.0]
  - - [2368, 704, 1, 3328, 2368, 2368, 2368, 3328]
    - [36, 7988.0]
  - - [2944, 704, 1, 3328, 2944, 2944, 2944, 3328]
    - [36, 8791.0]
  - - [3584, 704, 1, 3328, 3584, 3584, 3584, 3328]
    - [36, 8630.0]
  - - [4288, 704, 1, 3328, 4288, 4288, 4288, 3328]
    - [36, 8674.0]
  - - [5056, 704, 1, 3328, 5056, 5056, 5056, 3328]
    - [36, 8812.0]
  - - [5888, 704, 1, 3328, 5888, 5888, 5888, 3328]
    - [36, 9012.0]
  - - [6784, 704, 1, 3328, 6784, 6784, 6784, 3328]
    - [36, 8785.0]
  - - [256, 1024, 1, 3328, 256, 256, 256, 3328]
    - [29, 5149.0]
  - - [448, 1024, 1, 3328, 448, 448, 448, 3328]
    - [21, 6267.0]
  - - [704, 1024, 1, 3328, 704, 704, 704, 3328]
    - [36, 7596.0]
  - - [1024, 1024, 1, 3328, 1024, 1024, 1024, 3328]
    - [36, 8588.0]
  - - [1408, 1024, 1, 3328, 1408, 1408, 1408, 3328]
    - [36, 7963.0]
  - - [1856, 1024, 1, 3328, 1856, 1856, 1856, 3328]
    - [36, 8075.0]
  - - [2368, 1024, 1, 3328, 2368, 2368, 2368, 3328]
    - [36, 8301.0]
  - - [2944, 1024, 1, 3328, 2944, 2944, 2944, 3328]
    - [36, 8672.0]
  - - [3584, 1024, 1, 3328, 3584, 3584, 3584, 3328]
    - [36, 9075.0]
  - - [4288, 1024, 1, 3328, 4288, 4288, 4288, 3328]
    - [36, 8989.0]
  - - [5056, 1024, 1, 3328, 5056, 5056, 5056, 3328]
    - [36, 9061.0]
  - - [5888, 1024, 1, 3328, 5888, 5888, 5888, 3328]
    - [36, 9194.0]
  - - [6784, 1024, 1, 3328, 6784, 6784, 6784, 3328]
    - [36, 9061.0]
  - - [256, 1408, 1, 3328, 256, 256, 256, 3328]
    - [21, 4954.0]
  - - [448, 1408, 1, 3328, 448, 448, 448, 3328]
    - [36, 6669.0]
  - - [704, 1408, 1, 3328, 704, 704, 704, 3328]
    - [36, 8149.0]
  - - [1024, 1408, 1, 3328, 1024, 1024, 1024, 3328]
    - [36, 7949.0]
  - - [1408, 1408, 1, 3328, 1408, 1408, 1408, 3328]
    - [36, 8409.0]
  - - [1856, 1408, 1, 3328, 1856, 1856, 1856, 3328]
    - [36, 8932.0]
  - - [2368, 1408, 1, 3328, 2368, 2368, 2368, 3328]
    - [36, 8849.0]
  - - [2944, 1408, 1, 3328, 2944, 2944, 2944, 3328]
    - [36, 9014.0]
  - - [3584, 1408, 1, 3328, 3584, 3584, 3584, 3328]
    - [36, 8837.0]
  - - [4288, 1408, 1, 3328, 4288, 4288, 4288, 3328]
    - [36, 8846.0]
  - - [5056, 1408, 1, 3328, 5056, 5056, 5056, 3328]
    - [36, 8966.0]
  - - [5888, 1408, 1, 3328, 5888, 5888, 5888, 3328]
    - [36, 9151.0]
  - - [6784, 1408, 1, 3328, 6784, 6784, 6784, 3328]
    - [36, 9138.0]
  - - [256, 1856, 1, 3328, 256, 256, 256, 3328]
    - [36, 6464.0]
  - - [448, 1856, 1, 3328, 448, 448, 448, 3328]
    - [36, 6851.0]
  - - [704, 1856, 1, 3328, 704, 704, 704, 3328]
    - [36, 8346.0]
  - - [1024, 1856, 1, 3328, 1024, 1024, 1024, 3328]
    - [36, 8073.0]
  - - [1408, 1856, 1, 3328, 1408, 1408, 1408, 3328]
    - [36, 8928.0]
  - - [1856, 1856, 1, 3328, 1856, 1856, 1856, 3328]
    - [36, 8535.0]
  - - [2368, 1856, 1, 3328, 2368, 2368, 2368, 3328]
    - [36, 9004.0]
  - - [2944, 1856, 1, 3328, 2944, 2944, 2944, 3328]
    - [36, 9110.0]
  - - [3584, 1856, 1, 3328, 3584, 3584, 3584, 3328]
    - [36, 9007.0]
  - - [4288, 1856, 1, 3328, 4288, 4288, 4288, 3328]
    - [36, 9064.0]
  - - [5056, 1856, 1, 3328, 5056, 5056, 5056, 3328]
    - [36, 9221.0]
  - - [5888, 1856, 1, 3328, 5888, 5888, 5888, 3328]
    - [36, 9221.0]
  - - [6784, 1856, 1, 3328, 6784, 6784, 6784, 3328]
    - [36, 9125.0]
  - - [256, 2368, 1, 3328, 256, 256, 256, 3328]
    - [36, 6404.0]
  - - [448, 2368, 1, 3328, 448, 448, 448, 3328]
    - [36, 6813.0]
  - - [704, 2368, 1, 3328, 704, 704, 704, 3328]
    - [36, 7977.0]
  - - [1024, 2368, 1, 3328, 1024, 1024, 1024, 3328]
    - [36, 8294.0]
  - - [1408, 2368, 1, 3328, 1408, 1408, 1408, 3328]
    - [36, 8850.0]
  - - [1856, 2368, 1, 3328, 1856, 1856, 1856, 3328]
    - [36, 9007.0]
  - - [2368, 2368, 1, 3328, 2368, 2368, 2368, 3328]
    - [36, 8947.0]
  - - [2944, 2368, 1, 3328, 2944, 2944, 2944, 3328]
    - [36, 9091.0]
  - - [3584, 2368, 1, 3328, 3584, 3584, 3584, 3328]
    - [36, 9087.0]
  - - [4288, 2368, 1, 3328, 4288, 4288, 4288, 3328]
    - [36, 9220.0]
  - - [5056, 2368, 1, 3328, 5056, 5056, 5056, 3328]
    - [36, 9235.0]
  - - [5888, 2368, 1, 3328, 5888, 5888, 5888, 3328]
    - [36, 9176.0]
  - - [6784, 2368, 1, 3328, 6784, 6784, 6784, 3328]
    - [36, 9219.0]
  - - [256, 2944, 1, 3328, 256, 256, 256, 3328]
    - [36, 7885.0]
  - - [448, 2944, 1, 3328, 448, 448, 448, 3328]
    - [36, 7280.0]
  - - [704, 2944, 1, 3328, 704, 704, 704, 3328]
    - [36, 8774.0]
  - - [1024, 2944, 1, 3328, 1024, 1024, 1024, 3328]
    - [36, 8659.0]
  - - [1408, 2944, 1, 3328, 1408, 1408, 1408, 3328]
    - [36, 9017.0]
  - - [1856, 2944, 1, 3328, 1856, 1856, 1856, 3328]
    - [36, 9111.0]
  - - [2368, 2944, 1, 3328, 2368, 2368, 2368, 3328]
    - [36, 9092.0]
  - - [2944, 2944, 1, 3328, 2944, 2944, 2944, 3328]
    - [36, 9015.0]
  - - [3584, 2944, 1, 3328, 3584, 3584, 3584, 3328]
    - [36, 9120.0]
  - - [4288, 2944, 1, 3328, 4288, 4288, 4288, 3328]
    - [36, 9147.0]
  - - [5056, 2944, 1, 3328, 5056, 5056, 5056, 3328]
    - [36, 9285.0]
  - - [5888, 2944, 1, 3328, 5888, 5888, 5888, 3328]
    - [36, 9212.0]
  - - [6784, 2944, 1, 3328, 6784, 6784, 6784, 3328]
    - [36, 9244.0]
  - - [256, 3584, 1, 3328, 256, 256, 256, 3328]
    - [36, 7537.0]
  - - [448, 3584, 1, 3328, 448, 448, 448, 3328]
    - [36, 7678.0]
  - - [704, 3584, 1, 3328, 704, 704, 704, 3328]
    - [36, 8629.0]
  - - [1024, 3584, 1, 3328, 1024, 1024, 1024, 3328]
    - [36, 9053.0]
  - - [1408, 3584, 1, 3328, 1408, 1408, 1408, 3328]
    - [36, 8839.0]
  - - [1856, 3584, 1, 3328, 1856, 1856, 1856, 3328]
    - [36, 9008.0]
  - - [2368, 3584, 1, 3328, 2368, 2368, 2368, 3328]
    - [36, 9088.0]
  - - [2944, 3584, 1, 3328, 2944, 2944, 2944, 3328]
    - [36, 9119.0]
  - - [3584, 3584, 1, 3328, 3584, 3584, 3584, 3328]
    - [36, 9303.0]
  - - [4288, 3584, 1, 3328, 4288, 4288, 4288, 3328]
    - [36, 9263.0]
  - - [5056, 3584, 1, 3328, 5056, 5056, 5056, 3328]
    - [36, 9220.0]
  - - [5888, 3584, 1, 3328, 5888, 5888, 5888, 3328]
    - [36, 9286.0]
  - - [6784, 3584, 1, 3328, 6784, 6784, 6784, 3328]
    - [36, 9326.0]
  - - [256, 4288, 1, 3328, 256, 256, 256, 3328]
    - [36, 7009.0]
  - - [448, 4288, 1, 3328, 448, 448, 448, 3328]
    - [36, 8145.0]
  - - [704, 4288, 1, 3328, 704, 704, 704, 3328]
    - [36, 8668.0]
  - - [1024, 4288, 1, 3328, 1024, 1024, 1024, 3328]
    - [36, 8981.0]
  - - [1408, 4288, 1, 3328, 1408, 1408, 1408, 3328]
    - [36, 8848.0]
  - - [1856, 4288, 1, 3328, 1856, 1856, 1856, 3328]
    - [36, 9063.0]
  - - [2368, 4288, 1, 3328, 2368, 2368, 2368, 3328]
    - [36, 9219.0]
  - - [2944, 4288, 1, 3328, 2944, 2944, 2944, 3328]
    - [36, 9148.0]
  - - [3584, 4288, 1, 3328, 3584, 3584, 3584, 3328]
    - [36, 9265.0]
  - - [4288, 4288, 1, 3328, 4288, 4288, 4288, 3328]
    - [36, 9225.0]
  - - [5056, 4288, 1, 3328, 5056, 5056, 5056, 3328]
    - [36, 9312.0]
  - - [5888, 4288, 1, 3328, 5888, 5888, 5888, 3328]
    - [36, 9287.0]
  - - [6784, 4288, 1, 3328, 6784, 6784, 6784, 3328]
    - [36, 9355.0]
  - - [256, 5056, 1, 3328, 256, 256, 256, 3328]
    - [36, 8243.0]
  - - [448, 5056, 1, 3328, 448, 448, 448, 3328]
    - [36, 8498.0]
  - - [704, 5056, 1, 3328, 704, 704, 704, 3328]
    - [36, 8803.0]
  - - [1024, 5056, 1, 3328, 1024, 1024, 1024, 3328]
    - [36, 9049.0]
  - - [1408, 5056, 1, 3328, 1408, 1408, 1408, 3328]
    - [36, 8964.0]
  - - [1856, 5056, 1, 3328, 1856, 1856, 1856, 3328]
    - [36, 9222.0]
  - - [2368, 5056, 1, 3328, 2368, 2368, 2368, 3328]
    - [36, 9235.0]
  - - [2944, 5056, 1, 3328, 2944, 2944, 2944, 3328]
    - [36, 9283.0]
  - - [3584, 5056, 1, 3328, 3584, 3584, 3584, 3328]
    - [36, 9220.0]
  - - [4288, 5056, 1, 3328, 4288, 4288, 4288, 3328]
    - [36, 9312.0]
  - - [5056, 5056, 1, 3328, 5056, 5056, 5056, 3328]
    - [36, 9306.0]
  - - [5888, 5056, 1, 3328, 5888, 5888, 5888, 3328]
    - [38, 9328.0]
  - - [6784, 5056, 1, 3328, 6784, 6784, 6784, 3328]
    - [36, 9357.0]
  - - [256, 5888, 1, 3328, 256, 256, 256, 3328]
    - [36, 8279.0]
  - - [448, 5888, 1, 3328, 448, 448, 448, 3328]
    - [36, 8216.0]
  - - [704, 5888, 1, 3328, 704, 704, 704, 3328]
    - [36, 9014.0]
  - - [1024, 5888, 1, 3328, 1024, 1024, 1024, 3328]
    - [36, 9181.0]
  - - [1408, 5888, 1, 3328, 1408, 1408, 1408, 3328]
    - [36, 9150.0]
  - - [1856, 5888, 1, 3328, 1856, 1856, 1856, 3328]
    - [36, 9224.0]
  - - [2368, 5888, 1, 3328, 2368, 2368, 2368, 3328]
    - [36, 9177.0]
  - - [2944, 5888, 1, 3328, 2944, 2944, 2944, 3328]
    - [36, 9212.0]
  - - [3584, 5888, 1, 3328, 3584, 3584, 3584, 3328]
    - [36, 9286.0]
  - - [4288, 5888, 1, 3328, 4288, 4288, 4288, 3328]
    - [36, 9287.0]
  - - [5056, 5888, 1, 3328, 5056, 5056, 5056, 3328]
    - [36, 9323.0]
  - - [5888, 5888, 1, 3328, 5888, 5888, 5888, 3328]
    - [36, 9325.0]
  - - [6784, 5888, 1, 3328, 6784, 6784, 6784, 3328]
    - [36, 9343.0]
  - - [256, 6784, 1, 3328, 256, 256, 256, 3328]
    - [36, 8269.0]
  - - [448, 6784, 1, 3328, 448, 448, 448, 3328]
    - [36, 8724.0]
  - - [704, 6784, 1, 3328, 704, 704, 704, 3328]
    - [36, 8779.0]
  - - [1024, 6784, 1, 3328, 1024, 1024, 1024, 3328]
    - [36, 9051.0]
  - - [1408, 6784, 1, 3328, 1408, 1408, 1408, 3328]
    - [36, 9138.0]
  - - [1856, 6784, 1, 3328, 1856, 1856, 1856, 3328]
    - [36, 9129.0]
  - - [2368, 6784, 1, 3328, 2368, 2368, 2368, 3328]
    - [36, 9219.0]
  - - [2944, 6784, 1, 3328, 2944, 2944, 2944, 3328]
    - [36, 9243.0]
  - - [3584, 6784, 1, 3328, 3584, 3584, 3584, 3328]
    - [36, 9328.0]
  - - [4288, 6784, 1, 3328, 4288, 4288, 4288, 3328]
    - [36, 9359.0]
  - - [5056, 6784, 1, 3328, 5056, 5056, 5056, 3328]
    - [35, 9352.0]
  - - [5888, 6784, 1, 3328, 5888, 5888, 5888, 3328]
    - [36, 9340.0]
  - - [6784, 6784, 1, 3328, 6784, 6784, 6784, 3328]
    - [38, 9401.0]
  - - [1024, 1024, 1, 1024, 1024, 1024, 1024, 1024]
    - [18, 8316.0]
  - - [1024, 700, 1, 512, 1024, 1024, 1024, 512]
    - [21, 6909.0]
  - - [3072, 1500, 1, 128, 3072, 3072, 3072, 128]
    - [38, 7827.0]
  - - [4224, 1500, 1, 176, 4224, 4224, 4224, 176]
    - [35, 8402.0]
  - - [512, 1500, 1, 1536, 512, 512, 512, 1536]
    - [36, 7881.0]
  - - [512, 1500, 1, 2048, 512, 512, 512, 2048]
    - [36, 7950.0]
  - - [512, 1500, 1, 2560, 512, 512, 512, 2560]
    - [36, 7997.0]
  - - [512, 1500, 1, 2816, 512, 512, 512, 2816]
    - [36, 7975.0]
  - - [512, 3000, 1, 1536, 512, 512, 512, 1536]
    - [36, 8338.0]
  - - [1024, 1500, 1, 1536, 1024, 1024, 1024, 1536]
    - [36, 8319.0]
  - - [512, 3000, 1, 2048, 512, 512, 512, 2048]
    - [36, 8354.0]
  - - [1024, 1500, 1, 2048, 1024, 1024, 1024, 2048]
    - [36, 8350.0]
  - - [512, 3000, 1, 2560, 512, 512, 512, 2560]
    - [36, 8396.0]
  - - [1024, 1500, 1, 2560, 1024, 1024, 1024, 2560]
    - [36, 8401.0]
  - - [512, 3000, 1, 2816, 512, 512, 512, 2816]
    - [36, 8407.0]
  - - [1024, 1500, 1, 2816, 1024, 1024, 1024, 2816]
    - [36, 8424.0]
  - - [512, 6000, 1, 1536, 512, 512, 512, 1536]
    - [36, 8742.0]
  - - [1024, 3000, 1, 1536, 1024, 1024, 1024, 1536]
    - [36, 8737.0]
  - - [3072, 1500, 1, 1024, 3072, 3072, 3072, 1024]
    - [36, 8811.0]
  - - [512, 6000, 1, 2048, 512, 512, 512, 2048]
    - [36, 8757.0]
  - - [1024, 3000, 1, 2048, 1024, 1024, 1024, 2048]
    - [36, 8749.0]
  - - [5124, 700, 1, 2048, 5124, 5124, 5124, 2048]
    - [36, 8825.0]
  - - [512, 6000, 1, 2560, 512, 512, 512, 2560]
    - [36, 8798.0]
  - - [1024, 3000, 1, 2560, 1024, 1024, 1024, 2560]
    - [36, 8794.0]
  - - [512, 6000, 1, 2816, 512, 512, 512, 2816]
    - [36, 8801.0]
  - - [1024, 3000, 1, 2816, 1024, 1024, 1024, 2816]
    - [36, 8804.0]
  - - [5124, 700, 1, 2560, 5124, 5124, 5124, 2560]
    - [36, 8849.0]
  - - [1024, 6000, 1, 1536, 1024, 1024, 1024, 1536]
    - [36, 8936.0]
  - - [3072, 3000, 1, 1024, 3072, 3072, 3072, 1024]
    - [36, 8980.0]
  - - [4608, 1500, 1, 1536, 4608, 4608, 4608, 1536]
    - [36, 8971.0]
  - - [1024, 6000, 1, 2048, 1024, 1024, 1024, 2048]
    - [36, 8951.0]
  - - [1024, 6000, 1, 2560, 1024, 1024, 1024, 2560]
    - [36, 8979.0]
  - - [5124, 1500, 1, 2048, 5124, 5124, 5124, 2048]
    - [36, 8727.0]
  - - [1024, 6000, 1, 2816, 1024, 1024, 1024, 2816]
    - [36, 8986.0]
  - - [512, 24000, 1, 1536, 512, 512, 512, 1536]
    - [36, 9238.0]
  - - [3072, 6000, 1, 1024, 3072, 3072, 3072, 1024]
    - [36, 9171.0]
  - - [5124, 1500, 1, 2560, 5124, 5124, 5124, 2560]
    - [19, 8757.0]
  - - [4608, 3000, 1, 1536, 4608, 4608, 4608, 1536]
    - [36, 9232.0]
  - - [1760, 7000, 1, 1760, 1760, 1760, 1760, 1760]
    - [19, 9023.0]
  - - [6144, 1500, 1, 2560, 6144, 6144, 6144, 2560]
    - [36, 9031.0]
  - - [512, 24000, 1, 2048, 512, 512, 512, 2048]
    - [36, 9251.0]
  - - [2048, 7000, 1, 2048, 2048, 2048, 2048, 2048]
    - [36, 9142.0]
  - - [7680, 1500, 1, 2560, 7680, 7680, 7680, 2560]
    - [36, 9068.0]
  - - [512, 24000, 1, 2560, 512, 512, 512, 2560]
    - [36, 9262.0]
  - - [512, 24000, 1, 2816, 512, 512, 512, 2816]
    - [36, 9268.0]
  - - [8448, 1500, 1, 2816, 8448, 8448, 8448, 2816]
    - [36, 8993.0]
  - - [512, 48000, 1, 1536, 512, 512, 512, 1536]
    - [36, 9296.0]
  - - [1024, 24000, 1, 1536, 1024, 1024, 1024, 1536]
    - [38, 9294.0]
  - - [4608, 6000, 1, 1536, 4608, 4608, 4608, 1536]
    - [36, 9281.0]
  - - [2560, 7000, 1, 2560, 2560, 2560, 2560, 2560]
    - [36, 9239.0]
  - - [6144, 3000, 1, 2560, 6144, 6144, 6144, 2560]
    - [36, 9231.0]
  - - [512, 48000, 1, 2048, 512, 512, 512, 2048]
    - [36, 9301.0]
  - - [1024, 24000, 1, 2048, 1024, 1024, 1024, 2048]
    - [36, 9295.0]
  - - [7680, 3000, 1, 2560, 7680, 7680, 7680, 2560]
    - [36, 9225.0]
  - - [512, 48000, 1, 2560, 512, 512, 512, 2560]
    - [36, 9318.0]
  - - [1024, 24000, 1, 2560, 1024, 1024, 1024, 2560]
    - [36, 9315.0]
  - - [512, 48000, 1, 2816, 512, 512, 512, 2816]
    - [36, 9319.0]
  - - [1024, 24000, 1, 2816, 1024, 1024, 1024, 2816]
    - [36, 9317.0]
  - - [8448, 3000, 1, 2816, 8448, 8448, 8448, 2816]
    - [36, 9317.0]
  - - [1024, 48000, 1, 1536, 1024, 1024, 1024, 1536]
    - [38, 9326.0]
  - - [3072, 24000, 1, 1024, 3072, 3072, 3072, 1024]
    - [38, 9333.0]
  - - [5124, 9124, 1, 1760, 5124, 5124, 5124, 1760]
    - [36, 9216.0]
  - - [6144, 6000, 1, 2560, 6144, 6144, 6144, 2560]
    - [36, 9325.0]
  - - [5124, 9124, 1, 2048, 5124, 5124, 5124, 2048]
    - [36, 9221.0]
  - - [1024, 48000, 1, 2048, 1024, 1024, 1024, 2048]
    - [38, 9346.0]
  - - [4096, 7000, 1, 4096, 4096, 4096, 4096, 4096]
    - [38, 9301.0]
  - - [7680, 6000, 1, 2560, 7680, 7680, 7680, 2560]
    - [36, 9307.0]
  - - [5124, 9124, 1, 2560, 5124, 5124, 5124, 2560]
    - [36, 9239.0]
  - - [1024, 48000, 1, 2560, 1024, 1024, 1024, 2560]
    - [38, 9394.0]
  - - [1024, 48000, 1, 2816, 1024, 1024, 1024, 2816]
    - [38, 9395.0]
  - - [8448, 6000, 1, 2816, 8448, 8448, 8448, 2816]
    - [38, 9374.0]
  - - [3072, 48000, 1, 1024, 3072, 3072, 3072, 1024]
    - [38, 9399.0]
  - - [4608, 24000, 1, 1536, 4608, 4608, 4608, 1536]
    - [38, 9415.0]
  - - [5124, 9124, 1, 4096, 5124, 5124, 5124, 4096]
    - [36, 9187.0]
  - - [4608, 48000, 1, 1536, 4608, 4608, 4608, 1536]
    - [38, 9410.0]
  - - [6144, 24000, 1, 2560, 6144, 6144, 6144, 2560]
    - [38, 9416.0]
  - - [7680, 24000, 1, 2560, 7680, 7680, 7680, 2560]
    - [38, 9416.0]
  - - [8448, 24000, 1, 2816, 8448, 8448, 8448, 2816]
    - [38, 9434.0]
  - - [6144, 48000, 1, 2560, 6144, 6144, 6144, 2560]
    - [38, 9426.0]
  - - [7680, 48000, 1, 2560, 7680, 7680, 7680, 2560]
    - [38, 9431.0]
  - - [8448, 48000, 1, 2816, 8448, 8448, 8448, 2816]
    - [38, 9448.0]
  - - [256, 193600, 1, 64, 256, 256, 256, 64]
    - [39, 8536.0]
  - - [64, 193600, 1, 64, 64, 64, 64, 64]
    - [2, 8206.0]
  - - [64, 193600, 1, 256, 64, 64, 64, 256]
    - [43, 8856.0]
  - - [512, 50176, 1, 128, 512, 512, 512, 128]
    - [39, 8876.0]
  - - [128, 50176, 1, 512, 128, 128, 128, 512]
    - [41, 8953.0]
  - - [256, 12544, 1, 1024, 256, 256, 256, 1024]
    - [40, 8727.0]
  - - [1024, 12544, 1, 256, 1024, 1024, 1024, 256]
    - [8, 8949.0]
  - - [2048, 3136, 1, 512, 2048, 2048, 2048, 512]
    - [40, 8928.0]
  - - [512, 3136, 1, 2048, 512, 512, 512, 2048]
    - [42, 8188.0]
  - - [196, 256, 64, 1024, 196, 196, 196, 1024]
    - [45, 7394.0]
  - - [784, 512, 64, 128, 784, 784, 784, 128]
    - [44, 8456.0]
  - - [3136, 512, 1, 2048, 3136, 3136, 3136, 2048]
    - [47, 7332.0]
  - - [196, 1024, 64, 256, 196, 196, 196, 256]
    - [46, 7630.0]
  - - [3136, 2048, 1, 512, 3136, 3136, 3136, 512]
    - [47, 8720.0]
  - - [32, 32, 1, 32, 32, 32, 32, 32]
    - [48, 4.0]
  - - [32, 64, 1, 256, 32, 32, 32, 256]
    - [55, 19.0]
  - - [32, 128, 1, 256, 32, 32, 32, 256]
    - [55, 37.0]
  - - [32, 256, 1, 256, 32, 32, 32, 256]
    - [55, 76.0]
  - - [32, 448, 1, 256, 32, 32, 32, 256]
    - [55, 133.0]
  - - [32, 704, 1, 256, 32, 32, 32, 256]
    - [55, 210.0]
  - - [32, 1024, 1, 256, 32, 32, 32, 256]
    - [55, 305.0]
  - - [32, 1408, 1, 256, 32, 32, 32, 256]
    - [55, 417.0]
  - - [32, 1856, 1, 256, 32, 32, 32, 256]
    - [55, 554.0]
  - - [32, 2368, 1, 256, 32, 32, 32, 256]
    - [55, 689.0]
  - - [32, 2944, 1, 256, 32, 32, 32, 256]
    - [55, 869.0]
  - - [32, 3584, 1, 256, 32, 32, 32, 256]
    - [55, 995.0]
  - - [32, 4288, 1, 256, 32, 32, 32, 256]
    - [53, 1129.0]
  - - [32, 5056, 1, 256, 32, 32, 32, 256]
    - [53, 1321.0]
  - - [32, 5888, 1, 256, 32, 32, 32, 256]
    - [53, 1507.0]
  - - [32, 6784, 1, 256, 32, 32, 32, 256]
    - [57, 1694.0]
  - - [32, 64, 1, 1280, 32, 32, 32, 1280]
    - [65, 83.0]
  - - [32, 128, 1, 1280, 32, 32, 32, 1280]
    - [65, 164.0]
  - - [32, 256, 1, 1280, 32, 32, 32, 1280]
    - [65, 330.0]
  - - [32, 448, 1, 1280, 32, 32, 32, 1280]
    - [65, 572.0]
  - - [32, 704, 1, 1280, 32, 32, 32, 1280]
    - [65, 1012.0]
  - - [32, 1024, 1, 1280, 32, 32, 32, 1280]
    - [64, 1150.0]
  - - [32, 1408, 1, 1280, 32, 32, 32, 1280]
    - [64, 1567.0]
  - - [32, 1856, 1, 1280, 32, 32, 32, 1280]
    - [64, 1538.0]
  - - [32, 2368, 1, 1280, 32, 32, 32, 1280]
    - [67, 1921.0]
  - - [32, 2944, 1, 1280, 32, 32, 32, 1280]
    - [66, 2018.0]
  - - [32, 3584, 1, 1280, 32, 32, 32, 1280]
    - [64, 2151.0]
  - - [32, 4288, 1, 1280, 32, 32, 32, 1280]
    - [64, 2254.0]
  - - [32, 5056, 1, 1280, 32, 32, 32, 1280]
    - [64, 2347.0]
  - - [32, 5888, 1, 1280, 32, 32, 32, 1280]
    - [64, 2535.0]
  - - [32, 6784, 1, 1280, 32, 32, 32, 1280]
    - [63, 2739.0]
  - - [32, 64, 1, 3328, 32, 32, 32, 3328]
    - [70, 140.0]
  - - [32, 128, 1, 3328, 32, 32, 32, 3328]
    - [70, 280.0]
  - - [32, 256, 1, 3328, 32, 32, 32, 3328]
    - [70, 556.0]
  - - [32, 448, 1, 3328, 32, 32, 32, 3328]
    - [70, 965.0]
  - - [32, 704, 1, 3328, 32, 32, 32, 3328]
    - [67, 1313.0]
  - - [32, 1024, 1, 3328, 32, 32, 32, 3328]
    - [69, 1815.0]
  - - [32, 1408, 1, 3328, 32, 32, 32, 3328]
    - [69, 1909.0]
  - - [32, 1856, 1, 3328, 32, 32, 32, 3328]
    - [69, 2094.0]
  - - [32, 2368, 1, 3328, 32, 32, 32, 3328]
    - [67, 2394.0]
  - - [32, 2944, 1, 3328, 32, 32, 32, 3328]
    - [64, 2465.0]
  - - [32, 3584, 1, 3328, 32, 32, 32, 3328]
    - [69, 2630.0]
  - - [32, 4288, 1, 3328, 32, 32, 32, 3328]
    - [71, 2759.0]
  - - [32, 5056, 1, 3328, 32, 32, 32, 3328]
    - [69, 2892.0]
  - - [32, 5888, 1, 3328, 32, 32, 32, 3328]
    - [69, 2886.0]
  - - [32, 6784, 1, 3328, 32, 32, 32, 3328]
    - [69, 3075.0]
  - - [64, 32, 1, 256, 64, 64, 64, 256]
    - [55, 19.0]
  - - [128, 32, 1, 256, 128, 128, 128, 256]
    - [55, 38.0]
  - - [256, 32, 1, 256, 256, 256, 256, 256]
    - [55, 75.0]
  - - [448, 32, 1, 256, 448, 448, 448, 256]
    - [55, 133.0]
  - - [704, 32, 1, 256, 704, 704, 704, 256]
    - [55, 211.0]
  - - [1024, 32, 1, 256, 1024, 1024, 1024, 256]
    - [55, 306.0]
  - - [1408, 32, 1, 256, 1408, 1408, 1408, 256]
    - [55, 420.0]
  - - [1856, 32, 1, 256, 1856, 1856, 1856, 256]
    - [55, 556.0]
  - - [2368, 32, 1, 256, 2368, 2368, 2368, 256]
    - [55, 713.0]
  - - [2944, 32, 1, 256, 2944, 2944, 2944, 256]
    - [58, 840.0]
  - - [3584, 32, 1, 256, 3584, 3584, 3584, 256]
    - [60, 1070.0]
  - - [4288, 32, 1, 256, 4288, 4288, 4288, 256]
    - [53, 1187.0]
  - - [5056, 32, 1, 256, 5056, 5056, 5056, 256]
    - [53, 1411.0]
  - - [5888, 32, 1, 256, 5888, 5888, 5888, 256]
    - [53, 1621.0]
  - - [6784, 32, 1, 256, 6784, 6784, 6784, 256]
    - [57, 1857.0]
  - - [64, 32, 1, 1280, 64, 64, 64, 1280]
    - [65, 83.0]
  - - [128, 32, 1, 1280, 128, 128, 128, 1280]
    - [65, 165.0]
  - - [256, 32, 1, 1280, 256, 256, 256, 1280]
    - [65, 331.0]
  - - [448, 32, 1, 1280, 448, 448, 448, 1280]
    - [65, 575.0]
  - - [704, 32, 1, 1280, 704, 704, 704, 1280]
    - [68, 1027.0]
  - - [1024, 32, 1, 1280, 1024, 1024, 1024, 1280]
    - [67, 1160.0]
  - - [1408, 32, 1, 1280, 1408, 1408, 1408, 1280]
    - [64, 1606.0]
  - - [1856, 32, 1, 1280, 1856, 1856, 1856, 1280]
    - [64, 1661.0]
  - - [2368, 32, 1, 1280, 2368, 2368, 2368, 1280]
    - [64, 1984.0]
  - - [2944, 32, 1, 1280, 2944, 2944, 2944, 1280]
    - [64, 2091.0]
  - - [3584, 32, 1, 1280, 3584, 3584, 3584, 1280]
    - [66, 2146.0]
  - - [4288, 32, 1, 1280, 4288, 4288, 4288, 1280]
    - [66, 2256.0]
  - - [5056, 32, 1, 1280, 5056, 5056, 5056, 1280]
    - [66, 2419.0]
  - - [5888, 32, 1, 1280, 5888, 5888, 5888, 1280]
    - [64, 2512.0]
  - - [6784, 32, 1, 1280, 6784, 6784, 6784, 1280]
    - [62, 2799.0]
  - - [64, 32, 1, 3328, 64, 64, 64, 3328]
    - [70, 138.0]
  - - [128, 32, 1, 3328, 128, 128, 128, 3328]
    - [72, 281.0]
  - - [256, 32, 1, 3328, 256, 256, 256, 3328]
    - [70, 550.0]
  - - [448, 32, 1, 3328, 448, 448, 448, 3328]
    - [70, 970.0]
  - - [704, 32, 1, 3328, 704, 704, 704, 3328]
    - [69, 1305.0]
  - - [1024, 32, 1, 3328, 1024, 1024, 1024, 3328]
    - [69, 1766.0]
  - - [1408, 32, 1, 3328, 1408, 1408, 1408, 3328]
    - [71, 1981.0]
  - - [1856, 32, 1, 3328, 1856, 1856, 1856, 3328]
    - [69, 2092.0]
  - - [2368, 32, 1, 3328, 2368, 2368, 2368, 3328]
    - [66, 2451.0]
  - - [2944, 32, 1, 3328, 2944, 2944, 2944, 3328]
    - [64, 2476.0]
  - - [3584, 32, 1, 3328, 3584, 3584, 3584, 3328]
    - [71, 2639.0]
  - - [4288, 32, 1, 3328, 4288, 4288, 4288, 3328]
    - [69, 2822.0]
  - - [5056, 32, 1, 3328, 5056, 5056, 5056, 3328]
    - [71, 2999.0]
  - - [5888, 32, 1, 3328, 5888, 5888, 5888, 3328]
    - [69, 2967.0]
  - - [6784, 32, 1, 3328, 6784, 6784, 6784, 3328]
    - [71, 3143.0]
  - - [64, 64, 1, 32, 64, 64, 64, 32]
    - [50, 12.0]
  - - [128, 64, 1, 32, 128, 128, 128, 32]
    - [50, 24.0]
  - - [256, 64, 1, 32, 256, 256, 256, 32]
    - [61, 74.0]
  - - [448, 64, 1, 32, 448, 448, 448, 32]
    - [48, 84.0]
  - - [704, 64, 1, 32, 704, 704, 704, 32]
    - [48, 133.0]
  - - [1024, 64, 1, 32, 1024, 1024, 1024, 32]
    - [50, 199.0]
  - - [1408, 64, 1, 32, 1408, 1408, 1408, 32]
    - [48, 267.0]
  - - [1856, 64, 1, 32, 1856, 1856, 1856, 32]
    - [48, 355.0]
  - - [2368, 64, 1, 32, 2368, 2368, 2368, 32]
    - [48, 433.0]
  - - [2944, 64, 1, 32, 2944, 2944, 2944, 32]
    - [50, 527.0]
  - - [3584, 64, 1, 32, 3584, 3584, 3584, 32]
    - [50, 987.0]
  - - [4288, 64, 1, 32, 4288, 4288, 4288, 32]
    - [57, 989.0]
  - - [5056, 64, 1, 32, 5056, 5056, 5056, 32]
    - [53, 1052.0]
  - - [5888, 64, 1, 32, 5888, 5888, 5888, 32]
    - [53, 1346.0]
  - - [6784, 64, 1, 32, 6784, 6784, 6784, 32]
    - [57, 1565.0]
  - - [64, 128, 1, 32, 64, 64, 64, 32]
    - [48, 24.0]
  - - [128, 128, 1, 32, 128, 128, 128, 32]
    - [52, 73.0]
  - - [256, 128, 1, 32, 256, 256, 256, 32]
    - [48, 102.0]
  - - [448, 128, 1, 32, 448, 448, 448, 32]
    - [48, 174.0]
  - - [704, 128, 1, 32, 704, 704, 704, 32]
    - [51, 273.0]
  - - [1024, 128, 1, 32, 1024, 1024, 1024, 32]
    - [50, 386.0]
  - - [1408, 128, 1, 32, 1408, 1408, 1408, 32]
    - [51, 511.0]
  - - [1856, 128, 1, 32, 1856, 1856, 1856, 32]
    - [50, 932.0]
  - - [2368, 128, 1, 32, 2368, 2368, 2368, 32]
    - [53, 986.0]
  - - [2944, 128, 1, 32, 2944, 2944, 2944, 32]
    - [57, 1236.0]
  - - [3584, 128, 1, 32, 3584, 3584, 3584, 32]
    - [55, 1504.0]
  - - [4288, 128, 1, 32, 4288, 4288, 4288, 32]
    - [53, 1651.0]
  - - [5056, 128, 1, 32, 5056, 5056, 5056, 32]
    - [50, 1785.0]
  - - [5888, 128, 1, 32, 5888, 5888, 5888, 32]
    - [55, 1996.0]
  - - [6784, 128, 1, 32, 6784, 6784, 6784, 32]
    - [53, 2255.0]
  - - [64, 256, 1, 32, 64, 64, 64, 32]
    - [51, 49.0]
  - - [128, 256, 1, 32, 128, 128, 128, 32]
    - [48, 99.0]
  - - [256, 256, 1, 32, 256, 256, 256, 32]
    - [51, 199.0]
  - - [448, 256, 1, 32, 448, 448, 448, 32]
    - [48, 348.0]
  - - [704, 256, 1, 32, 704, 704, 704, 32]
    - [51, 559.0]
  - - [1024, 256, 1, 32, 1024, 1024, 1024, 32]
    - [50, 1165.0]
  - - [1408, 256, 1, 32, 1408, 1408, 1408, 32]
    - [53, 1287.0]
  - - [1856, 256, 1, 32, 1856, 1856, 1856, 32]
    - [48, 1508.0]
  - - [2368, 256, 1, 32, 2368, 2368, 2368, 32]
    - [53, 1823.0]
  - - [2944, 256, 1, 32, 2944, 2944, 2944, 32]
    - [53, 2233.0]
  - - [3584, 256, 1, 32, 3584, 3584, 3584, 32]
    - [58, 2097.0]
  - - [4288, 256, 1, 32, 4288, 4288, 4288, 32]
    - [57, 2467.0]
  - - [5056, 256, 1, 32, 5056, 5056, 5056, 32]
    - [48, 2628.0]
  - - [5888, 256, 1, 32, 5888, 5888, 5888, 32]
    - [55, 2656.0]
  - - [6784, 256, 1, 32, 6784, 6784, 6784, 32]
    - [53, 2812.0]
  - - [64, 448, 1, 32, 64, 64, 64, 32]
    - [48, 89.0]
  - - [128, 448, 1, 32, 128, 128, 128, 32]
    - [48, 176.0]
  - - [256, 448, 1, 32, 256, 256, 256, 32]
    - [48, 364.0]
  - - [448, 448, 1, 32, 448, 448, 448, 32]
    - [48, 627.0]
  - - [704, 448, 1, 32, 704, 704, 704, 32]
    - [53, 1126.0]
  - - [1024, 448, 1, 32, 1024, 1024, 1024, 32]
    - [53, 1215.0]
  - - [1408, 448, 1, 32, 1408, 1408, 1408, 32]
    - [55, 1802.0]
  - - [1856, 448, 1, 32, 1856, 1856, 1856, 32]
    - [53, 2132.0]
  - - [2368, 448, 1, 32, 2368, 2368, 2368, 32]
    - [53, 2384.0]
  - - [2944, 448, 1, 32, 2944, 2944, 2944, 32]
    - [48, 2431.0]
  - - [3584, 448, 1, 32, 3584, 3584, 3584, 32]
    - [53, 2621.0]
  - - [4288, 448, 1, 32, 4288, 4288, 4288, 32]
    - [48, 2784.0]
  - - [5056, 448, 1, 32, 5056, 5056, 5056, 32]
    - [57, 3092.0]
  - - [5888, 448, 1, 32, 5888, 5888, 5888, 32]
    - [53, 2972.0]
  - - [6784, 448, 1, 32, 6784, 6784, 6784, 32]
    - [57, 3141.0]
  - - [64, 704, 1, 32, 64, 64, 64, 32]
    - [51, 139.0]
  - - [128, 704, 1, 32, 128, 128, 128, 32]
    - [48, 284.0]
  - - [256, 704, 1, 32, 256, 256, 256, 32]
    - [48, 555.0]
  - - [448, 704, 1, 32, 448, 448, 448, 32]
    - [53, 1137.0]
  - - [704, 704, 1, 32, 704, 704, 704, 32]
    - [57, 1770.0]
  - - [1024, 704, 1, 32, 1024, 1024, 1024, 32]
    - [53, 1910.0]
  - - [1408, 704, 1, 32, 1408, 1408, 1408, 32]
    - [55, 2418.0]
  - - [1856, 704, 1, 32, 1856, 1856, 1856, 32]
    - [53, 2856.0]
  - - [2368, 704, 1, 32, 2368, 2368, 2368, 32]
    - [53, 2826.0]
  - - [2944, 704, 1, 32, 2944, 2944, 2944, 32]
    - [53, 3015.0]
  - - [3584, 704, 1, 32, 3584, 3584, 3584, 32]
    - [60, 2934.0]
  - - [4288, 704, 1, 32, 4288, 4288, 4288, 32]
    - [57, 3326.0]
  - - [5056, 704, 1, 32, 5056, 5056, 5056, 32]
    - [53, 3431.0]
  - - [5888, 704, 1, 32, 5888, 5888, 5888, 32]
    - [53, 3419.0]
  - - [6784, 704, 1, 32, 6784, 6784, 6784, 32]
    - [57, 3499.0]
  - - [64, 1024, 1, 32, 64, 64, 64, 32]
    - [48, 205.0]
  - - [128, 1024, 1, 32, 128, 128, 128, 32]
    - [48, 403.0]
  - - [256, 1024, 1, 32, 256, 256, 256, 32]
    - [50, 1116.0]
  - - [448, 1024, 1, 32, 448, 448, 448, 32]
    - [57, 1653.0]
  - - [704, 1024, 1, 32, 704, 704, 704, 32]
    - [57, 2045.0]
  - - [1024, 1024, 1, 32, 1024, 1024, 1024, 32]
    - [60, 2356.0]
  - - [1408, 1024, 1, 32, 1408, 1408, 1408, 32]
    - [54, 2621.0]
  - - [1856, 1024, 1, 32, 1856, 1856, 1856, 32]
    - [57, 2947.0]
  - - [2368, 1024, 1, 32, 2368, 2368, 2368, 32]
    - [57, 3119.0]
  - - [2944, 1024, 1, 32, 2944, 2944, 2944, 32]
    - [57, 3250.0]
  - - [3584, 1024, 1, 32, 3584, 3584, 3584, 32]
    - [53, 3306.0]
  - - [4288, 1024, 1, 32, 4288, 4288, 4288, 32]
    - [53, 3577.0]
  - - [5056, 1024, 1, 32, 5056, 5056, 5056, 32]
    - [53, 3646.0]
  - - [5888, 1024, 1, 32, 5888, 5888, 5888, 32]
    - [57, 3710.0]
  - - [6784, 1024, 1, 32, 6784, 6784, 6784, 32]
    - [53, 3705.0]
  - - [64, 1408, 1, 32, 64, 64, 64, 32]
    - [48, 284.0]
  - - [128, 1408, 1, 32, 128, 128, 128, 32]
    - [48, 559.0]
  - - [256, 1408, 1, 32, 256, 256, 256, 32]
    - [50, 1144.0]
  - - [448, 1408, 1, 32, 448, 448, 448, 32]
    - [53, 1911.0]
  - - [704, 1408, 1, 32, 704, 704, 704, 32]
    - [55, 2418.0]
  - - [1024, 1408, 1, 32, 1024, 1024, 1024, 32]
    - [53, 2373.0]
  - - [1408, 1408, 1, 32, 1408, 1408, 1408, 32]
    - [56, 2873.0]
  - - [1856, 1408, 1, 32, 1856, 1856, 1856, 32]
    - [53, 3308.0]
  - - [2368, 1408, 1, 32, 2368, 2368, 2368, 32]
    - [53, 3420.0]
  - - [2944, 1408, 1, 32, 2944, 2944, 2944, 32]
    - [57, 3370.0]
  - - [3584, 1408, 1, 32, 3584, 3584, 3584, 32]
    - [57, 3314.0]
  - - [4288, 1408, 1, 32, 4288, 4288, 4288, 32]
    - [57, 3648.0]
  - - [5056, 1408, 1, 32, 5056, 5056, 5056, 32]
    - [53, 3698.0]
  - - [5888, 1408, 1, 32, 5888, 5888, 5888, 32]
    - [53, 3764.0]
  - - [6784, 1408, 1, 32, 6784, 6784, 6784, 32]
    - [57, 3794.0]
  - - [64, 1856, 1, 32, 64, 64, 64, 32]
    - [48, 368.0]
  - - [128, 1856, 1, 32, 128, 128, 128, 32]
    - [50, 1092.0]
  - - [256, 1856, 1, 32, 256, 256, 256, 32]
    - [55, 1545.0]
  - - [448, 1856, 1, 32, 448, 448, 448, 32]
    - [53, 2174.0]
  - - [704, 1856, 1, 32, 704, 704, 704, 32]
    - [48, 2525.0]
  - - [1024, 1856, 1, 32, 1024, 1024, 1024, 32]
    - [57, 2437.0]
  - - [1408, 1856, 1, 32, 1408, 1408, 1408, 32]
    - [57, 3297.0]
  - - [1856, 1856, 1, 32, 1856, 1856, 1856, 32]
    - [53, 3377.0]
  - - [2368, 1856, 1, 32, 2368, 2368, 2368, 32]
    - [53, 3566.0]
  - - [2944, 1856, 1, 32, 2944, 2944, 2944, 32]
    - [53, 3649.0]
  - - [3584, 1856, 1, 32, 3584, 3584, 3584, 32]
    - [57, 3492.0]
  - - [4288, 1856, 1, 32, 4288, 4288, 4288, 32]
    - [57, 3776.0]
  - - [5056, 1856, 1, 32, 5056, 5056, 5056, 32]
    - [57, 3846.0]
  - - [5888, 1856, 1, 32, 5888, 5888, 5888, 32]
    - [57, 3821.0]
  - - [6784, 1856, 1, 32, 6784, 6784, 6784, 32]
    - [53, 3862.0]
  - - [64, 2368, 1, 32, 64, 64, 64, 32]
    - [48, 459.0]
  - - [128, 2368, 1, 32, 128, 128, 128, 32]
    - [48, 986.0]
  - - [256, 2368, 1, 32, 256, 256, 256, 32]
    - [59, 1564.0]
  - - [448, 2368, 1, 32, 448, 448, 448, 32]
    - [57, 2199.0]
  - - [704, 2368, 1, 32, 704, 704, 704, 32]
    - [57, 2657.0]
  - - [1024, 2368, 1, 32, 1024, 1024, 1024, 32]
    - [53, 2474.0]
  - - [1408, 2368, 1, 32, 1408, 1408, 1408, 32]
    - [53, 3214.0]
  - - [1856, 2368, 1, 32, 1856, 1856, 1856, 32]
    - [57, 3481.0]
  - - [2368, 2368, 1, 32, 2368, 2368, 2368, 32]
    - [57, 3560.0]
  - - [2944, 2368, 1, 32, 2944, 2944, 2944, 32]
    - [57, 3622.0]
  - - [3584, 2368, 1, 32, 3584, 3584, 3584, 32]
    - [53, 3478.0]
  - - [4288, 2368, 1, 32, 4288, 4288, 4288, 32]
    - [53, 3814.0]
  - - [5056, 2368, 1, 32, 5056, 5056, 5056, 32]
    - [53, 3844.0]
  - - [5888, 2368, 1, 32, 5888, 5888, 5888, 32]
    - [53, 3828.0]
  - - [6784, 2368, 1, 32, 6784, 6784, 6784, 32]
    - [57, 3887.0]
  - - [64, 2944, 1, 32, 64, 64, 64, 32]
    - [48, 531.0]
  - - [128, 2944, 1, 32, 128, 128, 128, 32]
    - [60, 1187.0]
  - - [256, 2944, 1, 32, 256, 256, 256, 32]
    - [60, 1920.0]
  - - [448, 2944, 1, 32, 448, 448, 448, 32]
    - [57, 2454.0]
  - - [704, 2944, 1, 32, 704, 704, 704, 32]
    - [57, 2940.0]
  - - [1024, 2944, 1, 32, 1024, 1024, 1024, 32]
    - [53, 2533.0]
  - - [1408, 2944, 1, 32, 1408, 1408, 1408, 32]
    - [53, 3377.0]
  - - [1856, 2944, 1, 32, 1856, 1856, 1856, 32]
    - [57, 3583.0]
  - - [2368, 2944, 1, 32, 2368, 2368, 2368, 32]
    - [57, 3679.0]
  - - [2944, 2944, 1, 32, 2944, 2944, 2944, 32]
    - [53, 3688.0]
  - - [3584, 2944, 1, 32, 3584, 3584, 3584, 32]
    - [57, 3601.0]
  - - [4288, 2944, 1, 32, 4288, 4288, 4288, 32]
    - [53, 3837.0]
  - - [5056, 2944, 1, 32, 5056, 5056, 5056, 32]
    - [57, 3902.0]
  - - [5888, 2944, 1, 32, 5888, 5888, 5888, 32]
    - [57, 3876.0]
  - - [6784, 2944, 1, 32, 6784, 6784, 6784, 32]
    - [53, 3928.0]
  - - [64, 3584, 1, 32, 64, 64, 64, 32]
    - [50, 908.0]
  - - [128, 3584, 1, 32, 128, 128, 128, 32]
    - [59, 1480.0]
  - - [256, 3584, 1, 32, 256, 256, 256, 32]
    - [57, 2039.0]
  - - [448, 3584, 1, 32, 448, 448, 448, 32]
    - [53, 2632.0]
  - - [704, 3584, 1, 32, 704, 704, 704, 32]
    - [57, 3068.0]
  - - [1024, 3584, 1, 32, 1024, 1024, 1024, 32]
    - [53, 2664.0]
  - - [1408, 3584, 1, 32, 1408, 1408, 1408, 32]
    - [53, 3468.0]
  - - [1856, 3584, 1, 32, 1856, 1856, 1856, 32]
    - [53, 3635.0]
  - - [2368, 3584, 1, 32, 2368, 2368, 2368, 32]
    - [53, 3714.0]
  - - [2944, 3584, 1, 32, 2944, 2944, 2944, 32]
    - [57, 3782.0]
  - - [3584, 3584, 1, 32, 3584, 3584, 3584, 32]
    - [53, 3616.0]
  - - [4288, 3584, 1, 32, 4288, 4288, 4288, 32]
    - [57, 3903.0]
  - - [5056, 3584, 1, 32, 5056, 5056, 5056, 32]
    - [53, 3952.0]
  - - [5888, 3584, 1, 32, 5888, 5888, 5888, 32]
    - [53, 3922.0]
  - - [6784, 3584, 1, 32, 6784, 6784, 6784, 32]
    - [53, 3962.0]
  - - [64, 4288, 1, 32, 64, 64, 64, 32]
    - [53, 915.0]
  - - [128, 4288, 1, 32, 128, 128, 128, 32]
    - [53, 1504.0]
  - - [256, 4288, 1, 32, 256, 256, 256, 32]
    - [60, 2091.0]
  - - [448, 4288, 1, 32, 448, 448, 448, 32]
    - [57, 2804.0]
  - - [704, 4288, 1, 32, 704, 704, 704, 32]
    - [57, 3203.0]
  - - [1024, 4288, 1, 32, 1024, 1024, 1024, 32]
    - [53, 2837.0]
  - - [1408, 4288, 1, 32, 1408, 1408, 1408, 32]
    - [57, 3546.0]
  - - [1856, 4288, 1, 32, 1856, 1856, 1856, 32]
    - [53, 3697.0]
  - - [2368, 4288, 1, 32, 2368, 2368, 2368, 32]
    - [57, 3824.0]
  - - [2944, 4288, 1, 32, 2944, 2944, 2944, 32]
    - [57, 3817.0]
  - - [3584, 4288, 1, 32, 3584, 3584, 3584, 32]
    - [53, 3677.0]
  - - [4288, 4288, 1, 32, 4288, 4288, 4288, 32]
    - [57, 3914.0]
  - - [5056, 4288, 1, 32, 5056, 5056, 5056, 32]
    - [57, 3967.0]
  - - [5888, 4288, 1, 32, 5888, 5888, 5888, 32]
    - [57, 3937.0]
  - - [6784, 4288, 1, 32, 6784, 6784, 6784, 32]
    - [57, 3992.0]
  - - [64, 5056, 1, 32, 64, 64, 64, 32]
    - [59, 1044.0]
  - - [128, 5056, 1, 32, 128, 128, 128, 32]
    - [59, 1726.0]
  - - [256, 5056, 1, 32, 256, 256, 256, 32]
    - [53, 2419.0]
  - - [448, 5056, 1, 32, 448, 448, 448, 32]
    - [57, 2980.0]
  - - [704, 5056, 1, 32, 704, 704, 704, 32]
    - [53, 3303.0]
  - - [1024, 5056, 1, 32, 1024, 1024, 1024, 32]
    - [57, 2905.0]
  - - [1408, 5056, 1, 32, 1408, 1408, 1408, 32]
    - [57, 3689.0]
  - - [1856, 5056, 1, 32, 1856, 1856, 1856, 32]
    - [57, 3850.0]
  - - [2368, 5056, 1, 32, 2368, 2368, 2368, 32]
    - [53, 3897.0]
  - - [2944, 5056, 1, 32, 2944, 2944, 2944, 32]
    - [53, 3912.0]
  - - [3584, 5056, 1, 32, 3584, 3584, 3584, 32]
    - [53, 3702.0]
  - - [4288, 5056, 1, 32, 4288, 4288, 4288, 32]
    - [57, 3987.0]
  - - [5056, 5056, 1, 32, 5056, 5056, 5056, 32]
    - [53, 3982.0]
  - - [5888, 5056, 1, 32, 5888, 5888, 5888, 32]
    - [57, 3965.0]
  - - [6784, 5056, 1, 32, 6784, 6784, 6784, 32]
    - [57, 4007.0]
  - - [64, 5888, 1, 32, 64, 64, 64, 32]
    - [51, 1256.0]
  - - [128, 5888, 1, 32, 128, 128, 128, 32]
    - [55, 2153.0]
  - - [256, 5888, 1, 32, 256, 256, 256, 32]
    - [54, 2704.0]
  - - [448, 5888, 1, 32, 448, 448, 448, 32]
    - [57, 3178.0]
  - - [704, 5888, 1, 32, 704, 704, 704, 32]
    - [57, 3528.0]
  - - [1024, 5888, 1, 32, 1024, 1024, 1024, 32]
    - [57, 2977.0]
  - - [1408, 5888, 1, 32, 1408, 1408, 1408, 32]
    - [57, 3701.0]
  - - [1856, 5888, 1, 32, 1856, 1856, 1856, 32]
    - [57, 3828.0]
  - - [2368, 5888, 1, 32, 2368, 2368, 2368, 32]
    - [53, 3889.0]
  - - [2944, 5888, 1, 32, 2944, 2944, 2944, 32]
    - [57, 3913.0]
  - - [3584, 5888, 1, 32, 3584, 3584, 3584, 32]
    - [53, 3750.0]
  - - [4288, 5888, 1, 32, 4288, 4288, 4288, 32]
    - [53, 3978.0]
  - - [5056, 5888, 1, 32, 5056, 5056, 5056, 32]
    - [53, 4022.0]
  - - [5888, 5888, 1, 32, 5888, 5888, 5888, 32]
    - [57, 4002.0]
  - - [6784, 5888, 1, 32, 6784, 6784, 6784, 32]
    - [53, 4018.0]
  - - [64, 6784, 1, 32, 64, 64, 64, 32]
    - [53, 1412.0]
  - - [128, 6784, 1, 32, 128, 128, 128, 32]
    - [60, 1940.0]
  - - [256, 6784, 1, 32, 256, 256, 256, 32]
    - [55, 2602.0]
  - - [448, 6784, 1, 32, 448, 448, 448, 32]
    - [53, 3225.0]
  - - [704, 6784, 1, 32, 704, 704, 704, 32]
    - [53, 3430.0]
  - - [1024, 6784, 1, 32, 1024, 1024, 1024, 32]
    - [53, 2985.0]
  - - [1408, 6784, 1, 32, 1408, 1408, 1408, 32]
    - [57, 3757.0]
  - - [1856, 6784, 1, 32, 1856, 1856, 1856, 32]
    - [57, 3836.0]
  - - [2368, 6784, 1, 32, 2368, 2368, 2368, 32]
    - [53, 3897.0]
  - - [2944, 6784, 1, 32, 2944, 2944, 2944, 32]
    - [53, 3928.0]
  - - [3584, 6784, 1, 32, 3584, 3584, 3584, 32]
    - [53, 3773.0]
  - - [4288, 6784, 1, 32, 4288, 4288, 4288, 32]
    - [57, 4032.0]
  - - [5056, 6784, 1, 32, 5056, 5056, 5056, 32]
    - [53, 4036.0]
  - - [5888, 6784, 1, 32, 5888, 5888, 5888, 32]
    - [57, 3988.0]
  - - [6784, 6784, 1, 32, 6784, 6784, 6784, 32]
    - [57, 4045.0]
  - - [32, 32, 1, 256, 32, 32, 32, 256]
    - [55, 10.0]
  - - [32, 32, 1, 1280, 32, 32, 32, 1280]
    - [65, 42.0]
  - - [32, 32, 1, 3328, 32, 32, 32, 3328]
    - [70, 71.0]
  - - [32, 64, 1, 32, 32, 32, 32, 32]
    - [48, 7.0]
  - - [32, 128, 1, 32, 32, 32, 32, 32]
    - [48, 14.0]
  - - [32, 256, 1, 32, 32, 32, 32, 32]
    - [51, 30.0]
  - - [32, 448, 1, 32, 32, 32, 32, 32]
    - [49, 53.0]
  - - [32, 704, 1, 32, 32, 32, 32, 32]
    - [48, 83.0]
  - - [32, 1024, 1, 32, 32, 32, 32, 32]
    - [48, 119.0]
  - - [32, 1408, 1, 32, 32, 32, 32, 32]
    - [48, 165.0]
  - - [32, 1856, 1, 32, 32, 32, 32, 32]
    - [48, 205.0]
  - - [32, 2368, 1, 32, 32, 32, 32, 32]
    - [48, 257.0]
  - - [32, 2944, 1, 32, 32, 32, 32, 32]
    - [51, 336.0]
  - - [32, 3584, 1, 32, 32, 32, 32, 32]
    - [55, 604.0]
  - - [32, 4288, 1, 32, 32, 32, 32, 32]
    - [57, 653.0]
  - - [32, 5056, 1, 32, 32, 32, 32, 32]
    - [53, 780.0]
  - - [32, 5888, 1, 32, 32, 32, 32, 32]
    - [57, 897.0]
  - - [32, 6784, 1, 32, 32, 32, 32, 32]
    - [57, 860.0]
  - - [64, 32, 1, 32, 64, 64, 64, 32]
    - [50, 7.0]
  - - [128, 32, 1, 32, 128, 128, 128, 32]
    - [48, 14.0]
  - - [256, 32, 1, 32, 256, 256, 256, 32]
    - [48, 28.0]
  - - [448, 32, 1, 32, 448, 448, 448, 32]
    - [48, 49.0]
  - - [704, 32, 1, 32, 704, 704, 704, 32]
    - [50, 78.0]
  - - [1024, 32, 1, 32, 1024, 1024, 1024, 32]
    - [57, 111.0]
  - - [1408, 32, 1, 32, 1408, 1408, 1408, 32]
    - [57, 157.0]
  - - [1856, 32, 1, 32, 1856, 1856, 1856, 32]
    - [50, 207.0]
  - - [2368, 32, 1, 32, 2368, 2368, 2368, 32]
    - [48, 264.0]
  - - [2944, 32, 1, 32, 2944, 2944, 2944, 32]
    - [50, 306.0]
  - - [3584, 32, 1, 32, 3584, 3584, 3584, 32]
    - [57, 493.0]
  - - [4288, 32, 1, 32, 4288, 4288, 4288, 32]
    - [48, 590.0]
  - - [5056, 32, 1, 32, 5056, 5056, 5056, 32]
    - [53, 667.0]
  - - [5888, 32, 1, 32, 5888, 5888, 5888, 32]
    - [53, 777.0]
  - - [6784, 32, 1, 32, 6784, 6784, 6784, 32]
    - [53, 860.0]
  - - [1, 1, 1, 1, 1, 1, 1, 1]
    - [77, 0.00020491803674143965]
  - - [1, 64, 1, 256, 1, 1, 1, 256]
    - [77, 1.0]
  - - [1, 128, 1, 256, 1, 1, 1, 256]
    - [74, 1.0]
  - - [1, 256, 1, 256, 1, 1, 1, 256]
    - [75, 2.0]
  - - [1, 448, 1, 256, 1, 1, 1, 256]
    - [77, 4.0]
  - - [1, 704, 1, 256, 1, 1, 1, 256]
    - [77, 6.0]
  - - [1, 1024, 1, 256, 1, 1, 1, 256]
    - [77, 9.0]
  - - [1, 1408, 1, 256, 1, 1, 1, 256]
    - [77, 13.0]
  - - [1, 1856, 1, 256, 1, 1, 1, 256]
    - [77, 17.0]
  - - [1, 2368, 1, 256, 1, 1, 1, 256]
    - [77, 22.0]
  - - [1, 2944, 1, 256, 1, 1, 1, 256]
    - [77, 27.0]
  - - [1, 3584, 1, 256, 1, 1, 1, 256]
    - [77, 36.0]
  - - [1, 4288, 1, 256, 1, 1, 1, 256]
    - [84, 33.0]
  - - [1, 5056, 1, 256, 1, 1, 1, 256]
    - [84, 38.0]
  - - [1, 5888, 1, 256, 1, 1, 1, 256]
    - [84, 45.0]
  - - [1, 6784, 1, 256, 1, 1, 1, 256]
    - [84, 51.0]
  - - [1, 64, 1, 1280, 1, 1, 1, 1280]
    - [90, 2.0]
  - - [1, 128, 1, 1280, 1, 1, 1, 1280]
    - [93, 5.0]
  - - [1, 256, 1, 1280, 1, 1, 1, 1280]
    - [93, 10.0]
  - - [1, 448, 1, 1280, 1, 1, 1, 1280]
    - [93, 17.0]
  - - [1, 704, 1, 1280, 1, 1, 1, 1280]
    - [93, 27.0]
  - - [1, 1024, 1, 1280, 1, 1, 1, 1280]
    - [94, 34.0]
  - - [1, 1408, 1, 1280, 1, 1, 1, 1280]
    - [94, 46.0]
  - - [1, 1856, 1, 1280, 1, 1, 1, 1280]
    - [94, 48.0]
  - - [1, 2368, 1, 1280, 1, 1, 1, 1280]
    - [94, 62.0]
  - - [1, 2944, 1, 1280, 1, 1, 1, 1280]
    - [94, 63.0]
  - - [1, 3584, 1, 1280, 1, 1, 1, 1280]
    - [94, 64.0]
  - - [1, 4288, 1, 1280, 1, 1, 1, 1280]
    - [92, 67.0]
  - - [1, 5056, 1, 1280, 1, 1, 1, 1280]
    - [91, 70.0]
  - - [1, 5888, 1, 1280, 1, 1, 1, 1280]
    - [94, 71.0]
  - - [1, 6784, 1, 1280, 1, 1, 1, 1280]
    - [91, 76.0]
  - - [1, 64, 1, 3328, 1, 1, 1, 3328]
    - [95, 4.0]
  - - [1, 128, 1, 3328, 1, 1, 1, 3328]
    - [95, 8.0]
  - - [1, 256, 1, 3328, 1, 1, 1, 3328]
    - [95, 16.0]
  - - [1, 448, 1, 3328, 1, 1, 1, 3328]
    - [95, 28.0]
  - - [1, 704, 1, 3328, 1, 1, 1, 3328]
    - [97, 36.0]
  - - [1, 1024, 1, 3328, 1, 1, 1, 3328]
    - [97, 50.0]
  - - [1, 1408, 1, 3328, 1, 1, 1, 3328]
    - [97, 56.0]
  - - [1, 1856, 1, 3328, 1, 1, 1, 3328]
    - [96, 60.0]
  - - [1, 2368, 1, 3328, 1, 1, 1, 3328]
    - [94, 68.0]
  - - [1, 2944, 1, 3328, 1, 1, 1, 3328]
    - [94, 70.0]
  - - [1, 3584, 1, 3328, 1, 1, 1, 3328]
    - [97, 72.0]
  - - [1, 4288, 1, 3328, 1, 1, 1, 3328]
    - [97, 78.0]
  - - [1, 5056, 1, 3328, 1, 1, 1, 3328]
    - [97, 81.0]
  - - [1, 5888, 1, 3328, 1, 1, 1, 3328]
    - [97, 80.0]
  - - [1, 6784, 1, 3328, 1, 1, 1, 3328]
    - [97, 86.0]
  - - [64, 1, 1, 256, 64, 64, 64, 256]
    - [77, 1.0]
  - - [128, 1, 1, 256, 128, 128, 128, 256]
    - [74, 1.0]
  - - [256, 1, 1, 256, 256, 256, 256, 256]
    - [75, 2.0]
  - - [448, 1, 1, 256, 448, 448, 448, 256]
    - [77, 4.0]
  - - [704, 1, 1, 256, 704, 704, 704, 256]
    - [77, 7.0]
  - - [1024, 1, 1, 256, 1024, 1024, 1024, 256]
    - [77, 10.0]
  - - [1408, 1, 1, 256, 1408, 1408, 1408, 256]
    - [77, 13.0]
  - - [1856, 1, 1, 256, 1856, 1856, 1856, 256]
    - [77, 18.0]
  - - [2368, 1, 1, 256, 2368, 2368, 2368, 256]
    - [77, 22.0]
  - - [2944, 1, 1, 256, 2944, 2944, 2944, 256]
    - [77, 28.0]
  - - [3584, 1, 1, 256, 3584, 3584, 3584, 256]
    - [86, 36.0]
  - - [4288, 1, 1, 256, 4288, 4288, 4288, 256]
    - [84, 33.0]
  - - [5056, 1, 1, 256, 5056, 5056, 5056, 256]
    - [84, 39.0]
  - - [5888, 1, 1, 256, 5888, 5888, 5888, 256]
    - [84, 45.0]
  - - [6784, 1, 1, 256, 6784, 6784, 6784, 256]
    - [84, 52.0]
  - - [64, 1, 1, 1280, 64, 64, 64, 1280]
    - [93, 3.0]
  - - [128, 1, 1, 1280, 128, 128, 128, 1280]
    - [93, 5.0]
  - - [256, 1, 1, 1280, 256, 256, 256, 1280]
    - [93, 10.0]
  - - [448, 1, 1, 1280, 448, 448, 448, 1280]
    - [93, 18.0]
  - - [704, 1, 1, 1280, 704, 704, 704, 1280]
    - [94, 30.0]
  - - [1024, 1, 1, 1280, 1024, 1024, 1024, 1280]
    - [94, 34.0]
  - - [1408, 1, 1, 1280, 1408, 1408, 1408, 1280]
    - [94, 46.0]
  - - [1856, 1, 1, 1280, 1856, 1856, 1856, 1280]
    - [94, 49.0]
  - - [2368, 1, 1, 1280, 2368, 2368, 2368, 1280]
    - [94, 62.0]
  - - [2944, 1, 1, 1280, 2944, 2944, 2944, 1280]
    - [94, 64.0]
  - - [3584, 1, 1, 1280, 3584, 3584, 3584, 1280]
    - [94, 64.0]
  - - [4288, 1, 1, 1280, 4288, 4288, 4288, 1280]
    - [94, 67.0]
  - - [5056, 1, 1, 1280, 5056, 5056, 5056, 1280]
    - [91, 70.0]
  - - [5888, 1, 1, 1280, 5888, 5888, 5888, 1280]
    - [94, 72.0]
  - - [6784, 1, 1, 1280, 6784, 6784, 6784, 1280]
    - [91, 76.0]
  - - [64, 1, 1, 3328, 64, 64, 64, 3328]
    - [95, 4.0]
  - - [128, 1, 1, 3328, 128, 128, 128, 3328]
    - [95, 8.0]
  - - [256, 1, 1, 3328, 256, 256, 256, 3328]
    - [95, 16.0]
  - - [448, 1, 1, 3328, 448, 448, 448, 3328]
    - [95, 28.0]
  - - [704, 1, 1, 3328, 704, 704, 704, 3328]
    - [97, 36.0]
  - - [1024, 1, 1, 3328, 1024, 1024, 1024, 3328]
    - [98, 51.0]
  - - [1408, 1, 1, 3328, 1408, 1408, 1408, 3328]
    - [97, 56.0]
  - - [1856, 1, 1, 3328, 1856, 1856, 1856, 3328]
    - [97, 61.0]
  - - [2368, 1, 1, 3328, 2368, 2368, 2368, 3328]
    - [94, 69.0]
  - - [2944, 1, 1, 3328, 2944, 2944, 2944, 3328]
    - [94, 70.0]
  - - [3584, 1, 1, 3328, 3584, 3584, 3584, 3328]
    - [97, 73.0]
  - - [4288, 1, 1, 3328, 4288, 4288, 4288, 3328]
    - [97, 78.0]
  - - [5056, 1, 1, 3328, 5056, 5056, 5056, 3328]
    - [97, 82.0]
  - - [5888, 1, 1, 3328, 5888, 5888, 5888, 3328]
    - [97, 81.0]
  - - [6784, 1, 1, 3328, 6784, 6784, 6784, 3328]
    - [97, 86.0]
  - - [64, 64, 1, 1, 64, 64, 64, 1]
    - [75, 1.0]
  - - [128, 64, 1, 1, 128, 128, 128, 1]
    - [73, 1.0]
  - - [256, 64, 1, 1, 256, 256, 256, 1]
    - [77, 4.0]
  - - [448, 64, 1, 1, 448, 448, 448, 1]
    - [84, 7.0]
  - - [704, 64, 1, 1, 704, 704, 704, 1]
    - [74, 6.0]
  - - [1024, 64, 1, 1, 1024, 1024, 1024, 1]
    - [81, 9.0]
  - - [1408, 64, 1, 1, 1408, 1408, 1408, 1]
    - [81, 13.0]
  - - [1856, 64, 1, 1, 1856, 1856, 1856, 1]
    - [81, 17.0]
  - - [2368, 64, 1, 1, 2368, 2368, 2368, 1]
    - [75, 20.0]
  - - [2944, 64, 1, 1, 2944, 2944, 2944, 1]
    - [81, 24.0]
  - - [3584, 64, 1, 1, 3584, 3584, 3584, 1]
    - [74, 42.0]
  - - [4288, 64, 1, 1, 4288, 4288, 4288, 1]
    - [84, 50.0]
  - - [5056, 64, 1, 1, 5056, 5056, 5056, 1]
    - [86, 48.0]
  - - [5888, 64, 1, 1, 5888, 5888, 5888, 1]
    - [81, 58.0]
  - - [6784, 64, 1, 1, 6784, 6784, 6784, 1]
    - [81, 69.0]
  - - [64, 128, 1, 1, 64, 64, 64, 1]
    - [73, 1.0]
  - - [128, 128, 1, 1, 128, 128, 128, 1]
    - [75, 4.0]
  - - [256, 128, 1, 1, 256, 256, 256, 1]
    - [84, 9.0]
  - - [448, 128, 1, 1, 448, 448, 448, 1]
    - [87, 9.0]
  - - [704, 128, 1, 1, 704, 704, 704, 1]
    - [75, 12.0]
  - - [1024, 128, 1, 1, 1024, 1024, 1024, 1]
    - [81, 18.0]
  - - [1408, 128, 1, 1, 1408, 1408, 1408, 1]
    - [81, 23.0]
  - - [1856, 128, 1, 1, 1856, 1856, 1856, 1]
    - [81, 45.0]
  - - [2368, 128, 1, 1, 2368, 2368, 2368, 1]
    - [84, 45.0]
  - - [2944, 128, 1, 1, 2944, 2944, 2944, 1]
    - [86, 56.0]
  - - [3584, 128, 1, 1, 3584, 3584, 3584, 1]
    - [81, 60.0]
  - - [4288, 128, 1, 1, 4288, 4288, 4288, 1]
    - [84, 71.0]
  - - [5056, 128, 1, 1, 5056, 5056, 5056, 1]
    - [81, 87.0]
  - - [5888, 128, 1, 1, 5888, 5888, 5888, 1]
    - [89, 97.0]
  - - [6784, 128, 1, 1, 6784, 6784, 6784, 1]
    - [77, 110.0]
  - - [64, 256, 1, 1, 64, 64, 64, 1]
    - [75, 2.0]
  - - [128, 256, 1, 1, 128, 128, 128, 1]
    - [74, 6.0]
  - - [256, 256, 1, 1, 256, 256, 256, 1]
    - [81, 10.0]
  - - [448, 256, 1, 1, 448, 448, 448, 1]
    - [77, 16.0]
  - - [704, 256, 1, 1, 704, 704, 704, 1]
    - [81, 23.0]
  - - [1024, 256, 1, 1, 1024, 1024, 1024, 1]
    - [81, 49.0]
  - - [1408, 256, 1, 1, 1408, 1408, 1408, 1]
    - [81, 57.0]
  - - [1856, 256, 1, 1, 1856, 1856, 1856, 1]
    - [88, 72.0]
  - - [2368, 256, 1, 1, 2368, 2368, 2368, 1]
    - [86, 94.0]
  - - [2944, 256, 1, 1, 2944, 2944, 2944, 1]
    - [81, 96.0]
  - - [3584, 256, 1, 1, 3584, 3584, 3584, 1]
    - [81, 108.0]
  - - [4288, 256, 1, 1, 4288, 4288, 4288, 1]
    - [77, 132.0]
  - - [5056, 256, 1, 1, 5056, 5056, 5056, 1]
    - [77, 122.0]
  - - [5888, 256, 1, 1, 5888, 5888, 5888, 1]
    - [77, 140.0]
  - - [6784, 256, 1, 1, 6784, 6784, 6784, 1]
    - [81, 139.0]
  - - [64, 448, 1, 1, 64, 64, 64, 1]
    - [85, 6.0]
  - - [128, 448, 1, 1, 128, 128, 128, 1]
    - [79, 8.0]
  - - [256, 448, 1, 1, 256, 256, 256, 1]
    - [75, 16.0]
  - - [448, 448, 1, 1, 448, 448, 448, 1]
    - [79, 28.0]
  - - [704, 448, 1, 1, 704, 704, 704, 1]
    - [84, 57.0]
  - - [1024, 448, 1, 1, 1024, 1024, 1024, 1]
    - [77, 74.0]
  - - [1408, 448, 1, 1, 1408, 1408, 1408, 1]
    - [77, 77.0]
  - - [1856, 448, 1, 1, 1856, 1856, 1856, 1]
    - [84, 114.0]
  - - [2368, 448, 1, 1, 2368, 2368, 2368, 1]
    - [75, 125.0]
  - - [2944, 448, 1, 1, 2944, 2944, 2944, 1]
    - [81, 127.0]
  - - [3584, 448, 1, 1, 3584, 3584, 3584, 1]
    - [77, 153.0]
  - - [4288, 448, 1, 1, 4288, 4288, 4288, 1]
    - [81, 151.0]
  - - [5056, 448, 1, 1, 5056, 5056, 5056, 1]
    - [81, 163.0]
  - - [5888, 448, 1, 1, 5888, 5888, 5888, 1]
    - [77, 167.0]
  - - [6784, 448, 1, 1, 6784, 6784, 6784, 1]
    - [86, 180.0]
  - - [64, 704, 1, 1, 64, 64, 64, 1]
    - [75, 6.0]
  - - [128, 704, 1, 1, 128, 128, 128, 1]
    - [77, 13.0]
  - - [256, 704, 1, 1, 256, 256, 256, 1]
    - [77, 26.0]
  - - [448, 704, 1, 1, 448, 448, 448, 1]
    - [77, 51.0]
  - - [704, 704, 1, 1, 704, 704, 704, 1]
    - [77, 74.0]
  - - [1024, 704, 1, 1, 1024, 1024, 1024, 1]
    - [77, 98.0]
  - - [1408, 704, 1, 1, 1408, 1408, 1408, 1]
    - [77, 117.0]
  - - [1856, 704, 1, 1, 1856, 1856, 1856, 1]
    - [75, 127.0]
  - - [2368, 704, 1, 1, 2368, 2368, 2368, 1]
    - [79, 143.0]
  - - [2944, 704, 1, 1, 2944, 2944, 2944, 1]
    - [81, 156.0]
  - - [3584, 704, 1, 1, 3584, 3584, 3584, 1]
    - [81, 163.0]
  - - [4288, 704, 1, 1, 4288, 4288, 4288, 1]
    - [77, 173.0]
  - - [5056, 704, 1, 1, 5056, 5056, 5056, 1]
    - [79, 182.0]
  - - [5888, 704, 1, 1, 5888, 5888, 5888, 1]
    - [81, 193.0]
  - - [6784, 704, 1, 1, 6784, 6784, 6784, 1]
    - [74, 195.0]
  - - [64, 1024, 1, 1, 64, 64, 64, 1]
    - [77, 9.0]
  - - [128, 1024, 1, 1, 128, 128, 128, 1]
    - [81, 18.0]
  - - [256, 1024, 1, 1, 256, 256, 256, 1]
    - [77, 50.0]
  - - [448, 1024, 1, 1, 448, 448, 448, 1]
    - [84, 70.0]
  - - [704, 1024, 1, 1, 704, 704, 704, 1]
    - [86, 102.0]
  - - [1024, 1024, 1, 1, 1024, 1024, 1024, 1]
    - [74, 130.0]
  - - [1408, 1024, 1, 1, 1408, 1408, 1408, 1]
    - [77, 128.0]
  - - [1856, 1024, 1, 1, 1856, 1856, 1856, 1]
    - [81, 153.0]
  - - [2368, 1024, 1, 1, 2368, 2368, 2368, 1]
    - [77, 166.0]
  - - [2944, 1024, 1, 1, 2944, 2944, 2944, 1]
    - [81, 179.0]
  - - [3584, 1024, 1, 1, 3584, 3584, 3584, 1]
    - [81, 194.0]
  - - [4288, 1024, 1, 1, 4288, 4288, 4288, 1]
    - [81, 200.0]
  - - [5056, 1024, 1, 1, 5056, 5056, 5056, 1]
    - [74, 210.0]
  - - [5888, 1024, 1, 1, 5888, 5888, 5888, 1]
    - [74, 212.0]
  - - [6784, 1024, 1, 1, 6784, 6784, 6784, 1]
    - [74, 219.0]
  - - [64, 1408, 1, 1, 64, 64, 64, 1]
    - [81, 13.0]
  - - [128, 1408, 1, 1, 128, 128, 128, 1]
    - [81, 24.0]
  - - [256, 1408, 1, 1, 256, 256, 256, 1]
    - [86, 68.0]
  - - [448, 1408, 1, 1, 448, 448, 448, 1]
    - [86, 99.0]
  - - [704, 1408, 1, 1, 704, 704, 704, 1]
    - [74, 121.0]
  - - [1024, 1408, 1, 1, 1024, 1024, 1024, 1]
    - [78, 134.0]
  - - [1408, 1408, 1, 1, 1408, 1408, 1408, 1]
    - [84, 156.0]
  - - [1856, 1408, 1, 1, 1856, 1856, 1856, 1]
    - [77, 173.0]
  - - [2368, 1408, 1, 1, 2368, 2368, 2368, 1]
    - [77, 189.0]
  - - [2944, 1408, 1, 1, 2944, 2944, 2944, 1]
    - [74, 196.0]
  - - [3584, 1408, 1, 1, 3584, 3584, 3584, 1]
    - [74, 198.0]
  - - [4288, 1408, 1, 1, 4288, 4288, 4288, 1]
    - [81, 210.0]
  - - [5056, 1408, 1, 1, 5056, 5056, 5056, 1]
    - [76, 224.0]
  - - [5888, 1408, 1, 1, 5888, 5888, 5888, 1]
    - [78, 231.0]
  - - [6784, 1408, 1, 1, 6784, 6784, 6784, 1]
    - [80, 231.0]
  - - [64, 1856, 1, 1, 64, 64, 64, 1]
    - [77, 16.0]
  - - [128, 1856, 1, 1, 128, 128, 128, 1]
    - [77, 45.0]
  - - [256, 1856, 1, 1, 256, 256, 256, 1]
    - [77, 85.0]
  - - [448, 1856, 1, 1, 448, 448, 448, 1]
    - [77, 106.0]
  - - [704, 1856, 1, 1, 704, 704, 704, 1]
    - [79, 123.0]
  - - [1024, 1856, 1, 1, 1024, 1024, 1024, 1]
    - [81, 148.0]
  - - [1408, 1856, 1, 1, 1408, 1408, 1408, 1]
    - [84, 180.0]
  - - [1856, 1856, 1, 1, 1856, 1856, 1856, 1]
    - [81, 189.0]
  - - [2368, 1856, 1, 1, 2368, 2368, 2368, 1]
    - [77, 197.0]
  - - [2944, 1856, 1, 1, 2944, 2944, 2944, 1]
    - [81, 203.0]
  - - [3584, 1856, 1, 1, 3584, 3584, 3584, 1]
    - [81, 215.0]
  - - [4288, 1856, 1, 1, 4288, 4288, 4288, 1]
    - [81, 223.0]
  - - [5056, 1856, 1, 1, 5056, 5056, 5056, 1]
    - [74, 236.0]
  - - [5888, 1856, 1, 1, 5888, 5888, 5888, 1]
    - [78, 243.0]
  - - [6784, 1856, 1, 1, 6784, 6784, 6784, 1]
    - [78, 244.0]
  - - [64, 2368, 1, 1, 64, 64, 64, 1]
    - [77, 21.0]
  - - [128, 2368, 1, 1, 128, 128, 128, 1]
    - [81, 53.0]
  - - [256, 2368, 1, 1, 256, 256, 256, 1]
    - [77, 87.0]
  - - [448, 2368, 1, 1, 448, 448, 448, 1]
    - [86, 116.0]
  - - [704, 2368, 1, 1, 704, 704, 704, 1]
    - [77, 149.0]
  - - [1024, 2368, 1, 1, 1024, 1024, 1024, 1]
    - [81, 168.0]
  - - [1408, 2368, 1, 1, 1408, 1408, 1408, 1]
    - [77, 194.0]
  - - [1856, 2368, 1, 1, 1856, 1856, 1856, 1]
    - [77, 210.0]
  - - [2368, 2368, 1, 1, 2368, 2368, 2368, 1]
    - [78, 209.0]
  - - [2944, 2368, 1, 1, 2944, 2944, 2944, 1]
    - [76, 216.0]
  - - [3584, 2368, 1, 1, 3584, 3584, 3584, 1]
    - [77, 219.0]
  - - [4288, 2368, 1, 1, 4288, 4288, 4288, 1]
    - [81, 227.0]
  - - [5056, 2368, 1, 1, 5056, 5056, 5056, 1]
    - [76, 235.0]
  - - [5888, 2368, 1, 1, 5888, 5888, 5888, 1]
    - [74, 242.0]
  - - [6784, 2368, 1, 1, 6784, 6784, 6784, 1]
    - [74, 249.0]
  - - [64, 2944, 1, 1, 64, 64, 64, 1]
    - [81, 28.0]
  - - [128, 2944, 1, 1, 128, 128, 128, 1]
    - [84, 74.0]
  - - [256, 2944, 1, 1, 256, 256, 256, 1]
    - [84, 119.0]
  - - [448, 2944, 1, 1, 448, 448, 448, 1]
    - [86, 143.0]
  - - [704, 2944, 1, 1, 704, 704, 704, 1]
    - [86, 167.0]
  - - [1024, 2944, 1, 1, 1024, 1024, 1024, 1]
    - [86, 179.0]
  - - [1408, 2944, 1, 1, 1408, 1408, 1408, 1]
    - [74, 207.0]
  - - [1856, 2944, 1, 1, 1856, 1856, 1856, 1]
    - [78, 219.0]
  - - [2368, 2944, 1, 1, 2368, 2368, 2368, 1]
    - [74, 229.0]
  - - [2944, 2944, 1, 1, 2944, 2944, 2944, 1]
    - [78, 233.0]
  - - [3584, 2944, 1, 1, 3584, 3584, 3584, 1]
    - [80, 236.0]
  - - [4288, 2944, 1, 1, 4288, 4288, 4288, 1]
    - [78, 244.0]
  - - [5056, 2944, 1, 1, 5056, 5056, 5056, 1]
    - [74, 254.0]
  - - [5888, 2944, 1, 1, 5888, 5888, 5888, 1]
    - [74, 256.0]
  - - [6784, 2944, 1, 1, 6784, 6784, 6784, 1]
    - [78, 259.0]
  - - [64, 3584, 1, 1, 64, 64, 64, 1]
    - [81, 35.0]
  - - [128, 3584, 1, 1, 128, 128, 128, 1]
    - [84, 91.0]
  - - [256, 3584, 1, 1, 256, 256, 256, 1]
    - [84, 129.0]
  - - [448, 3584, 1, 1, 448, 448, 448, 1]
    - [81, 157.0]
  - - [704, 3584, 1, 1, 704, 704, 704, 1]
    - [86, 180.0]
  - - [1024, 3584, 1, 1, 1024, 1024, 1024, 1]
    - [86, 191.0]
  - - [1408, 3584, 1, 1, 1408, 1408, 1408, 1]
    - [74, 219.0]
  - - [1856, 3584, 1, 1, 1856, 1856, 1856, 1]
    - [78, 227.0]
  - - [2368, 3584, 1, 1, 2368, 2368, 2368, 1]
    - [78, 234.0]
  - - [2944, 3584, 1, 1, 2944, 2944, 2944, 1]
    - [74, 242.0]
  - - [3584, 3584, 1, 1, 3584, 3584, 3584, 1]
    - [78, 244.0]
  - - [4288, 3584, 1, 1, 4288, 4288, 4288, 1]
    - [78, 249.0]
  - - [5056, 3584, 1, 1, 5056, 5056, 5056, 1]
    - [78, 259.0]
  - - [5888, 3584, 1, 1, 5888, 5888, 5888, 1]
    - [74, 258.0]
  - - [6784, 3584, 1, 1, 6784, 6784, 6784, 1]
    - [74, 262.0]
  - - [64, 4288, 1, 1, 64, 64, 64, 1]
    - [86, 55.0]
  - - [128, 4288, 1, 1, 128, 128, 128, 1]
    - [86, 94.0]
  - - [256, 4288, 1, 1, 256, 256, 256, 1]
    - [84, 133.0]
  - - [448, 4288, 1, 1, 448, 448, 448, 1]
    - [81, 166.0]
  - - [704, 4288, 1, 1, 704, 704, 704, 1]
    - [77, 189.0]
  - - [1024, 4288, 1, 1, 1024, 1024, 1024, 1]
    - [84, 198.0]
  - - [1408, 4288, 1, 1, 1408, 1408, 1408, 1]
    - [74, 223.0]
  - - [1856, 4288, 1, 1, 1856, 1856, 1856, 1]
    - [78, 232.0]
  - - [2368, 4288, 1, 1, 2368, 2368, 2368, 1]
    - [78, 241.0]
  - - [2944, 4288, 1, 1, 2944, 2944, 2944, 1]
    - [74, 246.0]
  - - [3584, 4288, 1, 1, 3584, 3584, 3584, 1]
    - [74, 246.0]
  - - [4288, 4288, 1, 1, 4288, 4288, 4288, 1]
    - [78, 252.0]
  - - [5056, 4288, 1, 1, 5056, 5056, 5056, 1]
    - [74, 259.0]
  - - [5888, 4288, 1, 1, 5888, 5888, 5888, 1]
    - [78, 258.0]
  - - [6784, 4288, 1, 1, 6784, 6784, 6784, 1]
    - [74, 262.0]
  - - [64, 5056, 1, 1, 64, 64, 64, 1]
    - [86, 65.0]
  - - [128, 5056, 1, 1, 128, 128, 128, 1]
    - [86, 109.0]
  - - [256, 5056, 1, 1, 256, 256, 256, 1]
    - [86, 151.0]
  - - [448, 5056, 1, 1, 448, 448, 448, 1]
    - [81, 179.0]
  - - [704, 5056, 1, 1, 704, 704, 704, 1]
    - [81, 195.0]
  - - [1024, 5056, 1, 1, 1024, 1024, 1024, 1]
    - [81, 204.0]
  - - [1408, 5056, 1, 1, 1408, 1408, 1408, 1]
    - [78, 228.0]
  - - [1856, 5056, 1, 1, 1856, 1856, 1856, 1]
    - [74, 240.0]
  - - [2368, 5056, 1, 1, 2368, 2368, 2368, 1]
    - [74, 245.0]
  - - [2944, 5056, 1, 1, 2944, 2944, 2944, 1]
    - [78, 252.0]
  - - [3584, 5056, 1, 1, 3584, 3584, 3584, 1]
    - [78, 252.0]
  - - [4288, 5056, 1, 1, 4288, 4288, 4288, 1]
    - [74, 256.0]
  - - [5056, 5056, 1, 1, 5056, 5056, 5056, 1]
    - [78, 261.0]
  - - [5888, 5056, 1, 1, 5888, 5888, 5888, 1]
    - [74, 260.0]
  - - [6784, 5056, 1, 1, 6784, 6784, 6784, 1]
    - [74, 263.0]
  - - [64, 5888, 1, 1, 64, 64, 64, 1]
    - [84, 75.0]
  - - [128, 5888, 1, 1, 128, 128, 128, 1]
    - [77, 121.0]
  - - [256, 5888, 1, 1, 256, 256, 256, 1]
    - [86, 158.0]
  - - [448, 5888, 1, 1, 448, 448, 448, 1]
    - [81, 182.0]
  - - [704, 5888, 1, 1, 704, 704, 704, 1]
    - [78, 211.0]
  - - [1024, 5888, 1, 1, 1024, 1024, 1024, 1]
    - [81, 211.0]
  - - [1408, 5888, 1, 1, 1408, 1408, 1408, 1]
    - [78, 240.0]
  - - [1856, 5888, 1, 1, 1856, 1856, 1856, 1]
    - [74, 250.0]
  - - [2368, 5888, 1, 1, 2368, 2368, 2368, 1]
    - [74, 252.0]
  - - [2944, 5888, 1, 1, 2944, 2944, 2944, 1]
    - [78, 256.0]
  - - [3584, 5888, 1, 1, 3584, 3584, 3584, 1]
    - [78, 257.0]
  - - [4288, 5888, 1, 1, 4288, 4288, 4288, 1]
    - [74, 261.0]
  - - [5056, 5888, 1, 1, 5056, 5056, 5056, 1]
    - [74, 267.0]
  - - [5888, 5888, 1, 1, 5888, 5888, 5888, 1]
    - [74, 265.0]
  - - [6784, 5888, 1, 1, 6784, 6784, 6784, 1]
    - [78, 267.0]
  - - [64, 6784, 1, 1, 64, 64, 64, 1]
    - [86, 86.0]
  - - [128, 6784, 1, 1, 128, 128, 128, 1]
    - [84, 126.0]
  - - [256, 6784, 1, 1, 256, 256, 256, 1]
    - [81, 166.0]
  - - [448, 6784, 1, 1, 448, 448, 448, 1]
    - [74, 195.0]
  - - [704, 6784, 1, 1, 704, 704, 704, 1]
    - [74, 212.0]
  - - [1024, 6784, 1, 1, 1024, 1024, 1024, 1]
    - [81, 216.0]
  - - [1408, 6784, 1, 1, 1408, 1408, 1408, 1]
    - [80, 240.0]
  - - [1856, 6784, 1, 1, 1856, 1856, 1856, 1]
    - [78, 249.0]
  - - [2368, 6784, 1, 1, 2368, 2368, 2368, 1]
    - [74, 256.0]
  - - [2944, 6784, 1, 1, 2944, 2944, 2944, 1]
    - [74, 259.0]
  - - [3584, 6784, 1, 1, 3584, 3584, 3584, 1]
    - [74, 259.0]
  - - [4288, 6784, 1, 1, 4288, 4288, 4288, 1]
    - [74, 263.0]
  - - [5056, 6784, 1, 1, 5056, 5056, 5056, 1]
    - [74, 267.0]
  - - [5888, 6784, 1, 1, 5888, 5888, 5888, 1]
    - [74, 266.0]
  - - [6784, 6784, 1, 1, 6784, 6784, 6784, 1]
    - [74, 271.0]
  - - [1, 1, 1, 256, 1, 1, 1, 256]
    - [77, 0.009302325895093413]
  - - [1, 1, 1, 1280, 1, 1, 1, 1280]
    - [93, 0.04]
  - - [1, 1, 1, 3328, 1, 1, 1, 3328]
    - [95, 0.07]
  - - [1, 64, 1, 1, 1, 1, 1, 1]
    - [75, 0.01]
  - - [1, 128, 1, 1, 1, 1, 1, 1]
    - [73, 0.02]
  - - [1, 256, 1, 1, 1, 1, 1, 1]
    - [79, 0.08]
  - - [1, 448, 1, 1, 1, 1, 1, 1]
    - [76, 0.11]
  - - [1, 704, 1, 1, 1, 1, 1, 1]
    - [82, 0.15]
  - - [1, 1024, 1, 1, 1, 1, 1, 1]
    - [81, 0.22]
  - - [1, 1408, 1, 1, 1, 1, 1, 1]
    - [77, 0.28]
  - - [1, 1856, 1, 1, 1, 1, 1, 1]
    - [77, 0.36]
  - - [1, 2368, 1, 1, 1, 1, 1, 1]
    - [77, 0.46]
  - - [1, 2944, 1, 1, 1, 1, 1, 1]
    - [75, 1.0]
  - - [1, 3584, 1, 1, 1, 1, 1, 1]
    - [75, 1.0]
  - - [1, 4288, 1, 1, 1, 1, 1, 1]
    - [74, 1.0]
  - - [1, 5056, 1, 1, 1, 1, 1, 1]
    - [84, 2.0]
  - - [1, 5888, 1, 1, 1, 1, 1, 1]
    - [75, 2.0]
  - - [1, 6784, 1, 1, 1, 1, 1, 1]
    - [75, 2.0]
  - - [64, 1, 1, 1, 64, 64, 64, 1]
    - [74, 0.01]
  - - [128, 1, 1, 1, 128, 128, 128, 1]
    - [75, 0.03]
  - - [256, 1, 1, 1, 256, 256, 256, 1]
    - [77, 0.09]
  - - [448, 1, 1, 1, 448, 448, 448, 1]
    - [83, 0.11]
  - - [704, 1, 1, 1, 704, 704, 704, 1]
    - [81, 0.18]
  - - [1024, 1, 1, 1, 1024, 1024, 1024, 1]
    - [81, 0.24]
  - - [1408, 1, 1, 1, 1408, 1408, 1408, 1]
    - [77, 0.31]
  - - [1856, 1, 1, 1, 1856, 1856, 1856, 1]
    - [81, 0.42]
  - - [2368, 1, 1, 1, 2368, 2368, 2368, 1]
    - [77, 1.0]
  - - [2944, 1, 1, 1, 2944, 2944, 2944, 1]
    - [75, 1.0]
  - - [3584, 1, 1, 1, 3584, 3584, 3584, 1]
    - [74, 1.0]
  - - [4288, 1, 1, 1, 4288, 4288, 4288, 1]
    - [73, 1.0]
  - - [5056, 1, 1, 1, 5056, 5056, 5056, 1]
    - [75, 2.0]
  - - [5888, 1, 1, 1, 5888, 5888, 5888, 1]
    - [74, 2.0]
  - - [6784, 1, 1, 1, 6784, 6784, 6784, 1]
    - [74, 2.0]
- null
