library/src/blas3/Tensile/Logic/aldebaran/vega20_Cijk_Alik_Bljk_DB_GB.yaml
- {MinimumRequiredVersion: 4.26.0}
- vega20
- gfx906
- [Device 66a0, Device 66a1, Device 66a7, Device 66af, Vega 20]
    SolutionIndex: 0
    SolutionNameMin: Cijk_Alik_Bljk_DB_GB_MT32x32x8_SN_AMAS3_GRVW2_LRVW2_TT4_4_VW2_WG8_8_1_WGM1
    SolutionIndex: 1
    SolutionNameMin: Cijk_Alik_Bljk_DB_GB_MT32x64x8_SN_AMAS3_GRVW2_LRVW2_TT4_8_VW2_WG8_8_1_WGM1
    SolutionIndex: 2
    SolutionNameMin: Cijk_Alik_Bljk_DB_GB_MT64x64x8_SN_AMAS3_GRVW2_LRVW2_TT8_8_VW2_WG8_8_1_WGM1
    SolutionIndex: 3
    SolutionNameMin: Cijk_Alik_Bljk_DB_GB_MT64x64x8_SN_AMAS3_GRVW2_LRVW2_TT4_4_VW2_WG16_16_1_WGM1
    SolutionIndex: 4
    SolutionNameMin: Cijk_Alik_Bljk_DB_GB_MT32x32x16_SN_AMAS3_GRVW2_LRVW2_TT4_4_VW2_WG8_8_1_WGM1
    SolutionIndex: 5
    SolutionNameMin: Cijk_Alik_Bljk_DB_GB_MT64x64x16_SN_AMAS3_GRVW2_LRVW2_TT4_4_VW2_WG16_16_1_WGM1
    SolutionIndex: 6
    SolutionNameMin: Cijk_Alik_Bljk_DB_GB_MT64x128x16_SN_AMAS3_GRVW2_LRVW2_TT4_8_VW2_WG16_16_1_WGM1
    SolutionIndex: 7
    SolutionNameMin: Cijk_Alik_Bljk_DB_GB_MT128x128x16_SN_AMAS3_GRVW2_LRVW2_TT8_8_VW2_WG16_16_1_WGM1
    SolutionIndex: 8
    SolutionNameMin: Cijk_Alik_Bljk_DB_GB_MT32x32x32_SN_AMAS3_GRVW2_LRVW2_TT4_4_VW2_WG8_8_1_WGM1
    SolutionIndex: 9
    SolutionNameMin: Cijk_Alik_Bljk_DB_GB_MT32x32x8_SN_AMAS3_GRVW2_LRVW2_TT4_4_VW2_WG8_8_1_WGM8
    SolutionIndex: 10
    SolutionNameMin: Cijk_Alik_Bljk_DB_GB_MT32x64x8_SN_AMAS3_GRVW2_LRVW2_TT4_8_VW2_WG8_8_1_WGM8
    SolutionIndex: 11
    SolutionNameMin: Cijk_Alik_Bljk_DB_GB_MT64x64x8_SN_AMAS3_GRVW2_LRVW2_TT4_4_VW2_WG16_16_1_WGM8
    SolutionIndex: 12
    SolutionNameMin: Cijk_Alik_Bljk_DB_GB_MT32x32x16_SN_AMAS3_GRVW2_LRVW2_TT4_4_VW2_WG8_8_1_WGM8
    SolutionIndex: 13
    SolutionNameMin: Cijk_Alik_Bljk_DB_GB_MT64x128x16_SN_AMAS3_GRVW2_LRVW2_TT4_8_VW2_WG16_16_1_WGM8
    SolutionIndex: 14
    SolutionNameMin: Cijk_Alik_Bljk_DB_GB_MT64x64x32_SN_AMAS3_GRVW2_LRVW2_TT4_4_VW2_WG16_16_1_WGM8
    SolutionIndex: 15
    SolutionNameMin: Cijk_Alik_Bljk_DB_GB_MT32x32x8_SN_AMAS0_GRVW1_LRVW1_TT4_4_VW1_WG8_8_1_WGM8
    SolutionIndex: 16
    SolutionNameMin: Cijk_Alik_Bljk_DB_GB_MT32x64x8_SN_AMAS0_GRVW1_LRVW1_TT4_8_VW1_WG8_8_1_WGM8
- - - [32, 32, 8, 32, 32, 32, 32, 32]
    - [0, 68.0]
  - - [32, 32, 8, 64, 32, 32, 64, 64]
    - [0, 96.0]
  - - [32, 32, 8, 128, 32, 32, 128, 128]
    - [0, 117.0]
  - - [32, 32, 8, 256, 32, 32, 256, 256]
    - [0, 132.0]
  - - [32, 32, 8, 512, 32, 32, 512, 512]
    - [0, 140.0]
  - - [32, 64, 8, 32, 32, 32, 32, 32]
    - [0, 144.0]
  - - [32, 64, 8, 64, 32, 32, 64, 64]
    - [0, 195.0]
  - - [32, 64, 8, 128, 32, 32, 128, 128]
    - [0, 237.0]
  - - [32, 64, 8, 256, 32, 32, 256, 256]
    - [0, 264.0]
  - - [32, 64, 8, 512, 32, 32, 512, 512]
    - [4, 277.0]
  - - [32, 128, 8, 32, 32, 32, 32, 32]
    - [0, 289.0]
  - - [32, 128, 8, 64, 32, 32, 64, 64]
    - [0, 393.0]
  - - [32, 128, 8, 128, 32, 32, 128, 128]
    - [0, 474.0]
  - - [32, 128, 8, 256, 32, 32, 256, 256]
    - [0, 513.0]
  - - [32, 128, 8, 512, 32, 32, 512, 512]
    - [4, 451.0]
  - - [32, 256, 8, 32, 32, 32, 32, 32]
    - [0, 565.0]
  - - [32, 256, 8, 64, 32, 32, 64, 64]
    - [0, 760.0]
  - - [32, 256, 8, 128, 32, 32, 128, 128]
    - [9, 888.0]
  - - [32, 256, 8, 256, 32, 32, 256, 256]
    - [4, 754.0]
  - - [32, 256, 8, 512, 32, 32, 512, 512]
    - [5, 689.0]
  - - [32, 512, 8, 32, 32, 32, 32, 32]
    - [0, 1055.0]
  - - [32, 512, 8, 64, 32, 32, 64, 64]
    - [0, 1371.0]
  - - [32, 512, 8, 128, 32, 32, 128, 128]
    - [4, 1164.0]
  - - [32, 512, 8, 256, 32, 32, 256, 256]
    - [5, 1077.0]
  - - [32, 512, 8, 512, 32, 32, 512, 512]
    - [5, 918.0]
  - - [64, 32, 8, 32, 64, 64, 32, 32]
    - [0, 144.0]
  - - [64, 32, 8, 64, 64, 64, 64, 64]
    - [0, 196.0]
  - - [64, 32, 8, 128, 64, 64, 128, 128]
    - [0, 239.0]
  - - [64, 32, 8, 256, 64, 64, 256, 256]
    - [9, 267.0]
  - - [64, 32, 8, 512, 64, 64, 512, 512]
    - [4, 278.0]
  - - [64, 64, 8, 32, 64, 64, 32, 32]
    - [0, 292.0]
  - - [64, 64, 8, 64, 64, 64, 64, 64]
    - [0, 395.0]
  - - [64, 64, 8, 128, 64, 64, 128, 128]
    - [0, 479.0]
  - - [64, 64, 8, 256, 64, 64, 256, 256]
    - [0, 526.0]
  - - [64, 64, 8, 512, 64, 64, 512, 512]
    - [12, 548.0]
  - - [64, 128, 8, 32, 64, 64, 32, 32]
    - [0, 566.0]
  - - [64, 128, 8, 64, 64, 64, 64, 64]
    - [0, 767.0]
  - - [64, 128, 8, 128, 64, 64, 128, 128]
    - [0, 935.0]
  - - [64, 128, 8, 256, 64, 64, 256, 256]
    - [4, 1013.0]
  - - [64, 128, 8, 512, 64, 64, 512, 512]
    - [4, 844.0]
  - - [64, 256, 8, 32, 64, 64, 32, 32]
    - [0, 1063.0]
  - - [64, 256, 8, 64, 64, 64, 64, 64]
    - [0, 1473.0]
  - - [64, 256, 8, 128, 64, 64, 128, 128]
    - [0, 1675.0]
  - - [64, 256, 8, 256, 64, 64, 256, 256]
    - [8, 1300.0]
  - - [64, 256, 8, 512, 64, 64, 512, 512]
    - [5, 1137.0]
  - - [64, 512, 8, 32, 64, 64, 32, 32]
    - [0, 1670.0]
  - - [64, 512, 8, 64, 64, 64, 64, 64]
    - [0, 2175.0]
  - - [64, 512, 8, 128, 64, 64, 128, 128]
    - [5, 1885.0]
  - - [64, 512, 8, 256, 64, 64, 256, 256]
    - [5, 1826.0]
  - - [64, 512, 8, 512, 64, 64, 512, 512]
    - [5, 1566.0]
  - - [128, 32, 8, 32, 128, 128, 32, 32]
    - [0, 296.0]
  - - [128, 32, 8, 64, 128, 128, 64, 64]
    - [0, 394.0]
  - - [128, 32, 8, 128, 128, 128, 128, 128]
    - [0, 483.0]
  - - [128, 32, 8, 256, 128, 128, 256, 256]
    - [4, 528.0]
  - - [128, 32, 8, 512, 128, 128, 512, 512]
    - [4, 555.0]
  - - [128, 64, 8, 32, 128, 128, 32, 32]
    - [0, 559.0]
  - - [128, 64, 8, 64, 128, 128, 64, 64]
    - [0, 768.0]
  - - [128, 64, 8, 128, 128, 128, 128, 128]
    - [0, 946.0]
  - - [128, 64, 8, 256, 128, 128, 256, 256]
    - [4, 1036.0]
  - - [128, 64, 8, 512, 128, 128, 512, 512]
    - [4, 1080.0]
  - - [128, 128, 8, 32, 128, 128, 32, 32]
    - [0, 1061.0]
  - - [128, 128, 8, 64, 128, 128, 64, 64]
    - [0, 1464.0]
  - - [128, 128, 8, 128, 128, 128, 128, 128]
    - [0, 1789.0]
  - - [128, 128, 8, 256, 128, 128, 256, 256]
    - [4, 1941.0]
  - - [128, 128, 8, 512, 128, 128, 512, 512]
    - [8, 1534.0]
  - - [128, 256, 8, 32, 128, 128, 32, 32]
    - [0, 1817.0]
  - - [128, 256, 8, 64, 128, 128, 64, 64]
    - [0, 2380.0]
  - - [128, 256, 8, 128, 128, 128, 128, 128]
    - [0, 2911.0]
  - - [128, 256, 8, 256, 128, 128, 256, 256]
    - [14, 2181.0]
  - - [128, 256, 8, 512, 128, 128, 512, 512]
    - [5, 2112.0]
  - - [128, 512, 8, 32, 128, 128, 32, 32]
    - [3, 2416.0]
  - - [128, 512, 8, 64, 128, 128, 64, 64]
    - [3, 3329.0]
  - - [128, 512, 8, 128, 128, 128, 128, 128]
    - [10, 3594.0]
  - - [128, 512, 8, 256, 128, 128, 256, 256]
    - [13, 2611.0]
  - - [128, 512, 8, 512, 128, 128, 512, 512]
    - [6, 2434.0]
  - - [256, 32, 8, 32, 256, 256, 32, 32]
    - [0, 554.0]
  - - [256, 32, 8, 64, 256, 256, 64, 64]
    - [0, 758.0]
  - - [256, 32, 8, 128, 256, 256, 128, 128]
    - [0, 909.0]
  - - [256, 32, 8, 256, 256, 256, 256, 256]
    - [12, 1035.0]
  - - [256, 32, 8, 512, 256, 256, 512, 512]
    - [12, 1101.0]
  - - [256, 64, 8, 32, 256, 256, 32, 32]
    - [0, 997.0]
  - - [256, 64, 8, 64, 256, 256, 64, 64]
    - [0, 1415.0]
  - - [256, 64, 8, 128, 256, 256, 128, 128]
    - [0, 1733.0]
  - - [256, 64, 8, 256, 256, 256, 256, 256]
    - [0, 1962.0]
  - - [256, 64, 8, 512, 256, 256, 512, 512]
    - [4, 1866.0]
  - - [256, 128, 8, 32, 256, 256, 32, 32]
    - [3, 1697.0]
  - - [256, 128, 8, 64, 256, 256, 64, 64]
    - [9, 2482.0]
  - - [256, 128, 8, 128, 256, 256, 128, 128]
    - [3, 2933.0]
  - - [256, 128, 8, 256, 256, 256, 256, 256]
    - [0, 2941.0]
  - - [256, 128, 8, 512, 256, 256, 512, 512]
    - [14, 2303.0]
  - - [256, 256, 8, 32, 256, 256, 32, 32]
    - [3, 2473.0]
  - - [256, 256, 8, 64, 256, 256, 64, 64]
    - [3, 3441.0]
  - - [256, 256, 8, 128, 256, 256, 128, 128]
    - [3, 4045.0]
  - - [256, 256, 8, 256, 256, 256, 256, 256]
    - [1, 3658.0]
  - - [256, 256, 8, 512, 256, 256, 512, 512]
    - [6, 2890.0]
  - - [256, 512, 8, 32, 256, 256, 32, 32]
    - [3, 2770.0]
  - - [256, 512, 8, 64, 256, 256, 64, 64]
    - [3, 3717.0]
  - - [256, 512, 8, 128, 256, 256, 128, 128]
    - [3, 4400.0]
  - - [256, 512, 8, 256, 256, 256, 256, 256]
    - [10, 4284.0]
  - - [256, 512, 8, 512, 256, 256, 512, 512]
    - [6, 3335.0]
  - - [512, 32, 8, 32, 512, 512, 32, 32]
    - [0, 890.0]
  - - [512, 32, 8, 64, 512, 512, 64, 64]
    - [9, 1253.0]
  - - [512, 32, 8, 128, 512, 512, 128, 128]
    - [0, 1589.0]
  - - [512, 32, 8, 256, 512, 512, 256, 256]
    - [0, 1885.0]
  - - [512, 32, 8, 512, 512, 512, 512, 512]
    - [12, 1924.0]
  - - [512, 64, 8, 32, 512, 512, 32, 32]
    - [3, 1603.0]
  - - [512, 64, 8, 64, 512, 512, 64, 64]
    - [11, 2191.0]
  - - [512, 64, 8, 128, 512, 512, 128, 128]
    - [3, 2830.0]
  - - [512, 64, 8, 256, 512, 512, 256, 256]
    - [11, 3253.0]
  - - [512, 64, 8, 512, 512, 512, 512, 512]
    - [15, 2739.0]
  - - [512, 128, 8, 32, 512, 512, 32, 32]
    - [3, 2262.0]
  - - [512, 128, 8, 64, 512, 512, 64, 64]
    - [3, 3277.0]
  - - [512, 128, 8, 128, 512, 512, 128, 128]
    - [11, 3962.0]
  - - [512, 128, 8, 256, 512, 512, 256, 256]
    - [3, 4464.0]
  - - [512, 128, 8, 512, 512, 512, 512, 512]
    - [16, 3611.0]
  - - [512, 256, 8, 32, 512, 512, 32, 32]
    - [3, 2648.0]
  - - [512, 256, 8, 64, 512, 512, 64, 64]
    - [3, 3616.0]
  - - [512, 256, 8, 128, 512, 512, 128, 128]
    - [3, 4365.0]
  - - [512, 256, 8, 256, 512, 512, 256, 256]
    - [2, 4886.0]
  - - [512, 256, 8, 512, 512, 512, 512, 512]
    - [6, 3927.0]
  - - [512, 512, 8, 32, 512, 512, 32, 32]
    - [11, 3170.0]
  - - [512, 512, 8, 64, 512, 512, 64, 64]
    - [3, 4192.0]
  - - [512, 512, 8, 128, 512, 512, 128, 128]
    - [11, 4816.0]
  - - [512, 512, 8, 256, 512, 512, 256, 256]
    - [3, 5022.0]
  - - [512, 512, 8, 512, 512, 512, 512, 512]
    - [7, 4234.0]
- null
