library/src/blas3/Tensile/Logic/aldebaran/vega20_Cijk_Ailk_Bjlk_CB_GB.yaml
- {MinimumRequiredVersion: 4.26.0}
- vega20
- gfx906
- [Device 66a0, Device 66a1, Device 66a7, Device 66af, Vega 20]
    SolutionIndex: 0
    SolutionNameMin: Cijk_Ailk_Bjlk_CB_GB_MT32x32x8_SN_AMAS3_GRVW2_LRVW2_TT4_4_VW2_WG8_8_1_WGM1
    SolutionIndex: 1
    SolutionNameMin: Cijk_Ailk_Bjlk_CB_GB_MT64x64x8_SN_AMAS3_GRVW2_LRVW2_TT4_4_VW2_WG16_16_1_WGM1
    SolutionIndex: 2
    SolutionNameMin: Cijk_Ailk_Bjlk_CB_GB_MT32x32x16_SN_AMAS3_GRVW2_LRVW2_TT4_4_VW2_WG8_8_1_WGM1
    SolutionIndex: 3
    SolutionNameMin: Cijk_Ailk_Bjlk_CB_GB_MT64x64x16_SN_AMAS3_GRVW2_LRVW2_TT4_4_VW2_WG16_16_1_WGM1
    SolutionIndex: 4
    SolutionNameMin: Cijk_Ailk_Bjlk_CB_GB_MT32x32x8_SN_AMAS0_GRVW1_LRVW1_TT4_4_VW1_WG8_8_1_WGM1
    SolutionIndex: 5
    SolutionNameMin: Cijk_Ailk_Bjlk_CB_GB_MT64x64x8_SN_AMAS0_GRVW1_LRVW1_TT4_4_VW1_WG16_16_1_WGM1
    SolutionIndex: 6
    SolutionNameMin: Cijk_Ailk_Bjlk_CB_GB_MT64x64x16_SN_AMAS0_GRVW1_LRVW1_TT4_4_VW1_WG16_16_1_WGM1
    SolutionIndex: 7
    SolutionNameMin: Cijk_Ailk_Bjlk_CB_GB_MT32x32x8_SN_AMAS3_GRVW2_LRVW2_TT4_4_VW2_WG8_8_1_WGM8
    SolutionIndex: 8
    SolutionNameMin: Cijk_Ailk_Bjlk_CB_GB_MT64x64x8_SN_AMAS3_GRVW2_LRVW2_TT4_4_VW2_WG16_16_1_WGM8
    SolutionIndex: 9
    SolutionNameMin: Cijk_Ailk_Bjlk_CB_GB_MT64x64x16_SN_AMAS3_GRVW2_LRVW2_TT4_4_VW2_WG16_16_1_WGM8
    SolutionIndex: 10
    SolutionNameMin: Cijk_Ailk_Bjlk_CB_GB_MT32x32x8_SN_AMAS0_GRVW1_LRVW1_TT4_4_VW1_WG8_8_1_WGM8
    SolutionIndex: 11
    SolutionNameMin: Cijk_Ailk_Bjlk_CB_GB_MT64x64x8_SN_AMAS0_GRVW1_LRVW1_TT4_4_VW1_WG16_16_1_WGM8
- - - [32, 32, 8, 32, 32, 32, 32, 32]
    - [0, 44.0]
  - - [32, 32, 8, 64, 32, 32, 32, 32]
    - [7, 61.0]
  - - [32, 32, 8, 128, 32, 32, 32, 32]
    - [0, 74.0]
  - - [32, 32, 8, 256, 32, 32, 32, 32]
    - [0, 82.0]
  - - [32, 32, 8, 512, 32, 32, 32, 32]
    - [0, 87.0]
  - - [32, 64, 8, 32, 32, 32, 32, 64]
    - [0, 97.0]
  - - [32, 64, 8, 64, 32, 32, 32, 64]
    - [0, 127.0]
  - - [32, 64, 8, 128, 32, 32, 32, 64]
    - [7, 152.0]
  - - [32, 64, 8, 256, 32, 32, 32, 64]
    - [0, 167.0]
  - - [32, 64, 8, 512, 32, 32, 32, 64]
    - [0, 174.0]
  - - [32, 128, 8, 32, 32, 32, 32, 128]
    - [0, 199.0]
  - - [32, 128, 8, 64, 32, 32, 32, 128]
    - [0, 261.0]
  - - [32, 128, 8, 128, 32, 32, 32, 128]
    - [7, 307.0]
  - - [32, 128, 8, 256, 32, 32, 32, 128]
    - [0, 334.0]
  - - [32, 128, 8, 512, 32, 32, 32, 128]
    - [0, 349.0]
  - - [32, 256, 8, 32, 32, 32, 32, 256]
    - [0, 395.0]
  - - [32, 256, 8, 64, 32, 32, 32, 256]
    - [0, 514.0]
  - - [32, 256, 8, 128, 32, 32, 32, 256]
    - [7, 605.0]
  - - [32, 256, 8, 256, 32, 32, 32, 256]
    - [7, 665.0]
  - - [32, 256, 8, 512, 32, 32, 32, 256]
    - [7, 704.0]
  - - [32, 512, 8, 32, 32, 32, 32, 512]
    - [7, 741.0]
  - - [32, 512, 8, 64, 32, 32, 32, 512]
    - [0, 972.0]
  - - [32, 512, 8, 128, 32, 32, 32, 512]
    - [0, 1174.0]
  - - [32, 512, 8, 256, 32, 32, 32, 512]
    - [7, 1312.0]
  - - [32, 512, 8, 512, 32, 32, 32, 512]
    - [7, 1397.0]
  - - [64, 32, 8, 32, 64, 64, 64, 32]
    - [0, 96.0]
  - - [64, 32, 8, 64, 64, 64, 64, 32]
    - [0, 128.0]
  - - [64, 32, 8, 128, 64, 64, 64, 32]
    - [7, 152.0]
  - - [64, 32, 8, 256, 64, 64, 64, 32]
    - [0, 167.0]
  - - [64, 32, 8, 512, 64, 64, 64, 32]
    - [7, 175.0]
  - - [64, 64, 8, 32, 64, 64, 64, 64]
    - [0, 200.0]
  - - [64, 64, 8, 64, 64, 64, 64, 64]
    - [0, 260.0]
  - - [64, 64, 8, 128, 64, 64, 64, 64]
    - [0, 307.0]
  - - [64, 64, 8, 256, 64, 64, 64, 64]
    - [7, 336.0]
  - - [64, 64, 8, 512, 64, 64, 64, 64]
    - [0, 350.0]
  - - [64, 128, 8, 32, 64, 64, 64, 128]
    - [0, 394.0]
  - - [64, 128, 8, 64, 64, 64, 64, 128]
    - [7, 516.0]
  - - [64, 128, 8, 128, 64, 64, 64, 128]
    - [0, 611.0]
  - - [64, 128, 8, 256, 64, 64, 64, 128]
    - [7, 667.0]
  - - [64, 128, 8, 512, 64, 64, 64, 128]
    - [2, 706.0]
  - - [64, 256, 8, 32, 64, 64, 64, 256]
    - [7, 757.0]
  - - [64, 256, 8, 64, 64, 64, 64, 256]
    - [0, 999.0]
  - - [64, 256, 8, 128, 64, 64, 64, 256]
    - [0, 1184.0]
  - - [64, 256, 8, 256, 64, 64, 64, 256]
    - [7, 1315.0]
  - - [64, 256, 8, 512, 64, 64, 64, 256]
    - [0, 1397.0]
  - - [64, 512, 8, 32, 64, 64, 64, 512]
    - [0, 1348.0]
  - - [64, 512, 8, 64, 64, 64, 64, 512]
    - [0, 1817.0]
  - - [64, 512, 8, 128, 64, 64, 64, 512]
    - [0, 2217.0]
  - - [64, 512, 8, 256, 64, 64, 64, 512]
    - [3, 2500.0]
  - - [64, 512, 8, 512, 64, 64, 64, 512]
    - [3, 2730.0]
  - - [128, 32, 8, 32, 128, 128, 128, 32]
    - [0, 200.0]
  - - [128, 32, 8, 64, 128, 128, 128, 32]
    - [0, 259.0]
  - - [128, 32, 8, 128, 128, 128, 128, 32]
    - [0, 307.0]
  - - [128, 32, 8, 256, 128, 128, 128, 32]
    - [7, 335.0]
  - - [128, 32, 8, 512, 128, 128, 128, 32]
    - [7, 349.0]
  - - [128, 64, 8, 32, 128, 128, 128, 64]
    - [0, 390.0]
  - - [128, 64, 8, 64, 128, 128, 128, 64]
    - [0, 515.0]
  - - [128, 64, 8, 128, 128, 128, 128, 64]
    - [0, 608.0]
  - - [128, 64, 8, 256, 128, 128, 128, 64]
    - [0, 669.0]
  - - [128, 64, 8, 512, 128, 128, 128, 64]
    - [2, 707.0]
  - - [128, 128, 8, 32, 128, 128, 128, 128]
    - [0, 746.0]
  - - [128, 128, 8, 64, 128, 128, 128, 128]
    - [0, 995.0]
  - - [128, 128, 8, 128, 128, 128, 128, 128]
    - [0, 1184.0]
  - - [128, 128, 8, 256, 128, 128, 128, 128]
    - [0, 1314.0]
  - - [128, 128, 8, 512, 128, 128, 128, 128]
    - [0, 1393.0]
  - - [128, 256, 8, 32, 128, 128, 128, 256]
    - [4, 1358.0]
  - - [128, 256, 8, 64, 128, 128, 128, 256]
    - [0, 1805.0]
  - - [128, 256, 8, 128, 128, 128, 128, 256]
    - [0, 2203.0]
  - - [128, 256, 8, 256, 128, 128, 128, 256]
    - [0, 2499.0]
  - - [128, 256, 8, 512, 128, 128, 128, 256]
    - [3, 2725.0]
  - - [128, 512, 8, 32, 128, 128, 128, 512]
    - [5, 1933.0]
  - - [128, 512, 8, 64, 128, 128, 128, 512]
    - [5, 2467.0]
  - - [128, 512, 8, 128, 128, 128, 128, 512]
    - [5, 2906.0]
  - - [128, 512, 8, 256, 128, 128, 128, 512]
    - [5, 3187.0]
  - - [128, 512, 8, 512, 128, 128, 128, 512]
    - [5, 3355.0]
  - - [256, 32, 8, 32, 256, 256, 256, 32]
    - [0, 384.0]
  - - [256, 32, 8, 64, 256, 256, 256, 32]
    - [0, 507.0]
  - - [256, 32, 8, 128, 256, 256, 256, 32]
    - [0, 600.0]
  - - [256, 32, 8, 256, 256, 256, 256, 32]
    - [7, 661.0]
  - - [256, 32, 8, 512, 256, 256, 256, 32]
    - [2, 703.0]
  - - [256, 64, 8, 32, 256, 256, 256, 64]
    - [5, 720.0]
  - - [256, 64, 8, 64, 256, 256, 256, 64]
    - [0, 969.0]
  - - [256, 64, 8, 128, 256, 256, 256, 64]
    - [0, 1168.0]
  - - [256, 64, 8, 256, 256, 256, 256, 64]
    - [0, 1304.0]
  - - [256, 64, 8, 512, 256, 256, 256, 64]
    - [7, 1393.0]
  - - [256, 128, 8, 32, 256, 256, 256, 128]
    - [5, 1322.0]
  - - [256, 128, 8, 64, 256, 256, 256, 128]
    - [1, 1749.0]
  - - [256, 128, 8, 128, 256, 256, 256, 128]
    - [7, 2244.0]
  - - [256, 128, 8, 256, 256, 256, 256, 128]
    - [0, 2465.0]
  - - [256, 128, 8, 512, 256, 256, 256, 128]
    - [3, 2714.0]
  - - [256, 256, 8, 32, 256, 256, 256, 256]
    - [5, 1920.0]
  - - [256, 256, 8, 64, 256, 256, 256, 256]
    - [5, 2450.0]
  - - [256, 256, 8, 128, 256, 256, 256, 256]
    - [5, 2848.0]
  - - [256, 256, 8, 256, 256, 256, 256, 256]
    - [5, 3156.0]
  - - [256, 256, 8, 512, 256, 256, 256, 256]
    - [5, 3336.0]
  - - [256, 512, 8, 32, 256, 256, 256, 512]
    - [5, 2266.0]
  - - [256, 512, 8, 64, 256, 256, 256, 512]
    - [1, 2720.0]
  - - [256, 512, 8, 128, 256, 256, 256, 512]
    - [1, 3078.0]
  - - [256, 512, 8, 256, 256, 256, 256, 512]
    - [1, 3274.0]
  - - [256, 512, 8, 512, 256, 256, 256, 512]
    - [9, 3292.0]
  - - [512, 32, 8, 32, 512, 512, 512, 32]
    - [5, 659.0]
  - - [512, 32, 8, 64, 512, 512, 512, 32]
    - [0, 895.0]
  - - [512, 32, 8, 128, 512, 512, 512, 32]
    - [7, 1111.0]
  - - [512, 32, 8, 256, 512, 512, 512, 32]
    - [0, 1269.0]
  - - [512, 32, 8, 512, 512, 512, 512, 32]
    - [7, 1375.0]
  - - [512, 64, 8, 32, 512, 512, 512, 64]
    - [1, 1256.0]
  - - [512, 64, 8, 64, 512, 512, 512, 64]
    - [1, 1715.0]
  - - [512, 64, 8, 128, 512, 512, 512, 64]
    - [1, 2135.0]
  - - [512, 64, 8, 256, 512, 512, 512, 64]
    - [7, 2467.0]
  - - [512, 64, 8, 512, 512, 512, 512, 64]
    - [3, 2690.0]
  - - [512, 128, 8, 32, 512, 512, 512, 128]
    - [5, 1746.0]
  - - [512, 128, 8, 64, 512, 512, 512, 128]
    - [5, 2321.0]
  - - [512, 128, 8, 128, 512, 512, 512, 128]
    - [5, 2791.0]
  - - [512, 128, 8, 256, 512, 512, 512, 128]
    - [10, 3095.0]
  - - [512, 128, 8, 512, 512, 512, 512, 128]
    - [5, 3297.0]
  - - [512, 256, 8, 32, 512, 512, 512, 256]
    - [1, 2113.0]
  - - [512, 256, 8, 64, 512, 512, 512, 256]
    - [1, 2630.0]
  - - [512, 256, 8, 128, 512, 512, 512, 256]
    - [1, 3041.0]
  - - [512, 256, 8, 256, 512, 512, 512, 256]
    - [1, 3238.0]
  - - [512, 256, 8, 512, 512, 512, 512, 256]
    - [9, 3266.0]
  - - [512, 512, 8, 32, 512, 512, 512, 512]
    - [11, 2518.0]
  - - [512, 512, 8, 64, 512, 512, 512, 512]
    - [8, 2953.0]
  - - [512, 512, 8, 128, 512, 512, 512, 512]
    - [1, 3265.0]
  - - [512, 512, 8, 256, 512, 512, 512, 512]
    - [1, 3323.0]
  - - [512, 512, 8, 512, 512, 512, 512, 512]
    - [6, 3301.0]
- null
