library/src/blas3/Tensile/Logic/aldebaran/vega20_Cijk_Ailk_Bjlk_DB_GB.yaml
- {MinimumRequiredVersion: 4.26.0}
- vega20
- gfx906
- [Device 66a0, Device 66a1, Device 66a7, Device 66af, Vega 20]
    SolutionIndex: 0
    SolutionNameMin: Cijk_Ailk_Bjlk_DB_GB_MT32x32x8_SN_AMAS3_GRVW2_LRVW2_TT4_4_VW2_WG8_8_1_WGM1
    SolutionIndex: 1
    SolutionNameMin: Cijk_Ailk_Bjlk_DB_GB_MT64x64x8_SN_AMAS3_GRVW2_LRVW2_TT4_4_VW2_WG16_16_1_WGM1
    SolutionIndex: 2
    SolutionNameMin: Cijk_Ailk_Bjlk_DB_GB_MT32x32x16_SN_AMAS3_GRVW2_LRVW2_TT4_4_VW2_WG8_8_1_WGM1
    SolutionIndex: 3
    SolutionNameMin: Cijk_Ailk_Bjlk_DB_GB_MT64x64x16_SN_AMAS3_GRVW2_LRVW2_TT4_4_VW2_WG16_16_1_WGM1
    SolutionIndex: 4
    SolutionNameMin: Cijk_Ailk_Bjlk_DB_GB_MT64x64x8_SN_AMAS0_GRVW1_LRVW1_TT4_4_VW1_WG16_16_1_WGM1
    SolutionIndex: 5
    SolutionNameMin: Cijk_Ailk_Bjlk_DB_GB_MT64x64x16_SN_AMAS0_GRVW1_LRVW1_TT4_4_VW1_WG16_16_1_WGM1
    SolutionIndex: 6
    SolutionNameMin: Cijk_Ailk_Bjlk_DB_GB_MT32x32x8_SN_AMAS3_GRVW2_LRVW2_TT4_4_VW2_WG8_8_1_WGM8
    SolutionIndex: 7
    SolutionNameMin: Cijk_Ailk_Bjlk_DB_GB_MT64x64x8_SN_AMAS3_GRVW2_LRVW2_TT4_4_VW2_WG16_16_1_WGM8
    SolutionIndex: 8
    SolutionNameMin: Cijk_Ailk_Bjlk_DB_GB_MT32x32x16_SN_AMAS3_GRVW2_LRVW2_TT4_4_VW2_WG8_8_1_WGM8
    SolutionIndex: 9
    SolutionNameMin: Cijk_Ailk_Bjlk_DB_GB_MT64x64x16_SN_AMAS3_GRVW2_LRVW2_TT4_4_VW2_WG16_16_1_WGM8
    SolutionIndex: 10
    SolutionNameMin: Cijk_Ailk_Bjlk_DB_GB_MT64x64x8_SN_AMAS0_GRVW1_LRVW1_TT4_4_VW1_WG16_16_1_WGM8
- - - [32, 32, 8, 32, 32, 32, 32, 32]
    - [6, 65.0]
  - - [32, 32, 8, 64, 32, 32, 32, 32]
    - [0, 92.0]
  - - [32, 32, 8, 128, 32, 32, 32, 32]
    - [0, 116.0]
  - - [32, 32, 8, 256, 32, 32, 32, 32]
    - [2, 134.0]
  - - [32, 32, 8, 512, 32, 32, 32, 32]
    - [3, 146.0]
  - - [32, 64, 8, 32, 32, 32, 32, 64]
    - [0, 139.0]
  - - [32, 64, 8, 64, 32, 32, 32, 64]
    - [0, 192.0]
  - - [32, 64, 8, 128, 32, 32, 32, 64]
    - [0, 237.0]
  - - [32, 64, 8, 256, 32, 32, 32, 64]
    - [2, 272.0]
  - - [32, 64, 8, 512, 32, 32, 32, 64]
    - [2, 291.0]
  - - [32, 128, 8, 32, 32, 32, 32, 128]
    - [0, 279.0]
  - - [32, 128, 8, 64, 32, 32, 32, 128]
    - [0, 387.0]
  - - [32, 128, 8, 128, 32, 32, 32, 128]
    - [0, 478.0]
  - - [32, 128, 8, 256, 32, 32, 32, 128]
    - [2, 540.0]
  - - [32, 128, 8, 512, 32, 32, 32, 128]
    - [2, 583.0]
  - - [32, 256, 8, 32, 32, 32, 32, 256]
    - [0, 537.0]
  - - [32, 256, 8, 64, 32, 32, 32, 256]
    - [0, 753.0]
  - - [32, 256, 8, 128, 32, 32, 32, 256]
    - [0, 923.0]
  - - [32, 256, 8, 256, 32, 32, 32, 256]
    - [2, 1072.0]
  - - [32, 256, 8, 512, 32, 32, 32, 256]
    - [2, 1173.0]
  - - [32, 512, 8, 32, 32, 32, 32, 512]
    - [0, 999.0]
  - - [32, 512, 8, 64, 32, 32, 32, 512]
    - [0, 1376.0]
  - - [32, 512, 8, 128, 32, 32, 32, 512]
    - [0, 1718.0]
  - - [32, 512, 8, 256, 32, 32, 32, 512]
    - [2, 2065.0]
  - - [32, 512, 8, 512, 32, 32, 32, 512]
    - [2, 2301.0]
  - - [64, 32, 8, 32, 64, 64, 64, 32]
    - [0, 140.0]
  - - [64, 32, 8, 64, 64, 64, 64, 32]
    - [0, 191.0]
  - - [64, 32, 8, 128, 64, 64, 64, 32]
    - [0, 238.0]
  - - [64, 32, 8, 256, 64, 64, 64, 32]
    - [2, 272.0]
  - - [64, 32, 8, 512, 64, 64, 64, 32]
    - [2, 291.0]
  - - [64, 64, 8, 32, 64, 64, 64, 64]
    - [0, 278.0]
  - - [64, 64, 8, 64, 64, 64, 64, 64]
    - [6, 386.0]
  - - [64, 64, 8, 128, 64, 64, 64, 64]
    - [0, 479.0]
  - - [64, 64, 8, 256, 64, 64, 64, 64]
    - [2, 544.0]
  - - [64, 64, 8, 512, 64, 64, 64, 64]
    - [2, 583.0]
  - - [64, 128, 8, 32, 64, 64, 64, 128]
    - [0, 543.0]
  - - [64, 128, 8, 64, 64, 64, 64, 128]
    - [0, 755.0]
  - - [64, 128, 8, 128, 64, 64, 64, 128]
    - [0, 942.0]
  - - [64, 128, 8, 256, 64, 64, 64, 128]
    - [8, 1073.0]
  - - [64, 128, 8, 512, 64, 64, 64, 128]
    - [2, 1176.0]
  - - [64, 256, 8, 32, 64, 64, 64, 256]
    - [1, 1012.0]
  - - [64, 256, 8, 64, 64, 64, 64, 256]
    - [0, 1425.0]
  - - [64, 256, 8, 128, 64, 64, 64, 256]
    - [0, 1776.0]
  - - [64, 256, 8, 256, 64, 64, 64, 256]
    - [2, 2065.0]
  - - [64, 256, 8, 512, 64, 64, 64, 256]
    - [2, 2301.0]
  - - [64, 512, 8, 32, 64, 64, 64, 512]
    - [1, 1719.0]
  - - [64, 512, 8, 64, 64, 64, 64, 512]
    - [1, 2405.0]
  - - [64, 512, 8, 128, 64, 64, 64, 512]
    - [3, 3234.0]
  - - [64, 512, 8, 256, 64, 64, 64, 512]
    - [9, 3940.0]
  - - [64, 512, 8, 512, 64, 64, 64, 512]
    - [3, 4468.0]
  - - [128, 32, 8, 32, 128, 128, 128, 32]
    - [0, 282.0]
  - - [128, 32, 8, 64, 128, 128, 128, 32]
    - [0, 387.0]
  - - [128, 32, 8, 128, 128, 128, 128, 32]
    - [0, 477.0]
  - - [128, 32, 8, 256, 128, 128, 128, 32]
    - [2, 544.0]
  - - [128, 32, 8, 512, 128, 128, 128, 32]
    - [8, 582.0]
  - - [128, 64, 8, 32, 128, 128, 128, 64]
    - [0, 542.0]
  - - [128, 64, 8, 64, 128, 128, 128, 64]
    - [0, 752.0]
  - - [128, 64, 8, 128, 128, 128, 128, 64]
    - [0, 938.0]
  - - [128, 64, 8, 256, 128, 128, 128, 64]
    - [2, 1072.0]
  - - [128, 64, 8, 512, 128, 128, 128, 64]
    - [2, 1177.0]
  - - [128, 128, 8, 32, 128, 128, 128, 128]
    - [0, 995.0]
  - - [128, 128, 8, 64, 128, 128, 128, 128]
    - [0, 1432.0]
  - - [128, 128, 8, 128, 128, 128, 128, 128]
    - [0, 1797.0]
  - - [128, 128, 8, 256, 128, 128, 128, 128]
    - [2, 2075.0]
  - - [128, 128, 8, 512, 128, 128, 128, 128]
    - [2, 2303.0]
  - - [128, 256, 8, 32, 128, 128, 128, 256]
    - [4, 1742.0]
  - - [128, 256, 8, 64, 128, 128, 128, 256]
    - [0, 2527.0]
  - - [128, 256, 8, 128, 128, 128, 128, 256]
    - [3, 3161.0]
  - - [128, 256, 8, 256, 128, 128, 128, 256]
    - [3, 3940.0]
  - - [128, 256, 8, 512, 128, 128, 128, 256]
    - [3, 4443.0]
  - - [128, 512, 8, 32, 128, 128, 128, 512]
    - [4, 2602.0]
  - - [128, 512, 8, 64, 128, 128, 128, 512]
    - [1, 3489.0]
  - - [128, 512, 8, 128, 128, 128, 128, 512]
    - [3, 4552.0]
  - - [128, 512, 8, 256, 128, 128, 128, 512]
    - [3, 5353.0]
  - - [128, 512, 8, 512, 128, 128, 128, 512]
    - [1, 5951.0]
  - - [256, 32, 8, 32, 256, 256, 256, 32]
    - [0, 524.0]
  - - [256, 32, 8, 64, 256, 256, 256, 32]
    - [0, 734.0]
  - - [256, 32, 8, 128, 256, 256, 256, 32]
    - [0, 906.0]
  - - [256, 32, 8, 256, 256, 256, 256, 32]
    - [2, 1062.0]
  - - [256, 32, 8, 512, 256, 256, 256, 32]
    - [8, 1166.0]
  - - [256, 64, 8, 32, 256, 256, 256, 64]
    - [1, 982.0]
  - - [256, 64, 8, 64, 256, 256, 256, 64]
    - [1, 1393.0]
  - - [256, 64, 8, 128, 256, 256, 256, 64]
    - [0, 1745.0]
  - - [256, 64, 8, 256, 256, 256, 256, 64]
    - [2, 2045.0]
  - - [256, 64, 8, 512, 256, 256, 256, 64]
    - [2, 2283.0]
  - - [256, 128, 8, 32, 256, 256, 256, 128]
    - [4, 1675.0]
  - - [256, 128, 8, 64, 256, 256, 256, 128]
    - [1, 2439.0]
  - - [256, 128, 8, 128, 256, 256, 256, 128]
    - [6, 3219.0]
  - - [256, 128, 8, 256, 256, 256, 256, 128]
    - [3, 3850.0]
  - - [256, 128, 8, 512, 256, 256, 256, 128]
    - [3, 4399.0]
  - - [256, 256, 8, 32, 256, 256, 256, 256]
    - [4, 2548.0]
  - - [256, 256, 8, 64, 256, 256, 256, 256]
    - [10, 3610.0]
  - - [256, 256, 8, 128, 256, 256, 256, 256]
    - [1, 4483.0]
  - - [256, 256, 8, 256, 256, 256, 256, 256]
    - [1, 5319.0]
  - - [256, 256, 8, 512, 256, 256, 256, 256]
    - [1, 5882.0]
  - - [256, 512, 8, 32, 256, 256, 256, 512]
    - [5, 2921.0]
  - - [256, 512, 8, 64, 256, 256, 256, 512]
    - [4, 3966.0]
  - - [256, 512, 8, 128, 256, 256, 256, 512]
    - [1, 4883.0]
  - - [256, 512, 8, 256, 256, 256, 256, 512]
    - [3, 5518.0]
  - - [256, 512, 8, 512, 256, 256, 256, 512]
    - [3, 5904.0]
  - - [512, 32, 8, 32, 512, 512, 512, 32]
    - [4, 853.0]
  - - [512, 32, 8, 64, 512, 512, 512, 32]
    - [0, 1209.0]
  - - [512, 32, 8, 128, 512, 512, 512, 32]
    - [2, 1607.0]
  - - [512, 32, 8, 256, 512, 512, 512, 32]
    - [2, 1992.0]
  - - [512, 32, 8, 512, 512, 512, 512, 32]
    - [2, 2244.0]
  - - [512, 64, 8, 32, 512, 512, 512, 64]
    - [1, 1608.0]
  - - [512, 64, 8, 64, 512, 512, 512, 64]
    - [3, 2255.0]
  - - [512, 64, 8, 128, 512, 512, 512, 64]
    - [3, 3053.0]
  - - [512, 64, 8, 256, 512, 512, 512, 64]
    - [9, 3763.0]
  - - [512, 64, 8, 512, 512, 512, 512, 64]
    - [3, 4346.0]
  - - [512, 128, 8, 32, 512, 512, 512, 128]
    - [1, 2289.0]
  - - [512, 128, 8, 64, 512, 512, 512, 128]
    - [7, 3413.0]
  - - [512, 128, 8, 128, 512, 512, 512, 128]
    - [1, 4469.0]
  - - [512, 128, 8, 256, 512, 512, 512, 128]
    - [7, 5164.0]
  - - [512, 128, 8, 512, 512, 512, 512, 128]
    - [7, 5785.0]
  - - [512, 256, 8, 32, 512, 512, 512, 256]
    - [10, 2722.0]
  - - [512, 256, 8, 64, 512, 512, 512, 256]
    - [7, 3789.0]
  - - [512, 256, 8, 128, 512, 512, 512, 256]
    - [3, 4809.0]
  - - [512, 256, 8, 256, 512, 512, 512, 256]
    - [3, 5467.0]
  - - [512, 256, 8, 512, 512, 512, 512, 256]
    - [9, 5754.0]
  - - [512, 512, 8, 32, 512, 512, 512, 512]
    - [4, 3260.0]
  - - [512, 512, 8, 64, 512, 512, 512, 512]
    - [1, 4401.0]
  - - [512, 512, 8, 128, 512, 512, 512, 512]
    - [1, 5306.0]
  - - [512, 512, 8, 256, 512, 512, 512, 512]
    - [1, 5689.0]
  - - [512, 512, 8, 512, 512, 512, 512, 512]
    - [3, 5754.0]
- null
