library/src/blas3/Tensile/Logic/aldebaran/vega20_Cijk_Ailk_Bljk_HBH_GB.yaml
- {MinimumRequiredVersion: 4.26.0}
- vega20
- gfx906
- [Device 66a0, Device 66a1, Device 66a7, Device 66af, Vega 20]
    SolutionIndex: 0
    SolutionNameMin: Cijk_Ailk_Bljk_HBH_GB_MT32x32x8_SN_GRVW4_LRVW4_TT4_4_VW4_WG8_8_1_WGM1
    SolutionIndex: 1
    SolutionNameMin: Cijk_Ailk_Bljk_HBH_GB_MT32x32x16_SN_GRVW4_LRVW4_TT4_4_VW4_WG8_8_1_WGM1
    SolutionIndex: 2
    SolutionNameMin: Cijk_Ailk_Bljk_HBH_GB_MT64x64x16_SN_GRVW4_LRVW4_TT4_4_VW4_WG16_16_1_WGM1
    SolutionIndex: 3
    SolutionNameMin: Cijk_Ailk_Bljk_HBH_GB_MT64x64x8_SN_GRVW2_LRVW2_TT4_4_VW2_WG16_16_1_WGM1
    SolutionIndex: 4
    SolutionNameMin: Cijk_Ailk_Bljk_HBH_GB_MT128x64x8_SN_GRVW2_LRVW2_TT8_4_VW2_WG16_16_1_WGM1
    SolutionIndex: 5
    SolutionNameMin: Cijk_Ailk_Bljk_HBH_GB_MT32x32x8_SN_GRVW4_LRVW4_TT4_4_VW4_WG8_8_1_WGM8
    SolutionIndex: 6
    SolutionNameMin: Cijk_Ailk_Bljk_HBH_GB_MT32x32x16_SN_GRVW4_LRVW4_TT4_4_VW4_WG8_8_1_WGM8
    SolutionIndex: 7
    SolutionNameMin: Cijk_Ailk_Bljk_HBH_GB_MT64x64x16_SN_GRVW4_LRVW4_TT4_4_VW4_WG16_16_1_WGM8
    SolutionIndex: 8
    SolutionNameMin: Cijk_Ailk_Bljk_HBH_GB_MT64x64x8_SN_GRVW2_LRVW2_TT4_4_VW2_WG16_16_1_WGM8
- - - [32, 32, 8, 32, 32, 32, 32, 32]
    - [5, 77.0]
  - - [32, 32, 8, 64, 32, 32, 32, 64]
    - [0, 116.0]
  - - [32, 32, 8, 128, 32, 32, 32, 128]
    - [5, 157.0]
  - - [32, 32, 8, 256, 32, 32, 32, 256]
    - [5, 190.0]
  - - [32, 32, 8, 512, 32, 32, 32, 512]
    - [1, 214.0]
  - - [32, 64, 8, 32, 32, 32, 32, 32]
    - [0, 165.0]
  - - [32, 64, 8, 64, 32, 32, 32, 64]
    - [0, 247.0]
  - - [32, 64, 8, 128, 32, 32, 32, 128]
    - [0, 324.0]
  - - [32, 64, 8, 256, 32, 32, 32, 256]
    - [5, 387.0]
  - - [32, 64, 8, 512, 32, 32, 32, 512]
    - [6, 437.0]
  - - [32, 128, 8, 32, 32, 32, 32, 32]
    - [0, 342.0]
  - - [32, 128, 8, 64, 32, 32, 32, 64]
    - [5, 503.0]
  - - [32, 128, 8, 128, 32, 32, 32, 128]
    - [0, 659.0]
  - - [32, 128, 8, 256, 32, 32, 32, 256]
    - [6, 785.0]
  - - [32, 128, 8, 512, 32, 32, 32, 512]
    - [6, 883.0]
  - - [32, 256, 8, 32, 32, 32, 32, 32]
    - [0, 681.0]
  - - [32, 256, 8, 64, 32, 32, 32, 64]
    - [5, 1004.0]
  - - [32, 256, 8, 128, 32, 32, 32, 128]
    - [0, 1317.0]
  - - [32, 256, 8, 256, 32, 32, 32, 256]
    - [6, 1576.0]
  - - [32, 256, 8, 512, 32, 32, 32, 512]
    - [6, 1743.0]
  - - [32, 512, 8, 32, 32, 32, 32, 32]
    - [5, 1334.0]
  - - [32, 512, 8, 64, 32, 32, 32, 64]
    - [0, 1953.0]
  - - [32, 512, 8, 128, 32, 32, 32, 128]
    - [5, 2570.0]
  - - [32, 512, 8, 256, 32, 32, 32, 256]
    - [6, 3033.0]
  - - [32, 512, 8, 512, 32, 32, 32, 512]
    - [1, 3378.0]
  - - [64, 32, 8, 32, 64, 64, 64, 32]
    - [0, 163.0]
  - - [64, 32, 8, 64, 64, 64, 64, 64]
    - [0, 245.0]
  - - [64, 32, 8, 128, 64, 64, 64, 128]
    - [0, 326.0]
  - - [64, 32, 8, 256, 64, 64, 64, 256]
    - [5, 389.0]
  - - [64, 32, 8, 512, 64, 64, 64, 512]
    - [6, 437.0]
  - - [64, 64, 8, 32, 64, 64, 64, 32]
    - [0, 342.0]
  - - [64, 64, 8, 64, 64, 64, 64, 64]
    - [0, 508.0]
  - - [64, 64, 8, 128, 64, 64, 64, 128]
    - [0, 660.0]
  - - [64, 64, 8, 256, 64, 64, 64, 256]
    - [6, 788.0]
  - - [64, 64, 8, 512, 64, 64, 64, 512]
    - [6, 885.0]
  - - [64, 128, 8, 32, 64, 64, 64, 32]
    - [0, 686.0]
  - - [64, 128, 8, 64, 64, 64, 64, 64]
    - [0, 1016.0]
  - - [64, 128, 8, 128, 64, 64, 64, 128]
    - [0, 1324.0]
  - - [64, 128, 8, 256, 64, 64, 64, 256]
    - [1, 1580.0]
  - - [64, 128, 8, 512, 64, 64, 64, 512]
    - [6, 1770.0]
  - - [64, 256, 8, 32, 64, 64, 64, 32]
    - [0, 1348.0]
  - - [64, 256, 8, 64, 64, 64, 64, 64]
    - [0, 1982.0]
  - - [64, 256, 8, 128, 64, 64, 64, 128]
    - [5, 2612.0]
  - - [64, 256, 8, 256, 64, 64, 64, 256]
    - [6, 3128.0]
  - - [64, 256, 8, 512, 64, 64, 64, 512]
    - [6, 3475.0]
  - - [64, 512, 8, 32, 64, 64, 64, 32]
    - [0, 2527.0]
  - - [64, 512, 8, 64, 64, 64, 64, 64]
    - [0, 3738.0]
  - - [64, 512, 8, 128, 64, 64, 64, 128]
    - [5, 4952.0]
  - - [64, 512, 8, 256, 64, 64, 64, 256]
    - [1, 5933.0]
  - - [64, 512, 8, 512, 64, 64, 64, 512]
    - [1, 6597.0]
  - - [128, 32, 8, 32, 128, 128, 128, 32]
    - [0, 343.0]
  - - [128, 32, 8, 64, 128, 128, 128, 64]
    - [0, 507.0]
  - - [128, 32, 8, 128, 128, 128, 128, 128]
    - [0, 664.0]
  - - [128, 32, 8, 256, 128, 128, 128, 256]
    - [6, 786.0]
  - - [128, 32, 8, 512, 128, 128, 128, 512]
    - [6, 887.0]
  - - [128, 64, 8, 32, 128, 128, 128, 32]
    - [5, 679.0]
  - - [128, 64, 8, 64, 128, 128, 128, 64]
    - [0, 1016.0]
  - - [128, 64, 8, 128, 128, 128, 128, 128]
    - [0, 1326.0]
  - - [128, 64, 8, 256, 128, 128, 128, 256]
    - [6, 1580.0]
  - - [128, 64, 8, 512, 128, 128, 128, 512]
    - [6, 1774.0]
  - - [128, 128, 8, 32, 128, 128, 128, 32]
    - [5, 1331.0]
  - - [128, 128, 8, 64, 128, 128, 128, 64]
    - [0, 2013.0]
  - - [128, 128, 8, 128, 128, 128, 128, 128]
    - [0, 2621.0]
  - - [128, 128, 8, 256, 128, 128, 128, 256]
    - [6, 3142.0]
  - - [128, 128, 8, 512, 128, 128, 128, 512]
    - [6, 3523.0]
  - - [128, 256, 8, 32, 128, 128, 128, 32]
    - [5, 2615.0]
  - - [128, 256, 8, 64, 128, 128, 128, 64]
    - [0, 3876.0]
  - - [128, 256, 8, 128, 128, 128, 128, 128]
    - [0, 5066.0]
  - - [128, 256, 8, 256, 128, 128, 128, 256]
    - [1, 6074.0]
  - - [128, 256, 8, 512, 128, 128, 128, 512]
    - [1, 6754.0]
  - - [128, 512, 8, 32, 128, 128, 128, 32]
    - [3, 4342.0]
  - - [128, 512, 8, 64, 128, 128, 128, 64]
    - [8, 6114.0]
  - - [128, 512, 8, 128, 128, 128, 128, 128]
    - [7, 7774.0]
  - - [128, 512, 8, 256, 128, 128, 128, 256]
    - [7, 9059.0]
  - - [128, 512, 8, 512, 128, 128, 128, 512]
    - [1, 9881.0]
  - - [256, 32, 8, 32, 256, 256, 256, 32]
    - [0, 703.0]
  - - [256, 32, 8, 64, 256, 256, 256, 64]
    - [0, 1024.0]
  - - [256, 32, 8, 128, 256, 256, 256, 128]
    - [5, 1332.0]
  - - [256, 32, 8, 256, 256, 256, 256, 256]
    - [1, 1585.0]
  - - [256, 32, 8, 512, 256, 256, 256, 512]
    - [6, 1765.0]
  - - [256, 64, 8, 32, 256, 256, 256, 32]
    - [0, 1348.0]
  - - [256, 64, 8, 64, 256, 256, 256, 64]
    - [5, 1975.0]
  - - [256, 64, 8, 128, 256, 256, 256, 128]
    - [5, 2605.0]
  - - [256, 64, 8, 256, 256, 256, 256, 256]
    - [1, 3125.0]
  - - [256, 64, 8, 512, 256, 256, 256, 512]
    - [6, 3494.0]
  - - [256, 128, 8, 32, 256, 256, 256, 32]
    - [5, 2527.0]
  - - [256, 128, 8, 64, 256, 256, 256, 64]
    - [0, 3806.0]
  - - [256, 128, 8, 128, 256, 256, 256, 128]
    - [5, 5078.0]
  - - [256, 128, 8, 256, 256, 256, 256, 256]
    - [1, 6026.0]
  - - [256, 128, 8, 512, 256, 256, 256, 512]
    - [1, 6751.0]
  - - [256, 256, 8, 32, 256, 256, 256, 32]
    - [5, 4342.0]
  - - [256, 256, 8, 64, 256, 256, 256, 64]
    - [3, 6141.0]
  - - [256, 256, 8, 128, 256, 256, 256, 128]
    - [3, 7753.0]
  - - [256, 256, 8, 256, 256, 256, 256, 256]
    - [7, 9079.0]
  - - [256, 256, 8, 512, 256, 256, 256, 512]
    - [1, 9930.0]
  - - [256, 512, 8, 32, 256, 256, 256, 32]
    - [3, 6493.0]
  - - [256, 512, 8, 64, 256, 256, 256, 64]
    - [3, 8729.0]
  - - [256, 512, 8, 128, 256, 256, 256, 128]
    - [7, 10434.0]
  - - [256, 512, 8, 256, 256, 256, 256, 256]
    - [7, 11547.0]
  - - [256, 512, 8, 512, 256, 256, 256, 512]
    - [7, 12345.0]
  - - [512, 32, 8, 32, 512, 512, 512, 32]
    - [0, 1351.0]
  - - [512, 32, 8, 64, 512, 512, 512, 64]
    - [5, 1960.0]
  - - [512, 32, 8, 128, 512, 512, 512, 128]
    - [0, 2592.0]
  - - [512, 32, 8, 256, 512, 512, 512, 256]
    - [6, 3089.0]
  - - [512, 32, 8, 512, 512, 512, 512, 512]
    - [6, 3479.0]
  - - [512, 64, 8, 32, 512, 512, 512, 32]
    - [5, 2545.0]
  - - [512, 64, 8, 64, 512, 512, 512, 64]
    - [5, 3772.0]
  - - [512, 64, 8, 128, 512, 512, 512, 128]
    - [5, 4987.0]
  - - [512, 64, 8, 256, 512, 512, 512, 256]
    - [6, 5971.0]
  - - [512, 64, 8, 512, 512, 512, 512, 512]
    - [1, 6724.0]
  - - [512, 128, 8, 32, 512, 512, 512, 32]
    - [5, 4333.0]
  - - [512, 128, 8, 64, 512, 512, 512, 64]
    - [5, 6070.0]
  - - [512, 128, 8, 128, 512, 512, 512, 128]
    - [6, 7717.0]
  - - [512, 128, 8, 256, 512, 512, 512, 256]
    - [7, 9035.0]
  - - [512, 128, 8, 512, 512, 512, 512, 512]
    - [1, 9892.0]
  - - [512, 256, 8, 32, 512, 512, 512, 32]
    - [3, 6503.0]
  - - [512, 256, 8, 64, 512, 512, 512, 64]
    - [8, 8639.0]
  - - [512, 256, 8, 128, 512, 512, 512, 128]
    - [7, 10447.0]
  - - [512, 256, 8, 256, 512, 512, 512, 256]
    - [7, 11551.0]
  - - [512, 256, 8, 512, 512, 512, 512, 512]
    - [7, 12350.0]
  - - [512, 512, 8, 32, 512, 512, 512, 32]
    - [4, 8004.0]
  - - [512, 512, 8, 64, 512, 512, 512, 64]
    - [4, 10058.0]
  - - [512, 512, 8, 128, 512, 512, 512, 128]
    - [7, 11367.0]
  - - [512, 512, 8, 256, 512, 512, 512, 256]
    - [7, 12275.0]
  - - [512, 512, 8, 512, 512, 512, 512, 512]
    - [2, 12664.0]
- null
