library/src/blas3/Tensile/Logic/aldebaran/vega10_Cijk_Alik_Bjlk_HSS_BH.yaml
- {MinimumRequiredVersion: 4.24.0}
- vega10
- gfx900
- [Device 6863, Device 6862, Device 687f, Device 6860, Device 6861, 'Vega 10 XTX [Radeon
    SolutionIndex: 0
    SolutionNameMin: Cijk_Alik_Bjlk_HSS_BH_MT64x128x8_SE_GSU1_PGR1_PLR1_TT4_8_VAW2
    SolutionIndex: 1
    SolutionNameMin: Cijk_Alik_Bjlk_HSS_BH_MT32x64x8_SE_GSU1_PGR1_PLR1_TT4_8_VAW2
    SolutionIndex: 2
    SolutionNameMin: Cijk_Alik_Bjlk_HSS_BH_MT32x64x8_SE_GSU1_PGR1_PLR1_TT2_4_VAW2
    SolutionIndex: 3
    SolutionNameMin: Cijk_Alik_Bjlk_HSS_BH_MT64x128x8_SE_GSU1_PGR1_PLR1_TT4_8_VAW2
    SolutionIndex: 4
    SolutionNameMin: Cijk_Alik_Bjlk_HSS_BH_MT8x64x16_SE_GSU1_PGR1_PLR1_TT2_2_VAW2
    SolutionIndex: 5
    SolutionNameMin: Cijk_Alik_Bjlk_HSS_BH_MT16x16x16_SE_GSU1_PGR1_PLR1_TT2_2_VAW2
    SolutionIndex: 6
    SolutionNameMin: Cijk_Alik_Bjlk_HSS_BH_MT16x32x16_SE_GSU1_PGR1_PLR1_TT2_4_VAW2
    SolutionIndex: 7
    SolutionNameMin: Cijk_Alik_Bjlk_HSS_BH_MT64x64x16_SE_GSU1_PGR1_PLR1_TT8_8_VAW2
    SolutionIndex: 8
    SolutionNameMin: Cijk_Alik_Bjlk_HSS_BH_MT16x32x16_SE_GSU1_PGR1_PLR1_TT2_2_VAW2
    SolutionIndex: 9
    SolutionNameMin: Cijk_Alik_Bjlk_HSS_BH_MT16x64x16_SE_GSU1_PGR1_PLR1_TT2_4_VAW2
    SolutionIndex: 10
    SolutionNameMin: Cijk_Alik_Bjlk_HSS_BH_MT16x64x16_SE_GSU1_PGR1_PLR1_TT2_2_VAW2
    SolutionIndex: 11
    SolutionNameMin: Cijk_Alik_Bjlk_HSS_BH_MT16x128x16_SE_GSU1_PGR1_PLR1_TT2_4_VAW2
    SolutionIndex: 12
    SolutionNameMin: Cijk_Alik_Bjlk_HSS_BH_MT32x128x16_SE_GSU1_PGR1_PLR1_TT4_4_VAW2
    SolutionIndex: 13
    SolutionNameMin: Cijk_Alik_Bjlk_HSS_BH_MT32x32x16_SE_GSU1_PGR1_PLR1_TT2_2_VAW2
    SolutionIndex: 14
    SolutionNameMin: Cijk_Alik_Bjlk_HSS_BH_MT32x64x16_SE_GSU1_PGR1_PLR1_TT2_4_VAW2
    SolutionIndex: 15
    SolutionNameMin: Cijk_Alik_Bjlk_HSS_BH_MT64x64x16_SE_GSU1_PGR1_PLR1_TT4_4_VAW2
    SolutionIndex: 16
    SolutionNameMin: Cijk_Alik_Bjlk_HSS_BH_MT64x128x16_SE_GSU1_PGR1_PLR1_TT4_8_VAW2
    SolutionIndex: 17
    SolutionNameMin: Cijk_Alik_Bjlk_HSS_BH_MT64x32x16_SE_GSU1_PGR1_PLR1_TT2_4_VAW2
    SolutionIndex: 18
    SolutionNameMin: Cijk_Alik_Bjlk_HSS_BH_MT8x64x16_SE_GSU1_PGR1_PLR1_TT2_2_VAW2
    SolutionIndex: 19
    SolutionNameMin: Cijk_Alik_Bjlk_HSS_BH_MT32x32x16_SE_GSU1_PGR1_PLR1_TT4_4_VAW2
    SolutionIndex: 20
    SolutionNameMin: Cijk_Alik_Bjlk_HSS_BH_MT16x32x16_SE_GSU1_PGR1_PLR1_TT2_2_VAW2
    SolutionIndex: 21
    SolutionNameMin: Cijk_Alik_Bjlk_HSS_BH_MT16x64x16_SE_GSU1_PGR1_PLR1_TT2_4_VAW2
    SolutionIndex: 22
    SolutionNameMin: Cijk_Alik_Bjlk_HSS_BH_MT32x64x16_SE_GSU1_PGR1_PLR1_TT4_4_VAW2
    SolutionIndex: 23
    SolutionNameMin: Cijk_Alik_Bjlk_HSS_BH_MT16x128x16_SE_GSU1_PGR1_PLR1_TT2_4_VAW2
    SolutionIndex: 24
    SolutionNameMin: Cijk_Alik_Bjlk_HSS_BH_MT32x128x16_SE_GSU1_PGR1_PLR1_TT4_4_VAW2
    SolutionIndex: 25
    SolutionNameMin: Cijk_Alik_Bjlk_HSS_BH_MT32x64x16_SE_GSU1_PGR1_PLR1_TT2_4_VAW2
    SolutionIndex: 26
    SolutionNameMin: Cijk_Alik_Bjlk_HSS_BH_MT64x64x16_SE_GSU1_PGR1_PLR1_TT4_4_VAW2
    SolutionIndex: 27
    SolutionNameMin: Cijk_Alik_Bjlk_HSS_BH_MT64x128x16_SE_GSU1_PGR1_PLR1_TT4_8_VAW2
    SolutionIndex: 28
    SolutionNameMin: Cijk_Alik_Bjlk_HSS_BH_MT128x128x16_SE_GSU1_PGR1_PLR1_TT8_8_VAW2
    SolutionIndex: 29
    SolutionNameMin: Cijk_Alik_Bjlk_HSS_BH_MT16x16x24_SE_GSU1_PGR1_PLR1_TT2_2_VAW2
    SolutionIndex: 30
    SolutionNameMin: Cijk_Alik_Bjlk_HSS_BH_MT16x32x24_SE_GSU1_PGR1_PLR1_TT2_4_VAW2
    SolutionIndex: 31
    SolutionNameMin: Cijk_Alik_Bjlk_HSS_BH_MT16x32x24_SE_GSU1_PGR1_PLR1_TT2_4_VAW2
    SolutionIndex: 32
    SolutionNameMin: Cijk_Alik_Bjlk_HSS_BH_MT8x64x32_SE_GSU1_PGR1_PLR1_TT2_2_VAW2
    SolutionIndex: 33
    SolutionNameMin: Cijk_Alik_Bjlk_HSS_BH_MT16x16x32_SE_GSU1_PGR1_PLR1_TT2_2_VAW2
    SolutionIndex: 34
    SolutionNameMin: Cijk_Alik_Bjlk_HSS_BH_MT16x64x32_SE_GSU1_PGR1_PLR1_TT2_4_VAW2
    SolutionIndex: 35
    SolutionNameMin: Cijk_Alik_Bjlk_HSS_BH_MT16x64x32_SE_GSU1_PGR1_PLR1_TT2_2_VAW2
    SolutionIndex: 36
    SolutionNameMin: Cijk_Alik_Bjlk_HSS_BH_MT16x128x32_SE_GSU1_PGR1_PLR1_TT2_4_VAW2
    SolutionIndex: 37
    SolutionNameMin: Cijk_Alik_Bjlk_HSS_BH_MT32x64x32_SE_GSU1_PGR1_PLR1_TT2_4_VAW2
    SolutionIndex: 38
    SolutionNameMin: Cijk_Alik_Bjlk_HSS_BH_MT64x64x32_SE_GSU1_PGR1_PLR1_TT4_4_VAW2
    SolutionIndex: 39
    SolutionNameMin: Cijk_Alik_Bjlk_HSS_BH_MT8x64x32_SE_GSU1_PGR1_PLR1_TT2_2_VAW2
    SolutionIndex: 40
    SolutionNameMin: Cijk_Alik_Bjlk_HSS_BH_MT16x16x32_SE_GSU1_PGR1_PLR1_TT2_2_VAW2
    SolutionIndex: 41
    SolutionNameMin: Cijk_Alik_Bjlk_HSS_BH_MT16x32x32_SE_GSU1_PGR1_PLR1_TT2_2_VAW2
    SolutionIndex: 42
    SolutionNameMin: Cijk_Alik_Bjlk_HSS_BH_MT16x64x32_SE_GSU1_PGR1_PLR1_TT2_2_VAW2
    SolutionIndex: 43
    SolutionNameMin: Cijk_Alik_Bjlk_HSS_BH_MT16x128x32_SE_GSU1_PGR1_PLR1_TT2_4_VAW2
    SolutionIndex: 44
    SolutionNameMin: Cijk_Alik_Bjlk_HSS_BH_MT64x64x32_SE_GSU1_PGR1_PLR1_TT4_4_VAW2
    SolutionIndex: 45
    SolutionNameMin: Cijk_Alik_Bjlk_HSS_BH_MT64x128x32_SE_GSU1_PGR1_PLR1_TT4_8_VAW2
    SolutionIndex: 46
    SolutionNameMin: Cijk_Alik_Bjlk_HSS_BH_MT8x64x64_SE_GSU1_PGR1_PLR1_TT2_2_VAW2
    SolutionIndex: 47
    SolutionNameMin: Cijk_Alik_Bjlk_HSS_BH_MT32x64x8_SE_GSU1_PGR0_PLR1_TT4_8_VAW2
    SolutionIndex: 48
    SolutionNameMin: Cijk_Alik_Bjlk_HSS_BH_MT32x64x16_SE_GSU1_PGR0_PLR1_TT4_8_VAW2
    SolutionIndex: 49
    SolutionNameMin: Cijk_Alik_Bjlk_HSS_BH_MT64x48x16_SE_GSU1_PGR1_PLR1_TT8_6_VAW2
    SolutionIndex: 50
    SolutionNameMin: Cijk_Alik_Bjlk_HSS_BH_MT64x64x16_SE_GSU1_PGR0_PLR1_TT4_4_VAW2
    SolutionIndex: 51
    SolutionNameMin: Cijk_Alik_Bjlk_HSS_BH_MT96x128x16_SE_GSU1_PGR1_PLR1_TT6_8_VAW2
    SolutionIndex: 52
    SolutionNameMin: Cijk_Alik_Bjlk_HSS_BH_MT128x64x16_SE_GSU1_PGR1_PLR1_TT8_4_VAW2
    SolutionIndex: 53
    SolutionNameMin: Cijk_Alik_Bjlk_HSS_BH_MT128x96x16_SE_GSU1_PGR1_PLR1_TT8_6_VAW2
    SolutionIndex: 54
    SolutionNameMin: Cijk_Alik_Bjlk_HSS_BH_MT48x64x16_SE_GSU1_PGR0_PLR1_TT6_8_VAW2
    SolutionIndex: 55
    SolutionNameMin: Cijk_Alik_Bjlk_HSS_BH_MT64x64x16_SE_GSU1_PGR0_PLR1_TT4_4_VAW2
    SolutionIndex: 56
    SolutionNameMin: Cijk_Alik_Bjlk_HSS_BH_MT96x128x16_SE_GSU1_PGR1_PLR1_TT6_8_VAW2
    SolutionIndex: 57
    SolutionNameMin: Cijk_Alik_Bjlk_HSS_BH_MT128x64x16_SE_GSU1_PGR1_PLR1_TT8_4_VAW2
    SolutionIndex: 58
    SolutionNameMin: Cijk_Alik_Bjlk_HSS_BH_MT32x64x24_SE_GSU1_PGR0_PLR1_TT4_8_VAW2
    SolutionIndex: 59
    SolutionNameMin: Cijk_Alik_Bjlk_HSS_BH_MT32x64x32_SE_GSU1_PGR0_PLR1_TT4_8_VAW2
    SolutionIndex: 60
    SolutionNameMin: Cijk_Alik_Bjlk_HSS_BH_MT64x64x4_SE_GSU1_PGR0_PLR0_TT4_4_VAW2
    SolutionIndex: 61
    SolutionNameMin: Cijk_Alik_Bjlk_HSS_BH_MT64x128x4_SE_GSU1_PGR1_PLR0_TT4_8_VAW2
    SolutionIndex: 62
    SolutionNameMin: Cijk_Alik_Bjlk_HSS_BH_MT64x64x4_SE_GSU1_PGR1_PLR0_TT4_4_VAW2
    SolutionIndex: 63
    SolutionNameMin: Cijk_Alik_Bjlk_HSS_BH_MT64x64x4_SE_GSU1_PGR0_PLR1_TT4_4_VAW2
    SolutionIndex: 64
    SolutionNameMin: Cijk_Alik_Bjlk_HSS_BH_MT64x128x4_SE_GSU1_PGR1_PLR1_TT4_8_VAW2
    SolutionIndex: 65
    SolutionNameMin: Cijk_Alik_Bjlk_HSS_BH_MT64x64x4_SE_GSU1_PGR1_PLR1_TT4_4_VAW2
    SolutionIndex: 66
    SolutionNameMin: Cijk_Alik_Bjlk_HSS_BH_MT64x128x8_SE_GSU1_PGR0_PLR0_TT4_8_VAW2
    SolutionIndex: 67
    SolutionNameMin: Cijk_Alik_Bjlk_HSS_BH_MT64x64x8_SE_GSU1_PGR0_PLR0_TT4_4_VAW2
    SolutionIndex: 68
    SolutionNameMin: Cijk_Alik_Bjlk_HSS_BH_MT128x128x8_SE_GSU1_PGR1_PLR0_TT8_8_VAW2
    SolutionIndex: 69
    SolutionNameMin: Cijk_Alik_Bjlk_HSS_BH_MT64x64x8_SE_GSU1_PGR1_PLR0_TT4_4_VAW2
    SolutionIndex: 70
    SolutionNameMin: Cijk_Alik_Bjlk_HSS_BH_MT64x64x8_SE_GSU1_PGR0_PLR1_TT4_4_VAW2
    SolutionIndex: 71
    SolutionNameMin: Cijk_Alik_Bjlk_HSS_BH_MT64x64x8_SE_GSU1_PGR1_PLR1_TT4_4_VAW2
    SolutionIndex: 72
    SolutionNameMin: Cijk_Alik_Bjlk_HSS_BH_MT64x64x16_SE_GSU1_PGR0_PLR0_TT4_4_VAW2
    SolutionIndex: 73
    SolutionNameMin: Cijk_Alik_Bjlk_HSS_BH_MT64x64x16_SE_GSU1_PGR1_PLR0_TT4_4_VAW2
    SolutionIndex: 74
    SolutionNameMin: Cijk_Alik_Bjlk_HSS_BH_MT64x64x16_SE_GSU1_PGR0_PLR1_TT4_4_VAW2
    SolutionIndex: 75
    SolutionNameMin: Cijk_Alik_Bjlk_HSS_BH_MT64x64x16_SE_GSU1_PGR1_PLR1_TT4_4_VAW2
    SolutionIndex: 76
    SolutionNameMin: Cijk_Alik_Bjlk_HSS_BH_MT64x64x16_SE_GSU2_PGR0_PLR0_TT4_4_VAW1
    SolutionIndex: 77
    SolutionNameMin: Cijk_Alik_Bjlk_HSS_BH_MT64x128x16_SE_GSU2_PGR1_PLR0_TT4_8_VAW1
    SolutionIndex: 78
    SolutionNameMin: Cijk_Alik_Bjlk_HSS_BH_MT64x64x16_SE_GSU2_PGR1_PLR1_TT4_4_VAW1
    SolutionIndex: 79
    SolutionNameMin: Cijk_Alik_Bjlk_HSS_BH_MT64x64x8_SE_GSU3_PGR1_PLR0_TT4_4_VAW1
    SolutionIndex: 80
    SolutionNameMin: Cijk_Alik_Bjlk_HSS_BH_MT64x128x8_SE_GSU3_PGR1_PLR1_TT4_8_VAW1
    SolutionIndex: 81
    SolutionNameMin: Cijk_Alik_Bjlk_HSS_BH_MT64x128x16_SE_GSU3_PGR1_PLR0_TT4_8_VAW1
    SolutionIndex: 82
    SolutionNameMin: Cijk_Alik_Bjlk_HSS_BH_MT64x64x16_SE_GSU3_PGR0_PLR1_TT4_4_VAW1
    SolutionIndex: 83
    SolutionNameMin: Cijk_Alik_Bjlk_HSS_BH_MT64x64x16_SE_GSU3_PGR1_PLR1_TT4_4_VAW1
    SolutionIndex: 84
    SolutionNameMin: Cijk_Alik_Bjlk_HSS_BH_MT64x64x4_SE_GSU5_PGR1_PLR0_TT4_4_VAW1
    SolutionIndex: 85
    SolutionNameMin: Cijk_Alik_Bjlk_HSS_BH_MT64x64x8_SE_GSU5_PGR1_PLR0_TT4_4_VAW1
    SolutionIndex: 86
    SolutionNameMin: Cijk_Alik_Bjlk_HSS_BH_MT64x64x16_SE_GSU5_PGR1_PLR1_TT4_4_VAW1
    SolutionIndex: 87
    SolutionNameMin: Cijk_Alik_Bjlk_HSS_BH_MT64x64x8_SE_GSU7_PGR1_PLR0_TT4_4_VAW1
    SolutionIndex: 88
    SolutionNameMin: Cijk_Alik_Bjlk_HSS_BH_MT64x128x8_SE_GSU7_PGR1_PLR1_TT4_8_VAW1
    SolutionIndex: 89
    SolutionNameMin: Cijk_Alik_Bjlk_HSS_BH_MT64x64x16_SE_GSU7_PGR0_PLR0_TT4_4_VAW1
    SolutionIndex: 90
    SolutionNameMin: Cijk_Alik_Bjlk_HSS_BH_MT64x128x16_SE_GSU7_PGR1_PLR0_TT4_8_VAW1
    SolutionIndex: 91
    SolutionNameMin: Cijk_Alik_Bjlk_HSS_BH_MT64x64x16_SE_GSU7_PGR1_PLR1_TT4_4_VAW1
    SolutionIndex: 92
    SolutionNameMin: Cijk_Alik_Bjlk_HSS_BH_MT128x128x4_SE_GSU1_PGR0_PLR0_TT8_8_VAW2
    SolutionIndex: 93
    SolutionNameMin: Cijk_Alik_Bjlk_HSS_BH_MT64x128x4_SE_GSU1_PGR0_PLR0_TT4_8_VAW2
    SolutionIndex: 94
    SolutionNameMin: Cijk_Alik_Bjlk_HSS_BH_MT64x64x4_SE_GSU1_PGR0_PLR0_TT4_4_VAW2
    SolutionIndex: 95
    SolutionNameMin: Cijk_Alik_Bjlk_HSS_BH_MT128x128x4_SE_GSU1_PGR1_PLR0_TT8_8_VAW2
    SolutionIndex: 96
    SolutionNameMin: Cijk_Alik_Bjlk_HSS_BH_MT64x128x4_SE_GSU1_PGR1_PLR0_TT4_8_VAW2
    SolutionIndex: 97
    SolutionNameMin: Cijk_Alik_Bjlk_HSS_BH_MT64x64x4_SE_GSU1_PGR1_PLR0_TT4_4_VAW2
    SolutionIndex: 98
    SolutionNameMin: Cijk_Alik_Bjlk_HSS_BH_MT64x64x4_SE_GSU1_PGR0_PLR1_TT4_4_VAW2
    SolutionIndex: 99
    SolutionNameMin: Cijk_Alik_Bjlk_HSS_BH_MT128x128x4_SE_GSU1_PGR1_PLR1_TT8_8_VAW2
    SolutionIndex: 100
    SolutionNameMin: Cijk_Alik_Bjlk_HSS_BH_MT64x128x4_SE_GSU1_PGR1_PLR1_TT4_8_VAW2
    SolutionIndex: 101
    SolutionNameMin: Cijk_Alik_Bjlk_HSS_BH_MT64x64x4_SE_GSU1_PGR1_PLR1_TT4_4_VAW2
    SolutionIndex: 102
    SolutionNameMin: Cijk_Alik_Bjlk_HSS_BH_MT128x128x8_SE_GSU1_PGR0_PLR0_TT8_8_VAW2
    SolutionIndex: 103
    SolutionNameMin: Cijk_Alik_Bjlk_HSS_BH_MT64x128x8_SE_GSU1_PGR0_PLR0_TT4_8_VAW2
    SolutionIndex: 104
    SolutionNameMin: Cijk_Alik_Bjlk_HSS_BH_MT64x64x8_SE_GSU1_PGR0_PLR0_TT4_4_VAW2
    SolutionIndex: 105
    SolutionNameMin: Cijk_Alik_Bjlk_HSS_BH_MT64x128x8_SE_GSU1_PGR1_PLR0_TT4_8_VAW2
    SolutionIndex: 106
    SolutionNameMin: Cijk_Alik_Bjlk_HSS_BH_MT64x64x8_SE_GSU1_PGR1_PLR0_TT4_4_VAW2
    SolutionIndex: 107
    SolutionNameMin: Cijk_Alik_Bjlk_HSS_BH_MT128x128x8_SE_GSU1_PGR0_PLR1_TT8_8_VAW2
    SolutionIndex: 108
    SolutionNameMin: Cijk_Alik_Bjlk_HSS_BH_MT64x64x8_SE_GSU1_PGR0_PLR1_TT4_4_VAW2
    SolutionIndex: 109
    SolutionNameMin: Cijk_Alik_Bjlk_HSS_BH_MT128x128x16_SE_GSU1_PGR0_PLR0_TT8_8_VAW2
    SolutionIndex: 110
    SolutionNameMin: Cijk_Alik_Bjlk_HSS_BH_MT64x128x16_SE_GSU1_PGR1_PLR0_TT4_8_VAW2
    SolutionIndex: 111
    SolutionNameMin: Cijk_Alik_Bjlk_HSS_BH_MT64x64x16_SE_GSU1_PGR1_PLR0_TT4_4_VAW2
    SolutionIndex: 112
    SolutionNameMin: Cijk_Alik_Bjlk_HSS_BH_MT128x128x16_SE_GSU1_PGR0_PLR1_TT8_8_VAW2
    SolutionIndex: 113
    SolutionNameMin: Cijk_Alik_Bjlk_HSS_BH_MT64x64x16_SE_GSU1_PGR0_PLR1_TT4_4_VAW2
    SolutionIndex: 114
    SolutionNameMin: Cijk_Alik_Bjlk_HSS_BH_MT128x128x16_SE_GSU1_PGR1_PLR1_TT8_8_VAW2
    SolutionIndex: 115
    SolutionNameMin: Cijk_Alik_Bjlk_HSS_BH_MT64x128x16_SE_GSU1_PGR1_PLR1_TT4_8_VAW2
    SolutionIndex: 116
    SolutionNameMin: Cijk_Alik_Bjlk_HSS_BH_MT64x64x16_SE_GSU1_PGR1_PLR1_TT4_4_VAW2
    SolutionIndex: 117
    SolutionNameMin: Cijk_Alik_Bjlk_HSS_BH_MT64x64x4_SE_GSU2_PGR1_PLR0_TT4_4_VAW1
    SolutionIndex: 118
    SolutionNameMin: Cijk_Alik_Bjlk_HSS_BH_MT64x64x8_SE_GSU2_PGR1_PLR0_TT4_4_VAW1
    SolutionIndex: 119
    SolutionNameMin: Cijk_Alik_Bjlk_HSS_BH_MT64x64x16_SE_GSU2_PGR1_PLR0_TT4_4_VAW1
    SolutionIndex: 120
    SolutionNameMin: Cijk_Alik_Bjlk_HSS_BH_MT64x64x4_SE_GSU3_PGR0_PLR0_TT4_4_VAW1
    SolutionIndex: 121
    SolutionNameMin: Cijk_Alik_Bjlk_HSS_BH_MT64x64x8_SE_GSU3_PGR1_PLR0_TT4_4_VAW1
    SolutionIndex: 122
    SolutionNameMin: Cijk_Alik_Bjlk_HSS_BH_MT64x64x16_SE_GSU3_PGR1_PLR1_TT4_4_VAW1
    SolutionIndex: 123
    SolutionNameMin: Cijk_Alik_Bjlk_HSS_BH_MT64x128x4_SE_GSU5_PGR1_PLR0_TT4_8_VAW1
    SolutionIndex: 124
    SolutionNameMin: Cijk_Alik_Bjlk_HSS_BH_MT64x64x4_SE_GSU5_PGR1_PLR0_TT4_4_VAW1
    SolutionIndex: 125
    SolutionNameMin: Cijk_Alik_Bjlk_HSS_BH_MT64x64x8_SE_GSU5_PGR1_PLR0_TT4_4_VAW1
    SolutionIndex: 126
    SolutionNameMin: Cijk_Alik_Bjlk_HSS_BH_MT64x64x16_SE_GSU5_PGR1_PLR1_TT4_4_VAW1
    SolutionIndex: 127
    SolutionNameMin: Cijk_Alik_Bjlk_HSS_BH_MT64x128x4_SE_GSU7_PGR1_PLR0_TT4_8_VAW1
    SolutionIndex: 128
    SolutionNameMin: Cijk_Alik_Bjlk_HSS_BH_MT64x64x4_SE_GSU7_PGR1_PLR0_TT4_4_VAW1
    SolutionIndex: 129
    SolutionNameMin: Cijk_Alik_Bjlk_HSS_BH_MT64x64x8_SE_GSU7_PGR1_PLR0_TT4_4_VAW1
    SolutionIndex: 130
    SolutionNameMin: Cijk_Alik_Bjlk_HSS_BH_MT64x64x8_SE_GSU7_PGR1_PLR1_TT4_4_VAW1
    SolutionIndex: 131
    SolutionNameMin: Cijk_Alik_Bjlk_HSS_BH_MT64x64x16_SE_GSU7_PGR1_PLR0_TT4_4_VAW1
- - - [64, 64, 1, 256, 64, 64, 256, 64]
    - [13, 82.0]
  - - [128, 64, 1, 256, 128, 128, 256, 64]
    - [37, 125.0]
  - - [64, 128, 1, 256, 64, 64, 256, 128]
    - [14, 130.0]
  - - [128, 128, 1, 256, 128, 128, 256, 128]
    - [33, 363.0]
  - - [64, 256, 1, 256, 64, 64, 256, 256]
    - [33, 365.0]
  - - [128, 256, 1, 256, 128, 128, 256, 256]
    - [32, 699.0]
  - - [64, 448, 1, 256, 64, 64, 256, 448]
    - [32, 635.0]
  - - [128, 448, 1, 256, 128, 128, 256, 448]
    - [42, 1231.0]
  - - [64, 704, 1, 256, 64, 64, 256, 704]
    - [32, 944.0]
  - - [128, 704, 1, 256, 128, 128, 256, 704]
    - [39, 1740.0]
  - - [64, 1024, 1, 256, 64, 64, 256, 1024]
    - [39, 1272.0]
  - - [128, 1024, 1, 256, 128, 128, 256, 1024]
    - [8, 2157.0]
  - - [64, 1408, 1, 256, 64, 64, 256, 1408]
    - [39, 1674.0]
  - - [128, 1408, 1, 256, 128, 128, 256, 1408]
    - [9, 2542.0]
  - - [64, 1856, 1, 256, 64, 64, 256, 1856]
    - [8, 1857.0]
  - - [128, 1856, 1, 256, 128, 128, 256, 1856]
    - [21, 2793.0]
  - - [64, 2368, 1, 256, 64, 64, 256, 2368]
    - [29, 2191.0]
  - - [128, 2368, 1, 256, 128, 128, 256, 2368]
    - [11, 3081.0]
  - - [64, 2944, 1, 256, 64, 64, 256, 2944]
    - [30, 2485.0]
  - - [128, 2944, 1, 256, 128, 128, 256, 2944]
    - [9, 3322.0]
  - - [64, 3584, 1, 256, 64, 64, 256, 3584]
    - [30, 2893.0]
  - - [128, 3584, 1, 256, 128, 128, 256, 3584]
    - [23, 3722.0]
  - - [64, 4288, 1, 256, 64, 64, 256, 4288]
    - [17, 2348.0]
  - - [128, 4288, 1, 256, 128, 128, 256, 4288]
    - [23, 3683.0]
  - - [64, 5056, 1, 256, 64, 64, 256, 5056]
    - [17, 2789.0]
  - - [128, 5056, 1, 256, 128, 128, 256, 5056]
    - [15, 3951.0]
  - - [64, 5888, 1, 256, 64, 64, 256, 5888]
    - [15, 2987.0]
  - - [128, 5888, 1, 256, 128, 128, 256, 5888]
    - [24, 3597.0]
  - - [64, 6784, 1, 256, 64, 64, 256, 6784]
    - [26, 3364.0]
  - - [128, 6784, 1, 256, 128, 128, 256, 6784]
    - [12, 3828.0]
  - - [64, 64, 1, 1280, 64, 64, 1280, 64]
    - [42, 114.0]
  - - [128, 64, 1, 1280, 128, 128, 1280, 64]
    - [5, 197.0]
  - - [64, 128, 1, 1280, 64, 64, 1280, 128]
    - [33, 197.0]
  - - [128, 128, 1, 1280, 128, 128, 1280, 128]
    - [29, 466.0]
  - - [64, 256, 1, 1280, 64, 64, 1280, 256]
    - [40, 468.0]
  - - [128, 256, 1, 1280, 128, 128, 1280, 256]
    - [29, 902.0]
  - - [64, 448, 1, 1280, 64, 64, 1280, 448]
    - [41, 808.0]
  - - [128, 448, 1, 1280, 128, 128, 1280, 448]
    - [29, 1558.0]
  - - [64, 704, 1, 1280, 64, 64, 1280, 704]
    - [29, 1190.0]
  - - [128, 704, 1, 1280, 128, 128, 1280, 704]
    - [29, 2118.0]
  - - [64, 1024, 1, 1280, 64, 64, 1280, 1024]
    - [29, 1498.0]
  - - [128, 1024, 1, 1280, 128, 128, 1280, 1024]
    - [29, 2505.0]
  - - [64, 1408, 1, 1280, 64, 64, 1280, 1408]
    - [42, 1959.0]
  - - [128, 1408, 1, 1280, 128, 128, 1280, 1408]
    - [30, 2873.0]
  - - [64, 1856, 1, 1280, 64, 64, 1280, 1856]
    - [20, 2181.0]
  - - [128, 1856, 1, 1280, 128, 128, 1280, 1856]
    - [30, 2985.0]
  - - [64, 2368, 1, 1280, 64, 64, 1280, 2368]
    - [35, 2508.0]
  - - [128, 2368, 1, 1280, 128, 128, 1280, 2368]
    - [14, 3292.0]
  - - [64, 2944, 1, 1280, 64, 64, 1280, 2944]
    - [25, 2802.0]
  - - [128, 2944, 1, 1280, 128, 128, 1280, 2944]
    - [26, 3625.0]
  - - [64, 3584, 1, 1280, 64, 64, 1280, 3584]
    - [25, 3308.0]
  - - [128, 3584, 1, 1280, 128, 128, 1280, 3584]
    - [26, 4353.0]
  - - [64, 4288, 1, 1280, 64, 64, 1280, 4288]
    - [25, 3046.0]
  - - [128, 4288, 1, 1280, 128, 128, 1280, 4288]
    - [26, 4056.0]
  - - [64, 5056, 1, 1280, 64, 64, 1280, 5056]
    - [14, 3437.0]
  - - [128, 5056, 1, 1280, 128, 128, 1280, 5056]
    - [26, 4748.0]
  - - [64, 5888, 1, 1280, 64, 64, 1280, 5888]
    - [26, 3611.0]
  - - [128, 5888, 1, 1280, 128, 128, 1280, 5888]
    - [26, 4243.0]
  - - [64, 6784, 1, 1280, 64, 64, 1280, 6784]
    - [26, 3986.0]
  - - [128, 6784, 1, 1280, 128, 128, 1280, 6784]
    - [38, 4561.0]
  - - [64, 64, 1, 3328, 64, 64, 3328, 64]
    - [35, 119.0]
  - - [128, 64, 1, 3328, 128, 128, 3328, 64]
    - [33, 230.0]
  - - [64, 128, 1, 3328, 64, 64, 3328, 128]
    - [33, 230.0]
  - - [128, 128, 1, 3328, 128, 128, 3328, 128]
    - [29, 489.0]
  - - [64, 256, 1, 3328, 64, 64, 3328, 256]
    - [29, 489.0]
  - - [128, 256, 1, 3328, 128, 128, 3328, 256]
    - [29, 949.0]
  - - [64, 448, 1, 3328, 64, 64, 3328, 448]
    - [46, 856.0]
  - - [128, 448, 1, 3328, 128, 128, 3328, 448]
    - [35, 1627.0]
  - - [64, 704, 1, 3328, 64, 64, 3328, 704]
    - [29, 1289.0]
  - - [128, 704, 1, 3328, 128, 128, 3328, 704]
    - [42, 2164.0]
  - - [64, 1024, 1, 3328, 64, 64, 3328, 1024]
    - [32, 1669.0]
  - - [128, 1024, 1, 3328, 128, 128, 3328, 1024]
    - [8, 2608.0]
  - - [64, 1408, 1, 3328, 64, 64, 3328, 1408]
    - [42, 2160.0]
  - - [128, 1408, 1, 3328, 128, 128, 3328, 1408]
    - [43, 2927.0]
  - - [64, 1856, 1, 3328, 64, 64, 3328, 1856]
    - [29, 2413.0]
  - - [128, 1856, 1, 3328, 128, 128, 3328, 1856]
    - [23, 2894.0]
  - - [64, 2368, 1, 3328, 64, 64, 3328, 2368]
    - [35, 2825.0]
  - - [128, 2368, 1, 3328, 128, 128, 3328, 2368]
    - [25, 3543.0]
  - - [64, 2944, 1, 3328, 64, 64, 3328, 2944]
    - [36, 3027.0]
  - - [128, 2944, 1, 3328, 128, 128, 3328, 2944]
    - [26, 3736.0]
  - - [64, 3584, 1, 3328, 64, 64, 3328, 3584]
    - [25, 3511.0]
  - - [128, 3584, 1, 3328, 128, 128, 3328, 3584]
    - [26, 4534.0]
  - - [64, 4288, 1, 3328, 64, 64, 3328, 4288]
    - [25, 3215.0]
  - - [128, 4288, 1, 3328, 128, 128, 3328, 4288]
    - [26, 4211.0]
  - - [64, 5056, 1, 3328, 64, 64, 3328, 5056]
    - [14, 3616.0]
  - - [128, 5056, 1, 3328, 128, 128, 3328, 5056]
    - [15, 4910.0]
  - - [64, 5888, 1, 3328, 64, 64, 3328, 5888]
    - [26, 3680.0]
  - - [128, 5888, 1, 3328, 128, 128, 3328, 5888]
    - [26, 4418.0]
  - - [64, 6784, 1, 3328, 64, 64, 3328, 6784]
    - [38, 4026.0]
  - - [128, 6784, 1, 3328, 128, 128, 3328, 6784]
    - [15, 4876.0]
  - - [256, 64, 1, 256, 256, 256, 256, 64]
    - [33, 365.0]
  - - [448, 64, 1, 256, 448, 448, 256, 64]
    - [32, 639.0]
  - - [704, 64, 1, 256, 704, 704, 256, 64]
    - [32, 955.0]
  - - [1024, 64, 1, 256, 1024, 1024, 256, 64]
    - [32, 1309.0]
  - - [1408, 64, 1, 256, 1408, 1408, 256, 64]
    - [32, 1740.0]
  - - [1856, 64, 1, 256, 1856, 1856, 256, 64]
    - [32, 2052.0]
  - - [2368, 64, 1, 256, 2368, 2368, 256, 64]
    - [35, 2370.0]
  - - [2944, 64, 1, 256, 2944, 2944, 256, 64]
    - [20, 2543.0]
  - - [3584, 64, 1, 256, 3584, 3584, 256, 64]
    - [34, 2893.0]
  - - [4288, 64, 1, 256, 4288, 4288, 256, 64]
    - [10, 2679.0]
  - - [5056, 64, 1, 256, 5056, 5056, 256, 64]
    - [25, 2867.0]
  - - [5888, 64, 1, 256, 5888, 5888, 256, 64]
    - [9, 2907.0]
  - - [6784, 64, 1, 256, 6784, 6784, 256, 64]
    - [14, 3075.0]
  - - [256, 128, 1, 256, 256, 256, 256, 128]
    - [32, 708.0]
  - - [448, 128, 1, 256, 448, 448, 256, 128]
    - [35, 1246.0]
  - - [704, 128, 1, 256, 704, 704, 256, 128]
    - [32, 1769.0]
  - - [1024, 128, 1, 256, 1024, 1024, 256, 128]
    - [32, 2242.0]
  - - [1408, 128, 1, 256, 1408, 1408, 256, 128]
    - [4, 2511.0]
  - - [1856, 128, 1, 256, 1856, 1856, 256, 128]
    - [9, 2821.0]
  - - [2368, 128, 1, 256, 2368, 2368, 256, 128]
    - [11, 3036.0]
  - - [2944, 128, 1, 256, 2944, 2944, 256, 128]
    - [21, 3356.0]
  - - [3584, 128, 1, 256, 3584, 3584, 256, 128]
    - [11, 3678.0]
  - - [4288, 128, 1, 256, 4288, 4288, 256, 128]
    - [2, 3763.0]
  - - [5056, 128, 1, 256, 5056, 5056, 256, 128]
    - [26, 4030.0]
  - - [5888, 128, 1, 256, 5888, 5888, 256, 128]
    - [22, 3859.0]
  - - [6784, 128, 1, 256, 6784, 6784, 256, 128]
    - [26, 4287.0]
  - - [256, 64, 1, 1280, 256, 256, 1280, 64]
    - [40, 465.0]
  - - [448, 64, 1, 1280, 448, 448, 1280, 64]
    - [46, 834.0]
  - - [704, 64, 1, 1280, 704, 704, 1280, 64]
    - [46, 1244.0]
  - - [1024, 64, 1, 1280, 1024, 1024, 1280, 64]
    - [32, 1724.0]
  - - [1408, 64, 1, 1280, 1408, 1408, 1280, 64]
    - [32, 2234.0]
  - - [1856, 64, 1, 1280, 1856, 1856, 1280, 64]
    - [39, 2528.0]
  - - [2368, 64, 1, 1280, 2368, 2368, 1280, 64]
    - [35, 2757.0]
  - - [2944, 64, 1, 1280, 2944, 2944, 1280, 64]
    - [20, 2841.0]
  - - [3584, 64, 1, 1280, 3584, 3584, 1280, 64]
    - [25, 3156.0]
  - - [4288, 64, 1, 1280, 4288, 4288, 1280, 64]
    - [9, 2883.0]
  - - [5056, 64, 1, 1280, 5056, 5056, 1280, 64]
    - [37, 3069.0]
  - - [5888, 64, 1, 1280, 5888, 5888, 1280, 64]
    - [38, 3024.0]
  - - [6784, 64, 1, 1280, 6784, 6784, 1280, 64]
    - [14, 2989.0]
  - - [256, 128, 1, 1280, 256, 256, 1280, 128]
    - [29, 904.0]
  - - [448, 128, 1, 1280, 448, 448, 1280, 128]
    - [46, 1570.0]
  - - [704, 128, 1, 1280, 704, 704, 1280, 128]
    - [32, 2215.0]
  - - [1024, 128, 1, 1280, 1024, 1024, 1280, 128]
    - [32, 2806.0]
  - - [1408, 128, 1, 1280, 1408, 1408, 1280, 128]
    - [31, 3041.0]
  - - [1856, 128, 1, 1280, 1856, 1856, 1280, 128]
    - [21, 3253.0]
  - - [2368, 128, 1, 1280, 2368, 2368, 1280, 128]
    - [11, 3845.0]
  - - [2944, 128, 1, 1280, 2944, 2944, 1280, 128]
    - [9, 3918.0]
  - - [3584, 128, 1, 1280, 3584, 3584, 1280, 128]
    - [23, 4545.0]
  - - [4288, 128, 1, 1280, 4288, 4288, 1280, 128]
    - [23, 4397.0]
  - - [5056, 128, 1, 1280, 5056, 5056, 1280, 128]
    - [12, 4730.0]
  - - [5888, 128, 1, 1280, 5888, 5888, 1280, 128]
    - [11, 4466.0]
  - - [6784, 128, 1, 1280, 6784, 6784, 1280, 128]
    - [24, 4884.0]
  - - [256, 64, 1, 3328, 256, 256, 3328, 64]
    - [29, 488.0]
  - - [448, 64, 1, 3328, 448, 448, 3328, 64]
    - [46, 878.0]
  - - [704, 64, 1, 3328, 704, 704, 3328, 64]
    - [46, 1312.0]
  - - [1024, 64, 1, 3328, 1024, 1024, 3328, 64]
    - [39, 1806.0]
  - - [1408, 64, 1, 3328, 1408, 1408, 3328, 64]
    - [39, 2329.0]
  - - [1856, 64, 1, 3328, 1856, 1856, 3328, 64]
    - [39, 2607.0]
  - - [2368, 64, 1, 3328, 2368, 2368, 3328, 64]
    - [35, 2928.0]
  - - [2944, 64, 1, 3328, 2944, 2944, 3328, 64]
    - [34, 2975.0]
  - - [3584, 64, 1, 3328, 3584, 3584, 3328, 64]
    - [37, 3151.0]
  - - [4288, 64, 1, 3328, 4288, 4288, 3328, 64]
    - [10, 3014.0]
  - - [5056, 64, 1, 3328, 5056, 5056, 3328, 64]
    - [25, 3101.0]
  - - [5888, 64, 1, 3328, 5888, 5888, 3328, 64]
    - [38, 3036.0]
  - - [6784, 64, 1, 3328, 6784, 6784, 3328, 64]
    - [38, 3144.0]
  - - [256, 128, 1, 3328, 256, 256, 3328, 128]
    - [29, 951.0]
  - - [448, 128, 1, 3328, 448, 448, 3328, 128]
    - [46, 1662.0]
  - - [704, 128, 1, 3328, 704, 704, 3328, 128]
    - [32, 2302.0]
  - - [1024, 128, 1, 3328, 1024, 1024, 3328, 128]
    - [32, 2852.0]
  - - [1408, 128, 1, 3328, 1408, 1408, 3328, 128]
    - [31, 3142.0]
  - - [1856, 128, 1, 3328, 1856, 1856, 3328, 128]
    - [9, 3317.0]
  - - [2368, 128, 1, 3328, 2368, 2368, 3328, 128]
    - [11, 4007.0]
  - - [2944, 128, 1, 3328, 2944, 2944, 3328, 128]
    - [11, 4030.0]
  - - [3584, 128, 1, 3328, 3584, 3584, 3328, 128]
    - [11, 4823.0]
  - - [4288, 128, 1, 3328, 4288, 4288, 3328, 128]
    - [11, 4675.0]
  - - [5056, 128, 1, 3328, 5056, 5056, 3328, 128]
    - [26, 4935.0]
  - - [5888, 128, 1, 3328, 5888, 5888, 3328, 128]
    - [23, 4724.0]
  - - [6784, 128, 1, 3328, 6784, 6784, 3328, 128]
    - [12, 5124.0]
  - - [256, 256, 1, 256, 256, 256, 256, 256]
    - [39, 1340.0]
  - - [448, 256, 1, 256, 448, 448, 256, 256]
    - [39, 2239.0]
  - - [256, 448, 1, 256, 256, 256, 256, 448]
    - [39, 2214.0]
  - - [448, 448, 1, 256, 448, 448, 256, 448]
    - [6, 2843.0]
  - - [256, 256, 1, 1280, 256, 256, 1280, 256]
    - [32, 1703.0]
  - - [448, 256, 1, 1280, 448, 448, 1280, 256]
    - [32, 2823.0]
  - - [256, 448, 1, 1280, 256, 256, 1280, 448]
    - [29, 2730.0]
  - - [448, 448, 1, 1280, 448, 448, 1280, 448]
    - [30, 3430.0]
  - - [256, 256, 1, 3328, 256, 256, 3328, 256]
    - [32, 1766.0]
  - - [448, 256, 1, 3328, 448, 448, 3328, 256]
    - [32, 2904.0]
  - - [256, 448, 1, 3328, 256, 256, 3328, 448]
    - [39, 2819.0]
  - - [448, 448, 1, 3328, 448, 448, 3328, 448]
    - [18, 3395.0]
  - - [704, 256, 1, 256, 704, 704, 256, 256]
    - [19, 1618.0]
  - - [1024, 256, 1, 256, 1024, 1024, 256, 256]
    - [15, 2226.0]
  - - [1408, 256, 1, 256, 1408, 1408, 256, 256]
    - [26, 2924.0]
  - - [1856, 256, 1, 256, 1856, 1856, 256, 256]
    - [26, 3146.0]
  - - [2368, 256, 1, 256, 2368, 2368, 256, 256]
    - [15, 3880.0]
  - - [2944, 256, 1, 256, 2944, 2944, 256, 256]
    - [26, 3952.0]
  - - [3584, 256, 1, 256, 3584, 3584, 256, 256]
    - [26, 4447.0]
  - - [4288, 256, 1, 256, 4288, 4288, 256, 256]
    - [26, 4360.0]
  - - [5056, 256, 1, 256, 5056, 5056, 256, 256]
    - [26, 4360.0]
  - - [5888, 256, 1, 256, 5888, 5888, 256, 256]
    - [26, 4415.0]
  - - [6784, 256, 1, 256, 6784, 6784, 256, 256]
    - [44, 4315.0]
  - - [704, 448, 1, 256, 704, 704, 256, 448]
    - [26, 2535.0]
  - - [1024, 448, 1, 256, 1024, 1024, 256, 448]
    - [38, 3439.0]
  - - [1408, 448, 1, 256, 1408, 1408, 256, 448]
    - [26, 4067.0]
  - - [1856, 448, 1, 256, 1856, 1856, 256, 448]
    - [15, 4270.0]
  - - [2368, 448, 1, 256, 2368, 2368, 256, 448]
    - [15, 4365.0]
  - - [2944, 448, 1, 256, 2944, 2944, 256, 448]
    - [15, 4567.0]
  - - [3584, 448, 1, 256, 3584, 3584, 256, 448]
    - [15, 4734.0]
  - - [4288, 448, 1, 256, 4288, 4288, 256, 448]
    - [26, 4538.0]
  - - [5056, 448, 1, 256, 5056, 5056, 256, 448]
    - [26, 4417.0]
  - - [5888, 448, 1, 256, 5888, 5888, 256, 448]
    - [26, 4391.0]
  - - [6784, 448, 1, 256, 6784, 6784, 256, 448]
    - [26, 4409.0]
  - - [256, 704, 1, 256, 256, 256, 256, 704]
    - [19, 1626.0]
  - - [448, 704, 1, 256, 448, 448, 256, 704]
    - [26, 2553.0]
  - - [704, 704, 1, 256, 704, 704, 256, 704]
    - [26, 3300.0]
  - - [1024, 704, 1, 256, 1024, 1024, 256, 704]
    - [15, 3769.0]
  - - [1408, 704, 1, 256, 1408, 1408, 256, 704]
    - [26, 4162.0]
  - - [1856, 704, 1, 256, 1856, 1856, 256, 704]
    - [15, 4641.0]
  - - [2368, 704, 1, 256, 2368, 2368, 256, 704]
    - [15, 4587.0]
  - - [2944, 704, 1, 256, 2944, 2944, 256, 704]
    - [15, 4678.0]
  - - [3584, 704, 1, 256, 3584, 3584, 256, 704]
    - [15, 4943.0]
  - - [4288, 704, 1, 256, 4288, 4288, 256, 704]
    - [26, 4582.0]
  - - [5056, 704, 1, 256, 5056, 5056, 256, 704]
    - [26, 4588.0]
  - - [5888, 704, 1, 256, 5888, 5888, 256, 704]
    - [26, 4478.0]
  - - [6784, 704, 1, 256, 6784, 6784, 256, 704]
    - [44, 4533.0]
  - - [256, 1024, 1, 256, 256, 256, 256, 1024]
    - [26, 2288.0]
  - - [448, 1024, 1, 256, 448, 448, 256, 1024]
    - [26, 3620.0]
  - - [704, 1024, 1, 256, 704, 704, 256, 1024]
    - [26, 3827.0]
  - - [1024, 1024, 1, 256, 1024, 1024, 256, 1024]
    - [15, 4076.0]
  - - [1408, 1024, 1, 256, 1408, 1408, 256, 1024]
    - [15, 4481.0]
  - - [1856, 1024, 1, 256, 1856, 1856, 256, 1024]
    - [15, 4701.0]
  - - [2368, 1024, 1, 256, 2368, 2368, 256, 1024]
    - [15, 4988.0]
  - - [2944, 1024, 1, 256, 2944, 2944, 256, 1024]
    - [15, 4924.0]
  - - [3584, 1024, 1, 256, 3584, 3584, 256, 1024]
    - [15, 4865.0]
  - - [4288, 1024, 1, 256, 4288, 4288, 256, 1024]
    - [26, 4626.0]
  - - [5056, 1024, 1, 256, 5056, 5056, 256, 1024]
    - [26, 4650.0]
  - - [5888, 1024, 1, 256, 5888, 5888, 256, 1024]
    - [27, 4553.0]
  - - [6784, 1024, 1, 256, 6784, 6784, 256, 1024]
    - [27, 4769.0]
  - - [256, 1408, 1, 256, 256, 256, 256, 1408]
    - [26, 2890.0]
  - - [448, 1408, 1, 256, 448, 448, 256, 1408]
    - [26, 4015.0]
  - - [704, 1408, 1, 256, 704, 704, 256, 1408]
    - [15, 4142.0]
  - - [1024, 1408, 1, 256, 1024, 1024, 256, 1408]
    - [15, 4473.0]
  - - [1408, 1408, 1, 256, 1408, 1408, 256, 1408]
    - [15, 4911.0]
  - - [1856, 1408, 1, 256, 1856, 1856, 256, 1408]
    - [15, 4987.0]
  - - [2368, 1408, 1, 256, 2368, 2368, 256, 1408]
    - [15, 5190.0]
  - - [2944, 1408, 1, 256, 2944, 2944, 256, 1408]
    - [15, 5247.0]
  - - [3584, 1408, 1, 256, 3584, 3584, 256, 1408]
    - [15, 5016.0]
  - - [4288, 1408, 1, 256, 4288, 4288, 256, 1408]
    - [15, 4858.0]
  - - [5056, 1408, 1, 256, 5056, 5056, 256, 1408]
    - [27, 4800.0]
  - - [5888, 1408, 1, 256, 5888, 5888, 256, 1408]
    - [27, 4690.0]
  - - [6784, 1408, 1, 256, 6784, 6784, 256, 1408]
    - [27, 4906.0]
  - - [256, 1856, 1, 256, 256, 256, 256, 1856]
    - [26, 3116.0]
  - - [448, 1856, 1, 256, 448, 448, 256, 1856]
    - [26, 4295.0]
  - - [704, 1856, 1, 256, 704, 704, 256, 1856]
    - [26, 4594.0]
  - - [1024, 1856, 1, 256, 1024, 1024, 256, 1856]
    - [15, 4606.0]
  - - [1408, 1856, 1, 256, 1408, 1408, 256, 1856]
    - [15, 5028.0]
  - - [1856, 1856, 1, 256, 1856, 1856, 256, 1856]
    - [15, 5147.0]
  - - [2368, 1856, 1, 256, 2368, 2368, 256, 1856]
    - [15, 5314.0]
  - - [2944, 1856, 1, 256, 2944, 2944, 256, 1856]
    - [15, 5398.0]
  - - [3584, 1856, 1, 256, 3584, 3584, 256, 1856]
    - [15, 5113.0]
  - - [4288, 1856, 1, 256, 4288, 4288, 256, 1856]
    - [15, 4860.0]
  - - [5056, 1856, 1, 256, 5056, 5056, 256, 1856]
    - [27, 4788.0]
  - - [5888, 1856, 1, 256, 5888, 5888, 256, 1856]
    - [27, 4615.0]
  - - [6784, 1856, 1, 256, 6784, 6784, 256, 1856]
    - [27, 4747.0]
  - - [256, 2368, 1, 256, 256, 256, 256, 2368]
    - [15, 3865.0]
  - - [448, 2368, 1, 256, 448, 448, 256, 2368]
    - [15, 4238.0]
  - - [704, 2368, 1, 256, 704, 704, 256, 2368]
    - [15, 4540.0]
  - - [1024, 2368, 1, 256, 1024, 1024, 256, 2368]
    - [15, 4915.0]
  - - [1408, 2368, 1, 256, 1408, 1408, 256, 2368]
    - [15, 5207.0]
  - - [1856, 2368, 1, 256, 1856, 1856, 256, 2368]
    - [15, 5318.0]
  - - [2368, 2368, 1, 256, 2368, 2368, 256, 2368]
    - [15, 5468.0]
  - - [2944, 2368, 1, 256, 2944, 2944, 256, 2368]
    - [15, 5483.0]
  - - [3584, 2368, 1, 256, 3584, 3584, 256, 2368]
    - [15, 5169.0]
  - - [4288, 2368, 1, 256, 4288, 4288, 256, 2368]
    - [15, 4936.0]
  - - [5056, 2368, 1, 256, 5056, 5056, 256, 2368]
    - [27, 4863.0]
  - - [5888, 2368, 1, 256, 5888, 5888, 256, 2368]
    - [27, 4734.0]
  - - [6784, 2368, 1, 256, 6784, 6784, 256, 2368]
    - [27, 4943.0]
  - - [256, 2944, 1, 256, 256, 256, 256, 2944]
    - [26, 3917.0]
  - - [448, 2944, 1, 256, 448, 448, 256, 2944]
    - [15, 4491.0]
  - - [704, 2944, 1, 256, 704, 704, 256, 2944]
    - [15, 4747.0]
  - - [1024, 2944, 1, 256, 1024, 1024, 256, 2944]
    - [15, 4921.0]
  - - [1408, 2944, 1, 256, 1408, 1408, 256, 2944]
    - [15, 5290.0]
  - - [1856, 2944, 1, 256, 1856, 1856, 256, 2944]
    - [15, 5486.0]
  - - [2368, 2944, 1, 256, 2368, 2368, 256, 2944]
    - [15, 5530.0]
  - - [2944, 2944, 1, 256, 2944, 2944, 256, 2944]
    - [15, 5536.0]
  - - [3584, 2944, 1, 256, 3584, 3584, 256, 2944]
    - [15, 5190.0]
  - - [4288, 2944, 1, 256, 4288, 4288, 256, 2944]
    - [27, 5017.0]
  - - [5056, 2944, 1, 256, 5056, 5056, 256, 2944]
    - [27, 5052.0]
  - - [5888, 2944, 1, 256, 5888, 5888, 256, 2944]
    - [27, 4875.0]
  - - [6784, 2944, 1, 256, 6784, 6784, 256, 2944]
    - [27, 5136.0]
  - - [256, 3584, 1, 256, 256, 256, 256, 3584]
    - [26, 4498.0]
  - - [448, 3584, 1, 256, 448, 448, 256, 3584]
    - [26, 4783.0]
  - - [704, 3584, 1, 256, 704, 704, 256, 3584]
    - [15, 5084.0]
  - - [1024, 3584, 1, 256, 1024, 1024, 256, 3584]
    - [26, 5051.0]
  - - [1408, 3584, 1, 256, 1408, 1408, 256, 3584]
    - [15, 5487.0]
  - - [1856, 3584, 1, 256, 1856, 1856, 256, 3584]
    - [15, 5578.0]
  - - [2368, 3584, 1, 256, 2368, 2368, 256, 3584]
    - [15, 5641.0]
  - - [2944, 3584, 1, 256, 2944, 2944, 256, 3584]
    - [15, 5598.0]
  - - [3584, 3584, 1, 256, 3584, 3584, 256, 3584]
    - [15, 5238.0]
  - - [4288, 3584, 1, 256, 4288, 4288, 256, 3584]
    - [27, 5193.0]
  - - [5056, 3584, 1, 256, 5056, 5056, 256, 3584]
    - [27, 5174.0]
  - - [5888, 3584, 1, 256, 5888, 5888, 256, 3584]
    - [27, 5123.0]
  - - [6784, 3584, 1, 256, 6784, 6784, 256, 3584]
    - [27, 5221.0]
  - - [256, 4288, 1, 256, 256, 256, 256, 4288]
    - [44, 4119.0]
  - - [448, 4288, 1, 256, 448, 448, 256, 4288]
    - [15, 4652.0]
  - - [704, 4288, 1, 256, 704, 704, 256, 4288]
    - [26, 4942.0]
  - - [1024, 4288, 1, 256, 1024, 1024, 256, 4288]
    - [15, 4993.0]
  - - [1408, 4288, 1, 256, 1408, 1408, 256, 4288]
    - [15, 5443.0]
  - - [1856, 4288, 1, 256, 1856, 1856, 256, 4288]
    - [15, 5603.0]
  - - [2368, 4288, 1, 256, 2368, 2368, 256, 4288]
    - [15, 5621.0]
  - - [2944, 4288, 1, 256, 2944, 2944, 256, 4288]
    - [15, 5628.0]
  - - [3584, 4288, 1, 256, 3584, 3584, 256, 4288]
    - [15, 5244.0]
  - - [4288, 4288, 1, 256, 4288, 4288, 256, 4288]
    - [15, 4980.0]
  - - [5056, 4288, 1, 256, 5056, 5056, 256, 4288]
    - [27, 5002.0]
  - - [5888, 4288, 1, 256, 5888, 5888, 256, 4288]
    - [27, 4930.0]
  - - [6784, 4288, 1, 256, 6784, 6784, 256, 4288]
    - [27, 5141.0]
  - - [256, 5056, 1, 256, 256, 256, 256, 5056]
    - [26, 4260.0]
  - - [448, 5056, 1, 256, 448, 448, 256, 5056]
    - [26, 4877.0]
  - - [704, 5056, 1, 256, 704, 704, 256, 5056]
    - [15, 5136.0]
  - - [1024, 5056, 1, 256, 1024, 1024, 256, 5056]
    - [15, 5100.0]
  - - [1408, 5056, 1, 256, 1408, 1408, 256, 5056]
    - [15, 5480.0]
  - - [1856, 5056, 1, 256, 1856, 1856, 256, 5056]
    - [15, 5663.0]
  - - [2368, 5056, 1, 256, 2368, 2368, 256, 5056]
    - [15, 5655.0]
  - - [2944, 5056, 1, 256, 2944, 2944, 256, 5056]
    - [15, 5656.0]
  - - [3584, 5056, 1, 256, 3584, 3584, 256, 5056]
    - [15, 5270.0]
  - - [4288, 5056, 1, 256, 4288, 4288, 256, 5056]
    - [27, 5046.0]
  - - [5056, 5056, 1, 256, 5056, 5056, 256, 5056]
    - [27, 5156.0]
  - - [5888, 5056, 1, 256, 5888, 5888, 256, 5056]
    - [27, 5048.0]
  - - [6784, 5056, 1, 256, 6784, 6784, 256, 5056]
    - [27, 5200.0]
  - - [256, 5888, 1, 256, 256, 256, 256, 5888]
    - [26, 4291.0]
  - - [448, 5888, 1, 256, 448, 448, 256, 5888]
    - [15, 4851.0]
  - - [704, 5888, 1, 256, 704, 704, 256, 5888]
    - [15, 5179.0]
  - - [1024, 5888, 1, 256, 1024, 1024, 256, 5888]
    - [15, 5182.0]
  - - [1408, 5888, 1, 256, 1408, 1408, 256, 5888]
    - [15, 5552.0]
  - - [1856, 5888, 1, 256, 1856, 1856, 256, 5888]
    - [15, 5667.0]
  - - [2368, 5888, 1, 256, 2368, 2368, 256, 5888]
    - [15, 5721.0]
  - - [2944, 5888, 1, 256, 2944, 2944, 256, 5888]
    - [15, 5701.0]
  - - [3584, 5888, 1, 256, 3584, 3584, 256, 5888]
    - [15, 5252.0]
  - - [4288, 5888, 1, 256, 4288, 4288, 256, 5888]
    - [27, 5256.0]
  - - [5056, 5888, 1, 256, 5056, 5056, 256, 5888]
    - [27, 5291.0]
  - - [5888, 5888, 1, 256, 5888, 5888, 256, 5888]
    - [27, 5158.0]
  - - [6784, 5888, 1, 256, 6784, 6784, 256, 5888]
    - [27, 5299.0]
  - - [256, 6784, 1, 256, 256, 256, 256, 6784]
    - [16, 4224.0]
  - - [448, 6784, 1, 256, 448, 448, 256, 6784]
    - [26, 4863.0]
  - - [704, 6784, 1, 256, 704, 704, 256, 6784]
    - [15, 5290.0]
  - - [1024, 6784, 1, 256, 1024, 1024, 256, 6784]
    - [15, 5191.0]
  - - [1408, 6784, 1, 256, 1408, 1408, 256, 6784]
    - [15, 5613.0]
  - - [1856, 6784, 1, 256, 1856, 1856, 256, 6784]
    - [15, 5703.0]
  - - [2368, 6784, 1, 256, 2368, 2368, 256, 6784]
    - [15, 5730.0]
  - - [2944, 6784, 1, 256, 2944, 2944, 256, 6784]
    - [15, 5692.0]
  - - [3584, 6784, 1, 256, 3584, 3584, 256, 6784]
    - [15, 5270.0]
  - - [4288, 6784, 1, 256, 4288, 4288, 256, 6784]
    - [27, 5300.0]
  - - [5056, 6784, 1, 256, 5056, 5056, 256, 6784]
    - [27, 5252.0]
  - - [5888, 6784, 1, 256, 5888, 5888, 256, 6784]
    - [27, 5113.0]
  - - [6784, 6784, 1, 256, 6784, 6784, 256, 6784]
    - [27, 5283.0]
  - - [704, 256, 1, 1280, 704, 704, 1280, 256]
    - [15, 2123.0]
  - - [1024, 256, 1, 1280, 1024, 1024, 1280, 256]
    - [26, 2550.0]
  - - [1408, 256, 1, 1280, 1408, 1408, 1280, 256]
    - [26, 3435.0]
  - - [1856, 256, 1, 1280, 1856, 1856, 1280, 256]
    - [15, 3563.0]
  - - [2368, 256, 1, 1280, 2368, 2368, 1280, 256]
    - [26, 4484.0]
  - - [2944, 256, 1, 1280, 2944, 2944, 1280, 256]
    - [26, 4367.0]
  - - [3584, 256, 1, 1280, 3584, 3584, 1280, 256]
    - [26, 5255.0]
  - - [4288, 256, 1, 1280, 4288, 4288, 1280, 256]
    - [26, 4943.0]
  - - [5056, 256, 1, 1280, 5056, 5056, 1280, 256]
    - [26, 5049.0]
  - - [5888, 256, 1, 1280, 5888, 5888, 1280, 256]
    - [26, 5082.0]
  - - [6784, 256, 1, 1280, 6784, 6784, 1280, 256]
    - [27, 5073.0]
  - - [704, 448, 1, 1280, 704, 704, 1280, 448]
    - [26, 3024.0]
  - - [1024, 448, 1, 1280, 1024, 1024, 1280, 448]
    - [26, 4315.0]
  - - [1408, 448, 1, 1280, 1408, 1408, 1280, 448]
    - [26, 4688.0]
  - - [1856, 448, 1, 1280, 1856, 1856, 1280, 448]
    - [26, 4841.0]
  - - [2368, 448, 1, 1280, 2368, 2368, 1280, 448]
    - [26, 4748.0]
  - - [2944, 448, 1, 1280, 2944, 2944, 1280, 448]
    - [26, 5035.0]
  - - [3584, 448, 1, 1280, 3584, 3584, 1280, 448]
    - [26, 5290.0]
  - - [4288, 448, 1, 1280, 4288, 4288, 1280, 448]
    - [26, 4985.0]
  - - [5056, 448, 1, 1280, 5056, 5056, 1280, 448]
    - [44, 5143.0]
  - - [5888, 448, 1, 1280, 5888, 5888, 1280, 448]
    - [26, 5207.0]
  - - [6784, 448, 1, 1280, 6784, 6784, 1280, 448]
    - [26, 5218.0]
  - - [256, 704, 1, 1280, 256, 256, 1280, 704]
    - [38, 2338.0]
  - - [448, 704, 1, 1280, 448, 448, 1280, 704]
    - [26, 3006.0]
  - - [704, 704, 1, 1280, 704, 704, 1280, 704]
    - [26, 3723.0]
  - - [1024, 704, 1, 1280, 1024, 1024, 1280, 704]
    - [26, 4213.0]
  - - [1408, 704, 1, 1280, 1408, 1408, 1280, 704]
    - [15, 4524.0]
  - - [1856, 704, 1, 1280, 1856, 1856, 1280, 704]
    - [26, 4997.0]
  - - [2368, 704, 1, 1280, 2368, 2368, 1280, 704]
    - [26, 4935.0]
  - - [2944, 704, 1, 1280, 2944, 2944, 1280, 704]
    - [26, 4964.0]
  - - [3584, 704, 1, 1280, 3584, 3584, 1280, 704]
    - [26, 5272.0]
  - - [4288, 704, 1, 1280, 4288, 4288, 1280, 704]
    - [26, 5174.0]
  - - [5056, 704, 1, 1280, 5056, 5056, 1280, 704]
    - [26, 5422.0]
  - - [5888, 704, 1, 1280, 5888, 5888, 1280, 704]
    - [26, 5279.0]
  - - [6784, 704, 1, 1280, 6784, 6784, 1280, 704]
    - [26, 5503.0]
  - - [256, 1024, 1, 1280, 256, 256, 1280, 1024]
    - [26, 2574.0]
  - - [448, 1024, 1, 1280, 448, 448, 1280, 1024]
    - [26, 4230.0]
  - - [704, 1024, 1, 1280, 704, 704, 1280, 1024]
    - [26, 4125.0]
  - - [1024, 1024, 1, 1280, 1024, 1024, 1280, 1024]
    - [15, 4498.0]
  - - [1408, 1024, 1, 1280, 1408, 1408, 1280, 1024]
    - [26, 4720.0]
  - - [1856, 1024, 1, 1280, 1856, 1856, 1280, 1024]
    - [51, 4657.0]
  - - [2368, 1024, 1, 1280, 2368, 2368, 1280, 1024]
    - [27, 4804.0]
  - - [2944, 1024, 1, 1280, 2944, 2944, 1280, 1024]
    - [27, 5111.0]
  - - [3584, 1024, 1, 1280, 3584, 3584, 1280, 1024]
    - [27, 5328.0]
  - - [4288, 1024, 1, 1280, 4288, 4288, 1280, 1024]
    - [27, 5266.0]
  - - [5056, 1024, 1, 1280, 5056, 5056, 1280, 1024]
    - [27, 5218.0]
  - - [5888, 1024, 1, 1280, 5888, 5888, 1280, 1024]
    - [27, 5172.0]
  - - [6784, 1024, 1, 1280, 6784, 6784, 1280, 1024]
    - [27, 5260.0]
  - - [256, 1408, 1, 1280, 256, 256, 1280, 1408]
    - [26, 3435.0]
  - - [448, 1408, 1, 1280, 448, 448, 1280, 1408]
    - [26, 4472.0]
  - - [704, 1408, 1, 1280, 704, 704, 1280, 1408]
    - [15, 4409.0]
  - - [1024, 1408, 1, 1280, 1024, 1024, 1280, 1408]
    - [15, 4716.0]
  - - [1408, 1408, 1, 1280, 1408, 1408, 1280, 1408]
    - [26, 5084.0]
  - - [1856, 1408, 1, 1280, 1856, 1856, 1280, 1408]
    - [27, 5185.0]
  - - [2368, 1408, 1, 1280, 2368, 2368, 1280, 1408]
    - [26, 5273.0]
  - - [2944, 1408, 1, 1280, 2944, 2944, 1280, 1408]
    - [26, 5253.0]
  - - [3584, 1408, 1, 1280, 3584, 3584, 1280, 1408]
    - [27, 5555.0]
  - - [4288, 1408, 1, 1280, 4288, 4288, 1280, 1408]
    - [26, 5501.0]
  - - [5056, 1408, 1, 1280, 5056, 5056, 1280, 1408]
    - [26, 5563.0]
  - - [5888, 1408, 1, 1280, 5888, 5888, 1280, 1408]
    - [26, 5531.0]
  - - [6784, 1408, 1, 1280, 6784, 6784, 1280, 1408]
    - [27, 5717.0]
  - - [256, 1856, 1, 1280, 256, 256, 1280, 1856]
    - [26, 3509.0]
  - - [448, 1856, 1, 1280, 448, 448, 1280, 1856]
    - [15, 4564.0]
  - - [704, 1856, 1, 1280, 704, 704, 1280, 1856]
    - [16, 4909.0]
  - - [1024, 1856, 1, 1280, 1024, 1024, 1280, 1856]
    - [53, 4716.0]
  - - [1408, 1856, 1, 1280, 1408, 1408, 1280, 1856]
    - [16, 5099.0]
  - - [1856, 1856, 1, 1280, 1856, 1856, 1280, 1856]
    - [27, 5096.0]
  - - [2368, 1856, 1, 1280, 2368, 2368, 1280, 1856]
    - [27, 5280.0]
  - - [2944, 1856, 1, 1280, 2944, 2944, 1280, 1856]
    - [26, 5416.0]
  - - [3584, 1856, 1, 1280, 3584, 3584, 1280, 1856]
    - [44, 5381.0]
  - - [4288, 1856, 1, 1280, 4288, 4288, 1280, 1856]
    - [26, 5548.0]
  - - [5056, 1856, 1, 1280, 5056, 5056, 1280, 1856]
    - [26, 5636.0]
  - - [5888, 1856, 1, 1280, 5888, 5888, 1280, 1856]
    - [26, 5547.0]
  - - [6784, 1856, 1, 1280, 6784, 6784, 1280, 1856]
    - [26, 5630.0]
  - - [256, 2368, 1, 1280, 256, 256, 1280, 2368]
    - [26, 4412.0]
  - - [448, 2368, 1, 1280, 448, 448, 1280, 2368]
    - [15, 4351.0]
  - - [704, 2368, 1, 1280, 704, 704, 1280, 2368]
    - [57, 4795.0]
  - - [1024, 2368, 1, 1280, 1024, 1024, 1280, 2368]
    - [38, 4843.0]
  - - [1408, 2368, 1, 1280, 1408, 1408, 1280, 2368]
    - [44, 5066.0]
  - - [1856, 2368, 1, 1280, 1856, 1856, 1280, 2368]
    - [27, 5209.0]
  - - [2368, 2368, 1, 1280, 2368, 2368, 1280, 2368]
    - [44, 5312.0]
  - - [2944, 2368, 1, 1280, 2944, 2944, 1280, 2368]
    - [26, 5405.0]
  - - [3584, 2368, 1, 1280, 3584, 3584, 1280, 2368]
    - [44, 5426.0]
  - - [4288, 2368, 1, 1280, 4288, 4288, 1280, 2368]
    - [26, 5524.0]
  - - [5056, 2368, 1, 1280, 5056, 5056, 1280, 2368]
    - [26, 5608.0]
  - - [5888, 2368, 1, 1280, 5888, 5888, 1280, 2368]
    - [26, 5576.0]
  - - [6784, 2368, 1, 1280, 6784, 6784, 1280, 2368]
    - [26, 5640.0]
  - - [256, 2944, 1, 1280, 256, 256, 1280, 2944]
    - [26, 4225.0]
  - - [448, 2944, 1, 1280, 448, 448, 1280, 2944]
    - [27, 4820.0]
  - - [704, 2944, 1, 1280, 704, 704, 1280, 2944]
    - [57, 4710.0]
  - - [1024, 2944, 1, 1280, 1024, 1024, 1280, 2944]
    - [16, 4950.0]
  - - [1408, 2944, 1, 1280, 1408, 1408, 1280, 2944]
    - [44, 5076.0]
  - - [1856, 2944, 1, 1280, 1856, 1856, 1280, 2944]
    - [27, 5473.0]
  - - [2368, 2944, 1, 1280, 2368, 2368, 1280, 2944]
    - [26, 5399.0]
  - - [2944, 2944, 1, 1280, 2944, 2944, 1280, 2944]
    - [27, 5638.0]
  - - [3584, 2944, 1, 1280, 3584, 3584, 1280, 2944]
    - [27, 5639.0]
  - - [4288, 2944, 1, 1280, 4288, 4288, 1280, 2944]
    - [27, 5665.0]
  - - [5056, 2944, 1, 1280, 5056, 5056, 1280, 2944]
    - [26, 5780.0]
  - - [5888, 2944, 1, 1280, 5888, 5888, 1280, 2944]
    - [27, 5715.0]
  - - [6784, 2944, 1, 1280, 6784, 6784, 1280, 2944]
    - [26, 5770.0]
  - - [256, 3584, 1, 1280, 256, 256, 1280, 3584]
    - [15, 4881.0]
  - - [448, 3584, 1, 1280, 448, 448, 1280, 3584]
    - [57, 4664.0]
  - - [704, 3584, 1, 1280, 704, 704, 1280, 3584]
    - [27, 4793.0]
  - - [1024, 3584, 1, 1280, 1024, 1024, 1280, 3584]
    - [16, 5211.0]
  - - [1408, 3584, 1, 1280, 1408, 1408, 1280, 3584]
    - [16, 5402.0]
  - - [1856, 3584, 1, 1280, 1856, 1856, 1280, 3584]
    - [27, 5365.0]
  - - [2368, 3584, 1, 1280, 2368, 2368, 1280, 3584]
    - [27, 5517.0]
  - - [2944, 3584, 1, 1280, 2944, 2944, 1280, 3584]
    - [27, 5700.0]
  - - [3584, 3584, 1, 1280, 3584, 3584, 1280, 3584]
    - [27, 5682.0]
  - - [4288, 3584, 1, 1280, 4288, 4288, 1280, 3584]
    - [27, 5696.0]
  - - [5056, 3584, 1, 1280, 5056, 5056, 1280, 3584]
    - [27, 5729.0]
  - - [5888, 3584, 1, 1280, 5888, 5888, 1280, 3584]
    - [27, 5788.0]
  - - [6784, 3584, 1, 1280, 6784, 6784, 1280, 3584]
    - [27, 5822.0]
  - - [256, 4288, 1, 1280, 256, 256, 1280, 4288]
    - [15, 4464.0]
  - - [448, 4288, 1, 1280, 448, 448, 1280, 4288]
    - [57, 4432.0]
  - - [704, 4288, 1, 1280, 704, 704, 1280, 4288]
    - [16, 4709.0]
  - - [1024, 4288, 1, 1280, 1024, 1024, 1280, 4288]
    - [16, 4885.0]
  - - [1408, 4288, 1, 1280, 1408, 1408, 1280, 4288]
    - [44, 5209.0]
  - - [1856, 4288, 1, 1280, 1856, 1856, 1280, 4288]
    - [44, 5406.0]
  - - [2368, 4288, 1, 1280, 2368, 2368, 1280, 4288]
    - [44, 5415.0]
  - - [2944, 4288, 1, 1280, 2944, 2944, 1280, 4288]
    - [27, 5535.0]
  - - [3584, 4288, 1, 1280, 3584, 3584, 1280, 4288]
    - [44, 5510.0]
  - - [4288, 4288, 1, 1280, 4288, 4288, 1280, 4288]
    - [26, 5682.0]
  - - [5056, 4288, 1, 1280, 5056, 5056, 1280, 4288]
    - [26, 5768.0]
  - - [5888, 4288, 1, 1280, 5888, 5888, 1280, 4288]
    - [26, 5689.0]
  - - [6784, 4288, 1, 1280, 6784, 6784, 1280, 4288]
    - [26, 5831.0]
  - - [256, 5056, 1, 1280, 256, 256, 1280, 5056]
    - [52, 4943.0]
  - - [448, 5056, 1, 1280, 448, 448, 1280, 5056]
    - [45, 4460.0]
  - - [704, 5056, 1, 1280, 704, 704, 1280, 5056]
    - [38, 4804.0]
  - - [1024, 5056, 1, 1280, 1024, 1024, 1280, 5056]
    - [51, 4887.0]
  - - [1408, 5056, 1, 1280, 1408, 1408, 1280, 5056]
    - [16, 5229.0]
  - - [1856, 5056, 1, 1280, 1856, 1856, 1280, 5056]
    - [44, 5464.0]
  - - [2368, 5056, 1, 1280, 2368, 2368, 1280, 5056]
    - [44, 5444.0]
  - - [2944, 5056, 1, 1280, 2944, 2944, 1280, 5056]
    - [26, 5579.0]
  - - [3584, 5056, 1, 1280, 3584, 3584, 1280, 5056]
    - [44, 5518.0]
  - - [4288, 5056, 1, 1280, 4288, 4288, 1280, 5056]
    - [26, 5713.0]
  - - [5056, 5056, 1, 1280, 5056, 5056, 1280, 5056]
    - [26, 5769.0]
  - - [5888, 5056, 1, 1280, 5888, 5888, 1280, 5056]
    - [26, 5776.0]
  - - [6784, 5056, 1, 1280, 6784, 6784, 1280, 5056]
    - [26, 5968.0]
  - - [256, 5888, 1, 1280, 256, 256, 1280, 5888]
    - [57, 4445.0]
  - - [448, 5888, 1, 1280, 448, 448, 1280, 5888]
    - [27, 4536.0]
  - - [704, 5888, 1, 1280, 704, 704, 1280, 5888]
    - [57, 4809.0]
  - - [1024, 5888, 1, 1280, 1024, 1024, 1280, 5888]
    - [53, 4970.0]
  - - [1408, 5888, 1, 1280, 1408, 1408, 1280, 5888]
    - [44, 5309.0]
  - - [1856, 5888, 1, 1280, 1856, 1856, 1280, 5888]
    - [27, 5521.0]
  - - [2368, 5888, 1, 1280, 2368, 2368, 1280, 5888]
    - [27, 5575.0]
  - - [2944, 5888, 1, 1280, 2944, 2944, 1280, 5888]
    - [27, 5708.0]
  - - [3584, 5888, 1, 1280, 3584, 3584, 1280, 5888]
    - [27, 5677.0]
  - - [4288, 5888, 1, 1280, 4288, 4288, 1280, 5888]
    - [26, 5746.0]
  - - [5056, 5888, 1, 1280, 5056, 5056, 1280, 5888]
    - [26, 5869.0]
  - - [5888, 5888, 1, 1280, 5888, 5888, 1280, 5888]
    - [27, 5922.0]
  - - [6784, 5888, 1, 1280, 6784, 6784, 1280, 5888]
    - [26, 6082.0]
  - - [256, 6784, 1, 1280, 256, 256, 1280, 6784]
    - [52, 5060.0]
  - - [448, 6784, 1, 1280, 448, 448, 1280, 6784]
    - [51, 4607.0]
  - - [704, 6784, 1, 1280, 704, 704, 1280, 6784]
    - [16, 4882.0]
  - - [1024, 6784, 1, 1280, 1024, 1024, 1280, 6784]
    - [16, 4939.0]
  - - [1408, 6784, 1, 1280, 1408, 1408, 1280, 6784]
    - [16, 5436.0]
  - - [1856, 6784, 1, 1280, 1856, 1856, 1280, 6784]
    - [44, 5507.0]
  - - [2368, 6784, 1, 1280, 2368, 2368, 1280, 6784]
    - [27, 5543.0]
  - - [2944, 6784, 1, 1280, 2944, 2944, 1280, 6784]
    - [27, 5679.0]
  - - [3584, 6784, 1, 1280, 3584, 3584, 1280, 6784]
    - [27, 5658.0]
  - - [4288, 6784, 1, 1280, 4288, 4288, 1280, 6784]
    - [26, 5786.0]
  - - [5056, 6784, 1, 1280, 5056, 5056, 1280, 6784]
    - [26, 5952.0]
  - - [5888, 6784, 1, 1280, 5888, 5888, 1280, 6784]
    - [26, 6054.0]
  - - [6784, 6784, 1, 1280, 6784, 6784, 1280, 6784]
    - [26, 6205.0]
  - - [704, 256, 1, 3328, 704, 704, 3328, 256]
    - [15, 2379.0]
  - - [1024, 256, 1, 3328, 1024, 1024, 3328, 256]
    - [26, 2607.0]
  - - [1408, 256, 1, 3328, 1408, 1408, 3328, 256]
    - [26, 3563.0]
  - - [1856, 256, 1, 3328, 1856, 1856, 3328, 256]
    - [26, 3640.0]
  - - [2368, 256, 1, 3328, 2368, 2368, 3328, 256]
    - [26, 4609.0]
  - - [2944, 256, 1, 3328, 2944, 2944, 3328, 256]
    - [26, 4502.0]
  - - [3584, 256, 1, 3328, 3584, 3584, 3328, 256]
    - [26, 5384.0]
  - - [4288, 256, 1, 3328, 4288, 4288, 3328, 256]
    - [26, 4984.0]
  - - [5056, 256, 1, 3328, 5056, 5056, 3328, 256]
    - [26, 5121.0]
  - - [5888, 256, 1, 3328, 5888, 5888, 3328, 256]
    - [26, 5177.0]
  - - [6784, 256, 1, 3328, 6784, 6784, 3328, 256]
    - [27, 5215.0]
  - - [704, 448, 1, 3328, 704, 704, 3328, 448]
    - [26, 3113.0]
  - - [1024, 448, 1, 3328, 1024, 1024, 3328, 448]
    - [26, 4475.0]
  - - [1408, 448, 1, 3328, 1408, 1408, 3328, 448]
    - [26, 4797.0]
  - - [1856, 448, 1, 3328, 1856, 1856, 3328, 448]
    - [26, 4940.0]
  - - [2368, 448, 1, 3328, 2368, 2368, 3328, 448]
    - [26, 4806.0]
  - - [2944, 448, 1, 3328, 2944, 2944, 3328, 448]
    - [57, 5084.0]
  - - [3584, 448, 1, 3328, 3584, 3584, 3328, 448]
    - [26, 5172.0]
  - - [4288, 448, 1, 3328, 4288, 4288, 3328, 448]
    - [44, 4811.0]
  - - [5056, 448, 1, 3328, 5056, 5056, 3328, 448]
    - [57, 5228.0]
  - - [5888, 448, 1, 3328, 5888, 5888, 3328, 448]
    - [57, 5085.0]
  - - [6784, 448, 1, 3328, 6784, 6784, 3328, 448]
    - [57, 5144.0]
  - - [256, 704, 1, 3328, 256, 256, 3328, 704]
    - [15, 2379.0]
  - - [448, 704, 1, 3328, 448, 448, 3328, 704]
    - [26, 3124.0]
  - - [704, 704, 1, 3328, 704, 704, 3328, 704]
    - [26, 3784.0]
  - - [1024, 704, 1, 3328, 1024, 1024, 3328, 704]
    - [26, 4179.0]
  - - [1408, 704, 1, 3328, 1408, 1408, 3328, 704]
    - [26, 4421.0]
  - - [1856, 704, 1, 3328, 1856, 1856, 3328, 704]
    - [57, 5043.0]
  - - [2368, 704, 1, 3328, 2368, 2368, 3328, 704]
    - [27, 4935.0]
  - - [2944, 704, 1, 3328, 2944, 2944, 3328, 704]
    - [27, 4833.0]
  - - [3584, 704, 1, 3328, 3584, 3584, 3328, 704]
    - [44, 5088.0]
  - - [4288, 704, 1, 3328, 4288, 4288, 3328, 704]
    - [57, 5103.0]
  - - [5056, 704, 1, 3328, 5056, 5056, 3328, 704]
    - [57, 5211.0]
  - - [5888, 704, 1, 3328, 5888, 5888, 3328, 704]
    - [44, 5098.0]
  - - [6784, 704, 1, 3328, 6784, 6784, 3328, 704]
    - [50, 6338.0]
  - - [256, 1024, 1, 3328, 256, 256, 3328, 1024]
    - [26, 2629.0]
  - - [448, 1024, 1, 3328, 448, 448, 3328, 1024]
    - [26, 4472.0]
  - - [704, 1024, 1, 3328, 704, 704, 3328, 1024]
    - [26, 4255.0]
  - - [1024, 1024, 1, 3328, 1024, 1024, 3328, 1024]
    - [26, 4185.0]
  - - [1408, 1024, 1, 3328, 1408, 1408, 3328, 1024]
    - [57, 4283.0]
  - - [1856, 1024, 1, 3328, 1856, 1856, 3328, 1024]
    - [56, 4860.0]
  - - [2368, 1024, 1, 3328, 2368, 2368, 3328, 1024]
    - [28, 4504.0]
  - - [2944, 1024, 1, 3328, 2944, 2944, 3328, 1024]
    - [49, 4650.0]
  - - [3584, 1024, 1, 3328, 3584, 3584, 3328, 1024]
    - [55, 5959.0]
  - - [4288, 1024, 1, 3328, 4288, 4288, 3328, 1024]
    - [7, 5792.0]
  - - [5056, 1024, 1, 3328, 5056, 5056, 3328, 1024]
    - [57, 5839.0]
  - - [5888, 1024, 1, 3328, 5888, 5888, 3328, 1024]
    - [51, 6206.0]
  - - [6784, 1024, 1, 3328, 6784, 6784, 3328, 1024]
    - [57, 6343.0]
  - - [256, 1408, 1, 3328, 256, 256, 3328, 1408]
    - [26, 3570.0]
  - - [448, 1408, 1, 3328, 448, 448, 3328, 1408]
    - [26, 4768.0]
  - - [704, 1408, 1, 3328, 704, 704, 3328, 1408]
    - [26, 4406.0]
  - - [1024, 1408, 1, 3328, 1024, 1024, 3328, 1408]
    - [44, 4293.0]
  - - [1408, 1408, 1, 3328, 1408, 1408, 3328, 1408]
    - [51, 5114.0]
  - - [1856, 1408, 1, 3328, 1856, 1856, 3328, 1408]
    - [27, 5159.0]
  - - [2368, 1408, 1, 3328, 2368, 2368, 3328, 1408]
    - [51, 5237.0]
  - - [2944, 1408, 1, 3328, 2944, 2944, 3328, 1408]
    - [58, 5270.0]
  - - [3584, 1408, 1, 3328, 3584, 3584, 3328, 1408]
    - [15, 6350.0]
  - - [4288, 1408, 1, 3328, 4288, 4288, 3328, 1408]
    - [15, 6305.0]
  - - [5056, 1408, 1, 3328, 5056, 5056, 3328, 1408]
    - [52, 6485.0]
  - - [5888, 1408, 1, 3328, 5888, 5888, 3328, 1408]
    - [15, 6655.0]
  - - [6784, 1408, 1, 3328, 6784, 6784, 3328, 1408]
    - [15, 6618.0]
  - - [256, 1856, 1, 3328, 256, 256, 3328, 1856]
    - [26, 3648.0]
  - - [448, 1856, 1, 3328, 448, 448, 3328, 1856]
    - [26, 4766.0]
  - - [704, 1856, 1, 3328, 704, 704, 3328, 1856]
    - [27, 4987.0]
  - - [1024, 1856, 1, 3328, 1024, 1024, 3328, 1856]
    - [53, 4898.0]
  - - [1408, 1856, 1, 3328, 1408, 1408, 3328, 1856]
    - [57, 5024.0]
  - - [1856, 1856, 1, 3328, 1856, 1856, 3328, 1856]
    - [27, 5005.0]
  - - [2368, 1856, 1, 3328, 2368, 2368, 3328, 1856]
    - [50, 6082.0]
  - - [2944, 1856, 1, 3328, 2944, 2944, 3328, 1856]
    - [52, 6587.0]
  - - [3584, 1856, 1, 3328, 3584, 3584, 3328, 1856]
    - [26, 6637.0]
  - - [4288, 1856, 1, 3328, 4288, 4288, 3328, 1856]
    - [26, 6756.0]
  - - [5056, 1856, 1, 3328, 5056, 5056, 3328, 1856]
    - [15, 6649.0]
  - - [5888, 1856, 1, 3328, 5888, 5888, 3328, 1856]
    - [15, 6693.0]
  - - [6784, 1856, 1, 3328, 6784, 6784, 3328, 1856]
    - [15, 6818.0]
  - - [256, 2368, 1, 3328, 256, 256, 3328, 2368]
    - [26, 4623.0]
  - - [448, 2368, 1, 3328, 448, 448, 3328, 2368]
    - [26, 4512.0]
  - - [704, 2368, 1, 3328, 704, 704, 3328, 2368]
    - [57, 4981.0]
  - - [1024, 2368, 1, 3328, 1024, 1024, 3328, 2368]
    - [52, 4770.0]
  - - [1408, 2368, 1, 3328, 1408, 1408, 3328, 2368]
    - [53, 5194.0]
  - - [1856, 2368, 1, 3328, 1856, 1856, 3328, 2368]
    - [15, 6140.0]
  - - [2368, 2368, 1, 3328, 2368, 2368, 3328, 2368]
    - [15, 6409.0]
  - - [2944, 2368, 1, 3328, 2944, 2944, 3328, 2368]
    - [15, 6567.0]
  - - [3584, 2368, 1, 3328, 3584, 3584, 3328, 2368]
    - [55, 6715.0]
  - - [4288, 2368, 1, 3328, 4288, 4288, 3328, 2368]
    - [15, 6547.0]
  - - [5056, 2368, 1, 3328, 5056, 5056, 3328, 2368]
    - [15, 6783.0]
  - - [5888, 2368, 1, 3328, 5888, 5888, 3328, 2368]
    - [15, 6859.0]
  - - [6784, 2368, 1, 3328, 6784, 6784, 3328, 2368]
    - [15, 6818.0]
  - - [256, 2944, 1, 3328, 256, 256, 3328, 2944]
    - [26, 4412.0]
  - - [448, 2944, 1, 3328, 448, 448, 3328, 2944]
    - [27, 5113.0]
  - - [704, 2944, 1, 3328, 704, 704, 3328, 2944]
    - [52, 4906.0]
  - - [1024, 2944, 1, 3328, 1024, 1024, 3328, 2944]
    - [52, 5129.0]
  - - [1408, 2944, 1, 3328, 1408, 1408, 3328, 2944]
    - [59, 5171.0]
  - - [1856, 2944, 1, 3328, 1856, 1856, 3328, 2944]
    - [15, 6401.0]
  - - [2368, 2944, 1, 3328, 2368, 2368, 3328, 2944]
    - [26, 6602.0]
  - - [2944, 2944, 1, 3328, 2944, 2944, 3328, 2944]
    - [15, 6902.0]
  - - [3584, 2944, 1, 3328, 3584, 3584, 3328, 2944]
    - [26, 6893.0]
  - - [4288, 2944, 1, 3328, 4288, 4288, 3328, 2944]
    - [52, 6723.0]
  - - [5056, 2944, 1, 3328, 5056, 5056, 3328, 2944]
    - [26, 6892.0]
  - - [5888, 2944, 1, 3328, 5888, 5888, 3328, 2944]
    - [15, 6751.0]
  - - [6784, 2944, 1, 3328, 6784, 6784, 3328, 2944]
    - [52, 6784.0]
  - - [256, 3584, 1, 3328, 256, 256, 3328, 3584]
    - [26, 5291.0]
  - - [448, 3584, 1, 3328, 448, 448, 3328, 3584]
    - [57, 4814.0]
  - - [704, 3584, 1, 3328, 704, 704, 3328, 3584]
    - [57, 5037.0]
  - - [1024, 3584, 1, 3328, 1024, 1024, 3328, 3584]
    - [48, 5386.0]
  - - [1408, 3584, 1, 3328, 1408, 1408, 3328, 3584]
    - [15, 6554.0]
  - - [1856, 3584, 1, 3328, 1856, 1856, 3328, 3584]
    - [26, 6732.0]
  - - [2368, 3584, 1, 3328, 2368, 2368, 3328, 3584]
    - [15, 6951.0]
  - - [2944, 3584, 1, 3328, 2944, 2944, 3328, 3584]
    - [26, 6868.0]
  - - [3584, 3584, 1, 3328, 3584, 3584, 3328, 3584]
    - [26, 6903.0]
  - - [4288, 3584, 1, 3328, 4288, 4288, 3328, 3584]
    - [55, 6737.0]
  - - [5056, 3584, 1, 3328, 5056, 5056, 3328, 3584]
    - [26, 6844.0]
  - - [5888, 3584, 1, 3328, 5888, 5888, 3328, 3584]
    - [57, 6942.0]
  - - [6784, 3584, 1, 3328, 6784, 6784, 3328, 3584]
    - [55, 6798.0]
  - - [256, 4288, 1, 3328, 256, 256, 3328, 4288]
    - [38, 4643.0]
  - - [448, 4288, 1, 3328, 448, 448, 3328, 4288]
    - [57, 4579.0]
  - - [704, 4288, 1, 3328, 704, 704, 3328, 4288]
    - [53, 4765.0]
  - - [1024, 4288, 1, 3328, 1024, 1024, 3328, 4288]
    - [15, 6209.0]
  - - [1408, 4288, 1, 3328, 1408, 1408, 3328, 4288]
    - [15, 6405.0]
  - - [1856, 4288, 1, 3328, 1856, 1856, 3328, 4288]
    - [55, 6517.0]
  - - [2368, 4288, 1, 3328, 2368, 2368, 3328, 4288]
    - [50, 6604.0]
  - - [2944, 4288, 1, 3328, 2944, 2944, 3328, 4288]
    - [26, 6799.0]
  - - [3584, 4288, 1, 3328, 3584, 3584, 3328, 4288]
    - [26, 6934.0]
  - - [4288, 4288, 1, 3328, 4288, 4288, 3328, 4288]
    - [15, 6844.0]
  - - [5056, 4288, 1, 3328, 5056, 5056, 3328, 4288]
    - [26, 6891.0]
  - - [5888, 4288, 1, 3328, 5888, 5888, 3328, 4288]
    - [50, 6840.0]
  - - [6784, 4288, 1, 3328, 6784, 6784, 3328, 4288]
    - [50, 6858.0]
  - - [256, 5056, 1, 3328, 256, 256, 3328, 5056]
    - [57, 5099.0]
  - - [448, 5056, 1, 3328, 448, 448, 3328, 5056]
    - [44, 4873.0]
  - - [704, 5056, 1, 3328, 704, 704, 3328, 5056]
    - [47, 5378.0]
  - - [1024, 5056, 1, 3328, 1024, 1024, 3328, 5056]
    - [15, 6341.0]
  - - [1408, 5056, 1, 3328, 1408, 1408, 3328, 5056]
    - [26, 6586.0]
  - - [1856, 5056, 1, 3328, 1856, 1856, 3328, 5056]
    - [0, 6593.0]
  - - [2368, 5056, 1, 3328, 2368, 2368, 3328, 5056]
    - [26, 6793.0]
  - - [2944, 5056, 1, 3328, 2944, 2944, 3328, 5056]
    - [15, 6814.0]
  - - [3584, 5056, 1, 3328, 3584, 3584, 3328, 5056]
    - [52, 6835.0]
  - - [4288, 5056, 1, 3328, 4288, 4288, 3328, 5056]
    - [26, 6885.0]
  - - [5056, 5056, 1, 3328, 5056, 5056, 3328, 5056]
    - [50, 6830.0]
  - - [5888, 5056, 1, 3328, 5888, 5888, 3328, 5056]
    - [52, 7019.0]
  - - [6784, 5056, 1, 3328, 6784, 6784, 3328, 5056]
    - [15, 7174.0]
  - - [256, 5888, 1, 3328, 256, 256, 3328, 5888]
    - [44, 4605.0]
  - - [448, 5888, 1, 3328, 448, 448, 3328, 5888]
    - [27, 5014.0]
  - - [704, 5888, 1, 3328, 704, 704, 3328, 5888]
    - [1, 5389.0]
  - - [1024, 5888, 1, 3328, 1024, 1024, 3328, 5888]
    - [15, 6529.0]
  - - [1408, 5888, 1, 3328, 1408, 1408, 3328, 5888]
    - [15, 6670.0]
  - - [1856, 5888, 1, 3328, 1856, 1856, 3328, 5888]
    - [26, 6853.0]
  - - [2368, 5888, 1, 3328, 2368, 2368, 3328, 5888]
    - [26, 6893.0]
  - - [2944, 5888, 1, 3328, 2944, 2944, 3328, 5888]
    - [52, 6942.0]
  - - [3584, 5888, 1, 3328, 3584, 3584, 3328, 5888]
    - [0, 6884.0]
  - - [4288, 5888, 1, 3328, 4288, 4288, 3328, 5888]
    - [50, 6757.0]
  - - [5056, 5888, 1, 3328, 5056, 5056, 3328, 5888]
    - [50, 6964.0]
  - - [5888, 5888, 1, 3328, 5888, 5888, 3328, 5888]
    - [54, 6768.0]
  - - [6784, 5888, 1, 3328, 6784, 6784, 3328, 5888]
    - [27, 6932.0]
  - - [256, 6784, 1, 3328, 256, 256, 3328, 6784]
    - [52, 5229.0]
  - - [448, 6784, 1, 3328, 448, 448, 3328, 6784]
    - [47, 5088.0]
  - - [704, 6784, 1, 3328, 704, 704, 3328, 6784]
    - [15, 6508.0]
  - - [1024, 6784, 1, 3328, 1024, 1024, 3328, 6784]
    - [26, 6271.0]
  - - [1408, 6784, 1, 3328, 1408, 1408, 3328, 6784]
    - [15, 6761.0]
  - - [1856, 6784, 1, 3328, 1856, 1856, 3328, 6784]
    - [26, 6790.0]
  - - [2368, 6784, 1, 3328, 2368, 2368, 3328, 6784]
    - [15, 6733.0]
  - - [2944, 6784, 1, 3328, 2944, 2944, 3328, 6784]
    - [26, 6842.0]
  - - [3584, 6784, 1, 3328, 3584, 3584, 3328, 6784]
    - [52, 6943.0]
  - - [4288, 6784, 1, 3328, 4288, 4288, 3328, 6784]
    - [38, 6687.0]
  - - [5056, 6784, 1, 3328, 5056, 5056, 3328, 6784]
    - [15, 7196.0]
  - - [5888, 6784, 1, 3328, 5888, 5888, 3328, 6784]
    - [3, 6945.0]
  - - [6784, 6784, 1, 3328, 6784, 6784, 3328, 6784]
    - [3, 7163.0]
  - - [1024, 1024, 1, 1024, 1024, 1024, 1024, 1024]
    - [15, 4486.0]
  - - [32, 32, 1, 32, 32, 32, 32, 32]
    - [60, 2.0]
  - - [32, 64, 1, 256, 32, 32, 256, 64]
    - [62, 10.0]
  - - [32, 128, 1, 256, 32, 32, 256, 128]
    - [62, 20.0]
  - - [32, 256, 1, 256, 32, 32, 256, 256]
    - [62, 42.0]
  - - [32, 448, 1, 256, 32, 32, 256, 448]
    - [69, 73.0]
  - - [32, 704, 1, 256, 32, 32, 256, 704]
    - [69, 116.0]
  - - [32, 1024, 1, 256, 32, 32, 256, 1024]
    - [69, 168.0]
  - - [32, 1408, 1, 256, 32, 32, 256, 1408]
    - [62, 232.0]
  - - [32, 1856, 1, 256, 32, 32, 256, 1856]
    - [62, 306.0]
  - - [32, 2368, 1, 256, 32, 32, 256, 2368]
    - [62, 391.0]
  - - [32, 2944, 1, 256, 32, 32, 256, 2944]
    - [69, 480.0]
  - - [32, 3584, 1, 256, 32, 32, 256, 3584]
    - [75, 811.0]
  - - [32, 4288, 1, 256, 32, 32, 256, 4288]
    - [67, 681.0]
  - - [32, 5056, 1, 256, 32, 32, 256, 5056]
    - [67, 796.0]
  - - [32, 5888, 1, 256, 32, 32, 256, 5888]
    - [67, 918.0]
  - - [32, 6784, 1, 256, 32, 32, 256, 6784]
    - [75, 1026.0]
  - - [32, 64, 1, 1280, 32, 32, 1280, 64]
    - [85, 48.0]
  - - [32, 128, 1, 1280, 32, 32, 1280, 128]
    - [84, 94.0]
  - - [32, 256, 1, 1280, 32, 32, 1280, 256]
    - [84, 187.0]
  - - [32, 448, 1, 1280, 32, 32, 1280, 448]
    - [85, 333.0]
  - - [32, 704, 1, 1280, 32, 32, 1280, 704]
    - [86, 637.0]
  - - [32, 1024, 1, 1280, 32, 32, 1280, 1024]
    - [85, 686.0]
  - - [32, 1408, 1, 1280, 32, 32, 1280, 1408]
    - [86, 921.0]
  - - [32, 1856, 1, 1280, 32, 32, 1280, 1856]
    - [86, 930.0]
  - - [32, 2368, 1, 1280, 32, 32, 1280, 2368]
    - [83, 1027.0]
  - - [32, 2944, 1, 1280, 32, 32, 1280, 2944]
    - [83, 972.0]
  - - [32, 3584, 1, 1280, 32, 32, 1280, 3584]
    - [83, 1158.0]
  - - [32, 4288, 1, 1280, 32, 32, 1280, 4288]
    - [81, 1144.0]
  - - [32, 5056, 1, 1280, 32, 32, 1280, 5056]
    - [78, 1132.0]
  - - [32, 5888, 1, 1280, 32, 32, 1280, 5888]
    - [79, 1194.0]
  - - [32, 6784, 1, 1280, 32, 32, 1280, 6784]
    - [77, 1252.0]
  - - [32, 64, 1, 3328, 32, 32, 3328, 64]
    - [87, 83.0]
  - - [32, 128, 1, 3328, 32, 32, 3328, 128]
    - [87, 167.0]
  - - [32, 256, 1, 3328, 32, 32, 3328, 256]
    - [91, 376.0]
  - - [32, 448, 1, 3328, 32, 32, 3328, 448]
    - [91, 663.0]
  - - [32, 704, 1, 3328, 32, 32, 3328, 704]
    - [85, 784.0]
  - - [32, 1024, 1, 3328, 32, 32, 3328, 1024]
    - [91, 1048.0]
  - - [32, 1408, 1, 3328, 32, 32, 3328, 1408]
    - [86, 1084.0]
  - - [32, 1856, 1, 3328, 32, 32, 3328, 1856]
    - [90, 1191.0]
  - - [32, 2368, 1, 3328, 32, 32, 3328, 2368]
    - [87, 1173.0]
  - - [32, 2944, 1, 3328, 32, 32, 3328, 2944]
    - [88, 1308.0]
  - - [32, 3584, 1, 3328, 32, 32, 3328, 3584]
    - [83, 1292.0]
  - - [32, 4288, 1, 3328, 32, 32, 3328, 4288]
    - [85, 1289.0]
  - - [32, 5056, 1, 3328, 32, 32, 3328, 5056]
    - [88, 1361.0]
  - - [32, 5888, 1, 3328, 32, 32, 3328, 5888]
    - [88, 1364.0]
  - - [32, 6784, 1, 3328, 32, 32, 3328, 6784]
    - [80, 1420.0]
  - - [64, 32, 1, 256, 64, 64, 256, 32]
    - [62, 10.0]
  - - [128, 32, 1, 256, 128, 128, 256, 32]
    - [69, 21.0]
  - - [256, 32, 1, 256, 256, 256, 256, 32]
    - [74, 51.0]
  - - [448, 32, 1, 256, 448, 448, 256, 32]
    - [69, 74.0]
  - - [704, 32, 1, 256, 704, 704, 256, 32]
    - [69, 116.0]
  - - [1024, 32, 1, 256, 1024, 1024, 256, 32]
    - [69, 169.0]
  - - [1408, 32, 1, 256, 1408, 1408, 256, 32]
    - [69, 229.0]
  - - [1856, 32, 1, 256, 1856, 1856, 256, 32]
    - [69, 304.0]
  - - [2368, 32, 1, 256, 2368, 2368, 256, 32]
    - [69, 385.0]
  - - [2944, 32, 1, 256, 2944, 2944, 256, 32]
    - [69, 579.0]
  - - [3584, 32, 1, 256, 3584, 3584, 256, 32]
    - [75, 791.0]
  - - [4288, 32, 1, 256, 4288, 4288, 256, 32]
    - [75, 641.0]
  - - [5056, 32, 1, 256, 5056, 5056, 256, 32]
    - [75, 749.0]
  - - [5888, 32, 1, 256, 5888, 5888, 256, 32]
    - [75, 866.0]
  - - [6784, 32, 1, 256, 6784, 6784, 256, 32]
    - [75, 999.0]
  - - [64, 32, 1, 1280, 64, 64, 1280, 32]
    - [85, 48.0]
  - - [128, 32, 1, 1280, 128, 128, 1280, 32]
    - [85, 95.0]
  - - [256, 32, 1, 1280, 256, 256, 1280, 32]
    - [85, 236.0]
  - - [448, 32, 1, 1280, 448, 448, 1280, 32]
    - [84, 336.0]
  - - [704, 32, 1, 1280, 704, 704, 1280, 32]
    - [85, 643.0]
  - - [1024, 32, 1, 1280, 1024, 1024, 1280, 32]
    - [85, 675.0]
  - - [1408, 32, 1, 1280, 1408, 1408, 1280, 32]
    - [85, 909.0]
  - - [1856, 32, 1, 1280, 1856, 1856, 1280, 32]
    - [86, 899.0]
  - - [2368, 32, 1, 1280, 2368, 2368, 1280, 32]
    - [83, 1003.0]
  - - [2944, 32, 1, 1280, 2944, 2944, 1280, 32]
    - [83, 948.0]
  - - [3584, 32, 1, 1280, 3584, 3584, 1280, 32]
    - [83, 1052.0]
  - - [4288, 32, 1, 1280, 4288, 4288, 1280, 32]
    - [82, 951.0]
  - - [5056, 32, 1, 1280, 5056, 5056, 1280, 32]
    - [76, 915.0]
  - - [5888, 32, 1, 1280, 5888, 5888, 1280, 32]
    - [75, 978.0]
  - - [6784, 32, 1, 1280, 6784, 6784, 1280, 32]
    - [75, 1127.0]
  - - [64, 32, 1, 3328, 64, 64, 3328, 32]
    - [87, 82.0]
  - - [128, 32, 1, 3328, 128, 128, 3328, 32]
    - [87, 166.0]
  - - [256, 32, 1, 3328, 256, 256, 3328, 32]
    - [87, 329.0]
  - - [448, 32, 1, 3328, 448, 448, 3328, 32]
    - [87, 569.0]
  - - [704, 32, 1, 3328, 704, 704, 3328, 32]
    - [85, 778.0]
  - - [1024, 32, 1, 3328, 1024, 1024, 3328, 32]
    - [91, 1038.0]
  - - [1408, 32, 1, 3328, 1408, 1408, 3328, 32]
    - [86, 1059.0]
  - - [1856, 32, 1, 3328, 1856, 1856, 3328, 32]
    - [89, 1011.0]
  - - [2368, 32, 1, 3328, 2368, 2368, 3328, 32]
    - [83, 1080.0]
  - - [2944, 32, 1, 3328, 2944, 2944, 3328, 32]
    - [83, 954.0]
  - - [3584, 32, 1, 3328, 3584, 3584, 3328, 32]
    - [76, 1014.0]
  - - [4288, 32, 1, 3328, 4288, 4288, 3328, 32]
    - [82, 905.0]
  - - [5056, 32, 1, 3328, 5056, 5056, 3328, 32]
    - [78, 938.0]
  - - [5888, 32, 1, 3328, 5888, 5888, 3328, 32]
    - [75, 1003.0]
  - - [6784, 32, 1, 3328, 6784, 6784, 3328, 32]
    - [75, 1150.0]
  - - [64, 64, 1, 32, 64, 64, 32, 64]
    - [60, 6.0]
  - - [128, 64, 1, 32, 128, 128, 32, 64]
    - [60, 12.0]
  - - [256, 64, 1, 32, 256, 256, 32, 64]
    - [60, 27.0]
  - - [448, 64, 1, 32, 448, 448, 32, 64]
    - [60, 46.0]
  - - [704, 64, 1, 32, 704, 704, 32, 64]
    - [63, 73.0]
  - - [1024, 64, 1, 32, 1024, 1024, 32, 64]
    - [63, 105.0]
  - - [1408, 64, 1, 32, 1408, 1408, 32, 64]
    - [60, 142.0]
  - - [1856, 64, 1, 32, 1856, 1856, 32, 64]
    - [60, 191.0]
  - - [2368, 64, 1, 32, 2368, 2368, 32, 64]
    - [63, 240.0]
  - - [2944, 64, 1, 32, 2944, 2944, 32, 64]
    - [70, 522.0]
  - - [3584, 64, 1, 32, 3584, 3584, 32, 64]
    - [67, 639.0]
  - - [4288, 64, 1, 32, 4288, 4288, 32, 64]
    - [67, 522.0]
  - - [5056, 64, 1, 32, 5056, 5056, 32, 64]
    - [72, 585.0]
  - - [5888, 64, 1, 32, 5888, 5888, 32, 64]
    - [70, 705.0]
  - - [6784, 64, 1, 32, 6784, 6784, 32, 64]
    - [73, 744.0]
  - - [64, 128, 1, 32, 64, 64, 32, 128]
    - [60, 12.0]
  - - [128, 128, 1, 32, 128, 128, 32, 128]
    - [74, 49.0]
  - - [256, 128, 1, 32, 256, 256, 32, 128]
    - [71, 55.0]
  - - [448, 128, 1, 32, 448, 448, 32, 128]
    - [63, 94.0]
  - - [704, 128, 1, 32, 704, 704, 32, 128]
    - [60, 146.0]
  - - [1024, 128, 1, 32, 1024, 1024, 32, 128]
    - [60, 211.0]
  - - [1408, 128, 1, 32, 1408, 1408, 32, 128]
    - [60, 286.0]
  - - [1856, 128, 1, 32, 1856, 1856, 32, 128]
    - [70, 597.0]
  - - [2368, 128, 1, 32, 2368, 2368, 32, 128]
    - [67, 598.0]
  - - [2944, 128, 1, 32, 2944, 2944, 32, 128]
    - [70, 733.0]
  - - [3584, 128, 1, 32, 3584, 3584, 32, 128]
    - [70, 783.0]
  - - [4288, 128, 1, 32, 4288, 4288, 32, 128]
    - [67, 847.0]
  - - [5056, 128, 1, 32, 5056, 5056, 32, 128]
    - [70, 978.0]
  - - [5888, 128, 1, 32, 5888, 5888, 32, 128]
    - [69, 960.0]
  - - [6784, 128, 1, 32, 6784, 6784, 32, 128]
    - [70, 1084.0]
  - - [64, 256, 1, 32, 64, 64, 32, 256]
    - [70, 48.0]
  - - [128, 256, 1, 32, 128, 128, 32, 256]
    - [60, 53.0]
  - - [256, 256, 1, 32, 256, 256, 32, 256]
    - [60, 106.0]
  - - [448, 256, 1, 32, 448, 448, 32, 256]
    - [63, 191.0]
  - - [704, 256, 1, 32, 704, 704, 32, 256]
    - [63, 290.0]
  - - [1024, 256, 1, 32, 1024, 1024, 32, 256]
    - [67, 606.0]
  - - [1408, 256, 1, 32, 1408, 1408, 32, 256]
    - [67, 705.0]
  - - [1856, 256, 1, 32, 1856, 1856, 32, 256]
    - [72, 752.0]
  - - [2368, 256, 1, 32, 2368, 2368, 32, 256]
    - [72, 952.0]
  - - [2944, 256, 1, 32, 2944, 2944, 32, 256]
    - [69, 1017.0]
  - - [3584, 256, 1, 32, 3584, 3584, 32, 256]
    - [71, 1092.0]
  - - [4288, 256, 1, 32, 4288, 4288, 32, 256]
    - [71, 1075.0]
  - - [5056, 256, 1, 32, 5056, 5056, 32, 256]
    - [69, 1073.0]
  - - [5888, 256, 1, 32, 5888, 5888, 32, 256]
    - [72, 987.0]
  - - [6784, 256, 1, 32, 6784, 6784, 32, 256]
    - [66, 991.0]
  - - [64, 448, 1, 32, 64, 64, 32, 448]
    - [62, 42.0]
  - - [128, 448, 1, 32, 128, 128, 32, 448]
    - [63, 95.0]
  - - [256, 448, 1, 32, 256, 256, 32, 448]
    - [63, 190.0]
  - - [448, 448, 1, 32, 448, 448, 32, 448]
    - [71, 615.0]
  - - [704, 448, 1, 32, 704, 704, 32, 448]
    - [67, 616.0]
  - - [1024, 448, 1, 32, 1024, 1024, 32, 448]
    - [67, 840.0]
  - - [1408, 448, 1, 32, 1408, 1408, 32, 448]
    - [67, 1002.0]
  - - [1856, 448, 1, 32, 1856, 1856, 32, 448]
    - [67, 1119.0]
  - - [2368, 448, 1, 32, 2368, 2368, 32, 448]
    - [73, 1091.0]
  - - [2944, 448, 1, 32, 2944, 2944, 32, 448]
    - [69, 1085.0]
  - - [3584, 448, 1, 32, 3584, 3584, 32, 448]
    - [71, 1001.0]
  - - [4288, 448, 1, 32, 4288, 4288, 32, 448]
    - [62, 1014.0]
  - - [5056, 448, 1, 32, 5056, 5056, 32, 448]
    - [62, 990.0]
  - - [5888, 448, 1, 32, 5888, 5888, 32, 448]
    - [62, 946.0]
  - - [6784, 448, 1, 32, 6784, 6784, 32, 448]
    - [65, 940.0]
  - - [64, 704, 1, 32, 64, 64, 32, 704]
    - [63, 67.0]
  - - [128, 704, 1, 32, 128, 128, 32, 704]
    - [60, 148.0]
  - - [256, 704, 1, 32, 256, 256, 32, 704]
    - [63, 289.0]
  - - [448, 704, 1, 32, 448, 448, 32, 704]
    - [67, 608.0]
  - - [704, 704, 1, 32, 704, 704, 32, 704]
    - [74, 784.0]
  - - [1024, 704, 1, 32, 1024, 1024, 32, 704]
    - [69, 958.0]
  - - [1408, 704, 1, 32, 1408, 1408, 32, 704]
    - [73, 1081.0]
  - - [1856, 704, 1, 32, 1856, 1856, 32, 704]
    - [73, 1100.0]
  - - [2368, 704, 1, 32, 2368, 2368, 32, 704]
    - [69, 1083.0]
  - - [2944, 704, 1, 32, 2944, 2944, 32, 704]
    - [62, 1016.0]
  - - [3584, 704, 1, 32, 3584, 3584, 32, 704]
    - [74, 931.0]
  - - [4288, 704, 1, 32, 4288, 4288, 32, 704]
    - [62, 983.0]
  - - [5056, 704, 1, 32, 5056, 5056, 32, 704]
    - [69, 958.0]
  - - [5888, 704, 1, 32, 5888, 5888, 32, 704]
    - [65, 931.0]
  - - [6784, 704, 1, 32, 6784, 6784, 32, 704]
    - [61, 908.0]
  - - [64, 1024, 1, 32, 64, 64, 32, 1024]
    - [60, 96.0]
  - - [128, 1024, 1, 32, 128, 128, 32, 1024]
    - [60, 213.0]
  - - [256, 1024, 1, 32, 256, 256, 32, 1024]
    - [67, 658.0]
  - - [448, 1024, 1, 32, 448, 448, 32, 1024]
    - [67, 893.0]
  - - [704, 1024, 1, 32, 704, 704, 32, 1024]
    - [69, 985.0]
  - - [1024, 1024, 1, 32, 1024, 1024, 32, 1024]
    - [75, 850.0]
  - - [1408, 1024, 1, 32, 1408, 1408, 32, 1024]
    - [73, 1085.0]
  - - [1856, 1024, 1, 32, 1856, 1856, 32, 1024]
    - [75, 1053.0]
  - - [2368, 1024, 1, 32, 2368, 2368, 32, 1024]
    - [70, 1042.0]
  - - [2944, 1024, 1, 32, 2944, 2944, 32, 1024]
    - [62, 996.0]
  - - [3584, 1024, 1, 32, 3584, 3584, 32, 1024]
    - [69, 923.0]
  - - [4288, 1024, 1, 32, 4288, 4288, 32, 1024]
    - [62, 970.0]
  - - [5056, 1024, 1, 32, 5056, 5056, 32, 1024]
    - [75, 946.0]
  - - [5888, 1024, 1, 32, 5888, 5888, 32, 1024]
    - [71, 905.0]
  - - [6784, 1024, 1, 32, 6784, 6784, 32, 1024]
    - [75, 905.0]
  - - [64, 1408, 1, 32, 64, 64, 32, 1408]
    - [65, 135.0]
  - - [128, 1408, 1, 32, 128, 128, 32, 1408]
    - [63, 298.0]
  - - [256, 1408, 1, 32, 256, 256, 32, 1408]
    - [67, 728.0]
  - - [448, 1408, 1, 32, 448, 448, 32, 1408]
    - [67, 973.0]
  - - [704, 1408, 1, 32, 704, 704, 32, 1408]
    - [70, 1087.0]
  - - [1024, 1408, 1, 32, 1024, 1024, 32, 1408]
    - [70, 937.0]
  - - [1408, 1408, 1, 32, 1408, 1408, 32, 1408]
    - [72, 1094.0]
  - - [1856, 1408, 1, 32, 1856, 1856, 32, 1408]
    - [69, 1064.0]
  - - [2368, 1408, 1, 32, 2368, 2368, 32, 1408]
    - [67, 1068.0]
  - - [2944, 1408, 1, 32, 2944, 2944, 32, 1408]
    - [67, 1003.0]
  - - [3584, 1408, 1, 32, 3584, 3584, 32, 1408]
    - [62, 955.0]
  - - [4288, 1408, 1, 32, 4288, 4288, 32, 1408]
    - [65, 960.0]
  - - [5056, 1408, 1, 32, 5056, 5056, 32, 1408]
    - [70, 942.0]
  - - [5888, 1408, 1, 32, 5888, 5888, 32, 1408]
    - [65, 910.0]
  - - [6784, 1408, 1, 32, 6784, 6784, 32, 1408]
    - [75, 904.0]
  - - [64, 1856, 1, 32, 64, 64, 32, 1856]
    - [63, 177.0]
  - - [128, 1856, 1, 32, 128, 128, 32, 1856]
    - [67, 600.0]
  - - [256, 1856, 1, 32, 256, 256, 32, 1856]
    - [73, 757.0]
  - - [448, 1856, 1, 32, 448, 448, 32, 1856]
    - [67, 1088.0]
  - - [704, 1856, 1, 32, 704, 704, 32, 1856]
    - [70, 1129.0]
  - - [1024, 1856, 1, 32, 1024, 1024, 32, 1856]
    - [70, 944.0]
  - - [1408, 1856, 1, 32, 1408, 1408, 32, 1856]
    - [70, 1085.0]
  - - [1856, 1856, 1, 32, 1856, 1856, 32, 1856]
    - [69, 1067.0]
  - - [2368, 1856, 1, 32, 2368, 2368, 32, 1856]
    - [71, 1062.0]
  - - [2944, 1856, 1, 32, 2944, 2944, 32, 1856]
    - [65, 999.0]
  - - [3584, 1856, 1, 32, 3584, 3584, 32, 1856]
    - [62, 953.0]
  - - [4288, 1856, 1, 32, 4288, 4288, 32, 1856]
    - [62, 960.0]
  - - [5056, 1856, 1, 32, 5056, 5056, 32, 1856]
    - [62, 947.0]
  - - [5888, 1856, 1, 32, 5888, 5888, 32, 1856]
    - [62, 897.0]
  - - [6784, 1856, 1, 32, 6784, 6784, 32, 1856]
    - [60, 897.0]
  - - [64, 2368, 1, 32, 64, 64, 32, 2368]
    - [65, 225.0]
  - - [128, 2368, 1, 32, 128, 128, 32, 2368]
    - [70, 590.0]
  - - [256, 2368, 1, 32, 256, 256, 32, 2368]
    - [67, 942.0]
  - - [448, 2368, 1, 32, 448, 448, 32, 2368]
    - [73, 1086.0]
  - - [704, 2368, 1, 32, 704, 704, 32, 2368]
    - [69, 1116.0]
  - - [1024, 2368, 1, 32, 1024, 1024, 32, 2368]
    - [73, 945.0]
  - - [1408, 2368, 1, 32, 1408, 1408, 32, 2368]
    - [70, 1085.0]
  - - [1856, 2368, 1, 32, 1856, 1856, 32, 2368]
    - [72, 1071.0]
  - - [2368, 2368, 1, 32, 2368, 2368, 32, 2368]
    - [69, 1068.0]
  - - [2944, 2368, 1, 32, 2944, 2944, 32, 2368]
    - [60, 995.0]
  - - [3584, 2368, 1, 32, 3584, 3584, 32, 2368]
    - [65, 944.0]
  - - [4288, 2368, 1, 32, 4288, 4288, 32, 2368]
    - [62, 959.0]
  - - [5056, 2368, 1, 32, 5056, 5056, 32, 2368]
    - [62, 940.0]
  - - [5888, 2368, 1, 32, 5888, 5888, 32, 2368]
    - [70, 889.0]
  - - [6784, 2368, 1, 32, 6784, 6784, 32, 2368]
    - [60, 903.0]
  - - [64, 2944, 1, 32, 64, 64, 32, 2944]
    - [75, 539.0]
  - - [128, 2944, 1, 32, 128, 128, 32, 2944]
    - [67, 733.0]
  - - [256, 2944, 1, 32, 256, 256, 32, 2944]
    - [67, 1043.0]
  - - [448, 2944, 1, 32, 448, 448, 32, 2944]
    - [72, 1108.0]
  - - [704, 2944, 1, 32, 704, 704, 32, 2944]
    - [69, 1122.0]
  - - [1024, 2944, 1, 32, 1024, 1024, 32, 2944]
    - [67, 981.0]
  - - [1408, 2944, 1, 32, 1408, 1408, 32, 2944]
    - [72, 1079.0]
  - - [1856, 2944, 1, 32, 1856, 1856, 32, 2944]
    - [72, 1069.0]
  - - [2368, 2944, 1, 32, 2368, 2368, 32, 2944]
    - [62, 1071.0]
  - - [2944, 2944, 1, 32, 2944, 2944, 32, 2944]
    - [62, 1008.0]
  - - [3584, 2944, 1, 32, 3584, 3584, 32, 2944]
    - [62, 942.0]
  - - [4288, 2944, 1, 32, 4288, 4288, 32, 2944]
    - [62, 954.0]
  - - [5056, 2944, 1, 32, 5056, 5056, 32, 2944]
    - [65, 937.0]
  - - [5888, 2944, 1, 32, 5888, 5888, 32, 2944]
    - [65, 891.0]
  - - [6784, 2944, 1, 32, 6784, 6784, 32, 2944]
    - [63, 895.0]
  - - [64, 3584, 1, 32, 64, 64, 32, 3584]
    - [69, 713.0]
  - - [128, 3584, 1, 32, 128, 128, 32, 3584]
    - [70, 897.0]
  - - [256, 3584, 1, 32, 256, 256, 32, 3584]
    - [67, 1139.0]
  - - [448, 3584, 1, 32, 448, 448, 32, 3584]
    - [72, 1104.0]
  - - [704, 3584, 1, 32, 704, 704, 32, 3584]
    - [75, 1100.0]
  - - [1024, 3584, 1, 32, 1024, 1024, 32, 3584]
    - [67, 993.0]
  - - [1408, 3584, 1, 32, 1408, 1408, 32, 3584]
    - [75, 1093.0]
  - - [1856, 3584, 1, 32, 1856, 1856, 32, 3584]
    - [69, 1069.0]
  - - [2368, 3584, 1, 32, 2368, 2368, 32, 3584]
    - [65, 1069.0]
  - - [2944, 3584, 1, 32, 2944, 2944, 32, 3584]
    - [65, 985.0]
  - - [3584, 3584, 1, 32, 3584, 3584, 32, 3584]
    - [65, 946.0]
  - - [4288, 3584, 1, 32, 4288, 4288, 32, 3584]
    - [65, 954.0]
  - - [5056, 3584, 1, 32, 5056, 5056, 32, 3584]
    - [62, 940.0]
  - - [5888, 3584, 1, 32, 5888, 5888, 32, 3584]
    - [60, 884.0]
  - - [6784, 3584, 1, 32, 6784, 6784, 32, 3584]
    - [63, 895.0]
  - - [64, 4288, 1, 32, 64, 64, 32, 4288]
    - [70, 532.0]
  - - [128, 4288, 1, 32, 128, 128, 32, 4288]
    - [63, 872.0]
  - - [256, 4288, 1, 32, 256, 256, 32, 4288]
    - [73, 1100.0]
  - - [448, 4288, 1, 32, 448, 448, 32, 4288]
    - [73, 1088.0]
  - - [704, 4288, 1, 32, 704, 704, 32, 4288]
    - [67, 1102.0]
  - - [1024, 4288, 1, 32, 1024, 1024, 32, 4288]
    - [74, 1004.0]
  - - [1408, 4288, 1, 32, 1408, 1408, 32, 4288]
    - [62, 1081.0]
  - - [1856, 4288, 1, 32, 1856, 1856, 32, 4288]
    - [72, 1075.0]
  - - [2368, 4288, 1, 32, 2368, 2368, 32, 4288]
    - [70, 1066.0]
  - - [2944, 4288, 1, 32, 2944, 2944, 32, 4288]
    - [62, 987.0]
  - - [3584, 4288, 1, 32, 3584, 3584, 32, 4288]
    - [65, 940.0]
  - - [4288, 4288, 1, 32, 4288, 4288, 32, 4288]
    - [62, 952.0]
  - - [5056, 4288, 1, 32, 5056, 5056, 32, 4288]
    - [62, 936.0]
  - - [5888, 4288, 1, 32, 5888, 5888, 32, 4288]
    - [63, 885.0]
  - - [6784, 4288, 1, 32, 6784, 6784, 32, 4288]
    - [63, 889.0]
  - - [64, 5056, 1, 32, 64, 64, 32, 5056]
    - [67, 641.0]
  - - [128, 5056, 1, 32, 128, 128, 32, 5056]
    - [70, 1024.0]
  - - [256, 5056, 1, 32, 256, 256, 32, 5056]
    - [74, 1094.0]
  - - [448, 5056, 1, 32, 448, 448, 32, 5056]
    - [74, 1102.0]
  - - [704, 5056, 1, 32, 704, 704, 32, 5056]
    - [67, 1108.0]
  - - [1024, 5056, 1, 32, 1024, 1024, 32, 5056]
    - [74, 1025.0]
  - - [1408, 5056, 1, 32, 1408, 1408, 32, 5056]
    - [63, 1082.0]
  - - [1856, 5056, 1, 32, 1856, 1856, 32, 5056]
    - [67, 1073.0]
  - - [2368, 5056, 1, 32, 2368, 2368, 32, 5056]
    - [65, 1076.0]
  - - [2944, 5056, 1, 32, 2944, 2944, 32, 5056]
    - [60, 989.0]
  - - [3584, 5056, 1, 32, 3584, 3584, 32, 5056]
    - [62, 948.0]
  - - [4288, 5056, 1, 32, 4288, 4288, 32, 5056]
    - [62, 950.0]
  - - [5056, 5056, 1, 32, 5056, 5056, 32, 5056]
    - [68, 944.0]
  - - [5888, 5056, 1, 32, 5888, 5888, 32, 5056]
    - [60, 884.0]
  - - [6784, 5056, 1, 32, 6784, 6784, 32, 5056]
    - [60, 892.0]
  - - [64, 5888, 1, 32, 64, 64, 32, 5888]
    - [67, 733.0]
  - - [128, 5888, 1, 32, 128, 128, 32, 5888]
    - [69, 999.0]
  - - [256, 5888, 1, 32, 256, 256, 32, 5888]
    - [70, 1083.0]
  - - [448, 5888, 1, 32, 448, 448, 32, 5888]
    - [74, 1091.0]
  - - [704, 5888, 1, 32, 704, 704, 32, 5888]
    - [72, 1111.0]
  - - [1024, 5888, 1, 32, 1024, 1024, 32, 5888]
    - [73, 1026.0]
  - - [1408, 5888, 1, 32, 1408, 1408, 32, 5888]
    - [60, 1083.0]
  - - [1856, 5888, 1, 32, 1856, 1856, 32, 5888]
    - [74, 1072.0]
  - - [2368, 5888, 1, 32, 2368, 2368, 32, 5888]
    - [62, 1069.0]
  - - [2944, 5888, 1, 32, 2944, 2944, 32, 5888]
    - [60, 994.0]
  - - [3584, 5888, 1, 32, 3584, 3584, 32, 5888]
    - [62, 943.0]
  - - [4288, 5888, 1, 32, 4288, 4288, 32, 5888]
    - [62, 956.0]
  - - [5056, 5888, 1, 32, 5056, 5056, 32, 5888]
    - [68, 949.0]
  - - [5888, 5888, 1, 32, 5888, 5888, 32, 5888]
    - [63, 882.0]
  - - [6784, 5888, 1, 32, 6784, 6784, 32, 5888]
    - [63, 894.0]
  - - [64, 6784, 1, 32, 64, 64, 32, 6784]
    - [67, 845.0]
  - - [128, 6784, 1, 32, 128, 128, 32, 6784]
    - [69, 1126.0]
  - - [256, 6784, 1, 32, 256, 256, 32, 6784]
    - [74, 1054.0]
  - - [448, 6784, 1, 32, 448, 448, 32, 6784]
    - [72, 1097.0]
  - - [704, 6784, 1, 32, 704, 704, 32, 6784]
    - [75, 1100.0]
  - - [1024, 6784, 1, 32, 1024, 1024, 32, 6784]
    - [69, 1027.0]
  - - [1408, 6784, 1, 32, 1408, 1408, 32, 6784]
    - [75, 1086.0]
  - - [1856, 6784, 1, 32, 1856, 1856, 32, 6784]
    - [72, 1069.0]
  - - [2368, 6784, 1, 32, 2368, 2368, 32, 6784]
    - [62, 1073.0]
  - - [2944, 6784, 1, 32, 2944, 2944, 32, 6784]
    - [60, 991.0]
  - - [3584, 6784, 1, 32, 3584, 3584, 32, 6784]
    - [63, 935.0]
  - - [4288, 6784, 1, 32, 4288, 4288, 32, 6784]
    - [62, 948.0]
  - - [5056, 6784, 1, 32, 5056, 5056, 32, 6784]
    - [68, 956.0]
  - - [5888, 6784, 1, 32, 5888, 5888, 32, 6784]
    - [60, 881.0]
  - - [6784, 6784, 1, 32, 6784, 6784, 32, 6784]
    - [60, 893.0]
  - - [32, 32, 1, 256, 32, 32, 256, 32]
    - [62, 5.0]
  - - [32, 32, 1, 1280, 32, 32, 1280, 32]
    - [84, 24.0]
  - - [32, 32, 1, 3328, 32, 32, 3328, 32]
    - [87, 42.0]
  - - [32, 64, 1, 32, 32, 32, 32, 64]
    - [60, 3.0]
  - - [32, 128, 1, 32, 32, 32, 32, 128]
    - [60, 7.0]
  - - [32, 256, 1, 32, 32, 32, 32, 256]
    - [60, 14.0]
  - - [32, 448, 1, 32, 32, 32, 32, 448]
    - [64, 34.0]
  - - [32, 704, 1, 32, 32, 32, 32, 704]
    - [60, 39.0]
  - - [32, 1024, 1, 32, 32, 32, 32, 1024]
    - [60, 56.0]
  - - [32, 1408, 1, 32, 32, 32, 32, 1408]
    - [62, 80.0]
  - - [32, 1856, 1, 32, 32, 32, 32, 1856]
    - [62, 104.0]
  - - [32, 2368, 1, 32, 32, 32, 32, 2368]
    - [60, 131.0]
  - - [32, 2944, 1, 32, 32, 32, 32, 2944]
    - [60, 163.0]
  - - [32, 3584, 1, 32, 32, 32, 32, 3584]
    - [69, 387.0]
  - - [32, 4288, 1, 32, 32, 32, 32, 4288]
    - [67, 387.0]
  - - [32, 5056, 1, 32, 32, 32, 32, 5056]
    - [70, 460.0]
  - - [32, 5888, 1, 32, 32, 32, 32, 5888]
    - [70, 525.0]
  - - [32, 6784, 1, 32, 32, 32, 32, 6784]
    - [70, 586.0]
  - - [64, 32, 1, 32, 64, 64, 32, 32]
    - [60, 3.0]
  - - [128, 32, 1, 32, 128, 128, 32, 32]
    - [60, 7.0]
  - - [256, 32, 1, 32, 256, 256, 32, 32]
    - [67, 26.0]
  - - [448, 32, 1, 32, 448, 448, 32, 32]
    - [63, 28.0]
  - - [704, 32, 1, 32, 704, 704, 32, 32]
    - [60, 42.0]
  - - [1024, 32, 1, 32, 1024, 1024, 32, 32]
    - [60, 61.0]
  - - [1408, 32, 1, 32, 1408, 1408, 32, 32]
    - [63, 85.0]
  - - [1856, 32, 1, 32, 1856, 1856, 32, 32]
    - [60, 113.0]
  - - [2368, 32, 1, 32, 2368, 2368, 32, 32]
    - [63, 139.0]
  - - [2944, 32, 1, 32, 2944, 2944, 32, 32]
    - [74, 289.0]
  - - [3584, 32, 1, 32, 3584, 3584, 32, 32]
    - [71, 351.0]
  - - [4288, 32, 1, 32, 4288, 4288, 32, 32]
    - [70, 349.0]
  - - [5056, 32, 1, 32, 5056, 5056, 32, 32]
    - [70, 399.0]
  - - [5888, 32, 1, 32, 5888, 5888, 32, 32]
    - [70, 455.0]
  - - [6784, 32, 1, 32, 6784, 6784, 32, 32]
    - [67, 501.0]
  - - [1, 1, 1, 1, 1, 1, 1, 1]
    - [98, 0.00011249226550199748]
  - - [1, 64, 1, 256, 1, 1, 256, 64]
    - [97, 0.32]
  - - [1, 128, 1, 256, 1, 1, 256, 128]
    - [97, 1.0]
  - - [1, 256, 1, 256, 1, 1, 256, 256]
    - [93, 1.0]
  - - [1, 448, 1, 256, 1, 1, 256, 448]
    - [94, 2.0]
  - - [1, 704, 1, 256, 1, 1, 256, 704]
    - [97, 4.0]
  - - [1, 1024, 1, 256, 1, 1, 256, 1024]
    - [97, 5.0]
  - - [1, 1408, 1, 256, 1, 1, 256, 1408]
    - [97, 7.0]
  - - [1, 1856, 1, 256, 1, 1, 256, 1856]
    - [97, 10.0]
  - - [1, 2368, 1, 256, 1, 1, 256, 2368]
    - [97, 12.0]
  - - [1, 2944, 1, 256, 1, 1, 256, 2944]
    - [97, 16.0]
  - - [1, 3584, 1, 256, 1, 1, 256, 3584]
    - [106, 24.0]
  - - [1, 4288, 1, 256, 1, 1, 256, 4288]
    - [106, 20.0]
  - - [1, 5056, 1, 256, 1, 1, 256, 5056]
    - [106, 23.0]
  - - [1, 5888, 1, 256, 1, 1, 256, 5888]
    - [106, 27.0]
  - - [1, 6784, 1, 256, 1, 1, 256, 6784]
    - [106, 31.0]
  - - [1, 64, 1, 1280, 1, 1, 1280, 64]
    - [117, 1.0]
  - - [1, 128, 1, 1280, 1, 1, 1280, 128]
    - [124, 3.0]
  - - [1, 256, 1, 1280, 1, 1, 1280, 256]
    - [124, 6.0]
  - - [1, 448, 1, 1280, 1, 1, 1280, 448]
    - [124, 10.0]
  - - [1, 704, 1, 1280, 1, 1, 1280, 704]
    - [125, 20.0]
  - - [1, 1024, 1, 1280, 1, 1, 1280, 1024]
    - [125, 21.0]
  - - [1, 1408, 1, 1280, 1, 1, 1280, 1408]
    - [125, 28.0]
  - - [1, 1856, 1, 1280, 1, 1, 1280, 1856]
    - [125, 30.0]
  - - [1, 2368, 1, 1280, 1, 1, 1280, 2368]
    - [121, 32.0]
  - - [1, 2944, 1, 1280, 1, 1, 1280, 2944]
    - [125, 32.0]
  - - [1, 3584, 1, 1280, 1, 1, 1280, 3584]
    - [125, 38.0]
  - - [1, 4288, 1, 1280, 1, 1, 1280, 4288]
    - [125, 40.0]
  - - [1, 5056, 1, 1280, 1, 1, 1280, 5056]
    - [123, 38.0]
  - - [1, 5888, 1, 1280, 1, 1, 1280, 5888]
    - [121, 40.0]
  - - [1, 6784, 1, 1280, 1, 1, 1280, 6784]
    - [123, 43.0]
  - - [1, 64, 1, 3328, 1, 1, 3328, 64]
    - [124, 2.0]
  - - [1, 128, 1, 3328, 1, 1, 3328, 128]
    - [128, 5.0]
  - - [1, 256, 1, 3328, 1, 1, 3328, 256]
    - [128, 10.0]
  - - [1, 448, 1, 3328, 1, 1, 3328, 448]
    - [131, 20.0]
  - - [1, 704, 1, 3328, 1, 1, 3328, 704]
    - [125, 24.0]
  - - [1, 1024, 1, 3328, 1, 1, 3328, 1024]
    - [130, 32.0]
  - - [1, 1408, 1, 3328, 1, 1, 3328, 1408]
    - [125, 33.0]
  - - [1, 1856, 1, 3328, 1, 1, 3328, 1856]
    - [127, 36.0]
  - - [1, 2368, 1, 3328, 1, 1, 3328, 2368]
    - [129, 37.0]
  - - [1, 2944, 1, 3328, 1, 1, 3328, 2944]
    - [127, 42.0]
  - - [1, 3584, 1, 3328, 1, 1, 3328, 3584]
    - [129, 43.0]
  - - [1, 4288, 1, 3328, 1, 1, 3328, 4288]
    - [125, 43.0]
  - - [1, 5056, 1, 3328, 1, 1, 3328, 5056]
    - [127, 46.0]
  - - [1, 5888, 1, 3328, 1, 1, 3328, 5888]
    - [127, 46.0]
  - - [1, 6784, 1, 3328, 1, 1, 3328, 6784]
    - [127, 46.0]
  - - [64, 1, 1, 256, 64, 64, 256, 1]
    - [97, 0.33]
  - - [128, 1, 1, 256, 128, 128, 256, 1]
    - [94, 1.0]
  - - [256, 1, 1, 256, 256, 256, 256, 1]
    - [116, 2.0]
  - - [448, 1, 1, 256, 448, 448, 256, 1]
    - [94, 2.0]
  - - [704, 1, 1, 256, 704, 704, 256, 1]
    - [97, 4.0]
  - - [1024, 1, 1, 256, 1024, 1024, 256, 1]
    - [97, 5.0]
  - - [1408, 1, 1, 256, 1408, 1408, 256, 1]
    - [97, 7.0]
  - - [1856, 1, 1, 256, 1856, 1856, 256, 1]
    - [97, 10.0]
  - - [2368, 1, 1, 256, 2368, 2368, 256, 1]
    - [97, 12.0]
  - - [2944, 1, 1, 256, 2944, 2944, 256, 1]
    - [97, 15.0]
  - - [3584, 1, 1, 256, 3584, 3584, 256, 1]
    - [106, 23.0]
  - - [4288, 1, 1, 256, 4288, 4288, 256, 1]
    - [106, 19.0]
  - - [5056, 1, 1, 256, 5056, 5056, 256, 1]
    - [106, 23.0]
  - - [5888, 1, 1, 256, 5888, 5888, 256, 1]
    - [106, 26.0]
  - - [6784, 1, 1, 256, 6784, 6784, 256, 1]
    - [106, 30.0]
  - - [64, 1, 1, 1280, 64, 64, 1280, 1]
    - [124, 2.0]
  - - [128, 1, 1, 1280, 128, 128, 1280, 1]
    - [124, 3.0]
  - - [256, 1, 1, 1280, 256, 256, 1280, 1]
    - [124, 6.0]
  - - [448, 1, 1, 1280, 448, 448, 1280, 1]
    - [124, 11.0]
  - - [704, 1, 1, 1280, 704, 704, 1280, 1]
    - [125, 20.0]
  - - [1024, 1, 1, 1280, 1024, 1024, 1280, 1]
    - [125, 21.0]
  - - [1408, 1, 1, 1280, 1408, 1408, 1280, 1]
    - [125, 29.0]
  - - [1856, 1, 1, 1280, 1856, 1856, 1280, 1]
    - [125, 29.0]
  - - [2368, 1, 1, 1280, 2368, 2368, 1280, 1]
    - [121, 31.0]
  - - [2944, 1, 1, 1280, 2944, 2944, 1280, 1]
    - [121, 30.0]
  - - [3584, 1, 1, 1280, 3584, 3584, 1280, 1]
    - [121, 34.0]
  - - [4288, 1, 1, 1280, 4288, 4288, 1280, 1]
    - [121, 32.0]
  - - [5056, 1, 1, 1280, 5056, 5056, 1280, 1]
    - [118, 31.0]
  - - [5888, 1, 1, 1280, 5888, 5888, 1280, 1]
    - [106, 29.0]
  - - [6784, 1, 1, 1280, 6784, 6784, 1280, 1]
    - [106, 33.0]
  - - [64, 1, 1, 3328, 64, 64, 3328, 1]
    - [128, 3.0]
  - - [128, 1, 1, 3328, 128, 128, 3328, 1]
    - [128, 5.0]
  - - [256, 1, 1, 3328, 256, 256, 3328, 1]
    - [128, 10.0]
  - - [448, 1, 1, 3328, 448, 448, 3328, 1]
    - [131, 20.0]
  - - [704, 1, 1, 3328, 704, 704, 3328, 1]
    - [125, 24.0]
  - - [1024, 1, 1, 3328, 1024, 1024, 3328, 1]
    - [129, 32.0]
  - - [1408, 1, 1, 3328, 1408, 1408, 3328, 1]
    - [129, 33.0]
  - - [1856, 1, 1, 3328, 1856, 1856, 3328, 1]
    - [129, 32.0]
  - - [2368, 1, 1, 3328, 2368, 2368, 3328, 1]
    - [122, 32.0]
  - - [2944, 1, 1, 3328, 2944, 2944, 3328, 1]
    - [131, 32.0]
  - - [3584, 1, 1, 3328, 3584, 3584, 3328, 1]
    - [119, 31.0]
  - - [4288, 1, 1, 3328, 4288, 4288, 3328, 1]
    - [126, 31.0]
  - - [5056, 1, 1, 3328, 5056, 5056, 3328, 1]
    - [119, 31.0]
  - - [5888, 1, 1, 3328, 5888, 5888, 3328, 1]
    - [106, 30.0]
  - - [6784, 1, 1, 3328, 6784, 6784, 3328, 1]
    - [106, 34.0]
  - - [64, 64, 1, 1, 64, 64, 1, 64]
    - [94, 0.27]
  - - [128, 64, 1, 1, 128, 128, 1, 64]
    - [94, 1.0]
  - - [256, 64, 1, 1, 256, 256, 1, 64]
    - [100, 3.0]
  - - [448, 64, 1, 1, 448, 448, 1, 64]
    - [107, 3.0]
  - - [704, 64, 1, 1, 704, 704, 1, 64]
    - [93, 3.0]
  - - [1024, 64, 1, 1, 1024, 1024, 1, 64]
    - [94, 5.0]
  - - [1408, 64, 1, 1, 1408, 1408, 1, 64]
    - [93, 6.0]
  - - [1856, 64, 1, 1, 1856, 1856, 1, 64]
    - [98, 9.0]
  - - [2368, 64, 1, 1, 2368, 2368, 1, 64]
    - [94, 11.0]
  - - [2944, 64, 1, 1, 2944, 2944, 1, 64]
    - [94, 13.0]
  - - [3584, 64, 1, 1, 3584, 3584, 1, 64]
    - [101, 38.0]
  - - [4288, 64, 1, 1, 4288, 4288, 1, 64]
    - [97, 26.0]
  - - [5056, 64, 1, 1, 5056, 5056, 1, 64]
    - [101, 31.0]
  - - [5888, 64, 1, 1, 5888, 5888, 1, 64]
    - [98, 35.0]
  - - [6784, 64, 1, 1, 6784, 6784, 1, 64]
    - [97, 41.0]
  - - [64, 128, 1, 1, 64, 64, 1, 128]
    - [94, 1.0]
  - - [128, 128, 1, 1, 128, 128, 1, 128]
    - [97, 2.0]
  - - [256, 128, 1, 1, 256, 256, 1, 128]
    - [101, 3.0]
  - - [448, 128, 1, 1, 448, 448, 1, 128]
    - [97, 5.0]
  - - [704, 128, 1, 1, 704, 704, 1, 128]
    - [94, 6.0]
  - - [1024, 128, 1, 1, 1024, 1024, 1, 128]
    - [94, 9.0]
  - - [1408, 128, 1, 1, 1408, 1408, 1, 128]
    - [94, 13.0]
  - - [1856, 128, 1, 1, 1856, 1856, 1, 128]
    - [101, 34.0]
  - - [2368, 128, 1, 1, 2368, 2368, 1, 128]
    - [101, 29.0]
  - - [2944, 128, 1, 1, 2944, 2944, 1, 128]
    - [97, 36.0]
  - - [3584, 128, 1, 1, 3584, 3584, 1, 128]
    - [97, 44.0]
  - - [4288, 128, 1, 1, 4288, 4288, 1, 128]
    - [101, 45.0]
  - - [5056, 128, 1, 1, 5056, 5056, 1, 128]
    - [101, 54.0]
  - - [5888, 128, 1, 1, 5888, 5888, 1, 128]
    - [93, 51.0]
  - - [6784, 128, 1, 1, 6784, 6784, 1, 128]
    - [98, 56.0]
  - - [64, 256, 1, 1, 64, 64, 1, 256]
    - [92, 1.0]
  - - [128, 256, 1, 1, 128, 128, 1, 256]
    - [93, 4.0]
  - - [256, 256, 1, 1, 256, 256, 1, 256]
    - [97, 5.0]
  - - [448, 256, 1, 1, 448, 448, 1, 256]
    - [94, 8.0]
  - - [704, 256, 1, 1, 704, 704, 1, 256]
    - [97, 13.0]
  - - [1024, 256, 1, 1, 1024, 1024, 1, 256]
    - [97, 36.0]
  - - [1408, 256, 1, 1, 1408, 1408, 1, 256]
    - [97, 34.0]
  - - [1856, 256, 1, 1, 1856, 1856, 1, 256]
    - [101, 40.0]
  - - [2368, 256, 1, 1, 2368, 2368, 1, 256]
    - [94, 49.0]
  - - [2944, 256, 1, 1, 2944, 2944, 1, 256]
    - [96, 51.0]
  - - [3584, 256, 1, 1, 3584, 3584, 1, 256]
    - [97, 53.0]
  - - [4288, 256, 1, 1, 4288, 4288, 1, 256]
    - [93, 51.0]
  - - [5056, 256, 1, 1, 5056, 5056, 1, 256]
    - [93, 48.0]
  - - [5888, 256, 1, 1, 5888, 5888, 1, 256]
    - [92, 44.0]
  - - [6784, 256, 1, 1, 6784, 6784, 1, 256]
    - [92, 43.0]
  - - [64, 448, 1, 1, 64, 64, 1, 448]
    - [96, 3.0]
  - - [128, 448, 1, 1, 128, 128, 1, 448]
    - [94, 4.0]
  - - [256, 448, 1, 1, 256, 256, 1, 448]
    - [94, 8.0]
  - - [448, 448, 1, 1, 448, 448, 1, 448]
    - [97, 34.0]
  - - [704, 448, 1, 1, 704, 704, 1, 448]
    - [97, 30.0]
  - - [1024, 448, 1, 1, 1024, 1024, 1, 448]
    - [101, 43.0]
  - - [1408, 448, 1, 1, 1408, 1408, 1, 448]
    - [94, 50.0]
  - - [1856, 448, 1, 1, 1856, 1856, 1, 448]
    - [101, 59.0]
  - - [2368, 448, 1, 1, 2368, 2368, 1, 448]
    - [103, 52.0]
  - - [2944, 448, 1, 1, 2944, 2944, 1, 448]
    - [101, 46.0]
  - - [3584, 448, 1, 1, 3584, 3584, 1, 448]
    - [97, 43.0]
  - - [4288, 448, 1, 1, 4288, 4288, 1, 448]
    - [103, 41.0]
  - - [5056, 448, 1, 1, 5056, 5056, 1, 448]
    - [92, 40.0]
  - - [5888, 448, 1, 1, 5888, 5888, 1, 448]
    - [92, 36.0]
  - - [6784, 448, 1, 1, 6784, 6784, 1, 448]
    - [115, 37.0]
  - - [64, 704, 1, 1, 64, 64, 1, 704]
    - [94, 3.0]
  - - [128, 704, 1, 1, 128, 128, 1, 704]
    - [94, 6.0]
  - - [256, 704, 1, 1, 256, 256, 1, 704]
    - [97, 13.0]
  - - [448, 704, 1, 1, 448, 448, 1, 704]
    - [97, 31.0]
  - - [704, 704, 1, 1, 704, 704, 1, 704]
    - [101, 42.0]
  - - [1024, 704, 1, 1, 1024, 1024, 1, 704]
    - [101, 54.0]
  - - [1408, 704, 1, 1, 1408, 1408, 1, 704]
    - [101, 54.0]
  - - [1856, 704, 1, 1, 1856, 1856, 1, 704]
    - [97, 49.0]
  - - [2368, 704, 1, 1, 2368, 2368, 1, 704]
    - [97, 44.0]
  - - [2944, 704, 1, 1, 2944, 2944, 1, 704]
    - [94, 41.0]
  - - [3584, 704, 1, 1, 3584, 3584, 1, 704]
    - [94, 37.0]
  - - [4288, 704, 1, 1, 4288, 4288, 1, 704]
    - [92, 38.0]
  - - [5056, 704, 1, 1, 5056, 5056, 1, 704]
    - [92, 36.0]
  - - [5888, 704, 1, 1, 5888, 5888, 1, 704]
    - [105, 35.0]
  - - [6784, 704, 1, 1, 6784, 6784, 1, 704]
    - [93, 34.0]
  - - [64, 1024, 1, 1, 64, 64, 1, 1024]
    - [94, 5.0]
  - - [128, 1024, 1, 1, 128, 128, 1, 1024]
    - [94, 10.0]
  - - [256, 1024, 1, 1, 256, 256, 1, 1024]
    - [97, 36.0]
  - - [448, 1024, 1, 1, 448, 448, 1, 1024]
    - [97, 45.0]
  - - [704, 1024, 1, 1, 704, 704, 1, 1024]
    - [97, 49.0]
  - - [1024, 1024, 1, 1, 1024, 1024, 1, 1024]
    - [98, 41.0]
  - - [1408, 1024, 1, 1, 1408, 1408, 1, 1024]
    - [94, 46.0]
  - - [1856, 1024, 1, 1, 1856, 1856, 1, 1024]
    - [97, 44.0]
  - - [2368, 1024, 1, 1, 2368, 2368, 1, 1024]
    - [94, 41.0]
  - - [2944, 1024, 1, 1, 2944, 2944, 1, 1024]
    - [106, 38.0]
  - - [3584, 1024, 1, 1, 3584, 3584, 1, 1024]
    - [94, 35.0]
  - - [4288, 1024, 1, 1, 4288, 4288, 1, 1024]
    - [99, 36.0]
  - - [5056, 1024, 1, 1, 5056, 5056, 1, 1024]
    - [95, 36.0]
  - - [5888, 1024, 1, 1, 5888, 5888, 1, 1024]
    - [106, 33.0]
  - - [6784, 1024, 1, 1, 6784, 6784, 1, 1024]
    - [115, 33.0]
  - - [64, 1408, 1, 1, 64, 64, 1, 1408]
    - [94, 7.0]
  - - [128, 1408, 1, 1, 128, 128, 1, 1408]
    - [94, 13.0]
  - - [256, 1408, 1, 1, 256, 256, 1, 1408]
    - [97, 36.0]
  - - [448, 1408, 1, 1, 448, 448, 1, 1408]
    - [104, 51.0]
  - - [704, 1408, 1, 1, 704, 704, 1, 1408]
    - [100, 53.0]
  - - [1024, 1408, 1, 1, 1024, 1024, 1, 1408]
    - [97, 39.0]
  - - [1408, 1408, 1, 1, 1408, 1408, 1, 1408]
    - [94, 44.0]
  - - [1856, 1408, 1, 1, 1856, 1856, 1, 1408]
    - [97, 42.0]
  - - [2368, 1408, 1, 1, 2368, 2368, 1, 1408]
    - [106, 40.0]
  - - [2944, 1408, 1, 1, 2944, 2944, 1, 1408]
    - [98, 37.0]
  - - [3584, 1408, 1, 1, 3584, 3584, 1, 1408]
    - [97, 34.0]
  - - [4288, 1408, 1, 1, 4288, 4288, 1, 1408]
    - [95, 35.0]
  - - [5056, 1408, 1, 1, 5056, 5056, 1, 1408]
    - [95, 36.0]
  - - [5888, 1408, 1, 1, 5888, 5888, 1, 1408]
    - [92, 32.0]
  - - [6784, 1408, 1, 1, 6784, 6784, 1, 1408]
    - [105, 33.0]
  - - [64, 1856, 1, 1, 64, 64, 1, 1856]
    - [94, 9.0]
  - - [128, 1856, 1, 1, 128, 128, 1, 1856]
    - [97, 32.0]
  - - [256, 1856, 1, 1, 256, 256, 1, 1856]
    - [101, 43.0]
  - - [448, 1856, 1, 1, 448, 448, 1, 1856]
    - [101, 57.0]
  - - [704, 1856, 1, 1, 704, 704, 1, 1856]
    - [94, 48.0]
  - - [1024, 1856, 1, 1, 1024, 1024, 1, 1856]
    - [97, 39.0]
  - - [1408, 1856, 1, 1, 1408, 1408, 1, 1856]
    - [97, 41.0]
  - - [1856, 1856, 1, 1, 1856, 1856, 1, 1856]
    - [94, 40.0]
  - - [2368, 1856, 1, 1, 2368, 2368, 1, 1856]
    - [94, 39.0]
  - - [2944, 1856, 1, 1, 2944, 2944, 1, 1856]
    - [106, 36.0]
  - - [3584, 1856, 1, 1, 3584, 3584, 1, 1856]
    - [101, 34.0]
  - - [4288, 1856, 1, 1, 4288, 4288, 1, 1856]
    - [95, 35.0]
  - - [5056, 1856, 1, 1, 5056, 5056, 1, 1856]
    - [95, 35.0]
  - - [5888, 1856, 1, 1, 5888, 5888, 1, 1856]
    - [97, 32.0]
  - - [6784, 1856, 1, 1, 6784, 6784, 1, 1856]
    - [105, 32.0]
  - - [64, 2368, 1, 1, 64, 64, 1, 2368]
    - [94, 11.0]
  - - [128, 2368, 1, 1, 128, 128, 1, 2368]
    - [97, 32.0]
  - - [256, 2368, 1, 1, 256, 256, 1, 2368]
    - [97, 52.0]
  - - [448, 2368, 1, 1, 448, 448, 1, 2368]
    - [97, 52.0]
  - - [704, 2368, 1, 1, 704, 704, 1, 2368]
    - [101, 45.0]
  - - [1024, 2368, 1, 1, 1024, 1024, 1, 2368]
    - [98, 38.0]
  - - [1408, 2368, 1, 1, 1408, 1408, 1, 2368]
    - [97, 40.0]
  - - [1856, 2368, 1, 1, 1856, 1856, 1, 2368]
    - [94, 39.0]
  - - [2368, 2368, 1, 1, 2368, 2368, 1, 2368]
    - [94, 38.0]
  - - [2944, 2368, 1, 1, 2944, 2944, 1, 2368]
    - [97, 35.0]
  - - [3584, 2368, 1, 1, 3584, 3584, 1, 2368]
    - [94, 33.0]
  - - [4288, 2368, 1, 1, 4288, 4288, 1, 2368]
    - [95, 35.0]
  - - [5056, 2368, 1, 1, 5056, 5056, 1, 2368]
    - [95, 35.0]
  - - [5888, 2368, 1, 1, 5888, 5888, 1, 2368]
    - [94, 31.0]
  - - [6784, 2368, 1, 1, 6784, 6784, 1, 2368]
    - [92, 31.0]
  - - [64, 2944, 1, 1, 64, 64, 1, 2944]
    - [94, 13.0]
  - - [128, 2944, 1, 1, 128, 128, 1, 2944]
    - [94, 39.0]
  - - [256, 2944, 1, 1, 256, 256, 1, 2944]
    - [97, 57.0]
  - - [448, 2944, 1, 1, 448, 448, 1, 2944]
    - [101, 49.0]
  - - [704, 2944, 1, 1, 704, 704, 1, 2944]
    - [94, 43.0]
  - - [1024, 2944, 1, 1, 1024, 1024, 1, 2944]
    - [94, 38.0]
  - - [1408, 2944, 1, 1, 1408, 1408, 1, 2944]
    - [94, 39.0]
  - - [1856, 2944, 1, 1, 1856, 1856, 1, 2944]
    - [94, 38.0]
  - - [2368, 2944, 1, 1, 2368, 2368, 1, 2944]
    - [94, 38.0]
  - - [2944, 2944, 1, 1, 2944, 2944, 1, 2944]
    - [94, 35.0]
  - - [3584, 2944, 1, 1, 3584, 3584, 1, 2944]
    - [101, 33.0]
  - - [4288, 2944, 1, 1, 4288, 4288, 1, 2944]
    - [99, 35.0]
  - - [5056, 2944, 1, 1, 5056, 5056, 1, 2944]
    - [95, 35.0]
  - - [5888, 2944, 1, 1, 5888, 5888, 1, 2944]
    - [110, 32.0]
  - - [6784, 2944, 1, 1, 6784, 6784, 1, 2944]
    - [93, 31.0]
  - - [64, 3584, 1, 1, 64, 64, 1, 3584]
    - [94, 36.0]
  - - [128, 3584, 1, 1, 128, 128, 1, 3584]
    - [97, 48.0]
  - - [256, 3584, 1, 1, 256, 256, 1, 3584]
    - [101, 56.0]
  - - [448, 3584, 1, 1, 448, 448, 1, 3584]
    - [101, 46.0]
  - - [704, 3584, 1, 1, 704, 704, 1, 3584]
    - [97, 42.0]
  - - [1024, 3584, 1, 1, 1024, 1024, 1, 3584]
    - [97, 37.0]
  - - [1408, 3584, 1, 1, 1408, 1408, 1, 3584]
    - [94, 38.0]
  - - [1856, 3584, 1, 1, 1856, 1856, 1, 3584]
    - [94, 38.0]
  - - [2368, 3584, 1, 1, 2368, 2368, 1, 3584]
    - [94, 37.0]
  - - [2944, 3584, 1, 1, 2944, 2944, 1, 3584]
    - [106, 35.0]
  - - [3584, 3584, 1, 1, 3584, 3584, 1, 3584]
    - [94, 32.0]
  - - [4288, 3584, 1, 1, 4288, 4288, 1, 3584]
    - [95, 35.0]
  - - [5056, 3584, 1, 1, 5056, 5056, 1, 3584]
    - [95, 35.0]
  - - [5888, 3584, 1, 1, 5888, 5888, 1, 3584]
    - [94, 31.0]
  - - [6784, 3584, 1, 1, 6784, 6784, 1, 3584]
    - [94, 31.0]
  - - [64, 4288, 1, 1, 64, 64, 1, 4288]
    - [97, 30.0]
  - - [128, 4288, 1, 1, 128, 128, 1, 4288]
    - [97, 51.0]
  - - [256, 4288, 1, 1, 256, 256, 1, 4288]
    - [101, 53.0]
  - - [448, 4288, 1, 1, 448, 448, 1, 4288]
    - [97, 45.0]
  - - [704, 4288, 1, 1, 704, 704, 1, 4288]
    - [94, 41.0]
  - - [1024, 4288, 1, 1, 1024, 1024, 1, 4288]
    - [97, 37.0]
  - - [1408, 4288, 1, 1, 1408, 1408, 1, 4288]
    - [94, 38.0]
  - - [1856, 4288, 1, 1, 1856, 1856, 1, 4288]
    - [94, 38.0]
  - - [2368, 4288, 1, 1, 2368, 2368, 1, 4288]
    - [94, 37.0]
  - - [2944, 4288, 1, 1, 2944, 2944, 1, 4288]
    - [116, 35.0]
  - - [3584, 4288, 1, 1, 3584, 3584, 1, 4288]
    - [94, 32.0]
  - - [4288, 4288, 1, 1, 4288, 4288, 1, 4288]
    - [94, 34.0]
  - - [5056, 4288, 1, 1, 5056, 5056, 1, 4288]
    - [95, 35.0]
  - - [5888, 4288, 1, 1, 5888, 5888, 1, 4288]
    - [111, 31.0]
  - - [6784, 4288, 1, 1, 6784, 6784, 1, 4288]
    - [94, 31.0]
  - - [64, 5056, 1, 1, 64, 64, 1, 5056]
    - [97, 34.0]
  - - [128, 5056, 1, 1, 128, 128, 1, 5056]
    - [97, 60.0]
  - - [256, 5056, 1, 1, 256, 256, 1, 5056]
    - [97, 49.0]
  - - [448, 5056, 1, 1, 448, 448, 1, 5056]
    - [97, 43.0]
  - - [704, 5056, 1, 1, 704, 704, 1, 5056]
    - [97, 41.0]
  - - [1024, 5056, 1, 1, 1024, 1024, 1, 5056]
    - [111, 37.0]
  - - [1408, 5056, 1, 1, 1408, 1408, 1, 5056]
    - [97, 38.0]
  - - [1856, 5056, 1, 1, 1856, 1856, 1, 5056]
    - [94, 38.0]
  - - [2368, 5056, 1, 1, 2368, 2368, 1, 5056]
    - [94, 37.0]
  - - [2944, 5056, 1, 1, 2944, 2944, 1, 5056]
    - [108, 34.0]
  - - [3584, 5056, 1, 1, 3584, 3584, 1, 5056]
    - [97, 32.0]
  - - [4288, 5056, 1, 1, 4288, 4288, 1, 5056]
    - [109, 35.0]
  - - [5056, 5056, 1, 1, 5056, 5056, 1, 5056]
    - [95, 35.0]
  - - [5888, 5056, 1, 1, 5888, 5888, 1, 5056]
    - [111, 31.0]
  - - [6784, 5056, 1, 1, 6784, 6784, 1, 5056]
    - [94, 31.0]
  - - [64, 5888, 1, 1, 64, 64, 1, 5888]
    - [97, 40.0]
  - - [128, 5888, 1, 1, 128, 128, 1, 5888]
    - [98, 58.0]
  - - [256, 5888, 1, 1, 256, 256, 1, 5888]
    - [97, 47.0]
  - - [448, 5888, 1, 1, 448, 448, 1, 5888]
    - [94, 42.0]
  - - [704, 5888, 1, 1, 704, 704, 1, 5888]
    - [94, 40.0]
  - - [1024, 5888, 1, 1, 1024, 1024, 1, 5888]
    - [94, 37.0]
  - - [1408, 5888, 1, 1, 1408, 1408, 1, 5888]
    - [111, 38.0]
  - - [1856, 5888, 1, 1, 1856, 1856, 1, 5888]
    - [94, 37.0]
  - - [2368, 5888, 1, 1, 2368, 2368, 1, 5888]
    - [94, 37.0]
  - - [2944, 5888, 1, 1, 2944, 2944, 1, 5888]
    - [104, 34.0]
  - - [3584, 5888, 1, 1, 3584, 3584, 1, 5888]
    - [94, 32.0]
  - - [4288, 5888, 1, 1, 4288, 4288, 1, 5888]
    - [112, 35.0]
  - - [5056, 5888, 1, 1, 5056, 5056, 1, 5888]
    - [95, 35.0]
  - - [5888, 5888, 1, 1, 5888, 5888, 1, 5888]
    - [92, 30.0]
  - - [6784, 5888, 1, 1, 6784, 6784, 1, 5888]
    - [97, 31.0]
  - - [64, 6784, 1, 1, 64, 64, 1, 6784]
    - [97, 46.0]
  - - [128, 6784, 1, 1, 128, 128, 1, 6784]
    - [97, 61.0]
  - - [256, 6784, 1, 1, 256, 256, 1, 6784]
    - [94, 45.0]
  - - [448, 6784, 1, 1, 448, 448, 1, 6784]
    - [94, 41.0]
  - - [704, 6784, 1, 1, 704, 704, 1, 6784]
    - [94, 40.0]
  - - [1024, 6784, 1, 1, 1024, 1024, 1, 6784]
    - [94, 37.0]
  - - [1408, 6784, 1, 1, 1408, 1408, 1, 6784]
    - [111, 38.0]
  - - [1856, 6784, 1, 1, 1856, 1856, 1, 6784]
    - [94, 37.0]
  - - [2368, 6784, 1, 1, 2368, 2368, 1, 6784]
    - [94, 37.0]
  - - [2944, 6784, 1, 1, 2944, 2944, 1, 6784]
    - [111, 34.0]
  - - [3584, 6784, 1, 1, 3584, 3584, 1, 6784]
    - [104, 32.0]
  - - [4288, 6784, 1, 1, 4288, 4288, 1, 6784]
    - [114, 35.0]
  - - [5056, 6784, 1, 1, 5056, 5056, 1, 6784]
    - [95, 35.0]
  - - [5888, 6784, 1, 1, 5888, 5888, 1, 6784]
    - [92, 30.0]
  - - [6784, 6784, 1, 1, 6784, 6784, 1, 6784]
    - [94, 31.0]
  - - [1, 1, 1, 256, 1, 1, 256, 1]
    - [97, 0.005374594721109828]
  - - [1, 1, 1, 1280, 1, 1, 1280, 1]
    - [120, 0.02]
  - - [1, 1, 1, 3328, 1, 1, 3328, 1]
    - [128, 0.04]
  - - [1, 64, 1, 1, 1, 1, 1, 64]
    - [98, 0.006041440512633142]
  - - [1, 128, 1, 1, 1, 1, 1, 128]
    - [94, 0.01]
  - - [1, 256, 1, 1, 1, 1, 1, 256]
    - [94, 0.06]
  - - [1, 448, 1, 1, 1, 1, 1, 448]
    - [103, 0.08]
  - - [1, 704, 1, 1, 1, 1, 1, 704]
    - [104, 0.08]
  - - [1, 1024, 1, 1, 1, 1, 1, 1024]
    - [98, 0.12]
  - - [1, 1408, 1, 1, 1, 1, 1, 1408]
    - [98, 0.16]
  - - [1, 1856, 1, 1, 1, 1, 1, 1856]
    - [98, 0.2]
  - - [1, 2368, 1, 1, 1, 1, 1, 2368]
    - [98, 0.25]
  - - [1, 2944, 1, 1, 1, 1, 1, 2944]
    - [97, 1.0]
  - - [1, 3584, 1, 1, 1, 1, 1, 3584]
    - [94, 1.0]
  - - [1, 4288, 1, 1, 1, 1, 1, 4288]
    - [94, 1.0]
  - - [1, 5056, 1, 1, 1, 1, 1, 5056]
    - [94, 1.0]
  - - [1, 5888, 1, 1, 1, 1, 1, 5888]
    - [94, 1.0]
  - - [1, 6784, 1, 1, 1, 1, 1, 6784]
    - [92, 1.0]
  - - [64, 1, 1, 1, 64, 64, 1, 1]
    - [113, 0.008470090226622243]
  - - [128, 1, 1, 1, 128, 128, 1, 1]
    - [104, 0.02]
  - - [256, 1, 1, 1, 256, 256, 1, 1]
    - [96, 0.05]
  - - [448, 1, 1, 1, 448, 448, 1, 1]
    - [102, 0.07]
  - - [704, 1, 1, 1, 704, 704, 1, 1]
    - [98, 0.1]
  - - [1024, 1, 1, 1, 1024, 1024, 1, 1]
    - [108, 0.14]
  - - [1408, 1, 1, 1, 1408, 1408, 1, 1]
    - [104, 0.18]
  - - [1856, 1, 1, 1, 1856, 1856, 1, 1]
    - [94, 0.23]
  - - [2368, 1, 1, 1, 2368, 2368, 1, 1]
    - [98, 0.31]
  - - [2944, 1, 1, 1, 2944, 2944, 1, 1]
    - [104, 0.36]
  - - [3584, 1, 1, 1, 3584, 3584, 1, 1]
    - [93, 1.0]
  - - [4288, 1, 1, 1, 4288, 4288, 1, 1]
    - [93, 1.0]
  - - [5056, 1, 1, 1, 5056, 5056, 1, 1]
    - [93, 1.0]
  - - [5888, 1, 1, 1, 5888, 5888, 1, 1]
    - [93, 1.0]
  - - [6784, 1, 1, 1, 6784, 6784, 1, 1]
    - [92, 1.0]
- null
