library/src/blas3/Tensile/Logic/aldebaran/vega10_Cijk_Ailk_Bljk_HSS_BH.yaml
- {MinimumRequiredVersion: 4.24.0}
- vega10
- gfx900
- [Device 6863, Device 6862, Device 687f, Device 6860, Device 6861, 'Vega 10 XTX [Radeon
    SolutionIndex: 0
    SolutionNameMin: Cijk_Ailk_Bljk_HSS_BH_MT16x16x8_SE_GSU1_PGR0_PLR1_TT2_2_VAW2
    SolutionIndex: 1
    SolutionNameMin: Cijk_Ailk_Bljk_HSS_BH_MT128x32x8_SE_GSU1_PGR1_PLR1_TT4_4_VAW2
    SolutionIndex: 2
    SolutionNameMin: Cijk_Ailk_Bljk_HSS_BH_MT16x16x16_SE_GSU1_PGR0_PLR1_TT2_2_VAW2
    SolutionIndex: 3
    SolutionNameMin: Cijk_Ailk_Bljk_HSS_BH_MT16x16x16_SE_GSU1_PGR1_PLR1_TT2_2_VAW2
    SolutionIndex: 4
    SolutionNameMin: Cijk_Ailk_Bljk_HSS_BH_MT32x8x16_SE_GSU1_PGR0_PLR1_TT2_2_VAW2
    SolutionIndex: 5
    SolutionNameMin: Cijk_Ailk_Bljk_HSS_BH_MT32x16x16_SE_GSU1_PGR1_PLR1_TT2_2_VAW2
    SolutionIndex: 6
    SolutionNameMin: Cijk_Ailk_Bljk_HSS_BH_MT64x16x16_SE_GSU1_PGR1_PLR1_TT4_2_VAW2
    SolutionIndex: 7
    SolutionNameMin: Cijk_Ailk_Bljk_HSS_BH_MT32x32x16_SE_GSU1_PGR1_PLR1_TT2_2_VAW2
    SolutionIndex: 8
    SolutionNameMin: Cijk_Ailk_Bljk_HSS_BH_MT64x64x16_SE_GSU1_PGR1_PLR1_TT4_4_VAW2
    SolutionIndex: 9
    SolutionNameMin: Cijk_Ailk_Bljk_HSS_BH_MT64x8x16_SE_GSU1_PGR1_PLR1_TT2_2_VAW2
    SolutionIndex: 10
    SolutionNameMin: Cijk_Ailk_Bljk_HSS_BH_MT128x8x16_SE_GSU1_PGR0_PLR1_TT4_2_VAW2
    SolutionIndex: 11
    SolutionNameMin: Cijk_Ailk_Bljk_HSS_BH_MT128x8x16_SE_GSU1_PGR1_PLR1_TT4_2_VAW2
    SolutionIndex: 12
    SolutionNameMin: Cijk_Ailk_Bljk_HSS_BH_MT64x16x16_SE_GSU1_PGR1_PLR1_TT2_2_VAW2
    SolutionIndex: 13
    SolutionNameMin: Cijk_Ailk_Bljk_HSS_BH_MT128x16x16_SE_GSU1_PGR1_PLR1_TT4_2_VAW2
    SolutionIndex: 14
    SolutionNameMin: Cijk_Ailk_Bljk_HSS_BH_MT128x32x16_SE_GSU1_PGR1_PLR1_TT4_4_VAW2
    SolutionIndex: 15
    SolutionNameMin: Cijk_Ailk_Bljk_HSS_BH_MT32x8x32_SE_GSU1_PGR1_PLR1_TT2_2_VAW2
    SolutionIndex: 16
    SolutionNameMin: Cijk_Ailk_Bljk_HSS_BH_MT32x16x32_SE_GSU1_PGR1_PLR1_TT2_2_VAW2
    SolutionIndex: 17
    SolutionNameMin: Cijk_Ailk_Bljk_HSS_BH_MT64x16x32_SE_GSU1_PGR1_PLR1_TT4_2_VAW2
    SolutionIndex: 18
    SolutionNameMin: Cijk_Ailk_Bljk_HSS_BH_MT64x32x32_SE_GSU1_PGR1_PLR1_TT4_4_VAW2
    SolutionIndex: 19
    SolutionNameMin: Cijk_Ailk_Bljk_HSS_BH_MT64x8x32_SE_GSU1_PGR1_PLR1_TT2_2_VAW2
    SolutionIndex: 20
    SolutionNameMin: Cijk_Ailk_Bljk_HSS_BH_MT64x16x32_SE_GSU1_PGR1_PLR1_TT2_2_VAW2
    SolutionIndex: 21
    SolutionNameMin: Cijk_Ailk_Bljk_HSS_BH_MT128x16x32_SE_GSU1_PGR1_PLR1_TT4_2_VAW2
    SolutionIndex: 22
    SolutionNameMin: Cijk_Ailk_Bljk_HSS_BH_MT32x8x64_SE_GSU1_PGR1_PLR1_TT2_2_VAW2
    SolutionIndex: 23
    SolutionNameMin: Cijk_Ailk_Bljk_HSS_BH_MT64x8x64_SE_GSU1_PGR1_PLR1_TT2_2_VAW2
    SolutionIndex: 24
    SolutionNameMin: Cijk_Ailk_Bljk_HSS_BH_MT64x16x64_SE_GSU1_PGR1_PLR1_TT2_2_VAW2
    SolutionIndex: 25
    SolutionNameMin: Cijk_Ailk_Bljk_HSS_BH_MT32x32x8_SE_GSU1_PGR1_PLR1_TT4_4_VAW2
    SolutionIndex: 26
    SolutionNameMin: Cijk_Ailk_Bljk_HSS_BH_MT32x16x8_SE_GSU1_PGR1_PLR1_TT2_2_VAW2
    SolutionIndex: 27
    SolutionNameMin: Cijk_Ailk_Bljk_HSS_BH_MT128x32x8_SE_GSU1_PGR1_PLR1_TT4_4_VAW2
    SolutionIndex: 28
    SolutionNameMin: Cijk_Ailk_Bljk_HSS_BH_MT32x16x16_SE_GSU1_PGR1_PLR1_TT4_2_VAW2
    SolutionIndex: 29
    SolutionNameMin: Cijk_Ailk_Bljk_HSS_BH_MT32x32x16_SE_GSU1_PGR1_PLR1_TT4_4_VAW2
    SolutionIndex: 30
    SolutionNameMin: Cijk_Ailk_Bljk_HSS_BH_MT32x16x16_SE_GSU1_PGR1_PLR1_TT2_2_VAW2
    SolutionIndex: 31
    SolutionNameMin: Cijk_Ailk_Bljk_HSS_BH_MT64x16x16_SE_GSU1_PGR1_PLR1_TT4_2_VAW2
    SolutionIndex: 32
    SolutionNameMin: Cijk_Ailk_Bljk_HSS_BH_MT64x32x16_SE_GSU1_PGR1_PLR1_TT4_4_VAW2
    SolutionIndex: 33
    SolutionNameMin: Cijk_Ailk_Bljk_HSS_BH_MT64x16x16_SE_GSU1_PGR1_PLR1_TT2_2_VAW2
    SolutionIndex: 34
    SolutionNameMin: Cijk_Ailk_Bljk_HSS_BH_MT128x16x16_SE_GSU1_PGR1_PLR1_TT4_2_VAW2
    SolutionIndex: 35
    SolutionNameMin: Cijk_Ailk_Bljk_HSS_BH_MT128x32x16_SE_GSU1_PGR1_PLR1_TT4_4_VAW2
    SolutionIndex: 36
    SolutionNameMin: Cijk_Ailk_Bljk_HSS_BH_MT32x8x16_SE_GSU1_PGR1_PLR1_TT2_2_VAW2
    SolutionIndex: 37
    SolutionNameMin: Cijk_Ailk_Bljk_HSS_BH_MT64x8x16_SE_GSU1_PGR1_PLR1_TT2_2_VAW2
    SolutionIndex: 38
    SolutionNameMin: Cijk_Ailk_Bljk_HSS_BH_MT128x8x16_SE_GSU1_PGR1_PLR1_TT4_2_VAW2
    SolutionIndex: 39
    SolutionNameMin: Cijk_Ailk_Bljk_HSS_BH_MT16x16x24_SE_GSU1_PGR1_PLR1_TT2_2_VAW2
    SolutionIndex: 40
    SolutionNameMin: Cijk_Ailk_Bljk_HSS_BH_MT32x16x32_SE_GSU1_PGR1_PLR1_TT2_2_VAW2
    SolutionIndex: 41
    SolutionNameMin: Cijk_Ailk_Bljk_HSS_BH_MT64x16x32_SE_GSU1_PGR1_PLR1_TT2_2_VAW2
    SolutionIndex: 42
    SolutionNameMin: Cijk_Ailk_Bljk_HSS_BH_MT32x8x32_SE_GSU1_PGR1_PLR1_TT2_2_VAW2
    SolutionIndex: 43
    SolutionNameMin: Cijk_Ailk_Bljk_HSS_BH_MT64x8x32_SE_GSU1_PGR1_PLR1_TT2_2_VAW2
    SolutionIndex: 44
    SolutionNameMin: Cijk_Ailk_Bljk_HSS_BH_MT32x32x8_SE_GSU1_PGR0_PLR1_TT4_4_VAW2
    SolutionIndex: 45
    SolutionNameMin: Cijk_Ailk_Bljk_HSS_BH_MT64x64x8_SE_GSU1_PGR1_PLR1_TT4_4_VAW2
    SolutionIndex: 46
    SolutionNameMin: Cijk_Ailk_Bljk_HSS_BH_MT128x64x8_SE_GSU1_PGR1_PLR1_TT8_4_VAW2
    SolutionIndex: 47
    SolutionNameMin: Cijk_Ailk_Bljk_HSS_BH_MT32x32x16_SE_GSU1_PGR0_PLR1_TT4_4_VAW2
    SolutionIndex: 48
    SolutionNameMin: Cijk_Ailk_Bljk_HSS_BH_MT64x64x16_SE_GSU1_PGR1_PLR1_TT4_4_VAW2
    SolutionIndex: 49
    SolutionNameMin: Cijk_Ailk_Bljk_HSS_BH_MT64x128x16_SE_GSU1_PGR1_PLR1_TT4_8_VAW2
    SolutionIndex: 50
    SolutionNameMin: Cijk_Ailk_Bljk_HSS_BH_MT128x64x16_SE_GSU1_PGR0_PLR1_TT8_4_VAW2
    SolutionIndex: 51
    SolutionNameMin: Cijk_Ailk_Bljk_HSS_BH_MT128x64x16_SE_GSU1_PGR1_PLR1_TT8_4_VAW2
    SolutionIndex: 52
    SolutionNameMin: Cijk_Ailk_Bljk_HSS_BH_MT128x96x16_SE_GSU1_PGR1_PLR1_TT8_6_VAW2
    SolutionIndex: 53
    SolutionNameMin: Cijk_Ailk_Bljk_HSS_BH_MT64x32x24_SE_GSU1_PGR0_PLR1_TT8_4_VAW2
    SolutionIndex: 54
    SolutionNameMin: Cijk_Ailk_Bljk_HSS_BH_MT64x64x32_SE_GSU1_PGR1_PLR1_TT4_4_VAW2
    SolutionIndex: 55
    SolutionNameMin: Cijk_Ailk_Bljk_HSS_BH_MT128x64x32_SE_GSU1_PGR0_PLR1_TT8_4_VAW2
    SolutionIndex: 56
    SolutionNameMin: Cijk_Ailk_Bljk_HSS_BH_MT128x64x32_SE_GSU1_PGR1_PLR1_TT8_4_VAW2
    SolutionIndex: 57
    SolutionNameMin: Cijk_Ailk_Bljk_HSS_BH_MT128x32x16_SE_GSU1_PGR1_PLR1_TT4_2_VAW2
    SolutionIndex: 58
    SolutionNameMin: Cijk_Ailk_Bljk_HSS_BH_MT32x32x32_SE_GSU1_PGR1_PLR1_TT2_2_VAW2
    SolutionIndex: 59
    SolutionNameMin: Cijk_Ailk_Bljk_HSS_BH_MT32x32x32_SE_GSU1_PGR1_PLR1_TT2_2_VAW2
    SolutionIndex: 60
    SolutionNameMin: Cijk_Ailk_Bljk_HSS_BH_MT128x32x32_SE_GSU1_PGR1_PLR1_TT4_2_VAW2
    SolutionIndex: 61
    SolutionNameMin: Cijk_Ailk_Bljk_HSS_BH_MT32x64x64_SE_GSU1_PGR1_PLR1_TT2_4_VAW2
    SolutionIndex: 62
    SolutionNameMin: Cijk_Ailk_Bljk_HSS_BH_MT64x32x16_SE_GSU1_PGR1_PLR1_TT2_4_VAW2
    SolutionIndex: 63
    SolutionNameMin: Cijk_Ailk_Bljk_HSS_BH_MT32x32x32_SE_GSU1_PGR1_PLR1_TT2_2_VAW2
    SolutionIndex: 64
    SolutionNameMin: Cijk_Ailk_Bljk_HSS_BH_MT64x64x16_SE_GSU1_PGR1_PLR0_TT4_4_VAW2
    SolutionIndex: 65
    SolutionNameMin: Cijk_Ailk_Bljk_HSS_BH_MT128x32x16_SE_GSU1_PGR1_PLR0_TT4_4_VAW2
    SolutionIndex: 66
    SolutionNameMin: Cijk_Ailk_Bljk_HSS_BH_MT128x32x16_SE_GSU1_PGR0_PLR0_TT4_4_VAW2
    SolutionIndex: 67
    SolutionNameMin: Cijk_Ailk_Bljk_HSS_BH_MT128x32x16_SE_GSU1_PGR1_PLR0_TT4_4_VAW2
    SolutionIndex: 68
    SolutionNameMin: Cijk_Ailk_Bljk_HSS_BH_MT64x128x4_SE_GSU1_PGR0_PLR0_TT4_8_VAW2
    SolutionIndex: 69
    SolutionNameMin: Cijk_Ailk_Bljk_HSS_BH_MT64x64x4_SE_GSU1_PGR0_PLR0_TT4_4_VAW2
    SolutionIndex: 70
    SolutionNameMin: Cijk_Ailk_Bljk_HSS_BH_MT64x128x4_SE_GSU1_PGR1_PLR0_TT4_8_VAW2
    SolutionIndex: 71
    SolutionNameMin: Cijk_Ailk_Bljk_HSS_BH_MT64x64x4_SE_GSU1_PGR1_PLR0_TT4_4_VAW2
    SolutionIndex: 72
    SolutionNameMin: Cijk_Ailk_Bljk_HSS_BH_MT64x128x4_SE_GSU1_PGR0_PLR1_TT4_8_VAW2
    SolutionIndex: 73
    SolutionNameMin: Cijk_Ailk_Bljk_HSS_BH_MT64x64x4_SE_GSU1_PGR0_PLR1_TT4_4_VAW2
    SolutionIndex: 74
    SolutionNameMin: Cijk_Ailk_Bljk_HSS_BH_MT64x128x4_SE_GSU1_PGR1_PLR1_TT4_8_VAW2
    SolutionIndex: 75
    SolutionNameMin: Cijk_Ailk_Bljk_HSS_BH_MT64x64x4_SE_GSU1_PGR1_PLR1_TT4_4_VAW2
    SolutionIndex: 76
    SolutionNameMin: Cijk_Ailk_Bljk_HSS_BH_MT64x128x8_SE_GSU1_PGR0_PLR0_TT4_8_VAW2
    SolutionIndex: 77
    SolutionNameMin: Cijk_Ailk_Bljk_HSS_BH_MT64x64x8_SE_GSU1_PGR0_PLR0_TT4_4_VAW2
    SolutionIndex: 78
    SolutionNameMin: Cijk_Ailk_Bljk_HSS_BH_MT64x64x8_SE_GSU1_PGR1_PLR0_TT4_4_VAW2
    SolutionIndex: 79
    SolutionNameMin: Cijk_Ailk_Bljk_HSS_BH_MT64x64x8_SE_GSU1_PGR0_PLR1_TT4_4_VAW2
    SolutionIndex: 80
    SolutionNameMin: Cijk_Ailk_Bljk_HSS_BH_MT64x64x8_SE_GSU1_PGR1_PLR1_TT4_4_VAW2
    SolutionIndex: 81
    SolutionNameMin: Cijk_Ailk_Bljk_HSS_BH_MT64x64x16_SE_GSU1_PGR0_PLR0_TT4_4_VAW2
    SolutionIndex: 82
    SolutionNameMin: Cijk_Ailk_Bljk_HSS_BH_MT64x64x16_SE_GSU1_PGR1_PLR0_TT4_4_VAW2
    SolutionIndex: 83
    SolutionNameMin: Cijk_Ailk_Bljk_HSS_BH_MT64x64x16_SE_GSU1_PGR0_PLR1_TT4_4_VAW2
    SolutionIndex: 84
    SolutionNameMin: Cijk_Ailk_Bljk_HSS_BH_MT64x64x16_SE_GSU1_PGR1_PLR1_TT4_4_VAW2
    SolutionIndex: 85
    SolutionNameMin: Cijk_Ailk_Bljk_HSS_BH_MT64x64x8_SE_GSU2_PGR1_PLR0_TT4_4_VAW1
    SolutionIndex: 86
    SolutionNameMin: Cijk_Ailk_Bljk_HSS_BH_MT64x64x16_SE_GSU2_PGR1_PLR0_TT4_4_VAW1
    SolutionIndex: 87
    SolutionNameMin: Cijk_Ailk_Bljk_HSS_BH_MT64x64x16_SE_GSU2_PGR1_PLR1_TT4_4_VAW1
    SolutionIndex: 88
    SolutionNameMin: Cijk_Ailk_Bljk_HSS_BH_MT64x64x8_SE_GSU3_PGR1_PLR0_TT4_4_VAW1
    SolutionIndex: 89
    SolutionNameMin: Cijk_Ailk_Bljk_HSS_BH_MT64x64x8_SE_GSU3_PGR1_PLR1_TT4_4_VAW1
    SolutionIndex: 90
    SolutionNameMin: Cijk_Ailk_Bljk_HSS_BH_MT64x64x16_SE_GSU3_PGR1_PLR0_TT4_4_VAW1
    SolutionIndex: 91
    SolutionNameMin: Cijk_Ailk_Bljk_HSS_BH_MT64x64x4_SE_GSU5_PGR1_PLR0_TT4_4_VAW1
    SolutionIndex: 92
    SolutionNameMin: Cijk_Ailk_Bljk_HSS_BH_MT64x64x8_SE_GSU5_PGR1_PLR0_TT4_4_VAW1
    SolutionIndex: 93
    SolutionNameMin: Cijk_Ailk_Bljk_HSS_BH_MT64x64x8_SE_GSU5_PGR1_PLR1_TT4_4_VAW1
    SolutionIndex: 94
    SolutionNameMin: Cijk_Ailk_Bljk_HSS_BH_MT64x64x16_SE_GSU5_PGR0_PLR0_TT4_4_VAW1
    SolutionIndex: 95
    SolutionNameMin: Cijk_Ailk_Bljk_HSS_BH_MT64x64x16_SE_GSU5_PGR1_PLR0_TT4_4_VAW1
    SolutionIndex: 96
    SolutionNameMin: Cijk_Ailk_Bljk_HSS_BH_MT64x64x8_SE_GSU7_PGR1_PLR0_TT4_4_VAW1
    SolutionIndex: 97
    SolutionNameMin: Cijk_Ailk_Bljk_HSS_BH_MT64x64x16_SE_GSU7_PGR1_PLR0_TT4_4_VAW1
    SolutionIndex: 98
    SolutionNameMin: Cijk_Ailk_Bljk_HSS_BH_MT128x128x4_SE_GSU1_PGR0_PLR0_TT8_8_VAW2
    SolutionIndex: 99
    SolutionNameMin: Cijk_Ailk_Bljk_HSS_BH_MT64x128x4_SE_GSU1_PGR0_PLR0_TT4_8_VAW2
    SolutionIndex: 100
    SolutionNameMin: Cijk_Ailk_Bljk_HSS_BH_MT64x64x4_SE_GSU1_PGR0_PLR0_TT4_4_VAW2
    SolutionIndex: 101
    SolutionNameMin: Cijk_Ailk_Bljk_HSS_BH_MT128x128x4_SE_GSU1_PGR1_PLR0_TT8_8_VAW2
    SolutionIndex: 102
    SolutionNameMin: Cijk_Ailk_Bljk_HSS_BH_MT64x64x4_SE_GSU1_PGR1_PLR0_TT4_4_VAW2
    SolutionIndex: 103
    SolutionNameMin: Cijk_Ailk_Bljk_HSS_BH_MT64x64x4_SE_GSU1_PGR0_PLR1_TT4_4_VAW2
    SolutionIndex: 104
    SolutionNameMin: Cijk_Ailk_Bljk_HSS_BH_MT64x64x4_SE_GSU1_PGR1_PLR1_TT4_4_VAW2
    SolutionIndex: 105
    SolutionNameMin: Cijk_Ailk_Bljk_HSS_BH_MT64x64x8_SE_GSU1_PGR0_PLR0_TT4_4_VAW2
    SolutionIndex: 106
    SolutionNameMin: Cijk_Ailk_Bljk_HSS_BH_MT64x128x8_SE_GSU1_PGR1_PLR0_TT4_8_VAW2
    SolutionIndex: 107
    SolutionNameMin: Cijk_Ailk_Bljk_HSS_BH_MT64x64x8_SE_GSU1_PGR1_PLR0_TT4_4_VAW2
    SolutionIndex: 108
    SolutionNameMin: Cijk_Ailk_Bljk_HSS_BH_MT64x64x8_SE_GSU1_PGR0_PLR1_TT4_4_VAW2
    SolutionIndex: 109
    SolutionNameMin: Cijk_Ailk_Bljk_HSS_BH_MT64x128x8_SE_GSU1_PGR1_PLR1_TT4_8_VAW2
    SolutionIndex: 110
    SolutionNameMin: Cijk_Ailk_Bljk_HSS_BH_MT128x128x16_SE_GSU1_PGR0_PLR0_TT8_8_VAW2
    SolutionIndex: 111
    SolutionNameMin: Cijk_Ailk_Bljk_HSS_BH_MT64x64x16_SE_GSU1_PGR1_PLR0_TT4_4_VAW2
    SolutionIndex: 112
    SolutionNameMin: Cijk_Ailk_Bljk_HSS_BH_MT64x64x16_SE_GSU1_PGR1_PLR1_TT4_4_VAW2
    SolutionIndex: 113
    SolutionNameMin: Cijk_Ailk_Bljk_HSS_BH_MT64x64x4_SE_GSU2_PGR0_PLR0_TT4_4_VAW1
    SolutionIndex: 114
    SolutionNameMin: Cijk_Ailk_Bljk_HSS_BH_MT64x64x4_SE_GSU2_PGR1_PLR0_TT4_4_VAW1
    SolutionIndex: 115
    SolutionNameMin: Cijk_Ailk_Bljk_HSS_BH_MT64x64x4_SE_GSU3_PGR1_PLR0_TT4_4_VAW1
    SolutionIndex: 116
    SolutionNameMin: Cijk_Ailk_Bljk_HSS_BH_MT64x64x8_SE_GSU3_PGR1_PLR0_TT4_4_VAW1
    SolutionIndex: 117
    SolutionNameMin: Cijk_Ailk_Bljk_HSS_BH_MT64x64x4_SE_GSU5_PGR1_PLR0_TT4_4_VAW1
    SolutionIndex: 118
    SolutionNameMin: Cijk_Ailk_Bljk_HSS_BH_MT64x64x8_SE_GSU5_PGR1_PLR0_TT4_4_VAW1
    SolutionIndex: 119
    SolutionNameMin: Cijk_Ailk_Bljk_HSS_BH_MT64x64x4_SE_GSU7_PGR1_PLR0_TT4_4_VAW1
    SolutionIndex: 120
    SolutionNameMin: Cijk_Ailk_Bljk_HSS_BH_MT64x64x8_SE_GSU7_PGR1_PLR0_TT4_4_VAW1
- - - [512, 1, 1, 500000, 512, 512, 512, 500000]
    - [15, 18.0]
  - - [512, 2, 1, 500000, 512, 512, 512, 500000]
    - [22, 36.0]
  - - [512, 4, 1, 500000, 512, 512, 512, 500000]
    - [23, 72.0]
  - - [512, 8, 1, 500000, 512, 512, 512, 500000]
    - [22, 143.0]
  - - [512, 16, 1, 500000, 512, 512, 512, 500000]
    - [22, 287.0]
  - - [1024, 1, 1, 500000, 1024, 1024, 1024, 500000]
    - [22, 36.0]
  - - [1024, 2, 1, 500000, 1024, 1024, 1024, 500000]
    - [22, 72.0]
  - - [1024, 4, 1, 500000, 1024, 1024, 1024, 500000]
    - [22, 143.0]
  - - [1024, 8, 1, 500000, 1024, 1024, 1024, 500000]
    - [23, 287.0]
  - - [1024, 16, 1, 500000, 1024, 1024, 1024, 500000]
    - [23, 571.0]
  - - [64, 1, 1, 1216, 64, 64, 64, 1216]
    - [0, 1.0]
  - - [128, 1, 1, 1024, 128, 128, 128, 1024]
    - [3, 3.0]
  - - [128, 1, 1, 1408, 128, 128, 128, 1408]
    - [3, 3.0]
  - - [512, 1, 1, 512, 512, 512, 512, 512]
    - [3, 9.0]
  - - [3072, 1, 1, 128, 3072, 3072, 3072, 128]
    - [2, 27.0]
  - - [512, 2, 1, 512, 512, 512, 512, 512]
    - [3, 18.0]
  - - [1024, 1, 1, 512, 1024, 1024, 1024, 512]
    - [3, 18.0]
  - - [4224, 1, 1, 128, 4224, 4224, 4224, 128]
    - [4, 37.0]
  - - [512, 4, 1, 512, 512, 512, 512, 512]
    - [3, 37.0]
  - - [1024, 2, 1, 512, 1024, 1024, 1024, 512]
    - [3, 36.0]
  - - [1024, 4, 1, 512, 1024, 1024, 1024, 512]
    - [3, 71.0]
  - - [3072, 1, 1, 1024, 3072, 3072, 3072, 1024]
    - [33, 52.0]
  - - [512, 16, 1, 512, 512, 512, 512, 512]
    - [3, 150.0]
  - - [3072, 2, 1, 1024, 3072, 3072, 3072, 1024]
    - [12, 104.0]
  - - [4608, 1, 1, 1536, 4608, 4608, 4608, 1536]
    - [13, 65.0]
  - - [1024, 16, 1, 512, 1024, 1024, 1024, 512]
    - [3, 289.0]
  - - [3072, 4, 1, 1024, 3072, 3072, 3072, 1024]
    - [33, 206.0]
  - - [4608, 2, 1, 1536, 4608, 4608, 4608, 1536]
    - [19, 130.0]
  - - [6144, 1, 1, 2560, 6144, 6144, 6144, 2560]
    - [13, 71.0]
  - - [7680, 1, 1, 2560, 7680, 7680, 7680, 2560]
    - [11, 73.0]
  - - [8448, 1, 1, 2816, 8448, 8448, 8448, 2816]
    - [10, 74.0]
  - - [4608, 4, 1, 1536, 4608, 4608, 4608, 1536]
    - [13, 260.0]
  - - [6144, 2, 1, 2560, 6144, 6144, 6144, 2560]
    - [13, 142.0]
  - - [7680, 2, 1, 2560, 7680, 7680, 7680, 2560]
    - [11, 146.0]
  - - [8448, 2, 1, 2816, 8448, 8448, 8448, 2816]
    - [11, 148.0]
  - - [1760, 16, 1, 1760, 1760, 1760, 1760, 1760]
    - [15, 669.0]
  - - [3072, 16, 1, 1024, 3072, 3072, 3072, 1024]
    - [12, 826.0]
  - - [6144, 4, 1, 2560, 6144, 6144, 6144, 2560]
    - [13, 284.0]
  - - [2048, 16, 1, 2048, 2048, 2048, 2048, 2048]
    - [41, 765.0]
  - - [7680, 4, 1, 2560, 7680, 7680, 7680, 2560]
    - [38, 293.0]
  - - [8448, 4, 1, 2816, 8448, 8448, 8448, 2816]
    - [11, 296.0]
  - - [2560, 16, 1, 2560, 2560, 2560, 2560, 2560]
    - [24, 839.0]
  - - [4608, 16, 1, 1536, 4608, 4608, 4608, 1536]
    - [13, 1037.0]
  - - [6144, 16, 1, 2560, 6144, 6144, 6144, 2560]
    - [20, 1099.0]
  - - [4096, 16, 1, 4096, 4096, 4096, 4096, 4096]
    - [20, 1116.0]
  - - [7680, 16, 1, 2560, 7680, 7680, 7680, 2560]
    - [13, 1166.0]
  - - [8448, 16, 1, 2816, 8448, 8448, 8448, 2816]
    - [13, 1181.0]
  - - [64, 64, 1, 256, 64, 64, 64, 256]
    - [3, 70.0]
  - - [128, 64, 1, 256, 128, 128, 128, 256]
    - [3, 124.0]
  - - [64, 128, 1, 256, 64, 64, 64, 256]
    - [3, 132.0]
  - - [128, 128, 1, 256, 128, 128, 128, 256]
    - [3, 219.0]
  - - [64, 256, 1, 256, 64, 64, 64, 256]
    - [3, 254.0]
  - - [128, 256, 1, 256, 128, 128, 128, 256]
    - [3, 437.0]
  - - [64, 448, 1, 256, 64, 64, 64, 256]
    - [3, 384.0]
  - - [128, 448, 1, 256, 128, 128, 128, 256]
    - [3, 748.0]
  - - [64, 704, 1, 256, 64, 64, 64, 256]
    - [3, 588.0]
  - - [128, 704, 1, 256, 128, 128, 128, 256]
    - [3, 1137.0]
  - - [64, 1024, 1, 256, 64, 64, 64, 256]
    - [3, 815.0]
  - - [128, 1024, 1, 256, 128, 128, 128, 256]
    - [3, 1567.0]
  - - [64, 1408, 1, 256, 64, 64, 64, 256]
    - [3, 1066.0]
  - - [128, 1408, 1, 256, 128, 128, 128, 256]
    - [30, 1965.0]
  - - [64, 1856, 1, 256, 64, 64, 64, 256]
    - [3, 1333.0]
  - - [128, 1856, 1, 256, 128, 128, 128, 256]
    - [5, 2243.0]
  - - [64, 2368, 1, 256, 64, 64, 64, 256]
    - [3, 1568.0]
  - - [128, 2368, 1, 256, 128, 128, 128, 256]
    - [5, 2555.0]
  - - [64, 2944, 1, 256, 64, 64, 64, 256]
    - [30, 1779.0]
  - - [128, 2944, 1, 256, 128, 128, 128, 256]
    - [12, 2813.0]
  - - [64, 3584, 1, 256, 64, 64, 64, 256]
    - [5, 1972.0]
  - - [128, 3584, 1, 256, 128, 128, 128, 256]
    - [12, 3115.0]
  - - [64, 4288, 1, 256, 64, 64, 64, 256]
    - [3, 2009.0]
  - - [128, 4288, 1, 256, 128, 128, 128, 256]
    - [30, 3115.0]
  - - [64, 5056, 1, 256, 64, 64, 64, 256]
    - [5, 2146.0]
  - - [128, 5056, 1, 256, 128, 128, 128, 256]
    - [30, 3141.0]
  - - [64, 5888, 1, 256, 64, 64, 64, 256]
    - [5, 2219.0]
  - - [128, 5888, 1, 256, 128, 128, 128, 256]
    - [12, 3146.0]
  - - [64, 6784, 1, 256, 64, 64, 64, 256]
    - [28, 2239.0]
  - - [128, 6784, 1, 256, 128, 128, 128, 256]
    - [12, 3244.0]
  - - [64, 64, 1, 1280, 64, 64, 64, 1280]
    - [39, 103.0]
  - - [128, 64, 1, 1280, 128, 128, 128, 1280]
    - [39, 206.0]
  - - [64, 128, 1, 1280, 64, 64, 64, 1280]
    - [39, 197.0]
  - - [128, 128, 1, 1280, 128, 128, 128, 1280]
    - [39, 378.0]
  - - [64, 256, 1, 1280, 64, 64, 64, 1280]
    - [39, 406.0]
  - - [128, 256, 1, 1280, 128, 128, 128, 1280]
    - [39, 751.0]
  - - [64, 448, 1, 1280, 64, 64, 64, 1280]
    - [39, 677.0]
  - - [128, 448, 1, 1280, 128, 128, 128, 1280]
    - [39, 1277.0]
  - - [64, 704, 1, 1280, 64, 64, 64, 1280]
    - [40, 988.0]
  - - [128, 704, 1, 1280, 128, 128, 128, 1280]
    - [20, 1867.0]
  - - [64, 1024, 1, 1280, 64, 64, 64, 1280]
    - [42, 1361.0]
  - - [128, 1024, 1, 1280, 128, 128, 128, 1280]
    - [43, 2415.0]
  - - [64, 1408, 1, 1280, 64, 64, 64, 1280]
    - [16, 1617.0]
  - - [128, 1408, 1, 1280, 128, 128, 128, 1280]
    - [5, 2653.0]
  - - [64, 1856, 1, 1280, 64, 64, 64, 1280]
    - [40, 1708.0]
  - - [128, 1856, 1, 1280, 128, 128, 128, 1280]
    - [37, 2897.0]
  - - [64, 2368, 1, 1280, 64, 64, 64, 1280]
    - [40, 1889.0]
  - - [128, 2368, 1, 1280, 128, 128, 128, 1280]
    - [33, 3140.0]
  - - [64, 2944, 1, 1280, 64, 64, 64, 1280]
    - [40, 2078.0]
  - - [128, 2944, 1, 1280, 128, 128, 128, 1280]
    - [31, 3460.0]
  - - [64, 3584, 1, 1280, 64, 64, 64, 1280]
    - [40, 2158.0]
  - - [128, 3584, 1, 1280, 128, 128, 128, 1280]
    - [31, 3699.0]
  - - [64, 4288, 1, 1280, 64, 64, 64, 1280]
    - [7, 2161.0]
  - - [128, 4288, 1, 1280, 128, 128, 128, 1280]
    - [13, 3753.0]
  - - [64, 5056, 1, 1280, 64, 64, 64, 1280]
    - [7, 2260.0]
  - - [128, 5056, 1, 1280, 128, 128, 128, 1280]
    - [14, 3871.0]
  - - [64, 5888, 1, 1280, 64, 64, 64, 1280]
    - [7, 2278.0]
  - - [128, 5888, 1, 1280, 128, 128, 128, 1280]
    - [14, 3757.0]
  - - [64, 6784, 1, 1280, 64, 64, 64, 1280]
    - [12, 2353.0]
  - - [128, 6784, 1, 1280, 128, 128, 128, 1280]
    - [14, 4075.0]
  - - [64, 64, 1, 3328, 64, 64, 64, 3328]
    - [39, 114.0]
  - - [128, 64, 1, 3328, 128, 128, 128, 3328]
    - [39, 226.0]
  - - [64, 128, 1, 3328, 64, 64, 64, 3328]
    - [39, 229.0]
  - - [128, 128, 1, 3328, 128, 128, 128, 3328]
    - [39, 443.0]
  - - [64, 256, 1, 3328, 64, 64, 64, 3328]
    - [39, 447.0]
  - - [128, 256, 1, 3328, 128, 128, 128, 3328]
    - [42, 879.0]
  - - [64, 448, 1, 3328, 64, 64, 64, 3328]
    - [19, 769.0]
  - - [128, 448, 1, 3328, 128, 128, 128, 3328]
    - [19, 1529.0]
  - - [64, 704, 1, 3328, 64, 64, 64, 3328]
    - [19, 1184.0]
  - - [128, 704, 1, 3328, 128, 128, 128, 3328]
    - [20, 2135.0]
  - - [64, 1024, 1, 3328, 64, 64, 64, 3328]
    - [42, 1591.0]
  - - [128, 1024, 1, 3328, 128, 128, 128, 3328]
    - [19, 2765.0]
  - - [64, 1408, 1, 3328, 64, 64, 64, 3328]
    - [16, 1860.0]
  - - [128, 1408, 1, 3328, 128, 128, 128, 3328]
    - [30, 2953.0]
  - - [64, 1856, 1, 3328, 64, 64, 64, 3328]
    - [15, 2072.0]
  - - [128, 1856, 1, 3328, 128, 128, 128, 3328]
    - [37, 3182.0]
  - - [64, 2368, 1, 3328, 64, 64, 64, 3328]
    - [40, 2256.0]
  - - [128, 2368, 1, 3328, 128, 128, 128, 3328]
    - [28, 3464.0]
  - - [64, 2944, 1, 3328, 64, 64, 64, 3328]
    - [40, 2419.0]
  - - [128, 2944, 1, 3328, 128, 128, 128, 3328]
    - [31, 3871.0]
  - - [64, 3584, 1, 3328, 64, 64, 64, 3328]
    - [41, 2610.0]
  - - [128, 3584, 1, 3328, 128, 128, 128, 3328]
    - [31, 4219.0]
  - - [64, 4288, 1, 3328, 64, 64, 64, 3328]
    - [30, 2488.0]
  - - [128, 4288, 1, 3328, 128, 128, 128, 3328]
    - [13, 4196.0]
  - - [64, 5056, 1, 3328, 64, 64, 64, 3328]
    - [18, 2614.0]
  - - [128, 5056, 1, 3328, 128, 128, 128, 3328]
    - [35, 4339.0]
  - - [64, 5888, 1, 3328, 64, 64, 64, 3328]
    - [7, 2570.0]
  - - [128, 5888, 1, 3328, 128, 128, 128, 3328]
    - [14, 4149.0]
  - - [64, 6784, 1, 3328, 64, 64, 64, 3328]
    - [32, 2744.0]
  - - [128, 6784, 1, 3328, 128, 128, 128, 3328]
    - [35, 4587.0]
  - - [256, 64, 1, 256, 256, 256, 256, 256]
    - [3, 249.0]
  - - [448, 64, 1, 256, 448, 448, 448, 256]
    - [3, 392.0]
  - - [704, 64, 1, 256, 704, 704, 704, 256]
    - [3, 579.0]
  - - [1024, 64, 1, 256, 1024, 1024, 1024, 256]
    - [9, 818.0]
  - - [1408, 64, 1, 256, 1408, 1408, 1408, 256]
    - [5, 1132.0]
  - - [1856, 64, 1, 256, 1856, 1856, 1856, 256]
    - [30, 1440.0]
  - - [2368, 64, 1, 256, 2368, 2368, 2368, 256]
    - [36, 1800.0]
  - - [2944, 64, 1, 256, 2944, 2944, 2944, 256]
    - [33, 2094.0]
  - - [3584, 64, 1, 256, 3584, 3584, 3584, 256]
    - [33, 2380.0]
  - - [4288, 64, 1, 256, 4288, 4288, 4288, 256]
    - [33, 2591.0]
  - - [5056, 64, 1, 256, 5056, 5056, 5056, 256]
    - [26, 2775.0]
  - - [5888, 64, 1, 256, 5888, 5888, 5888, 256]
    - [26, 2850.0]
  - - [6784, 64, 1, 256, 6784, 6784, 6784, 256]
    - [33, 2977.0]
  - - [256, 128, 1, 256, 256, 256, 256, 256]
    - [3, 432.0]
  - - [448, 128, 1, 256, 448, 448, 448, 256]
    - [3, 751.0]
  - - [704, 128, 1, 256, 704, 704, 704, 256]
    - [3, 1153.0]
  - - [1024, 128, 1, 256, 1024, 1024, 1024, 256]
    - [36, 1612.0]
  - - [1408, 128, 1, 256, 1408, 1408, 1408, 256]
    - [5, 2083.0]
  - - [1856, 128, 1, 256, 1856, 1856, 1856, 256]
    - [9, 2429.0]
  - - [2368, 128, 1, 256, 2368, 2368, 2368, 256]
    - [26, 2886.0]
  - - [2944, 128, 1, 256, 2944, 2944, 2944, 256]
    - [12, 3036.0]
  - - [3584, 128, 1, 256, 3584, 3584, 3584, 256]
    - [34, 3547.0]
  - - [4288, 128, 1, 256, 4288, 4288, 4288, 256]
    - [34, 3519.0]
  - - [5056, 128, 1, 256, 5056, 5056, 5056, 256]
    - [1, 3703.0]
  - - [5888, 128, 1, 256, 5888, 5888, 5888, 256]
    - [1, 3482.0]
  - - [6784, 128, 1, 256, 6784, 6784, 6784, 256]
    - [27, 3770.0]
  - - [256, 64, 1, 1280, 256, 256, 256, 1280]
    - [39, 411.0]
  - - [448, 64, 1, 1280, 448, 448, 448, 1280]
    - [39, 686.0]
  - - [704, 64, 1, 1280, 704, 704, 704, 1280]
    - [39, 1016.0]
  - - [1024, 64, 1, 1280, 1024, 1024, 1024, 1280]
    - [15, 1432.0]
  - - [1408, 64, 1, 1280, 1408, 1408, 1408, 1280]
    - [33, 1878.0]
  - - [1856, 64, 1, 1280, 1856, 1856, 1856, 1280]
    - [5, 2260.0]
  - - [2368, 64, 1, 1280, 2368, 2368, 2368, 1280]
    - [33, 2585.0]
  - - [2944, 64, 1, 1280, 2944, 2944, 2944, 1280]
    - [30, 2831.0]
  - - [3584, 64, 1, 1280, 3584, 3584, 3584, 1280]
    - [12, 3367.0]
  - - [4288, 64, 1, 1280, 4288, 4288, 4288, 1280]
    - [34, 3266.0]
  - - [5056, 64, 1, 1280, 5056, 5056, 5056, 1280]
    - [13, 3501.0]
  - - [5888, 64, 1, 1280, 5888, 5888, 5888, 1280]
    - [34, 3757.0]
  - - [6784, 64, 1, 1280, 6784, 6784, 6784, 1280]
    - [34, 4143.0]
  - - [256, 128, 1, 1280, 256, 256, 256, 1280]
    - [39, 747.0]
  - - [448, 128, 1, 1280, 448, 448, 448, 1280]
    - [39, 1299.0]
  - - [704, 128, 1, 1280, 704, 704, 704, 1280]
    - [12, 1908.0]
  - - [1024, 128, 1, 1280, 1024, 1024, 1024, 1280]
    - [5, 2505.0]
  - - [1408, 128, 1, 1280, 1408, 1408, 1408, 1280]
    - [5, 2891.0]
  - - [1856, 128, 1, 1280, 1856, 1856, 1856, 1280]
    - [37, 3146.0]
  - - [2368, 128, 1, 1280, 2368, 2368, 2368, 1280]
    - [34, 3754.0]
  - - [2944, 128, 1, 1280, 2944, 2944, 2944, 1280]
    - [31, 3930.0]
  - - [3584, 128, 1, 1280, 3584, 3584, 3584, 1280]
    - [34, 4553.0]
  - - [4288, 128, 1, 1280, 4288, 4288, 4288, 1280]
    - [34, 4403.0]
  - - [5056, 128, 1, 1280, 5056, 5056, 5056, 1280]
    - [48, 4625.0]
  - - [5888, 128, 1, 1280, 5888, 5888, 5888, 1280]
    - [34, 4673.0]
  - - [6784, 128, 1, 1280, 6784, 6784, 6784, 1280]
    - [35, 4926.0]
  - - [256, 64, 1, 3328, 256, 256, 256, 3328]
    - [39, 459.0]
  - - [448, 64, 1, 3328, 448, 448, 448, 3328]
    - [39, 772.0]
  - - [704, 64, 1, 3328, 704, 704, 704, 3328]
    - [39, 1198.0]
  - - [1024, 64, 1, 3328, 1024, 1024, 1024, 3328]
    - [42, 1633.0]
  - - [1408, 64, 1, 3328, 1408, 1408, 1408, 3328]
    - [15, 2128.0]
  - - [1856, 64, 1, 3328, 1856, 1856, 1856, 3328]
    - [43, 2514.0]
  - - [2368, 64, 1, 3328, 2368, 2368, 2368, 3328]
    - [12, 2745.0]
  - - [2944, 64, 1, 3328, 2944, 2944, 2944, 3328]
    - [21, 3068.0]
  - - [3584, 64, 1, 3328, 3584, 3584, 3584, 3328]
    - [21, 3716.0]
  - - [4288, 64, 1, 3328, 4288, 4288, 4288, 3328]
    - [34, 3456.0]
  - - [5056, 64, 1, 3328, 5056, 5056, 5056, 3328]
    - [34, 3649.0]
  - - [5888, 64, 1, 3328, 5888, 5888, 5888, 3328]
    - [34, 3972.0]
  - - [6784, 64, 1, 3328, 6784, 6784, 6784, 3328]
    - [34, 4320.0]
  - - [256, 128, 1, 3328, 256, 256, 256, 3328]
    - [42, 878.0]
  - - [448, 128, 1, 3328, 448, 448, 448, 3328]
    - [19, 1520.0]
  - - [704, 128, 1, 3328, 704, 704, 704, 3328]
    - [20, 2130.0]
  - - [1024, 128, 1, 3328, 1024, 1024, 1024, 3328]
    - [43, 2697.0]
  - - [1408, 128, 1, 3328, 1408, 1408, 1408, 3328]
    - [13, 3126.0]
  - - [1856, 128, 1, 3328, 1856, 1856, 1856, 3328]
    - [6, 3247.0]
  - - [2368, 128, 1, 3328, 2368, 2368, 2368, 3328]
    - [34, 3987.0]
  - - [2944, 128, 1, 3328, 2944, 2944, 2944, 3328]
    - [31, 4152.0]
  - - [3584, 128, 1, 3328, 3584, 3584, 3584, 3328]
    - [34, 4908.0]
  - - [4288, 128, 1, 3328, 4288, 4288, 4288, 3328]
    - [34, 4667.0]
  - - [5056, 128, 1, 3328, 5056, 5056, 5056, 3328]
    - [35, 4891.0]
  - - [5888, 128, 1, 3328, 5888, 5888, 5888, 3328]
    - [34, 4852.0]
  - - [6784, 128, 1, 3328, 6784, 6784, 6784, 3328]
    - [35, 5143.0]
  - - [256, 256, 1, 256, 256, 256, 256, 256]
    - [3, 851.0]
  - - [448, 256, 1, 256, 448, 448, 448, 256]
    - [3, 1441.0]
  - - [256, 448, 1, 256, 256, 256, 256, 256]
    - [12, 1441.0]
  - - [448, 448, 1, 256, 448, 448, 448, 256]
    - [5, 2367.0]
  - - [256, 256, 1, 1280, 256, 256, 256, 1280]
    - [39, 1441.0]
  - - [448, 256, 1, 1280, 448, 448, 448, 1280]
    - [39, 2356.0]
  - - [256, 448, 1, 1280, 256, 256, 256, 1280]
    - [33, 2402.0]
  - - [448, 448, 1, 1280, 448, 448, 448, 1280]
    - [5, 3153.0]
  - - [256, 256, 1, 3328, 256, 256, 256, 3328]
    - [15, 1614.0]
  - - [448, 256, 1, 3328, 448, 448, 448, 3328]
    - [20, 2698.0]
  - - [256, 448, 1, 3328, 256, 256, 256, 3328]
    - [20, 2709.0]
  - - [448, 448, 1, 3328, 448, 448, 448, 3328]
    - [34, 3404.0]
  - - [512, 32, 1, 512, 512, 512, 512, 512]
    - [3, 296.0]
  - - [1024, 32, 1, 512, 1024, 1024, 1024, 512]
    - [3, 563.0]
  - - [1760, 32, 1, 1760, 1760, 1760, 1760, 1760]
    - [19, 1298.0]
  - - [3072, 32, 1, 1024, 3072, 3072, 3072, 1024]
    - [12, 1614.0]
  - - [2048, 32, 1, 2048, 2048, 2048, 2048, 2048]
    - [20, 1421.0]
  - - [1760, 64, 1, 1760, 1760, 1760, 1760, 1760]
    - [20, 2415.0]
  - - [3072, 64, 1, 1024, 3072, 3072, 3072, 1024]
    - [12, 2888.0]
  - - [2560, 32, 1, 2560, 2560, 2560, 2560, 2560]
    - [16, 1696.0]
  - - [4608, 32, 1, 1536, 4608, 4608, 4608, 1536]
    - [13, 2063.0]
  - - [128, 1500, 1, 1280, 128, 128, 128, 1280]
    - [5, 2781.0]
  - - [2048, 64, 1, 2048, 2048, 2048, 2048, 2048]
    - [43, 2479.0]
  - - [176, 1500, 1, 1408, 176, 176, 176, 1408]
    - [12, 2894.0]
  - - [1760, 128, 1, 1760, 1760, 1760, 1760, 1760]
    - [13, 3538.0]
  - - [3072, 128, 1, 1024, 3072, 3072, 3072, 1024]
    - [31, 3959.0]
  - - [2560, 64, 1, 2560, 2560, 2560, 2560, 2560]
    - [20, 2937.0]
  - - [6144, 32, 1, 2560, 6144, 6144, 6144, 2560]
    - [34, 2215.0]
  - - [2048, 128, 1, 2048, 2048, 2048, 2048, 2048]
    - [6, 3387.0]
  - - [4096, 32, 1, 4096, 4096, 4096, 4096, 4096]
    - [17, 2127.0]
  - - [7680, 32, 1, 2560, 7680, 7680, 7680, 2560]
    - [13, 2304.0]
  - - [8448, 32, 1, 2816, 8448, 8448, 8448, 2816]
    - [13, 2339.0]
  - - [2560, 128, 1, 2560, 2560, 2560, 2560, 2560]
    - [34, 4240.0]
  - - [4096, 64, 1, 4096, 4096, 4096, 4096, 4096]
    - [31, 3366.0]
  - - [7680, 64, 1, 2560, 7680, 7680, 7680, 2560]
    - [34, 4067.0]
  - - [4096, 128, 1, 4096, 4096, 4096, 4096, 4096]
    - [34, 4340.0]
  - - [7680, 128, 1, 2560, 7680, 7680, 7680, 2560]
    - [34, 5012.0]
  - - [704, 256, 1, 256, 704, 704, 704, 256]
    - [45, 1317.0]
  - - [1024, 256, 1, 256, 1024, 1024, 1024, 256]
    - [45, 1805.0]
  - - [1408, 256, 1, 256, 1408, 1408, 1408, 256]
    - [45, 2574.0]
  - - [1856, 256, 1, 256, 1856, 1856, 1856, 256]
    - [45, 2821.0]
  - - [2368, 256, 1, 256, 2368, 2368, 2368, 256]
    - [48, 3390.0]
  - - [2944, 256, 1, 256, 2944, 2944, 2944, 256]
    - [48, 3524.0]
  - - [3584, 256, 1, 256, 3584, 3584, 3584, 256]
    - [48, 3949.0]
  - - [4288, 256, 1, 256, 4288, 4288, 4288, 256]
    - [48, 3867.0]
  - - [5056, 256, 1, 256, 5056, 5056, 5056, 256]
    - [48, 3934.0]
  - - [5888, 256, 1, 256, 5888, 5888, 5888, 256]
    - [48, 4041.0]
  - - [6784, 256, 1, 256, 6784, 6784, 6784, 256]
    - [48, 4009.0]
  - - [704, 448, 1, 256, 704, 704, 704, 256]
    - [45, 2238.0]
  - - [1024, 448, 1, 256, 1024, 1024, 1024, 256]
    - [45, 2980.0]
  - - [1408, 448, 1, 256, 1408, 1408, 1408, 256]
    - [45, 3658.0]
  - - [1856, 448, 1, 256, 1856, 1856, 1856, 256]
    - [29, 3910.0]
  - - [2368, 448, 1, 256, 2368, 2368, 2368, 256]
    - [48, 3934.0]
  - - [2944, 448, 1, 256, 2944, 2944, 2944, 256]
    - [48, 4081.0]
  - - [3584, 448, 1, 256, 3584, 3584, 3584, 256]
    - [48, 4098.0]
  - - [4288, 448, 1, 256, 4288, 4288, 4288, 256]
    - [48, 4253.0]
  - - [5056, 448, 1, 256, 5056, 5056, 5056, 256]
    - [48, 4488.0]
  - - [5888, 448, 1, 256, 5888, 5888, 5888, 256]
    - [48, 4436.0]
  - - [6784, 448, 1, 256, 6784, 6784, 6784, 256]
    - [48, 4424.0]
  - - [256, 704, 1, 256, 256, 256, 256, 256]
    - [25, 1320.0]
  - - [448, 704, 1, 256, 448, 448, 448, 256]
    - [25, 2247.0]
  - - [704, 704, 1, 256, 704, 704, 704, 256]
    - [45, 2989.0]
  - - [1024, 704, 1, 256, 1024, 1024, 1024, 256]
    - [29, 3390.0]
  - - [1408, 704, 1, 256, 1408, 1408, 1408, 256]
    - [44, 3798.0]
  - - [1856, 704, 1, 256, 1856, 1856, 1856, 256]
    - [48, 4131.0]
  - - [2368, 704, 1, 256, 2368, 2368, 2368, 256]
    - [48, 4163.0]
  - - [2944, 704, 1, 256, 2944, 2944, 2944, 256]
    - [48, 4208.0]
  - - [3584, 704, 1, 256, 3584, 3584, 3584, 256]
    - [48, 4084.0]
  - - [4288, 704, 1, 256, 4288, 4288, 4288, 256]
    - [48, 4306.0]
  - - [5056, 704, 1, 256, 5056, 5056, 5056, 256]
    - [48, 4319.0]
  - - [5888, 704, 1, 256, 5888, 5888, 5888, 256]
    - [48, 4227.0]
  - - [6784, 704, 1, 256, 6784, 6784, 6784, 256]
    - [51, 4417.0]
  - - [256, 1024, 1, 256, 256, 256, 256, 256]
    - [45, 1716.0]
  - - [448, 1024, 1, 256, 448, 448, 448, 256]
    - [45, 3229.0]
  - - [704, 1024, 1, 256, 704, 704, 704, 256]
    - [45, 3534.0]
  - - [1024, 1024, 1, 256, 1024, 1024, 1024, 256]
    - [47, 3646.0]
  - - [1408, 1024, 1, 256, 1408, 1408, 1408, 256]
    - [48, 4194.0]
  - - [1856, 1024, 1, 256, 1856, 1856, 1856, 256]
    - [48, 4358.0]
  - - [2368, 1024, 1, 256, 2368, 2368, 2368, 256]
    - [48, 4604.0]
  - - [2944, 1024, 1, 256, 2944, 2944, 2944, 256]
    - [48, 4520.0]
  - - [3584, 1024, 1, 256, 3584, 3584, 3584, 256]
    - [48, 4390.0]
  - - [4288, 1024, 1, 256, 4288, 4288, 4288, 256]
    - [48, 4735.0]
  - - [5056, 1024, 1, 256, 5056, 5056, 5056, 256]
    - [48, 4799.0]
  - - [5888, 1024, 1, 256, 5888, 5888, 5888, 256]
    - [48, 4602.0]
  - - [6784, 1024, 1, 256, 6784, 6784, 6784, 256]
    - [48, 4768.0]
  - - [256, 1408, 1, 256, 256, 256, 256, 256]
    - [45, 2341.0]
  - - [448, 1408, 1, 256, 448, 448, 448, 256]
    - [45, 3676.0]
  - - [704, 1408, 1, 256, 704, 704, 704, 256]
    - [44, 3884.0]
  - - [1024, 1408, 1, 256, 1024, 1024, 1024, 256]
    - [47, 4101.0]
  - - [1408, 1408, 1, 256, 1408, 1408, 1408, 256]
    - [48, 4589.0]
  - - [1856, 1408, 1, 256, 1856, 1856, 1856, 256]
    - [48, 4641.0]
  - - [2368, 1408, 1, 256, 2368, 2368, 2368, 256]
    - [48, 4716.0]
  - - [2944, 1408, 1, 256, 2944, 2944, 2944, 256]
    - [48, 4668.0]
  - - [3584, 1408, 1, 256, 3584, 3584, 3584, 256]
    - [48, 4484.0]
  - - [4288, 1408, 1, 256, 4288, 4288, 4288, 256]
    - [48, 4729.0]
  - - [5056, 1408, 1, 256, 5056, 5056, 5056, 256]
    - [48, 4819.0]
  - - [5888, 1408, 1, 256, 5888, 5888, 5888, 256]
    - [51, 4731.0]
  - - [6784, 1408, 1, 256, 6784, 6784, 6784, 256]
    - [51, 5014.0]
  - - [256, 1856, 1, 256, 256, 256, 256, 256]
    - [45, 2732.0]
  - - [448, 1856, 1, 256, 448, 448, 448, 256]
    - [45, 3996.0]
  - - [704, 1856, 1, 256, 704, 704, 704, 256]
    - [48, 4292.0]
  - - [1024, 1856, 1, 256, 1024, 1024, 1024, 256]
    - [47, 4296.0]
  - - [1408, 1856, 1, 256, 1408, 1408, 1408, 256]
    - [48, 4691.0]
  - - [1856, 1856, 1, 256, 1856, 1856, 1856, 256]
    - [48, 4831.0]
  - - [2368, 1856, 1, 256, 2368, 2368, 2368, 256]
    - [48, 4822.0]
  - - [2944, 1856, 1, 256, 2944, 2944, 2944, 256]
    - [48, 4705.0]
  - - [3584, 1856, 1, 256, 3584, 3584, 3584, 256]
    - [51, 4575.0]
  - - [4288, 1856, 1, 256, 4288, 4288, 4288, 256]
    - [48, 4833.0]
  - - [5056, 1856, 1, 256, 5056, 5056, 5056, 256]
    - [48, 4877.0]
  - - [5888, 1856, 1, 256, 5888, 5888, 5888, 256]
    - [51, 4953.0]
  - - [6784, 1856, 1, 256, 6784, 6784, 6784, 256]
    - [51, 5074.0]
  - - [256, 2368, 1, 256, 256, 256, 256, 256]
    - [45, 3368.0]
  - - [448, 2368, 1, 256, 448, 448, 448, 256]
    - [25, 4007.0]
  - - [704, 2368, 1, 256, 704, 704, 704, 256]
    - [45, 4255.0]
  - - [1024, 2368, 1, 256, 1024, 1024, 1024, 256]
    - [47, 4661.0]
  - - [1408, 2368, 1, 256, 1408, 1408, 1408, 256]
    - [48, 4870.0]
  - - [1856, 2368, 1, 256, 1856, 1856, 1856, 256]
    - [47, 4871.0]
  - - [2368, 2368, 1, 256, 2368, 2368, 2368, 256]
    - [48, 4886.0]
  - - [2944, 2368, 1, 256, 2944, 2944, 2944, 256]
    - [48, 4789.0]
  - - [3584, 2368, 1, 256, 3584, 3584, 3584, 256]
    - [51, 4707.0]
  - - [4288, 2368, 1, 256, 4288, 4288, 4288, 256]
    - [48, 4872.0]
  - - [5056, 2368, 1, 256, 5056, 5056, 5056, 256]
    - [48, 4891.0]
  - - [5888, 2368, 1, 256, 5888, 5888, 5888, 256]
    - [51, 5051.0]
  - - [6784, 2368, 1, 256, 6784, 6784, 6784, 256]
    - [51, 5086.0]
  - - [256, 2944, 1, 256, 256, 256, 256, 256]
    - [45, 3491.0]
  - - [448, 2944, 1, 256, 448, 448, 448, 256]
    - [45, 4329.0]
  - - [704, 2944, 1, 256, 704, 704, 704, 256]
    - [48, 4603.0]
  - - [1024, 2944, 1, 256, 1024, 1024, 1024, 256]
    - [47, 4723.0]
  - - [1408, 2944, 1, 256, 1408, 1408, 1408, 256]
    - [47, 4916.0]
  - - [1856, 2944, 1, 256, 1856, 1856, 1856, 256]
    - [47, 5048.0]
  - - [2368, 2944, 1, 256, 2368, 2368, 2368, 256]
    - [48, 4972.0]
  - - [2944, 2944, 1, 256, 2944, 2944, 2944, 256]
    - [48, 4889.0]
  - - [3584, 2944, 1, 256, 3584, 3584, 3584, 256]
    - [51, 4823.0]
  - - [4288, 2944, 1, 256, 4288, 4288, 4288, 256]
    - [48, 4944.0]
  - - [5056, 2944, 1, 256, 5056, 5056, 5056, 256]
    - [48, 4995.0]
  - - [5888, 2944, 1, 256, 5888, 5888, 5888, 256]
    - [51, 5117.0]
  - - [6784, 2944, 1, 256, 6784, 6784, 6784, 256]
    - [51, 5212.0]
  - - [256, 3584, 1, 256, 256, 256, 256, 256]
    - [45, 3843.0]
  - - [448, 3584, 1, 256, 448, 448, 448, 256]
    - [48, 4609.0]
  - - [704, 3584, 1, 256, 704, 704, 704, 256]
    - [48, 4871.0]
  - - [1024, 3584, 1, 256, 1024, 1024, 1024, 256]
    - [47, 4791.0]
  - - [1408, 3584, 1, 256, 1408, 1408, 1408, 256]
    - [48, 5086.0]
  - - [1856, 3584, 1, 256, 1856, 1856, 1856, 256]
    - [48, 5106.0]
  - - [2368, 3584, 1, 256, 2368, 2368, 2368, 256]
    - [48, 5059.0]
  - - [2944, 3584, 1, 256, 2944, 2944, 2944, 256]
    - [51, 4998.0]
  - - [3584, 3584, 1, 256, 3584, 3584, 3584, 256]
    - [51, 4928.0]
  - - [4288, 3584, 1, 256, 4288, 4288, 4288, 256]
    - [48, 5003.0]
  - - [5056, 3584, 1, 256, 5056, 5056, 5056, 256]
    - [48, 5069.0]
  - - [5888, 3584, 1, 256, 5888, 5888, 5888, 256]
    - [51, 5158.0]
  - - [6784, 3584, 1, 256, 6784, 6784, 6784, 256]
    - [51, 5268.0]
  - - [256, 4288, 1, 256, 256, 256, 256, 256]
    - [47, 3752.0]
  - - [448, 4288, 1, 256, 448, 448, 448, 256]
    - [45, 4402.0]
  - - [704, 4288, 1, 256, 704, 704, 704, 256]
    - [48, 4761.0]
  - - [1024, 4288, 1, 256, 1024, 1024, 1024, 256]
    - [47, 4961.0]
  - - [1408, 4288, 1, 256, 1408, 1408, 1408, 256]
    - [47, 5175.0]
  - - [1856, 4288, 1, 256, 1856, 1856, 1856, 256]
    - [47, 5165.0]
  - - [2368, 4288, 1, 256, 2368, 2368, 2368, 256]
    - [48, 5040.0]
  - - [2944, 4288, 1, 256, 2944, 2944, 2944, 256]
    - [51, 4971.0]
  - - [3584, 4288, 1, 256, 3584, 3584, 3584, 256]
    - [51, 4957.0]
  - - [4288, 4288, 1, 256, 4288, 4288, 4288, 256]
    - [48, 4985.0]
  - - [5056, 4288, 1, 256, 5056, 5056, 5056, 256]
    - [48, 5011.0]
  - - [5888, 4288, 1, 256, 5888, 5888, 5888, 256]
    - [51, 5188.0]
  - - [6784, 4288, 1, 256, 6784, 6784, 6784, 256]
    - [51, 5260.0]
  - - [256, 5056, 1, 256, 256, 256, 256, 256]
    - [47, 3856.0]
  - - [448, 5056, 1, 256, 448, 448, 448, 256]
    - [47, 4594.0]
  - - [704, 5056, 1, 256, 704, 704, 704, 256]
    - [47, 4909.0]
  - - [1024, 5056, 1, 256, 1024, 1024, 1024, 256]
    - [47, 5030.0]
  - - [1408, 5056, 1, 256, 1408, 1408, 1408, 256]
    - [47, 5211.0]
  - - [1856, 5056, 1, 256, 1856, 1856, 1856, 256]
    - [47, 5216.0]
  - - [2368, 5056, 1, 256, 2368, 2368, 2368, 256]
    - [48, 5160.0]
  - - [2944, 5056, 1, 256, 2944, 2944, 2944, 256]
    - [51, 5060.0]
  - - [3584, 5056, 1, 256, 3584, 3584, 3584, 256]
    - [51, 5010.0]
  - - [4288, 5056, 1, 256, 4288, 4288, 4288, 256]
    - [48, 5052.0]
  - - [5056, 5056, 1, 256, 5056, 5056, 5056, 256]
    - [48, 5061.0]
  - - [5888, 5056, 1, 256, 5888, 5888, 5888, 256]
    - [51, 5251.0]
  - - [6784, 5056, 1, 256, 6784, 6784, 6784, 256]
    - [51, 5320.0]
  - - [256, 5888, 1, 256, 256, 256, 256, 256]
    - [48, 3931.0]
  - - [448, 5888, 1, 256, 448, 448, 448, 256]
    - [48, 4670.0]
  - - [704, 5888, 1, 256, 704, 704, 704, 256]
    - [47, 4988.0]
  - - [1024, 5888, 1, 256, 1024, 1024, 1024, 256]
    - [47, 5132.0]
  - - [1408, 5888, 1, 256, 1408, 1408, 1408, 256]
    - [47, 5290.0]
  - - [1856, 5888, 1, 256, 1856, 1856, 1856, 256]
    - [47, 5267.0]
  - - [2368, 5888, 1, 256, 2368, 2368, 2368, 256]
    - [48, 5137.0]
  - - [2944, 5888, 1, 256, 2944, 2944, 2944, 256]
    - [51, 5152.0]
  - - [3584, 5888, 1, 256, 3584, 3584, 3584, 256]
    - [51, 5105.0]
  - - [4288, 5888, 1, 256, 4288, 4288, 4288, 256]
    - [48, 5052.0]
  - - [5056, 5888, 1, 256, 5056, 5056, 5056, 256]
    - [48, 5077.0]
  - - [5888, 5888, 1, 256, 5888, 5888, 5888, 256]
    - [51, 5279.0]
  - - [6784, 5888, 1, 256, 6784, 6784, 6784, 256]
    - [51, 5314.0]
  - - [256, 6784, 1, 256, 256, 256, 256, 256]
    - [47, 3813.0]
  - - [448, 6784, 1, 256, 448, 448, 448, 256]
    - [48, 4708.0]
  - - [704, 6784, 1, 256, 704, 704, 704, 256]
    - [47, 5089.0]
  - - [1024, 6784, 1, 256, 1024, 1024, 1024, 256]
    - [47, 5137.0]
  - - [1408, 6784, 1, 256, 1408, 1408, 1408, 256]
    - [47, 5336.0]
  - - [1856, 6784, 1, 256, 1856, 1856, 1856, 256]
    - [47, 5285.0]
  - - [2368, 6784, 1, 256, 2368, 2368, 2368, 256]
    - [53, 5179.0]
  - - [2944, 6784, 1, 256, 2944, 2944, 2944, 256]
    - [51, 5138.0]
  - - [3584, 6784, 1, 256, 3584, 3584, 3584, 256]
    - [51, 5105.0]
  - - [4288, 6784, 1, 256, 4288, 4288, 4288, 256]
    - [48, 5050.0]
  - - [5056, 6784, 1, 256, 5056, 5056, 5056, 256]
    - [52, 5084.0]
  - - [5888, 6784, 1, 256, 5888, 5888, 5888, 256]
    - [52, 5276.0]
  - - [6784, 6784, 1, 256, 6784, 6784, 6784, 256]
    - [51, 5340.0]
  - - [704, 256, 1, 1280, 704, 704, 704, 1280]
    - [48, 2066.0]
  - - [1024, 256, 1, 1280, 1024, 1024, 1024, 1280]
    - [48, 2387.0]
  - - [1408, 256, 1, 1280, 1408, 1408, 1408, 1280]
    - [48, 3275.0]
  - - [1856, 256, 1, 1280, 1856, 1856, 1856, 1280]
    - [48, 3461.0]
  - - [2368, 256, 1, 1280, 2368, 2368, 2368, 1280]
    - [29, 4401.0]
  - - [2944, 256, 1, 1280, 2944, 2944, 2944, 1280]
    - [29, 4348.0]
  - - [3584, 256, 1, 1280, 3584, 3584, 3584, 1280]
    - [48, 5217.0]
  - - [4288, 256, 1, 1280, 4288, 4288, 4288, 1280]
    - [48, 4894.0]
  - - [5056, 256, 1, 1280, 5056, 5056, 5056, 1280]
    - [48, 5050.0]
  - - [5888, 256, 1, 1280, 5888, 5888, 5888, 1280]
    - [48, 5138.0]
  - - [6784, 256, 1, 1280, 6784, 6784, 6784, 1280]
    - [48, 5208.0]
  - - [704, 448, 1, 1280, 704, 704, 704, 1280]
    - [48, 2847.0]
  - - [1024, 448, 1, 1280, 1024, 1024, 1024, 1280]
    - [48, 4032.0]
  - - [1408, 448, 1, 1280, 1408, 1408, 1408, 1280]
    - [48, 4536.0]
  - - [1856, 448, 1, 1280, 1856, 1856, 1856, 1280]
    - [29, 4768.0]
  - - [2368, 448, 1, 1280, 2368, 2368, 2368, 1280]
    - [48, 4770.0]
  - - [2944, 448, 1, 1280, 2944, 2944, 2944, 1280]
    - [48, 5110.0]
  - - [3584, 448, 1, 1280, 3584, 3584, 3584, 1280]
    - [48, 5469.0]
  - - [4288, 448, 1, 1280, 4288, 4288, 4288, 1280]
    - [48, 5136.0]
  - - [5056, 448, 1, 1280, 5056, 5056, 5056, 1280]
    - [48, 5531.0]
  - - [5888, 448, 1, 1280, 5888, 5888, 5888, 1280]
    - [48, 5437.0]
  - - [6784, 448, 1, 1280, 6784, 6784, 6784, 1280]
    - [48, 5422.0]
  - - [256, 704, 1, 1280, 256, 256, 256, 1280]
    - [48, 2047.0]
  - - [448, 704, 1, 1280, 448, 448, 448, 1280]
    - [29, 2849.0]
  - - [704, 704, 1, 1280, 704, 704, 704, 1280]
    - [48, 3543.0]
  - - [1024, 704, 1, 1280, 1024, 1024, 1024, 1280]
    - [29, 4115.0]
  - - [1408, 704, 1, 1280, 1408, 1408, 1408, 1280]
    - [48, 4370.0]
  - - [1856, 704, 1, 1280, 1856, 1856, 1856, 1280]
    - [48, 5004.0]
  - - [2368, 704, 1, 1280, 2368, 2368, 2368, 1280]
    - [48, 4942.0]
  - - [2944, 704, 1, 1280, 2944, 2944, 2944, 1280]
    - [48, 5022.0]
  - - [3584, 704, 1, 1280, 3584, 3584, 3584, 1280]
    - [48, 5274.0]
  - - [4288, 704, 1, 1280, 4288, 4288, 4288, 1280]
    - [48, 5338.0]
  - - [5056, 704, 1, 1280, 5056, 5056, 5056, 1280]
    - [48, 5550.0]
  - - [5888, 704, 1, 1280, 5888, 5888, 5888, 1280]
    - [48, 5413.0]
  - - [6784, 704, 1, 1280, 6784, 6784, 6784, 1280]
    - [48, 5701.0]
  - - [256, 1024, 1, 1280, 256, 256, 256, 1280]
    - [48, 2351.0]
  - - [448, 1024, 1, 1280, 448, 448, 448, 1280]
    - [48, 4008.0]
  - - [704, 1024, 1, 1280, 704, 704, 704, 1280]
    - [48, 4073.0]
  - - [1024, 1024, 1, 1280, 1024, 1024, 1024, 1280]
    - [48, 4415.0]
  - - [1408, 1024, 1, 1280, 1408, 1408, 1408, 1280]
    - [48, 4800.0]
  - - [1856, 1024, 1, 1280, 1856, 1856, 1856, 1280]
    - [48, 4958.0]
  - - [2368, 1024, 1, 1280, 2368, 2368, 2368, 1280]
    - [48, 5241.0]
  - - [2944, 1024, 1, 1280, 2944, 2944, 2944, 1280]
    - [48, 5238.0]
  - - [3584, 1024, 1, 1280, 3584, 3584, 3584, 1280]
    - [48, 5552.0]
  - - [4288, 1024, 1, 1280, 4288, 4288, 4288, 1280]
    - [48, 5501.0]
  - - [5056, 1024, 1, 1280, 5056, 5056, 5056, 1280]
    - [48, 5685.0]
  - - [5888, 1024, 1, 1280, 5888, 5888, 5888, 1280]
    - [48, 5643.0]
  - - [6784, 1024, 1, 1280, 6784, 6784, 6784, 1280]
    - [48, 5719.0]
  - - [256, 1408, 1, 1280, 256, 256, 256, 1280]
    - [48, 3186.0]
  - - [448, 1408, 1, 1280, 448, 448, 448, 1280]
    - [48, 4346.0]
  - - [704, 1408, 1, 1280, 704, 704, 704, 1280]
    - [48, 4263.0]
  - - [1024, 1408, 1, 1280, 1024, 1024, 1024, 1280]
    - [48, 4471.0]
  - - [1408, 1408, 1, 1280, 1408, 1408, 1408, 1280]
    - [48, 5047.0]
  - - [1856, 1408, 1, 1280, 1856, 1856, 1856, 1280]
    - [48, 5205.0]
  - - [2368, 1408, 1, 1280, 2368, 2368, 2368, 1280]
    - [48, 5395.0]
  - - [2944, 1408, 1, 1280, 2944, 2944, 2944, 1280]
    - [48, 5378.0]
  - - [3584, 1408, 1, 1280, 3584, 3584, 3584, 1280]
    - [48, 5636.0]
  - - [4288, 1408, 1, 1280, 4288, 4288, 4288, 1280]
    - [48, 5638.0]
  - - [5056, 1408, 1, 1280, 5056, 5056, 5056, 1280]
    - [48, 5679.0]
  - - [5888, 1408, 1, 1280, 5888, 5888, 5888, 1280]
    - [48, 5704.0]
  - - [6784, 1408, 1, 1280, 6784, 6784, 6784, 1280]
    - [48, 5822.0]
  - - [256, 1856, 1, 1280, 256, 256, 256, 1280]
    - [48, 3341.0]
  - - [448, 1856, 1, 1280, 448, 448, 448, 1280]
    - [48, 4409.0]
  - - [704, 1856, 1, 1280, 704, 704, 704, 1280]
    - [48, 4696.0]
  - - [1024, 1856, 1, 1280, 1024, 1024, 1024, 1280]
    - [48, 4349.0]
  - - [1408, 1856, 1, 1280, 1408, 1408, 1408, 1280]
    - [48, 5072.0]
  - - [1856, 1856, 1, 1280, 1856, 1856, 1856, 1280]
    - [48, 5196.0]
  - - [2368, 1856, 1, 1280, 2368, 2368, 2368, 1280]
    - [48, 5438.0]
  - - [2944, 1856, 1, 1280, 2944, 2944, 2944, 1280]
    - [48, 5644.0]
  - - [3584, 1856, 1, 1280, 3584, 3584, 3584, 1280]
    - [48, 5685.0]
  - - [4288, 1856, 1, 1280, 4288, 4288, 4288, 1280]
    - [48, 5765.0]
  - - [5056, 1856, 1, 1280, 5056, 5056, 5056, 1280]
    - [48, 5850.0]
  - - [5888, 1856, 1, 1280, 5888, 5888, 5888, 1280]
    - [48, 5808.0]
  - - [6784, 1856, 1, 1280, 6784, 6784, 6784, 1280]
    - [48, 5872.0]
  - - [256, 2368, 1, 1280, 256, 256, 256, 1280]
    - [48, 4147.0]
  - - [448, 2368, 1, 1280, 448, 448, 448, 1280]
    - [48, 4053.0]
  - - [704, 2368, 1, 1280, 704, 704, 704, 1280]
    - [51, 4719.0]
  - - [1024, 2368, 1, 1280, 1024, 1024, 1024, 1280]
    - [51, 4612.0]
  - - [1408, 2368, 1, 1280, 1408, 1408, 1408, 1280]
    - [48, 5136.0]
  - - [1856, 2368, 1, 1280, 1856, 1856, 1856, 1280]
    - [48, 5348.0]
  - - [2368, 2368, 1, 1280, 2368, 2368, 2368, 1280]
    - [48, 5557.0]
  - - [2944, 2368, 1, 1280, 2944, 2944, 2944, 1280]
    - [48, 5628.0]
  - - [3584, 2368, 1, 1280, 3584, 3584, 3584, 1280]
    - [48, 5718.0]
  - - [4288, 2368, 1, 1280, 4288, 4288, 4288, 1280]
    - [48, 5749.0]
  - - [5056, 2368, 1, 1280, 5056, 5056, 5056, 1280]
    - [48, 5798.0]
  - - [5888, 2368, 1, 1280, 5888, 5888, 5888, 1280]
    - [48, 5851.0]
  - - [6784, 2368, 1, 1280, 6784, 6784, 6784, 1280]
    - [48, 5828.0]
  - - [256, 2944, 1, 1280, 256, 256, 256, 1280]
    - [48, 4086.0]
  - - [448, 2944, 1, 1280, 448, 448, 448, 1280]
    - [54, 4052.0]
  - - [704, 2944, 1, 1280, 704, 704, 704, 1280]
    - [51, 4672.0]
  - - [1024, 2944, 1, 1280, 1024, 1024, 1024, 1280]
    - [51, 4903.0]
  - - [1408, 2944, 1, 1280, 1408, 1408, 1408, 1280]
    - [48, 5107.0]
  - - [1856, 2944, 1, 1280, 1856, 1856, 1856, 1280]
    - [48, 5543.0]
  - - [2368, 2944, 1, 1280, 2368, 2368, 2368, 1280]
    - [48, 5615.0]
  - - [2944, 2944, 1, 1280, 2944, 2944, 2944, 1280]
    - [48, 5722.0]
  - - [3584, 2944, 1, 1280, 3584, 3584, 3584, 1280]
    - [48, 5742.0]
  - - [4288, 2944, 1, 1280, 4288, 4288, 4288, 1280]
    - [48, 5775.0]
  - - [5056, 2944, 1, 1280, 5056, 5056, 5056, 1280]
    - [48, 5891.0]
  - - [5888, 2944, 1, 1280, 5888, 5888, 5888, 1280]
    - [48, 5848.0]
  - - [6784, 2944, 1, 1280, 6784, 6784, 6784, 1280]
    - [48, 5846.0]
  - - [256, 3584, 1, 1280, 256, 256, 256, 1280]
    - [48, 4574.0]
  - - [448, 3584, 1, 1280, 448, 448, 448, 1280]
    - [51, 4488.0]
  - - [704, 3584, 1, 1280, 704, 704, 704, 1280]
    - [51, 4804.0]
  - - [1024, 3584, 1, 1280, 1024, 1024, 1024, 1280]
    - [51, 5200.0]
  - - [1408, 3584, 1, 1280, 1408, 1408, 1408, 1280]
    - [51, 5389.0]
  - - [1856, 3584, 1, 1280, 1856, 1856, 1856, 1280]
    - [48, 5592.0]
  - - [2368, 3584, 1, 1280, 2368, 2368, 2368, 1280]
    - [48, 5736.0]
  - - [2944, 3584, 1, 1280, 2944, 2944, 2944, 1280]
    - [48, 5762.0]
  - - [3584, 3584, 1, 1280, 3584, 3584, 3584, 1280]
    - [48, 5774.0]
  - - [4288, 3584, 1, 1280, 4288, 4288, 4288, 1280]
    - [48, 5868.0]
  - - [5056, 3584, 1, 1280, 5056, 5056, 5056, 1280]
    - [48, 5911.0]
  - - [5888, 3584, 1, 1280, 5888, 5888, 5888, 1280]
    - [48, 5885.0]
  - - [6784, 3584, 1, 1280, 6784, 6784, 6784, 1280]
    - [48, 5907.0]
  - - [256, 4288, 1, 1280, 256, 256, 256, 1280]
    - [48, 4112.0]
  - - [448, 4288, 1, 1280, 448, 448, 448, 1280]
    - [51, 4322.0]
  - - [704, 4288, 1, 1280, 704, 704, 704, 1280]
    - [54, 4622.0]
  - - [1024, 4288, 1, 1280, 1024, 1024, 1024, 1280]
    - [51, 5055.0]
  - - [1408, 4288, 1, 1280, 1408, 1408, 1408, 1280]
    - [54, 5291.0]
  - - [1856, 4288, 1, 1280, 1856, 1856, 1856, 1280]
    - [48, 5575.0]
  - - [2368, 4288, 1, 1280, 2368, 2368, 2368, 1280]
    - [48, 5667.0]
  - - [2944, 4288, 1, 1280, 2944, 2944, 2944, 1280]
    - [48, 5695.0]
  - - [3584, 4288, 1, 1280, 3584, 3584, 3584, 1280]
    - [48, 5778.0]
  - - [4288, 4288, 1, 1280, 4288, 4288, 4288, 1280]
    - [48, 5832.0]
  - - [5056, 4288, 1, 1280, 5056, 5056, 5056, 1280]
    - [48, 5886.0]
  - - [5888, 4288, 1, 1280, 5888, 5888, 5888, 1280]
    - [48, 5842.0]
  - - [6784, 4288, 1, 1280, 6784, 6784, 6784, 1280]
    - [48, 5899.0]
  - - [256, 5056, 1, 1280, 256, 256, 256, 1280]
    - [51, 4681.0]
  - - [448, 5056, 1, 1280, 448, 448, 448, 1280]
    - [51, 4335.0]
  - - [704, 5056, 1, 1280, 704, 704, 704, 1280]
    - [54, 4794.0]
  - - [1024, 5056, 1, 1280, 1024, 1024, 1024, 1280]
    - [51, 5019.0]
  - - [1408, 5056, 1, 1280, 1408, 1408, 1408, 1280]
    - [54, 5322.0]
  - - [1856, 5056, 1, 1280, 1856, 1856, 1856, 1280]
    - [48, 5632.0]
  - - [2368, 5056, 1, 1280, 2368, 2368, 2368, 1280]
    - [48, 5703.0]
  - - [2944, 5056, 1, 1280, 2944, 2944, 2944, 1280]
    - [48, 5780.0]
  - - [3584, 5056, 1, 1280, 3584, 3584, 3584, 1280]
    - [48, 5781.0]
  - - [4288, 5056, 1, 1280, 4288, 4288, 4288, 1280]
    - [48, 5860.0]
  - - [5056, 5056, 1, 1280, 5056, 5056, 5056, 1280]
    - [48, 5900.0]
  - - [5888, 5056, 1, 1280, 5888, 5888, 5888, 1280]
    - [48, 5886.0]
  - - [6784, 5056, 1, 1280, 6784, 6784, 6784, 1280]
    - [48, 5996.0]
  - - [256, 5888, 1, 1280, 256, 256, 256, 1280]
    - [51, 4226.0]
  - - [448, 5888, 1, 1280, 448, 448, 448, 1280]
    - [54, 4389.0]
  - - [704, 5888, 1, 1280, 704, 704, 704, 1280]
    - [54, 4875.0]
  - - [1024, 5888, 1, 1280, 1024, 1024, 1024, 1280]
    - [51, 5029.0]
  - - [1408, 5888, 1, 1280, 1408, 1408, 1408, 1280]
    - [54, 5375.0]
  - - [1856, 5888, 1, 1280, 1856, 1856, 1856, 1280]
    - [48, 5597.0]
  - - [2368, 5888, 1, 1280, 2368, 2368, 2368, 1280]
    - [48, 5776.0]
  - - [2944, 5888, 1, 1280, 2944, 2944, 2944, 1280]
    - [48, 5774.0]
  - - [3584, 5888, 1, 1280, 3584, 3584, 3584, 1280]
    - [48, 5802.0]
  - - [4288, 5888, 1, 1280, 4288, 4288, 4288, 1280]
    - [48, 5856.0]
  - - [5056, 5888, 1, 1280, 5056, 5056, 5056, 1280]
    - [48, 5919.0]
  - - [5888, 5888, 1, 1280, 5888, 5888, 5888, 1280]
    - [48, 6009.0]
  - - [6784, 5888, 1, 1280, 6784, 6784, 6784, 1280]
    - [48, 6108.0]
  - - [256, 6784, 1, 1280, 256, 256, 256, 1280]
    - [51, 4773.0]
  - - [448, 6784, 1, 1280, 448, 448, 448, 1280]
    - [54, 4460.0]
  - - [704, 6784, 1, 1280, 704, 704, 704, 1280]
    - [54, 4936.0]
  - - [1024, 6784, 1, 1280, 1024, 1024, 1024, 1280]
    - [51, 5104.0]
  - - [1408, 6784, 1, 1280, 1408, 1408, 1408, 1280]
    - [54, 5442.0]
  - - [1856, 6784, 1, 1280, 1856, 1856, 1856, 1280]
    - [48, 5657.0]
  - - [2368, 6784, 1, 1280, 2368, 2368, 2368, 1280]
    - [48, 5728.0]
  - - [2944, 6784, 1, 1280, 2944, 2944, 2944, 1280]
    - [48, 5747.0]
  - - [3584, 6784, 1, 1280, 3584, 3584, 3584, 1280]
    - [48, 5797.0]
  - - [4288, 6784, 1, 1280, 4288, 4288, 4288, 1280]
    - [48, 5881.0]
  - - [5056, 6784, 1, 1280, 5056, 5056, 5056, 1280]
    - [48, 6025.0]
  - - [5888, 6784, 1, 1280, 5888, 5888, 5888, 1280]
    - [48, 6084.0]
  - - [6784, 6784, 1, 1280, 6784, 6784, 6784, 1280]
    - [48, 6238.0]
  - - [704, 256, 1, 3328, 704, 704, 704, 3328]
    - [48, 2315.0]
  - - [1024, 256, 1, 3328, 1024, 1024, 1024, 3328]
    - [48, 2525.0]
  - - [1408, 256, 1, 3328, 1408, 1408, 1408, 3328]
    - [48, 3473.0]
  - - [1856, 256, 1, 3328, 1856, 1856, 1856, 3328]
    - [48, 3606.0]
  - - [2368, 256, 1, 3328, 2368, 2368, 2368, 3328]
    - [48, 4597.0]
  - - [2944, 256, 1, 3328, 2944, 2944, 2944, 3328]
    - [29, 4505.0]
  - - [3584, 256, 1, 3328, 3584, 3584, 3584, 3328]
    - [48, 5417.0]
  - - [4288, 256, 1, 3328, 4288, 4288, 4288, 3328]
    - [48, 5021.0]
  - - [5056, 256, 1, 3328, 5056, 5056, 5056, 3328]
    - [48, 5135.0]
  - - [5888, 256, 1, 3328, 5888, 5888, 5888, 3328]
    - [48, 5194.0]
  - - [6784, 256, 1, 3328, 6784, 6784, 6784, 3328]
    - [48, 5316.0]
  - - [704, 448, 1, 3328, 704, 704, 704, 3328]
    - [48, 3014.0]
  - - [1024, 448, 1, 3328, 1024, 1024, 1024, 3328]
    - [48, 4241.0]
  - - [1408, 448, 1, 3328, 1408, 1408, 1408, 3328]
    - [48, 4697.0]
  - - [1856, 448, 1, 3328, 1856, 1856, 1856, 3328]
    - [48, 4888.0]
  - - [2368, 448, 1, 3328, 2368, 2368, 2368, 3328]
    - [48, 4785.0]
  - - [2944, 448, 1, 3328, 2944, 2944, 2944, 3328]
    - [48, 5154.0]
  - - [3584, 448, 1, 3328, 3584, 3584, 3584, 3328]
    - [48, 5388.0]
  - - [4288, 448, 1, 3328, 4288, 4288, 4288, 3328]
    - [48, 5150.0]
  - - [5056, 448, 1, 3328, 5056, 5056, 5056, 3328]
    - [48, 5554.0]
  - - [5888, 448, 1, 3328, 5888, 5888, 5888, 3328]
    - [48, 5396.0]
  - - [6784, 448, 1, 3328, 6784, 6784, 6784, 3328]
    - [48, 5396.0]
  - - [256, 704, 1, 3328, 256, 256, 256, 3328]
    - [29, 2332.0]
  - - [448, 704, 1, 3328, 448, 448, 448, 3328]
    - [48, 3013.0]
  - - [704, 704, 1, 3328, 704, 704, 704, 3328]
    - [48, 3710.0]
  - - [1024, 704, 1, 3328, 1024, 1024, 1024, 3328]
    - [48, 4063.0]
  - - [1408, 704, 1, 3328, 1408, 1408, 1408, 3328]
    - [48, 4417.0]
  - - [1856, 704, 1, 3328, 1856, 1856, 1856, 3328]
    - [51, 4992.0]
  - - [2368, 704, 1, 3328, 2368, 2368, 2368, 3328]
    - [51, 4933.0]
  - - [2944, 704, 1, 3328, 2944, 2944, 2944, 3328]
    - [51, 4898.0]
  - - [3584, 704, 1, 3328, 3584, 3584, 3584, 3328]
    - [51, 5060.0]
  - - [4288, 704, 1, 3328, 4288, 4288, 4288, 3328]
    - [51, 5236.0]
  - - [5056, 704, 1, 3328, 5056, 5056, 5056, 3328]
    - [51, 5440.0]
  - - [5888, 704, 1, 3328, 5888, 5888, 5888, 3328]
    - [54, 5137.0]
  - - [6784, 704, 1, 3328, 6784, 6784, 6784, 3328]
    - [51, 5402.0]
  - - [256, 1024, 1, 3328, 256, 256, 256, 3328]
    - [48, 2521.0]
  - - [448, 1024, 1, 3328, 448, 448, 448, 3328]
    - [48, 4313.0]
  - - [704, 1024, 1, 3328, 704, 704, 704, 3328]
    - [48, 4217.0]
  - - [1024, 1024, 1, 3328, 1024, 1024, 1024, 3328]
    - [48, 4372.0]
  - - [1408, 1024, 1, 3328, 1408, 1408, 1408, 3328]
    - [48, 4750.0]
  - - [1856, 1024, 1, 3328, 1856, 1856, 1856, 3328]
    - [52, 4768.0]
  - - [2368, 1024, 1, 3328, 2368, 2368, 2368, 3328]
    - [54, 5030.0]
  - - [2944, 1024, 1, 3328, 2944, 2944, 2944, 3328]
    - [51, 5264.0]
  - - [3584, 1024, 1, 3328, 3584, 3584, 3584, 3328]
    - [51, 5606.0]
  - - [4288, 1024, 1, 3328, 4288, 4288, 4288, 3328]
    - [51, 5444.0]
  - - [5056, 1024, 1, 3328, 5056, 5056, 5056, 3328]
    - [51, 5393.0]
  - - [5888, 1024, 1, 3328, 5888, 5888, 5888, 3328]
    - [51, 5406.0]
  - - [6784, 1024, 1, 3328, 6784, 6784, 6784, 3328]
    - [51, 5487.0]
  - - [256, 1408, 1, 3328, 256, 256, 256, 3328]
    - [48, 3439.0]
  - - [448, 1408, 1, 3328, 448, 448, 448, 3328]
    - [48, 4646.0]
  - - [704, 1408, 1, 3328, 704, 704, 704, 3328]
    - [48, 4390.0]
  - - [1024, 1408, 1, 3328, 1024, 1024, 1024, 3328]
    - [54, 4312.0]
  - - [1408, 1408, 1, 3328, 1408, 1408, 1408, 3328]
    - [52, 4980.0]
  - - [1856, 1408, 1, 3328, 1856, 1856, 1856, 3328]
    - [51, 5234.0]
  - - [2368, 1408, 1, 3328, 2368, 2368, 2368, 3328]
    - [54, 5136.0]
  - - [2944, 1408, 1, 3328, 2944, 2944, 2944, 3328]
    - [54, 5167.0]
  - - [3584, 1408, 1, 3328, 3584, 3584, 3584, 3328]
    - [51, 5649.0]
  - - [4288, 1408, 1, 3328, 4288, 4288, 4288, 3328]
    - [51, 5392.0]
  - - [5056, 1408, 1, 3328, 5056, 5056, 5056, 3328]
    - [51, 5581.0]
  - - [5888, 1408, 1, 3328, 5888, 5888, 5888, 3328]
    - [51, 5505.0]
  - - [6784, 1408, 1, 3328, 6784, 6784, 6784, 3328]
    - [51, 5755.0]
  - - [256, 1856, 1, 3328, 256, 256, 256, 3328]
    - [48, 3561.0]
  - - [448, 1856, 1, 3328, 448, 448, 448, 3328]
    - [48, 4600.0]
  - - [704, 1856, 1, 3328, 704, 704, 704, 3328]
    - [48, 4718.0]
  - - [1024, 1856, 1, 3328, 1024, 1024, 1024, 3328]
    - [52, 4666.0]
  - - [1408, 1856, 1, 3328, 1408, 1408, 1408, 3328]
    - [51, 5252.0]
  - - [1856, 1856, 1, 3328, 1856, 1856, 1856, 3328]
    - [51, 5269.0]
  - - [2368, 1856, 1, 3328, 2368, 2368, 2368, 3328]
    - [51, 5395.0]
  - - [2944, 1856, 1, 3328, 2944, 2944, 2944, 3328]
    - [51, 5653.0]
  - - [3584, 1856, 1, 3328, 3584, 3584, 3584, 3328]
    - [51, 5524.0]
  - - [4288, 1856, 1, 3328, 4288, 4288, 4288, 3328]
    - [51, 5548.0]
  - - [5056, 1856, 1, 3328, 5056, 5056, 5056, 3328]
    - [51, 5634.0]
  - - [5888, 1856, 1, 3328, 5888, 5888, 5888, 3328]
    - [51, 5768.0]
  - - [6784, 1856, 1, 3328, 6784, 6784, 6784, 3328]
    - [51, 5788.0]
  - - [256, 2368, 1, 3328, 256, 256, 256, 3328]
    - [48, 4460.0]
  - - [448, 2368, 1, 3328, 448, 448, 448, 3328]
    - [54, 4296.0]
  - - [704, 2368, 1, 3328, 704, 704, 704, 3328]
    - [51, 4948.0]
  - - [1024, 2368, 1, 3328, 1024, 1024, 1024, 3328]
    - [51, 4847.0]
  - - [1408, 2368, 1, 3328, 1408, 1408, 1408, 3328]
    - [52, 5160.0]
  - - [1856, 2368, 1, 3328, 1856, 1856, 1856, 3328]
    - [51, 5431.0]
  - - [2368, 2368, 1, 3328, 2368, 2368, 2368, 3328]
    - [51, 5361.0]
  - - [2944, 2368, 1, 3328, 2944, 2944, 2944, 3328]
    - [51, 5457.0]
  - - [3584, 2368, 1, 3328, 3584, 3584, 3584, 3328]
    - [51, 5589.0]
  - - [4288, 2368, 1, 3328, 4288, 4288, 4288, 3328]
    - [51, 5575.0]
  - - [5056, 2368, 1, 3328, 5056, 5056, 5056, 3328]
    - [46, 5660.0]
  - - [5888, 2368, 1, 3328, 5888, 5888, 5888, 3328]
    - [51, 5899.0]
  - - [6784, 2368, 1, 3328, 6784, 6784, 6784, 3328]
    - [51, 5978.0]
  - - [256, 2944, 1, 3328, 256, 256, 256, 3328]
    - [48, 4237.0]
  - - [448, 2944, 1, 3328, 448, 448, 448, 3328]
    - [54, 4456.0]
  - - [704, 2944, 1, 3328, 704, 704, 704, 3328]
    - [51, 4876.0]
  - - [1024, 2944, 1, 3328, 1024, 1024, 1024, 3328]
    - [51, 5203.0]
  - - [1408, 2944, 1, 3328, 1408, 1408, 1408, 3328]
    - [54, 5150.0]
  - - [1856, 2944, 1, 3328, 1856, 1856, 1856, 3328]
    - [54, 5413.0]
  - - [2368, 2944, 1, 3328, 2368, 2368, 2368, 3328]
    - [51, 5453.0]
  - - [2944, 2944, 1, 3328, 2944, 2944, 2944, 3328]
    - [51, 5732.0]
  - - [3584, 2944, 1, 3328, 3584, 3584, 3584, 3328]
    - [51, 5766.0]
  - - [4288, 2944, 1, 3328, 4288, 4288, 4288, 3328]
    - [51, 5809.0]
  - - [5056, 2944, 1, 3328, 5056, 5056, 5056, 3328]
    - [51, 5971.0]
  - - [5888, 2944, 1, 3328, 5888, 5888, 5888, 3328]
    - [51, 6166.0]
  - - [6784, 2944, 1, 3328, 6784, 6784, 6784, 3328]
    - [51, 6248.0]
  - - [256, 3584, 1, 3328, 256, 256, 256, 3328]
    - [48, 5121.0]
  - - [448, 3584, 1, 3328, 448, 448, 448, 3328]
    - [54, 4754.0]
  - - [704, 3584, 1, 3328, 704, 704, 704, 3328]
    - [54, 5125.0]
  - - [1024, 3584, 1, 3328, 1024, 1024, 1024, 3328]
    - [51, 5552.0]
  - - [1408, 3584, 1, 3328, 1408, 1408, 1408, 3328]
    - [51, 5664.0]
  - - [1856, 3584, 1, 3328, 1856, 1856, 1856, 3328]
    - [51, 5558.0]
  - - [2368, 3584, 1, 3328, 2368, 2368, 2368, 3328]
    - [51, 5604.0]
  - - [2944, 3584, 1, 3328, 2944, 2944, 2944, 3328]
    - [51, 5790.0]
  - - [3584, 3584, 1, 3328, 3584, 3584, 3584, 3328]
    - [51, 5863.0]
  - - [4288, 3584, 1, 3328, 4288, 4288, 4288, 3328]
    - [51, 5988.0]
  - - [5056, 3584, 1, 3328, 5056, 5056, 5056, 3328]
    - [51, 6128.0]
  - - [5888, 3584, 1, 3328, 5888, 5888, 5888, 3328]
    - [51, 6314.0]
  - - [6784, 3584, 1, 3328, 6784, 6784, 6784, 3328]
    - [51, 6411.0]
  - - [256, 4288, 1, 3328, 256, 256, 256, 3328]
    - [51, 4270.0]
  - - [448, 4288, 1, 3328, 448, 448, 448, 3328]
    - [54, 4573.0]
  - - [704, 4288, 1, 3328, 704, 704, 704, 3328]
    - [54, 4983.0]
  - - [1024, 4288, 1, 3328, 1024, 1024, 1024, 3328]
    - [51, 5348.0]
  - - [1408, 4288, 1, 3328, 1408, 1408, 1408, 3328]
    - [51, 5376.0]
  - - [1856, 4288, 1, 3328, 1856, 1856, 1856, 3328]
    - [51, 5560.0]
  - - [2368, 4288, 1, 3328, 2368, 2368, 2368, 3328]
    - [51, 5571.0]
  - - [2944, 4288, 1, 3328, 2944, 2944, 2944, 3328]
    - [51, 5783.0]
  - - [3584, 4288, 1, 3328, 3584, 3584, 3584, 3328]
    - [51, 5979.0]
  - - [4288, 4288, 1, 3328, 4288, 4288, 4288, 3328]
    - [51, 6108.0]
  - - [5056, 4288, 1, 3328, 5056, 5056, 5056, 3328]
    - [51, 6255.0]
  - - [5888, 4288, 1, 3328, 5888, 5888, 5888, 3328]
    - [51, 6388.0]
  - - [6784, 4288, 1, 3328, 6784, 6784, 6784, 3328]
    - [51, 6620.0]
  - - [256, 5056, 1, 3328, 256, 256, 256, 3328]
    - [51, 4991.0]
  - - [448, 5056, 1, 3328, 448, 448, 448, 3328]
    - [54, 4810.0]
  - - [704, 5056, 1, 3328, 704, 704, 704, 3328]
    - [54, 5152.0]
  - - [1024, 5056, 1, 3328, 1024, 1024, 1024, 3328]
    - [51, 5291.0]
  - - [1408, 5056, 1, 3328, 1408, 1408, 1408, 3328]
    - [51, 5569.0]
  - - [1856, 5056, 1, 3328, 1856, 1856, 1856, 3328]
    - [54, 5531.0]
  - - [2368, 5056, 1, 3328, 2368, 2368, 2368, 3328]
    - [51, 5703.0]
  - - [2944, 5056, 1, 3328, 2944, 2944, 2944, 3328]
    - [51, 5957.0]
  - - [3584, 5056, 1, 3328, 3584, 3584, 3584, 3328]
    - [51, 6139.0]
  - - [4288, 5056, 1, 3328, 4288, 4288, 4288, 3328]
    - [51, 6264.0]
  - - [5056, 5056, 1, 3328, 5056, 5056, 5056, 3328]
    - [51, 6380.0]
  - - [5888, 5056, 1, 3328, 5888, 5888, 5888, 3328]
    - [51, 6650.0]
  - - [6784, 5056, 1, 3328, 6784, 6784, 6784, 3328]
    - [51, 6819.0]
  - - [256, 5888, 1, 3328, 256, 256, 256, 3328]
    - [51, 4472.0]
  - - [448, 5888, 1, 3328, 448, 448, 448, 3328]
    - [54, 4777.0]
  - - [704, 5888, 1, 3328, 704, 704, 704, 3328]
    - [54, 5129.0]
  - - [1024, 5888, 1, 3328, 1024, 1024, 1024, 3328]
    - [51, 5309.0]
  - - [1408, 5888, 1, 3328, 1408, 1408, 1408, 3328]
    - [51, 5486.0]
  - - [1856, 5888, 1, 3328, 1856, 1856, 1856, 3328]
    - [54, 5559.0]
  - - [2368, 5888, 1, 3328, 2368, 2368, 2368, 3328]
    - [54, 5750.0]
  - - [2944, 5888, 1, 3328, 2944, 2944, 2944, 3328]
    - [51, 6147.0]
  - - [3584, 5888, 1, 3328, 3584, 3584, 3584, 3328]
    - [51, 6321.0]
  - - [4288, 5888, 1, 3328, 4288, 4288, 4288, 3328]
    - [46, 6378.0]
  - - [5056, 5888, 1, 3328, 5056, 5056, 5056, 3328]
    - [49, 6597.0]
  - - [5888, 5888, 1, 3328, 5888, 5888, 5888, 3328]
    - [51, 6831.0]
  - - [6784, 5888, 1, 3328, 6784, 6784, 6784, 3328]
    - [51, 6983.0]
  - - [256, 6784, 1, 3328, 256, 256, 256, 3328]
    - [51, 5142.0]
  - - [448, 6784, 1, 3328, 448, 448, 448, 3328]
    - [54, 4773.0]
  - - [704, 6784, 1, 3328, 704, 704, 704, 3328]
    - [54, 5312.0]
  - - [1024, 6784, 1, 3328, 1024, 1024, 1024, 3328]
    - [51, 5362.0]
  - - [1408, 6784, 1, 3328, 1408, 1408, 1408, 3328]
    - [51, 5722.0]
  - - [1856, 6784, 1, 3328, 1856, 1856, 1856, 3328]
    - [54, 5684.0]
  - - [2368, 6784, 1, 3328, 2368, 2368, 2368, 3328]
    - [51, 5935.0]
  - - [2944, 6784, 1, 3328, 2944, 2944, 2944, 3328]
    - [51, 6228.0]
  - - [3584, 6784, 1, 3328, 3584, 3584, 3584, 3328]
    - [51, 6425.0]
  - - [4288, 6784, 1, 3328, 4288, 4288, 4288, 3328]
    - [51, 6536.0]
  - - [5056, 6784, 1, 3328, 5056, 5056, 5056, 3328]
    - [49, 6775.0]
  - - [5888, 6784, 1, 3328, 5888, 5888, 5888, 3328]
    - [46, 6938.0]
  - - [6784, 6784, 1, 3328, 6784, 6784, 6784, 3328]
    - [51, 7190.0]
  - - [1024, 1024, 1, 1024, 1024, 1024, 1024, 1024]
    - [48, 4268.0]
  - - [1024, 700, 1, 512, 1024, 1024, 1024, 512]
    - [29, 3805.0]
  - - [3072, 1500, 1, 128, 3072, 3072, 3072, 128]
    - [47, 3302.0]
  - - [4224, 1500, 1, 176, 4224, 4224, 4224, 176]
    - [48, 4342.0]
  - - [512, 1500, 1, 1536, 512, 512, 512, 1536]
    - [48, 4168.0]
  - - [512, 1500, 1, 2048, 512, 512, 512, 2048]
    - [56, 2866.0]
  - - [512, 1500, 1, 2560, 512, 512, 512, 2560]
    - [48, 4333.0]
  - - [512, 1500, 1, 2816, 512, 512, 512, 2816]
    - [48, 4359.0]
  - - [512, 3000, 1, 1536, 512, 512, 512, 1536]
    - [51, 4383.0]
  - - [1024, 1500, 1, 1536, 1024, 1024, 1024, 1536]
    - [48, 4684.0]
  - - [512, 3000, 1, 2048, 512, 512, 512, 2048]
    - [56, 3052.0]
  - - [1024, 1500, 1, 2048, 1024, 1024, 1024, 2048]
    - [54, 3863.0]
  - - [512, 3000, 1, 2560, 512, 512, 512, 2560]
    - [51, 4495.0]
  - - [1024, 1500, 1, 2560, 1024, 1024, 1024, 2560]
    - [54, 4490.0]
  - - [512, 3000, 1, 2816, 512, 512, 512, 2816]
    - [54, 4620.0]
  - - [1024, 1500, 1, 2816, 1024, 1024, 1024, 2816]
    - [54, 4539.0]
  - - [512, 6000, 1, 1536, 512, 512, 512, 1536]
    - [51, 5053.0]
  - - [1024, 3000, 1, 1536, 1024, 1024, 1024, 1536]
    - [51, 5081.0]
  - - [3072, 1500, 1, 1024, 3072, 3072, 3072, 1024]
    - [51, 5003.0]
  - - [512, 6000, 1, 2048, 512, 512, 512, 2048]
    - [56, 3992.0]
  - - [1024, 3000, 1, 2048, 1024, 1024, 1024, 2048]
    - [56, 4458.0]
  - - [5124, 700, 1, 2048, 5124, 5124, 5124, 2048]
    - [54, 4768.0]
  - - [512, 6000, 1, 2560, 512, 512, 512, 2560]
    - [51, 5225.0]
  - - [1024, 3000, 1, 2560, 1024, 1024, 1024, 2560]
    - [51, 5218.0]
  - - [512, 6000, 1, 2816, 512, 512, 512, 2816]
    - [51, 5256.0]
  - - [1024, 3000, 1, 2816, 1024, 1024, 1024, 2816]
    - [51, 5269.0]
  - - [5124, 700, 1, 2560, 5124, 5124, 5124, 2560]
    - [54, 5062.0]
  - - [1024, 6000, 1, 1536, 1024, 1024, 1024, 1536]
    - [51, 5167.0]
  - - [3072, 3000, 1, 1024, 3072, 3072, 3072, 1024]
    - [51, 5345.0]
  - - [4608, 1500, 1, 1536, 4608, 4608, 4608, 1536]
    - [48, 5559.0]
  - - [1024, 6000, 1, 2048, 1024, 1024, 1024, 2048]
    - [56, 4695.0]
  - - [1024, 6000, 1, 2560, 1024, 1024, 1024, 2560]
    - [51, 5331.0]
  - - [5124, 1500, 1, 2048, 5124, 5124, 5124, 2048]
    - [51, 5117.0]
  - - [1024, 6000, 1, 2816, 1024, 1024, 1024, 2816]
    - [51, 5364.0]
  - - [512, 24000, 1, 1536, 512, 512, 512, 1536]
    - [51, 5436.0]
  - - [3072, 6000, 1, 1024, 3072, 3072, 3072, 1024]
    - [51, 5535.0]
  - - [5124, 1500, 1, 2560, 5124, 5124, 5124, 2560]
    - [51, 5319.0]
  - - [4608, 3000, 1, 1536, 4608, 4608, 4608, 1536]
    - [48, 5707.0]
  - - [1760, 7000, 1, 1760, 1760, 1760, 1760, 1760]
    - [48, 5573.0]
  - - [6144, 1500, 1, 2560, 6144, 6144, 6144, 2560]
    - [51, 5492.0]
  - - [512, 24000, 1, 2048, 512, 512, 512, 2048]
    - [56, 4867.0]
  - - [2048, 7000, 1, 2048, 2048, 2048, 2048, 2048]
    - [51, 5468.0]
  - - [7680, 1500, 1, 2560, 7680, 7680, 7680, 2560]
    - [51, 5608.0]
  - - [512, 24000, 1, 2560, 512, 512, 512, 2560]
    - [51, 5582.0]
  - - [512, 24000, 1, 2816, 512, 512, 512, 2816]
    - [51, 5598.0]
  - - [8448, 1500, 1, 2816, 8448, 8448, 8448, 2816]
    - [51, 5581.0]
  - - [512, 48000, 1, 1536, 512, 512, 512, 1536]
    - [51, 5535.0]
  - - [1024, 24000, 1, 1536, 1024, 1024, 1024, 1536]
    - [51, 5527.0]
  - - [4608, 6000, 1, 1536, 4608, 4608, 4608, 1536]
    - [48, 5852.0]
  - - [2560, 7000, 1, 2560, 2560, 2560, 2560, 2560]
    - [51, 5879.0]
  - - [6144, 3000, 1, 2560, 6144, 6144, 6144, 2560]
    - [51, 5905.0]
  - - [512, 48000, 1, 2048, 512, 512, 512, 2048]
    - [55, 5331.0]
  - - [1024, 24000, 1, 2048, 1024, 1024, 1024, 2048]
    - [51, 5441.0]
  - - [7680, 3000, 1, 2560, 7680, 7680, 7680, 2560]
    - [51, 6133.0]
  - - [512, 48000, 1, 2560, 512, 512, 512, 2560]
    - [51, 6128.0]
  - - [1024, 24000, 1, 2560, 1024, 1024, 1024, 2560]
    - [51, 6101.0]
  - - [512, 48000, 1, 2816, 512, 512, 512, 2816]
    - [51, 6174.0]
  - - [1024, 24000, 1, 2816, 1024, 1024, 1024, 2816]
    - [51, 6164.0]
  - - [8448, 3000, 1, 2816, 8448, 8448, 8448, 2816]
    - [51, 6251.0]
  - - [1024, 48000, 1, 1536, 1024, 1024, 1024, 1536]
    - [51, 6182.0]
  - - [3072, 24000, 1, 1024, 3072, 3072, 3072, 1024]
    - [51, 6289.0]
  - - [5124, 9124, 1, 1760, 5124, 5124, 5124, 1760]
    - [51, 6349.0]
  - - [6144, 6000, 1, 2560, 6144, 6144, 6144, 2560]
    - [51, 6566.0]
  - - [5124, 9124, 1, 2048, 5124, 5124, 5124, 2048]
    - [52, 6239.0]
  - - [1024, 48000, 1, 2048, 1024, 1024, 1024, 2048]
    - [51, 6294.0]
  - - [4096, 7000, 1, 4096, 4096, 4096, 4096, 4096]
    - [50, 6509.0]
  - - [7680, 6000, 1, 2560, 7680, 7680, 7680, 2560]
    - [51, 6820.0]
  - - [5124, 9124, 1, 2560, 5124, 5124, 5124, 2560]
    - [51, 6708.0]
  - - [1024, 48000, 1, 2560, 1024, 1024, 1024, 2560]
    - [51, 6857.0]
  - - [1024, 48000, 1, 2816, 1024, 1024, 1024, 2816]
    - [51, 6975.0]
  - - [8448, 6000, 1, 2816, 8448, 8448, 8448, 2816]
    - [51, 7082.0]
  - - [3072, 48000, 1, 1024, 3072, 3072, 3072, 1024]
    - [51, 7113.0]
  - - [4608, 24000, 1, 1536, 4608, 4608, 4608, 1536]
    - [48, 7362.0]
  - - [5124, 9124, 1, 4096, 5124, 5124, 5124, 4096]
    - [51, 7232.0]
  - - [4608, 48000, 1, 1536, 4608, 4608, 4608, 1536]
    - [51, 8402.0]
  - - [6144, 24000, 1, 2560, 6144, 6144, 6144, 2560]
    - [51, 8578.0]
  - - [7680, 24000, 1, 2560, 7680, 7680, 7680, 2560]
    - [51, 8992.0]
  - - [8448, 24000, 1, 2816, 8448, 8448, 8448, 2816]
    - [51, 9280.0]
  - - [6144, 48000, 1, 2560, 6144, 6144, 6144, 2560]
    - [51, 9478.0]
  - - [7680, 48000, 1, 2560, 7680, 7680, 7680, 2560]
    - [52, 9497.0]
  - - [8448, 48000, 1, 2816, 8448, 8448, 8448, 2816]
    - [51, 9460.0]
  - - [256, 193600, 1, 64, 256, 256, 256, 64]
    - [61, 2021.0]
  - - [64, 193600, 1, 64, 64, 64, 64, 64]
    - [7, 1504.0]
  - - [64, 193600, 1, 256, 64, 64, 64, 256]
    - [63, 2756.0]
  - - [512, 50176, 1, 128, 512, 512, 512, 128]
    - [57, 3938.0]
  - - [128, 50176, 1, 512, 128, 128, 128, 512]
    - [59, 4448.0]
  - - [256, 12544, 1, 1024, 256, 256, 256, 1024]
    - [58, 4698.0]
  - - [1024, 12544, 1, 256, 1024, 1024, 1024, 256]
    - [8, 5516.0]
  - - [2048, 3136, 1, 512, 2048, 2048, 2048, 512]
    - [62, 5694.0]
  - - [512, 3136, 1, 2048, 512, 512, 512, 2048]
    - [60, 4675.0]
  - - [196, 256, 64, 1024, 196, 196, 196, 1024]
    - [65, 2242.0]
  - - [784, 512, 64, 128, 784, 784, 784, 128]
    - [66, 3566.0]
  - - [3136, 512, 1, 2048, 3136, 3136, 3136, 2048]
    - [64, 4776.0]
  - - [196, 1024, 64, 256, 196, 196, 196, 256]
    - [67, 3801.0]
  - - [3136, 2048, 1, 512, 3136, 3136, 3136, 512]
    - [64, 5545.0]
  - - [32, 32, 1, 32, 32, 32, 32, 32]
    - [69, 2.0]
  - - [32, 64, 1, 256, 32, 32, 32, 256]
    - [71, 10.0]
  - - [32, 128, 1, 256, 32, 32, 32, 256]
    - [78, 21.0]
  - - [32, 256, 1, 256, 32, 32, 32, 256]
    - [71, 42.0]
  - - [32, 448, 1, 256, 32, 32, 32, 256]
    - [78, 74.0]
  - - [32, 704, 1, 256, 32, 32, 32, 256]
    - [78, 116.0]
  - - [32, 1024, 1, 256, 32, 32, 32, 256]
    - [78, 162.0]
  - - [32, 1408, 1, 256, 32, 32, 32, 256]
    - [78, 221.0]
  - - [32, 1856, 1, 256, 32, 32, 32, 256]
    - [80, 289.0]
  - - [32, 2368, 1, 256, 32, 32, 32, 256]
    - [82, 334.0]
  - - [32, 2944, 1, 256, 32, 32, 32, 256]
    - [81, 399.0]
  - - [32, 3584, 1, 256, 32, 32, 32, 256]
    - [81, 485.0]
  - - [32, 4288, 1, 256, 32, 32, 32, 256]
    - [82, 547.0]
  - - [32, 5056, 1, 256, 32, 32, 32, 256]
    - [82, 623.0]
  - - [32, 5888, 1, 256, 32, 32, 32, 256]
    - [82, 702.0]
  - - [32, 6784, 1, 256, 32, 32, 32, 256]
    - [82, 743.0]
  - - [32, 64, 1, 1280, 32, 32, 32, 1280]
    - [92, 48.0]
  - - [32, 128, 1, 1280, 32, 32, 32, 1280]
    - [92, 96.0]
  - - [32, 256, 1, 1280, 32, 32, 32, 1280]
    - [92, 191.0]
  - - [32, 448, 1, 1280, 32, 32, 32, 1280]
    - [92, 330.0]
  - - [32, 704, 1, 1280, 32, 32, 32, 1280]
    - [92, 478.0]
  - - [32, 1024, 1, 1280, 32, 32, 32, 1280]
    - [92, 601.0]
  - - [32, 1408, 1, 1280, 32, 32, 32, 1280]
    - [95, 767.0]
  - - [32, 1856, 1, 1280, 32, 32, 32, 1280]
    - [93, 809.0]
  - - [32, 2368, 1, 1280, 32, 32, 32, 1280]
    - [94, 834.0]
  - - [32, 2944, 1, 1280, 32, 32, 32, 1280]
    - [90, 843.0]
  - - [32, 3584, 1, 1280, 32, 32, 32, 1280]
    - [90, 963.0]
  - - [32, 4288, 1, 1280, 32, 32, 32, 1280]
    - [89, 928.0]
  - - [32, 5056, 1, 1280, 32, 32, 32, 1280]
    - [87, 969.0]
  - - [32, 5888, 1, 1280, 32, 32, 32, 1280]
    - [90, 964.0]
  - - [32, 6784, 1, 1280, 32, 32, 32, 1280]
    - [85, 1004.0]
  - - [32, 64, 1, 3328, 32, 32, 32, 3328]
    - [96, 83.0]
  - - [32, 128, 1, 3328, 32, 32, 32, 3328]
    - [96, 164.0]
  - - [32, 256, 1, 3328, 32, 32, 32, 3328]
    - [96, 330.0]
  - - [32, 448, 1, 3328, 32, 32, 32, 3328]
    - [96, 571.0]
  - - [32, 704, 1, 3328, 32, 32, 32, 3328]
    - [96, 678.0]
  - - [32, 1024, 1, 3328, 32, 32, 32, 3328]
    - [97, 944.0]
  - - [32, 1408, 1, 3328, 32, 32, 32, 3328]
    - [97, 1010.0]
  - - [32, 1856, 1, 3328, 32, 32, 32, 3328]
    - [96, 1017.0]
  - - [32, 2368, 1, 3328, 32, 32, 32, 3328]
    - [97, 1043.0]
  - - [32, 2944, 1, 3328, 32, 32, 32, 3328]
    - [97, 1097.0]
  - - [32, 3584, 1, 3328, 32, 32, 32, 3328]
    - [95, 1156.0]
  - - [32, 4288, 1, 3328, 32, 32, 32, 3328]
    - [95, 1156.0]
  - - [32, 5056, 1, 3328, 32, 32, 32, 3328]
    - [97, 1148.0]
  - - [32, 5888, 1, 3328, 32, 32, 32, 3328]
    - [90, 1146.0]
  - - [32, 6784, 1, 3328, 32, 32, 32, 3328]
    - [95, 1145.0]
  - - [64, 32, 1, 256, 64, 64, 64, 256]
    - [71, 10.0]
  - - [128, 32, 1, 256, 128, 128, 128, 256]
    - [78, 21.0]
  - - [256, 32, 1, 256, 256, 256, 256, 256]
    - [78, 42.0]
  - - [448, 32, 1, 256, 448, 448, 448, 256]
    - [78, 73.0]
  - - [704, 32, 1, 256, 704, 704, 704, 256]
    - [78, 120.0]
  - - [1024, 32, 1, 256, 1024, 1024, 1024, 256]
    - [78, 169.0]
  - - [1408, 32, 1, 256, 1408, 1408, 1408, 256]
    - [78, 230.0]
  - - [1856, 32, 1, 256, 1856, 1856, 1856, 256]
    - [78, 301.0]
  - - [2368, 32, 1, 256, 2368, 2368, 2368, 256]
    - [78, 389.0]
  - - [2944, 32, 1, 256, 2944, 2944, 2944, 256]
    - [78, 484.0]
  - - [3584, 32, 1, 256, 3584, 3584, 3584, 256]
    - [78, 583.0]
  - - [4288, 32, 1, 256, 4288, 4288, 4288, 256]
    - [78, 594.0]
  - - [5056, 32, 1, 256, 5056, 5056, 5056, 256]
    - [78, 703.0]
  - - [5888, 32, 1, 256, 5888, 5888, 5888, 256]
    - [78, 818.0]
  - - [6784, 32, 1, 256, 6784, 6784, 6784, 256]
    - [78, 942.0]
  - - [64, 32, 1, 1280, 64, 64, 64, 1280]
    - [92, 48.0]
  - - [128, 32, 1, 1280, 128, 128, 128, 1280]
    - [91, 95.0]
  - - [256, 32, 1, 1280, 256, 256, 256, 1280]
    - [91, 188.0]
  - - [448, 32, 1, 1280, 448, 448, 448, 1280]
    - [92, 333.0]
  - - [704, 32, 1, 1280, 704, 704, 704, 1280]
    - [91, 518.0]
  - - [1024, 32, 1, 1280, 1024, 1024, 1024, 1280]
    - [92, 624.0]
  - - [1408, 32, 1, 1280, 1408, 1408, 1408, 1280]
    - [92, 853.0]
  - - [1856, 32, 1, 1280, 1856, 1856, 1856, 1280]
    - [92, 882.0]
  - - [2368, 32, 1, 1280, 2368, 2368, 2368, 1280]
    - [88, 962.0]
  - - [2944, 32, 1, 1280, 2944, 2944, 2944, 1280]
    - [88, 929.0]
  - - [3584, 32, 1, 1280, 3584, 3584, 3584, 1280]
    - [90, 1103.0]
  - - [4288, 32, 1, 1280, 4288, 4288, 4288, 1280]
    - [88, 1060.0]
  - - [5056, 32, 1, 1280, 5056, 5056, 5056, 1280]
    - [85, 1102.0]
  - - [5888, 32, 1, 1280, 5888, 5888, 5888, 1280]
    - [88, 1127.0]
  - - [6784, 32, 1, 1280, 6784, 6784, 6784, 1280]
    - [85, 1167.0]
  - - [64, 32, 1, 3328, 64, 64, 64, 3328]
    - [96, 84.0]
  - - [128, 32, 1, 3328, 128, 128, 128, 3328]
    - [96, 166.0]
  - - [256, 32, 1, 3328, 256, 256, 256, 3328]
    - [96, 335.0]
  - - [448, 32, 1, 3328, 448, 448, 448, 3328]
    - [96, 580.0]
  - - [704, 32, 1, 3328, 704, 704, 704, 3328]
    - [92, 704.0]
  - - [1024, 32, 1, 3328, 1024, 1024, 1024, 3328]
    - [96, 993.0]
  - - [1408, 32, 1, 3328, 1408, 1408, 1408, 3328]
    - [97, 1059.0]
  - - [1856, 32, 1, 3328, 1856, 1856, 1856, 3328]
    - [96, 1104.0]
  - - [2368, 32, 1, 3328, 2368, 2368, 2368, 3328]
    - [90, 1114.0]
  - - [2944, 32, 1, 3328, 2944, 2944, 2944, 3328]
    - [96, 1158.0]
  - - [3584, 32, 1, 3328, 3584, 3584, 3584, 3328]
    - [90, 1277.0]
  - - [4288, 32, 1, 3328, 4288, 4288, 4288, 3328]
    - [92, 1240.0]
  - - [5056, 32, 1, 3328, 5056, 5056, 5056, 3328]
    - [86, 1235.0]
  - - [5888, 32, 1, 3328, 5888, 5888, 5888, 3328]
    - [90, 1272.0]
  - - [6784, 32, 1, 3328, 6784, 6784, 6784, 3328]
    - [85, 1277.0]
  - - [64, 64, 1, 32, 64, 64, 64, 32]
    - [69, 6.0]
  - - [128, 64, 1, 32, 128, 128, 128, 32]
    - [71, 12.0]
  - - [256, 64, 1, 32, 256, 256, 256, 32]
    - [69, 26.0]
  - - [448, 64, 1, 32, 448, 448, 448, 32]
    - [69, 41.0]
  - - [704, 64, 1, 32, 704, 704, 704, 32]
    - [71, 65.0]
  - - [1024, 64, 1, 32, 1024, 1024, 1024, 32]
    - [75, 93.0]
  - - [1408, 64, 1, 32, 1408, 1408, 1408, 32]
    - [71, 132.0]
  - - [1856, 64, 1, 32, 1856, 1856, 1856, 32]
    - [71, 173.0]
  - - [2368, 64, 1, 32, 2368, 2368, 2368, 32]
    - [69, 215.0]
  - - [2944, 64, 1, 32, 2944, 2944, 2944, 32]
    - [71, 270.0]
  - - [3584, 64, 1, 32, 3584, 3584, 3584, 32]
    - [71, 330.0]
  - - [4288, 64, 1, 32, 4288, 4288, 4288, 32]
    - [71, 399.0]
  - - [5056, 64, 1, 32, 5056, 5056, 5056, 32]
    - [71, 463.0]
  - - [5888, 64, 1, 32, 5888, 5888, 5888, 32]
    - [71, 550.0]
  - - [6784, 64, 1, 32, 6784, 6784, 6784, 32]
    - [71, 625.0]
  - - [64, 128, 1, 32, 64, 64, 64, 32]
    - [69, 11.0]
  - - [128, 128, 1, 32, 128, 128, 128, 32]
    - [73, 25.0]
  - - [256, 128, 1, 32, 256, 256, 256, 32]
    - [73, 54.0]
  - - [448, 128, 1, 32, 448, 448, 448, 32]
    - [71, 88.0]
  - - [704, 128, 1, 32, 704, 704, 704, 32]
    - [71, 133.0]
  - - [1024, 128, 1, 32, 1024, 1024, 1024, 32]
    - [71, 191.0]
  - - [1408, 128, 1, 32, 1408, 1408, 1408, 32]
    - [71, 262.0]
  - - [1856, 128, 1, 32, 1856, 1856, 1856, 32]
    - [71, 343.0]
  - - [2368, 128, 1, 32, 2368, 2368, 2368, 32]
    - [71, 435.0]
  - - [2944, 128, 1, 32, 2944, 2944, 2944, 32]
    - [71, 544.0]
  - - [3584, 128, 1, 32, 3584, 3584, 3584, 32]
    - [71, 656.0]
  - - [4288, 128, 1, 32, 4288, 4288, 4288, 32]
    - [69, 777.0]
  - - [5056, 128, 1, 32, 5056, 5056, 5056, 32]
    - [71, 866.0]
  - - [5888, 128, 1, 32, 5888, 5888, 5888, 32]
    - [71, 960.0]
  - - [6784, 128, 1, 32, 6784, 6784, 6784, 32]
    - [75, 1039.0]
  - - [64, 256, 1, 32, 64, 64, 64, 32]
    - [69, 23.0]
  - - [128, 256, 1, 32, 128, 128, 128, 32]
    - [71, 57.0]
  - - [256, 256, 1, 32, 256, 256, 256, 32]
    - [71, 94.0]
  - - [448, 256, 1, 32, 448, 448, 448, 32]
    - [69, 164.0]
  - - [704, 256, 1, 32, 704, 704, 704, 32]
    - [71, 264.0]
  - - [1024, 256, 1, 32, 1024, 1024, 1024, 32]
    - [73, 375.0]
  - - [1408, 256, 1, 32, 1408, 1408, 1408, 32]
    - [71, 524.0]
  - - [1856, 256, 1, 32, 1856, 1856, 1856, 32]
    - [71, 689.0]
  - - [2368, 256, 1, 32, 2368, 2368, 2368, 32]
    - [69, 818.0]
  - - [2944, 256, 1, 32, 2944, 2944, 2944, 32]
    - [73, 963.0]
  - - [3584, 256, 1, 32, 3584, 3584, 3584, 32]
    - [69, 1027.0]
  - - [4288, 256, 1, 32, 4288, 4288, 4288, 32]
    - [69, 862.0]
  - - [5056, 256, 1, 32, 5056, 5056, 5056, 32]
    - [79, 876.0]
  - - [5888, 256, 1, 32, 5888, 5888, 5888, 32]
    - [72, 871.0]
  - - [6784, 256, 1, 32, 6784, 6784, 6784, 32]
    - [68, 914.0]
  - - [64, 448, 1, 32, 64, 64, 64, 32]
    - [71, 41.0]
  - - [128, 448, 1, 32, 128, 128, 128, 32]
    - [81, 107.0]
  - - [256, 448, 1, 32, 256, 256, 256, 32]
    - [77, 165.0]
  - - [448, 448, 1, 32, 448, 448, 448, 32]
    - [69, 290.0]
  - - [704, 448, 1, 32, 704, 704, 704, 32]
    - [69, 454.0]
  - - [1024, 448, 1, 32, 1024, 1024, 1024, 32]
    - [71, 648.0]
  - - [1408, 448, 1, 32, 1408, 1408, 1408, 32]
    - [71, 876.0]
  - - [1856, 448, 1, 32, 1856, 1856, 1856, 32]
    - [73, 992.0]
  - - [2368, 448, 1, 32, 2368, 2368, 2368, 32]
    - [71, 880.0]
  - - [2944, 448, 1, 32, 2944, 2944, 2944, 32]
    - [72, 861.0]
  - - [3584, 448, 1, 32, 3584, 3584, 3584, 32]
    - [76, 862.0]
  - - [4288, 448, 1, 32, 4288, 4288, 4288, 32]
    - [71, 858.0]
  - - [5056, 448, 1, 32, 5056, 5056, 5056, 32]
    - [71, 896.0]
  - - [5888, 448, 1, 32, 5888, 5888, 5888, 32]
    - [71, 857.0]
  - - [6784, 448, 1, 32, 6784, 6784, 6784, 32]
    - [71, 878.0]
  - - [64, 704, 1, 32, 64, 64, 64, 32]
    - [69, 66.0]
  - - [128, 704, 1, 32, 128, 128, 128, 32]
    - [71, 128.0]
  - - [256, 704, 1, 32, 256, 256, 256, 32]
    - [71, 261.0]
  - - [448, 704, 1, 32, 448, 448, 448, 32]
    - [73, 460.0]
  - - [704, 704, 1, 32, 704, 704, 704, 32]
    - [71, 702.0]
  - - [1024, 704, 1, 32, 1024, 1024, 1024, 32]
    - [71, 927.0]
  - - [1408, 704, 1, 32, 1408, 1408, 1408, 32]
    - [71, 846.0]
  - - [1856, 704, 1, 32, 1856, 1856, 1856, 32]
    - [73, 890.0]
  - - [2368, 704, 1, 32, 2368, 2368, 2368, 32]
    - [71, 917.0]
  - - [2944, 704, 1, 32, 2944, 2944, 2944, 32]
    - [77, 897.0]
  - - [3584, 704, 1, 32, 3584, 3584, 3584, 32]
    - [69, 813.0]
  - - [4288, 704, 1, 32, 4288, 4288, 4288, 32]
    - [71, 890.0]
  - - [5056, 704, 1, 32, 5056, 5056, 5056, 32]
    - [71, 884.0]
  - - [5888, 704, 1, 32, 5888, 5888, 5888, 32]
    - [71, 863.0]
  - - [6784, 704, 1, 32, 6784, 6784, 6784, 32]
    - [69, 876.0]
  - - [64, 1024, 1, 32, 64, 64, 64, 32]
    - [69, 94.0]
  - - [128, 1024, 1, 32, 128, 128, 128, 32]
    - [71, 190.0]
  - - [256, 1024, 1, 32, 256, 256, 256, 32]
    - [73, 379.0]
  - - [448, 1024, 1, 32, 448, 448, 448, 32]
    - [69, 658.0]
  - - [704, 1024, 1, 32, 704, 704, 704, 32]
    - [71, 941.0]
  - - [1024, 1024, 1, 32, 1024, 1024, 1024, 32]
    - [74, 729.0]
  - - [1408, 1024, 1, 32, 1408, 1408, 1408, 32]
    - [71, 871.0]
  - - [1856, 1024, 1, 32, 1856, 1856, 1856, 32]
    - [71, 916.0]
  - - [2368, 1024, 1, 32, 2368, 2368, 2368, 32]
    - [71, 941.0]
  - - [2944, 1024, 1, 32, 2944, 2944, 2944, 32]
    - [79, 913.0]
  - - [3584, 1024, 1, 32, 3584, 3584, 3584, 32]
    - [79, 848.0]
  - - [4288, 1024, 1, 32, 4288, 4288, 4288, 32]
    - [79, 903.0]
  - - [5056, 1024, 1, 32, 5056, 5056, 5056, 32]
    - [71, 901.0]
  - - [5888, 1024, 1, 32, 5888, 5888, 5888, 32]
    - [75, 891.0]
  - - [6784, 1024, 1, 32, 6784, 6784, 6784, 32]
    - [69, 881.0]
  - - [64, 1408, 1, 32, 64, 64, 64, 32]
    - [71, 130.0]
  - - [128, 1408, 1, 32, 128, 128, 128, 32]
    - [71, 260.0]
  - - [256, 1408, 1, 32, 256, 256, 256, 32]
    - [73, 512.0]
  - - [448, 1408, 1, 32, 448, 448, 448, 32]
    - [71, 828.0]
  - - [704, 1408, 1, 32, 704, 704, 704, 32]
    - [71, 830.0]
  - - [1024, 1408, 1, 32, 1024, 1024, 1024, 32]
    - [72, 814.0]
  - - [1408, 1408, 1, 32, 1408, 1408, 1408, 32]
    - [69, 938.0]
  - - [1856, 1408, 1, 32, 1856, 1856, 1856, 32]
    - [71, 967.0]
  - - [2368, 1408, 1, 32, 2368, 2368, 2368, 32]
    - [71, 958.0]
  - - [2944, 1408, 1, 32, 2944, 2944, 2944, 32]
    - [75, 939.0]
  - - [3584, 1408, 1, 32, 3584, 3584, 3584, 32]
    - [75, 873.0]
  - - [4288, 1408, 1, 32, 4288, 4288, 4288, 32]
    - [71, 919.0]
  - - [5056, 1408, 1, 32, 5056, 5056, 5056, 32]
    - [71, 916.0]
  - - [5888, 1408, 1, 32, 5888, 5888, 5888, 32]
    - [71, 884.0]
  - - [6784, 1408, 1, 32, 6784, 6784, 6784, 32]
    - [71, 887.0]
  - - [64, 1856, 1, 32, 64, 64, 64, 32]
    - [71, 168.0]
  - - [128, 1856, 1, 32, 128, 128, 128, 32]
    - [73, 339.0]
  - - [256, 1856, 1, 32, 256, 256, 256, 32]
    - [73, 656.0]
  - - [448, 1856, 1, 32, 448, 448, 448, 32]
    - [69, 1001.0]
  - - [704, 1856, 1, 32, 704, 704, 704, 32]
    - [69, 883.0]
  - - [1024, 1856, 1, 32, 1024, 1024, 1024, 32]
    - [79, 777.0]
  - - [1408, 1856, 1, 32, 1408, 1408, 1408, 32]
    - [75, 971.0]
  - - [1856, 1856, 1, 32, 1856, 1856, 1856, 32]
    - [75, 998.0]
  - - [2368, 1856, 1, 32, 2368, 2368, 2368, 32]
    - [71, 971.0]
  - - [2944, 1856, 1, 32, 2944, 2944, 2944, 32]
    - [75, 939.0]
  - - [3584, 1856, 1, 32, 3584, 3584, 3584, 32]
    - [75, 881.0]
  - - [4288, 1856, 1, 32, 4288, 4288, 4288, 32]
    - [71, 926.0]
  - - [5056, 1856, 1, 32, 5056, 5056, 5056, 32]
    - [75, 916.0]
  - - [5888, 1856, 1, 32, 5888, 5888, 5888, 32]
    - [71, 870.0]
  - - [6784, 1856, 1, 32, 6784, 6784, 6784, 32]
    - [69, 889.0]
  - - [64, 2368, 1, 32, 64, 64, 64, 32]
    - [71, 215.0]
  - - [128, 2368, 1, 32, 128, 128, 128, 32]
    - [73, 429.0]
  - - [256, 2368, 1, 32, 256, 256, 256, 32]
    - [69, 794.0]
  - - [448, 2368, 1, 32, 448, 448, 448, 32]
    - [75, 861.0]
  - - [704, 2368, 1, 32, 704, 704, 704, 32]
    - [75, 939.0]
  - - [1024, 2368, 1, 32, 1024, 1024, 1024, 32]
    - [71, 827.0]
  - - [1408, 2368, 1, 32, 1408, 1408, 1408, 32]
    - [71, 1002.0]
  - - [1856, 2368, 1, 32, 1856, 1856, 1856, 32]
    - [71, 1008.0]
  - - [2368, 2368, 1, 32, 2368, 2368, 2368, 32]
    - [71, 989.0]
  - - [2944, 2368, 1, 32, 2944, 2944, 2944, 32]
    - [75, 947.0]
  - - [3584, 2368, 1, 32, 3584, 3584, 3584, 32]
    - [75, 891.0]
  - - [4288, 2368, 1, 32, 4288, 4288, 4288, 32]
    - [71, 927.0]
  - - [5056, 2368, 1, 32, 5056, 5056, 5056, 32]
    - [71, 923.0]
  - - [5888, 2368, 1, 32, 5888, 5888, 5888, 32]
    - [69, 876.0]
  - - [6784, 2368, 1, 32, 6784, 6784, 6784, 32]
    - [73, 893.0]
  - - [64, 2944, 1, 32, 64, 64, 64, 32]
    - [73, 262.0]
  - - [128, 2944, 1, 32, 128, 128, 128, 32]
    - [69, 523.0]
  - - [256, 2944, 1, 32, 256, 256, 256, 32]
    - [75, 897.0]
  - - [448, 2944, 1, 32, 448, 448, 448, 32]
    - [77, 902.0]
  - - [704, 2944, 1, 32, 704, 704, 704, 32]
    - [71, 969.0]
  - - [1024, 2944, 1, 32, 1024, 1024, 1024, 32]
    - [83, 876.0]
  - - [1408, 2944, 1, 32, 1408, 1408, 1408, 32]
    - [71, 1010.0]
  - - [1856, 2944, 1, 32, 1856, 1856, 1856, 32]
    - [71, 1013.0]
  - - [2368, 2944, 1, 32, 2368, 2368, 2368, 32]
    - [71, 997.0]
  - - [2944, 2944, 1, 32, 2944, 2944, 2944, 32]
    - [69, 949.0]
  - - [3584, 2944, 1, 32, 3584, 3584, 3584, 32]
    - [71, 903.0]
  - - [4288, 2944, 1, 32, 4288, 4288, 4288, 32]
    - [71, 931.0]
  - - [5056, 2944, 1, 32, 5056, 5056, 5056, 32]
    - [73, 928.0]
  - - [5888, 2944, 1, 32, 5888, 5888, 5888, 32]
    - [75, 874.0]
  - - [6784, 2944, 1, 32, 6784, 6784, 6784, 32]
    - [69, 889.0]
  - - [64, 3584, 1, 32, 64, 64, 64, 32]
    - [71, 313.0]
  - - [128, 3584, 1, 32, 128, 128, 128, 32]
    - [75, 619.0]
  - - [256, 3584, 1, 32, 256, 256, 256, 32]
    - [73, 967.0]
  - - [448, 3584, 1, 32, 448, 448, 448, 32]
    - [71, 924.0]
  - - [704, 3584, 1, 32, 704, 704, 704, 32]
    - [71, 1005.0]
  - - [1024, 3584, 1, 32, 1024, 1024, 1024, 32]
    - [80, 900.0]
  - - [1408, 3584, 1, 32, 1408, 1408, 1408, 32]
    - [71, 1026.0]
  - - [1856, 3584, 1, 32, 1856, 1856, 1856, 32]
    - [75, 1025.0]
  - - [2368, 3584, 1, 32, 2368, 2368, 2368, 32]
    - [71, 1001.0]
  - - [2944, 3584, 1, 32, 2944, 2944, 2944, 32]
    - [73, 957.0]
  - - [3584, 3584, 1, 32, 3584, 3584, 3584, 32]
    - [75, 896.0]
  - - [4288, 3584, 1, 32, 4288, 4288, 4288, 32]
    - [73, 936.0]
  - - [5056, 3584, 1, 32, 5056, 5056, 5056, 32]
    - [69, 929.0]
  - - [5888, 3584, 1, 32, 5888, 5888, 5888, 32]
    - [69, 884.0]
  - - [6784, 3584, 1, 32, 6784, 6784, 6784, 32]
    - [69, 888.0]
  - - [64, 4288, 1, 32, 64, 64, 64, 32]
    - [69, 370.0]
  - - [128, 4288, 1, 32, 128, 128, 128, 32]
    - [69, 725.0]
  - - [256, 4288, 1, 32, 256, 256, 256, 32]
    - [69, 798.0]
  - - [448, 4288, 1, 32, 448, 448, 448, 32]
    - [71, 925.0]
  - - [704, 4288, 1, 32, 704, 704, 704, 32]
    - [71, 1024.0]
  - - [1024, 4288, 1, 32, 1024, 1024, 1024, 32]
    - [75, 928.0]
  - - [1408, 4288, 1, 32, 1408, 1408, 1408, 32]
    - [73, 1046.0]
  - - [1856, 4288, 1, 32, 1856, 1856, 1856, 32]
    - [71, 1026.0]
  - - [2368, 4288, 1, 32, 2368, 2368, 2368, 32]
    - [71, 1013.0]
  - - [2944, 4288, 1, 32, 2944, 2944, 2944, 32]
    - [71, 955.0]
  - - [3584, 4288, 1, 32, 3584, 3584, 3584, 32]
    - [77, 898.0]
  - - [4288, 4288, 1, 32, 4288, 4288, 4288, 32]
    - [73, 937.0]
  - - [5056, 4288, 1, 32, 5056, 5056, 5056, 32]
    - [69, 929.0]
  - - [5888, 4288, 1, 32, 5888, 5888, 5888, 32]
    - [71, 872.0]
  - - [6784, 4288, 1, 32, 6784, 6784, 6784, 32]
    - [73, 883.0]
  - - [64, 5056, 1, 32, 64, 64, 64, 32]
    - [73, 430.0]
  - - [128, 5056, 1, 32, 128, 128, 128, 32]
    - [69, 825.0]
  - - [256, 5056, 1, 32, 256, 256, 256, 32]
    - [70, 791.0]
  - - [448, 5056, 1, 32, 448, 448, 448, 32]
    - [75, 985.0]
  - - [704, 5056, 1, 32, 704, 704, 704, 32]
    - [79, 1028.0]
  - - [1024, 5056, 1, 32, 1024, 1024, 1024, 32]
    - [80, 954.0]
  - - [1408, 5056, 1, 32, 1408, 1408, 1408, 32]
    - [75, 1038.0]
  - - [1856, 5056, 1, 32, 1856, 1856, 1856, 32]
    - [71, 1039.0]
  - - [2368, 5056, 1, 32, 2368, 2368, 2368, 32]
    - [75, 1014.0]
  - - [2944, 5056, 1, 32, 2944, 2944, 2944, 32]
    - [69, 963.0]
  - - [3584, 5056, 1, 32, 3584, 3584, 3584, 32]
    - [71, 907.0]
  - - [4288, 5056, 1, 32, 4288, 4288, 4288, 32]
    - [73, 942.0]
  - - [5056, 5056, 1, 32, 5056, 5056, 5056, 32]
    - [69, 935.0]
  - - [5888, 5056, 1, 32, 5888, 5888, 5888, 32]
    - [69, 873.0]
  - - [6784, 5056, 1, 32, 6784, 6784, 6784, 32]
    - [73, 887.0]
  - - [64, 5888, 1, 32, 64, 64, 64, 32]
    - [69, 498.0]
  - - [128, 5888, 1, 32, 128, 128, 128, 32]
    - [73, 848.0]
  - - [256, 5888, 1, 32, 256, 256, 256, 32]
    - [71, 823.0]
  - - [448, 5888, 1, 32, 448, 448, 448, 32]
    - [71, 974.0]
  - - [704, 5888, 1, 32, 704, 704, 704, 32]
    - [75, 1041.0]
  - - [1024, 5888, 1, 32, 1024, 1024, 1024, 32]
    - [71, 959.0]
  - - [1408, 5888, 1, 32, 1408, 1408, 1408, 32]
    - [73, 1044.0]
  - - [1856, 5888, 1, 32, 1856, 1856, 1856, 32]
    - [75, 1037.0]
  - - [2368, 5888, 1, 32, 2368, 2368, 2368, 32]
    - [75, 1018.0]
  - - [2944, 5888, 1, 32, 2944, 2944, 2944, 32]
    - [73, 962.0]
  - - [3584, 5888, 1, 32, 3584, 3584, 3584, 32]
    - [71, 914.0]
  - - [4288, 5888, 1, 32, 4288, 4288, 4288, 32]
    - [69, 943.0]
  - - [5056, 5888, 1, 32, 5056, 5056, 5056, 32]
    - [69, 940.0]
  - - [5888, 5888, 1, 32, 5888, 5888, 5888, 32]
    - [71, 879.0]
  - - [6784, 5888, 1, 32, 6784, 6784, 6784, 32]
    - [73, 888.0]
  - - [64, 6784, 1, 32, 64, 64, 64, 32]
    - [77, 547.0]
  - - [128, 6784, 1, 32, 128, 128, 128, 32]
    - [69, 874.0]
  - - [256, 6784, 1, 32, 256, 256, 256, 32]
    - [69, 855.0]
  - - [448, 6784, 1, 32, 448, 448, 448, 32]
    - [77, 1000.0]
  - - [704, 6784, 1, 32, 704, 704, 704, 32]
    - [71, 1059.0]
  - - [1024, 6784, 1, 32, 1024, 1024, 1024, 32]
    - [73, 970.0]
  - - [1408, 6784, 1, 32, 1408, 1408, 1408, 32]
    - [73, 1046.0]
  - - [1856, 6784, 1, 32, 1856, 1856, 1856, 32]
    - [69, 1042.0]
  - - [2368, 6784, 1, 32, 2368, 2368, 2368, 32]
    - [71, 1019.0]
  - - [2944, 6784, 1, 32, 2944, 2944, 2944, 32]
    - [69, 963.0]
  - - [3584, 6784, 1, 32, 3584, 3584, 3584, 32]
    - [71, 916.0]
  - - [4288, 6784, 1, 32, 4288, 4288, 4288, 32]
    - [73, 945.0]
  - - [5056, 6784, 1, 32, 5056, 5056, 5056, 32]
    - [73, 936.0]
  - - [5888, 6784, 1, 32, 5888, 5888, 5888, 32]
    - [69, 874.0]
  - - [6784, 6784, 1, 32, 6784, 6784, 6784, 32]
    - [69, 885.0]
  - - [32, 32, 1, 256, 32, 32, 32, 256]
    - [84, 7.0]
  - - [32, 32, 1, 1280, 32, 32, 32, 1280]
    - [91, 24.0]
  - - [32, 32, 1, 3328, 32, 32, 32, 3328]
    - [96, 42.0]
  - - [32, 64, 1, 32, 32, 32, 32, 32]
    - [69, 3.0]
  - - [32, 128, 1, 32, 32, 32, 32, 32]
    - [69, 7.0]
  - - [32, 256, 1, 32, 32, 32, 32, 32]
    - [75, 17.0]
  - - [32, 448, 1, 32, 32, 32, 32, 32]
    - [71, 31.0]
  - - [32, 704, 1, 32, 32, 32, 32, 32]
    - [69, 38.0]
  - - [32, 1024, 1, 32, 32, 32, 32, 32]
    - [69, 55.0]
  - - [32, 1408, 1, 32, 32, 32, 32, 32]
    - [71, 77.0]
  - - [32, 1856, 1, 32, 32, 32, 32, 32]
    - [71, 100.0]
  - - [32, 2368, 1, 32, 32, 32, 32, 32]
    - [73, 126.0]
  - - [32, 2944, 1, 32, 32, 32, 32, 32]
    - [71, 152.0]
  - - [32, 3584, 1, 32, 32, 32, 32, 32]
    - [73, 186.0]
  - - [32, 4288, 1, 32, 32, 32, 32, 32]
    - [69, 220.0]
  - - [32, 5056, 1, 32, 32, 32, 32, 32]
    - [69, 254.0]
  - - [32, 5888, 1, 32, 32, 32, 32, 32]
    - [69, 291.0]
  - - [32, 6784, 1, 32, 32, 32, 32, 32]
    - [73, 328.0]
  - - [64, 32, 1, 32, 64, 64, 64, 32]
    - [84, 6.0]
  - - [128, 32, 1, 32, 128, 128, 128, 32]
    - [69, 7.0]
  - - [256, 32, 1, 32, 256, 256, 256, 32]
    - [71, 14.0]
  - - [448, 32, 1, 32, 448, 448, 448, 32]
    - [69, 24.0]
  - - [704, 32, 1, 32, 704, 704, 704, 32]
    - [79, 43.0]
  - - [1024, 32, 1, 32, 1024, 1024, 1024, 32]
    - [73, 54.0]
  - - [1408, 32, 1, 32, 1408, 1408, 1408, 32]
    - [73, 76.0]
  - - [1856, 32, 1, 32, 1856, 1856, 1856, 32]
    - [69, 100.0]
  - - [2368, 32, 1, 32, 2368, 2368, 2368, 32]
    - [71, 128.0]
  - - [2944, 32, 1, 32, 2944, 2944, 2944, 32]
    - [73, 158.0]
  - - [3584, 32, 1, 32, 3584, 3584, 3584, 32]
    - [71, 194.0]
  - - [4288, 32, 1, 32, 4288, 4288, 4288, 32]
    - [69, 233.0]
  - - [5056, 32, 1, 32, 5056, 5056, 5056, 32]
    - [71, 269.0]
  - - [5888, 32, 1, 32, 5888, 5888, 5888, 32]
    - [71, 314.0]
  - - [6784, 32, 1, 32, 6784, 6784, 6784, 32]
    - [71, 365.0]
  - - [1, 1, 1, 1, 1, 1, 1, 1]
    - [103, 0.00011156356147887394]
  - - [1, 64, 1, 256, 1, 1, 1, 256]
    - [102, 0.32]
  - - [1, 128, 1, 256, 1, 1, 1, 256]
    - [100, 1.0]
  - - [1, 256, 1, 256, 1, 1, 1, 256]
    - [99, 1.0]
  - - [1, 448, 1, 256, 1, 1, 1, 256]
    - [100, 2.0]
  - - [1, 704, 1, 256, 1, 1, 1, 256]
    - [100, 3.0]
  - - [1, 1024, 1, 256, 1, 1, 1, 256]
    - [102, 5.0]
  - - [1, 1408, 1, 256, 1, 1, 1, 256]
    - [102, 7.0]
  - - [1, 1856, 1, 256, 1, 1, 1, 256]
    - [102, 9.0]
  - - [1, 2368, 1, 256, 1, 1, 1, 256]
    - [102, 11.0]
  - - [1, 2944, 1, 256, 1, 1, 1, 256]
    - [102, 14.0]
  - - [1, 3584, 1, 256, 1, 1, 1, 256]
    - [102, 16.0]
  - - [1, 4288, 1, 256, 1, 1, 1, 256]
    - [107, 17.0]
  - - [1, 5056, 1, 256, 1, 1, 1, 256]
    - [107, 19.0]
  - - [1, 5888, 1, 256, 1, 1, 1, 256]
    - [102, 21.0]
  - - [1, 6784, 1, 256, 1, 1, 1, 256]
    - [107, 24.0]
  - - [1, 64, 1, 1280, 1, 1, 1, 1280]
    - [113, 1.0]
  - - [1, 128, 1, 1280, 1, 1, 1, 1280]
    - [117, 3.0]
  - - [1, 256, 1, 1280, 1, 1, 1, 1280]
    - [117, 6.0]
  - - [1, 448, 1, 1280, 1, 1, 1, 1280]
    - [117, 10.0]
  - - [1, 704, 1, 1280, 1, 1, 1, 1280]
    - [117, 15.0]
  - - [1, 1024, 1, 1280, 1, 1, 1, 1280]
    - [118, 19.0]
  - - [1, 1408, 1, 1280, 1, 1, 1, 1280]
    - [118, 25.0]
  - - [1, 1856, 1, 1280, 1, 1, 1, 1280]
    - [117, 26.0]
  - - [1, 2368, 1, 1280, 1, 1, 1, 1280]
    - [118, 28.0]
  - - [1, 2944, 1, 1280, 1, 1, 1, 1280]
    - [116, 27.0]
  - - [1, 3584, 1, 1280, 1, 1, 1, 1280]
    - [116, 31.0]
  - - [1, 4288, 1, 1280, 1, 1, 1, 1280]
    - [117, 33.0]
  - - [1, 5056, 1, 1280, 1, 1, 1, 1280]
    - [118, 33.0]
  - - [1, 5888, 1, 1280, 1, 1, 1, 1280]
    - [115, 33.0]
  - - [1, 6784, 1, 1280, 1, 1, 1, 1280]
    - [118, 36.0]
  - - [1, 64, 1, 3328, 1, 1, 1, 3328]
    - [117, 2.0]
  - - [1, 128, 1, 3328, 1, 1, 1, 3328]
    - [119, 5.0]
  - - [1, 256, 1, 3328, 1, 1, 1, 3328]
    - [119, 10.0]
  - - [1, 448, 1, 3328, 1, 1, 1, 3328]
    - [119, 17.0]
  - - [1, 704, 1, 3328, 1, 1, 1, 3328]
    - [117, 20.0]
  - - [1, 1024, 1, 3328, 1, 1, 1, 3328]
    - [120, 29.0]
  - - [1, 1408, 1, 3328, 1, 1, 1, 3328]
    - [120, 31.0]
  - - [1, 1856, 1, 3328, 1, 1, 1, 3328]
    - [120, 33.0]
  - - [1, 2368, 1, 3328, 1, 1, 1, 3328]
    - [120, 33.0]
  - - [1, 2944, 1, 3328, 1, 1, 1, 3328]
    - [120, 36.0]
  - - [1, 3584, 1, 3328, 1, 1, 1, 3328]
    - [120, 38.0]
  - - [1, 4288, 1, 3328, 1, 1, 1, 3328]
    - [118, 37.0]
  - - [1, 5056, 1, 3328, 1, 1, 1, 3328]
    - [120, 40.0]
  - - [1, 5888, 1, 3328, 1, 1, 1, 3328]
    - [120, 40.0]
  - - [1, 6784, 1, 3328, 1, 1, 1, 3328]
    - [118, 40.0]
  - - [64, 1, 1, 256, 64, 64, 64, 256]
    - [102, 0.33]
  - - [128, 1, 1, 256, 128, 128, 128, 256]
    - [102, 1.0]
  - - [256, 1, 1, 256, 256, 256, 256, 256]
    - [99, 1.0]
  - - [448, 1, 1, 256, 448, 448, 448, 256]
    - [100, 2.0]
  - - [704, 1, 1, 256, 704, 704, 704, 256]
    - [102, 4.0]
  - - [1024, 1, 1, 256, 1024, 1024, 1024, 256]
    - [102, 5.0]
  - - [1408, 1, 1, 256, 1408, 1408, 1408, 256]
    - [102, 8.0]
  - - [1856, 1, 1, 256, 1856, 1856, 1856, 256]
    - [102, 10.0]
  - - [2368, 1, 1, 256, 2368, 2368, 2368, 256]
    - [102, 13.0]
  - - [2944, 1, 1, 256, 2944, 2944, 2944, 256]
    - [102, 16.0]
  - - [3584, 1, 1, 256, 3584, 3584, 3584, 256]
    - [102, 19.0]
  - - [4288, 1, 1, 256, 4288, 4288, 4288, 256]
    - [102, 18.0]
  - - [5056, 1, 1, 256, 5056, 5056, 5056, 256]
    - [102, 22.0]
  - - [5888, 1, 1, 256, 5888, 5888, 5888, 256]
    - [102, 25.0]
  - - [6784, 1, 1, 256, 6784, 6784, 6784, 256]
    - [102, 28.0]
  - - [64, 1, 1, 1280, 64, 64, 64, 1280]
    - [114, 1.0]
  - - [128, 1, 1, 1280, 128, 128, 128, 1280]
    - [117, 3.0]
  - - [256, 1, 1, 1280, 256, 256, 256, 1280]
    - [117, 6.0]
  - - [448, 1, 1, 1280, 448, 448, 448, 1280]
    - [117, 11.0]
  - - [704, 1, 1, 1280, 704, 704, 704, 1280]
    - [117, 17.0]
  - - [1024, 1, 1, 1280, 1024, 1024, 1024, 1280]
    - [117, 19.0]
  - - [1408, 1, 1, 1280, 1408, 1408, 1408, 1280]
    - [117, 26.0]
  - - [1856, 1, 1, 1280, 1856, 1856, 1856, 1280]
    - [118, 28.0]
  - - [2368, 1, 1, 1280, 2368, 2368, 2368, 1280]
    - [116, 30.0]
  - - [2944, 1, 1, 1280, 2944, 2944, 2944, 1280]
    - [118, 30.0]
  - - [3584, 1, 1, 1280, 3584, 3584, 3584, 1280]
    - [118, 36.0]
  - - [4288, 1, 1, 1280, 4288, 4288, 4288, 1280]
    - [118, 38.0]
  - - [5056, 1, 1, 1280, 5056, 5056, 5056, 1280]
    - [118, 36.0]
  - - [5888, 1, 1, 1280, 5888, 5888, 5888, 1280]
    - [116, 39.0]
  - - [6784, 1, 1, 1280, 6784, 6784, 6784, 1280]
    - [116, 39.0]
  - - [64, 1, 1, 3328, 64, 64, 64, 3328]
    - [117, 2.0]
  - - [128, 1, 1, 3328, 128, 128, 128, 3328]
    - [119, 5.0]
  - - [256, 1, 1, 3328, 256, 256, 256, 3328]
    - [119, 10.0]
  - - [448, 1, 1, 3328, 448, 448, 448, 3328]
    - [119, 17.0]
  - - [704, 1, 1, 3328, 704, 704, 704, 3328]
    - [117, 21.0]
  - - [1024, 1, 1, 3328, 1024, 1024, 1024, 3328]
    - [120, 30.0]
  - - [1408, 1, 1, 3328, 1408, 1408, 1408, 3328]
    - [118, 32.0]
  - - [1856, 1, 1, 3328, 1856, 1856, 1856, 3328]
    - [120, 35.0]
  - - [2368, 1, 1, 3328, 2368, 2368, 2368, 3328]
    - [120, 36.0]
  - - [2944, 1, 1, 3328, 2944, 2944, 2944, 3328]
    - [120, 39.0]
  - - [3584, 1, 1, 3328, 3584, 3584, 3584, 3328]
    - [118, 41.0]
  - - [4288, 1, 1, 3328, 4288, 4288, 4288, 3328]
    - [118, 42.0]
  - - [5056, 1, 1, 3328, 5056, 5056, 5056, 3328]
    - [120, 43.0]
  - - [5888, 1, 1, 3328, 5888, 5888, 5888, 3328]
    - [120, 42.0]
  - - [6784, 1, 1, 3328, 6784, 6784, 6784, 3328]
    - [120, 42.0]
  - - [64, 64, 1, 1, 64, 64, 64, 1]
    - [102, 0.28]
  - - [128, 64, 1, 1, 128, 128, 128, 1]
    - [100, 1.0]
  - - [256, 64, 1, 1, 256, 256, 256, 1]
    - [98, 1.0]
  - - [448, 64, 1, 1, 448, 448, 448, 1]
    - [99, 2.0]
  - - [704, 64, 1, 1, 704, 704, 704, 1]
    - [99, 3.0]
  - - [1024, 64, 1, 1, 1024, 1024, 1024, 1]
    - [99, 5.0]
  - - [1408, 64, 1, 1, 1408, 1408, 1408, 1]
    - [105, 7.0]
  - - [1856, 64, 1, 1, 1856, 1856, 1856, 1]
    - [100, 8.0]
  - - [2368, 64, 1, 1, 2368, 2368, 2368, 1]
    - [102, 11.0]
  - - [2944, 64, 1, 1, 2944, 2944, 2944, 1]
    - [102, 14.0]
  - - [3584, 64, 1, 1, 3584, 3584, 3584, 1]
    - [102, 17.0]
  - - [4288, 64, 1, 1, 4288, 4288, 4288, 1]
    - [100, 19.0]
  - - [5056, 64, 1, 1, 5056, 5056, 5056, 1]
    - [102, 23.0]
  - - [5888, 64, 1, 1, 5888, 5888, 5888, 1]
    - [102, 27.0]
  - - [6784, 64, 1, 1, 6784, 6784, 6784, 1]
    - [102, 32.0]
  - - [64, 128, 1, 1, 64, 64, 64, 1]
    - [100, 1.0]
  - - [128, 128, 1, 1, 128, 128, 128, 1]
    - [99, 1.0]
  - - [256, 128, 1, 1, 256, 256, 256, 1]
    - [105, 3.0]
  - - [448, 128, 1, 1, 448, 448, 448, 1]
    - [102, 5.0]
  - - [704, 128, 1, 1, 704, 704, 704, 1]
    - [103, 7.0]
  - - [1024, 128, 1, 1, 1024, 1024, 1024, 1]
    - [100, 9.0]
  - - [1408, 128, 1, 1, 1408, 1408, 1408, 1]
    - [102, 14.0]
  - - [1856, 128, 1, 1, 1856, 1856, 1856, 1]
    - [102, 17.0]
  - - [2368, 128, 1, 1, 2368, 2368, 2368, 1]
    - [102, 22.0]
  - - [2944, 128, 1, 1, 2944, 2944, 2944, 1]
    - [102, 27.0]
  - - [3584, 128, 1, 1, 3584, 3584, 3584, 1]
    - [102, 33.0]
  - - [4288, 128, 1, 1, 4288, 4288, 4288, 1]
    - [102, 38.0]
  - - [5056, 128, 1, 1, 5056, 5056, 5056, 1]
    - [102, 43.0]
  - - [5888, 128, 1, 1, 5888, 5888, 5888, 1]
    - [104, 45.0]
  - - [6784, 128, 1, 1, 6784, 6784, 6784, 1]
    - [102, 47.0]
  - - [64, 256, 1, 1, 64, 64, 64, 1]
    - [98, 1.0]
  - - [128, 256, 1, 1, 128, 128, 128, 1]
    - [100, 2.0]
  - - [256, 256, 1, 1, 256, 256, 256, 1]
    - [100, 5.0]
  - - [448, 256, 1, 1, 448, 448, 448, 1]
    - [102, 10.0]
  - - [704, 256, 1, 1, 704, 704, 704, 1]
    - [102, 13.0]
  - - [1024, 256, 1, 1, 1024, 1024, 1024, 1]
    - [100, 18.0]
  - - [1408, 256, 1, 1, 1408, 1408, 1408, 1]
    - [102, 26.0]
  - - [1856, 256, 1, 1, 1856, 1856, 1856, 1]
    - [104, 34.0]
  - - [2368, 256, 1, 1, 2368, 2368, 2368, 1]
    - [102, 40.0]
  - - [2944, 256, 1, 1, 2944, 2944, 2944, 1]
    - [102, 47.0]
  - - [3584, 256, 1, 1, 3584, 3584, 3584, 1]
    - [102, 47.0]
  - - [4288, 256, 1, 1, 4288, 4288, 4288, 1]
    - [102, 44.0]
  - - [5056, 256, 1, 1, 5056, 5056, 5056, 1]
    - [102, 42.0]
  - - [5888, 256, 1, 1, 5888, 5888, 5888, 1]
    - [104, 41.0]
  - - [6784, 256, 1, 1, 6784, 6784, 6784, 1]
    - [100, 39.0]
  - - [64, 448, 1, 1, 64, 64, 64, 1]
    - [100, 2.0]
  - - [128, 448, 1, 1, 128, 128, 128, 1]
    - [104, 5.0]
  - - [256, 448, 1, 1, 256, 256, 256, 1]
    - [100, 8.0]
  - - [448, 448, 1, 1, 448, 448, 448, 1]
    - [102, 14.0]
  - - [704, 448, 1, 1, 704, 704, 704, 1]
    - [102, 23.0]
  - - [1024, 448, 1, 1, 1024, 1024, 1024, 1]
    - [102, 32.0]
  - - [1408, 448, 1, 1, 1408, 1408, 1408, 1]
    - [102, 40.0]
  - - [1856, 448, 1, 1, 1856, 1856, 1856, 1]
    - [104, 46.0]
  - - [2368, 448, 1, 1, 2368, 2368, 2368, 1]
    - [103, 43.0]
  - - [2944, 448, 1, 1, 2944, 2944, 2944, 1]
    - [104, 41.0]
  - - [3584, 448, 1, 1, 3584, 3584, 3584, 1]
    - [102, 38.0]
  - - [4288, 448, 1, 1, 4288, 4288, 4288, 1]
    - [100, 38.0]
  - - [5056, 448, 1, 1, 5056, 5056, 5056, 1]
    - [100, 37.0]
  - - [5888, 448, 1, 1, 5888, 5888, 5888, 1]
    - [103, 35.0]
  - - [6784, 448, 1, 1, 6784, 6784, 6784, 1]
    - [99, 34.0]
  - - [64, 704, 1, 1, 64, 64, 64, 1]
    - [100, 3.0]
  - - [128, 704, 1, 1, 128, 128, 128, 1]
    - [103, 7.0]
  - - [256, 704, 1, 1, 256, 256, 256, 1]
    - [102, 13.0]
  - - [448, 704, 1, 1, 448, 448, 448, 1]
    - [104, 23.0]
  - - [704, 704, 1, 1, 704, 704, 704, 1]
    - [102, 36.0]
  - - [1024, 704, 1, 1, 1024, 1024, 1024, 1]
    - [104, 43.0]
  - - [1408, 704, 1, 1, 1408, 1408, 1408, 1]
    - [102, 41.0]
  - - [1856, 704, 1, 1, 1856, 1856, 1856, 1]
    - [100, 42.0]
  - - [2368, 704, 1, 1, 2368, 2368, 2368, 1]
    - [104, 40.0]
  - - [2944, 704, 1, 1, 2944, 2944, 2944, 1]
    - [102, 38.0]
  - - [3584, 704, 1, 1, 3584, 3584, 3584, 1]
    - [100, 34.0]
  - - [4288, 704, 1, 1, 4288, 4288, 4288, 1]
    - [100, 35.0]
  - - [5056, 704, 1, 1, 5056, 5056, 5056, 1]
    - [100, 35.0]
  - - [5888, 704, 1, 1, 5888, 5888, 5888, 1]
    - [100, 33.0]
  - - [6784, 704, 1, 1, 6784, 6784, 6784, 1]
    - [100, 33.0]
  - - [64, 1024, 1, 1, 64, 64, 64, 1]
    - [102, 5.0]
  - - [128, 1024, 1, 1, 128, 128, 128, 1]
    - [103, 10.0]
  - - [256, 1024, 1, 1, 256, 256, 256, 1]
    - [102, 20.0]
  - - [448, 1024, 1, 1, 448, 448, 448, 1]
    - [102, 33.0]
  - - [704, 1024, 1, 1, 704, 704, 704, 1]
    - [102, 44.0]
  - - [1024, 1024, 1, 1, 1024, 1024, 1024, 1]
    - [104, 34.0]
  - - [1408, 1024, 1, 1, 1408, 1408, 1408, 1]
    - [104, 42.0]
  - - [1856, 1024, 1, 1, 1856, 1856, 1856, 1]
    - [102, 40.0]
  - - [2368, 1024, 1, 1, 2368, 2368, 2368, 1]
    - [103, 39.0]
  - - [2944, 1024, 1, 1, 2944, 2944, 2944, 1]
    - [100, 36.0]
  - - [3584, 1024, 1, 1, 3584, 3584, 3584, 1]
    - [103, 34.0]
  - - [4288, 1024, 1, 1, 4288, 4288, 4288, 1]
    - [100, 35.0]
  - - [5056, 1024, 1, 1, 5056, 5056, 5056, 1]
    - [100, 34.0]
  - - [5888, 1024, 1, 1, 5888, 5888, 5888, 1]
    - [100, 32.0]
  - - [6784, 1024, 1, 1, 6784, 6784, 6784, 1]
    - [100, 32.0]
  - - [64, 1408, 1, 1, 64, 64, 64, 1]
    - [100, 6.0]
  - - [128, 1408, 1, 1, 128, 128, 128, 1]
    - [102, 13.0]
  - - [256, 1408, 1, 1, 256, 256, 256, 1]
    - [102, 26.0]
  - - [448, 1408, 1, 1, 448, 448, 448, 1]
    - [102, 43.0]
  - - [704, 1408, 1, 1, 704, 704, 704, 1]
    - [100, 43.0]
  - - [1024, 1408, 1, 1, 1024, 1024, 1024, 1]
    - [104, 34.0]
  - - [1408, 1408, 1, 1, 1408, 1408, 1408, 1]
    - [100, 39.0]
  - - [1856, 1408, 1, 1, 1856, 1856, 1856, 1]
    - [100, 39.0]
  - - [2368, 1408, 1, 1, 2368, 2368, 2368, 1]
    - [100, 38.0]
  - - [2944, 1408, 1, 1, 2944, 2944, 2944, 1]
    - [102, 36.0]
  - - [3584, 1408, 1, 1, 3584, 3584, 3584, 1]
    - [102, 34.0]
  - - [4288, 1408, 1, 1, 4288, 4288, 4288, 1]
    - [100, 34.0]
  - - [5056, 1408, 1, 1, 5056, 5056, 5056, 1]
    - [103, 34.0]
  - - [5888, 1408, 1, 1, 5888, 5888, 5888, 1]
    - [104, 32.0]
  - - [6784, 1408, 1, 1, 6784, 6784, 6784, 1]
    - [102, 32.0]
  - - [64, 1856, 1, 1, 64, 64, 64, 1]
    - [102, 9.0]
  - - [128, 1856, 1, 1, 128, 128, 128, 1]
    - [102, 17.0]
  - - [256, 1856, 1, 1, 256, 256, 256, 1]
    - [102, 35.0]
  - - [448, 1856, 1, 1, 448, 448, 448, 1]
    - [102, 45.0]
  - - [704, 1856, 1, 1, 704, 704, 704, 1]
    - [102, 42.0]
  - - [1024, 1856, 1, 1, 1024, 1024, 1024, 1]
    - [104, 35.0]
  - - [1408, 1856, 1, 1, 1408, 1408, 1408, 1]
    - [104, 38.0]
  - - [1856, 1856, 1, 1, 1856, 1856, 1856, 1]
    - [100, 38.0]
  - - [2368, 1856, 1, 1, 2368, 2368, 2368, 1]
    - [100, 37.0]
  - - [2944, 1856, 1, 1, 2944, 2944, 2944, 1]
    - [100, 35.0]
  - - [3584, 1856, 1, 1, 3584, 3584, 3584, 1]
    - [102, 33.0]
  - - [4288, 1856, 1, 1, 4288, 4288, 4288, 1]
    - [100, 34.0]
  - - [5056, 1856, 1, 1, 5056, 5056, 5056, 1]
    - [100, 33.0]
  - - [5888, 1856, 1, 1, 5888, 5888, 5888, 1]
    - [100, 31.0]
  - - [6784, 1856, 1, 1, 6784, 6784, 6784, 1]
    - [111, 32.0]
  - - [64, 2368, 1, 1, 64, 64, 64, 1]
    - [102, 11.0]
  - - [128, 2368, 1, 1, 128, 128, 128, 1]
    - [104, 22.0]
  - - [256, 2368, 1, 1, 256, 256, 256, 1]
    - [102, 40.0]
  - - [448, 2368, 1, 1, 448, 448, 448, 1]
    - [102, 43.0]
  - - [704, 2368, 1, 1, 704, 704, 704, 1]
    - [100, 40.0]
  - - [1024, 2368, 1, 1, 1024, 1024, 1024, 1]
    - [104, 35.0]
  - - [1408, 2368, 1, 1, 1408, 1408, 1408, 1]
    - [102, 38.0]
  - - [1856, 2368, 1, 1, 1856, 1856, 1856, 1]
    - [102, 38.0]
  - - [2368, 2368, 1, 1, 2368, 2368, 2368, 1]
    - [102, 37.0]
  - - [2944, 2368, 1, 1, 2944, 2944, 2944, 1]
    - [102, 34.0]
  - - [3584, 2368, 1, 1, 3584, 3584, 3584, 1]
    - [100, 33.0]
  - - [4288, 2368, 1, 1, 4288, 4288, 4288, 1]
    - [102, 34.0]
  - - [5056, 2368, 1, 1, 5056, 5056, 5056, 1]
    - [99, 33.0]
  - - [5888, 2368, 1, 1, 5888, 5888, 5888, 1]
    - [100, 31.0]
  - - [6784, 2368, 1, 1, 6784, 6784, 6784, 1]
    - [100, 31.0]
  - - [64, 2944, 1, 1, 64, 64, 64, 1]
    - [102, 14.0]
  - - [128, 2944, 1, 1, 128, 128, 128, 1]
    - [102, 27.0]
  - - [256, 2944, 1, 1, 256, 256, 256, 1]
    - [102, 47.0]
  - - [448, 2944, 1, 1, 448, 448, 448, 1]
    - [100, 42.0]
  - - [704, 2944, 1, 1, 704, 704, 704, 1]
    - [102, 40.0]
  - - [1024, 2944, 1, 1, 1024, 1024, 1024, 1]
    - [103, 35.0]
  - - [1408, 2944, 1, 1, 1408, 1408, 1408, 1]
    - [102, 38.0]
  - - [1856, 2944, 1, 1, 1856, 1856, 1856, 1]
    - [100, 37.0]
  - - [2368, 2944, 1, 1, 2368, 2368, 2368, 1]
    - [100, 37.0]
  - - [2944, 2944, 1, 1, 2944, 2944, 2944, 1]
    - [100, 34.0]
  - - [3584, 2944, 1, 1, 3584, 3584, 3584, 1]
    - [100, 32.0]
  - - [4288, 2944, 1, 1, 4288, 4288, 4288, 1]
    - [111, 34.0]
  - - [5056, 2944, 1, 1, 5056, 5056, 5056, 1]
    - [109, 34.0]
  - - [5888, 2944, 1, 1, 5888, 5888, 5888, 1]
    - [100, 31.0]
  - - [6784, 2944, 1, 1, 6784, 6784, 6784, 1]
    - [100, 31.0]
  - - [64, 3584, 1, 1, 64, 64, 64, 1]
    - [100, 16.0]
  - - [128, 3584, 1, 1, 128, 128, 128, 1]
    - [102, 33.0]
  - - [256, 3584, 1, 1, 256, 256, 256, 1]
    - [100, 44.0]
  - - [448, 3584, 1, 1, 448, 448, 448, 1]
    - [100, 42.0]
  - - [704, 3584, 1, 1, 704, 704, 704, 1]
    - [102, 40.0]
  - - [1024, 3584, 1, 1, 1024, 1024, 1024, 1]
    - [104, 36.0]
  - - [1408, 3584, 1, 1, 1408, 1408, 1408, 1]
    - [100, 37.0]
  - - [1856, 3584, 1, 1, 1856, 1856, 1856, 1]
    - [100, 37.0]
  - - [2368, 3584, 1, 1, 2368, 2368, 2368, 1]
    - [104, 37.0]
  - - [2944, 3584, 1, 1, 2944, 2944, 2944, 1]
    - [100, 34.0]
  - - [3584, 3584, 1, 1, 3584, 3584, 3584, 1]
    - [100, 32.0]
  - - [4288, 3584, 1, 1, 4288, 4288, 4288, 1]
    - [100, 33.0]
  - - [5056, 3584, 1, 1, 5056, 5056, 5056, 1]
    - [106, 34.0]
  - - [5888, 3584, 1, 1, 5888, 5888, 5888, 1]
    - [108, 31.0]
  - - [6784, 3584, 1, 1, 6784, 6784, 6784, 1]
    - [100, 31.0]
  - - [64, 4288, 1, 1, 64, 64, 64, 1]
    - [102, 20.0]
  - - [128, 4288, 1, 1, 128, 128, 128, 1]
    - [102, 36.0]
  - - [256, 4288, 1, 1, 256, 256, 256, 1]
    - [104, 44.0]
  - - [448, 4288, 1, 1, 448, 448, 448, 1]
    - [100, 40.0]
  - - [704, 4288, 1, 1, 704, 704, 704, 1]
    - [102, 39.0]
  - - [1024, 4288, 1, 1, 1024, 1024, 1024, 1]
    - [104, 36.0]
  - - [1408, 4288, 1, 1, 1408, 1408, 1408, 1]
    - [105, 37.0]
  - - [1856, 4288, 1, 1, 1856, 1856, 1856, 1]
    - [100, 37.0]
  - - [2368, 4288, 1, 1, 2368, 2368, 2368, 1]
    - [100, 36.0]
  - - [2944, 4288, 1, 1, 2944, 2944, 2944, 1]
    - [102, 34.0]
  - - [3584, 4288, 1, 1, 3584, 3584, 3584, 1]
    - [103, 32.0]
  - - [4288, 4288, 1, 1, 4288, 4288, 4288, 1]
    - [111, 34.0]
  - - [5056, 4288, 1, 1, 5056, 5056, 5056, 1]
    - [106, 34.0]
  - - [5888, 4288, 1, 1, 5888, 5888, 5888, 1]
    - [100, 30.0]
  - - [6784, 4288, 1, 1, 6784, 6784, 6784, 1]
    - [100, 31.0]
  - - [64, 5056, 1, 1, 64, 64, 64, 1]
    - [102, 23.0]
  - - [128, 5056, 1, 1, 128, 128, 128, 1]
    - [102, 40.0]
  - - [256, 5056, 1, 1, 256, 256, 256, 1]
    - [100, 43.0]
  - - [448, 5056, 1, 1, 448, 448, 448, 1]
    - [100, 40.0]
  - - [704, 5056, 1, 1, 704, 704, 704, 1]
    - [100, 39.0]
  - - [1024, 5056, 1, 1, 1024, 1024, 1024, 1]
    - [100, 35.0]
  - - [1408, 5056, 1, 1, 1408, 1408, 1408, 1]
    - [112, 37.0]
  - - [1856, 5056, 1, 1, 1856, 1856, 1856, 1]
    - [100, 37.0]
  - - [2368, 5056, 1, 1, 2368, 2368, 2368, 1]
    - [100, 36.0]
  - - [2944, 5056, 1, 1, 2944, 2944, 2944, 1]
    - [100, 33.0]
  - - [3584, 5056, 1, 1, 3584, 3584, 3584, 1]
    - [105, 32.0]
  - - [4288, 5056, 1, 1, 4288, 4288, 4288, 1]
    - [111, 34.0]
  - - [5056, 5056, 1, 1, 5056, 5056, 5056, 1]
    - [101, 34.0]
  - - [5888, 5056, 1, 1, 5888, 5888, 5888, 1]
    - [100, 30.0]
  - - [6784, 5056, 1, 1, 6784, 6784, 6784, 1]
    - [100, 31.0]
  - - [64, 5888, 1, 1, 64, 64, 64, 1]
    - [102, 27.0]
  - - [128, 5888, 1, 1, 128, 128, 128, 1]
    - [104, 41.0]
  - - [256, 5888, 1, 1, 256, 256, 256, 1]
    - [104, 42.0]
  - - [448, 5888, 1, 1, 448, 448, 448, 1]
    - [102, 40.0]
  - - [704, 5888, 1, 1, 704, 704, 704, 1]
    - [100, 39.0]
  - - [1024, 5888, 1, 1, 1024, 1024, 1024, 1]
    - [100, 35.0]
  - - [1408, 5888, 1, 1, 1408, 1408, 1408, 1]
    - [112, 37.0]
  - - [1856, 5888, 1, 1, 1856, 1856, 1856, 1]
    - [100, 37.0]
  - - [2368, 5888, 1, 1, 2368, 2368, 2368, 1]
    - [100, 36.0]
  - - [2944, 5888, 1, 1, 2944, 2944, 2944, 1]
    - [100, 33.0]
  - - [3584, 5888, 1, 1, 3584, 3584, 3584, 1]
    - [100, 31.0]
  - - [4288, 5888, 1, 1, 4288, 4288, 4288, 1]
    - [111, 34.0]
  - - [5056, 5888, 1, 1, 5056, 5056, 5056, 1]
    - [101, 34.0]
  - - [5888, 5888, 1, 1, 5888, 5888, 5888, 1]
    - [107, 31.0]
  - - [6784, 5888, 1, 1, 6784, 6784, 6784, 1]
    - [100, 31.0]
  - - [64, 6784, 1, 1, 64, 64, 64, 1]
    - [102, 31.0]
  - - [128, 6784, 1, 1, 128, 128, 128, 1]
    - [100, 43.0]
  - - [256, 6784, 1, 1, 256, 256, 256, 1]
    - [100, 40.0]
  - - [448, 6784, 1, 1, 448, 448, 448, 1]
    - [100, 39.0]
  - - [704, 6784, 1, 1, 704, 704, 704, 1]
    - [102, 39.0]
  - - [1024, 6784, 1, 1, 1024, 1024, 1024, 1]
    - [105, 36.0]
  - - [1408, 6784, 1, 1, 1408, 1408, 1408, 1]
    - [111, 37.0]
  - - [1856, 6784, 1, 1, 1856, 1856, 1856, 1]
    - [102, 37.0]
  - - [2368, 6784, 1, 1, 2368, 2368, 2368, 1]
    - [100, 36.0]
  - - [2944, 6784, 1, 1, 2944, 2944, 2944, 1]
    - [111, 34.0]
  - - [3584, 6784, 1, 1, 3584, 3584, 3584, 1]
    - [100, 31.0]
  - - [4288, 6784, 1, 1, 4288, 4288, 4288, 1]
    - [109, 34.0]
  - - [5056, 6784, 1, 1, 5056, 5056, 5056, 1]
    - [101, 34.0]
  - - [5888, 6784, 1, 1, 5888, 5888, 5888, 1]
    - [100, 30.0]
  - - [6784, 6784, 1, 1, 6784, 6784, 6784, 1]
    - [103, 31.0]
  - - [1, 1, 1, 256, 1, 1, 1, 256]
    - [102, 0.005349605178382511]
  - - [1, 1, 1, 1280, 1, 1, 1, 1280]
    - [115, 0.02]
  - - [1, 1, 1, 3328, 1, 1, 1, 3328]
    - [119, 0.04]
  - - [1, 64, 1, 1, 1, 1, 1, 1]
    - [103, 0.006084228671703252]
  - - [1, 128, 1, 1, 1, 1, 1, 1]
    - [100, 0.01]
  - - [1, 256, 1, 1, 1, 1, 1, 1]
    - [102, 0.03]
  - - [1, 448, 1, 1, 1, 1, 1, 1]
    - [102, 0.05]
  - - [1, 704, 1, 1, 1, 1, 1, 1]
    - [105, 0.08]
  - - [1, 1024, 1, 1, 1, 1, 1, 1]
    - [100, 0.12]
  - - [1, 1408, 1, 1, 1, 1, 1, 1]
    - [100, 0.16]
  - - [1, 1856, 1, 1, 1, 1, 1, 1]
    - [102, 0.2]
  - - [1, 2368, 1, 1, 1, 1, 1, 1]
    - [102, 0.24]
  - - [1, 2944, 1, 1, 1, 1, 1, 1]
    - [100, 0.29]
  - - [1, 3584, 1, 1, 1, 1, 1, 1]
    - [100, 0.35]
  - - [1, 4288, 1, 1, 1, 1, 1, 1]
    - [100, 0.41]
  - - [1, 5056, 1, 1, 1, 1, 1, 1]
    - [102, 0.49]
  - - [1, 5888, 1, 1, 1, 1, 1, 1]
    - [100, 1.0]
  - - [1, 6784, 1, 1, 1, 1, 1, 1]
    - [100, 1.0]
  - - [64, 1, 1, 1, 64, 64, 64, 1]
    - [112, 0.01]
  - - [128, 1, 1, 1, 128, 128, 128, 1]
    - [110, 0.02]
  - - [256, 1, 1, 1, 256, 256, 256, 1]
    - [102, 0.04]
  - - [448, 1, 1, 1, 448, 448, 448, 1]
    - [107, 0.07]
  - - [704, 1, 1, 1, 704, 704, 704, 1]
    - [100, 0.09]
  - - [1024, 1, 1, 1, 1024, 1024, 1024, 1]
    - [100, 0.13]
  - - [1408, 1, 1, 1, 1408, 1408, 1408, 1]
    - [100, 0.17]
  - - [1856, 1, 1, 1, 1856, 1856, 1856, 1]
    - [102, 0.22]
  - - [2368, 1, 1, 1, 2368, 2368, 2368, 1]
    - [100, 0.27]
  - - [2944, 1, 1, 1, 2944, 2944, 2944, 1]
    - [104, 0.35]
  - - [3584, 1, 1, 1, 3584, 3584, 3584, 1]
    - [102, 0.42]
  - - [4288, 1, 1, 1, 4288, 4288, 4288, 1]
    - [102, 0.5]
  - - [5056, 1, 1, 1, 5056, 5056, 5056, 1]
    - [100, 1.0]
  - - [5888, 1, 1, 1, 5888, 5888, 5888, 1]
    - [100, 1.0]
  - - [6784, 1, 1, 1, 6784, 6784, 6784, 1]
    - [99, 1.0]
- null
