library/src/blas3/Tensile/Logic/aldebaran/vega10_Cijk_Ailk_Bjlk_HSS_BH.yaml
- {MinimumRequiredVersion: 4.24.0}
- vega10
- gfx900
- [Device 6863, Device 6862, Device 687f, Device 6860, Device 6861, 'Vega 10 XTX [Radeon
    SolutionIndex: 0
    SolutionNameMin: Cijk_Ailk_Bjlk_HSS_BH_MT128x32x8_SE_GSU1_PGR1_PLR1_TT4_4_VAW2
    SolutionIndex: 1
    SolutionNameMin: Cijk_Ailk_Bjlk_HSS_BH_MT32x32x8_SE_GSU1_PGR1_PLR1_TT4_4_VAW2
    SolutionIndex: 2
    SolutionNameMin: Cijk_Ailk_Bjlk_HSS_BH_MT64x32x8_SE_GSU1_PGR1_PLR1_TT8_4_VAW2
    SolutionIndex: 3
    SolutionNameMin: Cijk_Ailk_Bjlk_HSS_BH_MT128x32x8_SE_GSU1_PGR1_PLR1_TT4_4_VAW2
    SolutionIndex: 4
    SolutionNameMin: Cijk_Ailk_Bjlk_HSS_BH_MT32x16x16_SE_GSU1_PGR1_PLR1_TT4_2_VAW2
    SolutionIndex: 5
    SolutionNameMin: Cijk_Ailk_Bjlk_HSS_BH_MT32x16x16_SE_GSU1_PGR1_PLR1_TT2_2_VAW2
    SolutionIndex: 6
    SolutionNameMin: Cijk_Ailk_Bjlk_HSS_BH_MT64x16x16_SE_GSU1_PGR1_PLR1_TT4_2_VAW2
    SolutionIndex: 7
    SolutionNameMin: Cijk_Ailk_Bjlk_HSS_BH_MT64x32x16_SE_GSU1_PGR1_PLR1_TT4_4_VAW2
    SolutionIndex: 8
    SolutionNameMin: Cijk_Ailk_Bjlk_HSS_BH_MT64x16x16_SE_GSU1_PGR1_PLR1_TT2_2_VAW2
    SolutionIndex: 9
    SolutionNameMin: Cijk_Ailk_Bjlk_HSS_BH_MT128x16x16_SE_GSU1_PGR1_PLR1_TT4_2_VAW2
    SolutionIndex: 10
    SolutionNameMin: Cijk_Ailk_Bjlk_HSS_BH_MT64x8x16_SE_GSU1_PGR1_PLR1_TT2_2_VAW2
    SolutionIndex: 11
    SolutionNameMin: Cijk_Ailk_Bjlk_HSS_BH_MT32x16x16_SE_GSU1_PGR1_PLR1_TT4_2_VAW2
    SolutionIndex: 12
    SolutionNameMin: Cijk_Ailk_Bjlk_HSS_BH_MT32x32x16_SE_GSU1_PGR1_PLR1_TT4_4_VAW2
    SolutionIndex: 13
    SolutionNameMin: Cijk_Ailk_Bjlk_HSS_BH_MT32x16x16_SE_GSU1_PGR1_PLR1_TT2_2_VAW2
    SolutionIndex: 14
    SolutionNameMin: Cijk_Ailk_Bjlk_HSS_BH_MT64x16x16_SE_GSU1_PGR1_PLR1_TT4_2_VAW2
    SolutionIndex: 15
    SolutionNameMin: Cijk_Ailk_Bjlk_HSS_BH_MT64x32x16_SE_GSU1_PGR1_PLR1_TT4_4_VAW2
    SolutionIndex: 16
    SolutionNameMin: Cijk_Ailk_Bjlk_HSS_BH_MT64x16x16_SE_GSU1_PGR1_PLR1_TT2_2_VAW2
    SolutionIndex: 17
    SolutionNameMin: Cijk_Ailk_Bjlk_HSS_BH_MT128x16x16_SE_GSU1_PGR1_PLR1_TT4_2_VAW2
    SolutionIndex: 18
    SolutionNameMin: Cijk_Ailk_Bjlk_HSS_BH_MT16x16x24_SE_GSU1_PGR1_PLR1_TT2_2_VAW2
    SolutionIndex: 19
    SolutionNameMin: Cijk_Ailk_Bjlk_HSS_BH_MT16x16x32_SE_GSU1_PGR1_PLR1_TT2_2_VAW2
    SolutionIndex: 20
    SolutionNameMin: Cijk_Ailk_Bjlk_HSS_BH_MT32x16x32_SE_GSU1_PGR1_PLR1_TT2_2_VAW2
    SolutionIndex: 21
    SolutionNameMin: Cijk_Ailk_Bjlk_HSS_BH_MT64x16x32_SE_GSU1_PGR1_PLR1_TT4_2_VAW2
    SolutionIndex: 22
    SolutionNameMin: Cijk_Ailk_Bjlk_HSS_BH_MT64x16x32_SE_GSU1_PGR1_PLR1_TT2_2_VAW2
    SolutionIndex: 23
    SolutionNameMin: Cijk_Ailk_Bjlk_HSS_BH_MT128x16x32_SE_GSU1_PGR1_PLR1_TT4_2_VAW2
    SolutionIndex: 24
    SolutionNameMin: Cijk_Ailk_Bjlk_HSS_BH_MT32x8x32_SE_GSU1_PGR1_PLR1_TT2_2_VAW2
    SolutionIndex: 25
    SolutionNameMin: Cijk_Ailk_Bjlk_HSS_BH_MT64x8x32_SE_GSU1_PGR1_PLR1_TT2_2_VAW2
    SolutionIndex: 26
    SolutionNameMin: Cijk_Ailk_Bjlk_HSS_BH_MT32x16x32_SE_GSU1_PGR1_PLR1_TT2_2_VAW2
    SolutionIndex: 27
    SolutionNameMin: Cijk_Ailk_Bjlk_HSS_BH_MT64x16x32_SE_GSU1_PGR1_PLR1_TT4_2_VAW2
    SolutionIndex: 28
    SolutionNameMin: Cijk_Ailk_Bjlk_HSS_BH_MT64x16x32_SE_GSU1_PGR1_PLR1_TT2_2_VAW2
    SolutionIndex: 29
    SolutionNameMin: Cijk_Ailk_Bjlk_HSS_BH_MT128x16x32_SE_GSU1_PGR1_PLR1_TT4_2_VAW2
    SolutionIndex: 30
    SolutionNameMin: Cijk_Ailk_Bjlk_HSS_BH_MT32x8x32_SE_GSU1_PGR1_PLR1_TT2_2_VAW2
    SolutionIndex: 31
    SolutionNameMin: Cijk_Ailk_Bjlk_HSS_BH_MT16x16x64_SE_GSU1_PGR1_PLR1_TT2_2_VAW2
    SolutionIndex: 32
    SolutionNameMin: Cijk_Ailk_Bjlk_HSS_BH_MT32x16x64_SE_GSU1_PGR1_PLR1_TT2_2_VAW2
    SolutionIndex: 33
    SolutionNameMin: Cijk_Ailk_Bjlk_HSS_BH_MT64x16x64_SE_GSU1_PGR1_PLR1_TT2_2_VAW2
    SolutionIndex: 34
    SolutionNameMin: Cijk_Ailk_Bjlk_HSS_BH_MT32x8x64_SE_GSU1_PGR1_PLR1_TT2_2_VAW2
    SolutionIndex: 35
    SolutionNameMin: Cijk_Ailk_Bjlk_HSS_BH_MT16x16x64_SE_GSU1_PGR1_PLR1_TT2_2_VAW2
    SolutionIndex: 36
    SolutionNameMin: Cijk_Ailk_Bjlk_HSS_BH_MT32x16x64_SE_GSU1_PGR1_PLR1_TT2_2_VAW2
    SolutionIndex: 37
    SolutionNameMin: Cijk_Ailk_Bjlk_HSS_BH_MT64x16x64_SE_GSU1_PGR1_PLR1_TT2_2_VAW2
    SolutionIndex: 38
    SolutionNameMin: Cijk_Ailk_Bjlk_HSS_BH_MT128x16x64_SE_GSU1_PGR1_PLR1_TT4_2_VAW2
    SolutionIndex: 39
    SolutionNameMin: Cijk_Ailk_Bjlk_HSS_BH_MT32x8x64_SE_GSU1_PGR1_PLR1_TT2_2_VAW2
    SolutionIndex: 40
    SolutionNameMin: Cijk_Ailk_Bjlk_HSS_BH_MT32x64x8_SE_GSU1_PGR1_PLR1_TT4_8_VAW2
    SolutionIndex: 41
    SolutionNameMin: Cijk_Ailk_Bjlk_HSS_BH_MT48x64x8_SE_GSU1_PGR1_PLR1_TT6_8_VAW2
    SolutionIndex: 42
    SolutionNameMin: Cijk_Ailk_Bjlk_HSS_BH_MT64x48x8_SE_GSU1_PGR1_PLR1_TT8_6_VAW2
    SolutionIndex: 43
    SolutionNameMin: Cijk_Ailk_Bjlk_HSS_BH_MT32x64x16_SE_GSU1_PGR1_PLR1_TT4_8_VAW2
    SolutionIndex: 44
    SolutionNameMin: Cijk_Ailk_Bjlk_HSS_BH_MT48x64x16_SE_GSU1_PGR1_PLR1_TT6_8_VAW2
    SolutionIndex: 45
    SolutionNameMin: Cijk_Ailk_Bjlk_HSS_BH_MT64x64x16_SE_GSU1_PGR1_PLR1_TT4_4_VAW2
    SolutionIndex: 46
    SolutionNameMin: Cijk_Ailk_Bjlk_HSS_BH_MT64x128x16_SE_GSU1_PGR1_PLR1_TT4_8_VAW2
    SolutionIndex: 47
    SolutionNameMin: Cijk_Ailk_Bjlk_HSS_BH_MT96x128x16_SE_GSU1_PGR1_PLR1_TT6_8_VAW2
    SolutionIndex: 48
    SolutionNameMin: Cijk_Ailk_Bjlk_HSS_BH_MT128x64x16_SE_GSU1_PGR1_PLR1_TT8_4_VAW2
    SolutionIndex: 49
    SolutionNameMin: Cijk_Ailk_Bjlk_HSS_BH_MT128x96x16_SE_GSU1_PGR1_PLR1_TT8_6_VAW2
    SolutionIndex: 50
    SolutionNameMin: Cijk_Ailk_Bjlk_HSS_BH_MT64x64x32_SE_GSU1_PGR1_PLR1_TT4_4_VAW2
    SolutionIndex: 51
    SolutionNameMin: Cijk_Ailk_Bjlk_HSS_BH_MT32x32x16_SE_GSU1_PGR1_PLR1_TT2_2_VAW2
    SolutionIndex: 52
    SolutionNameMin: Cijk_Ailk_Bjlk_HSS_BH_MT32x32x32_SE_GSU1_PGR1_PLR1_TT2_2_VAW2
    SolutionIndex: 53
    SolutionNameMin: Cijk_Ailk_Bjlk_HSS_BH_MT64x64x32_SE_GSU1_PGR1_PLR1_TT4_4_VAW2
    SolutionIndex: 54
    SolutionNameMin: Cijk_Ailk_Bjlk_HSS_BH_MT32x32x64_SE_GSU1_PGR1_PLR1_TT2_2_VAW2
    SolutionIndex: 55
    SolutionNameMin: Cijk_Ailk_Bjlk_HSS_BH_MT64x64x4_SE_GSU1_PGR0_PLR0_TT4_4_VAW2
    SolutionIndex: 56
    SolutionNameMin: Cijk_Ailk_Bjlk_HSS_BH_MT64x64x4_SE_GSU1_PGR1_PLR0_TT4_4_VAW2
    SolutionIndex: 57
    SolutionNameMin: Cijk_Ailk_Bjlk_HSS_BH_MT64x64x4_SE_GSU1_PGR0_PLR1_TT4_4_VAW2
    SolutionIndex: 58
    SolutionNameMin: Cijk_Ailk_Bjlk_HSS_BH_MT128x128x4_SE_GSU1_PGR1_PLR1_TT8_8_VAW2
    SolutionIndex: 59
    SolutionNameMin: Cijk_Ailk_Bjlk_HSS_BH_MT64x128x4_SE_GSU1_PGR1_PLR1_TT4_8_VAW2
    SolutionIndex: 60
    SolutionNameMin: Cijk_Ailk_Bjlk_HSS_BH_MT64x64x4_SE_GSU1_PGR1_PLR1_TT4_4_VAW2
    SolutionIndex: 61
    SolutionNameMin: Cijk_Ailk_Bjlk_HSS_BH_MT64x64x8_SE_GSU1_PGR0_PLR0_TT4_4_VAW2
    SolutionIndex: 62
    SolutionNameMin: Cijk_Ailk_Bjlk_HSS_BH_MT64x64x8_SE_GSU1_PGR1_PLR0_TT4_4_VAW2
    SolutionIndex: 63
    SolutionNameMin: Cijk_Ailk_Bjlk_HSS_BH_MT64x64x8_SE_GSU1_PGR0_PLR1_TT4_4_VAW2
    SolutionIndex: 64
    SolutionNameMin: Cijk_Ailk_Bjlk_HSS_BH_MT64x64x8_SE_GSU1_PGR1_PLR1_TT4_4_VAW2
    SolutionIndex: 65
    SolutionNameMin: Cijk_Ailk_Bjlk_HSS_BH_MT64x64x16_SE_GSU1_PGR0_PLR0_TT4_4_VAW2
    SolutionIndex: 66
    SolutionNameMin: Cijk_Ailk_Bjlk_HSS_BH_MT64x64x16_SE_GSU1_PGR1_PLR0_TT4_4_VAW2
    SolutionIndex: 67
    SolutionNameMin: Cijk_Ailk_Bjlk_HSS_BH_MT128x128x16_SE_GSU1_PGR0_PLR1_TT8_8_VAW2
    SolutionIndex: 68
    SolutionNameMin: Cijk_Ailk_Bjlk_HSS_BH_MT64x64x16_SE_GSU1_PGR0_PLR1_TT4_4_VAW2
    SolutionIndex: 69
    SolutionNameMin: Cijk_Ailk_Bjlk_HSS_BH_MT64x64x16_SE_GSU1_PGR1_PLR1_TT4_4_VAW2
    SolutionIndex: 70
    SolutionNameMin: Cijk_Ailk_Bjlk_HSS_BH_MT64x64x16_SE_GSU2_PGR1_PLR0_TT4_4_VAW1
    SolutionIndex: 71
    SolutionNameMin: Cijk_Ailk_Bjlk_HSS_BH_MT64x128x16_SE_GSU3_PGR0_PLR0_TT4_8_VAW1
    SolutionIndex: 72
    SolutionNameMin: Cijk_Ailk_Bjlk_HSS_BH_MT64x64x16_SE_GSU3_PGR0_PLR0_TT4_4_VAW1
    SolutionIndex: 73
    SolutionNameMin: Cijk_Ailk_Bjlk_HSS_BH_MT64x64x16_SE_GSU3_PGR1_PLR0_TT4_4_VAW1
    SolutionIndex: 74
    SolutionNameMin: Cijk_Ailk_Bjlk_HSS_BH_MT64x64x16_SE_GSU3_PGR1_PLR1_TT4_4_VAW1
    SolutionIndex: 75
    SolutionNameMin: Cijk_Ailk_Bjlk_HSS_BH_MT64x64x4_SE_GSU5_PGR1_PLR0_TT4_4_VAW1
    SolutionIndex: 76
    SolutionNameMin: Cijk_Ailk_Bjlk_HSS_BH_MT64x64x8_SE_GSU5_PGR1_PLR0_TT4_4_VAW1
    SolutionIndex: 77
    SolutionNameMin: Cijk_Ailk_Bjlk_HSS_BH_MT64x64x16_SE_GSU5_PGR1_PLR0_TT4_4_VAW1
    SolutionIndex: 78
    SolutionNameMin: Cijk_Ailk_Bjlk_HSS_BH_MT64x64x16_SE_GSU5_PGR1_PLR1_TT4_4_VAW1
    SolutionIndex: 79
    SolutionNameMin: Cijk_Ailk_Bjlk_HSS_BH_MT64x64x8_SE_GSU7_PGR1_PLR0_TT4_4_VAW1
    SolutionIndex: 80
    SolutionNameMin: Cijk_Ailk_Bjlk_HSS_BH_MT64x128x8_SE_GSU7_PGR1_PLR1_TT4_8_VAW1
    SolutionIndex: 81
    SolutionNameMin: Cijk_Ailk_Bjlk_HSS_BH_MT64x128x16_SE_GSU7_PGR1_PLR0_TT4_8_VAW1
    SolutionIndex: 82
    SolutionNameMin: Cijk_Ailk_Bjlk_HSS_BH_MT64x64x16_SE_GSU7_PGR1_PLR0_TT4_4_VAW1
    SolutionIndex: 83
    SolutionNameMin: Cijk_Ailk_Bjlk_HSS_BH_MT64x128x16_SE_GSU7_PGR0_PLR1_TT4_8_VAW1
    SolutionIndex: 84
    SolutionNameMin: Cijk_Ailk_Bjlk_HSS_BH_MT64x64x16_SE_GSU7_PGR0_PLR1_TT4_4_VAW1
    SolutionIndex: 85
    SolutionNameMin: Cijk_Ailk_Bjlk_HSS_BH_MT64x64x16_SE_GSU7_PGR1_PLR1_TT4_4_VAW1
    SolutionIndex: 86
    SolutionNameMin: Cijk_Ailk_Bjlk_HSS_BH_MT128x128x4_SE_GSU1_PGR0_PLR0_TT8_8_VAW2
    SolutionIndex: 87
    SolutionNameMin: Cijk_Ailk_Bjlk_HSS_BH_MT64x128x4_SE_GSU1_PGR0_PLR0_TT4_8_VAW2
    SolutionIndex: 88
    SolutionNameMin: Cijk_Ailk_Bjlk_HSS_BH_MT64x64x4_SE_GSU1_PGR0_PLR0_TT4_4_VAW2
    SolutionIndex: 89
    SolutionNameMin: Cijk_Ailk_Bjlk_HSS_BH_MT128x128x4_SE_GSU1_PGR1_PLR0_TT8_8_VAW2
    SolutionIndex: 90
    SolutionNameMin: Cijk_Ailk_Bjlk_HSS_BH_MT64x128x4_SE_GSU1_PGR1_PLR0_TT4_8_VAW2
    SolutionIndex: 91
    SolutionNameMin: Cijk_Ailk_Bjlk_HSS_BH_MT64x64x4_SE_GSU1_PGR1_PLR0_TT4_4_VAW2
    SolutionIndex: 92
    SolutionNameMin: Cijk_Ailk_Bjlk_HSS_BH_MT128x128x4_SE_GSU1_PGR0_PLR1_TT8_8_VAW2
    SolutionIndex: 93
    SolutionNameMin: Cijk_Ailk_Bjlk_HSS_BH_MT64x128x4_SE_GSU1_PGR0_PLR1_TT4_8_VAW2
    SolutionIndex: 94
    SolutionNameMin: Cijk_Ailk_Bjlk_HSS_BH_MT64x64x4_SE_GSU1_PGR0_PLR1_TT4_4_VAW2
    SolutionIndex: 95
    SolutionNameMin: Cijk_Ailk_Bjlk_HSS_BH_MT128x128x4_SE_GSU1_PGR1_PLR1_TT8_8_VAW2
    SolutionIndex: 96
    SolutionNameMin: Cijk_Ailk_Bjlk_HSS_BH_MT64x128x4_SE_GSU1_PGR1_PLR1_TT4_8_VAW2
    SolutionIndex: 97
    SolutionNameMin: Cijk_Ailk_Bjlk_HSS_BH_MT64x64x4_SE_GSU1_PGR1_PLR1_TT4_4_VAW2
    SolutionIndex: 98
    SolutionNameMin: Cijk_Ailk_Bjlk_HSS_BH_MT128x128x8_SE_GSU1_PGR1_PLR0_TT8_8_VAW2
    SolutionIndex: 99
    SolutionNameMin: Cijk_Ailk_Bjlk_HSS_BH_MT64x64x8_SE_GSU1_PGR1_PLR0_TT4_4_VAW2
    SolutionIndex: 100
    SolutionNameMin: Cijk_Ailk_Bjlk_HSS_BH_MT128x128x8_SE_GSU1_PGR0_PLR1_TT8_8_VAW2
    SolutionIndex: 101
    SolutionNameMin: Cijk_Ailk_Bjlk_HSS_BH_MT64x64x8_SE_GSU1_PGR0_PLR1_TT4_4_VAW2
    SolutionIndex: 102
    SolutionNameMin: Cijk_Ailk_Bjlk_HSS_BH_MT64x64x8_SE_GSU1_PGR1_PLR1_TT4_4_VAW2
    SolutionIndex: 103
    SolutionNameMin: Cijk_Ailk_Bjlk_HSS_BH_MT128x128x16_SE_GSU1_PGR0_PLR0_TT8_8_VAW2
    SolutionIndex: 104
    SolutionNameMin: Cijk_Ailk_Bjlk_HSS_BH_MT64x64x16_SE_GSU1_PGR0_PLR0_TT4_4_VAW2
    SolutionIndex: 105
    SolutionNameMin: Cijk_Ailk_Bjlk_HSS_BH_MT64x64x16_SE_GSU1_PGR1_PLR0_TT4_4_VAW2
    SolutionIndex: 106
    SolutionNameMin: Cijk_Ailk_Bjlk_HSS_BH_MT64x128x16_SE_GSU1_PGR0_PLR1_TT4_8_VAW2
    SolutionIndex: 107
    SolutionNameMin: Cijk_Ailk_Bjlk_HSS_BH_MT64x64x16_SE_GSU1_PGR0_PLR1_TT4_4_VAW2
    SolutionIndex: 108
    SolutionNameMin: Cijk_Ailk_Bjlk_HSS_BH_MT64x128x16_SE_GSU1_PGR1_PLR1_TT4_8_VAW2
    SolutionIndex: 109
    SolutionNameMin: Cijk_Ailk_Bjlk_HSS_BH_MT64x64x16_SE_GSU1_PGR1_PLR1_TT4_4_VAW2
    SolutionIndex: 110
    SolutionNameMin: Cijk_Ailk_Bjlk_HSS_BH_MT64x64x4_SE_GSU2_PGR1_PLR0_TT4_4_VAW1
    SolutionIndex: 111
    SolutionNameMin: Cijk_Ailk_Bjlk_HSS_BH_MT64x64x16_SE_GSU2_PGR1_PLR0_TT4_4_VAW1
    SolutionIndex: 112
    SolutionNameMin: Cijk_Ailk_Bjlk_HSS_BH_MT64x64x4_SE_GSU3_PGR1_PLR0_TT4_4_VAW1
    SolutionIndex: 113
    SolutionNameMin: Cijk_Ailk_Bjlk_HSS_BH_MT64x64x8_SE_GSU3_PGR1_PLR0_TT4_4_VAW1
    SolutionIndex: 114
    SolutionNameMin: Cijk_Ailk_Bjlk_HSS_BH_MT64x64x16_SE_GSU3_PGR1_PLR0_TT4_4_VAW1
    SolutionIndex: 115
    SolutionNameMin: Cijk_Ailk_Bjlk_HSS_BH_MT64x128x4_SE_GSU5_PGR1_PLR0_TT4_8_VAW1
    SolutionIndex: 116
    SolutionNameMin: Cijk_Ailk_Bjlk_HSS_BH_MT64x64x4_SE_GSU5_PGR1_PLR0_TT4_4_VAW1
    SolutionIndex: 117
    SolutionNameMin: Cijk_Ailk_Bjlk_HSS_BH_MT64x64x8_SE_GSU5_PGR1_PLR0_TT4_4_VAW1
    SolutionIndex: 118
    SolutionNameMin: Cijk_Ailk_Bjlk_HSS_BH_MT64x64x16_SE_GSU5_PGR0_PLR0_TT4_4_VAW1
    SolutionIndex: 119
    SolutionNameMin: Cijk_Ailk_Bjlk_HSS_BH_MT64x64x16_SE_GSU5_PGR1_PLR0_TT4_4_VAW1
    SolutionIndex: 120
    SolutionNameMin: Cijk_Ailk_Bjlk_HSS_BH_MT64x64x16_SE_GSU5_PGR1_PLR1_TT4_4_VAW1
    SolutionIndex: 121
    SolutionNameMin: Cijk_Ailk_Bjlk_HSS_BH_MT64x128x4_SE_GSU7_PGR1_PLR0_TT4_8_VAW1
    SolutionIndex: 122
    SolutionNameMin: Cijk_Ailk_Bjlk_HSS_BH_MT64x64x4_SE_GSU7_PGR1_PLR0_TT4_4_VAW1
    SolutionIndex: 123
    SolutionNameMin: Cijk_Ailk_Bjlk_HSS_BH_MT64x128x8_SE_GSU7_PGR1_PLR0_TT4_8_VAW1
    SolutionIndex: 124
    SolutionNameMin: Cijk_Ailk_Bjlk_HSS_BH_MT64x64x8_SE_GSU7_PGR1_PLR0_TT4_4_VAW1
    SolutionIndex: 125
    SolutionNameMin: Cijk_Ailk_Bjlk_HSS_BH_MT64x64x16_SE_GSU7_PGR1_PLR0_TT4_4_VAW1
    SolutionIndex: 126
    SolutionNameMin: Cijk_Ailk_Bjlk_HSS_BH_MT64x64x16_SE_GSU7_PGR1_PLR1_TT4_4_VAW1
- - - [64, 64, 1, 256, 64, 64, 64, 64]
    - [52, 95.0]
  - - [128, 64, 1, 256, 128, 128, 128, 64]
    - [38, 137.0]
  - - [64, 128, 1, 256, 64, 64, 64, 128]
    - [10, 114.0]
  - - [128, 128, 1, 256, 128, 128, 128, 128]
    - [24, 375.0]
  - - [64, 256, 1, 256, 64, 64, 64, 256]
    - [19, 377.0]
  - - [128, 256, 1, 256, 128, 128, 128, 256]
    - [24, 740.0]
  - - [64, 448, 1, 256, 64, 64, 64, 448]
    - [20, 661.0]
  - - [128, 448, 1, 256, 128, 128, 128, 448]
    - [19, 1270.0]
  - - [64, 704, 1, 256, 64, 64, 64, 704]
    - [19, 992.0]
  - - [128, 704, 1, 256, 128, 128, 128, 704]
    - [20, 1843.0]
  - - [64, 1024, 1, 256, 64, 64, 64, 1024]
    - [25, 1340.0]
  - - [128, 1024, 1, 256, 128, 128, 128, 1024]
    - [20, 2299.0]
  - - [64, 1408, 1, 256, 64, 64, 64, 1408]
    - [22, 1800.0]
  - - [128, 1408, 1, 256, 128, 128, 128, 1408]
    - [5, 2732.0]
  - - [64, 1856, 1, 256, 64, 64, 64, 1856]
    - [22, 2105.0]
  - - [128, 1856, 1, 256, 128, 128, 128, 1856]
    - [13, 2911.0]
  - - [64, 2368, 1, 256, 64, 64, 64, 2368]
    - [28, 2645.0]
  - - [128, 2368, 1, 256, 128, 128, 128, 2368]
    - [9, 3184.0]
  - - [64, 2944, 1, 256, 64, 64, 64, 2944]
    - [21, 2680.0]
  - - [128, 2944, 1, 256, 128, 128, 128, 2944]
    - [6, 3400.0]
  - - [64, 3584, 1, 256, 64, 64, 64, 3584]
    - [16, 3183.0]
  - - [128, 3584, 1, 256, 128, 128, 128, 3584]
    - [9, 4107.0]
  - - [64, 4288, 1, 256, 64, 64, 64, 4288]
    - [8, 2831.0]
  - - [128, 4288, 1, 256, 128, 128, 128, 4288]
    - [17, 3903.0]
  - - [64, 5056, 1, 256, 64, 64, 64, 5056]
    - [8, 2966.0]
  - - [128, 5056, 1, 256, 128, 128, 128, 5056]
    - [3, 3994.0]
  - - [64, 5888, 1, 256, 64, 64, 64, 5888]
    - [14, 3223.0]
  - - [128, 5888, 1, 256, 128, 128, 128, 5888]
    - [17, 3753.0]
  - - [64, 6784, 1, 256, 64, 64, 64, 6784]
    - [14, 3572.0]
  - - [128, 6784, 1, 256, 128, 128, 128, 6784]
    - [0, 4061.0]
  - - [64, 64, 1, 1280, 64, 64, 64, 64]
    - [28, 120.0]
  - - [128, 64, 1, 1280, 128, 128, 128, 64]
    - [19, 203.0]
  - - [64, 128, 1, 1280, 64, 64, 64, 128]
    - [5, 197.0]
  - - [128, 128, 1, 1280, 128, 128, 128, 128]
    - [34, 490.0]
  - - [64, 256, 1, 1280, 64, 64, 64, 256]
    - [31, 488.0]
  - - [128, 256, 1, 1280, 128, 128, 128, 256]
    - [24, 937.0]
  - - [64, 448, 1, 1280, 64, 64, 64, 448]
    - [36, 865.0]
  - - [128, 448, 1, 1280, 128, 128, 128, 448]
    - [33, 1720.0]
  - - [64, 704, 1, 1280, 64, 64, 64, 704]
    - [34, 1289.0]
  - - [128, 704, 1, 1280, 128, 128, 128, 704]
    - [33, 2410.0]
  - - [64, 1024, 1, 1280, 64, 64, 64, 1024]
    - [37, 1764.0]
  - - [128, 1024, 1, 1280, 128, 128, 128, 1024]
    - [20, 2835.0]
  - - [64, 1408, 1, 1280, 64, 64, 64, 1408]
    - [33, 2422.0]
  - - [128, 1408, 1, 1280, 128, 128, 128, 1408]
    - [23, 3261.0]
  - - [64, 1856, 1, 1280, 64, 64, 64, 1856]
    - [20, 2673.0]
  - - [128, 1856, 1, 1280, 128, 128, 128, 1856]
    - [6, 3359.0]
  - - [64, 2368, 1, 1280, 64, 64, 64, 2368]
    - [22, 3311.0]
  - - [128, 2368, 1, 1280, 128, 128, 128, 2368]
    - [9, 3977.0]
  - - [64, 2944, 1, 1280, 64, 64, 64, 2944]
    - [27, 3346.0]
  - - [128, 2944, 1, 1280, 128, 128, 128, 2944]
    - [14, 4155.0]
  - - [64, 3584, 1, 1280, 64, 64, 64, 3584]
    - [21, 4032.0]
  - - [128, 3584, 1, 1280, 128, 128, 128, 3584]
    - [9, 4816.0]
  - - [64, 4288, 1, 1280, 64, 64, 64, 4288]
    - [14, 3573.0]
  - - [128, 4288, 1, 1280, 128, 128, 128, 4288]
    - [9, 4633.0]
  - - [64, 5056, 1, 1280, 64, 64, 64, 5056]
    - [6, 3610.0]
  - - [128, 5056, 1, 1280, 128, 128, 128, 5056]
    - [45, 4812.0]
  - - [64, 5888, 1, 1280, 64, 64, 64, 5888]
    - [14, 3927.0]
  - - [128, 5888, 1, 1280, 128, 128, 128, 5888]
    - [17, 4751.0]
  - - [64, 6784, 1, 1280, 64, 64, 64, 6784]
    - [50, 4027.0]
  - - [128, 6784, 1, 1280, 128, 128, 128, 6784]
    - [3, 4918.0]
  - - [64, 64, 1, 3328, 64, 64, 64, 64]
    - [18, 115.0]
  - - [128, 64, 1, 3328, 128, 128, 128, 64]
    - [19, 237.0]
  - - [64, 128, 1, 3328, 64, 64, 64, 128]
    - [19, 237.0]
  - - [128, 128, 1, 3328, 128, 128, 128, 128]
    - [31, 518.0]
  - - [64, 256, 1, 3328, 64, 64, 64, 256]
    - [31, 520.0]
  - - [128, 256, 1, 3328, 128, 128, 128, 256]
    - [39, 1004.0]
  - - [64, 448, 1, 3328, 64, 64, 64, 448]
    - [32, 916.0]
  - - [128, 448, 1, 3328, 128, 128, 128, 448]
    - [33, 1822.0]
  - - [64, 704, 1, 3328, 64, 64, 64, 704]
    - [39, 1377.0]
  - - [128, 704, 1, 3328, 128, 128, 128, 704]
    - [37, 2585.0]
  - - [64, 1024, 1, 3328, 64, 64, 64, 1024]
    - [32, 1909.0]
  - - [128, 1024, 1, 3328, 128, 128, 128, 1024]
    - [20, 3089.0]
  - - [64, 1408, 1, 3328, 64, 64, 64, 1408]
    - [37, 2588.0]
  - - [128, 1408, 1, 3328, 128, 128, 128, 1408]
    - [20, 3454.0]
  - - [64, 1856, 1, 3328, 64, 64, 64, 1856]
    - [26, 2851.0]
  - - [128, 1856, 1, 3328, 128, 128, 128, 1856]
    - [26, 3505.0]
  - - [64, 2368, 1, 3328, 64, 64, 64, 2368]
    - [54, 3484.0]
  - - [128, 2368, 1, 3328, 128, 128, 128, 2368]
    - [9, 4109.0]
  - - [64, 2944, 1, 3328, 64, 64, 64, 2944]
    - [21, 3496.0]
  - - [128, 2944, 1, 3328, 128, 128, 128, 2944]
    - [6, 4355.0]
  - - [64, 3584, 1, 3328, 64, 64, 64, 3584]
    - [21, 4220.0]
  - - [128, 3584, 1, 3328, 128, 128, 128, 3584]
    - [14, 5050.0]
  - - [64, 4288, 1, 3328, 64, 64, 64, 4288]
    - [51, 3763.0]
  - - [128, 4288, 1, 3328, 128, 128, 128, 4288]
    - [17, 4822.0]
  - - [64, 5056, 1, 3328, 64, 64, 64, 5056]
    - [4, 3802.0]
  - - [128, 5056, 1, 3328, 128, 128, 128, 5056]
    - [45, 5003.0]
  - - [64, 5888, 1, 3328, 64, 64, 64, 5888]
    - [53, 3781.0]
  - - [128, 5888, 1, 3328, 128, 128, 128, 5888]
    - [17, 4854.0]
  - - [64, 6784, 1, 3328, 64, 64, 64, 6784]
    - [45, 4195.0]
  - - [128, 6784, 1, 3328, 128, 128, 128, 6784]
    - [0, 5104.0]
  - - [256, 64, 1, 256, 256, 256, 256, 64]
    - [19, 377.0]
  - - [448, 64, 1, 256, 448, 448, 448, 64]
    - [20, 656.0]
  - - [704, 64, 1, 256, 704, 704, 704, 64]
    - [30, 967.0]
  - - [1024, 64, 1, 256, 1024, 1024, 1024, 64]
    - [20, 1381.0]
  - - [1408, 64, 1, 256, 1408, 1408, 1408, 64]
    - [26, 1832.0]
  - - [1856, 64, 1, 256, 1856, 1856, 1856, 64]
    - [26, 2195.0]
  - - [2368, 64, 1, 256, 2368, 2368, 2368, 64]
    - [28, 2619.0]
  - - [2944, 64, 1, 256, 2944, 2944, 2944, 64]
    - [5, 2759.0]
  - - [3584, 64, 1, 256, 3584, 3584, 3584, 64]
    - [51, 3209.0]
  - - [4288, 64, 1, 256, 4288, 4288, 4288, 64]
    - [6, 2865.0]
  - - [5056, 64, 1, 256, 5056, 5056, 5056, 64]
    - [9, 3270.0]
  - - [5888, 64, 1, 256, 5888, 5888, 5888, 64]
    - [17, 3161.0]
  - - [6784, 64, 1, 256, 6784, 6784, 6784, 64]
    - [9, 3598.0]
  - - [256, 128, 1, 256, 256, 256, 256, 128]
    - [24, 731.0]
  - - [448, 128, 1, 256, 448, 448, 448, 128]
    - [28, 1295.0]
  - - [704, 128, 1, 256, 704, 704, 704, 128]
    - [22, 1843.0]
  - - [1024, 128, 1, 256, 1024, 1024, 1024, 128]
    - [20, 2335.0]
  - - [1408, 128, 1, 256, 1408, 1408, 1408, 128]
    - [5, 2708.0]
  - - [1856, 128, 1, 256, 1856, 1856, 1856, 128]
    - [5, 2901.0]
  - - [2368, 128, 1, 256, 2368, 2368, 2368, 128]
    - [9, 3155.0]
  - - [2944, 128, 1, 256, 2944, 2944, 2944, 128]
    - [6, 3427.0]
  - - [3584, 128, 1, 256, 3584, 3584, 3584, 128]
    - [9, 4076.0]
  - - [4288, 128, 1, 256, 4288, 4288, 4288, 128]
    - [9, 3809.0]
  - - [5056, 128, 1, 256, 5056, 5056, 5056, 128]
    - [0, 4096.0]
  - - [5888, 128, 1, 256, 5888, 5888, 5888, 128]
    - [15, 3842.0]
  - - [6784, 128, 1, 256, 6784, 6784, 6784, 128]
    - [7, 4174.0]
  - - [256, 64, 1, 1280, 256, 256, 256, 64]
    - [35, 493.0]
  - - [448, 64, 1, 1280, 448, 448, 448, 64]
    - [32, 865.0]
  - - [704, 64, 1, 1280, 704, 704, 704, 64]
    - [36, 1293.0]
  - - [1024, 64, 1, 1280, 1024, 1024, 1024, 64]
    - [32, 1786.0]
  - - [1408, 64, 1, 1280, 1408, 1408, 1408, 64]
    - [37, 2388.0]
  - - [1856, 64, 1, 1280, 1856, 1856, 1856, 64]
    - [26, 2755.0]
  - - [2368, 64, 1, 1280, 2368, 2368, 2368, 64]
    - [52, 3294.0]
  - - [2944, 64, 1, 1280, 2944, 2944, 2944, 64]
    - [23, 3349.0]
  - - [3584, 64, 1, 1280, 3584, 3584, 3584, 64]
    - [29, 3960.0]
  - - [4288, 64, 1, 1280, 4288, 4288, 4288, 64]
    - [9, 3507.0]
  - - [5056, 64, 1, 1280, 5056, 5056, 5056, 64]
    - [9, 3678.0]
  - - [5888, 64, 1, 1280, 5888, 5888, 5888, 64]
    - [17, 3934.0]
  - - [6784, 64, 1, 1280, 6784, 6784, 6784, 64]
    - [17, 4241.0]
  - - [256, 128, 1, 1280, 256, 256, 256, 128]
    - [31, 945.0]
  - - [448, 128, 1, 1280, 448, 448, 448, 128]
    - [33, 1700.0]
  - - [704, 128, 1, 1280, 704, 704, 704, 128]
    - [37, 2399.0]
  - - [1024, 128, 1, 1280, 1024, 1024, 1024, 128]
    - [20, 2968.0]
  - - [1408, 128, 1, 1280, 1408, 1408, 1408, 128]
    - [26, 3345.0]
  - - [1856, 128, 1, 1280, 1856, 1856, 1856, 128]
    - [5, 3485.0]
  - - [2368, 128, 1, 1280, 2368, 2368, 2368, 128]
    - [4, 3977.0]
  - - [2944, 128, 1, 1280, 2944, 2944, 2944, 128]
    - [14, 4145.0]
  - - [3584, 128, 1, 1280, 3584, 3584, 3584, 128]
    - [17, 4716.0]
  - - [4288, 128, 1, 1280, 4288, 4288, 4288, 128]
    - [17, 4577.0]
  - - [5056, 128, 1, 1280, 5056, 5056, 5056, 128]
    - [45, 4873.0]
  - - [5888, 128, 1, 1280, 5888, 5888, 5888, 128]
    - [17, 4765.0]
  - - [6784, 128, 1, 1280, 6784, 6784, 6784, 128]
    - [45, 5010.0]
  - - [256, 64, 1, 3328, 256, 256, 256, 64]
    - [31, 518.0]
  - - [448, 64, 1, 3328, 448, 448, 448, 64]
    - [32, 910.0]
  - - [704, 64, 1, 3328, 704, 704, 704, 64]
    - [39, 1371.0]
  - - [1024, 64, 1, 3328, 1024, 1024, 1024, 64]
    - [32, 1924.0]
  - - [1408, 64, 1, 3328, 1408, 1408, 1408, 64]
    - [37, 2546.0]
  - - [1856, 64, 1, 3328, 1856, 1856, 1856, 64]
    - [26, 2883.0]
  - - [2368, 64, 1, 3328, 2368, 2368, 2368, 64]
    - [52, 3320.0]
  - - [2944, 64, 1, 3328, 2944, 2944, 2944, 64]
    - [23, 3549.0]
  - - [3584, 64, 1, 3328, 3584, 3584, 3584, 64]
    - [23, 4225.0]
  - - [4288, 64, 1, 3328, 4288, 4288, 4288, 64]
    - [9, 3583.0]
  - - [5056, 64, 1, 3328, 5056, 5056, 5056, 64]
    - [9, 3731.0]
  - - [5888, 64, 1, 3328, 5888, 5888, 5888, 64]
    - [17, 4008.0]
  - - [6784, 64, 1, 3328, 6784, 6784, 6784, 64]
    - [17, 4409.0]
  - - [256, 128, 1, 3328, 256, 256, 256, 128]
    - [39, 1004.0]
  - - [448, 128, 1, 3328, 448, 448, 448, 128]
    - [33, 1812.0]
  - - [704, 128, 1, 3328, 704, 704, 704, 128]
    - [37, 2572.0]
  - - [1024, 128, 1, 3328, 1024, 1024, 1024, 128]
    - [20, 3114.0]
  - - [1408, 128, 1, 3328, 1408, 1408, 1408, 128]
    - [26, 3456.0]
  - - [1856, 128, 1, 3328, 1856, 1856, 1856, 128]
    - [13, 3542.0]
  - - [2368, 128, 1, 3328, 2368, 2368, 2368, 128]
    - [11, 4077.0]
  - - [2944, 128, 1, 3328, 2944, 2944, 2944, 128]
    - [14, 4307.0]
  - - [3584, 128, 1, 3328, 3584, 3584, 3584, 128]
    - [14, 4961.0]
  - - [4288, 128, 1, 3328, 4288, 4288, 4288, 128]
    - [17, 4747.0]
  - - [5056, 128, 1, 3328, 5056, 5056, 5056, 128]
    - [45, 5030.0]
  - - [5888, 128, 1, 3328, 5888, 5888, 5888, 128]
    - [17, 4887.0]
  - - [6784, 128, 1, 3328, 6784, 6784, 6784, 128]
    - [45, 5213.0]
  - - [256, 256, 1, 256, 256, 256, 256, 256]
    - [20, 1389.0]
  - - [448, 256, 1, 256, 448, 448, 448, 256]
    - [22, 2331.0]
  - - [256, 448, 1, 256, 256, 256, 256, 448]
    - [22, 2345.0]
  - - [448, 448, 1, 256, 448, 448, 448, 448]
    - [20, 3042.0]
  - - [256, 256, 1, 1280, 256, 256, 256, 256]
    - [37, 1767.0]
  - - [448, 256, 1, 1280, 448, 448, 448, 256]
    - [37, 2989.0]
  - - [256, 448, 1, 1280, 256, 256, 256, 448]
    - [37, 3053.0]
  - - [448, 448, 1, 1280, 448, 448, 448, 448]
    - [26, 3725.0]
  - - [256, 256, 1, 3328, 256, 256, 256, 256]
    - [32, 1913.0]
  - - [448, 256, 1, 3328, 448, 448, 448, 256]
    - [37, 3249.0]
  - - [256, 448, 1, 3328, 256, 256, 256, 448]
    - [37, 3278.0]
  - - [448, 448, 1, 3328, 448, 448, 448, 448]
    - [20, 3824.0]
  - - [512, 16, 1, 512, 512, 512, 512, 16]
    - [23, 157.0]
  - - [512, 32, 1, 512, 512, 512, 512, 32]
    - [24, 432.0]
  - - [1024, 16, 1, 512, 1024, 1024, 1024, 16]
    - [34, 423.0]
  - - [1024, 32, 1, 512, 1024, 1024, 1024, 32]
    - [32, 833.0]
  - - [704, 256, 1, 256, 704, 704, 704, 256]
    - [12, 1635.0]
  - - [1024, 256, 1, 256, 1024, 1024, 1024, 256]
    - [45, 2305.0]
  - - [1408, 256, 1, 256, 1408, 1408, 1408, 256]
    - [45, 2910.0]
  - - [1856, 256, 1, 256, 1856, 1856, 1856, 256]
    - [45, 3128.0]
  - - [2368, 256, 1, 256, 2368, 2368, 2368, 256]
    - [45, 3851.0]
  - - [2944, 256, 1, 256, 2944, 2944, 2944, 256]
    - [50, 3934.0]
  - - [3584, 256, 1, 256, 3584, 3584, 3584, 256]
    - [50, 4460.0]
  - - [4288, 256, 1, 256, 4288, 4288, 4288, 256]
    - [45, 4196.0]
  - - [5056, 256, 1, 256, 5056, 5056, 5056, 256]
    - [50, 4228.0]
  - - [5888, 256, 1, 256, 5888, 5888, 5888, 256]
    - [50, 4197.0]
  - - [6784, 256, 1, 256, 6784, 6784, 6784, 256]
    - [48, 4403.0]
  - - [704, 448, 1, 256, 704, 704, 704, 448]
    - [45, 2595.0]
  - - [1024, 448, 1, 256, 1024, 1024, 1024, 448]
    - [45, 3477.0]
  - - [1408, 448, 1, 256, 1408, 1408, 1408, 448]
    - [45, 4022.0]
  - - [1856, 448, 1, 256, 1856, 1856, 1856, 448]
    - [45, 4232.0]
  - - [2368, 448, 1, 256, 2368, 2368, 2368, 448]
    - [45, 4224.0]
  - - [2944, 448, 1, 256, 2944, 2944, 2944, 448]
    - [50, 4417.0]
  - - [3584, 448, 1, 256, 3584, 3584, 3584, 448]
    - [45, 4393.0]
  - - [4288, 448, 1, 256, 4288, 4288, 4288, 448]
    - [45, 4414.0]
  - - [5056, 448, 1, 256, 5056, 5056, 5056, 448]
    - [50, 4643.0]
  - - [5888, 448, 1, 256, 5888, 5888, 5888, 448]
    - [48, 4583.0]
  - - [6784, 448, 1, 256, 6784, 6784, 6784, 448]
    - [48, 4619.0]
  - - [256, 704, 1, 256, 256, 256, 256, 704]
    - [12, 1630.0]
  - - [448, 704, 1, 256, 448, 448, 448, 704]
    - [45, 2595.0]
  - - [704, 704, 1, 256, 704, 704, 704, 704]
    - [45, 3307.0]
  - - [1024, 704, 1, 256, 1024, 1024, 1024, 704]
    - [50, 3707.0]
  - - [1408, 704, 1, 256, 1408, 1408, 1408, 704]
    - [45, 4054.0]
  - - [1856, 704, 1, 256, 1856, 1856, 1856, 704]
    - [50, 4423.0]
  - - [2368, 704, 1, 256, 2368, 2368, 2368, 704]
    - [50, 4473.0]
  - - [2944, 704, 1, 256, 2944, 2944, 2944, 704]
    - [45, 4471.0]
  - - [3584, 704, 1, 256, 3584, 3584, 3584, 704]
    - [45, 4391.0]
  - - [4288, 704, 1, 256, 4288, 4288, 4288, 704]
    - [45, 4542.0]
  - - [5056, 704, 1, 256, 5056, 5056, 5056, 704]
    - [45, 4644.0]
  - - [5888, 704, 1, 256, 5888, 5888, 5888, 704]
    - [48, 4668.0]
  - - [6784, 704, 1, 256, 6784, 6784, 6784, 704]
    - [48, 4827.0]
  - - [256, 1024, 1, 256, 256, 256, 256, 1024]
    - [45, 2288.0]
  - - [448, 1024, 1, 256, 448, 448, 448, 1024]
    - [45, 3678.0]
  - - [704, 1024, 1, 256, 704, 704, 704, 1024]
    - [45, 3851.0]
  - - [1024, 1024, 1, 256, 1024, 1024, 1024, 1024]
    - [12, 3664.0]
  - - [1408, 1024, 1, 256, 1408, 1408, 1408, 1024]
    - [50, 4367.0]
  - - [1856, 1024, 1, 256, 1856, 1856, 1856, 1024]
    - [45, 4486.0]
  - - [2368, 1024, 1, 256, 2368, 2368, 2368, 1024]
    - [45, 4724.0]
  - - [2944, 1024, 1, 256, 2944, 2944, 2944, 1024]
    - [45, 4661.0]
  - - [3584, 1024, 1, 256, 3584, 3584, 3584, 1024]
    - [48, 4599.0]
  - - [4288, 1024, 1, 256, 4288, 4288, 4288, 1024]
    - [45, 4831.0]
  - - [5056, 1024, 1, 256, 5056, 5056, 5056, 1024]
    - [46, 5003.0]
  - - [5888, 1024, 1, 256, 5888, 5888, 5888, 1024]
    - [48, 5048.0]
  - - [6784, 1024, 1, 256, 6784, 6784, 6784, 1024]
    - [48, 5190.0]
  - - [256, 1408, 1, 256, 256, 256, 256, 1408]
    - [50, 2870.0]
  - - [448, 1408, 1, 256, 448, 448, 448, 1408]
    - [45, 4075.0]
  - - [704, 1408, 1, 256, 704, 704, 704, 1408]
    - [50, 4068.0]
  - - [1024, 1408, 1, 256, 1024, 1024, 1024, 1408]
    - [45, 4031.0]
  - - [1408, 1408, 1, 256, 1408, 1408, 1408, 1408]
    - [45, 4771.0]
  - - [1856, 1408, 1, 256, 1856, 1856, 1856, 1408]
    - [45, 4786.0]
  - - [2368, 1408, 1, 256, 2368, 2368, 2368, 1408]
    - [45, 4907.0]
  - - [2944, 1408, 1, 256, 2944, 2944, 2944, 1408]
    - [45, 4838.0]
  - - [3584, 1408, 1, 256, 3584, 3584, 3584, 1408]
    - [48, 4875.0]
  - - [4288, 1408, 1, 256, 4288, 4288, 4288, 1408]
    - [45, 5057.0]
  - - [5056, 1408, 1, 256, 5056, 5056, 5056, 1408]
    - [46, 5084.0]
  - - [5888, 1408, 1, 256, 5888, 5888, 5888, 1408]
    - [48, 5215.0]
  - - [6784, 1408, 1, 256, 6784, 6784, 6784, 1408]
    - [48, 5383.0]
  - - [256, 1856, 1, 256, 256, 256, 256, 1856]
    - [45, 3086.0]
  - - [448, 1856, 1, 256, 448, 448, 448, 1856]
    - [45, 4321.0]
  - - [704, 1856, 1, 256, 704, 704, 704, 1856]
    - [45, 4580.0]
  - - [1024, 1856, 1, 256, 1024, 1024, 1024, 1856]
    - [45, 4126.0]
  - - [1408, 1856, 1, 256, 1408, 1408, 1408, 1856]
    - [45, 4884.0]
  - - [1856, 1856, 1, 256, 1856, 1856, 1856, 1856]
    - [45, 4996.0]
  - - [2368, 1856, 1, 256, 2368, 2368, 2368, 1856]
    - [45, 5063.0]
  - - [2944, 1856, 1, 256, 2944, 2944, 2944, 1856]
    - [48, 5145.0]
  - - [3584, 1856, 1, 256, 3584, 3584, 3584, 1856]
    - [48, 5116.0]
  - - [4288, 1856, 1, 256, 4288, 4288, 4288, 1856]
    - [45, 5159.0]
  - - [5056, 1856, 1, 256, 5056, 5056, 5056, 1856]
    - [45, 5177.0]
  - - [5888, 1856, 1, 256, 5888, 5888, 5888, 1856]
    - [48, 5428.0]
  - - [6784, 1856, 1, 256, 6784, 6784, 6784, 1856]
    - [48, 5508.0]
  - - [256, 2368, 1, 256, 256, 256, 256, 2368]
    - [45, 3865.0]
  - - [448, 2368, 1, 256, 448, 448, 448, 2368]
    - [45, 4204.0]
  - - [704, 2368, 1, 256, 704, 704, 704, 2368]
    - [50, 4594.0]
  - - [1024, 2368, 1, 256, 1024, 1024, 1024, 2368]
    - [45, 4632.0]
  - - [1408, 2368, 1, 256, 1408, 1408, 1408, 2368]
    - [45, 5121.0]
  - - [1856, 2368, 1, 256, 1856, 1856, 1856, 2368]
    - [45, 5116.0]
  - - [2368, 2368, 1, 256, 2368, 2368, 2368, 2368]
    - [45, 5180.0]
  - - [2944, 2368, 1, 256, 2944, 2944, 2944, 2368]
    - [48, 5191.0]
  - - [3584, 2368, 1, 256, 3584, 3584, 3584, 2368]
    - [48, 5235.0]
  - - [4288, 2368, 1, 256, 4288, 4288, 4288, 2368]
    - [48, 5219.0]
  - - [5056, 2368, 1, 256, 5056, 5056, 5056, 2368]
    - [48, 5276.0]
  - - [5888, 2368, 1, 256, 5888, 5888, 5888, 2368]
    - [48, 5462.0]
  - - [6784, 2368, 1, 256, 6784, 6784, 6784, 2368]
    - [48, 5576.0]
  - - [256, 2944, 1, 256, 256, 256, 256, 2944]
    - [45, 3859.0]
  - - [448, 2944, 1, 256, 448, 448, 448, 2944]
    - [50, 4558.0]
  - - [704, 2944, 1, 256, 704, 704, 704, 2944]
    - [45, 4694.0]
  - - [1024, 2944, 1, 256, 1024, 1024, 1024, 2944]
    - [45, 4691.0]
  - - [1408, 2944, 1, 256, 1408, 1408, 1408, 2944]
    - [45, 5111.0]
  - - [1856, 2944, 1, 256, 1856, 1856, 1856, 2944]
    - [45, 5200.0]
  - - [2368, 2944, 1, 256, 2368, 2368, 2368, 2944]
    - [45, 5237.0]
  - - [2944, 2944, 1, 256, 2944, 2944, 2944, 2944]
    - [48, 5384.0]
  - - [3584, 2944, 1, 256, 3584, 3584, 3584, 2944]
    - [48, 5369.0]
  - - [4288, 2944, 1, 256, 4288, 4288, 4288, 2944]
    - [46, 5462.0]
  - - [5056, 2944, 1, 256, 5056, 5056, 5056, 2944]
    - [46, 5512.0]
  - - [5888, 2944, 1, 256, 5888, 5888, 5888, 2944]
    - [48, 5592.0]
  - - [6784, 2944, 1, 256, 6784, 6784, 6784, 2944]
    - [48, 5661.0]
  - - [256, 3584, 1, 256, 256, 256, 256, 3584]
    - [45, 4466.0]
  - - [448, 3584, 1, 256, 448, 448, 448, 3584]
    - [45, 4767.0]
  - - [704, 3584, 1, 256, 704, 704, 704, 3584]
    - [45, 5108.0]
  - - [1024, 3584, 1, 256, 1024, 1024, 1024, 3584]
    - [45, 4863.0]
  - - [1408, 3584, 1, 256, 1408, 1408, 1408, 3584]
    - [45, 5286.0]
  - - [1856, 3584, 1, 256, 1856, 1856, 1856, 3584]
    - [45, 5226.0]
  - - [2368, 3584, 1, 256, 2368, 2368, 2368, 3584]
    - [45, 5298.0]
  - - [2944, 3584, 1, 256, 2944, 2944, 2944, 3584]
    - [48, 5461.0]
  - - [3584, 3584, 1, 256, 3584, 3584, 3584, 3584]
    - [48, 5425.0]
  - - [4288, 3584, 1, 256, 4288, 4288, 4288, 3584]
    - [46, 5503.0]
  - - [5056, 3584, 1, 256, 5056, 5056, 5056, 3584]
    - [46, 5563.0]
  - - [5888, 3584, 1, 256, 5888, 5888, 5888, 3584]
    - [48, 5645.0]
  - - [6784, 3584, 1, 256, 6784, 6784, 6784, 3584]
    - [48, 5718.0]
  - - [256, 4288, 1, 256, 256, 256, 256, 4288]
    - [45, 4178.0]
  - - [448, 4288, 1, 256, 448, 448, 448, 4288]
    - [45, 4678.0]
  - - [704, 4288, 1, 256, 704, 704, 704, 4288]
    - [45, 4996.0]
  - - [1024, 4288, 1, 256, 1024, 1024, 1024, 4288]
    - [45, 5070.0]
  - - [1408, 4288, 1, 256, 1408, 1408, 1408, 4288]
    - [45, 5327.0]
  - - [1856, 4288, 1, 256, 1856, 1856, 1856, 4288]
    - [45, 5370.0]
  - - [2368, 4288, 1, 256, 2368, 2368, 2368, 4288]
    - [45, 5365.0]
  - - [2944, 4288, 1, 256, 2944, 2944, 2944, 4288]
    - [48, 5509.0]
  - - [3584, 4288, 1, 256, 3584, 3584, 3584, 4288]
    - [48, 5495.0]
  - - [4288, 4288, 1, 256, 4288, 4288, 4288, 4288]
    - [46, 5427.0]
  - - [5056, 4288, 1, 256, 5056, 5056, 5056, 4288]
    - [46, 5497.0]
  - - [5888, 4288, 1, 256, 5888, 5888, 5888, 4288]
    - [48, 5673.0]
  - - [6784, 4288, 1, 256, 6784, 6784, 6784, 4288]
    - [48, 5716.0]
  - - [256, 5056, 1, 256, 256, 256, 256, 5056]
    - [45, 4360.0]
  - - [448, 5056, 1, 256, 448, 448, 448, 5056]
    - [50, 4914.0]
  - - [704, 5056, 1, 256, 704, 704, 704, 5056]
    - [45, 5181.0]
  - - [1024, 5056, 1, 256, 1024, 1024, 1024, 5056]
    - [45, 5125.0]
  - - [1408, 5056, 1, 256, 1408, 1408, 1408, 5056]
    - [45, 5353.0]
  - - [1856, 5056, 1, 256, 1856, 1856, 1856, 5056]
    - [45, 5428.0]
  - - [2368, 5056, 1, 256, 2368, 2368, 2368, 5056]
    - [45, 5407.0]
  - - [2944, 5056, 1, 256, 2944, 2944, 2944, 5056]
    - [48, 5559.0]
  - - [3584, 5056, 1, 256, 3584, 3584, 3584, 5056]
    - [48, 5527.0]
  - - [4288, 5056, 1, 256, 4288, 4288, 4288, 5056]
    - [46, 5539.0]
  - - [5056, 5056, 1, 256, 5056, 5056, 5056, 5056]
    - [46, 5566.0]
  - - [5888, 5056, 1, 256, 5888, 5888, 5888, 5056]
    - [48, 5715.0]
  - - [6784, 5056, 1, 256, 6784, 6784, 6784, 5056]
    - [48, 5751.0]
  - - [256, 5888, 1, 256, 256, 256, 256, 5888]
    - [45, 4445.0]
  - - [448, 5888, 1, 256, 448, 448, 448, 5888]
    - [45, 4864.0]
  - - [704, 5888, 1, 256, 704, 704, 704, 5888]
    - [45, 5158.0]
  - - [1024, 5888, 1, 256, 1024, 1024, 1024, 5888]
    - [45, 5104.0]
  - - [1408, 5888, 1, 256, 1408, 1408, 1408, 5888]
    - [45, 5410.0]
  - - [1856, 5888, 1, 256, 1856, 1856, 1856, 5888]
    - [45, 5408.0]
  - - [2368, 5888, 1, 256, 2368, 2368, 2368, 5888]
    - [46, 5502.0]
  - - [2944, 5888, 1, 256, 2944, 2944, 2944, 5888]
    - [48, 5613.0]
  - - [3584, 5888, 1, 256, 3584, 3584, 3584, 5888]
    - [48, 5593.0]
  - - [4288, 5888, 1, 256, 4288, 4288, 4288, 5888]
    - [46, 5656.0]
  - - [5056, 5888, 1, 256, 5056, 5056, 5056, 5888]
    - [46, 5688.0]
  - - [5888, 5888, 1, 256, 5888, 5888, 5888, 5888]
    - [48, 5732.0]
  - - [6784, 5888, 1, 256, 6784, 6784, 6784, 5888]
    - [48, 5782.0]
  - - [256, 6784, 1, 256, 256, 256, 256, 6784]
    - [45, 4492.0]
  - - [448, 6784, 1, 256, 448, 448, 448, 6784]
    - [45, 4938.0]
  - - [704, 6784, 1, 256, 704, 704, 704, 6784]
    - [45, 5352.0]
  - - [1024, 6784, 1, 256, 1024, 1024, 1024, 6784]
    - [45, 5168.0]
  - - [1408, 6784, 1, 256, 1408, 1408, 1408, 6784]
    - [45, 5499.0]
  - - [1856, 6784, 1, 256, 1856, 1856, 1856, 6784]
    - [46, 5449.0]
  - - [2368, 6784, 1, 256, 2368, 2368, 2368, 6784]
    - [46, 5530.0]
  - - [2944, 6784, 1, 256, 2944, 2944, 2944, 6784]
    - [48, 5635.0]
  - - [3584, 6784, 1, 256, 3584, 3584, 3584, 6784]
    - [48, 5592.0]
  - - [4288, 6784, 1, 256, 4288, 4288, 4288, 6784]
    - [46, 5685.0]
  - - [5056, 6784, 1, 256, 5056, 5056, 5056, 6784]
    - [46, 5723.0]
  - - [5888, 6784, 1, 256, 5888, 5888, 5888, 6784]
    - [48, 5737.0]
  - - [6784, 6784, 1, 256, 6784, 6784, 6784, 6784]
    - [48, 5778.0]
  - - [704, 256, 1, 1280, 704, 704, 704, 256]
    - [45, 2164.0]
  - - [1024, 256, 1, 1280, 1024, 1024, 1024, 256]
    - [50, 2596.0]
  - - [1408, 256, 1, 1280, 1408, 1408, 1408, 256]
    - [50, 3509.0]
  - - [1856, 256, 1, 1280, 1856, 1856, 1856, 256]
    - [45, 3620.0]
  - - [2368, 256, 1, 1280, 2368, 2368, 2368, 256]
    - [45, 4584.0]
  - - [2944, 256, 1, 1280, 2944, 2944, 2944, 256]
    - [45, 4481.0]
  - - [3584, 256, 1, 1280, 3584, 3584, 3584, 256]
    - [50, 5403.0]
  - - [4288, 256, 1, 1280, 4288, 4288, 4288, 256]
    - [45, 5069.0]
  - - [5056, 256, 1, 1280, 5056, 5056, 5056, 256]
    - [45, 5130.0]
  - - [5888, 256, 1, 1280, 5888, 5888, 5888, 256]
    - [45, 5217.0]
  - - [6784, 256, 1, 1280, 6784, 6784, 6784, 256]
    - [45, 5327.0]
  - - [704, 448, 1, 1280, 704, 704, 704, 448]
    - [50, 3075.0]
  - - [1024, 448, 1, 1280, 1024, 1024, 1024, 448]
    - [50, 4367.0]
  - - [1408, 448, 1, 1280, 1408, 1408, 1408, 448]
    - [45, 4774.0]
  - - [1856, 448, 1, 1280, 1856, 1856, 1856, 448]
    - [45, 4932.0]
  - - [2368, 448, 1, 1280, 2368, 2368, 2368, 448]
    - [45, 4903.0]
  - - [2944, 448, 1, 1280, 2944, 2944, 2944, 448]
    - [45, 5260.0]
  - - [3584, 448, 1, 1280, 3584, 3584, 3584, 448]
    - [45, 5568.0]
  - - [4288, 448, 1, 1280, 4288, 4288, 4288, 448]
    - [45, 5256.0]
  - - [5056, 448, 1, 1280, 5056, 5056, 5056, 448]
    - [45, 5637.0]
  - - [5888, 448, 1, 1280, 5888, 5888, 5888, 448]
    - [45, 5506.0]
  - - [6784, 448, 1, 1280, 6784, 6784, 6784, 448]
    - [45, 5479.0]
  - - [256, 704, 1, 1280, 256, 256, 256, 704]
    - [45, 2126.0]
  - - [448, 704, 1, 1280, 448, 448, 448, 704]
    - [50, 3062.0]
  - - [704, 704, 1, 1280, 704, 704, 704, 704]
    - [45, 3774.0]
  - - [1024, 704, 1, 1280, 1024, 1024, 1024, 704]
    - [12, 4244.0]
  - - [1408, 704, 1, 1280, 1408, 1408, 1408, 704]
    - [45, 4566.0]
  - - [1856, 704, 1, 1280, 1856, 1856, 1856, 704]
    - [45, 5194.0]
  - - [2368, 704, 1, 1280, 2368, 2368, 2368, 704]
    - [45, 5100.0]
  - - [2944, 704, 1, 1280, 2944, 2944, 2944, 704]
    - [45, 5132.0]
  - - [3584, 704, 1, 1280, 3584, 3584, 3584, 704]
    - [45, 5642.0]
  - - [4288, 704, 1, 1280, 4288, 4288, 4288, 704]
    - [45, 5441.0]
  - - [5056, 704, 1, 1280, 5056, 5056, 5056, 704]
    - [45, 5638.0]
  - - [5888, 704, 1, 1280, 5888, 5888, 5888, 704]
    - [45, 5533.0]
  - - [6784, 704, 1, 1280, 6784, 6784, 6784, 704]
    - [45, 5770.0]
  - - [256, 1024, 1, 1280, 256, 256, 256, 1024]
    - [45, 2593.0]
  - - [448, 1024, 1, 1280, 448, 448, 448, 1024]
    - [50, 4372.0]
  - - [704, 1024, 1, 1280, 704, 704, 704, 1024]
    - [45, 4276.0]
  - - [1024, 1024, 1, 1280, 1024, 1024, 1024, 1024]
    - [45, 4415.0]
  - - [1408, 1024, 1, 1280, 1408, 1408, 1408, 1024]
    - [45, 4876.0]
  - - [1856, 1024, 1, 1280, 1856, 1856, 1856, 1024]
    - [45, 4964.0]
  - - [2368, 1024, 1, 1280, 2368, 2368, 2368, 1024]
    - [45, 5304.0]
  - - [2944, 1024, 1, 1280, 2944, 2944, 2944, 1024]
    - [46, 5255.0]
  - - [3584, 1024, 1, 1280, 3584, 3584, 3584, 1024]
    - [46, 5533.0]
  - - [4288, 1024, 1, 1280, 4288, 4288, 4288, 1024]
    - [46, 5484.0]
  - - [5056, 1024, 1, 1280, 5056, 5056, 5056, 1024]
    - [45, 5558.0]
  - - [5888, 1024, 1, 1280, 5888, 5888, 5888, 1024]
    - [50, 5427.0]
  - - [6784, 1024, 1, 1280, 6784, 6784, 6784, 1024]
    - [46, 5507.0]
  - - [256, 1408, 1, 1280, 256, 256, 256, 1408]
    - [50, 3507.0]
  - - [448, 1408, 1, 1280, 448, 448, 448, 1408]
    - [45, 4702.0]
  - - [704, 1408, 1, 1280, 704, 704, 704, 1408]
    - [45, 4518.0]
  - - [1024, 1408, 1, 1280, 1024, 1024, 1024, 1408]
    - [1, 4638.0]
  - - [1408, 1408, 1, 1280, 1408, 1408, 1408, 1408]
    - [45, 5198.0]
  - - [1856, 1408, 1, 1280, 1856, 1856, 1856, 1408]
    - [50, 5317.0]
  - - [2368, 1408, 1, 1280, 2368, 2368, 2368, 1408]
    - [45, 5532.0]
  - - [2944, 1408, 1, 1280, 2944, 2944, 2944, 1408]
    - [45, 5487.0]
  - - [3584, 1408, 1, 1280, 3584, 3584, 3584, 1408]
    - [45, 5739.0]
  - - [4288, 1408, 1, 1280, 4288, 4288, 4288, 1408]
    - [45, 5733.0]
  - - [5056, 1408, 1, 1280, 5056, 5056, 5056, 1408]
    - [45, 5744.0]
  - - [5888, 1408, 1, 1280, 5888, 5888, 5888, 1408]
    - [45, 5771.0]
  - - [6784, 1408, 1, 1280, 6784, 6784, 6784, 1408]
    - [45, 5867.0]
  - - [256, 1856, 1, 1280, 256, 256, 256, 1856]
    - [45, 3590.0]
  - - [448, 1856, 1, 1280, 448, 448, 448, 1856]
    - [45, 4780.0]
  - - [704, 1856, 1, 1280, 704, 704, 704, 1856]
    - [45, 4944.0]
  - - [1024, 1856, 1, 1280, 1024, 1024, 1024, 1856]
    - [50, 4719.0]
  - - [1408, 1856, 1, 1280, 1408, 1408, 1408, 1856]
    - [50, 5246.0]
  - - [1856, 1856, 1, 1280, 1856, 1856, 1856, 1856]
    - [50, 5364.0]
  - - [2368, 1856, 1, 1280, 2368, 2368, 2368, 1856]
    - [45, 5570.0]
  - - [2944, 1856, 1, 1280, 2944, 2944, 2944, 1856]
    - [45, 5748.0]
  - - [3584, 1856, 1, 1280, 3584, 3584, 3584, 1856]
    - [45, 5806.0]
  - - [4288, 1856, 1, 1280, 4288, 4288, 4288, 1856]
    - [45, 5857.0]
  - - [5056, 1856, 1, 1280, 5056, 5056, 5056, 1856]
    - [45, 5918.0]
  - - [5888, 1856, 1, 1280, 5888, 5888, 5888, 1856]
    - [45, 5875.0]
  - - [6784, 1856, 1, 1280, 6784, 6784, 6784, 1856]
    - [45, 5925.0]
  - - [256, 2368, 1, 1280, 256, 256, 256, 2368]
    - [45, 4488.0]
  - - [448, 2368, 1, 1280, 448, 448, 448, 2368]
    - [45, 4536.0]
  - - [704, 2368, 1, 1280, 704, 704, 704, 2368]
    - [48, 4971.0]
  - - [1024, 2368, 1, 1280, 1024, 1024, 1024, 2368]
    - [48, 4839.0]
  - - [1408, 2368, 1, 1280, 1408, 1408, 1408, 2368]
    - [50, 5416.0]
  - - [1856, 2368, 1, 1280, 1856, 1856, 1856, 2368]
    - [50, 5496.0]
  - - [2368, 2368, 1, 1280, 2368, 2368, 2368, 2368]
    - [50, 5704.0]
  - - [2944, 2368, 1, 1280, 2944, 2944, 2944, 2368]
    - [50, 5731.0]
  - - [3584, 2368, 1, 1280, 3584, 3584, 3584, 2368]
    - [45, 5833.0]
  - - [4288, 2368, 1, 1280, 4288, 4288, 4288, 2368]
    - [45, 5832.0]
  - - [5056, 2368, 1, 1280, 5056, 5056, 5056, 2368]
    - [45, 5858.0]
  - - [5888, 2368, 1, 1280, 5888, 5888, 5888, 2368]
    - [45, 5911.0]
  - - [6784, 2368, 1, 1280, 6784, 6784, 6784, 2368]
    - [45, 5880.0]
  - - [256, 2944, 1, 1280, 256, 256, 256, 2944]
    - [45, 4400.0]
  - - [448, 2944, 1, 1280, 448, 448, 448, 2944]
    - [46, 4805.0]
  - - [704, 2944, 1, 1280, 704, 704, 704, 2944]
    - [48, 4905.0]
  - - [1024, 2944, 1, 1280, 1024, 1024, 1024, 2944]
    - [48, 5146.0]
  - - [1408, 2944, 1, 1280, 1408, 1408, 1408, 2944]
    - [50, 5391.0]
  - - [1856, 2944, 1, 1280, 1856, 1856, 1856, 2944]
    - [50, 5707.0]
  - - [2368, 2944, 1, 1280, 2368, 2368, 2368, 2944]
    - [45, 5759.0]
  - - [2944, 2944, 1, 1280, 2944, 2944, 2944, 2944]
    - [50, 5812.0]
  - - [3584, 2944, 1, 1280, 3584, 3584, 3584, 2944]
    - [48, 5815.0]
  - - [4288, 2944, 1, 1280, 4288, 4288, 4288, 2944]
    - [50, 5850.0]
  - - [5056, 2944, 1, 1280, 5056, 5056, 5056, 2944]
    - [45, 5947.0]
  - - [5888, 2944, 1, 1280, 5888, 5888, 5888, 2944]
    - [45, 5907.0]
  - - [6784, 2944, 1, 1280, 6784, 6784, 6784, 2944]
    - [45, 5913.0]
  - - [256, 3584, 1, 1280, 256, 256, 256, 3584]
    - [45, 5108.0]
  - - [448, 3584, 1, 1280, 448, 448, 448, 3584]
    - [48, 4807.0]
  - - [704, 3584, 1, 1280, 704, 704, 704, 3584]
    - [48, 5027.0]
  - - [1024, 3584, 1, 1280, 1024, 1024, 1024, 3584]
    - [48, 5469.0]
  - - [1408, 3584, 1, 1280, 1408, 1408, 1408, 3584]
    - [50, 5629.0]
  - - [1856, 3584, 1, 1280, 1856, 1856, 1856, 3584]
    - [50, 5767.0]
  - - [2368, 3584, 1, 1280, 2368, 2368, 2368, 3584]
    - [45, 5867.0]
  - - [2944, 3584, 1, 1280, 2944, 2944, 2944, 3584]
    - [48, 5869.0]
  - - [3584, 3584, 1, 1280, 3584, 3584, 3584, 3584]
    - [45, 5862.0]
  - - [4288, 3584, 1, 1280, 4288, 4288, 4288, 3584]
    - [50, 5935.0]
  - - [5056, 3584, 1, 1280, 5056, 5056, 5056, 3584]
    - [45, 5960.0]
  - - [5888, 3584, 1, 1280, 5888, 5888, 5888, 3584]
    - [48, 5942.0]
  - - [6784, 3584, 1, 1280, 6784, 6784, 6784, 3584]
    - [45, 5966.0]
  - - [256, 4288, 1, 1280, 256, 256, 256, 4288]
    - [45, 4651.0]
  - - [448, 4288, 1, 1280, 448, 448, 448, 4288]
    - [50, 4587.0]
  - - [704, 4288, 1, 1280, 704, 704, 704, 4288]
    - [50, 4969.0]
  - - [1024, 4288, 1, 1280, 1024, 1024, 1024, 4288]
    - [48, 5237.0]
  - - [1408, 4288, 1, 1280, 1408, 1408, 1408, 4288]
    - [50, 5610.0]
  - - [1856, 4288, 1, 1280, 1856, 1856, 1856, 4288]
    - [50, 5770.0]
  - - [2368, 4288, 1, 1280, 2368, 2368, 2368, 4288]
    - [50, 5817.0]
  - - [2944, 4288, 1, 1280, 2944, 2944, 2944, 4288]
    - [50, 5819.0]
  - - [3584, 4288, 1, 1280, 3584, 3584, 3584, 4288]
    - [45, 5875.0]
  - - [4288, 4288, 1, 1280, 4288, 4288, 4288, 4288]
    - [50, 5910.0]
  - - [5056, 4288, 1, 1280, 5056, 5056, 5056, 4288]
    - [45, 5945.0]
  - - [5888, 4288, 1, 1280, 5888, 5888, 5888, 4288]
    - [50, 5914.0]
  - - [6784, 4288, 1, 1280, 6784, 6784, 6784, 4288]
    - [50, 5956.0]
  - - [256, 5056, 1, 1280, 256, 256, 256, 5056]
    - [48, 4996.0]
  - - [448, 5056, 1, 1280, 448, 448, 448, 5056]
    - [50, 4867.0]
  - - [704, 5056, 1, 1280, 704, 704, 704, 5056]
    - [50, 5149.0]
  - - [1024, 5056, 1, 1280, 1024, 1024, 1024, 5056]
    - [48, 5207.0]
  - - [1408, 5056, 1, 1280, 1408, 1408, 1408, 5056]
    - [50, 5642.0]
  - - [1856, 5056, 1, 1280, 1856, 1856, 1856, 5056]
    - [50, 5840.0]
  - - [2368, 5056, 1, 1280, 2368, 2368, 2368, 5056]
    - [50, 5847.0]
  - - [2944, 5056, 1, 1280, 2944, 2944, 2944, 5056]
    - [50, 5904.0]
  - - [3584, 5056, 1, 1280, 3584, 3584, 3584, 5056]
    - [45, 5884.0]
  - - [4288, 5056, 1, 1280, 4288, 4288, 4288, 5056]
    - [45, 5942.0]
  - - [5056, 5056, 1, 1280, 5056, 5056, 5056, 5056]
    - [45, 5958.0]
  - - [5888, 5056, 1, 1280, 5888, 5888, 5888, 5056]
    - [48, 5960.0]
  - - [6784, 5056, 1, 1280, 6784, 6784, 6784, 5056]
    - [45, 6083.0]
  - - [256, 5888, 1, 1280, 256, 256, 256, 5888]
    - [48, 4498.0]
  - - [448, 5888, 1, 1280, 448, 448, 448, 5888]
    - [50, 4741.0]
  - - [704, 5888, 1, 1280, 704, 704, 704, 5888]
    - [50, 5029.0]
  - - [1024, 5888, 1, 1280, 1024, 1024, 1024, 5888]
    - [48, 5229.0]
  - - [1408, 5888, 1, 1280, 1408, 1408, 1408, 5888]
    - [50, 5704.0]
  - - [1856, 5888, 1, 1280, 1856, 1856, 1856, 5888]
    - [50, 5824.0]
  - - [2368, 5888, 1, 1280, 2368, 2368, 2368, 5888]
    - [50, 5895.0]
  - - [2944, 5888, 1, 1280, 2944, 2944, 2944, 5888]
    - [45, 5895.0]
  - - [3584, 5888, 1, 1280, 3584, 3584, 3584, 5888]
    - [48, 5913.0]
  - - [4288, 5888, 1, 1280, 4288, 4288, 4288, 5888]
    - [50, 5935.0]
  - - [5056, 5888, 1, 1280, 5056, 5056, 5056, 5888]
    - [45, 5976.0]
  - - [5888, 5888, 1, 1280, 5888, 5888, 5888, 5888]
    - [48, 6065.0]
  - - [6784, 5888, 1, 1280, 6784, 6784, 6784, 5888]
    - [50, 6172.0]
  - - [256, 6784, 1, 1280, 256, 256, 256, 6784]
    - [48, 5178.0]
  - - [448, 6784, 1, 1280, 448, 448, 448, 6784]
    - [50, 4636.0]
  - - [704, 6784, 1, 1280, 704, 704, 704, 6784]
    - [50, 5046.0]
  - - [1024, 6784, 1, 1280, 1024, 1024, 1024, 6784]
    - [48, 5244.0]
  - - [1408, 6784, 1, 1280, 1408, 1408, 1408, 6784]
    - [50, 5770.0]
  - - [1856, 6784, 1, 1280, 1856, 1856, 1856, 6784]
    - [50, 5860.0]
  - - [2368, 6784, 1, 1280, 2368, 2368, 2368, 6784]
    - [50, 5875.0]
  - - [2944, 6784, 1, 1280, 2944, 2944, 2944, 6784]
    - [50, 5898.0]
  - - [3584, 6784, 1, 1280, 3584, 3584, 3584, 6784]
    - [48, 5924.0]
  - - [4288, 6784, 1, 1280, 4288, 4288, 4288, 6784]
    - [45, 5964.0]
  - - [5056, 6784, 1, 1280, 5056, 5056, 5056, 6784]
    - [50, 6085.0]
  - - [5888, 6784, 1, 1280, 5888, 5888, 5888, 6784]
    - [45, 6198.0]
  - - [6784, 6784, 1, 1280, 6784, 6784, 6784, 6784]
    - [45, 6282.0]
  - - [704, 256, 1, 3328, 704, 704, 704, 256]
    - [45, 2437.0]
  - - [1024, 256, 1, 3328, 1024, 1024, 1024, 256]
    - [50, 2678.0]
  - - [1408, 256, 1, 3328, 1408, 1408, 1408, 256]
    - [50, 3646.0]
  - - [1856, 256, 1, 3328, 1856, 1856, 1856, 256]
    - [45, 3711.0]
  - - [2368, 256, 1, 3328, 2368, 2368, 2368, 256]
    - [45, 4720.0]
  - - [2944, 256, 1, 3328, 2944, 2944, 2944, 256]
    - [45, 4575.0]
  - - [3584, 256, 1, 3328, 3584, 3584, 3584, 256]
    - [50, 5543.0]
  - - [4288, 256, 1, 3328, 4288, 4288, 4288, 256]
    - [45, 5152.0]
  - - [5056, 256, 1, 3328, 5056, 5056, 5056, 256]
    - [45, 5238.0]
  - - [5888, 256, 1, 3328, 5888, 5888, 5888, 256]
    - [50, 5255.0]
  - - [6784, 256, 1, 3328, 6784, 6784, 6784, 256]
    - [50, 5380.0]
  - - [704, 448, 1, 3328, 704, 704, 704, 448]
    - [50, 3196.0]
  - - [1024, 448, 1, 3328, 1024, 1024, 1024, 448]
    - [50, 4572.0]
  - - [1408, 448, 1, 3328, 1408, 1408, 1408, 448]
    - [50, 4892.0]
  - - [1856, 448, 1, 3328, 1856, 1856, 1856, 448]
    - [45, 5031.0]
  - - [2368, 448, 1, 3328, 2368, 2368, 2368, 448]
    - [45, 4950.0]
  - - [2944, 448, 1, 3328, 2944, 2944, 2944, 448]
    - [45, 5288.0]
  - - [3584, 448, 1, 3328, 3584, 3584, 3584, 448]
    - [45, 5536.0]
  - - [4288, 448, 1, 3328, 4288, 4288, 4288, 448]
    - [45, 5256.0]
  - - [5056, 448, 1, 3328, 5056, 5056, 5056, 448]
    - [45, 5652.0]
  - - [5888, 448, 1, 3328, 5888, 5888, 5888, 448]
    - [45, 5524.0]
  - - [6784, 448, 1, 3328, 6784, 6784, 6784, 448]
    - [45, 5485.0]
  - - [256, 704, 1, 3328, 256, 256, 256, 704]
    - [45, 2428.0]
  - - [448, 704, 1, 3328, 448, 448, 448, 704]
    - [50, 3198.0]
  - - [704, 704, 1, 3328, 704, 704, 704, 704]
    - [45, 3867.0]
  - - [1024, 704, 1, 3328, 1024, 1024, 1024, 704]
    - [50, 4272.0]
  - - [1408, 704, 1, 3328, 1408, 1408, 1408, 704]
    - [45, 4575.0]
  - - [1856, 704, 1, 3328, 1856, 1856, 1856, 704]
    - [48, 5152.0]
  - - [2368, 704, 1, 3328, 2368, 2368, 2368, 704]
    - [50, 5099.0]
  - - [2944, 704, 1, 3328, 2944, 2944, 2944, 704]
    - [50, 5065.0]
  - - [3584, 704, 1, 3328, 3584, 3584, 3584, 704]
    - [1, 5190.0]
  - - [4288, 704, 1, 3328, 4288, 4288, 4288, 704]
    - [50, 5395.0]
  - - [5056, 704, 1, 3328, 5056, 5056, 5056, 704]
    - [50, 5608.0]
  - - [5888, 704, 1, 3328, 5888, 5888, 5888, 704]
    - [50, 5449.0]
  - - [6784, 704, 1, 3328, 6784, 6784, 6784, 704]
    - [12, 5725.0]
  - - [256, 1024, 1, 3328, 256, 256, 256, 1024]
    - [50, 2681.0]
  - - [448, 1024, 1, 3328, 448, 448, 448, 1024]
    - [50, 4618.0]
  - - [704, 1024, 1, 3328, 704, 704, 704, 1024]
    - [45, 4364.0]
  - - [1024, 1024, 1, 3328, 1024, 1024, 1024, 1024]
    - [45, 4648.0]
  - - [1408, 1024, 1, 3328, 1408, 1408, 1408, 1024]
    - [48, 4402.0]
  - - [1856, 1024, 1, 3328, 1856, 1856, 1856, 1024]
    - [47, 4918.0]
  - - [2368, 1024, 1, 3328, 2368, 2368, 2368, 1024]
    - [46, 4953.0]
  - - [2944, 1024, 1, 3328, 2944, 2944, 2944, 1024]
    - [46, 5289.0]
  - - [3584, 1024, 1, 3328, 3584, 3584, 3584, 1024]
    - [46, 5537.0]
  - - [4288, 1024, 1, 3328, 4288, 4288, 4288, 1024]
    - [2, 5541.0]
  - - [5056, 1024, 1, 3328, 5056, 5056, 5056, 1024]
    - [41, 5696.0]
  - - [5888, 1024, 1, 3328, 5888, 5888, 5888, 1024]
    - [45, 6546.0]
  - - [6784, 1024, 1, 3328, 6784, 6784, 6784, 1024]
    - [45, 6649.0]
  - - [256, 1408, 1, 3328, 256, 256, 256, 1408]
    - [50, 3649.0]
  - - [448, 1408, 1, 3328, 448, 448, 448, 1408]
    - [50, 4884.0]
  - - [704, 1408, 1, 3328, 704, 704, 704, 1408]
    - [45, 4599.0]
  - - [1024, 1408, 1, 3328, 1024, 1024, 1024, 1408]
    - [50, 4603.0]
  - - [1408, 1408, 1, 3328, 1408, 1408, 1408, 1408]
    - [49, 5121.0]
  - - [1856, 1408, 1, 3328, 1856, 1856, 1856, 1408]
    - [48, 5334.0]
  - - [2368, 1408, 1, 3328, 2368, 2368, 2368, 1408]
    - [50, 5540.0]
  - - [2944, 1408, 1, 3328, 2944, 2944, 2944, 1408]
    - [50, 5563.0]
  - - [3584, 1408, 1, 3328, 3584, 3584, 3584, 1408]
    - [48, 5722.0]
  - - [4288, 1408, 1, 3328, 4288, 4288, 4288, 1408]
    - [50, 5710.0]
  - - [5056, 1408, 1, 3328, 5056, 5056, 5056, 1408]
    - [2, 6499.0]
  - - [5888, 1408, 1, 3328, 5888, 5888, 5888, 1408]
    - [45, 6619.0]
  - - [6784, 1408, 1, 3328, 6784, 6784, 6784, 1408]
    - [2, 6704.0]
  - - [256, 1856, 1, 3328, 256, 256, 256, 1856]
    - [45, 3705.0]
  - - [448, 1856, 1, 3328, 448, 448, 448, 1856]
    - [50, 5003.0]
  - - [704, 1856, 1, 3328, 704, 704, 704, 1856]
    - [46, 5062.0]
  - - [1024, 1856, 1, 3328, 1024, 1024, 1024, 1856]
    - [49, 4822.0]
  - - [1408, 1856, 1, 3328, 1408, 1408, 1408, 1856]
    - [48, 5340.0]
  - - [1856, 1856, 1, 3328, 1856, 1856, 1856, 1856]
    - [50, 5390.0]
  - - [2368, 1856, 1, 3328, 2368, 2368, 2368, 1856]
    - [1, 6342.0]
  - - [2944, 1856, 1, 3328, 2944, 2944, 2944, 1856]
    - [50, 5763.0]
  - - [3584, 1856, 1, 3328, 3584, 3584, 3584, 1856]
    - [41, 6258.0]
  - - [4288, 1856, 1, 3328, 4288, 4288, 4288, 1856]
    - [2, 6353.0]
  - - [5056, 1856, 1, 3328, 5056, 5056, 5056, 1856]
    - [2, 6628.0]
  - - [5888, 1856, 1, 3328, 5888, 5888, 5888, 1856]
    - [43, 5927.0]
  - - [6784, 1856, 1, 3328, 6784, 6784, 6784, 1856]
    - [50, 6006.0]
  - - [256, 2368, 1, 3328, 256, 256, 256, 2368]
    - [45, 4691.0]
  - - [448, 2368, 1, 3328, 448, 448, 448, 2368]
    - [50, 4838.0]
  - - [704, 2368, 1, 3328, 704, 704, 704, 2368]
    - [48, 5060.0]
  - - [1024, 2368, 1, 3328, 1024, 1024, 1024, 2368]
    - [50, 4981.0]
  - - [1408, 2368, 1, 3328, 1408, 1408, 1408, 2368]
    - [50, 5378.0]
  - - [1856, 2368, 1, 3328, 1856, 1856, 1856, 2368]
    - [50, 5539.0]
  - - [2368, 2368, 1, 3328, 2368, 2368, 2368, 2368]
    - [50, 5693.0]
  - - [2944, 2368, 1, 3328, 2944, 2944, 2944, 2368]
    - [2, 6392.0]
  - - [3584, 2368, 1, 3328, 3584, 3584, 3584, 2368]
    - [41, 6409.0]
  - - [4288, 2368, 1, 3328, 4288, 4288, 4288, 2368]
    - [2, 6518.0]
  - - [5056, 2368, 1, 3328, 5056, 5056, 5056, 2368]
    - [44, 6014.0]
  - - [5888, 2368, 1, 3328, 5888, 5888, 5888, 2368]
    - [50, 6099.0]
  - - [6784, 2368, 1, 3328, 6784, 6784, 6784, 2368]
    - [50, 6176.0]
  - - [256, 2944, 1, 3328, 256, 256, 256, 2944]
    - [45, 4503.0]
  - - [448, 2944, 1, 3328, 448, 448, 448, 2944]
    - [46, 5123.0]
  - - [704, 2944, 1, 3328, 704, 704, 704, 2944]
    - [50, 4993.0]
  - - [1024, 2944, 1, 3328, 1024, 1024, 1024, 2944]
    - [48, 5295.0]
  - - [1408, 2944, 1, 3328, 1408, 1408, 1408, 2944]
    - [1, 6287.0]
  - - [1856, 2944, 1, 3328, 1856, 1856, 1856, 2944]
    - [50, 5763.0]
  - - [2368, 2944, 1, 3328, 2368, 2368, 2368, 2944]
    - [42, 6051.0]
  - - [2944, 2944, 1, 3328, 2944, 2944, 2944, 2944]
    - [2, 6753.0]
  - - [3584, 2944, 1, 3328, 3584, 3584, 3584, 2944]
    - [45, 6863.0]
  - - [4288, 2944, 1, 3328, 4288, 4288, 4288, 2944]
    - [2, 6645.0]
  - - [5056, 2944, 1, 3328, 5056, 5056, 5056, 2944]
    - [42, 6239.0]
  - - [5888, 2944, 1, 3328, 5888, 5888, 5888, 2944]
    - [42, 6319.0]
  - - [6784, 2944, 1, 3328, 6784, 6784, 6784, 2944]
    - [50, 6327.0]
  - - [256, 3584, 1, 3328, 256, 256, 256, 3584]
    - [50, 5437.0]
  - - [448, 3584, 1, 3328, 448, 448, 448, 3584]
    - [48, 4881.0]
  - - [704, 3584, 1, 3328, 704, 704, 704, 3584]
    - [50, 5445.0]
  - - [1024, 3584, 1, 3328, 1024, 1024, 1024, 3584]
    - [48, 5639.0]
  - - [1408, 3584, 1, 3328, 1408, 1408, 1408, 3584]
    - [2, 6451.0]
  - - [1856, 3584, 1, 3328, 1856, 1856, 1856, 3584]
    - [2, 6479.0]
  - - [2368, 3584, 1, 3328, 2368, 2368, 2368, 3584]
    - [45, 6963.0]
  - - [2944, 3584, 1, 3328, 2944, 2944, 2944, 3584]
    - [2, 6844.0]
  - - [3584, 3584, 1, 3328, 3584, 3584, 3584, 3584]
    - [2, 6843.0]
  - - [4288, 3584, 1, 3328, 4288, 4288, 4288, 3584]
    - [40, 6753.0]
  - - [5056, 3584, 1, 3328, 5056, 5056, 5056, 3584]
    - [2, 6797.0]
  - - [5888, 3584, 1, 3328, 5888, 5888, 5888, 3584]
    - [45, 6981.0]
  - - [6784, 3584, 1, 3328, 6784, 6784, 6784, 3584]
    - [2, 6957.0]
  - - [256, 4288, 1, 3328, 256, 256, 256, 4288]
    - [50, 4997.0]
  - - [448, 4288, 1, 3328, 448, 448, 448, 4288]
    - [50, 5022.0]
  - - [704, 4288, 1, 3328, 704, 704, 704, 4288]
    - [50, 5280.0]
  - - [1024, 4288, 1, 3328, 1024, 1024, 1024, 4288]
    - [40, 5899.0]
  - - [1408, 4288, 1, 3328, 1408, 1408, 1408, 4288]
    - [2, 6195.0]
  - - [1856, 4288, 1, 3328, 1856, 1856, 1856, 4288]
    - [2, 6463.0]
  - - [2368, 4288, 1, 3328, 2368, 2368, 2368, 4288]
    - [42, 6513.0]
  - - [2944, 4288, 1, 3328, 2944, 2944, 2944, 4288]
    - [41, 6516.0]
  - - [3584, 4288, 1, 3328, 3584, 3584, 3584, 4288]
    - [50, 6117.0]
  - - [4288, 4288, 1, 3328, 4288, 4288, 4288, 4288]
    - [50, 6259.0]
  - - [5056, 4288, 1, 3328, 5056, 5056, 5056, 4288]
    - [50, 6407.0]
  - - [5888, 4288, 1, 3328, 5888, 5888, 5888, 4288]
    - [50, 6467.0]
  - - [6784, 4288, 1, 3328, 6784, 6784, 6784, 4288]
    - [50, 6698.0]
  - - [256, 5056, 1, 3328, 256, 256, 256, 5056]
    - [48, 5159.0]
  - - [448, 5056, 1, 3328, 448, 448, 448, 5056]
    - [50, 5385.0]
  - - [704, 5056, 1, 3328, 704, 704, 704, 5056]
    - [50, 5510.0]
  - - [1024, 5056, 1, 3328, 1024, 1024, 1024, 5056]
    - [40, 5559.0]
  - - [1408, 5056, 1, 3328, 1408, 1408, 1408, 5056]
    - [2, 6466.0]
  - - [1856, 5056, 1, 3328, 1856, 1856, 1856, 5056]
    - [2, 6540.0]
  - - [2368, 5056, 1, 3328, 2368, 2368, 2368, 5056]
    - [40, 6545.0]
  - - [2944, 5056, 1, 3328, 2944, 2944, 2944, 5056]
    - [2, 6757.0]
  - - [3584, 5056, 1, 3328, 3584, 3584, 3584, 5056]
    - [40, 6822.0]
  - - [4288, 5056, 1, 3328, 4288, 4288, 4288, 5056]
    - [50, 6401.0]
  - - [5056, 5056, 1, 3328, 5056, 5056, 5056, 5056]
    - [50, 6498.0]
  - - [5888, 5056, 1, 3328, 5888, 5888, 5888, 5056]
    - [48, 6709.0]
  - - [6784, 5056, 1, 3328, 6784, 6784, 6784, 5056]
    - [50, 6880.0]
  - - [256, 5888, 1, 3328, 256, 256, 256, 5888]
    - [50, 5001.0]
  - - [448, 5888, 1, 3328, 448, 448, 448, 5888]
    - [50, 5225.0]
  - - [704, 5888, 1, 3328, 704, 704, 704, 5888]
    - [50, 5364.0]
  - - [1024, 5888, 1, 3328, 1024, 1024, 1024, 5888]
    - [45, 6264.0]
  - - [1408, 5888, 1, 3328, 1408, 1408, 1408, 5888]
    - [45, 6658.0]
  - - [1856, 5888, 1, 3328, 1856, 1856, 1856, 5888]
    - [42, 6506.0]
  - - [2368, 5888, 1, 3328, 2368, 2368, 2368, 5888]
    - [50, 6079.0]
  - - [2944, 5888, 1, 3328, 2944, 2944, 2944, 5888]
    - [2, 6864.0]
  - - [3584, 5888, 1, 3328, 3584, 3584, 3584, 5888]
    - [45, 6983.0]
  - - [4288, 5888, 1, 3328, 4288, 4288, 4288, 5888]
    - [41, 6803.0]
  - - [5056, 5888, 1, 3328, 5056, 5056, 5056, 5888]
    - [50, 6693.0]
  - - [5888, 5888, 1, 3328, 5888, 5888, 5888, 5888]
    - [50, 6881.0]
  - - [6784, 5888, 1, 3328, 6784, 6784, 6784, 5888]
    - [50, 7026.0]
  - - [256, 6784, 1, 3328, 256, 256, 256, 6784]
    - [48, 5286.0]
  - - [448, 6784, 1, 3328, 448, 448, 448, 6784]
    - [50, 5301.0]
  - - [704, 6784, 1, 3328, 704, 704, 704, 6784]
    - [40, 5757.0]
  - - [1024, 6784, 1, 3328, 1024, 1024, 1024, 6784]
    - [45, 6567.0]
  - - [1408, 6784, 1, 3328, 1408, 1408, 1408, 6784]
    - [45, 6656.0]
  - - [1856, 6784, 1, 3328, 1856, 1856, 1856, 6784]
    - [42, 6485.0]
  - - [2368, 6784, 1, 3328, 2368, 2368, 2368, 6784]
    - [42, 6258.0]
  - - [2944, 6784, 1, 3328, 2944, 2944, 2944, 6784]
    - [2, 6842.0]
  - - [3584, 6784, 1, 3328, 3584, 3584, 3584, 6784]
    - [48, 6442.0]
  - - [4288, 6784, 1, 3328, 4288, 4288, 4288, 6784]
    - [50, 6698.0]
  - - [5056, 6784, 1, 3328, 5056, 5056, 5056, 6784]
    - [50, 6872.0]
  - - [5888, 6784, 1, 3328, 5888, 5888, 5888, 6784]
    - [50, 7020.0]
  - - [6784, 6784, 1, 3328, 6784, 6784, 6784, 6784]
    - [50, 7265.0]
  - - [1024, 1024, 1, 1024, 1024, 1024, 1024, 1024]
    - [45, 4415.0]
  - - [1760, 7133, 1, 1760, 1760, 1760, 1760, 7133]
    - [50, 5766.0]
  - - [2048, 7133, 1, 2048, 2048, 2048, 2048, 7133]
    - [48, 5772.0]
  - - [2560, 7133, 1, 2560, 2560, 2560, 2560, 7133]
    - [48, 6044.0]
  - - [3072, 7435, 1, 1024, 3072, 3072, 3072, 7435]
    - [48, 5773.0]
  - - [4096, 7133, 1, 4096, 4096, 4096, 4096, 7133]
    - [2, 8185.0]
  - - [7680, 5481, 1, 2560, 7680, 7680, 7680, 5481]
    - [48, 6760.0]
  - - [32, 32, 1, 32, 32, 32, 32, 32]
    - [55, 2.0]
  - - [32, 64, 1, 256, 32, 32, 32, 64]
    - [56, 10.0]
  - - [32, 128, 1, 256, 32, 32, 32, 128]
    - [62, 21.0]
  - - [32, 256, 1, 256, 32, 32, 32, 256]
    - [68, 51.0]
  - - [32, 448, 1, 256, 32, 32, 32, 448]
    - [62, 74.0]
  - - [32, 704, 1, 256, 32, 32, 32, 704]
    - [62, 117.0]
  - - [32, 1024, 1, 256, 32, 32, 32, 1024]
    - [62, 167.0]
  - - [32, 1408, 1, 256, 32, 32, 32, 1408]
    - [62, 233.0]
  - - [32, 1856, 1, 256, 32, 32, 32, 1856]
    - [62, 306.0]
  - - [32, 2368, 1, 256, 32, 32, 32, 2368]
    - [62, 392.0]
  - - [32, 2944, 1, 256, 32, 32, 32, 2944]
    - [63, 509.0]
  - - [32, 3584, 1, 256, 32, 32, 32, 3584]
    - [66, 821.0]
  - - [32, 4288, 1, 256, 32, 32, 32, 4288]
    - [66, 695.0]
  - - [32, 5056, 1, 256, 32, 32, 32, 5056]
    - [66, 815.0]
  - - [32, 5888, 1, 256, 32, 32, 32, 5888]
    - [66, 944.0]
  - - [32, 6784, 1, 256, 32, 32, 32, 6784]
    - [66, 1075.0]
  - - [32, 64, 1, 1280, 32, 32, 32, 64]
    - [76, 48.0]
  - - [32, 128, 1, 1280, 32, 32, 32, 128]
    - [76, 95.0]
  - - [32, 256, 1, 1280, 32, 32, 32, 256]
    - [75, 192.0]
  - - [32, 448, 1, 1280, 32, 32, 32, 448]
    - [76, 335.0]
  - - [32, 704, 1, 1280, 32, 32, 32, 704]
    - [78, 669.0]
  - - [32, 1024, 1, 1280, 32, 32, 32, 1024]
    - [77, 709.0]
  - - [32, 1408, 1, 1280, 32, 32, 32, 1408]
    - [77, 952.0]
  - - [32, 1856, 1, 1280, 32, 32, 32, 1856]
    - [77, 977.0]
  - - [32, 2368, 1, 1280, 32, 32, 32, 2368]
    - [74, 1058.0]
  - - [32, 2944, 1, 1280, 32, 32, 32, 2944]
    - [78, 1011.0]
  - - [32, 3584, 1, 1280, 32, 32, 32, 3584]
    - [73, 1198.0]
  - - [32, 4288, 1, 1280, 32, 32, 32, 4288]
    - [77, 1173.0]
  - - [32, 5056, 1, 1280, 32, 32, 32, 5056]
    - [70, 1194.0]
  - - [32, 5888, 1, 1280, 32, 32, 32, 5888]
    - [73, 1247.0]
  - - [32, 6784, 1, 1280, 32, 32, 32, 6784]
    - [70, 1258.0]
  - - [32, 64, 1, 3328, 32, 32, 32, 64]
    - [79, 84.0]
  - - [32, 128, 1, 3328, 32, 32, 32, 128]
    - [79, 170.0]
  - - [32, 256, 1, 3328, 32, 32, 32, 256]
    - [84, 338.0]
  - - [32, 448, 1, 3328, 32, 32, 32, 448]
    - [82, 678.0]
  - - [32, 704, 1, 3328, 32, 32, 32, 704]
    - [78, 812.0]
  - - [32, 1024, 1, 3328, 32, 32, 32, 1024]
    - [85, 1095.0]
  - - [32, 1408, 1, 3328, 32, 32, 32, 1408]
    - [77, 1134.0]
  - - [32, 1856, 1, 3328, 32, 32, 32, 1856]
    - [81, 1197.0]
  - - [32, 2368, 1, 3328, 32, 32, 32, 2368]
    - [82, 1233.0]
  - - [32, 2944, 1, 3328, 32, 32, 32, 2944]
    - [83, 1314.0]
  - - [32, 3584, 1, 3328, 32, 32, 32, 3584]
    - [77, 1377.0]
  - - [32, 4288, 1, 3328, 32, 32, 32, 4288]
    - [77, 1396.0]
  - - [32, 5056, 1, 3328, 32, 32, 32, 5056]
    - [80, 1381.0]
  - - [32, 5888, 1, 3328, 32, 32, 32, 5888]
    - [73, 1417.0]
  - - [32, 6784, 1, 3328, 32, 32, 32, 6784]
    - [71, 1415.0]
  - - [64, 32, 1, 256, 64, 64, 64, 32]
    - [56, 10.0]
  - - [128, 32, 1, 256, 128, 128, 128, 32]
    - [62, 21.0]
  - - [256, 32, 1, 256, 256, 256, 256, 32]
    - [64, 56.0]
  - - [448, 32, 1, 256, 448, 448, 448, 32]
    - [62, 77.0]
  - - [704, 32, 1, 256, 704, 704, 704, 32]
    - [62, 116.0]
  - - [1024, 32, 1, 256, 1024, 1024, 1024, 32]
    - [62, 169.0]
  - - [1408, 32, 1, 256, 1408, 1408, 1408, 32]
    - [62, 230.0]
  - - [1856, 32, 1, 256, 1856, 1856, 1856, 32]
    - [62, 306.0]
  - - [2368, 32, 1, 256, 2368, 2368, 2368, 32]
    - [62, 389.0]
  - - [2944, 32, 1, 256, 2944, 2944, 2944, 32]
    - [61, 517.0]
  - - [3584, 32, 1, 256, 3584, 3584, 3584, 32]
    - [66, 817.0]
  - - [4288, 32, 1, 256, 4288, 4288, 4288, 32]
    - [66, 692.0]
  - - [5056, 32, 1, 256, 5056, 5056, 5056, 32]
    - [66, 814.0]
  - - [5888, 32, 1, 256, 5888, 5888, 5888, 32]
    - [66, 937.0]
  - - [6784, 32, 1, 256, 6784, 6784, 6784, 32]
    - [66, 1083.0]
  - - [64, 32, 1, 1280, 64, 64, 64, 32]
    - [76, 48.0]
  - - [128, 32, 1, 1280, 128, 128, 128, 32]
    - [76, 96.0]
  - - [256, 32, 1, 1280, 256, 256, 256, 32]
    - [75, 194.0]
  - - [448, 32, 1, 1280, 448, 448, 448, 32]
    - [76, 338.0]
  - - [704, 32, 1, 1280, 704, 704, 704, 32]
    - [78, 667.0]
  - - [1024, 32, 1, 1280, 1024, 1024, 1024, 32]
    - [77, 715.0]
  - - [1408, 32, 1, 1280, 1408, 1408, 1408, 32]
    - [77, 959.0]
  - - [1856, 32, 1, 1280, 1856, 1856, 1856, 32]
    - [77, 979.0]
  - - [2368, 32, 1, 1280, 2368, 2368, 2368, 32]
    - [74, 1079.0]
  - - [2944, 32, 1, 1280, 2944, 2944, 2944, 32]
    - [74, 1016.0]
  - - [3584, 32, 1, 1280, 3584, 3584, 3584, 32]
    - [73, 1213.0]
  - - [4288, 32, 1, 1280, 4288, 4288, 4288, 32]
    - [73, 1155.0]
  - - [5056, 32, 1, 1280, 5056, 5056, 5056, 32]
    - [70, 1188.0]
  - - [5888, 32, 1, 1280, 5888, 5888, 5888, 32]
    - [73, 1256.0]
  - - [6784, 32, 1, 1280, 6784, 6784, 6784, 32]
    - [70, 1253.0]
  - - [64, 32, 1, 3328, 64, 64, 64, 32]
    - [79, 84.0]
  - - [128, 32, 1, 3328, 128, 128, 128, 32]
    - [79, 168.0]
  - - [256, 32, 1, 3328, 256, 256, 256, 32]
    - [79, 334.0]
  - - [448, 32, 1, 3328, 448, 448, 448, 32]
    - [79, 573.0]
  - - [704, 32, 1, 3328, 704, 704, 704, 32]
    - [78, 809.0]
  - - [1024, 32, 1, 3328, 1024, 1024, 1024, 32]
    - [85, 1104.0]
  - - [1408, 32, 1, 3328, 1408, 1408, 1408, 32]
    - [82, 1151.0]
  - - [1856, 32, 1, 3328, 1856, 1856, 1856, 32]
    - [82, 1195.0]
  - - [2368, 32, 1, 3328, 2368, 2368, 2368, 32]
    - [82, 1235.0]
  - - [2944, 32, 1, 3328, 2944, 2944, 2944, 32]
    - [82, 1280.0]
  - - [3584, 32, 1, 3328, 3584, 3584, 3584, 32]
    - [77, 1377.0]
  - - [4288, 32, 1, 3328, 4288, 4288, 4288, 32]
    - [77, 1349.0]
  - - [5056, 32, 1, 3328, 5056, 5056, 5056, 32]
    - [82, 1316.0]
  - - [5888, 32, 1, 3328, 5888, 5888, 5888, 32]
    - [72, 1360.0]
  - - [6784, 32, 1, 3328, 6784, 6784, 6784, 32]
    - [70, 1369.0]
  - - [64, 64, 1, 32, 64, 64, 64, 64]
    - [56, 6.0]
  - - [128, 64, 1, 32, 128, 128, 128, 64]
    - [55, 11.0]
  - - [256, 64, 1, 32, 256, 256, 256, 64]
    - [55, 40.0]
  - - [448, 64, 1, 32, 448, 448, 448, 64]
    - [58, 45.0]
  - - [704, 64, 1, 32, 704, 704, 704, 64]
    - [56, 63.0]
  - - [1024, 64, 1, 32, 1024, 1024, 1024, 64]
    - [63, 96.0]
  - - [1408, 64, 1, 32, 1408, 1408, 1408, 64]
    - [63, 130.0]
  - - [1856, 64, 1, 32, 1856, 1856, 1856, 64]
    - [56, 173.0]
  - - [2368, 64, 1, 32, 2368, 2368, 2368, 64]
    - [60, 220.0]
  - - [2944, 64, 1, 32, 2944, 2944, 2944, 64]
    - [63, 264.0]
  - - [3584, 64, 1, 32, 3584, 3584, 3584, 64]
    - [62, 708.0]
  - - [4288, 64, 1, 32, 4288, 4288, 4288, 64]
    - [68, 539.0]
  - - [5056, 64, 1, 32, 5056, 5056, 5056, 64]
    - [65, 627.0]
  - - [5888, 64, 1, 32, 5888, 5888, 5888, 64]
    - [65, 723.0]
  - - [6784, 64, 1, 32, 6784, 6784, 6784, 64]
    - [62, 834.0]
  - - [64, 128, 1, 32, 64, 64, 64, 128]
    - [57, 12.0]
  - - [128, 128, 1, 32, 128, 128, 128, 128]
    - [62, 52.0]
  - - [256, 128, 1, 32, 256, 256, 256, 128]
    - [63, 48.0]
  - - [448, 128, 1, 32, 448, 448, 448, 128]
    - [57, 90.0]
  - - [704, 128, 1, 32, 704, 704, 704, 128]
    - [63, 131.0]
  - - [1024, 128, 1, 32, 1024, 1024, 1024, 128]
    - [57, 209.0]
  - - [1408, 128, 1, 32, 1408, 1408, 1408, 128]
    - [57, 292.0]
  - - [1856, 128, 1, 32, 1856, 1856, 1856, 128]
    - [61, 590.0]
  - - [2368, 128, 1, 32, 2368, 2368, 2368, 128]
    - [65, 595.0]
  - - [2944, 128, 1, 32, 2944, 2944, 2944, 128]
    - [65, 743.0]
  - - [3584, 128, 1, 32, 3584, 3584, 3584, 128]
    - [68, 873.0]
  - - [4288, 128, 1, 32, 4288, 4288, 4288, 128]
    - [63, 881.0]
  - - [5056, 128, 1, 32, 5056, 5056, 5056, 128]
    - [69, 1020.0]
  - - [5888, 128, 1, 32, 5888, 5888, 5888, 128]
    - [62, 1037.0]
  - - [6784, 128, 1, 32, 6784, 6784, 6784, 128]
    - [69, 1130.0]
  - - [64, 256, 1, 32, 64, 64, 64, 256]
    - [55, 23.0]
  - - [128, 256, 1, 32, 128, 128, 128, 256]
    - [57, 52.0]
  - - [256, 256, 1, 32, 256, 256, 256, 256]
    - [55, 101.0]
  - - [448, 256, 1, 32, 448, 448, 448, 256]
    - [57, 185.0]
  - - [704, 256, 1, 32, 704, 704, 704, 256]
    - [57, 286.0]
  - - [1024, 256, 1, 32, 1024, 1024, 1024, 256]
    - [61, 636.0]
  - - [1408, 256, 1, 32, 1408, 1408, 1408, 256]
    - [65, 724.0]
  - - [1856, 256, 1, 32, 1856, 1856, 1856, 256]
    - [63, 799.0]
  - - [2368, 256, 1, 32, 2368, 2368, 2368, 256]
    - [68, 992.0]
  - - [2944, 256, 1, 32, 2944, 2944, 2944, 256]
    - [62, 1027.0]
  - - [3584, 256, 1, 32, 3584, 3584, 3584, 256]
    - [64, 1116.0]
  - - [4288, 256, 1, 32, 4288, 4288, 4288, 256]
    - [68, 1121.0]
  - - [5056, 256, 1, 32, 5056, 5056, 5056, 256]
    - [65, 1071.0]
  - - [5888, 256, 1, 32, 5888, 5888, 5888, 256]
    - [68, 1050.0]
  - - [6784, 256, 1, 32, 6784, 6784, 6784, 256]
    - [68, 996.0]
  - - [64, 448, 1, 32, 64, 64, 64, 448]
    - [59, 58.0]
  - - [128, 448, 1, 32, 128, 128, 128, 448]
    - [57, 89.0]
  - - [256, 448, 1, 32, 256, 256, 256, 448]
    - [57, 183.0]
  - - [448, 448, 1, 32, 448, 448, 448, 448]
    - [68, 606.0]
  - - [704, 448, 1, 32, 704, 704, 704, 448]
    - [62, 652.0]
  - - [1024, 448, 1, 32, 1024, 1024, 1024, 448]
    - [65, 893.0]
  - - [1408, 448, 1, 32, 1408, 1408, 1408, 448]
    - [65, 1040.0]
  - - [1856, 448, 1, 32, 1856, 1856, 1856, 448]
    - [69, 1119.0]
  - - [2368, 448, 1, 32, 2368, 2368, 2368, 448]
    - [65, 1146.0]
  - - [2944, 448, 1, 32, 2944, 2944, 2944, 448]
    - [62, 1083.0]
  - - [3584, 448, 1, 32, 3584, 3584, 3584, 448]
    - [65, 1037.0]
  - - [4288, 448, 1, 32, 4288, 4288, 4288, 448]
    - [64, 1006.0]
  - - [5056, 448, 1, 32, 5056, 5056, 5056, 448]
    - [66, 980.0]
  - - [5888, 448, 1, 32, 5888, 5888, 5888, 448]
    - [68, 938.0]
  - - [6784, 448, 1, 32, 6784, 6784, 6784, 448]
    - [65, 934.0]
  - - [64, 704, 1, 32, 64, 64, 64, 704]
    - [63, 65.0]
  - - [128, 704, 1, 32, 128, 128, 128, 704]
    - [63, 132.0]
  - - [256, 704, 1, 32, 256, 256, 256, 704]
    - [57, 284.0]
  - - [448, 704, 1, 32, 448, 448, 448, 704]
    - [68, 655.0]
  - - [704, 704, 1, 32, 704, 704, 704, 704]
    - [69, 836.0]
  - - [1024, 704, 1, 32, 1024, 1024, 1024, 704]
    - [65, 1008.0]
  - - [1408, 704, 1, 32, 1408, 1408, 1408, 704]
    - [68, 1139.0]
  - - [1856, 704, 1, 32, 1856, 1856, 1856, 704]
    - [65, 1131.0]
  - - [2368, 704, 1, 32, 2368, 2368, 2368, 704]
    - [65, 1101.0]
  - - [2944, 704, 1, 32, 2944, 2944, 2944, 704]
    - [62, 1019.0]
  - - [3584, 704, 1, 32, 3584, 3584, 3584, 704]
    - [65, 923.0]
  - - [4288, 704, 1, 32, 4288, 4288, 4288, 704]
    - [65, 966.0]
  - - [5056, 704, 1, 32, 5056, 5056, 5056, 704]
    - [62, 943.0]
  - - [5888, 704, 1, 32, 5888, 5888, 5888, 704]
    - [64, 914.0]
  - - [6784, 704, 1, 32, 6784, 6784, 6784, 704]
    - [61, 916.0]
  - - [64, 1024, 1, 32, 64, 64, 64, 1024]
    - [63, 95.0]
  - - [128, 1024, 1, 32, 128, 128, 128, 1024]
    - [55, 210.0]
  - - [256, 1024, 1, 32, 256, 256, 256, 1024]
    - [63, 666.0]
  - - [448, 1024, 1, 32, 448, 448, 448, 1024]
    - [64, 948.0]
  - - [704, 1024, 1, 32, 704, 704, 704, 1024]
    - [65, 1028.0]
  - - [1024, 1024, 1, 32, 1024, 1024, 1024, 1024]
    - [68, 869.0]
  - - [1408, 1024, 1, 32, 1408, 1408, 1408, 1024]
    - [68, 1120.0]
  - - [1856, 1024, 1, 32, 1856, 1856, 1856, 1024]
    - [68, 1062.0]
  - - [2368, 1024, 1, 32, 2368, 2368, 2368, 1024]
    - [65, 1053.0]
  - - [2944, 1024, 1, 32, 2944, 2944, 2944, 1024]
    - [61, 981.0]
  - - [3584, 1024, 1, 32, 3584, 3584, 3584, 1024]
    - [68, 946.0]
  - - [4288, 1024, 1, 32, 4288, 4288, 4288, 1024]
    - [63, 941.0]
  - - [5056, 1024, 1, 32, 5056, 5056, 5056, 1024]
    - [60, 936.0]
  - - [5888, 1024, 1, 32, 5888, 5888, 5888, 1024]
    - [62, 887.0]
  - - [6784, 1024, 1, 32, 6784, 6784, 6784, 1024]
    - [57, 892.0]
  - - [64, 1408, 1, 32, 64, 64, 64, 1408]
    - [60, 130.0]
  - - [128, 1408, 1, 32, 128, 128, 128, 1408]
    - [55, 290.0]
  - - [256, 1408, 1, 32, 256, 256, 256, 1408]
    - [64, 728.0]
  - - [448, 1408, 1, 32, 448, 448, 448, 1408]
    - [65, 1052.0]
  - - [704, 1408, 1, 32, 704, 704, 704, 1408]
    - [65, 1157.0]
  - - [1024, 1408, 1, 32, 1024, 1024, 1024, 1408]
    - [61, 957.0]
  - - [1408, 1408, 1, 32, 1408, 1408, 1408, 1408]
    - [68, 1131.0]
  - - [1856, 1408, 1, 32, 1856, 1856, 1856, 1408]
    - [65, 1077.0]
  - - [2368, 1408, 1, 32, 2368, 2368, 2368, 1408]
    - [65, 1050.0]
  - - [2944, 1408, 1, 32, 2944, 2944, 2944, 1408]
    - [68, 982.0]
  - - [3584, 1408, 1, 32, 3584, 3584, 3584, 1408]
    - [64, 920.0]
  - - [4288, 1408, 1, 32, 4288, 4288, 4288, 1408]
    - [56, 950.0]
  - - [5056, 1408, 1, 32, 5056, 5056, 5056, 1408]
    - [60, 938.0]
  - - [5888, 1408, 1, 32, 5888, 5888, 5888, 1408]
    - [57, 894.0]
  - - [6784, 1408, 1, 32, 6784, 6784, 6784, 1408]
    - [57, 895.0]
  - - [64, 1856, 1, 32, 64, 64, 64, 1856]
    - [63, 174.0]
  - - [128, 1856, 1, 32, 128, 128, 128, 1856]
    - [61, 607.0]
  - - [256, 1856, 1, 32, 256, 256, 256, 1856]
    - [65, 789.0]
  - - [448, 1856, 1, 32, 448, 448, 448, 1856]
    - [68, 1148.0]
  - - [704, 1856, 1, 32, 704, 704, 704, 1856]
    - [68, 1176.0]
  - - [1024, 1856, 1, 32, 1024, 1024, 1024, 1856]
    - [61, 944.0]
  - - [1408, 1856, 1, 32, 1408, 1408, 1408, 1856]
    - [68, 1096.0]
  - - [1856, 1856, 1, 32, 1856, 1856, 1856, 1856]
    - [65, 1071.0]
  - - [2368, 1856, 1, 32, 2368, 2368, 2368, 1856]
    - [56, 1035.0]
  - - [2944, 1856, 1, 32, 2944, 2944, 2944, 1856]
    - [65, 968.0]
  - - [3584, 1856, 1, 32, 3584, 3584, 3584, 1856]
    - [65, 937.0]
  - - [4288, 1856, 1, 32, 4288, 4288, 4288, 1856]
    - [56, 944.0]
  - - [5056, 1856, 1, 32, 5056, 5056, 5056, 1856]
    - [56, 937.0]
  - - [5888, 1856, 1, 32, 5888, 5888, 5888, 1856]
    - [57, 882.0]
  - - [6784, 1856, 1, 32, 6784, 6784, 6784, 1856]
    - [57, 891.0]
  - - [64, 2368, 1, 32, 64, 64, 64, 2368]
    - [57, 220.0]
  - - [128, 2368, 1, 32, 128, 128, 128, 2368]
    - [64, 609.0]
  - - [256, 2368, 1, 32, 256, 256, 256, 2368]
    - [68, 999.0]
  - - [448, 2368, 1, 32, 448, 448, 448, 2368]
    - [65, 1175.0]
  - - [704, 2368, 1, 32, 704, 704, 704, 2368]
    - [62, 1143.0]
  - - [1024, 2368, 1, 32, 1024, 1024, 1024, 2368]
    - [61, 947.0]
  - - [1408, 2368, 1, 32, 1408, 1408, 1408, 2368]
    - [62, 1089.0]
  - - [1856, 2368, 1, 32, 1856, 1856, 1856, 2368]
    - [68, 1065.0]
  - - [2368, 2368, 1, 32, 2368, 2368, 2368, 2368]
    - [62, 1041.0]
  - - [2944, 2368, 1, 32, 2944, 2944, 2944, 2368]
    - [60, 967.0]
  - - [3584, 2368, 1, 32, 3584, 3584, 3584, 2368]
    - [68, 918.0]
  - - [4288, 2368, 1, 32, 4288, 4288, 4288, 2368]
    - [56, 946.0]
  - - [5056, 2368, 1, 32, 5056, 5056, 5056, 2368]
    - [55, 936.0]
  - - [5888, 2368, 1, 32, 5888, 5888, 5888, 2368]
    - [55, 887.0]
  - - [6784, 2368, 1, 32, 6784, 6784, 6784, 2368]
    - [55, 895.0]
  - - [64, 2944, 1, 32, 64, 64, 64, 2944]
    - [63, 270.0]
  - - [128, 2944, 1, 32, 128, 128, 128, 2944]
    - [65, 740.0]
  - - [256, 2944, 1, 32, 256, 256, 256, 2944]
    - [68, 1047.0]
  - - [448, 2944, 1, 32, 448, 448, 448, 2944]
    - [68, 1158.0]
  - - [704, 2944, 1, 32, 704, 704, 704, 2944]
    - [63, 1129.0]
  - - [1024, 2944, 1, 32, 1024, 1024, 1024, 2944]
    - [62, 976.0]
  - - [1408, 2944, 1, 32, 1408, 1408, 1408, 2944]
    - [61, 1089.0]
  - - [1856, 2944, 1, 32, 1856, 1856, 1856, 2944]
    - [62, 1061.0]
  - - [2368, 2944, 1, 32, 2368, 2368, 2368, 2944]
    - [64, 1031.0]
  - - [2944, 2944, 1, 32, 2944, 2944, 2944, 2944]
    - [57, 959.0]
  - - [3584, 2944, 1, 32, 3584, 3584, 3584, 2944]
    - [62, 924.0]
  - - [4288, 2944, 1, 32, 4288, 4288, 4288, 2944]
    - [57, 946.0]
  - - [5056, 2944, 1, 32, 5056, 5056, 5056, 2944]
    - [57, 943.0]
  - - [5888, 2944, 1, 32, 5888, 5888, 5888, 2944]
    - [58, 881.0]
  - - [6784, 2944, 1, 32, 6784, 6784, 6784, 2944]
    - [57, 893.0]
  - - [64, 3584, 1, 32, 64, 64, 64, 3584]
    - [62, 708.0]
  - - [128, 3584, 1, 32, 128, 128, 128, 3584]
    - [56, 909.0]
  - - [256, 3584, 1, 32, 256, 256, 256, 3584]
    - [62, 1180.0]
  - - [448, 3584, 1, 32, 448, 448, 448, 3584]
    - [68, 1162.0]
  - - [704, 3584, 1, 32, 704, 704, 704, 3584]
    - [68, 1127.0]
  - - [1024, 3584, 1, 32, 1024, 1024, 1024, 3584]
    - [64, 1022.0]
  - - [1408, 3584, 1, 32, 1408, 1408, 1408, 3584]
    - [56, 1080.0]
  - - [1856, 3584, 1, 32, 1856, 1856, 1856, 3584]
    - [65, 1058.0]
  - - [2368, 3584, 1, 32, 2368, 2368, 2368, 3584]
    - [63, 1035.0]
  - - [2944, 3584, 1, 32, 2944, 2944, 2944, 3584]
    - [56, 961.0]
  - - [3584, 3584, 1, 32, 3584, 3584, 3584, 3584]
    - [62, 920.0]
  - - [4288, 3584, 1, 32, 4288, 4288, 4288, 3584]
    - [55, 949.0]
  - - [5056, 3584, 1, 32, 5056, 5056, 5056, 3584]
    - [55, 940.0]
  - - [5888, 3584, 1, 32, 5888, 5888, 5888, 3584]
    - [60, 876.0]
  - - [6784, 3584, 1, 32, 6784, 6784, 6784, 3584]
    - [55, 890.0]
  - - [64, 4288, 1, 32, 64, 64, 64, 4288]
    - [62, 541.0]
  - - [128, 4288, 1, 32, 128, 128, 128, 4288]
    - [68, 895.0]
  - - [256, 4288, 1, 32, 256, 256, 256, 4288]
    - [68, 1157.0]
  - - [448, 4288, 1, 32, 448, 448, 448, 4288]
    - [66, 1123.0]
  - - [704, 4288, 1, 32, 704, 704, 704, 4288]
    - [69, 1125.0]
  - - [1024, 4288, 1, 32, 1024, 1024, 1024, 4288]
    - [64, 1017.0]
  - - [1408, 4288, 1, 32, 1408, 1408, 1408, 4288]
    - [56, 1075.0]
  - - [1856, 4288, 1, 32, 1856, 1856, 1856, 4288]
    - [61, 1053.0]
  - - [2368, 4288, 1, 32, 2368, 2368, 2368, 4288]
    - [69, 1027.0]
  - - [2944, 4288, 1, 32, 2944, 2944, 2944, 4288]
    - [56, 967.0]
  - - [3584, 4288, 1, 32, 3584, 3584, 3584, 4288]
    - [64, 912.0]
  - - [4288, 4288, 1, 32, 4288, 4288, 4288, 4288]
    - [55, 944.0]
  - - [5056, 4288, 1, 32, 5056, 5056, 5056, 4288]
    - [55, 939.0]
  - - [5888, 4288, 1, 32, 5888, 5888, 5888, 4288]
    - [55, 883.0]
  - - [6784, 4288, 1, 32, 6784, 6784, 6784, 4288]
    - [57, 886.0]
  - - [64, 5056, 1, 32, 64, 64, 64, 5056]
    - [63, 638.0]
  - - [128, 5056, 1, 32, 128, 128, 128, 5056]
    - [65, 1051.0]
  - - [256, 5056, 1, 32, 256, 256, 256, 5056]
    - [66, 1132.0]
  - - [448, 5056, 1, 32, 448, 448, 448, 5056]
    - [68, 1123.0]
  - - [704, 5056, 1, 32, 704, 704, 704, 5056]
    - [61, 1125.0]
  - - [1024, 5056, 1, 32, 1024, 1024, 1024, 5056]
    - [61, 1020.0]
  - - [1408, 5056, 1, 32, 1408, 1408, 1408, 5056]
    - [56, 1084.0]
  - - [1856, 5056, 1, 32, 1856, 1856, 1856, 5056]
    - [63, 1058.0]
  - - [2368, 5056, 1, 32, 2368, 2368, 2368, 5056]
    - [63, 1033.0]
  - - [2944, 5056, 1, 32, 2944, 2944, 2944, 5056]
    - [60, 965.0]
  - - [3584, 5056, 1, 32, 3584, 3584, 3584, 5056]
    - [63, 919.0]
  - - [4288, 5056, 1, 32, 4288, 4288, 4288, 5056]
    - [57, 950.0]
  - - [5056, 5056, 1, 32, 5056, 5056, 5056, 5056]
    - [55, 946.0]
  - - [5888, 5056, 1, 32, 5888, 5888, 5888, 5056]
    - [57, 874.0]
  - - [6784, 5056, 1, 32, 6784, 6784, 6784, 5056]
    - [55, 890.0]
  - - [64, 5888, 1, 32, 64, 64, 64, 5888]
    - [56, 740.0]
  - - [128, 5888, 1, 32, 128, 128, 128, 5888]
    - [62, 1030.0]
  - - [256, 5888, 1, 32, 256, 256, 256, 5888]
    - [65, 1127.0]
  - - [448, 5888, 1, 32, 448, 448, 448, 5888]
    - [68, 1116.0]
  - - [704, 5888, 1, 32, 704, 704, 704, 5888]
    - [68, 1123.0]
  - - [1024, 5888, 1, 32, 1024, 1024, 1024, 5888]
    - [63, 1027.0]
  - - [1408, 5888, 1, 32, 1408, 1408, 1408, 5888]
    - [56, 1080.0]
  - - [1856, 5888, 1, 32, 1856, 1856, 1856, 5888]
    - [65, 1051.0]
  - - [2368, 5888, 1, 32, 2368, 2368, 2368, 5888]
    - [61, 1035.0]
  - - [2944, 5888, 1, 32, 2944, 2944, 2944, 5888]
    - [55, 968.0]
  - - [3584, 5888, 1, 32, 3584, 3584, 3584, 5888]
    - [63, 914.0]
  - - [4288, 5888, 1, 32, 4288, 4288, 4288, 5888]
    - [55, 948.0]
  - - [5056, 5888, 1, 32, 5056, 5056, 5056, 5888]
    - [57, 946.0]
  - - [5888, 5888, 1, 32, 5888, 5888, 5888, 5888]
    - [58, 882.0]
  - - [6784, 5888, 1, 32, 6784, 6784, 6784, 5888]
    - [57, 890.0]
  - - [64, 6784, 1, 32, 64, 64, 64, 6784]
    - [62, 853.0]
  - - [128, 6784, 1, 32, 128, 128, 128, 6784]
    - [64, 1161.0]
  - - [256, 6784, 1, 32, 256, 256, 256, 6784]
    - [65, 1095.0]
  - - [448, 6784, 1, 32, 448, 448, 448, 6784]
    - [68, 1116.0]
  - - [704, 6784, 1, 32, 704, 704, 704, 6784]
    - [63, 1122.0]
  - - [1024, 6784, 1, 32, 1024, 1024, 1024, 6784]
    - [64, 1033.0]
  - - [1408, 6784, 1, 32, 1408, 1408, 1408, 6784]
    - [60, 1081.0]
  - - [1856, 6784, 1, 32, 1856, 1856, 1856, 6784]
    - [63, 1052.0]
  - - [2368, 6784, 1, 32, 2368, 2368, 2368, 6784]
    - [61, 1032.0]
  - - [2944, 6784, 1, 32, 2944, 2944, 2944, 6784]
    - [57, 963.0]
  - - [3584, 6784, 1, 32, 3584, 3584, 3584, 6784]
    - [56, 914.0]
  - - [4288, 6784, 1, 32, 4288, 4288, 4288, 6784]
    - [55, 952.0]
  - - [5056, 6784, 1, 32, 5056, 5056, 5056, 6784]
    - [55, 943.0]
  - - [5888, 6784, 1, 32, 5888, 5888, 5888, 6784]
    - [55, 879.0]
  - - [6784, 6784, 1, 32, 6784, 6784, 6784, 6784]
    - [55, 888.0]
  - - [32, 32, 1, 256, 32, 32, 32, 32]
    - [56, 5.0]
  - - [32, 32, 1, 1280, 32, 32, 32, 32]
    - [76, 24.0]
  - - [32, 32, 1, 3328, 32, 32, 32, 32]
    - [79, 43.0]
  - - [32, 64, 1, 32, 32, 32, 32, 64]
    - [55, 3.0]
  - - [32, 128, 1, 32, 32, 32, 32, 128]
    - [56, 7.0]
  - - [32, 256, 1, 32, 32, 32, 32, 256]
    - [69, 29.0]
  - - [32, 448, 1, 32, 32, 32, 32, 448]
    - [56, 24.0]
  - - [32, 704, 1, 32, 32, 32, 32, 704]
    - [63, 39.0]
  - - [32, 1024, 1, 32, 32, 32, 32, 1024]
    - [63, 56.0]
  - - [32, 1408, 1, 32, 32, 32, 32, 1408]
    - [63, 77.0]
  - - [32, 1856, 1, 32, 32, 32, 32, 1856]
    - [63, 101.0]
  - - [32, 2368, 1, 32, 32, 32, 32, 2368]
    - [63, 130.0]
  - - [32, 2944, 1, 32, 32, 32, 32, 2944]
    - [63, 157.0]
  - - [32, 3584, 1, 32, 32, 32, 32, 3584]
    - [64, 393.0]
  - - [32, 4288, 1, 32, 32, 32, 32, 4288]
    - [61, 390.0]
  - - [32, 5056, 1, 32, 32, 32, 32, 5056]
    - [61, 451.0]
  - - [32, 5888, 1, 32, 32, 32, 32, 5888]
    - [61, 529.0]
  - - [32, 6784, 1, 32, 32, 32, 32, 6784]
    - [61, 582.0]
  - - [64, 32, 1, 32, 64, 64, 64, 32]
    - [55, 3.0]
  - - [128, 32, 1, 32, 128, 128, 128, 32]
    - [55, 7.0]
  - - [256, 32, 1, 32, 256, 256, 256, 32]
    - [62, 30.0]
  - - [448, 32, 1, 32, 448, 448, 448, 32]
    - [67, 26.0]
  - - [704, 32, 1, 32, 704, 704, 704, 32]
    - [60, 38.0]
  - - [1024, 32, 1, 32, 1024, 1024, 1024, 32]
    - [60, 55.0]
  - - [1408, 32, 1, 32, 1408, 1408, 1408, 32]
    - [60, 76.0]
  - - [1856, 32, 1, 32, 1856, 1856, 1856, 32]
    - [56, 101.0]
  - - [2368, 32, 1, 32, 2368, 2368, 2368, 32]
    - [60, 129.0]
  - - [2944, 32, 1, 32, 2944, 2944, 2944, 32]
    - [60, 160.0]
  - - [3584, 32, 1, 32, 3584, 3584, 3584, 32]
    - [62, 406.0]
  - - [4288, 32, 1, 32, 4288, 4288, 4288, 32]
    - [63, 387.0]
  - - [5056, 32, 1, 32, 5056, 5056, 5056, 32]
    - [61, 463.0]
  - - [5888, 32, 1, 32, 5888, 5888, 5888, 32]
    - [61, 532.0]
  - - [6784, 32, 1, 32, 6784, 6784, 6784, 32]
    - [61, 605.0]
  - - [1, 1, 1, 1, 1, 1, 1, 1]
    - [97, 0.00010975140889173589]
  - - [1, 64, 1, 256, 1, 1, 1, 64]
    - [91, 0.31]
  - - [1, 128, 1, 256, 1, 1, 1, 128]
    - [91, 1.0]
  - - [1, 256, 1, 256, 1, 1, 1, 256]
    - [99, 2.0]
  - - [1, 448, 1, 256, 1, 1, 1, 448]
    - [88, 2.0]
  - - [1, 704, 1, 256, 1, 1, 1, 704]
    - [91, 4.0]
  - - [1, 1024, 1, 256, 1, 1, 1, 1024]
    - [91, 5.0]
  - - [1, 1408, 1, 256, 1, 1, 1, 1408]
    - [91, 7.0]
  - - [1, 1856, 1, 256, 1, 1, 1, 1856]
    - [91, 10.0]
  - - [1, 2368, 1, 256, 1, 1, 1, 2368]
    - [91, 12.0]
  - - [1, 2944, 1, 256, 1, 1, 1, 2944]
    - [91, 15.0]
  - - [1, 3584, 1, 256, 1, 1, 1, 3584]
    - [105, 24.0]
  - - [1, 4288, 1, 256, 1, 1, 1, 4288]
    - [105, 21.0]
  - - [1, 5056, 1, 256, 1, 1, 1, 5056]
    - [102, 24.0]
  - - [1, 5888, 1, 256, 1, 1, 1, 5888]
    - [105, 28.0]
  - - [1, 6784, 1, 256, 1, 1, 1, 6784]
    - [105, 32.0]
  - - [1, 64, 1, 1280, 1, 1, 1, 64]
    - [110, 1.0]
  - - [1, 128, 1, 1280, 1, 1, 1, 128]
    - [116, 3.0]
  - - [1, 256, 1, 1280, 1, 1, 1, 256]
    - [116, 6.0]
  - - [1, 448, 1, 1280, 1, 1, 1, 448]
    - [116, 10.0]
  - - [1, 704, 1, 1280, 1, 1, 1, 704]
    - [119, 20.0]
  - - [1, 1024, 1, 1280, 1, 1, 1, 1024]
    - [119, 22.0]
  - - [1, 1408, 1, 1280, 1, 1, 1, 1408]
    - [119, 30.0]
  - - [1, 1856, 1, 1280, 1, 1, 1, 1856]
    - [119, 30.0]
  - - [1, 2368, 1, 1280, 1, 1, 1, 2368]
    - [114, 32.0]
  - - [1, 2944, 1, 1280, 1, 1, 1, 2944]
    - [117, 32.0]
  - - [1, 3584, 1, 1280, 1, 1, 1, 3584]
    - [117, 38.0]
  - - [1, 4288, 1, 1280, 1, 1, 1, 4288]
    - [117, 39.0]
  - - [1, 5056, 1, 1280, 1, 1, 1, 5056]
    - [115, 38.0]
  - - [1, 5888, 1, 1280, 1, 1, 1, 5888]
    - [113, 40.0]
  - - [1, 6784, 1, 1280, 1, 1, 1, 6784]
    - [115, 42.0]
  - - [1, 64, 1, 3328, 1, 1, 1, 64]
    - [116, 2.0]
  - - [1, 128, 1, 3328, 1, 1, 1, 128]
    - [122, 5.0]
  - - [1, 256, 1, 3328, 1, 1, 1, 256]
    - [122, 10.0]
  - - [1, 448, 1, 3328, 1, 1, 1, 448]
    - [125, 20.0]
  - - [1, 704, 1, 3328, 1, 1, 1, 704]
    - [119, 24.0]
  - - [1, 1024, 1, 3328, 1, 1, 1, 1024]
    - [125, 33.0]
  - - [1, 1408, 1, 3328, 1, 1, 1, 1408]
    - [125, 35.0]
  - - [1, 1856, 1, 3328, 1, 1, 1, 1856]
    - [123, 37.0]
  - - [1, 2368, 1, 3328, 1, 1, 1, 2368]
    - [124, 37.0]
  - - [1, 2944, 1, 3328, 1, 1, 1, 2944]
    - [121, 42.0]
  - - [1, 3584, 1, 3328, 1, 1, 1, 3584]
    - [117, 42.0]
  - - [1, 4288, 1, 3328, 1, 1, 1, 4288]
    - [117, 43.0]
  - - [1, 5056, 1, 3328, 1, 1, 1, 5056]
    - [121, 46.0]
  - - [1, 5888, 1, 3328, 1, 1, 1, 5888]
    - [121, 46.0]
  - - [1, 6784, 1, 3328, 1, 1, 1, 6784]
    - [121, 46.0]
  - - [64, 1, 1, 256, 64, 64, 64, 1]
    - [91, 0.33]
  - - [128, 1, 1, 256, 128, 128, 128, 1]
    - [91, 1.0]
  - - [256, 1, 1, 256, 256, 256, 256, 1]
    - [88, 1.0]
  - - [448, 1, 1, 256, 448, 448, 448, 1]
    - [88, 2.0]
  - - [704, 1, 1, 256, 704, 704, 704, 1]
    - [91, 4.0]
  - - [1024, 1, 1, 256, 1024, 1024, 1024, 1]
    - [91, 5.0]
  - - [1408, 1, 1, 256, 1408, 1408, 1408, 1]
    - [91, 8.0]
  - - [1856, 1, 1, 256, 1856, 1856, 1856, 1]
    - [91, 10.0]
  - - [2368, 1, 1, 256, 2368, 2368, 2368, 1]
    - [91, 13.0]
  - - [2944, 1, 1, 256, 2944, 2944, 2944, 1]
    - [91, 16.0]
  - - [3584, 1, 1, 256, 3584, 3584, 3584, 1]
    - [105, 24.0]
  - - [4288, 1, 1, 256, 4288, 4288, 4288, 1]
    - [109, 21.0]
  - - [5056, 1, 1, 256, 5056, 5056, 5056, 1]
    - [102, 24.0]
  - - [5888, 1, 1, 256, 5888, 5888, 5888, 1]
    - [102, 28.0]
  - - [6784, 1, 1, 256, 6784, 6784, 6784, 1]
    - [102, 32.0]
  - - [64, 1, 1, 1280, 64, 64, 64, 1]
    - [110, 1.0]
  - - [128, 1, 1, 1280, 128, 128, 128, 1]
    - [116, 3.0]
  - - [256, 1, 1, 1280, 256, 256, 256, 1]
    - [116, 6.0]
  - - [448, 1, 1, 1280, 448, 448, 448, 1]
    - [116, 10.0]
  - - [704, 1, 1, 1280, 704, 704, 704, 1]
    - [119, 20.0]
  - - [1024, 1, 1, 1280, 1024, 1024, 1024, 1]
    - [119, 22.0]
  - - [1408, 1, 1, 1280, 1408, 1408, 1408, 1]
    - [117, 29.0]
  - - [1856, 1, 1, 1280, 1856, 1856, 1856, 1]
    - [118, 30.0]
  - - [2368, 1, 1, 1280, 2368, 2368, 2368, 1]
    - [114, 33.0]
  - - [2944, 1, 1, 1280, 2944, 2944, 2944, 1]
    - [117, 32.0]
  - - [3584, 1, 1, 1280, 3584, 3584, 3584, 1]
    - [114, 38.0]
  - - [4288, 1, 1, 1280, 4288, 4288, 4288, 1]
    - [117, 40.0]
  - - [5056, 1, 1, 1280, 5056, 5056, 5056, 1]
    - [111, 37.0]
  - - [5888, 1, 1, 1280, 5888, 5888, 5888, 1]
    - [113, 40.0]
  - - [6784, 1, 1, 1280, 6784, 6784, 6784, 1]
    - [113, 40.0]
  - - [64, 1, 1, 3328, 64, 64, 64, 1]
    - [116, 2.0]
  - - [128, 1, 1, 3328, 128, 128, 128, 1]
    - [122, 5.0]
  - - [256, 1, 1, 3328, 256, 256, 256, 1]
    - [122, 10.0]
  - - [448, 1, 1, 3328, 448, 448, 448, 1]
    - [126, 20.0]
  - - [704, 1, 1, 3328, 704, 704, 704, 1]
    - [120, 24.0]
  - - [1024, 1, 1, 3328, 1024, 1024, 1024, 1]
    - [125, 33.0]
  - - [1408, 1, 1, 3328, 1408, 1408, 1408, 1]
    - [125, 35.0]
  - - [1856, 1, 1, 3328, 1856, 1856, 1856, 1]
    - [124, 36.0]
  - - [2368, 1, 1, 3328, 2368, 2368, 2368, 1]
    - [124, 38.0]
  - - [2944, 1, 1, 3328, 2944, 2944, 2944, 1]
    - [124, 40.0]
  - - [3584, 1, 1, 3328, 3584, 3584, 3584, 1]
    - [125, 43.0]
  - - [4288, 1, 1, 3328, 4288, 4288, 4288, 1]
    - [117, 43.0]
  - - [5056, 1, 1, 3328, 5056, 5056, 5056, 1]
    - [124, 44.0]
  - - [5888, 1, 1, 3328, 5888, 5888, 5888, 1]
    - [124, 43.0]
  - - [6784, 1, 1, 3328, 6784, 6784, 6784, 1]
    - [119, 43.0]
  - - [64, 64, 1, 1, 64, 64, 64, 64]
    - [94, 0.28]
  - - [128, 64, 1, 1, 128, 128, 128, 64]
    - [88, 1.0]
  - - [256, 64, 1, 1, 256, 256, 256, 64]
    - [91, 3.0]
  - - [448, 64, 1, 1, 448, 448, 448, 64]
    - [92, 3.0]
  - - [704, 64, 1, 1, 704, 704, 704, 64]
    - [87, 3.0]
  - - [1024, 64, 1, 1, 1024, 1024, 1024, 64]
    - [91, 5.0]
  - - [1408, 64, 1, 1, 1408, 1408, 1408, 64]
    - [94, 7.0]
  - - [1856, 64, 1, 1, 1856, 1856, 1856, 64]
    - [88, 9.0]
  - - [2368, 64, 1, 1, 2368, 2368, 2368, 64]
    - [88, 11.0]
  - - [2944, 64, 1, 1, 2944, 2944, 2944, 64]
    - [87, 28.0]
  - - [3584, 64, 1, 1, 3584, 3584, 3584, 64]
    - [88, 36.0]
  - - [4288, 64, 1, 1, 4288, 4288, 4288, 64]
    - [88, 25.0]
  - - [5056, 64, 1, 1, 5056, 5056, 5056, 64]
    - [88, 29.0]
  - - [5888, 64, 1, 1, 5888, 5888, 5888, 64]
    - [88, 34.0]
  - - [6784, 64, 1, 1, 6784, 6784, 6784, 64]
    - [91, 40.0]
  - - [64, 128, 1, 1, 64, 64, 64, 128]
    - [88, 1.0]
  - - [128, 128, 1, 1, 128, 128, 128, 128]
    - [87, 1.0]
  - - [256, 128, 1, 1, 256, 256, 256, 128]
    - [97, 3.0]
  - - [448, 128, 1, 1, 448, 448, 448, 128]
    - [91, 5.0]
  - - [704, 128, 1, 1, 704, 704, 704, 128]
    - [91, 7.0]
  - - [1024, 128, 1, 1, 1024, 1024, 1024, 128]
    - [94, 10.0]
  - - [1408, 128, 1, 1, 1408, 1408, 1408, 128]
    - [88, 13.0]
  - - [1856, 128, 1, 1, 1856, 1856, 1856, 128]
    - [94, 33.0]
  - - [2368, 128, 1, 1, 2368, 2368, 2368, 128]
    - [88, 27.0]
  - - [2944, 128, 1, 1, 2944, 2944, 2944, 128]
    - [88, 34.0]
  - - [3584, 128, 1, 1, 3584, 3584, 3584, 128]
    - [91, 42.0]
  - - [4288, 128, 1, 1, 4288, 4288, 4288, 128]
    - [91, 45.0]
  - - [5056, 128, 1, 1, 5056, 5056, 5056, 128]
    - [88, 52.0]
  - - [5888, 128, 1, 1, 5888, 5888, 5888, 128]
    - [88, 53.0]
  - - [6784, 128, 1, 1, 6784, 6784, 6784, 128]
    - [91, 56.0]
  - - [64, 256, 1, 1, 64, 64, 64, 256]
    - [86, 1.0]
  - - [128, 256, 1, 1, 128, 128, 128, 256]
    - [88, 2.0]
  - - [256, 256, 1, 1, 256, 256, 256, 256]
    - [88, 5.0]
  - - [448, 256, 1, 1, 448, 448, 448, 256]
    - [88, 8.0]
  - - [704, 256, 1, 1, 704, 704, 704, 256]
    - [88, 13.0]
  - - [1024, 256, 1, 1, 1024, 1024, 1024, 256]
    - [88, 36.0]
  - - [1408, 256, 1, 1, 1408, 1408, 1408, 256]
    - [94, 33.0]
  - - [1856, 256, 1, 1, 1856, 1856, 1856, 256]
    - [91, 39.0]
  - - [2368, 256, 1, 1, 2368, 2368, 2368, 256]
    - [94, 49.0]
  - - [2944, 256, 1, 1, 2944, 2944, 2944, 256]
    - [94, 56.0]
  - - [3584, 256, 1, 1, 3584, 3584, 3584, 256]
    - [88, 55.0]
  - - [4288, 256, 1, 1, 4288, 4288, 4288, 256]
    - [93, 49.0]
  - - [5056, 256, 1, 1, 5056, 5056, 5056, 256]
    - [88, 47.0]
  - - [5888, 256, 1, 1, 5888, 5888, 5888, 256]
    - [87, 45.0]
  - - [6784, 256, 1, 1, 6784, 6784, 6784, 256]
    - [92, 42.0]
  - - [64, 448, 1, 1, 64, 64, 64, 448]
    - [95, 3.0]
  - - [128, 448, 1, 1, 128, 128, 128, 448]
    - [88, 4.0]
  - - [256, 448, 1, 1, 256, 256, 256, 448]
    - [88, 8.0]
  - - [448, 448, 1, 1, 448, 448, 448, 448]
    - [99, 33.0]
  - - [704, 448, 1, 1, 704, 704, 704, 448]
    - [97, 30.0]
  - - [1024, 448, 1, 1, 1024, 1024, 1024, 448]
    - [88, 42.0]
  - - [1408, 448, 1, 1, 1408, 1408, 1408, 448]
    - [88, 50.0]
  - - [1856, 448, 1, 1, 1856, 1856, 1856, 448]
    - [88, 59.0]
  - - [2368, 448, 1, 1, 2368, 2368, 2368, 448]
    - [88, 51.0]
  - - [2944, 448, 1, 1, 2944, 2944, 2944, 448]
    - [88, 47.0]
  - - [3584, 448, 1, 1, 3584, 3584, 3584, 448]
    - [91, 42.0]
  - - [4288, 448, 1, 1, 4288, 4288, 4288, 448]
    - [90, 41.0]
  - - [5056, 448, 1, 1, 5056, 5056, 5056, 448]
    - [86, 39.0]
  - - [5888, 448, 1, 1, 5888, 5888, 5888, 448]
    - [93, 37.0]
  - - [6784, 448, 1, 1, 6784, 6784, 6784, 448]
    - [106, 37.0]
  - - [64, 704, 1, 1, 64, 64, 64, 704]
    - [88, 3.0]
  - - [128, 704, 1, 1, 128, 128, 128, 704]
    - [88, 6.0]
  - - [256, 704, 1, 1, 256, 256, 256, 704]
    - [88, 13.0]
  - - [448, 704, 1, 1, 448, 448, 448, 704]
    - [88, 30.0]
  - - [704, 704, 1, 1, 704, 704, 704, 704]
    - [88, 42.0]
  - - [1024, 704, 1, 1, 1024, 1024, 1024, 704]
    - [88, 49.0]
  - - [1408, 704, 1, 1, 1408, 1408, 1408, 704]
    - [88, 53.0]
  - - [1856, 704, 1, 1, 1856, 1856, 1856, 704]
    - [88, 48.0]
  - - [2368, 704, 1, 1, 2368, 2368, 2368, 704]
    - [91, 45.0]
  - - [2944, 704, 1, 1, 2944, 2944, 2944, 704]
    - [88, 40.0]
  - - [3584, 704, 1, 1, 3584, 3584, 3584, 704]
    - [88, 37.0]
  - - [4288, 704, 1, 1, 4288, 4288, 4288, 704]
    - [89, 38.0]
  - - [5056, 704, 1, 1, 5056, 5056, 5056, 704]
    - [103, 37.0]
  - - [5888, 704, 1, 1, 5888, 5888, 5888, 704]
    - [88, 34.0]
  - - [6784, 704, 1, 1, 6784, 6784, 6784, 704]
    - [88, 34.0]
  - - [64, 1024, 1, 1, 64, 64, 64, 1024]
    - [91, 5.0]
  - - [128, 1024, 1, 1, 128, 128, 128, 1024]
    - [94, 10.0]
  - - [256, 1024, 1, 1, 256, 256, 256, 1024]
    - [94, 37.0]
  - - [448, 1024, 1, 1, 448, 448, 448, 1024]
    - [94, 45.0]
  - - [704, 1024, 1, 1, 704, 704, 704, 1024]
    - [94, 52.0]
  - - [1024, 1024, 1, 1, 1024, 1024, 1024, 1024]
    - [88, 40.0]
  - - [1408, 1024, 1, 1, 1408, 1408, 1408, 1024]
    - [94, 47.0]
  - - [1856, 1024, 1, 1, 1856, 1856, 1856, 1024]
    - [88, 43.0]
  - - [2368, 1024, 1, 1, 2368, 2368, 2368, 1024]
    - [88, 41.0]
  - - [2944, 1024, 1, 1, 2944, 2944, 2944, 1024]
    - [91, 38.0]
  - - [3584, 1024, 1, 1, 3584, 3584, 3584, 1024]
    - [91, 36.0]
  - - [4288, 1024, 1, 1, 4288, 4288, 4288, 1024]
    - [88, 36.0]
  - - [5056, 1024, 1, 1, 5056, 5056, 5056, 1024]
    - [95, 36.0]
  - - [5888, 1024, 1, 1, 5888, 5888, 5888, 1024]
    - [91, 33.0]
  - - [6784, 1024, 1, 1, 6784, 6784, 6784, 1024]
    - [94, 33.0]
  - - [64, 1408, 1, 1, 64, 64, 64, 1408]
    - [88, 7.0]
  - - [128, 1408, 1, 1, 128, 128, 128, 1408]
    - [88, 13.0]
  - - [256, 1408, 1, 1, 256, 256, 256, 1408]
    - [88, 36.0]
  - - [448, 1408, 1, 1, 448, 448, 448, 1408]
    - [97, 51.0]
  - - [704, 1408, 1, 1, 704, 704, 704, 1408]
    - [91, 51.0]
  - - [1024, 1408, 1, 1, 1024, 1024, 1024, 1408]
    - [91, 39.0]
  - - [1408, 1408, 1, 1, 1408, 1408, 1408, 1408]
    - [88, 43.0]
  - - [1856, 1408, 1, 1, 1856, 1856, 1856, 1408]
    - [88, 41.0]
  - - [2368, 1408, 1, 1, 2368, 2368, 2368, 1408]
    - [97, 40.0]
  - - [2944, 1408, 1, 1, 2944, 2944, 2944, 1408]
    - [91, 37.0]
  - - [3584, 1408, 1, 1, 3584, 3584, 3584, 1408]
    - [88, 35.0]
  - - [4288, 1408, 1, 1, 4288, 4288, 4288, 1408]
    - [91, 36.0]
  - - [5056, 1408, 1, 1, 5056, 5056, 5056, 1408]
    - [95, 36.0]
  - - [5888, 1408, 1, 1, 5888, 5888, 5888, 1408]
    - [91, 32.0]
  - - [6784, 1408, 1, 1, 6784, 6784, 6784, 1408]
    - [91, 32.0]
  - - [64, 1856, 1, 1, 64, 64, 64, 1856]
    - [94, 9.0]
  - - [128, 1856, 1, 1, 128, 128, 128, 1856]
    - [91, 33.0]
  - - [256, 1856, 1, 1, 256, 256, 256, 1856]
    - [91, 41.0]
  - - [448, 1856, 1, 1, 448, 448, 448, 1856]
    - [88, 56.0]
  - - [704, 1856, 1, 1, 704, 704, 704, 1856]
    - [88, 47.0]
  - - [1024, 1856, 1, 1, 1024, 1024, 1024, 1856]
    - [88, 38.0]
  - - [1408, 1856, 1, 1, 1408, 1408, 1408, 1856]
    - [97, 42.0]
  - - [1856, 1856, 1, 1, 1856, 1856, 1856, 1856]
    - [88, 40.0]
  - - [2368, 1856, 1, 1, 2368, 2368, 2368, 1856]
    - [88, 39.0]
  - - [2944, 1856, 1, 1, 2944, 2944, 2944, 1856]
    - [105, 36.0]
  - - [3584, 1856, 1, 1, 3584, 3584, 3584, 1856]
    - [91, 34.0]
  - - [4288, 1856, 1, 1, 4288, 4288, 4288, 1856]
    - [88, 35.0]
  - - [5056, 1856, 1, 1, 5056, 5056, 5056, 1856]
    - [89, 35.0]
  - - [5888, 1856, 1, 1, 5888, 5888, 5888, 1856]
    - [94, 32.0]
  - - [6784, 1856, 1, 1, 6784, 6784, 6784, 1856]
    - [91, 32.0]
  - - [64, 2368, 1, 1, 64, 64, 64, 2368]
    - [88, 11.0]
  - - [128, 2368, 1, 1, 128, 128, 128, 2368]
    - [88, 30.0]
  - - [256, 2368, 1, 1, 256, 256, 256, 2368]
    - [88, 52.0]
  - - [448, 2368, 1, 1, 448, 448, 448, 2368]
    - [88, 52.0]
  - - [704, 2368, 1, 1, 704, 704, 704, 2368]
    - [88, 44.0]
  - - [1024, 2368, 1, 1, 1024, 1024, 1024, 2368]
    - [91, 38.0]
  - - [1408, 2368, 1, 1, 1408, 1408, 1408, 2368]
    - [97, 40.0]
  - - [1856, 2368, 1, 1, 1856, 1856, 1856, 2368]
    - [88, 39.0]
  - - [2368, 2368, 1, 1, 2368, 2368, 2368, 2368]
    - [88, 39.0]
  - - [2944, 2368, 1, 1, 2944, 2944, 2944, 2368]
    - [91, 35.0]
  - - [3584, 2368, 1, 1, 3584, 3584, 3584, 2368]
    - [88, 33.0]
  - - [4288, 2368, 1, 1, 4288, 4288, 4288, 2368]
    - [88, 35.0]
  - - [5056, 2368, 1, 1, 5056, 5056, 5056, 2368]
    - [89, 35.0]
  - - [5888, 2368, 1, 1, 5888, 5888, 5888, 2368]
    - [107, 32.0]
  - - [6784, 2368, 1, 1, 6784, 6784, 6784, 2368]
    - [107, 32.0]
  - - [64, 2944, 1, 1, 64, 64, 64, 2944]
    - [91, 31.0]
  - - [128, 2944, 1, 1, 128, 128, 128, 2944]
    - [88, 37.0]
  - - [256, 2944, 1, 1, 256, 256, 256, 2944]
    - [88, 57.0]
  - - [448, 2944, 1, 1, 448, 448, 448, 2944]
    - [88, 49.0]
  - - [704, 2944, 1, 1, 704, 704, 704, 2944]
    - [88, 43.0]
  - - [1024, 2944, 1, 1, 1024, 1024, 1024, 2944]
    - [97, 37.0]
  - - [1408, 2944, 1, 1, 1408, 1408, 1408, 2944]
    - [88, 39.0]
  - - [1856, 2944, 1, 1, 1856, 1856, 1856, 2944]
    - [88, 39.0]
  - - [2368, 2944, 1, 1, 2368, 2368, 2368, 2944]
    - [88, 38.0]
  - - [2944, 2944, 1, 1, 2944, 2944, 2944, 2944]
    - [105, 35.0]
  - - [3584, 2944, 1, 1, 3584, 3584, 3584, 2944]
    - [105, 33.0]
  - - [4288, 2944, 1, 1, 4288, 4288, 4288, 2944]
    - [91, 35.0]
  - - [5056, 2944, 1, 1, 5056, 5056, 5056, 2944]
    - [89, 35.0]
  - - [5888, 2944, 1, 1, 5888, 5888, 5888, 2944]
    - [88, 31.0]
  - - [6784, 2944, 1, 1, 6784, 6784, 6784, 2944]
    - [88, 31.0]
  - - [64, 3584, 1, 1, 64, 64, 64, 3584]
    - [88, 37.0]
  - - [128, 3584, 1, 1, 128, 128, 128, 3584]
    - [91, 45.0]
  - - [256, 3584, 1, 1, 256, 256, 256, 3584]
    - [88, 56.0]
  - - [448, 3584, 1, 1, 448, 448, 448, 3584]
    - [88, 45.0]
  - - [704, 3584, 1, 1, 704, 704, 704, 3584]
    - [91, 42.0]
  - - [1024, 3584, 1, 1, 1024, 1024, 1024, 3584]
    - [88, 37.0]
  - - [1408, 3584, 1, 1, 1408, 1408, 1408, 3584]
    - [91, 38.0]
  - - [1856, 3584, 1, 1, 1856, 1856, 1856, 3584]
    - [88, 38.0]
  - - [2368, 3584, 1, 1, 2368, 2368, 2368, 3584]
    - [91, 38.0]
  - - [2944, 3584, 1, 1, 2944, 2944, 2944, 3584]
    - [88, 34.0]
  - - [3584, 3584, 1, 1, 3584, 3584, 3584, 3584]
    - [101, 33.0]
  - - [4288, 3584, 1, 1, 4288, 4288, 4288, 3584]
    - [98, 35.0]
  - - [5056, 3584, 1, 1, 5056, 5056, 5056, 3584]
    - [89, 35.0]
  - - [5888, 3584, 1, 1, 5888, 5888, 5888, 3584]
    - [94, 31.0]
  - - [6784, 3584, 1, 1, 6784, 6784, 6784, 3584]
    - [88, 31.0]
  - - [64, 4288, 1, 1, 64, 64, 64, 4288]
    - [91, 27.0]
  - - [128, 4288, 1, 1, 128, 128, 128, 4288]
    - [94, 47.0]
  - - [256, 4288, 1, 1, 256, 256, 256, 4288]
    - [94, 51.0]
  - - [448, 4288, 1, 1, 448, 448, 448, 4288]
    - [88, 44.0]
  - - [704, 4288, 1, 1, 704, 704, 704, 4288]
    - [88, 41.0]
  - - [1024, 4288, 1, 1, 1024, 1024, 1024, 4288]
    - [88, 37.0]
  - - [1408, 4288, 1, 1, 1408, 1408, 1408, 4288]
    - [91, 38.0]
  - - [1856, 4288, 1, 1, 1856, 1856, 1856, 4288]
    - [88, 38.0]
  - - [2368, 4288, 1, 1, 2368, 2368, 2368, 4288]
    - [97, 38.0]
  - - [2944, 4288, 1, 1, 2944, 2944, 2944, 4288]
    - [109, 35.0]
  - - [3584, 4288, 1, 1, 3584, 3584, 3584, 4288]
    - [88, 32.0]
  - - [4288, 4288, 1, 1, 4288, 4288, 4288, 4288]
    - [88, 34.0]
  - - [5056, 4288, 1, 1, 5056, 5056, 5056, 4288]
    - [89, 35.0]
  - - [5888, 4288, 1, 1, 5888, 5888, 5888, 4288]
    - [88, 31.0]
  - - [6784, 4288, 1, 1, 6784, 6784, 6784, 4288]
    - [88, 31.0]
  - - [64, 5056, 1, 1, 64, 64, 64, 5056]
    - [91, 32.0]
  - - [128, 5056, 1, 1, 128, 128, 128, 5056]
    - [91, 55.0]
  - - [256, 5056, 1, 1, 256, 256, 256, 5056]
    - [94, 50.0]
  - - [448, 5056, 1, 1, 448, 448, 448, 5056]
    - [94, 43.0]
  - - [704, 5056, 1, 1, 704, 704, 704, 5056]
    - [88, 41.0]
  - - [1024, 5056, 1, 1, 1024, 1024, 1024, 5056]
    - [104, 37.0]
  - - [1408, 5056, 1, 1, 1408, 1408, 1408, 5056]
    - [104, 38.0]
  - - [1856, 5056, 1, 1, 1856, 1856, 1856, 5056]
    - [88, 38.0]
  - - [2368, 5056, 1, 1, 2368, 2368, 2368, 5056]
    - [88, 37.0]
  - - [2944, 5056, 1, 1, 2944, 2944, 2944, 5056]
    - [88, 34.0]
  - - [3584, 5056, 1, 1, 3584, 3584, 3584, 5056]
    - [107, 33.0]
  - - [4288, 5056, 1, 1, 4288, 4288, 4288, 5056]
    - [88, 34.0]
  - - [5056, 5056, 1, 1, 5056, 5056, 5056, 5056]
    - [89, 35.0]
  - - [5888, 5056, 1, 1, 5888, 5888, 5888, 5056]
    - [102, 31.0]
  - - [6784, 5056, 1, 1, 6784, 6784, 6784, 5056]
    - [88, 31.0]
  - - [64, 5888, 1, 1, 64, 64, 64, 5888]
    - [94, 37.0]
  - - [128, 5888, 1, 1, 128, 128, 128, 5888]
    - [91, 58.0]
  - - [256, 5888, 1, 1, 256, 256, 256, 5888]
    - [97, 47.0]
  - - [448, 5888, 1, 1, 448, 448, 448, 5888]
    - [88, 42.0]
  - - [704, 5888, 1, 1, 704, 704, 704, 5888]
    - [88, 40.0]
  - - [1024, 5888, 1, 1, 1024, 1024, 1024, 5888]
    - [104, 37.0]
  - - [1408, 5888, 1, 1, 1408, 1408, 1408, 5888]
    - [94, 37.0]
  - - [1856, 5888, 1, 1, 1856, 1856, 1856, 5888]
    - [88, 38.0]
  - - [2368, 5888, 1, 1, 2368, 2368, 2368, 5888]
    - [88, 37.0]
  - - [2944, 5888, 1, 1, 2944, 2944, 2944, 5888]
    - [104, 34.0]
  - - [3584, 5888, 1, 1, 3584, 3584, 3584, 5888]
    - [91, 32.0]
  - - [4288, 5888, 1, 1, 4288, 4288, 4288, 5888]
    - [88, 34.0]
  - - [5056, 5888, 1, 1, 5056, 5056, 5056, 5888]
    - [89, 35.0]
  - - [5888, 5888, 1, 1, 5888, 5888, 5888, 5888]
    - [86, 30.0]
  - - [6784, 5888, 1, 1, 6784, 6784, 6784, 5888]
    - [88, 31.0]
  - - [64, 6784, 1, 1, 64, 64, 64, 6784]
    - [91, 42.0]
  - - [128, 6784, 1, 1, 128, 128, 128, 6784]
    - [91, 59.0]
  - - [256, 6784, 1, 1, 256, 256, 256, 6784]
    - [94, 46.0]
  - - [448, 6784, 1, 1, 448, 448, 448, 6784]
    - [88, 41.0]
  - - [704, 6784, 1, 1, 704, 704, 704, 6784]
    - [88, 40.0]
  - - [1024, 6784, 1, 1, 1024, 1024, 1024, 6784]
    - [91, 37.0]
  - - [1408, 6784, 1, 1, 1408, 1408, 1408, 6784]
    - [94, 38.0]
  - - [1856, 6784, 1, 1, 1856, 1856, 1856, 6784]
    - [88, 38.0]
  - - [2368, 6784, 1, 1, 2368, 2368, 2368, 6784]
    - [88, 37.0]
  - - [2944, 6784, 1, 1, 2944, 2944, 2944, 6784]
    - [104, 34.0]
  - - [3584, 6784, 1, 1, 3584, 3584, 3584, 6784]
    - [107, 32.0]
  - - [4288, 6784, 1, 1, 4288, 4288, 4288, 6784]
    - [88, 34.0]
  - - [5056, 6784, 1, 1, 5056, 5056, 5056, 6784]
    - [89, 35.0]
  - - [5888, 6784, 1, 1, 5888, 5888, 5888, 6784]
    - [86, 30.0]
  - - [6784, 6784, 1, 1, 6784, 6784, 6784, 6784]
    - [88, 31.0]
  - - [1, 1, 1, 256, 1, 1, 1, 1]
    - [91, 0.005324902230966603]
  - - [1, 1, 1, 1280, 1, 1, 1, 1]
    - [112, 0.02]
  - - [1, 1, 1, 3328, 1, 1, 1, 1]
    - [122, 0.04]
  - - [1, 64, 1, 1, 1, 1, 1, 64]
    - [94, 0.006041725743126056]
  - - [1, 128, 1, 1, 1, 1, 1, 128]
    - [88, 0.01]
  - - [1, 256, 1, 1, 1, 1, 1, 256]
    - [91, 0.06]
  - - [1, 448, 1, 1, 1, 1, 1, 448]
    - [86, 0.07]
  - - [1, 704, 1, 1, 1, 1, 1, 704]
    - [91, 0.09]
  - - [1, 1024, 1, 1, 1, 1, 1, 1024]
    - [88, 0.1]
  - - [1, 1408, 1, 1, 1, 1, 1, 1408]
    - [88, 0.14]
  - - [1, 1856, 1, 1, 1, 1, 1, 1856]
    - [91, 0.19]
  - - [1, 2368, 1, 1, 1, 1, 1, 2368]
    - [88, 0.24]
  - - [1, 2944, 1, 1, 1, 1, 1, 2944]
    - [88, 0.29]
  - - [1, 3584, 1, 1, 1, 1, 1, 3584]
    - [88, 1.0]
  - - [1, 4288, 1, 1, 1, 1, 1, 4288]
    - [88, 1.0]
  - - [1, 5056, 1, 1, 1, 1, 1, 5056]
    - [88, 1.0]
  - - [1, 5888, 1, 1, 1, 1, 1, 5888]
    - [88, 1.0]
  - - [1, 6784, 1, 1, 1, 1, 1, 6784]
    - [87, 1.0]
  - - [64, 1, 1, 1, 64, 64, 64, 1]
    - [108, 0.008228336241690778]
  - - [128, 1, 1, 1, 128, 128, 128, 1]
    - [88, 0.02]
  - - [256, 1, 1, 1, 256, 256, 256, 1]
    - [96, 0.06]
  - - [448, 1, 1, 1, 448, 448, 448, 1]
    - [100, 0.07]
  - - [704, 1, 1, 1, 704, 704, 704, 1]
    - [94, 0.09]
  - - [1024, 1, 1, 1, 1024, 1024, 1024, 1]
    - [91, 0.13]
  - - [1408, 1, 1, 1, 1408, 1408, 1408, 1]
    - [88, 0.17]
  - - [1856, 1, 1, 1, 1856, 1856, 1856, 1]
    - [88, 0.23]
  - - [2368, 1, 1, 1, 2368, 2368, 2368, 1]
    - [88, 0.29]
  - - [2944, 1, 1, 1, 2944, 2944, 2944, 1]
    - [88, 0.36]
  - - [3584, 1, 1, 1, 3584, 3584, 3584, 1]
    - [87, 1.0]
  - - [4288, 1, 1, 1, 4288, 4288, 4288, 1]
    - [87, 1.0]
  - - [5056, 1, 1, 1, 5056, 5056, 5056, 1]
    - [87, 1.0]
  - - [5888, 1, 1, 1, 5888, 5888, 5888, 1]
    - [87, 1.0]
  - - [6784, 1, 1, 1, 6784, 6784, 6784, 1]
    - [86, 1.0]
- null
