library/src/blas3/Tensile/Logic/asm_full/aldebaran/equality/aldebaran_Cijk_Ailk_Bljk_SB.yaml
- {MinimumRequiredVersion: 4.34.0}
- aldebaran
- gfx90a
- [Device 0050, Device 0051, Device 0052, Device 0054, Device 0062, Device 7400, Device
    SolutionIndex: 0
    SolutionNameMin: Cijk_Ailk_Bljk_SB_MT64x64x16_MI32x32x2x1_SE_1LDSB0_AF0EM1_AF1EM1_AMAS0_DVO0_EPS0_FL0_GRVW1_GSU1_GSUASB_IU1_LBSPP128_LPB2_LRVW2_NEPBS0_NLCA1_ONLL1_PGR2_PLR9_SIA3_SS0_SU0_SUS0_SRVW2_SVW4_TT1_32_TLDS1_VW1_WSGRA1_WSGRB1_WG64_4_1_WGM1
    SolutionIndex: 1
    SolutionNameMin: Cijk_Ailk_Bljk_SB_MT64x64x16_MI32x32x2x1_SN_1LDSB1_AF0EM1_AF1EM1_AMAS0_DVO0_EPS0_FL0_GRVW4_GSU1_GSUASB_IU1_LBSPP128_LPB4_LRVW2_NEPBS4_NLCA1_ONLL1_PGR2_PLR9_SIA3_SS1_SU32_SUS256_SRVW0_SVW1_TT1_32_TLDS1_VW1_WSGRA1_WSGRB1_WG64_4_1_WGM5
    SolutionIndex: 2
    SolutionNameMin: Cijk_Ailk_Bljk_SB_MT128x64x16_MI32x32x2x1_SN_1LDSB1_AF0EM1_AF1EM1_AMAS3_DVO0_EPS0_FL0_GRVW4_GSU1_GSUASB_IU1_LBSPP128_LPB4_LRVW2_NEPBS1_NLCA1_ONLL1_PGR2_PLR9_SIA3_SS1_SU0_SUS0_SRVW0_SVW2_TT2_32_TLDS1_VW2_WSGRA1_WSGRB1_WG64_4_1_WGM5
    SolutionIndex: 3
    SolutionNameMin: Cijk_Ailk_Bljk_SB_MT64x32x32_MI16x16x4x1_SE_1LDSB0_AF0EM1_AF1EM1_AMAS0_DVO0_EPS0_FL0_GRVW2_GSU1_GSUASB_IU1_LBSPP128_LPB2_LRVW2_NEPBS0_NLCA1_ONLL1_PGR2_PLR9_SIA3_SS0_SU0_SUS0_SRVW2_SVW4_TT2_16_TLDS1_VW1_WSGRA1_WSGRB1_WG32_8_1_WGM2
    SolutionIndex: 4
    SolutionNameMin: Cijk_Ailk_Bljk_SB_MT64x32x32_MI16x16x4x1_SN_1LDSB1_AF0EM1_AF1EM1_AMAS3_DVO0_EPS0_FL0_GRVW4_GSU1_GSUASB_IU1_LBSPP128_LPB4_LRVW2_NEPBS1_NLCA1_ONLL1_PGR2_PLR9_SIA3_SS1_SU32_SUS256_SRVW0_SVW2_TT2_16_TLDS1_VW2_WSGRA1_WSGRB1_WG32_8_1_WGM10
    SolutionIndex: 5
    SolutionNameMin: Cijk_Ailk_Bljk_SB_MT64x64x32_MI32x32x2x1_SE_1LDSB0_AF0EM1_AF1EM1_AMAS0_DVO0_EPS0_FL0_GRVW2_GSU1_GSUASB_IU1_LBSPP128_LPB2_LRVW2_NEPBS0_NLCA1_ONLL1_PGR2_PLR17_SIA3_SS0_SU0_SUS0_SRVW2_SVW4_TT1_32_TLDS1_VW1_WSGRA1_WSGRB1_WG64_4_1_WGM2
    SolutionIndex: 6
    SolutionNameMin: Cijk_Ailk_Bljk_SB_MT64x128x16_MI32x32x2x1_SE_1LDSB0_AF0EM1_AF1EM1_AMAS0_DVO0_EPS0_FL0_GRVW1_GSU1_GSUASB_IU1_LBSPP128_LPB2_LRVW2_NEPBS0_NLCA1_ONLL1_PGR2_PLR9_SIA3_SS0_SU0_SUS0_SRVW2_SVW4_TT1_64_TLDS1_VW1_WSGRA1_WSGRB1_WG64_4_1_WGM2
    SolutionIndex: 7
    SolutionNameMin: Cijk_Ailk_Bljk_SB_MT64x32x32_MI16x16x4x1_SN_1LDSB1_AF0EM1_AF1EM1_AMAS3_DVO0_EPS0_FL0_GRVW4_GSU1_GSUASB_IU1_LBSPP128_LPB4_LRVW2_NEPBS2_NLCA1_ONLL1_PGR2_PLR9_SIA3_SS1_SU32_SUS256_SRVW0_SVW2_TT2_16_TLDS1_VW2_WSGRA1_WSGRB1_WG32_8_1_WGM5
    SolutionIndex: 8
    SolutionNameMin: Cijk_Ailk_Bljk_SB_MT96x96x16_MI16x16x4x1_SN_1LDSB1_AF0EM1_AF1EM1_AMAS0_DVO0_EPS0_FL0_GRVW2_GSU1_GSUASB_IU1_LBSPP128_LPB2_LRVW2_NEPBS2_NLCA3_ONLL1_PGR2_PLR5_SIA3_SS1_SU32_SUS256_SRVW0_SVW1_TT3_48_TLDS1_VW1_WSGRA1_WSGRB1_WG32_8_1_WGM5
    SolutionIndex: 9
    SolutionNameMin: Cijk_Ailk_Bljk_SB_MT64x128x32_MI32x32x2x1_SE_1LDSB0_AF0EM1_AF1EM1_AMAS0_DVO0_EPS0_FL0_GRVW1_GSU1_GSUASB_IU1_LBSPP128_LPB2_LRVW2_NEPBS0_NLCA1_ONLL1_PGR2_PLR17_SIA3_SS0_SU0_SUS0_SRVW2_SVW4_TT1_64_TLDS1_VW1_WSGRA1_WSGRB1_WG64_4_1_WGM15
    SolutionIndex: 10
    SolutionNameMin: Cijk_Ailk_Bljk_SB_MT128x96x16_MI32x32x2x1_SE_1LDSB0_AF0EM1_AF1EM1_AMAS0_DVO0_EPS0_FL0_GRVW2_GSU1_GSUASB_IU1_LBSPP128_LPB2_LRVW2_NEPBS0_NLCA1_ONLL1_PGR2_PLR9_SIA3_SS0_SU0_SUS0_SRVW2_SVW4_TT1_96_TLDS1_VW1_WSGRA1_WSGRB1_WG128_2_1_WGM15
    SolutionIndex: 11
    SolutionNameMin: Cijk_Ailk_Bljk_SB_MT64x32x32_MI16x16x4x1_SE_1LDSB0_AF0EM1_AF1EM1_AMAS0_DVO0_EPS0_FL0_GRVW2_GSU1_GSUASB_IU1_LBSPP128_LPB2_LRVW2_NEPBS0_NLCA1_ONLL1_PGR2_PLR9_SIA3_SS0_SU32_SUS256_SRVW2_SVW4_TT2_16_TLDS1_VW1_WSGRA1_WSGRB1_WG32_8_1_WGM1
    SolutionIndex: 12
    SolutionNameMin: Cijk_Ailk_Bljk_SB_MT128x64x16_MI32x32x2x1_SE_1LDSB0_AF0EM1_AF1EM1_AMAS0_DVO0_EPS0_FL0_GRVW2_GSU1_GSUASB_IU1_LBSPP128_LPB2_LRVW2_NEPBS0_NLCA1_ONLL1_PGR2_PLR9_SIA3_SS0_SU32_SUS256_SRVW2_SVW4_TT2_32_TLDS1_VW1_WSGRA1_WSGRB1_WG64_4_1_WGM15
    SolutionIndex: 13
    SolutionNameMin: Cijk_Ailk_Bljk_SB_MT64x64x16_MI16x16x4x1_SE_1LDSB0_AF0EM1_AF1EM1_AMAS0_DVO0_EPS1_FL0_GRVW4_GSU1_GSUASB_IU1_LBSPP0_LPB0_LRVW1_NEPBS0_NLCA1_ONLL1_PGR1_PLR1_SIA3_SS0_SU32_SUS256_SRVW0_SVW4_TT2_32_TLDS0_VW1_WSGRA1_WSGRB1_WG32_8_1_WGM8
- - - [1024, 384, 1, 1024]
    - [3, 48.778]
  - - [1024, 384, 2, 1024]
    - [0, 61.615]
  - - [1024, 384, 32, 1024]
    - [2, 93.867]
  - - [1024, 384, 1, 4096]
    - [5, 69.724]
  - - [1024, 384, 2, 4096]
    - [12, 78.256]
  - - [1024, 384, 32, 4096]
    - [2, 96.06]
  - - [2304, 384, 1, 768]
    - [12, 62.491]
  - - [2304, 384, 16, 768]
    - [8, 92.913]
  - - [2304, 384, 2, 768]
    - [6, 75.421]
  - - [3072, 384, 1, 1024]
    - [1, 67.206]
  - - [3072, 384, 2, 1024]
    - [4, 77.989]
  - - [3072, 384, 32, 1024]
    - [2, 96.12]
  - - [3072, 384, 1, 768]
    - [10, 62.523]
  - - [3072, 384, 16, 768]
    - [2, 94.127]
  - - [3072, 384, 2, 768]
    - [4, 75.073]
  - - [4096, 384, 1, 1024]
    - [7, 75.923]
  - - [4096, 384, 2, 1024]
    - [1, 84.398]
  - - [4096, 384, 32, 1024]
    - [2, 96.323]
  - - [64, 384, 12, 384]
    - [5, 21.998]
  - - [64, 384, 16, 384]
    - [11, 28.353]
  - - [64, 384, 192, 384]
    - [13, 59.0]
  - - [64, 384, 24, 384]
    - [7, 34.251]
  - - [64, 384, 32, 384]
    - [7, 41.116]
  - - [64, 384, 512, 384]
    - [9, 65.745]
- null
- null
- DeviceEfficiency
- null
- Equality
