library/src/blas3/Tensile/Logic/asm_full/aldebaran/equality/aldebaran_Cijk_Ailk_Bjlk_HHS_BH.yaml
- {MinimumRequiredVersion: 4.35.0}
- aldebaran
- gfx90a
- [Device 0050, Device 0051, Device 0052, Device 0054, Device 0062, Device 7400, Device
    SolutionIndex: 0
    SolutionNameMin: Cijk_Ailk_Bjlk_HHS_BH_MT16x16x16_MI16x16x16x1_SE_1LDSB0_AF0EM8_AF1EM1_AMAS3_BL1_EPS0_GRVW2_GSU1_GSUAMB_ISA90a_IU1_KLA_LRVW4_LDW0_MAC_NTD0_NLCA1_NLCB1_PGR2_PLR1_SIA3_SS0_SU0_SUS0_SPO0_SRVW0_SVW4_TT1_16_USFGROn1_VAW2_VSn1_VW2_WSGRA1_WSGRB1_WG16_4_1_WGM1
    SolutionIndex: 1
    SolutionNameMin: Cijk_Ailk_Bjlk_HHS_BH_MT64x32x16_MI16x16x16x1_SE_1LDSB0_AF0EM8_AF1EM1_AMAS3_BL1_EPS0_GRVW4_GSU1_GSUAMB_ISA90a_IU1_KLA_LRVW4_LDW0_MAC_NTD0_NLCA1_NLCB1_PGR2_PLR1_SIA3_SS0_SU0_SUS0_SPO0_SRVW4_SVW4_TT2_16_USFGROn1_VAW2_VSn1_VW2_WSGRA1_WSGRB1_WG32_8_1_WGM1
    SolutionIndex: 2
    SolutionNameMin: Cijk_Ailk_Bjlk_HHS_BH_MT32x64x16_MI16x16x16x1_SE_1LDSB0_AF0EM8_AF1EM1_AMAS3_BL1_EPS1_GRVW2_GSU1_GSUAMB_ISA90a_IU1_KLA_LRVW4_LDW0_MAC_NTD0_NLCA1_NLCB1_PGR1_PLR1_SIA3_SS0_SU0_SUS0_SPO0_SRVW4_SVW4_TT1_32_USFGROn1_VAW2_VSn1_VW2_WSGRA1_WSGRB1_WG32_8_1_WGM15
    SolutionIndex: 3
    SolutionNameMin: Cijk_Ailk_Bjlk_HHS_BH_MT64x32x16_MI16x16x16x1_SE_1LDSB1_AF0EM8_AF1EM1_AMAS3_BL1_EPS1_GRVW2_GSU1_GSUAMB_ISA90a_IU1_KLA_LRVW4_LDW0_MAC_NTD0_NLCA1_NLCB1_PGR1_PLR1_SIA3_SS0_SU0_SUS0_SPO0_SRVW4_SVW4_TT2_16_USFGROn1_VAW2_VSn1_VW2_WSGRA1_WSGRB1_WG32_8_1_WGM1
    SolutionIndex: 4
    SolutionNameMin: Cijk_Ailk_Bjlk_HHS_BH_MT64x64x16_MI32x32x8x1_SE_1LDSB0_AF0EM1_AF1EM1_AMAS3_BL1_EPS0_GRVW4_GSU1_GSUAMB_ISA90a_IU1_KLA_LRVW4_LDW0_MAC_NTD0_NLCA1_NLCB1_PGR2_PLR1_SIA3_SS0_SU0_SUS0_SPO0_SRVW4_SVW4_TT1_32_USFGROn1_VAW2_VSn1_VW2_WSGRA1_WSGRB1_WG64_4_1_WGM1
    SolutionIndex: 5
    SolutionNameMin: Cijk_Ailk_Bjlk_HHS_BH_MT64x32x16_MI16x16x16x1_SE_1LDSB0_AF0EM8_AF1EM1_AMAS3_BL1_EPS1_GRVW2_GSU1_GSUAMB_ISA90a_IU1_KLA_LRVW4_LDW0_MAC_NTD0_NLCA1_NLCB1_PGR1_PLR1_SIA3_SS0_SU0_SUS0_SPO0_SRVW4_SVW4_TT2_16_USFGROn1_VAW2_VSn1_VW2_WSGRA1_WSGRB1_WG32_8_1_WGM15
    SolutionIndex: 6
    SolutionNameMin: Cijk_Ailk_Bjlk_HHS_BH_MT64x32x16_MI16x16x16x1_SE_1LDSB1_AF0EM8_AF1EM1_AMAS3_BL1_EPS0_GRVW2_GSU1_GSUAMB_ISA90a_IU1_KLA_LRVW4_LDW0_MAC_NTD0_NLCA1_NLCB1_PGR2_PLR1_SIA3_SS0_SU0_SUS0_SPO0_SRVW4_SVW4_TT2_16_USFGROn1_VAW2_VSn1_VW2_WSGRA1_WSGRB1_WG32_8_1_WGM15
    SolutionIndex: 7
    SolutionNameMin: Cijk_Ailk_Bjlk_HHS_BH_MT64x192x16_MI32x32x8x1_SE_1LDSB0_AF0EM8_AF1EM1_AMAS3_BL1_EPS0_GRVW4_GSU1_GSUAMB_ISA90a_IU1_KLA_LRVW4_LDW0_MAC_NTD0_NLCA1_NLCB3_PGR2_PLR1_SIA3_SS0_SU0_SUS0_SPO0_SRVW4_SVW4_TT1_96_USFGROn1_VAW2_VSn1_VW2_WSGRA1_WSGRB1_WG64_4_1_WGM15
- - - [32, 144, 4096, 32]
    - [2, 6.722]
  - - [32, 144, 32768, 144]
    - [7, 18.114]
  - - [32, 144, 4096, 144]
    - [7, 16.006]
  - - [32, 144, 8192, 144]
    - [7, 17.265]
  - - [32, 144, 16384, 144]
    - [7, 17.866]
  - - [32, 576, 2048, 32]
    - [2, 9.277]
  - - [32, 2304, 1024, 32]
    - [2, 9.939]
  - - [32, 9216, 512, 32]
    - [2, 10.344]
  - - [64, 147, 768, 147]
    - [7, 16.074]
  - - [144, 9, 2048, 1]
    - [0, 0.064]
  - - [144, 32, 4096, 32]
    - [1, 7.268]
  - - [144, 32, 32768, 144]
    - [6, 16.544]
  - - [144, 32, 8192, 144]
    - [1, 15.984]
  - - [144, 32, 4096, 144]
    - [1, 15.168]
  - - [144, 32, 16384, 144]
    - [1, 16.326]
  - - [147, 64, 768, 147]
    - [4, 13.197]
  - - [576, 9, 1024, 1]
    - [0, 0.084]
  - - [576, 32, 2048, 32]
    - [1, 9.478]
  - - [2304, 32, 1024, 32]
    - [3, 8.455]
  - - [9216, 9, 256, 1]
    - [0, 0.108]
  - - [9216, 32, 512, 32]
    - [5, 8.755]
- null
- null
- DeviceEfficiency
- null
- Equality
