library/src/blas3/Tensile/Logic/asm_full/aldebaran/equality/aldebaran_Cijk_Ailk_Bljk_HHS_BH.yaml
- {MinimumRequiredVersion: 4.34.0}
- aldebaran
- gfx90a
- [Device 0050, Device 0051, Device 0052, Device 0054, Device 0062, Device 7400, Device
    SolutionIndex: 0
    SolutionNameMin: Cijk_Ailk_Bljk_HHS_BH_MT128x96x32_MI32x32x8x1_SE_1LDSB0_AF0EM1_AF1EM1_AMAS3_EPS0_GRVW4_GSU1_GSUAMB_LPB8_LRVW8_NEPBS0_NLCA1_PGR2_PLR5_SIA3_SS0_SU0_SUM0_SUS0_SRVW4_SVW4_TT1_96_VAW2_VW2_WSGRA1_WSGRB1_WG128_2_1_WGM15
    SolutionIndex: 1
    SolutionNameMin: Cijk_Ailk_Bljk_HHS_BH_MT64x128x64_MI32x32x8x1_SE_1LDSB0_AF0EM8_AF1EM1_AMAS3_EPS0_GRVW8_GSU1_GSUAMB_LPB8_LRVW8_NEPBS0_NLCA1_PGR2_PLR9_SIA3_SS0_SU0_SUM0_SUS0_SRVW4_SVW4_TT1_64_VAW2_VW2_WSGRA1_WSGRB1_WG64_4_1_WGM15
    SolutionIndex: 2
    SolutionNameMin: Cijk_Ailk_Bljk_HHS_BH_MT64x128x64_MI32x32x8x1_SE_1LDSB0_AF0EM8_AF1EM1_AMAS3_EPS0_GRVW8_GSU1_GSUAMB_LPB8_LRVW8_NEPBS0_NLCA1_PGR2_PLR9_SIA3_SS0_SU0_SUM0_SUS0_SRVW4_SVW4_TT1_64_VAW2_VW2_WSGRA1_WSGRB1_WG64_4_1_WGM1
    SolutionIndex: 3
    SolutionNameMin: Cijk_Ailk_Bljk_HHS_BH_MT128x64x32_MI32x32x8x1_SE_1LDSB0_AF0EM8_AF1EM1_AMAS3_EPS0_GRVW8_GSU1_GSUAMB_LPB8_LRVW8_NEPBS0_NLCA1_PGR2_PLR5_SIA3_SS0_SU0_SUM0_SUS0_SRVW4_SVW4_TT2_32_VAW2_VW2_WSGRA1_WSGRB1_WG64_4_1_WGM1
    SolutionIndex: 4
    SolutionNameMin: Cijk_Ailk_Bljk_HHS_BH_MT64x64x64_MI32x32x8x1_SE_1LDSB0_AF0EM8_AF1EM1_AMAS3_EPS0_GRVW8_GSU1_GSUAMB_LPB8_LRVW8_NEPBS0_NLCA1_PGR2_PLR9_SIA3_SS0_SU0_SUM0_SUS0_SRVW4_SVW4_TT1_32_VAW2_VW2_WSGRA1_WSGRB1_WG64_4_1_WGM15
    SolutionIndex: 5
    SolutionNameMin: Cijk_Ailk_Bljk_HHS_BH_MT64x64x64_MI32x32x8x1_SE_1LDSB0_AF0EM8_AF1EM1_AMAS3_EPS0_GRVW8_GSU1_GSUAMB_LPB8_LRVW8_NEPBS0_NLCA1_PGR2_PLR9_SIA3_SS0_SU0_SUM0_SUS0_SRVW4_SVW4_TT1_32_VAW2_VW2_WSGRA1_WSGRB1_WG64_4_1_WGM1
    SolutionIndex: 6
    SolutionNameMin: Cijk_Ailk_Bljk_HHS_BH_MT128x96x64_MI32x32x8x1_SE_1LDSB0_AF0EM8_AF1EM1_AMAS3_EPS0_GRVW8_GSU1_GSUAMB_LPB8_LRVW8_NEPBS0_NLCA1_PGR2_PLR9_SIA3_SS0_SU0_SUM0_SUS0_SRVW4_SVW4_TT1_96_VAW2_VW2_WSGRA1_WSGRB1_WG128_2_1_WGM1
    SolutionIndex: 7
    SolutionNameMin: Cijk_Ailk_Bljk_HHS_BH_MT128x96x32_MI32x32x8x1_SE_1LDSB1_AF0EM8_AF1EM1_AMAS3_EPS1_GRVW2_GSU1_GSUAMB_LPB8_LRVW8_NEPBS0_NLCA1_PGR1_PLR5_SIA3_SS0_SU32_SUM0_SUS256_SRVW4_SVW4_TT1_96_VAW2_VW2_WSGRA1_WSGRB1_WG128_2_1_WGM15
    SolutionIndex: 8
    SolutionNameMin: Cijk_Ailk_Bljk_HHS_BH_MT128x128x32_MI32x32x8x1_SE_1LDSB0_AF0EM8_AF1EM1_AMAS3_EPS0_GRVW8_GSU1_GSUAMB_LPB8_LRVW8_NEPBS0_NLCA1_PGR2_PLR5_SIA3_SS0_SU0_SUM0_SUS0_SRVW4_SVW4_TT2_64_VAW2_VW2_WSGRA1_WSGRB1_WG64_4_1_WGM1
    SolutionIndex: 9
    SolutionNameMin: Cijk_Ailk_Bljk_HHS_BH_MT128x128x32_MI32x32x8x1_SE_1LDSB1_AF0EM8_AF1EM1_AMAS3_EPS1_GRVW2_GSU1_GSUAMB_LPB8_LRVW8_NEPBS0_NLCA1_PGR1_PLR5_SIA3_SS0_SU0_SUM0_SUS0_SRVW4_SVW4_TT2_64_VAW2_VW2_WSGRA1_WSGRB1_WG64_4_1_WGM15
    SolutionIndex: 10
    SolutionNameMin: Cijk_Ailk_Bljk_HHS_BH_MT64x128x32_MI32x32x8x1_SE_1LDSB0_AF0EM1_AF1EM1_AMAS3_EPS0_GRVW4_GSU1_GSUAMB_LPB8_LRVW8_NEPBS0_NLCA1_PGR2_PLR5_SIA3_SS0_SU0_SUM0_SUS0_SRVW4_SVW4_TT1_64_VAW2_VW2_WSGRA1_WSGRB1_WG64_4_1_WGM2
    SolutionIndex: 11
    SolutionNameMin: Cijk_Ailk_Bljk_HHS_BH_MT64x64x64_MI32x32x8x1_SE_1LDSB0_AF0EM1_AF1EM1_AMAS3_EPS0_GRVW8_GSU1_GSUAMB_LPB8_LRVW8_NEPBS0_NLCA1_PGR2_PLR9_SIA3_SS0_SU0_SUM0_SUS0_SRVW4_SVW4_TT1_32_VAW2_VW2_WSGRA1_WSGRB1_WG64_4_1_WGM15
    SolutionIndex: 12
    SolutionNameMin: Cijk_Ailk_Bljk_HHS_BH_MT256x128x16_MI32x32x8x1_SN_1LDSB0_AF0EM1_AF1EM1_AMAS3_EPS0_GRVW8_GSU1_GSUASB_LPB8_LRVW4_NEPBS0_NLCA1_PGR2_PLR1_SIA3_SS1_SU32_SUM3_SUS64_SRVW0_SVW2_TT4_64_VAW2_VW2_WSGRA0_WSGRB0_WG64_4_1_WGM16
    SolutionIndex: 13
    SolutionNameMin: Cijk_Ailk_Bljk_HHS_BH_MT256x192x16_MI32x32x8x1_SN_1LDSB0_AF0EM8_AF1EM8_AMAS0_EPS0_GRVW4_GSU1_GSUAMB_LPB4_LRVW4_NEPBS0_NLCA1_PGR2_PLR1_SIA3_SS0_SU32_SUM0_SUS128_SRVW4_SVW4_TT2_192_VAW2_VW1_WSGRA0_WSGRB0_WG128_2_1_WGM15
    SolutionIndex: 14
    SolutionNameMin: Cijk_Ailk_Bljk_HHS_BH_MT32x64x32_MI16x16x16x1_SE_1LDSB1_AF0EM8_AF1EM1_AMAS3_ASE_BL1_EPS1_GRVW2_GSU1_GSUAMB_ISA90a_KLA_LBSPP128_LPB16_LDL1_LRVW8_LDW0_MAC_MIAV0_NTD0_NEPBS0_NLCA1_PGR1_PLR2_SIA3_SS0_SU0_SUM0_SUS0_SPO0_SRVW4_SVW4_TT1_32_TLDS1_USFGROn1_VAW2_VSn1_VW2_WSGRA1_WSGRB1_WG32_8_1_WGM15
    SolutionIndex: 15
    SolutionNameMin: Cijk_Ailk_Bljk_HHS_BH_MT32x32x32_MI16x16x16x1_SE_1LDSB0_AF0EM8_AF1EM1_AMAS3_ASE_BL1_EPS1_GRVW8_GSU1_GSUAMB_ISA90a_KLA_LBSPP128_LPB16_LDL1_LRVW8_LDW0_MAC_MIAV0_NTD0_NEPBS0_NLCA1_PGR1_PLR2_SIA3_SS0_SU0_SUM0_SUS0_SPO0_SRVW4_SVW4_TT1_16_TLDS1_USFGROn1_VAW2_VSn1_VW2_WSGRA1_WSGRB1_WG32_8_1_WGM1
    SolutionIndex: 16
    SolutionNameMin: Cijk_Ailk_Bljk_HHS_BH_MT32x64x64_MI16x16x16x1_SE_1LDSB0_AF0EM8_AF1EM1_AMAS3_ASE_BL1_EPS0_GRVW8_GSU1_GSUAMB_ISA90a_KLA_LBSPP128_LPB16_LDL1_LRVW8_LDW0_MAC_MIAV0_NTD0_NEPBS0_NLCA1_PGR2_PLR5_SIA3_SS0_SU32_SUM0_SUS128_SPO0_SRVW4_SVW4_TT1_32_TLDS1_USFGROn1_VAW2_VSn1_VW2_WSGRA1_WSGRB1_WG32_8_1_WGM1
    SolutionIndex: 17
    SolutionNameMin: Cijk_Ailk_Bljk_HHS_BH_MT32x32x64_MI16x16x16x1_SE_1LDSB0_AF0EM8_AF1EM1_AMAS3_ASE_BL1_EPS0_GRVW8_GSU1_GSUAMB_ISA90a_KLA_LBSPP128_LPB16_LDL1_LRVW8_LDW0_MAC_MIAV0_NTD0_NEPBS0_NLCA1_PGR2_PLR5_SIA3_SS0_SU0_SUM0_SUS0_SPO0_SRVW4_SVW4_TT1_16_TLDS1_USFGROn1_VAW2_VSn1_VW2_WSGRA1_WSGRB1_WG32_8_1_WGM1
    SolutionIndex: 18
    SolutionNameMin: Cijk_Ailk_Bljk_HHS_BH_MT32x64x32_MI16x16x16x1_SE_1LDSB1_AF0EM8_AF1EM1_AMAS3_ASE_BL1_EPS1_GRVW2_GSU1_GSUAMB_ISA90a_KLA_LBSPP128_LPB16_LDL1_LRVW8_LDW0_MAC_MIAV0_NTD0_NEPBS0_NLCA1_PGR1_PLR2_SIA3_SS0_SU0_SUM0_SUS0_SPO0_SRVW4_SVW4_TT1_32_TLDS1_USFGROn1_VAW2_VSn1_VW2_WSGRA1_WSGRB1_WG32_8_1_WGM1
    SolutionIndex: 19
    SolutionNameMin: Cijk_Ailk_Bljk_HHS_BH_MT64x32x32_MI16x16x16x1_SE_1LDSB1_AF0EM8_AF1EM1_AMAS3_ASE_BL1_EPS1_GRVW2_GSU1_GSUAMB_ISA90a_KLA_LBSPP128_LPB16_LDL1_LRVW8_LDW0_MAC_MIAV0_NTD0_NEPBS0_NLCA1_PGR1_PLR2_SIA3_SS0_SU0_SUM0_SUS0_SPO0_SRVW4_SVW4_TT2_16_TLDS1_USFGROn1_VAW2_VSn1_VW2_WSGRA1_WSGRB1_WG32_8_1_WGM2
    SolutionIndex: 20
    SolutionNameMin: Cijk_Ailk_Bljk_HHS_BH_MT64x32x32_MI16x16x16x1_SE_1LDSB1_AF0EM1_AF1EM1_AMAS3_ASE_BL1_EPS1_GRVW2_GSU1_GSUAMB_ISA90a_KLA_LBSPP128_LPB16_LDL1_LRVW8_LDW0_MAC_MIAV0_NTD0_NEPBS0_NLCA1_PGR1_PLR2_SIA3_SS0_SU0_SUM0_SUS0_SPO0_SRVW4_SVW4_TT2_16_TLDS1_USFGROn1_VAW2_VSn1_VW2_WSGRA1_WSGRB1_WG32_8_1_WGM15
    SolutionIndex: 21
    SolutionNameMin: Cijk_Ailk_Bljk_HHS_BH_MT64x128x64_MI32x32x8x1_SE_1LDSB0_AF0EM8_AF1EM1_AMAS3_ASE_BL1_EPS0_GRVW8_GSU1_GSUAMB_ISA90a_KLA_LBSPP128_LPB8_LDL1_LRVW8_LDW0_MAC_MIAV0_NTD0_NEPBS0_NLCA1_PGR2_PLR9_SIA3_SS0_SU0_SUM0_SUS0_SPO0_SRVW4_SVW4_TT1_64_TLDS1_USFGROn1_VAW2_VSn1_VW2_WSGRA1_WSGRB1_WG64_4_1_WGM1
    SolutionIndex: 22
    SolutionNameMin: Cijk_Ailk_Bljk_HHS_BH_MT256x128x16_MI32x32x8x1_SN_1LDSB0_AF0EM1_AF1EM1_AMAS3_ASE_BL1_EPS0_GRVW8_GSU1_GSUASB_ISA90a_KLA_LBSPP128_LPB8_LDL1_LRVW4_LDW0_MAC_MIAV0_NTD0_NEPBS0_NLCA1_PGR2_PLR1_SIA3_SS1_SU32_SUM3_SUS64_SPO0_SRVW0_SVW2_TT4_64_TLDS1_USFGROn1_VAW2_VSn1_VW2_WSGRA0_WSGRB0_WG64_4_1_WGM16
    SolutionIndex: 23
    SolutionNameMin: Cijk_Ailk_Bljk_HHS_BH_MT128x256x32_MI32x32x8x1_SE_1LDSB1_AF0EM8_AF1EM1_AMAS3_ASE_BL1_EPS0_GRVW8_GSU1_GSUAMB_ISA90a_KLA_LBSPP128_LPB8_LDL1_LRVW8_LDW0_MAC_MIAV0_NTD0_NEPBS0_NLCA1_PGR2_PLR5_SIA3_SS0_SU0_SUM0_SUS0_SPO0_SRVW4_SVW4_TT2_128_TLDS1_USFGROn1_VAW2_VSn1_VW2_WSGRA1_WSGRB1_WG64_4_1_WGM1
    SolutionIndex: 24
    SolutionNameMin: Cijk_Ailk_Bljk_HHS_BH_MT64x32x32_MI16x16x16x1_SE_1LDSB1_AF0EM8_AF1EM1_AMAS3_ASE_BL1_EPS1_GRVW2_GSU1_GSUAMB_ISA90a_KLA_LBSPP128_LPB16_LDL1_LRVW8_LDW0_MAC_MIAV0_NTD0_NEPBS0_NLCA1_PGR1_PLR2_SIA3_SS0_SU0_SUM0_SUS0_SPO0_SRVW4_SVW4_TT2_16_TLDS1_USFGROn1_VAW2_VSn1_VW2_WSGRA1_WSGRB1_WG32_8_1_WGM15
    SolutionIndex: 25
    SolutionNameMin: Cijk_Ailk_Bljk_HHS_BH_MT256x192x16_MI32x32x8x1_SN_1LDSB0_AF0EM8_AF1EM8_AMAS0_ASE_BL1_EPS0_GRVW4_GSU1_GSUAMB_ISA90a_KLA_LBSPP128_LPB4_LDL1_LRVW4_LDW0_MAC_MIAV0_NTD0_NEPBS0_NLCA1_PGR2_PLR1_SIA3_SS0_SU32_SUM0_SUS128_SPO0_SRVW4_SVW4_TT2_192_TLDS1_USFGROn1_VAW2_VSn1_VW1_WSGRA0_WSGRB0_WG128_2_1_WGM15
    SolutionIndex: 26
    SolutionNameMin: Cijk_Ailk_Bljk_HHS_BH_MT128x256x32_MI32x32x8x1_SN_1LDSB1_AF0EM1_AF1EM1_AMAS3_ASE_BL1_EPS0_GRVW8_GSU1_GSUAMB_ISA90a_KLA_LBSPP128_LPB8_LDL1_LRVW8_LDW0_MAC_MIAV0_NTD0_NEPBS0_NLCA1_PGR2_PLR5_SIA3_SS1_SU32_SUM0_SUS256_SPO0_SRVW0_SVW2_TT4_64_TLDS1_USFGROn1_VAW2_VSn1_VW2_WSGRA1_WSGRB1_WG32_8_1_WGM8
    SolutionIndex: 27
    SolutionNameMin: Cijk_Ailk_Bljk_HHS_BH_MT128x144x32_MI16x16x16x1_SE_1LDSB1_AF0EM8_AF1EM1_AMAS3_ASE_BL1_EPS1_GRVW2_GSU1_GSUAMB_ISA90a_KLA_LBSPP128_LPB16_LDL1_LRVW8_LDW0_MAC_MIAV0_NTD0_NEPBS0_NLCA1_PGR1_PLR2_SIA3_SS0_SU32_SUM0_SUS128_SPO0_SRVW4_SVW4_TT2_144_TLDS1_USFGROn1_VAW2_VSn1_VW2_WSGRA1_WSGRB1_WG64_4_1_WGM2
    SolutionIndex: 28
    SolutionNameMin: Cijk_Ailk_Bljk_HHS_BH_MT256x160x32_MI32x32x8x1_SE_1LDSB0_AF0EM8_AF1EM1_AMAS3_ASE_BL1_EPS0_GRVW4_GSU1_GSUAMB_ISA90a_KLA_LBSPP128_LPB8_LDL1_LRVW8_LDW0_MAC_MIAV0_NTD0_NEPBS0_NLCA1_PGR2_PLR5_SIA3_SS0_SU0_SUM0_SUS0_SPO0_SRVW4_SVW4_TT2_160_TLDS1_USFGROn1_VAW2_VSn1_VW2_WSGRA1_WSGRB1_WG128_2_1_WGM2
    SolutionIndex: 29
    SolutionNameMin: Cijk_Ailk_Bljk_HHS_BH_MT64x32x32_MI16x16x16x1_SE_1LDSB1_AF0EM8_AF1EM1_AMAS3_ASE_BL1_EPS1_GRVW2_GSU1_GSUAMB_ISA90a_KLA_LBSPP128_LPB16_LDL1_LRVW8_LDW0_MAC_MIAV0_NTD0_NEPBS0_NLCA1_PGR1_PLR2_SIA3_SS0_SU0_SUM0_SUS0_SPO0_SRVW4_SVW4_TT2_16_TLDS1_USFGROn1_VAW2_VSn1_VW2_WSGRA1_WSGRB1_WG32_8_1_WGM1
    SolutionIndex: 30
    SolutionNameMin: Cijk_Ailk_Bljk_HHS_BH_MT64x32x32_MI16x16x16x1_SE_1LDSB1_AF0EM8_AF1EM1_AMAS3_ASE_BL1_EPS1_GRVW2_GSU1_GSUAMB_ISA90a_KLA_LBSPP128_LPB16_LDL1_LRVW8_LDW0_MAC_MIAV0_NTD0_NEPBS0_NLCA1_PGR1_PLR2_SIA3_SS0_SU32_SUM0_SUS256_SPO0_SRVW4_SVW4_TT2_16_TLDS1_USFGROn1_VAW2_VSn1_VW2_WSGRA1_WSGRB1_WG32_8_1_WGM1
- - - [1024, 384, 1, 1024]
    - [5, 19.723]
  - - [1024, 384, 2, 1024]
    - [2, 32.173]
  - - [1024, 384, 32, 1024]
    - [9, 73.021]
  - - [1024, 384, 1, 4096]
    - [11, 39.107]
  - - [1024, 384, 2, 4096]
    - [2, 57.513]
  - - [1024, 384, 32, 4096]
    - [8, 86.498]
  - - [2304, 384, 1, 768]
    - [1, 29.903]
  - - [2304, 384, 16, 768]
    - [12, 72.733]
  - - [2304, 384, 2, 768]
    - [8, 43.25]
  - - [3072, 384, 1, 1024]
    - [6, 39.107]
  - - [3072, 384, 2, 1024]
    - [0, 54.876]
  - - [3072, 384, 32, 1024]
    - [13, 83.556]
  - - [3072, 384, 1, 768]
    - [0, 33.575]
  - - [3072, 384, 16, 768]
    - [7, 74.03]
  - - [3072, 384, 2, 768]
    - [0, 48.837]
  - - [4096, 384, 1, 1024]
    - [3, 44.366]
  - - [4096, 384, 2, 1024]
    - [8, 53.685]
  - - [4096, 384, 32, 1024]
    - [12, 83.106]
  - - [64, 384, 12, 384]
    - [5, 6.897]
  - - [64, 384, 16, 384]
    - [4, 9.001]
  - - [64, 384, 192, 384]
    - [10, 26.374]
  - - [64, 384, 24, 384]
    - [2, 11.759]
  - - [64, 384, 32, 384]
    - [2, 14.988]
  - - [64, 384, 512, 384]
    - [2, 30.755]
  - - [32, 32, 4096, 144]
    - [14, 7.475]
  - - [32, 32, 2048, 576]
    - [15, 11.685]
  - - [32, 32, 1024, 2304]
    - [16, 14.157]
  - - [32, 32, 512, 9216]
    - [17, 14.057]
  - - [32, 144, 32768, 144]
    - [14, 12.773]
  - - [32, 144, 4096, 144]
    - [18, 12.114]
  - - [32, 144, 16384, 144]
    - [18, 12.785]
  - - [32, 144, 8192, 144]
    - [14, 12.659]
  - - [64, 147, 768, 147]
    - [19, 13.374]
  - - [147, 147, 768, 64]
    - [20, 8.373]
  - - [256, 256, 64, 9216]
    - [21, 69.962]
  - - [256, 9216, 64, 256]
    - [22, 56.777]
  - - [512, 512, 64, 2304]
    - [23, 74.086]
  - - [512, 2304, 64, 512]
    - [22, 71.288]
  - - [576, 1, 1024, 9]
    - [24, 0.064]
  - - [576, 32, 2048, 32]
    - [24, 9.527]
  - - [768, 2048, 64, 144]
    - [22, 47.63]
  - - [1024, 576, 64, 1024]
    - [25, 72.074]
  - - [1024, 1024, 64, 576]
    - [26, 71.548]
  - - [2048, 144, 64, 768]
    - [27, 57.723]
  - - [2048, 144, 64, 2048]
    - [28, 65.424]
  - - [2048, 2048, 64, 144]
    - [22, 50.248]
  - - [2304, 1, 512, 9]
    - [29, 0.073]
  - - [2304, 32, 1024, 32]
    - [24, 8.332]
  - - [9216, 1, 256, 9]
    - [24, 0.079]
  - - [9216, 32, 512, 32]
    - [30, 8.567]
- null
- null
- DeviceEfficiency
- null
- Equality
