library/src/blas3/Tensile/Logic/asm_vega20/vega20_Cijk_Ailk_Bljk_4xi8BH.yaml
- {MinimumRequiredVersion: 4.6.0}
- vega20
- gfx906
- [Device 66a0, Device 66a1, Device 66a7, Device 66af, Vega 20]
    SolutionIndex: 0
    SolutionNameMin: Cijk_Ailk_Bljk_4xi8BH_MT128x016x16_DTL0_EPS1_GRVW04_LPB00_PGR1_SNLL0_TT04_04_USFGRO0_VW04_WG32_04_02
    SolutionIndex: 1
    SolutionNameMin: Cijk_Ailk_Bljk_4xi8BH_MT128x016x16_DTL0_EPS1_GRVW04_LPB00_PGR1_SNLL0_TT04_04_USFGRO0_VW04_WG32_04_02
    SolutionIndex: 2
    SolutionNameMin: Cijk_Ailk_Bljk_4xi8BH_MT128x008x32_DTL0_EPS0_GRVW02_LPB00_PGR0_SNLL0_TT04_02_USFGRO0_VW02_WG32_04_02
    SolutionIndex: 3
    SolutionNameMin: Cijk_Ailk_Bljk_4xi8BH_MT032x008x32_DTL0_EPS0_GRVW02_LPB00_PGR0_SNLL0_TT02_02_USFGRO0_VW02_WG16_04_04
    SolutionIndex: 4
    SolutionNameMin: Cijk_Ailk_Bljk_4xi8BH_MT064x008x32_DTL0_EPS0_GRVW02_LPB00_PGR0_SNLL0_TT04_02_USFGRO0_VW02_WG16_04_04
    SolutionIndex: 5
    SolutionNameMin: Cijk_Ailk_Bljk_4xi8BH_MT128x008x32_DTL0_EPS0_GRVW02_LPB00_PGR0_SNLL0_TT08_02_USFGRO0_VW02_WG16_04_04
    SolutionIndex: 6
    SolutionNameMin: Cijk_Ailk_Bljk_4xi8BH_MT064x008x32_DTL0_EPS0_GRVW02_LPB00_PGR0_SNLL0_TT08_02_USFGRO0_VW02_WG08_04_08
    SolutionIndex: 7
    SolutionNameMin: Cijk_Ailk_Bljk_4xi8BH_MT064x008x32_DTL0_EPS0_GRVW02_LPB00_PGR0_SNLL0_TT02_02_USFGRO0_VW02_WG32_04_02
    SolutionIndex: 8
    SolutionNameMin: Cijk_Ailk_Bljk_4xi8BH_MT128x008x32_DTL0_EPS0_GRVW02_LPB00_PGR0_SNLL0_TT08_02_USFGRO0_VW02_WG16_04_04
    SolutionIndex: 9
    SolutionNameMin: Cijk_Ailk_Bljk_4xi8BH_MT128x008x32_DTL0_EPS0_GRVW04_LPB00_PGR0_SNLL0_TT04_04_USFGRO0_VW04_WG32_02_04
    SolutionIndex: 10
    SolutionNameMin: Cijk_Ailk_Bljk_4xi8BH_MT064x004x64_DTL0_EPS0_GRVW02_LPB00_PGR0_SNLL0_TT02_02_USFGRO0_VW02_WG32_02_04
    SolutionIndex: 11
    SolutionNameMin: Cijk_Ailk_Bljk_4xi8BH_MT032x008x64_DTL0_EPS0_GRVW02_LPB00_PGR0_SNLL0_TT04_02_USFGRO0_VW02_WG08_04_08
    SolutionIndex: 12
    SolutionNameMin: Cijk_Ailk_Bljk_4xi8BH_MT064x004x64_DTL0_EPS0_GRVW02_LPB00_PGR0_SNLL0_TT04_02_USFGRO0_VW02_WG16_02_08
    SolutionIndex: 13
    SolutionNameMin: Cijk_Ailk_Bljk_4xi8BH_MT032x008x64_DTL0_EPS0_GRVW02_LPB00_PGR0_SNLL0_TT04_02_USFGRO0_VW02_WG08_04_08
    SolutionIndex: 14
    SolutionNameMin: Cijk_Ailk_Bljk_4xi8BH_MT064x004x64_DTL0_EPS0_GRVW02_LPB00_PGR0_SNLL0_TT04_02_USFGRO0_VW02_WG16_02_08
    SolutionIndex: 15
    SolutionNameMin: Cijk_Ailk_Bljk_4xi8BH_MT036x048x16_DTL0_EPS1_GRVW01_LPB00_PGR1_SNLL0_TT03_03_USFGRO01_VW01_WG12_16_01
    SolutionIndex: 16
    SolutionNameMin: Cijk_Ailk_Bljk_4xi8BH_MT036x048x16_DTL0_EPS1_GRVW01_LPB00_PGR1_SNLL0_TT03_03_USFGRO01_VW01_WG12_16_01
    SolutionIndex: 17
    SolutionNameMin: Cijk_Ailk_Bljk_4xi8BH_MT048x048x16_DTL0_EPS1_GRVW01_LPB00_PGR1_SNLL0_TT03_03_USFGRO01_VW01_WG16_16_01
    SolutionIndex: 18
    SolutionNameMin: Cijk_Ailk_Bljk_4xi8BH_MT024x024x24_DTL0_EPS1_GRVW01_LPB00_PGR1_SNLL0_TT03_04_USFGRO01_VW01_WG08_06_04
    SolutionIndex: 19
    SolutionNameMin: Cijk_Ailk_Bljk_4xi8BH_MT024x024x32_DTL0_EPS1_GRVW01_LPB00_PGR1_SNLL0_TT03_04_USFGRO01_VW01_WG08_06_04
    SolutionIndex: 20
    SolutionNameMin: Cijk_Ailk_Bljk_4xi8BH_MT016x016x08_DTL0_EPS0_GRVW02_LPB00_PGR1_SNLL0_TT02_02_USFGRO00_VW02_WG08_08_01
    SolutionIndex: 21
    SolutionNameMin: Cijk_Ailk_Bljk_4xi8BH_MT016x016x08_DTL0_EPS1_GRVW02_LPB00_PGR1_SNLL0_TT02_02_USFGRO01_VW02_WG08_08_02
    SolutionIndex: 22
    SolutionNameMin: Cijk_Ailk_Bljk_4xi8BH_MT128x032x08_DTL0_EPS1_GRVW04_LPB00_PGR1_SNLL0_TT08_04_USFGRO0_VW04_WG16_08_02
    SolutionIndex: 23
    SolutionNameMin: Cijk_Ailk_Bljk_4xi8BH_MT016x016x08_DTL0_EPS1_GRVW02_LPB00_PGR1_SNLL0_TT02_02_USFGRO01_VW02_WG08_08_02
    SolutionIndex: 24
    SolutionNameMin: Cijk_Ailk_Bljk_4xi8BH_MT032x016x08_DTL0_EPS1_GRVW02_LPB00_PGR1_SNLL0_TT04_02_USFGRO0_VW02_WG08_08_02
    SolutionIndex: 25
    SolutionNameMin: Cijk_Ailk_Bljk_4xi8BH_MT032x016x08_DTL0_EPS1_GRVW02_LPB00_PGR1_SNLL0_TT04_02_USFGRO0_VW02_WG08_08_02
    SolutionIndex: 26
    SolutionNameMin: Cijk_Ailk_Bljk_4xi8BH_MT016x016x08_DTL0_EPS1_GRVW02_LPB00_PGR1_SNLL0_TT02_02_USFGRO01_VW02_WG08_08_02
    SolutionIndex: 27
    SolutionNameMin: Cijk_Ailk_Bljk_4xi8BH_MT032x016x08_DTL0_EPS1_GRVW02_LPB00_PGR1_SNLL0_TT04_02_USFGRO0_VW02_WG08_08_02
    SolutionIndex: 28
    SolutionNameMin: Cijk_Ailk_Bljk_4xi8BH_MT064x016x16_DTL0_EPS1_GRVW04_LPB00_PGR1_SNLL0_TT04_04_USFGRO0_VW04_WG16_04_04
    SolutionIndex: 29
    SolutionNameMin: Cijk_Ailk_Bljk_4xi8BH_MT128x016x16_DTL0_EPS1_GRVW04_LPB00_PGR1_SNLL0_TT08_04_USFGRO0_VW04_WG16_04_04
    SolutionIndex: 30
    SolutionNameMin: Cijk_Ailk_Bljk_4xi8BH_MT032x032x16_DTL0_EPS1_GRVW04_LPB00_PGR1_SNLL0_TT04_04_USFGRO0_VW04_WG08_08_02
    SolutionIndex: 31
    SolutionNameMin: Cijk_Ailk_Bljk_4xi8BH_MT032x016x16_DTL0_EPS1_GRVW02_LPB00_PGR1_SNLL0_TT04_02_USFGRO0_VW02_WG08_08_04
    SolutionIndex: 32
    SolutionNameMin: Cijk_Ailk_Bljk_4xi8BH_MT064x032x16_DTL0_EPS1_GRVW04_LPB00_PGR1_SNLL0_TT04_04_USFGRO0_VW04_WG16_08_02
    SolutionIndex: 33
    SolutionNameMin: Cijk_Ailk_Bljk_4xi8BH_MT128x032x16_DTL0_EPS1_GRVW04_LPB00_PGR1_SNLL0_TT08_04_USFGRO0_VW04_WG16_08_02
    SolutionIndex: 34
    SolutionNameMin: Cijk_Ailk_Bljk_4xi8BH_MT128x016x16_DTL0_EPS1_GRVW04_LPB00_PGR1_SNLL0_TT04_04_USFGRO0_VW04_WG32_04_02
    SolutionIndex: 35
    SolutionNameMin: Cijk_Ailk_Bljk_4xi8BH_MT064x016x16_DTL0_EPS1_GRVW04_LPB00_PGR1_SNLL0_TT04_04_USFGRO0_VW04_WG16_04_04
    SolutionIndex: 36
    SolutionNameMin: Cijk_Ailk_Bljk_4xi8BH_MT128x016x16_DTL0_EPS1_GRVW04_LPB00_PGR1_SNLL0_TT08_04_USFGRO0_VW04_WG16_04_04
    SolutionIndex: 37
    SolutionNameMin: Cijk_Ailk_Bljk_4xi8BH_MT032x032x16_DTL0_EPS1_GRVW04_LPB00_PGR1_SNLL0_TT04_04_USFGRO0_VW04_WG08_08_02
    SolutionIndex: 38
    SolutionNameMin: Cijk_Ailk_Bljk_4xi8BH_MT016x016x16_DTL0_EPS1_GRVW02_LPB00_PGR1_SNLL0_TT02_02_USFGRO01_VW02_WG08_08_04
    SolutionIndex: 39
    SolutionNameMin: Cijk_Ailk_Bljk_4xi8BH_MT032x016x16_DTL0_EPS1_GRVW02_LPB00_PGR1_SNLL0_TT04_02_USFGRO0_VW02_WG08_08_04
    SolutionIndex: 40
    SolutionNameMin: Cijk_Ailk_Bljk_4xi8BH_MT064x032x16_DTL0_EPS1_GRVW04_LPB00_PGR1_SNLL0_TT04_04_USFGRO0_VW04_WG16_08_02
    SolutionIndex: 41
    SolutionNameMin: Cijk_Ailk_Bljk_4xi8BH_MT128x032x16_DTL0_EPS1_GRVW04_LPB00_PGR1_SNLL0_TT08_04_USFGRO0_VW04_WG16_08_02
    SolutionIndex: 42
    SolutionNameMin: Cijk_Ailk_Bljk_4xi8BH_MT016x016x16_DTL0_EPS1_GRVW02_LPB00_PGR1_SNLL0_TT02_02_USFGRO01_VW02_WG08_08_04
    SolutionIndex: 43
    SolutionNameMin: Cijk_Ailk_Bljk_4xi8BH_MT032x016x16_DTL0_EPS1_GRVW02_LPB00_PGR1_SNLL0_TT04_02_USFGRO0_VW02_WG08_08_04
    SolutionIndex: 44
    SolutionNameMin: Cijk_Ailk_Bljk_4xi8BH_MT032x016x16_DTL0_EPS1_GRVW02_LPB00_PGR1_SNLL0_TT02_02_USFGRO0_VW02_WG16_08_02
    SolutionIndex: 45
    SolutionNameMin: Cijk_Ailk_Bljk_4xi8BH_MT064x016x16_DTL0_EPS1_GRVW02_LPB00_PGR1_SNLL0_TT04_02_USFGRO0_VW02_WG16_08_02
    SolutionIndex: 46
    SolutionNameMin: Cijk_Ailk_Bljk_4xi8BH_MT064x016x16_DTL0_EPS1_GRVW04_LPB00_PGR1_SNLL0_TT04_04_USFGRO0_VW04_WG16_04_04
    SolutionIndex: 47
    SolutionNameMin: Cijk_Ailk_Bljk_4xi8BH_MT032x016x16_DTL0_EPS1_GRVW02_LPB00_PGR1_SNLL0_TT02_02_USFGRO0_VW02_WG16_08_02
    SolutionIndex: 48
    SolutionNameMin: Cijk_Ailk_Bljk_4xi8BH_MT064x016x16_DTL0_EPS1_GRVW02_LPB00_PGR1_SNLL0_TT04_02_USFGRO0_VW02_WG16_08_02
    SolutionIndex: 49
    SolutionNameMin: Cijk_Ailk_Bljk_4xi8BH_MT016x016x16_DTL0_EPS1_GRVW02_LPB00_PGR1_SNLL0_TT02_02_USFGRO01_VW02_WG08_08_04
    SolutionIndex: 50
    SolutionNameMin: Cijk_Ailk_Bljk_4xi8BH_MT032x008x32_DTL0_EPS1_GRVW02_LPB00_PGR1_SNLL0_TT02_02_USFGRO0_VW02_WG16_04_04
    SolutionIndex: 51
    SolutionNameMin: Cijk_Ailk_Bljk_4xi8BH_MT016x016x32_DTL0_EPS1_GRVW02_LPB00_PGR1_SNLL0_TT02_02_USFGRO0_VW02_WG08_08_04
    SolutionIndex: 52
    SolutionNameMin: Cijk_Ailk_Bljk_4xi8BH_MT032x032x32_DTL0_EPS1_GRVW04_LPB00_PGR1_SNLL0_TT04_04_USFGRO0_VW04_WG08_08_04
    SolutionIndex: 53
    SolutionNameMin: Cijk_Ailk_Bljk_4xi8BH_MT064x032x32_DTL0_EPS1_GRVW04_LPB00_PGR1_SNLL0_TT08_04_USFGRO0_VW04_WG08_08_04
    SolutionIndex: 54
    SolutionNameMin: Cijk_Ailk_Bljk_4xi8BH_MT032x008x32_DTL0_EPS1_GRVW02_LPB00_PGR1_SNLL0_TT02_02_USFGRO0_VW02_WG16_04_04
    SolutionIndex: 55
    SolutionNameMin: Cijk_Ailk_Bljk_4xi8BH_MT016x016x32_DTL0_EPS1_GRVW02_LPB00_PGR1_SNLL0_TT02_02_USFGRO0_VW02_WG08_08_04
    SolutionIndex: 56
    SolutionNameMin: Cijk_Ailk_Bljk_4xi8BH_MT032x032x32_DTL0_EPS1_GRVW04_LPB00_PGR1_SNLL0_TT04_04_USFGRO0_VW04_WG08_08_04
    SolutionIndex: 57
    SolutionNameMin: Cijk_Ailk_Bljk_4xi8BH_MT064x032x32_DTL0_EPS1_GRVW04_LPB00_PGR1_SNLL0_TT08_04_USFGRO0_VW04_WG08_08_04
    SolutionIndex: 58
    SolutionNameMin: Cijk_Ailk_Bljk_4xi8BH_MT128x032x32_DTL0_EPS1_GRVW04_LPB00_PGR1_SNLL0_TT08_04_USFGRO0_VW04_WG16_08_02
    SolutionIndex: 59
    SolutionNameMin: Cijk_Ailk_Bljk_4xi8BH_MT032x008x32_DTL0_EPS1_GRVW02_LPB00_PGR1_SNLL0_TT02_02_USFGRO0_VW02_WG16_04_04
    SolutionIndex: 60
    SolutionNameMin: Cijk_Ailk_Bljk_4xi8BH_MT064x008x32_DTL0_EPS1_GRVW02_LPB00_PGR1_SNLL0_TT04_02_USFGRO0_VW02_WG16_04_04
    SolutionIndex: 61
    SolutionNameMin: Cijk_Ailk_Bljk_4xi8BH_MT032x032x32_DTL0_EPS1_GRVW04_LPB00_PGR1_SNLL0_TT04_04_USFGRO0_VW04_WG08_08_04
    SolutionIndex: 62
    SolutionNameMin: Cijk_Ailk_Bljk_4xi8BH_MT032x008x32_DTL0_EPS1_GRVW02_LPB00_PGR1_SNLL0_TT02_02_USFGRO0_VW02_WG16_04_04
    SolutionIndex: 63
    SolutionNameMin: Cijk_Ailk_Bljk_4xi8BH_MT064x008x32_DTL0_EPS1_GRVW02_LPB00_PGR1_SNLL0_TT04_02_USFGRO0_VW02_WG16_04_04
    SolutionIndex: 64
    SolutionNameMin: Cijk_Ailk_Bljk_4xi8BH_MT032x016x32_DTL0_EPS1_GRVW02_LPB00_PGR1_SNLL0_TT04_02_USFGRO0_VW02_WG08_08_04
    SolutionIndex: 65
    SolutionNameMin: Cijk_Ailk_Bljk_4xi8BH_MT032x032x32_DTL0_EPS1_GRVW04_LPB00_PGR1_SNLL0_TT04_04_USFGRO0_VW04_WG08_08_04
    SolutionIndex: 66
    SolutionNameMin: Cijk_Ailk_Bljk_4xi8BH_MT032x008x32_DTL0_EPS1_GRVW02_LPB00_PGR1_SNLL0_TT02_02_USFGRO0_VW02_WG16_04_04
    SolutionIndex: 67
    SolutionNameMin: Cijk_Ailk_Bljk_4xi8BH_MT032x008x32_DTL0_EPS1_GRVW02_LPB00_PGR1_SNLL0_TT02_02_USFGRO0_VW02_WG16_04_04
    SolutionIndex: 68
    SolutionNameMin: Cijk_Ailk_Bljk_4xi8BH_MT128x064x08_DTL0_EPS1_GRVW04_LPB00_PGR1_SNLL1_TT08_04_USFGRO0_VW04_WG16_16_01
    SolutionIndex: 69
    SolutionNameMin: Cijk_Ailk_Bljk_4xi8BH_MT128x064x08_DTL0_EPS1_GRVW04_LPB00_PGR1_SNLL1_TT08_04_USFGRO0_VW04_WG16_16_01
    SolutionIndex: 70
    SolutionNameMin: Cijk_Ailk_Bljk_4xi8BH_MT064x064x16_DTL0_EPS0_GRVW04_LPB00_PGR0_SNLL0_TT04_04_USFGRO0_VW04_WG16_16_01
    SolutionIndex: 71
    SolutionNameMin: Cijk_Ailk_Bljk_4xi8BH_MT064x064x16_DTL0_EPS1_GRVW04_LPB00_PGR1_SNLL1_TT04_04_USFGRO0_VW04_WG16_16_01
    SolutionIndex: 72
    SolutionNameMin: Cijk_Ailk_Bljk_4xi8BH_MT064x128x16_DTL0_EPS0_GRVW04_LPB00_PGR0_SNLL0_TT04_08_USFGRO0_VW04_WG16_16_01
    SolutionIndex: 73
    SolutionNameMin: Cijk_Ailk_Bljk_4xi8BH_MT128x064x16_DTL0_EPS0_GRVW04_LPB00_PGR0_SNLL0_TT08_04_USFGRO0_VW04_WG16_16_01
    SolutionIndex: 74
    SolutionNameMin: Cijk_Ailk_Bljk_4xi8BH_MT128x064x16_DTL0_EPS1_GRVW04_LPB00_PGR1_SNLL1_TT08_04_USFGRO0_VW04_WG16_16_01
    SolutionIndex: 75
    SolutionNameMin: Cijk_Ailk_Bljk_4xi8BH_MT128x128x16_DTL0_EPS1_GRVW04_LPB00_PGR1_SNLL1_TT08_08_USFGRO0_VW04_WG16_16_01
    SolutionIndex: 76
    SolutionNameMin: Cijk_Ailk_Bljk_4xi8BH_MT064x064x16_DTL0_EPS0_GRVW04_LPB00_PGR0_SNLL0_TT04_04_USFGRO0_VW04_WG16_16_01
    SolutionIndex: 77
    SolutionNameMin: Cijk_Ailk_Bljk_4xi8BH_MT064x064x16_DTL0_EPS1_GRVW04_LPB00_PGR1_SNLL1_TT04_04_USFGRO0_VW04_WG16_16_01
    SolutionIndex: 78
    SolutionNameMin: Cijk_Ailk_Bljk_4xi8BH_MT064x128x16_DTL0_EPS0_GRVW04_LPB00_PGR0_SNLL0_TT04_08_USFGRO0_VW04_WG16_16_01
    SolutionIndex: 79
    SolutionNameMin: Cijk_Ailk_Bljk_4xi8BH_MT128x064x16_DTL0_EPS0_GRVW04_LPB00_PGR0_SNLL0_TT08_04_USFGRO0_VW04_WG16_16_01
    SolutionIndex: 80
    SolutionNameMin: Cijk_Ailk_Bljk_4xi8BH_MT128x064x16_DTL0_EPS1_GRVW04_LPB00_PGR1_SNLL1_TT08_04_USFGRO0_VW04_WG16_16_01
    SolutionIndex: 81
    SolutionNameMin: Cijk_Ailk_Bljk_4xi8BH_MT128x128x16_DTL0_EPS1_GRVW04_LPB00_PGR1_SNLL1_TT08_08_USFGRO0_VW04_WG16_16_01
    SolutionIndex: 82
    SolutionNameMin: Cijk_Ailk_Bljk_4xi8BH_MT064x064x32_DTL0_EPS1_GRVW04_LPB00_PGR1_SNLL1_TT04_04_USFGRO0_VW04_WG16_16_01
    SolutionIndex: 83
    SolutionNameMin: Cijk_Ailk_Bljk_4xi8BH_MT064x064x32_DTL0_EPS1_GRVW04_LPB00_PGR1_SNLL1_TT04_04_USFGRO0_VW04_WG16_16_01
    SolutionIndex: 84
    SolutionNameMin: Cijk_Ailk_Bljk_4xi8BH_MT016x016x04_DTL0_EPS0_GRVW02_LPB00_PGR1_SNLL0_TT02_02_USFGRO00_VW02_WG08_08_01
    SolutionIndex: 85
    SolutionNameMin: Cijk_Ailk_Bljk_4xi8BH_MT032x032x02_DTL0_EPS0_GRVW04_LPB00_PGR1_SNLL0_TT04_04_USFGRO00_VW04_WG08_08_01
    SolutionIndex: 86
    SolutionNameMin: Cijk_Ailk_Bljk_4xi8BH_MT016x016x08_DTL0_EPS1_GRVW02_LPB00_PGR1_SNLL1_TT02_02_USFGRO01_VW02_WG08_08_02
    SolutionIndex: 87
    SolutionNameMin: Cijk_Ailk_Bljk_4xi8BH_MT016x016x16_DTL0_EPS1_GRVW02_LPB00_PGR1_SNLL1_TT02_02_USFGRO01_VW02_WG08_08_04
    SolutionIndex: 88
    SolutionNameMin: Cijk_Ailk_Bljk_4xi8BH_MT016x016x04_DTL0_EPS1_GRVW02_LPB00_PGR1_SNLL0_TT02_02_USFGRO01_VW02_WG08_08_01
    SolutionIndex: 89
    SolutionNameMin: Cijk_Ailk_Bljk_4xi8BH_MT016x016x04_DTL0_EPS1_GRVW02_LPB00_PGR1_SNLL0_TT02_02_USFGRO01_VW02_WG08_08_01
    SolutionIndex: 90
    SolutionNameMin: Cijk_Ailk_Bljk_4xi8BH_MT008x008x08_DTL0_EPS1_GRVW02_LPB00_PGR1_SNLL0_TT02_02_USFGRO01_VW02_WG04_04_04
    SolutionIndex: 91
    SolutionNameMin: Cijk_Ailk_Bljk_4xi8BH_MT016x016x08_DTL0_EPS1_GRVW02_LPB00_PGR1_SNLL0_TT02_02_USFGRO01_VW02_WG08_08_02
    SolutionIndex: 92
    SolutionNameMin: Cijk_Ailk_Bljk_4xi8BH_MT008x008x08_DTL0_EPS1_GRVW02_LPB00_PGR1_SNLL0_TT02_02_USFGRO01_VW02_WG04_04_04
    SolutionIndex: 93
    SolutionNameMin: Cijk_Ailk_Bljk_4xi8BH_MT016x016x16_DTL0_EPS1_GRVW02_LPB00_PGR1_SNLL0_TT02_02_USFGRO01_VW02_WG08_08_04
    SolutionIndex: 94
    SolutionNameMin: Cijk_Ailk_Bljk_4xi8BH_MT128x032x08_DTL0_EPS1_GRVW04_LPB04_PGR1_SNLL1_TT04_04_USFGRO0_VW04_WG32_08_01
    SolutionIndex: 95
    SolutionNameMin: Cijk_Ailk_Bljk_4xi8BH_MT128x064x08_DTL0_EPS1_GRVW04_LPB04_PGR1_SNLL1_TT04_08_USFGRO0_VW04_WG32_08_01
    SolutionIndex: 96
    SolutionNameMin: Cijk_Ailk_Bljk_4xi8BH_MT128x032x08_DTL0_EPS1_GRVW04_LPB04_PGR1_SNLL1_TT04_04_USFGRO0_VW04_WG32_08_01
    SolutionIndex: 97
    SolutionNameMin: Cijk_Ailk_Bljk_4xi8BH_MT128x064x16_DTL0_EPS1_GRVW04_LPB04_PGR1_SNLL1_TT04_04_USFGRO0_VW04_WG32_16_01
    SolutionIndex: 98
    SolutionNameMin: Cijk_Ailk_Bljk_4xi8BH_MT128x064x16_DTL0_EPS1_GRVW04_LPB04_PGR1_SNLL1_TT04_04_USFGRO0_VW04_WG32_16_01
    SolutionIndex: 99
    SolutionNameMin: Cijk_Ailk_Bljk_4xi8BH_MT064x064x16_DTL0_EPS0_GRVW01_LPB01_PGR0_SNLL0_TT04_04_USFGRO01_VW01_WG16_16_01
    SolutionIndex: 100
    SolutionNameMin: Cijk_Ailk_Bljk_4xi8BH_MT064x064x16_DTL0_EPS0_GRVW01_LPB02_PGR0_SNLL0_TT04_04_USFGRO01_VW02_WG16_16_01
    SolutionIndex: 101
    SolutionNameMin: Cijk_Ailk_Bljk_4xi8BH_MT064x064x16_DTL0_EPS0_GRVW01_LPB04_PGR0_SNLL0_TT04_04_USFGRO01_VW04_WG16_16_01
    SolutionIndex: 102
    SolutionNameMin: Cijk_Ailk_Bljk_4xi8BH_MT064x064x16_DTL0_EPS0_GRVW04_LPB04_PGR0_SNLL0_TT04_04_USFGRO0_VW04_WG16_16_01
    SolutionIndex: 103
    SolutionNameMin: Cijk_Ailk_Bljk_4xi8BH_MT128x032x16_DTL0_EPS0_GRVW04_LPB04_PGR0_SNLL0_TT04_04_USFGRO0_VW04_WG32_08_01
    SolutionIndex: 104
    SolutionNameMin: Cijk_Ailk_Bljk_4xi8BH_MT032x016x32_DTL0_EPS1_GRVW02_LPB00_PGR1_SNLL0_TT04_02_USFGRO0_VW02_WG08_08_04
    SolutionIndex: 105
    SolutionNameMin: Cijk_Ailk_Bljk_4xi8BH_MT032x064x08_DTL0_EPS1_GRVW04_LPB00_PGR1_SNLL1_TT04_08_USFGRO0_VW04_WG08_08_01
    SolutionIndex: 106
    SolutionNameMin: Cijk_Ailk_Bljk_4xi8BH_MT256x032x08_DTL0_EPS1_GRVW04_LPB00_PGR1_SNLL1_TT08_04_USFGRO0_VW04_WG32_08_01
    SolutionIndex: 107
    SolutionNameMin: Cijk_Ailk_Bljk_4xi8BH_MT128x064x08_DTL0_EPS1_GRVW04_LPB00_PGR1_SNLL1_TT04_08_USFGRO0_VW04_WG32_08_01
    SolutionIndex: 108
    SolutionNameMin: Cijk_Ailk_Bljk_4xi8BH_MT256x064x08_DTL0_EPS1_GRVW04_LPB00_PGR1_SNLL1_TT08_08_USFGRO0_VW04_WG32_08_01
    SolutionIndex: 109
    SolutionNameMin: Cijk_Ailk_Bljk_4xi8BH_MT128x064x08_DTL0_EPS1_GRVW04_LPB04_PGR1_SNLL1_TT08_04_USFGRO0_VW04_WG16_16_01
    SolutionIndex: 110
    SolutionNameMin: Cijk_Ailk_Bljk_4xi8BH_MT128x064x08_DTL0_EPS1_GRVW04_LPB04_PGR1_SNLL1_TT08_04_USFGRO0_VW04_WG16_16_01
    SolutionIndex: 111
    SolutionNameMin: Cijk_Ailk_Bljk_4xi8BH_MT128x064x08_DTL0_EPS1_GRVW04_LPB04_PGR1_SNLL1_TT04_08_USFGRO0_VW04_WG32_08_01
    SolutionIndex: 112
    SolutionNameMin: Cijk_Ailk_Bljk_4xi8BH_MT064x032x08_DTL0_EPS0_GRVW01_LPB00_PGR0_SNLL0_TT04_04_USFGRO01_VW01_WG16_08_01
    SolutionIndex: 113
    SolutionNameMin: Cijk_Ailk_Bljk_4xi8BH_MT064x064x08_DTL0_EPS1_GRVW01_LPB00_PGR1_SNLL1_TT04_08_USFGRO01_VW01_WG16_08_01
    SolutionIndex: 114
    SolutionNameMin: Cijk_Ailk_Bljk_4xi8BH_MT128x064x08_DTL0_EPS0_GRVW01_LPB00_PGR0_SNLL0_TT08_04_USFGRO01_VW02_WG16_16_01
    SolutionIndex: 115
    SolutionNameMin: Cijk_Ailk_Bljk_4xi8BH_MT128x032x08_DTL0_EPS0_GRVW01_LPB01_PGR0_SNLL0_TT04_04_USFGRO01_VW01_WG32_08_01
    SolutionIndex: 116
    SolutionNameMin: Cijk_Ailk_Bljk_4xi8BH_MT064x128x08_DTL0_EPS1_GRVW01_LPB04_PGR1_SNLL1_TT04_08_USFGRO01_VW04_WG16_16_01
- - - [704, 1024, 1, 128]
    - [20, 3328.81]
  - - [1024, 1024, 1, 3328]
    - [74, 29974.8]
  - - [4, 704, 1, 1280]
    - [90, 596.768]
  - - [4, 1856, 1, 3328]
    - [42, 1696.91]
  - - [1856, 448, 1, 3328]
    - [74, 25326.7]
  - - [2944, 4288, 1, 1280]
    - [69, 36168.3]
  - - [2368, 64, 1, 3328]
    - [30, 18000.2]
  - - [1760, 32, 1, 1760]
    - [56, 9531.08]
  - - [2368, 5888, 1, 256]
    - [72, 34039.2]
  - - [5888, 1856, 1, 256]
    - [79, 34961.3]
  - - [64, 3584, 1, 1280]
    - [37, 15650.4]
  - - [512, 24000, 1, 1536]
    - [75, 36119.1]
  - - [128, 6784, 1, 3328]
    - [74, 26086.6]
  - - [5888, 1408, 1, 256]
    - [79, 34219.9]
  - - [5888, 1856, 1, 3328]
    - [69, 37300.6]
  - - [512, 4, 1, 512]
    - [14, 273.067]
  - - [35, 1500, 1, 2560]
    - [28, 9020.13]
  - - [1856, 4288, 1, 256]
    - [73, 32882.2]
  - - [1024, 5056, 1, 128]
    - [20, 2960.86]
  - - [5056, 5056, 1, 3328]
    - [69, 37314.5]
  - - [1408, 5888, 1, 1280]
    - [69, 36531.2]
  - - [2368, 448, 1, 128]
    - [20, 3603.78]
  - - [6144, 6000, 1, 2560]
    - [73, 37384.5]
  - - [2368, 6784, 1, 128]
    - [20, 3632.07]
  - - [1024, 3584, 1, 3328]
    - [69, 34801.2]
  - - [512, 48000, 1, 2048]
    - [73, 36825.5]
  - - [1408, 64, 1, 128]
    - [20, 1403.23]
  - - [256, 4288, 1, 3328]
    - [77, 26561.3]
  - - [5888, 1408, 1, 1280]
    - [69, 36551.4]
  - - [704, 1856, 1, 3328]
    - [71, 31337.9]
  - - [1408, 4288, 1, 256]
    - [73, 32801.4]
  - - [1024, 2368, 1, 256]
    - [79, 27811.7]
  - - [64, 4, 1, 256]
    - [87, 39.4795]
  - - [1408, 1856, 1, 1280]
    - [68, 33952.1]
  - - [1408, 64, 1, 1280]
    - [35, 11155.1]
  - - [448, 1024, 1, 1280]
    - [71, 23394.5]
  - - [4096, 32, 1, 4096]
    - [58, 16388.0]
  - - [256, 1408, 1, 3328]
    - [77, 19279.5]
  - - [5056, 5056, 1, 1280]
    - [69, 36966.0]
  - - [448, 5056, 1, 256]
    - [70, 28964.2]
  - - [704, 1856, 1, 1280]
    - [71, 30642.7]
  - - [128, 5056, 1, 128]
    - [20, 3417.41]
  - - [2368, 128, 1, 256]
    - [71, 12678.9]
  - - [1856, 1408, 1, 128]
    - [20, 3889.49]
  - - [64, 5056, 1, 256]
    - [71, 11537.3]
  - - [6784, 256, 1, 3328]
    - [77, 30937.5]
  - - [1408, 3584, 1, 256]
    - [73, 32296.1]
  - - [4288, 448, 1, 256]
    - [77, 27721.7]
  - - [64, 704, 1, 128]
    - [20, 848.113]
  - - [1024, 1856, 1, 128]
    - [20, 3916.12]
  - - [4288, 2944, 1, 1280]
    - [69, 36169.9]
  - - [704, 5056, 1, 1280]
    - [71, 32432.1]
  - - [2368, 704, 1, 3328]
    - [77, 29754.5]
  - - [256, 5888, 1, 256]
    - [71, 26871.6]
  - - [1856, 4288, 1, 3328]
    - [69, 35505.9]
  - - [256, 2944, 1, 256]
    - [71, 23358.1]
  - - [5888, 1024, 1, 256]
    - [79, 32729.1]
  - - [448, 64, 1, 1280]
    - [39, 5628.86]
  - - [3072, 64, 1, 1024]
    - [37, 11801.1]
  - - [3584, 4, 1, 1280]
    - [87, 2123.85]
  - - [2560, 16, 1, 2560]
    - [45, 8782.04]
  - - [2944, 64, 1, 256]
    - [70, 9532.51]
  - - [128, 4, 1, 1280]
    - [49, 161.419]
  - - [1408, 2944, 1, 256]
    - [73, 32511.0]
  - - [256, 1856, 1, 1280]
    - [77, 24114.8]
  - - [6784, 5056, 1, 3328]
    - [69, 38141.8]
  - - [5056, 5056, 1, 256]
    - [79, 35373.9]
  - - [128, 256, 1, 256]
    - [71, 1847.71]
  - - [64, 1024, 1, 1280]
    - [56, 9020.01]
  - - [2944, 4, 1, 256]
    - [87, 1277.4]
  - - [704, 5056, 1, 128]
    - [20, 3846.08]
  - - [4, 2368, 1, 1280]
    - [87, 1511.74]
  - - [2368, 2944, 1, 1280]
    - [69, 34925.2]
  - - [448, 448, 1, 3328]
    - [37, 19576.3]
  - - [6784, 6784, 1, 1280]
    - [69, 38146.1]
  - - [1024, 256, 1, 3328]
    - [82, 15657.1]
  - - [1408, 4288, 1, 1280]
    - [69, 35095.4]
  - - [3584, 4288, 1, 1280]
    - [69, 36356.9]
  - - [512, 6000, 1, 2560]
    - [68, 34276.2]
  - - [2368, 704, 1, 1280]
    - [77, 29303.1]
  - - [5056, 4288, 1, 3328]
    - [69, 37560.1]
  - - [3584, 2368, 1, 3328]
    - [69, 35419.8]
  - - [5888, 6784, 1, 1280]
    - [69, 37749.4]
  - - [64, 704, 1, 1280]
    - [31, 7033.13]
  - - [4288, 256, 1, 256]
    - [76, 23263.1]
  - - [2944, 128, 1, 128]
    - [20, 3107.89]
  - - [6144, 32, 1, 2560]
    - [37, 15270.5]
  - - [6784, 448, 1, 1280]
    - [69, 33687.4]
  - - [2944, 5888, 1, 256]
    - [79, 35118.5]
  - - [64, 64, 1, 1280]
    - [49, 1266.4]
  - - [4288, 2944, 1, 256]
    - [79, 34292.4]
  - - [5888, 704, 1, 1280]
    - [69, 35109.8]
  - - [5056, 4, 1, 3328]
    - [88, 2692.22]
  - - [1856, 64, 1, 1280]
    - [52, 12105.4]
  - - [1760, 16, 1, 1760]
    - [43, 6073.73]
  - - [448, 5888, 1, 128]
    - [20, 3967.58]
  - - [5888, 64, 1, 3328]
    - [32, 22418.6]
  - - [2944, 256, 1, 3328]
    - [77, 28936.2]
  - - [1024, 64, 1, 128]
    - [20, 1188.19]
  - - [5056, 2368, 1, 1280]
    - [69, 35661.0]
  - - [448, 3584, 1, 1280]
    - [77, 28355.5]
  - - [6784, 5888, 1, 256]
    - [73, 36310.3]
  - - [64, 1024, 1, 3328]
    - [56, 14348.9]
  - - [704, 128, 1, 1280]
    - [28, 10679.9]
  - - [4, 3584, 1, 128]
    - [84, 319.695]
  - - [1408, 448, 1, 1280]
    - [77, 23789.1]
  - - [1024, 1408, 1, 256]
    - [69, 26177.2]
  - - [2368, 2368, 1, 3328]
    - [69, 35769.2]
  - - [1856, 6784, 1, 128]
    - [20, 3502.09]
  - - [5056, 704, 1, 3328]
    - [69, 34541.8]
  - - [1408, 1856, 1, 256]
    - [69, 30631.5]
  - - [1408, 704, 1, 3328]
    - [74, 30303.3]
  - - [2368, 5056, 1, 256]
    - [73, 33666.4]
  - - [1408, 256, 1, 1280]
    - [71, 18410.8]
  - - [3072, 128, 1, 1024]
    - [71, 18040.0]
  - - [3584, 2368, 1, 1280]
    - [69, 34961.5]
  - - [4288, 64, 1, 3328]
    - [35, 19915.2]
  - - [2368, 4, 1, 1280]
    - [87, 1550.4]
  - - [704, 5888, 1, 256]
    - [70, 31695.3]
  - - [6784, 2944, 1, 128]
    - [20, 3695.01]
  - - [6784, 64, 1, 256]
    - [71, 16995.3]
  - - [2944, 256, 1, 256]
    - [71, 23644.4]
  - - [2944, 6784, 1, 3328]
    - [69, 37360.0]
  - - [128, 1, 1, 1408]
    - [3, 58.8967]
  - - [704, 1408, 1, 3328]
    - [71, 29665.6]
  - - [3584, 704, 1, 3328]
    - [69, 33163.5]
  - - [2944, 256, 1, 128]
    - [20, 3447.78]
  - - [6784, 4, 1, 1280]
    - [86, 2435.77]
  - - [1024, 64, 1, 1280]
    - [31, 8388.61]
  - - [8448, 4, 1, 2816]
    - [12, 4018.51]
  - - [448, 4288, 1, 256]
    - [71, 27504.6]
  - - [64, 3584, 1, 3328]
    - [28, 20925.5]
  - - [704, 2368, 1, 1280]
    - [77, 29335.3]
  - - [1856, 2368, 1, 1280]
    - [69, 33453.9]
  - - [2368, 128, 1, 3328]
    - [40, 21453.2]
  - - [64, 193600, 1, 64]
    - [71, 27477.0]
  - - [1760, 128, 1, 1760]
    - [30, 17405.3]
  - - [448, 1408, 1, 256]
    - [77, 20286.5]
  - - [1856, 4288, 1, 1280]
    - [69, 35081.3]
  - - [64, 5056, 1, 3328]
    - [32, 21977.3]
  - - [512, 1500, 1, 2816]
    - [77, 29634.0]
  - - [1024, 448, 1, 128]
    - [20, 3170.64]
  - - [704, 4, 1, 1280]
    - [92, 613.007]
  - - [704, 256, 1, 128]
    - [20, 2252.8]
  - - [256, 193600, 1, 64]
    - [95, 31949.5]
  - - [704, 2944, 1, 128]
    - [20, 3879.65]
  - - [1408, 1024, 1, 1280]
    - [68, 29727.7]
  - - [704, 6784, 1, 256]
    - [76, 31142.1]
  - - [6784, 704, 1, 256]
    - [76, 31015.7]
  - - [5056, 1408, 1, 128]
    - [20, 4123.51]
  - - [2048, 7000, 1, 2048]
    - [75, 36248.9]
  - - [256, 3584, 1, 3328]
    - [74, 27794.0]
  - - [5056, 704, 1, 256]
    - [79, 30846.7]
  - - [128, 1408, 1, 128]
    - [20, 2239.68]
  - - [3584, 4288, 1, 3328]
    - [81, 36873.2]
  - - [5888, 1856, 1, 1280]
    - [69, 37011.2]
  - - [256, 1408, 1, 256]
    - [71, 14787.6]
  - - [5056, 64, 1, 1280]
    - [71, 16501.5]
  - - [1024, 704, 1, 256]
    - [77, 20829.5]
  - - [64, 256, 1, 128]
    - [20, 318.716]
  - - [2368, 3584, 1, 1280]
    - [69, 35295.5]
  - - [1024, 256, 1, 256]
    - [71, 11898.7]
  - - [1856, 4, 1, 1280]
    - [87, 1294.65]
  - - [448, 448, 1, 256]
    - [71, 10528.7]
  - - [2944, 3584, 1, 3328]
    - [69, 36255.3]
  - - [7680, 32, 1, 2560]
    - [32, 19111.3]
  - - [128, 4288, 1, 128]
    - [20, 3193.39]
  - - [256, 256, 1, 3328]
    - [35, 14559.7]
  - - [128, 1024, 1, 3328]
    - [53, 19438.8]
  - - [4, 1408, 1, 3328]
    - [49, 1641.27]
  - - [196, 256, 64, 1024]
    - [103, 23226.0]
  - - [6784, 2944, 1, 256]
    - [79, 35363.5]
  - - [64, 1856, 1, 1280]
    - [35, 12261.6]
  - - [64, 1024, 1, 128]
    - [20, 1194.96]
  - - [1024, 1500, 1, 2560]
    - [69, 32326.2]
  - - [1856, 2368, 1, 256]
    - [70, 31783.1]
  - - [3584, 256, 1, 128]
    - [20, 3571.79]
  - - [3584, 6784, 1, 3328]
    - [69, 37477.7]
  - - [256, 1024, 1, 256]
    - [70, 13262.6]
  - - [4, 6784, 1, 3328]
    - [42, 2568.5]
  - - [1024, 5888, 1, 3328]
    - [81, 35197.8]
  - - [1024, 128, 1, 1280]
    - [30, 10659.0]
  - - [3072, 32, 1, 1024]
    - [29, 8738.13]
  - - [6144, 24000, 1, 2560]
    - [73, 37955.1]
  - - [448, 1024, 1, 256]
    - [71, 18700.7]
  - - [5056, 4288, 1, 1280]
    - [69, 37191.2]
  - - [5888, 64, 1, 256]
    - [70, 14841.4]
  - - [1856, 256, 1, 1280]
    - [71, 24019.5]
  - - [64, 5888, 1, 3328]
    - [32, 22507.1]
  - - [2368, 2368, 1, 1280]
    - [69, 35266.8]
  - - [2944, 5888, 1, 128]
    - [20, 3699.58]
  - - [704, 5888, 1, 1280]
    - [77, 33206.9]
  - - [2368, 3584, 1, 128]
    - [20, 3306.12]
  - - [1856, 5056, 1, 128]
    - [20, 3115.65]
  - - [4608, 1, 1, 1536]
    - [4, 722.233]
  - - [448, 256, 1, 3328]
    - [57, 17428.4]
  - - [2944, 6784, 1, 1280]
    - [69, 37092.7]
  - - [448, 1856, 1, 128]
    - [20, 3498.7]
  - - [128, 1024, 1, 128]
    - [20, 2051.0]
  - - [7680, 4, 1, 2560]
    - [29, 3967.87]
  - - [1024, 704, 1, 1280]
    - [77, 26066.3]
  - - [128, 5888, 1, 256]
    - [71, 22434.6]
  - - [1024, 5056, 1, 1280]
    - [81, 34776.5]
  - - [4288, 1024, 1, 256]
    - [76, 31575.1]
  - - [2944, 2368, 1, 128]
    - [20, 3146.03]
  - - [704, 704, 1, 3328]
    - [71, 26231.1]
  - - [704, 1408, 1, 1280]
    - [71, 29060.4]
  - - [5888, 448, 1, 1280]
    - [77, 30390.8]
  - - [3584, 256, 1, 3328]
    - [74, 27819.4]
  - - [704, 5888, 1, 3328]
    - [71, 33545.1]
  - - [704, 1856, 1, 128]
    - [20, 3654.89]
  - - [128, 3584, 1, 3328]
    - [32, 24111.3]
  - - [4, 4288, 1, 128]
    - [84, 304.924]
  - - [128, 704, 1, 1280]
    - [28, 10840.5]
  - - [3584, 2944, 1, 256]
    - [79, 33848.8]
  - - [1856, 128, 1, 3328]
    - [37, 21333.7]
  - - [1856, 2368, 1, 3328]
    - [69, 33982.1]
  - - [512, 6000, 1, 2816]
    - [69, 34550.5]
  - - [2944, 448, 1, 128]
    - [20, 3763.28]
  - - [64, 193600, 1, 256]
    - [77, 31293.8]
  - - [128, 2944, 1, 1280]
    - [77, 19171.1]
  - - [448, 2944, 1, 1280]
    - [68, 27028.6]
  - - [512, 24000, 1, 2048]
    - [79, 35292.7]
  - - [128, 256, 1, 3328]
    - [61, 9913.81]
  - - [1408, 5056, 1, 3328]
    - [69, 36169.2]
  - - [1856, 1856, 1, 3328]
    - [69, 33481.6]
  - - [3584, 128, 1, 256]
    - [70, 17740.3]
  - - [448, 1408, 1, 3328]
    - [71, 24404.2]
  - - [2368, 2368, 1, 256]
    - [73, 32639.8]
  - - [4288, 4288, 1, 1280]
    - [69, 36816.5]
  - - [64, 448, 1, 1280]
    - [43, 5227.94]
  - - [5888, 1024, 1, 1280]
    - [69, 35044.6]
  - - [704, 1024, 1, 256]
    - [71, 23011.1]
  - - [1024, 12544, 1, 256]
    - [97, 33101.8]
  - - [448, 4, 1, 256]
    - [87, 286.72]
  - - [5888, 448, 1, 128]
    - [20, 3967.59]
  - - [512, 48000, 1, 2560]
    - [79, 37427.3]
  - - [8448, 16, 1, 2816]
    - [48, 13026.5]
  - - [704, 6784, 1, 3328]
    - [69, 33339.6]
  - - [5888, 5888, 1, 1280]
    - [69, 37639.1]
  - - [5056, 1024, 1, 1280]
    - [69, 35617.5]
  - - [448, 5888, 1, 3328]
    - [77, 30729.1]
  - - [3072, 2, 1, 1024]
    - [54, 964.947]
  - - [1024, 2944, 1, 1280]
    - [81, 32453.8]
  - - [5056, 5888, 1, 1280]
    - [69, 37180.9]
  - - [4288, 5888, 1, 128]
    - [20, 3826.33]
  - - [256, 3584, 1, 256]
    - [71, 23967.5]
  - - [256, 4, 1, 1280]
    - [49, 291.271]
  - - [1408, 3584, 1, 128]
    - [20, 3973.93]
  - - [256, 2944, 1, 3328]
    - [77, 28909.6]
  - - [448, 3584, 1, 128]
    - [20, 3808.76]
  - - [5888, 2944, 1, 1280]
    - [69, 36733.7]
  - - [4, 6784, 1, 1280]
    - [87, 2226.54]
  - - [2368, 5888, 1, 128]
    - [20, 3206.97]
  - - [35, 8457, 1, 1760]
    - [15, 13545.3]
  - - [64, 2944, 1, 128]
    - [20, 2369.08]
  - - [2368, 4, 1, 256]
    - [87, 1027.47]
  - - [3584, 5888, 1, 256]
    - [79, 35461.9]
  - - [2368, 1024, 1, 128]
    - [20, 3848.95]
  - - [2368, 704, 1, 128]
    - [20, 3815.9]
  - - [512, 32, 1, 512]
    - [55, 1941.81]
  - - [3584, 2368, 1, 128]
    - [20, 4093.47]
  - - [5056, 704, 1, 128]
    - [20, 4026.93]
  - - [448, 2368, 1, 128]
    - [20, 3598.05]
  - - [4, 5056, 1, 256]
    - [87, 1578.46]
  - - [5056, 1408, 1, 3328]
    - [69, 36024.0]
  - - [1408, 704, 1, 256]
    - [71, 26268.7]
  - - [6784, 1024, 1, 3328]
    - [69, 35330.7]
  - - [6784, 2944, 1, 3328]
    - [69, 37376.8]
  - - [7680, 1, 1, 2560]
    - [7, 1021.87]
  - - [1856, 1856, 1, 256]
    - [79, 30241.9]
  - - [64, 64, 1, 3328]
    - [67, 2552.71]
  - - [512, 1, 1, 512]
    - [11, 78.019]
  - - [6784, 2368, 1, 1280]
    - [69, 37299.7]
  - - [4608, 2, 1, 1536]
    - [6, 1418.41]
  - - [4288, 3584, 1, 256]
    - [79, 34933.9]
  - - [4288, 5888, 1, 1280]
    - [69, 37322.9]
  - - [4608, 4, 1, 1536]
    - [12, 2743.37]
  - - [1024, 6000, 1, 1536]
    - [81, 35025.2]
  - - [8448, 32, 1, 2816]
    - [30, 18861.9]
  - - [448, 2944, 1, 3328]
    - [69, 27731.5]
  - - [4288, 1856, 1, 1280]
    - [69, 35168.5]
  - - [1856, 2944, 1, 3328]
    - [69, 34906.9]
  - - [256, 6784, 1, 3328]
    - [77, 30940.9]
  - - [512, 3000, 1, 1536]
    - [69, 31092.5]
  - - [64, 5888, 1, 256]
    - [77, 12726.8]
  - - [256, 5056, 1, 128]
    - [20, 3703.06]
  - - [5056, 1024, 1, 256]
    - [73, 32774.5]
  - - [704, 64, 1, 3328]
    - [61, 11919.4]
  - - [5056, 1856, 1, 3328]
    - [69, 35437.6]
  - - [4, 2944, 1, 3328]
    - [92, 2062.66]
  - - [512, 1500, 1, 2048]
    - [77, 26075.3]
  - - [1024, 1, 1, 500000]
    - [5, 1295.09]
  - - [256, 4, 1, 256]
    - [87, 170.223]
  - - [6784, 128, 1, 3328]
    - [74, 26305.1]
  - - [4288, 1408, 1, 128]
    - [20, 4022.49]
  - - [1856, 5888, 1, 3328]
    - [69, 35798.9]
  - - [4288, 5056, 1, 256]
    - [79, 35591.3]
  - - [1408, 128, 1, 1280]
    - [40, 14417.9]
  - - [4096, 7000, 1, 4096]
    - [73, 37477.1]
  - - [5056, 256, 1, 3328]
    - [77, 31110.4]
  - - [704, 704, 1, 256]
    - [71, 19886.8]
  - - [1024, 3000, 1, 2560]
    - [69, 33825.1]
  - - [1024, 5888, 1, 1280]
    - [81, 34364.3]
  - - [6784, 2368, 1, 128]
    - [20, 3667.18]
  - - [4, 5056, 1, 1280]
    - [87, 2201.25]
  - - [256, 64, 1, 1280]
    - [54, 3530.56]
  - - [128, 1856, 1, 1280]
    - [83, 15937.5]
  - - [1856, 1024, 1, 1280]
    - [69, 29907.7]
  - - [6784, 4288, 1, 1280]
    - [69, 37739.1]
  - - [1856, 1856, 1, 1280]
    - [69, 32944.3]
  - - [35, 1500, 1, 2048]
    - [19, 6477.11]
  - - [3072, 24000, 1, 1024]
    - [73, 37555.3]
  - - [1408, 5056, 1, 1280]
    - [69, 35731.0]
  - - [4, 2368, 1, 3328]
    - [92, 1997.64]
  - - [5888, 1856, 1, 128]
    - [20, 3438.89]
  - - [448, 704, 1, 1280]
    - [77, 16304.6]
  - - [448, 6784, 1, 128]
    - [20, 3975.29]
  - - [1024, 448, 1, 3328]
    - [77, 22698.9]
  - - [2944, 128, 1, 256]
    - [70, 15264.1]
  - - [5056, 3584, 1, 128]
    - [20, 3717.07]
  - - [5888, 5888, 1, 3328]
    - [69, 37962.7]
  - - [6784, 1024, 1, 256]
    - [79, 32775.2]
  - - [2944, 2368, 1, 256]
    - [79, 32782.4]
  - - [256, 448, 1, 256]
    - [70, 6194.12]
  - - [5056, 5888, 1, 3328]
    - [69, 37566.9]
  - - [1856, 1024, 1, 256]
    - [71, 27457.1]
  - - [512, 48000, 1, 1536]
    - [73, 37348.4]
  - - [3584, 448, 1, 1280]
    - [71, 28053.6]
  - - [1024, 1024, 1, 1280]
    - [80, 30026.3]
  - - [448, 5888, 1, 256]
    - [76, 28493.0]
  - - [2048, 128, 1, 2048]
    - [41, 17718.5]
  - - [1408, 6784, 1, 3328]
    - [69, 36139.1]
  - - [448, 1024, 1, 128]
    - [20, 3126.74]
  - - [4288, 704, 1, 128]
    - [20, 3985.98]
  - - [128, 1856, 1, 128]
    - [20, 2534.06]
  - - [448, 2368, 1, 3328]
    - [77, 25661.8]
  - - [5056, 64, 1, 128]
    - [20, 2884.34]
  - - [5056, 2944, 1, 256]
    - [79, 34926.9]
  - - [6784, 5888, 1, 128]
    - [20, 3977.7]
  - - [1024, 700, 1, 512]
    - [77, 22937.6]
  - - [3072, 1, 1, 128]
    - [50, 105.138]
  - - [1024, 4, 1, 256]
    - [87, 576.141]
  - - [2944, 704, 1, 128]
    - [20, 3887.6]
  - - [128, 6784, 1, 1280]
    - [71, 25539.8]
  - - [1408, 3584, 1, 3328]
    - [69, 35286.0]
  - - [2368, 6784, 1, 256]
    - [72, 34408.6]
  - - [5056, 1408, 1, 1280]
    - [69, 35583.1]
  - - [5056, 4288, 1, 128]
    - [20, 3783.21]
  - - [4, 704, 1, 256]
    - [87, 396.097]
  - - [4288, 2368, 1, 3328]
    - [69, 36492.9]
  - - [1408, 1856, 1, 128]
    - [20, 3929.7]
  - - [1408, 5888, 1, 3328]
    - [69, 36989.1]
  - - [1856, 256, 1, 256]
    - [71, 19430.5]
  - - [6784, 6784, 1, 256]
    - [73, 36594.0]
  - - [5888, 5056, 1, 128]
    - [20, 3842.81]
  - - [4288, 2368, 1, 128]
    - [20, 3385.55]
  - - [128, 5888, 1, 1280]
    - [77, 27832.9]
  - - [256, 4288, 1, 1280]
    - [71, 26010.6]
  - - [2368, 2944, 1, 256]
    - [73, 32638.6]
  - - [4, 1856, 1, 256]
    - [87, 959.871]
  - - [3584, 1856, 1, 1280]
    - [69, 35417.8]
  - - [6784, 6784, 1, 128]
    - [20, 3830.84]
  - - [256, 1856, 1, 128]
    - [20, 3087.18]
  - - [49, 512, 64, 2048]
    - [99, 13438.2]
  - - [704, 64, 1, 1280]
    - [43, 6982.04]
  - - [5888, 5056, 1, 256]
    - [79, 36294.2]
  - - [8448, 48000, 1, 2816]
    - [69, 38627.5]
  - - [512, 6000, 1, 2048]
    - [77, 30192.2]
  - - [3584, 448, 1, 256]
    - [77, 25467.3]
  - - [448, 4288, 1, 128]
    - [20, 3858.94]
  - - [7680, 64, 1, 2560]
    - [33, 20929.7]
  - - [256, 6784, 1, 256]
    - [71, 27444.2]
  - - [1408, 4288, 1, 128]
    - [20, 2682.59]
  - - [2944, 704, 1, 3328]
    - [74, 33167.6]
  - - [128, 448, 1, 256]
    - [70, 3084.05]
  - - [2048, 32, 1, 2048]
    - [52, 10518.6]
  - - [3584, 3584, 1, 256]
    - [73, 34526.8]
  - - [448, 1408, 1, 128]
    - [20, 3224.45]
  - - [128, 256, 1, 1280]
    - [31, 6061.13]
  - - [3584, 5056, 1, 256]
    - [79, 35352.1]
  - - [6784, 128, 1, 256]
    - [71, 22364.0]
  - - [4288, 4, 1, 256]
    - [87, 1389.53]
  - - [64, 1408, 1, 3328]
    - [28, 17117.2]
  - - [704, 448, 1, 256]
    - [71, 13236.1]
  - - [2944, 2368, 1, 1280]
    - [69, 35045.9]
  - - [448, 64, 1, 3328]
    - [61, 9018.94]
  - - [704, 6784, 1, 128]
    - [20, 2840.18]
  - - [3584, 4, 1, 3328]
    - [91, 2416.93]
  - - [6784, 3584, 1, 256]
    - [79, 35792.7]
  - - [704, 448, 1, 128]
    - [20, 2879.47]
  - - [256, 128, 1, 128]
    - [20, 600.903]
  - - [704, 1408, 1, 128]
    - [20, 3524.38]
  - - [4, 448, 1, 128]
    - [84, 40.5267]
  - - [4288, 128, 1, 1280]
    - [71, 20542.3]
  - - [128, 1408, 1, 256]
    - [71, 9264.53]
  - - [4, 2944, 1, 256]
    - [87, 1177.6]
  - - [64, 128, 1, 3328]
    - [59, 4155.94]
  - - [1856, 1408, 1, 256]
    - [71, 30687.7]
  - - [5056, 2368, 1, 128]
    - [20, 3440.72]
  - - [2944, 2944, 1, 3328]
    - [69, 36533.0]
  - - [5056, 6784, 1, 256]
    - [79, 35668.1]
  - - [1856, 3584, 1, 128]
    - [20, 3063.41]
  - - [5888, 4, 1, 1280]
    - [87, 2276.93]
  - - [128, 2944, 1, 128]
    - [20, 2941.13]
  - - [35, 8457, 1, 2560]
    - [15, 13702.5]
  - - [3584, 6784, 1, 128]
    - [20, 3719.41]
  - - [128, 4288, 1, 256]
    - [71, 16969.7]
  - - [704, 448, 1, 3328]
    - [77, 16885.9]
  - - [2368, 6784, 1, 1280]
    - [69, 36119.1]
  - - [128, 128, 1, 3328]
    - [63, 6569.39]
  - - [5056, 1856, 1, 256]
    - [73, 33089.4]
  - - [256, 128, 1, 256]
    - [70, 1777.25]
  - - [1024, 3000, 1, 2816]
    - [81, 33823.7]
  - - [1024, 1856, 1, 256]
    - [79, 26940.2]
  - - [64, 1, 1, 1216]
    - [49, 25.2675]
  - - [4288, 64, 1, 128]
    - [20, 2602.02]
  - - [256, 448, 1, 3328]
    - [35, 17317.7]
  - - [1408, 6784, 1, 1280]
    - [69, 35695.4]
  - - [3584, 3584, 1, 1280]
    - [69, 36383.4]
  - - [7680, 24000, 1, 2560]
    - [69, 38154.7]
  - - [64, 2368, 1, 1280]
    - [37, 13071.9]
  - - [448, 2368, 1, 1280]
    - [77, 25183.7]
  - - [4608, 48000, 1, 1536]
    - [81, 38156.9]
  - - [5888, 5888, 1, 128]
    - [20, 3871.35]
  - - [64, 6784, 1, 3328]
    - [40, 22598.3]
  - - [2944, 256, 1, 1280]
    - [77, 28190.8]
  - - [2048, 16, 1, 2048]
    - [44, 6875.91]
  - - [256, 2368, 1, 128]
    - [20, 3282.34]
  - - [5056, 2368, 1, 3328]
    - [69, 35996.1]
  - - [2944, 4288, 1, 256]
    - [79, 34482.6]
  - - [1408, 3584, 1, 1280]
    - [69, 34794.4]
  - - [2368, 64, 1, 256]
    - [70, 7853.71]
  - - [1024, 128, 1, 128]
    - [20, 1973.79]
  - - [704, 128, 1, 3328]
    - [35, 16981.5]
  - - [5888, 4, 1, 128]
    - [84, 408.49]
  - - [1856, 704, 1, 256]
    - [70, 27690.0]
  - - [1024, 1500, 1, 2816]
    - [69, 32370.7]
  - - [8448, 1, 1, 2816]
    - [7, 1083.31]
  - - [1024, 4, 1, 3328]
    - [26, 1521.37]
  - - [1024, 6000, 1, 2048]
    - [79, 34859.6]
  - - [512, 24000, 1, 2560]
    - [75, 36518.0]
  - - [6144, 3000, 1, 2560]
    - [75, 36598.1]
  - - [2368, 6784, 1, 3328]
    - [69, 36454.5]
  - - [1856, 1408, 1, 1280]
    - [77, 32806.6]
  - - [1856, 448, 1, 1280]
    - [77, 24511.9]
  - - [6784, 704, 1, 128]
    - [20, 4055.46]
  - - [4, 4, 1, 256]
    - [87, 1.8789]
  - - [128, 5888, 1, 128]
    - [20, 3442.86]
  - - [5056, 2944, 1, 128]
    - [20, 3582.27]
  - - [1408, 5888, 1, 256]
    - [73, 34397.4]
  - - [704, 2944, 1, 1280]
    - [71, 32001.2]
  - - [4288, 64, 1, 1280]
    - [37, 15326.0]
  - - [256, 64, 1, 256]
    - [59, 1033.08]
  - - [1024, 1024, 1, 256]
    - [77, 25228.9]
  - - [704, 1856, 1, 256]
    - [70, 27828.3]
  - - [2560, 64, 1, 2560]
    - [40, 15935.8]
  - - [3584, 704, 1, 1280]
    - [68, 32393.3]
  - - [256, 128, 1, 1280]
    - [31, 6186.29]
  - - [5888, 2368, 1, 256]
    - [79, 35159.1]
  - - [256, 2368, 1, 1280]
    - [71, 22970.6]
  - - [2944, 6784, 1, 128]
    - [20, 3608.94]
  - - [3584, 448, 1, 3328]
    - [77, 28559.8]
  - - [1408, 4, 1, 256]
    - [87, 735.608]
  - - [704, 2368, 1, 3328]
    - [77, 29751.3]
  - - [2944, 448, 1, 256]
    - [71, 24609.4]
  - - [1856, 448, 1, 128]
    - [20, 3547.68]
  - - [4608, 6000, 1, 1536]
    - [69, 37487.5]
  - - [2368, 128, 1, 1280]
    - [40, 16071.8]
  - - [256, 5888, 1, 128]
    - [20, 3820.55]
  - - [64, 6784, 1, 256]
    - [71, 13893.6]
  - - [64, 5056, 1, 1280]
    - [77, 16053.8]
  - - [4, 6784, 1, 128]
    - [84, 466.856]
  - - [2944, 2944, 1, 1280]
    - [69, 36153.1]
  - - [5056, 448, 1, 3328]
    - [77, 31876.7]
  - - [4, 3584, 1, 1280]
    - [87, 1872.46]
  - - [1408, 128, 1, 128]
    - [20, 2209.64]
  - - [6784, 704, 1, 3328]
    - [69, 33426.5]
  - - [128, 64, 1, 1280]
    - [66, 2269.65]
  - - [2368, 256, 1, 1280]
    - [77, 22875.8]
  - - [4, 448, 1, 3328]
    - [93, 842.341]
  - - [5888, 4288, 1, 128]
    - [20, 3835.95]
  - - [4, 5888, 1, 256]
    - [87, 1545.98]
  - - [1408, 2944, 1, 3328]
    - [69, 35742.2]
  - - [3584, 704, 1, 128]
    - [20, 3975.41]
  - - [64, 1024, 1, 256]
    - [70, 3524.63]
  - - [2368, 448, 1, 1280]
    - [77, 25211.8]
  - - [128, 3584, 1, 256]
    - [71, 17686.8]
  - - [704, 448, 1, 1280]
    - [77, 16265.2]
  - - [448, 5056, 1, 128]
    - [20, 3906.38]
  - - [6144, 4, 1, 2560]
    - [25, 3353.65]
  - - [5056, 3584, 1, 256]
    - [79, 35416.9]
  - - [4288, 4288, 1, 256]
    - [79, 35069.7]
  - - [1408, 5056, 1, 128]
    - [20, 3160.42]
  - - [2944, 3584, 1, 128]
    - [20, 3082.64]
  - - [3584, 2368, 1, 256]
    - [79, 33109.6]
  - - [5888, 5056, 1, 1280]
    - [69, 37836.6]
  - - [128, 1024, 1, 1280]
    - [28, 12885.7]
  - - [8448, 24000, 1, 2816]
    - [69, 38630.7]
  - - [64, 704, 1, 256]
    - [71, 2423.18]
  - - [4288, 256, 1, 1280]
    - [77, 25933.8]
  - - [3584, 3584, 1, 3328]
    - [69, 36804.4]
  - - [704, 64, 1, 128]
    - [20, 833.406]
  - - [3072, 1500, 1, 128]
    - [79, 28912.9]
  - - [2048, 3136, 1, 512]
    - [98, 32538.4]
  - - [3025, 256, 64, 64]
    - [101, 31949.5]
  - - [5888, 6784, 1, 256]
    - [79, 36310.3]
  - - [4288, 2944, 1, 3328]
    - [69, 36492.4]
  - - [2944, 64, 1, 128]
    - [20, 2016.49]
  - - [1024, 128, 1, 3328]
    - [30, 16411.1]
  - - [1024, 16, 1, 500000]
    - [0, 18542.3]
  - - [4288, 128, 1, 3328]
    - [40, 23057.6]
  - - [7680, 128, 1, 2560]
    - [74, 28972.9]
  - - [256, 5056, 1, 1280]
    - [77, 30387.9]
  - - [1408, 256, 1, 128]
    - [20, 2905.37]
  - - [2944, 5888, 1, 3328]
    - [69, 37155.1]
  - - [6784, 5888, 1, 1280]
    - [69, 37826.5]
  - - [3072, 1, 1, 1024]
    - [27, 462.607]
  - - [704, 128, 1, 256]
    - [70, 4908.23]
  - - [5888, 4288, 1, 1280]
    - [69, 37353.9]
  - - [1024, 24000, 1, 2048]
    - [73, 37301.5]
  - - [448, 256, 1, 1280]
    - [28, 12013.1]
  - - [5888, 3584, 1, 128]
    - [20, 3566.42]
  - - [64, 4288, 1, 3328]
    - [28, 19897.8]
  - - [448, 4, 1, 1280]
    - [87, 449.757]
  - - [6784, 6784, 1, 3328]
    - [69, 38470.7]
  - - [5056, 4, 1, 1280]
    - [87, 2299.0]
  - - [4, 5888, 1, 3328]
    - [42, 2554.79]
  - - [256, 1408, 1, 1280]
    - [77, 18543.9]
  - - [3072, 16, 1, 1024]
    - [47, 6307.22]
  - - [704, 3584, 1, 128]
    - [20, 2250.92]
  - - [1024, 2, 1, 512]
    - [11, 243.855]
  - - [5888, 448, 1, 3328]
    - [77, 30720.5]
  - - [2368, 4288, 1, 1280]
    - [69, 36027.0]
  - - [4288, 2944, 1, 128]
    - [20, 3549.31]
  - - [256, 64, 1, 3328]
    - [60, 6491.18]
  - - [2944, 64, 1, 3328]
    - [40, 20681.0]
  - - [6784, 64, 1, 3328]
    - [71, 22754.9]
  - - [5056, 2944, 1, 3328]
    - [69, 37126.8]
  - - [448, 128, 1, 256]
    - [70, 3084.05]
  - - [2944, 3584, 1, 256]
    - [79, 33950.9]
  - - [1408, 1408, 1, 3328]
    - [75, 32411.3]
  - - [1856, 128, 1, 1280]
    - [82, 16401.7]
  - - [3584, 3584, 1, 128]
    - [20, 3567.92]
  - - [64, 3584, 1, 256]
    - [71, 10561.2]
  - - [1408, 4, 1, 3328]
    - [91, 1725.9]
  - - [128, 2944, 1, 3328]
    - [32, 22952.0]
  - - [3584, 704, 1, 256]
    - [73, 29200.8]
  - - [2944, 448, 1, 3328]
    - [69, 27886.5]
  - - [1024, 2, 1, 500000]
    - [5, 2576.23]
  - - [3584, 1408, 1, 3328]
    - [81, 35041.5]
  - - [704, 3584, 1, 1280]
    - [77, 31700.2]
  - - [1024, 1408, 1, 128]
    - [20, 3682.15]
  - - [1856, 6784, 1, 256]
    - [73, 33987.0]
  - - [4288, 448, 1, 3328]
    - [69, 30852.1]
  - - [6784, 4288, 1, 128]
    - [20, 3415.8]
  - - [6784, 704, 1, 1280]
    - [69, 33040.7]
  - - [6144, 1, 1, 2560]
    - [2, 891.646]
  - - [3584, 6784, 1, 256]
    - [79, 35780.3]
  - - [6144, 16, 1, 2560]
    - [36, 12240.2]
  - - [3584, 64, 1, 128]
    - [20, 2450.76]
  - - [5888, 1024, 1, 3328]
    - [69, 35491.6]
  - - [448, 64, 1, 128]
    - [20, 566.36]
  - - [704, 6784, 1, 1280]
    - [68, 32771.5]
  - - [4, 448, 1, 256]
    - [87, 279.727]
  - - [196, 1024, 64, 256]
    - [102, 26548.8]
  - - [5888, 128, 1, 256]
    - [71, 23586.6]
  - - [4096, 16, 1, 4096]
    - [39, 12268.5]
  - - [1856, 5056, 1, 3328]
    - [69, 35452.1]
  - - [4, 6784, 1, 256]
    - [87, 1516.77]
  - - [1024, 3584, 1, 128]
    - [20, 2601.12]
  - - [64, 704, 1, 3328]
    - [46, 12112.0]
  - - [2368, 2944, 1, 128]
    - [20, 3893.28]
  - - [5056, 64, 1, 256]
    - [70, 12903.0]
  - - [512, 1500, 1, 1536]
    - [77, 28814.1]
  - - [512, 1, 1, 500000]
    - [8, 1295.42]
  - - [5888, 2944, 1, 3328]
    - [69, 37076.8]
  - - [128, 3584, 1, 1280]
    - [71, 22901.8]
  - - [1024, 704, 1, 128]
    - [20, 3474.2]
  - - [1408, 2368, 1, 128]
    - [20, 3981.07]
  - - [5888, 2368, 1, 128]
    - [20, 3583.55]
  - - [128, 5056, 1, 3328]
    - [71, 25049.7]
  - - [3584, 6784, 1, 1280]
    - [69, 36889.8]
  - - [4288, 1856, 1, 256]
    - [73, 32861.0]
  - - [1856, 5888, 1, 256]
    - [72, 34009.2]
  - - [256, 256, 1, 256]
    - [70, 3554.49]
  - - [4288, 4288, 1, 3328]
    - [69, 37187.3]
  - - [1024, 1024, 1, 128]
    - [20, 3260.88]
  - - [4288, 1408, 1, 1280]
    - [69, 35047.6]
  - - [3584, 5056, 1, 128]
    - [20, 3742.26]
  - - [4, 1024, 1, 3328]
    - [90, 1440.96]
  - - [4, 704, 1, 128]
    - [84, 63.6834]
  - - [4288, 2368, 1, 256]
    - [79, 34050.6]
  - - [2944, 5056, 1, 1280]
    - [69, 36942.3]
  - - [448, 6784, 1, 256]
    - [70, 30203.5]
  - - [64, 128, 1, 128]
    - [20, 165.391]
  - - [1856, 2368, 1, 128]
    - [20, 4007.99]
  - - [6784, 2368, 1, 3328]
    - [69, 37653.0]
  - - [1408, 6784, 1, 128]
    - [20, 3315.73]
  - - [256, 1024, 1, 1280]
    - [83, 17943.5]
  - - [704, 4, 1, 128]
    - [84, 64.1367]
  - - [1408, 4, 1, 128]
    - [84, 126.918]
  - - [4288, 128, 1, 256]
    - [71, 17261.6]
  - - [4288, 1856, 1, 3328]
    - [69, 35479.3]
  - - [3584, 448, 1, 128]
    - [20, 3773.8]
  - - [64, 4288, 1, 128]
    - [20, 2552.86]
  - - [64, 448, 1, 3328]
    - [65, 8951.26]
  - - [448, 4, 1, 3328]
    - [93, 890.116]
  - - [256, 4, 1, 3328]
    - [93, 628.759]
  - - [4, 1408, 1, 1280]
    - [90, 995.713]
  - - [3584, 64, 1, 1280]
    - [82, 15387.9]
  - - [1408, 448, 1, 128]
    - [20, 3325.39]
  - - [3584, 1024, 1, 1280]
    - [68, 34735.4]
  - - [1856, 5056, 1, 256]
    - [70, 33080.2]
  - - [4, 3584, 1, 256]
    - [87, 1369.41]
  - - [6784, 4288, 1, 3328]
    - [69, 38049.8]
  - - [4, 2944, 1, 1280]
    - [87, 1720.69]
  - - [1024, 4288, 1, 256]
    - [79, 30495.8]
  - - [5888, 3584, 1, 3328]
    - [69, 37556.7]
  - - [1856, 4, 1, 256]
    - [87, 940.863]
  - - [4, 256, 1, 256]
    - [87, 165.914]
  - - [5056, 3584, 1, 3328]
    - [69, 37474.7]
  - - [1408, 128, 1, 3328]
    - [40, 19435.7]
  - - [4, 64, 1, 1280]
    - [49, 84.4536]
  - - [2368, 1408, 1, 1280]
    - [77, 32652.7]
  - - [5056, 2944, 1, 1280]
    - [69, 36788.2]
  - - [8448, 6000, 1, 2816]
    - [69, 38380.4]
  - - [4, 4, 1, 128]
    - [85, 0.178709]
  - - [3584, 256, 1, 256]
    - [71, 23348.0]
  - - [3584, 2944, 1, 1280]
    - [69, 35414.5]
  - - [1024, 6784, 1, 256]
    - [79, 32346.0]
  - - [4, 128, 1, 256]
    - [87, 85.1117]
  - - [6784, 448, 1, 256]
    - [79, 30463.7]
  - - [5124, 9124, 1, 2048]
    - [79, 36605.0]
  - - [2944, 5056, 1, 3328]
    - [69, 37296.8]
  - - [6784, 4, 1, 128]
    - [84, 471.93]
  - - [2944, 1408, 1, 128]
    - [20, 3929.64]
  - - [448, 128, 1, 3328]
    - [28, 13179.6]
  - - [64, 2944, 1, 3328]
    - [28, 19693.7]
  - - [5056, 6784, 1, 3328]
    - [69, 37453.5]
  - - [704, 2368, 1, 128]
    - [20, 3798.24]
  - - [3072, 1500, 1, 1024]
    - [73, 33757.3]
  - - [128, 2944, 1, 256]
    - [71, 14841.4]
  - - [3136, 512, 1, 2048]
    - [102, 27531.3]
  - - [128, 6784, 1, 128]
    - [20, 3482.11]
  - - [3584, 4288, 1, 256]
    - [79, 34915.3]
  - - [448, 1856, 1, 256]
    - [71, 21989.8]
  - - [1856, 6784, 1, 3328]
    - [69, 36393.9]
  - - [3584, 128, 1, 3328]
    - [71, 23640.9]
  - - [64, 1856, 1, 256]
    - [71, 6231.29]
  - - [64, 448, 1, 256]
    - [51, 1691.25]
  - - [5888, 4288, 1, 256]
    - [79, 35756.9]
  - - [128, 1500, 1, 1280]
    - [32, 15226.8]
  - - [5056, 1408, 1, 256]
    - [79, 33231.7]
  - - [35, 8457, 1, 4096]
    - [16, 14324.1]
  - - [64, 256, 1, 1280]
    - [54, 3566.58]
  - - [2944, 4, 1, 128]
    - [84, 266.312]
  - - [3584, 1024, 1, 256]
    - [73, 31869.9]
  - - [512, 6000, 1, 1536]
    - [69, 33834.7]
  - - [256, 704, 1, 256]
    - [70, 9454.37]
  - - [5888, 5888, 1, 256]
    - [73, 36154.3]
  - - [4288, 1024, 1, 1280]
    - [69, 33474.5]
  - - [5888, 128, 1, 3328]
    - [71, 28843.1]
  - - [448, 6784, 1, 3328]
    - [71, 32487.2]
  - - [2944, 1408, 1, 1280]
    - [69, 35179.6]
  - - [3072, 6000, 1, 1024]
    - [79, 36156.4]
  - - [1024, 32, 1, 512]
    - [38, 3028.38]
  - - [2944, 1856, 1, 3328]
    - [69, 35006.4]
  - - [2368, 64, 1, 128]
    - [20, 1924.47]
  - - [256, 1024, 1, 128]
    - [20, 2768.52]
  - - [3584, 5888, 1, 1280]
    - [69, 36721.1]
  - - [64, 4, 1, 128]
    - [84, 3.7578]
  - - [6784, 1856, 1, 1280]
    - [69, 36119.7]
  - - [2944, 5056, 1, 256]
    - [79, 35126.5]
  - - [5888, 256, 1, 3328]
    - [69, 31665.1]
  - - [2944, 4288, 1, 128]
    - [20, 3498.43]
  - - [3584, 1408, 1, 256]
    - [79, 31897.4]
  - - [704, 3584, 1, 3328]
    - [77, 32133.0]
  - - [5056, 448, 1, 1280]
    - [77, 31514.3]
  - - [3584, 1856, 1, 3328]
    - [69, 35859.6]
  - - [64, 1408, 1, 128]
    - [20, 1376.41]
  - - [4288, 6784, 1, 1280]
    - [69, 37012.1]
  - - [1024, 3000, 1, 2048]
    - [69, 32922.3]
  - - [1408, 704, 1, 1280]
    - [74, 29087.0]
  - - [2944, 1024, 1, 256]
    - [73, 30383.9]
  - - [256, 64, 1, 128]
    - [20, 299.593]
  - - [2368, 4288, 1, 3328]
    - [69, 36413.5]
  - - [4, 1408, 1, 256]
    - [87, 735.608]
  - - [1024, 1408, 1, 1280]
    - [69, 29117.9]
  - - [64, 64, 1, 256]
    - [54, 301.315]
  - - [704, 256, 1, 3328]
    - [82, 13858.3]
  - - [6784, 5056, 1, 256]
    - [79, 36281.2]
  - - [1856, 1856, 1, 128]
    - [20, 3897.18]
  - - [4288, 5888, 1, 256]
    - [79, 35615.1]
  - - [4, 704, 1, 3328]
    - [90, 1097.38]
  - - [35, 8457, 1, 2048]
    - [17, 11360.5]
  - - [448, 2944, 1, 256]
    - [70, 24609.4]
  - - [4, 4288, 1, 3328]
    - [42, 2382.38]
  - - [2944, 6784, 1, 256]
    - [79, 35407.6]
  - - [2944, 2944, 1, 128]
    - [20, 3327.72]
  - - [4, 4, 1, 1280]
    - [49, 5.25128]
  - - [1856, 3584, 1, 1280]
    - [72, 33924.8]
  - - [64, 2944, 1, 256]
    - [71, 8965.52]
  - - [3584, 1408, 1, 1280]
    - [69, 34383.2]
  - - [448, 256, 1, 128]
    - [20, 1747.63]
  - - [4288, 448, 1, 128]
    - [20, 3848.06]
  - - [5056, 256, 1, 1280]
    - [77, 30567.3]
  - - [1856, 1408, 1, 3328]
    - [77, 33181.6]
  - - [128, 128, 1, 128]
    - [20, 211.834]
  - - [1024, 4288, 1, 3328]
    - [69, 33076.0]
  - - [448, 2368, 1, 256]
    - [70, 22669.5]
  - - [1024, 4, 1, 128]
    - [84, 92.9589]
  - - [64, 1408, 1, 1280]
    - [28, 10964.2]
  - - [64, 6784, 1, 1280]
    - [71, 20987.4]
  - - [5056, 448, 1, 256]
    - [77, 29168.1]
  - - [2944, 2368, 1, 3328]
    - [69, 35466.6]
  - - [704, 4288, 1, 3328]
    - [71, 32301.5]
  - - [1408, 128, 1, 256]
    - [70, 9493.28]
  - - [1024, 1856, 1, 1280]
    - [81, 29530.2]
  - - [6784, 1856, 1, 256]
    - [73, 34741.6]
  - - [512, 48000, 1, 2816]
    - [69, 37639.8]
  - - [512, 3000, 1, 2816]
    - [69, 31697.0]
  - - [128, 2368, 1, 3328]
    - [32, 21535.7]
  - - [1024, 5888, 1, 256]
    - [79, 32062.8]
  - - [64, 2944, 1, 1280]
    - [52, 14253.7]
  - - [6784, 1408, 1, 256]
    - [79, 33811.9]
  - - [5056, 64, 1, 3328]
    - [40, 22332.8]
  - - [128, 704, 1, 128]
    - [20, 1406.63]
  - - [1408, 2368, 1, 256]
    - [70, 30903.0]
  - - [1408, 1408, 1, 256]
    - [71, 28543.9]
  - - [4, 64, 1, 128]
    - [84, 5.38947]
  - - [64, 128, 1, 1280]
    - [59, 2097.15]
  - - [1024, 8, 1, 500000]
    - [5, 9951.9]
  - - [4, 2368, 1, 128]
    - [84, 210.489]
  - - [2368, 2368, 1, 128]
    - [20, 2874.22]
  - - [64, 5888, 1, 128]
    - [20, 2948.32]
  - - [5888, 4, 1, 3328]
    - [89, 2721.56]
  - - [6784, 1408, 1, 128]
    - [20, 3416.72]
  - - [1408, 5056, 1, 256]
    - [73, 33512.8]
  - - [512, 50176, 1, 128]
    - [94, 33128.5]
  - - [5056, 128, 1, 3328]
    - [77, 25014.8]
  - - [128, 128, 1, 1280]
    - [59, 3628.29]
  - - [512, 2, 1, 512]
    - [11, 144.035]
  - - [448, 704, 1, 256]
    - [71, 13107.2]
  - - [4288, 3584, 1, 128]
    - [20, 3517.63]
  - - [2944, 128, 1, 3328]
    - [37, 22785.2]
  - - [128, 5056, 1, 1280]
    - [71, 24249.9]
  - - [3584, 5056, 1, 1280]
    - [69, 36809.7]
  - - [256, 448, 1, 1280]
    - [30, 11800.7]
  - - [704, 704, 1, 128]
    - [20, 2683.54]
  - - [5056, 4, 1, 128]
    - [84, 349.821]
  - - [704, 256, 1, 1280]
    - [82, 12578.3]
  - - [64, 2368, 1, 3328]
    - [37, 18694.0]
  - - [1856, 1024, 1, 128]
    - [20, 3894.81]
  - - [1856, 64, 1, 128]
    - [20, 1780.37]
  - - [4096, 64, 1, 4096]
    - [41, 21128.3]
  - - [1024, 24000, 1, 1536]
    - [73, 37209.2]
  - - [704, 4288, 1, 256]
    - [71, 30116.9]
  - - [5888, 2368, 1, 1280]
    - [69, 36940.7]
  - - [6784, 1856, 1, 3328]
    - [69, 36457.9]
  - - [64, 128, 1, 256]
    - [38, 572.992]
  - - [2368, 5888, 1, 1280]
    - [69, 35703.5]
  - - [5888, 256, 1, 1280]
    - [68, 30880.0]
  - - [4, 5888, 1, 1280]
    - [87, 2171.94]
  - - [704, 128, 1, 128]
    - [20, 1410.07]
  - - [1024, 4, 1, 1280]
    - [26, 814.112]
  - - [2368, 1856, 1, 3328]
    - [69, 33936.4]
  - - [2368, 128, 1, 128]
    - [20, 2791.17]
  - - [2944, 704, 1, 256]
    - [73, 29741.0]
  - - [5056, 128, 1, 128]
    - [20, 3428.7]
  - - [2368, 1024, 1, 3328]
    - [69, 32191.8]
  - - [35, 700, 1, 2048]
    - [19, 4348.01]
  - - [256, 704, 1, 3328]
    - [83, 13826.3]
  - - [704, 3584, 1, 256]
    - [71, 29711.3]
  - - [1024, 1024, 1, 1024]
    - [77, 29417.6]
  - - [704, 2944, 1, 3328]
    - [77, 32535.6]
  - - [6784, 1024, 1, 128]
    - [20, 3077.65]
  - - [256, 448, 1, 128]
    - [20, 1760.2]
  - - [448, 1024, 1, 3328]
    - [71, 24326.4]
  - - [2944, 1024, 1, 3328]
    - [69, 33958.8]
  - - [2944, 5056, 1, 128]
    - [20, 3569.78]
  - - [2368, 256, 1, 256]
    - [71, 19545.2]
  - - [1408, 6784, 1, 256]
    - [79, 33755.9]
  - - [6784, 1408, 1, 3328]
    - [69, 36160.4]
  - - [4288, 6784, 1, 128]
    - [20, 3871.22]
  - - [1408, 2944, 1, 128]
    - [20, 4043.44]
  - - [704, 64, 1, 256]
    - [21, 2433.4]
  - - [3072, 4, 1, 1024]
    - [54, 1757.39]
  - - [256, 2368, 1, 3328]
    - [71, 23513.5]
  - - [6784, 2944, 1, 1280]
    - [69, 37058.3]
  - - [4288, 1856, 1, 128]
    - [20, 3180.04]
  - - [1856, 2944, 1, 128]
    - [20, 4081.95]
  - - [6784, 448, 1, 128]
    - [20, 4015.5]
  - - [64, 3584, 1, 128]
    - [20, 2442.63]
  - - [448, 5056, 1, 1280]
    - [71, 31391.4]
  - - [4288, 5056, 1, 1280]
    - [69, 37330.3]
  - - [2368, 1856, 1, 128]
    - [20, 4026.93]
  - - [128, 448, 1, 1280]
    - [43, 8436.82]
  - - [4288, 704, 1, 256]
    - [79, 30425.2]
  - - [256, 3584, 1, 128]
    - [20, 3462.28]
  - - [5888, 704, 1, 256]
    - [79, 32352.4]
  - - [3584, 1024, 1, 128]
    - [20, 4049.68]
  - - [256, 5888, 1, 3328]
    - [69, 31219.8]
  - - [1408, 4288, 1, 3328]
    - [69, 35568.8]
  - - [6784, 4288, 1, 256]
    - [79, 36143.4]
  - - [4288, 256, 1, 128]
    - [20, 3725.06]
  - - [448, 1856, 1, 3328]
    - [74, 25322.0]
  - - [5888, 256, 1, 256]
    - [71, 27251.1]
  - - [1024, 4, 1, 500000]
    - [5, 5090.73]
  - - [6784, 1024, 1, 1280]
    - [69, 34930.6]
  - - [5888, 1024, 1, 128]
    - [20, 4061.85]
  - - [1024, 128, 1, 256]
    - [71, 6428.05]
  - - [512, 16, 1, 500000]
    - [1, 18485.4]
  - - [128, 64, 1, 3328]
    - [66, 4093.54]
  - - [448, 64, 1, 256]
    - [70, 1561.71]
  - - [2368, 256, 1, 128]
    - [20, 3265.77]
  - - [6784, 3584, 1, 1280]
    - [69, 37551.3]
  - - [1024, 6784, 1, 1280]
    - [81, 34199.7]
  - - [2944, 64, 1, 1280]
    - [32, 13354.0]
  - - [1408, 2944, 1, 1280]
    - [69, 35240.4]
  - - [256, 1856, 1, 256]
    - [71, 18946.2]
  - - [1408, 2368, 1, 3328]
    - [77, 32957.2]
  - - [2944, 4, 1, 3328]
    - [91, 2321.71]
  - - [128, 1408, 1, 3328]
    - [40, 19794.9]
  - - [2944, 1856, 1, 128]
    - [20, 4041.84]
  - - [256, 2944, 1, 128]
    - [20, 3331.11]
  - - [3136, 2048, 1, 512]
    - [102, 33837.6]
  - - [256, 6784, 1, 128]
    - [20, 3838.02]
  - - [2368, 4, 1, 128]
    - [84, 134.117]
  - - [1408, 256, 1, 3328]
    - [77, 19248.6]
  - - [1856, 4, 1, 128]
    - [84, 167.893]
  - - [1024, 16, 1, 512]
    - [21, 1754.94]
  - - [5056, 6784, 1, 128]
    - [20, 3921.95]
  - - [4288, 5056, 1, 128]
    - [20, 3611.01]
  - - [1856, 5888, 1, 128]
    - [20, 3409.38]
  - - [7680, 2, 1, 2560]
    - [34, 1994.0]
  - - [3584, 1856, 1, 256]
    - [79, 33155.9]
  - - [4288, 3584, 1, 1280]
    - [69, 36844.5]
  - - [2368, 448, 1, 256]
    - [71, 22898.9]
  - - [4288, 256, 1, 3328]
    - [77, 26557.4]
  - - [1856, 704, 1, 128]
    - [20, 3670.94]
  - - [1408, 64, 1, 256]
    - [70, 4866.81]
  - - [64, 1856, 1, 128]
    - [20, 1818.7]
  - - [4, 256, 1, 128]
    - [84, 23.3224]
  - - [512, 16, 1, 512]
    - [49, 1013.12]
  - - [704, 5888, 1, 128]
    - [20, 3751.8]
  - - [6784, 3584, 1, 128]
    - [20, 3493.45]
  - - [1024, 64, 1, 256]
    - [71, 3423.92]
  - - [64, 2368, 1, 256]
    - [71, 7489.83]
  - - [5124, 1500, 1, 2048]
    - [75, 33418.8]
  - - [4288, 5056, 1, 3328]
    - [69, 37629.1]
  - - [4, 1856, 1, 1280]
    - [87, 1237.33]
  - - [4288, 128, 1, 128]
    - [20, 3231.6]
  - - [512, 2, 1, 500000]
    - [9, 2562.05]
  - - [1408, 1408, 1, 128]
    - [20, 3862.33]
  - - [7680, 16, 1, 2560]
    - [36, 14364.1]
  - - [1856, 128, 1, 128]
    - [20, 2534.06]
  - - [5056, 2368, 1, 256]
    - [73, 33733.1]
  - - [4288, 704, 1, 3328]
    - [69, 33917.7]
  - - [448, 3584, 1, 256]
    - [71, 26015.3]
  - - [2368, 64, 1, 1280]
    - [30, 13661.0]
  - - [2368, 1024, 1, 1280]
    - [69, 31639.0]
  - - [2944, 1408, 1, 3328]
    - [69, 35729.3]
  - - [6144, 1500, 1, 2560]
    - [75, 35936.4]
  - - [4224, 1, 1, 128]
    - [31, 129.969]
  - - [1024, 1408, 1, 3328]
    - [69, 29907.0]
  - - [2944, 5888, 1, 1280]
    - [69, 36792.2]
  - - [8448, 2, 1, 2816]
    - [10, 2088.64]
  - - [1408, 4, 1, 1280]
    - [26, 1024.0]
  - - [5888, 3584, 1, 256]
    - [79, 35503.8]
  - - [2368, 5056, 1, 128]
    - [20, 3414.04]
  - - [1408, 1856, 1, 3328]
    - [69, 34596.6]
  - - [4, 4, 1, 3328]
    - [93, 13.2458]
  - - [5888, 5056, 1, 3328]
    - [69, 38197.2]
  - - [7680, 6000, 1, 2560]
    - [69, 37623.1]
  - - [6784, 1408, 1, 1280]
    - [69, 35797.9]
  - - [4, 1024, 1, 1280]
    - [90, 801.664]
  - - [512, 3000, 1, 2560]
    - [69, 31558.3]
  - - [704, 2944, 1, 256]
    - [71, 29674.5]
  - - [4288, 64, 1, 256]
    - [77, 11116.2]
  - - [6784, 5888, 1, 3328]
    - [69, 38129.4]
  - - [2368, 4288, 1, 128]
    - [20, 3390.32]
  - - [64, 4288, 1, 1280]
    - [56, 15474.6]
  - - [6784, 64, 1, 1280]
    - [71, 21862.5]
  - - [3584, 128, 1, 128]
    - [20, 3237.06]
  - - [1024, 6784, 1, 128]
    - [20, 2970.91]
  - - [1024, 1500, 1, 1536]
    - [69, 31986.1]
  - - [1408, 64, 1, 3328]
    - [28, 16716.4]
  - - [6784, 4, 1, 256]
    - [86, 1781.23]
  - - [1408, 1408, 1, 1280]
    - [75, 31304.6]
  - - [256, 2368, 1, 256]
    - [71, 19496.1]
  - - [3072, 3000, 1, 1024]
    - [79, 35271.3]
  - - [448, 4288, 1, 3328]
    - [71, 30244.9]
  - - [2368, 1408, 1, 256]
    - [76, 30769.3]
  - - [704, 2368, 1, 256]
    - [71, 27010.8]
  - - [1024, 24000, 1, 2560]
    - [79, 37364.6]
  - - [2944, 448, 1, 1280]
    - [69, 27264.3]
  - - [5888, 2368, 1, 3328]
    - [69, 37362.8]
  - - [1024, 256, 1, 128]
    - [20, 2728.0]
  - - [5124, 9124, 1, 1760]
    - [69, 37892.3]
  - - [448, 1408, 1, 1280]
    - [71, 23817.2]
  - - [448, 1856, 1, 1280]
    - [71, 24500.6]
  - - [4288, 448, 1, 1280]
    - [69, 30282.2]
  - - [5888, 704, 1, 3328]
    - [69, 35675.7]
  - - [4, 1856, 1, 128]
    - [84, 100.664]
  - - [5056, 256, 1, 128]
    - [20, 3691.51]
  - - [1856, 256, 1, 128]
    - [20, 3074.69]
  - - [128, 2368, 1, 256]
    - [77, 12086.4]
  - - [704, 4, 1, 256]
    - [87, 409.6]
  - - [1024, 6784, 1, 3328]
    - [81, 34992.8]
  - - [1408, 5888, 1, 128]
    - [20, 3316.54]
  - - [4288, 4, 1, 128]
    - [84, 306.628]
  - - [512, 3136, 1, 2048]
    - [96, 27325.4]
  - - [1408, 1024, 1, 256]
    - [71, 26785.1]
  - - [128, 64, 1, 256]
    - [42, 560.736]
  - - [8448, 1500, 1, 2816]
    - [69, 36872.4]
  - - [256, 704, 1, 128]
    - [20, 2226.71]
  - - [2560, 7000, 1, 2560]
    - [69, 36868.9]
  - - [5888, 64, 1, 1280]
    - [71, 19004.9]
  - - [128, 4, 1, 3328]
    - [93, 364.089]
  - - [5056, 6784, 1, 1280]
    - [69, 37134.3]
  - - [1024, 448, 1, 1280]
    - [77, 21764.4]
  - - [704, 5056, 1, 3328]
    - [77, 32790.1]
  - - [128, 5056, 1, 256]
    - [77, 19865.1]
  - - [3584, 5056, 1, 3328]
    - [69, 37305.4]
  - - [1856, 4, 1, 3328]
    - [23, 1970.26]
  - - [4, 2944, 1, 128]
    - [84, 265.375]
  - - [2368, 2944, 1, 3328]
    - [69, 35369.2]
  - - [448, 448, 1, 1280]
    - [30, 14680.1]
  - - [128, 4, 1, 128]
    - [84, 12.0471]
  - - [2368, 3584, 1, 256]
    - [73, 33099.5]
  - - [4608, 3000, 1, 1536]
    - [69, 36242.4]
  - - [1024, 256, 1, 1280]
    - [82, 14525.7]
  - - [5056, 3584, 1, 1280]
    - [69, 37199.3]
  - - [5124, 9124, 1, 4096]
    - [79, 36753.8]
  - - [7680, 48000, 1, 2560]
    - [75, 38297.8]
  - - [1856, 704, 1, 1280]
    - [77, 30676.4]
  - - [1856, 2944, 1, 1280]
    - [69, 34409.1]
  - - [4608, 1500, 1, 1536]
    - [69, 34827.6]
  - - [1024, 48000, 1, 2816]
    - [81, 37963.3]
  - - [5124, 9124, 1, 2560]
    - [73, 36708.5]
  - - [128, 1024, 1, 256]
    - [71, 6961.5]
  - - [2944, 1408, 1, 256]
    - [79, 32411.7]
  - - [4288, 1408, 1, 3328]
    - [69, 35452.1]
  - - [784, 512, 64, 128]
    - [102, 32551.3]
  - - [3584, 64, 1, 3328]
    - [22, 20025.3]
  - - [5888, 2944, 1, 128]
    - [20, 3657.87]
  - - [2944, 1024, 1, 128]
    - [20, 3904.84]
  - - [128, 1, 1, 1024]
    - [13, 41.7427]
  - - [5124, 700, 1, 2048]
    - [77, 32246.6]
  - - [4, 4288, 1, 1280]
    - [87, 1925.84]
  - - [6784, 5056, 1, 128]
    - [20, 3916.7]
  - - [256, 1024, 1, 3328]
    - [83, 19845.7]
  - - [3584, 4, 1, 256]
    - [87, 1320.15]
  - - [1856, 64, 1, 3328]
    - [35, 17968.8]
  - - [4, 128, 1, 3328]
    - [93, 364.089]
  - - [256, 12544, 1, 1024]
    - [77, 30035.9]
  - - [5888, 1408, 1, 3328]
    - [69, 36946.5]
  - - [448, 2944, 1, 128]
    - [20, 3715.25]
  - - [2368, 1856, 1, 256]
    - [76, 31657.9]
  - - [256, 5056, 1, 256]
    - [71, 26721.8]
  - - [5056, 5056, 1, 128]
    - [20, 3870.27]
  - - [448, 3584, 1, 3328]
    - [77, 28697.9]
  - - [4, 5056, 1, 3328]
    - [42, 2474.47]
  - - [256, 256, 1, 128]
    - [20, 863.025]
  - - [5888, 256, 1, 128]
    - [20, 3677.81]
  - - [4, 5056, 1, 128]
    - [84, 350.769]
  - - [448, 256, 1, 256]
    - [70, 6168.09]
  - - [704, 4, 1, 3328]
    - [91, 1201.49]
  - - [1408, 256, 1, 256]
    - [71, 14883.0]
  - - [3584, 1856, 1, 128]
    - [20, 3041.31]
  - - [4288, 4288, 1, 128]
    - [20, 3371.34]
  - - [1856, 1024, 1, 3328]
    - [81, 30920.1]
  - - [1856, 4288, 1, 128]
    - [20, 3300.16]
  - - [1024, 6000, 1, 2560]
    - [75, 35528.9]
  - - [1024, 5056, 1, 256]
    - [79, 32342.6]
  - - [5056, 5888, 1, 128]
    - [20, 3779.31]
  - - [2368, 1408, 1, 3328]
    - [77, 32978.8]
  - - [1024, 48000, 1, 1536]
    - [75, 37702.8]
  - - [5888, 448, 1, 256]
    - [77, 28517.0]
  - - [5888, 6784, 1, 128]
    - [20, 3783.42]
  - - [2368, 4, 1, 3328]
    - [91, 2170.99]
  - - [6784, 5056, 1, 1280]
    - [69, 37829.9]
  - - [5056, 704, 1, 1280]
    - [69, 34102.3]
  - - [1024, 48000, 1, 2560]
    - [75, 37997.6]
  - - [4608, 32, 1, 1536]
    - [40, 13276.2]
  - - [1024, 2368, 1, 128]
    - [20, 3882.65]
  - - [128, 704, 1, 256]
    - [70, 4826.08]
  - - [2368, 448, 1, 3328]
    - [77, 25650.6]
  - - [128, 5888, 1, 3328]
    - [77, 28809.9]
  - - [448, 128, 1, 1280]
    - [28, 8475.79]
  - - [6784, 4, 1, 3328]
    - [89, 2684.56]
  - - [4288, 4, 1, 1280]
    - [87, 2029.07]
  - - [1024, 64, 1, 3328]
    - [56, 13170.5]
  - - [3072, 48000, 1, 1024]
    - [73, 37715.0]
  - - [256, 4, 1, 128]
    - [84, 23.8313]
  - - [1024, 5888, 1, 128]
    - [20, 3969.92]
  - - [3584, 5888, 1, 128]
    - [20, 3600.94]
  - - [5056, 5888, 1, 256]
    - [79, 35695.8]
  - - [2368, 1024, 1, 256]
    - [70, 28632.7]
  - - [2944, 1856, 1, 256]
    - [76, 32185.9]
  - - [1856, 6784, 1, 1280]
    - [69, 35965.0]
  - - [64, 5056, 1, 128]
    - [20, 2852.53]
  - - [64, 6784, 1, 128]
    - [20, 3094.35]
  - - [448, 704, 1, 128]
    - [20, 2811.29]
  - - [4, 1024, 1, 128]
    - [84, 91.3394]
  - - [1408, 448, 1, 256]
    - [77, 20185.1]
  - - [1408, 704, 1, 128]
    - [20, 3576.03]
  - - [64, 256, 1, 3328]
    - [64, 6399.76]
  - - [8448, 3000, 1, 2816]
    - [69, 37753.2]
  - - [6784, 448, 1, 3328]
    - [69, 34166.2]
  - - [5056, 1856, 1, 1280]
    - [69, 35076.1]
  - - [1408, 1024, 1, 3328]
    - [69, 30415.1]
  - - [2368, 256, 1, 3328]
    - [77, 23447.9]
  - - [7680, 1500, 1, 2560]
    - [69, 36096.1]
  - - [5888, 3584, 1, 1280]
    - [69, 37230.3]
  - - [1856, 3584, 1, 3328]
    - [78, 34136.5]
  - - [5888, 128, 1, 1280]
    - [71, 27945.8]
  - - [1024, 2944, 1, 256]
    - [79, 29501.2]
  - - [448, 6784, 1, 1280]
    - [71, 32118.7]
  - - [256, 3584, 1, 1280]
    - [71, 26985.4]
  - - [448, 128, 1, 128]
    - [20, 1060.7]
  - - [704, 5056, 1, 256]
    - [70, 30659.9]
  - - [3584, 1024, 1, 3328]
    - [69, 35367.5]
  - - [2944, 1856, 1, 1280]
    - [69, 34579.3]
  - - [128, 256, 1, 128]
    - [20, 615.001]
  - - [5056, 256, 1, 256]
    - [76, 26982.9]
  - - [2944, 4288, 1, 3328]
    - [69, 36605.0]
  - - [2368, 3584, 1, 3328]
    - [69, 35674.8]
  - - [2944, 704, 1, 1280]
    - [68, 32415.7]
  - - [128, 4, 1, 256]
    - [87, 88.5622]
  - - [2944, 3584, 1, 1280]
    - [69, 35873.5]
  - - [1856, 5888, 1, 1280]
    - [69, 35414.5]
  - - [256, 256, 1, 1280]
    - [35, 9404.27]
  - - [4608, 24000, 1, 1536]
    - [73, 37947.8]
  - - [4288, 1408, 1, 256]
    - [79, 32497.9]
  - - [3584, 64, 1, 256]
    - [70, 10485.8]
  - - [64, 1856, 1, 3328]
    - [28, 18001.5]
  - - [256, 1408, 1, 128]
    - [20, 2869.24]
  - - [5888, 1408, 1, 128]
    - [20, 3299.63]
  - - [4288, 2368, 1, 1280]
    - [69, 36125.1]
  - - [4, 4288, 1, 256]
    - [87, 1416.42]
  - - [256, 4288, 1, 128]
    - [20, 3462.52]
  - - [256, 128, 1, 3328]
    - [61, 9913.81]
  - - [512, 8, 1, 500000]
    - [8, 9874.64]
  - - [6784, 2368, 1, 256]
    - [79, 35410.0]
  - - [5888, 128, 1, 128]
    - [20, 3485.15]
  - - [1408, 448, 1, 3328]
    - [77, 24444.0]
  - - [1024, 24000, 1, 2816]
    - [79, 37394.1]
  - - [704, 1024, 1, 1280]
    - [77, 27028.3]
  - - [1856, 256, 1, 3328]
    - [77, 25139.2]
  - - [1856, 2944, 1, 256]
    - [76, 32304.9]
  - - [5056, 1024, 1, 128]
    - [20, 4034.95]
  - - [64, 5888, 1, 1280]
    - [71, 18354.1]
  - - [7680, 3000, 1, 2560]
    - [69, 36977.7]
  - - [4224, 1500, 1, 176]
    - [68, 31501.0]
  - - [5124, 700, 1, 2560]
    - [77, 32558.7]
  - - [6784, 256, 1, 128]
    - [20, 3815.62]
  - - [5888, 704, 1, 128]
    - [20, 4047.14]
  - - [6784, 64, 1, 128]
    - [20, 3101.28]
  - - [4, 448, 1, 1280]
    - [92, 427.94]
  - - [1024, 4288, 1, 1280]
    - [79, 32529.1]
  - - [2368, 5056, 1, 3328]
    - [69, 36001.3]
  - - [448, 4, 1, 128]
    - [84, 41.8579]
  - - [4, 256, 1, 3328]
    - [92, 579.57]
  - - [4288, 1024, 1, 3328]
    - [69, 33963.1]
  - - [6144, 48000, 1, 2560]
    - [73, 38069.4]
  - - [1024, 5056, 1, 3328]
    - [81, 35742.9]
  - - [1024, 1856, 1, 3328]
    - [81, 30929.2]
  - - [704, 704, 1, 1280]
    - [71, 25194.1]
  - - [128, 2368, 1, 1280]
    - [32, 15992.3]
  - - [3584, 4, 1, 128]
    - [84, 323.065]
  - - [3584, 256, 1, 1280]
    - [77, 26862.0]
  - - [4, 128, 1, 128]
    - [84, 11.7871]
  - - [128, 4288, 1, 3328]
    - [40, 23382.2]
  - - [5124, 1500, 1, 2560]
    - [69, 33939.6]
  - - [3584, 128, 1, 1280]
    - [71, 22654.4]
  - - [4, 256, 1, 1280]
    - [49, 281.27]
  - - [128, 704, 1, 3328]
    - [28, 16334.0]
  - - [4288, 6784, 1, 256]
    - [79, 35421.4]
  - - [3584, 2944, 1, 3328]
    - [69, 35937.0]
  - - [128, 1856, 1, 256]
    - [71, 11562.2]
  - - [64, 4288, 1, 256]
    - [71, 10331.6]
  - - [4, 3584, 1, 3328]
    - [87, 2223.22]
  - - [64, 4, 1, 3328]
    - [93, 193.629]
  - - [4, 64, 1, 3328]
    - [93, 190.171]
  - - [35, 700, 1, 2560]
    - [18, 6259.48]
  - - [5888, 2944, 1, 256]
    - [79, 35129.6]
  - - [4, 2368, 1, 256]
    - [87, 1045.19]
  - - [1856, 64, 1, 256]
    - [70, 6308.86]
  - - [5056, 128, 1, 1280]
    - [77, 24306.8]
  - - [448, 4288, 1, 1280]
    - [71, 29819.4]
  - - [256, 4288, 1, 256]
    - [71, 22921.6]
  - - [1024, 4288, 1, 128]
    - [20, 4042.27]
  - - [4, 1024, 1, 256]
    - [87, 569.878]
  - - [5056, 4288, 1, 256]
    - [79, 35500.3]
  - - [1024, 448, 1, 256]
    - [70, 16587.6]
  - - [1024, 3584, 1, 256]
    - [79, 31485.4]
  - - [2944, 128, 1, 1280]
    - [71, 19232.3]
  - - [49, 2048, 64, 512]
    - [100, 22675.0]
  - - [2560, 32, 1, 2560]
    - [57, 11689.8]
  - - [64, 256, 1, 256]
    - [71, 1018.03]
  - - [1024, 4, 1, 512]
    - [62, 511.5]
  - - [128, 2368, 1, 128]
    - [20, 2755.49]
  - - [256, 704, 1, 1280]
    - [83, 12578.3]
  - - [64, 2368, 1, 128]
    - [20, 1928.3]
  - - [176, 1500, 1, 1408]
    - [52, 15049.1]
  - - [448, 5888, 1, 1280]
    - [77, 30319.8]
  - - [512, 3000, 1, 2048]
    - [79, 27132.4]
  - - [5056, 448, 1, 128]
    - [20, 3904.27]
  - - [4288, 704, 1, 1280]
    - [69, 33408.3]
  - - [3584, 2944, 1, 128]
    - [20, 3394.92]
  - - [6784, 256, 1, 1280]
    - [77, 30577.5]
  - - [256, 2944, 1, 1280]
    - [71, 28010.7]
  - - [2560, 128, 1, 2560]
    - [32, 18833.9]
  - - [2368, 5888, 1, 3328]
    - [69, 36107.9]
  - - [4, 64, 1, 256]
    - [87, 44.2811]
  - - [704, 1024, 1, 3328]
    - [71, 27884.0]
  - - [2368, 1856, 1, 1280]
    - [69, 33497.7]
  - - [448, 5056, 1, 3328]
    - [71, 31844.4]
  - - [128, 448, 1, 128]
    - [20, 1079.42]
  - - [128, 6784, 1, 256]
    - [71, 22009.7]
  - - [512, 4, 1, 500000]
    - [8, 5075.34]
  - - [3584, 4288, 1, 128]
    - [20, 3331.3]
  - - [64, 448, 1, 128]
    - [20, 538.126]
  - - [1024, 6000, 1, 2816]
    - [81, 35620.3]
  - - [5888, 4288, 1, 3328]
    - [69, 37665.6]
  - - [2368, 704, 1, 256]
    - [71, 26976.6]
  - - [256, 1856, 1, 3328]
    - [77, 25179.2]
  - - [1856, 128, 1, 256]
    - [71, 11878.4]
  - - [6784, 128, 1, 128]
    - [20, 3557.91]
  - - [3584, 1408, 1, 128]
    - [20, 4006.47]
  - - [1856, 5056, 1, 1280]
    - [69, 35069.9]
  - - [2944, 1024, 1, 1280]
    - [69, 33368.7]
  - - [5056, 4, 1, 256]
    - [87, 1628.1]
  - - [3584, 5888, 1, 3328]
    - [69, 37238.8]
  - - [2368, 4288, 1, 256]
    - [73, 33988.2]
  - - [1024, 2368, 1, 3328]
    - [69, 31624.1]
  - - [128, 3584, 1, 128]
    - [20, 3123.42]
  - - [704, 1408, 1, 256]
    - [71, 26214.4]
  - - [4096, 128, 1, 4096]
    - [71, 24492.3]
  - - [1024, 2944, 1, 128]
    - [20, 3946.37]
  - - [1024, 3584, 1, 1280]
    - [79, 34055.5]
  - - [4288, 5888, 1, 3328]
    - [69, 37650.5]
  - - [4288, 4, 1, 3328]
    - [88, 2475.36]
  - - [4608, 16, 1, 1536]
    - [35, 9343.75]
  - - [5888, 64, 1, 128]
    - [20, 2973.77]
  - - [4, 5888, 1, 128]
    - [84, 408.49]
  - - [1024, 2944, 1, 3328]
    - [81, 33453.7]
  - - [2048, 64, 1, 2048]
    - [37, 14233.1]
  - - [6144, 2, 1, 2560]
    - [24, 1785.32]
  - - [256, 6784, 1, 1280]
    - [71, 30426.8]
  - - [1856, 3584, 1, 256]
    - [72, 32497.9]
  - - [128, 448, 1, 3328]
    - [52, 12773.8]
  - - [6784, 1856, 1, 128]
    - [20, 3449.03]
  - - [1024, 1500, 1, 2048]
    - [69, 31698.2]
  - - [5056, 128, 1, 256]
    - [71, 20657.7]
  - - [512, 24000, 1, 2816]
    - [81, 36679.1]
  - - [256, 5888, 1, 1280]
    - [71, 30393.5]
  - - [4, 128, 1, 1280]
    - [49, 157.538]
  - - [4288, 6784, 1, 3328]
    - [69, 37376.1]
  - - [6784, 128, 1, 1280]
    - [77, 25551.5]
  - - [64, 1408, 1, 256]
    - [71, 4805.97]
  - - [2368, 1408, 1, 128]
    - [20, 4020.07]
  - - [1856, 448, 1, 256]
    - [71, 22173.0]
  - - [1408, 1024, 1, 128]
    - [20, 3763.24]
  - - [128, 64, 1, 128]
    - [20, 168.041]
  - - [6784, 3584, 1, 3328]
    - [69, 37817.1]
  - - [1760, 7000, 1, 1760]
    - [69, 36403.2]
  - - [1024, 704, 1, 3328]
    - [77, 26060.6]
  - - [64, 64, 1, 128]
    - [20, 0.0841256]
  - - [2368, 5056, 1, 1280]
    - [69, 35652.7]
  - - [64, 4, 1, 1280]
    - [49, 99.9024]
  - - [1408, 2368, 1, 1280]
    - [77, 32627.7]
  - - [128, 1408, 1, 1280]
    - [32, 14399.9]
  - - [1024, 1, 1, 512]
    - [62, 121.927]
  - - [4, 1408, 1, 128]
    - [84, 125.156]
  - - [704, 4288, 1, 128]
    - [20, 3925.24]
  - - [128, 1856, 1, 3328]
    - [37, 21322.2]
  - - [2944, 2944, 1, 256]
    - [79, 33968.0]
  - - [2944, 4, 1, 1280]
    - [87, 1903.19]
  - - [5888, 4, 1, 256]
    - [87, 1674.81]
  - - [6784, 256, 1, 256]
    - [77, 27649.0]
  - - [256, 5056, 1, 3328]
    - [71, 30887.4]
  - - [128, 4288, 1, 1280]
    - [71, 20602.5]
  - - [5056, 1856, 1, 128]
    - [20, 3341.34]
  - - [1024, 3000, 1, 1536]
    - [69, 33375.2]
  - - [5056, 1024, 1, 3328]
    - [69, 36076.6]
  - - [128, 128, 1, 256]
    - [59, 993.911]
  - - [1760, 64, 1, 1760]
    - [35, 13597.1]
  - - [4288, 3584, 1, 3328]
    - [69, 37160.4]
  - - [448, 704, 1, 3328]
    - [77, 16745.8]
  - - [448, 448, 1, 128]
    - [20, 2261.45]
  - - [1024, 2368, 1, 1280]
    - [69, 30865.0]
  - - [1856, 704, 1, 3328]
    - [77, 31337.9]
  - - [512, 1500, 1, 2560]
    - [77, 29582.9]
  - - [5888, 6784, 1, 3328]
    - [69, 38083.9]
  - - [704, 4288, 1, 1280]
    - [71, 31912.8]
  - - [128, 50176, 1, 512]
    - [77, 31269.8]
  - - [704, 256, 1, 256]
    - [70, 9454.37]
  - - [1024, 48000, 1, 2048]
    - [73, 37641.3]
  - - [4288, 1024, 1, 128]
    - [20, 4082.2]
  - - [784, 128, 64, 128]
    - [116, 33858.5]
  - - [3025, 64, 64, 16]
    - [115, 13882.8]
  - - [3025, 256, 64, 16]
    - [114, 8698.83]
  - - [12544, 256, 1, 256]
    - [111, 34425.6]
  - - [50176, 63, 1, 196]
    - [106, 23702.1]
  - - [196, 256, 1, 576]
    - [104, 3603.66]
  - - [3136, 2048, 1, 128]
    - [109, 36056.3]
  - - [784, 512, 64, 32]
    - [112, 22315.0]
  - - [12544, 256, 1, 128]
    - [107, 31765.2]
  - - [50176, 128, 1, 64]
    - [110, 28624.1]
  - - [3025, 64, 64, 64]
    - [113, 26646.0]
  - - [50176, 512, 1, 64]
    - [108, 33816.7]
  - - [784, 128, 1, 128]
    - [105, 2880.06]
- null
