library/src/blas3/Tensile/Logic/asm_vega20/vega20_Cijk_Alik_Bljk_4xi8BH.yaml
- {MinimumRequiredVersion: 4.6.0}
- vega20
- gfx906
- [Device 66a0, Device 66a1, Device 66a7, Device 66af, Vega 20]
    SolutionIndex: 0
    SolutionNameMin: Cijk_Alik_Bljk_4xi8BH_MT128x016x32_GRVW04_GSU16_SNLL0_TT04_04_VW04_WG32_04_02
    SolutionIndex: 1
    SolutionNameMin: Cijk_Alik_Bljk_4xi8BH_MT128x008x32_GRVW04_GSU16_SNLL0_TT04_04_VW04_WG32_02_04
    SolutionIndex: 2
    SolutionNameMin: Cijk_Alik_Bljk_4xi8BH_MT064x008x32_GRVW04_GSU16_SNLL0_TT04_04_VW04_WG16_02_08
    SolutionIndex: 3
    SolutionNameMin: Cijk_Alik_Bljk_4xi8BH_MT128x016x32_GRVW04_GSU32_SNLL0_TT04_04_VW04_WG32_04_02
    SolutionIndex: 4
    SolutionNameMin: Cijk_Alik_Bljk_4xi8BH_MT036x048x16_GRVW01_GSU04_SNLL0_TT03_03_VW01_WG12_16_01
    SolutionIndex: 5
    SolutionNameMin: Cijk_Alik_Bljk_4xi8BH_MT036x048x16_GRVW01_GSU08_SNLL0_TT03_03_VW01_WG12_16_01
    SolutionIndex: 6
    SolutionNameMin: Cijk_Alik_Bljk_4xi8BH_MT016x016x08_GRVW02_GSU01_SNLL0_TT02_02_VW02_WG08_08_01
    SolutionIndex: 7
    SolutionNameMin: Cijk_Alik_Bljk_4xi8BH_MT032x016x08_GRVW02_GSU01_SNLL0_TT04_02_VW02_WG08_08_01
    SolutionIndex: 8
    SolutionNameMin: Cijk_Alik_Bljk_4xi8BH_MT032x032x08_GRVW04_GSU01_SNLL0_TT04_04_VW04_WG08_08_01
    SolutionIndex: 9
    SolutionNameMin: Cijk_Alik_Bljk_4xi8BH_MT032x016x08_GRVW02_GSU01_SNLL0_TT02_02_VW02_WG16_08_01
    SolutionIndex: 10
    SolutionNameMin: Cijk_Alik_Bljk_4xi8BH_MT032x016x08_GRVW02_GSU01_SNLL0_TT02_02_VW02_WG16_08_01
    SolutionIndex: 11
    SolutionNameMin: Cijk_Alik_Bljk_4xi8BH_MT016x016x16_GRVW02_GSU01_SNLL0_TT02_02_VW02_WG08_08_01
    SolutionIndex: 12
    SolutionNameMin: Cijk_Alik_Bljk_4xi8BH_MT032x016x16_GRVW02_GSU01_SNLL0_TT02_02_VW02_WG16_08_01
    SolutionIndex: 13
    SolutionNameMin: Cijk_Alik_Bljk_4xi8BH_MT128x016x16_GRVW04_GSU02_SNLL0_TT04_04_VW04_WG32_04_02
    SolutionIndex: 14
    SolutionNameMin: Cijk_Alik_Bljk_4xi8BH_MT064x016x16_GRVW04_GSU02_SNLL0_TT04_04_VW04_WG16_04_04
    SolutionIndex: 15
    SolutionNameMin: Cijk_Alik_Bljk_4xi8BH_MT032x032x16_GRVW04_GSU02_SNLL0_TT04_04_VW04_WG08_08_02
    SolutionIndex: 16
    SolutionNameMin: Cijk_Alik_Bljk_4xi8BH_MT064x032x16_GRVW04_GSU02_SNLL0_TT08_04_VW04_WG08_08_02
    SolutionIndex: 17
    SolutionNameMin: Cijk_Alik_Bljk_4xi8BH_MT032x016x16_GRVW02_GSU02_SNLL0_TT04_02_VW02_WG08_08_04
    SolutionIndex: 18
    SolutionNameMin: Cijk_Alik_Bljk_4xi8BH_MT032x032x16_GRVW04_GSU02_SNLL0_TT04_04_VW04_WG08_08_04
    SolutionIndex: 19
    SolutionNameMin: Cijk_Alik_Bljk_4xi8BH_MT032x016x16_GRVW02_GSU02_SNLL0_TT02_02_VW02_WG16_08_02
    SolutionIndex: 20
    SolutionNameMin: Cijk_Alik_Bljk_4xi8BH_MT064x032x16_GRVW04_GSU02_SNLL0_TT04_04_VW04_WG16_08_02
    SolutionIndex: 21
    SolutionNameMin: Cijk_Alik_Bljk_4xi8BH_MT128x032x16_GRVW04_GSU02_SNLL0_TT08_04_VW04_WG16_08_02
    SolutionIndex: 22
    SolutionNameMin: Cijk_Alik_Bljk_4xi8BH_MT128x016x16_GRVW04_GSU02_SNLL0_TT04_04_VW04_WG32_04_02
    SolutionIndex: 23
    SolutionNameMin: Cijk_Alik_Bljk_4xi8BH_MT064x016x16_GRVW04_GSU02_SNLL0_TT04_04_VW04_WG16_04_04
    SolutionIndex: 24
    SolutionNameMin: Cijk_Alik_Bljk_4xi8BH_MT032x032x16_GRVW04_GSU02_SNLL0_TT04_04_VW04_WG08_08_02
    SolutionIndex: 25
    SolutionNameMin: Cijk_Alik_Bljk_4xi8BH_MT064x032x16_GRVW04_GSU02_SNLL0_TT08_04_VW04_WG08_08_02
    SolutionIndex: 26
    SolutionNameMin: Cijk_Alik_Bljk_4xi8BH_MT016x016x16_GRVW02_GSU02_SNLL0_TT02_02_VW02_WG08_08_04
    SolutionIndex: 27
    SolutionNameMin: Cijk_Alik_Bljk_4xi8BH_MT032x016x16_GRVW02_GSU02_SNLL0_TT04_02_VW02_WG08_08_04
    SolutionIndex: 28
    SolutionNameMin: Cijk_Alik_Bljk_4xi8BH_MT032x032x16_GRVW04_GSU02_SNLL0_TT04_04_VW04_WG08_08_04
    SolutionIndex: 29
    SolutionNameMin: Cijk_Alik_Bljk_4xi8BH_MT064x032x16_GRVW04_GSU02_SNLL0_TT08_04_VW04_WG08_08_04
    SolutionIndex: 30
    SolutionNameMin: Cijk_Alik_Bljk_4xi8BH_MT064x032x16_GRVW04_GSU02_SNLL0_TT04_04_VW04_WG16_08_02
    SolutionIndex: 31
    SolutionNameMin: Cijk_Alik_Bljk_4xi8BH_MT128x032x16_GRVW04_GSU02_SNLL0_TT08_04_VW04_WG16_08_02
    SolutionIndex: 32
    SolutionNameMin: Cijk_Alik_Bljk_4xi8BH_MT032x032x16_GRVW04_GSU04_SNLL0_TT04_04_VW04_WG08_08_02
    SolutionIndex: 33
    SolutionNameMin: Cijk_Alik_Bljk_4xi8BH_MT016x016x16_GRVW02_GSU04_SNLL0_TT02_02_VW02_WG08_08_04
    SolutionIndex: 34
    SolutionNameMin: Cijk_Alik_Bljk_4xi8BH_MT032x016x16_GRVW02_GSU04_SNLL0_TT04_02_VW02_WG08_08_04
    SolutionIndex: 35
    SolutionNameMin: Cijk_Alik_Bljk_4xi8BH_MT032x032x16_GRVW04_GSU04_SNLL0_TT04_04_VW04_WG08_08_04
    SolutionIndex: 36
    SolutionNameMin: Cijk_Alik_Bljk_4xi8BH_MT032x016x16_GRVW02_GSU04_SNLL0_TT02_02_VW02_WG16_08_02
    SolutionIndex: 37
    SolutionNameMin: Cijk_Alik_Bljk_4xi8BH_MT064x032x16_GRVW04_GSU04_SNLL0_TT04_04_VW04_WG16_08_02
    SolutionIndex: 38
    SolutionNameMin: Cijk_Alik_Bljk_4xi8BH_MT032x032x16_GRVW04_GSU04_SNLL0_TT04_04_VW04_WG08_08_02
    SolutionIndex: 39
    SolutionNameMin: Cijk_Alik_Bljk_4xi8BH_MT016x016x16_GRVW02_GSU04_SNLL0_TT02_02_VW02_WG08_08_04
    SolutionIndex: 40
    SolutionNameMin: Cijk_Alik_Bljk_4xi8BH_MT032x016x16_GRVW02_GSU04_SNLL0_TT04_02_VW02_WG08_08_04
    SolutionIndex: 41
    SolutionNameMin: Cijk_Alik_Bljk_4xi8BH_MT064x032x16_GRVW04_GSU04_SNLL0_TT04_04_VW04_WG16_08_02
    SolutionIndex: 42
    SolutionNameMin: Cijk_Alik_Bljk_4xi8BH_MT128x032x16_GRVW04_GSU04_SNLL0_TT08_04_VW04_WG16_08_02
    SolutionIndex: 43
    SolutionNameMin: Cijk_Alik_Bljk_4xi8BH_MT016x016x16_GRVW02_GSU08_SNLL0_TT02_02_VW02_WG08_08_04
    SolutionIndex: 44
    SolutionNameMin: Cijk_Alik_Bljk_4xi8BH_MT032x016x16_GRVW02_GSU08_SNLL0_TT04_02_VW02_WG08_08_04
    SolutionIndex: 45
    SolutionNameMin: Cijk_Alik_Bljk_4xi8BH_MT016x016x16_GRVW02_GSU08_SNLL0_TT02_02_VW02_WG08_08_04
    SolutionIndex: 46
    SolutionNameMin: Cijk_Alik_Bljk_4xi8BH_MT032x008x32_GRVW02_GSU02_SNLL0_TT02_02_VW02_WG16_04_04
    SolutionIndex: 47
    SolutionNameMin: Cijk_Alik_Bljk_4xi8BH_MT064x016x32_GRVW04_GSU02_SNLL0_TT04_04_VW04_WG16_04_04
    SolutionIndex: 48
    SolutionNameMin: Cijk_Alik_Bljk_4xi8BH_MT016x016x32_GRVW02_GSU02_SNLL0_TT02_02_VW02_WG08_08_04
    SolutionIndex: 49
    SolutionNameMin: Cijk_Alik_Bljk_4xi8BH_MT032x032x32_GRVW04_GSU02_SNLL0_TT04_04_VW04_WG08_08_04
    SolutionIndex: 50
    SolutionNameMin: Cijk_Alik_Bljk_4xi8BH_MT032x008x32_GRVW02_GSU02_SNLL0_TT02_02_VW02_WG16_04_04
    SolutionIndex: 51
    SolutionNameMin: Cijk_Alik_Bljk_4xi8BH_MT032x032x32_GRVW04_GSU02_SNLL0_TT04_04_VW04_WG08_08_02
    SolutionIndex: 52
    SolutionNameMin: Cijk_Alik_Bljk_4xi8BH_MT032x032x32_GRVW04_GSU02_SNLL0_TT04_04_VW04_WG08_08_04
    SolutionIndex: 53
    SolutionNameMin: Cijk_Alik_Bljk_4xi8BH_MT032x032x32_GRVW04_GSU04_SNLL0_TT04_04_VW04_WG08_08_04
    SolutionIndex: 54
    SolutionNameMin: Cijk_Alik_Bljk_4xi8BH_MT032x008x32_GRVW02_GSU04_SNLL0_TT02_02_VW02_WG16_04_04
    SolutionIndex: 55
    SolutionNameMin: Cijk_Alik_Bljk_4xi8BH_MT032x032x32_GRVW04_GSU04_SNLL0_TT04_04_VW04_WG08_08_04
    SolutionIndex: 56
    SolutionNameMin: Cijk_Alik_Bljk_4xi8BH_MT064x064x16_GRVW04_GSU01_SNLL0_TT04_04_VW04_WG16_16_01
    SolutionIndex: 57
    SolutionNameMin: Cijk_Alik_Bljk_4xi8BH_MT064x064x16_GRVW04_GSU01_SNLL0_TT04_04_VW04_WG16_16_01
    SolutionIndex: 58
    SolutionNameMin: Cijk_Alik_Bljk_4xi8BH_MT064x064x08_GRVW04_GSU01_SNLL1_TT04_04_VW04_WG16_16_01
    SolutionIndex: 59
    SolutionNameMin: Cijk_Alik_Bljk_4xi8BH_MT064x128x08_GRVW04_GSU01_SNLL1_TT04_08_VW04_WG16_16_01
    SolutionIndex: 60
    SolutionNameMin: Cijk_Alik_Bljk_4xi8BH_MT128x064x08_GRVW04_GSU01_SNLL1_TT08_04_VW04_WG16_16_01
    SolutionIndex: 61
    SolutionNameMin: Cijk_Alik_Bljk_4xi8BH_MT064x064x08_GRVW04_GSU01_SNLL1_TT04_04_VW04_WG16_16_01
    SolutionIndex: 62
    SolutionNameMin: Cijk_Alik_Bljk_4xi8BH_MT064x128x08_GRVW04_GSU01_SNLL1_TT04_08_VW04_WG16_16_01
    SolutionIndex: 63
    SolutionNameMin: Cijk_Alik_Bljk_4xi8BH_MT128x064x08_GRVW04_GSU01_SNLL1_TT08_04_VW04_WG16_16_01
    SolutionIndex: 64
    SolutionNameMin: Cijk_Alik_Bljk_4xi8BH_MT064x064x16_GRVW04_GSU01_SNLL1_TT04_04_VW04_WG16_16_01
    SolutionIndex: 65
    SolutionNameMin: Cijk_Alik_Bljk_4xi8BH_MT064x128x16_GRVW04_GSU01_SNLL1_TT04_08_VW04_WG16_16_01
    SolutionIndex: 66
    SolutionNameMin: Cijk_Alik_Bljk_4xi8BH_MT128x064x16_GRVW04_GSU01_SNLL1_TT08_04_VW04_WG16_16_01
    SolutionIndex: 67
    SolutionNameMin: Cijk_Alik_Bljk_4xi8BH_MT128x096x16_GRVW02_GSU01_SNLL1_TT08_06_VW02_WG16_16_01
    SolutionIndex: 68
    SolutionNameMin: Cijk_Alik_Bljk_4xi8BH_MT128x128x16_GRVW04_GSU01_SNLL1_TT08_08_VW04_WG16_16_01
    SolutionIndex: 69
    SolutionNameMin: Cijk_Alik_Bljk_4xi8BH_MT064x064x16_GRVW04_GSU01_SNLL1_TT04_04_VW04_WG16_16_01
    SolutionIndex: 70
    SolutionNameMin: Cijk_Alik_Bljk_4xi8BH_MT064x128x16_GRVW04_GSU01_SNLL1_TT04_08_VW04_WG16_16_01
    SolutionIndex: 71
    SolutionNameMin: Cijk_Alik_Bljk_4xi8BH_MT128x064x16_GRVW04_GSU01_SNLL1_TT08_04_VW04_WG16_16_01
    SolutionIndex: 72
    SolutionNameMin: Cijk_Alik_Bljk_4xi8BH_MT128x128x16_GRVW04_GSU01_SNLL1_TT08_08_VW04_WG16_16_01
    SolutionIndex: 73
    SolutionNameMin: Cijk_Alik_Bljk_4xi8BH_MT064x064x32_GRVW04_GSU01_SNLL1_TT04_04_VW04_WG16_16_01
    SolutionIndex: 74
    SolutionNameMin: Cijk_Alik_Bljk_4xi8BH_MT016x016x04_GRVW02_GSU01_SNLL0_TT02_02_VW02_WG08_08_01
    SolutionIndex: 75
    SolutionNameMin: Cijk_Alik_Bljk_4xi8BH_MT032x032x02_GRVW04_GSU01_SNLL0_TT04_04_VW04_WG08_08_01
    SolutionIndex: 76
    SolutionNameMin: Cijk_Alik_Bljk_4xi8BH_MT008x008x08_GRVW02_GSU01_SNLL1_TT02_02_VW02_WG04_04_04
    SolutionIndex: 77
    SolutionNameMin: Cijk_Alik_Bljk_4xi8BH_MT016x016x16_GRVW02_GSU01_SNLL1_TT02_02_VW02_WG08_08_04
    SolutionIndex: 78
    SolutionNameMin: Cijk_Alik_Bljk_4xi8BH_MT008x008x08_GRVW02_GSU04_SNLL0_TT02_02_VW02_WG04_04_04
    SolutionIndex: 79
    SolutionNameMin: Cijk_Alik_Bljk_4xi8BH_MT008x008x08_GRVW02_GSU08_SNLL0_TT02_02_VW02_WG04_04_04
    SolutionIndex: 80
    SolutionNameMin: Cijk_Alik_Bljk_4xi8BH_MT008x008x08_GRVW02_GSU16_SNLL0_TT02_02_VW02_WG04_04_04
    SolutionIndex: 81
    SolutionNameMin: Cijk_Alik_Bljk_4xi8BH_MT016x016x16_GRVW02_GSU16_SNLL0_TT02_02_VW02_WG08_08_04
    SolutionIndex: 82
    SolutionNameMin: Cijk_Alik_Bljk_4xi8BH_MT064x128x08_GRVW04_NLCA01_NLCB01_TT04_08_VW04_WGM08
    SolutionIndex: 83
    SolutionNameMin: Cijk_Alik_Bljk_4xi8BH_MT064x032x08_GRVW04_GSU01_NLCA01_NLCB01_SNLL1_TT04_04_VW04_WG16_08_02_WGM01
    SolutionIndex: 84
    SolutionNameMin: Cijk_Alik_Bljk_4xi8BH_MT064x064x08_GRVW04_GSU01_NLCA01_NLCB01_SNLL1_TT04_04_VW04_WG16_16_01_WGM01
    SolutionIndex: 85
    SolutionNameMin: Cijk_Alik_Bljk_4xi8BH_MT128x064x08_GRVW04_GSU01_NLCA01_NLCB01_SNLL1_TT08_04_VW04_WG16_16_01_WGM01
    SolutionIndex: 86
    SolutionNameMin: Cijk_Alik_Bljk_4xi8BH_MT064x016x16_GRVW04_GSU01_NLCA01_NLCB01_SNLL1_TT04_04_VW04_WG16_04_04_WGM01
    SolutionIndex: 87
    SolutionNameMin: Cijk_Alik_Bljk_4xi8BH_MT032x032x32_GRVW04_GSU01_NLCA01_NLCB01_SNLL1_TT04_08_VW04_WG08_04_08_WGM01
    SolutionIndex: 88
    SolutionNameMin: Cijk_Alik_Bljk_4xi8BH_MT032x032x32_GRVW04_GSU04_NLCA01_NLCB01_SNLL0_TT04_08_VW04_WG08_04_08_WGM08
    SolutionIndex: 89
    SolutionNameMin: Cijk_Alik_Bljk_4xi8BH_MT032x064x08_GRVW04_GSU01_NLCA01_NLCB01_SNLL1_TT04_04_VW04_WG08_16_02_WGM01
    SolutionIndex: 90
    SolutionNameMin: Cijk_Alik_Bljk_4xi8BH_MT128x064x08_GRVW04_GSU01_NLCA01_NLCB01_SNLL1_TT08_04_VW04_WG16_16_01_WGM08
    SolutionIndex: 91
    SolutionNameMin: Cijk_Alik_Bljk_4xi8BH_MT032x016x16_GRVW04_GSU01_NLCA01_NLCB01_SNLL1_TT04_04_VW04_WG08_04_08_WGM08
    SolutionIndex: 92
    SolutionNameMin: Cijk_Alik_Bljk_4xi8BH_MT032x008x32_GRVW04_GSU01_NLCA01_NLCB01_SNLL1_TT04_04_VW04_WG08_02_16_WGM01
- - - [1024, 128, 1, 128]
    - [9, 2452.81]
  - - [4, 704, 1, 1280]
    - [79, 630.154]
  - - [4, 1856, 1, 3328]
    - [43, 1623.33]
  - - [1856, 448, 1, 3328]
    - [70, 24226.9]
  - - [2944, 4288, 1, 1280]
    - [72, 34098.4]
  - - [2368, 64, 1, 3328]
    - [24, 16778.6]
  - - [1760, 32, 1, 1760]
    - [55, 8725.63]
  - - [2368, 5888, 1, 256]
    - [62, 32620.7]
  - - [5888, 1856, 1, 256]
    - [63, 31547.1]
  - - [128, 64, 1, 256]
    - [48, 563.751]
  - - [512, 24000, 1, 1536]
    - [72, 35543.6]
  - - [128, 6784, 1, 3328]
    - [65, 24645.0]
  - - [5888, 1408, 1, 256]
    - [72, 31981.9]
  - - [5888, 1856, 1, 3328]
    - [72, 34953.2]
  - - [5056, 704, 1, 256]
    - [63, 28781.2]
  - - [2048, 400, 1, 512]
    - [70, 20722.8]
  - - [5888, 2944, 1, 3328]
    - [72, 36275.2]
  - - [1856, 4288, 1, 256]
    - [59, 30683.5]
  - - [1024, 5056, 1, 128]
    - [56, 5482.3]
  - - [5056, 5056, 1, 3328]
    - [72, 36559.6]
  - - [1408, 5888, 1, 1280]
    - [68, 35521.2]
  - - [2368, 448, 1, 128]
    - [56, 4015.1]
  - - [2368, 6784, 1, 128]
    - [56, 5736.37]
  - - [1024, 3584, 1, 3328]
    - [60, 32050.5]
  - - [512, 48000, 1, 2048]
    - [68, 34130.6]
  - - [128, 448, 1, 1280]
    - [49, 7791.97]
  - - [256, 4288, 1, 3328]
    - [64, 24610.9]
  - - [5888, 1408, 1, 1280]
    - [72, 35693.2]
  - - [704, 1856, 1, 3328]
    - [69, 29102.2]
  - - [4, 1408, 1, 128]
    - [74, 128.734]
  - - [1024, 2368, 1, 256]
    - [63, 25994.8]
  - - [64, 4, 1, 256]
    - [77, 36.818]
  - - [1408, 1856, 1, 1280]
    - [63, 31290.5]
  - - [1408, 64, 1, 1280]
    - [14, 9660.25]
  - - [448, 1024, 1, 1280]
    - [69, 22175.3]
  - - [6144, 24000, 1, 2048]
    - [68, 36489.6]
  - - [4096, 32, 1, 4096]
    - [42, 15114.6]
  - - [256, 1408, 1, 3328]
    - [69, 18027.8]
  - - [5056, 5056, 1, 1280]
    - [72, 36294.4]
  - - [448, 5056, 1, 256]
    - [69, 27377.8]
  - - [704, 1856, 1, 1280]
    - [64, 28589.4]
  - - [128, 5056, 1, 128]
    - [7, 4096.81]
  - - [2368, 128, 1, 256]
    - [64, 12200.4]
  - - [1760, 6400, 1, 1760]
    - [63, 36202.8]
  - - [1856, 1408, 1, 128]
    - [56, 5343.38]
  - - [64, 5056, 1, 256]
    - [64, 10786.1]
  - - [6784, 256, 1, 3328]
    - [69, 28732.1]
  - - [6784, 4288, 1, 3328]
    - [72, 36192.9]
  - - [4288, 448, 1, 256]
    - [69, 25801.8]
  - - [64, 704, 1, 128]
    - [6, 958.001]
  - - [1856, 2368, 1, 3328]
    - [69, 31066.2]
  - - [4288, 2944, 1, 1280]
    - [72, 34141.6]
  - - [704, 5056, 1, 1280]
    - [59, 30913.7]
  - - [2368, 704, 1, 3328]
    - [69, 27541.8]
  - - [256, 5888, 1, 256]
    - [62, 25220.7]
  - - [1856, 4288, 1, 3328]
    - [72, 34578.8]
  - - [256, 2944, 1, 256]
    - [64, 21875.1]
  - - [5888, 1024, 1, 256]
    - [62, 30395.9]
  - - [448, 64, 1, 1280]
    - [34, 4841.71]
  - - [3072, 64, 1, 1024]
    - [24, 9946.97]
  - - [3584, 4, 1, 1280]
    - [77, 1761.04]
  - - [16384, 3200, 1, 4096]
    - [68, 36942.8]
  - - [2944, 64, 1, 256]
    - [64, 9275.86]
  - - [128, 4, 1, 1280]
    - [43, 159.068]
  - - [1408, 2944, 1, 256]
    - [59, 30301.5]
  - - [256, 1856, 1, 1280]
    - [69, 22761.0]
  - - [6784, 5056, 1, 3328]
    - [72, 36460.4]
  - - [5056, 5056, 1, 256]
    - [68, 33392.0]
  - - [1408, 6784, 1, 128]
    - [56, 5658.8]
  - - [64, 1024, 1, 1280]
    - [49, 8507.72]
  - - [2944, 4, 1, 256]
    - [77, 1150.63]
  - - [704, 5056, 1, 128]
    - [56, 4073.73]
  - - [4, 2368, 1, 1280]
    - [77, 1390.39]
  - - [2368, 2944, 1, 1280]
    - [68, 34108.2]
  - - [128, 3584, 1, 1280]
    - [64, 21716.1]
  - - [6784, 6784, 1, 1280]
    - [72, 37456.8]
  - - [1024, 256, 1, 3328]
    - [73, 17921.4]
  - - [1408, 4288, 1, 1280]
    - [68, 34077.1]
  - - [3584, 4288, 1, 1280]
    - [72, 35930.6]
  - - [2368, 704, 1, 1280]
    - [69, 27106.9]
  - - [5056, 4288, 1, 3328]
    - [72, 35419.8]
  - - [3584, 2368, 1, 3328]
    - [72, 33247.5]
  - - [64, 704, 1, 1280]
    - [18, 6241.52]
  - - [4288, 256, 1, 256]
    - [69, 21750.6]
  - - [2944, 128, 1, 128]
    - [12, 3272.35]
  - - [6144, 32, 1, 2560]
    - [15, 15354.4]
  - - [6784, 448, 1, 1280]
    - [63, 31322.2]
  - - [1408, 2944, 1, 128]
    - [56, 5499.37]
  - - [4288, 2944, 1, 256]
    - [62, 31971.8]
  - - [5888, 704, 1, 1280]
    - [63, 31790.3]
  - - [5056, 4, 1, 3328]
    - [77, 2103.3]
  - - [1856, 64, 1, 1280]
    - [15, 11380.5]
  - - [1760, 16, 1, 1760]
    - [44, 5956.92]
  - - [448, 5888, 1, 128]
    - [56, 4953.66]
  - - [5888, 64, 1, 3328]
    - [20, 20091.3]
  - - [2944, 256, 1, 3328]
    - [69, 26842.8]
  - - [1024, 64, 1, 128]
    - [6, 1357.38]
  - - [5056, 2368, 1, 1280]
    - [72, 34918.3]
  - - [448, 3584, 1, 1280]
    - [69, 26315.1]
  - - [6784, 5888, 1, 256]
    - [72, 33875.7]
  - - [704, 1024, 1, 128]
    - [56, 4018.93]
  - - [704, 128, 1, 1280]
    - [14, 9909.22]
  - - [4, 3584, 1, 128]
    - [74, 324.214]
  - - [1408, 448, 1, 1280]
    - [69, 22084.3]
  - - [1024, 1408, 1, 256]
    - [63, 24541.1]
  - - [2368, 2368, 1, 3328]
    - [72, 32249.5]
  - - [1856, 6784, 1, 128]
    - [56, 5681.27]
  - - [5056, 704, 1, 3328]
    - [63, 31538.2]
  - - [1408, 1856, 1, 256]
    - [64, 28565.0]
  - - [1408, 704, 1, 3328]
    - [71, 28472.5]
  - - [2368, 5056, 1, 256]
    - [68, 31637.0]
  - - [1408, 256, 1, 1280]
    - [69, 17371.0]
  - - [3072, 128, 1, 1024]
    - [31, 11597.2]
  - - [3584, 2368, 1, 1280]
    - [72, 32587.1]
  - - [4288, 64, 1, 3328]
    - [41, 17536.7]
  - - [2368, 4, 1, 1280]
    - [77, 1400.02]
  - - [704, 5888, 1, 256]
    - [59, 30336.2]
  - - [6784, 2944, 1, 128]
    - [56, 5740.4]
  - - [2560, 1600, 1, 2560]
    - [66, 31140.9]
  - - [4288, 6784, 1, 3328]
    - [72, 36181.5]
  - - [2944, 256, 1, 256]
    - [64, 22176.8]
  - - [2944, 6784, 1, 3328]
    - [72, 35876.6]
  - - [704, 1408, 1, 3328]
    - [65, 28359.9]
  - - [6144, 5984, 1, 2048]
    - [68, 35595.0]
  - - [3584, 704, 1, 3328]
    - [71, 30281.3]
  - - [2944, 256, 1, 128]
    - [56, 4150.99]
  - - [6784, 4, 1, 1280]
    - [77, 2010.07]
  - - [1024, 64, 1, 1280]
    - [28, 7557.3]
  - - [2048, 1600, 1, 512]
    - [69, 28064.9]
  - - [448, 4288, 1, 256]
    - [64, 25720.8]
  - - [64, 3584, 1, 3328]
    - [25, 19424.0]
  - - [1856, 4288, 1, 128]
    - [56, 5608.3]
  - - [704, 2368, 1, 1280]
    - [69, 27134.4]
  - - [1856, 2368, 1, 1280]
    - [69, 30815.1]
  - - [2368, 128, 1, 3328]
    - [30, 19025.5]
  - - [2944, 128, 1, 256]
    - [64, 14795.9]
  - - [448, 1408, 1, 256]
    - [64, 19042.5]
  - - [1856, 4288, 1, 1280]
    - [72, 34253.2]
  - - [64, 5056, 1, 3328]
    - [20, 19737.7]
  - - [4, 704, 1, 256]
    - [77, 414.308]
  - - [1024, 448, 1, 128]
    - [56, 3417.94]
  - - [704, 4, 1, 1280]
    - [79, 636.834]
  - - [704, 256, 1, 128]
    - [56, 1604.22]
  - - [704, 2944, 1, 128]
    - [56, 5199.72]
  - - [1408, 1024, 1, 1280]
    - [63, 28098.3]
  - - [704, 6784, 1, 256]
    - [64, 28768.0]
  - - [6784, 704, 1, 256]
    - [69, 28673.5]
  - - [5056, 1408, 1, 128]
    - [56, 5519.16]
  - - [2048, 7000, 1, 2048]
    - [68, 34929.3]
  - - [256, 3584, 1, 3328]
    - [65, 26169.5]
  - - [4, 5888, 1, 3328]
    - [33, 2231.81]
  - - [128, 1408, 1, 128]
    - [6, 2496.61]
  - - [3584, 4288, 1, 3328]
    - [72, 36307.3]
  - - [5888, 1856, 1, 1280]
    - [68, 34524.6]
  - - [256, 1408, 1, 256]
    - [61, 14109.3]
  - - [5056, 64, 1, 1280]
    - [69, 15454.8]
  - - [1024, 704, 1, 256]
    - [64, 20235.7]
  - - [448, 128, 1, 128]
    - [6, 1187.71]
  - - [2368, 3584, 1, 1280]
    - [72, 32777.9]
  - - [2368, 6784, 1, 1280]
    - [72, 35417.3]
  - - [1024, 256, 1, 256]
    - [69, 12336.2]
  - - [1856, 4, 1, 1280]
    - [79, 1193.81]
  - - [448, 448, 1, 256]
    - [64, 10317.3]
  - - [2944, 3584, 1, 3328]
    - [72, 34102.6]
  - - [7680, 32, 1, 2560]
    - [31, 17115.0]
  - - [128, 4288, 1, 128]
    - [7, 3512.73]
  - - [256, 256, 1, 3328]
    - [18, 12784.5]
  - - [128, 1024, 1, 3328]
    - [15, 17936.2]
  - - [4, 1408, 1, 3328]
    - [79, 1533.82]
  - - [6784, 2944, 1, 256]
    - [72, 32520.4]
  - - [64, 1856, 1, 1280]
    - [15, 11804.6]
  - - [6784, 64, 1, 128]
    - [8, 3486.48]
  - - [4288, 2368, 1, 3328]
    - [72, 32758.0]
  - - [1856, 2368, 1, 256]
    - [69, 29484.3]
  - - [3584, 256, 1, 128]
    - [56, 4032.98]
  - - [3584, 6784, 1, 3328]
    - [72, 36394.8]
  - - [256, 1024, 1, 256]
    - [64, 12662.1]
  - - [4, 6784, 1, 3328]
    - [33, 2218.88]
  - - [1024, 5888, 1, 3328]
    - [68, 34463.9]
  - - [1024, 128, 1, 1280]
    - [18, 10852.0]
  - - [3072, 32, 1, 1024]
    - [51, 6923.2]
  - - [6144, 24000, 1, 2560]
    - [72, 37359.7]
  - - [5056, 4288, 1, 1280]
    - [72, 35083.8]
  - - [5888, 64, 1, 256]
    - [64, 14103.7]
  - - [6784, 1856, 1, 3328]
    - [72, 34271.6]
  - - [1408, 5056, 1, 1280]
    - [68, 34821.6]
  - - [1856, 256, 1, 1280]
    - [69, 22693.1]
  - - [64, 5888, 1, 3328]
    - [30, 20319.1]
  - - [2368, 2368, 1, 1280]
    - [59, 32232.4]
  - - [2944, 5888, 1, 128]
    - [56, 5729.45]
  - - [704, 5888, 1, 1280]
    - [70, 31310.0]
  - - [2368, 3584, 1, 128]
    - [56, 5623.38]
  - - [1856, 5056, 1, 128]
    - [56, 5714.29]
  - - [704, 1024, 1, 1280]
    - [64, 25101.9]
  - - [448, 256, 1, 3328]
    - [15, 15890.2]
  - - [448, 1856, 1, 128]
    - [56, 3763.45]
  - - [8192, 3200, 1, 2048]
    - [68, 36283.4]
  - - [128, 1024, 1, 128]
    - [6, 2304.56]
  - - [2944, 4, 1, 128]
    - [74, 268.208]
  - - [1024, 704, 1, 1280]
    - [64, 24554.2]
  - - [128, 5888, 1, 256]
    - [64, 21202.0]
  - - [1024, 5056, 1, 1280]
    - [68, 34447.5]
  - - [4288, 1024, 1, 256]
    - [69, 29318.6]
  - - [2944, 2368, 1, 128]
    - [56, 4200.82]
  - - [704, 704, 1, 3328]
    - [69, 24632.8]
  - - [704, 1408, 1, 1280]
    - [70, 27438.9]
  - - [5888, 448, 1, 1280]
    - [69, 28150.9]
  - - [3584, 256, 1, 3328]
    - [71, 26464.3]
  - - [704, 5888, 1, 3328]
    - [70, 31829.9]
  - - [704, 1856, 1, 128]
    - [56, 4904.63]
  - - [448, 448, 1, 3328]
    - [24, 18309.8]
  - - [4, 4288, 1, 128]
    - [74, 311.855]
  - - [128, 704, 1, 1280]
    - [15, 8672.43]
  - - [3584, 2944, 1, 256]
    - [68, 30473.1]
  - - [3584, 4, 1, 128]
    - [74, 325.356]
  - - [1856, 128, 1, 3328]
    - [24, 19425.7]
  - - [4, 64, 1, 1280]
    - [43, 86.6878]
  - - [2944, 448, 1, 128]
    - [56, 4261.0]
  - - [128, 2944, 1, 1280]
    - [69, 18119.6]
  - - [64, 64, 1, 3328]
    - [43, 2302.62]
  - - [448, 2944, 1, 1280]
    - [60, 26044.5]
  - - [512, 24000, 1, 2048]
    - [72, 32541.7]
  - - [128, 256, 1, 3328]
    - [53, 8866.01]
  - - [1408, 5056, 1, 3328]
    - [72, 35147.5]
  - - [1856, 1856, 1, 3328]
    - [62, 30395.8]
  - - [3584, 128, 1, 256]
    - [58, 17740.3]
  - - [2560, 800, 1, 2560]
    - [67, 26711.2]
  - - [448, 1408, 1, 3328]
    - [64, 22611.5]
  - - [2368, 2368, 1, 256]
    - [59, 30673.1]
  - - [4288, 4288, 1, 1280]
    - [72, 34293.0]
  - - [64, 448, 1, 1280]
    - [17, 4828.97]
  - - [5888, 1024, 1, 1280]
    - [68, 34211.9]
  - - [1408, 4288, 1, 256]
    - [59, 30365.4]
  - - [448, 4, 1, 256]
    - [77, 260.655]
  - - [5888, 448, 1, 128]
    - [56, 4920.45]
  - - [512, 48000, 1, 2560]
    - [72, 36437.2]
  - - [35, 8457, 1, 1760]
    - [4, 13095.8]
  - - [704, 6784, 1, 3328]
    - [72, 32501.1]
  - - [2560, 6400, 1, 2560]
    - [72, 36206.5]
  - - [5056, 1024, 1, 1280]
    - [68, 34758.2]
  - - [448, 5888, 1, 3328]
    - [68, 29093.5]
  - - [128, 4, 1, 128]
    - [74, 12.3191]
  - - [1024, 2944, 1, 1280]
    - [72, 32156.3]
  - - [5056, 5888, 1, 1280]
    - [72, 36612.9]
  - - [4288, 5888, 1, 128]
    - [56, 5768.24]
  - - [256, 3584, 1, 256]
    - [64, 21869.7]
  - - [1408, 3584, 1, 128]
    - [56, 5429.75]
  - - [256, 2944, 1, 3328]
    - [69, 26768.3]
  - - [448, 3584, 1, 128]
    - [56, 4530.88]
  - - [5888, 2944, 1, 1280]
    - [72, 36096.6]
  - - [4, 6784, 1, 1280]
    - [77, 1960.16]
  - - [2368, 5888, 1, 128]
    - [56, 5706.58]
  - - [8448, 16, 1, 2816]
    - [34, 10514.7]
  - - [64, 2944, 1, 128]
    - [6, 2627.15]
  - - [2368, 4, 1, 256]
    - [77, 954.658]
  - - [3584, 5888, 1, 256]
    - [68, 32614.5]
  - - [2368, 1024, 1, 128]
    - [56, 4985.2]
  - - [2368, 704, 1, 128]
    - [57, 4482.88]
  - - [3584, 2944, 1, 1280]
    - [72, 33502.8]
  - - [3584, 2368, 1, 128]
    - [56, 5577.76]
  - - [5056, 704, 1, 128]
    - [56, 5342.47]
  - - [448, 2368, 1, 128]
    - [56, 4003.26]
  - - [5056, 1408, 1, 3328]
    - [68, 35179.9]
  - - [1408, 704, 1, 256]
    - [64, 24259.6]
  - - [6784, 1024, 1, 3328]
    - [72, 34566.9]
  - - [6784, 2944, 1, 3328]
    - [72, 35837.9]
  - - [2944, 5056, 1, 3328]
    - [72, 35431.0]
  - - [1856, 1856, 1, 256]
    - [59, 28575.9]
  - - [1024, 5888, 1, 128]
    - [56, 5577.85]
  - - [6784, 2368, 1, 1280]
    - [72, 35397.8]
  - - [256, 4, 1, 128]
    - [74, 24.4537]
  - - [4288, 5888, 1, 1280]
    - [72, 35960.7]
  - - [4288, 4288, 1, 256]
    - [62, 32556.8]
  - - [8448, 32, 1, 2816]
    - [20, 16176.5]
  - - [448, 2944, 1, 3328]
    - [60, 26403.6]
  - - [5888, 4, 1, 128]
    - [74, 415.242]
  - - [4288, 1856, 1, 1280]
    - [68, 34230.2]
  - - [1856, 2944, 1, 3328]
    - [68, 31658.1]
  - - [256, 6784, 1, 3328]
    - [64, 28658.0]
  - - [64, 5888, 1, 256]
    - [64, 12273.4]
  - - [256, 5056, 1, 128]
    - [56, 4620.05]
  - - [5056, 1024, 1, 256]
    - [59, 30595.6]
  - - [704, 64, 1, 3328]
    - [35, 10544.8]
  - - [5056, 1856, 1, 3328]
    - [72, 33096.4]
  - - [4, 2944, 1, 3328]
    - [43, 1878.74]
  - - [4, 5056, 1, 256]
    - [77, 1406.89]
  - - [1856, 1408, 1, 256]
    - [59, 29264.7]
  - - [8448, 12000, 1, 2816]
    - [72, 37818.4]
  - - [6784, 128, 1, 3328]
    - [70, 25064.0]
  - - [4288, 1408, 1, 128]
    - [56, 5446.09]
  - - [1856, 5888, 1, 3328]
    - [72, 34867.4]
  - - [4288, 5056, 1, 256]
    - [62, 32540.5]
  - - [1408, 128, 1, 1280]
    - [15, 13506.2]
  - - [4096, 800, 1, 1024]
    - [69, 27099.4]
  - - [5056, 256, 1, 3328]
    - [69, 28936.9]
  - - [704, 704, 1, 256]
    - [58, 19579.9]
  - - [1024, 5888, 1, 1280]
    - [68, 33988.9]
  - - [6784, 2368, 1, 128]
    - [56, 5714.05]
  - - [4, 5056, 1, 1280]
    - [77, 1892.3]
  - - [256, 64, 1, 1280]
    - [34, 3869.28]
  - - [128, 1856, 1, 1280]
    - [69, 14891.6]
  - - [1856, 1024, 1, 1280]
    - [68, 29515.8]
  - - [6784, 4288, 1, 1280]
    - [72, 35777.4]
  - - [2560, 64, 1, 2560]
    - [15, 15033.3]
  - - [1856, 1856, 1, 1280]
    - [63, 30429.7]
  - - [4096, 400, 1, 1024]
    - [69, 25551.7]
  - - [3072, 24000, 1, 1024]
    - [68, 36428.9]
  - - [128, 4288, 1, 3328]
    - [20, 20728.8]
  - - [4, 2368, 1, 3328]
    - [80, 1834.86]
  - - [5888, 1856, 1, 128]
    - [56, 5667.29]
  - - [448, 704, 1, 1280]
    - [69, 15303.3]
  - - [128, 5056, 1, 1280]
    - [69, 22473.5]
  - - [1024, 448, 1, 3328]
    - [69, 22719.1]
  - - [1856, 704, 1, 1280]
    - [69, 28697.3]
  - - [5056, 3584, 1, 128]
    - [56, 5725.06]
  - - [5888, 5888, 1, 3328]
    - [72, 36842.3]
  - - [6784, 1024, 1, 256]
    - [62, 30577.5]
  - - [2944, 2368, 1, 256]
    - [62, 30197.6]
  - - [256, 448, 1, 256]
    - [64, 5991.86]
  - - [5056, 5888, 1, 3328]
    - [72, 36799.2]
  - - [1856, 1024, 1, 256]
    - [59, 25688.5]
  - - [512, 48000, 1, 1536]
    - [72, 36066.6]
  - - [3584, 448, 1, 1280]
    - [69, 26134.4]
  - - [8448, 5984, 1, 2816]
    - [72, 37256.2]
  - - [1024, 1024, 1, 1280]
    - [71, 28740.4]
  - - [448, 5888, 1, 256]
    - [64, 26544.1]
  - - [704, 64, 1, 128]
    - [6, 951.678]
  - - [1408, 6784, 1, 3328]
    - [72, 33838.6]
  - - [448, 1024, 1, 128]
    - [56, 3629.19]
  - - [4288, 704, 1, 128]
    - [56, 5218.8]
  - - [128, 1856, 1, 128]
    - [7, 2912.71]
  - - [448, 2368, 1, 3328]
    - [69, 23765.2]
  - - [5056, 64, 1, 128]
    - [6, 3161.74]
  - - [5056, 2944, 1, 256]
    - [62, 32624.4]
  - - [6784, 5888, 1, 128]
    - [56, 5804.13]
  - - [1024, 700, 1, 512]
    - [64, 22108.5]
  - - [704, 1024, 1, 256]
    - [64, 21918.0]
  - - [1024, 4, 1, 256]
    - [77, 546.133]
  - - [2944, 704, 1, 128]
    - [56, 5155.26]
  - - [128, 6784, 1, 1280]
    - [65, 23699.2]
  - - [1408, 3584, 1, 3328]
    - [72, 34290.3]
  - - [2368, 6784, 1, 256]
    - [59, 32633.8]
  - - [5056, 1408, 1, 1280]
    - [72, 34864.3]
  - - [256, 256, 1, 128]
    - [6, 1366.22]
  - - [5056, 4288, 1, 128]
    - [56, 5777.76]
  - - [1408, 1856, 1, 128]
    - [56, 5316.21]
  - - [1408, 5888, 1, 3328]
    - [72, 35980.9]
  - - [1856, 256, 1, 256]
    - [58, 18541.9]
  - - [6784, 6784, 1, 256]
    - [72, 34593.3]
  - - [64, 256, 1, 128]
    - [9, 398.698]
  - - [4288, 2368, 1, 128]
    - [56, 5693.49]
  - - [1024, 1024, 1, 128]
    - [56, 4531.32]
  - - [256, 4288, 1, 1280]
    - [64, 24184.0]
  - - [2368, 2944, 1, 256]
    - [62, 30717.3]
  - - [4, 1856, 1, 256]
    - [77, 922.594]
  - - [3584, 1856, 1, 1280]
    - [68, 32463.2]
  - - [6784, 6784, 1, 128]
    - [56, 5814.27]
  - - [256, 1856, 1, 128]
    - [56, 3519.53]
  - - [704, 64, 1, 1280]
    - [53, 6323.65]
  - - [5888, 5056, 1, 256]
    - [68, 33475.6]
  - - [8448, 48000, 1, 2816]
    - [72, 38069.5]
  - - [3584, 448, 1, 256]
    - [69, 24037.5]
  - - [448, 4288, 1, 128]
    - [56, 4811.96]
  - - [7680, 64, 1, 2560]
    - [21, 18369.2]
  - - [256, 6784, 1, 256]
    - [64, 25551.5]
  - - [1408, 4288, 1, 128]
    - [56, 5454.55]
  - - [2944, 704, 1, 3328]
    - [71, 30905.7]
  - - [128, 448, 1, 256]
    - [69, 3033.07]
  - - [5056, 256, 1, 1280]
    - [69, 28486.1]
  - - [2560, 32, 1, 2560]
    - [14, 12206.9]
  - - [3584, 3584, 1, 256]
    - [68, 31419.2]
  - - [448, 1408, 1, 128]
    - [56, 3513.51]
  - - [128, 256, 1, 1280]
    - [17, 5652.7]
  - - [3584, 5056, 1, 256]
    - [68, 32245.9]
  - - [6784, 128, 1, 256]
    - [69, 20431.8]
  - - [4288, 4, 1, 256]
    - [76, 1389.53]
  - - [704, 448, 1, 256]
    - [64, 12775.4]
  - - [2944, 2368, 1, 1280]
    - [72, 34069.1]
  - - [448, 64, 1, 3328]
    - [53, 8326.39]
  - - [1408, 3584, 1, 256]
    - [59, 30183.3]
  - - [3584, 4, 1, 3328]
    - [78, 2280.6]
  - - [6784, 3584, 1, 256]
    - [72, 33150.6]
  - - [256, 128, 1, 128]
    - [9, 791.378]
  - - [704, 1408, 1, 128]
    - [56, 4473.83]
  - - [4, 2368, 1, 256]
    - [77, 954.658]
  - - [4288, 128, 1, 1280]
    - [69, 19039.2]
  - - [128, 1408, 1, 256]
    - [64, 9154.23]
  - - [4, 2944, 1, 256]
    - [77, 1177.6]
  - - [64, 128, 1, 3328]
    - [44, 3724.45]
  - - [5056, 2368, 1, 128]
    - [56, 5708.04]
  - - [2944, 2944, 1, 3328]
    - [72, 33991.2]
  - - [5056, 6784, 1, 256]
    - [62, 33678.9]
  - - [1856, 3584, 1, 128]
    - [56, 5558.45]
  - - [128, 2944, 1, 128]
    - [12, 3267.92]
  - - [35, 8457, 1, 2560]
    - [4, 13270.5]
  - - [1024, 704, 1, 3328]
    - [69, 25506.5]
  - - [6784, 448, 1, 256]
    - [69, 28251.4]
  - - [3584, 6784, 1, 128]
    - [56, 5778.05]
  - - [128, 4288, 1, 256]
    - [69, 15752.2]
  - - [704, 448, 1, 3328]
    - [69, 16083.7]
  - - [1024, 1024, 1, 3328]
    - [71, 29959.3]
  - - [128, 128, 1, 3328]
    - [44, 5952.61]
  - - [5056, 1856, 1, 256]
    - [62, 31133.8]
  - - [4608, 5984, 1, 1536]
    - [72, 36313.0]
  - - [256, 128, 1, 256]
    - [19, 1864.14]
  - - [1760, 3200, 1, 1760]
    - [62, 35167.5]
  - - [1024, 1856, 1, 256]
    - [63, 24424.7]
  - - [4096, 1600, 1, 1024]
    - [68, 30957.1]
  - - [4288, 64, 1, 128]
    - [9, 2842.01]
  - - [256, 448, 1, 3328]
    - [15, 15553.5]
  - - [1408, 6784, 1, 1280]
    - [72, 33349.0]
  - - [3584, 3584, 1, 1280]
    - [72, 34635.9]
  - - [7680, 24000, 1, 2560]
    - [68, 37511.9]
  - - [64, 2368, 1, 1280]
    - [24, 12645.8]
  - - [448, 2368, 1, 1280]
    - [69, 23428.3]
  - - [4608, 48000, 1, 1536]
    - [68, 37569.7]
  - - [5888, 5888, 1, 128]
    - [56, 5765.78]
  - - [64, 6784, 1, 3328]
    - [64, 20989.8]
  - - [2944, 256, 1, 1280]
    - [69, 26058.6]
  - - [2048, 16, 1, 2048]
    - [34, 6179.45]
  - - [256, 2368, 1, 128]
    - [56, 3282.34]
  - - [5056, 2368, 1, 3328]
    - [72, 35272.2]
  - - [2944, 4288, 1, 256]
    - [62, 31522.7]
  - - [1408, 3584, 1, 1280]
    - [68, 34031.8]
  - - [2368, 64, 1, 256]
    - [64, 7853.71]
  - - [64, 448, 1, 3328]
    - [53, 8489.36]
  - - [704, 128, 1, 3328]
    - [14, 14348.9]
  - - [8192, 1600, 1, 2048]
    - [68, 34476.7]
  - - [1856, 704, 1, 256]
    - [69, 26132.5]
  - - [4, 4288, 1, 1280]
    - [77, 1681.05]
  - - [1408, 448, 1, 3328]
    - [69, 22743.8]
  - - [1024, 4, 1, 3328]
    - [79, 1618.94]
  - - [512, 24000, 1, 2560]
    - [68, 35990.7]
  - - [2368, 6784, 1, 3328]
    - [72, 35696.1]
  - - [1856, 1408, 1, 1280]
    - [59, 30891.7]
  - - [1856, 448, 1, 1280]
    - [71, 23350.3]
  - - [6784, 704, 1, 128]
    - [56, 5360.57]
  - - [4, 4, 1, 256]
    - [77, 1.69256]
  - - [128, 5888, 1, 128]
    - [7, 4091.14]
  - - [1408, 5888, 1, 256]
    - [68, 32068.9]
  - - [704, 2944, 1, 1280]
    - [65, 30119.2]
  - - [4288, 64, 1, 1280]
    - [24, 14636.4]
  - - [256, 64, 1, 256]
    - [26, 1092.27]
  - - [1024, 1024, 1, 256]
    - [69, 24183.4]
  - - [704, 1856, 1, 256]
    - [64, 26010.6]
  - - [704, 6784, 1, 128]
    - [56, 5383.23]
  - - [3584, 704, 1, 1280]
    - [63, 29948.2]
  - - [256, 128, 1, 1280]
    - [17, 5577.53]
  - - [5888, 2368, 1, 256]
    - [68, 31570.4]
  - - [256, 2368, 1, 1280]
    - [64, 21247.2]
  - - [2944, 6784, 1, 128]
    - [56, 5756.43]
  - - [3584, 448, 1, 3328]
    - [69, 26447.9]
  - - [1408, 4, 1, 256]
    - [77, 735.608]
  - - [704, 2368, 1, 3328]
    - [69, 27558.2]
  - - [2944, 448, 1, 256]
    - [63, 23382.4]
  - - [1856, 448, 1, 128]
    - [56, 3776.81]
  - - [4288, 4, 1, 3328]
    - [33, 2054.78]
  - - [2368, 128, 1, 1280]
    - [64, 14684.8]
  - - [256, 5888, 1, 128]
    - [56, 4687.51]
  - - [64, 6784, 1, 256]
    - [64, 13295.3]
  - - [64, 5056, 1, 1280]
    - [64, 15194.0]
  - - [4, 6784, 1, 128]
    - [74, 473.216]
  - - [2048, 3200, 1, 512]
    - [68, 30158.6]
  - - [2944, 2944, 1, 1280]
    - [72, 33567.1]
  - - [5056, 448, 1, 3328]
    - [69, 29538.5]
  - - [4, 3584, 1, 1280]
    - [78, 1721.4]
  - - [1408, 128, 1, 128]
    - [6, 2507.46]
  - - [6784, 704, 1, 3328]
    - [68, 32542.3]
  - - [128, 64, 1, 1280]
    - [33, 2001.1]
  - - [2368, 256, 1, 1280]
    - [69, 21223.9]
  - - [4, 448, 1, 3328]
    - [80, 892.781]
  - - [5888, 4288, 1, 128]
    - [56, 5362.77]
  - - [4, 5888, 1, 256]
    - [77, 1402.17]
  - - [1408, 2944, 1, 3328]
    - [72, 34715.1]
  - - [3584, 704, 1, 128]
    - [56, 5051.01]
  - - [4608, 12000, 1, 1536]
    - [72, 37276.6]
  - - [64, 1024, 1, 256]
    - [64, 3437.95]
  - - [5056, 5056, 1, 128]
    - [56, 5781.47]
  - - [2368, 448, 1, 1280]
    - [69, 23550.2]
  - - [128, 3584, 1, 256]
    - [69, 16777.2]
  - - [704, 448, 1, 1280]
    - [69, 15420.2]
  - - [8192, 800, 1, 2048]
    - [68, 31428.3]
  - - [448, 5056, 1, 128]
    - [56, 5102.63]
  - - [256, 4, 1, 1280]
    - [43, 286.183]
  - - [5056, 3584, 1, 256]
    - [62, 33097.2]
  - - [2368, 4, 1, 3328]
    - [43, 1678.53]
  - - [1408, 5056, 1, 128]
    - [56, 5529.87]
  - - [2944, 3584, 1, 128]
    - [56, 5642.41]
  - - [3584, 2368, 1, 256]
    - [69, 29592.1]
  - - [128, 3584, 1, 3328]
    - [64, 22451.9]
  - - [128, 1024, 1, 1280]
    - [15, 12409.2]
  - - [8448, 24000, 1, 2816]
    - [72, 37876.8]
  - - [64, 704, 1, 256]
    - [64, 2373.32]
  - - [4288, 256, 1, 1280]
    - [69, 24343.2]
  - - [3584, 3584, 1, 3328]
    - [72, 35135.3]
  - - [1024, 256, 1, 128]
    - [56, 2204.63]
  - - [4, 704, 1, 128]
    - [74, 63.9092]
  - - [5888, 6784, 1, 256]
    - [72, 33824.1]
  - - [4288, 2944, 1, 3328]
    - [72, 34570.6]
  - - [2944, 64, 1, 128]
    - [11, 2554.79]
  - - [1024, 128, 1, 3328]
    - [20, 16276.4]
  - - [1024, 16, 1, 500000]
    - [0, 14054.4]
  - - [4288, 128, 1, 3328]
    - [30, 20427.4]
  - - [7680, 128, 1, 2560]
    - [30, 20229.8]
  - - [256, 5056, 1, 1280]
    - [69, 28349.6]
  - - [1408, 256, 1, 128]
    - [56, 2862.12]
  - - [2944, 5888, 1, 3328]
    - [72, 36334.2]
  - - [6784, 5888, 1, 1280]
    - [72, 36726.1]
  - - [2048, 800, 1, 512]
    - [69, 25040.6]
  - - [704, 128, 1, 256]
    - [64, 4707.89]
  - - [5888, 4288, 1, 1280]
    - [72, 35911.9]
  - - [1024, 24000, 1, 2048]
    - [68, 34706.7]
  - - [448, 256, 1, 1280]
    - [15, 11275.0]
  - - [5888, 3584, 1, 128]
    - [56, 5730.02]
  - - [1024, 2944, 1, 128]
    - [56, 5092.06]
  - - [5056, 4, 1, 1280]
    - [77, 1976.09]
  - - [256, 1408, 1, 1280]
    - [69, 17449.8]
  - - [3072, 16, 1, 1024]
    - [17, 5033.16]
  - - [704, 3584, 1, 128]
    - [56, 5180.65]
  - - [5888, 448, 1, 3328]
    - [72, 29026.2]
  - - [2368, 4288, 1, 1280]
    - [59, 32531.8]
  - - [4288, 2944, 1, 128]
    - [56, 5668.48]
  - - [1024, 6784, 1, 3328]
    - [68, 34495.7]
  - - [128, 2368, 1, 256]
    - [64, 11864.6]
  - - [6784, 64, 1, 3328]
    - [69, 21387.5]
  - - [5056, 2944, 1, 3328]
    - [72, 35369.8]
  - - [448, 128, 1, 256]
    - [64, 3020.59]
  - - [2944, 3584, 1, 256]
    - [62, 31321.1]
  - - [1408, 1408, 1, 3328]
    - [68, 31471.3]
  - - [1856, 128, 1, 1280]
    - [64, 15483.0]
  - - [3584, 3584, 1, 128]
    - [56, 5730.01]
  - - [64, 3584, 1, 256]
    - [64, 9986.44]
  - - [1408, 4, 1, 3328]
    - [79, 1771.58]
  - - [128, 2944, 1, 3328]
    - [20, 20545.5]
  - - [3584, 704, 1, 256]
    - [69, 27439.4]
  - - [2944, 448, 1, 3328]
    - [63, 26371.9]
  - - [3584, 1408, 1, 3328]
    - [68, 34259.5]
  - - [704, 3584, 1, 1280]
    - [59, 29799.0]
  - - [2944, 6784, 1, 1280]
    - [72, 35496.1]
  - - [1856, 6784, 1, 256]
    - [62, 31907.8]
  - - [4288, 448, 1, 3328]
    - [71, 28730.8]
  - - [6784, 4288, 1, 128]
    - [56, 5809.25]
  - - [6784, 704, 1, 1280]
    - [68, 31929.4]
  - - [256, 4288, 1, 256]
    - [64, 21257.1]
  - - [3584, 6784, 1, 256]
    - [72, 33090.6]
  - - [6144, 12000, 1, 2048]
    - [68, 36315.4]
  - - [6144, 16, 1, 2560]
    - [22, 10050.2]
  - - [3584, 64, 1, 128]
    - [9, 2828.53]
  - - [5888, 1024, 1, 3328]
    - [68, 34522.0]
  - - [448, 64, 1, 128]
    - [9, 634.951]
  - - [704, 6784, 1, 1280]
    - [72, 32002.9]
  - - [4, 1024, 1, 1280]
    - [79, 766.503]
  - - [5888, 128, 1, 256]
    - [69, 21678.4]
  - - [4096, 16, 1, 4096]
    - [47, 10145.0]
  - - [1856, 5056, 1, 3328]
    - [72, 32997.8]
  - - [4, 6784, 1, 256]
    - [77, 1459.42]
  - - [1024, 3584, 1, 128]
    - [56, 5369.94]
  - - [1024, 1408, 1, 128]
    - [56, 4477.18]
  - - [2368, 2944, 1, 128]
    - [56, 5619.26]
  - - [5056, 64, 1, 256]
    - [69, 12475.5]
  - - [4, 448, 1, 1280]
    - [33, 490.12]
  - - [5056, 2944, 1, 128]
    - [56, 5751.91]
  - - [5888, 5056, 1, 3328]
    - [72, 36808.7]
  - - [1024, 704, 1, 128]
    - [56, 3806.71]
  - - [5888, 2368, 1, 128]
    - [56, 5651.29]
  - - [128, 5056, 1, 3328]
    - [64, 23173.8]
  - - [3584, 6784, 1, 1280]
    - [72, 35942.3]
  - - [448, 4, 1, 1280]
    - [43, 444.527]
  - - [1856, 5888, 1, 256]
    - [59, 32357.2]
  - - [256, 256, 1, 256]
    - [64, 3437.95]
  - - [256, 64, 1, 128]
    - [9, 362.829]
  - - [4288, 4288, 1, 3328]
    - [72, 34703.0]
  - - [4288, 1408, 1, 1280]
    - [68, 34225.0]
  - - [3584, 5056, 1, 128]
    - [56, 5708.43]
  - - [4, 1024, 1, 3328]
    - [79, 1336.42]
  - - [4288, 2368, 1, 256]
    - [62, 31584.7]
  - - [2944, 5056, 1, 1280]
    - [72, 35012.9]
  - - [448, 6784, 1, 256]
    - [59, 28499.8]
  - - [64, 128, 1, 128]
    - [6, 172.463]
  - - [1856, 2368, 1, 128]
    - [56, 5502.36]
  - - [6784, 2368, 1, 3328]
    - [72, 35759.1]
  - - [256, 1024, 1, 1280]
    - [69, 16677.2]
  - - [704, 4, 1, 128]
    - [74, 65.0628]
  - - [256, 4, 1, 256]
    - [77, 157.918]
  - - [4288, 128, 1, 256]
    - [58, 16414.6]
  - - [4288, 1856, 1, 3328]
    - [72, 34488.8]
  - - [3584, 448, 1, 128]
    - [56, 4452.36]
  - - [2048, 1600, 1, 2048]
    - [64, 27915.5]
  - - [256, 4, 1, 3328]
    - [81, 617.368]
  - - [4, 1408, 1, 1280]
    - [79, 971.558]
  - - [3584, 64, 1, 1280]
    - [69, 14724.2]
  - - [1408, 448, 1, 128]
    - [56, 3498.28]
  - - [3584, 1024, 1, 1280]
    - [60, 31531.9]
  - - [1856, 5056, 1, 256]
    - [62, 30822.3]
  - - [4, 3584, 1, 256]
    - [77, 1199.35]
  - - [4, 2944, 1, 1280]
    - [77, 1656.4]
  - - [1024, 4288, 1, 256]
    - [64, 27727.5]
  - - [5888, 3584, 1, 3328]
    - [72, 36124.0]
  - - [1856, 4, 1, 256]
    - [77, 950.272]
  - - [4, 256, 1, 256]
    - [77, 165.914]
  - - [5056, 3584, 1, 3328]
    - [72, 36018.9]
  - - [704, 448, 1, 128]
    - [56, 2516.84]
  - - [2368, 1408, 1, 1280]
    - [69, 30267.4]
  - - [5056, 2944, 1, 1280]
    - [72, 35012.9]
  - - [4, 4, 1, 128]
    - [75, 0.182206]
  - - [3584, 256, 1, 256]
    - [69, 22033.9]
  - - [1024, 6784, 1, 256]
    - [72, 29959.3]
  - - [4, 128, 1, 256]
    - [77, 84.0205]
  - - [64, 64, 1, 1280]
    - [45, 1213.63]
  - - [5124, 9124, 1, 2048]
    - [68, 34822.9]
  - - [6784, 4, 1, 128]
    - [74, 478.431]
  - - [2944, 1408, 1, 128]
    - [56, 5467.64]
  - - [448, 128, 1, 3328]
    - [38, 12109.2]
  - - [3584, 1408, 1, 1280]
    - [72, 33860.5]
  - - [64, 4288, 1, 3328]
    - [37, 17672.4]
  - - [5056, 6784, 1, 3328]
    - [72, 36489.7]
  - - [128, 2944, 1, 256]
    - [64, 14355.5]
  - - [128, 6784, 1, 128]
    - [7, 4095.4]
  - - [3584, 4288, 1, 256]
    - [68, 32471.6]
  - - [448, 1856, 1, 256]
    - [64, 20233.9]
  - - [1856, 6784, 1, 3328]
    - [72, 34346.3]
  - - [3584, 128, 1, 3328]
    - [69, 22719.1]
  - - [64, 1856, 1, 256]
    - [64, 6205.86]
  - - [64, 448, 1, 256]
    - [17, 1638.4]
  - - [5888, 4288, 1, 256]
    - [68, 32799.3]
  - - [4, 448, 1, 128]
    - [74, 41.2556]
  - - [5056, 1408, 1, 256]
    - [62, 30972.6]
  - - [35, 8457, 1, 2048]
    - [5, 11001.8]
  - - [64, 256, 1, 1280]
    - [40, 3785.47]
  - - [3584, 1024, 1, 256]
    - [59, 28926.2]
  - - [256, 704, 1, 256]
    - [64, 9301.88]
  - - [5888, 5888, 1, 256]
    - [68, 33610.3]
  - - [4288, 1024, 1, 1280]
    - [63, 31024.3]
  - - [5888, 128, 1, 3328]
    - [64, 26734.1]
  - - [448, 6784, 1, 3328]
    - [70, 30912.5]
  - - [2944, 1408, 1, 1280]
    - [68, 34381.8]
  - - [64, 128, 1, 1280]
    - [39, 2193.67]
  - - [2944, 1856, 1, 3328]
    - [63, 31680.2]
  - - [2368, 64, 1, 128]
    - [9, 2298.42]
  - - [256, 1024, 1, 128]
    - [56, 2222.15]
  - - [3584, 5888, 1, 1280]
    - [72, 35585.2]
  - - [64, 4, 1, 128]
    - [74, 3.81023]
  - - [6784, 1856, 1, 1280]
    - [72, 34032.9]
  - - [2944, 5056, 1, 256]
    - [59, 32005.1]
  - - [4288, 4, 1, 128]
    - [74, 310.098]
  - - [5888, 256, 1, 3328]
    - [63, 29546.4]
  - - [2944, 4288, 1, 128]
    - [56, 5672.46]
  - - [3584, 1408, 1, 256]
    - [68, 29400.2]
  - - [704, 3584, 1, 3328]
    - [65, 30213.7]
  - - [4096, 3200, 1, 1024]
    - [68, 34256.7]
  - - [5056, 448, 1, 1280]
    - [69, 29250.5]
  - - [3584, 1856, 1, 3328]
    - [72, 32914.4]
  - - [4288, 6784, 1, 1280]
    - [72, 35820.7]
  - - [2560, 7000, 1, 2560]
    - [72, 35413.9]
  - - [1408, 704, 1, 1280]
    - [71, 27498.4]
  - - [2944, 1024, 1, 256]
    - [59, 28647.1]
  - - [6784, 64, 1, 256]
    - [69, 16062.0]
  - - [2368, 4288, 1, 3328]
    - [72, 32843.9]
  - - [4, 1408, 1, 256]
    - [77, 706.761]
  - - [1024, 1408, 1, 1280]
    - [60, 27827.1]
  - - [64, 64, 1, 256]
    - [46, 281.875]
  - - [704, 256, 1, 3328]
    - [73, 12521.6]
  - - [6784, 5056, 1, 256]
    - [72, 33298.4]
  - - [1856, 1856, 1, 128]
    - [56, 5183.71]
  - - [3584, 5056, 1, 3328]
    - [72, 35943.3]
  - - [448, 6784, 1, 128]
    - [56, 5269.87]
  - - [4, 704, 1, 3328]
    - [79, 1118.34]
  - - [35, 8457, 1, 4096]
    - [5, 14029.1]
  - - [448, 2944, 1, 256]
    - [59, 23414.8]
  - - [4, 4288, 1, 3328]
    - [33, 2078.73]
  - - [2944, 6784, 1, 256]
    - [68, 32632.5]
  - - [2944, 2944, 1, 128]
    - [56, 5578.77]
  - - [4, 4, 1, 1280]
    - [43, 5.3057]
  - - [1856, 3584, 1, 1280]
    - [68, 32592.4]
  - - [64, 2944, 1, 256]
    - [64, 8801.92]
  - - [448, 256, 1, 128]
    - [9, 2146.21]
  - - [4288, 448, 1, 128]
    - [56, 4796.94]
  - - [4608, 24000, 1, 1536]
    - [72, 37334.7]
  - - [1856, 1408, 1, 3328]
    - [70, 31180.6]
  - - [128, 128, 1, 128]
    - [9, 364.089]
  - - [1024, 4288, 1, 3328]
    - [69, 30823.8]
  - - [448, 2368, 1, 256]
    - [69, 21184.2]
  - - [1024, 4, 1, 128]
    - [74, 93.6229]
  - - [64, 1408, 1, 1280]
    - [49, 9758.32]
  - - [64, 6784, 1, 1280]
    - [64, 19679.4]
  - - [5056, 448, 1, 256]
    - [69, 27326.2]
  - - [2944, 2368, 1, 3328]
    - [72, 34634.3]
  - - [704, 4288, 1, 3328]
    - [70, 30700.4]
  - - [1408, 128, 1, 256]
    - [64, 9227.47]
  - - [1024, 1856, 1, 1280]
    - [72, 29387.5]
  - - [2048, 6400, 1, 2048]
    - [68, 34630.6]
  - - [512, 48000, 1, 2816]
    - [72, 36787.1]
  - - [5124, 9124, 1, 2560]
    - [72, 35780.3]
  - - [128, 2368, 1, 3328]
    - [30, 19324.3]
  - - [1024, 5888, 1, 256]
    - [72, 29924.5]
  - - [64, 2944, 1, 1280]
    - [24, 13458.3]
  - - [5056, 64, 1, 3328]
    - [30, 19817.6]
  - - [128, 704, 1, 128]
    - [9, 1774.51]
  - - [1408, 2368, 1, 256]
    - [64, 28738.7]
  - - [1408, 1408, 1, 256]
    - [59, 26543.5]
  - - [4, 64, 1, 128]
    - [74, 6.6332]
  - - [64, 1024, 1, 128]
    - [6, 1361.79]
  - - [1024, 8, 1, 500000]
    - [1, 8018.8]
  - - [2368, 2368, 1, 128]
    - [56, 5477.34]
  - - [64, 5888, 1, 128]
    - [6, 3237.21]
  - - [5888, 4, 1, 3328]
    - [33, 2165.22]
  - - [6784, 1408, 1, 128]
    - [56, 5635.84]
  - - [4288, 5888, 1, 256]
    - [62, 33392.3]
  - - [1408, 5056, 1, 256]
    - [59, 31057.0]
  - - [5056, 128, 1, 3328]
    - [69, 23153.9]
  - - [128, 128, 1, 1280]
    - [40, 3449.26]
  - - [448, 704, 1, 256]
    - [64, 12576.4]
  - - [4288, 3584, 1, 128]
    - [56, 5746.13]
  - - [2944, 128, 1, 3328]
    - [30, 20505.2]
  - - [64, 1408, 1, 3328]
    - [15, 13961.5]
  - - [3584, 5056, 1, 1280]
    - [72, 35525.4]
  - - [256, 448, 1, 1280]
    - [15, 11206.2]
  - - [704, 704, 1, 128]
    - [56, 3935.41]
  - - [5056, 4, 1, 128]
    - [74, 356.573]
  - - [704, 256, 1, 1280]
    - [64, 11793.8]
  - - [64, 2368, 1, 3328]
    - [15, 17537.0]
  - - [1856, 1024, 1, 128]
    - [56, 4760.66]
  - - [1856, 64, 1, 128]
    - [12, 2054.64]
  - - [4096, 64, 1, 4096]
    - [25, 18436.5]
  - - [1024, 24000, 1, 1536]
    - [72, 36193.2]
  - - [704, 4288, 1, 256]
    - [59, 28601.1]
  - - [5888, 2368, 1, 1280]
    - [72, 34999.1]
  - - [128, 256, 1, 256]
    - [69, 1915.21]
  - - [64, 128, 1, 256]
    - [54, 540.503]
  - - [2368, 5888, 1, 1280]
    - [68, 35000.5]
  - - [5888, 256, 1, 1280]
    - [59, 29357.6]
  - - [1760, 128, 1, 1760]
    - [15, 16900.8]
  - - [4, 5888, 1, 1280]
    - [77, 1925.07]
  - - [704, 128, 1, 128]
    - [9, 1779.99]
  - - [1024, 4, 1, 1280]
    - [79, 842.907]
  - - [2368, 1856, 1, 3328]
    - [69, 31066.2]
  - - [2368, 128, 1, 128]
    - [6, 3002.89]
  - - [2944, 704, 1, 256]
    - [64, 27663.2]
  - - [5056, 128, 1, 128]
    - [7, 4017.34]
  - - [2368, 1024, 1, 3328]
    - [62, 29223.7]
  - - [256, 704, 1, 3328]
    - [73, 12428.2]
  - - [704, 3584, 1, 256]
    - [59, 28255.6]
  - - [1024, 1024, 1, 1024]
    - [70, 25811.1]
  - - [704, 2944, 1, 3328]
    - [65, 30762.3]
  - - [6784, 1024, 1, 128]
    - [56, 5567.89]
  - - [256, 448, 1, 128]
    - [12, 2038.9]
  - - [448, 1024, 1, 3328]
    - [64, 22903.2]
  - - [2944, 1024, 1, 3328]
    - [72, 32957.0]
  - - [2944, 5056, 1, 128]
    - [56, 5766.88]
  - - [2368, 256, 1, 256]
    - [64, 18214.7]
  - - [1408, 6784, 1, 256]
    - [59, 31221.6]
  - - [6784, 1408, 1, 3328]
    - [72, 33889.1]
  - - [4288, 6784, 1, 128]
    - [56, 5807.25]
  - - [704, 64, 1, 256]
    - [64, 2393.02]
  - - [5888, 4, 1, 1280]
    - [77, 1967.79]
  - - [256, 2368, 1, 3328]
    - [69, 21801.0]
  - - [6784, 2944, 1, 1280]
    - [72, 35487.2]
  - - [4288, 1856, 1, 128]
    - [56, 5588.61]
  - - [1856, 2944, 1, 128]
    - [56, 5601.48]
  - - [6784, 448, 1, 128]
    - [56, 5203.61]
  - - [64, 3584, 1, 128]
    - [7, 2801.54]
  - - [448, 5056, 1, 1280]
    - [64, 29086.2]
  - - [2368, 1856, 1, 128]
    - [56, 4177.64]
  - - [64, 2944, 1, 3328]
    - [30, 17753.4]
  - - [4288, 704, 1, 256]
    - [63, 27959.5]
  - - [256, 3584, 1, 128]
    - [56, 4005.47]
  - - [5888, 704, 1, 256]
    - [69, 29136.7]
  - - [3584, 1024, 1, 128]
    - [56, 5415.75]
  - - [256, 5888, 1, 3328]
    - [59, 29515.1]
  - - [1408, 4288, 1, 3328]
    - [68, 34514.3]
  - - [6784, 4288, 1, 256]
    - [72, 32817.7]
  - - [4288, 256, 1, 128]
    - [56, 4125.34]
  - - [5888, 256, 1, 256]
    - [59, 26108.0]
  - - [6784, 1024, 1, 1280]
    - [72, 34181.3]
  - - [5888, 1024, 1, 128]
    - [56, 5563.38]
  - - [1024, 128, 1, 256]
    - [69, 6765.01]
  - - [512, 16, 1, 500000]
    - [3, 13473.7]
  - - [128, 64, 1, 3328]
    - [43, 3850.7]
  - - [448, 64, 1, 256]
    - [39, 1616.75]
  - - [2368, 256, 1, 128]
    - [56, 3370.75]
  - - [6784, 3584, 1, 1280]
    - [72, 36083.2]
  - - [1024, 6784, 1, 1280]
    - [72, 33876.6]
  - - [2944, 64, 1, 1280]
    - [15, 13594.8]
  - - [1408, 2944, 1, 1280]
    - [72, 34413.0]
  - - [256, 1856, 1, 256]
    - [58, 17993.3]
  - - [2048, 800, 1, 2048]
    - [69, 26007.2]
  - - [1408, 2368, 1, 3328]
    - [69, 30540.7]
  - - [2944, 4, 1, 3328]
    - [77, 1876.94]
  - - [128, 1408, 1, 3328]
    - [20, 18175.3]
  - - [2944, 1856, 1, 128]
    - [56, 5572.91]
  - - [256, 2944, 1, 128]
    - [56, 3886.74]
  - - [256, 6784, 1, 128]
    - [56, 4766.25]
  - - [2368, 4, 1, 128]
    - [74, 136.533]
  - - [1408, 256, 1, 3328]
    - [69, 18147.8]
  - - [1856, 4, 1, 128]
    - [74, 167.893]
  - - [5056, 6784, 1, 128]
    - [56, 5813.85]
  - - [4288, 5056, 1, 128]
    - [56, 5784.26]
  - - [1856, 5888, 1, 128]
    - [56, 5721.54]
  - - [2944, 5888, 1, 256]
    - [68, 33126.1]
  - - [3584, 1856, 1, 256]
    - [60, 29370.3]
  - - [4288, 3584, 1, 1280]
    - [72, 36074.3]
  - - [2368, 448, 1, 256]
    - [64, 21519.9]
  - - [4288, 256, 1, 3328]
    - [69, 24737.5]
  - - [1856, 704, 1, 128]
    - [56, 4884.58]
  - - [1408, 64, 1, 256]
    - [64, 4727.19]
  - - [64, 1856, 1, 128]
    - [6, 2117.6]
  - - [4, 256, 1, 128]
    - [74, 23.6592]
  - - [2560, 16, 1, 2560]
    - [34, 7665.03]
  - - [704, 5888, 1, 128]
    - [56, 5483.46]
  - - [6784, 3584, 1, 128]
    - [56, 5789.45]
  - - [1024, 64, 1, 256]
    - [64, 3437.95]
  - - [64, 2368, 1, 256]
    - [64, 7375.91]
  - - [4288, 5056, 1, 3328]
    - [72, 35418.4]
  - - [4, 1856, 1, 1280]
    - [77, 1184.88]
  - - [4288, 128, 1, 128]
    - [12, 3457.41]
  - - [1408, 1408, 1, 128]
    - [56, 4958.1]
  - - [7680, 16, 1, 2560]
    - [13, 11447.3]
  - - [1856, 128, 1, 128]
    - [12, 2852.6]
  - - [5056, 2368, 1, 256]
    - [62, 31663.1]
  - - [4288, 704, 1, 3328]
    - [71, 30781.3]
  - - [448, 3584, 1, 256]
    - [64, 24408.7]
  - - [2368, 64, 1, 1280]
    - [15, 12662.3]
  - - [2368, 1024, 1, 1280]
    - [63, 29358.5]
  - - [2944, 1408, 1, 3328]
    - [72, 34610.5]
  - - [1408, 448, 1, 256]
    - [58, 19408.7]
  - - [1024, 1408, 1, 3328]
    - [60, 28595.3]
  - - [2944, 5888, 1, 1280]
    - [72, 36101.3]
  - - [1408, 4, 1, 1280]
    - [79, 1095.59]
  - - [5888, 3584, 1, 256]
    - [72, 32864.5]
  - - [2368, 5056, 1, 128]
    - [56, 5731.09]
  - - [1408, 1856, 1, 3328]
    - [71, 31333.4]
  - - [4, 4, 1, 3328]
    - [81, 13.1802]
  - - [6784, 1408, 1, 1280]
    - [72, 33414.6]
  - - [4096, 7000, 1, 4096]
    - [68, 36030.7]
  - - [704, 2944, 1, 256]
    - [64, 27925.2]
  - - [4288, 64, 1, 256]
    - [64, 10644.6]
  - - [6784, 5888, 1, 3328]
    - [72, 37058.8]
  - - [2368, 4288, 1, 128]
    - [56, 5717.03]
  - - [64, 4288, 1, 1280]
    - [24, 14244.6]
  - - [6784, 64, 1, 1280]
    - [69, 20492.1]
  - - [3584, 128, 1, 128]
    - [8, 3624.71]
  - - [1024, 6784, 1, 128]
    - [56, 5507.2]
  - - [4, 1856, 1, 128]
    - [74, 101.093]
  - - [1408, 64, 1, 3328]
    - [32, 14145.9]
  - - [6784, 4, 1, 256]
    - [76, 1877.52]
  - - [1408, 1408, 1, 1280]
    - [68, 31021.4]
  - - [16384, 400, 1, 4096]
    - [68, 28168.0]
  - - [256, 2368, 1, 256]
    - [58, 18045.3]
  - - [448, 4288, 1, 3328]
    - [65, 28847.4]
  - - [2368, 1408, 1, 256]
    - [69, 28700.1]
  - - [5888, 5056, 1, 128]
    - [56, 5768.63]
  - - [704, 2368, 1, 256]
    - [64, 25252.7]
  - - [1024, 24000, 1, 2560]
    - [68, 36535.3]
  - - [2944, 448, 1, 1280]
    - [59, 25940.5]
  - - [5888, 2368, 1, 3328]
    - [72, 35329.4]
  - - [5124, 9124, 1, 1760]
    - [62, 36837.5]
  - - [448, 1408, 1, 1280]
    - [64, 22036.1]
  - - [448, 1856, 1, 1280]
    - [71, 23319.6]
  - - [4288, 448, 1, 1280]
    - [63, 28159.8]
  - - [5888, 704, 1, 3328]
    - [71, 31987.8]
  - - [5056, 256, 1, 128]
    - [56, 4830.18]
  - - [1856, 256, 1, 128]
    - [56, 3777.48]
  - - [64, 1408, 1, 128]
    - [9, 1638.4]
  - - [704, 4, 1, 256]
    - [77, 379.419]
  - - [1408, 5888, 1, 128]
    - [56, 5662.53]
  - - [7680, 12000, 1, 2560]
    - [72, 37271.8]
  - - [1408, 1024, 1, 256]
    - [59, 25811.1]
  - - [8192, 400, 1, 2048]
    - [72, 27246.8]
  - - [1024, 1856, 1, 128]
    - [56, 4617.87]
  - - [256, 704, 1, 128]
    - [56, 1560.8]
  - - [2560, 128, 1, 2560]
    - [16, 17578.8]
  - - [448, 1024, 1, 256]
    - [64, 18179.6]
  - - [128, 4, 1, 3328]
    - [81, 364.089]
  - - [5056, 6784, 1, 1280]
    - [72, 36150.9]
  - - [1408, 64, 1, 128]
    - [12, 1647.76]
  - - [1024, 448, 1, 1280]
    - [69, 21588.3]
  - - [704, 5056, 1, 3328]
    - [70, 31117.4]
  - - [128, 5056, 1, 256]
    - [64, 18657.1]
  - - [64, 1024, 1, 3328]
    - [18, 12294.5]
  - - [1856, 4, 1, 3328]
    - [43, 1573.7]
  - - [4, 2944, 1, 128]
    - [74, 264.449]
  - - [2368, 2944, 1, 3328]
    - [68, 34459.4]
  - - [448, 448, 1, 1280]
    - [15, 13886.5]
  - - [2368, 3584, 1, 256]
    - [62, 31252.2]
  - - [1024, 256, 1, 1280]
    - [69, 16561.9]
  - - [5056, 3584, 1, 1280]
    - [72, 35660.8]
  - - [5124, 9124, 1, 4096]
    - [68, 35213.1]
  - - [7680, 48000, 1, 2560]
    - [68, 37745.6]
  - - [448, 4, 1, 3328]
    - [81, 864.315]
  - - [1856, 2944, 1, 1280]
    - [63, 31584.2]
  - - [1024, 48000, 1, 2816]
    - [68, 37511.9]
  - - [128, 1024, 1, 256]
    - [64, 6820.01]
  - - [2944, 1408, 1, 256]
    - [59, 29993.2]
  - - [4288, 1408, 1, 3328]
    - [68, 34535.6]
  - - [3584, 64, 1, 3328]
    - [21, 17894.1]
  - - [5888, 2944, 1, 128]
    - [56, 5676.39]
  - - [2944, 1024, 1, 128]
    - [56, 5192.09]
  - - [4288, 5056, 1, 1280]
    - [72, 35002.4]
  - - [5888, 6784, 1, 1280]
    - [72, 36716.1]
  - - [6784, 5056, 1, 128]
    - [56, 5796.66]
  - - [256, 1024, 1, 3328]
    - [73, 17914.1]
  - - [3584, 4, 1, 256]
    - [77, 1215.24]
  - - [1760, 1600, 1, 1760]
    - [62, 31376.0]
  - - [1856, 64, 1, 3328]
    - [29, 15478.2]
  - - [4, 128, 1, 3328]
    - [81, 364.089]
  - - [5888, 1408, 1, 3328]
    - [68, 35986.5]
  - - [448, 2944, 1, 128]
    - [56, 4271.78]
  - - [2368, 1856, 1, 256]
    - [69, 29391.9]
  - - [256, 5056, 1, 256]
    - [69, 25064.3]
  - - [128, 3584, 1, 128]
    - [7, 3533.11]
  - - [448, 3584, 1, 3328]
    - [69, 26582.1]
  - - [4, 5056, 1, 3328]
    - [80, 2144.85]
  - - [704, 2368, 1, 128]
    - [56, 4698.05]
  - - [5888, 256, 1, 128]
    - [56, 4715.0]
  - - [4, 5056, 1, 128]
    - [74, 352.686]
  - - [448, 256, 1, 256]
    - [64, 6016.42]
  - - [704, 4, 1, 3328]
    - [80, 1294.43]
  - - [1408, 256, 1, 256]
    - [64, 14373.0]
  - - [3584, 1856, 1, 128]
    - [56, 5477.64]
  - - [4288, 4288, 1, 128]
    - [56, 5738.92]
  - - [1856, 1024, 1, 3328]
    - [72, 30718.8]
  - - [128, 5888, 1, 3328]
    - [69, 26762.6]
  - - [1024, 5056, 1, 256]
    - [72, 29584.8]
  - - [5888, 5888, 1, 1280]
    - [72, 36531.7]
  - - [5056, 5888, 1, 128]
    - [56, 5793.01]
  - - [2368, 1408, 1, 3328]
    - [69, 30535.6]
  - - [1024, 48000, 1, 1536]
    - [68, 37144.8]
  - - [5888, 448, 1, 256]
    - [69, 26544.1]
  - - [2560, 3200, 1, 2560]
    - [72, 35545.0]
  - - [5888, 6784, 1, 128]
    - [56, 5778.15]
  - - [6144, 48000, 1, 2048]
    - [68, 36674.8]
  - - [6784, 5056, 1, 1280]
    - [72, 36051.2]
  - - [5056, 704, 1, 1280]
    - [63, 31304.5]
  - - [1024, 48000, 1, 2560]
    - [68, 37489.8]
  - - [4608, 32, 1, 1536]
    - [20, 11415.9]
  - - [1024, 2368, 1, 128]
    - [57, 2428.25]
  - - [128, 704, 1, 256]
    - [64, 4727.19]
  - - [2368, 448, 1, 3328]
    - [69, 23848.7]
  - - [128, 5888, 1, 1280]
    - [69, 25835.3]
  - - [16384, 800, 1, 4096]
    - [68, 32546.7]
  - - [448, 128, 1, 1280]
    - [28, 7791.97]
  - - [6784, 4, 1, 3328]
    - [33, 2196.22]
  - - [5888, 5056, 1, 1280]
    - [72, 36567.9]
  - - [1024, 64, 1, 3328]
    - [38, 11576.6]
  - - [3072, 48000, 1, 1024]
    - [68, 36774.6]
  - - [64, 3584, 1, 1280]
    - [15, 14477.4]
  - - [6784, 1408, 1, 256]
    - [62, 31381.9]
  - - [3584, 5888, 1, 128]
    - [56, 5747.82]
  - - [5056, 5888, 1, 256]
    - [68, 33715.5]
  - - [2368, 1024, 1, 256]
    - [62, 27540.2]
  - - [2944, 1856, 1, 256]
    - [69, 29812.5]
  - - [1856, 6784, 1, 1280]
    - [72, 33985.5]
  - - [64, 5056, 1, 128]
    - [6, 3195.89]
  - - [64, 6784, 1, 128]
    - [8, 3447.55]
  - - [448, 704, 1, 128]
    - [56, 2535.82]
  - - [4, 1024, 1, 128]
    - [74, 93.2918]
  - - [4288, 3584, 1, 256]
    - [68, 32829.2]
  - - [1408, 704, 1, 128]
    - [56, 4417.75]
  - - [64, 256, 1, 3328]
    - [40, 5788.32]
  - - [6784, 448, 1, 3328]
    - [63, 31081.6]
  - - [5056, 1856, 1, 1280]
    - [72, 32698.4]
  - - [1408, 1024, 1, 3328]
    - [63, 28255.1]
  - - [2368, 256, 1, 3328]
    - [69, 21786.8]
  - - [5888, 3584, 1, 1280]
    - [72, 35730.2]
  - - [1856, 3584, 1, 3328]
    - [68, 33122.2]
  - - [5888, 128, 1, 1280]
    - [64, 25821.5]
  - - [1024, 2944, 1, 256]
    - [60, 27289.7]
  - - [448, 6784, 1, 1280]
    - [59, 30363.9]
  - - [256, 3584, 1, 1280]
    - [65, 25387.1]
  - - [704, 5056, 1, 256]
    - [59, 29261.8]
  - - [3584, 1024, 1, 3328]
    - [63, 32474.9]
  - - [2944, 1856, 1, 1280]
    - [59, 31575.6]
  - - [128, 256, 1, 128]
    - [9, 788.403]
  - - [5056, 256, 1, 256]
    - [69, 25449.3]
  - - [2944, 4288, 1, 3328]
    - [72, 34596.2]
  - - [2368, 3584, 1, 3328]
    - [72, 33120.4]
  - - [2944, 704, 1, 1280]
    - [71, 30139.7]
  - - [128, 4, 1, 256]
    - [77, 79.9219]
  - - [2944, 3584, 1, 1280]
    - [72, 33626.3]
  - - [1856, 5888, 1, 1280]
    - [72, 34668.4]
  - - [256, 256, 1, 1280]
    - [23, 8473.34]
  - - [2048, 3200, 1, 2048]
    - [68, 31573.2]
  - - [4288, 1408, 1, 256]
    - [62, 30593.8]
  - - [3584, 64, 1, 256]
    - [64, 10874.1]
  - - [64, 1856, 1, 3328]
    - [15, 16554.2]
  - - [256, 1408, 1, 128]
    - [57, 2624.42]
  - - [5888, 1408, 1, 128]
    - [56, 5595.06]
  - - [4288, 2368, 1, 1280]
    - [59, 32939.1]
  - - [4, 4288, 1, 256]
    - [77, 1226.51]
  - - [256, 4288, 1, 128]
    - [56, 4044.59]
  - - [2048, 128, 1, 2048]
    - [31, 15330.4]
  - - [256, 128, 1, 3328]
    - [55, 8668.67]
  - - [512, 8, 1, 500000]
    - [2, 7869.66]
  - - [6784, 2368, 1, 256]
    - [63, 32149.1]
  - - [5888, 128, 1, 128]
    - [8, 4077.3]
  - - [1024, 24000, 1, 2816]
    - [68, 36685.7]
  - - [7680, 5984, 1, 2560]
    - [72, 36765.9]
  - - [4288, 1856, 1, 256]
    - [62, 31057.7]
  - - [1856, 256, 1, 3328]
    - [69, 23565.6]
  - - [1856, 2944, 1, 256]
    - [59, 30004.3]
  - - [5056, 1024, 1, 128]
    - [56, 5534.49]
  - - [64, 5888, 1, 1280]
    - [64, 17629.6]
  - - [1760, 800, 1, 1760]
    - [63, 29389.0]
  - - [6784, 256, 1, 128]
    - [56, 4824.18]
  - - [5888, 704, 1, 128]
    - [56, 5428.48]
  - - [1408, 2368, 1, 128]
    - [56, 5369.53]
  - - [1024, 4288, 1, 1280]
    - [60, 30485.8]
  - - [2368, 5056, 1, 3328]
    - [72, 35170.0]
  - - [448, 4, 1, 128]
    - [74, 42.477]
  - - [4, 256, 1, 3328]
    - [80, 628.759]
  - - [4288, 1024, 1, 3328]
    - [63, 31091.4]
  - - [6144, 48000, 1, 2560]
    - [68, 37503.0]
  - - [1024, 5056, 1, 3328]
    - [68, 35328.1]
  - - [1024, 1856, 1, 3328]
    - [68, 30721.8]
  - - [704, 704, 1, 1280]
    - [69, 23759.9]
  - - [128, 2368, 1, 1280]
    - [20, 14842.1]
  - - [1408, 128, 1, 3328]
    - [20, 17840.1]
  - - [3584, 256, 1, 1280]
    - [70, 25586.2]
  - - [4, 128, 1, 128]
    - [74, 11.9156]
  - - [5888, 64, 1, 1280]
    - [64, 17864.6]
  - - [3584, 128, 1, 1280]
    - [69, 21748.2]
  - - [4, 256, 1, 1280]
    - [80, 304.819]
  - - [128, 704, 1, 3328]
    - [23, 14417.9]
  - - [4288, 6784, 1, 256]
    - [62, 33331.8]
  - - [3584, 2944, 1, 3328]
    - [72, 34097.9]
  - - [128, 1856, 1, 256]
    - [64, 11057.7]
  - - [64, 4288, 1, 256]
    - [64, 9571.47]
  - - [4, 3584, 1, 3328]
    - [33, 2006.32]
  - - [64, 4, 1, 3328]
    - [81, 192.753]
  - - [4, 64, 1, 3328]
    - [43, 184.409]
  - - [5888, 2944, 1, 256]
    - [72, 32988.2]
  - - [1856, 64, 1, 256]
    - [64, 6180.63]
  - - [5056, 128, 1, 1280]
    - [64, 22461.4]
  - - [448, 4288, 1, 1280]
    - [65, 28101.8]
  - - [448, 1856, 1, 3328]
    - [70, 24155.0]
  - - [1024, 4288, 1, 128]
    - [56, 5396.93]
  - - [4, 1024, 1, 256]
    - [77, 540.503]
  - - [5056, 4288, 1, 256]
    - [62, 32590.2]
  - - [1024, 448, 1, 256]
    - [58, 16922.3]
  - - [1024, 3584, 1, 256]
    - [63, 28539.6]
  - - [2944, 128, 1, 1280]
    - [64, 17984.5]
  - - [2048, 32, 1, 2048]
    - [52, 8570.74]
  - - [64, 256, 1, 256]
    - [50, 1043.36]
  - - [1408, 4, 1, 128]
    - [74, 129.658]
  - - [128, 2368, 1, 128]
    - [6, 3007.54]
  - - [256, 704, 1, 1280]
    - [69, 11710.0]
  - - [64, 2368, 1, 128]
    - [9, 2325.98]
  - - [6784, 6784, 1, 3328]
    - [72, 37634.3]
  - - [448, 5888, 1, 1280]
    - [69, 28118.0]
  - - [5056, 448, 1, 128]
    - [56, 5084.73]
  - - [4288, 704, 1, 1280]
    - [63, 30661.8]
  - - [3584, 2944, 1, 128]
    - [56, 5612.39]
  - - [6784, 256, 1, 1280]
    - [69, 28318.2]
  - - [256, 2944, 1, 1280]
    - [64, 26002.4]
  - - [64, 4288, 1, 128]
    - [12, 2735.77]
  - - [2368, 5888, 1, 3328]
    - [72, 35341.7]
  - - [4, 64, 1, 256]
    - [77, 43.1158]
  - - [704, 1024, 1, 3328]
    - [64, 25758.4]
  - - [2368, 1856, 1, 1280]
    - [63, 30825.3]
  - - [448, 5056, 1, 3328]
    - [69, 29494.5]
  - - [128, 448, 1, 128]
    - [6, 1211.23]
  - - [128, 6784, 1, 256]
    - [64, 20135.7]
  - - [3584, 4288, 1, 128]
    - [56, 5724.06]
  - - [64, 448, 1, 128]
    - [6, 603.621]
  - - [5888, 4288, 1, 3328]
    - [72, 36251.5]
  - - [2368, 704, 1, 256]
    - [64, 25282.6]
  - - [256, 1856, 1, 3328]
    - [69, 23671.4]
  - - [1856, 128, 1, 256]
    - [64, 11832.2]
  - - [6784, 128, 1, 128]
    - [7, 4080.36]
  - - [3584, 1408, 1, 128]
    - [56, 5361.25]
  - - [1856, 5056, 1, 1280]
    - [72, 32698.4]
  - - [2944, 1024, 1, 1280]
    - [68, 32334.2]
  - - [5056, 4, 1, 256]
    - [76, 1568.89]
  - - [3584, 5888, 1, 3328]
    - [72, 36082.8]
  - - [2368, 4288, 1, 256]
    - [59, 31546.4]
  - - [1024, 2368, 1, 3328]
    - [63, 29536.1]
  - - [64, 704, 1, 3328]
    - [53, 10398.5]
  - - [704, 1408, 1, 256]
    - [64, 24399.6]
  - - [4096, 128, 1, 4096]
    - [25, 20152.8]
  - - [1024, 3584, 1, 1280]
    - [60, 32087.6]
  - - [4288, 5888, 1, 3328]
    - [72, 36207.8]
  - - [4288, 4, 1, 1280]
    - [77, 1707.2]
  - - [4608, 16, 1, 1536]
    - [27, 7509.7]
  - - [5888, 64, 1, 128]
    - [6, 3185.9]
  - - [4, 5888, 1, 128]
    - [74, 416.389]
  - - [1024, 2944, 1, 3328]
    - [72, 32643.9]
  - - [6784, 1856, 1, 256]
    - [63, 31300.5]
  - - [2048, 64, 1, 2048]
    - [24, 12416.1]
  - - [256, 6784, 1, 1280]
    - [64, 28196.1]
  - - [1856, 3584, 1, 256]
    - [62, 31051.9]
  - - [128, 448, 1, 3328]
    - [32, 11608.3]
  - - [6784, 1856, 1, 128]
    - [56, 5642.28]
  - - [4, 448, 1, 256]
    - [77, 273.067]
  - - [5056, 128, 1, 256]
    - [64, 18955.9]
  - - [512, 24000, 1, 2816]
    - [72, 36306.5]
  - - [256, 5888, 1, 1280]
    - [59, 28857.0]
  - - [4, 128, 1, 1280]
    - [43, 160.627]
  - - [16384, 1600, 1, 4096]
    - [68, 35333.7]
  - - [6784, 128, 1, 1280]
    - [65, 24449.9]
  - - [64, 1408, 1, 256]
    - [64, 4746.64]
  - - [2368, 1408, 1, 128]
    - [56, 5384.44]
  - - [1856, 448, 1, 256]
    - [64, 20746.7]
  - - [1408, 1024, 1, 128]
    - [56, 4629.94]
  - - [128, 64, 1, 128]
    - [9, 199.349]
  - - [6784, 3584, 1, 3328]
    - [72, 36395.1]
  - - [1760, 7000, 1, 1760]
    - [63, 35240.1]
  - - [2944, 64, 1, 3328]
    - [30, 18217.6]
  - - [64, 64, 1, 128]
    - [10, 89.4689]
  - - [2368, 5056, 1, 1280]
    - [68, 34837.3]
  - - [64, 4, 1, 1280]
    - [43, 84.0205]
  - - [1408, 2368, 1, 1280]
    - [64, 30233.1]
  - - [128, 1408, 1, 1280]
    - [20, 13182.1]
  - - [256, 64, 1, 3328]
    - [36, 5691.64]
  - - [704, 4288, 1, 128]
    - [56, 5235.78]
  - - [128, 1856, 1, 3328]
    - [15, 19416.2]
  - - [2944, 2944, 1, 256]
    - [59, 31250.5]
  - - [2944, 4, 1, 1280]
    - [77, 1720.69]
  - - [5888, 4, 1, 256]
    - [76, 1712.87]
  - - [6784, 256, 1, 256]
    - [69, 25878.7]
  - - [256, 5056, 1, 3328]
    - [64, 28886.5]
  - - [128, 4288, 1, 1280]
    - [64, 19247.8]
  - - [5056, 1856, 1, 128]
    - [56, 5689.93]
  - - [5056, 1024, 1, 3328]
    - [68, 35224.1]
  - - [128, 128, 1, 256]
    - [64, 1023.0]
  - - [1760, 64, 1, 1760]
    - [24, 13008.3]
  - - [4288, 3584, 1, 3328]
    - [72, 36327.9]
  - - [448, 704, 1, 3328]
    - [64, 15783.8]
  - - [448, 448, 1, 128]
    - [12, 2474.96]
  - - [1024, 2368, 1, 1280]
    - [60, 28808.1]
  - - [1856, 704, 1, 3328]
    - [69, 29074.9]
  - - [4, 2368, 1, 128]
    - [74, 214.972]
  - - [5888, 6784, 1, 3328]
    - [72, 37067.3]
  - - [704, 4288, 1, 1280]
    - [59, 30363.1]
  - - [704, 256, 1, 256]
    - [64, 9227.47]
  - - [1024, 48000, 1, 2048]
    - [68, 35621.7]
  - - [4288, 1024, 1, 128]
    - [56, 5459.85]
  - - [3136, 2048, 1, 128]
    - [82, 33858.5]
  - - [3025, 64, 1, 144]
    - [83, 9547.4]
  - - [3025, 256, 1, 64]
    - [84, 15391.8]
  - - [196, 256, 1, 2304]
    - [87, 10606.0]
  - - [784, 128, 1, 512]
    - [86, 12118.0]
  - - [49, 512, 1, 4608]
    - [88, 8961.67]
  - - [3025, 64, 1, 256]
    - [86, 14576.9]
  - - [50176, 63, 1, 784]
    - [85, 17018.9]
  - - [784, 512, 1, 128]
    - [84, 14764.4]
  - - [3025, 64, 1, 64]
    - [86, 7120.92]
  - - [49, 512, 1, 1024]
    - [92, 3964.52]
  - - [196, 256, 1, 576]
    - [91, 8705.23]
  - - [784, 512, 1, 32]
    - [89, 7298.33]
  - - [784, 128, 1, 128]
    - [86, 7057.72]
  - - [50176, 63, 1, 196]
    - [90, 21483.1]
- null
