library/src/blas3/Tensile/Logic/asm_full/aquavanjaram942/aquavanjaram942_Cijk_Alik_Bljk_DB.yaml
- {MinimumRequiredVersion: 4.7.2}
- aquavanjaram942
- gfx942
- [Device 0049]
    SolutionIndex: 0
    SolutionNameMin: Cijk_Alik_Bljk_DB_MT128x128x16_MI16x16x4x1_SN_AMAS3_DTVA0_GLS0_LBSPP128_LPA4_LPB4_LRVW2_NTC2_NTD3_NEPBS8_NLCA1_NLCB1_ONLL1_SVW2_TT2_128_TLDS1_UMLDSA1_UMLDSB1_VW2_WG64_4_1_WGM18
    SolutionIndex: 1
    SolutionNameMin: Cijk_Alik_Bljk_DB_MT128x64x16_MI16x16x4x1_SN_AMAS0_GLS0_LBSPP0_LPA1_LPB1_LRVW1_MIAV1_NEPBS0_PLR5_SU32_SUS512_SVW1_TT2_64_TLDS0_UMLDSA0_UMLDSB0_VW1_WG64_4_1_WGM12
    SolutionIndex: 2
    SolutionNameMin: Cijk_Alik_Bljk_DB_MT128x64x16_MI16x16x4x1_SN_AMAS0_GLS0_LBSPP0_LPA1_LPB1_LRVW1_MIAV1_NEPBS4_PLR5_SU0_SUS0_SVW1_TT4_32_TLDS0_UMLDSA0_UMLDSB0_VW1_WG32_8_1_WGM30
    SolutionIndex: 3
    SolutionNameMin: Cijk_Alik_Bljk_DB_MT128x128x16_MI16x16x4x1_SN_DTVA1_GRVW2_GLS0_NEPBS4_NLCA2_SU0_SUS0_TT2_128_WG64_4_1_WGM30
    SolutionIndex: 4
    SolutionNameMin: Cijk_Alik_Bljk_DB_MT128x128x16_MI16x16x4x1_SN_DTVA1_GRVW2_GLS0_NEPBS8_NLCA2_SU4_SUS512_TT2_128_WG64_4_1_WGM30
    SolutionIndex: 5
    SolutionNameMin: Cijk_Alik_Bljk_DB_MT128x128x16_MI16x16x4x1_SN_DTVA1_GRVW2_GLS0_NEPBS4_NLCA2_SU4_SUS512_TT2_128_WG64_4_1_WGM36
    SolutionIndex: 6
    SolutionNameMin: Cijk_Alik_Bljk_DB_MT128x128x16_MI16x16x4x1_SN_DTVA1_GRVW2_GLS1_NEPBS8_NLCA2_SU32_SUS512_TT2_128_WG64_4_1_WGM36
    SolutionIndex: 7
    SolutionNameMin: Cijk_Alik_Bljk_DB_MT128x128x16_MI16x16x4x1_SN_DTVA1_GRVW2_GLS1_NEPBS16_NLCA2_SU32_SUS512_TT2_128_WG64_4_1_WGM36
    SolutionIndex: 8
    SolutionNameMin: Cijk_Alik_Bljk_DB_MT128x128x16_MI16x16x4x1_SN_MIAV0_NEPBS8_SU4_TT4_64_WGM30
    SolutionIndex: 9
    SolutionNameMin: Cijk_Alik_Bljk_DB_MT128x128x16_MI16x16x4x1_SN_MIAV0_NEPBS16_SU4_TT4_64_WGM18
    SolutionIndex: 10
    SolutionNameMin: Cijk_Alik_Bljk_DB_MT128x192x16_MI16x16x4x1_SN_MIAV0_NEPBS8_SU4_TT4_96_WGM30
    SolutionIndex: 11
    SolutionNameMin: Cijk_Alik_Bljk_DB_MT128x128x16_MI16x16x4x1_SN_MIAV1_NEPBS16_SU32_TT4_64_WGM36
    SolutionIndex: 12
    SolutionNameMin: Cijk_Alik_Bljk_DB_MT128x256x16_MI16x16x4x1_SN_MIAV0_NEPBS8_SU4_TT4_128_WGM24
    SolutionIndex: 13
    SolutionNameMin: Cijk_Alik_Bljk_DB_MT128x128x16_MI16x16x4x1_SN_MIAV1_NEPBS0_SU4_TT4_64_WGM42
    SolutionIndex: 14
    SolutionNameMin: Cijk_Alik_Bljk_DB_MT128x64x16_MI16x16x4x1_SN_LBSPP0_LPA1_LPB1_LRVW1_NEPBS0_PLR5_SU4_SUS512_TT2_64_TLDS0_UMLDSA0_UMLDSB0_WG64_4_1_WGM30
    SolutionIndex: 15
    SolutionNameMin: Cijk_Alik_Bljk_DB_MT64x64x16_MI16x16x4x1_SN_LBSPP128_LPA4_LPB4_LRVW2_NEPBS4_PLR5_SU0_SUS0_TT2_32_TLDS1_UMLDSA1_UMLDSB1_WG32_8_1_WGM30
    SolutionIndex: 16
    SolutionNameMin: Cijk_Alik_Bljk_DB_MT64x32x32_MI16x16x4x1_SN_AMAS0_DTVA1_EPS1_LBSPP256_LPA4_LPB4_LRVW2_NEPBS4_NLCA4_PLR9_SU4_SUS512_SVW1_TT1_32_TLDS1_UMLDSA1_UMLDSB1_VW1_WG64_4_1_WGM30
    SolutionIndex: 17
    SolutionNameMin: Cijk_Alik_Bljk_DB_MT64x64x32_MI16x16x4x1_SN_AMAS0_DTVA1_EPS1_LBSPP256_LPA4_LPB4_LRVW2_NEPBS0_NLCA4_PLR9_SU4_SUS512_SVW1_TT1_64_TLDS1_UMLDSA1_UMLDSB1_VW1_WG64_4_1_WGM30
    SolutionIndex: 18
    SolutionNameMin: Cijk_Alik_Bljk_DB_MT64x128x16_MI16x16x4x1_SN_AMAS3_DTVA0_EPS0_LBSPP0_LPA2_LPB2_LRVW1_NEPBS0_NLCA1_PLR5_SU4_SUS512_SVW2_TT4_32_TLDS0_UMLDSA0_UMLDSB0_VW2_WG16_16_1_WGM30
    SolutionIndex: 19
    SolutionNameMin: Cijk_Alik_Bljk_DB_MT128x16x32_MI16x16x4x1_SN_AMAS3_BL1_EPS1_GSU113_NEPBS8_NLCA1_SS0_SU32_SUS256_SVW1_TT2_16_VW2_WG64_4_1
    SolutionIndex: 20
    SolutionNameMin: Cijk_Alik_Bljk_DB_MT128x32x32_MI16x16x4x1_SN_AMAS3_BL0_EPS0_GSU225_NEPBS8_NLCA1_SS0_SU0_SUS0_SVW1_TT2_32_VW2_WG64_4_1
    SolutionIndex: 21
    SolutionNameMin: Cijk_Alik_Bljk_DB_MT128x16x32_MI16x16x4x1_SN_AMAS0_BL0_EPS0_GSU450_NEPBS0_NLCA1_SS0_SU4_SUS256_SVW1_TT2_16_VW1_WG64_4_1
    SolutionIndex: 22
    SolutionNameMin: Cijk_Alik_Bljk_DB_MT128x16x32_MI16x16x4x1_SN_AMAS3_BL0_EPS0_GSU450_NEPBS8_NLCA1_SS1_SU0_SUS0_SVW1_TT2_16_VW2_WG64_4_1
    SolutionIndex: 23
    SolutionNameMin: Cijk_Alik_Bljk_DB_MT128x16x32_MI16x16x4x1_SN_AMAS0_BL0_EPS0_GSU1350_NEPBS8_NLCA1_SS1_SU0_SUS0_SVW1_TT2_16_VW1_WG64_4_1
    SolutionIndex: 24
    SolutionNameMin: Cijk_Alik_Bljk_DB_MT128x16x32_MI16x16x4x1_SN_AMAS3_BL0_EPS0_GSU225_NEPBS8_NLCA1_SS1_SU4_SUS256_SVW1_TT2_16_VW2_WG64_4_1
    SolutionIndex: 25
    SolutionNameMin: Cijk_Alik_Bljk_DB_MT128x256x16_MI16x16x4x1_SN_AMAS0_BL0_EPS0_GSU113_NEPBS4_SS1_SU4_SUS256_SVW1_TT2_256_VW1_WG64_4_1
    SolutionIndex: 26
    SolutionNameMin: Cijk_Alik_Bljk_DB_MT256x128x16_MI16x16x4x1_SN_AMAS0_BL0_EPS0_GSU113_NEPBS4_SS1_SU4_SUS256_SVW1_TT4_128_VW1_WG64_4_1
    SolutionIndex: 27
    SolutionNameMin: Cijk_Alik_Bljk_DB_MT256x128x16_MI16x16x4x1_SN_AMAS0_BL0_EPS0_GSU113_NEPBS4_SS1_SU0_SUS0_SVW1_TT4_128_VW1_WG64_4_1
    SolutionIndex: 28
    SolutionNameMin: Cijk_Alik_Bljk_DB_MT256x128x16_MI16x16x4x1_SN_AMAS0_BL0_EPS0_GSU113_NEPBS2_SS1_SU32_SUS256_SVW1_TT4_128_VW1_WG64_4_1
    SolutionIndex: 29
    SolutionNameMin: Cijk_Alik_Bljk_DB_MT128x256x16_MI16x16x4x1_SN_AMAS0_BL0_EPS0_GSU113_NEPBS4_SS1_SU0_SUS0_SVW1_TT4_128_VW1_WG32_8_1
    SolutionIndex: 30
    SolutionNameMin: Cijk_Alik_Bljk_DB_MT64x32x16_MI16x16x4x1_SN_AMAS0_GRVW2_LBSPP128_LPA4_LPB4_LRVW2_NEPBS0_PLR5_SVW1_TT1_32_TLDS1_UMLDSA1_UMLDSB1_VW1_WG64_4_1_WGM6
    SolutionIndex: 31
    SolutionNameMin: Cijk_Alik_Bljk_DB_MT32x64x16_MI16x16x4x1_SN_AMAS0_GRVW1_LBSPP128_LPA4_LPB4_LRVW2_NEPBS0_PLR5_SVW1_TT2_16_TLDS1_UMLDSA1_UMLDSB1_VW1_WG16_16_1_WGM6
    SolutionIndex: 32
    SolutionNameMin: Cijk_Alik_Bljk_DB_MT64x64x16_MI16x16x4x1_SN_AMAS0_GRVW1_LBSPP128_LPA1_LPB1_LRVW1_NEPBS0_PLR5_SVW1_TT2_32_TLDS1_UMLDSA1_UMLDSB1_VW1_WG32_8_1_WGM12
    SolutionIndex: 33
    SolutionNameMin: Cijk_Alik_Bljk_DB_MT64x64x16_MI16x16x4x1_SN_AMAS0_GRVW1_LBSPP0_LPA1_LPB1_LRVW1_NEPBS4_PLR5_SVW1_TT1_64_TLDS0_UMLDSA0_UMLDSB0_VW1_WG64_4_1_WGM12
    SolutionIndex: 34
    SolutionNameMin: Cijk_Alik_Bljk_DB_MT64x64x16_MI16x16x4x1_SN_AMAS0_GRVW1_LBSPP128_LPA1_LPB1_LRVW1_NEPBS4_PLR5_SVW1_TT2_32_TLDS1_UMLDSA1_UMLDSB1_VW1_WG32_8_1_WGM12
    SolutionIndex: 35
    SolutionNameMin: Cijk_Alik_Bljk_DB_MT64x64x16_MI16x16x4x1_SN_AMAS0_GRVW1_LBSPP0_LPA1_LPB1_LRVW1_NEPBS0_PLR5_SVW1_TT2_32_TLDS0_UMLDSA0_UMLDSB0_VW1_WG32_8_1_WGM6
    SolutionIndex: 36
    SolutionNameMin: Cijk_Alik_Bljk_DB_MT64x64x16_MI16x16x4x1_SN_AMAS3_GRVW1_LBSPP128_LPA1_LPB1_LRVW1_NEPBS0_PLR5_SVW2_TT2_32_TLDS1_UMLDSA1_UMLDSB1_VW2_WG32_8_1_WGM6
    SolutionIndex: 37
    SolutionNameMin: Cijk_Alik_Bljk_DB_MT128x64x16_MI16x16x4x1_SN_AMAS0_GRVW1_LBSPP128_LPA1_LPB1_LRVW1_NEPBS0_PLR5_SVW1_TT2_64_TLDS1_UMLDSA1_UMLDSB1_VW1_WG64_4_1_WGM6
    SolutionIndex: 38
    SolutionNameMin: Cijk_Alik_Bljk_DB_MT128x64x16_MI16x16x4x1_SN_AMAS0_GRVW1_LBSPP128_LPA1_LPB1_LRVW1_NEPBS0_PLR5_SVW1_TT2_64_TLDS1_UMLDSA1_UMLDSB1_VW1_WG64_4_1_WGM12
    SolutionIndex: 39
    SolutionNameMin: Cijk_Alik_Bljk_DB_MT128x64x16_MI16x16x4x1_SN_AMAS0_GRVW1_LBSPP128_LPA1_LPB1_LRVW1_NEPBS0_PLR5_SVW1_TT4_32_TLDS1_UMLDSA1_UMLDSB1_VW1_WG32_8_1_WGM12
    SolutionIndex: 40
    SolutionNameMin: Cijk_Alik_Bljk_DB_MT128x64x16_MI16x16x4x1_SN_AMAS0_GRVW1_LBSPP128_LPA4_LPB4_LRVW2_NEPBS0_PLR5_SVW1_TT4_32_TLDS1_UMLDSA1_UMLDSB1_VW1_WG32_8_1_WGM12
    SolutionIndex: 41
    SolutionNameMin: Cijk_Alik_Bljk_DB_MT32x64x32_MI16x16x4x1_SN_AMAS3_GRVW1_LBSPP256_LPA1_LPB1_LRVW1_NEPBS4_PLR9_SVW2_TT2_16_TLDS1_UMLDSA1_UMLDSB1_VW2_WG16_16_1_WGM6
    SolutionIndex: 42
    SolutionNameMin: Cijk_Alik_Bljk_DB_MT128x64x16_MI16x16x4x1_SN_AMAS0_GRVW1_LBSPP0_LPA1_LPB1_LRVW1_NEPBS0_PLR5_SVW1_TT2_64_TLDS0_UMLDSA0_UMLDSB0_VW1_WG64_4_1_WGM6
    SolutionIndex: 43
    SolutionNameMin: Cijk_Alik_Bljk_DB_MT64x32x32_MI16x16x4x1_SN_AMAS3_GRVW1_LBSPP256_LPA1_LPB1_LRVW1_NEPBS0_PLR9_SVW2_TT2_16_TLDS1_UMLDSA1_UMLDSB1_VW2_WG32_8_1_WGM6
    SolutionIndex: 44
    SolutionNameMin: Cijk_Alik_Bljk_DB_MT64x64x16_MI16x16x4x1_SN_AMAS0_GRVW2_LBSPP0_LPA1_LPB1_LRVW1_NEPBS4_PLR5_SVW1_TT2_32_TLDS0_UMLDSA0_UMLDSB0_VW1_WG32_8_1_WGM6
    SolutionIndex: 45
    SolutionNameMin: Cijk_Alik_Bljk_DB_MT64x64x16_MI16x16x4x1_SN_AMAS3_GRVW2_LBSPP0_LPA2_LPB2_LRVW1_NEPBS4_PLR5_SVW2_TT2_32_TLDS0_UMLDSA0_UMLDSB0_VW2_WG32_8_1_WGM6
    SolutionIndex: 46
    SolutionNameMin: Cijk_Alik_Bljk_DB_MT32x64x16_MI16x16x4x1_SN_AMAS3_GRVW1_LBSPP128_LPA4_LPB4_LRVW2_NEPBS0_PLR5_SVW2_TT2_16_TLDS1_UMLDSA1_UMLDSB1_VW2_WG16_16_1_WGM6
    SolutionIndex: 47
    SolutionNameMin: Cijk_Alik_Bljk_DB_MT32x64x16_MI16x16x4x1_SN_AMAS3_GRVW2_LBSPP128_LPA4_LPB4_LRVW2_NEPBS0_PLR5_SVW2_TT2_16_TLDS1_UMLDSA1_UMLDSB1_VW2_WG16_16_1_WGM12
    SolutionIndex: 48
    SolutionNameMin: Cijk_Alik_Bljk_DB_MT64x64x16_MI16x16x4x1_SN_AMAS3_GRVW2_LBSPP0_LPA2_LPB2_LRVW1_NEPBS4_PLR5_SVW2_TT2_32_TLDS0_UMLDSA0_UMLDSB0_VW2_WG32_8_1_WGM6
    SolutionIndex: 49
    SolutionNameMin: Cijk_Alik_Bljk_DB_MT64x64x16_MI16x16x4x1_SN_AMAS3_GRVW1_LBSPP128_LPA1_LPB1_LRVW1_NEPBS4_PLR5_SVW2_TT2_32_TLDS1_UMLDSA1_UMLDSB1_VW2_WG32_8_1_WGM6
    SolutionIndex: 50
    SolutionNameMin: Cijk_Alik_Bljk_DB_MT64x64x16_MI16x16x4x1_SN_AMAS0_GRVW1_LBSPP128_LPA4_LPB4_LRVW2_NEPBS0_PLR5_SVW1_TT2_32_TLDS1_UMLDSA1_UMLDSB1_VW1_WG32_8_1_WGM12
    SolutionIndex: 51
    SolutionNameMin: Cijk_Alik_Bljk_DB_MT64x64x16_MI16x16x4x1_SN_AMAS3_GRVW1_LBSPP128_LPA1_LPB1_LRVW1_NEPBS0_PLR5_SVW2_TT2_32_TLDS1_UMLDSA1_UMLDSB1_VW2_WG32_8_1_WGM12
    SolutionIndex: 52
    SolutionNameMin: Cijk_Alik_Bljk_DB_MT64x64x16_MI16x16x4x1_SN_AMAS3_GRVW2_LBSPP0_LPA2_LPB2_LRVW1_NEPBS0_PLR5_SVW2_TT2_32_TLDS0_UMLDSA0_UMLDSB0_VW2_WG32_8_1_WGM6
    SolutionIndex: 53
    SolutionNameMin: Cijk_Alik_Bljk_DB_MT64x64x32_MI16x16x4x1_SN_AMAS0_GRVW1_LBSPP0_LPA1_LPB1_LRVW1_NEPBS0_PLR9_SVW1_TT2_32_TLDS0_UMLDSA0_UMLDSB0_VW1_WG32_8_1_WGM12
    SolutionIndex: 54
    SolutionNameMin: Cijk_Alik_Bljk_DB_MT128x64x16_MI16x16x4x1_SN_AMAS3_GRVW2_LBSPP0_LPA2_LPB2_LRVW1_NEPBS0_PLR5_SVW2_TT2_64_TLDS0_UMLDSA0_UMLDSB0_VW2_WG64_4_1_WGM6
    SolutionIndex: 55
    SolutionNameMin: Cijk_Alik_Bljk_DB_MT128x64x16_MI16x16x4x1_SN_AMAS3_GRVW2_LBSPP0_LPA2_LPB2_LRVW1_NEPBS0_PLR5_SVW2_TT4_32_TLDS0_UMLDSA0_UMLDSB0_VW2_WG32_8_1_WGM12
    SolutionIndex: 56
    SolutionNameMin: Cijk_Alik_Bljk_DB_MT128x64x16_MI16x16x4x1_SN_AMAS3_GRVW2_LBSPP0_LPA2_LPB2_LRVW1_NEPBS0_PLR5_SVW2_TT2_64_TLDS0_UMLDSA0_UMLDSB0_VW2_WG64_4_1_WGM12
    SolutionIndex: 57
    SolutionNameMin: Cijk_Alik_Bljk_DB_MT128x64x16_MI16x16x4x1_SN_AMAS3_GRVW2_LBSPP0_LPA2_LPB2_LRVW1_NEPBS0_PLR5_SVW2_TT4_32_TLDS0_UMLDSA0_UMLDSB0_VW2_WG32_8_1_WGM6
    SolutionIndex: 58
    SolutionNameMin: Cijk_Alik_Bljk_DB_MT128x64x16_MI16x16x4x1_SN_AMAS0_GRVW2_LBSPP0_LPA1_LPB1_LRVW1_NEPBS0_PLR1_SVW1_TT2_64_TLDS0_UMLDSA0_UMLDSB0_VW1_WG64_4_1_WGM12
    SolutionIndex: 59
    SolutionNameMin: Cijk_Alik_Bljk_DB_MT64x64x16_MI16x16x4x1_SN_AMAS3_GRVW2_LBSPP128_LPA2_LPB2_LRVW1_NEPBS0_PLR5_SVW2_TT2_32_TLDS1_UMLDSA1_UMLDSB1_VW2_WG32_8_1_WGM12
    SolutionIndex: 60
    SolutionNameMin: Cijk_Alik_Bljk_DB_MT128x64x16_MI16x16x4x1_SN_AMAS3_GRVW2_LBSPP128_LPA4_LPB4_LRVW2_NEPBS0_PLR5_SVW2_TT4_32_TLDS1_UMLDSA1_UMLDSB1_VW2_WG32_8_1_WGM12
    SolutionIndex: 61
    SolutionNameMin: Cijk_Alik_Bljk_DB_MT64x32x32_MI16x16x4x1_SN_AMAS3_GRVW2_LBSPP256_LPA4_LPB4_LRVW2_NEPBS4_PLR9_SVW2_TT2_16_TLDS1_UMLDSA1_UMLDSB1_VW2_WG32_8_1_WGM6
    SolutionIndex: 62
    SolutionNameMin: Cijk_Alik_Bljk_DB_MT32x64x32_MI16x16x4x1_SN_AMAS0_GRVW2_LBSPP256_LPA4_LPB4_LRVW2_NEPBS0_PLR9_SVW1_TT2_16_TLDS1_UMLDSA1_UMLDSB1_VW1_WG16_16_1_WGM6
- - - [6144, 4864, 1, 512]
    - [5, 76.96]
  - - [4864, 3072, 1, 4096]
    - [0, 92.995]
  - - [7296, 4096, 1, 4096]
    - [8, 93.133]
  - - [7296, 4608, 1, 4096]
    - [9, 93.861]
  - - [7296, 4608, 1, 8192]
    - [10, 95.039]
  - - [9728, 6144, 1, 4096]
    - [11, 94.172]
  - - [9728, 6144, 1, 8192]
    - [12, 95.577]
  - - [16384, 16384, 1, 4096]
    - [13, 95.127]
  - - [14592, 15360, 1, 512]
    - [6, 77.307]
  - - [19456, 18432, 1, 512]
    - [7, 78.059]
  - - [1030, 1030, 1, 1030]
    - [14, 38.14]
  - - [1032, 1032, 1, 1032]
    - [1, 38.669]
  - - [2046, 2046, 1, 2046]
    - [2, 64.555]
  - - [2048, 2048, 1, 2048]
    - [15, 66.588]
  - - [4094, 4094, 1, 2046]
    - [3, 82.928]
  - - [4096, 4096, 1, 2048]
    - [4, 81.985]
  - - [1031, 1031, 1, 1031]
    - [16, 33.769]
  - - [2047, 2047, 1, 2047]
    - [17, 60.279]
  - - [4095, 4095, 1, 2047]
    - [18, 80.482]
  - - [250, 9, 1, 500000]
    - [19, 7.174]
  - - [250, 9, 1, 4000000]
    - [20, 7.701]
  - - [250, 9, 1, 8000000]
    - [21, 7.764]
  - - [250, 9, 1, 12000000]
    - [22, 7.814]
  - - [250, 9, 1, 16000000]
    - [23, 7.937]
  - - [250, 9, 1, 24000000]
    - [24, 8.04]
  - - [250, 250, 1, 500000]
    - [25, 58.16]
  - - [250, 250, 1, 4000000]
    - [26, 73.86]
  - - [250, 250, 1, 8000000]
    - [27, 74.521]
  - - [250, 250, 1, 12000000]
    - [28, 74.694]
  - - [250, 250, 1, 16000000]
    - [29, 71.116]
  - - [64, 1, 1000, 64]
    - [30, 0.408]
  - - [1, 64, 1000, 64]
    - [31, 0.416]
  - - [31, 31, 1000, 31]
    - [31, 3.081]
  - - [33, 33, 1000, 33]
    - [32, 2.921]
  - - [47, 47, 1000, 47]
    - [33, 5.194]
  - - [49, 49, 1000, 49]
    - [34, 5.304]
  - - [63, 63, 128, 63]
    - [35, 4.723]
  - - [65, 65, 128, 65]
    - [36, 3.947]
  - - [79, 79, 128, 79]
    - [32, 5.813]
  - - [81, 81, 128, 81]
    - [37, 5.83]
  - - [95, 95, 64, 95]
    - [38, 6.595]
  - - [97, 97, 64, 97]
    - [39, 6.681]
  - - [127, 127, 64, 127]
    - [40, 10.573]
  - - [129, 129, 64, 129]
    - [41, 7.562]
  - - [255, 255, 16, 255]
    - [42, 17.404]
  - - [257, 257, 16, 257]
    - [43, 14.482]
  - - [511, 511, 16, 511]
    - [44, 36.871]
  - - [513, 513, 16, 513]
    - [45, 36.416]
  - - [30, 30, 1000, 30]
    - [46, 3.232]
  - - [32, 32, 1000, 32]
    - [47, 3.908]
  - - [34, 34, 1000, 34]
    - [48, 3.421]
  - - [46, 46, 1000, 46]
    - [49, 5.624]
  - - [48, 48, 1000, 48]
    - [50, 7.486]
  - - [50, 50, 1000, 50]
    - [51, 6.431]
  - - [62, 62, 128, 62]
    - [52, 4.901]
  - - [64, 64, 128, 64]
    - [53, 5.816]
  - - [66, 66, 128, 66]
    - [54, 4.289]
  - - [78, 78, 128, 78]
    - [55, 6.261]
  - - [80, 80, 128, 80]
    - [56, 7.359]
  - - [82, 82, 128, 82]
    - [57, 7.096]
  - - [94, 94, 64, 94]
    - [54, 6.858]
  - - [96, 96, 64, 96]
    - [54, 7.795]
  - - [98, 98, 64, 98]
    - [56, 7.596]
  - - [126, 126, 64, 126]
    - [57, 12.789]
  - - [128, 128, 64, 128]
    - [58, 14.439]
  - - [130, 130, 64, 130]
    - [59, 9.571]
  - - [254, 254, 16, 254]
    - [57, 16.65]
  - - [256, 256, 16, 256]
    - [60, 20.267]
  - - [258, 258, 16, 258]
    - [61, 13.046]
  - - [510, 510, 16, 510]
    - [48, 38.777]
  - - [512, 512, 16, 512]
    - [62, 42.641]
  - - [514, 514, 16, 514]
    - [48, 37.077]
- null
