library/src/blas3/Tensile/Logic/asm_full/aquavanjaram942/aquavanjaram942_Cijk_Ailk_Bjlk_DB.yaml
- {MinimumRequiredVersion: 4.8.1}
- aquavanjaram942
- gfx942
- [Device 0049]
    SolutionIndex: 0
    SolutionNameMin: Cijk_Ailk_Bjlk_DB_MT128x128x16_MI16x16x4x1_SN_AMAS0_DTVA0_GLS0_LRVW1_NTA1_NTB1_NTC3_NTD2_NEPBS8_NLCB1_SVW1_TT2_128_VW1_WG64_4_1_WGM42
    SolutionIndex: 1
    SolutionNameMin: Cijk_Ailk_Bjlk_DB_MT128x128x16_MI16x16x4x1_SN_AMAS0_DTVA0_GLS1_LRVW1_NTA1_NTB0_NTC2_NTD2_NEPBS8_NLCB2_SVW1_TT2_128_VW1_WG64_4_1_WGM30
    SolutionIndex: 2
    SolutionNameMin: Cijk_Ailk_Bjlk_DB_MT128x128x16_MI16x16x4x1_SN_AMAS0_DTVA0_GLS1_LRVW1_NTA0_NTB0_NTC2_NTD2_NEPBS8_NLCB2_SVW1_TT2_128_VW1_WG64_4_1_WGM18
    SolutionIndex: 3
    SolutionNameMin: Cijk_Ailk_Bjlk_DB_MT128x128x16_MI16x16x4x1_SN_AMAS0_DTVA0_GLS1_LRVW1_NTA0_NTB1_NTC3_NTD3_NEPBS8_NLCB1_SVW1_TT4_64_VW1_WG32_8_1_WGM18
    SolutionIndex: 4
    SolutionNameMin: Cijk_Ailk_Bjlk_DB_MT128x128x16_MI16x16x4x1_SN_AMAS0_DTVA0_GLS1_LRVW1_NTA0_NTB1_NTC2_NTD3_NEPBS8_NLCB2_SVW1_TT4_64_VW1_WG32_8_1_WGM18
    SolutionIndex: 5
    SolutionNameMin: Cijk_Ailk_Bjlk_DB_MT128x128x16_MI16x16x4x1_SN_AMAS0_DTVA0_GLS1_LRVW1_NTA0_NTB0_NTC2_NTD2_NEPBS8_NLCB2_SVW1_TT4_64_VW1_WG32_8_1_WGM24
    SolutionIndex: 6
    SolutionNameMin: Cijk_Ailk_Bjlk_DB_MT128x128x16_MI16x16x4x1_SN_AMAS0_DTVA0_GLS1_LRVW1_NTA0_NTB1_NTC2_NTD3_NEPBS8_NLCB2_SVW1_TT2_128_VW1_WG64_4_1_WGM36
    SolutionIndex: 7
    SolutionNameMin: Cijk_Ailk_Bjlk_DB_MT128x64x16_MI16x16x4x1_SN_1LDSB1_DTVA1_GLS0_NLCB1_PLR5_TT2_64_WG64_4_1_WGM18
    SolutionIndex: 8
    SolutionNameMin: Cijk_Ailk_Bjlk_DB_MT128x64x16_MI16x16x4x1_SN_1LDSB1_DTVA1_GLS0_NLCB1_PLR5_TT2_64_WG64_4_1_WGM12
    SolutionIndex: 9
    SolutionNameMin: Cijk_Ailk_Bjlk_DB_MT128x64x16_MI16x16x4x1_SN_1LDSB1_LRVW1_NEPBS2_NLCB2_PLR1_SU0_SUS0_TT2_64_WGM30
    SolutionIndex: 10
    SolutionNameMin: Cijk_Ailk_Bjlk_DB_MT128x64x16_MI16x16x4x1_SN_1LDSB1_LRVW1_NEPBS2_NLCB2_PLR1_SU0_SUS0_TT2_64_WGM42
    SolutionIndex: 11
    SolutionNameMin: Cijk_Ailk_Bjlk_DB_MT128x64x16_MI16x16x4x1_SN_1LDSB1_LRVW1_NEPBS2_NLCB1_PLR1_SU0_SUS0_TT2_64_WGM42
    SolutionIndex: 12
    SolutionNameMin: Cijk_Ailk_Bjlk_DB_MT64x64x16_MI16x16x4x1_SN_1LDSB1_DTVA0_GLS1_NLCB2_PLR5_TT2_32_WG32_8_1_WGM30
    SolutionIndex: 13
    SolutionNameMin: Cijk_Ailk_Bjlk_DB_MT64x64x16_MI16x16x4x1_SN_1LDSB0_DTVA0_GLS0_NLCB2_PLR1_TT2_32_WG32_8_1_WGM30
    SolutionIndex: 14
    SolutionNameMin: Cijk_Ailk_Bjlk_DB_MT64x64x16_MI16x16x4x1_SN_1LDSB0_DTVA0_EPS0_NLCB2_PLR1_TT2_32_WG32_8_1_WGM30
    SolutionIndex: 15
    SolutionNameMin: Cijk_Ailk_Bjlk_DB_MT64x64x16_MI16x16x4x1_SN_1LDSB1_DTVA0_EPS0_NLCB1_PLR5_TT2_32_WG32_8_1_WGM30
    SolutionIndex: 16
    SolutionNameMin: Cijk_Ailk_Bjlk_DB_MT128x64x16_MI16x16x4x1_SN_1LDSB0_DTVA1_EPS1_NLCB1_PLR1_TT2_64_WG64_4_1_WGM30
    SolutionIndex: 17
    SolutionNameMin: Cijk_Ailk_Bjlk_DB_MT128x128x16_MI16x16x4x1_SN_
    SolutionIndex: 18
    SolutionNameMin: Cijk_Ailk_Bjlk_DB_MT32x16x16_MI16x16x4x1_SN_GRVW2_GLS1_PLR1_TT2_16_WG16_4_4_WGM1
    SolutionIndex: 19
    SolutionNameMin: Cijk_Ailk_Bjlk_DB_MT64x16x16_MI16x16x4x1_SN_GRVW1_GLS1_PLR1_TT1_16_WG64_4_1_WGM2
    SolutionIndex: 20
    SolutionNameMin: Cijk_Ailk_Bjlk_DB_MT16x16x64_MI16x16x4x1_SN_GRVW1_GLS1_PLR5_TT1_16_WG16_4_4_WGM2
    SolutionIndex: 21
    SolutionNameMin: Cijk_Ailk_Bjlk_DB_MT64x32x16_MI16x16x4x1_SN_1LDSB0_AMAS0_DTVA1_GRVW1_NEPBS4_NLCA1_PLR5_SVW1_TT1_32_VW1_WG64_4_1_WGM12
    SolutionIndex: 22
    SolutionNameMin: Cijk_Ailk_Bjlk_DB_MT32x64x32_MI16x16x4x1_SN_1LDSB1_AMAS0_DTVA0_GRVW1_NEPBS0_NLCA1_PLR9_SVW1_TT1_32_VW1_WG32_8_1_WGM6
    SolutionIndex: 23
    SolutionNameMin: Cijk_Ailk_Bjlk_DB_MT64x32x16_MI16x16x4x1_SN_1LDSB0_AMAS0_DTVA1_GRVW1_NEPBS4_NLCA1_PLR1_SVW1_TT1_32_VW1_WG64_4_1_WGM12
    SolutionIndex: 24
    SolutionNameMin: Cijk_Ailk_Bjlk_DB_MT64x64x16_MI16x16x4x1_SN_1LDSB1_AMAS0_DTVA1_GRVW1_NEPBS0_NLCA1_PLR5_SVW1_TT1_64_VW1_WG64_4_1_WGM6
    SolutionIndex: 25
    SolutionNameMin: Cijk_Ailk_Bjlk_DB_MT64x64x32_MI16x16x4x1_SN_1LDSB1_AMAS0_DTVA1_GRVW1_NEPBS0_NLCA1_PLR9_SVW1_TT1_64_VW1_WG64_4_1_WGM6
    SolutionIndex: 26
    SolutionNameMin: Cijk_Ailk_Bjlk_DB_MT64x64x16_MI16x16x4x1_SN_1LDSB1_AMAS0_DTVA0_GRVW1_NEPBS0_NLCA1_PLR5_SVW1_TT2_32_VW1_WG32_8_1_WGM12
    SolutionIndex: 27
    SolutionNameMin: Cijk_Ailk_Bjlk_DB_MT64x64x16_MI16x16x4x1_SN_1LDSB0_AMAS0_DTVA1_GRVW1_NEPBS0_NLCA1_PLR1_SVW1_TT1_64_VW1_WG64_4_1_WGM6
    SolutionIndex: 28
    SolutionNameMin: Cijk_Ailk_Bjlk_DB_MT64x64x16_MI16x16x4x1_SN_1LDSB1_AMAS3_DTVA0_GRVW2_NEPBS0_NLCA1_PLR5_SVW2_TT2_32_VW2_WG32_8_1_WGM12
    SolutionIndex: 29
    SolutionNameMin: Cijk_Ailk_Bjlk_DB_MT128x64x16_MI16x16x4x1_SN_1LDSB1_AMAS0_DTVA0_GRVW2_NEPBS0_NLCA1_PLR5_SVW1_TT4_32_VW1_WG32_8_1_WGM12
    SolutionIndex: 30
    SolutionNameMin: Cijk_Ailk_Bjlk_DB_MT128x64x16_MI16x16x4x1_SN_1LDSB1_AMAS0_DTVA0_GRVW2_NEPBS0_NLCA1_PLR1_SVW1_TT4_32_VW1_WG32_8_1_WGM6
    SolutionIndex: 31
    SolutionNameMin: Cijk_Ailk_Bjlk_DB_MT128x64x16_MI16x16x4x1_SN_1LDSB0_AMAS0_DTVA0_GRVW1_NEPBS0_NLCA1_PLR5_SVW1_TT4_32_VW1_WG32_8_1_WGM6
    SolutionIndex: 32
    SolutionNameMin: Cijk_Ailk_Bjlk_DB_MT128x64x16_MI16x16x4x1_SN_1LDSB1_AMAS0_DTVA0_GRVW1_NEPBS0_NLCA1_PLR5_SVW1_TT2_64_VW1_WG64_4_1_WGM12
    SolutionIndex: 33
    SolutionNameMin: Cijk_Ailk_Bjlk_DB_MT128x64x16_MI16x16x4x1_SN_1LDSB0_AMAS0_DTVA0_GRVW1_NEPBS0_NLCA1_PLR1_SVW1_TT2_64_VW1_WG64_4_1_WGM12
    SolutionIndex: 34
    SolutionNameMin: Cijk_Ailk_Bjlk_DB_MT64x32x16_MI16x16x4x1_SN_1LDSB0_AMAS0_DTVA0_GRVW1_NEPBS4_NLCA1_PLR1_SVW1_TT1_32_VW1_WG64_4_1_WGM6
    SolutionIndex: 35
    SolutionNameMin: Cijk_Ailk_Bjlk_DB_MT64x64x16_MI16x16x4x1_SN_1LDSB1_AMAS0_DTVA0_GRVW2_NEPBS0_NLCA1_PLR5_SVW1_TT2_32_VW1_WG32_8_1_WGM6
    SolutionIndex: 36
    SolutionNameMin: Cijk_Ailk_Bjlk_DB_MT64x64x16_MI16x16x4x1_SN_1LDSB0_AMAS3_DTVA0_GRVW2_NEPBS4_NLCA1_PLR1_SVW2_TT2_32_VW2_WG32_8_1_WGM6
    SolutionIndex: 37
    SolutionNameMin: Cijk_Ailk_Bjlk_DB_MT64x64x16_MI16x16x4x1_SN_AMAS3_DTVA0_GRVW1_NEPBS0_NLCA1_PLR5_SVW2_TT2_32_VW2_WG32_8_1_WGM6
    SolutionIndex: 38
    SolutionNameMin: Cijk_Ailk_Bjlk_DB_MT64x32x32_MI16x16x4x1_SN_AMAS0_DTVA1_GRVW1_NEPBS0_NLCA1_PLR9_SVW1_TT1_32_VW1_WG64_4_1_WGM6
    SolutionIndex: 39
    SolutionNameMin: Cijk_Ailk_Bjlk_DB_MT64x64x16_MI16x16x4x1_SN_AMAS3_DTVA0_GRVW1_NEPBS4_NLCA1_PLR5_SVW2_TT2_32_VW2_WG32_8_1_WGM6
    SolutionIndex: 40
    SolutionNameMin: Cijk_Ailk_Bjlk_DB_MT64x64x32_MI16x16x4x1_SN_AMAS0_DTVA1_GRVW1_NEPBS0_NLCA1_PLR9_SVW1_TT1_64_VW1_WG64_4_1_WGM6
    SolutionIndex: 41
    SolutionNameMin: Cijk_Ailk_Bjlk_DB_MT64x64x16_MI16x16x4x1_SN_AMAS3_DTVA0_GRVW1_NEPBS0_NLCA1_PLR5_SVW2_TT2_32_VW2_WG32_8_1_WGM12
    SolutionIndex: 42
    SolutionNameMin: Cijk_Ailk_Bjlk_DB_MT64x64x16_MI16x16x4x1_SN_AMAS3_DTVA0_GRVW2_NEPBS0_NLCA1_PLR5_SVW2_TT2_32_VW2_WG32_8_1_WGM6
    SolutionIndex: 43
    SolutionNameMin: Cijk_Ailk_Bjlk_DB_MT64x64x32_MI16x16x4x1_SN_AMAS0_DTVA0_GRVW2_NEPBS0_NLCA1_PLR9_SVW1_TT2_32_VW1_WG32_8_1_WGM12
    SolutionIndex: 44
    SolutionNameMin: Cijk_Ailk_Bjlk_DB_MT128x64x16_MI16x16x4x1_SN_AMAS3_DTVA1_GRVW2_NEPBS0_NLCA1_PLR5_SVW2_TT2_64_VW2_WG64_4_1_WGM6
    SolutionIndex: 45
    SolutionNameMin: Cijk_Ailk_Bjlk_DB_MT128x64x16_MI16x16x4x1_SN_AMAS3_DTVA1_GRVW2_NEPBS0_NLCA1_PLR1_SVW2_TT2_64_VW2_WG64_4_1_WGM6
    SolutionIndex: 46
    SolutionNameMin: Cijk_Ailk_Bjlk_DB_MT128x64x16_MI16x16x4x1_SN_AMAS3_DTVA1_GRVW2_NEPBS0_NLCA1_PLR1_SVW2_TT2_64_VW2_WG64_4_1_WGM12
    SolutionIndex: 47
    SolutionNameMin: Cijk_Ailk_Bjlk_DB_MT128x64x16_MI16x16x4x1_SN_AMAS0_DTVA0_GRVW2_NEPBS0_NLCA1_PLR5_SVW1_TT2_64_VW1_WG64_4_1_WGM12
    SolutionIndex: 48
    SolutionNameMin: Cijk_Ailk_Bjlk_DB_MT128x64x16_MI16x16x4x1_SN_AMAS0_DTVA0_GRVW2_NEPBS0_NLCA1_PLR5_SVW1_TT4_32_VW1_WG32_8_1_WGM12
    SolutionIndex: 49
    SolutionNameMin: Cijk_Ailk_Bjlk_DB_MT128x64x16_MI16x16x4x1_SN_AMAS3_DTVA1_GRVW2_NEPBS4_NLCA1_PLR5_SVW2_TT2_64_VW2_WG64_4_1_WGM12
    SolutionIndex: 50
    SolutionNameMin: Cijk_Ailk_Bjlk_DB_MT64x64x16_MI16x16x4x1_SN_AMAS3_DTVA0_GRVW2_NEPBS4_NLCA1_PLR5_SVW2_TT2_32_VW2_WG32_8_1_WGM6
    SolutionIndex: 51
    SolutionNameMin: Cijk_Ailk_Bjlk_DB_MT128x64x16_MI16x16x4x1_SN_AMAS3_DTVA0_GRVW2_NEPBS0_NLCA1_PLR5_SVW2_TT4_32_VW2_WG32_8_1_WGM12
    SolutionIndex: 52
    SolutionNameMin: Cijk_Ailk_Bjlk_DB_MT64x32x32_MI16x16x4x1_SN_AMAS0_DTVA0_GRVW2_NEPBS4_NLCA1_PLR9_SVW1_TT1_32_VW1_WG64_4_1_WGM6
    SolutionIndex: 53
    SolutionNameMin: Cijk_Ailk_Bjlk_DB_MT128x128x16_MI16x16x4x1_SN_GLS1_WGM36
    SolutionIndex: 54
    SolutionNameMin: Cijk_Ailk_Bjlk_DB_MT128x128x16_MI16x16x4x1_SN_GLS1_SU32_SUS512_WSGRB1_WGM36
    SolutionIndex: 55
    SolutionNameMin: Cijk_Ailk_Bjlk_DB_MT128x128x16_MI16x16x4x1_SN_GLS1_SU32_SUS512_WSGRB1_WGM24
    SolutionIndex: 56
    SolutionNameMin: Cijk_Ailk_Bjlk_DB_MT128x128x16_MI16x16x4x1_SN_GLS1_SU32_SUS512_WSGRB0_WGM24
    SolutionIndex: 57
    SolutionNameMin: Cijk_Ailk_Bjlk_DB_MT128x128x16_MI16x16x4x1_SN_GLS1_SU0_SUS0_WSGRB0_WGM36
    SolutionIndex: 58
    SolutionNameMin: Cijk_Ailk_Bjlk_DB_MT128x128x16_MI16x16x4x1_SN_GLS1_SU0_SUS0_WSGRB1_WGM36
    SolutionIndex: 59
    SolutionNameMin: Cijk_Ailk_Bjlk_DB_MT128x128x16_MI16x16x4x1_SN_GLS1_SU0_SUS0_WSGRB0_WGM24
    SolutionIndex: 60
    SolutionNameMin: Cijk_Ailk_Bjlk_DB_MT128x128x16_MI16x16x4x1_SN_GLS1_SU0_SUS0_WSGRB1_WGM24
    SolutionIndex: 61
    SolutionNameMin: Cijk_Ailk_Bjlk_DB_MT128x128x16_MI16x16x4x1_SN_GLS0_SU0_SUS0_WSGRB0_WGM24
    SolutionIndex: 62
    SolutionNameMin: Cijk_Ailk_Bjlk_DB_MT128x128x16_MI16x16x4x1_SN_GLS0_SU0_SUS0_WSGRB1_WGM36
    SolutionIndex: 63
    SolutionNameMin: Cijk_Ailk_Bjlk_DB_MT128x128x16_MI16x16x4x1_SN_GLS1_SU32_SUS512_WSGRB0_WGM36
    SolutionIndex: 64
    SolutionNameMin: Cijk_Ailk_Bjlk_DB_MT128x128x16_MI16x16x4x1_SN_GLS0_SU0_SUS0_WSGRB1_WGM24
    SolutionIndex: 65
    SolutionNameMin: Cijk_Ailk_Bjlk_DB_MT128x128x16_MI16x16x4x1_SN_1LDSB1_AF1EM1_AMAS0_DTVA0_DTVB0_GRVW1_LRVW1_NLCA1_NLCB1_PLR5_SU4_SUS256_SVW1_TT8_32_VW1_WG16_16_1_WGM12
    SolutionIndex: 66
    SolutionNameMin: Cijk_Ailk_Bjlk_DB_MT64x128x16_MI16x16x4x1_SN_1LDSB1_AF1EM1_AMAS3_DTVA0_DTVB1_GRVW2_LRVW1_NLCA1_NLCB1_PLR5_SU0_SUS0_SVW2_TT4_32_VW2_WG16_16_1_WGM12
    SolutionIndex: 67
    SolutionNameMin: Cijk_Ailk_Bjlk_DB_MT128x128x16_MI16x16x4x1_SN_1LDSB1_AF1EM1_AMAS3_DTVA0_DTVB1_GRVW2_LRVW1_NLCA1_NLCB1_PLR1_SU0_SUS0_SVW2_TT8_32_VW2_WG16_16_1_WGM12
    SolutionIndex: 68
    SolutionNameMin: Cijk_Ailk_Bjlk_DB_MT128x128x16_MI16x16x4x1_SN_1LDSB1_AF1EM2_AMAS3_DTVA1_DTVB0_GRVW2_LRVW1_NLCA1_NLCB1_PLR1_SU0_SUS0_SVW2_TT2_128_VW2_WG64_4_1_WGM2
    SolutionIndex: 69
    SolutionNameMin: Cijk_Ailk_Bjlk_DB_MT128x64x32_MI16x16x4x1_SN_1LDSB0_AF1EM1_AMAS3_DTVA1_DTVB0_GRVW2_LRVW1_NLCA1_NLCB1_PLR1_SU0_SUS0_SVW2_TT2_64_VW2_WG64_4_1_WGM1
    SolutionIndex: 70
    SolutionNameMin: Cijk_Ailk_Bjlk_DB_MT128x128x16_MI16x16x4x1_SN_1LDSB1_AF1EM2_AMAS3_DTVA0_DTVB0_GRVW2_LRVW1_NLCA1_NLCB1_PLR5_SU0_SUS0_SVW2_TT2_128_VW2_WG64_4_1_WGM1
    SolutionIndex: 71
    SolutionNameMin: Cijk_Ailk_Bjlk_DB_MT64x128x32_MI16x16x4x1_SN_1LDSB1_AF1EM2_AMAS3_DTVA0_DTVB0_GRVW2_LRVW1_NLCA1_NLCB1_PLR9_SU0_SUS0_SVW2_TT4_32_VW2_WG16_16_1_WGM12
    SolutionIndex: 72
    SolutionNameMin: Cijk_Ailk_Bjlk_DB_MT128x96x16_MI16x16x4x1_SN_1LDSB0_AF1EM1_AMAS3_DTVA1_DTVB0_GRVW2_LRVW1_NLCA1_NLCB3_PLR5_SU0_SUS0_SVW2_TT2_96_VW2_WG64_4_1_WGM1
    SolutionIndex: 73
    SolutionNameMin: Cijk_Ailk_Bjlk_DB_MT64x96x16_MI16x16x4x1_SN_1LDSB0_AF1EM1_AMAS0_DTVA1_DTVB0_GRVW1_LRVW2_NLCA1_NLCB3_PLR5_SU0_SUS0_SVW1_TT1_96_VW1_WG64_4_1_WGM2
    SolutionIndex: 74
    SolutionNameMin: Cijk_Ailk_Bjlk_DB_MT96x128x16_MI16x16x4x1_SN_1LDSB1_AF1EM2_AMAS3_DTVA0_DTVB1_GRVW2_LRVW1_NLCA3_NLCB1_PLR1_SU0_SUS0_SVW2_TT6_32_VW2_WG16_16_1_WGM12
    SolutionIndex: 75
    SolutionNameMin: Cijk_Ailk_Bjlk_DB_MT128x128x16_MI16x16x4x1_SN_GLS1_SU32_SUS512_WSGRB1_WGM36
    SolutionIndex: 76
    SolutionNameMin: Cijk_Ailk_Bjlk_DB_MT128x128x16_MI16x16x4x1_SN_GLS1_SU32_SUS512_WSGRB0_WGM36
    SolutionIndex: 77
    SolutionNameMin: Cijk_Ailk_Bjlk_DB_MT128x128x16_MI16x16x4x1_SN_GLS1_SU32_SUS512_WSGRB0_WGM24
    SolutionIndex: 78
    SolutionNameMin: Cijk_Ailk_Bjlk_DB_MT128x128x16_MI16x16x4x1_SN_GLS1_SU0_SUS0_WSGRB1_WGM12
    SolutionIndex: 79
    SolutionNameMin: Cijk_Ailk_Bjlk_DB_MT128x128x16_MI16x16x4x1_SN_GLS1_SU32_SUS512_WSGRB1_WGM12
    SolutionIndex: 80
    SolutionNameMin: Cijk_Ailk_Bjlk_DB_MT128x128x16_MI16x16x4x1_SN_GLS1_SU0_SUS0_WSGRB1_WGM36
    SolutionIndex: 81
    SolutionNameMin: Cijk_Ailk_Bjlk_DB_MT128x128x16_MI16x16x4x1_SN_GLS1_SU0_SUS0_WSGRB0_WGM24
    SolutionIndex: 82
    SolutionNameMin: Cijk_Ailk_Bjlk_DB_MT128x128x16_MI16x16x4x1_SN_GLS1_SU0_SUS0_WSGRB1_WGM24
    SolutionIndex: 83
    SolutionNameMin: Cijk_Ailk_Bjlk_DB_MT128x128x16_MI16x16x4x1_SN_GLS1_SU32_SUS512_WSGRB0_WGM12
    SolutionIndex: 84
    SolutionNameMin: Cijk_Ailk_Bjlk_DB_MT128x96x16_MI16x16x4x1_SN_1LDSB1_AF1EM1_AMAS3_DTVA1_DTVB0_GRVW2_LRVW2_NLCA1_NLCB3_PLR5_SU0_SUS0_SVW2_TT2_96_VW2_WG64_4_1_WGM1
    SolutionIndex: 85
    SolutionNameMin: Cijk_Ailk_Bjlk_DB_MT128x128x16_MI16x16x4x1_SN_GLS1_SU0_SUS0_WSGRB0_WGM12
    SolutionIndex: 86
    SolutionNameMin: Cijk_Ailk_Bjlk_DB_MT128x96x16_MI16x16x4x1_SN_1LDSB1_AF1EM1_AMAS3_DTVA1_DTVB0_GRVW2_LRVW1_NLCA1_NLCB3_PLR5_SU0_SUS0_SVW2_TT2_96_VW2_WG64_4_1_WGM2
    SolutionIndex: 87
    SolutionNameMin: Cijk_Ailk_Bjlk_DB_MT128x128x16_MI16x16x4x1_SN_GLS0_SU32_SUS512_WSGRB0_WGM36
    SolutionIndex: 88
    SolutionNameMin: Cijk_Ailk_Bjlk_DB_MT128x128x16_MI16x16x4x1_SN_1LDSB0_AF1EM1_AMAS3_DTVA0_DTVB1_GRVW2_LRVW1_NLCA1_NLCB1_PLR1_SU4_SUS256_SVW2_TT8_32_VW2_WG16_16_1_WGM2
    SolutionIndex: 89
    SolutionNameMin: Cijk_Ailk_Bjlk_DB_MT128x64x32_MI16x16x4x1_SN_1LDSB0_AF1EM1_AMAS3_DTVA1_DTVB0_GRVW2_LRVW1_NLCA1_NLCB1_PLR9_SU0_SUS0_SVW2_TT2_64_VW2_WG64_4_1_WGM12
    SolutionIndex: 90
    SolutionNameMin: Cijk_Ailk_Bjlk_DB_MT128x128x16_MI16x16x4x1_SN_1LDSB1_AF1EM1_AMAS3_DTVA1_DTVB0_GRVW2_LRVW1_NLCA1_NLCB1_PLR1_SU0_SUS0_SVW2_TT2_128_VW2_WG64_4_1_WGM1
    SolutionIndex: 91
    SolutionNameMin: Cijk_Ailk_Bjlk_DB_MT128x128x16_MI16x16x4x1_SN_1LDSB0_AF1EM1_AMAS3_DTVA1_DTVB0_GRVW2_LRVW2_NLCA1_NLCB1_PLR5_SU4_SUS256_SVW2_TT2_128_VW2_WG64_4_1_WGM1
    SolutionIndex: 92
    SolutionNameMin: Cijk_Ailk_Bjlk_DB_MT64x96x16_MI16x16x4x1_SN_1LDSB0_AF1EM1_AMAS0_DTVA1_DTVB0_GRVW1_LRVW2_NLCA1_NLCB3_PLR5_SU4_SUS256_SVW1_TT1_96_VW1_WG64_4_1_WGM1
    SolutionIndex: 93
    SolutionNameMin: Cijk_Ailk_Bjlk_DB_MT128x128x16_MI16x16x4x1_SN_1LDSB1_AMAS3_DTVA1_DTVB0_GRVW2_GLS1_LRVW2_NLCA1_NLCB2_PLR5_SU0_SUS0_SVW2_TT2_128_VW2_WSGRB0_WG64_4_1_WGM4
    SolutionIndex: 94
    SolutionNameMin: Cijk_Ailk_Bjlk_DB_MT128x128x16_MI16x16x4x1_SN_1LDSB1_AMAS3_DTVA1_DTVB0_GRVW2_GLS1_LRVW2_NLCA1_NLCB1_PLR5_SU0_SUS0_SVW2_TT2_128_VW2_WSGRB0_WG64_4_1_WGM4
    SolutionIndex: 95
    SolutionNameMin: Cijk_Ailk_Bjlk_DB_MT128x128x16_MI16x16x4x1_SN_1LDSB1_AMAS3_DTVA1_DTVB0_GRVW2_GLS1_LRVW1_NLCA1_NLCB1_PLR5_SU0_SUS0_SVW2_TT2_128_VW2_WSGRB0_WG64_4_1_WGM8
    SolutionIndex: 96
    SolutionNameMin: Cijk_Ailk_Bjlk_DB_MT128x128x16_MI16x16x4x1_SN_1LDSB1_AMAS3_DTVA1_DTVB0_GRVW2_GLS1_LRVW2_NLCA1_NLCB1_PLR5_SU0_SUS0_SVW2_TT2_128_VW2_WSGRB1_WG64_4_1_WGM6
    SolutionIndex: 97
    SolutionNameMin: Cijk_Ailk_Bjlk_DB_MT128x128x16_MI16x16x4x1_SN_1LDSB0_AMAS3_DTVA1_DTVB0_GRVW2_GLS0_LRVW2_NLCA1_NLCB1_PLR5_SU4_SUS256_SVW2_TT2_128_VW2_WSGRB1_WG64_4_1_WGM6
    SolutionIndex: 98
    SolutionNameMin: Cijk_Ailk_Bjlk_DB_MT128x128x16_MI16x16x4x1_SN_1LDSB1_AMAS3_DTVA1_DTVB0_GRVW2_GLS1_LRVW2_NLCA1_NLCB2_PLR5_SU0_SUS0_SVW2_TT2_128_VW2_WSGRB1_WG64_4_1_WGM6
    SolutionIndex: 99
    SolutionNameMin: Cijk_Ailk_Bjlk_DB_MT128x64x16_MI16x16x4x1_SN_1LDSB1_AMAS3_DTVA1_DTVB0_GRVW2_GLS1_LRVW2_NLCA1_NLCB1_PLR5_SU0_SUS0_SVW2_TT2_64_VW2_WSGRB1_WG64_4_1_WGM8
    SolutionIndex: 100
    SolutionNameMin: Cijk_Ailk_Bjlk_DB_MT128x64x16_MI16x16x4x1_SN_1LDSB1_AMAS3_DTVA1_DTVB0_GRVW2_GLS1_LRVW2_NLCA1_NLCB2_PLR5_SU0_SUS0_SVW2_TT2_64_VW2_WSGRB1_WG64_4_1_WGM8
    SolutionIndex: 101
    SolutionNameMin: Cijk_Ailk_Bjlk_DB_MT128x64x16_MI16x16x4x1_SN_1LDSB1_AMAS3_DTVA1_DTVB0_GRVW2_GLS1_LRVW2_NLCA1_NLCB2_PLR5_SU0_SUS0_SVW2_TT2_64_VW2_WSGRB0_WG64_4_1_WGM8
    SolutionIndex: 102
    SolutionNameMin: Cijk_Ailk_Bjlk_DB_MT128x64x16_MI16x16x4x1_SN_1LDSB0_AMAS3_DTVA1_DTVB0_GRVW2_GLS1_LRVW2_NLCA1_NLCB1_PLR5_SU0_SUS0_SVW2_TT2_64_VW2_WSGRB1_WG64_4_1_WGM8
    SolutionIndex: 103
    SolutionNameMin: Cijk_Ailk_Bjlk_DB_MT128x64x16_MI16x16x4x1_SN_1LDSB1_AMAS3_DTVA1_DTVB0_GRVW2_GLS1_LRVW2_NLCA1_NLCB2_PLR5_SU4_SUS256_SVW2_TT2_64_VW2_WSGRB0_WG64_4_1_WGM8
    SolutionIndex: 104
    SolutionNameMin: Cijk_Ailk_Bjlk_DB_MT128x128x16_MI16x16x4x1_SN_1LDSB1_AMAS3_DTVA1_DTVB0_GRVW2_GLS1_LRVW2_NLCA1_NLCB1_PLR5_SU4_SUS256_SVW2_TT2_128_VW2_WSGRB0_WG64_4_1_WGM8
    SolutionIndex: 105
    SolutionNameMin: Cijk_Ailk_Bjlk_DB_MT128x64x16_MI16x16x4x1_SN_1LDSB0_AMAS3_DTVA1_DTVB0_GRVW2_GLS1_LRVW2_NLCA1_NLCB1_PLR5_SU0_SUS0_SVW2_TT2_64_VW2_WSGRB0_WG64_4_1_WGM8
    SolutionIndex: 106
    SolutionNameMin: Cijk_Ailk_Bjlk_DB_MT128x64x16_MI16x16x4x1_SN_1LDSB0_AMAS3_DTVA1_DTVB0_GRVW2_GLS1_LRVW2_NLCA1_NLCB1_PLR5_SU4_SUS256_SVW2_TT2_64_VW2_WSGRB0_WG64_4_1_WGM8
    SolutionIndex: 107
    SolutionNameMin: Cijk_Ailk_Bjlk_DB_MT128x128x16_MI16x16x4x1_SN_1LDSB0_AMAS3_DTVA1_DTVB0_GRVW2_GLS0_LRVW2_NLCA1_NLCB2_PLR5_SU4_SUS256_SVW2_TT2_128_VW2_WSGRB1_WG64_4_1_WGM4
    SolutionIndex: 108
    SolutionNameMin: Cijk_Ailk_Bjlk_DB_MT128x128x16_MI16x16x4x1_SN_1LDSB0_AMAS3_DTVA1_DTVB0_GRVW2_GLS0_LRVW2_NLCA1_NLCB2_PLR5_SU4_SUS256_SVW2_TT2_128_VW2_WSGRB1_WG64_4_1_WGM8
    SolutionIndex: 109
    SolutionNameMin: Cijk_Ailk_Bjlk_DB_MT128x128x16_MI16x16x4x1_SN_1LDSB0_AMAS3_DTVA1_DTVB0_GRVW2_GLS0_LRVW1_NLCA1_NLCB2_PLR5_SU0_SUS0_SVW2_TT2_128_VW2_WSGRB0_WG64_4_1_WGM8
    SolutionIndex: 110
    SolutionNameMin: Cijk_Ailk_Bjlk_DB_MT128x128x16_MI16x16x4x1_SN_1LDSB1_AMAS3_DTVA1_DTVB0_GRVW2_GLS1_LRVW1_NLCA1_NLCB1_PLR5_SU0_SUS0_SVW2_TT2_128_VW2_WSGRB1_WG64_4_1_WGM8
    SolutionIndex: 111
    SolutionNameMin: Cijk_Ailk_Bjlk_DB_MT128x128x16_MI16x16x4x1_SN_1LDSB0_AMAS3_DTVA1_DTVB0_GRVW2_GLS1_LRVW1_NLCA1_NLCB2_PLR5_SU0_SUS0_SVW2_TT2_128_VW2_WSGRB1_WG64_4_1_WGM8
    SolutionIndex: 112
    SolutionNameMin: Cijk_Ailk_Bjlk_DB_MT128x128x16_MI16x16x4x1_SN_1LDSB1_AMAS3_DTVA1_DTVB0_GRVW2_GLS1_LRVW2_NLCA1_NLCB2_PLR5_SU0_SUS0_SVW2_TT2_128_VW2_WSGRB0_WG64_4_1_WGM8
    SolutionIndex: 113
    SolutionNameMin: Cijk_Ailk_Bjlk_DB_MT128x128x16_MI16x16x4x1_SN_1LDSB0_AMAS3_DTVA1_DTVB0_GRVW2_GLS0_LRVW1_NLCA1_NLCB1_PLR5_SU0_SUS0_SVW2_TT2_128_VW2_WSGRB1_WG64_4_1_WGM6
    SolutionIndex: 114
    SolutionNameMin: Cijk_Ailk_Bjlk_DB_MT128x128x16_MI16x16x4x1_SN_1LDSB1_AMAS3_DTVA1_DTVB0_GRVW2_GLS0_LRVW1_NLCA1_NLCB1_PLR5_SU0_SUS0_SVW2_TT2_128_VW2_WSGRB0_WG64_4_1_WGM4
    SolutionIndex: 115
    SolutionNameMin: Cijk_Ailk_Bjlk_DB_MT128x128x16_MI16x16x4x1_SN_1LDSB0_AMAS3_DTVA1_DTVB0_GRVW2_GLS1_LRVW2_NLCA1_NLCB2_PLR5_SU0_SUS0_SVW2_TT2_128_VW2_WSGRB0_WG64_4_1_WGM6
    SolutionIndex: 116
    SolutionNameMin: Cijk_Ailk_Bjlk_DB_MT128x128x16_MI16x16x4x1_SN_1LDSB1_AMAS3_DTVA1_DTVB0_GRVW2_GLS1_LRVW2_NLCA1_NLCB1_PLR5_SU0_SUS0_SVW2_TT2_128_VW2_WSGRB1_WG64_4_1_WGM1
    SolutionIndex: 117
    SolutionNameMin: Cijk_Ailk_Bjlk_DB_MT128x128x16_MI16x16x4x1_SN_1LDSB1_AMAS3_DTVA1_DTVB0_GRVW2_GLS1_LRVW2_NLCA1_NLCB1_PLR5_SU4_SUS256_SVW2_TT2_128_VW2_WSGRB1_WG64_4_1_WGM2
    SolutionIndex: 118
    SolutionNameMin: Cijk_Ailk_Bjlk_DB_MT128x128x16_MI16x16x4x1_SN_1LDSB1_AMAS3_DTVA1_DTVB0_GRVW2_GLS1_LRVW2_NLCA1_NLCB1_PLR5_SU0_SUS0_SVW2_TT2_128_VW2_WSGRB1_WG64_4_1_WGM2
    SolutionIndex: 119
    SolutionNameMin: Cijk_Ailk_Bjlk_DB_MT64x128x16_MI16x16x4x1_SN_1LDSB1_AMAS3_DTVA0_DTVB1_GRVW2_GLS0_LRVW1_NLCA1_NLCB1_PLR5_SU0_SUS0_SVW2_TT4_32_VW2_WSGRB0_WG16_16_1_WGM2
    SolutionIndex: 120
    SolutionNameMin: Cijk_Ailk_Bjlk_DB_MT128x128x16_MI16x16x4x1_SN_1LDSB1_AMAS3_DTVA1_DTVB0_GRVW2_GLS1_LRVW2_NLCA1_NLCB2_PLR5_SU4_SUS256_SVW2_TT2_128_VW2_WSGRB1_WG64_4_1_WGM1
    SolutionIndex: 121
    SolutionNameMin: Cijk_Ailk_Bjlk_DB_MT128x64x16_MI16x16x4x1_SN_1LDSB0_AMAS3_DTVA1_DTVB0_GRVW2_GLS0_LRVW1_NLCA1_NLCB2_PLR5_SU4_SUS256_SVW2_TT2_64_VW2_WSGRB0_WG64_4_1_WGM8
    SolutionIndex: 122
    SolutionNameMin: Cijk_Ailk_Bjlk_DB_MT128x128x16_MI16x16x4x1_SN_1LDSB1_AMAS3_DTVA1_DTVB0_GRVW2_GLS0_LRVW1_NLCA1_NLCB2_PLR5_SU4_SUS256_SVW2_TT2_128_VW2_WSGRB1_WG64_4_1_WGM2
    SolutionIndex: 123
    SolutionNameMin: Cijk_Ailk_Bjlk_DB_MT128x128x16_MI16x16x4x1_SN_1LDSB0_AMAS3_DTVA1_DTVB0_GRVW2_GLS1_LRVW2_NLCA1_NLCB1_PLR5_SU0_SUS0_SVW2_TT2_128_VW2_WSGRB1_WG64_4_1_WGM2
    SolutionIndex: 124
    SolutionNameMin: Cijk_Ailk_Bjlk_DB_MT64x128x16_MI16x16x4x1_SN_1LDSB1_AMAS3_DTVA0_DTVB1_GRVW2_GLS1_LRVW1_NLCA1_NLCB1_PLR5_SU0_SUS0_SVW2_TT4_32_VW2_WSGRB0_WG16_16_1_WGM6
    SolutionIndex: 125
    SolutionNameMin: Cijk_Ailk_Bjlk_DB_MT64x128x16_MI16x16x4x1_SN_1LDSB1_AMAS3_DTVA0_DTVB1_GRVW2_GLS1_LRVW1_NLCA1_NLCB1_PLR5_SU4_SUS256_SVW2_TT4_32_VW2_WSGRB0_WG16_16_1_WGM2
    SolutionIndex: 126
    SolutionNameMin: Cijk_Ailk_Bjlk_DB_MT128x128x16_MI16x16x4x1_SN_1LDSB0_AMAS3_DTVA1_DTVB0_GRVW2_GLS1_LRVW1_NLCA1_NLCB2_PLR5_SU0_SUS0_SVW2_TT2_128_VW2_WSGRB1_WG64_4_1_WGM1
    SolutionIndex: 127
    SolutionNameMin: Cijk_Ailk_Bjlk_DB_MT64x128x16_MI16x16x4x1_SN_1LDSB0_AMAS3_DTVA0_DTVB1_GRVW2_GLS0_LRVW1_NLCA1_NLCB1_PLR5_SU4_SUS256_SVW2_TT4_32_VW2_WSGRB0_WG16_16_1_WGM6
    SolutionIndex: 128
    SolutionNameMin: Cijk_Ailk_Bjlk_DB_MT128x64x16_MI16x16x4x1_SN_1LDSB1_AMAS3_DTVA1_DTVB0_GRVW2_GLS1_LRVW1_NLCA1_NLCB1_PLR5_SU0_SUS0_SVW2_TT2_64_VW2_WSGRB1_WG64_4_1_WGM8
    SolutionIndex: 129
    SolutionNameMin: Cijk_Ailk_Bjlk_DB_MT128x128x16_MI16x16x4x1_SN_1LDSB1_AMAS3_DTVA1_DTVB0_GRVW2_GLS0_LRVW2_NLCA1_NLCB2_PLR5_SU4_SUS256_SVW2_TT2_128_VW2_WSGRB1_WG64_4_1_WGM6
    SolutionIndex: 130
    SolutionNameMin: Cijk_Ailk_Bjlk_DB_MT128x128x16_MI16x16x4x1_SN_1LDSB0_AMAS3_DTVA1_DTVB0_GRVW2_GLS0_LRVW1_NLCA1_NLCB2_PLR5_SU0_SUS0_SVW2_TT2_128_VW2_WSGRB1_WG64_4_1_WGM6
    SolutionIndex: 131
    SolutionNameMin: Cijk_Ailk_Bjlk_DB_MT128x64x16_MI16x16x4x1_SN_1LDSB0_AMAS0_DTVA1_DTVB0_GRVW1_GLS0_LRVW2_NLCA2_NLCB1_PLR5_SU0_SUS0_SVW1_TT2_64_VW1_WSGRB1_WG64_4_1_WGM1
    SolutionIndex: 132
    SolutionNameMin: Cijk_Ailk_Bjlk_DB_MT64x128x16_MI16x16x4x1_SN_1LDSB1_AMAS3_DTVA0_DTVB1_GRVW2_GLS0_LRVW1_NLCA1_NLCB1_PLR5_SU0_SUS0_SVW2_TT4_32_VW2_WSGRB0_WG16_16_1_WGM1
    SolutionIndex: 133
    SolutionNameMin: Cijk_Ailk_Bjlk_DB_MT128x64x16_MI16x16x4x1_SN_1LDSB1_AMAS3_DTVA0_DTVB0_GRVW2_GLS0_LRVW1_NLCA1_NLCB2_PLR5_SU4_SUS256_SVW2_TT2_64_VW2_WSGRB0_WG64_4_1_WGM2
    SolutionIndex: 134
    SolutionNameMin: Cijk_Ailk_Bjlk_DB_MT64x128x16_MI16x16x4x1_SN_1LDSB1_AMAS3_DTVA0_DTVB1_GRVW2_GLS0_LRVW1_NLCA1_NLCB1_PLR5_SU4_SUS256_SVW2_TT4_32_VW2_WSGRB0_WG16_16_1_WGM4
    SolutionIndex: 135
    SolutionNameMin: Cijk_Ailk_Bjlk_DB_MT64x128x32_MI16x16x4x1_SN_1LDSB1_AMAS3_DTVA0_DTVB1_GRVW2_GLS1_LRVW1_NLCA1_NLCB1_PLR9_SU4_SUS256_SVW2_TT4_32_VW2_WSGRB0_WG16_16_1_WGM8
    SolutionIndex: 136
    SolutionNameMin: Cijk_Ailk_Bjlk_DB_MT128x64x16_MI16x16x4x1_SN_1LDSB1_AF1EM1_AMAS3_DTVA1_DTVB0_GRVW2_LRVW2_NLCA1_NLCB1_PLR5_SU0_SUS0_SVW2_TT2_64_VW2_WG64_4_1_WGM1
    SolutionIndex: 137
    SolutionNameMin: Cijk_Ailk_Bjlk_DB_MT128x128x16_MI16x16x4x1_SN_1LDSB1_AMAS3_DTVA1_DTVB0_GRVW2_GLS0_LRVW1_NLCA1_NLCB1_PLR5_SU0_SUS0_SVW2_TT2_128_VW2_WSGRB1_WG64_4_1_WGM1
    SolutionIndex: 138
    SolutionNameMin: Cijk_Ailk_Bjlk_DB_MT128x64x16_MI16x16x4x1_SN_1LDSB0_AF1EM1_AMAS3_DTVA1_DTVB0_GRVW2_LRVW2_NLCA1_NLCB1_PLR5_SU0_SUS0_SVW2_TT2_64_VW2_WG64_4_1_WGM1
    SolutionIndex: 139
    SolutionNameMin: Cijk_Ailk_Bjlk_DB_MT128x64x16_MI16x16x4x1_SN_1LDSB1_AMAS3_DTVA1_DTVB0_GRVW2_GLS0_LRVW1_NLCA1_NLCB1_PLR5_SU0_SUS0_SVW2_TT2_64_VW2_WSGRB1_WG64_4_1_WGM6
    SolutionIndex: 140
    SolutionNameMin: Cijk_Ailk_Bjlk_DB_MT128x96x16_MI16x16x4x1_SN_1LDSB1_AF1EM2_AMAS3_DTVA1_DTVB0_GRVW2_LRVW1_NLCA1_NLCB3_PLR5_SU0_SUS0_SVW2_TT2_96_VW2_WG64_4_1_WGM1
    SolutionIndex: 141
    SolutionNameMin: Cijk_Ailk_Bjlk_DB_MT128x64x16_MI16x16x4x1_SN_1LDSB1_AF1EM1_AMAS3_DTVA1_DTVB0_GRVW2_LRVW2_NLCA1_NLCB1_PLR5_SU4_SUS256_SVW2_TT2_64_VW2_WG64_4_1_WGM2
    SolutionIndex: 142
    SolutionNameMin: Cijk_Ailk_Bjlk_DB_MT128x64x16_MI16x16x4x1_SN_1LDSB1_AF1EM1_AMAS3_DTVA1_DTVB0_GRVW2_LRVW1_NLCA1_NLCB1_PLR5_SU0_SUS0_SVW2_TT2_64_VW2_WG64_4_1_WGM1
    SolutionIndex: 143
    SolutionNameMin: Cijk_Ailk_Bjlk_DB_MT96x128x16_MI16x16x4x1_SN_1LDSB1_AF1EM1_AMAS3_DTVA0_DTVB1_GRVW2_LRVW1_NLCA3_NLCB1_PLR1_SU4_SUS256_SVW2_TT6_32_VW2_WG16_16_1_WGM1
    SolutionIndex: 144
    SolutionNameMin: Cijk_Ailk_Bjlk_DB_MT96x128x16_MI16x16x4x1_SN_1LDSB0_AF1EM1_AMAS3_DTVA0_DTVB1_GRVW2_LRVW1_NLCA3_NLCB1_PLR1_SU4_SUS256_SVW2_TT6_32_VW2_WG16_16_1_WGM12
    SolutionIndex: 145
    SolutionNameMin: Cijk_Ailk_Bjlk_DB_MT128x128x16_MI16x16x4x1_SN_1LDSB1_AF1EM1_AMAS3_DTVA1_DTVB0_GRVW2_LRVW2_NLCA1_NLCB1_PLR5_SU4_SUS256_SVW2_TT2_128_VW2_WG64_4_1_WGM1
    SolutionIndex: 146
    SolutionNameMin: Cijk_Ailk_Bjlk_DB_MT128x96x16_MI16x16x4x1_SN_1LDSB1_AF1EM1_AMAS3_DTVA1_DTVB0_GRVW2_LRVW2_NLCA1_NLCB3_PLR5_SU4_SUS256_SVW2_TT2_96_VW2_WG64_4_1_WGM12
    SolutionIndex: 147
    SolutionNameMin: Cijk_Ailk_Bjlk_DB_MT128x64x16_MI16x16x4x1_SN_1LDSB0_AF1EM2_AMAS3_DTVA0_DTVB0_GRVW2_LRVW1_NLCA1_NLCB1_PLR1_SU0_SUS0_SVW2_TT2_64_VW2_WG64_4_1_WGM1
    SolutionIndex: 148
    SolutionNameMin: Cijk_Ailk_Bjlk_DB_MT128x96x16_MI16x16x4x1_SN_1LDSB0_AF1EM1_AMAS3_DTVA1_DTVB0_GRVW2_LRVW1_NLCA1_NLCB3_PLR1_SU4_SUS256_SVW2_TT2_96_VW2_WG64_4_1_WGM1
    SolutionIndex: 149
    SolutionNameMin: Cijk_Ailk_Bjlk_DB_MT128x128x16_MI16x16x4x1_SN_1LDSB1_AF1EM1_AMAS3_DTVA0_DTVB0_GRVW2_LRVW1_NLCA1_NLCB1_PLR1_SU4_SUS256_SVW2_TT2_128_VW2_WG64_4_1_WGM12
    SolutionIndex: 150
    SolutionNameMin: Cijk_Ailk_Bjlk_DB_MT128x64x16_MI16x16x4x1_SN_1LDSB0_AF1EM1_AMAS3_DTVA1_DTVB0_GRVW2_LRVW2_NLCA1_NLCB1_PLR5_SU0_SUS0_SVW2_TT2_64_VW2_WG64_4_1_WGM12
    SolutionIndex: 151
    SolutionNameMin: Cijk_Ailk_Bjlk_DB_MT128x128x16_MI16x16x4x1_SN_1LDSB0_AF1EM1_AMAS3_DTVA1_DTVB0_GRVW2_LRVW1_NLCA1_NLCB1_PLR5_SU4_SUS256_SVW2_TT2_128_VW2_WG64_4_1_WGM12
    SolutionIndex: 152
    SolutionNameMin: Cijk_Ailk_Bjlk_DB_MT128x128x16_MI16x16x4x1_SN_1LDSB0_AF1EM2_AMAS3_DTVA0_DTVB1_GRVW2_LRVW1_NLCA1_NLCB1_PLR1_SU0_SUS0_SVW2_TT8_32_VW2_WG16_16_1_WGM1
    SolutionIndex: 153
    SolutionNameMin: Cijk_Ailk_Bjlk_DB_MT128x64x16_MI16x16x4x1_SN_1LDSB1_AF1EM1_AMAS3_DTVA1_DTVB0_GRVW2_LRVW2_NLCA1_NLCB1_PLR5_SU0_SUS0_SVW2_TT2_64_VW2_WG64_4_1_WGM12
    SolutionIndex: 154
    SolutionNameMin: Cijk_Ailk_Bjlk_DB_MT128x64x16_MI16x16x4x1_SN_1LDSB1_AF1EM2_AMAS3_DTVA1_DTVB0_GRVW2_LRVW2_NLCA1_NLCB1_PLR5_SU4_SUS256_SVW2_TT2_64_VW2_WG64_4_1_WGM2
    SolutionIndex: 155
    SolutionNameMin: Cijk_Ailk_Bjlk_DB_MT96x128x32_MI16x16x4x1_SN_1LDSB1_AF1EM2_AMAS3_DTVA0_DTVB1_GRVW2_LRVW1_NLCA3_NLCB1_PLR1_SU4_SUS256_SVW2_TT6_32_VW2_WG16_16_1_WGM2
    SolutionIndex: 156
    SolutionNameMin: Cijk_Ailk_Bjlk_DB_MT64x96x16_MI16x16x4x1_SN_1LDSB0_AF1EM1_AMAS0_DTVA1_DTVB0_GRVW1_LRVW2_NLCA1_NLCB3_PLR5_SU4_SUS256_SVW1_TT1_96_VW1_WG64_4_1_WGM12
    SolutionIndex: 157
    SolutionNameMin: Cijk_Ailk_Bjlk_DB_MT96x128x16_MI16x16x4x1_SN_1LDSB0_AF1EM1_AMAS3_DTVA0_DTVB0_GRVW2_LRVW1_NLCA3_NLCB1_PLR5_SU0_SUS0_SVW2_TT6_32_VW2_WG16_16_1_WGM1
    SolutionIndex: 158
    SolutionNameMin: Cijk_Ailk_Bjlk_DB_MT128x96x16_MI16x16x4x1_SN_1LDSB1_AF1EM1_AMAS0_DTVA1_DTVB0_GRVW1_LRVW1_NLCA2_NLCB3_PLR1_SU0_SUS0_SVW1_TT2_96_VW1_WG64_4_1_WGM1
    SolutionIndex: 159
    SolutionNameMin: Cijk_Ailk_Bjlk_DB_MT64x64x16_MI16x16x4x1_SN_1LDSB0_AF1EM1_AMAS0_DTVA1_DTVB0_GRVW1_LRVW2_NLCA1_NLCB1_PLR5_SU4_SUS256_SVW1_TT1_64_VW1_WG64_4_1_WGM1
    SolutionIndex: 160
    SolutionNameMin: Cijk_Ailk_Bjlk_DB_MT128x128x16_MI16x16x4x1_SN_1LDSB1_AF1EM2_AMAS3_DTVA0_DTVB1_GRVW2_LRVW1_NLCA1_NLCB1_PLR5_SU0_SUS0_SVW2_TT8_32_VW2_WG16_16_1_WGM1
    SolutionIndex: 161
    SolutionNameMin: Cijk_Ailk_Bjlk_DB_MT64x64x16_MI16x16x4x1_SN_1LDSB0_AF1EM2_AMAS0_DTVA1_DTVB0_GRVW1_LRVW2_NLCA1_NLCB1_PLR5_SU0_SUS0_SVW1_TT1_64_VW1_WG64_4_1_WGM1
    SolutionIndex: 162
    SolutionNameMin: Cijk_Ailk_Bjlk_DB_MT64x64x16_MI16x16x4x1_SN_1LDSB0_AF1EM1_AMAS0_DTVA1_DTVB0_GRVW1_LRVW2_NLCA1_NLCB1_PLR5_SU0_SUS0_SVW1_TT1_64_VW1_WG64_4_1_WGM1
    SolutionIndex: 163
    SolutionNameMin: Cijk_Ailk_Bjlk_DB_MT64x64x16_MI16x16x4x1_SN_1LDSB0_AF1EM2_AMAS0_DTVA1_DTVB0_GRVW1_LRVW2_NLCA1_NLCB1_PLR5_SU0_SUS0_SVW1_TT1_64_VW1_WG64_4_1_WGM12
- - - [6144, 4864, 1, 512]
    - [17, 89.473]
  - - [7296, 4096, 1, 4096]
    - [1, 98.145]
  - - [16384, 16384, 1, 4096]
    - [6, 98.831]
  - - [4864, 3072, 1, 4096]
    - [0, 97.233]
  - - [7296, 4608, 1, 4096]
    - [2, 98.269]
  - - [7296, 4608, 1, 8192]
    - [3, 98.833]
  - - [9728, 6144, 1, 4096]
    - [4, 98.646]
  - - [9728, 6144, 1, 8192]
    - [5, 99.036]
  - - [14592, 15360, 1, 512]
    - [53, 84.066]
  - - [19456, 18432, 1, 512]
    - [53, 89.741]
  - - [1030, 1030, 1, 1030]
    - [7, 37.314]
  - - [1032, 1032, 1, 1032]
    - [8, 37.805]
  - - [2046, 2046, 1, 2046]
    - [12, 66.603]
  - - [2048, 2048, 1, 2048]
    - [13, 69.186]
  - - [4094, 4094, 1, 2046]
    - [9, 90.85]
  - - [4096, 4096, 1, 2048]
    - [10, 92.994]
  - - [7296, 4864, 1, 4096]
    - [11, 97.45]
  - - [1031, 1031, 1, 1031]
    - [14, 33.905]
  - - [2047, 2047, 1, 2047]
    - [15, 63.331]
  - - [4095, 4095, 1, 2047]
    - [16, 81.582]
  - - [127488, 25088, 1, 512]
    - [54, 93.466]
  - - [127488, 25600, 1, 512]
    - [54, 93.497]
  - - [124416, 23552, 1, 512]
    - [54, 93.766]
  - - [124416, 24064, 1, 512]
    - [54, 93.643]
  - - [120832, 22016, 1, 512]
    - [54, 93.765]
  - - [120832, 21504, 1, 512]
    - [54, 93.882]
  - - [117760, 20480, 1, 512]
    - [54, 93.967]
  - - [117760, 19968, 1, 512]
    - [54, 94.178]
  - - [113664, 18432, 1, 512]
    - [54, 94.66]
  - - [113664, 17920, 1, 512]
    - [54, 94.329]
  - - [111104, 16896, 1, 512]
    - [54, 94.48]
  - - [111104, 17408, 1, 512]
    - [54, 94.352]
  - - [108032, 15360, 1, 512]
    - [54, 94.561]
  - - [108032, 15872, 1, 512]
    - [54, 94.635]
  - - [103936, 13312, 1, 512]
    - [54, 94.738]
  - - [103936, 13824, 1, 512]
    - [54, 94.695]
  - - [100352, 11776, 1, 512]
    - [54, 94.887]
  - - [100352, 11264, 1, 512]
    - [54, 94.798]
  - - [97280, 10240, 1, 512]
    - [54, 95.039]
  - - [97280, 9728, 1, 512]
    - [54, 94.887]
  - - [93696, 8192, 1, 512]
    - [54, 94.713]
  - - [93696, 8704, 1, 512]
    - [54, 94.997]
  - - [90112, 6656, 1, 512]
    - [55, 95.194]
  - - [90112, 6144, 1, 512]
    - [55, 95.703]
  - - [87040, 5120, 1, 512]
    - [54, 95.675]
  - - [87040, 4608, 1, 512]
    - [54, 94.825]
  - - [85504, 4096, 1, 512]
    - [56, 91.818]
  - - [85504, 4608, 1, 512]
    - [54, 95.471]
  - - [82944, 3072, 1, 512]
    - [55, 88.206]
  - - [82944, 2560, 1, 512]
    - [57, 82.429]
  - - [81920, 2560, 1, 512]
    - [58, 81.802]
  - - [81920, 2048, 1, 512]
    - [57, 82.125]
  - - [80384, 1536, 1, 512]
    - [58, 82.516]
  - - [80384, 2048, 1, 512]
    - [59, 90.073]
  - - [78336, 1024, 1, 512]
    - [59, 78.507]
  - - [74240, 37376, 1, 512]
    - [54, 95.735]
  - - [74240, 36864, 1, 512]
    - [54, 95.571]
  - - [70144, 35328, 1, 512]
    - [54, 95.802]
  - - [70144, 34816, 1, 512]
    - [54, 95.774]
  - - [66048, 33280, 1, 512]
    - [54, 95.835]
  - - [66048, 32768, 1, 512]
    - [54, 95.864]
  - - [61952, 31232, 1, 512]
    - [54, 95.844]
  - - [61952, 30720, 1, 512]
    - [54, 95.887]
  - - [59904, 30208, 1, 512]
    - [54, 96.009]
  - - [59904, 29696, 1, 512]
    - [54, 95.905]
  - - [56832, 28672, 1, 512]
    - [54, 96.048]
  - - [56832, 28160, 1, 512]
    - [54, 96.09]
  - - [54784, 27648, 1, 512]
    - [54, 95.846]
  - - [54784, 27136, 1, 512]
    - [54, 95.976]
  - - [52736, 26624, 1, 512]
    - [54, 96.098]
  - - [52736, 26112, 1, 512]
    - [54, 95.975]
  - - [49664, 25088, 1, 512]
    - [54, 96.085]
  - - [49664, 24576, 1, 512]
    - [54, 96.108]
  - - [47616, 24064, 1, 512]
    - [54, 96.073]
  - - [47616, 23552, 1, 512]
    - [54, 96.097]
  - - [44544, 22528, 1, 512]
    - [54, 96.146]
  - - [44544, 22016, 1, 512]
    - [54, 95.957]
  - - [41472, 20992, 1, 512]
    - [54, 95.932]
  - - [41472, 20480, 1, 512]
    - [54, 96.001]
  - - [39424, 19968, 1, 512]
    - [54, 96.079]
  - - [39424, 19456, 1, 512]
    - [58, 95.567]
  - - [37376, 18944, 1, 512]
    - [57, 95.795]
  - - [37376, 18432, 1, 512]
    - [57, 95.726]
  - - [34304, 17408, 1, 512]
    - [57, 95.883]
  - - [34304, 16896, 1, 512]
    - [58, 95.563]
  - - [32256, 16384, 1, 512]
    - [59, 95.427]
  - - [32256, 15872, 1, 512]
    - [54, 95.394]
  - - [29184, 14848, 1, 512]
    - [58, 96.268]
  - - [29184, 14336, 1, 512]
    - [57, 96.218]
  - - [27136, 13824, 1, 512]
    - [54, 95.167]
  - - [27136, 13312, 1, 512]
    - [60, 96.048]
  - - [24064, 12288, 1, 512]
    - [60, 95.508]
  - - [24064, 11776, 1, 512]
    - [58, 95.856]
  - - [22016, 11264, 1, 512]
    - [59, 94.508]
  - - [22016, 10752, 1, 512]
    - [57, 94.846]
  - - [19968, 10240, 1, 512]
    - [57, 94.508]
  - - [19968, 9728, 1, 512]
    - [57, 93.537]
  - - [17920, 9216, 1, 512]
    - [58, 92.803]
  - - [17920, 8704, 1, 512]
    - [58, 90.93]
  - - [14848, 7680, 1, 512]
    - [57, 87.919]
  - - [14848, 7168, 1, 512]
    - [59, 84.871]
  - - [12800, 6656, 1, 512]
    - [59, 83.935]
  - - [12800, 6144, 1, 512]
    - [57, 83.4]
  - - [11264, 5632, 1, 512]
    - [59, 81.884]
  - - [10752, 5632, 1, 512]
    - [58, 82.257]
  - - [10752, 5120, 1, 512]
    - [58, 78.489]
  - - [11264, 5120, 1, 512]
    - [57, 80.544]
  - - [10240, 5120, 1, 512]
    - [60, 77.929]
  - - [9728, 5120, 1, 512]
    - [61, 77.821]
  - - [9728, 4608, 1, 512]
    - [59, 75.068]
  - - [10240, 4608, 1, 512]
    - [62, 72.927]
  - - [8704, 4608, 1, 512]
    - [63, 71.894]
  - - [8704, 4096, 1, 512]
    - [60, 72.399]
  - - [7680, 4096, 1, 512]
    - [64, 70.26]
  - - [7680, 3584, 1, 512]
    - [59, 71.309]
  - - [6656, 3584, 1, 512]
    - [65, 62.018]
  - - [6656, 3072, 1, 512]
    - [66, 67.968]
  - - [5632, 3072, 1, 512]
    - [67, 70.765]
  - - [5632, 2560, 1, 512]
    - [68, 65.541]
  - - [4608, 2560, 1, 512]
    - [69, 61.76]
  - - [4608, 2048, 1, 512]
    - [70, 63.548]
  - - [3584, 2048, 1, 512]
    - [71, 50.469]
  - - [3584, 1536, 1, 512]
    - [72, 57.287]
  - - [2560, 1536, 1, 512]
    - [73, 48.57]
  - - [2560, 1024, 1, 512]
    - [74, 49.258]
  - - [127488, 25089, 1, 512]
    - [75, 92.532]
  - - [124416, 23553, 1, 512]
    - [75, 92.901]
  - - [120832, 21505, 1, 512]
    - [75, 93.178]
  - - [117760, 19969, 1, 512]
    - [75, 92.859]
  - - [113664, 17921, 1, 512]
    - [75, 93.269]
  - - [111104, 16897, 1, 512]
    - [75, 93.16]
  - - [108032, 15361, 1, 512]
    - [76, 92.7]
  - - [103936, 13313, 1, 512]
    - [75, 93.39]
  - - [100352, 11265, 1, 512]
    - [76, 90.996]
  - - [97280, 9729, 1, 512]
    - [75, 93.342]
  - - [93696, 8193, 1, 512]
    - [75, 92.669]
  - - [90112, 6145, 1, 512]
    - [77, 92.27]
  - - [87040, 4609, 1, 512]
    - [76, 92.144]
  - - [85504, 4097, 1, 512]
    - [77, 90.619]
  - - [82944, 2561, 1, 512]
    - [53, 79.999]
  - - [81920, 2049, 1, 512]
    - [78, 76.835]
  - - [80384, 1537, 1, 512]
    - [79, 77.05]
  - - [78336, 513, 1, 512]
    - [80, 58.777]
  - - [74240, 36865, 1, 512]
    - [76, 95.197]
  - - [70144, 34817, 1, 512]
    - [75, 95.166]
  - - [66048, 32769, 1, 512]
    - [76, 95.368]
  - - [61952, 30721, 1, 512]
    - [75, 95.237]
  - - [59904, 29697, 1, 512]
    - [75, 94.563]
  - - [56832, 28161, 1, 512]
    - [76, 95.349]
  - - [54784, 27137, 1, 512]
    - [75, 95.251]
  - - [52736, 26113, 1, 512]
    - [76, 95.098]
  - - [49664, 24577, 1, 512]
    - [81, 95.501]
  - - [47616, 23553, 1, 512]
    - [75, 95.167]
  - - [44544, 22017, 1, 512]
    - [81, 94.991]
  - - [41472, 20481, 1, 512]
    - [53, 94.196]
  - - [39424, 19457, 1, 512]
    - [53, 94.796]
  - - [37376, 18433, 1, 512]
    - [53, 96.102]
  - - [34304, 16897, 1, 512]
    - [53, 94.167]
  - - [32256, 15873, 1, 512]
    - [81, 93.993]
  - - [29184, 14337, 1, 512]
    - [80, 93.602]
  - - [27136, 13313, 1, 512]
    - [53, 93.96]
  - - [24064, 11777, 1, 512]
    - [81, 91.851]
  - - [22016, 10753, 1, 512]
    - [81, 90.647]
  - - [19968, 9729, 1, 512]
    - [82, 88.577]
  - - [17920, 8705, 1, 512]
    - [53, 85.688]
  - - [14848, 7169, 1, 512]
    - [53, 82.608]
  - - [12800, 6145, 1, 512]
    - [83, 79.391]
  - - [11264, 5121, 1, 512]
    - [84, 71.876]
  - - [10752, 5121, 1, 512]
    - [85, 76.938]
  - - [10240, 4609, 1, 512]
    - [86, 66.454]
  - - [9728, 4609, 1, 512]
    - [87, 70.166]
  - - [8704, 4097, 1, 512]
    - [78, 70.279]
  - - [7680, 3585, 1, 512]
    - [77, 71.17]
  - - [6656, 3073, 1, 512]
    - [88, 65.583]
  - - [5632, 2561, 1, 512]
    - [89, 60.968]
  - - [4608, 2049, 1, 512]
    - [90, 60.215]
  - - [3584, 1537, 1, 512]
    - [91, 52.391]
  - - [2560, 1025, 1, 512]
    - [92, 59.408]
  - - [127488, 512, 1, 512]
    - [93, 67.945]
  - - [124416, 512, 1, 512]
    - [94, 67.125]
  - - [120832, 512, 1, 512]
    - [95, 68.333]
  - - [117760, 512, 1, 512]
    - [93, 68.281]
  - - [113664, 512, 1, 512]
    - [94, 68.811]
  - - [111104, 512, 1, 512]
    - [96, 69.382]
  - - [108032, 512, 1, 512]
    - [93, 70.706]
  - - [103936, 512, 1, 512]
    - [97, 66.604]
  - - [100352, 512, 1, 512]
    - [98, 70.277]
  - - [97280, 512, 1, 512]
    - [99, 63.429]
  - - [93696, 512, 1, 512]
    - [100, 63.258]
  - - [90112, 512, 1, 512]
    - [101, 64.683]
  - - [87040, 512, 1, 512]
    - [102, 62.796]
  - - [85504, 512, 1, 512]
    - [103, 62.629]
  - - [82944, 512, 1, 512]
    - [104, 69.444]
  - - [81920, 512, 1, 512]
    - [105, 63.596]
  - - [80384, 512, 1, 512]
    - [106, 63.058]
  - - [74240, 512, 1, 512]
    - [107, 66.453]
  - - [70144, 512, 1, 512]
    - [108, 66.68]
  - - [66048, 512, 1, 512]
    - [109, 65.423]
  - - [61952, 512, 1, 512]
    - [110, 68.394]
  - - [59904, 512, 1, 512]
    - [111, 66.996]
  - - [56832, 512, 1, 512]
    - [112, 68.597]
  - - [54784, 512, 1, 512]
    - [113, 63.227]
  - - [52736, 512, 1, 512]
    - [112, 65.534]
  - - [49664, 512, 1, 512]
    - [114, 67.767]
  - - [47616, 512, 1, 512]
    - [115, 65.348]
  - - [44544, 512, 1, 512]
    - [116, 64.152]
  - - [41472, 512, 1, 512]
    - [117, 65.755]
  - - [39424, 512, 1, 512]
    - [118, 63.525]
  - - [37376, 512, 1, 512]
    - [119, 67.158]
  - - [34304, 512, 1, 512]
    - [120, 65.673]
  - - [32256, 512, 1, 512]
    - [121, 60.047]
  - - [29184, 512, 1, 512]
    - [122, 66.332]
  - - [27136, 512, 1, 512]
    - [123, 66.529]
  - - [24064, 512, 1, 512]
    - [124, 60.48]
  - - [22016, 512, 1, 512]
    - [125, 58.13]
  - - [19968, 512, 1, 512]
    - [126, 61.384]
  - - [17920, 512, 1, 512]
    - [127, 57.878]
  - - [14848, 512, 1, 512]
    - [128, 51.735]
  - - [12800, 512, 1, 512]
    - [129, 57.607]
  - - [11264, 512, 1, 512]
    - [130, 57.905]
  - - [10752, 512, 1, 512]
    - [131, 55.214]
  - - [10240, 512, 1, 512]
    - [132, 51.773]
  - - [9728, 512, 1, 512]
    - [133, 50.308]
  - - [8704, 512, 1, 512]
    - [134, 51.806]
  - - [7680, 512, 1, 512]
    - [135, 44.162]
  - - [6656, 512, 1, 512]
    - [136, 70.453]
  - - [5632, 512, 1, 512]
    - [137, 50.125]
  - - [4608, 512, 1, 512]
    - [74, 60.331]
  - - [3584, 512, 1, 512]
    - [138, 65.262]
  - - [2560, 512, 1, 512]
    - [139, 47.434]
  - - [6144, 3072, 1, 512]
    - [140, 73.046]
  - - [6144, 512, 1, 512]
    - [141, 67.359]
  - - [6144, 2561, 1, 512]
    - [142, 65.747]
  - - [6144, 2560, 1, 512]
    - [84, 71.78]
  - - [5120, 2560, 1, 512]
    - [143, 65.045]
  - - [5120, 512, 1, 512]
    - [144, 59.568]
  - - [5120, 2049, 1, 512]
    - [145, 67.044]
  - - [5120, 2048, 1, 512]
    - [146, 63.472]
  - - [4096, 2048, 1, 512]
    - [147, 54.055]
  - - [4096, 512, 1, 512]
    - [148, 50.497]
  - - [4096, 1537, 1, 512]
    - [149, 57.264]
  - - [4096, 1536, 1, 512]
    - [150, 53.974]
  - - [3072, 1536, 1, 512]
    - [151, 49.858]
  - - [3072, 512, 1, 512]
    - [152, 32.159]
  - - [3072, 1025, 1, 512]
    - [153, 59.468]
  - - [3072, 1024, 1, 512]
    - [154, 67.828]
  - - [2048, 1024, 1, 512]
    - [155, 46.239]
  - - [2048, 1025, 1, 512]
    - [156, 42.131]
  - - [2048, 512, 1, 512]
    - [157, 22.248]
  - - [2048, 513, 1, 512]
    - [158, 22.866]
  - - [1536, 513, 1, 512]
    - [159, 43.667]
  - - [1536, 1024, 1, 512]
    - [160, 30.448]
  - - [1536, 512, 1, 512]
    - [161, 45.912]
  - - [1024, 513, 1, 512]
    - [162, 31.258]
  - - [1024, 512, 1, 512]
    - [161, 31.398]
  - - [512, 512, 1, 512]
    - [163, 15.75]
  - - [77824, 1, 1, 512]
    - [18, 0.854]
  - - [76800, 1, 1, 512]
    - [19, 0.839]
  - - [512, 1, 1, 512]
    - [20, 0.041]
  - - [64, 1, 1000, 64]
    - [21, 0.46]
  - - [1, 64, 1000, 64]
    - [22, 0.381]
  - - [31, 31, 1000, 31]
    - [23, 3.216]
  - - [33, 33, 1000, 33]
    - [24, 3.076]
  - - [47, 47, 1000, 47]
    - [25, 5.829]
  - - [49, 49, 1000, 49]
    - [26, 5.736]
  - - [63, 63, 128, 63]
    - [27, 4.863]
  - - [65, 65, 128, 65]
    - [28, 3.729]
  - - [79, 79, 128, 79]
    - [29, 5.394]
  - - [81, 81, 128, 81]
    - [30, 5.529]
  - - [95, 95, 64, 95]
    - [31, 6.311]
  - - [97, 97, 64, 97]
    - [32, 6.644]
  - - [127, 127, 64, 127]
    - [33, 11.794]
  - - [129, 129, 64, 129]
    - [28, 8.488]
  - - [255, 255, 16, 255]
    - [32, 17.479]
  - - [257, 257, 16, 257]
    - [34, 15.304]
  - - [511, 511, 16, 511]
    - [35, 34.883]
  - - [513, 513, 16, 513]
    - [36, 36.84]
  - - [30, 30, 1000, 30]
    - [37, 3.232]
  - - [32, 32, 1000, 32]
    - [38, 3.985]
  - - [34, 34, 1000, 34]
    - [37, 3.744]
  - - [46, 46, 1000, 46]
    - [39, 6.175]
  - - [48, 48, 1000, 48]
    - [40, 7.587]
  - - [50, 50, 1000, 50]
    - [41, 6.905]
  - - [62, 62, 128, 62]
    - [42, 4.953]
  - - [64, 64, 128, 64]
    - [43, 5.967]
  - - [66, 66, 128, 66]
    - [44, 4.178]
  - - [78, 78, 128, 78]
    - [45, 6.048]
  - - [80, 80, 128, 80]
    - [46, 7.013]
  - - [82, 82, 128, 82]
    - [46, 6.702]
  - - [94, 94, 64, 94]
    - [46, 6.8]
  - - [96, 96, 64, 96]
    - [47, 8.103]
  - - [98, 98, 64, 98]
    - [48, 7.296]
  - - [126, 126, 64, 126]
    - [49, 12.768]
  - - [128, 128, 64, 128]
    - [46, 14.439]
  - - [130, 130, 64, 130]
    - [50, 8.847]
  - - [254, 254, 16, 254]
    - [51, 19.004]
  - - [256, 256, 16, 256]
    - [46, 21.907]
  - - [258, 258, 16, 258]
    - [52, 15.056]
  - - [510, 510, 16, 510]
    - [39, 36.552]
  - - [514, 514, 16, 514]
    - [50, 37.304]
- null
