library/src/blas3/Tensile/Logic/asm_full/aquavanjaram942/aquavanjaram942_Cijk_Ailk_Bljk_ZB.yaml
- {MinimumRequiredVersion: 4.28.0}
- aquavanjaram942
- gfx942
- [Device 0049]
    SolutionIndex: 0
    SolutionNameMin: Cijk_Ailk_Bljk_ZB_MT32x32x8_MI16x16x4x1_SN_1LDSB1_IU2_NLCA1_SIA2_TT1_16_WG32_8_1
    SolutionIndex: 1
    SolutionNameMin: Cijk_Ailk_Bljk_ZB_MT64x32x8_MI16x16x4x1_SN_1LDSB1_IU1_NLCA1_SIA3_TT1_32_WG64_4_1
    SolutionIndex: 2
    SolutionNameMin: Cijk_Ailk_Bljk_ZB_MT64x64x8_MI16x16x4x1_SN_1LDSB1_IU1_NLCA1_SIA3_TT2_32_WG32_8_1
    SolutionIndex: 3
    SolutionNameMin: Cijk_Ailk_Bljk_ZB_MT64x64x8_MI16x16x4x1_SN_1LDSB1_IU1_NLCA1_SIA3_TT2_32_WG32_8_1
    SolutionIndex: 4
    SolutionNameMin: Cijk_Ailk_Bljk_ZB_MT64x64x8_MI16x16x4x1_SN_1LDSB1_IU1_NLCA1_SIA3_TT2_32_WG32_8_1
    SolutionIndex: 5
    SolutionNameMin: Cijk_Ailk_Bljk_ZB_MT16x16x16_MI16x16x4x1_SN_1LDSB0_IU1_NLCA1_SIA3_TT1_16_WG16_4_1
    SolutionIndex: 6
    SolutionNameMin: Cijk_Ailk_Bljk_ZB_MT32x32x16_MI16x16x4x1_SN_1LDSB0_IU1_NLCA1_SIA3_TT1_16_WG32_8_1
    SolutionIndex: 7
    SolutionNameMin: Cijk_Ailk_Bljk_ZB_MT16x16x16_MI16x16x4x1_SN_1LDSB0_GSUAMB_IU1_NLCA1_SIA3_TT1_16_WG16_4_1
    SolutionIndex: 8
    SolutionNameMin: Cijk_Ailk_Bljk_ZB_MT32x32x8_MI16x16x4x1_SN_1LDSB0_EPS0_IU1_NEPBS0_PGR2_PLR3_SIA3_SU0_SUS0_SPO1_SSO0_TT1_16_WG32_8_1_WGM1
    SolutionIndex: 9
    SolutionNameMin: Cijk_Ailk_Bljk_ZB_MT32x32x8_MI16x16x4x1_SN_1LDSB1_EPS1_IU2_NEPBS0_PGR1_PLR1_SIA2_SU0_SUS0_SPO0_SSO0_TT1_16_WG32_8_1_WGM10
    SolutionIndex: 10
    SolutionNameMin: Cijk_Ailk_Bljk_ZB_MT32x32x8_MI16x16x4x1_SN_1LDSB1_EPS0_IU2_NEPBS0_PGR2_PLR1_SIA2_SU0_SUS0_SPO1_SSO0_TT1_16_WG32_8_1_WGM10
    SolutionIndex: 11
    SolutionNameMin: Cijk_Ailk_Bljk_ZB_MT32x32x8_MI16x16x4x1_SN_1LDSB1_EPS0_IU2_NEPBS0_PGR2_PLR1_SIA2_SU0_SUS0_SPO0_SSO0_TT1_16_WG32_8_1_WGM10
    SolutionIndex: 12
    SolutionNameMin: Cijk_Ailk_Bljk_ZB_MT32x32x8_MI16x16x4x1_SN_1LDSB1_EPS1_IU2_NEPBS0_PGR1_PLR1_SIA2_SU0_SUS0_SPO0_SSO0_TT1_16_WG32_8_1_WGM5
    SolutionIndex: 13
    SolutionNameMin: Cijk_Ailk_Bljk_ZB_MT32x16x16_MI16x16x4x1_SN_1LDSB0_EPS0_IU1_NEPBS0_PGR2_PLR5_SIA3_SU0_SUS0_SPO0_SSO0_TT1_16_WG32_4_1_WGM1
    SolutionIndex: 14
    SolutionNameMin: Cijk_Ailk_Bljk_ZB_MT64x64x8_MI16x16x4x1_SN_1LDSB0_EPS0_IU1_NEPBS0_PGR2_PLR3_SIA3_SU0_SUS0_SPO1_SSO4_TT1_64_WG64_4_1_WGM8
    SolutionIndex: 15
    SolutionNameMin: Cijk_Ailk_Bljk_ZB_MT32x32x8_MI16x16x4x1_SN_1LDSB0_EPS0_IU1_NEPBS0_PGR2_PLR3_SIA3_SU0_SUS0_SPO1_SSO0_TT1_16_WG32_8_1_WGM1
    SolutionIndex: 16
    SolutionNameMin: Cijk_Ailk_Bljk_ZB_MT32x32x8_MI16x16x4x1_SN_1LDSB1_EPS1_IU2_NEPBS0_PGR1_PLR1_SIA2_SU0_SUS0_SPO0_SSO0_TT1_16_WG32_8_1_WGM10
    SolutionIndex: 17
    SolutionNameMin: Cijk_Ailk_Bljk_ZB_MT64x32x8_MI16x16x4x1_SN_1LDSB1_EPS0_IU2_NEPBS0_PGR2_PLR1_SIA2_SU0_SUS0_SPO0_SSO8_TT2_16_WG32_8_1_WGM1
    SolutionIndex: 18
    SolutionNameMin: Cijk_Ailk_Bljk_ZB_MT64x32x8_MI16x16x4x1_SN_1LDSB1_EPS0_IU2_NEPBS0_PGR2_PLR1_SIA2_SU0_SUS0_SPO0_SSO6_TT2_16_WG32_8_1_WGM1
    SolutionIndex: 19
    SolutionNameMin: Cijk_Ailk_Bljk_ZB_MT32x32x8_MI16x16x4x1_SN_1LDSB1_EPS0_IU2_NEPBS0_PGR2_PLR1_SIA2_SU0_SUS0_SPO0_SSO0_TT1_16_WG32_8_1_WGM10
    SolutionIndex: 20
    SolutionNameMin: Cijk_Ailk_Bljk_ZB_MT32x32x8_MI16x16x4x1_SN_1LDSB1_EPS1_IU2_NEPBS0_PGR1_PLR1_SIA2_SU0_SUS0_SPO0_SSO0_TT1_16_WG32_8_1_WGM5
    SolutionIndex: 21
    SolutionNameMin: Cijk_Ailk_Bljk_ZB_MT64x32x8_MI16x16x4x1_SN_1LDSB1_EPS0_IU2_NEPBS0_PGR2_PLR1_SIA2_SU32_SUS128_SPO1_SSO0_TT2_16_WG32_8_1_WGM10
    SolutionIndex: 22
    SolutionNameMin: Cijk_Ailk_Bljk_ZB_MT32x32x8_MI16x16x4x1_SN_1LDSB1_EPS0_IU2_NEPBS0_PGR2_PLR1_SIA2_SU32_SUS256_SPO0_SSO8_TT1_16_WG32_8_1_WGM1
    SolutionIndex: 23
    SolutionNameMin: Cijk_Ailk_Bljk_ZB_MT32x32x8_MI16x16x4x1_SN_1LDSB1_EPS0_IU2_NEPBS0_PGR2_PLR1_SIA2_SU0_SUS0_SPO0_SSO4_TT1_16_WG32_8_1_WGM5
    SolutionIndex: 24
    SolutionNameMin: Cijk_Ailk_Bljk_ZB_MT32x16x16_MI16x16x4x1_SN_1LDSB1_EPS1_IU4_NEPBS0_PGR1_PLR1_SIA2_SU0_SUS0_SPO1_SSO0_TT1_16_WG32_4_1_WGM1
    SolutionIndex: 25
    SolutionNameMin: Cijk_Ailk_Bljk_ZB_MT32x32x8_MI16x16x4x1_SN_1LDSB0_EPS0_IU1_NEPBS0_PGR2_PLR3_SIA3_SU0_SUS0_SPO1_SSO4_TT1_16_WG32_8_1_WGM1
    SolutionIndex: 26
    SolutionNameMin: Cijk_Ailk_Bljk_ZB_MT32x32x8_MI16x16x4x1_SN_1LDSB1_EPS0_IU2_NEPBS0_PGR2_PLR1_SIA2_SU0_SUS0_SPO0_SSO4_TT1_16_WG32_8_1_WGM1
    SolutionIndex: 27
    SolutionNameMin: Cijk_Ailk_Bljk_ZB_MT32x32x8_MI16x16x4x1_SN_1LDSB1_EPS0_IU2_NEPBS0_PGR2_PLR1_SIA2_SU32_SUS128_SPO0_SSO0_TT1_16_WG32_8_1_WGM10
    SolutionIndex: 28
    SolutionNameMin: Cijk_Ailk_Bljk_ZB_MT32x32x8_MI16x16x4x1_SN_1LDSB1_EPS1_IU2_NEPBS0_PGR1_PLR1_SIA2_SU32_SUS128_SPO1_SSO0_TT1_16_WG32_8_1_WGM10
    SolutionIndex: 29
    SolutionNameMin: Cijk_Ailk_Bljk_ZB_MT32x32x8_MI16x16x4x1_SN_1LDSB1_EPS0_IU2_NEPBS0_PGR2_PLR1_SIA2_SU0_SUS0_SPO0_SSO0_TT1_16_WG32_8_1_WGM10
    SolutionIndex: 30
    SolutionNameMin: Cijk_Ailk_Bljk_ZB_MT32x32x8_MI16x16x4x1_SN_1LDSB1_EPS1_IU2_NEPBS0_PGR1_PLR1_SIA2_SU0_SUS0_SPO0_SSO0_TT1_16_WG32_8_1_WGM10
    SolutionIndex: 31
    SolutionNameMin: Cijk_Ailk_Bljk_ZB_MT32x32x8_MI16x16x4x1_SN_1LDSB1_EPS0_IU2_NEPBS0_PGR2_PLR1_SIA2_SU0_SUS0_SPO0_SSO6_TT1_16_WG32_8_1_WGM10
    SolutionIndex: 32
    SolutionNameMin: Cijk_Ailk_Bljk_ZB_MT16x16x16_MI16x16x4x1_SN_1LDSB0_IU1_NLCA1_SIA3_TT1_16_WG16_4_1
    SolutionIndex: 33
    SolutionNameMin: Cijk_Ailk_Bljk_ZB_MT16x16x8_MI16x16x4x1_SN_1LDSB0_GSUAMB_IU1_NLCA1_SIA3_TT1_16_WG16_4_1
    SolutionIndex: 34
    SolutionNameMin: Cijk_Ailk_Bljk_ZB_MT16x16x16_MI16x16x4x1_SN_1LDSB0_GSUASB_IU1_NLCA1_SIA3_TT1_16_WG16_4_1
    SolutionIndex: 35
    SolutionNameMin: Cijk_Ailk_Bljk_ZB_MT16x16x8_MI16x16x4x1_SN_1LDSB1_GSUASB_IU2_NLCA1_SIA2_TT1_16_WG16_4_1
    SolutionIndex: 36
    SolutionNameMin: Cijk_Ailk_Bljk_ZB_MT16x16x16_MI16x16x4x1_SN_1LDSB0_GSUAMB_IU1_NLCA1_SIA3_TT1_16_WG16_4_1
    SolutionIndex: 37
    SolutionNameMin: Cijk_Ailk_Bljk_ZB_MT16x16x16_MI16x16x4x1_SN_1LDSB0_GSUAMB_IU1_NLCA1_SIA3_TT1_16_WG16_4_1
    SolutionIndex: 38
    SolutionNameMin: Cijk_Ailk_Bljk_ZB_MT16x16x16_MI16x16x4x1_SN_1LDSB0_GSUASB_IU1_NLCA1_SIA3_TT1_16_WG16_4_1
    SolutionIndex: 39
    SolutionNameMin: Cijk_Ailk_Bljk_ZB_MT16x16x8_MI16x16x4x1_SN_1LDSB0_GSUASB_IU1_NLCA1_SIA3_TT1_16_WG16_4_1
    SolutionIndex: 40
    SolutionNameMin: Cijk_Ailk_Bljk_ZB_MT16x16x8_MI16x16x4x1_SN_1LDSB0_GSUASB_IU1_NLCA1_SIA3_TT1_16_WG16_4_1
    SolutionIndex: 41
    SolutionNameMin: Cijk_Ailk_Bljk_ZB_MT64x32x8_MI16x16x4x1_SN_1LDSB1_EPS0_IU1_NEPBS0_PGR2_PLR1_SIA3_SU0_SUS0_SPO0_SSO6_TT1_32_WG64_4_1_WGM1
    SolutionIndex: 42
    SolutionNameMin: Cijk_Ailk_Bljk_ZB_MT16x16x16_MI16x16x4x1_SN_1LDSB0_EPS0_GSUAMB_GLS0_LPB1_PGR2_SS0_SU0_SUS0_SSO0
    SolutionIndex: 43
    SolutionNameMin: Cijk_Ailk_Bljk_ZB_MT64x32x16_MI16x16x4x1_SN_ASGT_ASEM32_LWPM0p50_NEPBS2_NLCA1_PLR1_SU4_TT1_32_WGM10
    SolutionIndex: 44
    SolutionNameMin: Cijk_Ailk_Bljk_ZB_MT64x32x16_MI16x16x4x1_SN_ASGT_ASEM1_LWPMn1_NEPBS2_NLCA1_PLR5_SU8_TT1_32_WGM7
    SolutionIndex: 45
    SolutionNameMin: Cijk_Ailk_Bljk_ZB_MT64x32x16_MI16x16x4x1_SN_ASGT332_ASEM32_LWPM0p25_NEPBS2_NLCA1_PLR5_SU4_TT1_32_WGM11
    SolutionIndex: 46
    SolutionNameMin: Cijk_Ailk_Bljk_ZB_MT64x64x16_MI16x16x4x1_SN_ASGT332_ASEM32_LWPM0p50_NEPBS2_NLCA1_PLR1_SU4_TT1_64_WGM8
    SolutionIndex: 47
    SolutionNameMin: Cijk_Ailk_Bljk_ZB_MT64x64x16_MI16x16x4x1_SN_ASGT332_ASEM32_LWPM0p50_NEPBS2_NLCA1_PLR1_SU8_TT1_64_WGM11
    SolutionIndex: 48
    SolutionNameMin: Cijk_Ailk_Bljk_ZB_MT64x64x16_MI16x16x4x1_SN_ASGT_ASEM32_LWPM0p50_NEPBS2_NLCA1_PLR1_SU4_TT1_64_WGM3
    SolutionIndex: 49
    SolutionNameMin: Cijk_Ailk_Bljk_ZB_MT64x64x16_MI16x16x4x1_SN_ASGT_ASEM32_LWPM0p50_NEPBS2_NLCA1_PLR1_SU4_TT1_64_WGM11
    SolutionIndex: 50
    SolutionNameMin: Cijk_Ailk_Bljk_ZB_MT64x32x16_MI16x16x4x1_SN_ASGT_ASEM32_LWPMn1_NEPBS2_NLCA1_PLR5_SU8_TT1_32_WGM8
    SolutionIndex: 51
    SolutionNameMin: Cijk_Ailk_Bljk_ZB_MT64x64x16_MI16x16x4x1_SN_ASGT332_ASEM1_LWPM0p50_NEPBS2_NLCA1_PLR1_SU4_TT1_64_WGM3
    SolutionIndex: 52
    SolutionNameMin: Cijk_Ailk_Bljk_ZB_MT64x32x16_MI16x16x4x1_SN_ASGT_ASEM32_LWPM0p25_NEPBS2_NLCA1_PLR5_SU8_TT1_32_WGM10
    SolutionIndex: 53
    SolutionNameMin: Cijk_Ailk_Bljk_ZB_MT64x32x16_MI16x16x4x1_SN_ASGT332_ASEM32_LWPM0p50_NEPBS2_NLCA1_PLR1_SU4_TT1_32_WGM3
    SolutionIndex: 54
    SolutionNameMin: Cijk_Ailk_Bljk_ZB_MT64x32x16_MI16x16x4x1_SN_ASGT332_ASEM32_LWPM0p50_NEPBS2_NLCA1_PLR1_SU4_TT1_32_WGM13
    SolutionIndex: 55
    SolutionNameMin: Cijk_Ailk_Bljk_ZB_MT64x32x16_MI16x16x4x1_SN_ASGT332_ASEM1_LWPM0p25_NEPBS2_NLCA1_PLR5_SU8_TT1_32_WGM11
    SolutionIndex: 56
    SolutionNameMin: Cijk_Ailk_Bljk_ZB_MT64x64x16_MI16x16x4x1_SN_ASGT332_ASEM32_LWPM0p50_NEPBS2_NLCA1_PLR1_SU32_TT1_64_WGM9
    SolutionIndex: 57
    SolutionNameMin: Cijk_Ailk_Bljk_ZB_MT64x32x16_MI16x16x4x1_SN_ASGT_ASEM32_LWPM0p25_NEPBS2_NLCA1_PLR5_SU4_TT1_32_WGM6
    SolutionIndex: 58
    SolutionNameMin: Cijk_Ailk_Bljk_ZB_MT64x64x16_MI16x16x4x1_SN_ASGT_ASEM32_LWPM0p50_NEPBS2_NLCA1_PLR1_SU8_TT1_64_WGM4
    SolutionIndex: 59
    SolutionNameMin: Cijk_Ailk_Bljk_ZB_MT64x32x16_MI16x16x4x1_SN_ASGT332_ASEM32_LWPM0p50_NEPBS2_NLCA1_PLR5_SU8_TT1_32_WGM10
    SolutionIndex: 60
    SolutionNameMin: Cijk_Ailk_Bljk_ZB_MT64x64x16_MI16x16x4x1_SN_ASGT332_ASEM32_LWPMn1_NEPBS2_NLCA1_PLR1_SU4_TT1_64_WGM5
    SolutionIndex: 61
    SolutionNameMin: Cijk_Ailk_Bljk_ZB_MT64x32x16_MI16x16x4x1_SN_ASGT332_ASEM1_LWPM0p50_NEPBS2_NLCA1_PLR5_SU4_TT1_32_WGM3
    SolutionIndex: 62
    SolutionNameMin: Cijk_Ailk_Bljk_ZB_MT64x64x16_MI16x16x4x1_SN_ASGT_ASEM1_LWPMn1_NEPBS2_NLCA1_PLR1_SU32_TT1_64_WGM3
    SolutionIndex: 63
    SolutionNameMin: Cijk_Ailk_Bljk_ZB_MT64x64x16_MI16x16x4x1_SN_ASGT332_ASEM32_LWPMn1_NEPBS2_NLCA1_PLR1_SU32_TT1_64_WGM7
    SolutionIndex: 64
    SolutionNameMin: Cijk_Ailk_Bljk_ZB_MT64x64x16_MI16x16x4x1_SN_ASGT332_ASEM32_LWPMn1_NEPBS2_NLCA1_PLR1_SU32_TT1_64_WGM3
    SolutionIndex: 65
    SolutionNameMin: Cijk_Ailk_Bljk_ZB_MT64x64x16_MI16x16x4x1_SN_ASGT_ASEM32_LWPM0p50_NEPBS2_NLCA1_PLR1_SU16_TT1_64_WGM4
    SolutionIndex: 66
    SolutionNameMin: Cijk_Ailk_Bljk_ZB_MT64x64x16_MI16x16x4x1_SN_ASGT332_ASEM1_LWPM0p50_NEPBS2_NLCA1_PLR1_SU8_TT1_64_WGM5
    SolutionIndex: 67
    SolutionNameMin: Cijk_Ailk_Bljk_ZB_MT64x64x16_MI16x16x4x1_SN_ASGT332_ASEM1_LWPMn1_NEPBS2_NLCA1_PLR1_SU8_TT1_64_WGM7
    SolutionIndex: 68
    SolutionNameMin: Cijk_Ailk_Bljk_ZB_MT64x64x16_MI16x16x4x1_SN_ASGT332_ASEM32_LWPMn1_NEPBS2_NLCA1_PLR1_SU8_TT1_64_WGM5
    SolutionIndex: 69
    SolutionNameMin: Cijk_Ailk_Bljk_ZB_MT64x64x16_MI16x16x4x1_SN_ASGT332_ASEM1_LWPM0p50_NEPBS2_NLCA1_PLR1_SU4_TT1_64_WGM5
    SolutionIndex: 70
    SolutionNameMin: Cijk_Ailk_Bljk_ZB_MT64x64x16_MI16x16x4x1_SN_ASGT332_ASEM1_LWPM0p50_NEPBS2_NLCA1_PLR1_SU4_TT1_64_WGM13
    SolutionIndex: 71
    SolutionNameMin: Cijk_Ailk_Bljk_ZB_MT64x64x16_MI16x16x4x1_SN_ASGT332_ASEM32_LWPM0p50_NEPBS2_NLCA1_PLR1_SU8_TT1_64_WGM3
    SolutionIndex: 72
    SolutionNameMin: Cijk_Ailk_Bljk_ZB_MT64x64x16_MI16x16x4x1_SN_ASGT_ASEM1_LWPM0p50_NEPBS2_NLCA1_PLR1_SU4_TT1_64_WGM3
    SolutionIndex: 73
    SolutionNameMin: Cijk_Ailk_Bljk_ZB_MT64x64x16_MI16x16x4x1_SN_ASGT332_ASEM32_LWPM0p50_NEPBS2_NLCA1_PLR1_SU4_TT1_64_WGM7
    SolutionIndex: 74
    SolutionNameMin: Cijk_Ailk_Bljk_ZB_MT64x64x16_MI16x16x4x1_SN_ASGT332_ASEM32_LWPM0p50_NEPBS2_NLCA1_PLR1_SU8_TT1_64_WGM4
    SolutionIndex: 75
    SolutionNameMin: Cijk_Ailk_Bljk_ZB_MT64x64x16_MI16x16x4x1_SN_ASGT332_ASEM32_LWPM0p50_NEPBS2_NLCA1_PLR1_SU16_TT1_64_WGM5
    SolutionIndex: 76
    SolutionNameMin: Cijk_Ailk_Bljk_ZB_MT64x64x16_MI16x16x4x1_SN_ASGT332_ASEM32_LWPM0p50_NEPBS2_NLCA1_PLR1_SU16_TT1_64_WGM4
    SolutionIndex: 77
    SolutionNameMin: Cijk_Ailk_Bljk_ZB_MT64x64x16_MI16x16x4x1_SN_ASGT332_ASEM32_LWPMn1_NEPBS2_NLCA1_PLR1_SU16_TT1_64_WGM4
    SolutionIndex: 78
    SolutionNameMin: Cijk_Ailk_Bljk_ZB_MT64x64x16_MI16x16x4x1_SN_ASGT_ASEM32_LWPM0p50_NEPBS2_NLCA1_PLR1_SU8_TT1_64_WGM6
    SolutionIndex: 79
    SolutionNameMin: Cijk_Ailk_Bljk_ZB_MT64x64x16_MI16x16x4x1_SN_ASGT332_ASEM1_LWPM0p50_NEPBS2_NLCA1_PLR1_SU16_TT1_64_WGM11
    SolutionIndex: 80
    SolutionNameMin: Cijk_Ailk_Bljk_ZB_MT64x64x16_MI16x16x4x1_SN_ASGT332_ASEM32_LWPM0p50_NEPBS2_NLCA1_PLR1_SU8_TT1_64_WGM7
    SolutionIndex: 81
    SolutionNameMin: Cijk_Ailk_Bljk_ZB_MT64x64x16_MI16x16x4x1_SN_ASGT332_ASEM32_LWPM0p50_NEPBS2_NLCA1_PLR1_SU32_TT1_64_WGM6
    SolutionIndex: 82
    SolutionNameMin: Cijk_Ailk_Bljk_ZB_MT64x64x16_MI16x16x4x1_SN_ASGT332_ASEM1_LWPM0p50_NEPBS2_NLCA1_PLR1_SU4_TT1_64_WGM6
    SolutionIndex: 83
    SolutionNameMin: Cijk_Ailk_Bljk_ZB_MT64x64x16_MI16x16x4x1_SN_ASGT332_ASEM32_LWPMn1_NEPBS2_NLCA1_PLR1_SU8_TT1_64_WGM10
    SolutionIndex: 84
    SolutionNameMin: Cijk_Ailk_Bljk_ZB_MT64x64x16_MI16x16x4x1_SN_ASGT332_ASEM1_LWPM0p50_NEPBS2_NLCA1_PLR1_SU4_TT1_64_WGM7
    SolutionIndex: 85
    SolutionNameMin: Cijk_Ailk_Bljk_ZB_MT64x96x16_MI16x16x4x1_SN_ASGT332_ASEM32_LWPM0p50_NEPBS2_NLCA1_PLR1_SU4_TT1_96_WGM13
    SolutionIndex: 86
    SolutionNameMin: Cijk_Ailk_Bljk_ZB_MT64x64x16_MI16x16x4x1_SN_ASGT332_ASEM1_LWPM0p50_NEPBS2_NLCA1_PLR1_SU8_TT1_64_WGM10
    SolutionIndex: 87
    SolutionNameMin: Cijk_Ailk_Bljk_ZB_MT64x64x16_MI16x16x4x1_SN_ASGT332_ASEM32_LWPMn1_NEPBS2_NLCA1_PLR1_SU4_TT1_64_WGM4
    SolutionIndex: 88
    SolutionNameMin: Cijk_Ailk_Bljk_ZB_MT64x64x16_MI16x16x4x1_SN_ASGT332_ASEM32_LWPMn1_NEPBS2_NLCA1_PLR1_SU4_TT1_64_WGM3
    SolutionIndex: 89
    SolutionNameMin: Cijk_Ailk_Bljk_ZB_MT64x64x16_MI16x16x4x1_SN_ASGT_ASEM1_LWPM0p50_NEPBS2_NLCA1_PLR1_SU4_TT1_64_WGM8
    SolutionIndex: 90
    SolutionNameMin: Cijk_Ailk_Bljk_ZB_MT64x64x16_MI16x16x4x1_SN_ASGT332_ASEM32_LWPM0p50_NEPBS2_NLCA1_PLR1_SU16_TT1_64_WGM11
    SolutionIndex: 91
    SolutionNameMin: Cijk_Ailk_Bljk_ZB_MT64x96x16_MI16x16x4x1_SN_ASGT332_ASEM32_LWPMn1_NEPBS2_NLCA1_PLR1_SU16_TT1_96_WGM4
    SolutionIndex: 92
    SolutionNameMin: Cijk_Ailk_Bljk_ZB_MT64x64x16_MI16x16x4x1_SN_ASGT332_ASEM32_LWPM0p50_NEPBS2_NLCA1_PLR1_SU32_TT1_64_WGM11
    SolutionIndex: 93
    SolutionNameMin: Cijk_Ailk_Bljk_ZB_MT64x64x16_MI16x16x4x1_SN_ASGT332_ASEM32_LWPMn1_NEPBS2_NLCA1_PLR1_SU8_TT1_64_WGM3
    SolutionIndex: 94
    SolutionNameMin: Cijk_Ailk_Bljk_ZB_MT64x96x16_MI16x16x4x1_SN_ASGT332_ASEM32_LWPM0p50_NEPBS2_NLCA1_PLR1_SU32_TT1_96_WGM4
    SolutionIndex: 95
    SolutionNameMin: Cijk_Ailk_Bljk_ZB_MT64x64x16_MI16x16x4x1_SN_ASGT332_ASEM1_LWPM0p50_NEPBS2_NLCA1_PLR1_SU32_TT1_64_WGM11
    SolutionIndex: 96
    SolutionNameMin: Cijk_Ailk_Bljk_ZB_MT64x64x16_MI16x16x4x1_SN_ASGT332_ASEM1_LWPM0p50_NEPBS2_NLCA1_PLR1_SU16_TT1_64_WGM3
    SolutionIndex: 97
    SolutionNameMin: Cijk_Ailk_Bljk_ZB_MT64x64x16_MI16x16x4x1_SN_ASGT332_ASEM32_LWPM0p50_NEPBS2_NLCA1_PLR1_SU32_TT1_64_WGM4
    SolutionIndex: 98
    SolutionNameMin: Cijk_Ailk_Bljk_ZB_MT64x64x16_MI16x16x4x1_SN_ASGT_ASEM1_LWPM0p50_NEPBS2_NLCA1_PLR1_SU16_TT1_64_WGM9
    SolutionIndex: 99
    SolutionNameMin: Cijk_Ailk_Bljk_ZB_MT64x64x16_MI16x16x4x1_SN_ASGT332_ASEM1_LWPM0p50_NEPBS2_NLCA1_PLR1_SU8_TT1_64_WGM11
    SolutionIndex: 100
    SolutionNameMin: Cijk_Ailk_Bljk_ZB_MT64x96x16_MI16x16x4x1_SN_ASGT332_ASEM32_LWPM0p50_NEPBS2_NLCA1_PLR1_SU8_TT1_96_WGM3
    SolutionIndex: 101
    SolutionNameMin: Cijk_Ailk_Bljk_ZB_MT64x96x16_MI16x16x4x1_SN_ASGT332_ASEM1_LWPMn1_NEPBS2_NLCA1_PLR1_SU16_TT1_96_WGM9
    SolutionIndex: 102
    SolutionNameMin: Cijk_Ailk_Bljk_ZB_MT64x96x16_MI16x16x4x1_SN_ASGT332_ASEM1_LWPM0p50_NEPBS2_NLCA1_PLR1_SU8_TT1_96_WGM7
    SolutionIndex: 103
    SolutionNameMin: Cijk_Ailk_Bljk_ZB_MT64x64x16_MI16x16x4x1_SN_ASGT_ASEM32_LWPM0p50_NEPBS2_NLCA1_PLR1_SU32_TT1_64_WGM12
    SolutionIndex: 104
    SolutionNameMin: Cijk_Ailk_Bljk_ZB_MT64x96x16_MI16x16x4x1_SN_ASGT332_ASEM32_LWPMn1_NEPBS2_NLCA1_PLR1_SU16_TT1_96_WGM8
    SolutionIndex: 105
    SolutionNameMin: Cijk_Ailk_Bljk_ZB_MT64x96x16_MI16x16x4x1_SN_ASGT332_ASEM32_LWPM0p50_NEPBS2_NLCA1_PLR1_SU8_TT1_96_WGM11
    SolutionIndex: 106
    SolutionNameMin: Cijk_Ailk_Bljk_ZB_MT64x96x16_MI16x16x4x1_SN_ASGT332_ASEM32_LWPM0p50_NEPBS2_NLCA1_PLR1_SU16_TT1_96_WGM11
    SolutionIndex: 107
    SolutionNameMin: Cijk_Ailk_Bljk_ZB_MT64x96x16_MI16x16x4x1_SN_ASGT332_ASEM1_LWPM0p50_NEPBS2_NLCA1_PLR1_SU4_TT1_96_WGM7
    SolutionIndex: 108
    SolutionNameMin: Cijk_Ailk_Bljk_ZB_MT64x96x16_MI16x16x4x1_SN_ASGT332_ASEM1_LWPM0p50_NEPBS2_NLCA1_PLR1_SU8_TT1_96_WGM9
    SolutionIndex: 109
    SolutionNameMin: Cijk_Ailk_Bljk_ZB_MT64x96x16_MI16x16x4x1_SN_ASGT332_ASEM1_LWPM0p50_NEPBS2_NLCA1_PLR1_SU4_TT1_96_WGM11
    SolutionIndex: 110
    SolutionNameMin: Cijk_Ailk_Bljk_ZB_MT64x96x16_MI16x16x4x1_SN_ASGT332_ASEM1_LWPM0p50_NEPBS2_NLCA1_PLR1_SU32_TT1_96_WGM13
    SolutionIndex: 111
    SolutionNameMin: Cijk_Ailk_Bljk_ZB_MT64x96x16_MI16x16x4x1_SN_ASGT332_ASEM1_LWPMn1_NEPBS2_NLCA1_PLR1_SU4_TT1_96_WGM6
    SolutionIndex: 112
    SolutionNameMin: Cijk_Ailk_Bljk_ZB_MT64x96x16_MI16x16x4x1_SN_ASGT332_ASEM32_LWPM0p50_NEPBS2_NLCA1_PLR1_SU8_TT1_96_WGM12
    SolutionIndex: 113
    SolutionNameMin: Cijk_Ailk_Bljk_ZB_MT64x96x16_MI16x16x4x1_SN_ASGT332_ASEM32_LWPM0p50_NEPBS2_NLCA1_PLR1_SU4_TT1_96_WGM11
    SolutionIndex: 114
    SolutionNameMin: Cijk_Ailk_Bljk_ZB_MT64x96x16_MI16x16x4x1_SN_ASGT332_ASEM1_LWPM0p50_NEPBS2_NLCA1_PLR1_SU4_TT1_96_WGM6
    SolutionIndex: 115
    SolutionNameMin: Cijk_Ailk_Bljk_ZB_MT64x96x16_MI16x16x4x1_SN_ASGT332_ASEM32_LWPM0p50_NEPBS2_NLCA1_PLR1_SU4_TT1_96_WGM6
    SolutionIndex: 116
    SolutionNameMin: Cijk_Ailk_Bljk_ZB_MT64x96x16_MI16x16x4x1_SN_ASGT332_ASEM32_LWPMn1_NEPBS2_NLCA1_PLR1_SU32_TT1_96_WGM9
    SolutionIndex: 117
    SolutionNameMin: Cijk_Ailk_Bljk_ZB_MT64x96x16_MI16x16x4x1_SN_ASGT332_ASEM32_LWPM0p50_NEPBS2_NLCA1_PLR1_SU4_TT1_96_WGM10
    SolutionIndex: 118
    SolutionNameMin: Cijk_Ailk_Bljk_ZB_MT64x96x16_MI16x16x4x1_SN_ASGT332_ASEM32_LWPM0p50_NEPBS2_NLCA1_PLR1_SU16_TT1_96_WGM9
    SolutionIndex: 119
    SolutionNameMin: Cijk_Ailk_Bljk_ZB_MT64x96x16_MI16x16x4x1_SN_ASGT332_ASEM32_LWPM0p50_NEPBS2_NLCA1_PLR1_SU8_TT1_96_WGM7
    SolutionIndex: 120
    SolutionNameMin: Cijk_Ailk_Bljk_ZB_MT64x96x16_MI16x16x4x1_SN_ASGT332_ASEM1_LWPMn1_NEPBS2_NLCA1_PLR1_SU4_TT1_96_WGM5
    SolutionIndex: 121
    SolutionNameMin: Cijk_Ailk_Bljk_ZB_MT64x96x16_MI16x16x4x1_SN_ASGT332_ASEM32_LWPMn1_NEPBS2_NLCA1_PLR1_SU4_TT1_96_WGM7
    SolutionIndex: 122
    SolutionNameMin: Cijk_Ailk_Bljk_ZB_MT64x96x16_MI16x16x4x1_SN_ASGT332_ASEM1_LWPM0p50_NEPBS2_NLCA1_PLR1_SU16_TT1_96_WGM3
    SolutionIndex: 123
    SolutionNameMin: Cijk_Ailk_Bljk_ZB_MT64x96x16_MI16x16x4x1_SN_ASGT332_ASEM1_LWPM0p50_NEPBS2_NLCA1_PLR1_SU8_TT1_96_WGM5
    SolutionIndex: 124
    SolutionNameMin: Cijk_Ailk_Bljk_ZB_MT64x96x16_MI16x16x4x1_SN_ASGT332_ASEM32_LWPM0p50_NEPBS2_NLCA1_PLR1_SU4_TT1_96_WGM7
    SolutionIndex: 125
    SolutionNameMin: Cijk_Ailk_Bljk_ZB_MT64x96x16_MI16x16x4x1_SN_ASGT332_ASEM1_LWPM0p50_NEPBS2_NLCA1_PLR1_SU4_TT1_96_WGM10
    SolutionIndex: 126
    SolutionNameMin: Cijk_Ailk_Bljk_ZB_MT64x96x16_MI16x16x4x1_SN_ASGT332_ASEM32_LWPM0p50_NEPBS2_NLCA1_PLR1_SU32_TT1_96_WGM7
    SolutionIndex: 127
    SolutionNameMin: Cijk_Ailk_Bljk_ZB_MT64x96x16_MI16x16x4x1_SN_ASGT332_ASEM1_LWPM0p50_NEPBS2_NLCA1_PLR1_SU4_TT1_96_WGM5
    SolutionIndex: 128
    SolutionNameMin: Cijk_Ailk_Bljk_ZB_MT64x96x16_MI16x16x4x1_SN_ASGT332_ASEM32_LWPM0p50_NEPBS2_NLCA1_PLR1_SU16_TT1_96_WGM7
    SolutionIndex: 129
    SolutionNameMin: Cijk_Ailk_Bljk_ZB_MT64x96x16_MI16x16x4x1_SN_ASGT332_ASEM1_LWPMn1_NEPBS2_NLCA1_PLR1_SU8_TT1_96_WGM5
    SolutionIndex: 130
    SolutionNameMin: Cijk_Ailk_Bljk_ZB_MT64x96x16_MI16x16x4x1_SN_ASGT332_ASEM1_LWPMn1_NEPBS2_NLCA1_PLR1_SU8_TT1_96_WGM7
    SolutionIndex: 131
    SolutionNameMin: Cijk_Ailk_Bljk_ZB_MT64x96x16_MI16x16x4x1_SN_ASGT332_ASEM32_LWPM0p50_NEPBS2_NLCA1_PLR1_SU8_TT1_96_WGM8
    SolutionIndex: 132
    SolutionNameMin: Cijk_Ailk_Bljk_ZB_MT64x96x16_MI16x16x4x1_SN_ASGT332_ASEM1_LWPMn1_NEPBS2_NLCA1_PLR1_SU4_TT1_96_WGM9
    SolutionIndex: 133
    SolutionNameMin: Cijk_Ailk_Bljk_ZB_MT64x96x16_MI16x16x4x1_SN_ASGT332_ASEM1_LWPM0p50_NEPBS2_NLCA1_PLR1_SU16_TT1_96_WGM5
    SolutionIndex: 134
    SolutionNameMin: Cijk_Ailk_Bljk_ZB_MT64x96x16_MI16x16x4x1_SN_ASGT332_ASEM1_LWPMn1_NEPBS2_NLCA1_PLR1_SU16_TT1_96_WGM5
    SolutionIndex: 135
    SolutionNameMin: Cijk_Ailk_Bljk_ZB_MT64x96x16_MI16x16x4x1_SN_ASGT332_ASEM1_LWPM0p50_NEPBS2_NLCA1_PLR1_SU16_TT1_96_WGM6
    SolutionIndex: 136
    SolutionNameMin: Cijk_Ailk_Bljk_ZB_MT64x96x16_MI16x16x4x1_SN_ASGT332_ASEM1_LWPM0p50_NEPBS2_NLCA1_PLR1_SU8_TT1_96_WGM6
    SolutionIndex: 137
    SolutionNameMin: Cijk_Ailk_Bljk_ZB_MT64x96x16_MI16x16x4x1_SN_ASGT332_ASEM1_LWPM0p50_NEPBS2_NLCA1_PLR1_SU32_TT1_96_WGM5
    SolutionIndex: 138
    SolutionNameMin: Cijk_Ailk_Bljk_ZB_MT64x96x16_MI16x16x4x1_SN_ASGT332_ASEM1_LWPMn1_NEPBS2_NLCA1_PLR1_SU32_TT1_96_WGM5
    SolutionIndex: 139
    SolutionNameMin: Cijk_Ailk_Bljk_ZB_MT64x96x16_MI16x16x4x1_SN_ASGT332_LWPM0p50_NEPBS1_SU32_SUS256_WGM10
    SolutionIndex: 140
    SolutionNameMin: Cijk_Ailk_Bljk_ZB_MT64x96x16_MI16x16x4x1_SN_ASGT332_LWPM0p50_NEPBS1_SU16_SUS256_WGM10
    SolutionIndex: 141
    SolutionNameMin: Cijk_Ailk_Bljk_ZB_MT64x96x16_MI16x16x4x1_SN_ASGT332_LWPM0p50_NEPBS1_SU32_SUS256_WGM5
    SolutionIndex: 142
    SolutionNameMin: Cijk_Ailk_Bljk_ZB_MT64x96x16_MI16x16x4x1_SN_ASGT332_LWPM0p50_NEPBS1_SU4_SUS256_WGM5
    SolutionIndex: 143
    SolutionNameMin: Cijk_Ailk_Bljk_ZB_MT64x96x16_MI16x16x4x1_SN_ASGT_LWPM0p50_NEPBS1_SU32_SUS256_WGM5
    SolutionIndex: 144
    SolutionNameMin: Cijk_Ailk_Bljk_ZB_MT64x96x16_MI16x16x4x1_SN_ASGT332_LWPM0p50_NEPBS1_SU32_SUS256_WGM7
    SolutionIndex: 145
    SolutionNameMin: Cijk_Ailk_Bljk_ZB_MT64x96x16_MI16x16x4x1_SN_ASGT_LWPM0p50_NEPBS1_SU32_SUS256_WGM7
    SolutionIndex: 146
    SolutionNameMin: Cijk_Ailk_Bljk_ZB_MT64x96x16_MI16x16x4x1_SN_ASGT_LWPM0p50_NEPBS1_SU16_SUS256_WGM10
    SolutionIndex: 147
    SolutionNameMin: Cijk_Ailk_Bljk_ZB_MT64x96x16_MI16x16x4x1_SN_ASGT_LWPM0p50_NEPBS1_SU0_SUS0_WGM5
    SolutionIndex: 148
    SolutionNameMin: Cijk_Ailk_Bljk_ZB_MT64x96x16_MI16x16x4x1_SN_ASGT332_LWPM0p50_NEPBS1_SU0_SUS0_WGM7
    SolutionIndex: 149
    SolutionNameMin: Cijk_Ailk_Bljk_ZB_MT64x96x16_MI16x16x4x1_SN_ASGT332_LWPM0p50_NEPBS1_SU16_SUS256_WGM5
    SolutionIndex: 150
    SolutionNameMin: Cijk_Ailk_Bljk_ZB_MT64x96x16_MI16x16x4x1_SN_ASGT332_LWPM0p50_NEPBS1_SU0_SUS0_WGM3
    SolutionIndex: 151
    SolutionNameMin: Cijk_Ailk_Bljk_ZB_MT64x96x16_MI16x16x4x1_SN_ASGT_LWPM0p50_NEPBS1_SU4_SUS256_WGM5
- - - [364, 364, 1, 364, 364, 364, 364, 364]
    - [0, 24.353]
  - - [364, 364, 1024, 364, 364, 364, 364, 364]
    - [4, 75.792]
  - - [364, 364, 128, 364, 364, 364, 364, 364]
    - [3, 74.754]
  - - [364, 364, 16, 364, 364, 364, 364, 364]
    - [1, 61.716]
  - - [364, 364, 256, 364, 364, 364, 364, 364]
    - [4, 75.336]
  - - [364, 364, 32, 364, 364, 364, 364, 364]
    - [2, 68.848]
  - - [364, 364, 512, 364, 364, 364, 364, 364]
    - [4, 75.642]
  - - [364, 364, 64, 364, 364, 364, 364, 364]
    - [3, 73.67]
  - - [64, 1, 1, 256, 64, 64, 64, 256]
    - [5, 0.017]
  - - [64, 64, 1, 256, 64, 64, 64, 256]
    - [5, 1.146]
  - - [1, 1, 1, 256, 1, 1, 1, 256]
    - [6, 0.0]
  - - [1, 64, 1, 256, 1, 1, 1, 256]
    - [5, 0.014]
  - - [32, 32, 1, 64, 3296, 3296, 3296, 3296]
    - [33, 0.097]
  - - [48, 16, 1, 16, 3296, 3296, 3296, 3296]
    - [34, 0.023]
  - - [64, 32, 1, 16, 3296, 3296, 3296, 3296]
    - [35, 0.062]
  - - [80, 48, 1, 16, 3296, 3296, 3296, 3296]
    - [36, 0.124]
  - - [96, 96, 1, 64, 3296, 3296, 3296, 3296]
    - [7, 0.941]
  - - [106, 106, 1, 128, 7146, 7146, 7146, 7146]
    - [32, 1.74]
  - - [128, 128, 1, 128, 13184, 13184, 13184, 13184]
    - [42, 2.7]
  - - [160, 160, 1, 64, 3296, 3296, 3296, 3296]
    - [37, 2.363]
  - - [224, 224, 1, 64, 3296, 3296, 3296, 3296]
    - [38, 4.523]
  - - [234, 234, 1, 128, 7146, 7146, 7146, 7146]
    - [39, 7.566]
  - - [256, 256, 1, 128, 13184, 13184, 13184, 13184]
    - [40, 9.11]
  - - [288, 288, 1, 64, 3296, 3296, 3296, 3296]
    - [13, 7.25]
  - - [352, 352, 1, 64, 3296, 3296, 3296, 3296]
    - [24, 10.359]
  - - [362, 362, 1, 128, 7146, 7146, 7146, 7146]
    - [15, 17.279]
  - - [384, 384, 1, 128, 13184, 13184, 13184, 13184]
    - [25, 18.799]
  - - [416, 416, 1, 64, 3296, 3296, 3296, 3296]
    - [8, 14.061]
  - - [480, 480, 1, 64, 3296, 3296, 3296, 3296]
    - [26, 17.375]
  - - [490, 490, 1, 128, 7146, 7146, 7146, 7146]
    - [9, 26.383]
  - - [512, 512, 1, 128, 13184, 13184, 13184, 13184]
    - [27, 28.267]
  - - [544, 544, 1, 64, 3296, 3296, 3296, 3296]
    - [20, 21.207]
  - - [608, 608, 1, 64, 3296, 3296, 3296, 3296]
    - [16, 24.233]
  - - [618, 618, 1, 128, 7146, 7146, 7146, 7146]
    - [17, 33.895]
  - - [640, 640, 1, 128, 13184, 13184, 13184, 13184]
    - [28, 36.352]
  - - [672, 672, 1, 64, 3296, 3296, 3296, 3296]
    - [10, 25.792]
  - - [736, 736, 1, 64, 3296, 3296, 3296, 3296]
    - [29, 27.532]
  - - [746, 746, 1, 128, 7146, 7146, 7146, 7146]
    - [18, 36.378]
  - - [768, 768, 1, 128, 13184, 13184, 13184, 13184]
    - [21, 38.123]
  - - [800, 800, 1, 64, 3296, 3296, 3296, 3296]
    - [30, 30.138]
  - - [864, 864, 1, 64, 3296, 3296, 3296, 3296]
    - [19, 31.781]
  - - [874, 874, 1, 128, 7146, 7146, 7146, 7146]
    - [14, 39.789]
  - - [896, 896, 1, 128, 13184, 13184, 13184, 13184]
    - [43, 43.179]
  - - [928, 928, 1, 64, 3296, 3296, 3296, 3296]
    - [31, 31.643]
  - - [992, 992, 1, 64, 3296, 3296, 3296, 3296]
    - [22, 32.909]
  - - [1002, 1002, 1, 128, 7146, 7146, 7146, 7146]
    - [44, 42.197]
  - - [1024, 1024, 1, 128, 13184, 13184, 13184, 13184]
    - [45, 48.196]
  - - [1056, 1056, 1, 64, 3296, 3296, 3296, 3296]
    - [16, 34.217]
  - - [1120, 1120, 1, 64, 3296, 3296, 3296, 3296]
    - [12, 36.182]
  - - [1130, 1130, 1, 128, 7146, 7146, 7146, 7146]
    - [46, 48.538]
  - - [1152, 1152, 1, 128, 13184, 13184, 13184, 13184]
    - [47, 52.704]
  - - [1184, 1184, 1, 64, 3296, 3296, 3296, 3296]
    - [23, 37.181]
  - - [1248, 1248, 1, 64, 3296, 3296, 3296, 3296]
    - [11, 38.233]
  - - [1258, 1258, 1, 128, 7146, 7146, 7146, 7146]
    - [48, 50.575]
  - - [1280, 1280, 1, 128, 13184, 13184, 13184, 13184]
    - [49, 54.005]
  - - [1312, 1312, 1, 64, 3296, 3296, 3296, 3296]
    - [41, 39.483]
  - - [1376, 1376, 1, 64, 3296, 3296, 3296, 3296]
    - [50, 40.227]
  - - [1386, 1386, 1, 128, 7146, 7146, 7146, 7146]
    - [51, 52.33]
  - - [1408, 1408, 1, 128, 13184, 13184, 13184, 13184]
    - [52, 57.106]
  - - [1440, 1440, 1, 64, 3296, 3296, 3296, 3296]
    - [53, 40.893]
  - - [1504, 1504, 1, 64, 3296, 3296, 3296, 3296]
    - [54, 41.554]
  - - [1514, 1514, 1, 128, 7146, 7146, 7146, 7146]
    - [51, 53.531]
  - - [1536, 1536, 1, 128, 13184, 13184, 13184, 13184]
    - [55, 58.787]
  - - [1568, 1568, 1, 64, 3296, 3296, 3296, 3296]
    - [56, 42.782]
  - - [1632, 1632, 1, 64, 3296, 3296, 3296, 3296]
    - [57, 43.833]
  - - [1642, 1642, 1, 128, 7146, 7146, 7146, 7146]
    - [58, 55.693]
  - - [1664, 1664, 1, 128, 13184, 13184, 13184, 13184]
    - [59, 60.443]
  - - [1696, 1696, 1, 64, 3296, 3296, 3296, 3296]
    - [60, 44.783]
  - - [1760, 1760, 1, 64, 3296, 3296, 3296, 3296]
    - [61, 45.235]
  - - [1770, 1770, 1, 128, 7146, 7146, 7146, 7146]
    - [62, 57.189]
  - - [1792, 1792, 1, 128, 13184, 13184, 13184, 13184]
    - [51, 62.792]
  - - [1824, 1824, 1, 64, 3296, 3296, 3296, 3296]
    - [63, 46.299]
  - - [1888, 1888, 1, 64, 3296, 3296, 3296, 3296]
    - [64, 46.415]
  - - [1898, 1898, 1, 128, 7146, 7146, 7146, 7146]
    - [65, 59.16]
  - - [1920, 1920, 1, 128, 13184, 13184, 13184, 13184]
    - [66, 64.486]
  - - [1952, 1952, 1, 64, 3296, 3296, 3296, 3296]
    - [67, 48.306]
  - - [2016, 2016, 1, 64, 3296, 3296, 3296, 3296]
    - [68, 48.189]
  - - [2026, 2026, 1, 128, 7146, 7146, 7146, 7146]
    - [69, 60.75]
  - - [2048, 2048, 1, 128, 13184, 13184, 13184, 13184]
    - [70, 66.377]
  - - [2080, 2080, 1, 64, 3296, 3296, 3296, 3296]
    - [71, 49.912]
  - - [2144, 2144, 1, 64, 3296, 3296, 3296, 3296]
    - [71, 49.982]
  - - [2154, 2154, 1, 128, 7146, 7146, 7146, 7146]
    - [72, 62.241]
  - - [2176, 2176, 1, 128, 13184, 13184, 13184, 13184]
    - [73, 68.027]
  - - [2208, 2208, 1, 64, 3296, 3296, 3296, 3296]
    - [71, 50.04]
  - - [2272, 2272, 1, 64, 3296, 3296, 3296, 3296]
    - [74, 51.206]
  - - [2282, 2282, 1, 128, 7146, 7146, 7146, 7146]
    - [62, 63.709]
  - - [2304, 2304, 1, 128, 13184, 13184, 13184, 13184]
    - [75, 69.082]
  - - [2336, 2336, 1, 64, 3296, 3296, 3296, 3296]
    - [76, 51.475]
  - - [2400, 2400, 1, 64, 3296, 3296, 3296, 3296]
    - [77, 51.794]
  - - [2410, 2410, 1, 128, 7146, 7146, 7146, 7146]
    - [78, 63.998]
  - - [2432, 2432, 1, 128, 13184, 13184, 13184, 13184]
    - [79, 69.842]
  - - [2464, 2464, 1, 64, 3296, 3296, 3296, 3296]
    - [80, 52.783]
  - - [2528, 2528, 1, 64, 3296, 3296, 3296, 3296]
    - [81, 53.042]
  - - [2538, 2538, 1, 128, 7146, 7146, 7146, 7146]
    - [82, 64.902]
  - - [2560, 2560, 1, 128, 13184, 13184, 13184, 13184]
    - [83, 70.959]
  - - [2592, 2592, 1, 64, 3296, 3296, 3296, 3296]
    - [84, 53.271]
  - - [2656, 2656, 1, 64, 3296, 3296, 3296, 3296]
    - [68, 54.328]
  - - [2666, 2666, 1, 128, 7146, 7146, 7146, 7146]
    - [85, 65.677]
  - - [2688, 2688, 1, 128, 13184, 13184, 13184, 13184]
    - [86, 71.643]
  - - [2720, 2720, 1, 64, 3296, 3296, 3296, 3296]
    - [87, 54.4]
  - - [2784, 2784, 1, 64, 3296, 3296, 3296, 3296]
    - [88, 54.456]
  - - [2794, 2794, 1, 128, 7146, 7146, 7146, 7146]
    - [89, 66.148]
  - - [2816, 2816, 1, 128, 13184, 13184, 13184, 13184]
    - [90, 72.377]
  - - [2848, 2848, 1, 64, 3296, 3296, 3296, 3296]
    - [60, 54.851]
  - - [2912, 2912, 1, 64, 3296, 3296, 3296, 3296]
    - [88, 55.146]
  - - [2922, 2922, 1, 128, 7146, 7146, 7146, 7146]
    - [91, 67.351]
  - - [2944, 2944, 1, 128, 13184, 13184, 13184, 13184]
    - [92, 73.065]
  - - [2976, 2976, 1, 64, 3296, 3296, 3296, 3296]
    - [93, 55.53]
  - - [3040, 3040, 1, 64, 3296, 3296, 3296, 3296]
    - [93, 55.997]
  - - [3050, 3050, 1, 128, 7146, 7146, 7146, 7146]
    - [94, 67.946]
  - - [3072, 3072, 1, 128, 13184, 13184, 13184, 13184]
    - [95, 73.415]
  - - [3104, 3104, 1, 64, 3296, 3296, 3296, 3296]
    - [96, 56.138]
  - - [3168, 3168, 1, 64, 3296, 3296, 3296, 3296]
    - [97, 56.398]
  - - [3178, 3178, 1, 128, 7146, 7146, 7146, 7146]
    - [98, 67.507]
  - - [3200, 3200, 1, 128, 13184, 13184, 13184, 13184]
    - [99, 73.812]
  - - [3232, 3232, 1, 64, 3296, 3296, 3296, 3296]
    - [76, 56.551]
  - - [3306, 3306, 1, 128, 7146, 7146, 7146, 7146]
    - [100, 67.992]
  - - [3328, 3328, 1, 128, 13184, 13184, 13184, 13184]
    - [47, 74.245]
  - - [3434, 3434, 1, 128, 7146, 7146, 7146, 7146]
    - [101, 69.111]
  - - [3456, 3456, 1, 128, 13184, 13184, 13184, 13184]
    - [102, 74.969]
  - - [3562, 3562, 1, 128, 7146, 7146, 7146, 7146]
    - [103, 68.544]
  - - [3584, 3584, 1, 128, 13184, 13184, 13184, 13184]
    - [79, 75.185]
  - - [3690, 3690, 1, 128, 7146, 7146, 7146, 7146]
    - [104, 69.384]
  - - [3712, 3712, 1, 128, 13184, 13184, 13184, 13184]
    - [79, 75.499]
  - - [3818, 3818, 1, 128, 7146, 7146, 7146, 7146]
    - [105, 70.483]
  - - [3840, 3840, 1, 128, 13184, 13184, 13184, 13184]
    - [106, 75.928]
  - - [3946, 3946, 1, 128, 7146, 7146, 7146, 7146]
    - [107, 69.952]
  - - [3968, 3968, 1, 128, 13184, 13184, 13184, 13184]
    - [92, 76.018]
  - - [4074, 4074, 1, 128, 7146, 7146, 7146, 7146]
    - [108, 70.67]
  - - [4096, 4096, 1, 128, 13184, 13184, 13184, 13184]
    - [109, 76.097]
  - - [4202, 4202, 1, 128, 7146, 7146, 7146, 7146]
    - [110, 71.212]
  - - [4224, 4224, 1, 128, 13184, 13184, 13184, 13184]
    - [111, 76.835]
  - - [4330, 4330, 1, 128, 7146, 7146, 7146, 7146]
    - [112, 70.883]
  - - [4352, 4352, 1, 128, 13184, 13184, 13184, 13184]
    - [92, 76.722]
  - - [4458, 4458, 1, 128, 7146, 7146, 7146, 7146]
    - [113, 71.504]
  - - [4480, 4480, 1, 128, 13184, 13184, 13184, 13184]
    - [114, 77.156]
  - - [4586, 4586, 1, 128, 7146, 7146, 7146, 7146]
    - [115, 72.105]
  - - [4608, 4608, 1, 128, 13184, 13184, 13184, 13184]
    - [111, 77.497]
  - - [4714, 4714, 1, 128, 7146, 7146, 7146, 7146]
    - [102, 71.641]
  - - [4736, 4736, 1, 128, 13184, 13184, 13184, 13184]
    - [79, 77.173]
  - - [4842, 4842, 1, 128, 7146, 7146, 7146, 7146]
    - [116, 72.137]
  - - [4864, 4864, 1, 128, 13184, 13184, 13184, 13184]
    - [90, 77.529]
  - - [4970, 4970, 1, 128, 7146, 7146, 7146, 7146]
    - [102, 72.548]
  - - [4992, 4992, 1, 128, 13184, 13184, 13184, 13184]
    - [117, 78.06]
  - - [5098, 5098, 1, 128, 7146, 7146, 7146, 7146]
    - [118, 72.275]
  - - [5120, 5120, 1, 128, 13184, 13184, 13184, 13184]
    - [92, 77.745]
  - - [5226, 5226, 1, 128, 7146, 7146, 7146, 7146]
    - [119, 72.792]
  - - [5248, 5248, 1, 128, 13184, 13184, 13184, 13184]
    - [120, 78.193]
  - - [5354, 5354, 1, 128, 7146, 7146, 7146, 7146]
    - [121, 73.059]
  - - [5376, 5376, 1, 128, 13184, 13184, 13184, 13184]
    - [114, 78.731]
  - - [5482, 5482, 1, 128, 7146, 7146, 7146, 7146]
    - [111, 72.723]
  - - [5504, 5504, 1, 128, 13184, 13184, 13184, 13184]
    - [122, 78.012]
  - - [5610, 5610, 1, 128, 7146, 7146, 7146, 7146]
    - [115, 73.225]
  - - [5632, 5632, 1, 128, 13184, 13184, 13184, 13184]
    - [123, 78.705]
  - - [5738, 5738, 1, 128, 7146, 7146, 7146, 7146]
    - [102, 73.684]
  - - [5760, 5760, 1, 128, 13184, 13184, 13184, 13184]
    - [120, 79.001]
  - - [5866, 5866, 1, 128, 7146, 7146, 7146, 7146]
    - [124, 73.196]
  - - [5888, 5888, 1, 128, 13184, 13184, 13184, 13184]
    - [125, 78.686]
  - - [5994, 5994, 1, 128, 7146, 7146, 7146, 7146]
    - [126, 73.74]
  - - [6016, 6016, 1, 128, 13184, 13184, 13184, 13184]
    - [127, 79.012]
  - - [6122, 6122, 1, 128, 7146, 7146, 7146, 7146]
    - [111, 73.861]
  - - [6144, 6144, 1, 128, 13184, 13184, 13184, 13184]
    - [111, 79.55]
  - - [6250, 6250, 1, 128, 7146, 7146, 7146, 7146]
    - [128, 73.564]
  - - [6272, 6272, 1, 128, 13184, 13184, 13184, 13184]
    - [129, 78.934]
  - - [6378, 6378, 1, 128, 7146, 7146, 7146, 7146]
    - [102, 73.935]
  - - [6400, 6400, 1, 128, 13184, 13184, 13184, 13184]
    - [114, 79.253]
  - - [6506, 6506, 1, 128, 7146, 7146, 7146, 7146]
    - [130, 74.253]
  - - [6528, 6528, 1, 128, 13184, 13184, 13184, 13184]
    - [114, 82.739]
  - - [6634, 6634, 1, 128, 7146, 7146, 7146, 7146]
    - [124, 75.611]
  - - [6656, 6656, 1, 128, 13184, 13184, 13184, 13184]
    - [125, 82.092]
  - - [6762, 6762, 1, 128, 7146, 7146, 7146, 7146]
    - [131, 76.01]
  - - [6784, 6784, 1, 128, 13184, 13184, 13184, 13184]
    - [114, 82.644]
  - - [6890, 6890, 1, 128, 7146, 7146, 7146, 7146]
    - [115, 76.33]
  - - [6912, 6912, 1, 128, 13184, 13184, 13184, 13184]
    - [132, 82.94]
  - - [7018, 7018, 1, 128, 7146, 7146, 7146, 7146]
    - [121, 75.857]
  - - [7040, 7040, 1, 128, 13184, 13184, 13184, 13184]
    - [114, 82.377]
  - - [7168, 7168, 1, 128, 13184, 13184, 13184, 13184]
    - [111, 82.782]
  - - [7296, 7296, 1, 128, 13184, 13184, 13184, 13184]
    - [114, 83.191]
  - - [7424, 7424, 1, 128, 13184, 13184, 13184, 13184]
    - [114, 82.67]
  - - [7552, 7552, 1, 128, 13184, 13184, 13184, 13184]
    - [133, 83.038]
  - - [7680, 7680, 1, 128, 13184, 13184, 13184, 13184]
    - [127, 83.385]
  - - [7808, 7808, 1, 128, 13184, 13184, 13184, 13184]
    - [123, 82.97]
  - - [7936, 7936, 1, 128, 13184, 13184, 13184, 13184]
    - [114, 83.204]
  - - [8064, 8064, 1, 128, 13184, 13184, 13184, 13184]
    - [111, 83.538]
  - - [8192, 8192, 1, 128, 13184, 13184, 13184, 13184]
    - [111, 83.097]
  - - [8320, 8320, 1, 128, 13184, 13184, 13184, 13184]
    - [133, 83.339]
  - - [8448, 8448, 1, 128, 13184, 13184, 13184, 13184]
    - [114, 83.794]
  - - [8576, 8576, 1, 128, 13184, 13184, 13184, 13184]
    - [134, 83.231]
  - - [8704, 8704, 1, 128, 13184, 13184, 13184, 13184]
    - [109, 83.61]
  - - [8832, 8832, 1, 128, 13184, 13184, 13184, 13184]
    - [123, 83.916]
  - - [8960, 8960, 1, 128, 13184, 13184, 13184, 13184]
    - [133, 83.361]
  - - [9088, 9088, 1, 128, 13184, 13184, 13184, 13184]
    - [127, 83.729]
  - - [9216, 9216, 1, 128, 13184, 13184, 13184, 13184]
    - [135, 84.072]
  - - [9344, 9344, 1, 128, 13184, 13184, 13184, 13184]
    - [136, 83.647]
  - - [9472, 9472, 1, 128, 13184, 13184, 13184, 13184]
    - [127, 83.804]
  - - [9600, 9600, 1, 128, 13184, 13184, 13184, 13184]
    - [123, 84.346]
  - - [9728, 9728, 1, 128, 13184, 13184, 13184, 13184]
    - [133, 83.727]
  - - [9856, 9856, 1, 128, 13184, 13184, 13184, 13184]
    - [135, 84.019]
  - - [9984, 9984, 1, 128, 13184, 13184, 13184, 13184]
    - [114, 84.288]
  - - [10112, 10112, 1, 128, 13184, 13184, 13184, 13184]
    - [133, 83.907]
  - - [10240, 10240, 1, 128, 13184, 13184, 13184, 13184]
    - [114, 84.16]
  - - [10368, 10368, 1, 128, 13184, 13184, 13184, 13184]
    - [127, 84.487]
  - - [10496, 10496, 1, 128, 13184, 13184, 13184, 13184]
    - [114, 84.049]
  - - [10624, 10624, 1, 128, 13184, 13184, 13184, 13184]
    - [134, 84.226]
  - - [10752, 10752, 1, 128, 13184, 13184, 13184, 13184]
    - [123, 84.508]
  - - [10880, 10880, 1, 128, 13184, 13184, 13184, 13184]
    - [114, 83.934]
  - - [11008, 11008, 1, 128, 13184, 13184, 13184, 13184]
    - [123, 84.235]
  - - [11136, 11136, 1, 128, 13184, 13184, 13184, 13184]
    - [114, 84.517]
  - - [11264, 11264, 1, 128, 13184, 13184, 13184, 13184]
    - [114, 84.254]
  - - [11392, 11392, 1, 128, 13184, 13184, 13184, 13184]
    - [137, 84.392]
  - - [11520, 11520, 1, 128, 13184, 13184, 13184, 13184]
    - [120, 84.59]
  - - [11648, 11648, 1, 128, 13184, 13184, 13184, 13184]
    - [133, 84.198]
  - - [11776, 11776, 1, 128, 13184, 13184, 13184, 13184]
    - [114, 84.531]
  - - [11904, 11904, 1, 128, 13184, 13184, 13184, 13184]
    - [120, 84.677]
  - - [12032, 12032, 1, 128, 13184, 13184, 13184, 13184]
    - [133, 84.309]
  - - [12160, 12160, 1, 128, 13184, 13184, 13184, 13184]
    - [123, 84.486]
  - - [12288, 12288, 1, 128, 13184, 13184, 13184, 13184]
    - [125, 84.795]
  - - [12416, 12416, 1, 128, 13184, 13184, 13184, 13184]
    - [127, 84.526]
  - - [12544, 12544, 1, 128, 13184, 13184, 13184, 13184]
    - [138, 84.586]
  - - [12672, 12672, 1, 128, 13184, 13184, 13184, 13184]
    - [133, 84.847]
  - - [12800, 12800, 1, 128, 13184, 13184, 13184, 13184]
    - [114, 84.535]
  - - [12928, 12928, 1, 128, 13184, 13184, 13184, 13184]
    - [123, 84.7]
  - - [13056, 13056, 1, 128, 13184, 13184, 13184, 13184]
    - [109, 84.958]
  - - [6454, 6454, 1, 689, 6454, 6454, 6454, 689]
    - [139, 87.137]
  - - [7561, 7561, 1, 411, 7561, 7561, 7561, 411]
    - [140, 86.16]
  - - [7985, 7985, 1, 701, 7985, 7985, 7985, 701]
    - [141, 89.041]
  - - [7985, 7985, 1, 1948, 7985, 7985, 7985, 1948]
    - [142, 91.625]
  - - [8709, 8709, 1, 875, 8709, 8709, 8709, 875]
    - [143, 89.776]
  - - [9603, 9603, 1, 1371, 9603, 9603, 9603, 1371]
    - [144, 90.607]
  - - [9603, 9603, 1, 701, 9603, 9603, 9603, 701]
    - [144, 89.134]
  - - [10606, 10606, 1, 1239, 10606, 10606, 10606, 1239]
    - [145, 91.097]
  - - [11505, 11505, 1, 1278, 11505, 11505, 11505, 1278]
    - [143, 91.988]
  - - [12301, 12301, 1, 837, 12301, 12301, 12301, 837]
    - [141, 89.445]
  - - [13179, 13179, 1, 1392, 13179, 13179, 13179, 1392]
    - [146, 92.356]
  - - [14487, 14487, 1, 1169, 14487, 14487, 14487, 1169]
    - [143, 90.816]
  - - [15420, 15420, 1, 2986, 15420, 15420, 15420, 2986]
    - [147, 93.061]
  - - [15420, 15420, 1, 701, 15420, 15420, 15420, 701]
    - [144, 90.805]
  - - [17445, 17445, 1, 1266, 17445, 17445, 17445, 1266]
    - [141, 91.25]
  - - [18395, 18395, 1, 1008, 18395, 18395, 18395, 1008]
    - [139, 92.136]
  - - [19343, 19343, 1, 501, 19343, 19343, 19343, 501]
    - [141, 87.771]
  - - [19343, 19343, 1, 1266, 19343, 19343, 19343, 1266]
    - [141, 91.129]
  - - [20342, 20342, 1, 1636, 20342, 20342, 20342, 1636]
    - [148, 92.368]
  - - [21581, 21581, 1, 701, 21581, 21581, 21581, 701]
    - [141, 90.541]
  - - [21581, 21581, 1, 2921, 21581, 21581, 21581, 2921]
    - [141, 92.701]
  - - [24261, 24261, 1, 659, 24261, 24261, 24261, 659]
    - [141, 89.095]
  - - [25109, 25109, 1, 1087, 25109, 25109, 25109, 1087]
    - [141, 91.68]
  - - [25854, 25854, 1, 701, 25854, 25854, 25854, 701]
    - [141, 90.698]
  - - [25854, 25854, 1, 1820, 25854, 25854, 25854, 1820]
    - [142, 92.758]
  - - [27412, 27412, 1, 501, 27412, 27412, 27412, 501]
    - [149, 88.238]
  - - [27412, 27412, 1, 1416, 27412, 27412, 27412, 1416]
    - [150, 92.22]
  - - [28005, 28005, 1, 701, 28005, 28005, 28005, 701]
    - [141, 90.7]
  - - [28005, 28005, 1, 2572, 28005, 28005, 28005, 2572]
    - [151, 93.091]
  - - [29829, 29829, 1, 1582, 29829, 29829, 29829, 1582]
    - [144, 92.237]
  - - [30421, 30421, 1, 1186, 30421, 30421, 30421, 1186]
    - [141, 91.138]
  - - [31256, 31256, 1, 415, 31256, 31256, 31256, 415]
    - [139, 89.166]
  - - [31256, 31256, 1, 1186, 31256, 31256, 31256, 1186]
    - [144, 91.208]
  - - [32163, 32163, 1, 1796, 32163, 32163, 32163, 1796]
    - [151, 92.106]
  - - [33974, 33974, 1, 1225, 33974, 33974, 33974, 1225]
    - [149, 91.666]
  - - [35882, 35882, 1, 701, 35882, 35882, 35882, 701]
    - [144, 90.626]
  - - [35882, 35882, 1, 2387, 35882, 35882, 35882, 2387]
    - [142, 92.459]
  - - [36653, 36653, 1, 501, 36653, 36653, 36653, 501]
    - [141, 88.02]
  - - [36653, 36653, 1, 2845, 36653, 36653, 36653, 2845]
    - [151, 92.987]
  - - [37967, 37967, 1, 1339, 37967, 37967, 37967, 1339]
    - [139, 91.559]
  - - [38361, 38361, 1, 701, 38361, 38361, 38361, 701]
    - [149, 90.487]
  - - [38361, 38361, 1, 3690, 38361, 38361, 38361, 3690]
    - [151, 93.115]
  - - [39067, 39067, 1, 1224, 39067, 39067, 39067, 1224]
    - [144, 91.925]
  - - [39761, 39761, 1, 3821, 39761, 39761, 39761, 3821]
    - [151, 93.069]
  - - [40401, 40401, 1, 701, 40401, 40401, 40401, 701]
    - [141, 90.596]
  - - [40401, 40401, 1, 1925, 40401, 40401, 40401, 1925]
    - [142, 92.145]
- null
- null
- DeviceEfficiency
