library/src/blas3/Tensile/Logic/asm_full/aquavanjaram942/aquavanjaram942_Cijk_Alik_Bljk_F8F8S_BH.yaml
- {MinimumRequiredVersion: 4.36.0}
- aquavanjaram942
- gfx942
- [Device 0049, Device 0050]
    SolutionIndex: 0
    SolutionNameMin: Cijk_Alik_Bljk_F8F8S_BH_MT256x256x64_MI32x32x16x1_SN_GLS0_LPA16_NEPBS0_NLCA1_SU32_SUS64_WGM6
    SolutionIndex: 1
    SolutionNameMin: Cijk_Alik_Bljk_F8F8S_BH_MT256x256x64_MI32x32x16x1_SN_GLS0_LPA16_NEPBS0_NLCA1_SU32_SUS128_WGM6
    SolutionIndex: 2
    SolutionNameMin: Cijk_Alik_Bljk_F8F8S_BH_MT256x256x64_MI32x32x16x1_SN_GLS0_LPA16_NEPBS0_NLCA2_SU0_SUS0_WGM6
    SolutionIndex: 3
    SolutionNameMin: Cijk_Alik_Bljk_F8F8S_BH_MT256x256x64_MI32x32x16x1_SN_GLS0_LPA16_NEPBS0_NLCA1_SU32_SUS64_WGM12
    SolutionIndex: 4
    SolutionNameMin: Cijk_Alik_Bljk_F8F8S_BH_MT256x256x64_MI32x32x16x1_SN_GLS0_LPA16_NEPBS0_NLCA1_SU32_SUS128_WGM19
    SolutionIndex: 5
    SolutionNameMin: Cijk_Alik_Bljk_F8F8S_BH_MT256x256x64_MI32x32x16x1_SN_GLS0_LPA16_NEPBS0_NLCA1_SU0_SUS0_WGM20
    SolutionIndex: 6
    SolutionNameMin: Cijk_Alik_Bljk_F8F8S_BH_MT256x256x64_MI32x32x16x1_SN_GLS0_LPA16_NEPBS0_NLCA1_SU32_SUS128_WGM20
    SolutionIndex: 7
    SolutionNameMin: Cijk_Alik_Bljk_F8F8S_BH_MT256x256x64_MI32x32x16x1_SN_GLS0_LPA16_NEPBS0_NLCA1_SU32_SUS128_WGM29
    SolutionIndex: 8
    SolutionNameMin: Cijk_Alik_Bljk_F8F8S_BH_MT64x64x64_MI32x32x16x1_SN_GRVW16_LPA16_LPB16_LRVW8_NEPBS8_NLCA1_PGR2_SU0_SUM0_SUS0_SRVW0_TSGRB0_WGM1
    SolutionIndex: 9
    SolutionNameMin: Cijk_Alik_Bljk_F8F8S_BH_MT64x64x64_MI32x32x16x1_SN_GRVW16_LPA16_LPB16_LRVW8_NEPBS0_NLCA1_PGR2_SU0_SUM0_SUS0_SRVW0_TSGRB0_WGM1
    SolutionIndex: 10
    SolutionNameMin: Cijk_Alik_Bljk_F8F8S_BH_MT64x64x64_MI32x32x16x1_SN_GRVW4_LPA16_LPB16_LRVW16_NEPBS0_NLCA1_PGR1_SU32_SUM0_SUS128_SRVW0_TSGRB1_WGM1
    SolutionIndex: 11
    SolutionNameMin: Cijk_Alik_Bljk_F8F8S_BH_MT64x64x64_MI32x32x16x1_SN_GRVW4_LPA16_LPB16_LRVW16_NEPBS0_NLCA2_PGR1_SU32_SUM0_SUS128_SRVW0_TSGRB0_WGM1
    SolutionIndex: 12
    SolutionNameMin: Cijk_Alik_Bljk_F8F8S_BH_MT64x64x64_MI32x32x16x1_SN_GRVW4_LPA16_LPB16_LRVW16_NEPBS8_NLCA1_PGR2_SU0_SUM0_SUS0_SRVW0_TSGRB0_WGM1
    SolutionIndex: 13
    SolutionNameMin: Cijk_Alik_Bljk_F8F8S_BH_MT256x256x64_MI32x32x16x1_SN_1LDSB1_AMAS3_EMLL0_MIAV0_NEPBS0_NLCB1_PLR5_SVW2_TT8_64_VW2_WG32_8_1_WGM32
    SolutionIndex: 14
    SolutionNameMin: Cijk_Alik_Bljk_F8F8S_BH_MT256x256x64_MI32x32x16x1_SN_1LDSB1_AMAS0_EMLL0_MIAV0_NEPBS0_NLCB1_PLR5_SVW1_TT8_64_VW1_WG32_8_1_WGM32
    SolutionIndex: 15
    SolutionNameMin: Cijk_Alik_Bljk_F8F8S_BH_MT256x224x128_MI16x16x32x1_SN_ELFLR4_FL1_GLVWA4_GLVWB4_GRVW4_LBSPPA1024_LBSPPB128_LPA8_LPB8_PLR5_SU4_SUS128_SVW8_TT8_112_VW8_WSGRA0_WG32_8_1_WGM16
    SolutionIndex: 16
    SolutionNameMin: Cijk_Alik_Bljk_F8F8S_BH_MT256x256x64_MI16x16x32x1_SN_ELFLR8_FL1_GLVWA4_GLVWB4_GRVW4_LBSPPA256_LBSPPB128_LPA8_LPB8_PLR3_SU4_SUS128_SVW4_TT8_128_VW4_WSGRA0_WG32_8_1_WGM16
- - - [6144, 4864, 1, 4096]
    - [0, 69.732]
  - - [6144, 4864, 1, 8192]
    - [0, 74.7]
  - - [6144, 4864, 1, 16384]
    - [0, 77.399]
  - - [6144, 9728, 1, 4096]
    - [3, 70.786]
  - - [6144, 9728, 1, 8192]
    - [0, 75.46]
  - - [6144, 9728, 1, 16384]
    - [4, 77.121]
  - - [9216, 4864, 1, 4096]
    - [1, 70.263]
  - - [9216, 4864, 1, 8192]
    - [6, 75.085]
  - - [9216, 4864, 1, 16384]
    - [3, 75.828]
  - - [6144, 4864, 1, 4352]
    - [2, 71.608]
  - - [6144, 4864, 1, 8448]
    - [5, 75.998]
  - - [6144, 4864, 1, 16640]
    - [5, 78.405]
  - - [4864, 3072, 1, 4096]
    - [7, 68.564]
  - - [4, 4, 1, 16]
    - [8, 0.0]
  - - [4, 64, 1, 64]
    - [9, 0.0]
  - - [16, 64, 1, 64]
    - [10, 0.001]
  - - [64, 4, 1, 64]
    - [11, 0.0]
  - - [64, 16, 1, 64]
    - [12, 0.001]
  - - [4864, 4096, 1, 8192]
    - [16, 73.921]
  - - [9728, 8192, 1, 8192]
    - [13, 69.059]
  - - [9728, 8192, 1, 65536]
    - [14, 69.187]
  - - [9728, 8192, 1, 40960]
    - [14, 64.946]
  - - [4096, 4096, 1, 8192]
    - [15, 86.267]
- null
- null
- DeviceEfficiency
