library/src/blas3/Tensile/Logic/asm_full/aquavanjaram942/aquavanjaram942_Cijk_Ailk_Bjlk_BSS_BH.yaml
- {MinimumRequiredVersion: 4.36.0}
- aquavanjaram942
- gfx942
- [Device 0049, Device 0050]
    SolutionIndex: 0
    SolutionNameMin: Cijk_Ailk_Bjlk_BSS_BH_MT256x128x16_MI32x32x8x1_SN_AMAS3_MIAV0_NTA0_NTB0_NTC2_NTD0_SVW2_VW2_WSGRA0_WSGRB0_WGM12
    SolutionIndex: 1
    SolutionNameMin: Cijk_Ailk_Bjlk_BSS_BH_MT256x128x16_MI32x32x8x1_SN_AMAS0_MIAV0_NTA0_NTB0_NTC2_NTD1_SVW1_VW1_WSGRA0_WSGRB1_WGM6
    SolutionIndex: 2
    SolutionNameMin: Cijk_Ailk_Bjlk_BSS_BH_MT256x128x16_MI32x32x8x1_SN_AMAS0_MIAV0_NTA0_NTB0_NTC3_NTD2_SVW1_VW1_WSGRA1_WSGRB0_WGM6
    SolutionIndex: 3
    SolutionNameMin: Cijk_Ailk_Bjlk_BSS_BH_MT256x128x16_MI32x32x8x1_SN_AMAS3_MIAV0_NTA1_NTB0_NTC3_NTD3_SVW2_VW2_WSGRA0_WSGRB0_WGM6
    SolutionIndex: 4
    SolutionNameMin: Cijk_Ailk_Bjlk_BSS_BH_MT256x128x16_MI32x32x8x1_SN_AMAS3_MIAV0_NTA0_NTB1_NTC2_NTD0_SVW2_VW2_WSGRA0_WSGRB0_WGM18
    SolutionIndex: 5
    SolutionNameMin: Cijk_Ailk_Bjlk_BSS_BH_MT256x128x16_MI32x32x8x1_SN_AMAS0_MIAV0_NTA0_NTB1_NTC2_NTD1_SVW1_VW1_WSGRA0_WSGRB1_WGM12
    SolutionIndex: 6
    SolutionNameMin: Cijk_Ailk_Bjlk_BSS_BH_MT256x128x16_MI32x32x8x1_SN_AMAS3_MIAV0_NTA0_NTB1_NTC3_NTD2_SVW2_VW2_WSGRA0_WSGRB0_WGM12
    SolutionIndex: 7
    SolutionNameMin: Cijk_Ailk_Bjlk_BSS_BH_MT256x128x16_MI32x32x8x1_SN_AMAS0_MIAV1_NTA0_NTB0_NTC2_NTD0_SVW1_VW1_WSGRA1_WSGRB1_WGM6
    SolutionIndex: 8
    SolutionNameMin: Cijk_Ailk_Bjlk_BSS_BH_MT256x128x16_MI32x32x8x1_SN_AMAS0_MIAV1_NTA0_NTB0_NTC3_NTD2_SVW1_VW1_WSGRA1_WSGRB1_WGM6
    SolutionIndex: 9
    SolutionNameMin: Cijk_Ailk_Bjlk_BSS_BH_MT256x128x16_MI32x32x8x1_SN_AMAS0_MIAV1_NTA0_NTB0_NTC3_NTD3_SVW1_VW1_WSGRA1_WSGRB0_WGM6
    SolutionIndex: 10
    SolutionNameMin: Cijk_Ailk_Bjlk_BSS_BH_MT256x128x16_MI32x32x8x1_SN_AMAS3_MIAV1_NTA1_NTB0_NTC3_NTD0_SVW2_VW2_WSGRA0_WSGRB0_WGM18
    SolutionIndex: 11
    SolutionNameMin: Cijk_Ailk_Bjlk_BSS_BH_MT256x128x16_MI32x32x8x1_SN_AMAS3_MIAV1_NTA0_NTB1_NTC2_NTD2_SVW2_VW2_WSGRA0_WSGRB0_WGM6
    SolutionIndex: 12
    SolutionNameMin: Cijk_Ailk_Bjlk_BSS_BH_MT256x256x32_MI16x16x16x1_SN_1LDSB0_NTA2_NTB0_NEPBS8_PLR1_SU0_SUS0_SPO0_SSO0_TT8_128_VFLRP0_WSGRA1_WSGRB0_WG32_8_1_WGM18
    SolutionIndex: 13
    SolutionNameMin: Cijk_Ailk_Bjlk_BSS_BH_MT256x256x32_MI16x16x16x1_SN_1LDSB0_NTA1_NTB0_NEPBS4_PLR3_SU32_SUS256_SPO1_SSO8_TT8_128_VFLRP0_WSGRA0_WSGRB0_WG32_8_1_WGM24
    SolutionIndex: 14
    SolutionNameMin: Cijk_Ailk_Bjlk_BSS_BH_MT256x256x32_MI16x16x16x1_SN_1LDSB0_NTA2_NTB0_NEPBS4_PLR1_SU0_SUS0_SPO0_SSO0_TT8_128_VFLRP0_WSGRA1_WSGRB0_WG32_8_1_WGM6
    SolutionIndex: 15
    SolutionNameMin: Cijk_Ailk_Bjlk_BSS_BH_MT256x256x32_MI16x16x16x1_SN_1LDSB0_NTA2_NTB1_NEPBS8_PLR3_SU0_SUS0_SPO0_SSO0_TT8_128_VFLRP1_WSGRA1_WSGRB0_WG32_8_1_WGM18
    SolutionIndex: 16
    SolutionNameMin: Cijk_Ailk_Bjlk_BSS_BH_MT256x256x32_MI16x16x16x1_SN_1LDSB0_NTA1_NTB1_NEPBS8_PLR3_SU32_SUS256_SPO1_SSO0_TT16_64_VFLRP0_WSGRA1_WSGRB0_WG16_16_1_WGM6
    SolutionIndex: 17
    SolutionNameMin: Cijk_Ailk_Bjlk_BSS_BH_MT256x256x32_MI32x32x8x1_SN_1LDSB0_NTA1_NTB1_NEPBS8_PLR1_SU0_SUS0_SPO1_SSO0_TT8_64_VFLRP0_WSGRA0_WSGRB0_WG32_8_1_WGM18
- - - [6144, 4864, 1, 4096]
    - [8, 70.712]
  - - [6144, 4864, 1, 8192]
    - [10, 76.966]
  - - [6144, 4864, 1, 16384]
    - [6, 80.65]
  - - [6144, 4864, 1, 4352]
    - [9, 71.359]
  - - [6144, 4864, 1, 8448]
    - [4, 77.231]
  - - [6144, 4864, 1, 16640]
    - [3, 80.74]
  - - [4864, 3072, 1, 4096]
    - [5, 69.961]
  - - [4864, 3072, 1, 8192]
    - [2, 76.379]
  - - [4864, 3072, 1, 16384]
    - [11, 79.987]
  - - [4864, 3072, 1, 4352]
    - [7, 70.538]
  - - [4864, 3072, 1, 8448]
    - [1, 76.616]
  - - [4864, 3072, 1, 16640]
    - [0, 80.077]
  - - [4864, 3072, 1, 2048]
    - [12, 62.19]
  - - [4864, 3072, 1, 6144]
    - [13, 70.21]
  - - [3072, 4864, 1, 2048]
    - [14, 60.46]
  - - [3072, 4864, 1, 4096]
    - [15, 67.36]
  - - [3072, 4864, 1, 6144]
    - [16, 62.49]
  - - [3072, 4864, 1, 8192]
    - [17, 65.49]
- null
- null
- DeviceEfficiency
