library/src/blas3/Tensile/Logic/asm_full/aquavanjaram942/aquavanjaram942_Cijk_Ailk_Bljk_SB_MX.yaml
- {MinimumRequiredVersion: 4.40.0}
- aquavanjaram942
- gfx942
- [Device 0049, Device 0050]
    SolutionIndex: 0
    SolutionNameMin: Cijk_Ailk_Bljk_SB_MX_MT192x256x32_MI32x32x4x1_SN_ASGT3128_GLS0_LBSPPB128_LPB4_NLCA3_SU0_SUS0_SSO2_TT3_128_WG64_4_1_WGM12
    SolutionIndex: 1
    SolutionNameMin: Cijk_Ailk_Bljk_SB_MX_MT192x256x32_MI32x32x4x1_SN_ASGT3128_GLS0_LBSPPB128_LPB4_NLCA3_SU8_SUS256_SSO2_TT3_128_WG64_4_1_WGM12
    SolutionIndex: 2
    SolutionNameMin: Cijk_Ailk_Bljk_SB_MX_MT192x256x32_MI32x32x4x1_SN_ASGT_GLS0_LBSPPB128_LPB4_NLCA3_SU8_SUS256_SSO2_TT3_128_WG64_4_1_WGM18
    SolutionIndex: 3
    SolutionNameMin: Cijk_Ailk_Bljk_SB_MX_MT256x128x32_MI32x32x4x1_SN_ASGT_GLS0_LBSPPB128_LPB4_NLCA1_SU0_SUS0_SSO2_TT2_128_WG128_2_1_WGM36
    SolutionIndex: 4
    SolutionNameMin: Cijk_Ailk_Bljk_SB_MX_MT256x128x32_MI32x32x4x1_SN_ASGT3128_GLS0_LBSPPB128_LPB4_NLCA1_SU0_SUS0_SSO2_TT2_128_WG128_2_1_WGM36
    SolutionIndex: 5
    SolutionNameMin: Cijk_Ailk_Bljk_SB_MX_MT128x256x32_MI32x32x4x1_SN_ASGT_GLS0_LBSPPB128_LPB4_NLCA1_SU0_SUS0_SSO4_TT2_128_WG64_4_1_WGM18
    SolutionIndex: 6
    SolutionNameMin: Cijk_Ailk_Bljk_SB_MX_MT192x256x32_MI32x32x4x1_SN_ASGT_GLS0_LBSPPB128_LPB4_NLCA3_SU0_SUS0_SSO8_TT3_128_WG64_4_1_WGM18
    SolutionIndex: 7
    SolutionNameMin: Cijk_Ailk_Bljk_SB_MX_MT192x256x32_MI32x32x4x1_SN_ASGT_GLS0_LBSPPB128_LPB4_NLCA3_SU8_SUS256_SSO8_TT3_128_WG64_4_1_WGM18
    SolutionIndex: 8
    SolutionNameMin: Cijk_Ailk_Bljk_SB_MX_MT256x128x32_MI32x32x4x1_SN_ASGT_GLS0_LBSPPB128_LPB4_NLCA1_SU0_SUS0_SSO8_TT2_128_WG128_2_1_WGM36
    SolutionIndex: 9
    SolutionNameMin: Cijk_Ailk_Bljk_SB_MX_MT256x128x32_MI32x32x4x1_SN_ASGT_GLS1_LBSPPB128_LPB4_NLCA1_SU32_SUS512_SSO2_TT4_64_WG64_4_1_WGM36
    SolutionIndex: 10
    SolutionNameMin: Cijk_Ailk_Bljk_SB_MX_MT256x192x32_MI32x32x4x1_SN_ASGT_GLS1_LBSPPB128_LPB4_NLCA1_SU16_SUS256_SSO2_TT4_96_WG64_4_1_WGM36
    SolutionIndex: 11
    SolutionNameMin: Cijk_Ailk_Bljk_SB_MX_MT192x256x32_MI32x32x4x1_SN_ASGT_GLS1_LBSPPB128_LPB4_NLCA3_SU0_SUS0_SSO2_TT3_128_WG64_4_1_WGM18
    SolutionIndex: 12
    SolutionNameMin: Cijk_Ailk_Bljk_SB_MX_MT192x256x32_MI32x32x4x1_SN_ASGT3128_GLS1_LBSPPB128_LPB4_NLCA3_SU0_SUS0_SSO4_TT3_128_WG64_4_1_WGM12
    SolutionIndex: 13
    SolutionNameMin: Cijk_Ailk_Bljk_SB_MX_MT256x128x32_MI32x32x4x1_SN_ASGT3128_GLS1_LBSPPB128_LPB4_NLCA1_SU0_SUS0_SSO6_TT2_128_WG128_2_1_WGM36
    SolutionIndex: 14
    SolutionNameMin: Cijk_Ailk_Bljk_SB_MX_MT256x192x32_MI32x32x4x1_SN_ASGT3128_GLS1_LBSPPB128_LPB4_NLCA1_SU32_SUS256_SSO8_TT4_96_WG64_4_1_WGM36
    SolutionIndex: 15
    SolutionNameMin: Cijk_Ailk_Bljk_SB_MX_MT128x128x32_MI32x32x4x1_SN_1LDSB1_ASGT3128_GLS1_LBSPPB128_LPB4_NLCA1_SU0_SUS0_SSO4_TT4_32_WG32_8_1_WGM12
- - - [6144, 9728, 1, 8192]
    - [4, 54.664]
  - - [6144, 9728, 1, 8224]
    - [5, 54.409]
  - - [6144, 9728, 1, 8256]
    - [4, 53.323]
  - - [9216, 9728, 1, 8192]
    - [8, 53.078]
  - - [9216, 9728, 1, 8224]
    - [12, 54.634]
  - - [9216, 9728, 1, 8256]
    - [0, 53.432]
  - - [9216, 9728, 1, 16384]
    - [3, 52.573]
  - - [9216, 9728, 1, 16448]
    - [6, 54.482]
  - - [9216, 9728, 1, 16512]
    - [13, 52.632]
  - - [7296, 9216, 1, 4096]
    - [1, 52.346]
  - - [7296, 9216, 1, 8192]
    - [2, 52.49]
  - - [7296, 9216, 1, 8224]
    - [11, 55.508]
  - - [7296, 9216, 1, 8256]
    - [7, 53.849]
  - - [14592, 9216, 1, 4096]
    - [9, 52.719]
  - - [14592, 9216, 1, 8192]
    - [10, 54.088]
  - - [14592, 9216, 1, 8224]
    - [14, 56.819]
  - - [14592, 9216, 1, 8256]
    - [14, 55.523]
  - - [256, 256, 1, 256]
    - [15, 1.186]
- null
- null
- DeviceEfficiency
