library/src/blas3/Tensile/Logic/asm_full/aquavanjaram942/aquavanjaram942_Cijk_Ailk_Bljk_BBS_BH.yaml
- {MinimumRequiredVersion: 4.36.0}
- aquavanjaram942
- gfx942
- [Device 0049, Device 0050]
    SolutionIndex: 0
    SolutionNameMin: Cijk_Ailk_Bljk_BBS_BH_MT256x128x16_MI32x32x8x1_SN_1LDSB1_AMAS3_FL0_MIAV0_NTA0_NTB0_NTC2_NTD3_NLCA2_ONLL0_SVW2_TT2_128_VW2_WSGRA1_WSGRB1_WG128_2_1_WGM12
    SolutionIndex: 1
    SolutionNameMin: Cijk_Ailk_Bljk_BBS_BH_MT256x128x16_MI32x32x8x1_SN_1LDSB1_AMAS3_FL0_MIAV0_NTA0_NTB1_NTC2_NTD3_NLCA2_ONLL0_SVW2_TT2_128_VW2_WSGRA0_WSGRB0_WG128_2_1_WGM12
    SolutionIndex: 2
    SolutionNameMin: Cijk_Ailk_Bljk_BBS_BH_MT256x128x16_MI32x32x8x1_SN_1LDSB1_AMAS3_FL0_MIAV0_NTA1_NTB1_NTC2_NTD2_NLCA2_ONLL0_SVW2_TT2_128_VW2_WSGRA0_WSGRB0_WG128_2_1_WGM6
    SolutionIndex: 3
    SolutionNameMin: Cijk_Ailk_Bljk_BBS_BH_MT256x128x16_MI32x32x8x1_SN_1LDSB1_AMAS3_FL0_MIAV0_NTA1_NTB1_NTC3_NTD1_NLCA2_ONLL2_SVW2_TT2_128_VW2_WSGRA0_WSGRB0_WG128_2_1_WGM6
    SolutionIndex: 4
    SolutionNameMin: Cijk_Ailk_Bljk_BBS_BH_MT256x128x16_MI32x32x8x1_SN_1LDSB1_AMAS3_FL0_MIAV1_NTA0_NTB0_NTC2_NTD2_NLCA2_ONLL2_SVW2_TT2_128_VW2_WSGRA0_WSGRB0_WG128_2_1_WGM6
    SolutionIndex: 5
    SolutionNameMin: Cijk_Ailk_Bljk_BBS_BH_MT256x128x16_MI32x32x8x1_SN_1LDSB1_AMAS3_FL0_MIAV1_NTA0_NTB1_NTC2_NTD2_NLCA2_ONLL0_SVW2_TT2_128_VW2_WSGRA1_WSGRB0_WG128_2_1_WGM6
    SolutionIndex: 6
    SolutionNameMin: Cijk_Ailk_Bljk_BBS_BH_MT256x128x16_MI32x32x8x1_SN_1LDSB1_AMAS3_FL0_MIAV1_NTA0_NTB1_NTC2_NTD3_NLCA2_ONLL2_SVW2_TT2_128_VW2_WSGRA0_WSGRB1_WG128_2_1_WGM6
    SolutionIndex: 7
    SolutionNameMin: Cijk_Ailk_Bljk_BBS_BH_MT256x128x16_MI32x32x8x1_SN_1LDSB1_AMAS3_FL0_MIAV1_NTA0_NTB1_NTC2_NTD3_NLCA2_ONLL1_SVW2_TT2_128_VW2_WSGRA1_WSGRB1_WG128_2_1_WGM12
    SolutionIndex: 8
    SolutionNameMin: Cijk_Ailk_Bljk_BBS_BH_MT256x128x16_MI32x32x8x1_SN_1LDSB1_AMAS3_FL0_MIAV1_NTA1_NTB1_NTC3_NTD3_NLCA2_ONLL2_SVW2_TT2_128_VW2_WSGRA0_WSGRB0_WG128_2_1_WGM6
    SolutionIndex: 9
    SolutionNameMin: Cijk_Ailk_Bljk_BBS_BH_MT256x128x32_MI32x32x8x1_SN_AMAS3_MIAV1_NLCA2_PLR5_SU4_SUS512_SPO1_SVW2_TT2_128_VW2_WGM32
    SolutionIndex: 10
    SolutionNameMin: Cijk_Ailk_Bljk_BBS_BH_MT256x256x32_MI32x32x8x1_SN_AMAS3_MIAV0_NLCA1_PLR5_SU0_SUS0_SPO0_SVW2_TT2_256_VW2_WGM32
    SolutionIndex: 11
    SolutionNameMin: Cijk_Ailk_Bljk_BBS_BH_MT256x256x32_MI32x32x8x1_SN_
    SolutionIndex: 12
    SolutionNameMin: Cijk_Ailk_Bljk_BBS_BH_MT256x256x32_MI32x32x8x1_SN_1LDSB1_FL1_LRVW8_MIAV0_NEPBS0_NLCA1_SU32_SUS64_SSO8_TT2_256_WG128_2_1_WGM30
    SolutionIndex: 13
    SolutionNameMin: Cijk_Ailk_Bljk_BBS_BH_MT256x256x32_MI32x32x8x1_SN_1LDSB1_FL1_LRVW8_MIAV0_NEPBS0_NLCA1_SU0_SUS0_SSO6_TT2_256_WG128_2_1_WGM30
    SolutionIndex: 14
    SolutionNameMin: Cijk_Ailk_Bljk_BBS_BH_MT256x256x32_MI32x32x8x1_SN_1LDSB1_FL0_LRVW8_MIAV0_NEPBS0_NLCA1_SU0_SUS0_SSO6_TT2_256_WG128_2_1_WGM18
    SolutionIndex: 15
    SolutionNameMin: Cijk_Ailk_Bljk_BBS_BH_MT256x256x32_MI32x32x8x1_SN_1LDSB1_FL0_LRVW8_MIAV0_NEPBS0_NLCA1_SU0_SUS0_SSO6_TT2_256_WG128_2_1_WGM30
    SolutionIndex: 16
    SolutionNameMin: Cijk_Ailk_Bljk_BBS_BH_MT256x256x32_MI32x32x8x1_SN_1LDSB1_FL2_LRVW8_MIAV0_NEPBS0_NLCA1_SU0_SUS0_SSO8_TT2_256_WG128_2_1_WGM6
    SolutionIndex: 17
    SolutionNameMin: Cijk_Ailk_Bljk_BBS_BH_MT256x256x32_MI32x32x8x1_SN_1LDSB1_FL0_LRVW8_MIAV0_NEPBS0_NLCA1_SU0_SUS0_SSO8_TT2_256_WG128_2_1_WGM6
    SolutionIndex: 18
    SolutionNameMin: Cijk_Ailk_Bljk_BBS_BH_MT256x256x32_MI32x32x8x1_SN_1LDSB1_FL1_LRVW8_MIAV0_NEPBS0_NLCA1_SU0_SUS0_SSO8_TT2_256_WG128_2_1_WGM18
    SolutionIndex: 19
    SolutionNameMin: Cijk_Ailk_Bljk_BBS_BH_MT256x256x32_MI32x32x8x1_SN_1LDSB1_FL2_LRVW8_MIAV0_NEPBS0_NLCA1_SU0_SUS0_SSO8_TT2_256_WG128_2_1_WGM18
    SolutionIndex: 20
    SolutionNameMin: Cijk_Ailk_Bljk_BBS_BH_MT128x128x64_MI16x16x16x1_SN_FL0_GLVWB8_LBSPPA0_LPA0_LPB16_LRVW8_MIAV0_PLR5_SVW4_TT4_64_VW4_WSGRA1_WG32_8_1
    SolutionIndex: 21
    SolutionNameMin: Cijk_Ailk_Bljk_BBS_BH_MT256x224x64_MI16x16x16x1_SN_CLR0_GLVWB4_LBSPPA0_LBSPPB128_LPA0_LPB4_LRVW4_PLR5_SVW4_TT4_224_VW4_WGM32
    SolutionIndex: 22
    SolutionNameMin: Cijk_Ailk_Bljk_BBS_BH_MT256x224x64_MI16x16x16x1_SN_CLR0_FL0_GLVWB4_LBSPPA0_LBSPPB128_LPA0_LPB4_LRVW4_PLR5_SVW4_TT4_224_VW4_WSGRA1_WG64_4_1
    SolutionIndex: 23
    SolutionNameMin: Cijk_Ailk_Bljk_BBS_BH_MT256x224x32_MI16x16x16x1_SN_CLR1_GLVWB2_LBSPPA0_LBSPPB128_LPA0_LPB4_LRVW4_PLR3_SVW4_TT4_224_VW4_WG64_4_1
    SolutionIndex: 24
    SolutionNameMin: Cijk_Ailk_Bljk_BBS_BH_MT256x256x32_MI16x16x16x1_SN_GLVWB2_LBSPPA2048_LPA32_LPB4_LRVW4_MIAV0_PLR3_SVW2_TT4_256_VW2_WG64_4_1_WGMn16
    SolutionIndex: 25
    SolutionNameMin: Cijk_Ailk_Bljk_BBS_BH_MT256x256x32_MI16x16x16x1_SN_FL1_GLVWB4_LBSPPA0_LPA0_LPB4_LRVW4_PLR3_SUM1_SVW4_TT4_256_VW4_WSGRA0_WG64_4_1_WGMn8
    SolutionIndex: 26
    SolutionNameMin: Cijk_Ailk_Bljk_BBS_BH_MT256x128x32_MI16x16x16x1_SN_GLVWB8_LBSPPA2048_LPA32_LPB8_LRVW4_MIAV1_PLR3_SVW2_TT4_128_VW2_WG64_4_1_WGM32
    SolutionIndex: 27
    SolutionNameMin: Cijk_Ailk_Bljk_BBS_BH_MT128x128x64_MI16x16x16x1_SN_LBSPPA0_LPA0_LPB16_MIAV0_PLR5_SU4_SUS256_SPO0_SVW4_TT4_64_VW4_WG32_8_1_WGMn16
    SolutionIndex: 28
    SolutionNameMin: Cijk_Ailk_Bljk_BBS_BH_MT256x112x64_MI16x16x16x1_SN_CLR1_GLVWB2_GSU2_GSUAMB_LBSPPA4096_LPA32_LPB16_LRVW8_MIAV0_NEPBS0_PLR5_SU0_SUS0_SVW2_TT4_112_VW2_WSGRA1_WG64_4_1_WGM8
    SolutionIndex: 29
    SolutionNameMin: Cijk_Ailk_Bljk_BBS_BH_MT256x256x32_MI16x16x16x1_SN_SU0_SUS0_TT4_256_WSGRA1_WG64_4_1_WGMn16
    SolutionIndex: 30
    SolutionNameMin: Cijk_Ailk_Bljk_BBS_BH_MT256x224x64_MI16x16x16x1_SN_EPS1_GLVWB2_GLS0_LBSPPA0_LBSPPB128_LPA0_LPB4_LRVW4_NEPBS0_NLCA2_SU4_SUS256_WSGRA1_WGMn16
    SolutionIndex: 31
    SolutionNameMin: Cijk_Ailk_Bljk_BBS_BH_MT256x224x64_MI16x16x16x1_SN_LBSPPA2048_LBSPPB128_LPA16_LPB4_LRVW4_SU0_SUS0_SVW2_VW2_WSGRA0_WGM1
    SolutionIndex: 32
    SolutionNameMin: Cijk_Ailk_Bljk_BBS_BH_MT256x224x64_MI16x16x16x1_SN_CLR0_LBSPPA0_LBSPPB128_LPA0_LPB4_LRVW4_NEPBS0_NLCA2_PLR5_SU8_SUM0_TT4_224_WSGRA0_WGM1
    SolutionIndex: 33
    SolutionNameMin: Cijk_Ailk_Bljk_BBS_BH_MT256x256x32_MI16x16x16x1_SN_CLR1_LBSPPA2048_LBSPPB128_LPA16_LPB4_LRVW4_NEPBS16_NLCA1_PLR3_SU8_SUM2_TT4_256_WSGRA1_WGM16
    SolutionIndex: 34
    SolutionNameMin: Cijk_Ailk_Bljk_BBS_BH_MT256x256x64_MI16x16x16x1_SN_1LDSB1_ELFLRn20_GLVWA4_GLVWB2_GRPM0p26_LBSPPB256_LPB4_NLCA1_PGR1_PLR1_SU8_SUS256_SVW4_TT4_256_VW4_VWB2_WGM30
    SolutionIndex: 35
    SolutionNameMin: Cijk_Ailk_Bljk_BBS_BH_MT256x256x64_MI16x16x16x1_SN_1LDSB1_DTVA1_ELFLR0_GLVWA4_GLVWB2_GRPM0p28_LBSPPB256_LPB4_LRVW4_PGR1_PLR1_SU8_SUS256_TT4_256_WSGRA0_WGM30
    SolutionIndex: 36
    SolutionNameMin: Cijk_Ailk_Bljk_BBS_BH_MT256x256x64_MI16x16x16x1_SN_1LDSB1_DTVA1_ELFLR0_GLVWA4_GLVWB2_GRPM0p26_LBSPPB256_LPB4_LRVW4_PGR1_PLR1_SU8_SUS256_TT4_256_WSGRA0_WGM30
    SolutionIndex: 37
    SolutionNameMin: Cijk_Ailk_Bljk_BBS_BH_MT256x256x64_MI16x16x16x1_SN_1LDSB1_DTVA1_ELFLRn20_GLVWA4_GLVWB2_GRPM0p26_LBSPPB256_LPB4_LRVW4_PGR1_PLR1_SU0_SUS0_TT4_256_WSGRA0_WGMn30
    SolutionIndex: 38
    SolutionNameMin: Cijk_Ailk_Bljk_BBS_BH_MT256x256x64_MI16x16x16x1_SN_1LDSB1_DTVA1_ELFLRn20_GLVWA4_GLVWB2_GRPM0p26_LBSPPB256_LPB4_LRVW4_PGR1_PLR1_SU0_SUS0_TT4_256_WSGRA0_WGM30
    SolutionIndex: 39
    SolutionNameMin: Cijk_Ailk_Bljk_BBS_BH_MT256x256x64_MI16x16x16x1_SN_1LDSB1_DTVA1_ELFLR0_GLVWA4_GLVWB2_GRPM0p24_LBSPPB256_LPB4_LRVW4_PGR1_PLR1_SU0_SUS0_TT4_256_WSGRA0_WGM30
    SolutionIndex: 40
    SolutionNameMin: Cijk_Ailk_Bljk_BBS_BH_MT256x256x64_MI16x16x16x1_SN_1LDSB1_DTVA1_ELFLR0_GLVWA4_GLVWB2_GRPM0p26_LBSPPB256_LPB4_LRVW4_PGR1_PLR1_SU0_SUS0_TT4_256_WSGRA0_WGM30
    SolutionIndex: 41
    SolutionNameMin: Cijk_Ailk_Bljk_BBS_BH_MT64x64x64_MI16x16x16x1_SN_AMAS3_CLR0_GLVWA8_GLVWB8_LBSPPA1024_LPA16_LPB16_MIAV0_SU16_SUS512_TT2_32_VW2_VFLRP1_WG32_8_1_WGM12
    SolutionIndex: 42
    SolutionNameMin: Cijk_Ailk_Bljk_BBS_BH_MT64x64x64_MI16x16x16x1_SN_AMAS3_CLR0_GLVWA2_GLVWB8_LBSPPA1024_LPA16_LPB16_MIAV0_SU8_SUS1024_TT1_64_VW2_VFLRP0_WG64_4_1_WGM12
    SolutionIndex: 43
    SolutionNameMin: Cijk_Ailk_Bljk_BBS_BH_MT64x64x32_MI32x32x8x1_SN_AMAS3_CLR0_GLVWA8_GLVWB8_LBSPPA0_LPA0_LPB8_MIAV0_SU2_SUS512_TT1_32_VW2_VFLRP1_WG64_4_1_WGM30
    SolutionIndex: 44
    SolutionNameMin: Cijk_Ailk_Bljk_BBS_BH_MT64x64x64_MI16x16x16x1_SN_AMAS3_CLR1_GLVWA8_GLVWB8_LBSPPA1024_LPA16_LPB16_MIAV0_SU16_SUS1024_TT1_64_VW2_VFLRP1_WG64_4_1_WGM30
    SolutionIndex: 45
    SolutionNameMin: Cijk_Ailk_Bljk_BBS_BH_MT64x64x64_MI16x16x16x1_SN_AMAS3_CLR1_GLVWA8_GLVWB8_LBSPPA1024_LPA16_LPB16_MIAV0_SU16_SUS1024_TT1_64_VW4_VFLRP1_WG64_4_1_WGMn12
    SolutionIndex: 46
    SolutionNameMin: Cijk_Ailk_Bljk_BBS_BH_MT64x64x64_MI16x16x16x1_SN_AMAS3_CLR1_GLVWA2_GLVWB8_LBSPPA1024_LPA16_LPB16_MIAV0_SU16_SUS512_TT1_64_VW2_VFLRP1_WG64_4_1_WGMn12
    SolutionIndex: 47
    SolutionNameMin: Cijk_Ailk_Bljk_BBS_BH_MT64x64x64_MI16x16x16x1_SN_AMAS3_CLR0_GLVWA8_GLVWB8_LBSPPA1024_LPA16_LPB16_MIAV0_SU8_SUS1024_TT1_64_VW2_VFLRP0_WG64_4_1_WGMn12
    SolutionIndex: 48
    SolutionNameMin: Cijk_Ailk_Bljk_BBS_BH_MT32x32x64_MI16x16x16x1_SN_AMAS3_ELFLR8_GLVWB8_GLS1_LBSPPA512_LPB16_LRVW8_MIAV0_PLR5_SU64_SUS128_VW2_VFLRP1_WGM12
    SolutionIndex: 49
    SolutionNameMin: Cijk_Ailk_Bljk_BBS_BH_MT32x32x64_MI16x16x16x1_SN_AMAS3_ELFLR0_GLVWB8_GLS1_LBSPPA256_LPB8_LRVW4_MIAV1_PLR5_SU64_SUS128_VW2_VFLRP1_WGM12
    SolutionIndex: 50
    SolutionNameMin: Cijk_Ailk_Bljk_BBS_BH_MT32x32x64_MI16x16x16x1_SN_AMAS3_ELFLR0_GLVWB8_GLS1_LBSPPA512_LPB16_LRVW8_MIAV0_PLR5_SU8_SUS128_VW2_VFLRP1_WGM12
    SolutionIndex: 51
    SolutionNameMin: Cijk_Ailk_Bljk_BBS_BH_MT32x32x64_MI16x16x16x1_SN_AMAS3_ELFLR4_GLVWB2_GLS1_LBSPPA512_LPB16_LRVW8_MIAV0_PLR5_SU4_SUS512_VW4_VFLRP0_WGM12
    SolutionIndex: 52
    SolutionNameMin: Cijk_Ailk_Bljk_BBS_BH_MT32x32x64_MI16x16x16x1_SN_AMAS3_ELFLR4_GLVWB2_GLS0_LBSPPA512_LPB16_LRVW8_MIAV1_PLR5_SU4_SUS512_VW4_VFLRP0_WGM12
    SolutionIndex: 53
    SolutionNameMin: Cijk_Ailk_Bljk_BBS_BH_MT128x128x64_MI16x16x16x1_SN_ELFLRn20_GLVWB8_GRPM0p45_LBSPPB256_LPB16_LRVW8_MIAV0_PGR2_PLR5_SU8_SUS128_WGM12
    SolutionIndex: 54
    SolutionNameMin: Cijk_Ailk_Bljk_BBS_BH_MT128x128x64_MI16x16x16x1_SN_ELFLR0_GLVWB2_GRPM0p40_LBSPPB256_LPB16_LRVW8_MIAV1_PGR2_PLR5_SU8_SUS128_WGM12
    SolutionIndex: 55
    SolutionNameMin: Cijk_Ailk_Bljk_BBS_BH_MT128x128x64_MI16x16x16x1_SN_ELFLR0_GLVWB8_GRPM0p70_LBSPPB256_LPB16_LRVW8_MIAV0_PGR2_PLR5_SU8_SUS128_WGM12
    SolutionIndex: 56
    SolutionNameMin: Cijk_Ailk_Bljk_BBS_BH_MT128x128x64_MI16x16x16x1_SN_ELFLR0_GLVWB2_GRPM0p80_LBSPPB256_LPB4_LRVW4_MIAV0_PGR2_PLR5_SU8_SUS128_WGM12
    SolutionIndex: 57
    SolutionNameMin: Cijk_Ailk_Bljk_BBS_BH_MT64x64x64_MI16x16x16x1_SN_AMAS3_ELFLR4_GLS1_LBSPPA512_LBSPPB256_LPA32_LPB4_LRVW4_NTC2_NTD2_PLR1_SS1_SU64_SUS512_SPO1_SVW2_TT2_32_VW2_VWB2_VFLRP1_WG32_8_1
    SolutionIndex: 58
    SolutionNameMin: Cijk_Ailk_Bljk_BBS_BH_MT64x64x64_MI16x16x16x1_SN_AMAS3_ELFLR4_GLS0_LBSPPA512_LBSPPB256_LPA32_LPB4_LRVW4_NTC3_NTD3_PLR1_SS1_SU64_SUS512_SPO0_SVW2_TT2_32_VW2_VWB2_VFLRP0_WG32_8_1
    SolutionIndex: 59
    SolutionNameMin: Cijk_Ailk_Bljk_BBS_BH_MT16x16x256_MI16x16x16x1_SN_GLVWA8_GLVWB8_GSU1_GSUASB_LBSPPA256_LBSPPB512_LPB16_LRVW8_MKFGSU256_NLCB1_PGR2_PLR5_SU0_SUS0_WG16_4_4
    SolutionIndex: 60
    SolutionNameMin: Cijk_Ailk_Bljk_BBS_BH_MT16x16x256_MI16x16x16x1_SN_ETSP_EMLL0_GSU32_LBSPPA256_LBSPPB512_LPA16_LPB16_LRVW8_NTA0_NTB0_PLR5_PKA0_SS1_SVW1
    SolutionIndex: 61
    SolutionNameMin: Cijk_Ailk_Bljk_BBS_BH_MT16x16x256_MI16x16x16x1_SN_GLVWA8_GLVWB4_GSU128_LBSPPA128_LBSPPB512_LPB4_LRVW4_NLCB1_PGR2_PLR1_SU0_SUS0_WG16_4_4
    SolutionIndex: 62
    SolutionNameMin: Cijk_Ailk_Bljk_BBS_BH_MT16x32x256_MI16x16x16x1_SN_1LDSB1_ETB_EMLL8_GLVWB8_LBSPPA256_LBSPPB512_LPB16_LRVW8_NTB4_PLR5_PKA1_SS1_SVW1_TT1_32_VWB1_WG16_4_4
    SolutionIndex: 63
    SolutionNameMin: Cijk_Ailk_Bljk_BBS_BH_MT16x64x128_MI16x16x16x1_SN_1LDSB0_ETB_EMLL8_GLVWA4_GLVWB2_LBSPPB256_LPB4_NTB4_PLR1_PKA1_SS0_SVW4_TT1_64_VWB1_WG16_4_4
    SolutionIndex: 64
    SolutionNameMin: Cijk_Ailk_Bljk_BBS_BH_MT16x128x64_MI16x16x16x1_SN_1LDSB0_ETB_GLVWB8_GSU19_LBSPPB256_LPB8_NTB4_PLR1_PKA1_SS1_SVW1_TT1_32_VWB2_WG16_16_1
    SolutionIndex: 65
    SolutionNameMin: Cijk_Ailk_Bljk_BBS_BH_MT16x64x128_MI16x16x16x1_SN_1LDSB0_ETSP_GLVWA8_GLVWB4_LBSPPA256_LBSPPB256_LPB16_LRVW8_NTB4_PLR9_PKA0_TT1_16_WG16_16_1
    SolutionIndex: 66
    SolutionNameMin: Cijk_Ailk_Bljk_BBS_BH_MT16x64x128_MI16x16x16x1_SN_1LDSB1_ETSP_EMLL8_GLVWA8_GLVWB8_GSU8_LBSPPB256_LPB8_NTB4_PLR1_PKA0_SS1_SVW1_TT1_64_VWB1_WG16_4_4
    SolutionIndex: 67
    SolutionNameMin: Cijk_Ailk_Bljk_BBS_BH_MT16x192x64_MI16x16x16x1_SN_ETB_GSU7_LBSPPA0_LBSPPB256_LPA0_NTB4_PKA1_SS1_SVW1_TT1_192_VWB2
    SolutionIndex: 68
    SolutionNameMin: Cijk_Ailk_Bljk_BBS_BH_MT32x16x256_MI16x16x16x1_SN_1LDSB1_AMAS3_DTVA1_ETB_GLVWA2_LBSPPA0_LPA0_LPB16_LRVW8_NTA0_PGR2_PLR5_PKA1_SVW2_TT2_16_VW2_WG16_4_4
    SolutionIndex: 69
    SolutionNameMin: Cijk_Ailk_Bljk_BBS_BH_MT128x16x128_MI16x16x16x1_SN_ETB_GLVWA4_GLVWB8_GSU16_LBSPPB256_LPB8_NTA4_NLCA2_PLR3_PKA1_SVW4_TT8_16_VW4_WG16_4_4
    SolutionIndex: 70
    SolutionNameMin: Cijk_Ailk_Bljk_BBS_BH_MT128x16x128_MI16x16x16x1_SN_ETSP_GLVWA4_GLVWB8_GSU4_GSUAMB_LBSPPB256_LPB8_NTC0_NTD0_NLCA2_PGR2_PLR1_PKA0_SVW4_TT8_16_VW4_WG16_4_4
    SolutionIndex: 71
    SolutionNameMin: Cijk_Ailk_Bljk_BBS_BH_MT256x16x64_MI16x16x16x1_SN_ETB_GLVWA4_GLVWB4_GSU6_LBSPPB128_LPB4_NTA4_NLCA4_PLR1_PKA1_SVW4_TT16_16_VW4_WG16_4_4
    SolutionIndex: 72
    SolutionNameMin: Cijk_Ailk_Bljk_BBS_BH_MT256x128x32_MI16x16x16x1_SN_1LDSB0_ELFLR0_GLVWA4_GLVWB4_GRPM0p24_LBSPPB128_LPB4_NLCA1_PGR1_PLR1_SU0_SUS0_SVW4_TT4_128_VW4_VWB2_WGM30
    SolutionIndex: 73
    SolutionNameMin: Cijk_Ailk_Bljk_BBS_BH_MT32x32x64_MI16x16x16x1_SN_CLR1_EPS1_ELFLR4_EMLL2_GLS1_LBSPPA512_LBSPPB128_NTC0_NTD0_NEPBS8_SU16_SPO0_SSO1_TT1_16_VWB1_WG32_8_1
    SolutionIndex: 74
    SolutionNameMin: Cijk_Ailk_Bljk_BBS_BH_MT32x32x64_MI16x16x16x1_SN_CLR0_EPS1_ELFLR0_EMLL0_GLS0_LBSPPA512_LBSPPB128_NTC2_NTD2_NEPBS8_SU64_SPO1_SSO1_TT1_16_VWB1_WG32_8_1
    SolutionIndex: 75
    SolutionNameMin: Cijk_Ailk_Bljk_BBS_BH_MT32x32x64_MI16x16x16x1_SN_CLR0_EPS0_ELFLR4_EMLL0_GLS0_LBSPPA512_LBSPPB128_NTC2_NTD2_NEPBS8_SU4_SPO0_SSO0_TT1_16_VWB1_WG32_8_1
    SolutionIndex: 76
    SolutionNameMin: Cijk_Ailk_Bljk_BBS_BH_MT64x32x64_MI16x16x16x1_SN_CLR1_EPS1_ELFLR0_EMLL2_GLS0_LBSPPA1024_LBSPPB256_NTC2_NTD2_NEPBS8_SU8_SPO0_SSO1_TT1_32_VWB2_WG64_4_1
    SolutionIndex: 77
    SolutionNameMin: Cijk_Ailk_Bljk_BBS_BH_MT16x16x64_MI16x16x16x1_SN_CLR0_GLVWA2_GLVWB2_GRVWn1_LBSPPA128_LPB4_LRVW4_MIAV0_NTC0_NTD0_NEPBS16_PLR1_SU8_SUS128_SSO0_VFLRP0_WG16_4_4_WGM12
    SolutionIndex: 78
    SolutionNameMin: Cijk_Ailk_Bljk_BBS_BH_MT16x16x64_MI16x16x16x1_SN_CLR0_GLVWA4_GLVWB4_GRVW4_LBSPPA128_LPB4_LRVW4_MIAV0_NTC0_NTD0_NEPBS16_PLR1_SU8_SUS128_SSO0_VFLRP1_WG16_4_4_WGM30
    SolutionIndex: 79
    SolutionNameMin: Cijk_Ailk_Bljk_BBS_BH_MT16x16x64_MI16x16x16x1_SN_CLR0_GLVWA2_GLVWB2_GRVWn1_LBSPPA128_LPB4_LRVW4_MIAV0_NTC0_NTD0_NEPBS16_PLR1_SU8_SUS128_SSO4_VFLRP1_WG16_4_4_WGM30
    SolutionIndex: 80
    SolutionNameMin: Cijk_Ailk_Bljk_BBS_BH_MT16x16x64_MI16x16x16x1_SN_CLR0_GLVWA4_GLVWB4_GRVW4_LBSPPA128_LPB4_LRVW4_MIAV0_NTC0_NTD0_NEPBS0_PLR1_SU8_SUS128_SSO0_VFLRP1_WG16_4_4_WGM30
    SolutionIndex: 81
    SolutionNameMin: Cijk_Ailk_Bljk_BBS_BH_MT64x128x32_MI16x16x16x1_SN_CLR1_ELFLR4_GLVWA4_GLVWB4_GRVW4_LBSPPB256_LPB4_MIAV1_NEPBS0_PLR3_SU8_SUS128_SSO0_TT2_64_VWB4_VFLRP1_WG32_8_1_WGM12
    SolutionIndex: 82
    SolutionNameMin: Cijk_Ailk_Bljk_BBS_BH_MT64x128x32_MI16x16x16x1_SN_CLR1_ELFLR0_GLVWA8_GLVWB8_GRVW8_LBSPPB256_LPB8_MIAV0_NEPBS16_PLR1_SU0_SUS0_SSO4_TT2_128_VWB4_VFLRP1_WG32_4_1_WGM30
    SolutionIndex: 83
    SolutionNameMin: Cijk_Ailk_Bljk_BBS_BH_MT64x128x32_MI16x16x16x1_SN_CLR1_ELFLR0_GLVWA8_GLVWB8_GRVW8_LBSPPB256_LPB8_MIAV0_NEPBS0_PLR3_SU8_SUS128_SSO0_TT2_128_VWB4_VFLRP1_WG32_4_1_WGM12
    SolutionIndex: 84
    SolutionNameMin: Cijk_Ailk_Bljk_BBS_BH_MT64x128x32_MI16x16x16x1_SN_CLR1_ELFLR0_GLVWA8_GLVWB8_GRVW8_LBSPPB128_LPB8_MIAV0_NEPBS0_PLR1_SU8_SUS128_SSO4_TT2_64_VWB1_VFLRP1_WG32_8_1_WGM12
    SolutionIndex: 85
    SolutionNameMin: Cijk_Ailk_Bljk_BBS_BH_MT64x128x32_MI16x16x16x1_SN_CLR1_ELFLR0_GLVWA8_GLVWB8_GRVW8_LBSPPB128_LPB8_MIAV1_NEPBS16_PLR1_SU8_SUS128_SSO0_TT2_64_VWB1_VFLRP1_WG32_8_1_WGM30
    SolutionIndex: 86
    SolutionNameMin: Cijk_Ailk_Bljk_BBS_BH_MT64x64x32_MI16x16x16x1_SN_1LDSB1_CLR0_ELFLR0_IU2_LBSPPB128_LPB8_MIAV1_NEPBS0_PLR1_SIA2_SLW0_SSO0_TLDS1_UMLDSB1_VWB1_VFLRP0_WGM30
    SolutionIndex: 87
    SolutionNameMin: Cijk_Ailk_Bljk_BBS_BH_MT64x64x32_MI16x16x16x1_SN_1LDSB1_CLR0_ELFLR4_IU2_LBSPPB128_LPB8_MIAV1_NEPBS16_PLR1_SIA2_SLW1_SSO4_TLDS1_UMLDSB1_VWB1_VFLRP0_WGM30
    SolutionIndex: 88
    SolutionNameMin: Cijk_Ailk_Bljk_BBS_BH_MT64x64x32_MI16x16x16x1_SN_1LDSB1_CLR0_ELFLR4_IU2_LBSPPB128_LPB8_MIAV0_NEPBS16_PLR1_SIA2_SLW0_SSO4_TLDS1_UMLDSB1_VWB2_VFLRP0_WGM12
    SolutionIndex: 89
    SolutionNameMin: Cijk_Ailk_Bljk_BBS_BH_MT64x64x32_MI16x16x16x1_SN_1LDSB1_CLR0_ELFLR0_IU2_LBSPPB128_LPB8_MIAV0_NEPBS0_PLR1_SIA2_SLW1_SSO4_TLDS1_UMLDSB1_VWB1_VFLRP0_WGM12
    SolutionIndex: 90
    SolutionNameMin: Cijk_Ailk_Bljk_BBS_BH_MT128x16x64_MI16x16x16x1_SN_1LDSB1_ETB_GLVWA4_GLVWB8_GSU18_LBSPPB128_LPB8_NTA4_NLCA1_PGR2_PLR1_PKA1_SVW4_TT4_16_VW4_WG32_4_1
    SolutionIndex: 91
    SolutionNameMin: Cijk_Ailk_Bljk_BBS_BH_MT64x16x128_MI16x16x16x1_SN_1LDSB1_AMAS3_CLR1_DTVA1_ETB_GLVWA2_LBSPPA0_LPA0_NTA0_NLCA2_PGR2_PLR1_PKA1_SVW2_TT4_16_VW2_WG16_4_4
    SolutionIndex: 92
    SolutionNameMin: Cijk_Ailk_Bljk_BBS_BH_MT128x16x64_MI16x16x16x1_SN_1LDSB0_ETB_GLVWA2_GLVWB2_GSU12_LBSPPB128_LPB4_NTA0_NLCA2_PLR1_PKA1_SVW2_TT4_16_VW2_WG32_4_2
    SolutionIndex: 93
    SolutionNameMin: Cijk_Ailk_Bljk_BBS_BH_MT256x16x64_MI16x16x16x1_SN_1LDSB0_ETB_GLVWA4_GLVWB4_GSU12_LBSPPB128_LPB4_NTA4_NLCA2_PLR1_PKA1_SVW4_TT8_16_VW4_WG32_4_2
    SolutionIndex: 94
    SolutionNameMin: Cijk_Ailk_Bljk_BBS_BH_MT128x32x64_MI16x16x16x1_SN_1LDSB0_ETSP_GLVWA2_GLVWB2_GSU16_LBSPPB256_LPB4_NTA0_NLCA2_PLR3_PKA0_SVW2_TT4_32_VW2_WG32_4_2
    SolutionIndex: 95
    SolutionNameMin: Cijk_Ailk_Bljk_BBS_BH_MT256x32x64_MI16x16x16x1_SN_1LDSB1_ETB_GLVWA2_GLVWB8_GSU8_LBSPPB256_LPB8_NTA0_NLCA2_PLR5_PKA1_SVW2_TT4_32_VW2_WG64_4_1
    SolutionIndex: 96
    SolutionNameMin: Cijk_Ailk_Bljk_BBS_BH_MT64x16x64_MI16x16x16x1_SN_DTVA1_ETSP_GLVWA4_GLVWB4_GSU1_GSUASB_LBSPPA0_LBSPPB128_LPA0_LPB4_NLCA1_PLR1_PKA0_SVW4_TT4_16_VW4_WG16_4_4
    SolutionIndex: 97
    SolutionNameMin: Cijk_Ailk_Bljk_BBS_BH_MT64x16x128_MI16x16x16x1_SN_DTVA1_ETB_GLVWA4_GLVWB2_GSU1_GSUASB_LBSPPA0_LBSPPB256_LPA0_LPB4_NLCA1_PLR1_PKA1_SVW4_TT4_16_VW4_WG16_4_4
    SolutionIndex: 98
    SolutionNameMin: Cijk_Ailk_Bljk_BBS_BH_MT64x32x128_MI16x16x16x1_SN_DTVA1_ETB_GLVWA2_GLVWB8_GSU1_GSUASB_LBSPPA0_LBSPPB512_LPA0_LPB8_NTA0_NLCA2_PLR1_PKA1_SVW2_TT4_32_VW2_WG16_4_4
    SolutionIndex: 99
    SolutionNameMin: Cijk_Ailk_Bljk_BBS_BH_MT64x32x128_MI16x16x16x1_SN_DTVA1_ETB_GLVWA2_GLVWB2_GSU1_GSUASB_LBSPPA0_LBSPPB512_LPA0_LPB4_NTA0_NLCA2_PLR1_PKA1_SVW2_TT4_32_VW2_WG16_4_4
    SolutionIndex: 100
    SolutionNameMin: Cijk_Ailk_Bljk_BBS_BH_MT256x224x64_MI16x16x16x1_SN_
    SolutionIndex: 101
    SolutionNameMin: Cijk_Ailk_Bljk_BBS_BH_MT96x64x16_MI16x16x16x1_SN_1LDSB0_AMAS3_ELFLR0_FL0_GLVWA2_GLVWB2_GRVW2_LPA32_NLCA3_TT6_16_VW2_WG16_16_1_WGM30
    SolutionIndex: 102
    SolutionNameMin: Cijk_Ailk_Bljk_BBS_BH_MT96x128x32_MI16x16x16x1_SN_1LDSB0_AMAS0_ELFLR0_FL0_GLVWA2_GLVWB2_GRVW2_LPA16_NLCA3_TT3_64_VW1_WG32_8_1_WGM1
    SolutionIndex: 103
    SolutionNameMin: Cijk_Ailk_Bljk_BBS_BH_MT16x32x64_MI16x16x16x1_SN_AMAS0_EPS1_ELFLR0_LBSPPA128_LBSPPB128_LPA16_NEPBS16_PGR2_SU8_SUS256_SSO0_TT1_16_TLDS1_VW1_VWB1_WG16_8_2_WGM30
    SolutionIndex: 104
    SolutionNameMin: Cijk_Ailk_Bljk_BBS_BH_MT32x16x64_MI16x16x16x1_SN_AMAS0_EPS1_ELFLR4_LBSPPA256_LBSPPB128_LPA16_NEPBS16_PGR2_SU0_SUS0_SSO0_TT1_16_TLDSn1_VW1_VWB1_WG32_4_2_WGM12
    SolutionIndex: 105
    SolutionNameMin: Cijk_Ailk_Bljk_BBS_BH_MT32x16x64_MI16x16x16x1_SN_AMAS0_EPS1_ELFLR4_LBSPPA256_LBSPPB128_LPA16_NEPBS0_PGR2_SU0_SUS0_SSO4_TT1_16_TLDSn1_VW1_VWB1_WG32_4_2_WGM1
    SolutionIndex: 106
    SolutionNameMin: Cijk_Ailk_Bljk_BBS_BH_MT64x128x64_MI32x32x8x1_SN_1LDSB0_AMAS3_CLR1_EPS1_ELFLR4_GSU18_GSUAMB_LBSPPB256_LPB4_PGR2_PLR5_SSO4_TLDS1_UMLDSB1_VW2_VFLRP1_WG32_4_2_WGM12
    SolutionIndex: 107
    SolutionNameMin: Cijk_Ailk_Bljk_BBS_BH_MT32x16x64_MI16x16x16x1_SN_AMAS0_EPS1_ELFLR4_GLVWA4_GLVWB4_GRVW4_LBSPPA256_LBSPPB128_LPA16_LPB4_MIAV1_PGR2_PLR1_TT1_16_TLDS1_UMLDSB1_VW1_WG32_4_1_WGM30
    SolutionIndex: 108
    SolutionNameMin: Cijk_Ailk_Bljk_BBS_BH_MT64x16x64_MI16x16x16x1_SN_AMAS0_EPS1_ELFLR4_GLVWA2_GLVWB2_GRVW2_LBSPPA512_LBSPPB128_LPA16_LPB4_MIAV1_PGR2_PLR1_TT1_16_TLDS1_UMLDSB1_VW1_WG64_4_1_WGM30
    SolutionIndex: 109
    SolutionNameMin: Cijk_Ailk_Bljk_BBS_BH_MT96x128x32_MI16x16x16x1_SN_1LDSB0_AMAS0_ELFLR4_FL0_GLVWA2_GLVWB2_GRVW2_LPA16_NLCA3_TT3_64_VW1_WG32_8_1_WGM30
    SolutionIndex: 110
    SolutionNameMin: Cijk_Ailk_Bljk_BBS_BH_MT16x32x64_MI16x16x16x1_SN_AMAS0_EPS1_ELFLR4_GLVWA4_GLVWB4_GRVW4_LBSPPA128_LBSPPB128_LPA16_LPB4_MIAV1_PGR2_PLR5_TT1_16_TLDS1_UMLDSB1_VW1_WG16_8_1_WGM12
    SolutionIndex: 111
    SolutionNameMin: Cijk_Ailk_Bljk_BBS_BH_MT16x16x64_MI16x16x16x1_SN_AMAS0_EPS1_ELFLR0_GLVWA4_GLVWB4_GRVW4_LBSPPA128_LBSPPB128_LPA16_LPB4_MIAV1_PGR2_PLR1_TT1_16_TLDS1_UMLDSB1_VW1_WG16_4_1_WGM12
    SolutionIndex: 112
    SolutionNameMin: Cijk_Ailk_Bljk_BBS_BH_MT32x16x64_MI16x16x16x1_SN_AMAS0_EPS1_ELFLR0_GLVWA2_GLVWB2_GRVW2_LBSPPA256_LBSPPB128_LPA16_LPB4_MIAV0_PGR2_PLR1_TT1_16_TLDS1_UMLDSB1_VW1_WG32_4_1_WGM1
    SolutionIndex: 113
    SolutionNameMin: Cijk_Ailk_Bljk_BBS_BH_MT32x64x64_MI16x16x16x1_SN_AMAS3_EPS1_ELFLR4_GLVWA8_GLVWB4_LBSPPA256_LBSPPB256_LPA32_NEPBS16_PGR2_SU0_SUS0_SSO0_TT2_32_TLDSn1_VW2_VWB2_WG16_8_2_WGM1
    SolutionIndex: 114
    SolutionNameMin: Cijk_Ailk_Bljk_BBS_BH_MT64x64x64_MI32x32x8x1_SN_1LDSB1_AMAS3_CLR1_EPS1_GLVWA8_GLVWB4_GSU9_GSUAMB_LBSPPB256_LPB4_PGR2_PLR3_SSO4_TLDS1_UMLDSB1_VW2_VFLRP1_WG32_2_4_WGM30
    SolutionIndex: 115
    SolutionNameMin: Cijk_Ailk_Bljk_BBS_BH_MT64x64x64_MI32x32x8x1_SN_1LDSB0_AMAS3_CLR1_EPS1_GLVWA8_GLVWB4_GSU9_GSUAMB_LBSPPB256_LPB4_PGR2_PLR3_SSO0_TLDS1_UMLDSB1_VW2_VFLRP1_WG32_2_4_WGM12
    SolutionIndex: 116
    SolutionNameMin: Cijk_Ailk_Bljk_BBS_BH_MT64x128x64_MI32x32x8x1_SN_1LDSB0_AMAS3_CLR1_EPS1_GLVWA8_GLVWB2_GSU18_GSUAMB_LBSPPB256_LPB4_PGR2_PLR5_SSO0_TLDS1_UMLDSB1_VW2_VFLRP1_WG32_4_2_WGM30
    SolutionIndex: 117
    SolutionNameMin: Cijk_Ailk_Bljk_BBS_BH_MT64x128x64_MI32x32x8x1_SN_1LDSB1_AMAS0_CLR0_EPS1_GLVWA2_GLVWB2_GSU9_GSUAMB_LBSPPB256_LPB4_PGR2_PLR5_SSO4_TLDS1_UMLDSB1_VW1_VFLRP0_WG32_4_2_WGM30
    SolutionIndex: 118
    SolutionNameMin: Cijk_Ailk_Bljk_BBS_BH_MT64x128x64_MI32x32x8x1_SN_1LDSB1_AMAS3_CLR1_EPS1_GLVWA8_GLVWB2_GSU9_GSUAMB_LBSPPB256_LPB4_PGR2_PLR5_SSO0_TLDS1_UMLDSB1_VW2_VFLRP1_WG32_4_2_WGM12
    SolutionIndex: 119
    SolutionNameMin: Cijk_Ailk_Bljk_BBS_BH_MT64x16x64_MI16x16x16x1_SN_AMAS0_ELFLR0_LBSPPA512_LBSPPB128_LPA16_LPB4_PGR2_PLR5_SU8_SUS256_TT1_16_TLDS1_UMLDSB1_VW1_VWB1_WG64_4_1_WGM12
    SolutionIndex: 120
    SolutionNameMin: Cijk_Ailk_Bljk_BBS_BH_MT64x32x64_MI16x16x16x1_SN_AMAS3_ELFLR0_LBSPPA512_LBSPPB128_LPA32_LPB4_PGR2_PLR1_SU0_SUS0_TT2_16_TLDS1_UMLDSB1_VW2_VWB1_WG32_8_1_WGM12
    SolutionIndex: 121
    SolutionNameMin: Cijk_Ailk_Bljk_BBS_BH_MT64x32x64_MI16x16x16x1_SN_AMAS3_ELFLR4_LBSPPA512_LBSPPB128_LPA32_LPB4_PGR2_PLR1_SU8_SUS256_TT2_16_TLDS1_UMLDSB1_VW2_VWB1_WG32_8_1_WGM12
    SolutionIndex: 122
    SolutionNameMin: Cijk_Ailk_Bljk_BBS_BH_MT128x128x32_MI32x32x8x1_SN_AMAS3_ELFLR0_LBSPPA0_LBSPPB128_LPA0_LPB4_PGR2_PLR5_SU0_SUS0_TT2_64_TLDS1_UMLDSB1_VW2_VWB1_WG64_4_1_WGM30
    SolutionIndex: 123
    SolutionNameMin: Cijk_Ailk_Bljk_BBS_BH_MT256x128x32_MI16x16x16x1_SN_AMAS0_ELFLR0_LBSPPA2048_LBSPPB128_LPA16_LPB4_PGR2_PLR1_SU0_SUS0_TT4_128_TLDS1_UMLDSB1_VW1_VWB2_WG64_4_1_WGM30
    SolutionIndex: 124
    SolutionNameMin: Cijk_Ailk_Bljk_BBS_BH_MT256x128x32_MI16x16x16x1_SN_AMAS3_ELFLR4_LBSPPA2048_LBSPPB128_LPA32_LPB4_PGR2_PLR1_SU0_SUS0_TT4_128_TLDS1_UMLDSB1_VW2_VWB2_WG64_4_1_WGM12
    SolutionIndex: 125
    SolutionNameMin: Cijk_Ailk_Bljk_BBS_BH_MT32x16x64_MI16x16x16x1_SN_AMAS0_CLR0_EPS1_ELFLR0_LBSPPA256_LBSPPB128_LPA16_NEPBS0_PGR1_PLR3_SU8_SUS256_SSO0_TT1_16_VW1_VWB1_VFLRP1_WG32_4_2_WGM1
    SolutionIndex: 126
    SolutionNameMin: Cijk_Ailk_Bljk_BBS_BH_MT16x32x64_MI16x16x16x1_SN_AMAS0_CLR1_EPS1_ELFLR0_LBSPPA128_LBSPPB128_LPA16_NEPBS16_PGR2_PLR3_SU8_SUS256_SSO0_TT1_16_VW1_VWB1_VFLRP1_WG16_8_2_WGM1
    SolutionIndex: 127
    SolutionNameMin: Cijk_Ailk_Bljk_BBS_BH_MT32x16x64_MI16x16x16x1_SN_AMAS0_CLR1_EPS1_ELFLR0_LBSPPA256_LBSPPB128_LPA16_NEPBS16_PGR2_PLR3_SU0_SUS0_SSO0_TT1_16_VW1_VWB1_VFLRP1_WG32_4_2_WGM30
    SolutionIndex: 128
    SolutionNameMin: Cijk_Ailk_Bljk_BBS_BH_MT32x16x64_MI16x16x16x1_SN_AMAS0_CLR0_EPS1_ELFLR0_LBSPPA256_LBSPPB128_LPA16_NEPBS0_PGR2_PLR3_SU8_SUS256_SSO4_TT1_16_VW1_VWB1_VFLRP0_WG32_4_2_WGM12
    SolutionIndex: 129
    SolutionNameMin: Cijk_Ailk_Bljk_BBS_BH_MT32x16x64_MI16x16x16x1_SN_AMAS0_CLR1_EPS1_ELFLR0_LBSPPA256_LBSPPB128_LPA16_NEPBS0_PGR2_PLR3_SU8_SUS256_SSO4_TT1_16_VW1_VWB1_VFLRP1_WG32_4_2_WGM1
    SolutionIndex: 130
    SolutionNameMin: Cijk_Ailk_Bljk_BBS_BH_MT32x16x64_MI16x16x16x1_SN_AMAS0_CLR0_EPS0_ELFLR4_LBSPPA256_LBSPPB128_LPA16_NEPBS0_PGR0_PLR3_SU8_SUS256_SSO4_TT1_16_VW1_VWB1_VFLRP0_WG32_4_2_WGM12
    SolutionIndex: 131
    SolutionNameMin: Cijk_Ailk_Bljk_BBS_BH_MT32x32x64_MI16x16x16x1_SN_AMAS0_CLR0_EPS1_ELFLR0_LBSPPA256_LBSPPB256_LPA16_NEPBS16_PGR2_PLR3_SU8_SUS256_SSO4_TT1_32_VW1_VWB2_VFLRP0_WG32_4_2_WGM12
    SolutionIndex: 132
    SolutionNameMin: Cijk_Ailk_Bljk_BBS_BH_MT32x16x64_MI16x16x16x1_SN_AMAS0_CLR1_EPS1_ELFLR0_LBSPPA256_LBSPPB128_LPA16_NEPBS0_PGR2_PLR3_SU0_SUS0_SSO0_TT1_16_VW1_VWB1_VFLRP1_WG32_4_2_WGM1
    SolutionIndex: 133
    SolutionNameMin: Cijk_Ailk_Bljk_BBS_BH_MT32x32x64_MI16x16x16x1_SN_AMAS0_CLR0_EPS1_ELFLR0_LBSPPA256_LBSPPB256_LPA16_NEPBS0_PGR2_PLR3_SU8_SUS256_SSO0_TT1_32_VW1_VWB2_VFLRP0_WG32_4_2_WGM1
    SolutionIndex: 134
    SolutionNameMin: Cijk_Ailk_Bljk_BBS_BH_MT128x64x64_MI32x32x8x1_SN_AMAS3_CLR1_EPS1_ELFLR0_LBSPPA0_LBSPPB256_LPA0_NEPBS0_PGR2_PLR5_SU8_SUS256_SSO0_TT2_64_VW2_VWB2_VFLRP1_WG64_2_2_WGM30
    SolutionIndex: 135
    SolutionNameMin: Cijk_Ailk_Bljk_BBS_BH_MT128x64x64_MI16x16x16x1_SN_AMAS3_CLR1_EPS1_ELFLR0_LBSPPA1024_LBSPPB256_LPA32_NEPBS16_PGR2_PLR3_SU0_SUS0_SSO4_TT4_64_VW2_VWB2_VFLRP1_WG32_4_2_WGM30
    SolutionIndex: 136
    SolutionNameMin: Cijk_Ailk_Bljk_BBS_BH_MT128x64x64_MI16x16x16x1_SN_AMAS3_CLR1_EPS1_ELFLR0_LBSPPA1024_LBSPPB256_LPA32_NEPBS16_PGR2_PLR3_SU0_SUS0_SSO4_TT4_64_VW2_VWB2_VFLRP1_WG32_4_2_WGM12
    SolutionIndex: 137
    SolutionNameMin: Cijk_Ailk_Bljk_BBS_BH_MT128x112x64_MI16x16x16x1_SN_1LDSB0_ELFLRn30_FL0_GLVWB2_GRPM0p35_LPB4_LRVW4_MIAV1_PGR2_PLR1
    SolutionIndex: 138
    SolutionNameMin: Cijk_Ailk_Bljk_BBS_BH_MT256x224x64_MI16x16x16x1_SN_CLR0_GLVWB4_LBSPPA0_LBSPPB128_LPA0_LPB4_LRVW4_PLR5_SVW4_TT4_224_VW4_WGM30
    SolutionIndex: 139
    SolutionNameMin: Cijk_Ailk_Bljk_BBS_BH_MT64x64x64_MI32x32x8x1_SN_AMAS3_CLR1_EPS1_ELFLR0_GLVWA2_GLVWB2_LBSPPA0_LBSPPB256_LPA0_LPB4_PGR2_PLR3_SU0_SUS0_SSO0_TT2_64_TLDS1_UMLDSB1_VW2_VFLRP1_WG32_2_4_WGM1
    SolutionIndex: 140
    SolutionNameMin: Cijk_Ailk_Bljk_BBS_BH_MT128x64x64_MI32x32x8x1_SN_AMAS3_CLR1_EPS1_ELFLR0_GLVWA2_GLVWB2_LBSPPA0_LBSPPB256_LPA0_LPB4_PGR2_PLR5_SU0_SUS0_SSO0_TT2_64_TLDS1_UMLDSB1_VW2_VFLRP1_WG64_2_2_WGM1
    SolutionIndex: 141
    SolutionNameMin: Cijk_Ailk_Bljk_BBS_BH_MT64x64x64_MI32x32x8x1_SN_AMAS3_EPS1_ELFLR4_GLVWA2_GLVWB2_LBSPPA0_LBSPPB256_LPA0_LPB4_NLCA1_PGR2_PLR3_SU0_SUS0_SSO4_TT2_64_TLDS1_UMLDSB1_VW2_WG32_2_4_WGM1
    SolutionIndex: 142
    SolutionNameMin: Cijk_Ailk_Bljk_BBS_BH_MT256x128x32_MI16x16x16x1_SN_1LDSB1_AMAS3_CLR1_ELFLR4_GLVWA2_GLVWB2_LBSPPA2048_LBSPPB128_LPA32_NLCA1_PGR2_PLR3_SSO4_TT4_128_VW2_VWB2_VFLRP1_WSGRA0_WG64_4_1_WGM1
    SolutionIndex: 143
    SolutionNameMin: Cijk_Ailk_Bljk_BBS_BH_MT256x112x32_MI16x16x16x1_SN_1LDSB0_ELFLRn20_GLVWA2_GLVWB2_GRPM0p30_LBSPPB128_LPB4_NLCA2_PGR1_PLR3_SU0_SUS0_SVW2_TT4_112_VW2_VWB1_WGM30
    SolutionIndex: 144
    SolutionNameMin: Cijk_Ailk_Bljk_BBS_BH_MT256x256x32_MI32x32x8x1_SN_
    SolutionIndex: 145
    SolutionNameMin: Cijk_Ailk_Bljk_BBS_BH_MT128x128x64_MI16x16x16x1_SN_1LDSB0_ELFLR0_GLVWB4_LPB4_NTC1_NTD1_NLCB1_SU0_SUS0_SSO0_VWB4
    SolutionIndex: 146
    SolutionNameMin: Cijk_Ailk_Bljk_BBS_BH_MT128x128x64_MI16x16x16x1_SN_1LDSB0_ELFLR12_GLVWB4_LPB4_NTC0_NTD0_NLCB2_SU16_SUS256_SSO0_VWB4
    SolutionIndex: 147
    SolutionNameMin: Cijk_Ailk_Bljk_BBS_BH_MT256x128x64_MI16x16x16x1_SN_GRPM1_NTC0_NTD0_NLCB2_PGR2_SU8_SUS256_WGM1
    SolutionIndex: 148
    SolutionNameMin: Cijk_Ailk_Bljk_BBS_BH_MT256x128x64_MI16x16x16x1_SN_GRPM1_NTC0_NTD0_NLCB2_PGR2_SU32_SUS256_WGMn4
    SolutionIndex: 149
    SolutionNameMin: Cijk_Ailk_Bljk_BBS_BH_MT256x224x64_MI16x16x16x1_SN_
    SolutionIndex: 150
    SolutionNameMin: Cijk_Ailk_Bljk_BBS_BH_MT256x256x32_MI16x16x16x1_SN_
    SolutionIndex: 151
    SolutionNameMin: Cijk_Ailk_Bljk_BBS_BH_MT16x16x16_MI16x16x16x1_SN_GLVWA2_GLVWB2_GRVW2_LPB16_MIAV1_NEPBS4_SU0_SUS0_TLDS0_UMLDSB0_WGM24
    SolutionIndex: 152
    SolutionNameMin: Cijk_Ailk_Bljk_BBS_BH_MT16x16x16_MI16x16x16x1_SN_GLVWA4_GLVWB4_GRVW4_LPB4_MIAV0_NEPBS4_SU32_SUS256_TLDS1_UMLDSB1_WGM24
    SolutionIndex: 153
    SolutionNameMin: Cijk_Ailk_Bljk_BBS_BH_MT16x16x32_MI16x16x16x1_SN_GLVWA4_GLVWB4_GRVW4_LPB16_MIAV0_NEPBS0_SU0_SUS0_TLDS0_UMLDSB0_WGM1
    SolutionIndex: 154
    SolutionNameMin: Cijk_Ailk_Bljk_BBS_BH_MT16x16x64_MI16x16x16x1_SN_GLVWA4_GLVWB4_GRVW8_LPB16_MIAV1_NEPBS0_SU0_SUS0_TLDS0_UMLDSB0_WG16_4_4_WGM1
    SolutionIndex: 155
    SolutionNameMin: Cijk_Ailk_Bljk_BBS_BH_MT16x16x16_MI16x16x16x1_SN_GLVWA2_GLVWB2_GRVW2_LPB4_MIAV0_NEPBS0_SU32_SUS256_TLDS1_UMLDSB1_WGM6
    SolutionIndex: 156
    SolutionNameMin: Cijk_Ailk_Bljk_BBS_BH_MT16x16x16_MI16x16x16x1_SN_GLVWA2_GLVWB2_GRVW2_LPB4_MIAV1_NEPBS0_SU32_SUS256_TLDS1_UMLDSB1_WGM1
    SolutionIndex: 157
    SolutionNameMin: Cijk_Ailk_Bljk_BBS_BH_MT16x16x64_MI16x16x16x1_SN_GLVWA4_GLVWB4_GRVW4_LPB16_MIAV0_NEPBS4_SU0_SUS0_TLDS0_UMLDSB0_WG16_4_4_WGM1
    SolutionIndex: 158
    SolutionNameMin: Cijk_Ailk_Bljk_BBS_BH_MT16x16x16_MI16x16x16x1_SN_GLVWA2_GLVWB4_LPB4_MIAV1_NEPBS0_SU0_SUS0_TLDS1_UMLDSB1_WGM12
    SolutionIndex: 159
    SolutionNameMin: Cijk_Ailk_Bljk_BBS_BH_MT16x16x16_MI16x16x16x1_SN_GLVWA2_GLVWB2_GRVW2_LPB16_MIAV1_NEPBS4_SU0_SUS0_TLDS0_UMLDSB0_WGM24
    SolutionIndex: 160
    SolutionNameMin: Cijk_Ailk_Bljk_BBS_BH_MT16x16x64_MI16x16x16x1_SN_GLVWA4_GLVWB4_GRVW8_LPB16_MIAV1_NEPBS4_SU0_SUS0_TLDS0_UMLDSB0_WG16_4_4_WGM1
    SolutionIndex: 161
    SolutionNameMin: Cijk_Ailk_Bljk_BBS_BH_MT128x224x64_MI16x16x16x1_SN_NTC4_NTD4_SSO2
    SolutionIndex: 162
    SolutionNameMin: Cijk_Ailk_Bljk_BBS_BH_MT256x224x64_MI16x16x16x1_SN_LBSPPA2048_LPA16_LPB4_NTC4_NTD4_NEPBS0_SU4_SUS128_SSO4
    SolutionIndex: 163
    SolutionNameMin: Cijk_Ailk_Bljk_BBS_BH_MT64x192x64_MI16x16x16x1_SN_
- - - [6144, 4864, 1, 4096]
    - [4, 69.609]
  - - [6144, 4864, 1, 8192]
    - [2, 74.772]
  - - [6144, 4864, 1, 16384]
    - [5, 52.789]
  - - [6144, 4864, 1, 4352]
    - [6, 71.11]
  - - [6144, 4864, 1, 8448]
    - [2, 73.879]
  - - [6144, 4864, 1, 16640]
    - [3, 52.276]
  - - [4864, 3072, 1, 4096]
    - [13, 84.39]
  - - [4864, 3072, 1, 8192]
    - [15, 89.093]
  - - [4864, 3072, 1, 16384]
    - [1, 76.33]
  - - [4864, 3072, 1, 4352]
    - [7, 74.355]
  - - [4864, 3072, 1, 8448]
    - [0, 79.514]
  - - [4864, 3072, 1, 16640]
    - [8, 73.647]
  - - [4864, 4096, 1, 8192]
    - [33, 83.721]
  - - [9728, 8192, 1, 8192]
    - [9, 62.084]
  - - [9728, 8192, 1, 65536]
    - [10, 63.959]
  - - [2048, 2048, 1, 65536]
    - [28, 74.09]
  - - [2048, 8192, 1, 1024]
    - [21, 67.471]
  - - [2048, 8192, 1, 8192]
    - [22, 78.538]
  - - [2048, 8192, 1, 65536]
    - [23, 89.789]
  - - [8192, 2048, 1, 1024]
    - [24, 62.4]
  - - [8192, 2048, 1, 8192]
    - [25, 68.541]
  - - [8192, 2048, 1, 65536]
    - [29, 76.172]
  - - [8192, 8192, 1, 1024]
    - [26, 79.127]
  - - [8192, 8192, 1, 8192]
    - [30, 81.414]
  - - [8192, 8192, 1, 65536]
    - [31, 81.637]
  - - [9728, 8192, 1, 16384]
    - [11, 90.44]
  - - [2048, 2048, 1, 8192]
    - [20, 61.307]
  - - [4864, 3072, 1, 2048]
    - [12, 75.36]
  - - [4864, 3072, 1, 6144]
    - [14, 87.421]
  - - [3072, 4864, 1, 2048]
    - [16, 75.635]
  - - [3072, 4864, 1, 4096]
    - [17, 84.078]
  - - [3072, 4864, 1, 6144]
    - [18, 87.411]
  - - [3072, 4864, 1, 8192]
    - [19, 89.066]
  - - [2048, 2048, 1, 1024]
    - [27, 41.15]
  - - [4096, 4096, 1, 8192]
    - [32, 76.867]
  - - [9728, 8192, 1, 16416]
    - [34, 88.752]
  - - [9728, 12288, 1, 4096]
    - [35, 80.635]
  - - [9728, 12288, 1, 8192]
    - [36, 85.656]
  - - [9728, 12288, 1, 8256]
    - [37, 87.673]
  - - [9728, 12288, 1, 16416]
    - [36, 88.067]
  - - [14592, 12288, 1, 8192]
    - [38, 84.803]
  - - [14592, 12288, 1, 8256]
    - [39, 85.018]
  - - [14592, 12288, 1, 16416]
    - [40, 87.403]
  - - [12288, 9728, 1, 16416]
    - [37, 88.868]
  - - [1216, 1024, 1, 1024]
    - [41, 13.7]
  - - [1216, 1024, 1, 2048]
    - [42, 15.4]
  - - [1216, 4096, 1, 4096]
    - [43, 21.9]
  - - [1024, 2432, 1, 2048]
    - [44, 18.2]
  - - [2432, 512, 1, 1024]
    - [45, 14.6]
  - - [4864, 256, 1, 1024]
    - [46, 14.1]
  - - [4864, 256, 1, 2048]
    - [47, 16.8]
  - - [512, 608, 1, 512]
    - [48, 3.4]
  - - [512, 608, 1, 1024]
    - [49, 5.2]
  - - [608, 512, 1, 512]
    - [50, 3.9]
  - - [608, 512, 1, 1024]
    - [51, 5.8]
  - - [1216, 256, 1, 512]
    - [52, 4.0]
  - - [2432, 2048, 1, 1024]
    - [53, 40.381]
  - - [2432, 2048, 1, 2048]
    - [54, 45.426]
  - - [2048, 2432, 1, 1024]
    - [55, 42.143]
  - - [2048, 2432, 1, 2048]
    - [56, 45.492]
  - - [9728, 128, 1, 1024]
    - [57, 19.9]
  - - [9728, 128, 1, 2048]
    - [58, 22.6]
  - - [16, 16, 1, 1024]
    - [59, 0.007]
  - - [16, 16, 1, 8192]
    - [60, 0.027]
  - - [16, 16, 1, 65536]
    - [61, 0.268]
  - - [16, 2048, 1, 1024]
    - [62, 0.794]
  - - [16, 2048, 1, 8192]
    - [63, 3.182]
  - - [16, 2048, 1, 65536]
    - [64, 7.481]
  - - [16, 8192, 1, 1024]
    - [65, 2.379]
  - - [16, 8192, 1, 8192]
    - [66, 5.978]
  - - [16, 8192, 1, 65536]
    - [67, 8.412]
  - - [2048, 16, 1, 1024]
    - [68, 0.574]
  - - [2048, 16, 1, 65536]
    - [69, 8.205]
  - - [8192, 16, 1, 8192]
    - [70, 7.498]
  - - [8192, 16, 1, 65536]
    - [71, 8.819]
  - - [9728, 8192, 1, 1024]
    - [72, 61.074]
  - - [4864, 64, 1, 512]
    - [73, 3.8]
  - - [2432, 128, 1, 512]
    - [74, 4.2]
  - - [2432, 128, 1, 1024]
    - [75, 6.2]
  - - [9728, 64, 1, 1024]
    - [76, 10.2]
  - - [64, 64, 1, 512]
    - [77, 0.1]
  - - [128, 128, 1, 512]
    - [78, 0.2]
  - - [256, 256, 1, 512]
    - [79, 0.9]
  - - [256, 256, 1, 1024]
    - [80, 1.7]
  - - [192, 24320, 1, 192]
    - [81, 10.899]
  - - [192, 99712, 1, 192]
    - [82, 16.061]
  - - [192, 102144, 1, 192]
    - [83, 15.901]
  - - [192, 99712, 1, 768]
    - [84, 35.516]
  - - [192, 102144, 1, 768]
    - [85, 34.075]
  - - [256, 398848, 1, 64]
    - [86, 8.544]
  - - [256, 408576, 1, 64]
    - [87, 8.519]
  - - [768, 97280, 1, 192]
    - [88, 18.916]
  - - [768, 102144, 1, 192]
    - [89, 19.007]
  - - [2048, 16, 1, 8192]
    - [90, 3.05]
  - - [8192, 16, 1, 1024]
    - [91, 2.17]
  - - [2048, 16, 1, 16384]
    - [92, 4.546]
  - - [4096, 16, 1, 16384]
    - [93, 6.124]
  - - [2048, 32, 1, 16384]
    - [94, 8.172]
  - - [4096, 32, 1, 16384]
    - [95, 11.609]
  - - [16384, 16, 1, 2048]
    - [96, 5.193]
  - - [16384, 16, 1, 4096]
    - [97, 7.555]
  - - [16384, 32, 1, 2048]
    - [98, 10.349]
  - - [16384, 32, 1, 4096]
    - [99, 13.737]
  - - [8192, 6144, 1, 4096]
    - [100, 75.6]
  - - [96, 401408, 1, 96]
    - [101, 12.82]
  - - [96, 401408, 1, 288]
    - [102, 22.717]
  - - [64, 1024, 1, 64]
    - [103, 0.148]
  - - [64, 2048, 1, 64]
    - [104, 0.292]
  - - [768, 16, 1, 512]
    - [105, 0.213]
  - - [64, 1024, 1, 32768]
    - [106, 13.204]
  - - [64, 4096, 1, 64]
    - [107, 0.574]
  - - [64, 8192, 1, 64]
    - [108, 1.062]
  - - [96, 401408, 1, 384]
    - [109, 27.561]
  - - [256, 1024, 1, 256]
    - [110, 2.302]
  - - [768, 32, 1, 512]
    - [111, 0.395]
  - - [768, 128, 1, 512]
    - [112, 1.529]
  - - [768, 512, 1, 512]
    - [113, 4.853]
  - - [32, 512, 1, 4096]
    - [114, 0.886]
  - - [32, 1024, 1, 4096]
    - [115, 1.646]
  - - [64, 2048, 1, 32768]
    - [116, 23.064]
  - - [64, 4096, 1, 32768]
    - [117, 28.764]
  - - [64, 8192, 1, 32768]
    - [118, 26.724]
  - - [32, 32, 1, 512]
    - [77, 0.017]
  - - [32, 512, 1, 2048]
    - [80, 0.706]
  - - [128, 50176, 1, 128]
    - [81, 7.795]
  - - [128, 50176, 1, 384]
    - [81, 19.015]
  - - [128, 50176, 1, 512]
    - [81, 20.779]
  - - [1024, 256, 1, 2048]
    - [119, 6.415]
  - - [1024, 512, 1, 1024]
    - [120, 8.7]
  - - [1024, 512, 1, 2048]
    - [121, 10.301]
  - - [1024, 4096, 1, 4096]
    - [122, 36.976]
  - - [1024, 8192, 1, 4096]
    - [123, 47.739]
  - - [1024, 8192, 1, 32768]
    - [124, 56.515]
  - - [1024, 16, 1, 1]
    - [125, 0.001]
  - - [1024, 16, 1, 128]
    - [126, 0.077]
  - - [1024, 16, 1, 1024]
    - [127, 0.447]
  - - [1024, 32, 1, 1]
    - [128, 0.001]
  - - [1024, 32, 1, 1024]
    - [129, 0.837]
  - - [1024, 64, 1, 1]
    - [130, 0.002]
  - - [1024, 64, 1, 1024]
    - [131, 1.452]
  - - [1024, 128, 1, 1024]
    - [132, 3.54]
  - - [1024, 256, 1, 1024]
    - [133, 5.756]
  - - [1024, 2048, 1, 4096]
    - [134, 34.51]
  - - [1024, 2048, 1, 32768]
    - [135, 40.795]
  - - [1024, 4096, 1, 32768]
    - [136, 41.01]
  - - [1024, 2048, 1, 1024]
    - [137, 21.189]
  - - [1024, 4096, 1, 1024]
    - [55, 32.413]
  - - [1024, 8192, 1, 1024]
    - [138, 27.036]
  - - [1024, 16384, 1, 1024]
    - [138, 43.325]
  - - [1024, 16384, 1, 4096]
    - [138, 65.698]
  - - [1024, 16384, 1, 32768]
    - [36, 70.925]
  - - [4096, 32, 1, 4096]
    - [139, 3.195]
  - - [4096, 512, 1, 4096]
    - [140, 36.435]
  - - [4096, 256, 1, 1024]
    - [141, 14.156]
  - - [4096, 16384, 1, 1024]
    - [142, 50.385]
  - - [4096, 2048, 1, 1024]
    - [143, 36.613]
  - - [4096, 4096, 1, 1024]
    - [143, 52.827]
  - - [4096, 8192, 1, 1024]
    - [138, 43.757]
  - - [98304, 98304, 1, 98304]
    - [144, 91.294]
  - - [19456, 256, 1, 512]
    - [145, 28.5]
  - - [19456, 256, 1, 1024]
    - [146, 37.8]
  - - [19456, 512, 1, 512]
    - [147, 34.0]
  - - [19456, 512, 1, 1024]
    - [148, 48.8]
  - - [70000, 70000, 1, 70000]
    - [149, 81.612]
  - - [50000, 50000, 1, 50000]
    - [150, 87.854]
  - - [2, 32, 1, 1]
    - [151, 0.001]
  - - [64, 1, 1, 16]
    - [152, 0.001]
  - - [64, 1, 1, 32]
    - [153, 0.001]
  - - [64, 1, 1, 64]
    - [154, 0.001]
  - - [2, 128, 1, 1]
    - [155, 0.001]
  - - [2, 64, 1, 1]
    - [156, 0.001]
  - - [32, 1, 1, 64]
    - [157, 0.001]
  - - [784, 1, 1, 16]
    - [158, 0.001]
  - - [2, 16, 1, 1]
    - [159, 0.001]
  - - [16, 1, 1, 64]
    - [160, 0.001]
  - - [224, 32768, 1, 4000]
    - [161, 39.8]
  - - [1000, 32768, 1, 4000]
    - [162, 62.36]
  - - [1000, 1024, 1, 100]
    - [163, 0.96]
  - - [1000, 1024, 1, 4000]
    - [134, 12.74]
- null
- null
- DeviceEfficiency
