library/src/blas3/Tensile/Logic/asm_full/aquavanjaram942/aquavanjaram942_Cijk_Alik_Bjlk_HHS_BH.yaml
- {MinimumRequiredVersion: 4.36.0}
- aquavanjaram942
- {Architecture: gfx942, IsAPU: 0}
- [Device 74a1]
    SolutionIndex: 0
    SolutionNameMin: Cijk_Alik_Bjlk_HHS_BH_MT128x256x32_MI16x16x16x1_SN_1LDSB0_DTVB1_ELFLRn20_GLVWA2_GLVWB4_GRPM1_LBSPPA256_LPA4_PGR2_PLR1_SVW4_TT8_64_VW4_WSGRB0_WG16_16_1_WGM1
    SolutionIndex: 1
    SolutionNameMin: Cijk_Alik_Bjlk_HHS_BH_MT128x256x32_MI16x16x16x1_SN_1LDSB0_DTVB1_ELFLRn20_GLVWA2_GLVWB4_GRPM1_LBSPPA256_LPA4_PGR2_PLR1_SVW4_TT8_64_VW4_WSGRB0_WG16_16_1_WGMn30
    SolutionIndex: 2
    SolutionNameMin: Cijk_Alik_Bjlk_HHS_BH_MT128x256x32_MI16x16x16x1_SN_1LDSB0_DTVB1_ELFLRn20_GLVWA2_GLVWB4_GRPM1_LBSPPA128_LPA4_PGR2_PLR3_SVW2_TT8_64_VW2_WSGRB0_WG16_16_1_WGMn30
    SolutionIndex: 3
    SolutionNameMin: Cijk_Alik_Bjlk_HHS_BH_MT128x256x32_MI16x16x16x1_SN_1LDSB0_DTVB1_ELFLRn20_GLVWA2_GLVWB4_GRPM1_LBSPPA256_LPA4_PGR2_PLR3_SVW4_TT8_64_VW4_WSGRB0_WG16_16_1_WGMn30
    SolutionIndex: 4
    SolutionNameMin: Cijk_Alik_Bjlk_HHS_BH_MT128x256x32_MI16x16x16x1_SN_1LDSB0_DTVB1_ELFLRn20_GLVWA2_GLVWB4_GRPM1_LBSPPA256_LPA4_PGR2_PLR3_SVW4_TT8_64_VW4_WSGRB0_WG16_16_1_WGMn12
    SolutionIndex: 5
    SolutionNameMin: Cijk_Alik_Bjlk_HHS_BH_MT256x256x64_MI16x16x16x1_SN_1LDSB1_DTVB1_ELFLRn20_GLVWA2_GLVWB4_GRPM0p26_LBSPPA256_LPA4_PGR1_PLR1_SVW2_TT16_64_VW2_WSGRB0_WG16_16_1_WGM30
    SolutionIndex: 6
    SolutionNameMin: Cijk_Alik_Bjlk_HHS_BH_MT256x256x64_MI16x16x16x1_SN_1LDSB1_DTVB1_ELFLRn20_GLVWA2_GLVWB4_GRPM0p24_LBSPPA256_LPA4_PGR1_PLR1_SVW2_TT16_64_VW2_WSGRB0_WG16_16_1_WGM30
    SolutionIndex: 7
    SolutionNameMin: Cijk_Alik_Bjlk_HHS_BH_MT256x256x32_MI16x16x16x1_SN_1LDSB1_DTVB1_ELFLRn20_GLVWA2_GLVWB4_GRPM1_LBSPPA128_LPA4_PGR2_PLR3_SVW2_TT16_64_VW2_WSGRB0_WG16_16_1_WGM30
    SolutionIndex: 8
    SolutionNameMin: Cijk_Alik_Bjlk_HHS_BH_MT256x256x64_MI16x16x16x1_SN_1LDSB1_DTVB1_ELFLRn20_GLVWA2_GLVWB4_GRPM0p26_LBSPPA512_LPA4_PGR1_PLR1_SVW4_TT16_64_VW4_WSGRB0_WG16_16_1_WGM30
    SolutionIndex: 9
    SolutionNameMin: Cijk_Alik_Bjlk_HHS_BH_MT256x256x64_MI16x16x16x1_SN_1LDSB1_DTVB1_ELFLRn20_GLVWA2_GLVWB4_GRPM0p24_LBSPPA512_LPA4_PGR1_PLR1_SVW4_TT16_64_VW4_WSGRB0_WG16_16_1_WGM12
    SolutionIndex: 10
    SolutionNameMin: Cijk_Alik_Bjlk_HHS_BH_MT256x256x64_MI16x16x16x1_SN_1LDSB1_DTVB1_ELFLRn20_GLVWA2_GLVWB4_GRPM0p26_LBSPPA512_LPA4_PGR1_PLR1_SVW4_TT16_64_VW4_WSGRB0_WG16_16_1_WGM1
    SolutionIndex: 11
    SolutionNameMin: Cijk_Alik_Bjlk_HHS_BH_MT128x256x32_MI16x16x16x1_SN_1LDSB0_DTVB1_ELFLRn20_GLVWA2_GLVWB4_GRPM1_LBSPPA256_LPA4_PGR2_PLR3_SVW4_TT8_64_VW4_WSGRB0_WG16_16_1_WGM12
    SolutionIndex: 12
    SolutionNameMin: Cijk_Alik_Bjlk_HHS_BH_MT256x256x64_MI16x16x16x1_SN_1LDSB1_DTVB1_ELFLRn20_GLVWA2_GLVWB4_GRPM0p30_LBSPPA256_LPA4_PGR1_PLR1_SVW2_TT16_64_VW2_WSGRB0_WG16_16_1_WGM30
    SolutionIndex: 13
    SolutionNameMin: Cijk_Alik_Bjlk_HHS_BH_MT128x256x32_MI16x16x16x1_SN_1LDSB1_DTVB1_ELFLRn20_GLVWA2_GLVWB4_GRPM1_LBSPPA256_LPA4_PGR2_PLR1_SVW4_TT8_64_VW4_WSGRB0_WG16_16_1_WGMn30
    SolutionIndex: 14
    SolutionNameMin: Cijk_Alik_Bjlk_HHS_BH_MT256x256x64_MI16x16x16x1_SN_1LDSB1_DTVB1_ELFLRn20_GLVWA2_GLVWB4_GRPM0p24_LBSPPA256_LPA4_PGR1_PLR1_SVW2_TT16_64_VW2_WSGRB0_WG16_16_1_WGMn30
    SolutionIndex: 15
    SolutionNameMin: Cijk_Alik_Bjlk_HHS_BH_MT256x256x64_MI16x16x16x1_SN_1LDSB1_DTVB1_ELFLRn20_GLVWA2_GLVWB4_GRPM0p30_LBSPPA512_LPA4_PGR1_PLR1_SVW4_TT16_64_VW4_WSGRB0_WG16_16_1_WGMn30
    SolutionIndex: 16
    SolutionNameMin: Cijk_Alik_Bjlk_HHS_BH_MT256x256x64_MI16x16x16x1_SN_1LDSB1_DTVB1_ELFLRn20_GLVWA2_GLVWB4_GRPM0p26_LBSPPA256_LPA4_PGR1_PLR1_SVW2_TT16_64_VW2_WSGRB0_WG16_16_1_WGM12
    SolutionIndex: 17
    SolutionNameMin: Cijk_Alik_Bjlk_HHS_BH_MT256x256x64_MI16x16x16x1_SN_1LDSB1_DTVB1_ELFLRn20_GLVWA2_GLVWB4_GRPM0p30_LBSPPA256_LPA4_PGR1_PLR1_SVW2_TT16_64_VW2_WSGRB0_WG16_16_1_WGM12
    SolutionIndex: 18
    SolutionNameMin: Cijk_Alik_Bjlk_HHS_BH_MT256x256x64_MI16x16x16x1_SN_1LDSB1_DTVB1_ELFLRn20_GLVWA2_GLVWB4_GRPM0p26_LBSPPA512_LPA4_PGR1_PLR1_SVW4_TT16_64_VW4_WSGRB0_WG16_16_1_WGM12
    SolutionIndex: 19
    SolutionNameMin: Cijk_Alik_Bjlk_HHS_BH_MT256x256x64_MI16x16x16x1_SN_1LDSB1_DTVB1_ELFLRn20_GLVWA2_GLVWB4_GRPM0p24_LBSPPA512_LPA4_PGR1_PLR1_SVW4_TT16_64_VW4_WSGRB0_WG16_16_1_WGM30
    SolutionIndex: 20
    SolutionNameMin: Cijk_Alik_Bjlk_HHS_BH_MT128x256x64_MI16x16x16x1_SN_AMAS3_ELFLRn20_EMLL0_GLVWB2_GRPM1_LBSPPA256_LWPMn1_NTC0_NTD0_NLCB2_PGR2_SS0_SVW4_VW2_VWB2
    SolutionIndex: 21
    SolutionNameMin: Cijk_Alik_Bjlk_HHS_BH_MT256x256x32_MI16x16x16x1_SN_
    SolutionIndex: 22
    SolutionNameMin: Cijk_Alik_Bjlk_HHS_BH_MT256x256x32_MI16x16x16x1_SN_
#  - - [6144, 4864, 1, 4096]
#    - [0, 80.764]
#  - - [6144, 4864, 1, 8192]
#    - [1, 84.621]
#  - - [6144, 4864, 1, 16384]
#    - [2, 84.832]
#  - - [6144, 4864, 1, 4352]
#    - [0, 81.216]
#  - - [6144, 4864, 1, 8448]
#    - [3, 85.104]
#  - - [6144, 4864, 1, 16640]
#    - [4, 85.339]
#  - - [4864, 3072, 1, 4096]
#    - [5, 55.829]
#  - - [4864, 3072, 1, 8192]
#    - [6, 60.807]
#  - - [4864, 3072, 1, 16384]
#    - [5, 66.47]
#  - - [4864, 3072, 1, 4352]
#    - [7, 46.501]
#  - - [4864, 3072, 1, 8448]
#    - [8, 61.164]
#  - - [4864, 3072, 1, 16640]
#    - [9, 65.505]
#  - - [8192, 8192, 1, 8192]
#    - [10, 72.543]
#  - - [9728, 8192, 1, 8192]
#    - [5, 85.254]
#  - - [4864, 3072, 1, 2048]
#    - [11, 48.195]
#  - - [4864, 3072, 1, 6144]
#    - [12, 54.057]
#  - - [3072, 4864, 1, 2048]
#    - [13, 53.438]
#  - - [3072, 4864, 1, 4096]
#    - [14, 58.279]
#  - - [3072, 4864, 1, 6144]
#    - [15, 56.418]
#  - - [3072, 4864, 1, 8192]
#    - [16, 61.367]
  - - [4864, 4096, 1, 4096]
    - [16, 71.106]
  - - [4864, 4096, 1, 8192]
    - [17, 79.368]
  - - [4864, 4096, 1, 8256]
    - [18, 81.493]
  - - [9728, 8192, 1, 16416]
    - [5, 87.718]
  - - [9728, 12288, 1, 4096]
    - [8, 77.812]
  - - [9728, 12288, 1, 8192]
    - [8, 86.008]
  - - [9728, 12288, 1, 8256]
    - [8, 87.435]
  - - [9728, 12288, 1, 16416]
    - [18, 86.872]
  - - [14592, 12288, 1, 8192]
    - [6, 86.233]
  - - [14592, 12288, 1, 8256]
    - [19, 86.147]
  - - [14592, 12288, 1, 16416]
    - [5, 88.061]
  - - [12288, 9728, 1, 16416]
    - [10, 88.251]
  - - [2048, 2048, 1, 65536]
    - [20, 70.3]
  - - [98304, 98304, 1, 98304]
    - [21, 76.458]
  - - [70000, 70000, 1, 70000]
    - [22, 87.954]
  - - [50000, 50000, 1, 50000]
    - [22, 71.808]
- null
- null
- DeviceEfficiency
