library/src/blas3/Tensile/Logic/asm_full/aquavanjaram942/aquavanjaram942_Cijk_Ailk_Bjlk_SB_MX.yaml
- {MinimumRequiredVersion: 4.40.0}
- aquavanjaram942
- gfx942
- [Device 0049, Device 0050]
    SolutionIndex: 0
    SolutionNameMin: Cijk_Ailk_Bjlk_SB_MX_MT256x256x32_MI16x16x8x1_SN_1LDSB1_AMAS3_GLS0_NLCA1_PLR5_SS1_SPO0_SVW2_TT8_128_VW2_WG32_8_1_WGM18
    SolutionIndex: 1
    SolutionNameMin: Cijk_Ailk_Bjlk_SB_MX_MT256x256x32_MI16x16x8x1_SN_1LDSB1_AMAS0_GLS0_NLCA1_PLR5_SS1_SPO0_SVW1_TT8_128_VW1_WG32_8_1_WGM24
    SolutionIndex: 2
    SolutionNameMin: Cijk_Ailk_Bjlk_SB_MX_MT256x256x32_MI16x16x8x1_SN_1LDSB1_AMAS3_GLS0_NLCA1_PLR5_SS1_SPO0_SVW2_TT8_128_VW2_WG32_8_1_WGM24
    SolutionIndex: 3
    SolutionNameMin: Cijk_Ailk_Bjlk_SB_MX_MT256x256x32_MI16x16x8x1_SN_1LDSB1_AMAS3_GLS0_NLCA1_PLR5_SS1_SPO1_SVW2_TT8_128_VW2_WG32_8_1_WGM24
    SolutionIndex: 4
    SolutionNameMin: Cijk_Ailk_Bjlk_SB_MX_MT256x256x32_MI16x16x8x1_SN_1LDSB1_AMAS3_GLS1_NLCA1_PLR5_SS1_SPO0_SVW2_TT8_128_VW2_WG32_8_1_WGM18
    SolutionIndex: 5
    SolutionNameMin: Cijk_Ailk_Bjlk_SB_MX_MT256x256x32_MI16x16x8x1_SN_1LDSB1_AMAS3_GLS1_NLCA1_PLR5_SS1_SPO0_SVW2_TT8_128_VW2_WG32_8_1_WGM24
    SolutionIndex: 6
    SolutionNameMin: Cijk_Ailk_Bjlk_SB_MX_MT256x256x32_MI16x16x8x1_SN_1LDSB1_AMAS3_GLS1_NLCA1_PLR5_SS1_SPO1_SVW2_TT8_128_VW2_WG32_8_1_WGM18
    SolutionIndex: 7
    SolutionNameMin: Cijk_Ailk_Bjlk_SB_MX_MT256x256x32_MI16x16x8x1_SN_1LDSB1_AMAS0_GLS1_NLCA1_PLR5_SS1_SPO1_SVW1_TT8_128_VW1_WG32_8_1_WGM24
    SolutionIndex: 8
    SolutionNameMin: Cijk_Ailk_Bjlk_SB_MX_MT128x128x16_MI32x32x4x1_SN_1LDSB0_AMAS0_GLS1_MIAV1_PLR5_SS1_SPO1_SVW1_TT2_64_VW1_WG64_4_1_WGM32
- - - [6144, 9728, 1, 8192]
    - [2, 61.147]
  - - [6144, 9728, 1, 8224]
    - [0, 60.753]
  - - [6144, 9728, 1, 8256]
    - [5, 60.443]
  - - [9216, 9728, 1, 8192]
    - [3, 60.21]
  - - [9216, 9728, 1, 8224]
    - [3, 60.432]
  - - [9216, 9728, 1, 8256]
    - [7, 60.41]
  - - [9216, 9728, 1, 16384]
    - [2, 61.224]
  - - [9216, 9728, 1, 16448]
    - [5, 61.158]
  - - [9216, 9728, 1, 16512]
    - [3, 61.132]
  - - [7296, 9216, 1, 4096]
    - [1, 55.615]
  - - [7296, 9216, 1, 8192]
    - [2, 56.637]
  - - [7296, 9216, 1, 8224]
    - [5, 56.519]
  - - [7296, 9216, 1, 8256]
    - [2, 56.799]
  - - [14592, 9216, 1, 4096]
    - [4, 59.316]
  - - [14592, 9216, 1, 8192]
    - [5, 60.449]
  - - [14592, 9216, 1, 8224]
    - [4, 60.522]
  - - [14592, 9216, 1, 8256]
    - [6, 60.364]
  - - [256, 256, 1, 256]
    - [8, 1.481]
- null
- null
- DeviceEfficiency
