library/src/blas3/Tensile/Logic/asm_full/aquavanjaram942/aquavanjaram942_Cijk_Ailk_Bljk_HSS_BH.yaml
- {MinimumRequiredVersion: 4.36.0}
- aquavanjaram942
- gfx942
- [Device 0049, Device 0050]
    SolutionIndex: 0
    SolutionNameMin: Cijk_Ailk_Bljk_HSS_BH_MT256x128x16_MI32x32x8x1_SN_1LDSB1_AMAS0_FL0_MIAV0_NTA1_NTB0_NTC2_NTD1_NLCA2_ONLL1_SVW1_TT2_128_VW1_WSGRA0_WSGRB0_WG128_2_1_WGM6
    SolutionIndex: 1
    SolutionNameMin: Cijk_Ailk_Bljk_HSS_BH_MT256x128x16_MI32x32x8x1_SN_1LDSB1_AMAS3_FL0_MIAV0_NTA1_NTB0_NTC2_NTD2_NLCA2_ONLL2_SVW2_TT2_128_VW2_WSGRA1_WSGRB1_WG128_2_1_WGM6
    SolutionIndex: 2
    SolutionNameMin: Cijk_Ailk_Bljk_HSS_BH_MT256x128x16_MI32x32x8x1_SN_1LDSB1_AMAS3_FL0_MIAV0_NTA0_NTB1_NTC2_NTD3_NLCA2_ONLL2_SVW2_TT2_128_VW2_WSGRA0_WSGRB0_WG128_2_1_WGM6
    SolutionIndex: 3
    SolutionNameMin: Cijk_Ailk_Bljk_HSS_BH_MT256x128x16_MI32x32x8x1_SN_1LDSB1_AMAS0_FL0_MIAV0_NTA1_NTB1_NTC2_NTD2_NLCA2_ONLL0_SVW1_TT2_128_VW1_WSGRA1_WSGRB0_WG128_2_1_WGM6
    SolutionIndex: 4
    SolutionNameMin: Cijk_Ailk_Bljk_HSS_BH_MT256x128x16_MI32x32x8x1_SN_1LDSB1_AMAS3_FL0_MIAV0_NTA1_NTB1_NTC3_NTD1_NLCA2_ONLL1_SVW2_TT4_64_VW2_WSGRA1_WSGRB1_WG64_4_1_WGM6
    SolutionIndex: 5
    SolutionNameMin: Cijk_Ailk_Bljk_HSS_BH_MT256x128x16_MI32x32x8x1_SN_1LDSB1_AMAS0_FL0_MIAV0_NTA1_NTB1_NTC3_NTD2_NLCA2_ONLL1_SVW1_TT2_128_VW1_WSGRA0_WSGRB1_WG128_2_1_WGM6
    SolutionIndex: 6
    SolutionNameMin: Cijk_Ailk_Bljk_HSS_BH_MT256x128x16_MI32x32x8x1_SN_1LDSB1_AMAS3_FL0_MIAV1_NTA0_NTB0_NTC2_NTD1_NLCA2_ONLL1_SVW2_TT2_128_VW2_WSGRA0_WSGRB0_WG128_2_1_WGM6
    SolutionIndex: 7
    SolutionNameMin: Cijk_Ailk_Bljk_HSS_BH_MT256x128x16_MI32x32x8x1_SN_1LDSB1_AMAS3_FL0_MIAV1_NTA0_NTB0_NTC3_NTD1_NLCA2_ONLL0_SVW2_TT2_128_VW2_WSGRA0_WSGRB0_WG128_2_1_WGM6
    SolutionIndex: 8
    SolutionNameMin: Cijk_Ailk_Bljk_HSS_BH_MT256x128x16_MI32x32x8x1_SN_1LDSB0_AMAS0_FL0_MIAV1_NTA0_NTB1_NTC3_NTD3_NLCA2_ONLL2_SVW1_TT2_128_VW1_WSGRA0_WSGRB0_WG128_2_1_WGM6
    SolutionIndex: 9
    SolutionNameMin: Cijk_Ailk_Bljk_HSS_BH_MT256x128x16_MI32x32x8x1_SN_1LDSB1_AMAS3_FL0_MIAV1_NTA1_NTB1_NTC3_NTD3_NLCA2_ONLL1_SVW2_TT2_128_VW2_WSGRA0_WSGRB0_WG128_2_1_WGM6
    SolutionIndex: 10
    SolutionNameMin: Cijk_Ailk_Bljk_HSS_BH_MT256x256x32_MI32x32x8x1_SN_1LDSB1_GLS0_LBSPPA0_LPA0_LPB8_LRVW8_MIAV0_NEPBS8_NLCA2_SU0_SUS0_SSO6_TT4_128_WG64_4_1_WGM6
    SolutionIndex: 11
    SolutionNameMin: Cijk_Ailk_Bljk_HSS_BH_MT256x256x32_MI32x32x8x1_SN_1LDSB1_GLS1_LBSPPA0_LPA0_LPB8_LRVW8_MIAV0_NEPBS8_NLCA2_SU0_SUS0_SSO8_TT4_128_WG64_4_1_WGM6
    SolutionIndex: 12
    SolutionNameMin: Cijk_Ailk_Bljk_HSS_BH_MT256x256x32_MI32x32x8x1_SN_1LDSB1_GLS0_LBSPPA0_LPA0_LPB8_LRVW8_MIAV0_NEPBS8_NLCA2_SU0_SUS0_SSO6_TT4_128_WG64_4_1_WGM18
    SolutionIndex: 13
    SolutionNameMin: Cijk_Ailk_Bljk_HSS_BH_MT256x256x32_MI32x32x8x1_SN_1LDSB1_GLS0_LBSPPA0_LPA0_LPB8_LRVW8_MIAV0_NEPBS8_NLCA2_SU0_SUS0_SSO8_TT4_128_WG64_4_1_WGM30
    SolutionIndex: 14
    SolutionNameMin: Cijk_Ailk_Bljk_HSS_BH_MT256x256x32_MI32x32x8x1_SN_1LDSB1_GLS0_LBSPPA0_LPA0_LPB8_LRVW8_MIAV0_NEPBS8_NLCA2_SU0_SUS0_SSO8_TT4_128_WG64_4_1_WGM6
- - - [6144, 4864, 1, 4096]
    - [0, 66.021]
  - - [6144, 4864, 1, 8192]
    - [1, 70.582]
  - - [6144, 4864, 1, 16384]
    - [3, 67.103]
  - - [6144, 4864, 1, 4352]
    - [6, 67.675]
  - - [6144, 4864, 1, 8448]
    - [2, 69.62]
  - - [6144, 4864, 1, 16640]
    - [5, 66.924]
  - - [4864, 3072, 1, 4096]
    - [11, 80.584]
  - - [4864, 3072, 1, 8192]
    - [13, 85.466]
  - - [4864, 3072, 1, 16384]
    - [9, 72.995]
  - - [4864, 3072, 1, 4352]
    - [8, 70.084]
  - - [4864, 3072, 1, 8448]
    - [4, 77.151]
  - - [4864, 3072, 1, 16640]
    - [7, 71.143]
  - - [4864, 3072, 1, 2048]
    - [10, 71.42]
  - - [4864, 3072, 1, 6144]
    - [12, 83.032]
  - - [3072, 4864, 1, 2048]
    - [12, 71.692]
  - - [3072, 4864, 1, 4096]
    - [12, 81.553]
  - - [3072, 4864, 1, 6144]
    - [14, 84.704]
  - - [3072, 4864, 1, 8192]
    - [12, 85.419]
- null
- null
- DeviceEfficiency
