library/src/blas3/Tensile/Logic/asm_full/aquavanjaram942/aquavanjaram942_Cijk_Alik_Bjlk_SB_GB.yaml
- {MinimumRequiredVersion: 4.37.0}
- aquavanjaram942
- gfx942
- [Device 0049, Device 0050]
    SolutionIndex: 0
    SolutionNameMin: Cijk_Alik_Bjlk_SB_GB_MT64x64x16_MI32x32x2x1_SN_AMAS0_DTVB0_GRVW1_LBSPP128_LPA2_LRVW2_NEPBS0_NLCB1_PLR9_SVW1_TT1_32_TLDS1_UMLDSA1_VW1_WG64_4_1_WGM6
    SolutionIndex: 1
    SolutionNameMin: Cijk_Alik_Bjlk_SB_GB_MT64x64x16_MI32x32x2x1_SN_AMAS0_DTVB0_GRVW4_LBSPP128_LPA4_LRVW2_NEPBS0_NLCB1_PLR9_SVW1_TT1_32_TLDS1_UMLDSA1_VW1_WG64_4_1_WGM6
    SolutionIndex: 2
    SolutionNameMin: Cijk_Alik_Bjlk_SB_GB_MT128x128x16_MI32x32x2x1_SN_AMAS0_DTVB0_GRVW2_LBSPP128_LPA2_LRVW1_NEPBS0_NLCB1_PLR9_SVW1_TT4_32_TLDS1_UMLDSA1_VW1_WG32_8_1_WGM6
    SolutionIndex: 3
    SolutionNameMin: Cijk_Alik_Bjlk_SB_GB_MT64x64x32_MI32x32x2x1_SN_AMAS0_DTVB0_GRVW4_LBSPP128_LPA4_LRVW4_NEPBS0_NLCB1_PLR17_SVW1_TT1_32_TLDS1_UMLDSA1_VW1_WG64_4_1_WGM18
    SolutionIndex: 4
    SolutionNameMin: Cijk_Alik_Bjlk_SB_GB_MT64x128x32_MI32x32x2x1_SN_AMAS3_DTVB0_GRVW1_LBSPP128_LPA1_LRVW1_NEPBS0_NLCB1_PLR17_SVW2_TT2_32_TLDS1_UMLDSA1_VW2_WG32_8_1_WGM6
    SolutionIndex: 5
    SolutionNameMin: Cijk_Alik_Bjlk_SB_GB_MT64x64x16_MI32x32x2x1_SN_AMAS0_DTVB0_GRVW4_LBSPP128_LPA4_LRVW1_NEPBS4_NLCB1_PLR9_SVW1_TT1_32_TLDS1_UMLDSA1_VW1_WG64_4_1_WGM12
    SolutionIndex: 6
    SolutionNameMin: Cijk_Alik_Bjlk_SB_GB_MT128x128x16_MI32x32x2x1_SN_AMAS3_DTVB0_GRVW1_LBSPP128_LPA2_LRVW2_NEPBS4_NLCB1_PLR9_SVW2_TT4_32_TLDS1_UMLDSA1_VW2_WG32_8_1_WGM12
    SolutionIndex: 7
    SolutionNameMin: Cijk_Alik_Bjlk_SB_GB_MT128x64x16_MI32x32x2x1_SN_AMAS3_DTVB0_GRVW2_LBSPP0_LPA2_LRVW1_NEPBS0_PLR9_SVW2_TT2_32_TLDS0_UMLDSA0_VW2_WG64_4_1_WGM6
    SolutionIndex: 8
    SolutionNameMin: Cijk_Alik_Bjlk_SB_GB_MT128x128x8_MI32x32x2x1_SN_AMAS3_DTVB0_GRVW2_LBSPP0_LPA2_LRVW1_NEPBS0_PLR5_SVW2_TT4_32_TLDS0_UMLDSA0_VW2_WG32_8_1_WGM12
    SolutionIndex: 9
    SolutionNameMin: Cijk_Alik_Bjlk_SB_GB_MT128x64x32_MI32x32x2x1_SN_AMAS3_DTVB0_GRVW2_LBSPP0_LPA2_LRVW1_NEPBS4_PLR17_SVW2_TT2_32_TLDS0_UMLDSA0_VW2_WG64_4_1_WGM12
    SolutionIndex: 10
    SolutionNameMin: Cijk_Alik_Bjlk_SB_GB_MT128x128x16_MI32x32x2x1_SN_AMAS3_DTVB0_GRVW2_LBSPP128_LPA2_LRVW2_NEPBS0_PLR9_SVW2_TT4_32_TLDS1_UMLDSA1_VW2_WG32_8_1_WGM6
    SolutionIndex: 11
    SolutionNameMin: Cijk_Alik_Bjlk_SB_GB_MT128x64x16_MI16x16x4x1_SN_AMAS3_DTVB0_GRVW2_LBSPP0_LPA2_LRVW1_NEPBS0_PLR5_SVW2_TT8_16_TLDS0_UMLDSA0_VW2_WG16_16_1_WGM6
    SolutionIndex: 12
    SolutionNameMin: Cijk_Alik_Bjlk_SB_GB_MT128x128x16_MI16x16x4x1_SN_AMAS3_DTVB0_GRVW2_LBSPP0_LPA2_LRVW1_NEPBS4_PLR1_SVW2_TT4_64_TLDS0_UMLDSA0_VW2_WG32_8_1_WGM12
    SolutionIndex: 13
    SolutionNameMin: Cijk_Alik_Bjlk_SB_GB_MT128x64x16_MI16x16x4x1_SN_AMAS3_DTVB0_GRVW2_LBSPP128_LPA2_LRVW1_NEPBS4_PLR1_SVW2_TT4_32_TLDS1_UMLDSA1_VW2_WG32_8_1_WGM18
    SolutionIndex: 14
    SolutionNameMin: Cijk_Alik_Bjlk_SB_GB_MT128x64x32_MI16x16x4x1_SN_AMAS3_DTVB0_GRVW2_LBSPP128_LPA2_LRVW1_NEPBS4_PLR9_SVW2_TT8_16_TLDS1_UMLDSA1_VW2_WG16_16_1_WGM6
    SolutionIndex: 15
    SolutionNameMin: Cijk_Alik_Bjlk_SB_GB_MT128x64x32_MI16x16x4x1_SN_AMAS3_DTVB0_GRVW4_LBSPP0_LPA2_LRVW1_NEPBS0_PLR9_SVW2_TT4_32_TLDS0_UMLDSA0_VW2_WG32_8_1_WGM6
    SolutionIndex: 16
    SolutionNameMin: Cijk_Alik_Bjlk_SB_GB_MT128x64x32_MI32x32x2x1_SN_AMAS3_DTVB0_GRVW4_LBSPP0_LPA2_LRVW1_NEPBS0_PLR17_SVW2_TT2_32_TLDS0_UMLDSA0_VW2_WG64_4_1_WGM12
    SolutionIndex: 17
    SolutionNameMin: Cijk_Alik_Bjlk_SB_GB_MT128x64x32_MI16x16x4x1_SN_AMAS3_DTVB0_GRVW2_LBSPP0_LPA2_LRVW1_NEPBS4_PLR9_SVW2_TT4_32_TLDS0_UMLDSA0_VW2_WG32_8_1_WGM12
    SolutionIndex: 18
    SolutionNameMin: Cijk_Alik_Bjlk_SB_GB_MT128x64x16_MI32x32x2x1_SN_AMAS3_DTVB0_GRVW4_LBSPP128_LPA4_LRVW2_NEPBS0_PLR9_SVW2_TT2_32_TLDS1_UMLDSA1_VW2_WG64_4_1_WGM12
    SolutionIndex: 19
    SolutionNameMin: Cijk_Alik_Bjlk_SB_GB_MT128x128x16_MI32x32x2x1_SN_AMAS3_DTVB0_GRVW2_LBSPP128_LPA2_LRVW2_NEPBS0_PLR9_SVW2_TT4_32_TLDS1_UMLDSA1_VW2_WG32_8_1_WGM6
    SolutionIndex: 20
    SolutionNameMin: Cijk_Alik_Bjlk_SB_GB_MT128x128x16_MI16x16x4x1_SN_AMAS3_DTVB0_GRVW4_LBSPP128_LPA4_LRVW1_NEPBS4_PLR5_SVW2_TT2_128_TLDS1_UMLDSA1_VW2_WG64_4_1_WGM18
    SolutionIndex: 21
    SolutionNameMin: Cijk_Alik_Bjlk_SB_GB_MT128x64x16_MI16x16x4x1_SN_AMAS3_DTVB0_GRVW4_LBSPP0_LPA2_LRVW1_NEPBS0_PLR1_SVW2_TT2_64_TLDS0_UMLDSA0_VW2_WG64_4_1_WGM12
    SolutionIndex: 22
    SolutionNameMin: Cijk_Alik_Bjlk_SB_GB_MT128x128x16_MI16x16x4x1_SN_AMAS3_DTVB0_GRVW2_LBSPP128_LPA2_LRVW1_NEPBS4_PLR1_SVW2_TT8_32_TLDS1_UMLDSA1_VW2_WG16_16_1_WGM12
    SolutionIndex: 23
    SolutionNameMin: Cijk_Alik_Bjlk_SB_GB_MT128x128x16_MI16x16x4x1_SN_AMAS3_DTVB0_GRVW4_LBSPP128_LPA4_LRVW1_NEPBS4_PLR5_SVW2_TT8_32_TLDS1_UMLDSA1_VW2_WG16_16_1_WGM18
    SolutionIndex: 24
    SolutionNameMin: Cijk_Alik_Bjlk_SB_GB_MT128x64x8_MI32x32x2x1_SN_AMAS3_DTVB0_GRVW4_LBSPP128_LPA4_LRVW1_NEPBS0_PLR5_SVW2_TT2_32_TLDS1_UMLDSA1_VW2_WG64_4_1_WGM18
    SolutionIndex: 25
    SolutionNameMin: Cijk_Alik_Bjlk_SB_GB_MT64x32x16_MI16x16x4x1_SN_AMAS0_DTVB0_GRVW1_LBSPP128_LPA2_LRVW2_NEPBS4_NLCB1_PLR5_SVW1_TT2_16_TLDS1_UMLDSA1_VW1_WG32_8_1_WGM6
    SolutionIndex: 26
    SolutionNameMin: Cijk_Alik_Bjlk_SB_GB_MT32x64x16_MI16x16x4x1_SN_AMAS0_DTVB0_GRVW2_LBSPP128_LPA2_LRVW2_NEPBS0_NLCB1_PLR5_SVW1_TT2_16_TLDS1_UMLDSA1_VW1_WG16_16_1_WGM12
    SolutionIndex: 27
    SolutionNameMin: Cijk_Alik_Bjlk_SB_GB_MT32x64x32_MI16x16x4x1_SN_AMAS0_DTVB0_GRVW1_LBSPP128_LPA2_LRVW1_NEPBS0_NLCB1_PLR9_SVW1_TT2_16_TLDS1_UMLDSA1_VW1_WG16_16_1_WGM12
    SolutionIndex: 28
    SolutionNameMin: Cijk_Alik_Bjlk_SB_GB_MT64x64x16_MI32x32x2x1_SN_AMAS0_DTVB0_GRVW2_LBSPP0_LPA1_LRVW1_NEPBS0_NLCB1_PLR9_SVW1_TT1_32_TLDS0_UMLDSA0_VW1_WG64_4_1_WGM6
    SolutionIndex: 29
    SolutionNameMin: Cijk_Alik_Bjlk_SB_GB_MT64x64x16_MI32x32x2x1_SN_AMAS0_DTVB0_GRVW2_LBSPP128_LPA2_LRVW2_NEPBS0_NLCB1_PLR9_SVW1_TT1_32_TLDS1_UMLDSA1_VW1_WG64_4_1_WGM12
    SolutionIndex: 30
    SolutionNameMin: Cijk_Alik_Bjlk_SB_GB_MT64x64x16_MI32x32x2x1_SN_AMAS0_DTVB0_GRVW4_LBSPP128_LPA4_LRVW1_NEPBS0_NLCB1_PLR9_SVW1_TT1_32_TLDS1_UMLDSA1_VW1_WG64_4_1_WGM6
    SolutionIndex: 31
    SolutionNameMin: Cijk_Alik_Bjlk_SB_GB_MT64x64x16_MI32x32x2x1_SN_AMAS0_DTVB0_GRVW1_LBSPP128_LPA1_LRVW1_NEPBS0_NLCB1_PLR9_SVW1_TT1_32_TLDS1_UMLDSA1_VW1_WG64_4_1_WGM12
    SolutionIndex: 32
    SolutionNameMin: Cijk_Alik_Bjlk_SB_GB_MT32x64x16_MI16x16x4x1_SN_AMAS3_DTVB0_GRVW4_LBSPP128_LPA4_LRVW2_NEPBS0_NLCB1_PLR5_SVW2_TT2_16_TLDS1_UMLDSA1_VW2_WG16_16_1_WGM12
    SolutionIndex: 33
    SolutionNameMin: Cijk_Alik_Bjlk_SB_GB_MT32x64x16_MI16x16x4x1_SN_AMAS0_DTVB0_GRVW2_LBSPP128_LPA2_LRVW2_NEPBS0_NLCB1_PLR5_SVW1_TT2_16_TLDS1_UMLDSA1_VW1_WG16_16_1_WGM6
    SolutionIndex: 34
    SolutionNameMin: Cijk_Alik_Bjlk_SB_GB_MT64x32x32_MI16x16x4x1_SN_AMAS0_DTVB0_GRVW1_LBSPP0_LPA1_LRVW1_NEPBS0_NLCB1_PLR9_SVW1_TT1_32_TLDS0_UMLDSA0_VW1_WG64_4_1_WGM6
    SolutionIndex: 35
    SolutionNameMin: Cijk_Alik_Bjlk_SB_GB_MT64x128x16_MI32x32x2x1_SN_AMAS0_DTVB1_GRVW1_LBSPP128_LPA2_LRVW2_NEPBS0_NLCB1_PLR9_SVW1_TT2_32_TLDS1_UMLDSA1_VW1_WG32_8_1_WGM6
    SolutionIndex: 36
    SolutionNameMin: Cijk_Alik_Bjlk_SB_GB_MT32x64x16_MI16x16x4x1_SN_AMAS3_DTVB0_GRVW1_LBSPP128_LPA2_LRVW2_NEPBS0_NLCB1_PLR5_SVW2_TT2_16_TLDS1_UMLDSA1_VW2_WG16_16_1_WGM12
    SolutionIndex: 37
    SolutionNameMin: Cijk_Alik_Bjlk_SB_GB_MT64x64x16_MI32x32x2x1_SN_AMAS0_DTVB0_GRVW2_LBSPP128_LPA2_LRVW1_NEPBS0_NLCB1_PLR9_SVW1_TT1_32_TLDS1_UMLDSA1_VW1_WG64_4_1_WGM6
    SolutionIndex: 38
    SolutionNameMin: Cijk_Alik_Bjlk_SB_GB_MT32x64x32_MI16x16x4x1_SN_AMAS3_DTVB0_GRVW2_LBSPP0_LPA2_LRVW1_NEPBS4_NLCB1_PLR9_SVW2_TT2_16_TLDS0_UMLDSA0_VW2_WG16_16_1_WGM6
    SolutionIndex: 39
    SolutionNameMin: Cijk_Alik_Bjlk_SB_GB_MT32x64x32_MI16x16x4x1_SN_AMAS3_DTVB0_GRVW1_LBSPP128_LPA2_LRVW1_NEPBS0_NLCB1_PLR9_SVW2_TT2_16_TLDS1_UMLDSA1_VW2_WG16_16_1_WGM6
    SolutionIndex: 40
    SolutionNameMin: Cijk_Alik_Bjlk_SB_GB_MT64x64x16_MI16x16x4x1_SN_AMAS3_DTVB0_GRVW2_LBSPP0_LPA2_LRVW1_NEPBS0_NLCB1_PLR5_SVW2_TT4_16_TLDS0_UMLDSA0_VW2_WG16_16_1_WGM6
    SolutionIndex: 41
    SolutionNameMin: Cijk_Alik_Bjlk_SB_GB_MT64x64x16_MI16x16x4x1_SN_AMAS3_DTVB0_GRVW2_LBSPP128_LPA2_LRVW1_NEPBS4_NLCB1_PLR5_SVW2_TT4_16_TLDS1_UMLDSA1_VW2_WG16_16_1_WGM12
    SolutionIndex: 42
    SolutionNameMin: Cijk_Alik_Bjlk_SB_GB_MT64x64x16_MI16x16x4x1_SN_AMAS3_DTVB0_GRVW2_LBSPP0_LPA2_LRVW1_NEPBS0_NLCB1_PLR5_SVW2_TT2_32_TLDS0_UMLDSA0_VW2_WG32_8_1_WGM6
    SolutionIndex: 43
    SolutionNameMin: Cijk_Alik_Bjlk_SB_GB_MT64x64x16_MI16x16x4x1_SN_AMAS3_DTVB0_GRVW2_LBSPP128_LPA2_LRVW1_NEPBS0_NLCB1_PLR5_SVW2_TT4_16_TLDS1_UMLDSA1_VW2_WG16_16_1_WGM6
    SolutionIndex: 44
    SolutionNameMin: Cijk_Alik_Bjlk_SB_GB_MT32x64x32_MI16x16x4x1_SN_AMAS3_DTVB0_GRVW2_LBSPP128_LPA2_LRVW2_NEPBS4_NLCB1_PLR9_SVW2_TT2_16_TLDS1_UMLDSA1_VW2_WG16_16_1_WGM12
    SolutionIndex: 45
    SolutionNameMin: Cijk_Alik_Bjlk_SB_GB_MT64x64x32_MI16x16x4x1_SN_AMAS3_DTVB0_GRVW2_LBSPP128_LPA2_LRVW1_NEPBS0_NLCB1_PLR9_SVW2_TT2_32_TLDS1_UMLDSA1_VW2_WG32_8_1_WGM12
    SolutionIndex: 46
    SolutionNameMin: Cijk_Alik_Bjlk_SB_GB_MT32x64x16_MI16x16x4x1_SN_AMAS3_DTVB0_GRVW4_LBSPP128_LPA4_LRVW2_NEPBS0_NLCB1_PLR5_SVW2_TT2_16_TLDS1_UMLDSA1_VW2_WG16_16_1_WGM6
    SolutionIndex: 47
    SolutionNameMin: Cijk_Alik_Bjlk_SB_GB_MT32x64x16_MI16x16x4x1_SN_AMAS3_DTVB0_GRVW4_LBSPP128_LPA4_LRVW2_NEPBS4_NLCB1_PLR5_SVW2_TT2_16_TLDS1_UMLDSA1_VW2_WG16_16_1_WGM6
    SolutionIndex: 48
    SolutionNameMin: Cijk_Alik_Bjlk_SB_GB_MT64x64x16_MI16x16x4x1_SN_AMAS3_DTVB0_GRVW4_LBSPP0_LPA2_LRVW1_NEPBS0_NLCB1_PLR5_SVW2_TT4_16_TLDS0_UMLDSA0_VW2_WG16_16_1_WGM12
    SolutionIndex: 49
    SolutionNameMin: Cijk_Alik_Bjlk_SB_GB_MT64x128x16_MI32x32x2x1_SN_AMAS3_DTVB0_GRVW1_LBSPP128_LPA1_LRVW1_NEPBS0_NLCB1_PLR9_SVW2_TT2_32_TLDS1_UMLDSA1_VW2_WG32_8_1_WGM6
    SolutionIndex: 50
    SolutionNameMin: Cijk_Alik_Bjlk_SB_GB_MT64x32x16_MI16x16x4x1_SN_AMAS3_DTVB0_GRVW1_LBSPP128_LPA2_LRVW2_NEPBS0_NLCB1_PLR5_SVW2_TT2_16_TLDS1_UMLDSA1_VW2_WG32_8_1_WGM6
    SolutionIndex: 51
    SolutionNameMin: Cijk_Alik_Bjlk_SB_GB_MT64x32x16_MI16x16x4x1_SN_AMAS3_DTVB0_GRVW2_LBSPP128_LPA2_LRVW2_NEPBS4_NLCB1_PLR5_SVW2_TT2_16_TLDS1_UMLDSA1_VW2_WG32_8_1_WGM6
    SolutionIndex: 52
    SolutionNameMin: Cijk_Alik_Bjlk_SB_GB_MT64x128x16_MI32x32x2x1_SN_AMAS3_DTVB0_GRVW2_LBSPP128_LPA2_LRVW1_NEPBS0_NLCB1_PLR9_SVW2_TT2_32_TLDS1_UMLDSA1_VW2_WG32_8_1_WGM6
    SolutionIndex: 53
    SolutionNameMin: Cijk_Alik_Bjlk_SB_GB_MT64x128x16_MI32x32x2x1_SN_AMAS3_DTVB0_GRVW2_LBSPP128_LPA2_LRVW2_NEPBS0_NLCB1_PLR9_SVW2_TT2_32_TLDS1_UMLDSA1_VW2_WG32_8_1_WGM6
    SolutionIndex: 54
    SolutionNameMin: Cijk_Alik_Bjlk_SB_GB_MT64x128x16_MI32x32x2x1_SN_AMAS3_DTVB0_GRVW2_LBSPP0_LPA2_LRVW1_NEPBS0_NLCB1_PLR9_SVW2_TT2_32_TLDS0_UMLDSA0_VW2_WG32_8_1_WGM6
    SolutionIndex: 55
    SolutionNameMin: Cijk_Alik_Bjlk_SB_GB_MT64x64x16_MI16x16x4x1_SN_AMAS3_DTVB0_GRVW1_LBSPP0_LPA2_LRVW1_NEPBS0_NLCB1_PLR5_SVW2_TT2_32_TLDS0_UMLDSA0_VW2_WG32_8_1_WGM12
    SolutionIndex: 56
    SolutionNameMin: Cijk_Alik_Bjlk_SB_GB_MT64x128x16_MI32x32x2x1_SN_AMAS3_DTVB0_GRVW2_LBSPP128_LPA2_LRVW1_NEPBS0_NLCB1_PLR9_SVW2_TT2_32_TLDS1_UMLDSA1_VW2_WG32_8_1_WGM12
    SolutionIndex: 57
    SolutionNameMin: Cijk_Alik_Bjlk_SB_GB_MT32x64x16_MI16x16x4x1_SN_AMAS3_DTVB0_GRVW4_LBSPP128_LPA4_LRVW2_NEPBS0_NLCB1_PLR5_SVW2_TT2_16_TLDS1_UMLDSA1_VW2_WG16_16_1_WGM12
    SolutionIndex: 58
    SolutionNameMin: Cijk_Alik_Bjlk_SB_GB_MT64x64x16_MI16x16x4x1_SN_AMAS3_DTVB0_GRVW2_LBSPP128_LPA2_LRVW2_NEPBS0_NLCB1_PLR5_SVW2_TT4_16_TLDS1_UMLDSA1_VW2_WG16_16_1_WGM12
- - - [511, 511, 16, 511]
    - [0, 61.103]
  - - [513, 513, 16, 513]
    - [1, 55.337]
  - - [1023, 1023, 16, 1023]
    - [4, 87.452]
  - - [1025, 1025, 16, 1025]
    - [5, 77.874]
  - - [2047, 2047, 16, 2047]
    - [2, 96.22]
  - - [2049, 2049, 16, 2049]
    - [3, 89.714]
  - - [4095, 2047, 16, 2047]
    - [6, 97.316]
  - - [4097, 2049, 16, 2049]
    - [3, 91.734]
  - - [510, 510, 16, 510]
    - [7, 56.004]
  - - [514, 514, 16, 514]
    - [8, 46.311]
  - - [1022, 1022, 16, 1022]
    - [9, 90.578]
  - - [1026, 1026, 16, 1026]
    - [9, 76.03]
  - - [2046, 2046, 16, 2046]
    - [10, 97.205]
  - - [2050, 2050, 16, 2050]
    - [11, 87.842]
  - - [4094, 2046, 16, 2046]
    - [12, 97.661]
  - - [4098, 2050, 16, 2050]
    - [13, 91.395]
  - - [508, 508, 16, 508]
    - [14, 46.113]
  - - [512, 512, 16, 512]
    - [15, 57.131]
  - - [516, 516, 16, 516]
    - [15, 41.34]
  - - [1020, 1020, 16, 1020]
    - [16, 91.083]
  - - [1024, 1024, 16, 1024]
    - [17, 92.538]
  - - [1028, 1028, 16, 1028]
    - [18, 77.585]
  - - [2044, 2044, 16, 2044]
    - [19, 97.221]
  - - [2048, 2048, 16, 2048]
    - [20, 97.931]
  - - [2052, 2052, 16, 2052]
    - [21, 88.338]
  - - [4092, 2044, 16, 2044]
    - [22, 97.721]
  - - [4096, 2048, 16, 2048]
    - [23, 98.268]
  - - [4100, 2052, 16, 2052]
    - [24, 92.023]
  - - [64, 1, 1000, 64]
    - [25, 0.496]
  - - [1, 64, 1000, 64]
    - [26, 0.495]
  - - [31, 31, 1000, 31]
    - [27, 3.851]
  - - [33, 33, 1000, 33]
    - [28, 3.767]
  - - [47, 47, 1000, 47]
    - [29, 8.518]
  - - [49, 49, 1000, 49]
    - [30, 9.451]
  - - [63, 63, 128, 63]
    - [31, 5.28]
  - - [65, 65, 128, 65]
    - [32, 4.602]
  - - [79, 79, 128, 79]
    - [33, 7.165]
  - - [81, 81, 128, 81]
    - [29, 7.528]
  - - [95, 95, 64, 95]
    - [34, 7.674]
  - - [97, 97, 64, 97]
    - [35, 7.713]
  - - [127, 127, 64, 127]
    - [0, 14.802]
  - - [129, 129, 64, 129]
    - [1, 12.27]
  - - [255, 255, 16, 255]
    - [36, 22.897]
  - - [257, 257, 16, 257]
    - [37, 22.019]
  - - [30, 30, 1000, 30]
    - [38, 4.102]
  - - [32, 32, 1000, 32]
    - [39, 5.016]
  - - [34, 34, 1000, 34]
    - [40, 4.496]
  - - [46, 46, 1000, 46]
    - [41, 8.795]
  - - [48, 48, 1000, 48]
    - [42, 11.156]
  - - [50, 50, 1000, 50]
    - [43, 10.523]
  - - [62, 62, 128, 62]
    - [44, 5.41]
  - - [64, 64, 128, 64]
    - [45, 6.432]
  - - [66, 66, 128, 66]
    - [46, 5.077]
  - - [78, 78, 128, 78]
    - [47, 7.551]
  - - [80, 80, 128, 80]
    - [48, 8.636]
  - - [82, 82, 128, 82]
    - [49, 8.288]
  - - [94, 94, 64, 94]
    - [50, 7.901]
  - - [96, 96, 64, 96]
    - [51, 9.679]
  - - [98, 98, 64, 98]
    - [52, 8.405]
  - - [126, 126, 64, 126]
    - [53, 15.725]
  - - [128, 128, 64, 128]
    - [54, 17.536]
  - - [130, 130, 64, 130]
    - [55, 13.07]
  - - [254, 254, 16, 254]
    - [56, 23.314]
  - - [256, 256, 16, 256]
    - [57, 27.715]
  - - [258, 258, 16, 258]
    - [58, 20.274]
- null
- null
- DeviceEfficiency
