library/src/blas3/Tensile/Logic/asm_full/aquavanjaram942/aquavanjaram942_Cijk_Alik_Bljk_SB_GB.yaml
- {MinimumRequiredVersion: 4.37.0}
- aquavanjaram942
- gfx942
- [Device 0049, Device 0050]
    SolutionIndex: 0
    SolutionNameMin: Cijk_Alik_Bljk_SB_GB_MT128x128x16_MI32x32x2x1_SN_AMAS0_GRVW2_LBSPP128_LPA2_LPB2_LRVW1_NEPBS0_PLR9_SS1_SVW1_TT2_64_TLDS1_UMLDSA1_UMLDSB1_VW1_WG64_4_1_WGM12
    SolutionIndex: 1
    SolutionNameMin: Cijk_Alik_Bljk_SB_GB_MT128x128x16_MI32x32x2x1_SN_AMAS3_GRVW2_LBSPP128_LPA2_LPB2_LRVW1_NEPBS0_PLR9_SS1_SVW2_TT2_64_TLDS1_UMLDSA1_UMLDSB1_VW2_WG64_4_1_WGM12
    SolutionIndex: 2
    SolutionNameMin: Cijk_Alik_Bljk_SB_GB_MT64x64x32_MI32x32x2x1_SN_AMAS0_GRVW1_LBSPP128_LPA2_LPB2_LRVW2_NEPBS0_PLR17_SS1_SVW1_TT1_32_TLDS1_UMLDSA1_UMLDSB1_VW1_WG64_4_1_WGM6
    SolutionIndex: 3
    SolutionNameMin: Cijk_Alik_Bljk_SB_GB_MT64x64x32_MI32x32x2x1_SN_AMAS0_GRVW1_LBSPP128_LPA2_LPB2_LRVW2_NEPBS0_PLR17_SS1_SVW1_TT1_32_TLDS1_UMLDSA1_UMLDSB1_VW1_WG64_4_1_WGM12
    SolutionIndex: 4
    SolutionNameMin: Cijk_Alik_Bljk_SB_GB_MT64x64x32_MI32x32x2x1_SN_AMAS0_GRVW2_LBSPP128_LPA2_LPB2_LRVW2_NEPBS0_PLR17_SS1_SVW1_TT1_32_TLDS1_UMLDSA1_UMLDSB1_VW1_WG64_4_1_WGM12
    SolutionIndex: 5
    SolutionNameMin: Cijk_Alik_Bljk_SB_GB_MT64x64x16_MI32x32x2x1_SN_AMAS0_GRVW1_LBSPP0_LPA1_LPB1_LRVW1_NEPBS4_PLR9_SS1_SVW1_TT1_32_TLDS0_UMLDSA0_UMLDSB0_VW1_WG64_4_1_WGM6
    SolutionIndex: 6
    SolutionNameMin: Cijk_Alik_Bljk_SB_GB_MT64x64x32_MI32x32x2x1_SN_AMAS0_GRVW4_LBSPP128_LPA4_LPB4_LRVW4_NEPBS4_PLR17_SS1_SVW1_TT1_32_TLDS1_UMLDSA1_UMLDSB1_VW1_WG64_4_1_WGM18
    SolutionIndex: 7
    SolutionNameMin: Cijk_Alik_Bljk_SB_GB_MT64x64x16_MI32x32x2x1_SN_AMAS0_GRVW2_LBSPP128_LPA2_LPB2_LRVW2_NEPBS0_PLR9_SS1_SVW1_TT1_32_TLDS1_UMLDSA1_UMLDSB1_VW1_WG64_4_1_WGM6
    SolutionIndex: 8
    SolutionNameMin: Cijk_Alik_Bljk_SB_GB_MT64x64x16_MI32x32x2x1_SN_AMAS0_GRVW2_LBSPP128_LPA2_LPB2_LRVW1_NEPBS0_PLR9_SS1_SVW1_TT1_32_TLDS1_UMLDSA1_UMLDSB1_VW1_WG64_4_1_WGM6
    SolutionIndex: 9
    SolutionNameMin: Cijk_Alik_Bljk_SB_GB_MT128x64x32_MI32x32x2x1_SN_AMAS3_GRVW2_LBSPP0_LPA2_LPB2_LRVW1_NEPBS0_PLR17_SS1_SVW2_TT2_32_TLDS0_UMLDSA0_UMLDSB0_VW2_WG64_4_1_WGM12
    SolutionIndex: 10
    SolutionNameMin: Cijk_Alik_Bljk_SB_GB_MT64x64x32_MI32x32x2x1_SN_AMAS0_GRVW2_LBSPP128_LPA2_LPB2_LRVW2_NEPBS0_PLR17_SS1_SVW1_TT1_32_TLDS1_UMLDSA1_UMLDSB1_VW1_WG64_4_1_WGM12
    SolutionIndex: 11
    SolutionNameMin: Cijk_Alik_Bljk_SB_GB_MT128x128x16_MI32x32x2x1_SN_AMAS3_GRVW2_LBSPP128_LPA2_LPB2_LRVW1_NEPBS0_PLR9_SS1_SVW2_TT2_64_TLDS1_UMLDSA1_UMLDSB1_VW2_WG64_4_1_WGM18
    SolutionIndex: 12
    SolutionNameMin: Cijk_Alik_Bljk_SB_GB_MT64x64x32_MI32x32x2x1_SN_AMAS0_GRVW2_LBSPP128_LPA4_LPB4_LRVW4_NEPBS4_PLR17_SS1_SVW1_TT1_32_TLDS1_UMLDSA1_UMLDSB1_VW1_WG64_4_1_WGM18
    SolutionIndex: 13
    SolutionNameMin: Cijk_Alik_Bljk_SB_GB_MT128x64x16_MI32x32x2x1_SN_AMAS3_GRVW2_LBSPP128_LPA2_LPB2_LRVW1_NEPBS4_PLR9_SS1_SVW2_TT2_32_TLDS1_UMLDSA1_UMLDSB1_VW2_WG64_4_1_WGM18
    SolutionIndex: 14
    SolutionNameMin: Cijk_Alik_Bljk_SB_GB_MT128x64x32_MI16x16x4x1_SN_AMAS3_GRVW2_LBSPP0_LPA2_LPB2_LRVW1_NEPBS4_PLR9_SS1_SVW2_TT2_64_TLDS0_UMLDSA0_UMLDSB0_VW2_WG64_4_1_WGM6
    SolutionIndex: 15
    SolutionNameMin: Cijk_Alik_Bljk_SB_GB_MT128x64x32_MI16x16x4x1_SN_AMAS3_GRVW4_LBSPP0_LPA2_LPB2_LRVW1_NEPBS0_PLR9_SS1_SVW2_TT4_32_TLDS0_UMLDSA0_UMLDSB0_VW2_WG32_8_1_WGM6
    SolutionIndex: 16
    SolutionNameMin: Cijk_Alik_Bljk_SB_GB_MT128x128x16_MI32x32x2x1_SN_AMAS3_GRVW2_LBSPP0_LPA2_LPB2_LRVW1_NEPBS0_PLR9_SS1_SVW2_TT2_64_TLDS0_UMLDSA0_UMLDSB0_VW2_WG64_4_1_WGM18
    SolutionIndex: 17
    SolutionNameMin: Cijk_Alik_Bljk_SB_GB_MT128x64x32_MI32x32x2x1_SN_AMAS3_GRVW4_LBSPP0_LPA2_LPB2_LRVW1_NEPBS0_PLR17_SS1_SVW2_TT2_32_TLDS0_UMLDSA0_UMLDSB0_VW2_WG64_4_1_WGM12
    SolutionIndex: 18
    SolutionNameMin: Cijk_Alik_Bljk_SB_GB_MT128x64x32_MI16x16x4x1_SN_AMAS3_GRVW4_LBSPP128_LPA8_LPB8_LRVW4_NEPBS4_PLR9_SS1_SVW2_TT2_64_TLDS1_UMLDSA1_UMLDSB1_VW2_WG64_4_1_WGM12
    SolutionIndex: 19
    SolutionNameMin: Cijk_Alik_Bljk_SB_GB_MT128x64x16_MI32x32x2x1_SN_AMAS3_GRVW4_LBSPP128_LPA4_LPB4_LRVW2_NEPBS0_PLR9_SS1_SVW2_TT2_32_TLDS1_UMLDSA1_UMLDSB1_VW2_WG64_4_1_WGM12
    SolutionIndex: 20
    SolutionNameMin: Cijk_Alik_Bljk_SB_GB_MT128x64x16_MI16x16x4x1_SN_AMAS3_GRVW4_LBSPP128_LPA4_LPB4_LRVW1_NEPBS4_PLR1_SS1_SVW2_TT4_32_TLDS1_UMLDSA1_UMLDSB1_VW2_WG32_8_1_WGM18
    SolutionIndex: 21
    SolutionNameMin: Cijk_Alik_Bljk_SB_GB_MT128x128x16_MI16x16x4x1_SN_AMAS3_GRVW4_LBSPP128_LPA4_LPB4_LRVW1_NEPBS4_PLR5_SS1_SVW2_TT8_32_TLDS1_UMLDSA1_UMLDSB1_VW2_WG16_16_1_WGM12
    SolutionIndex: 22
    SolutionNameMin: Cijk_Alik_Bljk_SB_GB_MT128x128x16_MI16x16x4x1_SN_AMAS3_GRVW4_LBSPP128_LPA4_LPB4_LRVW1_NEPBS4_PLR1_SS1_SVW2_TT8_32_TLDS1_UMLDSA1_UMLDSB1_VW2_WG16_16_1_WGM12
    SolutionIndex: 23
    SolutionNameMin: Cijk_Alik_Bljk_SB_GB_MT128x128x16_MI16x16x4x1_SN_AMAS3_GRVW4_LBSPP128_LPA4_LPB4_LRVW1_NEPBS4_PLR1_SS1_SVW2_TT4_64_TLDS1_UMLDSA1_UMLDSB1_VW2_WG32_8_1_WGM12
    SolutionIndex: 24
    SolutionNameMin: Cijk_Alik_Bljk_SB_GB_MT128x64x16_MI16x16x4x1_SN_AMAS3_GRVW4_LBSPP128_LPA4_LPB4_LRVW1_NEPBS4_PLR1_SS1_SVW2_TT2_64_TLDS1_UMLDSA1_UMLDSB1_VW2_WG64_4_1_WGM18
    SolutionIndex: 25
    SolutionNameMin: Cijk_Alik_Bljk_SB_GB_MT64x32x16_MI16x16x4x1_SN_AMAS0_GRVW4_LBSPP128_LPA4_LPB4_LRVW2_NEPBS0_PLR5_SS1_SVW1_TT1_32_TLDS1_UMLDSA1_UMLDSB1_VW1_WG64_4_1_WGM12
    SolutionIndex: 26
    SolutionNameMin: Cijk_Alik_Bljk_SB_GB_MT32x64x16_MI16x16x4x1_SN_AMAS0_GRVW2_LBSPP128_LPA2_LPB2_LRVW2_NEPBS0_PLR5_SS0_SVW4_TT1_32_TLDS1_UMLDSA1_UMLDSB1_VW1_WG32_8_1_WGM12
    SolutionIndex: 27
    SolutionNameMin: Cijk_Alik_Bljk_SB_GB_MT32x64x32_MI16x16x4x1_SN_AMAS0_GRVW1_LBSPP0_LPA1_LPB1_LRVW1_NEPBS0_PLR9_SS1_SVW1_TT1_32_TLDS0_UMLDSA0_UMLDSB0_VW1_WG32_8_1_WGM12
    SolutionIndex: 28
    SolutionNameMin: Cijk_Alik_Bljk_SB_GB_MT64x64x16_MI32x32x2x1_SN_AMAS0_GRVW2_LBSPP0_LPA1_LPB1_LRVW1_NEPBS0_PLR9_SS1_SVW1_TT1_32_TLDS0_UMLDSA0_UMLDSB0_VW1_WG64_4_1_WGM12
    SolutionIndex: 29
    SolutionNameMin: Cijk_Alik_Bljk_SB_GB_MT64x64x16_MI32x32x2x1_SN_AMAS0_GRVW1_LBSPP128_LPA1_LPB1_LRVW1_NEPBS4_PLR9_SS1_SVW1_TT1_32_TLDS1_UMLDSA1_UMLDSB1_VW1_WG64_4_1_WGM6
    SolutionIndex: 30
    SolutionNameMin: Cijk_Alik_Bljk_SB_GB_MT64x64x16_MI32x32x2x1_SN_AMAS0_GRVW2_LBSPP128_LPA2_LPB2_LRVW2_NEPBS0_PLR9_SS1_SVW1_TT1_32_TLDS1_UMLDSA1_UMLDSB1_VW1_WG64_4_1_WGM12
    SolutionIndex: 31
    SolutionNameMin: Cijk_Alik_Bljk_SB_GB_MT32x64x16_MI16x16x4x1_SN_AMAS0_GRVW1_LBSPP128_LPA2_LPB2_LRVW2_NEPBS4_PLR5_SS1_SVW1_TT1_32_TLDS1_UMLDSA1_UMLDSB1_VW1_WG32_8_1_WGM6
    SolutionIndex: 32
    SolutionNameMin: Cijk_Alik_Bljk_SB_GB_MT32x64x32_MI16x16x4x1_SN_AMAS3_GRVW1_LBSPP128_LPA2_LPB2_LRVW1_NEPBS0_PLR9_SS1_SVW2_TT2_16_TLDS1_UMLDSA1_UMLDSB1_VW2_WG16_16_1_WGM6
    SolutionIndex: 33
    SolutionNameMin: Cijk_Alik_Bljk_SB_GB_MT32x64x32_MI16x16x4x1_SN_AMAS0_GRVW1_LBSPP128_LPA2_LPB2_LRVW1_NEPBS0_PLR9_SS1_SVW1_TT1_32_TLDS1_UMLDSA1_UMLDSB1_VW1_WG32_8_1_WGM12
    SolutionIndex: 34
    SolutionNameMin: Cijk_Alik_Bljk_SB_GB_MT64x64x16_MI32x32x2x1_SN_AMAS0_GRVW1_LBSPP128_LPA1_LPB1_LRVW1_NEPBS4_PLR9_SS1_SVW1_TT1_32_TLDS1_UMLDSA1_UMLDSB1_VW1_WG64_4_1_WGM12
    SolutionIndex: 35
    SolutionNameMin: Cijk_Alik_Bljk_SB_GB_MT32x64x16_MI16x16x4x1_SN_AMAS0_GRVW1_LBSPP128_LPA2_LPB2_LRVW2_NEPBS0_PLR5_SS1_SVW1_TT1_32_TLDS1_UMLDSA1_UMLDSB1_VW1_WG32_8_1_WGM12
    SolutionIndex: 36
    SolutionNameMin: Cijk_Alik_Bljk_SB_GB_MT32x64x32_MI16x16x4x1_SN_AMAS0_GRVW1_LBSPP128_LPA2_LPB2_LRVW1_NEPBS0_PLR9_SS1_SVW1_TT1_32_TLDS1_UMLDSA1_UMLDSB1_VW1_WG32_8_1_WGM6
    SolutionIndex: 37
    SolutionNameMin: Cijk_Alik_Bljk_SB_GB_MT64x64x16_MI32x32x2x1_SN_AMAS0_GRVW1_LBSPP128_LPA2_LPB2_LRVW2_NEPBS4_PLR9_SS1_SVW1_TT1_32_TLDS1_UMLDSA1_UMLDSB1_VW1_WG64_4_1_WGM6
    SolutionIndex: 38
    SolutionNameMin: Cijk_Alik_Bljk_SB_GB_MT32x64x32_MI16x16x4x1_SN_AMAS3_GRVW1_LBSPP0_LPA2_LPB2_LRVW1_NEPBS4_PLR9_SS1_SVW2_TT2_16_TLDS0_UMLDSA0_UMLDSB0_VW2_WG16_16_1_WGM6
    SolutionIndex: 39
    SolutionNameMin: Cijk_Alik_Bljk_SB_GB_MT32x64x32_MI16x16x4x1_SN_AMAS0_GRVW1_LBSPP128_LPA2_LPB2_LRVW2_NEPBS4_PLR9_SS1_SVW1_TT1_32_TLDS1_UMLDSA1_UMLDSB1_VW1_WG32_8_1_WGM6
    SolutionIndex: 40
    SolutionNameMin: Cijk_Alik_Bljk_SB_GB_MT64x64x16_MI32x32x2x1_SN_AMAS0_GRVW1_LBSPP0_LPA1_LPB1_LRVW1_NEPBS0_PLR9_SS1_SVW1_TT1_32_TLDS0_UMLDSA0_UMLDSB0_VW1_WG64_4_1_WGM12
    SolutionIndex: 41
    SolutionNameMin: Cijk_Alik_Bljk_SB_GB_MT32x64x32_MI16x16x4x1_SN_AMAS3_GRVW2_LBSPP0_LPA2_LPB2_LRVW1_NEPBS0_PLR9_SS1_SVW2_TT2_16_TLDS0_UMLDSA0_UMLDSB0_VW2_WG16_16_1_WGM12
    SolutionIndex: 42
    SolutionNameMin: Cijk_Alik_Bljk_SB_GB_MT64x32x32_MI16x16x4x1_SN_AMAS3_GRVW4_LBSPP0_LPA2_LPB2_LRVW1_NEPBS4_PLR9_SS1_SVW2_TT2_16_TLDS0_UMLDSA0_UMLDSB0_VW2_WG32_8_1_WGM12
    SolutionIndex: 43
    SolutionNameMin: Cijk_Alik_Bljk_SB_GB_MT64x64x16_MI16x16x4x1_SN_AMAS3_GRVW1_LBSPP128_LPA2_LPB2_LRVW1_NEPBS0_PLR5_SS1_SVW2_TT2_32_TLDS1_UMLDSA1_UMLDSB1_VW2_WG32_8_1_WGM12
    SolutionIndex: 44
    SolutionNameMin: Cijk_Alik_Bljk_SB_GB_MT64x64x16_MI16x16x4x1_SN_AMAS3_GRVW2_LBSPP128_LPA2_LPB2_LRVW1_NEPBS0_PLR5_SS1_SVW2_TT2_32_TLDS1_UMLDSA1_UMLDSB1_VW2_WG32_8_1_WGM12
    SolutionIndex: 45
    SolutionNameMin: Cijk_Alik_Bljk_SB_GB_MT64x64x16_MI16x16x4x1_SN_AMAS3_GRVW1_LBSPP128_LPA2_LPB2_LRVW2_NEPBS0_PLR5_SS1_SVW2_TT2_32_TLDS1_UMLDSA1_UMLDSB1_VW2_WG32_8_1_WGM6
    SolutionIndex: 46
    SolutionNameMin: Cijk_Alik_Bljk_SB_GB_MT32x64x32_MI16x16x4x1_SN_AMAS3_GRVW2_LBSPP128_LPA2_LPB2_LRVW2_NEPBS4_PLR9_SS1_SVW2_TT2_16_TLDS1_UMLDSA1_UMLDSB1_VW2_WG16_16_1_WGM6
    SolutionIndex: 47
    SolutionNameMin: Cijk_Alik_Bljk_SB_GB_MT64x64x32_MI16x16x4x1_SN_AMAS3_GRVW4_LBSPP0_LPA2_LPB2_LRVW1_NEPBS0_PLR9_SS1_SVW2_TT2_32_TLDS0_UMLDSA0_UMLDSB0_VW2_WG32_8_1_WGM12
    SolutionIndex: 48
    SolutionNameMin: Cijk_Alik_Bljk_SB_GB_MT32x64x32_MI16x16x4x1_SN_AMAS3_GRVW1_LBSPP0_LPA2_LPB2_LRVW1_NEPBS4_PLR9_SS1_SVW2_TT2_16_TLDS0_UMLDSA0_UMLDSB0_VW2_WG16_16_1_WGM12
    SolutionIndex: 49
    SolutionNameMin: Cijk_Alik_Bljk_SB_GB_MT32x64x32_MI16x16x4x1_SN_AMAS3_GRVW1_LBSPP0_LPA2_LPB2_LRVW1_NEPBS4_PLR9_SS1_SVW2_TT2_16_TLDS0_UMLDSA0_UMLDSB0_VW2_WG16_16_1_WGM6
    SolutionIndex: 50
    SolutionNameMin: Cijk_Alik_Bljk_SB_GB_MT32x64x16_MI16x16x4x1_SN_AMAS3_GRVW1_LBSPP128_LPA2_LPB2_LRVW2_NEPBS4_PLR5_SS1_SVW2_TT2_16_TLDS1_UMLDSA1_UMLDSB1_VW2_WG16_16_1_WGM6
    SolutionIndex: 51
    SolutionNameMin: Cijk_Alik_Bljk_SB_GB_MT32x64x32_MI16x16x4x1_SN_AMAS3_GRVW1_LBSPP128_LPA2_LPB2_LRVW2_NEPBS4_PLR9_SS1_SVW2_TT2_16_TLDS1_UMLDSA1_UMLDSB1_VW2_WG16_16_1_WGM12
    SolutionIndex: 52
    SolutionNameMin: Cijk_Alik_Bljk_SB_GB_MT32x64x32_MI16x16x4x1_SN_AMAS3_GRVW2_LBSPP0_LPA2_LPB2_LRVW1_NEPBS4_PLR9_SS1_SVW2_TT2_16_TLDS0_UMLDSA0_UMLDSB0_VW2_WG16_16_1_WGM12
    SolutionIndex: 53
    SolutionNameMin: Cijk_Alik_Bljk_SB_GB_MT64x32x32_MI16x16x4x1_SN_AMAS3_GRVW4_LBSPP0_LPA2_LPB2_LRVW1_NEPBS4_PLR9_SS1_SVW2_TT2_16_TLDS0_UMLDSA0_UMLDSB0_VW2_WG32_8_1_WGM6
    SolutionIndex: 54
    SolutionNameMin: Cijk_Alik_Bljk_SB_GB_MT32x64x16_MI16x16x4x1_SN_AMAS3_GRVW4_LBSPP128_LPA4_LPB4_LRVW2_NEPBS4_PLR5_SS1_SVW2_TT2_16_TLDS1_UMLDSA1_UMLDSB1_VW2_WG16_16_1_WGM6
    SolutionIndex: 55
    SolutionNameMin: Cijk_Alik_Bljk_SB_GB_MT64x64x16_MI16x16x4x1_SN_AMAS3_GRVW2_LBSPP128_LPA2_LPB2_LRVW2_NEPBS4_PLR5_SS1_SVW2_TT2_32_TLDS1_UMLDSA1_UMLDSB1_VW2_WG32_8_1_WGM12
    SolutionIndex: 56
    SolutionNameMin: Cijk_Alik_Bljk_SB_GB_MT128x64x32_MI16x16x4x1_SN_AMAS3_GRVW4_LBSPP0_LPA2_LPB2_LRVW1_NEPBS0_PLR1_SS1_SVW2_TT4_32_TLDS0_UMLDSA0_UMLDSB0_VW2_WG32_8_1_WGM6
    SolutionIndex: 57
    SolutionNameMin: Cijk_Alik_Bljk_SB_GB_MT32x64x32_MI16x16x4x1_SN_AMAS3_GRVW2_LBSPP0_LPA2_LPB2_LRVW1_NEPBS0_PLR9_SS1_SVW2_TT2_16_TLDS0_UMLDSA0_UMLDSB0_VW2_WG16_16_1_WGM6
    SolutionIndex: 58
    SolutionNameMin: Cijk_Alik_Bljk_SB_GB_MT64x32x32_MI16x16x4x1_SN_AMAS3_GRVW1_LBSPP128_LPA2_LPB2_LRVW2_NEPBS4_PLR9_SS1_SVW2_TT2_16_TLDS1_UMLDSA1_UMLDSB1_VW2_WG32_8_1_WGM6
    SolutionIndex: 59
    SolutionNameMin: Cijk_Alik_Bljk_SB_GB_MT64x32x32_MI16x16x4x1_SN_AMAS3_GRVW2_LBSPP128_LPA2_LPB2_LRVW1_NEPBS0_PLR9_SS1_SVW2_TT2_16_TLDS1_UMLDSA1_UMLDSB1_VW2_WG32_8_1_WGM6
    SolutionIndex: 60
    SolutionNameMin: Cijk_Alik_Bljk_SB_GB_MT64x64x32_MI16x16x4x1_SN_AMAS3_GRVW4_LBSPP128_LPA8_LPB8_LRVW4_NEPBS0_PLR9_SS1_SU4_SUS256_SVW2_TT2_32_TLDS1_UMLDSA1_UMLDSB1_VW2_WG32_8_1_WGM18
- - - [511, 511, 16, 511]
    - [5, 58.309]
  - - [513, 513, 16, 513]
    - [2, 54.253]
  - - [1023, 1023, 16, 1023]
    - [4, 87.597]
  - - [1025, 1025, 16, 1025]
    - [3, 77.009]
  - - [2047, 2047, 16, 2047]
    - [0, 96.0]
  - - [2049, 2049, 16, 2049]
    - [6, 89.296]
  - - [4095, 2047, 16, 2047]
    - [1, 96.523]
  - - [4097, 2049, 16, 2049]
    - [6, 91.169]
  - - [510, 510, 16, 510]
    - [7, 58.513]
  - - [514, 514, 16, 514]
    - [8, 55.5]
  - - [1022, 1022, 16, 1022]
    - [9, 90.655]
  - - [1026, 1026, 16, 1026]
    - [10, 78.211]
  - - [2046, 2046, 16, 2046]
    - [11, 96.864]
  - - [2050, 2050, 16, 2050]
    - [12, 90.101]
  - - [4094, 2046, 16, 2046]
    - [13, 97.737]
  - - [4098, 2050, 16, 2050]
    - [12, 92.163]
  - - [508, 508, 16, 508]
    - [14, 45.463]
  - - [512, 512, 16, 512]
    - [15, 55.57]
  - - [516, 516, 16, 516]
    - [16, 43.648]
  - - [1020, 1020, 16, 1020]
    - [17, 90.956]
  - - [1024, 1024, 16, 1024]
    - [18, 92.079]
  - - [1028, 1028, 16, 1028]
    - [19, 77.204]
  - - [2044, 2044, 16, 2044]
    - [20, 97.048]
  - - [2048, 2048, 16, 2048]
    - [21, 97.142]
  - - [2052, 2052, 16, 2052]
    - [20, 88.216]
  - - [4092, 2044, 16, 2044]
    - [22, 97.718]
  - - [4096, 2048, 16, 2048]
    - [23, 97.666]
  - - [4100, 2052, 16, 2052]
    - [24, 91.84]
  - - [64, 1, 1000, 64]
    - [25, 0.494]
  - - [1, 64, 1000, 64]
    - [26, 0.497]
  - - [31, 31, 1000, 31]
    - [27, 3.718]
  - - [33, 33, 1000, 33]
    - [28, 3.619]
  - - [47, 47, 1000, 47]
    - [29, 8.34]
  - - [49, 49, 1000, 49]
    - [30, 9.222]
  - - [63, 63, 128, 63]
    - [31, 5.308]
  - - [65, 65, 128, 65]
    - [32, 4.785]
  - - [79, 79, 128, 79]
    - [33, 7.644]
  - - [81, 81, 128, 81]
    - [34, 7.824]
  - - [95, 95, 64, 95]
    - [35, 8.136]
  - - [97, 97, 64, 97]
    - [36, 8.059]
  - - [127, 127, 64, 127]
    - [37, 14.483]
  - - [129, 129, 64, 129]
    - [38, 13.377]
  - - [255, 255, 16, 255]
    - [39, 23.222]
  - - [257, 257, 16, 257]
    - [40, 21.789]
  - - [30, 30, 1000, 30]
    - [41, 4.023]
  - - [32, 32, 1000, 32]
    - [42, 4.93]
  - - [34, 34, 1000, 34]
    - [41, 4.479]
  - - [46, 46, 1000, 46]
    - [43, 8.593]
  - - [48, 48, 1000, 48]
    - [44, 11.211]
  - - [50, 50, 1000, 50]
    - [45, 10.041]
  - - [62, 62, 128, 62]
    - [46, 5.505]
  - - [64, 64, 128, 64]
    - [47, 6.555]
  - - [66, 66, 128, 66]
    - [48, 5.303]
  - - [78, 78, 128, 78]
    - [49, 7.936]
  - - [80, 80, 128, 80]
    - [50, 9.228]
  - - [82, 82, 128, 82]
    - [51, 8.827]
  - - [94, 94, 64, 94]
    - [52, 8.43]
  - - [96, 96, 64, 96]
    - [53, 9.679]
  - - [98, 98, 64, 98]
    - [54, 8.66]
  - - [126, 126, 64, 126]
    - [55, 15.121]
  - - [128, 128, 64, 128]
    - [56, 17.425]
  - - [130, 130, 64, 130]
    - [57, 14.396]
  - - [254, 254, 16, 254]
    - [51, 22.691]
  - - [256, 256, 16, 256]
    - [58, 26.429]
  - - [258, 258, 16, 258]
    - [59, 19.753]
  - - [64, 1536, 256, 1536]
    - [60, 83.468]
- null
- null
- DeviceEfficiency
