library/src/blas3/Tensile/Logic/asm_full/aquavanjaram942/aquavanjaram942_Cijk_Alik_Bjlk_BSS_BH.yaml
- {MinimumRequiredVersion: 4.36.0}
- aquavanjaram942
- gfx942
- [Device 0049, Device 0050]
    SolutionIndex: 0
    SolutionNameMin: Cijk_Alik_Bjlk_BSS_BH_MT256x256x32_MI32x32x8x1_SN_FL1_NTA0_NTB0_NTC2_NTD0_SU0_SUS0_SPO0_WGM18
    SolutionIndex: 1
    SolutionNameMin: Cijk_Alik_Bjlk_BSS_BH_MT256x256x32_MI32x32x8x1_SN_FL2_NTA0_NTB0_NTC2_NTD3_SU0_SUS0_SPO0_WGM6
    SolutionIndex: 2
    SolutionNameMin: Cijk_Alik_Bjlk_BSS_BH_MT256x256x32_MI32x32x8x1_SN_FL1_NTA0_NTB0_NTC3_NTD2_SU0_SUS0_SPO0_WGM6
    SolutionIndex: 3
    SolutionNameMin: Cijk_Alik_Bjlk_BSS_BH_MT256x256x32_MI32x32x8x1_SN_FL1_NTA1_NTB0_NTC2_NTD0_SU0_SUS0_SPO0_WGM6
    SolutionIndex: 4
    SolutionNameMin: Cijk_Alik_Bjlk_BSS_BH_MT256x256x32_MI32x32x8x1_SN_FL2_NTA1_NTB0_NTC3_NTD0_SU0_SUS0_SPO0_WGM6
    SolutionIndex: 5
    SolutionNameMin: Cijk_Alik_Bjlk_BSS_BH_MT256x256x32_MI32x32x8x1_SN_FL2_NTA0_NTB1_NTC2_NTD3_SU0_SUS0_SPO0_WGM19
    SolutionIndex: 6
    SolutionNameMin: Cijk_Alik_Bjlk_BSS_BH_MT256x256x32_MI32x32x8x1_SN_FL2_NTA0_NTB1_NTC2_NTD3_SU0_SUS0_SPO0_WGM20
    SolutionIndex: 7
    SolutionNameMin: Cijk_Alik_Bjlk_BSS_BH_MT256x256x32_MI32x32x8x1_SN_FL1_NTA0_NTB1_NTC3_NTD3_SU0_SUS0_SPO0_WGM19
    SolutionIndex: 8
    SolutionNameMin: Cijk_Alik_Bjlk_BSS_BH_MT256x256x32_MI32x32x8x1_SN_FL2_NTA1_NTB1_NTC2_NTD3_SU0_SUS0_SPO0_WGM6
    SolutionIndex: 9
    SolutionNameMin: Cijk_Alik_Bjlk_BSS_BH_MT256x256x32_MI16x16x16x1_SN_1LDSB1_AMAS3_LBSPPA256_LBSPPB2048_LPA4_LPB16_NEPBS8_SU8_SUS256_SPO1_SSO0_SVW4_VW4_WSGRB1_WGM12
    SolutionIndex: 10
    SolutionNameMin: Cijk_Alik_Bjlk_BSS_BH_MT256x256x32_MI16x16x16x1_SN_1LDSB1_AMAS3_LBSPPA256_LBSPPB2048_LPA4_LPB16_NEPBS0_SU4_SUS256_SPO0_SSO0_SVW4_VW4_WSGRB0_WGM24
    SolutionIndex: 11
    SolutionNameMin: Cijk_Alik_Bjlk_BSS_BH_MT256x256x32_MI16x16x16x1_SN_1LDSB1_AMAS3_LBSPPA256_LBSPPB2048_LPA4_LPB16_NEPBS8_SU4_SUS256_SPO0_SSO0_SVW4_VW4_WSGRB0_WGM12
    SolutionIndex: 12
    SolutionNameMin: Cijk_Alik_Bjlk_BSS_BH_MT256x256x32_MI16x16x16x1_SN_1LDSB1_AMAS3_LBSPPA256_LBSPPB2048_LPA4_LPB16_NEPBS8_SU4_SUS256_SPO0_SSO8_SVW4_VW4_WSGRB1_WGM12
    SolutionIndex: 13
    SolutionNameMin: Cijk_Alik_Bjlk_BSS_BH_MT256x256x32_MI16x16x16x1_SN_1LDSB1_AMAS3_LBSPPA256_LBSPPB2048_LPA4_LPB16_NEPBS8_SU32_SUS256_SPO0_SSO0_SVW4_VW4_WSGRB0_WGM18
    SolutionIndex: 14
    SolutionNameMin: Cijk_Alik_Bjlk_BSS_BH_MT256x256x32_MI16x16x16x1_SN_1LDSB1_AMAS3_LBSPPA256_LBSPPB2048_LPA4_LPB16_NEPBS8_SU4_SUS256_SPO0_SSO0_SVW4_VW4_WSGRB0_WGM18
    SolutionIndex: 15
    SolutionNameMin: Cijk_Alik_Bjlk_BSS_BH_MT256x256x32_MI16x16x16x1_SN_1LDSB1_AMAS3_LBSPPA256_LBSPPB2048_LPA4_LPB16_NEPBS8_SU4_SUS256_SPO0_SSO8_SVW4_VW4_WSGRB0_WGM18
- - - [6144, 4864, 1, 4096]
    - [14, 79.74]
  - - [6144, 4864, 1, 8192]
    - [14, 81.25]
  - - [6144, 4864, 1, 16384]
    - [5, 66.794]
  - - [6144, 4864, 1, 4352]
    - [8, 63.751]
  - - [6144, 4864, 1, 8448]
    - [4, 67.413]
  - - [6144, 4864, 1, 16640]
    - [7, 64.118]
  - - [4864, 3072, 1, 4096]
    - [8, 62.469]
  - - [4864, 3072, 1, 8192]
    - [0, 69.083]
  - - [4864, 3072, 1, 16384]
    - [1, 66.412]
  - - [4864, 3072, 1, 4352]
    - [2, 62.641]
  - - [4864, 3072, 1, 8448]
    - [3, 68.213]
  - - [4864, 3072, 1, 16640]
    - [6, 64.374]
  - - [4864, 6144, 1, 2048]
    - [9, 67.45]
  - - [4864, 6144, 1, 4096]
    - [10, 77.35]
  - - [4864, 6144, 1, 6144]
    - [11, 82.6]
  - - [4864, 6144, 1, 8192]
    - [12, 83.29]
  - - [6144, 4864, 1, 2048]
    - [13, 69.35]
  - - [6144, 4864, 1, 6144]
    - [15, 80.9]
- null
- null
- DeviceEfficiency
