library/src/blas3/Tensile/Logic/asm_full/aquavanjaram942/aquavanjaram942_Cijk_Ailk_Bjlk_HSS_BH.yaml
- {MinimumRequiredVersion: 4.36.0}
- aquavanjaram942
- gfx942
- [Device 0049, Device 0050]
    SolutionIndex: 0
    SolutionNameMin: Cijk_Ailk_Bjlk_HSS_BH_MT256x128x16_MI32x32x8x1_SN_AMAS0_MIAV0_NTA0_NTB0_NTC2_NTD1_SVW1_VW1_WSGRA1_WSGRB1_WGM6
    SolutionIndex: 1
    SolutionNameMin: Cijk_Ailk_Bjlk_HSS_BH_MT256x128x16_MI32x32x8x1_SN_AMAS3_MIAV0_NTA1_NTB0_NTC3_NTD2_SVW2_VW2_WSGRA0_WSGRB0_WGM12
    SolutionIndex: 2
    SolutionNameMin: Cijk_Ailk_Bjlk_HSS_BH_MT256x128x16_MI32x32x8x1_SN_AMAS3_MIAV1_NTA0_NTB0_NTC3_NTD1_SVW2_VW2_WSGRA0_WSGRB0_WGM6
    SolutionIndex: 3
    SolutionNameMin: Cijk_Ailk_Bjlk_HSS_BH_MT256x128x16_MI32x32x8x1_SN_AMAS0_MIAV1_NTA0_NTB1_NTC2_NTD3_SVW1_VW1_WSGRA1_WSGRB1_WGM12
    SolutionIndex: 4
    SolutionNameMin: Cijk_Ailk_Bjlk_HSS_BH_MT256x128x16_MI32x32x8x1_SN_AMAS3_MIAV1_NTA0_NTB1_NTC3_NTD0_SVW2_VW2_WSGRA0_WSGRB0_WGM6
    SolutionIndex: 5
    SolutionNameMin: Cijk_Ailk_Bjlk_HSS_BH_MT256x128x16_MI32x32x8x1_SN_AMAS0_MIAV1_NTA0_NTB1_NTC3_NTD0_SVW1_VW1_WSGRA1_WSGRB1_WGM6
    SolutionIndex: 6
    SolutionNameMin: Cijk_Ailk_Bjlk_HSS_BH_MT256x128x16_MI32x32x8x1_SN_AMAS0_MIAV1_NTA0_NTB1_NTC3_NTD1_SVW1_VW1_WSGRA1_WSGRB1_WGM6
    SolutionIndex: 7
    SolutionNameMin: Cijk_Ailk_Bjlk_HSS_BH_MT256x128x16_MI32x32x8x1_SN_AMAS3_MIAV1_NTA1_NTB1_NTC3_NTD1_SVW2_VW2_WSGRA0_WSGRB0_WGM6
    SolutionIndex: 8
    SolutionNameMin: Cijk_Ailk_Bjlk_HSS_BH_MT256x128x16_MI32x32x8x1_SN_AMAS3_MIAV1_NTA1_NTB1_NTC3_NTD1_SVW2_VW2_WSGRA0_WSGRB0_WGM12
    SolutionIndex: 9
    SolutionNameMin: Cijk_Ailk_Bjlk_HSS_BH_MT256x256x32_MI16x16x16x1_SN_1LDSB0_NTA2_NTB0_NEPBS8_PLR1_SU0_SUS0_SPO0_SSO0_TT8_128_VFLRP0_WSGRA1_WSGRB0_WG32_8_1_WGM18
    SolutionIndex: 10
    SolutionNameMin: Cijk_Ailk_Bjlk_HSS_BH_MT256x256x32_MI16x16x16x1_SN_1LDSB0_NTA2_NTB1_NEPBS8_PLR3_SU0_SUS0_SPO0_SSO0_TT8_128_VFLRP1_WSGRA1_WSGRB0_WG32_8_1_WGM18
    SolutionIndex: 11
    SolutionNameMin: Cijk_Ailk_Bjlk_HSS_BH_MT256x256x32_MI16x16x16x1_SN_1LDSB0_NTA2_NTB0_NEPBS4_PLR1_SU0_SUS0_SPO0_SSO0_TT8_128_VFLRP0_WSGRA1_WSGRB0_WG32_8_1_WGM6
    SolutionIndex: 12
    SolutionNameMin: Cijk_Ailk_Bjlk_HSS_BH_MT256x256x32_MI32x32x8x1_SN_1LDSB1_AMAS3_CLR1_GRVW8_LBSPPA0_LBSPPB0_LPA0_LPB0_PLR5_SU0_SUS0_SVW2_TT4_128_VW2_VFLRP1_WG64_4_1_WGM6
    SolutionIndex: 13
    SolutionNameMin: Cijk_Ailk_Bjlk_HSS_BH_MT256x256x32_MI32x32x8x1_SN_1LDSB1_AMAS3_CLR1_GRVW8_LBSPPA0_LBSPPB0_LPA0_LPB0_PLR5_SU0_SUS0_SVW2_TT4_128_VW2_VFLRP1_WG64_4_1_WGM12
    SolutionIndex: 14
    SolutionNameMin: Cijk_Ailk_Bjlk_HSS_BH_MT256x256x16_MI32x32x8x1_SN_1LDSB0_AMAS3_CLR1_GRVW4_LBSPPA0_LBSPPB0_LPA0_LPB0_PLR3_SU0_SUS0_SVW4_TT4_128_VW4_VFLRP1_WG64_4_1_WGM18
    SolutionIndex: 15
    SolutionNameMin: Cijk_Ailk_Bjlk_HSS_BH_MT256x256x32_MI32x32x8x1_SN_1LDSB1_AMAS3_CLR0_GRVW8_LBSPPA0_LBSPPB0_LPA0_LPB0_PLR5_SU0_SUS0_SVW2_TT4_128_VW2_VFLRP1_WG64_4_1_WGM6
    SolutionIndex: 16
    SolutionNameMin: Cijk_Ailk_Bjlk_HSS_BH_MT256x256x32_MI16x16x16x1_SN_1LDSB1_ELFLR0_GLS1_LBSPPA2048_LBSPPB2048_LPA32_LPB16_NEPBS0_NLCA2_NLCB2_PLR3_SPO0_TT8_128_WSGRA0_WSGRB1_WG32_8_1_WGM30
    SolutionIndex: 17
    SolutionNameMin: Cijk_Ailk_Bjlk_HSS_BH_MT256x256x32_MI16x16x16x1_SN_1LDSB1_ELFLR0_GLS0_LBSPPA2048_LBSPPB2048_LPA32_LPB16_NEPBS8_NLCA2_NLCB1_PLR3_SPO0_TT8_128_WSGRA1_WSGRB0_WG32_8_1_WGM30
    SolutionIndex: 18
    SolutionNameMin: Cijk_Ailk_Bjlk_HSS_BH_MT256x256x32_MI16x16x16x1_SN_1LDSB1_ELFLR0_GLS0_LBSPPA2048_LBSPPB2048_LPA32_LPB16_NEPBS8_NLCA2_NLCB1_PLR3_SPO0_TT8_128_WSGRA0_WSGRB1_WG32_8_1_WGM30
    SolutionIndex: 19
    SolutionNameMin: Cijk_Ailk_Bjlk_HSS_BH_MT256x256x32_MI16x16x16x1_SN_1LDSB1_ELFLR0_GLS0_LBSPPA2048_LBSPPB2048_LPA32_LPB16_NEPBS16_NLCA1_NLCB1_PLR3_SPO0_TT8_128_WSGRA0_WSGRB0_WG32_8_1_WGM18
    SolutionIndex: 20
    SolutionNameMin: Cijk_Ailk_Bjlk_HSS_BH_MT256x256x32_MI16x16x16x1_SN_1LDSB1_ELFLR0_GLS0_LBSPPA2048_LBSPPB2048_LPA32_LPB16_NEPBS8_NLCA1_NLCB1_PLR3_SPO1_TT8_128_WSGRA0_WSGRB1_WG32_8_1_WGM18
    SolutionIndex: 21
    SolutionNameMin: Cijk_Ailk_Bjlk_HSS_BH_MT256x256x32_MI16x16x16x1_SN_1LDSB1_ELFLR0_GLS0_LBSPPA2048_LBSPPB2048_LPA32_LPB16_NEPBS8_NLCA1_NLCB1_PLR3_SPO1_TT8_128_WSGRA0_WSGRB0_WG32_8_1_WGM18
    SolutionIndex: 22
    SolutionNameMin: Cijk_Ailk_Bjlk_HSS_BH_MT256x256x32_MI16x16x16x1_SN_1LDSB1_ELFLR0_GLS1_LBSPPA2048_LBSPPB2048_LPA32_LPB16_NEPBS16_NLCA2_NLCB1_PLR3_SPO0_TT8_128_WSGRA1_WSGRB0_WG32_8_1_WGM18
    SolutionIndex: 23
    SolutionNameMin: Cijk_Ailk_Bjlk_HSS_BH_MT256x256x32_MI32x32x8x1_SN_
    SolutionIndex: 24
    SolutionNameMin: Cijk_Ailk_Bjlk_HSS_BH_MT256x256x32_MI16x16x16x1_SN_EMLL2_LBSPPA0_LBSPPB2048_LPA0_SPO1_SVW4_TT8_128_VW4_WG32_8_1_WGM18
    SolutionIndex: 25
    SolutionNameMin: Cijk_Ailk_Bjlk_HSS_BH_MT256x256x32_MI16x16x16x1_SN_EMLL0_LBSPPA2048_LBSPPB2048_LPA32_SPO0_SVW2_TT8_128_VW2_WG32_8_1_WGM18
    SolutionIndex: 26
    SolutionNameMin: Cijk_Ailk_Bjlk_HSS_BH_MT256x256x32_MI16x16x16x1_SN_EMLL0_LBSPPA0_LBSPPB2048_LPA0_SPO1_SVW4_TT4_256_VW4_WG64_4_1_WGM18
    SolutionIndex: 27
    SolutionNameMin: Cijk_Ailk_Bjlk_HSS_BH_MT256x256x32_MI16x16x16x1_SN_EMLL2_LBSPPA2048_LBSPPB2048_LPA32_SPO1_SVW2_TT8_128_VW2_WG32_8_1_WGM18
    SolutionIndex: 28
    SolutionNameMin: Cijk_Ailk_Bjlk_HSS_BH_MT256x256x32_MI16x16x16x1_SN_EMLL0_LBSPPA0_LBSPPB2048_LPA0_SPO1_SVW4_TT8_128_VW4_WG32_8_1_WGM18
    SolutionIndex: 29
    SolutionNameMin: Cijk_Ailk_Bjlk_HSS_BH_MT256x256x32_MI16x16x16x1_SN_EMLL0_LBSPPA0_LBSPPB2048_LPA0_SPO0_SVW4_TT8_128_VW4_WG32_8_1_WGM24
    SolutionIndex: 30
    SolutionNameMin: Cijk_Ailk_Bjlk_HSS_BH_MT256x256x32_MI16x16x16x1_SN_EMLL0_LBSPPA2048_LBSPPB2048_LPA32_SPO0_SVW2_TT4_256_VW2_WG64_4_1_WGM24
    SolutionIndex: 31
    SolutionNameMin: Cijk_Ailk_Bjlk_HSS_BH_MT256x256x32_MI16x16x16x1_SN_EMLL2_LBSPPA2048_LBSPPB2048_LPA32_SPO0_SVW2_TT8_128_VW2_WG32_8_1_WGM18
    SolutionIndex: 32
    SolutionNameMin: Cijk_Ailk_Bjlk_HSS_BH_MT256x256x32_MI16x16x16x1_SN_EMLL0_LBSPPA2048_LBSPPB2048_LPA32_SPO1_SVW2_TT8_128_VW2_WG32_8_1_WGM24
    SolutionIndex: 33
    SolutionNameMin: Cijk_Ailk_Bjlk_HSS_BH_MT256x128x32_MI16x16x16x1_SN_EMLL2_LBSPPA0_LBSPPB1024_LPA0_SPO1_SVW4_TT4_128_VW4_WG64_4_1_WGM24
    SolutionIndex: 34
    SolutionNameMin: Cijk_Ailk_Bjlk_HSS_BH_MT128x256x32_MI16x16x16x1_SN_EMLL0_LBSPPA0_LBSPPB2048_LPA0_SPO1_SVW4_TT8_64_VW4_WG16_16_1_WGM18
    SolutionIndex: 35
    SolutionNameMin: Cijk_Ailk_Bjlk_HSS_BH_MT256x128x32_MI16x16x16x1_SN_EMLL2_LBSPPA2048_LBSPPB1024_LPA32_SPO1_SVW2_TT4_128_VW2_WG64_4_1_WGM24
    SolutionIndex: 36
    SolutionNameMin: Cijk_Ailk_Bjlk_HSS_BH_MT256x128x32_MI16x16x16x1_SN_EMLL2_LBSPPA0_LBSPPB1024_LPA0_SPO1_SVW4_TT4_128_VW4_WG64_4_1_WGM18
    SolutionIndex: 37
    SolutionNameMin: Cijk_Ailk_Bjlk_HSS_BH_MT256x128x32_MI16x16x16x1_SN_EMLL0_LBSPPA0_LBSPPB1024_LPA0_SPO0_SVW4_TT4_128_VW4_WG64_4_1_WGM18
    SolutionIndex: 38
    SolutionNameMin: Cijk_Ailk_Bjlk_HSS_BH_MT256x128x32_MI16x16x16x1_SN_EMLL2_LBSPPA2048_LBSPPB1024_LPA32_SPO1_SVW2_TT4_128_VW2_WG64_4_1_WGM18
    SolutionIndex: 39
    SolutionNameMin: Cijk_Ailk_Bjlk_HSS_BH_MT128x256x32_MI16x16x16x1_SN_EMLL0_LBSPPA0_LBSPPB2048_LPA0_SPO0_SVW4_TT8_64_VW4_WG16_16_1_WGM18
    SolutionIndex: 40
    SolutionNameMin: Cijk_Ailk_Bjlk_HSS_BH_MT128x256x32_MI16x16x16x1_SN_EMLL0_LBSPPA0_LBSPPB2048_LPA0_SPO0_SVW4_TT8_64_VW4_WG16_16_1_WGM24
    SolutionIndex: 41
    SolutionNameMin: Cijk_Ailk_Bjlk_HSS_BH_MT128x256x32_MI16x16x16x1_SN_EMLL2_LBSPPA1024_LBSPPB2048_LPA32_SPO1_SVW2_TT8_64_VW2_WG16_16_1_WGM18
    SolutionIndex: 42
    SolutionNameMin: Cijk_Ailk_Bjlk_HSS_BH_MT256x256x32_MI16x16x16x1_SN_EMLL0_LBSPPA2048_LBSPPB2048_LPA32_SPO0_SVW2_TT8_128_VW2_WG32_8_1_WGM1
    SolutionIndex: 43
    SolutionNameMin: Cijk_Ailk_Bjlk_HSS_BH_MT256x256x32_MI16x16x16x1_SN_EMLL0_LBSPPA0_LBSPPB2048_LPA0_SPO1_SVW4_TT4_256_VW4_WG64_4_1_WGM24
    SolutionIndex: 44
    SolutionNameMin: Cijk_Ailk_Bjlk_HSS_BH_MT256x256x32_MI16x16x16x1_SN_EMLL0_LBSPPA2048_LBSPPB2048_LPA32_SPO1_SVW2_TT8_128_VW2_WG32_8_1_WGM18
    SolutionIndex: 45
    SolutionNameMin: Cijk_Ailk_Bjlk_HSS_BH_MT128x256x32_MI16x16x16x1_SN_EMLL2_LBSPPA0_LBSPPB2048_LPA0_SPO1_SVW4_TT8_64_VW4_WG16_16_1_WGM18
    SolutionIndex: 46
    SolutionNameMin: Cijk_Ailk_Bjlk_HSS_BH_MT256x256x64_MI16x16x16x1_SN_SPO1
    SolutionIndex: 47
    SolutionNameMin: Cijk_Ailk_Bjlk_HSS_BH_MT256x128x32_MI16x16x16x1_SN_EMLL2_LBSPPA0_LBSPPB1024_LPA0_SPO0_SVW4_TT4_128_VW4_WG64_4_1_WGM18
    SolutionIndex: 48
    SolutionNameMin: Cijk_Ailk_Bjlk_HSS_BH_MT256x256x32_MI16x16x16x1_SN_EMLL0_LBSPPA2048_LBSPPB2048_LPA32_SPO0_SVW2_TT8_128_VW2_WG32_8_1_WGM24
    SolutionIndex: 49
    SolutionNameMin: Cijk_Ailk_Bjlk_HSS_BH_MT256x128x32_MI16x16x16x1_SN_EMLL2_LBSPPA0_LBSPPB1024_LPA0_SPO1_SVW4_TT4_128_VW4_WG64_4_1_WGM1
    SolutionIndex: 50
    SolutionNameMin: Cijk_Ailk_Bjlk_HSS_BH_MT256x256x32_MI16x16x16x1_SN_EMLL0_LBSPPA0_LBSPPB2048_LPA0_SPO1_SVW4_TT8_128_VW4_WG32_8_1_WGM1
    SolutionIndex: 51
    SolutionNameMin: Cijk_Ailk_Bjlk_HSS_BH_MT256x256x32_MI16x16x16x1_SN_EMLL0_LBSPPA0_LBSPPB2048_LPA0_SPO0_SVW4_TT8_128_VW4_WG32_8_1_WGM18
    SolutionIndex: 52
    SolutionNameMin: Cijk_Ailk_Bjlk_HSS_BH_MT256x256x32_MI16x16x16x1_SN_EMLL0_LBSPPA0_LBSPPB2048_LPA0_SPO1_SVW4_TT8_128_VW4_WG32_8_1_WGM24
    SolutionIndex: 53
    SolutionNameMin: Cijk_Ailk_Bjlk_HSS_BH_MT256x256x32_MI16x16x16x1_SN_EMLL0_LBSPPA0_LBSPPB2048_LPA0_SPO1_SVW4_TT8_128_VW4_WG32_8_1_WGM24
    SolutionIndex: 54
    SolutionNameMin: Cijk_Ailk_Bjlk_HSS_BH_MT256x256x32_MI16x16x16x1_SN_EMLL0_LBSPPA0_LBSPPB2048_LPA0_SPO1_SVW4_TT8_128_VW4_WG32_8_1_WGM36
    SolutionIndex: 55
    SolutionNameMin: Cijk_Ailk_Bjlk_HSS_BH_MT256x256x32_MI16x16x16x1_SN_EMLL0_LBSPPA2048_LBSPPB2048_LPA32_SPO1_SVW2_TT8_128_VW2_WG32_8_1_WGM24
    SolutionIndex: 56
    SolutionNameMin: Cijk_Ailk_Bjlk_HSS_BH_MT256x256x32_MI16x16x16x1_SN_EMLL0_LBSPPA0_LBSPPB2048_LPA0_SPO0_SVW4_TT8_128_VW4_WG32_8_1_WGM36
    SolutionIndex: 57
    SolutionNameMin: Cijk_Ailk_Bjlk_HSS_BH_MT256x256x32_MI16x16x16x1_SN_EMLL0_LBSPPA0_LBSPPB2048_LPA0_SPO0_SVW4_TT8_128_VW4_WG32_8_1_WGM24
    SolutionIndex: 58
    SolutionNameMin: Cijk_Ailk_Bjlk_HSS_BH_MT256x256x32_MI16x16x16x1_SN_EMLL0_LBSPPA2048_LBSPPB2048_LPA32_SPO1_SVW2_TT8_128_VW2_WG32_8_1_WGM18
    SolutionIndex: 59
    SolutionNameMin: Cijk_Ailk_Bjlk_HSS_BH_MT256x256x32_MI16x16x16x1_SN_EMLL0_LBSPPA0_LBSPPB2048_LPA0_SPO0_SVW4_TT8_128_VW4_WG32_8_1_WGM18
    SolutionIndex: 60
    SolutionNameMin: Cijk_Ailk_Bjlk_HSS_BH_MT256x256x32_MI16x16x16x1_SN_EMLL2_LBSPPA2048_LBSPPB2048_LPA32_SPO0_SVW2_TT16_64_VW2_WG16_16_1_WGM36
    SolutionIndex: 61
    SolutionNameMin: Cijk_Ailk_Bjlk_HSS_BH_MT256x256x32_MI16x16x16x1_SN_EMLL0_LBSPPA0_LBSPPB2048_LPA0_SPO0_SVW4_TT16_64_VW4_WG16_16_1_WGM24
    SolutionIndex: 62
    SolutionNameMin: Cijk_Ailk_Bjlk_HSS_BH_MT256x256x32_MI16x16x16x1_SN_EMLL0_LBSPPA0_LBSPPB2048_LPA0_SPO0_SVW4_TT16_64_VW4_WG16_16_1_WGM18
    SolutionIndex: 63
    SolutionNameMin: Cijk_Ailk_Bjlk_HSS_BH_MT256x256x32_MI16x16x16x1_SN_EMLL2_LBSPPA2048_LBSPPB2048_LPA32_SPO1_SVW2_TT8_128_VW2_WG32_8_1_WGM18
    SolutionIndex: 64
    SolutionNameMin: Cijk_Ailk_Bjlk_HSS_BH_MT256x256x32_MI16x16x16x1_SN_EMLL0_LBSPPA0_LBSPPB2048_LPA0_SPO1_SVW4_TT8_128_VW4_WG32_8_1_WGM18
    SolutionIndex: 65
    SolutionNameMin: Cijk_Ailk_Bjlk_HSS_BH_MT256x256x32_MI16x16x16x1_SN_EMLL2_LBSPPA0_LBSPPB2048_LPA0_SPO1_SVW4_TT8_128_VW4_WG32_8_1_WGM36
    SolutionIndex: 66
    SolutionNameMin: Cijk_Ailk_Bjlk_HSS_BH_MT256x256x32_MI16x16x16x1_SN_EMLL2_LBSPPA0_LBSPPB2048_LPA0_SPO0_SVW4_TT8_128_VW4_WG32_8_1_WGM36
- - - [6144, 4864, 1, 4096]
    - [20, 74.69]
  - - [6144, 4864, 1, 8192]
    - [22, 80.17]
  - - [6144, 4864, 1, 16384]
    - [4, 80.65]
  - - [6144, 4864, 1, 4352]
    - [5, 71.338]
  - - [6144, 4864, 1, 8448]
    - [8, 76.934]
  - - [6144, 4864, 1, 16640]
    - [7, 80.675]
  - - [4864, 3072, 1, 4096]
    - [6, 69.898]
  - - [4864, 3072, 1, 8192]
    - [13, 85.54]
  - - [4864, 3072, 1, 16384]
    - [2, 80.164]
  - - [4864, 3072, 1, 4352]
    - [3, 70.598]
  - - [4864, 3072, 1, 8448]
    - [0, 76.604]
  - - [4864, 3072, 1, 16640]
    - [1, 80.275]
  - - [4864, 3072, 1, 2048]
    - [9, 66.66]
  - - [3072, 4864, 1, 4096]
    - [10, 72.47]
  - - [3072, 4864, 1, 2048]
    - [11, 66.34]
  - - [4864, 3072, 1, 6144]
    - [12, 84.04]
  - - [3072, 4864, 1, 6144]
    - [14, 81.1]
  - - [3072, 4864, 1, 8192]
    - [15, 84.26]
  - - [4864, 6144, 1, 4096]
    - [16, 74.48]
  - - [4864, 6144, 1, 6144]
    - [17, 78.48]
  - - [4864, 6144, 1, 8192]
    - [18, 79.67]
  - - [6144, 4864, 1, 2048]
    - [19, 66.82]
  - - [6144, 4864, 1, 6144]
    - [21, 78.02]
  - - [4864, 6144, 1, 2048]
    - [23, 66.2]
  - - [87040, 2560, 1, 2560]
    - [24, 75.674]
  - - [84480, 2560, 1, 2560]
    - [25, 68.58]
  - - [81920, 2560, 1, 2560]
    - [26, 67.889]
  - - [79360, 2560, 1, 2560]
    - [27, 66.988]
  - - [76800, 2560, 1, 2560]
    - [28, 67.818]
  - - [74240, 2560, 1, 2560]
    - [29, 69.552]
  - - [71680, 2560, 1, 2560]
    - [30, 66.585]
  - - [69120, 2560, 1, 2560]
    - [31, 67.385]
  - - [66560, 2560, 1, 2560]
    - [25, 67.337]
  - - [64000, 2560, 1, 2560]
    - [32, 70.367]
  - - [61440, 2560, 1, 2560]
    - [33, 79.426]
  - - [58880, 2560, 1, 2560]
    - [34, 72.727]
  - - [56320, 2560, 1, 2560]
    - [35, 78.372]
  - - [53760, 2560, 1, 2560]
    - [36, 79.032]
  - - [51200, 2560, 1, 2560]
    - [37, 77.292]
  - - [48640, 2560, 1, 2560]
    - [38, 78.42]
  - - [46080, 2560, 1, 2560]
    - [35, 79.646]
  - - [43520, 2560, 1, 2560]
    - [39, 76.624]
  - - [40960, 2560, 1, 2560]
    - [40, 74.992]
  - - [38400, 2560, 1, 2560]
    - [41, 76.989]
  - - [35840, 2560, 1, 2560]
    - [34, 79.834]
  - - [33280, 2560, 1, 2560]
    - [34, 79.906]
  - - [30720, 2560, 1, 2560]
    - [40, 79.267]
  - - [28160, 2560, 1, 2560]
    - [41, 78.519]
  - - [25600, 2560, 1, 2560]
    - [42, 60.891]
  - - [23040, 2560, 1, 2560]
    - [43, 68.048]
  - - [20480, 2560, 1, 2560]
    - [44, 61.641]
  - - [17920, 2560, 1, 2560]
    - [45, 68.994]
  - - [15360, 2560, 1, 2560]
    - [46, 63.2]
  - - [12800, 2560, 1, 2560]
    - [47, 69.619]
  - - [10240, 2560, 1, 2560]
    - [48, 64.859]
  - - [7680, 2560, 1, 2560]
    - [49, 74.322]
  - - [5120, 2560, 1, 2560]
    - [50, 72.934]
  - - [176640, 2560, 1, 2560]
    - [51, 71.567]
  - - [171520, 2560, 1, 2560]
    - [52, 67.699]
  - - [166400, 2560, 1, 2560]
    - [51, 66.352]
  - - [161280, 2560, 1, 2560]
    - [51, 68.004]
  - - [156160, 2560, 1, 2560]
    - [44, 66.716]
  - - [151040, 2560, 1, 2560]
    - [48, 66.998]
  - - [145920, 2560, 1, 2560]
    - [32, 67.719]
  - - [140800, 2560, 1, 2560]
    - [28, 66.506]
  - - [135680, 2560, 1, 2560]
    - [28, 66.117]
  - - [130560, 2560, 1, 2560]
    - [28, 66.086]
  - - [125440, 2560, 1, 2560]
    - [29, 65.418]
  - - [120320, 2560, 1, 2560]
    - [44, 65.846]
  - - [115200, 2560, 1, 2560]
    - [44, 66.334]
  - - [110080, 2560, 1, 2560]
    - [32, 67.144]
  - - [104960, 2560, 1, 2560]
    - [44, 67.548]
  - - [99840, 2560, 1, 2560]
    - [48, 65.469]
  - - [94720, 2560, 1, 2560]
    - [52, 64.491]
  - - [89600, 2560, 1, 2560]
    - [48, 65.64]
  - - [122880, 2560, 1, 2560]
    - [27, 71.237]
  - - [117760, 2560, 1, 2560]
    - [28, 70.468]
  - - [112640, 2560, 1, 2560]
    - [25, 69.243]
  - - [107520, 2560, 1, 2560]
    - [25, 69.353]
  - - [102400, 2560, 1, 2560]
    - [48, 69.674]
  - - [97280, 2560, 1, 2560]
    - [44, 69.9]
  - - [92160, 2560, 1, 2560]
    - [44, 70.197]
  - - [174080, 2560, 1, 2560]
    - [53, 71.992]
  - - [168960, 2560, 1, 2560]
    - [54, 72.663]
  - - [163840, 2560, 1, 2560]
    - [54, 68.952]
  - - [158720, 2560, 1, 2560]
    - [55, 68.501]
  - - [153600, 2560, 1, 2560]
    - [56, 67.651]
  - - [148480, 2560, 1, 2560]
    - [57, 67.294]
  - - [143360, 2560, 1, 2560]
    - [54, 68.224]
  - - [138240, 2560, 1, 2560]
    - [58, 67.2]
  - - [133120, 2560, 1, 2560]
    - [59, 68.068]
  - - [128000, 2560, 1, 2560]
    - [60, 64.371]
  - - [248320, 2560, 1, 2560]
    - [61, 72.438]
  - - [243200, 2560, 1, 2560]
    - [62, 73.36]
  - - [238080, 2560, 1, 2560]
    - [56, 69.97]
  - - [232960, 2560, 1, 2560]
    - [59, 69.812]
  - - [227840, 2560, 1, 2560]
    - [59, 70.09]
  - - [222720, 2560, 1, 2560]
    - [53, 69.569]
  - - [217600, 2560, 1, 2560]
    - [56, 70.329]
  - - [212480, 2560, 1, 2560]
    - [63, 67.031]
  - - [207360, 2560, 1, 2560]
    - [64, 69.018]
  - - [202240, 2560, 1, 2560]
    - [65, 65.661]
  - - [197120, 2560, 1, 2560]
    - [64, 68.603]
  - - [192000, 2560, 1, 2560]
    - [59, 69.158]
  - - [186880, 2560, 1, 2560]
    - [59, 69.451]
  - - [181760, 2560, 1, 2560]
    - [61, 68.491]
  - - [245760, 2560, 1, 2560]
    - [66, 66.652]
  - - [240640, 2560, 1, 2560]
    - [59, 70.816]
  - - [235520, 2560, 1, 2560]
    - [59, 70.394]
  - - [230400, 2560, 1, 2560]
    - [59, 70.357]
  - - [225280, 2560, 1, 2560]
    - [54, 69.731]
  - - [220160, 2560, 1, 2560]
    - [64, 70.121]
  - - [215040, 2560, 1, 2560]
    - [54, 69.798]
  - - [209920, 2560, 1, 2560]
    - [59, 69.675]
  - - [204800, 2560, 1, 2560]
    - [54, 70.009]
  - - [199680, 2560, 1, 2560]
    - [64, 69.679]
  - - [194560, 2560, 1, 2560]
    - [63, 66.854]
  - - [189440, 2560, 1, 2560]
    - [64, 69.343]
  - - [184320, 2560, 1, 2560]
    - [53, 68.897]
  - - [179200, 2560, 1, 2560]
    - [53, 68.443]
- null
- null
- DeviceEfficiency
