library/src/blas3/Tensile/Logic/asm_full/aquavanjaram942/aquavanjaram942_Cijk_Alik_Bjlk_SB_MX.yaml
- {MinimumRequiredVersion: 4.40.0}
- aquavanjaram942
- gfx942
- [Device 0049, Device 0050]
    SolutionIndex: 0
    SolutionNameMin: Cijk_Alik_Bjlk_SB_MX_MT192x256x32_MI32x32x4x1_SN_ASGT3128_GLS0_LBSPPA128_LPA4_NLCB1_SU8_SUS256_SSO2_TT3_128_WG64_4_1_WGM12
    SolutionIndex: 1
    SolutionNameMin: Cijk_Alik_Bjlk_SB_MX_MT192x256x32_MI32x32x4x1_SN_ASGT_GLS0_LBSPPA128_LPA4_NLCB1_SU0_SUS0_SSO6_TT3_128_WG64_4_1_WGM12
    SolutionIndex: 2
    SolutionNameMin: Cijk_Alik_Bjlk_SB_MX_MT192x256x32_MI32x32x4x1_SN_ASGT3128_GLS0_LBSPPA128_LPA4_NLCB1_SU0_SUS0_SSO6_TT3_128_WG64_4_1_WGM12
    SolutionIndex: 3
    SolutionNameMin: Cijk_Alik_Bjlk_SB_MX_MT192x256x32_MI32x32x4x1_SN_ASGT_GLS0_LBSPPA128_LPA4_NLCB1_SU0_SUS0_SSO6_TT3_128_WG64_4_1_WGM18
    SolutionIndex: 4
    SolutionNameMin: Cijk_Alik_Bjlk_SB_MX_MT224x256x32_MI32x32x4x1_SN_ASGT3128_GLS0_LBSPPA128_LPA4_NLCB1_SU0_SUS0_SSO6_TT7_64_WG32_8_1_WGM36
    SolutionIndex: 5
    SolutionNameMin: Cijk_Alik_Bjlk_SB_MX_MT192x256x32_MI32x32x4x1_SN_ASGT_GLS0_LBSPPA128_LPA4_NLCB1_SU0_SUS0_SSO8_TT3_128_WG64_4_1_WGM6
    SolutionIndex: 6
    SolutionNameMin: Cijk_Alik_Bjlk_SB_MX_MT192x256x32_MI32x32x4x1_SN_ASGT_GLS0_LBSPPA128_LPA4_NLCB1_SU8_SUS256_SSO8_TT3_128_WG64_4_1_WGM12
    SolutionIndex: 7
    SolutionNameMin: Cijk_Alik_Bjlk_SB_MX_MT192x256x32_MI32x32x4x1_SN_ASGT_GLS0_LBSPPA128_LPA4_NLCB1_SU0_SUS0_SSO8_TT3_128_WG64_4_1_WGM18
    SolutionIndex: 8
    SolutionNameMin: Cijk_Alik_Bjlk_SB_MX_MT192x256x32_MI32x32x4x1_SN_ASGT3128_GLS0_LBSPPA128_LPA4_NLCB1_SU0_SUS0_SSO8_TT3_128_WG64_4_1_WGM18
    SolutionIndex: 9
    SolutionNameMin: Cijk_Alik_Bjlk_SB_MX_MT224x256x32_MI32x32x4x1_SN_ASGT_GLS0_LBSPPA128_LPA4_NLCB1_SU0_SUS0_SSO8_TT7_64_WG32_8_1_WGM18
    SolutionIndex: 10
    SolutionNameMin: Cijk_Alik_Bjlk_SB_MX_MT192x256x32_MI32x32x4x1_SN_ASGT_GLS1_LBSPPA128_LPA4_NLCB1_SU0_SUS0_SSO2_TT3_128_WG64_4_1_WGM12
    SolutionIndex: 11
    SolutionNameMin: Cijk_Alik_Bjlk_SB_MX_MT192x256x32_MI32x32x4x1_SN_ASGT_GLS1_LBSPPA128_LPA4_NLCB1_SU32_SUS256_SSO2_TT3_128_WG64_4_1_WGM18
    SolutionIndex: 12
    SolutionNameMin: Cijk_Alik_Bjlk_SB_MX_MT224x256x32_MI32x32x4x1_SN_ASGT_GLS1_LBSPPA128_LPA4_NLCB1_SU0_SUS0_SSO4_TT7_64_WG32_8_1_WGM36
    SolutionIndex: 13
    SolutionNameMin: Cijk_Alik_Bjlk_SB_MX_MT192x256x32_MI32x32x4x1_SN_ASGT_GLS1_LBSPPA128_LPA4_NLCB1_SU0_SUS0_SSO6_TT3_128_WG64_4_1_WGM12
    SolutionIndex: 14
    SolutionNameMin: Cijk_Alik_Bjlk_SB_MX_MT192x256x32_MI32x32x4x1_SN_ASGT_GLS1_LBSPPA128_LPA4_NLCB1_SU0_SUS0_SSO6_TT3_128_WG64_4_1_WGM18
    SolutionIndex: 15
    SolutionNameMin: Cijk_Alik_Bjlk_SB_MX_MT192x256x32_MI32x32x4x1_SN_ASGT3128_GLS1_LBSPPA128_LPA4_NLCB1_SU0_SUS0_SSO8_TT3_128_WG64_4_1_WGM18
    SolutionIndex: 16
    SolutionNameMin: Cijk_Alik_Bjlk_SB_MX_MT224x256x32_MI32x32x4x1_SN_ASGT_GLS1_LBSPPA128_LPA4_NLCB1_SU0_SUS0_SSO8_TT7_64_WG32_8_1_WGM36
    SolutionIndex: 17
    SolutionNameMin: Cijk_Alik_Bjlk_SB_MX_MT128x128x32_MI32x32x4x1_SN_1LDSB1_ASGT_GLS1_LBSPPA128_LPA4_SU32_SUS512_SSO4_TT4_32_WG32_8_1_WGM36
- - - [6144, 9728, 1, 8192]
    - [4, 44.354]
  - - [6144, 9728, 1, 8224]
    - [12, 53.156]
  - - [6144, 9728, 1, 8256]
    - [9, 48.687]
  - - [9216, 9728, 1, 8192]
    - [14, 46.801]
  - - [9216, 9728, 1, 8224]
    - [16, 55.434]
  - - [9216, 9728, 1, 8256]
    - [1, 52.516]
  - - [9216, 9728, 1, 16384]
    - [7, 47.659]
  - - [9216, 9728, 1, 16448]
    - [3, 54.028]
  - - [9216, 9728, 1, 16512]
    - [11, 45.605]
  - - [7296, 9216, 1, 4096]
    - [5, 49.739]
  - - [7296, 9216, 1, 8192]
    - [8, 47.259]
  - - [7296, 9216, 1, 8224]
    - [15, 56.14]
  - - [7296, 9216, 1, 8256]
    - [0, 53.272]
  - - [14592, 9216, 1, 4096]
    - [2, 45.82]
  - - [14592, 9216, 1, 8192]
    - [10, 47.057]
  - - [14592, 9216, 1, 8224]
    - [13, 55.511]
  - - [14592, 9216, 1, 8256]
    - [6, 53.106]
  - - [256, 256, 1, 256]
    - [17, 1.155]
- null
- null
- DeviceEfficiency
