library/src/blas3/Tensile/Logic/asm_full/aquavanjaram942/aquavanjaram942_Cijk_Alik_Bjlk_DB.yaml
- {MinimumRequiredVersion: 4.7.2}
- aquavanjaram942
- gfx942
- [Device 0049]
    SolutionIndex: 0
    SolutionNameMin: Cijk_Alik_Bjlk_DB_MT128x128x16_MI16x16x4x1_SN_AMAS3_DTVB0_GRVW1_GLS0_LPA4_LRVW2_MIAV1_NEPBS0_NLCB2_SU0_SUS0_SVW2_TT2_128_VW2_WG64_4_1_WGM18
    SolutionIndex: 1
    SolutionNameMin: Cijk_Alik_Bjlk_DB_MT128x128x16_MI16x16x4x1_SN_AMAS0_DTVB0_GRVW2_GLS1_LPA4_LRVW2_MIAV0_NEPBS0_NLCB1_SU0_SUS0_SVW1_TT8_32_VW1_WG16_16_1_WGM12
    SolutionIndex: 2
    SolutionNameMin: Cijk_Alik_Bjlk_DB_MT128x128x16_MI16x16x4x1_SN_AMAS3_DTVB0_GRVW2_GLS0_LPA4_LRVW2_MIAV1_NEPBS16_NLCB1_SU0_SUS0_SVW2_TT2_128_VW2_WG64_4_1_WGM18
    SolutionIndex: 3
    SolutionNameMin: Cijk_Alik_Bjlk_DB_MT128x128x16_MI16x16x4x1_SN_GLS0_MIAV0_NEPBS4_SU0_SUS0_WGM36
    SolutionIndex: 4
    SolutionNameMin: Cijk_Alik_Bjlk_DB_MT128x128x16_MI16x16x4x1_SN_GLS0_MIAV0_NEPBS4_SU4_SUS256_WGM30
    SolutionIndex: 5
    SolutionNameMin: Cijk_Alik_Bjlk_DB_MT128x128x16_MI16x16x4x1_SN_GLS0_MIAV0_NEPBS4_SU0_SUS0_WGM42
    SolutionIndex: 6
    SolutionNameMin: Cijk_Alik_Bjlk_DB_MT128x128x16_MI16x16x4x1_SN_GLS0_MIAV0_NEPBS2_SU0_SUS0_WGM42
    SolutionIndex: 7
    SolutionNameMin: Cijk_Alik_Bjlk_DB_MT128x128x16_MI16x16x4x1_SN_GLS0_MIAV0_NEPBS2_SU4_SUS256_WGM36
    SolutionIndex: 8
    SolutionNameMin: Cijk_Alik_Bjlk_DB_MT128x128x16_MI16x16x4x1_SN_GLS0_MIAV0_NEPBS2_SU0_SUS0_WGM24
    SolutionIndex: 9
    SolutionNameMin: Cijk_Alik_Bjlk_DB_MT128x128x16_MI16x16x4x1_SN_GLS1_MIAV0_NEPBS2_SU0_SUS0_WGM42
    SolutionIndex: 10
    SolutionNameMin: Cijk_Alik_Bjlk_DB_MT128x128x16_MI16x16x4x1_SN_GLS1_MIAV0_NEPBS2_SU0_SUS0_WGM36
    SolutionIndex: 11
    SolutionNameMin: Cijk_Alik_Bjlk_DB_MT128x128x16_MI16x16x4x1_SN_GLS1_MIAV0_NEPBS2_SU4_SUS256_WGM30
    SolutionIndex: 12
    SolutionNameMin: Cijk_Alik_Bjlk_DB_MT64x128x32_MI16x16x4x1_SN_AMAS0_DTVB0_GRVW2_GLS0_LBSPP256_LPA4_LRVW2_NEPBS0_NLCB1_PLR9_SU4_SUS256_SVW1_TT4_32_TLDS1_UMLDSA1_VW1_WG16_16_1_WGM30
    SolutionIndex: 13
    SolutionNameMin: Cijk_Alik_Bjlk_DB_MT128x64x16_MI16x16x4x1_SN_AMAS0_DTVB0_GRVW2_GLS0_LBSPP0_LPA1_LRVW1_NEPBS0_NLCB1_PLR5_SU4_SUS256_SVW1_TT4_32_TLDS0_UMLDSA0_VW1_WG32_8_1_WGM30
    SolutionIndex: 14
    SolutionNameMin: Cijk_Alik_Bjlk_DB_MT64x64x16_MI16x16x4x1_SN_AMAS0_DTVB1_GRVW1_GLS1_LBSPP128_LPA1_LRVW1_NEPBS4_NLCB1_PLR5_SU0_SUS0_SVW1_TT4_16_TLDS1_UMLDSA1_VW1_WG16_16_1_WGM30
    SolutionIndex: 15
    SolutionNameMin: Cijk_Alik_Bjlk_DB_MT64x64x16_MI16x16x4x1_SN_AMAS0_DTVB0_GRVW2_GLS1_LBSPP0_LPA1_LRVW1_NEPBS16_NLCB1_PLR5_SU4_SUS256_SVW1_TT2_32_TLDS0_UMLDSA0_VW1_WG32_8_1_WGM30
    SolutionIndex: 16
    SolutionNameMin: Cijk_Alik_Bjlk_DB_MT32x64x16_MI16x16x4x1_SN_AMAS0_DTVB0_EPS0_GRVW2_LBSPP128_LPA4_LRVW2_MIAV0_NEPBS4_NLCB1_PLR5_SU4_SUS256_SVW1_TT2_16_TLDS1_UMLDSA1_VW1_WG16_16_1_WGM30
    SolutionIndex: 17
    SolutionNameMin: Cijk_Alik_Bjlk_DB_MT64x64x16_MI16x16x4x1_SN_AMAS0_DTVB0_EPS0_GRVW2_LBSPP0_LPA1_LRVW1_MIAV1_NEPBS4_NLCB1_PLR5_SU4_SUS256_SVW1_TT2_32_TLDS0_UMLDSA0_VW1_WG32_8_1_WGM30
    SolutionIndex: 18
    SolutionNameMin: Cijk_Alik_Bjlk_DB_MT64x128x16_MI16x16x4x1_SN_AMAS0_DTVB0_EPS0_GRVW2_LBSPP0_LPA1_LRVW1_MIAV0_NEPBS1_NLCB1_PLR5_SU4_SUS256_SVW1_TT4_32_TLDS0_UMLDSA0_VW1_WG16_16_1_WGM18
    SolutionIndex: 19
    SolutionNameMin: Cijk_Alik_Bjlk_DB_MT64x32x16_MI16x16x4x1_SN_AMAS0_DTVB0_GRVW1_LBSPP128_LPA4_LRVW2_NEPBS0_NLCB1_PLR5_SVW1_TT2_16_TLDS1_UMLDSA1_VW1_WG32_8_1_WGM12
    SolutionIndex: 20
    SolutionNameMin: Cijk_Alik_Bjlk_DB_MT32x64x32_MI16x16x4x1_SN_AMAS0_DTVB1_GRVW1_LBSPP256_LPA4_LRVW2_NEPBS0_NLCB1_PLR9_SVW1_TT2_16_TLDS1_UMLDSA1_VW1_WG16_16_1_WGM12
    SolutionIndex: 21
    SolutionNameMin: Cijk_Alik_Bjlk_DB_MT32x64x16_MI16x16x4x1_SN_AMAS0_DTVB1_GRVW1_LBSPP128_LPA4_LRVW2_NEPBS4_NLCB1_PLR5_SVW1_TT2_16_TLDS1_UMLDSA1_VW1_WG16_16_1_WGM6
    SolutionIndex: 22
    SolutionNameMin: Cijk_Alik_Bjlk_DB_MT64x64x16_MI16x16x4x1_SN_AMAS0_DTVB0_GRVW1_LBSPP0_LPA1_LRVW1_NEPBS0_NLCB1_PLR5_SVW1_TT1_64_TLDS0_UMLDSA0_VW1_WG64_4_1_WGM6
    SolutionIndex: 23
    SolutionNameMin: Cijk_Alik_Bjlk_DB_MT64x64x32_MI16x16x4x1_SN_AMAS0_DTVB1_GRVW1_LBSPP0_LPA1_LRVW1_NEPBS0_NLCB1_PLR9_SVW1_TT4_16_TLDS0_UMLDSA0_VW1_WG16_16_1_WGM12
    SolutionIndex: 24
    SolutionNameMin: Cijk_Alik_Bjlk_DB_MT64x64x16_MI16x16x4x1_SN_AMAS0_DTVB1_GRVW1_LBSPP128_LPA1_LRVW1_NEPBS0_NLCB1_PLR5_SVW1_TT4_16_TLDS1_UMLDSA1_VW1_WG16_16_1_WGM12
    SolutionIndex: 25
    SolutionNameMin: Cijk_Alik_Bjlk_DB_MT64x64x16_MI16x16x4x1_SN_AMAS0_DTVB1_GRVW1_LBSPP128_LPA1_LRVW1_NEPBS0_NLCB1_PLR5_SVW1_TT4_16_TLDS1_UMLDSA1_VW1_WG16_16_1_WGM6
    SolutionIndex: 26
    SolutionNameMin: Cijk_Alik_Bjlk_DB_MT64x64x16_MI16x16x4x1_SN_AMAS3_DTVB0_GRVW2_LBSPP0_LPA2_LRVW1_NEPBS0_NLCB1_PLR5_SVW2_TT2_32_TLDS0_UMLDSA0_VW2_WG32_8_1_WGM12
    SolutionIndex: 27
    SolutionNameMin: Cijk_Alik_Bjlk_DB_MT64x128x16_MI16x16x4x1_SN_AMAS0_DTVB1_GRVW1_LBSPP128_LPA1_LRVW1_NEPBS0_NLCB2_PLR1_SVW1_TT4_32_TLDS1_UMLDSA1_VW1_WG16_16_1_WGM6
    SolutionIndex: 28
    SolutionNameMin: Cijk_Alik_Bjlk_DB_MT64x128x16_MI16x16x4x1_SN_AMAS0_DTVB0_GRVW1_LBSPP128_LPA4_LRVW2_NEPBS0_NLCB1_PLR5_SVW1_TT4_32_TLDS1_UMLDSA1_VW1_WG16_16_1_WGM12
    SolutionIndex: 29
    SolutionNameMin: Cijk_Alik_Bjlk_DB_MT64x128x16_MI16x16x4x1_SN_AMAS0_DTVB0_GRVW1_LBSPP0_LPA1_LRVW1_NEPBS0_NLCB1_PLR5_SVW1_TT4_32_TLDS0_UMLDSA0_VW1_WG16_16_1_WGM12
    SolutionIndex: 30
    SolutionNameMin: Cijk_Alik_Bjlk_DB_MT64x128x16_MI16x16x4x1_SN_AMAS3_DTVB0_GRVW2_LBSPP0_LPA2_LRVW1_NEPBS4_NLCB1_PLR5_SVW2_TT4_32_TLDS0_UMLDSA0_VW2_WG16_16_1_WGM6
    SolutionIndex: 31
    SolutionNameMin: Cijk_Alik_Bjlk_DB_MT64x128x16_MI16x16x4x1_SN_AMAS0_DTVB1_GRVW1_LBSPP0_LPA1_LRVW1_NEPBS0_NLCB2_PLR5_SVW1_TT4_32_TLDS0_UMLDSA0_VW1_WG16_16_1_WGM6
    SolutionIndex: 32
    SolutionNameMin: Cijk_Alik_Bjlk_DB_MT64x64x16_MI16x16x4x1_SN_AMAS3_DTVB0_GRVW2_LBSPP0_LPA2_LRVW1_NEPBS4_NLCB1_PLR5_SVW2_TT4_16_TLDS0_UMLDSA0_VW2_WG16_16_1_WGM12
    SolutionIndex: 33
    SolutionNameMin: Cijk_Alik_Bjlk_DB_MT64x64x16_MI16x16x4x1_SN_AMAS0_DTVB0_GRVW2_LBSPP0_LPA1_LRVW1_NEPBS4_NLCB1_PLR5_SVW1_TT1_64_TLDS0_UMLDSA0_VW1_WG64_4_1_WGM6
    SolutionIndex: 34
    SolutionNameMin: Cijk_Alik_Bjlk_DB_MT64x64x16_MI16x16x4x1_SN_AMAS3_DTVB0_GRVW2_LBSPP128_LPA4_LRVW2_NEPBS4_NLCB1_PLR5_SVW2_TT2_32_TLDS1_UMLDSA1_VW2_WG32_8_1_WGM6
    SolutionIndex: 35
    SolutionNameMin: Cijk_Alik_Bjlk_DB_MT64x32x16_MI16x16x4x1_SN_AMAS3_DTVB0_GRVW1_LBSPP128_LPA4_LRVW2_NEPBS4_NLCB1_PLR5_SVW2_TT2_16_TLDS1_UMLDSA1_VW2_WG32_8_1_WGM12
    SolutionIndex: 36
    SolutionNameMin: Cijk_Alik_Bjlk_DB_MT64x32x16_MI16x16x4x1_SN_AMAS3_DTVB0_GRVW2_LBSPP128_LPA4_LRVW2_NEPBS4_NLCB1_PLR5_SVW2_TT2_16_TLDS1_UMLDSA1_VW2_WG32_8_1_WGM12
    SolutionIndex: 37
    SolutionNameMin: Cijk_Alik_Bjlk_DB_MT64x64x16_MI16x16x4x1_SN_AMAS3_DTVB0_GRVW1_LBSPP0_LPA2_LRVW1_NEPBS0_NLCB1_PLR5_SVW2_TT4_16_TLDS0_UMLDSA0_VW2_WG16_16_1_WGM6
    SolutionIndex: 38
    SolutionNameMin: Cijk_Alik_Bjlk_DB_MT64x64x16_MI16x16x4x1_SN_AMAS3_DTVB0_GRVW2_LBSPP128_LPA4_LRVW2_NEPBS0_NLCB1_PLR5_SVW2_TT2_32_TLDS1_UMLDSA1_VW2_WG32_8_1_WGM12
    SolutionIndex: 39
    SolutionNameMin: Cijk_Alik_Bjlk_DB_MT64x64x32_MI16x16x4x1_SN_AMAS0_DTVB1_GRVW1_LBSPP0_LPA1_LRVW1_NEPBS0_NLCB1_PLR9_SVW1_TT4_16_TLDS0_UMLDSA0_VW1_WG16_16_1_WGM12
    SolutionIndex: 40
    SolutionNameMin: Cijk_Alik_Bjlk_DB_MT64x64x16_MI16x16x4x1_SN_AMAS3_DTVB0_GRVW1_LBSPP128_LPA4_LRVW2_NEPBS4_NLCB1_PLR5_SVW2_TT2_32_TLDS1_UMLDSA1_VW2_WG32_8_1_WGM6
    SolutionIndex: 41
    SolutionNameMin: Cijk_Alik_Bjlk_DB_MT64x64x16_MI16x16x4x1_SN_AMAS3_DTVB0_GRVW2_LBSPP0_LPA2_LRVW1_NEPBS0_NLCB1_PLR5_SVW2_TT2_32_TLDS0_UMLDSA0_VW2_WG32_8_1_WGM6
    SolutionIndex: 42
    SolutionNameMin: Cijk_Alik_Bjlk_DB_MT64x128x16_MI16x16x4x1_SN_AMAS3_DTVB0_GRVW2_LBSPP128_LPA4_LRVW2_NEPBS0_NLCB1_PLR5_SVW2_TT4_32_TLDS1_UMLDSA1_VW2_WG16_16_1_WGM12
    SolutionIndex: 43
    SolutionNameMin: Cijk_Alik_Bjlk_DB_MT64x128x16_MI16x16x4x1_SN_AMAS3_DTVB1_GRVW2_LBSPP128_LPA4_LRVW2_NEPBS0_NLCB1_PLR5_SVW2_TT4_32_TLDS1_UMLDSA1_VW2_WG16_16_1_WGM6
    SolutionIndex: 44
    SolutionNameMin: Cijk_Alik_Bjlk_DB_MT64x128x16_MI16x16x4x1_SN_AMAS3_DTVB0_GRVW2_LBSPP0_LPA2_LRVW1_NEPBS0_NLCB1_PLR5_SVW2_TT4_32_TLDS0_UMLDSA0_VW2_WG16_16_1_WGM6
    SolutionIndex: 45
    SolutionNameMin: Cijk_Alik_Bjlk_DB_MT64x128x16_MI16x16x4x1_SN_AMAS3_DTVB1_GRVW2_LBSPP0_LPA2_LRVW2_NEPBS0_NLCB1_PLR5_SVW2_TT4_32_TLDS0_UMLDSA0_VW2_WG16_16_1_WGM12
    SolutionIndex: 46
    SolutionNameMin: Cijk_Alik_Bjlk_DB_MT64x128x16_MI16x16x4x1_SN_AMAS3_DTVB1_GRVW2_LBSPP0_LPA2_LRVW1_NEPBS0_NLCB1_PLR5_SVW2_TT4_32_TLDS0_UMLDSA0_VW2_WG16_16_1_WGM6
    SolutionIndex: 47
    SolutionNameMin: Cijk_Alik_Bjlk_DB_MT128x64x16_MI16x16x4x1_SN_AMAS3_DTVB0_GRVW2_LBSPP128_LPA4_LRVW2_NEPBS0_NLCB1_PLR5_SVW2_TT2_64_TLDS1_UMLDSA1_VW2_WG64_4_1_WGM12
    SolutionIndex: 48
    SolutionNameMin: Cijk_Alik_Bjlk_DB_MT64x128x16_MI16x16x4x1_SN_AMAS0_DTVB0_GRVW2_LBSPP128_LPA2_LRVW1_NEPBS0_NLCB1_PLR1_SVW1_TT4_32_TLDS1_UMLDSA1_VW1_WG16_16_1_WGM12
    SolutionIndex: 49
    SolutionNameMin: Cijk_Alik_Bjlk_DB_MT64x64x16_MI16x16x4x1_SN_AMAS3_DTVB0_GRVW1_LBSPP128_LPA1_LRVW1_NEPBS0_NLCB1_PLR5_SVW2_TT2_32_TLDS1_UMLDSA1_VW2_WG32_8_1_WGM6
    SolutionIndex: 50
    SolutionNameMin: Cijk_Alik_Bjlk_DB_MT64x128x16_MI16x16x4x1_SN_AMAS3_DTVB1_GRVW2_LBSPP0_LPA2_LRVW1_NEPBS4_NLCB1_PLR1_SVW2_TT4_32_TLDS0_UMLDSA0_VW2_WG16_16_1_WGM6
    SolutionIndex: 51
    SolutionNameMin: Cijk_Alik_Bjlk_DB_MT64x128x16_MI16x16x4x1_SN_AMAS0_DTVB0_GRVW2_LBSPP128_LPA4_LRVW2_NEPBS0_NLCB1_PLR5_SVW1_TT4_32_TLDS1_UMLDSA1_VW1_WG16_16_1_WGM6
    SolutionIndex: 52
    SolutionNameMin: Cijk_Alik_Bjlk_DB_MT128x128x16_MI16x16x4x1_SN_AMAS3_DTVB1_GRVW2_LBSPP0_LPA2_LRVW1_NEPBS4_NLCB1_PLR1_SVW2_TT8_32_TLDS0_UMLDSA0_VW2_WG16_16_1_WGM12
    SolutionIndex: 53
    SolutionNameMin: Cijk_Alik_Bjlk_DB_MT64x64x16_MI16x16x4x1_SN_AMAS3_DTVB0_GRVW2_LBSPP0_LPA2_LRVW1_NEPBS4_NLCB1_PLR5_SVW2_TT4_16_TLDS0_UMLDSA0_VW2_WG16_16_1_WGM6
    SolutionIndex: 54
    SolutionNameMin: Cijk_Alik_Bjlk_DB_MT32x64x32_MI16x16x4x1_SN_AMAS0_DTVB0_GRVW2_LBSPP256_LPA4_LRVW2_NEPBS0_NLCB1_PLR9_SVW1_TT2_16_TLDS1_UMLDSA1_VW1_WG16_16_1_WGM6
    SolutionIndex: 55
    SolutionNameMin: Cijk_Alik_Bjlk_DB_MT64x64x16_MI16x16x4x1_SN_AMAS3_DTVB0_GRVW2_LBSPP128_LPA4_LRVW2_NEPBS4_NLCB1_PLR5_SVW2_TT2_32_TLDS1_UMLDSA1_VW2_WG32_8_1_WGM6
- - - [6144, 4864, 1, 512]
    - [2, 68.82]
  - - [4864, 3072, 1, 4096]
    - [3, 94.221]
  - - [7296, 4096, 1, 4096]
    - [4, 95.182]
  - - [7296, 4608, 1, 4096]
    - [5, 95.563]
  - - [7296, 4608, 1, 8192]
    - [6, 96.382]
  - - [9728, 6144, 1, 4096]
    - [7, 95.883]
  - - [9728, 6144, 1, 8192]
    - [8, 96.691]
  - - [16384, 16384, 1, 4096]
    - [9, 96.273]
  - - [14592, 15360, 1, 512]
    - [10, 88.066]
  - - [19456, 18432, 1, 512]
    - [11, 88.852]
  - - [4094, 4094, 1, 2046]
    - [0, 75.84]
  - - [4096, 4096, 1, 2048]
    - [1, 79.309]
  - - [1030, 1030, 1, 1030]
    - [12, 38.075]
  - - [1032, 1032, 1, 1032]
    - [13, 38.736]
  - - [2046, 2046, 1, 2046]
    - [14, 68.517]
  - - [2048, 2048, 1, 2048]
    - [15, 70.019]
  - - [1031, 1031, 1, 1031]
    - [16, 33.155]
  - - [2047, 2047, 1, 2047]
    - [17, 62.007]
  - - [4095, 4095, 1, 2047]
    - [18, 83.117]
  - - [64, 1, 1000, 64]
    - [19, 0.416]
  - - [1, 64, 1000, 64]
    - [20, 0.441]
  - - [31, 31, 1000, 31]
    - [21, 3.216]
  - - [33, 33, 1000, 33]
    - [22, 2.988]
  - - [47, 47, 1000, 47]
    - [23, 5.714]
  - - [49, 49, 1000, 49]
    - [24, 5.651]
  - - [63, 63, 128, 63]
    - [25, 4.851]
  - - [65, 65, 128, 65]
    - [26, 3.863]
  - - [79, 79, 128, 79]
    - [27, 5.813]
  - - [81, 81, 128, 81]
    - [28, 5.988]
  - - [95, 95, 64, 95]
    - [28, 6.595]
  - - [97, 97, 64, 97]
    - [28, 6.859]
  - - [127, 127, 64, 127]
    - [29, 11.491]
  - - [129, 129, 64, 129]
    - [30, 8.208]
  - - [255, 255, 16, 255]
    - [31, 17.92]
  - - [257, 257, 16, 257]
    - [32, 14.115]
  - - [511, 511, 16, 511]
    - [33, 35.854]
  - - [513, 513, 16, 513]
    - [34, 35.164]
  - - [30, 30, 1000, 30]
    - [35, 3.426]
  - - [32, 32, 1000, 32]
    - [36, 4.073]
  - - [34, 34, 1000, 34]
    - [37, 3.526]
  - - [46, 46, 1000, 46]
    - [38, 6.099]
  - - [48, 48, 1000, 48]
    - [39, 7.742]
  - - [50, 50, 1000, 50]
    - [40, 6.625]
  - - [62, 62, 128, 62]
    - [41, 5.006]
  - - [64, 64, 128, 64]
    - [41, 6.037]
  - - [66, 66, 128, 66]
    - [42, 4.281]
  - - [78, 78, 128, 78]
    - [43, 6.489]
  - - [80, 80, 128, 80]
    - [42, 7.201]
  - - [82, 82, 128, 82]
    - [42, 7.262]
  - - [94, 94, 64, 94]
    - [44, 6.93]
  - - [96, 96, 64, 96]
    - [45, 7.542]
  - - [98, 98, 64, 98]
    - [46, 7.443]
  - - [126, 126, 64, 126]
    - [47, 12.645]
  - - [128, 128, 64, 128]
    - [48, 14.801]
  - - [130, 130, 64, 130]
    - [49, 9.031]
  - - [254, 254, 16, 254]
    - [50, 19.675]
  - - [256, 256, 16, 256]
    - [51, 23.496]
  - - [258, 258, 16, 258]
    - [52, 14.293]
  - - [510, 510, 16, 510]
    - [53, 38.132]
  - - [512, 512, 16, 512]
    - [54, 42.682]
  - - [514, 514, 16, 514]
    - [55, 35.777]
- null
