library/src/blas3/Tensile/Logic/asm_full/aquavanjaram942/aquavanjaram942_Cijk_Ailk_Bljk_HHS_BH.yaml
- {MinimumRequiredVersion: 4.36.0}
- aquavanjaram942
- gfx942
- [Device 0049, Device 0050]
    SolutionIndex: 0
    SolutionNameMin: Cijk_Ailk_Bljk_HHS_BH_MT256x128x16_MI32x32x8x1_SN_1LDSB1_AMAS3_FL0_MIAV0_NTA0_NTB0_NTC3_NTD3_NLCA2_ONLL1_SVW2_TT2_128_VW2_WSGRA1_WSGRB1_WG128_2_1_WGM12
    SolutionIndex: 1
    SolutionNameMin: Cijk_Ailk_Bljk_HHS_BH_MT256x128x16_MI32x32x8x1_SN_1LDSB1_AMAS3_FL0_MIAV0_NTA1_NTB0_NTC3_NTD3_NLCA2_ONLL0_SVW2_TT2_128_VW2_WSGRA0_WSGRB0_WG128_2_1_WGM6
    SolutionIndex: 2
    SolutionNameMin: Cijk_Ailk_Bljk_HHS_BH_MT256x128x16_MI32x32x8x1_SN_1LDSB1_AMAS3_FL0_MIAV0_NTA0_NTB1_NTC3_NTD2_NLCA2_ONLL1_SVW2_TT2_128_VW2_WSGRA1_WSGRB1_WG128_2_1_WGM6
    SolutionIndex: 3
    SolutionNameMin: Cijk_Ailk_Bljk_HHS_BH_MT256x128x16_MI32x32x8x1_SN_1LDSB1_AMAS3_FL0_MIAV0_NTA1_NTB1_NTC2_NTD1_NLCA2_ONLL0_SVW2_TT2_128_VW2_WSGRA0_WSGRB1_WG128_2_1_WGM6
    SolutionIndex: 4
    SolutionNameMin: Cijk_Ailk_Bljk_HHS_BH_MT256x128x16_MI32x32x8x1_SN_1LDSB1_AMAS3_FL0_MIAV0_NTA1_NTB1_NTC3_NTD3_NLCA2_ONLL0_SVW2_TT2_128_VW2_WSGRA0_WSGRB0_WG128_2_1_WGM6
    SolutionIndex: 5
    SolutionNameMin: Cijk_Ailk_Bljk_HHS_BH_MT256x128x16_MI32x32x8x1_SN_1LDSB1_AMAS3_FL0_MIAV1_NTA0_NTB0_NTC2_NTD2_NLCA2_ONLL2_SVW2_TT2_128_VW2_WSGRA0_WSGRB0_WG128_2_1_WGM6
    SolutionIndex: 6
    SolutionNameMin: Cijk_Ailk_Bljk_HHS_BH_MT256x128x16_MI32x32x8x1_SN_1LDSB1_AMAS0_FL0_MIAV1_NTA1_NTB0_NTC2_NTD1_NLCA2_ONLL0_SVW1_TT2_128_VW1_WSGRA0_WSGRB0_WG128_2_1_WGM6
    SolutionIndex: 7
    SolutionNameMin: Cijk_Ailk_Bljk_HHS_BH_MT256x128x16_MI32x32x8x1_SN_1LDSB1_AMAS3_FL0_MIAV1_NTA1_NTB0_NTC3_NTD2_NLCA2_ONLL1_SVW2_TT4_64_VW2_WSGRA0_WSGRB1_WG64_4_1_WGM12
    SolutionIndex: 8
    SolutionNameMin: Cijk_Ailk_Bljk_HHS_BH_MT256x128x16_MI32x32x8x1_SN_1LDSB1_AMAS3_FL0_MIAV1_NTA1_NTB1_NTC2_NTD3_NLCA2_ONLL0_SVW2_TT2_128_VW2_WSGRA0_WSGRB0_WG128_2_1_WGM6
    SolutionIndex: 9
    SolutionNameMin: Cijk_Ailk_Bljk_HHS_BH_MT256x128x16_MI32x32x8x1_SN_1LDSB1_AMAS3_FL0_MIAV1_NTA1_NTB1_NTC3_NTD3_NLCA2_ONLL0_SVW2_TT2_128_VW2_WSGRA1_WSGRB1_WG128_2_1_WGM6
    SolutionIndex: 10
    SolutionNameMin: Cijk_Ailk_Bljk_HHS_BH_MT32x16x128_MI16x16x16x1_SN_1LDSB0_AMAS0_EMLL8_GSU1_GSUASB_LBSPP256_LPB16_LRVW8_PLR5_SVW1_TT1_16_VW1_WG32_4_2
    SolutionIndex: 11
    SolutionNameMin: Cijk_Ailk_Bljk_HHS_BH_MT128x16x128_MI16x16x16x1_SN_1LDSB1_AMAS3_EMLL8_GSU16_GSUAMB_LBSPP256_LPB16_LRVW8_PLR5_SVW2_TT2_16_VW2_WG64_4_2
    SolutionIndex: 12
    SolutionNameMin: Cijk_Ailk_Bljk_HHS_BH_MT128x16x64_MI16x16x16x1_SN_1LDSB0_AMAS3_EMLL0_GSU16_GSUAMB_LBSPP128_LPB8_LRVW4_PLR3_SVW4_TT4_16_VW4_WG32_4_2
    SolutionIndex: 13
    SolutionNameMin: Cijk_Ailk_Bljk_HHS_BH_MT64x16x128_MI16x16x16x1_SN_AMAS3_EMLL6_GLS0_PLR5_SVW2_TT2_16_VW2_WG32_4_2
    SolutionIndex: 14
    SolutionNameMin: Cijk_Ailk_Bljk_HHS_BH_MT64x16x128_MI16x16x16x1_SN_AMAS3_EMLL8_GLS0_PLR5_SVW2_TT2_16_VW2_WG32_4_2
    SolutionIndex: 15
    SolutionNameMin: Cijk_Ailk_Bljk_HHS_BH_MT256x16x64_MI16x16x16x1_SN_1LDSB1_AMAS3_EMLL6_GSU8_GSUAMB_LBSPP128_LPB8_LRVW4_PLR3_SVW4_TT4_16_VW4_WG64_4_2
    SolutionIndex: 16
    SolutionNameMin: Cijk_Ailk_Bljk_HHS_BH_MT256x128x32_MI32x32x8x1_SN_AMAS3_MIAV1_NLCA2_PLR5_SU0_SUS0_SPO1_SVW2_TT2_128_VW2_WGM32
    SolutionIndex: 17
    SolutionNameMin: Cijk_Ailk_Bljk_HHS_BH_MT256x256x32_MI32x32x8x1_SN_AMAS3_MIAV0_NLCA2_PLR5_SU4_SUS512_SPO0_SVW2_TT2_256_VW2_WGM32
    SolutionIndex: 18
    SolutionNameMin: Cijk_Ailk_Bljk_HHS_BH_MT256x256x32_MI32x32x8x1_SN_AMAS0_MIAV0_NLCA1_PLR5_SU0_SUS0_SPO1_SVW1_TT2_256_VW1_WGM1
    SolutionIndex: 19
    SolutionNameMin: Cijk_Ailk_Bljk_HHS_H_MT16x16x128_MI16x16x16x1_SN_AMAS0_LBSPP256_LPA8_MIAV1_NEPBS4_SS1_SVW1_TLDS1_UMLDSB1_VW1_WGM1
    SolutionIndex: 20
    SolutionNameMin: Cijk_Ailk_Bljk_HHS_BH_MT16x16x128_MI16x16x16x1_SN_AMAS0_GRVW8_LBSPP256_LPA8_LPB8_MIAV1_NEPBS0_SS0_SVW4_TLDS1_UMLDSB1_VW1_WGM18
    SolutionIndex: 21
    SolutionNameMin: Cijk_Ailk_Bljk_HHS_BH_MT16x16x128_MI16x16x16x1_SN_GRVW8_LPA8_LPB4_NEPBS4_WGM12
    SolutionIndex: 22
    SolutionNameMin: Cijk_Ailk_Bljk_HHS_BH_MT16x32x128_MI16x16x16x1_SN_AMAS3_LPB8_MIAV0_NEPBS4_SS0_SVW4_TT1_16_VW2_WSGRA0_WSGRB1_WG16_8_1_WGM1
    SolutionIndex: 23
    SolutionNameMin: Cijk_Ailk_Bljk_HHS_H_MT16x128x64_MI16x16x16x1_SN_AMAS3_GSU16_LBSPP128_LPA4_LRVW4_MIAV0_NEPBS4_PLR1_SS0_SVW4_TT1_32_TLDS1_UMLDSB1_VW2_WGM18
    SolutionIndex: 24
    SolutionNameMin: Cijk_Ailk_Bljk_HHS_BH_MT16x64x128_MI16x16x16x1_SN_AMAS3_LBSPP256_LPA8_LPB8_MIAV0_NEPBS0_SS0_SVW4_TT1_16_TLDS1_UMLDSB1_VW2_WG16_16_1_WGM16
    SolutionIndex: 25
    SolutionNameMin: Cijk_Ailk_Bljk_HHS_BH_MT16x64x128_MI16x16x16x1_SN_AMAS3_LBSPP256_LPA8_MIAV0_NEPBS4_SS0_SVW4_TLDS1_UMLDSB1_VW2_WGM1
    SolutionIndex: 26
    SolutionNameMin: Cijk_Ailk_Bljk_HHS_BH_MT16x64x64_MI16x16x16x1_SN_AMAS0_GRVW4_LBSPP128_LPA8_LPB4_LRVW4_MIAV1_NEPBS0_PLR5_SS0_SVW4_TLDS1_UMLDSB1_VW1_WGM1
    SolutionIndex: 27
    SolutionNameMin: Cijk_Ailk_Bljk_HHS_H_MT16x32x256_MI16x16x16x1_SN_AMAS0_LBSPP512_LPA8_LRVW4_MIAV1_NEPBS0_PLR1_SS0_SVW4_TLDS1_UMLDSB1_VW1_WG16_8_1_WGM8
    SolutionIndex: 28
    SolutionNameMin: Cijk_Ailk_Bljk_HHS_BH_MT256x256x32_MI32x32x8x1_SN_
    SolutionIndex: 29
    SolutionNameMin: Cijk_Ailk_Bljk_HHS_BH_MT256x256x32_MI32x32x8x1_SN_1LDSB1_FL1_LRVW8_MIAV0_NEPBS0_NLCA1_SU32_SUS64_SSO8_TT2_256_WG128_2_1_WGM30
    SolutionIndex: 30
    SolutionNameMin: Cijk_Ailk_Bljk_HHS_BH_MT256x256x32_MI32x32x8x1_SN_1LDSB1_FL1_LRVW8_MIAV0_NEPBS0_NLCA1_SU0_SUS0_SSO6_TT2_256_WG128_2_1_WGM30
    SolutionIndex: 31
    SolutionNameMin: Cijk_Ailk_Bljk_HHS_BH_MT256x256x32_MI32x32x8x1_SN_1LDSB1_FL0_LRVW8_MIAV0_NEPBS0_NLCA1_SU0_SUS0_SSO6_TT2_256_WG128_2_1_WGM18
    SolutionIndex: 32
    SolutionNameMin: Cijk_Ailk_Bljk_HHS_BH_MT256x256x32_MI32x32x8x1_SN_1LDSB1_FL0_LRVW8_MIAV0_NEPBS0_NLCA1_SU0_SUS0_SSO6_TT2_256_WG128_2_1_WGM30
    SolutionIndex: 33
    SolutionNameMin: Cijk_Ailk_Bljk_HHS_BH_MT256x256x32_MI32x32x8x1_SN_1LDSB1_FL2_LRVW8_MIAV0_NEPBS0_NLCA1_SU0_SUS0_SSO8_TT2_256_WG128_2_1_WGM6
    SolutionIndex: 34
    SolutionNameMin: Cijk_Ailk_Bljk_HHS_BH_MT256x256x32_MI32x32x8x1_SN_1LDSB1_FL0_LRVW8_MIAV0_NEPBS0_NLCA1_SU0_SUS0_SSO8_TT2_256_WG128_2_1_WGM6
    SolutionIndex: 35
    SolutionNameMin: Cijk_Ailk_Bljk_HHS_BH_MT256x256x32_MI32x32x8x1_SN_1LDSB1_FL1_LRVW8_MIAV0_NEPBS0_NLCA1_SU0_SUS0_SSO8_TT2_256_WG128_2_1_WGM18
    SolutionIndex: 36
    SolutionNameMin: Cijk_Ailk_Bljk_HHS_BH_MT256x256x32_MI32x32x8x1_SN_1LDSB1_FL2_LRVW8_MIAV0_NEPBS0_NLCA1_SU0_SUS0_SSO8_TT2_256_WG128_2_1_WGM18
    SolutionIndex: 37
    SolutionNameMin: Cijk_Ailk_Bljk_HHS_BH_MT128x128x64_MI16x16x16x1_SN_FL0_GLVWB8_LBSPPA0_LPA0_LPB16_LRVW8_MIAV0_PLR5_SVW4_TT4_64_VW4_WSGRA1_WG32_8_1
    SolutionIndex: 38
    SolutionNameMin: Cijk_Ailk_Bljk_HHS_BH_MT256x112x64_MI16x16x16x1_SN_CLR1_ELFLR4_FL1_GLVWB4_LBSPPA4096_LBSPPB128_LPA32_LPB16_LRVW8_NEPBS16_PLR5_TT4_112_WSGRA0_WG64_4_1_WGM16
    SolutionIndex: 39
    SolutionNameMin: Cijk_Ailk_Bljk_HHS_BH_MT256x224x64_MI16x16x16x1_SN_CLR0_GLVWB4_LBSPPA0_LBSPPB128_LPA0_LPB4_LRVW4_PLR5_SVW4_TT4_224_VW4_WGM32
    SolutionIndex: 40
    SolutionNameMin: Cijk_Ailk_Bljk_HHS_BH_MT256x224x64_MI16x16x16x1_SN_CLR0_FL0_GLVWB4_LBSPPA0_LBSPPB128_LPA0_LPB4_LRVW4_PLR5_SVW4_TT4_224_VW4_WSGRA1_WG64_4_1
    SolutionIndex: 41
    SolutionNameMin: Cijk_Ailk_Bljk_HHS_BH_MT256x256x32_MI16x16x16x1_SN_GLVWB2_LBSPPA2048_LPA32_LPB4_LRVW4_MIAV0_PLR3_SVW2_TT4_256_VW2_WG64_4_1_WGMn16
    SolutionIndex: 42
    SolutionNameMin: Cijk_Ailk_Bljk_HHS_BH_MT256x256x32_MI16x16x16x1_SN_FL0_LBSPPA0_LPA0_LPB4_LRVW4_PLR3_SUM0_SVW4_TT4_256_VW4_WG64_4_1_WGMn32
    SolutionIndex: 43
    SolutionNameMin: Cijk_Ailk_Bljk_HHS_BH_MT256x128x32_MI16x16x16x1_SN_GLVWB8_LBSPPA2048_LPA32_LPB8_LRVW4_MIAV1_PLR3_SVW2_TT4_128_VW2_WG64_4_1_WGM32
    SolutionIndex: 44
    SolutionNameMin: Cijk_Ailk_Bljk_HHS_BH_MT256x224x32_MI16x16x16x1_SN_CLR1_FL0_GLVWB4_LBSPPA0_LBSPPB128_LPA0_LPB4_LRVW4_PLR3_SVW4_TT4_224_VW4_WSGRA1_WG64_4_1_WGM16
    SolutionIndex: 45
    SolutionNameMin: Cijk_Ailk_Bljk_HHS_BH_MT128x128x64_MI16x16x16x1_SN_LBSPPA0_LPA0_LPB16_MIAV0_PLR5_SU4_SUS256_SPO0_SVW4_TT4_64_VW4_WG32_8_1_WGMn16
    SolutionIndex: 46
    SolutionNameMin: Cijk_Ailk_Bljk_HHS_BH_MT256x224x32_MI16x16x16x1_SN_CLR1_GLVWB2_LBSPPB128_LPB4_LRVW4_PLR3_SU0_SUS0_TT4_224_WSGRA1_WGM16
    SolutionIndex: 47
    SolutionNameMin: Cijk_Ailk_Bljk_HHS_BH_MT256x240x32_MI16x16x16x1_SN_GLVWB2_SU8_SUS256_TT4_240_WSGRA0_WG64_4_1_WGMn8
    SolutionIndex: 48
    SolutionNameMin: Cijk_Ailk_Bljk_HHS_BH_MT256x224x64_MI16x16x16x1_SN_EPS1_GLVWB2_GLS0_LBSPPA0_LBSPPB128_LPA0_LPB4_LRVW4_NEPBS0_NLCA2_SU4_SUS256_WSGRA1_WGMn16
    SolutionIndex: 49
    SolutionNameMin: Cijk_Ailk_Bljk_HHS_BH_MT256x224x64_MI16x16x16x1_SN_LBSPPA2048_LBSPPB128_LPA16_LPB4_LRVW4_SU0_SUS0_SVW2_VW2_WSGRA0_WGM1
    SolutionIndex: 50
    SolutionNameMin: Cijk_Ailk_Bljk_HHS_BH_MT256x256x32_MI16x16x16x1_SN_CLR1_LBSPPA2048_LBSPPB128_LPA16_LPB4_LRVW4_NEPBS16_NLCA1_PLR3_SU8_SUM2_TT4_256_WSGRA1_WGM16
    SolutionIndex: 51
    SolutionNameMin: Cijk_Ailk_Bljk_HHS_BH_MT256x256x64_MI16x16x16x1_SN_1LDSB1_ELFLRn20_GLVWA4_GLVWB2_GRPM0p26_LBSPPB256_LPB4_NLCA1_PGR1_PLR1_SU8_SUS256_SVW4_TT4_256_VW4_VWB2_WGM30
    SolutionIndex: 52
    SolutionNameMin: Cijk_Ailk_Bljk_HHS_BH_MT256x256x64_MI16x16x16x1_SN_1LDSB1_DTVA1_ELFLR0_GLVWA4_GLVWB2_GRPM0p28_LBSPPB256_LPB4_LRVW4_PGR1_PLR1_SU8_SUS256_TT4_256_WSGRA0_WGM30
    SolutionIndex: 53
    SolutionNameMin: Cijk_Ailk_Bljk_HHS_BH_MT256x256x64_MI16x16x16x1_SN_1LDSB1_DTVA1_ELFLR0_GLVWA4_GLVWB2_GRPM0p26_LBSPPB256_LPB4_LRVW4_PGR1_PLR1_SU8_SUS256_TT4_256_WSGRA0_WGM30
    SolutionIndex: 54
    SolutionNameMin: Cijk_Ailk_Bljk_HHS_BH_MT256x256x64_MI16x16x16x1_SN_1LDSB1_DTVA1_ELFLRn20_GLVWA4_GLVWB2_GRPM0p26_LBSPPB256_LPB4_LRVW4_PGR1_PLR1_SU0_SUS0_TT4_256_WSGRA0_WGMn30
    SolutionIndex: 55
    SolutionNameMin: Cijk_Ailk_Bljk_HHS_BH_MT256x256x64_MI16x16x16x1_SN_1LDSB1_DTVA1_ELFLRn20_GLVWA4_GLVWB2_GRPM0p26_LBSPPB256_LPB4_LRVW4_PGR1_PLR1_SU0_SUS0_TT4_256_WSGRA0_WGM30
    SolutionIndex: 56
    SolutionNameMin: Cijk_Ailk_Bljk_HHS_BH_MT256x256x64_MI16x16x16x1_SN_1LDSB1_DTVA1_ELFLR0_GLVWA4_GLVWB2_GRPM0p24_LBSPPB256_LPB4_LRVW4_PGR1_PLR1_SU0_SUS0_TT4_256_WSGRA0_WGM30
    SolutionIndex: 57
    SolutionNameMin: Cijk_Ailk_Bljk_HHS_BH_MT256x256x64_MI16x16x16x1_SN_1LDSB1_DTVA1_ELFLR0_GLVWA4_GLVWB2_GRPM0p26_LBSPPB256_LPB4_LRVW4_PGR1_PLR1_SU0_SUS0_TT4_256_WSGRA0_WGM30
    SolutionIndex: 58
    SolutionNameMin: Cijk_Ailk_Bljk_HHS_BH_MT64x64x64_MI16x16x16x1_SN_AMAS3_CLR0_GLVWA8_GLVWB8_LBSPPA1024_LPA16_LPB16_MIAV0_SU16_SUS512_TT2_32_VW2_VFLRP1_WG32_8_1_WGM12
    SolutionIndex: 59
    SolutionNameMin: Cijk_Ailk_Bljk_HHS_BH_MT64x64x64_MI16x16x16x1_SN_AMAS3_CLR0_GLVWA2_GLVWB8_LBSPPA1024_LPA16_LPB16_MIAV0_SU8_SUS1024_TT1_64_VW2_VFLRP0_WG64_4_1_WGM12
    SolutionIndex: 60
    SolutionNameMin: Cijk_Ailk_Bljk_HHS_BH_MT64x64x32_MI32x32x8x1_SN_AMAS3_CLR0_GLVWA8_GLVWB8_LBSPPA0_LPA0_LPB8_MIAV0_SU2_SUS512_TT1_32_VW2_VFLRP1_WG64_4_1_WGM30
    SolutionIndex: 61
    SolutionNameMin: Cijk_Ailk_Bljk_HHS_BH_MT64x64x64_MI16x16x16x1_SN_AMAS3_CLR1_GLVWA8_GLVWB8_LBSPPA1024_LPA16_LPB16_MIAV0_SU16_SUS1024_TT1_64_VW2_VFLRP1_WG64_4_1_WGM30
    SolutionIndex: 62
    SolutionNameMin: Cijk_Ailk_Bljk_HHS_BH_MT64x64x64_MI16x16x16x1_SN_AMAS3_CLR1_GLVWA8_GLVWB8_LBSPPA1024_LPA16_LPB16_MIAV0_SU16_SUS1024_TT1_64_VW4_VFLRP1_WG64_4_1_WGMn12
    SolutionIndex: 63
    SolutionNameMin: Cijk_Ailk_Bljk_HHS_BH_MT64x64x64_MI16x16x16x1_SN_AMAS3_CLR1_GLVWA2_GLVWB8_LBSPPA1024_LPA16_LPB16_MIAV0_SU16_SUS512_TT1_64_VW2_VFLRP1_WG64_4_1_WGMn12
    SolutionIndex: 64
    SolutionNameMin: Cijk_Ailk_Bljk_HHS_BH_MT64x64x64_MI16x16x16x1_SN_AMAS3_CLR0_GLVWA8_GLVWB8_LBSPPA1024_LPA16_LPB16_MIAV0_SU8_SUS1024_TT1_64_VW2_VFLRP0_WG64_4_1_WGMn12
    SolutionIndex: 65
    SolutionNameMin: Cijk_Ailk_Bljk_HHS_BH_MT32x32x64_MI16x16x16x1_SN_AMAS3_ELFLR8_GLVWB8_GLS1_LBSPPA512_LPB16_LRVW8_MIAV0_PLR5_SU64_SUS128_VW2_VFLRP1_WGM12
    SolutionIndex: 66
    SolutionNameMin: Cijk_Ailk_Bljk_HHS_BH_MT32x32x64_MI16x16x16x1_SN_AMAS3_ELFLR0_GLVWB8_GLS1_LBSPPA256_LPB8_LRVW4_MIAV1_PLR5_SU64_SUS128_VW2_VFLRP1_WGM12
    SolutionIndex: 67
    SolutionNameMin: Cijk_Ailk_Bljk_HHS_BH_MT32x32x64_MI16x16x16x1_SN_AMAS3_ELFLR0_GLVWB8_GLS1_LBSPPA512_LPB16_LRVW8_MIAV0_PLR5_SU8_SUS128_VW2_VFLRP1_WGM12
    SolutionIndex: 68
    SolutionNameMin: Cijk_Ailk_Bljk_HHS_BH_MT32x32x64_MI16x16x16x1_SN_AMAS3_ELFLR4_GLVWB2_GLS1_LBSPPA512_LPB16_LRVW8_MIAV0_PLR5_SU4_SUS512_VW4_VFLRP0_WGM12
    SolutionIndex: 69
    SolutionNameMin: Cijk_Ailk_Bljk_HHS_BH_MT32x32x64_MI16x16x16x1_SN_AMAS3_ELFLR4_GLVWB2_GLS0_LBSPPA512_LPB16_LRVW8_MIAV1_PLR5_SU4_SUS512_VW4_VFLRP0_WGM12
    SolutionIndex: 70
    SolutionNameMin: Cijk_Ailk_Bljk_HHS_BH_MT128x128x64_MI16x16x16x1_SN_ELFLRn20_GLVWB8_GRPM0p45_LBSPPB256_LPB16_LRVW8_MIAV0_PGR2_PLR5_SU8_SUS128_WGM12
    SolutionIndex: 71
    SolutionNameMin: Cijk_Ailk_Bljk_HHS_BH_MT128x128x64_MI16x16x16x1_SN_ELFLR0_GLVWB2_GRPM0p40_LBSPPB256_LPB16_LRVW8_MIAV1_PGR2_PLR5_SU8_SUS128_WGM12
    SolutionIndex: 72
    SolutionNameMin: Cijk_Ailk_Bljk_HHS_BH_MT128x128x64_MI16x16x16x1_SN_ELFLR0_GLVWB8_GRPM0p70_LBSPPB256_LPB16_LRVW8_MIAV0_PGR2_PLR5_SU8_SUS128_WGM12
    SolutionIndex: 73
    SolutionNameMin: Cijk_Ailk_Bljk_HHS_BH_MT128x128x64_MI16x16x16x1_SN_ELFLR0_GLVWB2_GRPM0p80_LBSPPB256_LPB4_LRVW4_MIAV0_PGR2_PLR5_SU8_SUS128_WGM12
    SolutionIndex: 74
    SolutionNameMin: Cijk_Ailk_Bljk_HHS_BH_MT64x64x64_MI16x16x16x1_SN_AMAS3_ELFLR4_GLS1_LBSPPA512_LBSPPB256_LPA32_LPB4_LRVW4_NTC2_NTD2_PLR1_SS1_SU64_SUS512_SPO1_SVW2_TT2_32_VW2_VWB2_VFLRP1_WG32_8_1
    SolutionIndex: 75
    SolutionNameMin: Cijk_Ailk_Bljk_HHS_BH_MT64x64x64_MI16x16x16x1_SN_AMAS3_ELFLR4_GLS0_LBSPPA512_LBSPPB256_LPA32_LPB4_LRVW4_NTC3_NTD3_PLR1_SS1_SU64_SUS512_SPO0_SVW2_TT2_32_VW2_VWB2_VFLRP0_WG32_8_1
    SolutionIndex: 76
    SolutionNameMin: Cijk_Ailk_Bljk_HHS_BH_MT32x32x64_MI16x16x16x1_SN_CLR1_EPS1_ELFLR4_EMLL2_GLS1_LBSPPA512_LBSPPB128_NTC0_NTD0_NEPBS8_SU16_SPO0_SSO1_TT1_16_VWB1_WG32_8_1
    SolutionIndex: 77
    SolutionNameMin: Cijk_Ailk_Bljk_HHS_BH_MT32x32x64_MI16x16x16x1_SN_CLR0_EPS1_ELFLR0_EMLL0_GLS0_LBSPPA512_LBSPPB128_NTC2_NTD2_NEPBS8_SU64_SPO1_SSO1_TT1_16_VWB1_WG32_8_1
    SolutionIndex: 78
    SolutionNameMin: Cijk_Ailk_Bljk_HHS_BH_MT32x32x64_MI16x16x16x1_SN_CLR0_EPS0_ELFLR4_EMLL0_GLS0_LBSPPA512_LBSPPB128_NTC2_NTD2_NEPBS8_SU4_SPO0_SSO0_TT1_16_VWB1_WG32_8_1
    SolutionIndex: 79
    SolutionNameMin: Cijk_Ailk_Bljk_HHS_BH_MT64x32x64_MI16x16x16x1_SN_CLR1_EPS1_ELFLR0_EMLL2_GLS0_LBSPPA1024_LBSPPB256_NTC2_NTD2_NEPBS8_SU8_SPO0_SSO1_TT1_32_VWB2_WG64_4_1
    SolutionIndex: 80
    SolutionNameMin: Cijk_Ailk_Bljk_HHS_BH_MT16x16x64_MI16x16x16x1_SN_CLR0_GLVWA2_GLVWB2_GRVWn1_LBSPPA128_LPB4_LRVW4_MIAV0_NTC0_NTD0_NEPBS16_PLR1_SU8_SUS128_SSO0_VFLRP0_WG16_4_4_WGM12
    SolutionIndex: 81
    SolutionNameMin: Cijk_Ailk_Bljk_HHS_BH_MT16x16x64_MI16x16x16x1_SN_CLR0_GLVWA4_GLVWB4_GRVW4_LBSPPA128_LPB4_LRVW4_MIAV0_NTC0_NTD0_NEPBS16_PLR1_SU8_SUS128_SSO0_VFLRP1_WG16_4_4_WGM30
    SolutionIndex: 82
    SolutionNameMin: Cijk_Ailk_Bljk_HHS_BH_MT16x16x64_MI16x16x16x1_SN_CLR0_GLVWA2_GLVWB2_GRVWn1_LBSPPA128_LPB4_LRVW4_MIAV0_NTC0_NTD0_NEPBS16_PLR1_SU8_SUS128_SSO4_VFLRP1_WG16_4_4_WGM30
    SolutionIndex: 83
    SolutionNameMin: Cijk_Ailk_Bljk_HHS_BH_MT16x16x64_MI16x16x16x1_SN_CLR0_GLVWA4_GLVWB4_GRVW4_LBSPPA128_LPB4_LRVW4_MIAV0_NTC0_NTD0_NEPBS0_PLR1_SU8_SUS128_SSO0_VFLRP1_WG16_4_4_WGM30
    SolutionIndex: 84
    SolutionNameMin: Cijk_Ailk_Bljk_HHS_BH_MT64x128x32_MI16x16x16x1_SN_CLR1_ELFLR4_GLVWA4_GLVWB4_GRVW4_LBSPPB256_LPB4_MIAV1_NEPBS0_PLR3_SU8_SUS128_SSO0_TT2_64_VWB4_VFLRP1_WG32_8_1_WGM12
    SolutionIndex: 85
    SolutionNameMin: Cijk_Ailk_Bljk_HHS_BH_MT64x128x32_MI16x16x16x1_SN_CLR1_ELFLR0_GLVWA8_GLVWB8_GRVW8_LBSPPB256_LPB8_MIAV0_NEPBS16_PLR1_SU0_SUS0_SSO4_TT2_128_VWB4_VFLRP1_WG32_4_1_WGM30
    SolutionIndex: 86
    SolutionNameMin: Cijk_Ailk_Bljk_HHS_BH_MT64x128x32_MI16x16x16x1_SN_CLR1_ELFLR0_GLVWA8_GLVWB8_GRVW8_LBSPPB256_LPB8_MIAV0_NEPBS0_PLR3_SU8_SUS128_SSO0_TT2_128_VWB4_VFLRP1_WG32_4_1_WGM12
    SolutionIndex: 87
    SolutionNameMin: Cijk_Ailk_Bljk_HHS_BH_MT64x128x32_MI16x16x16x1_SN_CLR1_ELFLR0_GLVWA8_GLVWB8_GRVW8_LBSPPB128_LPB8_MIAV0_NEPBS0_PLR1_SU8_SUS128_SSO4_TT2_64_VWB1_VFLRP1_WG32_8_1_WGM12
    SolutionIndex: 88
    SolutionNameMin: Cijk_Ailk_Bljk_HHS_BH_MT64x128x32_MI16x16x16x1_SN_CLR1_ELFLR0_GLVWA8_GLVWB8_GRVW8_LBSPPB128_LPB8_MIAV1_NEPBS16_PLR1_SU8_SUS128_SSO0_TT2_64_VWB1_VFLRP1_WG32_8_1_WGM30
    SolutionIndex: 89
    SolutionNameMin: Cijk_Ailk_Bljk_HHS_BH_MT64x64x32_MI16x16x16x1_SN_1LDSB1_CLR0_ELFLR0_IU2_LBSPPB128_LPB8_MIAV1_NEPBS0_PLR1_SIA2_SLW0_SSO0_TLDS1_UMLDSB1_VWB1_VFLRP0_WGM30
    SolutionIndex: 90
    SolutionNameMin: Cijk_Ailk_Bljk_HHS_BH_MT64x64x32_MI16x16x16x1_SN_1LDSB1_CLR0_ELFLR4_IU2_LBSPPB128_LPB8_MIAV1_NEPBS16_PLR1_SIA2_SLW1_SSO4_TLDS1_UMLDSB1_VWB1_VFLRP0_WGM30
    SolutionIndex: 91
    SolutionNameMin: Cijk_Ailk_Bljk_HHS_BH_MT64x64x32_MI16x16x16x1_SN_1LDSB1_CLR0_ELFLR4_IU2_LBSPPB128_LPB8_MIAV0_NEPBS16_PLR1_SIA2_SLW0_SSO4_TLDS1_UMLDSB1_VWB2_VFLRP0_WGM12
    SolutionIndex: 92
    SolutionNameMin: Cijk_Ailk_Bljk_HHS_BH_MT64x64x32_MI16x16x16x1_SN_1LDSB1_CLR0_ELFLR0_IU2_LBSPPB128_LPB8_MIAV0_NEPBS0_PLR1_SIA2_SLW1_SSO4_TLDS1_UMLDSB1_VWB1_VFLRP0_WGM12
    SolutionIndex: 93
    SolutionNameMin: Cijk_Ailk_Bljk_HHS_BH_MT128x16x64_MI16x16x16x1_SN_1LDSB0_ETB_GLVWA2_GLVWB2_GSU12_LBSPPB128_LPB4_NTA0_NLCA2_PLR1_PKA1_SVW2_TT4_16_VW2_WG32_4_2
    SolutionIndex: 94
    SolutionNameMin: Cijk_Ailk_Bljk_HHS_BH_MT256x16x64_MI16x16x16x1_SN_1LDSB0_ETB_GLVWA4_GLVWB4_GSU12_LBSPPB128_LPB4_NTA4_NLCA2_PLR1_PKA1_SVW4_TT8_16_VW4_WG32_4_2
    SolutionIndex: 95
    SolutionNameMin: Cijk_Ailk_Bljk_HHS_BH_MT128x32x64_MI16x16x16x1_SN_1LDSB0_ETSP_GLVWA2_GLVWB2_GSU16_LBSPPB256_LPB4_NTA0_NLCA2_PLR3_PKA0_SVW2_TT4_32_VW2_WG32_4_2
    SolutionIndex: 96
    SolutionNameMin: Cijk_Ailk_Bljk_HHS_BH_MT256x32x64_MI16x16x16x1_SN_1LDSB1_ETB_GLVWA2_GLVWB8_GSU8_LBSPPB256_LPB8_NTA0_NLCA2_PLR5_PKA1_SVW2_TT4_32_VW2_WG64_4_1
    SolutionIndex: 97
    SolutionNameMin: Cijk_Ailk_Bljk_HHS_BH_MT64x16x64_MI16x16x16x1_SN_DTVA1_ETSP_GLVWA4_GLVWB4_GSU1_GSUASB_LBSPPA0_LBSPPB128_LPA0_LPB4_NLCA1_PLR1_PKA0_SVW4_TT4_16_VW4_WG16_4_4
    SolutionIndex: 98
    SolutionNameMin: Cijk_Ailk_Bljk_HHS_BH_MT64x16x128_MI16x16x16x1_SN_DTVA1_ETB_GLVWA4_GLVWB2_GSU1_GSUASB_LBSPPA0_LBSPPB256_LPA0_LPB4_NLCA1_PLR1_PKA1_SVW4_TT4_16_VW4_WG16_4_4
    SolutionIndex: 99
    SolutionNameMin: Cijk_Ailk_Bljk_HHS_BH_MT64x32x128_MI16x16x16x1_SN_DTVA1_ETB_GLVWA2_GLVWB8_GSU1_GSUASB_LBSPPA0_LBSPPB512_LPA0_LPB8_NTA0_NLCA2_PLR1_PKA1_SVW2_TT4_32_VW2_WG16_4_4
    SolutionIndex: 100
    SolutionNameMin: Cijk_Ailk_Bljk_HHS_BH_MT64x32x128_MI16x16x16x1_SN_DTVA1_ETB_GLVWA2_GLVWB2_GSU1_GSUASB_LBSPPA0_LBSPPB512_LPA0_LPB4_NTA0_NLCA2_PLR1_PKA1_SVW2_TT4_32_VW2_WG16_4_4
    SolutionIndex: 101
    SolutionNameMin: Cijk_Ailk_Bljk_HHS_BH_MT256x224x64_MI16x16x16x1_SN_
    SolutionIndex: 102
    SolutionNameMin: Cijk_Ailk_Bljk_HHS_BH_MT96x64x16_MI16x16x16x1_SN_1LDSB0_AMAS3_ELFLR0_FL0_GLVWA2_GLVWB2_GRVW2_LPA32_NLCA3_TT6_16_VW2_WG16_16_1_WGM30
    SolutionIndex: 103
    SolutionNameMin: Cijk_Ailk_Bljk_HHS_BH_MT96x128x32_MI16x16x16x1_SN_1LDSB0_AMAS0_ELFLR0_FL0_GLVWA2_GLVWB2_GRVW2_LPA16_NLCA3_TT3_64_VW1_WG32_8_1_WGM1
    SolutionIndex: 104
    SolutionNameMin: Cijk_Ailk_Bljk_HHS_BH_MT16x32x64_MI16x16x16x1_SN_AMAS0_EPS1_ELFLR0_LBSPPA128_LBSPPB128_LPA16_NEPBS16_PGR2_SU8_SUS256_SSO0_TT1_16_TLDS1_VW1_VWB1_WG16_8_2_WGM30
    SolutionIndex: 105
    SolutionNameMin: Cijk_Ailk_Bljk_HHS_BH_MT32x16x64_MI16x16x16x1_SN_AMAS0_EPS1_ELFLR4_LBSPPA256_LBSPPB128_LPA16_NEPBS16_PGR2_SU0_SUS0_SSO0_TT1_16_TLDSn1_VW1_VWB1_WG32_4_2_WGM12
    SolutionIndex: 106
    SolutionNameMin: Cijk_Ailk_Bljk_HHS_BH_MT32x16x64_MI16x16x16x1_SN_AMAS0_EPS1_ELFLR4_LBSPPA256_LBSPPB128_LPA16_NEPBS0_PGR2_SU0_SUS0_SSO4_TT1_16_TLDSn1_VW1_VWB1_WG32_4_2_WGM1
    SolutionIndex: 107
    SolutionNameMin: Cijk_Ailk_Bljk_HHS_BH_MT64x128x64_MI32x32x8x1_SN_1LDSB0_AMAS3_CLR1_EPS1_ELFLR4_GSU18_GSUAMB_LBSPPB256_LPB4_PGR2_PLR5_SSO4_TLDS1_UMLDSB1_VW2_VFLRP1_WG32_4_2_WGM12
    SolutionIndex: 108
    SolutionNameMin: Cijk_Ailk_Bljk_HHS_BH_MT32x16x64_MI16x16x16x1_SN_AMAS0_EPS1_ELFLR4_GLVWA4_GLVWB4_GRVW4_LBSPPA256_LBSPPB128_LPA16_LPB4_MIAV1_PGR2_PLR1_TT1_16_TLDS1_UMLDSB1_VW1_WG32_4_1_WGM30
    SolutionIndex: 109
    SolutionNameMin: Cijk_Ailk_Bljk_HHS_BH_MT64x16x64_MI16x16x16x1_SN_AMAS0_EPS1_ELFLR4_GLVWA2_GLVWB2_GRVW2_LBSPPA512_LBSPPB128_LPA16_LPB4_MIAV1_PGR2_PLR1_TT1_16_TLDS1_UMLDSB1_VW1_WG64_4_1_WGM30
    SolutionIndex: 110
    SolutionNameMin: Cijk_Ailk_Bljk_HHS_BH_MT96x128x32_MI16x16x16x1_SN_1LDSB0_AMAS0_ELFLR4_FL0_GLVWA2_GLVWB2_GRVW2_LPA16_NLCA3_TT3_64_VW1_WG32_8_1_WGM30
    SolutionIndex: 111
    SolutionNameMin: Cijk_Ailk_Bljk_HHS_BH_MT16x32x64_MI16x16x16x1_SN_AMAS0_EPS1_ELFLR4_GLVWA4_GLVWB4_GRVW4_LBSPPA128_LBSPPB128_LPA16_LPB4_MIAV1_PGR2_PLR5_TT1_16_TLDS1_UMLDSB1_VW1_WG16_8_1_WGM12
    SolutionIndex: 112
    SolutionNameMin: Cijk_Ailk_Bljk_HHS_BH_MT16x16x64_MI16x16x16x1_SN_AMAS0_EPS1_ELFLR0_GLVWA4_GLVWB4_GRVW4_LBSPPA128_LBSPPB128_LPA16_LPB4_MIAV1_PGR2_PLR1_TT1_16_TLDS1_UMLDSB1_VW1_WG16_4_1_WGM12
    SolutionIndex: 113
    SolutionNameMin: Cijk_Ailk_Bljk_HHS_BH_MT32x16x64_MI16x16x16x1_SN_AMAS0_EPS1_ELFLR0_GLVWA2_GLVWB2_GRVW2_LBSPPA256_LBSPPB128_LPA16_LPB4_MIAV0_PGR2_PLR1_TT1_16_TLDS1_UMLDSB1_VW1_WG32_4_1_WGM1
    SolutionIndex: 114
    SolutionNameMin: Cijk_Ailk_Bljk_HHS_BH_MT32x64x64_MI16x16x16x1_SN_AMAS3_EPS1_ELFLR4_GLVWA8_GLVWB4_LBSPPA256_LBSPPB256_LPA32_NEPBS16_PGR2_SU0_SUS0_SSO0_TT2_32_TLDSn1_VW2_VWB2_WG16_8_2_WGM1
    SolutionIndex: 115
    SolutionNameMin: Cijk_Ailk_Bljk_HHS_BH_MT64x64x64_MI32x32x8x1_SN_1LDSB1_AMAS3_CLR1_EPS1_GLVWA8_GLVWB4_GSU9_GSUAMB_LBSPPB256_LPB4_PGR2_PLR3_SSO4_TLDS1_UMLDSB1_VW2_VFLRP1_WG32_2_4_WGM30
    SolutionIndex: 116
    SolutionNameMin: Cijk_Ailk_Bljk_HHS_BH_MT64x64x64_MI32x32x8x1_SN_1LDSB0_AMAS3_CLR1_EPS1_GLVWA8_GLVWB4_GSU9_GSUAMB_LBSPPB256_LPB4_PGR2_PLR3_SSO0_TLDS1_UMLDSB1_VW2_VFLRP1_WG32_2_4_WGM12
    SolutionIndex: 117
    SolutionNameMin: Cijk_Ailk_Bljk_HHS_BH_MT64x128x64_MI32x32x8x1_SN_1LDSB0_AMAS3_CLR1_EPS1_GLVWA8_GLVWB2_GSU18_GSUAMB_LBSPPB256_LPB4_PGR2_PLR5_SSO0_TLDS1_UMLDSB1_VW2_VFLRP1_WG32_4_2_WGM30
    SolutionIndex: 118
    SolutionNameMin: Cijk_Ailk_Bljk_HHS_BH_MT64x128x64_MI32x32x8x1_SN_1LDSB1_AMAS0_CLR0_EPS1_GLVWA2_GLVWB2_GSU9_GSUAMB_LBSPPB256_LPB4_PGR2_PLR5_SSO4_TLDS1_UMLDSB1_VW1_VFLRP0_WG32_4_2_WGM30
    SolutionIndex: 119
    SolutionNameMin: Cijk_Ailk_Bljk_HHS_BH_MT64x128x64_MI32x32x8x1_SN_1LDSB1_AMAS3_CLR1_EPS1_GLVWA8_GLVWB2_GSU9_GSUAMB_LBSPPB256_LPB4_PGR2_PLR5_SSO0_TLDS1_UMLDSB1_VW2_VFLRP1_WG32_4_2_WGM12
    SolutionIndex: 120
    SolutionNameMin: Cijk_Ailk_Bljk_HHS_BH_MT32x64x32_MI16x16x16x1_SN_AMAS0_EPS0_ELFLR4_GLVWA2_GLVWB2_GRVW2_LBSPPA256_LBSPPB128_LPA16_LPB4_MIAV0_PGR0_PLR3_TT2_16_TLDS1_UMLDSB1_VW1_WG16_16_1_WGM12
    SolutionIndex: 121
    SolutionNameMin: Cijk_Ailk_Bljk_HHS_BH_MT64x16x64_MI16x16x16x1_SN_AMAS0_ELFLR0_LBSPPA512_LBSPPB128_LPA16_LPB4_PGR2_PLR5_SU8_SUS256_TT1_16_TLDS1_UMLDSB1_VW1_VWB1_WG64_4_1_WGM12
    SolutionIndex: 122
    SolutionNameMin: Cijk_Ailk_Bljk_HHS_BH_MT64x32x64_MI16x16x16x1_SN_AMAS3_ELFLR0_LBSPPA512_LBSPPB128_LPA32_LPB4_PGR2_PLR1_SU0_SUS0_TT2_16_TLDS1_UMLDSB1_VW2_VWB1_WG32_8_1_WGM12
    SolutionIndex: 123
    SolutionNameMin: Cijk_Ailk_Bljk_HHS_BH_MT64x32x64_MI16x16x16x1_SN_AMAS3_ELFLR4_LBSPPA512_LBSPPB128_LPA32_LPB4_PGR2_PLR1_SU8_SUS256_TT2_16_TLDS1_UMLDSB1_VW2_VWB1_WG32_8_1_WGM12
    SolutionIndex: 124
    SolutionNameMin: Cijk_Ailk_Bljk_HHS_BH_MT128x128x32_MI32x32x8x1_SN_AMAS3_ELFLR0_LBSPPA0_LBSPPB128_LPA0_LPB4_PGR2_PLR5_SU0_SUS0_TT2_64_TLDS1_UMLDSB1_VW2_VWB1_WG64_4_1_WGM30
    SolutionIndex: 125
    SolutionNameMin: Cijk_Ailk_Bljk_HHS_BH_MT256x128x32_MI16x16x16x1_SN_AMAS0_ELFLR0_LBSPPA2048_LBSPPB128_LPA16_LPB4_PGR2_PLR1_SU0_SUS0_TT4_128_TLDS1_UMLDSB1_VW1_VWB2_WG64_4_1_WGM30
    SolutionIndex: 126
    SolutionNameMin: Cijk_Ailk_Bljk_HHS_BH_MT256x128x32_MI16x16x16x1_SN_AMAS3_ELFLR4_LBSPPA2048_LBSPPB128_LPA32_LPB4_PGR2_PLR1_SU0_SUS0_TT4_128_TLDS1_UMLDSB1_VW2_VWB2_WG64_4_1_WGM12
    SolutionIndex: 127
    SolutionNameMin: Cijk_Ailk_Bljk_HHS_BH_MT32x16x64_MI16x16x16x1_SN_AMAS0_CLR0_EPS1_ELFLR0_LBSPPA256_LBSPPB128_LPA16_NEPBS0_PGR1_PLR3_SU8_SUS256_SSO0_TT1_16_VW1_VWB1_VFLRP1_WG32_4_2_WGM1
    SolutionIndex: 128
    SolutionNameMin: Cijk_Ailk_Bljk_HHS_BH_MT16x32x64_MI16x16x16x1_SN_AMAS0_CLR1_EPS1_ELFLR0_LBSPPA128_LBSPPB128_LPA16_NEPBS16_PGR2_PLR3_SU8_SUS256_SSO0_TT1_16_VW1_VWB1_VFLRP1_WG16_8_2_WGM1
    SolutionIndex: 129
    SolutionNameMin: Cijk_Ailk_Bljk_HHS_BH_MT32x16x64_MI16x16x16x1_SN_AMAS0_CLR1_EPS1_ELFLR0_LBSPPA256_LBSPPB128_LPA16_NEPBS16_PGR2_PLR3_SU0_SUS0_SSO0_TT1_16_VW1_VWB1_VFLRP1_WG32_4_2_WGM30
    SolutionIndex: 130
    SolutionNameMin: Cijk_Ailk_Bljk_HHS_BH_MT32x16x64_MI16x16x16x1_SN_AMAS0_CLR0_EPS1_ELFLR0_LBSPPA256_LBSPPB128_LPA16_NEPBS0_PGR2_PLR3_SU8_SUS256_SSO4_TT1_16_VW1_VWB1_VFLRP0_WG32_4_2_WGM12
    SolutionIndex: 131
    SolutionNameMin: Cijk_Ailk_Bljk_HHS_BH_MT32x16x64_MI16x16x16x1_SN_AMAS0_CLR1_EPS1_ELFLR0_LBSPPA256_LBSPPB128_LPA16_NEPBS0_PGR2_PLR3_SU8_SUS256_SSO4_TT1_16_VW1_VWB1_VFLRP1_WG32_4_2_WGM1
    SolutionIndex: 132
    SolutionNameMin: Cijk_Ailk_Bljk_HHS_BH_MT32x16x64_MI16x16x16x1_SN_AMAS0_CLR0_EPS0_ELFLR4_LBSPPA256_LBSPPB128_LPA16_NEPBS0_PGR0_PLR3_SU8_SUS256_SSO4_TT1_16_VW1_VWB1_VFLRP0_WG32_4_2_WGM12
    SolutionIndex: 133
    SolutionNameMin: Cijk_Ailk_Bljk_HHS_BH_MT32x32x64_MI16x16x16x1_SN_AMAS0_CLR0_EPS1_ELFLR0_LBSPPA256_LBSPPB256_LPA16_NEPBS16_PGR2_PLR3_SU8_SUS256_SSO4_TT1_32_VW1_VWB2_VFLRP0_WG32_4_2_WGM12
    SolutionIndex: 134
    SolutionNameMin: Cijk_Ailk_Bljk_HHS_BH_MT32x16x64_MI16x16x16x1_SN_AMAS0_CLR1_EPS1_ELFLR0_LBSPPA256_LBSPPB128_LPA16_NEPBS0_PGR2_PLR3_SU0_SUS0_SSO0_TT1_16_VW1_VWB1_VFLRP1_WG32_4_2_WGM1
    SolutionIndex: 135
    SolutionNameMin: Cijk_Ailk_Bljk_HHS_BH_MT32x32x64_MI16x16x16x1_SN_AMAS0_CLR0_EPS1_ELFLR0_LBSPPA256_LBSPPB256_LPA16_NEPBS0_PGR2_PLR3_SU8_SUS256_SSO0_TT1_32_VW1_VWB2_VFLRP0_WG32_4_2_WGM1
    SolutionIndex: 136
    SolutionNameMin: Cijk_Ailk_Bljk_HHS_BH_MT128x64x64_MI32x32x8x1_SN_AMAS3_CLR1_EPS1_ELFLR0_LBSPPA0_LBSPPB256_LPA0_NEPBS0_PGR2_PLR5_SU8_SUS256_SSO0_TT2_64_VW2_VWB2_VFLRP1_WG64_2_2_WGM30
    SolutionIndex: 137
    SolutionNameMin: Cijk_Ailk_Bljk_HHS_BH_MT128x64x64_MI16x16x16x1_SN_AMAS3_CLR1_EPS1_ELFLR0_LBSPPA1024_LBSPPB256_LPA32_NEPBS16_PGR2_PLR3_SU0_SUS0_SSO4_TT4_64_VW2_VWB2_VFLRP1_WG32_4_2_WGM30
    SolutionIndex: 138
    SolutionNameMin: Cijk_Ailk_Bljk_HHS_BH_MT128x64x64_MI16x16x16x1_SN_AMAS3_CLR1_EPS1_ELFLR0_LBSPPA1024_LBSPPB256_LPA32_NEPBS16_PGR2_PLR3_SU0_SUS0_SSO4_TT4_64_VW2_VWB2_VFLRP1_WG32_4_2_WGM12
    SolutionIndex: 139
    SolutionNameMin: Cijk_Ailk_Bljk_HHS_BH_MT64x64x64_MI32x32x8x1_SN_AMAS3_CLR1_EPS1_ELFLR0_GLVWA2_GLVWB2_LBSPPA0_LBSPPB256_LPA0_LPB4_PGR2_PLR3_SU0_SUS0_SSO0_TT2_64_TLDS1_UMLDSB1_VW2_VFLRP1_WG32_2_4_WGM1
    SolutionIndex: 140
    SolutionNameMin: Cijk_Ailk_Bljk_HHS_BH_MT128x64x64_MI32x32x8x1_SN_AMAS3_CLR1_EPS1_ELFLR0_GLVWA2_GLVWB2_LBSPPA0_LBSPPB256_LPA0_LPB4_PGR2_PLR5_SU0_SUS0_SSO0_TT2_64_TLDS1_UMLDSB1_VW2_VFLRP1_WG64_2_2_WGM1
    SolutionIndex: 141
    SolutionNameMin: Cijk_Ailk_Bljk_HHS_BH_MT64x64x64_MI32x32x8x1_SN_AMAS3_EPS1_ELFLR4_GLVWA2_GLVWB2_LBSPPA0_LBSPPB256_LPA0_LPB4_NLCA1_PGR2_PLR3_SU0_SUS0_SSO4_TT2_64_TLDS1_UMLDSB1_VW2_WG32_2_4_WGM1
    SolutionIndex: 142
    SolutionNameMin: Cijk_Ailk_Bljk_HHS_BH_MT256x128x32_MI16x16x16x1_SN_1LDSB1_AMAS3_CLR1_ELFLR4_GLVWA2_GLVWB2_LBSPPA2048_LBSPPB128_LPA32_NLCA1_PGR2_PLR3_SSO4_TT4_128_VW2_VWB2_VFLRP1_WSGRA0_WG64_4_1_WGM1
    SolutionIndex: 143
    SolutionNameMin: Cijk_Ailk_Bljk_HHS_BH_MT256x256x32_MI32x32x8x1_SN_
    SolutionIndex: 144
    SolutionNameMin: Cijk_Ailk_Bljk_HHS_BH_MT128x128x64_MI16x16x16x1_SN_1LDSB0_ELFLR0_GLVWB4_LPB4_NTC1_NTD1_NLCB1_SU0_SUS0_SSO0_VWB4
    SolutionIndex: 145
    SolutionNameMin: Cijk_Ailk_Bljk_HHS_BH_MT128x128x64_MI16x16x16x1_SN_1LDSB0_ELFLR12_GLVWB4_LPB4_NTC0_NTD0_NLCB2_SU16_SUS256_SSO0_VWB4
    SolutionIndex: 146
    SolutionNameMin: Cijk_Ailk_Bljk_HHS_BH_MT256x128x64_MI16x16x16x1_SN_GRPM1_NTC0_NTD0_NLCB2_PGR2_SU8_SUS256_WGM1
    SolutionIndex: 147
    SolutionNameMin: Cijk_Ailk_Bljk_HHS_BH_MT256x128x64_MI16x16x16x1_SN_GRPM1_NTC0_NTD0_NLCB2_PGR2_SU32_SUS256_WGMn4
    SolutionIndex: 148
    SolutionNameMin: Cijk_Ailk_Bljk_HHS_BH_MT256x224x64_MI16x16x16x1_SN_
    SolutionIndex: 149
    SolutionNameMin: Cijk_Ailk_Bljk_HHS_BH_MT256x256x32_MI16x16x16x1_SN_
    SolutionIndex: 150
    SolutionNameMin: Cijk_Ailk_Bljk_HHS_BH_MT16x16x64_MI16x16x16x1_SN_GLVWA2_GLVWB2_GRVW2_LPB4_MIAV1_NEPBS0_SU0_SUS0_TLDS1_UMLDSB1_WG16_4_4_WGM1
    SolutionIndex: 151
    SolutionNameMin: Cijk_Ailk_Bljk_HHS_BH_MT16x16x16_MI16x16x16x1_SN_GLVWA4_GLVWB4_GRVW4_LPB16_MIAV0_NEPBS0_SU0_SUS0_TLDS0_UMLDSB0_WGM1
    SolutionIndex: 152
    SolutionNameMin: Cijk_Ailk_Bljk_HHS_BH_MT16x16x32_MI16x16x16x1_SN_GLVWA4_GLVWB4_GRVW8_LPB4_MIAV0_NEPBS4_SU0_SUS0_TLDS1_UMLDSB1_WGM24
    SolutionIndex: 153
    SolutionNameMin: Cijk_Ailk_Bljk_HHS_BH_MT16x16x64_MI16x16x16x1_SN_GLVWA2_GLVWB2_GRVW2_LPB16_MIAV0_NEPBS0_SU0_SUS0_TLDS0_UMLDSB0_WG16_4_4_WGM1
    SolutionIndex: 154
    SolutionNameMin: Cijk_Ailk_Bljk_HHS_BH_MT16x16x16_MI16x16x16x1_SN_GLVWA2_GLVWB2_GRVW2_LPB4_MIAV1_NEPBS4_SU0_SUS0_TLDS1_UMLDSB1_WGM6
    SolutionIndex: 155
    SolutionNameMin: Cijk_Ailk_Bljk_HHS_BH_MT16x16x16_MI16x16x16x1_SN_GLVWA2_GLVWB2_GRVW2_LPB4_MIAV1_NEPBS0_SU0_SUS0_TLDS1_UMLDSB1_WGM24
    SolutionIndex: 156
    SolutionNameMin: Cijk_Ailk_Bljk_HHS_BH_MT16x16x16_MI16x16x16x1_SN_GLVWA2_GLVWB2_GRVW2_LPB4_MIAV0_NEPBS4_SU0_SUS0_TLDS1_UMLDSB1_WGM1
    SolutionIndex: 157
    SolutionNameMin: Cijk_Ailk_Bljk_HHS_BH_MT16x16x16_MI16x16x16x1_SN_GLVWA4_GLVWB4_LPB4_MIAV0_NEPBS0_SU0_SUS0_TLDS1_UMLDSB1_WGM1
    SolutionIndex: 158
    SolutionNameMin: Cijk_Ailk_Bljk_HHS_BH_MT16x16x16_MI16x16x16x1_SN_GLVWA2_GLVWB2_GRVW2_LPB16_MIAV1_NEPBS4_SU0_SUS0_TLDS0_UMLDSB0_WGM6
    SolutionIndex: 159
    SolutionNameMin: Cijk_Ailk_Bljk_HHS_BH_MT16x16x64_MI16x16x16x1_SN_GLVWA4_GLVWB4_GRVW8_LPB4_MIAV1_NEPBS4_SU32_SUS256_TLDS1_UMLDSB1_WG16_4_4_WGM1
    SolutionIndex: 160
    SolutionNameMin: Cijk_Ailk_Bljk_HHS_BH_MT128x256x32_MI16x16x16x1_SN_1LDSB1_AMAS3_CLR1_EPS1_LBSPPA1024_LBSPPB128_LPA32_LPB4_MIAV1_NLCA1_PGR2_PLR3_TT4_128_VW2_VWB1_VFLRP1_WG32_8_1_WGM30
    SolutionIndex: 161
    SolutionNameMin: Cijk_Ailk_Bljk_HHS_BH_MT128x256x32_MI16x16x16x1_SN_1LDSB1_AMAS3_CLR1_EPS1_LBSPPA1024_LBSPPB128_LPA32_LPB4_MIAV0_NLCA1_PGR2_PLR1_TT4_128_VW2_VWB1_VFLRP1_WG32_8_1_WGM30
    SolutionIndex: 162
    SolutionNameMin: Cijk_Ailk_Bljk_HHS_BH_MT64x256x32_MI16x16x16x1_SN_1LDSB1_AMAS3_CLR1_EPS1_LBSPPA512_LBSPPB128_LPA32_LPB4_MIAV0_NLCA1_PGR1_PLR3_TT2_128_VW2_VWB1_VFLRP1_WG32_8_1_WGM30
    SolutionIndex: 163
    SolutionNameMin: Cijk_Ailk_Bljk_HHS_BH_MT128x256x32_MI16x16x16x1_SN_1LDSB0_AMAS3_CLR1_EPS0_LBSPPA1024_LBSPPB256_LPA32_LPB4_MIAV1_NLCA1_PGR0_PLR3_TT2_256_VW2_VWB4_VFLRP1_WG64_4_1_WGM30
    SolutionIndex: 164
    SolutionNameMin: Cijk_Ailk_Bljk_HHS_BH_MT64x256x32_MI16x16x16x1_SN_1LDSB0_AMAS3_CLR0_EPS0_LBSPPA512_LBSPPB128_LPA32_LPB4_MIAV1_NLCA1_PGR0_PLR1_TT2_128_VW2_VWB1_VFLRP1_WG32_8_1_WGM12
    SolutionIndex: 165
    SolutionNameMin: Cijk_Ailk_Bljk_HHS_BH_MT64x256x32_MI16x16x16x1_SN_1LDSB0_AMAS3_CLR1_EPS1_GLVWA8_GLVWB8_GRVW8_LBSPPA512_LBSPPB128_LPA32_LPB8_MIAV1_NLCA1_PGR2_TT2_128_VW2_VWB1_VFLRP1_WG32_8_1_WGM12
    SolutionIndex: 166
    SolutionNameMin: Cijk_Ailk_Bljk_HHS_BH_MT128x256x32_MI16x16x16x1_SN_1LDSB1_AMAS0_CLR1_EPS1_GLVWA8_GLVWB8_GRVW8_LBSPPA1024_LBSPPB256_LPA16_LPB8_MIAV1_NLCA1_PGR1_TT4_128_VW1_VWB4_VFLRP1_WG32_8_1_WGM30
    SolutionIndex: 167
    SolutionNameMin: Cijk_Ailk_Bljk_HHS_BH_MT192x256x32_MI16x16x16x1_SN_1LDSB1_AMAS0_CLR0_EPS1_GLVWA8_GLVWB8_GRVW8_LBSPPA0_LBSPPB128_LPA16_LPB8_MIAV0_NLCA3_PGR2_TT3_256_VW1_VWB1_VFLRP1_WG64_4_1_WGM12
    SolutionIndex: 168
    SolutionNameMin: Cijk_Ailk_Bljk_HHS_BH_MT64x256x16_MI16x16x16x1_SN_1LDSB1_AMAS0_CLR1_EPS1_GLVWA4_GLVWB4_GRVW4_LBSPPA512_LBSPPB128_LPA16_LPB4_MIAV0_NLCA1_PGR2_TT2_128_VW1_VWB1_VFLRP1_WG32_8_1_WGM12
    SolutionIndex: 169
    SolutionNameMin: Cijk_Ailk_Bljk_HHS_BH_MT128x224x64_MI16x16x16x1_SN_NTC4_NTD4_SSO2
    SolutionIndex: 170
    SolutionNameMin: Cijk_Ailk_Bljk_HHS_BH_MT256x224x64_MI16x16x16x1_SN_LBSPPA2048_LPA16_LPB4_NTC4_NTD4_NEPBS0_SU4_SUS128_SSO4
    SolutionIndex: 171
    SolutionNameMin: Cijk_Ailk_Bljk_HHS_BH_MT64x192x64_MI16x16x16x1_SN_
- - - [6144, 4864, 1, 4096]
    - [3, 70.659]
  - - [6144, 4864, 1, 8192]
    - [2, 74.046]
  - - [6144, 4864, 1, 16384]
    - [8, 68.435]
  - - [6144, 4864, 1, 4352]
    - [1, 72.307]
  - - [6144, 4864, 1, 8448]
    - [6, 71.533]
  - - [6144, 4864, 1, 16640]
    - [9, 68.353]
  - - [4864, 3072, 1, 4096]
    - [30, 84.85]
  - - [4864, 3072, 1, 8192]
    - [32, 88.883]
  - - [4864, 3072, 1, 16384]
    - [4, 76.438]
  - - [4864, 3072, 1, 4352]
    - [0, 75.329]
  - - [4864, 3072, 1, 8448]
    - [7, 79.887]
  - - [4864, 3072, 1, 16640]
    - [5, 74.744]
  - - [2048, 16, 1, 1024]
    - [10, 0.377]
  - - [2048, 16, 1, 8192]
    - [11, 1.462]
  - - [2048, 16, 1, 65536]
    - [12, 5.524]
  - - [8192, 16, 1, 1024]
    - [13, 1.518]
  - - [8192, 16, 1, 8192]
    - [14, 3.749]
  - - [8192, 16, 1, 65536]
    - [15, 5.408]
  - - [2048, 2048, 1, 65536]
    - [38, 76.667]
  - - [2048, 8192, 1, 65536]
    - [46, 85.497]
  - - [8192, 2048, 1, 65536]
    - [42, 77.98]
  - - [2048, 2048, 1, 1024]
    - [45, 41.15]
  - - [2048, 2048, 1, 8192]
    - [37, 61.307]
  - - [2048, 8192, 1, 1024]
    - [39, 67.471]
  - - [2048, 8192, 1, 8192]
    - [40, 78.538]
  - - [8192, 2048, 1, 1024]
    - [41, 62.4]
  - - [8192, 2048, 1, 8192]
    - [47, 77.587]
  - - [8192, 8192, 1, 1024]
    - [43, 79.127]
  - - [8192, 8192, 1, 8192]
    - [48, 81.414]
  - - [8192, 8192, 1, 65536]
    - [49, 81.637]
  - - [9728, 8192, 1, 1024]
    - [16, 53.947]
  - - [9728, 8192, 1, 8192]
    - [17, 60.177]
  - - [9728, 8192, 1, 65536]
    - [18, 63.237]
  - - [4864, 4096, 1, 8192]
    - [50, 83.721]
  - - [16, 16, 1, 1024]
    - [19, 0.004]
  - - [16, 16, 1, 8192]
    - [20, 0.015]
  - - [16, 16, 1, 65536]
    - [21, 0.097]
  - - [16, 2048, 1, 1024]
    - [22, 0.308]
  - - [16, 2048, 1, 8192]
    - [23, 1.768]
  - - [16, 2048, 1, 65536]
    - [24, 4.997]
  - - [16, 8192, 1, 1024]
    - [25, 1.195]
  - - [16, 8192, 1, 8192]
    - [26, 3.302]
  - - [16, 8192, 1, 65536]
    - [27, 5.92]
  - - [9728, 8192, 1, 16384]
    - [28, 90.44]
  - - [4864, 3072, 1, 2048]
    - [29, 77.133]
  - - [4864, 3072, 1, 6144]
    - [31, 87.062]
  - - [3072, 4864, 1, 2048]
    - [33, 77.322]
  - - [3072, 4864, 1, 4096]
    - [34, 85.226]
  - - [3072, 4864, 1, 6144]
    - [35, 87.086]
  - - [3072, 4864, 1, 8192]
    - [36, 88.7]
  - - [4096, 4096, 1, 8192]
    - [44, 83.2]
  - - [9728, 8192, 1, 16416]
    - [51, 88.752]
  - - [9728, 12288, 1, 4096]
    - [52, 80.635]
  - - [9728, 12288, 1, 8192]
    - [53, 85.656]
  - - [9728, 12288, 1, 8256]
    - [54, 87.673]
  - - [9728, 12288, 1, 16416]
    - [53, 88.067]
  - - [14592, 12288, 1, 8192]
    - [55, 84.803]
  - - [14592, 12288, 1, 8256]
    - [56, 85.018]
  - - [14592, 12288, 1, 16416]
    - [57, 87.403]
  - - [12288, 9728, 1, 16416]
    - [54, 88.868]
  - - [1216, 1024, 1, 1024]
    - [58, 15.0]
  - - [1216, 1024, 1, 2048]
    - [59, 14.8]
  - - [1216, 4096, 1, 4096]
    - [60, 22.3]
  - - [1024, 2432, 1, 2048]
    - [61, 15.8]
  - - [2432, 512, 1, 1024]
    - [62, 12.9]
  - - [4864, 256, 1, 1024]
    - [63, 12.2]
  - - [4864, 256, 1, 2048]
    - [64, 14.8]
  - - [512, 608, 1, 512]
    - [65, 2.6]
  - - [512, 608, 1, 1024]
    - [66, 4.9]
  - - [608, 512, 1, 512]
    - [67, 2.8]
  - - [608, 512, 1, 1024]
    - [68, 5.2]
  - - [1216, 256, 1, 512]
    - [69, 3.7]
  - - [2432, 2048, 1, 1024]
    - [70, 40.381]
  - - [2432, 2048, 1, 2048]
    - [71, 45.426]
  - - [2048, 2432, 1, 1024]
    - [72, 42.143]
  - - [2048, 2432, 1, 2048]
    - [73, 45.492]
  - - [9728, 128, 1, 1024]
    - [74, 20.0]
  - - [9728, 128, 1, 2048]
    - [75, 23.7]
  - - [4864, 64, 1, 512]
    - [76, 2.7]
  - - [2432, 128, 1, 512]
    - [77, 4.3]
  - - [2432, 128, 1, 1024]
    - [78, 6.2]
  - - [9728, 64, 1, 1024]
    - [79, 10.1]
  - - [64, 64, 1, 512]
    - [80, 0.1]
  - - [128, 128, 1, 512]
    - [81, 0.2]
  - - [256, 256, 1, 512]
    - [82, 1.1]
  - - [256, 256, 1, 1024]
    - [83, 1.7]
  - - [192, 24320, 1, 192]
    - [84, 11.556]
  - - [192, 99712, 1, 192]
    - [85, 16.98]
  - - [192, 102144, 1, 192]
    - [86, 16.735]
  - - [192, 99712, 1, 768]
    - [87, 35.226]
  - - [192, 102144, 1, 768]
    - [88, 34.796]
  - - [256, 398848, 1, 64]
    - [89, 8.526]
  - - [256, 408576, 1, 64]
    - [90, 8.425]
  - - [768, 97280, 1, 192]
    - [91, 18.587]
  - - [768, 102144, 1, 192]
    - [92, 17.606]
  - - [2048, 16, 1, 16384]
    - [93, 4.546]
  - - [4096, 16, 1, 16384]
    - [94, 6.124]
  - - [2048, 32, 1, 16384]
    - [95, 8.172]
  - - [4096, 32, 1, 16384]
    - [96, 11.609]
  - - [16384, 16, 1, 2048]
    - [97, 5.193]
  - - [16384, 16, 1, 4096]
    - [98, 7.555]
  - - [16384, 32, 1, 2048]
    - [99, 10.349]
  - - [16384, 32, 1, 4096]
    - [100, 13.737]
  - - [8192, 6144, 1, 4096]
    - [101, 78.1]
  - - [96, 401408, 1, 96]
    - [102, 12.949]
  - - [96, 401408, 1, 288]
    - [103, 22.682]
  - - [64, 1024, 1, 64]
    - [104, 0.148]
  - - [64, 2048, 1, 64]
    - [105, 0.292]
  - - [768, 16, 1, 512]
    - [106, 0.213]
  - - [64, 1024, 1, 32768]
    - [107, 13.204]
  - - [64, 4096, 1, 64]
    - [108, 0.574]
  - - [64, 8192, 1, 64]
    - [109, 1.062]
  - - [96, 401408, 1, 384]
    - [110, 26.515]
  - - [256, 1024, 1, 256]
    - [111, 2.302]
  - - [768, 32, 1, 512]
    - [112, 0.395]
  - - [768, 128, 1, 512]
    - [113, 1.529]
  - - [768, 512, 1, 512]
    - [114, 4.853]
  - - [32, 512, 1, 4096]
    - [115, 0.886]
  - - [32, 1024, 1, 4096]
    - [116, 1.646]
  - - [64, 2048, 1, 32768]
    - [117, 23.064]
  - - [64, 4096, 1, 32768]
    - [118, 28.764]
  - - [64, 8192, 1, 32768]
    - [119, 26.724]
  - - [32, 32, 1, 512]
    - [109, 0.019]
  - - [32, 512, 1, 2048]
    - [106, 0.669]
  - - [128, 50176, 1, 128]
    - [105, 8.464]
  - - [128, 50176, 1, 384]
    - [104, 20.058]
  - - [128, 50176, 1, 512]
    - [120, 21.505]
  - - [1024, 256, 1, 2048]
    - [121, 6.415]
  - - [1024, 512, 1, 1024]
    - [122, 8.7]
  - - [1024, 512, 1, 2048]
    - [123, 10.301]
  - - [1024, 4096, 1, 4096]
    - [124, 36.976]
  - - [1024, 8192, 1, 4096]
    - [125, 47.739]
  - - [1024, 8192, 1, 32768]
    - [126, 56.515]
  - - [1024, 16, 1, 1]
    - [127, 0.001]
  - - [1024, 16, 1, 128]
    - [128, 0.077]
  - - [1024, 16, 1, 1024]
    - [129, 0.447]
  - - [1024, 32, 1, 1]
    - [130, 0.001]
  - - [1024, 32, 1, 1024]
    - [131, 0.837]
  - - [1024, 64, 1, 1]
    - [132, 0.002]
  - - [1024, 64, 1, 1024]
    - [133, 1.452]
  - - [1024, 128, 1, 1024]
    - [134, 3.54]
  - - [1024, 256, 1, 1024]
    - [135, 5.756]
  - - [1024, 2048, 1, 4096]
    - [136, 34.51]
  - - [1024, 2048, 1, 32768]
    - [137, 40.795]
  - - [1024, 4096, 1, 32768]
    - [138, 41.01]
  - - [1024, 2048, 1, 1024]
    - [122, 21.214]
  - - [1024, 4096, 1, 1024]
    - [124, 32.891]
  - - [1024, 8192, 1, 1024]
    - [125, 26.137]
  - - [1024, 16384, 1, 1024]
    - [125, 42.507]
  - - [1024, 16384, 1, 4096]
    - [125, 66.99]
  - - [1024, 16384, 1, 32768]
    - [125, 72.487]
  - - [4096, 32, 1, 4096]
    - [139, 3.195]
  - - [4096, 512, 1, 4096]
    - [140, 36.435]
  - - [4096, 256, 1, 1024]
    - [141, 14.156]
  - - [4096, 16384, 1, 1024]
    - [142, 50.385]
  - - [4096, 2048, 1, 1024]
    - [140, 36.521]
  - - [4096, 4096, 1, 1024]
    - [140, 45.772]
  - - [4096, 8192, 1, 1024]
    - [142, 44.254]
  - - [98304, 98304, 1, 98304]
    - [143, 91.294]
  - - [19456, 256, 1, 512]
    - [144, 28.5]
  - - [19456, 256, 1, 1024]
    - [145, 37.6]
  - - [19456, 512, 1, 512]
    - [146, 33.6]
  - - [19456, 512, 1, 1024]
    - [147, 48.3]
  - - [70000, 70000, 1, 70000]
    - [148, 81.612]
  - - [50000, 50000, 1, 50000]
    - [149, 87.854]
  - - [32, 1, 1, 64]
    - [150, 0.001]
  - - [64, 1, 1, 16]
    - [151, 0.001]
  - - [64, 1, 1, 32]
    - [152, 0.001]
  - - [64, 1, 1, 64]
    - [153, 0.001]
  - - [2, 32, 1, 1]
    - [154, 0.001]
  - - [2, 128, 1, 1]
    - [155, 0.001]
  - - [2, 64, 1, 1]
    - [156, 0.001]
  - - [784, 1, 1, 16]
    - [157, 0.001]
  - - [2, 16, 1, 1]
    - [158, 0.001]
  - - [16, 1, 1, 64]
    - [159, 0.001]
  - - [384, 50432, 1, 1536]
    - [160, 28.608]
  - - [384, 50432, 1, 384]
    - [161, 13.002]
  - - [192, 200704, 1, 192]
    - [162, 21.944]
  - - [256, 802816, 1, 64]
    - [163, 7.174]
  - - [64, 802816, 1, 64]
    - [164, 5.623]
  - - [384, 12800, 1, 384]
    - [165, 7.541]
  - - [768, 200704, 1, 192]
    - [166, 15.922]
  - - [192, 200704, 1, 768]
    - [167, 28.07]
  - - [64, 200704, 1, 64]
    - [168, 4.639]
  - - [224, 32768, 1, 4000]
    - [169, 40.44]
  - - [1000, 32768, 1, 4000]
    - [170, 63.49]
  - - [1000, 1024, 1, 100]
    - [171, 0.94]
  - - [1000, 1024, 1, 4000]
    - [136, 12.59]
- null
- null
- DeviceEfficiency
