library/src/blas3/Tensile/Logic/asm_full/aquavanjaram942/aquavanjaram942_Cijk_Ailk_Bjlk_BBS_BH.yaml
- {MinimumRequiredVersion: 4.36.0}
- aquavanjaram942
- gfx942
- [Device 0049, Device 0050]
    SolutionIndex: 0
    SolutionNameMin: Cijk_Ailk_Bjlk_BBS_BH_MT256x128x16_MI32x32x8x1_SN_AMAS3_MIAV0_NTA0_NTB0_NTC2_NTD1_SVW2_VW2_WSGRA0_WSGRB0_WGM12
    SolutionIndex: 1
    SolutionNameMin: Cijk_Ailk_Bjlk_BBS_BH_MT256x128x16_MI32x32x8x1_SN_AMAS3_MIAV0_NTA0_NTB0_NTC2_NTD2_SVW2_VW2_WSGRA0_WSGRB0_WGM12
    SolutionIndex: 2
    SolutionNameMin: Cijk_Ailk_Bjlk_BBS_BH_MT256x128x16_MI32x32x8x1_SN_AMAS3_MIAV0_NTA0_NTB0_NTC3_NTD0_SVW2_VW2_WSGRA0_WSGRB0_WGM12
    SolutionIndex: 3
    SolutionNameMin: Cijk_Ailk_Bjlk_BBS_BH_MT256x128x16_MI32x32x8x1_SN_AMAS3_MIAV0_NTA0_NTB1_NTC2_NTD1_SVW2_VW2_WSGRA0_WSGRB0_WGM12
    SolutionIndex: 4
    SolutionNameMin: Cijk_Ailk_Bjlk_BBS_BH_MT256x128x16_MI32x32x8x1_SN_AMAS3_MIAV0_NTA0_NTB1_NTC2_NTD2_SVW2_VW2_WSGRA0_WSGRB0_WGM18
    SolutionIndex: 5
    SolutionNameMin: Cijk_Ailk_Bjlk_BBS_BH_MT256x128x16_MI32x32x8x1_SN_AMAS3_MIAV0_NTA0_NTB1_NTC3_NTD0_SVW2_VW2_WSGRA0_WSGRB0_WGM12
    SolutionIndex: 6
    SolutionNameMin: Cijk_Ailk_Bjlk_BBS_BH_MT256x128x16_MI32x32x8x1_SN_AMAS3_MIAV0_NTA0_NTB1_NTC3_NTD2_SVW2_VW2_WSGRA0_WSGRB0_WGM12
    SolutionIndex: 7
    SolutionNameMin: Cijk_Ailk_Bjlk_BBS_BH_MT256x128x16_MI32x32x8x1_SN_AMAS3_MIAV0_NTA0_NTB1_NTC3_NTD2_SVW2_VW2_WSGRA0_WSGRB0_WGM18
    SolutionIndex: 8
    SolutionNameMin: Cijk_Ailk_Bjlk_BBS_BH_MT256x128x16_MI32x32x8x1_SN_AMAS3_MIAV0_NTA0_NTB1_NTC3_NTD3_SVW2_VW2_WSGRA0_WSGRB0_WGM18
    SolutionIndex: 9
    SolutionNameMin: Cijk_Ailk_Bjlk_BBS_BH_MT256x128x16_MI32x32x8x1_SN_AMAS3_MIAV0_NTA1_NTB1_NTC3_NTD0_SVW2_VW2_WSGRA0_WSGRB0_WGM12
    SolutionIndex: 10
    SolutionNameMin: Cijk_Ailk_Bjlk_BBS_BH_MT256x128x16_MI32x32x8x1_SN_AMAS3_MIAV0_NTA1_NTB1_NTC3_NTD2_SVW2_VW2_WSGRA0_WSGRB0_WGM6
- - - [6144, 4864, 1, 4096]
    - [9, 75.625]
  - - [6144, 4864, 1, 8192]
    - [4, 79.757]
  - - [6144, 4864, 1, 16384]
    - [8, 81.813]
  - - [6144, 4864, 1, 4352]
    - [6, 76.068]
  - - [6144, 4864, 1, 8448]
    - [6, 79.884]
  - - [6144, 4864, 1, 16640]
    - [1, 81.842]
  - - [4864, 3072, 1, 4096]
    - [0, 74.429]
  - - [4864, 3072, 1, 8192]
    - [7, 79.047]
  - - [4864, 3072, 1, 16384]
    - [2, 81.454]
  - - [4864, 3072, 1, 4352]
    - [3, 74.923]
  - - [4864, 3072, 1, 8448]
    - [5, 79.216]
  - - [4864, 3072, 1, 16640]
    - [10, 81.448]
- null
- null
- DeviceEfficiency
