library/src/blas3/Tensile/Logic/asm_full/aquavanjaram942/aquavanjaram942_Cijk_Ailk_Bjlk_DB.yaml
- {MinimumRequiredVersion: 4.8.1}
- aquavanjaram942
- gfx942
- [Device 0049]
    SolutionIndex: 0
    SolutionNameMin: Cijk_Ailk_Bjlk_DB_MT128x128x16_MI16x16x4x1_SN_AMAS0_DTVA0_GLS0_LRVW1_NTA1_NTB1_NTC3_NTD2_NEPBS8_NLCB1_SVW1_TT2_128_VW1_WG64_4_1_WGM42
    SolutionIndex: 1
    SolutionNameMin: Cijk_Ailk_Bjlk_DB_MT128x128x16_MI16x16x4x1_SN_AMAS0_DTVA0_GLS1_LRVW1_NTA1_NTB0_NTC2_NTD2_NEPBS8_NLCB2_SVW1_TT2_128_VW1_WG64_4_1_WGM30
    SolutionIndex: 2
    SolutionNameMin: Cijk_Ailk_Bjlk_DB_MT128x128x16_MI16x16x4x1_SN_AMAS0_DTVA0_GLS1_LRVW1_NTA0_NTB0_NTC2_NTD2_NEPBS8_NLCB2_SVW1_TT2_128_VW1_WG64_4_1_WGM18
    SolutionIndex: 3
    SolutionNameMin: Cijk_Ailk_Bjlk_DB_MT128x128x16_MI16x16x4x1_SN_AMAS0_DTVA0_GLS1_LRVW1_NTA0_NTB1_NTC3_NTD3_NEPBS8_NLCB1_SVW1_TT4_64_VW1_WG32_8_1_WGM18
    SolutionIndex: 4
    SolutionNameMin: Cijk_Ailk_Bjlk_DB_MT128x128x16_MI16x16x4x1_SN_AMAS0_DTVA0_GLS1_LRVW1_NTA0_NTB1_NTC2_NTD3_NEPBS8_NLCB2_SVW1_TT4_64_VW1_WG32_8_1_WGM18
    SolutionIndex: 5
    SolutionNameMin: Cijk_Ailk_Bjlk_DB_MT128x128x16_MI16x16x4x1_SN_AMAS0_DTVA0_GLS1_LRVW1_NTA0_NTB0_NTC2_NTD2_NEPBS8_NLCB2_SVW1_TT4_64_VW1_WG32_8_1_WGM24
    SolutionIndex: 6
    SolutionNameMin: Cijk_Ailk_Bjlk_DB_MT128x128x16_MI16x16x4x1_SN_AMAS0_DTVA0_GLS1_LRVW1_NTA0_NTB1_NTC2_NTD3_NEPBS8_NLCB2_SVW1_TT2_128_VW1_WG64_4_1_WGM36
    SolutionIndex: 7
    SolutionNameMin: Cijk_Ailk_Bjlk_DB_MT128x64x16_MI16x16x4x1_SN_1LDSB1_DTVA1_GLS0_NLCB1_PLR5_TT2_64_WG64_4_1_WGM18
    SolutionIndex: 8
    SolutionNameMin: Cijk_Ailk_Bjlk_DB_MT128x64x16_MI16x16x4x1_SN_1LDSB1_DTVA1_GLS0_NLCB1_PLR5_TT2_64_WG64_4_1_WGM12
    SolutionIndex: 9
    SolutionNameMin: Cijk_Ailk_Bjlk_DB_MT128x64x16_MI16x16x4x1_SN_1LDSB1_LRVW1_NEPBS2_NLCB2_PLR1_SU0_SUS0_TT2_64_WGM30
    SolutionIndex: 10
    SolutionNameMin: Cijk_Ailk_Bjlk_DB_MT128x64x16_MI16x16x4x1_SN_1LDSB1_LRVW1_NEPBS2_NLCB2_PLR1_SU0_SUS0_TT2_64_WGM42
    SolutionIndex: 11
    SolutionNameMin: Cijk_Ailk_Bjlk_DB_MT128x64x16_MI16x16x4x1_SN_1LDSB1_LRVW1_NEPBS2_NLCB1_PLR1_SU0_SUS0_TT2_64_WGM42
    SolutionIndex: 12
    SolutionNameMin: Cijk_Ailk_Bjlk_DB_MT64x64x16_MI16x16x4x1_SN_1LDSB1_DTVA0_GLS1_NLCB2_PLR5_TT2_32_WG32_8_1_WGM30
    SolutionIndex: 13
    SolutionNameMin: Cijk_Ailk_Bjlk_DB_MT64x64x16_MI16x16x4x1_SN_1LDSB0_DTVA0_GLS0_NLCB2_PLR1_TT2_32_WG32_8_1_WGM30
    SolutionIndex: 14
    SolutionNameMin: Cijk_Ailk_Bjlk_DB_MT64x64x16_MI16x16x4x1_SN_1LDSB0_DTVA0_EPS0_NLCB2_PLR1_TT2_32_WG32_8_1_WGM30
    SolutionIndex: 15
    SolutionNameMin: Cijk_Ailk_Bjlk_DB_MT64x64x16_MI16x16x4x1_SN_1LDSB1_DTVA0_EPS0_NLCB1_PLR5_TT2_32_WG32_8_1_WGM30
    SolutionIndex: 16
    SolutionNameMin: Cijk_Ailk_Bjlk_DB_MT128x64x16_MI16x16x4x1_SN_1LDSB0_DTVA1_EPS1_NLCB1_PLR1_TT2_64_WG64_4_1_WGM30
    SolutionIndex: 17
    SolutionNameMin: Cijk_Ailk_Bjlk_DB_MT128x128x16_MI16x16x4x1_SN_
    SolutionIndex: 18
    SolutionNameMin: Cijk_Ailk_Bjlk_DB_MT64x32x16_MI16x16x4x1_SN_1LDSB0_AMAS0_DTVA1_GRVW1_NEPBS4_NLCA1_PLR5_SVW1_TT1_32_VW1_WG64_4_1_WGM12
    SolutionIndex: 19
    SolutionNameMin: Cijk_Ailk_Bjlk_DB_MT32x64x32_MI16x16x4x1_SN_1LDSB1_AMAS0_DTVA0_GRVW1_NEPBS0_NLCA1_PLR9_SVW1_TT1_32_VW1_WG32_8_1_WGM6
    SolutionIndex: 20
    SolutionNameMin: Cijk_Ailk_Bjlk_DB_MT64x32x16_MI16x16x4x1_SN_1LDSB0_AMAS0_DTVA1_GRVW1_NEPBS4_NLCA1_PLR1_SVW1_TT1_32_VW1_WG64_4_1_WGM12
    SolutionIndex: 21
    SolutionNameMin: Cijk_Ailk_Bjlk_DB_MT64x64x16_MI16x16x4x1_SN_1LDSB1_AMAS0_DTVA1_GRVW1_NEPBS0_NLCA1_PLR5_SVW1_TT1_64_VW1_WG64_4_1_WGM6
    SolutionIndex: 22
    SolutionNameMin: Cijk_Ailk_Bjlk_DB_MT64x64x32_MI16x16x4x1_SN_1LDSB1_AMAS0_DTVA1_GRVW1_NEPBS0_NLCA1_PLR9_SVW1_TT1_64_VW1_WG64_4_1_WGM6
    SolutionIndex: 23
    SolutionNameMin: Cijk_Ailk_Bjlk_DB_MT64x64x16_MI16x16x4x1_SN_1LDSB1_AMAS0_DTVA0_GRVW1_NEPBS0_NLCA1_PLR5_SVW1_TT2_32_VW1_WG32_8_1_WGM12
    SolutionIndex: 24
    SolutionNameMin: Cijk_Ailk_Bjlk_DB_MT64x64x16_MI16x16x4x1_SN_1LDSB0_AMAS0_DTVA1_GRVW1_NEPBS0_NLCA1_PLR1_SVW1_TT1_64_VW1_WG64_4_1_WGM6
    SolutionIndex: 25
    SolutionNameMin: Cijk_Ailk_Bjlk_DB_MT64x64x16_MI16x16x4x1_SN_1LDSB1_AMAS3_DTVA0_GRVW2_NEPBS0_NLCA1_PLR5_SVW2_TT2_32_VW2_WG32_8_1_WGM12
    SolutionIndex: 26
    SolutionNameMin: Cijk_Ailk_Bjlk_DB_MT128x64x16_MI16x16x4x1_SN_1LDSB1_AMAS0_DTVA0_GRVW2_NEPBS0_NLCA1_PLR5_SVW1_TT4_32_VW1_WG32_8_1_WGM12
    SolutionIndex: 27
    SolutionNameMin: Cijk_Ailk_Bjlk_DB_MT128x64x16_MI16x16x4x1_SN_1LDSB1_AMAS0_DTVA0_GRVW2_NEPBS0_NLCA1_PLR1_SVW1_TT4_32_VW1_WG32_8_1_WGM6
    SolutionIndex: 28
    SolutionNameMin: Cijk_Ailk_Bjlk_DB_MT128x64x16_MI16x16x4x1_SN_1LDSB0_AMAS0_DTVA0_GRVW1_NEPBS0_NLCA1_PLR5_SVW1_TT4_32_VW1_WG32_8_1_WGM6
    SolutionIndex: 29
    SolutionNameMin: Cijk_Ailk_Bjlk_DB_MT128x64x16_MI16x16x4x1_SN_1LDSB1_AMAS0_DTVA0_GRVW1_NEPBS0_NLCA1_PLR5_SVW1_TT2_64_VW1_WG64_4_1_WGM12
    SolutionIndex: 30
    SolutionNameMin: Cijk_Ailk_Bjlk_DB_MT128x64x16_MI16x16x4x1_SN_1LDSB0_AMAS0_DTVA0_GRVW1_NEPBS0_NLCA1_PLR1_SVW1_TT2_64_VW1_WG64_4_1_WGM12
    SolutionIndex: 31
    SolutionNameMin: Cijk_Ailk_Bjlk_DB_MT64x32x16_MI16x16x4x1_SN_1LDSB0_AMAS0_DTVA0_GRVW1_NEPBS4_NLCA1_PLR1_SVW1_TT1_32_VW1_WG64_4_1_WGM6
    SolutionIndex: 32
    SolutionNameMin: Cijk_Ailk_Bjlk_DB_MT64x64x16_MI16x16x4x1_SN_1LDSB1_AMAS0_DTVA0_GRVW2_NEPBS0_NLCA1_PLR5_SVW1_TT2_32_VW1_WG32_8_1_WGM6
    SolutionIndex: 33
    SolutionNameMin: Cijk_Ailk_Bjlk_DB_MT64x64x16_MI16x16x4x1_SN_1LDSB0_AMAS3_DTVA0_GRVW2_NEPBS4_NLCA1_PLR1_SVW2_TT2_32_VW2_WG32_8_1_WGM6
    SolutionIndex: 34
    SolutionNameMin: Cijk_Ailk_Bjlk_DB_MT64x64x16_MI16x16x4x1_SN_AMAS3_DTVA0_GRVW1_NEPBS0_NLCA1_PLR5_SVW2_TT2_32_VW2_WG32_8_1_WGM6
    SolutionIndex: 35
    SolutionNameMin: Cijk_Ailk_Bjlk_DB_MT64x32x32_MI16x16x4x1_SN_AMAS0_DTVA1_GRVW1_NEPBS0_NLCA1_PLR9_SVW1_TT1_32_VW1_WG64_4_1_WGM6
    SolutionIndex: 36
    SolutionNameMin: Cijk_Ailk_Bjlk_DB_MT64x64x16_MI16x16x4x1_SN_AMAS3_DTVA0_GRVW1_NEPBS4_NLCA1_PLR5_SVW2_TT2_32_VW2_WG32_8_1_WGM6
    SolutionIndex: 37
    SolutionNameMin: Cijk_Ailk_Bjlk_DB_MT64x64x32_MI16x16x4x1_SN_AMAS0_DTVA1_GRVW1_NEPBS0_NLCA1_PLR9_SVW1_TT1_64_VW1_WG64_4_1_WGM6
    SolutionIndex: 38
    SolutionNameMin: Cijk_Ailk_Bjlk_DB_MT64x64x16_MI16x16x4x1_SN_AMAS3_DTVA0_GRVW1_NEPBS0_NLCA1_PLR5_SVW2_TT2_32_VW2_WG32_8_1_WGM12
    SolutionIndex: 39
    SolutionNameMin: Cijk_Ailk_Bjlk_DB_MT64x64x16_MI16x16x4x1_SN_AMAS3_DTVA0_GRVW2_NEPBS0_NLCA1_PLR5_SVW2_TT2_32_VW2_WG32_8_1_WGM6
    SolutionIndex: 40
    SolutionNameMin: Cijk_Ailk_Bjlk_DB_MT64x64x32_MI16x16x4x1_SN_AMAS0_DTVA0_GRVW2_NEPBS0_NLCA1_PLR9_SVW1_TT2_32_VW1_WG32_8_1_WGM12
    SolutionIndex: 41
    SolutionNameMin: Cijk_Ailk_Bjlk_DB_MT128x64x16_MI16x16x4x1_SN_AMAS3_DTVA1_GRVW2_NEPBS0_NLCA1_PLR5_SVW2_TT2_64_VW2_WG64_4_1_WGM6
    SolutionIndex: 42
    SolutionNameMin: Cijk_Ailk_Bjlk_DB_MT128x64x16_MI16x16x4x1_SN_AMAS3_DTVA1_GRVW2_NEPBS0_NLCA1_PLR1_SVW2_TT2_64_VW2_WG64_4_1_WGM6
    SolutionIndex: 43
    SolutionNameMin: Cijk_Ailk_Bjlk_DB_MT128x64x16_MI16x16x4x1_SN_AMAS3_DTVA1_GRVW2_NEPBS0_NLCA1_PLR1_SVW2_TT2_64_VW2_WG64_4_1_WGM12
    SolutionIndex: 44
    SolutionNameMin: Cijk_Ailk_Bjlk_DB_MT128x64x16_MI16x16x4x1_SN_AMAS0_DTVA0_GRVW2_NEPBS0_NLCA1_PLR5_SVW1_TT2_64_VW1_WG64_4_1_WGM12
    SolutionIndex: 45
    SolutionNameMin: Cijk_Ailk_Bjlk_DB_MT128x64x16_MI16x16x4x1_SN_AMAS0_DTVA0_GRVW2_NEPBS0_NLCA1_PLR5_SVW1_TT4_32_VW1_WG32_8_1_WGM12
    SolutionIndex: 46
    SolutionNameMin: Cijk_Ailk_Bjlk_DB_MT128x64x16_MI16x16x4x1_SN_AMAS3_DTVA1_GRVW2_NEPBS4_NLCA1_PLR5_SVW2_TT2_64_VW2_WG64_4_1_WGM12
    SolutionIndex: 47
    SolutionNameMin: Cijk_Ailk_Bjlk_DB_MT64x64x16_MI16x16x4x1_SN_AMAS3_DTVA0_GRVW2_NEPBS4_NLCA1_PLR5_SVW2_TT2_32_VW2_WG32_8_1_WGM6
    SolutionIndex: 48
    SolutionNameMin: Cijk_Ailk_Bjlk_DB_MT128x64x16_MI16x16x4x1_SN_AMAS3_DTVA0_GRVW2_NEPBS0_NLCA1_PLR5_SVW2_TT4_32_VW2_WG32_8_1_WGM12
    SolutionIndex: 49
    SolutionNameMin: Cijk_Ailk_Bjlk_DB_MT64x32x32_MI16x16x4x1_SN_AMAS0_DTVA0_GRVW2_NEPBS4_NLCA1_PLR9_SVW1_TT1_32_VW1_WG64_4_1_WGM6
    SolutionIndex: 50
    SolutionNameMin: Cijk_Ailk_Bjlk_DB_MT128x128x16_MI16x16x4x1_SN_GLS1_SU32_SUS512_WSGRB1_WGM36
    SolutionIndex: 51
    SolutionNameMin: Cijk_Ailk_Bjlk_DB_MT128x128x16_MI16x16x4x1_SN_GRPM0p22_LWPM0p50_PGR1_SU16_SUS512_WGM48
    SolutionIndex: 52
    SolutionNameMin: Cijk_Ailk_Bjlk_DB_MT128x128x16_MI16x16x4x1_SN_GRPM0p20_LWPM1_PGR1_SU32_SUS512_WGM48
    SolutionIndex: 53
    SolutionNameMin: Cijk_Ailk_Bjlk_DB_MT128x128x16_MI16x16x4x1_SN_GRPM0p20_LWPM1_PGR1_SU16_SUS512_WGM36
    SolutionIndex: 54
    SolutionNameMin: Cijk_Ailk_Bjlk_DB_MT128x128x16_MI16x16x4x1_SN_GRPM0p20_LWPM1_PGR1_SU32_SUS512_WGM42
    SolutionIndex: 55
    SolutionNameMin: Cijk_Ailk_Bjlk_DB_MT128x128x16_MI16x16x4x1_SN_GRPM0p20_LWPM1_PGR1_SU32_SUS512_WGM36
    SolutionIndex: 56
    SolutionNameMin: Cijk_Ailk_Bjlk_DB_MT128x128x16_MI16x16x4x1_SN_GRPM0p20_LWPM1_PGR1_SU16_SUS512_WGM48
    SolutionIndex: 57
    SolutionNameMin: Cijk_Ailk_Bjlk_DB_MT128x128x16_MI16x16x4x1_SN_GRPM0p20_LWPM1_PGR1_SU16_SUS512_WGM42
    SolutionIndex: 58
    SolutionNameMin: Cijk_Ailk_Bjlk_DB_MT128x128x16_MI16x16x4x1_SN_GRPM0p22_LWPM0p50_PGR1_SU32_SUS512_WGM48
    SolutionIndex: 59
    SolutionNameMin: Cijk_Ailk_Bjlk_DB_MT128x128x16_MI16x16x4x1_SN_GRPM0p22_LWPM0p50_PGR1_SU0_SUS0_WGM36
    SolutionIndex: 60
    SolutionNameMin: Cijk_Ailk_Bjlk_DB_MT128x128x16_MI16x16x4x1_SN_GRPM0p20_LWPM1_PGR1_SU0_SUS0_WGM48
    SolutionIndex: 61
    SolutionNameMin: Cijk_Ailk_Bjlk_DB_MT128x128x16_MI16x16x4x1_SN_GRPM0p22_LWPM0p50_PGR1_SU32_SUS512_WGM42
    SolutionIndex: 62
    SolutionNameMin: Cijk_Ailk_Bjlk_DB_MT128x128x16_MI16x16x4x1_SN_GRPM0p22_LWPM0p50_PGR1_SU16_SUS512_WGM36
    SolutionIndex: 63
    SolutionNameMin: Cijk_Ailk_Bjlk_DB_MT128x128x16_MI16x16x4x1_SN_GRPM0p22_LWPM0p50_PGR1_SU16_SUS512_WGM42
    SolutionIndex: 64
    SolutionNameMin: Cijk_Ailk_Bjlk_DB_MT128x128x16_MI16x16x4x1_SN_GRPM0p20_LWPM1_PGR1_SU0_SUS0_WGM42
    SolutionIndex: 65
    SolutionNameMin: Cijk_Ailk_Bjlk_DB_MT128x128x16_MI16x16x4x1_SN_GRPM0p22_LWPM0p50_PGR1_SU0_SUS0_WGM48
    SolutionIndex: 66
    SolutionNameMin: Cijk_Ailk_Bjlk_DB_MT128x128x16_MI16x16x4x1_SN_GRPM0p22_LWPM0p50_PGR1_SU0_SUS0_WGM42
    SolutionIndex: 67
    SolutionNameMin: Cijk_Ailk_Bjlk_DB_MT128x128x16_MI16x16x4x1_SN_GRPM1_LWPM0p13_PGR2_SU0_SUS0_WGM42
    SolutionIndex: 68
    SolutionNameMin: Cijk_Ailk_Bjlk_DB_MT128x128x16_MI16x16x4x1_SN_GRPM0p20_LWPM1_PGR1_SU0_SUS0_WGM36
    SolutionIndex: 69
    SolutionNameMin: Cijk_Ailk_Bjlk_DB_MT128x128x16_MI16x16x4x1_SN_GRPM0p20_LWPM1_PGR1_SU32_SUS512_SSO4_WGM48
    SolutionIndex: 70
    SolutionNameMin: Cijk_Ailk_Bjlk_DB_MT128x128x16_MI16x16x4x1_SN_GRPM0p20_LWPM1_PGR1_SU16_SUS512_SSO4_WGM36
    SolutionIndex: 71
    SolutionNameMin: Cijk_Ailk_Bjlk_DB_MT128x128x16_MI16x16x4x1_SN_GRPM0p20_LWPM1_PGR1_SU32_SUS512_SSO8_WGM42
    SolutionIndex: 72
    SolutionNameMin: Cijk_Ailk_Bjlk_DB_MT128x128x16_MI16x16x4x1_SN_GRPM0p20_LWPM1_PGR1_SU32_SUS512_SSO4_WGM36
    SolutionIndex: 73
    SolutionNameMin: Cijk_Ailk_Bjlk_DB_MT128x128x16_MI16x16x4x1_SN_GRPM0p20_LWPM1_PGR1_SU32_SUS512_SSO4_WGM42
    SolutionIndex: 74
    SolutionNameMin: Cijk_Ailk_Bjlk_DB_MT128x128x16_MI16x16x4x1_SN_GRPM0p20_LWPM1_PGR1_SU32_SUS512_SSO8_WGM36
    SolutionIndex: 75
    SolutionNameMin: Cijk_Ailk_Bjlk_DB_MT128x128x16_MI16x16x4x1_SN_GRPM0p20_LWPM1_PGR1_SU16_SUS512_SSO4_WGM48
    SolutionIndex: 76
    SolutionNameMin: Cijk_Ailk_Bjlk_DB_MT128x128x16_MI16x16x4x1_SN_GRPM0p20_LWPM1_PGR1_SU16_SUS512_SSO4_WGM42
    SolutionIndex: 77
    SolutionNameMin: Cijk_Ailk_Bjlk_DB_MT128x128x16_MI16x16x4x1_SN_GRPM0p20_LWPM1_PGR1_SU0_SUS0_SSO8_WGM36
    SolutionIndex: 78
    SolutionNameMin: Cijk_Ailk_Bjlk_DB_MT128x128x16_MI16x16x4x1_SN_GRPM0p20_LWPM1_PGR1_SU0_SUS0_SSO8_WGM42
    SolutionIndex: 79
    SolutionNameMin: Cijk_Ailk_Bjlk_DB_MT128x128x16_MI16x16x4x1_SN_GRPM0p20_LWPM1_PGR1_SU0_SUS0_SSO8_WGM48
    SolutionIndex: 80
    SolutionNameMin: Cijk_Ailk_Bjlk_DB_MT128x128x16_MI16x16x4x1_SN_GRPM1_LWPM0p14_PGR2_SU0_SUS0_SSO4_WGM42
    SolutionIndex: 81
    SolutionNameMin: Cijk_Ailk_Bjlk_DB_MT128x128x16_MI16x16x4x1_SN_GRPM1_LWPM0p14_PGR2_SU0_SUS0_SSO8_WGM36
    SolutionIndex: 82
    SolutionNameMin: Cijk_Ailk_Bjlk_DB_MT128x128x16_MI16x16x4x1_SN_GRPM1_LWPM0p14_PGR2_SU0_SUS0_SSO4_WGM48
    SolutionIndex: 83
    SolutionNameMin: Cijk_Ailk_Bjlk_DB_MT128x128x16_MI16x16x4x1_SN_GRPM1_LWPM0p14_PGR2_SU0_SUS0_SSO4_WGM36
    SolutionIndex: 84
    SolutionNameMin: Cijk_Ailk_Bjlk_DB_MT128x128x16_MI16x16x4x1_SN_1LDSB1_GRPM1_GLS1_LRVW2_LWPM0p14_PGR2_SU0_SUS0_SSO8_WGM6
    SolutionIndex: 85
    SolutionNameMin: Cijk_Ailk_Bjlk_DB_MT128x128x16_MI16x16x4x1_SN_1LDSB0_GRPM1_GLS1_LRVW2_LWPM0p14_PGR2_SU0_SUS0_SSO0_WGM4
    SolutionIndex: 86
    SolutionNameMin: Cijk_Ailk_Bjlk_DB_MT128x128x16_MI16x16x4x1_SN_1LDSB1_GRPM1_GLS1_LRVW2_LWPM0p14_PGR2_SU0_SUS0_SSO8_WGM4
    SolutionIndex: 87
    SolutionNameMin: Cijk_Ailk_Bjlk_DB_MT128x128x16_MI16x16x4x1_SN_1LDSB1_GRPM1_GLS1_LRVW2_LWPM0p14_PGR2_SU0_SUS0_SSO0_WGM4
    SolutionIndex: 88
    SolutionNameMin: Cijk_Ailk_Bjlk_DB_MT128x128x16_MI16x16x4x1_SN_1LDSB1_GRPM1_GLS1_LRVW2_LWPM0p14_PGR2_SU0_SUS0_SSO4_WGM4
    SolutionIndex: 89
    SolutionNameMin: Cijk_Ailk_Bjlk_DB_MT128x128x16_MI16x16x4x1_SN_1LDSB0_GRPM1_GLS1_LRVW2_LWPM0p14_PGR2_SU0_SUS0_SSO0_WGM6
    SolutionIndex: 90
    SolutionNameMin: Cijk_Ailk_Bjlk_DB_MT128x128x16_MI16x16x4x1_SN_1LDSB1_GRPM1_GLS1_LRVW2_LWPM0p14_PGR2_SU0_SUS0_SSO4_WGM6
    SolutionIndex: 91
    SolutionNameMin: Cijk_Ailk_Bjlk_DB_MT128x128x16_MI16x16x4x1_SN_1LDSB0_GRPM1_GLS1_LRVW1_LWPM0p14_PGR2_SU0_SUS0_SSO0_WGM6
    SolutionIndex: 92
    SolutionNameMin: Cijk_Ailk_Bjlk_DB_MT128x128x16_MI16x16x4x1_SN_1LDSB0_GRPM1_GLS1_LRVW2_LWPM0p14_PGR2_SU0_SUS0_SSO4_WGM6
    SolutionIndex: 93
    SolutionNameMin: Cijk_Ailk_Bjlk_DB_MT128x128x16_MI16x16x4x1_SN_1LDSB0_GRPM1_GLS0_LRVW2_LWPM0p14_PGR2_SU0_SUS0_SSO0_WGM4
    SolutionIndex: 94
    SolutionNameMin: Cijk_Ailk_Bjlk_DB_MT128x128x16_MI16x16x4x1_SN_1LDSB0_GRPM1_GLS1_LRVW2_LWPM0p14_PGR2_SU0_SUS0_SSO0_WGM2
    SolutionIndex: 95
    SolutionNameMin: Cijk_Ailk_Bjlk_DB_MT128x128x16_MI16x16x4x1_SN_1LDSB0_GRPM1_GLS1_LRVW2_LWPM0p14_PGR2_SU0_SUS0_SSO4_WGM2
    SolutionIndex: 96
    SolutionNameMin: Cijk_Ailk_Bjlk_DB_MT128x128x16_MI16x16x4x1_SN_1LDSB0_GRPM1_GLS1_LRVW2_LWPM0p14_PGR2_SU32_SUS512_SSO0_WGM2
    SolutionIndex: 97
    SolutionNameMin: Cijk_Ailk_Bjlk_DB_MT128x128x16_MI16x16x4x1_SN_1LDSB1_GRPM0p20_GLS0_LRVW2_LWPM1_PGR1_SU32_SUS512_SSO4_WGM2
    SolutionIndex: 98
    SolutionNameMin: Cijk_Ailk_Bjlk_DB_MT128x128x16_MI16x16x4x1_SN_1LDSB1_GRPM1_GLS0_LRVW2_LWPM0p14_PGR2_SU0_SUS0_SSO0_WGM2
    SolutionIndex: 99
    SolutionNameMin: Cijk_Ailk_Bjlk_DB_MT128x128x16_MI16x16x4x1_SN_1LDSB1_GRPM1_GLS1_LRVW2_LWPM0p14_PGR2_SU16_SUS512_SSO8_WGM2
    SolutionIndex: 100
    SolutionNameMin: Cijk_Ailk_Bjlk_DB_MT128x128x16_MI16x16x4x1_SN_1LDSB1_GRPM1_GLS1_LRVW2_LWPM0p14_PGR2_SU32_SUS512_SSO0_WGM2
    SolutionIndex: 101
    SolutionNameMin: Cijk_Ailk_Bjlk_DB_MT128x128x16_MI16x16x4x1_SN_1LDSB1_GRPM1_GLS0_LRVW2_LWPM0p14_PGR2_SU0_SUS0_SSO4_WGM2
    SolutionIndex: 102
    SolutionNameMin: Cijk_Ailk_Bjlk_DB_MT128x128x16_MI16x16x4x1_SN_1LDSB1_GRPM1_GLS0_LRVW2_LWPM0p14_PGR2_SU0_SUS0_SSO8_WGM2
    SolutionIndex: 103
    SolutionNameMin: Cijk_Ailk_Bjlk_DB_MT128x128x16_MI16x16x4x1_SN_1LDSB1_GRPM0p20_GLS1_LRVW2_LWPM1_PGR1_SU0_SUS0_SSO4_WGM2
    SolutionIndex: 104
    SolutionNameMin: Cijk_Ailk_Bjlk_DB_MT128x128x16_MI16x16x4x1_SN_1LDSB0_GRPM0p20_GLS1_LRVW2_LWPM1_PGR1_SU0_SUS0_SSO4_WGM6
    SolutionIndex: 105
    SolutionNameMin: Cijk_Ailk_Bjlk_DB_MT128x128x16_MI16x16x4x1_SN_1LDSB1_GRPM0p20_GLS0_LRVW1_LWPM1_PGR1_SU0_SUS0_SSO0_WGM2
    SolutionIndex: 106
    SolutionNameMin: Cijk_Ailk_Bjlk_DB_MT128x128x16_MI16x16x4x1_SN_1LDSB0_GRPM1_GLS0_LRVW2_LWPM0p14_PGR2_SU16_SUS512_SSO4_WGM4
    SolutionIndex: 107
    SolutionNameMin: Cijk_Ailk_Bjlk_DB_MT128x128x16_MI16x16x4x1_SN_1LDSB1_GRPM1_GLS0_LRVW2_LWPM0p14_PGR2_SU0_SUS0_SSO4_WGM4
    SolutionIndex: 108
    SolutionNameMin: Cijk_Ailk_Bjlk_DB_MT128x64x8_MI16x16x4x1_SN_1LDSB0_AMAS3_ELFLR0_GRPM1_GRVW2_GLS1_LRVW1_LWPMn1_NLCA1_NLCB1_PGR2_PLR1_SU0_SUS0_SVW2_TT2_64_VW2_WGM12
    SolutionIndex: 109
    SolutionNameMin: Cijk_Ailk_Bjlk_DB_MT128x128x16_MI16x16x4x1_SN_1LDSB1_GRPM0p20_GLS0_LRVW2_LWPM1_PGR1_SU0_SUS0_SSO0_WGM6
    SolutionIndex: 110
    SolutionNameMin: Cijk_Ailk_Bjlk_DB_MT128x128x16_MI16x16x4x1_SN_1LDSB0_GRPM0p20_GLS1_LRVW2_LWPM1_PGR1_SU32_SUS512_SSO0_WGM2
    SolutionIndex: 111
    SolutionNameMin: Cijk_Ailk_Bjlk_DB_MT128x128x16_MI16x16x4x1_SN_1LDSB0_GRPM0p20_GLS1_LRVW1_LWPM1_PGR1_SU0_SUS0_SSO0_WGM2
    SolutionIndex: 112
    SolutionNameMin: Cijk_Ailk_Bjlk_DB_MT128x64x16_MI16x16x4x1_SN_1LDSB1_AMAS3_ELFLR0_GRPM1_GRVW2_GLS0_LRVW1_LWPMn1_NLCA1_NLCB1_PGR2_PLR1_SU0_SUS0_SVW2_TT2_64_VW2_WGM1
    SolutionIndex: 113
    SolutionNameMin: Cijk_Ailk_Bjlk_DB_MT128x96x16_MI16x16x4x1_SN_1LDSB1_AMAS3_ELFLR0_GRPM0p33_GRVW2_GLS1_LRVW2_LWPM1_NLCA1_NLCB3_PGR1_PLR5_SU0_SUS0_SVW2_TT2_96_VW2_WGM2
    SolutionIndex: 114
    SolutionNameMin: Cijk_Ailk_Bjlk_DB_MT128x64x16_MI16x16x4x1_SN_1LDSB0_AMAS3_ELFLR0_GRPM0p40_GRVW2_GLS0_LRVW1_LWPM1_NLCA1_NLCB1_PGR1_PLR1_SU0_SUS0_SVW2_TT2_64_VW2_WGM1
    SolutionIndex: 115
    SolutionNameMin: Cijk_Ailk_Bjlk_DB_MT128x32x16_MI16x16x4x1_SN_1LDSB0_AMAS3_ELFLR0_GRPM1_GRVW2_GLS0_LRVW2_LWPMn1_NLCA1_NLCB1_PGR2_PLR5_SU0_SUS0_SVW2_TT2_32_VW2_WGM1
    SolutionIndex: 116
    SolutionNameMin: Cijk_Ailk_Bjlk_DB_MT128x128x16_MI16x16x4x1_SN_ELFLR16_GRPM1_LWPM0p14_NLCA1_PGR2_SU32_SUS512_SSO4_TT2_128_WGM12
    SolutionIndex: 117
    SolutionNameMin: Cijk_Ailk_Bjlk_DB_MT128x128x16_MI16x16x4x1_SN_ELFLR4_GRPM1_LWPM0p14_NLCA1_PGR2_SU0_SUS0_SSO4_TT2_128_WGM12
    SolutionIndex: 118
    SolutionNameMin: Cijk_Ailk_Bjlk_DB_MT128x128x16_MI16x16x4x1_SN_ELFLR16_GRPM1_LWPM0p14_NLCA1_PGR2_SU0_SUS0_SSO4_TT2_128_WGM12
    SolutionIndex: 119
    SolutionNameMin: Cijk_Ailk_Bjlk_DB_MT128x96x16_MI16x16x4x1_SN_1LDSB1_AMAS3_ELFLR0_GRPM0p33_GRVW2_GLS0_LRVW2_LWPM1_NLCA1_NLCB3_PGR1_PLR5_SU0_SUS0_SVW2_TT2_96_VW2_WGM1
    SolutionIndex: 120
    SolutionNameMin: Cijk_Ailk_Bjlk_DB_MT128x64x16_MI16x16x4x1_SN_1LDSB1_AMAS3_ELFLR0_GRPM0p40_GRVW2_GLS0_LRVW1_LWPM1_NLCA1_NLCB1_PGR1_PLR1_SU0_SUS0_SVW2_TT2_64_VW2_WGM1
    SolutionIndex: 121
    SolutionNameMin: Cijk_Ailk_Bjlk_DB_MT128x64x16_MI16x16x4x1_SN_1LDSB1_AMAS3_ELFLR0_GRPM1_GRVW2_GLS0_LRVW2_LWPMn1_NLCA1_NLCB1_PGR2_PLR5_SU0_SUS0_SVW2_TT2_64_VW2_WGM1
    SolutionIndex: 122
    SolutionNameMin: Cijk_Ailk_Bjlk_DB_MT256x64x16_MI16x16x4x1_SN_ELFLR4_GRPM1_LWPM0p14_NLCA2_PGR2_SU0_SUS0_SSO4_TT4_64_WGM6
    SolutionIndex: 123
    SolutionNameMin: Cijk_Ailk_Bjlk_DB_MT128x128x16_MI16x16x4x1_SN_1LDSB1_AMAS3_ELFLR8_GRPM1_GRVW2_GLS1_LRVW1_LWPMn1_NLCA1_NLCB1_PGR2_PLR1_SU0_SUS0_SVW2_TT2_128_VW2_WGM12
    SolutionIndex: 124
    SolutionNameMin: Cijk_Ailk_Bjlk_DB_MT128x128x16_MI16x16x4x1_SN_ELFLR16_GRPM1_LWPM0p14_NLCA1_PGR2_SU0_SUS0_SSO4_TT2_128_WGM18
    SolutionIndex: 125
    SolutionNameMin: Cijk_Ailk_Bjlk_DB_MT128x128x16_MI16x16x4x1_SN_1LDSB0_AMAS3_ELFLR8_GRPM1_GRVW2_GLS0_LRVW1_LWPMn1_NLCA1_NLCB1_PGR2_PLR1_SU0_SUS0_SVW2_TT2_128_VW2_WGM1
    SolutionIndex: 126
    SolutionNameMin: Cijk_Ailk_Bjlk_DB_MT128x64x16_MI16x16x4x1_SN_1LDSB0_AMAS3_ELFLR0_GRPM0p40_GRVW2_GLS0_LRVW2_LWPM1_NLCA1_NLCB1_PGR1_PLR5_SU0_SUS0_SVW2_TT2_64_VW2_WGM12
    SolutionIndex: 127
    SolutionNameMin: Cijk_Ailk_Bjlk_DB_MT128x128x16_MI16x16x4x1_SN_1LDSB1_AMAS3_ELFLR8_GRPM0p20_GRVW2_GLS1_LRVW2_LWPM1_NLCA1_NLCB1_PGR1_PLR5_SU0_SUS0_SVW2_TT2_128_VW2_WGM12
    SolutionIndex: 128
    SolutionNameMin: Cijk_Ailk_Bjlk_DB_MT128x128x16_MI16x16x4x1_SN_1LDSB1_AMAS3_ELFLR8_GRPM0p20_GRVW2_GLS0_LRVW2_LWPM1_NLCA1_NLCB1_PGR1_PLR5_SU0_SUS0_SVW2_TT2_128_VW2_WGM12
    SolutionIndex: 129
    SolutionNameMin: Cijk_Ailk_Bjlk_DB_MT128x96x16_MI16x16x4x1_SN_1LDSB0_AMAS3_ELFLR0_GRPM0p33_GRVW2_GLS0_LRVW2_LWPM1_NLCA1_NLCB3_PGR1_PLR5_SU0_SUS0_SVW2_TT2_96_VW2_WGM1
    SolutionIndex: 130
    SolutionNameMin: Cijk_Ailk_Bjlk_DB_MT128x64x16_MI16x16x4x1_SN_1LDSB0_AMAS3_ELFLR0_GRPM1_GRVW2_GLS1_LRVW2_LWPMn1_NLCA1_NLCB1_PGR2_PLR5_SU0_SUS0_SVW2_TT2_64_VW2_WGM1
    SolutionIndex: 131
    SolutionNameMin: Cijk_Ailk_Bjlk_DB_MT128x128x16_MI16x16x4x1_SN_1LDSB0_AMAS3_ELFLR8_GRPM0p20_GRVW2_GLS1_LRVW2_LWPM1_NLCA1_NLCB1_PGR1_PLR5_SU0_SUS0_SVW2_TT2_128_VW2_WGM1
    SolutionIndex: 132
    SolutionNameMin: Cijk_Ailk_Bjlk_DB_MT128x64x16_MI16x16x4x1_SN_1LDSB1_AMAS3_ELFLR0_GRPM1_GRVW2_GLS1_LRVW2_LWPMn1_NLCA1_NLCB1_PGR2_PLR5_SU0_SUS0_SVW2_TT2_64_VW2_WGM1
    SolutionIndex: 133
    SolutionNameMin: Cijk_Ailk_Bjlk_DB_MT128x96x16_MI16x16x4x1_SN_1LDSB1_AMAS3_ELFLR0_GRPM0p33_GRVW2_GLS0_LRVW2_LWPM1_NLCA1_NLCB3_PGR1_PLR5_SU16_SUS512_SVW2_TT2_96_VW2_WGM12
    SolutionIndex: 134
    SolutionNameMin: Cijk_Ailk_Bjlk_DB_MT128x128x16_MI16x16x4x1_SN_1LDSB1_AMAS3_ELFLR8_GRPM1_GRVW2_GLS1_LRVW2_LWPMn1_NLCA1_NLCB1_PGR2_PLR5_SU0_SUS0_SVW2_TT2_128_VW2_WGM12
    SolutionIndex: 135
    SolutionNameMin: Cijk_Ailk_Bjlk_DB_MT128x128x16_MI16x16x4x1_SN_1LDSB0_AMAS3_ELFLR8_GRPM1_GRVW2_GLS0_LRVW2_LWPMn1_NLCA1_NLCB1_PGR2_PLR5_SU0_SUS0_SVW2_TT2_128_VW2_WGM12
    SolutionIndex: 136
    SolutionNameMin: Cijk_Ailk_Bjlk_DB_MT128x128x16_MI16x16x4x1_SN_1LDSB0_AMAS3_ELFLR8_GRPM1_GRVW2_GLS1_LRVW2_LWPMn1_NLCA1_NLCB1_PGR2_PLR5_SU16_SUS512_SVW2_TT2_128_VW2_WGM12
    SolutionIndex: 137
    SolutionNameMin: Cijk_Ailk_Bjlk_DB_MT128x128x16_MI16x16x4x1_SN_ELFLR4_GRPM0p20_LWPM1_NLCA1_PGR1_SU0_SUS0_SSO8_TT2_128_WGM18
    SolutionIndex: 138
    SolutionNameMin: Cijk_Ailk_Bjlk_DB_MT128x96x16_MI16x16x4x1_SN_1LDSB0_AMAS3_ELFLR0_GRPM0p33_GRVW2_GLS0_LRVW2_LWPM1_NLCA1_NLCB3_PGR1_PLR5_SU0_SUS0_SVW2_TT2_96_VW2_WGM12
    SolutionIndex: 139
    SolutionNameMin: Cijk_Ailk_Bjlk_DB_MT128x96x16_MI16x16x4x1_SN_1LDSB0_AMAS3_ELFLR0_GRPM0p33_GRVW2_GLS0_LRVW1_LWPM1_NLCA1_NLCB3_PGR1_PLR5_SU0_SUS0_SVW2_TT2_96_VW2_WGM2
    SolutionIndex: 140
    SolutionNameMin: Cijk_Ailk_Bjlk_DB_MT128x32x16_MI16x16x4x1_SN_1LDSB0_AMAS3_ELFLR0_GRPM1_GRVW2_GLS0_LRVW2_LWPMn1_NLCA1_NLCB1_PGR2_PLR5_SU0_SUS0_SVW2_TT2_32_VW2_WGM2
    SolutionIndex: 141
    SolutionNameMin: Cijk_Ailk_Bjlk_DB_MT128x64x16_MI16x16x4x1_SN_1LDSB1_AMAS3_ELFLR0_GRPM0p40_GRVW2_GLS1_LRVW2_LWPM1_NLCA1_NLCB1_PGR1_PLR5_SU0_SUS0_SVW2_TT2_64_VW2_WGM1
    SolutionIndex: 142
    SolutionNameMin: Cijk_Ailk_Bjlk_DB_MT128x32x16_MI16x16x4x1_SN_1LDSB0_AMAS3_ELFLR0_GRPM1_GRVW2_GLS0_LRVW1_LWPMn1_NLCA1_NLCB1_PGR2_PLR5_SU0_SUS0_SVW2_TT2_32_VW2_WGM1
    SolutionIndex: 143
    SolutionNameMin: Cijk_Ailk_Bjlk_DB_MT128x32x8_MI16x16x4x1_SN_1LDSB1_AMAS3_ELFLR0_GRPM1_GRVW2_GLS0_LRVW1_LWPMn1_NLCA1_NLCB1_PGR2_PLR3_SU0_SUS0_SVW2_TT2_32_VW2_WGM1
    SolutionIndex: 144
    SolutionNameMin: Cijk_Ailk_Bjlk_DB_MT128x32x8_MI16x16x4x1_SN_1LDSB0_AMAS3_ELFLR0_GRPM1_GRVW2_GLS0_LRVW1_LWPMn1_NLCA1_NLCB1_PGR2_PLR1_SU0_SUS0_SVW2_TT2_32_VW2_WGM1
    SolutionIndex: 145
    SolutionNameMin: Cijk_Ailk_Bjlk_DB_MT128x32x8_MI16x16x4x1_SN_1LDSB0_AMAS3_ELFLR0_GRPM1_GRVW2_GLS1_LRVW1_LWPMn1_NLCA1_NLCB1_PGR2_PLR1_SU0_SUS0_SVW2_TT2_32_VW2_WGM2
    SolutionIndex: 146
    SolutionNameMin: Cijk_Ailk_Bjlk_DB_MT128x32x16_MI16x16x4x1_SN_1LDSB0_AMAS3_ELFLR0_GRPM1_GRVW2_GLS0_LRVW1_LWPMn1_NLCA1_NLCB1_PGR2_PLR1_SU0_SUS0_SVW2_TT2_32_VW2_WGM12
    SolutionIndex: 147
    SolutionNameMin: Cijk_Ailk_Bjlk_DB_MT128x32x16_MI16x16x4x1_SN_1LDSB0_AMAS3_ELFLR0_GRPM1_GRVW2_GLS0_LRVW1_LWPMn1_NLCA1_NLCB1_PGR2_PLR5_SU16_SUS512_SVW2_TT2_32_VW2_WGM12
    SolutionIndex: 148
    SolutionNameMin: Cijk_Ailk_Bjlk_DB_MT128x32x16_MI16x16x4x1_SN_1LDSB0_AMAS3_ELFLR0_GRPM1_GRVW2_GLS0_LRVW2_LWPMn1_NLCA1_NLCB1_PGR2_PLR5_SU0_SUS0_SVW2_TT2_32_VW2_WGM12
    SolutionIndex: 149
    SolutionNameMin: Cijk_Ailk_Bjlk_DB_MT128x128x16_MI16x16x4x1_SN_GRPM1_LWPM0p14_NLCB1_PGR2_SU0_SUS0_SSO4_WGM42
    SolutionIndex: 150
    SolutionNameMin: Cijk_Ailk_Bjlk_DB_MT128x128x16_MI16x16x4x1_SN_GRPM0p20_LWPM1_NLCB1_PGR1_SU0_SUS0_SSO8_WGM36
    SolutionIndex: 151
    SolutionNameMin: Cijk_Ailk_Bjlk_DB_MT128x128x16_MI16x16x4x1_SN_ELFLR16_GRPM0p20_LWPM1_NLCA1_PGR1_SU0_SUS0_SSO4_TT2_128_WGM18
    SolutionIndex: 152
    SolutionNameMin: Cijk_Ailk_Bjlk_DB_MT128x128x16_MI16x16x4x1_SN_ELFLR16_GRPM0p20_LWPM1_NLCA1_PGR1_SU32_SUS512_SSO8_TT2_128_WGM12
    SolutionIndex: 153
    SolutionNameMin: Cijk_Ailk_Bjlk_DB_MT128x128x16_MI16x16x4x1_SN_ELFLR4_GRPM0p20_LWPM1_NLCA1_PGR1_SU0_SUS0_SSO4_TT2_128_WGM18
    SolutionIndex: 154
    SolutionNameMin: Cijk_Ailk_Bjlk_DB_MT128x128x16_MI16x16x4x1_SN_ELFLR16_GRPM0p20_LWPM1_NLCA1_PGR1_SU16_SUS512_SSO4_TT2_128_WGM12
    SolutionIndex: 155
    SolutionNameMin: Cijk_Ailk_Bjlk_DB_MT128x128x16_MI16x16x4x1_SN_ELFLR16_GRPM0p20_LWPM1_NLCA1_PGR1_SU0_SUS0_SSO4_TT2_128_WGM12
    SolutionIndex: 156
    SolutionNameMin: Cijk_Ailk_Bjlk_DB_MT128x128x16_MI16x16x4x1_SN_ELFLR4_GRPM1_LWPM0p14_NLCA1_PGR2_SU32_SUS512_SSO4_TT2_128_WGM18
    SolutionIndex: 157
    SolutionNameMin: Cijk_Ailk_Bjlk_DB_MT128x128x16_MI16x16x4x1_SN_ELFLR4_GRPM1_LWPM0p14_NLCA1_PGR2_SU0_SUS0_SSO8_TT2_128_WGM18
    SolutionIndex: 158
    SolutionNameMin: Cijk_Ailk_Bjlk_DB_MT128x128x16_MI16x16x4x1_SN_ELFLR4_GRPM1_LWPM0p14_NLCA1_PGR2_SU0_SUS0_SSO4_TT2_128_WGM18
    SolutionIndex: 159
    SolutionNameMin: Cijk_Ailk_Bjlk_DB_MT256x64x16_MI16x16x4x1_SN_ELFLR16_GRPM0p20_LWPM1_NLCA2_PGR1_SU0_SUS0_SSO4_TT4_64_WGM18
    SolutionIndex: 160
    SolutionNameMin: Cijk_Ailk_Bjlk_DB_MT256x64x16_MI16x16x4x1_SN_ELFLR16_GRPM0p20_LWPM1_NLCA2_PGR1_SU16_SUS512_SSO4_TT4_64_WGM12
    SolutionIndex: 161
    SolutionNameMin: Cijk_Ailk_Bjlk_DB_MT128x128x16_MI16x16x4x1_SN_ELFLR4_GRPM1_LWPM0p14_NLCA1_PGR2_SU16_SUS512_SSO8_TT2_128_WGM12
    SolutionIndex: 162
    SolutionNameMin: Cijk_Ailk_Bjlk_DB_MT256x64x16_MI16x16x4x1_SN_ELFLR4_GRPM1_LWPM0p14_NLCA2_PGR2_SU0_SUS0_SSO4_TT4_64_WGM18
    SolutionIndex: 163
    SolutionNameMin: Cijk_Ailk_Bjlk_DB_MT256x16x32_MI16x16x4x1_SN_1LDSB0_DTVA1_DTVB0_GLVWA1_GLVWB1_GRPM1_GRVW1_GLS0_NLCA4_NLCB1_PGR1_PLR1_TT4_16_WG64_4_2
    SolutionIndex: 164
    SolutionNameMin: Cijk_Ailk_Bjlk_DB_MT256x16x16_MI16x16x4x1_SN_1LDSB1_DTVA0_DTVB0_GLVWA2_GLVWB1_GRPM1_GRVW2_GLS0_NLCA1_NLCB1_PGR2_PLR1_TT4_16_WG64_4_1
    SolutionIndex: 165
    SolutionNameMin: Cijk_Ailk_Bjlk_DB_MT16x16x64_MI16x16x4x1_SN_1LDSB1_DTVA1_DTVB1_GRPM0p50_GRVW1_GLS0_NLCA1_NLCB1_PGR1_PLR5_TT1_16_WG16_4_4
    SolutionIndex: 166
    SolutionNameMin: Cijk_Ailk_Bjlk_DB_MT128x128x16_MI16x16x4x1_SN_GRPM0p20_LWPM1_PGR1_SU16_SSO4_USFGRO1_WGM48
    SolutionIndex: 167
    SolutionNameMin: Cijk_Ailk_Bjlk_DB_MT128x128x16_MI16x16x4x1_SN_GRPM0p20_LWPM1_PGR1_SU16_SSO4_USFGRO1_WGM42
    SolutionIndex: 168
    SolutionNameMin: Cijk_Ailk_Bjlk_DB_MT128x128x16_MI16x16x4x1_SN_GRPM0p20_LWPM1_PGR1_SU32_SSO4_USFGRO1_WGM48
    SolutionIndex: 169
    SolutionNameMin: Cijk_Ailk_Bjlk_DB_MT128x128x16_MI16x16x4x1_SN_GRPM0p20_LWPM1_PGR1_SU32_SSO4_USFGRO1_WGM42
    SolutionIndex: 170
    SolutionNameMin: Cijk_Ailk_Bjlk_DB_MT128x128x16_MI16x16x4x1_SN_GRPM0p20_LWPM1_NLCB1_PGR1_SU32_SSO4_USFGRO1_WGM42
    SolutionIndex: 171
    SolutionNameMin: Cijk_Ailk_Bjlk_DB_MT128x128x16_MI16x16x4x1_SN_GRPM0p20_LWPM1_NLCB1_PGR1_SU16_SSO4_USFGRO1_WGM42
    SolutionIndex: 172
    SolutionNameMin: Cijk_Ailk_Bjlk_DB_MT128x128x16_MI16x16x4x1_SN_GRPM0p22_LWPM0p50_PGR1_SU16_SUS512_WGM48
    SolutionIndex: 173
    SolutionNameMin: Cijk_Ailk_Bjlk_DB_MT128x128x16_MI16x16x4x1_SN_GRPM0p22_LWPM0p50_PGR1_SU32_SUS512_WGM48
    SolutionIndex: 174
    SolutionNameMin: Cijk_Ailk_Bjlk_DB_MT128x128x16_MI16x16x4x1_SN_GRPM0p20_LWPM1_PGR1_SU16_SUS512_WGM36
    SolutionIndex: 175
    SolutionNameMin: Cijk_Ailk_Bjlk_DB_MT128x128x16_MI16x16x4x1_SN_GRPM0p20_LWPM1_PGR1_SU16_SUS512_WGM42
    SolutionIndex: 176
    SolutionNameMin: Cijk_Ailk_Bjlk_DB_MT128x128x16_MI16x16x4x1_SN_GRPM0p22_LWPM0p50_PGR1_SU16_SUS512_WGM42
    SolutionIndex: 177
    SolutionNameMin: Cijk_Ailk_Bjlk_DB_MT128x128x16_MI16x16x4x1_SN_GRPM0p20_LWPM1_PGR1_SU16_SUS512_WGM48
    SolutionIndex: 178
    SolutionNameMin: Cijk_Ailk_Bjlk_DB_MT128x128x16_MI16x16x4x1_SN_GRPM0p20_LWPM1_PGR1_SU32_SUS512_WGM36
    SolutionIndex: 179
    SolutionNameMin: Cijk_Ailk_Bjlk_DB_MT128x128x16_MI16x16x4x1_SN_GRPM0p22_LWPM0p50_PGR1_SU32_SUS512_WGM42
    SolutionIndex: 180
    SolutionNameMin: Cijk_Ailk_Bjlk_DB_MT128x128x16_MI16x16x4x1_SN_GRPM0p22_LWPM0p50_PGR1_SU32_SUS512_WGM36
    SolutionIndex: 181
    SolutionNameMin: Cijk_Ailk_Bjlk_DB_MT128x128x16_MI16x16x4x1_SN_GRPM0p22_LWPM0p50_PGR1_SU16_SUS512_WGM36
    SolutionIndex: 182
    SolutionNameMin: Cijk_Ailk_Bjlk_DB_MT128x128x16_MI16x16x4x1_SN_GRPM0p22_LWPM0p50_PGR1_SU0_SUS0_WGM36
    SolutionIndex: 183
    SolutionNameMin: Cijk_Ailk_Bjlk_DB_MT128x128x16_MI16x16x4x1_SN_GRPM0p20_LWPM1_PGR1_SU32_SUS512_WGM42
    SolutionIndex: 184
    SolutionNameMin: Cijk_Ailk_Bjlk_DB_MT128x128x16_MI16x16x4x1_SN_GRPM0p20_LWPM1_PGR1_SU32_SUS512_WGM48
    SolutionIndex: 185
    SolutionNameMin: Cijk_Ailk_Bjlk_DB_MT128x128x16_MI16x16x4x1_SN_GRPM0p20_LWPM1_PGR1_SU0_SUS0_WGM36
    SolutionIndex: 186
    SolutionNameMin: Cijk_Ailk_Bjlk_DB_MT128x128x16_MI16x16x4x1_SN_GRPM0p20_LWPM1_PGR1_SU0_SUS0_WGM42
    SolutionIndex: 187
    SolutionNameMin: Cijk_Ailk_Bjlk_DB_MT128x128x16_MI16x16x4x1_SN_GRPM0p20_LWPM1_PGR1_SU0_SUS0_WGM48
    SolutionIndex: 188
    SolutionNameMin: Cijk_Ailk_Bjlk_DB_MT128x128x16_MI16x16x4x1_SN_GRPM0p22_LWPM0p50_PGR1_SU0_SUS0_WGM42
    SolutionIndex: 189
    SolutionNameMin: Cijk_Ailk_Bjlk_DB_MT128x128x16_MI16x16x4x1_SN_GRPM1_LWPM0p14_PGR2_SU0_SUS0_WGM36
    SolutionIndex: 190
    SolutionNameMin: Cijk_Ailk_Bjlk_DB_MT128x128x16_MI16x16x4x1_SN_GRPM1_LWPM0p13_PGR2_SU0_SUS0_WGM48
    SolutionIndex: 191
    SolutionNameMin: Cijk_Ailk_Bjlk_DB_MT128x128x16_MI16x16x4x1_SN_GRPM1_LWPM0p13_PGR2_SU0_SUS0_WGM42
    SolutionIndex: 192
    SolutionNameMin: Cijk_Ailk_Bjlk_DB_MT128x128x16_MI16x16x4x1_SN_GRPM1_LWPM0p13_PGR2_SU0_SUS0_WGM36
    SolutionIndex: 193
    SolutionNameMin: Cijk_Ailk_Bjlk_DB_MT128x128x16_MI16x16x4x1_SN_GRPM0p20_LWPM1_PGR1_SU32_SUS512_SSO4_WGM48
    SolutionIndex: 194
    SolutionNameMin: Cijk_Ailk_Bjlk_DB_MT128x128x16_MI16x16x4x1_SN_GRPM0p20_LWPM1_PGR1_SU16_SUS512_SSO4_WGM42
    SolutionIndex: 195
    SolutionNameMin: Cijk_Ailk_Bjlk_DB_MT128x128x16_MI16x16x4x1_SN_GRPM0p20_LWPM1_PGR1_SU32_SUS512_SSO8_WGM42
    SolutionIndex: 196
    SolutionNameMin: Cijk_Ailk_Bjlk_DB_MT128x128x16_MI16x16x4x1_SN_GRPM0p20_LWPM1_PGR1_SU16_SUS512_SSO4_WGM48
    SolutionIndex: 197
    SolutionNameMin: Cijk_Ailk_Bjlk_DB_MT128x128x16_MI16x16x4x1_SN_GRPM0p20_LWPM1_PGR1_SU32_SUS512_SSO4_WGM36
    SolutionIndex: 198
    SolutionNameMin: Cijk_Ailk_Bjlk_DB_MT128x128x16_MI16x16x4x1_SN_GRPM0p20_LWPM1_PGR1_SU16_SUS512_SSO4_WGM36
    SolutionIndex: 199
    SolutionNameMin: Cijk_Ailk_Bjlk_DB_MT128x128x16_MI16x16x4x1_SN_GRPM0p20_LWPM1_PGR1_SU16_SUS512_SSO8_WGM36
    SolutionIndex: 200
    SolutionNameMin: Cijk_Ailk_Bjlk_DB_MT128x128x16_MI16x16x4x1_SN_GRPM0p20_LWPM1_PGR1_SU0_SUS0_SSO8_WGM48
    SolutionIndex: 201
    SolutionNameMin: Cijk_Ailk_Bjlk_DB_MT128x128x16_MI16x16x4x1_SN_GRPM0p20_LWPM1_PGR1_SU0_SUS0_SSO8_WGM36
    SolutionIndex: 202
    SolutionNameMin: Cijk_Ailk_Bjlk_DB_MT128x128x16_MI16x16x4x1_SN_GRPM0p20_LWPM1_PGR1_SU0_SUS0_SSO4_WGM36
    SolutionIndex: 203
    SolutionNameMin: Cijk_Ailk_Bjlk_DB_MT128x128x16_MI16x16x4x1_SN_GRPM1_LWPM0p14_PGR2_SU32_SUS512_SSO8_WGM42
    SolutionIndex: 204
    SolutionNameMin: Cijk_Ailk_Bjlk_DB_MT128x128x16_MI16x16x4x1_SN_GRPM0p20_LWPM1_PGR1_SU0_SUS0_SSO4_WGM42
    SolutionIndex: 205
    SolutionNameMin: Cijk_Ailk_Bjlk_DB_MT128x128x16_MI16x16x4x1_SN_GRPM0p20_LWPM1_PGR1_SU0_SUS0_SSO4_WGM48
    SolutionIndex: 206
    SolutionNameMin: Cijk_Ailk_Bjlk_DB_MT128x128x16_MI16x16x4x1_SN_GRPM1_LWPM0p14_PGR2_SU0_SUS0_SSO4_WGM42
    SolutionIndex: 207
    SolutionNameMin: Cijk_Ailk_Bjlk_DB_MT128x128x16_MI16x16x4x1_SN_GRPM1_LWPM0p14_PGR2_SU0_SUS0_SSO4_WGM36
    SolutionIndex: 208
    SolutionNameMin: Cijk_Ailk_Bjlk_DB_MT128x128x16_MI16x16x4x1_SN_GRPM1_LWPM0p14_PGR2_SU0_SUS0_SSO4_WGM48
    SolutionIndex: 209
    SolutionNameMin: Cijk_Ailk_Bjlk_DB_MT128x128x16_MI16x16x4x1_SN_1LDSB1_GRPM1_GLS0_LRVW2_LWPM0p14_PGR2_SU0_SUS0_SSO4_WGM4
    SolutionIndex: 210
    SolutionNameMin: Cijk_Ailk_Bjlk_DB_MT128x128x16_MI16x16x4x1_SN_1LDSB0_GRPM0p20_GLS1_LRVW2_LWPM1_PGR1_SU0_SUS0_SSO8_WGM4
    SolutionIndex: 211
    SolutionNameMin: Cijk_Ailk_Bjlk_DB_MT128x128x16_MI16x16x4x1_SN_1LDSB1_GRPM1_GLS0_LRVW2_LWPM0p14_PGR2_SU0_SUS0_SSO8_WGM4
    SolutionIndex: 212
    SolutionNameMin: Cijk_Ailk_Bjlk_DB_MT128x128x16_MI16x16x4x1_SN_1LDSB0_GRPM0p20_GLS1_LRVW2_LWPM1_PGR1_SU0_SUS0_SSO0_WGM4
    SolutionIndex: 213
    SolutionNameMin: Cijk_Ailk_Bjlk_DB_MT128x128x16_MI16x16x4x1_SN_1LDSB1_GRPM1_GLS1_LRVW2_LWPM0p14_PGR2_SU0_SUS0_SSO0_WGM4
    SolutionIndex: 214
    SolutionNameMin: Cijk_Ailk_Bjlk_DB_MT128x128x16_MI16x16x4x1_SN_1LDSB0_GRPM1_GLS1_LRVW2_LWPM0p14_PGR2_SU0_SUS0_SSO4_WGM4
    SolutionIndex: 215
    SolutionNameMin: Cijk_Ailk_Bjlk_DB_MT128x128x16_MI16x16x4x1_SN_1LDSB1_GRPM0p20_GLS1_LRVW2_LWPM1_PGR1_SU0_SUS0_SSO4_WGM4
    SolutionIndex: 216
    SolutionNameMin: Cijk_Ailk_Bjlk_DB_MT128x128x16_MI16x16x4x1_SN_1LDSB1_GRPM1_GLS0_LRVW2_LWPM0p14_PGR2_SU0_SUS0_SSO0_WGM4
    SolutionIndex: 217
    SolutionNameMin: Cijk_Ailk_Bjlk_DB_MT128x128x16_MI16x16x4x1_SN_1LDSB0_GRPM1_GLS0_LRVW2_LWPM0p14_PGR2_SU0_SUS0_SSO0_WGM4
    SolutionIndex: 218
    SolutionNameMin: Cijk_Ailk_Bjlk_DB_MT128x128x16_MI16x16x4x1_SN_1LDSB0_GRPM1_GLS0_LRVW2_LWPM0p14_PGR2_SU0_SUS0_SSO4_WGM4
    SolutionIndex: 219
    SolutionNameMin: Cijk_Ailk_Bjlk_DB_MT128x128x16_MI16x16x4x1_SN_1LDSB1_GRPM1_GLS0_LRVW2_LWPM0p14_PGR2_SU0_SUS0_SSO4_WGM2
    SolutionIndex: 220
    SolutionNameMin: Cijk_Ailk_Bjlk_DB_MT128x128x16_MI16x16x4x1_SN_1LDSB1_GRPM1_GLS0_LRVW2_LWPM0p14_PGR2_SU0_SUS0_SSO8_WGM2
    SolutionIndex: 221
    SolutionNameMin: Cijk_Ailk_Bjlk_DB_MT128x128x16_MI16x16x4x1_SN_1LDSB0_GRPM1_GLS0_LRVW2_LWPM0p14_PGR2_SU0_SUS0_SSO8_WGM2
    SolutionIndex: 222
    SolutionNameMin: Cijk_Ailk_Bjlk_DB_MT128x128x16_MI16x16x4x1_SN_1LDSB0_GRPM1_GLS1_LRVW2_LWPM0p14_PGR2_SU16_SUS512_SSO0_WGM2
    SolutionIndex: 223
    SolutionNameMin: Cijk_Ailk_Bjlk_DB_MT128x128x16_MI16x16x4x1_SN_1LDSB1_GRPM0p20_GLS1_LRVW2_LWPM1_PGR1_SU16_SUS512_SSO4_WGM2
    SolutionIndex: 224
    SolutionNameMin: Cijk_Ailk_Bjlk_DB_MT128x128x16_MI16x16x4x1_SN_1LDSB1_GRPM0p20_GLS0_LRVW2_LWPM1_PGR1_SU16_SUS512_SSO0_WGM2
    SolutionIndex: 225
    SolutionNameMin: Cijk_Ailk_Bjlk_DB_MT128x128x16_MI16x16x4x1_SN_1LDSB0_GRPM0p20_GLS1_LRVW2_LWPM1_PGR1_SU32_SUS512_SSO0_WGM2
    SolutionIndex: 226
    SolutionNameMin: Cijk_Ailk_Bjlk_DB_MT128x128x16_MI16x16x4x1_SN_1LDSB1_GRPM0p20_GLS0_LRVW2_LWPM1_PGR1_SU0_SUS0_SSO4_WGM2
    SolutionIndex: 227
    SolutionNameMin: Cijk_Ailk_Bjlk_DB_MT128x128x16_MI16x16x4x1_SN_1LDSB1_GRPM1_GLS1_LRVW2_LWPM0p14_PGR2_SU32_SUS512_SSO0_WGM4
    SolutionIndex: 228
    SolutionNameMin: Cijk_Ailk_Bjlk_DB_MT128x128x16_MI16x16x4x1_SN_1LDSB0_GRPM0p20_GLS1_LRVW2_LWPM1_PGR1_SU0_SUS0_SSO0_WGM6
    SolutionIndex: 229
    SolutionNameMin: Cijk_Ailk_Bjlk_DB_MT128x128x16_MI16x16x4x1_SN_1LDSB1_GRPM1_GLS1_LRVW2_LWPM0p14_PGR2_SU0_SUS0_SSO0_WGM2
    SolutionIndex: 230
    SolutionNameMin: Cijk_Ailk_Bjlk_DB_MT128x128x16_MI16x16x4x1_SN_1LDSB0_GRPM1_GLS0_LRVW2_LWPM0p14_PGR2_SU0_SUS0_SSO4_WGM2
    SolutionIndex: 231
    SolutionNameMin: Cijk_Ailk_Bjlk_DB_MT128x128x16_MI16x16x4x1_SN_1LDSB0_GRPM1_GLS1_LRVW2_LWPM0p14_PGR2_SU16_SUS512_SSO0_WGM6
    SolutionIndex: 232
    SolutionNameMin: Cijk_Ailk_Bjlk_DB_MT128x128x16_MI16x16x4x1_SN_1LDSB1_GRPM0p20_GLS1_LRVW2_LWPM1_PGR1_SU0_SUS0_SSO0_WGM4
    SolutionIndex: 233
    SolutionNameMin: Cijk_Ailk_Bjlk_DB_MT128x128x16_MI16x16x4x1_SN_1LDSB0_GRPM1_GLS1_LRVW2_LWPM0p14_PGR2_SU0_SUS0_SSO0_WGM4
    SolutionIndex: 234
    SolutionNameMin: Cijk_Ailk_Bjlk_DB_MT128x128x16_MI16x16x4x1_SN_1LDSB1_GRPM0p20_GLS0_LRVW2_LWPM1_PGR1_SU0_SUS0_SSO0_WGM4
    SolutionIndex: 235
    SolutionNameMin: Cijk_Ailk_Bjlk_DB_MT128x128x16_MI16x16x4x1_SN_1LDSB0_GRPM1_GLS0_LRVW2_LWPM0p14_PGR2_SU0_SUS0_SSO0_WGM2
    SolutionIndex: 236
    SolutionNameMin: Cijk_Ailk_Bjlk_DB_MT128x128x16_MI16x16x4x1_SN_1LDSB0_GRPM1_GLS0_LRVW2_LWPM0p14_PGR2_SU32_SUS512_SSO0_WGM2
    SolutionIndex: 237
    SolutionNameMin: Cijk_Ailk_Bjlk_DB_MT128x128x16_MI16x16x4x1_SN_1LDSB1_GRPM1_GLS0_LRVW2_LWPM0p14_PGR2_SU0_SUS0_SSO0_WGM2
    SolutionIndex: 238
    SolutionNameMin: Cijk_Ailk_Bjlk_DB_MT128x128x16_MI16x16x4x1_SN_1LDSB0_GRPM0p20_GLS1_LRVW2_LWPM1_PGR1_SU0_SUS0_SSO4_WGM2
    SolutionIndex: 239
    SolutionNameMin: Cijk_Ailk_Bjlk_DB_MT128x128x16_MI16x16x4x1_SN_1LDSB0_GRPM0p20_GLS0_LRVW2_LWPM1_PGR1_SU0_SUS0_SSO0_WGM2
    SolutionIndex: 240
    SolutionNameMin: Cijk_Ailk_Bjlk_DB_MT128x128x16_MI16x16x4x1_SN_1LDSB1_GRPM1_GLS0_LRVW2_LWPM0p14_PGR2_SU16_SUS512_SSO4_WGM2
    SolutionIndex: 241
    SolutionNameMin: Cijk_Ailk_Bjlk_DB_MT128x128x16_MI16x16x4x1_SN_1LDSB0_GRPM1_GLS1_LRVW2_LWPM0p14_PGR2_SU32_SUS512_SSO4_WGM4
    SolutionIndex: 242
    SolutionNameMin: Cijk_Ailk_Bjlk_DB_MT128x128x16_MI16x16x4x1_SN_1LDSB1_GRPM0p20_GLS0_LRVW2_LWPM1_PGR1_SU16_SUS512_SSO0_WGM4
    SolutionIndex: 243
    SolutionNameMin: Cijk_Ailk_Bjlk_DB_MT128x128x16_MI16x16x4x1_SN_1LDSB1_GRPM1_GLS1_LRVW2_LWPM0p14_PGR2_SU0_SUS0_SSO0_WGM6
    SolutionIndex: 244
    SolutionNameMin: Cijk_Ailk_Bjlk_DB_MT128x128x16_MI16x16x4x1_SN_1LDSB1_GRPM1_GLS1_LRVW2_LWPM0p14_PGR2_SU0_SUS0_SSO4_WGM6
    SolutionIndex: 245
    SolutionNameMin: Cijk_Ailk_Bjlk_DB_MT128x128x16_MI16x16x4x1_SN_1LDSB1_GRPM0p20_GLS0_LRVW2_LWPM1_PGR1_SU0_SUS0_SSO0_WGM6
    SolutionIndex: 246
    SolutionNameMin: Cijk_Ailk_Bjlk_DB_MT128x128x16_MI16x16x4x1_SN_1LDSB0_GRPM1_GLS0_LRVW2_LWPM0p14_PGR2_SU32_SUS512_SSO0_WGM4
    SolutionIndex: 247
    SolutionNameMin: Cijk_Ailk_Bjlk_DB_MT128x96x16_MI16x16x4x1_SN_1LDSB1_ELFLR0_GLVWB2_GRPM0p33_GLS0_LRVW1_LWPM1_NLCB3_PGR1_PLR5_TT2_96_WGM1
    SolutionIndex: 248
    SolutionNameMin: Cijk_Ailk_Bjlk_DB_MT128x96x16_MI16x16x4x1_SN_1LDSB0_ELFLR0_GLVWB2_GRPM0p33_GLS1_LRVW2_LWPM1_NLCB3_PGR1_PLR5_TT2_96_WGM12
    SolutionIndex: 249
    SolutionNameMin: Cijk_Ailk_Bjlk_DB_MT128x128x16_MI16x16x4x1_SN_1LDSB0_GRPM1_GLS1_LRVW2_LWPM0p14_PGR2_SU16_SUS512_SSO4_WGM2
    SolutionIndex: 250
    SolutionNameMin: Cijk_Ailk_Bjlk_DB_MT128x96x16_MI16x16x4x1_SN_1LDSB1_ELFLR0_GLVWB2_GRPM0p33_GLS0_LRVW2_LWPM1_NLCB3_PGR1_PLR5_TT2_96_WGM12
    SolutionIndex: 251
    SolutionNameMin: Cijk_Ailk_Bjlk_DB_MT128x96x16_MI16x16x4x1_SN_1LDSB1_ELFLR0_GLVWB2_GRPM0p33_GLS0_LRVW1_LWPM1_NLCB3_PGR1_PLR5_TT2_96_WGM2
    SolutionIndex: 252
    SolutionNameMin: Cijk_Ailk_Bjlk_DB_MT128x64x16_MI16x16x4x1_SN_1LDSB1_ELFLR0_GLVWB2_GRPM1_GLS0_LRVW2_LWPMn1_NLCB1_PGR2_PLR5_TT2_64_WGM1
    SolutionIndex: 253
    SolutionNameMin: Cijk_Ailk_Bjlk_DB_MT128x96x16_MI16x16x4x1_SN_1LDSB1_ELFLR0_GLVWB2_GRPM0p33_GLS0_LRVW2_LWPM1_NLCB3_PGR1_PLR5_TT2_96_WGM2
    SolutionIndex: 254
    SolutionNameMin: Cijk_Ailk_Bjlk_DB_MT128x64x16_MI16x16x4x1_SN_1LDSB0_ELFLR0_GLVWB2_GRPM0p40_GLS0_LRVW1_LWPM1_NLCB1_PGR1_PLR1_TT2_64_WGM12
    SolutionIndex: 255
    SolutionNameMin: Cijk_Ailk_Bjlk_DB_MT128x64x16_MI16x16x4x1_SN_1LDSB0_ELFLR0_GLVWB2_GRPM0p40_GLS0_LRVW2_LWPM1_NLCB1_PGR1_PLR5_TT2_64_WGM1
    SolutionIndex: 256
    SolutionNameMin: Cijk_Ailk_Bjlk_DB_MT128x64x16_MI16x16x4x1_SN_1LDSB1_ELFLR0_GLVWB2_GRPM0p40_GLS0_LRVW2_LWPM1_NLCB1_PGR1_PLR5_TT2_64_WGM1
    SolutionIndex: 257
    SolutionNameMin: Cijk_Ailk_Bjlk_DB_MT128x32x16_MI16x16x4x1_SN_1LDSB0_ELFLR0_GLVWB2_GRPM1_GLS0_LRVW2_LWPMn1_NLCB1_PGR2_PLR5_TT2_32_WGM2
    SolutionIndex: 258
    SolutionNameMin: Cijk_Ailk_Bjlk_DB_MT128x32x16_MI16x16x4x1_SN_1LDSB1_ELFLR0_GLVWB2_GRPM1_GLS0_LRVW2_LWPMn1_NLCB1_PGR2_PLR5_TT2_32_WGM2
    SolutionIndex: 259
    SolutionNameMin: Cijk_Ailk_Bjlk_DB_MT128x128x16_MI16x16x4x1_SN_1LDSB0_ELFLR8_GLVWB2_GRPM0p20_GLS1_LRVW2_LWPM1_NLCB1_PGR1_PLR5_TT2_128_WGM12
    SolutionIndex: 260
    SolutionNameMin: Cijk_Ailk_Bjlk_DB_MT128x128x16_MI16x16x4x1_SN_1LDSB1_ELFLR8_GLVWB2_GRPM0p20_GLS1_LRVW2_LWPM1_NLCB1_PGR1_PLR5_TT2_128_WGM1
    SolutionIndex: 261
    SolutionNameMin: Cijk_Ailk_Bjlk_DB_MT128x128x16_MI16x16x4x1_SN_1LDSB1_ELFLR8_GLVWB2_GRPM1_GLS1_LRVW2_LWPMn1_NLCB1_PGR2_PLR5_TT2_128_WGM12
    SolutionIndex: 262
    SolutionNameMin: Cijk_Ailk_Bjlk_DB_MT128x128x16_MI16x16x4x1_SN_1LDSB0_ELFLR8_GLVWB2_GRPM1_GLS0_LRVW2_LWPMn1_NLCB1_PGR2_PLR5_TT2_128_WGM2
    SolutionIndex: 263
    SolutionNameMin: Cijk_Ailk_Bjlk_DB_MT128x128x16_MI16x16x4x1_SN_1LDSB1_ELFLR8_GLVWB2_GRPM0p20_GLS1_LRVW2_LWPM1_NLCB1_PGR1_PLR5_TT2_128_WGM12
    SolutionIndex: 264
    SolutionNameMin: Cijk_Ailk_Bjlk_DB_MT128x128x16_MI16x16x4x1_SN_1LDSB1_ELFLR8_GLVWB2_GRPM1_GLS1_LRVW2_LWPMn1_NLCB1_PGR2_PLR5_TT2_128_WGM1
    SolutionIndex: 265
    SolutionNameMin: Cijk_Ailk_Bjlk_DB_MT128x128x16_MI16x16x4x1_SN_1LDSB1_ELFLR8_GLVWB2_GRPM0p20_GLS1_LRVW2_LWPM1_NLCB1_PGR1_PLR5_TT2_128_WGM2
    SolutionIndex: 266
    SolutionNameMin: Cijk_Ailk_Bjlk_DB_MT128x128x16_MI16x16x4x1_SN_1LDSB1_ELFLR8_GLVWB2_GRPM1_GLS0_LRVW2_LWPMn1_NLCB1_PGR2_PLR5_TT2_128_WGM12
    SolutionIndex: 267
    SolutionNameMin: Cijk_Ailk_Bjlk_DB_MT128x96x16_MI16x16x4x1_SN_1LDSB0_ELFLR0_GLVWB2_GRPM0p33_GLS1_LRVW2_LWPM1_NLCB3_PGR1_PLR5_TT2_96_WGM1
    SolutionIndex: 268
    SolutionNameMin: Cijk_Ailk_Bjlk_DB_MT128x128x16_MI16x16x4x1_SN_1LDSB0_ELFLR8_GLVWB2_GRPM1_GLS1_LRVW2_LWPMn1_NLCB1_PGR2_PLR5_TT2_128_WGM12
    SolutionIndex: 269
    SolutionNameMin: Cijk_Ailk_Bjlk_DB_MT128x128x8_MI16x16x4x1_SN_1LDSB1_ELFLR8_GLVWB2_GRPM1_GLS1_LRVW1_LWPMn1_NLCB1_PGR2_PLR1_TT2_128_WGM2
    SolutionIndex: 270
    SolutionNameMin: Cijk_Ailk_Bjlk_DB_MT128x128x16_MI16x16x4x1_SN_1LDSB0_ELFLR8_GLVWB2_GRPM0p20_GLS0_LRVW2_LWPM1_NLCB1_PGR1_PLR5_TT2_128_WGM2
    SolutionIndex: 271
    SolutionNameMin: Cijk_Ailk_Bjlk_DB_MT128x96x16_MI16x16x4x1_SN_1LDSB0_ELFLR0_GLVWB2_GRPM0p33_GLS0_LRVW2_LWPM1_NLCB3_PGR1_PLR5_TT2_96_WGM12
    SolutionIndex: 272
    SolutionNameMin: Cijk_Ailk_Bjlk_DB_MT128x128x16_MI16x16x4x1_SN_ELFLR16_GRPM0p20_LWPM1_NLCA1_PGR1_SU0_SUS0_SSO4_TT2_128_WGM18
    SolutionIndex: 273
    SolutionNameMin: Cijk_Ailk_Bjlk_DB_MT128x128x16_MI16x16x4x1_SN_ELFLR4_GRPM0p20_LWPM1_NLCA1_PGR1_SU0_SUS0_SSO4_TT2_128_WGM18
    SolutionIndex: 274
    SolutionNameMin: Cijk_Ailk_Bjlk_DB_MT128x128x16_MI16x16x4x1_SN_ELFLR16_GRPM0p20_LWPM1_NLCA1_PGR1_SU16_SUS512_SSO4_TT2_128_WGM12
    SolutionIndex: 275
    SolutionNameMin: Cijk_Ailk_Bjlk_DB_MT128x128x16_MI16x16x4x1_SN_ELFLR16_GRPM0p20_LWPM1_NLCA1_PGR1_SU0_SUS0_SSO8_TT2_128_WGM18
    SolutionIndex: 276
    SolutionNameMin: Cijk_Ailk_Bjlk_DB_MT128x128x16_MI16x16x4x1_SN_ELFLR16_GRPM0p20_LWPM1_NLCA1_PGR1_SU32_SUS512_SSO4_TT2_128_WGM12
    SolutionIndex: 277
    SolutionNameMin: Cijk_Ailk_Bjlk_DB_MT128x128x16_MI16x16x4x1_SN_ELFLR4_GRPM0p20_LWPM1_NLCA1_PGR1_SU0_SUS0_SSO8_TT2_128_WGM18
    SolutionIndex: 278
    SolutionNameMin: Cijk_Ailk_Bjlk_DB_MT128x128x16_MI16x16x4x1_SN_ELFLR16_GRPM1_LWPM0p14_NLCA1_PGR2_SU0_SUS0_SSO4_TT2_128_WGM12
    SolutionIndex: 279
    SolutionNameMin: Cijk_Ailk_Bjlk_DB_MT128x128x16_MI16x16x4x1_SN_ELFLR16_GRPM1_LWPM0p14_NLCA1_PGR2_SU0_SUS0_SSO4_TT2_128_WGM18
    SolutionIndex: 280
    SolutionNameMin: Cijk_Ailk_Bjlk_DB_MT128x128x16_MI16x16x4x1_SN_ELFLR4_GRPM1_LWPM0p14_NLCA1_PGR2_SU0_SUS0_SSO8_TT2_128_WGM18
    SolutionIndex: 281
    SolutionNameMin: Cijk_Ailk_Bjlk_DB_MT128x128x16_MI16x16x4x1_SN_ELFLR4_GRPM1_LWPM0p14_NLCA1_PGR2_SU0_SUS0_SSO4_TT2_128_WGM18
    SolutionIndex: 282
    SolutionNameMin: Cijk_Ailk_Bjlk_DB_MT128x128x16_MI16x16x4x1_SN_ELFLR4_GRPM1_LWPM0p14_NLCA1_PGR2_SU0_SUS0_SSO8_TT2_128_WGM12
    SolutionIndex: 283
    SolutionNameMin: Cijk_Ailk_Bjlk_DB_MT128x128x16_MI16x16x4x1_SN_ELFLR4_GRPM1_LWPM0p14_NLCA1_PGR2_SU32_SUS512_SSO8_TT2_128_WGM12
    SolutionIndex: 284
    SolutionNameMin: Cijk_Ailk_Bjlk_DB_MT128x128x16_MI16x16x4x1_SN_ELFLR4_GRPM1_LWPM0p14_NLCA1_PGR2_SU0_SUS0_SSO4_TT2_128_WGM12
    SolutionIndex: 285
    SolutionNameMin: Cijk_Ailk_Bjlk_DB_MT128x128x16_MI16x16x4x1_SN_ELFLR4_GRPM0p20_LWPM1_NLCA1_PGR1_SU0_SUS0_SSO4_TT2_128_WGM12
    SolutionIndex: 286
    SolutionNameMin: Cijk_Ailk_Bjlk_DB_MT256x64x16_MI16x16x4x1_SN_ELFLR16_GRPM0p20_LWPM1_NLCA2_PGR1_SU16_SUS512_SSO4_TT4_64_WGM18
    SolutionIndex: 287
    SolutionNameMin: Cijk_Ailk_Bjlk_DB_MT128x128x16_MI16x16x4x1_SN_ELFLR4_GRPM1_LWPM0p14_NLCA1_PGR2_SU32_SUS512_SSO4_TT2_128_WGM12
    SolutionIndex: 288
    SolutionNameMin: Cijk_Ailk_Bjlk_DB_MT256x64x16_MI16x16x4x1_SN_ELFLR16_GRPM1_LWPM0p14_NLCA2_PGR2_SU0_SUS0_SSO4_TT4_64_WGM12
    SolutionIndex: 289
    SolutionNameMin: Cijk_Ailk_Bjlk_DB_MT256x64x16_MI16x16x4x1_SN_ELFLR16_GRPM0p20_LWPM1_NLCA2_PGR1_SU0_SUS0_SSO8_TT4_64_WGM18
    SolutionIndex: 290
    SolutionNameMin: Cijk_Ailk_Bjlk_DB_MT256x64x16_MI16x16x4x1_SN_ELFLR4_GRPM0p20_LWPM1_NLCA2_PGR1_SU0_SUS0_SSO4_TT4_64_WGM12
    SolutionIndex: 291
    SolutionNameMin: Cijk_Ailk_Bjlk_DB_MT256x64x16_MI16x16x4x1_SN_ELFLR4_GRPM1_LWPM0p14_NLCA2_PGR2_SU0_SUS0_SSO4_TT4_64_WGM18
    SolutionIndex: 292
    SolutionNameMin: Cijk_Ailk_Bjlk_DB_MT256x64x16_MI16x16x4x1_SN_ELFLR16_GRPM0p20_LWPM1_NLCA2_PGR1_SU0_SUS0_SSO4_TT4_64_WGM12
    SolutionIndex: 293
    SolutionNameMin: Cijk_Ailk_Bjlk_DB_MT256x64x16_MI16x16x4x1_SN_ELFLR16_GRPM1_LWPM0p14_NLCA2_PGR2_SU0_SUS0_SSO4_TT4_64_WGM18
    SolutionIndex: 294
    SolutionNameMin: Cijk_Ailk_Bjlk_DB_MT256x64x16_MI16x16x4x1_SN_ELFLR4_GRPM1_LWPM0p14_NLCA2_PGR2_SU0_SUS0_SSO4_TT4_64_WGM12
    SolutionIndex: 295
    SolutionNameMin: Cijk_Ailk_Bjlk_DB_MT128x128x16_MI16x16x4x1_SN_ELFLR4_GRPM1_LWPM0p14_NLCA1_PGR2_SU16_SUS512_SSO4_TT2_128_WGM12
    SolutionIndex: 296
    SolutionNameMin: Cijk_Ailk_Bjlk_DB_MT32x16x64_MI16x16x4x1_SN_1LDSB0_DTVA0_DTVB1_GLVWA1_GLVWB1_GRPM1_GRVW1_GLS0_NLCA1_NLCB1_PGR2_PLR5_TT2_16_WG16_4_4
    SolutionIndex: 297
    SolutionNameMin: Cijk_Ailk_Bjlk_DB_MT128x128x16_MI16x16x4x1_SN_GRPM0p20_LWPM1_PGR1_SU16_SSO4_USFGRO1_WGM48
    SolutionIndex: 298
    SolutionNameMin: Cijk_Ailk_Bjlk_DB_MT128x128x16_MI16x16x4x1_SN_GRPM0p20_LWPM1_PGR1_SU16_SSO4_USFGRO1_WGM42
    SolutionIndex: 299
    SolutionNameMin: Cijk_Ailk_Bjlk_DB_MT128x128x16_MI16x16x4x1_SN_GRPM0p20_LWPM1_PGR1_SU32_SSO4_USFGRO1_WGM48
    SolutionIndex: 300
    SolutionNameMin: Cijk_Ailk_Bjlk_DB_MT128x128x16_MI16x16x4x1_SN_GRPM0p20_LWPM1_PGR1_SU16_SSO8_USFGRO1_WGM42
    SolutionIndex: 301
    SolutionNameMin: Cijk_Ailk_Bjlk_DB_MT128x128x16_MI16x16x4x1_SN_GRPM0p20_LWPM1_PGR1_SU16_SSO4_USFGRO1_WGM36
    SolutionIndex: 302
    SolutionNameMin: Cijk_Ailk_Bjlk_DB_MT128x128x16_MI16x16x4x1_SN_GRPM0p20_LWPM1_PGR1_SU32_SSO8_USFGRO1_WGM36
    SolutionIndex: 303
    SolutionNameMin: Cijk_Ailk_Bjlk_DB_MT128x128x16_MI16x16x4x1_SN_GRPM0p20_LWPM1_PGR1_SU32_SSO8_USFGRO1_WGM48
    SolutionIndex: 304
    SolutionNameMin: Cijk_Ailk_Bjlk_DB_MT128x128x16_MI16x16x4x1_SN_GRPM0p20_LWPM1_PGR1_SU32_SSO8_USFGRO1_WGM42
    SolutionIndex: 305
    SolutionNameMin: Cijk_Ailk_Bjlk_DB_MT128x128x16_MI16x16x4x1_SN_GRPM0p20_LWPM1_NLCB1_PGR1_SU32_SSO8_USFGRO1_WGM42
    SolutionIndex: 306
    SolutionNameMin: Cijk_Ailk_Bjlk_DB_MT128x128x16_MI16x16x4x1_SN_GRPM0p20_LWPM1_NLCB1_PGR1_SU16_SSO4_USFGRO1_WGM42
    SolutionIndex: 307
    SolutionNameMin: Cijk_Ailk_Bjlk_DB_MT128x128x16_MI16x16x4x1_SN_GRPM0p20_LWPM1_NLCB1_PGR1_SU32_SSO4_USFGRO1_WGM42
    SolutionIndex: 308
    SolutionNameMin: Cijk_Ailk_Bjlk_DB_MT128x128x16_MI16x16x4x1_SN_GRPM0p20_LWPM1_NLCB1_PGR1_SU16_SSO4_USFGRO1_WGM36
    SolutionIndex: 309
    SolutionNameMin: Cijk_Ailk_Bjlk_DB_MT128x128x16_MI16x16x4x1_SN_GRPM0p20_LWPM1_NLCB1_PGR1_SU32_SSO4_USFGRO1_WGM36
    SolutionIndex: 310
    SolutionNameMin: Cijk_Ailk_Bjlk_DB_MT128x128x16_MI16x16x4x1_SN_GRPM0p20_LWPM1_NLCB2_PGR1_SU16_SSO8_USFGRO1_WGM36
    SolutionIndex: 311
    SolutionNameMin: Cijk_Ailk_Bjlk_DB_MT128x128x16_MI16x16x4x1_SN_GRPM0p20_LWPM1_NLCB1_PGR1_SU32_SSO8_USFGRO1_WGM36
    SolutionIndex: 312
    SolutionNameMin: Cijk_Ailk_Bjlk_DB_MT128x128x16_MI16x16x4x1_SN_GRPM0p20_LWPM1_NLCB2_PGR1_SU32_SSO4_USFGRO1_WGM18
    SolutionIndex: 313
    SolutionNameMin: Cijk_Ailk_Bjlk_DB_MT128x128x16_MI16x16x4x1_SN_GRPM0p20_LWPM1_NLCB2_PGR1_SU32_SSO4_USFGRO1_WGM36
    SolutionIndex: 314
    SolutionNameMin: Cijk_Ailk_Bjlk_DB_MT128x128x16_MI16x16x4x1_SN_GRPM1_LWPM0p14_NLCB2_PGR2_SU16_SSO4_USFGRO0_WGM18
- - - [6144, 4864, 1, 512]
    - [17, 89.473]
  - - [7296, 4096, 1, 4096]
    - [1, 98.145]
  - - [16384, 16384, 1, 4096]
    - [6, 98.831]
  - - [4864, 3072, 1, 4096]
    - [0, 97.233]
  - - [7296, 4608, 1, 4096]
    - [2, 98.269]
  - - [7296, 4608, 1, 8192]
    - [3, 98.833]
  - - [9728, 6144, 1, 4096]
    - [4, 98.646]
  - - [9728, 6144, 1, 8192]
    - [5, 99.036]
  - - [14592, 15360, 1, 512]
    - [149, 95.37]
  - - [19456, 18432, 1, 512]
    - [150, 95.066]
  - - [1030, 1030, 1, 1030]
    - [7, 37.314]
  - - [1032, 1032, 1, 1032]
    - [8, 37.805]
  - - [2046, 2046, 1, 2046]
    - [12, 66.603]
  - - [2048, 2048, 1, 2048]
    - [13, 69.186]
  - - [4094, 4094, 1, 2046]
    - [9, 90.85]
  - - [4096, 4096, 1, 2048]
    - [10, 92.994]
  - - [7296, 4864, 1, 4096]
    - [11, 97.45]
  - - [1031, 1031, 1, 1031]
    - [14, 33.905]
  - - [2047, 2047, 1, 2047]
    - [15, 63.331]
  - - [4095, 4095, 1, 2047]
    - [16, 81.582]
  - - [127488, 25088, 1, 512]
    - [51, 95.969]
  - - [127488, 25600, 1, 512]
    - [52, 95.487]
  - - [124416, 23552, 1, 512]
    - [53, 95.717]
  - - [124416, 24064, 1, 512]
    - [53, 95.727]
  - - [120832, 22016, 1, 512]
    - [54, 95.78]
  - - [120832, 21504, 1, 512]
    - [54, 95.771]
  - - [117760, 20480, 1, 512]
    - [54, 95.732]
  - - [117760, 19968, 1, 512]
    - [54, 95.755]
  - - [113664, 18432, 1, 512]
    - [52, 95.785]
  - - [113664, 17920, 1, 512]
    - [55, 95.731]
  - - [111104, 16896, 1, 512]
    - [56, 95.804]
  - - [111104, 17408, 1, 512]
    - [54, 95.872]
  - - [108032, 15360, 1, 512]
    - [57, 95.871]
  - - [108032, 15872, 1, 512]
    - [52, 95.885]
  - - [103936, 13312, 1, 512]
    - [55, 95.845]
  - - [103936, 13824, 1, 512]
    - [53, 95.821]
  - - [100352, 11776, 1, 512]
    - [57, 95.845]
  - - [100352, 11264, 1, 512]
    - [54, 95.787]
  - - [97280, 10240, 1, 512]
    - [51, 96.034]
  - - [97280, 9728, 1, 512]
    - [55, 95.703]
  - - [93696, 8192, 1, 512]
    - [50, 94.713]
  - - [93696, 8704, 1, 512]
    - [51, 95.878]
  - - [90112, 6656, 1, 512]
    - [58, 96.105]
  - - [90112, 6144, 1, 512]
    - [51, 95.896]
  - - [87040, 5120, 1, 512]
    - [59, 95.69]
  - - [87040, 4608, 1, 512]
    - [60, 95.37]
  - - [85504, 4096, 1, 512]
    - [137, 94.31]
  - - [85504, 4608, 1, 512]
    - [151, 94.278]
  - - [82944, 3072, 1, 512]
    - [152, 93.443]
  - - [82944, 2560, 1, 512]
    - [151, 93.995]
  - - [81920, 2560, 1, 512]
    - [153, 93.299]
  - - [81920, 2048, 1, 512]
    - [153, 93.299]
  - - [80384, 1536, 1, 512]
    - [154, 91.904]
  - - [80384, 2048, 1, 512]
    - [151, 92.601]
  - - [78336, 1024, 1, 512]
    - [155, 91.329]
  - - [74240, 37376, 1, 512]
    - [56, 95.866]
  - - [74240, 36864, 1, 512]
    - [56, 95.941]
  - - [70144, 35328, 1, 512]
    - [56, 96.064]
  - - [70144, 34816, 1, 512]
    - [56, 96.049]
  - - [66048, 33280, 1, 512]
    - [54, 96.209]
  - - [66048, 32768, 1, 512]
    - [57, 96.317]
  - - [61952, 31232, 1, 512]
    - [56, 96.266]
  - - [61952, 30720, 1, 512]
    - [52, 96.455]
  - - [59904, 30208, 1, 512]
    - [57, 96.39]
  - - [59904, 29696, 1, 512]
    - [57, 96.373]
  - - [56832, 28672, 1, 512]
    - [54, 96.373]
  - - [56832, 28160, 1, 512]
    - [53, 96.18]
  - - [54784, 27648, 1, 512]
    - [53, 96.21]
  - - [54784, 27136, 1, 512]
    - [57, 96.539]
  - - [52736, 26624, 1, 512]
    - [53, 96.267]
  - - [52736, 26112, 1, 512]
    - [61, 96.779]
  - - [49664, 25088, 1, 512]
    - [58, 96.771]
  - - [49664, 24576, 1, 512]
    - [56, 96.496]
  - - [47616, 24064, 1, 512]
    - [55, 96.315]
  - - [47616, 23552, 1, 512]
    - [62, 96.492]
  - - [44544, 22528, 1, 512]
    - [63, 96.712]
  - - [44544, 22016, 1, 512]
    - [57, 96.416]
  - - [41472, 20992, 1, 512]
    - [60, 96.296]
  - - [41472, 20480, 1, 512]
    - [60, 96.324]
  - - [39424, 19968, 1, 512]
    - [64, 96.566]
  - - [39424, 19456, 1, 512]
    - [60, 96.326]
  - - [37376, 18944, 1, 512]
    - [60, 96.288]
  - - [37376, 18432, 1, 512]
    - [60, 96.24]
  - - [34304, 17408, 1, 512]
    - [64, 96.509]
  - - [34304, 16896, 1, 512]
    - [60, 96.412]
  - - [32256, 16384, 1, 512]
    - [64, 96.3]
  - - [32256, 15872, 1, 512]
    - [59, 96.208]
  - - [29184, 14848, 1, 512]
    - [60, 96.131]
  - - [29184, 14336, 1, 512]
    - [59, 96.128]
  - - [27136, 13824, 1, 512]
    - [59, 95.609]
  - - [27136, 13312, 1, 512]
    - [64, 96.003]
  - - [24064, 12288, 1, 512]
    - [65, 95.056]
  - - [24064, 11776, 1, 512]
    - [59, 95.443]
  - - [22016, 11264, 1, 512]
    - [64, 94.947]
  - - [22016, 10752, 1, 512]
    - [66, 94.915]
  - - [19968, 10240, 1, 512]
    - [65, 94.902]
  - - [19968, 9728, 1, 512]
    - [65, 95.381]
  - - [17920, 9216, 1, 512]
    - [67, 92.758]
  - - [17920, 8704, 1, 512]
    - [65, 94.7]
  - - [14848, 7680, 1, 512]
    - [65, 93.521]
  - - [14848, 7168, 1, 512]
    - [60, 93.421]
  - - [12800, 6656, 1, 512]
    - [60, 93.877]
  - - [12800, 6144, 1, 512]
    - [65, 90.682]
  - - [11264, 5632, 1, 512]
    - [66, 94.226]
  - - [10752, 5632, 1, 512]
    - [64, 89.59]
  - - [10752, 5120, 1, 512]
    - [59, 91.968]
  - - [11264, 5120, 1, 512]
    - [68, 90.23]
  - - [10240, 5120, 1, 512]
    - [59, 88.02]
  - - [9728, 5120, 1, 512]
    - [137, 87.956]
  - - [9728, 4608, 1, 512]
    - [156, 93.665]
  - - [10240, 4608, 1, 512]
    - [124, 90.819]
  - - [8704, 4608, 1, 512]
    - [157, 88.777]
  - - [8704, 4096, 1, 512]
    - [118, 88.242]
  - - [7680, 4096, 1, 512]
    - [158, 85.076]
  - - [7680, 3584, 1, 512]
    - [158, 83.723]
  - - [6656, 3584, 1, 512]
    - [118, 82.959]
  - - [6656, 3072, 1, 512]
    - [118, 82.494]
  - - [5632, 3072, 1, 512]
    - [123, 80.933]
  - - [5632, 2560, 1, 512]
    - [124, 85.069]
  - - [4608, 2560, 1, 512]
    - [130, 71.877]
  - - [4608, 2048, 1, 512]
    - [131, 68.938]
  - - [3584, 2048, 1, 512]
    - [137, 72.429]
  - - [3584, 1536, 1, 512]
    - [138, 67.271]
  - - [2560, 1536, 1, 512]
    - [142, 55.066]
  - - [2560, 1024, 1, 512]
    - [121, 51.547]
  - - [127488, 25089, 1, 512]
    - [69, 94.38]
  - - [124416, 23553, 1, 512]
    - [70, 94.699]
  - - [120832, 21505, 1, 512]
    - [71, 95.053]
  - - [117760, 19969, 1, 512]
    - [72, 94.737]
  - - [113664, 17921, 1, 512]
    - [72, 94.956]
  - - [111104, 16897, 1, 512]
    - [73, 95.04]
  - - [108032, 15361, 1, 512]
    - [70, 94.824]
  - - [103936, 13313, 1, 512]
    - [70, 94.821]
  - - [100352, 11265, 1, 512]
    - [73, 94.875]
  - - [97280, 9729, 1, 512]
    - [74, 94.185]
  - - [93696, 8193, 1, 512]
    - [69, 92.238]
  - - [90112, 6145, 1, 512]
    - [75, 93.622]
  - - [87040, 4609, 1, 512]
    - [72, 92.294]
  - - [85504, 4097, 1, 512]
    - [153, 90.74]
  - - [82944, 2561, 1, 512]
    - [151, 89.432]
  - - [81920, 2049, 1, 512]
    - [159, 88.908]
  - - [80384, 1537, 1, 512]
    - [155, 86.385]
  - - [78336, 513, 1, 512]
    - [160, 40.246]
  - - [74240, 36865, 1, 512]
    - [69, 95.786]
  - - [70144, 34817, 1, 512]
    - [69, 95.864]
  - - [66048, 32769, 1, 512]
    - [76, 96.007]
  - - [61952, 30721, 1, 512]
    - [69, 95.924]
  - - [59904, 29697, 1, 512]
    - [70, 95.682]
  - - [56832, 28161, 1, 512]
    - [70, 95.682]
  - - [54784, 27137, 1, 512]
    - [73, 95.905]
  - - [52736, 26113, 1, 512]
    - [69, 95.62]
  - - [49664, 24577, 1, 512]
    - [75, 95.867]
  - - [47616, 23553, 1, 512]
    - [77, 95.876]
  - - [44544, 22017, 1, 512]
    - [78, 95.668]
  - - [41472, 20481, 1, 512]
    - [69, 95.267]
  - - [39424, 19457, 1, 512]
    - [77, 95.772]
  - - [37376, 18433, 1, 512]
    - [77, 95.822]
  - - [34304, 16897, 1, 512]
    - [78, 95.415]
  - - [32256, 15873, 1, 512]
    - [77, 95.067]
  - - [29184, 14337, 1, 512]
    - [79, 95.073]
  - - [27136, 13313, 1, 512]
    - [79, 94.715]
  - - [24064, 11777, 1, 512]
    - [80, 95.007]
  - - [22016, 10753, 1, 512]
    - [78, 93.722]
  - - [19968, 9729, 1, 512]
    - [81, 93.973]
  - - [17920, 8705, 1, 512]
    - [82, 93.195]
  - - [14848, 7169, 1, 512]
    - [80, 93.588]
  - - [12800, 6145, 1, 512]
    - [82, 91.708]
  - - [11264, 5121, 1, 512]
    - [83, 91.833]
  - - [10752, 5121, 1, 512]
    - [77, 87.053]
  - - [10240, 4609, 1, 512]
    - [116, 91.429]
  - - [9728, 4609, 1, 512]
    - [161, 86.033]
  - - [8704, 4097, 1, 512]
    - [118, 86.301]
  - - [7680, 3585, 1, 512]
    - [162, 82.658]
  - - [6656, 3073, 1, 512]
    - [117, 82.197]
  - - [5632, 2561, 1, 512]
    - [122, 84.697]
  - - [4608, 2049, 1, 512]
    - [129, 70.054]
  - - [3584, 1537, 1, 512]
    - [136, 61.016]
  - - [2560, 1025, 1, 512]
    - [119, 50.991]
  - - [127488, 512, 1, 512]
    - [84, 88.35]
  - - [124416, 512, 1, 512]
    - [85, 87.9]
  - - [120832, 512, 1, 512]
    - [86, 88.683]
  - - [117760, 512, 1, 512]
    - [87, 88.886]
  - - [113664, 512, 1, 512]
    - [86, 89.219]
  - - [111104, 512, 1, 512]
    - [88, 88.531]
  - - [108032, 512, 1, 512]
    - [88, 90.645]
  - - [103936, 512, 1, 512]
    - [86, 87.655]
  - - [100352, 512, 1, 512]
    - [84, 89.521]
  - - [97280, 512, 1, 512]
    - [84, 87.832]
  - - [93696, 512, 1, 512]
    - [86, 89.958]
  - - [90112, 512, 1, 512]
    - [89, 87.463]
  - - [87040, 512, 1, 512]
    - [84, 90.538]
  - - [85504, 512, 1, 512]
    - [90, 90.081]
  - - [82944, 512, 1, 512]
    - [86, 87.363]
  - - [81920, 512, 1, 512]
    - [90, 87.01]
  - - [80384, 512, 1, 512]
    - [89, 85.204]
  - - [74240, 512, 1, 512]
    - [91, 84.344]
  - - [70144, 512, 1, 512]
    - [85, 88.127]
  - - [66048, 512, 1, 512]
    - [92, 82.2]
  - - [61952, 512, 1, 512]
    - [86, 86.52]
  - - [59904, 512, 1, 512]
    - [93, 79.089]
  - - [56832, 512, 1, 512]
    - [86, 87.148]
  - - [54784, 512, 1, 512]
    - [90, 84.561]
  - - [52736, 512, 1, 512]
    - [94, 81.588]
  - - [49664, 512, 1, 512]
    - [95, 85.676]
  - - [47616, 512, 1, 512]
    - [96, 83.376]
  - - [44544, 512, 1, 512]
    - [97, 69.568]
  - - [41472, 512, 1, 512]
    - [98, 81.974]
  - - [39424, 512, 1, 512]
    - [99, 74.29]
  - - [37376, 512, 1, 512]
    - [94, 68.698]
  - - [34304, 512, 1, 512]
    - [100, 74.686]
  - - [32256, 512, 1, 512]
    - [101, 71.421]
  - - [29184, 512, 1, 512]
    - [95, 76.733]
  - - [27136, 512, 1, 512]
    - [102, 73.823]
  - - [24064, 512, 1, 512]
    - [94, 61.677]
  - - [22016, 512, 1, 512]
    - [92, 53.284]
  - - [19968, 512, 1, 512]
    - [103, 64.38]
  - - [17920, 512, 1, 512]
    - [104, 58.556]
  - - [14848, 512, 1, 512]
    - [105, 45.723]
  - - [12800, 512, 1, 512]
    - [106, 66.771]
  - - [11264, 512, 1, 512]
    - [98, 63.041]
  - - [10752, 512, 1, 512]
    - [107, 59.249]
  - - [10240, 512, 1, 512]
    - [108, 71.307]
  - - [9728, 512, 1, 512]
    - [101, 52.782]
  - - [8704, 512, 1, 512]
    - [109, 50.024]
  - - [7680, 512, 1, 512]
    - [110, 41.948]
  - - [6656, 512, 1, 512]
    - [111, 56.039]
  - - [5632, 512, 1, 512]
    - [112, 58.877]
  - - [4608, 512, 1, 512]
    - [113, 51.672]
  - - [3584, 512, 1, 512]
    - [114, 56.002]
  - - [2560, 512, 1, 512]
    - [115, 43.93]
  - - [6144, 3072, 1, 512]
    - [119, 83.905]
  - - [6144, 512, 1, 512]
    - [120, 62.645]
  - - [6144, 2561, 1, 512]
    - [119, 78.958]
  - - [6144, 2560, 1, 512]
    - [121, 75.411]
  - - [5120, 2560, 1, 512]
    - [125, 72.341]
  - - [5120, 512, 1, 512]
    - [126, 56.948]
  - - [5120, 2049, 1, 512]
    - [127, 66.889]
  - - [5120, 2048, 1, 512]
    - [128, 69.433]
  - - [4096, 2048, 1, 512]
    - [132, 58.775]
  - - [4096, 512, 1, 512]
    - [133, 33.366]
  - - [4096, 1537, 1, 512]
    - [134, 69.967]
  - - [4096, 1536, 1, 512]
    - [135, 65.885]
  - - [3072, 1536, 1, 512]
    - [139, 66.717]
  - - [3072, 512, 1, 512]
    - [140, 55.988]
  - - [3072, 1025, 1, 512]
    - [141, 64.114]
  - - [3072, 1024, 1, 512]
    - [121, 65.942]
  - - [2048, 1024, 1, 512]
    - [143, 42.368]
  - - [2048, 1025, 1, 512]
    - [144, 43.444]
  - - [2048, 512, 1, 512]
    - [115, 36.103]
  - - [2048, 513, 1, 512]
    - [145, 32.149]
  - - [1536, 513, 1, 512]
    - [146, 42.932]
  - - [1536, 1024, 1, 512]
    - [115, 56.804]
  - - [1536, 512, 1, 512]
    - [147, 39.988]
  - - [1024, 513, 1, 512]
    - [115, 27.273]
  - - [1024, 512, 1, 512]
    - [115, 27.675]
  - - [512, 512, 1, 512]
    - [148, 13.225]
  - - [77824, 1, 1, 512]
    - [163, 0.734]
  - - [76800, 1, 1, 512]
    - [164, 0.796]
  - - [512, 1, 1, 512]
    - [165, 0.045]
  - - [64, 1, 1000, 64]
    - [18, 0.46]
  - - [1, 64, 1000, 64]
    - [19, 0.381]
  - - [31, 31, 1000, 31]
    - [20, 3.216]
  - - [33, 33, 1000, 33]
    - [21, 3.076]
  - - [47, 47, 1000, 47]
    - [22, 5.829]
  - - [49, 49, 1000, 49]
    - [23, 5.736]
  - - [63, 63, 128, 63]
    - [24, 4.863]
  - - [65, 65, 128, 65]
    - [25, 3.729]
  - - [79, 79, 128, 79]
    - [26, 5.394]
  - - [81, 81, 128, 81]
    - [27, 5.529]
  - - [95, 95, 64, 95]
    - [28, 6.311]
  - - [97, 97, 64, 97]
    - [29, 6.644]
  - - [127, 127, 64, 127]
    - [30, 11.794]
  - - [129, 129, 64, 129]
    - [25, 8.488]
  - - [255, 255, 16, 255]
    - [29, 17.479]
  - - [257, 257, 16, 257]
    - [31, 15.304]
  - - [511, 511, 16, 511]
    - [32, 34.883]
  - - [513, 513, 16, 513]
    - [33, 36.84]
  - - [30, 30, 1000, 30]
    - [34, 3.232]
  - - [32, 32, 1000, 32]
    - [35, 3.985]
  - - [34, 34, 1000, 34]
    - [34, 3.744]
  - - [46, 46, 1000, 46]
    - [36, 6.175]
  - - [48, 48, 1000, 48]
    - [37, 7.587]
  - - [50, 50, 1000, 50]
    - [38, 6.905]
  - - [62, 62, 128, 62]
    - [39, 4.953]
  - - [64, 64, 128, 64]
    - [40, 5.967]
  - - [66, 66, 128, 66]
    - [41, 4.178]
  - - [78, 78, 128, 78]
    - [42, 6.048]
  - - [80, 80, 128, 80]
    - [43, 7.013]
  - - [82, 82, 128, 82]
    - [43, 6.702]
  - - [94, 94, 64, 94]
    - [43, 6.8]
  - - [96, 96, 64, 96]
    - [44, 8.103]
  - - [98, 98, 64, 98]
    - [45, 7.296]
  - - [126, 126, 64, 126]
    - [46, 12.768]
  - - [128, 128, 64, 128]
    - [43, 14.439]
  - - [130, 130, 64, 130]
    - [47, 8.847]
  - - [254, 254, 16, 254]
    - [48, 19.004]
  - - [256, 256, 16, 256]
    - [43, 21.907]
  - - [258, 258, 16, 258]
    - [49, 15.056]
  - - [510, 510, 16, 510]
    - [36, 36.552]
  - - [514, 514, 16, 514]
    - [47, 37.304]
  - - [123392, 49152, 1, 512]
    - [166, 95.164]
  - - [122880, 48640, 1, 512]
    - [167, 95.557]
  - - [115200, 40960, 1, 512]
    - [167, 95.669]
  - - [114688, 40448, 1, 512]
    - [168, 95.545]
  - - [107008, 32768, 1, 512]
    - [169, 96.002]
  - - [106496, 32256, 1, 512]
    - [167, 96.08]
  - - [49664, 49152, 1, 512]
    - [168, 96.751]
  - - [49152, 48640, 1, 512]
    - [167, 96.828]
  - - [40448, 39936, 1, 512]
    - [167, 96.908]
  - - [39936, 39424, 1, 512]
    - [167, 96.853]
  - - [122880, 48641, 1, 512]
    - [170, 95.213]
  - - [114688, 40449, 1, 512]
    - [171, 95.28]
  - - [106496, 32257, 1, 512]
    - [171, 95.419]
  - - [49152, 48641, 1, 512]
    - [171, 96.102]
  - - [39936, 39425, 1, 512]
    - [171, 96.053]
  - - [127488, 25088, 1, 576]
    - [172, 96.793]
  - - [127488, 25600, 1, 576]
    - [173, 96.749]
  - - [124416, 23552, 1, 576]
    - [174, 96.358]
  - - [124416, 24064, 1, 576]
    - [174, 96.509]
  - - [120832, 22016, 1, 576]
    - [175, 96.693]
  - - [120832, 21504, 1, 576]
    - [176, 96.995]
  - - [117760, 20480, 1, 576]
    - [173, 97.009]
  - - [117760, 19968, 1, 576]
    - [175, 96.709]
  - - [113664, 18432, 1, 576]
    - [172, 97.028]
  - - [113664, 17920, 1, 576]
    - [176, 97.26]
  - - [111104, 16896, 1, 576]
    - [177, 96.299]
  - - [111104, 17408, 1, 576]
    - [176, 97.029]
  - - [108032, 15360, 1, 576]
    - [175, 96.695]
  - - [108032, 15872, 1, 576]
    - [174, 96.556]
  - - [103936, 13312, 1, 576]
    - [173, 97.019]
  - - [103936, 13824, 1, 576]
    - [178, 96.842]
  - - [100352, 11776, 1, 576]
    - [179, 96.911]
  - - [100352, 11264, 1, 576]
    - [179, 96.963]
  - - [97280, 10240, 1, 576]
    - [180, 96.513]
  - - [97280, 9728, 1, 576]
    - [181, 96.672]
  - - [93696, 8192, 1, 576]
    - [173, 96.488]
  - - [93696, 8704, 1, 576]
    - [181, 96.42]
  - - [90112, 6656, 1, 576]
    - [173, 96.545]
  - - [90112, 6144, 1, 576]
    - [173, 96.417]
  - - [87040, 5120, 1, 576]
    - [182, 96.156]
  - - [87040, 4608, 1, 576]
    - [182, 95.703]
  - - [74240, 37376, 1, 576]
    - [177, 96.812]
  - - [74240, 36864, 1, 576]
    - [183, 96.905]
  - - [70144, 35328, 1, 576]
    - [184, 96.883]
  - - [70144, 34816, 1, 576]
    - [175, 96.878]
  - - [66048, 33280, 1, 576]
    - [175, 96.915]
  - - [66048, 32768, 1, 576]
    - [174, 96.798]
  - - [61952, 31232, 1, 576]
    - [184, 96.983]
  - - [61952, 30720, 1, 576]
    - [177, 97.033]
  - - [59904, 30208, 1, 576]
    - [179, 97.305]
  - - [59904, 29696, 1, 576]
    - [176, 97.591]
  - - [56832, 28672, 1, 576]
    - [174, 96.981]
  - - [56832, 28160, 1, 576]
    - [174, 96.91]
  - - [54784, 27648, 1, 576]
    - [174, 96.885]
  - - [54784, 27136, 1, 576]
    - [176, 97.112]
  - - [52736, 26624, 1, 576]
    - [176, 97.04]
  - - [52736, 26112, 1, 576]
    - [175, 96.842]
  - - [49664, 25088, 1, 576]
    - [172, 97.014]
  - - [49664, 24576, 1, 576]
    - [173, 96.974]
  - - [47616, 24064, 1, 576]
    - [185, 96.803]
  - - [47616, 23552, 1, 576]
    - [180, 96.951]
  - - [44544, 22528, 1, 576]
    - [175, 96.719]
  - - [44544, 22016, 1, 576]
    - [186, 96.667]
  - - [41472, 20992, 1, 576]
    - [187, 96.608]
  - - [41472, 20480, 1, 576]
    - [182, 96.579]
  - - [39424, 19968, 1, 576]
    - [188, 96.688]
  - - [39424, 19456, 1, 576]
    - [187, 96.657]
  - - [37376, 18944, 1, 576]
    - [182, 96.684]
  - - [37376, 18432, 1, 576]
    - [182, 96.702]
  - - [34304, 17408, 1, 576]
    - [188, 96.937]
  - - [34304, 16896, 1, 576]
    - [185, 96.753]
  - - [32256, 16384, 1, 576]
    - [186, 96.715]
  - - [32256, 15872, 1, 576]
    - [185, 96.659]
  - - [29184, 14848, 1, 576]
    - [185, 96.896]
  - - [29184, 14336, 1, 576]
    - [185, 96.922]
  - - [27136, 13824, 1, 576]
    - [185, 95.878]
  - - [27136, 13312, 1, 576]
    - [186, 96.157]
  - - [24064, 12288, 1, 576]
    - [187, 95.453]
  - - [24064, 11776, 1, 576]
    - [185, 96.032]
  - - [22016, 11264, 1, 576]
    - [185, 95.472]
  - - [22016, 10752, 1, 576]
    - [187, 95.377]
  - - [19968, 10240, 1, 576]
    - [185, 95.541]
  - - [19968, 9728, 1, 576]
    - [189, 95.585]
  - - [17920, 9216, 1, 576]
    - [189, 94.282]
  - - [17920, 8704, 1, 576]
    - [187, 95.123]
  - - [14848, 7680, 1, 576]
    - [190, 94.037]
  - - [14848, 7168, 1, 576]
    - [191, 93.925]
  - - [12800, 6656, 1, 576]
    - [188, 94.287]
  - - [12800, 6144, 1, 576]
    - [187, 91.231]
  - - [11264, 5632, 1, 576]
    - [191, 94.391]
  - - [10752, 5632, 1, 576]
    - [188, 90.302]
  - - [10752, 5120, 1, 576]
    - [192, 92.463]
  - - [11264, 5120, 1, 576]
    - [192, 91.309]
  - - [10240, 5120, 1, 576]
    - [182, 88.945]
  - - [127488, 25089, 1, 576]
    - [193, 95.319]
  - - [124416, 23553, 1, 576]
    - [194, 95.563]
  - - [120832, 21505, 1, 576]
    - [195, 95.75]
  - - [117760, 19969, 1, 576]
    - [196, 95.689]
  - - [113664, 17921, 1, 576]
    - [197, 95.522]
  - - [111104, 16897, 1, 576]
    - [194, 95.822]
  - - [108032, 15361, 1, 576]
    - [198, 95.417]
  - - [103936, 13313, 1, 576]
    - [198, 95.296]
  - - [100352, 11265, 1, 576]
    - [194, 95.371]
  - - [97280, 9729, 1, 576]
    - [199, 94.606]
  - - [93696, 8193, 1, 576]
    - [199, 94.283]
  - - [90112, 6145, 1, 576]
    - [200, 94.274]
  - - [87040, 4609, 1, 576]
    - [201, 92.949]
  - - [74240, 36865, 1, 576]
    - [196, 96.259]
  - - [70144, 34817, 1, 576]
    - [193, 96.245]
  - - [66048, 32769, 1, 576]
    - [194, 96.223]
  - - [61952, 30721, 1, 576]
    - [193, 96.342]
  - - [59904, 29697, 1, 576]
    - [198, 96.004]
  - - [56832, 28161, 1, 576]
    - [198, 96.164]
  - - [54784, 27137, 1, 576]
    - [194, 96.39]
  - - [52736, 26113, 1, 576]
    - [193, 96.304]
  - - [49664, 24577, 1, 576]
    - [193, 96.48]
  - - [47616, 23553, 1, 576]
    - [202, 96.242]
  - - [44544, 22017, 1, 576]
    - [203, 96.575]
  - - [41472, 20481, 1, 576]
    - [202, 95.854]
  - - [39424, 19457, 1, 576]
    - [202, 96.073]
  - - [37376, 18433, 1, 576]
    - [202, 96.274]
  - - [34304, 16897, 1, 576]
    - [204, 95.993]
  - - [32256, 15873, 1, 576]
    - [202, 95.532]
  - - [29184, 14337, 1, 576]
    - [202, 95.946]
  - - [27136, 13313, 1, 576]
    - [205, 94.949]
  - - [24064, 11777, 1, 576]
    - [206, 95.316]
  - - [22016, 10753, 1, 576]
    - [204, 94.184]
  - - [19968, 9729, 1, 576]
    - [207, 94.63]
  - - [17920, 8705, 1, 576]
    - [204, 92.998]
  - - [14848, 7169, 1, 576]
    - [208, 93.572]
  - - [12800, 6145, 1, 576]
    - [208, 91.92]
  - - [11264, 5121, 1, 576]
    - [201, 90.923]
  - - [10752, 5121, 1, 576]
    - [201, 87.398]
  - - [127488, 576, 1, 576]
    - [209, 77.1]
  - - [124416, 576, 1, 576]
    - [210, 78.853]
  - - [120832, 576, 1, 576]
    - [211, 77.872]
  - - [117760, 576, 1, 576]
    - [212, 80.085]
  - - [113664, 576, 1, 576]
    - [213, 80.8]
  - - [111104, 576, 1, 576]
    - [214, 79.316]
  - - [108032, 576, 1, 576]
    - [215, 79.522]
  - - [103936, 576, 1, 576]
    - [213, 80.332]
  - - [100352, 576, 1, 576]
    - [214, 79.027]
  - - [97280, 576, 1, 576]
    - [216, 78.022]
  - - [93696, 576, 1, 576]
    - [213, 79.184]
  - - [90112, 576, 1, 576]
    - [217, 77.79]
  - - [87040, 576, 1, 576]
    - [212, 78.962]
  - - [85504, 576, 1, 576]
    - [212, 78.79]
  - - [82944, 576, 1, 576]
    - [217, 75.743]
  - - [81920, 576, 1, 576]
    - [217, 75.868]
  - - [80384, 576, 1, 576]
    - [212, 77.703]
  - - [74240, 576, 1, 576]
    - [212, 77.264]
  - - [70144, 576, 1, 576]
    - [211, 74.04]
  - - [66048, 576, 1, 576]
    - [211, 74.356]
  - - [61952, 576, 1, 576]
    - [209, 77.017]
  - - [59904, 576, 1, 576]
    - [217, 72.726]
  - - [56832, 576, 1, 576]
    - [216, 80.211]
  - - [54784, 576, 1, 576]
    - [218, 74.562]
  - - [52736, 576, 1, 576]
    - [211, 72.302]
  - - [49664, 576, 1, 576]
    - [211, 75.413]
  - - [47616, 576, 1, 576]
    - [219, 73.273]
  - - [44544, 576, 1, 576]
    - [209, 75.679]
  - - [41472, 576, 1, 576]
    - [220, 67.784]
  - - [39424, 576, 1, 576]
    - [219, 75.029]
  - - [37376, 576, 1, 576]
    - [221, 67.357]
  - - [34304, 576, 1, 576]
    - [222, 71.877]
  - - [32256, 576, 1, 576]
    - [223, 61.82]
  - - [29184, 576, 1, 576]
    - [214, 69.639]
  - - [27136, 576, 1, 576]
    - [224, 61.049]
  - - [24064, 576, 1, 576]
    - [225, 46.569]
  - - [22016, 576, 1, 576]
    - [226, 62.088]
  - - [19968, 576, 1, 576]
    - [227, 48.24]
  - - [17920, 576, 1, 576]
    - [214, 47.867]
  - - [14848, 576, 1, 576]
    - [209, 56.729]
  - - [12800, 576, 1, 576]
    - [228, 45.823]
  - - [11264, 576, 1, 576]
    - [229, 63.326]
  - - [10752, 576, 1, 576]
    - [230, 65.367]
  - - [10240, 576, 1, 576]
    - [229, 62.221]
  - - [9728, 576, 1, 576]
    - [231, 63.226]
  - - [124992, 576, 1, 576]
    - [216, 77.744]
  - - [122112, 576, 1, 576]
    - [232, 81.711]
  - - [119232, 576, 1, 576]
    - [216, 78.917]
  - - [116352, 576, 1, 576]
    - [216, 80.256]
  - - [114048, 576, 1, 576]
    - [233, 80.769]
  - - [111168, 576, 1, 576]
    - [216, 78.819]
  - - [108864, 576, 1, 576]
    - [234, 80.988]
  - - [105984, 576, 1, 576]
    - [216, 78.984]
  - - [103104, 576, 1, 576]
    - [213, 80.593]
  - - [100224, 576, 1, 576]
    - [214, 78.938]
  - - [97920, 576, 1, 576]
    - [234, 80.07]
  - - [95040, 576, 1, 576]
    - [216, 78.646]
  - - [92160, 576, 1, 576]
    - [216, 78.466]
  - - [89280, 576, 1, 576]
    - [209, 77.319]
  - - [86976, 576, 1, 576]
    - [216, 76.716]
  - - [84096, 576, 1, 576]
    - [233, 78.106]
  - - [81216, 576, 1, 576]
    - [217, 75.609]
  - - [78336, 576, 1, 576]
    - [213, 76.188]
  - - [76032, 576, 1, 576]
    - [214, 76.744]
  - - [73152, 576, 1, 576]
    - [232, 76.14]
  - - [70848, 576, 1, 576]
    - [211, 74.044]
  - - [67968, 576, 1, 576]
    - [211, 76.283]
  - - [65664, 576, 1, 576]
    - [217, 74.444]
  - - [62784, 576, 1, 576]
    - [217, 74.943]
  - - [60480, 576, 1, 576]
    - [217, 73.521]
  - - [58176, 576, 1, 576]
    - [216, 80.847]
  - - [55872, 576, 1, 576]
    - [216, 78.896]
  - - [52992, 576, 1, 576]
    - [233, 72.856]
  - - [50688, 576, 1, 576]
    - [217, 77.496]
  - - [48384, 576, 1, 576]
    - [217, 73.637]
  - - [46080, 576, 1, 576]
    - [235, 78.284]
  - - [43776, 576, 1, 576]
    - [236, 72.094]
  - - [39168, 576, 1, 576]
    - [219, 74.68]
  - - [36864, 576, 1, 576]
    - [237, 69.36]
  - - [34560, 576, 1, 576]
    - [238, 69.051]
  - - [29952, 576, 1, 576]
    - [239, 58.103]
  - - [28224, 576, 1, 576]
    - [240, 69.877]
  - - [25920, 576, 1, 576]
    - [222, 58.255]
  - - [24192, 576, 1, 576]
    - [241, 42.543]
  - - [21888, 576, 1, 576]
    - [237, 65.365]
  - - [20160, 576, 1, 576]
    - [242, 49.679]
  - - [17856, 576, 1, 576]
    - [234, 49.557]
  - - [16128, 576, 1, 576]
    - [243, 59.492]
  - - [14400, 576, 1, 576]
    - [244, 50.852]
  - - [12672, 576, 1, 576]
    - [244, 43.478]
  - - [10944, 576, 1, 576]
    - [245, 58.9]
  - - [10368, 576, 1, 576]
    - [235, 65.22]
  - - [9792, 576, 1, 576]
    - [246, 59.574]
  - - [9216, 576, 1, 576]
    - [247, 72.854]
  - - [8640, 576, 1, 576]
    - [248, 71.305]
  - - [8064, 576, 1, 576]
    - [249, 51.277]
  - - [7488, 576, 1, 576]
    - [250, 62.968]
  - - [6912, 576, 1, 576]
    - [251, 55.792]
  - - [6336, 576, 1, 576]
    - [252, 74.197]
  - - [5760, 576, 1, 576]
    - [243, 56.233]
  - - [5184, 576, 1, 576]
    - [243, 50.575]
  - - [4608, 576, 1, 576]
    - [253, 59.741]
  - - [4032, 576, 1, 576]
    - [250, 48.431]
  - - [3456, 576, 1, 576]
    - [253, 47.794]
  - - [2880, 576, 1, 576]
    - [254, 49.306]
  - - [2304, 576, 1, 576]
    - [255, 44.368]
  - - [1728, 576, 1, 576]
    - [256, 31.073]
  - - [1152, 576, 1, 576]
    - [257, 36.334]
  - - [576, 576, 1, 576]
    - [258, 16.22]
  - - [10368, 9793, 1, 576]
    - [259, 91.819]
  - - [9792, 9217, 1, 576]
    - [259, 90.819]
  - - [9216, 8641, 1, 576]
    - [260, 91.352]
  - - [8640, 8065, 1, 576]
    - [261, 88.56]
  - - [8064, 7489, 1, 576]
    - [262, 83.743]
  - - [7488, 6913, 1, 576]
    - [263, 85.041]
  - - [6912, 6337, 1, 576]
    - [264, 91.154]
  - - [6336, 5761, 1, 576]
    - [250, 82.814]
  - - [5760, 5185, 1, 576]
    - [265, 80.037]
  - - [5184, 4609, 1, 576]
    - [266, 76.36]
  - - [4608, 4033, 1, 576]
    - [267, 83.261]
  - - [4032, 3457, 1, 576]
    - [268, 77.325]
  - - [3456, 2881, 1, 576]
    - [269, 70.477]
  - - [2880, 2305, 1, 576]
    - [270, 64.92]
  - - [2304, 1729, 1, 576]
    - [267, 59.855]
  - - [1728, 1153, 1, 576]
    - [271, 43.86]
  - - [1152, 577, 1, 576]
    - [258, 36.304]
  - - [85504, 4096, 1, 576]
    - [272, 95.081]
  - - [85504, 4608, 1, 576]
    - [273, 94.981]
  - - [82944, 3072, 1, 576]
    - [274, 93.811]
  - - [82944, 2560, 1, 576]
    - [273, 94.607]
  - - [81920, 2560, 1, 576]
    - [273, 93.588]
  - - [81920, 2048, 1, 576]
    - [275, 94.432]
  - - [80384, 1536, 1, 576]
    - [276, 92.261]
  - - [80384, 2048, 1, 576]
    - [277, 93.224]
  - - [78336, 1024, 1, 576]
    - [278, 92.557]
  - - [9728, 5120, 1, 576]
    - [279, 89.857]
  - - [9728, 4608, 1, 576]
    - [279, 93.924]
  - - [10240, 4608, 1, 576]
    - [280, 90.113]
  - - [8704, 4608, 1, 576]
    - [279, 91.352]
  - - [8704, 4096, 1, 576]
    - [281, 89.278]
  - - [7680, 4096, 1, 576]
    - [279, 87.801]
  - - [7680, 3584, 1, 576]
    - [279, 85.257]
  - - [6656, 3584, 1, 576]
    - [282, 82.754]
  - - [6656, 3072, 1, 576]
    - [283, 83.051]
  - - [5632, 3072, 1, 576]
    - [284, 84.258]
  - - [5632, 2560, 1, 576]
    - [284, 85.368]
  - - [4608, 2560, 1, 576]
    - [277, 65.266]
  - - [4608, 2048, 1, 576]
    - [285, 65.199]
  - - [3584, 2048, 1, 576]
    - [286, 67.488]
  - - [3584, 1536, 1, 576]
    - [287, 60.937]
  - - [2560, 1536, 1, 576]
    - [272, 42.88]
  - - [2560, 1024, 1, 576]
    - [288, 49.602]
  - - [85504, 4097, 1, 576]
    - [272, 91.439]
  - - [82944, 2561, 1, 576]
    - [272, 89.803]
  - - [81920, 2049, 1, 576]
    - [289, 89.694]
  - - [80384, 1537, 1, 576]
    - [276, 86.387]
  - - [78336, 513, 1, 576]
    - [290, 61.011]
  - - [10240, 4609, 1, 576]
    - [279, 91.342]
  - - [9728, 4609, 1, 576]
    - [277, 85.826]
  - - [8704, 4097, 1, 576]
    - [277, 85.749]
  - - [7680, 3585, 1, 576]
    - [291, 83.665]
  - - [6656, 3073, 1, 576]
    - [278, 83.54]
  - - [5632, 2561, 1, 576]
    - [292, 68.783]
  - - [4608, 2049, 1, 576]
    - [293, 70.424]
  - - [3584, 1537, 1, 576]
    - [294, 60.695]
  - - [2560, 1025, 1, 576]
    - [295, 49.256]
  - - [576, 1, 1, 576]
    - [296, 0.061]
  - - [123392, 49152, 1, 576]
    - [297, 96.143]
  - - [122880, 48640, 1, 576]
    - [298, 96.255]
  - - [115200, 40960, 1, 576]
    - [298, 96.427]
  - - [114688, 40448, 1, 576]
    - [299, 96.351]
  - - [107008, 32768, 1, 576]
    - [298, 96.628]
  - - [106496, 32256, 1, 576]
    - [298, 96.569]
  - - [49664, 49152, 1, 576]
    - [297, 96.982]
  - - [49152, 48640, 1, 576]
    - [300, 96.933]
  - - [40448, 39936, 1, 576]
    - [301, 96.764]
  - - [39936, 39424, 1, 576]
    - [300, 96.937]
  - - [34560, 34560, 1, 576]
    - [301, 96.747]
  - - [34560, 33984, 1, 576]
    - [301, 96.668]
  - - [28800, 28800, 1, 576]
    - [298, 96.707]
  - - [28800, 28224, 1, 576]
    - [302, 96.315]
  - - [24768, 24768, 1, 576]
    - [297, 96.045]
  - - [24768, 24192, 1, 576]
    - [301, 96.36]
  - - [19008, 19008, 1, 576]
    - [303, 95.205]
  - - [19008, 18432, 1, 576]
    - [302, 95.211]
  - - [15552, 15552, 1, 576]
    - [304, 93.819]
  - - [15552, 14976, 1, 576]
    - [304, 94.68]
  - - [122880, 48641, 1, 576]
    - [305, 95.766]
  - - [114688, 40449, 1, 576]
    - [306, 95.876]
  - - [106496, 32257, 1, 576]
    - [305, 96.074]
  - - [49152, 48641, 1, 576]
    - [307, 96.749]
  - - [39936, 39425, 1, 576]
    - [308, 96.292]
  - - [34560, 33985, 1, 576]
    - [307, 96.48]
  - - [28800, 28225, 1, 576]
    - [308, 96.316]
  - - [24768, 24193, 1, 576]
    - [309, 95.737]
  - - [19008, 18433, 1, 576]
    - [310, 94.389]
  - - [15552, 14977, 1, 576]
    - [311, 93.357]
  - - [75456, 9216, 1, 576]
    - [308, 96.215]
  - - [69696, 3456, 1, 576]
    - [312, 94.547]
  - - [52992, 10945, 1, 576]
    - [313, 95.054]
  - - [50688, 6337, 1, 576]
    - [309, 94.603]
  - - [48960, 2881, 1, 576]
    - [314, 89.848]
  - - [47808, 1153, 1, 576]
    - [311, 80.414]
- null
