library/src/blas3/Tensile/Logic/asm_full/aquavanjaram942/aquavanjaram942_Cijk_Alik_Bljk_HHS_BH.yaml
- {MinimumRequiredVersion: 4.36.0}
- aquavanjaram942
- gfx942
- [Device 0049, Device 0050]
    SolutionIndex: 0
    SolutionNameMin: Cijk_Alik_Bljk_HHS_BH_MT256x256x32_MI32x32x8x1_SN_DTVA0_FL2_GLS1_NTC2_NTD3_NLCA1_ONLL2_SU32_SUS64_SPO0_SSO10_WGM18
    SolutionIndex: 1
    SolutionNameMin: Cijk_Alik_Bljk_HHS_BH_MT256x256x32_MI32x32x8x1_SN_FL2_GLS1_NTC2_NTD2_NEPBS0_ONLL1_SU32_SUS128_SPO0_SSO8_WGM19
    SolutionIndex: 2
    SolutionNameMin: Cijk_Alik_Bljk_HHS_BH_MT256x256x32_MI32x32x8x1_SN_FL2_GLS0_NTC3_NTD2_NEPBS0_ONLL2_SU32_SUS128_SPO0_SSO6_WGM19
    SolutionIndex: 3
    SolutionNameMin: Cijk_Alik_Bljk_HHS_BH_MT256x256x32_MI32x32x8x1_SN_FL0_GLS0_NTC3_NTD2_NEPBS0_ONLL1_SU32_SUS128_SPO1_SSO8_WGM19
    SolutionIndex: 4
    SolutionNameMin: Cijk_Alik_Bljk_HHS_BH_MT256x256x32_MI32x32x8x1_SN_FL2_GLS1_NTC3_NTD3_NEPBS0_ONLL0_SU32_SUS128_SPO1_SSO10_WGM19
    SolutionIndex: 5
    SolutionNameMin: Cijk_Alik_Bljk_HHS_BH_MT256x256x32_MI32x32x8x1_SN_FL0_GLS1_NTC3_NTD2_NEPBS0_ONLL1_SU32_SUS128_SPO1_SSO6_WGM19
    SolutionIndex: 6
    SolutionNameMin: Cijk_Alik_Bljk_HHS_BH_MT256x256x32_MI32x32x8x1_SN_FL2_GLS1_NTC3_NTD2_NEPBS0_ONLL0_SU32_SUS128_SPO0_SSO8_WGM18
    SolutionIndex: 7
    SolutionNameMin: Cijk_Alik_Bljk_HHS_BH_MT256x256x32_MI32x32x8x1_SN_FL0_GLS0_NTC3_NTD3_NEPBS0_ONLL2_SU32_SUS128_SPO1_SSO10_WGM19
    SolutionIndex: 8
    SolutionNameMin: Cijk_Alik_Bljk_HHS_BH_MT256x256x32_MI32x32x8x1_SN_FL0_GLS1_NTC2_NTD3_NEPBS0_ONLL0_SU32_SUS64_SPO1_SSO6_WGM18
    SolutionIndex: 9
    SolutionNameMin: Cijk_Alik_Bljk_HHS_BH_MT256x256x32_MI32x32x8x1_SN_FL0_GLS0_NTC2_NTD3_NEPBS0_ONLL1_SU0_SUS0_SPO0_SSO6_WGM18
    SolutionIndex: 10
    SolutionNameMin: Cijk_Alik_Bljk_HHS_BH_MT256x256x32_MI32x32x8x1_SN_FL2_GLS0_NTC3_NTD3_NEPBS0_ONLL2_SU32_SUS64_SPO0_SSO8_WGM19
    SolutionIndex: 11
    SolutionNameMin: Cijk_Alik_Bljk_HHS_BH_MT256x256x32_MI32x32x8x1_SN_1LDSB0_DTVA1_GLS1_LRVW8_NEPBS8_NLCA2_SU0_SUS0_SSO6_WGM30
    SolutionIndex: 12
    SolutionNameMin: Cijk_Alik_Bljk_HHS_BH_MT256x256x32_MI32x32x8x1_SN_1LDSB1_DTVA0_GLS0_LRVW8_NEPBS0_NLCA1_SU32_SUS64_SSO8_WGM12
    SolutionIndex: 13
    SolutionNameMin: Cijk_Alik_Bljk_HHS_BH_MT256x192x64_MI32x32x8x1_SN_AMAS0_GLS1_NEPBS0_PLR9_SU0_SUS0_SSO4_SVW1_TT4_96_VW1_WG64_4_1_WGM32
    SolutionIndex: 14
    SolutionNameMin: Cijk_Alik_Bljk_HHS_BH_MT256x256x32_MI32x32x8x1_SN_AMAS3_CLR0_ELFLR0_GLS1_LBSPPA128_LBSPPB128_LPA8_LPB8_LRVW8_NLCA1_SU4_SUS512_SPO1_SVW2_TT8_64_TLDS1_UMLDSA1_UMLDSB1_VW2_VFLRP0_WG32_8_1_WGM32
    SolutionIndex: 15
    SolutionNameMin: Cijk_Alik_Bljk_HHS_BH_MT256x256x32_MI32x32x8x1_SN_AMAS3_CLR0_ELFLR0_GLS0_LBSPPA128_LBSPPB128_LPA8_LPB8_LRVW8_NLCA1_SU4_SUS512_SPO0_SVW2_TT8_64_TLDS1_UMLDSA1_UMLDSB1_VW2_VFLRP0_WG32_8_1_WGM32
    SolutionIndex: 16
    SolutionNameMin: Cijk_Alik_Bljk_HHS_BH_MT256x256x32_MI32x32x8x1_SN_1LDSB1_DTVA0_GLS0_LBSPPA128_LPA8_LPB8_LRVW8_NEPBS0_NLCA1_SU32_SUS64_SSO6_WGM6
    SolutionIndex: 17
    SolutionNameMin: Cijk_Alik_Bljk_HHS_BH_MT256x256x32_MI32x32x8x1_SN_1LDSB1_DTVA0_GLS0_LBSPPA128_LPA8_LPB8_LRVW8_NEPBS0_NLCA1_SU32_SUS64_SSO8_WGM6
    SolutionIndex: 18
    SolutionNameMin: Cijk_Alik_Bljk_HHS_BH_MT256x128x64_MI16x16x16x1_SN_1LDSB1_DTVA0_GLS1_LBSPPA256_LPA16_LPB16_LRVW8_NEPBS0_NLCA1_SU32_SUS128_SSO8_WGM18
    SolutionIndex: 19
    SolutionNameMin: Cijk_Alik_Bljk_HHS_BH_MT256x256x32_MI32x32x8x1_SN_1LDSB1_DTVA0_GLS0_LBSPPA128_LPA8_LPB8_LRVW8_NEPBS0_NLCA1_SU32_SUS64_SSO8_WGM18
    SolutionIndex: 20
    SolutionNameMin: Cijk_Alik_Bljk_HHS_BH_MT256x128x64_MI16x16x16x1_SN_1LDSB1_DTVA0_GLS0_LBSPPA256_LPA16_LPB16_LRVW8_NEPBS0_NLCA1_SU0_SUS0_SSO6_WGM12
    SolutionIndex: 21
    SolutionNameMin: Cijk_Alik_Bljk_HHS_BH_MT256x224x64_MI16x16x16x1_SN_AMAS3_NEPBS8_SU2_SUS1024_SPO1_SSO0_TT8_112_VW4_WGM32
    SolutionIndex: 22
    SolutionNameMin: Cijk_Alik_Bljk_HHS_BH_MT256x224x64_MI16x16x16x1_SN_AMAS0_NEPBS0_SU2_SUS512_SPO0_SSO0_TT8_112_VW1_WGM16
    SolutionIndex: 23
    SolutionNameMin: Cijk_Alik_Bljk_HHS_BH_MT256x224x64_MI16x16x16x1_SN_AMAS3_NEPBS0_SU2_SUS512_SPO0_SSO0_TT8_112_VW4_WGM16
    SolutionIndex: 24
    SolutionNameMin: Cijk_Alik_Bljk_HHS_BH_MT256x224x64_MI16x16x16x1_SN_AMAS3_NEPBS0_SU0_SUS0_SPO0_SSO0_TT8_112_VW4_WGM16
    SolutionIndex: 25
    SolutionNameMin: Cijk_Alik_Bljk_HHS_BH_MT256x224x64_MI16x16x16x1_SN_AMAS0_NEPBS16_SU4_SUS512_SPO1_SSO0_TT8_112_VW1_WGM16
    SolutionIndex: 26
    SolutionNameMin: Cijk_Alik_Bljk_HHS_BH_MT16x16x512_MI16x16x16x1_SN_AMAS0_EPS1_GLS0_LBSPPA1024_LBSPPB1024_NEPBS0_ONLL1_PLR9_SS0_SPO1_SVW4_TT1_16_U64SL0_VW1_WSGRB1_WG16_4_4
    SolutionIndex: 27
    SolutionNameMin: Cijk_Alik_Bljk_HHS_BH_MT16x16x512_MI16x16x16x1_SN_AMAS0_EPS0_GLS1_LBSPPA1024_LBSPPB1024_NEPBS0_ONLL1_PLR9_SS1_SPO0_SVW1_TT1_16_U64SL0_VW1_WSGRB1_WG16_4_4
    SolutionIndex: 28
    SolutionNameMin: Cijk_Alik_Bljk_HHS_BH_MT32x16x512_MI16x16x16x1_SN_AMAS3_EPS0_GLS1_LBSPPA2048_LBSPPB1024_NEPBS16_ONLL1_PLR9_SS1_SPO0_SVW2_TT2_16_U64SL1_VW2_WSGRB0_WG16_4_4
    SolutionIndex: 29
    SolutionNameMin: Cijk_Alik_Bljk_HHS_BH_MT16x16x256_MI16x16x16x1_SN_AMAS0_EPS0_GLS0_LBSPPA512_LBSPPB512_NEPBS16_ONLL0_PLR5_SS0_SPO1_SVW4_TT1_16_U64SL0_VW1_WSGRB0_WG16_4_4
    SolutionIndex: 30
    SolutionNameMin: Cijk_Alik_Bljk_HHS_BH_MT32x16x256_MI16x16x16x1_SN_AMAS0_EPS1_GLS0_LBSPPA512_LBSPPB512_NEPBS0_ONLL0_PLR5_SS1_SPO0_SVW1_TT2_16_U64SL1_VW1_WSGRB0_WG16_4_4
    SolutionIndex: 31
    SolutionNameMin: Cijk_Alik_Bljk_HHS_BH_MT16x32x512_MI16x16x16x1_SN_AMAS0_EMLL0_GLS0_LBSPPA1024_LBSPPB1024_LPA16_LPB16_NEPBS16_PLR9_SS0_SPO1_SSO0_SVW4_TT1_32_VW1_WG16_4_4
    SolutionIndex: 32
    SolutionNameMin: Cijk_Alik_Bljk_HHS_BH_MT16x16x512_MI16x16x16x1_SN_AMAS0_EMLL4_GLS0_LBSPPA1024_LBSPPB1024_LPA16_LPB16_NEPBS0_PLR9_SS0_SPO0_SSO0_SVW4_TT1_16_VW1_WG16_4_4
    SolutionIndex: 33
    SolutionNameMin: Cijk_Alik_Bljk_HHS_BH_MT64x16x256_MI16x16x16x1_SN_AMAS0_EMLL4_GLS1_LBSPPA512_LBSPPB512_LPA16_LPB16_NEPBS16_PLR9_SS1_SPO1_SSO0_SVW1_TT2_16_VW1_WG32_4_2
    SolutionIndex: 34
    SolutionNameMin: Cijk_Alik_Bljk_HHS_BH_MT16x32x128_MI16x16x16x1_SN_AMAS0_EMLL0_GLS1_LBSPPA256_LBSPPB256_LPA16_LPB16_NEPBS0_PLR5_SS0_SPO0_SSO4_SVW4_TT1_32_VW1_WG16_4_2
    SolutionIndex: 35
    SolutionNameMin: Cijk_Alik_Bljk_HHS_BH_MT32x32x256_MI16x16x16x1_SN_AMAS3_EMLL0_GLS1_LBSPPA1024_LBSPPB512_LPA16_LPB16_NEPBS0_PLR5_SS1_SPO1_SSO0_SVW2_TT2_32_VW2_WG16_4_4
    SolutionIndex: 36
    SolutionNameMin: Cijk_Alik_Bljk_HHS_BH_MT16x64x256_MI16x16x16x1_SN_AMAS3_EMLL4_GLS0_LBSPPA512_LBSPPB512_LPA16_LPB16_NEPBS16_PLR5_SS0_SPO0_SSO0_SVW4_TT1_64_VW4_WG16_4_4
    SolutionIndex: 37
    SolutionNameMin: Cijk_Alik_Bljk_HHS_BH_MT16x32x512_MI16x16x16x1_SN_AMAS3_EMLL0_GLS1_LBSPPA1024_LBSPPB1024_LPA16_LPB16_NEPBS0_PLR9_SS0_SPO0_SSO0_SVW4_TT1_32_VW4_WG16_4_4
    SolutionIndex: 38
    SolutionNameMin: Cijk_Alik_Bljk_HHS_BH_MT64x32x256_MI16x16x16x1_SN_AMAS3_EMLL4_GLS0_LBSPPA1024_LBSPPB512_LPA16_LPB16_NEPBS16_PLR9_SS1_SPO0_SSO0_SVW2_TT2_32_VW2_WG32_4_2
    SolutionIndex: 39
    SolutionNameMin: Cijk_Alik_Bljk_HHS_BH_MT64x32x256_MI16x16x16x1_SN_AMAS0_EMLL0_GLS1_LBSPPA512_LBSPPB512_LPA16_LPB16_NEPBS16_PLR5_SS1_SPO0_SSO0_SVW1_TT4_32_VW1_WG16_4_4
    SolutionIndex: 40
    SolutionNameMin: Cijk_Alik_Bljk_HHS_BH_MT64x32x256_MI16x16x16x1_SN_AMAS3_EMLL0_GLS0_LBSPPA1024_LBSPPB512_LPA16_LPB16_NEPBS16_PLR5_SS1_SPO0_SSO0_SVW2_TT4_32_VW2_WG16_4_4
    SolutionIndex: 41
    SolutionNameMin: Cijk_Alik_Bljk_HHS_BH_MT256x224x64_MI16x16x16x1_SN_FL1_GLVWA2_GLVWB2_GRVW2_LBSPPA512_LBSPPB128_LPA4_LPB4_LRVW4_PLR5_SVW4_TT8_112_VW4_WSGRA0_WG32_8_1_WGM16
    SolutionIndex: 42
    SolutionNameMin: Cijk_Alik_Bljk_HHS_BH_MT256x256x32_MI16x16x16x1_SN_FL1_GLVWA2_GLVWB2_GRVW2_LBSPPA128_LBSPPB128_LPA4_LPB4_LRVW4_PLR3_SVW2_TT8_128_VW2_WSGRA0_WG32_8_1_WGM32
    SolutionIndex: 43
    SolutionNameMin: Cijk_Alik_Bljk_HHS_BH_MT256x256x32_MI32x32x8x1_SN_1LDSB1_ELFLR0_GLS0_LBSPPA128_LBSPPB128_LPA8_LPB8_LRVW8_NEPBS0_NLCA1_SU32_SUS128_SSO8_WGM30
    SolutionIndex: 44
    SolutionNameMin: Cijk_Alik_Bljk_HHS_BH_MT256x256x32_MI32x32x8x1_SN_1LDSB1_ELFLR0_GLS0_LBSPPA128_LBSPPB128_LPA8_LPB8_LRVW8_NEPBS0_NLCA1_SU32_SUS64_SSO6_WGM30
    SolutionIndex: 45
    SolutionNameMin: Cijk_Alik_Bljk_HHS_BH_MT256x256x32_MI32x32x8x1_SN_1LDSB1_ELFLR0_GLS0_LBSPPA128_LBSPPB128_LPA8_LPB8_LRVW8_NEPBS0_NLCA1_SU32_SUS128_SSO6_WGM18
    SolutionIndex: 46
    SolutionNameMin: Cijk_Alik_Bljk_HHS_BH_MT256x256x32_MI32x32x8x1_SN_1LDSB1_ELFLR8_GLS0_LBSPPA128_LBSPPB128_LPA8_LPB8_LRVW8_NEPBS0_NLCA1_SU32_SUS64_SSO6_WGM30
    SolutionIndex: 47
    SolutionNameMin: Cijk_Alik_Bljk_HHS_BH_MT256x256x32_MI32x32x8x1_SN_1LDSB1_ELFLR0_GLS1_LBSPPA128_LBSPPB128_LPA8_LPB8_LRVW8_NEPBS0_NLCA1_SU32_SUS64_SSO6_WGM18
    SolutionIndex: 48
    SolutionNameMin: Cijk_Alik_Bljk_HHS_BH_MT256x256x32_MI32x32x8x1_SN_1LDSB1_ELFLR0_GLS0_LBSPPA128_LBSPPB128_LPA8_LPB8_LRVW8_NEPBS0_NLCA1_SU32_SUS64_SSO6_WGM18
    SolutionIndex: 49
    SolutionNameMin: Cijk_Alik_Bljk_HHS_BH_MT256x256x32_MI32x32x8x1_SN_1LDSB1_ELFLR0_GLS1_LBSPPA128_LBSPPB128_LPA8_LPB8_LRVW8_NEPBS0_NLCA1_SU32_SUS128_SSO8_WGM18
    SolutionIndex: 50
    SolutionNameMin: Cijk_Alik_Bljk_HHS_BH_MT256x256x32_MI32x32x8x1_SN_1LDSB1_ELFLR8_GLS0_LBSPPA128_LBSPPB128_LPA8_LPB8_LRVW8_NEPBS0_NLCA1_SU32_SUS64_SSO6_WGM18
- - - [12288, 9728, 1, 16512]
    - [0, 83.215]
  - - [6144, 4864, 1, 4096]
    - [48, 55.436]
  - - [6144, 4864, 1, 8192]
    - [50, 57.627]
  - - [6144, 4864, 1, 16384]
    - [1, 70.351]
  - - [6144, 9728, 1, 4096]
    - [2, 70.358]
  - - [6144, 9728, 1, 8192]
    - [3, 72.553]
  - - [6144, 9728, 1, 16384]
    - [4, 63.371]
  - - [9216, 4864, 1, 4096]
    - [5, 70.002]
  - - [9216, 4864, 1, 8192]
    - [6, 75.338]
  - - [9216, 4864, 1, 16384]
    - [7, 67.44]
  - - [6144, 4864, 1, 4352]
    - [8, 73.763]
  - - [6144, 4864, 1, 8448]
    - [9, 77.512]
  - - [6144, 4864, 1, 16640]
    - [10, 63.729]
  - - [4864, 3072, 1, 4096]
    - [17, 78.828]
  - - [12288, 9728, 1, 16416]
    - [11, 89.231]
  - - [12320, 9728, 1, 16512]
    - [12, 74.895]
  - - [4864, 4096, 1, 8192]
    - [42, 39.911]
  - - [9728, 8192, 1, 8192]
    - [15, 69.278]
  - - [9728, 8192, 1, 65536]
    - [13, 55.219]
  - - [8192, 8192, 1, 8192]
    - [14, 63.041]
  - - [4864, 3072, 1, 2048]
    - [16, 80.381]
  - - [4864, 3072, 1, 6144]
    - [18, 78.468]
  - - [4864, 3072, 1, 8192]
    - [16, 92.627]
  - - [3072, 4864, 1, 2048]
    - [16, 80.114]
  - - [3072, 4864, 1, 4096]
    - [19, 82.172]
  - - [3072, 4864, 1, 6144]
    - [20, 79.244]
  - - [3072, 4864, 1, 8192]
    - [16, 92.618]
  - - [7168, 65536, 1, 28672]
    - [21, 92.58]
  - - [21504, 65536, 1, 7168]
    - [22, 85.12]
  - - [28672, 65536, 1, 7168]
    - [23, 85.24]
  - - [7168, 65536, 1, 7168]
    - [24, 88.18]
  - - [50432, 65536, 1, 7168]
    - [25, 84.64]
  - - [4000, 8, 1, 8192]
    - [26, 2.312]
  - - [1280, 8, 1, 8192]
    - [27, 1.399]
  - - [8192, 8, 1, 1024]
    - [28, 1.505]
  - - [7168, 8, 1, 8192]
    - [29, 2.822]
  - - [8192, 8, 1, 3584]
    - [30, 2.859]
  - - [4000, 32, 1, 8192]
    - [31, 9.573]
  - - [1280, 32, 1, 8192]
    - [32, 5.669]
  - - [8192, 32, 1, 1024]
    - [33, 7.112]
  - - [7168, 32, 1, 8192]
    - [34, 12.392]
  - - [8192, 32, 1, 3584]
    - [35, 11.752]
  - - [4000, 64, 1, 8192]
    - [36, 16.166]
  - - [1280, 64, 1, 8192]
    - [37, 8.604]
  - - [8192, 64, 1, 1024]
    - [38, 12.981]
  - - [7168, 64, 1, 8192]
    - [39, 19.432]
  - - [8192, 64, 1, 3584]
    - [40, 24.702]
  - - [4096, 4096, 1, 8192]
    - [41, 79.579]
  - - [4864, 6144, 1, 2048]
    - [43, 50.779]
  - - [4864, 6144, 1, 4096]
    - [44, 55.99]
  - - [4864, 6144, 1, 6144]
    - [45, 53.369]
  - - [4864, 6144, 1, 8192]
    - [46, 58.699]
  - - [6144, 4864, 1, 2048]
    - [47, 50.499]
  - - [6144, 4864, 1, 6144]
    - [49, 52.872]
- null
- null
- DeviceEfficiency
