library/src/blas3/Tensile/Logic/asm_full/aquavanjaram942/aquavanjaram942_Cijk_Alik_Bljk_HHS_BH.yaml
- {MinimumRequiredVersion: 4.36.0}
- aquavanjaram942
- gfx942
- [Device 0049, Device 0050]
    SolutionIndex: 0
    SolutionNameMin: Cijk_Alik_Bljk_HHS_BH_MT256x256x32_MI32x32x8x1_SN_DTVA0_FL2_GLS1_NTC2_NTD3_NLCA1_ONLL2_SU32_SUS64_SPO0_SSO10_WGM18
    SolutionIndex: 1
    SolutionNameMin: Cijk_Alik_Bljk_HHS_BH_MT256x256x32_MI32x32x8x1_SN_FL2_GLS0_NTC2_NTD3_NEPBS0_ONLL2_SU32_SUS64_SPO0_SSO6_WGM4
    SolutionIndex: 2
    SolutionNameMin: Cijk_Alik_Bljk_HHS_BH_MT256x256x32_MI32x32x8x1_SN_FL0_GLS0_NTC2_NTD3_NEPBS8_ONLL1_SU32_SUS64_SPO0_SSO6_WGM18
    SolutionIndex: 3
    SolutionNameMin: Cijk_Alik_Bljk_HHS_BH_MT256x256x32_MI32x32x8x1_SN_FL2_GLS1_NTC2_NTD2_NEPBS0_ONLL1_SU32_SUS128_SPO0_SSO8_WGM19
    SolutionIndex: 4
    SolutionNameMin: Cijk_Alik_Bljk_HHS_BH_MT256x256x32_MI32x32x8x1_SN_FL2_GLS0_NTC3_NTD2_NEPBS0_ONLL2_SU32_SUS128_SPO0_SSO6_WGM19
    SolutionIndex: 5
    SolutionNameMin: Cijk_Alik_Bljk_HHS_BH_MT256x256x32_MI32x32x8x1_SN_FL0_GLS0_NTC3_NTD2_NEPBS0_ONLL1_SU32_SUS128_SPO1_SSO8_WGM19
    SolutionIndex: 6
    SolutionNameMin: Cijk_Alik_Bljk_HHS_BH_MT256x256x32_MI32x32x8x1_SN_FL2_GLS1_NTC3_NTD3_NEPBS0_ONLL0_SU32_SUS128_SPO1_SSO10_WGM19
    SolutionIndex: 7
    SolutionNameMin: Cijk_Alik_Bljk_HHS_BH_MT256x256x32_MI32x32x8x1_SN_FL0_GLS1_NTC3_NTD2_NEPBS0_ONLL1_SU32_SUS128_SPO1_SSO6_WGM19
    SolutionIndex: 8
    SolutionNameMin: Cijk_Alik_Bljk_HHS_BH_MT256x256x32_MI32x32x8x1_SN_FL2_GLS1_NTC3_NTD2_NEPBS0_ONLL0_SU32_SUS128_SPO0_SSO8_WGM18
    SolutionIndex: 9
    SolutionNameMin: Cijk_Alik_Bljk_HHS_BH_MT256x256x32_MI32x32x8x1_SN_FL0_GLS0_NTC3_NTD3_NEPBS0_ONLL2_SU32_SUS128_SPO1_SSO10_WGM19
    SolutionIndex: 10
    SolutionNameMin: Cijk_Alik_Bljk_HHS_BH_MT256x256x32_MI32x32x8x1_SN_FL0_GLS1_NTC2_NTD3_NEPBS0_ONLL0_SU32_SUS64_SPO1_SSO6_WGM18
    SolutionIndex: 11
    SolutionNameMin: Cijk_Alik_Bljk_HHS_BH_MT256x256x32_MI32x32x8x1_SN_FL0_GLS0_NTC2_NTD3_NEPBS0_ONLL1_SU0_SUS0_SPO0_SSO6_WGM18
    SolutionIndex: 12
    SolutionNameMin: Cijk_Alik_Bljk_HHS_BH_MT256x256x32_MI32x32x8x1_SN_FL2_GLS0_NTC3_NTD3_NEPBS0_ONLL2_SU32_SUS64_SPO0_SSO8_WGM19
    SolutionIndex: 13
    SolutionNameMin: Cijk_Alik_Bljk_HHS_BH_MT256x256x32_MI32x32x8x1_SN_1LDSB0_DTVA1_GLS1_LRVW8_NEPBS8_NLCA2_SU0_SUS0_SSO6_WGM30
    SolutionIndex: 14
    SolutionNameMin: Cijk_Alik_Bljk_HHS_BH_MT256x256x32_MI32x32x8x1_SN_1LDSB1_DTVA0_GLS0_LRVW8_NEPBS0_NLCA1_SU32_SUS64_SSO8_WGM12
    SolutionIndex: 15
    SolutionNameMin: Cijk_Alik_Bljk_HHS_BH_MT256x256x32_MI32x32x8x1_SN_AMAS3_GLS0_NEPBS0_PLR5_SU4_SUS512_SSO0_SVW2_TT8_64_VW2_WG32_8_1_WGM32
    SolutionIndex: 16
    SolutionNameMin: Cijk_Alik_Bljk_HHS_BH_MT256x192x64_MI32x32x8x1_SN_AMAS0_GLS1_NEPBS0_PLR9_SU0_SUS0_SSO4_SVW1_TT4_96_VW1_WG64_4_1_WGM32
    SolutionIndex: 17
    SolutionNameMin: Cijk_Alik_Bljk_HHS_BH_MT256x256x32_MI32x32x8x1_SN_AMAS3_CLR0_ELFLR0_GLS1_LBSPPA128_LBSPPB128_LPA8_LPB8_LRVW8_NLCA1_SU4_SUS512_SPO1_SVW2_TT8_64_TLDS1_UMLDSA1_UMLDSB1_VW2_VFLRP0_WG32_8_1_WGM32
    SolutionIndex: 18
    SolutionNameMin: Cijk_Alik_Bljk_HHS_BH_MT256x256x32_MI32x32x8x1_SN_AMAS3_CLR0_ELFLR0_GLS0_LBSPPA128_LBSPPB128_LPA8_LPB8_LRVW8_NLCA1_SU4_SUS512_SPO0_SVW2_TT8_64_TLDS1_UMLDSA1_UMLDSB1_VW2_VFLRP0_WG32_8_1_WGM32
    SolutionIndex: 19
    SolutionNameMin: Cijk_Alik_Bljk_HHS_BH_MT256x256x32_MI32x32x8x1_SN_1LDSB1_DTVA0_GLS0_LBSPPA128_LPA8_LPB8_LRVW8_NEPBS0_NLCA1_SU32_SUS64_SSO6_WGM6
    SolutionIndex: 20
    SolutionNameMin: Cijk_Alik_Bljk_HHS_BH_MT256x256x32_MI32x32x8x1_SN_1LDSB1_DTVA0_GLS0_LBSPPA128_LPA8_LPB8_LRVW8_NEPBS0_NLCA1_SU32_SUS64_SSO8_WGM6
    SolutionIndex: 21
    SolutionNameMin: Cijk_Alik_Bljk_HHS_BH_MT256x128x64_MI16x16x16x1_SN_1LDSB1_DTVA0_GLS1_LBSPPA256_LPA16_LPB16_LRVW8_NEPBS0_NLCA1_SU32_SUS128_SSO8_WGM18
    SolutionIndex: 22
    SolutionNameMin: Cijk_Alik_Bljk_HHS_BH_MT256x256x32_MI32x32x8x1_SN_1LDSB1_DTVA0_GLS0_LBSPPA128_LPA8_LPB8_LRVW8_NEPBS0_NLCA1_SU32_SUS64_SSO8_WGM18
    SolutionIndex: 23
    SolutionNameMin: Cijk_Alik_Bljk_HHS_BH_MT256x128x64_MI16x16x16x1_SN_1LDSB1_DTVA0_GLS0_LBSPPA256_LPA16_LPB16_LRVW8_NEPBS0_NLCA1_SU0_SUS0_SSO6_WGM12
- - - [12288, 9728, 1, 16512]
    - [0, 83.215]
  - - [6144, 4864, 1, 4096]
    - [1, 72.688]
  - - [6144, 4864, 1, 8192]
    - [2, 81.645]
  - - [6144, 4864, 1, 16384]
    - [3, 70.351]
  - - [6144, 9728, 1, 4096]
    - [4, 70.358]
  - - [6144, 9728, 1, 8192]
    - [5, 72.553]
  - - [6144, 9728, 1, 16384]
    - [6, 63.371]
  - - [9216, 4864, 1, 4096]
    - [7, 70.002]
  - - [9216, 4864, 1, 8192]
    - [8, 75.338]
  - - [9216, 4864, 1, 16384]
    - [9, 67.44]
  - - [6144, 4864, 1, 4352]
    - [10, 73.763]
  - - [6144, 4864, 1, 8448]
    - [11, 77.512]
  - - [6144, 4864, 1, 16640]
    - [12, 63.729]
  - - [4864, 3072, 1, 4096]
    - [20, 78.828]
  - - [12288, 9728, 1, 16416]
    - [13, 89.231]
  - - [12320, 9728, 1, 16512]
    - [14, 74.895]
  - - [4864, 4096, 1, 8192]
    - [15, 60.029]
  - - [9728, 8192, 1, 8192]
    - [18, 69.278]
  - - [9728, 8192, 1, 65536]
    - [16, 55.219]
  - - [8192, 8192, 1, 8192]
    - [17, 63.041]
  - - [4864, 3072, 1, 2048]
    - [19, 80.381]
  - - [4864, 3072, 1, 6144]
    - [21, 78.468]
  - - [4864, 3072, 1, 8192]
    - [19, 92.627]
  - - [3072, 4864, 1, 2048]
    - [19, 80.114]
  - - [3072, 4864, 1, 4096]
    - [22, 82.172]
  - - [3072, 4864, 1, 6144]
    - [23, 79.244]
  - - [3072, 4864, 1, 8192]
    - [19, 92.618]
- null
- null
- DeviceEfficiency
