library/src/blas3/Tensile/Logic/asm_full/aquavanjaram942/aquavanjaram942_Cijk_Ailk_Bjlk_BSS_BH.yaml
- {MinimumRequiredVersion: 4.36.0}
- aquavanjaram942
- gfx942
- [Device 0049, Device 0050]
    SolutionIndex: 0
    SolutionNameMin: Cijk_Ailk_Bjlk_BSS_BH_MT256x128x16_MI32x32x8x1_SN_AMAS3_MIAV0_NTA0_NTB0_NTC2_NTD0_SVW2_VW2_WSGRA0_WSGRB0_WGM12
    SolutionIndex: 1
    SolutionNameMin: Cijk_Ailk_Bjlk_BSS_BH_MT256x128x16_MI32x32x8x1_SN_AMAS0_MIAV0_NTA0_NTB0_NTC2_NTD1_SVW1_VW1_WSGRA0_WSGRB1_WGM6
    SolutionIndex: 2
    SolutionNameMin: Cijk_Ailk_Bjlk_BSS_BH_MT256x128x16_MI32x32x8x1_SN_AMAS3_MIAV0_NTA1_NTB0_NTC3_NTD3_SVW2_VW2_WSGRA0_WSGRB0_WGM6
    SolutionIndex: 3
    SolutionNameMin: Cijk_Ailk_Bjlk_BSS_BH_MT256x128x16_MI32x32x8x1_SN_AMAS3_MIAV0_NTA0_NTB1_NTC2_NTD0_SVW2_VW2_WSGRA0_WSGRB0_WGM18
    SolutionIndex: 4
    SolutionNameMin: Cijk_Ailk_Bjlk_BSS_BH_MT256x128x16_MI32x32x8x1_SN_AMAS3_MIAV0_NTA0_NTB1_NTC3_NTD2_SVW2_VW2_WSGRA0_WSGRB0_WGM12
    SolutionIndex: 5
    SolutionNameMin: Cijk_Ailk_Bjlk_BSS_BH_MT256x128x16_MI32x32x8x1_SN_AMAS0_MIAV1_NTA0_NTB0_NTC2_NTD0_SVW1_VW1_WSGRA1_WSGRB1_WGM6
    SolutionIndex: 6
    SolutionNameMin: Cijk_Ailk_Bjlk_BSS_BH_MT256x128x16_MI32x32x8x1_SN_AMAS0_MIAV1_NTA0_NTB0_NTC3_NTD3_SVW1_VW1_WSGRA1_WSGRB0_WGM6
    SolutionIndex: 7
    SolutionNameMin: Cijk_Ailk_Bjlk_BSS_BH_MT256x128x16_MI32x32x8x1_SN_AMAS3_MIAV1_NTA0_NTB1_NTC2_NTD2_SVW2_VW2_WSGRA0_WSGRB0_WGM6
    SolutionIndex: 8
    SolutionNameMin: Cijk_Ailk_Bjlk_BSS_BH_MT256x256x32_MI16x16x16x1_SN_1LDSB0_NTA2_NTB0_NEPBS8_PLR1_SU0_SUS0_SPO0_SSO0_TT8_128_VFLRP0_WSGRA1_WSGRB0_WG32_8_1_WGM18
    SolutionIndex: 9
    SolutionNameMin: Cijk_Ailk_Bjlk_BSS_BH_MT256x256x32_MI16x16x16x1_SN_1LDSB1_CLR1_GRVW8_LBSPPA2048_LBSPPB2048_LPA32_LPB16_PLR3_SU0_SUS0_SVW2_TT8_128_VW2_VFLRP1_WSGRA1_WSGRB1_WG32_8_1_WGM18
    SolutionIndex: 10
    SolutionNameMin: Cijk_Ailk_Bjlk_BSS_BH_MT256x256x16_MI32x32x8x1_SN_1LDSB0_CLR1_GRVW8_LBSPPA0_LBSPPB0_LPA0_LPB0_PLR3_SU32_SUS256_SVW4_TT8_64_VW4_VFLRP1_WSGRA0_WSGRB0_WG32_8_1_WGM6
    SolutionIndex: 11
    SolutionNameMin: Cijk_Ailk_Bjlk_BSS_BH_MT256x256x16_MI32x32x8x1_SN_1LDSB1_CLR1_GRVW8_LBSPPA0_LBSPPB0_LPA0_LPB0_PLR3_SU0_SUS0_SVW4_TT4_128_VW4_VFLRP1_WSGRA0_WSGRB0_WG64_4_1_WGM18
    SolutionIndex: 12
    SolutionNameMin: Cijk_Ailk_Bjlk_BSS_BH_MT256x256x16_MI32x32x8x1_SN_1LDSB1_CLR1_GRVW4_LBSPPA0_LBSPPB0_LPA0_LPB0_PLR3_SU0_SUS0_SVW4_TT8_64_VW4_VFLRP1_WSGRA0_WSGRB0_WG32_8_1_WGM6
    SolutionIndex: 13
    SolutionNameMin: Cijk_Ailk_Bjlk_BSS_BH_MT256x256x16_MI32x32x8x1_SN_1LDSB1_CLR1_GRVW8_NEPBS8_SU0_SUS0_SPO1_SSO0_VFLRP1_WSGRA0_WSGRB1_WGM12
    SolutionIndex: 14
    SolutionNameMin: Cijk_Ailk_Bjlk_BSS_BH_MT256x256x16_MI32x32x8x1_SN_1LDSB0_CLR1_GRVW4_NEPBS8_SU0_SUS0_SPO1_SSO0_VFLRP1_WSGRA0_WSGRB1_WGM30
    SolutionIndex: 15
    SolutionNameMin: Cijk_Ailk_Bjlk_BSS_BH_MT256x256x32_MI16x16x16x1_SN_1LDSB1_ELFLR0_GLS1_LBSPPA2048_LBSPPB2048_LPA32_LPB16_NEPBS0_NLCA2_NLCB2_PLR3_SPO0_TT8_128_WSGRA0_WSGRB1_WG32_8_1_WGM30
    SolutionIndex: 16
    SolutionNameMin: Cijk_Ailk_Bjlk_BSS_BH_MT256x256x32_MI16x16x16x1_SN_1LDSB1_ELFLR0_GLS0_LBSPPA2048_LBSPPB2048_LPA32_LPB16_NEPBS8_NLCA2_NLCB1_PLR3_SPO0_TT8_128_WSGRA1_WSGRB0_WG32_8_1_WGM30
    SolutionIndex: 17
    SolutionNameMin: Cijk_Ailk_Bjlk_BSS_BH_MT256x256x32_MI16x16x16x1_SN_1LDSB1_ELFLR0_GLS0_LBSPPA2048_LBSPPB2048_LPA32_LPB16_NEPBS8_NLCA2_NLCB1_PLR3_SPO0_TT8_128_WSGRA0_WSGRB1_WG32_8_1_WGM30
    SolutionIndex: 18
    SolutionNameMin: Cijk_Ailk_Bjlk_BSS_BH_MT256x256x32_MI16x16x16x1_SN_1LDSB1_ELFLR0_GLS0_LBSPPA2048_LBSPPB2048_LPA32_LPB16_NEPBS16_NLCA1_NLCB1_PLR3_SPO0_TT8_128_WSGRA0_WSGRB0_WG32_8_1_WGM18
    SolutionIndex: 19
    SolutionNameMin: Cijk_Ailk_Bjlk_BSS_BH_MT256x256x32_MI16x16x16x1_SN_1LDSB1_ELFLR0_GLS0_LBSPPA2048_LBSPPB2048_LPA32_LPB16_NEPBS8_NLCA1_NLCB1_PLR3_SPO1_TT8_128_WSGRA0_WSGRB1_WG32_8_1_WGM18
    SolutionIndex: 20
    SolutionNameMin: Cijk_Ailk_Bjlk_BSS_BH_MT256x256x32_MI16x16x16x1_SN_1LDSB1_ELFLR0_GLS0_LBSPPA2048_LBSPPB2048_LPA32_LPB16_NEPBS8_NLCA1_NLCB1_PLR3_SPO1_TT8_128_WSGRA0_WSGRB0_WG32_8_1_WGM18
    SolutionIndex: 21
    SolutionNameMin: Cijk_Ailk_Bjlk_BSS_BH_MT256x256x32_MI16x16x16x1_SN_1LDSB1_ELFLR0_GLS1_LBSPPA2048_LBSPPB2048_LPA32_LPB16_NEPBS16_NLCA2_NLCB1_PLR3_SPO0_TT8_128_WSGRA1_WSGRB0_WG32_8_1_WGM18
    SolutionIndex: 22
    SolutionNameMin: Cijk_Ailk_Bjlk_BSS_BH_MT256x256x32_MI32x32x8x1_SN_
- - - [6144, 4864, 1, 4096]
    - [19, 74.69]
  - - [6144, 4864, 1, 8192]
    - [21, 80.17]
  - - [6144, 4864, 1, 16384]
    - [4, 80.65]
  - - [6144, 4864, 1, 4352]
    - [6, 71.359]
  - - [6144, 4864, 1, 8448]
    - [3, 77.231]
  - - [6144, 4864, 1, 16640]
    - [2, 80.74]
  - - [4864, 3072, 1, 4096]
    - [9, 70.63]
  - - [4864, 3072, 1, 8192]
    - [13, 73.76]
  - - [4864, 3072, 1, 16384]
    - [7, 79.987]
  - - [4864, 3072, 1, 4352]
    - [5, 70.538]
  - - [4864, 3072, 1, 8448]
    - [1, 76.616]
  - - [4864, 3072, 1, 16640]
    - [0, 80.077]
  - - [4864, 3072, 1, 2048]
    - [8, 62.19]
  - - [4864, 3072, 1, 6144]
    - [10, 73.59]
  - - [3072, 4864, 1, 2048]
    - [11, 61.05]
  - - [3072, 4864, 1, 4096]
    - [9, 70.57]
  - - [3072, 4864, 1, 6144]
    - [12, 66.22]
  - - [3072, 4864, 1, 8192]
    - [14, 73.63]
  - - [4864, 6144, 1, 4096]
    - [15, 74.48]
  - - [4864, 6144, 1, 6144]
    - [16, 78.48]
  - - [4864, 6144, 1, 8192]
    - [17, 79.67]
  - - [6144, 4864, 1, 2048]
    - [18, 66.82]
  - - [6144, 4864, 1, 6144]
    - [20, 78.02]
  - - [4864, 6144, 1, 2048]
    - [22, 66.2]
- null
- null
- DeviceEfficiency
