library/src/blas3/Tensile/Logic/asm_full/aldebaran/fp16altimpl/aldebaran_Cijk_Alik_Bjlk_HHS_BHR.yaml
- {MinimumRequiredVersion: 4.30.0}
- aldebaran
- gfx90a
- [Device 7400, Device 7408, Device 740c]
    SolutionIndex: 0
    SolutionNameMin: Cijk_Alik_Bjlk_HBHR_MT64x64x4_SN_
    SolutionIndex: 1
    SolutionNameMin: Cijk_Alik_Bjlk_HBHR_MT16x16x64_MI16x16x16x1_SN_1LDSB0_EPS0_GRVW8_IU1_LPA16_NLCB1_PGR2_PLR5_SU32_SUS256_SRVW4_TT1_16_WG16_4_1
    SolutionIndex: 2
    SolutionNameMin: Cijk_Alik_Bjlk_HBHR_MT32x32x64_MI16x16x16x1_SN_1LDSB0_EPS0_GRVW8_IU1_LPA16_NLCB1_PGR2_PLR5_SU0_SUS0_SRVW4_TT1_16_WG32_8_1
    SolutionIndex: 3
    SolutionNameMin: Cijk_Alik_Bjlk_HBHR_MT16x64x64_MI16x16x16x1_SN_1LDSB0_EPS0_GRVW8_IU1_LPA16_NLCB1_PGR2_PLR5_SU0_SUS0_SRVW4_TT1_16_WG16_16_1
    SolutionIndex: 4
    SolutionNameMin: Cijk_Alik_Bjlk_HBHR_MT32x32x64_MI16x16x16x1_SN_1LDSB0_EPS0_GRVW8_IU1_LPA16_NLCB1_PGR2_PLR5_SU32_SUS128_SRVW4_TT1_16_WG32_8_1
    SolutionIndex: 5
    SolutionNameMin: Cijk_Alik_Bjlk_HBHR_MT4x64x32_MI4x4x4x16_SN_1LDSB0_EPS0_GRVW4_IU2_LPA8_NLCB1_PGR2_PLR5_SU0_SUS0_SRVW0_TT1_4_WG4_16_1
    SolutionIndex: 6
    SolutionNameMin: Cijk_Alik_Bjlk_HBHR_MT16x64x64_MI16x16x16x1_SN_1LDSB0_EPS0_GRVW8_IU1_LPA16_NLCB1_PGR2_PLR5_SU32_SUS128_SRVW4_TT1_16_WG16_16_1
    SolutionIndex: 7
    SolutionNameMin: Cijk_Alik_Bjlk_HBHR_MT32x32x64_MI16x16x16x1_SN_1LDSB0_EPS0_GRVW8_IU1_LPA16_NLCB1_PGR2_PLR5_SU32_SUS256_SRVW4_TT1_16_WG32_8_1
    SolutionIndex: 8
    SolutionNameMin: Cijk_Alik_Bjlk_HBHR_MT16x16x64_MI16x16x16x1_SN_1LDSB0_EPS0_GRVW8_IU1_LPA16_NLCB1_PGR2_PLR5_SU0_SUS0_SRVW4_TT1_16_WG16_4_1
    SolutionIndex: 9
    SolutionNameMin: Cijk_Alik_Bjlk_HBHR_MT64x32x64_MI16x16x16x1_SN_1LDSB0_EPS0_GRVW8_IU1_LPA16_NLCB1_PGR2_PLR5_SU0_SUS0_SRVW4_TT2_16_WG32_8_1
    SolutionIndex: 10
    SolutionNameMin: Cijk_Alik_Bjlk_HBHR_MT16x16x64_MI16x16x16x1_SN_1LDSB0_EPS0_GRVW4_IU1_LPA16_NLCB1_PGR2_PLR5_SU0_SUS0_SRVW4_TT1_16_WG16_4_1
    SolutionIndex: 11
    SolutionNameMin: Cijk_Alik_Bjlk_HBHR_MT64x64x64_MI32x32x8x1_SN_1LDSB0_EPS0_GRVW8_IU2_LPA8_NLCB1_PGR2_PLR5_SU0_SUS0_SRVW4_TT1_32_WG64_4_1
    SolutionIndex: 12
    SolutionNameMin: Cijk_Alik_Bjlk_HBHR_MT4x64x32_MI4x4x4x16_SN_1LDSB0_EPS0_GRVW4_IU2_LPA8_NLCB1_PGR2_PLR1_SU0_SUS0_SRVW0_TT1_4_WG4_16_1
    SolutionIndex: 13
    SolutionNameMin: Cijk_Alik_Bjlk_HBHR_MT32x32x64_MI16x16x16x1_SN_1LDSB0_EPS0_GRVW4_IU1_LPA16_NLCB1_PGR2_PLR5_SU0_SUS0_SRVW4_TT1_16_WG32_8_1
    SolutionIndex: 14
    SolutionNameMin: Cijk_Alik_Bjlk_HBHR_MT4x64x32_MI4x4x4x16_SN_1LDSB0_EPS1_GRVW4_IU2_LPA8_NLCB1_PGR1_PLR5_SU0_SUS0_SRVW0_TT1_4_WG4_16_1
    SolutionIndex: 15
    SolutionNameMin: Cijk_Alik_Bjlk_HBHR_MT16x64x64_MI16x16x16x1_SN_1LDSB0_EPS0_GRVW8_IU1_LPA16_NLCB1_PGR2_PLR5_SU32_SUS256_SRVW4_TT1_16_WG16_16_1
    SolutionIndex: 16
    SolutionNameMin: Cijk_Alik_Bjlk_HBHR_MT64x64x64_MI32x32x8x1_SN_1LDSB0_EPS0_GRVW8_IU2_LPA8_NLCB1_PGR2_PLR1_SU0_SUS0_SRVW4_TT1_32_WG64_4_1
    SolutionIndex: 17
    SolutionNameMin: Cijk_Alik_Bjlk_HBHR_MT64x16x64_MI16x16x16x1_SN_1LDSB0_EPS0_GRVW8_IU1_LPA16_NLCB1_PGR2_PLR5_SU0_SUS0_SRVW4_TT1_16_WG64_4_1
    SolutionIndex: 18
    SolutionNameMin: Cijk_Alik_Bjlk_HBHR_MT32x32x64_MI16x16x16x1_SN_1LDSB0_EPS0_GRVW4_IU1_LPA16_NLCB1_PGR2_PLR5_SU32_SUS256_SRVW4_TT1_16_WG32_8_1
    SolutionIndex: 19
    SolutionNameMin: Cijk_Alik_Bjlk_HBHR_MT64x64x64_MI32x32x8x1_SN_1LDSB0_EPS0_GRVW8_IU1_LPA8_NLCB1_PGR2_PLR9_SU0_SUS0_SRVW4_TT1_32_WG64_4_1
    SolutionIndex: 20
    SolutionNameMin: Cijk_Alik_Bjlk_HBHR_MT32x32x64_MI16x16x16x1_SN_1LDSB0_EPS0_GRVW4_IU1_LPA16_NLCB1_PGR2_PLR5_SU32_SUS128_SRVW4_TT1_16_WG32_8_1
    SolutionIndex: 21
    SolutionNameMin: Cijk_Alik_Bjlk_HBHR_MT64x32x64_MI16x16x16x1_SN_1LDSB0_EPS1_GRVW4_IU1_LPA16_NLCB1_PGR1_PLR5_SU32_SUS256_SRVW4_TT2_16_WG32_8_1
    SolutionIndex: 22
    SolutionNameMin: Cijk_Alik_Bjlk_HBHR_MT16x16x64_MI16x16x16x1_SN_1LDSB0_EPS0_GRVW4_IU1_LPA16_NLCB1_PGR2_PLR5_SU32_SUS128_SRVW4_TT1_16_WG16_4_1
    SolutionIndex: 23
    SolutionNameMin: Cijk_Alik_Bjlk_HBHR_MT4x64x32_MI4x4x4x16_SN_1LDSB0_EPS0_GRVW4_IU1_LPA8_NLCB1_PGR2_PLR9_SU0_SUS0_SRVW0_TT1_4_WG4_16_1
    SolutionIndex: 24
    SolutionNameMin: Cijk_Alik_Bjlk_HBHR_MT4x64x32_MI4x4x4x16_SN_1LDSB0_EPS1_GRVW4_IU2_LPA8_NLCB1_PGR1_PLR5_SU32_SUS256_SRVW0_TT1_4_WG4_16_1
    SolutionIndex: 25
    SolutionNameMin: Cijk_Alik_Bjlk_HBHR_MT128x64x64_MI32x32x8x1_SN_1LDSB1_EPS0_GRVW8_IU2_LPA8_NLCB1_PGR2_PLR5_SU0_SUS0_SRVW4_TT2_32_WG64_4_1
    SolutionIndex: 26
    SolutionNameMin: Cijk_Alik_Bjlk_HHS_BH_MT64x64x32_MI16x16x16x1_SN_AMAS3_GRVW2_LBSPP128_LPA4_SIA0_SU16_SUS64_SVW2_TLDS1_VW2_WSGRA0_WSGRB1
    SolutionIndex: 27
    SolutionNameMin: Cijk_Alik_Bjlk_HHS_BH_MT64x64x32_MI16x16x16x1_SN_AMAS3_GRVW2_LBSPP128_LPA4_SIA0_SU2_SUS64_SVW2_TLDS1_VW2_WSGRA0_WSGRB1
    SolutionIndex: 28
    SolutionNameMin: Cijk_Alik_Bjlk_HHS_BH_MT64x64x4_SN_AF0EM1_AMAS0_ASEM1_BL0_EPS0_GRVW1_ISA000_IU1_KLS_LBSPP0_LPA0_LDL1_LRVW1_FMA_PGR0_PLR1_SIA1_SS0_SU32_SUS256_SVW4_SNLL0_TT4_4_TLDS0_USFGRO0_VS1_VW1_WSGRB0_WG16_16_1_WGM8
    SolutionIndex: 29
    SolutionNameMin: Cijk_Alik_Bjlk_HHS_BH_MT64x64x8_SN_AF0EM1_AMAS0_ASEM1_BL0_EPS0_GRVW1_ISA000_IU1_KLS_LBSPP0_LPA0_LDL1_LRVW1_FMA_PGR0_PLR0_SIA1_SS0_SU32_SUS256_SVW4_SNLL0_TT4_4_TLDS0_USFGRO0_VS1_VW1_WSGRB0_WG16_16_1_WGM8
    SolutionIndex: 30
    SolutionNameMin: Cijk_Alik_Bjlk_HHS_BH_MT64x64x4_SN_AF0EM1_AMAS0_ASEM1_BL0_EPS0_GRVW1_ISA000_IU1_KLS_LBSPP0_LPA0_LDL1_LRVW1_FMA_PGR1_PLR1_SIA1_SS0_SU32_SUS256_SVW4_SNLL0_TT4_4_TLDS0_USFGRO0_VS1_VW1_WSGRB0_WG16_16_1_WGM8
    SolutionIndex: 31
    SolutionNameMin: Cijk_Alik_Bjlk_HHS_BH_MT64x64x4_SN_AF0EM1_AMAS0_ASEM1_BL0_EPS0_GRVW1_ISA000_IU1_KLS_LBSPP0_LPA0_LDL1_LRVW1_FMA_PGR0_PLR0_SIA1_SS0_SU32_SUS256_SVW4_SNLL0_TT4_4_TLDS0_USFGRO0_VS1_VW1_WSGRB0_WG16_16_1_WGM8
    SolutionIndex: 32
    SolutionNameMin: Cijk_Alik_Bjlk_HHS_BH_MT64x64x4_SN_AF0EM1_AMAS0_ASEM1_BL0_EPS0_GRVW1_ISA000_IU1_KLS_LBSPP0_LPA0_LDL1_LRVW1_FMA_PGR1_PLR0_SIA1_SS0_SU32_SUS256_SVW4_SNLL0_TT4_4_TLDS0_USFGRO0_VS1_VW1_WSGRB0_WG16_16_1_WGM8
- - - [1, 1, 1, 256]
    - [0, 0.00543305]
  - - [64, 448, 1, 3328]
    - [1, 3.657]
  - - [1, 64, 1, 1280]
    - [2, 0.005]
  - - [1, 2944, 1, 3328]
    - [3, 0.352]
  - - [64, 128, 1, 256]
    - [4, 0.188]
  - - [128, 64, 1, 1280]
    - [1, 0.671]
  - - [1, 2368, 1, 1280]
    - [2, 0.172]
  - - [1, 128, 1, 1]
    - [5, 0.0]
  - - [64, 1408, 1, 3328]
    - [6, 11.078]
  - - [64, 1024, 1, 3328]
    - [6, 8.11]
  - - [1, 64, 1, 3328]
    - [7, 0.008]
  - - [64, 448, 1, 1280]
    - [7, 2.223]
  - - [1, 256, 1, 1280]
    - [8, 0.019]
  - - [64, 64, 1, 1280]
    - [1, 0.325]
  - - [64, 5056, 1, 256]
    - [9, 6.667]
  - - [1, 1408, 1, 1280]
    - [3, 0.104]
  - - [1, 2368, 1, 3328]
    - [2, 0.289]
  - - [1, 64, 1, 1]
    - [5, 0.0]
  - - [1, 128, 1, 1280]
    - [2, 0.01]
  - - [64, 1856, 1, 256]
    - [8, 2.483]
  - - [64, 1024, 1, 1280]
    - [3, 5.054]
  - - [64, 256, 1, 1280]
    - [1, 1.327]
  - - [1, 1024, 1, 256]
    - [6, 0.022]
  - - [1, 704, 1, 3328]
    - [10, 0.089]
  - - [64, 2368, 1, 3328]
    - [9, 14.875]
  - - [64, 3584, 1, 1280]
    - [11, 14.076]
  - - [1, 256, 1, 1]
    - [12, 0.0]
  - - [1, 3584, 1, 1280]
    - [6, 0.261]
  - - [128, 64, 1, 256]
    - [13, 0.188]
  - - [64, 128, 1, 3328]
    - [1, 1.031]
  - - [64, 256, 1, 3328]
    - [6, 2.104]
  - - [1, 2944, 1, 1]
    - [14, 0.0]
  - - [1, 1408, 1, 3328]
    - [10, 0.171]
  - - [64, 2944, 1, 256]
    - [9, 3.91]
  - - [64, 1408, 1, 1280]
    - [15, 6.768]
  - - [64, 2368, 1, 1280]
    - [9, 10.071]
  - - [64, 3584, 1, 3328]
    - [11, 21.079]
  - - [1, 704, 1, 1]
    - [5, 0.0]
  - - [64, 6784, 1, 3328]
    - [16, 36.999]
  - - [1, 704, 1, 1280]
    - [17, 0.052]
  - - [1, 2944, 1, 256]
    - [6, 0.061]
  - - [64, 1856, 1, 3328]
    - [9, 12.005]
  - - [64, 448, 1, 256]
    - [18, 0.641]
  - - [1, 448, 1, 1280]
    - [15, 0.034]
  - - [64, 5056, 1, 3328]
    - [19, 28.548]
  - - [64, 128, 1, 1280]
    - [1, 0.649]
  - - [1, 5056, 1, 256]
    - [6, 0.104]
  - - [1, 1856, 1, 256]
    - [7, 0.039]
  - - [1, 1856, 1, 1280]
    - [6, 0.138]
  - - [256, 64, 1, 256]
    - [2, 0.372]
  - - [1, 4288, 1, 1280]
    - [6, 0.309]
  - - [1, 1408, 1, 1]
    - [12, 0.0]
  - - [64, 6784, 1, 1280]
    - [11, 25.247]
  - - [64, 1856, 1, 1280]
    - [9, 7.93]
  - - [64, 6784, 1, 256]
    - [9, 8.757]
  - - [64, 5056, 1, 1280]
    - [11, 19.363]
  - - [1, 448, 1, 3328]
    - [10, 0.056]
  - - [64, 4288, 1, 256]
    - [9, 5.82]
  - - [1, 1408, 1, 256]
    - [6, 0.029]
  - - [1, 2368, 1, 256]
    - [6, 0.049]
  - - [1, 4288, 1, 1]
    - [5, 0.0]
  - - [1, 128, 1, 256]
    - [13, 0.003]
  - - [64, 5888, 1, 3328]
    - [11, 33.012]
  - - [1, 1024, 1, 3328]
    - [8, 0.127]
  - - [1, 1856, 1, 3328]
    - [2, 0.23]
  - - [64, 1024, 1, 256]
    - [7, 1.537]
  - - [64, 256, 1, 256]
    - [17, 0.381]
  - - [1, 4288, 1, 3328]
    - [6, 0.512]
  - - [1, 1024, 1, 1280]
    - [8, 0.077]
  - - [1, 2368, 1, 1]
    - [2, 0.0]
  - - [1, 3584, 1, 3328]
    - [15, 0.424]
  - - [64, 704, 1, 256]
    - [15, 1.031]
  - - [64, 2944, 1, 3328]
    - [9, 18.255]
  - - [64, 64, 1, 256]
    - [2, 0.095]
  - - [1, 5056, 1, 1]
    - [5, 0.0]
  - - [128, 64, 1, 3328]
    - [1, 1.078]
  - - [1, 448, 1, 256]
    - [20, 0.009]
  - - [1, 3584, 1, 256]
    - [6, 0.075]
  - - [64, 4288, 1, 1280]
    - [11, 16.559]
  - - [1, 1024, 1, 1]
    - [5, 0.0]
  - - [64, 2944, 1, 1280]
    - [9, 12.351]
  - - [64, 5888, 1, 1280]
    - [11, 22.272]
  - - [64, 704, 1, 3328]
    - [7, 5.727]
  - - [1, 256, 1, 256]
    - [18, 0.005]
  - - [64, 1408, 1, 256]
    - [6, 2.03]
  - - [64, 2368, 1, 256]
    - [21, 3.057]
  - - [64, 3584, 1, 256]
    - [9, 4.794]
  - - [1, 5056, 1, 1280]
    - [3, 0.365]
  - - [1, 3584, 1, 1]
    - [5, 0.0]
  - - [1, 704, 1, 256]
    - [20, 0.015]
  - - [1, 128, 1, 3328]
    - [17, 0.016]
  - - [1, 2944, 1, 1280]
    - [2, 0.218]
  - - [64, 4288, 1, 3328]
    - [11, 24.499]
  - - [64, 64, 1, 3328]
    - [22, 0.524]
  - - [1, 448, 1, 1]
    - [23, 0.0]
  - - [1, 64, 1, 256]
    - [20, 0.001]
  - - [64, 5888, 1, 256]
    - [9, 7.876]
  - - [64, 704, 1, 1280]
    - [6, 3.512]
  - - [1, 1856, 1, 1]
    - [24, 0.0]
  - - [1, 256, 1, 3328]
    - [10, 0.032]
  - - [1, 4288, 1, 256]
    - [6, 0.09]
  - - [1024, 1024, 1, 1024]
    - [25, 29.362]
  - - [64, 160, 2048, 851]
    - [26, 32.011]
  - - [64, 160, 2048, 379]
    - [27, 29.627]
  - - [1024, 1, 1024, 8]
    - [28, 0.056]
  - - [122880, 1, 1, 96]
    - [28, 0.092]
  - - [2256, 1, 1, 96]
    - [29, 0.006]
  - - [20480, 1, 1, 96]
    - [30, 0.044]
  - - [235520, 1, 1, 96]
    - [31, 0.104]
  - - [10240, 1, 1, 96]
    - [32, 0.027]
  - - [70938, 1, 1, 96]
    - [28, 0.079]
  - - [70298, 1, 1, 96]
    - [31, 0.08]
  - - [512000, 1, 1, 96]
    - [31, 0.112]
  - - [1988, 1, 1, 96]
    - [31, 0.005]
  - - [2298, 1, 1, 96]
    - [28, 0.006]
  - - [61440, 1, 1, 96]
    - [31, 0.077]
- null
- null
- DeviceEfficiency
- Fp16AltImpl
