library/src/blas3/Tensile/Logic/asm_full/aldebaran/fp16altimpl/aldebaran_Cijk_Ailk_Bjlk_HHS_BHR.yaml
- {MinimumRequiredVersion: 4.31.0}
- aldebaran
- gfx90a
- [Device 7400, Device 7408, Device 740c]
    SolutionIndex: 0
    SolutionNameMin: Cijk_Ailk_Bjlk_HBHR_MT64x64x4_SN_
    SolutionIndex: 1
    SolutionNameMin: Cijk_Ailk_Bjlk_HBHR_MT32x32x64_MI16x16x16x1_SE_1LDSB0_AF0EM8_AF1EM1_EPS0_GRVW8_GSU1_GSUAMB_NLCA1_NLCB1_PGR2_SU0_SUS0_SRVW4_TT1_16_VAW2_WSGRA1_WSGRB1_WG32_8_1_WGM1
    SolutionIndex: 2
    SolutionNameMin: Cijk_Ailk_Bjlk_HBHR_MT64x64x64_MI32x32x8x1_SE_1LDSB0_AF0EM8_AF1EM1_EPS0_GRVW8_GSU1_GSUAMB_NLCA1_NLCB1_PGR2_SU0_SUS0_SRVW4_TT1_32_VAW2_WSGRA1_WSGRB1_WG64_4_1_WGM15
    SolutionIndex: 3
    SolutionNameMin: Cijk_Ailk_Bjlk_HBHR_MT64x16x32_MI16x16x16x1_SE_1LDSB0_AF0EM1_AF1EM1_EPS0_GRVW8_GSU1_GSUAMB_NLCA1_NLCB1_PGR2_SU0_SUS0_SRVW0_TT1_16_VAW2_WSGRA1_WSGRB1_WG64_4_1_WGM1
    SolutionIndex: 4
    SolutionNameMin: Cijk_Ailk_Bjlk_HBHR_MT64x64x32_MI32x32x8x1_SE_1LDSB0_AF0EM8_AF1EM1_EPS0_GRVW8_GSU1_GSUAMB_NLCA1_NLCB1_PGR2_SU0_SUS0_SRVW4_TT1_32_VAW2_WSGRA1_WSGRB1_WG64_4_1_WGM15
    SolutionIndex: 5
    SolutionNameMin: Cijk_Ailk_Bjlk_HBHR_MT32x32x64_MI16x16x16x1_SE_1LDSB0_AF0EM8_AF1EM1_EPS0_GRVW8_GSU1_GSUAMB_NLCA1_NLCB1_PGR2_SU0_SUS0_SRVW4_TT1_16_VAW2_WSGRA1_WSGRB1_WG32_8_1_WGM15
    SolutionIndex: 6
    SolutionNameMin: Cijk_Ailk_Bjlk_HBHR_MT64x64x64_MI32x32x8x1_SE_1LDSB0_AF0EM8_AF1EM1_EPS1_GRVW8_GSU7_GSUAMB_NLCA1_NLCB1_PGR1_SU0_SUS0_SRVW0_TT1_32_VAW1_WSGRA1_WSGRB1_WG64_4_1_WGM1
    SolutionIndex: 7
    SolutionNameMin: Cijk_Ailk_Bjlk_HBHR_MT32x32x64_MI16x16x16x1_SE_1LDSB0_AF0EM8_AF1EM1_EPS0_GRVW4_GSU1_GSUAMB_NLCA1_NLCB1_PGR2_SU0_SUS0_SRVW4_TT1_16_VAW2_WSGRA1_WSGRB1_WG32_8_1_WGM2
    SolutionIndex: 8
    SolutionNameMin: Cijk_Ailk_Bjlk_HBHR_MT32x64x64_MI16x16x16x1_SE_1LDSB0_AF0EM8_AF1EM1_EPS0_GRVW8_GSU1_GSUAMB_NLCA1_NLCB1_PGR2_SU0_SUS0_SRVW4_TT1_32_VAW2_WSGRA1_WSGRB1_WG32_8_1_WGM1
    SolutionIndex: 9
    SolutionNameMin: Cijk_Ailk_Bjlk_HBHR_MT32x32x64_MI16x16x16x1_SE_1LDSB0_AF0EM1_AF1EM1_EPS0_GRVW8_GSU1_GSUAMB_NLCA1_NLCB1_PGR2_SU0_SUS0_SRVW4_TT1_16_VAW2_WSGRA1_WSGRB1_WG32_8_1_WGM1
    SolutionIndex: 10
    SolutionNameMin: Cijk_Ailk_Bjlk_HBHR_MT64x64x64_MI32x32x8x1_SE_1LDSB0_AF0EM8_AF1EM1_EPS0_GRVW8_GSU1_GSUAMB_NLCA1_NLCB1_PGR2_SU0_SUS0_SRVW4_TT1_32_VAW2_WSGRA1_WSGRB1_WG64_4_1_WGM2
    SolutionIndex: 11
    SolutionNameMin: Cijk_Ailk_Bjlk_HBHR_MT64x16x64_MI16x16x16x1_SE_1LDSB0_AF0EM8_AF1EM1_EPS0_GRVW2_GSU7_GSUAMB_NLCA1_NLCB1_PGR2_SU0_SUS0_SRVW0_TT1_16_VAW1_WSGRA1_WSGRB1_WG64_4_1_WGM1
    SolutionIndex: 12
    SolutionNameMin: Cijk_Ailk_Bjlk_HBHR_MT32x32x64_MI16x16x16x1_SE_1LDSB0_AF0EM8_AF1EM1_EPS0_GRVW4_GSU1_GSUAMB_NLCA1_NLCB1_PGR2_SU32_SUS128_SRVW4_TT1_16_VAW2_WSGRA1_WSGRB1_WG32_8_1_WGM1
    SolutionIndex: 13
    SolutionNameMin: Cijk_Ailk_Bjlk_HBHR_MT64x64x32_MI32x32x8x1_SE_1LDSB0_AF0EM8_AF1EM1_EPS0_GRVW8_GSU1_GSUAMB_NLCA1_NLCB1_PGR2_SU0_SUS0_SRVW4_TT1_32_VAW2_WSGRA1_WSGRB1_WG64_4_1_WGM1
    SolutionIndex: 14
    SolutionNameMin: Cijk_Ailk_Bjlk_HBHR_MT64x64x32_MI32x32x8x1_SE_1LDSB0_AF0EM8_AF1EM1_EPS0_GRVW8_GSU1_GSUAMB_NLCA1_NLCB1_PGR2_SU32_SUS128_SRVW4_TT1_32_VAW2_WSGRA1_WSGRB1_WG64_4_1_WGM15
    SolutionIndex: 15
    SolutionNameMin: Cijk_Ailk_Bjlk_HBHR_MT32x32x32_MI16x16x16x1_SE_1LDSB0_AF0EM1_AF1EM1_EPS0_GRVW4_GSU1_GSUAMB_NLCA1_NLCB1_PGR2_SU0_SUS0_SRVW4_TT1_16_VAW2_WSGRA1_WSGRB1_WG32_8_1_WGM1
    SolutionIndex: 16
    SolutionNameMin: Cijk_Ailk_Bjlk_HBHR_MT64x64x32_MI32x32x8x1_SE_1LDSB0_AF0EM8_AF1EM1_EPS0_GRVW4_GSU1_GSUAMB_NLCA1_NLCB1_PGR2_SU0_SUS0_SRVW4_TT1_32_VAW2_WSGRA1_WSGRB1_WG64_4_1_WGM1
    SolutionIndex: 17
    SolutionNameMin: Cijk_Ailk_Bjlk_HBHR_MT32x32x32_MI16x16x16x1_SE_1LDSB0_AF0EM8_AF1EM1_EPS0_GRVW4_GSU1_GSUAMB_NLCA1_NLCB1_PGR2_SU0_SUS0_SRVW4_TT1_16_VAW2_WSGRA1_WSGRB1_WG32_8_1_WGM1
    SolutionIndex: 18
    SolutionNameMin: Cijk_Ailk_Bjlk_HBHR_MT16x16x32_MI16x16x16x1_SE_1LDSB0_AF0EM1_AF1EM1_EPS0_GRVW4_GSU1_GSUAMB_NLCA1_NLCB1_PGR2_SU32_SUS128_SRVW0_TT1_16_VAW2_WSGRA1_WSGRB1_WG16_4_1_WGM1
    SolutionIndex: 19
    SolutionNameMin: Cijk_Ailk_Bjlk_HBHR_MT64x16x64_MI16x16x16x1_SE_1LDSB0_AF0EM8_AF1EM1_EPS0_GRVW2_GSU7_GSUAMB_NLCA1_NLCB1_PGR2_SU32_SUS128_SRVW0_TT1_16_VAW1_WSGRA1_WSGRB1_WG64_4_1_WGM1
    SolutionIndex: 20
    SolutionNameMin: Cijk_Ailk_Bjlk_HBHR_MT64x16x64_MI16x16x16x1_SE_1LDSB0_AF0EM8_AF1EM1_EPS0_GRVW2_GSU7_GSUAMB_NLCA1_NLCB1_PGR2_SU32_SUS256_SRVW4_TT1_16_VAW1_WSGRA1_WSGRB1_WG64_4_1_WGM1
    SolutionIndex: 21
    SolutionNameMin: Cijk_Ailk_Bjlk_HBHR_MT128x128x32_MI32x32x8x1_SE_1LDSB0_AF0EM8_AF1EM1_EPS0_GRVW8_GSU1_GSUAMB_NLCA1_NLCB1_PGR2_SU0_SUS0_SRVW4_TT2_64_VAW2_WSGRA1_WSGRB1_WG64_4_1_WGM1
    SolutionIndex: 22
    SolutionNameMin: Cijk_Ailk_Bjlk_HBHR_MT128x192x16_MI32x32x8x1_SE_1LDSB0_AF0EM8_AF1EM1_EPS0_GRVW4_GSU1_GSUAMB_NLCA1_NLCB3_PGR2_SU0_SUS0_SRVW4_TT2_96_VAW2_WSGRA1_WSGRB1_WG64_4_1_WGM15
    SolutionIndex: 23
    SolutionNameMin: Cijk_Ailk_Bjlk_HBHR_MT128x128x16_MI32x32x8x1_SE_1LDSB0_AF0EM8_AF1EM1_EPS0_GRVW8_GSU1_GSUAMB_NLCA1_NLCB1_PGR2_SU0_SUS0_SRVW4_TT2_64_VAW2_WSGRA1_WSGRB1_WG64_4_1_WGM2
    SolutionIndex: 24
    SolutionNameMin: Cijk_Ailk_Bjlk_HBHR_MT128x256x16_MI32x32x8x1_SE_1LDSB0_AF0EM8_AF1EM1_EPS0_GRVW8_GSU1_GSUAMB_NLCA1_NLCB1_PGR2_SU0_SUS0_SRVW4_TT2_128_VAW2_WSGRA1_WSGRB1_WG64_4_1_WGM1
    SolutionIndex: 25
    SolutionNameMin: Cijk_Ailk_Bjlk_HBHR_MT128x64x16_MI32x32x8x1_SE_1LDSB0_AF0EM8_AF1EM1_EPS0_GRVW8_GSU1_GSUAMB_NLCA1_NLCB1_PGR2_SU32_SUS128_SRVW4_TT2_32_VAW2_WSGRA1_WSGRB1_WG64_4_1_WGM1
    SolutionIndex: 26
    SolutionNameMin: Cijk_Ailk_Bjlk_HBHR_MT128x128x16_MI32x32x8x1_SE_1LDSB0_AF0EM8_AF1EM1_EPS0_GRVW8_GSU1_GSUAMB_NLCA1_NLCB1_PGR2_SU32_SUS256_SRVW4_TT2_64_VAW2_WSGRA1_WSGRB1_WG64_4_1_WGM2
    SolutionIndex: 27
    SolutionNameMin: Cijk_Ailk_Bjlk_HBHR_MT64x64x32_MI32x32x8x1_SE_1LDSB0_AF0EM8_AF1EM1_EPS0_GRVW8_GSU1_GSUAMB_NLCA1_NLCB1_PGR2_SU32_SUS128_SRVW4_TT1_32_VAW2_WSGRA1_WSGRB1_WG64_4_1_WGM1
    SolutionIndex: 28
    SolutionNameMin: Cijk_Ailk_Bjlk_HBHR_MT128x128x32_MI32x32x8x1_SE_1LDSB0_AF0EM1_AF1EM1_EPS0_GRVW8_GSU1_GSUAMB_NLCA1_NLCB1_PGR2_SU0_SUS0_SRVW4_TT2_64_VAW2_WSGRA1_WSGRB1_WG64_4_1_WGM15
    SolutionIndex: 29
    SolutionNameMin: Cijk_Ailk_Bjlk_HBHR_MT64x128x16_MI32x32x8x1_SE_1LDSB0_AF0EM1_AF1EM1_EPS0_GRVW4_GSU1_GSUAMB_NLCA1_NLCB1_PGR2_SU0_SUS0_SRVW4_TT1_64_VAW2_WSGRA1_WSGRB1_WG64_4_1_WGM15
    SolutionIndex: 30
    SolutionNameMin: Cijk_Ailk_Bjlk_HBHR_MT64x128x16_MI32x32x8x1_SE_1LDSB0_AF0EM1_AF1EM1_EPS0_GRVW8_GSU1_GSUAMB_NLCA1_NLCB1_PGR2_SU0_SUS0_SRVW4_TT1_64_VAW2_WSGRA1_WSGRB1_WG64_4_1_WGM1
    SolutionIndex: 31
    SolutionNameMin: Cijk_Ailk_Bjlk_HBHR_MT128x128x32_MI32x32x8x1_SE_1LDSB0_AF0EM8_AF1EM1_EPS1_GRVW8_GSU1_GSUAMB_NLCA1_NLCB1_PGR1_SU0_SUS0_SRVW4_TT2_64_VAW2_WSGRA1_WSGRB1_WG64_4_1_WGM1
    SolutionIndex: 32
    SolutionNameMin: Cijk_Ailk_Bjlk_HBHR_MT128x64x16_MI32x32x8x1_SE_1LDSB0_AF0EM8_AF1EM1_EPS0_GRVW4_GSU1_GSUAMB_NLCA1_NLCB1_PGR2_SU0_SUS0_SRVW4_TT2_32_VAW2_WSGRA1_WSGRB1_WG64_4_1_WGM15
    SolutionIndex: 33
    SolutionNameMin: Cijk_Ailk_Bjlk_HBHR_MT128x64x16_MI32x32x8x1_SE_1LDSB0_AF0EM8_AF1EM1_EPS0_GRVW4_GSU1_GSUAMB_NLCA1_NLCB1_PGR2_SU0_SUS0_SRVW4_TT2_32_VAW2_WSGRA1_WSGRB1_WG64_4_1_WGM2
    SolutionIndex: 34
    SolutionNameMin: Cijk_Ailk_Bjlk_HBHR_MT128x128x16_MI32x32x8x1_SE_1LDSB0_AF0EM8_AF1EM1_EPS0_GRVW4_GSU1_GSUAMB_NLCA1_NLCB1_PGR2_SU0_SUS0_SRVW4_TT2_64_VAW2_WSGRA1_WSGRB1_WG64_4_1_WGM1
    SolutionIndex: 35
    SolutionNameMin: Cijk_Ailk_Bjlk_HBHR_MT128x128x16_MI32x32x8x1_SE_1LDSB0_AF0EM8_AF1EM1_EPS0_GRVW8_GSU1_GSUAMB_NLCA1_NLCB1_PGR2_SU0_SUS0_SRVW4_TT2_64_VAW2_WSGRA1_WSGRB1_WG64_4_1_WGM1
    SolutionIndex: 36
    SolutionNameMin: Cijk_Ailk_Bjlk_HBHR_MT64x64x32_MI32x32x8x1_SE_1LDSB0_AF0EM8_AF1EM1_EPS0_GRVW8_GSU1_GSUAMB_NLCA1_NLCB1_PGR2_SU32_SUS128_SRVW4_TT1_32_VAW2_WSGRA1_WSGRB1_WG64_4_1_WGM2
    SolutionIndex: 37
    SolutionNameMin: Cijk_Ailk_Bjlk_HBHR_MT32x32x16_MI16x16x16x1_SE_AF0EM1_GRVW2_SU0_SUS256_SRVW4_TT1_16_WG32_8_1_WGM1
    SolutionIndex: 38
    SolutionNameMin: Cijk_Ailk_Bjlk_HBHR_MT16x16x16_MI16x16x16x1_SE_1LDSB0_AF0EM1_AF1EM1_EPS1_GRVW2_GSU1_GSUAMB_NLCA1_NLCB1_PGR1_SU0_SUS0_SRVW0_TT1_16_VAW2_WSGRA1_WSGRB1_WG16_4_1_WGM1
    SolutionIndex: 39
    SolutionNameMin: Cijk_Ailk_Bjlk_HBHR_MT32x32x16_MI16x16x16x1_SE_AF0EM1_GRVW2_SU32_SUS256_SRVW4_TT1_16_WG32_8_1_WGM1
    SolutionIndex: 40
    SolutionNameMin: Cijk_Ailk_Bjlk_HBHR_MT16x16x16_MI16x16x16x1_SE_1LDSB0_AF0EM1_AF1EM1_EPS1_GRVW2_GSU1_GSUAMB_NLCA1_NLCB1_PGR1_SU32_SUS128_SRVW0_TT1_16_VAW2_WSGRA1_WSGRB1_WG16_4_1_WGM15
    SolutionIndex: 41
    SolutionNameMin: Cijk_Ailk_Bjlk_HBHR_MT16x16x16_MI16x16x16x1_SE_1LDSB0_AF0EM8_AF1EM1_EPS1_GRVW2_GSU1_GSUAMB_NLCA1_NLCB1_PGR1_SU0_SUS0_SRVW0_TT1_16_VAW2_WSGRA1_WSGRB1_WG16_4_1_WGM1
    SolutionIndex: 42
    SolutionNameMin: Cijk_Ailk_Bjlk_HBHR_MT16x16x16_MI16x16x16x1_SE_1LDSB0_AF0EM1_AF1EM1_EPS1_GRVW4_GSU1_GSUAMB_NLCA1_NLCB1_PGR1_SU0_SUS0_SRVW0_TT1_16_VAW2_WSGRA1_WSGRB1_WG16_4_1_WGM1
    SolutionIndex: 43
    SolutionNameMin: Cijk_Ailk_Bjlk_HBHR_MT16x16x16_MI16x16x16x1_SE_1LDSB0_AF0EM1_AF1EM1_EPS1_GRVW2_GSU1_GSUAMB_NLCA1_NLCB1_PGR1_SU0_SUS0_SRVW4_TT1_16_VAW2_WSGRA1_WSGRB1_WG16_4_1_WGM1
    SolutionIndex: 44
    SolutionNameMin: Cijk_Ailk_Bjlk_HBHR_MT16x16x16_MI16x16x16x1_SE_1LDSB0_AF0EM8_AF1EM1_EPS0_GRVW2_GSU1_GSUAMB_NLCA1_NLCB1_PGR2_SU0_SUS0_SRVW0_TT1_16_VAW2_WSGRA1_WSGRB1_WG16_4_1_WGM1
    SolutionIndex: 45
    SolutionNameMin: Cijk_Ailk_Bjlk_HBHR_MT16x16x32_MI16x16x16x1_SE_1LDSB0_AF0EM1_AF1EM1_EPS0_GRVW8_GSU1_GSUAMB_NLCA1_NLCB1_PGR2_SU0_SUS0_SRVW0_TT1_16_VAW2_WSGRA1_WSGRB1_WG16_4_1_WGM1
    SolutionIndex: 46
    SolutionNameMin: Cijk_Ailk_Bjlk_HBHR_MT32x32x16_MI16x16x16x1_SE_1LDSB0_AF0EM8_AF1EM1_EPS1_GRVW2_GSU1_GSUAMB_NLCA1_NLCB1_PGR1_SU0_SUS0_SRVW4_TT1_16_VAW2_WSGRA1_WSGRB1_WG32_8_1_WGM1
    SolutionIndex: 47
    SolutionNameMin: Cijk_Ailk_Bjlk_HBHR_MT16x64x32_MI16x16x16x1_SE_AF0EM8_GRVW8_SU0_SUS256_SRVW0_TT1_16_WG16_16_1_WGM2
    SolutionIndex: 48
    SolutionNameMin: Cijk_Ailk_Bjlk_HBHR_MT32x32x16_MI16x16x16x1_SE_AF0EM8_GRVW2_SU0_SUS256_SRVW4_TT1_16_WG32_8_1_WGM1
    SolutionIndex: 49
    SolutionNameMin: Cijk_Ailk_Bjlk_HBHR_MT64x128x16_MI32x32x8x1_SE_1LDSB0_AF0EM8_AF1EM1_EPS0_GRVW2_GSU1_GSUAMB_NLCA1_NLCB1_PGR2_SU32_SUS128_SRVW4_TT1_64_VAW2_WSGRA1_WSGRB1_WG64_4_1_WGM1
    SolutionIndex: 50
    SolutionNameMin: Cijk_Ailk_Bjlk_HBHR_MT64x128x16_MI32x32x8x1_SE_1LDSB0_AF0EM8_AF1EM1_EPS0_GRVW8_GSU1_GSUAMB_NLCA1_NLCB1_PGR2_SU32_SUS256_SRVW4_TT1_64_VAW2_WSGRA1_WSGRB1_WG64_4_1_WGM1
    SolutionIndex: 51
    SolutionNameMin: Cijk_Ailk_Bjlk_HBHR_MT128x64x16_MI32x32x8x1_SE_1LDSB0_AF0EM8_AF1EM1_EPS0_GRVW2_GSU1_GSUAMB_NLCA1_NLCB1_PGR2_SU32_SUS256_SRVW4_TT2_32_VAW2_WSGRA1_WSGRB1_WG64_4_1_WGM15
    SolutionIndex: 52
    SolutionNameMin: Cijk_Ailk_Bjlk_HBHR_MT16x64x32_MI16x16x16x1_SE_1LDSB0_AF0EM8_AF1EM1_EPS1_GRVW2_GSU1_GSUAMB_NLCA1_NLCB1_PGR1_SU0_SUS0_SRVW0_TT1_16_VAW2_WSGRA1_WSGRB1_WG16_16_1_WGM1
    SolutionIndex: 53
    SolutionNameMin: Cijk_Ailk_Bjlk_HBHR_MT32x32x32_MI16x16x16x1_SE_1LDSB0_AF0EM1_AF1EM1_EPS0_GRVW2_GSU1_GSUAMB_NLCA1_NLCB1_PGR2_SU0_SUS0_SRVW4_TT1_16_VAW2_WSGRA1_WSGRB1_WG32_8_1_WGM1
    SolutionIndex: 54
    SolutionNameMin: Cijk_Ailk_Bjlk_HBHR_MT64x32x16_MI16x16x16x1_SE_1LDSB0_AF0EM1_AF1EM1_EPS0_GRVW2_GSU1_GSUAMB_NLCA1_NLCB1_PGR2_SU0_SUS0_SRVW4_TT2_16_VAW2_WSGRA1_WSGRB1_WG32_8_1_WGM1
    SolutionIndex: 55
    SolutionNameMin: Cijk_Ailk_Bjlk_HBHR_MT64x32x16_MI16x16x16x1_SE_1LDSB0_AF0EM8_AF1EM1_EPS0_GRVW4_GSU1_GSUAMB_NLCA1_NLCB1_PGR2_SU0_SUS0_SRVW4_TT2_16_VAW2_WSGRA1_WSGRB1_WG32_8_1_WGM1
    SolutionIndex: 56
    SolutionNameMin: Cijk_Ailk_Bjlk_HBHR_MT128x96x32_MI32x32x8x1_SE_1LDSB0_AF0EM8_AF1EM1_EPS0_GRVW4_GSU1_GSUAMB_NLCA1_NLCB3_PGR2_SU0_SUS0_SRVW4_TT1_96_VAW2_WSGRA1_WSGRB1_WG128_2_1_WGM2
    SolutionIndex: 57
    SolutionNameMin: Cijk_Ailk_Bjlk_HBHR_MT128x96x64_MI32x32x8x1_SE_1LDSB0_AF0EM8_AF1EM1_EPS0_GRVW4_GSU1_GSUAMB_NLCA1_NLCB3_PGR2_SU0_SUS0_SRVW4_TT1_96_VAW2_WSGRA1_WSGRB1_WG128_2_1_WGM2
    SolutionIndex: 58
    SolutionNameMin: Cijk_Ailk_Bjlk_HBHR_MT256x160x32_MI32x32x8x1_SE_1LDSB0_AF0EM8_AF1EM1_EPS1_GRVW4_GSU1_GSUAMB_NLCA1_NLCB5_PGR1_SU0_SUS0_SRVW4_TT2_160_VAW2_WSGRA1_WSGRB1_WG128_2_1_WGM15
    SolutionIndex: 59
    SolutionNameMin: Cijk_Ailk_Bjlk_HBHR_MT128x256x16_MI32x32x8x1_SE_1LDSB1_AF0EM8_AF1EM1_EPS0_GRVW8_GSU1_GSUAMB_NLCA1_NLCB1_PGR2_SU0_SUS0_SRVW4_TT2_128_VAW2_WSGRA1_WSGRB1_WG64_4_1_WGM1
    SolutionIndex: 60
    SolutionNameMin: Cijk_Ailk_Bjlk_HBHR_MT128x128x32_MI32x32x8x1_SE_1LDSB0_AF0EM8_AF1EM1_EPS0_GRVW4_GSU1_GSUAMB_NLCA1_NLCB1_PGR2_SU0_SUS0_SRVW4_TT2_64_VAW2_WSGRA1_WSGRB1_WG64_4_1_WGM1
    SolutionIndex: 61
    SolutionNameMin: Cijk_Ailk_Bjlk_HBHR_MT160x256x32_MI32x32x8x1_SE_1LDSB0_AF0EM8_AF1EM1_EPS1_GRVW4_GSU1_GSUAMB_NLCA5_NLCB1_PGR1_SU32_SUS128_SRVW0_TT5_64_VAW2_WSGRA1_WSGRB1_WG32_8_1_WGM1
    SolutionIndex: 62
    SolutionNameMin: Cijk_Ailk_Bjlk_HBHR_MT16x64x64_MI16x16x16x1_SE_1LDSB0_AF0EM1_AF1EM1_EPS0_GRVW8_GSU15_GSUAMB_NLCA1_NLCB1_PGR2_SU32_SUS256_SRVW0_TT1_16_VAW1_WSGRA1_WSGRB1_WG16_16_1_WGM1
    SolutionIndex: 63
    SolutionNameMin: Cijk_Ailk_Bjlk_HBHR_MT32x64x16_MI16x16x16x1_SE_1LDSB0_AF0EM1_AF1EM1_EPS1_GRVW2_GSU1_GSUAMB_NLCA1_NLCB1_PGR1_SU32_SUS128_SRVW4_TT1_32_VAW2_WSGRA1_WSGRB1_WG32_8_1_WGM2
    SolutionIndex: 64
    SolutionNameMin: Cijk_Ailk_Bjlk_HBHR_MT32x32x16_MI16x16x16x1_SE_1LDSB0_AF0EM1_AF1EM1_EPS0_GRVW4_GSU1_GSUAMB_NLCA1_NLCB1_PGR2_SU0_SUS0_SRVW4_TT1_16_VAW2_WSGRA1_WSGRB1_WG32_8_1_WGM1
    SolutionIndex: 65
    SolutionNameMin: Cijk_Ailk_Bjlk_HBHR_MT64x64x32_MI32x32x8x1_SE_1LDSB0_AF0EM8_AF1EM1_EPS0_GRVW8_GSU15_GSUAMB_NLCA1_NLCB1_PGR2_SU0_SUS0_SRVW4_TT1_32_VAW1_WSGRA1_WSGRB1_WG64_4_1_WGM15
    SolutionIndex: 66
    SolutionNameMin: Cijk_Ailk_Bjlk_HBHR_MT64x128x32_MI32x32x8x1_SE_1LDSB0_AF0EM8_AF1EM1_EPS0_GRVW4_GSU7_GSUAMB_NLCA1_NLCB1_PGR2_SU32_SUS256_SRVW4_TT1_64_VAW1_WSGRA1_WSGRB1_WG64_4_1_WGM2
    SolutionIndex: 67
    SolutionNameMin: Cijk_Ailk_Bjlk_HBHR_MT128x256x16_MI32x32x8x1_SE_1LDSB0_AF0EM8_AF1EM1_EPS0_GRVW4_GSU5_GSUAMB_NLCA1_NLCB1_PGR2_SU0_SUS0_SRVW4_TT2_128_VAW1_WSGRA1_WSGRB1_WG64_4_1_WGM15
    SolutionIndex: 68
    SolutionNameMin: Cijk_Ailk_Bjlk_HBHR_MT128x128x32_MI32x32x8x1_SE_1LDSB0_AF0EM8_AF1EM1_EPS0_GRVW4_GSU2_GSUAMB_NLCA1_NLCB1_PGR2_SU0_SUS0_SRVW4_TT2_64_VAW1_WSGRA1_WSGRB1_WG64_4_1_WGM15
    SolutionIndex: 69
    SolutionNameMin: Cijk_Ailk_Bjlk_HBHR_MT128x160x32_MI32x32x8x1_SE_1LDSB0_AF0EM8_AF1EM1_EPS0_GRVW4_GSU2_GSUAMB_NLCA1_NLCB5_PGR2_SU0_SUS0_SRVW4_TT1_160_VAW1_WSGRA1_WSGRB1_WG128_2_1_WGM2
    SolutionIndex: 70
    SolutionNameMin: Cijk_Ailk_Bjlk_HBHR_MT128x256x16_MI32x32x8x1_SE_1LDSB0_AF0EM8_AF1EM1_EPS0_GRVW4_GSU3_GSUAMB_NLCA1_NLCB1_PGR2_SU0_SUS0_SRVW4_TT2_128_VAW1_WSGRA1_WSGRB1_WG64_4_1_WGM2
    SolutionIndex: 71
    SolutionNameMin: Cijk_Ailk_Bjlk_HBHR_MT128x160x32_MI32x32x8x1_SE_1LDSB0_AF0EM8_AF1EM1_EPS0_GRVW4_GSU1_GSUAMB_NLCA1_NLCB5_PGR2_SU0_SUS0_SRVW4_TT1_160_VAW2_WSGRA1_WSGRB1_WG128_2_1_WGM2
    SolutionIndex: 72
    SolutionNameMin: Cijk_Ailk_Bjlk_HBHR_MT128x160x32_MI32x32x8x1_SE_1LDSB0_AF0EM8_AF1EM1_EPS0_GRVW4_GSU1_GSUAMB_NLCA1_NLCB5_PGR2_SU0_SUS0_SRVW4_TT1_160_VAW2_WSGRA1_WSGRB1_WG128_2_1_WGM15
    SolutionIndex: 73
    SolutionNameMin: Cijk_Ailk_Bjlk_HBHR_MT128x192x32_MI32x32x8x1_SE_1LDSB0_AF0EM8_AF1EM1_EPS0_GRVW4_GSU1_GSUAMB_NLCA1_NLCB3_PGR2_SU0_SUS0_SRVW4_TT2_96_VAW2_WSGRA1_WSGRB1_WG64_4_1_WGM2
    SolutionIndex: 74
    SolutionNameMin: Cijk_Ailk_Bjlk_HBHR_MT128x256x16_MI32x32x8x1_SE_1LDSB1_AF0EM8_AF1EM1_EPS0_GRVW8_GSU1_GSUAMB_NLCA1_NLCB1_PGR2_SU0_SUS0_SRVW4_TT2_128_VAW2_WSGRA1_WSGRB1_WG64_4_1_WGM2
    SolutionIndex: 75
    SolutionNameMin: Cijk_Ailk_Bjlk_HBHR_MT128x256x16_MI32x32x8x1_SE_1LDSB0_AF0EM1_AF1EM1_EPS0_GRVW8_GSU1_GSUAMB_NLCA1_NLCB1_PGR2_SU0_SUS0_SRVW4_TT2_128_VAW2_WSGRA1_WSGRB1_WG64_4_1_WGM1
    SolutionIndex: 76
    SolutionNameMin: Cijk_Ailk_Bjlk_HBHR_MT128x288x32_MI32x32x8x1_SE_1LDSB0_AF0EM8_AF1EM1_EPS0_GRVW4_GSU1_GSUAMB_NLCA1_NLCB9_PGR2_SU0_SUS0_SRVW4_TT1_288_VAW2_WSGRA1_WSGRB1_WG128_2_1_WGM15
    SolutionIndex: 77
    SolutionNameMin: Cijk_Ailk_Bjlk_HBHR_MT128x288x32_MI32x32x8x1_SE_1LDSB0_AF0EM8_AF1EM1_EPS0_GRVW2_GSU1_GSUAMB_NLCA1_NLCB9_PGR2_SU0_SUS0_SRVW4_TT1_288_VAW2_WSGRA1_WSGRB1_WG128_2_1_WGM15
    SolutionIndex: 78
    SolutionNameMin: Cijk_Ailk_Bjlk_HBHR_MT128x288x32_MI32x32x8x1_SE_1LDSB0_AF0EM8_AF1EM1_EPS1_GRVW4_GSU1_GSUAMB_NLCA1_NLCB9_PGR1_SU0_SUS0_SRVW4_TT1_288_VAW2_WSGRA1_WSGRB1_WG128_2_1_WGM1
    SolutionIndex: 79
    SolutionNameMin: Cijk_Ailk_Bjlk_HBHR_MT256x160x32_MI32x32x8x1_SE_1LDSB0_AF0EM8_AF1EM1_EPS0_GRVW2_GSU1_GSUAMB_NLCA2_NLCB5_PGR2_SU0_SUS0_SRVW4_TT2_160_VAW2_WSGRA1_WSGRB1_WG128_2_1_WGM15
    SolutionIndex: 80
    SolutionNameMin: Cijk_Ailk_Bjlk_HBHR_MT256x160x32_MI32x32x8x1_SE_1LDSB0_AF0EM8_AF1EM1_EPS1_GRVW4_GSU1_GSUAMB_NLCA1_NLCB5_PGR1_SU0_SUS0_SRVW4_TT2_160_VAW2_WSGRA1_WSGRB1_WG128_2_1_WGM2
    SolutionIndex: 81
    SolutionNameMin: Cijk_Ailk_Bjlk_HBHR_MT128x128x32_MI32x32x8x1_SE_1LDSB0_AF0EM1_AF1EM1_EPS0_GRVW4_GSU1_GSUAMB_NLCA1_NLCB1_PGR2_SU0_SUS0_SRVW4_TT2_64_VAW2_WSGRA1_WSGRB1_WG64_4_1_WGM2
    SolutionIndex: 82
    SolutionNameMin: Cijk_Ailk_Bjlk_HBHR_MT128x256x16_MI32x32x8x1_SE_1LDSB1_AF0EM1_AF1EM1_EPS0_GRVW8_GSU1_GSUAMB_NLCA1_NLCB1_PGR2_SU0_SUS0_SRVW4_TT2_128_VAW2_WSGRA1_WSGRB1_WG64_4_1_WGM1
    SolutionIndex: 83
    SolutionNameMin: Cijk_Ailk_Bjlk_HBHR_MT128x256x16_MI32x32x8x1_SE_1LDSB0_AF0EM8_AF1EM1_EPS0_GRVW4_GSU1_GSUAMB_NLCA1_NLCB1_PGR2_SU0_SUS0_SRVW4_TT2_128_VAW2_WSGRA1_WSGRB1_WG64_4_1_WGM15
    SolutionIndex: 84
    SolutionNameMin: Cijk_Ailk_Bjlk_HBHR_MT128x256x16_MI32x32x8x1_SE_1LDSB0_AF0EM1_AF1EM1_EPS0_GRVW8_GSU1_GSUAMB_NLCA1_NLCB1_PGR2_SU0_SUS0_SRVW4_TT2_128_VAW2_WSGRA1_WSGRB1_WG64_4_1_WGM15
    SolutionIndex: 85
    SolutionNameMin: Cijk_Ailk_Bjlk_HBHR_MT128x128x32_MI32x32x8x1_SE_1LDSB0_AF0EM1_AF1EM1_EPS0_GRVW4_GSU1_GSUAMB_NLCA1_NLCB1_PGR2_SU0_SUS0_SRVW4_TT2_64_VAW2_WSGRA1_WSGRB1_WG64_4_1_WGM1
    SolutionIndex: 86
    SolutionNameMin: Cijk_Ailk_Bjlk_HBHR_MT64x32x16_MI16x16x16x1_SE_1LDSB0_AF0EM8_AF1EM1_EPS1_GRVW8_GSU1_GSUAMB_NLCA1_NLCB1_PGR1_SU32_SUS128_SRVW4_TT2_16_VAW2_WSGRA1_WSGRB1_WG32_8_1_WGM2
    SolutionIndex: 87
    SolutionNameMin: Cijk_Ailk_Bjlk_HBHR_MT128x128x32_MI32x32x8x1_SE_1LDSB0_AF0EM1_AF1EM1_EPS0_GRVW8_GSU1_GSUAMB_NLCA1_NLCB1_PGR2_SU0_SUS0_SRVW4_TT2_64_VAW2_WSGRA1_WSGRB1_WG64_4_1_WGM2
    SolutionIndex: 88
    SolutionNameMin: Cijk_Ailk_Bjlk_HBHR_MT128x288x16_MI32x32x8x1_SE_1LDSB0_AF0EM8_AF1EM1_EPS0_GRVW2_GSU1_GSUAMB_NLCA1_NLCB9_PGR2_SU0_SUS0_SRVW4_TT1_288_VAW2_WSGRA1_WSGRB1_WG128_2_1_WGM15
    SolutionIndex: 89
    SolutionNameMin: Cijk_Ailk_Bjlk_HBHR_MT64x64x32_MI32x32x8x1_SE_1LDSB0_AF0EM1_AF1EM1_EPS0_GRVW8_GSU1_GSUAMB_NLCA1_NLCB1_PGR2_SU0_SUS0_SRVW4_TT1_32_VAW2_WSGRA1_WSGRB1_WG64_4_1_WGM1
    SolutionIndex: 90
    SolutionNameMin: Cijk_Ailk_Bjlk_HBHR_MT128x128x32_MI32x32x8x1_SE_1LDSB0_AF0EM8_AF1EM1_EPS0_GRVW8_GSU3_GSUAMB_NLCA1_NLCB1_PGR2_SU0_SUS0_SRVW4_TT2_64_VAW1_WSGRA1_WSGRB1_WG64_4_1_WGM1
    SolutionIndex: 91
    SolutionNameMin: Cijk_Ailk_Bjlk_HBHR_MT128x64x64_MI32x32x8x1_SE_1LDSB0_AF0EM8_AF1EM1_EPS1_GRVW8_GSU5_GSUAMB_NLCA1_NLCB1_PGR1_SU0_SUS0_SRVW0_TT2_32_VAW1_WSGRA1_WSGRB1_WG64_4_1_WGM2
    SolutionIndex: 92
    SolutionNameMin: Cijk_Ailk_Bjlk_HBHR_MT32x32x32_MI16x16x16x1_SE_1LDSB0_AF0EM8_AF1EM1_EPS1_GRVW2_GSU1_GSUAMB_NLCA1_NLCB1_PGR1_SU0_SUS0_SRVW4_TT1_16_VAW2_WSGRA1_WSGRB1_WG32_8_1_WGM1
    SolutionIndex: 93
    SolutionNameMin: Cijk_Ailk_Bjlk_HBHR_MT128x64x16_MI32x32x8x1_SE_1LDSB0_AF0EM8_AF1EM1_EPS0_GRVW4_GSU1_GSUAMB_NLCA1_NLCB1_PGR2_SU0_SUS0_SRVW4_TT2_32_VAW2_WSGRA1_WSGRB1_WG64_4_1_WGM1
    SolutionIndex: 94
    SolutionNameMin: Cijk_Ailk_Bjlk_HBHR_MT64x64x64_MI32x32x8x1_SE_1LDSB0_AF0EM8_AF1EM1_EPS1_GRVW8_GSU3_GSUAMB_NLCA1_NLCB1_PGR1_SU0_SUS0_SRVW0_TT1_32_VAW1_WSGRA1_WSGRB1_WG64_4_1_WGM1
    SolutionIndex: 95
    SolutionNameMin: Cijk_Ailk_Bjlk_HBHR_MT64x64x64_MI32x32x8x1_SE_1LDSB0_AF0EM8_AF1EM1_EPS1_GRVW8_GSU3_GSUAMB_NLCA1_NLCB1_PGR1_SU0_SUS0_SRVW0_TT1_32_VAW1_WSGRA1_WSGRB1_WG64_4_1_WGM2
    SolutionIndex: 96
    SolutionNameMin: Cijk_Ailk_Bjlk_HBHR_MT64x128x64_MI32x32x8x1_SE_1LDSB0_AF0EM8_AF1EM1_EPS1_GRVW8_GSU3_GSUAMB_NLCA1_NLCB1_PGR1_SU32_SUS128_SRVW0_TT1_64_VAW1_WSGRA1_WSGRB1_WG64_4_1_WGM2
    SolutionIndex: 97
    SolutionNameMin: Cijk_Ailk_Bjlk_HBHR_MT128x64x64_MI32x32x8x1_SE_1LDSB0_AF0EM8_AF1EM1_EPS1_GRVW8_GSU3_GSUAMB_NLCA1_NLCB1_PGR1_SU0_SUS0_SRVW0_TT2_32_VAW1_WSGRA1_WSGRB1_WG64_4_1_WGM1
    SolutionIndex: 98
    SolutionNameMin: Cijk_Ailk_Bjlk_HBHR_MT128x128x64_MI32x32x8x1_SE_1LDSB0_AF0EM8_AF1EM1_EPS0_GRVW8_GSU15_GSUAMB_NLCA1_NLCB1_PGR2_SU0_SUS0_SRVW4_TT2_64_VAW1_WSGRA1_WSGRB1_WG64_4_1_WGM2
    SolutionIndex: 99
    SolutionNameMin: Cijk_Ailk_Bjlk_HBHR_MT128x128x32_MI32x32x8x1_SE_1LDSB0_AF0EM8_AF1EM1_EPS0_GRVW4_GSU3_GSUAMB_NLCA1_NLCB1_PGR2_SU0_SUS0_SRVW4_TT2_64_VAW1_WSGRA1_WSGRB1_WG64_4_1_WGM15
    SolutionIndex: 100
    SolutionNameMin: Cijk_Ailk_Bjlk_HBHR_MT64x64x16_MI32x32x8x1_SE_1LDSB0_AF0EM8_AF1EM1_EPS0_GRVW2_GSU1_GSUAMB_NLCA1_NLCB1_PGR2_SU32_SUS256_SRVW4_TT1_32_VAW2_WSGRA1_WSGRB1_WG64_4_1_WGM1
    SolutionIndex: 101
    SolutionNameMin: Cijk_Ailk_Bjlk_HBHR_MT128x256x32_MI32x32x8x1_SE_1LDSB0_AF0EM8_AF1EM1_EPS1_GRVW8_GSU3_GSUAMB_NLCA1_NLCB1_PGR1_SU0_SUS0_SRVW4_TT2_128_VAW1_WSGRA1_WSGRB1_WG64_4_1_WGM15
    SolutionIndex: 102
    SolutionNameMin: Cijk_Ailk_Bjlk_HBHR_MT128x64x32_MI32x32x8x1_SE_1LDSB0_AF0EM8_AF1EM1_EPS0_GRVW8_GSU1_GSUAMB_NLCA1_NLCB1_PGR2_SU0_SUS0_SRVW4_TT2_32_VAW2_WSGRA1_WSGRB1_WG64_4_1_WGM2
    SolutionIndex: 103
    SolutionNameMin: Cijk_Ailk_Bjlk_HBHR_MT64x128x32_MI32x32x8x1_SE_1LDSB0_AF0EM1_AF1EM1_EPS0_GRVW4_GSU1_GSUAMB_NLCA1_NLCB1_PGR2_SU0_SUS0_SRVW4_TT1_64_VAW2_WSGRA1_WSGRB1_WG64_4_1_WGM2
    SolutionIndex: 104
    SolutionNameMin: Cijk_Ailk_Bjlk_HBHR_MT64x128x16_MI32x32x8x1_SE_1LDSB0_AF0EM8_AF1EM1_EPS0_GRVW8_GSU1_GSUAMB_NLCA1_NLCB1_PGR2_SU32_SUS128_SRVW4_TT1_64_VAW2_WSGRA1_WSGRB1_WG64_4_1_WGM2
    SolutionIndex: 105
    SolutionNameMin: Cijk_Ailk_Bjlk_HBHR_MT16x16x16_MI16x16x16x1_SE_1LDSB0_AF0EM1_AF1EM1_EPS0_GRVW2_GSU1_GSUAMB_NLCA1_NLCB1_PGR2_SU32_SUS256_SRVW4_TT1_16_VAW2_WSGRA1_WSGRB1_WG16_4_1_WGM1
    SolutionIndex: 106
    SolutionNameMin: Cijk_Ailk_Bjlk_HBHR_MT32x64x16_MI16x16x16x1_SE_1LDSB1_AF0EM1_AF1EM1_EPS0_GRVW8_GSU1_GSUAMB_NLCA1_NLCB1_PGR2_SU0_SUS0_SRVW4_TT1_32_VAW2_WSGRA1_WSGRB1_WG32_8_1_WGM2
    SolutionIndex: 107
    SolutionNameMin: Cijk_Ailk_Bjlk_HBHR_MT32x64x16_MI16x16x16x1_SE_1LDSB1_AF0EM1_AF1EM1_EPS1_GRVW2_GSU1_GSUAMB_NLCA1_NLCB1_PGR1_SU0_SUS0_SRVW4_TT1_32_VAW2_WSGRA1_WSGRB1_WG32_8_1_WGM15
    SolutionIndex: 108
    SolutionNameMin: Cijk_Ailk_Bjlk_HBHR_MT32x64x16_MI16x16x16x1_SE_1LDSB0_AF0EM1_AF1EM1_EPS1_GRVW2_GSU1_GSUAMB_NLCA1_NLCB1_PGR1_SU0_SUS0_SRVW4_TT1_32_VAW2_WSGRA1_WSGRB1_WG32_8_1_WGM1
    SolutionIndex: 109
    SolutionNameMin: Cijk_Ailk_Bjlk_HBHR_MT32x64x16_MI16x16x16x1_SE_1LDSB0_AF0EM8_AF1EM1_EPS1_GRVW2_GSU1_GSUAMB_NLCA1_NLCB1_PGR1_SU0_SUS0_SRVW4_TT1_32_VAW2_WSGRA1_WSGRB1_WG32_8_1_WGM15
    SolutionIndex: 110
    SolutionNameMin: Cijk_Ailk_Bjlk_HBHR_MT32x64x16_MI16x16x16x1_SE_1LDSB0_AF0EM1_AF1EM1_EPS1_GRVW2_GSU1_GSUAMB_NLCA1_NLCB1_PGR1_SU32_SUS256_SRVW4_TT1_32_VAW2_WSGRA1_WSGRB1_WG32_8_1_WGM2
    SolutionIndex: 111
    SolutionNameMin: Cijk_Ailk_Bjlk_HBHR_MT32x64x16_MI16x16x16x1_SE_1LDSB0_AF0EM1_AF1EM1_EPS0_GRVW2_GSU1_GSUAMB_NLCA1_NLCB1_PGR2_SU32_SUS256_SRVW4_TT1_32_VAW2_WSGRA1_WSGRB1_WG32_8_1_WGM15
    SolutionIndex: 112
    SolutionNameMin: Cijk_Ailk_Bjlk_HBHR_MT32x64x16_MI16x16x16x1_SE_1LDSB0_AF0EM8_AF1EM1_EPS0_GRVW8_GSU1_GSUAMB_NLCA1_NLCB1_PGR2_SU32_SUS256_SRVW4_TT1_32_VAW2_WSGRA1_WSGRB1_WG32_8_1_WGM2
    SolutionIndex: 113
    SolutionNameMin: Cijk_Ailk_Bjlk_HBHR_MT64x32x16_MI16x16x16x1_SE_1LDSB1_AF0EM8_AF1EM1_EPS1_GRVW2_GSU1_GSUAMB_NLCA1_NLCB1_PGR1_SU0_SUS0_SRVW4_TT2_16_VAW2_WSGRA1_WSGRB1_WG32_8_1_WGM1
    SolutionIndex: 114
    SolutionNameMin: Cijk_Ailk_Bjlk_HBHR_MT64x32x16_MI16x16x16x1_SE_1LDSB0_AF0EM8_AF1EM1_EPS0_GRVW8_GSU1_GSUAMB_NLCA1_NLCB1_PGR2_SU32_SUS128_SRVW4_TT2_16_VAW2_WSGRA1_WSGRB1_WG32_8_1_WGM2
    SolutionIndex: 115
    SolutionNameMin: Cijk_Ailk_Bjlk_HBHR_MT64x32x16_MI16x16x16x1_SE_1LDSB0_AF0EM8_AF1EM1_EPS0_GRVW2_GSU1_GSUAMB_NLCA1_NLCB1_PGR2_SU32_SUS128_SRVW4_TT2_16_VAW2_WSGRA1_WSGRB1_WG32_8_1_WGM1
    SolutionIndex: 116
    SolutionNameMin: Cijk_Ailk_Bjlk_HBHR_MT64x64x16_MI32x32x8x1_SE_1LDSB0_AF0EM8_AF1EM1_EPS1_GRVW2_GSU1_GSUAMB_NLCA1_NLCB1_PGR1_SU32_SUS256_SRVW4_TT1_32_VAW2_WSGRA1_WSGRB1_WG64_4_1_WGM1
    SolutionIndex: 117
    SolutionNameMin: Cijk_Ailk_Bjlk_HBHR_MT64x64x16_MI32x32x8x1_SE_1LDSB0_AF0EM8_AF1EM1_EPS0_GRVW8_GSU1_GSUAMB_NLCA1_NLCB1_PGR2_SU32_SUS256_SRVW4_TT1_32_VAW2_WSGRA1_WSGRB1_WG64_4_1_WGM1
    SolutionIndex: 118
    SolutionNameMin: Cijk_Ailk_Bjlk_HBHR_MT64x64x16_MI32x32x8x1_SE_1LDSB0_AF0EM8_AF1EM1_EPS0_GRVW2_GSU1_GSUAMB_NLCA1_NLCB1_PGR2_SU0_SUS0_SRVW4_TT1_32_VAW2_WSGRA1_WSGRB1_WG64_4_1_WGM2
    SolutionIndex: 119
    SolutionNameMin: Cijk_Ailk_Bjlk_HBHR_MT128x96x32_MI32x32x8x1_SE_1LDSB0_AF0EM8_AF1EM1_EPS0_GRVW4_GSU1_GSUAMB_NLCA1_NLCB3_PGR2_SU0_SUS0_SRVW4_TT1_96_VAW2_WSGRA1_WSGRB1_WG128_2_1_WGM15
    SolutionIndex: 120
    SolutionNameMin: Cijk_Ailk_Bjlk_HBHR_MT32x64x16_MI16x16x16x1_SE_1LDSB0_AF0EM1_AF1EM1_EPS0_GRVW8_GSU1_GSUAMB_NLCA1_NLCB1_PGR2_SU32_SUS256_SRVW4_TT1_32_VAW2_WSGRA1_WSGRB1_WG32_8_1_WGM2
    SolutionIndex: 121
    SolutionNameMin: Cijk_Ailk_Bjlk_HBHR_MT64x192x32_MI32x32x8x1_SE_1LDSB0_AF0EM8_AF1EM1_EPS0_GRVW4_GSU1_GSUAMB_NLCA1_NLCB3_PGR2_SU0_SUS0_SRVW4_TT1_96_VAW2_WSGRA1_WSGRB1_WG64_4_1_WGM1
    SolutionIndex: 122
    SolutionNameMin: Cijk_Ailk_Bjlk_HBHR_MT64x128x16_MI32x32x8x1_SE_1LDSB0_AF0EM8_AF1EM1_EPS0_GRVW2_GSU1_GSUAMB_NLCA1_NLCB1_PGR2_SU0_SUS0_SRVW4_TT1_64_VAW2_WSGRA1_WSGRB1_WG64_4_1_WGM2
    SolutionIndex: 123
    SolutionNameMin: Cijk_Ailk_Bjlk_HBHR_MT64x128x16_MI32x32x8x1_SE_1LDSB0_AF0EM8_AF1EM1_EPS0_GRVW4_GSU1_GSUAMB_NLCA1_NLCB1_PGR2_SU32_SUS128_SRVW4_TT1_64_VAW2_WSGRA1_WSGRB1_WG64_4_1_WGM1
    SolutionIndex: 124
    SolutionNameMin: Cijk_Ailk_Bjlk_HBHR_MT64x128x16_MI32x32x8x1_SE_1LDSB0_AF0EM8_AF1EM1_EPS0_GRVW4_GSU1_GSUAMB_NLCA1_NLCB1_PGR2_SU0_SUS0_SRVW4_TT1_64_VAW2_WSGRA1_WSGRB1_WG64_4_1_WGM2
    SolutionIndex: 125
    SolutionNameMin: Cijk_Ailk_Bjlk_HBHR_MT64x64x16_MI32x32x8x1_SE_1LDSB0_AF0EM1_AF1EM1_EPS0_GRVW2_GSU1_GSUAMB_NLCA1_NLCB1_PGR2_SU32_SUS128_SRVW4_TT1_32_VAW2_WSGRA1_WSGRB1_WG64_4_1_WGM15
    SolutionIndex: 126
    SolutionNameMin: Cijk_Ailk_Bjlk_HBHR_MT64x64x16_MI32x32x8x1_SE_1LDSB0_AF0EM1_AF1EM1_EPS1_GRVW2_GSU1_GSUAMB_NLCA1_NLCB1_PGR1_SU0_SUS0_SRVW4_TT1_32_VAW2_WSGRA1_WSGRB1_WG64_4_1_WGM2
    SolutionIndex: 127
    SolutionNameMin: Cijk_Ailk_Bjlk_HBHR_MT64x64x16_MI32x32x8x1_SE_1LDSB0_AF0EM1_AF1EM1_EPS0_GRVW2_GSU1_GSUAMB_NLCA1_NLCB1_PGR2_SU32_SUS128_SRVW4_TT1_32_VAW2_WSGRA1_WSGRB1_WG64_4_1_WGM2
    SolutionIndex: 128
    SolutionNameMin: Cijk_Ailk_Bjlk_HBHR_MT64x64x16_MI32x32x8x1_SE_1LDSB0_AF0EM1_AF1EM1_EPS1_GRVW8_GSU1_GSUAMB_NLCA1_NLCB1_PGR1_SU0_SUS0_SRVW4_TT1_32_VAW2_WSGRA1_WSGRB1_WG64_4_1_WGM1
    SolutionIndex: 129
    SolutionNameMin: Cijk_Ailk_Bjlk_HBHR_MT128x96x16_MI32x32x8x1_SE_1LDSB0_AF0EM1_AF1EM1_EPS1_GRVW2_GSU1_GSUAMB_NLCA1_NLCB3_PGR1_SU32_SUS256_SRVW4_TT1_96_VAW2_WSGRA1_WSGRB1_WG128_2_1_WGM15
    SolutionIndex: 130
    SolutionNameMin: Cijk_Ailk_Bjlk_HBHR_MT128x96x16_MI32x32x8x1_SE_1LDSB0_AF0EM1_AF1EM1_EPS1_GRVW2_GSU1_GSUAMB_NLCA1_NLCB3_PGR1_SU0_SUS0_SRVW4_TT1_96_VAW2_WSGRA1_WSGRB1_WG128_2_1_WGM15
    SolutionIndex: 131
    SolutionNameMin: Cijk_Ailk_Bjlk_HBHR_MT64x128x16_MI32x32x8x1_SE_1LDSB0_AF0EM1_AF1EM1_EPS0_GRVW8_GSU1_GSUAMB_NLCA1_NLCB1_PGR2_SU32_SUS128_SRVW4_TT1_64_VAW2_WSGRA1_WSGRB1_WG64_4_1_WGM2
    SolutionIndex: 132
    SolutionNameMin: Cijk_Ailk_Bjlk_HBHR_MT64x128x16_MI32x32x8x1_SE_1LDSB0_AF0EM8_AF1EM1_EPS0_GRVW4_GSU1_GSUAMB_NLCA1_NLCB1_PGR2_SU0_SUS0_SRVW4_TT1_64_VAW2_WSGRA1_WSGRB1_WG64_4_1_WGM1
    SolutionIndex: 133
    SolutionNameMin: Cijk_Ailk_Bjlk_HBHR_MT64x64x16_MI32x32x8x1_SE_1LDSB0_AF0EM1_AF1EM1_EPS0_GRVW4_GSU1_GSUAMB_NLCA1_NLCB1_PGR2_SU0_SUS0_SRVW4_TT1_32_VAW2_WSGRA1_WSGRB1_WG64_4_1_WGM1
    SolutionIndex: 134
    SolutionNameMin: Cijk_Ailk_Bjlk_HBHR_MT64x64x16_MI32x32x8x1_SE_1LDSB0_AF0EM8_AF1EM1_EPS0_GRVW2_GSU1_GSUAMB_NLCA1_NLCB1_PGR2_SU0_SUS0_SRVW4_TT1_32_VAW2_WSGRA1_WSGRB1_WG64_4_1_WGM1
    SolutionIndex: 135
    SolutionNameMin: Cijk_Ailk_Bjlk_HBHR_MT96x128x32_MI32x32x8x1_SE_1LDSB0_AF0EM1_AF1EM1_EPS0_GRVW4_GSU1_GSUAMB_NLCA3_NLCB1_PGR2_SU0_SUS0_SRVW0_TT3_32_VAW2_WSGRA1_WSGRB1_WG32_8_1_WGM1
    SolutionIndex: 136
    SolutionNameMin: Cijk_Ailk_Bjlk_HBHR_MT64x128x32_MI32x32x8x1_SE_1LDSB0_AF0EM1_AF1EM1_EPS0_GRVW8_GSU1_GSUAMB_NLCA1_NLCB1_PGR2_SU32_SUS256_SRVW4_TT1_64_VAW2_WSGRA1_WSGRB1_WG64_4_1_WGM15
    SolutionIndex: 137
    SolutionNameMin: Cijk_Ailk_Bjlk_HBHR_MT128x64x16_MI32x32x8x1_SE_1LDSB0_AF0EM8_AF1EM1_EPS0_GRVW8_GSU1_GSUAMB_NLCA1_NLCB1_PGR2_SU32_SUS256_SRVW4_TT2_32_VAW2_WSGRA1_WSGRB1_WG64_4_1_WGM1
    SolutionIndex: 138
    SolutionNameMin: Cijk_Ailk_Bjlk_HBHR_MT128x128x16_MI32x32x8x1_SE_1LDSB0_AF0EM8_AF1EM1_EPS0_GRVW4_GSU1_GSUAMB_NLCA1_NLCB1_PGR2_SU0_SUS0_SRVW4_TT2_64_VAW2_WSGRA1_WSGRB1_WG64_4_1_WGM15
    SolutionIndex: 139
    SolutionNameMin: Cijk_Ailk_Bjlk_HBHR_MT128x128x16_MI32x32x8x1_SE_1LDSB0_AF0EM8_AF1EM1_EPS0_GRVW8_GSU1_GSUAMB_NLCA1_NLCB1_PGR2_SU0_SUS0_SRVW4_TT2_64_VAW2_WSGRA1_WSGRB1_WG64_4_1_WGM15
    SolutionIndex: 140
    SolutionNameMin: Cijk_Ailk_Bjlk_HBHR_MT128x128x16_MI32x32x8x1_SE_1LDSB0_AF0EM1_AF1EM1_EPS0_GRVW8_GSU1_GSUAMB_NLCA1_NLCB1_PGR2_SU0_SUS0_SRVW4_TT2_64_VAW2_WSGRA1_WSGRB1_WG64_4_1_WGM2
    SolutionIndex: 141
    SolutionNameMin: Cijk_Ailk_Bjlk_HBHR_MT64x128x16_MI32x32x8x1_SE_1LDSB0_AF0EM1_AF1EM1_EPS0_GRVW8_GSU1_GSUAMB_NLCA1_NLCB1_PGR2_SU32_SUS128_SRVW4_TT1_64_VAW2_WSGRA1_WSGRB1_WG64_4_1_WGM1
    SolutionIndex: 142
    SolutionNameMin: Cijk_Ailk_Bjlk_HBHR_MT128x256x16_MI32x32x8x1_SE_1LDSB1_AF0EM1_AF1EM1_EPS0_GRVW8_GSU1_GSUAMB_NLCA1_NLCB1_PGR2_SU0_SUS0_SRVW4_TT2_128_VAW2_WSGRA1_WSGRB1_WG64_4_1_WGM2
    SolutionIndex: 143
    SolutionNameMin: Cijk_Ailk_Bjlk_HBHR_MT64x32x16_MI16x16x16x1_SE_1LDSB0_AF0EM8_AF1EM1_EPS0_GRVW2_GSU1_GSUAMB_NLCA1_NLCB1_PGR2_SU32_SUS256_SRVW4_TT2_16_VAW2_WSGRA1_WSGRB1_WG32_8_1_WGM2
    SolutionIndex: 144
    SolutionNameMin: Cijk_Ailk_Bjlk_HBHR_MT128x96x16_MI32x32x8x1_SE_1LDSB0_AF0EM8_AF1EM1_EPS0_GRVW2_GSU1_GSUAMB_NLCA1_NLCB3_PGR2_SU0_SUS0_SRVW4_TT1_96_VAW2_WSGRA1_WSGRB1_WG128_2_1_WGM15
    SolutionIndex: 145
    SolutionNameMin: Cijk_Ailk_Bjlk_HBHR_MT64x128x16_MI32x32x8x1_SE_1LDSB0_AF0EM8_AF1EM1_EPS1_GRVW2_GSU1_GSUAMB_NLCA1_NLCB1_PGR1_SU32_SUS128_SRVW4_TT1_64_VAW2_WSGRA1_WSGRB1_WG64_4_1_WGM15
    SolutionIndex: 146
    SolutionNameMin: Cijk_Ailk_Bjlk_HBHR_MT64x16x32_MI16x16x16x1_SE_1LDSB0_AF0EM8_AF1EM1_EPS0_GRVW8_GSU15_GSUAMB_NLCA1_NLCB1_PGR2_SU32_SUS128_SRVW0_TT1_16_VAW1_WSGRA1_WSGRB1_WG64_4_1_WGM2
    SolutionIndex: 147
    SolutionNameMin: Cijk_Ailk_Bjlk_HBHR_MT64x64x16_MI32x32x8x1_SE_1LDSB0_AF0EM8_AF1EM1_EPS0_GRVW8_GSU1_GSUAMB_NLCA1_NLCB1_PGR2_SU0_SUS0_SRVW4_TT1_32_VAW2_WSGRA1_WSGRB1_WG64_4_1_WGM1
    SolutionIndex: 148
    SolutionNameMin: Cijk_Ailk_Bjlk_HBHR_MT64x128x16_MI32x32x8x1_SE_1LDSB0_AF0EM8_AF1EM1_EPS0_GRVW2_GSU1_GSUAMB_NLCA1_NLCB1_PGR2_SU32_SUS256_SRVW4_TT1_64_VAW2_WSGRA1_WSGRB1_WG64_4_1_WGM2
    SolutionIndex: 149
    SolutionNameMin: Cijk_Ailk_Bjlk_HBHR_MT16x16x32_MI16x16x16x1_SE_1LDSB0_AF0EM8_AF1EM1_EPS0_GRVW2_GSU5_GSUAMB_NLCA1_NLCB1_PGR2_SU0_SUS0_SRVW0_TT1_16_VAW1_WSGRA1_WSGRB1_WG16_4_1_WGM1
    SolutionIndex: 150
    SolutionNameMin: Cijk_Ailk_Bjlk_HBHR_MT64x32x16_MI16x16x16x1_SE_1LDSB0_AF0EM8_AF1EM1_EPS1_GRVW2_GSU1_GSUAMB_NLCA1_NLCB1_PGR1_SU0_SUS0_SRVW4_TT2_16_VAW2_WSGRA1_WSGRB1_WG32_8_1_WGM15
    SolutionIndex: 151
    SolutionNameMin: Cijk_Ailk_Bjlk_HBHR_MT64x64x32_MI32x32x8x1_SE_1LDSB0_AF0EM1_AF1EM1_EPS0_GRVW4_GSU1_GSUAMB_NLCA1_NLCB1_PGR2_SU0_SUS0_SRVW4_TT1_32_VAW2_WSGRA1_WSGRB1_WG64_4_1_WGM1
    SolutionIndex: 152
    SolutionNameMin: Cijk_Ailk_Bjlk_HBHR_MT128x128x16_MI32x32x8x1_SE_1LDSB0_AF0EM8_AF1EM1_EPS0_GRVW8_GSU1_GSUAMB_NLCA1_NLCB1_PGR2_SU32_SUS128_SRVW4_TT2_64_VAW2_WSGRA1_WSGRB1_WG64_4_1_WGM1
    SolutionIndex: 153
    SolutionNameMin: Cijk_Ailk_Bjlk_HBHR_MT128x64x64_MI32x32x8x1_SE_1LDSB0_AF0EM1_AF1EM1_EPS0_GRVW8_GSU1_GSUAMB_NLCA1_NLCB1_PGR2_SU32_SUS256_SRVW4_TT2_32_VAW2_WSGRA1_WSGRB1_WG64_4_1_WGM15
    SolutionIndex: 154
    SolutionNameMin: Cijk_Ailk_Bjlk_HBHR_MT128x64x16_MI32x32x8x1_SE_1LDSB0_AF0EM8_AF1EM1_EPS0_GRVW2_GSU1_GSUAMB_NLCA1_NLCB1_PGR2_SU0_SUS0_SRVW4_TT2_32_VAW2_WSGRA1_WSGRB1_WG64_4_1_WGM1
    SolutionIndex: 155
    SolutionNameMin: Cijk_Ailk_Bjlk_HBHR_MT128x64x16_MI32x32x8x1_SE_1LDSB0_AF0EM1_AF1EM1_EPS0_GRVW8_GSU1_GSUAMB_NLCA1_NLCB1_PGR2_SU0_SUS0_SRVW4_TT2_32_VAW2_WSGRA1_WSGRB1_WG64_4_1_WGM2
    SolutionIndex: 156
    SolutionNameMin: Cijk_Ailk_Bjlk_HBHR_MT256x128x32_MI32x32x8x1_SE_1LDSB0_AF0EM8_AF1EM1_EPS1_GRVW8_GSU1_GSUAMB_NLCA1_NLCB1_PGR1_SU0_SUS0_SRVW4_TT4_64_VAW2_WSGRA1_WSGRB1_WG64_4_1_WGM15
    SolutionIndex: 157
    SolutionNameMin: Cijk_Ailk_Bjlk_HBHR_MT128x256x16_MI32x32x8x1_SE_1LDSB0_AF0EM8_AF1EM1_EPS0_GRVW4_GSU1_GSUAMB_NLCA1_NLCB1_PGR2_SU0_SUS0_SRVW4_TT2_128_VAW2_WSGRA1_WSGRB1_WG64_4_1_WGM1
    SolutionIndex: 158
    SolutionNameMin: Cijk_Ailk_Bjlk_HBHR_MT128x256x16_MI32x32x8x1_SE_1LDSB0_AF0EM8_AF1EM1_EPS0_GRVW8_GSU1_GSUAMB_NLCA1_NLCB1_PGR2_SU0_SUS0_SRVW4_TT2_128_VAW2_WSGRA1_WSGRB1_WG64_4_1_WGM2
    SolutionIndex: 159
    SolutionNameMin: Cijk_Ailk_Bjlk_HBHR_MT128x192x32_MI32x32x8x1_SE_1LDSB0_AF0EM8_AF1EM1_EPS0_GRVW4_GSU1_GSUAMB_NLCA1_NLCB3_PGR2_SU0_SUS0_SRVW4_TT2_96_VAW2_WSGRA1_WSGRB1_WG64_4_1_WGM15
    SolutionIndex: 160
    SolutionNameMin: Cijk_Ailk_Bjlk_HBHR_MT128x96x16_MI32x32x8x1_SE_1LDSB0_AF0EM1_AF1EM1_EPS0_GRVW2_GSU1_GSUAMB_NLCA1_NLCB3_PGR2_SU0_SUS0_SRVW4_TT1_96_VAW2_WSGRA1_WSGRB1_WG128_2_1_WGM1
    SolutionIndex: 161
    SolutionNameMin: Cijk_Ailk_Bjlk_HBHR_MT64x128x32_MI32x32x8x1_SE_1LDSB0_AF0EM8_AF1EM1_EPS0_GRVW4_GSU1_GSUAMB_NLCA1_NLCB1_PGR2_SU32_SUS256_SRVW4_TT1_64_VAW2_WSGRA1_WSGRB1_WG64_4_1_WGM15
    SolutionIndex: 162
    SolutionNameMin: Cijk_Ailk_Bjlk_HBHR_MT64x128x16_MI32x32x8x1_SE_1LDSB0_AF0EM8_AF1EM1_EPS0_GRVW2_GSU1_GSUAMB_NLCA1_NLCB1_PGR2_SU0_SUS0_SRVW4_TT1_64_VAW2_WSGRA1_WSGRB1_WG64_4_1_WGM1
    SolutionIndex: 163
    SolutionNameMin: Cijk_Ailk_Bjlk_HBHR_MT96x128x32_MI32x32x8x1_SE_1LDSB0_AF0EM8_AF1EM1_EPS0_GRVW4_GSU1_GSUAMB_NLCA3_NLCB1_PGR2_SU0_SUS0_SRVW0_TT3_32_VAW2_WSGRA1_WSGRB1_WG32_8_1_WGM1
    SolutionIndex: 164
    SolutionNameMin: Cijk_Ailk_Bjlk_HBHR_MT128x64x16_MI32x32x8x1_SE_1LDSB0_AF0EM8_AF1EM1_EPS0_GRVW8_GSU1_GSUAMB_NLCA1_NLCB1_PGR2_SU0_SUS0_SRVW4_TT2_32_VAW2_WSGRA1_WSGRB1_WG64_4_1_WGM15
    SolutionIndex: 165
    SolutionNameMin: Cijk_Ailk_Bjlk_HBHR_MT128x64x64_MI32x32x8x1_SE_1LDSB0_AF0EM8_AF1EM1_EPS0_GRVW8_GSU1_GSUAMB_NLCA1_NLCB1_PGR2_SU0_SUS0_SRVW4_TT2_32_VAW2_WSGRA1_WSGRB1_WG64_4_1_WGM2
    SolutionIndex: 166
    SolutionNameMin: Cijk_Ailk_Bjlk_HBHR_MT64x64x64_MI32x32x8x1_SE_1LDSB0_AF0EM8_AF1EM1_EPS0_GRVW8_GSU15_GSUAMB_NLCA1_NLCB1_PGR2_SU32_SUS128_SRVW4_TT1_32_VAW1_WSGRA1_WSGRB1_WG64_4_1_WGM1
    SolutionIndex: 167
    SolutionNameMin: Cijk_Ailk_Bjlk_HBHR_MT64x64x32_MI32x32x8x1_SE_1LDSB0_AF0EM8_AF1EM1_EPS0_GRVW4_GSU15_GSUAMB_NLCA1_NLCB1_PGR2_SU32_SUS256_SRVW4_TT1_32_VAW1_WSGRA1_WSGRB1_WG64_4_1_WGM1
    SolutionIndex: 168
    SolutionNameMin: Cijk_Ailk_Bjlk_HBHR_MT64x64x64_MI32x32x8x1_SE_1LDSB0_AF0EM8_AF1EM1_EPS1_GRVW8_GSU5_GSUAMB_NLCA1_NLCB1_PGR1_SU0_SUS0_SRVW0_TT1_32_VAW1_WSGRA1_WSGRB1_WG64_4_1_WGM2
    SolutionIndex: 169
    SolutionNameMin: Cijk_Ailk_Bjlk_HBHR_MT64x64x64_MI32x32x8x1_SE_1LDSB0_AF0EM8_AF1EM1_EPS1_GRVW8_GSU5_GSUAMB_NLCA1_NLCB1_PGR1_SU0_SUS0_SRVW0_TT1_32_VAW1_WSGRA1_WSGRB1_WG64_4_1_WGM1
    SolutionIndex: 170
    SolutionNameMin: Cijk_Ailk_Bjlk_HBHR_MT128x256x16_MI32x32x8x1_SE_1LDSB0_AF0EM8_AF1EM1_EPS0_GRVW8_GSU15_GSUAMB_NLCA1_NLCB1_PGR2_SU0_SUS0_SRVW4_TT2_128_VAW1_WSGRA1_WSGRB1_WG64_4_1_WGM2
    SolutionIndex: 171
    SolutionNameMin: Cijk_Ailk_Bjlk_HBHR_MT128x128x32_MI32x32x8x1_SE_1LDSB0_AF0EM8_AF1EM1_EPS0_GRVW8_GSU1_GSUAMB_NLCA1_NLCB1_PGR2_SU0_SUS0_SRVW4_TT2_64_VAW2_WSGRA1_WSGRB1_WG64_4_1_WGM15
    SolutionIndex: 172
    SolutionNameMin: Cijk_Ailk_Bjlk_HBHR_MT64x128x32_MI32x32x8x1_SE_1LDSB0_AF0EM8_AF1EM1_EPS0_GRVW2_GSU1_GSUAMB_NLCA1_NLCB1_PGR2_SU0_SUS0_SRVW4_TT1_64_VAW2_WSGRA1_WSGRB1_WG64_4_1_WGM2
    SolutionIndex: 173
    SolutionNameMin: Cijk_Ailk_Bjlk_HBHR_MT128x64x32_MI32x32x8x1_SE_1LDSB0_AF0EM8_AF1EM1_EPS0_GRVW2_GSU1_GSUAMB_NLCA1_NLCB1_PGR2_SU0_SUS0_SRVW4_TT2_32_VAW2_WSGRA1_WSGRB1_WG64_4_1_WGM1
    SolutionIndex: 174
    SolutionNameMin: Cijk_Ailk_Bjlk_HBHR_MT32x32x64_MI16x16x16x1_SE_1LDSB0_AF0EM1_AF1EM1_EPS0_GRVW8_GSU7_GSUAMB_NLCA1_NLCB1_PGR2_SU32_SUS256_SRVW4_TT1_16_VAW1_WSGRA1_WSGRB1_WG32_8_1_WGM1
    SolutionIndex: 175
    SolutionNameMin: Cijk_Ailk_Bjlk_HBHR_MT128x256x32_MI32x32x8x1_SE_1LDSB0_AF0EM8_AF1EM1_EPS1_GRVW8_GSU1_GSUAMB_NLCA1_NLCB1_PGR1_SU0_SUS0_SRVW4_TT2_128_VAW2_WSGRA1_WSGRB1_WG64_4_1_WGM2
    SolutionIndex: 176
    SolutionNameMin: Cijk_Ailk_Bjlk_HBHR_MT64x32x16_MI16x16x16x1_SE_1LDSB1_AF0EM8_AF1EM1_EPS0_GRVW2_GSU1_GSUAMB_NLCA1_NLCB1_PGR2_SU0_SUS0_SRVW4_TT2_16_VAW2_WSGRA1_WSGRB1_WG32_8_1_WGM15
    SolutionIndex: 177
    SolutionNameMin: Cijk_Ailk_Bjlk_HBHR_MT128x256x16_MI32x32x8x1_SE_1LDSB0_AF0EM8_AF1EM1_EPS0_GRVW8_GSU1_GSUAMB_NLCA1_NLCB1_PGR2_SU0_SUS0_SRVW4_TT2_128_VAW2_WSGRA1_WSGRB1_WG64_4_1_WGM15
    SolutionIndex: 178
    SolutionNameMin: Cijk_Ailk_Bjlk_HBHR_MT128x256x16_MI32x32x8x1_SE_1LDSB0_AF0EM8_AF1EM1_EPS0_GRVW8_GSU1_GSUAMB_NLCA1_NLCB1_PGR2_SU32_SUS256_SRVW4_TT2_128_VAW2_WSGRA1_WSGRB1_WG64_4_1_WGM2
    SolutionIndex: 179
    SolutionNameMin: Cijk_Ailk_Bjlk_HBHR_MT64x64x16_MI32x32x8x1_SE_1LDSB0_AF0EM8_AF1EM1_EPS0_GRVW4_GSU1_GSUAMB_NLCA1_NLCB1_PGR2_SU0_SUS0_SRVW4_TT1_32_VAW2_WSGRA1_WSGRB1_WG64_4_1_WGM1
    SolutionIndex: 180
    SolutionNameMin: Cijk_Ailk_Bjlk_HBHR_MT128x128x16_MI32x32x8x1_SE_1LDSB0_AF0EM1_AF1EM1_EPS0_GRVW8_GSU1_GSUAMB_NLCA1_NLCB1_PGR2_SU0_SUS0_SRVW4_TT2_64_VAW2_WSGRA1_WSGRB1_WG64_4_1_WGM15
    SolutionIndex: 181
    SolutionNameMin: Cijk_Ailk_Bjlk_HBHR_MT128x256x16_MI32x32x8x1_SE_1LDSB1_AF0EM8_AF1EM1_EPS0_GRVW8_GSU1_GSUAMB_NLCA1_NLCB1_PGR2_SU0_SUS0_SRVW4_TT2_128_VAW2_WSGRA1_WSGRB1_WG64_4_1_WGM15
    SolutionIndex: 182
    SolutionNameMin: Cijk_Ailk_Bjlk_HBHR_MT128x64x16_MI32x32x8x1_SE_1LDSB0_AF0EM8_AF1EM1_EPS0_GRVW2_GSU1_GSUAMB_NLCA1_NLCB1_PGR2_SU32_SUS256_SRVW4_TT2_32_VAW2_WSGRA1_WSGRB1_WG64_4_1_WGM2
    SolutionIndex: 183
    SolutionNameMin: Cijk_Ailk_Bjlk_HBHR_MT128x128x16_MI32x32x8x1_SE_1LDSB0_AF0EM8_AF1EM1_EPS0_GRVW2_GSU1_GSUAMB_NLCA1_NLCB1_PGR2_SU0_SUS0_SRVW4_TT2_64_VAW2_WSGRA1_WSGRB1_WG64_4_1_WGM1
    SolutionIndex: 184
    SolutionNameMin: Cijk_Ailk_Bjlk_HBHR_MT128x128x16_MI32x32x8x1_SE_1LDSB0_AF0EM8_AF1EM1_EPS0_GRVW2_GSU1_GSUAMB_NLCA1_NLCB1_PGR2_SU32_SUS256_SRVW4_TT2_64_VAW2_WSGRA1_WSGRB1_WG64_4_1_WGM1
    SolutionIndex: 185
    SolutionNameMin: Cijk_Ailk_Bjlk_HBHR_MT128x128x16_MI32x32x8x1_SE_1LDSB0_AF0EM1_AF1EM1_EPS0_GRVW8_GSU1_GSUAMB_NLCA1_NLCB1_PGR2_SU0_SUS0_SRVW4_TT2_64_VAW2_WSGRA1_WSGRB1_WG64_4_1_WGM1
    SolutionIndex: 186
    SolutionNameMin: Cijk_Ailk_Bjlk_HBHR_MT128x64x32_MI32x32x8x1_SE_1LDSB0_AF0EM8_AF1EM1_EPS1_GRVW8_GSU1_GSUAMB_NLCA1_NLCB1_PGR1_SU0_SUS0_SRVW4_TT2_32_VAW2_WSGRA1_WSGRB1_WG64_4_1_WGM15
    SolutionIndex: 187
    SolutionNameMin: Cijk_Ailk_Bjlk_HBHR_MT128x128x32_MI32x32x8x1_SE_1LDSB0_AF0EM8_AF1EM1_EPS0_GRVW8_GSU3_GSUAMB_NLCA1_NLCB1_PGR2_SU0_SUS0_SRVW4_TT2_64_VAW1_WSGRA1_WSGRB1_WG64_4_1_WGM15
    SolutionIndex: 188
    SolutionNameMin: Cijk_Ailk_Bjlk_HBHR_MT128x64x16_MI32x32x8x1_SE_1LDSB0_AF0EM8_AF1EM1_EPS1_GRVW8_GSU1_GSUAMB_NLCA1_NLCB1_PGR1_SU0_SUS0_SRVW4_TT2_32_VAW2_WSGRA1_WSGRB1_WG64_4_1_WGM1
    SolutionIndex: 189
    SolutionNameMin: Cijk_Ailk_Bjlk_HBHR_MT64x128x64_MI32x32x8x1_SE_1LDSB0_AF0EM8_AF1EM1_EPS0_GRVW8_GSU1_GSUAMB_NLCA1_NLCB1_PGR2_SU0_SUS0_SRVW4_TT1_64_VAW2_WSGRA1_WSGRB1_WG64_4_1_WGM15
    SolutionIndex: 190
    SolutionNameMin: Cijk_Ailk_Bjlk_HBHR_MT128x128x32_MI32x32x8x1_SE_1LDSB0_AF0EM8_AF1EM1_EPS0_GRVW4_GSU1_GSUAMB_NLCA1_NLCB1_PGR2_SU0_SUS0_SRVW4_TT2_64_VAW2_WSGRA1_WSGRB1_WG64_4_1_WGM2
    SolutionIndex: 191
    SolutionNameMin: Cijk_Ailk_Bjlk_HBHR_MT128x128x32_MI32x32x8x1_SE_1LDSB0_AF0EM8_AF1EM1_EPS0_GRVW8_GSU1_GSUAMB_NLCA1_NLCB1_PGR2_SU32_SUS256_SRVW4_TT2_64_VAW2_WSGRA1_WSGRB1_WG64_4_1_WGM15
    SolutionIndex: 192
    SolutionNameMin: Cijk_Ailk_Bjlk_HBHR_MT128x64x16_MI32x32x8x1_SE_1LDSB0_AF0EM8_AF1EM1_EPS0_GRVW8_GSU1_GSUAMB_NLCA1_NLCB1_PGR2_SU0_SUS0_SRVW4_TT2_32_VAW2_WSGRA1_WSGRB1_WG64_4_1_WGM2
    SolutionIndex: 193
    SolutionNameMin: Cijk_Ailk_Bjlk_HBHR_MT64x192x16_MI32x32x8x1_SE_1LDSB0_AF0EM8_AF1EM1_EPS0_GRVW4_GSU1_GSUAMB_NLCA1_NLCB3_PGR2_SU0_SUS0_SRVW4_TT1_96_VAW2_WSGRA1_WSGRB1_WG64_4_1_WGM15
    SolutionIndex: 194
    SolutionNameMin: Cijk_Ailk_Bjlk_HBHR_MT128x128x32_MI32x32x8x1_SE_1LDSB0_AF0EM8_AF1EM1_EPS0_GRVW8_GSU1_GSUAMB_NLCA1_NLCB1_PGR2_SU0_SUS0_SRVW4_TT2_64_VAW2_WSGRA1_WSGRB1_WG64_4_1_WGM2
    SolutionIndex: 195
    SolutionNameMin: Cijk_Ailk_Bjlk_HBHR_MT128x128x16_MI32x32x8x1_SE_1LDSB0_AF0EM8_AF1EM1_EPS0_GRVW8_GSU1_GSUAMB_NLCA1_NLCB1_PGR2_SU32_SUS256_SRVW4_TT2_64_VAW2_WSGRA1_WSGRB1_WG64_4_1_WGM1
    SolutionIndex: 196
    SolutionNameMin: Cijk_Ailk_Bjlk_HBHR_MT32x32x16_MI16x16x16x1_SE_1LDSB0_AF0EM8_AF1EM1_EPS0_GRVW4_GSU1_GSUAMB_NLCA1_NLCB1_PGR2_SU0_SUS0_SRVW4_TT1_16_VAW2_WSGRA1_WSGRB1_WG32_8_1_WGM1
    SolutionIndex: 197
    SolutionNameMin: Cijk_Ailk_Bjlk_HBHR_MT32x32x16_MI16x16x16x1_SE_1LDSB0_AF0EM8_AF1EM1_EPS1_GRVW4_GSU1_GSUAMB_NLCA1_NLCB1_PGR1_SU0_SUS0_SRVW4_TT1_16_VAW2_WSGRA1_WSGRB1_WG32_8_1_WGM15
    SolutionIndex: 198
    SolutionNameMin: Cijk_Ailk_Bjlk_HBHR_MT128x256x16_MI32x32x8x1_SE_1LDSB0_AF0EM8_AF1EM1_EPS0_GRVW4_GSU1_GSUAMB_NLCA1_NLCB1_PGR2_SU0_SUS0_SRVW4_TT2_128_VAW2_WSGRA1_WSGRB1_WG64_4_1_WGM2
    SolutionIndex: 199
    SolutionNameMin: Cijk_Ailk_Bjlk_HBHR_MT64x32x16_MI16x16x16x1_SE_1LDSB1_AF0EM8_AF1EM1_EPS1_GRVW2_GSU1_GSUAMB_NLCA1_NLCB1_PGR1_SU32_SUS256_SRVW4_TT2_16_VAW2_WSGRA1_WSGRB1_WG32_8_1_WGM2
    SolutionIndex: 200
    SolutionNameMin: Cijk_Ailk_Bjlk_HBHR_MT64x64x32_MI32x32x8x1_SE_1LDSB0_AF0EM8_AF1EM1_EPS0_GRVW8_GSU1_GSUAMB_NLCA1_NLCB1_PGR2_SU0_SUS0_SRVW4_TT1_32_VAW2_WSGRA1_WSGRB1_WG64_4_1_WGM2
    SolutionIndex: 201
    SolutionNameMin: Cijk_Ailk_Bjlk_HBHR_MT64x128x16_MI32x32x8x1_SE_1LDSB0_AF0EM8_AF1EM1_EPS0_GRVW8_GSU1_GSUAMB_NLCA1_NLCB1_PGR2_SU32_SUS256_SRVW4_TT1_64_VAW2_WSGRA1_WSGRB1_WG64_4_1_WGM2
    SolutionIndex: 202
    SolutionNameMin: Cijk_Ailk_Bjlk_HBHR_MT128x128x16_MI32x32x8x1_SE_1LDSB0_AF0EM1_AF1EM1_EPS0_GRVW8_GSU1_GSUAMB_NLCA1_NLCB1_PGR2_SU32_SUS128_SRVW4_TT2_64_VAW2_WSGRA1_WSGRB1_WG64_4_1_WGM1
    SolutionIndex: 203
    SolutionNameMin: Cijk_Ailk_Bjlk_HBHR_MT64x32x16_MI16x16x16x1_SE_1LDSB0_AF0EM8_AF1EM1_EPS1_GRVW2_GSU1_GSUAMB_NLCA1_NLCB1_PGR1_SU32_SUS128_SRVW4_TT2_16_VAW2_WSGRA1_WSGRB1_WG32_8_1_WGM1
    SolutionIndex: 204
    SolutionNameMin: Cijk_Ailk_Bjlk_HBHR_MT128x64x32_MI32x32x8x1_SE_1LDSB0_AF0EM1_AF1EM1_EPS0_GRVW4_GSU1_GSUAMB_NLCA1_NLCB1_PGR2_SU0_SUS0_SRVW4_TT2_32_VAW2_WSGRA1_WSGRB1_WG64_4_1_WGM15
    SolutionIndex: 205
    SolutionNameMin: Cijk_Ailk_Bjlk_HBHR_MT128x128x32_MI32x32x8x1_SE_1LDSB0_AF0EM8_AF1EM1_EPS0_GRVW8_GSU1_GSUAMB_NLCA1_NLCB1_PGR2_SU32_SUS128_SRVW4_TT2_64_VAW2_WSGRA1_WSGRB1_WG64_4_1_WGM1
    SolutionIndex: 206
    SolutionNameMin: Cijk_Ailk_Bjlk_HBHR_MT64x128x32_MI32x32x8x1_SE_1LDSB0_AF0EM8_AF1EM1_EPS1_GRVW8_GSU1_GSUAMB_NLCA1_NLCB1_PGR1_SU0_SUS0_SRVW4_TT1_64_VAW2_WSGRA1_WSGRB1_WG64_4_1_WGM15
    SolutionIndex: 207
    SolutionNameMin: Cijk_Ailk_Bjlk_HBHR_MT96x128x32_MI32x32x8x1_SE_1LDSB0_AF0EM8_AF1EM1_EPS0_GRVW4_GSU1_GSUAMB_NLCA3_NLCB1_PGR2_SU32_SUS256_SRVW0_TT3_32_VAW2_WSGRA1_WSGRB1_WG32_8_1_WGM2
    SolutionIndex: 208
    SolutionNameMin: Cijk_Ailk_Bjlk_HBHR_MT128x128x32_MI32x32x8x1_SE_1LDSB0_AF0EM1_AF1EM1_EPS0_GRVW8_GSU1_GSUAMB_NLCA1_NLCB1_PGR2_SU0_SUS0_SRVW4_TT2_64_VAW2_WSGRA1_WSGRB1_WG64_4_1_WGM1
    SolutionIndex: 209
    SolutionNameMin: Cijk_Ailk_Bjlk_HBHR_MT64x192x16_MI32x32x8x1_SE_1LDSB0_AF0EM1_AF1EM1_EPS1_GRVW2_GSU1_GSUAMB_NLCA1_NLCB3_PGR1_SU0_SUS0_SRVW4_TT1_96_VAW2_WSGRA1_WSGRB1_WG64_4_1_WGM2
    SolutionIndex: 210
    SolutionNameMin: Cijk_Ailk_Bjlk_HBHR_MT32x32x16_MI16x16x16x1_SE_1LDSB0_AF0EM1_AF1EM1_EPS1_GRVW8_GSU1_GSUAMB_NLCA1_NLCB1_PGR1_SU0_SUS0_SRVW4_TT1_16_VAW2_WSGRA1_WSGRB1_WG32_8_1_WGM1
    SolutionIndex: 211
    SolutionNameMin: Cijk_Ailk_Bjlk_HBHR_MT64x192x32_MI32x32x8x1_SE_1LDSB0_AF0EM1_AF1EM1_EPS0_GRVW4_GSU1_GSUAMB_NLCA1_NLCB3_PGR2_SU0_SUS0_SRVW4_TT1_96_VAW2_WSGRA1_WSGRB1_WG64_4_1_WGM2
    SolutionIndex: 212
    SolutionNameMin: Cijk_Ailk_Bjlk_HBHR_MT64x128x32_MI32x32x8x1_SE_1LDSB0_AF0EM1_AF1EM1_EPS0_GRVW4_GSU1_GSUAMB_NLCA1_NLCB1_PGR2_SU0_SUS0_SRVW4_TT1_64_VAW2_WSGRA1_WSGRB1_WG64_4_1_WGM15
    SolutionIndex: 213
    SolutionNameMin: Cijk_Ailk_Bjlk_HBHR_MT128x64x32_MI32x32x8x1_SE_1LDSB0_AF0EM1_AF1EM1_EPS0_GRVW8_GSU1_GSUAMB_NLCA1_NLCB1_PGR2_SU32_SUS256_SRVW4_TT2_32_VAW2_WSGRA1_WSGRB1_WG64_4_1_WGM1
    SolutionIndex: 214
    SolutionNameMin: Cijk_Ailk_Bjlk_HBHR_MT128x128x16_MI32x32x8x1_SE_1LDSB0_AF0EM1_AF1EM1_EPS0_GRVW4_GSU1_GSUAMB_NLCA1_NLCB1_PGR2_SU0_SUS0_SRVW4_TT2_64_VAW2_WSGRA1_WSGRB1_WG64_4_1_WGM15
    SolutionIndex: 215
    SolutionNameMin: Cijk_Ailk_Bjlk_HBHR_MT128x128x16_MI32x32x8x1_SE_1LDSB0_AF0EM1_AF1EM1_EPS0_GRVW2_GSU1_GSUAMB_NLCA1_NLCB1_PGR2_SU0_SUS0_SRVW4_TT2_64_VAW2_WSGRA1_WSGRB1_WG64_4_1_WGM1
    SolutionIndex: 216
    SolutionNameMin: Cijk_Ailk_Bjlk_HBHR_MT16x64x32_MI16x16x16x1_SE_1LDSB0_AF0EM1_AF1EM1_EPS1_GRVW8_GSU1_GSUAMB_NLCA1_NLCB1_PGR1_SU0_SUS0_SRVW0_TT1_16_VAW2_WSGRA1_WSGRB1_WG16_16_1_WGM1
    SolutionIndex: 217
    SolutionNameMin: Cijk_Ailk_Bjlk_HHS_BH_MT128x256x16_MI32x32x8x1_SN_1LDSB1_EPS0_GRVW8_NLCA1_NLCB1_PGR2_SU0_SUS0_SRVW4_TT2_128_WG64_4_1_WGM2
    SolutionIndex: 218
    SolutionNameMin: Cijk_Ailk_Bjlk_HHS_BH_MT64x64x32_MI16x16x16x1_SN_AMAS3_PGR2_PLR2_SS1_SU0_SUS0_SVW2_VW2_WSGRA0_WSGRB0
    SolutionIndex: 219
    SolutionNameMin: Cijk_Ailk_Bjlk_HHS_BH_MT64x64x32_MI16x16x16x1_SN_AMAS3_PGR2_PLR2_SS1_SU8_SUS64_SVW2_VW2_WSGRA1_WSGRB1
    SolutionIndex: 220
    SolutionNameMin: Cijk_Ailk_Bjlk_HHS_BH_MT16x16x64_MI16x16x16x1_SN_1LDSB1_IU4_MIAV0_SIA2_SS0_SVW4_TT1_16_WG16_4_1_WGM16
- - - [1, 1, 1, 1]
    - [0, 0.0]
  - - [1, 1, 1, 256]
    - [0, 0.00535123]
  - - [1, 1, 1, 1280]
    - [0, 0.0]
  - - [1, 1, 1, 3328]
    - [0, 0.0]
  - - [64, 448, 1, 3328]
    - [1, 3.171]
  - - [3584, 64, 1, 1280]
    - [2, 11.899]
  - - [64, 128, 1, 256]
    - [3, 0.183]
  - - [64, 5888, 1, 1280]
    - [4, 20.278]
  - - [64, 4288, 1, 1280]
    - [2, 14.497]
  - - [3584, 64, 1, 3328]
    - [2, 18.068]
  - - [64, 1024, 1, 3328]
    - [1, 7.164]
  - - [704, 64, 1, 3328]
    - [5, 4.841]
  - - [64, 448, 1, 1280]
    - [5, 2.067]
  - - [64, 704, 1, 3328]
    - [5, 4.954]
  - - [64, 64, 1, 1280]
    - [1, 0.295]
  - - [64, 5056, 1, 256]
    - [1, 6.1]
  - - [64, 4288, 1, 3328]
    - [2, 21.709]
  - - [1856, 64, 1, 3328]
    - [6, 9.81]
  - - [448, 64, 1, 1280]
    - [5, 2.027]
  - - [5888, 64, 1, 1280]
    - [2, 19.689]
  - - [2944, 64, 1, 256]
    - [7, 3.882]
  - - [64, 1856, 1, 256]
    - [3, 2.501]
  - - [64, 1024, 1, 1280]
    - [5, 4.773]
  - - [64, 256, 1, 1280]
    - [1, 1.176]
  - - [704, 64, 1, 1280]
    - [5, 3.185]
  - - [64, 128, 1, 1280]
    - [5, 0.588]
  - - [2368, 64, 1, 256]
    - [1, 3.191]
  - - [2368, 64, 1, 3328]
    - [8, 12.039]
  - - [64, 1408, 1, 3328]
    - [1, 9.599]
  - - [1856, 64, 1, 1280]
    - [9, 6.907]
  - - [64, 3584, 1, 1280]
    - [10, 12.206]
  - - [448, 64, 1, 3328]
    - [5, 3.08]
  - - [5888, 64, 1, 3328]
    - [2, 29.497]
  - - [128, 64, 1, 256]
    - [1, 0.176]
  - - [64, 128, 1, 3328]
    - [11, 0.934]
  - - [64, 256, 1, 3328]
    - [5, 1.818]
  - - [4288, 64, 1, 3328]
    - [2, 21.893]
  - - [64, 2944, 1, 256]
    - [3, 3.938]
  - - [6784, 64, 1, 256]
    - [4, 7.826]
  - - [1024, 64, 1, 1280]
    - [1, 4.633]
  - - [64, 2368, 1, 1280]
    - [9, 8.604]
  - - [64, 3584, 1, 3328]
    - [2, 17.88]
  - - [64, 6784, 1, 3328]
    - [2, 33.496]
  - - [3584, 64, 1, 256]
    - [7, 4.531]
  - - [64, 1856, 1, 3328]
    - [6, 9.897]
  - - [448, 64, 1, 256]
    - [12, 0.627]
  - - [64, 5056, 1, 3328]
    - [10, 25.33]
  - - [256, 64, 1, 256]
    - [3, 0.363]
  - - [4288, 64, 1, 1280]
    - [13, 14.712]
  - - [5056, 64, 1, 1280]
    - [4, 17.543]
  - - [1024, 64, 1, 3328]
    - [1, 6.902]
  - - [1408, 64, 1, 256]
    - [3, 1.984]
  - - [64, 1408, 1, 256]
    - [12, 1.925]
  - - [64, 2368, 1, 3328]
    - [10, 12.014]
  - - [64, 448, 1, 256]
    - [3, 0.622]
  - - [64, 6784, 1, 1280]
    - [4, 23.104]
  - - [64, 1856, 1, 1280]
    - [9, 6.798]
  - - [64, 6784, 1, 256]
    - [14, 7.976]
  - - [64, 5056, 1, 1280]
    - [4, 17.543]
  - - [64, 4288, 1, 256]
    - [15, 5.459]
  - - [128, 64, 1, 1280]
    - [1, 0.588]
  - - [5888, 64, 1, 256]
    - [16, 6.879]
  - - [64, 5888, 1, 3328]
    - [10, 29.253]
  - - [64, 1024, 1, 256]
    - [5, 1.443]
  - - [5056, 64, 1, 3328]
    - [2, 25.597]
  - - [256, 64, 1, 1280]
    - [1, 1.164]
  - - [64, 256, 1, 256]
    - [17, 0.358]
  - - [704, 64, 1, 256]
    - [3, 1.015]
  - - [64, 1408, 1, 1280]
    - [1, 6.278]
  - - [64, 704, 1, 256]
    - [3, 0.985]
  - - [64, 2944, 1, 3328]
    - [2, 14.968]
  - - [64, 64, 1, 256]
    - [18, 0.092]
  - - [1856, 64, 1, 256]
    - [3, 2.576]
  - - [128, 64, 1, 3328]
    - [19, 0.92]
  - - [2944, 64, 1, 1280]
    - [9, 10.451]
  - - [4288, 64, 1, 256]
    - [15, 5.497]
  - - [64, 2944, 1, 1280]
    - [9, 10.532]
  - - [1408, 64, 1, 1280]
    - [1, 6.465]
  - - [6784, 64, 1, 3328]
    - [2, 33.635]
  - - [1024, 64, 1, 256]
    - [3, 1.465]
  - - [64, 2368, 1, 256]
    - [17, 3.145]
  - - [64, 3584, 1, 256]
    - [1, 4.759]
  - - [2944, 64, 1, 3328]
    - [8, 15.031]
  - - [2368, 64, 1, 1280]
    - [9, 8.471]
  - - [256, 64, 1, 3328]
    - [1, 1.802]
  - - [64, 64, 1, 3328]
    - [20, 0.457]
  - - [64, 5888, 1, 256]
    - [16, 7.012]
  - - [64, 704, 1, 1280]
    - [1, 3.249]
  - - [6784, 64, 1, 1280]
    - [4, 22.852]
  - - [5056, 64, 1, 256]
    - [7, 6.14]
  - - [1408, 64, 1, 3328]
    - [5, 9.681]
  - - [4096, 7133, 1, 4096]
    - [21, 88.148]
  - - [512, 16, 1, 512]
    - [3, 0.307]
  - - [2048, 7133, 1, 2048]
    - [21, 77.864]
  - - [2560, 7133, 1, 2560]
    - [22, 83.506]
  - - [1024, 1024, 1, 1024]
    - [14, 31.586]
  - - [3072, 7435, 1, 1024]
    - [23, 76.645]
  - - [1024, 32, 1, 512]
    - [12, 1.26]
  - - [1760, 7133, 1, 1760]
    - [22, 75.757]
  - - [7680, 5481, 1, 2560]
    - [24, 88.821]
  - - [1024, 16, 1, 512]
    - [3, 0.622]
  - - [512, 32, 1, 512]
    - [1, 0.618]
  - - [3136, 256, 64, 64]
    - [25, 19.633]
  - - [784, 512, 64, 128]
    - [26, 33.741]
  - - [784, 128, 64, 512]
    - [21, 43.534]
  - - [3136, 64, 128, 64]
    - [27, 15.86]
  - - [196, 256, 128, 1024]
    - [28, 46.137]
  - - [196, 256, 64, 1024]
    - [29, 40.534]
  - - [196, 1024, 128, 256]
    - [30, 36.233]
  - - [784, 128, 256, 512]
    - [31, 50.681]
  - - [3136, 64, 64, 256]
    - [32, 31.938]
  - - [3136, 64, 256, 256]
    - [33, 32.917]
  - - [3136, 256, 256, 64]
    - [25, 20.735]
  - - [3136, 64, 128, 256]
    - [32, 32.699]
  - - [784, 128, 128, 512]
    - [34, 48.62]
  - - [784, 512, 128, 128]
    - [35, 36.18]
  - - [784, 512, 256, 128]
    - [35, 37.422]
  - - [196, 1024, 64, 256]
    - [30, 33.049]
  - - [3136, 64, 64, 64]
    - [36, 14.563]
  - - [196, 1024, 256, 256]
    - [30, 37.911]
  - - [196, 256, 256, 1024]
    - [30, 50.048]
  - - [3136, 256, 128, 64]
    - [25, 20.373]
  - - [3136, 64, 256, 64]
    - [4, 16.517]
  - - [14, 64, 1, 14]
    - [3, 0.001]
  - - [15, 64, 1, 14]
    - [3, 0.001]
  - - [15, 64, 1, 15]
    - [37, 0.001]
  - - [15, 64, 1, 15]
    - [3, 0.001]
  - - [17, 64, 1, 15]
    - [38, 0.002]
  - - [17, 64, 1, 17]
    - [39, 0.002]
  - - [17, 64, 1, 17]
    - [38, 0.002]
  - - [21, 64, 1, 17]
    - [40, 0.003]
  - - [21, 64, 1, 21]
    - [40, 0.003]
  - - [24, 64, 1, 24]
    - [41, 0.004]
  - - [30, 64, 1, 30]
    - [18, 0.006]
  - - [30, 64, 1, 31]
    - [40, 0.007]
  - - [31, 64, 1, 31]
    - [42, 0.007]
  - - [32, 64, 1, 32]
    - [43, 0.008]
  - - [32, 64, 1, 35]
    - [44, 0.008]
  - - [34, 64, 1, 24]
    - [45, 0.005]
  - - [34, 64, 1, 34]
    - [42, 0.008]
  - - [35, 64, 1, 35]
    - [42, 0.008]
  - - [64, 14, 1, 14]
    - [44, 0.001]
  - - [64, 15, 1, 14]
    - [46, 0.001]
  - - [64, 15, 1, 15]
    - [47, 0.002]
  - - [64, 15, 1, 15]
    - [46, 0.001]
  - - [64, 17, 1, 15]
    - [44, 0.002]
  - - [64, 17, 1, 17]
    - [48, 0.002]
  - - [64, 17, 1, 17]
    - [41, 0.002]
  - - [64, 21, 1, 17]
    - [41, 0.002]
  - - [64, 21, 1, 21]
    - [41, 0.003]
  - - [64, 24, 1, 24]
    - [41, 0.004]
  - - [64, 30, 1, 30]
    - [41, 0.006]
  - - [64, 30, 1, 31]
    - [41, 0.006]
  - - [64, 31, 1, 31]
    - [41, 0.006]
  - - [64, 32, 1, 32]
    - [41, 0.007]
  - - [64, 32, 1, 35]
    - [44, 0.007]
  - - [64, 34, 1, 24]
    - [41, 0.005]
  - - [64, 34, 1, 34]
    - [17, 0.007]
  - - [64, 35, 1, 35]
    - [41, 0.008]
  - - [64, 128, 512, 128]
    - [49, 16.709]
  - - [64, 512, 1, 512]
    - [5, 1.252]
  - - [64, 512, 64, 512]
    - [50, 31.341]
  - - [128, 64, 512, 128]
    - [51, 16.572]
  - - [512, 64, 1, 512]
    - [12, 1.244]
  - - [512, 64, 64, 512]
    - [25, 30.704]
  - - [1024, 2, 1, 4]
    - [41, 0.001]
  - - [1024, 2, 1, 32]
    - [52, 0.008]
  - - [1024, 2, 1, 2048]
    - [53, 0.151]
  - - [1024, 1024, 1, 4]
    - [54, 0.34]
  - - [1024, 1024, 1, 32]
    - [55, 2.931]
  - - [1024, 1024, 1, 2048]
    - [56, 40.595]
  - - [1024, 1024, 1, 4096]
    - [57, 50.405]
  - - [1024, 4096, 1, 2048]
    - [21, 64.305]
  - - [1024, 4096, 1, 4096]
    - [58, 75.168]
  - - [1024, 30528, 1, 2048]
    - [59, 86.633]
  - - [1024, 30528, 1, 4096]
    - [24, 91.49]
  - - [4096, 1024, 1, 2048]
    - [60, 64.134]
  - - [4096, 1024, 1, 4096]
    - [61, 72.848]
  - - [3, 64, 512, 3]
    - [38, 0.025]
  - - [5, 64, 512, 5]
    - [42, 0.067]
  - - [5, 64, 960, 5]
    - [38, 0.104]
  - - [9, 64, 512, 9]
    - [38, 0.215]
  - - [13, 512, 1, 32768]
    - [62, 3.432]
  - - [27, 128, 32768, 27]
    - [63, 4.111]
  - - [33, 32, 200, 33]
    - [64, 0.599]
  - - [33, 32, 1600, 33]
    - [42, 2.02]
  - - [67, 2048, 1, 512]
    - [9, 4.629]
  - - [74, 2048, 1, 512]
    - [9, 4.967]
  - - [74, 2048, 1, 960]
    - [9, 7.253]
  - - [100, 2048, 1, 512]
    - [15, 6.153]
  - - [256, 128, 1, 32768]
    - [65, 16.37]
  - - [256, 1280, 1, 8976]
    - [66, 32.777]
  - - [256, 2560, 1, 8976]
    - [67, 51.576]
  - - [256, 2816, 1, 8976]
    - [67, 55.355]
  - - [256, 3328, 1, 8976]
    - [68, 60.293]
  - - [256, 3584, 1, 8976]
    - [69, 52.93]
  - - [256, 3840, 1, 8976]
    - [69, 56.485]
  - - [256, 4096, 1, 8976]
    - [70, 58.651]
  - - [256, 4352, 1, 8976]
    - [70, 61.567]
  - - [256, 4864, 1, 8976]
    - [57, 66.171]
  - - [256, 5120, 1, 8976]
    - [57, 69.001]
  - - [256, 5632, 1, 8976]
    - [60, 68.841]
  - - [256, 5888, 1, 8976]
    - [60, 71.971]
  - - [256, 6144, 1, 8976]
    - [60, 75.064]
  - - [256, 7168, 1, 8976]
    - [71, 64.953]
  - - [256, 8192, 1, 8976]
    - [72, 73.922]
  - - [256, 8960, 1, 8976]
    - [73, 74.134]
  - - [256, 9728, 1, 8976]
    - [73, 80.206]
  - - [256, 9984, 1, 8976]
    - [73, 83.893]
  - - [256, 10240, 1, 8976]
    - [73, 84.24]
  - - [256, 10496, 1, 8976]
    - [73, 86.017]
  - - [256, 11008, 1, 8976]
    - [74, 72.46]
  - - [256, 11264, 1, 8976]
    - [59, 74.183]
  - - [256, 11520, 1, 8976]
    - [74, 75.676]
  - - [256, 11776, 1, 8976]
    - [74, 77.338]
  - - [256, 12544, 1, 8976]
    - [74, 82.236]
  - - [256, 12800, 1, 8976]
    - [74, 83.66]
  - - [256, 13312, 1, 8976]
    - [59, 86.765]
  - - [256, 13568, 1, 8976]
    - [75, 88.151]
  - - [256, 14336, 1, 8976]
    - [76, 77.661]
  - - [256, 14848, 1, 8976]
    - [77, 80.0]
  - - [256, 15104, 1, 8976]
    - [78, 82.096]
  - - [256, 15872, 1, 8976]
    - [58, 80.302]
  - - [256, 16128, 1, 8976]
    - [58, 81.201]
  - - [256, 17152, 1, 8976]
    - [79, 86.206]
  - - [256, 17408, 1, 8976]
    - [80, 87.086]
  - - [256, 18688, 1, 8976]
    - [60, 82.253]
  - - [256, 19968, 1, 8976]
    - [60, 87.901]
  - - [256, 20480, 1, 8976]
    - [81, 89.865]
  - - [256, 20992, 1, 8976]
    - [21, 91.925]
  - - [256, 21248, 1, 8976]
    - [82, 71.729]
  - - [256, 22016, 1, 8976]
    - [83, 74.311]
  - - [256, 26112, 1, 8976]
    - [84, 88.091]
  - - [256, 32512, 1, 8976]
    - [85, 86.827]
  - - [256, 32768, 1, 1]
    - [86, 0.231]
  - - [256, 33536, 1, 8976]
    - [87, 89.598]
  - - [256, 44505, 1, 8976]
    - [88, 84.483]
  - - [257, 4096, 1, 1024]
    - [89, 29.693]
  - - [480, 1024, 1, 32768]
    - [90, 52.904]
  - - [512, 32, 1, 200]
    - [3, 0.264]
  - - [512, 32, 1, 1600]
    - [5, 1.307]
  - - [512, 256, 1, 32768]
    - [91, 34.989]
  - - [512, 512, 1, 200]
    - [92, 4.018]
  - - [512, 512, 1, 1600]
    - [4, 16.019]
  - - [512, 2048, 1, 256]
    - [13, 15.589]
  - - [560, 1024, 1, 200]
    - [55, 7.737]
  - - [560, 1024, 1, 1600]
    - [2, 26.711]
  - - [768, 2048, 1, 256]
    - [93, 21.603]
  - - [1024, 64, 1, 512]
    - [1, 2.52]
  - - [1024, 64, 1, 960]
    - [12, 3.96]
  - - [1024, 256, 1, 1024]
    - [2, 12.601]
  - - [1024, 256, 1, 1280]
    - [2, 14.159]
  - - [1024, 256, 1, 2304]
    - [10, 18.391]
  - - [1024, 256, 1, 2816]
    - [2, 19.208]
  - - [1024, 256, 1, 3072]
    - [2, 20.073]
  - - [1024, 256, 1, 3328]
    - [2, 20.737]
  - - [1024, 256, 1, 3584]
    - [2, 21.255]
  - - [1024, 256, 1, 4096]
    - [2, 21.719]
  - - [1024, 256, 1, 4352]
    - [2, 22.393]
  - - [1024, 256, 1, 4608]
    - [2, 22.495]
  - - [1024, 256, 1, 5120]
    - [94, 23.228]
  - - [1024, 256, 1, 5376]
    - [95, 23.912]
  - - [1024, 256, 1, 5632]
    - [94, 24.248]
  - - [1024, 256, 1, 6144]
    - [96, 25.308]
  - - [1024, 256, 1, 6400]
    - [97, 26.072]
  - - [1024, 256, 1, 7680]
    - [96, 28.496]
  - - [1024, 256, 1, 7936]
    - [97, 28.794]
  - - [1024, 256, 1, 8192]
    - [97, 30.056]
  - - [1024, 256, 1, 8448]
    - [97, 30.098]
  - - [1024, 256, 1, 9728]
    - [97, 32.21]
  - - [1024, 256, 1, 9984]
    - [97, 32.984]
  - - [1024, 256, 1, 10496]
    - [97, 33.549]
  - - [1024, 256, 1, 11520]
    - [97, 34.264]
  - - [1024, 256, 1, 12032]
    - [97, 35.43]
  - - [1024, 256, 1, 13568]
    - [97, 37.07]
  - - [1024, 256, 1, 14336]
    - [97, 37.536]
  - - [1024, 256, 1, 14848]
    - [97, 37.87]
  - - [1024, 256, 1, 15104]
    - [97, 37.965]
  - - [1024, 256, 1, 15872]
    - [97, 38.205]
  - - [1024, 256, 1, 16128]
    - [96, 38.695]
  - - [1024, 256, 1, 17152]
    - [97, 39.392]
  - - [1024, 256, 1, 17408]
    - [97, 39.917]
  - - [1024, 256, 1, 18944]
    - [97, 40.544]
  - - [1024, 256, 1, 19712]
    - [97, 41.231]
  - - [1024, 256, 1, 19968]
    - [97, 41.097]
  - - [1024, 256, 1, 21248]
    - [97, 41.67]
  - - [1024, 256, 1, 21504]
    - [97, 41.949]
  - - [1024, 256, 1, 22016]
    - [97, 42.25]
  - - [1024, 256, 1, 28672]
    - [98, 45.067]
  - - [1024, 256, 1, 33536]
    - [98, 47.436]
  - - [1024, 512, 1, 32768]
    - [99, 57.249]
  - - [1024, 1024, 1, 200]
    - [100, 11.814]
  - - [1024, 1024, 1, 512]
    - [14, 24.389]
  - - [1024, 1024, 1, 960]
    - [14, 30.569]
  - - [1024, 1024, 1, 1600]
    - [56, 37.356]
  - - [1024, 1024, 1, 32768]
    - [101, 68.25]
  - - [1600, 1024, 1, 512]
    - [102, 34.243]
  - - [1600, 1024, 1, 960]
    - [103, 44.413]
  - - [2048, 256, 1, 1024]
    - [2, 20.366]
  - - [2048, 960, 1, 1]
    - [55, 0.126]
  - - [2048, 2048, 1, 512]
    - [93, 44.15]
  - - [2048, 2048, 1, 960]
    - [104, 54.855]
  - - [2048, 2048, 1, 1024]
    - [30, 55.556]
  - - [3200, 2048, 1, 1024]
    - [24, 67.507]
  - - [4096, 4096, 1, 1024]
    - [59, 74.331]
  - - [14, 64, 10880, 14]
    - [43, 1.684]
  - - [15, 64, 10880, 14]
    - [43, 1.742]
  - - [15, 64, 7680, 15]
    - [43, 1.762]
  - - [15, 64, 10880, 15]
    - [105, 1.86]
  - - [17, 64, 7680, 15]
    - [63, 1.555]
  - - [17, 64, 6144, 17]
    - [106, 1.629]
  - - [17, 64, 7680, 17]
    - [107, 1.688]
  - - [21, 64, 6144, 17]
    - [108, 1.997]
  - - [21, 64, 6144, 21]
    - [108, 2.467]
  - - [24, 64, 4736, 24]
    - [109, 4.106]
  - - [30, 64, 2048, 30]
    - [110, 3.098]
  - - [30, 64, 2048, 31]
    - [108, 3.239]
  - - [31, 64, 2048, 31]
    - [111, 2.844]
  - - [32, 64, 4608, 32]
    - [112, 7.595]
  - - [32, 64, 4608, 35]
    - [112, 6.598]
  - - [34, 64, 4736, 24]
    - [108, 2.751]
  - - [34, 64, 4736, 34]
    - [106, 3.728]
  - - [35, 64, 4608, 35]
    - [106, 3.822]
  - - [64, 14, 10880, 14]
    - [44, 2.034]
  - - [64, 15, 10880, 14]
    - [41, 2.145]
  - - [64, 15, 7680, 15]
    - [44, 2.167]
  - - [64, 15, 10880, 15]
    - [41, 2.292]
  - - [64, 17, 7680, 15]
    - [113, 2.319]
  - - [64, 17, 6144, 17]
    - [55, 2.345]
  - - [64, 17, 7680, 17]
    - [55, 2.44]
  - - [64, 21, 6144, 17]
    - [55, 2.839]
  - - [64, 21, 6144, 21]
    - [113, 3.428]
  - - [64, 24, 4736, 24]
    - [55, 4.203]
  - - [64, 30, 2048, 30]
    - [55, 4.764]
  - - [64, 30, 2048, 31]
    - [113, 4.819]
  - - [64, 31, 2048, 31]
    - [55, 4.962]
  - - [64, 32, 4608, 32]
    - [114, 7.912]
  - - [64, 32, 4608, 35]
    - [115, 6.879]
  - - [64, 34, 4736, 24]
    - [116, 4.675]
  - - [64, 34, 4736, 34]
    - [117, 6.027]
  - - [64, 35, 4608, 35]
    - [118, 6.148]
  - - [1024, 1024, 1, 3840]
    - [57, 49.633]
  - - [1024, 1024, 1, 3968]
    - [57, 49.922]
  - - [1024, 1024, 1, 6528]
    - [57, 55.323]
  - - [1024, 1024, 1, 7104]
    - [57, 56.213]
  - - [1024, 1024, 1, 7200]
    - [119, 55.341]
  - - [1024, 1024, 1, 8064]
    - [57, 57.321]
  - - [1024, 1024, 1, 8160]
    - [90, 56.773]
  - - [1024, 1024, 1, 9216]
    - [70, 59.789]
  - - [1024, 1024, 1, 9520]
    - [70, 60.143]
  - - [1024, 1024, 1, 10064]
    - [70, 61.507]
  - - [1024, 1024, 1, 10080]
    - [101, 61.257]
  - - [1024, 1024, 1, 10200]
    - [70, 61.511]
  - - [1024, 4096, 1, 3840]
    - [58, 74.89]
  - - [1024, 4096, 1, 3968]
    - [58, 74.764]
  - - [1024, 4096, 1, 6528]
    - [79, 80.776]
  - - [1024, 4096, 1, 7104]
    - [58, 81.52]
  - - [1024, 4096, 1, 7200]
    - [79, 81.788]
  - - [1024, 4096, 1, 8064]
    - [79, 82.769]
  - - [1024, 4096, 1, 8160]
    - [58, 82.323]
  - - [1024, 4096, 1, 9216]
    - [79, 83.51]
  - - [1024, 4096, 1, 9520]
    - [58, 82.168]
  - - [1024, 4096, 1, 10064]
    - [79, 83.245]
  - - [1024, 4096, 1, 10080]
    - [79, 84.847]
  - - [1024, 4096, 1, 10200]
    - [79, 83.637]
  - - [1024, 42720, 1, 3968]
    - [21, 91.037]
  - - [1024, 42720, 1, 6528]
    - [21, 92.695]
  - - [1024, 42720, 1, 7104]
    - [21, 92.931]
  - - [1024, 42720, 1, 7200]
    - [21, 92.86]
  - - [1024, 42720, 1, 9520]
    - [21, 93.151]
  - - [1024, 42720, 1, 10080]
    - [21, 93.556]
  - - [4096, 1024, 1, 3840]
    - [61, 71.105]
  - - [4096, 1024, 1, 3968]
    - [61, 71.842]
  - - [4096, 1024, 1, 6528]
    - [61, 76.947]
  - - [4096, 1024, 1, 7104]
    - [61, 78.729]
  - - [4096, 1024, 1, 7200]
    - [61, 78.668]
  - - [4096, 1024, 1, 8064]
    - [61, 80.208]
  - - [4096, 1024, 1, 8160]
    - [61, 80.184]
  - - [4096, 1024, 1, 9216]
    - [61, 81.236]
  - - [4096, 1024, 1, 9520]
    - [61, 80.119]
  - - [4096, 1024, 1, 10064]
    - [61, 80.144]
  - - [4096, 1024, 1, 10080]
    - [61, 81.816]
  - - [4096, 1024, 1, 10200]
    - [61, 80.001]
  - - [27, 64, 1920, 27]
    - [106, 2.78]
  - - [27, 64, 1920, 33]
    - [120, 3.316]
  - - [33, 64, 1920, 33]
    - [106, 2.991]
  - - [64, 27, 1920, 27]
    - [55, 3.809]
  - - [64, 27, 1920, 33]
    - [55, 4.486]
  - - [64, 33, 1920, 33]
    - [118, 4.46]
  - - [1024, 1024, 1, 3240]
    - [121, 44.716]
  - - [1024, 1024, 1, 3960]
    - [56, 47.884]
  - - [1024, 4096, 1, 3240]
    - [58, 69.657]
  - - [1024, 4096, 1, 3960]
    - [58, 72.307]
  - - [1024, 42720, 1, 3960]
    - [21, 90.024]
  - - [4096, 1024, 1, 3240]
    - [61, 67.389]
  - - [4096, 1024, 1, 3960]
    - [61, 70.509]
  - - [64, 1280, 64, 192]
    - [50, 27.262]
  - - [64, 1280, 64, 320]
    - [122, 36.35]
  - - [64, 1280, 64, 384]
    - [104, 39.517]
  - - [64, 1280, 64, 448]
    - [122, 42.408]
  - - [64, 2048, 64, 192]
    - [122, 30.143]
  - - [64, 2048, 64, 320]
    - [123, 38.429]
  - - [64, 2048, 64, 384]
    - [30, 41.477]
  - - [64, 2048, 64, 448]
    - [124, 43.967]
  - - [1225, 192, 64, 32]
    - [125, 8.349]
  - - [1225, 192, 64, 48]
    - [126, 11.849]
  - - [1225, 192, 64, 64]
    - [127, 15.012]
  - - [1225, 256, 64, 48]
    - [128, 12.376]
  - - [1225, 256, 64, 64]
    - [127, 15.578]
  - - [1225, 288, 64, 48]
    - [129, 10.951]
  - - [1225, 288, 64, 64]
    - [130, 14.011]
  - - [5329, 64, 64, 80]
    - [127, 15.31]
  - - [289, 768, 64, 128]
    - [30, 21.14]
  - - [289, 768, 64, 160]
    - [30, 24.598]
  - - [289, 768, 64, 192]
    - [131, 27.583]
  - - [64, 1280, 32, 192]
    - [30, 23.826]
  - - [64, 1280, 32, 320]
    - [50, 31.504]
  - - [64, 1280, 32, 384]
    - [50, 34.472]
  - - [64, 1280, 32, 448]
    - [50, 36.856]
  - - [64, 2048, 32, 192]
    - [123, 24.926]
  - - [64, 2048, 32, 320]
    - [30, 33.017]
  - - [64, 2048, 32, 384]
    - [30, 34.173]
  - - [64, 2048, 32, 448]
    - [132, 38.007]
  - - [1225, 192, 32, 32]
    - [125, 7.16]
  - - [1225, 192, 32, 48]
    - [133, 10.15]
  - - [1225, 192, 32, 64]
    - [127, 13.109]
  - - [1225, 256, 32, 48]
    - [133, 11.121]
  - - [1225, 256, 32, 64]
    - [127, 13.915]
  - - [1225, 288, 32, 48]
    - [54, 10.472]
  - - [1225, 288, 32, 64]
    - [129, 12.68]
  - - [5329, 64, 32, 80]
    - [127, 14.318]
  - - [289, 768, 32, 128]
    - [30, 18.161]
  - - [289, 768, 32, 160]
    - [30, 21.268]
  - - [289, 768, 32, 192]
    - [30, 24.387]
  - - [49, 512, 64, 2048]
    - [30, 33.108]
  - - [49, 2048, 64, 512]
    - [30, 28.433]
  - - [3136, 64, 32, 256]
    - [93, 28.764]
  - - [3136, 64, 32, 64]
    - [100, 12.758]
  - - [3136, 256, 32, 64]
    - [134, 18.561]
  - - [784, 128, 32, 512]
    - [132, 38.352]
  - - [784, 512, 32, 128]
    - [50, 29.497]
  - - [196, 256, 32, 1024]
    - [135, 32.961]
  - - [196, 1024, 32, 256]
    - [29, 29.734]
  - - [49, 512, 32, 2048]
    - [136, 24.246]
  - - [49, 2048, 32, 512]
    - [30, 24.864]
  - - [3136, 64, 64, 128]
    - [137, 22.841]
  - - [3136, 128, 64, 256]
    - [138, 41.187]
  - - [784, 256, 64, 512]
    - [23, 56.347]
  - - [3136, 256, 64, 128]
    - [35, 33.212]
  - - [3136, 256, 64, 256]
    - [35, 50.595]
  - - [196, 512, 64, 1024]
    - [81, 47.406]
  - - [784, 512, 64, 256]
    - [35, 50.543]
  - - [784, 512, 64, 512]
    - [139, 64.628]
  - - [196, 1024, 64, 512]
    - [30, 44.825]
  - - [196, 1024, 64, 1024]
    - [140, 53.097]
  - - [49, 1024, 64, 2048]
    - [136, 39.773]
  - - [49, 2048, 64, 1024]
    - [30, 36.809]
  - - [3136, 64, 32, 128]
    - [93, 19.875]
  - - [3136, 128, 32, 256]
    - [23, 39.163]
  - - [784, 256, 32, 512]
    - [132, 49.332]
  - - [3136, 256, 32, 128]
    - [35, 31.477]
  - - [3136, 256, 32, 256]
    - [139, 48.146]
  - - [196, 512, 32, 1024]
    - [30, 42.004]
  - - [784, 512, 32, 256]
    - [139, 44.105]
  - - [784, 512, 32, 512]
    - [23, 57.35]
  - - [196, 1024, 32, 512]
    - [30, 40.139]
  - - [196, 1024, 32, 1024]
    - [81, 48.303]
  - - [49, 1024, 32, 2048]
    - [30, 34.146]
  - - [49, 2048, 32, 1024]
    - [141, 32.786]
  - - [7680, 8192, 1, 8192]
    - [28, 95.68]
  - - [3840, 4096, 1, 4096]
    - [21, 89.599]
  - - [1920, 2048, 1, 2048]
    - [119, 69.739]
  - - [960, 1024, 1, 1024]
    - [14, 30.57]
  - - [480, 512, 1, 512]
    - [9, 7.501]
  - - [8192, 7680, 1, 8192]
    - [28, 95.639]
  - - [4096, 3840, 1, 4096]
    - [60, 89.854]
  - - [2048, 1920, 1, 2048]
    - [56, 70.827]
  - - [1024, 960, 1, 1024]
    - [119, 29.612]
  - - [512, 480, 1, 512]
    - [9, 7.541]
  - - [8192, 8192, 1, 8192]
    - [142, 95.786]
  - - [4096, 4096, 1, 4096]
    - [59, 87.563]
  - - [2048, 2048, 1, 2048]
    - [58, 64.996]
  - - [512, 512, 1, 512]
    - [13, 8.495]
  - - [64, 512, 16, 512]
    - [14, 15.275]
  - - [1024, 2, 1, 1]
    - [44, 0.0]
  - - [1024, 2, 1, 512]
    - [3, 0.073]
  - - [1024, 1024, 1, 1]
    - [143, 0.083]
  - - [1024, 1024, 1, 77]
    - [55, 5.65]
  - - [1024, 4096, 1, 512]
    - [93, 43.99]
  - - [1024, 30522, 1, 77]
    - [144, 19.001]
  - - [4096, 1024, 1, 512]
    - [93, 44.475]
  - - [64, 128, 160, 128]
    - [117, 11.456]
  - - [1024, 2, 1, 10]
    - [41, 0.002]
  - - [1024, 2, 1, 1280]
    - [3, 0.128]
  - - [1024, 1024, 1, 10]
    - [55, 0.856]
  - - [1024, 1024, 1, 1280]
    - [4, 34.212]
  - - [1024, 4096, 1, 1280]
    - [21, 58.725]
  - - [1024, 30522, 1, 200]
    - [144, 41.089]
  - - [4096, 1024, 1, 1280]
    - [87, 58.442]
  - - [64, 128, 624, 128]
    - [145, 18.113]
  - - [1024, 2, 1, 39]
    - [52, 0.008]
  - - [1024, 2, 1, 4992]
    - [146, 0.295]
  - - [1024, 1024, 1, 39]
    - [55, 3.2]
  - - [1024, 1024, 1, 780]
    - [14, 26.479]
  - - [1024, 1024, 1, 4992]
    - [57, 53.274]
  - - [1024, 4096, 1, 4992]
    - [58, 77.675]
  - - [1024, 30522, 1, 780]
    - [35, 73.184]
  - - [4096, 1024, 1, 4992]
    - [61, 75.247]
  - - [1024, 1024, 1, 308]
    - [147, 16.029]
  - - [1024, 30522, 1, 308]
    - [23, 53.321]
  - - [64, 128, 640, 128]
    - [148, 18.263]
  - - [1024, 2, 1, 40]
    - [41, 0.008]
  - - [1024, 2, 1, 5120]
    - [146, 0.296]
  - - [1024, 1024, 1, 40]
    - [55, 3.259]
  - - [1024, 1024, 1, 800]
    - [16, 28.382]
  - - [1024, 1024, 1, 5120]
    - [57, 53.152]
  - - [1024, 4096, 1, 5120]
    - [58, 77.972]
  - - [1024, 30522, 1, 800]
    - [35, 75.524]
  - - [4096, 1024, 1, 5120]
    - [61, 75.49]
  - - [64, 128, 656, 128]
    - [122, 18.365]
  - - [1024, 2, 1, 41]
    - [41, 0.009]
  - - [1024, 2, 1, 5248]
    - [146, 0.302]
  - - [1024, 1024, 1, 41]
    - [55, 3.364]
  - - [1024, 1024, 1, 820]
    - [14, 26.541]
  - - [1024, 1024, 1, 5248]
    - [57, 53.081]
  - - [1024, 4096, 1, 5248]
    - [58, 78.356]
  - - [1024, 30522, 1, 820]
    - [23, 74.592]
  - - [4096, 1024, 1, 5248]
    - [61, 75.562]
  - - [64, 512, 80, 512]
    - [49, 33.455]
  - - [1024, 2, 1, 5]
    - [41, 0.001]
  - - [1024, 2, 1, 2560]
    - [149, 0.176]
  - - [1024, 1024, 1, 5]
    - [150, 0.434]
  - - [1024, 1024, 1, 385]
    - [151, 19.191]
  - - [1024, 1024, 1, 2560]
    - [56, 43.704]
  - - [1024, 4096, 1, 2560]
    - [58, 68.54]
  - - [1024, 30522, 1, 385]
    - [152, 59.591]
  - - [4096, 1024, 1, 2560]
    - [60, 66.106]
  - - [64, 512, 96, 512]
    - [49, 34.896]
  - - [1024, 2, 1, 6]
    - [44, 0.001]
  - - [1024, 2, 1, 3072]
    - [149, 0.201]
  - - [1024, 1024, 1, 6]
    - [86, 0.506]
  - - [1024, 1024, 1, 462]
    - [16, 20.442]
  - - [1024, 1024, 1, 3072]
    - [119, 46.468]
  - - [1024, 4096, 1, 3072]
    - [58, 71.056]
  - - [1024, 30522, 1, 462]
    - [152, 63.08]
  - - [4096, 1024, 1, 3072]
    - [61, 68.476]
  - - [64, 128, 128, 128]
    - [100, 9.819]
  - - [1024, 2, 1, 8]
    - [41, 0.002]
  - - [1024, 2, 1, 1024]
    - [3, 0.114]
  - - [1024, 1024, 1, 8]
    - [55, 0.695]
  - - [1024, 1024, 1, 160]
    - [117, 10.619]
  - - [1024, 4096, 1, 1024]
    - [21, 55.684]
  - - [1024, 30522, 1, 160]
    - [26, 38.017]
  - - [4096, 1024, 1, 1024]
    - [21, 55.748]
  - - [64, 128, 144, 128]
    - [100, 10.699]
  - - [1024, 2, 1, 9]
    - [41, 0.002]
  - - [1024, 2, 1, 1152]
    - [3, 0.121]
  - - [1024, 1024, 1, 9]
    - [55, 0.782]
  - - [1024, 1024, 1, 180]
    - [100, 11.018]
  - - [1024, 1024, 1, 1152]
    - [14, 32.716]
  - - [1024, 4096, 1, 1152]
    - [21, 57.243]
  - - [1024, 30522, 1, 180]
    - [152, 38.275]
  - - [4096, 1024, 1, 1152]
    - [21, 57.545]
  - - [479, 1024, 1, 32768]
    - [153, 36.91]
  - - [4, 64, 32768, 4]
    - [38, 0.199]
  - - [4, 64, 38400, 4]
    - [38, 0.2]
  - - [64, 4, 32768, 4]
    - [41, 0.207]
  - - [64, 4, 38400, 4]
    - [41, 0.209]
  - - [1024, 1024, 1, 8192]
    - [101, 57.538]
  - - [1024, 1024, 1, 9600]
    - [101, 60.616]
  - - [1024, 4096, 1, 8192]
    - [79, 83.358]
  - - [1024, 4096, 1, 9600]
    - [79, 84.243]
  - - [1024, 33712, 1, 8192]
    - [22, 93.449]
  - - [1024, 33712, 1, 9600]
    - [22, 93.917]
  - - [4096, 1024, 1, 8192]
    - [61, 79.604]
  - - [4096, 1024, 1, 9600]
    - [61, 79.421]
  - - [64, 128, 1, 128]
    - [44, 0.104]
  - - [128, 64, 1, 128]
    - [45, 0.103]
  - - [5, 64, 1, 5]
    - [53, 0.0]
  - - [2048, 512, 1, 1]
    - [55, 0.084]
  - - [33, 32, 1, 33]
    - [3, 0.003]
  - - [1024, 1600, 1, 1]
    - [55, 0.112]
  - - [64, 1024, 32, 1024]
    - [30, 41.572]
  - - [2560, 1920, 1, 2048]
    - [21, 75.058]
  - - [1024, 3072, 1, 4096]
    - [60, 76.808]
  - - [2560, 2560, 1, 2048]
    - [21, 76.877]
  - - [2048, 2, 1, 2]
    - [41, 0.001]
  - - [1024, 64, 128, 1024]
    - [154, 51.314]
  - - [2048, 2048, 1, 2]
    - [143, 0.369]
  - - [1024, 64, 32, 1024]
    - [155, 40.459]
  - - [1024, 96, 64, 1024]
    - [119, 59.495]
  - - [1024, 30592, 1, 2048]
    - [24, 86.658]
  - - [1024, 3072, 1, 16384]
    - [156, 76.941]
  - - [6144, 1536, 1, 4096]
    - [119, 83.414]
  - - [1024, 1024, 1, 16]
    - [55, 1.477]
  - - [1536, 4608, 1, 8192]
    - [157, 93.043]
  - - [640, 2560, 1, 2048]
    - [21, 59.254]
  - - [1024, 4096, 1, 16384]
    - [79, 86.924]
  - - [64, 512, 40, 512]
    - [30, 26.436]
  - - [1024, 1024, 1, 16384]
    - [57, 62.681]
  - - [1536, 6144, 1, 4096]
    - [56, 83.622]
  - - [1024, 30592, 1, 4096]
    - [158, 91.705]
  - - [2560, 2560, 1, 4]
    - [150, 0.849]
  - - [1536, 1536, 1, 4096]
    - [159, 71.771]
  - - [2560, 7680, 1, 2048]
    - [21, 87.073]
  - - [64, 1024, 256, 1024]
    - [124, 56.006]
  - - [96, 1024, 64, 1024]
    - [135, 54.086]
  - - [1536, 50304, 1, 4096]
    - [21, 93.774]
  - - [2048, 8192, 1, 1024]
    - [35, 75.139]
  - - [1024, 30592, 1, 8192]
    - [158, 94.034]
  - - [512, 64, 256, 512]
    - [154, 39.599]
  - - [1024, 96, 128, 1024]
    - [160, 63.254]
  - - [64, 512, 128, 512]
    - [161, 36.493]
  - - [4096, 1024, 1, 16384]
    - [61, 83.529]
  - - [8192, 2048, 1, 1024]
    - [59, 74.589]
  - - [64, 1024, 64, 1024]
    - [103, 48.389]
  - - [1024, 50304, 1, 4096]
    - [87, 92.715]
  - - [1536, 4608, 1, 4096]
    - [24, 89.024]
  - - [512, 64, 128, 512]
    - [25, 36.438]
  - - [6144, 1536, 1, 8192]
    - [119, 86.298]
  - - [1024, 3072, 1, 8192]
    - [60, 80.739]
  - - [1536, 1536, 1, 8192]
    - [73, 78.526]
  - - [1536, 50304, 1, 8192]
    - [21, 95.815]
  - - [2560, 2, 1, 4]
    - [52, 0.002]
  - - [2048, 6144, 1, 1024]
    - [21, 77.34]
  - - [64, 1024, 128, 1024]
    - [162, 53.088]
  - - [1024, 64, 64, 1024]
    - [155, 49.126]
  - - [1024, 2, 1, 16]
    - [41, 0.004]
  - - [96, 1024, 128, 1024]
    - [163, 57.629]
  - - [2048, 30592, 1, 1024]
    - [35, 83.447]
  - - [64, 512, 256, 512]
    - [103, 40.904]
  - - [1536, 6144, 1, 8192]
    - [56, 86.495]
  - - [1024, 50304, 1, 2048]
    - [35, 88.871]
  - - [1024, 50304, 1, 8192]
    - [21, 94.691]
  - - [1024, 3072, 1, 2048]
    - [21, 69.927]
  - - [1024, 64, 256, 1024]
    - [154, 54.006]
  - - [1024, 50304, 1, 16384]
    - [87, 95.735]
  - - [512, 64, 40, 512]
    - [164, 25.982]
  - - [1024, 2, 1, 64]
    - [41, 0.014]
  - - [1024, 30528, 1, 8192]
    - [24, 93.709]
  - - [1024, 1024, 1, 64]
    - [55, 5.214]
  - - [64, 128, 1024, 128]
    - [49, 20.196]
  - - [128, 64, 1024, 128]
    - [154, 19.202]
  - - [1024, 1024, 1, 3456]
    - [119, 48.147]
  - - [1024, 1024, 1, 6912]
    - [57, 55.776]
  - - [1024, 1024, 1, 864]
    - [13, 29.845]
  - - [1024, 512, 1, 3456]
    - [165, 31.025]
  - - [1024, 512, 1, 4096]
    - [90, 33.604]
  - - [1024, 512, 1, 6912]
    - [90, 43.854]
  - - [1024, 512, 1, 864]
    - [14, 18.972]
  - - [256, 128, 1, 3456]
    - [5, 3.635]
  - - [256, 128, 1, 4096]
    - [65, 3.838]
  - - [256, 128, 1, 55296]
    - [166, 20.517]
  - - [256, 128, 1, 6912]
    - [167, 5.88]
  - - [256, 128, 1, 864]
    - [17, 1.706]
  - - [256, 3456, 1, 1]
    - [55, 0.078]
  - - [256, 4096, 1, 1]
    - [55, 0.091]
  - - [256, 6912, 1, 1]
    - [55, 0.122]
  - - [256, 864, 1, 1]
    - [46, 0.022]
  - - [480, 1024, 1, 3456]
    - [165, 28.48]
  - - [480, 1024, 1, 4096]
    - [90, 30.987]
  - - [480, 1024, 1, 6912]
    - [90, 40.633]
  - - [480, 1024, 1, 864]
    - [14, 17.787]
  - - [512, 256, 1, 3456]
    - [168, 10.744]
  - - [512, 256, 1, 4096]
    - [169, 12.319]
  - - [512, 256, 1, 55296]
    - [170, 40.89]
  - - [512, 256, 1, 6912]
    - [168, 17.448]
  - - [512, 256, 1, 864]
    - [3, 5.962]
  - - [30528, 1024, 1, 640]
    - [139, 70.242]
  - - [30528, 1024, 1, 1280]
    - [139, 81.714]
  - - [4096, 1024, 1, 10240]
    - [61, 82.03]
  - - [1024, 4096, 1, 10240]
    - [79, 84.983]
  - - [30528, 1024, 1, 1600]
    - [171, 83.645]
  - - [1024, 2, 1, 80]
    - [44, 0.016]
  - - [1024, 1024, 1, 10240]
    - [101, 61.911]
  - - [1024, 1024, 1, 80]
    - [114, 6.259]
  - - [64, 128, 1280, 128]
    - [122, 21.664]
  - - [128, 64, 1280, 128]
    - [51, 19.767]
  - - [1024, 4096, 1, 10496]
    - [79, 85.236]
  - - [30528, 1024, 1, 1640]
    - [139, 83.253]
  - - [4096, 1024, 1, 10496]
    - [61, 80.257]
  - - [1024, 1024, 1, 10496]
    - [101, 62.092]
  - - [1024, 1024, 1, 82]
    - [55, 5.871]
  - - [1024, 2, 1, 82]
    - [52, 0.016]
  - - [128, 64, 1312, 128]
    - [154, 20.0]
  - - [64, 128, 1312, 128]
    - [122, 21.831]
  - - [30528, 1024, 1, 160]
    - [144, 35.11]
  - - [1024, 4096, 1, 6144]
    - [58, 79.828]
  - - [30528, 1024, 1, 240]
    - [144, 46.367]
  - - [4096, 1024, 1, 6144]
    - [61, 76.808]
  - - [1024, 1024, 1, 12]
    - [55, 1.02]
  - - [1024, 2, 1, 12]
    - [41, 0.003]
  - - [1024, 1024, 1, 6144]
    - [57, 55.535]
  - - [64, 512, 192, 512]
    - [172, 40.823]
  - - [512, 64, 192, 512]
    - [173, 38.857]
  - - [13, 512, 1, 3456]
    - [174, 0.73]
  - - [13, 512, 1, 4096]
    - [174, 0.873]
  - - [13, 512, 1, 55296]
    - [62, 4.397]
  - - [13, 512, 1, 6912]
    - [174, 1.286]
  - - [13, 512, 1, 864]
    - [3, 0.327]
  - - [1024, 1024, 1, 10224]
    - [70, 61.437]
  - - [1024, 1024, 1, 10192]
    - [70, 61.874]
  - - [1024, 1024, 1, 10208]
    - [101, 61.56]
  - - [1024, 4096, 1, 10224]
    - [79, 83.17]
  - - [4096, 1024, 1, 10224]
    - [61, 81.063]
  - - [1024, 3072, 1, 10224]
    - [74, 81.538]
  - - [1024, 3072, 1, 10240]
    - [60, 81.555]
  - - [4096, 1024, 1, 10192]
    - [61, 80.512]
  - - [1024, 3072, 1, 10192]
    - [74, 81.558]
  - - [1024, 4096, 1, 10192]
    - [79, 83.558]
  - - [1024, 3072, 1, 10200]
    - [74, 80.873]
  - - [1024, 1024, 1, 10184]
    - [70, 61.352]
  - - [4096, 1024, 1, 10208]
    - [61, 80.585]
  - - [1024, 3072, 1, 10208]
    - [156, 81.667]
  - - [1024, 4096, 1, 10208]
    - [79, 84.185]
  - - [1024, 2048, 1, 10224]
    - [72, 74.766]
  - - [1024, 2048, 1, 10240]
    - [72, 76.59]
  - - [1024, 1024, 1, 10120]
    - [70, 61.342]
  - - [1024, 2048, 1, 10192]
    - [71, 75.23]
  - - [64, 24, 6816, 24]
    - [150, 4.515]
  - - [1024, 1024, 1, 10152]
    - [70, 61.504]
  - - [1024, 3072, 1, 10080]
    - [175, 81.508]
  - - [64, 26, 6272, 26]
    - [176, 5.07]
  - - [100352, 256, 1, 512]
    - [26, 61.695]
  - - [12544, 1024, 1, 2048]
    - [177, 78.099]
  - - [12544, 147, 1, 64]
    - [32, 7.306]
  - - [200704, 256, 1, 512]
    - [178, 60.822]
  - - [25088, 512, 1, 1024]
    - [28, 69.672]
  - - [3136, 576, 1, 64]
    - [179, 8.09]
  - - [50176, 512, 1, 1024]
    - [180, 76.447]
  - - [6272, 1024, 1, 2048]
    - [142, 75.531]
  - - [784, 1152, 1, 128]
    - [117, 8.403]
  - - [3136, 256, 128, 128]
    - [35, 34.225]
  - - [3136, 256, 256, 128]
    - [35, 34.75]
  - - [784, 512, 128, 256]
    - [23, 55.11]
  - - [784, 512, 256, 256]
    - [35, 57.584]
  - - [64, 128, 2048, 128]
    - [122, 22.912]
  - - [128, 64, 2048, 128]
    - [51, 20.626]
  - - [30528, 1024, 1, 2560]
    - [181, 87.571]
  - - [1024, 1024, 1, 128]
    - [55, 8.791]
  - - [1024, 2, 1, 128]
    - [44, 0.026]
  - - [128, 64, 1536, 128]
    - [182, 20.229]
  - - [64, 128, 1536, 128]
    - [122, 21.995]
  - - [1024, 4096, 1, 12288]
    - [79, 85.217]
  - - [30528, 1024, 1, 1920]
    - [171, 85.522]
  - - [1024, 1024, 1, 96]
    - [55, 7.224]
  - - [1024, 1024, 1, 12288]
    - [57, 61.072]
  - - [4096, 1024, 1, 12288]
    - [61, 82.074]
  - - [1024, 2, 1, 96]
    - [44, 0.02]
  - - [25600, 128, 25, 128]
    - [183, 29.005]
  - - [12544, 128, 36, 128]
    - [184, 30.072]
  - - [9216, 128, 49, 128]
    - [184, 30.851]
  - - [6400, 128, 64, 128]
    - [34, 30.748]
  - - [6400, 256, 25, 256]
    - [185, 51.009]
  - - [4096, 256, 36, 256]
    - [23, 52.269]
  - - [2304, 256, 49, 256]
    - [185, 50.216]
  - - [2304, 256, 64, 256]
    - [185, 51.502]
  - - [2304, 512, 25, 512]
    - [35, 68.735]
  - - [1024, 512, 36, 512]
    - [35, 65.273]
  - - [1024, 512, 49, 512]
    - [35, 67.637]
  - - [1024, 512, 64, 512]
    - [35, 69.801]
  - - [92416, 64, 25, 64]
    - [144, 15.488]
  - - [50176, 64, 36, 64]
    - [144, 15.814]
  - - [36864, 64, 49, 64]
    - [144, 16.152]
  - - [25600, 64, 64, 64]
    - [144, 16.253]
  - - [64, 128, 192, 128]
    - [14, 12.395]
  - - [128, 64, 192, 128]
    - [186, 11.938]
  - - [768, 2, 1, 2048]
    - [53, 0.113]
  - - [3072, 768, 1, 2048]
    - [73, 62.215]
  - - [768, 3072, 1, 2048]
    - [119, 62.429]
  - - [768, 768, 1, 2048]
    - [165, 29.977]
  - - [64, 384, 144, 384]
    - [50, 36.804]
  - - [384, 64, 144, 384]
    - [186, 32.855]
  - - [768, 2, 1, 4608]
    - [11, 0.232]
  - - [3072, 768, 1, 4608]
    - [73, 73.609]
  - - [768, 3072, 1, 4608]
    - [159, 73.433]
  - - [768, 768, 1, 4608]
    - [187, 40.398]
  - - [64, 512, 48, 512]
    - [172, 29.845]
  - - [512, 64, 48, 512]
    - [154, 29.845]
  - - [64, 128, 256, 128]
    - [117, 13.747]
  - - [128, 64, 256, 128]
    - [188, 13.623]
  - - [64, 384, 192, 384]
    - [124, 35.503]
  - - [384, 64, 192, 384]
    - [32, 34.367]
  - - [1024, 2, 1, 4608]
    - [146, 0.269]
  - - [4096, 1024, 1, 4608]
    - [61, 73.515]
  - - [1024, 4096, 1, 4608]
    - [58, 76.646]
  - - [1024, 1024, 1, 4608]
    - [119, 51.405]
  - - [196, 2304, 1, 256]
    - [15, 7.156]
  - - [49, 4608, 1, 512]
    - [15, 6.512]
  - - [196, 1024, 128, 512]
    - [30, 47.045]
  - - [196, 1024, 256, 512]
    - [30, 48.828]
  - - [49, 2048, 128, 512]
    - [30, 31.146]
  - - [49, 2048, 256, 512]
    - [30, 32.606]
  - - [49, 512, 128, 2048]
    - [103, 37.593]
  - - [49, 512, 256, 2048]
    - [30, 41.302]
  - - [4880, 256, 49, 256]
    - [35, 53.308]
  - - [3128, 256, 64, 256]
    - [35, 52.64]
  - - [4680, 256, 49, 256]
    - [23, 53.145]
  - - [5280, 256, 36, 256]
    - [35, 51.166]
  - - [2640, 256, 64, 256]
    - [35, 52.286]
  - - [5304, 256, 49, 256]
    - [21, 52.26]
  - - [2760, 256, 64, 256]
    - [35, 52.464]
  - - [6440, 256, 36, 256]
    - [23, 51.826]
  - - [5704, 256, 36, 256]
    - [139, 51.853]
  - - [2128, 256, 64, 256]
    - [35, 51.915]
  - - [1160, 256, 49, 256]
    - [139, 44.505]
  - - [4056, 256, 49, 256]
    - [35, 51.817]
  - - [6144, 256, 36, 256]
    - [139, 52.58]
  - - [6336, 256, 36, 256]
    - [139, 50.229]
  - - [13600, 512, 2, 128]
    - [35, 29.149]
  - - [15200, 512, 2, 128]
    - [35, 29.38]
  - - [15200, 128, 2, 512]
    - [23, 41.035]
  - - [13600, 128, 2, 512]
    - [21, 46.924]
  - - [5632, 256, 36, 256]
    - [185, 52.271]
  - - [12288, 128, 2, 512]
    - [21, 45.365]
  - - [12880, 128, 2, 512]
    - [21, 45.071]
  - - [768, 512, 2, 2048]
    - [189, 39.363]
  - - [11408, 128, 2, 512]
    - [190, 41.089]
  - - [13824, 512, 2, 128]
    - [35, 29.039]
  - - [13824, 128, 2, 512]
    - [21, 48.956]
  - - [10560, 128, 2, 512]
    - [30, 39.579]
  - - [10752, 128, 2, 512]
    - [21, 39.497]
  - - [13600, 512, 2, 256]
    - [23, 44.58]
  - - [15200, 512, 2, 256]
    - [23, 44.448]
  - - [768, 2048, 2, 512]
    - [21, 44.694]
  - - [12880, 512, 2, 128]
    - [34, 29.307]
  - - [11616, 128, 2, 512]
    - [191, 41.037]
  - - [14208, 512, 2, 128]
    - [34, 28.781]
  - - [11408, 512, 2, 128]
    - [35, 29.298]
  - - [6912, 256, 36, 256]
    - [185, 52.449]
  - - [672, 512, 2, 2048]
    - [4, 34.82]
  - - [13824, 512, 2, 256]
    - [24, 46.396]
  - - [11616, 512, 2, 128]
    - [35, 28.447]
  - - [12288, 512, 2, 128]
    - [34, 28.758]
  - - [14208, 128, 2, 512]
    - [192, 38.783]
  - - [11968, 128, 2, 512]
    - [21, 43.424]
  - - [864, 2048, 2, 512]
    - [193, 41.832]
  - - [1008, 512, 2, 2048]
    - [163, 42.153]
  - - [10560, 512, 2, 128]
    - [134, 27.552]
  - - [672, 2048, 2, 512]
    - [21, 39.994]
  - - [9408, 128, 2, 512]
    - [32, 37.147]
  - - [10752, 512, 2, 128]
    - [35, 26.288]
  - - [11968, 512, 2, 128]
    - [35, 28.878]
  - - [1240, 256, 49, 256]
    - [139, 46.684]
  - - [4032, 256, 2, 1024]
    - [56, 45.713]
  - - [888, 2048, 2, 512]
    - [144, 44.358]
  - - [12880, 512, 2, 256]
    - [23, 43.376]
  - - [12288, 512, 2, 256]
    - [34, 44.972]
  - - [13440, 128, 2, 512]
    - [21, 47.143]
  - - [864, 2048, 2, 256]
    - [144, 29.933]
  - - [12672, 128, 2, 512]
    - [21, 45.866]
  - - [11264, 128, 2, 512]
    - [21, 41.689]
  - - [11776, 128, 2, 512]
    - [21, 43.151]
  - - [16128, 128, 2, 512]
    - [23, 43.382]
  - - [4032, 1024, 2, 256]
    - [35, 41.348]
  - - [14000, 128, 2, 512]
    - [194, 50.548]
  - - [13440, 512, 2, 128]
    - [24, 28.072]
  - - [864, 512, 2, 2048]
    - [163, 36.26]
  - - [768, 2048, 2, 256]
    - [194, 30.446]
  - - [3264, 1024, 2, 256]
    - [35, 40.0]
  - - [888, 512, 2, 2048]
    - [163, 37.135]
  - - [4200, 256, 2, 1024]
    - [119, 47.71]
  - - [2352, 1024, 2, 256]
    - [23, 37.347]
  - - [56, 512, 64, 512]
    - [123, 28.003]
  - - [2400, 1024, 2, 256]
    - [195, 36.632]
  - - [15200, 256, 2, 12]
    - [134, 2.956]
  - - [840, 512, 2, 2048]
    - [163, 34.517]
  - - [12880, 256, 2, 12]
    - [100, 2.914]
  - - [2520, 1024, 2, 256]
    - [23, 38.865]
  - - [13600, 256, 2, 12]
    - [134, 2.81]
  - - [15200, 256, 2, 3]
    - [117, 0.756]
  - - [12880, 256, 2, 3]
    - [134, 0.75]
  - - [4200, 1024, 2, 256]
    - [152, 43.601]
  - - [12288, 256, 2, 12]
    - [143, 2.532]
  - - [768, 256, 2, 12]
    - [46, 0.462]
  - - [13824, 256, 2, 12]
    - [157, 2.518]
  - - [864, 256, 2, 3]
    - [46, 0.131]
  - - [176, 256, 2, 3]
    - [41, 0.029]
  - - [864, 256, 2, 12]
    - [196, 0.507]
  - - [13600, 256, 2, 3]
    - [100, 0.731]
  - - [768, 256, 2, 3]
    - [46, 0.117]
  - - [7600, 512, 1, 256]
    - [123, 31.437]
  - - [6144, 512, 1, 256]
    - [87, 30.861]
  - - [12544, 1024, 1, 1024]
    - [144, 70.233]
  - - [1024, 81, 1, 1024]
    - [12, 4.882]
  - - [176, 256, 2, 12]
    - [44, 0.109]
  - - [216, 256, 2, 3]
    - [41, 0.034]
  - - [192, 256, 2, 12]
    - [197, 0.121]
  - - [3800, 256, 2, 3]
    - [118, 0.414]
  - - [13824, 256, 2, 3]
    - [198, 0.666]
  - - [12288, 256, 2, 3]
    - [199, 0.641]
  - - [192, 256, 2, 3]
    - [41, 0.031]
  - - [216, 256, 2, 12]
    - [46, 0.133]
  - - [2688, 256, 2, 1024]
    - [21, 38.168]
  - - [3072, 256, 2, 12]
    - [55, 1.337]
  - - [3800, 256, 2, 12]
    - [100, 1.575]
  - - [3072, 256, 2, 3]
    - [55, 0.332]
  - - [2520, 256, 2, 1024]
    - [200, 39.07]
  - - [16128, 512, 2, 128]
    - [34, 28.152]
  - - [2400, 256, 2, 1024]
    - [4, 37.504]
  - - [2352, 256, 2, 1024]
    - [4, 36.95]
  - - [2944, 256, 2, 1024]
    - [21, 41.802]
  - - [2992, 1024, 2, 256]
    - [201, 39.449]
  - - [2816, 256, 2, 1024]
    - [21, 39.89]
  - - [2904, 1024, 2, 256]
    - [50, 38.034]
  - - [3456, 256, 2, 3]
    - [143, 0.36]
  - - [3400, 256, 2, 3]
    - [118, 0.387]
  - - [2816, 1024, 2, 256]
    - [34, 33.604]
  - - [3456, 256, 2, 12]
    - [143, 1.433]
  - - [2944, 1024, 2, 256]
    - [202, 34.99]
  - - [3168, 256, 2, 1024]
    - [102, 44.449]
  - - [2992, 256, 2, 1024]
    - [102, 43.424]
  - - [51520, 256, 2, 12]
    - [113, 3.29]
  - - [3072, 256, 2, 1024]
    - [21, 43.411]
  - - [2640, 1024, 2, 256]
    - [50, 36.435]
  - - [2688, 1024, 2, 256]
    - [30, 32.603]
  - - [2904, 256, 2, 1024]
    - [102, 42.251]
  - - [3264, 256, 2, 1024]
    - [102, 46.57]
  - - [54400, 256, 2, 12]
    - [203, 2.917]
  - - [55296, 256, 2, 3]
    - [144, 0.761]
  - - [60800, 256, 2, 12]
    - [144, 2.989]
  - - [51520, 256, 2, 3]
    - [116, 0.862]
  - - [55296, 256, 2, 12]
    - [113, 2.931]
  - - [3600, 1024, 2, 256]
    - [104, 39.673]
  - - [60800, 256, 2, 3]
    - [55, 0.764]
  - - [952, 256, 64, 256]
    - [23, 44.586]
  - - [49152, 256, 2, 12]
    - [115, 2.992]
  - - [3360, 256, 2, 1024]
    - [102, 47.368]
  - - [736, 256, 64, 256]
    - [34, 43.584]
  - - [600, 256, 64, 256]
    - [139, 42.005]
  - - [1440, 256, 49, 256]
    - [139, 45.862]
  - - [3168, 1024, 2, 256]
    - [34, 38.583]
  - - [1368, 256, 49, 256]
    - [23, 47.408]
  - - [49152, 256, 2, 3]
    - [113, 0.757]
  - - [3600, 256, 2, 1024]
    - [56, 41.291]
  - - [3360, 1024, 2, 256]
    - [152, 41.262]
  - - [54400, 256, 2, 3]
    - [203, 0.75]
  - - [3072, 1024, 2, 256]
    - [23, 36.659]
  - - [2640, 256, 2, 1024]
    - [102, 38.599]
  - - [616, 256, 64, 256]
    - [23, 42.372]
  - - [3008, 256, 64, 256]
    - [139, 49.91]
  - - [896, 256, 64, 256]
    - [139, 44.336]
  - - [768, 256, 64, 256]
    - [23, 45.252]
  - - [3552, 256, 2, 1024]
    - [119, 40.271]
  - - [3552, 1024, 2, 256]
    - [50, 38.854]
  - - [800, 256, 64, 256]
    - [50, 41.181]
  - - [1120, 256, 49, 256]
    - [34, 43.618]
  - - [2408, 256, 64, 256]
    - [35, 51.489]
  - - [3456, 256, 2, 1024]
    - [204, 47.585]
  - - [672, 256, 64, 256]
    - [35, 41.295]
  - - [3456, 1024, 2, 256]
    - [35, 41.075]
  - - [1064, 256, 49, 256]
    - [139, 43.596]
  - - [3400, 256, 2, 1024]
    - [102, 49.589]
  - - [704, 256, 64, 256]
    - [34, 40.719]
  - - [3400, 1024, 2, 256]
    - [35, 40.987]
  - - [3264, 256, 64, 256]
    - [35, 50.013]
  - - [3800, 1024, 2, 256]
    - [144, 40.59]
  - - [3800, 256, 2, 1024]
    - [56, 43.84]
  - - [6440, 512, 1, 256]
    - [152, 31.49]
  - - [6912, 512, 1, 256]
    - [194, 33.911]
  - - [6800, 512, 1, 256]
    - [152, 32.924]
  - - [6800, 512, 1, 1024]
    - [21, 63.255]
  - - [6440, 512, 1, 1024]
    - [205, 61.455]
  - - [6912, 512, 1, 1024]
    - [21, 66.173]
  - - [1728, 1024, 1, 512]
    - [206, 36.324]
  - - [1536, 1024, 1, 512]
    - [186, 32.288]
  - - [7600, 512, 1, 1024]
    - [207, 54.747]
  - - [6144, 512, 1, 1024]
    - [194, 58.915]
  - - [1728, 1024, 1, 2048]
    - [103, 58.662]
  - - [1536, 1024, 1, 2048]
    - [21, 57.333]
  - - [1024, 320, 1, 1024]
    - [13, 15.686]
  - - [173280, 64, 1, 128]
    - [154, 19.315]
  - - [25992, 64, 1, 128]
    - [117, 13.254]
  - - [4524, 256, 49, 256]
    - [180, 49.049]
  - - [2666, 256, 64, 256]
    - [208, 46.539]
  - - [950, 2048, 2, 512]
    - [209, 38.37]
  - - [3220, 1024, 2, 256]
    - [141, 36.092]
  - - [782, 128, 64, 128]
    - [30, 19.953]
  - - [850, 2048, 2, 512]
    - [160, 38.548]
  - - [713, 512, 2, 2048]
    - [89, 34.311]
  - - [805, 2048, 2, 512]
    - [131, 39.543]
  - - [713, 2048, 2, 512]
    - [30, 37.107]
  - - [660, 512, 2, 2048]
    - [89, 32.42]
  - - [726, 512, 2, 2048]
    - [89, 34.654]
  - - [660, 2048, 2, 512]
    - [29, 34.123]
  - - [726, 2048, 2, 512]
    - [30, 36.889]
  - - [748, 512, 2, 2048]
    - [89, 35.995]
  - - [805, 2048, 2, 256]
    - [30, 28.22]
  - - [1251, 256, 49, 256]
    - [30, 38.163]
  - - [805, 512, 2, 2048]
    - [89, 37.664]
  - - [850, 512, 2, 2048]
    - [89, 31.185]
  - - [850, 256, 2, 3]
    - [64, 0.117]
  - - [805, 256, 2, 12]
    - [64, 0.442]
  - - [228, 256, 2, 12]
    - [3, 0.129]
  - - [228, 256, 2, 3]
    - [3, 0.033]
  - - [805, 256, 2, 3]
    - [64, 0.114]
  - - [850, 256, 2, 12]
    - [64, 0.471]
  - - [187, 256, 2, 12]
    - [3, 0.105]
  - - [247, 256, 2, 12]
    - [38, 0.144]
  - - [950, 256, 2, 12]
    - [64, 0.491]
  - - [950, 256, 2, 3]
    - [210, 0.129]
  - - [1900, 1024, 1, 2048]
    - [211, 46.763]
  - - [1610, 1024, 1, 2048]
    - [103, 52.542]
  - - [1900, 1024, 1, 512]
    - [30, 29.534]
  - - [3220, 256, 2, 12]
    - [54, 1.351]
  - - [187, 256, 2, 3]
    - [42, 0.027]
  - - [221, 256, 2, 3]
    - [3, 0.032]
  - - [221, 256, 2, 12]
    - [38, 0.13]
  - - [247, 256, 2, 3]
    - [38, 0.037]
  - - [3220, 256, 2, 3]
    - [54, 0.344]
  - - [3036, 1024, 2, 256]
    - [141, 36.824]
  - - [3036, 256, 2, 1024]
    - [212, 39.852]
  - - [850, 2048, 2, 256]
    - [141, 27.971]
  - - [2852, 1024, 2, 256]
    - [141, 33.693]
  - - [950, 2048, 2, 256]
    - [155, 27.109]
  - - [3700, 1024, 2, 256]
    - [141, 36.548]
  - - [2852, 256, 2, 1024]
    - [213, 37.604]
  - - [3700, 256, 2, 1024]
    - [30, 37.233]
  - - [1269, 256, 49, 256]
    - [30, 35.426]
  - - [1467, 256, 49, 256]
    - [180, 39.199]
  - - [3500, 256, 2, 1024]
    - [103, 43.071]
  - - [1449, 256, 49, 256]
    - [140, 39.211]
  - - [1278, 256, 49, 256]
    - [87, 36.931]
  - - [1413, 256, 49, 256]
    - [180, 37.37]
  - - [1341, 256, 49, 256]
    - [180, 37.465]
  - - [1287, 256, 49, 256]
    - [180, 38.011]
  - - [1332, 256, 49, 256]
    - [185, 40.193]
  - - [1359, 256, 49, 256]
    - [30, 38.056]
  - - [1395, 256, 49, 256]
    - [180, 37.248]
  - - [1323, 256, 49, 256]
    - [214, 37.719]
  - - [1404, 256, 49, 256]
    - [215, 38.164]
  - - [1386, 256, 49, 256]
    - [30, 39.547]
  - - [1350, 256, 49, 256]
    - [30, 40.635]
  - - [3500, 1024, 2, 256]
    - [141, 35.16]
  - - [3220, 256, 2, 1024]
    - [136, 43.032]
  - - [690, 256, 64, 256]
    - [87, 35.136]
  - - [660, 256, 64, 256]
    - [30, 37.804]
  - - [782, 256, 64, 256]
    - [30, 38.981]
  - - [884, 256, 64, 256]
    - [29, 37.365]
  - - [1610, 1024, 1, 512]
    - [89, 29.172]
  - - [1700, 1024, 1, 512]
    - [103, 29.709]
  - - [1700, 1024, 1, 2048]
    - [103, 54.798]
  - - [100, 512, 120, 128]
    - [126, 14.694]
  - - [100, 512, 18, 128]
    - [120, 6.712]
  - - [100, 512, 19, 128]
    - [120, 7.158]
  - - [1444, 128, 120, 256]
    - [30, 36.43]
  - - [1444, 128, 18, 256]
    - [30, 28.14]
  - - [1444, 128, 19, 256]
    - [30, 29.19]
  - - [1444, 256, 120, 256]
    - [180, 47.264]
  - - [1444, 256, 18, 256]
    - [30, 34.393]
  - - [1444, 256, 19, 256]
    - [30, 36.369]
  - - [25, 256, 120, 128]
    - [108, 5.325]
  - - [25, 256, 18, 128]
    - [3, 1.259]
  - - [25, 256, 19, 128]
    - [3, 1.319]
  - - [361, 512, 120, 256]
    - [29, 36.871]
  - - [361, 512, 18, 256]
    - [29, 27.03]
  - - [361, 512, 19, 256]
    - [30, 24.525]
  - - [9, 256, 120, 128]
    - [216, 2.088]
  - - [9, 256, 18, 128]
    - [45, 0.475]
  - - [9, 256, 19, 128]
    - [45, 0.493]
  - - [100, 2304, 1, 512]
    - [15, 6.816]
  - - [1444, 576, 1, 128]
    - [54, 7.314]
  - - [25, 1152, 1, 256]
    - [3, 0.602]
  - - [27436, 64, 1, 128]
    - [151, 11.51]
  - - [361, 2304, 1, 512]
    - [151, 19.346]
  - - [9, 1152, 1, 256]
    - [3, 0.215]
  - - [3840, 4224, 1, 4096]
    - [21, 92.284]
  - - [3840, 4224, 1, 4224]
    - [21, 92.422]
  - - [3840, 4224, 1, 4320]
    - [21, 92.529]
  - - [7680, 8448, 1, 8192]
    - [177, 97.586]
  - - [7680, 8448, 1, 8448]
    - [177, 97.667]
  - - [7680, 8448, 1, 8640]
    - [84, 97.799]
  - - [64, 32, 16, 32]
    - [197, 0.118]
  - - [64, 48, 16, 48]
    - [44, 0.246]
  - - [64, 64, 16, 64]
    - [47, 0.442]
  - - [64, 80, 16, 80]
    - [44, 0.637]
  - - [64, 96, 16, 96]
    - [47, 0.886]
  - - [64, 112, 16, 112]
    - [44, 1.113]
  - - [64, 128, 16, 128]
    - [17, 1.36]
  - - [64, 144, 16, 144]
    - [44, 1.721]
  - - [64, 160, 16, 160]
    - [17, 2.272]
  - - [64, 176, 16, 176]
    - [17, 2.448]
  - - [64, 192, 16, 192]
    - [5, 3.271]
  - - [64, 208, 16, 208]
    - [196, 3.284]
  - - [64, 224, 16, 224]
    - [53, 4.077]
  - - [64, 240, 16, 240]
    - [55, 4.179]
  - - [64, 256, 16, 256]
    - [5, 4.974]
  - - [64, 272, 16, 272]
    - [55, 5.111]
  - - [64, 288, 16, 288]
    - [17, 5.765]
  - - [64, 304, 16, 304]
    - [55, 6.127]
  - - [64, 320, 16, 320]
    - [8, 7.248]
  - - [64, 336, 16, 336]
    - [147, 6.385]
  - - [64, 352, 16, 352]
    - [13, 8.168]
  - - [64, 368, 16, 368]
    - [147, 8.012]
  - - [64, 384, 16, 384]
    - [200, 8.86]
  - - [64, 400, 16, 400]
    - [179, 8.278]
  - - [64, 416, 16, 416]
    - [4, 10.676]
  - - [64, 448, 16, 448]
    - [13, 12.187]
  - - [64, 464, 16, 464]
    - [147, 10.991]
  - - [64, 480, 16, 480]
    - [36, 13.094]
  - - [64, 496, 16, 496]
    - [147, 12.234]
  - - [1024, 3072, 1, 4896]
    - [190, 78.73]
  - - [1024, 3072, 1, 5552]
    - [190, 78.238]
  - - [1024, 3072, 1, 5888]
    - [190, 80.076]
  - - [1024, 3072, 1, 6128]
    - [190, 78.861]
  - - [1024, 1024, 1, 6128]
    - [70, 52.346]
  - - [1024, 3072, 1, 6688]
    - [190, 80.377]
  - - [1024, 3072, 1, 5664]
    - [190, 79.595]
  - - [1024, 3072, 1, 6048]
    - [190, 80.041]
  - - [1024, 3072, 1, 5984]
    - [190, 80.0]
  - - [1024, 1024, 1, 7872]
    - [70, 57.477]
  - - [1024, 3072, 1, 5920]
    - [190, 79.959]
  - - [1024, 1024, 1, 7344]
    - [70, 55.759]
  - - [1024, 1024, 1, 7760]
    - [70, 57.476]
  - - [1024, 3072, 1, 5136]
    - [190, 77.59]
  - - [1024, 3072, 1, 6336]
    - [190, 80.084]
  - - [1024, 1024, 1, 7184]
    - [70, 54.785]
  - - [1024, 3072, 1, 5936]
    - [190, 78.705]
  - - [1024, 1024, 1, 5936]
    - [70, 51.945]
  - - [1024, 3072, 1, 6608]
    - [190, 79.335]
  - - [1024, 3072, 1, 5616]
    - [85, 78.361]
  - - [1024, 3072, 1, 5904]
    - [81, 78.575]
  - - [1024, 3072, 1, 6624]
    - [190, 80.288]
  - - [1024, 1024, 1, 6624]
    - [70, 53.931]
  - - [1024, 3072, 1, 6416]
    - [81, 79.12]
  - - [1024, 3072, 1, 5344]
    - [190, 79.048]
  - - [1024, 3072, 1, 7024]
    - [190, 79.814]
  - - [1024, 1024, 1, 7024]
    - [70, 54.342]
  - - [1024, 3072, 1, 5776]
    - [190, 78.432]
  - - [1024, 1024, 1, 7536]
    - [70, 56.598]
  - - [1024, 3072, 1, 7040]
    - [81, 80.694]
  - - [1024, 3072, 1, 6512]
    - [81, 79.179]
  - - [1024, 1024, 1, 6512]
    - [70, 53.573]
  - - [1024, 3072, 1, 6544]
    - [190, 79.183]
  - - [1024, 3072, 1, 5472]
    - [81, 79.125]
  - - [1024, 1024, 1, 7232]
    - [57, 57.034]
  - - [1024, 3072, 1, 6368]
    - [190, 80.003]
  - - [1024, 3072, 1, 6736]
    - [190, 79.524]
  - - [1024, 3072, 1, 7152]
    - [190, 79.709]
  - - [1024, 1024, 1, 7152]
    - [70, 55.368]
  - - [1024, 3072, 1, 5296]
    - [190, 77.721]
  - - [1024, 3072, 1, 5312]
    - [190, 79.136]
  - - [1024, 3072, 1, 5872]
    - [60, 78.622]
  - - [1024, 3072, 1, 6080]
    - [190, 79.897]
  - - [1024, 3072, 1, 6000]
    - [190, 78.817]
  - - [1024, 3072, 1, 6960]
    - [190, 79.571]
  - - [1024, 1024, 1, 6960]
    - [70, 53.917]
  - - [1024, 3072, 1, 6848]
    - [190, 80.525]
  - - [4096, 1024, 1, 6848]
    - [61, 78.089]
  - - [1024, 3072, 1, 5056]
    - [85, 78.8]
  - - [1024, 1024, 1, 8016]
    - [70, 56.808]
  - - [1024, 3072, 1, 6976]
    - [190, 80.639]
  - - [1024, 4096, 1, 6976]
    - [79, 81.738]
  - - [1024, 3072, 1, 5744]
    - [85, 78.388]
  - - [1024, 3072, 1, 5728]
    - [190, 79.642]
  - - [1024, 3072, 1, 5632]
    - [190, 79.714]
  - - [1024, 3072, 1, 6176]
    - [190, 79.943]
  - - [1024, 3072, 1, 5504]
    - [81, 79.458]
  - - [1024, 3072, 1, 5488]
    - [190, 78.239]
  - - [1024, 3072, 1, 5456]
    - [190, 78.128]
  - - [1024, 3072, 1, 6640]
    - [190, 79.209]
  - - [1024, 1024, 1, 6640]
    - [70, 53.987]
  - - [1024, 3072, 1, 6432]
    - [190, 80.38]
  - - [1024, 3072, 1, 6288]
    - [81, 79.308]
  - - [1024, 1024, 1, 6288]
    - [70, 52.947]
  - - [1024, 3072, 1, 4704]
    - [190, 78.454]
  - - [1024, 3072, 1, 6256]
    - [190, 78.904]
  - - [1024, 1024, 1, 7264]
    - [101, 55.833]
  - - [1024, 3072, 1, 6672]
    - [190, 79.43]
  - - [1024, 3072, 1, 6304]
    - [190, 80.022]
  - - [1024, 1024, 1, 6304]
    - [56, 53.889]
  - - [1024, 3072, 1, 5520]
    - [190, 78.192]
  - - [1024, 3072, 1, 6208]
    - [190, 79.978]
  - - [1024, 3072, 1, 4976]
    - [190, 77.587]
  - - [1024, 3072, 1, 5360]
    - [190, 78.272]
  - - [1024, 3072, 1, 5392]
    - [190, 78.032]
  - - [1024, 3072, 1, 5376]
    - [81, 79.19]
  - - [1024, 3072, 1, 5328]
    - [190, 77.804]
  - - [1024, 3072, 1, 6448]
    - [190, 79.184]
  - - [1024, 1024, 1, 6448]
    - [70, 53.569]
  - - [1024, 3072, 1, 5424]
    - [60, 78.08]
  - - [1024, 3072, 1, 6464]
    - [190, 80.214]
  - - [1024, 1024, 1, 7376]
    - [70, 56.037]
  - - [1024, 3072, 1, 5104]
    - [81, 77.636]
  - - [1024, 3072, 1, 6224]
    - [60, 78.865]
  - - [1024, 3072, 1, 6320]
    - [190, 78.981]
  - - [1024, 1024, 1, 6320]
    - [70, 52.952]
  - - [1024, 4096, 1, 6320]
    - [79, 78.987]
  - - [1024, 3072, 1, 6560]
    - [81, 80.309]
  - - [1024, 1024, 1, 6560]
    - [70, 54.006]
  - - [1024, 3072, 1, 5856]
    - [85, 79.763]
  - - [1024, 3072, 1, 6496]
    - [190, 80.442]
  - - [1024, 3072, 1, 5696]
    - [190, 79.322]
  - - [1024, 3072, 1, 6144]
    - [81, 79.85]
  - - [1024, 1024, 1, 7504]
    - [70, 55.337]
  - - [4096, 1024, 1, 7504]
    - [61, 77.475]
  - - [1024, 3072, 1, 6096]
    - [81, 78.592]
  - - [1024, 1024, 1, 6096]
    - [70, 52.338]
  - - [1024, 3072, 1, 4880]
    - [190, 77.35]
  - - [1024, 1024, 1, 7168]
    - [57, 56.529]
  - - [1024, 1024, 1, 7776]
    - [70, 56.811]
  - - [1024, 3072, 1, 6384]
    - [190, 79.194]
  - - [1024, 1024, 1, 6384]
    - [70, 53.262]
  - - [1024, 3072, 1, 5712]
    - [190, 78.405]
  - - [1024, 3072, 1, 4624]
    - [190, 76.867]
  - - [1024, 1024, 1, 7488]
    - [57, 57.035]
  - - [1024, 3072, 1, 7472]
    - [81, 79.933]
  - - [1024, 1024, 1, 7472]
    - [70, 56.082]
  - - [1024, 3072, 1, 6576]
    - [190, 79.192]
  - - [1024, 3072, 1, 6928]
    - [81, 79.591]
  - - [1024, 3072, 1, 6864]
    - [190, 79.604]
  - - [1024, 1024, 1, 6864]
    - [70, 54.132]
  - - [1024, 3072, 1, 5792]
    - [190, 79.688]
  - - [1024, 3072, 1, 6704]
    - [190, 79.358]
  - - [1024, 1024, 1, 6704]
    - [70, 54.172]
  - - [1024, 3072, 1, 6800]
    - [190, 79.512]
  - - [1024, 3072, 1, 6016]
    - [81, 79.976]
  - - [1024, 3072, 1, 6880]
    - [81, 80.474]
  - - [1024, 1024, 1, 6880]
    - [70, 54.623]
  - - [1024, 1024, 1, 27]
    - [55, 2.278]
  - - [16384, 16384, 1, 16384]
    - [217, 99.058]
  - - [16896, 16384, 1, 16384]
    - [217, 99.487]
  - - [1280, 100, 1, 1792]
    - [8, 7.578]
  - - [1280, 1280, 1, 1792]
    - [208, 51.364]
  - - [2048, 1000, 1, 32]
    - [55, 3.692]
  - - [224, 4000, 1, 224]
    - [200, 11.656]
  - - [25088, 4096, 1, 32]
    - [35, 10.051]
  - - [3072, 768, 1, 7168]
    - [73, 70.646]
  - - [4096, 4096, 1, 32]
    - [152, 8.507]
  - - [768, 100, 1, 32]
    - [52, 0.231]
  - - [768, 3072, 1, 7168]
    - [73, 70.359]
  - - [768, 768, 1, 32]
    - [150, 1.497]
  - - [768, 768, 1, 7168]
    - [187, 49.412]
  - - [196, 1632, 32, 128]
    - [30, 17.98]
  - - [196, 1664, 32, 128]
    - [131, 19.988]
  - - [196, 1696, 32, 128]
    - [30, 18.639]
  - - [196, 1728, 32, 128]
    - [125, 19.084]
  - - [196, 1760, 32, 128]
    - [30, 18.597]
  - - [196, 1792, 32, 896]
    - [180, 46.443]
  - - [196, 288, 32, 128]
    - [133, 8.83]
  - - [196, 320, 32, 128]
    - [133, 11.047]
  - - [196, 512, 32, 128]
    - [133, 13.269]
  - - [224, 64, 160, 224]
    - [137, 18.918]
  - - [224, 64, 384, 224]
    - [200, 23.311]
  - - [224, 64, 512, 224]
    - [200, 24.438]
  - - [3136, 192, 32, 128]
    - [144, 29.034]
  - - [3136, 96, 32, 128]
    - [144, 22.775]
  - - [49, 1024, 32, 128]
    - [106, 7.421]
  - - [49, 1056, 32, 128]
    - [125, 7.37]
  - - [49, 1088, 32, 128]
    - [106, 7.501]
  - - [49, 1120, 32, 128]
    - [106, 7.537]
  - - [49, 1152, 32, 128]
    - [30, 7.707]
  - - [49, 1600, 32, 128]
    - [106, 9.0]
  - - [49, 1632, 32, 128]
    - [29, 8.957]
  - - [49, 1664, 32, 128]
    - [29, 9.155]
  - - [49, 1696, 32, 128]
    - [120, 8.776]
  - - [49, 1728, 32, 128]
    - [106, 8.84]
  - - [49, 1824, 32, 128]
    - [106, 9.085]
  - - [49, 1856, 32, 128]
    - [106, 9.244]
  - - [49, 1888, 32, 128]
    - [127, 9.083]
  - - [49, 672, 32, 128]
    - [106, 5.778]
  - - [49, 704, 32, 128]
    - [106, 6.03]
  - - [49, 736, 32, 128]
    - [106, 6.328]
  - - [49, 768, 32, 128]
    - [106, 6.603]
  - - [49, 800, 32, 128]
    - [106, 6.651]
  - - [49, 832, 32, 128]
    - [106, 6.767]
  - - [64, 224, 160, 224]
    - [162, 19.105]
  - - [64, 224, 384, 224]
    - [162, 24.162]
  - - [64, 224, 512, 224]
    - [132, 24.965]
  - - [784, 128, 32, 128]
    - [201, 17.215]
  - - [784, 224, 32, 128]
    - [162, 20.21]
  - - [784, 288, 32, 128]
    - [144, 22.17]
  - - [784, 320, 32, 128]
    - [50, 23.202]
  - - [784, 352, 32, 128]
    - [50, 24.211]
  - - [1024, 1024, 1, 14080]
    - [70, 63.853]
  - - [1024, 1024, 1, 14400]
    - [70, 64.147]
  - - [1024, 1024, 1, 15168]
    - [70, 64.737]
  - - [4096, 1024, 1, 15136]
    - [61, 77.847]
  - - [4096, 1024, 1, 28672]
    - [61, 79.879]
  - - [1024, 1024, 1, 12112]
    - [70, 61.809]
  - - [1024, 1024, 1, 12192]
    - [70, 61.95]
  - - [1024, 1024, 1, 12272]
    - [70, 61.957]
  - - [1024, 1024, 1, 12304]
    - [70, 62.012]
  - - [1024, 1024, 1, 12368]
    - [70, 62.017]
  - - [1024, 1024, 1, 12416]
    - [101, 62.1]
  - - [1024, 1024, 1, 13024]
    - [101, 62.955]
  - - [1024, 1024, 1, 13056]
    - [70, 62.751]
  - - [1024, 1024, 1, 13072]
    - [70, 62.7]
  - - [1024, 1024, 1, 13088]
    - [101, 62.956]
  - - [1024, 1024, 1, 13168]
    - [70, 62.88]
  - - [1024, 1024, 1, 13184]
    - [70, 62.88]
  - - [1024, 1024, 1, 13216]
    - [101, 63.185]
  - - [1024, 1024, 1, 13232]
    - [70, 62.83]
  - - [1024, 1024, 1, 13248]
    - [70, 62.981]
  - - [1024, 1024, 1, 13280]
    - [101, 63.134]
  - - [1024, 1024, 1, 13296]
    - [70, 62.855]
  - - [1024, 1024, 1, 13312]
    - [70, 63.133]
  - - [1024, 1024, 1, 13328]
    - [70, 62.982]
  - - [1024, 1024, 1, 13344]
    - [70, 62.781]
  - - [1024, 1024, 1, 13360]
    - [70, 63.133]
  - - [1024, 1024, 1, 13376]
    - [70, 63.108]
  - - [1024, 1024, 1, 13392]
    - [70, 62.757]
  - - [1024, 1024, 1, 13408]
    - [101, 63.233]
  - - [1024, 1024, 1, 13424]
    - [70, 63.057]
  - - [1024, 1024, 1, 13440]
    - [70, 62.758]
  - - [1024, 1024, 1, 13456]
    - [70, 63.409]
  - - [1024, 1024, 1, 13472]
    - [70, 63.283]
  - - [1024, 1024, 1, 13488]
    - [70, 62.513]
  - - [1024, 1024, 1, 13504]
    - [70, 62.809]
  - - [1024, 1024, 1, 13520]
    - [70, 63.357]
  - - [1024, 1024, 1, 13536]
    - [70, 63.131]
  - - [1024, 1024, 1, 13552]
    - [70, 63.181]
  - - [1024, 1024, 1, 13600]
    - [101, 63.205]
  - - [1024, 1024, 1, 13616]
    - [70, 63.454]
  - - [1024, 1024, 1, 13632]
    - [70, 63.254]
  - - [1024, 1024, 1, 13648]
    - [70, 63.18]
  - - [1024, 1024, 1, 13680]
    - [70, 63.378]
  - - [1024, 1024, 1, 13696]
    - [101, 63.802]
  - - [1024, 1024, 1, 13712]
    - [70, 63.278]
  - - [1024, 1024, 1, 13728]
    - [70, 63.351]
  - - [1024, 1024, 1, 13760]
    - [70, 63.524]
  - - [1024, 1024, 1, 13776]
    - [70, 63.326]
  - - [1024, 1024, 1, 13792]
    - [70, 63.771]
  - - [1024, 1024, 1, 13808]
    - [70, 63.129]
  - - [1024, 1024, 1, 13824]
    - [70, 63.472]
  - - [1024, 1024, 1, 13840]
    - [70, 63.202]
  - - [1024, 1024, 1, 13856]
    - [101, 63.619]
  - - [1024, 1024, 1, 13872]
    - [70, 63.544]
  - - [1024, 1024, 1, 13888]
    - [101, 64.015]
  - - [1024, 1024, 1, 13904]
    - [70, 63.445]
  - - [1024, 1024, 1, 13920]
    - [101, 63.567]
  - - [1024, 1024, 1, 13936]
    - [70, 63.371]
  - - [1024, 1024, 1, 13952]
    - [101, 63.787]
  - - [1024, 1024, 1, 13968]
    - [70, 63.541]
  - - [1024, 1024, 1, 13984]
    - [101, 63.958]
  - - [1024, 1024, 1, 14000]
    - [70, 63.662]
  - - [1024, 1024, 1, 14016]
    - [70, 63.808]
  - - [1024, 1024, 1, 14032]
    - [70, 63.807]
  - - [1024, 1024, 1, 14048]
    - [101, 63.929]
  - - [1024, 1024, 1, 14064]
    - [70, 62.959]
  - - [1024, 1024, 1, 14096]
    - [70, 63.804]
  - - [1024, 1024, 1, 14112]
    - [101, 63.949]
  - - [1024, 1024, 1, 14128]
    - [70, 63.486]
  - - [1024, 1024, 1, 14144]
    - [101, 63.728]
  - - [1024, 1024, 1, 14176]
    - [101, 64.141]
  - - [1024, 1024, 1, 14192]
    - [70, 63.944]
  - - [1024, 1024, 1, 14208]
    - [70, 64.237]
  - - [1024, 1024, 1, 14224]
    - [70, 63.7]
  - - [1024, 1024, 1, 14240]
    - [101, 64.063]
  - - [1024, 1024, 1, 14256]
    - [70, 63.794]
  - - [1024, 1024, 1, 14272]
    - [70, 64.011]
  - - [1024, 1024, 1, 14288]
    - [70, 63.793]
  - - [1024, 1024, 1, 14304]
    - [101, 64.179]
  - - [1024, 1024, 1, 14320]
    - [70, 64.008]
  - - [1024, 1024, 1, 14336]
    - [101, 64.177]
  - - [1024, 1024, 1, 14352]
    - [70, 63.885]
  - - [1024, 1024, 1, 14384]
    - [70, 63.668]
  - - [1024, 1024, 1, 14416]
    - [70, 63.833]
  - - [1024, 1024, 1, 14432]
    - [101, 64.314]
  - - [1024, 1024, 1, 14448]
    - [70, 63.784]
  - - [1024, 1024, 1, 14464]
    - [70, 64.118]
  - - [1024, 1024, 1, 14480]
    - [70, 63.877]
  - - [1024, 1024, 1, 14496]
    - [101, 64.164]
  - - [1024, 1024, 1, 14512]
    - [70, 64.042]
  - - [1024, 1024, 1, 14528]
    - [101, 64.137]
  - - [1024, 1024, 1, 14544]
    - [70, 63.731]
  - - [1024, 1024, 1, 14560]
    - [101, 64.399]
  - - [1024, 1024, 1, 14576]
    - [70, 64.157]
  - - [1024, 1024, 1, 14608]
    - [70, 63.261]
  - - [1024, 1024, 1, 14624]
    - [101, 64.416]
  - - [1024, 1024, 1, 14640]
    - [70, 63.915]
  - - [1024, 1024, 1, 14656]
    - [101, 64.413]
  - - [1024, 1024, 1, 14672]
    - [101, 63.585]
  - - [1024, 1024, 1, 14688]
    - [70, 64.148]
  - - [1024, 1024, 1, 14704]
    - [70, 64.313]
  - - [1024, 1024, 1, 14720]
    - [101, 64.431]
  - - [1024, 1024, 1, 14736]
    - [70, 64.215]
  - - [1024, 1024, 1, 14752]
    - [101, 64.523]
  - - [1024, 1024, 1, 14784]
    - [101, 64.448]
  - - [1024, 1024, 1, 14800]
    - [70, 64.328]
  - - [1024, 1024, 1, 14816]
    - [101, 64.445]
  - - [1024, 1024, 1, 14848]
    - [101, 64.442]
  - - [1024, 1024, 1, 14864]
    - [70, 64.088]
  - - [1024, 1024, 1, 14880]
    - [70, 64.557]
  - - [1024, 1024, 1, 14896]
    - [70, 64.508]
  - - [1024, 1024, 1, 14912]
    - [70, 64.672]
  - - [1024, 1024, 1, 14928]
    - [70, 64.037]
  - - [1024, 1024, 1, 14944]
    - [101, 64.527]
  - - [1024, 1024, 1, 14960]
    - [70, 63.573]
  - - [1024, 1024, 1, 14976]
    - [70, 64.429]
  - - [1024, 1024, 1, 14992]
    - [70, 64.522]
  - - [1024, 1024, 1, 15008]
    - [101, 64.708]
  - - [1024, 1024, 1, 15024]
    - [70, 64.401]
  - - [1024, 1024, 1, 15040]
    - [101, 64.634]
  - - [1024, 1024, 1, 15056]
    - [70, 64.445]
  - - [1024, 1024, 1, 15072]
    - [70, 64.49]
  - - [1024, 1024, 1, 15088]
    - [70, 64.535]
  - - [1024, 1024, 1, 15104]
    - [101, 64.604]
  - - [1024, 1024, 1, 15120]
    - [70, 64.462]
  - - [1024, 1024, 1, 15136]
    - [101, 64.741]
  - - [1024, 1024, 1, 15152]
    - [70, 64.739]
  - - [1024, 1024, 1, 15184]
    - [70, 64.41]
  - - [1024, 1024, 1, 15200]
    - [70, 64.663]
  - - [1024, 1024, 1, 15216]
    - [70, 64.592]
  - - [1024, 1024, 1, 15232]
    - [101, 65.034]
  - - [1024, 1024, 1, 15248]
    - [70, 64.588]
  - - [1024, 1024, 1, 15264]
    - [101, 64.54]
  - - [1024, 1024, 1, 15280]
    - [70, 64.793]
  - - [1024, 1024, 1, 15312]
    - [101, 64.375]
  - - [1024, 1024, 1, 15328]
    - [70, 64.997]
  - - [1024, 1024, 1, 15344]
    - [70, 64.463]
  - - [1024, 1024, 1, 15360]
    - [101, 64.761]
  - - [1024, 1024, 1, 15376]
    - [70, 64.805]
  - - [1024, 1024, 1, 15408]
    - [70, 64.824]
  - - [1024, 1024, 1, 15424]
    - [101, 64.938]
  - - [1024, 1024, 1, 15440]
    - [70, 64.431]
  - - [1024, 1024, 1, 15456]
    - [101, 64.865]
  - - [1024, 1024, 1, 15472]
    - [70, 64.817]
  - - [1024, 1024, 1, 15504]
    - [70, 64.199]
  - - [1024, 1024, 1, 15520]
    - [101, 65.11]
  - - [1024, 1024, 1, 15536]
    - [70, 64.13]
  - - [1024, 1024, 1, 15568]
    - [70, 64.851]
  - - [1024, 1024, 1, 15584]
    - [101, 65.032]
  - - [1024, 1024, 1, 15600]
    - [70, 64.147]
  - - [1024, 1024, 1, 15616]
    - [70, 65.235]
  - - [1024, 1024, 1, 15632]
    - [70, 64.707]
  - - [1024, 1024, 1, 15648]
    - [101, 65.207]
  - - [1024, 1024, 1, 15664]
    - [70, 65.044]
  - - [1024, 1024, 1, 15696]
    - [70, 64.722]
  - - [1024, 1024, 1, 15712]
    - [101, 65.451]
  - - [1024, 1024, 1, 15728]
    - [101, 64.271]
  - - [1024, 1024, 1, 15744]
    - [101, 65.102]
  - - [1024, 1024, 1, 15760]
    - [70, 64.76]
  - - [1024, 1024, 1, 15776]
    - [101, 65.28]
  - - [1024, 1024, 1, 15792]
    - [101, 64.244]
  - - [1024, 1024, 1, 15808]
    - [101, 65.367]
  - - [1024, 1024, 1, 15856]
    - [70, 64.951]
  - - [1024, 1024, 1, 15888]
    - [70, 65.218]
  - - [1024, 1024, 1, 15904]
    - [101, 64.945]
  - - [1024, 1024, 1, 15920]
    - [70, 65.101]
  - - [1024, 1024, 1, 15936]
    - [101, 65.506]
  - - [1024, 1024, 1, 15952]
    - [70, 64.583]
  - - [1024, 1024, 1, 15968]
    - [101, 65.524]
  - - [1024, 1024, 1, 15984]
    - [70, 65.047]
  - - [1024, 1024, 1, 16000]
    - [101, 65.609]
  - - [1024, 1024, 1, 16016]
    - [70, 64.423]
  - - [1024, 1024, 1, 16032]
    - [101, 65.018]
  - - [1024, 1024, 1, 16064]
    - [101, 65.395]
  - - [1024, 1024, 1, 16080]
    - [70, 65.325]
  - - [1024, 1024, 1, 16096]
    - [101, 65.798]
  - - [1024, 1024, 1, 16112]
    - [70, 65.142]
  - - [1024, 1024, 1, 16128]
    - [101, 65.251]
  - - [1024, 1024, 1, 16160]
    - [101, 65.492]
  - - [1024, 1024, 1, 16176]
    - [70, 65.222]
  - - [1024, 1024, 1, 16192]
    - [101, 65.286]
  - - [1024, 1024, 1, 16224]
    - [70, 65.415]
  - - [1024, 1024, 1, 16240]
    - [70, 65.191]
  - - [1024, 1024, 1, 16256]
    - [101, 65.433]
  - - [1024, 1024, 1, 16272]
    - [101, 64.922]
  - - [1024, 1024, 1, 16288]
    - [101, 65.472]
  - - [1024, 1024, 1, 16304]
    - [101, 64.678]
  - - [1024, 1024, 1, 16320]
    - [101, 65.489]
  - - [1024, 1024, 1, 16336]
    - [70, 65.354]
  - - [1024, 1024, 1, 16352]
    - [101, 65.662]
  - - [1024, 1024, 1, 16400]
    - [101, 64.863]
  - - [1024, 1024, 1, 16432]
    - [70, 65.494]
  - - [1024, 1024, 1, 16448]
    - [101, 65.735]
  - - [1024, 1024, 1, 16464]
    - [70, 65.313]
  - - [1024, 1024, 1, 16480]
    - [101, 65.819]
  - - [1024, 1024, 1, 16496]
    - [70, 65.33]
  - - [1024, 1024, 1, 16512]
    - [101, 65.569]
  - - [1024, 1024, 1, 16544]
    - [101, 65.874]
  - - [1024, 1024, 1, 16576]
    - [101, 66.135]
  - - [1024, 1024, 1, 16608]
    - [101, 65.554]
  - - [1024, 1024, 1, 16656]
    - [70, 65.113]
  - - [1024, 1024, 1, 16704]
    - [101, 65.955]
  - - [1024, 1024, 1, 16736]
    - [101, 65.621]
  - - [1024, 1024, 1, 16768]
    - [101, 66.097]
  - - [1024, 1024, 1, 16880]
    - [101, 65.148]
  - - [1024, 1024, 1, 16928]
    - [101, 66.088]
  - - [1024, 1024, 1, 17024]
    - [101, 66.179]
  - - [1024, 1024, 1, 2004]
    - [56, 34.97]
  - - [1024, 1024, 1, 2072]
    - [56, 35.271]
  - - [1024, 1024, 1, 2307]
    - [119, 37.696]
  - - [1024, 30528, 1, 2231]
    - [59, 80.138]
  - - [1024, 30528, 1, 2256]
    - [158, 80.707]
  - - [1024, 30528, 1, 2322]
    - [158, 80.421]
  - - [1024, 3072, 1, 11984]
    - [75, 75.293]
  - - [1024, 3072, 1, 12064]
    - [156, 75.608]
  - - [1024, 3072, 1, 12112]
    - [156, 74.889]
  - - [1024, 3072, 1, 12192]
    - [156, 75.661]
  - - [1024, 3072, 1, 12272]
    - [142, 75.002]
  - - [1024, 3072, 1, 12304]
    - [84, 75.667]
  - - [1024, 3072, 1, 12368]
    - [84, 75.785]
  - - [1024, 3072, 1, 12416]
    - [175, 75.974]
  - - [1024, 3072, 1, 13024]
    - [156, 75.982]
  - - [1024, 3072, 1, 13056]
    - [82, 76.256]
  - - [1024, 3072, 1, 13072]
    - [75, 75.763]
  - - [1024, 3072, 1, 13088]
    - [59, 76.129]
  - - [1024, 3072, 1, 13168]
    - [82, 76.058]
  - - [1024, 3072, 1, 13184]
    - [156, 76.026]
  - - [1024, 3072, 1, 13216]
    - [59, 76.199]
  - - [1024, 3072, 1, 13232]
    - [84, 76.08]
  - - [1024, 3072, 1, 13248]
    - [82, 76.123]
  - - [1024, 3072, 1, 13280]
    - [156, 76.22]
  - - [1024, 3072, 1, 13296]
    - [59, 76.078]
  - - [1024, 3072, 1, 13312]
    - [175, 76.096]
  - - [1024, 3072, 1, 13328]
    - [82, 76.188]
  - - [1024, 3072, 1, 13344]
    - [175, 76.267]
  - - [1024, 3072, 1, 13360]
    - [175, 75.182]
  - - [1024, 3072, 1, 13376]
    - [156, 76.314]
  - - [1024, 3072, 1, 13392]
    - [156, 75.302]
  - - [1024, 3072, 1, 13408]
    - [156, 76.239]
  - - [1024, 3072, 1, 13424]
    - [156, 75.244]
  - - [1024, 3072, 1, 13440]
    - [156, 76.152]
  - - [1024, 3072, 1, 13456]
    - [75, 75.614]
  - - [1024, 3072, 1, 13472]
    - [142, 75.969]
  - - [1024, 3072, 1, 13488]
    - [82, 76.011]
  - - [1024, 3072, 1, 13504]
    - [156, 76.138]
  - - [1024, 3072, 1, 13520]
    - [156, 75.282]
  - - [1024, 3072, 1, 13536]
    - [175, 76.173]
  - - [1024, 3072, 1, 13552]
    - [175, 75.306]
  - - [1024, 3072, 1, 13568]
    - [82, 76.063]
  - - [1024, 3072, 1, 13584]
    - [59, 76.394]
  - - [1024, 3072, 1, 13600]
    - [82, 76.351]
  - - [1024, 3072, 1, 13616]
    - [190, 75.178]
  - - [1024, 3072, 1, 13632]
    - [84, 76.181]
  - - [1024, 3072, 1, 13648]
    - [175, 75.367]
  - - [1024, 3072, 1, 13664]
    - [175, 76.191]
  - - [1024, 3072, 1, 13680]
    - [82, 76.376]
  - - [1024, 3072, 1, 13696]
    - [84, 76.226]
  - - [1024, 3072, 1, 13712]
    - [75, 75.803]
  - - [1024, 3072, 1, 13728]
    - [156, 76.153]
  - - [1024, 3072, 1, 13744]
    - [75, 75.921]
  - - [1024, 3072, 1, 13760]
    - [59, 76.294]
  - - [1024, 3072, 1, 13776]
    - [82, 76.323]
  - - [1024, 3072, 1, 13792]
    - [156, 76.221]
  - - [1024, 3072, 1, 13808]
    - [82, 76.322]
  - - [1024, 3072, 1, 13824]
    - [175, 76.327]
  - - [1024, 3072, 1, 13840]
    - [75, 75.731]
  - - [1024, 3072, 1, 13856]
    - [156, 76.278]
  - - [1024, 3072, 1, 13872]
    - [156, 75.417]
  - - [1024, 3072, 1, 13888]
    - [156, 76.276]
  - - [1024, 3072, 1, 13904]
    - [59, 76.34]
  - - [1024, 3072, 1, 13920]
    - [175, 76.369]
  - - [1024, 3072, 1, 13936]
    - [156, 75.452]
  - - [1024, 3072, 1, 13952]
    - [156, 76.285]
  - - [1024, 3072, 1, 13984]
    - [175, 76.236]
  - - [1024, 3072, 1, 14000]
    - [157, 75.868]
  - - [1024, 3072, 1, 14016]
    - [156, 76.282]
  - - [1024, 3072, 1, 14032]
    - [142, 76.147]
  - - [1024, 3072, 1, 14048]
    - [175, 76.562]
  - - [1024, 3072, 1, 14064]
    - [156, 75.431]
  - - [1024, 3072, 1, 14080]
    - [156, 76.349]
  - - [1024, 3072, 1, 14096]
    - [156, 75.488]
  - - [1024, 3072, 1, 14112]
    - [156, 76.149]
  - - [1024, 3072, 1, 14128]
    - [142, 76.212]
  - - [1024, 3072, 1, 14144]
    - [156, 76.462]
  - - [1024, 3072, 1, 14176]
    - [175, 76.32]
  - - [1024, 3072, 1, 14192]
    - [175, 75.466]
  - - [1024, 3072, 1, 14208]
    - [175, 76.353]
  - - [1024, 3072, 1, 15008]
    - [156, 76.445]
  - - [1024, 3072, 1, 15040]
    - [156, 76.564]
  - - [1024, 3072, 1, 15072]
    - [156, 76.584]
  - - [1024, 3072, 1, 16144]
    - [59, 76.914]
  - - [1024, 3072, 1, 16176]
    - [82, 76.839]
  - - [1024, 3072, 1, 16464]
    - [156, 76.166]
  - - [1024, 3072, 1, 28672]
    - [175, 78.354]
  - - [1024, 4096, 1, 13488]
    - [79, 78.446]
  - - [1024, 4096, 1, 14080]
    - [79, 79.483]
  - - [1024, 4096, 1, 14240]
    - [79, 79.569]
  - - [1024, 4096, 1, 15248]
    - [79, 79.19]
  - - [1024, 4096, 1, 15312]
    - [79, 79.174]
  - - [1024, 4096, 1, 15328]
    - [79, 79.904]
  - - [1024, 4096, 1, 15792]
    - [79, 79.128]
  - - [1024, 4096, 1, 15984]
    - [79, 79.449]
  - - [1024, 4096, 1, 16192]
    - [58, 79.762]
  - - [1024, 4096, 1, 16336]
    - [79, 79.542]
  - - [1024, 4096, 1, 28672]
    - [79, 81.788]
  - - [4096, 1024, 1, 13312]
    - [61, 76.102]
  - - [4096, 1024, 1, 15664]
    - [61, 76.02]
  - - [4096, 1024, 1, 15680]
    - [61, 77.726]
  - - [4096, 1024, 1, 15776]
    - [61, 77.022]
  - - [4096, 1024, 1, 15792]
    - [61, 77.172]
  - - [4096, 1024, 1, 16032]
    - [61, 77.87]
  - - [4096, 1024, 1, 16112]
    - [61, 77.281]
  - - [4096, 1024, 1, 16464]
    - [61, 77.646]
  - - [4096, 1024, 1, 16576]
    - [61, 76.779]
  - - [1000, 100, 1, 1024]
    - [5, 4.807]
  - - [1000, 100, 1, 256]
    - [5, 1.803]
  - - [1000, 4000, 1, 256]
    - [192, 27.8]
  - - [1000, 4000, 1, 31744]
    - [58, 78.702]
  - - [1000, 4000, 1, 32768]
    - [58, 78.637]
  - - [1000, 4000, 1, 7936]
    - [58, 72.884]
  - - [1280, 100, 1, 5376]
    - [169, 14.41]
  - - [1280, 1280, 1, 224]
    - [192, 17.595]
  - - [1280, 1280, 1, 5376]
    - [85, 67.187]
  - - [1280, 1280, 1, 896]
    - [21, 38.109]
  - - [1280, 5120, 1, 224]
    - [185, 31.929]
  - - [1280, 5120, 1, 5376]
    - [142, 77.316]
  - - [1664, 1000, 1, 256]
    - [93, 18.97]
  - - [1920, 1000, 1, 256]
    - [119, 19.162]
  - - [1920, 1000, 1, 64]
    - [179, 6.35]
  - - [2048, 1000, 1, 256]
    - [144, 19.559]
  - - [2048, 1000, 1, 96]
    - [179, 9.426]
  - - [224, 4000, 1, 32768]
    - [101, 61.268]
  - - [2304, 768, 1, 5376]
    - [85, 72.123]
  - - [2304, 768, 1, 896]
    - [21, 40.969]
  - - [25088, 4096, 1, 256]
    - [178, 52.052]
  - - [3072, 768, 1, 10752]
    - [159, 72.871]
  - - [3072, 768, 1, 224]
    - [192, 20.892]
  - - [3072, 768, 1, 3584]
    - [73, 63.98]
  - - [3072, 768, 1, 896]
    - [56, 44.768]
  - - [3840, 1280, 1, 5376]
    - [21, 75.656]
  - - [5120, 1280, 1, 5376]
    - [217, 77.362]
  - - [768, 100, 1, 16]
    - [41, 0.117]
  - - [768, 100, 1, 48]
    - [197, 0.322]
  - - [768, 100, 1, 5376]
    - [167, 9.651]
  - - [768, 100, 1, 896]
    - [1, 3.876]
  - - [768, 3072, 1, 10752]
    - [159, 72.852]
  - - [768, 3072, 1, 224]
    - [192, 20.819]
  - - [768, 3072, 1, 3584]
    - [73, 64.066]
  - - [768, 3072, 1, 5376]
    - [159, 68.275]
  - - [768, 3072, 1, 896]
    - [56, 44.601]
  - - [768, 768, 1, 10752]
    - [99, 57.023]
  - - [768, 768, 1, 224]
    - [200, 7.834]
  - - [768, 768, 1, 3584]
    - [99, 34.617]
  - - [768, 768, 1, 5376]
    - [99, 42.99]
  - - [196, 1024, 16, 128]
    - [133, 13.231]
  - - [196, 1120, 256, 128]
    - [30, 22.363]
  - - [196, 1120, 64, 128]
    - [30, 19.006]
  - - [196, 1280, 256, 640]
    - [140, 50.767]
  - - [196, 1344, 256, 128]
    - [209, 25.045]
  - - [196, 1408, 16, 128]
    - [125, 15.053]
  - - [196, 1472, 256, 128]
    - [30, 23.502]
  - - [196, 1504, 256, 128]
    - [30, 23.121]
  - - [196, 384, 256, 128]
    - [29, 21.965]
  - - [196, 384, 64, 128]
    - [133, 15.54]
  - - [196, 416, 256, 128]
    - [30, 18.445]
  - - [196, 480, 256, 128]
    - [30, 18.583]
  - - [196, 512, 256, 128]
    - [29, 23.184]
  - - [196, 512, 64, 128]
    - [125, 16.995]
  - - [196, 544, 256, 128]
    - [131, 20.104]
  - - [196, 544, 64, 128]
    - [30, 15.821]
  - - [196, 576, 256, 128]
    - [209, 21.629]
  - - [196, 608, 256, 128]
    - [30, 20.116]
  - - [196, 640, 256, 128]
    - [29, 23.749]
  - - [196, 640, 64, 128]
    - [29, 18.465]
  - - [196, 704, 16, 128]
    - [127, 11.452]
  - - [196, 960, 256, 128]
    - [209, 23.838]
  - - [196, 960, 64, 128]
    - [127, 19.425]
  - - [224, 64, 480, 224]
    - [137, 24.774]
  - - [3136, 128, 16, 128]
    - [162, 21.896]
  - - [3136, 128, 256, 128]
    - [35, 32.88]
  - - [3136, 128, 64, 128]
    - [35, 29.781]
  - - [49, 1024, 64, 128]
    - [29, 9.356]
  - - [49, 1152, 16, 128]
    - [106, 5.614]
  - - [49, 1184, 16, 128]
    - [106, 5.398]
  - - [49, 1440, 256, 128]
    - [30, 12.428]
  - - [49, 1472, 256, 128]
    - [209, 12.519]
  - - [49, 1504, 256, 128]
    - [30, 12.943]
  - - [49, 1536, 256, 128]
    - [30, 13.728]
  - - [49, 1568, 256, 128]
    - [30, 12.858]
  - - [49, 1696, 64, 128]
    - [127, 10.565]
  - - [49, 1760, 16, 128]
    - [106, 6.677]
  - - [49, 1760, 64, 128]
    - [127, 10.501]
  - - [49, 1824, 64, 128]
    - [125, 10.658]
  - - [49, 640, 256, 128]
    - [30, 11.936]
  - - [49, 640, 64, 128]
    - [29, 8.199]
  - - [49, 672, 64, 128]
    - [120, 7.894]
  - - [49, 768, 64, 128]
    - [111, 8.576]
  - - [49, 928, 256, 128]
    - [209, 11.839]
  - - [49, 960, 256, 128]
    - [209, 12.102]
  - - [49, 992, 256, 128]
    - [30, 12.419]
  - - [784, 160, 16, 128]
    - [179, 12.422]
  - - [784, 160, 256, 128]
    - [144, 28.359]
  - - [784, 160, 64, 128]
    - [193, 21.088]
  - - [784, 192, 16, 128]
    - [147, 14.594]
  - - [784, 192, 256, 128]
    - [144, 31.993]
  - - [784, 192, 64, 128]
    - [193, 24.589]
  - - [784, 224, 256, 128]
    - [35, 32.466]
  - - [784, 224, 64, 128]
    - [162, 24.822]
  - - [784, 256, 16, 128]
    - [201, 17.475]
  - - [784, 320, 64, 128]
    - [35, 27.697]
  - - [784, 352, 64, 128]
    - [35, 29.209]
  - - [784, 384, 256, 128]
    - [35, 37.765]
  - - [784, 384, 64, 128]
    - [35, 30.908]
  - - [784, 416, 256, 128]
    - [35, 34.235]
  - - [784, 416, 64, 128]
    - [35, 29.112]
  - - [128, 64, 72, 128]
    - [200, 4.274]
  - - [512, 64, 72, 128]
    - [192, 12.695]
  - - [512, 64, 96, 128]
    - [192, 14.176]
  - - [64, 128, 72, 128]
    - [200, 4.296]
  - - [64, 128, 96, 128]
    - [200, 5.699]
  - - [64, 160, 2048, 851]
    - [218, 32.19]
  - - [64, 160, 2048, 379]
    - [219, 28.049]
  - - [64, 160, 1, 512]
    - [220, 0.955]
  - - [32, 128, 2048, 742]
    - [132, 24.898]
  - - [32, 160, 2048, 851]
    - [209, 22.329]
  - - [32, 160, 2048, 379]
    - [193, 18.915]
  - - [32, 160, 2048, 4]
    - [109, 0.79]
  - - [64, 262144, 1, 742]
    - [148, 42.431]
  - - [64, 327680, 1, 379]
    - [162, 34.781]
  - - [64, 327680, 1, 851]
    - [122, 41.971]
  - - [64, 327680, 1, 4]
    - [134, 1.075]
  - - [1536, 384, 1, 25216]
    - [99, 71.854]
  - - [1536, 384, 1, 69344]
    - [99, 81.731]
  - - [1536, 384, 1, 91408]
    - [99, 82.777]
  - - [192, 192, 1, 100352]
    - [166, 26.854]
  - - [192, 192, 1, 275968]
    - [166, 31.644]
  - - [192, 192, 1, 363776]
    - [166, 32.66]
  - - [192, 768, 1, 100352]
    - [170, 49.914]
  - - [192, 768, 1, 275968]
    - [170, 55.652]
  - - [192, 768, 1, 363776]
    - [170, 55.226]
  - - [196, 1728, 1, 384]
    - [54, 5.814]
  - - [256, 64, 1, 1103872]
    - [166, 25.047]
  - - [256, 64, 1, 1455104]
    - [166, 25.308]
  - - [256, 64, 1, 401408]
    - [166, 23.256]
  - - [384, 1000, 1, 128]
    - [53, 3.146]
  - - [384, 1000, 1, 352]
    - [200, 7.116]
  - - [384, 1000, 1, 464]
    - [4, 8.062]
  - - [384, 1536, 1, 25216]
    - [99, 72.257]
  - - [384, 1536, 1, 69344]
    - [99, 81.687]
  - - [384, 1536, 1, 91408]
    - [99, 82.935]
  - - [384, 384, 1, 17600]
    - [91, 30.299]
  - - [384, 384, 1, 23200]
    - [170, 32.172]
  - - [384, 384, 1, 25216]
    - [91, 35.173]
  - - [384, 384, 1, 6400]
    - [65, 17.661]
  - - [384, 384, 1, 69344]
    - [170, 46.564]
  - - [384, 384, 1, 91408]
    - [170, 48.812]
  - - [64, 256, 1, 1103872]
    - [166, 25.072]
  - - [64, 256, 1, 1455104]
    - [166, 25.17]
  - - [64, 256, 1, 401408]
    - [166, 23.133]
  - - [64, 64, 1, 1103872]
    - [62, 8.738]
  - - [64, 64, 1, 1455104]
    - [62, 8.84]
  - - [64, 64, 1, 401408]
    - [62, 7.856]
  - - [768, 192, 1, 100352]
    - [65, 50.049]
  - - [768, 192, 1, 275968]
    - [170, 55.944]
  - - [768, 192, 1, 363776]
    - [170, 55.714]
  - - [784, 576, 1, 192]
    - [53, 4.742]
  - - [192, 196, 128, 192]
    - [162, 22.311]
  - - [192, 196, 352, 192]
    - [162, 28.597]
  - - [192, 196, 464, 192]
    - [162, 29.858]
  - - [196, 64, 1056, 784]
    - [155, 30.549]
  - - [196, 64, 1392, 784]
    - [155, 29.723]
  - - [196, 64, 384, 784]
    - [155, 27.152]
  - - [196, 9, 192, 1]
    - [38, 0.019]
  - - [196, 9, 384, 1]
    - [38, 0.03]
  - - [3136, 9, 64, 1]
    - [41, 0.065]
  - - [49, 9, 384, 1]
    - [38, 0.011]
  - - [50, 64, 2112, 197]
    - [126, 13.441]
  - - [50, 64, 2784, 197]
    - [126, 14.144]
  - - [50, 64, 768, 197]
    - [128, 10.78]
  - - [64, 196, 1056, 784]
    - [30, 31.109]
  - - [64, 196, 1392, 784]
    - [217, 31.67]
  - - [64, 196, 384, 784]
    - [145, 31.353]
  - - [64, 50, 2112, 197]
    - [116, 17.606]
  - - [64, 50, 2784, 197]
    - [116, 18.777]
  - - [64, 50, 768, 197]
    - [179, 13.671]
  - - [64, 784, 128, 3136]
    - [209, 47.156]
  - - [64, 784, 352, 3136]
    - [189, 50.251]
  - - [64, 784, 464, 3136]
    - [189, 50.716]
  - - [64, 784, 128, 64]
    - [219, 12.55]
  - - [64, 784, 352, 64]
    - [219, 17.233]
  - - [64, 784, 464, 64]
    - [218, 18.012]
  - - [784, 64, 128, 3136]
    - [33, 49.426]
  - - [784, 64, 352, 3136]
    - [32, 52.175]
  - - [784, 64, 464, 3136]
    - [33, 52.117]
  - - [784, 9, 192, 1]
    - [41, 0.057]
  - - [784, 9, 64, 1]
    - [41, 0.028]
  - - [1536, 384, 1, 50432]
    - [99, 80.54]
  - - [192, 192, 1, 200704]
    - [166, 30.714]
  - - [192, 768, 1, 200704]
    - [170, 53.935]
  - - [256, 64, 1, 802816]
    - [166, 24.6]
  - - [384, 1000, 1, 256]
    - [218, 5.35]
  - - [384, 1536, 1, 50432]
    - [99, 80.482]
  - - [384, 384, 1, 12800]
    - [91, 26.027]
  - - [384, 384, 1, 50432]
    - [170, 43.276]
  - - [64, 256, 1, 802816]
    - [166, 24.522]
  - - [64, 64, 1, 802816]
    - [62, 8.511]
  - - [768, 192, 1, 200704]
    - [170, 53.657]
  - - [192, 196, 256, 192]
    - [162, 27.134]
  - - [196, 64, 768, 784]
    - [155, 30.786]
  - - [50, 64, 1536, 197]
    - [125, 12.759]
  - - [64, 196, 768, 784]
    - [59, 31.33]
  - - [64, 50, 1536, 197]
    - [116, 16.861]
  - - [64, 784, 256, 3136]
    - [103, 49.691]
  - - [64, 784, 256, 64]
    - [218, 15.914]
  - - [784, 64, 256, 3136]
    - [32, 51.589]
- null
- null
- DeviceEfficiency
- Fp16AltImpl
