library/src/blas3/Tensile/Logic/asm_full/aldebaran/fp16altimpl/aldebaran_Cijk_Alik_Bljk_HHS_BHR.yaml
- {MinimumRequiredVersion: 4.31.0}
- aldebaran
- gfx90a
- [Device 0050, Device 0051, Device 0052, Device 0054, Device 0062, Device 7400, Device
    SolutionIndex: 0
    SolutionNameMin: Cijk_Alik_Bljk_HHS_BH_MT16x16x128_MI16x16x16x1_SE_1LDSB0_AF0EM1_EPS0_GRVW8_LBSPP256_LPA16_LPB16_PGR2_PLR9_SU0_SUS256_SRVW0_TT1_16_WG16_4_1_WGM1
    SolutionIndex: 1
    SolutionNameMin: Cijk_Alik_Bljk_HHS_BH_MT128x64x32_MI32x32x8x1_SE_1LDSB1_AF0EM8_EPS1_GRVW8_GSU1_GSUAMB_LBSPP128_LPA8_LPB8_LRVW8_PGR1_PLR5_SU0_SUS0_SRVW4_TT2_32_VAW2_WSGRA1_WSGRB1_WG64_4_1_WGM1
    SolutionIndex: 2
    SolutionNameMin: Cijk_Alik_Bljk_HHS_BH_MT64x16x128_MI16x16x16x1_SE_1LDSB1_AF0EM8_EPS1_GRVW8_GSU1_GSUAMB_LBSPP256_LPA16_LPB16_LRVW8_PGR1_PLR9_SU0_SUS0_SRVW0_TT1_16_VAW2_WSGRA1_WSGRB1_WG64_4_1_WGM1
    SolutionIndex: 3
    SolutionNameMin: Cijk_Alik_Bljk_HHS_BH_MT128x128x64_MI32x32x8x1_SE_1LDSB1_AF0EM8_EPS0_GRVW8_GSU1_GSUAMB_LBSPP128_LPA8_LPB8_LRVW8_PGR2_PLR9_SU0_SUS0_SRVW4_TT2_64_VAW2_WSGRA1_WSGRB1_WG64_4_1_WGM15
    SolutionIndex: 4
    SolutionNameMin: Cijk_Alik_Bljk_HHS_BH_MT128x64x64_MI32x32x8x1_SE_1LDSB1_AF0EM8_EPS0_GRVW8_GSU1_GSUAMB_LBSPP128_LPA8_LPB8_LRVW8_PGR2_PLR9_SU32_SUS128_SRVW4_TT2_32_VAW2_WSGRA1_WSGRB1_WG64_4_1_WGM15
    SolutionIndex: 5
    SolutionNameMin: Cijk_Alik_Bljk_HHS_BH_MT64x64x32_MI32x32x8x1_SE_1LDSB1_AF0EM8_EPS0_GRVW8_GSU1_GSUAMB_LBSPP128_LPA8_LPB8_LRVW8_PGR2_PLR5_SU0_SUS0_SRVW4_TT1_32_VAW2_WSGRA1_WSGRB1_WG64_4_1_WGM1
    SolutionIndex: 6
    SolutionNameMin: Cijk_Alik_Bljk_HHS_BH_MT64x128x64_MI32x32x8x1_SE_1LDSB1_AF0EM8_EPS0_GRVW8_GSU1_GSUAMB_LBSPP128_LPA8_LPB8_LRVW8_PGR2_PLR9_SU0_SUS0_SRVW4_TT1_64_VAW2_WSGRA1_WSGRB1_WG64_4_1_WGM15
    SolutionIndex: 7
    SolutionNameMin: Cijk_Alik_Bljk_HHS_BH_MT64x16x128_MI16x16x16x1_SE_1LDSB0_AF0EM1_EPS0_GRVW8_GSU1_GSUAMB_LBSPP256_LPA16_LPB16_LRVW8_PGR2_PLR9_SU0_SUS0_SRVW0_TT1_16_VAW2_WSGRA1_WSGRB1_WG64_4_1_WGM2
    SolutionIndex: 8
    SolutionNameMin: Cijk_Alik_Bljk_HHS_BH_MT64x64x32_MI32x32x8x1_SE_1LDSB1_AF0EM8_EPS0_GRVW8_GSU1_GSUAMB_LBSPP128_LPA8_LPB8_LRVW8_PGR2_PLR5_SU32_SUS128_SRVW4_TT1_32_VAW2_WSGRA1_WSGRB1_WG64_4_1_WGM1
    SolutionIndex: 9
    SolutionNameMin: Cijk_Alik_Bljk_HHS_BH_MT128x96x64_MI32x32x8x1_SE_1LDSB1_AF0EM8_EPS0_GRVW8_GSU1_GSUAMB_LBSPP128_LPA8_LPB8_LRVW8_PGR2_PLR9_SU0_SUS0_SRVW4_TT1_96_VAW2_WSGRA1_WSGRB1_WG128_2_1_WGM15
    SolutionIndex: 10
    SolutionNameMin: Cijk_Alik_Bljk_HHS_BH_MT16x16x128_MI16x16x16x1_SE_1LDSB1_AF0EM1_EPS1_GRVW8_GSU1_GSUAMB_LBSPP256_LPA16_LPB16_LRVW8_PGR1_PLR9_SU0_SUS0_SRVW0_TT1_16_VAW2_WSGRA1_WSGRB1_WG16_4_1_WGM1
    SolutionIndex: 11
    SolutionNameMin: Cijk_Alik_Bljk_HHS_BH_MT64x16x32_MI16x16x16x1_SE_1LDSB1_AF0EM1_EPS1_GRVW8_GSU1_GSUAMB_LBSPP128_LPA16_LPB16_LRVW8_PGR1_PLR2_SU0_SUS0_SRVW0_TT1_16_VAW2_WSGRA1_WSGRB1_WG64_4_1_WGM1
    SolutionIndex: 12
    SolutionNameMin: Cijk_Alik_Bljk_HHS_BH_MT16x16x32_MI16x16x16x1_SE_1LDSB1_AF0EM1_EPS0_GRVW8_GSU1_GSUAMB_LBSPP128_LPA16_LPB16_LRVW8_PGR2_PLR2_SU0_SUS0_SRVW0_TT1_16_VAW2_WSGRA1_WSGRB1_WG16_4_1_WGM1
    SolutionIndex: 13
    SolutionNameMin: Cijk_Alik_Bljk_HHS_BH_MT128x96x64_MI32x32x8x1_SE_1LDSB1_AF0EM8_EPS0_GRVW8_GSU1_GSUAMB_LBSPP128_LPA8_LPB8_LRVW8_PGR2_PLR9_SU0_SUS0_SRVW4_TT1_96_VAW2_WSGRA1_WSGRB1_WG128_2_1_WGM2
    SolutionIndex: 14
    SolutionNameMin: Cijk_Alik_Bljk_HHS_BH_MT32x64x64_MI16x16x16x1_SE_1LDSB1_AF0EM8_EPS1_GRVW8_GSU1_GSUAMB_LBSPP128_LPA16_LPB16_LRVW8_PGR1_PLR5_SU0_SUS0_SRVW4_TT1_32_VAW2_WSGRA1_WSGRB1_WG32_8_1_WGM2
    SolutionIndex: 15
    SolutionNameMin: Cijk_Alik_Bljk_HHS_BH_MT128x96x64_MI32x32x8x1_SE_1LDSB1_AF0EM8_EPS0_GRVW8_GSU1_GSUAMB_LBSPP128_LPA8_LPB8_LRVW8_PGR2_PLR9_SU0_SUS0_SRVW4_TT1_96_VAW2_WSGRA1_WSGRB1_WG128_2_1_WGM1
    SolutionIndex: 16
    SolutionNameMin: Cijk_Alik_Bljk_HHS_BH_MT64x64x64_MI32x32x8x1_SE_1LDSB0_AF0EM8_EPS0_GRVW8_GSU1_GSUAMB_LBSPP128_LPA8_LPB8_LRVW8_PGR2_PLR9_SU0_SUS0_SRVW4_TT1_32_VAW2_WSGRA1_WSGRB1_WG64_4_1_WGM2
    SolutionIndex: 17
    SolutionNameMin: Cijk_Alik_Bljk_HHS_BH_MT16x64x128_MI16x16x16x1_SE_1LDSB0_AF0EM1_EPS0_GRVW8_GSU1_GSUAMB_LBSPP256_LPA16_LPB16_LRVW8_PGR2_PLR9_SU0_SUS0_SRVW0_TT1_16_VAW2_WSGRA1_WSGRB1_WG16_16_1_WGM1
    SolutionIndex: 18
    SolutionNameMin: Cijk_Alik_Bljk_HHS_BH_MT16x64x32_MI16x16x16x1_SE_1LDSB1_AF0EM8_EPS0_GRVW8_GSU1_GSUAMB_LBSPP128_LPA16_LPB16_LRVW8_PGR2_PLR2_SU0_SUS0_SRVW0_TT1_16_VAW2_WSGRA1_WSGRB1_WG16_16_1_WGM1
    SolutionIndex: 19
    SolutionNameMin: Cijk_Alik_Bljk_HHS_BH_MT16x64x128_MI16x16x16x1_SE_1LDSB0_AF0EM8_EPS0_GRVW8_GSU1_GSUAMB_LBSPP256_LPA16_LPB16_LRVW8_PGR2_PLR9_SU0_SUS0_SRVW0_TT1_16_VAW2_WSGRA1_WSGRB1_WG16_16_1_WGM2
    SolutionIndex: 20
    SolutionNameMin: Cijk_Alik_Bljk_HHS_BH_MT128x96x64_MI32x32x8x1_SE_1LDSB1_AF0EM8_EPS0_GRVW8_GSU1_GSUAMB_LBSPP128_LPA8_LPB8_LRVW8_PGR2_PLR9_SU32_SUS128_SRVW4_TT1_96_VAW2_WSGRA1_WSGRB1_WG128_2_1_WGM15
    SolutionIndex: 21
    SolutionNameMin: Cijk_Alik_Bljk_HHS_BH_MT16x16x128_MI16x16x16x1_SE_1LDSB0_AF0EM8_EPS0_GRVW8_GSU1_GSUAMB_LBSPP256_LPA16_LPB16_LRVW8_PGR2_PLR9_SU0_SUS0_SRVW0_TT1_16_VAW2_WSGRA1_WSGRB1_WG16_4_1_WGM15
    SolutionIndex: 22
    SolutionNameMin: Cijk_Alik_Bljk_HHS_BH_MT64x16x128_MI16x16x16x1_SE_1LDSB0_AF0EM1_EPS0_GRVW8_GSU1_GSUAMB_LBSPP256_LPA16_LPB16_LRVW8_PGR2_PLR9_SU0_SUS0_SRVW0_TT1_16_VAW2_WSGRA1_WSGRB1_WG64_4_1_WGM1
    SolutionIndex: 23
    SolutionNameMin: Cijk_Alik_Bljk_HHS_BH_MT16x64x128_MI16x16x16x1_SE_1LDSB0_AF0EM1_EPS1_GRVW8_GSU1_GSUAMB_LBSPP256_LPA16_LPB16_LRVW8_PGR1_PLR9_SU0_SUS0_SRVW0_TT1_16_VAW2_WSGRA1_WSGRB1_WG16_16_1_WGM1
    SolutionIndex: 24
    SolutionNameMin: Cijk_Alik_Bljk_HHS_BH_MT64x64x64_MI32x32x8x1_SE_1LDSB0_AF0EM8_EPS0_GRVW8_GSU1_GSUAMB_LBSPP128_LPA8_LPB8_LRVW8_PGR2_PLR9_SU0_SUS0_SRVW4_TT1_32_VAW2_WSGRA1_WSGRB1_WG64_4_1_WGM1
    SolutionIndex: 25
    SolutionNameMin: Cijk_Alik_Bljk_HHS_BH_MT16x16x128_MI16x16x16x1_SE_1LDSB0_AF0EM1_EPS0_GRVW8_GSU1_GSUAMB_LBSPP256_LPA16_LPB16_LRVW8_PGR2_PLR9_SU0_SUS0_SRVW0_TT1_16_VAW2_WSGRA1_WSGRB1_WG16_4_1_WGM15
    SolutionIndex: 26
    SolutionNameMin: Cijk_Alik_Bljk_HHS_BH_MT64x32x64_MI16x16x16x1_SE_1LDSB1_AF0EM8_EPS1_GRVW8_GSU1_GSUAMB_LBSPP128_LPA16_LPB16_LRVW8_PGR1_PLR5_SU0_SUS0_SRVW4_TT2_16_VAW2_WSGRA1_WSGRB1_WG32_8_1_WGM1
    SolutionIndex: 27
    SolutionNameMin: Cijk_Alik_Bljk_HHS_BH_MT128x128x32_MI32x32x8x1_SE_1LDSB1_AF0EM8_EPS1_GRVW8_GSU1_GSUAMB_LBSPP128_LPA8_LPB8_LRVW8_PGR1_PLR5_SU32_SUS256_SRVW4_TT2_64_VAW2_WSGRA1_WSGRB1_WG64_4_1_WGM1
    SolutionIndex: 28
    SolutionNameMin: Cijk_Alik_Bljk_HHS_BH_MT128x64x64_MI32x32x8x1_SE_1LDSB1_AF0EM8_EPS0_GRVW8_GSU1_GSUAMB_LBSPP128_LPA8_LPB8_LRVW8_PGR2_PLR9_SU0_SUS0_SRVW4_TT2_32_VAW2_WSGRA1_WSGRB1_WG64_4_1_WGM1
    SolutionIndex: 29
    SolutionNameMin: Cijk_Alik_Bljk_HHS_BH_MT16x16x128_MI16x16x16x1_SE_1LDSB0_AF0EM1_EPS0_GRVW8_GSU1_GSUAMB_LBSPP256_LPA16_LPB16_LRVW8_PGR2_PLR9_SU0_SUS0_SRVW0_TT1_16_VAW2_WSGRA1_WSGRB1_WG16_4_1_WGM2
    SolutionIndex: 30
    SolutionNameMin: Cijk_Alik_Bljk_HHS_BH_MT64x32x32_MI16x16x16x1_SE_1LDSB1_AF0EM8_EPS1_GRVW2_GSU1_GSUAMB_LBSPP128_LPA16_LPB16_LRVW8_PGR1_PLR2_SU0_SUS0_SRVW4_TT2_16_VAW2_WSGRA1_WSGRB1_WG32_8_1_WGM2
    SolutionIndex: 31
    SolutionNameMin: Cijk_Alik_Bljk_HHS_BH_MT64x64x64_MI32x32x8x1_SE_1LDSB1_AF0EM1_EPS1_GRVW8_GSU1_GSUAMB_LBSPP128_LPA8_LPB8_LRVW8_PGR1_PLR9_SU32_SUS128_SRVW4_TT1_32_VAW2_WSGRA1_WSGRB1_WG64_4_1_WGM1
    SolutionIndex: 32
    SolutionNameMin: Cijk_Alik_Bljk_HHS_BH_MT128x64x64_MI32x32x8x1_SE_1LDSB1_AF0EM8_EPS0_GRVW8_GSU1_GSUAMB_LBSPP128_LPA8_LPB8_LRVW8_PGR2_PLR9_SU0_SUS0_SRVW4_TT2_32_VAW2_WSGRA1_WSGRB1_WG64_4_1_WGM15
    SolutionIndex: 33
    SolutionNameMin: Cijk_Alik_Bljk_HHS_BH_MT64x64x64_MI32x32x8x1_SE_1LDSB1_AF0EM8_EPS1_GRVW8_GSU1_GSUAMB_LBSPP128_LPA8_LPB8_LRVW8_PGR1_PLR9_SU0_SUS0_SRVW4_TT1_32_VAW2_WSGRA1_WSGRB1_WG64_4_1_WGM1
    SolutionIndex: 34
    SolutionNameMin: Cijk_Alik_Bljk_HHS_BH_MT128x96x32_MI32x32x8x1_SE_1LDSB1_AF0EM8_EPS1_GRVW4_GSU1_GSUAMB_LBSPP128_LPA8_LPB8_LRVW8_PGR1_PLR5_SU0_SUS0_SRVW4_TT1_96_VAW2_WSGRA1_WSGRB1_WG128_2_1_WGM2
    SolutionIndex: 35
    SolutionNameMin: Cijk_Alik_Bljk_HHS_BH_MT96x128x64_MI32x32x8x1_SE_1LDSB1_AF0EM8_EPS0_GRVW8_GSU1_GSUAMB_LBSPP128_LPA8_LPB8_LRVW8_PGR2_PLR9_SU0_SUS0_SRVW0_TT3_32_VAW2_WSGRA1_WSGRB1_WG32_8_1_WGM2
    SolutionIndex: 36
    SolutionNameMin: Cijk_Alik_Bljk_HHS_BH_MT64x16x128_MI16x16x16x1_SE_1LDSB0_AF0EM8_EPS0_GRVW8_GSU1_GSUAMB_LBSPP256_LPA16_LPB16_LRVW8_PGR2_PLR9_SU0_SUS0_SRVW0_TT1_16_VAW2_WSGRA1_WSGRB1_WG64_4_1_WGM2
    SolutionIndex: 37
    SolutionNameMin: Cijk_Alik_Bljk_HHS_BH_MT128x64x64_MI32x32x8x1_SE_1LDSB0_AF0EM8_EPS0_GRVW8_GSU1_GSUAMB_LBSPP128_LPA8_LPB8_LRVW8_PGR2_PLR9_SU0_SUS0_SRVW4_TT2_32_VAW2_WSGRA1_WSGRB1_WG64_4_1_WGM1
    SolutionIndex: 38
    SolutionNameMin: Cijk_Alik_Bljk_HHS_BH_MT128x96x32_MI32x32x8x1_SE_1LDSB1_AF0EM8_EPS1_GRVW4_GSU1_GSUAMB_LBSPP128_LPA8_LPB8_LRVW8_PGR1_PLR5_SU32_SUS128_SRVW4_TT1_96_VAW2_WSGRA1_WSGRB1_WG128_2_1_WGM1
    SolutionIndex: 39
    SolutionNameMin: Cijk_Alik_Bljk_HHS_BH_MT64x16x128_MI16x16x16x1_SE_1LDSB0_AF0EM1_EPS0_GRVW8_GSU1_GSUAMB_LBSPP256_LPA16_LPB16_LRVW8_PGR2_PLR9_SU32_SUS256_SRVW0_TT1_16_VAW2_WSGRA1_WSGRB1_WG64_4_1_WGM1
    SolutionIndex: 40
    SolutionNameMin: Cijk_Alik_Bljk_HHS_BH_MT64x64x32_MI32x32x8x1_SE_1LDSB1_AF0EM8_EPS1_GRVW2_GSU1_GSUAMB_LBSPP128_LPA8_LPB8_LRVW8_PGR1_PLR5_SU32_SUS128_SRVW4_TT1_32_VAW2_WSGRA1_WSGRB1_WG64_4_1_WGM1
    SolutionIndex: 41
    SolutionNameMin: Cijk_Alik_Bljk_HHS_BH_MT32x64x64_MI16x16x16x1_SE_1LDSB1_AF0EM1_EPS1_GRVW8_GSU1_GSUAMB_LBSPP128_LPA16_LPB16_LRVW8_PGR1_PLR5_SU32_SUS128_SRVW4_TT1_32_VAW2_WSGRA1_WSGRB1_WG32_8_1_WGM1
    SolutionIndex: 42
    SolutionNameMin: Cijk_Alik_Bljk_HHS_BH_MT128x64x64_MI32x32x8x1_SE_1LDSB1_AF0EM8_EPS0_GRVW8_GSU1_GSUAMB_LBSPP128_LPA8_LPB8_LRVW8_PGR2_PLR9_SU0_SUS0_SRVW4_TT2_32_VAW2_WSGRA1_WSGRB1_WG64_4_1_WGM2
    SolutionIndex: 43
    SolutionNameMin: Cijk_Alik_Bljk_HHS_BH_MT64x32x32_MI16x16x16x1_SE_1LDSB0_AF0EM8_EPS1_GRVW4_GSU1_GSUAMB_LBSPP128_LPA16_LPB16_LRVW8_PGR1_PLR2_SU0_SUS0_SRVW4_TT2_16_VAW2_WSGRA1_WSGRB1_WG32_8_1_WGM1
    SolutionIndex: 44
    SolutionNameMin: Cijk_Alik_Bljk_HHS_BH_MT64x128x64_MI32x32x8x1_SE_1LDSB1_AF0EM8_EPS0_GRVW8_GSU1_GSUAMB_LBSPP128_LPA8_LPB8_LRVW8_PGR2_PLR9_SU0_SUS0_SRVW4_TT1_64_VAW2_WSGRA1_WSGRB1_WG64_4_1_WGM1
    SolutionIndex: 45
    SolutionNameMin: Cijk_Alik_Bljk_HHS_BH_MT128x96x64_MI32x32x8x1_SE_1LDSB1_AF0EM8_EPS1_GRVW8_GSU1_GSUAMB_LBSPP128_LPA8_LPB8_LRVW8_PGR1_PLR9_SU32_SUS128_SRVW4_TT1_96_VAW2_WSGRA1_WSGRB1_WG128_2_1_WGM1
    SolutionIndex: 46
    SolutionNameMin: Cijk_Alik_Bljk_HHS_BH_MT16x16x32_MI16x16x16x1_SE_1LDSB0_AF0EM8_EPS1_GRVW4_GSU1_GSUAMB_LBSPP128_LPA16_LPB16_LRVW8_PGR1_PLR2_SU0_SUS0_SRVW0_TT1_16_VAW2_WSGRA1_WSGRB1_WG16_4_1_WGM1
    SolutionIndex: 47
    SolutionNameMin: Cijk_Alik_Bljk_HHS_BH_MT64x32x32_MI16x16x16x1_SE_1LDSB0_AF0EM8_EPS1_GRVW8_GSU1_GSUAMB_LBSPP128_LPA16_LPB16_LRVW8_PGR1_PLR2_SU0_SUS0_SRVW4_TT2_16_VAW2_WSGRA1_WSGRB1_WG32_8_1_WGM1
    SolutionIndex: 48
    SolutionNameMin: Cijk_Alik_Bljk_HHS_BH_MT128x128x32_MI32x32x8x1_SE_1LDSB1_AF0EM8_EPS1_GRVW8_GSU1_GSUAMB_LBSPP128_LPA8_LPB8_LRVW8_PGR1_PLR5_SU0_SUS0_SRVW4_TT2_64_VAW2_WSGRA1_WSGRB1_WG64_4_1_WGM1
    SolutionIndex: 49
    SolutionNameMin: Cijk_Alik_Bljk_HHS_BH_MT64x64x64_MI32x32x8x1_SE_1LDSB1_AF0EM8_EPS1_GRVW8_GSU1_GSUAMB_LBSPP128_LPA8_LPB8_LRVW8_PGR1_PLR9_SU32_SUS256_SRVW4_TT1_32_VAW2_WSGRA1_WSGRB1_WG64_4_1_WGM2
    SolutionIndex: 50
    SolutionNameMin: Cijk_Alik_Bljk_HHS_BH_MT64x64x32_MI32x32x8x1_SE_1LDSB1_AF0EM8_EPS1_GRVW8_GSU1_GSUAMB_LBSPP128_LPA8_LPB8_LRVW8_PGR1_PLR5_SU0_SUS0_SRVW4_TT1_32_VAW2_WSGRA1_WSGRB1_WG64_4_1_WGM1
    SolutionIndex: 51
    SolutionNameMin: Cijk_Alik_Bljk_HHS_BH_MT64x32x64_MI16x16x16x1_SE_1LDSB0_AF0EM8_EPS0_GRVW8_GSU1_GSUAMB_LBSPP128_LPA16_LPB16_LRVW8_PGR2_PLR5_SU32_SUS128_SRVW4_TT2_16_VAW2_WSGRA1_WSGRB1_WG32_8_1_WGM1
    SolutionIndex: 52
    SolutionNameMin: Cijk_Alik_Bljk_HHS_BH_MT128x128x64_MI32x32x8x1_SE_1LDSB1_AF0EM8_EPS0_GRVW8_GSU1_GSUAMB_LBSPP128_LPA8_LPB8_LRVW8_PGR2_PLR9_SU0_SUS0_SRVW4_TT2_64_VAW2_WSGRA1_WSGRB1_WG64_4_1_WGM2
    SolutionIndex: 53
    SolutionNameMin: Cijk_Alik_Bljk_HHS_BH_MT128x160x64_MI32x32x8x1_SE_1LDSB1_AF0EM8_EPS0_GRVW4_GSU1_GSUAMB_LBSPP128_LPA8_LPB8_LRVW8_PGR2_PLR9_SU0_SUS0_SRVW4_TT1_160_VAW2_WSGRA1_WSGRB1_WG128_2_1_WGM2
    SolutionIndex: 54
    SolutionNameMin: Cijk_Alik_Bljk_HHS_BH_MT16x16x128_MI16x16x16x1_SE_1LDSB1_AF0EM1_EPS1_GRVW8_GSU1_GSUAMB_LBSPP256_LPA16_LPB16_LRVW8_PGR1_PLR9_SU0_SUS0_SRVW0_TT1_16_VAW2_WSGRA1_WSGRB1_WG16_4_1_WGM15
    SolutionIndex: 55
    SolutionNameMin: Cijk_Alik_Bljk_HHS_BH_MT32x32x32_MI16x16x16x1_SE_1LDSB1_AF0EM8_EPS1_GRVW4_GSU1_GSUAMB_LBSPP128_LPA16_LPB16_LRVW8_PGR1_PLR2_SU0_SUS0_SRVW4_TT1_16_VAW2_WSGRA1_WSGRB1_WG32_8_1_WGM2
    SolutionIndex: 56
    SolutionNameMin: Cijk_Alik_Bljk_HHS_BH_MT128x128x32_MI32x32x8x1_SE_1LDSB1_AF0EM8_EPS1_GRVW8_GSU1_GSUAMB_LBSPP128_LPA8_LPB8_LRVW8_PGR1_PLR5_SU0_SUS0_SRVW4_TT2_64_VAW2_WSGRA1_WSGRB1_WG64_4_1_WGM2
    SolutionIndex: 57
    SolutionNameMin: Cijk_Alik_Bljk_HHS_BH_MT32x64x32_MI16x16x16x1_SE_1LDSB0_AF0EM8_EPS1_GRVW4_GSU1_GSUAMB_LBSPP128_LPA16_LPB16_LRVW8_PGR1_PLR2_SU0_SUS0_SRVW4_TT1_32_VAW2_WSGRA1_WSGRB1_WG32_8_1_WGM1
    SolutionIndex: 58
    SolutionNameMin: Cijk_Alik_Bljk_HHS_BH_MT64x32x64_MI16x16x16x1_SE_1LDSB0_AF0EM8_EPS0_GRVW8_GSU1_GSUAMB_LBSPP128_LPA16_LPB16_LRVW8_PGR2_PLR5_SU0_SUS0_SRVW4_TT2_16_VAW2_WSGRA1_WSGRB1_WG32_8_1_WGM15
    SolutionIndex: 59
    SolutionNameMin: Cijk_Alik_Bljk_HHS_BH_MT16x16x128_MI16x16x16x1_SE_1LDSB1_AF0EM8_EPS1_GRVW8_GSU1_GSUAMB_LBSPP256_LPA16_LPB16_LRVW8_PGR1_PLR9_SU0_SUS0_SRVW0_TT1_16_VAW2_WSGRA1_WSGRB1_WG16_4_1_WGM2
    SolutionIndex: 60
    SolutionNameMin: Cijk_Alik_Bljk_HHS_BH_MT64x64x64_MI32x32x8x1_SE_1LDSB0_AF0EM8_EPS0_GRVW8_GSU1_GSUAMB_LBSPP128_LPA8_LPB8_LRVW8_PGR2_PLR9_SU0_SUS0_SRVW4_TT1_32_VAW2_WSGRA1_WSGRB1_WG64_4_1_WGM15
    SolutionIndex: 61
    SolutionNameMin: Cijk_Alik_Bljk_HHS_BH_MT64x128x32_MI32x32x8x1_SE_1LDSB1_AF0EM8_EPS1_GRVW8_GSU1_GSUAMB_LBSPP128_LPA8_LPB8_LRVW8_PGR1_PLR5_SU0_SUS0_SRVW4_TT1_64_VAW2_WSGRA1_WSGRB1_WG64_4_1_WGM2
    SolutionIndex: 62
    SolutionNameMin: Cijk_Alik_Bljk_HHS_BH_MT64x64x32_MI32x32x8x1_SE_1LDSB1_AF0EM8_EPS1_GRVW8_GSU1_GSUAMB_LBSPP128_LPA8_LPB8_LRVW8_PGR1_PLR5_SU32_SUS128_SRVW4_TT1_32_VAW2_WSGRA1_WSGRB1_WG64_4_1_WGM1
    SolutionIndex: 63
    SolutionNameMin: Cijk_Alik_Bljk_HHS_BH_MT64x128x64_MI32x32x8x1_SE_1LDSB0_AF0EM8_EPS0_GRVW8_GSU1_GSUAMB_LBSPP128_LPA8_LPB8_LRVW8_PGR2_PLR9_SU32_SUS128_SRVW4_TT1_64_VAW2_WSGRA1_WSGRB1_WG64_4_1_WGM1
    SolutionIndex: 64
    SolutionNameMin: Cijk_Alik_Bljk_HHS_BH_MT128x64x64_MI32x32x8x1_SE_1LDSB0_AF0EM8_EPS0_GRVW8_GSU1_GSUAMB_LBSPP128_LPA8_LPB8_LRVW8_PGR2_PLR9_SU0_SUS0_SRVW4_TT2_32_VAW2_WSGRA1_WSGRB1_WG64_4_1_WGM15
    SolutionIndex: 65
    SolutionNameMin: Cijk_Alik_Bljk_HHS_BH_MT16x64x32_MI16x16x16x1_SE_1LDSB0_AF0EM1_EPS1_GRVW2_GSU1_GSUAMB_LBSPP128_LPA16_LPB16_LRVW8_PGR1_PLR2_SU0_SUS0_SRVW0_TT1_16_VAW2_WSGRA1_WSGRB1_WG16_16_1_WGM1
    SolutionIndex: 66
    SolutionNameMin: Cijk_Alik_Bljk_HHS_BH_MT128x96x32_MI32x32x8x1_SE_1LDSB1_AF0EM8_EPS1_GRVW2_GSU1_GSUAMB_LBSPP128_LPA8_LPB8_LRVW8_PGR1_PLR5_SU32_SUS256_SRVW4_TT1_96_VAW2_WSGRA1_WSGRB1_WG128_2_1_WGM2
    SolutionIndex: 67
    SolutionNameMin: Cijk_Alik_Bljk_HHS_BH_MT64x64x64_MI32x32x8x1_SE_1LDSB0_AF0EM8_EPS0_GRVW8_GSU1_GSUAMB_LBSPP128_LPA8_LPB8_LRVW8_PGR2_PLR9_SU32_SUS128_SRVW4_TT1_32_VAW2_WSGRA1_WSGRB1_WG64_4_1_WGM15
    SolutionIndex: 68
    SolutionNameMin: Cijk_Alik_Bljk_HHS_BH_MT128x256x32_MI32x32x8x1_SE_1LDSB1_AF0EM8_EPS1_GRVW4_GSU1_GSUAMB_LBSPP128_LPA8_LPB8_LRVW8_PGR1_PLR5_SU0_SUS0_SRVW4_TT2_128_VAW2_WSGRA1_WSGRB1_WG64_4_1_WGM1
    SolutionIndex: 69
    SolutionNameMin: Cijk_Alik_Bljk_HHS_BH_MT128x160x32_MI32x32x8x1_SE_1LDSB1_AF0EM8_EPS1_GRVW4_GSU1_GSUAMB_LBSPP128_LPA8_LPB8_LRVW8_PGR1_PLR5_SU0_SUS0_SRVW4_TT1_160_VAW2_WSGRA1_WSGRB1_WG128_2_1_WGM15
    SolutionIndex: 70
    SolutionNameMin: Cijk_Alik_Bljk_HHS_BH_MT64x32x64_MI16x16x16x1_SE_1LDSB0_AF0EM8_EPS1_GRVW8_GSU1_GSUAMB_LBSPP128_LPA16_LPB16_LRVW8_PGR1_PLR5_SU0_SUS0_SRVW4_TT2_16_VAW2_WSGRA1_WSGRB1_WG32_8_1_WGM2
    SolutionIndex: 71
    SolutionNameMin: Cijk_Alik_Bljk_HHS_BH_MT64x128x64_MI32x32x8x1_SE_1LDSB1_AF0EM8_EPS0_GRVW8_GSU1_GSUAMB_LBSPP128_LPA8_LPB8_LRVW8_PGR2_PLR9_SU32_SUS128_SRVW4_TT1_64_VAW2_WSGRA1_WSGRB1_WG64_4_1_WGM1
    SolutionIndex: 72
    SolutionNameMin: Cijk_Alik_Bljk_HHS_BH_MT128x160x64_MI32x32x8x1_SE_1LDSB1_AF0EM8_EPS0_GRVW8_GSU1_GSUAMB_LBSPP128_LPA8_LPB8_LRVW8_PGR2_PLR9_SU32_SUS128_SRVW4_TT1_160_VAW2_WSGRA1_WSGRB1_WG128_2_1_WGM15
    SolutionIndex: 73
    SolutionNameMin: Cijk_Alik_Bljk_HHS_BH_MT32x32x64_MI16x16x16x1_SE_1LDSB0_AF0EM1_EPS1_GRVW8_GSU1_GSUAMB_LBSPP128_LPA16_LPB16_LRVW8_PGR1_PLR5_SU0_SUS0_SRVW4_TT1_16_VAW2_WSGRA1_WSGRB1_WG32_8_1_WGM1
    SolutionIndex: 74
    SolutionNameMin: Cijk_Alik_Bljk_HHS_BH_MT64x128x64_MI32x32x8x1_SE_1LDSB1_AF0EM8_EPS1_GRVW8_GSU1_GSUAMB_LBSPP128_LPA8_LPB8_LRVW8_PGR1_PLR9_SU32_SUS256_SRVW4_TT1_64_VAW2_WSGRA1_WSGRB1_WG64_4_1_WGM15
    SolutionIndex: 75
    SolutionNameMin: Cijk_Alik_Bljk_HHS_BH_MT16x16x32_MI16x16x16x1_SE_1LDSB1_AF0EM1_EPS1_GRVW8_GSU1_GSUAMB_LBSPP128_LPA16_LPB16_LRVW8_PGR1_PLR2_SU0_SUS0_SRVW0_TT1_16_VAW2_WSGRA1_WSGRB1_WG16_4_1_WGM1
    SolutionIndex: 76
    SolutionNameMin: Cijk_Alik_Bljk_HHS_BH_MT128x64x64_MI32x32x8x1_SE_1LDSB1_AF0EM8_EPS1_GRVW8_GSU1_GSUAMB_LBSPP128_LPA8_LPB8_LRVW8_PGR1_PLR9_SU32_SUS128_SRVW4_TT2_32_VAW2_WSGRA1_WSGRB1_WG64_4_1_WGM1
    SolutionIndex: 77
    SolutionNameMin: Cijk_Alik_Bljk_HHS_BH_MT16x16x128_MI16x16x16x1_SE_1LDSB0_AF0EM8_EPS0_GRVW8_GSU1_GSUAMB_LBSPP256_LPA16_LPB16_LRVW8_PGR2_PLR9_SU0_SUS0_SRVW0_TT1_16_VAW2_WSGRA1_WSGRB1_WG16_4_1_WGM2
    SolutionIndex: 78
    SolutionNameMin: Cijk_Alik_Bljk_HHS_BH_MT16x64x128_MI16x16x16x1_SE_1LDSB0_AF0EM8_EPS0_GRVW8_GSU1_GSUAMB_LBSPP256_LPA16_LPB16_LRVW8_PGR2_PLR9_SU0_SUS0_SRVW4_TT1_16_VAW2_WSGRA1_WSGRB1_WG16_16_1_WGM1
    SolutionIndex: 79
    SolutionNameMin: Cijk_Alik_Bljk_HHS_BH_MT16x16x128_MI16x16x16x1_SE_1LDSB0_AF0EM8_EPS0_GRVW8_GSU1_GSUAMB_LBSPP256_LPA16_LPB16_LRVW8_PGR2_PLR9_SU32_SUS256_SRVW0_TT1_16_VAW2_WSGRA1_WSGRB1_WG16_4_1_WGM1
    SolutionIndex: 80
    SolutionNameMin: Cijk_Alik_Bljk_HHS_BH_MT16x64x128_MI16x16x16x1_SE_1LDSB0_AF0EM8_EPS0_GRVW8_GSU1_GSUAMB_LBSPP256_LPA16_LPB16_LRVW8_PGR2_PLR9_SU0_SUS0_SRVW0_TT1_16_VAW2_WSGRA1_WSGRB1_WG16_16_1_WGM1
    SolutionIndex: 81
    SolutionNameMin: Cijk_Alik_Bljk_HHS_BH_MT64x32x32_MI16x16x16x1_SE_1LDSB1_AF0EM8_EPS1_GRVW8_GSU1_GSUAMB_LBSPP128_LPA16_LPB16_LRVW8_PGR1_PLR2_SU0_SUS0_SRVW4_TT2_16_VAW2_WSGRA1_WSGRB1_WG32_8_1_WGM15
    SolutionIndex: 82
    SolutionNameMin: Cijk_Alik_Bljk_HHS_BH_MT16x64x128_MI16x16x16x1_SE_1LDSB0_AF0EM8_EPS1_GRVW8_GSU1_GSUAMB_LBSPP256_LPA16_LPB16_LRVW8_PGR1_PLR9_SU0_SUS0_SRVW0_TT1_16_VAW2_WSGRA1_WSGRB1_WG16_16_1_WGM2
    SolutionIndex: 83
    SolutionNameMin: Cijk_Alik_Bljk_HHS_BH_MT16x64x32_MI16x16x16x1_SE_1LDSB0_AF0EM8_EPS0_GRVW4_GSU1_GSUAMB_LBSPP128_LPA16_LPB16_LRVW8_PGR2_PLR2_SU0_SUS0_SRVW0_TT1_16_VAW2_WSGRA1_WSGRB1_WG16_16_1_WGM2
    SolutionIndex: 84
    SolutionNameMin: Cijk_Alik_Bljk_HHS_BH_MT16x64x32_MI16x16x16x1_SE_1LDSB0_AF0EM8_EPS0_GRVW4_GSU1_GSUAMB_LBSPP128_LPA16_LPB16_LRVW8_PGR2_PLR2_SU0_SUS0_SRVW0_TT1_16_VAW2_WSGRA1_WSGRB1_WG16_16_1_WGM1
    SolutionIndex: 85
    SolutionNameMin: Cijk_Alik_Bljk_HHS_BH_MT16x16x32_MI16x16x16x1_SE_1LDSB0_AF0EM1_EPS0_GRVW8_GSU1_GSUAMB_LBSPP128_LPA16_LPB16_LRVW8_PGR2_PLR2_SU0_SUS0_SRVW0_TT1_16_VAW2_WSGRA1_WSGRB1_WG16_4_1_WGM15
    SolutionIndex: 86
    SolutionNameMin: Cijk_Alik_Bljk_HHS_BH_MT64x64x32_MI32x32x8x1_SE_1LDSB0_AF0EM8_EPS0_GRVW8_GSU1_GSUAMB_LBSPP128_LPA8_LPB8_LRVW8_PGR2_PLR5_SU0_SUS0_SRVW4_TT1_32_VAW2_WSGRA1_WSGRB1_WG64_4_1_WGM15
    SolutionIndex: 87
    SolutionNameMin: Cijk_Alik_Bljk_HHS_BH_MT32x64x64_MI16x16x16x1_SE_1LDSB0_AF0EM8_EPS0_GRVW8_GSU1_GSUAMB_LBSPP128_LPA16_LPB16_LRVW8_PGR2_PLR5_SU32_SUS256_SRVW4_TT1_32_VAW2_WSGRA1_WSGRB1_WG32_8_1_WGM1
    SolutionIndex: 88
    SolutionNameMin: Cijk_Alik_Bljk_HHS_BH_MT128x64x64_MI32x32x8x1_SE_1LDSB1_AF0EM8_EPS0_GRVW8_GSU1_GSUAMB_LBSPP128_LPA8_LPB8_LRVW8_PGR2_PLR9_SU32_SUS128_SRVW4_TT2_32_VAW2_WSGRA1_WSGRB1_WG64_4_1_WGM2
    SolutionIndex: 89
    SolutionNameMin: Cijk_Alik_Bljk_HHS_BH_MT128x64x64_MI32x32x8x1_SE_1LDSB1_AF0EM1_EPS1_GRVW8_GSU1_GSUAMB_LBSPP128_LPA8_LPB8_LRVW8_PGR1_PLR9_SU0_SUS0_SRVW4_TT2_32_VAW2_WSGRA1_WSGRB1_WG64_4_1_WGM15
    SolutionIndex: 90
    SolutionNameMin: Cijk_Alik_Bljk_HHS_BH_MT32x64x64_MI16x16x16x1_SE_1LDSB1_AF0EM8_EPS1_GRVW8_GSU1_GSUAMB_LBSPP128_LPA16_LPB16_LRVW8_PGR1_PLR5_SU0_SUS0_SRVW4_TT1_32_VAW2_WSGRA1_WSGRB1_WG32_8_1_WGM15
    SolutionIndex: 91
    SolutionNameMin: Cijk_Alik_Bljk_HHS_BH_MT128x128x32_MI32x32x8x1_SE_1LDSB1_AF0EM8_EPS1_GRVW8_GSU1_GSUAMB_LBSPP128_LPA8_LPB8_LRVW8_PGR1_PLR5_SU0_SUS0_SRVW4_TT2_64_VAW2_WSGRA1_WSGRB1_WG64_4_1_WGM15
    SolutionIndex: 92
    SolutionNameMin: Cijk_Alik_Bljk_HHS_BH_MT32x32x32_MI16x16x16x1_SE_1LDSB1_AF0EM1_EPS1_GRVW4_GSU1_GSUAMB_LBSPP128_LPA16_LPB16_LRVW8_PGR1_PLR2_SU0_SUS0_SRVW4_TT1_16_VAW2_WSGRA1_WSGRB1_WG32_8_1_WGM1
    SolutionIndex: 93
    SolutionNameMin: Cijk_Alik_Bljk_HHS_BH_MT64x128x64_MI32x32x8x1_SE_1LDSB1_AF0EM8_EPS0_GRVW8_GSU1_GSUAMB_LBSPP128_LPA8_LPB8_LRVW8_PGR2_PLR9_SU32_SUS256_SRVW4_TT1_64_VAW2_WSGRA1_WSGRB1_WG64_4_1_WGM15
    SolutionIndex: 94
    SolutionNameMin: Cijk_Alik_Bljk_HHS_BH_MT16x16x64_MI16x16x16x1_SE_1LDSB0_AF0EM1_EPS0_GRVW8_GSU1_GSUAMB_LBSPP128_LPA16_LPB16_LRVW8_PGR2_PLR5_SU0_SUS0_SRVW0_TT1_16_VAW2_WSGRA1_WSGRB1_WG16_4_1_WGM1
    SolutionIndex: 95
    SolutionNameMin: Cijk_Alik_Bljk_HHS_BH_MT128x128x32_MI32x32x8x1_SE_1LDSB1_AF0EM8_EPS1_GRVW8_GSU1_GSUAMB_LBSPP128_LPA8_LPB8_LRVW8_PGR1_PLR5_SU32_SUS128_SRVW4_TT2_64_VAW2_WSGRA1_WSGRB1_WG64_4_1_WGM1
    SolutionIndex: 96
    SolutionNameMin: Cijk_Alik_Bljk_HHS_BH_MT64x192x64_MI32x32x8x1_SE_1LDSB1_AF0EM8_EPS0_GRVW8_GSU1_GSUAMB_LBSPP128_LPA8_LPB8_LRVW8_PGR2_PLR9_SU0_SUS0_SRVW4_TT1_96_VAW2_WSGRA1_WSGRB1_WG64_4_1_WGM15
    SolutionIndex: 97
    SolutionNameMin: Cijk_Alik_Bljk_HHS_BH_MT128x64x32_MI32x32x8x1_SE_1LDSB1_AF0EM8_EPS1_GRVW4_GSU1_GSUAMB_LBSPP128_LPA8_LPB8_LRVW8_PGR1_PLR5_SU32_SUS256_SRVW4_TT2_32_VAW2_WSGRA1_WSGRB1_WG64_4_1_WGM1
    SolutionIndex: 98
    SolutionNameMin: Cijk_Alik_Bljk_HHS_BH_MT64x64x32_MI16x16x4x4_SE_1LDSB0_AF0EM1_EPS1_GRVW2_GSU1_GSUASB_LBSPP128_LPA4_LPB4_LRVW4_PGR1_PLR1_SU16_SUS64_SRVW0_TT1_16_VAW2_WSGRA0_WSGRB0_WG64_4_1_WGM1
    SolutionIndex: 99
    SolutionNameMin: Cijk_Alik_Bljk_HHS_BH_MT32x64x32_MI16x16x16x1_SE_1LDSB1_AF0EM1_EPS1_GRVW4_GSU1_GSUAMB_LBSPP128_LPA16_LPB16_LRVW8_PGR1_PLR2_SU0_SUS0_SRVW4_TT1_32_VAW2_WSGRA1_WSGRB1_WG32_8_1_WGM1
    SolutionIndex: 100
    SolutionNameMin: Cijk_Alik_Bljk_HHS_BH_MT128x128x32_MI32x32x8x1_SE_1LDSB1_AF0EM8_EPS0_GRVW8_GSU1_GSUAMB_LBSPP128_LPA8_LPB8_LRVW8_PGR2_PLR5_SU32_SUS128_SRVW4_TT2_64_VAW2_WSGRA1_WSGRB1_WG64_4_1_WGM1
    SolutionIndex: 101
    SolutionNameMin: Cijk_Alik_Bljk_HHS_BH_MT16x16x32_MI16x16x16x1_SE_1LDSB1_AF0EM1_EPS0_GRVW2_GSU1_GSUAMB_LBSPP128_LPA16_LPB16_LRVW8_PGR2_PLR2_SU0_SUS0_SRVW0_TT1_16_VAW2_WSGRA1_WSGRB1_WG16_4_1_WGM2
    SolutionIndex: 102
    SolutionNameMin: Cijk_Alik_Bljk_HHS_BH_MT128x96x64_MI32x32x8x1_SE_1LDSB1_AF0EM8_EPS1_GRVW8_GSU1_GSUAMB_LBSPP128_LPA8_LPB8_LRVW8_PGR1_PLR9_SU0_SUS0_SRVW4_TT1_96_VAW2_WSGRA1_WSGRB1_WG128_2_1_WGM2
    SolutionIndex: 103
    SolutionNameMin: Cijk_Alik_Bljk_HHS_BH_MT16x16x128_MI16x16x16x1_SE_1LDSB0_AF0EM8_EPS1_GRVW8_GSU1_GSUAMB_LBSPP256_LPA16_LPB16_LRVW8_PGR1_PLR9_SU0_SUS0_SRVW0_TT1_16_VAW2_WSGRA1_WSGRB1_WG16_4_1_WGM1
    SolutionIndex: 104
    SolutionNameMin: Cijk_Alik_Bljk_HHS_BH_MT64x64x64_MI32x32x8x1_SE_1LDSB1_AF0EM8_EPS1_GRVW8_GSU1_GSUAMB_LBSPP128_LPA8_LPB8_LRVW8_PGR1_PLR9_SU0_SUS0_SRVW4_TT1_32_VAW2_WSGRA1_WSGRB1_WG64_4_1_WGM15
    SolutionIndex: 105
    SolutionNameMin: Cijk_Alik_Bljk_HHS_BH_MT128x128x32_MI32x32x8x1_SE_1LDSB1_AF0EM8_EPS0_GRVW8_GSU1_GSUAMB_LBSPP128_LPA8_LPB8_LRVW8_PGR2_PLR5_SU32_SUS256_SRVW4_TT2_64_VAW2_WSGRA1_WSGRB1_WG64_4_1_WGM1
    SolutionIndex: 106
    SolutionNameMin: Cijk_Alik_Bljk_HHS_BH_MT64x32x32_MI16x16x16x1_SE_1LDSB1_AF0EM8_EPS1_GRVW8_GSU1_GSUAMB_LBSPP128_LPA16_LPB16_LRVW8_PGR1_PLR2_SU0_SUS0_SRVW4_TT2_16_VAW2_WSGRA1_WSGRB1_WG32_8_1_WGM1
    SolutionIndex: 107
    SolutionNameMin: Cijk_Alik_Bljk_HHS_BH_MT128x96x64_MI32x32x8x1_SE_1LDSB1_AF0EM8_EPS0_GRVW8_GSU1_GSUAMB_LBSPP128_LPA8_LPB8_LRVW8_PGR2_PLR9_SU32_SUS128_SRVW4_TT1_96_VAW2_WSGRA1_WSGRB1_WG128_2_1_WGM1
    SolutionIndex: 108
    SolutionNameMin: Cijk_Alik_Bljk_HHS_BH_MT16x16x128_MI16x16x16x1_SE_1LDSB1_AF0EM1_EPS1_GRVW8_GSU1_GSUAMB_LBSPP256_LPA16_LPB16_LRVW8_PGR1_PLR9_SU0_SUS0_SRVW0_TT1_16_VAW2_WSGRA1_WSGRB1_WG16_4_1_WGM2
    SolutionIndex: 109
    SolutionNameMin: Cijk_Alik_Bljk_HHS_BH_MT64x64x64_MI32x32x8x1_SE_1LDSB1_AF0EM8_EPS1_GRVW8_GSU1_GSUAMB_LBSPP128_LPA8_LPB8_LRVW8_PGR1_PLR9_SU32_SUS128_SRVW4_TT1_32_VAW2_WSGRA1_WSGRB1_WG64_4_1_WGM1
    SolutionIndex: 110
    SolutionNameMin: Cijk_Alik_Bljk_HHS_BH_MT64x128x32_MI32x32x8x1_SE_1LDSB1_AF0EM8_EPS0_GRVW8_GSU1_GSUAMB_LBSPP128_LPA8_LPB8_LRVW8_PGR2_PLR5_SU32_SUS256_SRVW4_TT1_64_VAW2_WSGRA1_WSGRB1_WG64_4_1_WGM1
    SolutionIndex: 111
    SolutionNameMin: Cijk_Alik_Bljk_HHS_BH_MT128x64x64_MI32x32x8x1_SE_1LDSB1_AF0EM8_EPS0_GRVW8_GSU1_GSUAMB_LBSPP128_LPA8_LPB8_LRVW8_PGR2_PLR9_SU32_SUS256_SRVW4_TT2_32_VAW2_WSGRA1_WSGRB1_WG64_4_1_WGM15
    SolutionIndex: 112
    SolutionNameMin: Cijk_Alik_Bljk_HHS_BH_MT128x96x64_MI32x32x8x1_SE_1LDSB1_AF0EM8_EPS1_GRVW8_GSU1_GSUAMB_LBSPP128_LPA8_LPB8_LRVW8_PGR1_PLR9_SU32_SUS256_SRVW4_TT1_96_VAW2_WSGRA1_WSGRB1_WG128_2_1_WGM1
    SolutionIndex: 113
    SolutionNameMin: Cijk_Alik_Bljk_HHS_BH_MT64x128x64_MI32x32x8x1_SE_1LDSB1_AF0EM8_EPS0_GRVW8_GSU1_GSUAMB_LBSPP128_LPA8_LPB8_LRVW8_PGR2_PLR9_SU32_SUS128_SRVW4_TT1_64_VAW2_WSGRA1_WSGRB1_WG64_4_1_WGM2
    SolutionIndex: 114
    SolutionNameMin: Cijk_Alik_Bljk_HHS_BH_MT128x128x64_MI32x32x8x1_SE_1LDSB1_AF0EM8_EPS0_GRVW8_GSU1_GSUAMB_LBSPP128_LPA8_LPB8_LRVW8_PGR2_PLR9_SU0_SUS0_SRVW4_TT2_64_VAW2_WSGRA1_WSGRB1_WG64_4_1_WGM1
    SolutionIndex: 115
    SolutionNameMin: Cijk_Alik_Bljk_HHS_BH_MT128x96x64_MI32x32x8x1_SE_1LDSB1_AF0EM8_EPS1_GRVW8_GSU1_GSUAMB_LBSPP128_LPA8_LPB8_LRVW8_PGR1_PLR9_SU32_SUS256_SRVW4_TT1_96_VAW2_WSGRA1_WSGRB1_WG128_2_1_WGM2
    SolutionIndex: 116
    SolutionNameMin: Cijk_Alik_Bljk_HHS_BH_MT64x32x64_MI16x16x16x1_SE_1LDSB0_AF0EM8_EPS0_GRVW8_GSU1_GSUAMB_LBSPP128_LPA16_LPB16_LRVW8_PGR2_PLR5_SU32_SUS128_SRVW4_TT2_16_VAW2_WSGRA1_WSGRB1_WG32_8_1_WGM2
    SolutionIndex: 117
    SolutionNameMin: Cijk_Alik_Bljk_HHS_BH_MT64x32x32_MI16x16x16x1_SE_1LDSB0_AF0EM8_EPS1_GRVW2_GSU1_GSUAMB_LBSPP128_LPA16_LPB16_LRVW8_PGR1_PLR2_SU32_SUS256_SRVW4_TT2_16_VAW2_WSGRA1_WSGRB1_WG32_8_1_WGM15
    SolutionIndex: 118
    SolutionNameMin: Cijk_Alik_Bljk_HHS_BH_MT128x96x32_MI32x32x8x1_SE_1LDSB1_AF0EM8_EPS1_GRVW2_GSU1_GSUAMB_LBSPP128_LPA8_LPB8_LRVW8_PGR1_PLR5_SU32_SUS128_SRVW4_TT1_96_VAW2_WSGRA1_WSGRB1_WG128_2_1_WGM1
    SolutionIndex: 119
    SolutionNameMin: Cijk_Alik_Bljk_HHS_BH_MT16x64x64_MI16x16x16x1_SE_1LDSB0_AF0EM8_EPS0_GRVW8_GSU1_GSUAMB_LBSPP128_LPA16_LPB16_LRVW8_PGR2_PLR5_SU0_SUS0_SRVW0_TT1_16_VAW2_WSGRA1_WSGRB1_WG16_16_1_WGM1
    SolutionIndex: 120
    SolutionNameMin: Cijk_Alik_Bljk_HHS_BH_MT64x64x64_MI32x32x8x1_SE_1LDSB0_AF0EM8_EPS0_GRVW8_GSU1_GSUAMB_LBSPP128_LPA8_LPB8_LRVW8_PGR2_PLR9_SU32_SUS256_SRVW4_TT1_32_VAW2_WSGRA1_WSGRB1_WG64_4_1_WGM15
    SolutionIndex: 121
    SolutionNameMin: Cijk_Alik_Bljk_HHS_BH_MT128x256x32_MI32x32x8x1_SE_1LDSB1_AF0EM8_EPS1_GRVW8_GSU1_GSUAMB_LBSPP128_LPA8_LPB8_LRVW8_PGR1_PLR5_SU0_SUS0_SRVW4_TT2_128_VAW2_WSGRA1_WSGRB1_WG64_4_1_WGM1
    SolutionIndex: 122
    SolutionNameMin: Cijk_Alik_Bljk_HHS_BH_MT64x64x32_MI32x32x8x1_SE_1LDSB1_AF0EM8_EPS0_GRVW2_GSU1_GSUAMB_LBSPP128_LPA8_LPB8_LRVW8_PGR2_PLR5_SU0_SUS0_SRVW4_TT1_32_VAW2_WSGRA1_WSGRB1_WG64_4_1_WGM1
    SolutionIndex: 123
    SolutionNameMin: Cijk_Alik_Bljk_HHS_BH_MT128x96x64_MI32x32x8x1_SE_1LDSB1_AF0EM8_EPS1_GRVW8_GSU1_GSUAMB_LBSPP128_LPA8_LPB8_LRVW8_PGR1_PLR9_SU0_SUS0_SRVW4_TT1_96_VAW2_WSGRA1_WSGRB1_WG128_2_1_WGM1
    SolutionIndex: 124
    SolutionNameMin: Cijk_Alik_Bljk_HHS_BH_MT128x96x64_MI32x32x8x1_SE_1LDSB1_AF0EM8_EPS0_GRVW8_GSU1_GSUAMB_LBSPP128_LPA8_LPB8_LRVW8_PGR2_PLR9_SU32_SUS256_SRVW4_TT1_96_VAW2_WSGRA1_WSGRB1_WG128_2_1_WGM15
    SolutionIndex: 125
    SolutionNameMin: Cijk_Alik_Bljk_HHS_BH_MT64x64x32_MI32x32x8x1_SE_1LDSB1_AF0EM1_EPS1_GRVW2_GSU1_GSUAMB_LBSPP128_LPA8_LPB8_LRVW8_PGR1_PLR5_SU0_SUS0_SRVW4_TT1_32_VAW2_WSGRA1_WSGRB1_WG64_4_1_WGM1
    SolutionIndex: 126
    SolutionNameMin: Cijk_Alik_Bljk_HHS_BH_MT64x128x64_MI32x32x8x1_SE_1LDSB0_AF0EM8_EPS0_GRVW8_GSU1_GSUAMB_LBSPP128_LPA8_LPB8_LRVW8_PGR2_PLR9_SU32_SUS256_SRVW4_TT1_64_VAW2_WSGRA1_WSGRB1_WG64_4_1_WGM1
    SolutionIndex: 127
    SolutionNameMin: Cijk_Alik_Bljk_HHS_BH_MT128x144x64_MI16x16x16x1_SE_1LDSB1_AF0EM8_EPS0_GRVW4_GSU1_GSUAMB_LBSPP128_LPA16_LPB16_LRVW8_PGR2_PLR5_SU32_SUS128_SRVW4_TT2_144_VAW2_WSGRA1_WSGRB1_WG64_4_1_WGM15
    SolutionIndex: 128
    SolutionNameMin: Cijk_Alik_Bljk_HHS_BH_MT16x64x32_MI16x16x16x1_SE_1LDSB0_AF0EM8_EPS0_GRVW8_GSU1_GSUAMB_LBSPP128_LPA16_LPB16_LRVW8_PGR2_PLR2_SU0_SUS0_SRVW0_TT1_16_VAW2_WSGRA1_WSGRB1_WG16_16_1_WGM1
    SolutionIndex: 129
    SolutionNameMin: Cijk_Alik_Bljk_HHS_BH_MT128x64x64_MI32x32x8x1_SE_1LDSB0_AF0EM8_EPS0_GRVW8_GSU1_GSUAMB_LBSPP128_LPA8_LPB8_LRVW8_PGR2_PLR9_SU32_SUS128_SRVW4_TT2_32_VAW2_WSGRA1_WSGRB1_WG64_4_1_WGM2
    SolutionIndex: 130
    SolutionNameMin: Cijk_Alik_Bljk_HHS_BH_MT64x32x32_MI16x16x16x1_SE_1LDSB1_AF0EM8_EPS1_GRVW4_GSU1_GSUAMB_LBSPP128_LPA16_LPB16_LRVW8_PGR1_PLR2_SU0_SUS0_SRVW4_TT2_16_VAW2_WSGRA1_WSGRB1_WG32_8_1_WGM1
    SolutionIndex: 131
    SolutionNameMin: Cijk_Alik_Bljk_HHS_BH_MT64x32x64_MI16x16x16x1_SE_1LDSB1_AF0EM8_EPS1_GRVW8_GSU1_GSUAMB_LBSPP128_LPA16_LPB16_LRVW8_PGR1_PLR5_SU32_SUS128_SRVW4_TT2_16_VAW2_WSGRA1_WSGRB1_WG32_8_1_WGM15
    SolutionIndex: 132
    SolutionNameMin: Cijk_Alik_Bljk_HHS_BH_MT32x32x32_MI16x16x16x1_SE_1LDSB0_AF0EM8_EPS0_GRVW2_GSU1_GSUAMB_LBSPP128_LPA16_LPB16_LRVW8_PGR2_PLR2_SU0_SUS0_SRVW4_TT1_16_VAW2_WSGRA1_WSGRB1_WG32_8_1_WGM1
    SolutionIndex: 133
    SolutionNameMin: Cijk_Alik_Bljk_HHS_BH_MT64x32x32_MI16x16x16x1_SE_1LDSB1_AF0EM8_EPS1_GRVW2_GSU1_GSUAMB_LBSPP128_LPA16_LPB16_LRVW8_PGR1_PLR2_SU0_SUS0_SRVW4_TT2_16_VAW2_WSGRA1_WSGRB1_WG32_8_1_WGM1
    SolutionIndex: 134
    SolutionNameMin: Cijk_Alik_Bljk_HHS_BH_MT144x64x64_MI16x16x16x1_SE_1LDSB1_AF0EM8_EPS0_GRVW4_GSU1_GSUAMB_LBSPP128_LPA16_LPB16_LRVW8_PGR2_PLR5_SU32_SUS256_SRVW0_TT9_16_VAW2_WSGRA1_WSGRB1_WG16_16_1_WGM1
    SolutionIndex: 135
    SolutionNameMin: Cijk_Alik_Bljk_HHS_BH_MT16x16x128_MI16x16x16x1_SE_1LDSB0_AF0EM1_EPS1_GRVW8_GSU1_GSUAMB_LBSPP256_LPA16_LPB16_LRVW8_PGR1_PLR9_SU0_SUS0_SRVW0_TT1_16_VAW2_WSGRA1_WSGRB1_WG16_4_1_WGM1
    SolutionIndex: 136
    SolutionNameMin: Cijk_Alik_Bljk_HHS_BH_MT64x64x32_MI32x32x8x1_SE_1LDSB1_AF0EM8_EPS1_GRVW4_GSU1_GSUAMB_LBSPP128_LPA8_LPB8_LRVW8_PGR1_PLR5_SU0_SUS0_SRVW4_TT1_32_VAW2_WSGRA1_WSGRB1_WG64_4_1_WGM1
    SolutionIndex: 137
    SolutionNameMin: Cijk_Alik_Bljk_HHS_BH_MT64x64x64_MI32x32x8x1_SE_1LDSB1_AF0EM8_EPS1_GRVW8_GSU1_GSUAMB_LBSPP128_LPA8_LPB8_LRVW8_PGR1_PLR9_SU0_SUS0_SRVW4_TT1_32_VAW2_WSGRA1_WSGRB1_WG64_4_1_WGM2
    SolutionIndex: 138
    SolutionNameMin: Cijk_Alik_Bljk_HHS_BH_MT64x128x32_MI32x32x8x1_SE_1LDSB1_AF0EM8_EPS1_GRVW4_GSU1_GSUAMB_LBSPP128_LPA8_LPB8_LRVW8_PGR1_PLR5_SU0_SUS0_SRVW4_TT1_64_VAW2_WSGRA1_WSGRB1_WG64_4_1_WGM1
    SolutionIndex: 139
    SolutionNameMin: Cijk_Alik_Bljk_HHS_BH_MT64x32x32_MI16x16x16x1_SE_1LDSB0_AF0EM8_EPS1_GRVW2_GSU1_GSUAMB_LBSPP128_LPA16_LPB16_LRVW8_PGR1_PLR2_SU0_SUS0_SRVW4_TT2_16_VAW2_WSGRA1_WSGRB1_WG32_8_1_WGM1
    SolutionIndex: 140
    SolutionNameMin: Cijk_Alik_Bljk_HHS_BH_MT128x128x32_MI32x32x8x1_SE_1LDSB1_AF0EM8_EPS0_GRVW4_GSU1_GSUAMB_LBSPP128_LPA8_LPB8_LRVW8_PGR2_PLR5_SU32_SUS256_SRVW4_TT2_64_VAW2_WSGRA1_WSGRB1_WG64_4_1_WGM1
    SolutionIndex: 141
    SolutionNameMin: Cijk_Alik_Bljk_HHS_BH_MT128x128x32_MI32x32x8x1_SE_1LDSB1_AF0EM8_EPS0_GRVW2_GSU1_GSUAMB_LBSPP128_LPA8_LPB8_LRVW8_PGR2_PLR5_SU0_SUS0_SRVW4_TT2_64_VAW2_WSGRA1_WSGRB1_WG64_4_1_WGM2
    SolutionIndex: 142
    SolutionNameMin: Cijk_Alik_Bljk_HHS_BH_MT128x64x64_MI32x32x8x1_SE_1LDSB0_AF0EM8_EPS0_GRVW8_GSU1_GSUAMB_LBSPP128_LPA8_LPB8_LRVW8_PGR2_PLR9_SU32_SUS256_SRVW4_TT2_32_VAW2_WSGRA1_WSGRB1_WG64_4_1_WGM15
    SolutionIndex: 143
    SolutionNameMin: Cijk_Alik_Bljk_HHS_BH_MT128x96x64_MI32x32x8x1_SE_1LDSB1_AF0EM8_EPS1_GRVW8_GSU1_GSUAMB_LBSPP128_LPA8_LPB8_LRVW8_PGR1_PLR9_SU32_SUS128_SRVW4_TT1_96_VAW2_WSGRA1_WSGRB1_WG128_2_1_WGM2
    SolutionIndex: 144
    SolutionNameMin: Cijk_Alik_Bljk_HHS_BH_MT128x64x32_MI32x32x8x1_SE_1LDSB1_AF0EM8_EPS1_GRVW8_GSU1_GSUAMB_LBSPP128_LPA8_LPB8_LRVW8_PGR1_PLR5_SU32_SUS128_SRVW4_TT2_32_VAW2_WSGRA1_WSGRB1_WG64_4_1_WGM1
    SolutionIndex: 145
    SolutionNameMin: Cijk_Alik_Bljk_HHS_BH_MT128x64x32_MI32x32x8x1_SE_1LDSB0_AF0EM8_EPS0_GRVW8_GSU1_GSUAMB_LBSPP128_LPA8_LPB8_LRVW8_PGR2_PLR5_SU0_SUS0_SRVW4_TT2_32_VAW2_WSGRA1_WSGRB1_WG64_4_1_WGM1
    SolutionIndex: 146
    SolutionNameMin: Cijk_Alik_Bljk_HHS_BH_MT64x64x64_MI32x32x8x1_SE_1LDSB0_AF0EM8_EPS0_GRVW8_GSU1_GSUAMB_LBSPP128_LPA8_LPB8_LRVW8_PGR2_PLR9_SU32_SUS256_SRVW4_TT1_32_VAW2_WSGRA1_WSGRB1_WG64_4_1_WGM2
    SolutionIndex: 147
    SolutionNameMin: Cijk_Alik_Bljk_HHS_BH_MT128x96x64_MI32x32x8x1_SE_1LDSB1_AF0EM8_EPS0_GRVW8_GSU1_GSUAMB_LBSPP128_LPA8_LPB8_LRVW8_PGR2_PLR9_SU32_SUS128_SRVW4_TT1_96_VAW2_WSGRA1_WSGRB1_WG128_2_1_WGM2
    SolutionIndex: 148
    SolutionNameMin: Cijk_Alik_Bljk_HHS_BH_MT64x64x64_MI32x32x8x1_SE_1LDSB1_AF0EM8_EPS1_GRVW8_GSU1_GSUAMB_LBSPP128_LPA8_LPB8_LRVW8_PGR1_PLR9_SU32_SUS256_SRVW4_TT1_32_VAW2_WSGRA1_WSGRB1_WG64_4_1_WGM15
    SolutionIndex: 149
    SolutionNameMin: Cijk_Alik_Bljk_HHS_BH_MT16x16x128_MI16x16x16x1_SE_1LDSB1_AF0EM1_EPS1_GRVW8_GSU1_GSUAMB_LBSPP256_LPA16_LPB16_LRVW8_PGR1_PLR9_SU0_SUS0_SRVW4_TT1_16_VAW2_WSGRA1_WSGRB1_WG16_4_1_WGM1
    SolutionIndex: 150
    SolutionNameMin: Cijk_Alik_Bljk_HHS_BH_MT128x128x32_MI32x32x8x1_SE_1LDSB1_AF0EM8_EPS1_GRVW2_GSU1_GSUAMB_LBSPP128_LPA8_LPB8_LRVW8_PGR1_PLR5_SU32_SUS256_SRVW4_TT2_64_VAW2_WSGRA1_WSGRB1_WG64_4_1_WGM1
    SolutionIndex: 151
    SolutionNameMin: Cijk_Alik_Bljk_HHS_BH_MT32x64x64_MI16x16x16x1_SE_1LDSB0_AF0EM8_EPS1_GRVW8_GSU1_GSUAMB_LBSPP128_LPA16_LPB16_LRVW8_PGR1_PLR5_SU0_SUS0_SRVW4_TT1_32_VAW2_WSGRA1_WSGRB1_WG32_8_1_WGM15
    SolutionIndex: 152
    SolutionNameMin: Cijk_Alik_Bljk_HHS_BH_MT64x32x32_MI16x16x16x1_SE_1LDSB1_AF0EM8_EPS1_GRVW8_GSU1_GSUAMB_LBSPP128_LPA16_LPB16_LRVW8_PGR1_PLR2_SU32_SUS128_SRVW4_TT2_16_VAW2_WSGRA1_WSGRB1_WG32_8_1_WGM2
    SolutionIndex: 153
    SolutionNameMin: Cijk_Alik_Bljk_HHS_BH_MT64x64x32_MI32x32x8x1_SE_1LDSB1_AF0EM8_EPS1_GRVW2_GSU1_GSUAMB_LBSPP128_LPA8_LPB8_LRVW8_PGR1_PLR5_SU32_SUS256_SRVW4_TT1_32_VAW2_WSGRA1_WSGRB1_WG64_4_1_WGM1
    SolutionIndex: 154
    SolutionNameMin: Cijk_Alik_Bljk_HHS_BH_MT128x64x32_MI32x32x8x1_SE_1LDSB0_AF0EM8_EPS1_GRVW8_GSU1_GSUAMB_LBSPP128_LPA8_LPB8_LRVW8_PGR1_PLR5_SU0_SUS0_SRVW4_TT2_32_VAW2_WSGRA1_WSGRB1_WG64_4_1_WGM1
    SolutionIndex: 155
    SolutionNameMin: Cijk_Alik_Bljk_HHS_BH_MT128x128x64_MI32x32x8x1_SE_1LDSB1_AF0EM1_EPS0_GRVW8_GSU1_GSUAMB_LBSPP128_LPA8_LPB8_LRVW8_PGR2_PLR9_SU0_SUS0_SRVW4_TT2_64_VAW2_WSGRA1_WSGRB1_WG64_4_1_WGM15
    SolutionIndex: 156
    SolutionNameMin: Cijk_Alik_Bljk_HHS_BH_MT128x256x32_MI32x32x8x1_SE_1LDSB1_AF0EM8_EPS0_GRVW8_GSU1_GSUAMB_LBSPP128_LPA8_LPB8_LRVW8_PGR2_PLR5_SU32_SUS256_SRVW4_TT2_128_VAW2_WSGRA1_WSGRB1_WG64_4_1_WGM2
    SolutionIndex: 157
    SolutionNameMin: Cijk_Alik_Bljk_HHS_BH_MT128x128x32_MI32x32x8x1_SE_1LDSB1_AF0EM8_EPS0_GRVW2_GSU1_GSUAMB_LBSPP128_LPA8_LPB8_LRVW8_PGR2_PLR5_SU32_SUS128_SRVW4_TT2_64_VAW2_WSGRA1_WSGRB1_WG64_4_1_WGM1
    SolutionIndex: 158
    SolutionNameMin: Cijk_Alik_Bljk_HHS_BH_MT16x16x128_MI16x16x16x1_SE_1LDSB1_AF0EM8_EPS1_GRVW8_GSU1_GSUAMB_LBSPP256_LPA16_LPB16_LRVW8_PGR1_PLR9_SU32_SUS256_SRVW0_TT1_16_VAW2_WSGRA1_WSGRB1_WG16_4_1_WGM1
    SolutionIndex: 159
    SolutionNameMin: Cijk_Alik_Bljk_HHS_BH_MT32x32x32_MI16x16x16x1_SE_1LDSB0_AF0EM1_EPS0_GRVW2_GSU1_GSUAMB_LBSPP128_LPA16_LPB16_LRVW8_PGR2_PLR2_SU0_SUS0_SRVW4_TT1_16_VAW2_WSGRA1_WSGRB1_WG32_8_1_WGM1
    SolutionIndex: 160
    SolutionNameMin: Cijk_Alik_Bljk_HHS_BH_MT16x64x128_MI16x16x16x1_SE_1LDSB1_AF0EM8_EPS1_GRVW8_GSU1_GSUAMB_LBSPP256_LPA16_LPB16_LRVW8_PGR1_PLR9_SU0_SUS0_SRVW0_TT1_16_VAW2_WSGRA1_WSGRB1_WG16_16_1_WGM2
    SolutionIndex: 161
    SolutionNameMin: Cijk_Alik_Bljk_HHS_BH_MT128x160x64_MI32x32x8x1_SE_1LDSB1_AF0EM8_EPS1_GRVW4_GSU1_GSUAMB_LBSPP128_LPA8_LPB8_LRVW8_PGR1_PLR9_SU0_SUS0_SRVW4_TT1_160_VAW2_WSGRA1_WSGRB1_WG128_2_1_WGM2
    SolutionIndex: 162
    SolutionNameMin: Cijk_Alik_Bljk_HHS_BH_MT32x32x64_MI16x16x16x1_SE_1LDSB0_AF0EM8_EPS0_GRVW4_GSU1_GSUAMB_LBSPP128_LPA16_LPB16_LRVW8_PGR2_PLR5_SU0_SUS0_SRVW4_TT1_16_VAW2_WSGRA1_WSGRB1_WG32_8_1_WGM2
    SolutionIndex: 163
    SolutionNameMin: Cijk_Alik_Bljk_HHS_BH_MT128x192x32_MI32x32x8x1_SE_1LDSB1_AF0EM1_EPS0_GRVW8_GSU1_GSUAMB_LBSPP128_LPA8_LPB8_LRVW8_PGR2_PLR5_SU32_SUS128_SRVW4_TT2_96_VAW2_WSGRA1_WSGRB1_WG64_4_1_WGM15
    SolutionIndex: 164
    SolutionNameMin: Cijk_Alik_Bljk_HHS_BH_MT32x32x64_MI16x16x16x1_SE_1LDSB0_AF0EM8_EPS0_GRVW4_GSU1_GSUAMB_LBSPP128_LPA16_LPB16_LRVW8_PGR2_PLR5_SU0_SUS0_SRVW4_TT1_16_VAW2_WSGRA1_WSGRB1_WG32_8_1_WGM1
    SolutionIndex: 165
    SolutionNameMin: Cijk_Alik_Bljk_HHS_BH_MT128x96x64_MI32x32x8x1_SE_1LDSB1_AF0EM1_EPS0_GRVW8_GSU1_GSUAMB_LBSPP128_LPA8_LPB8_LRVW8_PGR2_PLR9_SU0_SUS0_SRVW4_TT1_96_VAW2_WSGRA1_WSGRB1_WG128_2_1_WGM15
    SolutionIndex: 166
    SolutionNameMin: Cijk_Alik_Bljk_HHS_BH_MT64x32x64_MI16x16x16x1_SE_1LDSB0_AF0EM8_EPS0_GRVW4_GSU1_GSUAMB_LBSPP128_LPA16_LPB16_LRVW8_PGR2_PLR5_SU0_SUS0_SRVW4_TT2_16_VAW2_WSGRA1_WSGRB1_WG32_8_1_WGM15
    SolutionIndex: 167
    SolutionNameMin: Cijk_Alik_Bljk_HHS_BH_MT16x16x128_MI16x16x16x1_SE_1LDSB1_AF0EM1_EPS1_GRVW8_GSU7_GSUAMB_LBSPP256_LPA16_LPB16_LRVW8_PGR1_PLR9_SU32_SUS256_SRVW0_TT1_16_VAW1_WSGRA1_WSGRB1_WG16_4_1_WGM2
    SolutionIndex: 168
    SolutionNameMin: Cijk_Alik_Bljk_HHS_BH_MT16x16x128_MI16x16x16x1_SE_1LDSB1_AF0EM1_EPS1_GRVW8_GSU3_GSUAMB_LBSPP256_LPA16_LPB16_LRVW8_PGR1_PLR9_SU32_SUS256_SRVW0_TT1_16_VAW1_WSGRA1_WSGRB1_WG16_4_1_WGM2
    SolutionIndex: 169
    SolutionNameMin: Cijk_Alik_Bljk_HHS_BH_MT128x128x32_MI32x32x8x1_SE_1LDSB0_AF0EM8_EPS0_GRVW8_GSU1_GSUAMB_LBSPP128_LPA8_LPB8_LRVW8_PGR2_PLR5_SU32_SUS128_SRVW4_TT2_64_VAW2_WSGRA1_WSGRB1_WG64_4_1_WGM1
    SolutionIndex: 170
    SolutionNameMin: Cijk_Alik_Bljk_HHS_BH_MT64x64x64_MI32x32x8x1_SE_1LDSB0_AF0EM8_EPS0_GRVW8_GSU1_GSUAMB_LBSPP128_LPA8_LPB8_LRVW8_PGR2_PLR9_SU32_SUS128_SRVW4_TT1_32_VAW2_WSGRA1_WSGRB1_WG64_4_1_WGM2
    SolutionIndex: 171
    SolutionNameMin: Cijk_Alik_Bljk_HHS_BH_MT16x16x128_MI16x16x16x1_SE_1LDSB1_AF0EM1_EPS1_GRVW8_GSU5_GSUAMB_LBSPP256_LPA16_LPB16_LRVW8_PGR1_PLR9_SU0_SUS0_SRVW0_TT1_16_VAW1_WSGRA1_WSGRB1_WG16_4_1_WGM2
    SolutionIndex: 172
    SolutionNameMin: Cijk_Alik_Bljk_HHS_BH_MT128x160x32_MI32x32x8x1_SE_1LDSB1_AF0EM8_EPS0_GRVW2_GSU1_GSUAMB_LBSPP128_LPA8_LPB8_LRVW8_PGR2_PLR5_SU0_SUS0_SRVW4_TT1_160_VAW2_WSGRA1_WSGRB1_WG128_2_1_WGM15
    SolutionIndex: 173
    SolutionNameMin: Cijk_Alik_Bljk_HHS_BH_MT16x16x128_MI16x16x16x1_SE_1LDSB0_AF0EM8_EPS1_GRVW8_GSU5_GSUAMB_LBSPP256_LPA16_LPB16_LRVW8_PGR1_PLR9_SU32_SUS256_SRVW0_TT1_16_VAW1_WSGRA1_WSGRB1_WG16_4_1_WGM1
    SolutionIndex: 174
    SolutionNameMin: Cijk_Alik_Bljk_HHS_BH_MT128x128x32_MI32x32x8x1_SE_1LDSB1_AF0EM8_EPS0_GRVW8_GSU1_GSUAMB_LBSPP128_LPA8_LPB8_LRVW8_PGR2_PLR5_SU0_SUS0_SRVW4_TT2_64_VAW2_WSGRA1_WSGRB1_WG64_4_1_WGM15
    SolutionIndex: 175
    SolutionNameMin: Cijk_Alik_Bljk_HHS_BH_MT160x160x32_MI16x16x16x1_SE_1LDSB1_AF0EM8_EPS1_GRVW2_GSU1_GSUAMB_LBSPP128_LPA16_LPB16_LRVW8_PGR1_PLR2_SU0_SUS0_SRVW0_TT5_80_VAW2_WSGRA1_WSGRB1_WG32_8_1_WGM1
    SolutionIndex: 176
    SolutionNameMin: Cijk_Alik_Bljk_HHS_BH_MT256x160x64_MI32x32x8x1_SE_1LDSB1_AF0EM8_EPS0_GRVW2_GSU1_GSUAMB_LBSPP128_LPA8_LPB8_LRVW8_PGR2_PLR9_SU32_SUS256_SRVW4_TT2_160_VAW2_WSGRA1_WSGRB1_WG128_2_1_WGM2
    SolutionIndex: 177
    SolutionNameMin: Cijk_Alik_Bljk_HHS_BH_MT64x32x64_MI16x16x16x1_SE_1LDSB1_AF0EM1_EPS1_GRVW8_GSU1_GSUAMB_LBSPP128_LPA16_LPB16_LRVW8_PGR1_PLR5_SU0_SUS0_SRVW4_TT2_16_VAW2_WSGRA1_WSGRB1_WG32_8_1_WGM1
    SolutionIndex: 178
    SolutionNameMin: Cijk_Alik_Bljk_HHS_BH_MT128x64x64_MI32x32x8x1_SE_1LDSB0_AF0EM8_EPS0_GRVW4_GSU1_GSUAMB_LBSPP128_LPA8_LPB8_LRVW8_PGR2_PLR9_SU0_SUS0_SRVW4_TT2_32_VAW2_WSGRA1_WSGRB1_WG64_4_1_WGM2
    SolutionIndex: 179
    SolutionNameMin: Cijk_Alik_Bljk_HHS_BH_MT128x96x64_MI32x32x8x1_SE_1LDSB0_AF0EM8_EPS0_GRVW8_GSU1_GSUAMB_LBSPP128_LPA8_LPB8_LRVW8_PGR2_PLR9_SU0_SUS0_SRVW4_TT1_96_VAW2_WSGRA1_WSGRB1_WG128_2_1_WGM2
    SolutionIndex: 180
    SolutionNameMin: Cijk_Alik_Bljk_HHS_BH_MT64x64x32_MI32x32x8x1_SE_1LDSB0_AF0EM8_EPS0_GRVW2_GSU1_GSUAMB_LBSPP128_LPA8_LPB8_LRVW8_PGR2_PLR5_SU0_SUS0_SRVW4_TT1_32_VAW2_WSGRA1_WSGRB1_WG64_4_1_WGM15
    SolutionIndex: 181
    SolutionNameMin: Cijk_Alik_Bljk_HHS_BH_MT256x128x64_MI32x32x8x1_SE_1LDSB1_AF0EM8_EPS0_GRVW2_GSU1_GSUAMB_LBSPP128_LPA8_LPB8_LRVW8_PGR2_PLR9_SU0_SUS0_SRVW4_TT4_64_VAW2_WSGRA1_WSGRB1_WG64_4_1_WGM1
    SolutionIndex: 182
    SolutionNameMin: Cijk_Alik_Bljk_HHS_BH_MT256x160x32_MI32x32x8x1_SE_1LDSB1_AF0EM8_EPS1_GRVW2_GSU1_GSUAMB_LBSPP128_LPA8_LPB8_LRVW8_PGR1_PLR5_SU0_SUS0_SRVW4_TT2_160_VAW2_WSGRA1_WSGRB1_WG128_2_1_WGM1
    SolutionIndex: 183
    SolutionNameMin: Cijk_Alik_Bljk_HHS_BH_MT128x96x64_MI32x32x8x1_SE_1LDSB0_AF0EM8_EPS0_GRVW8_GSU1_GSUAMB_LBSPP128_LPA8_LPB8_LRVW8_PGR2_PLR9_SU0_SUS0_SRVW4_TT1_96_VAW2_WSGRA1_WSGRB1_WG128_2_1_WGM15
    SolutionIndex: 184
    SolutionNameMin: Cijk_Alik_Bljk_HHS_BH_MT128x64x32_MI32x32x8x1_SE_1LDSB0_AF0EM8_EPS0_GRVW2_GSU1_GSUAMB_LBSPP128_LPA8_LPB8_LRVW8_PGR2_PLR5_SU0_SUS0_SRVW4_TT2_32_VAW2_WSGRA1_WSGRB1_WG64_4_1_WGM1
    SolutionIndex: 185
    SolutionNameMin: Cijk_Alik_Bljk_HHS_BH_MT128x96x64_MI32x32x8x1_SE_1LDSB0_AF0EM8_EPS0_GRVW2_GSU1_GSUAMB_LBSPP128_LPA8_LPB8_LRVW8_PGR2_PLR9_SU32_SUS128_SRVW4_TT1_96_VAW2_WSGRA1_WSGRB1_WG128_2_1_WGM15
    SolutionIndex: 186
    SolutionNameMin: Cijk_Alik_Bljk_HHS_BH_MT16x16x64_MI16x16x16x1_SE_1LDSB0_AF0EM8_EPS1_GRVW8_GSU1_GSUAMB_LBSPP128_LPA16_LPB16_LRVW8_PGR1_PLR5_SU0_SUS0_SRVW0_TT1_16_VAW2_WSGRA1_WSGRB1_WG16_4_1_WGM1
    SolutionIndex: 187
    SolutionNameMin: Cijk_Alik_Bljk_HHS_BH_MT16x16x128_MI16x16x16x1_SE_1LDSB0_AF0EM1_EPS1_GRVW8_GSU1_GSUAMB_LBSPP256_LPA16_LPB16_LRVW8_PGR1_PLR9_SU32_SUS256_SRVW0_TT1_16_VAW2_WSGRA1_WSGRB1_WG16_4_1_WGM1
    SolutionIndex: 188
    SolutionNameMin: Cijk_Alik_Bljk_HHS_BH_MT128x128x32_MI32x32x8x1_SE_1LDSB1_AF0EM8_EPS0_GRVW4_GSU1_GSUAMB_LBSPP128_LPA8_LPB8_LRVW8_PGR2_PLR5_SU0_SUS0_SRVW4_TT2_64_VAW2_WSGRA1_WSGRB1_WG64_4_1_WGM15
    SolutionIndex: 189
    SolutionNameMin: Cijk_Alik_Bljk_HHS_BH_MT128x64x64_MI32x32x8x1_SE_1LDSB0_AF0EM8_EPS0_GRVW8_GSU1_GSUAMB_LBSPP128_LPA8_LPB8_LRVW8_PGR2_PLR9_SU0_SUS0_SRVW4_TT2_32_VAW2_WSGRA1_WSGRB1_WG64_4_1_WGM2
    SolutionIndex: 190
    SolutionNameMin: Cijk_Alik_Bljk_HHS_BH_MT96x96x64_MI16x16x16x1_SE_1LDSB1_AF0EM8_EPS1_GRVW8_GSU1_GSUAMB_LBSPP128_LPA16_LPB16_LRVW8_PGR1_PLR5_SU32_SUS128_SRVW0_TT3_48_VAW2_WSGRA1_WSGRB1_WG32_8_1_WGM2
    SolutionIndex: 191
    SolutionNameMin: Cijk_Alik_Bljk_HHS_BH_MT96x96x64_MI16x16x16x1_SE_1LDSB1_AF0EM8_EPS1_GRVW8_GSU1_GSUAMB_LBSPP128_LPA16_LPB16_LRVW8_PGR1_PLR5_SU32_SUS256_SRVW0_TT3_48_VAW2_WSGRA1_WSGRB1_WG32_8_1_WGM1
    SolutionIndex: 192
    SolutionNameMin: Cijk_Alik_Bljk_HHS_BH_MT128x128x32_MI32x32x8x1_SE_1LDSB1_AF0EM8_EPS0_GRVW8_GSU1_GSUAMB_LBSPP128_LPA8_LPB8_LRVW8_PGR2_PLR5_SU32_SUS256_SRVW4_TT2_64_VAW2_WSGRA1_WSGRB1_WG64_4_1_WGM2
    SolutionIndex: 193
    SolutionNameMin: Cijk_Alik_Bljk_HHS_BH_MT128x160x32_MI32x32x8x1_SE_1LDSB1_AF0EM8_EPS1_GRVW4_GSU1_GSUAMB_LBSPP128_LPA8_LPB8_LRVW8_PGR1_PLR5_SU32_SUS128_SRVW4_TT1_160_VAW2_WSGRA1_WSGRB1_WG128_2_1_WGM2
    SolutionIndex: 194
    SolutionNameMin: Cijk_Alik_Bljk_HHS_BH_MT128x96x32_MI32x32x8x1_SE_1LDSB0_AF0EM8_EPS0_GRVW4_GSU1_GSUAMB_LBSPP128_LPA8_LPB8_LRVW8_PGR2_PLR5_SU0_SUS0_SRVW4_TT1_96_VAW2_WSGRA1_WSGRB1_WG128_2_1_WGM1
    SolutionIndex: 195
    SolutionNameMin: Cijk_Alik_Bljk_HHS_BH_MT128x256x32_MI32x32x8x1_SE_1LDSB1_AF0EM8_EPS0_GRVW8_GSU1_GSUAMB_LBSPP128_LPA8_LPB8_LRVW8_PGR2_PLR5_SU32_SUS128_SRVW4_TT2_128_VAW2_WSGRA1_WSGRB1_WG64_4_1_WGM15
    SolutionIndex: 196
    SolutionNameMin: Cijk_Alik_Bljk_HHS_BH_MT32x32x32_MI16x16x16x1_SE_1LDSB1_AF0EM1_EPS0_GRVW8_GSU1_GSUAMB_LBSPP128_LPA16_LPB16_LRVW8_PGR2_PLR2_SU0_SUS0_SRVW4_TT1_16_VAW2_WSGRA1_WSGRB1_WG32_8_1_WGM1
    SolutionIndex: 197
    SolutionNameMin: Cijk_Alik_Bljk_HHS_BH_MT32x64x32_MI16x16x16x1_SE_1LDSB1_AF0EM8_EPS0_GRVW2_GSU1_GSUAMB_LBSPP128_LPA16_LPB16_LRVW8_PGR2_PLR2_SU0_SUS0_SRVW4_TT1_32_VAW2_WSGRA1_WSGRB1_WG32_8_1_WGM15
    SolutionIndex: 198
    SolutionNameMin: Cijk_Alik_Bljk_HHS_BH_MT128x64x64_MI32x32x8x1_SE_1LDSB1_AF0EM8_EPS1_GRVW8_GSU1_GSUAMB_LBSPP128_LPA8_LPB8_LRVW8_PGR1_PLR9_SU0_SUS0_SRVW4_TT2_32_VAW2_WSGRA1_WSGRB1_WG64_4_1_WGM15
    SolutionIndex: 199
    SolutionNameMin: Cijk_Alik_Bljk_HHS_BH_MT128x64x64_MI32x32x8x1_SE_1LDSB0_AF0EM8_EPS0_GRVW8_GSU1_GSUAMB_LBSPP128_LPA8_LPB8_LRVW8_PGR2_PLR9_SU32_SUS128_SRVW4_TT2_32_VAW2_WSGRA1_WSGRB1_WG64_4_1_WGM1
    SolutionIndex: 200
    SolutionNameMin: Cijk_Alik_Bljk_HHS_BH_MT128x128x32_MI32x32x8x1_SE_1LDSB1_AF0EM8_EPS1_GRVW4_GSU1_GSUAMB_LBSPP128_LPA8_LPB8_LRVW8_PGR1_PLR5_SU32_SUS128_SRVW4_TT2_64_VAW2_WSGRA1_WSGRB1_WG64_4_1_WGM1
    SolutionIndex: 201
    SolutionNameMin: Cijk_Alik_Bljk_HHS_BH_MT16x16x128_MI16x16x16x1_SE_1LDSB0_AF0EM1_EPS0_GRVW8_GSU1_GSUAMB_LBSPP256_LPA16_LPB16_LRVW8_PGR2_PLR9_SU32_SUS256_SRVW0_TT1_16_VAW2_WSGRA1_WSGRB1_WG16_4_1_WGM2
    SolutionIndex: 202
    SolutionNameMin: Cijk_Alik_Bljk_HHS_BH_MT128x256x32_MI32x32x8x1_SE_1LDSB1_AF0EM8_EPS0_GRVW2_GSU1_GSUAMB_LBSPP128_LPA8_LPB8_LRVW8_PGR2_PLR5_SU0_SUS0_SRVW4_TT2_128_VAW2_WSGRA1_WSGRB1_WG64_4_1_WGM1
    SolutionIndex: 203
    SolutionNameMin: Cijk_Alik_Bljk_HHS_BH_MT160x128x64_MI32x32x8x1_SE_1LDSB1_AF0EM8_EPS1_GRVW8_GSU1_GSUAMB_LBSPP128_LPA8_LPB8_LRVW8_PGR1_PLR9_SU32_SUS128_SRVW0_TT5_32_VAW2_WSGRA1_WSGRB1_WG32_8_1_WGM2
    SolutionIndex: 204
    SolutionNameMin: Cijk_Alik_Bljk_HHS_BH_MT64x128x64_MI32x32x8x1_SE_1LDSB1_AF0EM8_EPS1_GRVW8_GSU1_GSUAMB_LBSPP128_LPA8_LPB8_LRVW8_PGR1_PLR9_SU32_SUS128_SRVW4_TT1_64_VAW2_WSGRA1_WSGRB1_WG64_4_1_WGM2
    SolutionIndex: 205
    SolutionNameMin: Cijk_Alik_Bljk_HHS_BH_MT128x128x32_MI32x32x8x1_SE_1LDSB1_AF0EM8_EPS0_GRVW8_GSU1_GSUAMB_LBSPP128_LPA8_LPB8_LRVW8_PGR2_PLR5_SU0_SUS0_SRVW4_TT2_64_VAW2_WSGRA1_WSGRB1_WG64_4_1_WGM2
    SolutionIndex: 206
    SolutionNameMin: Cijk_Alik_Bljk_HHS_BH_MT64x64x64_MI32x32x8x1_SE_1LDSB1_AF0EM8_EPS1_GRVW8_GSU1_GSUAMB_LBSPP128_LPA8_LPB8_LRVW8_PGR1_PLR9_SU32_SUS128_SRVW4_TT1_32_VAW2_WSGRA1_WSGRB1_WG64_4_1_WGM15
    SolutionIndex: 207
    SolutionNameMin: Cijk_Alik_Bljk_HHS_BH_MT64x128x64_MI32x32x8x1_SE_1LDSB1_AF0EM8_EPS1_GRVW8_GSU1_GSUAMB_LBSPP128_LPA8_LPB8_LRVW8_PGR1_PLR9_SU32_SUS128_SRVW4_TT1_64_VAW2_WSGRA1_WSGRB1_WG64_4_1_WGM15
    SolutionIndex: 208
    SolutionNameMin: Cijk_Alik_Bljk_HHS_BH_MT128x128x32_MI32x32x8x1_SE_1LDSB1_AF0EM8_EPS1_GRVW4_GSU1_GSUAMB_LBSPP128_LPA8_LPB8_LRVW8_PGR1_PLR5_SU32_SUS256_SRVW4_TT2_64_VAW2_WSGRA1_WSGRB1_WG64_4_1_WGM1
    SolutionIndex: 209
    SolutionNameMin: Cijk_Alik_Bljk_HHS_BH_MT64x128x64_MI32x32x8x1_SE_1LDSB1_AF0EM8_EPS1_GRVW8_GSU1_GSUAMB_LBSPP128_LPA8_LPB8_LRVW8_PGR1_PLR9_SU0_SUS0_SRVW4_TT1_64_VAW2_WSGRA1_WSGRB1_WG64_4_1_WGM1
    SolutionIndex: 210
    SolutionNameMin: Cijk_Alik_Bljk_HHS_BH_MT128x96x32_MI32x32x8x1_SE_1LDSB1_AF0EM8_EPS1_GRVW4_GSU1_GSUAMB_LBSPP128_LPA8_LPB8_LRVW8_PGR1_PLR5_SU32_SUS256_SRVW4_TT1_96_VAW2_WSGRA1_WSGRB1_WG128_2_1_WGM2
    SolutionIndex: 211
    SolutionNameMin: Cijk_Alik_Bljk_HHS_BH_MT128x128x32_MI32x32x8x1_SE_1LDSB1_AF0EM1_EPS1_GRVW8_GSU1_GSUAMB_LBSPP128_LPA8_LPB8_LRVW8_PGR1_PLR5_SU32_SUS256_SRVW4_TT2_64_VAW2_WSGRA1_WSGRB1_WG64_4_1_WGM15
    SolutionIndex: 212
    SolutionNameMin: Cijk_Alik_Bljk_HHS_BH_MT128x160x32_MI32x32x8x1_SE_1LDSB1_AF0EM8_EPS1_GRVW4_GSU1_GSUAMB_LBSPP128_LPA8_LPB8_LRVW8_PGR1_PLR5_SU0_SUS0_SRVW4_TT1_160_VAW2_WSGRA1_WSGRB1_WG128_2_1_WGM1
    SolutionIndex: 213
    SolutionNameMin: Cijk_Alik_Bljk_HHS_BH_MT128x256x32_MI32x32x8x1_SE_1LDSB1_AF0EM1_EPS1_GRVW8_GSU1_GSUAMB_LBSPP128_LPA8_LPB8_LRVW8_PGR1_PLR5_SU32_SUS128_SRVW4_TT2_128_VAW2_WSGRA1_WSGRB1_WG64_4_1_WGM15
    SolutionIndex: 214
    SolutionNameMin: Cijk_Alik_Bljk_HHS_BH_MT96x96x64_MI16x16x16x1_SE_1LDSB0_AF0EM8_EPS1_GRVW8_GSU1_GSUAMB_LBSPP128_LPA16_LPB16_LRVW8_PGR1_PLR5_SU32_SUS256_SRVW0_TT3_48_VAW2_WSGRA1_WSGRB1_WG32_8_1_WGM1
    SolutionIndex: 215
    SolutionNameMin: Cijk_Alik_Bljk_HHS_BH_MT128x128x32_MI32x32x8x1_SE_1LDSB1_AF0EM1_EPS1_GRVW2_GSU1_GSUAMB_LBSPP128_LPA8_LPB8_LRVW8_PGR1_PLR5_SU32_SUS128_SRVW4_TT2_64_VAW2_WSGRA1_WSGRB1_WG64_4_1_WGM1
    SolutionIndex: 216
    SolutionNameMin: Cijk_Alik_Bljk_HHS_BH_MT32x32x64_MI16x16x16x1_SE_1LDSB0_AF0EM8_EPS0_GRVW2_GSU1_GSUAMB_LBSPP128_LPA16_LPB16_LRVW8_PGR2_PLR5_SU32_SUS128_SRVW4_TT1_16_VAW2_WSGRA1_WSGRB1_WG32_8_1_WGM1
    SolutionIndex: 217
    SolutionNameMin: Cijk_Alik_Bljk_HHS_BH_MT128x64x32_MI32x32x8x1_SE_1LDSB1_AF0EM8_EPS1_GRVW2_GSU1_GSUAMB_LBSPP128_LPA8_LPB8_LRVW8_PGR1_PLR5_SU32_SUS128_SRVW4_TT2_32_VAW2_WSGRA1_WSGRB1_WG64_4_1_WGM2
    SolutionIndex: 218
    SolutionNameMin: Cijk_Alik_Bljk_HHS_BH_MT32x32x64_MI16x16x16x1_SE_1LDSB0_AF0EM8_EPS0_GRVW8_GSU1_GSUAMB_LBSPP128_LPA16_LPB16_LRVW8_PGR2_PLR5_SU0_SUS0_SRVW4_TT1_16_VAW2_WSGRA1_WSGRB1_WG32_8_1_WGM2
    SolutionIndex: 219
    SolutionNameMin: Cijk_Alik_Bljk_HHS_BH_MT64x128x64_MI32x32x8x1_SE_1LDSB0_AF0EM8_EPS0_GRVW8_GSU1_GSUAMB_LBSPP128_LPA8_LPB8_LRVW8_PGR2_PLR9_SU32_SUS128_SRVW4_TT1_64_VAW2_WSGRA1_WSGRB1_WG64_4_1_WGM2
    SolutionIndex: 220
    SolutionNameMin: Cijk_Alik_Bljk_HHS_BH_MT256x128x64_MI32x32x8x1_SE_1LDSB1_AF0EM8_EPS0_GRVW4_GSU1_GSUAMB_LBSPP128_LPA8_LPB8_LRVW8_PGR2_PLR9_SU32_SUS128_SRVW4_TT4_64_VAW2_WSGRA1_WSGRB1_WG64_4_1_WGM1
    SolutionIndex: 221
    SolutionNameMin: Cijk_Alik_Bljk_HHS_BH_MT128x128x64_MI32x32x8x1_SE_1LDSB1_AF0EM8_EPS0_GRVW8_GSU1_GSUAMB_LBSPP128_LPA8_LPB8_LRVW8_PGR2_PLR9_SU32_SUS128_SRVW4_TT2_64_VAW2_WSGRA1_WSGRB1_WG64_4_1_WGM15
    SolutionIndex: 222
    SolutionNameMin: Cijk_Alik_Bljk_HHS_BH_MT128x256x32_MI32x32x8x1_SE_1LDSB1_AF0EM8_EPS0_GRVW8_GSU1_GSUAMB_LBSPP128_LPA8_LPB8_LRVW8_PGR2_PLR5_SU0_SUS0_SRVW4_TT2_128_VAW2_WSGRA1_WSGRB1_WG64_4_1_WGM15
    SolutionIndex: 223
    SolutionNameMin: Cijk_Alik_Bljk_HHS_BH_MT128x96x32_MI32x32x8x1_SE_1LDSB1_AF0EM8_EPS1_GRVW4_GSU1_GSUAMB_LBSPP128_LPA8_LPB8_LRVW8_PGR1_PLR5_SU32_SUS256_SRVW4_TT1_96_VAW2_WSGRA1_WSGRB1_WG128_2_1_WGM15
    SolutionIndex: 224
    SolutionNameMin: Cijk_Alik_Bljk_HHS_BH_MT64x128x64_MI32x32x8x1_SE_1LDSB1_AF0EM8_EPS1_GRVW8_GSU1_GSUAMB_LBSPP128_LPA8_LPB8_LRVW8_PGR1_PLR9_SU0_SUS0_SRVW4_TT1_64_VAW2_WSGRA1_WSGRB1_WG64_4_1_WGM2
    SolutionIndex: 225
    SolutionNameMin: Cijk_Alik_Bljk_HHS_BH_MT128x128x32_MI32x32x8x1_SE_1LDSB1_AF0EM8_EPS1_GRVW4_GSU1_GSUAMB_LBSPP128_LPA8_LPB8_LRVW8_PGR1_PLR5_SU0_SUS0_SRVW4_TT2_64_VAW2_WSGRA1_WSGRB1_WG64_4_1_WGM2
    SolutionIndex: 226
    SolutionNameMin: Cijk_Alik_Bljk_HHS_BH_MT64x32x64_MI16x16x16x1_SE_1LDSB0_AF0EM1_EPS0_GRVW8_GSU15_GSUAMB_LBSPP128_LPA16_LPB16_LRVW8_PGR2_PLR5_SU32_SUS128_SRVW4_TT2_16_VAW1_WSGRA1_WSGRB1_WG32_8_1_WGM1
    SolutionIndex: 227
    SolutionNameMin: Cijk_Alik_Bljk_HHS_BH_MT128x128x32_MI32x32x8x1_SE_1LDSB1_AF0EM8_EPS0_GRVW8_GSU1_GSUAMB_LBSPP128_LPA8_LPB8_LRVW8_PGR2_PLR5_SU0_SUS0_SRVW4_TT2_64_VAW2_WSGRA1_WSGRB1_WG64_4_1_WGM1
    SolutionIndex: 228
    SolutionNameMin: Cijk_Alik_Bljk_HHS_BH_MT256x128x32_MI32x32x8x1_SE_1LDSB0_AF0EM8_EPS0_GRVW8_GSU1_GSUAMB_LBSPP128_LPA8_LPB8_LRVW8_PGR2_PLR5_SU32_SUS128_SRVW4_TT4_64_VAW2_WSGRA1_WSGRB1_WG64_4_1_WGM15
    SolutionIndex: 229
    SolutionNameMin: Cijk_Alik_Bljk_HHS_BH_MT256x128x32_MI32x32x8x1_SE_1LDSB0_AF0EM8_EPS0_GRVW8_GSU1_GSUAMB_LBSPP128_LPA8_LPB8_LRVW8_PGR2_PLR5_SU0_SUS0_SRVW4_TT4_64_VAW2_WSGRA1_WSGRB1_WG64_4_1_WGM1
    SolutionIndex: 230
    SolutionNameMin: Cijk_Alik_Bljk_HHS_BH_MT128x128x32_MI32x32x8x1_SE_1LDSB0_AF0EM8_EPS0_GRVW8_GSU1_GSUAMB_LBSPP128_LPA8_LPB8_LRVW8_PGR2_PLR5_SU32_SUS256_SRVW4_TT2_64_VAW2_WSGRA1_WSGRB1_WG64_4_1_WGM1
    SolutionIndex: 231
    SolutionNameMin: Cijk_Alik_Bljk_HHS_BH_MT128x64x32_MI32x32x8x1_SE_1LDSB1_AF0EM8_EPS0_GRVW8_GSU1_GSUAMB_LBSPP128_LPA8_LPB8_LRVW8_PGR2_PLR5_SU0_SUS0_SRVW4_TT2_32_VAW2_WSGRA1_WSGRB1_WG64_4_1_WGM15
    SolutionIndex: 232
    SolutionNameMin: Cijk_Alik_Bljk_HHS_BH_MT128x96x64_MI32x32x8x1_SE_1LDSB0_AF0EM8_EPS0_GRVW4_GSU15_GSUAMB_LBSPP128_LPA8_LPB8_LRVW8_PGR2_PLR9_SU0_SUS0_SRVW4_TT1_96_VAW1_WSGRA1_WSGRB1_WG128_2_1_WGM2
    SolutionIndex: 233
    SolutionNameMin: Cijk_Alik_Bljk_HHS_BH_MT128x96x64_MI32x32x8x1_SE_1LDSB0_AF0EM8_EPS0_GRVW4_GSU15_GSUAMB_LBSPP128_LPA8_LPB8_LRVW8_PGR2_PLR9_SU0_SUS0_SRVW4_TT1_96_VAW1_WSGRA1_WSGRB1_WG128_2_1_WGM1
    SolutionIndex: 234
    SolutionNameMin: Cijk_Alik_Bljk_HHS_BH_MT128x96x64_MI32x32x8x1_SE_1LDSB0_AF0EM8_EPS0_GRVW8_GSU15_GSUAMB_LBSPP128_LPA8_LPB8_LRVW8_PGR2_PLR9_SU32_SUS128_SRVW4_TT1_96_VAW1_WSGRA1_WSGRB1_WG128_2_1_WGM1
    SolutionIndex: 235
    SolutionNameMin: Cijk_Alik_Bljk_HHS_BH_MT128x96x64_MI32x32x8x1_SE_1LDSB0_AF0EM8_EPS0_GRVW2_GSU15_GSUAMB_LBSPP128_LPA8_LPB8_LRVW8_PGR2_PLR9_SU0_SUS0_SRVW4_TT1_96_VAW1_WSGRA1_WSGRB1_WG128_2_1_WGM1
    SolutionIndex: 236
    SolutionNameMin: Cijk_Alik_Bljk_HHS_BH_MT64x64x32_MI32x32x8x1_SE_1LDSB1_AF0EM8_EPS0_GRVW4_GSU15_GSUAMB_LBSPP128_LPA8_LPB8_LRVW8_PGR2_PLR5_SU0_SUS0_SRVW4_TT1_32_VAW1_WSGRA1_WSGRB1_WG64_4_1_WGM1
    SolutionIndex: 237
    SolutionNameMin: Cijk_Alik_Bljk_HHS_BH_MT64x32x64_MI16x16x16x1_SE_1LDSB0_AF0EM8_EPS0_GRVW8_GSU7_GSUAMB_LBSPP128_LPA16_LPB16_LRVW8_PGR2_PLR5_SU0_SUS0_SRVW4_TT2_16_VAW1_WSGRA1_WSGRB1_WG32_8_1_WGM1
    SolutionIndex: 238
    SolutionNameMin: Cijk_Alik_Bljk_HHS_BH_MT128x64x64_MI32x32x8x1_SE_1LDSB0_AF0EM8_EPS0_GRVW8_GSU5_GSUAMB_LBSPP128_LPA8_LPB8_LRVW8_PGR2_PLR9_SU32_SUS128_SRVW4_TT2_32_VAW1_WSGRA1_WSGRB1_WG64_4_1_WGM2
    SolutionIndex: 239
    SolutionNameMin: Cijk_Alik_Bljk_HHS_BH_MT128x96x64_MI32x32x8x1_SE_1LDSB1_AF0EM8_EPS0_GRVW8_GSU15_GSUAMB_LBSPP128_LPA8_LPB8_LRVW8_PGR2_PLR9_SU32_SUS128_SRVW4_TT1_96_VAW1_WSGRA1_WSGRB1_WG128_2_1_WGM1
    SolutionIndex: 240
    SolutionNameMin: Cijk_Alik_Bljk_HHS_BH_MT128x96x32_MI32x32x8x1_SE_1LDSB0_AF0EM8_EPS0_GRVW4_GSU7_GSUAMB_LBSPP128_LPA8_LPB8_LRVW8_PGR2_PLR5_SU32_SUS256_SRVW4_TT1_96_VAW1_WSGRA1_WSGRB1_WG128_2_1_WGM1
    SolutionIndex: 241
    SolutionNameMin: Cijk_Alik_Bljk_HHS_BH_MT64x192x32_MI32x32x8x1_SE_1LDSB0_AF0EM8_EPS0_GRVW8_GSU15_GSUAMB_LBSPP128_LPA8_LPB8_LRVW8_PGR2_PLR5_SU0_SUS0_SRVW4_TT1_96_VAW1_WSGRA1_WSGRB1_WG64_4_1_WGM15
    SolutionIndex: 242
    SolutionNameMin: Cijk_Alik_Bljk_HHS_BH_MT128x128x32_MI32x32x8x1_SE_1LDSB0_AF0EM8_EPS0_GRVW8_GSU15_GSUAMB_LBSPP128_LPA8_LPB8_LRVW8_PGR2_PLR5_SU0_SUS0_SRVW4_TT2_64_VAW1_WSGRA1_WSGRB1_WG64_4_1_WGM2
    SolutionIndex: 243
    SolutionNameMin: Cijk_Alik_Bljk_HHS_BH_MT64x128x64_MI32x32x8x1_SE_1LDSB0_AF0EM8_EPS0_GRVW8_GSU7_GSUAMB_LBSPP128_LPA8_LPB8_LRVW8_PGR2_PLR9_SU32_SUS256_SRVW4_TT1_64_VAW1_WSGRA1_WSGRB1_WG64_4_1_WGM1
    SolutionIndex: 244
    SolutionNameMin: Cijk_Alik_Bljk_HHS_BH_MT128x64x64_MI32x32x8x1_SE_1LDSB1_AF0EM8_EPS0_GRVW8_GSU15_GSUAMB_LBSPP128_LPA8_LPB8_LRVW8_PGR2_PLR9_SU0_SUS0_SRVW4_TT2_32_VAW1_WSGRA1_WSGRB1_WG64_4_1_WGM2
    SolutionIndex: 245
    SolutionNameMin: Cijk_Alik_Bljk_HHS_BH_MT64x64x64_MI32x32x8x1_SE_1LDSB0_AF0EM8_EPS0_GRVW8_GSU3_GSUAMB_LBSPP128_LPA8_LPB8_LRVW8_PGR2_PLR9_SU0_SUS0_SRVW4_TT1_32_VAW1_WSGRA1_WSGRB1_WG64_4_1_WGM2
    SolutionIndex: 246
    SolutionNameMin: Cijk_Alik_Bljk_HHS_BH_MT64x64x64_MI32x32x8x1_SE_1LDSB0_AF0EM8_EPS0_GRVW8_GSU3_GSUAMB_LBSPP128_LPA8_LPB8_LRVW8_PGR2_PLR9_SU32_SUS128_SRVW4_TT1_32_VAW1_WSGRA1_WSGRB1_WG64_4_1_WGM1
    SolutionIndex: 247
    SolutionNameMin: Cijk_Alik_Bljk_HHS_BH_MT128x96x64_MI32x32x8x1_SE_1LDSB0_AF0EM8_EPS0_GRVW8_GSU15_GSUAMB_LBSPP128_LPA8_LPB8_LRVW8_PGR2_PLR9_SU0_SUS0_SRVW4_TT1_96_VAW1_WSGRA1_WSGRB1_WG128_2_1_WGM2
    SolutionIndex: 248
    SolutionNameMin: Cijk_Alik_Bljk_HHS_BH_MT128x64x64_MI32x32x8x1_SE_1LDSB1_AF0EM8_EPS0_GRVW8_GSU7_GSUAMB_LBSPP128_LPA8_LPB8_LRVW8_PGR2_PLR9_SU0_SUS0_SRVW4_TT2_32_VAW1_WSGRA1_WSGRB1_WG64_4_1_WGM2
    SolutionIndex: 249
    SolutionNameMin: Cijk_Alik_Bljk_HHS_BH_MT128x64x64_MI32x32x8x1_SE_1LDSB0_AF0EM8_EPS0_GRVW8_GSU7_GSUAMB_LBSPP128_LPA8_LPB8_LRVW8_PGR2_PLR9_SU0_SUS0_SRVW4_TT2_32_VAW1_WSGRA1_WSGRB1_WG64_4_1_WGM1
    SolutionIndex: 250
    SolutionNameMin: Cijk_Alik_Bljk_HHS_BH_MT32x32x64_MI16x16x16x1_SE_1LDSB0_AF0EM8_EPS0_GRVW8_GSU7_GSUAMB_LBSPP128_LPA16_LPB16_LRVW8_PGR2_PLR5_SU32_SUS256_SRVW4_TT1_16_VAW1_WSGRA1_WSGRB1_WG32_8_1_WGM1
    SolutionIndex: 251
    SolutionNameMin: Cijk_Alik_Bljk_HHS_BH_MT64x64x64_MI32x32x8x1_SE_1LDSB0_AF0EM8_EPS0_GRVW4_GSU1_GSUAMB_LBSPP128_LPA8_LPB8_LRVW8_PGR2_PLR9_SU0_SUS0_SRVW4_TT1_32_VAW2_WSGRA1_WSGRB1_WG64_4_1_WGM1
    SolutionIndex: 252
    SolutionNameMin: Cijk_Alik_Bljk_HHS_BH_MT32x32x64_MI16x16x16x1_SE_1LDSB0_AF0EM8_EPS0_GRVW4_GSU7_GSUAMB_LBSPP128_LPA16_LPB16_LRVW8_PGR2_PLR5_SU0_SUS0_SRVW4_TT1_16_VAW1_WSGRA1_WSGRB1_WG32_8_1_WGM1
    SolutionIndex: 253
    SolutionNameMin: Cijk_Alik_Bljk_HHS_BH_MT128x96x32_MI32x32x8x1_SE_1LDSB0_AF0EM8_EPS0_GRVW2_GSU15_GSUAMB_LBSPP128_LPA8_LPB8_LRVW8_PGR2_PLR5_SU0_SUS0_SRVW4_TT1_96_VAW1_WSGRA1_WSGRB1_WG128_2_1_WGM15
    SolutionIndex: 254
    SolutionNameMin: Cijk_Alik_Bljk_HHS_BH_MT128x96x32_MI32x32x8x1_SE_1LDSB0_AF0EM8_EPS0_GRVW4_GSU1_GSUAMB_LBSPP128_LPA8_LPB8_LRVW8_PGR2_PLR5_SU0_SUS0_SRVW4_TT1_96_VAW2_WSGRA1_WSGRB1_WG128_2_1_WGM15
    SolutionIndex: 255
    SolutionNameMin: Cijk_Alik_Bljk_HHS_BH_MT16x16x128_MI16x16x16x1_SE_1LDSB1_AF0EM8_EPS1_GRVW8_GSU15_GSUAMB_LBSPP256_LPA16_LPB16_LRVW8_PGR1_PLR9_SU32_SUS256_SRVW4_TT1_16_VAW1_WSGRA1_WSGRB1_WG16_4_1_WGM15
    SolutionIndex: 256
    SolutionNameMin: Cijk_Alik_Bljk_HHS_BH_MT128x96x32_MI32x32x8x1_SE_1LDSB0_AF0EM8_EPS0_GRVW4_GSU1_GSUAMB_LBSPP128_LPA8_LPB8_LRVW8_PGR2_PLR5_SU32_SUS128_SRVW4_TT1_96_VAW2_WSGRA1_WSGRB1_WG128_2_1_WGM15
    SolutionIndex: 257
    SolutionNameMin: Cijk_Alik_Bljk_HHS_BH_MT64x192x32_MI32x32x8x1_SE_1LDSB0_AF0EM8_EPS0_GRVW8_GSU1_GSUAMB_LBSPP128_LPA8_LPB8_LRVW8_PGR2_PLR5_SU32_SUS128_SRVW4_TT1_96_VAW2_WSGRA1_WSGRB1_WG64_4_1_WGM15
    SolutionIndex: 258
    SolutionNameMin: Cijk_Alik_Bljk_HHS_BH_MT128x128x32_MI32x32x8x1_SE_1LDSB0_AF0EM8_EPS0_GRVW4_GSU1_GSUAMB_LBSPP128_LPA8_LPB8_LRVW8_PGR2_PLR5_SU32_SUS256_SRVW4_TT2_64_VAW2_WSGRA1_WSGRB1_WG64_4_1_WGM2
    SolutionIndex: 259
    SolutionNameMin: Cijk_Alik_Bljk_HHS_BH_MT16x64x64_MI16x16x16x1_SE_1LDSB0_AF0EM8_EPS0_GRVW8_GSU1_GSUAMB_LBSPP128_LPA16_LPB16_LRVW8_PGR2_PLR5_SU0_SUS0_SRVW0_TT1_16_VAW2_WSGRA1_WSGRB1_WG16_16_1_WGM2
    SolutionIndex: 260
    SolutionNameMin: Cijk_Alik_Bljk_HHS_BH_MT128x64x32_MI32x32x8x1_SE_1LDSB0_AF0EM8_EPS0_GRVW4_GSU1_GSUAMB_LBSPP128_LPA8_LPB8_LRVW8_PGR2_PLR5_SU0_SUS0_SRVW4_TT2_32_VAW2_WSGRA1_WSGRB1_WG64_4_1_WGM15
    SolutionIndex: 261
    SolutionNameMin: Cijk_Alik_Bljk_HHS_BH_MT128x128x32_MI32x32x8x1_SE_1LDSB1_AF0EM8_EPS1_GRVW2_GSU1_GSUAMB_LBSPP128_LPA8_LPB8_LRVW8_PGR1_PLR5_SU0_SUS0_SRVW4_TT2_64_VAW2_WSGRA1_WSGRB1_WG64_4_1_WGM15
    SolutionIndex: 262
    SolutionNameMin: Cijk_Alik_Bljk_HHS_BH_MT128x128x32_MI32x32x8x1_SE_1LDSB1_AF0EM8_EPS0_GRVW2_GSU1_GSUAMB_LBSPP128_LPA8_LPB8_LRVW8_PGR2_PLR5_SU32_SUS256_SRVW4_TT2_64_VAW2_WSGRA1_WSGRB1_WG64_4_1_WGM1
    SolutionIndex: 263
    SolutionNameMin: Cijk_Alik_Bljk_HHS_BH_MT256x128x32_MI32x32x8x1_SE_1LDSB1_AF0EM8_EPS0_GRVW8_GSU1_GSUAMB_LBSPP128_LPA8_LPB8_LRVW8_PGR2_PLR5_SU0_SUS0_SRVW4_TT4_64_VAW2_WSGRA1_WSGRB1_WG64_4_1_WGM15
    SolutionIndex: 264
    SolutionNameMin: Cijk_Alik_Bljk_HHS_BH_MT128x128x32_MI32x32x8x1_SE_1LDSB1_AF0EM8_EPS0_GRVW2_GSU1_GSUAMB_LBSPP128_LPA8_LPB8_LRVW8_PGR2_PLR5_SU0_SUS0_SRVW4_TT2_64_VAW2_WSGRA1_WSGRB1_WG64_4_1_WGM15
    SolutionIndex: 265
    SolutionNameMin: Cijk_Alik_Bljk_HHS_BH_MT128x160x32_MI32x32x8x1_SE_1LDSB0_AF0EM8_EPS0_GRVW4_GSU1_GSUAMB_LBSPP128_LPA8_LPB8_LRVW8_PGR2_PLR5_SU0_SUS0_SRVW4_TT1_160_VAW2_WSGRA1_WSGRB1_WG128_2_1_WGM15
    SolutionIndex: 266
    SolutionNameMin: Cijk_Alik_Bljk_HHS_BH_MT128x96x32_MI32x32x8x1_SE_1LDSB0_AF0EM8_EPS0_GRVW2_GSU1_GSUAMB_LBSPP128_LPA8_LPB8_LRVW8_PGR2_PLR5_SU0_SUS0_SRVW4_TT1_96_VAW2_WSGRA1_WSGRB1_WG128_2_1_WGM15
    SolutionIndex: 267
    SolutionNameMin: Cijk_Alik_Bljk_HHS_BH_MT64x64x64_MI32x32x8x1_SE_1LDSB1_AF0EM8_EPS1_GRVW4_GSU1_GSUAMB_LBSPP128_LPA8_LPB8_LRVW8_PGR1_PLR9_SU0_SUS0_SRVW4_TT1_32_VAW2_WSGRA1_WSGRB1_WG64_4_1_WGM1
    SolutionIndex: 268
    SolutionNameMin: Cijk_Alik_Bljk_HHS_BH_MT128x64x32_MI32x32x8x1_SE_1LDSB1_AF0EM8_EPS1_GRVW2_GSU1_GSUAMB_LBSPP128_LPA8_LPB8_LRVW8_PGR1_PLR5_SU0_SUS0_SRVW4_TT2_32_VAW2_WSGRA1_WSGRB1_WG64_4_1_WGM2
    SolutionIndex: 269
    SolutionNameMin: Cijk_Alik_Bljk_HHS_BH_MT128x64x32_MI32x32x8x1_SE_1LDSB1_AF0EM8_EPS1_GRVW2_GSU1_GSUAMB_LBSPP128_LPA8_LPB8_LRVW8_PGR1_PLR5_SU0_SUS0_SRVW4_TT2_32_VAW2_WSGRA1_WSGRB1_WG64_4_1_WGM15
    SolutionIndex: 270
    SolutionNameMin: Cijk_Alik_Bljk_HHS_BH_MT64x64x32_MI32x32x8x1_SE_1LDSB1_AF0EM8_EPS0_GRVW8_GSU1_GSUAMB_LBSPP128_LPA8_LPB8_LRVW8_PGR2_PLR5_SU0_SUS0_SRVW4_TT1_32_VAW2_WSGRA1_WSGRB1_WG64_4_1_WGM15
    SolutionIndex: 271
    SolutionNameMin: Cijk_Alik_Bljk_HHS_BH_MT64x32x32_MI16x16x16x1_SE_1LDSB1_AF0EM8_EPS0_GRVW2_GSU1_GSUAMB_LBSPP128_LPA16_LPB16_LRVW8_PGR2_PLR2_SU0_SUS0_SRVW4_TT2_16_VAW2_WSGRA1_WSGRB1_WG32_8_1_WGM2
    SolutionIndex: 272
    SolutionNameMin: Cijk_Alik_Bljk_HHS_BH_MT128x128x32_MI32x32x8x1_SE_1LDSB1_AF0EM8_EPS0_GRVW4_GSU1_GSUAMB_LBSPP128_LPA8_LPB8_LRVW8_PGR2_PLR5_SU32_SUS128_SRVW4_TT2_64_VAW2_WSGRA1_WSGRB1_WG64_4_1_WGM15
    SolutionIndex: 273
    SolutionNameMin: Cijk_Alik_Bljk_HHS_BH_MT128x64x32_MI32x32x8x1_SE_1LDSB1_AF0EM8_EPS1_GRVW8_GSU1_GSUAMB_LBSPP128_LPA8_LPB8_LRVW8_PGR1_PLR5_SU0_SUS0_SRVW4_TT2_32_VAW2_WSGRA1_WSGRB1_WG64_4_1_WGM2
    SolutionIndex: 274
    SolutionNameMin: Cijk_Alik_Bljk_HHS_BH_MT256x128x32_MI32x32x8x1_SE_1LDSB0_AF0EM8_EPS0_GRVW8_GSU1_GSUAMB_LBSPP128_LPA8_LPB8_LRVW8_PGR2_PLR5_SU0_SUS0_SRVW4_TT4_64_VAW2_WSGRA1_WSGRB1_WG64_4_1_WGM15
    SolutionIndex: 275
    SolutionNameMin: Cijk_Alik_Bljk_HHS_BH_MT128x64x32_MI32x32x8x1_SE_1LDSB1_AF0EM8_EPS1_GRVW2_GSU1_GSUAMB_LBSPP128_LPA8_LPB8_LRVW8_PGR1_PLR5_SU32_SUS256_SRVW4_TT2_32_VAW2_WSGRA1_WSGRB1_WG64_4_1_WGM1
    SolutionIndex: 276
    SolutionNameMin: Cijk_Alik_Bljk_HHS_BH_MT128x128x64_MI32x32x8x1_SE_1LDSB1_AF0EM8_EPS0_GRVW8_GSU1_GSUAMB_LBSPP128_LPA8_LPB8_LRVW8_PGR2_PLR9_SU32_SUS128_SRVW4_TT2_64_VAW2_WSGRA1_WSGRB1_WG64_4_1_WGM1
    SolutionIndex: 277
    SolutionNameMin: Cijk_Alik_Bljk_HHS_BH_MT128x256x32_MI32x32x8x1_SE_1LDSB1_AF0EM8_EPS0_GRVW4_GSU1_GSUAMB_LBSPP128_LPA8_LPB8_LRVW8_PGR2_PLR5_SU0_SUS0_SRVW4_TT2_128_VAW2_WSGRA1_WSGRB1_WG64_4_1_WGM2
    SolutionIndex: 278
    SolutionNameMin: Cijk_Alik_Bljk_HHS_BH_MT256x128x32_MI32x32x8x1_SE_1LDSB1_AF0EM8_EPS0_GRVW4_GSU1_GSUAMB_LBSPP128_LPA8_LPB8_LRVW8_PGR2_PLR5_SU32_SUS256_SRVW4_TT4_64_VAW2_WSGRA1_WSGRB1_WG64_4_1_WGM1
    SolutionIndex: 279
    SolutionNameMin: Cijk_Alik_Bljk_HHS_BH_MT128x256x32_MI32x32x8x1_SE_1LDSB1_AF0EM8_EPS0_GRVW8_GSU1_GSUAMB_LBSPP128_LPA8_LPB8_LRVW8_PGR2_PLR5_SU0_SUS0_SRVW4_TT2_128_VAW2_WSGRA1_WSGRB1_WG64_4_1_WGM2
    SolutionIndex: 280
    SolutionNameMin: Cijk_Alik_Bljk_HHS_BH_MT128x128x32_MI32x32x8x1_SE_1LDSB1_AF0EM1_EPS0_GRVW8_GSU1_GSUAMB_LBSPP128_LPA8_LPB8_LRVW8_PGR2_PLR5_SU0_SUS0_SRVW4_TT2_64_VAW2_WSGRA1_WSGRB1_WG64_4_1_WGM15
    SolutionIndex: 281
    SolutionNameMin: Cijk_Alik_Bljk_HHS_BH_MT128x256x32_MI32x32x8x1_SE_1LDSB1_AF0EM1_EPS1_GRVW8_GSU1_GSUAMB_LBSPP128_LPA8_LPB8_LRVW8_PGR1_PLR5_SU0_SUS0_SRVW4_TT2_128_VAW2_WSGRA1_WSGRB1_WG64_4_1_WGM2
    SolutionIndex: 282
    SolutionNameMin: Cijk_Alik_Bljk_HHS_BH_MT128x128x32_MI32x32x8x1_SE_1LDSB1_AF0EM8_EPS1_GRVW4_GSU1_GSUAMB_LBSPP128_LPA8_LPB8_LRVW8_PGR1_PLR5_SU0_SUS0_SRVW4_TT2_64_VAW2_WSGRA1_WSGRB1_WG64_4_1_WGM15
    SolutionIndex: 283
    SolutionNameMin: Cijk_Alik_Bljk_HHS_BH_MT256x256x32_MI32x32x8x1_SE_1LDSB1_AF0EM1_EPS1_GRVW2_GSU1_GSUAMB_LBSPP128_LPA8_LPB8_LRVW8_PGR1_PLR5_SU0_SUS0_SRVW4_TT4_128_VAW2_WSGRA1_WSGRB1_WG64_4_1_WGM2
    SolutionIndex: 284
    SolutionNameMin: Cijk_Alik_Bljk_HHS_BH_MT128x256x32_MI32x32x8x1_SE_1LDSB1_AF0EM1_EPS1_GRVW8_GSU1_GSUAMB_LBSPP128_LPA8_LPB8_LRVW8_PGR1_PLR5_SU0_SUS0_SRVW4_TT2_128_VAW2_WSGRA1_WSGRB1_WG64_4_1_WGM1
    SolutionIndex: 285
    SolutionNameMin: Cijk_Alik_Bljk_HHS_BH_MT64x64x32_MI32x32x8x1_SE_1LDSB1_AF0EM1_EPS0_GRVW2_GSU1_GSUAMB_LBSPP128_LPA8_LPB8_LRVW8_PGR2_PLR5_SU32_SUS256_SRVW4_TT1_32_VAW2_WSGRA1_WSGRB1_WG64_4_1_WGM15
    SolutionIndex: 286
    SolutionNameMin: Cijk_Alik_Bljk_HHS_BH_MT64x128x32_MI32x32x8x1_SE_1LDSB1_AF0EM1_EPS1_GRVW2_GSU1_GSUAMB_LBSPP128_LPA8_LPB8_LRVW8_PGR1_PLR5_SU32_SUS128_SRVW4_TT1_64_VAW2_WSGRA1_WSGRB1_WG64_4_1_WGM2
    SolutionIndex: 287
    SolutionNameMin: Cijk_Alik_Bljk_HHS_BH_MT64x128x32_MI32x32x8x1_SE_1LDSB1_AF0EM1_EPS1_GRVW2_GSU1_GSUAMB_LBSPP128_LPA8_LPB8_LRVW8_PGR1_PLR5_SU32_SUS128_SRVW4_TT1_64_VAW2_WSGRA1_WSGRB1_WG64_4_1_WGM15
    SolutionIndex: 288
    SolutionNameMin: Cijk_Alik_Bljk_HHS_BH_MT128x256x32_MI32x32x8x1_SE_1LDSB0_AF0EM1_EPS0_GRVW8_GSU1_GSUAMB_LBSPP128_LPA8_LPB8_LRVW8_PGR2_PLR5_SU0_SUS0_SRVW4_TT2_128_VAW2_WSGRA1_WSGRB1_WG64_4_1_WGM15
    SolutionIndex: 289
    SolutionNameMin: Cijk_Alik_Bljk_HHS_BH_MT64x64x32_MI32x32x8x1_SE_1LDSB1_AF0EM1_EPS1_GRVW8_GSU1_GSUAMB_LBSPP128_LPA8_LPB8_LRVW8_PGR1_PLR5_SU0_SUS0_SRVW4_TT1_32_VAW2_WSGRA1_WSGRB1_WG64_4_1_WGM15
    SolutionIndex: 290
    SolutionNameMin: Cijk_Alik_Bljk_HHS_BH_MT64x64x32_MI32x32x8x1_SE_1LDSB1_AF0EM1_EPS1_GRVW4_GSU1_GSUAMB_LBSPP128_LPA8_LPB8_LRVW8_PGR1_PLR5_SU0_SUS0_SRVW4_TT1_32_VAW2_WSGRA1_WSGRB1_WG64_4_1_WGM2
    SolutionIndex: 291
    SolutionNameMin: Cijk_Alik_Bljk_HHS_BH_MT64x64x32_MI32x32x8x1_SE_1LDSB1_AF0EM1_EPS0_GRVW4_GSU1_GSUAMB_LBSPP128_LPA8_LPB8_LRVW8_PGR2_PLR5_SU32_SUS128_SRVW4_TT1_32_VAW2_WSGRA1_WSGRB1_WG64_4_1_WGM15
    SolutionIndex: 292
    SolutionNameMin: Cijk_Alik_Bljk_HHS_BH_MT128x128x32_MI32x32x8x1_SE_1LDSB1_AF0EM1_EPS1_GRVW8_GSU1_GSUAMB_LBSPP128_LPA8_LPB8_LRVW8_PGR1_PLR5_SU0_SUS0_SRVW4_TT2_64_VAW2_WSGRA1_WSGRB1_WG64_4_1_WGM15
    SolutionIndex: 293
    SolutionNameMin: Cijk_Alik_Bljk_HHS_BH_MT64x128x32_MI32x32x8x1_SE_1LDSB1_AF0EM1_EPS1_GRVW8_GSU1_GSUAMB_LBSPP128_LPA8_LPB8_LRVW8_PGR1_PLR5_SU0_SUS0_SRVW4_TT1_64_VAW2_WSGRA1_WSGRB1_WG64_4_1_WGM2
    SolutionIndex: 294
    SolutionNameMin: Cijk_Alik_Bljk_HHS_BH_MT64x64x32_MI32x32x8x1_SE_1LDSB1_AF0EM1_EPS0_GRVW2_GSU1_GSUAMB_LBSPP128_LPA8_LPB8_LRVW8_PGR2_PLR5_SU32_SUS128_SRVW4_TT1_32_VAW2_WSGRA1_WSGRB1_WG64_4_1_WGM15
    SolutionIndex: 295
    SolutionNameMin: Cijk_Alik_Bljk_HHS_BH_MT64x64x32_MI32x32x8x1_SE_1LDSB1_AF0EM1_EPS1_GRVW2_GSU1_GSUAMB_LBSPP128_LPA8_LPB8_LRVW8_PGR1_PLR5_SU32_SUS256_SRVW4_TT1_32_VAW2_WSGRA1_WSGRB1_WG64_4_1_WGM15
    SolutionIndex: 296
    SolutionNameMin: Cijk_Alik_Bljk_HHS_BH_MT64x64x32_MI32x32x8x1_SE_1LDSB1_AF0EM1_EPS1_GRVW2_GSU1_GSUAMB_LBSPP128_LPA8_LPB8_LRVW8_PGR1_PLR5_SU0_SUS0_SRVW4_TT1_32_VAW2_WSGRA1_WSGRB1_WG64_4_1_WGM2
    SolutionIndex: 297
    SolutionNameMin: Cijk_Alik_Bljk_HHS_BH_MT128x128x32_MI32x32x8x1_SE_1LDSB1_AF0EM1_EPS1_GRVW4_GSU1_GSUAMB_LBSPP128_LPA8_LPB8_LRVW8_PGR1_PLR5_SU0_SUS0_SRVW4_TT2_64_VAW2_WSGRA1_WSGRB1_WG64_4_1_WGM15
    SolutionIndex: 298
    SolutionNameMin: Cijk_Alik_Bljk_HHS_BH_MT128x192x32_MI32x32x8x1_SE_1LDSB1_AF0EM1_EPS0_GRVW2_GSU1_GSUAMB_LBSPP128_LPA8_LPB8_LRVW8_PGR2_PLR5_SU0_SUS0_SRVW4_TT2_96_VAW2_WSGRA1_WSGRB1_WG64_4_1_WGM15
    SolutionIndex: 299
    SolutionNameMin: Cijk_Alik_Bljk_HHS_BH_MT64x128x32_MI32x32x8x1_SE_1LDSB1_AF0EM1_EPS1_GRVW2_GSU1_GSUAMB_LBSPP128_LPA8_LPB8_LRVW8_PGR1_PLR5_SU32_SUS256_SRVW4_TT1_64_VAW2_WSGRA1_WSGRB1_WG64_4_1_WGM2
    SolutionIndex: 300
    SolutionNameMin: Cijk_Alik_Bljk_HHS_BH_MT64x128x32_MI32x32x8x1_SE_1LDSB1_AF0EM1_EPS0_GRVW8_GSU1_GSUAMB_LBSPP128_LPA8_LPB8_LRVW8_PGR2_PLR5_SU0_SUS0_SRVW4_TT1_64_VAW2_WSGRA1_WSGRB1_WG64_4_1_WGM2
    SolutionIndex: 301
    SolutionNameMin: Cijk_Alik_Bljk_HHS_BH_MT128x256x32_MI32x32x8x1_SE_1LDSB1_AF0EM1_EPS1_GRVW2_GSU1_GSUAMB_LBSPP128_LPA8_LPB8_LRVW8_PGR1_PLR5_SU0_SUS0_SRVW4_TT2_128_VAW2_WSGRA1_WSGRB1_WG64_4_1_WGM15
    SolutionIndex: 302
    SolutionNameMin: Cijk_Alik_Bljk_HHS_BH_MT128x128x32_MI32x32x8x1_SE_1LDSB1_AF0EM1_EPS1_GRVW2_GSU1_GSUAMB_LBSPP128_LPA8_LPB8_LRVW8_PGR1_PLR5_SU0_SUS0_SRVW4_TT2_64_VAW2_WSGRA1_WSGRB1_WG64_4_1_WGM15
    SolutionIndex: 303
    SolutionNameMin: Cijk_Alik_Bljk_HHS_BH_MT128x128x32_MI32x32x8x1_SE_1LDSB1_AF0EM1_EPS0_GRVW2_GSU1_GSUAMB_LBSPP128_LPA8_LPB8_LRVW8_PGR2_PLR5_SU32_SUS128_SRVW4_TT2_64_VAW2_WSGRA1_WSGRB1_WG64_4_1_WGM15
    SolutionIndex: 304
    SolutionNameMin: Cijk_Alik_Bljk_HHS_BH_MT64x32x64_MI16x16x16x1_SE_1LDSB0_AF0EM1_EPS0_GRVW8_GSU15_GSUAMB_LBSPP128_LPA16_LPB16_LRVW8_PGR2_PLR5_SU32_SUS128_SRVW4_TT2_16_VAW1_WSGRA1_WSGRB1_WG32_8_1_WGM15
    SolutionIndex: 305
    SolutionNameMin: Cijk_Alik_Bljk_HHS_BH_MT32x32x32_MI16x16x16x1_SE_1LDSB1_AF0EM1_EPS0_GRVW4_GSU1_GSUAMB_LBSPP128_LPA16_LPB16_LRVW8_PGR2_PLR2_SU0_SUS0_SRVW4_TT1_16_VAW2_WSGRA1_WSGRB1_WG32_8_1_WGM1
    SolutionIndex: 306
    SolutionNameMin: Cijk_Alik_Bljk_HHS_BH_MT16x16x32_MI16x16x16x1_SE_1LDSB1_AF0EM1_EPS0_GRVW2_GSU1_GSUAMB_LBSPP128_LPA16_LPB16_LRVW8_PGR2_PLR2_SU32_SUS256_SRVW0_TT1_16_VAW2_WSGRA1_WSGRB1_WG16_4_1_WGM2
    SolutionIndex: 307
    SolutionNameMin: Cijk_Alik_Bljk_HHS_BH_MT32x32x32_MI16x16x16x1_SE_1LDSB1_AF0EM8_EPS0_GRVW2_GSU1_GSUAMB_LBSPP128_LPA16_LPB16_LRVW8_PGR2_PLR2_SU0_SUS0_SRVW4_TT1_16_VAW2_WSGRA1_WSGRB1_WG32_8_1_WGM1
    SolutionIndex: 308
    SolutionNameMin: Cijk_Alik_Bljk_HHS_BH_MT32x32x32_MI16x16x16x1_SE_1LDSB0_AF0EM1_EPS1_GRVW2_GSU1_GSUAMB_LBSPP128_LPA16_LPB16_LRVW8_PGR1_PLR2_SU0_SUS0_SRVW4_TT1_16_VAW2_WSGRA1_WSGRB1_WG32_8_1_WGM1
    SolutionIndex: 309
    SolutionNameMin: Cijk_Alik_Bljk_HHS_BH_MT16x16x32_MI16x16x16x1_SE_1LDSB1_AF0EM1_EPS0_GRVW2_GSU1_GSUAMB_LBSPP128_LPA16_LPB16_LRVW8_PGR2_PLR2_SU0_SUS0_SRVW0_TT1_16_VAW2_WSGRA1_WSGRB1_WG16_4_1_WGM15
    SolutionIndex: 310
    SolutionNameMin: Cijk_Alik_Bljk_HHS_BH_MT128x96x64_MI32x32x8x1_SN_1LDSB0_AMAS3_GRVW8_GSUASB_LBSPP128_LPA8_LPB8_SU32_SUS128_TLDS1_VW2_WSGRA0_WSGRB1_WGM1
    SolutionIndex: 311
    SolutionNameMin: Cijk_Alik_Bljk_HHS_BH_MT128x96x64_MI32x32x8x1_SN_1LDSB0_GRVW8_GSUASB_LPA8_LPB8_SUS128
    SolutionIndex: 312
    SolutionNameMin: Cijk_Alik_Bljk_HHS_BH_MT128x160x32_MI32x32x8x1_SN_AMAS0_GRVW2_GSUAMB_LBSPP128_LPA4_LPB4_LRVW4_PLR1_TLDS1_VW1_WSGRA1_WSGRB0_WGM16
    SolutionIndex: 313
    SolutionNameMin: Cijk_Alik_Bljk_HHS_BH_MT32x64x64_MI16x16x16x1_SN_GRVW8_GSUASB_WSGRA0_WSGRB0
    SolutionIndex: 314
    SolutionNameMin: Cijk_Alik_Bljk_HHS_BH_MT32x64x64_MI16x16x16x1_SN_GRVW8_GSUASB_WSGRA0_WSGRB1
    SolutionIndex: 315
    SolutionNameMin: Cijk_Alik_Bljk_HHS_BH_MT32x64x64_MI16x16x16x1_SN_GRVW8_GSUAMB_WSGRA0_WSGRB1
    SolutionIndex: 316
    SolutionNameMin: Cijk_Alik_Bljk_HHS_BH_MT32x16x16_MI16x16x16x1_SN_1LDSB1_IU1_LBSPP128_LPA4_LPB4_PLR1_SIA2_SS0_SU2_SUS128_SVW4_TT2_16_TLDS1_WG16_4_1_WGM1
    SolutionIndex: 317
    SolutionNameMin: Cijk_Alik_Bljk_HHS_BH_MT64x32x64_MI16x16x16x1_SE_1LDSB0_AF0EM1_AF1EM1_AMAS3_EPS0_GRVW8_GSU15_GSUAMB_LBSPP128_LPA16_LPB16_LRVW8_LDW0_MAC_PGR2_PLR5_SIA3_SS0_SU32_SUS128_SRVW4_SVW4_TT2_16_VAW1_VW2_WSGRA1_WSGRB1_WG32_8_1_WGM1
    SolutionIndex: 318
    SolutionNameMin: Cijk_Alik_Bljk_HHS_BH_MT128x96x64_MI32x32x8x1_SE_1LDSB1_AF0EM8_AF1EM1_AMAS3_EPS0_GRVW8_GSU1_GSUAMB_LBSPP128_LPA8_LPB8_LRVW8_LDW0_MAC_PGR2_PLR9_SIA3_SS0_SU32_SUS128_SRVW4_SVW4_TT1_96_VAW2_VW2_WSGRA1_WSGRB1_WG128_2_1_WGM15
    SolutionIndex: 319
    SolutionNameMin: Cijk_Alik_Bljk_HHS_BH_MT128x96x64_MI32x32x8x1_SE_1LDSB1_AF0EM8_AF1EM1_AMAS3_EPS0_GRVW8_GSU1_GSUAMB_LBSPP128_LPA8_LPB8_LRVW8_LDW0_MAC_PGR2_PLR9_SIA3_SS0_SU0_SUS0_SRVW4_SVW4_TT1_96_VAW2_VW2_WSGRA1_WSGRB1_WG128_2_1_WGM2
    SolutionIndex: 320
    SolutionNameMin: Cijk_Alik_Bljk_HHS_BH_MT128x96x64_MI32x32x8x1_SE_1LDSB1_AF0EM8_AF1EM1_AMAS3_EPS0_GRVW8_GSU1_GSUAMB_LBSPP128_LPA8_LPB8_LRVW8_LDW0_MAC_PGR2_PLR9_SIA3_SS0_SU0_SUS0_SRVW4_SVW4_TT1_96_VAW2_VW2_WSGRA1_WSGRB1_WG128_2_1_WGM1
    SolutionIndex: 321
    SolutionNameMin: Cijk_Alik_Bljk_HHS_BH_MT128x96x64_MI32x32x8x1_SE_1LDSB1_AF0EM8_AF1EM1_AMAS3_EPS0_GRVW8_GSU1_GSUAMB_LBSPP128_LPA8_LPB8_LRVW8_LDW0_MAC_PGR2_PLR9_SIA3_SS0_SU32_SUS256_SRVW4_SVW4_TT1_96_VAW2_VW2_WSGRA1_WSGRB1_WG128_2_1_WGM15
    SolutionIndex: 322
    SolutionNameMin: Cijk_Alik_Bljk_HHS_BH_MT128x128x32_MI32x32x8x1_SE_1LDSB1_AF0EM8_AF1EM1_AMAS3_EPS0_GRVW2_GSU1_GSUAMB_LBSPP128_LPA8_LPB8_LRVW8_LDW0_MAC_PGR2_PLR5_SIA3_SS0_SU0_SUS0_SRVW4_SVW4_TT2_64_VAW2_VW2_WSGRA1_WSGRB1_WG64_4_1_WGM2
    SolutionIndex: 323
    SolutionNameMin: Cijk_Alik_Bljk_HHS_BH_MT128x48x128_MI16x16x16x1_SN_1LDSB1_AMAS0_GRVW8_LBSPP256_LPA16_LPB16_LRVW8_MIAV1_NEPBS0_PLR9_SVW1_TT2_48_VW1_WG64_4_1_WGM1
    SolutionIndex: 324
    SolutionNameMin: Cijk_Alik_Bljk_HHS_BH_MT64x16x128_MI16x16x16x1_SN_1LDSB0_AMAS0_GRVW8_LBSPP256_LPA16_LPB16_LRVW8_MIAV0_NEPBS0_PLR9_SVW1_TT1_16_VW1_WG64_4_1_WGM15
    SolutionIndex: 325
    SolutionNameMin: Cijk_Alik_Bljk_HHS_BH_MT64x64x64_MI32x32x8x1_SN_1LDSB1_AMAS0_GRVW8_LBSPP128_LPA8_LPB8_LRVW8_MIAV0_NEPBS16_PLR9_SVW1_TT1_32_VW1_WG64_4_1_WGM2
    SolutionIndex: 326
    SolutionNameMin: Cijk_Alik_Bljk_HHS_BH_MT64x128x64_MI32x32x8x1_SN_1LDSB0_AMAS0_GRVW8_LBSPP128_LPA8_LPB8_LRVW8_MIAV1_NEPBS0_PLR9_SVW1_TT2_32_VW1_WG32_8_1_WGM1
    SolutionIndex: 327
    SolutionNameMin: Cijk_Alik_Bljk_HHS_BH_MT64x32x128_MI16x16x16x1_SN_1LDSB0_AMAS0_GRVW8_LBSPP256_LPA16_LPB16_LRVW8_MIAV1_NEPBS0_PLR9_SVW1_TT1_32_VW1_WG64_4_1_WGM1
    SolutionIndex: 328
    SolutionNameMin: Cijk_Alik_Bljk_HHS_BH_MT64x16x128_MI16x16x16x1_SN_1LDSB1_AMAS0_GRVW8_LBSPP256_LPA16_LPB16_LRVW8_MIAV1_NEPBS0_PLR9_SVW1_TT1_16_VW1_WG64_4_1_WGM15
    SolutionIndex: 329
    SolutionNameMin: Cijk_Alik_Bljk_HHS_BH_MT128x96x64_MI16x16x16x1_SN_1LDSB1_AMAS3_GRVW8_LBSPP128_LPA16_LPB16_LRVW8_MIAV0_NEPBS0_PLR5_SVW2_TT2_96_VW2_WG64_4_1_WGM2
    SolutionIndex: 330
    SolutionNameMin: Cijk_Alik_Bljk_HHS_BH_MT64x64x128_MI32x32x8x1_SN_1LDSB1_AMAS0_GRVW8_LBSPP256_LPA8_LPB8_LRVW8_MIAV0_NEPBS0_PLR17_SVW1_TT1_32_VW1_WG64_4_1_WGM1
    SolutionIndex: 331
    SolutionNameMin: Cijk_Alik_Bljk_HHS_BH_MT128x32x128_MI32x32x8x1_SN_1LDSB1_AMAS0_GRVW8_LBSPP256_LPA8_LPB8_LRVW8_MIAV1_NEPBS0_PLR17_SVW1_TT1_32_VW1_WG128_2_1_WGM1
    SolutionIndex: 332
    SolutionNameMin: Cijk_Alik_Bljk_HHS_BH_MT64x64x32_MI32x32x8x1_SN_1LDSB0_AMAS0_GRVW4_LBSPP128_LPA8_LPB8_LRVW8_MIAV0_NEPBS16_PLR5_SVW1_TT1_32_VW1_WG64_4_1_WGM1
    SolutionIndex: 333
    SolutionNameMin: Cijk_Alik_Bljk_HHS_BH_MT256x128x32_MI32x32x8x1_SN_1LDSB1_AMAS3_GRVW4_LBSPP128_LPA4_LPB4_LRVW4_MIAV1_NEPBS16_PLR5_SVW4_TT4_64_VW4_WG64_4_1_WGM15
    SolutionIndex: 334
    SolutionNameMin: Cijk_Alik_Bljk_HHS_BH_MT32x128x128_MI32x32x8x1_SN_1LDSB1_AMAS0_GRVW8_LBSPP256_LPA8_LPB8_LRVW8_MIAV1_NEPBS16_PLR17_SS1_SVW1_TT1_32_VW1_WG32_8_1_WGM1
    SolutionIndex: 335
    SolutionNameMin: Cijk_Alik_Bljk_HHS_BH_MT128x80x64_MI16x16x16x1_SN_1LDSB0_AMAS0_GRVW4_LBSPP128_LPA4_LPB4_LRVW4_MIAV1_NEPBS0_PLR5_SS1_SVW1_TT2_80_VW1_WG64_4_1_WGM15
    SolutionIndex: 336
    SolutionNameMin: Cijk_Alik_Bljk_HHS_BH_MT64x32x128_MI16x16x16x1_SN_1LDSB0_AMAS3_GRVW8_LBSPP256_LPA16_LPB16_LRVW8_MIAV0_NEPBS16_PLR9_SS0_SVW4_TT2_16_VW4_WG32_8_1_WGM1
    SolutionIndex: 337
    SolutionNameMin: Cijk_Alik_Bljk_HHS_BH_MT16x16x128_MI16x16x16x1_SN_1LDSB0_AMAS3_GRVW8_LBSPP256_LPA16_LPB16_LRVW8_MIAV1_NEPBS16_PLR9_SS0_SVW4_TT1_16_VW4_WG16_4_1_WGM1
    SolutionIndex: 338
    SolutionNameMin: Cijk_Alik_Bljk_HHS_BH_MT64x64x64_MI32x32x8x1_SN_1LDSB1_AMAS0_GRVW8_LBSPP128_LPA8_LPB8_LRVW8_MIAV1_NEPBS0_PLR9_SS1_SVW1_TT1_32_VW1_WG64_4_1_WGM1
    SolutionIndex: 339
    SolutionNameMin: Cijk_Alik_Bljk_HHS_BH_MT128x64x64_MI32x32x8x1_SN_1LDSB1_AMAS0_GRVW8_LBSPP128_LPA8_LPB8_LRVW8_MIAV0_NEPBS0_PLR9_SS1_SVW1_TT2_32_VW1_WG64_4_1_WGM1
    SolutionIndex: 340
    SolutionNameMin: Cijk_Alik_Bljk_HHS_BH_MT64x128x128_MI32x32x8x1_SN_1LDSB1_AMAS0_GRVW8_LBSPP256_LPA8_LPB8_LRVW8_MIAV1_NEPBS0_PLR17_SS1_SVW1_TT2_32_VW1_WG32_8_1_WGM2
    SolutionIndex: 341
    SolutionNameMin: Cijk_Alik_Bljk_HHS_BH_MT96x128x64_MI32x32x8x1_SN_1LDSB1_AMAS0_GRVW8_LBSPP128_LPA8_LPB8_LRVW8_MIAV1_NEPBS0_PLR9_SVW1_TT3_32_VW1_WG32_8_1_WGM1
    SolutionIndex: 342
    SolutionNameMin: Cijk_Alik_Bljk_HHS_BH_MT128x96x64_MI32x32x8x1_SN_1LDSB1_AMAS0_GRVW8_LPA8_LPB8_LRVW8_MIAV1_NTC0_NTD0_PLR9_SU32_SUS256_SVW1_TT1_96_VW1_WG128_2_1_WGM15
    SolutionIndex: 343
    SolutionNameMin: Cijk_Alik_Bljk_HHS_BH_MT96x128x64_MI32x32x8x1_SN_1LDSB1_AMAS0_GRVW8_LPA8_LPB8_LRVW8_MIAV1_NTC0_NTD3_PLR9_SU32_SUS256_SVW1_TT3_32_VW1_WG32_8_1_WGM15
    SolutionIndex: 344
    SolutionNameMin: Cijk_Alik_Bljk_HHS_BH_MT192x256x32_MI32x32x8x1_SN_1LDSB1_AMAS3_LPA8_LPB8_MIAV0_NTC3_NTD0_NEPBS0_PLR5_SU0_SUS0_SPO0_SSO0_SVW2_TT6_64_VW2_WG32_8_1_WGM8
    SolutionIndex: 345
    SolutionNameMin: Cijk_Alik_Bljk_HHS_BH_MT128x256x64_MI32x32x8x1_SN_1LDSB1_AMAS0_LPA8_LPB8_MIAV0_NTC3_NTD3_NEPBS8_PLR9_SU32_SUS256_SPO1_SSO4_SVW1_TT4_64_VW1_WG32_8_1_WGM15
    SolutionIndex: 346
    SolutionNameMin: Cijk_Alik_Bljk_HHS_BH_MT192x256x32_MI32x32x8x1_SN_1LDSB0_AMAS3_LPA8_LPB8_MIAV0_NTC0_NTD3_NEPBS0_PLR5_SU0_SUS0_SPO1_SSO4_SVW2_TT6_64_VW2_WG32_8_1_WGM15
    SolutionIndex: 347
    SolutionNameMin: Cijk_Alik_Bljk_HHS_BH_MT128x256x32_MI32x32x8x1_SN_1LDSB1_AMAS3_LPA8_LPB8_MIAV0_NTC0_NTD3_NEPBS8_PLR5_SU0_SUS0_SPO1_SSO0_SVW4_TT4_64_VW4_WG32_8_1_WGM8
    SolutionIndex: 348
    SolutionNameMin: Cijk_Alik_Bljk_HHS_BH_MT128x96x64_MI32x32x8x1_SN_1LDSB1_AMAS0_LPA8_LPB8_MIAV1_NEPBS0_PLR9_SU0_SUS0_SSO4_SVW1_TT1_96_VW1_WG128_2_1_WGM15
    SolutionIndex: 349
    SolutionNameMin: Cijk_Alik_Bljk_HHS_BH_MT128x96x64_MI32x32x8x1_SN_1LDSB1_AMAS0_LPA8_LPB8_MIAV1_NEPBS8_PLR9_SU32_SUS256_SSO4_SVW1_TT1_96_VW1_WG128_2_1_WGM15
    SolutionIndex: 350
    SolutionNameMin: Cijk_Alik_Bljk_HHS_BH_MT128x96x64_MI32x32x8x1_SN_1LDSB1_AMAS0_LPA8_LPB8_MIAV1_NEPBS8_PLR9_SU0_SUS0_SSO4_SVW1_TT1_96_VW1_WG128_2_1_WGM15
    SolutionIndex: 351
    SolutionNameMin: Cijk_Alik_Bljk_HHS_BH_MT128x96x64_MI32x32x8x1_SN_1LDSB1_AMAS0_LPA8_LPB8_MIAV1_NEPBS0_PLR9_SU0_SUS0_SSO4_SVW1_TT1_96_VW1_WG128_2_1_WGM4
    SolutionIndex: 352
    SolutionNameMin: Cijk_Alik_Bljk_HHS_BH_MT128x96x64_MI32x32x8x1_SN_1LDSB1_AMAS0_LPA8_LPB8_MIAV0_NEPBS8_PLR9_SU0_SUS0_SSO4_SVW1_TT1_96_VW1_WG128_2_1_WGM15
    SolutionIndex: 353
    SolutionNameMin: Cijk_Alik_Bljk_HHS_BH_MT96x128x64_MI32x32x8x1_SN_1LDSB1_AMAS0_LPA8_LPB8_MIAV1_NEPBS0_PLR9_SU0_SUS0_SSO4_SVW1_TT3_32_VW1_WG32_8_1_WGM4
    SolutionIndex: 354
    SolutionNameMin: Cijk_Alik_Bljk_HHS_BH_MT96x128x64_MI32x32x8x1_SN_1LDSB1_AMAS0_LPA8_LPB8_MIAV0_NEPBS8_PLR9_SU0_SUS0_SSO4_SVW1_TT3_32_VW1_WG32_8_1_WGM4
    SolutionIndex: 355
    SolutionNameMin: Cijk_Alik_Bljk_HHS_BH_MT128x96x64_MI32x32x8x1_SN_1LDSB1_AMAS0_LPA8_LPB8_MIAV1_NEPBS8_PLR9_SU0_SUS0_SSO4_SVW1_TT1_96_VW1_WG128_2_1_WGM4
    SolutionIndex: 356
    SolutionNameMin: Cijk_Alik_Bljk_HHS_BH_MT128x96x64_MI32x32x8x1_SN_1LDSB1_AMAS0_LPA8_LPB8_MIAV1_NEPBS8_PLR9_SU0_SUS0_SSO4_SVW1_TT1_96_VW1_WG128_2_1_WGM8
    SolutionIndex: 357
    SolutionNameMin: Cijk_Alik_Bljk_HHS_BH_MT128x96x64_MI32x32x8x1_SN_1LDSB1_AMAS0_LPA8_LPB8_MIAV0_NEPBS8_PLR9_SU0_SUS0_SSO4_SVW1_TT1_96_VW1_WG128_2_1_WGM4
    SolutionIndex: 358
    SolutionNameMin: Cijk_Alik_Bljk_HHS_BH_MT96x128x64_MI32x32x8x1_SN_1LDSB1_AMAS0_LPA8_LPB8_MIAV1_NEPBS0_PLR9_SU0_SUS0_SSO4_SVW1_TT3_32_VW1_WG32_8_1_WGM15
    SolutionIndex: 359
    SolutionNameMin: Cijk_Alik_Bljk_HHS_BH_MT96x128x64_MI32x32x8x1_SN_1LDSB1_AMAS0_LPA8_LPB8_MIAV1_NEPBS0_PLR9_SU32_SUS256_SSO4_SVW1_TT3_32_VW1_WG32_8_1_WGM15
    SolutionIndex: 360
    SolutionNameMin: Cijk_Alik_Bljk_HHS_BH_MT96x96x64_MI16x16x16x1_SN_1LDSB1_AMAS0_LPA16_LPB16_MIAV1_NEPBS0_PLR5_SU0_SUS0_SSO4_SVW1_TT3_48_VW1_WG32_8_1_WGM4
    SolutionIndex: 361
    SolutionNameMin: Cijk_Alik_Bljk_HHS_BH_MT96x96x64_MI16x16x16x1_SN_1LDSB1_AMAS0_LPA16_LPB16_MIAV1_NEPBS0_PLR5_SU0_SUS0_SSO0_SVW1_TT3_48_VW1_WG32_8_1_WGM15
    SolutionIndex: 362
    SolutionNameMin: Cijk_Alik_Bljk_HHS_BH_MT96x96x64_MI16x16x16x1_SN_1LDSB1_AMAS0_LPA16_LPB16_MIAV1_NEPBS0_PLR5_SU32_SUS256_SSO4_SVW1_TT3_48_VW1_WG32_8_1_WGM8
    SolutionIndex: 363
    SolutionNameMin: Cijk_Alik_Bljk_HHS_BH_MT96x96x64_MI16x16x16x1_SN_1LDSB1_AMAS0_LPA16_LPB16_MIAV1_NEPBS8_PLR5_SU32_SUS256_SSO0_SVW1_TT3_48_VW1_WG32_8_1_WGM4
    SolutionIndex: 364
    SolutionNameMin: Cijk_Alik_Bljk_HHS_BH_MT128x256x64_MI32x32x8x1_SN_AMAS0_GRVW8_LPA8_LPB8_LRVW8_MIAV0_NTC0_NTD3_NEPBS0_PLR9_SU0_SUS0_SSO4_SVW1_TT2_128_VW1_WG64_4_1_WGM12
    SolutionIndex: 365
    SolutionNameMin: Cijk_Alik_Bljk_HHS_BH_MT128x128x64_MI16x16x16x1_SN_AMAS3_GRVW8_LPA16_LPB16_LRVW8_MIAV1_NTC3_NTD3_NEPBS8_PLR5_SU0_SUS0_SSO4_SVW2_TT4_64_VW2_WG32_8_1_WGM12
    SolutionIndex: 366
    SolutionNameMin: Cijk_Alik_Bljk_HHS_BH_MT144x256x64_MI16x16x16x1_SN_AMAS0_GRVW4_LPA4_LPB4_LRVW4_MIAV0_NTC0_NTD0_NEPBS0_PLR5_SU0_SUS0_SSO0_SVW1_TT9_64_VW1_WG16_16_1_WGM8
    SolutionIndex: 367
    SolutionNameMin: Cijk_Alik_Bljk_HHS_BH_MT128x128x64_MI16x16x16x1_SN_AMAS3_GRVW8_LPA16_LPB16_LRVW8_MIAV1_NTC3_NTD3_NEPBS0_PLR5_SU32_SUS256_SSO0_SVW2_TT4_64_VW2_WG32_8_1_WGM15
    SolutionIndex: 368
    SolutionNameMin: Cijk_Alik_Bljk_HHS_BH_MT128x256x64_MI32x32x8x1_SN_AMAS0_GRVW8_LPA8_LPB8_LRVW8_MIAV0_NTC3_NTD0_NEPBS0_PLR9_SU0_SUS0_SSO4_SVW1_TT2_128_VW1_WG64_4_1_WGM12
    SolutionIndex: 369
    SolutionNameMin: Cijk_Alik_Bljk_HHS_BH_MT128x160x64_MI16x16x16x1_SN_AMAS3_GRVW8_LPA16_LPB16_LRVW8_MIAV1_NTC0_NTD0_NEPBS0_PLR5_SU0_SUS0_SSO0_SVW2_TT2_160_VW2_WG64_4_1_WGM8
    SolutionIndex: 370
    SolutionNameMin: Cijk_Alik_Bljk_HHS_BH_MT256x256x32_MI32x32x8x1_SN_AMAS3_GRVW8_LPA8_LPB8_LRVW8_MIAV0_NTC0_NTD3_NEPBS0_PLR5_SU32_SUS256_SSO4_SVW2_TT4_128_VW2_WG64_4_1_WGM12
    SolutionIndex: 371
    SolutionNameMin: Cijk_Alik_Bljk_HHS_BH_MT160x256x64_MI32x32x8x1_SN_AMAS0_GRVW8_LPA8_LPB8_LRVW8_MIAV0_NTC3_NTD3_NEPBS0_PLR9_SU0_SUS0_SSO0_SVW1_TT5_64_VW1_WG32_8_1_WGM12
    SolutionIndex: 372
    SolutionNameMin: Cijk_Alik_Bljk_HHS_BH_MT160x256x64_MI32x32x8x1_SN_AMAS0_GRVW8_LPA8_LPB8_LRVW8_MIAV0_NTC0_NTD3_NEPBS0_PLR9_SU0_SUS0_SSO0_SVW1_TT5_64_VW1_WG32_8_1_WGM15
    SolutionIndex: 373
    SolutionNameMin: Cijk_Alik_Bljk_HHS_BH_MT128x64x64_MI32x32x8x1_SN_AMAS0_GRVW8_LPA8_LPB8_LRVW8_MIAV0_NTC3_NTD3_NEPBS0_PLR9_SU32_SUS256_SSO0_SVW1_TT1_64_VW1_WG128_2_1_WGM12
    SolutionIndex: 374
    SolutionNameMin: Cijk_Alik_Bljk_HHS_BH_MT128x96x64_MI32x32x8x1_SN_AMAS0_LPA8_LPB8_MIAV1_NEPBS8_PLR9_SS1_SU32_SUS256_SPO1_SSO4_SVW1_TT1_96_VW1_WG128_2_1_WGM15
    SolutionIndex: 375
    SolutionNameMin: Cijk_Alik_Bljk_HHS_BH_MT128x96x64_MI32x32x8x1_SN_AMAS0_LPA8_LPB8_MIAV1_NEPBS8_PLR9_SS1_SU0_SUS0_SPO1_SSO4_SVW1_TT1_96_VW1_WG128_2_1_WGM2
    SolutionIndex: 376
    SolutionNameMin: Cijk_Alik_Bljk_HHS_BH_MT128x96x64_MI32x32x8x1_SN_AMAS0_LPA8_LPB8_MIAV1_NEPBS0_PLR9_SS1_SU0_SUS0_SPO1_SSO4_SVW1_TT1_96_VW1_WG128_2_1_WGM2
    SolutionIndex: 377
    SolutionNameMin: Cijk_Alik_Bljk_HHS_BH_MT128x64x64_MI16x16x16x1_SN_AMAS3_LPA16_LPB16_MIAV1_NEPBS0_PLR5_SS1_SU0_SUS0_SPO1_SSO4_SVW2_TT2_64_VW2_WG64_4_1_WGM8
    SolutionIndex: 378
    SolutionNameMin: Cijk_Alik_Bljk_HHS_BH_MT128x32x128_MI32x32x8x1_SN_1LDSB1_AF0EM1_AF1EM1_AMAS0_EPS0_GRVW8_GSU1_GSUASB_LBSPP256_LPA8_LPB8_LRVW8_LDW0_FMA_MIAV1_NTC0_NTD0_NEPBS0_PGR2_PLR17_SIA3_SS1_SU0_SUS0_SPO0_SRVW0_SSO0_SVW1_TT1_32_VAW1_VW1_WSGRA1_WSGRB1_WG128_2_1_WGM1
    SolutionIndex: 379
    SolutionNameMin: Cijk_Alik_Bljk_HHS_BH_MT128x96x64_MI32x32x8x1_SN_1LDSB1_AF0EM1_AF1EM1_AMAS0_EPS1_GRVW8_GSU1_GSUASB_LBSPP128_LPA8_LPB8_LRVW8_LDW0_FMA_MIAV0_NTC3_NTD3_NEPBS8_PGR2_PLR9_SIA3_SS1_SU0_SUS0_SPO1_SRVW0_SSO4_SVW1_TT1_96_VAW1_VW1_WSGRA0_WSGRB1_WG128_2_1_WGM15
    SolutionIndex: 380
    SolutionNameMin: Cijk_Alik_Bljk_HHS_BH_MT128x64x64_MI32x32x8x1_SE_1LDSB1_AF0EM8_AF1EM1_AMAS3_EPS0_GRVW8_GSU1_GSUAMB_LBSPP128_LPA8_LPB8_LRVW8_LDW0_MAC_MIAV0_NTC0_NTD0_NEPBS0_PGR2_PLR9_SIA3_SS0_SU0_SUS0_SPO0_SRVW4_SSO0_SVW4_TT2_32_VAW2_VW2_WSGRA1_WSGRB1_WG64_4_1_WGM15
    SolutionIndex: 381
    SolutionNameMin: Cijk_Alik_Bljk_HHS_BH_MT16x16x128_MI16x16x16x1_SE_1LDSB1_AF0EM8_AF1EM1_AMAS3_EPS1_GRVW8_GSU1_GSUAMB_LBSPP256_LPA16_LPB16_LRVW8_LDW0_MAC_MIAV0_NTC0_NTD0_NEPBS0_PGR1_PLR9_SIA3_SS0_SU0_SUS0_SPO0_SRVW0_SSO0_SVW4_TT1_16_VAW2_VW2_WSGRA1_WSGRB1_WG16_4_1_WGM2
    SolutionIndex: 382
    SolutionNameMin: Cijk_Alik_Bljk_HHS_BH_MT16x16x128_MI16x16x16x1_SE_1LDSB0_AF0EM8_AF1EM1_AMAS3_EPS0_GRVW8_GSU1_GSUAMB_LBSPP256_LPA16_LPB16_LRVW8_LDW0_MAC_MIAV0_NTC0_NTD0_NEPBS0_PGR2_PLR9_SIA3_SS0_SU32_SUS256_SPO0_SRVW0_SSO0_SVW4_TT1_16_VAW2_VW2_WSGRA1_WSGRB1_WG16_4_1_WGM1
    SolutionIndex: 383
    SolutionNameMin: Cijk_Alik_Bljk_HHS_BH_MT64x32x64_MI16x16x16x1_SE_1LDSB0_AF0EM8_AF1EM1_AMAS3_EPS0_GRVW8_GSU1_GSUAMB_LBSPP128_LPA16_LPB16_LRVW8_LDW0_MAC_MIAV0_NTC0_NTD0_NEPBS0_PGR2_PLR5_SIA3_SS0_SU32_SUS128_SPO0_SRVW4_SSO0_SVW4_TT2_16_VAW2_VW2_WSGRA1_WSGRB1_WG32_8_1_WGM1
- - - [2368, 1024, 1, 1]
    - [1, 0.142]
  - - [448, 1, 1, 256]
    - [2, 0.013]
  - - [5056, 1408, 1, 3328]
    - [3, 84.149]
  - - [5056, 1856, 1, 3328]
    - [4, 82.925]
  - - [5888, 128, 1, 1]
    - [5, 0.06]
  - - [448, 3584, 1, 3328]
    - [6, 69.841]
  - - [704, 64, 1, 3328]
    - [7, 8.322]
  - - [5056, 4288, 1, 32]
    - [8, 11.344]
  - - [3584, 1024, 1, 256]
    - [9, 30.771]
  - - [32, 5056, 1, 1280]
    - [10, 12.891]
  - - [1856, 256, 1, 1]
    - [11, 0.04]
  - - [256, 1856, 1, 32]
    - [12, 1.404]
  - - [1408, 3584, 1, 3328]
    - [13, 83.133]
  - - [128, 3584, 1, 1280]
    - [14, 24.594]
  - - [1024, 2368, 1, 3328]
    - [15, 76.403]
  - - [4288, 64, 1, 3328]
    - [16, 27.007]
  - - [1, 4288, 1, 1280]
    - [17, 0.394]
  - - [2368, 64, 1, 1]
    - [11, 0.015]
  - - [256, 128, 1, 256]
    - [2, 0.909]
  - - [448, 64, 1, 1]
    - [18, 0.003]
  - - [32, 1408, 1, 32]
    - [18, 0.185]
  - - [448, 3584, 1, 32]
    - [8, 4.225]
  - - [64, 1024, 1, 1280]
    - [19, 6.563]
  - - [1, 1408, 1, 3328]
    - [0, 0.268]
  - - [1408, 128, 1, 32]
    - [12, 0.619]
  - - [4288, 6784, 1, 3328]
    - [20, 90.464]
  - - [1024, 1, 1, 3328]
    - [21, 0.198]
  - - [2944, 128, 1, 32]
    - [11, 1.132]
  - - [64, 6784, 1, 1]
    - [11, 0.036]
  - - [1024, 64, 1, 1280]
    - [22, 6.609]
  - - [448, 128, 1, 256]
    - [23, 1.606]
  - - [64, 5056, 1, 3328]
    - [24, 29.306]
  - - [5888, 4288, 1, 3328]
    - [20, 90.641]
  - - [1, 2368, 1, 1280]
    - [25, 0.242]
  - - [704, 1024, 1, 1]
    - [5, 0.058]
  - - [2368, 1408, 1, 32]
    - [5, 6.428]
  - - [256, 1856, 1, 1280]
    - [26, 26.558]
  - - [1024, 2944, 1, 1]
    - [27, 0.144]
  - - [2944, 3584, 1, 3328]
    - [20, 87.662]
  - - [2368, 2944, 1, 1280]
    - [28, 72.017]
  - - [256, 1408, 1, 1]
    - [11, 0.034]
  - - [1, 1024, 1, 3328]
    - [29, 0.195]
  - - [6784, 5888, 1, 3328]
    - [20, 90.737]
  - - [3584, 1408, 1, 32]
    - [30, 7.079]
  - - [5056, 256, 1, 256]
    - [31, 21.091]
  - - [1856, 2368, 1, 256]
    - [32, 34.921]
  - - [2368, 1024, 1, 3328]
    - [9, 76.725]
  - - [3584, 4288, 1, 32]
    - [30, 9.143]
  - - [1024, 1024, 1, 1280]
    - [33, 41.203]
  - - [3584, 3584, 1, 1]
    - [34, 0.227]
  - - [32, 2944, 1, 3328]
    - [17, 16.129]
  - - [704, 1408, 1, 3328]
    - [35, 55.973]
  - - [1408, 704, 1, 256]
    - [33, 16.061]
  - - [704, 64, 1, 32]
    - [11, 0.179]
  - - [5888, 1, 1, 3328]
    - [7, 0.783]
  - - [2368, 32, 1, 256]
    - [36, 2.005]
  - - [6784, 128, 1, 3328]
    - [37, 61.431]
  - - [2944, 256, 1, 1]
    - [5, 0.06]
  - - [1408, 2368, 1, 1]
    - [38, 0.147]
  - - [32, 448, 1, 3328]
    - [21, 2.757]
  - - [5056, 1, 1, 3328]
    - [39, 0.738]
  - - [2944, 256, 1, 32]
    - [30, 2.174]
  - - [5056, 6784, 1, 1280]
    - [20, 84.209]
  - - [4288, 5056, 1, 1]
    - [40, 0.27]
  - - [5056, 4288, 1, 1]
    - [40, 0.271]
  - - [128, 4288, 1, 3328]
    - [6, 41.575]
  - - [5056, 128, 1, 256]
    - [41, 12.785]
  - - [1408, 4288, 1, 1280]
    - [42, 71.192]
  - - [1856, 704, 1, 1280]
    - [33, 51.343]
  - - [4288, 1024, 1, 3328]
    - [6, 79.727]
  - - [1, 5888, 1, 3328]
    - [17, 0.769]
  - - [1024, 128, 1, 32]
    - [43, 0.45]
  - - [32, 4288, 1, 1280]
    - [10, 11.308]
  - - [1024, 5056, 1, 1]
    - [38, 0.185]
  - - [704, 3584, 1, 1280]
    - [44, 61.987]
  - - [1856, 5056, 1, 256]
    - [45, 43.029]
  - - [1408, 1024, 1, 1280]
    - [42, 50.345]
  - - [5056, 5888, 1, 3328]
    - [20, 89.02]
  - - [448, 1, 1, 1]
    - [46, 0.0]
  - - [3584, 3584, 1, 1280]
    - [20, 77.312]
  - - [2368, 3584, 1, 32]
    - [8, 9.272]
  - - [2944, 2368, 1, 1]
    - [38, 0.186]
  - - [704, 4288, 1, 1]
    - [5, 0.16]
  - - [2368, 256, 1, 32]
    - [30, 1.748]
  - - [1024, 6784, 1, 1280]
    - [42, 72.753]
  - - [1024, 3584, 1, 1]
    - [38, 0.158]
  - - [32, 5056, 1, 32]
    - [12, 0.545]
  - - [5888, 32, 1, 32]
    - [11, 0.629]
  - - [64, 128, 1, 3328]
    - [0, 1.583]
  - - [256, 5056, 1, 32]
    - [30, 3.31]
  - - [5056, 64, 1, 32]
    - [12, 1.042]
  - - [2368, 5056, 1, 32]
    - [5, 10.157]
  - - [6784, 1856, 1, 32]
    - [30, 8.866]
  - - [64, 128, 1, 1]
    - [12, 0.001]
  - - [64, 2368, 1, 1280]
    - [10, 12.21]
  - - [128, 704, 1, 32]
    - [47, 0.325]
  - - [64, 6784, 1, 3328]
    - [24, 35.085]
  - - [2944, 256, 1, 1280]
    - [6, 40.106]
  - - [5056, 704, 1, 1]
    - [8, 0.164]
  - - [2944, 4288, 1, 256]
    - [45, 45.118]
  - - [1024, 1024, 1, 3328]
    - [9, 58.16]
  - - [5056, 704, 1, 32]
    - [5, 6.649]
  - - [1856, 4288, 1, 3328]
    - [44, 82.569]
  - - [1, 1856, 1, 256]
    - [23, 0.049]
  - - [6784, 4288, 1, 32]
    - [48, 9.756]
  - - [5888, 64, 1, 256]
    - [26, 8.051]
  - - [256, 128, 1, 1]
    - [18, 0.003]
  - - [5888, 5056, 1, 256]
    - [45, 48.075]
  - - [2944, 448, 1, 256]
    - [49, 20.452]
  - - [3584, 2368, 1, 3328]
    - [20, 81.448]
  - - [4288, 1856, 1, 1]
    - [40, 0.222]
  - - [1856, 2944, 1, 1]
    - [50, 0.19]
  - - [32, 4288, 1, 3328]
    - [10, 17.381]
  - - [1, 3584, 1, 3328]
    - [17, 0.614]
  - - [256, 32, 1, 3328]
    - [0, 1.617]
  - - [1856, 2368, 1, 32]
    - [5, 7.336]
  - - [4288, 1856, 1, 32]
    - [5, 9.226]
  - - [5056, 64, 1, 3328]
    - [16, 30.032]
  - - [6784, 1, 1, 1280]
    - [10, 0.535]
  - - [1024, 448, 1, 32]
    - [12, 1.378]
  - - [1408, 64, 1, 1]
    - [18, 0.009]
  - - [1, 1, 1, 3328]
    - [0, 0.0]
  - - [5056, 2368, 1, 256]
    - [42, 44.385]
  - - [1408, 5888, 1, 256]
    - [42, 40.39]
  - - [5056, 6784, 1, 1]
    - [5, 0.287]
  - - [32, 448, 1, 1280]
    - [0, 1.487]
  - - [32, 448, 1, 32]
    - [12, 0.059]
  - - [1856, 64, 1, 256]
    - [51, 2.855]
  - - [1024, 1408, 1, 3328]
    - [52, 64.665]
  - - [256, 5056, 1, 1280]
    - [9, 50.043]
  - - [704, 2368, 1, 1]
    - [40, 0.109]
  - - [64, 1024, 1, 32]
    - [43, 0.246]
  - - [1024, 256, 1, 256]
    - [51, 5.685]
  - - [128, 1, 1, 1]
    - [18, 0.0]
  - - [3584, 4288, 1, 1280]
    - [20, 79.096]
  - - [1856, 128, 1, 32]
    - [5, 0.793]
  - - [1856, 128, 1, 1280]
    - [24, 17.045]
  - - [128, 2944, 1, 3328]
    - [16, 37.379]
  - - [1, 6784, 1, 3328]
    - [17, 0.826]
  - - [3584, 2368, 1, 1]
    - [38, 0.197]
  - - [4288, 448, 1, 3328]
    - [53, 64.542]
  - - [4288, 32, 1, 3328]
    - [54, 17.559]
  - - [256, 1856, 1, 1]
    - [55, 0.039]
  - - [704, 6784, 1, 1280]
    - [13, 69.36]
  - - [2368, 4288, 1, 32]
    - [5, 9.736]
  - - [704, 5056, 1, 1280]
    - [44, 68.994]
  - - [256, 3584, 1, 3328]
    - [15, 51.269]
  - - [1024, 32, 1, 3328]
    - [21, 5.993]
  - - [3584, 6784, 1, 32]
    - [56, 9.591]
  - - [3584, 6784, 1, 1280]
    - [20, 81.905]
  - - [4288, 4288, 1, 3328]
    - [20, 89.349]
  - - [3584, 64, 1, 1280]
    - [51, 16.058]
  - - [64, 1856, 1, 256]
    - [10, 2.903]
  - - [3584, 64, 1, 32]
    - [46, 0.745]
  - - [448, 1, 1, 1280]
    - [19, 0.046]
  - - [256, 4288, 1, 1280]
    - [33, 42.215]
  - - [1408, 3584, 1, 1]
    - [48, 0.188]
  - - [4288, 1856, 1, 3328]
    - [4, 84.295]
  - - [1856, 2944, 1, 1280]
    - [42, 66.778]
  - - [4288, 256, 1, 256]
    - [33, 18.624]
  - - [128, 5888, 1, 32]
    - [57, 2.123]
  - - [128, 5888, 1, 1280]
    - [6, 38.542]
  - - [1408, 128, 1, 3328]
    - [58, 22.525]
  - - [3584, 256, 1, 256]
    - [33, 15.386]
  - - [32, 6784, 1, 3328]
    - [17, 21.706]
  - - [64, 64, 1, 1280]
    - [21, 0.419]
  - - [32, 3584, 1, 256]
    - [59, 2.668]
  - - [704, 256, 1, 32]
    - [5, 0.591]
  - - [448, 128, 1, 3328]
    - [7, 10.488]
  - - [64, 2944, 1, 3328]
    - [58, 20.778]
  - - [64, 4288, 1, 3328]
    - [60, 26.183]
  - - [5056, 1024, 1, 3328]
    - [9, 85.744]
  - - [128, 256, 1, 1280]
    - [0, 3.259]
  - - [1856, 256, 1, 256]
    - [26, 10.003]
  - - [3584, 704, 1, 1]
    - [1, 0.136]
  - - [256, 704, 1, 256]
    - [10, 4.126]
  - - [448, 5056, 1, 1]
    - [61, 0.132]
  - - [5888, 5888, 1, 256]
    - [45, 49.649]
  - - [3584, 704, 1, 32]
    - [30, 5.198]
  - - [448, 6784, 1, 3328]
    - [42, 72.815]
  - - [6784, 4288, 1, 1]
    - [38, 0.26]
  - - [3584, 6784, 1, 1]
    - [48, 0.25]
  - - [1408, 2368, 1, 32]
    - [30, 5.98]
  - - [448, 5056, 1, 32]
    - [61, 5.104]
  - - [4288, 4288, 1, 1280]
    - [20, 80.547]
  - - [6784, 1408, 1, 1]
    - [56, 0.204]
  - - [1856, 5888, 1, 3328]
    - [15, 82.945]
  - - [1024, 704, 1, 1]
    - [30, 0.056]
  - - [3584, 1856, 1, 3328]
    - [4, 79.761]
  - - [5056, 5888, 1, 1]
    - [62, 0.283]
  - - [2944, 1024, 1, 256]
    - [48, 28.508]
  - - [448, 1408, 1, 3328]
    - [63, 49.48]
  - - [5056, 32, 1, 3328]
    - [59, 18.109]
  - - [2368, 4288, 1, 3328]
    - [15, 85.383]
  - - [1024, 704, 1, 32]
    - [5, 2.096]
  - - [448, 2944, 1, 256]
    - [33, 21.371]
  - - [2944, 6784, 1, 256]
    - [45, 48.776]
  - - [2368, 2368, 1, 1280]
    - [28, 66.013]
  - - [5888, 128, 1, 3328]
    - [64, 56.068]
  - - [256, 256, 1, 32]
    - [65, 0.254]
  - - [1024, 1, 1, 256]
    - [2, 0.028]
  - - [3584, 3584, 1, 32]
    - [30, 9.027]
  - - [2944, 448, 1, 1]
    - [5, 0.088]
  - - [128, 32, 1, 32]
    - [12, 0.016]
  - - [5056, 64, 1, 1280]
    - [16, 21.505]
  - - [2944, 2944, 1, 1280]
    - [20, 70.856]
  - - [1, 2368, 1, 256]
    - [23, 0.062]
  - - [1408, 5056, 1, 1]
    - [66, 0.19]
  - - [2944, 32, 1, 1280]
    - [7, 9.057]
  - - [64, 1408, 1, 3328]
    - [17, 15.642]
  - - [256, 448, 1, 1280]
    - [10, 9.729]
  - - [2368, 6784, 1, 1]
    - [40, 0.26]
  - - [6784, 4288, 1, 1280]
    - [20, 82.337]
  - - [2944, 704, 1, 256]
    - [45, 25.546]
  - - [2368, 6784, 1, 1280]
    - [20, 78.134]
  - - [704, 2944, 1, 3328]
    - [13, 65.913]
  - - [5888, 256, 1, 1]
    - [1, 0.099]
  - - [704, 704, 1, 32]
    - [11, 1.502]
  - - [256, 4288, 1, 256]
    - [33, 17.888]
  - - [5056, 6784, 1, 32]
    - [5, 12.112]
  - - [5056, 128, 1, 1]
    - [5, 0.054]
  - - [448, 5056, 1, 1280]
    - [15, 58.54]
  - - [448, 448, 1, 256]
    - [26, 4.386]
  - - [256, 5888, 1, 3328]
    - [52, 67.043]
  - - [704, 448, 1, 1280]
    - [67, 22.629]
  - - [448, 64, 1, 256]
    - [7, 0.78]
  - - [1024, 704, 1, 1280]
    - [32, 38.792]
  - - [5888, 1024, 1, 1]
    - [68, 0.188]
  - - [5888, 448, 1, 32]
    - [1, 5.225]
  - - [6784, 2944, 1, 256]
    - [45, 45.573]
  - - [1024, 256, 1, 1]
    - [11, 0.024]
  - - [2368, 448, 1, 256]
    - [33, 18.322]
  - - [4288, 256, 1, 3328]
    - [9, 61.249]
  - - [4288, 2944, 1, 256]
    - [42, 45.856]
  - - [448, 5888, 1, 3328]
    - [6, 77.33]
  - - [128, 256, 1, 3328]
    - [29, 6.143]
  - - [128, 6784, 1, 32]
    - [30, 2.465]
  - - [1856, 64, 1, 32]
    - [47, 0.428]
  - - [1408, 4288, 1, 1]
    - [69, 0.181]
  - - [1408, 1856, 1, 3328]
    - [15, 82.132]
  - - [4288, 64, 1, 256]
    - [70, 5.907]
  - - [3584, 1024, 1, 3328]
    - [9, 79.588]
  - - [2944, 5888, 1, 3328]
    - [20, 89.451]
  - - [128, 6784, 1, 3328]
    - [71, 59.632]
  - - [448, 4288, 1, 3328]
    - [72, 65.067]
  - - [704, 2368, 1, 256]
    - [6, 25.173]
  - - [1, 64, 1, 3328]
    - [0, 0.012]
  - - [4288, 128, 1, 1]
    - [5, 0.046]
  - - [256, 2368, 1, 32]
    - [30, 1.763]
  - - [4288, 3584, 1, 3328]
    - [20, 86.821]
  - - [1408, 64, 1, 256]
    - [73, 2.26]
  - - [1408, 1024, 1, 1]
    - [1, 0.092]
  - - [64, 1024, 1, 1]
    - [11, 0.007]
  - - [1408, 1024, 1, 256]
    - [74, 21.326]
  - - [5056, 3584, 1, 1]
    - [62, 0.266]
  - - [448, 1024, 1, 256]
    - [26, 9.729]
  - - [6784, 6784, 1, 3328]
    - [20, 90.248]
  - - [6784, 32, 1, 32]
    - [75, 0.745]
  - - [64, 1024, 1, 3328]
    - [36, 11.537]
  - - [2368, 2944, 1, 3328]
    - [52, 83.246]
  - - [448, 448, 1, 1280]
    - [51, 15.478]
  - - [5056, 3584, 1, 32]
    - [5, 10.98]
  - - [5056, 3584, 1, 1280]
    - [20, 80.53]
  - - [1856, 1856, 1, 256]
    - [76, 32.575]
  - - [32, 5888, 1, 256]
    - [10, 4.347]
  - - [256, 1408, 1, 32]
    - [11, 1.101]
  - - [2944, 1, 1, 3328]
    - [77, 0.523]
  - - [32, 704, 1, 3328]
    - [0, 4.377]
  - - [5888, 4288, 1, 1]
    - [38, 0.254]
  - - [1024, 128, 1, 256]
    - [10, 3.231]
  - - [32, 1856, 1, 3328]
    - [78, 10.504]
  - - [5056, 704, 1, 256]
    - [42, 32.904]
  - - [2368, 5056, 1, 256]
    - [45, 45.199]
  - - [1024, 5056, 1, 256]
    - [15, 37.331]
  - - [32, 1024, 1, 3328]
    - [79, 5.993]
  - - [5888, 448, 1, 256]
    - [32, 28.71]
  - - [6784, 5056, 1, 1280]
    - [20, 82.716]
  - - [4288, 6784, 1, 1280]
    - [20, 83.071]
  - - [64, 1, 1, 256]
    - [80, 0.002]
  - - [1856, 64, 1, 1280]
    - [59, 9.733]
  - - [128, 1408, 1, 1]
    - [11, 0.017]
  - - [1024, 64, 1, 32]
    - [65, 0.249]
  - - [1024, 64, 1, 3328]
    - [7, 11.814]
  - - [704, 6784, 1, 3328]
    - [15, 79.659]
  - - [2944, 1856, 1, 1]
    - [81, 0.17]
  - - [5888, 4288, 1, 1280]
    - [20, 82.32]
  - - [5888, 3584, 1, 1280]
    - [20, 80.445]
  - - [32, 2368, 1, 1280]
    - [17, 7.434]
  - - [3584, 1408, 1, 1280]
    - [9, 71.416]
  - - [1024, 2944, 1, 256]
    - [32, 29.474]
  - - [1, 2944, 1, 1280]
    - [17, 0.287]
  - - [32, 1024, 1, 256]
    - [82, 0.9]
  - - [2944, 1856, 1, 1280]
    - [6, 64.43]
  - - [3584, 1, 1, 1280]
    - [36, 0.349]
  - - [256, 3584, 1, 32]
    - [12, 2.469]
  - - [1024, 2368, 1, 1]
    - [1, 0.129]
  - - [2944, 3584, 1, 1280]
    - [9, 76.617]
  - - [64, 1, 1, 1]
    - [83, 0.0]
  - - [1856, 4288, 1, 256]
    - [42, 41.359]
  - - [256, 1, 1, 256]
    - [2, 0.007]
  - - [256, 128, 1, 3328]
    - [0, 6.082]
  - - [1, 1856, 1, 3328]
    - [25, 0.346]
  - - [448, 3584, 1, 1]
    - [5, 0.114]
  - - [2368, 2944, 1, 32]
    - [5, 8.757]
  - - [128, 4288, 1, 32]
    - [30, 1.677]
  - - [448, 256, 1, 256]
    - [10, 2.827]
  - - [64, 64, 1, 1]
    - [84, 0.0]
  - - [1, 1408, 1, 1]
    - [85, 0.0]
  - - [2944, 32, 1, 32]
    - [47, 0.336]
  - - [448, 1856, 1, 1]
    - [50, 0.066]
  - - [4288, 704, 1, 256]
    - [48, 29.615]
  - - [1856, 1024, 1, 256]
    - [33, 23.73]
  - - [448, 1856, 1, 32]
    - [30, 2.417]
  - - [448, 1856, 1, 3328]
    - [71, 63.756]
  - - [448, 448, 1, 32]
    - [86, 0.683]
  - - [1024, 448, 1, 256]
    - [26, 9.729]
  - - [6784, 1, 1, 256]
    - [59, 0.163]
  - - [704, 6784, 1, 32]
    - [5, 7.552]
  - - [1024, 4288, 1, 1]
    - [38, 0.165]
  - - [704, 256, 1, 3328]
    - [87, 22.376]
  - - [704, 1856, 1, 32]
    - [8, 3.464]
  - - [1408, 5888, 1, 1280]
    - [13, 70.038]
  - - [32, 704, 1, 1280]
    - [0, 2.321]
  - - [5056, 1856, 1, 256]
    - [88, 41.768]
  - - [6784, 704, 1, 1280]
    - [9, 67.064]
  - - [704, 1408, 1, 32]
    - [5, 2.707]
  - - [5888, 1024, 1, 256]
    - [42, 36.38]
  - - [64, 2944, 1, 1]
    - [11, 0.018]
  - - [64, 2944, 1, 32]
    - [5, 0.635]
  - - [64, 2944, 1, 1280]
    - [51, 14.006]
  - - [6784, 1856, 1, 3328]
    - [4, 86.497]
  - - [2368, 5888, 1, 1280]
    - [15, 77.664]
  - - [5888, 6784, 1, 32]
    - [48, 10.192]
  - - [1, 6784, 1, 256]
    - [23, 0.16]
  - - [6784, 6784, 1, 32]
    - [48, 10.416]
  - - [256, 1, 1, 1280]
    - [0, 0.026]
  - - [5888, 128, 1, 32]
    - [30, 2.174]
  - - [6784, 256, 1, 256]
    - [89, 25.046]
  - - [2368, 3584, 1, 3328]
    - [4, 82.036]
  - - [128, 4288, 1, 1280]
    - [90, 28.888]
  - - [32, 3584, 1, 1280]
    - [10, 9.786]
  - - [5888, 1024, 1, 1280]
    - [9, 69.951]
  - - [1856, 704, 1, 3328]
    - [33, 62.331]
  - - [5888, 6784, 1, 3328]
    - [20, 91.051]
  - - [6784, 448, 1, 1]
    - [91, 0.139]
  - - [6784, 1856, 1, 1]
    - [38, 0.225]
  - - [128, 32, 1, 1280]
    - [0, 0.428]
  - - [2944, 2368, 1, 1280]
    - [4, 70.206]
  - - [128, 256, 1, 1]
    - [92, 0.003]
  - - [6784, 448, 1, 32]
    - [30, 5.707]
  - - [6784, 448, 1, 3328]
    - [93, 70.17]
  - - [1, 6784, 1, 1]
    - [12, 0.001]
  - - [448, 3584, 1, 1280]
    - [44, 55.395]
  - - [1408, 6784, 1, 1280]
    - [42, 73.232]
  - - [5056, 5888, 1, 1280]
    - [20, 82.719]
  - - [32, 2944, 1, 32]
    - [57, 0.343]
  - - [5888, 704, 1, 1]
    - [1, 0.159]
  - - [3584, 1856, 1, 1]
    - [38, 0.185]
  - - [1, 256, 1, 256]
    - [94, 0.007]
  - - [5056, 2944, 1, 32]
    - [5, 10.669]
  - - [32, 6784, 1, 256]
    - [10, 4.472]
  - - [4288, 6784, 1, 1]
    - [40, 0.28]
  - - [1, 4288, 1, 3328]
    - [17, 0.67]
  - - [1024, 6784, 1, 1]
    - [27, 0.2]
  - - [2368, 5888, 1, 32]
    - [62, 10.451]
  - - [448, 448, 1, 3328]
    - [58, 24.919]
  - - [1, 256, 1, 1]
    - [11, 0.0]
  - - [3584, 4288, 1, 1]
    - [38, 0.234]
  - - [5888, 1024, 1, 3328]
    - [9, 80.166]
  - - [6784, 5888, 1, 256]
    - [13, 47.884]
  - - [704, 128, 1, 1280]
    - [22, 8.84]
  - - [4288, 128, 1, 256]
    - [26, 11.472]
  - - [5056, 1024, 1, 1]
    - [95, 0.199]
  - - [32, 3584, 1, 3328]
    - [10, 15.637]
  - - [1024, 1, 1, 1280]
    - [21, 0.109]
  - - [4288, 2368, 1, 32]
    - [5, 9.841]
  - - [704, 3584, 1, 1]
    - [40, 0.145]
  - - [704, 1856, 1, 3328]
    - [96, 69.003]
  - - [2944, 128, 1, 1280]
    - [16, 26.127]
  - - [1, 2368, 1, 3328]
    - [17, 0.429]
  - - [6784, 704, 1, 32]
    - [30, 6.943]
  - - [4288, 1, 1, 1280]
    - [36, 0.399]
  - - [704, 5888, 1, 256]
    - [33, 33.118]
  - - [2368, 3584, 1, 1280]
    - [15, 72.164]
  - - [64, 448, 1, 256]
    - [23, 0.795]
  - - [1408, 448, 1, 1280]
    - [26, 34.07]
  - - [3584, 5056, 1, 32]
    - [97, 9.189]
  - - [1024, 32, 1, 1280]
    - [21, 3.352]
  - - [128, 2368, 1, 1]
    - [92, 0.028]
  - - [6784, 1856, 1, 1280]
    - [20, 75.281]
  - - [5056, 5056, 1, 3328]
    - [20, 88.024]
  - - [128, 704, 1, 1280]
    - [7, 8.84]
  - - [128, 2944, 1, 1280]
    - [16, 26.771]
  - - [2368, 5056, 1, 1]
    - [5, 0.247]
  - - [5888, 1408, 1, 256]
    - [42, 38.136]
  - - [2368, 1024, 1, 32]
    - [1, 5.43]
  - - [256, 256, 1, 3328]
    - [7, 11.701]
  - - [64, 4288, 1, 1]
    - [98, 0.026]
  - - [4288, 1024, 1, 256]
    - [42, 35.179]
  - - [3584, 32, 1, 32]
    - [47, 0.409]
  - - [3584, 64, 1, 1]
    - [5, 0.021]
  - - [704, 32, 1, 1280]
    - [0, 2.272]
  - - [32, 4288, 1, 32]
    - [99, 0.458]
  - - [64, 64, 1, 3328]
    - [0, 0.784]
  - - [64, 1408, 1, 1]
    - [11, 0.009]
  - - [4288, 5888, 1, 1280]
    - [20, 81.055]
  - - [1856, 2944, 1, 3328]
    - [42, 74.096]
  - - [256, 1024, 1, 256]
    - [26, 5.907]
  - - [5056, 5888, 1, 256]
    - [45, 50.095]
  - - [1408, 128, 1, 1280]
    - [58, 13.973]
  - - [5056, 256, 1, 3328]
    - [35, 71.056]
  - - [1024, 5888, 1, 1280]
    - [42, 71.27]
  - - [1024, 448, 1, 1]
    - [30, 0.038]
  - - [32, 32, 1, 32]
    - [75, 0.004]
  - - [5056, 1, 1, 1280]
    - [7, 0.442]
  - - [5888, 5056, 1, 1280]
    - [20, 82.197]
  - - [5888, 2944, 1, 1]
    - [100, 0.238]
  - - [64, 4288, 1, 1280]
    - [24, 18.581]
  - - [1408, 4288, 1, 3328]
    - [42, 82.199]
  - - [704, 2944, 1, 32]
    - [5, 4.916]
  - - [1, 5888, 1, 1280]
    - [10, 0.472]
  - - [2944, 4288, 1, 3328]
    - [20, 85.086]
  - - [256, 2944, 1, 256]
    - [33, 14.207]
  - - [704, 448, 1, 32]
    - [86, 1.024]
  - - [5056, 2944, 1, 256]
    - [42, 46.362]
  - - [704, 1024, 1, 256]
    - [31, 14.339]
  - - [2368, 1856, 1, 256]
    - [88, 34.825]
  - - [64, 3584, 1, 1]
    - [5, 0.022]
  - - [1024, 128, 1, 1280]
    - [10, 10.679]
  - - [2368, 4288, 1, 1280]
    - [20, 75.871]
  - - [3584, 448, 1, 256]
    - [42, 23.388]
  - - [256, 6784, 1, 256]
    - [89, 25.427]
  - - [1024, 32, 1, 32]
    - [11, 0.131]
  - - [1024, 1408, 1, 1]
    - [30, 0.093]
  - - [128, 64, 1, 32]
    - [101, 0.033]
  - - [64, 1, 1, 1280]
    - [80, 0.006]
  - - [2368, 32, 1, 32]
    - [11, 0.282]
  - - [256, 5888, 1, 1]
    - [1, 0.1]
  - - [2944, 2944, 1, 1]
    - [56, 0.204]
  - - [6784, 3584, 1, 256]
    - [15, 45.272]
  - - [1408, 1856, 1, 256]
    - [102, 30.515]
  - - [128, 1408, 1, 256]
    - [10, 4.296]
  - - [2944, 2944, 1, 32]
    - [1, 8.095]
  - - [2944, 2944, 1, 3328]
    - [52, 83.284]
  - - [1, 2944, 1, 256]
    - [25, 0.079]
  - - [448, 32, 1, 1280]
    - [0, 1.52]
  - - [3584, 1, 1, 256]
    - [2, 0.098]
  - - [704, 32, 1, 3328]
    - [0, 4.399]
  - - [256, 448, 1, 3328]
    - [10, 14.382]
  - - [128, 128, 1, 256]
    - [103, 0.459]
  - - [2368, 64, 1, 256]
    - [10, 3.768]
  - - [64, 448, 1, 1280]
    - [0, 2.954]
  - - [6784, 1408, 1, 32]
    - [30, 8.399]
  - - [1408, 448, 1, 3328]
    - [88, 49.171]
  - - [2368, 6784, 1, 3328]
    - [20, 84.231]
  - - [256, 2368, 1, 1]
    - [30, 0.05]
  - - [4288, 3584, 1, 32]
    - [5, 10.655]
  - - [5888, 64, 1, 3328]
    - [67, 32.859]
  - - [3584, 704, 1, 1280]
    - [4, 61.257]
  - - [448, 5056, 1, 3328]
    - [13, 71.55]
  - - [4288, 448, 1, 256]
    - [33, 24.195]
  - - [5056, 256, 1, 1280]
    - [35, 50.585]
  - - [704, 448, 1, 3328]
    - [24, 34.08]
  - - [2944, 5888, 1, 32]
    - [30, 9.218]
  - - [3584, 5056, 1, 256]
    - [45, 47.905]
  - - [6784, 1, 1, 3328]
    - [22, 0.837]
  - - [32, 2368, 1, 3328]
    - [19, 13.465]
  - - [4288, 256, 1, 1]
    - [5, 0.087]
  - - [64, 256, 1, 1]
    - [46, 0.002]
  - - [1856, 448, 1, 3328]
    - [32, 63.626]
  - - [3584, 2368, 1, 256]
    - [42, 39.481]
  - - [4288, 4288, 1, 256]
    - [45, 48.653]
  - - [4288, 256, 1, 1280]
    - [35, 43.974]
  - - [448, 5056, 1, 256]
    - [9, 27.45]
  - - [128, 1856, 1, 1]
    - [11, 0.022]
  - - [4288, 704, 1, 1280]
    - [6, 60.972]
  - - [128, 1856, 1, 32]
    - [86, 0.779]
  - - [2368, 704, 1, 1]
    - [1, 0.11]
  - - [3584, 32, 1, 256]
    - [59, 2.711]
  - - [448, 2368, 1, 1280]
    - [35, 42.497]
  - - [3584, 256, 1, 1]
    - [30, 0.067]
  - - [1408, 1856, 1, 1280]
    - [15, 65.655]
  - - [3584, 4288, 1, 3328]
    - [20, 87.453]
  - - [448, 4288, 1, 32]
    - [5, 4.776]
  - - [448, 4288, 1, 1280]
    - [104, 50.739]
  - - [64, 3584, 1, 256]
    - [24, 4.9]
  - - [1, 6784, 1, 1280]
    - [17, 0.532]
  - - [5056, 1024, 1, 256]
    - [45, 38.093]
  - - [2368, 448, 1, 32]
    - [5, 3.012]
  - - [4288, 3584, 1, 1280]
    - [20, 78.619]
  - - [32, 2944, 1, 1280]
    - [17, 9.242]
  - - [1408, 704, 1, 1]
    - [30, 0.075]
  - - [2368, 256, 1, 256]
    - [26, 12.489]
  - - [1, 5056, 1, 1]
    - [12, 0.001]
  - - [4288, 32, 1, 32]
    - [43, 0.48]
  - - [1856, 3584, 1, 32]
    - [5, 8.784]
  - - [5056, 3584, 1, 3328]
    - [20, 88.09]
  - - [4288, 5056, 1, 256]
    - [42, 49.353]
  - - [1856, 5888, 1, 256]
    - [45, 44.268]
  - - [256, 256, 1, 256]
    - [36, 1.835]
  - - [2368, 3584, 1, 1]
    - [62, 0.226]
  - - [4288, 2368, 1, 256]
    - [45, 44.306]
  - - [448, 1, 1, 3328]
    - [21, 0.087]
  - - [1856, 256, 1, 1280]
    - [26, 26.661]
  - - [256, 2944, 1, 1]
    - [30, 0.061]
  - - [1408, 2944, 1, 3328]
    - [42, 78.18]
  - - [32, 1856, 1, 32]
    - [84, 0.233]
  - - [5888, 3584, 1, 1]
    - [38, 0.247]
  - - [256, 1, 1, 1]
    - [18, 0.0]
  - - [6784, 5056, 1, 3328]
    - [20, 90.03]
  - - [6784, 5056, 1, 1]
    - [38, 0.263]
  - - [5888, 3584, 1, 32]
    - [95, 9.393]
  - - [5888, 3584, 1, 3328]
    - [20, 89.244]
  - - [32, 1024, 1, 1280]
    - [78, 3.259]
  - - [1, 256, 1, 3328]
    - [25, 0.049]
  - - [1024, 6784, 1, 256]
    - [32, 38.531]
  - - [6784, 5888, 1, 32]
    - [105, 10.272]
  - - [1408, 1, 1, 1280]
    - [21, 0.144]
  - - [2368, 6784, 1, 32]
    - [8, 10.805]
  - - [6784, 64, 1, 1]
    - [92, 0.037]
  - - [5056, 1408, 1, 1280]
    - [6, 75.32]
  - - [3584, 1408, 1, 3328]
    - [9, 82.987]
  - - [2944, 3584, 1, 1]
    - [48, 0.219]
  - - [2944, 1408, 1, 1280]
    - [6, 65.188]
  - - [1856, 64, 1, 1]
    - [106, 0.011]
  - - [3584, 1024, 1, 1]
    - [34, 0.154]
  - - [256, 32, 1, 256]
    - [10, 0.227]
  - - [2944, 1856, 1, 3328]
    - [4, 74.527]
  - - [128, 1024, 1, 3328]
    - [54, 15.905]
  - - [1408, 128, 1, 1]
    - [11, 0.017]
  - - [2944, 3584, 1, 32]
    - [30, 8.606]
  - - [5888, 256, 1, 32]
    - [30, 3.599]
  - - [6784, 64, 1, 256]
    - [58, 8.881]
  - - [256, 128, 1, 1280]
    - [36, 3.259]
  - - [6784, 5056, 1, 256]
    - [107, 47.064]
  - - [1408, 32, 1, 3328]
    - [36, 8.083]
  - - [1856, 3584, 1, 1280]
    - [42, 71.163]
  - - [256, 5888, 1, 256]
    - [6, 21.846]
  - - [5056, 32, 1, 256]
    - [108, 3.733]
  - - [1024, 4288, 1, 3328]
    - [42, 82.649]
  - - [448, 2368, 1, 256]
    - [33, 19.005]
  - - [64, 1408, 1, 1280]
    - [80, 8.721]
  - - [3584, 32, 1, 1280]
    - [10, 9.616]
  - - [128, 2368, 1, 3328]
    - [16, 31.052]
  - - [64, 5056, 1, 256]
    - [67, 6.763]
  - - [256, 64, 1, 256]
    - [23, 0.463]
  - - [32, 1408, 1, 256]
    - [23, 1.274]
  - - [2368, 448, 1, 3328]
    - [15, 59.546]
  - - [2368, 1408, 1, 1]
    - [61, 0.16]
  - - [1, 1, 1, 1]
    - [75, 0.0]
  - - [1024, 1856, 1, 32]
    - [1, 4.283]
  - - [32, 1024, 1, 32]
    - [18, 0.133]
  - - [4288, 1, 1, 256]
    - [36, 0.112]
  - - [1856, 128, 1, 3328]
    - [60, 25.596]
  - - [5888, 2368, 1, 1]
    - [27, 0.228]
  - - [2368, 2368, 1, 1]
    - [5, 0.195]
  - - [704, 256, 1, 1280]
    - [58, 14.049]
  - - [704, 4288, 1, 256]
    - [48, 29.92]
  - - [5888, 2368, 1, 32]
    - [30, 9.09]
  - - [5888, 2368, 1, 1280]
    - [20, 76.921]
  - - [128, 256, 1, 256]
    - [2, 0.909]
  - - [2944, 5056, 1, 3328]
    - [4, 83.989]
  - - [6784, 704, 1, 3328]
    - [9, 78.645]
  - - [1856, 1856, 1, 32]
    - [40, 6.435]
  - - [4288, 2944, 1, 32]
    - [5, 10.32]
  - - [256, 5056, 1, 1]
    - [5, 0.085]
  - - [704, 64, 1, 256]
    - [39, 1.238]
  - - [256, 2368, 1, 3328]
    - [6, 46.387]
  - - [704, 1, 1, 1]
    - [18, 0.0]
  - - [128, 448, 1, 1280]
    - [19, 5.664]
  - - [5056, 5056, 1, 256]
    - [45, 49.351]
  - - [5888, 256, 1, 256]
    - [74, 21.957]
  - - [5888, 64, 1, 1]
    - [55, 0.033]
  - - [6784, 6784, 1, 256]
    - [13, 48.552]
  - - [256, 3584, 1, 1]
    - [30, 0.068]
  - - [2368, 1, 1, 256]
    - [36, 0.064]
  - - [448, 32, 1, 32]
    - [18, 0.059]
  - - [704, 64, 1, 1]
    - [83, 0.005]
  - - [3584, 704, 1, 3328]
    - [32, 75.927]
  - - [4288, 704, 1, 3328]
    - [6, 71.322]
  - - [4288, 2944, 1, 1280]
    - [20, 75.603]
  - - [448, 3584, 1, 256]
    - [6, 24.633]
  - - [704, 32, 1, 256]
    - [2, 0.619]
  - - [6784, 256, 1, 32]
    - [30, 4.202]
  - - [1856, 128, 1, 1]
    - [11, 0.022]
  - - [1856, 32, 1, 32]
    - [11, 0.233]
  - - [6784, 1408, 1, 1280]
    - [20, 72.195]
  - - [2368, 5056, 1, 1280]
    - [20, 75.2]
  - - [704, 1856, 1, 1280]
    - [33, 50.928]
  - - [1408, 1408, 1, 1280]
    - [109, 51.419]
  - - [448, 1024, 1, 3328]
    - [63, 35.613]
  - - [32, 704, 1, 32]
    - [18, 0.093]
  - - [256, 704, 1, 1]
    - [12, 0.017]
  - - [5888, 1856, 1, 32]
    - [30, 8.621]
  - - [5888, 704, 1, 3328]
    - [4, 77.094]
  - - [5056, 1, 1, 256]
    - [2, 0.126]
  - - [448, 6784, 1, 256]
    - [56, 30.123]
  - - [1024, 128, 1, 1]
    - [12, 0.013]
  - - [128, 64, 1, 256]
    - [94, 0.227]
  - - [1856, 128, 1, 256]
    - [51, 5.271]
  - - [2944, 5888, 1, 256]
    - [45, 48.682]
  - - [1024, 256, 1, 1280]
    - [67, 18.808]
  - - [128, 5056, 1, 32]
    - [30, 1.867]
  - - [128, 5056, 1, 1280]
    - [44, 33.693]
  - - [448, 32, 1, 3328]
    - [0, 2.771]
  - - [1856, 1408, 1, 32]
    - [1, 5.575]
  - - [64, 704, 1, 32]
    - [18, 0.185]
  - - [64, 704, 1, 3328]
    - [25, 8.405]
  - - [64, 2368, 1, 32]
    - [30, 0.52]
  - - [5888, 64, 1, 32]
    - [12, 1.192]
  - - [2368, 256, 1, 1]
    - [5, 0.051]
  - - [5888, 64, 1, 1280]
    - [16, 23.027]
  - - [5056, 1, 1, 1]
    - [11, 0.001]
  - - [5888, 2944, 1, 1280]
    - [20, 78.933]
  - - [32, 2368, 1, 256]
    - [23, 1.987]
  - - [256, 1408, 1, 256]
    - [70, 7.936]
  - - [448, 5888, 1, 1]
    - [61, 0.148]
  - - [3584, 1408, 1, 1]
    - [27, 0.185]
  - - [32, 6784, 1, 1280]
    - [78, 13.976]
  - - [32, 6784, 1, 32]
    - [12, 0.705]
  - - [448, 5888, 1, 32]
    - [110, 5.529]
  - - [5056, 704, 1, 1280]
    - [111, 68.442]
  - - [1856, 6784, 1, 1]
    - [8, 0.247]
  - - [5056, 64, 1, 1]
    - [5, 0.029]
  - - [1, 5888, 1, 1]
    - [65, 0.001]
  - - [2368, 1024, 1, 256]
    - [15, 29.263]
  - - [1856, 6784, 1, 32]
    - [5, 10.34]
  - - [1856, 6784, 1, 1280]
    - [15, 77.764]
  - - [64, 3584, 1, 3328]
    - [24, 21.94]
  - - [5888, 5056, 1, 3328]
    - [20, 88.455]
  - - [1, 2944, 1, 3328]
    - [17, 0.523]
  - - [1408, 6784, 1, 32]
    - [1, 8.42]
  - - [32, 5888, 1, 1280]
    - [10, 14.226]
  - - [448, 256, 1, 1]
    - [11, 0.011]
  - - [3584, 5888, 1, 3328]
    - [20, 89.466]
  - - [4288, 1408, 1, 256]
    - [42, 38.272]
  - - [448, 64, 1, 1280]
    - [78, 2.871]
  - - [128, 448, 1, 32]
    - [18, 0.227]
  - - [6784, 2368, 1, 256]
    - [112, 43.262]
  - - [1408, 448, 1, 32]
    - [43, 1.834]
  - - [1856, 1408, 1, 1280]
    - [42, 66.116]
  - - [448, 256, 1, 3328]
    - [51, 14.146]
  - - [1856, 2368, 1, 1]
    - [62, 0.184]
  - - [1408, 5056, 1, 3328]
    - [28, 84.495]
  - - [128, 704, 1, 3328]
    - [80, 15.57]
  - - [5056, 128, 1, 1280]
    - [113, 34.566]
  - - [5056, 4288, 1, 256]
    - [42, 48.548]
  - - [5056, 5056, 1, 32]
    - [5, 11.651]
  - - [1856, 704, 1, 256]
    - [33, 21.783]
  - - [64, 256, 1, 256]
    - [103, 0.463]
  - - [448, 5888, 1, 1280]
    - [44, 63.719]
  - - [128, 6784, 1, 256]
    - [104, 15.46]
  - - [5056, 448, 1, 256]
    - [9, 27.449]
  - - [4288, 5888, 1, 1]
    - [5, 0.275]
  - - [1856, 5056, 1, 1280]
    - [42, 74.478]
  - - [2368, 4288, 1, 1]
    - [5, 0.239]
  - - [2368, 32, 1, 3328]
    - [39, 13.402]
  - - [3584, 1856, 1, 256]
    - [42, 37.109]
  - - [256, 3584, 1, 256]
    - [33, 15.297]
  - - [64, 704, 1, 1]
    - [11, 0.005]
  - - [4288, 5888, 1, 32]
    - [5, 11.596]
  - - [4288, 5888, 1, 3328]
    - [20, 86.501]
  - - [1, 1024, 1, 1]
    - [85, 0.0]
  - - [1024, 2944, 1, 3328]
    - [114, 70.868]
  - - [2944, 2368, 1, 256]
    - [42, 38.593]
  - - [1024, 1856, 1, 256]
    - [115, 22.936]
  - - [2944, 64, 1, 3328]
    - [116, 20.901]
  - - [1024, 5888, 1, 32]
    - [1, 7.627]
  - - [1024, 5888, 1, 3328]
    - [42, 81.761]
  - - [5056, 2368, 1, 32]
    - [62, 10.18]
  - - [1408, 2368, 1, 1280]
    - [42, 64.801]
  - - [256, 1, 1, 3328]
    - [21, 0.05]
  - - [128, 1024, 1, 32]
    - [117, 0.454]
  - - [5056, 6784, 1, 3328]
    - [20, 90.734]
  - - [448, 704, 1, 1]
    - [18, 0.03]
  - - [32, 64, 1, 32]
    - [46, 0.009]
  - - [448, 704, 1, 32]
    - [12, 1.024]
  - - [448, 704, 1, 3328]
    - [16, 33.595]
  - - [1408, 2944, 1, 256]
    - [42, 32.755]
  - - [64, 5888, 1, 1]
    - [92, 0.033]
  - - [2368, 128, 1, 32]
    - [86, 0.984]
  - - [2368, 256, 1, 1280]
    - [113, 32.742]
  - - [2368, 128, 1, 3328]
    - [24, 32.286]
  - - [704, 5056, 1, 32]
    - [62, 6.649]
  - - [32, 2368, 1, 32]
    - [83, 0.276]
  - - [1408, 1, 1, 256]
    - [2, 0.04]
  - - [4288, 256, 1, 32]
    - [8, 3.044]
  - - [448, 1408, 1, 1]
    - [30, 0.051]
  - - [5056, 4288, 1, 1280]
    - [20, 81.462]
  - - [1408, 256, 1, 256]
    - [70, 7.876]
  - - [4288, 448, 1, 1]
    - [40, 0.122]
  - - [256, 4288, 1, 32]
    - [11, 2.868]
  - - [1408, 256, 1, 1280]
    - [67, 25.861]
  - - [256, 256, 1, 1]
    - [18, 0.007]
  - - [1408, 1, 1, 1]
    - [11, 0.0]
  - - [448, 1408, 1, 256]
    - [26, 12.722]
  - - [5888, 5888, 1, 1]
    - [118, 0.264]
  - - [128, 2944, 1, 32]
    - [11, 1.171]
  - - [32, 256, 1, 32]
    - [46, 0.035]
  - - [2944, 704, 1, 1280]
    - [9, 52.994]
  - - [1024, 3584, 1, 1280]
    - [15, 66.323]
  - - [1856, 448, 1, 1]
    - [5, 0.065]
  - - [2368, 2944, 1, 1]
    - [5, 0.215]
  - - [5056, 256, 1, 32]
    - [5, 3.457]
  - - [4288, 1, 1, 3328]
    - [7, 0.69]
  - - [5056, 1024, 1, 1280]
    - [9, 73.487]
  - - [704, 704, 1, 1]
    - [11, 0.041]
  - - [1856, 448, 1, 1280]
    - [32, 43.604]
  - - [3584, 6784, 1, 256]
    - [45, 49.735]
  - - [64, 1856, 1, 1280]
    - [10, 10.382]
  - - [1856, 1408, 1, 256]
    - [44, 28.989]
  - - [4288, 4288, 1, 32]
    - [5, 10.849]
  - - [128, 1, 1, 256]
    - [119, 0.004]
  - - [32, 64, 1, 3328]
    - [0, 0.392]
  - - [5888, 448, 1, 1]
    - [1, 0.14]
  - - [128, 5888, 1, 256]
    - [90, 13.935]
  - - [3584, 256, 1, 3328]
    - [15, 51.269]
  - - [5056, 5056, 1, 1280]
    - [20, 82.325]
  - - [6784, 1408, 1, 3328]
    - [4, 81.881]
  - - [448, 2368, 1, 1]
    - [5, 0.082]
  - - [2368, 1, 1, 1280]
    - [36, 0.234]
  - - [32, 3584, 1, 32]
    - [57, 0.401]
  - - [128, 6784, 1, 1]
    - [30, 0.066]
  - - [1, 3584, 1, 1]
    - [65, 0.0]
  - - [5888, 5888, 1, 3328]
    - [20, 90.563]
  - - [256, 2944, 1, 3328]
    - [63, 57.204]
  - - [1, 128, 1, 3328]
    - [25, 0.024]
  - - [32, 256, 1, 256]
    - [10, 0.232]
  - - [5888, 1408, 1, 32]
    - [30, 8.078]
  - - [704, 256, 1, 1]
    - [11, 0.017]
  - - [1, 448, 1, 1]
    - [75, 0.0]
  - - [256, 6784, 1, 3328]
    - [52, 76.609]
  - - [64, 5888, 1, 256]
    - [70, 7.934]
  - - [1856, 1, 1, 1]
    - [11, 0.0]
  - - [1024, 256, 1, 3328]
    - [120, 28.408]
  - - [704, 704, 1, 256]
    - [26, 10.511]
  - - [448, 1024, 1, 32]
    - [12, 1.414]
  - - [6784, 2368, 1, 1280]
    - [20, 77.017]
  - - [128, 1856, 1, 1280]
    - [16, 16.55]
  - - [256, 2368, 1, 256]
    - [26, 12.313]
  - - [2944, 1408, 1, 1]
    - [1, 0.16]
  - - [6784, 1024, 1, 256]
    - [121, 37.381]
  - - [5056, 1408, 1, 32]
    - [5, 8.912]
  - - [1408, 6784, 1, 3328]
    - [42, 82.904]
  - - [2944, 1408, 1, 3328]
    - [4, 76.942]
  - - [1856, 32, 1, 256]
    - [39, 1.572]
  - - [704, 2368, 1, 32]
    - [5, 4.419]
  - - [448, 256, 1, 32]
    - [43, 0.409]
  - - [704, 6784, 1, 1]
    - [122, 0.191]
  - - [2368, 6784, 1, 256]
    - [45, 47.964]
  - - [1856, 3584, 1, 3328]
    - [28, 80.12]
  - - [1, 704, 1, 3328]
    - [0, 0.137]
  - - [64, 1, 1, 3328]
    - [0, 0.012]
  - - [448, 704, 1, 1280]
    - [24, 22.629]
  - - [704, 1856, 1, 1]
    - [40, 0.095]
  - - [704, 448, 1, 256]
    - [70, 6.944]
  - - [448, 64, 1, 3328]
    - [0, 5.485]
  - - [704, 6784, 1, 256]
    - [123, 35.966]
  - - [256, 32, 1, 1280]
    - [0, 0.875]
  - - [2368, 448, 1, 1280]
    - [35, 42.262]
  - - [6784, 2944, 1, 32]
    - [97, 9.279]
  - - [64, 4288, 1, 32]
    - [86, 0.883]
  - - [128, 704, 1, 1]
    - [84, 0.009]
  - - [128, 448, 1, 3328]
    - [36, 10.288]
  - - [5888, 2368, 1, 3328]
    - [20, 85.787]
  - - [2368, 704, 1, 1280]
    - [32, 56.834]
  - - [1024, 1408, 1, 1280]
    - [32, 49.981]
  - - [4288, 64, 1, 1280]
    - [60, 18.757]
  - - [128, 5056, 1, 1]
    - [30, 0.052]
  - - [2944, 5056, 1, 32]
    - [30, 9.096]
  - - [448, 448, 1, 1]
    - [11, 0.019]
  - - [256, 2368, 1, 1280]
    - [32, 32.259]
  - - [704, 2368, 1, 3328]
    - [44, 73.798]
  - - [3584, 2944, 1, 256]
    - [45, 43.788]
  - - [64, 6784, 1, 256]
    - [90, 8.636]
  - - [3584, 1024, 1, 1280]
    - [124, 65.583]
  - - [64, 1024, 1, 256]
    - [23, 1.8]
  - - [1408, 32, 1, 32]
    - [11, 0.177]
  - - [128, 3584, 1, 256]
    - [26, 9.451]
  - - [704, 1408, 1, 1]
    - [125, 0.075]
  - - [5056, 3584, 1, 256]
    - [45, 47.993]
  - - [2368, 704, 1, 256]
    - [32, 24.531]
  - - [1856, 1856, 1, 1280]
    - [6, 68.52]
  - - [32, 5888, 1, 32]
    - [85, 0.618]
  - - [64, 32, 1, 32]
    - [46, 0.009]
  - - [4288, 704, 1, 1]
    - [62, 0.156]
  - - [1856, 1024, 1, 1]
    - [5, 0.12]
  - - [4288, 2944, 1, 3328]
    - [20, 84.343]
  - - [1024, 128, 1, 3328]
    - [58, 16.113]
  - - [4288, 128, 1, 3328]
    - [126, 42.432]
  - - [4288, 704, 1, 32]
    - [5, 6.046]
  - - [1856, 1024, 1, 32]
    - [5, 4.661]
  - - [1, 448, 1, 3328]
    - [25, 0.087]
  - - [2944, 6784, 1, 1]
    - [38, 0.24]
  - - [6784, 2368, 1, 32]
    - [1, 9.092]
  - - [5888, 5056, 1, 1]
    - [38, 0.257]
  - - [128, 6784, 1, 1280]
    - [6, 42.45]
  - - [704, 5888, 1, 1]
    - [40, 0.181]
  - - [6784, 6784, 1, 1]
    - [38, 0.272]
  - - [1856, 32, 1, 1280]
    - [7, 5.907]
  - - [5888, 448, 1, 3328]
    - [32, 77.451]
  - - [704, 5888, 1, 32]
    - [30, 7.116]
  - - [704, 5888, 1, 1280]
    - [44, 66.567]
  - - [1024, 6784, 1, 3328]
    - [52, 83.404]
  - - [704, 2944, 1, 1280]
    - [31, 53.757]
  - - [4288, 6784, 1, 256]
    - [45, 51.347]
  - - [3584, 256, 1, 32]
    - [12, 2.487]
  - - [1408, 1408, 1, 32]
    - [81, 4.467]
  - - [1408, 1408, 1, 3328]
    - [127, 71.131]
  - - [1024, 64, 1, 256]
    - [7, 1.767]
  - - [4288, 64, 1, 32]
    - [128, 0.933]
  - - [1408, 256, 1, 32]
    - [12, 1.171]
  - - [5888, 128, 1, 256]
    - [49, 14.207]
  - - [64, 704, 1, 1280]
    - [25, 4.512]
  - - [2944, 1856, 1, 256]
    - [42, 34.789]
  - - [128, 5056, 1, 3328]
    - [6, 48.05]
  - - [4288, 2944, 1, 1]
    - [40, 0.247]
  - - [6784, 5056, 1, 32]
    - [105, 9.933]
  - - [1024, 448, 1, 3328]
    - [129, 35.539]
  - - [3584, 128, 1, 1]
    - [30, 0.038]
  - - [2944, 4288, 1, 1280]
    - [20, 76.556]
  - - [64, 32, 1, 3328]
    - [0, 0.392]
  - - [1024, 4288, 1, 256]
    - [32, 34.602]
  - - [128, 2368, 1, 256]
    - [70, 6.623]
  - - [2368, 64, 1, 32]
    - [130, 0.52]
  - - [1408, 1, 1, 3328]
    - [21, 0.265]
  - - [64, 1408, 1, 32]
    - [43, 0.338]
  - - [2368, 5888, 1, 1]
    - [5, 0.254]
  - - [1408, 1856, 1, 32]
    - [1, 5.323]
  - - [448, 1856, 1, 256]
    - [33, 16.204]
  - - [1856, 6784, 1, 3328]
    - [15, 85.978]
  - - [3584, 128, 1, 256]
    - [131, 9.519]
  - - [1024, 448, 1, 1280]
    - [26, 25.944]
  - - [1024, 2368, 1, 32]
    - [1, 5.143]
  - - [32, 2944, 1, 256]
    - [17, 2.405]
  - - [128, 5888, 1, 1]
    - [5, 0.06]
  - - [64, 5056, 1, 1]
    - [5, 0.03]
  - - [1856, 256, 1, 32]
    - [12, 1.428]
  - - [2368, 2368, 1, 3328]
    - [4, 75.439]
  - - [64, 448, 1, 1]
    - [83, 0.003]
  - - [3584, 5888, 1, 32]
    - [48, 9.393]
  - - [3584, 5888, 1, 1280]
    - [20, 79.77]
  - - [64, 5056, 1, 32]
    - [84, 1.111]
  - - [2944, 64, 1, 1]
    - [132, 0.019]
  - - [6784, 704, 1, 256]
    - [115, 35.05]
  - - [3584, 1024, 1, 32]
    - [133, 6.241]
  - - [1408, 704, 1, 32]
    - [30, 2.814]
  - - [1408, 704, 1, 1280]
    - [134, 39.163]
  - - [2368, 5888, 1, 256]
    - [45, 46.924]
  - - [2944, 64, 1, 32]
    - [12, 0.612]
  - - [1, 1408, 1, 256]
    - [135, 0.038]
  - - [64, 2944, 1, 256]
    - [10, 4.606]
  - - [5888, 5888, 1, 32]
    - [105, 10.047]
  - - [1856, 1408, 1, 3328]
    - [35, 78.892]
  - - [1024, 1024, 1, 32]
    - [30, 2.78]
  - - [4288, 1024, 1, 1]
    - [8, 0.186]
  - - [704, 4288, 1, 3328]
    - [28, 72.371]
  - - [2944, 5056, 1, 1280]
    - [20, 75.931]
  - - [6784, 2944, 1, 1280]
    - [20, 79.083]
  - - [6784, 256, 1, 3328]
    - [52, 76.429]
  - - [5056, 128, 1, 3328]
    - [126, 49.22]
  - - [128, 128, 1, 1280]
    - [79, 1.676]
  - - [128, 4288, 1, 1]
    - [30, 0.046]
  - - [1408, 5056, 1, 32]
    - [30, 7.995]
  - - [2944, 128, 1, 3328]
    - [67, 38.817]
  - - [5888, 1856, 1, 1280]
    - [20, 72.86]
  - - [64, 128, 1, 256]
    - [10, 0.229]
  - - [5888, 256, 1, 1280]
    - [32, 51.026]
  - - [1856, 5056, 1, 1]
    - [5, 0.233]
  - - [3584, 1856, 1, 1280]
    - [6, 69.412]
  - - [6784, 448, 1, 256]
    - [56, 29.122]
  - - [704, 3584, 1, 256]
    - [33, 28.764]
  - - [1856, 5056, 1, 32]
    - [5, 9.611]
  - - [1856, 5056, 1, 3328]
    - [28, 82.594]
  - - [1024, 2944, 1, 32]
    - [30, 5.69]
  - - [1408, 6784, 1, 256]
    - [45, 41.869]
  - - [1024, 2368, 1, 1280]
    - [32, 60.605]
  - - [1856, 3584, 1, 1]
    - [136, 0.205]
  - - [5888, 128, 1, 1280]
    - [28, 40.106]
  - - [2944, 5888, 1, 1280]
    - [20, 78.933]
  - - [1, 1856, 1, 1]
    - [11, 0.0]
  - - [3584, 3584, 1, 256]
    - [45, 45.57]
  - - [1856, 2368, 1, 3328]
    - [15, 72.981]
  - - [5888, 704, 1, 256]
    - [28, 31.297]
  - - [64, 448, 1, 32]
    - [83, 0.116]
  - - [6784, 4288, 1, 256]
    - [107, 46.899]
  - - [128, 64, 1, 3328]
    - [0, 1.617]
  - - [1, 5056, 1, 1280]
    - [17, 0.445]
  - - [32, 64, 1, 1280]
    - [0, 0.216]
  - - [1408, 2368, 1, 3328]
    - [28, 77.169]
  - - [1024, 3584, 1, 256]
    - [137, 30.593]
  - - [2944, 128, 1, 256]
    - [58, 8.558]
  - - [6784, 128, 1, 1]
    - [86, 0.07]
  - - [1408, 256, 1, 3328]
    - [60, 38.178]
  - - [448, 32, 1, 256]
    - [119, 0.398]
  - - [1024, 32, 1, 256]
    - [2, 0.892]
  - - [1, 5888, 1, 256]
    - [23, 0.152]
  - - [64, 2368, 1, 256]
    - [10, 3.903]
  - - [2944, 256, 1, 256]
    - [31, 14.301]
  - - [1, 128, 1, 256]
    - [0, 0.004]
  - - [32, 256, 1, 1280]
    - [0, 0.856]
  - - [5888, 1, 1, 256]
    - [10, 0.154]
  - - [32, 128, 1, 3328]
    - [29, 0.796]
  - - [6784, 128, 1, 256]
    - [49, 16.37]
  - - [6784, 64, 1, 1280]
    - [16, 26.308]
  - - [4288, 1024, 1, 32]
    - [50, 7.363]
  - - [1408, 64, 1, 3328]
    - [7, 15.789]
  - - [2944, 448, 1, 1280]
    - [33, 50.72]
  - - [6784, 32, 1, 1280]
    - [7, 14.102]
  - - [2944, 64, 1, 1280]
    - [58, 14.376]
  - - [704, 448, 1, 1]
    - [11, 0.03]
  - - [32, 128, 1, 32]
    - [12, 0.017]
  - - [1, 128, 1, 1]
    - [85, 0.0]
  - - [5888, 1, 1, 1]
    - [11, 0.001]
  - - [5888, 1856, 1, 3328]
    - [20, 81.251]
  - - [2368, 3584, 1, 256]
    - [42, 42.277]
  - - [4288, 1408, 1, 3328]
    - [4, 81.313]
  - - [1856, 32, 1, 3328]
    - [7, 10.706]
  - - [2944, 32, 1, 256]
    - [7, 2.303]
  - - [128, 64, 1, 1]
    - [75, 0.001]
  - - [256, 1024, 1, 3328]
    - [16, 28.083]
  - - [32, 448, 1, 256]
    - [103, 0.401]
  - - [1856, 64, 1, 3328]
    - [59, 14.846]
  - - [256, 5056, 1, 256]
    - [33, 20.071]
  - - [5888, 2944, 1, 3328]
    - [20, 88.694]
  - - [2368, 1408, 1, 3328]
    - [3, 76.555]
  - - [5888, 704, 1, 32]
    - [106, 6.47]
  - - [2944, 704, 1, 1]
    - [1, 0.119]
  - - [6784, 1856, 1, 256]
    - [13, 42.375]
  - - [1, 704, 1, 256]
    - [23, 0.02]
  - - [1856, 1856, 1, 1]
    - [138, 0.162]
  - - [5888, 32, 1, 256]
    - [10, 4.767]
  - - [128, 704, 1, 256]
    - [23, 2.499]
  - - [256, 1408, 1, 3328]
    - [16, 37.438]
  - - [2944, 128, 1, 1]
    - [30, 0.034]
  - - [32, 256, 1, 3328]
    - [25, 1.567]
  - - [2944, 704, 1, 3328]
    - [9, 65.413]
  - - [704, 1024, 1, 32]
    - [5, 2.166]
  - - [2368, 1856, 1, 32]
    - [5, 7.474]
  - - [5056, 4288, 1, 3328]
    - [20, 88.1]
  - - [3584, 448, 1, 3328]
    - [32, 70.085]
  - - [256, 32, 1, 32]
    - [12, 0.033]
  - - [64, 256, 1, 3328]
    - [0, 3.167]
  - - [256, 6784, 1, 1]
    - [1, 0.109]
  - - [1024, 3584, 1, 32]
    - [30, 6.271]
  - - [256, 6784, 1, 32]
    - [30, 4.066]
  - - [2944, 1408, 1, 32]
    - [1, 6.498]
  - - [4288, 3584, 1, 1]
    - [5, 0.255]
  - - [1, 704, 1, 1]
    - [11, 0.0]
  - - [5056, 448, 1, 3328]
    - [9, 71.731]
  - - [3584, 64, 1, 256]
    - [26, 4.974]
  - - [64, 1856, 1, 32]
    - [139, 0.424]
  - - [64, 1856, 1, 3328]
    - [10, 15.627]
  - - [6784, 3584, 1, 32]
    - [140, 9.612]
  - - [4288, 1856, 1, 256]
    - [42, 42.117]
  - - [1856, 2944, 1, 256]
    - [137, 36.565]
  - - [128, 448, 1, 1]
    - [11, 0.006]
  - - [64, 128, 1, 32]
    - [46, 0.035]
  - - [704, 1, 1, 1280]
    - [80, 0.074]
  - - [2944, 5888, 1, 1]
    - [141, 0.236]
  - - [1024, 1856, 1, 3328]
    - [127, 67.418]
  - - [5888, 1024, 1, 32]
    - [1, 7.522]
  - - [3584, 256, 1, 1280]
    - [33, 35.568]
  - - [1024, 1, 1, 1]
    - [18, 0.0]
  - - [1408, 5056, 1, 1280]
    - [42, 73.751]
  - - [3584, 128, 1, 1280]
    - [26, 25.251]
  - - [5056, 6784, 1, 256]
    - [13, 51.073]
  - - [256, 1856, 1, 256]
    - [26, 9.651]
  - - [5888, 32, 1, 1280]
    - [54, 14.152]
  - - [256, 128, 1, 32]
    - [11, 0.131]
  - - [32, 1856, 1, 1280]
    - [17, 5.948]
  - - [2944, 5056, 1, 1]
    - [38, 0.227]
  - - [448, 128, 1, 1]
    - [18, 0.006]
  - - [256, 704, 1, 32]
    - [12, 0.602]
  - - [256, 704, 1, 1280]
    - [51, 14.049]
  - - [1, 2368, 1, 1]
    - [65, 0.0]
  - - [5888, 5888, 1, 1280]
    - [20, 82.995]
  - - [256, 2944, 1, 1280]
    - [142, 39.811]
  - - [2944, 256, 1, 3328]
    - [142, 58.265]
  - - [5056, 2944, 1, 1280]
    - [20, 76.773]
  - - [704, 1024, 1, 3328]
    - [63, 55.503]
  - - [2368, 1856, 1, 1280]
    - [13, 62.753]
  - - [448, 2944, 1, 1]
    - [5, 0.099]
  - - [6784, 2944, 1, 1]
    - [38, 0.242]
  - - [2944, 1024, 1, 32]
    - [30, 5.72]
  - - [2944, 1024, 1, 1280]
    - [56, 57.812]
  - - [1408, 64, 1, 32]
    - [43, 0.328]
  - - [5056, 5056, 1, 1]
    - [122, 0.278]
  - - [2368, 4288, 1, 256]
    - [15, 44.644]
  - - [448, 1856, 1, 1280]
    - [6, 43.446]
  - - [2368, 448, 1, 1]
    - [5, 0.081]
  - - [448, 2944, 1, 32]
    - [5, 3.421]
  - - [448, 2944, 1, 1280]
    - [33, 50.451]
  - - [2944, 6784, 1, 1280]
    - [20, 80.498]
  - - [256, 6784, 1, 1280]
    - [52, 58.109]
  - - [128, 2368, 1, 1280]
    - [16, 21.015]
  - - [3584, 2368, 1, 32]
    - [30, 8.159]
  - - [704, 32, 1, 32]
    - [18, 0.09]
  - - [6784, 3584, 1, 3328]
    - [20, 87.131]
  - - [128, 32, 1, 256]
    - [0, 0.118]
  - - [128, 1408, 1, 1280]
    - [58, 14.202]
  - - [64, 32, 1, 1280]
    - [0, 0.214]
  - - [128, 1856, 1, 3328]
    - [60, 25.092]
  - - [2944, 2944, 1, 256]
    - [42, 40.779]
  - - [1408, 1024, 1, 3328]
    - [114, 64.204]
  - - [5056, 2368, 1, 1280]
    - [20, 74.906]
  - - [448, 128, 1, 32]
    - [11, 0.227]
  - - [2368, 64, 1, 3328]
    - [51, 17.647]
  - - [32, 5056, 1, 3328]
    - [10, 19.444]
  - - [448, 2944, 1, 3328]
    - [33, 63.81]
  - - [2944, 1024, 1, 1]
    - [27, 0.143]
  - - [2368, 128, 1, 1280]
    - [16, 21.639]
  - - [3584, 704, 1, 256]
    - [32, 27.99]
  - - [2368, 5888, 1, 3328]
    - [15, 86.041]
  - - [4288, 2368, 1, 1]
    - [62, 0.237]
  - - [1408, 3584, 1, 32]
    - [30, 7.107]
  - - [2944, 4288, 1, 32]
    - [30, 8.995]
  - - [5888, 1408, 1, 1280]
    - [20, 71.249]
  - - [3584, 5056, 1, 1280]
    - [20, 79.598]
  - - [5888, 6784, 1, 1280]
    - [20, 83.898]
  - - [64, 1856, 1, 1]
    - [12, 0.011]
  - - [704, 128, 1, 32]
    - [133, 0.325]
  - - [3584, 2944, 1, 1]
    - [38, 0.221]
  - - [128, 3584, 1, 3328]
    - [63, 34.471]
  - - [256, 4288, 1, 3328]
    - [124, 60.439]
  - - [4288, 64, 1, 1]
    - [98, 0.026]
  - - [1, 1408, 1, 1280]
    - [0, 0.14]
  - - [5056, 32, 1, 1280]
    - [10, 12.477]
  - - [1856, 704, 1, 32]
    - [8, 3.49]
  - - [1024, 1856, 1, 1]
    - [133, 0.11]
  - - [704, 5056, 1, 3328]
    - [44, 81.827]
  - - [1024, 3584, 1, 3328]
    - [15, 79.542]
  - - [5888, 256, 1, 3328]
    - [114, 66.726]
  - - [1856, 1408, 1, 1]
    - [61, 0.15]
  - - [2944, 448, 1, 32]
    - [1, 3.213]
  - - [128, 448, 1, 256]
    - [23, 1.606]
  - - [128, 1024, 1, 1]
    - [11, 0.013]
  - - [32, 32, 1, 256]
    - [0, 0.028]
  - - [4288, 5056, 1, 1280]
    - [20, 80.622]
  - - [1856, 1856, 1, 3328]
    - [32, 79.975]
  - - [1024, 2368, 1, 256]
    - [13, 28.088]
  - - [4288, 2368, 1, 3328]
    - [9, 85.441]
  - - [256, 64, 1, 32]
    - [11, 0.066]
  - - [1, 1024, 1, 1280]
    - [7, 0.105]
  - - [5056, 128, 1, 32]
    - [5, 1.882]
  - - [5888, 3584, 1, 256]
    - [45, 47.109]
  - - [1024, 5056, 1, 32]
    - [30, 7.152]
  - - [5888, 448, 1, 1280]
    - [32, 62.259]
  - - [704, 5888, 1, 3328]
    - [44, 78.338]
  - - [1024, 1408, 1, 256]
    - [6, 21.659]
  - - [3584, 2944, 1, 1280]
    - [20, 76.157]
  - - [1, 5056, 1, 256]
    - [23, 0.124]
  - - [256, 1024, 1, 1]
    - [12, 0.023]
  - - [32, 32, 1, 3328]
    - [0, 0.198]
  - - [2368, 1, 1, 3328]
    - [0, 0.433]
  - - [4288, 1856, 1, 1280]
    - [4, 72.87]
  - - [3584, 5888, 1, 1]
    - [38, 0.248]
  - - [5888, 4288, 1, 256]
    - [45, 48.035]
  - - [1024, 2944, 1, 1280]
    - [28, 59.555]
  - - [6784, 1, 1, 1]
    - [46, 0.001]
  - - [1408, 64, 1, 1280]
    - [7, 8.962]
  - - [1, 256, 1, 1280]
    - [0, 0.027]
  - - [2944, 3584, 1, 256]
    - [143, 44.753]
  - - [1, 128, 1, 1280]
    - [7, 0.013]
  - - [1024, 256, 1, 32]
    - [12, 0.867]
  - - [5888, 1, 1, 1280]
    - [7, 0.485]
  - - [2368, 32, 1, 1280]
    - [36, 7.695]
  - - [5888, 1856, 1, 1]
    - [144, 0.209]
  - - [6784, 128, 1, 1280]
    - [32, 45.207]
  - - [6784, 2368, 1, 3328]
    - [4, 85.39]
  - - [1, 64, 1, 256]
    - [10, 0.002]
  - - [704, 128, 1, 1]
    - [98, 0.009]
  - - [1408, 4288, 1, 32]
    - [30, 7.532]
  - - [256, 64, 1, 1280]
    - [0, 1.725]
  - - [256, 448, 1, 256]
    - [10, 2.757]
  - - [1856, 1024, 1, 1280]
    - [33, 50.662]
  - - [5888, 1856, 1, 256]
    - [42, 42.251]
  - - [5056, 1856, 1, 1]
    - [62, 0.233]
  - - [5888, 2368, 1, 256]
    - [45, 43.475]
  - - [1408, 1024, 1, 32]
    - [1, 3.56]
  - - [32, 704, 1, 256]
    - [19, 0.643]
  - - [2944, 1, 1, 256]
    - [2, 0.08]
  - - [32, 4288, 1, 256]
    - [59, 3.166]
  - - [5056, 1856, 1, 32]
    - [5, 9.611]
  - - [5056, 1856, 1, 1280]
    - [6, 74.725]
  - - [1, 64, 1, 1]
    - [12, 0.0]
  - - [1408, 5888, 1, 3328]
    - [114, 80.115]
  - - [1408, 704, 1, 3328]
    - [15, 55.889]
  - - [5056, 704, 1, 3328]
    - [4, 82.129]
  - - [704, 64, 1, 1280]
    - [7, 4.608]
  - - [1, 704, 1, 1280]
    - [25, 0.073]
  - - [5888, 6784, 1, 1]
    - [38, 0.266]
  - - [5888, 4288, 1, 32]
    - [1, 9.602]
  - - [1408, 3584, 1, 256]
    - [45, 36.661]
  - - [1856, 704, 1, 1]
    - [5, 0.095]
  - - [6784, 256, 1, 1]
    - [145, 0.107]
  - - [2944, 1, 1, 1]
    - [11, 0.0]
  - - [256, 1856, 1, 3328]
    - [44, 36.507]
  - - [4288, 128, 1, 1280]
    - [26, 30.211]
  - - [6784, 256, 1, 1280]
    - [52, 57.708]
  - - [128, 4288, 1, 256]
    - [131, 10.994]
  - - [128, 128, 1, 32]
    - [11, 0.066]
  - - [128, 1408, 1, 32]
    - [50, 0.602]
  - - [6784, 128, 1, 32]
    - [133, 2.336]
  - - [1408, 448, 1, 1]
    - [30, 0.051]
  - - [2368, 704, 1, 3328]
    - [32, 73.711]
  - - [704, 128, 1, 3328]
    - [7, 15.715]
  - - [2944, 1856, 1, 32]
    - [30, 7.216]
  - - [1024, 64, 1, 1]
    - [18, 0.007]
  - - [1408, 32, 1, 1280]
    - [39, 4.512]
  - - [704, 1, 1, 256]
    - [2, 0.02]
  - - [2368, 1408, 1, 256]
    - [76, 32.162]
  - - [2368, 1856, 1, 1]
    - [5, 0.189]
  - - [4288, 1408, 1, 1]
    - [40, 0.205]
  - - [3584, 2368, 1, 1280]
    - [20, 71.91]
  - - [64, 5056, 1, 1280]
    - [146, 21.02]
  - - [1408, 2944, 1, 1]
    - [27, 0.162]
  - - [4288, 1408, 1, 32]
    - [5, 8.276]
  - - [5888, 2944, 1, 256]
    - [45, 46.638]
  - - [128, 64, 1, 1280]
    - [0, 0.862]
  - - [1408, 2944, 1, 32]
    - [1, 6.497]
  - - [1, 3584, 1, 1280]
    - [17, 0.349]
  - - [64, 64, 1, 32]
    - [46, 0.016]
  - - [448, 1408, 1, 32]
    - [30, 1.88]
  - - [128, 5056, 1, 256]
    - [131, 12.362]
  - - [1, 1, 1, 1280]
    - [17, 0.0]
  - - [64, 704, 1, 256]
    - [36, 1.25]
  - - [5888, 6784, 1, 256]
    - [147, 49.213]
  - - [6784, 5888, 1, 1]
    - [38, 0.267]
  - - [64, 4288, 1, 256]
    - [16, 5.82]
  - - [1, 448, 1, 1280]
    - [29, 0.045]
  - - [1024, 1024, 1, 1]
    - [30, 0.071]
  - - [6784, 5888, 1, 1280]
    - [20, 83.147]
  - - [1024, 4288, 1, 32]
    - [30, 6.736]
  - - [1856, 1, 1, 1280]
    - [7, 0.181]
  - - [3584, 5888, 1, 256]
    - [45, 48.848]
  - - [5056, 2368, 1, 1]
    - [8, 0.25]
  - - [256, 1408, 1, 1280]
    - [16, 25.481]
  - - [64, 256, 1, 32]
    - [12, 0.066]
  - - [64, 5888, 1, 3328]
    - [16, 32.782]
  - - [6784, 64, 1, 3328]
    - [16, 34.785]
  - - [5056, 448, 1, 1]
    - [1, 0.133]
  - - [2944, 448, 1, 3328]
    - [148, 62.44]
  - - [2368, 1024, 1, 1280]
    - [15, 62.333]
  - - [1856, 6784, 1, 256]
    - [123, 46.203]
  - - [4288, 32, 1, 1280]
    - [59, 11.117]
  - - [448, 1408, 1, 1280]
    - [26, 33.817]
  - - [5056, 448, 1, 32]
    - [1, 5.136]
  - - [3584, 2944, 1, 32]
    - [30, 8.705]
  - - [2368, 128, 1, 1]
    - [5, 0.028]
  - - [32, 128, 1, 1280]
    - [0, 0.419]
  - - [3584, 1856, 1, 32]
    - [1, 7.542]
  - - [128, 128, 1, 3328]
    - [29, 3.183]
  - - [5056, 64, 1, 256]
    - [26, 6.965]
  - - [64, 448, 1, 3328]
    - [21, 5.375]
  - - [4288, 1408, 1, 1280]
    - [6, 71.72]
  - - [6784, 2368, 1, 1]
    - [38, 0.234]
  - - [32, 5056, 1, 256]
    - [149, 3.794]
  - - [704, 128, 1, 256]
    - [23, 2.3]
  - - [704, 5056, 1, 1]
    - [61, 0.164]
  - - [256, 1024, 1, 32]
    - [5, 0.844]
  - - [256, 1024, 1, 1280]
    - [16, 18.352]
  - - [2368, 128, 1, 256]
    - [70, 6.673]
  - - [32, 64, 1, 256]
    - [0, 0.06]
  - - [2368, 1408, 1, 1280]
    - [6, 65.956]
  - - [128, 256, 1, 32]
    - [11, 0.131]
  - - [64, 6784, 1, 32]
    - [11, 1.294]
  - - [6784, 32, 1, 256]
    - [10, 4.673]
  - - [256, 4288, 1, 1]
    - [5, 0.075]
  - - [5888, 1408, 1, 1]
    - [150, 0.201]
  - - [1024, 4288, 1, 1280]
    - [42, 70.202]
  - - [1856, 4288, 1, 1]
    - [50, 0.221]
  - - [128, 2944, 1, 256]
    - [151, 7.992]
  - - [3584, 4288, 1, 256]
    - [45, 46.707]
  - - [2368, 2944, 1, 256]
    - [76, 40.457]
  - - [3584, 128, 1, 32]
    - [12, 1.367]
  - - [3584, 128, 1, 3328]
    - [126, 35.32]
  - - [704, 5056, 1, 256]
    - [6, 33.224]
  - - [1856, 4288, 1, 32]
    - [5, 9.346]
  - - [64, 256, 1, 1280]
    - [0, 1.725]
  - - [4288, 1024, 1, 1280]
    - [6, 70.358]
  - - [1, 4288, 1, 256]
    - [23, 0.112]
  - - [64, 2368, 1, 1]
    - [130, 0.014]
  - - [4288, 6784, 1, 32]
    - [8, 11.679]
  - - [704, 704, 1, 3328]
    - [113, 38.554]
  - - [128, 2944, 1, 1]
    - [92, 0.033]
  - - [3584, 1408, 1, 256]
    - [45, 36.026]
  - - [704, 3584, 1, 3328]
    - [44, 76.11]
  - - [5056, 448, 1, 1280]
    - [9, 58.435]
  - - [1408, 2944, 1, 1280]
    - [42, 66.791]
  - - [5888, 704, 1, 1280]
    - [32, 64.976]
  - - [64, 64, 1, 256]
    - [10, 0.114]
  - - [704, 1408, 1, 1280]
    - [35, 40.61]
  - - [4288, 5888, 1, 256]
    - [42, 50.117]
  - - [6784, 64, 1, 32]
    - [11, 1.315]
  - - [3584, 3584, 1, 3328]
    - [20, 86.53]
  - - [2944, 6784, 1, 32]
    - [152, 9.388]
  - - [448, 64, 1, 32]
    - [11, 0.116]
  - - [5056, 256, 1, 1]
    - [5, 0.097]
  - - [64, 6784, 1, 1280]
    - [16, 26.198]
  - - [2944, 2368, 1, 3328]
    - [114, 82.147]
  - - [1, 4288, 1, 1]
    - [65, 0.0]
  - - [1408, 128, 1, 256]
    - [10, 4.192]
  - - [1024, 1856, 1, 1280]
    - [137, 49.833]
  - - [448, 5888, 1, 256]
    - [33, 29.15]
  - - [1024, 5888, 1, 256]
    - [32, 37.64]
  - - [704, 1408, 1, 256]
    - [33, 18.564]
  - - [6784, 2944, 1, 3328]
    - [20, 89.054]
  - - [1408, 2368, 1, 256]
    - [32, 30.822]
  - - [64, 128, 1, 1280]
    - [0, 0.869]
  - - [5888, 32, 1, 3328]
    - [7, 19.145]
  - - [1408, 5056, 1, 256]
    - [42, 39.334]
  - - [1024, 1408, 1, 32]
    - [1, 3.536]
  - - [4288, 128, 1, 32]
    - [12, 1.609]
  - - [6784, 704, 1, 1]
    - [38, 0.173]
  - - [448, 704, 1, 256]
    - [26, 6.944]
  - - [704, 3584, 1, 32]
    - [5, 5.615]
  - - [1856, 256, 1, 3328]
    - [63, 37.038]
  - - [448, 1024, 1, 1280]
    - [26, 26.253]
  - - [4288, 4288, 1, 1]
    - [40, 0.264]
  - - [5056, 2944, 1, 1]
    - [153, 0.255]
  - - [64, 2368, 1, 3328]
    - [10, 18.155]
  - - [256, 704, 1, 3328]
    - [58, 22.083]
  - - [1, 2944, 1, 1]
    - [65, 0.0]
  - - [1024, 1024, 1, 256]
    - [33, 17.381]
  - - [3584, 1, 1, 1]
    - [46, 0.0]
  - - [256, 2944, 1, 32]
    - [57, 2.363]
  - - [6784, 4288, 1, 3328]
    - [20, 89.904]
  - - [5056, 2944, 1, 3328]
    - [20, 84.205]
  - - [704, 1024, 1, 1280]
    - [6, 38.362]
  - - [256, 3584, 1, 1280]
    - [33, 35.857]
  - - [2368, 1856, 1, 3328]
    - [9, 72.404]
  - - [1856, 4288, 1, 1280]
    - [44, 73.571]
  - - [1, 1024, 1, 256]
    - [23, 0.028]
  - - [3584, 448, 1, 1]
    - [154, 0.099]
  - - [2944, 1024, 1, 3328]
    - [155, 70.426]
  - - [32, 1408, 1, 3328]
    - [80, 8.083]
  - - [128, 1, 1, 3328]
    - [21, 0.024]
  - - [5888, 5056, 1, 32]
    - [95, 9.704]
  - - [704, 2944, 1, 1]
    - [62, 0.128]
  - - [3584, 448, 1, 32]
    - [30, 3.759]
  - - [3584, 448, 1, 1280]
    - [32, 54.483]
  - - [2944, 6784, 1, 3328]
    - [20, 90.365]
  - - [1856, 2368, 1, 1280]
    - [33, 63.191]
  - - [6784, 1024, 1, 1280]
    - [156, 71.405]
  - - [6784, 3584, 1, 1280]
    - [20, 80.513]
  - - [1, 5056, 1, 3328]
    - [17, 0.729]
  - - [128, 128, 1, 1]
    - [75, 0.002]
  - - [128, 2368, 1, 32]
    - [12, 1.003]
  - - [128, 1408, 1, 3328]
    - [58, 21.659]
  - - [2944, 32, 1, 3328]
    - [22, 15.912]
  - - [704, 1856, 1, 256]
    - [33, 20.937]
  - - [1408, 1408, 1, 1]
    - [1, 0.112]
  - - [1408, 4288, 1, 256]
    - [32, 37.529]
  - - [256, 5056, 1, 3328]
    - [15, 71.056]
  - - [2368, 64, 1, 1280]
    - [59, 11.687]
  - - [1856, 448, 1, 32]
    - [30, 2.324]
  - - [1408, 448, 1, 256]
    - [26, 12.461]
  - - [32, 128, 1, 256]
    - [0, 0.118]
  - - [448, 1024, 1, 1]
    - [11, 0.038]
  - - [128, 1024, 1, 1280]
    - [10, 10.501]
  - - [448, 6784, 1, 1]
    - [40, 0.16]
  - - [704, 2944, 1, 256]
    - [13, 25.438]
  - - [1408, 1408, 1, 256]
    - [9, 24.228]
  - - [448, 6784, 1, 32]
    - [5, 6.226]
  - - [1, 64, 1, 1280]
    - [29, 0.007]
  - - [1408, 1856, 1, 1]
    - [1, 0.14]
  - - [4288, 448, 1, 32]
    - [5, 4.617]
  - - [4288, 448, 1, 1280]
    - [9, 49.559]
  - - [2944, 704, 1, 32]
    - [1, 4.584]
  - - [1024, 704, 1, 256]
    - [26, 13.769]
  - - [448, 4288, 1, 1]
    - [40, 0.124]
  - - [3584, 5056, 1, 1]
    - [38, 0.243]
  - - [1408, 3584, 1, 1280]
    - [15, 71.137]
  - - [6784, 448, 1, 1280]
    - [6, 58.673]
  - - [3584, 5056, 1, 3328]
    - [20, 88.032]
  - - [2368, 2368, 1, 32]
    - [5, 8.086]
  - - [64, 5888, 1, 32]
    - [12, 1.171]
  - - [1856, 448, 1, 256]
    - [26, 15.572]
  - - [128, 1024, 1, 256]
    - [51, 3.049]
  - - [3584, 64, 1, 3328]
    - [16, 23.119]
  - - [5888, 2944, 1, 32]
    - [30, 9.3]
  - - [2944, 1, 1, 1280]
    - [36, 0.293]
  - - [1856, 2944, 1, 32]
    - [40, 7.842]
  - - [5056, 1408, 1, 1]
    - [5, 0.216]
  - - [5888, 1408, 1, 3328]
    - [20, 79.847]
  - - [448, 4288, 1, 256]
    - [33, 23.985]
  - - [6784, 1024, 1, 1]
    - [68, 0.21]
  - - [256, 448, 1, 1]
    - [12, 0.011]
  - - [128, 5888, 1, 3328]
    - [6, 53.622]
  - - [6784, 1024, 1, 32]
    - [30, 7.901]
  - - [256, 448, 1, 32]
    - [57, 0.405]
  - - [6784, 3584, 1, 1]
    - [157, 0.248]
  - - [2944, 2368, 1, 32]
    - [30, 7.757]
  - - [3584, 6784, 1, 3328]
    - [20, 87.954]
  - - [448, 128, 1, 1280]
    - [7, 5.824]
  - - [64, 3584, 1, 32]
    - [12, 0.773]
  - - [64, 3584, 1, 1280]
    - [60, 15.98]
  - - [6784, 1408, 1, 256]
    - [45, 39.583]
  - - [5056, 1024, 1, 32]
    - [5, 7.745]
  - - [1024, 5056, 1, 1280]
    - [15, 71.93]
  - - [4288, 3584, 1, 256]
    - [45, 46.955]
  - - [2368, 256, 1, 3328]
    - [142, 47.06]
  - - [448, 6784, 1, 1280]
    - [42, 60.874]
  - - [1856, 5888, 1, 1]
    - [40, 0.24]
  - - [256, 5888, 1, 32]
    - [30, 3.697]
  - - [3584, 1, 1, 3328]
    - [36, 0.625]
  - - [4288, 32, 1, 256]
    - [10, 3.326]
  - - [256, 64, 1, 1]
    - [46, 0.002]
  - - [4288, 5056, 1, 32]
    - [5, 11.361]
  - - [4288, 5056, 1, 3328]
    - [20, 87.267]
  - - [1856, 5888, 1, 32]
    - [8, 9.974]
  - - [1856, 5888, 1, 1280]
    - [15, 74.761]
  - - [256, 256, 1, 1280]
    - [36, 6.563]
  - - [704, 2368, 1, 1280]
    - [44, 56.97]
  - - [4288, 2368, 1, 1280]
    - [20, 76.069]
  - - [2944, 5056, 1, 256]
    - [45, 46.463]
  - - [32, 1856, 1, 256]
    - [19, 1.647]
  - - [64, 5888, 1, 1280]
    - [16, 23.835]
  - - [1, 1856, 1, 1280]
    - [17, 0.177]
  - - [2944, 4288, 1, 1]
    - [38, 0.222]
  - - [5056, 5888, 1, 32]
    - [5, 12.005]
  - - [704, 1, 1, 3328]
    - [21, 0.135]
  - - [448, 256, 1, 1280]
    - [158, 9.088]
  - - [1408, 256, 1, 1]
    - [30, 0.032]
  - - [2368, 5056, 1, 3328]
    - [114, 83.055]
  - - [1024, 5056, 1, 3328]
    - [15, 85.105]
  - - [704, 704, 1, 1280]
    - [26, 27.28]
  - - [128, 32, 1, 3328]
    - [29, 0.784]
  - - [1024, 6784, 1, 32]
    - [30, 7.901]
  - - [3584, 2944, 1, 3328]
    - [20, 87.16]
  - - [128, 1856, 1, 256]
    - [159, 5.076]
  - - [32, 32, 1, 1280]
    - [0, 0.107]
  - - [1408, 5888, 1, 1]
    - [48, 0.201]
  - - [1, 3584, 1, 256]
    - [23, 0.096]
  - - [704, 4288, 1, 32]
    - [5, 6.184]
  - - [1408, 5888, 1, 32]
    - [30, 8.144]
  - - [6784, 1024, 1, 3328]
    - [3, 82.349]
  - - [1856, 1, 1, 3328]
    - [21, 0.348]
  - - [5056, 1408, 1, 256]
    - [42, 40.901]
  - - [1, 1, 1, 256]
    - [23, 0.0]
  - - [2944, 1408, 1, 256]
    - [42, 33.026]
  - - [4288, 1, 1, 1]
    - [11, 0.0]
  - - [2368, 2368, 1, 256]
    - [76, 37.351]
  - - [1, 448, 1, 256]
    - [23, 0.013]
  - - [1408, 6784, 1, 1]
    - [38, 0.208]
  - - [3584, 32, 1, 3328]
    - [59, 14.931]
  - - [128, 3584, 1, 1]
    - [92, 0.038]
  - - [1856, 1, 1, 256]
    - [2, 0.051]
  - - [6784, 6784, 1, 1280]
    - [20, 84.472]
  - - [1024, 5888, 1, 1]
    - [121, 0.185]
  - - [6784, 32, 1, 3328]
    - [7, 21.591]
  - - [1408, 32, 1, 256]
    - [36, 1.226]
  - - [128, 3584, 1, 32]
    - [12, 1.402]
  - - [1856, 3584, 1, 256]
    - [42, 39.075]
  - - [2944, 64, 1, 256]
    - [10, 4.418]
  - - [2368, 704, 1, 32]
    - [5, 4.324]
  - - [256, 5888, 1, 1280]
    - [32, 51.755]
  - - [448, 2368, 1, 32]
    - [8, 3.036]
  - - [448, 2368, 1, 3328]
    - [35, 59.636]
  - - [64, 1408, 1, 256]
    - [160, 2.363]
  - - [5056, 32, 1, 32]
    - [46, 0.545]
  - - [1024, 704, 1, 3328]
    - [6, 55.847]
  - - [32, 5888, 1, 3328]
    - [10, 19.789]
  - - [256, 64, 1, 3328]
    - [0, 3.2]
  - - [32, 1408, 1, 1280]
    - [19, 4.481]
  - - [64, 32, 1, 256]
    - [0, 0.058]
  - - [1856, 1024, 1, 3328]
    - [161, 64.665]
  - - [2368, 1, 1, 1]
    - [11, 0.0]
  - - [5056, 2368, 1, 3328]
    - [4, 82.886]
  - - [128, 1, 1, 1280]
    - [19, 0.013]
  - - [704, 4288, 1, 1280]
    - [42, 61.057]
  - - [704, 256, 1, 256]
    - [10, 4.296]
  - - [512, 128, 1, 784]
    - [162, 3.446]
  - - [1024, 256, 1, 196]
    - [132, 3.911]
  - - [256, 64, 1, 3136]
    - [94, 2.27]
  - - [256, 1024, 1, 196]
    - [92, 3.911]
  - - [64, 256, 1, 3136]
    - [94, 2.288]
  - - [128, 512, 1, 784]
    - [119, 3.466]
  - - [64, 64, 1, 3136]
    - [94, 0.563]
  - - [2560, 7000, 1, 2560]
    - [20, 85.501]
  - - [7680, 12000, 1, 2560]
    - [20, 90.91]
  - - [5124, 9124, 1, 1760]
    - [163, 82.513]
  - - [1760, 32, 1, 1760]
    - [164, 5.031]
  - - [512, 24000, 1, 1536]
    - [42, 75.783]
  - - [3072, 24000, 1, 1024]
    - [20, 84.217]
  - - [2048, 400, 1, 512]
    - [26, 23.052]
  - - [2560, 128, 1, 2560]
    - [60, 32.703]
  - - [3072, 16, 1, 1024]
    - [39, 4.08]
  - - [512, 48000, 1, 2816]
    - [15, 86.099]
  - - [512, 48000, 1, 2048]
    - [15, 84.928]
  - - [1760, 64, 1, 1760]
    - [162, 9.927]
  - - [2048, 1600, 1, 2048]
    - [6, 70.53]
  - - [512, 48000, 1, 1536]
    - [15, 78.729]
  - - [2560, 32, 1, 2560]
    - [36, 12.436]
  - - [8448, 5984, 1, 2816]
    - [20, 89.918]
  - - [4096, 3200, 1, 1024]
    - [20, 75.874]
  - - [1024, 24000, 1, 2560]
    - [15, 86.348]
  - - [1760, 6400, 1, 1760]
    - [48, 75.027]
  - - [5124, 9124, 1, 2048]
    - [165, 86.395]
  - - [1024, 700, 1, 512]
    - [33, 23.36]
  - - [4608, 32, 1, 1536]
    - [59, 13.019]
  - - [3072, 64, 1, 1024]
    - [166, 12.815]
  - - [16384, 3200, 1, 4096]
    - [20, 90.007]
  - - [2560, 16, 1, 2560]
    - [21, 6.421]
  - - [1024, 48000, 1, 2560]
    - [15, 89.301]
  - - [8448, 48000, 1, 2816]
    - [20, 92.43]
  - - [2048, 32, 1, 2048]
    - [39, 9.001]
  - - [2560, 3200, 1, 2560]
    - [20, 76.046]
  - - [16384, 800, 1, 4096]
    - [72, 82.553]
  - - [4608, 24000, 1, 1536]
    - [20, 88.587]
  - - [7680, 48000, 1, 2560]
    - [124, 92.503]
  - - [3072, 48000, 1, 1024]
    - [20, 85.508]
  - - [1760, 16, 1, 1760]
    - [164, 2.561]
  - - [8192, 3200, 1, 2048]
    - [20, 86.09]
  - - [512, 24000, 1, 2816]
    - [42, 81.902]
  - - [4096, 400, 1, 1024]
    - [104, 40.132]
  - - [6144, 48000, 1, 2560]
    - [124, 92.037]
  - - [4608, 48000, 1, 1536]
    - [20, 89.677]
  - - [4096, 128, 1, 4096]
    - [126, 42.596]
  - - [2048, 800, 1, 512]
    - [32, 36.918]
  - - [4608, 5984, 1, 1536]
    - [20, 83.775]
  - - [4096, 1600, 1, 1024]
    - [124, 69.493]
  - - [6144, 5984, 1, 2048]
    - [20, 87.592]
  - - [7680, 24000, 1, 2560]
    - [124, 91.956]
  - - [6144, 48000, 1, 2048]
    - [124, 91.957]
  - - [2048, 3200, 1, 2048]
    - [15, 82.094]
  - - [5124, 9124, 1, 2560]
    - [165, 86.576]
  - - [1024, 24000, 1, 1536]
    - [15, 81.568]
  - - [7680, 16, 1, 2560]
    - [10, 12.436]
  - - [2560, 6400, 1, 2560]
    - [20, 84.099]
  - - [2048, 128, 1, 2048]
    - [67, 23.814]
  - - [512, 16, 1, 500000]
    - [167, 6.724]
  - - [1024, 8, 1, 500000]
    - [168, 4.649]
  - - [512, 24000, 1, 2560]
    - [42, 81.157]
  - - [1024, 24000, 1, 2816]
    - [15, 87.245]
  - - [7680, 5984, 1, 2560]
    - [20, 88.811]
  - - [2048, 1600, 1, 512]
    - [42, 45.99]
  - - [2048, 7000, 1, 2048]
    - [20, 84.861]
  - - [1760, 800, 1, 1760]
    - [169, 50.487]
  - - [4096, 64, 1, 4096]
    - [146, 27.494]
  - - [7680, 32, 1, 2560]
    - [7, 16.917]
  - - [2560, 64, 1, 2560]
    - [51, 17.502]
  - - [3072, 128, 1, 1024]
    - [170, 23.505]
  - - [7680, 64, 1, 2560]
    - [42, 30.953]
  - - [1760, 128, 1, 1760]
    - [87, 15.897]
  - - [2560, 1600, 1, 2560]
    - [4, 73.332]
  - - [2048, 3200, 1, 512]
    - [143, 58.071]
  - - [2560, 800, 1, 2560]
    - [72, 67.124]
  - - [3072, 32, 1, 1024]
    - [7, 7.715]
  - - [6144, 32, 1, 2560]
    - [59, 18.117]
  - - [4608, 12000, 1, 1536]
    - [20, 87.052]
  - - [4096, 32, 1, 4096]
    - [51, 15.009]
  - - [6144, 24000, 1, 2048]
    - [124, 91.121]
  - - [8192, 800, 1, 2048]
    - [4, 74.712]
  - - [5124, 9124, 1, 4096]
    - [165, 90.951]
  - - [8448, 24000, 1, 2816]
    - [20, 92.339]
  - - [1024, 48000, 1, 1536]
    - [15, 84.847]
  - - [7680, 128, 1, 2560]
    - [35, 45.953]
  - - [8192, 1600, 1, 2048]
    - [9, 83.132]
  - - [4096, 800, 1, 1024]
    - [32, 60.007]
  - - [1024, 16, 1, 500000]
    - [171, 8.65]
  - - [2048, 800, 1, 2048]
    - [32, 65.405]
  - - [1760, 3200, 1, 1760]
    - [172, 68.809]
  - - [512, 48000, 1, 2560]
    - [15, 85.104]
  - - [8448, 16, 1, 2816]
    - [59, 13.035]
  - - [2048, 64, 1, 2048]
    - [58, 12.707]
  - - [512, 24000, 1, 2048]
    - [15, 79.711]
  - - [16384, 1600, 1, 4096]
    - [9, 88.736]
  - - [4608, 16, 1, 1536]
    - [36, 7.505]
  - - [1024, 24000, 1, 2048]
    - [13, 85.827]
  - - [8192, 400, 1, 2048]
    - [9, 65.746]
  - - [2048, 6400, 1, 2048]
    - [15, 84.715]
  - - [6144, 12000, 1, 2048]
    - [20, 90.029]
  - - [512, 8, 1, 500000]
    - [173, 3.778]
  - - [1760, 7000, 1, 1760]
    - [174, 79.575]
  - - [1024, 48000, 1, 2816]
    - [15, 90.135]
  - - [6144, 16, 1, 2560]
    - [7, 11.525]
  - - [8448, 32, 1, 2816]
    - [7, 19.448]
  - - [4096, 7000, 1, 4096]
    - [20, 91.214]
  - - [4096, 16, 1, 4096]
    - [39, 11.499]
  - - [6144, 24000, 1, 2560]
    - [124, 91.426]
  - - [2048, 16, 1, 2048]
    - [39, 4.37]
  - - [8448, 12000, 1, 2816]
    - [20, 92.008]
  - - [16384, 400, 1, 4096]
    - [9, 74.564]
  - - [1760, 1600, 1, 1760]
    - [175, 60.826]
  - - [1024, 48000, 1, 2048]
    - [13, 88.923]
  - - [4096, 4096, 1, 4096]
    - [9, 89.734]
  - - [512, 512, 1, 512]
    - [24, 10.217]
  - - [1024, 1024, 1, 1024]
    - [33, 39.024]
  - - [2049, 512, 1, 2048]
    - [31, 42.995]
  - - [2048, 2048, 1, 2049]
    - [176, 58.189]
  - - [1023, 512, 1, 1024]
    - [177, 24.268]
  - - [8192, 8191, 1, 8192]
    - [20, 94.348]
  - - [511, 512, 1, 512]
    - [159, 8.983]
  - - [1024, 512, 1, 1025]
    - [178, 18.347]
  - - [8192, 8192, 1, 8192]
    - [20, 94.357]
  - - [1024, 1024, 1, 1023]
    - [179, 27.719]
  - - [1024, 1025, 1, 1024]
    - [33, 38.32]
  - - [512, 512, 1, 511]
    - [180, 7.584]
  - - [2047, 2048, 1, 2048]
    - [89, 62.65]
  - - [1024, 1023, 1, 1024]
    - [33, 38.489]
  - - [2048, 511, 1, 2048]
    - [9, 50.203]
  - - [2048, 2049, 1, 2048]
    - [42, 73.297]
  - - [8192, 8192, 1, 8191]
    - [181, 87.166]
  - - [2047, 512, 1, 2048]
    - [31, 42.878]
  - - [1025, 1024, 1, 1024]
    - [31, 36.473]
  - - [3072, 513, 1, 3072]
    - [32, 69.572]
  - - [512, 513, 1, 512]
    - [24, 10.595]
  - - [512, 511, 1, 512]
    - [51, 10.267]
  - - [8191, 8192, 1, 8192]
    - [165, 92.999]
  - - [8192, 8193, 1, 8192]
    - [20, 94.357]
  - - [4096, 4097, 1, 4096]
    - [9, 89.704]
  - - [8192, 8192, 1, 8193]
    - [181, 87.398]
  - - [4096, 4095, 1, 4096]
    - [9, 89.598]
  - - [4096, 4096, 1, 4097]
    - [182, 76.147]
  - - [1024, 1024, 1, 1025]
    - [183, 28.492]
  - - [513, 512, 1, 512]
    - [177, 9.411]
  - - [2048, 2048, 1, 2048]
    - [42, 73.096]
  - - [4095, 4096, 1, 4096]
    - [165, 86.669]
  - - [8193, 8192, 1, 8192]
    - [165, 93.148]
  - - [4096, 4096, 1, 4095]
    - [182, 75.983]
  - - [1025, 512, 1, 1024]
    - [41, 24.512]
  - - [1024, 512, 1, 1023]
    - [184, 17.617]
  - - [2048, 513, 1, 2048]
    - [15, 51.36]
  - - [3072, 511, 1, 3072]
    - [111, 67.076]
  - - [2049, 2048, 1, 2048]
    - [89, 65.115]
  - - [2048, 2047, 1, 2048]
    - [42, 72.35]
  - - [1024, 511, 1, 1024]
    - [26, 26.362]
  - - [2048, 512, 1, 2047]
    - [185, 37.033]
  - - [2048, 2048, 1, 2047]
    - [182, 56.701]
  - - [4097, 4096, 1, 4096]
    - [165, 86.964]
  - - [1024, 513, 1, 1024]
    - [26, 25.789]
  - - [512, 512, 1, 513]
    - [122, 7.81]
  - - [2048, 512, 1, 2049]
    - [185, 39.169]
  - - [1023, 1024, 1, 1024]
    - [31, 33.948]
  - - [15, 14, 1, 64]
    - [85, 0.002]
  - - [17, 15, 1, 64]
    - [85, 0.002]
  - - [21, 17, 1, 64]
    - [85, 0.003]
  - - [30, 31, 1, 64]
    - [85, 0.007]
  - - [32, 35, 1, 64]
    - [186, 0.009]
  - - [27, 33, 1, 64]
    - [75, 0.007]
  - - [2, 4, 1, 1024]
    - [108, 0.001]
  - - [2, 32, 1, 1024]
    - [187, 0.005]
  - - [2, 2048, 1, 1024]
    - [17, 0.333]
  - - [64, 128, 512, 128]
    - [31, 15.009]
  - - [64, 512, 1, 512]
    - [23, 1.658]
  - - [64, 512, 64, 512]
    - [6, 25.96]
  - - [128, 128, 512, 64]
    - [76, 12.025]
  - - [512, 512, 1, 64]
    - [26, 1.63]
  - - [512, 512, 64, 64]
    - [188, 16.572]
  - - [1024, 4, 1, 1024]
    - [0, 0.462]
  - - [1024, 4, 1, 1024]
    - [22, 0.288]
  - - [1024, 32, 1, 1024]
    - [22, 2.237]
  - - [1024, 2048, 1, 1024]
    - [33, 50.3]
  - - [1024, 2048, 1, 4096]
    - [72, 73.99]
  - - [1024, 4096, 1, 1024]
    - [42, 63.089]
  - - [1024, 4096, 1, 4096]
    - [71, 79.327]
  - - [4096, 2048, 1, 1024]
    - [20, 68.98]
  - - [4096, 4096, 1, 1024]
    - [20, 77.609]
  - - [30528, 2048, 1, 1024]
    - [20, 81.439]
  - - [30528, 4096, 1, 1024]
    - [20, 84.909]
  - - [27, 27, 32768, 128]
    - [10, 7.766]
  - - [32, 1600, 1, 512]
    - [19, 2.546]
  - - [33, 33, 1600, 32]
    - [12, 2.284]
  - - [64, 512, 1, 1024]
    - [7, 2.908]
  - - [64, 960, 1, 1024]
    - [17, 5.251]
  - - [128, 32768, 1, 256]
    - [32, 28.331]
  - - [256, 684, 1, 1024]
    - [58, 12.318]
  - - [256, 1280, 1, 1024]
    - [16, 20.325]
  - - [256, 1536, 1, 1024]
    - [16, 24.131]
  - - [256, 2304, 1, 1024]
    - [32, 28.353]
  - - [256, 2560, 1, 1024]
    - [28, 31.243]
  - - [256, 2816, 1, 1024]
    - [142, 34.226]
  - - [256, 3328, 1, 1024]
    - [189, 39.956]
  - - [256, 3584, 1, 1024]
    - [104, 34.479]
  - - [256, 4608, 1, 1024]
    - [9, 43.342]
  - - [256, 4864, 1, 1024]
    - [33, 43.4]
  - - [256, 5376, 1, 1024]
    - [32, 43.382]
  - - [256, 5888, 1, 1024]
    - [32, 47.384]
  - - [256, 6144, 1, 1024]
    - [42, 48.911]
  - - [256, 6400, 1, 1024]
    - [28, 50.54]
  - - [256, 6656, 1, 1024]
    - [32, 52.703]
  - - [256, 7168, 1, 1024]
    - [137, 43.741]
  - - [256, 7424, 1, 1024]
    - [104, 44.931]
  - - [256, 7936, 1, 1024]
    - [33, 47.447]
  - - [256, 8192, 1, 1024]
    - [104, 48.389]
  - - [256, 8448, 1, 1024]
    - [9, 51.024]
  - - [256, 8960, 1, 1024]
    - [9, 52.506]
  - - [256, 9984, 1, 1024]
    - [13, 58.622]
  - - [256, 10496, 1, 1024]
    - [9, 59.614]
  - - [256, 11264, 1, 1024]
    - [89, 51.339]
  - - [256, 11520, 1, 1024]
    - [42, 52.425]
  - - [256, 11776, 1, 1024]
    - [42, 53.262]
  - - [256, 12544, 1, 1024]
    - [42, 56.39]
  - - [256, 13312, 1, 1024]
    - [32, 58.945]
  - - [256, 14336, 1, 1024]
    - [13, 59.467]
  - - [256, 14592, 1, 1024]
    - [165, 60.786]
  - - [256, 14848, 1, 1024]
    - [13, 60.654]
  - - [256, 15104, 1, 1024]
    - [15, 62.829]
  - - [256, 16128, 1, 1024]
    - [42, 59.246]
  - - [256, 18176, 1, 1024]
    - [15, 59.186]
  - - [256, 18944, 1, 1024]
    - [15, 61.081]
  - - [256, 19200, 1, 1024]
    - [15, 62.109]
  - - [256, 20480, 1, 1024]
    - [13, 64.622]
  - - [256, 20992, 1, 1024]
    - [13, 64.92]
  - - [256, 21248, 1, 1024]
    - [42, 56.74]
  - - [256, 21504, 1, 1024]
    - [42, 58.054]
  - - [256, 22016, 1, 1024]
    - [42, 59.382]
  - - [256, 22344, 1, 1024]
    - [42, 59.667]
  - - [256, 23296, 1, 1024]
    - [42, 61.985]
  - - [256, 23552, 1, 1024]
    - [42, 62.273]
  - - [256, 31488, 1, 1024]
    - [13, 68.331]
  - - [256, 32768, 1, 512]
    - [32, 51.808]
  - - [256, 33536, 1, 1024]
    - [15, 64.526]
  - - [256, 44505, 1, 1024]
    - [15, 67.2]
  - - [512, 1600, 1, 512]
    - [33, 24.871]
  - - [512, 32768, 1, 13]
    - [27, 3.011]
  - - [512, 32768, 1, 1024]
    - [15, 73.905]
  - - [684, 8976, 1, 256]
    - [31, 33.348]
  - - [1024, 200, 1, 560]
    - [132, 7.3]
  - - [1024, 512, 1, 1024]
    - [26, 25.848]
  - - [1024, 512, 1, 1600]
    - [88, 32.146]
  - - [1024, 960, 1, 1024]
    - [190, 37.679]
  - - [1024, 960, 1, 1600]
    - [191, 47.129]
  - - [1024, 1600, 1, 560]
    - [192, 28.794]
  - - [1024, 1600, 1, 1024]
    - [32, 51.786]
  - - [1024, 32768, 1, 480]
    - [193, 66.226]
  - - [1024, 32768, 1, 1024]
    - [15, 80.783]
  - - [1280, 8976, 1, 256]
    - [45, 44.183]
  - - [1792, 8976, 1, 256]
    - [45, 48.732]
  - - [2048, 114, 1, 512]
    - [51, 9.288]
  - - [2048, 114, 1, 768]
    - [51, 12.169]
  - - [2048, 215, 1, 512]
    - [26, 16.282]
  - - [2048, 215, 1, 768]
    - [26, 19.242]
  - - [2048, 256, 1, 512]
    - [26, 18.784]
  - - [2048, 256, 1, 768]
    - [26, 23.145]
  - - [2048, 512, 1, 67]
    - [30, 4.602]
  - - [2048, 512, 1, 74]
    - [30, 5.204]
  - - [2048, 512, 1, 100]
    - [30, 6.284]
  - - [2048, 512, 1, 2048]
    - [15, 49.783]
  - - [2048, 684, 1, 512]
    - [32, 31.939]
  - - [2048, 684, 1, 768]
    - [32, 39.1]
  - - [2048, 960, 1, 74]
    - [194, 7.285]
  - - [2048, 960, 1, 2048]
    - [72, 61.889]
  - - [2048, 1536, 1, 512]
    - [42, 44.151]
  - - [2048, 1536, 1, 768]
    - [42, 51.649]
  - - [2048, 8976, 1, 256]
    - [45, 48.687]
  - - [2304, 8976, 1, 256]
    - [45, 49.377]
  - - [2560, 8976, 1, 256]
    - [45, 50.903]
  - - [2816, 8976, 1, 256]
    - [45, 50.347]
  - - [3072, 8976, 1, 256]
    - [45, 51.211]
  - - [3328, 8976, 1, 256]
    - [45, 51.561]
  - - [3840, 8976, 1, 256]
    - [45, 51.59]
  - - [4096, 8976, 1, 256]
    - [45, 51.079]
  - - [4352, 8976, 1, 256]
    - [45, 51.19]
  - - [4608, 8976, 1, 256]
    - [45, 51.598]
  - - [4864, 8976, 1, 256]
    - [115, 51.126]
  - - [5120, 8976, 1, 256]
    - [143, 51.456]
  - - [5376, 8976, 1, 256]
    - [45, 50.832]
  - - [5632, 8976, 1, 256]
    - [45, 50.609]
  - - [5888, 8976, 1, 256]
    - [143, 49.815]
  - - [6144, 8976, 1, 256]
    - [112, 50.4]
  - - [6400, 8976, 1, 256]
    - [13, 49.356]
  - - [7168, 8976, 1, 256]
    - [107, 48.912]
  - - [7936, 8976, 1, 256]
    - [20, 48.571]
  - - [8192, 8976, 1, 256]
    - [107, 49.402]
  - - [8448, 8976, 1, 256]
    - [20, 48.11]
  - - [8960, 8976, 1, 256]
    - [20, 48.085]
  - - [9472, 8976, 1, 256]
    - [9, 48.655]
  - - [9728, 8976, 1, 256]
    - [9, 48.497]
  - - [9984, 8976, 1, 256]
    - [195, 47.795]
  - - [10240, 8976, 1, 256]
    - [9, 49.248]
  - - [10496, 8976, 1, 256]
    - [9, 48.017]
  - - [11264, 8976, 1, 256]
    - [195, 48.368]
  - - [11776, 8976, 1, 256]
    - [195, 48.826]
  - - [12544, 8976, 1, 256]
    - [195, 48.798]
  - - [13312, 8976, 1, 256]
    - [195, 49.459]
  - - [13568, 8976, 1, 256]
    - [195, 48.403]
  - - [13824, 8976, 1, 256]
    - [195, 49.14]
  - - [15104, 8976, 1, 256]
    - [20, 49.062]
  - - [15360, 8976, 1, 256]
    - [195, 50.773]
  - - [15872, 8976, 1, 256]
    - [20, 48.947]
  - - [16128, 8976, 1, 256]
    - [195, 49.214]
  - - [17152, 8976, 1, 256]
    - [195, 49.548]
  - - [18176, 8976, 1, 256]
    - [195, 49.407]
  - - [18688, 8976, 1, 256]
    - [9, 49.882]
  - - [18944, 8976, 1, 256]
    - [195, 49.529]
  - - [19712, 8976, 1, 256]
    - [195, 49.579]
  - - [19968, 8976, 1, 256]
    - [195, 49.966]
  - - [20480, 8976, 1, 256]
    - [195, 50.703]
  - - [20992, 8976, 1, 256]
    - [195, 49.622]
  - - [21248, 8976, 1, 256]
    - [195, 49.696]
  - - [23552, 8976, 1, 256]
    - [195, 49.693]
  - - [28672, 8976, 1, 256]
    - [195, 50.63]
  - - [31488, 8976, 1, 256]
    - [195, 49.785]
  - - [33536, 8976, 1, 256]
    - [195, 49.989]
  - - [44505, 8976, 1, 256]
    - [165, 47.705]
  - - [15, 14, 10880, 64]
    - [12, 3.787]
  - - [17, 15, 7680, 64]
    - [12, 2.912]
  - - [21, 17, 6144, 64]
    - [196, 3.586]
  - - [30, 31, 2048, 64]
    - [92, 4.719]
  - - [32, 35, 4608, 64]
    - [197, 7.657]
  - - [1024, 3840, 1, 1024]
    - [165, 67.608]
  - - [1024, 3840, 1, 4096]
    - [13, 86.989]
  - - [1024, 3968, 1, 1024]
    - [42, 61.358]
  - - [1024, 3968, 1, 4096]
    - [71, 77.006]
  - - [1024, 6528, 1, 1024]
    - [15, 74.44]
  - - [1024, 6528, 1, 4096]
    - [13, 90.623]
  - - [1024, 7104, 1, 1024]
    - [15, 68.96]
  - - [1024, 7104, 1, 4096]
    - [13, 83.094]
  - - [1024, 7200, 1, 1024]
    - [15, 69.95]
  - - [1024, 7200, 1, 4096]
    - [13, 83.988]
  - - [1024, 8064, 1, 1024]
    - [4, 67.421]
  - - [1024, 8064, 1, 4096]
    - [114, 81.686]
  - - [1024, 8160, 1, 1024]
    - [15, 68.907]
  - - [1024, 8160, 1, 4096]
    - [13, 82.143]
  - - [1024, 9216, 1, 1024]
    - [15, 77.327]
  - - [1024, 9216, 1, 4096]
    - [13, 92.64]
  - - [1024, 9520, 1, 1024]
    - [4, 71.092]
  - - [1024, 9520, 1, 4096]
    - [4, 84.801]
  - - [1024, 10064, 1, 1024]
    - [15, 73.801]
  - - [1024, 10064, 1, 4096]
    - [13, 88.893]
  - - [1024, 10080, 1, 1024]
    - [15, 74.801]
  - - [1024, 10080, 1, 4096]
    - [13, 88.884]
  - - [1024, 10200, 1, 1024]
    - [15, 75.219]
  - - [1024, 10200, 1, 4096]
    - [13, 89.959]
  - - [4096, 3840, 1, 1024]
    - [20, 78.014]
  - - [4096, 3968, 1, 1024]
    - [20, 76.007]
  - - [4096, 6528, 1, 1024]
    - [20, 80.001]
  - - [4096, 7104, 1, 1024]
    - [20, 81.52]
  - - [4096, 7200, 1, 1024]
    - [20, 81.611]
  - - [4096, 8064, 1, 1024]
    - [20, 81.756]
  - - [4096, 8160, 1, 1024]
    - [20, 82.376]
  - - [4096, 9216, 1, 1024]
    - [20, 82.921]
  - - [4096, 9520, 1, 1024]
    - [20, 82.003]
  - - [4096, 10064, 1, 1024]
    - [20, 82.94]
  - - [4096, 10080, 1, 1024]
    - [20, 82.956]
  - - [4096, 10200, 1, 1024]
    - [20, 82.239]
  - - [42720, 3968, 1, 1024]
    - [20, 84.357]
  - - [42720, 6528, 1, 1024]
    - [20, 85.582]
  - - [42720, 7104, 1, 1024]
    - [20, 85.777]
  - - [42720, 7200, 1, 1024]
    - [20, 85.729]
  - - [42720, 9520, 1, 1024]
    - [20, 85.572]
  - - [42720, 10080, 1, 1024]
    - [20, 86.133]
  - - [27, 33, 1920, 64]
    - [99, 3.992]
  - - [1024, 3240, 1, 1024]
    - [32, 60.089]
  - - [1024, 3240, 1, 4096]
    - [52, 79.125]
  - - [1024, 3960, 1, 1024]
    - [4, 60.443]
  - - [1024, 3960, 1, 4096]
    - [4, 76.85]
  - - [4096, 3240, 1, 1024]
    - [20, 76.515]
  - - [4096, 3960, 1, 1024]
    - [20, 75.731]
  - - [42720, 3960, 1, 1024]
    - [20, 84.234]
  - - [7680, 8192, 1, 8192]
    - [20, 96.001]
  - - [3840, 4096, 1, 4096]
    - [9, 90.617]
  - - [1920, 2048, 1, 2048]
    - [9, 78.932]
  - - [480, 512, 1, 512]
    - [70, 9.388]
  - - [8192, 7680, 1, 8192]
    - [165, 95.811]
  - - [4096, 3840, 1, 4096]
    - [9, 91.106]
  - - [2048, 1920, 1, 2048]
    - [13, 79.309]
  - - [512, 480, 1, 512]
    - [70, 9.71]
  - - [2, 8, 1, 1024]
    - [0, 0.001]
  - - [512, 512, 16, 64]
    - [1, 11.722]
  - - [512, 512, 128, 64]
    - [150, 17.949]
  - - [1024, 77, 1, 1024]
    - [36, 6.451]
  - - [1024, 512, 1, 4096]
    - [63, 42.596]
  - - [4096, 512, 1, 1024]
    - [9, 50.093]
  - - [30522, 77, 1, 1024]
    - [165, 28.068]
  - - [30522, 616, 1, 1024]
    - [165, 70.472]
  - - [2, 10, 1, 1024]
    - [39, 0.002]
  - - [128, 128, 128, 64]
    - [177, 6.407]
  - - [128, 128, 160, 64]
    - [1, 9.794]
  - - [1024, 10, 1, 1024]
    - [79, 0.862]
  - - [1024, 200, 1, 1024]
    - [24, 13.2]
  - - [1024, 1280, 1, 1024]
    - [33, 45.274]
  - - [1024, 1280, 1, 4096]
    - [35, 72.613]
  - - [4096, 1280, 1, 1024]
    - [6, 65.462]
  - - [30522, 160, 1, 1024]
    - [89, 45.955]
  - - [30522, 200, 1, 1024]
    - [165, 47.298]
  - - [2, 39, 1, 1024]
    - [22, 0.006]
  - - [128, 128, 624, 64]
    - [89, 13.403]
  - - [1024, 39, 1, 1024]
    - [36, 3.388]
  - - [1024, 780, 1, 1024]
    - [32, 36.422]
  - - [1024, 4992, 1, 1024]
    - [15, 69.875]
  - - [1024, 4992, 1, 4096]
    - [13, 86.22]
  - - [4096, 4992, 1, 1024]
    - [20, 77.983]
  - - [30522, 780, 1, 1024]
    - [165, 73.204]
  - - [1024, 308, 1, 1024]
    - [60, 19.458]
  - - [30522, 308, 1, 1024]
    - [89, 60.187]
  - - [2, 40, 1, 1024]
    - [0, 0.007]
  - - [128, 128, 640, 64]
    - [198, 13.599]
  - - [1024, 40, 1, 1024]
    - [36, 3.475]
  - - [1024, 800, 1, 1024]
    - [199, 37.209]
  - - [1024, 5120, 1, 1024]
    - [15, 70.089]
  - - [1024, 5120, 1, 4096]
    - [13, 88.044]
  - - [4096, 5120, 1, 1024]
    - [20, 79.093]
  - - [30522, 800, 1, 1024]
    - [165, 73.322]
  - - [2, 41, 1, 1024]
    - [0, 0.007]
  - - [128, 128, 656, 64]
    - [89, 13.644]
  - - [1024, 41, 1, 1024]
    - [36, 3.588]
  - - [1024, 820, 1, 1024]
    - [189, 38.442]
  - - [1024, 5248, 1, 1024]
    - [15, 71.675]
  - - [1024, 5248, 1, 4096]
    - [13, 90.115]
  - - [4096, 5248, 1, 1024]
    - [20, 80.05]
  - - [30522, 820, 1, 1024]
    - [165, 75.253]
  - - [2, 5, 1, 1024]
    - [29, 0.001]
  - - [512, 512, 80, 64]
    - [27, 17.203]
  - - [1024, 5, 1, 1024]
    - [39, 0.444]
  - - [1024, 385, 1, 1024]
    - [58, 22.972]
  - - [1024, 2560, 1, 1024]
    - [15, 61.847]
  - - [1024, 2560, 1, 4096]
    - [13, 84.067]
  - - [4096, 2560, 1, 1024]
    - [20, 75.045]
  - - [30522, 385, 1, 1024]
    - [165, 63.35]
  - - [2, 6, 1, 1024]
    - [22, 0.001]
  - - [512, 512, 96, 64]
    - [200, 17.566]
  - - [1024, 6, 1, 1024]
    - [79, 0.545]
  - - [1024, 462, 1, 1024]
    - [26, 24.044]
  - - [1024, 3072, 1, 1024]
    - [42, 57.974]
  - - [1024, 3072, 1, 4096]
    - [52, 76.084]
  - - [4096, 3072, 1, 1024]
    - [20, 74.331]
  - - [30522, 462, 1, 1024]
    - [165, 69.612]
  - - [1024, 8, 1, 1024]
    - [22, 0.569]
  - - [1024, 160, 1, 1024]
    - [51, 11.319]
  - - [1024, 1024, 1, 4096]
    - [13, 60.563]
  - - [4096, 1024, 1, 1024]
    - [6, 61.721]
  - - [2, 9, 1, 1024]
    - [22, 0.001]
  - - [128, 128, 144, 64]
    - [1, 9.246]
  - - [1024, 9, 1, 1024]
    - [201, 0.793]
  - - [1024, 180, 1, 1024]
    - [51, 12.436]
  - - [1024, 1152, 1, 1024]
    - [9, 43.76]
  - - [1024, 1152, 1, 4096]
    - [165, 69.614]
  - - [4096, 1152, 1, 1024]
    - [165, 63.894]
  - - [30522, 180, 1, 1024]
    - [89, 49.326]
  - - [1024, 32768, 1, 479]
    - [202, 51.99]
  - - [1024, 8192, 1, 1024]
    - [15, 67.963]
  - - [1024, 8192, 1, 4096]
    - [52, 83.09]
  - - [1024, 9600, 1, 1024]
    - [42, 72.329]
  - - [1024, 9600, 1, 4096]
    - [32, 85.514]
  - - [4096, 8192, 1, 1024]
    - [20, 81.687]
  - - [4096, 9600, 1, 1024]
    - [20, 82.919]
  - - [33712, 8192, 1, 1024]
    - [20, 87.413]
  - - [33712, 9600, 1, 1024]
    - [20, 87.799]
  - - [128, 128, 1, 64]
    - [18, 0.127]
  - - [64, 128, 1, 128]
    - [10, 0.122]
  - - [2, 1024, 1, 1024]
    - [25, 0.183]
  - - [33, 33, 1, 32]
    - [85, 0.004]
  - - [480, 1024, 1, 1024]
    - [26, 24.763]
  - - [480, 2048, 1, 2048]
    - [35, 48.57]
  - - [1024, 480, 1, 1024]
    - [177, 24.338]
  - - [2048, 480, 1, 2048]
    - [15, 48.99]
  - - [1024, 1024, 128, 96]
    - [100, 27.96]
  - - [30592, 4096, 1, 1024]
    - [20, 84.029]
  - - [64, 1024, 256, 1024]
    - [113, 38.875]
  - - [1536, 8192, 1, 1536]
    - [42, 78.413]
  - - [2048, 2, 1, 2048]
    - [7, 0.559]
  - - [3072, 8192, 1, 1024]
    - [20, 79.414]
  - - [3072, 2048, 1, 1024]
    - [9, 68.54]
  - - [50304, 8192, 1, 1024]
    - [20, 84.539]
  - - [64, 512, 40, 512]
    - [33, 26.344]
  - - [2048, 1024, 1, 8192]
    - [203, 72.985]
  - - [96, 1024, 64, 1024]
    - [35, 46.798]
  - - [1024, 16, 1, 1024]
    - [22, 1.153]
  - - [50304, 2048, 1, 1024]
    - [20, 81.341]
  - - [1536, 8192, 1, 6144]
    - [114, 92.66]
  - - [50304, 4096, 1, 1536]
    - [20, 88.238]
  - - [8192, 1024, 1, 2048]
    - [20, 77.176]
  - - [2, 4, 1, 2560]
    - [29, 0.001]
  - - [2560, 2048, 1, 640]
    - [15, 58.977]
  - - [1024, 1024, 128, 64]
    - [200, 19.52]
  - - [2048, 1024, 1, 2048]
    - [9, 60.944]
  - - [1536, 4096, 1, 1536]
    - [42, 75.819]
  - - [1024, 1024, 64, 64]
    - [56, 19.134]
  - - [30592, 8192, 1, 1024]
    - [20, 84.803]
  - - [50304, 16384, 1, 1024]
    - [20, 85.037]
  - - [4608, 4096, 1, 1536]
    - [20, 80.174]
  - - [2560, 2048, 1, 2560]
    - [15, 82.317]
  - - [7680, 2048, 1, 2560]
    - [9, 85.707]
  - - [2, 16, 1, 1024]
    - [7, 0.003]
  - - [50304, 4096, 1, 1024]
    - [20, 84.012]
  - - [64, 1024, 128, 1024]
    - [204, 39.166]
  - - [1920, 2048, 1, 2560]
    - [9, 80.893]
  - - [1024, 1024, 64, 96]
    - [205, 27.401]
  - - [64, 1024, 32, 1024]
    - [206, 33.144]
  - - [6144, 4096, 1, 1536]
    - [20, 84.009]
  - - [64, 512, 128, 512]
    - [207, 29.65]
  - - [1536, 4096, 1, 6144]
    - [28, 88.212]
  - - [512, 512, 256, 64]
    - [208, 18.939]
  - - [96, 1024, 128, 1024]
    - [35, 47.643]
  - - [50304, 8192, 1, 1536]
    - [20, 88.767]
  - - [6144, 8192, 1, 1536]
    - [20, 86.418]
  - - [4096, 16384, 1, 1024]
    - [20, 84.467]
  - - [30592, 1024, 1, 2048]
    - [9, 86.752]
  - - [2, 2, 1, 2048]
    - [25, 0.001]
  - - [1024, 16384, 1, 4096]
    - [13, 89.797]
  - - [64, 512, 256, 512]
    - [209, 33.008]
  - - [512, 512, 40, 64]
    - [200, 15.621]
  - - [6144, 1024, 1, 2048]
    - [9, 79.457]
  - - [4608, 8192, 1, 1536]
    - [20, 84.4]
  - - [30592, 2048, 1, 1024]
    - [20, 80.816]
  - - [3072, 16384, 1, 1024]
    - [20, 83.036]
  - - [1024, 1024, 256, 64]
    - [200, 19.749]
  - - [64, 1024, 64, 1024]
    - [6, 36.77]
  - - [1024, 16384, 1, 1024]
    - [20, 76.961]
  - - [1024, 1024, 32, 64]
    - [210, 18.246]
  - - [3072, 4096, 1, 1024]
    - [20, 68.898]
  - - [2560, 4, 1, 2560]
    - [36, 1.596]
  - - [960, 1024, 1, 1024]
    - [33, 37.931]
  - - [1024, 1, 1, 1024]
    - [22, 0.07]
  - - [32768, 1, 1, 256]
    - [10, 0.487]
  - - [512, 1, 1, 2048]
    - [21, 0.076]
  - - [1600, 1, 1, 1024]
    - [21, 0.135]
  - - [200, 1, 1, 1024]
    - [36, 0.018]
  - - [960, 1, 1, 2048]
    - [0, 0.14]
  - - [1024, 64, 1, 1024]
    - [22, 4.345]
  - - [30528, 8192, 1, 1024]
    - [20, 85.625]
  - - [128, 128, 1024, 64]
    - [42, 14.215]
  - - [64, 128, 1024, 128]
    - [206, 16.709]
  - - [1024, 3456, 1, 1024]
    - [42, 64.398]
  - - [1024, 3456, 1, 480]
    - [211, 47.024]
  - - [1024, 4096, 1, 480]
    - [212, 44.738]
  - - [1024, 6912, 1, 1024]
    - [42, 69.852]
  - - [1024, 6912, 1, 480]
    - [213, 54.063]
  - - [1024, 864, 1, 1024]
    - [214, 34.367]
  - - [1024, 864, 1, 480]
    - [194, 20.623]
  - - [128, 3456, 1, 256]
    - [151, 9.179]
  - - [128, 4096, 1, 256]
    - [131, 10.801]
  - - [128, 55296, 1, 256]
    - [45, 32.301]
  - - [128, 6912, 1, 256]
    - [32, 15.751]
  - - [128, 864, 1, 256]
    - [94, 2.703]
  - - [256, 3456, 1, 512]
    - [42, 26.581]
  - - [256, 4096, 1, 512]
    - [33, 26.883]
  - - [256, 55296, 1, 512]
    - [32, 55.398]
  - - [256, 6912, 1, 512]
    - [89, 38.959]
  - - [256, 864, 1, 512]
    - [58, 8.922]
  - - [3456, 1, 1, 256]
    - [36, 0.091]
  - - [4096, 1, 1, 256]
    - [36, 0.107]
  - - [512, 3456, 1, 1024]
    - [32, 55.323]
  - - [512, 3456, 1, 13]
    - [1, 1.393]
  - - [512, 4096, 1, 1024]
    - [42, 49.886]
  - - [512, 4096, 1, 13]
    - [5, 1.513]
  - - [512, 55296, 1, 13]
    - [27, 3.336]
  - - [512, 6912, 1, 1024]
    - [42, 64.196]
  - - [512, 6912, 1, 13]
    - [48, 2.025]
  - - [512, 864, 1, 1024]
    - [58, 25.517]
  - - [512, 864, 1, 13]
    - [55, 0.491]
  - - [6912, 1, 1, 256]
    - [59, 0.165]
  - - [864, 1, 1, 256]
    - [2, 0.024]
  - - [30528, 640, 1, 1024]
    - [93, 74.343]
  - - [30528, 1280, 1, 1024]
    - [20, 79.72]
  - - [30528, 1600, 1, 1024]
    - [20, 79.414]
  - - [1024, 10240, 1, 1024]
    - [15, 75.185]
  - - [1024, 80, 1, 1024]
    - [7, 7.214]
  - - [4096, 10240, 1, 1024]
    - [20, 82.225]
  - - [1024, 10240, 1, 4096]
    - [13, 90.346]
  - - [64, 128, 1280, 128]
    - [33, 17.087]
  - - [128, 128, 1280, 64]
    - [89, 14.71]
  - - [1024, 10496, 1, 4096]
    - [13, 92.467]
  - - [30528, 1640, 1, 1024]
    - [20, 79.005]
  - - [1024, 82, 1, 1024]
    - [7, 6.59]
  - - [4096, 10496, 1, 1024]
    - [20, 82.928]
  - - [1024, 10496, 1, 1024]
    - [15, 76.684]
  - - [64, 128, 1312, 128]
    - [109, 17.014]
  - - [128, 128, 1312, 64]
    - [198, 14.918]
  - - [30528, 160, 1, 1024]
    - [9, 49.044]
  - - [1024, 12, 1, 1024]
    - [19, 1.027]
  - - [30528, 240, 1, 1024]
    - [113, 60.55]
  - - [1024, 6144, 1, 1024]
    - [15, 70.062]
  - - [4096, 6144, 1, 1024]
    - [20, 80.381]
  - - [1024, 6144, 1, 4096]
    - [13, 85.62]
  - - [64, 512, 192, 512]
    - [207, 31.863]
  - - [512, 512, 192, 64]
    - [215, 18.583]
  - - [2, 64, 1, 1024]
    - [22, 0.011]
  - - [2, 80, 1, 1024]
    - [7, 0.015]
  - - [2, 82, 1, 1024]
    - [135, 0.015]
  - - [2, 12, 1, 1024]
    - [39, 0.002]
  - - [2, 1, 1, 1024]
    - [0, 0.0]
  - - [1, 4096, 1, 256]
    - [23, 0.109]
  - - [1, 6912, 1, 256]
    - [10, 0.175]
  - - [1024, 10224, 1, 1024]
    - [15, 74.975]
  - - [1024, 10192, 1, 1024]
    - [15, 75.254]
  - - [1024, 10208, 1, 1024]
    - [15, 74.672]
  - - [1024, 10224, 1, 4096]
    - [13, 90.188]
  - - [4096, 10224, 1, 1024]
    - [20, 82.362]
  - - [3072, 10224, 1, 1024]
    - [20, 80.72]
  - - [3072, 10240, 1, 1024]
    - [20, 80.559]
  - - [1024, 10192, 1, 4096]
    - [13, 89.939]
  - - [4096, 10192, 1, 1024]
    - [20, 82.245]
  - - [3072, 10192, 1, 1024]
    - [20, 80.057]
  - - [3072, 10200, 1, 1024]
    - [20, 80.855]
  - - [1024, 10184, 1, 1024]
    - [15, 74.774]
  - - [3072, 10208, 1, 1024]
    - [20, 80.702]
  - - [1024, 10208, 1, 4096]
    - [13, 90.198]
  - - [4096, 10208, 1, 1024]
    - [20, 82.36]
  - - [2048, 10224, 1, 1024]
    - [20, 78.687]
  - - [2048, 10240, 1, 1024]
    - [20, 78.887]
  - - [1024, 10120, 1, 1024]
    - [15, 74.351]
  - - [2048, 10192, 1, 1024]
    - [20, 78.009]
  - - [1024, 10152, 1, 1024]
    - [15, 74.725]
  - - [3072, 10080, 1, 1024]
    - [20, 81.676]
  - - [1024, 2048, 1, 49]
    - [1, 5.385]
  - - [1024, 512, 1, 196]
    - [30, 6.692]
  - - [1152, 128, 1, 784]
    - [51, 7.002]
  - - [2048, 512, 1, 49]
    - [30, 3.618]
  - - [2304, 256, 1, 196]
    - [5, 7.529]
  - - [256, 128, 1, 3136]
    - [216, 4.522]
  - - [256, 512, 1, 784]
    - [132, 6.191]
  - - [4608, 512, 1, 49]
    - [217, 6.03]
  - - [512, 1024, 1, 196]
    - [30, 6.771]
  - - [512, 2048, 1, 49]
    - [30, 3.508]
  - - [512, 256, 1, 784]
    - [58, 6.258]
  - - [576, 64, 1, 3136]
    - [218, 5.088]
  - - [128, 128, 49, 12800]
    - [64, 45.154]
  - - [128, 128, 25, 25088]
    - [16, 43.854]
  - - [128, 128, 49, 25600]
    - [219, 46.107]
  - - [128, 128, 25, 50176]
    - [170, 44.918]
  - - [256, 256, 25, 12544]
    - [114, 83.232]
  - - [256, 256, 49, 3200]
    - [220, 72.044]
  - - [256, 256, 25, 6272]
    - [52, 78.545]
  - - [256, 256, 49, 6400]
    - [220, 78.92]
  - - [512, 512, 49, 1152]
    - [13, 65.482]
  - - [512, 512, 25, 2048]
    - [32, 71.261]
  - - [512, 512, 49, 2304]
    - [15, 74.427]
  - - [512, 512, 25, 4096]
    - [52, 80.093]
  - - [64, 128, 2048, 128]
    - [31, 17.294]
  - - [128, 128, 2048, 64]
    - [42, 15.629]
  - - [30528, 2560, 1, 1024]
    - [20, 83.639]
  - - [1024, 128, 1, 1024]
    - [51, 9.055]
  - - [64, 128, 1536, 128]
    - [31, 17.135]
  - - [128, 128, 1536, 64]
    - [32, 15.274]
  - - [1024, 12288, 1, 1024]
    - [15, 73.764]
  - - [1024, 12288, 1, 4096]
    - [114, 89.568]
  - - [30528, 1920, 1, 1024]
    - [20, 82.891]
  - - [1024, 96, 1, 1024]
    - [7, 7.768]
  - - [4096, 12288, 1, 1024]
    - [20, 83.731]
  - - [128, 128, 36, 12544]
    - [32, 41.888]
  - - [128, 128, 49, 9216]
    - [28, 45.059]
  - - [128, 128, 64, 6400]
    - [221, 43.205]
  - - [128, 128, 81, 12544]
    - [221, 47.16]
  - - [128, 128, 121, 9216]
    - [60, 41.686]
  - - [128, 128, 169, 6400]
    - [3, 46.302]
  - - [256, 256, 36, 4096]
    - [15, 73.071]
  - - [256, 256, 49, 2304]
    - [220, 67.17]
  - - [256, 256, 64, 2304]
    - [32, 63.857]
  - - [256, 256, 81, 4096]
    - [3, 82.649]
  - - [256, 256, 121, 2304]
    - [32, 66.53]
  - - [256, 256, 169, 2304]
    - [114, 66.705]
  - - [512, 512, 81, 1024]
    - [222, 69.299]
  - - [512, 512, 121, 1024]
    - [222, 69.69]
  - - [512, 512, 169, 1024]
    - [13, 71.215]
  - - [512, 512, 36, 1024]
    - [15, 64.271]
  - - [512, 512, 49, 1024]
    - [15, 65.369]
  - - [512, 512, 64, 1024]
    - [13, 66.721]
  - - [64, 64, 36, 50176]
    - [22, 23.008]
  - - [64, 64, 49, 36864]
    - [22, 29.985]
  - - [64, 64, 64, 25600]
    - [36, 26.226]
  - - [128, 128, 192, 64]
    - [177, 8.188]
  - - [64, 128, 192, 128]
    - [74, 11.876]
  - - [768, 2048, 1, 768]
    - [42, 43.76]
  - - [3072, 2048, 1, 768]
    - [15, 63.373]
  - - [768, 2048, 1, 3072]
    - [52, 68.561]
  - - [768, 16, 1, 768]
    - [25, 0.677]
  - - [384, 384, 144, 64]
    - [223, 16.445]
  - - [64, 384, 144, 384]
    - [224, 27.147]
  - - [768, 4608, 1, 768]
    - [32, 57.776]
  - - [3072, 4608, 1, 768]
    - [20, 69.554]
  - - [768, 4608, 1, 3072]
    - [52, 80.795]
  - - [768, 12, 1, 768]
    - [158, 0.628]
  - - [512, 512, 48, 64]
    - [225, 16.173]
  - - [64, 512, 48, 512]
    - [207, 28.803]
  - - [768, 4, 1, 768]
    - [22, 0.166]
  - - [128, 128, 256, 64]
    - [188, 9.363]
  - - [64, 128, 256, 128]
    - [33, 12.344]
  - - [384, 384, 192, 64]
    - [223, 16.802]
  - - [64, 384, 192, 384]
    - [224, 25.972]
  - - [1024, 4608, 1, 1024]
    - [15, 64.272]
  - - [4096, 4608, 1, 1024]
    - [20, 79.762]
  - - [1024, 4608, 1, 4096]
    - [165, 79.472]
  - - [2880, 3072, 1, 3072]
    - [15, 84.078]
  - - [3072, 3072, 1, 3072]
    - [9, 88.278]
  - - [3072, 512, 1, 3072]
    - [155, 68.909]
  - - [4096, 512, 1, 4096]
    - [9, 67.536]
  - - [512, 1024, 1, 1024]
    - [26, 26.646]
  - - [512, 2048, 1, 2048]
    - [9, 50.196]
  - - [512, 3072, 1, 3072]
    - [52, 68.476]
  - - [512, 4096, 1, 4096]
    - [72, 73.206]
  - - [512, 8192, 1, 8192]
    - [72, 84.339]
  - - [64, 1024, 1, 1024]
    - [19, 5.559]
  - - [8192, 512, 1, 8192]
    - [4, 83.001]
  - - [147, 64, 1, 12544]
    - [226, 3.49]
  - - [2, 128, 1, 1024]
    - [0, 0.022]
  - - [2, 96, 1, 1024]
    - [7, 0.017]
  - - [2, 2048, 1, 768]
    - [25, 0.261]
  - - [2, 4608, 1, 768]
    - [23, 0.554]
  - - [2, 4608, 1, 1024]
    - [17, 0.704]
  - - [128, 128, 49, 1120]
    - [5, 29.708]
  - - [256, 256, 36, 432]
    - [38, 28.779]
  - - [128, 128, 49, 1064]
    - [32, 25.801]
  - - [128, 128, 49, 1040]
    - [32, 26.057]
  - - [256, 256, 36, 456]
    - [34, 28.791]
  - - [256, 256, 36, 504]
    - [102, 31.155]
  - - [256, 256, 49, 1120]
    - [174, 57.723]
  - - [256, 256, 36, 442]
    - [45, 28.379]
  - - [128, 128, 64, 600]
    - [1, 20.137]
  - - [128, 128, 64, 616]
    - [227, 20.385]
  - - [256, 256, 49, 950]
    - [228, 46.259]
  - - [256, 256, 64, 616]
    - [48, 36.478]
  - - [256, 256, 64, 660]
    - [48, 35.973]
  - - [128, 128, 49, 950]
    - [33, 23.869]
  - - [256, 256, 36, 408]
    - [66, 26.451]
  - - [128, 128, 49, 972]
    - [71, 24.354]
  - - [128, 128, 64, 560]
    - [1, 19.69]
  - - [256, 256, 49, 1008]
    - [229, 49.216]
  - - [128, 128, 49, 1008]
    - [145, 25.682]
  - - [128, 128, 64, 532]
    - [227, 18.271]
  - - [256, 256, 36, 462]
    - [45, 28.166]
  - - [128, 128, 49, 1080]
    - [32, 26.473]
  - - [128, 128, 64, 588]
    - [230, 18.876]
  - - [256, 256, 36, 468]
    - [143, 28.93]
  - - [256, 256, 36, 494]
    - [102, 30.186]
  - - [128, 128, 49, 1160]
    - [142, 27.042]
  - - [128, 128, 49, 988]
    - [63, 24.551]
  - - [128, 128, 49, 936]
    - [231, 24.539]
  - - [256, 80, 1, 784]
    - [119, 1.09]
  - - [256, 256, 1, 60800]
    - [232, 41.722]
  - - [256, 256, 1, 54400]
    - [232, 40.007]
  - - [256, 256, 1, 51520]
    - [232, 39.75]
  - - [256, 256, 1, 55296]
    - [232, 40.504]
  - - [1024, 256, 1, 3800]
    - [146, 25.565]
  - - [256, 256, 1, 56832]
    - [233, 40.661]
  - - [256, 256, 1, 45632]
    - [234, 37.815]
  - - [256, 256, 1, 49152]
    - [235, 33.113]
  - - [256, 128, 1, 13600]
    - [236, 10.548]
  - - [1024, 256, 1, 3400]
    - [146, 24.492]
  - - [256, 1024, 1, 3400]
    - [16, 24.023]
  - - [256, 128, 1, 12880]
    - [237, 9.886]
  - - [1024, 256, 1, 3220]
    - [67, 23.598]
  - - [256, 512, 1, 13600]
    - [238, 27.74]
  - - [256, 1024, 1, 3220]
    - [60, 23.599]
  - - [256, 256, 1, 43008]
    - [239, 37.625]
  - - [1024, 256, 1, 3456]
    - [120, 28.752]
  - - [256, 1024, 1, 3456]
    - [24, 28.275]
  - - [256, 512, 1, 15200]
    - [240, 30.456]
  - - [1024, 256, 1, 3072]
    - [146, 28.265]
  - - [128, 512, 1, 15200]
    - [241, 19.934]
  - - [256, 1024, 1, 3072]
    - [60, 27.411]
  - - [256, 512, 1, 12880]
    - [238, 28.388]
  - - [512, 128, 1, 15200]
    - [242, 19.054]
  - - [128, 512, 1, 11408]
    - [243, 15.26]
  - - [256, 128, 1, 13824]
    - [244, 11.023]
  - - [1024, 256, 1, 3552]
    - [16, 24.684]
  - - [256, 1024, 1, 3552]
    - [16, 25.463]
  - - [256, 512, 1, 13824]
    - [245, 31.699]
  - - [512, 256, 1, 13824]
    - [238, 32.098]
  - - [256, 1024, 1, 2852]
    - [67, 22.402]
  - - [1024, 256, 1, 2852]
    - [16, 21.993]
  - - [256, 128, 1, 10752]
    - [25, 9.729]
  - - [256, 128, 1, 10560]
    - [237, 9.151]
  - - [256, 512, 1, 10752]
    - [246, 27.375]
  - - [256, 1024, 1, 3800]
    - [60, 25.682]
  - - [256, 512, 1, 10560]
    - [245, 28.825]
  - - [256, 1024, 1, 2992]
    - [16, 23.502]
  - - [128, 512, 1, 11616]
    - [241, 15.972]
  - - [512, 1024, 1, 3800]
    - [142, 37.852]
  - - [256, 128, 1, 14208]
    - [237, 11.329]
  - - [256, 512, 1, 14208]
    - [238, 31.694]
  - - [512, 256, 1, 14208]
    - [238, 32.63]
  - - [128, 512, 1, 14208]
    - [247, 19.499]
  - - [256, 1024, 1, 2688]
    - [60, 26.374]
  - - [1024, 256, 1, 2688]
    - [146, 26.551]
  - - [256, 1024, 1, 2904]
    - [67, 23.307]
  - - [1024, 256, 1, 2904]
    - [16, 22.994]
  - - [256, 1024, 1, 2640]
    - [60, 22.799]
  - - [1024, 256, 1, 2640]
    - [60, 22.47]
  - - [1024, 256, 1, 4032]
    - [24, 32.012]
  - - [512, 1024, 1, 3400]
    - [111, 35.111]
  - - [1024, 256, 1, 2992]
    - [16, 23.377]
  - - [256, 128, 1, 15200]
    - [236, 11.291]
  - - [512, 128, 1, 11408]
    - [243, 15.095]
  - - [256, 1024, 1, 3360]
    - [60, 24.503]
  - - [1024, 256, 1, 3360]
    - [16, 23.798]
  - - [1024, 256, 1, 3500]
    - [67, 23.984]
  - - [256, 1024, 1, 3500]
    - [67, 24.265]
  - - [512, 1024, 1, 3456]
    - [199, 40.91]
  - - [512, 128, 1, 16800]
    - [242, 19.565]
  - - [1024, 256, 1, 3168]
    - [16, 23.392]
  - - [256, 1024, 1, 3168]
    - [16, 23.747]
  - - [256, 1024, 1, 3036]
    - [24, 22.417]
  - - [512, 1024, 1, 3072]
    - [88, 39.62]
  - - [1024, 256, 1, 4200]
    - [60, 26.225]
  - - [512, 256, 1, 15200]
    - [240, 30.456]
  - - [1024, 256, 1, 3600]
    - [60, 25.869]
  - - [128, 512, 1, 11264]
    - [17, 17.695]
  - - [2048, 512, 1, 950]
    - [15, 28.199]
  - - [256, 1024, 1, 3600]
    - [60, 26.253]
  - - [512, 128, 1, 11616]
    - [242, 15.651]
  - - [256, 1024, 1, 2944]
    - [16, 27.087]
  - - [1024, 256, 1, 2944]
    - [60, 27.516]
  - - [1024, 256, 1, 3700]
    - [67, 24.338]
  - - [512, 1024, 1, 3552]
    - [142, 35.203]
  - - [512, 128, 1, 16128]
    - [248, 20.184]
  - - [256, 1024, 1, 2352]
    - [16, 21.178]
  - - [1024, 256, 1, 2352]
    - [60, 21.114]
  - - [1024, 256, 1, 2816]
    - [120, 27.269]
  - - [256, 1024, 1, 3700]
    - [60, 24.779]
  - - [256, 1024, 1, 2816]
    - [16, 27.179]
  - - [256, 512, 1, 11408]
    - [238, 26.405]
  - - [1024, 256, 1, 3036]
    - [67, 22.874]
  - - [512, 1024, 1, 3220]
    - [219, 34.582]
  - - [1024, 256, 1, 3264]
    - [16, 29.212]
  - - [256, 1024, 1, 3264]
    - [24, 29.753]
  - - [2048, 512, 1, 850]
    - [15, 27.436]
  - - [1024, 256, 1, 3864]
    - [16, 25.473]
  - - [256, 1024, 1, 4032]
    - [60, 32.359]
  - - [512, 2048, 1, 864]
    - [194, 32.404]
  - - [512, 128, 1, 11968]
    - [243, 17.533]
  - - [512, 2048, 1, 768]
    - [33, 34.498]
  - - [128, 512, 1, 11968]
    - [249, 17.259]
  - - [1024, 256, 1, 3128]
    - [60, 23.329]
  - - [256, 1024, 1, 3128]
    - [67, 23.568]
  - - [256, 1024, 1, 3200]
    - [24, 27.962]
  - - [256, 512, 1, 11616]
    - [240, 26.39]
  - - [256, 128, 1, 11408]
    - [237, 9.318]
  - - [1024, 256, 1, 3200]
    - [146, 28.297]
  - - [2048, 512, 1, 805]
    - [15, 25.634]
  - - [256, 12, 1, 11408]
    - [250, 1.05]
  - - [1024, 256, 1, 4000]
    - [16, 25.794]
  - - [256, 1024, 1, 2520]
    - [67, 21.955]
  - - [1024, 256, 1, 2520]
    - [16, 21.636]
  - - [256, 1024, 1, 2976]
    - [251, 23.438]
  - - [256, 1024, 1, 2400]
    - [24, 20.726]
  - - [1024, 256, 1, 2400]
    - [251, 20.666]
  - - [512, 128, 1, 12288]
    - [7, 17.756]
  - - [1024, 256, 1, 3696]
    - [60, 25.504]
  - - [512, 1024, 1, 2852]
    - [111, 32.967]
  - - [1024, 256, 1, 3900]
    - [60, 24.665]
  - - [512, 2048, 1, 888]
    - [194, 28.277]
  - - [1024, 256, 1, 3772]
    - [67, 24.166]
  - - [2048, 512, 1, 864]
    - [194, 32.715]
  - - [256, 1024, 1, 3696]
    - [67, 25.625]
  - - [128, 512, 1, 12288]
    - [78, 17.652]
  - - [2048, 512, 1, 768]
    - [33, 33.48]
  - - [256, 1024, 1, 2728]
    - [60, 22.135]
  - - [1024, 256, 1, 2728]
    - [120, 21.954]
  - - [1024, 256, 1, 2480]
    - [16, 21.17]
  - - [256, 1024, 1, 2480]
    - [16, 21.864]
  - - [1024, 256, 1, 2880]
    - [60, 29.331]
  - - [128, 512, 1, 12672]
    - [19, 17.959]
  - - [512, 256, 1, 3220]
    - [116, 13.509]
  - - [256, 1024, 1, 2880]
    - [16, 29.432]
  - - [256, 1024, 1, 4200]
    - [60, 26.06]
  - - [1024, 256, 1, 3648]
    - [60, 31.229]
  - - [1024, 256, 1, 3312]
    - [24, 24.272]
  - - [256, 1024, 1, 3648]
    - [60, 31.782]
  - - [256, 12, 1, 3800]
    - [80, 0.475]
  - - [1024, 256, 1, 3300]
    - [146, 23.317]
  - - [1024, 256, 1, 3528]
    - [146, 24.928]
  - - [256, 1024, 1, 2604]
    - [16, 21.423]
  - - [1024, 256, 1, 2604]
    - [146, 21.187]
  - - [512, 256, 1, 11408]
    - [238, 26.447]
  - - [256, 3, 1, 3800]
    - [78, 0.124]
  - - [256, 128, 1, 11616]
    - [236, 9.105]
  - - [256, 1024, 1, 3312]
    - [24, 24.454]
  - - [256, 1024, 1, 3300]
    - [60, 23.888]
  - - [256, 12, 1, 11616]
    - [252, 1.042]
  - - [512, 256, 1, 3072]
    - [87, 15.643]
  - - [256, 1024, 1, 3528]
    - [16, 24.459]
  - - [512, 128, 1, 11776]
    - [7, 17.891]
  - - [512, 128, 1, 12144]
    - [244, 15.676]
  - - [2048, 512, 1, 888]
    - [194, 28.353]
  - - [2048, 256, 1, 950]
    - [189, 18.044]
  - - [1024, 256, 1, 2976]
    - [251, 22.712]
  - - [2048, 512, 1, 713]
    - [15, 24.486]
  - - [512, 1024, 1, 2688]
    - [28, 37.625]
  - - [1024, 256, 1, 2760]
    - [67, 22.518]
  - - [512, 128, 1, 11264]
    - [7, 17.809]
  - - [512, 256, 1, 3800]
    - [58, 14.885]
  - - [256, 1024, 1, 2760]
    - [67, 22.456]
  - - [512, 1024, 1, 2640]
    - [142, 33.536]
  - - [1024, 256, 1, 2160]
    - [16, 20.252]
  - - [512, 1024, 1, 2904]
    - [219, 34.307]
  - - [256, 1024, 1, 2160]
    - [16, 20.382]
  - - [1024, 512, 1, 950]
    - [126, 18.219]
  - - [128, 512, 1, 12144]
    - [247, 15.486]
  - - [512, 2048, 1, 672]
    - [230, 27.565]
  - - [512, 2048, 1, 660]
    - [13, 23.206]
  - - [512, 2048, 1, 1008]
    - [194, 30.301]
  - - [512, 128, 1, 12672]
    - [36, 18.168]
  - - [512, 256, 1, 11616]
    - [240, 26.309]
  - - [512, 256, 1, 2852]
    - [58, 12.88]
  - - [2048, 256, 1, 850]
    - [32, 17.679]
  - - [128, 512, 1, 12512]
    - [253, 16.982]
  - - [2048, 512, 1, 726]
    - [15, 24.717]
  - - [1024, 512, 1, 850]
    - [111, 17.742]
  - - [2048, 512, 1, 660]
    - [194, 23.206]
  - - [256, 1024, 1, 3864]
    - [60, 25.588]
  - - [2048, 512, 1, 672]
    - [254, 27.566]
  - - [256, 512, 1, 12288]
    - [245, 29.41]
  - - [256, 12, 1, 12288]
    - [255, 1.168]
  - - [128, 512, 1, 11776]
    - [80, 17.709]
  - - [256, 128, 1, 12288]
    - [244, 10.31]
  - - [512, 2048, 1, 840]
    - [256, 27.797]
  - - [512, 256, 1, 2640]
    - [58, 13.49]
  - - [2048, 512, 1, 1008]
    - [254, 30.85]
  - - [256, 1024, 1, 4000]
    - [16, 25.738]
  - - [512, 2048, 1, 792]
    - [179, 26.209]
  - - [1024, 512, 1, 805]
    - [145, 16.34]
  - - [512, 2048, 1, 1050]
    - [15, 29.962]
  - - [2048, 512, 1, 748]
    - [256, 24.478]
  - - [512, 256, 1, 2904]
    - [58, 13.571]
  - - [512, 256, 1, 12288]
    - [238, 29.458]
  - - [256, 1024, 1, 3900]
    - [60, 24.878]
  - - [2048, 256, 1, 864]
    - [5, 21.81]
  - - [256, 12, 1, 950]
    - [119, 0.183]
  - - [512, 256, 1, 2688]
    - [87, 15.267]
  - - [256, 3, 1, 950]
    - [119, 0.048]
  - - [256, 1024, 1, 3772]
    - [67, 24.431]
  - - [1024, 512, 1, 768]
    - [26, 23.146]
  - - [1024, 512, 1, 864]
    - [5, 21.444]
  - - [512, 256, 1, 3400]
    - [58, 14.025]
  - - [2048, 512, 1, 875]
    - [15, 26.711]
  - - [2048, 512, 1, 840]
    - [194, 27.875]
  - - [2048, 512, 1, 792]
    - [13, 26.581]
  - - [512, 2048, 1, 736]
    - [257, 29.276]
  - - [256, 12, 1, 3220]
    - [80, 0.439]
  - - [2048, 256, 1, 888]
    - [42, 17.841]
  - - [512, 2048, 1, 704]
    - [33, 33.947]
  - - [512, 2048, 1, 588]
    - [230, 21.243]
  - - [1024, 512, 1, 888]
    - [63, 17.841]
  - - [512, 2048, 1, 816]
    - [15, 25.775]
  - - [256, 3, 1, 3220]
    - [17, 0.115]
  - - [1024, 512, 1, 713]
    - [42, 15.315]
  - - [256, 12, 1, 3072]
    - [25, 0.563]
  - - [256, 3, 1, 3072]
    - [0, 0.143]
  - - [2048, 512, 1, 736]
    - [256, 28.791]
  - - [2048, 512, 1, 588]
    - [258, 21.243]
  - - [256, 12, 1, 850]
    - [119, 0.172]
  - - [2048, 512, 1, 704]
    - [33, 33.809]
  - - [1024, 512, 1, 660]
    - [145, 14.823]
  - - [256, 3, 1, 850]
    - [119, 0.045]
  - - [2048, 256, 1, 660]
    - [5, 15.052]
  - - [256, 12, 1, 2852]
    - [19, 0.4]
  - - [2048, 256, 1, 672]
    - [5, 18.463]
  - - [1024, 512, 1, 672]
    - [5, 18.992]
  - - [1024, 512, 1, 726]
    - [32, 15.824]
  - - [512, 256, 1, 3456]
    - [58, 16.955]
  - - [512, 256, 1, 3552]
    - [58, 14.177]
  - - [512, 2048, 1, 630]
    - [254, 22.35]
  - - [256, 3, 1, 2852]
    - [19, 0.104]
  - - [512, 2048, 1, 600]
    - [194, 23.089]
  - - [256, 12, 1, 805]
    - [259, 0.161]
  - - [256, 3, 1, 805]
    - [119, 0.042]
  - - [256, 3, 1, 864]
    - [259, 0.045]
  - - [256, 3, 1, 768]
    - [36, 0.053]
  - - [256, 12, 1, 864]
    - [119, 0.172]
  - - [256, 12, 1, 768]
    - [79, 0.213]
  - - [256, 12, 1, 2904]
    - [78, 0.399]
  - - [256, 3, 1, 2904]
    - [78, 0.105]
  - - [256, 3, 1, 713]
    - [259, 0.038]
  - - [256, 12, 1, 888]
    - [119, 0.177]
  - - [256, 3, 1, 888]
    - [119, 0.045]
  - - [256, 12, 1, 713]
    - [119, 0.152]
  - - [2048, 256, 1, 805]
    - [260, 16.229]
  - - [256, 3, 1, 660]
    - [119, 0.037]
  - - [256, 3, 1, 672]
    - [259, 0.037]
  - - [256, 12, 1, 660]
    - [119, 0.146]
  - - [256, 3, 1, 726]
    - [119, 0.04]
  - - [256, 12, 1, 672]
    - [119, 0.144]
  - - [256, 3, 1, 247]
    - [18, 0.016]
  - - [2048, 256, 1, 713]
    - [42, 15.315]
  - - [256, 12, 1, 726]
    - [119, 0.153]
  - - [256, 3, 1, 216]
    - [119, 0.015]
  - - [256, 3, 1, 3400]
    - [80, 0.115]
  - - [2048, 256, 1, 726]
    - [111, 15.709]
  - - [256, 3, 1, 221]
    - [18, 0.015]
  - - [256, 12, 1, 3552]
    - [19, 0.452]
  - - [256, 3, 1, 3456]
    - [0, 0.151]
  - - [256, 3, 1, 204]
    - [119, 0.014]
  - - [256, 12, 1, 3400]
    - [78, 0.441]
  - - [256, 12, 1, 3456]
    - [0, 0.595]
  - - [256, 12, 1, 221]
    - [119, 0.06]
  - - [256, 3, 1, 3552]
    - [80, 0.121]
  - - [256, 3, 1, 228]
    - [119, 0.015]
  - - [256, 3, 1, 234]
    - [119, 0.016]
  - - [256, 12, 1, 234]
    - [119, 0.06]
  - - [1024, 1024, 1, 12544]
    - [147, 71.281]
  - - [1024, 1000, 1, 12544]
    - [15, 69.778]
  - - [320, 1024, 1, 1024]
    - [16, 21.003]
  - - [1024, 1000, 1, 1024]
    - [33, 37.987]
  - - [320, 1000, 1, 1024]
    - [24, 19.848]
  - - [512, 512, 64, 48]
    - [261, 10.453]
  - - [256, 256, 64, 140]
    - [66, 16.097]
  - - [512, 512, 64, 56]
    - [225, 12.153]
  - - [512, 512, 49, 90]
    - [150, 16.261]
  - - [512, 512, 49, 60]
    - [200, 12.077]
  - - [256, 256, 49, 864]
    - [205, 53.434]
  - - [256, 256, 64, 224]
    - [27, 28.152]
  - - [128, 128, 49, 1280]
    - [32, 33.852]
  - - [256, 256, 64, 176]
    - [261, 19.523]
  - - [256, 256, 64, 154]
    - [48, 17.62]
  - - [128, 128, 49, 1360]
    - [63, 28.876]
  - - [512, 512, 49, 80]
    - [262, 15.795]
  - - [128, 128, 49, 1200]
    - [33, 28.119]
  - - [256, 256, 49, 1200]
    - [263, 52.881]
  - - [256, 256, 64, 704]
    - [42, 49.14]
  - - [256, 256, 64, 768]
    - [32, 45.998]
  - - [256, 256, 49, 1160]
    - [263, 51.622]
  - - [256, 256, 49, 320]
    - [48, 35.514]
  - - [128, 128, 49, 1240]
    - [32, 28.251]
  - - [512, 512, 49, 70]
    - [264, 14.089]
  - - [256, 256, 49, 1240]
    - [229, 53.6]
  - - [256, 256, 36, 384]
    - [123, 34.252]
  - - [256, 12, 1, 228]
    - [119, 0.06]
  - - [256, 3, 1, 252]
    - [119, 0.017]
  - - [256, 12, 1, 252]
    - [119, 0.065]
  - - [1024, 2048, 1, 888]
    - [45, 39.365]
  - - [1024, 2048, 1, 713]
    - [265, 33.228]
  - - [2304, 256, 1, 704]
    - [26, 24.494]
  - - [1024, 2048, 1, 660]
    - [265, 33.109]
  - - [1024, 2048, 1, 726]
    - [265, 35.588]
  - - [1024, 2048, 1, 672]
    - [266, 39.497]
  - - [256, 12, 1, 247]
    - [119, 0.063]
  - - [2304, 256, 1, 736]
    - [145, 21.738]
  - - [1024, 2048, 1, 850]
    - [265, 38.327]
  - - [1024, 2048, 1, 805]
    - [265, 37.077]
  - - [2304, 256, 1, 792]
    - [142, 18.932]
  - - [1024, 2048, 1, 864]
    - [254, 44.187]
  - - [2304, 256, 1, 748]
    - [32, 17.319]
  - - [2304, 256, 1, 726]
    - [32, 17.544]
  - - [1024, 2048, 1, 768]
    - [49, 45.252]
  - - [1024, 2048, 1, 950]
    - [265, 40.298]
  - - [2304, 256, 1, 713]
    - [32, 17.043]
  - - [2304, 256, 1, 768]
    - [41, 25.391]
  - - [512, 2048, 1, 759]
    - [254, 25.187]
  - - [512, 2048, 1, 925]
    - [15, 28.237]
  - - [2304, 256, 1, 805]
    - [145, 18.072]
  - - [512, 2048, 1, 900]
    - [194, 27.617]
  - - [512, 2048, 1, 875]
    - [254, 26.642]
  - - [512, 2048, 1, 748]
    - [256, 24.753]
  - - [512, 2048, 1, 726]
    - [194, 24.717]
  - - [512, 2048, 1, 713]
    - [254, 24.345]
  - - [512, 2048, 1, 805]
    - [194, 25.428]
  - - [512, 2048, 1, 850]
    - [15, 27.511]
  - - [512, 2048, 1, 950]
    - [266, 27.849]
  - - [128, 128, 49, 1152]
    - [33, 31.291]
  - - [128, 128, 36, 12000]
    - [178, 46.041]
  - - [128, 128, 49, 1216]
    - [33, 33.842]
  - - [128, 128, 36, 1800]
    - [64, 28.078]
  - - [128, 128, 36, 1900]
    - [28, 27.933]
  - - [128, 128, 64, 5880]
    - [221, 42.383]
  - - [128, 128, 49, 7680]
    - [63, 48.374]
  - - [128, 128, 64, 882]
    - [188, 23.628]
  - - [128, 128, 64, 931]
    - [230, 24.496]
  - - [128, 64, 121, 1152]
    - [33, 22.492]
  - - [128, 64, 81, 12000]
    - [267, 32.765]
  - - [128, 64, 121, 1216]
    - [33, 24.781]
  - - [128, 64, 81, 1800]
    - [42, 24.073]
  - - [128, 64, 81, 1900]
    - [267, 24.322]
  - - [128, 64, 49, 20280]
    - [24, 32.991]
  - - [128, 64, 49, 3042]
    - [67, 25.105]
  - - [128, 64, 49, 3211]
    - [170, 25.388]
  - - [128, 64, 25, 43320]
    - [58, 30.718]
  - - [128, 64, 169, 5880]
    - [64, 30.654]
  - - [128, 64, 25, 6498]
    - [58, 23.427]
  - - [128, 64, 25, 6859]
    - [16, 21.387]
  - - [128, 64, 121, 7680]
    - [22, 30.468]
  - - [128, 64, 169, 882]
    - [198, 20.657]
  - - [128, 64, 169, 931]
    - [32, 21.262]
  - - [256, 128, 25, 1080]
    - [32, 28.48]
  - - [256, 128, 49, 1152]
    - [52, 43.236]
  - - [256, 128, 121, 120]
    - [268, 13.537]
  - - [256, 128, 169, 120]
    - [269, 14.482]
  - - [256, 128, 36, 120]
    - [40, 8.394]
  - - [256, 128, 49, 120]
    - [184, 10.288]
  - - [256, 128, 64, 120]
    - [40, 11.119]
  - - [256, 128, 36, 12000]
    - [35, 62.397]
  - - [256, 128, 49, 1216]
    - [198, 47.614]
  - - [256, 128, 25, 162]
    - [5, 8.306]
  - - [256, 128, 25, 171]
    - [122, 8.672]
  - - [256, 128, 121, 18]
    - [62, 2.689]
  - - [256, 128, 169, 18]
    - [130, 2.995]
  - - [256, 128, 36, 18]
    - [106, 1.468]
  - - [256, 128, 49, 18]
    - [5, 1.77]
  - - [256, 128, 64, 18]
    - [1, 2.045]
  - - [256, 128, 36, 1800]
    - [35, 38.962]
  - - [256, 128, 121, 19]
    - [270, 2.858]
  - - [256, 128, 169, 19]
    - [271, 3.144]
  - - [256, 128, 36, 19]
    - [30, 1.54]
  - - [256, 128, 49, 19]
    - [145, 1.899]
  - - [256, 128, 64, 19]
    - [5, 2.148]
  - - [256, 128, 36, 1900]
    - [272, 39.029]
  - - [256, 128, 49, 480]
    - [231, 31.347]
  - - [256, 128, 81, 480]
    - [273, 36.338]
  - - [256, 128, 64, 5880]
    - [274, 51.247]
  - - [256, 128, 49, 72]
    - [184, 6.784]
  - - [256, 128, 81, 72]
    - [275, 9.085]
  - - [256, 128, 49, 76]
    - [1, 7.015]
  - - [256, 128, 81, 76]
    - [97, 9.47]
  - - [256, 128, 49, 7680]
    - [155, 64.529]
  - - [256, 128, 64, 882]
    - [48, 31.197]
  - - [256, 128, 64, 931]
    - [48, 31.605]
  - - [256, 256, 49, 1152]
    - [220, 54.411]
  - - [256, 256, 36, 12000]
    - [9, 79.564]
  - - [256, 256, 49, 1216]
    - [228, 58.738]
  - - [256, 256, 36, 1800]
    - [123, 53.4]
  - - [256, 256, 36, 1900]
    - [15, 52.227]
  - - [256, 256, 64, 5880]
    - [114, 64.514]
  - - [256, 256, 49, 7680]
    - [276, 80.609]
  - - [256, 256, 64, 882]
    - [102, 38.989]
  - - [256, 256, 64, 931]
    - [188, 38.865]
  - - [512, 256, 81, 1080]
    - [277, 61.516]
  - - [512, 256, 25, 12000]
    - [68, 86.747]
  - - [512, 256, 81, 162]
    - [150, 23.517]
  - - [512, 256, 81, 171]
    - [225, 24.149]
  - - [512, 256, 25, 1800]
    - [278, 62.339]
  - - [512, 256, 25, 1900]
    - [228, 62.797]
  - - [512, 256, 121, 1920]
    - [52, 73.89]
  - - [512, 256, 169, 1920]
    - [155, 72.415]
  - - [512, 256, 49, 1920]
    - [279, 67.837]
  - - [512, 256, 121, 288]
    - [280, 42.884]
  - - [512, 256, 169, 288]
    - [174, 43.667]
  - - [512, 256, 49, 288]
    - [56, 36.884]
  - - [512, 256, 25, 3000]
    - [228, 71.501]
  - - [512, 256, 81, 3000]
    - [263, 77.857]
  - - [512, 256, 121, 304]
    - [261, 38.146]
  - - [512, 256, 169, 304]
    - [264, 38.531]
  - - [512, 256, 49, 304]
    - [281, 33.635]
  - - [512, 256, 25, 450]
    - [225, 33.698]
  - - [512, 256, 81, 450]
    - [68, 41.31]
  - - [512, 256, 25, 475]
    - [27, 34.25]
  - - [512, 256, 81, 475]
    - [202, 42.306]
  - - [512, 256, 121, 480]
    - [282, 52.716]
  - - [512, 256, 169, 480]
    - [48, 53.431]
  - - [512, 256, 49, 5880]
    - [283, 77.94]
  - - [512, 256, 121, 72]
    - [157, 15.047]
  - - [512, 256, 169, 72]
    - [188, 15.437]
  - - [512, 256, 121, 76]
    - [157, 15.502]
  - - [512, 256, 169, 76]
    - [141, 15.767]
  - - [512, 256, 49, 882]
    - [121, 52.355]
  - - [512, 256, 49, 931]
    - [284, 51.98]
  - - [64, 64, 64, 20280]
    - [60, 24.181]
  - - [64, 64, 49, 27000]
    - [58, 24.324]
  - - [64, 64, 64, 3042]
    - [146, 17.756]
  - - [64, 64, 64, 3211]
    - [146, 18.133]
  - - [64, 64, 49, 4050]
    - [51, 16.209]
  - - [64, 64, 49, 4275]
    - [58, 18.171]
  - - [64, 64, 36, 43320]
    - [166, 22.546]
  - - [64, 64, 36, 6498]
    - [166, 17.582]
  - - [64, 64, 36, 6859]
    - [58, 17.37]
  - - [1152, 128, 1, 1444]
    - [51, 10.037]
  - - [1152, 256, 1, 1]
    - [11, 0.026]
  - - [1152, 256, 1, 1444]
    - [16, 17.447]
  - - [1152, 256, 1, 25]
    - [11, 0.639]
  - - [1152, 256, 1, 9]
    - [11, 0.234]
  - - [128, 256, 1, 1444]
    - [119, 2.613]
  - - [2304, 256, 1, 1444]
    - [63, 26.655]
  - - [2304, 340, 1, 1]
    - [30, 0.062]
  - - [2304, 340, 1, 1444]
    - [4, 31.861]
  - - [2304, 340, 1, 9]
    - [30, 0.548]
  - - [2304, 510, 1, 25]
    - [30, 1.97]
  - - [2304, 512, 1, 100]
    - [285, 6.922]
  - - [2304, 512, 1, 361]
    - [254, 17.014]
  - - [256, 128, 1, 25]
    - [11, 0.085]
  - - [256, 128, 1, 9]
    - [18, 0.03]
  - - [256, 256, 1, 1444]
    - [164, 5.176]
  - - [4608, 510, 1, 100]
    - [38, 10.763]
  - - [4608, 510, 1, 361]
    - [38, 24.827]
  - - [512, 128, 1, 100]
    - [18, 0.631]
  - - [512, 256, 1, 361]
    - [159, 3.484]
  - - [576, 128, 1, 1444]
    - [119, 5.795]
  - - [576, 64, 1, 5625]
    - [79, 5.783]
  - - [64, 128, 1, 1444]
    - [119, 0.644]
  - - [81, 1024, 1, 1024]
    - [17, 6.985]
  - - [81, 1000, 1, 1024]
    - [17, 6.535]
  - - [340, 256, 49, 1152]
    - [89, 47.393]
  - - [340, 256, 36, 120]
    - [286, 12.955]
  - - [340, 256, 49, 120]
    - [285, 13.504]
  - - [340, 256, 64, 120]
    - [287, 14.854]
  - - [340, 256, 36, 12000]
    - [288, 77.025]
  - - [340, 256, 49, 1216]
    - [89, 51.075]
  - - [340, 256, 36, 18]
    - [289, 2.319]
  - - [340, 256, 49, 18]
    - [290, 2.703]
  - - [340, 256, 64, 18]
    - [291, 2.95]
  - - [340, 256, 36, 1800]
    - [292, 49.032]
  - - [340, 256, 36, 19]
    - [293, 2.457]
  - - [340, 256, 49, 19]
    - [290, 2.889]
  - - [340, 256, 64, 19]
    - [294, 3.163]
  - - [340, 256, 36, 1900]
    - [292, 48.083]
  - - [340, 256, 64, 5880]
    - [155, 63.67]
  - - [340, 256, 49, 7680]
    - [155, 69.354]
  - - [340, 256, 64, 882]
    - [284, 41.809]
  - - [340, 256, 64, 931]
    - [281, 41.499]
  - - [510, 256, 49, 120]
    - [295, 14.273]
  - - [510, 256, 64, 120]
    - [295, 15.143]
  - - [510, 256, 49, 18]
    - [296, 2.796]
  - - [510, 256, 64, 18]
    - [295, 3.092]
  - - [510, 256, 49, 19]
    - [290, 2.932]
  - - [510, 256, 64, 19]
    - [290, 3.24]
  - - [510, 256, 36, 480]
    - [280, 37.325]
  - - [510, 256, 36, 72]
    - [297, 8.805]
  - - [510, 256, 36, 76]
    - [296, 9.295]
  - - [510, 512, 36, 1080]
    - [298, 48.06]
  - - [510, 512, 36, 162]
    - [299, 17.507]
  - - [510, 512, 36, 171]
    - [287, 18.806]
  - - [510, 512, 49, 1920]
    - [89, 69.717]
  - - [510, 512, 64, 1920]
    - [89, 70.813]
  - - [510, 512, 49, 288]
    - [300, 33.726]
  - - [510, 512, 64, 288]
    - [300, 34.939]
  - - [510, 512, 36, 3000]
    - [301, 65.028]
  - - [510, 512, 49, 304]
    - [297, 29.65]
  - - [510, 512, 64, 304]
    - [302, 31.243]
  - - [510, 512, 36, 450]
    - [297, 31.688]
  - - [510, 512, 36, 475]
    - [303, 31.92]
  - - [510, 512, 49, 480]
    - [280, 42.191]
  - - [510, 512, 64, 480]
    - [300, 43.159]
  - - [510, 512, 49, 72]
    - [285, 11.623]
  - - [510, 512, 64, 72]
    - [296, 12.104]
  - - [510, 512, 49, 76]
    - [296, 11.987]
  - - [510, 512, 64, 76]
    - [287, 12.53]
  - - [147, 64, 1, 22500]
    - [304, 5.031]
  - - [33, 33, 8192, 64]
    - [31, 2.64]
  - - [34, 24, 320, 64]
    - [75, 1.483]
  - - [9, 9, 8192, 64]
    - [12, 1.673]
  - - [17, 17, 8192, 64]
    - [305, 1.692]
  - - [21, 21, 8192, 64]
    - [196, 2.455]
  - - [30, 30, 5248, 64]
    - [159, 3.71]
  - - [15, 15, 8192, 64]
    - [306, 2.723]
  - - [5, 5, 8192, 64]
    - [12, 0.659]
  - - [32, 32, 5248, 64]
    - [307, 5.567]
  - - [34, 34, 5248, 64]
    - [31, 2.793]
  - - [27, 27, 8192, 64]
    - [159, 3.157]
  - - [26, 26, 5248, 64]
    - [12, 3.162]
  - - [14, 14, 5440, 64]
    - [101, 2.496]
  - - [3, 3, 8192, 64]
    - [12, 0.238]
  - - [31, 31, 8192, 64]
    - [308, 3.548]
  - - [24, 24, 5440, 64]
    - [307, 4.239]
  - - [35, 35, 8192, 64]
    - [31, 3.025]
  - - [4, 4, 3456, 64]
    - [12, 0.271]
  - - [10, 44, 3712, 64]
    - [101, 2.886]
  - - [16, 12, 10240, 64]
    - [309, 2.247]
  - - [16, 14, 10240, 64]
    - [101, 2.397]
  - - [16, 32, 5120, 64]
    - [309, 3.788]
  - - [18, 14, 9088, 64]
    - [11, 2.613]
  - - [20, 16, 11008, 64]
    - [12, 3.409]
  - - [20, 18, 8192, 64]
    - [196, 2.776]
  - - [22, 16, 10048, 64]
    - [75, 3.592]
  - - [22, 18, 10048, 64]
    - [75, 3.428]
  - - [22, 32, 5120, 64]
    - [305, 3.724]
  - - [24, 36, 320, 64]
    - [18, 1.634]
  - - [26, 32, 384, 64]
    - [92, 1.786]
  - - [26, 34, 320, 64]
    - [309, 1.534]
  - - [28, 32, 384, 64]
    - [309, 1.908]
  - - [28, 34, 320, 64]
    - [101, 1.639]
  - - [30, 32, 384, 64]
    - [101, 1.926]
  - - [30, 36, 320, 64]
    - [101, 1.78]
  - - [32, 34, 320, 64]
    - [14, 1.977]
  - - [32, 36, 320, 64]
    - [75, 2.077]
  - - [32, 72, 160, 64]
    - [14, 2.161]
  - - [62, 56, 2624, 64]
    - [31, 5.324]
  - - [72, 16, 160, 64]
    - [26, 1.117]
  - - [96, 96, 16, 64]
    - [75, 0.984]
  - - [112, 112, 16, 64]
    - [75, 1.34]
  - - [144, 144, 16, 64]
    - [75, 2.01]
  - - [160, 160, 16, 64]
    - [18, 2.421]
  - - [176, 176, 16, 64]
    - [43, 2.929]
  - - [192, 192, 16, 64]
    - [43, 3.349]
  - - [208, 208, 16, 64]
    - [104, 3.84]
  - - [224, 224, 16, 64]
    - [197, 4.288]
  - - [240, 240, 16, 64]
    - [148, 5.034]
  - - [256, 256, 16, 64]
    - [130, 5.074]
  - - [272, 272, 16, 64]
    - [136, 5.616]
  - - [288, 288, 16, 64]
    - [136, 6.095]
  - - [304, 304, 16, 64]
    - [50, 6.879]
  - - [336, 336, 16, 64]
    - [144, 7.799]
  - - [352, 352, 16, 64]
    - [110, 8.031]
  - - [368, 368, 16, 64]
    - [144, 8.928]
  - - [384, 384, 16, 64]
    - [268, 7.148]
  - - [400, 400, 16, 64]
    - [110, 9.184]
  - - [416, 416, 16, 64]
    - [38, 9.373]
  - - [432, 432, 16, 64]
    - [210, 10.302]
  - - [448, 448, 16, 64]
    - [34, 10.245]
  - - [464, 464, 16, 64]
    - [34, 11.29]
  - - [480, 480, 16, 64]
    - [34, 11.762]
  - - [1024, 4896, 1, 1024]
    - [15, 68.128]
  - - [1024, 6688, 1, 4096]
    - [52, 83.942]
  - - [1024, 7872, 1, 1024]
    - [15, 76.29]
  - - [1024, 7872, 1, 4096]
    - [15, 92.168]
  - - [1024, 7760, 1, 1024]
    - [15, 74.593]
  - - [1024, 7760, 1, 4096]
    - [13, 90.924]
  - - [1024, 6608, 1, 1024]
    - [4, 67.706]
  - - [1024, 6608, 1, 4096]
    - [52, 82.674]
  - - [1024, 6624, 1, 4096]
    - [3, 82.743]
  - - [1024, 7024, 1, 4096]
    - [3, 87.809]
  - - [1024, 7040, 1, 4096]
    - [114, 88.974]
  - - [1024, 6544, 1, 4096]
    - [72, 83.532]
  - - [1024, 6736, 1, 4096]
    - [52, 84.231]
  - - [1024, 6960, 1, 4096]
    - [114, 87.356]
  - - [3072, 6848, 1, 1024]
    - [20, 78.876]
  - - [1024, 6848, 1, 4096]
    - [3, 85.587]
  - - [1024, 6976, 1, 4096]
    - [3, 87.255]
  - - [1024, 6640, 1, 4096]
    - [114, 83.229]
  - - [4096, 7440, 1, 1024]
    - [20, 80.934]
  - - [1024, 6672, 1, 1024]
    - [28, 67.833]
  - - [1024, 6672, 1, 4096]
    - [52, 83.453]
  - - [1024, 5328, 1, 1024]
    - [4, 62.197]
  - - [1024, 6560, 1, 4096]
    - [72, 84.559]
  - - [1024, 7776, 1, 1024]
    - [15, 75.608]
  - - [1024, 7776, 1, 4096]
    - [13, 91.225]
  - - [1024, 6576, 1, 4096]
    - [3, 82.493]
  - - [1024, 6928, 1, 4096]
    - [3, 87.093]
  - - [1024, 6864, 1, 4096]
    - [52, 85.854]
  - - [1024, 6704, 1, 1024]
    - [4, 67.982]
  - - [1024, 6704, 1, 4096]
    - [114, 84.098]
  - - [1024, 6800, 1, 4096]
    - [3, 85.416]
  - - [1024, 6880, 1, 4096]
    - [3, 85.918]
  - - [1000, 32, 1, 1664]
    - [25, 3.468]
  - - [1000, 32, 1, 4096]
    - [201, 6.027]
  - - [100, 1792, 1, 1280]
    - [17, 11.236]
  - - [100, 224, 1, 1000]
    - [94, 1.237]
  - - [1184, 128, 1, 196]
    - [305, 2.246]
  - - [1280, 1792, 1, 3840]
    - [15, 68.11]
  - - [1280, 1792, 1, 5120]
    - [15, 70.305]
  - - [1280, 640, 1, 196]
    - [180, 8.824]
  - - [1312, 128, 1, 196]
    - [132, 2.424]
  - - [1568, 128, 1, 196]
    - [307, 2.897]
  - - [1792, 896, 1, 196]
    - [268, 12.846]
  - - [4000, 224, 1, 1000]
    - [194, 23.921]
  - - [4000, 224, 1, 224]
    - [5, 11.478]
  - - [4096, 32, 1, 25088]
    - [59, 21.729]
  - - [768, 32, 1, 768]
    - [22, 1.354]
  - - [224, 224, 160, 64]
    - [227, 12.835]
  - - [224, 224, 384, 64]
    - [48, 15.2]
  - - [224, 224, 512, 64]
    - [61, 15.698]
  - - [512, 512, 25, 512]
    - [222, 45.768]
  - - [64, 224, 160, 224]
    - [138, 17.649]
  - - [64, 224, 384, 224]
    - [138, 20.86]
  - - [64, 224, 512, 224]
    - [61, 21.122]
  - - [1024, 2235, 1, 1024]
    - [15, 49.353]
  - - [1024, 2236, 1, 1024]
    - [15, 49.283]
  - - [1024, 2242, 1, 1024]
    - [15, 49.14]
  - - [1024, 2284, 1, 1024]
    - [15, 49.6]
  - - [1024, 14320, 1, 4096]
    - [13, 84.629]
  - - [1024, 14112, 1, 4096]
    - [13, 83.64]
  - - [1024, 14128, 1, 4096]
    - [13, 83.62]
  - - [1024, 14144, 1, 4096]
    - [13, 83.704]
  - - [1024, 14160, 1, 4096]
    - [13, 83.82]
  - - [1024, 14176, 1, 4096]
    - [13, 83.851]
  - - [1024, 14192, 1, 4096]
    - [13, 83.936]
  - - [1024, 14208, 1, 4096]
    - [13, 84.083]
  - - [1024, 14224, 1, 4096]
    - [13, 84.167]
  - - [1024, 14240, 1, 4096]
    - [13, 84.23]
  - - [1024, 14256, 1, 4096]
    - [13, 84.304]
  - - [1024, 14272, 1, 4096]
    - [13, 84.388]
  - - [1024, 14288, 1, 4096]
    - [13, 84.366]
  - - [1024, 14304, 1, 4096]
    - [13, 84.587]
  - - [1024, 14640, 1, 1024]
    - [20, 69.237]
  - - [1024, 2237, 1, 1024]
    - [15, 49.305]
  - - [1024, 3520, 1, 4096]
    - [32, 76.901]
  - - [1024, 3616, 1, 1024]
    - [9, 57.884]
  - - [1024, 3664, 1, 1024]
    - [15, 58.415]
  - - [1024, 3712, 1, 1024]
    - [15, 59.26]
  - - [1024, 3808, 1, 1024]
    - [15, 60.467]
  - - [1024, 3824, 1, 1024]
    - [15, 60.396]
  - - [1024, 3904, 1, 1024]
    - [15, 61.495]
  - - [1024, 3920, 1, 1024]
    - [15, 61.257]
  - - [1024, 3920, 1, 4096]
    - [13, 80.574]
  - - [1024, 4368, 1, 4096]
    - [13, 70.279]
  - - [1024, 4528, 1, 4096]
    - [13, 72.288]
  - - [1024, 4944, 1, 4096]
    - [13, 78.268]
  - - [1024, 5024, 1, 1024]
    - [15, 63.208]
  - - [1024, 5536, 1, 4096]
    - [4, 72.447]
  - - [1024, 5696, 1, 4096]
    - [32, 74.089]
  - - [1024, 5936, 1, 1024]
    - [28, 62.725]
  - - [1024, 603, 1, 1024]
    - [28, 25.717]
  - - [1024, 6048, 1, 4096]
    - [13, 77.684]
  - - [1024, 627, 1, 1024]
    - [28, 26.838]
  - - [30528, 468, 1, 1024]
    - [20, 69.169]
  - - [30528, 659, 1, 1024]
    - [20, 70.248]
  - - [30528, 665, 1, 1024]
    - [124, 70.887]
  - - [30528, 672, 1, 1024]
    - [20, 71.138]
  - - [3072, 14848, 1, 1024]
    - [20, 76.521]
  - - [3072, 4384, 1, 1024]
    - [20, 67.525]
  - - [1024, 1002, 1, 1024]
    - [33, 32.431]
  - - [1024, 109, 1, 1024]
    - [58, 6.998]
  - - [1024, 128, 1, 4096]
    - [58, 16.392]
  - - [1024, 14096, 1, 4096]
    - [13, 83.462]
  - - [1024, 17, 1, 1024]
    - [36, 1.348]
  - - [1024, 1818, 1, 1024]
    - [137, 41.382]
  - - [1024, 1950, 1, 1024]
    - [15, 43.713]
  - - [1024, 1966, 1, 1024]
    - [49, 43.989]
  - - [1024, 1973, 1, 1024]
    - [15, 44.061]
  - - [1024, 2027, 1, 1024]
    - [13, 45.097]
  - - [1024, 2051, 1, 1024]
    - [15, 45.46]
  - - [1024, 2086, 1, 1024]
    - [15, 45.977]
  - - [1024, 2123, 1, 1024]
    - [15, 46.88]
  - - [1024, 2125, 1, 1024]
    - [9, 46.836]
  - - [1024, 2150, 1, 1024]
    - [15, 47.654]
  - - [1024, 2177, 1, 1024]
    - [15, 47.893]
  - - [1024, 2178, 1, 1024]
    - [15, 48.094]
  - - [1024, 2180, 1, 1024]
    - [15, 47.87]
  - - [1024, 2184, 1, 1024]
    - [15, 48.136]
  - - [1024, 2191, 1, 1024]
    - [15, 48.112]
  - - [1024, 2192, 1, 1024]
    - [15, 47.867]
  - - [1024, 2194, 1, 1024]
    - [15, 47.999]
  - - [1024, 2196, 1, 1024]
    - [15, 47.777]
  - - [1024, 2199, 1, 1024]
    - [15, 48.467]
  - - [1024, 2200, 1, 1024]
    - [15, 48.219]
  - - [1024, 2201, 1, 1024]
    - [15, 48.242]
  - - [1024, 2208, 1, 1024]
    - [13, 49.686]
  - - [1024, 2209, 1, 1024]
    - [15, 48.597]
  - - [1024, 2210, 1, 1024]
    - [15, 48.349]
  - - [1024, 2213, 1, 1024]
    - [15, 48.325]
  - - [1024, 2214, 1, 1024]
    - [9, 48.708]
  - - [1024, 2215, 1, 1024]
    - [15, 48.548]
  - - [1024, 2216, 1, 1024]
    - [15, 48.66]
  - - [1024, 2217, 1, 1024]
    - [9, 49.047]
  - - [1024, 2218, 1, 1024]
    - [15, 48.705]
  - - [1024, 2219, 1, 1024]
    - [15, 48.999]
  - - [1024, 2220, 1, 1024]
    - [15, 48.568]
  - - [1024, 2221, 1, 1024]
    - [15, 48.62]
  - - [1024, 2223, 1, 1024]
    - [107, 48.723]
  - - [1024, 2224, 1, 1024]
    - [15, 48.566]
  - - [1024, 2225, 1, 1024]
    - [15, 48.587]
  - - [1024, 2226, 1, 1024]
    - [9, 48.609]
  - - [1024, 2227, 1, 1024]
    - [15, 48.902]
  - - [1024, 2228, 1, 1024]
    - [9, 48.652]
  - - [1024, 2229, 1, 1024]
    - [15, 49.037]
  - - [1024, 2230, 1, 1024]
    - [9, 49.151]
  - - [1024, 2231, 1, 1024]
    - [15, 48.99]
  - - [1024, 2232, 1, 1024]
    - [13, 49.194]
  - - [1024, 2233, 1, 1024]
    - [15, 49.125]
  - - [1024, 2234, 1, 1024]
    - [9, 48.964]
  - - [1024, 2238, 1, 1024]
    - [15, 49.327]
  - - [1024, 2239, 1, 1024]
    - [15, 49.534]
  - - [1024, 2240, 1, 1024]
    - [28, 49.279]
  - - [1024, 2241, 1, 1024]
    - [15, 49.393]
  - - [1024, 2243, 1, 1024]
    - [9, 48.98]
  - - [1024, 2247, 1, 1024]
    - [15, 49.068]
  - - [1024, 2248, 1, 1024]
    - [15, 49.18]
  - - [1024, 2249, 1, 1024]
    - [15, 49.662]
  - - [1024, 2251, 1, 1024]
    - [15, 49.799]
  - - [1024, 2252, 1, 1024]
    - [15, 49.451]
  - - [1024, 2253, 1, 1024]
    - [15, 49.473]
  - - [1024, 2254, 1, 1024]
    - [15, 49.403]
  - - [1024, 2255, 1, 1024]
    - [15, 49.61]
  - - [1024, 2256, 1, 1024]
    - [15, 49.539]
  - - [1024, 2257, 1, 1024]
    - [15, 49.561]
  - - [1024, 2258, 1, 1024]
    - [13, 48.767]
  - - [1024, 2262, 1, 1024]
    - [15, 49.856]
  - - [1024, 2263, 1, 1024]
    - [15, 49.509]
  - - [1024, 2264, 1, 1024]
    - [15, 49.53]
  - - [1024, 2267, 1, 1024]
    - [15, 49.141]
  - - [1024, 2268, 1, 1024]
    - [15, 49.803]
  - - [1024, 2269, 1, 1024]
    - [15, 49.185]
  - - [1024, 2270, 1, 1024]
    - [15, 49.939]
  - - [1024, 2271, 1, 1024]
    - [15, 49.683]
  - - [1024, 2272, 1, 1024]
    - [9, 49.34]
  - - [1024, 2273, 1, 1024]
    - [9, 49.361]
  - - [1024, 2274, 1, 1024]
    - [15, 49.384]
  - - [1024, 2275, 1, 1024]
    - [15, 49.956]
  - - [1024, 2277, 1, 1024]
    - [15, 49.814]
  - - [1024, 2280, 1, 1024]
    - [15, 49.332]
  - - [1024, 2281, 1, 1024]
    - [15, 49.81]
  - - [1024, 2282, 1, 1024]
    - [15, 49.832]
  - - [1024, 2283, 1, 1024]
    - [15, 49.67]
  - - [1024, 2285, 1, 1024]
    - [15, 49.531]
  - - [1024, 2286, 1, 1024]
    - [15, 50.104]
  - - [1024, 2287, 1, 1024]
    - [15, 49.575]
  - - [1024, 2288, 1, 1024]
    - [15, 49.596]
  - - [1024, 2289, 1, 1024]
    - [15, 50.078]
  - - [1024, 2290, 1, 1024]
    - [15, 49.822]
  - - [1024, 2291, 1, 1024]
    - [15, 49.661]
  - - [1024, 2292, 1, 1024]
    - [15, 49.683]
  - - [1024, 2293, 1, 1024]
    - [15, 49.796]
  - - [1024, 2294, 1, 1024]
    - [15, 49.726]
  - - [1024, 2295, 1, 1024]
    - [15, 50.208]
  - - [1024, 2296, 1, 1024]
    - [15, 49.861]
  - - [1024, 2298, 1, 1024]
    - [15, 49.813]
  - - [1024, 2299, 1, 1024]
    - [15, 50.11]
  - - [1024, 2300, 1, 1024]
    - [15, 50.132]
  - - [1024, 2301, 1, 1024]
    - [15, 50.246]
  - - [1024, 2302, 1, 1024]
    - [15, 49.446]
  - - [1024, 2303, 1, 1024]
    - [15, 50.665]
  - - [1024, 3456, 1, 4096]
    - [52, 77.731]
  - - [1024, 3472, 1, 4096]
    - [32, 75.539]
  - - [1024, 3488, 1, 4096]
    - [32, 76.202]
  - - [1024, 3504, 1, 4096]
    - [4, 76.2]
  - - [1024, 3632, 1, 1024]
    - [15, 57.983]
  - - [1024, 368, 1, 1024]
    - [16, 20.41]
  - - [1024, 3680, 1, 1024]
    - [15, 58.83]
  - - [1024, 3680, 1, 4096]
    - [9, 76.271]
  - - [1024, 3696, 1, 1024]
    - [15, 58.925]
  - - [1024, 3696, 1, 4096]
    - [147, 75.97]
  - - [1024, 3728, 1, 1024]
    - [15, 58.879]
  - - [1024, 384, 1, 1024]
    - [60, 21.81]
  - - [1024, 3904, 1, 4096]
    - [9, 80.176]
  - - [1024, 3936, 1, 1024]
    - [13, 62.584]
  - - [1024, 3936, 1, 4096]
    - [13, 81.221]
  - - [1024, 3984, 1, 1024]
    - [4, 56.434]
  - - [1024, 4000, 1, 4096]
    - [32, 72.008]
  - - [1024, 4048, 1, 4096]
    - [4, 73.011]
  - - [1024, 4064, 1, 1024]
    - [42, 57.361]
  - - [1024, 4192, 1, 1024]
    - [28, 59.452]
  - - [1024, 4256, 1, 4096]
    - [32, 75.836]
  - - [1024, 4352, 1, 4096]
    - [4, 77.372]
  - - [1024, 4928, 1, 1024]
    - [107, 61.935]
  - - [1024, 4960, 1, 4096]
    - [13, 78.39]
  - - [1024, 5136, 1, 4096]
    - [13, 80.712]
  - - [1024, 5360, 1, 4096]
    - [4, 70.358]
  - - [1024, 5456, 1, 1024]
    - [28, 58.278]
  - - [1024, 5488, 1, 4096]
    - [71, 71.898]
  - - [1024, 549, 1, 1024]
    - [44, 24.2]
  - - [1024, 558, 1, 1024]
    - [71, 24.059]
  - - [1024, 559, 1, 1024]
    - [44, 24.19]
  - - [1024, 560, 1, 1024]
    - [28, 23.97]
  - - [1024, 5600, 1, 1024]
    - [42, 59.387]
  - - [1024, 571, 1, 1024]
    - [71, 24.53]
  - - [1024, 576, 1, 1024]
    - [28, 25.776]
  - - [1024, 5760, 1, 4096]
    - [4, 74.736]
  - - [1024, 579, 1, 1024]
    - [64, 24.694]
  - - [1024, 581, 1, 1024]
    - [28, 25.235]
  - - [1024, 582, 1, 1024]
    - [28, 25.002]
  - - [1024, 590, 1, 1024]
    - [28, 25.72]
  - - [1024, 591, 1, 1024]
    - [37, 25.115]
  - - [1024, 593, 1, 1024]
    - [28, 25.2]
  - - [1024, 594, 1, 1024]
    - [71, 25.334]
  - - [1024, 595, 1, 1024]
    - [28, 25.654]
  - - [1024, 596, 1, 1024]
    - [28, 25.328]
  - - [1024, 597, 1, 1024]
    - [28, 25.834]
  - - [1024, 598, 1, 1024]
    - [126, 25.413]
  - - [1024, 602, 1, 1024]
    - [126, 25.583]
  - - [1024, 604, 1, 1024]
    - [28, 25.853]
  - - [1024, 605, 1, 1024]
    - [28, 25.99]
  - - [1024, 608, 1, 1024]
    - [71, 25.837]
  - - [1024, 609, 1, 1024]
    - [6, 25.88]
  - - [1024, 610, 1, 1024]
    - [28, 26.016]
  - - [1024, 612, 1, 1024]
    - [28, 26.196]
  - - [1024, 613, 1, 1024]
    - [28, 25.957]
  - - [1024, 614, 1, 1024]
    - [28, 26.092]
  - - [1024, 615, 1, 1024]
    - [28, 26.516]
  - - [1024, 616, 1, 1024]
    - [28, 25.898]
  - - [1024, 617, 1, 1024]
    - [6, 26.22]
  - - [1024, 618, 1, 1024]
    - [28, 26.357]
  - - [1024, 619, 1, 1024]
    - [28, 26.496]
  - - [1024, 620, 1, 1024]
    - [37, 26.347]
  - - [1024, 621, 1, 1024]
    - [71, 26.485]
  - - [1024, 622, 1, 1024]
    - [93, 26.432]
  - - [1024, 623, 1, 1024]
    - [6, 26.474]
  - - [1024, 624, 1, 1024]
    - [126, 26.517]
  - - [1024, 625, 1, 1024]
    - [71, 26.752]
  - - [1024, 626, 1, 1024]
    - [93, 26.602]
  - - [1024, 628, 1, 1024]
    - [93, 26.592]
  - - [1024, 6288, 1, 4096]
    - [13, 80.113]
  - - [1024, 629, 1, 1024]
    - [71, 26.924]
  - - [1024, 630, 1, 1024]
    - [71, 26.676]
  - - [1024, 6304, 1, 4096]
    - [13, 80.339]
  - - [1024, 631, 1, 1024]
    - [71, 27.009]
  - - [1024, 632, 1, 1024]
    - [93, 26.761]
  - - [1024, 633, 1, 1024]
    - [28, 26.803]
  - - [1024, 634, 1, 1024]
    - [71, 26.75]
  - - [1024, 635, 1, 1024]
    - [28, 27.082]
  - - [1024, 636, 1, 1024]
    - [28, 27.422]
  - - [1024, 6368, 1, 1024]
    - [15, 66.165]
  - - [1024, 637, 1, 1024]
    - [28, 27.069]
  - - [1024, 638, 1, 1024]
    - [71, 26.918]
  - - [1024, 639, 1, 1024]
    - [71, 27.352]
  - - [1024, 640, 1, 1024]
    - [28, 28.424]
  - - [1024, 641, 1, 1024]
    - [28, 27.943]
  - - [1024, 642, 1, 1024]
    - [6, 27.48]
  - - [1024, 643, 1, 1024]
    - [64, 27.325]
  - - [1024, 644, 1, 1024]
    - [71, 27.666]
  - - [1024, 645, 1, 1024]
    - [6, 28.014]
  - - [1024, 646, 1, 1024]
    - [6, 27.452]
  - - [1024, 800, 1, 4096]
    - [189, 58.611]
  - - [1024, 816, 1, 4096]
    - [64, 59.507]
  - - [1024, 834, 1, 1024]
    - [191, 30.316]
  - - [1024, 835, 1, 1024]
    - [191, 30.259]
  - - [1024, 836, 1, 1024]
    - [191, 30.203]
  - - [1024, 837, 1, 1024]
    - [214, 29.964]
  - - [1024, 838, 1, 1024]
    - [191, 30.091]
  - - [1024, 839, 1, 1024]
    - [190, 29.945]
  - - [1024, 840, 1, 1024]
    - [191, 30.071]
  - - [1024, 889, 1, 1024]
    - [190, 32.515]
  - - [1024, 893, 1, 1024]
    - [190, 32.461]
  - - [1024, 962, 1, 1024]
    - [96, 31.482]
  - - [1024, 966, 1, 1024]
    - [104, 32.238]
  - - [1024, 976, 1, 1024]
    - [104, 31.94]
  - - [30528, 109, 1, 1024]
    - [35, 42.326]
  - - [30528, 119, 1, 1024]
    - [35, 44.777]
  - - [30528, 122, 1, 1024]
    - [35, 45.325]
  - - [30528, 17, 1, 1024]
    - [33, 9.736]
  - - [30528, 447, 1, 1024]
    - [9, 66.907]
  - - [30528, 448, 1, 1024]
    - [124, 67.2]
  - - [30528, 462, 1, 1024]
    - [20, 68.714]
  - - [30528, 471, 1, 1024]
    - [124, 69.148]
  - - [30528, 473, 1, 1024]
    - [20, 69.732]
  - - [30528, 474, 1, 1024]
    - [124, 69.909]
  - - [30528, 475, 1, 1024]
    - [20, 70.233]
  - - [30528, 477, 1, 1024]
    - [124, 70.175]
  - - [30528, 478, 1, 1024]
    - [124, 70.706]
  - - [30528, 54, 1, 1024]
    - [33, 26.825]
  - - [30528, 545, 1, 1024]
    - [124, 66.788]
  - - [30528, 546, 1, 1024]
    - [124, 67.191]
  - - [30528, 548, 1, 1024]
    - [20, 67.39]
  - - [30528, 549, 1, 1024]
    - [20, 67.395]
  - - [30528, 550, 1, 1024]
    - [20, 67.73]
  - - [30528, 553, 1, 1024]
    - [20, 67.604]
  - - [30528, 555, 1, 1024]
    - [20, 68.084]
  - - [30528, 557, 1, 1024]
    - [20, 67.951]
  - - [30528, 558, 1, 1024]
    - [20, 67.908]
  - - [30528, 559, 1, 1024]
    - [124, 68.054]
  - - [30528, 560, 1, 1024]
    - [124, 68.199]
  - - [30528, 561, 1, 1024]
    - [124, 67.991]
  - - [30528, 562, 1, 1024]
    - [20, 68.775]
  - - [30528, 563, 1, 1024]
    - [20, 68.755]
  - - [30528, 565, 1, 1024]
    - [124, 68.5]
  - - [30528, 566, 1, 1024]
    - [20, 68.716]
  - - [30528, 567, 1, 1024]
    - [20, 68.366]
  - - [30528, 568, 1, 1024]
    - [124, 68.557]
  - - [30528, 569, 1, 1024]
    - [20, 69.128]
  - - [30528, 570, 1, 1024]
    - [124, 69.035]
  - - [30528, 571, 1, 1024]
    - [20, 69.275]
  - - [30528, 572, 1, 1024]
    - [20, 69.134]
  - - [30528, 573, 1, 1024]
    - [20, 69.35]
  - - [30528, 641, 1, 1024]
    - [20, 69.272]
  - - [30528, 642, 1, 1024]
    - [124, 69.53]
  - - [30528, 643, 1, 1024]
    - [20, 69.002]
  - - [30528, 644, 1, 1024]
    - [124, 69.257]
  - - [30528, 645, 1, 1024]
    - [124, 69.28]
  - - [30528, 646, 1, 1024]
    - [20, 69.366]
  - - [30528, 647, 1, 1024]
    - [124, 69.537]
  - - [30528, 648, 1, 1024]
    - [20, 69.538]
  - - [30528, 649, 1, 1024]
    - [124, 69.413]
  - - [30528, 650, 1, 1024]
    - [124, 69.226]
  - - [30528, 651, 1, 1024]
    - [124, 69.818]
  - - [30528, 652, 1, 1024]
    - [20, 69.946]
  - - [30528, 653, 1, 1024]
    - [20, 70.032]
  - - [30528, 657, 1, 1024]
    - [20, 70.333]
  - - [30528, 658, 1, 1024]
    - [20, 70.141]
  - - [30528, 660, 1, 1024]
    - [20, 70.376]
  - - [30528, 661, 1, 1024]
    - [20, 70.632]
  - - [30528, 662, 1, 1024]
    - [20, 70.334]
  - - [30528, 663, 1, 1024]
    - [20, 70.61]
  - - [30528, 664, 1, 1024]
    - [124, 70.781]
  - - [30528, 666, 1, 1024]
    - [124, 70.737]
  - - [30528, 668, 1, 1024]
    - [124, 71.467]
  - - [30528, 669, 1, 1024]
    - [124, 71.12]
  - - [30528, 671, 1, 1024]
    - [124, 71.182]
  - - [30528, 749, 1, 1024]
    - [124, 70.875]
  - - [30528, 750, 1, 1024]
    - [124, 70.989]
  - - [30528, 751, 1, 1024]
    - [124, 71.352]
  - - [30528, 752, 1, 1024]
    - [124, 71.293]
  - - [30528, 753, 1, 1024]
    - [20, 71.292]
  - - [30528, 754, 1, 1024]
    - [20, 71.272]
  - - [30528, 755, 1, 1024]
    - [124, 71.674]
  - - [30528, 756, 1, 1024]
    - [20, 71.614]
  - - [30528, 757, 1, 1024]
    - [124, 71.536]
  - - [30528, 758, 1, 1024]
    - [124, 71.707]
  - - [30528, 759, 1, 1024]
    - [124, 71.783]
  - - [30528, 760, 1, 1024]
    - [124, 71.8]
  - - [30528, 761, 1, 1024]
    - [20, 71.914]
  - - [30528, 762, 1, 1024]
    - [124, 72.028]
  - - [30528, 763, 1, 1024]
    - [124, 72.103]
  - - [30528, 764, 1, 1024]
    - [124, 72.081]
  - - [30528, 765, 1, 1024]
    - [124, 72.156]
  - - [30528, 766, 1, 1024]
    - [124, 72.27]
  - - [30528, 82, 1, 1024]
    - [15, 34.178]
  - - [3072, 3424, 1, 1024]
    - [9, 69.304]
  - - [3072, 368, 1, 1024]
    - [15, 35.538]
  - - [3072, 560, 1, 1024]
    - [32, 47.824]
  - - [3072, 800, 1, 1024]
    - [15, 52.12]
  - - [4096, 128, 1, 1024]
    - [28, 23.086]
  - - [4096, 368, 1, 1024]
    - [6, 43.151]
  - - [48, 48, 16, 64]
    - [119, 0.239]
  - - [1000, 256, 1, 1664]
    - [146, 18.748]
  - - [1000, 64, 1, 1664]
    - [80, 6.817]
  - - [1000, 64, 1, 1920]
    - [80, 7.483]
  - - [1000, 96, 1, 2048]
    - [36, 11.302]
  - - [1000, 96, 1, 4096]
    - [22, 15.018]
  - - [100, 1024, 1, 1000]
    - [159, 5.06]
  - - [100, 4, 1, 768]
    - [108, 0.027]
  - - [100, 5376, 1, 1280]
    - [31, 22.537]
  - - [100, 5376, 1, 768]
    - [41, 16.915]
  - - [100, 896, 1, 1280]
    - [17, 7.831]
  - - [1024, 3584, 1, 1024]
    - [15, 57.45]
  - - [1280, 224, 1, 5120]
    - [16, 32.882]
  - - [1280, 5376, 1, 3840]
    - [114, 77.266]
  - - [1280, 5376, 1, 5120]
    - [114, 79.611]
  - - [1280, 896, 1, 1280]
    - [33, 40.047]
  - - [1344, 128, 1, 49]
    - [83, 0.709]
  - - [3072, 224, 1, 768]
    - [28, 23.816]
  - - [4000, 1024, 1, 1000]
    - [9, 41.725]
  - - [4000, 32768, 1, 1000]
    - [277, 70.744]
  - - [4000, 8192, 1, 1000]
    - [277, 65.065]
  - - [4000, 8192, 1, 224]
    - [193, 47.691]
  - - [4096, 256, 1, 25088]
    - [147, 68.449]
  - - [4096, 256, 1, 4096]
    - [15, 54.739]
  - - [4096, 896, 1, 1024]
    - [9, 57.217]
  - - [4096, 96, 1, 25088]
    - [238, 44.636]
  - - [768, 224, 1, 2304]
    - [58, 17.512]
  - - [768, 224, 1, 3072]
    - [58, 19.847]
  - - [768, 224, 1, 768]
    - [58, 8.913]
  - - [768, 896, 1, 768]
    - [28, 25.123]
  - - [224, 224, 64, 64]
    - [8, 8.871]
  - - [64, 224, 48, 224]
    - [106, 9.438]
  - - [1536, 384, 1, 1536]
    - [28, 31.119]
  - - [1536, 384, 1, 6144]
    - [199, 49.488]
  - - [1536, 4, 1, 1536]
    - [22, 0.578]
  - - [1536, 512, 1, 1536]
    - [28, 41.492]
  - - [1536, 512, 1, 6144]
    - [129, 64.729]
  - - [128, 128, 72, 64]
    - [81, 4.674]
  - - [512, 128, 72, 64]
    - [105, 10.835]
  - - [512, 128, 96, 64]
    - [1, 11.514]
  - - [256, 256, 3072, 64]
    - [261, 19.258]
  - - [256, 256, 384, 64]
    - [188, 16.724]
  - - [64, 64, 96, 64]
    - [308, 1.62]
  - - [256, 256, 32, 64]
    - [268, 6.407]
  - - [64, 64, 256, 64]
    - [177, 3.897]
  - - [256, 256, 96, 64]
    - [261, 11.543]
  - - [256, 256, 768, 64]
    - [261, 17.966]
  - - [128, 128, 32, 64]
    - [58, 2.112]
  - - [16, 16, 96, 64]
    - [186, 0.112]
  - - [16, 16, 64, 64]
    - [94, 0.084]
  - - [128, 128, 96, 64]
    - [184, 5.3]
  - - [256, 256, 512, 64]
    - [200, 17.609]
  - - [64, 64, 64, 64]
    - [180, 1.174]
  - - [32, 32, 384, 64]
    - [12, 1.602]
  - - [16, 16, 48, 64]
    - [12, 0.068]
  - - [128, 128, 3072, 64]
    - [42, 16.444]
  - - [32, 32, 512, 64]
    - [307, 2.112]
  - - [256, 256, 256, 64]
    - [48, 15.43]
  - - [32, 32, 128, 64]
    - [12, 0.573]
  - - [32, 32, 1536, 64]
    - [307, 4.725]
  - - [32, 32, 24, 64]
    - [73, 0.137]
  - - [256, 256, 48, 64]
    - [268, 8.308]
  - - [32, 32, 256, 64]
    - [101, 1.099]
  - - [64, 64, 128, 64]
    - [307, 2.124]
  - - [16, 16, 128, 64]
    - [101, 0.141]
  - - [128, 128, 384, 64]
    - [28, 10.879]
  - - [256, 256, 2048, 64]
    - [215, 19.141]
  - - [256, 256, 1536, 64]
    - [150, 18.912]
  - - [256, 256, 64, 64]
    - [105, 9.851]
  - - [64, 64, 48, 64]
    - [24, 0.933]
  - - [64, 64, 32, 64]
    - [31, 0.63]
  - - [256, 256, 128, 64]
    - [188, 13.235]
  - - [16, 16, 2048, 64]
    - [12, 1.929]
  - - [256, 256, 192, 64]
    - [188, 14.563]
  - - [16, 16, 768, 64]
    - [186, 0.854]
  - - [16, 16, 256, 64]
    - [186, 0.286]
  - - [384, 384, 48, 64]
    - [66, 12.094]
  - - [256, 256, 24, 64]
    - [198, 5.3]
  - - [32, 32, 96, 64]
    - [101, 0.432]
  - - [64, 64, 12, 64]
    - [128, 0.264]
  - - [128, 128, 768, 64]
    - [32, 13.521]
  - - [128, 128, 12, 64]
    - [5, 0.933]
  - - [16, 16, 32, 64]
    - [186, 0.049]
  - - [256, 256, 1024, 64]
    - [302, 18.476]
  - - [768, 1, 1, 768]
    - [21, 0.042]
  - - [768, 2, 1, 768]
    - [36, 0.084]
  - - [768, 8, 1, 768]
    - [21, 0.332]
  - - [1024, 2, 1, 1024]
    - [22, 0.139]
  - - [768, 128, 1, 768]
    - [324, 6.119]
  - - [768, 64, 1, 768]
    - [36, 2.609]
  - - [768, 256, 1, 768]
    - [327, 11.417]
  - - [512, 2048, 1, 39488]
    - [310, 71.48]
  - - [512, 2048, 1, 1414]
    - [311, 40.071]
  - - [2048, 2048, 1, 1414]
    - [312, 50.548]
  - - [160, 2048, 1, 768]
    - [313, 22.129]
  - - [128, 2048, 1, 768]
    - [314, 19.202]
  - - [128, 2048, 1, 512]
    - [315, 15.509]
  - - [160, 4, 512, 32]
    - [316, 1.615]
  - - [64, 262144, 1, 742]
    - [44, 32.233]
  - - [96, 70298, 1, 192]
    - [107, 27.074]
  - - [96, 122880, 1, 192]
    - [107, 33.596]
  - - [96, 2256, 1, 192]
    - [58, 1.931]
  - - [96, 20480, 1, 192]
    - [137, 12.716]
  - - [96, 10240, 1, 192]
    - [74, 7.671]
  - - [96, 1988, 1, 192]
    - [51, 1.646]
  - - [96, 1024, 1, 192]
    - [94, 0.868]
  - - [96, 61440, 1, 192]
    - [15, 24.65]
  - - [96, 2298, 1, 192]
    - [58, 1.908]
  - - [96, 235520, 1, 192]
    - [107, 39.578]
  - - [96, 512000, 1, 192]
    - [15, 45.473]
  - - [96, 70938, 1, 192]
    - [147, 26.591]
  - - [64, 327680, 1, 4]
    - [300, 1.298]
  - - [64, 327680, 1, 379]
    - [113, 25.244]
  - - [64, 327680, 1, 851]
    - [93, 32.913]
  - - [23744, 2048, 1, 256]
    - [20, 43.328]
  - - [256, 2048, 1, 4096]
    - [44, 31.518]
  - - [128, 2048, 1, 480]
    - [5, 4.743]
  - - [128, 2048, 1, 3200]
    - [60, 18.689]
  - - [3840, 2048, 1, 128]
    - [143, 19.117]
  - - [128, 2048, 1, 3840]
    - [16, 20.924]
  - - [1024, 2048, 1, 2048]
    - [53, 50.547]
  - - [256, 2048, 1, 256]
    - [41, 5.392]
  - - [256, 2048, 1, 328]
    - [180, 5.896]
  - - [256, 2048, 1, 120]
    - [30, 2.417]
  - - [256, 2048, 1, 704]
    - [314, 13.017]
  - - [256, 2048, 1, 3200]
    - [37, 29.373]
  - - [128, 2048, 1, 2048]
    - [60, 15.07]
  - - [512, 2048, 1, 120]
    - [294, 4.524]
  - - [256, 2048, 1, 1456]
    - [129, 17.093]
  - - [128, 2048, 1, 64]
    - [51, 0.79]
  - - [2048, 2048, 1, 1024]
    - [42, 48.238]
  - - [256, 2048, 1, 5552]
    - [32, 33.888]
  - - [2048, 2048, 1, 1456]
    - [69, 48.118]
  - - [512, 2048, 1, 23744]
    - [238, 66.763]
  - - [1456, 2048, 1, 128]
    - [71, 11.773]
  - - [4096, 2048, 1, 256]
    - [42, 30.101]
  - - [2048, 2048, 1, 3840]
    - [44, 65.152]
  - - [256, 2048, 1, 480]
    - [5, 8.802]
  - - [128, 2048, 1, 1456]
    - [16, 10.654]
  - - [1024, 1024, 1, 15296]
    - [20, 61.331]
  - - [15040, 1024, 1, 256]
    - [20, 37.296]
  - - [128, 1024, 1, 953]
    - [58, 4.183]
  - - [8, 1024, 1, 15296]
    - [167, 2.557]
  - - [128, 1024, 1, 128]
    - [158, 0.791]
  - - [256, 1024, 1, 384]
    - [314, 4.278]
  - - [7, 1024, 1, 128]
    - [23, 0.043]
  - - [8, 1024, 1, 1024]
    - [36, 0.356]
  - - [128, 1024, 1, 1024]
    - [58, 5.132]
  - - [384, 1024, 1, 946]
    - [120, 10.79]
  - - [256, 1024, 1, 15040]
    - [238, 40.232]
  - - [160, 2048, 1, 64]
    - [116, 1.004]
  - - [27232, 2048, 1, 512]
    - [20, 58.666]
  - - [2048, 2048, 1, 512]
    - [42, 35.654]
  - - [12128, 2048, 1, 512]
    - [124, 56.153]
  - - [1414, 2048, 1, 512]
    - [31, 28.75]
  - - [160, 2048, 1, 2048]
    - [24, 19.19]
  - - [39488, 2048, 1, 512]
    - [20, 60.245]
  - - [512, 2048, 1, 5120]
    - [20, 50.608]
  - - [4096, 2048, 1, 3200]
    - [155, 68.168]
  - - [512, 2048, 1, 6534]
    - [9, 49.613]
  - - [5120, 2048, 1, 512]
    - [124, 48.656]
  - - [4096, 2048, 1, 4096]
    - [114, 70.848]
  - - [512, 2048, 1, 512]
    - [31, 16.115]
  - - [512, 7808, 1, 512]
    - [102, 40.069]
  - - [2048, 95232, 1, 512]
    - [15, 74.613]
  - - [2048, 53248, 1, 512]
    - [147, 73.776]
  - - [512, 23808, 1, 2048]
    - [44, 71.417]
  - - [2048, 23808, 1, 512]
    - [13, 70.837]
  - - [2048, 9728, 1, 512]
    - [143, 63.296]
  - - [2048, 13312, 1, 512]
    - [20, 65.86]
  - - [2048, 8704, 1, 512]
    - [113, 61.932]
  - - [512, 23808, 1, 512]
    - [102, 57.404]
  - - [512, 7680, 1, 512]
    - [143, 40.342]
  - - [512, 9728, 1, 512]
    - [198, 42.638]
  - - [2048, 32856, 1, 512]
    - [13, 71.689]
  - - [512, 18688, 1, 2048]
    - [44, 70.043]
  - - [2048, 9344, 1, 512]
    - [13, 62.071]
  - - [512, 22272, 1, 512]
    - [165, 56.663]
  - - [512, 26624, 1, 2048]
    - [279, 72.849]
  - - [2048, 7680, 1, 512]
    - [13, 61.487]
  - - [512, 7424, 1, 512]
    - [45, 38.671]
  - - [2048, 106496, 1, 512]
    - [102, 75.514]
  - - [512, 8320, 1, 512]
    - [204, 40.864]
  - - [512, 8320, 1, 2048]
    - [44, 64.116]
  - - [2048, 50688, 1, 512]
    - [147, 73.357]
  - - [512, 9088, 1, 512]
    - [71, 41.287]
  - - [2048, 16640, 1, 512]
    - [9, 67.796]
  - - [512, 12672, 1, 512]
    - [165, 49.221]
  - - [2048, 9216, 1, 512]
    - [13, 64.586]
  - - [512, 13312, 1, 512]
    - [71, 47.812]
  - - [512, 8832, 1, 512]
    - [32, 41.363]
  - - [2048, 8192, 1, 512]
    - [124, 60.884]
  - - [512, 26624, 1, 512]
    - [20, 58.812]
  - - [512, 95232, 1, 512]
    - [13, 71.077]
  - - [512, 13160, 1, 512]
    - [113, 47.567]
  - - [512, 8704, 1, 2048]
    - [176, 65.604]
  - - [512, 18944, 1, 512]
    - [71, 53.097]
  - - [512, 47616, 1, 512]
    - [13, 65.033]
  - - [512, 16640, 1, 512]
    - [93, 51.14]
  - - [512, 7808, 1, 2048]
    - [147, 65.25]
  - - [512, 19456, 1, 2048]
    - [107, 70.186]
  - - [2048, 38912, 1, 512]
    - [13, 72.39]
  - - [512, 38912, 1, 2048]
    - [13, 77.009]
  - - [2048, 2640, 1, 512]
    - [113, 42.68]
  - - [512, 9472, 1, 2048]
    - [13, 63.273]
  - - [512, 50688, 1, 2048]
    - [13, 76.731]
  - - [512, 8192, 1, 2048]
    - [44, 62.684]
  - - [512, 9472, 1, 512]
    - [113, 42.127]
  - - [2048, 26624, 1, 512]
    - [13, 70.642]
  - - [512, 13312, 1, 2048]
    - [279, 68.092]
  - - [512, 19456, 1, 512]
    - [42, 53.142]
  - - [512, 94644, 1, 2048]
    - [13, 79.954]
  - - [512, 106496, 1, 2048]
    - [20, 79.463]
  - - [512, 22272, 1, 2048]
    - [13, 72.411]
  - - [2048, 44544, 1, 512]
    - [147, 72.943]
  - - [512, 11136, 1, 512]
    - [44, 45.07]
  - - [512, 8960, 1, 512]
    - [198, 41.006]
  - - [512, 6784, 1, 2048]
    - [114, 62.152]
  - - [512, 50688, 1, 512]
    - [15, 65.323]
  - - [512, 7680, 1, 2048]
    - [165, 65.569]
  - - [512, 94644, 1, 512]
    - [9, 69.958]
  - - [2048, 9088, 1, 512]
    - [143, 62.656]
  - - [512, 106496, 1, 512]
    - [9, 70.519]
  - - [512, 8064, 1, 2048]
    - [113, 61.324]
  - - [2048, 8064, 1, 512]
    - [71, 60.943]
  - - [512, 2640, 1, 512]
    - [28, 21.13]
  - - [512, 38912, 1, 512]
    - [9, 63.087]
  - - [512, 9216, 1, 512]
    - [165, 42.801]
  - - [512, 47616, 1, 2048]
    - [20, 75.963]
  - - [512, 44544, 1, 2048]
    - [13, 78.462]
  - - [2048, 13160, 1, 512]
    - [9, 65.779]
  - - [2048, 17408, 1, 512]
    - [9, 68.14]
  - - [2048, 6784, 1, 512]
    - [113, 58.595]
  - - [2048, 7808, 1, 512]
    - [115, 61.633]
  - - [512, 12672, 1, 2048]
    - [15, 70.001]
  - - [2048, 12672, 1, 512]
    - [20, 65.489]
  - - [512, 44544, 1, 512]
    - [13, 65.276]
  - - [512, 17408, 1, 2048]
    - [13, 70.772]
  - - [512, 25344, 1, 512]
    - [165, 58.519]
  - - [2048, 8320, 1, 512]
    - [13, 61.484]
  - - [512, 2640, 1, 2048]
    - [44, 42.68]
  - - [2048, 22272, 1, 512]
    - [13, 70.005]
  - - [512, 18944, 1, 2048]
    - [4, 70.825]
  - - [512, 18688, 1, 512]
    - [32, 53.131]
  - - [512, 53248, 1, 512]
    - [20, 65.718]
  - - [512, 7424, 1, 2048]
    - [107, 62.295]
  - - [512, 53248, 1, 2048]
    - [13, 76.377]
  - - [2048, 15360, 1, 512]
    - [9, 66.862]
  - - [512, 9216, 1, 2048]
    - [13, 62.65]
  - - [2048, 19456, 1, 512]
    - [13, 69.111]
  - - [2048, 18944, 1, 512]
    - [147, 68.463]
  - - [2048, 18688, 1, 512]
    - [20, 68.462]
  - - [2048, 11136, 1, 512]
    - [13, 65.567]
  - - [512, 9728, 1, 2048]
    - [20, 64.804]
  - - [2048, 47616, 1, 512]
    - [13, 73.527]
  - - [512, 17408, 1, 512]
    - [71, 53.326]
  - - [512, 11136, 1, 2048]
    - [88, 63.679]
  - - [512, 8064, 1, 512]
    - [44, 39.931]
  - - [512, 9088, 1, 2048]
    - [107, 61.362]
  - - [512, 9344, 1, 512]
    - [71, 42.219]
  - - [2048, 8960, 1, 512]
    - [102, 61.659]
  - - [512, 11904, 1, 2048]
    - [44, 67.75]
  - - [512, 8704, 1, 512]
    - [71, 42.076]
  - - [512, 6784, 1, 512]
    - [44, 38.293]
  - - [512, 15360, 1, 512]
    - [165, 53.238]
  - - [512, 13160, 1, 2048]
    - [222, 66.69]
  - - [2048, 8832, 1, 512]
    - [13, 62.704]
  - - [2048, 25344, 1, 512]
    - [13, 70.737]
  - - [2048, 9472, 1, 512]
    - [113, 62.709]
  - - [512, 9344, 1, 2048]
    - [147, 62.299]
  - - [512, 32856, 1, 2048]
    - [13, 74.328]
  - - [512, 8832, 1, 2048]
    - [9, 60.711]
  - - [512, 16640, 1, 2048]
    - [176, 68.2]
  - - [512, 25344, 1, 2048]
    - [165, 73.943]
  - - [2048, 94644, 1, 512]
    - [147, 75.217]
  - - [512, 32856, 1, 512]
    - [20, 60.942]
  - - [512, 95232, 1, 2048]
    - [13, 78.707]
  - - [2048, 7424, 1, 512]
    - [71, 59.862]
  - - [512, 11904, 1, 512]
    - [71, 46.863]
  - - [512, 15360, 1, 2048]
    - [165, 71.415]
  - - [512, 8192, 1, 512]
    - [44, 39.768]
  - - [2048, 11904, 1, 512]
    - [20, 65.53]
  - - [512, 8960, 1, 2048]
    - [107, 60.6]
  - - [1000, 128, 1, 384]
    - [10, 3.377]
  - - [1000, 352, 1, 384]
    - [51, 8.322]
  - - [1000, 464, 1, 384]
    - [26, 10.087]
  - - [147, 64, 1, 3136]
    - [94, 1.15]
  - - [1536, 25216, 1, 384]
    - [45, 65.048]
  - - [1536, 69344, 1, 384]
    - [147, 69.46]
  - - [1536, 91408, 1, 384]
    - [147, 69.995]
  - - [1728, 384, 1, 196]
    - [180, 6.691]
  - - [192, 100352, 1, 192]
    - [44, 36.916]
  - - [192, 100352, 1, 768]
    - [44, 52.958]
  - - [192, 275968, 1, 192]
    - [6, 41.318]
  - - [192, 275968, 1, 768]
    - [6, 56.156]
  - - [192, 363776, 1, 192]
    - [6, 41.944]
  - - [192, 363776, 1, 768]
    - [6, 56.708]
  - - [256, 1103872, 1, 64]
    - [225, 20.644]
  - - [256, 1455104, 1, 64]
    - [225, 20.739]
  - - [256, 401408, 1, 64]
    - [297, 19.923]
  - - [384, 17600, 1, 384]
    - [107, 43.77]
  - - [384, 23200, 1, 384]
    - [9, 48.057]
  - - [384, 25216, 1, 1536]
    - [28, 70.553]
  - - [384, 25216, 1, 384]
    - [20, 48.654]
  - - [384, 6400, 1, 384]
    - [102, 30.729]
  - - [384, 69344, 1, 1536]
    - [147, 77.996]
  - - [384, 69344, 1, 384]
    - [107, 59.689]
  - - [384, 91408, 1, 1536]
    - [15, 78.978]
  - - [384, 91408, 1, 384]
    - [107, 61.931]
  - - [576, 192, 1, 784]
    - [119, 4.652]
  - - [64, 1103872, 1, 256]
    - [209, 29.93]
  - - [64, 1103872, 1, 64]
    - [33, 19.369]
  - - [64, 1455104, 1, 256]
    - [209, 30.512]
  - - [64, 1455104, 1, 64]
    - [33, 19.646]
  - - [64, 401408, 1, 256]
    - [207, 28.955]
  - - [64, 401408, 1, 64]
    - [31, 17.199]
  - - [768, 100352, 1, 192]
    - [143, 47.214]
  - - [768, 275968, 1, 192]
    - [143, 49.318]
  - - [768, 363776, 1, 192]
    - [143, 49.678]
  - - [192, 192, 128, 196]
    - [223, 17.28]
  - - [192, 192, 352, 196]
    - [66, 22.041]
  - - [192, 192, 464, 196]
    - [66, 22.712]
  - - [196, 784, 1056, 64]
    - [300, 14.769]
  - - [196, 784, 1392, 64]
    - [287, 14.772]
  - - [196, 784, 384, 64]
    - [300, 14.107]
  - - [50, 197, 2112, 64]
    - [177, 7.367]
  - - [50, 197, 2784, 64]
    - [177, 7.532]
  - - [50, 197, 768, 64]
    - [177, 6.588]
  - - [64, 197, 2112, 50]
    - [133, 9.363]
  - - [64, 197, 2784, 50]
    - [30, 9.506]
  - - [64, 197, 768, 50]
    - [133, 8.01]
  - - [64, 64, 128, 784]
    - [139, 12.972]
  - - [64, 64, 352, 784]
    - [180, 16.12]
  - - [64, 64, 464, 784]
    - [267, 16.94]
  - - [64, 784, 1056, 196]
    - [172, 18.548]
  - - [64, 784, 1392, 196]
    - [172, 18.697]
  - - [64, 784, 384, 196]
    - [287, 17.884]
  - - [784, 3136, 128, 64]
    - [56, 23.245]
  - - [784, 3136, 352, 64]
    - [95, 23.581]
  - - [784, 3136, 464, 64]
    - [95, 23.626]
  - - [9, 1, 192, 196]
    - [12, 0.021]
  - - [9, 1, 384, 196]
    - [94, 0.043]
  - - [9, 1, 384, 49]
    - [75, 0.011]
  - - [1000, 256, 1, 384]
    - [51, 6.119]
  - - [1536, 50432, 1, 384]
    - [45, 68.999]
  - - [192, 200704, 1, 192]
    - [44, 40.249]
  - - [192, 200704, 1, 768]
    - [44, 55.878]
  - - [256, 802816, 1, 64]
    - [282, 20.417]
  - - [384, 12800, 1, 384]
    - [15, 39.821]
  - - [384, 50432, 1, 1536]
    - [15, 76.027]
  - - [384, 50432, 1, 384]
    - [107, 57.346]
  - - [64, 802816, 1, 256]
    - [209, 29.49]
  - - [64, 802816, 1, 64]
    - [33, 18.654]
  - - [768, 200704, 1, 192]
    - [143, 48.918]
  - - [192, 192, 256, 196]
    - [66, 20.592]
  - - [196, 784, 768, 64]
    - [300, 14.653]
  - - [50, 197, 1536, 64]
    - [177, 7.186]
  - - [64, 197, 1536, 50]
    - [133, 9.031]
  - - [64, 64, 256, 784]
    - [153, 15.778]
  - - [64, 784, 768, 196]
    - [172, 18.363]
  - - [784, 3136, 256, 64]
    - [95, 23.587]
  - - [9, 1, 64, 3136]
    - [17, 0.075]
  - - [9, 1, 192, 784]
    - [94, 0.071]
  - - [9, 1, 64, 784]
    - [17, 0.025]
  - - [147, 256, 1, 9216]
    - [317, 8.915]
  - - [768, 9408, 1, 768]
    - [318, 53.248]
  - - [2048, 9216, 1, 2048]
    - [319, 78.713]
  - - [2048, 9216, 1, 8192]
    - [320, 86.532]
  - - [2304, 512, 1, 2304]
    - [321, 45.878]
  - - [4096, 36864, 1, 1024]
    - [318, 78.047]
  - - [4608, 1024, 1, 576]
    - [318, 42.799]
  - - [8192, 9216, 1, 2048]
    - [318, 81.647]
  - - [9216, 2048, 1, 144]
    - [322, 23.539]
  - - [3129, 128, 1, 768]
    - [331, 18.532]
  - - [3129, 162, 1, 768]
    - [323, 20.119]
  - - [3129, 20, 1, 768]
    - [324, 3.813]
  - - [3129, 256, 1, 768]
    - [325, 29.493]
  - - [3129, 83, 1, 768]
    - [334, 12.484]
  - - [768, 1000, 1, 2054]
    - [326, 34.848]
  - - [768, 1050, 1, 2054]
    - [335, 36.235]
  - - [768, 162, 1, 768]
    - [336, 7.177]
  - - [768, 21, 1, 768]
    - [337, 1.049]
  - - [768, 83, 1, 768]
    - [328, 3.968]
  - - [178, 178, 1536, 64]
    - [338, 18.201]
  - - [64, 178, 1536, 178]
    - [332, 16.119]
  - - [3072, 1536, 1, 768]
    - [341, 58.242]
  - - [3072, 512, 1, 768]
    - [339, 44.186]
  - - [768, 1536, 1, 3072]
    - [329, 65.534]
  - - [768, 1536, 1, 768]
    - [329, 38.663]
  - - [768, 512, 1, 3072]
    - [330, 44.915]
  - - [768, 512, 1, 768]
    - [330, 20.496]
  - - [512, 512, 288, 64]
    - [333, 27.959]
  - - [64, 512, 288, 512]
    - [340, 42.264]
  - - [3072, 14774, 1, 768]
    - [348, 82.224]
  - - [3072, 22784, 1, 768]
    - [349, 83.636]
  - - [3072, 28836, 1, 768]
    - [350, 84.525]
  - - [3072, 45568, 1, 768]
    - [350, 85.75]
  - - [768, 12800, 1, 2054]
    - [344, 72.493]
  - - [768, 14774, 1, 3072]
    - [351, 82.918]
  - - [768, 14774, 1, 768]
    - [352, 71.504]
  - - [768, 22784, 1, 3072]
    - [353, 89.363]
  - - [768, 22784, 1, 768]
    - [354, 77.444]
  - - [768, 28836, 1, 3072]
    - [355, 87.218]
  - - [768, 28836, 1, 768]
    - [356, 77.297]
  - - [768, 45568, 1, 3072]
    - [355, 90.39]
  - - [768, 45568, 1, 768]
    - [355, 82.083]
  - - [30522, 12288, 1, 768]
    - [342, 73.891]
  - - [30522, 1536, 1, 768]
    - [358, 72.748]
  - - [30522, 512, 1, 768]
    - [343, 61.545]
  - - [768, 12288, 1, 3072]
    - [351, 88.419]
  - - [768, 12288, 1, 768]
    - [357, 74.097]
  - - [3072, 12288, 1, 768]
    - [352, 82.272]
  - - [768, 3560, 1, 3072]
    - [360, 71.687]
  - - [768, 3560, 1, 768]
    - [361, 49.491]
  - - [768, 3738, 1, 3072]
    - [362, 73.762]
  - - [768, 3738, 1, 768]
    - [363, 49.679]
  - - [768, 4150, 1, 2054]
    - [345, 57.397]
  - - [768, 6400, 1, 2054]
    - [346, 69.61]
  - - [768, 8100, 1, 2054]
    - [347, 61.81]
  - - [3072, 3560, 1, 768]
    - [359, 69.476]
  - - [3072, 3738, 1, 768]
    - [350, 71.173]
  - - [12288, 2048, 1, 8192]
    - [364, 92.453]
  - - [16384, 2048, 1, 8192]
    - [365, 87.656]
  - - [64000, 2048, 1, 8192]
    - [366, 92.282]
  - - [64000, 512, 1, 8192]
    - [367, 89.195]
  - - [8192, 2048, 1, 16384]
    - [368, 88.173]
  - - [8192, 2048, 1, 4096]
    - [369, 83.455]
  - - [12288, 512, 1, 8192]
    - [370, 83.287]
  - - [16384, 512, 1, 8192]
    - [365, 84.732]
  - - [8192, 512, 1, 16384]
    - [371, 87.378]
  - - [8192, 512, 1, 4096]
    - [372, 77.161]
  - - [512, 512, 128, 128]
    - [373, 23.23]
  - - [3072, 28672, 1, 1024]
    - [374, 80.8]
  - - [4096, 28672, 1, 1024]
    - [374, 81.185]
  - - [1024, 12672, 1, 4096]
    - [375, 84.452]
  - - [1024, 11648, 1, 4096]
    - [375, 84.837]
  - - [1024, 12576, 1, 4096]
    - [376, 83.794]
  - - [1024, 14416, 1, 1024]
    - [375, 73.315]
  - - [1024, 12672, 1, 1024]
    - [375, 72.407]
  - - [1024, 11648, 1, 1024]
    - [375, 71.325]
  - - [1024, 13264, 1, 1024]
    - [377, 70.992]
  - - [3072, 11648, 1, 1024]
    - [374, 77.633]
  - - [3072, 12032, 1, 1024]
    - [374, 77.711]
  - - [3072, 12576, 1, 1024]
    - [374, 78.495]
  - - [3072, 13424, 1, 1024]
    - [374, 78.414]
  - - [3072, 13264, 1, 1024]
    - [374, 78.529]
  - - [4096, 96, 1, 1024]
    - [378, 15.216]
  - - [1024, 3882816, 1, 512]
    - [379, 78.871]
  - - [4096, 192, 1, 1024]
    - [380, 25.859]
  - - [4096, 88, 1, 1024]
    - [378, 14.028]
  - - [512, 128, 1, 512]
    - [381, 1.847]
  - - [512, 82, 1, 512]
    - [382, 1.332]
  - - [2048, 192, 1, 512]
    - [383, 9.643]
- null
