library/src/blas3/Tensile/Logic/vega10_deepbench/Cijk_Ailk_Bljk_SB.yaml
- {MinimumRequiredVersion: 3.3.0}
- Tensile
- default
- AssignedDerivedParameters: true
- - - [8448, 48000, 1, 2816]
    - [34, 10735.1]
  - - [2048, 7000, 1, 2048]
    - [31, 9949.54]
  - - [7680, 64, 1, 2560]
    - [13, 5851.33]
  - - [4096, 64, 1, 4096]
    - [11, 5551.55]
  - - [512, 24000, 1, 2048]
    - [31, 9737.97]
  - - [5124, 9124, 1, 2560]
    - [33, 10463.4]
  - - [1024, 48000, 1, 1530]
    - [32, 11177.3]
  - - [2048, 32, 1, 2048]
    - [20, 2684.27]
  - - [3072, 48000, 1, 1024]
    - [28, 9810.44]
  - - [5124, 9124, 1, 4096]
    - [34, 10170.2]
  - - [5124, 9124, 1, 1760]
    - [33, 11076.1]
  - - [4096, 32, 1, 4096]
    - [27, 4752.5]
  - - [2048, 64, 1, 2048]
    - [26, 4122.61]
  - - [512, 48000, 1, 2560]
    - [33, 10609.1]
  - - [4096, 128, 1, 4096]
    - [24, 6375.68]
  - - [4608, 24000, 1, 1536]
    - [33, 10452.7]
  - - [7680, 48000, 1, 2560]
    - [33, 10695.2]
  - - [2560, 16, 1, 2560]
    - [9, 2128.63]
  - - [512, 16, 1, 512]
    - [8, 293.37]
  - - [3072, 24000, 1, 1024]
    - [28, 9714.94]
  - - [2560, 64, 1, 2560]
    - [19, 4936.48]
  - - [512, 24000, 1, 1530]
    - [33, 10714.3]
  - - [1024, 16, 1, 500000]
    - [1, 2502.07]
  - - [3072, 16, 1, 1024]
    - [22, 1665.32]
  - - [3072, 128, 1, 1024]
    - [14, 4734.9]
  - - [2560, 7000, 1, 2560]
    - [33, 10421.7]
  - - [6144, 16, 1, 2048]
    - [27, 2568.84]
  - - [1760, 64, 1, 1760]
    - [24, 4365.84]
  - - [512, 24000, 1, 2816]
    - [33, 10436.5]
  - - [6144, 32, 1, 2048]
    - [25, 4249.93]
  - - [2560, 128, 1, 2560]
    - [14, 6358.38]
  - - [1024, 16, 1, 512]
    - [8, 536.699]
  - - [1024, 24000, 1, 2048]
    - [31, 10271.3]
  - - [1760, 7000, 1, 1760]
    - [33, 10655.0]
  - - [4096, 16, 1, 4096]
    - [10, 2629.73]
  - - [1024, 32, 1, 512]
    - [18, 916.963]
  - - [512, 48000, 1, 2048]
    - [31, 10074.2]
  - - [4608, 48000, 1, 1536]
    - [33, 10466.5]
  - - [35, 8457, 1, 4096]
    - [6, 3800.07]
  - - [8448, 32, 1, 2816]
    - [27, 4684.05]
  - - [1024, 8, 1, 500000]
    - [2, 1332.91]
  - - [8448, 16, 1, 2816]
    - [14, 2518.82]
  - - [2048, 128, 1, 2048]
    - [14, 5103.92]
  - - [4608, 16, 1, 1536]
    - [21, 2187.09]
  - - [1024, 24000, 1, 2560]
    - [33, 10520.5]
  - - [1760, 16, 1, 1760]
    - [23, 1698.13]
  - - [1024, 48000, 1, 2560]
    - [34, 10650.2]
  - - [5124, 9124, 1, 2048]
    - [28, 10119.6]
  - - [1024, 700, 1, 512]
    - [30, 4984.27]
  - - [2560, 32, 1, 2560]
    - [13, 3667.22]
  - - [1760, 32, 1, 1760]
    - [12, 3034.31]
  - - [35, 8457, 1, 1760]
    - [5, 3968.77]
  - - [6144, 24000, 1, 2048]
    - [34, 10354.4]
  - - [4096, 7000, 1, 4096]
    - [34, 10419.4]
  - - [1024, 24000, 1, 1530]
    - [32, 11051.7]
  - - [3072, 32, 1, 1024]
    - [12, 2430.98]
  - - [35, 8457, 1, 2560]
    - [4, 3725.18]
  - - [6144, 48000, 1, 2048]
    - [35, 10347.0]
  - - [4608, 32, 1, 1536]
    - [7, 3609.87]
  - - [512, 32, 1, 512]
    - [17, 539.252]
  - - [1024, 48000, 1, 2816]
    - [34, 10658.0]
  - - [3072, 64, 1, 1024]
    - [16, 3648.11]
  - - [512, 48000, 1, 1530]
    - [32, 11073.1]
  - - [512, 48000, 1, 2816]
    - [33, 10801.9]
  - - [2048, 16, 1, 2048]
    - [17, 1830.2]
  - - [8448, 24000, 1, 2816]
    - [33, 10754.9]
  - - [7680, 16, 1, 2560]
    - [14, 2493.6]
  - - [7680, 24000, 1, 2560]
    - [34, 10707.8]
  - - [1760, 128, 1, 1760]
    - [19, 5587.2]
  - - [35, 8457, 1, 2048]
    - [4, 3369.07]
  - - [512, 8, 1, 500000]
    - [0, 1289.22]
  - - [512, 24000, 1, 2560]
    - [33, 10248.3]
  - - [7680, 32, 1, 2560]
    - [15, 4444.37]
  - - [1024, 48000, 1, 2048]
    - [31, 10399.5]
  - - [512, 16, 1, 500000]
    - [3, 2403.8]
  - - [1024, 24000, 1, 2816]
    - [33, 10502.0]
- - - -1
    - - - -1
        - - - 64
            - - [64, 13]
              - [128, 24]
              - [704, 30]
              - [-1, 33]
          - - 128
            - - [128, 17]
              - [704, 12]
              - [1408, 24]
              - [1856, 11]
              - [2368, 24]
              - [2944, 11]
              - [4288, 24]
              - [5056, 11]
              - [5888, 30]
              - [-1, 11]
          - - 256
            - - [64, 17]
              - [256, 13]
              - [448, 24]
              - [5056, 30]
              - [5888, 32]
              - [-1, 30]
          - - 448
            - - [64, 12]
              - [128, 13]
              - [256, 24]
              - [448, 19]
              - [1408, 30]
              - [1856, 33]
              - [2368, 30]
              - [2944, 33]
              - [3584, 30]
              - [4288, 29]
              - [5056, 30]
              - [5888, 32]
              - [-1, 29]
          - - 704
            - - [64, 12]
              - [128, 13]
              - [2368, 30]
              - [5888, 29]
              - [-1, 33]
          - - 1024
            - - [64, 12]
              - [128, 24]
              - [1024, 30]
              - [-1, 33]
          - - 1408
            - - [64, 13]
              - [128, 24]
              - [448, 30]
              - [1024, 33]
              - [1856, 32]
              - [2368, 33]
              - [2944, 32]
              - [5888, 33]
              - [-1, 32]
          - - 1856
            - - [64, 24]
              - [128, 11]
              - [256, 30]
              - [448, 33]
              - [704, 30]
              - [1024, 33]
              - [1408, 29]
              - [2944, 33]
              - [3584, 29]
              - [4288, 33]
              - [5056, 32]
              - [-1, 33]
          - - 2368
            - - [64, 19]
              - [128, 24]
              - [704, 30]
              - [1408, 32]
              - [3584, 33]
              - [4288, 32]
              - [-1, 33]
          - - 2944
            - - [64, 24]
              - [128, 11]
              - [256, 30]
              - [1024, 33]
              - [1408, 32]
              - [-1, 33]
          - - 3584
            - - [64, 19]
              - [128, 30]
              - [256, 32]
              - [448, 30]
              - [704, 32]
              - [1856, 33]
              - [2368, 32]
              - [-1, 33]
          - - 4288
            - - [128, 24]
              - [256, 30]
              - [-1, 33]
          - - 5056
            - - [64, 24]
              - [128, 11]
              - [448, 30]
              - [-1, 33]
          - - 5888
            - - [64, 11]
              - [128, 30]
              - [256, 33]
              - [448, 30]
              - [-1, 33]
          - - -1
            - - [64, 30]
              - [128, 33]
              - [256, 30]
              - [-1, 33]
