library/src/blas3/Tensile/Logic/vega10_deepbench/Cijk_Ailk_Bjlk_SB.yaml
- {MinimumRequiredVersion: 3.3.0}
- Tensile
- default
- AssignedDerivedParameters: true
- - - [4096, 7133, 1, 4096]
    - [10, 11810.1]
  - - [512, 16, 1, 512]
    - [0, 294.906]
  - - [1760, 7133, 1, 1760]
    - [6, 11022.8]
  - - [2560, 7133, 1, 2560]
    - [6, 11615.2]
  - - [1024, 32, 1, 512]
    - [4, 989.019]
  - - [3072, 7435, 1, 1024]
    - [6, 10741.8]
  - - [512, 32, 1, 512]
    - [5, 566.205]
  - - [2048, 7133, 1, 2048]
    - [10, 11313.8]
  - - [7680, 5481, 1, 2560]
    - [6, 11648.7]
  - - [1024, 16, 1, 512]
    - [5, 534.17]
- - - -1
    - - - -1
        - - - 64
            - - [128, 3]
              - [704, 7]
              - [1024, 8]
              - [1408, 6]
              - [1856, 7]
              - [2944, 6]
              - [3584, 8]
              - [-1, 6]
          - - 128
            - - [128, 5]
              - [1408, 2]
              - [1856, 1]
              - [2368, 2]
              - [2944, 1]
              - [3584, 7]
              - [4288, 2]
              - [5056, 1]
              - [5888, 7]
              - [-1, 1]
          - - 256
            - - [64, 5]
              - [448, 3]
              - [5056, 7]
              - [5888, 6]
              - [-1, 7]
          - - 448
            - - [64, 2]
              - [448, 3]
              - [2368, 7]
              - [2944, 6]
              - [3584, 7]
              - [4288, 6]
              - [5888, 7]
              - [-1, 6]
          - - 704
            - - [64, 2]
              - [128, 3]
              - [2368, 7]
              - [5056, 6]
              - [5888, 8]
              - [-1, 7]
          - - 1024
            - - [128, 2]
              - [704, 7]
              - [1408, 8]
              - [1856, 7]
              - [2368, 8]
              - [3584, 9]
              - [4288, 6]
              - [-1, 9]
          - - 1408
            - - [128, 3]
              - [704, 7]
              - [1408, 6]
              - [1856, 9]
              - [2368, 7]
              - [-1, 6]
          - - 1856
            - - [64, 3]
              - [128, 1]
              - [704, 7]
              - [1024, 10]
              - [1408, 8]
              - [1856, 6]
              - [2368, 7]
              - [-1, 6]
          - - 2368
            - - [128, 3]
              - [704, 7]
              - [1024, 8]
              - [1856, 7]
              - [-1, 6]
          - - 2944
            - - [64, 3]
              - [128, 1]
              - [704, 7]
              - [1024, 8]
              - [2944, 6]
              - [3584, 8]
              - [-1, 6]
          - - 3584
            - - [64, 1]
              - [448, 7]
              - [704, 9]
              - [1024, 8]
              - [1408, 6]
              - [1856, 9]
              - [-1, 6]
          - - 4288
            - - [128, 3]
              - [256, 7]
              - [704, 9]
              - [1024, 8]
              - [1856, 6]
              - [3584, 8]
              - [4288, 6]
              - [-1, 8]
          - - 5056
            - - [64, 3]
              - [128, 1]
              - [448, 7]
              - [704, 9]
              - [1408, 8]
              - [2944, 6]
              - [3584, 8]
              - [5056, 6]
              - [-1, 8]
          - - 5888
            - - [64, 1]
              - [448, 7]
              - [704, 9]
              - [1024, 8]
              - [2944, 6]
              - [3584, 8]
              - [5888, 6]
              - [-1, 8]
          - - -1
            - - [64, 7]
              - [128, 1]
              - [704, 7]
              - [1024, 8]
              - [1856, 6]
              - [2368, 8]
              - [2944, 6]
              - [3584, 8]
              - [4288, 6]
              - [-1, 8]
