library/src/blas3/Tensile/Logic/vega10_deepbench/Cijk_Alik_Bljk_SB.yaml
- {MinimumRequiredVersion: 3.3.0}
- Tensile
- default
- AssignedDerivedParameters: true
- - - [8448, 48000, 1, 2816]
    - [37, 9748.57]
  - - [2560, 7000, 1, 2560]
    - [29, 8787.59]
  - - [7680, 64, 1, 2560]
    - [23, 4903.71]
  - - [7680, 128, 1, 2560]
    - [21, 5924.81]
  - - [2048, 7000, 1, 2048]
    - [29, 7636.06]
  - - [512, 24000, 1, 2048]
    - [5, 7713.57]
  - - [5124, 9124, 1, 2560]
    - [29, 8890.2]
  - - [1024, 48000, 1, 2560]
    - [29, 8948.04]
  - - [3072, 32, 1, 1024]
    - [20, 1540.71]
  - - [3072, 48000, 1, 1024]
    - [29, 7989.05]
  - - [5124, 9124, 1, 4096]
    - [29, 8638.6]
  - - [5124, 9124, 1, 1760]
    - [28, 10474.7]
  - - [4096, 32, 1, 4096]
    - [11, 2689.26]
  - - [1760, 64, 1, 1760]
    - [27, 4117.31]
  - - [512, 48000, 1, 2560]
    - [29, 8984.58]
  - - [1024, 16, 1, 500000]
    - [0, 2398.42]
  - - [4608, 24000, 1, 1536]
    - [29, 8754.59]
  - - [7680, 48000, 1, 2560]
    - [36, 9161.92]
  - - [4096, 64, 1, 4096]
    - [23, 4099.29]
  - - [2048, 16, 1, 2048]
    - [19, 990.098]
  - - [3072, 24000, 1, 1024]
    - [35, 7904.77]
  - - [2560, 64, 1, 2560]
    - [26, 3691.1]
  - - [512, 24000, 1, 1530]
    - [37, 9576.68]
  - - [2560, 128, 1, 2560]
    - [27, 4879.06]
  - - [3072, 16, 1, 1024]
    - [15, 787.318]
  - - [3072, 128, 1, 1024]
    - [9, 2888.24]
  - - [1760, 32, 1, 1760]
    - [8, 2793.58]
  - - [6144, 16, 1, 2048]
    - [10, 1454.94]
  - - [2048, 64, 1, 2048]
    - [14, 2625.93]
  - - [512, 24000, 1, 2816]
    - [37, 9398.74]
  - - [6144, 32, 1, 2048]
    - [10, 2576.14]
  - - [1024, 48000, 1, 1530]
    - [36, 10111.1]
  - - [1760, 16, 1, 1760]
    - [24, 1566.89]
  - - [1024, 24000, 1, 2048]
    - [29, 7891.3]
  - - [1760, 7000, 1, 1760]
    - [28, 10093.6]
  - - [4096, 16, 1, 4096]
    - [12, 1504.26]
  - - [512, 48000, 1, 2048]
    - [5, 8122.72]
  - - [4608, 48000, 1, 1536]
    - [29, 8818.72]
  - - [35, 8457, 1, 4096]
    - [7, 3310.46]
  - - [8448, 32, 1, 2816]
    - [8, 3727.53]
  - - [1024, 8, 1, 500000]
    - [3, 1436.33]
  - - [8448, 16, 1, 2816]
    - [25, 1928.11]
  - - [2048, 128, 1, 2048]
    - [9, 3306.36]
  - - [4608, 16, 1, 1536]
    - [13, 1481.38]
  - - [1024, 24000, 1, 2560]
    - [29, 8780.97]
  - - [5124, 9124, 1, 2048]
    - [29, 8287.92]
  - - [1024, 700, 1, 512]
    - [32, 3722.3]
  - - [2560, 32, 1, 2560]
    - [15, 2566.7]
  - - [2048, 32, 1, 2048]
    - [20, 1879.56]
  - - [35, 8457, 1, 1760]
    - [4, 3266.46]
  - - [6144, 24000, 1, 2048]
    - [29, 8592.58]
  - - [4096, 7000, 1, 4096]
    - [29, 8427.46]
  - - [1024, 24000, 1, 1530]
    - [36, 9807.98]
  - - [7680, 24000, 1, 2560]
    - [29, 9123.3]
  - - [6144, 48000, 1, 2048]
    - [29, 8638.28]
  - - [4608, 32, 1, 1536]
    - [17, 2479.77]
  - - [35, 8457, 1, 2560]
    - [6, 3221.83]
  - - [1024, 48000, 1, 2816]
    - [36, 9774.78]
  - - [3072, 64, 1, 1024]
    - [18, 2316.99]
  - - [512, 48000, 1, 1530]
    - [37, 9805.71]
  - - [512, 48000, 1, 2816]
    - [37, 9590.15]
  - - [2560, 16, 1, 2560]
    - [19, 1404.31]
  - - [8448, 24000, 1, 2816]
    - [37, 9781.56]
  - - [7680, 16, 1, 2560]
    - [10, 1754.8]
  - - [4096, 128, 1, 4096]
    - [22, 5138.28]
  - - [1760, 128, 1, 1760]
    - [21, 5294.26]
  - - [35, 8457, 1, 2048]
    - [6, 3010.83]
  - - [512, 8, 1, 500000]
    - [2, 1476.88]
  - - [512, 24000, 1, 2560]
    - [34, 8673.98]
  - - [7680, 32, 1, 2560]
    - [11, 3254.11]
  - - [1024, 48000, 1, 2048]
    - [29, 8233.1]
  - - [512, 16, 1, 500000]
    - [1, 2450.66]
  - - [1024, 24000, 1, 2816]
    - [36, 9502.37]
- - - -1
    - - - -1
        - - - 64
            - - [64, 23]
              - [128, 22]
              - [704, 31]
              - [1408, 33]
              - [1856, 28]
              - [2368, 33]
              - [-1, 37]
          - - 128
            - - [64, 24]
              - [128, 17]
              - [256, 10]
              - [448, 27]
              - [704, 22]
              - [1408, 26]
              - [1856, 23]
              - [2368, 16]
              - [2944, 26]
              - [3584, 5]
              - [4288, 23]
              - [5056, 26]
              - [5888, 5]
              - [-1, 29]
          - - 256
            - - [64, 14]
              - [128, 10]
              - [256, 22]
              - [448, 27]
              - [704, 5]
              - [1024, 31]
              - [1408, 5]
              - [1856, 31]
              - [2944, 5]
              - [3584, 29]
              - [4288, 31]
              - [5056, 5]
              - [5888, 33]
              - [-1, 5]
          - - 448
            - - [64, 10]
              - [448, 27]
              - [704, 5]
              - [1024, 31]
              - [1408, 5]
              - [1856, 29]
              - [2368, 31]
              - [2944, 33]
              - [3584, 5]
              - [4288, 29]
              - [5056, 31]
              - [5888, 28]
              - [-1, 29]
          - - 704
            - - [64, 27]
              - [128, 23]
              - [256, 5]
              - [704, 31]
              - [1024, 5]
              - [1408, 29]
              - [1856, 5]
              - [2368, 31]
              - [3584, 32]
              - [5888, 29]
              - [-1, 37]
          - - 1024
            - - [64, 8]
              - [128, 26]
              - [256, 31]
              - [448, 5]
              - [704, 31]
              - [1024, 32]
              - [1408, 28]
              - [1856, 37]
              - [2368, 28]
              - [2944, 33]
              - [4288, 28]
              - [5056, 36]
              - [-1, 28]
          - - 1408
            - - [64, 23]
              - [128, 16]
              - [448, 5]
              - [704, 34]
              - [1024, 33]
              - [1408, 37]
              - [1856, 34]
              - [2368, 33]
              - [4288, 36]
              - [5888, 37]
              - [-1, 36]
          - - 1856
            - - [64, 26]
              - [128, 22]
              - [256, 31]
              - [448, 29]
              - [704, 31]
              - [1024, 36]
              - [1408, 33]
              - [2368, 28]
              - [2944, 34]
              - [3584, 28]
              - [4288, 36]
              - [-1, 28]
          - - 2368
            - - [64, 22]
              - [128, 16]
              - [704, 31]
              - [1024, 33]
              - [2368, 28]
              - [2944, 36]
              - [4288, 28]
              - [-1, 36]
          - - 2944
            - - [128, 16]
              - [256, 31]
              - [448, 33]
              - [704, 28]
              - [1024, 33]
              - [1856, 28]
              - [2944, 36]
              - [3584, 28]
              - [-1, 36]
          - - 3584
            - - [64, 23]
              - [128, 31]
              - [256, 29]
              - [448, 31]
              - [704, 28]
              - [1024, 33]
              - [1408, 36]
              - [1856, 28]
              - [-1, 36]
          - - 4288
            - - [64, 23]
              - [128, 22]
              - [256, 31]
              - [448, 34]
              - [704, 28]
              - [1024, 33]
              - [1856, 37]
              - [2368, 28]
              - [-1, 37]
          - - 5056
            - - [64, 26]
              - [448, 31]
              - [704, 28]
              - [1024, 33]
              - [1408, 37]
              - [1856, 28]
              - [2368, 37]
              - [2944, 30]
              - [3584, 37]
              - [4288, 30]
              - [-1, 37]
          - - 5888
            - - [64, 26]
              - [128, 31]
              - [448, 33]
              - [704, 28]
              - [1024, 33]
              - [1408, 37]
              - [1856, 33]
              - [2944, 37]
              - [3584, 30]
              - [5056, 37]
              - [5888, 36]
              - [-1, 37]
          - - -1
            - - [64, 5]
              - [128, 29]
              - [448, 31]
              - [704, 37]
              - [1408, 33]
              - [1856, 30]
              - [2368, 37]
              - [2944, 30]
              - [-1, 37]
