library/src/blas3/Tensile/Logic/asm_full/cu_efficiency/arcturus_Cijk_Alik_Bljk_HBH.yaml
- {MinimumRequiredVersion: 4.27.0}
- arcturus
- gfx908
- [Device 7380, Device 7388, Device 738c, Device 7390]
    SolutionIndex: 0
    SolutionNameMin: Cijk_Alik_Bljk_HBH_MT64x64x16_MI32x32x8x1_SN_1LDSB0_EPS0_GRVW2_LPA8_LPB8_PGR2_PLR2_SRVW4_TT1_32_WG64_4_1
    SolutionIndex: 1
    SolutionNameMin: Cijk_Alik_Bljk_HBH_MT128x128x16_MI32x32x8x1_SN_1LDSB0_EPS0_GRVW2_LPA8_LPB8_PGR2_PLR2_SRVW4_TT2_64_WG64_4_1
    SolutionIndex: 2
    SolutionNameMin: Cijk_Alik_Bljk_HBH_MT64x32x32_MI16x16x16x1_SN_1LDSB0_EPS0_GRVW2_LPA16_LPB16_PGR2_PLR2_SRVW4_TT2_16_WG32_8_1
    SolutionIndex: 3
    SolutionNameMin: Cijk_Alik_Bljk_HBH_MT96x96x32_MI16x16x16x1_SN_1LDSB0_EPS0_GRVW2_LPA16_LPB16_PGR2_PLR2_SRVW0_TT3_48_WG32_8_1
    SolutionIndex: 4
    SolutionNameMin: Cijk_Alik_Bljk_HBH_MT256x256x32_MI32x32x8x1_SN_1LDSB1_EPS1_GRVW2_LPA8_LPB8_PGR1_PLR5_SRVW4_TT4_128_WG64_4_1
    SolutionIndex: 5
    SolutionNameMin: Cijk_Alik_Bljk_HBH_MT96x96x32_MI16x16x16x1_SN_1LDSB0_EPS1_GRVW4_LPA16_LPB16_PGR1_PLR2_SRVW0_TT3_48_WG32_8_1
    SolutionIndex: 6
    SolutionNameMin: Cijk_Alik_Bljk_HBH_MT256x256x32_MI32x32x8x1_SN_1LDSB1_EPS1_GRVW4_LPA8_LPB8_PGR1_PLR5_SRVW4_TT4_128_WG64_4_1
    SolutionIndex: 7
    SolutionNameMin: Cijk_Alik_Bljk_HBH_MT128x96x32_MI32x32x8x1_SN_1LDSB0_EPS1_GRVW4_LPA8_LPB8_PGR1_PLR5_SRVW4_TT1_96_WG128_2_1
    SolutionIndex: 8
    SolutionNameMin: Cijk_Alik_Bljk_HBH_MT64x64x64_MI32x32x8x1_SN_1LDSB0_EPS0_GRVW4_LPA8_LPB8_PGR2_PLR9_SRVW4_TT1_32_WG64_4_1
    SolutionIndex: 9
    SolutionNameMin: Cijk_Alik_Bljk_HBH_MT192x192x64_MI32x32x8x1_SN_1LDSB1_EPS0_GRVW4_LPA8_LPB8_PGR2_PLR9_SRVW0_TT3_96_WG64_4_1
    SolutionIndex: 10
    SolutionNameMin: Cijk_Alik_Bljk_HBH_MT256x256x16_MI32x32x8x1_SN_1LDSB0_EPS1_GRVW8_LPA8_LPB8_PGR1_PLR2_SRVW4_TT4_128_WG64_4_1
    SolutionIndex: 11
    SolutionNameMin: Cijk_Alik_Bljk_HBH_MT32x32x32_MI16x16x16x1_SN_1LDSB0_EPS0_GRVW8_LPA16_LPB16_PGR2_PLR2_SRVW4_TT1_16_WG32_8_1
    SolutionIndex: 12
    SolutionNameMin: Cijk_Alik_Bljk_HBH_MT64x32x32_MI16x16x16x1_SN_1LDSB0_EPS0_GRVW8_LPA16_LPB16_PGR2_PLR2_SRVW4_TT2_16_WG32_8_1
    SolutionIndex: 13
    SolutionNameMin: Cijk_Alik_Bljk_HBH_MT192x192x32_MI32x32x8x1_SN_1LDSB0_EPS1_GRVW8_LPA8_LPB8_PGR1_PLR5_SRVW0_TT3_96_WG64_4_1
    SolutionIndex: 14
    SolutionNameMin: Cijk_Alik_Bljk_HBH_MT16x16x64_MI16x16x16x1_SN_1LDSB0_EPS1_GRVW8_LPA16_LPB16_PGR1_PLR5_SRVW4_TT1_16_WG16_4_1
    SolutionIndex: 15
    SolutionNameMin: Cijk_Alik_Bljk_HBH_MT160x160x64_MI16x16x16x1_SN_1LDSB1_EPS1_GRVW8_LPA16_LPB16_PGR1_PLR5_SRVW0_TT5_80_WG32_8_1
    SolutionIndex: 16
    SolutionNameMin: Cijk_Alik_Bljk_HBH_MT96x96x64_MI16x16x16x1_SN_1LDSB0_EPS0_GRVW8_LPA16_LPB16_PGR2_PLR5_SRVW0_TT3_48_WG32_8_1
    SolutionIndex: 17
    SolutionNameMin: Cijk_Alik_Bljk_HBH_MT160x160x64_MI16x16x16x1_SN_1LDSB1_EPS0_GRVW8_LPA16_LPB16_PGR2_PLR5_SRVW0_TT5_80_WG32_8_1
    SolutionIndex: 18
    SolutionNameMin: Cijk_Alik_Bljk_HBH_MT128x128x64_MI32x32x8x1_SN_1LDSB1_EPS0_GRVW8_LPA8_LPB8_PGR2_PLR9_SRVW4_TT2_64_WG64_4_1
- - - [16, 16, 16, 64]
    - [14, 0.259]
  - - [32, 32, 16, 64]
    - [11, 1.008]
  - - [48, 48, 16, 64]
    - [0, 1.44]
  - - [64, 64, 16, 64]
    - [8, 3.271]
  - - [80, 80, 16, 64]
    - [16, 2.754]
  - - [96, 96, 16, 64]
    - [3, 6.022]
  - - [112, 112, 16, 64]
    - [1, 3.636]
  - - [128, 128, 16, 64]
    - [18, 8.121]
  - - [144, 144, 16, 64]
    - [15, 4.175]
  - - [160, 160, 16, 64]
    - [17, 10.514]
  - - [176, 176, 16, 64]
    - [9, 4.488]
  - - [192, 192, 16, 64]
    - [13, 12.498]
  - - [208, 208, 16, 64]
    - [2, 4.064]
  - - [224, 224, 16, 64]
    - [2, 4.761]
  - - [240, 240, 16, 64]
    - [10, 5.036]
  - - [256, 256, 16, 64]
    - [4, 12.331]
  - - [272, 272, 16, 64]
    - [2, 5.138]
  - - [288, 288, 16, 64]
    - [5, 6.309]
  - - [304, 304, 16, 64]
    - [2, 6.025]
  - - [320, 320, 16, 64]
    - [15, 9.945]
  - - [336, 336, 16, 64]
    - [2, 6.44]
  - - [352, 352, 16, 64]
    - [2, 7.196]
  - - [368, 368, 16, 64]
    - [2, 7.291]
  - - [384, 384, 16, 64]
    - [7, 10.094]
  - - [400, 400, 16, 64]
    - [2, 7.822]
  - - [416, 416, 16, 64]
    - [12, 8.637]
  - - [432, 432, 16, 64]
    - [12, 8.64]
  - - [448, 448, 16, 64]
    - [2, 9.569]
  - - [464, 464, 16, 64]
    - [2, 8.932]
  - - [480, 480, 16, 64]
    - [5, 10.616]
  - - [496, 496, 16, 64]
    - [12, 9.318]
  - - [512, 512, 16, 64]
    - [6, 12.077]
- null
- null
- CUEfficiency
