library/src/blas3/Tensile/Logic/asm_full/cu_efficiency/arcturus_Cijk_Ailk_Bljk_HBH.yaml
- {MinimumRequiredVersion: 4.27.0}
- arcturus
- gfx908
- [Device 7380, Device 7388, Device 738c, Device 7390]
    SolutionIndex: 0
    SolutionNameMin: Cijk_Ailk_Bljk_HBH_MT64x32x32_MI16x16x16x1_SN_1LDSB0_EPS1_GRVW2_LPB16_PGR1_PLR2_TT2_16_WG32_8_1
    SolutionIndex: 1
    SolutionNameMin: Cijk_Ailk_Bljk_HBH_MT64x144x32_MI16x16x16x1_SN_1LDSB0_EPS0_GRVW2_LPB16_PGR2_PLR2_TT1_144_WG64_4_1
    SolutionIndex: 2
    SolutionNameMin: Cijk_Ailk_Bljk_HBH_MT64x64x16_MI32x32x8x1_SN_1LDSB0_EPS0_GRVW4_LPB8_PGR2_PLR2_TT1_32_WG64_4_1
    SolutionIndex: 3
    SolutionNameMin: Cijk_Ailk_Bljk_HBH_MT64x128x16_MI32x32x8x1_SN_1LDSB0_EPS0_GRVW4_LPB8_PGR2_PLR2_TT1_64_WG64_4_1
    SolutionIndex: 4
    SolutionNameMin: Cijk_Ailk_Bljk_HBH_MT64x256x16_MI32x32x8x1_SN_1LDSB0_EPS0_GRVW4_LPB8_PGR2_PLR2_TT1_128_WG64_4_1
    SolutionIndex: 5
    SolutionNameMin: Cijk_Ailk_Bljk_HBH_MT64x192x16_MI32x32x8x1_SN_1LDSB0_EPS0_GRVW4_LPB8_PGR2_PLR2_TT1_96_WG64_4_1
    SolutionIndex: 6
    SolutionNameMin: Cijk_Ailk_Bljk_HBH_MT64x16x32_MI16x16x16x1_SN_1LDSB0_EPS0_GRVW4_LPB16_PGR2_PLR2_TT1_16_WG64_4_1
    SolutionIndex: 7
    SolutionNameMin: Cijk_Ailk_Bljk_HBH_MT64x128x32_MI32x32x8x1_SN_1LDSB0_EPS0_GRVW4_LPB8_PGR2_PLR5_TT1_64_WG64_4_1
    SolutionIndex: 8
    SolutionNameMin: Cijk_Ailk_Bljk_HBH_MT64x256x32_MI32x32x8x1_SN_1LDSB0_EPS0_GRVW4_LPB8_PGR2_PLR5_TT1_128_WG64_4_1
    SolutionIndex: 9
    SolutionNameMin: Cijk_Ailk_Bljk_HBH_MT64x256x16_MI32x32x8x1_SN_1LDSB0_EPS1_GRVW8_LPB8_PGR1_PLR2_TT1_128_WG64_4_1
    SolutionIndex: 10
    SolutionNameMin: Cijk_Ailk_Bljk_HBH_MT64x64x16_MI32x32x8x1_SN_1LDSB0_EPS0_GRVW8_LPB8_PGR2_PLR2_TT1_32_WG64_4_1
    SolutionIndex: 11
    SolutionNameMin: Cijk_Ailk_Bljk_HBH_MT64x128x16_MI32x32x8x1_SN_1LDSB0_EPS0_GRVW8_LPB8_PGR2_PLR2_TT1_64_WG64_4_1
    SolutionIndex: 12
    SolutionNameMin: Cijk_Ailk_Bljk_HBH_MT64x256x16_MI32x32x8x1_SN_1LDSB0_EPS0_GRVW8_LPB8_PGR2_PLR2_TT1_128_WG64_4_1
    SolutionIndex: 13
    SolutionNameMin: Cijk_Ailk_Bljk_HBH_MT64x128x32_MI32x32x8x1_SN_1LDSB0_EPS1_GRVW8_LPB8_PGR1_PLR5_TT1_64_WG64_4_1
    SolutionIndex: 14
    SolutionNameMin: Cijk_Ailk_Bljk_HBH_MT64x256x32_MI32x32x8x1_SN_1LDSB0_EPS1_GRVW8_LPB8_PGR1_PLR5_TT1_128_WG64_4_1
    SolutionIndex: 15
    SolutionNameMin: Cijk_Ailk_Bljk_HBH_MT64x192x32_MI32x32x8x1_SN_1LDSB0_EPS1_GRVW8_LPB8_PGR1_PLR5_TT1_96_WG64_4_1
    SolutionIndex: 16
    SolutionNameMin: Cijk_Ailk_Bljk_HBH_MT64x256x32_MI32x32x8x1_SN_1LDSB0_EPS0_GRVW8_LPB8_PGR2_PLR5_TT1_128_WG64_4_1
    SolutionIndex: 17
    SolutionNameMin: Cijk_Ailk_Bljk_HBH_MT64x192x32_MI32x32x8x1_SN_1LDSB0_EPS0_GRVW8_LPB8_PGR2_PLR5_TT1_96_WG64_4_1
- - - [64, 16, 16, 16]
    - [6, 0.191]
  - - [64, 32, 16, 32]
    - [0, 0.898]
  - - [64, 48, 16, 48]
    - [10, 1.347]
  - - [64, 64, 16, 64]
    - [2, 2.887]
  - - [64, 80, 16, 80]
    - [3, 2.555]
  - - [64, 96, 16, 96]
    - [13, 3.68]
  - - [64, 112, 16, 112]
    - [11, 4.873]
  - - [64, 128, 16, 128]
    - [7, 8.121]
  - - [64, 144, 16, 144]
    - [1, 6.654]
  - - [64, 160, 16, 160]
    - [17, 7.764]
  - - [64, 176, 16, 176]
    - [5, 8.835]
  - - [64, 192, 16, 192]
    - [17, 14.802]
  - - [64, 208, 16, 208]
    - [9, 9.717]
  - - [64, 224, 16, 224]
    - [16, 11.376]
  - - [64, 240, 16, 240]
    - [4, 12.358]
  - - [64, 256, 16, 256]
    - [8, 18.116]
  - - [64, 272, 16, 272]
    - [5, 9.428]
  - - [64, 288, 16, 288]
    - [1, 12.793]
  - - [64, 304, 16, 304]
    - [5, 10.96]
  - - [64, 320, 16, 320]
    - [15, 13.096]
  - - [64, 336, 16, 336]
    - [5, 13.003]
  - - [64, 352, 16, 352]
    - [17, 15.623]
  - - [64, 368, 16, 368]
    - [5, 15.067]
  - - [64, 384, 16, 384]
    - [17, 20.7]
  - - [64, 400, 16, 400]
    - [9, 14.896]
  - - [64, 416, 16, 416]
    - [16, 16.452]
  - - [64, 432, 16, 432]
    - [12, 16.894]
  - - [64, 448, 16, 448]
    - [14, 18.589]
  - - [64, 464, 16, 464]
    - [12, 18.825]
  - - [64, 480, 16, 480]
    - [16, 21.506]
  - - [64, 496, 16, 496]
    - [4, 19.867]
  - - [64, 512, 16, 512]
    - [14, 26.241]
- null
- null
- CUEfficiency
