library/src/blas3/Tensile/Logic/nonMFMA_legacy/aldebaran_Cijk_Ailk_Bjlk_DB.yaml
- {MinimumRequiredVersion: 4.8.1}
- aldebaran
- gfx90a
- [Device 0050, Device 0051, Device 0052, Device 0054, Device 0062, Device 7400, Device
    SolutionIndex: 0
    SolutionNameMin: Cijk_Ailk_Bjlk_DB_MT064x064x08_PLR1_TT04_04_WG16_16_01
    SolutionIndex: 1
    SolutionNameMin: Cijk_Ailk_Bjlk_DB_MT064x064x04_PLR1_TT04_04_WG16_16_01
    SolutionIndex: 2
    SolutionNameMin: Cijk_Ailk_Bjlk_DB_MT064x048x04_PLR0_TT04_06_WG16_08_01
    SolutionIndex: 3
    SolutionNameMin: Cijk_Ailk_Bjlk_DB_MT064x048x04_PLR0_TT04_06_WG16_08_01
    SolutionIndex: 4
    SolutionNameMin: Cijk_Ailk_Bjlk_DB_MT064x048x04_PLR0_TT04_06_WG16_08_01
    SolutionIndex: 5
    SolutionNameMin: Cijk_Ailk_Bjlk_DB_MT064x048x04_PLR0_TT04_06_WG16_08_01
    SolutionIndex: 6
    SolutionNameMin: Cijk_Ailk_Bjlk_DB_MT064x064x04_PLR1_TT04_08_WG16_08_01
    SolutionIndex: 7
    SolutionNameMin: Cijk_Ailk_Bjlk_DB_MT064x064x04_PLR1_TT04_08_WG16_08_01
    SolutionIndex: 8
    SolutionNameMin: Cijk_Ailk_Bjlk_DB_MT064x064x04_PLR1_TT04_08_WG16_08_01
    SolutionIndex: 9
    SolutionNameMin: Cijk_Ailk_Bjlk_DB_MT048x064x04_PLR0_TT06_04_WG08_16_01
    SolutionIndex: 10
    SolutionNameMin: Cijk_Ailk_Bjlk_DB_MT064x064x04_PLR1_TT08_04_WG08_16_01
    SolutionIndex: 11
    SolutionNameMin: Cijk_Ailk_Bjlk_DB_MT096x096x04_PLR0_TT06_06_WG16_16_01
    SolutionIndex: 12
    SolutionNameMin: Cijk_Ailk_Bjlk_DB_MT064x128x04_PLR1_TT04_08_WG16_16_01
    SolutionIndex: 13
    SolutionNameMin: Cijk_Ailk_Bjlk_DB_MT064x064x08_PLR0_TT04_04_WG16_16_01
    SolutionIndex: 14
    SolutionNameMin: Cijk_Ailk_Bjlk_DB_MT064x064x08_PLR0_TT04_04_WG16_16_01
    SolutionIndex: 15
    SolutionNameMin: Cijk_Ailk_Bjlk_DB_MT096x032x04_PLR1_TT06_04_WG16_08_01
    SolutionIndex: 16
    SolutionNameMin: Cijk_Ailk_Bjlk_DB_MT064x048x04_PLR1_TT04_06_WG16_08_01
    SolutionIndex: 17
    SolutionNameMin: Cijk_Ailk_Bjlk_DB_MT032x064x04_PLR0_TT04_04_WG08_16_01
    SolutionIndex: 18
    SolutionNameMin: Cijk_Ailk_Bjlk_DB_MT048x064x04_PLR0_TT06_04_WG08_16_01
    SolutionIndex: 19
    SolutionNameMin: Cijk_Ailk_Bjlk_DB_MT096x064x04_PLR0_TT06_04_WG16_16_01
    SolutionIndex: 20
    SolutionNameMin: Cijk_Ailk_Bjlk_DB_MT064x032x08_PLR1_TT04_04_WG16_08_01
    SolutionIndex: 21
    SolutionNameMin: Cijk_Ailk_Bjlk_DB_MT064x064x08_PLR1_TT04_04_WG16_16_01
    SolutionIndex: 22
    SolutionNameMin: Cijk_Ailk_Bjlk_DB_MT064x064x08_PLR0_TT04_04_WG16_16_01
    SolutionIndex: 23
    SolutionNameMin: Cijk_Ailk_Bjlk_DB_MT064x032x12_PLR1_TT04_04_WG16_08_01
    SolutionIndex: 24
    SolutionNameMin: Cijk_Ailk_Bjlk_DB_MT064x048x04_PK00_PLR0_SNLL0_TT04_06_WG16_08_01_WGM01
    SolutionIndex: 25
    SolutionNameMin: Cijk_Ailk_Bjlk_DB_MT064x032x04_PK00_PLR0_SNLL0_TT04_04_WG16_08_01_WGM08
    SolutionIndex: 26
    SolutionNameMin: Cijk_Ailk_Bjlk_DB_MT064x048x04_PK00_PLR0_SNLL1_TT04_06_WG16_08_01_WGM08
    SolutionIndex: 27
    SolutionNameMin: Cijk_Ailk_Bjlk_DB_MT064x048x04_PK00_PLR0_SNLL0_TT04_06_WG16_08_01_WGM08
    SolutionIndex: 28
    SolutionNameMin: Cijk_Ailk_Bjlk_DB_MT048x064x04_PK00_PLR0_SNLL1_TT06_04_WG08_16_01_WGM08
    SolutionIndex: 29
    SolutionNameMin: Cijk_Ailk_Bjlk_DB_MT048x064x04_PK00_PLR0_SNLL0_TT06_04_WG08_16_01_WGM08
    SolutionIndex: 30
    SolutionNameMin: Cijk_Ailk_Bjlk_DB_MT096x064x04_PK00_PLR0_SNLL1_TT06_04_WG16_16_01_WGM08
    SolutionIndex: 31
    SolutionNameMin: Cijk_Ailk_Bjlk_DB_MT064x032x08_PK00_PLR1_SNLL0_TT04_04_WG16_08_01_WGM01
    SolutionIndex: 32
    SolutionNameMin: Cijk_Ailk_Bjlk_DB_MT064x064x08_PK00_PLR1_SNLL1_TT04_04_WG16_16_01_WGM08
    SolutionIndex: 33
    SolutionNameMin: Cijk_Ailk_Bjlk_DB_MT064x064x08_PK00_PLR1_SNLL0_TT04_04_WG16_16_01_WGM08
    SolutionIndex: 34
    SolutionNameMin: Cijk_Ailk_Bjlk_DB_MT64x32x4_SE_PLR0_SNLL0_TT4_4_WG16_8_1_WGM1
    SolutionIndex: 35
    SolutionNameMin: Cijk_Ailk_Bjlk_DB_MT64x48x4_SE_PLR1_SNLL0_TT4_6_WG16_8_1_WGM1
    SolutionIndex: 37
    SolutionNameMin: Cijk_Ailk_Bjlk_DB_MT128x32x4_SE_PLR0_SNLL0_TT8_4_WG16_8_1_WGM1
    SolutionIndex: 39
    SolutionNameMin: Cijk_Ailk_Bjlk_DB_MT64x64x4_SE_PLR1_SNLL0_TT4_8_WG16_8_1_WGM1
    SolutionIndex: 40
    SolutionNameMin: Cijk_Ailk_Bjlk_DB_MT128x64x4_SE_PLR1_SNLL0_TT8_4_WG16_16_1_WGM1
    SolutionIndex: 41
    SolutionNameMin: Cijk_Ailk_Bjlk_DB_MT64x128x4_SE_PLR1_SNLL1_TT4_8_WG16_16_1_WGM1
    SolutionIndex: 42
    SolutionNameMin: Cijk_Ailk_Bjlk_DB_MT64x128x4_SE_PLR1_SNLL0_TT4_8_WG16_16_1_WGM1
    SolutionIndex: 44
    SolutionNameMin: Cijk_Ailk_Bjlk_DB_MT64x48x4_SE_PLR0_SNLL1_TT4_6_WG16_8_1_WGM4
    SolutionIndex: 45
    SolutionNameMin: Cijk_Ailk_Bjlk_DB_MT64x48x4_SE_PLR0_SNLL0_TT4_6_WG16_8_1_WGM4
    SolutionIndex: 46
    SolutionNameMin: Cijk_Ailk_Bjlk_DB_MT128x32x4_SE_PLR0_SNLL1_TT8_4_WG16_8_1_WGM4
    SolutionIndex: 47
    SolutionNameMin: Cijk_Ailk_Bjlk_DB_MT48x64x4_SE_PLR0_SNLL0_TT6_4_WG8_16_1_WGM4
    SolutionIndex: 49
    SolutionNameMin: Cijk_Ailk_Bjlk_DB_MT64x48x4_SE_PLR0_SNLL1_TT4_6_WG16_8_1_WGM8
    SolutionIndex: 50
    SolutionNameMin: Cijk_Ailk_Bjlk_DB_MT64x48x4_SE_PLR0_SNLL0_TT4_6_WG16_8_1_WGM8
    SolutionIndex: 53
    SolutionNameMin: Cijk_Ailk_Bjlk_DB_MT48x64x4_SE_PLR0_SNLL0_TT6_4_WG8_16_1_WGM8
    SolutionIndex: 54
    SolutionNameMin: Cijk_Ailk_Bjlk_DB_MT64x32x8_SE_PLR1_SNLL1_TT4_4_WG16_8_1_WGM1
    SolutionIndex: 55
    SolutionNameMin: Cijk_Ailk_Bjlk_DB_MT64x32x8_SE_PLR1_SNLL0_TT4_4_WG16_8_1_WGM1
    SolutionIndex: 56
    SolutionNameMin: Cijk_Ailk_Bjlk_DB_MT64x64x8_SE_PLR1_SNLL1_TT4_4_WG16_16_1_WGM1
    SolutionIndex: 57
    SolutionNameMin: Cijk_Ailk_Bjlk_DB_MT64x64x8_SE_PLR0_SNLL1_TT4_4_WG16_16_1_WGM1
    SolutionIndex: 58
    SolutionNameMin: Cijk_Ailk_Bjlk_DB_MT64x64x8_SE_PLR1_SNLL0_TT4_4_WG16_16_1_WGM1
    SolutionIndex: 59
    SolutionNameMin: Cijk_Ailk_Bjlk_DB_MT64x64x8_SE_PLR0_SNLL0_TT4_4_WG16_16_1_WGM1
    SolutionIndex: 60
    SolutionNameMin: Cijk_Ailk_Bjlk_DB_MT64x32x8_SE_PLR1_SNLL1_TT4_4_WG16_8_1_WGM4
    SolutionIndex: 61
    SolutionNameMin: Cijk_Ailk_Bjlk_DB_MT96x32x8_SE_PLR1_SNLL1_TT6_4_WG16_8_1_WGM4
    SolutionIndex: 62
    SolutionNameMin: Cijk_Ailk_Bjlk_DB_MT64x64x8_SE_PLR1_SNLL1_TT4_4_WG16_16_1_WGM4
    SolutionIndex: 63
    SolutionNameMin: Cijk_Ailk_Bjlk_DB_MT64x64x8_SE_PLR0_SNLL1_TT4_4_WG16_16_1_WGM4
    SolutionIndex: 64
    SolutionNameMin: Cijk_Ailk_Bjlk_DB_MT64x64x8_SE_PLR0_SNLL0_TT4_4_WG16_16_1_WGM4
    SolutionIndex: 65
    SolutionNameMin: Cijk_Ailk_Bjlk_DB_MT64x32x8_SE_PLR1_SNLL0_TT4_4_WG16_8_1_WGM8
    SolutionIndex: 67
    SolutionNameMin: Cijk_Ailk_Bjlk_DB_MT64x64x8_SE_PLR0_SNLL1_TT4_4_WG16_16_1_WGM8
    SolutionIndex: 68
    SolutionNameMin: Cijk_Ailk_Bjlk_DB_MT64x64x8_SE_PLR1_SNLL0_TT4_4_WG16_16_1_WGM8
    SolutionIndex: 69
    SolutionNameMin: Cijk_Ailk_Bjlk_DB_MT64x64x8_SE_PLR0_SNLL0_TT4_4_WG16_16_1_WGM8
    SolutionIndex: 70
    SolutionNameMin: Cijk_Ailk_Bjlk_DB_MT64x32x4_SE_PLR1_SNLL1_TT4_4_WG16_8_1_WGM1
    SolutionIndex: 71
    SolutionNameMin: Cijk_Ailk_Bjlk_DB_MT64x32x4_SE_PLR0_SNLL1_TT4_4_WG16_8_1_WGM1
    SolutionIndex: 72
    SolutionNameMin: Cijk_Ailk_Bjlk_DB_MT64x32x4_SE_PLR1_SNLL0_TT4_4_WG16_8_1_WGM1
    SolutionIndex: 73
    SolutionNameMin: Cijk_Ailk_Bjlk_DB_MT64x32x4_SE_PLR0_SNLL0_TT4_4_WG16_8_1_WGM1
    SolutionIndex: 74
    SolutionNameMin: Cijk_Ailk_Bjlk_DB_MT96x32x4_SE_PLR1_SNLL1_TT6_4_WG16_8_1_WGM1
    SolutionIndex: 75
    SolutionNameMin: Cijk_Ailk_Bjlk_DB_MT64x64x4_SE_PLR1_SNLL1_TT4_8_WG16_8_1_WGM1
    SolutionIndex: 76
    SolutionNameMin: Cijk_Ailk_Bjlk_DB_MT48x64x4_SE_PLR0_SNLL1_TT6_4_WG8_16_1_WGM1
    SolutionIndex: 77
    SolutionNameMin: Cijk_Ailk_Bjlk_DB_MT48x64x4_SE_PLR0_SNLL0_TT6_4_WG8_16_1_WGM1
    SolutionIndex: 78
    SolutionNameMin: Cijk_Ailk_Bjlk_DB_MT96x64x4_SE_PLR0_SNLL1_TT6_4_WG16_16_1_WGM1
    SolutionIndex: 79
    SolutionNameMin: Cijk_Ailk_Bjlk_DB_MT96x64x4_SE_PLR0_SNLL0_TT6_4_WG16_16_1_WGM1
    SolutionIndex: 80
    SolutionNameMin: Cijk_Ailk_Bjlk_DB_MT128x64x4_SE_PLR1_SNLL1_TT8_4_WG16_16_1_WGM1
    SolutionIndex: 81
    SolutionNameMin: Cijk_Ailk_Bjlk_DB_MT128x64x4_SE_PLR1_SNLL0_TT8_4_WG16_16_1_WGM1
    SolutionIndex: 82
    SolutionNameMin: Cijk_Ailk_Bjlk_DB_MT64x128x4_SE_PLR1_SNLL1_TT4_8_WG16_16_1_WGM1
    SolutionIndex: 83
    SolutionNameMin: Cijk_Ailk_Bjlk_DB_MT64x128x4_SE_PLR1_SNLL0_TT4_8_WG16_16_1_WGM1
    SolutionIndex: 84
    SolutionNameMin: Cijk_Ailk_Bjlk_DB_MT64x32x4_SE_PLR0_SNLL1_TT4_4_WG16_8_1_WGM4
    SolutionIndex: 85
    SolutionNameMin: Cijk_Ailk_Bjlk_DB_MT64x32x4_SE_PLR0_SNLL0_TT4_4_WG16_8_1_WGM4
    SolutionIndex: 86
    SolutionNameMin: Cijk_Ailk_Bjlk_DB_MT96x32x4_SE_PLR1_SNLL0_TT6_4_WG16_8_1_WGM4
    SolutionIndex: 87
    SolutionNameMin: Cijk_Ailk_Bjlk_DB_MT48x64x4_SE_PLR0_SNLL1_TT6_4_WG8_16_1_WGM4
    SolutionIndex: 88
    SolutionNameMin: Cijk_Ailk_Bjlk_DB_MT48x64x4_SE_PLR0_SNLL0_TT6_4_WG8_16_1_WGM4
    SolutionIndex: 89
    SolutionNameMin: Cijk_Ailk_Bjlk_DB_MT96x64x4_SE_PLR0_SNLL1_TT6_4_WG16_16_1_WGM4
    SolutionIndex: 90
    SolutionNameMin: Cijk_Ailk_Bjlk_DB_MT96x64x4_SE_PLR0_SNLL0_TT6_4_WG16_16_1_WGM4
    SolutionIndex: 91
    SolutionNameMin: Cijk_Ailk_Bjlk_DB_MT64x128x4_SE_PLR1_SNLL0_TT4_8_WG16_16_1_WGM4
    SolutionIndex: 92
    SolutionNameMin: Cijk_Ailk_Bjlk_DB_MT64x32x4_SE_PLR0_SNLL1_TT4_4_WG16_8_1_WGM8
    SolutionIndex: 93
    SolutionNameMin: Cijk_Ailk_Bjlk_DB_MT64x32x4_SE_PLR0_SNLL0_TT4_4_WG16_8_1_WGM8
    SolutionIndex: 94
    SolutionNameMin: Cijk_Ailk_Bjlk_DB_MT96x32x4_SE_PLR1_SNLL1_TT6_4_WG16_8_1_WGM8
    SolutionIndex: 95
    SolutionNameMin: Cijk_Ailk_Bjlk_DB_MT48x64x4_SE_PLR0_SNLL1_TT6_4_WG8_16_1_WGM8
    SolutionIndex: 96
    SolutionNameMin: Cijk_Ailk_Bjlk_DB_MT48x64x4_SE_PLR0_SNLL0_TT6_4_WG8_16_1_WGM8
    SolutionIndex: 97
    SolutionNameMin: Cijk_Ailk_Bjlk_DB_MT96x64x4_SE_PLR0_SNLL0_TT6_4_WG16_16_1_WGM8
    SolutionIndex: 98
    SolutionNameMin: Cijk_Ailk_Bjlk_DB_MT128x64x8_SE_PLR0_SNLL0_TT4_4_WG32_16_1_WGM1
    SolutionIndex: 99
    SolutionNameMin: Cijk_Ailk_Bjlk_DB_MT64x32x8_SE_PLR1_SNLL1_TT4_4_WG16_8_1_WGM1
    SolutionIndex: 100
    SolutionNameMin: Cijk_Ailk_Bjlk_DB_MT64x32x8_SE_PLR1_SNLL0_TT4_4_WG16_8_1_WGM1
    SolutionIndex: 101
    SolutionNameMin: Cijk_Ailk_Bjlk_DB_MT32x64x8_SE_PLR1_SNLL1_TT4_4_WG8_16_1_WGM1
    SolutionIndex: 102
    SolutionNameMin: Cijk_Ailk_Bjlk_DB_MT64x64x8_SE_PLR1_SNLL1_TT4_4_WG16_16_1_WGM1
    SolutionIndex: 103
    SolutionNameMin: Cijk_Ailk_Bjlk_DB_MT64x64x8_SE_PLR0_SNLL1_TT4_4_WG16_16_1_WGM1
    SolutionIndex: 104
    SolutionNameMin: Cijk_Ailk_Bjlk_DB_MT64x64x8_SE_PLR1_SNLL0_TT4_4_WG16_16_1_WGM1
    SolutionIndex: 105
    SolutionNameMin: Cijk_Ailk_Bjlk_DB_MT64x64x8_SE_PLR0_SNLL0_TT4_4_WG16_16_1_WGM1
    SolutionIndex: 106
    SolutionNameMin: Cijk_Ailk_Bjlk_DB_MT64x32x8_SE_PLR1_SNLL1_TT4_4_WG16_8_1_WGM4
    SolutionIndex: 107
    SolutionNameMin: Cijk_Ailk_Bjlk_DB_MT64x32x8_SE_PLR1_SNLL0_TT4_4_WG16_8_1_WGM4
    SolutionIndex: 108
    SolutionNameMin: Cijk_Ailk_Bjlk_DB_MT96x32x8_SE_PLR1_SNLL0_TT6_4_WG16_8_1_WGM4
    SolutionIndex: 109
    SolutionNameMin: Cijk_Ailk_Bjlk_DB_MT32x64x8_SE_PLR1_SNLL1_TT4_4_WG8_16_1_WGM4
    SolutionIndex: 110
    SolutionNameMin: Cijk_Ailk_Bjlk_DB_MT64x64x8_SE_PLR1_SNLL1_TT4_4_WG16_16_1_WGM4
    SolutionIndex: 111
    SolutionNameMin: Cijk_Ailk_Bjlk_DB_MT64x64x8_SE_PLR0_SNLL1_TT4_4_WG16_16_1_WGM4
    SolutionIndex: 112
    SolutionNameMin: Cijk_Ailk_Bjlk_DB_MT64x64x8_SE_PLR1_SNLL0_TT4_4_WG16_16_1_WGM4
    SolutionIndex: 113
    SolutionNameMin: Cijk_Ailk_Bjlk_DB_MT64x64x8_SE_PLR0_SNLL0_TT4_4_WG16_16_1_WGM4
    SolutionIndex: 114
    SolutionNameMin: Cijk_Ailk_Bjlk_DB_MT64x32x8_SE_PLR1_SNLL1_TT4_4_WG16_8_1_WGM8
    SolutionIndex: 115
    SolutionNameMin: Cijk_Ailk_Bjlk_DB_MT64x32x8_SE_PLR1_SNLL0_TT4_4_WG16_8_1_WGM8
    SolutionIndex: 116
    SolutionNameMin: Cijk_Ailk_Bjlk_DB_MT32x64x8_SE_PLR1_SNLL1_TT4_4_WG8_16_1_WGM8
    SolutionIndex: 117
    SolutionNameMin: Cijk_Ailk_Bjlk_DB_MT64x64x8_SE_PLR1_SNLL1_TT4_4_WG16_16_1_WGM8
    SolutionIndex: 118
    SolutionNameMin: Cijk_Ailk_Bjlk_DB_MT64x64x8_SE_PLR0_SNLL1_TT4_4_WG16_16_1_WGM8
    SolutionIndex: 119
    SolutionNameMin: Cijk_Ailk_Bjlk_DB_MT64x64x8_SE_PLR1_SNLL0_TT4_4_WG16_16_1_WGM8
    SolutionIndex: 120
    SolutionNameMin: Cijk_Ailk_Bjlk_DB_MT64x64x8_SE_PLR0_SNLL0_TT4_4_WG16_16_1_WGM8
    SolutionIndex: 121
    SolutionNameMin: Cijk_Ailk_Bjlk_DB_MT64x48x4_SE_PLR0_SNLL1_TT4_6_WG16_8_1_WGM1
    SolutionIndex: 122
    SolutionNameMin: Cijk_Ailk_Bjlk_DB_MT32x64x4_SE_PLR0_SNLL1_TT4_4_WG8_16_1_WGM1
    SolutionIndex: 123
    SolutionNameMin: Cijk_Ailk_Bjlk_DB_MT32x64x4_SE_PLR0_SNLL0_TT4_4_WG8_16_1_WGM1
    SolutionIndex: 124
    SolutionNameMin: Cijk_Ailk_Bjlk_DB_MT64x48x4_SE_PLR0_SNLL1_TT4_6_WG16_8_1_WGM4
    SolutionIndex: 125
    SolutionNameMin: Cijk_Ailk_Bjlk_DB_MT64x48x4_SE_PLR0_SNLL0_TT4_6_WG16_8_1_WGM4
    SolutionIndex: 126
    SolutionNameMin: Cijk_Ailk_Bjlk_DB_MT32x64x4_SE_PLR0_SNLL0_TT4_4_WG8_16_1_WGM8
    SolutionIndex: 127
    SolutionNameMin: Cijk_Ailk_Bjlk_DB_MT64x32x4_SE_PLR0_SNLL1_TT4_4_WG16_8_1_WGM1
    SolutionIndex: 130
    SolutionNameMin: Cijk_Ailk_Bjlk_DB_MT96x64x4_SE_PLR0_SNLL1_TT6_4_WG16_16_1_WGM1
    SolutionIndex: 131
    SolutionNameMin: Cijk_Ailk_Bjlk_DB_MT96x64x4_SE_PLR0_SNLL0_TT6_4_WG16_16_1_WGM1
    SolutionIndex: 132
    SolutionNameMin: Cijk_Ailk_Bjlk_DB_MT128x64x4_SE_PLR1_SNLL1_TT8_4_WG16_16_1_WGM1
    SolutionIndex: 134
    SolutionNameMin: Cijk_Ailk_Bjlk_DB_MT64x32x8_SE_
    SolutionIndex: 135
    SolutionNameMin: Cijk_Ailk_Bjlk_DB_MT48x64x4_SE_PLR0_SNLL1_TT6_4_WG8_16_1_WGM1
    SolutionIndex: 136
    SolutionNameMin: Cijk_Ailk_Bjlk_DB_MT96x64x4_SE_PLR1_SNLL0_TT6_4_WG16_16_1_WGM1
    SolutionIndex: 137
    SolutionNameMin: Cijk_Ailk_Bjlk_DB_MT64x32x4_SE_PLR1_SNLL1_TT4_4_WG16_8_1_WGM4
    SolutionIndex: 138
    SolutionNameMin: Cijk_Ailk_Bjlk_DB_MT64x32x4_SE_PLR0_SNLL1_TT4_4_WG16_8_1_WGM4
    SolutionIndex: 139
    SolutionNameMin: Cijk_Ailk_Bjlk_DB_MT32x64x4_SE_PLR0_SNLL1_TT4_4_WG8_16_1_WGM4
    SolutionIndex: 140
    SolutionNameMin: Cijk_Ailk_Bjlk_DB_MT96x64x4_SE_PLR1_SNLL1_TT6_4_WG16_16_1_WGM4
    SolutionIndex: 141
    SolutionNameMin: Cijk_Ailk_Bjlk_DB_MT96x64x4_SE_PLR1_SNLL0_TT6_4_WG16_16_1_WGM4
    SolutionIndex: 142
    SolutionNameMin: Cijk_Ailk_Bjlk_DB_MT32x64x8_SE_PLR1_SNLL1_TT4_4_WG8_16_1_WGM1
    SolutionIndex: 143
    SolutionNameMin: Cijk_Ailk_Bjlk_DB_MT32x64x8_SE_PLR1_SNLL1_TT4_4_WG8_16_1_WGM4
    SolutionIndex: 144
    SolutionNameMin: Cijk_Ailk_Bjlk_DB_MT64x64x8_SE_PLR1_SNLL0_TT4_4_WG16_16_1_WGM4
    SolutionIndex: 145
    SolutionNameMin: Cijk_Ailk_Bjlk_DB_MT64x32x8_SE_PLR1_SNLL1_TT4_4_WG16_8_1_WGM8
    SolutionIndex: 146
    SolutionNameMin: Cijk_Ailk_Bjlk_DB_MT32x64x8_SE_PLR1_SNLL1_TT4_4_WG8_16_1_WGM8
    SolutionIndex: 147
    SolutionNameMin: Cijk_Ailk_Bjlk_DB_MT32x64x8_SE_PLR1_SNLL0_TT4_4_WG8_16_1_WGM8
- - - [38144, 38144, 1, 256]
    - [9, 0.0]
  - - [29568, 128, 1, 384]
    - [21, 0.0]
  - - [30848, 128, 1, 256]
    - [21, 0.0]
  - - [25728, 128, 1, 384]
    - [21, 0.0]
  - - [32256, 32256, 1, 256]
    - [9, 0.0]
  - - [7680, 7680, 1, 256]
    - [5, 0.0]
  - - [41984, 41984, 1, 256]
    - [8, 0.0]
  - - [40448, 40448, 1, 256]
    - [9, 0.0]
  - - [25728, 128, 1, 256]
    - [21, 0.0]
  - - [64, 64, 1, 64]
    - [0, 0.0]
  - - [15104, 15104, 1, 256]
    - [5, 0.0]
  - - [17280, 17280, 1, 384]
    - [5, 0.0]
  - - [34688, 128, 1, 384]
    - [21, 0.0]
  - - [27392, 27392, 1, 256]
    - [4, 0.0]
  - - [6528, 128, 1, 256]
    - [17, 0.0]
  - - [35328, 35328, 1, 256]
    - [5, 0.0]
  - - [18432, 18432, 1, 384]
    - [9, 0.0]
  - - [31232, 31232, 1, 256]
    - [9, 0.0]
  - - [7808, 128, 1, 256]
    - [21, 0.0]
  - - [38400, 38400, 1, 384]
    - [8, 0.0]
  - - [16128, 16128, 1, 256]
    - [5, 0.0]
  - - [9472, 9472, 1, 256]
    - [5, 0.0]
  - - [21888, 21888, 1, 384]
    - [8, 0.0]
  - - [38656, 38656, 1, 256]
    - [5, 0.0]
  - - [20224, 20224, 1, 256]
    - [5, 0.0]
  - - [8960, 8960, 1, 256]
    - [5, 0.0]
  - - [29952, 29952, 1, 384]
    - [8, 0.0]
  - - [36864, 36864, 1, 384]
    - [8, 0.0]
  - - [33408, 33408, 1, 384]
    - [8, 0.0]
  - - [20608, 128, 1, 384]
    - [21, 0.0]
  - - [23424, 23424, 1, 384]
    - [8, 0.0]
  - - [4864, 4864, 1, 256]
    - [5, 0.0]
  - - [21504, 21504, 1, 384]
    - [5, 0.0]
  - - [25600, 25600, 1, 256]
    - [9, 0.0]
  - - [40960, 40960, 1, 256]
    - [6, 0.0]
  - - [19200, 19200, 1, 384]
    - [5, 0.0]
  - - [64, 1, 1, 64]
    - [1, 0.0]
  - - [25088, 25088, 1, 256]
    - [9, 0.0]
  - - [41728, 41728, 1, 256]
    - [5, 0.0]
  - - [35840, 35840, 1, 256]
    - [8, 0.0]
  - - [34560, 34560, 1, 256]
    - [5, 0.0]
  - - [26368, 26368, 1, 256]
    - [5, 0.0]
  - - [5888, 5888, 1, 256]
    - [5, 0.0]
  - - [28032, 28032, 1, 384]
    - [4, 0.0]
  - - [42496, 42496, 1, 256]
    - [9, 0.0]
  - - [27008, 128, 1, 256]
    - [21, 0.0]
  - - [38400, 38400, 1, 256]
    - [9, 0.0]
  - - [11008, 11008, 1, 256]
    - [5, 0.0]
  - - [32000, 32000, 1, 256]
    - [9, 0.0]
  - - [37248, 37248, 1, 384]
    - [8, 0.0]
  - - [10496, 10496, 1, 256]
    - [5, 0.0]
  - - [16640, 16640, 1, 256]
    - [5, 0.0]
  - - [24960, 24960, 1, 384]
    - [5, 0.0]
  - - [18688, 18688, 1, 256]
    - [5, 0.0]
  - - [22272, 22272, 1, 384]
    - [8, 0.0]
  - - [15488, 128, 1, 256]
    - [21, 0.0]
  - - [28416, 28416, 1, 384]
    - [6, 0.0]
  - - [3840, 3840, 1, 256]
    - [4, 0.0]
  - - [19968, 19968, 1, 384]
    - [5, 0.0]
  - - [43776, 43776, 1, 256]
    - [5, 0.0]
  - - [35072, 35072, 1, 256]
    - [8, 0.0]
  - - [20736, 20736, 1, 256]
    - [5, 0.0]
  - - [7168, 7168, 1, 256]
    - [9, 0.0]
  - - [18432, 18432, 1, 256]
    - [9, 0.0]
  - - [38016, 38016, 1, 384]
    - [8, 0.0]
  - - [35328, 35328, 1, 384]
    - [8, 0.0]
  - - [38784, 38784, 1, 384]
    - [8, 0.0]
  - - [26112, 26112, 1, 384]
    - [6, 0.0]
  - - [27264, 27264, 1, 384]
    - [5, 0.0]
  - - [44928, 44928, 1, 384]
    - [8, 0.0]
  - - [41088, 128, 1, 384]
    - [18, 0.0]
  - - [42368, 128, 1, 256]
    - [21, 0.0]
  - - [10752, 10752, 1, 256]
    - [5, 0.0]
  - - [9088, 128, 1, 384]
    - [18, 0.0]
  - - [17152, 17152, 1, 256]
    - [5, 0.0]
  - - [44928, 128, 1, 384]
    - [18, 0.0]
  - - [7808, 128, 1, 384]
    - [21, 0.0]
  - - [29184, 29184, 1, 256]
    - [9, 0.0]
  - - [11776, 11776, 1, 256]
    - [9, 0.0]
  - - [1, 64, 1, 64]
    - [1, 0.0]
  - - [27136, 27136, 1, 256]
    - [8, 0.0]
  - - [33408, 128, 1, 256]
    - [21, 0.0]
  - - [33792, 33792, 1, 384]
    - [8, 0.0]
  - - [43520, 43520, 1, 256]
    - [8, 0.0]
  - - [14592, 14592, 1, 384]
    - [5, 0.0]
  - - [41472, 41472, 1, 256]
    - [6, 0.0]
  - - [14080, 14080, 1, 256]
    - [5, 0.0]
  - - [34688, 128, 1, 256]
    - [21, 0.0]
  - - [16896, 16896, 1, 256]
    - [9, 0.0]
  - - [15744, 15744, 1, 384]
    - [5, 0.0]
  - - [28416, 28416, 1, 256]
    - [5, 0.0]
  - - [23808, 23808, 1, 256]
    - [5, 0.0]
  - - [27648, 27648, 1, 256]
    - [9, 0.0]
  - - [1152, 3072, 1, 384]
    - [9, 0.0]
  - - [21888, 128, 1, 256]
    - [21, 0.0]
  - - [34816, 34816, 1, 256]
    - [9, 0.0]
  - - [43776, 43776, 1, 384]
    - [8, 0.0]
  - - [36096, 36096, 1, 256]
    - [5, 0.0]
  - - [24320, 24320, 1, 256]
    - [5, 0.0]
  - - [12544, 12544, 1, 256]
    - [5, 0.0]
  - - [29184, 29184, 1, 384]
    - [8, 0.0]
  - - [29568, 29568, 1, 384]
    - [8, 0.0]
  - - [12928, 128, 1, 384]
    - [21, 0.0]
  - - [36480, 36480, 1, 384]
    - [8, 0.0]
  - - [30720, 30720, 1, 256]
    - [9, 0.0]
  - - [25728, 25728, 1, 384]
    - [5, 0.0]
  - - [34048, 34048, 1, 256]
    - [5, 0.0]
  - - [12928, 128, 1, 256]
    - [21, 0.0]
  - - [9728, 9728, 1, 256]
    - [9, 0.0]
  - - [128, 128, 1, 256]
    - [20, 0.0]
  - - [33024, 33024, 1, 256]
    - [5, 0.0]
  - - [15488, 128, 1, 384]
    - [21, 0.0]
  - - [39808, 128, 1, 384]
    - [21, 0.0]
  - - [18176, 18176, 1, 256]
    - [5, 0.0]
  - - [21504, 21504, 1, 256]
    - [5, 0.0]
  - - [16384, 16384, 1, 256]
    - [5, 0.0]
  - - [27008, 128, 1, 384]
    - [18, 0.0]
  - - [27904, 27904, 1, 256]
    - [4, 0.0]
  - - [24448, 128, 1, 384]
    - [21, 0.0]
  - - [35968, 128, 1, 384]
    - [18, 0.0]
  - - [37632, 37632, 1, 256]
    - [5, 0.0]
  - - [14848, 14848, 1, 256]
    - [5, 0.0]
  - - [23552, 23552, 1, 256]
    - [9, 0.0]
  - - [4608, 4608, 1, 50000]
    - [11, 0.0]
  - - [13056, 13056, 1, 256]
    - [5, 0.0]
  - - [38528, 128, 1, 256]
    - [21, 0.0]
  - - [19584, 19584, 1, 384]
    - [5, 0.0]
  - - [16768, 128, 1, 384]
    - [18, 0.0]
  - - [22784, 22784, 1, 256]
    - [9, 0.0]
  - - [44160, 44160, 1, 384]
    - [8, 0.0]
  - - [28160, 28160, 1, 256]
    - [8, 0.0]
  - - [14592, 14592, 1, 256]
    - [5, 0.0]
  - - [20992, 20992, 1, 256]
    - [9, 0.0]
  - - [41216, 41216, 1, 256]
    - [5, 0.0]
  - - [21760, 21760, 1, 256]
    - [5, 0.0]
  - - [25344, 25344, 1, 256]
    - [9, 0.0]
  - - [4608, 4608, 1, 256]
    - [9, 0.0]
  - - [2560, 2048, 1, 256]
    - [13, 0.0]
  - - [30464, 30464, 1, 256]
    - [5, 0.0]
  - - [19200, 19200, 1, 256]
    - [5, 0.0]
  - - [22272, 22272, 1, 256]
    - [9, 0.0]
  - - [29952, 29952, 1, 256]
    - [5, 0.0]
  - - [20480, 20480, 1, 256]
    - [9, 0.0]
  - - [17408, 17408, 1, 256]
    - [9, 0.0]
  - - [32768, 32768, 1, 256]
    - [6, 0.0]
  - - [18816, 18816, 1, 384]
    - [6, 0.0]
  - - [34944, 34944, 1, 384]
    - [8, 0.0]
  - - [18048, 18048, 1, 384]
    - [7, 0.0]
  - - [34560, 34560, 1, 384]
    - [8, 0.0]
  - - [9088, 128, 1, 256]
    - [18, 0.0]
  - - [24576, 24576, 1, 256]
    - [9, 0.0]
  - - [32128, 128, 1, 384]
    - [21, 0.0]
  - - [8448, 8448, 1, 256]
    - [5, 0.0]
  - - [42752, 42752, 1, 256]
    - [4, 0.0]
  - - [5376, 5376, 1, 256]
    - [5, 0.0]
  - - [18048, 128, 1, 256]
    - [21, 0.0]
  - - [3584, 3584, 1, 256]
    - [5, 0.0]
  - - [37120, 37120, 1, 256]
    - [5, 0.0]
  - - [39936, 39936, 1, 384]
    - [8, 0.0]
  - - [20736, 20736, 1, 384]
    - [5, 0.0]
  - - [35584, 35584, 1, 256]
    - [5, 0.0]
  - - [26112, 26112, 1, 256]
    - [5, 0.0]
  - - [16896, 16896, 1, 384]
    - [9, 0.0]
  - - [40704, 40704, 1, 384]
    - [8, 0.0]
  - - [33280, 33280, 1, 256]
    - [9, 0.0]
  - - [5632, 5632, 1, 256]
    - [5, 0.0]
  - - [19456, 19456, 1, 256]
    - [9, 0.0]
  - - [22016, 22016, 1, 256]
    - [9, 0.0]
  - - [14208, 128, 1, 256]
    - [21, 0.0]
  - - [13568, 13568, 1, 256]
    - [5, 0.0]
  - - [30848, 128, 1, 384]
    - [21, 0.0]
  - - [1408, 128, 1, 384]
    - [21, 0.0]
  - - [5760, 5760, 1, 5760]
    - [12, 0.0]
  - - [39936, 39936, 1, 256]
    - [9, 0.0]
  - - [1920, 3072, 1, 384]
    - [3, 0.0]
  - - [9984, 9984, 1, 256]
    - [5, 0.0]
  - - [2816, 2048, 1, 256]
    - [14, 0.0]
  - - [23168, 128, 1, 256]
    - [21, 0.0]
  - - [19968, 19968, 1, 256]
    - [5, 0.0]
  - - [44800, 44800, 1, 256]
    - [5, 0.0]
  - - [14976, 14976, 1, 384]
    - [5, 0.0]
  - - [35712, 35712, 1, 384]
    - [8, 0.0]
  - - [43008, 43008, 1, 384]
    - [8, 0.0]
  - - [41088, 41088, 1, 384]
    - [8, 0.0]
  - - [16128, 16128, 1, 384]
    - [7, 0.0]
  - - [5120, 5120, 1, 256]
    - [9, 0.0]
  - - [25856, 25856, 1, 256]
    - [5, 0.0]
  - - [12288, 12288, 1, 256]
    - [5, 0.0]
  - - [6400, 6400, 1, 256]
    - [5, 0.0]
  - - [2688, 128, 1, 256]
    - [21, 0.0]
  - - [11648, 128, 1, 256]
    - [21, 0.0]
  - - [43264, 43264, 1, 256]
    - [9, 0.0]
  - - [19712, 19712, 1, 256]
    - [5, 0.0]
  - - [34176, 34176, 1, 384]
    - [8, 0.0]
  - - [31104, 31104, 1, 384]
    - [8, 0.0]
  - - [36608, 36608, 1, 256]
    - [5, 0.0]
  - - [39808, 128, 1, 256]
    - [21, 0.0]
  - - [13824, 13824, 1, 384]
    - [9, 0.0]
  - - [42624, 42624, 1, 384]
    - [8, 0.0]
  - - [21120, 21120, 1, 384]
    - [8, 0.0]
  - - [23296, 23296, 1, 256]
    - [5, 0.0]
  - - [42240, 42240, 1, 256]
    - [5, 0.0]
  - - [33408, 128, 1, 384]
    - [19, 0.0]
  - - [43648, 128, 1, 256]
    - [21, 0.0]
  - - [19328, 128, 1, 384]
    - [21, 0.0]
  - - [33792, 33792, 1, 256]
    - [5, 0.0]
  - - [31488, 31488, 1, 256]
    - [4, 0.0]
  - - [768, 3072, 1, 384]
    - [2, 0.0]
  - - [6144, 6144, 1, 256]
    - [9, 0.0]
  - - [20352, 20352, 1, 384]
    - [5, 0.0]
  - - [23168, 128, 1, 384]
    - [18, 0.0]
  - - [33536, 33536, 1, 256]
    - [4, 0.0]
  - - [32640, 32640, 1, 384]
    - [8, 0.0]
  - - [1536, 3072, 1, 384]
    - [9, 0.0]
  - - [19328, 128, 1, 256]
    - [21, 0.0]
  - - [2688, 3072, 1, 384]
    - [9, 0.0]
  - - [24192, 24192, 1, 384]
    - [8, 0.0]
  - - [6912, 6912, 1, 256]
    - [5, 0.0]
  - - [15360, 15360, 1, 256]
    - [5, 0.0]
  - - [18944, 18944, 1, 256]
    - [9, 0.0]
  - - [37376, 37376, 1, 256]
    - [8, 0.0]
  - - [31488, 31488, 1, 384]
    - [8, 0.0]
  - - [26880, 26880, 1, 256]
    - [5, 0.0]
  - - [44928, 128, 1, 128]
    - [22, 0.0]
  - - [24448, 128, 1, 256]
    - [21, 0.0]
  - - [31872, 31872, 1, 384]
    - [8, 0.0]
  - - [1408, 128, 1, 256]
    - [21, 0.0]
  - - [38528, 128, 1, 384]
    - [21, 0.0]
  - - [15616, 15616, 1, 256]
    - [5, 0.0]
  - - [39552, 39552, 1, 384]
    - [8, 0.0]
  - - [4352, 4352, 1, 256]
    - [5, 0.0]
  - - [28288, 128, 1, 384]
    - [21, 0.0]
  - - [10368, 128, 1, 256]
    - [22, 0.0]
  - - [32128, 128, 1, 256]
    - [21, 0.0]
  - - [4608, 4608, 1, 4608]
    - [11, 0.0]
  - - [8704, 8704, 1, 256]
    - [9, 0.0]
  - - [17664, 17664, 1, 256]
    - [5, 0.0]
  - - [24576, 24576, 1, 384]
    - [8, 0.0]
  - - [37248, 128, 1, 384]
    - [21, 0.0]
  - - [34304, 34304, 1, 256]
    - [6, 0.0]
  - - [42368, 128, 1, 384]
    - [19, 0.0]
  - - [17664, 17664, 1, 384]
    - [5, 0.0]
  - - [12800, 12800, 1, 256]
    - [9, 0.0]
  - - [26624, 26624, 1, 256]
    - [9, 0.0]
  - - [36864, 36864, 1, 256]
    - [8, 0.0]
  - - [40704, 40704, 1, 256]
    - [5, 0.0]
  - - [12032, 12032, 1, 256]
    - [5, 0.0]
  - - [33024, 33024, 1, 384]
    - [8, 0.0]
  - - [28800, 28800, 1, 384]
    - [5, 0.0]
  - - [22656, 22656, 1, 384]
    - [5, 0.0]
  - - [41472, 41472, 1, 384]
    - [6, 0.0]
  - - [39680, 39680, 1, 256]
    - [5, 0.0]
  - - [44032, 44032, 1, 256]
    - [8, 0.0]
  - - [43392, 43392, 1, 384]
    - [8, 0.0]
  - - [42240, 42240, 1, 384]
    - [8, 0.0]
  - - [38912, 38912, 1, 256]
    - [9, 0.0]
  - - [23040, 23040, 1, 384]
    - [8, 0.0]
  - - [13312, 13312, 1, 256]
    - [9, 0.0]
  - - [128, 128, 1, 384]
    - [23, 0.0]
  - - [39168, 39168, 1, 256]
    - [5, 0.0]
  - - [25344, 25344, 1, 384]
    - [5, 0.0]
  - - [5248, 128, 1, 256]
    - [16, 0.0]
  - - [30208, 30208, 1, 256]
    - [9, 0.0]
  - - [40192, 40192, 1, 256]
    - [5, 0.0]
  - - [15872, 15872, 1, 256]
    - [9, 0.0]
  - - [44544, 44544, 1, 256]
    - [9, 0.0]
  - - [11520, 11520, 1, 256]
    - [5, 0.0]
  - - [15360, 15360, 1, 384]
    - [9, 0.0]
  - - [23040, 23040, 1, 256]
    - [5, 0.0]
  - - [26496, 26496, 1, 384]
    - [8, 0.0]
  - - [11264, 11264, 1, 256]
    - [9, 0.0]
  - - [18048, 128, 1, 384]
    - [18, 0.0]
  - - [30976, 30976, 1, 256]
    - [4, 0.0]
  - - [11648, 128, 1, 384]
    - [15, 0.0]
  - - [2304, 3072, 1, 384]
    - [3, 0.0]
  - - [28928, 28928, 1, 256]
    - [9, 0.0]
  - - [43008, 43008, 1, 256]
    - [5, 0.0]
  - - [29440, 29440, 1, 256]
    - [5, 0.0]
  - - [36352, 36352, 1, 256]
    - [5, 0.0]
  - - [32256, 32256, 1, 384]
    - [8, 0.0]
  - - [23808, 23808, 1, 384]
    - [8, 0.0]
  - - [37248, 128, 1, 256]
    - [21, 0.0]
  - - [1, 1, 1, 64]
    - [1, 0.0]
  - - [37888, 37888, 1, 256]
    - [6, 0.0]
  - - [35968, 128, 1, 256]
    - [21, 0.0]
  - - [13824, 13824, 1, 256]
    - [9, 0.0]
  - - [39168, 39168, 1, 384]
    - [8, 0.0]
  - - [37632, 37632, 1, 384]
    - [8, 0.0]
  - - [29568, 128, 1, 256]
    - [21, 0.0]
  - - [14336, 14336, 1, 256]
    - [9, 0.0]
  - - [28288, 128, 1, 256]
    - [21, 0.0]
  - - [16512, 16512, 1, 384]
    - [5, 0.0]
  - - [30720, 30720, 1, 384]
    - [8, 0.0]
  - - [21248, 21248, 1, 256]
    - [5, 0.0]
  - - [29696, 29696, 1, 256]
    - [9, 0.0]
  - - [384, 3072, 1, 384]
    - [3, 0.0]
  - - [28672, 28672, 1, 256]
    - [5, 0.0]
  - - [32512, 32512, 1, 256]
    - [5, 0.0]
  - - [9216, 9216, 1, 256]
    - [9, 0.0]
  - - [6656, 6656, 1, 256]
    - [9, 0.0]
  - - [30336, 30336, 1, 384]
    - [5, 0.0]
  - - [20608, 128, 1, 256]
    - [21, 0.0]
  - - [7936, 7936, 1, 256]
    - [5, 0.0]
  - - [41856, 41856, 1, 384]
    - [8, 0.0]
  - - [44288, 44288, 1, 256]
    - [5, 0.0]
  - - [7744, 7744, 1, 7744]
    - [10, 0.0]
  - - [7424, 7424, 1, 256]
    - [5, 0.0]
  - - [39424, 39424, 1, 256]
    - [6, 0.0]
  - - [43648, 128, 1, 384]
    - [21, 0.0]
  - - [14208, 14208, 1, 384]
    - [5, 0.0]
  - - [36096, 36096, 1, 384]
    - [8, 0.0]
  - - [44544, 44544, 1, 384]
    - [8, 0.0]
  - - [22528, 22528, 1, 256]
    - [9, 0.0]
  - - [4096, 4096, 1, 256]
    - [5, 0.0]
  - - [31744, 31744, 1, 256]
    - [9, 0.0]
  - - [3968, 128, 1, 384]
    - [21, 0.0]
  - - [17920, 17920, 1, 256]
    - [9, 0.0]
  - - [5248, 128, 1, 384]
    - [16, 0.0]
  - - [26880, 26880, 1, 384]
    - [8, 0.0]
  - - [8192, 8192, 1, 256]
    - [9, 0.0]
  - - [3968, 128, 1, 256]
    - [21, 0.0]
  - - [41088, 128, 1, 256]
    - [21, 0.0]
  - - [21888, 128, 1, 384]
    - [21, 0.0]
  - - [16768, 128, 1, 256]
    - [21, 0.0]
  - - [24064, 24064, 1, 256]
    - [9, 0.0]
  - - [44928, 128, 1, 256]
    - [21, 0.0]
  - - [27648, 27648, 1, 384]
    - [6, 0.0]
  - - [24832, 24832, 1, 256]
    - [5, 0.0]
  - - [10240, 10240, 1, 256]
    - [9, 0.0]
  - - [40320, 40320, 1, 384]
    - [8, 0.0]
  - - [18432, 2688, 1, 384]
    - [27, 0.0]
  - - [43008, 2304, 1, 384]
    - [29, 0.0]
  - - [3840, 3072, 1, 384]
    - [27, 0.0]
  - - [33408, 1920, 1, 384]
    - [27, 0.0]
  - - [33792, 2688, 1, 384]
    - [27, 0.0]
  - - [8064, 2688, 1, 384]
    - [27, 0.0]
  - - [33408, 2304, 1, 384]
    - [27, 0.0]
  - - [31872, 1536, 1, 384]
    - [26, 0.0]
  - - [41088, 1920, 1, 384]
    - [27, 0.0]
  - - [41088, 2304, 1, 384]
    - [27, 0.0]
  - - [5376, 1536, 1, 384]
    - [30, 0.0]
  - - [16128, 1536, 1, 384]
    - [29, 0.0]
  - - [36480, 2688, 1, 384]
    - [27, 0.0]
  - - [15360, 768, 1, 384]
    - [27, 0.0]
  - - [42624, 768, 1, 384]
    - [29, 0.0]
  - - [4992, 1536, 1, 384]
    - [29, 0.0]
  - - [29952, 1536, 1, 384]
    - [29, 0.0]
  - - [10752, 2688, 1, 384]
    - [26, 0.0]
  - - [42240, 2688, 1, 384]
    - [27, 0.0]
  - - [36096, 1536, 1, 384]
    - [29, 0.0]
  - - [26496, 1536, 1, 384]
    - [27, 0.0]
  - - [42624, 2688, 1, 384]
    - [27, 0.0]
  - - [17664, 2688, 1, 384]
    - [27, 0.0]
  - - [37248, 1536, 1, 384]
    - [27, 0.0]
  - - [16896, 2304, 1, 384]
    - [27, 0.0]
  - - [22272, 1920, 1, 384]
    - [27, 0.0]
  - - [26880, 2688, 1, 384]
    - [27, 0.0]
  - - [384, 768, 1, 384]
    - [31, 0.0]
  - - [16896, 1920, 1, 384]
    - [27, 0.0]
  - - [32640, 2304, 1, 384]
    - [29, 0.0]
  - - [5760, 2304, 1, 384]
    - [29, 0.0]
  - - [11904, 2304, 1, 384]
    - [29, 0.0]
  - - [24576, 2304, 1, 384]
    - [29, 0.0]
  - - [33024, 1536, 1, 384]
    - [27, 0.0]
  - - [36096, 2304, 1, 384]
    - [29, 0.0]
  - - [20352, 2688, 1, 384]
    - [27, 0.0]
  - - [14592, 2304, 1, 384]
    - [29, 0.0]
  - - [16128, 1920, 1, 384]
    - [27, 0.0]
  - - [16512, 1920, 1, 384]
    - [27, 0.0]
  - - [35712, 1920, 1, 384]
    - [27, 0.0]
  - - [9216, 2688, 1, 384]
    - [29, 0.0]
  - - [23808, 2688, 1, 384]
    - [27, 0.0]
  - - [18048, 768, 1, 384]
    - [29, 0.0]
  - - [14592, 2688, 1, 384]
    - [27, 0.0]
  - - [14208, 1920, 1, 384]
    - [27, 0.0]
  - - [14976, 2688, 1, 384]
    - [27, 0.0]
  - - [17280, 2304, 1, 384]
    - [29, 0.0]
  - - [11520, 2304, 1, 384]
    - [27, 0.0]
  - - [18432, 768, 1, 384]
    - [26, 0.0]
  - - [4608, 768, 1, 384]
    - [29, 0.0]
  - - [34944, 1920, 1, 384]
    - [27, 0.0]
  - - [13824, 2688, 1, 384]
    - [27, 0.0]
  - - [39936, 2304, 1, 384]
    - [29, 0.0]
  - - [7680, 2688, 1, 384]
    - [26, 0.0]
  - - [19968, 2304, 1, 384]
    - [27, 0.0]
  - - [27648, 2688, 1, 384]
    - [27, 0.0]
  - - [4224, 768, 1, 384]
    - [32, 0.0]
  - - [24192, 1920, 1, 384]
    - [27, 0.0]
  - - [32640, 1920, 1, 384]
    - [26, 0.0]
  - - [34176, 2688, 1, 384]
    - [27, 0.0]
  - - [35328, 1536, 1, 384]
    - [27, 0.0]
  - - [8832, 2688, 1, 384]
    - [27, 0.0]
  - - [18048, 1920, 1, 384]
    - [27, 0.0]
  - - [31488, 768, 1, 384]
    - [29, 0.0]
  - - [21504, 2304, 1, 384]
    - [27, 0.0]
  - - [11136, 2688, 1, 384]
    - [27, 0.0]
  - - [768, 1152, 1, 384]
    - [25, 0.0]
  - - [29184, 2688, 1, 384]
    - [27, 0.0]
  - - [4608, 2688, 1, 384]
    - [27, 0.0]
  - - [21504, 2688, 1, 384]
    - [27, 0.0]
  - - [34176, 768, 1, 384]
    - [27, 0.0]
  - - [23808, 1536, 1, 384]
    - [27, 0.0]
  - - [43392, 1536, 1, 384]
    - [27, 0.0]
  - - [13824, 768, 1, 384]
    - [29, 0.0]
  - - [38016, 1536, 1, 384]
    - [29, 0.0]
  - - [20736, 2688, 1, 384]
    - [27, 0.0]
  - - [15744, 1536, 1, 384]
    - [27, 0.0]
  - - [16512, 1536, 1, 384]
    - [29, 0.0]
  - - [3072, 2304, 1, 384]
    - [28, 0.0]
  - - [5760, 2688, 1, 384]
    - [26, 0.0]
  - - [38400, 2304, 1, 384]
    - [27, 0.0]
  - - [15360, 2688, 1, 384]
    - [27, 0.0]
  - - [29952, 2688, 1, 384]
    - [27, 0.0]
  - - [43008, 2688, 1, 384]
    - [27, 0.0]
  - - [13440, 1920, 1, 384]
    - [27, 0.0]
  - - [6528, 2688, 1, 384]
    - [27, 0.0]
  - - [2304, 1536, 1, 384]
    - [24, 0.0]
  - - [40320, 1536, 1, 384]
    - [29, 0.0]
  - - [13440, 1536, 1, 384]
    - [29, 0.0]
  - - [40320, 2688, 1, 384]
    - [29, 0.0]
  - - [30336, 2304, 1, 384]
    - [27, 0.0]
  - - [24192, 2688, 1, 384]
    - [27, 0.0]
  - - [35328, 768, 1, 384]
    - [29, 0.0]
  - - [23040, 768, 1, 384]
    - [29, 0.0]
  - - [29952, 2304, 1, 384]
    - [27, 0.0]
  - - [33024, 1920, 1, 384]
    - [27, 0.0]
  - - [14976, 768, 1, 384]
    - [26, 0.0]
  - - [42624, 1920, 1, 384]
    - [26, 0.0]
  - - [32640, 2688, 1, 384]
    - [28, 0.0]
  - - [11520, 1536, 1, 384]
    - [29, 0.0]
  - - [6912, 768, 1, 384]
    - [29, 0.0]
  - - [39552, 1920, 1, 384]
    - [27, 0.0]
  - - [32256, 1920, 1, 384]
    - [29, 0.0]
  - - [10752, 1536, 1, 384]
    - [28, 0.0]
  - - [24576, 2688, 1, 384]
    - [27, 0.0]
  - - [12672, 2688, 1, 384]
    - [27, 0.0]
  - - [10752, 1920, 1, 384]
    - [27, 0.0]
  - - [40704, 1536, 1, 384]
    - [29, 0.0]
  - - [32256, 768, 1, 384]
    - [28, 0.0]
  - - [18816, 2688, 1, 384]
    - [29, 0.0]
  - - [11520, 2688, 1, 384]
    - [27, 0.0]
  - - [35712, 2688, 1, 384]
    - [27, 0.0]
  - - [29952, 1920, 1, 384]
    - [27, 0.0]
  - - [26880, 1920, 1, 384]
    - [27, 0.0]
  - - [33408, 2688, 1, 384]
    - [27, 0.0]
  - - [35328, 2688, 1, 384]
    - [27, 0.0]
  - - [21120, 2688, 1, 384]
    - [27, 0.0]
  - - [19584, 1920, 1, 384]
    - [27, 0.0]
  - - [17664, 1536, 1, 384]
    - [27, 0.0]
  - - [36864, 768, 1, 384]
    - [29, 0.0]
  - - [14592, 1536, 1, 384]
    - [28, 0.0]
  - - [11136, 2304, 1, 384]
    - [27, 0.0]
  - - [9600, 2688, 1, 384]
    - [27, 0.0]
  - - [9216, 2304, 1, 384]
    - [29, 0.0]
  - - [21120, 768, 1, 384]
    - [29, 0.0]
  - - [4992, 2688, 1, 384]
    - [27, 0.0]
  - - [41472, 768, 1, 384]
    - [29, 0.0]
  - - [37632, 1536, 1, 384]
    - [26, 0.0]
  - - [38784, 2304, 1, 384]
    - [27, 0.0]
  - - [8448, 2688, 1, 384]
    - [27, 0.0]
  - - [36864, 2304, 1, 384]
    - [27, 0.0]
  - - [40704, 1920, 1, 384]
    - [27, 0.0]
  - - [39552, 2688, 1, 384]
    - [27, 0.0]
  - - [26112, 768, 1, 384]
    - [27, 0.0]
  - - [29184, 1536, 1, 384]
    - [29, 0.0]
  - - [32640, 1536, 1, 384]
    - [27, 0.0]
  - - [5376, 2688, 1, 384]
    - [27, 0.0]
  - - [13056, 768, 1, 384]
    - [29, 0.0]
  - - [13824, 2304, 1, 384]
    - [29, 0.0]
  - - [16896, 768, 1, 384]
    - [29, 0.0]
  - - [30336, 1920, 1, 384]
    - [27, 0.0]
  - - [27264, 2304, 1, 384]
    - [27, 0.0]
  - - [7680, 1536, 1, 384]
    - [28, 0.0]
  - - [30720, 2688, 1, 384]
    - [27, 0.0]
  - - [36096, 2688, 1, 384]
    - [27, 0.0]
  - - [5760, 1920, 1, 384]
    - [27, 0.0]
  - - [42240, 1536, 1, 384]
    - [29, 0.0]
  - - [8448, 1920, 1, 384]
    - [27, 0.0]
  - - [32256, 1536, 1, 384]
    - [29, 0.0]
  - - [44160, 2304, 1, 384]
    - [29, 0.0]
  - - [30336, 2688, 1, 384]
    - [27, 0.0]
  - - [6144, 2688, 1, 384]
    - [27, 0.0]
  - - [39168, 1536, 1, 384]
    - [29, 0.0]
  - - [11904, 1920, 1, 384]
    - [27, 0.0]
  - - [8064, 1536, 1, 384]
    - [28, 0.0]
  - - [21120, 1920, 1, 384]
    - [27, 0.0]
  - - [22656, 2304, 1, 384]
    - [27, 0.0]
  - - [19968, 2688, 1, 384]
    - [27, 0.0]
  - - [10752, 768, 1, 384]
    - [28, 0.0]
  - - [18432, 2304, 1, 384]
    - [29, 0.0]
  - - [14976, 1920, 1, 384]
    - [27, 0.0]
  - - [33024, 2688, 1, 384]
    - [27, 0.0]
  - - [1536, 768, 1, 384]
    - [29, 0.0]
  - - [33024, 2304, 1, 384]
    - [27, 0.0]
  - - [14208, 2688, 1, 384]
    - [27, 0.0]
  - - [38016, 2304, 1, 384]
    - [27, 0.0]
  - - [16896, 2688, 1, 384]
    - [27, 0.0]
  - - [31104, 768, 1, 384]
    - [27, 0.0]
  - - [41472, 2304, 1, 384]
    - [27, 0.0]
  - - [23424, 2688, 1, 384]
    - [27, 0.0]
  - - [26496, 2688, 1, 384]
    - [27, 0.0]
  - - [16512, 2304, 1, 384]
    - [27, 0.0]
  - - [11520, 1920, 1, 384]
    - [27, 0.0]
  - - [39552, 768, 1, 384]
    - [27, 0.0]
  - - [6144, 2304, 1, 384]
    - [26, 0.0]
  - - [14208, 2304, 1, 384]
    - [27, 0.0]
  - - [19584, 2304, 1, 384]
    - [27, 0.0]
  - - [36480, 768, 1, 384]
    - [26, 0.0]
  - - [15744, 2688, 1, 384]
    - [27, 0.0]
  - - [34560, 1536, 1, 384]
    - [27, 0.0]
  - - [8448, 2304, 1, 384]
    - [27, 0.0]
  - - [26112, 2688, 1, 384]
    - [27, 0.0]
  - - [39936, 768, 1, 384]
    - [27, 0.0]
  - - [19200, 1920, 1, 384]
    - [29, 0.0]
  - - [38400, 768, 1, 384]
    - [29, 0.0]
  - - [8448, 1536, 1, 384]
    - [29, 0.0]
  - - [13824, 1536, 1, 384]
    - [29, 0.0]
  - - [9600, 768, 1, 384]
    - [29, 0.0]
  - - [10368, 768, 1, 384]
    - [27, 0.0]
  - - [20736, 1536, 1, 384]
    - [29, 0.0]
  - - [28800, 768, 1, 384]
    - [27, 0.0]
  - - [10368, 1536, 1, 384]
    - [26, 0.0]
  - - [21888, 1536, 1, 384]
    - [26, 0.0]
  - - [38784, 2688, 1, 384]
    - [26, 0.0]
  - - [27648, 2304, 1, 384]
    - [29, 0.0]
  - - [11136, 1920, 1, 384]
    - [27, 0.0]
  - - [37248, 768, 1, 384]
    - [29, 0.0]
  - - [23040, 2688, 1, 384]
    - [27, 0.0]
  - - [37632, 1920, 1, 384]
    - [27, 0.0]
  - - [7680, 768, 1, 384]
    - [27, 0.0]
  - - [38016, 1920, 1, 384]
    - [27, 0.0]
  - - [35712, 2304, 1, 384]
    - [27, 0.0]
  - - [37248, 2688, 1, 384]
    - [27, 0.0]
  - - [29568, 1920, 1, 384]
    - [27, 0.0]
  - - [38400, 2688, 1, 384]
    - [27, 0.0]
  - - [25728, 768, 1, 384]
    - [26, 0.0]
  - - [8832, 1920, 1, 384]
    - [26, 0.0]
  - - [43776, 1920, 1, 384]
    - [27, 0.0]
  - - [15744, 768, 1, 384]
    - [29, 0.0]
  - - [27264, 1920, 1, 384]
    - [27, 0.0]
  - - [33792, 2304, 1, 384]
    - [27, 0.0]
  - - [8832, 2304, 1, 384]
    - [29, 0.0]
  - - [39168, 2688, 1, 384]
    - [27, 0.0]
  - - [35328, 1920, 1, 384]
    - [27, 0.0]
  - - [35328, 2304, 1, 384]
    - [29, 0.0]
  - - [29184, 768, 1, 384]
    - [27, 0.0]
  - - [18048, 2688, 1, 384]
    - [27, 0.0]
  - - [32256, 2688, 1, 384]
    - [27, 0.0]
  - - [18816, 1536, 1, 384]
    - [26, 0.0]
  - - [13056, 1536, 1, 384]
    - [29, 0.0]
  - - [34944, 1536, 1, 384]
    - [27, 0.0]
  - - [38400, 1920, 1, 384]
    - [27, 0.0]
  - - [15360, 2304, 1, 384]
    - [27, 0.0]
  - - [27264, 2688, 1, 384]
    - [27, 0.0]
  - - [11136, 1536, 1, 384]
    - [29, 0.0]
  - - [30720, 2304, 1, 384]
    - [27, 0.0]
  - - [24960, 2688, 1, 384]
    - [27, 0.0]
  - - [13824, 1920, 1, 384]
    - [27, 0.0]
  - - [17280, 2688, 1, 384]
    - [27, 0.0]
  - - [31872, 768, 1, 384]
    - [27, 0.0]
  - - [11904, 2688, 1, 384]
    - [27, 0.0]
  - - [7296, 768, 1, 384]
    - [26, 0.0]
  - - [19200, 1536, 1, 384]
    - [29, 0.0]
  - - [12288, 768, 1, 384]
    - [29, 0.0]
  - - [33792, 768, 1, 384]
    - [27, 0.0]
  - - [21888, 2688, 1, 384]
    - [27, 0.0]
  - - [2688, 1920, 1, 384]
    - [33, 0.0]
  - - [19968, 768, 1, 384]
    - [29, 0.0]
  - - [12288, 2688, 1, 384]
    - [26, 0.0]
  - - [12288, 2304, 1, 384]
    - [26, 0.0]
  - - [28416, 768, 1, 384]
    - [27, 0.0]
  - - [34560, 768, 1, 384]
    - [27, 0.0]
  - - [39936, 2688, 1, 384]
    - [27, 0.0]
  - - [8064, 1920, 1, 384]
    - [26, 0.0]
  - - [26880, 1536, 1, 384]
    - [27, 0.0]
  - - [28032, 2688, 1, 384]
    - [27, 0.0]
  - - [41472, 2688, 1, 384]
    - [27, 0.0]
  - - [29568, 2688, 1, 384]
    - [27, 0.0]
  - - [31104, 2688, 1, 384]
    - [27, 0.0]
  - - [5376, 1920, 1, 384]
    - [26, 0.0]
  - - [41856, 2688, 1, 384]
    - [27, 0.0]
  - - [9984, 768, 1, 384]
    - [29, 0.0]
  - - [3456, 2688, 1, 384]
    - [29, 0.0]
  - - [43392, 2688, 1, 384]
    - [27, 0.0]
  - - [36480, 1920, 1, 384]
    - [27, 0.0]
  - - [29568, 1536, 1, 384]
    - [29, 0.0]
  - - [36864, 2688, 1, 384]
    - [27, 0.0]
  - - [12672, 768, 1, 384]
    - [29, 0.0]
  - - [24064, 3072, 1, 256]
    - [53, 0.0]
  - - [256, 512, 1, 256]
    - [54, 0.0]
  - - [40960, 27648, 1, 256]
    - [53, 0.0]
  - - [31744, 3072, 1, 256]
    - [53, 0.0]
  - - [13056, 1792, 1, 256]
    - [47, 0.0]
  - - [35328, 22785, 1, 256]
    - [47, 0.0]
  - - [28160, 15872, 1, 256]
    - [53, 0.0]
  - - [39168, 1792, 1, 256]
    - [47, 0.0]
  - - [23808, 11265, 1, 256]
    - [53, 0.0]
  - - [16640, 4353, 1, 256]
    - [47, 0.0]
  - - [38912, 26624, 1, 256]
    - [53, 0.0]
  - - [6912, 3585, 1, 256]
    - [53, 0.0]
  - - [32768, 1792, 1, 256]
    - [47, 0.0]
  - - [30976, 18688, 1, 256]
    - [47, 0.0]
  - - [512, 2048, 1, 256]
    - [41, 0.0]
  - - [15872, 3584, 1, 256]
    - [53, 0.0]
  - - [6400, 1792, 1, 256]
    - [53, 0.0]
  - - [39680, 27393, 1, 256]
    - [47, 0.0]
  - - [36864, 24577, 1, 256]
    - [53, 0.0]
  - - [26112, 1536, 1, 256]
    - [53, 0.0]
  - - [26368, 1536, 1, 256]
    - [53, 0.0]
  - - [16896, 4353, 1, 256]
    - [47, 0.0]
  - - [14336, 1793, 1, 256]
    - [47, 0.0]
  - - [3840, 3072, 1, 256]
    - [53, 0.0]
  - - [2560, 3072, 1, 256]
    - [59, 0.0]
  - - [6656, 1536, 1, 256]
    - [69, 0.0]
  - - [27136, 1792, 1, 256]
    - [47, 0.0]
  - - [43776, 3072, 1, 256]
    - [53, 0.0]
  - - [23296, 1792, 1, 256]
    - [47, 0.0]
  - - [11264, 7937, 1, 256]
    - [47, 0.0]
  - - [768, 3072, 1, 256]
    - [47, 0.0]
  - - [6912, 3841, 1, 256]
    - [47, 0.0]
  - - [40960, 769, 1, 256]
    - [47, 0.0]
  - - [40448, 9216, 1, 256]
    - [53, 0.0]
  - - [7680, 4353, 1, 256]
    - [47, 0.0]
  - - [23296, 3072, 1, 256]
    - [53, 0.0]
  - - [7936, 4609, 1, 256]
    - [53, 0.0]
  - - [20736, 8448, 1, 256]
    - [47, 0.0]
  - - [768, 1024, 1, 256]
    - [61, 0.0]
  - - [38656, 3072, 1, 256]
    - [53, 0.0]
  - - [28160, 1792, 1, 256]
    - [47, 0.0]
  - - [13824, 3072, 1, 256]
    - [53, 0.0]
  - - [42752, 1792, 1, 256]
    - [47, 0.0]
  - - [35584, 23041, 1, 256]
    - [53, 0.0]
  - - [13056, 3072, 1, 256]
    - [53, 0.0]
  - - [37888, 768, 1, 256]
    - [47, 0.0]
  - - [19456, 3072, 1, 256]
    - [53, 0.0]
  - - [15872, 9216, 1, 256]
    - [53, 0.0]
  - - [30976, 1792, 1, 256]
    - [47, 0.0]
  - - [26368, 14081, 1, 256]
    - [47, 0.0]
  - - [35328, 23041, 1, 256]
    - [53, 0.0]
  - - [27648, 15105, 1, 256]
    - [47, 0.0]
  - - [25856, 13568, 1, 256]
    - [47, 0.0]
  - - [23296, 9216, 1, 256]
    - [53, 0.0]
  - - [2048, 1024, 1, 256]
    - [39, 0.0]
  - - [12032, 1792, 1, 256]
    - [47, 0.0]
  - - [11520, 1536, 1, 256]
    - [53, 0.0]
  - - [16128, 768, 1, 256]
    - [47, 0.0]
  - - [15360, 3072, 1, 256]
    - [53, 0.0]
  - - [38912, 26369, 1, 256]
    - [47, 0.0]
  - - [25344, 13056, 1, 256]
    - [47, 0.0]
  - - [39168, 26880, 1, 256]
    - [47, 0.0]
  - - [39424, 768, 1, 256]
    - [47, 0.0]
  - - [10496, 1792, 1, 256]
    - [47, 0.0]
  - - [28672, 3072, 1, 256]
    - [53, 0.0]
  - - [27392, 768, 1, 256]
    - [47, 0.0]
  - - [39680, 768, 1, 256]
    - [47, 0.0]
  - - [11520, 8193, 1, 256]
    - [53, 0.0]
  - - [17408, 4865, 1, 256]
    - [47, 0.0]
  - - [14080, 1537, 1, 256]
    - [53, 0.0]
  - - [29184, 768, 1, 256]
    - [53, 0.0]
  - - [19200, 6913, 1, 256]
    - [47, 0.0]
  - - [33536, 9216, 1, 256]
    - [53, 0.0]
  - - [5632, 3072, 1, 256]
    - [53, 0.0]
  - - [32768, 20480, 1, 256]
    - [53, 0.0]
  - - [29440, 9216, 1, 256]
    - [53, 0.0]
  - - [40960, 1792, 1, 256]
    - [47, 0.0]
  - - [10240, 3072, 1, 256]
    - [53, 0.0]
  - - [20992, 1792, 1, 256]
    - [47, 0.0]
  - - [42240, 9216, 1, 256]
    - [53, 0.0]
  - - [19200, 6912, 1, 256]
    - [47, 0.0]
  - - [27392, 1792, 1, 256]
    - [47, 0.0]
  - - [42496, 1536, 1, 256]
    - [53, 0.0]
  - - [29440, 16897, 1, 256]
    - [53, 0.0]
  - - [20480, 8192, 1, 256]
    - [53, 0.0]
  - - [11264, 8193, 1, 256]
    - [53, 0.0]
  - - [26880, 14337, 1, 256]
    - [53, 0.0]
  - - [28928, 16641, 1, 256]
    - [47, 0.0]
  - - [15360, 2817, 1, 256]
    - [47, 0.0]
  - - [44288, 1536, 1, 256]
    - [53, 0.0]
  - - [7936, 1536, 1, 256]
    - [53, 0.0]
  - - [18176, 5633, 1, 256]
    - [53, 0.0]
  - - [8448, 3072, 1, 256]
    - [53, 0.0]
  - - [17920, 5632, 1, 256]
    - [53, 0.0]
  - - [1792, 2048, 1, 256]
    - [64, 0.0]
  - - [39936, 3072, 1, 256]
    - [53, 0.0]
  - - [20480, 3072, 1, 256]
    - [53, 0.0]
  - - [24832, 1792, 1, 256]
    - [47, 0.0]
  - - [37376, 25088, 1, 256]
    - [53, 0.0]
  - - [7168, 4097, 1, 256]
    - [53, 0.0]
  - - [21504, 768, 1, 256]
    - [47, 0.0]
  - - [13312, 3072, 1, 256]
    - [53, 0.0]
  - - [40960, 1025, 1, 256]
    - [50, 0.0]
  - - [12032, 1536, 1, 256]
    - [53, 0.0]
  - - [9216, 768, 1, 256]
    - [53, 0.0]
  - - [44288, 27648, 1, 256]
    - [53, 0.0]
  - - [32512, 1792, 1, 256]
    - [47, 0.0]
  - - [23808, 11520, 1, 256]
    - [47, 0.0]
  - - [25600, 13057, 1, 256]
    - [47, 0.0]
  - - [40448, 1792, 1, 256]
    - [47, 0.0]
  - - [25088, 12800, 1, 256]
    - [53, 0.0]
  - - [22784, 10496, 1, 256]
    - [47, 0.0]
  - - [38400, 26113, 1, 256]
    - [53, 0.0]
  - - [9728, 3072, 1, 256]
    - [53, 0.0]
  - - [20736, 1792, 1, 256]
    - [47, 0.0]
  - - [7680, 3072, 1, 256]
    - [53, 0.0]
  - - [5376, 2305, 1, 256]
    - [47, 0.0]
  - - [12800, 3072, 1, 256]
    - [53, 0.0]
  - - [43520, 3584, 1, 256]
    - [53, 0.0]
  - - [12288, 3072, 1, 256]
    - [53, 0.0]
  - - [12800, 1536, 1, 256]
    - [53, 0.0]
  - - [21504, 8961, 1, 256]
    - [47, 0.0]
  - - [39680, 9216, 1, 256]
    - [53, 0.0]
  - - [3584, 513, 1, 256]
    - [39, 0.0]
  - - [1280, 3072, 1, 256]
    - [59, 0.0]
  - - [13056, 9216, 1, 256]
    - [53, 0.0]
  - - [22016, 768, 1, 256]
    - [53, 0.0]
  - - [33024, 1536, 1, 256]
    - [53, 0.0]
  - - [26880, 9216, 1, 256]
    - [53, 0.0]
  - - [44032, 27648, 1, 256]
    - [53, 0.0]
  - - [7680, 768, 1, 256]
    - [47, 0.0]
  - - [32000, 19712, 1, 256]
    - [47, 0.0]
  - - [26880, 14593, 1, 256]
    - [47, 0.0]
  - - [24064, 9216, 1, 256]
    - [53, 0.0]
  - - [39424, 26881, 1, 256]
    - [47, 0.0]
  - - [27392, 3072, 1, 256]
    - [53, 0.0]
  - - [10752, 1792, 1, 256]
    - [47, 0.0]
  - - [8960, 5633, 1, 256]
    - [53, 0.0]
  - - [34560, 3072, 1, 256]
    - [53, 0.0]
  - - [23808, 9216, 1, 256]
    - [53, 0.0]
  - - [29696, 17153, 1, 256]
    - [47, 0.0]
  - - [11776, 1536, 1, 256]
    - [53, 0.0]
  - - [13568, 1536, 1, 256]
    - [53, 0.0]
  - - [30208, 9216, 1, 256]
    - [53, 0.0]
  - - [36608, 1536, 1, 256]
    - [53, 0.0]
  - - [12800, 513, 1, 256]
    - [50, 0.0]
  - - [7680, 1792, 1, 256]
    - [47, 0.0]
  - - [42496, 2305, 1, 256]
    - [47, 0.0]
  - - [37376, 1536, 1, 256]
    - [53, 0.0]
  - - [20224, 1792, 1, 256]
    - [47, 0.0]
  - - [43520, 1536, 1, 256]
    - [53, 0.0]
  - - [26368, 768, 1, 256]
    - [53, 0.0]
  - - [18176, 3072, 1, 256]
    - [53, 0.0]
  - - [24320, 12033, 1, 256]
    - [47, 0.0]
  - - [17408, 9216, 1, 256]
    - [53, 0.0]
  - - [36352, 1792, 1, 256]
    - [47, 0.0]
  - - [20992, 8705, 1, 256]
    - [53, 0.0]
  - - [19712, 7424, 1, 256]
    - [47, 0.0]
  - - [38144, 768, 1, 256]
    - [47, 0.0]
  - - [10752, 1536, 1, 256]
    - [53, 0.0]
  - - [4096, 3072, 1, 256]
    - [53, 0.0]
  - - [29696, 17409, 1, 256]
    - [53, 0.0]
  - - [10240, 6913, 1, 256]
    - [47, 0.0]
  - - [18944, 1536, 1, 256]
    - [53, 0.0]
  - - [38656, 26113, 1, 256]
    - [53, 0.0]
  - - [37376, 25089, 1, 256]
    - [53, 0.0]
  - - [38400, 1536, 1, 256]
    - [53, 0.0]
  - - [8448, 1792, 1, 256]
    - [47, 0.0]
  - - [13056, 769, 1, 256]
    - [53, 0.0]
  - - [24320, 11777, 1, 256]
    - [53, 0.0]
  - - [17664, 9216, 1, 256]
    - [53, 0.0]
  - - [8192, 4865, 1, 256]
    - [47, 0.0]
  - - [17920, 1792, 1, 256]
    - [47, 0.0]
  - - [32000, 19713, 1, 256]
    - [47, 0.0]
  - - [8960, 768, 1, 256]
    - [47, 0.0]
  - - [31232, 3072, 1, 256]
    - [53, 0.0]
  - - [12544, 257, 1, 256]
    - [49, 0.0]
  - - [43776, 3585, 1, 256]
    - [53, 0.0]
  - - [11008, 1792, 1, 256]
    - [47, 0.0]
  - - [29696, 17408, 1, 256]
    - [53, 0.0]
  - - [34560, 22272, 1, 256]
    - [47, 0.0]
  - - [256, 2048, 1, 256]
    - [56, 0.0]
  - - [32768, 20481, 1, 256]
    - [53, 0.0]
  - - [14336, 3072, 1, 256]
    - [53, 0.0]
  - - [19456, 7168, 1, 256]
    - [53, 0.0]
  - - [13312, 9216, 1, 256]
    - [53, 0.0]
  - - [22272, 768, 1, 256]
    - [47, 0.0]
  - - [24064, 1792, 1, 256]
    - [47, 0.0]
  - - [16896, 1792, 1, 256]
    - [47, 0.0]
  - - [27904, 15616, 1, 256]
    - [47, 0.0]
  - - [37888, 3072, 1, 256]
    - [53, 0.0]
  - - [13056, 513, 1, 256]
    - [49, 0.0]
  - - [36608, 24065, 1, 256]
    - [53, 0.0]
  - - [40704, 3072, 1, 256]
    - [53, 0.0]
  - - [28928, 16640, 1, 256]
    - [47, 0.0]
  - - [24576, 12288, 1, 256]
    - [53, 0.0]
  - - [17152, 3072, 1, 256]
    - [53, 0.0]
  - - [17152, 4864, 1, 256]
    - [47, 0.0]
  - - [42496, 9216, 1, 256]
    - [53, 0.0]
  - - [32256, 768, 1, 256]
    - [47, 0.0]
  - - [4352, 1792, 1, 256]
    - [47, 0.0]
  - - [5632, 768, 1, 256]
    - [69, 0.0]
  - - [40704, 513, 1, 256]
    - [49, 0.0]
  - - [19712, 768, 1, 256]
    - [47, 0.0]
  - - [33536, 20993, 1, 256]
    - [53, 0.0]
  - - [2816, 3072, 1, 256]
    - [59, 0.0]
  - - [3584, 3072, 1, 256]
    - [53, 0.0]
  - - [4608, 1537, 1, 256]
    - [53, 0.0]
  - - [44032, 9216, 1, 256]
    - [53, 0.0]
  - - [33792, 21249, 1, 256]
    - [47, 0.0]
  - - [32512, 20225, 1, 256]
    - [47, 0.0]
  - - [38656, 9216, 1, 256]
    - [53, 0.0]
  - - [17664, 5377, 1, 256]
    - [47, 0.0]
  - - [19456, 7169, 1, 256]
    - [53, 0.0]
  - - [8448, 5121, 1, 256]
    - [53, 0.0]
  - - [29440, 17152, 1, 256]
    - [47, 0.0]
  - - [40448, 513, 1, 256]
    - [50, 0.0]
  - - [41472, 1792, 1, 256]
    - [47, 0.0]
  - - [17920, 3072, 1, 256]
    - [53, 0.0]
  - - [35072, 9216, 1, 256]
    - [53, 0.0]
  - - [34816, 22273, 1, 256]
    - [47, 0.0]
  - - [35072, 22785, 1, 256]
    - [47, 0.0]
  - - [39168, 9216, 1, 256]
    - [53, 0.0]
  - - [42752, 2817, 1, 256]
    - [47, 0.0]
  - - [11776, 3072, 1, 256]
    - [53, 0.0]
  - - [24832, 12289, 1, 256]
    - [53, 0.0]
  - - [24576, 12033, 1, 256]
    - [47, 0.0]
  - - [6400, 1536, 1, 256]
    - [53, 0.0]
  - - [32512, 3072, 1, 256]
    - [53, 0.0]
  - - [30976, 3072, 1, 256]
    - [53, 0.0]
  - - [22016, 9473, 1, 256]
    - [47, 0.0]
  - - [19968, 1792, 1, 256]
    - [47, 0.0]
  - - [29440, 3072, 1, 256]
    - [53, 0.0]
  - - [43776, 3840, 1, 256]
    - [47, 0.0]
  - - [41472, 768, 1, 256]
    - [47, 0.0]
  - - [8192, 1792, 1, 256]
    - [47, 0.0]
  - - [35840, 3072, 1, 256]
    - [53, 0.0]
  - - [8704, 3072, 1, 256]
    - [53, 0.0]
  - - [9728, 1792, 1, 256]
    - [47, 0.0]
  - - [22272, 9729, 1, 256]
    - [53, 0.0]
  - - [32768, 3072, 1, 256]
    - [53, 0.0]
  - - [3072, 2048, 1, 256]
    - [53, 0.0]
  - - [36864, 24576, 1, 256]
    - [53, 0.0]
  - - [9984, 1536, 1, 256]
    - [53, 0.0]
  - - [12032, 8961, 1, 256]
    - [47, 0.0]
  - - [38400, 25857, 1, 256]
    - [47, 0.0]
  - - [20224, 7937, 1, 256]
    - [47, 0.0]
  - - [34304, 21761, 1, 256]
    - [47, 0.0]
  - - [30720, 18432, 1, 256]
    - [53, 0.0]
  - - [31744, 9216, 1, 256]
    - [53, 0.0]
  - - [27136, 14848, 1, 256]
    - [53, 0.0]
  - - [34048, 9216, 1, 256]
    - [53, 0.0]
  - - [3584, 257, 1, 256]
    - [37, 0.0]
  - - [18688, 6145, 1, 256]
    - [53, 0.0]
  - - [36096, 768, 1, 256]
    - [47, 0.0]
  - - [36608, 9216, 1, 256]
    - [53, 0.0]
  - - [35584, 9216, 1, 256]
    - [53, 0.0]
  - - [29952, 17664, 1, 256]
    - [47, 0.0]
  - - [34816, 1792, 1, 256]
    - [47, 0.0]
  - - [24064, 11776, 1, 256]
    - [53, 0.0]
  - - [40448, 3072, 1, 256]
    - [53, 0.0]
  - - [18688, 6401, 1, 256]
    - [47, 0.0]
  - - [20480, 1536, 1, 256]
    - [53, 0.0]
  - - [18432, 3072, 1, 256]
    - [53, 0.0]
  - - [20224, 768, 1, 256]
    - [53, 0.0]
  - - [25344, 768, 1, 256]
    - [47, 0.0]
  - - [36608, 24320, 1, 256]
    - [47, 0.0]
  - - [34816, 9216, 1, 256]
    - [53, 0.0]
  - - [41216, 27648, 1, 256]
    - [53, 0.0]
  - - [30464, 9216, 1, 256]
    - [53, 0.0]
  - - [7424, 3072, 1, 256]
    - [53, 0.0]
  - - [20480, 1792, 1, 256]
    - [47, 0.0]
  - - [41984, 1793, 1, 256]
    - [47, 0.0]
  - - [18688, 1792, 1, 256]
    - [47, 0.0]
  - - [13824, 1792, 1, 256]
    - [47, 0.0]
  - - [38144, 3072, 1, 256]
    - [53, 0.0]
  - - [33280, 3072, 1, 256]
    - [53, 0.0]
  - - [35584, 23296, 1, 256]
    - [47, 0.0]
  - - [43520, 768, 1, 256]
    - [47, 0.0]
  - - [40704, 1536, 1, 256]
    - [53, 0.0]
  - - [29696, 3072, 1, 256]
    - [53, 0.0]
  - - [32256, 19969, 1, 256]
    - [53, 0.0]
  - - [40960, 9216, 1, 256]
    - [53, 0.0]
  - - [37632, 9216, 1, 256]
    - [53, 0.0]
  - - [42240, 2305, 1, 256]
    - [47, 0.0]
  - - [17920, 5377, 1, 256]
    - [47, 0.0]
  - - [27904, 9216, 1, 256]
    - [53, 0.0]
  - - [34304, 22016, 1, 256]
    - [53, 0.0]
  - - [11776, 8705, 1, 256]
    - [53, 0.0]
  - - [22272, 1536, 1, 256]
    - [53, 0.0]
  - - [25856, 9216, 1, 256]
    - [53, 0.0]
  - - [19712, 3072, 1, 256]
    - [53, 0.0]
  - - [41472, 9216, 1, 256]
    - [53, 0.0]
  - - [42496, 27648, 1, 256]
    - [53, 0.0]
  - - [44288, 4352, 1, 256]
    - [47, 0.0]
  - - [42496, 2561, 1, 256]
    - [53, 0.0]
  - - [9984, 6657, 1, 256]
    - [53, 0.0]
  - - [43008, 3073, 1, 256]
    - [53, 0.0]
  - - [36352, 24065, 1, 256]
    - [53, 0.0]
  - - [24832, 3072, 1, 256]
    - [53, 0.0]
  - - [29184, 16641, 1, 256]
    - [47, 0.0]
  - - [1024, 2048, 1, 256]
    - [57, 0.0]
  - - [42240, 27648, 1, 256]
    - [53, 0.0]
  - - [9984, 1792, 1, 256]
    - [47, 0.0]
  - - [44288, 3072, 1, 256]
    - [53, 0.0]
  - - [11008, 768, 1, 256]
    - [47, 0.0]
  - - [28672, 16129, 1, 256]
    - [47, 0.0]
  - - [17920, 9216, 1, 256]
    - [53, 0.0]
  - - [25088, 12801, 1, 256]
    - [53, 0.0]
  - - [19712, 9216, 1, 256]
    - [53, 0.0]
  - - [31744, 19457, 1, 256]
    - [53, 0.0]
  - - [36864, 1792, 1, 256]
    - [47, 0.0]
  - - [42496, 1792, 1, 256]
    - [47, 0.0]
  - - [39936, 9216, 1, 256]
    - [53, 0.0]
  - - [8960, 1792, 1, 256]
    - [47, 0.0]
  - - [17664, 5121, 1, 256]
    - [53, 0.0]
  - - [38144, 25601, 1, 256]
    - [53, 0.0]
  - - [27136, 14849, 1, 256]
    - [53, 0.0]
  - - [31744, 19456, 1, 256]
    - [53, 0.0]
  - - [33024, 3072, 1, 256]
    - [53, 0.0]
  - - [37888, 9216, 1, 256]
    - [53, 0.0]
  - - [6912, 1792, 1, 256]
    - [47, 0.0]
  - - [42240, 2049, 1, 256]
    - [53, 0.0]
  - - [34048, 3072, 1, 256]
    - [53, 0.0]
  - - [37120, 9216, 1, 256]
    - [53, 0.0]
  - - [14080, 9216, 1, 256]
    - [53, 0.0]
  - - [38400, 1792, 1, 256]
    - [47, 0.0]
  - - [43776, 9216, 1, 256]
    - [53, 0.0]
  - - [14336, 2049, 1, 256]
    - [53, 0.0]
  - - [37120, 24577, 1, 256]
    - [53, 0.0]
  - - [30976, 18433, 1, 256]
    - [53, 0.0]
  - - [37632, 3072, 1, 256]
    - [53, 0.0]
  - - [34560, 1792, 1, 256]
    - [47, 0.0]
  - - [5120, 3072, 1, 256]
    - [53, 0.0]
  - - [21760, 9217, 1, 256]
    - [53, 0.0]
  - - [24064, 11521, 1, 256]
    - [47, 0.0]
  - - [7936, 3072, 1, 256]
    - [53, 0.0]
  - - [21760, 9472, 1, 256]
    - [47, 0.0]
  - - [9216, 6145, 1, 256]
    - [53, 0.0]
  - - [8192, 1536, 1, 256]
    - [53, 0.0]
  - - [39936, 27648, 1, 256]
    - [53, 0.0]
  - - [21248, 9216, 1, 256]
    - [53, 0.0]
  - - [5376, 2049, 1, 256]
    - [53, 0.0]
  - - [35072, 22529, 1, 256]
    - [53, 0.0]
  - - [13312, 769, 1, 256]
    - [50, 0.0]
  - - [35840, 9216, 1, 256]
    - [53, 0.0]
  - - [39424, 27136, 1, 256]
    - [53, 0.0]
  - - [26368, 9216, 1, 256]
    - [53, 0.0]
  - - [34048, 21505, 1, 256]
    - [53, 0.0]
  - - [26112, 1792, 1, 256]
    - [47, 0.0]
  - - [23296, 768, 1, 256]
    - [47, 0.0]
  - - [43264, 27648, 1, 256]
    - [53, 0.0]
  - - [18432, 9216, 1, 256]
    - [53, 0.0]
  - - [38912, 3072, 1, 256]
    - [53, 0.0]
  - - [30464, 17921, 1, 256]
    - [53, 0.0]
  - - [37376, 9216, 1, 256]
    - [53, 0.0]
  - - [256, 3072, 1, 256]
    - [57, 0.0]
  - - [9472, 3072, 1, 256]
    - [53, 0.0]
  - - [35840, 23552, 1, 256]
    - [53, 0.0]
  - - [8960, 3072, 1, 256]
    - [53, 0.0]
  - - [34816, 3072, 1, 256]
    - [53, 0.0]
  - - [11008, 3072, 1, 256]
    - [53, 0.0]
  - - [36864, 1536, 1, 256]
    - [53, 0.0]
  - - [23552, 9216, 1, 256]
    - [53, 0.0]
  - - [31232, 18945, 1, 256]
    - [53, 0.0]
  - - [27136, 9216, 1, 256]
    - [53, 0.0]
  - - [19968, 7681, 1, 256]
    - [53, 0.0]
  - - [31488, 18945, 1, 256]
    - [53, 0.0]
  - - [33280, 1792, 1, 256]
    - [47, 0.0]
  - - [14592, 3072, 1, 256]
    - [53, 0.0]
  - - [30976, 18689, 1, 256]
    - [47, 0.0]
  - - [4096, 769, 1, 256]
    - [47, 0.0]
  - - [31488, 3072, 1, 256]
    - [53, 0.0]
  - - [33024, 1792, 1, 256]
    - [47, 0.0]
  - - [11520, 8449, 1, 256]
    - [47, 0.0]
  - - [44544, 4353, 1, 256]
    - [47, 0.0]
  - - [18176, 5889, 1, 256]
    - [47, 0.0]
  - - [5632, 2305, 1, 256]
    - [47, 0.0]
  - - [39936, 27393, 1, 256]
    - [47, 0.0]
  - - [10240, 7169, 1, 256]
    - [53, 0.0]
  - - [39168, 26625, 1, 256]
    - [53, 0.0]
  - - [10752, 7681, 1, 256]
    - [53, 0.0]
  - - [13824, 1536, 1, 256]
    - [53, 0.0]
  - - [14336, 9216, 1, 256]
    - [53, 0.0]
  - - [37632, 25345, 1, 256]
    - [47, 0.0]
  - - [35840, 23553, 1, 256]
    - [53, 0.0]
  - - [23552, 3072, 1, 256]
    - [53, 0.0]
  - - [19712, 7169, 1, 256]
    - [53, 0.0]
  - - [5888, 2561, 1, 256]
    - [53, 0.0]
  - - [27136, 768, 1, 256]
    - [47, 0.0]
  - - [22272, 1792, 1, 256]
    - [47, 0.0]
  - - [15616, 1536, 1, 256]
    - [53, 0.0]
  - - [3840, 769, 1, 256]
    - [35, 0.0]
  - - [42240, 2304, 1, 256]
    - [47, 0.0]
  - - [24576, 3072, 1, 256]
    - [53, 0.0]
  - - [27136, 1536, 1, 256]
    - [53, 0.0]
  - - [25344, 12801, 1, 256]
    - [53, 0.0]
  - - [32512, 20224, 1, 256]
    - [47, 0.0]
  - - [17664, 3072, 1, 256]
    - [53, 0.0]
  - - [28160, 15873, 1, 256]
    - [53, 0.0]
  - - [40960, 3072, 1, 256]
    - [53, 0.0]
  - - [14592, 9216, 1, 256]
    - [53, 0.0]
  - - [22784, 10497, 1, 256]
    - [47, 0.0]
  - - [22272, 3072, 1, 256]
    - [53, 0.0]
  - - [39680, 27137, 1, 256]
    - [53, 0.0]
  - - [20992, 8704, 1, 256]
    - [53, 0.0]
  - - [24320, 1536, 1, 256]
    - [53, 0.0]
  - - [7936, 4865, 1, 256]
    - [47, 0.0]
  - - [17664, 5376, 1, 256]
    - [47, 0.0]
  - - [37888, 25345, 1, 256]
    - [47, 0.0]
  - - [23296, 10753, 1, 256]
    - [53, 0.0]
  - - [28416, 15873, 1, 256]
    - [53, 0.0]
  - - [27648, 15361, 1, 256]
    - [53, 0.0]
  - - [39424, 1536, 1, 256]
    - [53, 0.0]
  - - [15104, 2817, 1, 256]
    - [47, 0.0]
  - - [19456, 9216, 1, 256]
    - [53, 0.0]
  - - [24064, 11777, 1, 256]
    - [53, 0.0]
  - - [40448, 1536, 1, 256]
    - [53, 0.0]
  - - [512, 3072, 1, 256]
    - [59, 0.0]
  - - [38912, 9216, 1, 256]
    - [53, 0.0]
  - - [19456, 6913, 1, 256]
    - [47, 0.0]
  - - [29440, 1792, 1, 256]
    - [47, 0.0]
  - - [41984, 9216, 1, 256]
    - [53, 0.0]
  - - [14080, 1793, 1, 256]
    - [47, 0.0]
  - - [20992, 8449, 1, 256]
    - [47, 0.0]
  - - [17920, 768, 1, 256]
    - [47, 0.0]
  - - [10496, 7169, 1, 256]
    - [53, 0.0]
  - - [40704, 27648, 1, 256]
    - [53, 0.0]
  - - [13568, 1025, 1, 256]
    - [50, 0.0]
  - - [38144, 9216, 1, 256]
    - [53, 0.0]
  - - [27392, 15104, 1, 256]
    - [47, 0.0]
  - - [2304, 3072, 1, 256]
    - [47, 0.0]
  - - [9472, 6401, 1, 256]
    - [47, 0.0]
  - - [39424, 1792, 1, 256]
    - [47, 0.0]
  - - [41728, 768, 1, 256]
    - [47, 0.0]
  - - [11264, 3072, 1, 256]
    - [53, 0.0]
  - - [25344, 3072, 1, 256]
    - [53, 0.0]
  - - [24576, 1792, 1, 256]
    - [47, 0.0]
  - - [27392, 14849, 1, 256]
    - [53, 0.0]
  - - [14848, 2561, 1, 256]
    - [53, 0.0]
  - - [28160, 3072, 1, 256]
    - [53, 0.0]
  - - [23552, 11009, 1, 256]
    - [47, 0.0]
  - - [11776, 8449, 1, 256]
    - [47, 0.0]
  - - [16640, 1792, 1, 256]
    - [47, 0.0]
  - - [24576, 12289, 1, 256]
    - [53, 0.0]
  - - [38656, 26369, 1, 256]
    - [47, 0.0]
  - - [13824, 9216, 1, 256]
    - [53, 0.0]
  - - [28928, 1792, 1, 256]
    - [47, 0.0]
  - - [27904, 15361, 1, 256]
    - [53, 0.0]
  - - [3840, 1792, 1, 256]
    - [53, 0.0]
  - - [14848, 3072, 1, 256]
    - [53, 0.0]
  - - [27904, 1536, 1, 256]
    - [53, 0.0]
  - - [34816, 1536, 1, 256]
    - [53, 0.0]
  - - [14592, 2305, 1, 256]
    - [47, 0.0]
  - - [22528, 9985, 1, 256]
    - [47, 0.0]
  - - [26368, 13825, 1, 256]
    - [53, 0.0]
  - - [4096, 1792, 1, 256]
    - [47, 0.0]
  - - [30720, 18177, 1, 256]
    - [47, 0.0]
  - - [37120, 24833, 1, 256]
    - [47, 0.0]
  - - [24320, 3072, 1, 256]
    - [53, 0.0]
  - - [2560, 1536, 1, 256]
    - [57, 0.0]
  - - [44032, 4097, 1, 256]
    - [53, 0.0]
  - - [44544, 27648, 1, 256]
    - [53, 0.0]
  - - [34048, 21761, 1, 256]
    - [47, 0.0]
  - - [24064, 1536, 1, 256]
    - [53, 0.0]
  - - [24832, 12545, 1, 256]
    - [47, 0.0]
  - - [44032, 3841, 1, 256]
    - [47, 0.0]
  - - [40448, 257, 1, 256]
    - [49, 0.0]
  - - [26624, 14337, 1, 256]
    - [53, 0.0]
  - - [8192, 5121, 1, 256]
    - [53, 0.0]
  - - [42240, 1536, 1, 256]
    - [53, 0.0]
  - - [5888, 2817, 1, 256]
    - [47, 0.0]
  - - [6144, 1792, 1, 256]
    - [47, 0.0]
  - - [16384, 1792, 1, 256]
    - [47, 0.0]
  - - [35584, 23297, 1, 256]
    - [47, 0.0]
  - - [36352, 24064, 1, 256]
    - [53, 0.0]
  - - [23040, 1536, 1, 256]
    - [53, 0.0]
  - - [8704, 1536, 1, 256]
    - [53, 0.0]
  - - [18432, 6145, 1, 256]
    - [53, 0.0]
  - - [12032, 3072, 1, 256]
    - [53, 0.0]
  - - [39168, 3072, 1, 256]
    - [53, 0.0]
  - - [28160, 1536, 1, 256]
    - [53, 0.0]
  - - [41728, 27648, 1, 256]
    - [53, 0.0]
  - - [28416, 1792, 1, 256]
    - [47, 0.0]
  - - [24320, 12032, 1, 256]
    - [47, 0.0]
  - - [28928, 16385, 1, 256]
    - [53, 0.0]
  - - [34816, 22528, 1, 256]
    - [53, 0.0]
  - - [26368, 1792, 1, 256]
    - [47, 0.0]
  - - [25856, 13569, 1, 256]
    - [47, 0.0]
  - - [25600, 13312, 1, 256]
    - [53, 0.0]
  - - [31232, 18689, 1, 256]
    - [47, 0.0]
  - - [20736, 9216, 1, 256]
    - [53, 0.0]
  - - [34304, 9216, 1, 256]
    - [53, 0.0]
  - - [43264, 3073, 1, 256]
    - [53, 0.0]
  - - [8704, 5633, 1, 256]
    - [53, 0.0]
  - - [4864, 1793, 1, 256]
    - [49, 0.0]
  - - [41984, 3072, 1, 256]
    - [53, 0.0]
  - - [20992, 3072, 1, 256]
    - [53, 0.0]
  - - [9728, 6401, 1, 256]
    - [47, 0.0]
  - - [16640, 4097, 1, 256]
    - [53, 0.0]
  - - [38400, 9216, 1, 256]
    - [53, 0.0]
  - - [38656, 1536, 1, 256]
    - [53, 0.0]
  - - [1536, 3072, 1, 256]
    - [53, 0.0]
  - - [12544, 1792, 1, 256]
    - [47, 0.0]
  - - [37632, 1792, 1, 256]
    - [47, 0.0]
  - - [17152, 4609, 1, 256]
    - [53, 0.0]
  - - [18944, 6656, 1, 256]
    - [53, 0.0]
  - - [34560, 22017, 1, 256]
    - [53, 0.0]
  - - [23296, 11008, 1, 256]
    - [47, 0.0]
  - - [14848, 768, 1, 256]
    - [47, 0.0]
  - - [38656, 1792, 1, 256]
    - [47, 0.0]
  - - [8448, 5377, 1, 256]
    - [47, 0.0]
  - - [29952, 17665, 1, 256]
    - [47, 0.0]
  - - [33792, 21504, 1, 256]
    - [53, 0.0]
  - - [24576, 1536, 1, 256]
    - [53, 0.0]
  - - [37376, 1792, 1, 256]
    - [47, 0.0]
  - - [42752, 768, 1, 256]
    - [47, 0.0]
  - - [4096, 1025, 1, 256]
    - [69, 0.0]
  - - [35840, 768, 1, 256]
    - [53, 0.0]
  - - [19200, 3072, 1, 256]
    - [53, 0.0]
  - - [33536, 1792, 1, 256]
    - [47, 0.0]
  - - [36864, 9216, 1, 256]
    - [53, 0.0]
  - - [38656, 26368, 1, 256]
    - [47, 0.0]
  - - [44288, 9216, 1, 256]
    - [53, 0.0]
  - - [44288, 4097, 1, 256]
    - [53, 0.0]
  - - [26112, 3072, 1, 256]
    - [53, 0.0]
  - - [512, 768, 1, 256]
    - [55, 0.0]
  - - [36096, 3072, 1, 256]
    - [53, 0.0]
  - - [4864, 1537, 1, 256]
    - [53, 0.0]
  - - [31232, 18944, 1, 256]
    - [53, 0.0]
  - - [20224, 7681, 1, 256]
    - [53, 0.0]
  - - [26112, 9216, 1, 256]
    - [53, 0.0]
  - - [21504, 3072, 1, 256]
    - [53, 0.0]
  - - [12544, 3072, 1, 256]
    - [53, 0.0]
  - - [32256, 19713, 1, 256]
    - [47, 0.0]
  - - [40704, 1792, 1, 256]
    - [47, 0.0]
  - - [18176, 5888, 1, 256]
    - [47, 0.0]
  - - [33792, 9216, 1, 256]
    - [53, 0.0]
  - - [26624, 14336, 1, 256]
    - [53, 0.0]
  - - [38912, 1792, 1, 256]
    - [47, 0.0]
  - - [7936, 1792, 1, 256]
    - [53, 0.0]
  - - [28672, 16385, 1, 256]
    - [53, 0.0]
  - - [18944, 3072, 1, 256]
    - [53, 0.0]
  - - [33280, 20993, 1, 256]
    - [53, 0.0]
  - - [37120, 24832, 1, 256]
    - [47, 0.0]
  - - [43520, 1792, 1, 256]
    - [47, 0.0]
  - - [16896, 4609, 1, 256]
    - [53, 0.0]
  - - [41472, 1536, 1, 256]
    - [53, 0.0]
  - - [39936, 768, 1, 256]
    - [47, 0.0]
  - - [23296, 11009, 1, 256]
    - [47, 0.0]
  - - [26624, 9216, 1, 256]
    - [53, 0.0]
  - - [29184, 9216, 1, 256]
    - [53, 0.0]
  - - [36352, 9216, 1, 256]
    - [53, 0.0]
  - - [37632, 25344, 1, 256]
    - [47, 0.0]
  - - [37888, 25600, 1, 256]
    - [53, 0.0]
  - - [16640, 9216, 1, 256]
    - [53, 0.0]
  - - [44544, 9216, 1, 256]
    - [53, 0.0]
  - - [14080, 1792, 1, 256]
    - [47, 0.0]
  - - [33536, 21249, 1, 256]
    - [47, 0.0]
  - - [34048, 21760, 1, 256]
    - [47, 0.0]
  - - [9984, 768, 1, 256]
    - [47, 0.0]
  - - [40192, 1536, 1, 256]
    - [53, 0.0]
  - - [41728, 3072, 1, 256]
    - [53, 0.0]
  - - [35328, 9216, 1, 256]
    - [53, 0.0]
  - - [32512, 768, 1, 256]
    - [47, 0.0]
  - - [14592, 2049, 1, 256]
    - [53, 0.0]
  - - [14848, 9216, 1, 256]
    - [53, 0.0]
  - - [23808, 3072, 1, 256]
    - [53, 0.0]
  - - [13568, 9216, 1, 256]
    - [53, 0.0]
  - - [42496, 2560, 1, 256]
    - [53, 0.0]
  - - [42752, 3072, 1, 256]
    - [53, 0.0]
  - - [39680, 27392, 1, 256]
    - [47, 0.0]
  - - [14592, 1792, 1, 256]
    - [47, 0.0]
  - - [25600, 13313, 1, 256]
    - [53, 0.0]
  - - [26624, 1792, 1, 256]
    - [47, 0.0]
  - - [20480, 8193, 1, 256]
    - [53, 0.0]
  - - [36096, 23808, 1, 256]
    - [47, 0.0]
  - - [15104, 2561, 1, 256]
    - [53, 0.0]
  - - [43520, 3072, 1, 256]
    - [53, 0.0]
  - - [1280, 2048, 1, 256]
    - [57, 0.0]
  - - [43008, 1792, 1, 256]
    - [47, 0.0]
  - - [18688, 3072, 1, 256]
    - [53, 0.0]
  - - [35328, 23040, 1, 256]
    - [53, 0.0]
  - - [18944, 6401, 1, 256]
    - [47, 0.0]
  - - [16128, 3585, 1, 256]
    - [53, 0.0]
  - - [29952, 1536, 1, 256]
    - [53, 0.0]
  - - [17408, 5121, 1, 256]
    - [53, 0.0]
  - - [36608, 1792, 1, 256]
    - [47, 0.0]
  - - [13056, 768, 1, 256]
    - [53, 0.0]
  - - [26112, 13824, 1, 256]
    - [53, 0.0]
  - - [43520, 3585, 1, 256]
    - [53, 0.0]
  - - [40704, 9216, 1, 256]
    - [53, 0.0]
  - - [27904, 15617, 1, 256]
    - [47, 0.0]
  - - [21248, 3072, 1, 256]
    - [53, 0.0]
  - - [38912, 1536, 1, 256]
    - [53, 0.0]
  - - [28672, 1792, 1, 256]
    - [47, 0.0]
  - - [18432, 1792, 1, 256]
    - [47, 0.0]
  - - [29952, 9216, 1, 256]
    - [53, 0.0]
  - - [4352, 1025, 1, 256]
    - [49, 0.0]
  - - [34304, 22017, 1, 256]
    - [53, 0.0]
  - - [28160, 15617, 1, 256]
    - [47, 0.0]
  - - [19968, 9216, 1, 256]
    - [53, 0.0]
  - - [7424, 4353, 1, 256]
    - [47, 0.0]
  - - [19200, 1792, 1, 256]
    - [47, 0.0]
  - - [27648, 15360, 1, 256]
    - [53, 0.0]
  - - [23040, 10497, 1, 256]
    - [47, 0.0]
  - - [21248, 8961, 1, 256]
    - [47, 0.0]
  - - [32256, 1792, 1, 256]
    - [47, 0.0]
  - - [26112, 13569, 1, 256]
    - [47, 0.0]
  - - [12288, 8961, 1, 256]
    - [47, 0.0]
  - - [6656, 3585, 1, 256]
    - [53, 0.0]
  - - [19968, 7425, 1, 256]
    - [47, 0.0]
  - - [9472, 768, 1, 256]
    - [47, 0.0]
  - - [33792, 3072, 1, 256]
    - [53, 0.0]
  - - [15616, 3072, 1, 256]
    - [53, 0.0]
  - - [8704, 5377, 1, 256]
    - [47, 0.0]
  - - [11520, 3072, 1, 256]
    - [53, 0.0]
  - - [25856, 1536, 1, 256]
    - [53, 0.0]
  - - [28416, 768, 1, 256]
    - [47, 0.0]
  - - [32256, 3072, 1, 256]
    - [53, 0.0]
  - - [20736, 1536, 1, 256]
    - [53, 0.0]
  - - [22784, 10241, 1, 256]
    - [53, 0.0]
  - - [36608, 24321, 1, 256]
    - [47, 0.0]
  - - [36096, 9216, 1, 256]
    - [53, 0.0]
  - - [10752, 768, 1, 256]
    - [47, 0.0]
  - - [38400, 26112, 1, 256]
    - [53, 0.0]
  - - [9216, 5889, 1, 256]
    - [47, 0.0]
  - - [41472, 27648, 1, 256]
    - [53, 0.0]
  - - [38144, 25856, 1, 256]
    - [47, 0.0]
  - - [15360, 3073, 1, 256]
    - [53, 0.0]
  - - [29184, 16896, 1, 256]
    - [53, 0.0]
  - - [16128, 1792, 1, 256]
    - [47, 0.0]
  - - [32768, 20225, 1, 256]
    - [47, 0.0]
  - - [23040, 10752, 1, 256]
    - [53, 0.0]
  - - [15872, 3585, 1, 256]
    - [53, 0.0]
  - - [11008, 7681, 1, 256]
    - [53, 0.0]
  - - [15360, 9216, 1, 256]
    - [53, 0.0]
  - - [28416, 16128, 1, 256]
    - [47, 0.0]
  - - [30208, 1792, 1, 256]
    - [47, 0.0]
  - - [41728, 1792, 1, 256]
    - [47, 0.0]
  - - [32256, 19968, 1, 256]
    - [53, 0.0]
  - - [18944, 1792, 1, 256]
    - [47, 0.0]
  - - [41728, 1793, 1, 256]
    - [47, 0.0]
  - - [31488, 19201, 1, 256]
    - [47, 0.0]
  - - [40192, 257, 1, 256]
    - [50, 0.0]
  - - [42752, 27648, 1, 256]
    - [53, 0.0]
  - - [40704, 768, 1, 256]
    - [47, 0.0]
  - - [25088, 12545, 1, 256]
    - [47, 0.0]
  - - [24576, 9216, 1, 256]
    - [53, 0.0]
  - - [33024, 20737, 1, 256]
    - [47, 0.0]
  - - [29696, 9216, 1, 256]
    - [53, 0.0]
  - - [31232, 1536, 1, 256]
    - [53, 0.0]
  - - [30208, 17920, 1, 256]
    - [53, 0.0]
  - - [44544, 4609, 1, 256]
    - [53, 0.0]
  - - [22016, 9728, 1, 256]
    - [53, 0.0]
  - - [30208, 17921, 1, 256]
    - [53, 0.0]
  - - [19200, 6657, 1, 256]
    - [53, 0.0]
  - - [22016, 9729, 1, 256]
    - [53, 0.0]
  - - [18176, 768, 1, 256]
    - [47, 0.0]
  - - [29184, 1792, 1, 256]
    - [47, 0.0]
  - - [12288, 1792, 1, 256]
    - [47, 0.0]
  - - [22528, 1536, 1, 256]
    - [53, 0.0]
  - - [14848, 2305, 1, 256]
    - [47, 0.0]
  - - [41216, 1025, 1, 256]
    - [50, 0.0]
  - - [8192, 3072, 1, 256]
    - [53, 0.0]
  - - [5888, 1792, 1, 256]
    - [47, 0.0]
  - - [21760, 3072, 1, 256]
    - [53, 0.0]
  - - [22272, 9985, 1, 256]
    - [47, 0.0]
  - - [29184, 1536, 1, 256]
    - [53, 0.0]
  - - [22016, 3072, 1, 256]
    - [53, 0.0]
  - - [30720, 9216, 1, 256]
    - [53, 0.0]
  - - [39680, 1792, 1, 256]
    - [47, 0.0]
  - - [9728, 1536, 1, 256]
    - [53, 0.0]
  - - [34560, 9216, 1, 256]
    - [53, 0.0]
  - - [12032, 8705, 1, 256]
    - [53, 0.0]
  - - [10752, 7425, 1, 256]
    - [47, 0.0]
  - - [18688, 1536, 1, 256]
    - [53, 0.0]
  - - [16128, 3840, 1, 256]
    - [47, 0.0]
  - - [38656, 768, 1, 256]
    - [47, 0.0]
  - - [21248, 1792, 1, 256]
    - [47, 0.0]
  - - [36352, 3072, 1, 256]
    - [53, 0.0]
  - - [19968, 7680, 1, 256]
    - [53, 0.0]
  - - [3840, 513, 1, 256]
    - [49, 0.0]
  - - [38400, 3072, 1, 256]
    - [53, 0.0]
  - - [5376, 768, 1, 256]
    - [47, 0.0]
  - - [20224, 9216, 1, 256]
    - [53, 0.0]
  - - [17408, 5120, 1, 256]
    - [53, 0.0]
  - - [28928, 9216, 1, 256]
    - [53, 0.0]
  - - [35072, 1792, 1, 256]
    - [47, 0.0]
  - - [31488, 19200, 1, 256]
    - [47, 0.0]
  - - [11008, 7937, 1, 256]
    - [47, 0.0]
  - - [21248, 8705, 1, 256]
    - [53, 0.0]
  - - [13568, 3072, 1, 256]
    - [53, 0.0]
  - - [34560, 22273, 1, 256]
    - [47, 0.0]
  - - [34048, 768, 1, 256]
    - [47, 0.0]
  - - [40448, 27648, 1, 256]
    - [53, 0.0]
  - - [28416, 16129, 1, 256]
    - [47, 0.0]
  - - [34816, 22529, 1, 256]
    - [53, 0.0]
  - - [22528, 3072, 1, 256]
    - [53, 0.0]
  - - [27136, 14593, 1, 256]
    - [47, 0.0]
  - - [35584, 3072, 1, 256]
    - [53, 0.0]
  - - [43008, 3072, 1, 256]
    - [53, 0.0]
  - - [30464, 1792, 1, 256]
    - [47, 0.0]
  - - [16384, 4097, 1, 256]
    - [53, 0.0]
  - - [20992, 9216, 1, 256]
    - [53, 0.0]
  - - [31488, 1792, 1, 256]
    - [47, 0.0]
  - - [31488, 9216, 1, 256]
    - [53, 0.0]
  - - [22272, 9984, 1, 256]
    - [47, 0.0]
  - - [41728, 1537, 1, 256]
    - [53, 0.0]
  - - [26880, 1792, 1, 256]
    - [47, 0.0]
  - - [30464, 768, 1, 256]
    - [47, 0.0]
  - - [2816, 1792, 1, 256]
    - [47, 0.0]
  - - [41472, 1537, 1, 256]
    - [53, 0.0]
  - - [43008, 27648, 1, 256]
    - [53, 0.0]
  - - [39424, 27137, 1, 256]
    - [53, 0.0]
  - - [24320, 1792, 1, 256]
    - [47, 0.0]
  - - [32000, 3072, 1, 256]
    - [53, 0.0]
  - - [12800, 1792, 1, 256]
    - [47, 0.0]
  - - [15872, 3072, 1, 256]
    - [53, 0.0]
  - - [15872, 1792, 1, 256]
    - [47, 0.0]
  - - [10496, 7425, 1, 256]
    - [47, 0.0]
  - - [16896, 4608, 1, 256]
    - [53, 0.0]
  - - [9984, 6913, 1, 256]
    - [47, 0.0]
  - - [21248, 8960, 1, 256]
    - [47, 0.0]
  - - [14336, 1792, 1, 256]
    - [53, 0.0]
  - - [24832, 12544, 1, 256]
    - [47, 0.0]
  - - [30464, 18176, 1, 256]
    - [47, 0.0]
  - - [31744, 19201, 1, 256]
    - [47, 0.0]
  - - [1792, 768, 1, 256]
    - [67, 0.0]
  - - [1536, 2048, 1, 256]
    - [47, 0.0]
  - - [40192, 3072, 1, 256]
    - [53, 0.0]
  - - [42240, 3072, 1, 256]
    - [53, 0.0]
  - - [32256, 9216, 1, 256]
    - [53, 0.0]
  - - [41984, 2049, 1, 256]
    - [53, 0.0]
  - - [6656, 1792, 1, 256]
    - [47, 0.0]
  - - [13824, 1537, 1, 256]
    - [53, 0.0]
  - - [20736, 3072, 1, 256]
    - [53, 0.0]
  - - [36096, 23809, 1, 256]
    - [47, 0.0]
  - - [41728, 9216, 1, 256]
    - [53, 0.0]
  - - [25600, 768, 1, 256]
    - [47, 0.0]
  - - [37632, 768, 1, 256]
    - [47, 0.0]
  - - [25600, 9216, 1, 256]
    - [53, 0.0]
  - - [19968, 3072, 1, 256]
    - [53, 0.0]
  - - [15616, 9216, 1, 256]
    - [53, 0.0]
  - - [29184, 16897, 1, 256]
    - [53, 0.0]
  - - [7168, 3841, 1, 256]
    - [47, 0.0]
  - - [40704, 769, 1, 256]
    - [47, 0.0]
  - - [6144, 3073, 1, 256]
    - [53, 0.0]
  - - [34304, 1792, 1, 256]
    - [47, 0.0]
  - - [18688, 6400, 1, 256]
    - [47, 0.0]
  - - [20992, 1536, 1, 256]
    - [53, 0.0]
  - - [21760, 768, 1, 256]
    - [47, 0.0]
  - - [43264, 3072, 1, 256]
    - [53, 0.0]
  - - [21760, 9216, 1, 256]
    - [53, 0.0]
  - - [11264, 768, 1, 256]
    - [67, 0.0]
  - - [42496, 3072, 1, 256]
    - [53, 0.0]
  - - [30208, 17665, 1, 256]
    - [47, 0.0]
  - - [27392, 15105, 1, 256]
    - [47, 0.0]
  - - [29952, 17409, 1, 256]
    - [53, 0.0]
  - - [44032, 3072, 1, 256]
    - [53, 0.0]
  - - [41216, 9216, 1, 256]
    - [53, 0.0]
  - - [8448, 1536, 1, 256]
    - [53, 0.0]
  - - [36352, 768, 1, 256]
    - [47, 0.0]
  - - [23552, 768, 1, 256]
    - [47, 0.0]
  - - [7168, 3072, 1, 256]
    - [53, 0.0]
  - - [44288, 4353, 1, 256]
    - [47, 0.0]
  - - [36608, 768, 1, 256]
    - [53, 0.0]
  - - [15616, 3073, 1, 256]
    - [53, 0.0]
  - - [37376, 24833, 1, 256]
    - [47, 0.0]
  - - [38144, 25857, 1, 256]
    - [47, 0.0]
  - - [26880, 14592, 1, 256]
    - [47, 0.0]
  - - [6144, 2817, 1, 256]
    - [47, 0.0]
  - - [23808, 768, 1, 256]
    - [47, 0.0]
  - - [39168, 26881, 1, 256]
    - [47, 0.0]
  - - [5120, 1793, 1, 256]
    - [47, 0.0]
  - - [32512, 19969, 1, 256]
    - [53, 0.0]
  - - [43008, 2817, 1, 256]
    - [47, 0.0]
  - - [26112, 13825, 1, 256]
    - [53, 0.0]
  - - [33536, 3072, 1, 256]
    - [53, 0.0]
  - - [9728, 6657, 1, 256]
    - [53, 0.0]
  - - [2048, 3072, 1, 256]
    - [59, 0.0]
  - - [24832, 9216, 1, 256]
    - [53, 0.0]
  - - [5632, 2561, 1, 256]
    - [53, 0.0]
  - - [33280, 20992, 1, 256]
    - [53, 0.0]
  - - [20224, 7936, 1, 256]
    - [47, 0.0]
  - - [28672, 16384, 1, 256]
    - [53, 0.0]
  - - [28416, 9216, 1, 256]
    - [53, 0.0]
  - - [7936, 768, 1, 256]
    - [47, 0.0]
  - - [23552, 11265, 1, 256]
    - [53, 0.0]
  - - [25088, 3072, 1, 256]
    - [53, 0.0]
  - - [32000, 19457, 1, 256]
    - [53, 0.0]
  - - [44800, 3072, 1, 256]
    - [53, 0.0]
  - - [37120, 1792, 1, 256]
    - [47, 0.0]
  - - [30464, 18177, 1, 256]
    - [47, 0.0]
  - - [44544, 4608, 1, 256]
    - [53, 0.0]
  - - [7168, 768, 1, 256]
    - [69, 0.0]
  - - [18944, 9216, 1, 256]
    - [53, 0.0]
  - - [33280, 20737, 1, 256]
    - [47, 0.0]
  - - [25856, 3072, 1, 256]
    - [53, 0.0]
  - - [27648, 9216, 1, 256]
    - [53, 0.0]
  - - [5120, 2049, 1, 256]
    - [53, 0.0]
  - - [28160, 9216, 1, 256]
    - [53, 0.0]
  - - [37632, 25089, 1, 256]
    - [53, 0.0]
  - - [22016, 1792, 1, 256]
    - [47, 0.0]
  - - [16384, 9216, 1, 256]
    - [53, 0.0]
  - - [21504, 9217, 1, 256]
    - [53, 0.0]
  - - [20480, 7937, 1, 256]
    - [47, 0.0]
  - - [33536, 21248, 1, 256]
    - [47, 0.0]
  - - [12800, 768, 1, 256]
    - [53, 0.0]
  - - [28672, 9216, 1, 256]
    - [53, 0.0]
  - - [32000, 9216, 1, 256]
    - [53, 0.0]
  - - [44544, 3072, 1, 256]
    - [53, 0.0]
  - - [5376, 3072, 1, 256]
    - [53, 0.0]
  - - [35840, 23297, 1, 256]
    - [47, 0.0]
  - - [23808, 11521, 1, 256]
    - [47, 0.0]
  - - [13312, 1025, 1, 256]
    - [49, 0.0]
  - - [18176, 9216, 1, 256]
    - [53, 0.0]
  - - [17920, 5633, 1, 256]
    - [53, 0.0]
  - - [27648, 3072, 1, 256]
    - [53, 0.0]
  - - [1024, 3072, 1, 256]
    - [59, 0.0]
  - - [22016, 9216, 1, 256]
    - [53, 0.0]
  - - [21760, 9473, 1, 256]
    - [47, 0.0]
  - - [6144, 1536, 1, 256]
    - [53, 0.0]
  - - [16896, 1536, 1, 256]
    - [53, 0.0]
  - - [19968, 768, 1, 256]
    - [47, 0.0]
  - - [23552, 11264, 1, 256]
    - [53, 0.0]
  - - [27904, 3072, 1, 256]
    - [53, 0.0]
  - - [19712, 7425, 1, 256]
    - [47, 0.0]
  - - [26624, 14081, 1, 256]
    - [47, 0.0]
  - - [3328, 257, 1, 256]
    - [46, 0.0]
  - - [24320, 9216, 1, 256]
    - [53, 0.0]
  - - [14080, 3072, 1, 256]
    - [53, 0.0]
  - - [17408, 3072, 1, 256]
    - [53, 0.0]
  - - [21504, 9216, 1, 256]
    - [53, 0.0]
  - - [14848, 2560, 1, 256]
    - [53, 0.0]
  - - [34304, 3072, 1, 256]
    - [53, 0.0]
  - - [15104, 9216, 1, 256]
    - [53, 0.0]
  - - [17152, 4865, 1, 256]
    - [47, 0.0]
  - - [38912, 26625, 1, 256]
    - [53, 0.0]
  - - [41216, 1792, 1, 256]
    - [47, 0.0]
  - - [39424, 3072, 1, 256]
    - [53, 0.0]
  - - [30720, 18433, 1, 256]
    - [53, 0.0]
  - - [18944, 6657, 1, 256]
    - [53, 0.0]
  - - [5632, 1792, 1, 256]
    - [47, 0.0]
  - - [18176, 1792, 1, 256]
    - [47, 0.0]
  - - [31232, 9216, 1, 256]
    - [53, 0.0]
  - - [42752, 2561, 1, 256]
    - [53, 0.0]
  - - [18688, 9216, 1, 256]
    - [53, 0.0]
  - - [43776, 1792, 1, 256]
    - [47, 0.0]
  - - [10240, 1792, 1, 256]
    - [47, 0.0]
  - - [33792, 21505, 1, 256]
    - [53, 0.0]
  - - [25856, 13313, 1, 256]
    - [53, 0.0]
  - - [29952, 3072, 1, 256]
    - [53, 0.0]
  - - [5888, 768, 1, 256]
    - [47, 0.0]
  - - [20480, 9216, 1, 256]
    - [53, 0.0]
  - - [17152, 1792, 1, 256]
    - [47, 0.0]
  - - [23040, 10753, 1, 256]
    - [53, 0.0]
  - - [8960, 5889, 1, 256]
    - [47, 0.0]
  - - [16640, 4352, 1, 256]
    - [47, 0.0]
  - - [30464, 3072, 1, 256]
    - [53, 0.0]
  - - [16128, 9216, 1, 256]
    - [53, 0.0]
  - - [25344, 13057, 1, 256]
    - [47, 0.0]
  - - [39424, 9216, 1, 256]
    - [53, 0.0]
  - - [25600, 3072, 1, 256]
    - [53, 0.0]
  - - [28416, 3072, 1, 256]
    - [53, 0.0]
  - - [12800, 257, 1, 256]
    - [49, 0.0]
  - - [43264, 1792, 1, 256]
    - [47, 0.0]
  - - [20736, 8193, 1, 256]
    - [53, 0.0]
  - - [30976, 9216, 1, 256]
    - [53, 0.0]
  - - [40192, 27648, 1, 256]
    - [53, 0.0]
  - - [31232, 1792, 1, 256]
    - [47, 0.0]
  - - [36352, 23809, 1, 256]
    - [47, 0.0]
  - - [9984, 3072, 1, 256]
    - [53, 0.0]
  - - [11776, 1792, 1, 256]
    - [53, 0.0]
  - - [37120, 1536, 1, 256]
    - [53, 0.0]
  - - [14592, 2304, 1, 256]
    - [47, 0.0]
  - - [7424, 768, 1, 256]
    - [53, 0.0]
  - - [10240, 1536, 1, 256]
    - [53, 0.0]
  - - [27392, 9216, 1, 256]
    - [53, 0.0]
  - - [15104, 3072, 1, 256]
    - [53, 0.0]
  - - [19200, 9216, 1, 256]
    - [53, 0.0]
  - - [36096, 23553, 1, 256]
    - [53, 0.0]
  - - [16128, 3841, 1, 256]
    - [47, 0.0]
  - - [18432, 5889, 1, 256]
    - [47, 0.0]
  - - [43776, 3841, 1, 256]
    - [47, 0.0]
  - - [22528, 10241, 1, 256]
    - [53, 0.0]
  - - [20224, 3072, 1, 256]
    - [53, 0.0]
  - - [39680, 3072, 1, 256]
    - [53, 0.0]
  - - [20736, 8449, 1, 256]
    - [47, 0.0]
  - - [30720, 1792, 1, 256]
    - [47, 0.0]
  - - [36864, 24321, 1, 256]
    - [47, 0.0]
  - - [22784, 1536, 1, 256]
    - [53, 0.0]
  - - [7424, 4097, 1, 256]
    - [53, 0.0]
  - - [7680, 4609, 1, 256]
    - [53, 0.0]
  - - [12032, 768, 1, 256]
    - [47, 0.0]
  - - [1792, 3072, 1, 256]
    - [59, 0.0]
  - - [6400, 3073, 1, 256]
    - [53, 0.0]
  - - [29440, 17153, 1, 256]
    - [47, 0.0]
  - - [8704, 1792, 1, 256]
    - [53, 0.0]
  - - [30720, 3072, 1, 256]
    - [53, 0.0]
  - - [16384, 3841, 1, 256]
    - [47, 0.0]
  - - [40192, 9216, 1, 256]
    - [53, 0.0]
  - - [23040, 1792, 1, 256]
    - [47, 0.0]
  - - [37888, 25601, 1, 256]
    - [53, 0.0]
  - - [26368, 14080, 1, 256]
    - [47, 0.0]
  - - [30208, 3072, 1, 256]
    - [53, 0.0]
  - - [33024, 20736, 1, 256]
    - [47, 0.0]
  - - [35072, 22784, 1, 256]
    - [47, 0.0]
  - - [9472, 6145, 1, 256]
    - [53, 0.0]
  - - [22784, 1792, 1, 256]
    - [47, 0.0]
  - - [768, 2048, 1, 256]
    - [57, 0.0]
  - - [1024, 1280, 1, 256]
    - [58, 0.0]
  - - [41984, 27648, 1, 256]
    - [53, 0.0]
  - - [33024, 20481, 1, 256]
    - [53, 0.0]
  - - [33280, 1536, 1, 256]
    - [53, 0.0]
  - - [9216, 3072, 1, 256]
    - [53, 0.0]
  - - [22528, 1792, 1, 256]
    - [47, 0.0]
  - - [25088, 768, 1, 256]
    - [47, 0.0]
  - - [13825, 128, 1, 128]
    - [103, 0.0]
  - - [20609, 128, 1, 256]
    - [113, 0.0]
  - - [6017, 128, 1, 256]
    - [92, 0.0]
  - - [2305, 128, 1, 128]
    - [100, 0.0]
  - - [15745, 128, 1, 256]
    - [119, 0.0]
  - - [8833, 128, 1, 128]
    - [117, 0.0]
  - - [641, 128, 1, 128]
    - [101, 0.0]
  - - [9217, 128, 1, 128]
    - [110, 0.0]
  - - [15361, 128, 1, 256]
    - [119, 0.0]
  - - [22913, 128, 1, 256]
    - [113, 0.0]
  - - [2177, 128, 1, 128]
    - [100, 0.0]
  - - [19073, 128, 1, 256]
    - [113, 0.0]
  - - [28289, 128, 1, 128]
    - [111, 0.0]
  - - [13057, 128, 1, 256]
    - [120, 0.0]
  - - [1793, 128, 1, 128]
    - [102, 0.0]
  - - [16769, 128, 1, 128]
    - [112, 0.0]
  - - [23681, 128, 1, 256]
    - [117, 0.0]
  - - [14593, 128, 1, 256]
    - [119, 0.0]
  - - [24449, 128, 1, 128]
    - [118, 0.0]
  - - [4609, 128, 1, 256]
    - [93, 0.0]
  - - [10625, 128, 1, 128]
    - [111, 0.0]
  - - [12545, 128, 1, 256]
    - [111, 0.0]
  - - [5633, 128, 1, 128]
    - [105, 0.0]
  - - [641, 128, 1, 256]
    - [114, 0.0]
  - - [18305, 128, 1, 256]
    - [120, 0.0]
  - - [23297, 128, 1, 256]
    - [120, 0.0]
  - - [21377, 128, 1, 256]
    - [112, 0.0]
  - - [9601, 128, 1, 128]
    - [112, 0.0]
  - - [13697, 128, 1, 256]
    - [96, 0.0]
  - - [23681, 128, 1, 128]
    - [113, 0.0]
  - - [24833, 128, 1, 256]
    - [111, 0.0]
  - - [25985, 128, 1, 128]
    - [111, 0.0]
  - - [9601, 128, 1, 256]
    - [110, 0.0]
  - - [17153, 128, 1, 128]
    - [110, 0.0]
  - - [9985, 128, 1, 128]
    - [113, 0.0]
  - - [23297, 128, 1, 128]
    - [113, 0.0]
  - - [19073, 128, 1, 128]
    - [118, 0.0]
  - - [2689, 128, 1, 256]
    - [99, 0.0]
  - - [4993, 128, 1, 128]
    - [105, 0.0]
  - - [6913, 128, 1, 256]
    - [91, 0.0]
  - - [6785, 128, 1, 128]
    - [118, 0.0]
  - - [27905, 128, 1, 128]
    - [111, 0.0]
  - - [7169, 128, 1, 256]
    - [81, 0.0]
  - - [11905, 128, 1, 256]
    - [119, 0.0]
  - - [1409, 128, 1, 128]
    - [100, 0.0]
  - - [12673, 128, 1, 128]
    - [111, 0.0]
  - - [27521, 128, 1, 256]
    - [110, 0.0]
  - - [1409, 128, 1, 256]
    - [115, 0.0]
  - - [25217, 128, 1, 128]
    - [118, 0.0]
  - - [7297, 128, 1, 128]
    - [111, 0.0]
  - - [14081, 128, 1, 128]
    - [111, 0.0]
  - - [22913, 128, 1, 128]
    - [118, 0.0]
  - - [10753, 128, 1, 256]
    - [94, 0.0]
  - - [7937, 128, 1, 128]
    - [78, 0.0]
  - - [11393, 128, 1, 128]
    - [111, 0.0]
  - - [26369, 128, 1, 128]
    - [120, 0.0]
  - - [12161, 128, 1, 256]
    - [120, 0.0]
  - - [8449, 128, 1, 128]
    - [89, 0.0]
  - - [22145, 128, 1, 256]
    - [112, 0.0]
  - - [20225, 128, 1, 256]
    - [120, 0.0]
  - - [10241, 128, 1, 256]
    - [105, 0.0]
  - - [6913, 128, 1, 128]
    - [118, 0.0]
  - - [4993, 128, 1, 256]
    - [74, 0.0]
  - - [6401, 128, 1, 256]
    - [80, 0.0]
  - - [13057, 128, 1, 128]
    - [118, 0.0]
  - - [2945, 128, 1, 128]
    - [112, 0.0]
  - - [3713, 128, 1, 256]
    - [104, 0.0]
  - - [10753, 128, 1, 128]
    - [105, 0.0]
  - - [14849, 128, 1, 256]
    - [81, 0.0]
  - - [3841, 128, 1, 128]
    - [92, 0.0]
  - - [28289, 128, 1, 256]
    - [113, 0.0]
  - - [12929, 128, 1, 128]
    - [111, 0.0]
  - - [14081, 128, 1, 256]
    - [90, 0.0]
  - - [14977, 128, 1, 256]
    - [112, 0.0]
  - - [12545, 128, 1, 128]
    - [111, 0.0]
  - - [16129, 128, 1, 256]
    - [110, 0.0]
  - - [11777, 128, 1, 256]
    - [105, 0.0]
  - - [11777, 128, 1, 128]
    - [120, 0.0]
  - - [17537, 128, 1, 256]
    - [112, 0.0]
  - - [5377, 128, 1, 128]
    - [103, 0.0]
  - - [8065, 128, 1, 256]
    - [95, 0.0]
  - - [6145, 128, 1, 128]
    - [93, 0.0]
  - - [20993, 128, 1, 128]
    - [111, 0.0]
  - - [15617, 128, 1, 128]
    - [112, 0.0]
  - - [5633, 128, 1, 256]
    - [108, 0.0]
  - - [4865, 128, 1, 128]
    - [120, 0.0]
  - - [385, 128, 1, 256]
    - [101, 0.0]
  - - [3841, 128, 1, 256]
    - [71, 0.0]
  - - [8833, 128, 1, 256]
    - [112, 0.0]
  - - [4225, 128, 1, 128]
    - [85, 0.0]
  - - [11009, 128, 1, 256]
    - [113, 0.0]
  - - [385, 128, 1, 128]
    - [101, 0.0]
  - - [9473, 128, 1, 256]
    - [112, 0.0]
  - - [5761, 128, 1, 128]
    - [92, 0.0]
  - - [11905, 128, 1, 128]
    - [118, 0.0]
  - - [4097, 128, 1, 256]
    - [92, 0.0]
  - - [25217, 128, 1, 256]
    - [96, 0.0]
  - - [9089, 128, 1, 256]
    - [117, 0.0]
  - - [10369, 128, 1, 256]
    - [120, 0.0]
  - - [14209, 128, 1, 256]
    - [97, 0.0]
  - - [6401, 128, 1, 128]
    - [92, 0.0]
  - - [27137, 128, 1, 256]
    - [113, 0.0]
  - - [16385, 128, 1, 256]
    - [74, 0.0]
  - - [24833, 128, 1, 128]
    - [118, 0.0]
  - - [18689, 128, 1, 128]
    - [120, 0.0]
  - - [7553, 128, 1, 256]
    - [75, 0.0]
  - - [8321, 128, 1, 128]
    - [79, 0.0]
  - - [15361, 128, 1, 128]
    - [111, 0.0]
  - - [1153, 128, 1, 128]
    - [101, 0.0]
  - - [1025, 128, 1, 128]
    - [109, 0.0]
  - - [19841, 128, 1, 256]
    - [112, 0.0]
  - - [15233, 128, 1, 128]
    - [119, 0.0]
  - - [21761, 128, 1, 256]
    - [117, 0.0]
  - - [17153, 128, 1, 256]
    - [117, 0.0]
  - - [15617, 128, 1, 256]
    - [112, 0.0]
  - - [4865, 128, 1, 256]
    - [105, 0.0]
  - - [14209, 128, 1, 128]
    - [111, 0.0]
  - - [19457, 128, 1, 256]
    - [120, 0.0]
  - - [9857, 128, 1, 256]
    - [112, 0.0]
  - - [11521, 128, 1, 128]
    - [117, 0.0]
  - - [8449, 128, 1, 256]
    - [87, 0.0]
  - - [4097, 128, 1, 128]
    - [85, 0.0]
  - - [28673, 128, 1, 256]
    - [111, 0.0]
  - - [12161, 128, 1, 128]
    - [111, 0.0]
  - - [1921, 128, 1, 256]
    - [100, 0.0]
  - - [9985, 128, 1, 256]
    - [111, 0.0]
  - - [7937, 128, 1, 256]
    - [95, 0.0]
  - - [9857, 128, 1, 128]
    - [111, 0.0]
  - - [13825, 128, 1, 256]
    - [97, 0.0]
  - - [9089, 128, 1, 128]
    - [110, 0.0]
  - - [6785, 128, 1, 256]
    - [83, 0.0]
  - - [5249, 128, 1, 256]
    - [86, 0.0]
  - - [7681, 128, 1, 256]
    - [88, 0.0]
  - - [3329, 128, 1, 128]
    - [100, 0.0]
  - - [14465, 128, 1, 128]
    - [110, 0.0]
  - - [11137, 128, 1, 256]
    - [118, 0.0]
  - - [1153, 128, 1, 256]
    - [115, 0.0]
  - - [16001, 128, 1, 128]
    - [119, 0.0]
  - - [26753, 128, 1, 128]
    - [120, 0.0]
  - - [13697, 128, 1, 128]
    - [117, 0.0]
  - - [3073, 128, 1, 128]
    - [107, 0.0]
  - - [22529, 128, 1, 256]
    - [111, 0.0]
  - - [18689, 128, 1, 256]
    - [111, 0.0]
  - - [257, 128, 1, 128]
    - [99, 0.0]
  - - [15233, 128, 1, 256]
    - [112, 0.0]
  - - [27521, 128, 1, 128]
    - [118, 0.0]
  - - [16385, 128, 1, 128]
    - [74, 0.0]
  - - [4481, 128, 1, 256]
    - [93, 0.0]
  - - [6017, 128, 1, 128]
    - [92, 0.0]
  - - [7297, 128, 1, 256]
    - [82, 0.0]
  - - [7553, 128, 1, 128]
    - [111, 0.0]
  - - [21761, 128, 1, 128]
    - [118, 0.0]
  - - [11393, 128, 1, 256]
    - [120, 0.0]
  - - [11521, 128, 1, 256]
    - [112, 0.0]
  - - [12929, 128, 1, 256]
    - [118, 0.0]
  - - [20225, 128, 1, 128]
    - [118, 0.0]
  - - [13313, 128, 1, 128]
    - [105, 0.0]
  - - [2561, 128, 1, 128]
    - [115, 0.0]
  - - [1537, 128, 1, 128]
    - [115, 0.0]
  - - [24449, 128, 1, 256]
    - [120, 0.0]
  - - [12289, 128, 1, 256]
    - [103, 0.0]
  - - [4225, 128, 1, 256]
    - [73, 0.0]
  - - [26369, 128, 1, 256]
    - [118, 0.0]
  - - [17921, 128, 1, 256]
    - [113, 0.0]
  - - [2945, 128, 1, 256]
    - [102, 0.0]
  - - [24065, 128, 1, 128]
    - [113, 0.0]
  - - [6529, 128, 1, 128]
    - [84, 0.0]
  - - [6145, 128, 1, 256]
    - [81, 0.0]
  - - [25985, 128, 1, 256]
    - [113, 0.0]
  - - [8705, 128, 1, 256]
    - [104, 0.0]
  - - [384, 128, 1, 256]
    - [99, 0.0]
  - - [25601, 128, 1, 256]
    - [120, 0.0]
  - - [28673, 128, 1, 128]
    - [113, 0.0]
  - - [20609, 128, 1, 128]
    - [111, 0.0]
  - - [19457, 128, 1, 128]
    - [118, 0.0]
  - - [16769, 128, 1, 256]
    - [117, 0.0]
  - - [12673, 128, 1, 256]
    - [120, 0.0]
  - - [8321, 128, 1, 256]
    - [88, 0.0]
  - - [5249, 128, 1, 128]
    - [110, 0.0]
  - - [16129, 128, 1, 128]
    - [110, 0.0]
  - - [13441, 128, 1, 256]
    - [88, 0.0]
  - - [5377, 128, 1, 256]
    - [86, 0.0]
  - - [21377, 128, 1, 128]
    - [112, 0.0]
  - - [14465, 128, 1, 256]
    - [119, 0.0]
  - - [11137, 128, 1, 128]
    - [111, 0.0]
  - - [7681, 128, 1, 128]
    - [89, 0.0]
  - - [7169, 128, 1, 128]
    - [98, 0.0]
  - - [22145, 128, 1, 128]
    - [113, 0.0]
  - - [11009, 128, 1, 128]
    - [111, 0.0]
  - - [20993, 128, 1, 256]
    - [113, 0.0]
  - - [13313, 128, 1, 256]
    - [119, 0.0]
  - - [25601, 128, 1, 128]
    - [113, 0.0]
  - - [4609, 128, 1, 128]
    - [85, 0.0]
  - - [5761, 128, 1, 256]
    - [91, 0.0]
  - - [17921, 128, 1, 128]
    - [111, 0.0]
  - - [2689, 128, 1, 128]
    - [100, 0.0]
  - - [8705, 128, 1, 128]
    - [104, 0.0]
  - - [10241, 128, 1, 128]
    - [105, 0.0]
  - - [14977, 128, 1, 128]
    - [111, 0.0]
  - - [18305, 128, 1, 128]
    - [111, 0.0]
  - - [3457, 128, 1, 128]
    - [112, 0.0]
  - - [24065, 128, 1, 256]
    - [113, 0.0]
  - - [12289, 128, 1, 128]
    - [103, 0.0]
  - - [14593, 128, 1, 128]
    - [118, 0.0]
  - - [2177, 128, 1, 256]
    - [106, 0.0]
  - - [4481, 128, 1, 128]
    - [73, 0.0]
  - - [8065, 128, 1, 128]
    - [87, 0.0]
  - - [3457, 128, 1, 256]
    - [104, 0.0]
  - - [6529, 128, 1, 256]
    - [82, 0.0]
  - - [26753, 128, 1, 256]
    - [113, 0.0]
  - - [17537, 128, 1, 128]
    - [110, 0.0]
  - - [22529, 128, 1, 128]
    - [113, 0.0]
  - - [10625, 128, 1, 256]
    - [111, 0.0]
  - - [14849, 128, 1, 128]
    - [98, 0.0]
  - - [9217, 128, 1, 256]
    - [112, 0.0]
  - - [19841, 128, 1, 128]
    - [119, 0.0]
  - - [15745, 128, 1, 128]
    - [112, 0.0]
  - - [13441, 128, 1, 128]
    - [112, 0.0]
  - - [3713, 128, 1, 128]
    - [102, 0.0]
  - - [27137, 128, 1, 128]
    - [118, 0.0]
  - - [16001, 128, 1, 256]
    - [110, 0.0]
  - - [10369, 128, 1, 128]
    - [120, 0.0]
  - - [1921, 128, 1, 128]
    - [100, 0.0]
  - - [9473, 128, 1, 128]
    - [112, 0.0]
  - - [27905, 128, 1, 256]
    - [111, 0.0]
  - - [30976, 1024, 1, 128]
    - [120, 0.0]
  - - [42240, 26369, 1, 128]
    - [120, 0.0]
  - - [33024, 17025, 1, 128]
    - [120, 0.0]
  - - [39168, 512, 1, 128]
    - [120, 0.0]
  - - [30848, 1024, 1, 128]
    - [120, 0.0]
  - - [41728, 8192, 1, 128]
    - [120, 0.0]
  - - [39552, 23553, 1, 128]
    - [120, 0.0]
  - - [35072, 512, 1, 128]
    - [120, 0.0]
  - - [29952, 14081, 1, 128]
    - [120, 0.0]
  - - [33280, 2048, 1, 128]
    - [120, 0.0]
  - - [40320, 128, 1, 128]
    - [120, 0.0]
  - - [35456, 1024, 1, 128]
    - [120, 0.0]
  - - [36096, 1024, 1, 128]
    - [120, 0.0]
  - - [36992, 20993, 1, 128]
    - [120, 0.0]
  - - [36096, 20097, 1, 128]
    - [120, 0.0]
  - - [31488, 15489, 1, 128]
    - [120, 0.0]
  - - [39552, 23681, 1, 128]
    - [120, 0.0]
  - - [36864, 128, 1, 128]
    - [120, 0.0]
  - - [40320, 4096, 1, 128]
    - [120, 0.0]
  - - [35200, 2048, 1, 128]
    - [120, 0.0]
  - - [29824, 2048, 1, 128]
    - [120, 0.0]
  - - [34688, 2048, 1, 128]
    - [120, 0.0]
  - - [42752, 26753, 1, 128]
    - [120, 0.0]
  - - [34304, 4096, 1, 128]
    - [120, 0.0]
  - - [36480, 20481, 1, 128]
    - [120, 0.0]
  - - [33408, 128, 1, 128]
    - [120, 0.0]
  - - [38784, 4096, 1, 128]
    - [120, 0.0]
  - - [43264, 27393, 1, 128]
    - [120, 0.0]
  - - [34560, 128, 1, 128]
    - [120, 0.0]
  - - [30336, 4096, 1, 128]
    - [120, 0.0]
  - - [29056, 2048, 1, 128]
    - [120, 0.0]
  - - [34816, 512, 1, 128]
    - [120, 0.0]
  - - [38272, 2048, 1, 128]
    - [120, 0.0]
  - - [39808, 23937, 1, 128]
    - [120, 0.0]
  - - [30848, 512, 1, 128]
    - [120, 0.0]
  - - [40448, 512, 1, 128]
    - [120, 0.0]
  - - [40448, 24577, 1, 128]
    - [120, 0.0]
  - - [44544, 28545, 1, 128]
    - [120, 0.0]
  - - [30208, 14209, 1, 128]
    - [120, 0.0]
  - - [34688, 18689, 1, 128]
    - [120, 0.0]
  - - [31360, 512, 1, 128]
    - [120, 0.0]
  - - [38912, 512, 1, 128]
    - [120, 0.0]
  - - [39680, 1024, 1, 128]
    - [120, 0.0]
  - - [34048, 1024, 1, 128]
    - [120, 0.0]
  - - [39552, 4096, 1, 128]
    - [120, 0.0]
  - - [40320, 24321, 1, 128]
    - [120, 0.0]
  - - [40832, 24833, 1, 128]
    - [120, 0.0]
  - - [36736, 1024, 1, 128]
    - [120, 0.0]
  - - [44672, 1024, 1, 128]
    - [120, 0.0]
  - - [32000, 128, 1, 128]
    - [113, 0.0]
  - - [40704, 4096, 1, 128]
    - [120, 0.0]
  - - [38144, 1024, 1, 128]
    - [120, 0.0]
  - - [30720, 14849, 1, 128]
    - [120, 0.0]
  - - [38144, 8192, 1, 128]
    - [120, 0.0]
  - - [30208, 1024, 1, 128]
    - [120, 0.0]
  - - [43136, 1024, 1, 128]
    - [120, 0.0]
  - - [38528, 1024, 1, 128]
    - [120, 0.0]
  - - [43264, 2048, 1, 128]
    - [120, 0.0]
  - - [38400, 22529, 1, 128]
    - [120, 0.0]
  - - [37120, 128, 1, 128]
    - [119, 0.0]
  - - [32256, 128, 1, 128]
    - [111, 0.0]
  - - [29952, 13953, 1, 128]
    - [113, 0.0]
  - - [34560, 8192, 1, 128]
    - [120, 0.0]
  - - [37504, 21505, 1, 128]
    - [120, 0.0]
  - - [33536, 128, 1, 128]
    - [118, 0.0]
  - - [41856, 2048, 1, 128]
    - [120, 0.0]
  - - [32896, 4096, 1, 128]
    - [120, 0.0]
  - - [41856, 8192, 1, 128]
    - [120, 0.0]
  - - [29440, 4096, 1, 128]
    - [120, 0.0]
  - - [33664, 8192, 1, 128]
    - [120, 0.0]
  - - [36992, 512, 1, 128]
    - [120, 0.0]
  - - [33280, 512, 1, 128]
    - [120, 0.0]
  - - [41728, 128, 1, 128]
    - [113, 0.0]
  - - [31744, 128, 1, 128]
    - [111, 0.0]
  - - [31360, 1024, 1, 128]
    - [120, 0.0]
  - - [29952, 8192, 1, 128]
    - [120, 0.0]
  - - [38016, 2048, 1, 128]
    - [120, 0.0]
  - - [34176, 8192, 1, 128]
    - [120, 0.0]
  - - [30464, 512, 1, 128]
    - [120, 0.0]
  - - [41984, 2048, 1, 128]
    - [120, 0.0]
  - - [40448, 4096, 1, 128]
    - [120, 0.0]
  - - [33920, 4096, 1, 128]
    - [120, 0.0]
  - - [41088, 8192, 1, 128]
    - [120, 0.0]
  - - [39808, 8192, 1, 128]
    - [120, 0.0]
  - - [40832, 4096, 1, 128]
    - [120, 0.0]
  - - [30592, 2048, 1, 128]
    - [120, 0.0]
  - - [36352, 1024, 1, 128]
    - [120, 0.0]
  - - [30336, 2048, 1, 128]
    - [120, 0.0]
  - - [30976, 512, 1, 128]
    - [120, 0.0]
  - - [42368, 1024, 1, 128]
    - [120, 0.0]
  - - [29056, 1024, 1, 128]
    - [120, 0.0]
  - - [38784, 22913, 1, 128]
    - [120, 0.0]
  - - [28928, 512, 1, 128]
    - [120, 0.0]
  - - [40576, 512, 1, 128]
    - [120, 0.0]
  - - [34816, 4096, 1, 128]
    - [120, 0.0]
  - - [41600, 2048, 1, 128]
    - [120, 0.0]
  - - [29696, 8192, 1, 128]
    - [120, 0.0]
  - - [41856, 4096, 1, 128]
    - [120, 0.0]
  - - [35584, 2048, 1, 128]
    - [120, 0.0]
  - - [30848, 14849, 1, 128]
    - [120, 0.0]
  - - [33280, 17281, 1, 128]
    - [120, 0.0]
  - - [43776, 2048, 1, 128]
    - [120, 0.0]
  - - [42112, 8192, 1, 128]
    - [120, 0.0]
  - - [37376, 128, 1, 128]
    - [120, 0.0]
  - - [41600, 4096, 1, 128]
    - [120, 0.0]
  - - [36224, 20353, 1, 128]
    - [120, 0.0]
  - - [29952, 1024, 1, 128]
    - [120, 0.0]
  - - [34176, 1024, 1, 128]
    - [120, 0.0]
  - - [31744, 512, 1, 128]
    - [120, 0.0]
  - - [42624, 8192, 1, 128]
    - [120, 0.0]
  - - [41216, 128, 1, 128]
    - [113, 0.0]
  - - [42624, 26753, 1, 128]
    - [120, 0.0]
  - - [32512, 2048, 1, 128]
    - [120, 0.0]
  - - [40064, 4096, 1, 128]
    - [120, 0.0]
  - - [32640, 4096, 1, 128]
    - [120, 0.0]
  - - [42112, 26241, 1, 128]
    - [120, 0.0]
  - - [32256, 512, 1, 128]
    - [120, 0.0]
  - - [40960, 1024, 1, 128]
    - [120, 0.0]
  - - [35968, 128, 1, 128]
    - [120, 0.0]
  - - [32384, 8192, 1, 128]
    - [120, 0.0]
  - - [42880, 512, 1, 128]
    - [120, 0.0]
  - - [33024, 8192, 1, 128]
    - [120, 0.0]
  - - [43904, 1024, 1, 128]
    - [120, 0.0]
  - - [33664, 17665, 1, 128]
    - [120, 0.0]
  - - [41856, 512, 1, 128]
    - [120, 0.0]
  - - [40704, 128, 1, 128]
    - [118, 0.0]
  - - [33408, 17537, 1, 128]
    - [120, 0.0]
  - - [37120, 512, 1, 128]
    - [120, 0.0]
  - - [41216, 25345, 1, 128]
    - [120, 0.0]
  - - [39680, 8192, 1, 128]
    - [120, 0.0]
  - - [40192, 24193, 1, 128]
    - [120, 0.0]
  - - [33024, 17153, 1, 128]
    - [120, 0.0]
  - - [38272, 1024, 1, 128]
    - [120, 0.0]
  - - [35328, 1024, 1, 128]
    - [120, 0.0]
  - - [31104, 8192, 1, 128]
    - [120, 0.0]
  - - [40320, 8192, 1, 128]
    - [120, 0.0]
  - - [29312, 2048, 1, 128]
    - [120, 0.0]
  - - [36608, 20737, 1, 128]
    - [120, 0.0]
  - - [42240, 4096, 1, 128]
    - [120, 0.0]
  - - [43520, 2048, 1, 128]
    - [120, 0.0]
  - - [29056, 512, 1, 128]
    - [120, 0.0]
  - - [35328, 19329, 1, 128]
    - [120, 0.0]
  - - [30464, 128, 1, 128]
    - [113, 0.0]
  - - [29696, 13697, 1, 128]
    - [120, 0.0]
  - - [43904, 28033, 1, 128]
    - [120, 0.0]
  - - [35584, 19713, 1, 128]
    - [120, 0.0]
  - - [41088, 4096, 1, 128]
    - [120, 0.0]
  - - [42368, 2048, 1, 128]
    - [120, 0.0]
  - - [36736, 128, 1, 128]
    - [119, 0.0]
  - - [30336, 8192, 1, 128]
    - [120, 0.0]
  - - [43008, 128, 1, 128]
    - [118, 0.0]
  - - [37120, 1024, 1, 128]
    - [120, 0.0]
  - - [31104, 2048, 1, 128]
    - [120, 0.0]
  - - [33152, 4096, 1, 128]
    - [120, 0.0]
  - - [43392, 27521, 1, 128]
    - [120, 0.0]
  - - [37248, 21249, 1, 128]
    - [120, 0.0]
  - - [33920, 17921, 1, 128]
    - [120, 0.0]
  - - [39680, 4096, 1, 128]
    - [120, 0.0]
  - - [43264, 512, 1, 128]
    - [120, 0.0]
  - - [35712, 8192, 1, 128]
    - [120, 0.0]
  - - [31616, 2048, 1, 128]
    - [120, 0.0]
  - - [35328, 512, 1, 128]
    - [120, 0.0]
  - - [43136, 27265, 1, 128]
    - [120, 0.0]
  - - [30208, 128, 1, 128]
    - [113, 0.0]
  - - [40320, 24449, 1, 128]
    - [120, 0.0]
  - - [44288, 2048, 1, 128]
    - [120, 0.0]
  - - [35072, 1024, 1, 128]
    - [120, 0.0]
  - - [30464, 14465, 1, 128]
    - [120, 0.0]
  - - [44160, 8192, 1, 128]
    - [120, 0.0]
  - - [33792, 17793, 1, 128]
    - [120, 0.0]
  - - [37632, 1024, 1, 128]
    - [120, 0.0]
  - - [35968, 2048, 1, 128]
    - [120, 0.0]
  - - [38400, 8192, 1, 128]
    - [120, 0.0]
  - - [32512, 4096, 1, 128]
    - [120, 0.0]
  - - [32512, 16641, 1, 128]
    - [120, 0.0]
  - - [39424, 128, 1, 128]
    - [111, 0.0]
  - - [30976, 8192, 1, 128]
    - [120, 0.0]
  - - [35968, 20097, 1, 128]
    - [113, 0.0]
  - - [38656, 512, 1, 128]
    - [120, 0.0]
  - - [34944, 18945, 1, 128]
    - [120, 0.0]
  - - [33664, 17793, 1, 128]
    - [120, 0.0]
  - - [38656, 22657, 1, 128]
    - [120, 0.0]
  - - [34944, 1024, 1, 128]
    - [120, 0.0]
  - - [31872, 16001, 1, 128]
    - [113, 0.0]
  - - [43392, 8192, 1, 128]
    - [120, 0.0]
  - - [38016, 512, 1, 128]
    - [120, 0.0]
  - - [29440, 8192, 1, 128]
    - [120, 0.0]
  - - [35200, 1024, 1, 128]
    - [120, 0.0]
  - - [34304, 18433, 1, 128]
    - [120, 0.0]
  - - [44672, 28801, 1, 128]
    - [120, 0.0]
  - - [29184, 4096, 1, 128]
    - [120, 0.0]
  - - [33408, 8192, 1, 128]
    - [120, 0.0]
  - - [39040, 128, 1, 128]
    - [120, 0.0]
  - - [39680, 23681, 1, 128]
    - [120, 0.0]
  - - [38144, 4096, 1, 128]
    - [120, 0.0]
  - - [42368, 26497, 1, 128]
    - [120, 0.0]
  - - [42368, 4096, 1, 128]
    - [120, 0.0]
  - - [31872, 128, 1, 128]
    - [111, 0.0]
  - - [41984, 512, 1, 128]
    - [120, 0.0]
  - - [39296, 2048, 1, 128]
    - [120, 0.0]
  - - [33920, 2048, 1, 128]
    - [120, 0.0]
  - - [36736, 20865, 1, 128]
    - [120, 0.0]
  - - [34432, 8192, 1, 128]
    - [120, 0.0]
  - - [30848, 14977, 1, 128]
    - [120, 0.0]
  - - [31744, 15873, 1, 128]
    - [120, 0.0]
  - - [42880, 27009, 1, 128]
    - [120, 0.0]
  - - [42240, 26241, 1, 128]
    - [120, 0.0]
  - - [38400, 4096, 1, 128]
    - [120, 0.0]
  - - [42624, 26625, 1, 128]
    - [120, 0.0]
  - - [35072, 4096, 1, 128]
    - [120, 0.0]
  - - [40576, 4096, 1, 128]
    - [120, 0.0]
  - - [39296, 8192, 1, 128]
    - [120, 0.0]
  - - [42624, 512, 1, 128]
    - [120, 0.0]
  - - [32768, 8192, 1, 128]
    - [120, 0.0]
  - - [36864, 1024, 1, 128]
    - [120, 0.0]
  - - [43392, 128, 1, 128]
    - [120, 0.0]
  - - [41344, 2048, 1, 128]
    - [120, 0.0]
  - - [35584, 4096, 1, 128]
    - [120, 0.0]
  - - [40064, 2048, 1, 128]
    - [120, 0.0]
  - - [40576, 24705, 1, 128]
    - [120, 0.0]
  - - [39808, 1024, 1, 128]
    - [120, 0.0]
  - - [36992, 1024, 1, 128]
    - [120, 0.0]
  - - [42496, 1024, 1, 128]
    - [120, 0.0]
  - - [43904, 128, 1, 128]
    - [113, 0.0]
  - - [31232, 512, 1, 128]
    - [120, 0.0]
  - - [42112, 128, 1, 128]
    - [120, 0.0]
  - - [37376, 2048, 1, 128]
    - [120, 0.0]
  - - [38016, 128, 1, 128]
    - [118, 0.0]
  - - [42368, 8192, 1, 128]
    - [120, 0.0]
  - - [43392, 512, 1, 128]
    - [120, 0.0]
  - - [41984, 1024, 1, 128]
    - [120, 0.0]
  - - [42240, 2048, 1, 128]
    - [120, 0.0]
  - - [29952, 128, 1, 128]
    - [111, 0.0]
  - - [36608, 8192, 1, 128]
    - [120, 0.0]
  - - [32512, 16513, 1, 128]
    - [120, 0.0]
  - - [29568, 512, 1, 128]
    - [120, 0.0]
  - - [34304, 1024, 1, 128]
    - [120, 0.0]
  - - [41984, 4096, 1, 128]
    - [120, 0.0]
  - - [30464, 4096, 1, 128]
    - [120, 0.0]
  - - [41216, 2048, 1, 128]
    - [120, 0.0]
  - - [36480, 20609, 1, 128]
    - [120, 0.0]
  - - [44800, 4096, 1, 128]
    - [120, 0.0]
  - - [36864, 512, 1, 128]
    - [120, 0.0]
  - - [39680, 2048, 1, 128]
    - [120, 0.0]
  - - [43648, 4096, 1, 128]
    - [120, 0.0]
  - - [33664, 128, 1, 128]
    - [118, 0.0]
  - - [41600, 512, 1, 128]
    - [120, 0.0]
  - - [43776, 1024, 1, 128]
    - [120, 0.0]
  - - [37632, 512, 1, 128]
    - [118, 0.0]
  - - [44160, 128, 1, 128]
    - [111, 0.0]
  - - [37248, 8192, 1, 128]
    - [120, 0.0]
  - - [34816, 18817, 1, 128]
    - [120, 0.0]
  - - [38528, 22529, 1, 128]
    - [120, 0.0]
  - - [40192, 24321, 1, 128]
    - [120, 0.0]
  - - [40832, 128, 1, 128]
    - [111, 0.0]
  - - [29312, 8192, 1, 128]
    - [120, 0.0]
  - - [43776, 27777, 1, 128]
    - [120, 0.0]
  - - [37632, 21633, 1, 128]
    - [120, 0.0]
  - - [33792, 4096, 1, 128]
    - [120, 0.0]
  - - [35968, 1024, 1, 128]
    - [120, 0.0]
  - - [37888, 512, 1, 128]
    - [120, 0.0]
  - - [35968, 512, 1, 128]
    - [120, 0.0]
  - - [30592, 1024, 1, 128]
    - [120, 0.0]
  - - [38400, 512, 1, 128]
    - [120, 0.0]
  - - [43264, 1024, 1, 128]
    - [120, 0.0]
  - - [38528, 4096, 1, 128]
    - [120, 0.0]
  - - [28928, 1024, 1, 128]
    - [120, 0.0]
  - - [33152, 1024, 1, 128]
    - [120, 0.0]
  - - [41344, 1024, 1, 128]
    - [120, 0.0]
  - - [30848, 8192, 1, 128]
    - [120, 0.0]
  - - [41344, 4096, 1, 128]
    - [120, 0.0]
  - - [38912, 2048, 1, 128]
    - [120, 0.0]
  - - [38272, 128, 1, 128]
    - [118, 0.0]
  - - [31488, 4096, 1, 128]
    - [120, 0.0]
  - - [44416, 4096, 1, 128]
    - [120, 0.0]
  - - [39552, 2048, 1, 128]
    - [120, 0.0]
  - - [37760, 1024, 1, 128]
    - [120, 0.0]
  - - [34304, 18305, 1, 128]
    - [120, 0.0]
  - - [44544, 28673, 1, 128]
    - [120, 0.0]
  - - [44416, 8192, 1, 128]
    - [120, 0.0]
  - - [38144, 512, 1, 128]
    - [120, 0.0]
  - - [30208, 14337, 1, 128]
    - [120, 0.0]
  - - [38144, 2048, 1, 128]
    - [120, 0.0]
  - - [40448, 128, 1, 128]
    - [111, 0.0]
  - - [42240, 8192, 1, 128]
    - [120, 0.0]
  - - [39424, 2048, 1, 128]
    - [120, 0.0]
  - - [41088, 512, 1, 128]
    - [120, 0.0]
  - - [36224, 2048, 1, 128]
    - [120, 0.0]
  - - [31744, 4096, 1, 128]
    - [120, 0.0]
  - - [44160, 512, 1, 128]
    - [120, 0.0]
  - - [32000, 1024, 1, 128]
    - [120, 0.0]
  - - [42752, 1024, 1, 128]
    - [120, 0.0]
  - - [42496, 2048, 1, 128]
    - [120, 0.0]
  - - [32640, 2048, 1, 128]
    - [120, 0.0]
  - - [42752, 26881, 1, 128]
    - [120, 0.0]
  - - [32256, 8192, 1, 128]
    - [120, 0.0]
  - - [44800, 512, 1, 128]
    - [120, 0.0]
  - - [34816, 128, 1, 128]
    - [120, 0.0]
  - - [38272, 8192, 1, 128]
    - [120, 0.0]
  - - [44800, 28929, 1, 128]
    - [120, 0.0]
  - - [37120, 8192, 1, 128]
    - [120, 0.0]
  - - [43776, 512, 1, 128]
    - [120, 0.0]
  - - [43008, 1024, 1, 128]
    - [120, 0.0]
  - - [34432, 18561, 1, 128]
    - [113, 0.0]
  - - [36736, 4096, 1, 128]
    - [120, 0.0]
  - - [36224, 512, 1, 128]
    - [120, 0.0]
  - - [32768, 512, 1, 128]
    - [120, 0.0]
  - - [30592, 128, 1, 128]
    - [113, 0.0]
  - - [43008, 27137, 1, 128]
    - [120, 0.0]
  - - [34048, 18177, 1, 128]
    - [120, 0.0]
  - - [43136, 2048, 1, 128]
    - [120, 0.0]
  - - [29184, 13313, 1, 128]
    - [120, 0.0]
  - - [40064, 24193, 1, 128]
    - [113, 0.0]
  - - [40960, 128, 1, 128]
    - [113, 0.0]
  - - [29184, 2048, 1, 128]
    - [120, 0.0]
  - - [37248, 128, 1, 128]
    - [112, 0.0]
  - - [35328, 128, 1, 128]
    - [113, 0.0]
  - - [43264, 128, 1, 128]
    - [120, 0.0]
  - - [29952, 4096, 1, 128]
    - [120, 0.0]
  - - [36736, 20737, 1, 128]
    - [113, 0.0]
  - - [34176, 4096, 1, 128]
    - [120, 0.0]
  - - [32768, 1024, 1, 128]
    - [120, 0.0]
  - - [44160, 4096, 1, 128]
    - [120, 0.0]
  - - [31104, 1024, 1, 128]
    - [120, 0.0]
  - - [33792, 512, 1, 128]
    - [120, 0.0]
  - - [41216, 25217, 1, 128]
    - [120, 0.0]
  - - [31872, 1024, 1, 128]
    - [120, 0.0]
  - - [38528, 8192, 1, 128]
    - [120, 0.0]
  - - [44672, 4096, 1, 128]
    - [120, 0.0]
  - - [32512, 1024, 1, 128]
    - [120, 0.0]
  - - [39168, 8192, 1, 128]
    - [120, 0.0]
  - - [31360, 15361, 1, 128]
    - [120, 0.0]
  - - [38016, 22145, 1, 128]
    - [120, 0.0]
  - - [35712, 128, 1, 128]
    - [120, 0.0]
  - - [30208, 4096, 1, 128]
    - [120, 0.0]
  - - [33920, 128, 1, 128]
    - [118, 0.0]
  - - [30336, 128, 1, 128]
    - [120, 0.0]
  - - [42368, 128, 1, 128]
    - [111, 0.0]
  - - [38912, 4096, 1, 128]
    - [120, 0.0]
  - - [34176, 512, 1, 128]
    - [120, 0.0]
  - - [42752, 8192, 1, 128]
    - [120, 0.0]
  - - [31488, 1024, 1, 128]
    - [120, 0.0]
  - - [36608, 1024, 1, 128]
    - [120, 0.0]
  - - [41856, 128, 1, 128]
    - [120, 0.0]
  - - [29312, 13441, 1, 128]
    - [120, 0.0]
  - - [43520, 128, 1, 128]
    - [118, 0.0]
  - - [31616, 8192, 1, 128]
    - [120, 0.0]
  - - [40448, 2048, 1, 128]
    - [120, 0.0]
  - - [35328, 2048, 1, 128]
    - [120, 0.0]
  - - [36864, 20865, 1, 128]
    - [120, 0.0]
  - - [32000, 2048, 1, 128]
    - [120, 0.0]
  - - [34176, 18177, 1, 128]
    - [120, 0.0]
  - - [37504, 128, 1, 128]
    - [111, 0.0]
  - - [33792, 1024, 1, 128]
    - [120, 0.0]
  - - [31872, 8192, 1, 128]
    - [120, 0.0]
  - - [40704, 512, 1, 128]
    - [120, 0.0]
  - - [37632, 128, 1, 128]
    - [113, 0.0]
  - - [32640, 1024, 1, 128]
    - [120, 0.0]
  - - [44544, 8192, 1, 128]
    - [120, 0.0]
  - - [39424, 8192, 1, 128]
    - [120, 0.0]
  - - [39296, 512, 1, 128]
    - [120, 0.0]
  - - [35840, 128, 1, 128]
    - [120, 0.0]
  - - [39168, 1024, 1, 128]
    - [120, 0.0]
  - - [35712, 19841, 1, 128]
    - [120, 0.0]
  - - [29568, 13569, 1, 128]
    - [120, 0.0]
  - - [34944, 4096, 1, 128]
    - [120, 0.0]
  - - [32768, 2048, 1, 128]
    - [120, 0.0]
  - - [39296, 128, 1, 128]
    - [111, 0.0]
  - - [29568, 4096, 1, 128]
    - [120, 0.0]
  - - [39040, 1024, 1, 128]
    - [120, 0.0]
  - - [37376, 1024, 1, 128]
    - [120, 0.0]
  - - [33536, 2048, 1, 128]
    - [120, 0.0]
  - - [31488, 8192, 1, 128]
    - [120, 0.0]
  - - [37888, 1024, 1, 128]
    - [120, 0.0]
  - - [41472, 4096, 1, 128]
    - [120, 0.0]
  - - [30592, 512, 1, 128]
    - [120, 0.0]
  - - [34560, 18561, 1, 128]
    - [120, 0.0]
  - - [29184, 512, 1, 128]
    - [120, 0.0]
  - - [32256, 16257, 1, 128]
    - [120, 0.0]
  - - [43392, 27393, 1, 128]
    - [120, 0.0]
  - - [29312, 4096, 1, 128]
    - [120, 0.0]
  - - [43648, 2048, 1, 128]
    - [120, 0.0]
  - - [44288, 1024, 1, 128]
    - [120, 0.0]
  - - [35456, 128, 1, 128]
    - [118, 0.0]
  - - [44160, 28289, 1, 128]
    - [120, 0.0]
  - - [40320, 1024, 1, 128]
    - [120, 0.0]
  - - [37888, 22017, 1, 128]
    - [120, 0.0]
  - - [29696, 512, 1, 128]
    - [120, 0.0]
  - - [35840, 2048, 1, 128]
    - [120, 0.0]
  - - [37504, 2048, 1, 128]
    - [120, 0.0]
  - - [41728, 4096, 1, 128]
    - [120, 0.0]
  - - [42752, 4096, 1, 128]
    - [120, 0.0]
  - - [29824, 4096, 1, 128]
    - [120, 0.0]
  - - [44800, 1024, 1, 128]
    - [120, 0.0]
  - - [30592, 4096, 1, 128]
    - [120, 0.0]
  - - [43904, 4096, 1, 128]
    - [120, 0.0]
  - - [39552, 8192, 1, 128]
    - [120, 0.0]
  - - [37632, 2048, 1, 128]
    - [120, 0.0]
  - - [29312, 128, 1, 128]
    - [112, 0.0]
  - - [30080, 512, 1, 128]
    - [118, 0.0]
  - - [33664, 2048, 1, 128]
    - [120, 0.0]
  - - [43520, 27521, 1, 128]
    - [120, 0.0]
  - - [36224, 128, 1, 128]
    - [111, 0.0]
  - - [28928, 12929, 1, 128]
    - [113, 0.0]
  - - [29440, 1024, 1, 128]
    - [120, 0.0]
  - - [35840, 19969, 1, 128]
    - [120, 0.0]
  - - [42880, 4096, 1, 128]
    - [120, 0.0]
  - - [42496, 8192, 1, 128]
    - [120, 0.0]
  - - [39936, 24065, 1, 128]
    - [120, 0.0]
  - - [33408, 1024, 1, 128]
    - [120, 0.0]
  - - [32256, 2048, 1, 128]
    - [120, 0.0]
  - - [35712, 19713, 1, 128]
    - [113, 0.0]
  - - [40192, 4096, 1, 128]
    - [120, 0.0]
  - - [32000, 16129, 1, 128]
    - [120, 0.0]
  - - [44032, 512, 1, 128]
    - [120, 0.0]
  - - [35584, 128, 1, 128]
    - [111, 0.0]
  - - [35584, 8192, 1, 128]
    - [120, 0.0]
  - - [37888, 21889, 1, 128]
    - [120, 0.0]
  - - [37504, 1024, 1, 128]
    - [120, 0.0]
  - - [33664, 512, 1, 128]
    - [120, 0.0]
  - - [32384, 1024, 1, 128]
    - [120, 0.0]
  - - [38400, 1024, 1, 128]
    - [120, 0.0]
  - - [35200, 128, 1, 128]
    - [111, 0.0]
  - - [43648, 1024, 1, 128]
    - [120, 0.0]
  - - [36608, 128, 1, 128]
    - [117, 0.0]
  - - [32768, 128, 1, 128]
    - [118, 0.0]
  - - [28928, 4096, 1, 128]
    - [120, 0.0]
  - - [35200, 19329, 1, 128]
    - [120, 0.0]
  - - [41216, 8192, 1, 128]
    - [120, 0.0]
  - - [36864, 8192, 1, 128]
    - [120, 0.0]
  - - [40064, 128, 1, 128]
    - [113, 0.0]
  - - [42624, 1024, 1, 128]
    - [120, 0.0]
  - - [34688, 128, 1, 128]
    - [119, 0.0]
  - - [43648, 27777, 1, 128]
    - [120, 0.0]
  - - [37888, 8192, 1, 128]
    - [120, 0.0]
  - - [41472, 25601, 1, 128]
    - [120, 0.0]
  - - [38272, 512, 1, 128]
    - [120, 0.0]
  - - [35456, 4096, 1, 128]
    - [120, 0.0]
  - - [42496, 26625, 1, 128]
    - [120, 0.0]
  - - [43136, 4096, 1, 128]
    - [120, 0.0]
  - - [44800, 8192, 1, 128]
    - [120, 0.0]
  - - [36480, 8192, 1, 128]
    - [120, 0.0]
  - - [37504, 4096, 1, 128]
    - [120, 0.0]
  - - [39040, 8192, 1, 128]
    - [120, 0.0]
  - - [31104, 512, 1, 128]
    - [120, 0.0]
  - - [34176, 2048, 1, 128]
    - [120, 0.0]
  - - [31616, 512, 1, 128]
    - [120, 0.0]
  - - [35456, 2048, 1, 128]
    - [120, 0.0]
  - - [43136, 8192, 1, 128]
    - [120, 0.0]
  - - [33024, 128, 1, 128]
    - [119, 0.0]
  - - [38656, 4096, 1, 128]
    - [120, 0.0]
  - - [33408, 17409, 1, 128]
    - [120, 0.0]
  - - [39424, 1024, 1, 128]
    - [120, 0.0]
  - - [29312, 13313, 1, 128]
    - [120, 0.0]
  - - [35840, 4096, 1, 128]
    - [120, 0.0]
  - - [42496, 512, 1, 128]
    - [120, 0.0]
  - - [37632, 8192, 1, 128]
    - [120, 0.0]
  - - [41088, 2048, 1, 128]
    - [120, 0.0]
  - - [38528, 512, 1, 128]
    - [120, 0.0]
  - - [35072, 2048, 1, 128]
    - [120, 0.0]
  - - [31104, 4096, 1, 128]
    - [120, 0.0]
  - - [33280, 4096, 1, 128]
    - [120, 0.0]
  - - [43904, 8192, 1, 128]
    - [120, 0.0]
  - - [34816, 8192, 1, 128]
    - [120, 0.0]
  - - [38016, 1024, 1, 128]
    - [120, 0.0]
  - - [33152, 128, 1, 128]
    - [118, 0.0]
  - - [42496, 128, 1, 128]
    - [111, 0.0]
  - - [40832, 24961, 1, 128]
    - [120, 0.0]
  - - [41728, 1024, 1, 128]
    - [120, 0.0]
  - - [41472, 25473, 1, 128]
    - [120, 0.0]
  - - [34560, 2048, 1, 128]
    - [120, 0.0]
  - - [31616, 15617, 1, 128]
    - [120, 0.0]
  - - [33664, 4096, 1, 128]
    - [120, 0.0]
  - - [35328, 8192, 1, 128]
    - [120, 0.0]
  - - [39808, 4096, 1, 128]
    - [120, 0.0]
  - - [37248, 512, 1, 128]
    - [120, 0.0]
  - - [31360, 4096, 1, 128]
    - [120, 0.0]
  - - [41344, 8192, 1, 128]
    - [120, 0.0]
  - - [32000, 512, 1, 128]
    - [120, 0.0]
  - - [35968, 19969, 1, 128]
    - [120, 0.0]
  - - [30080, 14081, 1, 128]
    - [113, 0.0]
  - - [35840, 8192, 1, 128]
    - [120, 0.0]
  - - [44672, 2048, 1, 128]
    - [120, 0.0]
  - - [31872, 2048, 1, 128]
    - [120, 0.0]
  - - [42496, 4096, 1, 128]
    - [120, 0.0]
  - - [43776, 128, 1, 128]
    - [120, 0.0]
  - - [40704, 2048, 1, 128]
    - [120, 0.0]
  - - [34432, 128, 1, 128]
    - [111, 0.0]
  - - [44544, 2048, 1, 128]
    - [120, 0.0]
  - - [32384, 16385, 1, 128]
    - [120, 0.0]
  - - [43776, 27905, 1, 128]
    - [120, 0.0]
  - - [44032, 4096, 1, 128]
    - [120, 0.0]
  - - [36480, 512, 1, 128]
    - [120, 0.0]
  - - [44160, 1024, 1, 128]
    - [120, 0.0]
  - - [41216, 4096, 1, 128]
    - [120, 0.0]
  - - [44032, 2048, 1, 128]
    - [120, 0.0]
  - - [33152, 2048, 1, 128]
    - [120, 0.0]
  - - [41984, 25985, 1, 128]
    - [120, 0.0]
  - - [39552, 512, 1, 128]
    - [120, 0.0]
  - - [41344, 25473, 1, 128]
    - [120, 0.0]
  - - [40960, 4096, 1, 128]
    - [120, 0.0]
  - - [32640, 128, 1, 128]
    - [111, 0.0]
  - - [35968, 4096, 1, 128]
    - [120, 0.0]
  - - [33536, 4096, 1, 128]
    - [120, 0.0]
  - - [30976, 15105, 1, 128]
    - [120, 0.0]
  - - [35072, 8192, 1, 128]
    - [120, 0.0]
  - - [39424, 23425, 1, 128]
    - [120, 0.0]
  - - [43520, 1024, 1, 128]
    - [120, 0.0]
  - - [44288, 28417, 1, 128]
    - [120, 0.0]
  - - [30848, 128, 1, 128]
    - [119, 0.0]
  - - [35712, 512, 1, 128]
    - [120, 0.0]
  - - [44160, 2048, 1, 128]
    - [120, 0.0]
  - - [34048, 8192, 1, 128]
    - [120, 0.0]
  - - [40448, 24449, 1, 128]
    - [120, 0.0]
  - - [39168, 23297, 1, 128]
    - [120, 0.0]
  - - [32128, 1024, 1, 128]
    - [120, 0.0]
  - - [36864, 20993, 1, 128]
    - [120, 0.0]
  - - [40064, 1024, 1, 128]
    - [120, 0.0]
  - - [38784, 8192, 1, 128]
    - [120, 0.0]
  - - [37248, 2048, 1, 128]
    - [120, 0.0]
  - - [34560, 4096, 1, 128]
    - [120, 0.0]
  - - [39040, 23041, 1, 128]
    - [120, 0.0]
  - - [36480, 1024, 1, 128]
    - [120, 0.0]
  - - [39040, 2048, 1, 128]
    - [120, 0.0]
  - - [39808, 23809, 1, 128]
    - [113, 0.0]
  - - [36992, 4096, 1, 128]
    - [120, 0.0]
  - - [32768, 16897, 1, 128]
    - [120, 0.0]
  - - [30976, 2048, 1, 128]
    - [120, 0.0]
  - - [32640, 16769, 1, 128]
    - [113, 0.0]
  - - [29824, 13953, 1, 128]
    - [120, 0.0]
  - - [29184, 128, 1, 128]
    - [118, 0.0]
  - - [30720, 8192, 1, 128]
    - [120, 0.0]
  - - [30848, 2048, 1, 128]
    - [120, 0.0]
  - - [38016, 4096, 1, 128]
    - [120, 0.0]
  - - [35456, 8192, 1, 128]
    - [120, 0.0]
  - - [36992, 21121, 1, 128]
    - [120, 0.0]
  - - [36736, 2048, 1, 128]
    - [120, 0.0]
  - - [37888, 128, 1, 128]
    - [120, 0.0]
  - - [39808, 2048, 1, 128]
    - [120, 0.0]
  - - [41856, 25985, 1, 128]
    - [120, 0.0]
  - - [34688, 4096, 1, 128]
    - [120, 0.0]
  - - [38784, 1024, 1, 128]
    - [120, 0.0]
  - - [40960, 25089, 1, 128]
    - [120, 0.0]
  - - [32000, 4096, 1, 128]
    - [120, 0.0]
  - - [41600, 25601, 1, 128]
    - [120, 0.0]
  - - [37504, 512, 1, 128]
    - [120, 0.0]
  - - [32128, 16129, 1, 128]
    - [120, 0.0]
  - - [37248, 21377, 1, 128]
    - [120, 0.0]
  - - [35840, 512, 1, 128]
    - [120, 0.0]
  - - [36096, 128, 1, 128]
    - [111, 0.0]
  - - [32512, 8192, 1, 128]
    - [120, 0.0]
  - - [36736, 8192, 1, 128]
    - [120, 0.0]
  - - [42880, 1024, 1, 128]
    - [120, 0.0]
  - - [44288, 8192, 1, 128]
    - [120, 0.0]
  - - [36224, 1024, 1, 128]
    - [120, 0.0]
  - - [41344, 25345, 1, 128]
    - [120, 0.0]
  - - [32384, 512, 1, 128]
    - [120, 0.0]
  - - [38272, 4096, 1, 128]
    - [120, 0.0]
  - - [37120, 2048, 1, 128]
    - [120, 0.0]
  - - [33152, 8192, 1, 128]
    - [120, 0.0]
  - - [36096, 4096, 1, 128]
    - [120, 0.0]
  - - [34560, 18689, 1, 128]
    - [120, 0.0]
  - - [36864, 4096, 1, 128]
    - [120, 0.0]
  - - [34944, 512, 1, 128]
    - [120, 0.0]
  - - [37760, 128, 1, 128]
    - [118, 0.0]
  - - [31616, 128, 1, 128]
    - [111, 0.0]
  - - [36224, 4096, 1, 128]
    - [120, 0.0]
  - - [40576, 24577, 1, 128]
    - [120, 0.0]
  - - [34688, 1024, 1, 128]
    - [120, 0.0]
  - - [40192, 1024, 1, 128]
    - [120, 0.0]
  - - [44672, 512, 1, 128]
    - [120, 0.0]
  - - [33664, 1024, 1, 128]
    - [120, 0.0]
  - - [39424, 512, 1, 128]
    - [120, 0.0]
  - - [44416, 1024, 1, 128]
    - [120, 0.0]
  - - [33408, 2048, 1, 128]
    - [120, 0.0]
  - - [43648, 8192, 1, 128]
    - [120, 0.0]
  - - [43520, 27649, 1, 128]
    - [120, 0.0]
  - - [40448, 1024, 1, 128]
    - [120, 0.0]
  - - [33152, 17153, 1, 128]
    - [120, 0.0]
  - - [33024, 512, 1, 128]
    - [120, 0.0]
  - - [39680, 128, 1, 128]
    - [120, 0.0]
  - - [29696, 4096, 1, 128]
    - [120, 0.0]
  - - [42112, 2048, 1, 128]
    - [120, 0.0]
  - - [38016, 8192, 1, 128]
    - [120, 0.0]
  - - [30464, 8192, 1, 128]
    - [120, 0.0]
  - - [43648, 128, 1, 128]
    - [113, 0.0]
  - - [32896, 16897, 1, 128]
    - [120, 0.0]
  - - [43008, 8192, 1, 128]
    - [120, 0.0]
  - - [34304, 512, 1, 128]
    - [120, 0.0]
  - - [38528, 128, 1, 128]
    - [120, 0.0]
  - - [41216, 1024, 1, 128]
    - [120, 0.0]
  - - [38272, 22401, 1, 128]
    - [120, 0.0]
  - - [34048, 4096, 1, 128]
    - [120, 0.0]
  - - [30720, 512, 1, 128]
    - [120, 0.0]
  - - [41728, 512, 1, 128]
    - [120, 0.0]
  - - [43136, 512, 1, 128]
    - [120, 0.0]
  - - [41088, 1024, 1, 128]
    - [120, 0.0]
  - - [33536, 1024, 1, 128]
    - [120, 0.0]
  - - [41088, 25089, 1, 128]
    - [120, 0.0]
  - - [36352, 20353, 1, 128]
    - [120, 0.0]
  - - [29184, 1024, 1, 128]
    - [120, 0.0]
  - - [44800, 128, 1, 128]
    - [111, 0.0]
  - - [41600, 8192, 1, 128]
    - [120, 0.0]
  - - [44416, 28545, 1, 128]
    - [120, 0.0]
  - - [34048, 512, 1, 128]
    - [120, 0.0]
  - - [32128, 16257, 1, 128]
    - [120, 0.0]
  - - [44288, 4096, 1, 128]
    - [120, 0.0]
  - - [34432, 18433, 1, 128]
    - [120, 0.0]
  - - [41856, 25857, 1, 128]
    - [120, 0.0]
  - - [32128, 2048, 1, 128]
    - [120, 0.0]
  - - [34688, 512, 1, 128]
    - [120, 0.0]
  - - [39936, 4096, 1, 128]
    - [120, 0.0]
  - - [38656, 1024, 1, 128]
    - [120, 0.0]
  - - [37760, 512, 1, 128]
    - [120, 0.0]
  - - [30336, 512, 1, 128]
    - [120, 0.0]
  - - [38016, 22017, 1, 128]
    - [120, 0.0]
  - - [44544, 4096, 1, 128]
    - [120, 0.0]
  - - [38912, 8192, 1, 128]
    - [120, 0.0]
  - - [39936, 128, 1, 128]
    - [113, 0.0]
  - - [36480, 2048, 1, 128]
    - [120, 0.0]
  - - [35200, 4096, 1, 128]
    - [120, 0.0]
  - - [30976, 14977, 1, 128]
    - [120, 0.0]
  - - [31104, 15105, 1, 128]
    - [120, 0.0]
  - - [40832, 1024, 1, 128]
    - [120, 0.0]
  - - [32384, 16513, 1, 128]
    - [120, 0.0]
  - - [43392, 4096, 1, 128]
    - [120, 0.0]
  - - [32768, 4096, 1, 128]
    - [120, 0.0]
  - - [38272, 22273, 1, 128]
    - [120, 0.0]
  - - [32128, 512, 1, 128]
    - [120, 0.0]
  - - [32896, 2048, 1, 128]
    - [120, 0.0]
  - - [37376, 21505, 1, 128]
    - [120, 0.0]
  - - [41856, 1024, 1, 128]
    - [120, 0.0]
  - - [33536, 8192, 1, 128]
    - [120, 0.0]
  - - [29568, 1024, 1, 128]
    - [120, 0.0]
  - - [44032, 28033, 1, 128]
    - [120, 0.0]
  - - [33280, 8192, 1, 128]
    - [120, 0.0]
  - - [39296, 4096, 1, 128]
    - [120, 0.0]
  - - [30592, 14593, 1, 128]
    - [113, 0.0]
  - - [37504, 8192, 1, 128]
    - [120, 0.0]
  - - [30336, 14465, 1, 128]
    - [120, 0.0]
  - - [29952, 2048, 1, 128]
    - [120, 0.0]
  - - [40832, 512, 1, 128]
    - [120, 0.0]
  - - [44672, 28673, 1, 128]
    - [120, 0.0]
  - - [30080, 4096, 1, 128]
    - [120, 0.0]
  - - [37888, 2048, 1, 128]
    - [120, 0.0]
  - - [37632, 21761, 1, 128]
    - [120, 0.0]
  - - [29824, 8192, 1, 128]
    - [120, 0.0]
  - - [35328, 19457, 1, 128]
    - [120, 0.0]
  - - [37376, 4096, 1, 128]
    - [120, 0.0]
  - - [33792, 17921, 1, 128]
    - [120, 0.0]
  - - [34304, 8192, 1, 128]
    - [120, 0.0]
  - - [42752, 512, 1, 128]
    - [120, 0.0]
  - - [36992, 2048, 1, 128]
    - [120, 0.0]
  - - [39168, 4096, 1, 128]
    - [120, 0.0]
  - - [31360, 15489, 1, 128]
    - [120, 0.0]
  - - [43520, 8192, 1, 128]
    - [120, 0.0]
  - - [30080, 2048, 1, 128]
    - [120, 0.0]
  - - [30720, 4096, 1, 128]
    - [120, 0.0]
  - - [34176, 128, 1, 128]
    - [113, 0.0]
  - - [32768, 16769, 1, 128]
    - [120, 0.0]
  - - [35072, 128, 1, 128]
    - [112, 0.0]
  - - [35712, 4096, 1, 128]
    - [120, 0.0]
  - - [36480, 4096, 1, 128]
    - [120, 0.0]
  - - [39424, 4096, 1, 128]
    - [120, 0.0]
  - - [38400, 128, 1, 128]
    - [113, 0.0]
  - - [34432, 2048, 1, 128]
    - [120, 0.0]
  - - [41344, 512, 1, 128]
    - [120, 0.0]
  - - [35200, 512, 1, 128]
    - [120, 0.0]
  - - [39936, 8192, 1, 128]
    - [120, 0.0]
  - - [31488, 128, 1, 128]
    - [120, 0.0]
  - - [43008, 512, 1, 128]
    - [120, 0.0]
  - - [33024, 4096, 1, 128]
    - [120, 0.0]
  - - [36608, 512, 1, 128]
    - [120, 0.0]
  - - [37376, 8192, 1, 128]
    - [120, 0.0]
  - - [29824, 13825, 1, 128]
    - [120, 0.0]
  - - [36352, 2048, 1, 128]
    - [120, 0.0]
  - - [30336, 1024, 1, 128]
    - [120, 0.0]
  - - [44416, 28417, 1, 128]
    - [120, 0.0]
  - - [38144, 22273, 1, 128]
    - [120, 0.0]
  - - [28928, 2048, 1, 128]
    - [120, 0.0]
  - - [29568, 13697, 1, 128]
    - [120, 0.0]
  - - [43136, 27137, 1, 128]
    - [120, 0.0]
  - - [42112, 4096, 1, 128]
    - [120, 0.0]
  - - [40960, 512, 1, 128]
    - [120, 0.0]
  - - [35584, 1024, 1, 128]
    - [120, 0.0]
  - - [31232, 15361, 1, 128]
    - [120, 0.0]
  - - [40960, 8192, 1, 128]
    - [120, 0.0]
  - - [31232, 1024, 1, 128]
    - [120, 0.0]
  - - [29312, 512, 1, 128]
    - [120, 0.0]
  - - [44416, 512, 1, 128]
    - [120, 0.0]
  - - [42240, 512, 1, 128]
    - [120, 0.0]
  - - [31232, 8192, 1, 128]
    - [120, 0.0]
  - - [35072, 19201, 1, 128]
    - [120, 0.0]
  - - [29568, 128, 1, 128]
    - [112, 0.0]
  - - [33792, 2048, 1, 128]
    - [120, 0.0]
  - - [35712, 2048, 1, 128]
    - [120, 0.0]
  - - [40576, 128, 1, 128]
    - [119, 0.0]
  - - [40704, 1024, 1, 128]
    - [120, 0.0]
  - - [29824, 1024, 1, 128]
    - [120, 0.0]
  - - [33536, 17665, 1, 128]
    - [120, 0.0]
  - - [43008, 27009, 1, 128]
    - [120, 0.0]
  - - [34304, 2048, 1, 128]
    - [120, 0.0]
  - - [37120, 21249, 1, 128]
    - [120, 0.0]
  - - [41600, 1024, 1, 128]
    - [120, 0.0]
  - - [33024, 1024, 1, 128]
    - [120, 0.0]
  - - [42368, 512, 1, 128]
    - [120, 0.0]
  - - [30592, 14721, 1, 128]
    - [120, 0.0]
  - - [29696, 2048, 1, 128]
    - [120, 0.0]
  - - [31232, 128, 1, 128]
    - [120, 0.0]
  - - [38784, 22785, 1, 128]
    - [120, 0.0]
  - - [32896, 1024, 1, 128]
    - [120, 0.0]
  - - [32128, 128, 1, 128]
    - [113, 0.0]
  - - [35968, 8192, 1, 128]
    - [120, 0.0]
  - - [38400, 2048, 1, 128]
    - [120, 0.0]
  - - [36864, 2048, 1, 128]
    - [120, 0.0]
  - - [31616, 4096, 1, 128]
    - [120, 0.0]
  - - [34688, 18817, 1, 128]
    - [120, 0.0]
  - - [42624, 4096, 1, 128]
    - [120, 0.0]
  - - [29312, 1024, 1, 128]
    - [120, 0.0]
  - - [37760, 2048, 1, 128]
    - [120, 0.0]
  - - [39808, 512, 1, 128]
    - [120, 0.0]
  - - [41472, 128, 1, 128]
    - [111, 0.0]
  - - [32128, 4096, 1, 128]
    - [120, 0.0]
  - - [43520, 4096, 1, 128]
    - [120, 0.0]
  - - [41472, 512, 1, 128]
    - [120, 0.0]
  - - [38912, 22913, 1, 128]
    - [120, 0.0]
  - - [30464, 1024, 1, 128]
    - [120, 0.0]
  - - [33280, 128, 1, 128]
    - [113, 0.0]
  - - [31872, 15873, 1, 128]
    - [120, 0.0]
  - - [36352, 4096, 1, 128]
    - [120, 0.0]
  - - [30720, 2048, 1, 128]
    - [120, 0.0]
  - - [33792, 128, 1, 128]
    - [120, 0.0]
  - - [36096, 8192, 1, 128]
    - [120, 0.0]
  - - [38784, 128, 1, 128]
    - [120, 0.0]
  - - [30208, 2048, 1, 128]
    - [120, 0.0]
  - - [34432, 4096, 1, 128]
    - [120, 0.0]
  - - [42880, 128, 1, 128]
    - [120, 0.0]
  - - [31616, 15745, 1, 128]
    - [120, 0.0]
  - - [40960, 2048, 1, 128]
    - [120, 0.0]
  - - [41344, 128, 1, 128]
    - [113, 0.0]
  - - [41728, 25857, 1, 128]
    - [120, 0.0]
  - - [32896, 512, 1, 128]
    - [120, 0.0]
  - - [41728, 2048, 1, 128]
    - [120, 0.0]
  - - [42368, 26369, 1, 128]
    - [120, 0.0]
  - - [30720, 14721, 1, 128]
    - [120, 0.0]
  - - [37376, 512, 1, 128]
    - [120, 0.0]
  - - [35456, 19457, 1, 128]
    - [120, 0.0]
  - - [29184, 13185, 1, 128]
    - [120, 0.0]
  - - [34944, 128, 1, 128]
    - [119, 0.0]
  - - [36608, 20609, 1, 128]
    - [120, 0.0]
  - - [35584, 19585, 1, 128]
    - [120, 0.0]
  - - [42880, 8192, 1, 128]
    - [120, 0.0]
  - - [39936, 1024, 1, 128]
    - [120, 0.0]
  - - [34944, 19073, 1, 128]
    - [120, 0.0]
  - - [32512, 128, 1, 128]
    - [118, 0.0]
  - - [40064, 512, 1, 128]
    - [120, 0.0]
  - - [30464, 2048, 1, 128]
    - [120, 0.0]
  - - [30592, 8192, 1, 128]
    - [120, 0.0]
  - - [39040, 512, 1, 128]
    - [120, 0.0]
  - - [41088, 128, 1, 128]
    - [120, 0.0]
  - - [29824, 128, 1, 128]
    - [117, 0.0]
  - - [32384, 128, 1, 128]
    - [111, 0.0]
  - - [41728, 25729, 1, 128]
    - [120, 0.0]
  - - [30976, 4096, 1, 128]
    - [120, 0.0]
  - - [42624, 128, 1, 128]
    - [113, 0.0]
  - - [42112, 512, 1, 128]
    - [120, 0.0]
  - - [38784, 2048, 1, 128]
    - [120, 0.0]
  - - [35200, 8192, 1, 128]
    - [120, 0.0]
  - - [30976, 128, 1, 128]
    - [112, 0.0]
  - - [32640, 16641, 1, 128]
    - [120, 0.0]
  - - [41984, 8192, 1, 128]
    - [120, 0.0]
  - - [30080, 128, 1, 128]
    - [113, 0.0]
  - - [35584, 512, 1, 128]
    - [120, 0.0]
  - - [44800, 2048, 1, 128]
    - [120, 0.0]
  - - [34048, 128, 1, 128]
    - [118, 0.0]
  - - [35712, 1024, 1, 128]
    - [120, 0.0]
  - - [43136, 128, 1, 128]
    - [113, 0.0]
  - - [33280, 1024, 1, 128]
    - [120, 0.0]
  - - [34816, 18945, 1, 128]
    - [120, 0.0]
  - - [40704, 8192, 1, 128]
    - [120, 0.0]
  - - [34304, 128, 1, 128]
    - [111, 0.0]
  - - [39936, 512, 1, 128]
    - [120, 0.0]
  - - [36096, 2048, 1, 128]
    - [120, 0.0]
  - - [40832, 8192, 1, 128]
    - [120, 0.0]
  - - [37760, 4096, 1, 128]
    - [120, 0.0]
  - - [36736, 512, 1, 128]
    - [120, 0.0]
  - - [31744, 8192, 1, 128]
    - [120, 0.0]
  - - [33920, 1024, 1, 128]
    - [120, 0.0]
  - - [39808, 128, 1, 128]
    - [120, 0.0]
  - - [36608, 2048, 1, 128]
    - [120, 0.0]
  - - [30464, 14593, 1, 128]
    - [120, 0.0]
  - - [35200, 19201, 1, 128]
    - [113, 0.0]
  - - [41472, 1024, 1, 128]
    - [120, 0.0]
  - - [30720, 128, 1, 128]
    - [118, 0.0]
  - - [41600, 128, 1, 128]
    - [120, 0.0]
  - - [38144, 22145, 1, 128]
    - [120, 0.0]
  - - [37120, 4096, 1, 128]
    - [120, 0.0]
  - - [40704, 24705, 1, 128]
    - [120, 0.0]
  - - [41088, 25217, 1, 128]
    - [120, 0.0]
  - - [43776, 8192, 1, 128]
    - [120, 0.0]
  - - [38912, 1024, 1, 128]
    - [120, 0.0]
  - - [43008, 2048, 1, 128]
    - [120, 0.0]
  - - [42496, 26497, 1, 128]
    - [120, 0.0]
  - - [33536, 512, 1, 128]
    - [120, 0.0]
  - - [43520, 512, 1, 128]
    - [120, 0.0]
  - - [39040, 23169, 1, 128]
    - [120, 0.0]
  - - [29568, 2048, 1, 128]
    - [120, 0.0]
  - - [44672, 8192, 1, 128]
    - [120, 0.0]
  - - [29824, 512, 1, 128]
    - [120, 0.0]
  - - [34944, 2048, 1, 128]
    - [120, 0.0]
  - - [33408, 4096, 1, 128]
    - [120, 0.0]
  - - [41600, 25729, 1, 128]
    - [120, 0.0]
  - - [40832, 2048, 1, 128]
    - [120, 0.0]
  - - [38912, 128, 1, 128]
    - [111, 0.0]
  - - [34048, 2048, 1, 128]
    - [120, 0.0]
  - - [43904, 2048, 1, 128]
    - [120, 0.0]
  - - [39296, 23297, 1, 128]
    - [120, 0.0]
  - - [31232, 4096, 1, 128]
    - [120, 0.0]
  - - [35840, 1024, 1, 128]
    - [120, 0.0]
  - - [28928, 128, 1, 128]
    - [110, 0.0]
  - - [42752, 2048, 1, 128]
    - [120, 0.0]
  - - [44032, 1024, 1, 128]
    - [120, 0.0]
  - - [29440, 13569, 1, 128]
    - [120, 0.0]
  - - [35456, 19585, 1, 128]
    - [120, 0.0]
  - - [35840, 19841, 1, 128]
    - [120, 0.0]
  - - [31360, 128, 1, 128]
    - [112, 0.0]
  - - [40192, 2048, 1, 128]
    - [120, 0.0]
  - - [33920, 8192, 1, 128]
    - [120, 0.0]
  - - [43648, 512, 1, 128]
    - [120, 0.0]
  - - [30080, 14209, 1, 128]
    - [120, 0.0]
  - - [39680, 23809, 1, 128]
    - [120, 0.0]
  - - [32512, 512, 1, 128]
    - [120, 0.0]
  - - [34816, 2048, 1, 128]
    - [120, 0.0]
  - - [43392, 1024, 1, 128]
    - [120, 0.0]
  - - [39040, 4096, 1, 128]
    - [120, 0.0]
  - - [43264, 4096, 1, 128]
    - [120, 0.0]
  - - [44416, 2048, 1, 128]
    - [120, 0.0]
  - - [31488, 512, 1, 128]
    - [120, 0.0]
  - - [31616, 1024, 1, 128]
    - [120, 0.0]
  - - [44032, 8192, 1, 128]
    - [120, 0.0]
  - - [39424, 23553, 1, 128]
    - [120, 0.0]
  - - [31360, 8192, 1, 128]
    - [120, 0.0]
  - - [42752, 128, 1, 128]
    - [120, 0.0]
  - - [40192, 512, 1, 128]
    - [120, 0.0]
  - - [36096, 20225, 1, 128]
    - [120, 0.0]
  - - [41984, 26113, 1, 128]
    - [120, 0.0]
  - - [39936, 2048, 1, 128]
    - [120, 0.0]
  - - [42880, 2048, 1, 128]
    - [120, 0.0]
  - - [29440, 128, 1, 128]
    - [119, 0.0]
  - - [40192, 128, 1, 128]
    - [111, 0.0]
  - - [36608, 4096, 1, 128]
    - [120, 0.0]
  - - [37760, 21761, 1, 128]
    - [113, 0.0]
  - - [44160, 28161, 1, 128]
    - [120, 0.0]
  - - [44288, 512, 1, 128]
    - [120, 0.0]
  - - [29056, 13185, 1, 128]
    - [120, 0.0]
  - - [43904, 512, 1, 128]
    - [120, 0.0]
  - - [29696, 128, 1, 128]
    - [120, 0.0]
  - - [36224, 8192, 1, 128]
    - [120, 0.0]
  - - [33024, 2048, 1, 128]
    - [120, 0.0]
  - - [44032, 28161, 1, 128]
    - [120, 0.0]
  - - [44032, 128, 1, 128]
    - [113, 0.0]
  - - [38784, 512, 1, 128]
    - [120, 0.0]
  - - [29056, 8192, 1, 128]
    - [120, 0.0]
  - - [33920, 18049, 1, 128]
    - [120, 0.0]
  - - [34816, 1024, 1, 128]
    - [120, 0.0]
  - - [29056, 128, 1, 128]
    - [113, 0.0]
  - - [39552, 1024, 1, 128]
    - [120, 0.0]
  - - [36992, 8192, 1, 128]
    - [120, 0.0]
  - - [44544, 1024, 1, 128]
    - [120, 0.0]
  - - [43904, 27905, 1, 128]
    - [120, 0.0]
  - - [29440, 512, 1, 128]
    - [120, 0.0]
  - - [29568, 8192, 1, 128]
    - [120, 0.0]
  - - [41472, 2048, 1, 128]
    - [120, 0.0]
  - - [29184, 8192, 1, 128]
    - [120, 0.0]
  - - [33408, 512, 1, 128]
    - [120, 0.0]
  - - [38656, 22785, 1, 128]
    - [120, 0.0]
  - - [31744, 15745, 1, 128]
    - [120, 0.0]
  - - [38656, 2048, 1, 128]
    - [120, 0.0]
  - - [30080, 8192, 1, 128]
    - [120, 0.0]
  - - [44672, 128, 1, 128]
    - [120, 0.0]
  - - [40704, 24833, 1, 128]
    - [120, 0.0]
  - - [33792, 8192, 1, 128]
    - [120, 0.0]
  - - [33920, 512, 1, 128]
    - [120, 0.0]
  - - [40576, 1024, 1, 128]
    - [120, 0.0]
  - - [36224, 20225, 1, 128]
    - [120, 0.0]
  - - [34432, 1024, 1, 128]
    - [120, 0.0]
  - - [31488, 15617, 1, 128]
    - [120, 0.0]
  - - [40576, 2048, 1, 128]
    - [120, 0.0]
  - - [30208, 512, 1, 128]
    - [120, 0.0]
  - - [36480, 128, 1, 128]
    - [118, 0.0]
  - - [37504, 21633, 1, 128]
    - [120, 0.0]
  - - [32896, 17025, 1, 128]
    - [120, 0.0]
  - - [39168, 2048, 1, 128]
    - [120, 0.0]
  - - [29440, 2048, 1, 128]
    - [120, 0.0]
  - - [29440, 13441, 1, 128]
    - [120, 0.0]
  - - [32640, 8192, 1, 128]
    - [120, 0.0]
  - - [35072, 19073, 1, 128]
    - [120, 0.0]
  - - [33152, 512, 1, 128]
    - [120, 0.0]
  - - [40576, 8192, 1, 128]
    - [120, 0.0]
  - - [34944, 8192, 1, 128]
    - [120, 0.0]
  - - [38656, 128, 1, 128]
    - [119, 0.0]
  - - [33536, 17537, 1, 128]
    - [120, 0.0]
  - - [29952, 512, 1, 128]
    - [120, 0.0]
  - - [31488, 2048, 1, 128]
    - [120, 0.0]
  - - [31872, 4096, 1, 128]
    - [120, 0.0]
  - - [31232, 15233, 1, 128]
    - [120, 0.0]
  - - [38912, 23041, 1, 128]
    - [120, 0.0]
  - - [31232, 2048, 1, 128]
    - [120, 0.0]
  - - [40448, 8192, 1, 128]
    - [120, 0.0]
  - - [36352, 128, 1, 128]
    - [111, 0.0]
  - - [43776, 4096, 1, 128]
    - [120, 0.0]
  - - [32000, 8192, 1, 128]
    - [120, 0.0]
  - - [37760, 8192, 1, 128]
    - [120, 0.0]
  - - [30080, 1024, 1, 128]
    - [120, 0.0]
  - - [44544, 128, 1, 128]
    - [120, 0.0]
  - - [29696, 1024, 1, 128]
    - [120, 0.0]
  - - [32640, 512, 1, 128]
    - [120, 0.0]
  - - [44416, 128, 1, 128]
    - [120, 0.0]
  - - [41216, 512, 1, 128]
    - [120, 0.0]
  - - [31872, 512, 1, 128]
    - [120, 0.0]
  - - [34432, 512, 1, 128]
    - [120, 0.0]
  - - [34560, 1024, 1, 128]
    - [120, 0.0]
  - - [42240, 128, 1, 128]
    - [113, 0.0]
  - - [44288, 28289, 1, 128]
    - [120, 0.0]
  - - [30336, 14337, 1, 128]
    - [120, 0.0]
  - - [32384, 2048, 1, 128]
    - [120, 0.0]
  - - [38400, 22401, 1, 128]
    - [120, 0.0]
  - - [39296, 1024, 1, 128]
    - [120, 0.0]
  - - [28928, 8192, 1, 128]
    - [120, 0.0]
  - - [40320, 2048, 1, 128]
    - [120, 0.0]
  - - [31104, 15233, 1, 128]
    - [113, 0.0]
  - - [39680, 512, 1, 128]
    - [120, 0.0]
  - - [34048, 18049, 1, 128]
    - [120, 0.0]
  - - [30720, 1024, 1, 128]
    - [120, 0.0]
  - - [42880, 26881, 1, 128]
    - [120, 0.0]
  - - [32896, 8192, 1, 128]
    - [120, 0.0]
  - - [43264, 8192, 1, 128]
    - [120, 0.0]
  - - [37632, 4096, 1, 128]
    - [120, 0.0]
  - - [32256, 4096, 1, 128]
    - [120, 0.0]
  - - [37248, 4096, 1, 128]
    - [120, 0.0]
  - - [33280, 17409, 1, 128]
    - [120, 0.0]
  - - [36096, 512, 1, 128]
    - [120, 0.0]
  - - [37120, 21121, 1, 128]
    - [120, 0.0]
  - - [32896, 128, 1, 128]
    - [119, 0.0]
  - - [36352, 20481, 1, 128]
    - [120, 0.0]
  - - [43392, 2048, 1, 128]
    - [120, 0.0]
  - - [36352, 512, 1, 128]
    - [120, 0.0]
  - - [29056, 13057, 1, 128]
    - [120, 0.0]
  - - [29056, 4096, 1, 128]
    - [120, 0.0]
  - - [37888, 4096, 1, 128]
    - [120, 0.0]
  - - [40320, 512, 1, 128]
    - [120, 0.0]
  - - [39168, 128, 1, 128]
    - [119, 0.0]
  - - [41472, 8192, 1, 128]
    - [120, 0.0]
  - - [34560, 512, 1, 128]
    - [120, 0.0]
  - - [34176, 18305, 1, 128]
    - [120, 0.0]
  - - [34688, 8192, 1, 128]
    - [120, 0.0]
  - - [29696, 13825, 1, 128]
    - [120, 0.0]
  - - [33152, 17281, 1, 128]
    - [120, 0.0]
  - - [30208, 8192, 1, 128]
    - [120, 0.0]
  - - [43648, 27649, 1, 128]
    - [120, 0.0]
  - - [31360, 2048, 1, 128]
    - [120, 0.0]
  - - [41984, 128, 1, 128]
    - [118, 0.0]
  - - [38528, 2048, 1, 128]
    - [120, 0.0]
  - - [32256, 16385, 1, 128]
    - [120, 0.0]
  - - [42240, 1024, 1, 128]
    - [120, 0.0]
  - - [32000, 16001, 1, 128]
    - [113, 0.0]
  - - [37248, 1024, 1, 128]
    - [120, 0.0]
  - - [32256, 1024, 1, 128]
    - [120, 0.0]
  - - [39296, 23425, 1, 128]
    - [120, 0.0]
  - - [43008, 4096, 1, 128]
    - [120, 0.0]
  - - [31104, 128, 1, 128]
    - [119, 0.0]
  - - [38656, 8192, 1, 128]
    - [120, 0.0]
  - - [44288, 128, 1, 128]
    - [113, 0.0]
  - - [38528, 22657, 1, 128]
    - [120, 0.0]
  - - [39552, 128, 1, 128]
    - [120, 0.0]
  - - [37376, 21377, 1, 128]
    - [120, 0.0]
  - - [28928, 13057, 1, 128]
    - [120, 0.0]
  - - [43264, 27265, 1, 128]
    - [120, 0.0]
  - - [35328, 4096, 1, 128]
    - [120, 0.0]
  - - [30848, 4096, 1, 128]
    - [120, 0.0]
  - - [44800, 28801, 1, 128]
    - [120, 0.0]
  - - [35456, 512, 1, 128]
    - [120, 0.0]
  - - [40960, 24961, 1, 128]
    - [120, 0.0]
  - - [39936, 23937, 1, 128]
    - [120, 0.0]
  - - [31744, 1024, 1, 128]
    - [120, 0.0]
  - - [32128, 8192, 1, 128]
    - [120, 0.0]
  - - [42112, 26113, 1, 128]
    - [120, 0.0]
  - - [31744, 2048, 1, 128]
    - [120, 0.0]
  - - [42112, 1024, 1, 128]
    - [120, 0.0]
  - - [40064, 8192, 1, 128]
    - [120, 0.0]
  - - [38144, 128, 1, 128]
    - [120, 0.0]
  - - [42624, 2048, 1, 128]
    - [120, 0.0]
  - - [36992, 128, 1, 128]
    - [111, 0.0]
  - - [40192, 8192, 1, 128]
    - [120, 0.0]
  - - [40064, 24065, 1, 128]
    - [120, 0.0]
  - - [37760, 21889, 1, 128]
    - [120, 0.0]
  - - [36352, 8192, 1, 128]
    - [120, 0.0]
  - - [44544, 512, 1, 128]
    - [120, 0.0]
  - - [32384, 4096, 1, 128]
    - [120, 0.0]
  - - [39168, 23169, 1, 128]
    - [120, 0.0]
  - - [1408, 897, 1, 128]
    - [103, 0.0]
  - - [16512, 512, 1, 128]
    - [120, 0.0]
  - - [20480, 12673, 1, 128]
    - [120, 0.0]
  - - [20992, 512, 1, 128]
    - [120, 0.0]
  - - [9344, 512, 1, 128]
    - [120, 0.0]
  - - [18048, 2048, 1, 128]
    - [120, 0.0]
  - - [20352, 12673, 1, 128]
    - [120, 0.0]
  - - [640, 128, 1, 128]
    - [99, 0.0]
  - - [28160, 512, 1, 128]
    - [120, 0.0]
  - - [20608, 4096, 1, 128]
    - [120, 0.0]
  - - [19328, 1024, 1, 128]
    - [120, 0.0]
  - - [26496, 4096, 1, 128]
    - [120, 0.0]
  - - [10624, 512, 1, 128]
    - [120, 0.0]
  - - [20352, 1024, 1, 128]
    - [120, 0.0]
  - - [10240, 6529, 1, 128]
    - [120, 0.0]
  - - [22144, 14465, 1, 128]
    - [120, 0.0]
  - - [13184, 2048, 1, 128]
    - [120, 0.0]
  - - [14720, 6913, 1, 128]
    - [113, 0.0]
  - - [21248, 512, 1, 128]
    - [120, 0.0]
  - - [10496, 128, 1, 128]
    - [118, 0.0]
  - - [13056, 5377, 1, 128]
    - [120, 0.0]
  - - [10880, 128, 1, 128]
    - [113, 0.0]
  - - [18688, 512, 1, 128]
    - [120, 0.0]
  - - [22656, 4096, 1, 128]
    - [120, 0.0]
  - - [15232, 1024, 1, 128]
    - [120, 0.0]
  - - [20224, 4096, 1, 128]
    - [120, 0.0]
  - - [6016, 2305, 1, 128]
    - [113, 0.0]
  - - [13184, 4096, 1, 128]
    - [120, 0.0]
  - - [256, 129, 1, 128]
    - [116, 0.0]
  - - [11264, 7553, 1, 128]
    - [120, 0.0]
  - - [18176, 128, 1, 128]
    - [111, 0.0]
  - - [15872, 8193, 1, 128]
    - [120, 0.0]
  - - [26112, 4096, 1, 128]
    - [120, 0.0]
  - - [22784, 2048, 1, 128]
    - [120, 0.0]
  - - [10880, 7297, 1, 128]
    - [120, 0.0]
  - - [14720, 2048, 1, 128]
    - [120, 0.0]
  - - [9216, 5633, 1, 128]
    - [120, 0.0]
  - - [23040, 15233, 1, 128]
    - [120, 0.0]
  - - [8832, 5121, 1, 128]
    - [120, 0.0]
  - - [18816, 1024, 1, 128]
    - [120, 0.0]
  - - [128, 129, 1, 128]
    - [99, 0.0]
  - - [15488, 512, 1, 128]
    - [120, 0.0]
  - - [18176, 1024, 1, 128]
    - [120, 0.0]
  - - [16128, 8449, 1, 128]
    - [120, 0.0]
  - - [16000, 2048, 1, 128]
    - [120, 0.0]
  - - [24960, 9089, 1, 128]
    - [120, 0.0]
  - - [14336, 1024, 1, 128]
    - [120, 0.0]
  - - [25472, 8192, 1, 128]
    - [120, 0.0]
  - - [23040, 128, 1, 128]
    - [118, 0.0]
  - - [9472, 512, 1, 128]
    - [118, 0.0]
  - - [19072, 128, 1, 128]
    - [118, 0.0]
  - - [10624, 6913, 1, 128]
    - [120, 0.0]
  - - [7808, 1024, 1, 128]
    - [120, 0.0]
  - - [27008, 11137, 1, 128]
    - [120, 0.0]
  - - [21504, 4096, 1, 128]
    - [120, 0.0]
  - - [7936, 1024, 1, 128]
    - [118, 0.0]
  - - [12928, 5121, 1, 128]
    - [120, 0.0]
  - - [26240, 8192, 1, 128]
    - [120, 0.0]
  - - [18304, 2048, 1, 128]
    - [120, 0.0]
  - - [24576, 1024, 1, 128]
    - [120, 0.0]
  - - [10624, 128, 1, 128]
    - [111, 0.0]
  - - [24576, 128, 1, 128]
    - [120, 0.0]
  - - [25600, 9601, 1, 128]
    - [120, 0.0]
  - - [5248, 128, 1, 128]
    - [110, 0.0]
  - - [24448, 4096, 1, 128]
    - [120, 0.0]
  - - [19328, 128, 1, 128]
    - [119, 0.0]
  - - [24064, 512, 1, 128]
    - [118, 0.0]
  - - [11136, 512, 1, 128]
    - [118, 0.0]
  - - [14592, 1024, 1, 128]
    - [120, 0.0]
  - - [12544, 4737, 1, 128]
    - [120, 0.0]
  - - [17280, 128, 1, 128]
    - [112, 0.0]
  - - [25344, 8192, 1, 128]
    - [120, 0.0]
  - - [4608, 512, 1, 128]
    - [118, 0.0]
  - - [4608, 128, 1, 128]
    - [85, 0.0]
  - - [21760, 512, 1, 128]
    - [120, 0.0]
  - - [7936, 128, 1, 128]
    - [96, 0.0]
  - - [11008, 7425, 1, 128]
    - [113, 0.0]
  - - [13824, 2048, 1, 128]
    - [120, 0.0]
  - - [18048, 512, 1, 128]
    - [120, 0.0]
  - - [19584, 11905, 1, 128]
    - [120, 0.0]
  - - [22656, 512, 1, 128]
    - [120, 0.0]
  - - [4608, 3073, 1, 128]
    - [120, 0.0]
  - - [5504, 128, 1, 128]
    - [117, 0.0]
  - - [4864, 1024, 1, 128]
    - [120, 0.0]
  - - [17664, 1024, 1, 128]
    - [120, 0.0]
  - - [18176, 2048, 1, 128]
    - [120, 0.0]
  - - [2048, 1537, 1, 128]
    - [111, 0.0]
  - - [22528, 128, 1, 128]
    - [113, 0.0]
  - - [21760, 13953, 1, 128]
    - [120, 0.0]
  - - [7040, 128, 1, 128]
    - [111, 0.0]
  - - [3328, 1665, 1, 128]
    - [113, 0.0]
  - - [768, 512, 1, 128]
    - [104, 0.0]
  - - [21504, 13697, 1, 128]
    - [120, 0.0]
  - - [18560, 10881, 1, 128]
    - [113, 0.0]
  - - [2560, 128, 1, 128]
    - [100, 0.0]
  - - [15616, 1024, 1, 128]
    - [120, 0.0]
  - - [19456, 4096, 1, 128]
    - [120, 0.0]
  - - [25600, 2048, 1, 128]
    - [120, 0.0]
  - - [2304, 128, 1, 128]
    - [100, 0.0]
  - - [1664, 1025, 1, 128]
    - [124, 0.0]
  - - [23168, 15361, 1, 128]
    - [120, 0.0]
  - - [9856, 128, 1, 128]
    - [117, 0.0]
  - - [13312, 2048, 1, 128]
    - [120, 0.0]
  - - [19200, 512, 1, 128]
    - [120, 0.0]
  - - [19200, 2048, 1, 128]
    - [120, 0.0]
  - - [23168, 2048, 1, 128]
    - [120, 0.0]
  - - [18688, 128, 1, 128]
    - [111, 0.0]
  - - [13568, 1024, 1, 128]
    - [120, 0.0]
  - - [17792, 9985, 1, 128]
    - [113, 0.0]
  - - [20608, 1024, 1, 128]
    - [120, 0.0]
  - - [11648, 8065, 1, 128]
    - [120, 0.0]
  - - [1280, 128, 1, 128]
    - [110, 0.0]
  - - [16256, 4096, 1, 128]
    - [120, 0.0]
  - - [17024, 1024, 1, 128]
    - [120, 0.0]
  - - [19456, 128, 1, 128]
    - [119, 0.0]
  - - [20736, 512, 1, 128]
    - [120, 0.0]
  - - [14464, 6785, 1, 128]
    - [113, 0.0]
  - - [20736, 13057, 1, 128]
    - [120, 0.0]
  - - [8704, 2048, 1, 128]
    - [120, 0.0]
  - - [640, 512, 1, 128]
    - [100, 0.0]
  - - [768, 129, 1, 128]
    - [99, 0.0]
  - - [27776, 1024, 1, 128]
    - [120, 0.0]
  - - [19200, 11521, 1, 128]
    - [120, 0.0]
  - - [6400, 2048, 1, 128]
    - [120, 0.0]
  - - [14976, 7297, 1, 128]
    - [113, 0.0]
  - - [7040, 2048, 1, 128]
    - [120, 0.0]
  - - [25984, 128, 1, 128]
    - [119, 0.0]
  - - [13696, 128, 1, 128]
    - [112, 0.0]
  - - [2688, 1153, 1, 128]
    - [120, 0.0]
  - - [15232, 2048, 1, 128]
    - [120, 0.0]
  - - [11776, 128, 1, 128]
    - [118, 0.0]
  - - [3328, 512, 1, 128]
    - [111, 0.0]
  - - [11648, 7937, 1, 128]
    - [113, 0.0]
  - - [19456, 2048, 1, 128]
    - [120, 0.0]
  - - [11008, 128, 1, 128]
    - [111, 0.0]
  - - [9984, 6401, 1, 128]
    - [113, 0.0]
  - - [25856, 9857, 1, 128]
    - [120, 0.0]
  - - [4224, 512, 1, 128]
    - [119, 0.0]
  - - [13568, 5761, 1, 128]
    - [120, 0.0]
  - - [5632, 2049, 1, 128]
    - [118, 0.0]
  - - [8832, 2048, 1, 128]
    - [120, 0.0]
  - - [5632, 3969, 1, 128]
    - [120, 0.0]
  - - [25856, 2048, 1, 128]
    - [120, 0.0]
  - - [25472, 2048, 1, 128]
    - [120, 0.0]
  - - [20736, 12929, 1, 128]
    - [113, 0.0]
  - - [14592, 128, 1, 128]
    - [112, 0.0]
  - - [1792, 512, 1, 128]
    - [105, 0.0]
  - - [14208, 2048, 1, 128]
    - [120, 0.0]
  - - [15360, 7681, 1, 128]
    - [120, 0.0]
  - - [5760, 2048, 1, 128]
    - [120, 0.0]
  - - [6400, 512, 1, 128]
    - [118, 0.0]
  - - [5248, 3713, 1, 128]
    - [113, 0.0]
  - - [16768, 1024, 1, 128]
    - [120, 0.0]
  - - [10752, 512, 1, 128]
    - [118, 0.0]
  - - [26624, 2048, 1, 128]
    - [120, 0.0]
  - - [384, 128, 1, 128]
    - [101, 0.0]
  - - [27392, 8192, 1, 128]
    - [120, 0.0]
  - - [24448, 512, 1, 128]
    - [120, 0.0]
  - - [11136, 7553, 1, 128]
    - [113, 0.0]
  - - [17024, 9345, 1, 128]
    - [113, 0.0]
  - - [16000, 8193, 1, 128]
    - [120, 0.0]
  - - [5888, 2048, 1, 128]
    - [120, 0.0]
  - - [18304, 10497, 1, 128]
    - [113, 0.0]
  - - [3968, 128, 1, 128]
    - [92, 0.0]
  - - [14336, 6529, 1, 128]
    - [120, 0.0]
  - - [19840, 128, 1, 128]
    - [119, 0.0]
  - - [25600, 8192, 1, 128]
    - [120, 0.0]
  - - [18688, 11009, 1, 128]
    - [113, 0.0]
  - - [7680, 1024, 1, 128]
    - [120, 0.0]
  - - [7168, 128, 1, 128]
    - [118, 0.0]
  - - [1664, 512, 1, 128]
    - [84, 0.0]
  - - [12544, 1024, 1, 128]
    - [120, 0.0]
  - - [6528, 2048, 1, 128]
    - [120, 0.0]
  - - [19072, 4096, 1, 128]
    - [120, 0.0]
  - - [2048, 512, 1, 128]
    - [125, 0.0]
  - - [13568, 5889, 1, 128]
    - [120, 0.0]
  - - [23680, 16001, 1, 128]
    - [120, 0.0]
  - - [26112, 10113, 1, 128]
    - [120, 0.0]
  - - [15872, 128, 1, 128]
    - [112, 0.0]
  - - [16384, 512, 1, 128]
    - [120, 0.0]
  - - [9856, 6273, 1, 128]
    - [113, 0.0]
  - - [26368, 1024, 1, 128]
    - [120, 0.0]
  - - [16256, 2048, 1, 128]
    - [120, 0.0]
  - - [3968, 2305, 1, 128]
    - [113, 0.0]
  - - [28672, 8192, 1, 128]
    - [120, 0.0]
  - - [10368, 1024, 1, 128]
    - [120, 0.0]
  - - [11008, 1024, 1, 128]
    - [120, 0.0]
  - - [11776, 4097, 1, 128]
    - [120, 0.0]
  - - [26496, 2048, 1, 128]
    - [120, 0.0]
  - - [17792, 4096, 1, 128]
    - [120, 0.0]
  - - [2304, 512, 1, 128]
    - [119, 0.0]
  - - [9216, 2048, 1, 128]
    - [118, 0.0]
  - - [12416, 512, 1, 128]
    - [120, 0.0]
  - - [18048, 128, 1, 128]
    - [119, 0.0]
  - - [21888, 14209, 1, 128]
    - [120, 0.0]
  - - [9344, 5761, 1, 128]
    - [120, 0.0]
  - - [19712, 2048, 1, 128]
    - [120, 0.0]
  - - [12288, 1024, 1, 128]
    - [120, 0.0]
  - - [3584, 1921, 1, 128]
    - [120, 0.0]
  - - [22784, 128, 1, 128]
    - [118, 0.0]
  - - [26880, 128, 1, 128]
    - [120, 0.0]
  - - [17408, 1024, 1, 128]
    - [120, 0.0]
  - - [15488, 4096, 1, 128]
    - [120, 0.0]
  - - [13312, 5633, 1, 128]
    - [120, 0.0]
  - - [22016, 14337, 1, 128]
    - [120, 0.0]
  - - [19328, 2048, 1, 128]
    - [120, 0.0]
  - - [25600, 128, 1, 128]
    - [119, 0.0]
  - - [22784, 15105, 1, 128]
    - [120, 0.0]
  - - [5376, 3713, 1, 128]
    - [113, 0.0]
  - - [14208, 512, 1, 128]
    - [118, 0.0]
  - - [12928, 4096, 1, 128]
    - [120, 0.0]
  - - [768, 257, 1, 128]
    - [101, 0.0]
  - - [27776, 11777, 1, 128]
    - [120, 0.0]
  - - [12032, 1024, 1, 128]
    - [120, 0.0]
  - - [14208, 4096, 1, 128]
    - [120, 0.0]
  - - [19840, 12161, 1, 128]
    - [120, 0.0]
  - - [17536, 512, 1, 128]
    - [120, 0.0]
  - - [19840, 4096, 1, 128]
    - [120, 0.0]
  - - [26624, 512, 1, 128]
    - [120, 0.0]
  - - [27136, 11137, 1, 128]
    - [120, 0.0]
  - - [11008, 512, 1, 128]
    - [120, 0.0]
  - - [1024, 513, 1, 128]
    - [85, 0.0]
  - - [15744, 512, 1, 128]
    - [120, 0.0]
  - - [22016, 128, 1, 128]
    - [119, 0.0]
  - - [9344, 1024, 1, 128]
    - [120, 0.0]
  - - [28544, 1024, 1, 128]
    - [120, 0.0]
  - - [13440, 5633, 1, 128]
    - [120, 0.0]
  - - [21632, 13825, 1, 128]
    - [120, 0.0]
  - - [24064, 4096, 1, 128]
    - [120, 0.0]
  - - [24192, 512, 1, 128]
    - [120, 0.0]
  - - [22912, 15233, 1, 128]
    - [120, 0.0]
  - - [20864, 13185, 1, 128]
    - [113, 0.0]
  - - [8064, 4353, 1, 128]
    - [113, 0.0]
  - - [8704, 5121, 1, 128]
    - [120, 0.0]
  - - [19840, 1024, 1, 128]
    - [120, 0.0]
  - - [15616, 128, 1, 128]
    - [112, 0.0]
  - - [21632, 512, 1, 128]
    - [120, 0.0]
  - - [13440, 512, 1, 128]
    - [118, 0.0]
  - - [23936, 128, 1, 128]
    - [119, 0.0]
  - - [8960, 5377, 1, 128]
    - [120, 0.0]
  - - [27008, 512, 1, 128]
    - [120, 0.0]
  - - [13440, 5761, 1, 128]
    - [120, 0.0]
  - - [3072, 512, 1, 128]
    - [111, 0.0]
  - - [4096, 1024, 1, 128]
    - [118, 0.0]
  - - [7296, 3585, 1, 128]
    - [120, 0.0]
  - - [12416, 4737, 1, 128]
    - [120, 0.0]
  - - [6912, 512, 1, 128]
    - [120, 0.0]
  - - [11136, 2048, 1, 128]
    - [120, 0.0]
  - - [18176, 10369, 1, 128]
    - [120, 0.0]
  - - [14976, 4096, 1, 128]
    - [120, 0.0]
  - - [19712, 4096, 1, 128]
    - [120, 0.0]
  - - [8064, 1024, 1, 128]
    - [120, 0.0]
  - - [9600, 128, 1, 128]
    - [119, 0.0]
  - - [26240, 1024, 1, 128]
    - [120, 0.0]
  - - [5248, 3585, 1, 128]
    - [120, 0.0]
  - - [16768, 2048, 1, 128]
    - [120, 0.0]
  - - [13184, 128, 1, 128]
    - [113, 0.0]
  - - [19328, 11521, 1, 128]
    - [120, 0.0]
  - - [4864, 512, 1, 128]
    - [112, 0.0]
  - - [3584, 2049, 1, 128]
    - [118, 0.0]
  - - [18560, 128, 1, 128]
    - [111, 0.0]
  - - [27392, 11393, 1, 128]
    - [120, 0.0]
  - - [27520, 512, 1, 128]
    - [120, 0.0]
  - - [18176, 4096, 1, 128]
    - [120, 0.0]
  - - [7808, 4225, 1, 128]
    - [120, 0.0]
  - - [15232, 128, 1, 128]
    - [112, 0.0]
  - - [25728, 1024, 1, 128]
    - [120, 0.0]
  - - [23936, 512, 1, 128]
    - [120, 0.0]
  - - [23424, 2048, 1, 128]
    - [120, 0.0]
  - - [28032, 12161, 1, 128]
    - [120, 0.0]
  - - [27136, 512, 1, 128]
    - [120, 0.0]
  - - [14336, 6657, 1, 128]
    - [120, 0.0]
  - - [15616, 4096, 1, 128]
    - [120, 0.0]
  - - [3328, 1793, 1, 128]
    - [120, 0.0]
  - - [28416, 512, 1, 128]
    - [120, 0.0]
  - - [16384, 8705, 1, 128]
    - [120, 0.0]
  - - [3200, 1537, 1, 128]
    - [120, 0.0]
  - - [26368, 128, 1, 128]
    - [120, 0.0]
  - - [16000, 512, 1, 128]
    - [120, 0.0]
  - - [25216, 9345, 1, 128]
    - [120, 0.0]
  - - [28288, 4096, 1, 128]
    - [120, 0.0]
  - - [24832, 512, 1, 128]
    - [120, 0.0]
  - - [18048, 10369, 1, 128]
    - [120, 0.0]
  - - [20480, 4096, 1, 128]
    - [120, 0.0]
  - - [17792, 10113, 1, 128]
    - [120, 0.0]
  - - [13312, 5505, 1, 128]
    - [120, 0.0]
  - - [17024, 2048, 1, 128]
    - [120, 0.0]
  - - [20608, 12929, 1, 128]
    - [120, 0.0]
  - - [16896, 4096, 1, 128]
    - [120, 0.0]
  - - [27776, 2048, 1, 128]
    - [120, 0.0]
  - - [6912, 3201, 1, 128]
    - [113, 0.0]
  - - [15744, 2048, 1, 128]
    - [120, 0.0]
  - - [24448, 128, 1, 128]
    - [112, 0.0]
  - - [2688, 128, 1, 128]
    - [100, 0.0]
  - - [7808, 2048, 1, 128]
    - [120, 0.0]
  - - [1408, 512, 1, 128]
    - [110, 0.0]
  - - [12032, 512, 1, 128]
    - [120, 0.0]
  - - [26752, 512, 1, 128]
    - [120, 0.0]
  - - [16128, 8321, 1, 128]
    - [120, 0.0]
  - - [25856, 128, 1, 128]
    - [112, 0.0]
  - - [24064, 8192, 1, 128]
    - [120, 0.0]
  - - [28160, 4096, 1, 128]
    - [120, 0.0]
  - - [13312, 128, 1, 128]
    - [118, 0.0]
  - - [10112, 6401, 1, 128]
    - [113, 0.0]
  - - [16384, 4096, 1, 128]
    - [120, 0.0]
  - - [16512, 2048, 1, 128]
    - [120, 0.0]
  - - [27520, 11521, 1, 128]
    - [120, 0.0]
  - - [8192, 4481, 1, 128]
    - [120, 0.0]
  - - [16768, 512, 1, 128]
    - [120, 0.0]
  - - [6144, 128, 1, 128]
    - [92, 0.0]
  - - [13568, 512, 1, 128]
    - [120, 0.0]
  - - [9344, 5633, 1, 128]
    - [120, 0.0]
  - - [13440, 4096, 1, 128]
    - [120, 0.0]
  - - [2176, 1665, 1, 128]
    - [118, 0.0]
  - - [28288, 128, 1, 128]
    - [113, 0.0]
  - - [11776, 4096, 1, 128]
    - [120, 0.0]
  - - [17280, 512, 1, 128]
    - [120, 0.0]
  - - [5504, 3841, 1, 128]
    - [120, 0.0]
  - - [14848, 7041, 1, 128]
    - [120, 0.0]
  - - [3584, 128, 1, 128]
    - [102, 0.0]
  - - [26880, 8192, 1, 128]
    - [120, 0.0]
  - - [2944, 1409, 1, 128]
    - [111, 0.0]
  - - [26368, 10369, 1, 128]
    - [113, 0.0]
  - - [21888, 512, 1, 128]
    - [120, 0.0]
  - - [15872, 2048, 1, 128]
    - [120, 0.0]
  - - [20224, 512, 1, 128]
    - [120, 0.0]
  - - [24320, 8449, 1, 128]
    - [113, 0.0]
  - - [5632, 1024, 1, 128]
    - [120, 0.0]
  - - [17152, 9473, 1, 128]
    - [120, 0.0]
  - - [4096, 128, 1, 128]
    - [126, 0.0]
  - - [8832, 128, 1, 128]
    - [110, 0.0]
  - - [2048, 1409, 1, 128]
    - [112, 0.0]
  - - [28160, 12289, 1, 128]
    - [120, 0.0]
  - - [9088, 5505, 1, 128]
    - [113, 0.0]
  - - [19200, 1024, 1, 128]
    - [120, 0.0]
  - - [18048, 4096, 1, 128]
    - [120, 0.0]
  - - [12928, 512, 1, 128]
    - [118, 0.0]
  - - [20864, 4096, 1, 128]
    - [120, 0.0]
  - - [27008, 2048, 1, 128]
    - [120, 0.0]
  - - [16640, 128, 1, 128]
    - [117, 0.0]
  - - [24960, 8192, 1, 128]
    - [120, 0.0]
  - - [24320, 1024, 1, 128]
    - [120, 0.0]
  - - [23552, 15873, 1, 128]
    - [120, 0.0]
  - - [26240, 4096, 1, 128]
    - [120, 0.0]
  - - [24320, 128, 1, 128]
    - [120, 0.0]
  - - [26240, 128, 1, 128]
    - [118, 0.0]
  - - [3200, 1665, 1, 128]
    - [120, 0.0]
  - - [11776, 2048, 1, 128]
    - [120, 0.0]
  - - [6144, 512, 1, 128]
    - [118, 0.0]
  - - [24960, 128, 1, 128]
    - [120, 0.0]
  - - [23424, 128, 1, 128]
    - [110, 0.0]
  - - [11776, 8065, 1, 128]
    - [120, 0.0]
  - - [19072, 11265, 1, 128]
    - [120, 0.0]
  - - [8192, 4609, 1, 128]
    - [120, 0.0]
  - - [21888, 4096, 1, 128]
    - [120, 0.0]
  - - [14976, 2048, 1, 128]
    - [120, 0.0]
  - - [23680, 4096, 1, 128]
    - [120, 0.0]
  - - [14080, 1024, 1, 128]
    - [120, 0.0]
  - - [19968, 4096, 1, 128]
    - [120, 0.0]
  - - [8704, 128, 1, 128]
    - [110, 0.0]
  - - [23424, 15745, 1, 128]
    - [113, 0.0]
  - - [8320, 2048, 1, 128]
    - [120, 0.0]
  - - [6144, 2433, 1, 128]
    - [113, 0.0]
  - - [19200, 11393, 1, 128]
    - [120, 0.0]
  - - [28416, 128, 1, 128]
    - [111, 0.0]
  - - [14080, 2048, 1, 128]
    - [120, 0.0]
  - - [12544, 4096, 1, 128]
    - [120, 0.0]
  - - [17024, 128, 1, 128]
    - [112, 0.0]
  - - [23936, 16257, 1, 128]
    - [120, 0.0]
  - - [12288, 128, 1, 128]
    - [113, 0.0]
  - - [28800, 1024, 1, 128]
    - [120, 0.0]
  - - [13824, 6017, 1, 128]
    - [120, 0.0]
  - - [23040, 2048, 1, 128]
    - [120, 0.0]
  - - [9984, 6273, 1, 128]
    - [120, 0.0]
  - - [23680, 512, 1, 128]
    - [120, 0.0]
  - - [7936, 4353, 1, 128]
    - [113, 0.0]
  - - [24192, 2048, 1, 128]
    - [120, 0.0]
  - - [8448, 512, 1, 128]
    - [120, 0.0]
  - - [5760, 2177, 1, 128]
    - [113, 0.0]
  - - [22656, 14977, 1, 128]
    - [120, 0.0]
  - - [17024, 4096, 1, 128]
    - [120, 0.0]
  - - [24960, 8961, 1, 128]
    - [120, 0.0]
  - - [5888, 1024, 1, 128]
    - [120, 0.0]
  - - [9344, 2048, 1, 128]
    - [120, 0.0]
  - - [11520, 1024, 1, 128]
    - [120, 0.0]
  - - [17024, 9217, 1, 128]
    - [120, 0.0]
  - - [10368, 6657, 1, 128]
    - [120, 0.0]
  - - [21632, 2048, 1, 128]
    - [120, 0.0]
  - - [26880, 2048, 1, 128]
    - [120, 0.0]
  - - [20736, 4096, 1, 128]
    - [120, 0.0]
  - - [26624, 8192, 1, 128]
    - [120, 0.0]
  - - [26752, 2048, 1, 128]
    - [120, 0.0]
  - - [24192, 8321, 1, 128]
    - [120, 0.0]
  - - [4736, 1024, 1, 128]
    - [118, 0.0]
  - - [27648, 8192, 1, 128]
    - [120, 0.0]
  - - [27392, 11521, 1, 128]
    - [120, 0.0]
  - - [27776, 4096, 1, 128]
    - [120, 0.0]
  - - [28672, 12801, 1, 128]
    - [120, 0.0]
  - - [13056, 512, 1, 128]
    - [120, 0.0]
  - - [25088, 2048, 1, 128]
    - [120, 0.0]
  - - [17408, 9601, 1, 128]
    - [120, 0.0]
  - - [5120, 3585, 1, 128]
    - [120, 0.0]
  - - [13824, 512, 1, 128]
    - [118, 0.0]
  - - [8576, 1024, 1, 128]
    - [120, 0.0]
  - - [16768, 4096, 1, 128]
    - [120, 0.0]
  - - [25728, 9729, 1, 128]
    - [120, 0.0]
  - - [27392, 512, 1, 128]
    - [120, 0.0]
  - - [13824, 128, 1, 128]
    - [119, 0.0]
  - - [27264, 1024, 1, 128]
    - [120, 0.0]
  - - [22272, 14465, 1, 128]
    - [120, 0.0]
  - - [19840, 2048, 1, 128]
    - [120, 0.0]
  - - [18176, 10497, 1, 128]
    - [120, 0.0]
  - - [4992, 3329, 1, 128]
    - [113, 0.0]
  - - [14976, 7169, 1, 128]
    - [120, 0.0]
  - - [10112, 512, 1, 128]
    - [120, 0.0]
  - - [24704, 128, 1, 128]
    - [110, 0.0]
  - - [16896, 128, 1, 128]
    - [117, 0.0]
  - - [10880, 7169, 1, 128]
    - [120, 0.0]
  - - [9600, 512, 1, 128]
    - [118, 0.0]
  - - [22528, 1024, 1, 128]
    - [120, 0.0]
  - - [27008, 128, 1, 128]
    - [119, 0.0]
  - - [4480, 2945, 1, 128]
    - [113, 0.0]
  - - [15872, 8065, 1, 128]
    - [120, 0.0]
  - - [28672, 128, 1, 128]
    - [113, 0.0]
  - - [9344, 128, 1, 128]
    - [110, 0.0]
  - - [15360, 2048, 1, 128]
    - [120, 0.0]
  - - [11392, 512, 1, 128]
    - [118, 0.0]
  - - [9216, 128, 1, 128]
    - [112, 0.0]
  - - [8192, 2048, 1, 128]
    - [120, 0.0]
  - - [14464, 1024, 1, 128]
    - [120, 0.0]
  - - [4096, 2433, 1, 128]
    - [120, 0.0]
  - - [6528, 2945, 1, 128]
    - [120, 0.0]
  - - [12672, 512, 1, 128]
    - [120, 0.0]
  - - [26624, 128, 1, 128]
    - [111, 0.0]
  - - [19712, 1024, 1, 128]
    - [120, 0.0]
  - - [4480, 2817, 1, 128]
    - [113, 0.0]
  - - [13440, 2048, 1, 128]
    - [120, 0.0]
  - - [256, 257, 1, 128]
    - [114, 0.0]
  - - [16000, 128, 1, 128]
    - [112, 0.0]
  - - [7552, 3969, 1, 128]
    - [113, 0.0]
  - - [12416, 2048, 1, 128]
    - [120, 0.0]
  - - [18432, 512, 1, 128]
    - [120, 0.0]
  - - [14464, 512, 1, 128]
    - [118, 0.0]
  - - [1280, 769, 1, 128]
    - [121, 0.0]
  - - [14976, 512, 1, 128]
    - [120, 0.0]
  - - [28032, 4096, 1, 128]
    - [120, 0.0]
  - - [27904, 128, 1, 128]
    - [113, 0.0]
  - - [20224, 12545, 1, 128]
    - [120, 0.0]
  - - [15872, 4096, 1, 128]
    - [120, 0.0]
  - - [3456, 1793, 1, 128]
    - [113, 0.0]
  - - [14336, 128, 1, 128]
    - [112, 0.0]
  - - [21248, 2048, 1, 128]
    - [120, 0.0]
  - - [23040, 1024, 1, 128]
    - [120, 0.0]
  - - [15232, 7425, 1, 128]
    - [120, 0.0]
  - - [14592, 512, 1, 128]
    - [120, 0.0]
  - - [22912, 15105, 1, 128]
    - [120, 0.0]
  - - [22528, 2048, 1, 128]
    - [120, 0.0]
  - - [3072, 1024, 1, 128]
    - [120, 0.0]
  - - [17536, 4096, 1, 128]
    - [120, 0.0]
  - - [384, 257, 1, 128]
    - [101, 0.0]
  - - [14464, 6657, 1, 128]
    - [120, 0.0]
  - - [20096, 1024, 1, 128]
    - [120, 0.0]
  - - [26880, 4096, 1, 128]
    - [120, 0.0]
  - - [18816, 2048, 1, 128]
    - [120, 0.0]
  - - [17152, 512, 1, 128]
    - [120, 0.0]
  - - [18432, 4096, 1, 128]
    - [120, 0.0]
  - - [10368, 2048, 1, 128]
    - [120, 0.0]
  - - [1408, 769, 1, 128]
    - [102, 0.0]
  - - [7168, 2048, 1, 128]
    - [120, 0.0]
  - - [17664, 128, 1, 128]
    - [119, 0.0]
  - - [1152, 513, 1, 128]
    - [113, 0.0]
  - - [7296, 3713, 1, 128]
    - [120, 0.0]
  - - [24064, 2048, 1, 128]
    - [120, 0.0]
  - - [8576, 2048, 1, 128]
    - [120, 0.0]
  - - [23168, 15489, 1, 128]
    - [113, 0.0]
  - - [14848, 7169, 1, 128]
    - [120, 0.0]
  - - [2432, 512, 1, 128]
    - [110, 0.0]
  - - [19712, 12033, 1, 128]
    - [120, 0.0]
  - - [25856, 4096, 1, 128]
    - [120, 0.0]
  - - [17152, 9345, 1, 128]
    - [120, 0.0]
  - - [3712, 128, 1, 128]
    - [104, 0.0]
  - - [22272, 128, 1, 128]
    - [112, 0.0]
  - - [25600, 9729, 1, 128]
    - [120, 0.0]
  - - [6016, 2433, 1, 128]
    - [113, 0.0]
  - - [12928, 128, 1, 128]
    - [118, 0.0]
  - - [25088, 8192, 1, 128]
    - [120, 0.0]
  - - [7040, 1024, 1, 128]
    - [120, 0.0]
  - - [4736, 3201, 1, 128]
    - [120, 0.0]
  - - [16000, 1024, 1, 128]
    - [120, 0.0]
  - - [1920, 512, 1, 128]
    - [111, 0.0]
  - - [8192, 1024, 1, 128]
    - [120, 0.0]
  - - [8448, 4865, 1, 128]
    - [113, 0.0]
  - - [11136, 7425, 1, 128]
    - [113, 0.0]
  - - [23296, 4096, 1, 128]
    - [120, 0.0]
  - - [27904, 2048, 1, 128]
    - [120, 0.0]
  - - [23552, 4096, 1, 128]
    - [120, 0.0]
  - - [24960, 2048, 1, 128]
    - [120, 0.0]
  - - [2816, 128, 1, 128]
    - [100, 0.0]
  - - [7424, 3841, 1, 128]
    - [113, 0.0]
  - - [20480, 128, 1, 128]
    - [111, 0.0]
  - - [18816, 11137, 1, 128]
    - [120, 0.0]
  - - [26496, 128, 1, 128]
    - [111, 0.0]
  - - [16896, 9217, 1, 128]
    - [120, 0.0]
  - - [23296, 512, 1, 128]
    - [120, 0.0]
  - - [8064, 2048, 1, 128]
    - [120, 0.0]
  - - [19968, 128, 1, 128]
    - [119, 0.0]
  - - [8320, 4737, 1, 128]
    - [113, 0.0]
  - - [27648, 1024, 1, 128]
    - [120, 0.0]
  - - [3712, 512, 1, 128]
    - [119, 0.0]
  - - [256, 128, 1, 128]
    - [99, 0.0]
  - - [3072, 1537, 1, 128]
    - [120, 0.0]
  - - [5504, 1024, 1, 128]
    - [120, 0.0]
  - - [20992, 2048, 1, 128]
    - [120, 0.0]
  - - [20480, 1024, 1, 128]
    - [120, 0.0]
  - - [20864, 128, 1, 128]
    - [113, 0.0]
  - - [28544, 12545, 1, 128]
    - [120, 0.0]
  - - [1152, 512, 1, 128]
    - [70, 0.0]
  - - [24320, 8321, 1, 128]
    - [120, 0.0]
  - - [2688, 512, 1, 128]
    - [118, 0.0]
  - - [27904, 8192, 1, 128]
    - [120, 0.0]
  - - [3840, 2177, 1, 128]
    - [113, 0.0]
  - - [25344, 128, 1, 128]
    - [117, 0.0]
  - - [13184, 512, 1, 128]
    - [120, 0.0]
  - - [7680, 512, 1, 128]
    - [118, 0.0]
  - - [11904, 2048, 1, 128]
    - [120, 0.0]
  - - [12544, 512, 1, 128]
    - [118, 0.0]
  - - [8448, 4737, 1, 128]
    - [120, 0.0]
  - - [28544, 128, 1, 128]
    - [111, 0.0]
  - - [21760, 14081, 1, 128]
    - [120, 0.0]
  - - [12800, 128, 1, 128]
    - [111, 0.0]
  - - [17664, 4096, 1, 128]
    - [120, 0.0]
  - - [2432, 1793, 1, 128]
    - [120, 0.0]
  - - [16384, 8577, 1, 128]
    - [120, 0.0]
  - - [28544, 512, 1, 128]
    - [120, 0.0]
  - - [28032, 12033, 1, 128]
    - [120, 0.0]
  - - [4864, 3329, 1, 128]
    - [113, 0.0]
  - - [12928, 5249, 1, 128]
    - [113, 0.0]
  - - [4736, 512, 1, 128]
    - [118, 0.0]
  - - [27264, 2048, 1, 128]
    - [120, 0.0]
  - - [19840, 12033, 1, 128]
    - [113, 0.0]
  - - [19584, 4096, 1, 128]
    - [120, 0.0]
  - - [21376, 4096, 1, 128]
    - [120, 0.0]
  - - [20352, 4096, 1, 128]
    - [120, 0.0]
  - - [6400, 2689, 1, 128]
    - [120, 0.0]
  - - [24704, 8192, 1, 128]
    - [120, 0.0]
  - - [22528, 14849, 1, 128]
    - [120, 0.0]
  - - [18304, 512, 1, 128]
    - [120, 0.0]
  - - [6656, 1024, 1, 128]
    - [118, 0.0]
  - - [13568, 4096, 1, 128]
    - [120, 0.0]
  - - [6016, 512, 1, 128]
    - [118, 0.0]
  - - [17664, 2048, 1, 128]
    - [120, 0.0]
  - - [17408, 512, 1, 128]
    - [120, 0.0]
  - - [24960, 4096, 1, 128]
    - [120, 0.0]
  - - [20608, 12801, 1, 128]
    - [120, 0.0]
  - - [27648, 11649, 1, 128]
    - [120, 0.0]
  - - [5760, 128, 1, 128]
    - [102, 0.0]
  - - [17792, 512, 1, 128]
    - [120, 0.0]
  - - [17664, 512, 1, 128]
    - [120, 0.0]
  - - [19968, 12161, 1, 128]
    - [120, 0.0]
  - - [19840, 512, 1, 128]
    - [120, 0.0]
  - - [12032, 4353, 1, 128]
    - [120, 0.0]
  - - [25984, 512, 1, 128]
    - [120, 0.0]
  - - [27648, 4096, 1, 128]
    - [120, 0.0]
  - - [10752, 7041, 1, 128]
    - [120, 0.0]
  - - [28544, 2048, 1, 128]
    - [120, 0.0]
  - - [7680, 2048, 1, 128]
    - [120, 0.0]
  - - [13184, 5377, 1, 128]
    - [113, 0.0]
  - - [6784, 3201, 1, 128]
    - [120, 0.0]
  - - [16384, 2048, 1, 128]
    - [120, 0.0]
  - - [22656, 1024, 1, 128]
    - [120, 0.0]
  - - [12800, 512, 1, 128]
    - [120, 0.0]
  - - [23936, 1024, 1, 128]
    - [120, 0.0]
  - - [15360, 1024, 1, 128]
    - [120, 0.0]
  - - [15488, 2048, 1, 128]
    - [120, 0.0]
  - - [11392, 1024, 1, 128]
    - [120, 0.0]
  - - [15744, 1024, 1, 128]
    - [120, 0.0]
  - - [9856, 2048, 1, 128]
    - [120, 0.0]
  - - [5888, 2305, 1, 128]
    - [113, 0.0]
  - - [10496, 512, 1, 128]
    - [120, 0.0]
  - - [1664, 1153, 1, 128]
    - [117, 0.0]
  - - [3456, 1024, 1, 128]
    - [120, 0.0]
  - - [20992, 13313, 1, 128]
    - [120, 0.0]
  - - [11904, 4096, 1, 128]
    - [120, 0.0]
  - - [13056, 1024, 1, 128]
    - [120, 0.0]
  - - [12800, 2048, 1, 128]
    - [120, 0.0]
  - - [12160, 512, 1, 128]
    - [120, 0.0]
  - - [5760, 2049, 1, 128]
    - [120, 0.0]
  - - [11392, 128, 1, 128]
    - [111, 0.0]
  - - [5632, 128, 1, 128]
    - [110, 0.0]
  - - [11520, 2048, 1, 128]
    - [120, 0.0]
  - - [11648, 2048, 1, 128]
    - [120, 0.0]
  - - [28544, 8192, 1, 128]
    - [120, 0.0]
  - - [22912, 1024, 1, 128]
    - [120, 0.0]
  - - [10752, 7169, 1, 128]
    - [120, 0.0]
  - - [8320, 128, 1, 128]
    - [96, 0.0]
  - - [23808, 1024, 1, 128]
    - [120, 0.0]
  - - [25984, 8192, 1, 128]
    - [120, 0.0]
  - - [22656, 2048, 1, 128]
    - [120, 0.0]
  - - [7296, 1024, 1, 128]
    - [120, 0.0]
  - - [28032, 512, 1, 128]
    - [120, 0.0]
  - - [22400, 2048, 1, 128]
    - [120, 0.0]
  - - [22144, 512, 1, 128]
    - [120, 0.0]
  - - [13312, 4096, 1, 128]
    - [120, 0.0]
  - - [10240, 2048, 1, 128]
    - [120, 0.0]
  - - [12672, 128, 1, 128]
    - [111, 0.0]
  - - [10752, 2048, 1, 128]
    - [120, 0.0]
  - - [1152, 128, 1, 128]
    - [101, 0.0]
  - - [13696, 5889, 1, 128]
    - [113, 0.0]
  - - [9216, 1024, 1, 128]
    - [120, 0.0]
  - - [17152, 128, 1, 128]
    - [119, 0.0]
  - - [24320, 2048, 1, 128]
    - [120, 0.0]
  - - [16512, 8705, 1, 128]
    - [120, 0.0]
  - - [3072, 1409, 1, 128]
    - [113, 0.0]
  - - [1024, 128, 1, 128]
    - [110, 0.0]
  - - [22400, 14593, 1, 128]
    - [120, 0.0]
  - - [4096, 512, 1, 128]
    - [119, 0.0]
  - - [4992, 128, 1, 128]
    - [113, 0.0]
  - - [9472, 5889, 1, 128]
    - [113, 0.0]
  - - [9472, 5761, 1, 128]
    - [120, 0.0]
  - - [27136, 1024, 1, 128]
    - [120, 0.0]
  - - [6528, 1024, 1, 128]
    - [120, 0.0]
  - - [25472, 1024, 1, 128]
    - [120, 0.0]
  - - [5120, 512, 1, 128]
    - [118, 0.0]
  - - [5504, 512, 1, 128]
    - [118, 0.0]
  - - [21120, 13441, 1, 128]
    - [120, 0.0]
  - - [4352, 128, 1, 128]
    - [85, 0.0]
  - - [8832, 5249, 1, 128]
    - [113, 0.0]
  - - [1536, 1025, 1, 128]
    - [120, 0.0]
  - - [11520, 512, 1, 128]
    - [120, 0.0]
  - - [5632, 2048, 1, 128]
    - [120, 0.0]
  - - [7424, 128, 1, 128]
    - [120, 0.0]
  - - [18432, 128, 1, 128]
    - [111, 0.0]
  - - [12672, 2048, 1, 128]
    - [120, 0.0]
  - - [14208, 128, 1, 128]
    - [112, 0.0]
  - - [15360, 7553, 1, 128]
    - [120, 0.0]
  - - [26496, 1024, 1, 128]
    - [120, 0.0]
  - - [27136, 128, 1, 128]
    - [118, 0.0]
  - - [12032, 2048, 1, 128]
    - [120, 0.0]
  - - [11648, 1024, 1, 128]
    - [120, 0.0]
  - - [11776, 512, 1, 128]
    - [118, 0.0]
  - - [1024, 512, 1, 128]
    - [122, 0.0]
  - - [11264, 7681, 1, 128]
    - [120, 0.0]
  - - [19456, 11777, 1, 128]
    - [120, 0.0]
  - - [14080, 4096, 1, 128]
    - [120, 0.0]
  - - [7040, 3329, 1, 128]
    - [113, 0.0]
  - - [27392, 4096, 1, 128]
    - [120, 0.0]
  - - [14720, 7041, 1, 128]
    - [113, 0.0]
  - - [19584, 1024, 1, 128]
    - [120, 0.0]
  - - [21376, 13569, 1, 128]
    - [120, 0.0]
  - - [20480, 12801, 1, 128]
    - [120, 0.0]
  - - [21248, 128, 1, 128]
    - [112, 0.0]
  - - [9728, 1024, 1, 128]
    - [120, 0.0]
  - - [18688, 10881, 1, 128]
    - [120, 0.0]
  - - [21120, 13313, 1, 128]
    - [120, 0.0]
  - - [20096, 2048, 1, 128]
    - [120, 0.0]
  - - [16640, 4096, 1, 128]
    - [120, 0.0]
  - - [28160, 12161, 1, 128]
    - [120, 0.0]
  - - [640, 129, 1, 128]
    - [106, 0.0]
  - - [28672, 512, 1, 128]
    - [120, 0.0]
  - - [12416, 4096, 1, 128]
    - [120, 0.0]
  - - [25344, 9473, 1, 128]
    - [120, 0.0]
  - - [18304, 1024, 1, 128]
    - [120, 0.0]
  - - [25600, 4096, 1, 128]
    - [120, 0.0]
  - - [22272, 512, 1, 128]
    - [120, 0.0]
  - - [21504, 13825, 1, 128]
    - [120, 0.0]
  - - [4736, 128, 1, 128]
    - [73, 0.0]
  - - [26496, 10625, 1, 128]
    - [120, 0.0]
  - - [7040, 512, 1, 128]
    - [120, 0.0]
  - - [14336, 4096, 1, 128]
    - [120, 0.0]
  - - [9216, 512, 1, 128]
    - [120, 0.0]
  - - [1280, 641, 1, 128]
    - [73, 0.0]
  - - [16768, 8961, 1, 128]
    - [113, 0.0]
  - - [18944, 11137, 1, 128]
    - [120, 0.0]
  - - [21504, 2048, 1, 128]
    - [120, 0.0]
  - - [21888, 1024, 1, 128]
    - [120, 0.0]
  - - [11264, 512, 1, 128]
    - [120, 0.0]
  - - [27776, 8192, 1, 128]
    - [120, 0.0]
  - - [10368, 6785, 1, 128]
    - [113, 0.0]
  - - [18432, 10753, 1, 128]
    - [120, 0.0]
  - - [19968, 2048, 1, 128]
    - [120, 0.0]
  - - [16640, 512, 1, 128]
    - [120, 0.0]
  - - [24576, 8577, 1, 128]
    - [120, 0.0]
  - - [28672, 2048, 1, 128]
    - [120, 0.0]
  - - [11136, 128, 1, 128]
    - [120, 0.0]
  - - [12288, 4609, 1, 128]
    - [120, 0.0]
  - - [14848, 1024, 1, 128]
    - [120, 0.0]
  - - [14848, 128, 1, 128]
    - [113, 0.0]
  - - [7424, 1024, 1, 128]
    - [120, 0.0]
  - - [2560, 1024, 1, 128]
    - [111, 0.0]
  - - [6400, 128, 1, 128]
    - [84, 0.0]
  - - [15488, 7809, 1, 128]
    - [120, 0.0]
  - - [17920, 2048, 1, 128]
    - [120, 0.0]
  - - [5760, 512, 1, 128]
    - [118, 0.0]
  - - [16640, 1024, 1, 128]
    - [120, 0.0]
  - - [28160, 2048, 1, 128]
    - [120, 0.0]
  - - [5504, 3969, 1, 128]
    - [120, 0.0]
  - - [11776, 1024, 1, 128]
    - [120, 0.0]
  - - [18816, 128, 1, 128]
    - [111, 0.0]
  - - [27904, 12033, 1, 128]
    - [113, 0.0]
  - - [11520, 7937, 1, 128]
    - [120, 0.0]
  - - [18944, 11265, 1, 128]
    - [120, 0.0]
  - - [5376, 1024, 1, 128]
    - [120, 0.0]
  - - [12032, 4225, 1, 128]
    - [120, 0.0]
  - - [5376, 128, 1, 128]
    - [102, 0.0]
  - - [9856, 1024, 1, 128]
    - [120, 0.0]
  - - [26752, 10881, 1, 128]
    - [120, 0.0]
  - - [20352, 128, 1, 128]
    - [118, 0.0]
  - - [14464, 128, 1, 128]
    - [112, 0.0]
  - - [1024, 385, 1, 128]
    - [100, 0.0]
  - - [3840, 128, 1, 128]
    - [110, 0.0]
  - - [24192, 128, 1, 128]
    - [119, 0.0]
  - - [28544, 12673, 1, 128]
    - [120, 0.0]
  - - [1664, 128, 1, 128]
    - [102, 0.0]
  - - [26752, 8192, 1, 128]
    - [120, 0.0]
  - - [16896, 1024, 1, 128]
    - [120, 0.0]
  - - [9728, 128, 1, 128]
    - [112, 0.0]
  - - [11264, 2048, 1, 128]
    - [120, 0.0]
  - - [11392, 2048, 1, 128]
    - [120, 0.0]
  - - [20224, 2048, 1, 128]
    - [120, 0.0]
  - - [26880, 1024, 1, 128]
    - [120, 0.0]
  - - [15104, 512, 1, 128]
    - [120, 0.0]
  - - [26368, 2048, 1, 128]
    - [120, 0.0]
  - - [6784, 3073, 1, 128]
    - [120, 0.0]
  - - [23168, 128, 1, 128]
    - [119, 0.0]
  - - [8448, 1024, 1, 128]
    - [118, 0.0]
  - - [16896, 9089, 1, 128]
    - [120, 0.0]
  - - [17536, 128, 1, 128]
    - [112, 0.0]
  - - [22912, 512, 1, 128]
    - [120, 0.0]
  - - [28032, 128, 1, 128]
    - [120, 0.0]
  - - [19584, 512, 1, 128]
    - [120, 0.0]
  - - [27136, 11265, 1, 128]
    - [120, 0.0]
  - - [4992, 512, 1, 128]
    - [118, 0.0]
  - - [8448, 128, 1, 128]
    - [87, 0.0]
  - - [27648, 128, 1, 128]
    - [120, 0.0]
  - - [16640, 2048, 1, 128]
    - [120, 0.0]
  - - [26752, 10753, 1, 128]
    - [120, 0.0]
  - - [2944, 1281, 1, 128]
    - [112, 0.0]
  - - [5376, 3841, 1, 128]
    - [113, 0.0]
  - - [10496, 6913, 1, 128]
    - [113, 0.0]
  - - [17024, 512, 1, 128]
    - [120, 0.0]
  - - [11008, 7297, 1, 128]
    - [120, 0.0]
  - - [14080, 128, 1, 128]
    - [119, 0.0]
  - - [5888, 512, 1, 128]
    - [119, 0.0]
  - - [19200, 128, 1, 128]
    - [111, 0.0]
  - - [14208, 6529, 1, 128]
    - [120, 0.0]
  - - [22912, 4096, 1, 128]
    - [120, 0.0]
  - - [14336, 2048, 1, 128]
    - [120, 0.0]
  - - [17792, 128, 1, 128]
    - [112, 0.0]
  - - [22656, 14849, 1, 128]
    - [120, 0.0]
  - - [19712, 512, 1, 128]
    - [120, 0.0]
  - - [5248, 1024, 1, 128]
    - [120, 0.0]
  - - [3712, 2049, 1, 128]
    - [120, 0.0]
  - - [24448, 8449, 1, 128]
    - [113, 0.0]
  - - [8192, 512, 1, 128]
    - [120, 0.0]
  - - [25472, 4096, 1, 128]
    - [120, 0.0]
  - - [25088, 512, 1, 128]
    - [120, 0.0]
  - - [23168, 1024, 1, 128]
    - [120, 0.0]
  - - [24320, 8192, 1, 128]
    - [120, 0.0]
  - - [24192, 8192, 1, 128]
    - [120, 0.0]
  - - [2176, 512, 1, 128]
    - [110, 0.0]
  - - [4992, 3457, 1, 128]
    - [120, 0.0]
  - - [896, 257, 1, 128]
    - [72, 0.0]
  - - [28288, 1024, 1, 128]
    - [120, 0.0]
  - - [20864, 1024, 1, 128]
    - [120, 0.0]
  - - [18432, 2048, 1, 128]
    - [120, 0.0]
  - - [17280, 9601, 1, 128]
    - [120, 0.0]
  - - [18944, 4096, 1, 128]
    - [120, 0.0]
  - - [13440, 128, 1, 128]
    - [118, 0.0]
  - - [7424, 2048, 1, 128]
    - [120, 0.0]
  - - [768, 128, 1, 128]
    - [99, 0.0]
  - - [16128, 512, 1, 128]
    - [120, 0.0]
  - - [28288, 12289, 1, 128]
    - [120, 0.0]
  - - [23552, 128, 1, 128]
    - [112, 0.0]
  - - [24832, 8192, 1, 128]
    - [120, 0.0]
  - - [10240, 1024, 1, 128]
    - [120, 0.0]
  - - [8960, 2048, 1, 128]
    - [120, 0.0]
  - - [17664, 9985, 1, 128]
    - [120, 0.0]
  - - [25088, 4096, 1, 128]
    - [120, 0.0]
  - - [7552, 2048, 1, 128]
    - [120, 0.0]
  - - [15104, 7297, 1, 128]
    - [120, 0.0]
  - - [7168, 1024, 1, 128]
    - [120, 0.0]
  - - [26112, 8192, 1, 128]
    - [120, 0.0]
  - - [24192, 1024, 1, 128]
    - [120, 0.0]
  - - [22912, 2048, 1, 128]
    - [120, 0.0]
  - - [10368, 512, 1, 128]
    - [120, 0.0]
  - - [22528, 4096, 1, 128]
    - [120, 0.0]
  - - [6528, 128, 1, 128]
    - [84, 0.0]
  - - [26752, 4096, 1, 128]
    - [120, 0.0]
  - - [2816, 512, 1, 128]
    - [118, 0.0]
  - - [22016, 14209, 1, 128]
    - [120, 0.0]
  - - [8832, 1024, 1, 128]
    - [120, 0.0]
  - - [16384, 128, 1, 128]
    - [112, 0.0]
  - - [5120, 1024, 1, 128]
    - [118, 0.0]
  - - [24832, 8833, 1, 128]
    - [120, 0.0]
  - - [11520, 128, 1, 128]
    - [119, 0.0]
  - - [24960, 512, 1, 128]
    - [120, 0.0]
  - - [27520, 2048, 1, 128]
    - [120, 0.0]
  - - [22272, 14593, 1, 128]
    - [120, 0.0]
  - - [2048, 128, 1, 128]
    - [115, 0.0]
  - - [2176, 1537, 1, 128]
    - [118, 0.0]
  - - [10496, 1024, 1, 128]
    - [120, 0.0]
  - - [12160, 4353, 1, 128]
    - [113, 0.0]
  - - [6144, 1024, 1, 128]
    - [120, 0.0]
  - - [26752, 1024, 1, 128]
    - [120, 0.0]
  - - [17280, 4096, 1, 128]
    - [120, 0.0]
  - - [16896, 512, 1, 128]
    - [120, 0.0]
  - - [4480, 128, 1, 128]
    - [71, 0.0]
  - - [18944, 128, 1, 128]
    - [111, 0.0]
  - - [9600, 2048, 1, 128]
    - [120, 0.0]
  - - [19456, 1024, 1, 128]
    - [120, 0.0]
  - - [9984, 2048, 1, 128]
    - [120, 0.0]
  - - [25216, 9217, 1, 128]
    - [120, 0.0]
  - - [19968, 1024, 1, 128]
    - [120, 0.0]
  - - [13952, 2048, 1, 128]
    - [120, 0.0]
  - - [10496, 2048, 1, 128]
    - [120, 0.0]
  - - [12672, 1024, 1, 128]
    - [120, 0.0]
  - - [19072, 11393, 1, 128]
    - [120, 0.0]
  - - [11008, 2048, 1, 128]
    - [120, 0.0]
  - - [27520, 11649, 1, 128]
    - [120, 0.0]
  - - [10880, 512, 1, 128]
    - [118, 0.0]
  - - [14592, 6785, 1, 128]
    - [120, 0.0]
  - - [7424, 512, 1, 128]
    - [120, 0.0]
  - - [13056, 5249, 1, 128]
    - [120, 0.0]
  - - [23296, 15489, 1, 128]
    - [120, 0.0]
  - - [28416, 8192, 1, 128]
    - [120, 0.0]
  - - [11392, 7681, 1, 128]
    - [120, 0.0]
  - - [18048, 1024, 1, 128]
    - [120, 0.0]
  - - [15616, 7809, 1, 128]
    - [120, 0.0]
  - - [128, 128, 1, 128]
    - [99, 0.0]
  - - [24704, 512, 1, 128]
    - [120, 0.0]
  - - [7680, 4097, 1, 128]
    - [120, 0.0]
  - - [16640, 8961, 1, 128]
    - [120, 0.0]
  - - [18944, 1024, 1, 128]
    - [120, 0.0]
  - - [12928, 2048, 1, 128]
    - [120, 0.0]
  - - [22272, 2048, 1, 128]
    - [120, 0.0]
  - - [27904, 11905, 1, 128]
    - [120, 0.0]
  - - [26240, 2048, 1, 128]
    - [120, 0.0]
  - - [9728, 6017, 1, 128]
    - [120, 0.0]
  - - [20736, 1024, 1, 128]
    - [120, 0.0]
  - - [3456, 1921, 1, 128]
    - [113, 0.0]
  - - [8064, 512, 1, 128]
    - [118, 0.0]
  - - [4224, 1024, 1, 128]
    - [118, 0.0]
  - - [25984, 10113, 1, 128]
    - [120, 0.0]
  - - [13696, 6017, 1, 128]
    - [120, 0.0]
  - - [27520, 8192, 1, 128]
    - [120, 0.0]
  - - [18944, 512, 1, 128]
    - [120, 0.0]
  - - [6272, 128, 1, 128]
    - [92, 0.0]
  - - [27264, 4096, 1, 128]
    - [120, 0.0]
  - - [1792, 1153, 1, 128]
    - [119, 0.0]
  - - [17536, 9729, 1, 128]
    - [120, 0.0]
  - - [13184, 5505, 1, 128]
    - [120, 0.0]
  - - [2944, 128, 1, 128]
    - [112, 0.0]
  - - [25344, 512, 1, 128]
    - [120, 0.0]
  - - [23040, 15361, 1, 128]
    - [120, 0.0]
  - - [8704, 512, 1, 128]
    - [118, 0.0]
  - - [20864, 13057, 1, 128]
    - [120, 0.0]
  - - [19328, 4096, 1, 128]
    - [120, 0.0]
  - - [28288, 8192, 1, 128]
    - [120, 0.0]
  - - [10112, 1024, 1, 128]
    - [120, 0.0]
  - - [17536, 2048, 1, 128]
    - [120, 0.0]
  - - [7552, 128, 1, 128]
    - [118, 0.0]
  - - [15616, 7937, 1, 128]
    - [120, 0.0]
  - - [23040, 512, 1, 128]
    - [120, 0.0]
  - - [25984, 2048, 1, 128]
    - [120, 0.0]
  - - [14720, 128, 1, 128]
    - [112, 0.0]
  - - [23424, 1024, 1, 128]
    - [120, 0.0]
  - - [1920, 1281, 1, 128]
    - [112, 0.0]
  - - [27136, 2048, 1, 128]
    - [120, 0.0]
  - - [28800, 8192, 1, 128]
    - [120, 0.0]
  - - [15488, 128, 1, 128]
    - [112, 0.0]
  - - [28800, 12929, 1, 128]
    - [113, 0.0]
  - - [21888, 14081, 1, 128]
    - [120, 0.0]
  - - [25600, 1024, 1, 128]
    - [120, 0.0]
  - - [21632, 1024, 1, 128]
    - [120, 0.0]
  - - [24448, 1024, 1, 128]
    - [120, 0.0]
  - - [4352, 2689, 1, 128]
    - [120, 0.0]
  - - [20480, 512, 1, 128]
    - [118, 0.0]
  - - [7296, 128, 1, 128]
    - [118, 0.0]
  - - [4992, 1024, 1, 128]
    - [120, 0.0]
  - - [27264, 11393, 1, 128]
    - [120, 0.0]
  - - [26752, 128, 1, 128]
    - [111, 0.0]
  - - [24960, 1024, 1, 128]
    - [120, 0.0]
  - - [21504, 512, 1, 128]
    - [120, 0.0]
  - - [6272, 2561, 1, 128]
    - [120, 0.0]
  - - [25088, 9089, 1, 128]
    - [120, 0.0]
  - - [20864, 512, 1, 128]
    - [120, 0.0]
  - - [4224, 2561, 1, 128]
    - [120, 0.0]
  - - [15744, 8065, 1, 128]
    - [120, 0.0]
  - - [21632, 128, 1, 128]
    - [119, 0.0]
  - - [15104, 4096, 1, 128]
    - [120, 0.0]
  - - [20352, 512, 1, 128]
    - [120, 0.0]
  - - [25472, 9601, 1, 128]
    - [120, 0.0]
  - - [27904, 512, 1, 128]
    - [120, 0.0]
  - - [19968, 512, 1, 128]
    - [120, 0.0]
  - - [5760, 1024, 1, 128]
    - [120, 0.0]
  - - [28416, 12545, 1, 128]
    - [120, 0.0]
  - - [16512, 8833, 1, 128]
    - [113, 0.0]
  - - [6016, 128, 1, 128]
    - [85, 0.0]
  - - [13056, 4096, 1, 128]
    - [120, 0.0]
  - - [19968, 12289, 1, 128]
    - [120, 0.0]
  - - [7424, 3713, 1, 128]
    - [113, 0.0]
  - - [28800, 128, 1, 128]
    - [120, 0.0]
  - - [512, 512, 1, 128]
    - [100, 0.0]
  - - [24832, 2048, 1, 128]
    - [120, 0.0]
  - - [20736, 128, 1, 128]
    - [111, 0.0]
  - - [26368, 512, 1, 128]
    - [120, 0.0]
  - - [26496, 8192, 1, 128]
    - [120, 0.0]
  - - [13824, 4096, 1, 128]
    - [120, 0.0]
  - - [27264, 128, 1, 128]
    - [112, 0.0]
  - - [21760, 1024, 1, 128]
    - [120, 0.0]
  - - [2432, 1921, 1, 128]
    - [113, 0.0]
  - - [27136, 8192, 1, 128]
    - [120, 0.0]
  - - [6784, 2048, 1, 128]
    - [120, 0.0]
  - - [11264, 128, 1, 128]
    - [118, 0.0]
  - - [7552, 512, 1, 128]
    - [118, 0.0]
  - - [19328, 11649, 1, 128]
    - [120, 0.0]
  - - [17152, 2048, 1, 128]
    - [120, 0.0]
  - - [23808, 16129, 1, 128]
    - [120, 0.0]
  - - [20224, 12417, 1, 128]
    - [120, 0.0]
  - - [27904, 1024, 1, 128]
    - [120, 0.0]
  - - [3456, 512, 1, 128]
    - [119, 0.0]
  - - [13312, 512, 1, 128]
    - [120, 0.0]
  - - [26368, 4096, 1, 128]
    - [120, 0.0]
  - - [23296, 15617, 1, 128]
    - [120, 0.0]
  - - [26112, 10241, 1, 128]
    - [120, 0.0]
  - - [26240, 512, 1, 128]
    - [120, 0.0]
  - - [4352, 1024, 1, 128]
    - [118, 0.0]
  - - [10624, 2048, 1, 128]
    - [120, 0.0]
  - - [23808, 16001, 1, 128]
    - [113, 0.0]
  - - [17536, 9857, 1, 128]
    - [113, 0.0]
  - - [23936, 4096, 1, 128]
    - [120, 0.0]
  - - [1408, 128, 1, 128]
    - [100, 0.0]
  - - [14848, 512, 1, 128]
    - [120, 0.0]
  - - [8704, 4993, 1, 128]
    - [113, 0.0]
  - - [15104, 2048, 1, 128]
    - [120, 0.0]
  - - [2560, 512, 1, 128]
    - [118, 0.0]
  - - [27264, 8192, 1, 128]
    - [120, 0.0]
  - - [23808, 4096, 1, 128]
    - [120, 0.0]
  - - [14080, 6273, 1, 128]
    - [120, 0.0]
  - - [10112, 6529, 1, 128]
    - [120, 0.0]
  - - [27648, 512, 1, 128]
    - [120, 0.0]
  - - [20992, 128, 1, 128]
    - [113, 0.0]
  - - [15104, 128, 1, 128]
    - [119, 0.0]
  - - [7808, 128, 1, 128]
    - [76, 0.0]
  - - [3584, 1024, 1, 128]
    - [120, 0.0]
  - - [15232, 512, 1, 128]
    - [120, 0.0]
  - - [21376, 13697, 1, 128]
    - [120, 0.0]
  - - [11392, 7809, 1, 128]
    - [120, 0.0]
  - - [11904, 1024, 1, 128]
    - [120, 0.0]
  - - [28800, 2048, 1, 128]
    - [120, 0.0]
  - - [8960, 512, 1, 128]
    - [120, 0.0]
  - - [19456, 11649, 1, 128]
    - [120, 0.0]
  - - [11904, 128, 1, 128]
    - [112, 0.0]
  - - [18560, 512, 1, 128]
    - [120, 0.0]
  - - [6656, 128, 1, 128]
    - [92, 0.0]
  - - [17792, 2048, 1, 128]
    - [120, 0.0]
  - - [21632, 4096, 1, 128]
    - [120, 0.0]
  - - [25728, 4096, 1, 128]
    - [120, 0.0]
  - - [18048, 10241, 1, 128]
    - [120, 0.0]
  - - [1792, 1281, 1, 128]
    - [103, 0.0]
  - - [512, 385, 1, 128]
    - [115, 0.0]
  - - [26112, 512, 1, 128]
    - [120, 0.0]
  - - [16128, 1024, 1, 128]
    - [120, 0.0]
  - - [4480, 1024, 1, 128]
    - [120, 0.0]
  - - [14720, 4096, 1, 128]
    - [120, 0.0]
  - - [23552, 2048, 1, 128]
    - [120, 0.0]
  - - [22528, 512, 1, 128]
    - [120, 0.0]
  - - [22912, 128, 1, 128]
    - [120, 0.0]
  - - [25344, 1024, 1, 128]
    - [120, 0.0]
  - - [24064, 16257, 1, 128]
    - [120, 0.0]
  - - [9088, 5377, 1, 128]
    - [113, 0.0]
  - - [27776, 128, 1, 128]
    - [112, 0.0]
  - - [15616, 512, 1, 128]
    - [120, 0.0]
  - - [13568, 128, 1, 128]
    - [110, 0.0]
  - - [15488, 7681, 1, 128]
    - [120, 0.0]
  - - [20096, 512, 1, 128]
    - [120, 0.0]
  - - [24832, 4096, 1, 128]
    - [120, 0.0]
  - - [28800, 4096, 1, 128]
    - [120, 0.0]
  - - [11904, 4225, 1, 128]
    - [120, 0.0]
  - - [3968, 1024, 1, 128]
    - [120, 0.0]
  - - [6400, 2817, 1, 128]
    - [113, 0.0]
  - - [24576, 4096, 1, 128]
    - [120, 0.0]
  - - [9088, 128, 1, 128]
    - [119, 0.0]
  - - [17152, 4096, 1, 128]
    - [120, 0.0]
  - - [22528, 14721, 1, 128]
    - [120, 0.0]
  - - [27392, 2048, 1, 128]
    - [120, 0.0]
  - - [8832, 512, 1, 128]
    - [118, 0.0]
  - - [8960, 5249, 1, 128]
    - [120, 0.0]
  - - [3200, 1024, 1, 128]
    - [118, 0.0]
  - - [4736, 3073, 1, 128]
    - [120, 0.0]
  - - [28032, 2048, 1, 128]
    - [120, 0.0]
  - - [14592, 2048, 1, 128]
    - [120, 0.0]
  - - [13440, 1024, 1, 128]
    - [120, 0.0]
  - - [14464, 2048, 1, 128]
    - [120, 0.0]
  - - [6912, 2048, 1, 128]
    - [120, 0.0]
  - - [19584, 2048, 1, 128]
    - [120, 0.0]
  - - [17920, 128, 1, 128]
    - [112, 0.0]
  - - [19584, 11777, 1, 128]
    - [120, 0.0]
  - - [23936, 16129, 1, 128]
    - [113, 0.0]
  - - [10496, 6785, 1, 128]
    - [120, 0.0]
  - - [27648, 2048, 1, 128]
    - [120, 0.0]
  - - [23808, 128, 1, 128]
    - [119, 0.0]
  - - [20864, 2048, 1, 128]
    - [120, 0.0]
  - - [9088, 512, 1, 128]
    - [120, 0.0]
  - - [3584, 512, 1, 128]
    - [118, 0.0]
  - - [8576, 4993, 1, 128]
    - [113, 0.0]
  - - [3328, 1024, 1, 128]
    - [120, 0.0]
  - - [20608, 2048, 1, 128]
    - [120, 0.0]
  - - [23552, 15745, 1, 128]
    - [120, 0.0]
  - - [23424, 15617, 1, 128]
    - [113, 0.0]
  - - [21120, 512, 1, 128]
    - [120, 0.0]
  - - [6656, 512, 1, 128]
    - [118, 0.0]
  - - [12544, 128, 1, 128]
    - [118, 0.0]
  - - [24448, 8577, 1, 128]
    - [113, 0.0]
  - - [9984, 512, 1, 128]
    - [120, 0.0]
  - - [18304, 4096, 1, 128]
    - [120, 0.0]
  - - [17920, 512, 1, 128]
    - [120, 0.0]
  - - [12160, 4096, 1, 128]
    - [120, 0.0]
  - - [3968, 2433, 1, 128]
    - [113, 0.0]
  - - [27008, 4096, 1, 128]
    - [120, 0.0]
  - - [22272, 1024, 1, 128]
    - [120, 0.0]
  - - [14336, 512, 1, 128]
    - [120, 0.0]
  - - [18560, 10753, 1, 128]
    - [120, 0.0]
  - - [6272, 2048, 1, 128]
    - [120, 0.0]
  - - [12800, 1024, 1, 128]
    - [120, 0.0]
  - - [9600, 5889, 1, 128]
    - [120, 0.0]
  - - [13056, 128, 1, 128]
    - [111, 0.0]
  - - [7296, 2048, 1, 128]
    - [120, 0.0]
  - - [21376, 512, 1, 128]
    - [120, 0.0]
  - - [11904, 512, 1, 128]
    - [120, 0.0]
  - - [6400, 1024, 1, 128]
    - [118, 0.0]
  - - [27008, 1024, 1, 128]
    - [120, 0.0]
  - - [22400, 14721, 1, 128]
    - [120, 0.0]
  - - [6272, 1024, 1, 128]
    - [120, 0.0]
  - - [17408, 128, 1, 128]
    - [112, 0.0]
  - - [26624, 10625, 1, 128]
    - [120, 0.0]
  - - [22400, 1024, 1, 128]
    - [120, 0.0]
  - - [18304, 10625, 1, 128]
    - [120, 0.0]
  - - [15872, 1024, 1, 128]
    - [120, 0.0]
  - - [21120, 128, 1, 128]
    - [111, 0.0]
  - - [22784, 4096, 1, 128]
    - [120, 0.0]
  - - [25728, 9857, 1, 128]
    - [120, 0.0]
  - - [16256, 1024, 1, 128]
    - [120, 0.0]
  - - [18560, 4096, 1, 128]
    - [120, 0.0]
  - - [7936, 4225, 1, 128]
    - [113, 0.0]
  - - [7680, 3969, 1, 128]
    - [120, 0.0]
  - - [9472, 2048, 1, 128]
    - [120, 0.0]
  - - [28160, 128, 1, 128]
    - [120, 0.0]
  - - [18816, 512, 1, 128]
    - [120, 0.0]
  - - [9856, 512, 1, 128]
    - [118, 0.0]
  - - [17664, 9857, 1, 128]
    - [113, 0.0]
  - - [27392, 128, 1, 128]
    - [119, 0.0]
  - - [24448, 2048, 1, 128]
    - [120, 0.0]
  - - [7808, 512, 1, 128]
    - [119, 0.0]
  - - [13952, 512, 1, 128]
    - [120, 0.0]
  - - [24576, 512, 1, 128]
    - [120, 0.0]
  - - [27520, 128, 1, 128]
    - [112, 0.0]
  - - [26496, 512, 1, 128]
    - [120, 0.0]
  - - [8576, 512, 1, 128]
    - [120, 0.0]
  - - [11648, 512, 1, 128]
    - [120, 0.0]
  - - [17408, 2048, 1, 128]
    - [120, 0.0]
  - - [17920, 10241, 1, 128]
    - [120, 0.0]
  - - [16384, 1024, 1, 128]
    - [120, 0.0]
  - - [6016, 2048, 1, 128]
    - [120, 0.0]
  - - [9728, 512, 1, 128]
    - [120, 0.0]
  - - [19712, 128, 1, 128]
    - [112, 0.0]
  - - [26112, 1024, 1, 128]
    - [120, 0.0]
  - - [16768, 128, 1, 128]
    - [112, 0.0]
  - - [8960, 1024, 1, 128]
    - [120, 0.0]
  - - [6784, 128, 1, 128]
    - [111, 0.0]
  - - [12800, 4993, 1, 128]
    - [120, 0.0]
  - - [6144, 2561, 1, 128]
    - [120, 0.0]
  - - [26880, 10881, 1, 128]
    - [120, 0.0]
  - - [12928, 1024, 1, 128]
    - [120, 0.0]
  - - [7040, 3457, 1, 128]
    - [120, 0.0]
  - - [15744, 4096, 1, 128]
    - [120, 0.0]
  - - [20096, 4096, 1, 128]
    - [120, 0.0]
  - - [21760, 128, 1, 128]
    - [119, 0.0]
  - - [7936, 2048, 1, 128]
    - [120, 0.0]
  - - [24448, 8192, 1, 128]
    - [120, 0.0]
  - - [21120, 2048, 1, 128]
    - [120, 0.0]
  - - [12160, 1024, 1, 128]
    - [120, 0.0]
  - - [7168, 3457, 1, 128]
    - [120, 0.0]
  - - [15232, 7553, 1, 128]
    - [120, 0.0]
  - - [26624, 1024, 1, 128]
    - [120, 0.0]
  - - [25344, 2048, 1, 128]
    - [120, 0.0]
  - - [12544, 4865, 1, 128]
    - [120, 0.0]
  - - [21120, 4096, 1, 128]
    - [120, 0.0]
  - - [20224, 128, 1, 128]
    - [112, 0.0]
  - - [14592, 4096, 1, 128]
    - [120, 0.0]
  - - [16256, 8577, 1, 128]
    - [120, 0.0]
  - - [24192, 4096, 1, 128]
    - [120, 0.0]
  - - [21248, 1024, 1, 128]
    - [120, 0.0]
  - - [25216, 1024, 1, 128]
    - [120, 0.0]
  - - [5888, 2177, 1, 128]
    - [113, 0.0]
  - - [21504, 1024, 1, 128]
    - [120, 0.0]
  - - [17536, 1024, 1, 128]
    - [120, 0.0]
  - - [9728, 2048, 1, 128]
    - [120, 0.0]
  - - [13952, 6273, 1, 128]
    - [120, 0.0]
  - - [28800, 512, 1, 128]
    - [120, 0.0]
  - - [2304, 1793, 1, 128]
    - [113, 0.0]
  - - [12416, 128, 1, 128]
    - [118, 0.0]
  - - [20224, 1024, 1, 128]
    - [120, 0.0]
  - - [22144, 128, 1, 128]
    - [119, 0.0]
  - - [22784, 1024, 1, 128]
    - [120, 0.0]
  - - [27136, 4096, 1, 128]
    - [120, 0.0]
  - - [27264, 512, 1, 128]
    - [120, 0.0]
  - - [26240, 10241, 1, 128]
    - [120, 0.0]
  - - [27904, 4096, 1, 128]
    - [120, 0.0]
  - - [21504, 128, 1, 128]
    - [119, 0.0]
  - - [3712, 2177, 1, 128]
    - [120, 0.0]
  - - [18432, 1024, 1, 128]
    - [120, 0.0]
  - - [28672, 4096, 1, 128]
    - [120, 0.0]
  - - [25344, 4096, 1, 128]
    - [120, 0.0]
  - - [26880, 512, 1, 128]
    - [120, 0.0]
  - - [21888, 2048, 1, 128]
    - [120, 0.0]
  - - [1792, 128, 1, 128]
    - [117, 0.0]
  - - [6016, 1024, 1, 128]
    - [118, 0.0]
  - - [15104, 7425, 1, 128]
    - [113, 0.0]
  - - [22016, 2048, 1, 128]
    - [120, 0.0]
  - - [13952, 4096, 1, 128]
    - [120, 0.0]
  - - [20992, 4096, 1, 128]
    - [120, 0.0]
  - - [8064, 4481, 1, 128]
    - [113, 0.0]
  - - [12672, 4096, 1, 128]
    - [120, 0.0]
  - - [20096, 12289, 1, 128]
    - [120, 0.0]
  - - [14848, 2048, 1, 128]
    - [120, 0.0]
  - - [23168, 512, 1, 128]
    - [120, 0.0]
  - - [7680, 128, 1, 128]
    - [118, 0.0]
  - - [13312, 1024, 1, 128]
    - [120, 0.0]
  - - [10624, 1024, 1, 128]
    - [120, 0.0]
  - - [3840, 512, 1, 128]
    - [118, 0.0]
  - - [22144, 14337, 1, 128]
    - [120, 0.0]
  - - [3200, 128, 1, 128]
    - [104, 0.0]
  - - [25472, 9473, 1, 128]
    - [113, 0.0]
  - - [16768, 9089, 1, 128]
    - [120, 0.0]
  - - [12288, 2048, 1, 128]
    - [120, 0.0]
  - - [20608, 512, 1, 128]
    - [120, 0.0]
  - - [2816, 1024, 1, 128]
    - [120, 0.0]
  - - [7552, 1024, 1, 128]
    - [120, 0.0]
  - - [5120, 3457, 1, 128]
    - [113, 0.0]
  - - [25216, 2048, 1, 128]
    - [120, 0.0]
  - - [12672, 4865, 1, 128]
    - [113, 0.0]
  - - [10880, 2048, 1, 128]
    - [120, 0.0]
  - - [18176, 512, 1, 128]
    - [120, 0.0]
  - - [8320, 4609, 1, 128]
    - [120, 0.0]
  - - [16000, 4096, 1, 128]
    - [120, 0.0]
  - - [22144, 2048, 1, 128]
    - [120, 0.0]
  - - [22784, 512, 1, 128]
    - [120, 0.0]
  - - [4096, 2561, 1, 128]
    - [120, 0.0]
  - - [24576, 2048, 1, 128]
    - [120, 0.0]
  - - [26624, 4096, 1, 128]
    - [120, 0.0]
  - - [18560, 2048, 1, 128]
    - [120, 0.0]
  - - [19584, 128, 1, 128]
    - [112, 0.0]
  - - [23936, 2048, 1, 128]
    - [120, 0.0]
  - - [23552, 512, 1, 128]
    - [120, 0.0]
  - - [12032, 4096, 1, 128]
    - [120, 0.0]
  - - [3840, 2305, 1, 128]
    - [113, 0.0]
  - - [25088, 128, 1, 128]
    - [120, 0.0]
  - - [16640, 8833, 1, 128]
    - [120, 0.0]
  - - [896, 128, 1, 128]
    - [99, 0.0]
  - - [17280, 2048, 1, 128]
    - [120, 0.0]
  - - [16896, 2048, 1, 128]
    - [120, 0.0]
  - - [22656, 128, 1, 128]
    - [111, 0.0]
  - - [25728, 8192, 1, 128]
    - [120, 0.0]
  - - [16128, 128, 1, 128]
    - [112, 0.0]
  - - [3840, 1024, 1, 128]
    - [118, 0.0]
  - - [2944, 512, 1, 128]
    - [110, 0.0]
  - - [24064, 1024, 1, 128]
    - [120, 0.0]
  - - [896, 385, 1, 128]
    - [100, 0.0]
  - - [8064, 128, 1, 128]
    - [89, 0.0]
  - - [12416, 1024, 1, 128]
    - [120, 0.0]
  - - [20608, 128, 1, 128]
    - [111, 0.0]
  - - [2944, 1024, 1, 128]
    - [112, 0.0]
  - - [6656, 2048, 1, 128]
    - [120, 0.0]
  - - [24064, 128, 1, 128]
    - [111, 0.0]
  - - [15744, 7937, 1, 128]
    - [113, 0.0]
  - - [2688, 1024, 1, 128]
    - [112, 0.0]
  - - [24192, 8193, 1, 128]
    - [120, 0.0]
  - - [24320, 4096, 1, 128]
    - [120, 0.0]
  - - [24576, 8705, 1, 128]
    - [120, 0.0]
  - - [13824, 1024, 1, 128]
    - [120, 0.0]
  - - [27776, 512, 1, 128]
    - [120, 0.0]
  - - [10240, 128, 1, 128]
    - [117, 0.0]
  - - [26240, 10369, 1, 128]
    - [120, 0.0]
  - - [16512, 4096, 1, 128]
    - [120, 0.0]
  - - [9856, 6145, 1, 128]
    - [120, 0.0]
  - - [27392, 1024, 1, 128]
    - [120, 0.0]
  - - [14976, 1024, 1, 128]
    - [120, 0.0]
  - - [1280, 512, 1, 128]
    - [113, 0.0]
  - - [6528, 2817, 1, 128]
    - [120, 0.0]
  - - [12288, 512, 1, 128]
    - [120, 0.0]
  - - [5248, 512, 1, 128]
    - [120, 0.0]
  - - [28544, 4096, 1, 128]
    - [120, 0.0]
  - - [21248, 13569, 1, 128]
    - [120, 0.0]
  - - [26112, 2048, 1, 128]
    - [120, 0.0]
  - - [14208, 6401, 1, 128]
    - [113, 0.0]
  - - [13952, 128, 1, 128]
    - [112, 0.0]
  - - [2304, 1665, 1, 128]
    - [118, 0.0]
  - - [6912, 1024, 1, 128]
    - [120, 0.0]
  - - [28672, 1024, 1, 128]
    - [120, 0.0]
  - - [14592, 6913, 1, 128]
    - [120, 0.0]
  - - [24704, 1024, 1, 128]
    - [120, 0.0]
  - - [22400, 512, 1, 128]
    - [120, 0.0]
  - - [23424, 4096, 1, 128]
    - [120, 0.0]
  - - [24832, 128, 1, 128]
    - [112, 0.0]
  - - [23680, 2048, 1, 128]
    - [120, 0.0]
  - - [25984, 9985, 1, 128]
    - [113, 0.0]
  - - [15360, 512, 1, 128]
    - [118, 0.0]
  - - [21376, 2048, 1, 128]
    - [120, 0.0]
  - - [16128, 2048, 1, 128]
    - [120, 0.0]
  - - [15872, 512, 1, 128]
    - [120, 0.0]
  - - [3072, 128, 1, 128]
    - [119, 0.0]
  - - [27520, 4096, 1, 128]
    - [120, 0.0]
  - - [25216, 4096, 1, 128]
    - [120, 0.0]
  - - [28672, 12673, 1, 128]
    - [120, 0.0]
  - - [28288, 512, 1, 128]
    - [120, 0.0]
  - - [22400, 4096, 1, 128]
    - [120, 0.0]
  - - [25344, 9345, 1, 128]
    - [120, 0.0]
  - - [9984, 128, 1, 128]
    - [119, 0.0]
  - - [28416, 1024, 1, 128]
    - [120, 0.0]
  - - [27008, 8192, 1, 128]
    - [120, 0.0]
  - - [13184, 1024, 1, 128]
    - [120, 0.0]
  - - [10240, 512, 1, 128]
    - [120, 0.0]
  - - [3456, 128, 1, 128]
    - [112, 0.0]
  - - [16000, 8321, 1, 128]
    - [113, 0.0]
  - - [27520, 1024, 1, 128]
    - [120, 0.0]
  - - [25088, 1024, 1, 128]
    - [120, 0.0]
  - - [6784, 512, 1, 128]
    - [113, 0.0]
  - - [18432, 10625, 1, 128]
    - [120, 0.0]
  - - [16128, 4096, 1, 128]
    - [120, 0.0]
  - - [26880, 11009, 1, 128]
    - [120, 0.0]
  - - [28800, 12801, 1, 128]
    - [120, 0.0]
  - - [12288, 4096, 1, 128]
    - [120, 0.0]
  - - [20096, 12417, 1, 128]
    - [120, 0.0]
  - - [1920, 128, 1, 128]
    - [116, 0.0]
  - - [13056, 2048, 1, 128]
    - [120, 0.0]
  - - [384, 385, 1, 128]
    - [101, 0.0]
  - - [9088, 1024, 1, 128]
    - [120, 0.0]
  - - [6784, 1024, 1, 128]
    - [118, 0.0]
  - - [21760, 4096, 1, 128]
    - [120, 0.0]
  - - [27008, 11009, 1, 128]
    - [120, 0.0]
  - - [14208, 1024, 1, 128]
    - [120, 0.0]
  - - [25600, 512, 1, 128]
    - [120, 0.0]
  - - [23680, 1024, 1, 128]
    - [120, 0.0]
  - - [28160, 8192, 1, 128]
    - [120, 0.0]
  - - [22016, 4096, 1, 128]
    - [120, 0.0]
  - - [18688, 4096, 1, 128]
    - [120, 0.0]
  - - [10752, 1024, 1, 128]
    - [120, 0.0]
  - - [2432, 128, 1, 128]
    - [100, 0.0]
  - - [7296, 512, 1, 128]
    - [118, 0.0]
  - - [19200, 4096, 1, 128]
    - [120, 0.0]
  - - [4608, 2945, 1, 128]
    - [113, 0.0]
  - - [18816, 11009, 1, 128]
    - [113, 0.0]
  - - [9600, 1024, 1, 128]
    - [120, 0.0]
  - - [7168, 512, 1, 128]
    - [118, 0.0]
  - - [11904, 4097, 1, 128]
    - [120, 0.0]
  - - [17920, 1024, 1, 128]
    - [120, 0.0]
  - - [11520, 7809, 1, 128]
    - [113, 0.0]
  - - [22784, 14977, 1, 128]
    - [120, 0.0]
  - - [13696, 1024, 1, 128]
    - [120, 0.0]
  - - [15104, 1024, 1, 128]
    - [120, 0.0]
  - - [25216, 512, 1, 128]
    - [120, 0.0]
  - - [5376, 512, 1, 128]
    - [117, 0.0]
  - - [17408, 4096, 1, 128]
    - [120, 0.0]
  - - [25728, 512, 1, 128]
    - [120, 0.0]
  - - [896, 512, 1, 128]
    - [104, 0.0]
  - - [6912, 3329, 1, 128]
    - [113, 0.0]
  - - [22016, 512, 1, 128]
    - [118, 0.0]
  - - [22144, 4096, 1, 128]
    - [120, 0.0]
  - - [10368, 128, 1, 128]
    - [118, 0.0]
  - - [23296, 2048, 1, 128]
    - [120, 0.0]
  - - [17920, 10113, 1, 128]
    - [120, 0.0]
  - - [14848, 4096, 1, 128]
    - [120, 0.0]
  - - [26112, 128, 1, 128]
    - [113, 0.0]
  - - [28032, 8192, 1, 128]
    - [120, 0.0]
  - - [20096, 128, 1, 128]
    - [112, 0.0]
  - - [15360, 4096, 1, 128]
    - [120, 0.0]
  - - [3328, 128, 1, 128]
    - [119, 0.0]
  - - [25472, 512, 1, 128]
    - [120, 0.0]
  - - [18304, 128, 1, 128]
    - [119, 0.0]
  - - [20352, 12545, 1, 128]
    - [113, 0.0]
  - - [26624, 10753, 1, 128]
    - [120, 0.0]
  - - [20480, 2048, 1, 128]
    - [120, 0.0]
  - - [26496, 10497, 1, 128]
    - [120, 0.0]
  - - [22400, 128, 1, 128]
    - [119, 0.0]
  - - [9216, 5505, 1, 128]
    - [120, 0.0]
  - - [24064, 8193, 1, 128]
    - [120, 0.0]
  - - [4224, 128, 1, 128]
    - [123, 0.0]
  - - [6656, 3073, 1, 128]
    - [118, 0.0]
  - - [10880, 1024, 1, 128]
    - [120, 0.0]
  - - [23808, 512, 1, 128]
    - [120, 0.0]
  - - [15488, 1024, 1, 128]
    - [120, 0.0]
  - - [24704, 8705, 1, 128]
    - [120, 0.0]
  - - [12416, 4609, 1, 128]
    - [120, 0.0]
  - - [3712, 1024, 1, 128]
    - [120, 0.0]
  - - [25856, 8192, 1, 128]
    - [120, 0.0]
  - - [8320, 1024, 1, 128]
    - [120, 0.0]
  - - [16256, 512, 1, 128]
    - [120, 0.0]
  - - [18944, 2048, 1, 128]
    - [120, 0.0]
  - - [23168, 4096, 1, 128]
    - [120, 0.0]
  - - [15616, 2048, 1, 128]
    - [120, 0.0]
  - - [24320, 512, 1, 128]
    - [120, 0.0]
  - - [2688, 1025, 1, 128]
    - [118, 0.0]
  - - [12800, 5121, 1, 128]
    - [120, 0.0]
  - - [5120, 128, 1, 128]
    - [103, 0.0]
  - - [4352, 512, 1, 128]
    - [119, 0.0]
  - - [24576, 8192, 1, 128]
    - [120, 0.0]
  - - [8320, 512, 1, 128]
    - [118, 0.0]
  - - [12160, 4481, 1, 128]
    - [120, 0.0]
  - - [2560, 1025, 1, 128]
    - [111, 0.0]
  - - [19072, 1024, 1, 128]
    - [120, 0.0]
  - - [2816, 1153, 1, 128]
    - [120, 0.0]
  - - [6912, 128, 1, 128]
    - [103, 0.0]
  - - [9088, 2048, 1, 128]
    - [120, 0.0]
  - - [26368, 8192, 1, 128]
    - [120, 0.0]
  - - [17408, 9729, 1, 128]
    - [120, 0.0]
  - - [18816, 4096, 1, 128]
    - [120, 0.0]
  - - [4480, 512, 1, 128]
    - [118, 0.0]
  - - [11648, 128, 1, 128]
    - [110, 0.0]
  - - [1536, 897, 1, 128]
    - [103, 0.0]
  - - [11136, 1024, 1, 128]
    - [120, 0.0]
  - - [8704, 1024, 1, 128]
    - [120, 0.0]
  - - [19072, 2048, 1, 128]
    - [120, 0.0]
  - - [25856, 1024, 1, 128]
    - [120, 0.0]
  - - [7552, 3841, 1, 128]
    - [113, 0.0]
  - - [23296, 128, 1, 128]
    - [112, 0.0]
  - - [23424, 512, 1, 128]
    - [120, 0.0]
  - - [26368, 10497, 1, 128]
    - [120, 0.0]
  - - [18560, 1024, 1, 128]
    - [120, 0.0]
  - - [8192, 128, 1, 128]
    - [76, 0.0]
  - - [27776, 11905, 1, 128]
    - [120, 0.0]
  - - [18688, 1024, 1, 128]
    - [120, 0.0]
  - - [21248, 4096, 1, 128]
    - [120, 0.0]
  - - [16256, 8449, 1, 128]
    - [113, 0.0]
  - - [1920, 1409, 1, 128]
    - [104, 0.0]
  - - [24704, 4096, 1, 128]
    - [120, 0.0]
  - - [13824, 6145, 1, 128]
    - [120, 0.0]
  - - [6528, 512, 1, 128]
    - [120, 0.0]
  - - [21376, 128, 1, 128]
    - [119, 0.0]
  - - [11264, 1024, 1, 128]
    - [120, 0.0]
  - - [4352, 2817, 1, 128]
    - [113, 0.0]
  - - [22272, 4096, 1, 128]
    - [120, 0.0]
  - - [27264, 11265, 1, 128]
    - [120, 0.0]
  - - [28160, 1024, 1, 128]
    - [120, 0.0]
  - - [16256, 128, 1, 128]
    - [112, 0.0]
  - - [18688, 2048, 1, 128]
    - [120, 0.0]
  - - [9600, 6017, 1, 128]
    - [120, 0.0]
  - - [23552, 1024, 1, 128]
    - [120, 0.0]
  - - [8576, 128, 1, 128]
    - [77, 0.0]
  - - [20992, 13185, 1, 128]
    - [120, 0.0]
  - - [20992, 1024, 1, 128]
    - [120, 0.0]
  - - [14720, 512, 1, 128]
    - [120, 0.0]
  - - [28032, 1024, 1, 128]
    - [120, 0.0]
  - - [20352, 2048, 1, 128]
    - [120, 0.0]
  - - [15360, 128, 1, 128]
    - [118, 0.0]
  - - [8448, 2048, 1, 128]
    - [120, 0.0]
  - - [6272, 2689, 1, 128]
    - [120, 0.0]
  - - [7808, 4097, 1, 128]
    - [120, 0.0]
  - - [25472, 128, 1, 128]
    - [112, 0.0]
  - - [12288, 4481, 1, 128]
    - [120, 0.0]
  - - [28416, 4096, 1, 128]
    - [120, 0.0]
  - - [2176, 128, 1, 128]
    - [115, 0.0]
  - - [21760, 2048, 1, 128]
    - [120, 0.0]
  - - [21376, 1024, 1, 128]
    - [120, 0.0]
  - - [13696, 2048, 1, 128]
    - [120, 0.0]
  - - [28288, 12417, 1, 128]
    - [120, 0.0]
  - - [5632, 512, 1, 128]
    - [120, 0.0]
  - - [22016, 1024, 1, 128]
    - [120, 0.0]
  - - [25216, 128, 1, 128]
    - [112, 0.0]
  - - [25216, 8192, 1, 128]
    - [120, 0.0]
  - - [12032, 128, 1, 128]
    - [113, 0.0]
  - - [6144, 2048, 1, 128]
    - [120, 0.0]
  - - [23680, 128, 1, 128]
    - [119, 0.0]
  - - [15744, 128, 1, 128]
    - [112, 0.0]
  - - [3968, 512, 1, 128]
    - [112, 0.0]
  - - [16512, 1024, 1, 128]
    - [120, 0.0]
  - - [1536, 128, 1, 128]
    - [102, 0.0]
  - - [25984, 4096, 1, 128]
    - [120, 0.0]
  - - [19456, 512, 1, 128]
    - [120, 0.0]
  - - [9984, 1024, 1, 128]
    - [120, 0.0]
  - - [14080, 6401, 1, 128]
    - [120, 0.0]
  - - [20736, 2048, 1, 128]
    - [120, 0.0]
  - - [4224, 2689, 1, 128]
    - [113, 0.0]
  - - [13696, 512, 1, 128]
    - [120, 0.0]
  - - [17280, 1024, 1, 128]
    - [120, 0.0]
  - - [10752, 128, 1, 128]
    - [111, 0.0]
  - - [1536, 512, 1, 128]
    - [84, 0.0]
  - - [25728, 2048, 1, 128]
    - [120, 0.0]
  - - [9472, 128, 1, 128]
    - [110, 0.0]
  - - [7168, 3585, 1, 128]
    - [120, 0.0]
  - - [14720, 1024, 1, 128]
    - [120, 0.0]
  - - [25728, 128, 1, 128]
    - [119, 0.0]
  - - [14976, 128, 1, 128]
    - [119, 0.0]
  - - [24832, 1024, 1, 128]
    - [120, 0.0]
  - - [14080, 512, 1, 128]
    - [120, 0.0]
  - - [17152, 1024, 1, 128]
    - [120, 0.0]
  - - [19072, 512, 1, 128]
    - [120, 0.0]
  - - [21120, 1024, 1, 128]
    - [120, 0.0]
  - - [4864, 128, 1, 128]
    - [113, 0.0]
  - - [7936, 512, 1, 128]
    - [120, 0.0]
  - - [21248, 13441, 1, 128]
    - [113, 0.0]
  - - [12160, 2048, 1, 128]
    - [120, 0.0]
  - - [19712, 11905, 1, 128]
    - [113, 0.0]
  - - [23296, 1024, 1, 128]
    - [120, 0.0]
  - - [24832, 8961, 1, 128]
    - [113, 0.0]
  - - [13568, 2048, 1, 128]
    - [120, 0.0]
  - - [13696, 4096, 1, 128]
    - [120, 0.0]
  - - [5888, 128, 1, 128]
    - [92, 0.0]
  - - [10112, 2048, 1, 128]
    - [120, 0.0]
  - - [21632, 13953, 1, 128]
    - [120, 0.0]
  - - [19328, 512, 1, 128]
    - [120, 0.0]
  - - [6272, 512, 1, 128]
    - [119, 0.0]
  - - [4864, 3201, 1, 128]
    - [113, 0.0]
  - - [15232, 4096, 1, 128]
    - [120, 0.0]
  - - [23040, 4096, 1, 128]
    - [120, 0.0]
  - - [2816, 1281, 1, 128]
    - [113, 0.0]
  - - [8960, 128, 1, 128]
    - [119, 0.0]
  - - [9472, 1024, 1, 128]
    - [118, 0.0]
  - - [27648, 11777, 1, 128]
    - [120, 0.0]
  - - [28416, 2048, 1, 128]
    - [120, 0.0]
  - - [13952, 6145, 1, 128]
    - [120, 0.0]
  - - [13952, 1024, 1, 128]
    - [120, 0.0]
  - - [12544, 2048, 1, 128]
    - [120, 0.0]
  - - [10624, 7041, 1, 128]
    - [120, 0.0]
  - - [24704, 2048, 1, 128]
    - [120, 0.0]
  - - [17280, 9473, 1, 128]
    - [120, 0.0]
  - - [25088, 9217, 1, 128]
    - [120, 0.0]
  - - [10240, 6657, 1, 128]
    - [120, 0.0]
  - - [12800, 4096, 1, 128]
    - [120, 0.0]
  - - [17792, 1024, 1, 128]
    - [120, 0.0]
  - - [12160, 128, 1, 128]
    - [113, 0.0]
  - - [16512, 128, 1, 128]
    - [117, 0.0]
  - - [25856, 512, 1, 128]
    - [120, 0.0]
  - - [8576, 4865, 1, 128]
    - [113, 0.0]
  - - [25984, 1024, 1, 128]
    - [120, 0.0]
  - - [512, 128, 1, 128]
    - [99, 0.0]
  - - [10112, 128, 1, 128]
    - [110, 0.0]
  - - [28288, 2048, 1, 128]
    - [120, 0.0]
  - - [1152, 641, 1, 128]
    - [93, 0.0]
  - - [17920, 4096, 1, 128]
    - [120, 0.0]
  - - [2560, 1921, 1, 128]
    - [118, 0.0]
  - - [24704, 8833, 1, 128]
    - [120, 0.0]
  - - [3200, 512, 1, 128]
    - [118, 0.0]
  - - [6656, 2945, 1, 128]
    - [120, 0.0]
  - - [12672, 4993, 1, 128]
    - [120, 0.0]
  - - [4608, 1024, 1, 128]
    - [118, 0.0]
  - - [25856, 9985, 1, 128]
    - [120, 0.0]
  - - [23808, 2048, 1, 128]
    - [120, 0.0]
  - - [9728, 6145, 1, 128]
    - [120, 0.0]
  - - [28416, 12417, 1, 128]
    - [120, 0.0]
  - - [14464, 4096, 1, 128]
    - [120, 0.0]
  - - [21888, 128, 1, 128]
    - [112, 0.0]
  - - [23680, 15873, 1, 128]
    - [120, 0.0]
  - - [22144, 1024, 1, 128]
    - [120, 0.0]
  - - [17664, 512, 1, 256]
    - [64, 0.0]
  - - [25600, 1024, 1, 256]
    - [64, 0.0]
  - - [28928, 512, 1, 256]
    - [64, 0.0]
  - - [15104, 512, 1, 256]
    - [64, 0.0]
  - - [38912, 1024, 1, 256]
    - [69, 0.0]
  - - [34304, 8192, 1, 256]
    - [69, 0.0]
  - - [23552, 1024, 1, 256]
    - [64, 0.0]
  - - [39424, 23552, 1, 256]
    - [69, 0.0]
  - - [9472, 1024, 1, 256]
    - [64, 0.0]
  - - [28928, 13056, 1, 256]
    - [45, 0.0]
  - - [42496, 1024, 1, 256]
    - [64, 0.0]
  - - [18432, 1024, 1, 256]
    - [64, 0.0]
  - - [40192, 24320, 1, 256]
    - [45, 0.0]
  - - [33280, 17152, 1, 256]
    - [45, 0.0]
  - - [27904, 512, 1, 256]
    - [64, 0.0]
  - - [39680, 8192, 1, 256]
    - [69, 0.0]
  - - [28160, 8192, 1, 256]
    - [69, 0.0]
  - - [25088, 8192, 1, 256]
    - [69, 0.0]
  - - [23040, 15360, 1, 256]
    - [69, 0.0]
  - - [19712, 11776, 1, 256]
    - [64, 0.0]
  - - [43520, 27648, 1, 256]
    - [69, 0.0]
  - - [44544, 4096, 1, 256]
    - [69, 0.0]
  - - [20224, 4096, 1, 256]
    - [69, 0.0]
  - - [31744, 4096, 1, 256]
    - [69, 0.0]
  - - [33024, 16896, 1, 256]
    - [64, 0.0]
  - - [32768, 8192, 1, 256]
    - [69, 0.0]
  - - [42752, 4096, 1, 256]
    - [69, 0.0]
  - - [19968, 512, 1, 256]
    - [64, 0.0]
  - - [10496, 512, 1, 256]
    - [63, 0.0]
  - - [36864, 4096, 1, 256]
    - [69, 0.0]
  - - [12288, 1024, 1, 256]
    - [64, 0.0]
  - - [22784, 14848, 1, 256]
    - [64, 0.0]
  - - [17152, 9472, 1, 256]
    - [45, 0.0]
  - - [31488, 1024, 1, 256]
    - [64, 0.0]
  - - [25344, 1024, 1, 256]
    - [64, 0.0]
  - - [33536, 512, 1, 256]
    - [64, 0.0]
  - - [28672, 8192, 1, 256]
    - [69, 0.0]
  - - [15104, 7168, 1, 256]
    - [64, 0.0]
  - - [38144, 22272, 1, 256]
    - [45, 0.0]
  - - [25344, 4096, 1, 256]
    - [69, 0.0]
  - - [6400, 2560, 1, 256]
    - [64, 0.0]
  - - [21248, 13568, 1, 256]
    - [45, 0.0]
  - - [2304, 1536, 1, 256]
    - [57, 0.0]
  - - [20992, 512, 1, 256]
    - [64, 0.0]
  - - [3072, 1024, 1, 256]
    - [64, 0.0]
  - - [36864, 20736, 1, 256]
    - [45, 0.0]
  - - [39936, 24064, 1, 256]
    - [69, 0.0]
  - - [2816, 512, 1, 256]
    - [64, 0.0]
  - - [37888, 512, 1, 256]
    - [64, 0.0]
  - - [39680, 1024, 1, 256]
    - [64, 0.0]
  - - [35584, 19712, 1, 256]
    - [45, 0.0]
  - - [25600, 9728, 1, 256]
    - [69, 0.0]
  - - [2816, 1024, 1, 256]
    - [57, 0.0]
  - - [13056, 1024, 1, 256]
    - [64, 0.0]
  - - [39680, 4096, 1, 256]
    - [69, 0.0]
  - - [4864, 3072, 1, 256]
    - [64, 0.0]
  - - [27648, 11776, 1, 256]
    - [69, 0.0]
  - - [13056, 4096, 1, 256]
    - [64, 0.0]
  - - [4096, 2304, 1, 256]
    - [59, 0.0]
  - - [34048, 1024, 1, 256]
    - [64, 0.0]
  - - [6400, 512, 1, 256]
    - [63, 0.0]
  - - [15872, 4096, 1, 256]
    - [69, 0.0]
  - - [29440, 1024, 1, 256]
    - [64, 0.0]
  - - [7424, 512, 1, 256]
    - [63, 0.0]
  - - [19200, 4096, 1, 256]
    - [69, 0.0]
  - - [37376, 21504, 1, 256]
    - [69, 0.0]
  - - [37888, 1024, 1, 256]
    - [69, 0.0]
  - - [40704, 24832, 1, 256]
    - [45, 0.0]
  - - [26112, 1024, 1, 256]
    - [64, 0.0]
  - - [25088, 8960, 1, 256]
    - [45, 0.0]
  - - [27136, 512, 1, 256]
    - [63, 0.0]
  - - [4608, 512, 1, 256]
    - [63, 0.0]
  - - [31232, 8192, 1, 256]
    - [69, 0.0]
  - - [33024, 512, 1, 256]
    - [64, 0.0]
  - - [27648, 512, 1, 256]
    - [64, 0.0]
  - - [28928, 4096, 1, 256]
    - [64, 0.0]
  - - [44544, 2048, 1, 256]
    - [69, 0.0]
  - - [43776, 27648, 1, 256]
    - [69, 0.0]
  - - [19456, 4096, 1, 256]
    - [69, 0.0]
  - - [33536, 17664, 1, 256]
    - [45, 0.0]
  - - [35328, 4096, 1, 256]
    - [69, 0.0]
  - - [13312, 5376, 1, 256]
    - [45, 0.0]
  - - [32768, 1024, 1, 256]
    - [69, 0.0]
  - - [39168, 4096, 1, 256]
    - [69, 0.0]
  - - [15616, 7936, 1, 256]
    - [45, 0.0]
  - - [41472, 25600, 1, 256]
    - [69, 0.0]
  - - [14592, 4096, 1, 256]
    - [69, 0.0]
  - - [37632, 21760, 1, 256]
    - [45, 0.0]
  - - [37376, 21248, 1, 256]
    - [45, 0.0]
  - - [14336, 6656, 1, 256]
    - [69, 0.0]
  - - [36608, 20480, 1, 256]
    - [69, 0.0]
  - - [32256, 16384, 1, 256]
    - [69, 0.0]
  - - [44544, 28416, 1, 256]
    - [45, 0.0]
  - - [26112, 512, 1, 256]
    - [64, 0.0]
  - - [41216, 25344, 1, 256]
    - [45, 0.0]
  - - [16640, 512, 1, 256]
    - [64, 0.0]
  - - [30464, 14336, 1, 256]
    - [64, 0.0]
  - - [13312, 4096, 1, 256]
    - [69, 0.0]
  - - [22528, 1024, 1, 256]
    - [64, 0.0]
  - - [5632, 1024, 1, 256]
    - [64, 0.0]
  - - [27392, 1024, 1, 256]
    - [64, 0.0]
  - - [27648, 8192, 1, 256]
    - [69, 0.0]
  - - [26368, 1024, 1, 256]
    - [64, 0.0]
  - - [43776, 4096, 1, 256]
    - [69, 0.0]
  - - [23552, 15872, 1, 256]
    - [69, 0.0]
  - - [26624, 10496, 1, 256]
    - [45, 0.0]
  - - [27392, 8192, 1, 256]
    - [69, 0.0]
  - - [17408, 9728, 1, 256]
    - [69, 0.0]
  - - [16896, 9216, 1, 256]
    - [64, 0.0]
  - - [26880, 11008, 1, 256]
    - [45, 0.0]
  - - [31488, 512, 1, 256]
    - [64, 0.0]
  - - [14336, 6400, 1, 256]
    - [44, 0.0]
  - - [17152, 512, 1, 256]
    - [64, 0.0]
  - - [7168, 512, 1, 256]
    - [64, 0.0]
  - - [41984, 26112, 1, 256]
    - [69, 0.0]
  - - [11776, 512, 1, 256]
    - [64, 0.0]
  - - [16128, 8448, 1, 256]
    - [45, 0.0]
  - - [11520, 1024, 1, 256]
    - [63, 0.0]
  - - [27904, 1024, 1, 256]
    - [64, 0.0]
  - - [37888, 8192, 1, 256]
    - [69, 0.0]
  - - [20480, 12544, 1, 256]
    - [45, 0.0]
  - - [23552, 15616, 1, 256]
    - [45, 0.0]
  - - [21504, 13824, 1, 256]
    - [69, 0.0]
  - - [27136, 11008, 1, 256]
    - [45, 0.0]
  - - [32000, 512, 1, 256]
    - [64, 0.0]
  - - [26624, 1024, 1, 256]
    - [64, 0.0]
  - - [34816, 8192, 1, 256]
    - [69, 0.0]
  - - [23040, 512, 1, 256]
    - [64, 0.0]
  - - [36608, 1024, 1, 256]
    - [69, 0.0]
  - - [43264, 8192, 1, 256]
    - [69, 0.0]
  - - [30208, 14336, 1, 256]
    - [69, 0.0]
  - - [43520, 512, 1, 256]
    - [64, 0.0]
  - - [32256, 4096, 1, 256]
    - [69, 0.0]
  - - [33792, 17664, 1, 256]
    - [45, 0.0]
  - - [10752, 6912, 1, 256]
    - [45, 0.0]
  - - [29696, 8192, 1, 256]
    - [69, 0.0]
  - - [41472, 512, 1, 256]
    - [64, 0.0]
  - - [44544, 8192, 1, 256]
    - [69, 0.0]
  - - [41472, 8192, 1, 256]
    - [69, 0.0]
  - - [38656, 4096, 1, 256]
    - [69, 0.0]
  - - [44800, 512, 1, 256]
    - [63, 0.0]
  - - [37376, 4096, 1, 256]
    - [69, 0.0]
  - - [19200, 1024, 1, 256]
    - [64, 0.0]
  - - [39680, 23552, 1, 256]
    - [69, 0.0]
  - - [30976, 8192, 1, 256]
    - [69, 0.0]
  - - [25856, 1024, 1, 256]
    - [64, 0.0]
  - - [22016, 14336, 1, 256]
    - [69, 0.0]
  - - [17152, 9216, 1, 256]
    - [64, 0.0]
  - - [18432, 10752, 1, 256]
    - [69, 0.0]
  - - [5376, 1024, 1, 256]
    - [64, 0.0]
  - - [21760, 13824, 1, 256]
    - [64, 0.0]
  - - [15360, 512, 1, 256]
    - [64, 0.0]
  - - [2560, 512, 1, 256]
    - [35, 0.0]
  - - [36096, 8192, 1, 256]
    - [69, 0.0]
  - - [42752, 26624, 1, 256]
    - [69, 0.0]
  - - [35584, 19456, 1, 256]
    - [69, 0.0]
  - - [6144, 2304, 1, 256]
    - [64, 0.0]
  - - [42240, 1024, 1, 256]
    - [64, 0.0]
  - - [26880, 4096, 1, 256]
    - [69, 0.0]
  - - [28160, 12032, 1, 256]
    - [45, 0.0]
  - - [18688, 10752, 1, 256]
    - [64, 0.0]
  - - [43520, 8192, 1, 256]
    - [69, 0.0]
  - - [8192, 4352, 1, 256]
    - [64, 0.0]
  - - [6912, 3072, 1, 256]
    - [64, 0.0]
  - - [31744, 15616, 1, 256]
    - [45, 0.0]
  - - [36352, 20224, 1, 256]
    - [45, 0.0]
  - - [41216, 25088, 1, 256]
    - [64, 0.0]
  - - [37632, 1024, 1, 256]
    - [69, 0.0]
  - - [18944, 512, 1, 256]
    - [64, 0.0]
  - - [15616, 1024, 1, 256]
    - [64, 0.0]
  - - [44288, 512, 1, 256]
    - [64, 0.0]
  - - [24832, 8704, 1, 256]
    - [64, 0.0]
  - - [21504, 13568, 1, 256]
    - [45, 0.0]
  - - [18176, 10496, 1, 256]
    - [45, 0.0]
  - - [21248, 1024, 1, 256]
    - [64, 0.0]
  - - [16384, 1024, 1, 256]
    - [64, 0.0]
  - - [25600, 8192, 1, 256]
    - [69, 0.0]
  - - [28672, 12544, 1, 256]
    - [45, 0.0]
  - - [16128, 1024, 1, 256]
    - [64, 0.0]
  - - [22272, 14592, 1, 256]
    - [45, 0.0]
  - - [1280, 512, 1, 256]
    - [57, 0.0]
  - - [36864, 20992, 1, 256]
    - [69, 0.0]
  - - [3584, 1792, 1, 256]
    - [57, 0.0]
  - - [35072, 19200, 1, 256]
    - [45, 0.0]
  - - [32000, 4096, 1, 256]
    - [69, 0.0]
  - - [28416, 1024, 1, 256]
    - [69, 0.0]
  - - [20480, 12800, 1, 256]
    - [69, 0.0]
  - - [21760, 4096, 1, 256]
    - [64, 0.0]
  - - [44288, 8192, 1, 256]
    - [69, 0.0]
  - - [33280, 4096, 1, 256]
    - [69, 0.0]
  - - [32512, 1024, 1, 256]
    - [64, 0.0]
  - - [38400, 22528, 1, 256]
    - [69, 0.0]
  - - [40448, 1024, 1, 256]
    - [69, 0.0]
  - - [5120, 512, 1, 256]
    - [63, 0.0]
  - - [29952, 8192, 1, 256]
    - [69, 0.0]
  - - [40448, 24576, 1, 256]
    - [69, 0.0]
  - - [29696, 4096, 1, 256]
    - [69, 0.0]
  - - [21504, 1024, 1, 256]
    - [63, 0.0]
  - - [19968, 1024, 1, 256]
    - [64, 0.0]
  - - [16896, 512, 1, 256]
    - [63, 0.0]
  - - [33536, 17408, 1, 256]
    - [69, 0.0]
  - - [19712, 512, 1, 256]
    - [64, 0.0]
  - - [16384, 8704, 1, 256]
    - [69, 0.0]
  - - [29952, 13824, 1, 256]
    - [64, 0.0]
  - - [14592, 6656, 1, 256]
    - [64, 0.0]
  - - [36864, 1024, 1, 256]
    - [69, 0.0]
  - - [31744, 15872, 1, 256]
    - [69, 0.0]
  - - [24832, 8960, 1, 256]
    - [45, 0.0]
  - - [23808, 1024, 1, 256]
    - [64, 0.0]
  - - [19200, 11264, 1, 256]
    - [64, 0.0]
  - - [23296, 15360, 1, 256]
    - [69, 0.0]
  - - [34304, 18432, 1, 256]
    - [69, 0.0]
  - - [22016, 1024, 1, 256]
    - [64, 0.0]
  - - [40704, 4096, 1, 256]
    - [69, 0.0]
  - - [25600, 4096, 1, 256]
    - [69, 0.0]
  - - [3328, 1024, 1, 256]
    - [63, 0.0]
  - - [30464, 8192, 1, 256]
    - [69, 0.0]
  - - [39424, 8192, 1, 256]
    - [69, 0.0]
  - - [23808, 15872, 1, 256]
    - [69, 0.0]
  - - [8960, 1024, 1, 256]
    - [64, 0.0]
  - - [44032, 4096, 1, 256]
    - [69, 0.0]
  - - [35584, 8192, 1, 256]
    - [69, 0.0]
  - - [29184, 8192, 1, 256]
    - [69, 0.0]
  - - [13824, 1024, 1, 256]
    - [64, 0.0]
  - - [36608, 8192, 1, 256]
    - [69, 0.0]
  - - [30976, 512, 1, 256]
    - [64, 0.0]
  - - [33024, 4096, 1, 256]
    - [69, 0.0]
  - - [11776, 7936, 1, 256]
    - [64, 0.0]
  - - [23808, 16128, 1, 256]
    - [45, 0.0]
  - - [22272, 14336, 1, 256]
    - [69, 0.0]
  - - [27392, 11520, 1, 256]
    - [45, 0.0]
  - - [30464, 4096, 1, 256]
    - [69, 0.0]
  - - [20992, 13312, 1, 256]
    - [69, 0.0]
  - - [44800, 1024, 1, 256]
    - [69, 0.0]
  - - [32512, 4096, 1, 256]
    - [69, 0.0]
  - - [23296, 15616, 1, 256]
    - [45, 0.0]
  - - [9216, 1024, 1, 256]
    - [64, 0.0]
  - - [20224, 12544, 1, 256]
    - [45, 0.0]
  - - [32256, 1024, 1, 256]
    - [64, 0.0]
  - - [38400, 512, 1, 256]
    - [64, 0.0]
  - - [29952, 1024, 1, 256]
    - [64, 0.0]
  - - [36352, 512, 1, 256]
    - [64, 0.0]
  - - [41728, 25600, 1, 256]
    - [69, 0.0]
  - - [32000, 1024, 1, 256]
    - [64, 0.0]
  - - [38144, 22016, 1, 256]
    - [69, 0.0]
  - - [27136, 11264, 1, 256]
    - [69, 0.0]
  - - [34048, 18176, 1, 256]
    - [45, 0.0]
  - - [22016, 14080, 1, 256]
    - [45, 0.0]
  - - [19712, 12032, 1, 256]
    - [45, 0.0]
  - - [23552, 4096, 1, 256]
    - [69, 0.0]
  - - [15872, 1024, 1, 256]
    - [64, 0.0]
  - - [37120, 512, 1, 256]
    - [63, 0.0]
  - - [9984, 1024, 1, 256]
    - [64, 0.0]
  - - [32512, 8192, 1, 256]
    - [69, 0.0]
  - - [15360, 4096, 1, 256]
    - [69, 0.0]
  - - [13056, 512, 1, 256]
    - [64, 0.0]
  - - [44032, 8192, 1, 256]
    - [69, 0.0]
  - - [24576, 8192, 1, 256]
    - [69, 0.0]
  - - [36352, 8192, 1, 256]
    - [69, 0.0]
  - - [26368, 8192, 1, 256]
    - [69, 0.0]
  - - [20480, 1024, 1, 256]
    - [64, 0.0]
  - - [35072, 8192, 1, 256]
    - [69, 0.0]
  - - [32000, 15872, 1, 256]
    - [69, 0.0]
  - - [40704, 24576, 1, 256]
    - [69, 0.0]
  - - [15104, 7424, 1, 256]
    - [45, 0.0]
  - - [25856, 4096, 1, 256]
    - [69, 0.0]
  - - [14848, 512, 1, 256]
    - [64, 0.0]
  - - [39424, 4096, 1, 256]
    - [69, 0.0]
  - - [24832, 512, 1, 256]
    - [64, 0.0]
  - - [44288, 28416, 1, 256]
    - [45, 0.0]
  - - [12544, 4608, 1, 256]
    - [64, 0.0]
  - - [12800, 4864, 1, 256]
    - [64, 0.0]
  - - [29440, 512, 1, 256]
    - [63, 0.0]
  - - [40192, 24064, 1, 256]
    - [69, 0.0]
  - - [18176, 4096, 1, 256]
    - [69, 0.0]
  - - [40960, 8192, 1, 256]
    - [69, 0.0]
  - - [42240, 512, 1, 256]
    - [64, 0.0]
  - - [9728, 512, 1, 256]
    - [63, 0.0]
  - - [14848, 7168, 1, 256]
    - [64, 0.0]
  - - [44800, 28672, 1, 256]
    - [69, 0.0]
  - - [15616, 7680, 1, 256]
    - [64, 0.0]
  - - [33280, 17408, 1, 256]
    - [69, 0.0]
  - - [42752, 1024, 1, 256]
    - [69, 0.0]
  - - [35328, 8192, 1, 256]
    - [69, 0.0]
  - - [36352, 1024, 1, 256]
    - [64, 0.0]
  - - [35840, 1024, 1, 256]
    - [64, 0.0]
  - - [41472, 4096, 1, 256]
    - [69, 0.0]
  - - [3584, 1024, 1, 256]
    - [63, 0.0]
  - - [22528, 14592, 1, 256]
    - [45, 0.0]
  - - [44032, 512, 1, 256]
    - [63, 0.0]
  - - [30720, 1024, 1, 256]
    - [64, 0.0]
  - - [39680, 512, 1, 256]
    - [64, 0.0]
  - - [22272, 1024, 1, 256]
    - [64, 0.0]
  - - [42240, 26368, 1, 256]
    - [45, 0.0]
  - - [10240, 6400, 1, 256]
    - [45, 0.0]
  - - [30976, 14848, 1, 256]
    - [69, 0.0]
  - - [41728, 25856, 1, 256]
    - [45, 0.0]
  - - [28928, 12800, 1, 256]
    - [64, 0.0]
  - - [21760, 14080, 1, 256]
    - [45, 0.0]
  - - [5888, 1024, 1, 256]
    - [64, 0.0]
  - - [24576, 8704, 1, 256]
    - [69, 0.0]
  - - [38912, 4096, 1, 256]
    - [69, 0.0]
  - - [15360, 1024, 1, 256]
    - [64, 0.0]
  - - [18688, 512, 1, 256]
    - [64, 0.0]
  - - [27392, 512, 1, 256]
    - [64, 0.0]
  - - [22784, 512, 1, 256]
    - [64, 0.0]
  - - [40448, 4096, 1, 256]
    - [69, 0.0]
  - - [19200, 512, 1, 256]
    - [64, 0.0]
  - - [26368, 10496, 1, 256]
    - [45, 0.0]
  - - [25088, 9216, 1, 256]
    - [69, 0.0]
  - - [33536, 1024, 1, 256]
    - [64, 0.0]
  - - [25600, 9472, 1, 256]
    - [45, 0.0]
  - - [13824, 4096, 1, 256]
    - [64, 0.0]
  - - [5632, 3840, 1, 256]
    - [64, 0.0]
  - - [9216, 5376, 1, 256]
    - [45, 0.0]
  - - [8960, 5120, 1, 256]
    - [64, 0.0]
  - - [19456, 512, 1, 256]
    - [64, 0.0]
  - - [24576, 4096, 1, 256]
    - [64, 0.0]
  - - [27392, 11264, 1, 256]
    - [69, 0.0]
  - - [35072, 4096, 1, 256]
    - [69, 0.0]
  - - [44288, 4096, 1, 256]
    - [69, 0.0]
  - - [40448, 8192, 1, 256]
    - [69, 0.0]
  - - [33280, 512, 1, 256]
    - [64, 0.0]
  - - [22272, 4096, 1, 256]
    - [69, 0.0]
  - - [35584, 512, 1, 256]
    - [64, 0.0]
  - - [10752, 512, 1, 256]
    - [64, 0.0]
  - - [19968, 4096, 1, 256]
    - [69, 0.0]
  - - [34304, 1024, 1, 256]
    - [64, 0.0]
  - - [41216, 8192, 1, 256]
    - [69, 0.0]
  - - [35840, 19712, 1, 256]
    - [45, 0.0]
  - - [43520, 27392, 1, 256]
    - [45, 0.0]
  - - [30720, 14848, 1, 256]
    - [69, 0.0]
  - - [38400, 22272, 1, 256]
    - [45, 0.0]
  - - [1536, 1024, 1, 256]
    - [57, 0.0]
  - - [40192, 1024, 1, 256]
    - [69, 0.0]
  - - [44800, 256, 1, 256]
    - [67, 0.0]
  - - [1536, 512, 1, 256]
    - [34, 0.0]
  - - [34560, 18432, 1, 256]
    - [69, 0.0]
  - - [1792, 1024, 1, 256]
    - [57, 0.0]
  - - [5376, 3584, 1, 256]
    - [64, 0.0]
  - - [30208, 1024, 1, 256]
    - [64, 0.0]
  - - [31232, 512, 1, 256]
    - [63, 0.0]
  - - [23040, 4096, 1, 256]
    - [69, 0.0]
  - - [35840, 4096, 1, 256]
    - [69, 0.0]
  - - [38144, 512, 1, 256]
    - [64, 0.0]
  - - [31744, 512, 1, 256]
    - [64, 0.0]
  - - [14592, 6912, 1, 256]
    - [45, 0.0]
  - - [19456, 11520, 1, 256]
    - [45, 0.0]
  - - [7168, 1024, 1, 256]
    - [63, 0.0]
  - - [18944, 11264, 1, 256]
    - [69, 0.0]
  - - [19712, 1024, 1, 256]
    - [64, 0.0]
  - - [26112, 9984, 1, 256]
    - [45, 0.0]
  - - [38656, 22784, 1, 256]
    - [45, 0.0]
  - - [24320, 8192, 1, 256]
    - [69, 0.0]
  - - [4864, 1024, 1, 256]
    - [63, 0.0]
  - - [20480, 4096, 1, 256]
    - [69, 0.0]
  - - [10240, 1024, 1, 256]
    - [64, 0.0]
  - - [31232, 15360, 1, 256]
    - [69, 0.0]
  - - [24320, 4096, 1, 256]
    - [67, 0.0]
  - - [33792, 1024, 1, 256]
    - [64, 0.0]
  - - [12032, 1024, 1, 256]
    - [64, 0.0]
  - - [39168, 512, 1, 256]
    - [64, 0.0]
  - - [16896, 4096, 1, 256]
    - [69, 0.0]
  - - [36096, 1024, 1, 256]
    - [69, 0.0]
  - - [28416, 12544, 1, 256]
    - [45, 0.0]
  - - [30720, 4096, 1, 256]
    - [69, 0.0]
  - - [19712, 4096, 1, 256]
    - [69, 0.0]
  - - [37120, 21248, 1, 256]
    - [45, 0.0]
  - - [16384, 4096, 1, 256]
    - [69, 0.0]
  - - [18688, 11008, 1, 256]
    - [45, 0.0]
  - - [38400, 8192, 1, 256]
    - [69, 0.0]
  - - [11264, 7424, 1, 256]
    - [45, 0.0]
  - - [23296, 512, 1, 256]
    - [64, 0.0]
  - - [25344, 512, 1, 256]
    - [64, 0.0]
  - - [44544, 256, 1, 256]
    - [64, 0.0]
  - - [43264, 4096, 1, 256]
    - [69, 0.0]
  - - [32512, 16640, 1, 256]
    - [45, 0.0]
  - - [39936, 8192, 1, 256]
    - [69, 0.0]
  - - [43264, 512, 1, 256]
    - [63, 0.0]
  - - [16640, 8704, 1, 256]
    - [64, 0.0]
  - - [26624, 8192, 1, 256]
    - [69, 0.0]
  - - [35328, 19456, 1, 256]
    - [69, 0.0]
  - - [42752, 26880, 1, 256]
    - [45, 0.0]
  - - [25344, 9216, 1, 256]
    - [69, 0.0]
  - - [34048, 8192, 1, 256]
    - [69, 0.0]
  - - [18688, 4096, 1, 256]
    - [69, 0.0]
  - - [37632, 8192, 1, 256]
    - [69, 0.0]
  - - [19968, 12032, 1, 256]
    - [45, 0.0]
  - - [8448, 4608, 1, 256]
    - [64, 0.0]
  - - [2048, 1536, 1, 256]
    - [57, 0.0]
  - - [31488, 15616, 1, 256]
    - [45, 0.0]
  - - [35328, 512, 1, 256]
    - [64, 0.0]
  - - [37376, 8192, 1, 256]
    - [69, 0.0]
  - - [33792, 8192, 1, 256]
    - [69, 0.0]
  - - [36608, 4096, 1, 256]
    - [69, 0.0]
  - - [28416, 8192, 1, 256]
    - [69, 0.0]
  - - [5632, 512, 1, 256]
    - [40, 0.0]
  - - [13568, 4096, 1, 256]
    - [64, 0.0]
  - - [17664, 9728, 1, 256]
    - [64, 0.0]
  - - [13568, 1024, 1, 256]
    - [64, 0.0]
  - - [8448, 512, 1, 256]
    - [64, 0.0]
  - - [22528, 4096, 1, 256]
    - [69, 0.0]
  - - [33536, 8192, 1, 256]
    - [69, 0.0]
  - - [23296, 1024, 1, 256]
    - [64, 0.0]
  - - [43520, 4096, 1, 256]
    - [69, 0.0]
  - - [39936, 23808, 1, 256]
    - [45, 0.0]
  - - [12544, 4096, 1, 256]
    - [64, 0.0]
  - - [22016, 4096, 1, 256]
    - [69, 0.0]
  - - [14592, 512, 1, 256]
    - [63, 0.0]
  - - [39936, 4096, 1, 256]
    - [69, 0.0]
  - - [18176, 1024, 1, 256]
    - [64, 0.0]
  - - [44800, 2048, 1, 256]
    - [67, 0.0]
  - - [14848, 4096, 1, 256]
    - [69, 0.0]
  - - [20224, 12288, 1, 256]
    - [69, 0.0]
  - - [16896, 8960, 1, 256]
    - [45, 0.0]
  - - [43264, 27392, 1, 256]
    - [45, 0.0]
  - - [24064, 16128, 1, 256]
    - [45, 0.0]
  - - [1024, 512, 1, 256]
    - [127, 0.0]
  - - [24576, 8448, 1, 256]
    - [45, 0.0]
  - - [25344, 9472, 1, 256]
    - [45, 0.0]
  - - [3328, 1536, 1, 256]
    - [64, 0.0]
  - - [31488, 4096, 1, 256]
    - [69, 0.0]
  - - [43008, 8192, 1, 256]
    - [69, 0.0]
  - - [28672, 12800, 1, 256]
    - [69, 0.0]
  - - [20736, 13056, 1, 256]
    - [45, 0.0]
  - - [17664, 9984, 1, 256]
    - [45, 0.0]
  - - [17920, 1024, 1, 256]
    - [64, 0.0]
  - - [11008, 1024, 1, 256]
    - [63, 0.0]
  - - [44800, 4096, 1, 256]
    - [69, 0.0]
  - - [29952, 14080, 1, 256]
    - [45, 0.0]
  - - [39168, 23296, 1, 256]
    - [45, 0.0]
  - - [9472, 512, 1, 256]
    - [64, 0.0]
  - - [27904, 8192, 1, 256]
    - [69, 0.0]
  - - [5120, 1024, 1, 256]
    - [64, 0.0]
  - - [15872, 7936, 1, 256]
    - [64, 0.0]
  - - [13568, 5632, 1, 256]
    - [64, 0.0]
  - - [17920, 9984, 1, 256]
    - [45, 0.0]
  - - [16640, 8960, 1, 256]
    - [45, 0.0]
  - - [41984, 4096, 1, 256]
    - [69, 0.0]
  - - [6912, 512, 1, 256]
    - [64, 0.0]
  - - [28416, 4096, 1, 256]
    - [69, 0.0]
  - - [27648, 11520, 1, 256]
    - [45, 0.0]
  - - [7680, 3840, 1, 256]
    - [64, 0.0]
  - - [34048, 4096, 1, 256]
    - [69, 0.0]
  - - [11264, 512, 1, 256]
    - [63, 0.0]
  - - [26368, 4096, 1, 256]
    - [69, 0.0]
  - - [21248, 13312, 1, 256]
    - [69, 0.0]
  - - [15104, 1024, 1, 256]
    - [64, 0.0]
  - - [35072, 18944, 1, 256]
    - [69, 0.0]
  - - [6144, 1024, 1, 256]
    - [64, 0.0]
  - - [44800, 8192, 1, 256]
    - [69, 0.0]
  - - [25088, 512, 1, 256]
    - [64, 0.0]
  - - [27904, 12032, 1, 256]
    - [45, 0.0]
  - - [27648, 1024, 1, 256]
    - [64, 0.0]
  - - [28928, 8192, 1, 256]
    - [69, 0.0]
  - - [29440, 13312, 1, 256]
    - [69, 0.0]
  - - [43264, 27136, 1, 256]
    - [69, 0.0]
  - - [23552, 512, 1, 256]
    - [64, 0.0]
  - - [26880, 10752, 1, 256]
    - [64, 0.0]
  - - [44032, 28160, 1, 256]
    - [69, 0.0]
  - - [36096, 512, 1, 256]
    - [64, 0.0]
  - - [4352, 2560, 1, 256]
    - [64, 0.0]
  - - [38912, 8192, 1, 256]
    - [69, 0.0]
  - - [12032, 4096, 1, 256]
    - [64, 0.0]
  - - [37632, 512, 1, 256]
    - [64, 0.0]
  - - [30208, 512, 1, 256]
    - [64, 0.0]
  - - [2304, 512, 1, 256]
    - [58, 0.0]
  - - [24320, 8448, 1, 256]
    - [45, 0.0]
  - - [39424, 512, 1, 256]
    - [64, 0.0]
  - - [37632, 21504, 1, 256]
    - [69, 0.0]
  - - [17152, 1024, 1, 256]
    - [64, 0.0]
  - - [22784, 15104, 1, 256]
    - [45, 0.0]
  - - [27904, 11776, 1, 256]
    - [64, 0.0]
  - - [43008, 26880, 1, 256]
    - [45, 0.0]
  - - [41728, 4096, 1, 256]
    - [69, 0.0]
  - - [25344, 8192, 1, 256]
    - [69, 0.0]
  - - [44800, 28928, 1, 256]
    - [45, 0.0]
  - - [38912, 22784, 1, 256]
    - [45, 0.0]
  - - [44032, 1024, 1, 256]
    - [69, 0.0]
  - - [30976, 4096, 1, 256]
    - [69, 0.0]
  - - [15872, 8192, 1, 256]
    - [64, 0.0]
  - - [40960, 4096, 1, 256]
    - [69, 0.0]
  - - [35584, 1024, 1, 256]
    - [69, 0.0]
  - - [18944, 4096, 1, 256]
    - [64, 0.0]
  - - [36096, 20224, 1, 256]
    - [45, 0.0]
  - - [11008, 7168, 1, 256]
    - [64, 0.0]
  - - [7936, 1024, 1, 256]
    - [64, 0.0]
  - - [44288, 1024, 1, 256]
    - [64, 0.0]
  - - [38656, 8192, 1, 256]
    - [69, 0.0]
  - - [38144, 1024, 1, 256]
    - [64, 0.0]
  - - [41984, 1024, 1, 256]
    - [69, 0.0]
  - - [20736, 512, 1, 256]
    - [63, 0.0]
  - - [32768, 16640, 1, 256]
    - [45, 0.0]
  - - [40960, 1024, 1, 256]
    - [69, 0.0]
  - - [25856, 9984, 1, 256]
    - [45, 0.0]
  - - [29696, 13824, 1, 256]
    - [69, 0.0]
  - - [37120, 4096, 1, 256]
    - [69, 0.0]
  - - [37120, 20992, 1, 256]
    - [69, 0.0]
  - - [35072, 512, 1, 256]
    - [64, 0.0]
  - - [38656, 1024, 1, 256]
    - [64, 0.0]
  - - [37376, 512, 1, 256]
    - [64, 0.0]
  - - [32000, 16128, 1, 256]
    - [45, 0.0]
  - - [41984, 25856, 1, 256]
    - [45, 0.0]
  - - [23040, 15104, 1, 256]
    - [45, 0.0]
  - - [31232, 15104, 1, 256]
    - [45, 0.0]
  - - [25088, 4096, 1, 256]
    - [64, 0.0]
  - - [15360, 7424, 1, 256]
    - [45, 0.0]
  - - [16384, 8448, 1, 256]
    - [45, 0.0]
  - - [26624, 4096, 1, 256]
    - [69, 0.0]
  - - [14080, 6400, 1, 256]
    - [64, 0.0]
  - - [16128, 4096, 1, 256]
    - [69, 0.0]
  - - [43776, 27904, 1, 256]
    - [45, 0.0]
  - - [15872, 512, 1, 256]
    - [64, 0.0]
  - - [43776, 8192, 1, 256]
    - [69, 0.0]
  - - [10496, 6656, 1, 256]
    - [64, 0.0]
  - - [13312, 512, 1, 256]
    - [63, 0.0]
  - - [29184, 512, 1, 256]
    - [64, 0.0]
  - - [15360, 7680, 1, 256]
    - [69, 0.0]
  - - [40192, 8192, 1, 256]
    - [69, 0.0]
  - - [34560, 8192, 1, 256]
    - [69, 0.0]
  - - [25856, 8192, 1, 256]
    - [69, 0.0]
  - - [32512, 16384, 1, 256]
    - [69, 0.0]
  - - [12288, 4352, 1, 256]
    - [45, 0.0]
  - - [29440, 13568, 1, 256]
    - [45, 0.0]
  - - [28160, 1024, 1, 256]
    - [64, 0.0]
  - - [32768, 4096, 1, 256]
    - [69, 0.0]
  - - [24832, 4096, 1, 256]
    - [69, 0.0]
  - - [39680, 23808, 1, 256]
    - [45, 0.0]
  - - [22784, 4096, 1, 256]
    - [69, 0.0]
  - - [7936, 4096, 1, 256]
    - [64, 0.0]
  - - [8704, 4864, 1, 256]
    - [64, 0.0]
  - - [29696, 512, 1, 256]
    - [64, 0.0]
  - - [39424, 23296, 1, 256]
    - [45, 0.0]
  - - [17408, 9472, 1, 256]
    - [45, 0.0]
  - - [33792, 4096, 1, 256]
    - [69, 0.0]
  - - [17920, 512, 1, 256]
    - [64, 0.0]
  - - [25856, 512, 1, 256]
    - [64, 0.0]
  - - [44288, 28160, 1, 256]
    - [69, 0.0]
  - - [40192, 4096, 1, 256]
    - [69, 0.0]
  - - [21248, 512, 1, 256]
    - [64, 0.0]
  - - [3072, 512, 1, 256]
    - [64, 0.0]
  - - [29184, 13312, 1, 256]
    - [69, 0.0]
  - - [44544, 1024, 1, 256]
    - [69, 0.0]
  - - [37888, 21760, 1, 256]
    - [44, 0.0]
  - - [33792, 17920, 1, 256]
    - [69, 0.0]
  - - [6912, 1024, 1, 256]
    - [63, 0.0]
  - - [41216, 512, 1, 256]
    - [64, 0.0]
  - - [42240, 26112, 1, 256]
    - [69, 0.0]
  - - [30720, 8192, 1, 256]
    - [69, 0.0]
  - - [11776, 1024, 1, 256]
    - [64, 0.0]
  - - [43008, 4096, 1, 256]
    - [69, 0.0]
  - - [34560, 18688, 1, 256]
    - [45, 0.0]
  - - [41984, 512, 1, 256]
    - [64, 0.0]
  - - [41728, 512, 1, 256]
    - [64, 0.0]
  - - [2560, 1792, 1, 256]
    - [59, 0.0]
  - - [36864, 8192, 1, 256]
    - [69, 0.0]
  - - [40704, 8192, 1, 256]
    - [69, 0.0]
  - - [30720, 14592, 1, 256]
    - [44, 0.0]
  - - [32256, 512, 1, 256]
    - [64, 0.0]
  - - [40192, 512, 1, 256]
    - [64, 0.0]
  - - [8960, 512, 1, 256]
    - [63, 0.0]
  - - [16640, 4096, 1, 256]
    - [64, 0.0]
  - - [30976, 15104, 1, 256]
    - [45, 0.0]
  - - [27136, 8192, 1, 256]
    - [69, 0.0]
  - - [30208, 8192, 1, 256]
    - [69, 0.0]
  - - [21504, 512, 1, 256]
    - [64, 0.0]
  - - [9728, 5888, 1, 256]
    - [64, 0.0]
  - - [38912, 23040, 1, 256]
    - [69, 0.0]
  - - [7424, 1024, 1, 256]
    - [64, 0.0]
  - - [38656, 22528, 1, 256]
    - [69, 0.0]
  - - [26880, 512, 1, 256]
    - [64, 0.0]
  - - [29184, 13056, 1, 256]
    - [45, 0.0]
  - - [44032, 27904, 1, 256]
    - [45, 0.0]
  - - [38144, 8192, 1, 256]
    - [69, 0.0]
  - - [29952, 512, 1, 256]
    - [64, 0.0]
  - - [18432, 4096, 1, 256]
    - [69, 0.0]
  - - [28160, 12288, 1, 256]
    - [69, 0.0]
  - - [29696, 1024, 1, 256]
    - [64, 0.0]
  - - [39936, 1024, 1, 256]
    - [69, 0.0]
  - - [25600, 512, 1, 256]
    - [63, 0.0]
  - - [40448, 24320, 1, 256]
    - [45, 0.0]
  - - [40448, 512, 1, 256]
    - [63, 0.0]
  - - [7424, 3584, 1, 256]
    - [64, 0.0]
  - - [5376, 512, 1, 256]
    - [63, 0.0]
  - - [27136, 4096, 1, 256]
    - [69, 0.0]
  - - [35840, 19968, 1, 256]
    - [69, 0.0]
  - - [18944, 11008, 1, 256]
    - [45, 0.0]
  - - [34816, 18688, 1, 256]
    - [45, 0.0]
  - - [38400, 1024, 1, 256]
    - [69, 0.0]
  - - [36352, 20480, 1, 256]
    - [69, 0.0]
  - - [36608, 20736, 1, 256]
    - [45, 0.0]
  - - [28672, 1024, 1, 256]
    - [64, 0.0]
  - - [42496, 26624, 1, 256]
    - [69, 0.0]
  - - [31488, 15360, 1, 256]
    - [64, 0.0]
  - - [20992, 4096, 1, 256]
    - [69, 0.0]
  - - [12544, 512, 1, 256]
    - [64, 0.0]
  - - [24064, 8192, 1, 256]
    - [69, 0.0]
  - - [26880, 8192, 1, 256]
    - [69, 0.0]
  - - [4352, 512, 1, 256]
    - [64, 0.0]
  - - [7680, 1024, 1, 256]
    - [64, 0.0]
  - - [16128, 8192, 1, 256]
    - [64, 0.0]
  - - [39168, 8192, 1, 256]
    - [69, 0.0]
  - - [29440, 4096, 1, 256]
    - [69, 0.0]
  - - [33536, 4096, 1, 256]
    - [69, 0.0]
  - - [33024, 17152, 1, 256]
    - [45, 0.0]
  - - [34816, 18944, 1, 256]
    - [69, 0.0]
  - - [22016, 512, 1, 256]
    - [64, 0.0]
  - - [14848, 6912, 1, 256]
    - [45, 0.0]
  - - [20736, 12800, 1, 256]
    - [64, 0.0]
  - - [32256, 16128, 1, 256]
    - [45, 0.0]
  - - [7680, 512, 1, 256]
    - [63, 0.0]
  - - [19968, 12288, 1, 256]
    - [69, 0.0]
  - - [29184, 4096, 1, 256]
    - [69, 0.0]
  - - [15616, 4096, 1, 256]
    - [64, 0.0]
  - - [44544, 28672, 1, 256]
    - [69, 0.0]
  - - [26112, 4096, 1, 256]
    - [69, 0.0]
  - - [26624, 10752, 1, 256]
    - [69, 0.0]
  - - [15104, 4096, 1, 256]
    - [64, 0.0]
  - - [23296, 4096, 1, 256]
    - [69, 0.0]
  - - [37888, 22016, 1, 256]
    - [69, 0.0]
  - - [11520, 7680, 1, 256]
    - [64, 0.0]
  - - [41728, 1024, 1, 256]
    - [69, 0.0]
  - - [2304, 1792, 1, 256]
    - [57, 0.0]
  - - [34048, 17920, 1, 256]
    - [69, 0.0]
  - - [1536, 768, 1, 256]
    - [56, 0.0]
  - - [33280, 8192, 1, 256]
    - [69, 0.0]
  - - [11264, 1024, 1, 256]
    - [64, 0.0]
  - - [21760, 1024, 1, 256]
    - [64, 0.0]
  - - [18432, 10496, 1, 256]
    - [45, 0.0]
  - - [41216, 4096, 1, 256]
    - [69, 0.0]
  - - [41472, 25344, 1, 256]
    - [45, 0.0]
  - - [17408, 1024, 1, 256]
    - [64, 0.0]
  - - [19456, 1024, 1, 256]
    - [64, 0.0]
  - - [36096, 19968, 1, 256]
    - [69, 0.0]
  - - [8704, 512, 1, 256]
    - [63, 0.0]
  - - [30464, 1024, 1, 256]
    - [64, 0.0]
  - - [8192, 1024, 1, 256]
    - [64, 0.0]
  - - [11520, 512, 1, 256]
    - [64, 0.0]
  - - [44544, 512, 1, 256]
    - [63, 0.0]
  - - [20736, 4096, 1, 256]
    - [64, 0.0]
  - - [42752, 8192, 1, 256]
    - [69, 0.0]
  - - [39936, 512, 1, 256]
    - [64, 0.0]
  - - [42496, 26368, 1, 256]
    - [45, 0.0]
  - - [28672, 4096, 1, 256]
    - [69, 0.0]
  - - [35840, 8192, 1, 256]
    - [69, 0.0]
  - - [17664, 1024, 1, 256]
    - [64, 0.0]
  - - [21248, 4096, 1, 256]
    - [69, 0.0]
  - - [1280, 768, 1, 256]
    - [58, 0.0]
  - - [28160, 512, 1, 256]
    - [64, 0.0]
  - - [34304, 18176, 1, 256]
    - [45, 0.0]
  - - [19200, 11520, 1, 256]
    - [45, 0.0]
  - - [25856, 9728, 1, 256]
    - [64, 0.0]
  - - [35328, 19200, 1, 256]
    - [45, 0.0]
  - - [29440, 8192, 1, 256]
    - [69, 0.0]
  - - [20992, 13056, 1, 256]
    - [45, 0.0]
  - - [21760, 512, 1, 256]
    - [64, 0.0]
  - - [12800, 512, 1, 256]
    - [63, 0.0]
  - - [28416, 12288, 1, 256]
    - [64, 0.0]
  - - [29696, 13568, 1, 256]
    - [45, 0.0]
  - - [21504, 4096, 1, 256]
    - [69, 0.0]
  - - [30464, 14592, 1, 256]
    - [45, 0.0]
  - - [13056, 5120, 1, 256]
    - [64, 0.0]
  - - [34560, 4096, 1, 256]
    - [69, 0.0]
  - - [32768, 16896, 1, 256]
    - [69, 0.0]
  - - [13824, 5888, 1, 256]
    - [45, 0.0]
  - - [33024, 8192, 1, 256]
    - [69, 0.0]
  - - [14080, 4096, 1, 256]
    - [64, 0.0]
  - - [43008, 1024, 1, 256]
    - [69, 0.0]
  - - [31744, 1024, 1, 256]
    - [64, 0.0]
  - - [11008, 512, 1, 256]
    - [64, 0.0]
  - - [24832, 8192, 1, 256]
    - [69, 0.0]
  - - [43776, 512, 1, 256]
    - [64, 0.0]
  - - [24064, 1024, 1, 256]
    - [63, 0.0]
  - - [12800, 4096, 1, 256]
    - [64, 0.0]
  - - [19456, 11776, 1, 256]
    - [69, 0.0]
  - - [22528, 14848, 1, 256]
    - [69, 0.0]
  - - [30208, 14080, 1, 256]
    - [45, 0.0]
  - - [40704, 1024, 1, 256]
    - [69, 0.0]
  - - [35584, 4096, 1, 256]
    - [69, 0.0]
  - - [26112, 8192, 1, 256]
    - [69, 0.0]
  - - [9472, 5632, 1, 256]
    - [64, 0.0]
  - - [15616, 512, 1, 256]
    - [64, 0.0]
  - - [34816, 4096, 1, 256]
    - [69, 0.0]
  - - [31232, 4096, 1, 256]
    - [69, 0.0]
  - - [9728, 1024, 1, 256]
    - [63, 0.0]
  - - [13312, 1024, 1, 256]
    - [64, 0.0]
  - - [20224, 1024, 1, 256]
    - [64, 0.0]
  - - [4864, 512, 1, 256]
    - [64, 0.0]
  - - [34304, 4096, 1, 256]
    - [69, 0.0]
  - - [43776, 1024, 1, 256]
    - [69, 0.0]
  - - [37120, 8192, 1, 256]
    - [69, 0.0]
  - - [33792, 512, 1, 256]
    - [64, 0.0]
  - - [42496, 512, 1, 256]
    - [64, 0.0]
  - - [9216, 512, 1, 256]
    - [63, 0.0]
  - - [14336, 4096, 1, 256]
    - [64, 0.0]
  - - [43008, 27136, 1, 256]
    - [69, 0.0]
  - - [35840, 512, 1, 256]
    - [64, 0.0]
  - - [40960, 25088, 1, 256]
    - [69, 0.0]
  - - [17408, 512, 1, 256]
    - [64, 0.0]
  - - [12288, 4096, 1, 256]
    - [64, 0.0]
  - - [6656, 512, 1, 256]
    - [64, 0.0]
  - - [40960, 24832, 1, 256]
    - [45, 0.0]
  - - [39168, 23040, 1, 256]
    - [69, 0.0]
  - - [512, 1, 1, 128]
    - [134, 0.0]
  - - [384, 1, 1, 384]
    - [134, 0.0]
  - - [256, 1, 1, 256]
    - [134, 0.0]
  - - [128, 1, 1, 128]
    - [134, 0.0]
  - - [640, 1, 1, 128]
    - [134, 0.0]
  - - [1, 128, 1, 256]
    - [134, 0.0]
  - - [512, 128, 1, 256]
    - [145, 0.0]
  - - [2049, 128, 1, 256]
    - [56, 0.0]
  - - [49, 128, 1, 256]
    - [147, 0.0]
  - - [1537, 128, 1, 256]
    - [56, 0.0]
  - - [257, 128, 1, 256]
    - [54, 0.0]
  - - [9728, 128, 1, 256]
    - [68, 0.0]
  - - [3840, 128, 1, 256]
    - [58, 0.0]
  - - [1280, 128, 1, 256]
    - [56, 0.0]
  - - [7168, 128, 1, 256]
    - [132, 0.0]
  - - [6656, 128, 1, 256]
    - [132, 0.0]
  - - [2561, 128, 1, 256]
    - [62, 0.0]
  - - [6912, 128, 1, 256]
    - [132, 0.0]
  - - [2048, 128, 1, 256]
    - [62, 0.0]
  - - [2304, 128, 1, 256]
    - [58, 0.0]
  - - [1536, 128, 1, 256]
    - [56, 0.0]
  - - [4864, 128, 1, 256]
    - [34, 0.0]
  - - [8448, 128, 1, 256]
    - [131, 0.0]
  - - [3072, 128, 1, 256]
    - [65, 0.0]
  - - [3329, 128, 1, 256]
    - [58, 0.0]
  - - [3328, 128, 1, 256]
    - [58, 0.0]
  - - [8960, 128, 1, 256]
    - [130, 0.0]
  - - [9216, 128, 1, 256]
    - [53, 0.0]
  - - [2817, 128, 1, 256]
    - [56, 0.0]
  - - [6400, 128, 1, 256]
    - [138, 0.0]
  - - [561, 128, 1, 256]
    - [143, 0.0]
  - - [2816, 128, 1, 256]
    - [58, 0.0]
  - - [3073, 128, 1, 256]
    - [56, 0.0]
  - - [2097, 128, 1, 256]
    - [58, 0.0]
  - - [768, 128, 1, 256]
    - [54, 0.0]
  - - [9984, 128, 1, 256]
    - [62, 0.0]
  - - [3584, 128, 1, 256]
    - [58, 0.0]
  - - [817, 128, 1, 256]
    - [60, 0.0]
  - - [5632, 128, 1, 256]
    - [140, 0.0]
  - - [9472, 128, 1, 256]
    - [58, 0.0]
  - - [2305, 128, 1, 256]
    - [58, 0.0]
  - - [1329, 128, 1, 256]
    - [62, 0.0]
  - - [5888, 128, 1, 256]
    - [136, 0.0]
  - - [7680, 128, 1, 256]
    - [132, 0.0]
  - - [4608, 128, 1, 256]
    - [139, 0.0]
  - - [2353, 128, 1, 256]
    - [58, 0.0]
  - - [5120, 128, 1, 256]
    - [137, 0.0]
  - - [769, 128, 1, 256]
    - [54, 0.0]
  - - [1792, 128, 1, 256]
    - [56, 0.0]
  - - [1073, 128, 1, 256]
    - [62, 0.0]
  - - [513, 128, 1, 256]
    - [60, 0.0]
  - - [4096, 128, 1, 256]
    - [58, 0.0]
  - - [7424, 128, 1, 256]
    - [132, 0.0]
  - - [4352, 128, 1, 256]
    - [34, 0.0]
  - - [1793, 128, 1, 256]
    - [58, 0.0]
  - - [8192, 128, 1, 256]
    - [40, 0.0]
  - - [1281, 128, 1, 256]
    - [56, 0.0]
  - - [305, 128, 1, 256]
    - [142, 0.0]
  - - [2560, 128, 1, 256]
    - [58, 0.0]
  - - [2609, 128, 1, 256]
    - [58, 0.0]
  - - [1585, 128, 1, 256]
    - [62, 0.0]
  - - [8704, 128, 1, 256]
    - [135, 0.0]
  - - [10240, 128, 1, 256]
    - [144, 0.0]
  - - [256, 128, 1, 256]
    - [146, 0.0]
  - - [1025, 128, 1, 256]
    - [56, 0.0]
  - - [2865, 128, 1, 256]
    - [58, 0.0]
  - - [5376, 128, 1, 256]
    - [59, 0.0]
  - - [1841, 128, 1, 256]
    - [56, 0.0]
  - - [7936, 128, 1, 256]
    - [42, 0.0]
  - - [6144, 128, 1, 256]
    - [141, 0.0]
  - - [1024, 128, 1, 256]
    - [145, 0.0]
  - - [36096, 1281, 1, 256]
    - [45, 0.0]
  - - [38656, 2816, 1, 256]
    - [47, 0.0]
  - - [35072, 2048, 1, 256]
    - [53, 0.0]
  - - [39424, 2865, 1, 256]
    - [53, 0.0]
  - - [39168, 3328, 1, 256]
    - [47, 0.0]
  - - [36096, 2865, 1, 256]
    - [47, 0.0]
  - - [39216, 5632, 1, 256]
    - [53, 0.0]
  - - [38144, 6144, 1, 256]
    - [53, 0.0]
  - - [35328, 3072, 1, 256]
    - [53, 0.0]
  - - [39936, 256, 1, 256]
    - [47, 0.0]
  - - [36864, 3328, 1, 256]
    - [47, 0.0]
  - - [39168, 6144, 1, 256]
    - [53, 0.0]
  - - [36352, 4352, 1, 256]
    - [47, 0.0]
  - - [37680, 10240, 1, 256]
    - [53, 0.0]
  - - [38144, 256, 1, 256]
    - [47, 0.0]
  - - [37632, 1281, 1, 256]
    - [45, 0.0]
  - - [35632, 1792, 1, 256]
    - [53, 0.0]
  - - [36096, 4096, 1, 256]
    - [53, 0.0]
  - - [36144, 2816, 1, 256]
    - [47, 0.0]
  - - [36352, 256, 1, 256]
    - [53, 0.0]
  - - [35888, 2865, 1, 256]
    - [47, 0.0]
  - - [38912, 1280, 1, 256]
    - [47, 0.0]
  - - [37120, 3072, 1, 256]
    - [53, 0.0]
  - - [38448, 10240, 1, 256]
    - [53, 0.0]
  - - [39936, 3328, 1, 256]
    - [47, 0.0]
  - - [39168, 10240, 1, 256]
    - [53, 0.0]
  - - [39680, 3329, 1, 256]
    - [47, 0.0]
  - - [37168, 2865, 1, 256]
    - [53, 0.0]
  - - [38144, 5888, 1, 256]
    - [47, 0.0]
  - - [37120, 1281, 1, 256]
    - [45, 0.0]
  - - [37376, 10240, 1, 256]
    - [53, 0.0]
  - - [38704, 5120, 1, 256]
    - [53, 0.0]
  - - [39168, 5376, 1, 256]
    - [47, 0.0]
  - - [38656, 2865, 1, 256]
    - [47, 0.0]
  - - [37376, 3584, 1, 256]
    - [53, 0.0]
  - - [35072, 6144, 1, 256]
    - [53, 0.0]
  - - [39936, 6144, 1, 256]
    - [53, 0.0]
  - - [37632, 5376, 1, 256]
    - [47, 0.0]
  - - [36352, 2304, 1, 256]
    - [47, 0.0]
  - - [35840, 2048, 1, 256]
    - [53, 0.0]
  - - [36608, 1280, 1, 256]
    - [47, 0.0]
  - - [39936, 1792, 1, 256]
    - [47, 0.0]
  - - [36608, 3329, 1, 256]
    - [47, 0.0]
  - - [35072, 3329, 1, 256]
    - [47, 0.0]
  - - [37168, 3584, 1, 256]
    - [53, 0.0]
  - - [36096, 1792, 1, 256]
    - [47, 0.0]
  - - [39424, 3329, 1, 256]
    - [47, 0.0]
  - - [39424, 2048, 1, 256]
    - [53, 0.0]
  - - [39984, 2865, 1, 256]
    - [47, 0.0]
  - - [38448, 256, 1, 256]
    - [53, 0.0]
  - - [35584, 256, 1, 256]
    - [53, 0.0]
  - - [36608, 10240, 1, 256]
    - [53, 0.0]
  - - [38960, 5376, 1, 256]
    - [53, 0.0]
  - - [36352, 2048, 1, 256]
    - [53, 0.0]
  - - [39680, 1281, 1, 256]
    - [45, 0.0]
  - - [36608, 2304, 1, 256]
    - [47, 0.0]
  - - [39936, 1280, 1, 256]
    - [47, 0.0]
  - - [39680, 5376, 1, 256]
    - [47, 0.0]
  - - [35584, 10240, 1, 256]
    - [53, 0.0]
  - - [36864, 512, 1, 256]
    - [53, 0.0]
  - - [39424, 2816, 1, 256]
    - [47, 0.0]
  - - [35840, 2816, 1, 256]
    - [47, 0.0]
  - - [38192, 2816, 1, 256]
    - [53, 0.0]
  - - [35584, 2048, 1, 256]
    - [53, 0.0]
  - - [37936, 2865, 1, 256]
    - [53, 0.0]
  - - [39936, 2865, 1, 256]
    - [47, 0.0]
  - - [38656, 10240, 1, 256]
    - [53, 0.0]
  - - [36608, 2048, 1, 256]
    - [53, 0.0]
  - - [35120, 2816, 1, 256]
    - [47, 0.0]
  - - [39424, 5888, 1, 256]
    - [47, 0.0]
  - - [37680, 2816, 1, 256]
    - [47, 0.0]
  - - [36096, 6144, 1, 256]
    - [53, 0.0]
  - - [38144, 1281, 1, 256]
    - [45, 0.0]
  - - [37632, 2048, 1, 256]
    - [53, 0.0]
  - - [39680, 256, 1, 256]
    - [47, 0.0]
  - - [37680, 3840, 1, 256]
    - [53, 0.0]
  - - [39168, 2816, 1, 256]
    - [47, 0.0]
  - - [38192, 2865, 1, 256]
    - [53, 0.0]
  - - [38912, 4608, 1, 256]
    - [53, 0.0]
  - - [37120, 2048, 1, 256]
    - [53, 0.0]
  - - [35376, 1536, 1, 256]
    - [53, 0.0]
  - - [38448, 4864, 1, 256]
    - [47, 0.0]
  - - [38192, 10240, 1, 256]
    - [53, 0.0]
  - - [37632, 2816, 1, 256]
    - [53, 0.0]
  - - [39424, 1024, 1, 256]
    - [53, 0.0]
  - - [39168, 256, 1, 256]
    - [47, 0.0]
  - - [39984, 6144, 1, 256]
    - [53, 0.0]
  - - [38144, 4608, 1, 256]
    - [53, 0.0]
  - - [35840, 2865, 1, 256]
    - [47, 0.0]
  - - [36352, 6144, 1, 256]
    - [53, 0.0]
  - - [36864, 768, 1, 256]
    - [47, 0.0]
  - - [37888, 3328, 1, 256]
    - [47, 0.0]
  - - [36912, 3328, 1, 256]
    - [47, 0.0]
  - - [37120, 3584, 1, 256]
    - [53, 0.0]
  - - [38912, 1281, 1, 256]
    - [45, 0.0]
  - - [39472, 256, 1, 256]
    - [53, 0.0]
  - - [39936, 1281, 1, 256]
    - [45, 0.0]
  - - [37376, 5120, 1, 256]
    - [53, 0.0]
  - - [37888, 2048, 1, 256]
    - [53, 0.0]
  - - [37632, 1280, 1, 256]
    - [47, 0.0]
  - - [35376, 2816, 1, 256]
    - [47, 0.0]
  - - [38656, 3329, 1, 256]
    - [47, 0.0]
  - - [36912, 256, 1, 256]
    - [53, 0.0]
  - - [39168, 768, 1, 256]
    - [47, 0.0]
  - - [37424, 256, 1, 256]
    - [47, 0.0]
  - - [38448, 2816, 1, 256]
    - [53, 0.0]
  - - [35840, 3840, 1, 256]
    - [47, 0.0]
  - - [38912, 2865, 1, 256]
    - [47, 0.0]
  - - [36096, 1280, 1, 256]
    - [47, 0.0]
  - - [35328, 1024, 1, 256]
    - [53, 0.0]
  - - [39680, 3328, 1, 256]
    - [47, 0.0]
  - - [36352, 2816, 1, 256]
    - [47, 0.0]
  - - [38912, 256, 1, 256]
    - [53, 0.0]
  - - [39424, 3328, 1, 256]
    - [47, 0.0]
  - - [35888, 2816, 1, 256]
    - [53, 0.0]
  - - [36096, 2816, 1, 256]
    - [47, 0.0]
  - - [38960, 10240, 1, 256]
    - [53, 0.0]
  - - [35840, 3584, 1, 256]
    - [53, 0.0]
  - - [39424, 5120, 1, 256]
    - [53, 0.0]
  - - [37376, 1024, 1, 256]
    - [53, 0.0]
  - - [37632, 4096, 1, 256]
    - [53, 0.0]
  - - [36400, 2865, 1, 256]
    - [47, 0.0]
  - - [36144, 2560, 1, 256]
    - [53, 0.0]
  - - [36864, 1281, 1, 256]
    - [45, 0.0]
  - - [39424, 5376, 1, 256]
    - [47, 0.0]
  - - [36400, 2816, 1, 256]
    - [47, 0.0]
  - - [38656, 6144, 1, 256]
    - [53, 0.0]
  - - [37888, 5632, 1, 256]
    - [53, 0.0]
  - - [36912, 2865, 1, 256]
    - [47, 0.0]
  - - [38656, 4352, 1, 256]
    - [47, 0.0]
  - - [37632, 1536, 1, 256]
    - [53, 0.0]
  - - [35072, 2865, 1, 256]
    - [47, 0.0]
  - - [35888, 2304, 1, 256]
    - [47, 0.0]
  - - [38912, 3329, 1, 256]
    - [47, 0.0]
  - - [37680, 4096, 1, 256]
    - [53, 0.0]
  - - [38400, 6144, 1, 256]
    - [53, 0.0]
  - - [37888, 3840, 1, 256]
    - [47, 0.0]
  - - [36608, 3328, 1, 256]
    - [47, 0.0]
  - - [35328, 256, 1, 256]
    - [47, 0.0]
  - - [36096, 3329, 1, 256]
    - [47, 0.0]
  - - [37888, 5888, 1, 256]
    - [47, 0.0]
  - - [36864, 3329, 1, 256]
    - [47, 0.0]
  - - [35632, 256, 1, 256]
    - [47, 0.0]
  - - [38656, 4864, 1, 256]
    - [47, 0.0]
  - - [37888, 2816, 1, 256]
    - [47, 0.0]
  - - [37120, 3328, 1, 256]
    - [47, 0.0]
  - - [35328, 1536, 1, 256]
    - [53, 0.0]
  - - [35328, 1280, 1, 256]
    - [47, 0.0]
  - - [35888, 10240, 1, 256]
    - [53, 0.0]
  - - [36400, 10240, 1, 256]
    - [53, 0.0]
  - - [35072, 10240, 1, 256]
    - [53, 0.0]
  - - [39680, 2816, 1, 256]
    - [47, 0.0]
  - - [35584, 3329, 1, 256]
    - [47, 0.0]
  - - [36656, 256, 1, 256]
    - [47, 0.0]
  - - [38144, 4096, 1, 256]
    - [53, 0.0]
  - - [39936, 2816, 1, 256]
    - [47, 0.0]
  - - [36864, 3072, 1, 256]
    - [53, 0.0]
  - - [37936, 2816, 1, 256]
    - [47, 0.0]
  - - [37632, 3584, 1, 256]
    - [53, 0.0]
  - - [39984, 10240, 1, 256]
    - [53, 0.0]
  - - [38656, 512, 1, 256]
    - [53, 0.0]
  - - [35328, 10240, 1, 256]
    - [53, 0.0]
  - - [36096, 2048, 1, 256]
    - [53, 0.0]
  - - [37120, 4864, 1, 256]
    - [47, 0.0]
  - - [35840, 10240, 1, 256]
    - [53, 0.0]
  - - [39680, 5632, 1, 256]
    - [53, 0.0]
  - - [38144, 4352, 1, 256]
    - [47, 0.0]
  - - [36400, 2560, 1, 256]
    - [53, 0.0]
  - - [35840, 3329, 1, 256]
    - [47, 0.0]
  - - [37424, 10240, 1, 256]
    - [53, 0.0]
  - - [38912, 10240, 1, 256]
    - [53, 0.0]
  - - [35072, 768, 1, 256]
    - [47, 0.0]
  - - [36096, 3840, 1, 256]
    - [47, 0.0]
  - - [36656, 3072, 1, 256]
    - [53, 0.0]
  - - [39680, 1536, 1, 256]
    - [53, 0.0]
  - - [36656, 2865, 1, 256]
    - [53, 0.0]
  - - [38912, 512, 1, 256]
    - [53, 0.0]
  - - [38400, 256, 1, 256]
    - [47, 0.0]
  - - [38704, 10240, 1, 256]
    - [53, 0.0]
  - - [38912, 5376, 1, 256]
    - [47, 0.0]
  - - [35120, 256, 1, 256]
    - [47, 0.0]
  - - [38656, 3328, 1, 256]
    - [47, 0.0]
  - - [37888, 1536, 1, 256]
    - [53, 0.0]
  - - [39216, 5376, 1, 256]
    - [53, 0.0]
  - - [37376, 3329, 1, 256]
    - [47, 0.0]
  - - [37680, 256, 1, 256]
    - [53, 0.0]
  - - [39680, 6144, 1, 256]
    - [53, 0.0]
  - - [38400, 2865, 1, 256]
    - [47, 0.0]
  - - [36608, 2865, 1, 256]
    - [47, 0.0]
  - - [38912, 768, 1, 256]
    - [47, 0.0]
  - - [35584, 1792, 1, 256]
    - [47, 0.0]
  - - [39424, 256, 1, 256]
    - [47, 0.0]
  - - [36352, 1281, 1, 256]
    - [45, 0.0]
  - - [38400, 2048, 1, 256]
    - [53, 0.0]
  - - [38144, 3329, 1, 256]
    - [47, 0.0]
  - - [39680, 2048, 1, 256]
    - [53, 0.0]
  - - [38656, 256, 1, 256]
    - [47, 0.0]
  - - [39728, 2816, 1, 256]
    - [53, 0.0]
  - - [36352, 3329, 1, 256]
    - [47, 0.0]
  - - [38400, 10240, 1, 256]
    - [53, 0.0]
  - - [39984, 6400, 1, 256]
    - [53, 0.0]
  - - [37888, 4352, 1, 256]
    - [47, 0.0]
  - - [37888, 4096, 1, 256]
    - [53, 0.0]
  - - [35584, 1536, 1, 256]
    - [53, 0.0]
  - - [36096, 256, 1, 256]
    - [53, 0.0]
  - - [36864, 2048, 1, 256]
    - [53, 0.0]
  - - [36144, 2865, 1, 256]
    - [53, 0.0]
  - - [35584, 3584, 1, 256]
    - [53, 0.0]
  - - [35072, 1024, 1, 256]
    - [53, 0.0]
  - - [36352, 3328, 1, 256]
    - [47, 0.0]
  - - [39424, 1281, 1, 256]
    - [50, 0.0]
  - - [39728, 10240, 1, 256]
    - [53, 0.0]
  - - [37632, 2865, 1, 256]
    - [47, 0.0]
  - - [37168, 3328, 1, 256]
    - [47, 0.0]
  - - [37376, 5376, 1, 256]
    - [47, 0.0]
  - - [35328, 2865, 1, 256]
    - [47, 0.0]
  - - [35584, 6144, 1, 256]
    - [53, 0.0]
  - - [38704, 2816, 1, 256]
    - [53, 0.0]
  - - [36608, 3072, 1, 256]
    - [53, 0.0]
  - - [39680, 1280, 1, 256]
    - [47, 0.0]
  - - [35328, 1281, 1, 256]
    - [45, 0.0]
  - - [36608, 512, 1, 256]
    - [53, 0.0]
  - - [39936, 1536, 1, 256]
    - [53, 0.0]
  - - [39728, 5888, 1, 256]
    - [47, 0.0]
  - - [39168, 1281, 1, 256]
    - [45, 0.0]
  - - [37120, 256, 1, 256]
    - [53, 0.0]
  - - [38960, 2865, 1, 256]
    - [47, 0.0]
  - - [39168, 5120, 1, 256]
    - [53, 0.0]
  - - [36864, 256, 1, 256]
    - [53, 0.0]
  - - [36912, 2816, 1, 256]
    - [53, 0.0]
  - - [36096, 2304, 1, 256]
    - [47, 0.0]
  - - [35840, 3328, 1, 256]
    - [47, 0.0]
  - - [38704, 2865, 1, 256]
    - [47, 0.0]
  - - [38144, 1792, 1, 256]
    - [47, 0.0]
  - - [36608, 2560, 1, 256]
    - [53, 0.0]
  - - [35376, 10240, 1, 256]
    - [53, 0.0]
  - - [35840, 2304, 1, 256]
    - [47, 0.0]
  - - [35840, 1280, 1, 256]
    - [53, 0.0]
  - - [37376, 1280, 1, 256]
    - [47, 0.0]
  - - [35584, 3328, 1, 256]
    - [47, 0.0]
  - - [35584, 2865, 1, 256]
    - [47, 0.0]
  - - [39936, 10240, 1, 256]
    - [53, 0.0]
  - - [38912, 5120, 1, 256]
    - [53, 0.0]
  - - [37632, 3329, 1, 256]
    - [47, 0.0]
  - - [37888, 1792, 1, 256]
    - [47, 0.0]
  - - [36608, 1281, 1, 256]
    - [45, 0.0]
  - - [38192, 4352, 1, 256]
    - [53, 0.0]
  - - [39936, 2048, 1, 256]
    - [53, 0.0]
  - - [35072, 1281, 1, 256]
    - [45, 0.0]
  - - [39472, 2816, 1, 256]
    - [53, 0.0]
  - - [39728, 2865, 1, 256]
    - [53, 0.0]
  - - [38400, 2816, 1, 256]
    - [47, 0.0]
  - - [38400, 4608, 1, 256]
    - [53, 0.0]
  - - [39216, 10240, 1, 256]
    - [53, 0.0]
  - - [35072, 3072, 1, 256]
    - [53, 0.0]
  - - [38400, 4352, 1, 256]
    - [47, 0.0]
  - - [39216, 2816, 1, 256]
    - [53, 0.0]
  - - [35840, 1792, 1, 256]
    - [47, 0.0]
  - - [35632, 2048, 1, 256]
    - [53, 0.0]
  - - [38704, 256, 1, 256]
    - [47, 0.0]
  - - [37888, 3329, 1, 256]
    - [47, 0.0]
  - - [37888, 6144, 1, 256]
    - [53, 0.0]
  - - [37376, 6144, 1, 256]
    - [53, 0.0]
  - - [37376, 256, 1, 256]
    - [47, 0.0]
  - - [36400, 256, 1, 256]
    - [53, 0.0]
  - - [37936, 4096, 1, 256]
    - [53, 0.0]
  - - [38144, 10240, 1, 256]
    - [53, 0.0]
  - - [35376, 1792, 1, 256]
    - [53, 0.0]
  - - [37168, 10240, 1, 256]
    - [53, 0.0]
  - - [39984, 2816, 1, 256]
    - [53, 0.0]
  - - [37168, 2816, 1, 256]
    - [53, 0.0]
  - - [39424, 5632, 1, 256]
    - [53, 0.0]
  - - [36352, 1280, 1, 256]
    - [47, 0.0]
  - - [39680, 10240, 1, 256]
    - [53, 0.0]
  - - [38144, 3328, 1, 256]
    - [47, 0.0]
  - - [39168, 2048, 1, 256]
    - [53, 0.0]
  - - [35328, 6144, 1, 256]
    - [53, 0.0]
  - - [35632, 2865, 1, 256]
    - [53, 0.0]
  - - [36656, 10240, 1, 256]
    - [53, 0.0]
  - - [36608, 4352, 1, 256]
    - [47, 0.0]
  - - [35120, 2865, 1, 256]
    - [47, 0.0]
  - - [36608, 6144, 1, 256]
    - [53, 0.0]
  - - [37888, 2865, 1, 256]
    - [47, 0.0]
  - - [39168, 1024, 1, 256]
    - [53, 0.0]
  - - [38704, 4864, 1, 256]
    - [47, 0.0]
  - - [39168, 2865, 1, 256]
    - [47, 0.0]
  - - [38960, 5120, 1, 256]
    - [53, 0.0]
  - - [36864, 2816, 1, 256]
    - [47, 0.0]
  - - [38656, 1280, 1, 256]
    - [47, 0.0]
  - - [35584, 1281, 1, 256]
    - [44, 0.0]
  - - [39216, 2865, 1, 256]
    - [53, 0.0]
  - - [35120, 1280, 1, 256]
    - [47, 0.0]
  - - [36096, 3328, 1, 256]
    - [47, 0.0]
  - - [38912, 6144, 1, 256]
    - [53, 0.0]
  - - [37376, 3840, 1, 256]
    - [47, 0.0]
  - - [37424, 2816, 1, 256]
    - [53, 0.0]
  - - [36864, 10240, 1, 256]
    - [53, 0.0]
  - - [35328, 3328, 1, 256]
    - [47, 0.0]
  - - [37632, 5632, 1, 256]
    - [53, 0.0]
  - - [35072, 1536, 1, 256]
    - [53, 0.0]
  - - [36864, 2865, 1, 256]
    - [47, 0.0]
  - - [36864, 4608, 1, 256]
    - [53, 0.0]
  - - [37888, 1280, 1, 256]
    - [47, 0.0]
  - - [36864, 4864, 1, 256]
    - [47, 0.0]
  - - [37632, 256, 1, 256]
    - [53, 0.0]
  - - [38912, 2816, 1, 256]
    - [47, 0.0]
  - - [38656, 5120, 1, 256]
    - [53, 0.0]
  - - [35072, 1280, 1, 256]
    - [47, 0.0]
  - - [38400, 3329, 1, 256]
    - [47, 0.0]
  - - [35840, 1281, 1, 256]
    - [45, 0.0]
  - - [39680, 2865, 1, 256]
    - [47, 0.0]
  - - [38192, 256, 1, 256]
    - [47, 0.0]
  - - [37632, 10240, 1, 256]
    - [53, 0.0]
  - - [39984, 256, 1, 256]
    - [47, 0.0]
  - - [37424, 2865, 1, 256]
    - [47, 0.0]
  - - [37888, 256, 1, 256]
    - [53, 0.0]
  - - [36864, 6144, 1, 256]
    - [53, 0.0]
  - - [38656, 1281, 1, 256]
    - [50, 0.0]
  - - [37936, 256, 1, 256]
    - [47, 0.0]
  - - [39168, 4864, 1, 256]
    - [47, 0.0]
  - - [35840, 256, 1, 256]
    - [53, 0.0]
  - - [37888, 10240, 1, 256]
    - [53, 0.0]
  - - [39728, 6144, 1, 256]
    - [53, 0.0]
  - - [39680, 5888, 1, 256]
    - [47, 0.0]
  - - [38144, 2816, 1, 256]
    - [47, 0.0]
  - - [39728, 256, 1, 256]
    - [47, 0.0]
  - - [37376, 2816, 1, 256]
    - [47, 0.0]
  - - [36352, 2865, 1, 256]
    - [47, 0.0]
  - - [39216, 256, 1, 256]
    - [47, 0.0]
  - - [37888, 1281, 1, 256]
    - [45, 0.0]
  - - [39472, 10240, 1, 256]
    - [53, 0.0]
  - - [37376, 2048, 1, 256]
    - [53, 0.0]
  - - [36096, 10240, 1, 256]
    - [53, 0.0]
  - - [35584, 1280, 1, 256]
    - [47, 0.0]
  - - [39168, 5632, 1, 256]
    - [53, 0.0]
  - - [39936, 5632, 1, 256]
    - [53, 0.0]
  - - [35072, 256, 1, 256]
    - [47, 0.0]
  - - [35376, 2865, 1, 256]
    - [53, 0.0]
  - - [38400, 4864, 1, 256]
    - [47, 0.0]
  - - [35888, 256, 1, 256]
    - [53, 0.0]
  - - [35072, 3328, 1, 256]
    - [47, 0.0]
  - - [37936, 10240, 1, 256]
    - [53, 0.0]
  - - [36352, 10240, 1, 256]
    - [53, 0.0]
  - - [38656, 2048, 1, 256]
    - [53, 0.0]
  - - [35632, 2816, 1, 256]
    - [47, 0.0]
  - - [36912, 10240, 1, 256]
    - [53, 0.0]
  - - [39936, 5888, 1, 256]
    - [47, 0.0]
  - - [38448, 2865, 1, 256]
    - [47, 0.0]
  - - [38144, 3840, 1, 256]
    - [47, 0.0]
  - - [37632, 6144, 1, 256]
    - [53, 0.0]
  - - [37376, 3328, 1, 256]
    - [53, 0.0]
  - - [36608, 2816, 1, 256]
    - [53, 0.0]
  - - [36912, 3072, 1, 256]
    - [53, 0.0]
  - - [37120, 2816, 1, 256]
    - [47, 0.0]
  - - [38144, 2865, 1, 256]
    - [47, 0.0]
  - - [38912, 2048, 1, 256]
    - [53, 0.0]
  - - [38192, 4608, 1, 256]
    - [53, 0.0]
  - - [37120, 5120, 1, 256]
    - [53, 0.0]
  - - [38400, 3328, 1, 256]
    - [53, 0.0]
  - - [35632, 10240, 1, 256]
    - [53, 0.0]
  - - [38912, 4864, 1, 256]
    - [47, 0.0]
  - - [37120, 10240, 1, 256]
    - [53, 0.0]
  - - [37120, 3329, 1, 256]
    - [47, 0.0]
  - - [35840, 6144, 1, 256]
    - [53, 0.0]
  - - [38400, 1281, 1, 256]
    - [44, 0.0]
  - - [36144, 10240, 1, 256]
    - [53, 0.0]
  - - [38144, 1280, 1, 256]
    - [47, 0.0]
  - - [39424, 10240, 1, 256]
    - [53, 0.0]
  - - [39424, 6144, 1, 256]
    - [53, 0.0]
  - - [39424, 1280, 1, 256]
    - [47, 0.0]
  - - [35328, 3329, 1, 256]
    - [47, 0.0]
  - - [39472, 5888, 1, 256]
    - [53, 0.0]
  - - [36352, 4096, 1, 256]
    - [53, 0.0]
  - - [38656, 4608, 1, 256]
    - [53, 0.0]
  - - [37168, 256, 1, 256]
    - [53, 0.0]
  - - [38144, 2048, 1, 256]
    - [53, 0.0]
  - - [35840, 1536, 1, 256]
    - [53, 0.0]
  - - [37120, 1280, 1, 256]
    - [47, 0.0]
  - - [37424, 3840, 1, 256]
    - [53, 0.0]
  - - [37424, 3584, 1, 256]
    - [53, 0.0]
  - - [36864, 2560, 1, 256]
    - [53, 0.0]
  - - [39936, 6400, 1, 256]
    - [47, 0.0]
  - - [36096, 2560, 1, 256]
    - [53, 0.0]
  - - [37120, 768, 1, 256]
    - [47, 0.0]
  - - [35328, 2048, 1, 256]
    - [53, 0.0]
  - - [36608, 4608, 1, 256]
    - [53, 0.0]
  - - [38400, 4096, 1, 256]
    - [53, 0.0]
  - - [35328, 2816, 1, 256]
    - [47, 0.0]
  - - [36144, 256, 1, 256]
    - [47, 0.0]
  - - [36608, 256, 1, 256]
    - [53, 0.0]
  - - [39168, 3329, 1, 256]
    - [47, 0.0]
  - - [38448, 4608, 1, 256]
    - [53, 0.0]
  - - [37632, 3328, 1, 256]
    - [47, 0.0]
  - - [37680, 2865, 1, 256]
    - [47, 0.0]
  - - [35120, 10240, 1, 256]
    - [53, 0.0]
  - - [37120, 6144, 1, 256]
    - [53, 0.0]
  - - [36656, 2816, 1, 256]
    - [53, 0.0]
  - - [39936, 3329, 1, 256]
    - [47, 0.0]
  - - [35328, 1792, 1, 256]
    - [47, 0.0]
  - - [35120, 1536, 1, 256]
    - [53, 0.0]
  - - [39472, 2865, 1, 256]
    - [53, 0.0]
  - - [37936, 4352, 1, 256]
    - [53, 0.0]
  - - [35888, 2048, 1, 256]
    - [53, 0.0]
  - - [37888, 3584, 1, 256]
    - [53, 0.0]
  - - [37376, 2865, 1, 256]
    - [47, 0.0]
  - - [36864, 1280, 1, 256]
    - [47, 0.0]
  - - [39472, 5632, 1, 256]
    - [53, 0.0]
  - - [37120, 1024, 1, 256]
    - [53, 0.0]
  - - [37120, 2865, 1, 256]
    - [47, 0.0]
  - - [38400, 1280, 1, 256]
    - [47, 0.0]
  - - [35584, 2816, 1, 256]
    - [47, 0.0]
  - - [37376, 1281, 1, 256]
    - [50, 0.0]
  - - [36352, 2560, 1, 256]
    - [53, 0.0]
  - - [36144, 2304, 1, 256]
    - [47, 0.0]
  - - [37632, 3840, 1, 256]
    - [47, 0.0]
  - - [38960, 2816, 1, 256]
    - [53, 0.0]
  - - [37376, 3072, 1, 256]
    - [53, 0.0]
  - - [35072, 2816, 1, 256]
    - [47, 0.0]
  - - [38912, 3328, 1, 256]
    - [47, 0.0]
  - - [38960, 256, 1, 256]
    - [53, 0.0]
  - - [35376, 256, 1, 256]
    - [47, 0.0]
  - - [39168, 1280, 1, 256]
    - [53, 0.0]
  - - [44032, 5888, 1, 256]
    - [47, 0.0]
  - - [40192, 2865, 1, 256]
    - [47, 0.0]
  - - [43312, 256, 1, 256]
    - [47, 0.0]
  - - [43520, 1280, 1, 256]
    - [47, 0.0]
  - - [41216, 2816, 1, 256]
    - [47, 0.0]
  - - [41520, 7936, 1, 256]
    - [47, 0.0]
  - - [43008, 2048, 1, 256]
    - [53, 0.0]
  - - [42496, 2048, 1, 256]
    - [53, 0.0]
  - - [40704, 3328, 1, 256]
    - [47, 0.0]
  - - [41776, 7936, 1, 256]
    - [53, 0.0]
  - - [40192, 1792, 1, 256]
    - [47, 0.0]
  - - [43520, 6144, 1, 256]
    - [53, 0.0]
  - - [42032, 2865, 1, 256]
    - [53, 0.0]
  - - [41472, 3329, 1, 256]
    - [47, 0.0]
  - - [41008, 7424, 1, 256]
    - [47, 0.0]
  - - [40448, 2865, 1, 256]
    - [47, 0.0]
  - - [41264, 2865, 1, 256]
    - [53, 0.0]
  - - [43312, 9728, 1, 256]
    - [53, 0.0]
  - - [40704, 2816, 1, 256]
    - [47, 0.0]
  - - [42544, 8704, 1, 256]
    - [53, 0.0]
  - - [40960, 7168, 1, 256]
    - [53, 0.0]
  - - [41216, 3329, 1, 256]
    - [47, 0.0]
  - - [41984, 6144, 1, 256]
    - [53, 0.0]
  - - [42240, 10240, 1, 256]
    - [53, 0.0]
  - - [42752, 2865, 1, 256]
    - [47, 0.0]
  - - [41216, 1280, 1, 256]
    - [47, 0.0]
  - - [40704, 7168, 1, 256]
    - [53, 0.0]
  - - [41216, 10240, 1, 256]
    - [53, 0.0]
  - - [40960, 256, 1, 256]
    - [47, 0.0]
  - - [40704, 2560, 1, 256]
    - [53, 0.0]
  - - [42752, 3329, 1, 256]
    - [47, 0.0]
  - - [43264, 3329, 1, 256]
    - [47, 0.0]
  - - [40192, 6144, 1, 256]
    - [53, 0.0]
  - - [43008, 10240, 1, 256]
    - [53, 0.0]
  - - [43520, 1281, 1, 256]
    - [45, 0.0]
  - - [42496, 8960, 1, 256]
    - [47, 0.0]
  - - [43312, 10240, 1, 256]
    - [53, 0.0]
  - - [44032, 6144, 1, 256]
    - [53, 0.0]
  - - [40192, 256, 1, 256]
    - [47, 0.0]
  - - [41984, 1536, 1, 256]
    - [53, 0.0]
  - - [41216, 768, 1, 256]
    - [47, 0.0]
  - - [40752, 256, 1, 256]
    - [53, 0.0]
  - - [44288, 1280, 1, 256]
    - [47, 0.0]
  - - [43520, 9216, 1, 256]
    - [53, 0.0]
  - - [42032, 8192, 1, 256]
    - [53, 0.0]
  - - [41728, 3584, 1, 256]
    - [53, 0.0]
  - - [40448, 1280, 1, 256]
    - [47, 0.0]
  - - [41216, 7168, 1, 256]
    - [53, 0.0]
  - - [42496, 1280, 1, 256]
    - [47, 0.0]
  - - [40448, 6656, 1, 256]
    - [53, 0.0]
  - - [40240, 256, 1, 256]
    - [47, 0.0]
  - - [41264, 2816, 1, 256]
    - [53, 0.0]
  - - [43264, 3328, 1, 256]
    - [47, 0.0]
  - - [43008, 9216, 1, 256]
    - [53, 0.0]
  - - [42240, 1281, 1, 256]
    - [45, 0.0]
  - - [42288, 2865, 1, 256]
    - [53, 0.0]
  - - [43008, 3328, 1, 256]
    - [47, 0.0]
  - - [40496, 256, 1, 256]
    - [47, 0.0]
  - - [43264, 8960, 1, 256]
    - [47, 0.0]
  - - [43056, 9472, 1, 256]
    - [47, 0.0]
  - - [40448, 3328, 1, 256]
    - [47, 0.0]
  - - [41776, 8192, 1, 256]
    - [53, 0.0]
  - - [40704, 6400, 1, 256]
    - [47, 0.0]
  - - [41984, 7680, 1, 256]
    - [53, 0.0]
  - - [43312, 9472, 1, 256]
    - [47, 0.0]
  - - [40192, 1280, 1, 256]
    - [47, 0.0]
  - - [43776, 5632, 1, 256]
    - [53, 0.0]
  - - [41984, 2865, 1, 256]
    - [47, 0.0]
  - - [40448, 2816, 1, 256]
    - [47, 0.0]
  - - [42240, 3328, 1, 256]
    - [47, 0.0]
  - - [42752, 2048, 1, 256]
    - [53, 0.0]
  - - [42240, 256, 1, 256]
    - [47, 0.0]
  - - [43008, 3329, 1, 256]
    - [47, 0.0]
  - - [44032, 5632, 1, 256]
    - [53, 0.0]
  - - [40192, 2048, 1, 256]
    - [53, 0.0]
  - - [41216, 256, 1, 256]
    - [47, 0.0]
  - - [44288, 9984, 1, 256]
    - [47, 0.0]
  - - [43008, 1280, 1, 256]
    - [47, 0.0]
  - - [41984, 2816, 1, 256]
    - [47, 0.0]
  - - [42752, 6144, 1, 256]
    - [53, 0.0]
