library/src/blas3/Tensile/Logic/archive/hip_Cijk_Alik_Bjlk_BBH.yaml
- {MinimumRequiredVersion: 4.9.6}
- hip
- fallback
- [Device 0000]
    SolutionIndex: 0
    SolutionNameMin: Cijk_Alik_Bjlk_BBH_MT32x32x16_SE_TT2_2_WG16_16_1
    SolutionIndex: 1
    SolutionNameMin: Cijk_Alik_Bjlk_BBH_MT16x16x16_SE_TT2_2_WG8_8_1
    SolutionIndex: 2
    SolutionNameMin: Cijk_Alik_Bjlk_BBH_MT32x32x16_SE_TT2_2_WG16_16_1
    SolutionIndex: 3
    SolutionNameMin: Cijk_Alik_Bjlk_BBH_MT64x32x16_SE_TT4_2_WG16_16_1
    SolutionIndex: 4
    SolutionNameMin: Cijk_Alik_Bjlk_BBH_MT16x16x16_SE_TT2_2_WG8_8_1
- - - [1, 127, 2, 63, 1, 1, 63, 127]
    - [4, 1.36722]
  - - [1, 129, 2, 65, 1, 1, 65, 129]
    - [2, 1.42384]
  - - [129, 1, 2, 64, 129, 129, 64, 1]
    - [2, 1.66343]
  - - [129, 129, 2, 64, 129, 129, 64, 129]
    - [0, 179.713]
  - - [128, 1, 2, 64, 128, 128, 64, 1]
    - [2, 1.48439]
  - - [128, 128, 2, 1, 128, 128, 1, 128]
    - [2, 3.45581]
  - - [129, 129, 2, 1, 129, 129, 1, 129]
    - [3, 3.51002]
  - - [129, 1, 2, 63, 129, 129, 63, 1]
    - [2, 1.5452]
  - - [1, 1, 2, 1, 1, 1, 1, 1]
    - [2, 0.000226886]
  - - [127, 1, 2, 63, 127, 127, 63, 1]
    - [4, 1.4306]
  - - [127, 128, 2, 1, 127, 127, 1, 128]
    - [2, 3.42881]
  - - [128, 128, 2, 64, 128, 128, 64, 128]
    - [0, 166.533]
  - - [129, 129, 2, 63, 129, 129, 63, 129]
    - [1, 160.826]
  - - [1, 127, 2, 64, 1, 1, 64, 127]
    - [2, 1.322]
  - - [127, 127, 2, 65, 127, 127, 65, 127]
    - [1, 153.004]
  - - [1, 129, 2, 63, 1, 1, 63, 129]
    - [4, 1.33794]
  - - [127, 127, 2, 1, 127, 127, 1, 127]
    - [3, 3.48377]
  - - [128, 127, 2, 1, 128, 128, 1, 127]
    - [3, 3.48337]
  - - [1, 128, 2, 63, 1, 1, 63, 128]
    - [2, 1.32757]
  - - [129, 1, 2, 65, 129, 129, 65, 1]
    - [2, 1.61701]
  - - [128, 1, 2, 65, 128, 128, 65, 1]
    - [2, 1.43994]
  - - [1, 127, 2, 65, 1, 1, 65, 127]
    - [2, 1.35079]
  - - [128, 1, 2, 63, 128, 128, 63, 1]
    - [2, 1.48106]
  - - [1, 128, 2, 65, 1, 1, 65, 128]
    - [2, 1.38661]
  - - [129, 128, 2, 1, 129, 129, 1, 128]
    - [3, 3.25408]
  - - [127, 1, 2, 64, 127, 127, 64, 1]
    - [2, 1.41584]
  - - [128, 128, 2, 65, 128, 128, 65, 128]
    - [0, 172.177]
  - - [127, 129, 2, 1, 127, 127, 1, 129]
    - [3, 3.53864]
  - - [129, 127, 2, 1, 129, 129, 1, 127]
    - [2, 3.45578]
  - - [127, 127, 2, 63, 127, 127, 63, 127]
    - [1, 149.915]
  - - [127, 1, 2, 65, 127, 127, 65, 1]
    - [2, 1.37583]
  - - [1, 129, 2, 64, 1, 1, 64, 129]
    - [2, 1.39318]
  - - [129, 129, 2, 65, 129, 129, 65, 129]
    - [0, 181.389]
  - - [128, 129, 2, 1, 128, 128, 1, 129]
    - [2, 3.25408]
  - - [1, 128, 2, 64, 1, 1, 64, 128]
    - [2, 1.34042]
  - - [128, 128, 2, 63, 128, 128, 63, 128]
    - [0, 164.9]
  - - [127, 127, 2, 64, 127, 127, 64, 127]
    - [0, 164.91]
- null
