library/src/blas3/Tensile/Logic/archive/hip_Cijk_Ailk_Bljk_4xi8BH.yaml
- {MinimumRequiredVersion: 4.6.0}
- hip
- fallback
- [Device 0000]
    SolutionIndex: 0
    SolutionNameMin: Cijk_Ailk_Bljk_4xi8BH_MT064x032x08_NLCA01_TT04_02_WG16_16_01
    SolutionIndex: 1
    SolutionNameMin: Cijk_Ailk_Bljk_4xi8BH_MT064x016x16_NLCA01_TT08_02_WG08_08_01
    SolutionIndex: 2
    SolutionNameMin: Cijk_Ailk_Bljk_4xi8BH_MT128x032x16_NLCA01_TT08_02_WG16_16_01
    SolutionIndex: 3
    SolutionNameMin: Cijk_Ailk_Bljk_4xi8BH_MT064x016x16_NLCA01_TT08_02_WG08_08_01
    SolutionIndex: 4
    SolutionNameMin: Cijk_Ailk_Bljk_4xi8BH_MT016x064x16_NLCA01_TT02_08_WG08_08_01
- - - [128, 128, 2, 65]
    - [0, 117.805]
  - - [128, 1, 2, 64]
    - [3, 0.565746]
  - - [127, 127, 2, 1]
    - [2, 3.47608]
  - - [129, 129, 2, 63]
    - [0, 110.589]
  - - [127, 127, 2, 65]
    - [0, 102.381]
  - - [1, 127, 2, 64]
    - [3, 0.514439]
  - - [1, 128, 2, 64]
    - [4, 0.568889]
  - - [128, 129, 2, 1]
    - [2, 3.55862]
  - - [1, 128, 2, 63]
    - [2, 0.56001]
  - - [127, 1, 2, 63]
    - [2, 0.554086]
  - - [129, 1, 2, 64]
    - [3, 0.576536]
  - - [128, 1, 2, 63]
    - [4, 0.572727]
  - - [1, 129, 2, 65]
    - [4, 0.579075]
  - - [127, 129, 2, 1]
    - [2, 3.59276]
  - - [128, 128, 2, 64]
    - [0, 104.858]
  - - [128, 1, 2, 65]
    - [3, 0.576177]
  - - [1, 129, 2, 64]
    - [3, 0.578151]
  - - [1, 129, 2, 63]
    - [2, 0.567528]
  - - [1, 128, 2, 65]
    - [3, 0.577778]
  - - [129, 129, 2, 65]
    - [0, 114.583]
  - - [128, 128, 2, 1]
    - [2, 3.47119]
  - - [1, 1, 2, 1]
    - [3, 0.000108228]
  - - [129, 1, 2, 65]
    - [2, 0.551645]
  - - [127, 1, 2, 64]
    - [3, 0.558242]
  - - [127, 128, 2, 1]
    - [2, 3.56491]
  - - [129, 127, 2, 1]
    - [2, 3.50064]
  - - [127, 1, 2, 65]
    - [3, 0.563866]
  - - [128, 127, 2, 1]
    - [2, 3.44407]
  - - [127, 127, 2, 64]
    - [0, 90.8676]
  - - [1, 127, 2, 65]
    - [3, 0.554772]
  - - [129, 1, 2, 63]
    - [3, 0.569118]
  - - [129, 129, 2, 1]
    - [2, 3.41004]
  - - [129, 129, 2, 64]
    - [0, 116.779]
  - - [127, 127, 2, 63]
    - [1, 49.908]
  - - [1, 127, 2, 63]
    - [2, 0.420221]
  - - [128, 128, 2, 63]
    - [0, 113.678]
  - - [129, 128, 2, 1]
    - [2, 3.46891]
- null
