library/src/blas3/Tensile/Logic/archive/hip_Cijk_Alik_Bjlk_HBH.yaml
- {MinimumRequiredVersion: 4.6.0}
- hip
- fallback
- [Device 0000]
    SolutionIndex: 0
    SolutionNameMin: Cijk_Alik_Bjlk_HBH_MT032x032x16_TT02_02_WG16_16_01
    SolutionIndex: 1
    SolutionNameMin: Cijk_Alik_Bjlk_HBH_MT064x032x16_TT04_02_WG16_16_01
    SolutionIndex: 2
    SolutionNameMin: Cijk_Alik_Bjlk_HBH_MT016x016x16_TT02_02_WG08_08_01
    SolutionIndex: 3
    SolutionNameMin: Cijk_Alik_Bjlk_HBH_MT032x032x16_TT02_02_WG16_16_01
    SolutionIndex: 4
    SolutionNameMin: Cijk_Alik_Bjlk_HBH_MT064x032x16_TT04_02_WG16_16_01
    SolutionIndex: 5
    SolutionNameMin: Cijk_Alik_Bjlk_HBH_MT016x016x16_TT02_02_WG08_08_01
- - - [128, 128, 2, 65]
    - [0, 143.14]
  - - [128, 1, 2, 64]
    - [3, 1.5876]
  - - [127, 127, 2, 1]
    - [4, 3.69952]
  - - [129, 129, 2, 63]
    - [0, 133.722]
  - - [127, 127, 2, 65]
    - [0, 146.428]
  - - [1, 127, 2, 64]
    - [3, 1.26211]
  - - [1, 128, 2, 64]
    - [3, 1.48406]
  - - [128, 129, 2, 1]
    - [4, 3.68571]
  - - [1, 128, 2, 63]
    - [3, 1.48235]
  - - [127, 1, 2, 63]
    - [3, 1.48167]
  - - [129, 1, 2, 64]
    - [3, 1.56364]
  - - [128, 1, 2, 63]
    - [3, 1.51579]
  - - [1, 129, 2, 65]
    - [3, 1.53011]
  - - [127, 129, 2, 1]
    - [4, 3.65692]
  - - [128, 128, 2, 64]
    - [0, 144.035]
  - - [128, 1, 2, 65]
    - [3, 1.56391]
  - - [1, 129, 2, 64]
    - [3, 1.51765]
  - - [1, 129, 2, 63]
    - [3, 1.48303]
  - - [1, 128, 2, 65]
    - [3, 1.51825]
  - - [129, 129, 2, 65]
    - [1, 144.608]
  - - [128, 128, 2, 1]
    - [3, 3.59298]
  - - [1, 1, 2, 1]
    - [5, 0.000181168]
  - - [129, 1, 2, 65]
    - [3, 1.57613]
  - - [127, 1, 2, 64]
    - [3, 1.51649]
  - - [127, 128, 2, 1]
    - [3, 3.59646]
  - - [129, 127, 2, 1]
    - [4, 3.50064]
  - - [127, 1, 2, 65]
    - [3, 1.51753]
  - - [128, 127, 2, 1]
    - [4, 3.66126]
  - - [127, 127, 2, 64]
    - [0, 140.252]
  - - [1, 127, 2, 65]
    - [3, 1.55169]
  - - [129, 1, 2, 63]
    - [3, 1.5392]
  - - [129, 129, 2, 1]
    - [4, 3.68164]
  - - [129, 129, 2, 64]
    - [0, 133.128]
  - - [127, 127, 2, 63]
    - [2, 114.429]
  - - [1, 127, 2, 63]
    - [3, 1.23477]
  - - [128, 128, 2, 63]
    - [0, 138.735]
  - - [129, 128, 2, 1]
    - [4, 3.82222]
- null
