library/src/blas3/Tensile/Logic/archive/hip_Cijk_Alik_Bjlk_4xi8BH.yaml
- {MinimumRequiredVersion: 4.6.0}
- hip
- fallback
- [Device 0000]
    SolutionIndex: 0
    SolutionNameMin: Cijk_Alik_Bjlk_4xi8BH_MT064x032x08_NLCB01_TT04_02_WG16_16_01
    SolutionIndex: 1
    SolutionNameMin: Cijk_Alik_Bjlk_4xi8BH_MT016x064x16_NLCB01_TT02_08_WG08_08_01
    SolutionIndex: 2
    SolutionNameMin: Cijk_Alik_Bjlk_4xi8BH_MT128x032x16_NLCB01_TT08_02_WG16_16_01
    SolutionIndex: 3
    SolutionNameMin: Cijk_Alik_Bjlk_4xi8BH_MT032x128x16_NLCB01_TT02_08_WG16_16_01
    SolutionIndex: 4
    SolutionNameMin: Cijk_Alik_Bjlk_4xi8BH_MT064x016x16_NLCB01_TT08_02_WG08_08_01
    SolutionIndex: 5
    SolutionNameMin: Cijk_Alik_Bjlk_4xi8BH_MT016x064x16_NLCB01_TT02_08_WG08_08_01
- - - [128, 128, 2, 65]
    - [0, 112.814]
  - - [128, 1, 2, 64]
    - [5, 0.53057]
  - - [127, 127, 2, 1]
    - [2, 2.80017]
  - - [129, 129, 2, 63]
    - [0, 109.207]
  - - [127, 127, 2, 65]
    - [0, 97.4336]
  - - [1, 127, 2, 64]
    - [5, 0.527792]
  - - [1, 128, 2, 64]
    - [5, 0.529208]
  - - [128, 129, 2, 1]
    - [2, 3.38361]
  - - [1, 128, 2, 63]
    - [2, 0.536179]
  - - [127, 1, 2, 63]
    - [2, 0.526382]
  - - [129, 1, 2, 64]
    - [5, 0.541732]
  - - [128, 1, 2, 63]
    - [3, 0.525]
  - - [1, 129, 2, 65]
    - [5, 0.538882]
  - - [127, 129, 2, 1]
    - [2, 3.35717]
  - - [128, 128, 2, 64]
    - [0, 112.508]
  - - [128, 1, 2, 65]
    - [5, 0.537468]
  - - [1, 129, 2, 64]
    - [5, 0.529239]
  - - [1, 129, 2, 63]
    - [4, 0.530492]
  - - [1, 128, 2, 65]
    - [5, 0.533342]
  - - [129, 129, 2, 65]
    - [0, 108.601]
  - - [128, 128, 2, 1]
    - [2, 3.38512]
  - - [1, 1, 2, 1]
    - [5, 0.000110619]
  - - [129, 1, 2, 65]
    - [5, 0.580679]
  - - [127, 1, 2, 64]
    - [5, 0.518367]
  - - [127, 128, 2, 1]
    - [2, 3.38667]
  - - [129, 127, 2, 1]
    - [3, 2.82466]
  - - [127, 1, 2, 65]
    - [5, 0.529167]
  - - [128, 127, 2, 1]
    - [2, 2.76463]
  - - [127, 127, 2, 64]
    - [0, 69.559]
  - - [1, 127, 2, 65]
    - [5, 0.534659]
  - - [129, 1, 2, 63]
    - [2, 0.533268]
  - - [129, 129, 2, 1]
    - [2, 3.35504]
  - - [129, 129, 2, 64]
    - [0, 106.93]
  - - [127, 127, 2, 63]
    - [1, 49.3272]
  - - [1, 127, 2, 63]
    - [4, 0.415852]
  - - [128, 128, 2, 63]
    - [0, 110.277]
  - - [129, 128, 2, 1]
    - [2, 3.2]
- null
