library/src/blas3/Tensile/Logic/archive/hip_Cijk_Ailk_Bjlk_HBH.yaml
- {MinimumRequiredVersion: 4.6.0}
- hip
- fallback
- [Device 0000]
    SolutionIndex: 0
    SolutionNameMin: Cijk_Ailk_Bjlk_HBH_MT064x032x08_NLCA01_NLCB01_TT04_02_WG16_16_01
    SolutionIndex: 1
    SolutionNameMin: Cijk_Ailk_Bjlk_HBH_MT128x032x16_NLCA01_NLCB01_TT08_02_WG16_16_01
    SolutionIndex: 2
    SolutionNameMin: Cijk_Ailk_Bjlk_HBH_MT064x016x16_NLCA01_NLCB01_TT08_02_WG08_08_01
    SolutionIndex: 3
    SolutionNameMin: Cijk_Ailk_Bjlk_HBH_MT128x032x16_NLCA01_NLCB01_TT08_02_WG16_16_01
    SolutionIndex: 4
    SolutionNameMin: Cijk_Ailk_Bjlk_HBH_MT032x128x16_NLCA01_NLCB01_TT02_08_WG16_16_01
    SolutionIndex: 5
    SolutionNameMin: Cijk_Ailk_Bjlk_HBH_MT064x016x16_NLCA01_NLCB01_TT08_02_WG08_08_01
    SolutionIndex: 6
    SolutionNameMin: Cijk_Ailk_Bjlk_HBH_MT016x064x16_NLCA01_NLCB01_TT02_08_WG08_08_01
- - - [128, 128, 2, 65]
    - [0, 166.4]
  - - [128, 1, 2, 64]
    - [3, 1.02403]
  - - [127, 127, 2, 1]
    - [3, 3.2258]
  - - [129, 129, 2, 63]
    - [0, 156.949]
  - - [127, 127, 2, 65]
    - [0, 136.513]
  - - [1, 127, 2, 64]
    - [3, 0.879654]
  - - [1, 128, 2, 64]
    - [3, 0.994205]
  - - [128, 129, 2, 1]
    - [4, 3.3561]
  - - [1, 128, 2, 63]
    - [3, 1.00299]
  - - [127, 1, 2, 63]
    - [5, 1.0754]
  - - [129, 1, 2, 64]
    - [3, 1.032]
  - - [128, 1, 2, 63]
    - [5, 1.00299]
  - - [1, 129, 2, 65]
    - [3, 1.06409]
  - - [127, 129, 2, 1]
    - [3, 3.38492]
  - - [128, 128, 2, 64]
    - [0, 166.971]
  - - [128, 1, 2, 65]
    - [3, 1.03483]
  - - [1, 129, 2, 64]
    - [3, 0.98756]
  - - [1, 129, 2, 63]
    - [3, 1.02617]
  - - [1, 128, 2, 65]
    - [3, 1.10642]
  - - [129, 129, 2, 65]
    - [0, 163.889]
  - - [128, 128, 2, 1]
    - [3, 3.38512]
  - - [1, 1, 2, 1]
    - [6, 0.000141243]
  - - [129, 1, 2, 65]
    - [3, 1.02256]
  - - [127, 1, 2, 64]
    - [5, 1.07513]
  - - [127, 128, 2, 1]
    - [4, 3.59646]
  - - [129, 127, 2, 1]
    - [4, 2.88433]
  - - [127, 1, 2, 65]
    - [3, 1.03187]
  - - [128, 127, 2, 1]
    - [4, 3.44407]
  - - [127, 127, 2, 64]
    - [1, 102.406]
  - - [1, 127, 2, 65]
    - [3, 0.929643]
  - - [129, 1, 2, 63]
    - [3, 1.03661]
  - - [129, 129, 2, 1]
    - [4, 3.43822]
  - - [129, 129, 2, 64]
    - [0, 160.395]
  - - [127, 127, 2, 63]
    - [2, 83.5648]
  - - [1, 127, 2, 63]
    - [3, 0.778307]
  - - [128, 128, 2, 63]
    - [0, 160.284]
  - - [129, 128, 2, 1]
    - [3, 3.27619]
- null
