library/src/blas3/Tensile/Logic/archive/hip_Cijk_Ailk_Bjlk_4xi8BH.yaml
- {MinimumRequiredVersion: 4.6.0}
- hip
- fallback
- [Device 0000]
    SolutionIndex: 0
    SolutionNameMin: Cijk_Ailk_Bjlk_4xi8BH_MT064x032x08_NLCA01_NLCB01_TT04_02_WG16_16_01
    SolutionIndex: 1
    SolutionNameMin: Cijk_Ailk_Bjlk_4xi8BH_MT064x016x16_NLCA01_NLCB01_TT08_02_WG08_08_01
    SolutionIndex: 2
    SolutionNameMin: Cijk_Ailk_Bjlk_4xi8BH_MT128x032x16_NLCA01_NLCB01_TT08_02_WG16_16_01
    SolutionIndex: 3
    SolutionNameMin: Cijk_Ailk_Bjlk_4xi8BH_MT032x128x16_NLCA01_NLCB01_TT02_08_WG16_16_01
    SolutionIndex: 4
    SolutionNameMin: Cijk_Ailk_Bjlk_4xi8BH_MT064x016x16_NLCA01_NLCB01_TT08_02_WG08_08_01
    SolutionIndex: 5
    SolutionNameMin: Cijk_Ailk_Bjlk_4xi8BH_MT016x064x16_NLCA01_NLCB01_TT02_08_WG08_08_01
- - - [128, 128, 2, 65]
    - [0, 119.39]
  - - [128, 1, 2, 64]
    - [2, 0.519797]
  - - [127, 127, 2, 1]
    - [2, 3.47608]
  - - [129, 129, 2, 63]
    - [0, 111.058]
  - - [127, 127, 2, 65]
    - [0, 101.588]
  - - [1, 127, 2, 64]
    - [5, 0.510561]
  - - [1, 128, 2, 64]
    - [2, 0.518489]
  - - [128, 129, 2, 1]
    - [3, 2.8469]
  - - [1, 128, 2, 63]
    - [3, 0.52093]
  - - [127, 1, 2, 63]
    - [2, 0.518199]
  - - [129, 1, 2, 64]
    - [2, 0.52122]
  - - [128, 1, 2, 63]
    - [3, 0.529134]
  - - [1, 129, 2, 65]
    - [3, 0.520161]
  - - [127, 129, 2, 1]
    - [2, 2.84427]
  - - [128, 128, 2, 64]
    - [0, 118.617]
  - - [128, 1, 2, 65]
    - [4, 0.522613]
  - - [1, 129, 2, 64]
    - [3, 0.518593]
  - - [1, 129, 2, 63]
    - [2, 0.561257]
  - - [1, 128, 2, 65]
    - [3, 0.551724]
  - - [129, 129, 2, 65]
    - [0, 114.583]
  - - [128, 128, 2, 1]
    - [3, 2.88451]
  - - [1, 1, 2, 1]
    - [4, 0.000110132]
  - - [129, 1, 2, 65]
    - [3, 0.518874]
  - - [127, 1, 2, 64]
    - [2, 0.549189]
  - - [127, 128, 2, 1]
    - [2, 3.50345]
  - - [129, 127, 2, 1]
    - [2, 2.88433]
  - - [127, 1, 2, 65]
    - [2, 0.553284]
  - - [128, 127, 2, 1]
    - [3, 2.86197]
  - - [127, 127, 2, 64]
    - [0, 90.5488]
  - - [1, 127, 2, 65]
    - [2, 0.518538]
  - - [129, 1, 2, 63]
    - [2, 0.529102]
  - - [129, 129, 2, 1]
    - [2, 2.75525]
  - - [129, 129, 2, 64]
    - [0, 117.812]
  - - [127, 127, 2, 63]
    - [1, 50.3039]
  - - [1, 127, 2, 63]
    - [2, 0.419345]
  - - [128, 128, 2, 63]
    - [0, 113.678]
  - - [129, 128, 2, 1]
    - [3, 2.92766]
- null
