library/src/blas3/Tensile/Logic/archive/vega20_Cijk_Ailk_Bjlk_SB.yaml
- {MinimumRequiredVersion: 4.6.0}
- vega20
- gfx906
- [Device 66a0, Device 66a1, Device 66a7, Device 66af, Vega 20]
    SolutionIndex: 0
    SolutionNameMin: Cijk_Ailk_Bjlk_SB_MT032x008x08_GRVW02_GSU01_SNLL0_TT02_02_VW02_WG16_04_01
    SolutionIndex: 1
    SolutionNameMin: Cijk_Ailk_Bjlk_SB_MT016x016x08_GRVW02_GSU01_SNLL0_TT02_02_VW02_WG08_08_01
    SolutionIndex: 2
    SolutionNameMin: Cijk_Ailk_Bjlk_SB_MT032x016x08_GRVW02_GSU01_SNLL0_TT04_02_VW02_WG08_08_01
    SolutionIndex: 3
    SolutionNameMin: Cijk_Ailk_Bjlk_SB_MT032x032x08_GRVW04_GSU01_SNLL0_TT04_04_VW04_WG08_08_01
    SolutionIndex: 4
    SolutionNameMin: Cijk_Ailk_Bjlk_SB_MT032x016x08_GRVW02_GSU01_SNLL0_TT02_02_VW02_WG16_08_01
    SolutionIndex: 5
    SolutionNameMin: Cijk_Ailk_Bjlk_SB_MT064x016x08_GRVW02_GSU01_SNLL0_TT04_02_VW02_WG16_08_01
    SolutionIndex: 6
    SolutionNameMin: Cijk_Ailk_Bjlk_SB_MT016x016x08_GRVW02_GSU01_SNLL0_TT02_02_VW02_WG08_08_01
    SolutionIndex: 7
    SolutionNameMin: Cijk_Ailk_Bjlk_SB_MT032x016x08_GRVW02_GSU01_SNLL0_TT04_02_VW02_WG08_08_01
    SolutionIndex: 8
    SolutionNameMin: Cijk_Ailk_Bjlk_SB_MT032x032x08_GRVW04_GSU01_SNLL0_TT04_04_VW04_WG08_08_01
    SolutionIndex: 9
    SolutionNameMin: Cijk_Ailk_Bjlk_SB_MT032x016x08_GRVW02_GSU01_SNLL0_TT02_02_VW02_WG16_08_01
    SolutionIndex: 10
    SolutionNameMin: Cijk_Ailk_Bjlk_SB_MT064x016x08_GRVW02_GSU01_SNLL0_TT04_02_VW02_WG16_08_01
    SolutionIndex: 11
    SolutionNameMin: Cijk_Ailk_Bjlk_SB_MT064x008x16_GRVW02_GSU01_SNLL0_TT02_02_VW02_WG32_04_01
    SolutionIndex: 12
    SolutionNameMin: Cijk_Ailk_Bjlk_SB_MT016x016x16_GRVW02_GSU01_SNLL0_TT02_02_VW02_WG08_08_01
    SolutionIndex: 13
    SolutionNameMin: Cijk_Ailk_Bjlk_SB_MT032x016x16_GRVW02_GSU01_SNLL0_TT04_02_VW02_WG08_08_01
    SolutionIndex: 14
    SolutionNameMin: Cijk_Ailk_Bjlk_SB_MT032x032x16_GRVW04_GSU01_SNLL0_TT04_04_VW04_WG08_08_01
    SolutionIndex: 15
    SolutionNameMin: Cijk_Ailk_Bjlk_SB_MT064x016x16_GRVW02_GSU01_SNLL0_TT04_02_VW02_WG16_08_01
    SolutionIndex: 16
    SolutionNameMin: Cijk_Ailk_Bjlk_SB_MT064x032x16_GRVW04_GSU01_SNLL0_TT04_04_VW04_WG16_08_01
    SolutionIndex: 17
    SolutionNameMin: Cijk_Ailk_Bjlk_SB_MT064x008x16_GRVW02_GSU01_SNLL0_TT02_02_VW02_WG32_04_01
    SolutionIndex: 18
    SolutionNameMin: Cijk_Ailk_Bjlk_SB_MT032x008x16_GRVW02_GSU01_SNLL0_TT02_02_VW02_WG16_04_01
    SolutionIndex: 19
    SolutionNameMin: Cijk_Ailk_Bjlk_SB_MT016x016x16_GRVW02_GSU01_SNLL0_TT02_02_VW02_WG08_08_01
    SolutionIndex: 20
    SolutionNameMin: Cijk_Ailk_Bjlk_SB_MT016x016x24_GRVW02_GSU01_SNLL0_TT02_02_VW02_WG08_08_01
    SolutionIndex: 21
    SolutionNameMin: Cijk_Ailk_Bjlk_SB_MT016x016x08_GRVW02_GSU02_SNLL0_TT02_02_VW02_WG08_08_02
    SolutionIndex: 22
    SolutionNameMin: Cijk_Ailk_Bjlk_SB_MT032x016x08_GRVW02_GSU02_SNLL0_TT04_02_VW02_WG08_08_02
    SolutionIndex: 23
    SolutionNameMin: Cijk_Ailk_Bjlk_SB_MT016x016x08_GRVW02_GSU04_SNLL0_TT02_02_VW02_WG08_08_02
    SolutionIndex: 24
    SolutionNameMin: Cijk_Ailk_Bjlk_SB_MT016x016x08_GRVW02_GSU08_SNLL0_TT02_02_VW02_WG08_08_02
    SolutionIndex: 25
    SolutionNameMin: Cijk_Ailk_Bjlk_SB_MT016x016x16_GRVW02_GSU02_SNLL0_TT02_02_VW02_WG08_08_02
    SolutionIndex: 26
    SolutionNameMin: Cijk_Ailk_Bjlk_SB_MT032x016x16_GRVW02_GSU02_SNLL0_TT04_02_VW02_WG08_08_02
    SolutionIndex: 27
    SolutionNameMin: Cijk_Ailk_Bjlk_SB_MT032x032x16_GRVW04_GSU02_SNLL0_TT04_04_VW04_WG08_08_02
    SolutionIndex: 28
    SolutionNameMin: Cijk_Ailk_Bjlk_SB_MT064x032x16_GRVW04_GSU02_SNLL0_TT08_04_VW04_WG08_08_02
    SolutionIndex: 29
    SolutionNameMin: Cijk_Ailk_Bjlk_SB_MT016x016x16_GRVW02_GSU02_SNLL0_TT02_02_VW02_WG08_08_04
    SolutionIndex: 30
    SolutionNameMin: Cijk_Ailk_Bjlk_SB_MT032x016x16_GRVW02_GSU02_SNLL0_TT04_02_VW02_WG08_08_04
    SolutionIndex: 31
    SolutionNameMin: Cijk_Ailk_Bjlk_SB_MT032x016x16_GRVW02_GSU02_SNLL0_TT02_02_VW02_WG16_08_02
    SolutionIndex: 32
    SolutionNameMin: Cijk_Ailk_Bjlk_SB_MT064x016x16_GRVW02_GSU02_SNLL0_TT04_02_VW02_WG16_08_02
    SolutionIndex: 33
    SolutionNameMin: Cijk_Ailk_Bjlk_SB_MT064x016x16_GRVW04_GSU02_SNLL0_TT04_04_VW04_WG16_04_04
    SolutionIndex: 34
    SolutionNameMin: Cijk_Ailk_Bjlk_SB_MT016x016x16_GRVW02_GSU02_SNLL0_TT02_02_VW02_WG08_08_02
    SolutionIndex: 35
    SolutionNameMin: Cijk_Ailk_Bjlk_SB_MT032x016x16_GRVW02_GSU02_SNLL0_TT04_02_VW02_WG08_08_02
    SolutionIndex: 36
    SolutionNameMin: Cijk_Ailk_Bjlk_SB_MT032x032x16_GRVW04_GSU02_SNLL0_TT04_04_VW04_WG08_08_02
    SolutionIndex: 37
    SolutionNameMin: Cijk_Ailk_Bjlk_SB_MT016x016x16_GRVW02_GSU02_SNLL0_TT02_02_VW02_WG08_08_04
    SolutionIndex: 38
    SolutionNameMin: Cijk_Ailk_Bjlk_SB_MT032x016x16_GRVW02_GSU02_SNLL0_TT04_02_VW02_WG08_08_04
    SolutionIndex: 39
    SolutionNameMin: Cijk_Ailk_Bjlk_SB_MT032x016x16_GRVW02_GSU02_SNLL0_TT02_02_VW02_WG16_08_02
    SolutionIndex: 40
    SolutionNameMin: Cijk_Ailk_Bjlk_SB_MT016x016x16_GRVW02_GSU04_SNLL0_TT02_02_VW02_WG08_08_04
    SolutionIndex: 41
    SolutionNameMin: Cijk_Ailk_Bjlk_SB_MT032x032x16_GRVW04_GSU04_SNLL0_TT04_04_VW04_WG08_08_02
    SolutionIndex: 42
    SolutionNameMin: Cijk_Ailk_Bjlk_SB_MT016x016x16_GRVW02_GSU04_SNLL0_TT02_02_VW02_WG08_08_04
    SolutionIndex: 43
    SolutionNameMin: Cijk_Ailk_Bjlk_SB_MT016x016x16_GRVW02_GSU08_SNLL0_TT02_02_VW02_WG08_08_04
    SolutionIndex: 44
    SolutionNameMin: Cijk_Ailk_Bjlk_SB_MT032x008x32_GRVW02_GSU02_SNLL0_TT02_02_VW02_WG16_04_04
    SolutionIndex: 45
    SolutionNameMin: Cijk_Ailk_Bjlk_SB_MT032x016x32_GRVW02_GSU02_SNLL0_TT04_02_VW02_WG08_08_02
    SolutionIndex: 46
    SolutionNameMin: Cijk_Ailk_Bjlk_SB_MT016x016x32_GRVW02_GSU02_SNLL0_TT02_02_VW02_WG08_08_04
    SolutionIndex: 47
    SolutionNameMin: Cijk_Ailk_Bjlk_SB_MT032x016x32_GRVW02_GSU02_SNLL0_TT04_02_VW02_WG08_08_04
    SolutionIndex: 48
    SolutionNameMin: Cijk_Ailk_Bjlk_SB_MT032x032x32_GRVW04_GSU02_SNLL0_TT04_04_VW04_WG08_08_04
    SolutionIndex: 49
    SolutionNameMin: Cijk_Ailk_Bjlk_SB_MT064x032x32_GRVW04_GSU02_SNLL0_TT08_04_VW04_WG08_08_04
    SolutionIndex: 50
    SolutionNameMin: Cijk_Ailk_Bjlk_SB_MT064x032x32_GRVW04_GSU02_SNLL0_TT04_04_VW04_WG16_08_02
    SolutionIndex: 51
    SolutionNameMin: Cijk_Ailk_Bjlk_SB_MT128x032x32_GRVW04_GSU02_SNLL0_TT08_08_VW04_WG16_04_04
    SolutionIndex: 52
    SolutionNameMin: Cijk_Ailk_Bjlk_SB_MT032x016x32_GRVW02_GSU02_SNLL0_TT04_02_VW02_WG08_08_02
    SolutionIndex: 53
    SolutionNameMin: Cijk_Ailk_Bjlk_SB_MT032x032x32_GRVW04_GSU02_SNLL0_TT04_04_VW04_WG08_08_02
    SolutionIndex: 54
    SolutionNameMin: Cijk_Ailk_Bjlk_SB_MT016x016x32_GRVW02_GSU02_SNLL0_TT02_02_VW02_WG08_08_04
    SolutionIndex: 55
    SolutionNameMin: Cijk_Ailk_Bjlk_SB_MT032x016x32_GRVW02_GSU02_SNLL0_TT04_02_VW02_WG08_08_04
    SolutionIndex: 56
    SolutionNameMin: Cijk_Ailk_Bjlk_SB_MT032x032x32_GRVW04_GSU02_SNLL0_TT04_04_VW04_WG08_08_04
    SolutionIndex: 57
    SolutionNameMin: Cijk_Ailk_Bjlk_SB_MT064x032x32_GRVW04_GSU02_SNLL0_TT08_04_VW04_WG08_08_04
    SolutionIndex: 58
    SolutionNameMin: Cijk_Ailk_Bjlk_SB_MT064x008x32_GRVW02_GSU04_SNLL0_TT04_02_VW02_WG16_04_04
    SolutionIndex: 59
    SolutionNameMin: Cijk_Ailk_Bjlk_SB_MT016x016x32_GRVW02_GSU04_SNLL0_TT02_02_VW02_WG08_08_04
    SolutionIndex: 60
    SolutionNameMin: Cijk_Ailk_Bjlk_SB_MT032x016x32_GRVW02_GSU04_SNLL0_TT04_02_VW02_WG08_08_04
    SolutionIndex: 61
    SolutionNameMin: Cijk_Ailk_Bjlk_SB_MT032x032x32_GRVW04_GSU04_SNLL0_TT04_04_VW04_WG08_08_04
    SolutionIndex: 62
    SolutionNameMin: Cijk_Ailk_Bjlk_SB_MT032x032x32_GRVW04_GSU04_SNLL0_TT04_04_VW04_WG08_08_04
    SolutionIndex: 63
    SolutionNameMin: Cijk_Ailk_Bjlk_SB_MT032x008x32_GRVW02_GSU08_SNLL0_TT02_02_VW02_WG16_04_04
    SolutionIndex: 64
    SolutionNameMin: Cijk_Ailk_Bjlk_SB_MT016x016x32_GRVW02_GSU08_SNLL0_TT02_02_VW02_WG08_08_04
    SolutionIndex: 65
    SolutionNameMin: Cijk_Ailk_Bjlk_SB_MT128x128x08_GRVW04_GSU01_SNLL0_TT08_08_VW04_WG16_16_01
    SolutionIndex: 66
    SolutionNameMin: Cijk_Ailk_Bjlk_SB_MT064x064x16_GRVW04_GSU01_SNLL0_TT04_04_VW04_WG16_16_01
    SolutionIndex: 67
    SolutionNameMin: Cijk_Ailk_Bjlk_SB_MT064x128x16_GRVW04_GSU01_SNLL0_TT04_08_VW04_WG16_16_01
    SolutionIndex: 68
    SolutionNameMin: Cijk_Ailk_Bjlk_SB_MT128x064x16_GRVW04_GSU01_SNLL0_TT08_04_VW04_WG16_16_01
    SolutionIndex: 69
    SolutionNameMin: Cijk_Ailk_Bjlk_SB_MT064x064x16_GRVW04_GSU01_SNLL0_TT04_04_VW04_WG16_16_01
    SolutionIndex: 70
    SolutionNameMin: Cijk_Ailk_Bjlk_SB_MT064x128x16_GRVW04_GSU01_SNLL0_TT04_08_VW04_WG16_16_01
    SolutionIndex: 71
    SolutionNameMin: Cijk_Ailk_Bjlk_SB_MT128x064x16_GRVW04_GSU01_SNLL0_TT08_04_VW04_WG16_16_01
    SolutionIndex: 72
    SolutionNameMin: Cijk_Ailk_Bjlk_SB_MT128x128x08_GRVW04_GSU01_SNLL1_TT08_08_VW04_WG16_16_01
    SolutionIndex: 73
    SolutionNameMin: Cijk_Ailk_Bjlk_SB_MT128x128x08_GRVW04_GSU01_SNLL1_TT08_08_VW04_WG16_16_01
    SolutionIndex: 74
    SolutionNameMin: Cijk_Ailk_Bjlk_SB_MT064x064x16_GRVW04_GSU01_SNLL1_TT04_04_VW04_WG16_16_01
    SolutionIndex: 75
    SolutionNameMin: Cijk_Ailk_Bjlk_SB_MT064x128x16_GRVW04_GSU01_SNLL1_TT04_08_VW04_WG16_16_01
    SolutionIndex: 76
    SolutionNameMin: Cijk_Ailk_Bjlk_SB_MT096x128x16_GRVW02_GSU01_SNLL1_TT06_08_VW02_WG16_16_01
    SolutionIndex: 77
    SolutionNameMin: Cijk_Ailk_Bjlk_SB_MT128x064x16_GRVW04_GSU01_SNLL1_TT08_04_VW04_WG16_16_01
    SolutionIndex: 78
    SolutionNameMin: Cijk_Ailk_Bjlk_SB_MT128x096x16_GRVW02_GSU01_SNLL1_TT08_06_VW02_WG16_16_01
    SolutionIndex: 79
    SolutionNameMin: Cijk_Ailk_Bjlk_SB_MT128x128x16_GRVW04_GSU01_SNLL1_TT08_08_VW04_WG16_16_01
    SolutionIndex: 80
    SolutionNameMin: Cijk_Ailk_Bjlk_SB_MT064x064x16_GRVW04_GSU01_SNLL1_TT04_04_VW04_WG16_16_01
    SolutionIndex: 81
    SolutionNameMin: Cijk_Ailk_Bjlk_SB_MT064x128x16_GRVW04_GSU01_SNLL1_TT04_08_VW04_WG16_16_01
    SolutionIndex: 82
    SolutionNameMin: Cijk_Ailk_Bjlk_SB_MT096x128x16_GRVW02_GSU01_SNLL1_TT06_08_VW02_WG16_16_01
    SolutionIndex: 83
    SolutionNameMin: Cijk_Ailk_Bjlk_SB_MT128x064x16_GRVW04_GSU01_SNLL1_TT08_04_VW04_WG16_16_01
    SolutionIndex: 84
    SolutionNameMin: Cijk_Ailk_Bjlk_SB_MT128x096x16_GRVW02_GSU01_SNLL1_TT08_06_VW02_WG16_16_01
    SolutionIndex: 85
    SolutionNameMin: Cijk_Ailk_Bjlk_SB_MT128x128x16_GRVW04_GSU01_SNLL1_TT08_08_VW04_WG16_16_01
    SolutionIndex: 86
    SolutionNameMin: Cijk_Ailk_Bjlk_SB_MT016x016x04_GRVW02_GSU01_SNLL0_TT02_02_VW02_WG08_08_01
    SolutionIndex: 87
    SolutionNameMin: Cijk_Ailk_Bjlk_SB_MT032x032x02_GRVW04_GSU01_SNLL0_TT04_04_VW04_WG08_08_01
    SolutionIndex: 88
    SolutionNameMin: Cijk_Ailk_Bjlk_SB_MT008x008x08_GRVW02_GSU01_SNLL1_TT02_02_VW02_WG04_04_04
    SolutionIndex: 89
    SolutionNameMin: Cijk_Ailk_Bjlk_SB_MT016x016x16_GRVW02_GSU01_SNLL1_TT02_02_VW02_WG08_08_04
    SolutionIndex: 90
    SolutionNameMin: Cijk_Ailk_Bjlk_SB_MT008x008x08_GRVW02_GSU02_SNLL0_TT02_02_VW02_WG04_04_04
    SolutionIndex: 91
    SolutionNameMin: Cijk_Ailk_Bjlk_SB_MT016x016x04_GRVW02_GSU04_SNLL0_TT02_02_VW02_WG08_08_01
    SolutionIndex: 92
    SolutionNameMin: Cijk_Ailk_Bjlk_SB_MT008x008x08_GRVW02_GSU04_SNLL0_TT02_02_VW02_WG04_04_04
    SolutionIndex: 93
    SolutionNameMin: Cijk_Ailk_Bjlk_SB_MT016x016x04_GRVW02_GSU08_SNLL0_TT02_02_VW02_WG08_08_01
    SolutionIndex: 94
    SolutionNameMin: Cijk_Ailk_Bjlk_SB_MT008x008x08_GRVW02_GSU08_SNLL0_TT02_02_VW02_WG04_04_04
    SolutionIndex: 95
    SolutionNameMin: Cijk_Ailk_Bjlk_SB_MT016x016x08_GRVW02_GSU16_SNLL0_TT02_02_VW02_WG08_08_02
    SolutionIndex: 96
    SolutionNameMin: Cijk_Ailk_Bjlk_SB_MT008x008x08_GRVW02_GSU16_SNLL0_TT02_02_VW02_WG04_04_04
    SolutionIndex: 97
    SolutionNameMin: Cijk_Ailk_Bjlk_SB_MT016x016x16_GRVW02_GSU16_SNLL0_TT02_02_VW02_WG08_08_04
    SolutionIndex: 98
    SolutionNameMin: Cijk_Ailk_Bjlk_SB_MT064x128x08_DTL0_GRVW01_GSU01_PGR1_PLR1_TT04_08_USFGRO01_VW02_WG16_16_01_WGM01
    SolutionIndex: 99
    SolutionNameMin: Cijk_Ailk_Bjlk_SB_MT064x064x08_DTL0_GRVW01_GSU01_PGR1_PLR1_TT04_08_USFGRO01_VW04_WG16_08_01_WGM01
    SolutionIndex: 100
    SolutionNameMin: Cijk_Ailk_Bjlk_SB_MT032x256x08_DTL1_GRVW01_GSU01_PGR0_PLR1_TT04_08_USFGRO01_VW04_WG08_32_01_WGM01
    SolutionIndex: 101
    SolutionNameMin: Cijk_Ailk_Bjlk_SB_MT032x256x08_DTL1_GRVW01_GSU01_PGR0_PLR1_TT04_08_USFGRO01_VW04_WG08_32_01_WGM08
    SolutionIndex: 102
    SolutionNameMin: Cijk_Ailk_Bjlk_SB_MT032x256x08_DTL1_GRVW01_GSU01_PGR0_PLR1_TT04_08_USFGRO01_VW04_WG08_32_01_WGM64
    SolutionIndex: 103
    SolutionNameMin: Cijk_Ailk_Bjlk_SB_MT064x064x16_DTL0_GRVW01_GSU01_PGR0_PLR1_TT04_08_USFGRO01_VW04_WG16_08_01_WGM01
    SolutionIndex: 104
    SolutionNameMin: Cijk_Ailk_Bjlk_SB_MT064x064x08_DTL0_GRVW04_GSU01_PGR1_PLR1_TT04_08_USFGRO0_VW04_WG16_08_01_WGM01
    SolutionIndex: 105
    SolutionNameMin: Cijk_Ailk_Bjlk_SB_MT064x128x16_DTL0_GRVW04_GSU01_PGR0_PLR1_TT08_04_USFGRO0_VW04_WG08_32_01_WGM01
    SolutionIndex: 106
    SolutionNameMin: Cijk_Ailk_Bjlk_SB_MT064x064x16_DTL0_GRVW04_GSU01_PGR1_PLR1_TT04_04_USFGRO0_VW04_WG16_16_01_WGM01
    SolutionIndex: 107
    SolutionNameMin: Cijk_Ailk_Bjlk_SB_MT064x128x16_DTL0_GRVW04_GSU01_PGR0_PLR1_TT04_08_USFGRO0_VW04_WG16_16_01_WGM01
    SolutionIndex: 108
    SolutionNameMin: Cijk_Ailk_Bjlk_SB_MT064x128x16_DTL0_GRVW04_GSU01_PGR0_PLR1_TT04_08_USFGRO0_VW04_WG16_16_01_WGM08
    SolutionIndex: 109
    SolutionNameMin: Cijk_Ailk_Bjlk_SB_MT64x64x8_SE_EPS1_GSU1_PGR1_PLR1_SNLL1_TT8_8_VW4_WG8_8_1_WGM8
    SolutionIndex: 110
    SolutionNameMin: Cijk_Ailk_Bjlk_SB_MT64x64x8_SE_EPS1_GSU1_PGR1_PLR1_SNLL1_TT8_8_VW4_WG8_8_1_WGM64
    SolutionIndex: 111
    SolutionNameMin: Cijk_Ailk_Bjlk_SB_MT128x32x16_SE_EPS0_GSU1_PGR0_PLR1_SNLL0_TT8_4_VW4_WG16_8_1_WGM8
    SolutionIndex: 112
    SolutionNameMin: Cijk_Ailk_Bjlk_SB_MT64x64x16_SE_EPS1_GSU1_PGR1_PLR1_SNLL1_TT4_4_VW4_WG16_16_1_WGM8
    SolutionIndex: 113
    SolutionNameMin: Cijk_Ailk_Bjlk_SB_MT64x64x16_SE_EPS0_GSU1_PGR0_PLR1_SNLL0_TT4_4_VW4_WG16_16_1_WGM64
    SolutionIndex: 114
    SolutionNameMin: Cijk_Ailk_Bjlk_SB_MT64x64x16_SE_EPS1_GSU1_PGR1_PLR1_SNLL1_TT4_4_VW4_WG16_16_1_WGM64
    SolutionIndex: 115
    SolutionNameMin: Cijk_Ailk_Bjlk_SB_MT64x64x8_SE_EPS1_FL0_GRVW1_NLCA1_NLCB1_PGR1_PLR0_SNLL1_TT4_4_USFGRO1_VW1_WGM1
    SolutionIndex: 116
    SolutionNameMin: Cijk_Ailk_Bjlk_SB_MT64x64x8_SE_EPS0_FL0_GRVW1_NLCA1_NLCB1_PGR0_PLR1_SNLL0_TT4_4_USFGRO1_VW1_WGM1
    SolutionIndex: 117
    SolutionNameMin: Cijk_Ailk_Bjlk_SB_MT64x32x8_SE_EPS0_FL0_GRVW1_NLCA1_NLCB1_PGR0_PLR1_SNLL0_TT4_2_USFGRO1_VW1_WGM1
    SolutionIndex: 118
    SolutionNameMin: Cijk_Ailk_Bjlk_SB_MT64x128x8_SE_EPS1_FL0_GRVW1_NLCA1_NLCB1_PGR1_PLR0_SNLL1_TT4_8_USFGRO1_VW1_WGM1
    SolutionIndex: 119
    SolutionNameMin: Cijk_Ailk_Bjlk_SB_MT64x32x8_SE_EPS0_FL0_GRVW1_NLCA1_NLCB1_PGR0_PLR0_SNLL0_TT4_4_USFGRO1_VW1_WGM1
    SolutionIndex: 120
    SolutionNameMin: Cijk_Ailk_Bjlk_SB_MT64x32x8_SE_EPS0_FL0_GRVW1_NLCA1_NLCB1_PGR0_PLR1_SNLL0_TT4_4_USFGRO1_VW1_WGM1
    SolutionIndex: 121
    SolutionNameMin: Cijk_Ailk_Bjlk_SB_MT64x16x8_SE_EPS0_FL0_GRVW1_NLCA1_NLCB1_PGR0_PLR0_SNLL0_TT4_2_USFGRO1_VW1_WGM1
    SolutionIndex: 122
    SolutionNameMin: Cijk_Ailk_Bjlk_SB_MT64x16x8_SE_EPS0_FL0_GRVW1_NLCA1_NLCB1_PGR0_PLR1_SNLL0_TT4_2_USFGRO1_VW1_WGM1
    SolutionIndex: 123
    SolutionNameMin: Cijk_Ailk_Bjlk_SB_MT64x64x8_SE_EPS1_FL0_GRVW1_NLCA1_NLCB1_PGR1_PLR0_SNLL1_TT4_4_USFGRO1_VW1_WGM8
    SolutionIndex: 124
    SolutionNameMin: Cijk_Ailk_Bjlk_SB_MT64x128x8_SE_EPS1_FL0_GRVW1_NLCA1_NLCB1_PGR1_PLR0_SNLL1_TT4_8_USFGRO1_VW1_WGM8
    SolutionIndex: 125
    SolutionNameMin: Cijk_Ailk_Bjlk_SB_MT64x32x8_SE_EPS0_FL0_GRVW1_NLCA1_NLCB1_PGR0_PLR0_SNLL0_TT4_4_USFGRO1_VW1_WGM8
    SolutionIndex: 126
    SolutionNameMin: Cijk_Ailk_Bjlk_SB_MT64x32x8_SE_EPS0_FL0_GRVW1_NLCA1_NLCB1_PGR0_PLR1_SNLL0_TT4_4_USFGRO1_VW1_WGM8
    SolutionIndex: 127
    SolutionNameMin: Cijk_Ailk_Bjlk_SB_MT64x16x8_SE_EPS0_FL0_GRVW1_NLCA1_NLCB1_PGR0_PLR1_SNLL0_TT4_2_USFGRO1_VW1_WGM8
    SolutionIndex: 128
    SolutionNameMin: Cijk_Ailk_Bjlk_SB_MT64x64x16_SE_EPS0_FL0_GRVW1_NLCA1_NLCB1_PGR0_PLR0_SNLL0_TT4_4_USFGRO1_VW1_WGM1
    SolutionIndex: 129
    SolutionNameMin: Cijk_Ailk_Bjlk_SB_MT64x16x16_SE_EPS0_FL0_GRVW1_NLCA1_NLCB1_PGR0_PLR0_SNLL0_TT4_2_USFGRO1_VW1_WGM1
    SolutionIndex: 130
    SolutionNameMin: Cijk_Ailk_Bjlk_SB_MT64x16x16_SE_EPS0_FL0_GRVW1_NLCA1_NLCB1_PGR0_PLR1_SNLL0_TT4_2_USFGRO1_VW1_WGM1
    SolutionIndex: 131
    SolutionNameMin: Cijk_Ailk_Bjlk_SB_MT64x32x32_SE_EPS0_FL0_GRVW1_NLCA1_NLCB1_PGR0_PLR1_SNLL0_TT4_2_USFGRO1_VW1_WGM8
    SolutionIndex: 132
    SolutionNameMin: Cijk_Ailk_Bjlk_SB_MT64x32x8_SE_EPS0_FL0_GRVW1_NLCA1_NLCB1_PGR0_PLR0_SNLL0_TT4_4_USFGRO1_VW4_WGM1
    SolutionIndex: 133
    SolutionNameMin: Cijk_Ailk_Bjlk_SB_MT64x32x8_SE_EPS0_FL0_GRVW1_NLCA1_NLCB1_PGR0_PLR1_SNLL0_TT4_4_USFGRO1_VW4_WGM1
    SolutionIndex: 134
    SolutionNameMin: Cijk_Ailk_Bjlk_SB_MT64x32x8_SE_EPS0_FL0_GRVW1_NLCA1_NLCB1_PGR0_PLR0_SNLL0_TT4_4_USFGRO1_VW4_WGM8
    SolutionIndex: 135
    SolutionNameMin: Cijk_Ailk_Bjlk_SB_MT64x32x8_SE_EPS0_FL0_GRVW1_NLCA1_NLCB1_PGR0_PLR1_SNLL0_TT4_4_USFGRO1_VW4_WGM8
    SolutionIndex: 136
    SolutionNameMin: Cijk_Ailk_Bjlk_SB_MT64x64x8_SE_EPS1_FL0_GRVW4_NLCA1_NLCB1_PGR1_PLR1_SNLL1_TT8_4_USFGRO0_VW4_WGM1
    SolutionIndex: 137
    SolutionNameMin: Cijk_Ailk_Bjlk_SB_MT64x64x16_SE_EPS1_FL0_GRVW4_NLCA1_NLCB1_PGR1_PLR1_SNLL1_TT4_4_USFGRO0_VW4_WGM1
    SolutionIndex: 138
    SolutionNameMin: Cijk_Ailk_Bjlk_SB_MT64x64x16_SE_EPS1_FL1_GRVW4_NLCA1_NLCB1_PGR1_PLR1_SNLL1_TT4_4_USFGRO0_VW4_WGM1
    SolutionIndex: 139
    SolutionNameMin: Cijk_Ailk_Bjlk_SB_MT128x64x16_SE_EPS1_FL0_GRVW4_NLCA1_NLCB1_PGR1_PLR1_SNLL1_TT8_4_USFGRO0_VW4_WGM1
    SolutionIndex: 140
    SolutionNameMin: Cijk_Ailk_Bjlk_SB_MT128x64x16_SE_EPS1_FL1_GRVW4_NLCA1_NLCB1_PGR1_PLR1_SNLL1_TT8_4_USFGRO0_VW4_WGM1
    SolutionIndex: 141
    SolutionNameMin: Cijk_Ailk_Bjlk_SB_MT128x128x16_SE_EPS1_FL0_GRVW4_NLCA1_NLCB1_PGR1_PLR1_SNLL1_TT8_8_USFGRO0_VW4_WGM1
    SolutionIndex: 142
    SolutionNameMin: Cijk_Ailk_Bjlk_SB_MT128x128x16_SE_EPS1_FL1_GRVW4_NLCA1_NLCB1_PGR1_PLR1_SNLL1_TT8_8_USFGRO0_VW4_WGM1
    SolutionIndex: 143
    SolutionNameMin: Cijk_Ailk_Bjlk_SB_MT64x64x16_SE_EPS1_FL0_GRVW4_NLCA1_NLCB1_PGR1_PLR1_SNLL1_TT4_4_USFGRO0_VW4_WGM8
    SolutionIndex: 144
    SolutionNameMin: Cijk_Ailk_Bjlk_SB_MT64x128x16_SE_EPS1_FL0_GRVW4_NLCA1_NLCB1_PGR1_PLR1_SNLL1_TT4_8_USFGRO0_VW4_WGM8
    SolutionIndex: 145
    SolutionNameMin: Cijk_Ailk_Bjlk_SB_MT64x128x16_SE_EPS1_FL1_GRVW4_NLCA1_NLCB1_PGR1_PLR1_SNLL1_TT4_8_USFGRO0_VW4_WGM8
    SolutionIndex: 146
    SolutionNameMin: Cijk_Ailk_Bjlk_SB_MT128x64x16_SE_EPS1_FL0_GRVW4_NLCA1_NLCB1_PGR1_PLR1_SNLL1_TT8_4_USFGRO0_VW4_WGM8
    SolutionIndex: 147
    SolutionNameMin: Cijk_Ailk_Bjlk_SB_MT128x64x16_SE_EPS1_FL1_GRVW4_NLCA1_NLCB1_PGR1_PLR1_SNLL1_TT8_4_USFGRO0_VW4_WGM8
    SolutionIndex: 148
    SolutionNameMin: Cijk_Ailk_Bjlk_SB_MT128x128x16_SE_EPS1_FL0_GRVW4_NLCA1_NLCB1_PGR1_PLR1_SNLL1_TT8_8_USFGRO0_VW4_WGM8
    SolutionIndex: 149
    SolutionNameMin: Cijk_Ailk_Bjlk_SB_MT128x128x16_SE_EPS1_FL1_GRVW4_NLCA1_NLCB1_PGR1_PLR1_SNLL1_TT8_8_USFGRO0_VW4_WGM8
    SolutionIndex: 150
    SolutionNameMin: Cijk_Ailk_Bjlk_SB_MT64x64x16_SE_EPS1_FL1_GRVW4_NLCA1_NLCB1_PGR1_PLR0_TT4_4_USFGRO0_VW4_WGM8
    SolutionIndex: 151
    SolutionNameMin: Cijk_Ailk_Bjlk_SB_MT64x128x8_SE_EPS1_FL0_GRVW2_NLCA1_NLCB1_PGR1_PLR1_TT4_8_USFGRO0_VW2_WGM8
    SolutionIndex: 152
    SolutionNameMin: Cijk_Ailk_Bjlk_SB_MT128x64x8_SE_EPS1_FL0_GRVW1_NLCA1_NLCB1_PGR1_PLR0_TT8_4_USFGRO1_VW4_WGM8
    SolutionIndex: 153
    SolutionNameMin: Cijk_Ailk_Bjlk_SB_MT128x64x8_SE_EPS1_FL1_GRVW2_NLCA1_NLCB1_PGR1_PLR1_TT8_4_USFGRO0_VW2_WGM8
    SolutionIndex: 154
    SolutionNameMin: Cijk_Ailk_Bjlk_SB_MT64x64x8_SE_DTL0_EPS0_FL0_GRVW1_PGR0_PLR1_TT4_4_USFGRO1_VW2_WG16_16_1_WGM1
    SolutionIndex: 155
    SolutionNameMin: Cijk_Ailk_Bjlk_SB_MT64x64x8_SE_DTL0_EPS0_FL0_GRVW1_PGR0_PLR1_TT4_4_USFGRO1_VW4_WG16_16_1_WGM1
    SolutionIndex: 156
    SolutionNameMin: Cijk_Ailk_Bjlk_SB_MT64x64x8_SE_DTL0_EPS1_FL0_GRVW1_PGR1_PLR1_TT4_4_USFGRO1_VW4_WG16_16_1_WGM1
    SolutionIndex: 157
    SolutionNameMin: Cijk_Ailk_Bjlk_SB_MT64x64x16_SE_DTL0_EPS1_FL0_GRVW1_PGR1_PLR1_TT4_4_USFGRO1_VW4_WG16_16_1_WGM1
    SolutionIndex: 158
    SolutionNameMin: Cijk_Ailk_Bjlk_SB_MT64x64x16_SE_DTL0_EPS1_FL0_GRVW4_PGR1_PLR1_TT4_4_USFGRO0_VW4_WG16_16_1_WGM1
    SolutionIndex: 159
    SolutionNameMin: Cijk_Ailk_Bjlk_SB_MT32x8x32_SE_DTL0_EPS1_FL0_GRVW1_PGR1_PLR0_TT2_2_USFGRO1_VW2_WG16_4_4_WGM1
    SolutionIndex: 160
    SolutionNameMin: Cijk_Ailk_Bjlk_SB_MT32x8x16_SE_DTL0_EPS1_FL1_GRVW2_PGR1_PLR0_TT2_2_USFGRO0_VW2_WG16_4_4_WGM1
    SolutionIndex: 161
    SolutionNameMin: Cijk_Ailk_Bjlk_SB_MT96x64x8_SE_DTL0_EPS1_FL1_GRVW2_PGR1_PLR1_TT6_4_USFGRO0_VW2_WG16_16_1_WGM1
    SolutionIndex: 162
    SolutionNameMin: Cijk_Ailk_Bjlk_SB_MT96x64x8_SE_DTL0_EPS1_FL1_GRVW2_PGR1_PLR1_TT6_4_USFGRO0_VW2_WG16_16_1_WGM8
    SolutionIndex: 163
    SolutionNameMin: Cijk_Ailk_Bjlk_SB_MT64x96x8_SE_DTL0_EPS1_FL1_GRVW2_PGR1_PLR1_TT4_6_USFGRO0_VW2_WG16_16_1_WGM1
    SolutionIndex: 164
    SolutionNameMin: Cijk_Ailk_Bjlk_SB_MT64x128x8_SE_DTL0_EPS1_FL0_GRVW1_PGR1_PLR0_TT4_8_USFGRO1_VW4_WG16_16_1_WGM1
    SolutionIndex: 165
    SolutionNameMin: Cijk_Ailk_Bjlk_SB_MT64x128x8_SE_DTL0_EPS1_FL0_GRVW2_PGR1_PLR1_TT4_8_USFGRO0_VW2_WG16_16_1_WGM1
    SolutionIndex: 166
    SolutionNameMin: Cijk_Ailk_Bjlk_SB_MT128x64x8_SE_DTL0_EPS1_FL1_GRVW2_PGR1_PLR1_TT8_4_USFGRO0_VW2_WG16_16_1_WGM1
    SolutionIndex: 167
    SolutionNameMin: Cijk_Ailk_Bjlk_SB_MT64x64x8_SE_AMAS3_EPS1_FL0_GRVW4_GSU1_PGR1_PLR1_TT4_4_USFGRO0_VW2_WG16_16_1_WGM1
    SolutionIndex: 168
    SolutionNameMin: Cijk_Ailk_Bjlk_SB_MT64x64x16_SE_AMAS3_EPS1_FL0_GRVW4_GSU1_PGR1_PLR1_TT4_4_USFGRO0_VW4_WG16_16_1_WGM8
    SolutionIndex: 169
    SolutionNameMin: Cijk_Ailk_Bjlk_SB_MT64x32x8_SE_AMAS3_EPS1_FL0_GRVW2_GSU1_PGR1_PLR1_TT4_4_USFGRO0_VW2_WG16_8_2_WGM8
    SolutionIndex: 170
    SolutionNameMin: Cijk_Ailk_Bjlk_SB_MT8x32x32_SE_AMAS3_EPS1_FL0_GRVW1_GSU1_PGR1_PLR1_TT2_2_USFGRO1_VW2_WG4_16_4_WGM1
    SolutionIndex: 171
    SolutionNameMin: Cijk_Ailk_Bjlk_SB_MT16x32x32_SE_AMAS1_EPS1_FL0_GRVW1_GSU1_PGR1_PLR1_TT4_2_USFGRO1_VW1_WG4_16_4_WGM8
    SolutionIndex: 172
    SolutionNameMin: Cijk_Ailk_Bjlk_SB_MT16x32x32_SE_AMAS3_EPS1_FL0_GRVW1_GSU1_PGR1_PLR1_TT4_2_USFGRO1_VW2_WG4_16_4_WGM8
    SolutionIndex: 173
    SolutionNameMin: Cijk_Ailk_Bjlk_SB_MT32x8x32_SE_AMAS1_EPS1_FL0_GRVW1_GSU1_PGR1_PLR1_TT2_2_USFGRO1_VW1_WG16_4_4_WGM8
    SolutionIndex: 174
    SolutionNameMin: Cijk_Ailk_Bjlk_SB_MT64x16x16_SE_AMAS3_EPS1_FL0_GRVW4_GSU1_PGR1_PLR0_TT4_4_USFGRO0_VW4_WG16_4_4_WGM1
    SolutionIndex: 175
    SolutionNameMin: Cijk_Ailk_Bjlk_SB_MT128x64x8_SE_AMAS3_EPS1_FL0_GRVW1_GSU1_PGR1_PLR1_TT8_4_USFGRO1_VW4_WG16_16_1_WGM8
    SolutionIndex: 176
    SolutionNameMin: Cijk_Ailk_Bjlk_SB_MT128x64x8_SE_AMAS3_EPS1_FL1_GRVW2_GSU1_PGR1_PLR0_TT8_4_USFGRO0_VW2_WG16_16_1_WGM8
    SolutionIndex: 177
    SolutionNameMin: Cijk_Ailk_Bjlk_SB_MT64x64x16_SE_EPS1_FL0_GRVW4_GSU1_PGR1_PLR0_TT4_4_USFGRO0_VW4_WG16_16_1_WGM8
    SolutionIndex: 178
    SolutionNameMin: Cijk_Ailk_Bjlk_SB_MT64x64x16_SE_EPS1_FL0_GRVW4_GSU1_PGR1_PLR1_TT4_4_USFGRO0_VW4_WG16_16_1_WGM1
    SolutionIndex: 179
    SolutionNameMin: Cijk_Ailk_Bjlk_SB_MT64x64x16_SE_EPS1_FL1_GRVW4_GSU1_PGR1_PLR1_TT4_4_USFGRO0_VW4_WG16_16_1_WGM1
    SolutionIndex: 180
    SolutionNameMin: Cijk_Ailk_Bjlk_SB_MT64x64x16_SE_EPS1_FL1_GRVW4_GSU1_PGR1_PLR1_TT4_4_USFGRO0_VW4_WG16_16_1_WGM8
    SolutionIndex: 181
    SolutionNameMin: Cijk_Ailk_Bjlk_SB_MT64x96x8_SE_EPS1_FL1_GRVW2_GSU1_PGR1_PLR0_TT4_6_USFGRO0_VW2_WG16_16_1_WGM1
    SolutionIndex: 182
    SolutionNameMin: Cijk_Ailk_Bjlk_SB_MT64x96x8_SE_EPS1_FL1_GRVW2_GSU1_PGR1_PLR1_TT4_6_USFGRO0_VW2_WG16_16_1_WGM1
    SolutionIndex: 183
    SolutionNameMin: Cijk_Ailk_Bjlk_SB_MT64x96x8_SE_EPS1_FL1_GRVW2_GSU1_PGR1_PLR1_TT4_6_USFGRO0_VW2_WG16_16_1_WGM8
    SolutionIndex: 184
    SolutionNameMin: Cijk_Ailk_Bjlk_SB_MT64x128x8_SE_EPS1_FL0_GRVW2_GSU1_PGR1_PLR1_TT4_8_USFGRO0_VW2_WG16_16_1_WGM1
    SolutionIndex: 185
    SolutionNameMin: Cijk_Ailk_Bjlk_SB_MT64x128x8_SE_EPS1_FL1_GRVW2_GSU1_PGR1_PLR1_TT4_8_USFGRO0_VW2_WG16_16_1_WGM1
    SolutionIndex: 186
    SolutionNameMin: Cijk_Ailk_Bjlk_SB_MT64x128x8_SE_EPS1_FL1_GRVW2_GSU1_PGR1_PLR1_TT4_8_USFGRO0_VW2_WG16_16_1_WGM8
    SolutionIndex: 187
    SolutionNameMin: Cijk_Ailk_Bjlk_SB_MT128x64x8_SE_EPS1_FL0_GRVW2_GSU1_PGR1_PLR1_TT8_4_USFGRO0_VW2_WG16_16_1_WGM1
    SolutionIndex: 188
    SolutionNameMin: Cijk_Ailk_Bjlk_SB_MT128x64x8_SE_EPS1_FL0_GRVW2_GSU1_PGR1_PLR1_TT8_4_USFGRO0_VW2_WG16_16_1_WGM8
    SolutionIndex: 189
    SolutionNameMin: Cijk_Ailk_Bjlk_SB_MT128x64x8_SE_EPS1_FL1_GRVW2_GSU1_PGR1_PLR1_TT8_4_USFGRO0_VW2_WG16_16_1_WGM1
    SolutionIndex: 190
    SolutionNameMin: Cijk_Ailk_Bjlk_SB_MT128x128x8_SE_EPS1_FL0_GRVW1_GSU1_PGR1_PLR1_TT8_8_USFGRO1_VW2_WG16_16_1_WGM1
    SolutionIndex: 191
    SolutionNameMin: Cijk_Ailk_Bjlk_SB_MT128x128x8_SE_EPS1_FL0_GRVW1_GSU1_PGR1_PLR0_TT8_8_USFGRO1_VW4_WG16_16_1_WGM8
    SolutionIndex: 192
    SolutionNameMin: Cijk_Ailk_Bjlk_SB_MT32x64x32_SE_EPS1_FL0_GRVW4_GSU1_PGR1_PLR1_TT4_4_USFGRO0_VW4_WG8_16_2_WGM1
    SolutionIndex: 193
    SolutionNameMin: Cijk_Ailk_Bjlk_SB_MT32x64x32_SE_EPS1_FL0_GRVW4_GSU1_PGR1_PLR1_TT4_4_USFGRO0_VW4_WG8_16_2_WGM8
    SolutionIndex: 194
    SolutionNameMin: Cijk_Ailk_Bjlk_SB_MT32x64x32_SE_EPS1_FL1_GRVW4_GSU1_PGR1_PLR1_TT4_4_USFGRO0_VW4_WG8_16_2_WGM1
    SolutionIndex: 195
    SolutionNameMin: Cijk_Ailk_Bjlk_SB_MT32x64x32_SE_EPS1_FL1_GRVW4_GSU1_PGR1_PLR1_TT4_4_USFGRO0_VW4_WG8_16_2_WGM8
    SolutionIndex: 196
    SolutionNameMin: Cijk_Ailk_Bjlk_SB_MT64x32x32_SE_EPS1_FL0_GRVW4_GSU1_PGR1_PLR1_TT4_4_USFGRO0_VW4_WG16_8_2_WGM8
    SolutionIndex: 197
    SolutionNameMin: Cijk_Ailk_Bjlk_SB_MT64x32x32_SE_EPS1_FL1_GRVW4_GSU1_PGR1_PLR1_TT4_4_USFGRO0_VW4_WG16_8_2_WGM8
    SolutionIndex: 198
    SolutionNameMin: Cijk_Ailk_Bjlk_SB_MT64x32x16_SE_AMAS1_GRVW1_TT4_4_USFGRO1_VW1_WG16_8_2_WGM8
    SolutionIndex: 199
    SolutionNameMin: Cijk_Ailk_Bjlk_SB_MT32x16x32_SE_AMAS3_GRVW2_TT4_2_USFGRO0_VW2_WG8_8_4_WGM8
    SolutionIndex: 200
    SolutionNameMin: Cijk_Ailk_Bjlk_SB_MT128x128x16_SE_AMAS3_GRVW1_TT8_8_USFGRO1_VW4_WG16_16_1_WGM1
    SolutionIndex: 201
    SolutionNameMin: Cijk_Ailk_Bjlk_SB_MT64x32x8_SE_AMAS1_GRVW1_TT4_2_USFGRO1_VW1_WG16_16_1_WGM8
    SolutionIndex: 202
    SolutionNameMin: Cijk_Ailk_Bjlk_SB_MT16x32x16_SE_AMAS3_GRVW1_TT2_4_USFGRO1_VW2_WG8_8_4_WGM1
    SolutionIndex: 203
    SolutionNameMin: Cijk_Ailk_Bjlk_SB_MT32x32x32_SE_AMAS3_GRVW2_TT4_4_USFGRO0_VW2_WG8_8_4_WGM1
    SolutionIndex: 204
    SolutionNameMin: Cijk_Ailk_Bjlk_SB_MT32x64x16_SE_AMAS3_GRVW2_TT4_4_USFGRO0_VW2_WG8_16_2_WGM1
    SolutionIndex: 205
    SolutionNameMin: Cijk_Ailk_Bjlk_SB_MT64x32x16_SE_AMAS3_GRVW1_TT4_4_USFGRO1_VW2_WG16_8_2_WGM8
    SolutionIndex: 206
    SolutionNameMin: Cijk_Ailk_Bjlk_SB_MT64x64x16_SE_AMAS3_GRVW4_TT4_4_USFGRO0_VW4_WG16_16_1_WGM8
    SolutionIndex: 207
    SolutionNameMin: Cijk_Ailk_Bjlk_SB_MT64x64x16_SE_AMAS1_GRVW1_TT4_4_USFGRO1_VW1_WG16_16_1_WGM1
    SolutionIndex: 208
    SolutionNameMin: Cijk_Ailk_Bjlk_SB_MT64x32x16_SE_AMAS3_GRVW1_TT4_4_USFGRO1_VW4_WG16_8_2_WGM8
    SolutionIndex: 209
    SolutionNameMin: Cijk_Ailk_Bjlk_SB_MT32x64x16_SE_AMAS3_GRVW2_TT4_4_USFGRO0_VW2_WG8_16_2_WGM8
    SolutionIndex: 210
    SolutionNameMin: Cijk_Ailk_Bjlk_SB_MT32x16x32_SE_AMAS3_GRVW2_TT4_2_USFGRO0_VW2_WG8_8_4_WGM1
    SolutionIndex: 211
    SolutionNameMin: Cijk_Ailk_Bjlk_SB_MT64x64x16_SE_AMAS3_GRVW4_TT4_4_USFGRO0_VW4_WG16_16_1_WGM8
    SolutionIndex: 212
    SolutionNameMin: Cijk_Ailk_Bjlk_SB_MT32x32x32_SE_AMAS3_GRVW1_TT4_4_USFGRO1_VW2_WG8_8_4_WGM1
    SolutionIndex: 213
    SolutionNameMin: Cijk_Ailk_Bjlk_SB_MT64x64x16_SE_AMAS3_GRVW1_TT4_4_USFGRO1_VW4_WG16_16_1_WGM1
    SolutionIndex: 214
    SolutionNameMin: Cijk_Ailk_Bjlk_SB_MT64x64x8_SE_AMAS3_GRVW4_TT4_4_USFGRO0_VW2_WG16_16_1_WGM1
    SolutionIndex: 215
    SolutionNameMin: Cijk_Ailk_Bjlk_SB_MT32x32x32_SE_AMAS3_GRVW4_TT4_4_USFGRO0_VW4_WG8_8_4_WGM1
    SolutionIndex: 216
    SolutionNameMin: Cijk_Ailk_Bjlk_SB_MT64x64x8_SE_AMAS3_GRVW2_TT4_4_USFGRO0_VW2_WG16_16_1_WGM1
    SolutionIndex: 217
    SolutionNameMin: Cijk_Ailk_Bjlk_SB_MT64x64x16_SE_AMAS3_GRVW4_TT4_4_USFGRO0_VW4_WG16_16_1_WGM1
    SolutionIndex: 218
    SolutionNameMin: Cijk_Ailk_Bjlk_SB_MT64x64x16_SE_AMAS3_GRVW1_TT4_4_USFGRO1_VW2_WG16_16_1_WGM1
    SolutionIndex: 219
    SolutionNameMin: Cijk_Ailk_Bjlk_SB_MT64x32x32_SE_AMAS3_GRVW4_TT4_4_USFGRO0_VW4_WG16_8_2_WGM1
    SolutionIndex: 220
    SolutionNameMin: Cijk_Ailk_Bjlk_SB_MT64x32x16_SE_AMAS3_GRVW2_TT4_4_USFGRO0_VW2_WG16_8_2_WGM1
    SolutionIndex: 221
    SolutionNameMin: Cijk_Ailk_Bjlk_SB_MT128x128x16_SE_AMAS3_GRVW2_TT8_8_USFGRO0_VW2_WG16_16_1_WGM8
    SolutionIndex: 222
    SolutionNameMin: Cijk_Ailk_Bjlk_SB_MT32x32x8_SE_AMAS3_GRVW4_TT4_2_USFGRO1_VW2_WG8_16_2_WGM8
    SolutionIndex: 223
    SolutionNameMin: Cijk_Ailk_Bjlk_SB_MT64x32x16_SE_AMAS3_GRVW1_TT4_4_USFGRO1_VW4_WG16_8_2_WGM1
    SolutionIndex: 224
    SolutionNameMin: Cijk_Ailk_Bjlk_SB_MT64x64x8_SE_AMAS3_GRVW4_TT4_4_USFGRO0_VW2_WG16_16_1_WGM8
    SolutionIndex: 225
    SolutionNameMin: Cijk_Ailk_Bjlk_SB_MT64x64x8_SE_AMAS3_GRVW1_TT4_4_USFGRO1_VW4_WG16_16_1_WGM8
    SolutionIndex: 226
    SolutionNameMin: Cijk_Ailk_Bjlk_SB_MT64x32x32_SE_AMAS3_GRVW4_TT4_4_USFGRO0_VW4_WG16_8_2_WGM1
    SolutionIndex: 227
    SolutionNameMin: Cijk_Ailk_Bjlk_SB_MT16x32x32_SE_AMAS3_GRVW1_TT2_4_USFGRO1_VW2_WG8_8_4_WGM8
    SolutionIndex: 228
    SolutionNameMin: Cijk_Ailk_Bjlk_SB_MT32x16x32_SE_AMAS1_GRVW1_TT4_2_USFGRO1_VW1_WG8_8_4_WGM8
    SolutionIndex: 229
    SolutionNameMin: Cijk_Ailk_Bjlk_SB_MT16x32x32_SE_AMAS3_GRVW2_TT2_4_USFGRO0_VW2_WG8_8_4_WGM1
    SolutionIndex: 230
    SolutionNameMin: Cijk_Ailk_Bjlk_SB_MT32x32x16_SE_AMAS3_GRVW2_TT4_4_USFGRO0_VW2_WG8_8_4_WGM1
    SolutionIndex: 231
    SolutionNameMin: Cijk_Ailk_Bjlk_SB_MT128x128x16_SE_AMAS3_GRVW1_TT8_8_USFGRO1_VW4_WG16_16_1_WGM8
    SolutionIndex: 232
    SolutionNameMin: Cijk_Ailk_Bjlk_SB_MT64x64x8_SE_AMAS3_GRVW1_TT4_4_USFGRO1_VW4_WG16_16_1_WGM1
    SolutionIndex: 233
    SolutionNameMin: Cijk_Ailk_Bjlk_SB_MT32x32x32_SE_AMAS3_GRVW2_TT4_4_USFGRO0_VW2_WG8_8_4_WGM8
    SolutionIndex: 234
    SolutionNameMin: Cijk_Ailk_Bjlk_SB_MT32x64x16_SE_AMAS3_GRVW1_TT4_4_USFGRO1_VW4_WG8_16_2_WGM8
    SolutionIndex: 235
    SolutionNameMin: Cijk_Ailk_Bjlk_SB_MT32x64x16_SE_AMAS3_GRVW2_TT4_4_USFGRO0_VW2_WG8_16_2_WGM1
    SolutionIndex: 236
    SolutionNameMin: Cijk_Ailk_Bjlk_SB_MT64x64x16_SE_AMAS3_GRVW2_TT4_4_USFGRO0_VW2_WG16_16_1_WGM8
    SolutionIndex: 237
    SolutionNameMin: Cijk_Ailk_Bjlk_SB_MT128x128x8_SE_AMAS3_GRVW1_TT8_8_USFGRO1_VW4_WG16_16_1_WGM1
    SolutionIndex: 238
    SolutionNameMin: Cijk_Ailk_Bjlk_SB_MT64x32x8_SE_AMAS3_GRVW1_TT4_4_USFGRO1_VW4_WG16_8_2_WGM1
    SolutionIndex: 239
    SolutionNameMin: Cijk_Ailk_Bjlk_SB_MT32x32x32_SE_AMAS3_GRVW1_TT4_4_USFGRO1_VW2_WG8_8_4_WGM8
    SolutionIndex: 240
    SolutionNameMin: Cijk_Ailk_Bjlk_SB_MT128x128x8_SE_AMAS3_GRVW1_TT8_8_USFGRO1_VW2_WG16_16_1_WGM8
    SolutionIndex: 241
    SolutionNameMin: Cijk_Ailk_Bjlk_SB_MT128x128x8_SE_AMAS3_GRVW1_TT8_8_USFGRO1_VW4_WG16_16_1_WGM8
    SolutionIndex: 242
    SolutionNameMin: Cijk_Ailk_Bjlk_SB_MT64x32x8_SE_AMAS1_GRVW1_TT4_2_USFGRO1_VW1_WG16_16_1_WGM1
    SolutionIndex: 243
    SolutionNameMin: Cijk_Ailk_Bjlk_SB_MT32x32x32_SE_AMAS3_GRVW4_TT4_4_USFGRO0_VW4_WG8_8_4_WGM8
    SolutionIndex: 244
    SolutionNameMin: Cijk_Ailk_Bjlk_SB_MT16x32x32_SE_AMAS1_GRVW1_TT2_4_USFGRO1_VW1_WG8_8_4_WGM8
    SolutionIndex: 245
    SolutionNameMin: Cijk_Ailk_Bjlk_SB_MT64x32x8_SE_AMAS3_GRVW1_TT4_2_USFGRO1_VW2_WG16_16_1_WGM1
    SolutionIndex: 246
    SolutionNameMin: Cijk_Ailk_Bjlk_SB_MT64x16x32_SE_AMAS3_GRVW1_TT4_2_USFGRO1_VW2_WG16_8_2_WGM8
    SolutionIndex: 247
    SolutionNameMin: Cijk_Ailk_Bjlk_SB_MT64x64x8_SE_AMAS3_GRVW2_TT4_4_USFGRO0_VW2_WG16_16_1_WGM1
    SolutionIndex: 248
    SolutionNameMin: Cijk_Ailk_Bjlk_SB_MT64x32x16_SE_AMAS3_GRVW2_TT4_4_USFGRO0_VW2_WG16_8_2_WGM1
    SolutionIndex: 249
    SolutionNameMin: Cijk_Ailk_Bjlk_SB_MT32x16x32_SE_AMAS1_GRVW1_TT4_2_USFGRO1_VW1_WG8_8_4_WGM1
    SolutionIndex: 250
    SolutionNameMin: Cijk_Ailk_Bjlk_SB_MT128x128x8_SE_AMAS3_GRVW1_TT8_8_USFGRO1_VW2_WG16_16_1_WGM1
    SolutionIndex: 251
    SolutionNameMin: Cijk_Ailk_Bjlk_SB_MT16x32x32_SE_AMAS1_GRVW1_TT2_4_USFGRO1_VW1_WG8_8_4_WGM1
    SolutionIndex: 252
    SolutionNameMin: Cijk_Ailk_Bjlk_SB_MT64x32x8_SE_AMAS3_GRVW4_TT4_2_USFGRO0_VW2_WG16_16_1_WGM1
    SolutionIndex: 253
    SolutionNameMin: Cijk_Ailk_Bjlk_SB_MT64x64x8_SE_AMAS3_GRVW1_TT4_4_USFGRO1_VW2_WG16_16_1_WGM1
    SolutionIndex: 254
    SolutionNameMin: Cijk_Ailk_Bjlk_SB_MT64x64x8_SE_AMAS3_GRVW4_TT4_4_USFGRO0_VW2_WG16_16_1_WGM8
    SolutionIndex: 255
    SolutionNameMin: Cijk_Ailk_Bjlk_SB_MT64x64x8_SE_AMAS3_GRVW4_TT4_4_USFGRO0_VW2_WG16_16_1_WGM1
    SolutionIndex: 256
    SolutionNameMin: Cijk_Ailk_Bjlk_SB_MT16x64x32_SE_AMAS3_GRVW2_TT2_4_USFGRO0_VW2_WG8_16_2_WGM1
    SolutionIndex: 257
    SolutionNameMin: Cijk_Ailk_Bjlk_SB_MT16x32x32_SE_AMAS3_GRVW2_TT2_4_USFGRO0_VW2_WG8_8_4_WGM8
    SolutionIndex: 258
    SolutionNameMin: Cijk_Ailk_Bjlk_SB_MT128x128x8_SE_AMAS3_GRVW4_TT8_8_USFGRO0_VW4_WG16_16_1_WGM1
    SolutionIndex: 259
    SolutionNameMin: Cijk_Ailk_Bjlk_SB_MT32x64x16_SE_AMAS3_GRVW2_TT4_4_USFGRO0_VW2_WG8_16_2_WGM8
    SolutionIndex: 260
    SolutionNameMin: Cijk_Ailk_Bjlk_SB_MT64x16x16_SE_AMAS3_GRVW1_TT4_2_USFGRO1_VW2_WG16_8_2_WGM1
    SolutionIndex: 261
    SolutionNameMin: Cijk_Ailk_Bjlk_SB_MT64x32x32_SE_AMAS3_GRVW4_TT4_4_USFGRO0_VW4_WG16_8_2_WGM8
    SolutionIndex: 262
    SolutionNameMin: Cijk_Ailk_Bjlk_SB_MT64x32x32_SE_AMAS3_GRVW2_TT4_4_USFGRO0_VW2_WG16_8_2_WGM1
    SolutionIndex: 263
    SolutionNameMin: Cijk_Ailk_Bjlk_SB_MT32x32x32_SE_AMAS3_GRVW4_TT4_4_USFGRO0_VW4_WG8_8_4_WGM1
    SolutionIndex: 264
    SolutionNameMin: Cijk_Ailk_Bjlk_SB_MT32x16x16_SE_AMAS3_GRVW2_TT4_2_USFGRO0_VW2_WG8_8_4_WGM1
    SolutionIndex: 265
    SolutionNameMin: Cijk_Ailk_Bjlk_SB_MT64x32x32_SE_AMAS3_GRVW4_TT4_4_USFGRO0_VW4_WG16_8_2_WGM8
    SolutionIndex: 266
    SolutionNameMin: Cijk_Ailk_Bjlk_SB_MT32x32x32_SE_AMAS3_GRVW2_TT4_4_USFGRO0_VW2_WG8_8_4_WGM1
    SolutionIndex: 267
    SolutionNameMin: Cijk_Ailk_Bjlk_SB_MT32x32x32_SE_AMAS3_GRVW1_TT4_4_USFGRO1_VW4_WG8_8_4_WGM1
    SolutionIndex: 268
    SolutionNameMin: Cijk_Ailk_Bjlk_SB_MT64x64x8_SE_AMAS1_GRVW1_TT4_4_USFGRO1_VW1_WG16_16_1_WGM1
    SolutionIndex: 269
    SolutionNameMin: Cijk_Ailk_Bjlk_SB_MT64x64x16_SE_AMAS3_GRVW2_TT4_4_USFGRO0_VW2_WG16_16_1_WGM1
    SolutionIndex: 270
    SolutionNameMin: Cijk_Ailk_Bjlk_SB_MT64x16x16_SE_AMAS3_GRVW2_TT4_2_USFGRO0_VW2_WG16_8_2_WGM8
    SolutionIndex: 271
    SolutionNameMin: Cijk_Ailk_Bjlk_SB_MT64x32x16_SE_AMAS3_GRVW2_TT4_4_USFGRO0_VW2_WG16_8_2_WGM8
    SolutionIndex: 272
    SolutionNameMin: Cijk_Ailk_Bjlk_SB_MT64x64x8_SE_AMAS3_GRVW1_TT4_4_USFGRO1_VW2_WG16_16_1_WGM8
    SolutionIndex: 273
    SolutionNameMin: Cijk_Ailk_Bjlk_SB_MT32x32x32_SE_AMAS3_GRVW2_TT4_4_USFGRO0_VW2_WG8_8_4_WGM8
    SolutionIndex: 274
    SolutionNameMin: Cijk_Ailk_Bjlk_SB_MT64x32x16_SE_AMAS3_GRVW2_TT4_4_USFGRO0_VW2_WG16_8_2_WGM8
    SolutionIndex: 275
    SolutionNameMin: Cijk_Ailk_Bjlk_SB_MT64x64x16_SE_AMAS3_GRVW4_TT4_4_USFGRO0_VW4_WG16_16_1_WGM1
    SolutionIndex: 276
    SolutionNameMin: Cijk_Ailk_Bjlk_SB_MT32x32x32_SE_AMAS3_GRVW4_TT4_4_USFGRO0_VW4_WG8_8_4_WGM8
    SolutionIndex: 277
    SolutionNameMin: Cijk_Ailk_Bjlk_SB_MT32x64x32_SE_AMAS3_GRVW2_TT4_4_USFGRO0_VW2_WG8_16_2_WGM1
    SolutionIndex: 278
    SolutionNameMin: Cijk_Ailk_Bjlk_SB_MT32x64x32_SE_AMAS3_GRVW4_TT4_4_USFGRO0_VW4_WG8_16_2_WGM1
    SolutionIndex: 279
    SolutionNameMin: Cijk_Ailk_Bjlk_SB_MT32x64x32_SE_AMAS3_GRVW2_TT4_8_USFGRO0_VW2_WG8_8_4_WGM1
    SolutionIndex: 280
    SolutionNameMin: Cijk_Ailk_Bjlk_SB_MT64x32x32_SE_AMAS3_GRVW2_TT8_4_USFGRO0_VW2_WG8_8_4_WGM1
    SolutionIndex: 281
    SolutionNameMin: Cijk_Ailk_Bjlk_SB_MT64x64x32_SE_AMAS3_GRVW2_TT8_4_USFGRO0_VW2_WG8_16_2_WGM8
    SolutionIndex: 282
    SolutionNameMin: Cijk_Ailk_Bjlk_SB_MT64x32x32_SE_AMAS3_GRVW2_TT8_4_USFGRO0_VW2_WG8_8_4_WGM8
    SolutionIndex: 283
    SolutionNameMin: Cijk_Ailk_Bjlk_SB_MT64x64x8_SE_DTL0_EPS1_FL0_GRVW1_PGR1_PLR0_TT4_4_USFGRO1_VW2_WG16_16_1_WGM8
    SolutionIndex: 284
    SolutionNameMin: Cijk_Ailk_Bjlk_SB_MT64x64x8_SE_DTL0_EPS0_FL0_GRVW1_PGR0_PLR1_TT4_4_USFGRO1_VW2_WG16_16_1_WGM1
    SolutionIndex: 285
    SolutionNameMin: Cijk_Ailk_Bjlk_SB_MT64x64x8_SE_DTL0_EPS1_FL0_GRVW1_PGR1_PLR1_TT4_4_USFGRO1_VW2_WG16_16_1_WGM1
    SolutionIndex: 286
    SolutionNameMin: Cijk_Ailk_Bjlk_SB_MT64x64x8_SE_DTL0_EPS1_FL0_GRVW1_PGR1_PLR1_TT4_4_USFGRO1_VW2_WG16_16_1_WGM8
    SolutionIndex: 287
    SolutionNameMin: Cijk_Ailk_Bjlk_SB_MT64x64x16_SE_DTL0_EPS0_FL0_GRVW1_PGR0_PLR1_TT4_4_USFGRO1_VW2_WG16_16_1_WGM1
    SolutionIndex: 288
    SolutionNameMin: Cijk_Ailk_Bjlk_SB_MT64x64x16_SE_DTL0_EPS0_FL0_GRVW1_PGR0_PLR1_TT4_4_USFGRO1_VW2_WG16_16_1_WGM8
    SolutionIndex: 289
    SolutionNameMin: Cijk_Ailk_Bjlk_SB_MT64x64x8_SE_DTL0_EPS1_FL0_GRVW1_PGR1_PLR0_TT4_4_USFGRO1_VW4_WG16_16_1_WGM1
    SolutionIndex: 290
    SolutionNameMin: Cijk_Ailk_Bjlk_SB_MT64x64x8_SE_DTL0_EPS0_FL0_GRVW1_PGR0_PLR0_TT4_4_USFGRO1_VW4_WG16_16_1_WGM8
    SolutionIndex: 291
    SolutionNameMin: Cijk_Ailk_Bjlk_SB_MT64x64x8_SE_DTL0_EPS1_FL0_GRVW1_PGR1_PLR0_TT4_4_USFGRO1_VW4_WG16_16_1_WGM8
    SolutionIndex: 292
    SolutionNameMin: Cijk_Ailk_Bjlk_SB_MT64x64x8_SE_DTL0_EPS0_FL0_GRVW1_PGR0_PLR1_TT4_4_USFGRO1_VW4_WG16_16_1_WGM1
    SolutionIndex: 293
    SolutionNameMin: Cijk_Ailk_Bjlk_SB_MT64x64x8_SE_DTL0_EPS1_FL0_GRVW1_PGR1_PLR1_TT4_4_USFGRO1_VW4_WG16_16_1_WGM8
    SolutionIndex: 294
    SolutionNameMin: Cijk_Ailk_Bjlk_SB_MT64x64x16_SE_DTL0_EPS0_FL0_GRVW1_PGR0_PLR1_TT4_4_USFGRO1_VW4_WG16_16_1_WGM1
    SolutionIndex: 295
    SolutionNameMin: Cijk_Ailk_Bjlk_SB_MT64x64x16_SE_DTL0_EPS1_FL0_GRVW1_PGR1_PLR1_TT4_4_USFGRO1_VW4_WG16_16_1_WGM1
    SolutionIndex: 296
    SolutionNameMin: Cijk_Ailk_Bjlk_SB_MT64x64x16_SE_DTL0_EPS0_FL0_GRVW1_PGR0_PLR1_TT4_4_USFGRO1_VW4_WG16_16_1_WGM8
    SolutionIndex: 297
    SolutionNameMin: Cijk_Ailk_Bjlk_SB_MT64x64x8_SE_DTL0_EPS1_FL0_GRVW2_PGR1_PLR1_TT4_4_USFGRO0_VW2_WG16_16_1_WGM8
    SolutionIndex: 298
    SolutionNameMin: Cijk_Ailk_Bjlk_SB_MT64x64x8_SE_DTL0_EPS1_FL0_GRVW4_PGR1_PLR1_TT4_4_USFGRO0_VW2_WG16_16_1_WGM1
    SolutionIndex: 299
    SolutionNameMin: Cijk_Ailk_Bjlk_SB_MT64x64x16_SE_DTL0_EPS1_FL0_GRVW4_PGR1_PLR1_TT4_4_USFGRO0_VW4_WG16_16_1_WGM1
    SolutionIndex: 300
    SolutionNameMin: Cijk_Ailk_Bjlk_SB_MT64x64x16_SE_DTL0_EPS1_FL0_GRVW4_PGR1_PLR1_TT4_4_USFGRO0_VW4_WG16_16_1_WGM8
    SolutionIndex: 301
    SolutionNameMin: Cijk_Ailk_Bjlk_SB_MT64x64x8_SE_DTL0_EPS1_FL1_GRVW2_PGR1_PLR1_TT4_4_USFGRO0_VW2_WG16_16_1_WGM8
    SolutionIndex: 302
    SolutionNameMin: Cijk_Ailk_Bjlk_SB_MT64x64x16_SE_DTL0_EPS1_FL1_GRVW4_PGR1_PLR1_TT4_4_USFGRO0_VW4_WG16_16_1_WGM8
    SolutionIndex: 303
    SolutionNameMin: Cijk_Ailk_Bjlk_SB_MT96x64x8_SE_DTL0_EPS1_FL0_GRVW1_PGR1_PLR1_TT6_4_USFGRO1_VW2_WG16_16_1_WGM1
    SolutionIndex: 304
    SolutionNameMin: Cijk_Ailk_Bjlk_SB_MT96x64x8_SE_DTL0_EPS1_FL0_GRVW1_PGR1_PLR1_TT6_4_USFGRO1_VW2_WG16_16_1_WGM8
    SolutionIndex: 305
    SolutionNameMin: Cijk_Ailk_Bjlk_SB_MT96x64x8_SE_DTL0_EPS1_FL1_GRVW2_PGR1_PLR1_TT6_4_USFGRO0_VW2_WG16_16_1_WGM1
    SolutionIndex: 306
    SolutionNameMin: Cijk_Ailk_Bjlk_SB_MT96x64x8_SE_DTL0_EPS1_FL1_GRVW2_PGR1_PLR1_TT6_4_USFGRO0_VW2_WG16_16_1_WGM8
    SolutionIndex: 307
    SolutionNameMin: Cijk_Ailk_Bjlk_SB_MT64x96x8_SE_DTL0_EPS1_FL0_GRVW1_PGR1_PLR1_TT4_6_USFGRO1_VW2_WG16_16_1_WGM8
    SolutionIndex: 308
    SolutionNameMin: Cijk_Ailk_Bjlk_SB_MT64x96x8_SE_DTL0_EPS1_FL1_GRVW2_PGR1_PLR1_TT4_6_USFGRO0_VW2_WG16_16_1_WGM1
    SolutionIndex: 309
    SolutionNameMin: Cijk_Ailk_Bjlk_SB_MT64x96x8_SE_DTL0_EPS1_FL1_GRVW2_PGR1_PLR1_TT4_6_USFGRO0_VW2_WG16_16_1_WGM8
    SolutionIndex: 310
    SolutionNameMin: Cijk_Ailk_Bjlk_SB_MT64x128x8_SE_DTL0_EPS1_FL0_GRVW1_PGR1_PLR0_TT4_8_USFGRO1_VW4_WG16_16_1_WGM1
    SolutionIndex: 311
    SolutionNameMin: Cijk_Ailk_Bjlk_SB_MT64x128x8_SE_DTL0_EPS1_FL0_GRVW1_PGR1_PLR0_TT4_8_USFGRO1_VW4_WG16_16_1_WGM8
    SolutionIndex: 312
    SolutionNameMin: Cijk_Ailk_Bjlk_SB_MT64x128x8_SE_DTL0_EPS1_FL0_GRVW2_PGR1_PLR0_TT4_8_USFGRO0_VW2_WG16_16_1_WGM1
    SolutionIndex: 313
    SolutionNameMin: Cijk_Ailk_Bjlk_SB_MT64x128x8_SE_DTL0_EPS1_FL0_GRVW2_PGR1_PLR1_TT4_8_USFGRO0_VW2_WG16_16_1_WGM1
    SolutionIndex: 314
    SolutionNameMin: Cijk_Ailk_Bjlk_SB_MT64x128x8_SE_DTL0_EPS1_FL0_GRVW2_PGR1_PLR1_TT4_8_USFGRO0_VW2_WG16_16_1_WGM8
    SolutionIndex: 315
    SolutionNameMin: Cijk_Ailk_Bjlk_SB_MT64x128x8_SE_DTL0_EPS1_FL1_GRVW2_PGR1_PLR1_TT4_8_USFGRO0_VW2_WG16_16_1_WGM1
    SolutionIndex: 316
    SolutionNameMin: Cijk_Ailk_Bjlk_SB_MT64x128x8_SE_DTL0_EPS1_FL1_GRVW2_PGR1_PLR1_TT4_8_USFGRO0_VW2_WG16_16_1_WGM8
    SolutionIndex: 317
    SolutionNameMin: Cijk_Ailk_Bjlk_SB_MT128x64x8_SE_DTL0_EPS1_FL0_GRVW1_PGR1_PLR0_TT8_4_USFGRO1_VW4_WG16_16_1_WGM1
    SolutionIndex: 318
    SolutionNameMin: Cijk_Ailk_Bjlk_SB_MT128x64x8_SE_DTL0_EPS1_FL0_GRVW1_PGR1_PLR0_TT8_4_USFGRO1_VW4_WG16_16_1_WGM8
    SolutionIndex: 319
    SolutionNameMin: Cijk_Ailk_Bjlk_SB_MT128x64x8_SE_DTL0_EPS1_FL0_GRVW1_PGR1_PLR1_TT8_4_USFGRO1_VW4_WG16_16_1_WGM8
    SolutionIndex: 320
    SolutionNameMin: Cijk_Ailk_Bjlk_SB_MT128x64x8_SE_DTL0_EPS1_FL0_GRVW2_PGR1_PLR0_TT8_4_USFGRO0_VW2_WG16_16_1_WGM1
    SolutionIndex: 321
    SolutionNameMin: Cijk_Ailk_Bjlk_SB_MT128x64x8_SE_DTL0_EPS1_FL1_GRVW2_PGR1_PLR1_TT8_4_USFGRO0_VW2_WG16_16_1_WGM8
    SolutionIndex: 322
    SolutionNameMin: Cijk_Ailk_Bjlk_SB_MT32x64x16_SE_DTL0_EPS0_FL0_GRVW1_PGR0_PLR1_TT2_4_USFGRO1_VW2_WG16_16_1_WGM1
    SolutionIndex: 323
    SolutionNameMin: Cijk_Ailk_Bjlk_SB_MT32x64x16_SE_DTL0_EPS0_FL0_GRVW1_PGR0_PLR1_TT2_4_USFGRO1_VW2_WG16_16_1_WGM8
    SolutionIndex: 324
    SolutionNameMin: Cijk_Ailk_Bjlk_SB_MT32x64x8_SE_DTL0_EPS1_FL0_GRVW4_PGR1_PLR1_TT2_4_USFGRO0_VW2_WG16_16_1_WGM8
    SolutionIndex: 325
    SolutionNameMin: Cijk_Ailk_Bjlk_SB_MT32x64x16_SE_DTL0_EPS1_FL0_GRVW1_PGR1_PLR1_TT4_4_USFGRO1_VW2_WG8_16_2_WGM1
    SolutionIndex: 326
    SolutionNameMin: Cijk_Ailk_Bjlk_SB_MT32x64x16_SE_DTL0_EPS1_FL0_GRVW1_PGR1_PLR1_TT4_4_USFGRO1_VW4_WG8_16_2_WGM1
    SolutionIndex: 327
    SolutionNameMin: Cijk_Ailk_Bjlk_SB_MT32x32x8_SE_DTL0_EPS1_FL0_GRVW4_PGR1_PLR1_TT2_4_USFGRO1_VW2_WG16_8_2_WGM1
    SolutionIndex: 328
    SolutionNameMin: Cijk_Ailk_Bjlk_SB_MT32x32x16_SE_DTL0_EPS1_FL1_GRVW4_PGR1_PLR1_TT2_4_USFGRO0_VW2_WG16_8_2_WGM1
    SolutionIndex: 329
    SolutionNameMin: Cijk_Ailk_Bjlk_SB_MT8x32x32_SE_DTL0_EPS1_FL0_GRVW1_PGR1_PLR1_TT2_2_USFGRO1_VW2_WG4_16_4_WGM1
    SolutionIndex: 330
    SolutionNameMin: Cijk_Ailk_Bjlk_SB_MT16x32x32_SE_DTL0_EPS1_FL1_GRVW2_PGR1_PLR1_TT4_2_USFGRO0_VW2_WG4_16_4_WGM1
    SolutionIndex: 331
    SolutionNameMin: Cijk_Ailk_Bjlk_SB_MT16x64x16_SE_DTL0_EPS1_FL0_GRVW4_PGR1_PLR1_TT4_4_USFGRO0_VW4_WG4_16_4_WGM8
    SolutionIndex: 332
    SolutionNameMin: Cijk_Ailk_Bjlk_SB_MT32x16x32_SE_DTL0_EPS1_FL0_GRVW1_PGR1_PLR1_TT2_4_USFGRO1_VW2_WG16_4_4_WGM1
    SolutionIndex: 333
    SolutionNameMin: Cijk_Ailk_Bjlk_SB_MT64x16x16_SE_DTL0_EPS1_FL0_GRVW4_PGR1_PLR1_TT4_4_USFGRO0_VW4_WG16_4_4_WGM1
    SolutionIndex: 334
    SolutionNameMin: Cijk_Ailk_Bjlk_SB_MT64x16x16_SE_DTL0_EPS1_FL0_GRVW4_PGR1_PLR1_TT4_4_USFGRO0_VW4_WG16_4_4_WGM8
    SolutionIndex: 335
    SolutionNameMin: Cijk_Ailk_Bjlk_SB_MT64x16x32_SE_DTL0_EPS1_FL1_GRVW2_PGR1_PLR1_TT4_4_USFGRO0_VW2_WG16_4_4_WGM1
    SolutionIndex: 336
    SolutionNameMin: Cijk_Ailk_Bjlk_SB_MT64x32x8_SE_DTL0_EPS0_FL0_GRVW1_PGR0_PLR1_TT4_4_USFGRO1_VW4_WG16_8_1_WGM1
    SolutionIndex: 337
    SolutionNameMin: Cijk_Ailk_Bjlk_SB_MT64x32x8_SE_DTL0_EPS0_FL0_GRVW1_PGR0_PLR1_TT4_4_USFGRO1_VW4_WG16_8_1_WGM8
    SolutionIndex: 338
    SolutionNameMin: Cijk_Ailk_Bjlk_SB_MT64x32x16_SE_DTL0_EPS0_FL0_GRVW2_PGR0_PLR1_TT4_4_USFGRO0_VW2_WG16_8_1_WGM8
    SolutionIndex: 339
    SolutionNameMin: Cijk_Ailk_Bjlk_SB_MT64x64x8_SE_DTL0_EPS1_FL0_GRVW1_PGR1_PLR0_TT4_8_USFGRO1_VW2_WG16_8_1_WGM1
    SolutionIndex: 340
    SolutionNameMin: Cijk_Ailk_Bjlk_SB_MT64x64x8_SE_DTL0_EPS1_FL0_GRVW1_PGR1_PLR0_TT4_8_USFGRO1_VW4_WG16_8_1_WGM1
    SolutionIndex: 341
    SolutionNameMin: Cijk_Ailk_Bjlk_SB_MT64x64x8_SE_DTL0_EPS1_FL0_GRVW1_PGR1_PLR0_TT4_8_USFGRO1_VW4_WG16_8_1_WGM8
    SolutionIndex: 342
    SolutionNameMin: Cijk_Ailk_Bjlk_SB_MT64x64x8_SE_DTL0_EPS1_FL0_GRVW4_PGR1_PLR0_TT4_8_USFGRO0_VW4_WG16_8_1_WGM1
    SolutionIndex: 343
    SolutionNameMin: Cijk_Ailk_Bjlk_SB_MT64x64x8_SE_DTL0_EPS1_FL0_GRVW4_PGR1_PLR0_TT4_8_USFGRO0_VW4_WG16_8_1_WGM8
    SolutionIndex: 344
    SolutionNameMin: Cijk_Ailk_Bjlk_SB_MT64x64x8_SE_DTL0_EPS1_FL1_GRVW4_PGR1_PLR0_TT4_8_USFGRO0_VW4_WG16_8_1_WGM8
    SolutionIndex: 345
    SolutionNameMin: Cijk_Ailk_Bjlk_SB_MT64x64x8_SE_DTL0_EPS1_FL1_GRVW4_PGR1_PLR1_TT4_8_USFGRO0_VW4_WG16_8_1_WGM8
    SolutionIndex: 346
    SolutionNameMin: Cijk_Ailk_Bjlk_SB_MT128x32x8_SE_DTL1_EPS0_FL0_GRVW1_PGR0_PLR1_TT8_4_USFGRO1_VW4_WG16_8_1_WGM8
    SolutionIndex: 347
    SolutionNameMin: Cijk_Ailk_Bjlk_SB_MT32x64x16_SE_DTL0_EPS0_FL0_GRVW2_PGR0_PLR1_TT4_4_USFGRO0_VW2_WG8_16_1_WGM8
    SolutionIndex: 348
    SolutionNameMin: Cijk_Ailk_Bjlk_SB_MT32x64x8_SE_DTL0_EPS1_FL1_GRVW2_PGR1_PLR1_TT4_4_USFGRO0_VW2_WG8_16_1_WGM1
    SolutionIndex: 349
    SolutionNameMin: Cijk_Ailk_Bjlk_SB_MT32x64x16_SE_DTL0_EPS0_FL1_GRVW2_PGR0_PLR1_TT4_4_USFGRO0_VW2_WG8_16_1_WGM1
    SolutionIndex: 350
    SolutionNameMin: Cijk_Ailk_Bjlk_SB_MT64x64x8_SE_DTL0_EPS1_FL0_GRVW4_PGR1_PLR0_TT8_4_USFGRO0_VW4_WG8_16_1_WGM1
    SolutionIndex: 351
    SolutionNameMin: Cijk_Ailk_Bjlk_SB_MT64x64x8_SE_DTL0_EPS1_FL0_GRVW4_PGR1_PLR0_TT8_4_USFGRO0_VW4_WG8_16_1_WGM8
    SolutionIndex: 352
    SolutionNameMin: Cijk_Ailk_Bjlk_SB_MT64x64x8_SE_DTL0_EPS1_FL1_GRVW4_PGR1_PLR0_TT8_4_USFGRO0_VW4_WG8_16_1_WGM1
    SolutionIndex: 353
    SolutionNameMin: Cijk_Ailk_Bjlk_SB_MT64x64x8_SE_DTL0_EPS1_FL0_GRVW1_PGR1_PLR0_TT4_4_USFGRO1_VW4_WG16_16_1_WGM1
    SolutionIndex: 354
    SolutionNameMin: Cijk_Ailk_Bjlk_SB_MT64x64x8_SE_DTL0_EPS1_FL0_GRVW1_PGR1_PLR0_TT4_4_USFGRO1_VW4_WG16_16_1_WGM8
    SolutionIndex: 355
    SolutionNameMin: Cijk_Ailk_Bjlk_SB_MT64x64x16_SE_DTL0_EPS0_FL0_GRVW1_PGR0_PLR1_TT4_4_USFGRO1_VW4_WG16_16_1_WGM1
    SolutionIndex: 356
    SolutionNameMin: Cijk_Ailk_Bjlk_SB_MT64x64x16_SE_DTL0_EPS1_FL0_GRVW1_PGR1_PLR1_TT4_4_USFGRO1_VW4_WG16_16_1_WGM8
    SolutionIndex: 357
    SolutionNameMin: Cijk_Ailk_Bjlk_SB_MT64x128x8_SE_DTL0_EPS1_FL0_GRVW1_PGR1_PLR1_TT4_8_USFGRO1_VW2_WG16_16_1_WGM8
    SolutionIndex: 358
    SolutionNameMin: Cijk_Ailk_Bjlk_SB_MT64x128x8_SE_DTL0_EPS1_FL0_GRVW1_PGR1_PLR0_TT4_8_USFGRO1_VW4_WG16_16_1_WGM1
    SolutionIndex: 359
    SolutionNameMin: Cijk_Ailk_Bjlk_SB_MT64x128x8_SE_DTL0_EPS1_FL0_GRVW1_PGR1_PLR0_TT4_8_USFGRO1_VW4_WG16_16_1_WGM8
    SolutionIndex: 360
    SolutionNameMin: Cijk_Ailk_Bjlk_SB_MT64x128x8_SE_DTL0_EPS1_FL1_GRVW2_PGR1_PLR0_TT4_8_USFGRO0_VW2_WG16_16_1_WGM8
    SolutionIndex: 361
    SolutionNameMin: Cijk_Ailk_Bjlk_SB_MT64x128x8_SE_DTL0_EPS1_FL1_GRVW2_PGR1_PLR1_TT4_8_USFGRO0_VW2_WG16_16_1_WGM1
    SolutionIndex: 362
    SolutionNameMin: Cijk_Ailk_Bjlk_SB_MT64x128x8_SE_DTL0_EPS1_FL1_GRVW2_PGR1_PLR1_TT4_8_USFGRO0_VW2_WG16_16_1_WGM8
    SolutionIndex: 363
    SolutionNameMin: Cijk_Ailk_Bjlk_SB_MT128x64x16_SE_DTL0_EPS0_FL0_GRVW1_PGR0_PLR1_TT8_4_USFGRO1_VW4_WG16_16_1_WGM1
    SolutionIndex: 364
    SolutionNameMin: Cijk_Ailk_Bjlk_SB_MT64x64x8_SE_DTL0_EPS1_FL0_GRVW4_PGR1_PLR0_TT4_8_USFGRO0_VW4_WG16_8_1_WGM1
    SolutionIndex: 365
    SolutionNameMin: Cijk_Ailk_Bjlk_SB_MT64x64x8_SE_DTL0_EPS1_FL0_GRVW4_PGR1_PLR0_TT4_8_USFGRO0_VW4_WG16_8_1_WGM8
    SolutionIndex: 366
    SolutionNameMin: Cijk_Ailk_Bjlk_SB_MT128x32x8_SE_DTL1_EPS0_FL0_GRVW1_PGR0_PLR1_TT8_4_USFGRO1_VW4_WG16_8_1_WGM8
    SolutionIndex: 367
    SolutionNameMin: Cijk_Ailk_Bjlk_SB_MT64x64x8_SE_DTL0_EPS1_FL0_GRVW4_PGR1_PLR0_TT8_4_USFGRO0_VW4_WG8_16_1_WGM1
    SolutionIndex: 368
    SolutionNameMin: Cijk_Ailk_Bjlk_SB_MT64x64x8_SE_DTL0_EPS1_FL1_GRVW4_PGR1_PLR0_TT8_4_USFGRO0_VW4_WG8_16_1_WGM1
    SolutionIndex: 369
    SolutionNameMin: Cijk_Ailk_Bjlk_SB_MT64x64x8_SE_EPS1_FL0_GRVW2_NLCA1_NLCB1_PGR1_PLR1_TT4_4_USFGRO0_VW2_WGM8
    SolutionIndex: 370
    SolutionNameMin: Cijk_Ailk_Bjlk_SB_MT96x64x8_SE_EPS1_FL1_GRVW2_NLCA1_NLCB1_PGR1_PLR1_TT6_4_USFGRO0_VW2_WGM8
    SolutionIndex: 371
    SolutionNameMin: Cijk_Ailk_Bjlk_SB_MT128x64x8_SE_EPS1_FL0_GRVW2_NLCA1_NLCB1_PGR1_PLR1_TT8_4_USFGRO0_VW2_WGM8
    SolutionIndex: 372
    SolutionNameMin: Cijk_Ailk_Bjlk_SB_MT128x64x8_SE_EPS1_FL1_GRVW2_NLCA1_NLCB1_PGR1_PLR0_TT8_4_USFGRO0_VW2_WGM8
    SolutionIndex: 376
    SolutionNameMin: Cijk_Ailk_Bjlk_SB_MT64x64x16_SE_EPS1_FL1_GRVW2_NLCA1_NLCB1_PGR1_PLR1_TT4_4_USFGRO0_VW2_WGM8
    SolutionIndex: 377
    SolutionNameMin: Cijk_Ailk_Bjlk_SB_MT64x128x8_SE_EPS1_FL1_GRVW2_NLCA1_NLCB1_PGR1_PLR1_TT4_8_USFGRO0_VW2_WGM1
    SolutionIndex: 378
    SolutionNameMin: Cijk_Ailk_Bjlk_SB_MT128x64x16_SE_EPS0_FL0_GRVW4_NLCA1_NLCB1_PGR0_PLR1_TT8_4_USFGRO0_VW4_WGM8
    SolutionIndex: 379
    SolutionNameMin: Cijk_Ailk_Bjlk_SB_MT64x64x8_SE_DTL0_EPS1_FL1_GRVW4_PGR1_PLR0_TT4_4_USFGRO0_VW2_WG16_16_1_WGM1
    SolutionIndex: 380
    SolutionNameMin: Cijk_Ailk_Bjlk_SB_MT64x64x16_SE_DTL0_EPS1_FL0_GRVW1_PGR1_PLR1_TT4_4_USFGRO1_VW4_WG16_16_1_WGM1
    SolutionIndex: 381
    SolutionNameMin: Cijk_Ailk_Bjlk_SB_MT64x64x8_SE_DTL0_EPS1_FL0_GRVW4_PGR1_PLR1_TT4_4_USFGRO0_VW2_WG16_16_1_WGM8
    SolutionIndex: 382
    SolutionNameMin: Cijk_Ailk_Bjlk_SB_MT64x64x8_SE_DTL0_EPS1_FL1_GRVW2_PGR1_PLR1_TT4_4_USFGRO0_VW2_WG16_16_1_WGM1
    SolutionIndex: 383
    SolutionNameMin: Cijk_Ailk_Bjlk_SB_MT64x128x8_SE_DTL0_EPS1_FL0_GRVW2_PGR1_PLR1_TT4_8_USFGRO0_VW2_WG16_16_1_WGM8
    SolutionIndex: 384
    SolutionNameMin: Cijk_Ailk_Bjlk_SB_MT64x128x8_SE_DTL0_EPS1_FL1_GRVW2_PGR1_PLR1_TT4_8_USFGRO0_VW2_WG16_16_1_WGM8
    SolutionIndex: 385
    SolutionNameMin: Cijk_Ailk_Bjlk_SB_MT128x64x8_SE_DTL0_EPS1_FL0_GRVW2_PGR1_PLR1_TT8_4_USFGRO0_VW2_WG16_16_1_WGM1
    SolutionIndex: 386
    SolutionNameMin: Cijk_Ailk_Bjlk_SB_MT128x64x8_SE_DTL0_EPS1_FL0_GRVW2_PGR1_PLR1_TT8_4_USFGRO0_VW2_WG16_16_1_WGM8
    SolutionIndex: 387
    SolutionNameMin: Cijk_Ailk_Bjlk_SB_MT128x64x8_SE_DTL0_EPS1_FL1_GRVW2_PGR1_PLR1_TT8_4_USFGRO0_VW2_WG16_16_1_WGM1
    SolutionIndex: 388
    SolutionNameMin: Cijk_Ailk_Bjlk_SB_MT128x64x8_SE_DTL0_EPS1_FL1_GRVW2_PGR1_PLR1_TT8_4_USFGRO0_VW2_WG16_16_1_WGM8
    SolutionIndex: 389
    SolutionNameMin: Cijk_Ailk_Bjlk_SB_MT64x32x32_SE_DTL0_EPS0_FL0_GRVW1_PGR0_PLR1_TT4_2_USFGRO1_VW2_WG16_16_1_WGM8
    SolutionIndex: 390
    SolutionNameMin: Cijk_Ailk_Bjlk_SB_MT32x64x32_SE_DTL0_EPS1_FL0_GRVW4_PGR1_PLR1_TT4_4_USFGRO0_VW4_WG8_16_2_WGM1
    SolutionIndex: 391
    SolutionNameMin: Cijk_Ailk_Bjlk_SB_MT32x64x32_SE_DTL0_EPS1_FL1_GRVW4_PGR1_PLR1_TT4_4_USFGRO0_VW4_WG8_16_2_WGM1
    SolutionIndex: 392
    SolutionNameMin: Cijk_Ailk_Bjlk_SB_MT64x32x32_SE_DTL0_EPS1_FL0_GRVW4_PGR1_PLR1_TT4_4_USFGRO0_VW4_WG16_8_2_WGM1
    SolutionIndex: 393
    SolutionNameMin: Cijk_Ailk_Bjlk_SB_MT64x32x32_SE_DTL0_EPS1_FL0_GRVW4_PGR1_PLR1_TT4_4_USFGRO0_VW4_WG16_8_2_WGM8
    SolutionIndex: 394
    SolutionNameMin: Cijk_Ailk_Bjlk_SB_MT64x32x32_SE_DTL0_EPS1_FL1_GRVW4_PGR1_PLR1_TT4_4_USFGRO0_VW4_WG16_8_2_WGM1
    SolutionIndex: 395
    SolutionNameMin: Cijk_Ailk_Bjlk_SB_MT64x32x32_SE_DTL0_EPS1_FL1_GRVW4_PGR1_PLR1_TT4_4_USFGRO0_VW4_WG16_8_2_WGM8
    SolutionIndex: 396
    SolutionNameMin: Cijk_Ailk_Bjlk_SB_MT64x32x8_SE_DTL0_EPS0_FL0_GRVW1_PGR0_PLR0_TT4_4_USFGRO1_VW2_WG16_8_1_WGM1
    SolutionIndex: 397
    SolutionNameMin: Cijk_Ailk_Bjlk_SB_MT64x32x8_SE_DTL0_EPS0_FL0_GRVW1_PGR0_PLR1_TT4_4_USFGRO1_VW2_WG16_8_1_WGM1
    SolutionIndex: 398
    SolutionNameMin: Cijk_Ailk_Bjlk_SB_MT64x32x8_SE_DTL0_EPS0_FL0_GRVW1_PGR0_PLR1_TT4_4_USFGRO1_VW2_WG16_8_1_WGM8
    SolutionIndex: 399
    SolutionNameMin: Cijk_Ailk_Bjlk_SB_MT64x32x8_SE_DTL0_EPS0_FL0_GRVW1_PGR0_PLR1_TT4_4_USFGRO1_VW4_WG16_8_1_WGM1
    SolutionIndex: 400
    SolutionNameMin: Cijk_Ailk_Bjlk_SB_MT64x32x8_SE_DTL0_EPS0_FL1_GRVW2_PGR0_PLR1_TT4_4_USFGRO0_VW2_WG16_8_1_WGM8
    SolutionIndex: 401
    SolutionNameMin: Cijk_Ailk_Bjlk_SB_MT64x32x8_SE_DTL0_EPS1_FL0_GRVW2_PGR1_PLR1_TT4_4_USFGRO0_VW2_WG16_8_1_WGM1
    SolutionIndex: 402
    SolutionNameMin: Cijk_Ailk_Bjlk_SB_MT64x32x8_SE_DTL0_EPS1_FL0_GRVW2_PGR1_PLR1_TT4_4_USFGRO0_VW2_WG16_8_1_WGM8
    SolutionIndex: 403
    SolutionNameMin: Cijk_Ailk_Bjlk_SB_MT64x32x8_SE_DTL0_EPS1_FL1_GRVW2_PGR1_PLR1_TT4_4_USFGRO0_VW2_WG16_8_1_WGM1
    SolutionIndex: 404
    SolutionNameMin: Cijk_Ailk_Bjlk_SB_MT64x16x8_SE_DTL0_EPS0_FL0_GRVW1_PGR0_PLR0_TT4_2_USFGRO1_VW2_WG16_8_1_WGM1
    SolutionIndex: 405
    SolutionNameMin: Cijk_Ailk_Bjlk_SB_MT64x16x16_SE_DTL0_EPS0_FL0_GRVW1_PGR0_PLR0_TT4_2_USFGRO1_VW2_WG16_8_1_WGM8
    SolutionIndex: 406
    SolutionNameMin: Cijk_Ailk_Bjlk_SB_MT64x16x8_SE_DTL0_EPS0_FL0_GRVW1_PGR0_PLR1_TT4_2_USFGRO1_VW2_WG16_8_1_WGM1
    SolutionIndex: 407
    SolutionNameMin: Cijk_Ailk_Bjlk_SB_MT64x16x8_SE_DTL0_EPS0_FL0_GRVW1_PGR0_PLR1_TT4_2_USFGRO1_VW2_WG16_8_1_WGM8
    SolutionIndex: 408
    SolutionNameMin: Cijk_Ailk_Bjlk_SB_MT64x16x8_SE_DTL0_EPS0_FL0_GRVW2_PGR0_PLR1_TT4_2_USFGRO0_VW2_WG16_8_1_WGM1
    SolutionIndex: 409
    SolutionNameMin: Cijk_Ailk_Bjlk_SB_MT64x16x16_SE_DTL0_EPS0_FL0_GRVW2_PGR0_PLR1_TT4_2_USFGRO0_VW2_WG16_8_1_WGM1
    SolutionIndex: 410
    SolutionNameMin: Cijk_Ailk_Bjlk_SB_MT64x16x16_SE_DTL0_EPS0_FL0_GRVW2_PGR0_PLR1_TT4_2_USFGRO0_VW2_WG16_8_1_WGM8
    SolutionIndex: 411
    SolutionNameMin: Cijk_Ailk_Bjlk_SB_MT64x16x16_SE_DTL0_EPS0_FL1_GRVW2_PGR0_PLR1_TT4_2_USFGRO0_VW2_WG16_8_1_WGM1
    SolutionIndex: 412
    SolutionNameMin: Cijk_Ailk_Bjlk_SB_MT64x64x8_SE_DTL0_EPS1_FL0_GRVW4_PGR1_PLR0_TT4_8_USFGRO0_VW4_WG16_8_1_WGM1
    SolutionIndex: 413
    SolutionNameMin: Cijk_Ailk_Bjlk_SB_MT64x64x8_SE_DTL0_EPS1_FL0_GRVW1_PGR1_PLR0_TT4_4_USFGRO1_VW4_WG16_16_1_WGM1
    SolutionIndex: 414
    SolutionNameMin: Cijk_Ailk_Bjlk_SB_MT64x64x8_SE_DTL0_EPS1_FL0_GRVW1_PGR1_PLR0_TT4_4_USFGRO1_VW4_WG16_16_1_WGM8
    SolutionIndex: 415
    SolutionNameMin: Cijk_Ailk_Bjlk_SB_MT64x64x16_SE_DTL0_EPS0_FL0_GRVW1_PGR0_PLR1_TT4_4_USFGRO1_VW4_WG16_16_1_WGM8
    SolutionIndex: 416
    SolutionNameMin: Cijk_Ailk_Bjlk_SB_MT64x128x8_SE_DTL0_EPS1_FL0_GRVW1_PGR1_PLR0_TT4_8_USFGRO1_VW4_WG16_16_1_WGM1
    SolutionIndex: 417
    SolutionNameMin: Cijk_Ailk_Bjlk_SB_MT64x128x8_SE_DTL0_EPS1_FL0_GRVW1_PGR1_PLR0_TT4_8_USFGRO1_VW4_WG16_16_1_WGM8
    SolutionIndex: 418
    SolutionNameMin: Cijk_Ailk_Bjlk_SB_MT64x128x8_SE_DTL0_EPS1_FL0_GRVW2_PGR1_PLR1_TT4_8_USFGRO0_VW2_WG16_16_1_WGM1
    SolutionIndex: 419
    SolutionNameMin: Cijk_Ailk_Bjlk_SB_MT64x128x8_SE_DTL0_EPS1_FL0_GRVW2_PGR1_PLR1_TT4_8_USFGRO0_VW2_WG16_16_1_WGM8
    SolutionIndex: 420
    SolutionNameMin: Cijk_Ailk_Bjlk_SB_MT64x128x8_SE_DTL0_EPS1_FL1_GRVW2_PGR1_PLR1_TT4_8_USFGRO0_VW2_WG16_16_1_WGM1
    SolutionIndex: 421
    SolutionNameMin: Cijk_Ailk_Bjlk_SB_MT64x64x8_SE_DTL0_EPS1_FL0_GRVW4_PGR1_PLR0_TT4_8_USFGRO0_VW4_WG16_8_1_WGM1
    SolutionIndex: 422
    SolutionNameMin: Cijk_Ailk_Bjlk_SB_MT64x64x8_SE_DTL0_EPS1_FL1_GRVW4_PGR1_PLR0_TT4_8_USFGRO0_VW4_WG16_8_1_WGM1
    SolutionIndex: 423
    SolutionNameMin: Cijk_Ailk_Bjlk_SB_MT64x64x8_SE_DTL0_EPS1_FL1_GRVW4_PGR1_PLR0_TT4_8_USFGRO0_VW4_WG16_8_1_WGM8
    SolutionIndex: 424
    SolutionNameMin: Cijk_Ailk_Bjlk_SB_MT128x32x8_SE_DTL1_EPS0_FL0_GRVW1_PGR0_PLR1_TT8_4_USFGRO1_VW4_WG16_8_1_WGM8
    SolutionIndex: 425
    SolutionNameMin: Cijk_Ailk_Bjlk_SB_MT32x128x8_SE_DTL1_EPS0_FL0_GRVW1_PGR0_PLR1_TT4_8_USFGRO1_VW4_WG8_16_1_WGM1
    SolutionIndex: 426
    SolutionNameMin: Cijk_Ailk_Bjlk_SB_MT64x64x8_SE_DTL0_EPS1_FL0_GRVW2_PGR1_PLR0_TT8_4_USFGRO0_VW2_WG8_16_1_WGM8
    SolutionIndex: 427
    SolutionNameMin: Cijk_Ailk_Bjlk_SB_MT64x64x8_SE_DTL0_EPS1_FL0_GRVW4_PGR1_PLR0_TT8_4_USFGRO0_VW4_WG8_16_1_WGM8
    SolutionIndex: 428
    SolutionNameMin: Cijk_Ailk_Bjlk_SB_MT64x64x16_SE_EPS1_FL0_GRVW4_GSU1_PGR1_PLR1_TT4_4_USFGRO0_VW4_WG16_16_1_WGM1
    SolutionIndex: 429
    SolutionNameMin: Cijk_Ailk_Bjlk_SB_MT64x64x16_SE_EPS1_FL0_GRVW4_GSU1_PGR1_PLR1_TT4_4_USFGRO0_VW4_WG16_16_1_WGM8
    SolutionIndex: 430
    SolutionNameMin: Cijk_Ailk_Bjlk_SB_MT64x64x16_SE_EPS1_FL1_GRVW4_GSU1_PGR1_PLR1_TT4_4_USFGRO0_VW4_WG16_16_1_WGM8
    SolutionIndex: 431
    SolutionNameMin: Cijk_Ailk_Bjlk_SB_MT128x64x8_SE_EPS1_FL0_GRVW1_GSU1_PGR1_PLR0_TT8_4_USFGRO1_VW2_WG16_16_1_WGM1
    SolutionIndex: 432
    SolutionNameMin: Cijk_Ailk_Bjlk_SB_MT128x64x16_SE_EPS0_FL0_GRVW1_GSU1_PGR0_PLR0_TT8_4_USFGRO1_VW2_WG16_16_1_WGM1
    SolutionIndex: 433
    SolutionNameMin: Cijk_Ailk_Bjlk_SB_MT128x64x8_SE_EPS1_FL0_GRVW1_GSU1_PGR1_PLR0_TT8_4_USFGRO1_VW4_WG16_16_1_WGM1
    SolutionIndex: 434
    SolutionNameMin: Cijk_Ailk_Bjlk_SB_MT128x64x8_SE_EPS1_FL0_GRVW1_GSU1_PGR1_PLR0_TT8_4_USFGRO1_VW4_WG16_16_1_WGM8
    SolutionIndex: 435
    SolutionNameMin: Cijk_Ailk_Bjlk_SB_MT128x64x8_SE_EPS0_FL1_GRVW2_GSU1_PGR0_PLR0_TT8_4_USFGRO0_VW2_WG16_16_1_WGM1
    SolutionIndex: 436
    SolutionNameMin: Cijk_Ailk_Bjlk_SB_MT96x64x8_SE_EPS1_FL1_GRVW2_GSU1_PGR1_PLR1_TT6_4_USFGRO0_VW2_WG16_16_1_WGM8
    SolutionIndex: 437
    SolutionNameMin: Cijk_Ailk_Bjlk_SB_MT64x96x8_SE_EPS1_FL0_GRVW1_GSU1_PGR1_PLR1_TT4_6_USFGRO1_VW2_WG16_16_1_WGM1
    SolutionIndex: 438
    SolutionNameMin: Cijk_Ailk_Bjlk_SB_MT64x96x8_SE_EPS1_FL1_GRVW2_GSU1_PGR1_PLR1_TT4_6_USFGRO0_VW2_WG16_16_1_WGM8
    SolutionIndex: 439
    SolutionNameMin: Cijk_Ailk_Bjlk_SB_MT64x64x16_SE_FL0_GRVW4_NLCA1_NLCB1_PLR0_TT4_4_VW4_WG16_16_1_WGM8
    SolutionIndex: 440
    SolutionNameMin: Cijk_Ailk_Bjlk_SB_MT64x64x16_SE_FL0_GRVW4_NLCA1_NLCB1_PLR1_TT4_4_VW4_WG16_16_1_WGM8
    SolutionIndex: 441
    SolutionNameMin: Cijk_Ailk_Bjlk_SB_MT128x64x16_SE_FL0_GRVW4_NLCA1_NLCB1_PLR1_TT8_4_VW4_WG16_16_1_WGM1
    SolutionIndex: 442
    SolutionNameMin: Cijk_Ailk_Bjlk_SB_MT64x32x32_SE_FL0_GRVW4_NLCA1_NLCB1_PLR1_TT8_4_VW4_WG8_8_4_WGM16
    SolutionIndex: 443
    SolutionIndex: 444
    SolutionIndex: 445
    SolutionIndex: 447
    SolutionIndex: 448
    SolutionIndex: 449
    SolutionIndex: 450
    SolutionIndex: 451
    SolutionIndex: 452
    SolutionIndex: 453
    SolutionIndex: 454
    SolutionIndex: 455
    SolutionIndex: 456
    SolutionIndex: 457
    SolutionIndex: 458
    SolutionIndex: 459
    SolutionIndex: 460
    SolutionIndex: 461
    SolutionIndex: 462
    SolutionIndex: 463
    SolutionIndex: 464
    SolutionIndex: 465
    SolutionIndex: 466
    SolutionNameMin: Cijk_Ailk_Bjlk_SB_MT64x64x16_SE_GRVW4_GSU1_LRVW4_TT4_4_VW4_WG16_16_1_WGM8
    SolutionIndex: 467
    SolutionNameMin: Cijk_Ailk_Bjlk_SB_MT128x64x16_SE_GRVW4_GSU1_LRVW4_TT8_4_VW4_WG16_16_1_WGM1
    SolutionIndex: 468
    SolutionNameMin: Cijk_Ailk_Bjlk_SB_MT128x64x16_SE_GRVW4_GSU1_LRVW4_TT8_4_VW4_WG16_16_1_WGM8
    SolutionIndex: 469
    SolutionNameMin: Cijk_Ailk_Bjlk_SB_MT64x64x16_SE_GRVW4_GSU1_LRVW4_TT4_4_VW4_WG16_16_1_WGM1
    SolutionIndex: 470
    SolutionNameMin: Cijk_Ailk_Bjlk_SB_MT128x128x16_SE_GRVW4_GSU1_LRVW4_TT8_8_VW4_WG16_16_1_WGM8
    SolutionIndex: 471
    SolutionNameMin: Cijk_Ailk_Bjlk_SB_MT128x128x16_SE_GRVW4_GSU1_LRVW4_TT8_8_VW4_WG16_16_1_WGM1
    SolutionIndex: 472
    SolutionNameMin: Cijk_Ailk_Bjlk_SB_MT64x64x16_SE_GRVW4_LRVW4_TT4_4_VW4_WG16_16_1_WGM8
    SolutionIndex: 473
    SolutionNameMin: Cijk_Ailk_Bjlk_SB_MT128x128x16_SE_GRVW4_LRVW4_TT8_8_VW4_WG16_16_1_WGM1
    SolutionIndex: 474
    SolutionNameMin: Cijk_Ailk_Bjlk_SB_MT64x64x16_SE_GRVW4_LRVW4_TT4_4_VW4_WG16_16_1_WGM1
    SolutionIndex: 475
    SolutionNameMin: Cijk_Ailk_Bjlk_SB_MT128x128x16_SE_GRVW4_LRVW4_TT8_8_VW4_WG16_16_1_WGM8
    SolutionIndex: 476
    SolutionNameMin: Cijk_Ailk_Bjlk_SB_MT128x64x16_SE_GRVW4_LRVW4_TT8_4_VW4_WG16_16_1_WGM8
    SolutionIndex: 477
    SolutionNameMin: Cijk_Ailk_Bjlk_SB_MT64x64x32_SE_GRVW4_LRVW4_TT4_8_VW4_WG16_8_2_WGM8
    SolutionIndex: 478
    SolutionNameMin: Cijk_Ailk_Bjlk_SB_MT64x128x16_SE_GRVW4_LRVW4_TT4_8_VW4_WG16_16_1_WGM1
    SolutionIndex: 479
    SolutionNameMin: Cijk_Ailk_Bjlk_SB_MT64x128x16_SE_GRVW4_LRVW4_TT4_8_VW4_WG16_16_1_WGM8
    SolutionIndex: 480
    SolutionNameMin: Cijk_Ailk_Bjlk_SB_MT128x64x16_SE_GRVW4_LRVW4_TT8_4_VW4_WG16_16_1_WGM1
    SolutionIndex: 481
    SolutionNameMin: Cijk_Ailk_Bjlk_SB_MT64x64x16_SE_GRVW4_LRVW4_TT8_4_VW4_WG8_16_2_WGM8
    SolutionIndex: 482
    SolutionNameMin: Cijk_Ailk_Bjlk_SB_MT64x64x32_SE_GRVW4_LRVW4_TT8_4_VW4_WG8_16_2_WGM8
    SolutionIndex: 483
    SolutionNameMin: Cijk_Ailk_Bjlk_SB_MT64x64x32_SE_GRVW4_LRVW4_TT4_4_VW4_WG16_16_1_WGM8
    SolutionIndex: 484
    SolutionNameMin: Cijk_Ailk_Bjlk_SB_MT32x128x24_SE_GRVW4_LRVW4_TT4_8_VW4_WG8_16_2_WGM8
    SolutionIndex: 485
    SolutionNameMin: Cijk_Ailk_Bjlk_SB_MT128x32x24_SE_GRVW4_LRVW4_TT8_4_VW4_WG16_8_2_WGM8
    SolutionIndex: 486
    SolutionNameMin: Cijk_Ailk_Bjlk_SB_MT64x64x16_SE_GRVW4_LRVW4_TT4_8_VW4_WG16_8_2_WGM8
    SolutionIndex: 487
    SolutionNameMin: Cijk_Ailk_Bjlk_SB_MT128x32x24_SE_GRVW4_LRVW4_TT8_4_VW4_WG16_8_2_WGM1
    SolutionIndex: 488
    SolutionNameMin: Cijk_Ailk_Bjlk_SB_MT64x64x16_SE_GRVW4_LRVW4_TT4_8_VW4_WG16_8_2_WGM1
    SolutionIndex: 489
    SolutionNameMin: Cijk_Ailk_Bjlk_SB_MT32x128x24_SE_GRVW4_LRVW4_TT4_8_VW4_WG8_16_2_WGM1
    SolutionIndex: 490
    SolutionNameMin: Cijk_Ailk_Bjlk_SB_MT64x64x32_SE_GRVW4_LRVW4_TT4_8_VW4_WG16_8_2_WGM1
    SolutionIndex: 491
    SolutionNameMin: Cijk_Ailk_Bjlk_SB_MT64x96x16_SE_GRVW2_LRVW2_TT4_6_VW2_WG16_16_1_WGM8
    SolutionIndex: 492
    SolutionNameMin: Cijk_Ailk_Bjlk_SB_MT64x96x16_SE_GRVW2_LRVW2_TT4_6_VW2_WG16_16_1_WGM1
    SolutionIndex: 493
    SolutionNameMin: Cijk_Ailk_Bjlk_SB_MT64x96x24_SE_GRVW2_LRVW2_TT4_6_VW2_WG16_16_1_WGM8
    SolutionIndex: 494
    SolutionNameMin: Cijk_Ailk_Bjlk_SB_MT64x64x16_SE_GRVW4_LRVW4_TT8_4_VW4_WG8_16_2_WGM1
    SolutionIndex: 495
    SolutionNameMin: Cijk_Ailk_Bjlk_SB_MT64x64x32_SE_GRVW4_LRVW4_TT8_4_VW4_WG8_16_2_WGM1
    SolutionIndex: 496
    SolutionNameMin: Cijk_Ailk_Bjlk_SB_MT96x64x24_SE_GRVW2_LRVW2_TT6_4_VW2_WG16_16_1_WGM8
- - - [1024, 128, 1, 128]
    - [4, 1028.02]
  - - [4, 704, 1, 1280]
    - [43, 363.355]
  - - [4, 1856, 1, 3328]
    - [43, 579.434]
  - - [1856, 448, 1, 3328]
    - [80, 6966.73]
  - - [2944, 4288, 1, 1280]
    - [75, 9057.88]
  - - [2368, 64, 1, 3328]
    - [36, 5837.56]
  - - [2368, 5888, 1, 256]
    - [80, 9111.06]
  - - [128, 64, 1, 256]
    - [42, 374.491]
  - - [5888, 1024, 1, 1280]
    - [85, 8570.44]
  - - [128, 6784, 1, 3328]
    - [48, 7703.86]
  - - [64, 4, 1, 256]
    - [94, 11.2219]
  - - [5888, 1856, 1, 3328]
    - [80, 9394.3]
  - - [5056, 704, 1, 256]
    - [83, 8026.89]
  - - [5888, 2944, 1, 3328]
    - [73, 7608.11]
  - - [1856, 4288, 1, 256]
    - [74, 8986.32]
  - - [1024, 5056, 1, 128]
    - [66, 3898.24]
  - - [5056, 5056, 1, 3328]
    - [74, 9536.75]
  - - [1408, 5888, 1, 1280]
    - [75, 9279.09]
  - - [2368, 448, 1, 128]
    - [67, 2474.32]
  - - [1024, 3584, 1, 3328]
    - [77, 9258.48]
  - - [4, 2944, 1, 1280]
    - [29, 611.74]
  - - [1408, 64, 1, 128]
    - [0, 858.21]
  - - [256, 4288, 1, 3328]
    - [80, 7615.98]
  - - [5888, 1408, 1, 1280]
    - [73, 9620.29]
  - - [704, 1856, 1, 3328]
    - [74, 9033.65]
  - - [4, 1408, 1, 128]
    - [87, 24.355]
  - - [1024, 2368, 1, 256]
    - [74, 7526.15]
  - - [1408, 1856, 1, 1280]
    - [77, 8324.09]
  - - [1408, 64, 1, 1280]
    - [48, 4681.14]
  - - [448, 1024, 1, 1280]
    - [74, 7112.43]
  - - [256, 1408, 1, 3328]
    - [80, 5825.41]
  - - [5056, 5056, 1, 1280]
    - [83, 9233.55]
  - - [448, 5056, 1, 256]
    - [75, 7003.17]
  - - [704, 1856, 1, 1280]
    - [74, 8877.28]
  - - [128, 5056, 1, 128]
    - [66, 2301.04]
  - - [2368, 128, 1, 256]
    - [74, 3848.94]
  - - [1856, 1408, 1, 128]
    - [69, 4202.21]
  - - [64, 5056, 1, 256]
    - [75, 3109.52]
  - - [6784, 256, 1, 3328]
    - [74, 6388.43]
  - - [6784, 4288, 1, 3328]
    - [85, 9114.57]
  - - [4288, 448, 1, 256]
    - [78, 5782.95]
  - - [64, 704, 1, 128]
    - [11, 379.419]
  - - [1856, 2368, 1, 3328]
    - [74, 9128.36]
  - - [4288, 2944, 1, 1280]
    - [80, 9182.23]
  - - [704, 5056, 1, 1280]
    - [74, 9071.47]
  - - [2368, 704, 1, 3328]
    - [80, 7731.33]
  - - [256, 5888, 1, 256]
    - [74, 7920.28]
  - - [1856, 4288, 1, 3328]
    - [80, 9329.97]
  - - [256, 2944, 1, 256]
    - [81, 5312.17]
  - - [5888, 1024, 1, 256]
    - [72, 6710.87]
  - - [448, 64, 1, 1280]
    - [47, 2814.43]
  - - [448, 5056, 1, 3328]
    - [74, 8255.43]
  - - [3584, 4, 1, 1280]
    - [23, 640.715]
  - - [2944, 64, 1, 256]
    - [22, 2621.44]
  - - [128, 4, 1, 1280]
    - [94, 86.2316]
  - - [1408, 2944, 1, 256]
    - [74, 8848.89]
  - - [256, 1856, 1, 1280]
    - [74, 7366.45]
  - - [6784, 5056, 1, 3328]
    - [85, 8332.06]
  - - [5056, 5056, 1, 256]
    - [80, 9171.64]
  - - [1408, 6784, 1, 128]
    - [66, 5079.09]
  - - [64, 1024, 1, 1280]
    - [38, 3679.21]
  - - [2944, 4, 1, 256]
    - [29, 369.443]
  - - [704, 5056, 1, 128]
    - [66, 4509.17]
  - - [4, 2368, 1, 1280]
    - [23, 569.744]
  - - [2368, 2944, 1, 1280]
    - [85, 7451.04]
  - - [128, 3584, 1, 1280]
    - [83, 6071.16]
  - - [6784, 6784, 1, 1280]
    - [80, 9535.64]
  - - [1408, 4288, 1, 1280]
    - [83, 8254.99]
  - - [3584, 4288, 1, 1280]
    - [85, 9651.09]
  - - [2368, 704, 1, 1280]
    - [80, 8291.3]
  - - [5056, 4288, 1, 3328]
    - [72, 9406.26]
  - - [3584, 2368, 1, 3328]
    - [80, 9350.22]
  - - [64, 704, 1, 1280]
    - [47, 3384.49]
  - - [4288, 256, 1, 256]
    - [80, 5593.52]
  - - [2944, 128, 1, 128]
    - [2, 2130.5]
  - - [6784, 448, 1, 1280]
    - [83, 8815.75]
  - - [1408, 2944, 1, 128]
    - [66, 4558.24]
  - - [4288, 2944, 1, 256]
    - [85, 7865.33]
  - - [5888, 704, 1, 1280]
    - [74, 9262.89]
  - - [1856, 64, 1, 1280]
    - [48, 4359.05]
  - - [448, 5888, 1, 128]
    - [69, 4000.49]
  - - [5888, 64, 1, 3328]
    - [49, 6603.29]
  - - [2944, 256, 1, 3328]
    - [74, 8423.53]
  - - [1024, 64, 1, 128]
    - [19, 582.542]
  - - [5056, 2368, 1, 1280]
    - [74, 9419.81]
  - - [448, 3584, 1, 1280]
    - [74, 7985.72]
  - - [6784, 5888, 1, 256]
    - [72, 9494.26]
  - - [704, 1024, 1, 128]
    - [66, 2813.25]
  - - [704, 128, 1, 1280]
    - [48, 4477.61]
  - - [5888, 2944, 1, 128]
    - [69, 4745.86]
  - - [4, 3584, 1, 128]
    - [86, 96.379]
  - - [1408, 448, 1, 1280]
    - [74, 6912.7]
  - - [1024, 1408, 1, 256]
    - [82, 5810.75]
  - - [2368, 2368, 1, 3328]
    - [83, 9088.61]
  - - [1856, 6784, 1, 128]
    - [69, 5168.22]
  - - [5056, 704, 1, 3328]
    - [75, 7464.8]
  - - [1408, 1856, 1, 256]
    - [80, 6727.59]
  - - [1408, 704, 1, 3328]
    - [80, 8379.43]
  - - [2368, 5056, 1, 256]
    - [80, 8664.01]
  - - [5888, 1856, 1, 256]
    - [85, 5809.92]
  - - [4288, 64, 1, 3328]
    - [62, 6583.84]
  - - [2368, 4, 1, 1280]
    - [95, 545.151]
  - - [704, 5888, 1, 256]
    - [80, 8813.61]
  - - [4288, 64, 1, 256]
    - [38, 3059.87]
  - - [6784, 64, 1, 256]
    - [80, 3490.86]
  - - [2944, 256, 1, 256]
    - [74, 6970.3]
  - - [2944, 6784, 1, 3328]
    - [74, 9475.69]
  - - [704, 1408, 1, 3328]
    - [74, 8154.08]
  - - [3584, 704, 1, 3328]
    - [74, 8994.97]
  - - [2944, 256, 1, 128]
    - [66, 2824.03]
  - - [6784, 4, 1, 1280]
    - [23, 625.614]
  - - [1024, 64, 1, 1280]
    - [35, 3307.81]
  - - [448, 4288, 1, 256]
    - [80, 6074.38]
  - - [64, 3584, 1, 3328]
    - [28, 6200.16]
  - - [704, 2368, 1, 1280]
    - [74, 8291.3]
  - - [448, 2944, 1, 128]
    - [66, 3221.77]
  - - [1856, 2368, 1, 1280]
    - [85, 6855.14]
  - - [2368, 128, 1, 3328]
    - [36, 6479.51]
  - - [2944, 128, 1, 256]
    - [74, 3828.13]
  - - [448, 1408, 1, 256]
    - [75, 4525.8]
  - - [1856, 4288, 1, 1280]
    - [73, 9160.22]
  - - [64, 5056, 1, 3328]
    - [56, 6819.2]
  - - [4, 704, 1, 256]
    - [40, 123.441]
  - - [1024, 448, 1, 128]
    - [69, 1989.17]
  - - [704, 4, 1, 1280]
    - [43, 381.831]
  - - [704, 256, 1, 128]
    - [66, 1109.07]
  - - [704, 2944, 1, 128]
    - [66, 4088.93]
  - - [1408, 1024, 1, 1280]
    - [80, 8191.98]
  - - [704, 6784, 1, 256]
    - [74, 6717.8]
  - - [6784, 704, 1, 256]
    - [80, 5429.12]
  - - [5056, 1408, 1, 128]
    - [66, 4954.4]
  - - [256, 3584, 1, 3328]
    - [74, 7890.86]
  - - [4, 5888, 1, 3328]
    - [91, 690.947]
  - - [128, 1408, 1, 128]
    - [13, 1393.04]
  - - [3584, 4288, 1, 3328]
    - [76, 8900.77]
  - - [5888, 1856, 1, 1280]
    - [77, 9345.75]
  - - [5056, 1024, 1, 3328]
    - [78, 7834.74]
  - - [5056, 64, 1, 1280]
    - [56, 5890.04]
  - - [1024, 704, 1, 256]
    - [74, 6007.47]
  - - [1024, 4288, 1, 128]
    - [68, 3496.99]
  - - [4288, 64, 1, 1280]
    - [53, 4726.49]
  - - [2368, 3584, 1, 1280]
    - [72, 8128.72]
  - - [2368, 6784, 1, 1280]
    - [72, 9478.62]
  - - [1024, 256, 1, 256]
    - [80, 4092.0]
  - - [1856, 4, 1, 1280]
    - [95, 509.803]
  - - [448, 448, 1, 256]
    - [80, 3001.18]
  - - [2944, 3584, 1, 3328]
    - [81, 9081.81]
  - - [128, 4288, 1, 128]
    - [1, 2323.23]
  - - [64, 448, 1, 256]
    - [44, 1066.87]
  - - [128, 1024, 1, 3328]
    - [57, 6392.26]
  - - [4, 1408, 1, 3328]
    - [40, 616.556]
  - - [6784, 2944, 1, 256]
    - [83, 8547.63]
  - - [64, 1856, 1, 1280]
    - [56, 4409.61]
  - - [64, 1024, 1, 128]
    - [0, 554.802]
  - - [4288, 2368, 1, 3328]
    - [76, 8779.98]
  - - [1856, 2368, 1, 256]
    - [83, 4976.64]
  - - [3584, 256, 1, 128]
    - [68, 2812.27]
  - - [3584, 6784, 1, 3328]
    - [78, 9278.12]
  - - [256, 1024, 1, 256]
    - [74, 4346.43]
  - - [4, 6784, 1, 3328]
    - [93, 681.266]
  - - [1024, 5888, 1, 3328]
    - [74, 9187.51]
  - - [1024, 128, 1, 1280]
    - [26, 3659.95]
  - - [4288, 128, 1, 1280]
    - [80, 6019.07]
  - - [5056, 4288, 1, 1280]
    - [72, 9343.86]
  - - [5888, 64, 1, 256]
    - [74, 4692.07]
  - - [1856, 256, 1, 1280]
    - [80, 4790.28]
  - - [64, 5888, 1, 3328]
    - [48, 6702.1]
  - - [2944, 5888, 1, 128]
    - [69, 5202.55]
  - - [704, 5888, 1, 1280]
    - [74, 9264.19]
  - - [2368, 3584, 1, 128]
    - [66, 5053.61]
  - - [6784, 5888, 1, 3328]
    - [72, 7926.7]
  - - [704, 1024, 1, 1280]
    - [73, 5402.5]
  - - [448, 256, 1, 3328]
    - [56, 6124.55]
  - - [448, 1856, 1, 128]
    - [67, 2885.86]
  - - [128, 1024, 1, 128]
    - [1, 1013.12]
  - - [2944, 4, 1, 128]
    - [86, 77.5374]
  - - [1024, 704, 1, 1280]
    - [74, 7365.48]
  - - [128, 5888, 1, 256]
    - [74, 6990.51]
  - - [1024, 5056, 1, 1280]
    - [79, 9421.9]
  - - [4288, 1024, 1, 256]
    - [81, 6269.93]
  - - [2944, 2368, 1, 128]
    - [66, 4918.08]
  - - [704, 704, 1, 3328]
    - [74, 7963.55]
  - - [704, 1408, 1, 1280]
    - [74, 8347.22]
  - - [5888, 448, 1, 1280]
    - [80, 5216.95]
  - - [3584, 256, 1, 3328]
    - [74, 7802.15]
  - - [704, 5888, 1, 3328]
    - [80, 8381.36]
  - - [704, 1856, 1, 128]
    - [66, 3598.28]
  - - [128, 3584, 1, 3328]
    - [36, 7161.01]
  - - [6784, 2368, 1, 1280]
    - [85, 9464.31]
  - - [4, 4288, 1, 128]
    - [86, 132.58]
  - - [128, 704, 1, 1280]
    - [48, 4463.75]
  - - [3584, 2944, 1, 256]
    - [85, 8201.14]
  - - [1856, 128, 1, 3328]
    - [27, 6575.4]
  - - [4, 64, 1, 1280]
    - [43, 43.5745]
  - - [4, 5056, 1, 3328]
    - [23, 675.215]
  - - [128, 2944, 1, 1280]
    - [27, 5916.89]
  - - [2368, 1024, 1, 3328]
    - [80, 8646.74]
  - - [128, 256, 1, 3328]
    - [61, 4130.75]
  - - [1408, 5056, 1, 3328]
    - [79, 9529.65]
  - - [1856, 1856, 1, 3328]
    - [78, 8114.89]
  - - [3584, 128, 1, 256]
    - [74, 5603.08]
  - - [448, 1408, 1, 3328]
    - [74, 7072.93]
  - - [2368, 2368, 1, 256]
    - [81, 7648.66]
  - - [4288, 4288, 1, 1280]
    - [76, 9244.01]
  - - [64, 448, 1, 1280]
    - [47, 2885.23]
  - - [1408, 4288, 1, 256]
    - [74, 8080.31]
  - - [448, 4, 1, 256]
    - [92, 84.3294]
  - - [5888, 448, 1, 128]
    - [69, 3540.7]
  - - [448, 4, 1, 1280]
    - [43, 322.157]
  - - [704, 6784, 1, 3328]
    - [73, 8613.48]
  - - [5888, 5888, 1, 1280]
    - [80, 9501.95]
  - - [5056, 1024, 1, 1280]
    - [83, 9110.01]
  - - [448, 5888, 1, 3328]
    - [74, 8586.33]
  - - [128, 4, 1, 128]
    - [86, 4.17959]
  - - [1024, 2944, 1, 1280]
    - [82, 7096.43]
  - - [5056, 5888, 1, 1280]
    - [73, 9693.41]
  - - [4288, 5888, 1, 128]
    - [66, 5406.36]
  - - [256, 3584, 1, 256]
    - [74, 6908.27]
  - - [1408, 3584, 1, 128]
    - [66, 4645.59]
  - - [256, 2944, 1, 3328]
    - [77, 6284.3]
  - - [448, 3584, 1, 128]
    - [69, 3675.27]
  - - [5888, 2944, 1, 1280]
    - [79, 9628.8]
  - - [4, 6784, 1, 1280]
    - [23, 688.076]
  - - [2368, 5888, 1, 128]
    - [66, 5273.86]
  - - [64, 2944, 1, 128]
    - [10, 1316.44]
  - - [3584, 5888, 1, 256]
    - [80, 9239.04]
  - - [2368, 704, 1, 128]
    - [69, 3537.55]
  - - [3584, 2944, 1, 1280]
    - [74, 9324.52]
  - - [3584, 2368, 1, 128]
    - [66, 4766.24]
  - - [5056, 704, 1, 128]
    - [66, 4487.85]
  - - [448, 2368, 1, 128]
    - [69, 2876.92]
  - - [5056, 1408, 1, 3328]
    - [85, 9515.87]
  - - [1408, 704, 1, 256]
    - [77, 6836.08]
  - - [6784, 1024, 1, 3328]
    - [72, 9309.55]
  - - [6784, 2944, 1, 3328]
    - [73, 9536.48]
  - - [2944, 5056, 1, 3328]
    - [74, 9526.15]
  - - [1856, 1856, 1, 256]
    - [74, 5239.14]
  - - [1024, 5888, 1, 128]
    - [66, 4006.18]
  - - [2048, 7133, 1, 2048]
    - [72, 9827.97]
  - - [256, 4, 1, 128]
    - [87, 4.28908]
  - - [4288, 5888, 1, 1280]
    - [82, 9202.73]
  - - [4288, 4288, 1, 256]
    - [77, 5521.08]
  - - [448, 2944, 1, 3328]
    - [80, 7724.43]
  - - [4288, 1856, 1, 1280]
    - [80, 8826.24]
  - - [1856, 2944, 1, 3328]
    - [74, 9194.8]
  - - [256, 6784, 1, 3328]
    - [74, 8740.23]
  - - [64, 5888, 1, 256]
    - [74, 4766.25]
  - - [256, 5056, 1, 128]
    - [66, 2937.5]
  - - [5056, 1024, 1, 256]
    - [85, 5467.81]
  - - [704, 64, 1, 3328]
    - [62, 4818.33]
  - - [5056, 1856, 1, 3328]
    - [79, 8861.59]
  - - [4, 2944, 1, 3328]
    - [29, 662.002]
  - - [4, 5056, 1, 256]
    - [89, 494.021]
  - - [1856, 1408, 1, 256]
    - [74, 8674.68]
  - - [3584, 4, 1, 128]
    - [86, 108.196]
  - - [448, 448, 1, 3328]
    - [48, 6457.3]
  - - [6784, 128, 1, 3328]
    - [41, 7256.61]
  - - [4288, 1408, 1, 128]
    - [69, 4791.66]
  - - [4288, 5056, 1, 256]
    - [74, 8560.74]
  - - [1408, 128, 1, 1280]
    - [56, 5085.69]
  - - [5056, 256, 1, 3328]
    - [77, 7284.13]
  - - [704, 704, 1, 256]
    - [74, 6171.09]
  - - [1024, 5888, 1, 1280]
    - [79, 8852.79]
  - - [6784, 2368, 1, 128]
    - [67, 4729.2]
  - - [4, 5056, 1, 1280]
    - [40, 669.946]
  - - [64, 128, 1, 256]
    - [42, 369.217]
  - - [128, 1856, 1, 1280]
    - [36, 5549.03]
  - - [5056, 3584, 1, 256]
    - [80, 7115.74]
  - - [1856, 1024, 1, 1280]
    - [72, 8196.4]
  - - [6784, 4288, 1, 1280]
    - [73, 9509.56]
  - - [1856, 1856, 1, 1280]
    - [75, 5791.89]
  - - [6784, 2944, 1, 128]
    - [66, 5317.02]
  - - [1408, 5056, 1, 1280]
    - [75, 8980.63]
  - - [4, 2368, 1, 3328]
    - [40, 592.534]
  - - [5888, 1856, 1, 128]
    - [65, 4600.1]
  - - [448, 704, 1, 1280]
    - [74, 2286.48]
  - - [2368, 1024, 1, 128]
    - [69, 3911.02]
  - - [1024, 448, 1, 3328]
    - [74, 7295.14]
  - - [1856, 704, 1, 1280]
    - [74, 8881.02]
  - - [5056, 3584, 1, 128]
    - [66, 4911.58]
  - - [5888, 5888, 1, 3328]
    - [82, 9243.8]
  - - [6784, 1024, 1, 256]
    - [85, 5475.31]
  - - [2944, 2368, 1, 256]
    - [80, 5670.67]
  - - [256, 448, 1, 256]
    - [31, 2293.76]
  - - [5056, 5888, 1, 3328]
    - [75, 7847.97]
  - - [1856, 1024, 1, 256]
    - [80, 7517.6]
  - - [448, 1408, 1, 1280]
    - [74, 6917.44]
  - - [3584, 448, 1, 1280]
    - [80, 7980.76]
  - - [1024, 1024, 1, 1280]
    - [77, 8384.42]
  - - [448, 5888, 1, 256]
    - [74, 7365.65]
  - - [704, 64, 1, 128]
    - [19, 358.655]
  - - [1408, 6784, 1, 3328]
    - [80, 9094.09]
  - - [448, 1024, 1, 128]
    - [69, 1772.95]
  - - [4288, 704, 1, 128]
    - [66, 4355.28]
  - - [128, 1856, 1, 128]
    - [5, 1610.63]
  - - [448, 2368, 1, 3328]
    - [80, 7366.37]
  - - [5056, 64, 1, 128]
    - [5, 2157.23]
  - - [5056, 2944, 1, 256]
    - [74, 9123.06]
  - - [6784, 5888, 1, 128]
    - [65, 5285.8]
  - - [704, 1024, 1, 256]
    - [80, 6667.25]
  - - [1024, 4, 1, 256]
    - [29, 187.246]
  - - [2368, 1856, 1, 256]
    - [80, 6777.84]
  - - [128, 6784, 1, 1280]
    - [77, 7052.61]
  - - [1408, 3584, 1, 3328]
    - [81, 9037.95]
  - - [2368, 6784, 1, 256]
    - [74, 9181.35]
  - - [5056, 1408, 1, 1280]
    - [79, 9421.9]
  - - [256, 256, 1, 128]
    - [11, 543.304]
  - - [5056, 4288, 1, 128]
    - [69, 5339.92]
  - - [1408, 1856, 1, 128]
    - [66, 4270.89]
  - - [1408, 5888, 1, 3328]
    - [78, 9034.79]
  - - [1856, 256, 1, 256]
    - [80, 5847.83]
  - - [6784, 6784, 1, 256]
    - [73, 9624.38]
  - - [64, 256, 1, 128]
    - [12, 146.449]
  - - [4288, 2368, 1, 128]
    - [65, 3896.94]
  - - [1856, 4288, 1, 128]
    - [66, 4337.07]
  - - [256, 4288, 1, 1280]
    - [74, 7499.42]
  - - [2368, 2944, 1, 256]
    - [79, 7703.18]
  - - [4, 1856, 1, 256]
    - [92, 263.964]
  - - [3584, 1856, 1, 1280]
    - [74, 9224.33]
  - - [6784, 6784, 1, 128]
    - [66, 5476.03]
  - - [256, 1856, 1, 128]
    - [69, 1858.72]
  - - [704, 64, 1, 1280]
    - [47, 3368.67]
  - - [5888, 5056, 1, 256]
    - [80, 5859.81]
  - - [3584, 448, 1, 256]
    - [80, 7298.33]
  - - [448, 4288, 1, 128]
    - [66, 3813.45]
  - - [2944, 4288, 1, 3328]
    - [75, 9149.63]
  - - [256, 6784, 1, 256]
    - [74, 7984.85]
  - - [1408, 4288, 1, 128]
    - [69, 4728.34]
  - - [2944, 704, 1, 3328]
    - [80, 7149.76]
  - - [128, 448, 1, 256]
    - [46, 1699.08]
  - - [512, 32, 1, 512]
    - [46, 1127.5]
  - - [3584, 3584, 1, 256]
    - [75, 8558.01]
  - - [448, 1408, 1, 128]
    - [66, 2504.35]
  - - [128, 256, 1, 1280]
    - [47, 3216.49]
  - - [3584, 5056, 1, 256]
    - [72, 5674.35]
  - - [6784, 128, 1, 256]
    - [74, 6216.39]
  - - [4288, 4, 1, 256]
    - [90, 435.606]
  - - [64, 1408, 1, 3328]
    - [48, 6185.91]
  - - [704, 448, 1, 256]
    - [80, 4004.98]
  - - [2944, 2368, 1, 1280]
    - [81, 8542.7]
  - - [448, 64, 1, 3328]
    - [61, 3835.23]
  - - [1408, 3584, 1, 256]
    - [74, 8714.53]
  - - [3584, 4, 1, 3328]
    - [29, 689.454]
  - - [6784, 3584, 1, 256]
    - [79, 9271.24]
  - - [256, 128, 1, 128]
    - [12, 283.399]
  - - [704, 1408, 1, 128]
    - [66, 3210.47]
  - - [4, 2368, 1, 256]
    - [92, 360.838]
  - - [2944, 448, 1, 128]
    - [66, 3344.31]
  - - [128, 1408, 1, 256]
    - [74, 3186.28]
  - - [4, 2944, 1, 256]
    - [90, 384.522]
  - - [64, 128, 1, 3328]
    - [43, 2103.62]
  - - [5056, 2368, 1, 128]
    - [66, 5219.66]
  - - [2944, 2944, 1, 3328]
    - [83, 9174.59]
  - - [5056, 6784, 1, 256]
    - [85, 8992.26]
  - - [1856, 3584, 1, 128]
    - [66, 4957.17]
  - - [128, 2944, 1, 128]
    - [4, 2241.38]
  - - [1024, 704, 1, 3328]
    - [84, 6545.01]
  - - [6784, 448, 1, 256]
    - [80, 5379.15]
  - - [3584, 6784, 1, 128]
    - [66, 5101.91]
  - - [128, 4288, 1, 256]
    - [74, 5211.76]
  - - [704, 448, 1, 3328]
    - [75, 4504.05]
  - - [1024, 1024, 1, 3328]
    - [486, 8028.83]
  - - [128, 128, 1, 3328]
    - [60, 3184.93]
  - - [5056, 1856, 1, 256]
    - [74, 9138.33]
  - - [256, 128, 1, 256]
    - [46, 1205.26]
  - - [1024, 1856, 1, 256]
    - [85, 6374.99]
  - - [4288, 64, 1, 128]
    - [2, 1695.33]
  - - [256, 448, 1, 3328]
    - [49, 5659.57]
  - - [1408, 6784, 1, 1280]
    - [74, 9349.1]
  - - [3584, 3584, 1, 1280]
    - [79, 9302.09]
  - - [64, 2368, 1, 1280]
    - [48, 4432.97]
  - - [448, 2368, 1, 1280]
    - [74, 7250.67]
  - - [5888, 5888, 1, 128]
    - [66, 4615.93]
  - - [64, 6784, 1, 3328]
    - [80, 6987.13]
  - - [2944, 256, 1, 1280]
    - [83, 6127.35]
  - - [5056, 5888, 1, 128]
    - [65, 5106.29]
  - - [256, 2368, 1, 128]
    - [66, 2141.13]
  - - [5056, 2368, 1, 3328]
    - [77, 9041.65]
  - - [2944, 4288, 1, 256]
    - [85, 8691.12]
  - - [1408, 3584, 1, 1280]
    - [74, 9069.9]
  - - [2368, 64, 1, 256]
    - [46, 2412.77]
  - - [64, 448, 1, 3328]
    - [61, 3739.04]
  - - [256, 256, 1, 3328]
    - [48, 5304.08]
  - - [5888, 4, 1, 128]
    - [87, 105.555]
  - - [1856, 704, 1, 256]
    - [74, 8025.33]
  - - [4, 4288, 1, 1280]
    - [21, 578.97]
  - - [1408, 448, 1, 3328]
    - [82, 5714.41]
  - - [1024, 4, 1, 3328]
    - [40, 608.549]
  - - [2368, 256, 1, 256]
    - [80, 5172.98]
  - - [2368, 6784, 1, 3328]
    - [80, 9456.51]
  - - [1856, 1408, 1, 1280]
    - [85, 7805.09]
  - - [1856, 448, 1, 1280]
    - [72, 6184.94]
  - - [6784, 704, 1, 128]
    - [66, 4597.77]
  - - [4, 4, 1, 256]
    - [43, 0.691892]
  - - [128, 5888, 1, 128]
    - [4, 2691.66]
  - - [1408, 5888, 1, 256]
    - [79, 7164.17]
  - - [704, 2944, 1, 1280]
    - [81, 8139.71]
  - - [1856, 2368, 1, 128]
    - [69, 4623.28]
  - - [4096, 7133, 1, 4096]
    - [73, 9939.97]
  - - [256, 64, 1, 256]
    - [37, 689.853]
  - - [1024, 1024, 1, 256]
    - [80, 7216.01]
  - - [704, 1856, 1, 256]
    - [80, 6364.07]
  - - [128, 4288, 1, 3328]
    - [36, 7200.49]
  - - [3584, 704, 1, 1280]
    - [83, 7971.98]
  - - [256, 128, 1, 1280]
    - [34, 2702.52]
  - - [2368, 4, 1, 256]
    - [29, 325.918]
  - - [256, 2368, 1, 1280]
    - [74, 6638.83]
  - - [2944, 6784, 1, 128]
    - [65, 5233.43]
  - - [3584, 448, 1, 3328]
    - [74, 8094.3]
  - - [1408, 4, 1, 256]
    - [92, 243.546]
  - - [704, 2368, 1, 3328]
    - [74, 8403.01]
  - - [2944, 448, 1, 256]
    - [74, 7022.49]
  - - [1856, 448, 1, 128]
    - [69, 2842.69]
  - - [2368, 128, 1, 1280]
    - [56, 5685.42]
  - - [256, 5888, 1, 128]
    - [71, 2178.61]
  - - [64, 6784, 1, 256]
    - [74, 5385.13]
  - - [64, 5056, 1, 1280]
    - [48, 5603.19]
  - - [4, 6784, 1, 128]
    - [86, 180.156]
  - - [2944, 2944, 1, 1280]
    - [83, 9129.29]
  - - [5888, 2368, 1, 256]
    - [85, 6961.59]
  - - [4, 3584, 1, 1280]
    - [29, 646.13]
  - - [1408, 128, 1, 128]
    - [15, 1172.19]
  - - [6784, 704, 1, 3328]
    - [80, 9084.52]
  - - [128, 64, 1, 1280]
    - [59, 1260.31]
  - - [2368, 256, 1, 1280]
    - [80, 6643.38]
  - - [4, 448, 1, 3328]
    - [43, 433.414]
  - - [5888, 4288, 1, 128]
    - [67, 4753.07]
  - - [4, 5888, 1, 256]
    - [29, 471.04]
  - - [1408, 2944, 1, 3328]
    - [83, 9207.0]
  - - [3584, 704, 1, 128]
    - [69, 3762.36]
  - - [64, 1024, 1, 256]
    - [47, 1807.89]
  - - [5056, 5056, 1, 128]
    - [70, 4830.06]
  - - [2368, 448, 1, 1280]
    - [74, 7263.06]
  - - [128, 3584, 1, 256]
    - [77, 4369.07]
  - - [704, 448, 1, 1280]
    - [75, 4205.23]
  - - [448, 5056, 1, 128]
    - [66, 3855.47]
  - - [256, 4, 1, 1280]
    - [97, 157.538]
  - - [128, 5056, 1, 256]
    - [80, 6108.96]
  - - [1408, 5056, 1, 128]
    - [69, 4836.58]
  - - [2944, 3584, 1, 128]
    - [69, 4532.09]
  - - [3584, 2368, 1, 256]
    - [74, 8951.24]
  - - [5888, 5056, 1, 1280]
    - [85, 9276.39]
  - - [2368, 5056, 1, 128]
    - [69, 5167.56]
  - - [64, 704, 1, 256]
    - [29, 1501.87]
  - - [4288, 256, 1, 1280]
    - [74, 7496.2]
  - - [3584, 3584, 1, 3328]
    - [75, 9301.67]
  - - [1024, 256, 1, 128]
    - [66, 1508.74]
  - - [4, 704, 1, 128]
    - [87, 12.0469]
  - - [5888, 6784, 1, 256]
    - [73, 9370.37]
  - - [4288, 2944, 1, 3328]
    - [77, 9148.99]
  - - [2944, 64, 1, 128]
    - [13, 1456.36]
  - - [1856, 64, 1, 256]
    - [39, 2209.93]
  - - [4288, 128, 1, 3328]
    - [33, 6471.85]
  - - [4288, 704, 1, 1280]
    - [80, 8934.51]
  - - [256, 5056, 1, 1280]
    - [74, 8439.03]
  - - [1408, 256, 1, 128]
    - [69, 1769.07]
  - - [2944, 5888, 1, 3328]
    - [74, 9447.94]
  - - [6784, 5888, 1, 1280]
    - [85, 9372.15]
  - - [704, 128, 1, 256]
    - [31, 2059.7]
  - - [5888, 4288, 1, 1280]
    - [77, 9244.22]
  - - [448, 256, 1, 1280]
    - [56, 4741.62]
  - - [5888, 3584, 1, 128]
    - [65, 4979.96]
  - - [1856, 1856, 1, 128]
    - [69, 4363.88]
  - - [5056, 4, 1, 1280]
    - [89, 629.541]
  - - [256, 1408, 1, 1280]
    - [80, 5588.34]
  - - [512, 16, 1, 512]
    - [40, 689.853]
  - - [704, 3584, 1, 128]
    - [69, 4069.57]
  - - [5888, 448, 1, 3328]
    - [85, 7925.84]
  - - [2368, 4288, 1, 1280]
    - [84, 8492.6]
  - - [4288, 2944, 1, 128]
    - [66, 5238.11]
  - - [1024, 6784, 1, 3328]
    - [80, 8578.08]
  - - [128, 2368, 1, 256]
    - [80, 3788.8]
  - - [6784, 64, 1, 3328]
    - [74, 7003.36]
  - - [5056, 2944, 1, 3328]
    - [77, 8575.35]
  - - [448, 128, 1, 256]
    - [29, 1714.96]
  - - [2944, 3584, 1, 256]
    - [74, 8994.16]
  - - [1408, 1408, 1, 3328]
    - [72, 8757.6]
  - - [1856, 128, 1, 1280]
    - [74, 5598.07]
  - - [3584, 3584, 1, 128]
    - [65, 4787.34]
  - - [64, 3584, 1, 256]
    - [80, 3545.91]
  - - [1408, 4, 1, 3328]
    - [24, 640.14]
  - - [128, 2944, 1, 3328]
    - [48, 7204.14]
  - - [3584, 704, 1, 256]
    - [74, 6239.59]
  - - [2944, 448, 1, 3328]
    - [80, 7726.61]
  - - [3584, 1408, 1, 3328]
    - [72, 9358.68]
  - - [704, 3584, 1, 1280]
    - [80, 8005.18]
  - - [2944, 6784, 1, 1280]
    - [72, 9487.63]
  - - [1856, 6784, 1, 256]
    - [74, 5684.46]
  - - [4288, 448, 1, 3328]
    - [80, 8410.28]
  - - [6784, 4288, 1, 128]
    - [70, 4785.48]
  - - [6784, 704, 1, 1280]
    - [74, 5578.95]
  - - [256, 4288, 1, 256]
    - [74, 6781.33]
  - - [3584, 64, 1, 128]
    - [13, 1473.9]
  - - [5888, 1024, 1, 3328]
    - [72, 8639.39]
  - - [448, 64, 1, 128]
    - [4, 259.182]
  - - [704, 6784, 1, 1280]
    - [80, 9027.15]
  - - [5888, 128, 1, 256]
    - [80, 6812.78]
  - - [2368, 448, 1, 3328]
    - [80, 7356.53]
  - - [1856, 5056, 1, 3328]
    - [79, 8871.46]
  - - [4, 6784, 1, 256]
    - [88, 469.379]
  - - [1024, 3584, 1, 128]
    - [66, 3427.92]
  - - [1024, 1408, 1, 128]
    - [69, 2934.95]
  - - [2368, 2944, 1, 128]
    - [69, 4887.92]
  - - [5056, 64, 1, 256]
    - [38, 3186.06]
  - - [4, 448, 1, 1280]
    - [43, 273.067]
  - - [5056, 2944, 1, 128]
    - [70, 4752.69]
  - - [5888, 5056, 1, 3328]
    - [84, 9124.67]
  - - [1024, 704, 1, 128]
    - [69, 2302.26]
  - - [1408, 2368, 1, 128]
    - [69, 3826.85]
  - - [5888, 2368, 1, 128]
    - [66, 4912.67]
  - - [128, 5056, 1, 3328]
    - [56, 7583.7]
  - - [3584, 6784, 1, 1280]
    - [83, 9313.4]
  - - [3072, 7435, 1, 1024]
    - [77, 9321.97]
  - - [1856, 5888, 1, 256]
    - [74, 5778.24]
  - - [256, 256, 1, 256]
    - [26, 1576.81]
  - - [256, 64, 1, 128]
    - [12, 173.605]
  - - [4288, 4288, 1, 3328]
    - [79, 8416.17]
  - - [4288, 1408, 1, 1280]
    - [85, 9301.87]
  - - [3584, 5056, 1, 128]
    - [71, 4344.84]
  - - [4, 1024, 1, 3328]
    - [40, 615.139]
  - - [4288, 2368, 1, 256]
    - [74, 9142.57]
  - - [2944, 5056, 1, 1280]
    - [74, 9399.59]
  - - [448, 6784, 1, 256]
    - [73, 5710.83]
  - - [64, 1024, 1, 3328]
    - [56, 4975.0]
  - - [6784, 2368, 1, 3328]
    - [83, 9207.53]
  - - [256, 1024, 1, 1280]
    - [80, 5983.32]
  - - [704, 4, 1, 128]
    - [86, 15.0187]
  - - [256, 4, 1, 256]
    - [43, 52.8516]
  - - [4288, 128, 1, 256]
    - [74, 5242.88]
  - - [4288, 1856, 1, 3328]
    - [85, 9353.96]
  - - [3584, 448, 1, 128]
    - [66, 3353.8]
  - - [256, 4, 1, 3328]
    - [97, 313.224]
  - - [4, 1408, 1, 1280]
    - [40, 509.107]
  - - [3584, 64, 1, 1280]
    - [28, 5198.32]
  - - [1408, 448, 1, 128]
    - [66, 2628.27]
  - - [3584, 1024, 1, 1280]
    - [80, 8534.91]
  - - [1856, 5056, 1, 256]
    - [72, 8184.39]
  - - [4, 3584, 1, 256]
    - [90, 395.476]
  - - [1024, 4288, 1, 256]
    - [75, 5966.42]
  - - [5888, 3584, 1, 3328]
    - [78, 9189.33]
  - - [4, 256, 1, 256]
    - [94, 41.4785]
  - - [5056, 3584, 1, 3328]
    - [79, 9431.82]
  - - [128, 5888, 1, 1280]
    - [74, 8192.0]
  - - [704, 448, 1, 128]
    - [66, 1510.86]
  - - [2368, 1408, 1, 1280]
    - [74, 8415.55]
  - - [5056, 2944, 1, 1280]
    - [85, 9294.67]
  - - [3584, 256, 1, 256]
    - [74, 6749.45]
  - - [128, 1856, 1, 3328]
    - [27, 6796.99]
  - - [1024, 6784, 1, 256]
    - [80, 8782.99]
  - - [4, 128, 1, 256]
    - [40, 27.3067]
  - - [64, 64, 1, 1280]
    - [59, 712.348]
  - - [6784, 4, 1, 128]
    - [87, 121.96]
  - - [2944, 1408, 1, 128]
    - [69, 4430.36]
  - - [448, 128, 1, 3328]
    - [56, 5097.24]
  - - [64, 2944, 1, 3328]
    - [56, 6362.1]
  - - [64, 4288, 1, 3328]
    - [56, 6564.91]
  - - [5056, 6784, 1, 3328]
    - [80, 8121.08]
  - - [128, 2944, 1, 256]
    - [74, 4692.07]
  - - [128, 6784, 1, 128]
    - [3, 2687.36]
  - - [3584, 4288, 1, 256]
    - [80, 9193.89]
  - - [448, 1856, 1, 256]
    - [80, 6231.29]
  - - [1856, 6784, 1, 3328]
    - [85, 9191.38]
  - - [3584, 128, 1, 3328]
    - [74, 7368.37]
  - - [64, 1856, 1, 256]
    - [25, 2184.53]
  - - [1024, 448, 1, 1280]
    - [80, 6977.22]
  - - [5888, 4288, 1, 256]
    - [80, 5780.4]
  - - [4, 448, 1, 128]
    - [87, 8.96]
  - - [5056, 1408, 1, 256]
    - [74, 5601.25]
  - - [64, 256, 1, 1280]
    - [40, 1927.53]
  - - [3584, 1024, 1, 256]
    - [85, 7542.74]
  - - [256, 704, 1, 256]
    - [74, 2957.52]
  - - [5888, 5888, 1, 256]
    - [85, 7344.04]
  - - [4288, 1024, 1, 1280]
    - [80, 8925.74]
  - - [5888, 128, 1, 3328]
    - [74, 8409.97]
  - - [448, 6784, 1, 3328]
    - [74, 8862.46]
  - - [2944, 1408, 1, 1280]
    - [85, 7478.83]
  - - [1024, 32, 1, 512]
    - [29, 1777.25]
  - - [2944, 1856, 1, 3328]
    - [74, 9153.33]
  - - [2368, 64, 1, 128]
    - [13, 1102.2]
  - - [2944, 2944, 1, 128]
    - [65, 4591.85]
  - - [4, 128, 1, 3328]
    - [95, 118.99]
  - - [3584, 5888, 1, 1280]
    - [74, 9222.39]
  - - [64, 4, 1, 128]
    - [86, 0.93516]
  - - [6784, 1856, 1, 1280]
    - [74, 9135.97]
  - - [2944, 5056, 1, 256]
    - [80, 8860.03]
  - - [2944, 5888, 1, 1280]
    - [73, 9643.53]
  - - [5888, 256, 1, 3328]
    - [80, 8799.43]
  - - [1856, 5888, 1, 3328]
    - [80, 9457.43]
  - - [3584, 1408, 1, 256]
    - [80, 8672.43]
  - - [704, 3584, 1, 3328]
    - [80, 8525.2]
  - - [5056, 448, 1, 1280]
    - [80, 8843.67]
  - - [3584, 1856, 1, 3328]
    - [72, 8881.43]
  - - [64, 1408, 1, 128]
    - [1, 747.042]
  - - [1408, 704, 1, 1280]
    - [74, 8342.83]
  - - [2944, 1024, 1, 256]
    - [85, 8079.48]
  - - [1024, 2368, 1, 128]
    - [69, 3347.48]
  - - [2368, 4288, 1, 3328]
    - [80, 9467.57]
  - - [4, 1408, 1, 256]
    - [92, 257.463]
  - - [1024, 1408, 1, 1280]
    - [80, 8241.74]
  - - [64, 64, 1, 256]
    - [40, 189.959]
  - - [704, 256, 1, 3328]
    - [74, 4519.18]
  - - [6784, 5056, 1, 256]
    - [73, 9133.68]
  - - [4, 4288, 1, 3328]
    - [24, 669.975]
  - - [448, 6784, 1, 128]
    - [66, 4481.82]
  - - [4, 704, 1, 3328]
    - [96, 522.971]
  - - [448, 2944, 1, 256]
    - [74, 7022.49]
  - - [2944, 6784, 1, 256]
    - [80, 9199.74]
  - - [2368, 2368, 1, 1280]
    - [85, 8646.74]
  - - [4, 4, 1, 1280]
    - [43, 3.01176]
  - - [1856, 3584, 1, 1280]
    - [72, 8805.35]
  - - [64, 2944, 1, 256]
    - [46, 2565.66]
  - - [3584, 1408, 1, 1280]
    - [85, 9273.02]
  - - [448, 256, 1, 128]
    - [1, 941.03]
  - - [4288, 448, 1, 128]
    - [67, 3215.1]
  - - [5056, 256, 1, 1280]
    - [80, 8790.03]
  - - [1856, 1408, 1, 3328]
    - [74, 9310.63]
  - - [128, 128, 1, 128]
    - [9, 155.115]
  - - [1024, 4288, 1, 3328]
    - [77, 8528.02]
  - - [448, 2368, 1, 256]
    - [81, 5097.24]
  - - [1024, 4, 1, 128]
    - [87, 10.2721]
  - - [5056, 448, 1, 256]
    - [80, 8236.68]
  - - [2944, 2368, 1, 3328]
    - [73, 9331.06]
  - - [704, 128, 1, 3328]
    - [48, 5969.2]
  - - [64, 64, 1, 3328]
    - [64, 1494.68]
  - - [1024, 1856, 1, 1280]
    - [79, 6356.33]
  - - [6784, 1856, 1, 256]
    - [80, 9068.53]
  - - [128, 2368, 1, 3328]
    - [56, 6714.12]
  - - [1024, 5888, 1, 256]
    - [80, 5501.5]
  - - [5056, 128, 1, 1280]
    - [36, 6455.54]
  - - [5056, 64, 1, 3328]
    - [41, 6703.71]
  - - [128, 704, 1, 128]
    - [2, 696.518]
  - - [1408, 2368, 1, 256]
    - [74, 8667.15]
  - - [1408, 1408, 1, 256]
    - [85, 7615.71]
  - - [4, 64, 1, 128]
    - [87, 0.98463]
  - - [64, 128, 1, 1280]
    - [59, 1379.71]
  - - [2368, 2368, 1, 128]
    - [69, 4582.16]
  - - [64, 5888, 1, 128]
    - [2, 2086.27]
  - - [5888, 4, 1, 3328]
    - [23, 667.414]
  - - [6784, 1408, 1, 128]
    - [70, 4516.24]
  - - [4288, 5888, 1, 256]
    - [85, 8497.33]
  - - [1408, 5056, 1, 256]
    - [74, 8867.36]
  - - [5056, 128, 1, 3328]
    - [56, 7678.88]
  - - [128, 128, 1, 1280]
    - [44, 2016.49]
  - - [448, 704, 1, 256]
    - [75, 3030.79]
  - - [4288, 3584, 1, 128]
    - [66, 5246.23]
  - - [2944, 128, 1, 3328]
    - [41, 6795.06]
  - - [128, 5056, 1, 1280]
    - [27, 6192.99]
  - - [3584, 5056, 1, 1280]
    - [79, 9499.07]
  - - [256, 448, 1, 1280]
    - [35, 4267.46]
  - - [704, 704, 1, 128]
    - [69, 2259.22]
  - - [5056, 4, 1, 128]
    - [87, 12.4313]
  - - [704, 256, 1, 1280]
    - [74, 4355.87]
  - - [64, 2368, 1, 3328]
    - [48, 6310.87]
  - - [1856, 1024, 1, 128]
    - [65, 4065.33]
  - - [1856, 64, 1, 128]
    - [4, 936.229]
  - - [64, 6784, 1, 1280]
    - [27, 5731.7]
  - - [704, 4288, 1, 256]
    - [80, 5218.8]
  - - [5888, 2368, 1, 1280]
    - [74, 9378.8]
  - - [128, 256, 1, 256]
    - [44, 1219.27]
  - - [256, 64, 1, 1280]
    - [46, 1820.44]
  - - [2368, 5888, 1, 1280]
    - [85, 9143.54]
  - - [5888, 256, 1, 1280]
    - [74, 8678.37]
  - - [4, 5888, 1, 1280]
    - [21, 668.142]
  - - [704, 128, 1, 128]
    - [9, 649.456]
  - - [1024, 4, 1, 1280]
    - [40, 478.365]
  - - [2368, 1856, 1, 3328]
    - [72, 8153.77]
  - - [2368, 128, 1, 128]
    - [7, 1858.11]
  - - [2944, 704, 1, 256]
    - [74, 8437.97]
  - - [5056, 128, 1, 128]
    - [3, 2689.53]
  - - [256, 704, 1, 3328]
    - [74, 4541.08]
  - - [704, 3584, 1, 256]
    - [75, 7770.97]
  - - [704, 2944, 1, 3328]
    - [80, 9166.38]
  - - [6784, 1024, 1, 128]
    - [65, 4362.21]
  - - [256, 448, 1, 128]
    - [12, 899.514]
  - - [448, 1024, 1, 3328]
    - [74, 7385.46]
  - - [2944, 1024, 1, 3328]
    - [77, 8779.71]
  - - [2944, 5056, 1, 128]
    - [69, 5103.01]
  - - [1408, 6784, 1, 256]
    - [80, 8346.79]
  - - [6784, 1408, 1, 3328]
    - [76, 8878.3]
  - - [4288, 6784, 1, 128]
    - [65, 5432.89]
  - - [704, 64, 1, 256]
    - [54, 1441.79]
  - - [5888, 4, 1, 1280]
    - [91, 636.541]
  - - [256, 2368, 1, 3328]
    - [74, 6804.7]
  - - [6784, 2944, 1, 1280]
    - [73, 9472.16]
  - - [4288, 1856, 1, 128]
    - [69, 4886.28]
  - - [1856, 2944, 1, 128]
    - [66, 4642.86]
  - - [6784, 448, 1, 128]
    - [66, 4369.07]
  - - [64, 3584, 1, 128]
    - [13, 1645.75]
  - - [448, 5056, 1, 1280]
    - [74, 8553.54]
  - - [2368, 1856, 1, 128]
    - [66, 4741.75]
  - - [128, 448, 1, 1280]
    - [56, 3744.91]
  - - [4288, 704, 1, 256]
    - [74, 8444.06]
  - - [256, 3584, 1, 128]
    - [66, 2454.86]
  - - [5888, 704, 1, 256]
    - [74, 8819.47]
  - - [3584, 1024, 1, 128]
    - [69, 4094.86]
  - - [256, 5888, 1, 3328]
    - [83, 8538.23]
  - - [1408, 4288, 1, 3328]
    - [85, 9212.47]
  - - [6784, 4288, 1, 256]
    - [73, 9163.02]
  - - [4288, 256, 1, 128]
    - [66, 3081.34]
  - - [5888, 256, 1, 256]
    - [74, 7680.65]
  - - [6784, 1024, 1, 1280]
    - [85, 9248.53]
  - - [5888, 1024, 1, 128]
    - [69, 4061.84]
  - - [1024, 128, 1, 256]
    - [80, 2317.29]
  - - [128, 64, 1, 3328]
    - [63, 2116.69]
  - - [448, 64, 1, 256]
    - [46, 1079.42]
  - - [2368, 256, 1, 128]
    - [67, 2229.73]
  - - [6784, 3584, 1, 1280]
    - [80, 9096.5]
  - - [1024, 6784, 1, 1280]
    - [78, 9112.8]
  - - [2944, 64, 1, 1280]
    - [36, 4982.9]
  - - [1408, 2944, 1, 1280]
    - [75, 9131.53]
  - - [256, 1856, 1, 256]
    - [83, 4432.76]
  - - [1408, 2368, 1, 3328]
    - [83, 8449.08]
  - - [2944, 4, 1, 3328]
    - [29, 673.84]
  - - [128, 1408, 1, 3328]
    - [48, 6582.37]
  - - [2944, 1856, 1, 128]
    - [66, 4827.44]
  - - [256, 2944, 1, 128]
    - [69, 2416.56]
  - - [256, 6784, 1, 128]
    - [69, 3118.66]
  - - [2368, 4, 1, 128]
    - [87, 22.6197]
  - - [1408, 256, 1, 3328]
    - [74, 3733.72]
  - - [1856, 4, 1, 128]
    - [86, 7.10009]
  - - [1024, 16, 1, 512]
    - [42, 1165.08]
  - - [5056, 6784, 1, 128]
    - [70, 4949.03]
  - - [4288, 5056, 1, 128]
    - [69, 4966.8]
  - - [1856, 5888, 1, 128]
    - [65, 4351.66]
  - - [2944, 5888, 1, 256]
    - [85, 8460.89]
  - - [3584, 1856, 1, 256]
    - [80, 8876.6]
  - - [4288, 3584, 1, 1280]
    - [73, 9603.6]
  - - [2368, 448, 1, 256]
    - [74, 6604.6]
  - - [4288, 256, 1, 3328]
    - [74, 7619.79]
  - - [1856, 704, 1, 128]
    - [66, 3629.51]
  - - [1408, 64, 1, 256]
    - [30, 2168.11]
  - - [64, 1856, 1, 128]
    - [6, 979.662]
  - - [4, 256, 1, 128]
    - [87, 5.13595]
  - - [704, 4288, 1, 3328]
    - [80, 9014.42]
  - - [704, 5888, 1, 128]
    - [67, 4221.67]
  - - [6784, 3584, 1, 128]
    - [65, 5360.63]
  - - [1024, 64, 1, 256]
    - [25, 1588.75]
  - - [64, 2368, 1, 256]
    - [80, 2552.45]
  - - [4288, 5056, 1, 3328]
    - [79, 8193.28]
  - - [4, 1856, 1, 1280]
    - [29, 499.092]
  - - [4288, 128, 1, 128]
    - [66, 2373.47]
  - - [1408, 1408, 1, 128]
    - [69, 3753.78]
  - - [1024, 128, 1, 3328]
    - [51, 5656.22]
  - - [1856, 128, 1, 128]
    - [2, 1617.48]
  - - [5056, 2368, 1, 256]
    - [85, 5553.31]
  - - [4288, 704, 1, 3328]
    - [73, 6961.96]
  - - [448, 3584, 1, 256]
    - [83, 5981.4]
  - - [64, 128, 1, 128]
    - [20, 74.8983]
  - - [2368, 64, 1, 1280]
    - [56, 5041.23]
  - - [2368, 1024, 1, 1280]
    - [81, 7740.87]
  - - [2944, 1408, 1, 3328]
    - [83, 9204.55]
  - - [1408, 448, 1, 256]
    - [80, 5954.3]
  - - [1024, 1408, 1, 3328]
    - [77, 8161.44]
  - - [2560, 7133, 1, 2560]
    - [72, 9636.59]
  - - [1408, 4, 1, 1280]
    - [24, 520.879]
  - - [5888, 3584, 1, 256]
    - [85, 9225.16]
  - - [128, 1024, 1, 1280]
    - [27, 4755.45]
  - - [1408, 1856, 1, 3328]
    - [77, 9130.77]
  - - [4, 4, 1, 3328]
    - [97, 6.93333]
  - - [6784, 1408, 1, 1280]
    - [74, 9346.81]
  - - [4, 1024, 1, 1280]
    - [24, 422.813]
  - - [704, 2944, 1, 256]
    - [80, 8331.96]
  - - [704, 4288, 1, 128]
    - [66, 4371.04]
  - - [2368, 4288, 1, 128]
    - [66, 3988.79]
  - - [64, 4288, 1, 1280]
    - [56, 5407.53]
  - - [6784, 64, 1, 1280]
    - [36, 5708.15]
  - - [3584, 128, 1, 128]
    - [2, 2463.1]
  - - [1024, 6784, 1, 128]
    - [67, 3862.02]
  - - [4, 1856, 1, 128]
    - [87, 30.5362]
  - - [1408, 64, 1, 3328]
    - [56, 6095.38]
  - - [6784, 4, 1, 256]
    - [89, 487.838]
  - - [1408, 1408, 1, 1280]
    - [85, 8640.53]
  - - [256, 2368, 1, 256]
    - [77, 4282.26]
  - - [448, 4288, 1, 3328]
    - [74, 8516.03]
  - - [2368, 1408, 1, 256]
    - [80, 8632.09]
  - - [5888, 5056, 1, 128]
    - [66, 5091.01]
  - - [704, 2368, 1, 256]
    - [80, 7664.7]
  - - [2944, 448, 1, 1280]
    - [80, 7618.25]
  - - [5888, 2368, 1, 3328]
    - [83, 9343.38]
  - - [64, 2944, 1, 1280]
    - [48, 5162.08]
  - - [448, 1856, 1, 1280]
    - [74, 7027.9]
  - - [4288, 448, 1, 1280]
    - [74, 5855.66]
  - - [5888, 704, 1, 3328]
    - [83, 9190.81]
  - - [5056, 256, 1, 128]
    - [69, 3235.84]
  - - [1856, 256, 1, 128]
    - [67, 1849.68]
  - - [5056, 128, 1, 256]
    - [80, 6108.96]
  - - [704, 4, 1, 256]
    - [40, 125.156]
  - - [1408, 5888, 1, 128]
    - [66, 5055.06]
  - - [4288, 4, 1, 128]
    - [86, 95.6209]
  - - [1408, 1024, 1, 256]
    - [74, 7370.18]
  - - [1024, 1856, 1, 128]
    - [66, 2966.7]
  - - [256, 704, 1, 128]
    - [68, 528.129]
  - - [256, 1024, 1, 128]
    - [66, 1171.59]
  - - [448, 1024, 1, 256]
    - [80, 5624.55]
  - - [128, 4, 1, 3328]
    - [97, 191.885]
  - - [5056, 6784, 1, 1280]
    - [74, 9543.97]
  - - [704, 5056, 1, 3328]
    - [81, 8790.25]
  - - [64, 1408, 1, 1280]
    - [48, 4505.6]
  - - [3584, 5056, 1, 3328]
    - [79, 9073.42]
  - - [1856, 4, 1, 3328]
    - [97, 612.775]
  - - [4, 2944, 1, 128]
    - [86, 71.9145]
  - - [2368, 2944, 1, 3328]
    - [72, 9314.58]
  - - [448, 448, 1, 1280]
    - [56, 5129.81]
  - - [2368, 3584, 1, 256]
    - [74, 8998.7]
  - - [5056, 3584, 1, 1280]
    - [75, 9345.07]
  - - [448, 4, 1, 3328]
    - [97, 487.237]
  - - [1856, 2944, 1, 1280]
    - [85, 8438.69]
  - - [3584, 2368, 1, 1280]
    - [80, 9298.8]
  - - [128, 1024, 1, 256]
    - [32, 2356.35]
  - - [2944, 1408, 1, 256]
    - [72, 5440.72]
  - - [4288, 1408, 1, 3328]
    - [72, 9385.99]
  - - [3584, 64, 1, 3328]
    - [28, 6310.87]
  - - [1408, 128, 1, 256]
    - [74, 2942.43]
  - - [2944, 1024, 1, 128]
    - [69, 3927.89]
  - - [4288, 5056, 1, 1280]
    - [76, 8328.48]
  - - [5888, 6784, 1, 1280]
    - [85, 9757.34]
  - - [6784, 5056, 1, 128]
    - [65, 5101.3]
  - - [256, 1024, 1, 3328]
    - [74, 6475.77]
  - - [3584, 4, 1, 256]
    - [90, 420.873]
  - - [1856, 64, 1, 3328]
    - [56, 6409.1]
  - - [64, 6784, 1, 128]
    - [4, 2387.22]
  - - [5888, 1408, 1, 3328]
    - [79, 9655.79]
  - - [5888, 64, 1, 1280]
    - [74, 5870.76]
  - - [256, 5056, 1, 256]
    - [77, 6108.96]
  - - [128, 3584, 1, 128]
    - [7, 2383.13]
  - - [448, 3584, 1, 3328]
    - [72, 7092.18]
  - - [704, 2368, 1, 128]
    - [66, 3740.98]
  - - [5888, 256, 1, 128]
    - [67, 2977.44]
  - - [4, 5056, 1, 128]
    - [86, 132.62]
  - - [448, 256, 1, 256]
    - [38, 2308.19]
  - - [704, 4, 1, 3328]
    - [43, 552.574]
  - - [1408, 256, 1, 256]
    - [74, 4577.12]
  - - [3584, 1856, 1, 128]
    - [66, 4571.76]
  - - [4288, 4288, 1, 128]
    - [69, 5284.55]
  - - [1856, 1024, 1, 3328]
    - [80, 6362.15]
  - - [128, 5888, 1, 3328]
    - [50, 7040.73]
  - - [1024, 5056, 1, 256]
    - [85, 7855.6]
  - - [2368, 1408, 1, 3328]
    - [80, 9205.56]
  - - [5888, 448, 1, 256]
    - [77, 5538.74]
  - - [5888, 6784, 1, 128]
    - [65, 4500.75]
  - - [2368, 4, 1, 3328]
    - [43, 642.798]
  - - [6784, 5056, 1, 1280]
    - [81, 9249.13]
  - - [5056, 704, 1, 1280]
    - [80, 8883.27]
  - - [1408, 256, 1, 1280]
    - [74, 5632.0]
  - - [4288, 6784, 1, 1280]
    - [80, 8843.21]
  - - [128, 704, 1, 256]
    - [38, 2045.09]
  - - [448, 128, 1, 1280]
    - [48, 3807.07]
  - - [6784, 4, 1, 3328]
    - [91, 684.571]
  - - [4288, 4, 1, 1280]
    - [40, 601.825]
  - - [1024, 64, 1, 3328]
    - [52, 3928.38]
  - - [1856, 4, 1, 256]
    - [90, 293.294]
  - - [64, 3584, 1, 1280]
    - [74, 5265.45]
  - - [6784, 1408, 1, 256]
    - [74, 9059.26]
  - - [3584, 5888, 1, 128]
    - [66, 5084.19]
  - - [5056, 5888, 1, 256]
    - [85, 8589.99]
  - - [2368, 1024, 1, 256]
    - [77, 4493.03]
  - - [2944, 1856, 1, 256]
    - [83, 5202.31]
  - - [1856, 6784, 1, 1280]
    - [81, 9071.38]
  - - [64, 5056, 1, 128]
    - [4, 2038.32]
  - - [5888, 64, 1, 128]
    - [3, 2016.49]
  - - [448, 704, 1, 128]
    - [67, 1173.55]
  - - [4, 1024, 1, 128]
    - [86, 8.79685]
  - - [4288, 3584, 1, 256]
    - [80, 9080.16]
  - - [1408, 704, 1, 128]
    - [66, 3165.61]
  - - [64, 256, 1, 3328]
    - [60, 3126.49]
  - - [5056, 1856, 1, 1280]
    - [77, 8857.45]
  - - [1408, 1024, 1, 3328]
    - [83, 8177.02]
  - - [2368, 256, 1, 3328]
    - [74, 6810.21]
  - - [5888, 3584, 1, 1280]
    - [72, 9535.45]
  - - [1856, 3584, 1, 3328]
    - [74, 9281.81]
  - - [5888, 128, 1, 1280]
    - [80, 8136.72]
  - - [1024, 2944, 1, 256]
    - [72, 7247.86]
  - - [448, 6784, 1, 1280]
    - [80, 7013.94]
  - - [256, 3584, 1, 1280]
    - [74, 7738.54]
  - - [448, 128, 1, 128]
    - [4, 495.948]
  - - [704, 5056, 1, 256]
    - [80, 8609.34]
  - - [3584, 1024, 1, 3328]
    - [73, 7765.63]
  - - [2944, 1856, 1, 1280]
    - [85, 7775.93]
  - - [128, 256, 1, 128]
    - [17, 296.208]
  - - [5056, 256, 1, 256]
    - [74, 7829.63]
  - - [2368, 3584, 1, 3328]
    - [73, 8895.98]
  - - [2944, 704, 1, 1280]
    - [83, 6855.73]
  - - [128, 4, 1, 256]
    - [92, 24.8242]
  - - [2944, 3584, 1, 1280]
    - [85, 9049.12]
  - - [1856, 5888, 1, 1280]
    - [80, 9431.96]
  - - [256, 256, 1, 1280]
    - [45, 3942.02]
  - - [5056, 448, 1, 3328]
    - [85, 4587.73]
  - - [4288, 1408, 1, 256]
    - [85, 5408.73]
  - - [3584, 64, 1, 256]
    - [54, 2496.61]
  - - [64, 1856, 1, 3328]
    - [27, 5896.68]
  - - [256, 1408, 1, 128]
    - [66, 1643.07]
  - - [5888, 1408, 1, 128]
    - [65, 4436.27]
  - - [4288, 2368, 1, 1280]
    - [74, 9432.94]
  - - [4, 4288, 1, 256]
    - [89, 442.632]
  - - [256, 4288, 1, 128]
    - [66, 2814.69]
  - - [256, 128, 1, 3328]
    - [55, 3951.16]
  - - [6784, 2368, 1, 256]
    - [74, 9169.89]
  - - [5888, 128, 1, 128]
    - [3, 3156.71]
  - - [4288, 1856, 1, 256]
    - [80, 5658.13]
  - - [1856, 256, 1, 3328]
    - [74, 7646.27]
  - - [1856, 2944, 1, 256]
    - [81, 6444.88]
  - - [5056, 1024, 1, 128]
    - [65, 4607.2]
  - - [64, 5888, 1, 1280]
    - [80, 5842.36]
  - - [1760, 7133, 1, 1760]
    - [73, 9097.74]
  - - [6784, 256, 1, 128]
    - [66, 3685.31]
  - - [5888, 704, 1, 128]
    - [65, 3656.13]
  - - [6784, 64, 1, 128]
    - [16, 2191.42]
  - - [1024, 4288, 1, 1280]
    - [80, 9199.22]
  - - [2368, 5056, 1, 3328]
    - [76, 9072.78]
  - - [448, 4, 1, 128]
    - [87, 5.32937]
  - - [4, 256, 1, 3328]
    - [97, 310.937]
  - - [4288, 1024, 1, 3328]
    - [78, 8660.23]
  - - [1024, 5056, 1, 3328]
    - [74, 8886.66]
  - - [1024, 1856, 1, 3328]
    - [79, 8426.14]
  - - [704, 704, 1, 1280]
    - [74, 7661.7]
  - - [128, 2368, 1, 1280]
    - [48, 5746.05]
  - - [1408, 128, 1, 3328]
    - [56, 6530.77]
  - - [3584, 256, 1, 1280]
    - [80, 7633.94]
  - - [4, 128, 1, 128]
    - [87, 1.97874]
  - - [704, 6784, 1, 128]
    - [69, 4589.49]
  - - [3584, 128, 1, 1280]
    - [74, 7078.14]
  - - [4, 256, 1, 1280]
    - [43, 178.087]
  - - [128, 704, 1, 3328]
    - [48, 5959.71]
  - - [4288, 6784, 1, 256]
    - [74, 9326.44]
  - - [3584, 2944, 1, 3328]
    - [76, 9114.06]
  - - [128, 1856, 1, 256]
    - [80, 3672.55]
  - - [64, 4288, 1, 256]
    - [74, 3457.41]
  - - [4, 3584, 1, 3328]
    - [23, 694.27]
  - - [64, 4, 1, 3328]
    - [43, 71.4738]
  - - [4, 64, 1, 3328]
    - [43, 91.8069]
  - - [5888, 2944, 1, 256]
    - [73, 7241.45]
  - - [2368, 6784, 1, 128]
    - [69, 5229.53]
  - - [448, 4288, 1, 1280]
    - [74, 8416.3]
  - - [448, 1856, 1, 3328]
    - [74, 7161.46]
  - - [4, 1024, 1, 256]
    - [40, 187.246]
  - - [5056, 4288, 1, 256]
    - [85, 8947.16]
  - - [1024, 448, 1, 256]
    - [80, 5318.86]
  - - [1024, 3584, 1, 256]
    - [75, 6151.94]
  - - [2944, 128, 1, 1280]
    - [56, 6053.53]
  - - [1856, 5056, 1, 128]
    - [66, 5091.32]
  - - [64, 256, 1, 256]
    - [29, 771.012]
  - - [1408, 4, 1, 128]
    - [86, 40.7758]
  - - [128, 2368, 1, 128]
    - [14, 1520.27]
  - - [256, 704, 1, 1280]
    - [74, 4329.71]
  - - [64, 2368, 1, 128]
    - [5, 1212.42]
  - - [6784, 6784, 1, 3328]
    - [85, 8310.57]
  - - [448, 5888, 1, 1280]
    - [80, 8502.23]
  - - [5056, 448, 1, 128]
    - [66, 4160.9]
  - - [3584, 2944, 1, 128]
    - [66, 4363.41]
  - - [6784, 256, 1, 1280]
    - [80, 8629.57]
  - - [256, 2944, 1, 1280]
    - [80, 7277.38]
  - - [64, 4288, 1, 128]
    - [5, 1821.96]
  - - [2368, 5888, 1, 3328]
    - [74, 9017.42]
  - - [4, 64, 1, 256]
    - [40, 16.0627]
  - - [704, 1024, 1, 3328]
    - [80, 8059.45]
  - - [2368, 1856, 1, 1280]
    - [80, 8813.14]
  - - [128, 448, 1, 128]
    - [1, 588.144]
  - - [128, 6784, 1, 256]
    - [80, 6538.18]
  - - [3584, 4288, 1, 128]
    - [66, 5025.36]
  - - [64, 448, 1, 128]
    - [18, 231.693]
  - - [5888, 4288, 1, 3328]
    - [74, 9515.78]
  - - [2368, 704, 1, 256]
    - [80, 7642.74]
  - - [256, 1856, 1, 3328]
    - [80, 6547.07]
  - - [1856, 128, 1, 256]
    - [74, 3782.18]
  - - [6784, 128, 1, 128]
    - [8, 2835.44]
  - - [3584, 1408, 1, 128]
    - [65, 3049.11]
  - - [1856, 5056, 1, 1280]
    - [81, 8863.2]
  - - [2944, 1024, 1, 1280]
    - [85, 8873.15]
  - - [5056, 4, 1, 256]
    - [21, 494.021]
  - - [3584, 5888, 1, 3328]
    - [73, 9585.15]
  - - [2368, 4288, 1, 256]
    - [85, 6418.95]
  - - [1024, 2368, 1, 3328]
    - [80, 8645.26]
  - - [64, 704, 1, 3328]
    - [62, 4399.83]
  - - [704, 1408, 1, 256]
    - [74, 7428.44]
  - - [6784, 1856, 1, 3328]
    - [85, 9163.56]
  - - [1024, 2944, 1, 128]
    - [69, 3551.88]
  - - [1024, 3584, 1, 1280]
    - [83, 9112.37]
  - - [4288, 5888, 1, 3328]
    - [73, 8523.95]
  - - [4288, 4, 1, 3328]
    - [40, 619.916]
  - - [256, 1408, 1, 256]
    - [74, 4505.6]
  - - [448, 2944, 1, 1280]
    - [74, 7612.77]
  - - [4, 5888, 1, 128]
    - [86, 174.464]
  - - [1024, 2944, 1, 3328]
    - [79, 9136.64]
  - - [3584, 6784, 1, 256]
    - [79, 7253.79]
  - - [256, 6784, 1, 1280]
    - [74, 8637.62]
  - - [1856, 3584, 1, 256]
    - [80, 8199.57]
  - - [128, 448, 1, 3328]
    - [61, 4799.82]
  - - [6784, 1856, 1, 128]
    - [66, 5185.52]
  - - [4, 448, 1, 256]
    - [40, 86.8848]
  - - [2944, 704, 1, 128]
    - [69, 3798.54]
  - - [256, 5888, 1, 1280]
    - [74, 8678.37]
  - - [4, 128, 1, 1280]
    - [43, 102.4]
  - - [4288, 6784, 1, 3328]
    - [79, 8209.3]
  - - [6784, 128, 1, 1280]
    - [56, 6562.89]
  - - [64, 1408, 1, 256]
    - [46, 2059.7]
  - - [7680, 5481, 1, 2560]
    - [85, 9426.69]
  - - [2368, 1408, 1, 128]
    - [66, 4532.4]
  - - [1856, 448, 1, 256]
    - [74, 6275.38]
  - - [1408, 1024, 1, 128]
    - [66, 3604.48]
  - - [128, 64, 1, 128]
    - [1, 87.3813]
  - - [6784, 3584, 1, 3328]
    - [81, 8991.82]
  - - [2944, 64, 1, 3328]
    - [50, 6043.26]
  - - [64, 64, 1, 128]
    - [6, 36.209]
  - - [2368, 5056, 1, 1280]
    - [80, 9438.38]
  - - [64, 4, 1, 1280]
    - [43, 40.1569]
  - - [1408, 2368, 1, 1280]
    - [76, 7738.06]
  - - [128, 1408, 1, 1280]
    - [48, 4937.64]
  - - [256, 64, 1, 3328]
    - [58, 2683.36]
  - - [2944, 4288, 1, 128]
    - [66, 5173.71]
  - - [2944, 2944, 1, 256]
    - [74, 8943.82]
  - - [2944, 4, 1, 1280]
    - [23, 617.757]
  - - [5888, 4, 1, 256]
    - [89, 483.118]
  - - [6784, 256, 1, 256]
    - [80, 7916.6]
  - - [256, 5056, 1, 3328]
    - [74, 8953.15]
  - - [128, 4288, 1, 1280]
    - [27, 6014.95]
  - - [5056, 1856, 1, 128]
    - [68, 4221.05]
  - - [5888, 1408, 1, 256]
    - [79, 9144.75]
  - - [128, 128, 1, 256]
    - [29, 759.838]
  - - [5056, 4, 1, 3328]
    - [89, 642.718]
  - - [4288, 3584, 1, 3328]
    - [75, 9299.95]
  - - [448, 704, 1, 3328]
    - [81, 4480.98]
  - - [448, 448, 1, 128]
    - [5, 1360.71]
  - - [1024, 2368, 1, 1280]
    - [74, 8570.19]
  - - [1856, 704, 1, 3328]
    - [74, 8448.16]
  - - [4, 2368, 1, 128]
    - [86, 64.4902]
  - - [5888, 6784, 1, 3328]
    - [81, 9447.02]
  - - [704, 4288, 1, 1280]
    - [83, 7476.77]
  - - [704, 256, 1, 256]
    - [74, 2957.52]
  - - [6784, 448, 1, 3328]
    - [77, 8886.12]
  - - [4288, 1024, 1, 128]
    - [65, 3864.39]
  - - [49, 512, 128, 2048]
    - [106, 7112.68]
  - - [196, 256, 256, 1024]
    - [102, 8302.6]
  - - [784, 512, 256, 128]
    - [100, 9061.26]
  - - [49, 2048, 128, 512]
    - [98, 6963.26]
  - - [784, 128, 128, 512]
    - [105, 8983.53]
  - - [3136, 256, 256, 64]
    - [103, 9051.28]
  - - [3136, 64, 128, 64]
    - [99, 8581.25]
  - - [49, 2048, 256, 512]
    - [98, 7049.54]
  - - [784, 128, 256, 512]
    - [107, 9102.89]
  - - [196, 256, 128, 1024]
    - [101, 8085.79]
  - - [3136, 64, 128, 256]
    - [104, 9381.29]
  - - [3136, 256, 128, 64]
    - [103, 8982.54]
  - - [784, 512, 128, 128]
    - [100, 8965.89]
  - - [3136, 64, 256, 256]
    - [104, 9566.33]
  - - [3136, 64, 256, 64]
    - [99, 8743.7]
  - - [196, 1024, 128, 256]
    - [102, 8119.33]
  - - [49, 512, 256, 2048]
    - [108, 7166.31]
  - - [196, 1024, 256, 256]
    - [102, 8210.56]
  - - [5329, 160, 64, 64]
    - [111, 8156.79]
  - - [1225, 384, 64, 192]
    - [110, 9162.25]
  - - [289, 1024, 64, 256]
    - [110, 8483.73]
  - - [64, 1536, 64, 384]
    - [114, 9323.55]
  - - [1225, 384, 64, 64]
    - [113, 8158.7]
  - - [1225, 384, 64, 96]
    - [110, 8540.6]
  - - [64, 1536, 64, 256]
    - [112, 9142.9]
  - - [289, 1024, 64, 384]
    - [109, 8725.56]
  - - [289, 1024, 64, 192]
    - [110, 8313.06]
  - - [289, 1024, 64, 128]
    - [112, 7989.41]
  - - [4096, 1024, 1, 2984]
    - [148, 9846.29]
  - - [1024, 4096, 1, 3437]
    - [149, 9915.7]
  - - [1024, 4096, 1, 3235]
    - [142, 9913.92]
  - - [4096, 1024, 1, 4032]
    - [472, 9948.81]
  - - [1024, 4096, 1, 3334]
    - [149, 9918.17]
  - - [4096, 1024, 1, 3288]
    - [149, 9854.57]
  - - [1024, 4096, 1, 3515]
    - [149, 9923.93]
  - - [4096, 1024, 1, 3437]
    - [149, 9869.53]
  - - [1024, 4096, 1, 3259]
    - [149, 9907.55]
  - - [1024, 4096, 1, 3384]
    - [476, 9785.91]
  - - [64, 92, 688, 92]
    - [120, 6137.79]
  - - [4096, 1024, 1, 3458]
    - [148, 9887.59]
  - - [1024, 4096, 1, 3412]
    - [148, 9930.46]
  - - [1024, 4096, 1, 3529]
    - [142, 9924.44]
  - - [1024, 4096, 1, 4032]
    - [472, 10485.7]
  - - [4096, 1024, 1, 3999]
    - [149, 9894.9]
  - - [1024, 4096, 1, 3079]
    - [142, 9894.48]
  - - [1024, 4096, 1, 3876]
    - [141, 9949.29]
  - - [1024, 4096, 1, 3450]
    - [149, 9915.55]
  - - [1024, 4096, 1, 3256]
    - [149, 9911.08]
  - - [4096, 1024, 1, 3403]
    - [148, 9858.83]
  - - [1024, 1024, 1, 3975]
    - [139, 8990.71]
  - - [1024, 4096, 1, 3359]
    - [149, 9914.9]
  - - [4096, 1024, 1, 3549]
    - [148, 9870.56]
  - - [4096, 1024, 1, 3176]
    - [149, 9855.82]
  - - [1024, 4096, 1, 3504]
    - [141, 9934.07]
  - - [4096, 1024, 1, 3314]
    - [148, 9873.8]
  - - [4096, 1024, 1, 3183]
    - [148, 9843.74]
  - - [1024, 4096, 1, 3209]
    - [142, 9904.87]
  - - [1024, 4096, 1, 3720]
    - [141, 9934.06]
  - - [1024, 4096, 1, 3859]
    - [141, 9952.43]
  - - [1024, 33708, 1, 4059]
    - [141, 10321.4]
  - - [1024, 4096, 1, 3968]
    - [141, 9955.86]
  - - [64, 123, 528, 123]
    - [115, 6916.11]
  - - [4096, 1024, 1, 3477]
    - [149, 9871.93]
  - - [4096, 1024, 1, 3233]
    - [149, 9862.25]
  - - [4096, 1024, 1, 3409]
    - [149, 9876.76]
  - - [4096, 1024, 1, 3564]
    - [149, 9870.39]
  - - [64, 102, 624, 100]
    - [115, 5773.06]
  - - [4096, 1024, 1, 3190]
    - [148, 9850.87]
  - - [64, 112, 576, 111]
    - [115, 6517.25]
  - - [1024, 4096, 1, 3288]
    - [148, 9911.8]
  - - [4096, 1024, 1, 3451]
    - [148, 9859.51]
  - - [1024, 4096, 1, 3348]
    - [141, 9915.37]
  - - [64, 102, 624, 102]
    - [115, 5783.6]
  - - [1024, 4096, 1, 3465]
    - [142, 9913.02]
  - - [1024, 33708, 1, 4032]
    - [141, 10340.3]
  - - [1024, 33708, 1, 3840]
    - [141, 10341.7]
  - - [4096, 1024, 1, 3391]
    - [149, 9861.67]
  - - [1024, 4096, 1, 3530]
    - [141, 9920.34]
  - - [4096, 1024, 1, 3209]
    - [148, 9846.9]
  - - [1024, 4096, 1, 3457]
    - [142, 9917.19]
  - - [1024, 4096, 1, 3386]
    - [141, 9917.55]
  - - [4096, 1024, 1, 3350]
    - [148, 9884.44]
  - - [1024, 4096, 1, 3184]
    - [149, 9925.88]
  - - [1024, 4096, 1, 3093]
    - [148, 9902.45]
  - - [64, 133, 480, 135]
    - [132, 6205.87]
  - - [1024, 4096, 1, 3400]
    - [473, 9590.43]
  - - [1024, 1024, 1, 4026]
    - [147, 9014.29]
  - - [1024, 4096, 1, 3214]
    - [141, 9895.84]
  - - [4096, 1024, 1, 3406]
    - [149, 9857.72]
  - - [1024, 4096, 1, 3565]
    - [148, 9919.27]
  - - [4096, 1024, 1, 3536]
    - [486, 9911.13]
  - - [1024, 4096, 1, 3183]
    - [148, 9907.45]
  - - [1024, 4096, 1, 3462]
    - [149, 9922.3]
  - - [4096, 1024, 1, 3130]
    - [142, 9845.94]
  - - [4096, 1024, 1, 3381]
    - [149, 9868.17]
  - - [4096, 1024, 1, 3298]
    - [148, 9870.44]
  - - [1024, 4096, 1, 3292]
    - [141, 9906.2]
  - - [4096, 1024, 1, 3289]
    - [148, 9856.45]
  - - [64, 160, 400, 159]
    - [135, 7427.74]
  - - [1024, 4096, 1, 3379]
    - [141, 9916.99]
  - - [1024, 4096, 1, 3990]
    - [142, 9947.27]
  - - [1024, 4096, 1, 3540]
    - [149, 9935.66]
  - - [4096, 1024, 1, 3412]
    - [149, 9867.46]
  - - [1024, 1024, 1, 3780]
    - [144, 9036.16]
  - - [1024, 4096, 1, 3555]
    - [148, 9927.27]
  - - [1024, 4096, 1, 3518]
    - [142, 9925.45]
  - - [4096, 1024, 1, 3189]
    - [148, 9861.14]
  - - [1024, 4096, 1, 3298]
    - [142, 9923.12]
  - - [1024, 4096, 1, 3393]
    - [149, 9929.18]
  - - [1024, 4096, 1, 3207]
    - [141, 9912.71]
  - - [64, 228, 272, 232]
    - [138, 7350.04]
  - - [64, 23, 2720, 23]
    - [119, 2640.15]
  - - [4096, 1024, 1, 3487]
    - [149, 9860.81]
  - - [1024, 1024, 1, 3822]
    - [147, 8993.86]
  - - [64, 77, 816, 77]
    - [120, 5273.09]
  - - [4096, 1024, 1, 3431]
    - [149, 9867.43]
  - - [4096, 1024, 1, 3378]
    - [148, 9888.04]
  - - [4096, 1024, 1, 3529]
    - [142, 9879.4]
  - - [4096, 1024, 1, 3460]
    - [149, 9877.15]
  - - [1024, 4096, 1, 3336]
    - [141, 9912.31]
  - - [1024, 4096, 1, 3501]
    - [142, 9914.3]
  - - [64, 159, 400, 159]
    - [133, 7016.41]
  - - [1024, 4096, 1, 3584]
    - [472, 9272.81]
  - - [64, 135, 480, 134]
    - [133, 6241.29]
  - - [64, 99, 624, 99]
    - [124, 5617.29]
  - - [4096, 1024, 1, 2499]
    - [148, 9813.47]
  - - [1024, 1024, 1, 3942]
    - [144, 9059.91]
  - - [4096, 1024, 1, 3352]
    - [148, 9867.02]
  - - [1024, 4096, 1, 3543]
    - [149, 9928.67]
  - - [1024, 4096, 1, 3476]
    - [148, 9931.48]
  - - [1024, 33708, 1, 3822]
    - [141, 10324.6]
  - - [1024, 4096, 1, 3436]
    - [141, 9917.18]
  - - [1024, 1024, 1, 3861]
    - [140, 8998.39]
  - - [1024, 1024, 1, 4000]
    - [145, 9058.2]
  - - [1024, 4096, 1, 3594]
    - [141, 9927.78]
  - - [4096, 1024, 1, 3514]
    - [149, 9872.2]
  - - [1024, 4096, 1, 3064]
    - [148, 9907.0]
  - - [4096, 1024, 1, 3371]
    - [141, 9857.64]
  - - [4096, 1024, 1, 3558]
    - [149, 9876.21]
  - - [4096, 1024, 1, 3517]
    - [148, 9866.35]
  - - [4096, 1024, 1, 3144]
    - [148, 9846.26]
  - - [1024, 4096, 1, 3312]
    - [141, 9932.75]
  - - [4096, 1024, 1, 3079]
    - [148, 9851.0]
  - - [1024, 4096, 1, 3415]
    - [141, 9919.37]
  - - [1024, 4096, 1, 3221]
    - [148, 9908.08]
  - - [1024, 4096, 1, 3978]
    - [142, 9944.31]
  - - [4096, 1024, 1, 3876]
    - [148, 9898.89]
  - - [1024, 4096, 1, 3528]
    - [472, 9647.83]
  - - [1024, 4096, 1, 3181]
    - [149, 9894.76]
  - - [4096, 1024, 1, 3445]
    - [148, 9878.44]
  - - [4096, 1024, 1, 3450]
    - [141, 9864.72]
  - - [4096, 1024, 1, 3377]
    - [148, 9879.59]
  - - [1024, 4096, 1, 3532]
    - [142, 9928.09]
  - - [1024, 33708, 1, 3944]
    - [141, 10329.6]
  - - [4096, 1024, 1, 3483]
    - [148, 9861.73]
  - - [1024, 4096, 1, 3358]
    - [141, 9903.59]
  - - [4096, 1024, 1, 3464]
    - [148, 9876.74]
  - - [4096, 1024, 1, 3282]
    - [141, 9859.13]
  - - [4096, 1024, 1, 3256]
    - [149, 9855.0]
  - - [1024, 4096, 1, 3057]
    - [148, 9910.65]
  - - [4096, 1024, 1, 3481]
    - [148, 9866.19]
  - - [4096, 1024, 1, 3340]
    - [148, 9862.15]
  - - [1024, 1024, 1, 3870]
    - [147, 9082.35]
  - - [1024, 4096, 1, 3273]
    - [141, 9916.19]
  - - [64, 65, 992, 65]
    - [133, 4682.91]
  - - [4096, 1024, 1, 3392]
    - [142, 9881.02]
  - - [4096, 1024, 1, 3337]
    - [148, 9864.4]
  - - [4096, 1024, 1, 3359]
    - [148, 9874.32]
  - - [4096, 1024, 1, 3498]
    - [149, 9864.25]
  - - [4096, 1024, 1, 3169]
    - [148, 9851.0]
  - - [1024, 33708, 1, 3859]
    - [142, 10332.5]
  - - [64, 19, 3264, 19]
    - [119, 2182.04]
  - - [1024, 4096, 1, 3103]
    - [141, 9898.8]
  - - [4096, 1024, 1, 3900]
    - [148, 9897.02]
  - - [1024, 4096, 1, 3442]
    - [148, 9938.87]
  - - [1024, 4096, 1, 3248]
    - [148, 9939.82]
  - - [1024, 4096, 1, 3351]
    - [149, 9923.13]
  - - [4096, 1024, 1, 3593]
    - [148, 9894.26]
  - - [1024, 4096, 1, 3780]
    - [148, 9941.86]
  - - [64, 133, 480, 133]
    - [133, 6180.69]
  - - [1024, 33708, 1, 3681]
    - [141, 10332.2]
  - - [4096, 1024, 1, 3374]
    - [142, 9859.26]
  - - [1024, 4096, 1, 3557]
    - [141, 9928.1]
  - - [4096, 1024, 1, 3906]
    - [148, 9906.97]
  - - [4096, 1024, 1, 3504]
    - [148, 9885.95]
  - - [1024, 4096, 1, 3270]
    - [148, 9916.27]
  - - [4096, 1024, 1, 3098]
    - [141, 9854.66]
  - - [64, 232, 272, 232]
    - [138, 7394.0]
  - - [4096, 1024, 1, 3216]
    - [149, 9876.47]
  - - [64, 148, 432, 148]
    - [135, 6663.75]
  - - [1024, 4096, 1, 3550]
    - [148, 9920.18]
  - - [4096, 1024, 1, 3449]
    - [142, 9870.47]
  - - [1024, 4096, 1, 3403]
    - [149, 9908.11]
  - - [1024, 4096, 1, 3523]
    - [148, 9932.61]
  - - [1024, 4096, 1, 3486]
    - [148, 9917.36]
  - - [1024, 4096, 1, 3564]
    - [148, 9923.34]
  - - [1024, 33708, 1, 4005]
    - [141, 10339.4]
  - - [4096, 1024, 1, 3296]
    - [148, 9879.68]
  - - [1024, 4096, 1, 3263]
    - [141, 9907.07]
  - - [64, 25, 2512, 25]
    - [119, 2848.07]
  - - [1024, 4096, 1, 3130]
    - [149, 9900.0]
  - - [1024, 4096, 1, 3295]
    - [149, 9895.35]
  - - [1024, 33708, 1, 3925]
    - [142, 10342.2]
  - - [1024, 4096, 1, 3378]
    - [141, 9921.27]
  - - [4096, 1024, 1, 3720]
    - [149, 9885.72]
  - - [4096, 1024, 1, 3399]
    - [148, 9880.55]
  - - [4096, 1024, 1, 3543]
    - [149, 9870.63]
  - - [64, 9, 6544, 9]
    - [122, 955.07]
  - - [4096, 1024, 1, 3497]
    - [148, 9868.33]
  - - [4096, 1024, 1, 3594]
    - [149, 9876.78]
  - - [1024, 4096, 1, 3144]
    - [149, 9901.86]
  - - [1024, 4096, 1, 3975]
    - [142, 9950.09]
  - - [4096, 1024, 1, 3205]
    - [149, 9855.97]
  - - [1024, 33708, 1, 3995]
    - [141, 10331.0]
  - - [1024, 4096, 1, 3392]
    - [141, 9935.68]
  - - [1024, 4096, 1, 3055]
    - [149, 9893.15]
  - - [1024, 4096, 1, 4026]
    - [149, 9940.12]
  - - [4096, 1024, 1, 3557]
    - [148, 9883.9]
  - - [4096, 1024, 1, 3515]
    - [148, 9871.84]
  - - [4096, 1024, 1, 3486]
    - [149, 9860.64]
  - - [4096, 1024, 1, 3457]
    - [149, 9885.27]
  - - [1024, 4096, 1, 3511]
    - [141, 9928.14]
  - - [4096, 1024, 1, 3138]
    - [148, 9853.96]
  - - [1024, 4096, 1, 3339]
    - [142, 9912.79]
  - - [1024, 4096, 1, 3939]
    - [142, 9952.16]
  - - [4096, 1024, 1, 3500]
    - [142, 9863.52]
  - - [4096, 1024, 1, 3395]
    - [149, 9883.72]
  - - [4096, 1024, 1, 3968]
    - [149, 9920.26]
  - - [4096, 1024, 1, 4020]
    - [149, 9912.71]
  - - [4096, 1024, 1, 3942]
    - [148, 9910.07]
  - - [1024, 1024, 1, 4032]
    - [472, 8251.07]
  - - [4096, 1024, 1, 3349]
    - [149, 9865.94]
  - - [1024, 4096, 1, 3322]
    - [142, 9908.33]
  - - [4096, 1024, 1, 3452]
    - [148, 9872.59]
  - - [1024, 4096, 1, 3417]
    - [148, 9912.54]
  - - [1024, 1024, 1, 4012]
    - [146, 9085.37]
  - - [1024, 4096, 1, 3526]
    - [142, 9920.26]
  - - [4096, 1024, 1, 3485]
    - [142, 9861.54]
  - - [1024, 1024, 1, 3681]
    - [146, 8991.36]
  - - [4096, 1024, 1, 3303]
    - [149, 9861.2]
  - - [4096, 1024, 1, 3344]
    - [472, 11129.4]
  - - [1024, 4096, 1, 3479]
    - [149, 9921.67]
  - - [4096, 1024, 1, 3300]
    - [148, 9868.54]
  - - [1024, 4096, 1, 3439]
    - [142, 9918.19]
  - - [4096, 1024, 1, 3280]
    - [149, 9875.19]
  - - [1024, 4096, 1, 3245]
    - [141, 9910.39]
  - - [1024, 4096, 1, 3328]
    - [472, 10424.3]
  - - [4096, 1024, 1, 3418]
    - [141, 9870.66]
  - - [1024, 4096, 1, 3493]
    - [149, 9938.35]
  - - [1024, 4096, 1, 3500]
    - [141, 9916.83]
  - - [1024, 4096, 1, 3166]
    - [141, 9898.02]
  - - [4096, 1024, 1, 3126]
    - [142, 9846.94]
  - - [1024, 4096, 1, 3277]
    - [149, 9898.56]
  - - [1024, 4096, 1, 3315]
    - [148, 9923.01]
  - - [1024, 1024, 1, 3927]
    - [139, 8987.61]
  - - [1024, 4096, 1, 3414]
    - [141, 9915.91]
  - - [4096, 1024, 1, 3531]
    - [148, 9871.82]
  - - [4096, 1024, 1, 3484]
    - [141, 9867.76]
  - - [1024, 4096, 1, 3180]
    - [148, 9903.99]
  - - [4096, 1024, 1, 3360]
    - [472, 11114.2]
  - - [1024, 33708, 1, 3990]
    - [141, 10334.9]
  - - [4096, 1024, 1, 3466]
    - [148, 9874.92]
  - - [1024, 4096, 1, 3428]
    - [141, 9915.92]
  - - [1024, 4096, 1, 3137]
    - [148, 9913.17]
  - - [4096, 1024, 1, 4059]
    - [148, 9901.76]
  - - [1024, 4096, 1, 3353]
    - [148, 9914.5]
  - - [1024, 4096, 1, 3942]
    - [148, 9944.4]
  - - [4096, 1024, 1, 3506]
    - [141, 9875.65]
  - - [1024, 1024, 1, 3894]
    - [139, 8946.45]
  - - [4096, 1024, 1, 3508]
    - [149, 9877.57]
  - - [64, 132, 480, 135]
    - [133, 6164.76]
  - - [4096, 1024, 1, 3956]
    - [141, 9907.73]
  - - [64, 7, 8192, 7]
    - [121, 812.978]
  - - [1024, 4096, 1, 3272]
    - [142, 9909.72]
  - - [1024, 4096, 1, 3443]
    - [149, 9929.73]
  - - [1024, 4096, 1, 3375]
    - [149, 9909.13]
  - - [1024, 4096, 1, 3525]
    - [149, 9929.17]
  - - [4096, 1024, 1, 3472]
    - [148, 9889.87]
  - - [1024, 4096, 1, 3520]
    - [483, 8997.11]
  - - [4096, 1024, 1, 3322]
    - [148, 9862.88]
  - - [4096, 1024, 1, 3387]
    - [148, 9861.52]
  - - [64, 8, 7280, 8]
    - [127, 1024.0]
  - - [1024, 33708, 1, 3939]
    - [141, 10339.8]
  - - [4096, 1024, 1, 3345]
    - [149, 9873.58]
  - - [4096, 1024, 1, 2967]
    - [148, 9839.11]
  - - [1024, 4096, 1, 3453]
    - [141, 9905.71]
  - - [1024, 4096, 1, 3640]
    - [148, 9933.95]
  - - [4096, 1024, 1, 3291]
    - [142, 9860.74]
  - - [1024, 4096, 1, 3350]
    - [149, 9917.93]
  - - [4096, 1024, 1, 3417]
    - [148, 9864.51]
  - - [64, 135, 480, 135]
    - [133, 6265.35]
  - - [1024, 4096, 1, 3467]
    - [142, 9906.85]
  - - [1024, 4096, 1, 3491]
    - [148, 9933.2]
  - - [1024, 4096, 1, 3822]
    - [148, 9938.65]
  - - [4096, 1024, 1, 3292]
    - [148, 9849.11]
  - - [1024, 4096, 1, 3231]
    - [141, 9905.72]
  - - [1024, 4096, 1, 3364]
    - [142, 9930.22]
  - - [1024, 4096, 1, 3995]
    - [142, 9943.66]
  - - [1024, 4096, 1, 3545]
    - [141, 9928.43]
  - - [1024, 1024, 1, 3876]
    - [139, 9002.94]
  - - [1024, 4096, 1, 3186]
    - [141, 9920.91]
  - - [4096, 1024, 1, 3432]
    - [148, 9875.19]
  - - [64, 84, 752, 85]
    - [120, 5704.41]
  - - [4096, 1024, 1, 3367]
    - [142, 9867.96]
  - - [4096, 1024, 1, 3503]
    - [149, 9870.91]
  - - [1024, 4096, 1, 3095]
    - [142, 9902.8]
  - - [4096, 1024, 1, 3465]
    - [149, 9872.07]
  - - [1024, 4096, 1, 3402]
    - [148, 9914.56]
  - - [4096, 1024, 1, 3140]
    - [148, 9847.85]
  - - [1024, 1024, 1, 4050]
    - [145, 9055.65]
  - - [4096, 1024, 1, 3424]
    - [142, 9894.52]
  - - [4096, 1024, 1, 3257]
    - [141, 9860.87]
  - - [4096, 1024, 1, 2917]
    - [148, 9845.81]
  - - [1024, 33708, 1, 3640]
    - [141, 10321.6]
  - - [1024, 4096, 1, 3456]
    - [476, 9866.77]
  - - [1024, 4096, 1, 3014]
    - [141, 9907.87]
  - - [4096, 1024, 1, 3372]
    - [149, 9868.27]
  - - [64, 132, 480, 132]
    - [133, 6121.52]
  - - [1024, 4096, 1, 3294]
    - [149, 9903.13]
  - - [4096, 1024, 1, 3446]
    - [149, 9871.59]
  - - [1024, 4096, 1, 3389]
    - [142, 9909.17]
  - - [4096, 1024, 1, 3259]
    - [148, 9860.66]
  - - [4096, 1024, 1, 3544]
    - [148, 9878.66]
  - - [4096, 1024, 1, 3479]
    - [149, 9873.87]
  - - [4096, 1024, 1, 3542]
    - [148, 9878.87]
  - - [4096, 1024, 1, 3321]
    - [141, 9861.03]
  - - [1024, 4096, 1, 3147]
    - [141, 9894.67]
  - - [1024, 4096, 1, 3944]
    - [141, 9950.41]
  - - [4096, 1024, 1, 3870]
    - [149, 9881.64]
  - - [1024, 4096, 1, 3308]
    - [141, 9907.16]
  - - [4096, 1024, 1, 3401]
    - [148, 9864.49]
  - - [1024, 4096, 1, 3395]
    - [141, 9928.93]
  - - [64, 99, 624, 102]
    - [118, 5651.26]
  - - [1024, 4096, 1, 3563]
    - [148, 9922.66]
  - - [1024, 33708, 1, 3870]
    - [141, 10325.3]
  - - [4096, 1024, 1, 3494]
    - [148, 9875.27]
  - - [1024, 4096, 1, 3271]
    - [141, 9912.99]
  - - [1024, 33708, 1, 3910]
    - [141, 10341.4]
  - - [1024, 4096, 1, 3287]
    - [149, 9924.77]
  - - [1024, 33708, 1, 3860]
    - [141, 10330.6]
  - - [64, 143, 432, 148]
    - [135, 6571.68]
  - - [1024, 1024, 1, 3584]
    - [472, 8239.97]
  - - [64, 162, 400, 162]
    - [137, 6822.16]
  - - [4096, 1024, 1, 3341]
    - [148, 9854.56]
  - - [1024, 4096, 1, 3136]
    - [141, 9926.76]
  - - [4096, 1024, 1, 3439]
    - [148, 9854.23]
  - - [64, 148, 432, 147]
    - [133, 6677.51]
  - - [1024, 4096, 1, 3751]
    - [148, 9938.38]
  - - [1024, 4096, 1, 3301]
    - [148, 9919.05]
  - - [4096, 1024, 1, 3468]
    - [149, 9859.73]
  - - [1024, 4096, 1, 3416]
    - [149, 9918.42]
  - - [4096, 1024, 1, 3163]
    - [148, 9854.55]
  - - [1024, 4096, 1, 3230]
    - [142, 9897.44]
  - - [1024, 4096, 1, 3581]
    - [142, 9915.38]
  - - [1024, 1024, 1, 3960]
    - [472, 7688.4]
  - - [4096, 1024, 1, 3463]
    - [149, 9884.64]
  - - [1024, 4096, 1, 3478]
    - [142, 9926.92]
  - - [4096, 1024, 1, 3262]
    - [148, 9852.12]
  - - [1024, 4096, 1, 3438]
    - [148, 9912.58]
  - - [1024, 4096, 1, 3244]
    - [141, 9900.41]
  - - [1024, 4096, 1, 3445]
    - [141, 9920.22]
  - - [4096, 1024, 1, 3328]
    - [472, 9706.41]
  - - [1024, 4096, 1, 3492]
    - [142, 9937.12]
  - - [4096, 1024, 1, 3211]
    - [142, 9847.85]
  - - [1024, 4096, 1, 3910]
    - [149, 9946.47]
  - - [1024, 4096, 1, 3314]
    - [141, 9932.5]
  - - [4096, 1024, 1, 3859]
    - [148, 9902.74]
  - - [4096, 1024, 1, 3383]
    - [148, 9875.1]
  - - [1024, 4096, 1, 3409]
    - [149, 9926.69]
  - - [1024, 4096, 1, 4020]
    - [141, 9941.7]
  - - [4096, 1024, 1, 3530]
    - [148, 9872.71]
  - - [4096, 1024, 1, 3411]
    - [149, 9874.92]
  - - [1024, 4096, 1, 3566]
    - [149, 9921.0]
  - - [4096, 1024, 1, 3493]
    - [141, 9875.64]
  - - [4096, 1024, 1, 3184]
    - [148, 9873.04]
  - - [1024, 4096, 1, 3431]
    - [142, 9910.93]
  - - [4096, 1024, 1, 3306]
    - [149, 9853.32]
  - - [1024, 4096, 1, 3352]
    - [149, 9913.22]
  - - [4096, 1024, 1, 3295]
    - [148, 9862.58]
  - - [64, 123, 528, 122]
    - [115, 6950.15]
  - - [1024, 4096, 1, 3517]
    - [142, 9919.96]
  - - [64, 102, 624, 101]
    - [123, 5791.39]
  - - [4096, 1024, 1, 3426]
    - [148, 9891.04]
  - - [4096, 1024, 1, 3385]
    - [148, 9868.31]
  - - [1024, 1024, 1, 3978]
    - [139, 9008.38]
  - - [4096, 1024, 1, 3572]
    - [141, 9884.71]
  - - [4096, 1024, 1, 3459]
    - [148, 9892.07]
  - - [1024, 4096, 1, 3374]
    - [149, 9908.42]
  - - [4096, 1024, 1, 3166]
    - [148, 9832.35]
  - - [4096, 1024, 1, 3093]
    - [149, 9841.15]
  - - [4096, 1024, 1, 3523]
    - [142, 9878.95]
  - - [4096, 1024, 1, 3413]
    - [142, 9880.71]
  - - [1024, 4096, 1, 3996]
    - [141, 9948.04]
  - - [1024, 4096, 1, 3452]
    - [149, 9915.87]
  - - [4096, 1024, 1, 3232]
    - [149, 9876.44]
  - - [4096, 1024, 1, 3400]
    - [482, 9711.65]
  - - [4096, 1024, 1, 3334]
    - [148, 9868.89]
  - - [1024, 4096, 1, 3345]
    - [141, 9920.5]
  - - [1024, 4096, 1, 3538]
    - [148, 9933.24]
  - - [1024, 4096, 1, 3466]
    - [148, 9920.75]
  - - [4096, 1024, 1, 3315]
    - [148, 9876.77]
  - - [4096, 1024, 1, 3214]
    - [149, 9847.83]
  - - [1024, 33708, 1, 3900]
    - [141, 10331.6]
  - - [64, 160, 400, 160]
    - [135, 7440.51]
  - - [1024, 4096, 1, 3367]
    - [148, 9926.22]
  - - [1024, 4096, 1, 2917]
    - [149, 9904.47]
  - - [1024, 1024, 1, 3995]
    - [140, 9000.23]
  - - [64, 132, 480, 134]
    - [133, 6146.78]
  - - [1024, 4096, 1, 3544]
    - [149, 9924.04]
  - - [4096, 1024, 1, 3414]
    - [149, 9867.8]
  - - [4096, 1024, 1, 3565]
    - [142, 9870.03]
  - - [1024, 4096, 1, 3512]
    - [148, 9919.74]
  - - [1024, 4096, 1, 3191]
    - [149, 9914.69]
  - - [64, 27, 2336, 27]
    - [117, 3054.61]
  - - [1024, 4096, 1, 3289]
    - [149, 9917.1]
  - - [4096, 1024, 1, 3290]
    - [148, 9858.31]
  - - [1024, 4096, 1, 3211]
    - [149, 9897.06]
  - - [1024, 33708, 1, 3969]
    - [142, 10336.0]
  - - [4096, 1024, 1, 3566]
    - [148, 9862.9]
  - - [64, 111, 576, 111]
    - [123, 6400.81]
  - - [1024, 4096, 1, 3459]
    - [148, 9922.93]
  - - [1024, 4096, 1, 3372]
    - [141, 9909.76]
  - - [4096, 1024, 1, 3339]
    - [148, 9859.2]
  - - [4096, 1024, 1, 3425]
    - [148, 9889.24]
  - - [4096, 1024, 1, 3388]
    - [148, 9871.57]
  - - [1024, 4096, 1, 3531]
    - [141, 9918.9]
  - - [4096, 1024, 1, 3286]
    - [149, 9868.32]
  - - [4096, 1024, 1, 3462]
    - [148, 9881.78]
  - - [1024, 4096, 1, 3388]
    - [141, 9904.59]
  - - [4096, 1024, 1, 3165]
    - [141, 9836.23]
  - - [4096, 1024, 1, 3304]
    - [148, 9857.45]
  - - [1024, 4096, 1, 2736]
    - [480, 9109.92]
  - - [4096, 1024, 1, 3397]
    - [148, 9872.0]
  - - [64, 38, 1680, 38]
    - [116, 3459.42]
  - - [1024, 4096, 1, 3311]
    - [149, 9908.22]
  - - [1024, 4096, 1, 3394]
    - [149, 9929.33]
  - - [4096, 1024, 1, 2736]
    - [486, 9401.28]
  - - [1024, 4096, 1, 3559]
    - [142, 9925.23]
  - - [4096, 1024, 1, 3180]
    - [148, 9837.95]
  - - [1024, 4096, 1, 3480]
    - [141, 9922.36]
  - - [4096, 1024, 1, 3318]
    - [148, 9867.77]
  - - [4096, 1024, 1, 3213]
    - [148, 9845.92]
  - - [1024, 4096, 1, 3286]
    - [148, 9912.04]
  - - [4096, 1024, 1, 3471]
    - [148, 9874.14]
  - - [1024, 4096, 1, 3381]
    - [149, 9922.86]
  - - [64, 100, 624, 100]
    - [124, 5705.14]
  - - [4096, 1024, 1, 3502]
    - [148, 9872.34]
  - - [64, 16, 3840, 16]
    - [130, 2091.57]
  - - [1024, 4096, 1, 3552]
    - [141, 9943.79]
  - - [4096, 1024, 1, 3519]
    - [149, 9869.85]
  - - [1024, 4096, 1, 3300]
    - [142, 9916.05]
  - - [1024, 4096, 1, 3419]
    - [141, 9913.96]
  - - [4096, 1024, 1, 4030]
    - [142, 9893.63]
  - - [4096, 1024, 1, 3976]
    - [149, 9898.25]
  - - [1024, 4096, 1, 3473]
    - [149, 9928.32]
  - - [1024, 1024, 1, 3977]
    - [146, 9009.23]
  - - [4096, 1024, 1, 3428]
    - [148, 9876.69]
  - - [1024, 4096, 1, 3433]
    - [142, 9923.82]
  - - [4096, 1024, 1, 3534]
    - [142, 9863.9]
  - - [4096, 1024, 1, 3461]
    - [148, 9873.02]
  - - [4096, 1024, 1, 3681]
    - [148, 9898.47]
  - - [4096, 1024, 1, 3495]
    - [149, 9875.98]
  - - [4096, 1024, 1, 3351]
    - [148, 9879.61]
  - - [1024, 4096, 1, 4059]
    - [141, 9948.51]
  - - [4096, 1024, 1, 3990]
    - [148, 9900.66]
  - - [1024, 4096, 1, 3325]
    - [142, 9903.2]
  - - [1024, 4096, 1, 3408]
    - [148, 9932.05]
  - - [64, 59, 1088, 59]
    - [123, 5343.67]
  - - [4096, 1024, 1, 3394]
    - [149, 9878.07]
  - - [1024, 4096, 1, 3573]
    - [149, 9935.2]
  - - [4096, 1024, 1, 3386]
    - [148, 9866.28]
  - - [4096, 1024, 1, 3540]
    - [148, 9882.23]
  - - [1024, 4096, 1, 3182]
    - [142, 9894.35]
  - - [1024, 4096, 1, 3430]
    - [141, 9915.14]
  - - [1024, 4096, 1, 3236]
    - [149, 9920.46]
  - - [4096, 1024, 1, 2977]
    - [148, 9847.98]
  - - [1024, 4096, 1, 3355]
    - [148, 9908.68]
  - - [4096, 1024, 1, 3139]
    - [148, 9850.61]
  - - [4096, 1024, 1, 3516]
    - [142, 9874.11]
  - - [4096, 1024, 1, 3368]
    - [142, 9872.54]
  - - [4096, 1024, 1, 3559]
    - [141, 9884.22]
  - - [64, 11, 5456, 11]
    - [130, 1382.57]
  - - [1024, 4096, 1, 3506]
    - [148, 9937.59]
  - - [1024, 4096, 1, 3145]
    - [141, 9905.01]
  - - [1024, 4096, 1, 3369]
    - [148, 9912.61]
  - - [64, 112, 576, 112]
    - [115, 6583.46]
  - - [4096, 1024, 1, 3522]
    - [148, 9889.37]
  - - [1024, 33708, 1, 3894]
    - [141, 10337.4]
  - - [64, 159, 400, 162]
    - [133, 7056.99]
  - - [4096, 1024, 1, 3336]
    - [148, 9867.57]
  - - [1024, 4096, 1, 3382]
    - [142, 9915.8]
  - - [4096, 1024, 1, 3533]
    - [148, 9878.46]
  - - [4096, 1024, 1, 4050]
    - [149, 9916.72]
  - - [4096, 1024, 1, 3480]
    - [142, 9869.22]
  - - [1024, 4096, 1, 3344]
    - [473, 8901.82]
  - - [64, 122, 528, 122]
    - [115, 6871.04]
  - - [1024, 4096, 1, 3509]
    - [142, 9925.7]
  - - [1024, 4096, 1, 3956]
    - [141, 9958.16]
  - - [4096, 1024, 1, 3616]
    - [148, 9904.53]
  - - [1024, 4096, 1, 3366]
    - [141, 9919.37]
  - - [4096, 1024, 1, 2935]
    - [141, 9833.13]
  - - [4096, 1024, 1, 3393]
    - [148, 9877.35]
  - - [4096, 1024, 1, 3547]
    - [142, 9865.0]
  - - [1024, 4096, 1, 3499]
    - [149, 9912.39]
  - - [4096, 1024, 1, 3357]
    - [148, 9855.18]
  - - [4096, 1024, 1, 3272]
    - [148, 9861.87]
  - - [4096, 1024, 1, 3207]
    - [148, 9847.68]
  - - [4096, 1024, 1, 3894]
    - [148, 9918.76]
  - - [1024, 4096, 1, 3444]
    - [148, 9932.61]
  - - [4096, 1024, 1, 3561]
    - [148, 9872.51]
  - - [4096, 1024, 1, 3376]
    - [148, 9885.49]
  - - [1024, 4096, 1, 3458]
    - [148, 9929.29]
  - - [4096, 1024, 1, 3231]
    - [142, 9846.98]
  - - [64, 228, 272, 228]
    - [143, 7302.59]
  - - [1024, 4096, 1, 3505]
    - [149, 9931.53]
  - - [4096, 1024, 1, 3277]
    - [148, 9857.1]
  - - [64, 21, 2976, 21]
    - [119, 2436.04]
  - - [1024, 4096, 1, 3391]
    - [148, 9911.15]
  - - [64, 32, 1984, 32]
    - [131, 3572.07]
  - - [1024, 4096, 1, 3536]
    - [480, 9867.35]
  - - [1024, 4096, 1, 3063]
    - [148, 9906.82]
  - - [1024, 1024, 1, 3925]
    - [140, 9011.35]
  - - [1024, 4096, 1, 3189]
    - [142, 9900.85]
  - - [1024, 4096, 1, 2505]
    - [148, 9854.75]
  - - [4096, 1024, 1, 3454]
    - [141, 9864.86]
  - - [1024, 4096, 1, 3405]
    - [149, 9906.23]
  - - [1024, 33708, 1, 4050]
    - [142, 10343.6]
  - - [4096, 1024, 1, 3520]
    - [472, 10140.6]
  - - [64, 93, 688, 93]
    - [126, 6222.76]
  - - [1024, 4096, 1, 3487]
    - [149, 9918.59]
  - - [1024, 4096, 1, 3558]
    - [149, 9930.89]
  - - [4096, 1024, 1, 3297]
    - [148, 9874.21]
  - - [1024, 1024, 1, 3840]
    - [476, 7716.01]
  - - [1024, 4096, 1, 3483]
    - [148, 9915.28]
  - - [1024, 1024, 1, 3956]
    - [147, 9009.93]
  - - [1024, 33708, 1, 3751]
    - [142, 10325.8]
  - - [4096, 1024, 1, 3380]
    - [148, 9888.37]
  - - [1024, 4096, 1, 3380]
    - [141, 9927.15]
  - - [1024, 4096, 1, 3396]
    - [149, 9931.86]
  - - [1024, 4096, 1, 3497]
    - [142, 9914.76]
  - - [1024, 4096, 1, 3502]
    - [149, 9921.42]
  - - [1024, 1024, 1, 3976]
    - [144, 9060.2]
  - - [1024, 4096, 1, 3138]
    - [142, 9908.56]
  - - [4096, 1024, 1, 3939]
    - [141, 9910.13]
  - - [1024, 4096, 1, 3303]
    - [142, 9916.54]
  - - [64, 111, 576, 112]
    - [123, 6495.09]
  - - [1024, 4096, 1, 3418]
    - [148, 9913.25]
  - - [1024, 4096, 1, 3224]
    - [472, 10421.1]
  - - [4096, 1024, 1, 3978]
    - [148, 9896.18]
  - - [1024, 4096, 1, 3472]
    - [141, 9937.38]
  - - [4096, 1024, 1, 3353]
    - [149, 9863.87]
  - - [4096, 1024, 1, 3362]
    - [148, 9870.96]
  - - [1024, 33708, 1, 3978]
    - [141, 10325.3]
  - - [64, 100, 624, 102]
    - [118, 5695.57]
  - - [1024, 4096, 1, 3432]
    - [149, 9915.46]
  - - [1024, 4096, 1, 3139]
    - [148, 9914.11]
  - - [1024, 4096, 1, 3341]
    - [149, 9912.0]
  - - [1024, 4096, 1, 3494]
    - [142, 9924.5]
  - - [1024, 4096, 1, 3969]
    - [141, 9952.18]
  - - [1024, 4096, 1, 3163]
    - [149, 9911.69]
  - - [1024, 1024, 1, 3955]
    - [139, 9097.76]
  - - [4096, 1024, 1, 3405]
    - [148, 9853.74]
  - - [1024, 1024, 1, 4030]
    - [139, 9083.76]
  - - [4096, 1024, 1, 3453]
    - [148, 9858.78]
  - - [1024, 4096, 1, 3411]
    - [149, 9926.44]
  - - [1024, 4096, 1, 3527]
    - [142, 9922.55]
  - - [4096, 1024, 1, 3474]
    - [148, 9878.39]
  - - [1024, 4096, 1, 3572]
    - [148, 9931.9]
  - - [4096, 1024, 1, 3293]
    - [148, 9848.16]
  - - [4096, 1024, 1, 3247]
    - [148, 9861.35]
  - - [64, 15, 4096, 15]
    - [130, 1955.65]
  - - [1024, 4096, 1, 3425]
    - [149, 9936.3]
  - - [1024, 4096, 1, 3354]
    - [141, 9917.45]
  - - [4096, 1024, 1, 3382]
    - [148, 9885.39]
  - - [4096, 1024, 1, 3236]
    - [148, 9860.5]
  - - [1024, 4096, 1, 3519]
    - [149, 9919.2]
  - - [4096, 1024, 1, 3354]
    - [148, 9854.65]
  - - [4096, 1024, 1, 3501]
    - [149, 9869.52]
  - - [1024, 1024, 1, 3906]
    - [147, 9104.89]
  - - [4096, 1024, 1, 3266]
    - [148, 9873.87]
  - - [64, 101, 624, 102]
    - [118, 5765.42]
  - - [1024, 4096, 1, 3368]
    - [148, 9909.67]
  - - [1024, 4096, 1, 4030]
    - [149, 9940.17]
  - - [1024, 4096, 1, 3533]
    - [142, 9916.54]
  - - [4096, 1024, 1, 3332]
    - [149, 9876.35]
  - - [4096, 1024, 1, 3584]
    - [472, 10390.1]
  - - [1024, 4096, 1, 3616]
    - [148, 9957.08]
  - - [4096, 1024, 1, 3265]
    - [148, 9877.68]
  - - [4096, 1024, 1, 3361]
    - [148, 9888.51]
  - - [4096, 1024, 1, 3467]
    - [148, 9863.3]
  - - [1024, 4096, 1, 3454]
    - [142, 9904.79]
  - - [1024, 4096, 1, 3101]
    - [149, 9893.02]
  - - [1024, 4096, 1, 3508]
    - [149, 9931.44]
  - - [4096, 1024, 1, 3267]
    - [148, 9864.38]
  - - [64, 54, 1184, 54]
    - [115, 4905.92]
  - - [4096, 1024, 1, 3419]
    - [148, 9872.46]
  - - [4096, 1024, 1, 3822]
    - [148, 9892.53]
  - - [1024, 4096, 1, 3266]
    - [148, 9918.48]
  - - [4096, 1024, 1, 3440]
    - [149, 9890.06]
  - - [1024, 4096, 1, 3361]
    - [148, 9930.87]
  - - [1024, 4096, 1, 3546]
    - [142, 9926.46]
  - - [4096, 1024, 1, 3473]
    - [148, 9888.96]
  - - [4096, 1024, 1, 3546]
    - [149, 9872.17]
  - - [1024, 4096, 1, 3088]
    - [142, 9917.93]
  - - [1024, 4096, 1, 3535]
    - [149, 9921.1]
  - - [1024, 4096, 1, 3447]
    - [149, 9920.53]
  - - [1024, 4096, 1, 3560]
    - [148, 9925.38]
  - - [1024, 4096, 1, 3422]
    - [142, 9922.11]
  - - [1024, 4096, 1, 3469]
    - [141, 9906.08]
  - - [4096, 1024, 1, 3488]
    - [148, 9903.16]
  - - [1024, 4096, 1, 3110]
    - [148, 9906.66]
  - - [1024, 4096, 1, 3265]
    - [149, 9916.59]
  - - [1024, 4096, 1, 3291]
    - [148, 9902.63]
  - - [1024, 4096, 1, 3390]
    - [149, 9907.12]
  - - [4096, 1024, 1, 3046]
    - [148, 9847.58]
  - - [1024, 4096, 1, 3539]
    - [149, 9933.39]
  - - [4096, 1024, 1, 3221]
    - [149, 9860.64]
  - - [4096, 1024, 1, 3433]
    - [148, 9872.64]
  - - [4096, 1024, 1, 3364]
    - [149, 9881.81]
  - - [4096, 1024, 1, 3470]
    - [148, 9858.46]
  - - [1024, 4096, 1, 3404]
    - [141, 9907.17]
  - - [1024, 33708, 1, 3968]
    - [142, 10350.2]
  - - [4096, 1024, 1, 3088]
    - [148, 9868.96]
  - - [1024, 4096, 1, 3247]
    - [148, 9900.92]
  - - [1024, 33708, 1, 3996]
    - [141, 10328.4]
  - - [4096, 1024, 1, 3482]
    - [149, 9866.89]
  - - [1024, 1024, 1, 3796]
    - [144, 9031.58]
  - - [4096, 1024, 1, 3995]
    - [149, 9896.68]
  - - [1024, 1024, 1, 3859]
    - [146, 9097.26]
  - - [1024, 4096, 1, 3280]
    - [142, 9933.95]
  - - [4096, 1024, 1, 3271]
    - [149, 9859.99]
  - - [64, 10, 5952, 10]
    - [130, 1220.92]
  - - [4096, 1024, 1, 3545]
    - [148, 9877.25]
  - - [4096, 1024, 1, 3476]
    - [141, 9882.47]
  - - [4096, 1024, 1, 3496]
    - [142, 9880.4]
  - - [4096, 1024, 1, 3191]
    - [142, 9858.6]
  - - [4096, 1024, 1, 3311]
    - [149, 9853.1]
  - - [1024, 4096, 1, 3302]
    - [149, 9919.22]
  - - [1024, 4096, 1, 3681]
    - [148, 9944.89]
  - - [4096, 1024, 1, 3582]
    - [141, 9869.67]
  - - [4096, 1024, 1, 3421]
    - [149, 9855.98]
  - - [4096, 1024, 1, 3560]
    - [142, 9884.38]
  - - [1024, 4096, 1, 3495]
    - [149, 9930.03]
  - - [4096, 1024, 1, 3186]
    - [148, 9870.49]
  - - [4096, 1024, 1, 3925]
    - [148, 9903.9]
  - - [64, 71, 896, 71]
    - [134, 5004.69]
  - - [1024, 4096, 1, 3435]
    - [149, 9916.48]
  - - [4096, 1024, 1, 3434]
    - [148, 9871.19]
  - - [1024, 33708, 1, 4012]
    - [141, 10332.4]
  - - [1024, 4096, 1, 3340]
    - [141, 9918.01]
  - - [1024, 1024, 1, 3860]
    - [139, 8999.26]
  - - [4096, 1024, 1, 3489]
    - [148, 9881.92]
  - - [1024, 4096, 1, 3162]
    - [149, 9906.18]
  - - [4096, 1024, 1, 3436]
    - [148, 9858.02]
  - - [1024, 1024, 1, 4005]
    - [145, 9042.96]
  - - [64, 84, 752, 84]
    - [119, 5629.83]
  - - [4096, 1024, 1, 3574]
    - [148, 9886.6]
  - - [4096, 1024, 1, 3469]
    - [141, 9856.16]
  - - [1024, 4096, 1, 3410]
    - [142, 9924.64]
  - - [1024, 4096, 1, 3216]
    - [141, 9930.57]
  - - [4096, 1024, 1, 3095]
    - [148, 9846.91]
  - - [1024, 1024, 1, 3990]
    - [147, 9088.94]
  - - [4096, 1024, 1, 3448]
    - [148, 9863.84]
  - - [1024, 4096, 1, 3176]
    - [149, 9913.91]
  - - [64, 49, 1296, 49]
    - [115, 4437.36]
  - - [4096, 1024, 1, 2918]
    - [148, 9830.83]
  - - [64, 14, 4368, 14]
    - [129, 1802.37]
  - - [1024, 4096, 1, 3424]
    - [148, 9933.95]
  - - [4096, 1024, 1, 3402]
    - [141, 9863.02]
  - - [4096, 1024, 1, 3145]
    - [142, 9856.46]
  - - [64, 134, 480, 134]
    - [135, 6183.95]
  - - [1024, 33708, 1, 3976]
    - [142, 10330.0]
  - - [4096, 1024, 1, 3518]
    - [141, 9855.97]
  - - [4096, 1024, 1, 3110]
    - [148, 9856.36]
  - - [4096, 1024, 1, 3325]
    - [148, 9852.26]
  - - [1024, 33708, 1, 3999]
    - [141, 10329.6]
  - - [4096, 1024, 1, 2985]
    - [148, 9837.2]
  - - [1024, 4096, 1, 3371]
    - [141, 9912.93]
  - - [4096, 1024, 1, 3342]
    - [148, 9863.06]
  - - [4096, 1024, 1, 3141]
    - [142, 9849.81]
  - - [4096, 1024, 1, 3532]
    - [142, 9866.2]
  - - [64, 78, 816, 78]
    - [120, 5316.78]
  - - [1024, 4096, 1, 3169]
    - [149, 9910.35]
  - - [1024, 4096, 1, 3514]
    - [148, 9917.9]
  - - [4096, 1024, 1, 3780]
    - [149, 9899.65]
  - - [1024, 4096, 1, 3098]
    - [141, 9901.52]
  - - [1024, 4096, 1, 3449]
    - [149, 9919.75]
  - - [1024, 4096, 1, 3222]
    - [141, 9917.56]
  - - [1024, 4096, 1, 3346]
    - [142, 9912.81]
  - - [4096, 1024, 1, 3064]
    - [149, 9848.69]
  - - [4096, 1024, 1, 3511]
    - [148, 9873.29]
  - - [4096, 1024, 1, 3384]
    - [482, 9805.38]
  - - [4096, 1024, 1, 3356]
    - [142, 9853.35]
  - - [1024, 4096, 1, 3796]
    - [141, 9940.56]
  - - [4096, 1024, 1, 3427]
    - [148, 9883.04]
  - - [4096, 1024, 1, 3390]
    - [148, 9863.69]
  - - [4096, 1024, 1, 3573]
    - [149, 9885.92]
  - - [4096, 1024, 1, 3456]
    - [472, 10386.0]
  - - [1024, 4096, 1, 3360]
    - [472, 9685.52]
  - - [1024, 33708, 1, 3977]
    - [142, 10327.1]
  - - [1024, 4096, 1, 2918]
    - [141, 9902.74]
  - - [4096, 1024, 1, 3975]
    - [148, 9905.17]
  - - [4096, 1024, 1, 3525]
    - [149, 9879.81]
  - - [4096, 1024, 1, 3398]
    - [141, 9873.81]
  - - [4096, 1024, 1, 3640]
    - [148, 9885.06]
  - - [1024, 1024, 1, 3999]
    - [140, 8995.32]
  - - [4096, 1024, 1, 3014]
    - [148, 9841.22]
  - - [1024, 4096, 1, 3446]
    - [141, 9917.11]
  - - [1024, 33708, 1, 3796]
    - [141, 10338.9]
  - - [4096, 1024, 1, 3101]
    - [141, 9827.24]
  - - [4096, 1024, 1, 3563]
    - [149, 9862.93]
  - - [4096, 1024, 1, 3539]
    - [141, 9889.44]
  - - [4096, 1024, 1, 3182]
    - [148, 9833.69]
  - - [1024, 4096, 1, 3468]
    - [142, 9912.95]
  - - [4096, 1024, 1, 3312]
    - [148, 9889.75]
  - - [4096, 1024, 1, 3215]
    - [148, 9853.78]
  - - [4096, 1024, 1, 3910]
    - [148, 9894.62]
  - - [1024, 33708, 1, 3780]
    - [142, 10331.9]
  - - [1024, 4096, 1, 3290]
    - [148, 9914.98]
  - - [1024, 4096, 1, 4012]
    - [148, 9942.55]
  - - [1024, 4096, 1, 3385]
    - [148, 9915.73]
  - - [1024, 33708, 1, 3975]
    - [141, 10330.0]
  - - [4096, 1024, 1, 3996]
    - [148, 9891.21]
  - - [4096, 1024, 1, 2765]
    - [149, 9800.28]
  - - [4096, 1024, 1, 3538]
    - [149, 9886.12]
  - - [4096, 1024, 1, 3415]
    - [149, 9874.5]
  - - [1024, 4096, 1, 3554]
    - [148, 9931.89]
  - - [4096, 1024, 1, 3513]
    - [142, 9874.15]
  - - [1024, 4096, 1, 3304]
    - [142, 9907.63]
  - - [4096, 1024, 1, 3294]
    - [148, 9851.15]
  - - [4096, 1024, 1, 3396]
    - [149, 9880.6]
  - - [1024, 4096, 1, 3213]
    - [142, 9891.02]
  - - [4096, 1024, 1, 3137]
    - [142, 9857.31]
  - - [4096, 1024, 1, 3552]
    - [148, 9904.12]
  - - [1024, 1024, 1, 4020]
    - [147, 9098.77]
  - - [64, 13, 4672, 13]
    - [130, 1693.44]
  - - [1024, 4096, 1, 3461]
    - [148, 9918.35]
  - - [4096, 1024, 1, 3263]
    - [141, 9843.79]
  - - [4096, 1024, 1, 3430]
    - [148, 9885.16]
  - - [4096, 1024, 1, 3389]
    - [148, 9859.13]
  - - [4096, 1024, 1, 3528]
    - [482, 10109.2]
  - - [1024, 4096, 1, 3463]
    - [149, 9929.51]
  - - [4096, 1024, 1, 3526]
    - [149, 9876.8]
  - - [4096, 1024, 1, 3154]
    - [148, 9858.15]
  - - [4096, 1024, 1, 3499]
    - [149, 9862.82]
  - - [1024, 1024, 1, 3939]
    - [147, 9107.31]
  - - [4096, 1024, 1, 3955]
    - [149, 9906.18]
  - - [1024, 4096, 1, 3297]
    - [142, 9925.24]
  - - [1024, 4096, 1, 3233]
    - [148, 9920.55]
  - - [1024, 4096, 1, 3226]
    - [148, 9911.25]
  - - [4096, 1024, 1, 3404]
    - [148, 9867.18]
  - - [4096, 1024, 1, 3355]
    - [148, 9862.56]
  - - [1024, 4096, 1, 3542]
    - [148, 9926.39]
  - - [4096, 1024, 1, 3181]
    - [149, 9831.76]
  - - [1024, 4096, 1, 3474]
    - [148, 9927.93]
  - - [4096, 1024, 1, 3319]
    - [148, 9870.18]
  - - [1024, 4096, 1, 3434]
    - [141, 9917.41]
  - - [1024, 4096, 1, 3860]
    - [148, 9945.22]
  - - [1024, 4096, 1, 3343]
    - [141, 9914.56]
  - - [64, 77, 816, 78]
    - [120, 5276.87]
  - - [1024, 4096, 1, 3488]
    - [148, 9945.71]
  - - [1024, 4096, 1, 3046]
    - [148, 9908.68]
  - - [1024, 4096, 1, 3141]
    - [149, 9909.08]
  - - [1024, 4096, 1, 3516]
    - [149, 9911.28]
  - - [4096, 1024, 1, 3147]
    - [148, 9840.37]
  - - [1024, 1024, 1, 4059]
    - [140, 9009.68]
  - - [1024, 1024, 1, 3944]
    - [140, 9006.07]
  - - [1024, 4096, 1, 3421]
    - [149, 9919.76]
  - - [4096, 1024, 1, 3944]
    - [142, 9899.43]
  - - [64, 45, 1424, 45]
    - [128, 4068.57]
  - - [1024, 4096, 1, 3574]
    - [142, 9930.09]
  - - [1024, 4096, 1, 3977]
    - [141, 9944.18]
  - - [1024, 1024, 1, 3968]
    - [146, 9045.12]
  - - [1024, 4096, 1, 2985]
    - [148, 9887.55]
  - - [64, 193, 320, 193]
    - [136, 6631.25]
  - - [1024, 4096, 1, 3427]
    - [149, 9933.31]
  - - [64, 12, 5040, 12]
    - [130, 1552.43]
  - - [1024, 4096, 1, 3482]
    - [149, 9942.12]
  - - [1024, 4096, 1, 3332]
    - [141, 9923.48]
  - - [1024, 1024, 1, 3720]
    - [145, 9039.46]
  - - [4096, 1024, 1, 3308]
    - [149, 9852.56]
  - - [1024, 4096, 1, 3513]
    - [149, 9919.89]
  - - [1024, 4096, 1, 3154]
    - [142, 9908.36]
  - - [1024, 4096, 1, 3955]
    - [149, 9949.91]
  - - [1024, 4096, 1, 2967]
    - [149, 9897.34]
  - - [1024, 33708, 1, 3942]
    - [141, 10336.0]
  - - [1024, 4096, 1, 3319]
    - [149, 9912.35]
  - - [4096, 1024, 1, 3860]
    - [148, 9909.19]
  - - [1024, 4096, 1, 3548]
    - [141, 9924.11]
  - - [4096, 1024, 1, 3977]
    - [149, 9891.34]
  - - [4096, 1024, 1, 3535]
    - [148, 9867.74]
  - - [1024, 4096, 1, 3541]
    - [149, 9923.06]
  - - [1024, 1024, 1, 3910]
    - [146, 9080.3]
  - - [1024, 33708, 1, 3584]
    - [141, 10332.9]
  - - [1024, 4096, 1, 3168]
    - [476, 9893.61]
  - - [1024, 4096, 1, 3448]
    - [149, 9922.32]
  - - [4096, 1024, 1, 3343]
    - [148, 9857.13]
  - - [64, 35, 1808, 35]
    - [132, 3175.34]
  - - [1024, 4096, 1, 3357]
    - [142, 9902.31]
  - - [64, 143, 432, 143]
    - [133, 6489.6]
  - - [4096, 1024, 1, 3510]
    - [148, 9867.3]
  - - [4096, 1024, 1, 3369]
    - [148, 9863.34]
  - - [64, 92, 688, 93]
    - [120, 6188.2]
  - - [4096, 1024, 1, 3379]
    - [148, 9870.02]
  - - [1024, 4096, 1, 3276]
    - [148, 9904.67]
  - - [1024, 4096, 1, 3363]
    - [148, 9925.03]
  - - [4096, 1024, 1, 3055]
    - [148, 9831.82]
  - - [1024, 4096, 1, 3524]
    - [141, 9923.69]
  - - [4096, 1024, 1, 3057]
    - [148, 9852.77]
  - - [1024, 33708, 1, 3720]
    - [142, 10327.0]
  - - [1024, 4096, 1, 3383]
    - [141, 9919.29]
  - - [1024, 4096, 1, 3522]
    - [142, 9932.46]
  - - [1024, 33708, 1, 3956]
    - [141, 10333.7]
  - - [1024, 4096, 1, 3481]
    - [141, 9921.98]
  - - [4096, 1024, 1, 3562]
    - [149, 9874.76]
  - - [4096, 1024, 1, 3299]
    - [148, 9872.87]
  - - [1024, 4096, 1, 3262]
    - [142, 9924.73]
  - - [1024, 4096, 1, 3840]
    - [478, 9794.98]
  - - [1024, 33708, 1, 4026]
    - [141, 10334.2]
  - - [4096, 1024, 1, 3168]
    - [482, 9373.25]
  - - [64, 101, 624, 101]
    - [123, 5734.62]
  - - [1024, 4096, 1, 3999]
    - [141, 9947.0]
  - - [1024, 4096, 1, 3549]
    - [141, 9923.2]
  - - [4096, 1024, 1, 3375]
    - [148, 9868.79]
  - - [1024, 4096, 1, 3496]
    - [149, 9928.57]
  - - [64, 29, 2176, 29]
    - [119, 3289.92]
  - - [1024, 4096, 1, 3190]
    - [149, 9897.51]
  - - [4096, 1024, 1, 3273]
    - [149, 9853.55]
  - - [1024, 4096, 1, 3406]
    - [148, 9906.94]
  - - [4096, 1024, 1, 4005]
    - [141, 9907.87]
  - - [4096, 1024, 1, 3555]
    - [148, 9878.86]
  - - [4096, 1024, 1, 2505]
    - [148, 9785.0]
  - - [1024, 4096, 1, 3460]
    - [148, 9930.14]
  - - [64, 17, 3632, 17]
    - [120, 1917.17]
  - - [1024, 4096, 1, 3579]
    - [142, 9920.84]
  - - [1024, 33708, 1, 4030]
    - [142, 10327.6]
  - - [1024, 4096, 1, 3510]
    - [142, 9931.21]
  - - [1024, 1024, 1, 3969]
    - [139, 9020.73]
  - - [1024, 4096, 1, 3282]
    - [149, 9919.95]
  - - [1024, 4096, 1, 3377]
    - [141, 9927.24]
  - - [1024, 4096, 1, 2935]
    - [149, 9903.38]
  - - [64, 41, 1552, 41]
    - [120, 3740.38]
  - - [1024, 4096, 1, 3498]
    - [141, 9914.91]
  - - [1024, 4096, 1, 3593]
    - [148, 9925.54]
  - - [1024, 1024, 1, 3948]
    - [147, 9008.93]
  - - [4096, 1024, 1, 3226]
    - [149, 9854.65]
  - - [1024, 4096, 1, 2499]
    - [148, 9904.72]
  - - [1024, 4096, 1, 3296]
    - [141, 9926.79]
  - - [1024, 4096, 1, 3455]
    - [148, 9917.42]
  - - [1024, 4096, 1, 3399]
    - [142, 9919.6]
  - - [1024, 4096, 1, 3205]
    - [141, 9917.64]
  - - [4096, 1024, 1, 4026]
    - [149, 9897.71]
  - - [1024, 4096, 1, 3484]
    - [141, 9915.43]
  - - [4096, 1024, 1, 3302]
    - [149, 9862.7]
  - - [1024, 4096, 1, 3485]
    - [149, 9912.9]
  - - [1024, 1024, 1, 3996]
    - [147, 9008.67]
  - - [1024, 4096, 1, 3126]
    - [142, 9910.06]
  - - [1024, 4096, 1, 4050]
    - [141, 9951.11]
  - - [4096, 1024, 1, 3235]
    - [142, 9870.64]
  - - [1024, 33708, 1, 3955]
    - [141, 10336.0]
  - - [1024, 4096, 1, 3342]
    - [141, 9903.75]
  - - [1024, 1024, 1, 3900]
    - [146, 9082.82]
  - - [1024, 4096, 1, 3397]
    - [149, 9922.6]
  - - [4096, 1024, 1, 3491]
    - [149, 9880.65]
  - - [1024, 4096, 1, 3503]
    - [141, 9923.18]
  - - [1024, 4096, 1, 3140]
    - [142, 9908.31]
  - - [4096, 1024, 1, 3121]
    - [148, 9860.22]
  - - [4096, 1024, 1, 3276]
    - [148, 9854.09]
  - - [1024, 4096, 1, 3321]
    - [149, 9917.76]
  - - [1024, 4096, 1, 3870]
    - [149, 9930.97]
  - - [4096, 1024, 1, 3475]
    - [148, 9877.48]
  - - [1024, 4096, 1, 2984]
    - [148, 9895.49]
  - - [4096, 1024, 1, 3363]
    - [142, 9873.34]
  - - [1024, 4096, 1, 3582]
    - [148, 9920.77]
  - - [4096, 1024, 1, 3509]
    - [148, 9886.76]
  - - [1024, 4096, 1, 3426]
    - [141, 9928.76]
  - - [4096, 1024, 1, 3136]
    - [148, 9872.51]
  - - [1024, 4096, 1, 3232]
    - [149, 9926.19]
  - - [4096, 1024, 1, 3103]
    - [148, 9838.93]
  - - [1024, 4096, 1, 3335]
    - [142, 9913.27]
  - - [1024, 4096, 1, 3900]
    - [141, 9937.91]
  - - [4096, 1024, 1, 3512]
    - [142, 9877.16]
  - - [4096, 1024, 1, 3222]
    - [148, 9859.67]
  - - [1024, 4096, 1, 3165]
    - [148, 9899.61]
  - - [4096, 1024, 1, 3408]
    - [148, 9899.58]
  - - [4096, 1024, 1, 3751]
    - [148, 9891.39]
  - - [1024, 4096, 1, 3318]
    - [141, 9913.32]
  - - [4096, 1024, 1, 3442]
    - [149, 9880.11]
  - - [1024, 4096, 1, 3413]
    - [148, 9921.8]
  - - [4096, 1024, 1, 3524]
    - [148, 9879.12]
  - - [1024, 4096, 1, 3976]
    - [149, 9945.47]
  - - [1024, 4096, 1, 3475]
    - [149, 9932.41]
  - - [1024, 4096, 1, 3534]
    - [141, 9911.39]
  - - [4096, 1024, 1, 3301]
    - [148, 9872.65]
  - - [4096, 1024, 1, 3248]
    - [148, 9878.12]
  - - [1024, 4096, 1, 2977]
    - [142, 9899.83]
  - - [4096, 1024, 1, 3346]
    - [148, 9875.97]
  - - [1024, 4096, 1, 3451]
    - [141, 9920.06]
  - - [1024, 4096, 1, 3257]
    - [142, 9904.92]
  - - [1024, 1024, 1, 3640]
    - [140, 8983.29]
  - - [1024, 4096, 1, 3356]
    - [141, 9904.38]
  - - [4096, 1024, 1, 3348]
    - [149, 9872.43]
  - - [4096, 1024, 1, 3335]
    - [148, 9865.72]
  - - [4096, 1024, 1, 3505]
    - [148, 9888.78]
  - - [1024, 4096, 1, 3490]
    - [141, 9937.9]
  - - [4096, 1024, 1, 3447]
    - [148, 9865.29]
  - - [1024, 4096, 1, 3267]
    - [149, 9919.22]
  - - [4096, 1024, 1, 3230]
    - [148, 9853.1]
  - - [4096, 1024, 1, 3455]
    - [148, 9862.34]
  - - [1024, 4096, 1, 3925]
    - [141, 9945.54]
  - - [1024, 4096, 1, 3362]
    - [142, 9921.53]
  - - [4096, 1024, 1, 3969]
    - [149, 9911.88]
  - - [4096, 1024, 1, 3527]
    - [148, 9882.77]
  - - [1024, 4096, 1, 3585]
    - [142, 9946.42]
  - - [4096, 1024, 1, 3063]
    - [148, 9853.93]
  - - [4096, 1024, 1, 3435]
    - [148, 9867.03]
  - - [4096, 1024, 1, 3366]
    - [149, 9863.92]
  - - [4096, 1024, 1, 3581]
    - [141, 9868.47]
  - - [1024, 33708, 1, 3906]
    - [141, 10339.2]
  - - [1024, 4096, 1, 3464]
    - [149, 9916.11]
  - - [1024, 4096, 1, 3440]
    - [148, 9945.15]
  - - [4096, 1024, 1, 3143]
    - [148, 9846.66]
  - - [1024, 4096, 1, 3349]
    - [142, 9912.73]
  - - [4096, 1024, 1, 3416]
    - [148, 9885.03]
  - - [4096, 1024, 1, 3365]
    - [148, 9875.9]
  - - [1024, 4096, 1, 3470]
    - [149, 9914.88]
  - - [4096, 1024, 1, 3287]
    - [148, 9860.59]
  - - [1024, 4096, 1, 3441]
    - [149, 9928.88]
  - - [4096, 1024, 1, 3224]
    - [472, 10365.5]
  - - [1024, 4096, 1, 3387]
    - [141, 9911.62]
  - - [1024, 4096, 1, 3547]
    - [141, 9920.26]
  - - [4096, 1024, 1, 3478]
    - [142, 9882.8]
  - - [4096, 1024, 1, 3548]
    - [149, 9869.35]
  - - [1024, 33708, 1, 4020]
    - [141, 10345.2]
  - - [4096, 1024, 1, 3320]
    - [148, 9863.64]
  - - [1024, 4096, 1, 3906]
    - [148, 9942.57]
  - - [4096, 1024, 1, 3796]
    - [148, 9899.03]
  - - [1024, 4096, 1, 3306]
    - [141, 9902.3]
  - - [1024, 4096, 1, 3401]
    - [149, 9913.85]
  - - [64, 147, 432, 147]
    - [133, 6626.5]
  - - [1024, 4096, 1, 3215]
    - [149, 9911.14]
  - - [4096, 1024, 1, 4012]
    - [149, 9898.1]
  - - [1024, 4096, 1, 2765]
    - [149, 9863.63]
  - - [4096, 1024, 1, 3554]
    - [142, 9883.42]
  - - [4096, 1024, 1, 3423]
    - [148, 9866.62]
  - - [1024, 1024, 1, 3751]
    - [146, 9006.26]
  - - [1024, 4096, 1, 3562]
    - [142, 9921.98]
  - - [1024, 4096, 1, 3489]
    - [141, 9936.68]
  - - [4096, 1024, 1, 3358]
    - [148, 9858.12]
  - - [4096, 1024, 1, 3270]
    - [149, 9850.74]
  - - [1024, 4096, 1, 3293]
    - [141, 9905.23]
  - - [1024, 4096, 1, 3376]
    - [141, 9934.88]
  - - [4096, 1024, 1, 3245]
    - [148, 9852.42]
  - - [4096, 1024, 1, 3541]
    - [148, 9887.12]
  - - [4096, 1024, 1, 3443]
    - [148, 9871.63]
  - - [4096, 1024, 1, 3438]
    - [149, 9863.76]
  - - [4096, 1024, 1, 3244]
    - [148, 9859.66]
  - - [1024, 4096, 1, 3365]
    - [148, 9922.0]
  - - [1024, 4096, 1, 3299]
    - [142, 9923.28]
  - - [4096, 1024, 1, 3840]
    - [472, 10473.2]
  - - [1024, 4096, 1, 3471]
    - [149, 9918.28]
  - - [1024, 4096, 1, 3398]
    - [141, 9918.89]
  - - [4096, 1024, 1, 3162]
    - [148, 9843.83]
  - - [1024, 4096, 1, 4005]
    - [142, 9947.77]
  - - [4096, 1024, 1, 3579]
    - [148, 9868.15]
  - - [64, 18, 3440, 18]
    - [125, 2059.23]
  - - [64, 177, 352, 177]
    - [143, 7315.3]
  - - [1024, 4096, 1, 3121]
    - [149, 9930.24]
  - - [4096, 1024, 1, 3441]
    - [148, 9883.18]
  - - [4096, 1024, 1, 3422]
    - [148, 9858.31]
  - - [4096, 1024, 1, 3444]
    - [148, 9886.93]
  - - [1024, 4096, 1, 3337]
    - [142, 9911.35]
  - - [4096, 1024, 1, 3550]
    - [141, 9871.77]
  - - [1024, 4096, 1, 3477]
    - [141, 9930.55]
  - - [4096, 1024, 1, 3490]
    - [148, 9878.35]
  - - [4096, 1024, 1, 3585]
    - [148, 9893.53]
  - - [1024, 4096, 1, 3143]
    - [141, 9901.09]
  - - [1024, 33708, 1, 3876]
    - [142, 10330.7]
  - - [1024, 4096, 1, 3320]
    - [149, 9913.08]
  - - [1024, 4096, 1, 3423]
    - [149, 9914.04]
  - - [1024, 4096, 1, 3894]
    - [141, 9944.37]
  - - [4096, 1024, 1, 3410]
    - [148, 9878.57]
  - - [1024, 4096, 1, 3561]
    - [141, 9926.58]
  - - [4096, 1024, 1, 3492]
    - [142, 9872.82]
  - - [64, 85, 752, 85]
    - [120, 5734.25]
  - - [36548, 1024, 1, 3712]
    - [151, 10367.5]
  - - [4096, 2048, 1, 128]
    - [152, 8743.83]
  - - [1024, 1024, 1, 3712]
    - [153, 9976.19]
  - - [1024, 1024, 1, 128]
    - [150, 5765.37]
  - - [4096, 3072, 1, 128]
    - [152, 8869.01]
  - - [768, 3072, 1, 4096]
    - [162, 10028.7]
  - - [64, 256, 192, 256]
    - [158, 8791.55]
  - - [768, 2, 1, 16]
    - [160, 4.95484]
  - - [768, 768, 1, 64]
    - [157, 3469.55]
  - - [768, 768, 1, 4096]
    - [163, 7475.0]
  - - [768, 30522, 1, 1280]
    - [166, 10296.9]
  - - [64, 128, 384, 128]
    - [158, 7660.83]
  - - [768, 30522, 1, 320]
    - [164, 10007.9]
  - - [768, 768, 1, 32]
    - [155, 2359.3]
  - - [3072, 768, 1, 4096]
    - [162, 10033.7]
  - - [768, 30522, 1, 640]
    - [165, 10206.7]
  - - [64, 64, 768, 64]
    - [156, 5494.72]
  - - [768, 768, 1, 640]
    - [163, 6721.64]
  - - [768, 768, 1, 16]
    - [154, 1203.72]
  - - [768, 768, 1, 1280]
    - [161, 7138.57]
  - - [768, 2, 1, 32]
    - [159, 11.8154]
  - - [2048, 2048, 1, 512]
    - [176, 9607.57]
  - - [512, 32, 1, 200]
    - [170, 422.268]
  - - [1024, 1, 1, 200]
    - [173, 24.6154]
  - - [1600, 1024, 1, 512]
    - [168, 8115.91]
  - - [560, 1024, 1, 200]
    - [167, 4810.74]
  - - [2048, 1, 1, 512]
    - [171, 80.9086]
  - - [512, 512, 1, 200]
    - [169, 4398.39]
  - - [100, 2048, 1, 512]
    - [174, 4443.12]
  - - [1024, 1024, 1, 200]
    - [175, 6990.51]
  - - [1024, 64, 1, 512]
    - [172, 2853.27]
  - - [1024, 256, 1, 18944]
    - [195, 9196.41]
  - - [256, 3328, 1, 8976]
    - [185, 8299.26]
  - - [1024, 256, 1, 4352]
    - [193, 8813.74]
  - - [256, 9728, 1, 8976]
    - [188, 9638.48]
  - - [1024, 256, 1, 3072]
    - [195, 8640.63]
  - - [768, 2048, 1, 256]
    - [187, 8662.93]
  - - [1024, 256, 1, 19968]
    - [192, 9220.86]
  - - [256, 12800, 1, 8976]
    - [182, 9418.42]
  - - [1024, 256, 1, 3328]
    - [196, 8682.48]
  - - [256, 10240, 1, 8976]
    - [189, 10137.7]
  - - [1024, 256, 1, 15104]
    - [194, 9167.03]
  - - [256, 10496, 1, 8976]
    - [182, 9858.38]
  - - [1024, 256, 1, 2816]
    - [197, 8575.71]
  - - [1024, 256, 1, 4608]
    - [192, 8861.21]
  - - [256, 11264, 1, 8976]
    - [179, 9627.69]
  - - [1024, 256, 1, 6400]
    - [192, 8985.23]
  - - [1024, 256, 1, 16128]
    - [192, 9170.26]
  - - [256, 44505, 1, 8976]
    - [186, 10331.8]
  - - [256, 6144, 1, 8976]
    - [189, 10395.0]
  - - [1024, 256, 1, 5120]
    - [194, 8881.53]
  - - [1024, 256, 1, 7936]
    - [197, 9023.14]
  - - [256, 3840, 1, 8976]
    - [184, 9541.28]
  - - [1024, 256, 1, 21248]
    - [192, 9209.72]
  - - [1024, 256, 1, 12032]
    - [194, 9156.17]
  - - [256, 8192, 1, 8976]
    - [191, 10374.4]
  - - [1024, 256, 1, 3584]
    - [193, 8712.2]
  - - [1024, 256, 1, 14336]
    - [194, 9162.51]
  - - [256, 7168, 1, 8976]
    - [180, 9554.86]
  - - [1024, 256, 1, 13568]
    - [192, 9165.04]
  - - [256, 4096, 1, 8976]
    - [184, 10146.6]
  - - [1024, 256, 1, 4096]
    - [193, 8783.88]
  - - [256, 2560, 1, 8976]
    - [183, 8381.56]
  - - [256, 20992, 1, 8976]
    - [182, 9989.86]
  - - [256, 4352, 1, 8976]
    - [183, 9634.92]
  - - [256, 33536, 1, 8976]
    - [182, 10218.1]
  - - [256, 3584, 1, 8976]
    - [184, 8924.5]
  - - [256, 26112, 1, 8976]
    - [183, 10272.3]
  - - [256, 14336, 1, 8976]
    - [187, 10217.3]
  - - [1024, 256, 1, 14848]
    - [194, 9185.19]
  - - [1024, 256, 1, 8448]
    - [195, 9025.89]
  - - [1024, 256, 1, 28672]
    - [192, 9256.4]
  - - [1024, 256, 1, 5632]
    - [192, 8932.69]
  - - [256, 22016, 1, 8976]
    - [187, 10151.9]
  - - [1024, 256, 1, 33536]
    - [192, 9243.07]
  - - [256, 5120, 1, 8976]
    - [178, 9418.05]
  - - [256, 11520, 1, 8976]
    - [185, 9701.0]
  - - [256, 19968, 1, 8976]
    - [183, 10228.0]
  - - [1024, 256, 1, 5376]
    - [194, 8892.52]
  - - [1024, 256, 1, 22016]
    - [192, 9244.24]
  - - [256, 8960, 1, 8976]
    - [183, 9841.31]
  - - [1024, 256, 1, 15872]
    - [192, 9223.15]
  - - [256, 17408, 1, 8976]
    - [187, 9785.77]
  - - [256, 5632, 1, 8976]
    - [187, 9564.22]
  - - [256, 32512, 1, 8976]
    - [186, 10357.9]
  - - [256, 11008, 1, 8976]
    - [179, 9445.13]
  - - [1024, 256, 1, 6144]
    - [194, 8955.81]
  - - [256, 4864, 1, 8976]
    - [179, 8979.35]
  - - [256, 15104, 1, 8976]
    - [182, 10007.0]
  - - [1024, 256, 1, 9984]
    - [192, 9110.43]
  - - [256, 1280, 1, 8976]
    - [178, 5944.34]
  - - [1024, 256, 1, 1024]
    - [194, 7005.1]
  - - [1024, 256, 1, 9728]
    - [194, 9066.19]
  - - [1024, 256, 1, 10496]
    - [192, 9118.05]
  - - [256, 11776, 1, 8976]
    - [189, 9911.64]
  - - [256, 12544, 1, 8976]
    - [182, 9235.25]
  - - [1024, 256, 1, 17152]
    - [192, 9152.21]
  - - [1024, 256, 1, 11520]
    - [194, 9146.77]
  - - [1024, 256, 1, 21504]
    - [194, 9207.42]
  - - [256, 17152, 1, 8976]
    - [181, 9654.71]
  - - [1024, 256, 1, 17408]
    - [192, 9181.17]
  - - [256, 15872, 1, 8976]
    - [190, 10086.4]
  - - [256, 18688, 1, 8976]
    - [183, 9612.47]
  - - [256, 5888, 1, 8976]
    - [187, 9988.33]
  - - [512, 2048, 1, 256]
    - [177, 7678.36]
  - - [1024, 256, 1, 7680]
    - [195, 9032.96]
  - - [1024, 256, 1, 1280]
    - [197, 7767.23]
  - - [256, 14848, 1, 8976]
    - [183, 9852.66]
  - - [256, 9984, 1, 8976]
    - [189, 9908.87]
  - - [256, 20480, 1, 8976]
    - [187, 10337.1]
  - - [1024, 256, 1, 8192]
    - [194, 9044.32]
  - - [1024, 256, 1, 19712]
    - [193, 9184.18]
  - - [256, 13568, 1, 8976]
    - [183, 9927.82]
  - - [256, 13312, 1, 8976]
    - [182, 9757.91]
  - - [256, 2816, 1, 8976]
    - [182, 9191.43]
  - - [1024, 256, 1, 2304]
    - [193, 8444.91]
  - - [256, 21248, 1, 8976]
    - [183, 10127.5]
  - - [256, 16128, 1, 8976]
    - [191, 10238.4]
  - - [256, 512, 36, 98]
    - [214, 7994.85]
  - - [64, 192, 36, 25088]
    - [281, 8613.89]
  - - [128, 128, 64, 25]
    - [213, 2540.15]
  - - [256, 256, 64, 56]
    - [214, 6924.56]
  - - [512, 486, 36, 800]
    - [221, 8994.84]
  - - [512, 512, 36, 1568]
    - [231, 9872.38]
  - - [64, 192, 64, 3200]
    - [275, 9295.89]
  - - [256, 384, 36, 4096]
    - [275, 9334.61]
  - - [128, 256, 64, 32]
    - [216, 4279.9]
  - - [64, 128, 64, 23104]
    - [281, 10103.1]
  - - [128, 256, 64, 9]
    - [207, 1709.63]
  - - [256, 512, 36, 784]
    - [217, 9520.73]
  - - [256, 324, 36, 32]
    - [253, 4473.38]
  - - [512, 512, 36, 33]
    - [225, 5925.17]
  - - [16, 32, 36, 5760]
    - [229, 1448.8]
  - - [192, 384, 64, 128]
    - [275, 8618.43]
  - - [512, 512, 64, 72]
    - [232, 8260.12]
  - - [128, 128, 64, 1600]
    - [206, 9008.38]
  - - [512, 512, 36, 128]
    - [275, 8871.62]
  - - [192, 384, 64, 2304]
    - [206, 9657.16]
  - - [384, 256, 64, 450]
    - [240, 9538.93]
  - - [3, 64, 36, 6272]
    - [229, 509.784]
  - - [3, 64, 64, 2888]
    - [257, 708.621]
  - - [384, 256, 64, 2304]
    - [240, 10287.5]
  - - [512, 512, 64, 144]
    - [275, 9226.7]
  - - [256, 256, 36, 6272]
    - [217, 9607.28]
  - - [80, 192, 64, 4608]
    - [276, 7347.93]
  - - [64, 64, 36, 3136]
    - [263, 5959.05]
  - - [256, 384, 64, 2304]
    - [240, 10283.4]
  - - [512, 512, 36, 66]
    - [225, 7618.08]
  - - [128, 256, 64, 800]
    - [250, 9611.15]
  - - [64, 128, 36, 30]
    - [208, 1242.61]
  - - [192, 256, 36, 512]
    - [275, 8657.97]
  - - [256, 512, 64, 200]
    - [275, 9153.87]
  - - [256, 512, 64, 25]
    - [253, 5349.88]
  - - [3, 64, 64, 46208]
    - [256, 808.562]
  - - [128, 256, 36, 1568]
    - [248, 8528.62]
  - - [64, 128, 64, 11552]
    - [281, 9997.0]
  - - [128, 192, 64, 946]
    - [275, 9198.38]
  - - [64, 192, 64, 12800]
    - [236, 9000.66]
  - - [224, 224, 64, 128]
    - [215, 6312.07]
  - - [128, 256, 64, 288]
    - [275, 8697.87]
  - - [64, 64, 64, 826]
    - [220, 6650.21]
  - - [256, 384, 64, 1152]
    - [250, 10106.8]
  - - [3, 64, 64, 92416]
    - [256, 812.031]
  - - [32, 32, 36, 43808]
    - [199, 2813.09]
  - - [160, 320, 64, 288]
    - [209, 8090.86]
  - - [1, 16, 36, 23040]
    - [244, 42.6667]
  - - [128, 256, 36, 128]
    - [224, 6049.48]
  - - [128, 128, 64, 3360]
    - [275, 9199.96]
  - - [128, 128, 64, 420]
    - [275, 8131.5]
  - - [64, 128, 64, 361]
    - [214, 6937.98]
  - - [512, 512, 36, 16]
    - [268, 3797.66]
  - - [384, 256, 36, 800]
    - [211, 9151.65]
  - - [192, 384, 36, 4096]
    - [211, 8867.57]
  - - [64, 64, 64, 1600]
    - [261, 7931.74]
  - - [256, 384, 64, 576]
    - [241, 9745.8]
  - - [512, 512, 64, 14]
    - [225, 3638.18]
  - - [512, 512, 36, 8]
    - [201, 2279.51]
  - - [512, 486, 64, 128]
    - [217, 8337.83]
  - - [1, 16, 64, 640]
    - [249, 49.9512]
  - - [64, 96, 64, 288]
    - [274, 5707.97]
  - - [96, 96, 36, 1568]
    - [243, 6866.75]
  - - [256, 256, 36, 128]
    - [247, 7703.82]
  - - [64, 128, 36, 53824]
    - [235, 6331.31]
  - - [256, 256, 36, 32]
    - [232, 4648.86]
  - - [192, 256, 64, 288]
    - [275, 8987.79]
  - - [256, 256, 36, 16]
    - [245, 2912.71]
  - - [128, 256, 36, 3200]
    - [248, 8680.27]
  - - [160, 320, 64, 512]
    - [209, 8449.44]
  - - [128, 160, 36, 512]
    - [220, 7214.97]
  - - [96, 96, 36, 2592]
    - [215, 7104.79]
  - - [64, 96, 64, 800]
    - [243, 7268.32]
  - - [147, 64, 36, 18816]
    - [259, 7116.26]
  - - [160, 320, 36, 512]
    - [215, 7874.82]
  - - [256, 512, 36, 4]
    - [252, 1034.78]
  - - [96, 128, 64, 946]
    - [235, 7901.07]
  - - [256, 324, 64, 1568]
    - [240, 8589.53]
  - - [128, 128, 64, 50]
    - [232, 4070.56]
  - - [35, 96, 36, 8960]
    - [226, 4207.3]
  - - [32, 64, 36, 43808]
    - [266, 4390.81]
  - - [160, 224, 36, 128]
    - [215, 5446.92]
  - - [64, 64, 64, 81]
    - [238, 2391.18]
  - - [256, 256, 36, 3200]
    - [206, 9559.55]
  - - [256, 256, 36, 210]
    - [217, 8414.61]
  - - [192, 384, 64, 576]
    - [275, 9468.75]
  - - [512, 512, 64, 800]
    - [250, 10096.4]
  - - [512, 24, 36, 800]
    - [203, 4761.77]
  - - [64, 64, 64, 13216]
    - [262, 8491.41]
  - - [192, 224, 64, 1152]
    - [220, 8769.06]
  - - [256, 256, 64, 1152]
    - [240, 9988.09]
  - - [512, 486, 64, 512]
    - [250, 9254.67]
  - - [128, 128, 36, 784]
    - [215, 7468.06]
  - - [256, 512, 64, 1600]
    - [237, 10232.5]
  - - [512, 512, 64, 9]
    - [232, 2599.78]
  - - [96, 128, 64, 288]
    - [243, 6599.43]
  - - [64, 96, 36, 512]
    - [243, 5073.75]
  - - [256, 512, 36, 1568]
    - [275, 9637.81]
  - - [128, 128, 64, 400]
    - [275, 8192.0]
  - - [128, 128, 64, 800]
    - [275, 8716.34]
  - - [96, 128, 36, 512]
    - [263, 6756.93]
  - - [16, 32, 36, 360]
    - [227, 754.036]
  - - [128, 256, 64, 3200]
    - [240, 10222.5]
  - - [96, 128, 64, 800]
    - [243, 7967.9]
  - - [256, 512, 64, 4]
    - [207, 1097.99]
  - - [256, 256, 64, 450]
    - [250, 9347.45]
  - - [64, 64, 64, 3200]
    - [261, 8518.08]
  - - [192, 224, 64, 128]
    - [223, 7035.17]
  - - [128, 128, 64, 288]
    - [275, 7751.28]
  - - [256, 256, 64, 72]
    - [232, 7489.83]
  - - [96, 208, 36, 512]
    - [243, 6939.11]
  - - [128, 256, 36, 3136]
    - [220, 8669.33]
  - - [64, 64, 36, 3520]
    - [215, 6007.47]
  - - [64, 128, 36, 1568]
    - [276, 6897.7]
  - - [160, 320, 64, 242]
    - [204, 7873.17]
  - - [192, 192, 36, 512]
    - [215, 7707.32]
  - - [512, 512, 36, 512]
    - [275, 9582.42]
  - - [1, 16, 64, 10240]
    - [228, 71.3511]
  - - [128, 128, 36, 512]
    - [215, 7149.38]
  - - [512, 512, 36, 256]
    - [206, 9384.4]
  - - [512, 512, 36, 1024]
    - [200, 9777.89]
  - - [96, 208, 64, 1152]
    - [276, 7850.9]
  - - [128, 192, 64, 3200]
    - [206, 9490.82]
  - - [256, 256, 36, 4096]
    - [211, 9585.46]
  - - [160, 160, 64, 288]
    - [243, 7299.8]
  - - [256, 256, 64, 896]
    - [240, 9850.33]
  - - [128, 256, 64, 242]
    - [275, 8391.38]
  - - [128, 128, 36, 440]
    - [220, 6274.72]
  - - [96, 128, 36, 1568]
    - [263, 7875.03]
  - - [192, 384, 36, 1024]
    - [211, 8715.72]
  - - [64, 96, 36, 10368]
    - [280, 7478.59]
  - - [128, 256, 64, 100]
    - [225, 7084.97]
  - - [112, 224, 36, 2048]
    - [219, 7555.92]
  - - [384, 256, 64, 1152]
    - [240, 10102.3]
  - - [192, 384, 36, 128]
    - [275, 7543.04]
  - - [128, 128, 36, 7040]
    - [248, 7600.6]
  - - [128, 256, 64, 1568]
    - [240, 10005.9]
  - - [128, 128, 36, 1568]
    - [233, 7848.3]
  - - [128, 256, 64, 72]
    - [255, 6553.6]
  - - [256, 256, 36, 12544]
    - [269, 9365.04]
  - - [256, 256, 36, 105]
    - [232, 7286.06]
  - - [128, 256, 36, 392]
    - [220, 7625.69]
  - - [64, 64, 64, 5408]
    - [261, 8882.67]
  - - [3, 64, 36, 25088]
    - [229, 528.942]
  - - [384, 256, 36, 1024]
    - [275, 9182.75]
  - - [35, 96, 36, 13440]
    - [282, 4110.29]
  - - [128, 256, 64, 1152]
    - [240, 9804.87]
  - - [256, 324, 64, 32]
    - [253, 5043.63]
  - - [160, 224, 64, 128]
    - [267, 6046.15]
  - - [192, 224, 36, 2592]
    - [265, 8878.68]
  - - [96, 96, 64, 1152]
    - [243, 8035.45]
  - - [32, 64, 36, 90]
    - [202, 964.465]
  - - [64, 128, 64, 2888]
    - [217, 9047.23]
  - - [256, 384, 36, 800]
    - [275, 9154.02]
  - - [512, 512, 64, 4]
    - [272, 1233.62]
  - - [192, 320, 36, 128]
    - [214, 7388.19]
  - - [64, 128, 36, 480]
    - [276, 5653.27]
  - - [192, 384, 64, 242]
    - [275, 9079.99]
  - - [256, 486, 64, 32]
    - [268, 5909.18]
  - - [147, 64, 64, 9702]
    - [277, 7319.69]
  - - [512, 512, 64, 64]
    - [213, 8179.02]
  - - [64, 192, 64, 3698]
    - [206, 9287.89]
  - - [73, 192, 64, 10439]
    - [235, 6668.02]
  - - [1, 16, 36, 1440]
    - [251, 33.4452]
  - - [128, 256, 36, 512]
    - [220, 7989.15]
  - - [512, 512, 64, 576]
    - [250, 9951.89]
  - - [64, 64, 36, 12544]
    - [266, 5872.77]
  - - [128, 128, 36, 880]
    - [263, 7597.26]
  - - [192, 224, 36, 128]
    - [223, 6451.2]
  - - [64, 64, 64, 800]
    - [261, 6916.73]
  - - [64, 128, 36, 12544]
    - [239, 6395.88]
  - - [64, 64, 36, 1568]
    - [215, 5536.66]
  - - [160, 160, 36, 512]
    - [215, 7345.26]
  - - [512, 24, 64, 512]
    - [205, 5242.88]
  - - [3, 64, 36, 3136]
    - [229, 475.352]
  - - [256, 256, 64, 9]
    - [253, 2106.51]
  - - [3, 64, 64, 11552]
    - [256, 785.127]
  - - [128, 256, 36, 12544]
    - [271, 8792.13]
  - - [128, 128, 36, 3136]
    - [233, 8098.46]
  - - [256, 512, 36, 3136]
    - [217, 9694.39]
  - - [64, 64, 36, 196]
    - [230, 2757.76]
  - - [144, 288, 36, 512]
    - [263, 7077.89]
  - - [256, 24, 64, 32]
    - [242, 1483.83]
  - - [384, 384, 36, 800]
    - [206, 9246.5]
  - - [512, 512, 64, 1600]
    - [250, 10277.3]
  - - [112, 224, 36, 512]
    - [220, 6744.78]
  - - [128, 128, 36, 49]
    - [225, 2716.29]
  - - [512, 512, 36, 4]
    - [252, 1156.52]
  - - [35, 96, 64, 4235]
    - [215, 4631.28]
  - - [192, 384, 64, 450]
    - [206, 9372.2]
  - - [256, 256, 36, 1024]
    - [275, 9346.64]
  - - [112, 224, 64, 1152]
    - [220, 7523.95]
  - - [256, 512, 64, 400]
    - [237, 9597.95]
  - - [149, 32, 36, 19072]
    - [282, 5811.8]
  - - [128, 256, 36, 6272]
    - [220, 8754.68]
  - - [128, 192, 36, 1568]
    - [243, 8195.1]
  - - [256, 256, 36, 512]
    - [275, 9074.22]
  - - [256, 256, 64, 112]
    - [275, 8305.55]
  - - [512, 512, 64, 18]
    - [268, 4324.02]
  - - [256, 256, 64, 18]
    - [232, 3547.81]
  - - [256, 256, 64, 1568]
    - [240, 10141.7]
  - - [64, 96, 36, 1568]
    - [261, 6805.66]
  - - [384, 256, 36, 4096]
    - [275, 9311.1]
  - - [256, 512, 64, 800]
    - [250, 9998.35]
  - - [256, 384, 36, 2048]
    - [275, 9285.34]
  - - [3, 64, 36, 200704]
    - [257, 547.375]
  - - [384, 384, 64, 2304]
    - [200, 9901.68]
  - - [160, 320, 64, 128]
    - [234, 7113.81]
  - - [512, 512, 36, 528]
    - [206, 9567.65]
  - - [160, 320, 36, 128]
    - [235, 6411.13]
  - - [96, 96, 64, 800]
    - [243, 7690.01]
  - - [256, 512, 36, 49]
    - [232, 6721.25]
  - - [384, 384, 64, 450]
    - [206, 9523.53]
  - - [3, 64, 64, 23104]
    - [256, 801.621]
  - - [256, 256, 64, 3200]
    - [240, 10300.4]
  - - [128, 192, 36, 512]
    - [220, 7499.75]
  - - [192, 192, 64, 288]
    - [275, 8774.24]
  - - [96, 208, 64, 242]
    - [235, 5901.99]
  - - [256, 16, 36, 3200]
    - [264, 3807.77]
  - - [512, 512, 64, 8]
    - [242, 2379.75]
  - - [64, 128, 64, 5776]
    - [217, 9332.74]
  - - [512, 512, 64, 288]
    - [206, 9521.99]
  - - [256, 16, 36, 32]
    - [260, 766.005]
  - - [128, 192, 64, 288]
    - [275, 8527.58]
  - - [32, 64, 64, 640]
    - [243, 4660.34]
  - - [64, 64, 36, 392]
    - [243, 3686.4]
  - - [384, 384, 36, 1024]
    - [211, 9282.48]
  - - [64, 64, 36, 11552]
    - [273, 5904.78]
  - - [96, 128, 36, 6272]
    - [263, 8350.99]
  - - [128, 256, 36, 16]
    - [245, 2144.81]
  - - [256, 256, 64, 288]
    - [275, 9140.13]
  - - [64, 64, 64, 1652]
    - [261, 7766.53]
  - - [256, 384, 36, 1024]
    - [211, 9203.27]
  - - [96, 128, 64, 3200]
    - [278, 8866.2]
  - - [256, 324, 36, 3200]
    - [219, 8194.25]
  - - [128, 192, 64, 800]
    - [275, 9198.03]
  - - [64, 128, 64, 10]
    - [218, 851.117]
  - - [96, 208, 64, 288]
    - [243, 6667.58]
  - - [64, 96, 36, 2592]
    - [226, 7216.88]
  - - [64, 128, 64, 160]
    - [254, 5190.97]
  - - [192, 384, 64, 512]
    - [206, 9446.04]
  - - [64, 64, 36, 6272]
    - [215, 6212.01]
  - - [512, 24, 36, 288]
    - [212, 3922.47]
  - - [128, 128, 64, 1568]
    - [206, 9037.86]
  - - [112, 224, 64, 242]
    - [274, 6399.26]
  - - [128, 256, 64, 1600]
    - [240, 10010.3]
  - - [32, 32, 64, 20000]
    - [210, 4378.41]
  - - [160, 192, 64, 288]
    - [235, 7803.63]
  - - [512, 24, 64, 128]
    - [198, 3733.8]
  - - [512, 512, 36, 32]
    - [232, 5935.34]
  - - [3, 64, 36, 100352]
    - [229, 542.783]
  - - [3, 64, 64, 1444]
    - [257, 674.159]
  - - [512, 512, 36, 3136]
    - [200, 9921.1]
  - - [128, 256, 64, 6400]
    - [258, 10349.3]
  - - [256, 256, 36, 2048]
    - [275, 9518.99]
  - - [128, 160, 64, 288]
    - [220, 7549.75]
  - - [256, 256, 64, 6400]
    - [240, 10392.6]
  - - [32, 64, 64, 20000]
    - [266, 6493.86]
  - - [256, 256, 36, 1680]
    - [217, 9513.29]
  - - [128, 128, 64, 210]
    - [275, 7094.1]
  - - [192, 384, 36, 2048]
    - [206, 8818.65]
  - - [256, 256, 64, 144]
    - [275, 8608.61]
  - - [384, 384, 36, 4096]
    - [211, 9356.94]
  - - [160, 320, 64, 1152]
    - [235, 8749.48]
  - - [384, 256, 36, 2048]
    - [275, 9279.63]
  - - [256, 512, 36, 392]
    - [275, 9252.14]
  - - [256, 512, 64, 50]
    - [232, 7511.29]
  - - [73, 192, 36, 23360]
    - [279, 5802.93]
  - - [3, 64, 36, 50176]
    - [229, 542.037]
  - - [384, 384, 36, 2048]
    - [206, 9325.8]
  - - [256, 384, 64, 450]
    - [250, 9528.66]
  - - [192, 320, 64, 128]
    - [211, 8399.81]
  - - [128, 256, 36, 32]
    - [225, 3276.8]
  - - [160, 192, 36, 512]
    - [263, 7752.34]
  - - [512, 512, 64, 256]
    - [217, 9473.64]
  - - [256, 512, 64, 32]
    - [253, 6391.32]
  - - [384, 384, 64, 576]
    - [206, 9614.79]
  - - [64, 64, 64, 648]
    - [261, 6282.15]
  - - [512, 486, 36, 288]
    - [275, 8624.93]
  - - [32, 64, 36, 1440]
    - [215, 3961.5]
  - - [144, 288, 64, 242]
    - [235, 6347.02]
  - - [384, 256, 64, 576]
    - [240, 9775.24]
  - - [512, 512, 36, 64]
    - [213, 7791.28]
  - - [448, 384, 64, 128]
    - [206, 9132.23]
  - - [64, 128, 64, 722]
    - [254, 8047.11]
  - - [144, 288, 64, 288]
    - [263, 6859.4]
  - - [512, 512, 64, 224]
    - [275, 9427.29]
  - - [112, 224, 64, 288]
    - [274, 6736.92]
  - - [384, 384, 64, 1152]
    - [200, 9820.46]
  - - [448, 384, 36, 128]
    - [275, 8761.31]
  - - [64, 64, 64, 100]
    - [223, 2708.1]
  - - [256, 486, 36, 128]
    - [247, 7640.04]
  - - [64, 96, 64, 4608]
    - [276, 8351.49]
  - - [16, 32, 64, 160]
    - [202, 736.36]
  - - [64, 192, 36, 6272]
    - [276, 8041.19]
  - - [64, 64, 64, 200]
    - [230, 3924.31]
  - - [256, 256, 36, 800]
    - [275, 9299.55]
  - - [64, 128, 36, 6272]
    - [273, 6816.36]
  - - [32, 64, 64, 40]
    - [222, 885.622]
  - - [256, 16, 64, 32]
    - [270, 1205.26]
  - - [192, 384, 36, 800]
    - [211, 8673.88]
  - - [128, 128, 36, 3200]
    - [243, 8538.89]
  - - [256, 256, 36, 256]
    - [217, 8454.36]
  - - [192, 384, 64, 1152]
    - [206, 9589.01]
  - - [128, 256, 64, 200]
    - [216, 8141.12]
  - - [64, 96, 64, 1152]
    - [243, 7620.88]
  - - [128, 128, 36, 392]
    - [220, 6175.51]
  - - [80, 192, 36, 10368]
    - [266, 6497.16]
  - - [224, 224, 36, 128]
    - [276, 5826.89]
  - - [512, 512, 64, 28]
    - [232, 5728.81]
  - - [256, 16, 64, 1568]
    - [246, 4637.2]
  - - [144, 288, 64, 1152]
    - [263, 7784.24]
  - - [256, 256, 64, 576]
    - [240, 9596.12]
  - - [64, 128, 36, 784]
    - [276, 6058.99]
  - - [256, 24, 36, 128]
    - [212, 2239.84]
  - - [256, 256, 64, 2304]
    - [240, 10225.7]
  - - [192, 384, 36, 512]
    - [275, 8549.03]
  - - [16, 32, 64, 2560]
    - [229, 2153.13]
  - - [256, 512, 36, 32]
    - [253, 5702.23]
  - - [512, 512, 64, 128]
    - [275, 9084.11]
  - - [128, 128, 64, 200]
    - [214, 6971.91]
  - - [512, 512, 64, 32]
    - [225, 6248.5]
  - - [128, 256, 36, 196]
    - [225, 6628.76]
  - - [8, 384, 64, 6600]
    - [256, 2733.89]
  - - [149, 32, 64, 8195]
    - [220, 6050.91]
  - - [35, 96, 64, 6160]
    - [263, 4689.35]
  - - [64, 64, 36, 1760]
    - [215, 5622.24]
  - - [196, 528, 32, 32]
    - [296, 4088.41]
  - - [5329, 64, 32, 80]
    - [289, 8331.14]
  - - [64, 2880, 1, 320]
    - [334, 4362.6]
  - - [49, 832, 32, 256]
    - [301, 5618.63]
  - - [196, 512, 32, 24]
    - [290, 3621.73]
  - - [289, 1120, 1, 160]
    - [286, 3302.86]
  - - [1225, 192, 32, 32]
    - [294, 6194.57]
  - - [64, 2048, 32, 384]
    - [314, 9541.54]
  - - [1001, 1536, 1, 32]
    - [288, 3575.67]
  - - [289, 1792, 1, 320]
    - [309, 5140.33]
  - - [1001, 1024, 1, 32]
    - [283, 2733.4]
  - - [196, 480, 32, 64]
    - [338, 5070.42]
  - - [64, 1728, 1, 320]
    - [335, 3205.57]
  - - [49, 832, 32, 160]
    - [339, 4988.82]
  - - [49, 832, 32, 384]
    - [301, 5901.95]
  - - [289, 896, 1, 192]
    - [325, 3452.59]
  - - [289, 1024, 32, 384]
    - [342, 8902.42]
  - - [784, 192, 32, 96]
    - [352, 7853.63]
  - - [50176, 256, 1, 128]
    - [318, 9041.83]
  - - [289, 1024, 32, 256]
    - [350, 8660.72]
  - - [289, 1024, 32, 192]
    - [340, 8433.35]
  - - [12544, 512, 1, 256]
    - [304, 9187.34]
  - - [1225, 1728, 1, 192]
    - [308, 7720.85]
  - - [196, 480, 32, 96]
    - [349, 5662.5]
  - - [196, 512, 32, 144]
    - [343, 6531.38]
  - - [784, 400, 1, 32]
    - [284, 1280.0]
  - - [289, 768, 32, 128]
    - [344, 7913.61]
  - - [5329, 576, 1, 96]
    - [293, 7563.46]
  - - [49, 1200, 1, 128]
    - [332, 1011.61]
  - - [64, 1536, 32, 256]
    - [345, 9159.54]
  - - [289, 2592, 1, 384]
    - [315, 6002.71]
  - - [196, 528, 32, 128]
    - [348, 5987.1]
  - - [64, 2048, 32, 448]
    - [314, 9669.87]
  - - [5329, 448, 1, 64]
    - [289, 6201.02]
  - - [784, 256, 32, 64]
    - [291, 7623.18]
  - - [784, 192, 32, 32]
    - [296, 5874.26]
  - - [21609, 288, 1, 32]
    - [307, 5296.5]
  - - [784, 256, 32, 32]
    - [287, 6235.46]
  - - [5041, 720, 1, 192]
    - [303, 8140.98]
  - - [289, 2016, 1, 256]
    - [300, 5404.05]
  - - [196, 512, 32, 128]
    - [341, 6366.82]
  - - [289, 768, 32, 160]
    - [343, 8253.88]
  - - [64, 1536, 32, 384]
    - [316, 9508.5]
  - - [64, 1280, 32, 320]
    - [316, 9070.73]
  - - [289, 896, 1, 128]
    - [326, 2917.68]
  - - [289, 3456, 1, 384]
    - [308, 7274.91]
  - - [196, 800, 1, 64]
    - [328, 1393.78]
  - - [64, 1280, 32, 384]
    - [313, 9225.01]
  - - [64, 1344, 1, 512]
    - [330, 3041.45]
  - - [1001, 4096, 1, 512]
    - [313, 9391.77]
  - - [1225, 192, 32, 64]
    - [289, 7729.29]
  - - [64, 1152, 1, 384]
    - [333, 2440.65]
  - - [729, 1600, 1, 192]
    - [299, 6827.71]
  - - [289, 1344, 1, 192]
    - [298, 4439.04]
  - - [784, 192, 32, 16]
    - [322, 3663.04]
  - - [3136, 1024, 1, 2048]
    - [306, 9071.77]
  - - [64, 1152, 1, 448]
    - [331, 2564.45]
  - - [49, 832, 32, 128]
    - [298, 4733.16]
  - - [784, 256, 32, 128]
    - [310, 8471.6]
  - - [49, 800, 1, 128]
    - [329, 633.535]
  - - [196, 512, 32, 32]
    - [296, 4354.26]
  - - [1225, 384, 32, 96]
    - [311, 8751.63]
  - - [5041, 576, 1, 96]
    - [295, 7067.63]
  - - [49, 832, 32, 48]
    - [324, 3316.72]
  - - [5329, 160, 32, 64]
    - [346, 8159.84]
  - - [1225, 288, 32, 48]
    - [336, 6673.65]
  - - [4096, 9216, 1, 512]
    - [320, 10116.9]
  - - [196, 480, 32, 192]
    - [347, 6388.46]
  - - [64, 1152, 1, 256]
    - [334, 1982.6]
  - - [3136, 1024, 1, 512]
    - [306, 8745.57]
  - - [49, 832, 32, 32]
    - [323, 2717.87]
  - - [784, 192, 32, 64]
    - [291, 7216.32]
  - - [289, 1024, 32, 128]
    - [312, 7970.5]
  - - [289, 768, 32, 192]
    - [351, 8327.27]
  - - [289, 1120, 1, 192]
    - [297, 3716.9]
  - - [196, 512, 32, 112]
    - [302, 6252.81]
  - - [1001, 2048, 1, 32]
    - [292, 4000.09]
  - - [1225, 288, 32, 64]
    - [346, 7208.04]
  - - [196, 600, 1, 64]
    - [327, 1093.95]
  - - [1225, 384, 32, 192]
    - [311, 9332.66]
  - - [50176, 256, 1, 512]
    - [319, 9833.54]
  - - [196, 512, 32, 160]
    - [344, 6614.34]
  - - [4096, 4096, 1, 512]
    - [317, 10032.2]
  - - [49, 832, 32, 192]
    - [298, 5244.53]
  - - [1225, 256, 32, 64]
    - [289, 7972.35]
  - - [64, 2048, 32, 320]
    - [314, 9404.27]
  - - [196, 480, 32, 16]
    - [337, 2724.49]
  - - [1225, 256, 32, 48]
    - [291, 7100.38]
  - - [64, 1280, 32, 448]
    - [313, 9344.41]
  - - [1225, 1200, 1, 64]
    - [285, 5157.89]
  - - [1225, 384, 32, 64]
    - [289, 8219.96]
  - - [12544, 512, 1, 1024]
    - [306, 9672.72]
  - - [64, 1280, 32, 192]
    - [302, 8525.01]
  - - [196, 512, 32, 64]
    - [289, 5489.34]
  - - [289, 1792, 1, 256]
    - [305, 4831.61]
  - - [196, 528, 32, 256]
    - [321, 6453.82]
  - - [64, 2048, 32, 192]
    - [310, 8955.81]
  - - [196, 528, 32, 160]
    - [347, 6161.15]
  - - [1225, 192, 32, 48]
    - [289, 7236.92]
  - - [64, 1728, 1, 192]
    - [333, 2480.57]
  - - [1001, 2048, 1, 64]
    - [356, 5714.42]
  - - [5329, 64, 128, 80]
    - [363, 8835.29]
  - - [64, 1280, 128, 448]
    - [361, 10020.5]
  - - [289, 768, 128, 128]
    - [364, 8542.71]
  - - [1225, 192, 128, 64]
    - [353, 8444.77]
  - - [1225, 288, 128, 48]
    - [366, 7244.66]
  - - [289, 768, 128, 192]
    - [368, 8794.49]
  - - [289, 768, 128, 160]
    - [365, 8705.33]
  - - [64, 2048, 128, 192]
    - [359, 9780.26]
  - - [64, 1280, 128, 384]
    - [362, 9950.9]
  - - [1225, 256, 128, 48]
    - [354, 8273.61]
  - - [1225, 192, 128, 48]
    - [354, 8140.32]
  - - [1225, 288, 128, 64]
    - [366, 7886.21]
  - - [64, 1280, 128, 320]
    - [358, 9894.56]
  - - [1225, 256, 128, 64]
    - [359, 8572.51]
  - - [1001, 2048, 1, 128]
    - [360, 7289.06]
  - - [1225, 192, 128, 32]
    - [355, 7104.57]
  - - [64, 1280, 128, 192]
    - [367, 9642.08]
  - - [1001, 1536, 1, 64]
    - [357, 5146.56]
  - - [2048, 2048, 1, 1024]
    - [371, 9940.21]
  - - [3200, 2048, 1, 1024]
    - [370, 9899.24]
  - - [4096, 4096, 1, 1024]
    - [372, 10222.2]
  - - [2048, 256, 1, 1024]
    - [369, 8452.0]
  - - [257, 4096, 1, 1024]
    - [370, 8353.5]
  - - [65, 1024, 1, 6400]
    - [376, 3556.98]
  - - [256, 4096, 1, 6400]
    - [377, 10132.4]
  - - [1024, 4096, 1, 64]
    - [378, 6918.44]
  - - [1024, 4096, 1, 6336]
    - [472, 10341.4]
  - - [512, 2048, 1, 2790]
    - [384, 9862.21]
  - - [512, 2048, 1, 3509]
    - [388, 9976.82]
  - - [512, 2048, 1, 3528]
    - [385, 9998.31]
  - - [2048, 512, 1, 3364]
    - [387, 9984.74]
  - - [2048, 512, 1, 3418]
    - [385, 9988.94]
  - - [2048, 512, 1, 3487]
    - [387, 10005.4]
  - - [2048, 512, 1, 4032]
    - [385, 10047.2]
  - - [512, 512, 1, 3977]
    - [393, 8746.2]
  - - [512, 512, 1, 4032]
    - [393, 8849.34]
  - - [64, 38, 840, 38]
    - [406, 3041.91]
  - - [64, 49, 648, 49]
    - [397, 3715.46]
  - - [512, 2048, 1, 2864]
    - [387, 9944.11]
  - - [512, 2048, 1, 3092]
    - [387, 9947.83]
  - - [512, 2048, 1, 3113]
    - [384, 9978.65]
  - - [512, 2048, 1, 3137]
    - [385, 9960.58]
  - - [512, 2048, 1, 3165]
    - [387, 9967.39]
  - - [512, 2048, 1, 3166]
    - [385, 9953.82]
  - - [512, 2048, 1, 3194]
    - [385, 9955.88]
  - - [512, 2048, 1, 3219]
    - [385, 9979.22]
  - - [512, 2048, 1, 3222]
    - [385, 9972.01]
  - - [512, 2048, 1, 3234]
    - [383, 9966.77]
  - - [512, 2048, 1, 3237]
    - [385, 9954.97]
  - - [512, 2048, 1, 3242]
    - [387, 9960.98]
  - - [512, 2048, 1, 3246]
    - [385, 9959.28]
  - - [512, 2048, 1, 3249]
    - [385, 9966.13]
  - - [512, 2048, 1, 3251]
    - [385, 9976.94]
  - - [512, 2048, 1, 3257]
    - [387, 9967.35]
  - - [512, 2048, 1, 3262]
    - [387, 9947.81]
  - - [512, 2048, 1, 3268]
    - [385, 9954.53]
  - - [512, 2048, 1, 3282]
    - [387, 9962.46]
  - - [512, 2048, 1, 3286]
    - [384, 9942.35]
  - - [512, 2048, 1, 3287]
    - [387, 9961.47]
  - - [512, 2048, 1, 3293]
    - [387, 9956.65]
  - - [512, 2048, 1, 3297]
    - [385, 9980.24]
  - - [512, 2048, 1, 3307]
    - [385, 9982.84]
  - - [512, 2048, 1, 3314]
    - [384, 9971.82]
  - - [512, 2048, 1, 3315]
    - [387, 9984.0]
  - - [512, 2048, 1, 3319]
    - [385, 9970.84]
  - - [512, 2048, 1, 3322]
    - [385, 9973.01]
  - - [512, 2048, 1, 3323]
    - [385, 9976.0]
  - - [512, 2048, 1, 3324]
    - [387, 9958.48]
  - - [512, 2048, 1, 3325]
    - [384, 9972.87]
  - - [512, 2048, 1, 3327]
    - [385, 9976.59]
  - - [512, 2048, 1, 3329]
    - [385, 9982.58]
  - - [512, 2048, 1, 3332]
    - [385, 9984.73]
  - - [512, 2048, 1, 3336]
    - [385, 9976.19]
  - - [512, 2048, 1, 3339]
    - [385, 9992.0]
  - - [512, 2048, 1, 3342]
    - [385, 9975.92]
  - - [512, 2048, 1, 3344]
    - [385, 9970.54]
  - - [512, 2048, 1, 3358]
    - [384, 9964.68]
  - - [512, 2048, 1, 3360]
    - [387, 9993.24]
  - - [512, 2048, 1, 3364]
    - [385, 9964.43]
  - - [512, 2048, 1, 3365]
    - [387, 9980.93]
  - - [512, 2048, 1, 3369]
    - [387, 9986.01]
  - - [512, 2048, 1, 3371]
    - [385, 9967.15]
  - - [512, 2048, 1, 3374]
    - [383, 9958.05]
  - - [512, 2048, 1, 3376]
    - [383, 9979.68]
  - - [512, 2048, 1, 3377]
    - [387, 9978.14]
  - - [512, 2048, 1, 3378]
    - [385, 9969.85]
  - - [512, 2048, 1, 3381]
    - [383, 9971.97]
  - - [512, 2048, 1, 3382]
    - [387, 9979.41]
  - - [512, 2048, 1, 3383]
    - [385, 9980.12]
  - - [512, 2048, 1, 3384]
    - [387, 10001.1]
  - - [512, 2048, 1, 3385]
    - [383, 9968.07]
  - - [512, 2048, 1, 3386]
    - [383, 9991.22]
  - - [512, 2048, 1, 3388]
    - [385, 9965.71]
  - - [512, 2048, 1, 3390]
    - [387, 9980.55]
  - - [512, 2048, 1, 3391]
    - [385, 9972.29]
  - - [512, 2048, 1, 3396]
    - [387, 9989.24]
  - - [512, 2048, 1, 3399]
    - [384, 9955.61]
  - - [512, 2048, 1, 3402]
    - [385, 9980.01]
  - - [512, 2048, 1, 3410]
    - [383, 9978.91]
  - - [512, 2048, 1, 3412]
    - [385, 9987.0]
  - - [512, 2048, 1, 3414]
    - [387, 9970.58]
  - - [512, 2048, 1, 3415]
    - [384, 9973.5]
  - - [512, 2048, 1, 3418]
    - [385, 9971.16]
  - - [512, 2048, 1, 3420]
    - [387, 9990.33]
  - - [512, 2048, 1, 3422]
    - [384, 9989.5]
  - - [512, 2048, 1, 3425]
    - [387, 9976.05]
  - - [512, 2048, 1, 3426]
    - [385, 9976.73]
  - - [512, 2048, 1, 3427]
    - [385, 9975.21]
  - - [512, 2048, 1, 3428]
    - [385, 9975.91]
  - - [512, 2048, 1, 3430]
    - [385, 9977.3]
  - - [512, 2048, 1, 3431]
    - [387, 9962.52]
  - - [512, 2048, 1, 3432]
    - [387, 10003.1]
  - - [512, 2048, 1, 3438]
    - [385, 9989.48]
  - - [512, 2048, 1, 3439]
    - [385, 9972.49]
  - - [512, 2048, 1, 3440]
    - [385, 10015.3]
  - - [512, 2048, 1, 3443]
    - [385, 9997.38]
  - - [512, 2048, 1, 3445]
    - [385, 9998.74]
  - - [512, 2048, 1, 3447]
    - [383, 9971.42]
  - - [512, 2048, 1, 3448]
    - [383, 9983.13]
  - - [512, 2048, 1, 3450]
    - [385, 9980.1]
  - - [512, 2048, 1, 3451]
    - [387, 9980.79]
  - - [512, 2048, 1, 3452]
    - [387, 9981.48]
  - - [512, 2048, 1, 3453]
    - [384, 9975.57]
  - - [512, 2048, 1, 3455]
    - [385, 9981.35]
  - - [512, 2048, 1, 3456]
    - [383, 10012.9]
  - - [512, 2048, 1, 3457]
    - [387, 9982.73]
  - - [512, 2048, 1, 3458]
    - [385, 10003.2]
  - - [512, 2048, 1, 3459]
    - [385, 9988.5]
  - - [512, 2048, 1, 3460]
    - [387, 9969.42]
  - - [512, 2048, 1, 3461]
    - [383, 9996.48]
  - - [512, 2048, 1, 3462]
    - [384, 9983.97]
  - - [512, 2048, 1, 3466]
    - [387, 9993.3]
  - - [512, 2048, 1, 3467]
    - [384, 9989.59]
  - - [512, 2048, 1, 3468]
    - [388, 9983.7]
  - - [512, 2048, 1, 3470]
    - [385, 9993.84]
  - - [512, 2048, 1, 3471]
    - [387, 9985.75]
  - - [512, 2048, 1, 3472]
    - [384, 10010.6]
  - - [512, 2048, 1, 3475]
    - [385, 9990.68]
  - - [512, 2048, 1, 3476]
    - [385, 9989.18]
  - - [512, 2048, 1, 3477]
    - [387, 9989.86]
  - - [512, 2048, 1, 3478]
    - [385, 9973.06]
  - - [512, 2048, 1, 3479]
    - [387, 9971.56]
  - - [512, 2048, 1, 3480]
    - [387, 9996.29]
  - - [512, 2048, 1, 3481]
    - [384, 9979.48]
  - - [512, 2048, 1, 3483]
    - [385, 9998.33]
  - - [512, 2048, 1, 3484]
    - [387, 10003.4]
  - - [512, 2048, 1, 3487]
    - [383, 9974.86]
  - - [512, 2048, 1, 3489]
    - [387, 9982.76]
  - - [512, 2048, 1, 3490]
    - [385, 9983.44]
  - - [512, 2048, 1, 3491]
    - [387, 9999.4]
  - - [512, 2048, 1, 3493]
    - [385, 9994.2]
  - - [512, 2048, 1, 3494]
    - [387, 9975.29]
  - - [512, 2048, 1, 3495]
    - [384, 9975.97]
  - - [512, 2048, 1, 3497]
    - [385, 9994.74]
  - - [512, 2048, 1, 3498]
    - [387, 10002.0]
  - - [512, 2048, 1, 3499]
    - [384, 10000.5]
  - - [512, 2048, 1, 3501]
    - [385, 9997.45]
  - - [512, 2048, 1, 3503]
    - [387, 9977.08]
  - - [512, 2048, 1, 3507]
    - [385, 9999.34]
  - - [512, 2048, 1, 3508]
    - [385, 9978.31]
  - - [512, 2048, 1, 3511]
    - [387, 9976.02]
  - - [512, 2048, 1, 3514]
    - [385, 9988.89]
  - - [512, 2048, 1, 3515]
    - [385, 9989.55]
  - - [512, 2048, 1, 3517]
    - [387, 9993.07]
  - - [512, 2048, 1, 3518]
    - [385, 9976.44]
  - - [512, 2048, 1, 3519]
    - [385, 9992.27]
  - - [512, 2048, 1, 3520]
    - [387, 10003.8]
  - - [512, 2048, 1, 3523]
    - [387, 9997.11]
  - - [512, 2048, 1, 3529]
    - [387, 9992.51]
  - - [512, 2048, 1, 3530]
    - [387, 9997.5]
  - - [512, 2048, 1, 3532]
    - [385, 10001.0]
  - - [512, 2048, 1, 3533]
    - [387, 9988.73]
  - - [512, 2048, 1, 3534]
    - [385, 10002.3]
  - - [512, 2048, 1, 3538]
    - [384, 9992.09]
  - - [512, 2048, 1, 3539]
    - [384, 9979.86]
  - - [512, 2048, 1, 3541]
    - [383, 9991.95]
  - - [512, 2048, 1, 3547]
    - [387, 9993.82]
  - - [512, 2048, 1, 3548]
    - [385, 9990.19]
  - - [512, 2048, 1, 3552]
    - [385, 9988.58]
  - - [512, 2048, 1, 3564]
    - [383, 9998.74]
  - - [512, 2048, 1, 3575]
    - [385, 9999.62]
  - - [512, 2048, 1, 3598]
    - [384, 9997.82]
  - - [512, 2048, 1, 3599]
    - [387, 9979.44]
  - - [512, 2048, 1, 3608]
    - [385, 10017.1]
  - - [512, 2048, 1, 3780]
    - [385, 9990.97]
  - - [512, 2048, 1, 3796]
    - [385, 10003.0]
  - - [512, 2048, 1, 3822]
    - [385, 10027.2]
  - - [512, 2048, 1, 3840]
    - [385, 10028.2]
  - - [512, 2048, 1, 3859]
    - [385, 10019.9]
  - - [512, 2048, 1, 3870]
    - [387, 10002.9]
  - - [512, 2048, 1, 3876]
    - [383, 10010.5]
  - - [512, 2048, 1, 3906]
    - [387, 10020.9]
  - - [512, 2048, 1, 3910]
    - [385, 10025.3]
  - - [512, 2048, 1, 3925]
    - [384, 10008.9]
  - - [512, 2048, 1, 3942]
    - [385, 10032.7]
  - - [512, 2048, 1, 3944]
    - [384, 10049.5]
  - - [512, 2048, 1, 3955]
    - [387, 10032.7]
  - - [512, 2048, 1, 3968]
    - [383, 10021.1]
  - - [512, 2048, 1, 3969]
    - [387, 10021.7]
  - - [512, 2048, 1, 3976]
    - [387, 10051.0]
  - - [512, 2048, 1, 3977]
    - [387, 10036.1]
  - - [512, 2048, 1, 3978]
    - [387, 10042.5]
  - - [512, 2048, 1, 3990]
    - [385, 10032.2]
  - - [512, 2048, 1, 3995]
    - [383, 10031.3]
  - - [512, 2048, 1, 3996]
    - [385, 10039.6]
  - - [512, 2048, 1, 3999]
    - [385, 10020.2]
  - - [512, 2048, 1, 4005]
    - [384, 10016.1]
  - - [512, 2048, 1, 4012]
    - [384, 10014.5]
  - - [512, 2048, 1, 4020]
    - [383, 10017.3]
  - - [512, 2048, 1, 4026]
    - [387, 10032.2]
  - - [512, 2048, 1, 4030]
    - [387, 10015.6]
  - - [512, 2048, 1, 4032]
    - [384, 10035.7]
  - - [512, 33708, 1, 3780]
    - [385, 10489.1]
  - - [512, 33708, 1, 3796]
    - [385, 10482.9]
  - - [512, 33708, 1, 3822]
    - [385, 10485.1]
  - - [512, 33708, 1, 3840]
    - [386, 10490.3]
  - - [512, 33708, 1, 3859]
    - [388, 10491.1]
  - - [512, 33708, 1, 3870]
    - [385, 10493.2]
  - - [512, 33708, 1, 3876]
    - [385, 10494.3]
  - - [512, 33708, 1, 3906]
    - [387, 10489.8]
  - - [512, 33708, 1, 3910]
    - [387, 10494.9]
  - - [512, 33708, 1, 3925]
    - [385, 10490.7]
  - - [512, 33708, 1, 3942]
    - [387, 10494.9]
  - - [512, 33708, 1, 3944]
    - [385, 10497.5]
  - - [512, 33708, 1, 3955]
    - [385, 10498.6]
  - - [512, 33708, 1, 3968]
    - [387, 10504.5]
  - - [512, 33708, 1, 3969]
    - [387, 10501.1]
  - - [512, 33708, 1, 3976]
    - [385, 10504.4]
  - - [512, 33708, 1, 3977]
    - [386, 10495.7]
  - - [512, 33708, 1, 3978]
    - [385, 10497.1]
  - - [512, 33708, 1, 3990]
    - [387, 10499.7]
  - - [512, 33708, 1, 3995]
    - [387, 10492.2]
  - - [512, 33708, 1, 3996]
    - [385, 10494.7]
  - - [512, 33708, 1, 3999]
    - [387, 10493.0]
  - - [512, 33708, 1, 4005]
    - [387, 10499.9]
  - - [512, 33708, 1, 4012]
    - [387, 10500.8]
  - - [512, 33708, 1, 4020]
    - [385, 10499.7]
  - - [512, 33708, 1, 4026]
    - [385, 10491.3]
  - - [512, 33708, 1, 4030]
    - [386, 10498.7]
  - - [512, 33708, 1, 4032]
    - [387, 10501.5]
  - - [2048, 512, 1, 2790]
    - [386, 9910.32]
  - - [2048, 512, 1, 2864]
    - [387, 9936.21]
  - - [2048, 512, 1, 3092]
    - [387, 9964.95]
  - - [2048, 512, 1, 3113]
    - [385, 9968.9]
  - - [2048, 512, 1, 3137]
    - [387, 9960.58]
  - - [2048, 512, 1, 3165]
    - [385, 9972.18]
  - - [2048, 512, 1, 3166]
    - [387, 9965.75]
  - - [2048, 512, 1, 3194]
    - [385, 9972.46]
  - - [2048, 512, 1, 3219]
    - [385, 9969.77]
  - - [2048, 512, 1, 3222]
    - [385, 9960.24]
  - - [2048, 512, 1, 3234]
    - [387, 9973.81]
  - - [2048, 512, 1, 3237]
    - [385, 9964.3]
  - - [2048, 512, 1, 3242]
    - [387, 9986.73]
  - - [2048, 512, 1, 3246]
    - [387, 9968.6]
  - - [2048, 512, 1, 3249]
    - [385, 9984.83]
  - - [2048, 512, 1, 3251]
    - [387, 9979.28]
  - - [2048, 512, 1, 3257]
    - [385, 9981.33]
  - - [2048, 512, 1, 3262]
    - [385, 9980.32]
  - - [2048, 512, 1, 3268]
    - [385, 9970.75]
  - - [2048, 512, 1, 3282]
    - [387, 9985.57]
  - - [2048, 512, 1, 3286]
    - [387, 9969.97]
  - - [2048, 512, 1, 3287]
    - [385, 9966.08]
  - - [2048, 512, 1, 3293]
    - [387, 9977.35]
  - - [2048, 512, 1, 3297]
    - [385, 9982.55]
  - - [2048, 512, 1, 3307]
    - [385, 9978.25]
  - - [2048, 512, 1, 3314]
    - [385, 9978.7]
  - - [2048, 512, 1, 3315]
    - [385, 9986.29]
  - - [2048, 512, 1, 3319]
    - [387, 9977.71]
  - - [2048, 512, 1, 3322]
    - [385, 9991.31]
  - - [2048, 512, 1, 3323]
    - [385, 9987.44]
  - - [2048, 512, 1, 3324]
    - [387, 9979.0]
  - - [2048, 512, 1, 3325]
    - [387, 9979.72]
  - - [2048, 512, 1, 3327]
    - [387, 9974.3]
  - - [2048, 512, 1, 3329]
    - [387, 9991.73]
  - - [2048, 512, 1, 3332]
    - [385, 9968.77]
  - - [2048, 512, 1, 3336]
    - [385, 10003.6]
  - - [2048, 512, 1, 3339]
    - [385, 9989.72]
  - - [2048, 512, 1, 3342]
    - [387, 9987.29]
  - - [2048, 512, 1, 3344]
    - [385, 10002.4]
  - - [2048, 512, 1, 3358]
    - [387, 9985.02]
  - - [2048, 512, 1, 3360]
    - [385, 9997.77]
  - - [2048, 512, 1, 3365]
    - [385, 9989.97]
  - - [2048, 512, 1, 3369]
    - [387, 9997.32]
  - - [2048, 512, 1, 3371]
    - [387, 9994.2]
  - - [2048, 512, 1, 3374]
    - [385, 9985.03]
  - - [2048, 512, 1, 3376]
    - [387, 9995.46]
  - - [2048, 512, 1, 3377]
    - [385, 9989.4]
  - - [2048, 512, 1, 3378]
    - [385, 10001.4]
  - - [2048, 512, 1, 3381]
    - [387, 9983.2]
  - - [2048, 512, 1, 3382]
    - [385, 9986.16]
  - - [2048, 512, 1, 3383]
    - [387, 9984.61]
  - - [2048, 512, 1, 3384]
    - [385, 10010.1]
  - - [2048, 512, 1, 3385]
    - [385, 9995.02]
  - - [2048, 512, 1, 3386]
    - [385, 9979.98]
  - - [2048, 512, 1, 3388]
    - [385, 9979.14]
  - - [2048, 512, 1, 3390]
    - [387, 9982.79]
  - - [2048, 512, 1, 3391]
    - [387, 9981.25]
  - - [2048, 512, 1, 3396]
    - [387, 9989.24]
  - - [2048, 512, 1, 3399]
    - [385, 9986.86]
  - - [2048, 512, 1, 3402]
    - [385, 9984.48]
  - - [2048, 512, 1, 3410]
    - [385, 9987.83]
  - - [2048, 512, 1, 3412]
    - [385, 9982.54]
  - - [2048, 512, 1, 3414]
    - [385, 9990.62]
  - - [2048, 512, 1, 3415]
    - [385, 9982.4]
  - - [2048, 512, 1, 3420]
    - [385, 9994.79]
  - - [2048, 512, 1, 3422]
    - [387, 9991.72]
  - - [2048, 512, 1, 3425]
    - [385, 9989.36]
  - - [2048, 512, 1, 3426]
    - [387, 9996.72]
  - - [2048, 512, 1, 3427]
    - [385, 9995.19]
  - - [2048, 512, 1, 3428]
    - [387, 9986.99]
  - - [2048, 512, 1, 3430]
    - [387, 9992.82]
  - - [2048, 512, 1, 3431]
    - [387, 9982.42]
  - - [2048, 512, 1, 3432]
    - [387, 10005.3]
  - - [2048, 512, 1, 3438]
    - [385, 9998.35]
  - - [2048, 512, 1, 3439]
    - [385, 9996.82]
  - - [2048, 512, 1, 3440]
    - [385, 10010.8]
  - - [2048, 512, 1, 3443]
    - [385, 9995.15]
  - - [2048, 512, 1, 3445]
    - [385, 9994.31]
  - - [2048, 512, 1, 3447]
    - [385, 9980.23]
  - - [2048, 512, 1, 3448]
    - [387, 10009.7]
  - - [2048, 512, 1, 3450]
    - [385, 9986.71]
  - - [2048, 512, 1, 3451]
    - [385, 9994.02]
  - - [2048, 512, 1, 3452]
    - [385, 9985.89]
  - - [2048, 512, 1, 3453]
    - [387, 9990.99]
  - - [2048, 512, 1, 3455]
    - [387, 9979.15]
  - - [2048, 512, 1, 3456]
    - [387, 10001.9]
  - - [2048, 512, 1, 3457]
    - [387, 9998.14]
  - - [2048, 512, 1, 3458]
    - [385, 9987.81]
  - - [2048, 512, 1, 3459]
    - [385, 9981.9]
  - - [2048, 512, 1, 3460]
    - [387, 9982.59]
  - - [2048, 512, 1, 3461]
    - [387, 9998.68]
  - - [2048, 512, 1, 3462]
    - [387, 9986.16]
  - - [2048, 512, 1, 3466]
    - [385, 10002.1]
  - - [2048, 512, 1, 3467]
    - [387, 9996.19]
  - - [2048, 512, 1, 3468]
    - [387, 9992.48]
  - - [2048, 512, 1, 3470]
    - [385, 9989.45]
  - - [2048, 512, 1, 3471]
    - [387, 9996.72]
  - - [2048, 512, 1, 3472]
    - [387, 9993.02]
  - - [2048, 512, 1, 3475]
    - [387, 9999.46]
  - - [2048, 512, 1, 3476]
    - [387, 9995.75]
  - - [2048, 512, 1, 3477]
    - [385, 9994.24]
  - - [2048, 512, 1, 3478]
    - [387, 9994.92]
  - - [2048, 512, 1, 3479]
    - [385, 9986.85]
  - - [2048, 512, 1, 3480]
    - [387, 10011.6]
  - - [2048, 512, 1, 3481]
    - [387, 9996.97]
  - - [2048, 512, 1, 3483]
    - [387, 10007.1]
  - - [2048, 512, 1, 3484]
    - [387, 9994.63]
  - - [2048, 512, 1, 3489]
    - [387, 10000.2]
  - - [2048, 512, 1, 3490]
    - [387, 9992.16]
  - - [2048, 512, 1, 3491]
    - [385, 9995.03]
  - - [2048, 512, 1, 3493]
    - [387, 9992.02]
  - - [2048, 512, 1, 3494]
    - [387, 9986.17]
  - - [2048, 512, 1, 3495]
    - [385, 9986.85]
  - - [2048, 512, 1, 3497]
    - [385, 9999.1]
  - - [2048, 512, 1, 3498]
    - [387, 9999.78]
  - - [2048, 512, 1, 3499]
    - [387, 10000.5]
  - - [2048, 512, 1, 3501]
    - [387, 9995.27]
  - - [2048, 512, 1, 3503]
    - [387, 9992.28]
  - - [2048, 512, 1, 3507]
    - [387, 9999.34]
  - - [2048, 512, 1, 3508]
    - [387, 9997.84]
  - - [2048, 512, 1, 3509]
    - [387, 10000.7]
  - - [2048, 512, 1, 3511]
    - [385, 9980.35]
  - - [2048, 512, 1, 3514]
    - [385, 10008.4]
  - - [2048, 512, 1, 3515]
    - [387, 9998.22]
  - - [2048, 512, 1, 3517]
    - [385, 10003.9]
  - - [2048, 512, 1, 3518]
    - [385, 9993.74]
  - - [2048, 512, 1, 3519]
    - [387, 10003.1]
  - - [2048, 512, 1, 3520]
    - [387, 10021.1]
  - - [2048, 512, 1, 3523]
    - [387, 9990.62]
  - - [2048, 512, 1, 3528]
    - [387, 10009.1]
  - - [2048, 512, 1, 3529]
    - [387, 10003.3]
  - - [2048, 512, 1, 3530]
    - [387, 10001.8]
  - - [2048, 512, 1, 3532]
    - [385, 9994.52]
  - - [2048, 512, 1, 3533]
    - [387, 9999.51]
  - - [2048, 512, 1, 3534]
    - [385, 9995.87]
  - - [2048, 512, 1, 3538]
    - [385, 10007.2]
  - - [2048, 512, 1, 3539]
    - [387, 9994.91]
  - - [2048, 512, 1, 3541]
    - [387, 10002.7]
  - - [2048, 512, 1, 3547]
    - [385, 10006.7]
  - - [2048, 512, 1, 3548]
    - [387, 10003.1]
  - - [2048, 512, 1, 3552]
    - [385, 10023.0]
  - - [2048, 512, 1, 3564]
    - [385, 10007.3]
  - - [2048, 512, 1, 3575]
    - [385, 9999.62]
  - - [2048, 512, 1, 3598]
    - [387, 10012.7]
  - - [2048, 512, 1, 3599]
    - [385, 9998.48]
  - - [2048, 512, 1, 3608]
    - [385, 10023.5]
  - - [2048, 512, 1, 3780]
    - [387, 10021.3]
  - - [2048, 512, 1, 3796]
    - [385, 10023.2]
  - - [2048, 512, 1, 3822]
    - [385, 10011.1]
  - - [2048, 512, 1, 3840]
    - [387, 10028.2]
  - - [2048, 512, 1, 3859]
    - [387, 10029.9]
  - - [2048, 512, 1, 3870]
    - [387, 10018.7]
  - - [2048, 512, 1, 3876]
    - [385, 10032.3]
  - - [2048, 512, 1, 3906]
    - [385, 10040.5]
  - - [2048, 512, 1, 3910]
    - [385, 10029.2]
  - - [2048, 512, 1, 3925]
    - [385, 10040.2]
  - - [2048, 512, 1, 3942]
    - [387, 10028.8]
  - - [2048, 512, 1, 3944]
    - [387, 10047.6]
  - - [2048, 512, 1, 3955]
    - [387, 10036.6]
  - - [2048, 512, 1, 3968]
    - [385, 10046.2]
  - - [2048, 512, 1, 3969]
    - [387, 10044.9]
  - - [2048, 512, 1, 3976]
    - [387, 10043.2]
  - - [2048, 512, 1, 3977]
    - [385, 10043.8]
  - - [2048, 512, 1, 3978]
    - [387, 10044.4]
  - - [2048, 512, 1, 3990]
    - [387, 10034.1]
  - - [2048, 512, 1, 3995]
    - [385, 10040.9]
  - - [2048, 512, 1, 3996]
    - [387, 10035.7]
  - - [2048, 512, 1, 3999]
    - [385, 10031.7]
  - - [2048, 512, 1, 4005]
    - [385, 10037.2]
  - - [2048, 512, 1, 4012]
    - [385, 10039.3]
  - - [2048, 512, 1, 4020]
    - [385, 10028.7]
  - - [2048, 512, 1, 4026]
    - [387, 10043.7]
  - - [2048, 512, 1, 4030]
    - [387, 10046.0]
  - - [512, 512, 1, 3780]
    - [395, 8679.96]
  - - [512, 512, 1, 3796]
    - [394, 8656.04]
  - - [512, 512, 1, 3822]
    - [395, 8691.14]
  - - [512, 512, 1, 3840]
    - [393, 8830.11]
  - - [512, 512, 1, 3859]
    - [391, 8661.08]
  - - [512, 512, 1, 3870]
    - [395, 8626.68]
  - - [512, 512, 1, 3876]
    - [394, 8759.23]
  - - [512, 512, 1, 3906]
    - [393, 8778.59]
  - - [512, 512, 1, 3910]
    - [393, 8793.61]
  - - [512, 512, 1, 3925]
    - [395, 8672.58]
  - - [512, 512, 1, 3927]
    - [392, 8659.48]
  - - [512, 512, 1, 3942]
    - [392, 8769.28]
  - - [512, 512, 1, 3944]
    - [391, 8732.23]
  - - [512, 512, 1, 3955]
    - [394, 8691.98]
  - - [512, 512, 1, 3968]
    - [390, 8845.13]
  - - [512, 512, 1, 3969]
    - [393, 8799.47]
  - - [512, 512, 1, 3976]
    - [394, 8755.75]
  - - [512, 512, 1, 3978]
    - [394, 8742.53]
  - - [512, 512, 1, 3990]
    - [395, 8670.05]
  - - [512, 512, 1, 3995]
    - [390, 8646.51]
  - - [512, 512, 1, 3996]
    - [393, 8654.39]
  - - [512, 512, 1, 3999]
    - [395, 8666.62]
  - - [512, 512, 1, 4005]
    - [395, 8760.74]
  - - [512, 512, 1, 4012]
    - [394, 8735.23]
  - - [512, 512, 1, 4020]
    - [395, 8746.84]
  - - [512, 512, 1, 4026]
    - [394, 8673.5]
  - - [512, 512, 1, 4030]
    - [395, 8665.03]
  - - [512, 512, 1, 4050]
    - [392, 8730.95]
  - - [512, 512, 1, 4059]
    - [395, 8653.57]
  - - [64, 12, 2520, 12]
    - [406, 1180.1]
  - - [64, 13, 2336, 13]
    - [411, 1224.14]
  - - [64, 14, 2184, 14]
    - [410, 1348.23]
  - - [64, 15, 2048, 15]
    - [409, 1445.65]
  - - [64, 16, 1920, 16]
    - [405, 1771.24]
  - - [64, 17, 1816, 17]
    - [404, 1608.66]
  - - [64, 18, 1720, 18]
    - [406, 1714.71]
  - - [64, 19, 1632, 19]
    - [407, 1805.83]
  - - [64, 21, 1488, 21]
    - [406, 2034.75]
  - - [64, 23, 1360, 23]
    - [406, 2239.5]
  - - [64, 25, 1256, 25]
    - [406, 2291.97]
  - - [64, 27, 1168, 27]
    - [408, 2398.51]
  - - [64, 29, 1088, 29]
    - [408, 2605.01]
  - - [64, 32, 992, 32]
    - [389, 2998.7]
  - - [64, 35, 904, 35]
    - [406, 2848.62]
  - - [64, 41, 776, 41]
    - [396, 3261.14]
  - - [64, 45, 712, 45]
    - [406, 3538.16]
  - - [64, 54, 592, 54]
    - [396, 4049.91]
  - - [64, 59, 544, 59]
    - [396, 4267.41]
  - - [64, 64, 496, 64]
    - [380, 4837.18]
  - - [64, 64, 496, 65]
    - [412, 5614.58]
  - - [64, 65, 496, 65]
    - [399, 4191.2]
  - - [64, 71, 448, 71]
    - [396, 4472.02]
  - - [64, 77, 408, 77]
    - [397, 4720.06]
  - - [64, 77, 408, 78]
    - [398, 4793.05]
  - - [64, 78, 408, 78]
    - [400, 4855.3]
  - - [64, 85, 376, 85]
    - [401, 5125.66]
  - - [64, 93, 344, 93]
    - [401, 5561.23]
  - - [64, 102, 312, 102]
    - [381, 5172.98]
  - - [64, 112, 288, 112]
    - [379, 5959.05]
  - - [64, 122, 264, 122]
    - [382, 5875.7]
  - - [64, 123, 264, 122]
    - [402, 5890.83]
  - - [64, 123, 264, 123]
    - [403, 6006.1]
  - - [64, 134, 240, 134]
    - [401, 5765.14]
  - - [64, 135, 240, 134]
    - [401, 5712.63]
  - - [64, 135, 240, 135]
    - [401, 5717.65]
  - - [49, 512, 64, 2048]
    - [426, 7581.0]
  - - [49, 2048, 64, 512]
    - [420, 7418.19]
  - - [64, 1280, 64, 192]
    - [423, 9341.43]
  - - [64, 1280, 64, 320]
    - [422, 9731.56]
  - - [64, 1280, 64, 384]
    - [427, 9780.73]
  - - [64, 1280, 64, 448]
    - [418, 9852.39]
  - - [64, 2048, 64, 192]
    - [416, 9518.99]
  - - [64, 2048, 64, 320]
    - [417, 9868.95]
  - - [64, 2048, 64, 384]
    - [418, 9895.63]
  - - [64, 2048, 64, 448]
    - [419, 9971.6]
  - - [196, 256, 64, 1024]
    - [419, 7586.6]
  - - [196, 1024, 64, 256]
    - [425, 7815.97]
  - - [289, 768, 64, 128]
    - [422, 8322.18]
  - - [289, 768, 64, 160]
    - [421, 8508.49]
  - - [289, 768, 64, 192]
    - [422, 8648.36]
  - - [784, 128, 64, 512]
    - [418, 9365.27]
  - - [784, 512, 64, 128]
    - [416, 9226.53]
  - - [1225, 192, 64, 32]
    - [415, 6865.59]
  - - [1225, 192, 64, 48]
    - [414, 7915.58]
  - - [1225, 192, 64, 64]
    - [414, 8282.15]
  - - [1225, 256, 64, 48]
    - [414, 8114.72]
  - - [1225, 256, 64, 64]
    - [414, 8384.5]
  - - [1225, 288, 64, 48]
    - [424, 7126.52]
  - - [1225, 288, 64, 64]
    - [424, 7712.79]
  - - [3136, 64, 64, 64]
    - [414, 8556.24]
  - - [3136, 64, 64, 256]
    - [422, 9796.04]
  - - [3136, 256, 64, 64]
    - [416, 9369.54]
  - - [5329, 64, 64, 80]
    - [413, 8717.09]
  - - [1024, 3072, 1, 512]
    - [428, 9355.32]
  - - [1024, 1024, 1, 6]
    - [434, 534.988]
  - - [1024, 30522, 1, 120]
    - [431, 10516.3]
  - - [3072, 1024, 1, 3072]
    - [429, 11003.5]
  - - [1024, 1024, 1, 80]
    - [466, 7182.03]
  - - [1024, 1024, 1, 20]
    - [435, 1515.28]
  - - [3072, 1024, 1, 2048]
    - [436, 10805.1]
  - - [3072, 1024, 1, 512]
    - [436, 9239.4]
  - - [64, 512, 16, 512]
    - [430, 6236.88]
  - - [1024, 1024, 1, 512]
    - [438, 8036.99]
  - - [1024, 30522, 1, 80]
    - [433, 9385.74]
  - - [1024, 1024, 1, 120]
    - [437, 4723.32]
  - - [1024, 3072, 1, 2048]
    - [429, 11072.6]
  - - [1024, 30522, 1, 20]
    - [432, 5392.43]
  - - [1024, 3072, 1, 3072]
    - [438, 11162.1]
  - - [512, 512, 1, 1]
    - [439, 64.0]
  - - [512, 512, 1, 512]
    - [442, 8604.0]
  - - [1024, 1024, 1, 1]
    - [440, 170.0]
  - - [1024, 1024, 1, 1024]
    - [441, 12382.0]
  - - [64, 512, 96, 512]
    - [443, 11068.0]
  - - [512, 64, 96, 512]
    - [444, 10807.0]
  - - [4096, 1024, 1, 3072]
    - [496, 9025.54]
  - - [1024, 1024, 1, 3072]
    - [472, 8144.26]
  - - [30528, 1024, 1, 3072]
    - [447, 12797.0]
  - - [1024, 4096, 1, 3072]
    - [480, 9143.39]
  - - [1024, 2, 1, 6]
    - [445, 2.0]
  - - [1024, 2, 1, 32]
    - [456, 12.0]
  - - [1024, 2, 1, 4]
    - [450, 2.0]
  - - [1024, 30528, 1, 4096]
    - [453, 13868.0]
  - - [1024, 1024, 1, 4096]
    - [472, 8932.93]
  - - [1024, 1024, 1, 32]
    - [466, 3919.91]
  - - [4096, 1024, 1, 4096]
    - [472, 10192.1]
  - - [1024, 4096, 1, 4096]
    - [482, 9518.96]
  - - [1024, 1024, 1, 2048]
    - [451, 13101.0]
  - - [4096, 1024, 1, 2048]
    - [447, 13708.0]
  - - [1024, 30528, 1, 2048]
    - [454, 13862.0]
  - - [1024, 1024, 1, 4]
    - [452, 603.0]
  - - [1024, 4096, 1, 2048]
    - [455, 13780.0]
  - - [128, 64, 512, 128]
    - [466, 9020.01]
  - - [64, 128, 512, 128]
    - [466, 10183.4]
  - - [512, 64, 64, 512]
    - [449, 11641.0]
  - - [64, 512, 64, 512]
    - [448, 12280.0]
  - - [1024, 7168, 6, 1024]
    - [459, 12404.9]
  - - [4096, 7168, 6, 1024]
    - [459, 12703.6]
  - - [1024, 7168, 6, 4096]
    - [457, 12572.1]
  - - [1024, 14, 6, 128]
    - [460, 1563.93]
  - - [1024, 14, 6, 1024]
    - [462, 3219.31]
  - - [1024, 7168, 12, 1024]
    - [458, 12700.4]
  - - [4096, 7168, 12, 1024]
    - [458, 12761.0]
  - - [1024, 7168, 12, 4096]
    - [458, 12865.2]
  - - [1024, 14, 12, 128]
    - [461, 2457.6]
  - - [1024, 14, 12, 1024]
    - [460, 4626.07]
  - - [128, 64, 1, 1048576]
    - [464, 852.609]
  - - [256, 256, 1, 1048576]
    - [463, 6085.59]
  - - [256, 128, 1, 1048576]
    - [465, 4254.5]
  - - [64, 128, 1312, 128]
    - [466, 11094.6]
  - - [128, 64, 1312, 128]
    - [467, 9917.33]
  - - [64, 128, 1280, 128]
    - [466, 11305.4]
  - - [128, 64, 1280, 128]
    - [468, 10112.8]
  - - [128, 64, 1024, 128]
    - [468, 9662.9]
  - - [64, 128, 1024, 128]
    - [469, 10859.0]
  - - [64, 512, 128, 512]
    - [469, 12644.2]
  - - [512, 64, 128, 512]
    - [467, 12102.6]
  - - [64, 512, 192, 512]
    - [466, 13005.6]
  - - [512, 64, 192, 512]
    - [468, 12340.0]
  - - [30528, 1024, 1, 4096]
    - [470, 14235.7]
  - - [1024, 1024, 1, 8]
    - [468, 1416.99]
  - - [1024, 4096, 1, 6144]
    - [472, 9748.85]
  - - [30528, 1024, 1, 6144]
    - [470, 14277.4]
  - - [4096, 1024, 1, 6144]
    - [484, 9602.96]
  - - [1024, 1024, 1, 12]
    - [466, 1872.46]
  - - [1024, 1024, 1, 6144]
    - [482, 8159.11]
  - - [4096, 1024, 1, 10496]
    - [470, 14250.4]
  - - [1024, 1024, 1, 10496]
    - [468, 13923.0]
  - - [1024, 4096, 1, 10496]
    - [470, 14223.1]
  - - [30528, 1024, 1, 10496]
    - [470, 14282.8]
  - - [1024, 1024, 1, 82]
    - [466, 6634.51]
  - - [30528, 1024, 1, 10240]
    - [470, 14300.9]
  - - [4096, 1024, 1, 10240]
    - [471, 14220.2]
  - - [1024, 1024, 1, 10240]
    - [468, 13937.5]
  - - [1024, 4096, 1, 10240]
    - [470, 14233.8]
  - - [4096, 1024, 1, 8192]
    - [472, 9773.7]
  - - [30528, 1024, 1, 8192]
    - [470, 14278.0]
  - - [1024, 1024, 1, 8192]
    - [474, 8196.48]
  - - [1024, 1024, 1, 64]
    - [466, 6765.01]
  - - [1024, 4096, 1, 8192]
    - [476, 9231.49]
  - - [4096, 1024, 1, 4440]
    - [472, 11090.2]
  - - [1024, 1024, 1, 6480]
    - [472, 9493.07]
  - - [1024, 1024, 1, 5664]
    - [472, 9569.36]
  - - [4096, 1024, 1, 2160]
    - [472, 11132.0]
  - - [1024, 4096, 1, 7080]
    - [472, 11216.1]
  - - [1024, 1024, 1, 5376]
    - [472, 9472.27]
  - - [1024, 33712, 1, 7808]
    - [473, 11982.8]
  - - [1024, 1024, 1, 2880]
    - [474, 9470.32]
  - - [1024, 4096, 1, 2880]
    - [472, 11127.1]
  - - [1024, 33712, 1, 4176]
    - [475, 11950.6]
  - - [1024, 33712, 1, 7200]
    - [473, 11983.6]
  - - [1024, 4096, 1, 2392]
    - [472, 11128.7]
  - - [4096, 1024, 1, 6080]
    - [476, 10649.0]
  - - [1024, 4096, 1, 3952]
    - [472, 11189.6]
  - - [4096, 1024, 1, 7216]
    - [476, 10671.5]
  - - [1024, 4096, 1, 7872]
    - [472, 11168.4]
  - - [4096, 1024, 1, 3808]
    - [477, 11144.8]
  - - [4096, 1024, 1, 2976]
    - [472, 11131.3]
  - - [1024, 33712, 1, 5712]
    - [473, 11846.0]
  - - [1024, 1024, 1, 4160]
    - [472, 9472.87]
  - - [1024, 4096, 1, 5760]
    - [472, 11099.7]
  - - [1024, 4096, 1, 8136]
    - [478, 10559.7]
  - - [4096, 1024, 1, 7752]
    - [479, 10431.9]
  - - [1024, 1024, 1, 8136]
    - [472, 9571.85]
  - - [4096, 1024, 1, 6800]
    - [480, 10114.5]
  - - [1024, 1024, 1, 6032]
    - [472, 9534.79]
  - - [4096, 1024, 1, 2944]
    - [472, 10832.3]
  - - [4096, 1024, 1, 6232]
    - [479, 10506.3]
  - - [4096, 1024, 1, 7728]
    - [481, 10239.3]
  - - [1024, 33712, 1, 6496]
    - [474, 11572.0]
  - - [1024, 4096, 1, 7584]
    - [472, 10504.6]
  - - [1024, 1024, 1, 7616]
    - [474, 8874.84]
  - - [1024, 33712, 1, 7584]
    - [478, 10940.0]
  - - [1024, 1024, 1, 6200]
    - [482, 8697.89]
  - - [1024, 4096, 1, 6080]
    - [472, 10531.8]
  - - [4096, 1024, 1, 7280]
    - [476, 10487.2]
  - - [1024, 4096, 1, 7216]
    - [472, 10431.7]
  - - [1024, 4096, 1, 7560]
    - [472, 10096.8]
  - - [4096, 1024, 1, 7560]
    - [476, 9923.66]
  - - [1024, 33712, 1, 7560]
    - [478, 10872.0]
  - - [1024, 33712, 1, 3200]
    - [475, 10872.3]
  - - [1024, 1024, 1, 7400]
    - [481, 8606.3]
  - - [1024, 33712, 1, 7400]
    - [478, 10748.7]
  - - [1024, 4096, 1, 5336]
    - [479, 10105.5]
  - - [1024, 1024, 1, 6192]
    - [474, 8927.46]
  - - [4096, 1024, 1, 2880]
    - [472, 10432.1]
  - - [1024, 1024, 1, 4624]
    - [472, 9414.03]
  - - [1024, 1024, 1, 7232]
    - [472, 8864.78]
  - - [4096, 1024, 1, 7832]
    - [476, 9923.18]
  - - [1024, 1024, 1, 7832]
    - [472, 8286.01]
  - - [1024, 33712, 1, 6560]
    - [475, 10900.8]
  - - [1024, 33712, 1, 4704]
    - [472, 10215.2]
  - - [1024, 33712, 1, 7688]
    - [478, 10569.3]
  - - [4096, 1024, 1, 4680]
    - [483, 10155.9]
  - - [4096, 1024, 1, 6032]
    - [484, 9836.39]
  - - [4096, 1024, 1, 6512]
    - [484, 9539.14]
  - - [1024, 4096, 1, 7784]
    - [472, 9770.75]
  - - [1024, 4096, 1, 6880]
    - [472, 9748.11]
  - - [4096, 1024, 1, 6880]
    - [472, 9353.28]
  - - [1024, 1024, 1, 6880]
    - [485, 8762.73]
  - - [4096, 1024, 1, 6728]
    - [479, 9109.55]
  - - [1024, 33712, 1, 7728]
    - [478, 10559.5]
  - - [1024, 33712, 1, 6256]
    - [475, 11079.9]
  - - [1024, 33712, 1, 8120]
    - [478, 10412.6]
  - - [1024, 4096, 1, 2160]
    - [482, 10046.7]
  - - [1024, 33712, 1, 7896]
    - [478, 10528.4]
  - - [1024, 4096, 1, 3808]
    - [483, 9530.66]
  - - [1024, 1024, 1, 7208]
    - [482, 8143.12]
  - - [4096, 1024, 1, 7208]
    - [479, 9135.0]
  - - [1024, 4096, 1, 6448]
    - [472, 9742.36]
  - - [4096, 1024, 1, 8040]
    - [476, 9206.45]
  - - [1024, 1024, 1, 8040]
    - [472, 8322.66]
  - - [1024, 1024, 1, 3600]
    - [486, 8607.41]
  - - [1024, 4096, 1, 5184]
    - [472, 10451.1]
  - - [1024, 4096, 1, 3600]
    - [480, 9885.98]
  - - [4096, 1024, 1, 6192]
    - [481, 9148.35]
  - - [1024, 33712, 1, 3600]
    - [473, 10948.5]
  - - [1024, 4096, 1, 5704]
    - [481, 9528.53]
  - - [1024, 1024, 1, 3168]
    - [472, 8876.34]
  - - [1024, 4096, 1, 7440]
    - [472, 9579.07]
  - - [4096, 1024, 1, 5304]
    - [472, 9385.77]
  - - [1024, 1024, 1, 2520]
    - [472, 8857.63]
  - - [1024, 4096, 1, 6936]
    - [487, 9898.34]
  - - [1024, 1024, 1, 2304]
    - [487, 8033.77]
  - - [4096, 1024, 1, 4160]
    - [482, 9469.16]
  - - [4096, 1024, 1, 5152]
    - [484, 10166.5]
  - - [1024, 1024, 1, 5152]
    - [472, 8835.29]
  - - [1024, 1024, 1, 7584]
    - [472, 8383.63]
  - - [1024, 33712, 1, 7936]
    - [478, 10461.9]
  - - [1024, 4096, 1, 7688]
    - [480, 9972.33]
  - - [1024, 4096, 1, 6216]
    - [472, 9651.9]
  - - [4096, 1024, 1, 5616]
    - [472, 9435.95]
  - - [1024, 4096, 1, 5104]
    - [472, 10461.5]
  - - [4096, 1024, 1, 5104]
    - [484, 10255.1]
  - - [4096, 1024, 1, 4864]
    - [484, 9968.45]
  - - [1024, 1024, 1, 6600]
    - [472, 8855.29]
  - - [1024, 1024, 1, 6768]
    - [472, 8933.46]
  - - [1024, 1024, 1, 7552]
    - [472, 8939.34]
  - - [1024, 4096, 1, 6192]
    - [472, 9704.02]
  - - [1024, 4096, 1, 6600]
    - [476, 9221.29]
  - - [1024, 4096, 1, 6200]
    - [472, 9528.01]
  - - [4096, 1024, 1, 3600]
    - [472, 9661.3]
  - - [1024, 4096, 1, 6864]
    - [472, 10302.9]
  - - [1024, 4096, 1, 5040]
    - [479, 9857.88]
  - - [4096, 1024, 1, 3904]
    - [476, 9867.97]
  - - [1024, 1024, 1, 3904]
    - [474, 8273.3]
  - - [1024, 4096, 1, 6944]
    - [480, 9966.72]
  - - [1024, 4096, 1, 7744]
    - [477, 9726.36]
  - - [4096, 1024, 1, 2592]
    - [484, 9858.9]
  - - [1024, 33712, 1, 7744]
    - [478, 10489.3]
  - - [1024, 33712, 1, 8024]
    - [478, 10794.7]
  - - [1024, 4096, 1, 3040]
    - [482, 9549.61]
  - - [1024, 1024, 1, 7168]
    - [481, 8112.61]
  - - [1024, 33712, 1, 3360]
    - [473, 10891.0]
  - - [1024, 1024, 1, 7840]
    - [484, 8517.92]
  - - [1024, 4096, 1, 5400]
    - [481, 9575.36]
  - - [4096, 1024, 1, 7808]
    - [476, 9221.75]
  - - [1024, 1024, 1, 4176]
    - [474, 8828.31]
  - - [1024, 1024, 1, 7808]
    - [472, 8953.7]
  - - [1024, 4096, 1, 5664]
    - [472, 10522.9]
  - - [1024, 1024, 1, 6440]
    - [472, 8859.17]
  - - [1024, 1024, 1, 7488]
    - [472, 8817.4]
  - - [1024, 1024, 1, 4144]
    - [487, 8633.93]
  - - [4096, 1024, 1, 7952]
    - [476, 9211.5]
  - - [4096, 1024, 1, 7992]
    - [476, 9200.71]
  - - [1024, 33712, 1, 6992]
    - [488, 10124.2]
  - - [4096, 1024, 1, 2560]
    - [483, 9442.61]
  - - [1024, 1024, 1, 2560]
    - [474, 8749.5]
  - - [1024, 4096, 1, 5888]
    - [472, 9669.84]
  - - [4096, 1024, 1, 7344]
    - [476, 9219.77]
  - - [4096, 1024, 1, 6320]
    - [486, 9581.55]
  - - [1024, 1024, 1, 6496]
    - [474, 8292.99]
  - - [1024, 1024, 1, 6320]
    - [474, 8935.1]
  - - [4096, 1024, 1, 3672]
    - [472, 9618.68]
  - - [1024, 4096, 1, 3904]
    - [472, 10247.4]
  - - [1024, 1024, 1, 6336]
    - [484, 8095.04]
  - - [1024, 33712, 1, 7296]
    - [488, 10176.5]
  - - [1024, 33712, 1, 8000]
    - [478, 10513.3]
  - - [1024, 4096, 1, 7296]
    - [483, 9450.76]
  - - [1024, 33712, 1, 5616]
    - [475, 10956.6]
  - - [1024, 33712, 1, 4624]
    - [473, 10232.8]
  - - [4096, 1024, 1, 1512]
    - [476, 9690.97]
  - - [4096, 1024, 1, 5632]
    - [477, 10203.1]
  - - [1024, 4096, 1, 4784]
    - [472, 9742.04]
  - - [4096, 1024, 1, 4784]
    - [481, 9203.0]
  - - [1024, 4096, 1, 7568]
    - [472, 10453.4]
  - - [1024, 1024, 1, 7568]
    - [481, 8134.07]
  - - [1024, 4096, 1, 2520]
    - [476, 9044.99]
  - - [1024, 33712, 1, 6384]
    - [475, 11118.7]
  - - [1024, 33712, 1, 7128]
    - [489, 10155.0]
  - - [1024, 4096, 1, 7280]
    - [483, 9208.88]
  - - [1024, 4096, 1, 5376]
    - [482, 9249.08]
  - - [1024, 1024, 1, 5304]
    - [472, 8258.54]
  - - [4096, 1024, 1, 7744]
    - [479, 9121.1]
  - - [4096, 1024, 1, 5376]
    - [472, 9509.33]
  - - [1024, 33712, 1, 2976]
    - [473, 11471.3]
  - - [4096, 1024, 1, 1600]
    - [476, 9751.9]
  - - [1024, 4096, 1, 6608]
    - [472, 9642.85]
  - - [4096, 1024, 1, 4992]
    - [482, 9551.61]
  - - [4096, 1024, 1, 6560]
    - [472, 9215.26]
  - - [1024, 4096, 1, 5680]
    - [472, 9767.92]
  - - [1024, 4096, 1, 6432]
    - [480, 9953.1]
  - - [1024, 4096, 1, 5520]
    - [472, 9314.05]
  - - [1024, 33712, 1, 3960]
    - [474, 10553.9]
  - - [4096, 1024, 1, 7872]
    - [476, 9218.02]
  - - [1024, 1024, 1, 2736]
    - [474, 8221.27]
  - - [1024, 33712, 1, 8112]
    - [478, 10428.9]
  - - [1024, 33712, 1, 4352]
    - [480, 10939.3]
  - - [1024, 1024, 1, 5576]
    - [482, 8101.71]
  - - [1024, 1024, 1, 7800]
    - [472, 8274.19]
  - - [1024, 1024, 1, 7360]
    - [472, 8260.02]
  - - [1024, 4096, 1, 4488]
    - [479, 9804.15]
  - - [4096, 1024, 1, 5040]
    - [477, 9631.86]
  - - [1024, 4096, 1, 6256]
    - [472, 10488.7]
  - - [1024, 33712, 1, 7440]
    - [490, 10242.8]
  - - [1024, 1024, 1, 6256]
    - [481, 8111.42]
  - - [4096, 1024, 1, 6960]
    - [479, 9824.28]
  - - [1024, 4096, 1, 2112]
    - [482, 10053.5]
  - - [4096, 1024, 1, 2112]
    - [484, 9495.7]
  - - [1024, 1024, 1, 7320]
    - [472, 8864.86]
  - - [1024, 33712, 1, 7448]
    - [478, 10101.3]
  - - [1024, 33712, 1, 6800]
    - [475, 10637.2]
  - - [4096, 1024, 1, 6864]
    - [476, 9878.4]
  - - [4096, 1024, 1, 7760]
    - [476, 9221.36]
  - - [1024, 33712, 1, 3456]
    - [473, 10886.9]
  - - [1024, 33712, 1, 8008]
    - [478, 10432.8]
  - - [4096, 1024, 1, 6624]
    - [483, 9572.68]
  - - [1024, 1024, 1, 5120]
    - [487, 8709.75]
  - - [1024, 1024, 1, 4320]
    - [486, 8631.55]
  - - [4096, 1024, 1, 7232]
    - [482, 9303.49]
  - - [1024, 4096, 1, 7520]
    - [472, 9491.63]
  - - [1024, 4096, 1, 6720]
    - [485, 9588.52]
  - - [1024, 4096, 1, 4704]
    - [482, 9594.41]
  - - [1024, 4096, 1, 7232]
    - [480, 9986.41]
  - - [4096, 1024, 1, 6720]
    - [472, 9439.01]
  - - [1024, 1024, 1, 5512]
    - [472, 8279.47]
  - - [1024, 1024, 1, 7872]
    - [484, 7861.3]
  - - [1024, 33712, 1, 7872]
    - [478, 10315.5]
  - - [4096, 1024, 1, 7904]
    - [476, 9207.57]
  - - [1024, 4096, 1, 6528]
    - [472, 10504.4]
  - - [1024, 4096, 1, 4160]
    - [472, 9763.77]
  - - [1024, 1024, 1, 6528]
    - [474, 8291.04]
  - - [1024, 1024, 1, 6240]
    - [472, 8843.93]
  - - [1024, 1024, 1, 4816]
    - [487, 8678.05]
  - - [1024, 4096, 1, 6976]
    - [480, 9960.57]
  - - [1024, 4096, 1, 4800]
    - [472, 10210.9]
  - - [1024, 1024, 1, 5104]
    - [474, 8275.48]
  - - [1024, 1024, 1, 6624]
    - [472, 8957.17]
  - - [1024, 4096, 1, 4432]
    - [472, 10487.1]
  - - [1024, 1024, 1, 7776]
    - [481, 8095.42]
  - - [1024, 33712, 1, 7000]
    - [488, 10058.4]
  - - [1024, 1024, 1, 7200]
    - [472, 8303.7]
  - - [1024, 1024, 1, 7248]
    - [474, 8776.05]
  - - [4096, 1024, 1, 8184]
    - [480, 8855.69]
  - - [1024, 1024, 1, 7176]
    - [472, 8926.35]
  - - [4096, 1024, 1, 6256]
    - [472, 9238.73]
  - - [1024, 33712, 1, 3808]
    - [474, 10473.4]
  - - [1024, 33712, 1, 6480]
    - [475, 10951.0]
  - - [4096, 1024, 1, 8112]
    - [481, 9059.37]
  - - [1024, 4096, 1, 7696]
    - [472, 10250.0]
  - - [1024, 4096, 1, 5832]
    - [472, 9118.02]
  - - [1024, 4096, 1, 1600]
    - [486, 9696.66]
  - - [1024, 4096, 1, 7728]
    - [480, 9262.05]
  - - [4096, 1024, 1, 1824]
    - [481, 10412.7]
  - - [1024, 4096, 1, 7680]
    - [477, 9570.09]
  - - [1024, 33712, 1, 7992]
    - [478, 10420.3]
  - - [1024, 4096, 1, 7904]
    - [476, 9865.87]
  - - [1024, 1024, 1, 6728]
    - [472, 7742.99]
  - - [4096, 1024, 1, 5032]
    - [472, 9486.21]
  - - [4096, 1024, 1, 7920]
    - [476, 9219.04]
  - - [1024, 33712, 1, 7168]
    - [489, 10143.0]
  - - [4096, 1024, 1, 5888]
    - [483, 9363.9]
  - - [1024, 4096, 1, 7888]
    - [472, 9773.07]
  - - [4096, 1024, 1, 8024]
    - [486, 9256.05]
  - - [4096, 1024, 1, 6576]
    - [486, 9259.81]
  - - [1024, 1024, 1, 7912]
    - [474, 8211.56]
  - - [4096, 1024, 1, 5400]
    - [484, 9201.59]
  - - [4096, 1024, 1, 4896]
    - [472, 10107.5]
  - - [1024, 1024, 1, 6408]
    - [474, 8922.84]
  - - [1024, 1024, 1, 6048]
    - [485, 8113.83]
  - - [1024, 4096, 1, 7992]
    - [472, 9693.24]
  - - [1024, 1024, 1, 8160]
    - [472, 8215.25]
  - - [1024, 4096, 1, 8184]
    - [480, 8645.32]
  - - [4096, 1024, 1, 7400]
    - [476, 9202.59]
  - - [1024, 1024, 1, 7992]
    - [472, 8286.72]
  - - [4096, 1024, 1, 8120]
    - [476, 9557.95]
  - - [4096, 1024, 1, 7072]
    - [484, 9152.46]
  - - [1024, 1024, 1, 7424]
    - [484, 8574.86]
  - - [1024, 1024, 1, 6432]
    - [481, 8626.34]
  - - [1024, 4096, 1, 7424]
    - [472, 10317.6]
  - - [1024, 1024, 1, 7392]
    - [484, 8632.23]
  - - [1024, 4096, 1, 6560]
    - [480, 9965.86]
  - - [1024, 4096, 1, 3000]
    - [476, 9843.9]
  - - [1024, 4096, 1, 8176]
    - [472, 9770.39]
  - - [4096, 1024, 1, 4176]
    - [477, 9500.63]
  - - [4096, 1024, 1, 6992]
    - [476, 9200.64]
  - - [1024, 4096, 1, 7040]
    - [472, 9747.47]
  - - [1024, 1024, 1, 7040]
    - [474, 8214.58]
  - - [1024, 1024, 1, 5280]
    - [474, 8740.31]
  - - [1024, 1024, 1, 7688]
    - [481, 8100.96]
  - - [1024, 4096, 1, 6968]
    - [480, 9244.93]
  - - [1024, 1024, 1, 7536]
    - [484, 8525.42]
  - - [1024, 1024, 1, 8056]
    - [472, 8314.27]
  - - [1024, 1024, 1, 6552]
    - [481, 8091.79]
  - - [1024, 4096, 1, 7912]
    - [472, 9775.31]
  - - [1024, 4096, 1, 4864]
    - [482, 9397.58]
  - - [1024, 4096, 1, 5936]
    - [481, 9246.16]
  - - [1024, 1024, 1, 5336]
    - [472, 8267.12]
  - - [1024, 4096, 1, 4872]
    - [482, 10134.6]
  - - [1024, 4096, 1, 6656]
    - [472, 9743.27]
  - - [1024, 4096, 1, 7920]
    - [472, 9549.8]
  - - [1024, 33712, 1, 7776]
    - [478, 10424.0]
  - - [1024, 1024, 1, 8112]
    - [484, 8598.89]
  - - [4096, 1024, 1, 968]
    - [477, 9484.39]
  - - [1024, 4096, 1, 6552]
    - [472, 10147.2]
  - - [1024, 4096, 1, 7808]
    - [472, 9687.91]
  - - [1024, 4096, 1, 7176]
    - [472, 9296.0]
  - - [1024, 33712, 1, 6032]
    - [475, 11277.4]
  - - [1024, 4096, 1, 6344]
    - [472, 9918.51]
  - - [1024, 1024, 1, 3400]
    - [487, 8584.92]
  - - [1024, 1024, 1, 5056]
    - [472, 9555.84]
  - - [4096, 1024, 1, 5664]
    - [484, 9865.31]
  - - [1024, 4096, 1, 8128]
    - [472, 9467.88]
  - - [1024, 1024, 1, 7128]
    - [484, 8009.24]
  - - [4096, 1024, 1, 8128]
    - [483, 9706.4]
  - - [1024, 4096, 1, 6048]
    - [472, 10161.1]
  - - [1024, 4096, 1, 1248]
    - [472, 9496.51]
  - - [1024, 4096, 1, 3120]
    - [476, 10491.8]
  - - [1024, 1024, 1, 3224]
    - [487, 8041.39]
  - - [1024, 33712, 1, 7424]
    - [489, 10066.4]
  - - [1024, 4096, 1, 3240]
    - [473, 8887.6]
  - - [1024, 1024, 1, 4704]
    - [486, 8084.98]
  - - [1024, 4096, 1, 7968]
    - [473, 9685.19]
  - - [4096, 1024, 1, 8160]
    - [483, 9397.01]
  - - [1024, 33712, 1, 8128]
    - [478, 10381.2]
  - - [1024, 1024, 1, 4992]
    - [482, 8131.1]
  - - [1024, 4096, 1, 4624]
    - [472, 9714.3]
  - - [1024, 33712, 1, 7104]
    - [489, 10205.1]
  - - [1024, 4096, 1, 7360]
    - [480, 9252.7]
  - - [1024, 1024, 1, 2976]
    - [474, 8250.2]
  - - [4096, 1024, 1, 7568]
    - [476, 9219.08]
  - - [1024, 33712, 1, 7504]
    - [490, 10133.9]
  - - [1024, 4096, 1, 8096]
    - [480, 10000.3]
  - - [1024, 1024, 1, 4968]
    - [472, 8246.75]
  - - [1024, 1024, 1, 8128]
    - [484, 7945.63]
  - - [4096, 1024, 1, 6688]
    - [486, 9329.32]
  - - [4096, 1024, 1, 5832]
    - [472, 9254.63]
  - - [4096, 1024, 1, 5184]
    - [481, 9458.5]
  - - [4096, 1024, 1, 8096]
    - [476, 9214.82]
  - - [1024, 33712, 1, 6200]
    - [475, 11142.8]
  - - [1024, 1024, 1, 7968]
    - [491, 8047.3]
  - - [1024, 4096, 1, 2560]
    - [480, 9110.59]
  - - [1024, 33712, 1, 6600]
    - [475, 10950.4]
  - - [1024, 4096, 1, 6320]
    - [472, 10948.3]
  - - [4096, 1024, 1, 7536]
    - [486, 9377.5]
  - - [4096, 1024, 1, 6888]
    - [484, 9644.75]
  - - [1024, 1024, 1, 4368]
    - [472, 8274.62]
  - - [1024, 1024, 1, 5712]
    - [472, 8749.34]
  - - [1024, 4096, 1, 7344]
    - [476, 9246.11]
  - - [4096, 1024, 1, 6112]
    - [484, 9358.76]
  - - [1024, 33712, 1, 6240]
    - [475, 11172.6]
  - - [1024, 4096, 1, 4992]
    - [472, 11246.8]
  - - [1024, 1024, 1, 7952]
    - [474, 8264.2]
  - - [4096, 1024, 1, 7616]
    - [476, 9224.82]
  - - [1024, 1024, 1, 5824]
    - [472, 8210.83]
  - - [1024, 33712, 1, 3400]
    - [473, 10851.2]
  - - [1024, 33712, 1, 2352]
    - [472, 10230.1]
  - - [1024, 4096, 1, 7504]
    - [472, 10305.5]
  - - [4096, 1024, 1, 3120]
    - [482, 9433.52]
  - - [1024, 33712, 1, 5832]
    - [489, 10331.0]
  - - [1024, 33712, 1, 6624]
    - [475, 11033.5]
  - - [1024, 4096, 1, 3960]
    - [472, 11158.0]
  - - [4096, 1024, 1, 6656]
    - [472, 9313.68]
  - - [1024, 4096, 1, 6480]
    - [481, 9390.46]
  - - [1024, 4096, 1, 8008]
    - [472, 9593.69]
  - - [1024, 1024, 1, 2112]
    - [477, 8533.38]
  - - [1024, 4096, 1, 7248]
    - [472, 9139.29]
  - - [4096, 1024, 1, 7448]
    - [472, 9366.03]
  - - [4096, 1024, 1, 6336]
    - [472, 9272.77]
  - - [1024, 1024, 1, 4200]
    - [474, 8819.3]
  - - [1024, 4096, 1, 4176]
    - [472, 10438.7]
  - - [1024, 1024, 1, 7296]
    - [481, 8702.32]
  - - [1024, 4096, 1, 5568]
    - [472, 10157.4]
  - - [1024, 4096, 1, 6496]
    - [472, 9766.75]
  - - [4096, 1024, 1, 5712]
    - [479, 9740.52]
  - - [1024, 4096, 1, 6992]
    - [472, 10450.2]
  - - [1024, 4096, 1, 5056]
    - [481, 10094.0]
  - - [1024, 33712, 1, 7072]
    - [489, 10097.8]
  - - [4096, 1024, 1, 7656]
    - [476, 9198.68]
  - - [1024, 4096, 1, 6440]
    - [472, 10443.6]
  - - [1024, 4096, 1, 5280]
    - [472, 9521.99]
  - - [1024, 4096, 1, 6208]
    - [472, 9722.4]
  - - [4096, 1024, 1, 5120]
    - [479, 9114.0]
  - - [1024, 33712, 1, 7760]
    - [478, 10479.4]
  - - [1024, 4096, 1, 3264]
    - [483, 9371.69]
  - - [1024, 33712, 1, 7176]
    - [489, 10211.1]
  - - [1024, 4096, 1, 2584]
    - [486, 9247.48]
  - - [1024, 1024, 1, 7728]
    - [472, 8284.3]
  - - [1024, 4096, 1, 6120]
    - [480, 9213.06]
  - - [4096, 1024, 1, 7584]
    - [486, 9418.23]
  - - [1024, 1024, 1, 6120]
    - [472, 8280.77]
  - - [4096, 1024, 1, 6344]
    - [472, 9477.34]
  - - [4096, 1024, 1, 7296]
    - [472, 8855.43]
  - - [1024, 4096, 1, 8000]
    - [472, 9648.7]
  - - [1024, 33712, 1, 4680]
    - [473, 11412.5]
  - - [1024, 33712, 1, 6960]
    - [474, 10498.4]
  - - [4096, 1024, 1, 6784]
    - [483, 9697.25]
  - - [1024, 1024, 1, 1824]
    - [472, 8848.07]
  - - [4096, 1024, 1, 3200]
    - [472, 10433.6]
  - - [1024, 4096, 1, 7480]
    - [472, 10137.2]
  - - [1024, 4096, 1, 8064]
    - [487, 9508.89]
  - - [1024, 1024, 1, 2600]
    - [487, 9146.16]
  - - [1024, 4096, 1, 7536]
    - [472, 9484.42]
  - - [1024, 4096, 1, 8024]
    - [477, 9449.82]
  - - [1024, 33712, 1, 6912]
    - [475, 10675.0]
  - - [1024, 33712, 1, 6432]
    - [475, 11092.5]
  - - [1024, 1024, 1, 6392]
    - [481, 8112.02]
  - - [1024, 1024, 1, 7280]
    - [472, 8948.71]
  - - [1024, 1024, 1, 6400]
    - [472, 8304.7]
  - - [1024, 1024, 1, 7936]
    - [472, 8958.61]
  - - [1024, 33712, 1, 7696]
    - [478, 10454.5]
  - - [4096, 1024, 1, 7504]
    - [476, 9954.06]
  - - [1024, 1024, 1, 6656]
    - [472, 8944.15]
  - - [1024, 4096, 1, 6072]
    - [472, 9691.21]
  - - [1024, 1024, 1, 3240]
    - [472, 8226.88]
  - - [1024, 33712, 1, 6080]
    - [475, 11247.6]
  - - [1024, 4096, 1, 4576]
    - [472, 11061.0]
  - - [1024, 4096, 1, 7488]
    - [472, 9634.24]
  - - [4096, 1024, 1, 6480]
    - [472, 9227.73]
  - - [1024, 33712, 1, 7680]
    - [478, 10289.1]
  - - [1024, 1024, 1, 7416]
    - [487, 8202.07]
  - - [1024, 33712, 1, 6696]
    - [475, 10791.8]
  - - [1024, 33712, 1, 7888]
    - [478, 10443.0]
  - - [1024, 4096, 1, 7400]
    - [476, 9220.52]
  - - [1024, 1024, 1, 5632]
    - [487, 8079.18]
  - - [4096, 1024, 1, 8000]
    - [476, 9199.82]
  - - [1024, 1024, 1, 3696]
    - [472, 8248.6]
  - - [1024, 1024, 1, 7696]
    - [472, 8947.37]
  - - [1024, 4096, 1, 7208]
    - [476, 9205.08]
  - - [4096, 1024, 1, 7912]
    - [476, 9189.73]
  - - [4096, 1024, 1, 6552]
    - [484, 9688.14]
  - - [4096, 1024, 1, 7848]
    - [476, 9201.21]
  - - [1024, 33712, 1, 3344]
    - [475, 10285.4]
  - - [1024, 33712, 1, 6808]
    - [475, 10718.7]
  - - [1024, 4096, 1, 7840]
    - [472, 9340.34]
  - - [4096, 1024, 1, 4608]
    - [477, 9932.21]
  - - [4096, 1024, 1, 6200]
    - [484, 9786.76]
  - - [1024, 1024, 1, 8184]
    - [474, 8324.46]
  - - [1024, 33712, 1, 7216]
    - [488, 10131.3]
  - - [1024, 33712, 1, 7656]
    - [478, 10218.4]
  - - [1024, 4096, 1, 7752]
    - [476, 9921.32]
  - - [4096, 1024, 1, 7936]
    - [476, 9219.24]
  - - [1024, 1024, 1, 2184]
    - [472, 8837.92]
  - - [4096, 1024, 1, 2184]
    - [472, 10189.9]
  - - [1024, 4096, 1, 4680]
    - [472, 10495.6]
  - - [1024, 1024, 1, 6832]
    - [482, 8633.64]
  - - [1024, 4096, 1, 1440]
    - [472, 10465.4]
  - - [1024, 4096, 1, 6888]
    - [480, 9940.5]
  - - [4096, 1024, 1, 7168]
    - [472, 9252.72]
  - - [4096, 1024, 1, 7840]
    - [481, 9106.71]
  - - [1024, 1024, 1, 6960]
    - [472, 8294.76]
  - - [1024, 1024, 1, 4680]
    - [472, 8702.15]
  - - [1024, 4096, 1, 7832]
    - [472, 9700.7]
  - - [1024, 33712, 1, 4992]
    - [473, 10052.1]
  - - [1024, 4096, 1, 6912]
    - [479, 9143.33]
  - - [1024, 33712, 1, 6208]
    - [475, 11184.7]
  - - [4096, 1024, 1, 6600]
    - [476, 9907.49]
  - - [1024, 1024, 1, 6800]
    - [472, 8141.83]
  - - [1024, 33712, 1, 8160]
    - [478, 10409.0]
  - - [1024, 4096, 1, 6696]
    - [483, 9305.08]
  - - [1024, 1024, 1, 4432]
    - [487, 8649.63]
  - - [1024, 1024, 1, 5984]
    - [472, 8285.78]
  - - [1024, 33712, 1, 8136]
    - [478, 10449.5]
  - - [4096, 1024, 1, 6120]
    - [483, 9598.06]
  - - [4096, 1024, 1, 7040]
    - [482, 9309.36]
  - - [4096, 1024, 1, 5880]
    - [484, 9234.93]
  - - [1024, 1024, 1, 5760]
    - [472, 8322.0]
  - - [1024, 1024, 1, 5920]
    - [485, 8001.07]
  - - [4096, 1024, 1, 4800]
    - [484, 9960.32]
  - - [4096, 1024, 1, 8056]
    - [476, 9202.85]
  - - [4096, 1024, 1, 5824]
    - [472, 9563.83]
  - - [1024, 1024, 1, 6688]
    - [487, 8730.27]
  - - [1024, 1024, 1, 7848]
    - [472, 8215.39]
  - - [1024, 4096, 1, 4224]
    - [472, 9118.77]
  - - [1024, 33712, 1, 7904]
    - [478, 10413.3]
  - - [4096, 1024, 1, 5280]
    - [483, 10192.3]
  - - [1024, 4096, 1, 7936]
    - [472, 10195.9]
  - - [1024, 1024, 1, 1440]
    - [482, 7786.44]
  - - [1024, 1024, 1, 5424]
    - [472, 8934.68]
  - - [1024, 1024, 1, 2992]
    - [487, 8545.79]
  - - [1024, 33712, 1, 8192]
    - [478, 10347.8]
  - - [1024, 1024, 1, 3128]
    - [485, 8045.37]
  - - [1024, 4096, 1, 4144]
    - [472, 10457.0]
  - - [4096, 1024, 1, 7680]
    - [486, 9793.78]
  - - [1024, 4096, 1, 8056]
    - [480, 9251.64]
  - - [1024, 4096, 1, 7776]
    - [472, 9795.41]
  - - [4096, 1024, 1, 1440]
    - [477, 9798.47]
  - - [4096, 1024, 1, 3696]
    - [472, 10352.4]
  - - [1024, 1024, 1, 7344]
    - [484, 8441.55]
  - - [4096, 1024, 1, 6496]
    - [472, 9298.25]
  - - [4096, 1024, 1, 7192]
    - [479, 9110.09]
  - - [1024, 1024, 1, 6208]
    - [472, 8283.54]
  - - [4096, 1024, 1, 7128]
    - [479, 9119.36]
  - - [1024, 1024, 1, 6912]
    - [472, 8159.66]
  - - [1024, 1024, 1, 3264]
    - [474, 8730.98]
  - - [1024, 4096, 1, 5632]
    - [472, 9661.29]
  - - [4096, 1024, 1, 7440]
    - [476, 9220.18]
  - - [1024, 1024, 1, 5184]
    - [472, 8924.02]
  - - [1024, 1024, 1, 6384]
    - [474, 8987.76]
  - - [4096, 1024, 1, 3128]
    - [472, 10437.0]
  - - [4096, 1024, 1, 6768]
    - [472, 9358.25]
  - - [1024, 33712, 1, 8176]
    - [478, 10329.5]
  - - [1024, 1024, 1, 8096]
    - [484, 8540.49]
  - - [1024, 33712, 1, 8064]
    - [478, 10396.0]
  - - [4096, 1024, 1, 6440]
    - [472, 9151.14]
  - - [1024, 1024, 1, 6992]
    - [484, 8514.84]
  - - [4096, 1024, 1, 7968]
    - [476, 9434.95]
  - - [1024, 4096, 1, 2992]
    - [472, 10465.4]
  - - [1024, 1024, 1, 6560]
    - [482, 8106.24]
  - - [1024, 4096, 1, 8040]
    - [472, 9858.88]
  - - [4096, 1024, 1, 4320]
    - [484, 9537.7]
  - - [1024, 4096, 1, 6624]
    - [472, 10465.2]
  - - [4096, 1024, 1, 7200]
    - [476, 9214.84]
  - - [1024, 4096, 1, 2184]
    - [472, 9738.4]
  - - [1024, 1024, 1, 6448]
    - [484, 8469.28]
  - - [1024, 1024, 1, 7680]
    - [472, 8954.98]
  - - [1024, 4096, 1, 6240]
    - [472, 8976.42]
  - - [1024, 1024, 1, 6936]
    - [474, 8216.85]
  - - [1024, 33712, 1, 7544]
    - [478, 10209.1]
  - - [1024, 1024, 1, 8176]
    - [486, 8035.7]
  - - [1024, 33712, 1, 6720]
    - [473, 10465.7]
  - - [1024, 1024, 1, 7072]
    - [487, 8097.65]
  - - [4096, 1024, 1, 5576]
    - [479, 9824.97]
  - - [1024, 1024, 1, 3120]
    - [472, 8907.5]
  - - [4096, 1024, 1, 7176]
    - [476, 9173.6]
  - - [1024, 33712, 1, 7912]
    - [478, 10517.7]
  - - [1024, 4096, 1, 7616]
    - [476, 9915.73]
  - - [4096, 1024, 1, 2992]
    - [482, 9277.65]
  - - [1024, 33712, 1, 7208]
    - [489, 10109.5]
  - - [1024, 33712, 1, 7704]
    - [478, 10412.5]
  - - [1024, 33712, 1, 7800]
    - [478, 10405.8]
  - - [1024, 1024, 1, 5888]
    - [492, 8087.92]
  - - [4096, 1024, 1, 7800]
    - [472, 8834.18]
  - - [1024, 1024, 1, 4800]
    - [472, 8265.15]
  - - [1024, 33712, 1, 5984]
    - [475, 11072.5]
  - - [4096, 1024, 1, 7008]
    - [476, 9211.52]
  - - [1024, 33712, 1, 7232]
    - [482, 10385.5]
  - - [1024, 1024, 1, 5400]
    - [493, 8068.7]
  - - [1024, 33712, 1, 4576]
    - [473, 10840.5]
  - - [1024, 1024, 1, 7440]
    - [472, 9580.24]
  - - [1024, 33712, 1, 7616]
    - [490, 10088.1]
  - - [4096, 1024, 1, 7696]
    - [476, 9213.8]
  - - [1024, 1024, 1, 4864]
    - [474, 8281.79]
  - - [1024, 1024, 1, 6080]
    - [482, 8716.12]
  - - [1024, 4096, 1, 6768]
    - [472, 9928.84]
  - - [4096, 1024, 1, 5936]
    - [479, 9129.52]
  - - [1024, 4096, 1, 2576]
    - [472, 10500.4]
  - - [1024, 4096, 1, 968]
    - [472, 10152.2]
  - - [1024, 1024, 1, 5616]
    - [482, 8099.67]
  - - [4096, 1024, 1, 2576]
    - [472, 9752.05]
  - - [4096, 1024, 1, 4736]
    - [477, 9400.75]
  - - [4096, 1024, 1, 6912]
    - [472, 9304.37]
  - - [1024, 1024, 1, 6808]
    - [472, 8284.61]
  - - [1024, 4096, 1, 6512]
    - [472, 9735.53]
  - - [4096, 1024, 1, 7488]
    - [476, 9223.42]
  - - [1024, 4096, 1, 5824]
    - [472, 9568.62]
  - - [1024, 4096, 1, 8112]
    - [472, 9444.42]
  - - [1024, 33712, 1, 6048]
    - [475, 11151.8]
  - - [1024, 4096, 1, 5880]
    - [479, 9839.47]
  - - [4096, 1024, 1, 6048]
    - [482, 9215.54]
  - - [4096, 1024, 1, 8176]
    - [476, 9224.57]
  - - [1024, 4096, 1, 3128]
    - [476, 9813.7]
  - - [1024, 33712, 1, 5760]
    - [475, 11148.0]
  - - [1024, 33712, 1, 7040]
    - [475, 10629.3]
  - - [1024, 4096, 1, 6400]
    - [479, 9158.84]
  - - [1024, 1024, 1, 6944]
    - [481, 8114.12]
  - - [1024, 4096, 1, 5920]
    - [472, 10318.7]
  - - [1024, 4096, 1, 1952]
    - [482, 10156.9]
  - - [4096, 1024, 1, 7360]
    - [486, 9463.51]
  - - [1024, 1024, 1, 7520]
    - [481, 8000.47]
  - - [1024, 4096, 1, 2304]
    - [484, 9625.91]
  - - [1024, 4096, 1, 5472]
    - [481, 9741.91]
  - - [1024, 4096, 1, 1824]
    - [482, 10159.3]
  - - [1024, 1024, 1, 4784]
    - [487, 8686.06]
  - - [4096, 1024, 1, 7248]
    - [479, 9118.9]
  - - [1024, 1024, 1, 7104]
    - [472, 8954.06]
  - - [4096, 1024, 1, 7104]
    - [486, 9209.1]
  - - [1024, 4096, 1, 7104]
    - [472, 9527.6]
  - - [1024, 4096, 1, 5264]
    - [475, 9644.4]
  - - [4096, 1024, 1, 7424]
    - [486, 9449.17]
  - - [1024, 4096, 1, 5120]
    - [472, 9758.42]
  - - [1024, 33712, 1, 3840]
    - [480, 9697.36]
  - - [1024, 1024, 1, 6536]
    - [487, 8730.09]
  - - [1024, 4096, 1, 5712]
    - [472, 9744.01]
  - - [4096, 1024, 1, 6208]
    - [484, 9110.11]
  - - [1024, 33712, 1, 7920]
    - [478, 10394.4]
  - - [1024, 4096, 1, 4896]
    - [476, 9916.57]
  - - [1024, 4096, 1, 5152]
    - [481, 10045.5]
  - - [1024, 1024, 1, 7888]
    - [481, 8704.27]
  - - [4096, 1024, 1, 7888]
    - [476, 9590.39]
  - - [1024, 33712, 1, 6888]
    - [475, 10712.6]
  - - [4096, 1024, 1, 7480]
    - [480, 9336.4]
  - - [1024, 1024, 1, 2392]
    - [472, 8884.19]
  - - [1024, 33712, 1, 6552]
    - [475, 11087.7]
  - - [1024, 1024, 1, 3672]
    - [472, 8875.06]
  - - [1024, 4096, 1, 6960]
    - [472, 10537.2]
  - - [1024, 4096, 1, 7392]
    - [480, 9257.64]
  - - [4096, 1024, 1, 5440]
    - [484, 9122.1]
  - - [1024, 33712, 1, 5520]
    - [475, 10858.9]
  - - [1024, 33712, 1, 6784]
    - [474, 10500.6]
  - - [4096, 1024, 1, 3240]
    - [483, 10070.5]
  - - [4096, 1024, 1, 2304]
    - [472, 9569.48]
  - - [1024, 33712, 1, 2240]
    - [474, 11008.7]
  - - [1024, 1024, 1, 7896]
    - [484, 8474.79]
  - - [1024, 4096, 1, 6688]
    - [480, 9238.14]
  - - [1024, 1024, 1, 5472]
    - [472, 8285.86]
  - - [1024, 4096, 1, 5808]
    - [481, 9395.13]
  - - [4096, 1024, 1, 6448]
    - [484, 9746.29]
  - - [1024, 4096, 1, 7704]
    - [472, 9423.72]
  - - [1024, 1024, 1, 7192]
    - [494, 8281.36]
  - - [4096, 1024, 1, 7000]
    - [479, 9127.09]
  - - [1024, 4096, 1, 6536]
    - [472, 9660.12]
  - - [1024, 1024, 1, 7600]
    - [474, 8237.36]
  - - [1024, 1024, 1, 6720]
    - [484, 8145.0]
  - - [4096, 1024, 1, 7600]
    - [486, 9386.07]
  - - [1024, 4096, 1, 7600]
    - [472, 9757.27]
  - - [1024, 4096, 1, 7760]
    - [472, 9126.82]
  - - [1024, 4096, 1, 4888]
    - [481, 9501.73]
  - - [1024, 4096, 1, 7168]
    - [472, 9650.46]
  - - [4096, 1024, 1, 4888]
    - [484, 9757.88]
  - - [1024, 33712, 1, 7392]
    - [489, 10060.1]
  - - [1024, 1024, 1, 2944]
    - [485, 8563.58]
  - - [1024, 1024, 1, 7752]
    - [472, 8940.31]
  - - [1024, 4096, 1, 1144]
    - [477, 9576.62]
  - - [4096, 1024, 1, 3952]
    - [472, 10110.7]
  - - [1024, 33712, 1, 5280]
    - [475, 10957.7]
  - - [4096, 1024, 1, 6000]
    - [484, 9598.5]
  - - [1024, 1024, 1, 7560]
    - [474, 8829.99]
  - - [1024, 33712, 1, 5440]
    - [475, 10753.7]
  - - [1024, 4096, 1, 7200]
    - [472, 10910.9]
  - - [1024, 33712, 1, 7280]
    - [485, 10197.0]
  - - [1024, 4096, 1, 7656]
    - [478, 9301.42]
  - - [1024, 1024, 1, 7656]
    - [484, 8024.02]
  - - [4096, 1024, 1, 3000]
    - [482, 9529.59]
  - - [1024, 1024, 1, 8000]
    - [472, 8954.51]
  - - [4096, 1024, 1, 6240]
    - [479, 9134.06]
  - - [1024, 33712, 1, 4800]
    - [473, 11599.0]
  - - [1024, 33712, 1, 7344]
    - [485, 10314.9]
  - - [4096, 1024, 1, 4488]
    - [481, 9533.25]
  - - [1024, 1024, 1, 3344]
    - [472, 8904.99]
  - - [1024, 4096, 1, 7128]
    - [480, 9235.88]
  - - [1024, 33712, 1, 6336]
    - [475, 10892.0]
  - - [4096, 1024, 1, 3264]
    - [477, 10220.8]
  - - [1024, 1024, 1, 3360]
    - [485, 8083.71]
  - - [1024, 1024, 1, 5952]
    - [472, 9575.77]
  - - [4096, 1024, 1, 5952]
    - [484, 9250.46]
  - - [1024, 1024, 1, 6840]
    - [472, 8282.79]
  - - [1024, 1024, 1, 6000]
    - [487, 8746.85]
  - - [1024, 1024, 1, 5680]
    - [481, 8084.33]
  - - [4096, 1024, 1, 5200]
    - [472, 9492.32]
  - - [1024, 4096, 1, 5200]
    - [481, 9934.73]
  - - [1024, 1024, 1, 5200]
    - [472, 8265.49]
  - - [1024, 1024, 1, 1760]
    - [472, 8232.91]
  - - [4096, 1024, 1, 1760]
    - [472, 10465.5]
  - - [4096, 1024, 1, 6392]
    - [484, 9404.08]
  - - [1024, 4096, 1, 1760]
    - [482, 10211.9]
  - - [1024, 33712, 1, 4736]
    - [480, 10593.0]
  - - [1024, 1024, 1, 7592]
    - [484, 8043.78]
  - - [4096, 1024, 1, 7592]
    - [476, 9194.48]
  - - [1024, 33712, 1, 4872]
    - [476, 11127.4]
  - - [1024, 4096, 1, 7592]
    - [472, 9349.76]
  - - [1024, 4096, 1, 5440]
    - [472, 9661.32]
  - - [1024, 1024, 1, 7904]
    - [472, 8296.54]
  - - [1024, 1024, 1, 3520]
    - [485, 8599.67]
  - - [1024, 4096, 1, 6408]
    - [472, 10459.0]
  - - [1024, 1024, 1, 3200]
    - [472, 8783.86]
  - - [1024, 4096, 1, 3200]
    - [476, 9785.45]
  - - [4096, 1024, 1, 2352]
    - [484, 9785.9]
  - - [1024, 33712, 1, 6936]
    - [475, 10606.3]
  - - [1024, 1024, 1, 2160]
    - [486, 8524.99]
  - - [1024, 33712, 1, 6880]
    - [475, 10345.8]
  - - [1024, 1024, 1, 7056]
    - [482, 8776.25]
  - - [1024, 4096, 1, 7056]
    - [472, 9756.74]
  - - [1024, 1024, 1, 7504]
    - [484, 8328.91]
  - - [1024, 33712, 1, 5632]
    - [480, 10540.5]
  - - [4096, 1024, 1, 6384]
    - [484, 9901.03]
  - - [1024, 33712, 1, 7520]
    - [490, 10193.0]
  - - [4096, 1024, 1, 7520]
    - [483, 9236.58]
  - - [4096, 1024, 1, 1248]
    - [472, 10372.7]
  - - [1024, 1024, 1, 3000]
    - [474, 8874.18]
  - - [1024, 4096, 1, 4368]
    - [479, 9841.77]
  - - [1024, 1024, 1, 5600]
    - [472, 8912.1]
  - - [4096, 1024, 1, 2720]
    - [482, 9187.34]
  - - [4096, 1024, 1, 5600]
    - [477, 10171.5]
  - - [1024, 4096, 1, 6000]
    - [472, 10388.8]
  - - [1024, 4096, 1, 5600]
    - [472, 9764.54]
  - - [1024, 33712, 1, 5952]
    - [475, 11288.1]
  - - [4096, 1024, 1, 5568]
    - [483, 10200.7]
  - - [4096, 1024, 1, 4624]
    - [484, 9938.91]
  - - [1024, 1024, 1, 6232]
    - [472, 8916.47]
  - - [1024, 33712, 1, 5920]
    - [475, 11238.2]
  - - [1024, 4096, 1, 6232]
    - [472, 10656.4]
  - - [4096, 1024, 1, 3960]
    - [481, 9220.88]
  - - [1024, 33712, 1, 7832]
    - [478, 10410.2]
  - - [1024, 33712, 1, 5376]
    - [475, 10758.5]
  - - [1024, 4096, 1, 4608]
    - [472, 11138.9]
  - - [1024, 1024, 1, 7216]
    - [472, 8292.24]
  - - [1024, 33712, 1, 5200]
    - [488, 10439.0]
  - - [4096, 1024, 1, 7392]
    - [476, 9940.55]
  - - [1024, 1024, 1, 6864]
    - [472, 8286.59]
  - - [1024, 1024, 1, 2720]
    - [482, 8609.39]
  - - [1024, 1024, 1, 7544]
    - [484, 8601.29]
  - - [1024, 1024, 1, 5440]
    - [486, 8100.77]
  - - [4096, 1024, 1, 7544]
    - [486, 8857.27]
  - - [1024, 33712, 1, 8096]
    - [478, 10427.6]
  - - [1024, 1024, 1, 4960]
    - [482, 8839.09]
  - - [1024, 1024, 1, 3456]
    - [472, 8290.32]
  - - [1024, 1024, 1, 2576]
    - [485, 8539.21]
  - - [1024, 33712, 1, 1824]
    - [478, 11226.8]
  - - [1024, 4096, 1, 2976]
    - [483, 9613.53]
  - - [1024, 33712, 1, 5032]
    - [494, 10156.9]
  - - [4096, 1024, 1, 1952]
    - [479, 10148.8]
  - - [1024, 4096, 1, 5032]
    - [481, 9996.24]
  - - [1024, 1024, 1, 5032]
    - [485, 8698.92]
  - - [4096, 1024, 1, 3864]
    - [472, 9687.93]
  - - [1024, 33712, 1, 3952]
    - [474, 10414.5]
  - - [1024, 1024, 1, 3952]
    - [487, 8049.65]
  - - [1024, 33712, 1, 7192]
    - [485, 10323.7]
  - - [1024, 1024, 1, 1472]
    - [487, 8817.98]
  - - [4096, 1024, 1, 7784]
    - [476, 9204.6]
  - - [4096, 1024, 1, 1472]
    - [482, 9981.24]
  - - [1024, 1024, 1, 6216]
    - [472, 8898.44]
  - - [1024, 4096, 1, 5792]
    - [481, 9869.56]
  - - [1024, 33712, 1, 5208]
    - [475, 10722.1]
  - - [4096, 1024, 1, 5208]
    - [483, 10258.0]
  - - [1024, 4096, 1, 5208]
    - [472, 10429.7]
  - - [1024, 1024, 1, 5208]
    - [472, 8258.18]
  - - [1024, 33712, 1, 8040]
    - [478, 10435.1]
  - - [1024, 1024, 1, 968]
    - [485, 8509.57]
  - - [4096, 1024, 1, 4968]
    - [472, 9709.08]
  - - [4096, 1024, 1, 7896]
    - [476, 9203.16]
  - - [1024, 4096, 1, 4968]
    - [472, 9690.65]
  - - [1024, 4096, 1, 8160]
    - [472, 9744.61]
  - - [4096, 1024, 1, 5680]
    - [479, 9809.43]
  - - [4096, 1024, 1, 6840]
    - [482, 9623.55]
  - - [1024, 33712, 1, 6448]
    - [475, 11126.3]
  - - [4096, 1024, 1, 6400]
    - [472, 9544.68]
  - - [1024, 33712, 1, 6440]
    - [475, 10605.4]
  - - [1024, 33712, 1, 5104]
    - [474, 11030.8]
  - - [4096, 1024, 1, 5792]
    - [483, 10290.3]
  - - [1024, 1024, 1, 5520]
    - [472, 8943.33]
  - - [1024, 1024, 1, 1952]
    - [472, 8874.51]
  - - [4096, 1024, 1, 4224]
    - [472, 9399.37]
  - - [1024, 1024, 1, 7448]
    - [472, 8782.91]
  - - [1024, 4096, 1, 7448]
    - [480, 9244.52]
  - - [1024, 33712, 1, 2992]
    - [474, 10144.0]
  - - [4096, 1024, 1, 5336]
    - [484, 9986.76]
  - - [1024, 4096, 1, 1472]
    - [472, 9725.89]
  - - [1024, 33712, 1, 6320]
    - [476, 10714.4]
  - - [4096, 1024, 1, 1144]
    - [472, 10289.6]
  - - [1024, 1024, 1, 7080]
    - [472, 8932.4]
  - - [4096, 1024, 1, 7080]
    - [472, 9191.17]
  - - [4096, 1024, 1, 6528]
    - [477, 9517.63]
  - - [1024, 1024, 1, 5704]
    - [472, 8747.31]
  - - [1024, 4096, 1, 4816]
    - [472, 9479.16]
  - - [4096, 1024, 1, 5704]
    - [484, 9270.95]
  - - [4096, 1024, 1, 2600]
    - [472, 10434.4]
  - - [1024, 4096, 1, 2600]
    - [472, 10432.0]
  - - [1024, 1024, 1, 4896]
    - [472, 8262.22]
  - - [1024, 4096, 1, 3696]
    - [476, 9878.98]
  - - [4096, 1024, 1, 5760]
    - [477, 10378.7]
  - - [1024, 1024, 1, 6072]
    - [472, 8263.59]
  - - [4096, 1024, 1, 6072]
    - [477, 10201.8]
  - - [4096, 1024, 1, 6696]
    - [472, 9293.26]
  - - [4096, 1024, 1, 1320]
    - [472, 10290.8]
  - - [1024, 4096, 1, 7192]
    - [480, 9947.15]
  - - [1024, 4096, 1, 7224]
    - [472, 9604.03]
  - - [1024, 33712, 1, 4488]
    - [478, 10508.5]
  - - [1024, 1024, 1, 4488]
    - [486, 8000.12]
  - - [4096, 1024, 1, 5264]
    - [484, 9883.41]
  - - [1024, 1024, 1, 6576]
    - [472, 8935.59]
  - - [1024, 1024, 1, 5264]
    - [472, 8935.0]
  - - [1024, 33712, 1, 3328]
    - [473, 10470.2]
  - - [1024, 1024, 1, 5832]
    - [485, 8179.0]
  - - [1024, 33712, 1, 6944]
    - [473, 10620.7]
  - - [1024, 1024, 1, 1320]
    - [485, 8318.01]
  - - [1024, 4096, 1, 4440]
    - [479, 9819.59]
  - - [1024, 4096, 1, 7848]
    - [477, 9378.0]
  - - [1024, 1024, 1, 4224]
    - [472, 8286.88]
  - - [4096, 1024, 1, 6808]
    - [484, 9187.26]
  - - [4096, 1024, 1, 4704]
    - [477, 10329.4]
  - - [1024, 1024, 1, 5880]
    - [472, 8930.48]
  - - [1024, 4096, 1, 2944]
    - [480, 9176.02]
  - - [1024, 1024, 1, 1248]
    - [472, 7944.5]
  - - [1024, 1024, 1, 4608]
    - [472, 8790.25]
  - - [1024, 1024, 1, 3384]
    - [472, 8722.65]
  - - [1024, 1024, 1, 3528]
    - [472, 8219.35]
  - - [1024, 1024, 1, 3536]
    - [472, 8131.04]
  - - [1024, 1024, 1, 4752]
    - [472, 8902.98]
  - - [4096, 1024, 1, 8136]
    - [479, 9051.66]
  - - [4096, 1024, 1, 4752]
    - [472, 9715.75]
  - - [1024, 4096, 1, 6392]
    - [472, 10337.3]
  - - [4096, 1024, 1, 4352]
    - [477, 9801.09]
  - - [1024, 33712, 1, 7592]
    - [490, 10210.6]
  - - [1024, 33712, 1, 4816]
    - [479, 9494.75]
  - - [1024, 33712, 1, 3000]
    - [480, 9791.96]
  - - [4096, 1024, 1, 4816]
    - [481, 9688.66]
  - - [4096, 1024, 1, 7552]
    - [486, 9222.3]
  - - [1024, 33712, 1, 7320]
    - [485, 10203.7]
  - - [1024, 4096, 1, 7800]
    - [480, 9233.31]
  - - [1024, 1024, 1, 7480]
    - [484, 8061.3]
  - - [1024, 1024, 1, 2592]
    - [485, 8058.29]
  - - [1024, 4096, 1, 2592]
    - [472, 9694.32]
  - - [1024, 33712, 1, 3536]
    - [473, 10768.2]
  - - [4096, 1024, 1, 5520]
    - [479, 9841.06]
  - - [1024, 33712, 1, 7552]
    - [490, 10220.6]
  - - [1024, 33712, 1, 6512]
    - [475, 11104.8]
  - - [1024, 33712, 1, 3672]
    - [474, 11291.9]
  - - [1024, 4096, 1, 3672]
    - [473, 8903.39]
  - - [1024, 4096, 1, 4960]
    - [481, 9342.07]
  - - [1024, 33712, 1, 6360]
    - [475, 11174.2]
  - - [4096, 1024, 1, 6360]
    - [484, 9961.64]
  - - [1024, 4096, 1, 6728]
    - [472, 10525.1]
  - - [1024, 4096, 1, 6360]
    - [487, 9141.77]
  - - [1024, 1024, 1, 6360]
    - [472, 8303.77]
  - - [1024, 1024, 1, 1512]
    - [472, 8780.7]
  - - [1024, 4096, 1, 1512]
    - [472, 9689.78]
  - - [1024, 1024, 1, 1960]
    - [474, 8810.03]
  - - [4096, 1024, 1, 1960]
    - [472, 10253.5]
  - - [1024, 33712, 1, 5824]
    - [475, 11212.7]
  - - [1024, 33712, 1, 7568]
    - [490, 10164.7]
  - - [1024, 33712, 1, 2584]
    - [472, 9475.08]
  - - [4096, 1024, 1, 6592]
    - [486, 9311.85]
  - - [4096, 1024, 1, 2584]
    - [472, 9580.34]
  - - [1024, 1024, 1, 2584]
    - [472, 8613.66]
  - - [1024, 33712, 1, 5424]
    - [475, 10929.6]
  - - [4096, 1024, 1, 5424]
    - [484, 9973.45]
  - - [1024, 4096, 1, 5424]
    - [472, 10444.1]
  - - [4096, 1024, 1, 4368]
    - [481, 9530.49]
  - - [1024, 1024, 1, 7744]
    - [472, 8943.68]
  - - [1024, 1024, 1, 6976]
    - [484, 8436.57]
  - - [1024, 1024, 1, 6512]
    - [472, 8917.96]
  - - [1024, 1024, 1, 4736]
    - [474, 8860.34]
  - - [1024, 33712, 1, 2576]
    - [474, 10948.4]
  - - [1024, 33712, 1, 6968]
    - [475, 10238.0]
  - - [4096, 1024, 1, 6968]
    - [476, 9506.43]
  - - [1024, 1024, 1, 6968]
    - [472, 8860.18]
  - - [1024, 4096, 1, 2352]
    - [472, 10391.2]
  - - [1024, 1024, 1, 2352]
    - [482, 8487.89]
  - - [1024, 4096, 1, 6800]
    - [480, 9250.75]
  - - [4096, 1024, 1, 7704]
    - [476, 9191.68]
  - - [1024, 1024, 1, 7704]
    - [472, 8295.21]
  - - [4096, 1024, 1, 4144]
    - [477, 11013.5]
  - - [1024, 33712, 1, 3120]
    - [474, 10597.2]
  - - [4096, 1024, 1, 7776]
    - [476, 9206.36]
  - - [1024, 33712, 1, 8184]
    - [478, 10396.3]
  - - [1024, 33712, 1, 6656]
    - [475, 10915.1]
  - - [4096, 1024, 1, 7632]
    - [479, 9154.74]
  - - [1024, 4096, 1, 7632]
    - [472, 10377.5]
  - - [1024, 33712, 1, 4368]
    - [477, 9677.69]
  - - [1024, 4096, 1, 7000]
    - [472, 10760.9]
  - - [1024, 4096, 1, 1320]
    - [472, 9668.32]
  - - [1024, 4096, 1, 6272]
    - [472, 9410.0]
  - - [1024, 33712, 1, 6272]
    - [475, 11234.3]
  - - [1024, 4096, 1, 1960]
    - [478, 10184.4]
  - - [1024, 4096, 1, 5952]
    - [484, 9432.78]
  - - [1024, 1024, 1, 7920]
    - [472, 8304.7]
  - - [1024, 33712, 1, 6528]
    - [475, 11074.4]
  - - [4096, 1024, 1, 7320]
    - [476, 9196.68]
  - - [1024, 33712, 1, 7752]
    - [478, 10498.3]
  - - [1024, 33712, 1, 3864]
    - [480, 10422.5]
  - - [1024, 1024, 1, 4480]
    - [485, 8040.55]
  - - [4096, 1024, 1, 4480]
    - [481, 9503.17]
  - - [1024, 4096, 1, 4480]
    - [472, 10478.7]
  - - [1024, 33712, 1, 7056]
    - [475, 10576.2]
  - - [1024, 33712, 1, 7632]
    - [490, 10190.6]
  - - [1024, 4096, 1, 5616]
    - [481, 9978.29]
  - - [1024, 33712, 1, 6192]
    - [475, 11185.7]
  - - [4096, 1024, 1, 6944]
    - [482, 9784.84]
  - - [1024, 4096, 1, 6784]
    - [472, 10086.9]
  - - [1024, 1024, 1, 6784]
    - [495, 8496.8]
  - - [4096, 1024, 1, 2240]
    - [472, 10361.8]
  - - [1024, 4096, 1, 4352]
    - [472, 10406.8]
  - - [1024, 4096, 1, 2240]
    - [472, 9619.93]
  - - [1024, 1024, 1, 2240]
    - [487, 8490.48]
  - - [4096, 1024, 1, 4576]
    - [477, 10128.1]
  - - [1024, 33712, 1, 7360]
    - [490, 10370.6]
  - - [1024, 1024, 1, 4576]
    - [481, 8070.29]
  - - [4096, 1024, 1, 4200]
    - [484, 9639.31]
  - - [4096, 1024, 1, 6976]
    - [472, 9331.11]
  - - [1024, 33712, 1, 5568]
    - [475, 11122.1]
  - - [1024, 33712, 1, 3072]
    - [476, 10095.5]
  - - [4096, 1024, 1, 8064]
    - [486, 9261.03]
  - - [1024, 4096, 1, 2720]
    - [472, 9756.84]
  - - [1024, 33712, 1, 6688]
    - [475, 10811.1]
  - - [1024, 33712, 1, 4032]
    - [494, 9662.92]
  - - [4096, 1024, 1, 5984]
    - [482, 9358.74]
  - - [1024, 33712, 1, 5040]
    - [489, 10040.7]
  - - [1024, 4096, 1, 7320]
    - [479, 9135.61]
  - - [1024, 33712, 1, 3680]
    - [473, 10084.1]
  - - [4096, 1024, 1, 3680]
    - [477, 9484.22]
  - - [1024, 4096, 1, 5984]
    - [481, 10027.6]
  - - [1024, 4096, 1, 3680]
    - [482, 9305.81]
  - - [1024, 4096, 1, 3888]
    - [482, 9591.24]
  - - [4096, 1024, 1, 6936]
    - [483, 8874.59]
  - - [4096, 1024, 1, 7688]
    - [476, 9203.81]
  - - [1024, 1024, 1, 7008]
    - [472, 8161.26]
  - - [1024, 1024, 1, 3680]
    - [487, 8600.99]
  - - [1024, 1024, 1, 5808]
    - [472, 8937.12]
  - - [4096, 1024, 1, 5808]
    - [479, 9830.37]
  - - [1024, 33712, 1, 5888]
    - [475, 11175.9]
  - - [1024, 33712, 1, 6112]
    - [475, 11246.5]
  - - [1024, 4096, 1, 4200]
    - [473, 9627.93]
  - - [1024, 4096, 1, 6112]
    - [479, 9840.74]
  - - [1024, 1024, 1, 6112]
    - [474, 8898.25]
  - - [4096, 1024, 1, 4432]
    - [472, 10170.0]
  - - [4096, 1024, 1, 4960]
    - [484, 10147.0]
  - - [1024, 33712, 1, 5184]
    - [475, 10551.8]
  - - [1024, 4096, 1, 7072]
    - [481, 9332.38]
  - - [1024, 1024, 1, 3040]
    - [486, 8633.97]
  - - [4096, 1024, 1, 3040]
    - [472, 10446.6]
  - - [1024, 4096, 1, 6160]
    - [472, 9721.58]
  - - [1024, 33712, 1, 8056]
    - [478, 10425.1]
  - - [1024, 1024, 1, 7784]
    - [494, 8362.12]
  - - [1024, 33712, 1, 7536]
    - [478, 10240.6]
  - - [1024, 33712, 1, 7952]
    - [478, 10415.4]
  - - [1024, 4096, 1, 7552]
    - [483, 9499.78]
  - - [1024, 33712, 1, 6864]
    - [475, 10647.8]
  - - [4096, 1024, 1, 6432]
    - [483, 9579.06]
  - - [1024, 33712, 1, 4752]
    - [473, 11366.0]
  - - [1024, 1024, 1, 6160]
    - [482, 8644.55]
  - - [4096, 1024, 1, 6160]
    - [482, 9647.81]
  - - [1024, 1024, 1, 6608]
    - [472, 8233.87]
  - - [4096, 1024, 1, 6608]
    - [477, 9344.78]
  - - [4096, 1024, 1, 6272]
    - [472, 9516.48]
  - - [1024, 33712, 1, 5264]
    - [475, 10702.8]
  - - [1024, 4096, 1, 7896]
    - [480, 8645.05]
  - - [1024, 33712, 1, 4864]
    - [478, 10941.2]
  - - [1024, 1024, 1, 424]
    - [494, 5956.54]
  - - [4096, 1024, 1, 424]
    - [472, 9836.17]
  - - [1024, 4096, 1, 424]
    - [472, 9977.45]
  - - [1024, 33712, 1, 5600]
    - [475, 10892.6]
  - - [1024, 1024, 1, 6760]
    - [481, 8080.66]
  - - [4096, 1024, 1, 6760]
    - [479, 9240.7]
  - - [1024, 4096, 1, 6760]
    - [472, 9717.53]
  - - [1024, 1024, 1, 1144]
    - [472, 8652.42]
  - - [1024, 33712, 1, 6144]
    - [475, 11132.7]
  - - [1024, 1024, 1, 6344]
    - [487, 8712.47]
  - - [4096, 1024, 1, 4872]
    - [472, 9680.97]
  - - [1024, 1024, 1, 3808]
    - [472, 8900.16]
  - - [1024, 33712, 1, 2560]
    - [474, 10184.5]
  - - [4096, 1024, 1, 8032]
    - [486, 9659.97]
  - - [1024, 4096, 1, 8032]
    - [472, 10350.2]
  - - [1024, 1024, 1, 8032]
    - [481, 8007.05]
  - - [1024, 4096, 1, 6576]
    - [477, 9313.35]
  - - [1024, 1024, 1, 2664]
    - [472, 8175.48]
  - - [4096, 1024, 1, 2664]
    - [472, 10230.7]
  - - [1024, 4096, 1, 2664]
    - [472, 9631.75]
