library/src/blas3/Tensile/Logic/archive/vega20_Cijk_Ailk_Bljk_HB.yaml
- {MinimumRequiredVersion: 4.18.0}
- vega20
- gfx906
- [Device 66a0, Device 66a1, Device 66a7, Device 66af, Vega 20]
- - - [1024, 32, 1, 2, 1024, 1024, 1024, 2]
    - [11, 26.0]
  - - [1024, 32, 1, 1024, 1024, 1024, 1024, 1024]
    - [13, 2689.0]
  - - [1024, 4096, 1, 30528, 1024, 1024, 1024, 30528]
    - [8, 25917.0]
  - - [1024, 4096, 1, 1024, 1024, 1024, 1024, 1024]
    - [10, 25700.0]
  - - [4096, 4096, 1, 1024, 4096, 4096, 4096, 1024]
    - [9, 27468.0]
  - - [1024, 4096, 1, 4096, 1024, 1024, 1024, 4096]
    - [4, 24861.0]
  - - [1024, 2048, 1, 1024, 1024, 1024, 1024, 1024]
    - [6, 24032.0]
  - - [1024, 2048, 1, 4096, 1024, 1024, 1024, 4096]
    - [12, 23057.0]
  - - [4096, 2048, 1, 1024, 4096, 4096, 4096, 1024]
    - [7, 26584.0]
  - - [1024, 2048, 1, 30528, 1024, 1024, 1024, 30528]
    - [3, 24935.0]
  - - [1024, 4, 1, 1024, 1024, 1024, 1024, 1024]
    - [15, 290.0]
  - - [1024, 4, 1, 2, 1024, 1024, 1024, 2]
    - [0, 3.0]
  - - [128, 128, 512, 64, 128, 128, 128, 64]
    - [5, 16694.0]
  - - [64, 128, 512, 128, 64, 64, 64, 128]
    - [1, 15643.0]
  - - [64, 512, 64, 512, 64, 64, 64, 512]
    - [14, 16210.0]
  - - [512, 512, 64, 64, 512, 512, 512, 64]
    - [2, 20809.0]
- null
