library/src/blas3/Tensile/Logic/archive/vega20_Cijk_Ailk_Bljk_SB.yaml
- {MinimumRequiredVersion: 4.6.0}
- vega20
- gfx906
- [Device 66a0, Device 66a1, Device 66a7, Device 66af, Vega 20]
    SolutionIndex: 0
    SolutionNameMin: Cijk_Ailk_Bljk_SB_MT128x016x16_DTL0_EPS1_GRVW02_LPB00_PGR1_SNLL0_TT08_02_USFGRO0_VW02_WG16_08_02
    SolutionIndex: 1
    SolutionNameMin: Cijk_Ailk_Bljk_SB_MT128x016x16_DTL0_EPS1_GRVW02_LPB00_PGR1_SNLL0_TT08_02_USFGRO0_VW02_WG16_08_02
    SolutionIndex: 2
    SolutionNameMin: Cijk_Ailk_Bljk_SB_MT128x016x16_DTL0_EPS1_GRVW04_LPB00_PGR1_SNLL0_TT04_04_USFGRO0_VW04_WG32_04_02
    SolutionIndex: 3
    SolutionNameMin: Cijk_Ailk_Bljk_SB_MT064x016x32_DTL0_EPS0_GRVW02_LPB00_PGR0_SNLL0_TT04_02_USFGRO0_VW02_WG16_08_02
    SolutionIndex: 4
    SolutionNameMin: Cijk_Ailk_Bljk_SB_MT128x008x32_DTL0_EPS0_GRVW02_LPB00_PGR0_SNLL0_TT04_02_USFGRO0_VW02_WG32_04_02
    SolutionIndex: 5
    SolutionNameMin: Cijk_Ailk_Bljk_SB_MT128x008x32_DTL0_EPS0_GRVW04_LPB00_PGR0_SNLL0_TT04_04_USFGRO0_VW04_WG32_02_04
    SolutionIndex: 6
    SolutionNameMin: Cijk_Ailk_Bljk_SB_MT064x008x32_DTL0_EPS0_GRVW04_LPB00_PGR0_SNLL0_TT04_04_USFGRO0_VW04_WG16_02_08
    SolutionIndex: 7
    SolutionNameMin: Cijk_Ailk_Bljk_SB_MT064x008x32_DTL0_EPS1_GRVW04_LPB00_PGR1_SNLL0_TT04_04_USFGRO0_VW04_WG16_02_08
    SolutionIndex: 8
    SolutionNameMin: Cijk_Ailk_Bljk_SB_MT064x008x32_DTL0_EPS0_GRVW02_LPB00_PGR0_SNLL0_TT02_02_USFGRO0_VW02_WG32_04_02
    SolutionIndex: 9
    SolutionNameMin: Cijk_Ailk_Bljk_SB_MT128x008x32_DTL0_EPS0_GRVW04_LPB00_PGR0_SNLL0_TT04_04_USFGRO0_VW04_WG32_02_04
    SolutionIndex: 10
    SolutionNameMin: Cijk_Ailk_Bljk_SB_MT064x008x32_DTL0_EPS1_GRVW02_LPB00_PGR1_SNLL0_TT08_02_USFGRO0_VW02_WG08_04_08
    SolutionIndex: 11
    SolutionNameMin: Cijk_Ailk_Bljk_SB_MT032x008x64_DTL0_EPS0_GRVW02_LPB00_PGR0_SNLL0_TT02_02_USFGRO0_VW02_WG16_04_04
    SolutionIndex: 12
    SolutionNameMin: Cijk_Ailk_Bljk_SB_MT064x004x64_DTL0_EPS0_GRVW02_LPB00_PGR0_SNLL0_TT02_02_USFGRO0_VW02_WG32_02_04
    SolutionIndex: 13
    SolutionNameMin: Cijk_Ailk_Bljk_SB_MT064x004x64_DTL0_EPS0_GRVW02_LPB00_PGR0_SNLL0_TT04_02_USFGRO0_VW02_WG16_02_08
    SolutionIndex: 14
    SolutionNameMin: Cijk_Ailk_Bljk_SB_MT048x036x16_DTL0_EPS1_GRVW01_LPB00_PGR1_SNLL0_TT06_03_USFGRO01_VW01_WG08_12_02
    SolutionIndex: 15
    SolutionNameMin: Cijk_Ailk_Bljk_SB_MT036x048x16_DTL0_EPS1_GRVW01_LPB00_PGR1_SNLL0_TT03_03_USFGRO01_VW01_WG12_16_01
    SolutionIndex: 16
    SolutionNameMin: Cijk_Ailk_Bljk_SB_MT048x048x16_DTL0_EPS1_GRVW01_LPB00_PGR1_SNLL0_TT03_03_USFGRO01_VW01_WG16_16_01
    SolutionIndex: 17
    SolutionNameMin: Cijk_Ailk_Bljk_SB_MT048x024x32_DTL0_EPS1_GRVW02_LPB00_PGR1_SNLL0_TT06_04_USFGRO0_VW02_WG08_06_04
    SolutionIndex: 18
    SolutionNameMin: Cijk_Ailk_Bljk_SB_MT024x024x32_DTL0_EPS1_GRVW01_LPB00_PGR1_SNLL0_TT03_04_USFGRO01_VW01_WG08_06_04
    SolutionIndex: 19
    SolutionNameMin: Cijk_Ailk_Bljk_SB_MT048x024x32_DTL0_EPS1_GRVW02_LPB00_PGR1_SNLL0_TT06_04_USFGRO0_VW02_WG08_06_04
    SolutionIndex: 20
    SolutionNameMin: Cijk_Ailk_Bljk_SB_MT032x008x08_DTL0_EPS0_GRVW02_LPB00_PGR1_SNLL0_TT02_02_USFGRO00_VW02_WG16_04_01
    SolutionIndex: 21
    SolutionNameMin: Cijk_Ailk_Bljk_SB_MT016x016x08_DTL0_EPS0_GRVW02_LPB00_PGR1_SNLL0_TT02_02_USFGRO00_VW02_WG08_08_01
    SolutionIndex: 22
    SolutionNameMin: Cijk_Ailk_Bljk_SB_MT032x032x08_DTL0_EPS0_GRVW04_LPB00_PGR1_SNLL0_TT04_04_USFGRO00_VW04_WG08_08_01
    SolutionIndex: 23
    SolutionNameMin: Cijk_Ailk_Bljk_SB_MT064x032x08_DTL0_EPS0_GRVW04_LPB00_PGR1_SNLL0_TT08_04_USFGRO00_VW04_WG08_08_01
    SolutionIndex: 24
    SolutionNameMin: Cijk_Ailk_Bljk_SB_MT032x016x08_DTL0_EPS0_GRVW02_LPB00_PGR1_SNLL0_TT02_02_USFGRO00_VW02_WG16_08_01
    SolutionIndex: 25
    SolutionNameMin: Cijk_Ailk_Bljk_SB_MT064x016x08_DTL0_EPS0_GRVW02_LPB00_PGR1_SNLL0_TT04_02_USFGRO00_VW02_WG16_08_01
    SolutionIndex: 26
    SolutionNameMin: Cijk_Ailk_Bljk_SB_MT016x016x08_DTL0_EPS0_GRVW02_LPB00_PGR1_SNLL0_TT02_02_USFGRO00_VW02_WG08_08_01
    SolutionIndex: 27
    SolutionNameMin: Cijk_Ailk_Bljk_SB_MT032x016x08_DTL0_EPS0_GRVW02_LPB00_PGR1_SNLL0_TT04_02_USFGRO00_VW02_WG08_08_01
    SolutionIndex: 28
    SolutionNameMin: Cijk_Ailk_Bljk_SB_MT032x032x08_DTL0_EPS0_GRVW04_LPB00_PGR1_SNLL0_TT04_04_USFGRO00_VW04_WG08_08_01
    SolutionIndex: 29
    SolutionNameMin: Cijk_Ailk_Bljk_SB_MT032x016x08_DTL0_EPS0_GRVW02_LPB00_PGR1_SNLL0_TT02_02_USFGRO00_VW02_WG16_08_01
    SolutionIndex: 30
    SolutionNameMin: Cijk_Ailk_Bljk_SB_MT064x016x08_DTL0_EPS0_GRVW02_LPB00_PGR1_SNLL0_TT04_02_USFGRO00_VW02_WG16_08_01
    SolutionIndex: 31
    SolutionNameMin: Cijk_Ailk_Bljk_SB_MT064x008x16_DTL0_EPS0_GRVW02_LPB00_PGR1_SNLL0_TT02_02_USFGRO00_VW02_WG32_04_01
    SolutionIndex: 32
    SolutionNameMin: Cijk_Ailk_Bljk_SB_MT016x016x16_DTL0_EPS0_GRVW02_LPB00_PGR1_SNLL0_TT02_02_USFGRO00_VW02_WG08_08_01
    SolutionIndex: 33
    SolutionNameMin: Cijk_Ailk_Bljk_SB_MT032x016x16_DTL0_EPS0_GRVW02_LPB00_PGR1_SNLL0_TT04_02_USFGRO00_VW02_WG08_08_01
    SolutionIndex: 34
    SolutionNameMin: Cijk_Ailk_Bljk_SB_MT032x032x16_DTL0_EPS0_GRVW04_LPB00_PGR1_SNLL0_TT04_04_USFGRO00_VW04_WG08_08_01
    SolutionIndex: 35
    SolutionNameMin: Cijk_Ailk_Bljk_SB_MT064x016x16_DTL0_EPS0_GRVW02_LPB00_PGR1_SNLL0_TT04_02_USFGRO00_VW02_WG16_08_01
    SolutionIndex: 36
    SolutionNameMin: Cijk_Ailk_Bljk_SB_MT064x032x16_DTL0_EPS0_GRVW04_LPB00_PGR1_SNLL0_TT04_04_USFGRO00_VW04_WG16_08_01
    SolutionIndex: 37
    SolutionNameMin: Cijk_Ailk_Bljk_SB_MT064x016x16_DTL0_EPS0_GRVW02_LPB00_PGR1_SNLL0_TT04_02_USFGRO00_VW02_WG16_08_01
    SolutionIndex: 38
    SolutionNameMin: Cijk_Ailk_Bljk_SB_MT032x016x24_DTL0_EPS0_GRVW02_LPB00_PGR1_SNLL0_TT04_02_USFGRO00_VW02_WG08_08_01
    SolutionIndex: 39
    SolutionNameMin: Cijk_Ailk_Bljk_SB_MT032x008x32_DTL0_EPS0_GRVW02_LPB00_PGR1_SNLL0_TT02_02_USFGRO00_VW02_WG16_04_01
    SolutionIndex: 40
    SolutionNameMin: Cijk_Ailk_Bljk_SB_MT016x016x08_DTL0_EPS1_GRVW02_LPB00_PGR1_SNLL0_TT02_02_USFGRO01_VW02_WG08_08_02
    SolutionIndex: 41
    SolutionNameMin: Cijk_Ailk_Bljk_SB_MT128x032x08_DTL0_EPS1_GRVW04_LPB00_PGR1_SNLL0_TT08_04_USFGRO0_VW04_WG16_08_02
    SolutionIndex: 42
    SolutionNameMin: Cijk_Ailk_Bljk_SB_MT016x016x08_DTL0_EPS1_GRVW02_LPB00_PGR1_SNLL0_TT02_02_USFGRO01_VW02_WG08_08_02
    SolutionIndex: 43
    SolutionNameMin: Cijk_Ailk_Bljk_SB_MT016x016x08_DTL0_EPS1_GRVW02_LPB00_PGR1_SNLL0_TT02_02_USFGRO01_VW02_WG08_08_02
    SolutionIndex: 44
    SolutionNameMin: Cijk_Ailk_Bljk_SB_MT128x016x16_DTL0_EPS1_GRVW04_LPB00_PGR1_SNLL0_TT04_04_USFGRO0_VW04_WG32_04_02
    SolutionIndex: 45
    SolutionNameMin: Cijk_Ailk_Bljk_SB_MT064x016x16_DTL0_EPS1_GRVW04_LPB00_PGR1_SNLL0_TT04_04_USFGRO0_VW04_WG16_04_04
    SolutionIndex: 46
    SolutionNameMin: Cijk_Ailk_Bljk_SB_MT016x016x16_DTL0_EPS1_GRVW02_LPB00_PGR1_SNLL0_TT02_02_USFGRO0_VW02_WG08_08_02
    SolutionIndex: 47
    SolutionNameMin: Cijk_Ailk_Bljk_SB_MT032x016x16_DTL0_EPS1_GRVW02_LPB00_PGR1_SNLL0_TT04_02_USFGRO0_VW02_WG08_08_02
    SolutionIndex: 48
    SolutionNameMin: Cijk_Ailk_Bljk_SB_MT032x032x16_DTL0_EPS1_GRVW04_LPB00_PGR1_SNLL0_TT04_04_USFGRO0_VW04_WG08_08_02
    SolutionIndex: 49
    SolutionNameMin: Cijk_Ailk_Bljk_SB_MT064x032x16_DTL0_EPS1_GRVW04_LPB00_PGR1_SNLL0_TT08_04_USFGRO0_VW04_WG08_08_02
    SolutionIndex: 50
    SolutionNameMin: Cijk_Ailk_Bljk_SB_MT016x016x16_DTL0_EPS1_GRVW02_LPB00_PGR1_SNLL0_TT02_02_USFGRO01_VW02_WG08_08_04
    SolutionIndex: 51
    SolutionNameMin: Cijk_Ailk_Bljk_SB_MT032x016x16_DTL0_EPS1_GRVW02_LPB00_PGR1_SNLL0_TT04_02_USFGRO0_VW02_WG08_08_04
    SolutionIndex: 52
    SolutionNameMin: Cijk_Ailk_Bljk_SB_MT064x016x16_DTL0_EPS1_GRVW02_LPB00_PGR1_SNLL0_TT04_02_USFGRO0_VW02_WG16_08_02
    SolutionIndex: 53
    SolutionNameMin: Cijk_Ailk_Bljk_SB_MT128x016x16_DTL0_EPS1_GRVW04_LPB00_PGR1_SNLL0_TT04_04_USFGRO0_VW04_WG32_04_02
    SolutionIndex: 54
    SolutionNameMin: Cijk_Ailk_Bljk_SB_MT064x016x16_DTL0_EPS1_GRVW04_LPB00_PGR1_SNLL0_TT04_04_USFGRO0_VW04_WG16_04_04
    SolutionIndex: 55
    SolutionNameMin: Cijk_Ailk_Bljk_SB_MT128x016x16_DTL0_EPS1_GRVW04_LPB00_PGR1_SNLL0_TT08_04_USFGRO0_VW04_WG16_04_04
    SolutionIndex: 56
    SolutionNameMin: Cijk_Ailk_Bljk_SB_MT032x016x16_DTL0_EPS1_GRVW02_LPB00_PGR1_SNLL0_TT04_02_USFGRO0_VW02_WG08_08_02
    SolutionIndex: 57
    SolutionNameMin: Cijk_Ailk_Bljk_SB_MT032x032x16_DTL0_EPS1_GRVW04_LPB00_PGR1_SNLL0_TT04_04_USFGRO0_VW04_WG08_08_02
    SolutionIndex: 58
    SolutionNameMin: Cijk_Ailk_Bljk_SB_MT064x032x16_DTL0_EPS1_GRVW04_LPB00_PGR1_SNLL0_TT08_04_USFGRO0_VW04_WG08_08_02
    SolutionIndex: 59
    SolutionNameMin: Cijk_Ailk_Bljk_SB_MT016x016x16_DTL0_EPS1_GRVW02_LPB00_PGR1_SNLL0_TT02_02_USFGRO01_VW02_WG08_08_04
    SolutionIndex: 60
    SolutionNameMin: Cijk_Ailk_Bljk_SB_MT032x016x16_DTL0_EPS1_GRVW02_LPB00_PGR1_SNLL0_TT04_02_USFGRO0_VW02_WG08_08_04
    SolutionIndex: 61
    SolutionNameMin: Cijk_Ailk_Bljk_SB_MT032x016x16_DTL0_EPS1_GRVW02_LPB00_PGR1_SNLL0_TT02_02_USFGRO0_VW02_WG16_08_02
    SolutionIndex: 62
    SolutionNameMin: Cijk_Ailk_Bljk_SB_MT064x016x16_DTL0_EPS1_GRVW02_LPB00_PGR1_SNLL0_TT04_02_USFGRO0_VW02_WG16_08_02
    SolutionIndex: 63
    SolutionNameMin: Cijk_Ailk_Bljk_SB_MT128x064x16_DTL0_EPS1_GRVW04_LPB00_PGR1_SNLL0_TT08_08_USFGRO0_VW04_WG16_08_02
    SolutionIndex: 64
    SolutionNameMin: Cijk_Ailk_Bljk_SB_MT128x016x16_DTL0_EPS1_GRVW04_LPB00_PGR1_SNLL0_TT04_04_USFGRO0_VW04_WG32_04_02
    SolutionIndex: 65
    SolutionNameMin: Cijk_Ailk_Bljk_SB_MT032x016x16_DTL0_EPS1_GRVW02_LPB00_PGR1_SNLL0_TT04_02_USFGRO0_VW02_WG08_08_02
    SolutionIndex: 66
    SolutionNameMin: Cijk_Ailk_Bljk_SB_MT032x032x16_DTL0_EPS1_GRVW04_LPB00_PGR1_SNLL0_TT04_04_USFGRO0_VW04_WG08_08_02
    SolutionIndex: 67
    SolutionNameMin: Cijk_Ailk_Bljk_SB_MT064x032x16_DTL0_EPS1_GRVW04_LPB00_PGR1_SNLL0_TT08_04_USFGRO0_VW04_WG08_08_02
    SolutionIndex: 68
    SolutionNameMin: Cijk_Ailk_Bljk_SB_MT016x016x16_DTL0_EPS1_GRVW02_LPB00_PGR1_SNLL0_TT02_02_USFGRO01_VW02_WG08_08_04
    SolutionIndex: 69
    SolutionNameMin: Cijk_Ailk_Bljk_SB_MT032x016x16_DTL0_EPS1_GRVW02_LPB00_PGR1_SNLL0_TT04_02_USFGRO0_VW02_WG08_08_04
    SolutionIndex: 70
    SolutionNameMin: Cijk_Ailk_Bljk_SB_MT064x016x16_DTL0_EPS1_GRVW04_LPB00_PGR1_SNLL0_TT04_04_USFGRO0_VW04_WG16_04_04
    SolutionIndex: 71
    SolutionNameMin: Cijk_Ailk_Bljk_SB_MT032x032x16_DTL0_EPS1_GRVW04_LPB00_PGR1_SNLL0_TT04_04_USFGRO0_VW04_WG08_08_02
    SolutionIndex: 72
    SolutionNameMin: Cijk_Ailk_Bljk_SB_MT032x016x16_DTL0_EPS1_GRVW02_LPB00_PGR1_SNLL0_TT04_02_USFGRO0_VW02_WG08_08_04
    SolutionIndex: 73
    SolutionNameMin: Cijk_Ailk_Bljk_SB_MT016x016x16_DTL0_EPS1_GRVW02_LPB00_PGR1_SNLL0_TT02_02_USFGRO01_VW02_WG08_08_04
    SolutionIndex: 74
    SolutionNameMin: Cijk_Ailk_Bljk_SB_MT064x064x24_DTL0_EPS1_GRVW04_LPB00_PGR1_SNLL0_TT08_08_USFGRO0_VW04_WG08_08_02
    SolutionIndex: 75
    SolutionNameMin: Cijk_Ailk_Bljk_SB_MT064x064x24_DTL0_EPS1_GRVW04_LPB00_PGR1_SNLL0_TT08_08_USFGRO0_VW04_WG08_08_02
    SolutionIndex: 76
    SolutionNameMin: Cijk_Ailk_Bljk_SB_MT032x008x32_DTL0_EPS1_GRVW02_LPB00_PGR1_SNLL0_TT02_02_USFGRO0_VW02_WG16_04_04
    SolutionIndex: 77
    SolutionNameMin: Cijk_Ailk_Bljk_SB_MT064x008x32_DTL0_EPS1_GRVW02_LPB00_PGR1_SNLL0_TT04_02_USFGRO0_VW02_WG16_04_04
    SolutionIndex: 78
    SolutionNameMin: Cijk_Ailk_Bljk_SB_MT128x032x32_DTL0_EPS1_GRVW04_LPB00_PGR1_SNLL0_TT08_08_USFGRO0_VW04_WG16_04_04
    SolutionIndex: 79
    SolutionNameMin: Cijk_Ailk_Bljk_SB_MT032x016x32_DTL0_EPS1_GRVW02_LPB00_PGR1_SNLL0_TT04_02_USFGRO0_VW02_WG08_08_02
    SolutionIndex: 80
    SolutionNameMin: Cijk_Ailk_Bljk_SB_MT016x016x32_DTL0_EPS1_GRVW02_LPB00_PGR1_SNLL0_TT02_02_USFGRO0_VW02_WG08_08_04
    SolutionIndex: 81
    SolutionNameMin: Cijk_Ailk_Bljk_SB_MT032x032x32_DTL0_EPS1_GRVW04_LPB00_PGR1_SNLL0_TT04_04_USFGRO0_VW04_WG08_08_04
    SolutionIndex: 82
    SolutionNameMin: Cijk_Ailk_Bljk_SB_MT064x032x32_DTL0_EPS1_GRVW04_LPB00_PGR1_SNLL0_TT08_04_USFGRO0_VW04_WG08_08_04
    SolutionIndex: 83
    SolutionNameMin: Cijk_Ailk_Bljk_SB_MT064x016x32_DTL0_EPS1_GRVW02_LPB00_PGR1_SNLL0_TT04_02_USFGRO0_VW02_WG16_08_02
    SolutionIndex: 84
    SolutionNameMin: Cijk_Ailk_Bljk_SB_MT032x008x32_DTL0_EPS1_GRVW02_LPB00_PGR1_SNLL0_TT02_02_USFGRO0_VW02_WG16_04_04
    SolutionIndex: 85
    SolutionNameMin: Cijk_Ailk_Bljk_SB_MT128x032x32_DTL0_EPS1_GRVW04_LPB00_PGR1_SNLL0_TT08_08_USFGRO0_VW04_WG16_04_04
    SolutionIndex: 86
    SolutionNameMin: Cijk_Ailk_Bljk_SB_MT032x016x32_DTL0_EPS1_GRVW02_LPB00_PGR1_SNLL0_TT04_02_USFGRO0_VW02_WG08_08_04
    SolutionIndex: 87
    SolutionNameMin: Cijk_Ailk_Bljk_SB_MT032x032x32_DTL0_EPS1_GRVW04_LPB00_PGR1_SNLL0_TT04_04_USFGRO0_VW04_WG08_08_04
    SolutionIndex: 88
    SolutionNameMin: Cijk_Ailk_Bljk_SB_MT064x032x32_DTL0_EPS1_GRVW04_LPB00_PGR1_SNLL0_TT08_04_USFGRO0_VW04_WG08_08_04
    SolutionIndex: 89
    SolutionNameMin: Cijk_Ailk_Bljk_SB_MT064x032x32_DTL0_EPS1_GRVW04_LPB00_PGR1_SNLL0_TT04_04_USFGRO0_VW04_WG16_08_02
    SolutionIndex: 90
    SolutionNameMin: Cijk_Ailk_Bljk_SB_MT128x064x32_DTL0_EPS1_GRVW04_LPB00_PGR1_SNLL0_TT08_08_USFGRO0_VW04_WG16_08_02
    SolutionIndex: 91
    SolutionNameMin: Cijk_Ailk_Bljk_SB_MT032x008x32_DTL0_EPS1_GRVW02_LPB00_PGR1_SNLL0_TT02_02_USFGRO0_VW02_WG16_04_04
    SolutionIndex: 92
    SolutionNameMin: Cijk_Ailk_Bljk_SB_MT064x008x32_DTL0_EPS1_GRVW02_LPB00_PGR1_SNLL0_TT04_02_USFGRO0_VW02_WG16_04_04
    SolutionIndex: 93
    SolutionNameMin: Cijk_Ailk_Bljk_SB_MT032x032x32_DTL0_EPS1_GRVW04_LPB00_PGR1_SNLL0_TT04_04_USFGRO0_VW04_WG08_08_04
    SolutionIndex: 94
    SolutionNameMin: Cijk_Ailk_Bljk_SB_MT032x008x32_DTL0_EPS1_GRVW02_LPB00_PGR1_SNLL0_TT02_02_USFGRO0_VW02_WG16_04_04
    SolutionIndex: 95
    SolutionNameMin: Cijk_Ailk_Bljk_SB_MT032x032x32_DTL0_EPS1_GRVW04_LPB00_PGR1_SNLL0_TT04_04_USFGRO0_VW04_WG08_08_04
    SolutionIndex: 96
    SolutionNameMin: Cijk_Ailk_Bljk_SB_MT064x032x32_DTL0_EPS1_GRVW04_LPB00_PGR1_SNLL0_TT08_04_USFGRO0_VW04_WG08_08_04
    SolutionIndex: 97
    SolutionNameMin: Cijk_Ailk_Bljk_SB_MT064x016x32_DTL0_EPS1_GRVW02_LPB00_PGR1_SNLL0_TT04_02_USFGRO0_VW02_WG16_08_02
    SolutionIndex: 98
    SolutionNameMin: Cijk_Ailk_Bljk_SB_MT032x008x32_DTL0_EPS1_GRVW02_LPB00_PGR1_SNLL0_TT02_02_USFGRO0_VW02_WG16_04_04
    SolutionIndex: 99
    SolutionNameMin: Cijk_Ailk_Bljk_SB_MT032x008x32_DTL0_EPS1_GRVW02_LPB00_PGR1_SNLL0_TT02_02_USFGRO0_VW02_WG16_04_04
    SolutionIndex: 100
    SolutionNameMin: Cijk_Ailk_Bljk_SB_MT128x128x08_DTL0_EPS0_GRVW04_LPB00_PGR0_SNLL0_TT08_08_USFGRO00_VW04_WG16_16_01
    SolutionIndex: 101
    SolutionNameMin: Cijk_Ailk_Bljk_SB_MT064x064x16_DTL0_EPS0_GRVW04_LPB00_PGR0_SNLL0_TT04_04_USFGRO00_VW04_WG16_16_01
    SolutionIndex: 102
    SolutionNameMin: Cijk_Ailk_Bljk_SB_MT064x064x16_DTL0_EPS0_GRVW04_LPB00_PGR1_SNLL0_TT04_04_USFGRO00_VW04_WG16_16_01
    SolutionIndex: 103
    SolutionNameMin: Cijk_Ailk_Bljk_SB_MT064x128x16_DTL0_EPS0_GRVW04_LPB00_PGR1_SNLL0_TT04_08_USFGRO00_VW04_WG16_16_01
    SolutionIndex: 104
    SolutionNameMin: Cijk_Ailk_Bljk_SB_MT096x128x16_DTL0_EPS0_GRVW02_LPB00_PGR0_SNLL0_TT06_08_USFGRO00_VW02_WG16_16_01
    SolutionIndex: 105
    SolutionNameMin: Cijk_Ailk_Bljk_SB_MT128x064x16_DTL0_EPS0_GRVW04_LPB00_PGR0_SNLL0_TT08_04_USFGRO00_VW04_WG16_16_01
    SolutionIndex: 106
    SolutionNameMin: Cijk_Ailk_Bljk_SB_MT128x064x16_DTL0_EPS0_GRVW04_LPB00_PGR1_SNLL0_TT08_04_USFGRO00_VW04_WG16_16_01
    SolutionIndex: 107
    SolutionNameMin: Cijk_Ailk_Bljk_SB_MT064x064x16_DTL0_EPS0_GRVW04_LPB00_PGR0_SNLL0_TT04_04_USFGRO00_VW04_WG16_16_01
    SolutionIndex: 108
    SolutionNameMin: Cijk_Ailk_Bljk_SB_MT064x064x16_DTL0_EPS0_GRVW04_LPB00_PGR1_SNLL0_TT04_04_USFGRO00_VW04_WG16_16_01
    SolutionIndex: 109
    SolutionNameMin: Cijk_Ailk_Bljk_SB_MT064x128x16_DTL0_EPS0_GRVW04_LPB00_PGR1_SNLL0_TT04_08_USFGRO00_VW04_WG16_16_01
    SolutionIndex: 110
    SolutionNameMin: Cijk_Ailk_Bljk_SB_MT096x128x16_DTL0_EPS0_GRVW02_LPB00_PGR0_SNLL0_TT06_08_USFGRO00_VW02_WG16_16_01
    SolutionIndex: 111
    SolutionNameMin: Cijk_Ailk_Bljk_SB_MT128x064x16_DTL0_EPS0_GRVW04_LPB00_PGR1_SNLL0_TT08_04_USFGRO00_VW04_WG16_16_01
    SolutionIndex: 112
    SolutionNameMin: Cijk_Ailk_Bljk_SB_MT064x064x32_DTL0_EPS0_GRVW04_LPB00_PGR0_SNLL0_TT04_04_USFGRO00_VW04_WG16_16_01
    SolutionIndex: 113
    SolutionNameMin: Cijk_Ailk_Bljk_SB_MT064x128x32_DTL0_EPS0_GRVW04_LPB00_PGR0_SNLL0_TT04_08_USFGRO00_VW04_WG16_16_01
    SolutionIndex: 114
    SolutionNameMin: Cijk_Ailk_Bljk_SB_MT128x064x32_DTL0_EPS0_GRVW04_LPB00_PGR0_SNLL0_TT08_04_USFGRO00_VW04_WG16_16_01
    SolutionIndex: 115
    SolutionNameMin: Cijk_Ailk_Bljk_SB_MT064x064x32_DTL0_EPS0_GRVW04_LPB00_PGR0_SNLL0_TT04_04_USFGRO00_VW04_WG16_16_01
    SolutionIndex: 116
    SolutionNameMin: Cijk_Ailk_Bljk_SB_MT064x064x32_DTL0_EPS0_GRVW04_LPB00_PGR1_SNLL0_TT04_04_USFGRO00_VW04_WG16_16_01
    SolutionIndex: 117
    SolutionNameMin: Cijk_Ailk_Bljk_SB_MT128x128x08_DTL0_EPS1_GRVW04_LPB00_PGR1_SNLL1_TT08_08_USFGRO0_VW04_WG16_16_01
    SolutionIndex: 118
    SolutionNameMin: Cijk_Ailk_Bljk_SB_MT128x128x08_DTL0_EPS1_GRVW04_LPB00_PGR1_SNLL1_TT08_08_USFGRO0_VW04_WG16_16_01
    SolutionIndex: 119
    SolutionNameMin: Cijk_Ailk_Bljk_SB_MT064x064x16_DTL0_EPS0_GRVW04_LPB00_PGR0_SNLL0_TT04_04_USFGRO0_VW04_WG16_16_01
    SolutionIndex: 120
    SolutionNameMin: Cijk_Ailk_Bljk_SB_MT064x064x16_DTL0_EPS1_GRVW04_LPB00_PGR1_SNLL1_TT04_04_USFGRO0_VW04_WG16_16_01
    SolutionIndex: 121
    SolutionNameMin: Cijk_Ailk_Bljk_SB_MT064x128x16_DTL0_EPS0_GRVW04_LPB00_PGR0_SNLL0_TT04_08_USFGRO0_VW04_WG16_16_01
    SolutionIndex: 122
    SolutionNameMin: Cijk_Ailk_Bljk_SB_MT064x128x16_DTL0_EPS1_GRVW04_LPB00_PGR1_SNLL1_TT04_08_USFGRO0_VW04_WG16_16_01
    SolutionIndex: 123
    SolutionNameMin: Cijk_Ailk_Bljk_SB_MT096x128x16_DTL0_EPS1_GRVW02_LPB00_PGR1_SNLL1_TT06_08_USFGRO0_VW02_WG16_16_01
    SolutionIndex: 124
    SolutionNameMin: Cijk_Ailk_Bljk_SB_MT128x064x16_DTL0_EPS0_GRVW04_LPB00_PGR0_SNLL0_TT08_04_USFGRO0_VW04_WG16_16_01
    SolutionIndex: 125
    SolutionNameMin: Cijk_Ailk_Bljk_SB_MT128x064x16_DTL0_EPS1_GRVW04_LPB00_PGR1_SNLL1_TT08_04_USFGRO0_VW04_WG16_16_01
    SolutionIndex: 126
    SolutionNameMin: Cijk_Ailk_Bljk_SB_MT128x096x16_DTL0_EPS1_GRVW02_LPB00_PGR1_SNLL1_TT08_06_USFGRO0_VW02_WG16_16_01
    SolutionIndex: 127
    SolutionNameMin: Cijk_Ailk_Bljk_SB_MT128x128x16_DTL0_EPS0_GRVW04_LPB00_PGR0_SNLL0_TT08_08_USFGRO0_VW04_WG16_16_01
    SolutionIndex: 128
    SolutionNameMin: Cijk_Ailk_Bljk_SB_MT128x128x16_DTL0_EPS1_GRVW04_LPB00_PGR1_SNLL1_TT08_08_USFGRO0_VW04_WG16_16_01
    SolutionIndex: 129
    SolutionNameMin: Cijk_Ailk_Bljk_SB_MT064x064x16_DTL0_EPS0_GRVW04_LPB00_PGR0_SNLL0_TT04_04_USFGRO0_VW04_WG16_16_01
    SolutionIndex: 130
    SolutionNameMin: Cijk_Ailk_Bljk_SB_MT064x064x16_DTL0_EPS1_GRVW04_LPB00_PGR1_SNLL1_TT04_04_USFGRO0_VW04_WG16_16_01
    SolutionIndex: 131
    SolutionNameMin: Cijk_Ailk_Bljk_SB_MT064x128x16_DTL0_EPS0_GRVW04_LPB00_PGR0_SNLL0_TT04_08_USFGRO0_VW04_WG16_16_01
    SolutionIndex: 132
    SolutionNameMin: Cijk_Ailk_Bljk_SB_MT064x128x16_DTL0_EPS1_GRVW04_LPB00_PGR1_SNLL1_TT04_08_USFGRO0_VW04_WG16_16_01
    SolutionIndex: 133
    SolutionNameMin: Cijk_Ailk_Bljk_SB_MT096x128x16_DTL0_EPS1_GRVW02_LPB00_PGR1_SNLL1_TT06_08_USFGRO0_VW02_WG16_16_01
    SolutionIndex: 134
    SolutionNameMin: Cijk_Ailk_Bljk_SB_MT128x064x16_DTL0_EPS0_GRVW04_LPB00_PGR0_SNLL0_TT08_04_USFGRO0_VW04_WG16_16_01
    SolutionIndex: 135
    SolutionNameMin: Cijk_Ailk_Bljk_SB_MT128x064x16_DTL0_EPS1_GRVW04_LPB00_PGR1_SNLL1_TT08_04_USFGRO0_VW04_WG16_16_01
    SolutionIndex: 136
    SolutionNameMin: Cijk_Ailk_Bljk_SB_MT128x096x16_DTL0_EPS1_GRVW02_LPB00_PGR1_SNLL1_TT08_06_USFGRO0_VW02_WG16_16_01
    SolutionIndex: 137
    SolutionNameMin: Cijk_Ailk_Bljk_SB_MT128x128x16_DTL0_EPS0_GRVW04_LPB00_PGR0_SNLL0_TT08_08_USFGRO0_VW04_WG16_16_01
    SolutionIndex: 138
    SolutionNameMin: Cijk_Ailk_Bljk_SB_MT128x128x16_DTL0_EPS1_GRVW04_LPB00_PGR1_SNLL1_TT08_08_USFGRO0_VW04_WG16_16_01
    SolutionIndex: 139
    SolutionNameMin: Cijk_Ailk_Bljk_SB_MT128x128x24_DTL0_EPS0_GRVW04_LPB00_PGR0_SNLL0_TT08_08_USFGRO0_VW04_WG16_16_01
    SolutionIndex: 140
    SolutionNameMin: Cijk_Ailk_Bljk_SB_MT128x128x24_DTL0_EPS1_GRVW04_LPB00_PGR1_SNLL1_TT08_08_USFGRO0_VW04_WG16_16_01
    SolutionIndex: 141
    SolutionNameMin: Cijk_Ailk_Bljk_SB_MT128x128x24_DTL0_EPS0_GRVW04_LPB00_PGR0_SNLL0_TT08_08_USFGRO0_VW04_WG16_16_01
    SolutionIndex: 142
    SolutionNameMin: Cijk_Ailk_Bljk_SB_MT128x128x24_DTL0_EPS1_GRVW04_LPB00_PGR1_SNLL1_TT08_08_USFGRO0_VW04_WG16_16_01
    SolutionIndex: 143
    SolutionNameMin: Cijk_Ailk_Bljk_SB_MT064x064x32_DTL0_EPS0_GRVW04_LPB00_PGR0_SNLL0_TT04_04_USFGRO0_VW04_WG16_16_01
    SolutionIndex: 144
    SolutionNameMin: Cijk_Ailk_Bljk_SB_MT064x064x32_DTL0_EPS1_GRVW04_LPB00_PGR1_SNLL1_TT04_04_USFGRO0_VW04_WG16_16_01
    SolutionIndex: 145
    SolutionNameMin: Cijk_Ailk_Bljk_SB_MT128x064x32_DTL0_EPS0_GRVW04_LPB00_PGR0_SNLL0_TT08_04_USFGRO0_VW04_WG16_16_01
    SolutionIndex: 146
    SolutionNameMin: Cijk_Ailk_Bljk_SB_MT128x064x32_DTL0_EPS1_GRVW04_LPB00_PGR1_SNLL1_TT08_04_USFGRO0_VW04_WG16_16_01
    SolutionIndex: 147
    SolutionNameMin: Cijk_Ailk_Bljk_SB_MT128x128x32_DTL0_EPS0_GRVW04_LPB00_PGR0_SNLL0_TT08_08_USFGRO0_VW04_WG16_16_01
    SolutionIndex: 148
    SolutionNameMin: Cijk_Ailk_Bljk_SB_MT128x128x32_DTL0_EPS1_GRVW04_LPB00_PGR1_SNLL1_TT08_08_USFGRO0_VW04_WG16_16_01
    SolutionIndex: 149
    SolutionNameMin: Cijk_Ailk_Bljk_SB_MT064x064x32_DTL0_EPS0_GRVW04_LPB00_PGR0_SNLL0_TT04_04_USFGRO0_VW04_WG16_16_01
    SolutionIndex: 150
    SolutionNameMin: Cijk_Ailk_Bljk_SB_MT064x064x32_DTL0_EPS1_GRVW04_LPB00_PGR1_SNLL1_TT04_04_USFGRO0_VW04_WG16_16_01
    SolutionIndex: 151
    SolutionNameMin: Cijk_Ailk_Bljk_SB_MT128x064x32_DTL0_EPS0_GRVW04_LPB00_PGR0_SNLL0_TT08_04_USFGRO0_VW04_WG16_16_01
    SolutionIndex: 152
    SolutionNameMin: Cijk_Ailk_Bljk_SB_MT128x064x32_DTL0_EPS1_GRVW04_LPB00_PGR1_SNLL1_TT08_04_USFGRO0_VW04_WG16_16_01
    SolutionIndex: 153
    SolutionNameMin: Cijk_Ailk_Bljk_SB_MT128x128x32_DTL0_EPS0_GRVW04_LPB00_PGR0_SNLL0_TT08_08_USFGRO0_VW04_WG16_16_01
    SolutionIndex: 154
    SolutionNameMin: Cijk_Ailk_Bljk_SB_MT128x128x32_DTL0_EPS1_GRVW04_LPB00_PGR1_SNLL1_TT08_08_USFGRO0_VW04_WG16_16_01
    SolutionIndex: 155
    SolutionNameMin: Cijk_Ailk_Bljk_SB_MT016x016x04_DTL0_EPS0_GRVW02_LPB00_PGR1_SNLL0_TT02_02_USFGRO00_VW02_WG08_08_01
    SolutionIndex: 156
    SolutionNameMin: Cijk_Ailk_Bljk_SB_MT032x032x02_DTL0_EPS0_GRVW04_LPB00_PGR1_SNLL0_TT04_04_USFGRO00_VW04_WG08_08_01
    SolutionIndex: 157
    SolutionNameMin: Cijk_Ailk_Bljk_SB_MT016x016x16_DTL0_EPS1_GRVW02_LPB00_PGR1_SNLL1_TT02_02_USFGRO01_VW02_WG08_08_04
    SolutionIndex: 158
    SolutionNameMin: Cijk_Ailk_Bljk_SB_MT016x016x04_DTL0_EPS1_GRVW02_LPB00_PGR1_SNLL0_TT02_02_USFGRO01_VW02_WG08_08_01
    SolutionIndex: 159
    SolutionNameMin: Cijk_Ailk_Bljk_SB_MT008x008x08_DTL0_EPS1_GRVW02_LPB00_PGR1_SNLL0_TT02_02_USFGRO01_VW02_WG04_04_04
    SolutionIndex: 160
    SolutionNameMin: Cijk_Ailk_Bljk_SB_MT016x016x04_DTL0_EPS1_GRVW02_LPB00_PGR1_SNLL0_TT02_02_USFGRO01_VW02_WG08_08_01
    SolutionIndex: 161
    SolutionNameMin: Cijk_Ailk_Bljk_SB_MT008x008x08_DTL0_EPS1_GRVW02_LPB00_PGR1_SNLL0_TT02_02_USFGRO01_VW02_WG04_04_04
    SolutionIndex: 162
    SolutionNameMin: Cijk_Ailk_Bljk_SB_MT016x016x08_DTL0_EPS1_GRVW02_LPB00_PGR1_SNLL0_TT02_02_USFGRO01_VW02_WG08_08_02
    SolutionIndex: 163
    SolutionNameMin: Cijk_Ailk_Bljk_SB_MT008x008x08_DTL0_EPS1_GRVW02_LPB00_PGR1_SNLL0_TT02_02_USFGRO01_VW02_WG04_04_04
    SolutionIndex: 164
    SolutionNameMin: Cijk_Ailk_Bljk_SB_MT016x016x16_DTL0_EPS1_GRVW02_LPB00_PGR1_SNLL0_TT02_02_USFGRO01_VW02_WG08_08_04
    SolutionIndex: 165
    SolutionNameMin: Cijk_Ailk_Bljk_SB_MT128x032x08_DTL0_EPS1_GRVW04_LPB04_PGR1_SNLL1_TT04_04_USFGRO0_VW04_WG32_08_01
    SolutionIndex: 166
    SolutionNameMin: Cijk_Ailk_Bljk_SB_MT128x032x08_DTL0_EPS1_GRVW04_LPB04_PGR1_SNLL1_TT04_04_USFGRO0_VW04_WG32_08_01
    SolutionIndex: 167
    SolutionNameMin: Cijk_Ailk_Bljk_SB_MT064x064x16_DTL0_EPS1_GRVW04_LPB04_PGR1_SNLL1_TT04_04_USFGRO0_VW04_WG16_16_01
    SolutionIndex: 168
    SolutionNameMin: Cijk_Ailk_Bljk_SB_MT128x064x16_DTL0_EPS1_GRVW04_LPB04_PGR1_SNLL1_TT04_08_USFGRO0_VW04_WG32_08_01
    SolutionIndex: 170
    SolutionNameMin: Cijk_Ailk_Bljk_SB_MT128x032x16_DTL0_EPS0_GRVW01_LPB02_PGR0_SNLL0_TT04_04_USFGRO01_VW02_WG32_08_01
    SolutionIndex: 174
    SolutionNameMin: Cijk_Ailk_Bljk_SB_MT064x064x16_DTL0_EPS0_GRVW04_LPB04_PGR0_SNLL0_TT04_04_USFGRO0_VW04_WG16_16_01
    SolutionIndex: 178
    SolutionNameMin: Cijk_Ailk_Bljk_SB_MT128x064x08_DTL0_GRVW02_GSU01_PGR1_PLR1_TT08_04_USFGRO0_VW02_WG16_16_01_WGM01
    SolutionIndex: 180
    SolutionNameMin: Cijk_Ailk_Bljk_SB_MT064x064x08_DTL0_GRVW04_GSU01_PGR1_PLR1_TT04_08_USFGRO0_VW04_WG16_08_01_WGM01
    SolutionIndex: 182
    SolutionNameMin: Cijk_Ailk_Bljk_SB_MT064x128x16_DTL0_GRVW04_GSU01_PGR0_PLR1_TT08_04_USFGRO0_VW04_WG08_32_01_WGM01
    SolutionIndex: 183
    SolutionNameMin: Cijk_Ailk_Bljk_SB_MT064x064x16_DTL0_GRVW04_GSU01_PGR1_PLR1_TT04_04_USFGRO0_VW04_WG16_16_01_WGM01
    SolutionIndex: 184
    SolutionNameMin: Cijk_Ailk_Bljk_SB_MT064x128x16_DTL0_GRVW04_GSU01_PGR0_PLR1_TT04_08_USFGRO0_VW04_WG16_16_01_WGM01
    SolutionIndex: 185
    SolutionNameMin: Cijk_Ailk_Bljk_SB_MT128x064x16_DTL0_GRVW04_GSU01_PGR0_PLR1_TT08_04_USFGRO0_VW04_WG16_16_01_WGM01
    SolutionIndex: 189
    SolutionNameMin: Cijk_Ailk_Bljk_SB_MT128x64x8_EPS1_GRVW4_GSU1_LPB0_PGR1_SNLL1_TT8_4_VW4_WG16_16_1_WGM4
    SolutionIndex: 190
    SolutionNameMin: Cijk_Ailk_Bljk_SB_MT128x128x16_EPS1_GRVW4_GSU1_LPB0_PGR1_SNLL1_TT8_8_VW4_WG16_16_1_WGM4
    SolutionIndex: 191
    SolutionNameMin: Cijk_Ailk_Bljk_SB_MT128x64x8_EPS1_GRVW4_GSU1_LPB0_PGR1_SNLL1_TT8_4_VW4_WG16_16_1_WGM8
    SolutionIndex: 192
    SolutionNameMin: Cijk_Ailk_Bljk_SB_MT128x128x16_EPS1_GRVW4_GSU1_LPB0_PGR1_SNLL1_TT8_8_VW4_WG16_16_1_WGM8
    SolutionIndex: 194
    SolutionNameMin: Cijk_Ailk_Bljk_SB_MT64x32x32_EPS1_GRVW2_GSU1_LPB2_PGR1_SNLL1_TT4_4_VW2_WG16_8_2_WGM4
    SolutionIndex: 195
    SolutionNameMin: Cijk_Ailk_Bljk_SB_MT128x64x8_EPS1_GRVW4_GSU1_LPB4_PGR1_SNLL1_TT8_4_VW4_WG16_16_1_WGM4
    SolutionIndex: 196
    SolutionNameMin: Cijk_Ailk_Bljk_SB_MT32x16x16_EPS1_GRVW4_GSU1_LPB4_PGR1_SNLL1_TT4_4_VW4_WG8_4_2_WGM4
    SolutionIndex: 197
    SolutionNameMin: Cijk_Ailk_Bljk_SB_MT128x64x16_EPS1_GRVW4_GSU1_LPB4_PGR1_SNLL1_TT8_4_VW4_WG16_16_1_WGM4
    SolutionIndex: 198
    SolutionNameMin: Cijk_Ailk_Bljk_SB_MT64x32x16_EPS1_GRVW4_GSU1_LPB4_PGR1_SNLL1_TT4_4_VW4_WG16_8_2_WGM4
    SolutionIndex: 199
    SolutionNameMin: Cijk_Ailk_Bljk_SB_MT64x64x16_EPS1_GRVW4_GSU1_LPB4_PGR1_SNLL1_TT4_8_VW4_WG16_8_2_WGM4
    SolutionIndex: 201
    SolutionNameMin: Cijk_Ailk_Bljk_SB_MT64x32x32_EPS1_GRVW4_GSU1_LPB4_PGR1_SNLL1_TT4_4_VW4_WG16_8_2_WGM4
    SolutionIndex: 202
    SolutionNameMin: Cijk_Ailk_Bljk_SB_MT128x64x16_EPS1_GRVW4_GSU1_LPB4_PGR1_SNLL1_TT8_4_VW4_WG16_16_1_WGM8
    SolutionIndex: 203
    SolutionNameMin: Cijk_Ailk_Bljk_SB_MT64x32x16_EPS1_GRVW4_GSU1_LPB4_PGR1_SNLL1_TT4_4_VW4_WG16_8_2_WGM8
    SolutionIndex: 204
    SolutionNameMin: Cijk_Ailk_Bljk_SB_MT64x64x16_EPS1_GRVW4_GSU1_LPB4_PGR1_SNLL1_TT4_8_VW4_WG16_8_2_WGM8
    SolutionIndex: 205
    SolutionNameMin: Cijk_Ailk_Bljk_SB_MT128x32x16_EPS1_GRVW4_GSU1_LPB4_PGR1_SNLL1_TT8_4_VW4_WG16_8_2_WGM8
    SolutionIndex: 206
    SolutionNameMin: Cijk_Ailk_Bljk_SB_MT64x32x32_EPS1_GRVW4_GSU1_LPB4_PGR1_SNLL1_TT4_4_VW4_WG16_8_2_WGM8
    SolutionIndex: 207
    SolutionNameMin: Cijk_Ailk_Bljk_SB_MT128x64x16_EPS1_GRVW4_GSU1_LPB4_PGR1_SNLL1_TT8_4_VW4_WG16_16_1_WGM16
    SolutionIndex: 208
    SolutionNameMin: Cijk_Ailk_Bljk_SB_MT64x32x16_EPS1_GRVW4_GSU1_LPB4_PGR1_SNLL1_TT4_4_VW4_WG16_8_2_WGM16
    SolutionIndex: 209
    SolutionNameMin: Cijk_Ailk_Bljk_SB_MT64x64x16_EPS1_GRVW4_GSU1_LPB4_PGR1_SNLL1_TT4_8_VW4_WG16_8_2_WGM16
    SolutionIndex: 210
    SolutionNameMin: Cijk_Ailk_Bljk_SB_MT128x32x16_EPS1_GRVW4_GSU1_LPB4_PGR1_SNLL1_TT8_4_VW4_WG16_8_2_WGM16
    SolutionIndex: 211
    SolutionNameMin: Cijk_Ailk_Bljk_SB_MT64x32x32_EPS1_GRVW4_GSU1_LPB4_PGR1_SNLL1_TT4_4_VW4_WG16_8_2_WGM16
    SolutionIndex: 212
    SolutionNameMin: Cijk_Ailk_Bljk_SB_MT128x64x16_EPS1_GRVW4_GSU1_LPB4_PGR1_SNLL1_TT8_4_VW4_WG16_16_1_WGM32
    SolutionIndex: 213
    SolutionNameMin: Cijk_Ailk_Bljk_SB_MT64x32x16_EPS1_GRVW4_GSU1_LPB4_PGR1_SNLL1_TT4_4_VW4_WG16_8_2_WGM32
    SolutionIndex: 214
    SolutionNameMin: Cijk_Ailk_Bljk_SB_MT64x32x32_EPS1_GRVW4_GSU1_LPB4_PGR1_SNLL1_TT4_4_VW4_WG16_8_2_WGM32
    SolutionIndex: 217
    SolutionNameMin: Cijk_Ailk_Bljk_SB_MT256x32x8_SE_EPS1_PGR1_SNLL1_TT4_8_WG64_4_1_WGM2
    SolutionIndex: 219
    SolutionNameMin: Cijk_Ailk_Bljk_SB_MT128x64x8_SE_EPS1_PGR1_SNLL1_TT4_8_WG32_8_1_WGM7
    SolutionIndex: 220
    SolutionNameMin: Cijk_Ailk_Bljk_SB_MT128x64x8_SE_EPS1_PGR1_SNLL1_TT4_8_WG32_8_1_WGM15
    SolutionIndex: 221
    SolutionNameMin: Cijk_Ailk_Bljk_SB_MT128x64x8_SE_EPS1_PGR1_SNLL1_TT8_4_WG16_16_1_WGM16
    SolutionIndex: 224
    SolutionNameMin: Cijk_Ailk_Bljk_SB_MT128x64x8_SE_EPS1_PGR1_SNLL1_TT4_8_WG32_8_1_WGM32
    SolutionIndex: 226
    SolutionNameMin: Cijk_Ailk_Bljk_SB_MT64x64x16_SE_EPS1_PGR1_SNLL1_TT4_4_WG16_16_1_WGM2
    SolutionIndex: 227
    SolutionNameMin: Cijk_Ailk_Bljk_SB_MT64x64x16_SE_EPS1_PGR1_SNLL1_TT4_8_WG16_8_2_WGM2
    SolutionIndex: 229
    SolutionNameMin: Cijk_Ailk_Bljk_SB_MT64x64x16_SE_EPS1_PGR1_SNLL1_TT4_8_WG16_8_2_WGM7
    SolutionIndex: 230
    SolutionNameMin: Cijk_Ailk_Bljk_SB_MT64x64x16_SE_EPS1_PGR1_SNLL1_TT4_8_WG16_8_2_WGM11
    SolutionIndex: 231
    SolutionNameMin: Cijk_Ailk_Bljk_SB_MT64x64x16_SE_EPS1_PGR1_SNLL1_TT4_4_WG16_16_1_WGM16
    SolutionIndex: 234
    SolutionNameMin: Cijk_Ailk_Bljk_SB_MT64x64x32_SE_EPS1_PGR1_SNLL1_TT4_8_WG16_8_2_WGM32
    SolutionIndex: 235
    SolutionNameMin: Cijk_Ailk_Bljk_SB_MT128x64x8_SE_EPS1_PGR1_SNLL1_TT8_4_WG16_16_1_WGM8
    SolutionIndex: 236
    SolutionNameMin: Cijk_Ailk_Bljk_SB_MT64x64x16_SE_EPS1_PGR1_SNLL1_TT4_4_WG16_16_1_WGM1
    SolutionIndex: 237
    SolutionNameMin: Cijk_Ailk_Bljk_SB_MT128x64x16_SE_EPS1_PGR1_SNLL1_TT8_4_WG16_16_1_WGM1
    SolutionIndex: 238
    SolutionNameMin: Cijk_Ailk_Bljk_SB_MT128x128x16_SE_EPS1_PGR1_SNLL1_TT8_4_WG16_32_1_WGM1
    SolutionIndex: 239
    SolutionNameMin: Cijk_Ailk_Bljk_SB_MT64x64x16_SE_EPS1_PGR1_SNLL1_TT4_4_WG16_16_1_WGM8
    SolutionIndex: 240
    SolutionNameMin: Cijk_Ailk_Bljk_SB_MT128x64x8_SE_DTL0_EPS1_FL0_GRVW4_LPB0_PGR1_PLR1_SNLL1_TT8_4_USFGRO0_VW4_WG16_16_1_WGM1
    SolutionIndex: 241
    SolutionNameMin: Cijk_Ailk_Bljk_SB_MT128x64x8_SE_DTL0_EPS1_FL1_GRVW4_LPB0_PGR1_PLR1_SNLL1_TT8_4_USFGRO0_VW4_WG16_16_1_WGM1
    SolutionIndex: 242
    SolutionNameMin: Cijk_Ailk_Bljk_SB_MT128x64x8_SE_DTL0_EPS1_FL0_GRVW4_LPB0_PGR1_PLR1_SNLL1_TT8_4_USFGRO0_VW4_WG16_16_1_WGM8
    SolutionIndex: 243
    SolutionNameMin: Cijk_Ailk_Bljk_SB_MT128x64x8_SE_DTL0_EPS1_FL1_GRVW4_LPB0_PGR1_PLR1_SNLL1_TT8_4_USFGRO0_VW4_WG16_16_1_WGM8
    SolutionIndex: 244
    SolutionNameMin: Cijk_Ailk_Bljk_SB_MT128x128x16_SE_DTL0_EPS1_FL0_GRVW4_LPB0_PGR1_PLR1_SNLL1_TT8_8_USFGRO0_VW4_WG16_16_1_WGM1
    SolutionIndex: 245
    SolutionNameMin: Cijk_Ailk_Bljk_SB_MT128x128x16_SE_DTL0_EPS1_FL1_GRVW4_LPB0_PGR1_PLR1_SNLL1_TT8_8_USFGRO0_VW4_WG16_16_1_WGM1
    SolutionIndex: 246
    SolutionNameMin: Cijk_Ailk_Bljk_SB_MT128x128x16_SE_DTL0_EPS1_FL0_GRVW4_LPB0_PGR1_PLR1_SNLL1_TT8_8_USFGRO0_VW4_WG16_16_1_WGM8
    SolutionIndex: 247
    SolutionNameMin: Cijk_Ailk_Bljk_SB_MT128x128x16_SE_DTL0_EPS1_FL1_GRVW4_LPB0_PGR1_PLR1_SNLL1_TT8_8_USFGRO0_VW4_WG16_16_1_WGM8
    SolutionIndex: 248
    SolutionNameMin: Cijk_Ailk_Bljk_SB_MT96x64x8_SE_DTL0_EPS1_FL0_GRVW1_LPB2_PGR1_PLR1_SNLL1_TT6_4_USFGRO0_VW2_WG16_16_1_WGM1
    SolutionIndex: 249
    SolutionNameMin: Cijk_Ailk_Bljk_SB_MT64x64x16_SE_DTL0_EPS0_FL0_GRVW1_LPB4_PGR0_PLR1_SNLL0_TT4_4_USFGRO1_VW4_WG16_16_1_WGM1
    SolutionIndex: 250
    SolutionNameMin: Cijk_Ailk_Bljk_SB_MT64x64x16_SE_DTL0_EPS0_FL0_GRVW1_LPB4_PGR0_PLR1_SNLL0_TT4_4_USFGRO1_VW4_WG16_16_1_WGM8
    SolutionIndex: 251
    SolutionNameMin: Cijk_Ailk_Bljk_SB_MT96x64x8_SE_DTL0_EPS1_FL1_GRVW2_LPB2_PGR1_PLR1_SNLL1_TT6_4_USFGRO0_VW2_WG16_16_1_WGM1
    SolutionIndex: 252
    SolutionNameMin: Cijk_Ailk_Bljk_SB_MT96x64x16_SE_DTL0_EPS1_FL0_GRVW2_LPB2_PGR1_PLR0_SNLL1_TT6_4_USFGRO0_VW2_WG16_16_1_WGM8
    SolutionIndex: 253
    SolutionNameMin: Cijk_Ailk_Bljk_SB_MT64x96x16_SE_DTL0_EPS1_FL0_GRVW2_LPB2_PGR1_PLR0_SNLL1_TT4_6_USFGRO0_VW2_WG16_16_1_WGM8
    SolutionIndex: 254
    SolutionNameMin: Cijk_Ailk_Bljk_SB_MT64x96x16_SE_DTL0_EPS1_FL1_GRVW2_LPB2_PGR1_PLR0_SNLL1_TT4_6_USFGRO0_VW2_WG16_16_1_WGM8
    SolutionIndex: 255
    SolutionNameMin: Cijk_Ailk_Bljk_SB_MT128x64x8_SE_DTL0_EPS1_FL0_GRVW4_LPB4_PGR1_PLR1_SNLL1_TT8_4_USFGRO0_VW4_WG16_16_1_WGM1
    SolutionIndex: 256
    SolutionNameMin: Cijk_Ailk_Bljk_SB_MT128x64x8_SE_DTL0_EPS1_FL1_GRVW4_LPB4_PGR1_PLR1_SNLL1_TT8_4_USFGRO0_VW4_WG16_16_1_WGM1
    SolutionIndex: 257
    SolutionNameMin: Cijk_Ailk_Bljk_SB_MT128x64x8_SE_DTL0_EPS1_FL0_GRVW4_LPB4_PGR1_PLR1_SNLL1_TT8_4_USFGRO0_VW4_WG16_16_1_WGM8
    SolutionIndex: 258
    SolutionNameMin: Cijk_Ailk_Bljk_SB_MT128x64x8_SE_DTL0_EPS1_FL1_GRVW4_LPB4_PGR1_PLR1_SNLL1_TT8_4_USFGRO0_VW4_WG16_16_1_WGM8
    SolutionIndex: 259
    SolutionNameMin: Cijk_Ailk_Bljk_SB_MT64x64x16_SE_DTL0_EPS0_FL0_GRVW4_LPB4_PGR0_PLR1_SNLL0_TT4_4_USFGRO0_VW4_WG16_16_1_WGM1
    SolutionIndex: 260
    SolutionNameMin: Cijk_Ailk_Bljk_SB_MT128x64x16_SE_DTL0_EPS1_FL0_GRVW4_LPB4_PGR1_PLR1_SNLL1_TT8_4_USFGRO0_VW4_WG16_16_1_WGM1
    SolutionIndex: 261
    SolutionNameMin: Cijk_Ailk_Bljk_SB_MT128x64x16_SE_DTL0_EPS1_FL1_GRVW4_LPB4_PGR1_PLR1_SNLL1_TT8_4_USFGRO0_VW4_WG16_16_1_WGM1
    SolutionIndex: 262
    SolutionNameMin: Cijk_Ailk_Bljk_SB_MT64x64x16_SE_DTL0_EPS0_FL0_GRVW4_LPB4_PGR0_PLR1_SNLL0_TT4_4_USFGRO0_VW4_WG16_16_1_WGM8
    SolutionIndex: 263
    SolutionNameMin: Cijk_Ailk_Bljk_SB_MT128x64x16_SE_DTL0_EPS1_FL0_GRVW4_LPB4_PGR1_PLR1_SNLL1_TT8_4_USFGRO0_VW4_WG16_16_1_WGM8
    SolutionIndex: 264
    SolutionNameMin: Cijk_Ailk_Bljk_SB_MT128x64x16_SE_DTL0_EPS1_FL1_GRVW4_LPB4_PGR1_PLR1_SNLL1_TT8_4_USFGRO0_VW4_WG16_16_1_WGM8
    SolutionIndex: 265
    SolutionNameMin: Cijk_Ailk_Bljk_SB_MT64x32x8_SE_DTL0_EPS0_FL0_GRVW1_LPB0_PGR0_PLR1_SNLL0_TT4_4_USFGRO1_VW1_WG16_8_1_WGM1
    SolutionIndex: 266
    SolutionNameMin: Cijk_Ailk_Bljk_SB_MT64x16x8_SE_DTL0_EPS0_FL0_GRVW1_LPB0_PGR0_PLR0_SNLL0_TT4_2_USFGRO1_VW1_WG16_8_1_WGM8
    SolutionIndex: 267
    SolutionNameMin: Cijk_Ailk_Bljk_SB_MT64x16x8_SE_DTL0_EPS0_FL0_GRVW1_LPB0_PGR0_PLR1_SNLL0_TT4_2_USFGRO1_VW1_WG16_8_1_WGM8
    SolutionIndex: 268
    SolutionNameMin: Cijk_Ailk_Bljk_SB_MT64x16x16_SE_DTL0_EPS0_FL0_GRVW1_LPB0_PGR0_PLR1_SNLL0_TT4_2_USFGRO1_VW1_WG16_8_1_WGM1
    SolutionIndex: 269
    SolutionNameMin: Cijk_Ailk_Bljk_SB_MT64x16x16_SE_DTL0_EPS0_FL0_GRVW1_LPB0_PGR0_PLR1_SNLL0_TT4_2_USFGRO1_VW1_WG16_8_1_WGM8
    SolutionIndex: 270
    SolutionNameMin: Cijk_Ailk_Bljk_SB_MT64x32x8_SE_DTL0_EPS1_FL0_GRVW4_LPB0_PGR1_PLR1_SNLL1_TT4_4_USFGRO0_VW4_WG16_8_1_WGM1
    SolutionIndex: 271
    SolutionNameMin: Cijk_Ailk_Bljk_SB_MT64x32x8_SE_DTL0_EPS1_FL1_GRVW4_LPB0_PGR1_PLR1_SNLL1_TT4_4_USFGRO0_VW4_WG16_8_1_WGM1
    SolutionIndex: 272
    SolutionNameMin: Cijk_Ailk_Bljk_SB_MT64x64x8_SE_DTL0_EPS1_FL0_GRVW4_LPB0_PGR1_PLR1_SNLL1_TT4_8_USFGRO0_VW4_WG16_8_1_WGM1
    SolutionIndex: 273
    SolutionNameMin: Cijk_Ailk_Bljk_SB_MT64x32x8_SE_DTL0_EPS1_FL1_GRVW4_LPB0_PGR1_PLR1_SNLL1_TT4_4_USFGRO0_VW4_WG16_8_1_WGM8
    SolutionIndex: 274
    SolutionNameMin: Cijk_Ailk_Bljk_SB_MT64x32x16_SE_DTL0_EPS0_FL0_GRVW4_LPB0_PGR0_PLR1_SNLL0_TT4_4_USFGRO0_VW4_WG16_8_1_WGM8
    SolutionIndex: 275
    SolutionNameMin: Cijk_Ailk_Bljk_SB_MT64x32x16_SE_DTL0_EPS0_FL1_GRVW4_LPB0_PGR0_PLR1_SNLL0_TT4_4_USFGRO0_VW4_WG16_8_1_WGM8
    SolutionIndex: 276
    SolutionNameMin: Cijk_Ailk_Bljk_SB_MT64x64x8_SE_DTL0_EPS0_FL0_GRVW1_LPB1_PGR0_PLR0_SNLL0_TT4_4_USFGRO1_VW1_WG16_16_1_WGM1
    SolutionIndex: 277
    SolutionNameMin: Cijk_Ailk_Bljk_SB_MT64x64x8_SE_DTL0_EPS0_FL0_GRVW1_LPB1_PGR0_PLR1_SNLL0_TT4_4_USFGRO1_VW1_WG16_16_1_WGM1
    SolutionIndex: 278
    SolutionNameMin: Cijk_Ailk_Bljk_SB_MT64x64x8_SE_DTL0_EPS1_FL0_GRVW1_LPB1_PGR1_PLR1_SNLL1_TT4_4_USFGRO1_VW1_WG16_16_1_WGM1
    SolutionIndex: 279
    SolutionNameMin: Cijk_Ailk_Bljk_SB_MT64x32x8_SE_DTL0_EPS0_FL0_GRVW1_LPB1_PGR0_PLR1_SNLL0_TT4_4_USFGRO1_VW1_WG16_8_1_WGM1
    SolutionIndex: 280
    SolutionNameMin: Cijk_Ailk_Bljk_SB_MT64x16x8_SE_DTL0_EPS0_FL0_GRVW1_LPB1_PGR0_PLR0_SNLL0_TT4_2_USFGRO1_VW1_WG16_8_1_WGM1
    SolutionIndex: 281
    SolutionNameMin: Cijk_Ailk_Bljk_SB_MT64x16x8_SE_DTL0_EPS0_FL0_GRVW1_LPB1_PGR0_PLR1_SNLL0_TT4_2_USFGRO1_VW1_WG16_8_1_WGM1
    SolutionIndex: 282
    SolutionNameMin: Cijk_Ailk_Bljk_SB_MT64x64x8_SE_DTL0_EPS1_FL0_GRVW1_LPB1_PGR1_PLR1_SNLL1_TT4_4_USFGRO1_VW1_WG16_16_1_WGM8
    SolutionIndex: 283
    SolutionNameMin: Cijk_Ailk_Bljk_SB_MT64x32x8_SE_DTL0_EPS0_FL0_GRVW1_LPB1_PGR0_PLR1_SNLL0_TT4_4_USFGRO1_VW1_WG16_8_1_WGM8
    SolutionIndex: 284
    SolutionNameMin: Cijk_Ailk_Bljk_SB_MT64x16x8_SE_DTL0_EPS0_FL0_GRVW1_LPB1_PGR0_PLR1_SNLL0_TT4_2_USFGRO1_VW1_WG16_8_1_WGM8
    SolutionIndex: 285
    SolutionNameMin: Cijk_Ailk_Bljk_SB_MT64x64x16_SE_DTL0_EPS0_FL0_GRVW1_LPB1_PGR0_PLR1_SNLL0_TT4_4_USFGRO1_VW1_WG16_16_1_WGM1
    SolutionIndex: 286
    SolutionNameMin: Cijk_Ailk_Bljk_SB_MT64x32x16_SE_DTL0_EPS0_FL0_GRVW1_LPB1_PGR0_PLR0_SNLL0_TT4_2_USFGRO1_VW1_WG16_16_1_WGM1
    SolutionIndex: 287
    SolutionNameMin: Cijk_Ailk_Bljk_SB_MT64x32x16_SE_DTL0_EPS0_FL0_GRVW1_LPB1_PGR0_PLR1_SNLL0_TT4_2_USFGRO1_VW1_WG16_16_1_WGM1
    SolutionIndex: 288
    SolutionNameMin: Cijk_Ailk_Bljk_SB_MT64x32x16_SE_DTL0_EPS0_FL0_GRVW1_LPB1_PGR0_PLR1_SNLL0_TT4_4_USFGRO1_VW1_WG16_8_1_WGM1
    SolutionIndex: 289
    SolutionNameMin: Cijk_Ailk_Bljk_SB_MT64x16x16_SE_DTL0_EPS0_FL0_GRVW1_LPB1_PGR0_PLR0_SNLL0_TT4_2_USFGRO1_VW1_WG16_8_1_WGM1
    SolutionIndex: 290
    SolutionNameMin: Cijk_Ailk_Bljk_SB_MT64x16x16_SE_DTL0_EPS0_FL0_GRVW1_LPB1_PGR0_PLR1_SNLL0_TT4_2_USFGRO1_VW1_WG16_8_1_WGM1
    SolutionIndex: 291
    SolutionNameMin: Cijk_Ailk_Bljk_SB_MT64x64x16_SE_DTL0_EPS0_FL0_GRVW1_LPB1_PGR0_PLR1_SNLL0_TT4_4_USFGRO1_VW1_WG16_16_1_WGM8
    SolutionIndex: 292
    SolutionNameMin: Cijk_Ailk_Bljk_SB_MT64x32x16_SE_DTL0_EPS0_FL0_GRVW1_LPB1_PGR0_PLR1_SNLL0_TT4_2_USFGRO1_VW1_WG16_16_1_WGM8
    SolutionIndex: 293
    SolutionNameMin: Cijk_Ailk_Bljk_SB_MT64x16x16_SE_DTL0_EPS0_FL0_GRVW1_LPB1_PGR0_PLR1_SNLL0_TT4_2_USFGRO1_VW1_WG16_8_1_WGM8
    SolutionIndex: 294
    SolutionNameMin: Cijk_Ailk_Bljk_SB_MT64x32x32_SE_DTL0_EPS0_FL0_GRVW1_LPB1_PGR0_PLR1_SNLL0_TT4_2_USFGRO1_VW1_WG16_16_1_WGM1
    SolutionIndex: 295
    SolutionNameMin: Cijk_Ailk_Bljk_SB_MT64x32x8_SE_DTL0_EPS0_FL0_GRVW1_LPB4_PGR0_PLR1_SNLL0_TT4_4_USFGRO1_VW4_WG16_8_1_WGM1
    SolutionIndex: 296
    SolutionNameMin: Cijk_Ailk_Bljk_SB_MT64x32x8_SE_DTL0_EPS0_FL0_GRVW1_LPB4_PGR0_PLR1_SNLL0_TT4_4_USFGRO1_VW4_WG16_8_1_WGM8
    SolutionIndex: 297
    SolutionNameMin: Cijk_Ailk_Bljk_SB_MT64x32x16_SE_DTL0_EPS0_FL0_GRVW1_LPB4_PGR0_PLR1_SNLL0_TT4_4_USFGRO1_VW4_WG16_8_1_WGM1
    SolutionIndex: 298
    SolutionNameMin: Cijk_Ailk_Bljk_SB_MT64x32x8_SE_DTL0_EPS0_FL0_GRVW4_LPB4_PGR0_PLR1_SNLL0_TT4_4_USFGRO0_VW4_WG16_8_1_WGM8
    SolutionIndex: 299
    SolutionNameMin: Cijk_Ailk_Bljk_SB_MT64x32x8_SE_DTL0_EPS0_FL1_GRVW4_LPB4_PGR0_PLR1_SNLL0_TT4_4_USFGRO0_VW4_WG16_8_1_WGM8
    SolutionIndex: 300
    SolutionNameMin: Cijk_Ailk_Bljk_SB_MT32x32x8_SE_EPS0_GRVW2_GSU1_LPB0_PGR0_PLR1_SNLL0_TT2_2_VW2_WG16_16_1_WGM1
    SolutionIndex: 301
    SolutionNameMin: Cijk_Ailk_Bljk_SB_MT16x16x8_SE_EPS0_GRVW2_GSU1_LPB0_PGR0_PLR0_SNLL0_TT2_2_VW2_WG8_8_4_WGM1
    SolutionIndex: 302
    SolutionNameMin: Cijk_Ailk_Bljk_SB_MT32x32x16_SE_EPS0_GRVW2_GSU1_LPB0_PGR0_PLR0_SNLL0_TT2_2_VW2_WG16_16_1_WGM1
    SolutionIndex: 303
    SolutionNameMin: Cijk_Ailk_Bljk_SB_MT32x32x16_SE_EPS0_GRVW2_GSU1_LPB0_PGR0_PLR1_SNLL0_TT2_2_VW2_WG16_16_1_WGM1
    SolutionIndex: 304
    SolutionNameMin: Cijk_Ailk_Bljk_SB_MT16x16x16_SE_EPS0_GRVW2_GSU1_LPB0_PGR0_PLR0_SNLL0_TT2_2_VW2_WG8_8_2_WGM1
    SolutionIndex: 305
    SolutionNameMin: Cijk_Ailk_Bljk_SB_MT16x16x16_SE_EPS0_GRVW2_GSU1_LPB0_PGR0_PLR1_SNLL0_TT2_2_VW2_WG8_8_2_WGM1
    SolutionIndex: 306
    SolutionNameMin: Cijk_Ailk_Bljk_SB_MT16x16x16_SE_EPS1_GRVW2_GSU1_LPB0_PGR1_PLR1_SNLL1_TT2_2_VW2_WG8_8_4_WGM1
    SolutionIndex: 307
    SolutionNameMin: Cijk_Ailk_Bljk_SB_MT16x32x16_SE_EPS0_GRVW2_GSU1_LPB0_PGR0_PLR1_SNLL0_TT2_4_VW2_WG8_8_4_WGM1
    SolutionIndex: 308
    SolutionNameMin: Cijk_Ailk_Bljk_SB_MT32x32x16_SE_EPS0_GRVW2_GSU1_LPB0_PGR0_PLR0_SNLL0_TT2_2_VW2_WG16_16_1_WGM8
    SolutionIndex: 309
    SolutionNameMin: Cijk_Ailk_Bljk_SB_MT32x64x16_SE_EPS0_GRVW2_GSU1_LPB0_PGR0_PLR0_SNLL0_TT2_4_VW2_WG16_16_1_WGM8
    SolutionIndex: 310
    SolutionNameMin: Cijk_Ailk_Bljk_SB_MT32x64x16_SE_EPS0_GRVW2_GSU1_LPB0_PGR0_PLR1_SNLL0_TT2_4_VW2_WG16_16_1_WGM8
    SolutionIndex: 311
    SolutionNameMin: Cijk_Ailk_Bljk_SB_MT16x16x16_SE_EPS0_GRVW2_GSU1_LPB0_PGR0_PLR0_SNLL0_TT2_2_VW2_WG8_8_4_WGM8
    SolutionIndex: 312
    SolutionNameMin: Cijk_Ailk_Bljk_SB_MT16x16x32_SE_EPS0_GRVW2_GSU1_LPB0_PGR0_PLR0_SNLL0_TT2_2_VW2_WG8_8_4_WGM1
    SolutionIndex: 313
    SolutionNameMin: Cijk_Ailk_Bljk_SB_MT32x16x32_SE_EPS1_GRVW2_GSU1_LPB0_PGR1_PLR1_SNLL1_TT4_2_VW2_WG8_8_4_WGM1
    SolutionIndex: 314
    SolutionNameMin: Cijk_Ailk_Bljk_SB_MT16x8x32_SE_EPS0_GRVW2_GSU1_LPB0_PGR0_PLR1_SNLL0_TT2_2_VW2_WG8_4_4_WGM1
    SolutionIndex: 315
    SolutionNameMin: Cijk_Ailk_Bljk_SB_MT16x8x32_SE_EPS1_GRVW2_GSU1_LPB0_PGR1_PLR1_SNLL1_TT2_2_VW2_WG8_4_4_WGM1
    SolutionIndex: 316
    SolutionNameMin: Cijk_Ailk_Bljk_SB_MT16x8x32_SE_EPS0_GRVW2_GSU1_LPB0_PGR0_PLR1_SNLL0_TT2_2_VW2_WG8_4_4_WGM8
    SolutionIndex: 317
    SolutionNameMin: Cijk_Ailk_Bljk_SB_MT16x8x32_SE_EPS1_GRVW2_GSU4_LPB0_PGR1_PLR1_SNLL0_TT2_2_VW2_WG8_4_4_WGM1
    SolutionIndex: 318
    SolutionNameMin: Cijk_Ailk_Bljk_SB_MT32x32x16_SE_EPS0_GRVW2_GSU1_LPB2_PGR0_PLR1_SNLL0_TT2_2_VW2_WG16_16_1_WGM1
    SolutionIndex: 319
    SolutionNameMin: Cijk_Ailk_Bljk_SB_MT32x64x16_SE_EPS0_GRVW2_GSU1_LPB2_PGR0_PLR0_SNLL0_TT2_4_VW2_WG16_16_1_WGM1
    SolutionIndex: 320
    SolutionNameMin: Cijk_Ailk_Bljk_SB_MT32x64x16_SE_EPS0_GRVW2_GSU1_LPB2_PGR0_PLR1_SNLL0_TT2_4_VW2_WG16_16_1_WGM1
    SolutionIndex: 321
    SolutionNameMin: Cijk_Ailk_Bljk_SB_MT16x16x16_SE_EPS0_GRVW2_GSU1_LPB2_PGR0_PLR1_SNLL0_TT2_2_VW2_WG8_8_2_WGM1
    SolutionIndex: 322
    SolutionNameMin: Cijk_Ailk_Bljk_SB_MT32x16x16_SE_EPS0_GRVW2_GSU1_LPB2_PGR0_PLR1_SNLL0_TT4_2_VW2_WG8_8_4_WGM1
    SolutionIndex: 323
    SolutionNameMin: Cijk_Ailk_Bljk_SB_MT32x16x16_SE_EPS1_GRVW2_GSU1_LPB2_PGR1_PLR1_SNLL1_TT4_2_VW2_WG8_8_4_WGM1
    SolutionIndex: 324
    SolutionNameMin: Cijk_Ailk_Bljk_SB_MT32x32x32_SE_EPS1_GRVW2_GSU1_LPB2_PGR1_PLR1_SNLL1_TT2_2_VW2_WG16_16_1_WGM1
    SolutionIndex: 325
    SolutionNameMin: Cijk_Ailk_Bljk_SB_MT16x16x32_SE_EPS1_GRVW2_GSU1_LPB2_PGR1_PLR0_SNLL1_TT2_2_VW2_WG8_8_4_WGM1
    SolutionIndex: 326
    SolutionNameMin: Cijk_Ailk_Bljk_SB_MT16x16x32_SE_EPS0_GRVW2_GSU1_LPB2_PGR0_PLR1_SNLL0_TT2_2_VW2_WG8_8_4_WGM1
    SolutionIndex: 327
    SolutionNameMin: Cijk_Ailk_Bljk_SB_MT16x16x32_SE_EPS1_GRVW2_GSU1_LPB2_PGR1_PLR1_SNLL1_TT2_2_VW2_WG8_8_4_WGM1
    SolutionIndex: 328
    SolutionNameMin: Cijk_Ailk_Bljk_SB_MT32x16x32_SE_EPS1_GRVW2_GSU1_LPB2_PGR1_PLR0_SNLL1_TT4_2_VW2_WG8_8_4_WGM1
    SolutionIndex: 329
    SolutionNameMin: Cijk_Ailk_Bljk_SB_MT32x16x32_SE_EPS0_GRVW2_GSU1_LPB2_PGR0_PLR1_SNLL0_TT4_2_VW2_WG8_8_4_WGM1
    SolutionIndex: 330
    SolutionNameMin: Cijk_Ailk_Bljk_SB_MT32x16x32_SE_EPS1_GRVW2_GSU1_LPB2_PGR1_PLR1_SNLL1_TT4_2_VW2_WG8_8_4_WGM1
    SolutionIndex: 331
    SolutionNameMin: Cijk_Ailk_Bljk_SB_MT16x32x32_SE_EPS1_GRVW2_GSU1_LPB2_PGR1_PLR0_SNLL1_TT2_4_VW2_WG8_8_4_WGM1
    SolutionIndex: 332
    SolutionNameMin: Cijk_Ailk_Bljk_SB_MT16x32x32_SE_EPS0_GRVW2_GSU1_LPB2_PGR0_PLR1_SNLL0_TT2_4_VW2_WG8_8_4_WGM1
    SolutionIndex: 333
    SolutionNameMin: Cijk_Ailk_Bljk_SB_MT16x32x32_SE_EPS1_GRVW2_GSU1_LPB2_PGR1_PLR1_SNLL1_TT2_4_VW2_WG8_8_4_WGM1
    SolutionIndex: 334
    SolutionNameMin: Cijk_Ailk_Bljk_SB_MT16x8x32_SE_EPS1_GRVW2_GSU1_LPB2_PGR1_PLR1_SNLL1_TT2_2_VW2_WG8_4_4_WGM1
    SolutionIndex: 335
    SolutionNameMin: Cijk_Ailk_Bljk_SB_MT64x32x32_SE_EPS1_GRVW2_GSU1_LPB2_PGR1_PLR1_SNLL1_TT4_2_VW2_WG16_16_1_WGM8
    SolutionIndex: 336
    SolutionNameMin: Cijk_Ailk_Bljk_SB_MT16x16x32_SE_EPS0_GRVW2_GSU1_LPB2_PGR0_PLR1_SNLL0_TT2_2_VW2_WG8_8_4_WGM8
    SolutionIndex: 337
    SolutionNameMin: Cijk_Ailk_Bljk_SB_MT16x16x32_SE_EPS1_GRVW2_GSU1_LPB2_PGR1_PLR1_SNLL1_TT2_2_VW2_WG8_8_4_WGM8
    SolutionIndex: 338
    SolutionNameMin: Cijk_Ailk_Bljk_SB_MT32x16x32_SE_EPS0_GRVW2_GSU1_LPB2_PGR0_PLR1_SNLL0_TT4_2_VW2_WG8_8_4_WGM8
    SolutionIndex: 339
    SolutionNameMin: Cijk_Ailk_Bljk_SB_MT32x16x32_SE_EPS1_GRVW2_GSU1_LPB2_PGR1_PLR1_SNLL1_TT4_2_VW2_WG8_8_4_WGM8
    SolutionIndex: 340
    SolutionNameMin: Cijk_Ailk_Bljk_SB_MT16x32x32_SE_EPS1_GRVW2_GSU1_LPB2_PGR1_PLR0_SNLL1_TT2_4_VW2_WG8_8_4_WGM8
    SolutionIndex: 341
    SolutionNameMin: Cijk_Ailk_Bljk_SB_MT16x32x32_SE_EPS1_GRVW2_GSU1_LPB2_PGR1_PLR1_SNLL1_TT2_4_VW2_WG8_8_4_WGM8
    SolutionIndex: 342
    SolutionNameMin: Cijk_Ailk_Bljk_SB_MT16x8x32_SE_EPS0_GRVW2_GSU1_LPB2_PGR0_PLR1_SNLL0_TT2_2_VW2_WG8_4_4_WGM8
    SolutionIndex: 343
    SolutionNameMin: Cijk_Ailk_Bljk_SB_MT16x8x32_SE_EPS1_GRVW2_GSU1_LPB2_PGR1_PLR1_SNLL1_TT2_2_VW2_WG8_4_4_WGM8
    SolutionIndex: 344
    SolutionNameMin: Cijk_Ailk_Bljk_SB_MT16x16x32_SE_EPS1_GRVW2_GSU4_LPB2_PGR1_PLR1_SNLL0_TT2_2_VW2_WG8_8_2_WGM1
    SolutionIndex: 345
    SolutionNameMin: Cijk_Ailk_Bljk_SB_MT16x16x32_SE_EPS1_GRVW2_GSU4_LPB2_PGR1_PLR0_SNLL0_TT2_2_VW2_WG8_8_4_WGM1
    SolutionIndex: 346
    SolutionNameMin: Cijk_Ailk_Bljk_SB_MT16x16x32_SE_EPS1_GRVW2_GSU4_LPB2_PGR1_PLR1_SNLL0_TT2_2_VW2_WG8_8_4_WGM1
    SolutionIndex: 347
    SolutionNameMin: Cijk_Ailk_Bljk_SB_MT16x32x32_SE_EPS1_GRVW2_GSU4_LPB2_PGR1_PLR1_SNLL0_TT2_4_VW2_WG8_8_4_WGM1
    SolutionIndex: 348
    SolutionNameMin: Cijk_Ailk_Bljk_SB_MT16x8x32_SE_EPS1_GRVW2_GSU4_LPB2_PGR1_PLR0_SNLL0_TT2_2_VW2_WG8_4_4_WGM1
    SolutionIndex: 349
    SolutionNameMin: Cijk_Ailk_Bljk_SB_MT16x8x32_SE_EPS1_GRVW2_GSU4_LPB2_PGR1_PLR1_SNLL0_TT2_2_VW2_WG8_4_4_WGM1
    SolutionIndex: 350
    SolutionNameMin: Cijk_Ailk_Bljk_SB_MT16x16x32_SE_EPS1_GRVW2_GSU4_LPB2_PGR1_PLR1_SNLL0_TT2_4_VW2_WG8_4_4_WGM1
    SolutionIndex: 351
    SolutionNameMin: Cijk_Ailk_Bljk_SB_MT16x16x32_SE_EPS1_GRVW2_GSU4_LPB2_PGR1_PLR0_SNLL0_TT2_2_VW2_WG8_8_4_WGM8
    SolutionIndex: 352
    SolutionNameMin: Cijk_Ailk_Bljk_SB_MT16x16x32_SE_EPS0_GRVW2_GSU4_LPB2_PGR0_PLR1_SNLL0_TT2_2_VW2_WG8_8_4_WGM8
    SolutionIndex: 353
    SolutionNameMin: Cijk_Ailk_Bljk_SB_MT16x16x32_SE_EPS1_GRVW2_GSU4_LPB2_PGR1_PLR1_SNLL0_TT2_2_VW2_WG8_8_4_WGM8
    SolutionIndex: 354
    SolutionNameMin: Cijk_Ailk_Bljk_SB_MT32x16x32_SE_EPS1_GRVW2_GSU4_LPB2_PGR1_PLR0_SNLL0_TT4_2_VW2_WG8_8_4_WGM8
    SolutionIndex: 355
    SolutionNameMin: Cijk_Ailk_Bljk_SB_MT32x16x32_SE_EPS1_GRVW2_GSU4_LPB2_PGR1_PLR1_SNLL0_TT4_2_VW2_WG8_8_4_WGM8
    SolutionIndex: 356
    SolutionNameMin: Cijk_Ailk_Bljk_SB_MT16x32x32_SE_EPS1_GRVW2_GSU4_LPB2_PGR1_PLR1_SNLL0_TT2_4_VW2_WG8_8_4_WGM8
    SolutionIndex: 357
    SolutionNameMin: Cijk_Ailk_Bljk_SB_MT16x8x32_SE_EPS1_GRVW2_GSU4_LPB2_PGR1_PLR0_SNLL0_TT2_2_VW2_WG8_4_4_WGM8
    SolutionIndex: 358
    SolutionNameMin: Cijk_Ailk_Bljk_SB_MT16x8x32_SE_EPS1_GRVW2_GSU4_LPB2_PGR1_PLR1_SNLL0_TT2_2_VW2_WG8_4_4_WGM8
    SolutionIndex: 359
    SolutionNameMin: Cijk_Ailk_Bljk_SB_MT16x32x16_SE_EPS0_GRVW2_GSU1_LPB0_PGR0_PLR0_SNLL0_TT2_2_VW2_WG8_16_1_WGM1
    SolutionIndex: 360
    SolutionNameMin: Cijk_Ailk_Bljk_SB_MT16x64x16_SE_EPS0_GRVW2_GSU1_LPB0_PGR0_PLR1_SNLL0_TT2_4_VW2_WG8_16_1_WGM1
    SolutionIndex: 361
    SolutionNameMin: Cijk_Ailk_Bljk_SB_MT8x32x16_SE_EPS0_GRVW2_GSU1_LPB0_PGR0_PLR0_SNLL0_TT2_2_VW2_WG4_16_4_WGM1
    SolutionIndex: 362
    SolutionNameMin: Cijk_Ailk_Bljk_SB_MT8x32x16_SE_EPS0_GRVW2_GSU1_LPB0_PGR0_PLR1_SNLL0_TT2_2_VW2_WG4_16_4_WGM1
    SolutionIndex: 363
    SolutionNameMin: Cijk_Ailk_Bljk_SB_MT4x64x16_SE_EPS0_GRVW2_GSU1_LPB0_PGR0_PLR0_SNLL0_TT2_2_VW2_WG2_32_4_WGM1
    SolutionIndex: 364
    SolutionNameMin: Cijk_Ailk_Bljk_SB_MT8x64x8_SE_EPS0_GRVW2_GSU1_LPB2_PGR0_PLR1_SNLL0_TT2_4_VW2_WG4_16_4_WGM1
    SolutionIndex: 365
    SolutionNameMin: Cijk_Ailk_Bljk_SB_MT16x32x16_SE_EPS0_GRVW2_GSU1_LPB2_PGR0_PLR0_SNLL0_TT2_2_VW2_WG8_16_1_WGM1
    SolutionIndex: 366
    SolutionNameMin: Cijk_Ailk_Bljk_SB_MT8x32x16_SE_EPS0_GRVW2_GSU1_LPB2_PGR0_PLR0_SNLL0_TT2_2_VW2_WG4_16_4_WGM1
    SolutionIndex: 367
    SolutionNameMin: Cijk_Ailk_Bljk_SB_MT8x32x16_SE_EPS0_GRVW2_GSU1_LPB2_PGR0_PLR1_SNLL0_TT2_2_VW2_WG4_16_4_WGM1
    SolutionIndex: 368
    SolutionNameMin: Cijk_Ailk_Bljk_SB_MT8x64x16_SE_EPS0_GRVW2_GSU1_LPB2_PGR0_PLR0_SNLL0_TT2_4_VW2_WG4_16_4_WGM1
    SolutionIndex: 369
    SolutionNameMin: Cijk_Ailk_Bljk_SB_MT4x64x16_SE_EPS0_GRVW2_GSU1_LPB2_PGR0_PLR0_SNLL0_TT2_2_VW2_WG2_32_4_WGM1
    SolutionIndex: 370
    SolutionNameMin: Cijk_Ailk_Bljk_SB_MT4x64x16_SE_EPS0_GRVW2_GSU1_LPB2_PGR0_PLR1_SNLL0_TT2_2_VW2_WG2_32_4_WGM1
    SolutionIndex: 371
    SolutionNameMin: Cijk_Ailk_Bljk_SB_MT4x64x16_SE_EPS1_GRVW2_GSU1_LPB2_PGR1_PLR1_SNLL1_TT2_2_VW2_WG2_32_4_WGM1
    SolutionIndex: 372
    SolutionNameMin: Cijk_Ailk_Bljk_SB_MT4x64x16_SE_EPS1_GRVW2_GSU1_LPB2_PGR1_PLR1_SNLL1_TT2_2_VW2_WG2_32_4_WGM8
    SolutionIndex: 373
    SolutionNameMin: Cijk_Ailk_Bljk_SB_MT8x32x32_SE_EPS0_GRVW2_GSU1_LPB2_PGR0_PLR1_SNLL0_TT2_2_VW2_WG4_16_4_WGM1
    SolutionIndex: 374
    SolutionNameMin: Cijk_Ailk_Bljk_SB_MT16x32x32_SE_EPS1_GRVW2_GSU1_LPB2_PGR1_PLR1_SNLL1_TT4_2_VW2_WG4_16_4_WGM1
    SolutionIndex: 375
    SolutionNameMin: Cijk_Ailk_Bljk_SB_MT16x16x32_SE_EPS1_GRVW2_GSU1_LPB2_PGR1_PLR0_SNLL1_TT4_2_VW2_WG4_8_8_WGM1
    SolutionIndex: 376
    SolutionNameMin: Cijk_Ailk_Bljk_SB_MT16x16x32_SE_EPS1_GRVW2_GSU1_LPB2_PGR1_PLR1_SNLL1_TT4_2_VW2_WG4_8_8_WGM1
    SolutionIndex: 377
    SolutionNameMin: Cijk_Ailk_Bljk_SB_MT8x32x32_SE_EPS0_GRVW2_GSU1_LPB2_PGR0_PLR1_SNLL0_TT2_4_VW2_WG4_8_8_WGM1
    SolutionIndex: 378
    SolutionNameMin: Cijk_Ailk_Bljk_SB_MT8x32x32_SE_EPS1_GRVW2_GSU1_LPB2_PGR1_PLR1_SNLL1_TT2_4_VW2_WG4_8_8_WGM1
    SolutionIndex: 379
    SolutionNameMin: Cijk_Ailk_Bljk_SB_MT4x64x32_SE_EPS0_GRVW2_GSU1_LPB2_PGR0_PLR1_SNLL0_TT2_2_VW2_WG2_32_4_WGM1
    SolutionIndex: 380
    SolutionNameMin: Cijk_Ailk_Bljk_SB_MT16x32x32_SE_EPS1_GRVW2_GSU1_LPB2_PGR1_PLR1_SNLL1_TT4_2_VW2_WG4_16_4_WGM8
    SolutionIndex: 381
    SolutionNameMin: Cijk_Ailk_Bljk_SB_MT16x16x32_SE_EPS1_GRVW2_GSU1_LPB2_PGR1_PLR1_SNLL1_TT4_2_VW2_WG4_8_8_WGM8
    SolutionIndex: 382
    SolutionNameMin: Cijk_Ailk_Bljk_SB_MT8x32x32_SE_EPS0_GRVW2_GSU1_LPB2_PGR0_PLR1_SNLL0_TT2_4_VW2_WG4_8_8_WGM8
    SolutionIndex: 383
    SolutionNameMin: Cijk_Ailk_Bljk_SB_MT8x32x32_SE_EPS1_GRVW2_GSU1_LPB2_PGR1_PLR1_SNLL1_TT2_4_VW2_WG4_8_8_WGM8
    SolutionIndex: 384
    SolutionNameMin: Cijk_Ailk_Bljk_SB_MT8x32x32_SE_EPS1_GRVW2_GSU1_LPB2_PGR1_PLR1_SNLL1_TT4_2_VW2_WG2_16_8_WGM8
    SolutionIndex: 385
    SolutionNameMin: Cijk_Ailk_Bljk_SB_MT32x8x32_SE_EPS1_GRVW2_GSU1_LPB0_PGR1_PLR1_SNLL1_TT2_2_VW2_WG16_4_4_WGM1
    SolutionIndex: 386
    SolutionNameMin: Cijk_Ailk_Bljk_SB_MT32x8x32_SE_EPS1_GRVW2_GSU1_LPB2_PGR1_PLR1_SNLL1_TT2_2_VW2_WG16_4_4_WGM1
    SolutionIndex: 387
    SolutionNameMin: Cijk_Ailk_Bljk_SB_MT32x16x32_SE_EPS1_GRVW2_GSU1_LPB2_PGR1_PLR1_SNLL1_TT2_4_VW2_WG16_4_4_WGM1
    SolutionIndex: 388
    SolutionNameMin: Cijk_Ailk_Bljk_SB_MT32x16x32_SE_EPS1_GRVW2_GSU1_LPB2_PGR1_PLR1_SNLL1_TT2_2_VW2_WG16_8_2_WGM1
    SolutionIndex: 389
    SolutionNameMin: Cijk_Ailk_Bljk_SB_MT32x32x32_SE_EPS1_GRVW2_GSU1_LPB2_PGR1_PLR1_SNLL1_TT2_4_VW2_WG16_8_2_WGM1
    SolutionIndex: 390
    SolutionNameMin: Cijk_Ailk_Bljk_SB_MT32x8x32_SE_EPS1_GRVW2_GSU1_LPB2_PGR1_PLR1_SNLL1_TT4_2_VW2_WG8_4_8_WGM1
    SolutionIndex: 391
    SolutionNameMin: Cijk_Ailk_Bljk_SB_MT16x16x32_SE_EPS1_GRVW2_GSU1_LPB2_PGR1_PLR1_SNLL1_TT2_4_VW2_WG8_4_8_WGM1
    SolutionIndex: 392
    SolutionNameMin: Cijk_Ailk_Bljk_SB_MT32x8x32_SE_EPS1_GRVW2_GSU1_LPB2_PGR1_PLR1_SNLL1_TT2_2_VW2_WG16_4_4_WGM8
    SolutionIndex: 393
    SolutionNameMin: Cijk_Ailk_Bljk_SB_MT32x16x32_SE_EPS1_GRVW2_GSU1_LPB2_PGR1_PLR1_SNLL1_TT2_4_VW2_WG16_4_4_WGM8
    SolutionIndex: 394
    SolutionNameMin: Cijk_Ailk_Bljk_SB_MT64x16x32_SE_EPS1_GRVW2_GSU1_LPB2_PGR1_PLR1_SNLL1_TT4_2_VW2_WG16_8_2_WGM8
    SolutionIndex: 395
    SolutionNameMin: Cijk_Ailk_Bljk_SB_MT16x16x32_SE_EPS1_GRVW2_GSU1_LPB2_PGR1_PLR1_SNLL1_TT2_4_VW2_WG8_4_8_WGM8
    SolutionIndex: 396
    SolutionNameMin: Cijk_Ailk_Bljk_SB_MT64x32x32_SE_EPS1_GRVW2_GSU1_LPB2_PGR1_PLR1_SNLL1_TT2_4_VW2_WG32_8_2_WGM8
    SolutionIndex: 397
    SolutionNameMin: Cijk_Ailk_Bljk_SB_MT32x8x32_SE_EPS1_GRVW2_GSU4_LPB2_PGR1_PLR0_SNLL0_TT2_2_VW2_WG16_4_4_WGM1
    SolutionIndex: 398
    SolutionNameMin: Cijk_Ailk_Bljk_SB_MT16x16x32_SE_EPS1_GRVW2_GSU4_LPB2_PGR1_PLR0_SNLL0_TT2_4_VW2_WG8_4_8_WGM1
    SolutionIndex: 399
    SolutionNameMin: Cijk_Ailk_Bljk_SB_MT16x16x32_SE_EPS0_GRVW2_GSU4_LPB2_PGR0_PLR1_SNLL0_TT2_4_VW2_WG8_4_8_WGM1
    SolutionIndex: 400
    SolutionNameMin: Cijk_Ailk_Bljk_SB_MT16x16x32_SE_EPS1_GRVW2_GSU4_LPB2_PGR1_PLR1_SNLL0_TT2_4_VW2_WG8_4_8_WGM1
    SolutionIndex: 401
    SolutionNameMin: Cijk_Ailk_Bljk_SB_MT16x16x32_SE_EPS1_GRVW2_GSU4_LPB2_PGR1_PLR1_SNLL0_TT2_4_VW2_WG8_4_8_WGM8
    SolutionIndex: 402
    SolutionNameMin: Cijk_Ailk_Bljk_SB_MT64x64x8_SE_EPS1_GRVW2_GSU1_LPB0_PGR1_PLR1_SNLL1_TT4_4_VW2_WG16_16_1_WGM1
    SolutionIndex: 403
    SolutionNameMin: Cijk_Ailk_Bljk_SB_MT64x64x8_SE_EPS1_GRVW2_GSU1_LPB0_PGR1_PLR1_SNLL1_TT4_4_VW2_WG16_16_1_WGM8
    SolutionIndex: 404
    SolutionNameMin: Cijk_Ailk_Bljk_SB_MT64x64x8_SE_EPS0_GRVW2_GSU1_LPB0_PGR0_PLR0_SNLL0_TT4_4_VW2_WG16_16_1_WGM16
    SolutionIndex: 405
    SolutionNameMin: Cijk_Ailk_Bljk_SB_MT64x64x16_SE_EPS0_GRVW2_GSU1_LPB0_PGR0_PLR0_SNLL0_TT4_4_VW2_WG16_16_1_WGM16
    SolutionIndex: 406
    SolutionNameMin: Cijk_Ailk_Bljk_SB_MT128x64x16_SE_EPS1_GRVW4_GSU1_LPB0_PGR1_PLR1_SNLL1_TT8_4_VW4_WG16_16_1_WGM1
    SolutionIndex: 407
    SolutionNameMin: Cijk_Ailk_Bljk_SB_MT64x64x16_SE_EPS1_GRVW4_GSU1_LPB0_PGR1_PLR1_SNLL1_TT4_4_VW4_WG16_16_1_WGM8
    SolutionIndex: 408
    SolutionNameMin: Cijk_Ailk_Bljk_SB_MT64x64x32_SE_EPS1_GRVW4_GSU1_LPB0_PGR1_PLR1_SNLL1_TT4_4_VW4_WG16_16_1_WGM16
    SolutionIndex: 409
    SolutionNameMin: Cijk_Ailk_Bljk_SB_MT64x64x8_SE_EPS1_GRVW2_GSU1_LPB2_PGR1_PLR1_SNLL1_TT4_4_VW2_WG16_16_1_WGM1
    SolutionIndex: 410
    SolutionNameMin: Cijk_Ailk_Bljk_SB_MT64x64x8_SE_EPS0_GRVW2_GSU1_LPB2_PGR0_PLR1_SNLL0_TT4_4_VW2_WG16_16_1_WGM16
    SolutionIndex: 411
    SolutionNameMin: Cijk_Ailk_Bljk_SB_MT64x64x8_SE_EPS1_GRVW2_GSU1_LPB2_PGR1_PLR1_SNLL1_TT4_4_VW2_WG16_16_1_WGM16
    SolutionIndex: 412
    SolutionNameMin: Cijk_Ailk_Bljk_SB_MT64x32x16_SE_EPS1_GRVW2_GSU1_LPB2_PGR1_PLR1_SNLL1_TT4_4_VW2_WG16_8_4_WGM1
    SolutionIndex: 413
    SolutionNameMin: Cijk_Ailk_Bljk_SB_MT64x64x16_SE_EPS0_GRVW2_GSU1_LPB2_PGR0_PLR1_SNLL0_TT4_4_VW2_WG16_16_1_WGM8
    SolutionIndex: 414
    SolutionNameMin: Cijk_Ailk_Bljk_SB_MT64x32x16_SE_EPS1_GRVW2_GSU1_LPB2_PGR1_PLR1_SNLL1_TT4_4_VW2_WG16_8_4_WGM8
    SolutionIndex: 415
    SolutionNameMin: Cijk_Ailk_Bljk_SB_MT32x64x16_SE_EPS0_GRVW2_GSU1_LPB2_PGR0_PLR0_SNLL0_TT4_4_VW2_WG8_16_4_WGM8
    SolutionIndex: 416
    SolutionNameMin: Cijk_Ailk_Bljk_SB_MT32x64x16_SE_EPS1_GRVW2_GSU1_LPB2_PGR1_PLR1_SNLL1_TT4_4_VW2_WG8_16_4_WGM8
    SolutionIndex: 417
    SolutionNameMin: Cijk_Ailk_Bljk_SB_MT64x64x16_SE_EPS0_GRVW2_GSU1_LPB2_PGR0_PLR0_SNLL0_TT4_4_VW2_WG16_16_1_WGM16
    SolutionIndex: 418
    SolutionNameMin: Cijk_Ailk_Bljk_SB_MT64x64x16_SE_EPS0_GRVW2_GSU1_LPB2_PGR0_PLR1_SNLL0_TT4_4_VW2_WG16_16_1_WGM16
    SolutionIndex: 419
    SolutionNameMin: Cijk_Ailk_Bljk_SB_MT64x64x32_SE_EPS1_GRVW2_GSU1_LPB2_PGR1_PLR1_SNLL1_TT4_4_VW2_WG16_16_4_WGM1
    SolutionIndex: 420
    SolutionNameMin: Cijk_Ailk_Bljk_SB_MT64x32x32_SE_EPS1_GRVW2_GSU1_LPB2_PGR1_PLR1_SNLL1_TT4_4_VW2_WG16_8_4_WGM1
    SolutionIndex: 421
    SolutionNameMin: Cijk_Ailk_Bljk_SB_MT128x64x32_SE_EPS1_GRVW2_GSU1_LPB2_PGR1_PLR1_SNLL1_TT4_4_VW2_WG32_16_2_WGM1
    SolutionIndex: 422
    SolutionNameMin: Cijk_Ailk_Bljk_SB_MT64x64x32_SE_EPS1_GRVW2_GSU1_LPB2_PGR1_PLR1_SNLL1_TT4_4_VW2_WG16_16_4_WGM8
    SolutionIndex: 423
    SolutionNameMin: Cijk_Ailk_Bljk_SB_MT64x32x32_SE_EPS1_GRVW2_GSU1_LPB2_PGR1_PLR1_SNLL1_TT4_4_VW2_WG16_8_4_WGM8
    SolutionIndex: 424
    SolutionNameMin: Cijk_Ailk_Bljk_SB_MT64x64x16_SE_EPS1_GRVW4_GSU1_LPB4_PGR1_PLR1_SNLL1_TT4_4_VW4_WG16_16_1_WGM1
    SolutionIndex: 425
    SolutionNameMin: Cijk_Ailk_Bljk_SB_MT128x64x16_SE_EPS1_GRVW4_GSU1_LPB4_PGR1_PLR1_SNLL1_TT8_4_VW4_WG16_16_1_WGM1
    SolutionIndex: 426
    SolutionNameMin: Cijk_Ailk_Bljk_SB_MT64x64x16_SE_EPS0_GRVW4_GSU1_LPB4_PGR0_PLR0_SNLL0_TT4_4_VW4_WG16_16_1_WGM8
    SolutionIndex: 427
    SolutionNameMin: Cijk_Ailk_Bljk_SB_MT64x64x16_SE_EPS1_GRVW4_GSU1_LPB4_PGR1_PLR1_SNLL1_TT4_4_VW4_WG16_16_1_WGM16
    SolutionIndex: 428
    SolutionNameMin: Cijk_Ailk_Bljk_SB_MT64x128x16_SE_EPS1_GRVW4_GSU1_LPB4_PGR1_PLR1_SNLL1_TT4_8_VW4_WG16_16_1_WGM16
    SolutionIndex: 429
    SolutionNameMin: Cijk_Ailk_Bljk_SB_MT128x64x16_SE_EPS1_GRVW4_GSU1_LPB4_PGR1_PLR1_SNLL1_TT8_4_VW4_WG16_16_1_WGM16
    SolutionIndex: 430
    SolutionNameMin: Cijk_Ailk_Bljk_SB_MT64x64x32_SE_EPS1_GRVW4_GSU1_LPB4_PGR1_PLR1_SNLL1_TT4_4_VW4_WG16_16_1_WGM1
    SolutionIndex: 431
    SolutionNameMin: Cijk_Ailk_Bljk_SB_MT64x32x32_SE_EPS1_GRVW4_GSU1_LPB4_PGR1_PLR1_SNLL1_TT4_4_VW4_WG16_8_4_WGM1
    SolutionIndex: 432
    SolutionNameMin: Cijk_Ailk_Bljk_SB_MT64x64x32_SE_EPS1_GRVW4_GSU1_LPB4_PGR1_PLR1_SNLL1_TT4_8_VW4_WG16_8_4_WGM1
    SolutionIndex: 433
    SolutionNameMin: Cijk_Ailk_Bljk_SB_MT128x32x32_SE_EPS1_GRVW4_GSU1_LPB4_PGR1_PLR1_SNLL1_TT8_4_VW4_WG16_8_4_WGM1
    SolutionIndex: 434
    SolutionNameMin: Cijk_Ailk_Bljk_SB_MT64x64x32_SE_EPS1_GRVW4_GSU1_LPB4_PGR1_PLR1_SNLL1_TT8_4_VW4_WG8_16_4_WGM1
    SolutionIndex: 435
    SolutionNameMin: Cijk_Ailk_Bljk_SB_MT128x64x32_SE_EPS1_GRVW4_GSU1_LPB4_PGR1_PLR1_SNLL1_TT4_4_VW4_WG32_16_2_WGM1
    SolutionIndex: 436
    SolutionNameMin: Cijk_Ailk_Bljk_SB_MT64x32x32_SE_EPS1_GRVW4_GSU1_LPB4_PGR1_PLR1_SNLL1_TT4_4_VW4_WG16_8_4_WGM8
    SolutionIndex: 437
    SolutionNameMin: Cijk_Ailk_Bljk_SB_MT64x64x32_SE_EPS1_GRVW4_GSU1_LPB4_PGR1_PLR1_SNLL1_TT4_8_VW4_WG16_8_4_WGM8
    SolutionIndex: 438
    SolutionNameMin: Cijk_Ailk_Bljk_SB_MT128x64x32_SE_EPS1_GRVW4_GSU1_LPB4_PGR1_PLR1_SNLL1_TT4_4_VW4_WG32_16_2_WGM8
    SolutionIndex: 439
    SolutionNameMin: Cijk_Ailk_Bljk_SB_MT64x64x32_SE_EPS1_GRVW4_GSU1_LPB4_PGR1_PLR1_SNLL1_TT4_4_VW4_WG16_16_1_WGM16
    SolutionIndex: 440
    SolutionNameMin: Cijk_Ailk_Bljk_SB_MT64x32x32_SE_EPS1_GRVW4_GSU1_LPB4_PGR1_PLR0_SNLL1_TT4_4_VW4_WG16_8_4_WGM16
    SolutionIndex: 441
    SolutionNameMin: Cijk_Ailk_Bljk_SB_MT64x64x32_SE_EPS1_GRVW4_GSU1_LPB4_PGR1_PLR1_SNLL1_TT4_8_VW4_WG16_8_4_WGM16
    SolutionIndex: 442
    SolutionNameMin: Cijk_Ailk_Bljk_SB_MT64x64x32_SE_EPS1_GRVW4_GSU1_LPB4_PGR1_PLR1_SNLL1_TT8_4_VW4_WG8_16_4_WGM16
    SolutionIndex: 443
    SolutionNameMin: Cijk_Ailk_Bljk_SB_MT128x64x32_SE_EPS1_GRVW4_GSU1_LPB4_PGR1_PLR1_SNLL1_TT4_4_VW4_WG32_16_2_WGM16
    SolutionIndex: 444
    SolutionNameMin: Cijk_Ailk_Bljk_SB_MT16x64x8_SE_EPS0_GRVW2_GSU1_LPB0_PGR0_PLR0_SNLL0_TT4_4_VW2_WG4_16_4_WGM1
    SolutionIndex: 445
    SolutionNameMin: Cijk_Ailk_Bljk_SB_MT16x64x8_SE_EPS0_GRVW2_GSU1_LPB0_PGR0_PLR1_SNLL0_TT4_4_VW2_WG4_16_4_WGM1
    SolutionIndex: 446
    SolutionNameMin: Cijk_Ailk_Bljk_SB_MT64x64x32_SE_EPS1_GRVW4_GSU1_LPB0_PGR1_PLR1_SNLL1_TT8_4_VW4_WG8_16_2_WGM16
    SolutionIndex: 447
    SolutionNameMin: Cijk_Ailk_Bljk_SB_MT32x64x8_SE_EPS0_GRVW2_GSU1_LPB2_PGR0_PLR1_SNLL0_TT4_4_VW2_WG8_16_2_WGM8
    SolutionIndex: 448
    SolutionNameMin: Cijk_Ailk_Bljk_SB_MT32x64x8_SE_EPS0_GRVW2_GSU1_LPB2_PGR0_PLR1_SNLL0_TT4_4_VW2_WG8_16_2_WGM16
    SolutionIndex: 449
    SolutionNameMin: Cijk_Ailk_Bljk_SB_MT32x64x8_SE_EPS1_GRVW2_GSU1_LPB2_PGR1_PLR1_SNLL1_TT4_4_VW2_WG8_16_2_WGM16
    SolutionIndex: 450
    SolutionNameMin: Cijk_Ailk_Bljk_SB_MT32x64x16_SE_EPS0_GRVW2_GSU1_LPB2_PGR0_PLR1_SNLL0_TT4_4_VW2_WG8_16_2_WGM1
    SolutionIndex: 451
    SolutionNameMin: Cijk_Ailk_Bljk_SB_MT32x64x16_SE_EPS1_GRVW2_GSU1_LPB2_PGR1_PLR1_SNLL1_TT4_4_VW2_WG8_16_2_WGM1
    SolutionIndex: 452
    SolutionNameMin: Cijk_Ailk_Bljk_SB_MT16x64x16_SE_EPS0_GRVW2_GSU1_LPB2_PGR0_PLR1_SNLL0_TT4_4_VW2_WG4_16_4_WGM1
    SolutionIndex: 453
    SolutionNameMin: Cijk_Ailk_Bljk_SB_MT32x64x16_SE_EPS0_GRVW2_GSU1_LPB2_PGR0_PLR1_SNLL0_TT4_4_VW2_WG8_16_2_WGM8
    SolutionIndex: 454
    SolutionNameMin: Cijk_Ailk_Bljk_SB_MT32x64x16_SE_EPS1_GRVW2_GSU1_LPB2_PGR1_PLR1_SNLL1_TT4_4_VW2_WG8_16_2_WGM8
    SolutionIndex: 455
    SolutionNameMin: Cijk_Ailk_Bljk_SB_MT32x64x16_SE_EPS1_GRVW2_GSU1_LPB2_PGR1_PLR1_SNLL1_TT4_4_VW2_WG8_16_2_WGM16
    SolutionIndex: 456
    SolutionNameMin: Cijk_Ailk_Bljk_SB_MT16x32x32_SE_EPS1_GRVW2_GSU1_LPB2_PGR1_PLR1_SNLL1_TT4_4_VW2_WG4_8_8_WGM8
    SolutionIndex: 457
    SolutionNameMin: Cijk_Ailk_Bljk_SB_MT64x64x16_SE_EPS1_GRVW4_GSU1_LPB4_PGR1_PLR1_SNLL1_TT8_4_VW4_WG8_16_2_WGM1
    SolutionIndex: 458
    SolutionNameMin: Cijk_Ailk_Bljk_SB_MT64x64x16_SE_EPS1_GRVW4_GSU1_LPB4_PGR1_PLR1_SNLL1_TT8_4_VW4_WG8_16_2_WGM8
    SolutionIndex: 459
    SolutionNameMin: Cijk_Ailk_Bljk_SB_MT64x64x16_SE_EPS1_GRVW4_GSU1_LPB4_PGR1_PLR1_SNLL1_TT8_4_VW4_WG8_16_2_WGM16
    SolutionIndex: 460
    SolutionNameMin: Cijk_Ailk_Bljk_SB_MT32x64x32_SE_EPS1_GRVW4_GSU1_LPB4_PGR1_PLR1_SNLL1_TT4_4_VW4_WG8_16_2_WGM1
    SolutionIndex: 461
    SolutionNameMin: Cijk_Ailk_Bljk_SB_MT32x64x32_SE_EPS1_GRVW4_GSU1_LPB4_PGR1_PLR1_SNLL1_TT4_4_VW4_WG8_16_2_WGM16
    SolutionIndex: 462
    SolutionNameMin: Cijk_Ailk_Bljk_SB_MT32x32x32_SE_EPS1_GRVW4_GSU1_LPB0_PGR1_PLR1_SNLL1_TT4_4_VW4_WG8_8_4_WGM16
    SolutionIndex: 463
    SolutionNameMin: Cijk_Ailk_Bljk_SB_MT32x32x16_SE_EPS1_GRVW2_GSU1_LPB2_PGR1_PLR1_SNLL1_TT4_4_VW2_WG8_8_4_WGM1
    SolutionIndex: 464
    SolutionNameMin: Cijk_Ailk_Bljk_SB_MT32x32x16_SE_EPS0_GRVW2_GSU1_LPB2_PGR0_PLR1_SNLL0_TT4_4_VW2_WG8_8_4_WGM8
    SolutionIndex: 465
    SolutionNameMin: Cijk_Ailk_Bljk_SB_MT32x32x16_SE_EPS1_GRVW2_GSU1_LPB2_PGR1_PLR1_SNLL1_TT4_4_VW2_WG8_8_4_WGM16
    SolutionIndex: 466
    SolutionNameMin: Cijk_Ailk_Bljk_SB_MT32x32x32_SE_EPS1_GRVW2_GSU1_LPB2_PGR1_PLR1_SNLL1_TT4_4_VW2_WG8_8_4_WGM1
    SolutionIndex: 467
    SolutionNameMin: Cijk_Ailk_Bljk_SB_MT32x32x32_SE_EPS1_GRVW2_GSU1_LPB2_PGR1_PLR1_SNLL1_TT4_4_VW2_WG8_8_4_WGM8
    SolutionIndex: 468
    SolutionNameMin: Cijk_Ailk_Bljk_SB_MT32x32x32_SE_EPS1_GRVW2_GSU1_LPB2_PGR1_PLR1_SNLL1_TT4_4_VW2_WG8_8_4_WGM16
    SolutionIndex: 469
    SolutionNameMin: Cijk_Ailk_Bljk_SB_MT64x32x16_SE_EPS1_GRVW4_GSU1_LPB4_PGR1_PLR1_SNLL1_TT4_4_VW4_WG16_8_2_WGM1
    SolutionIndex: 470
    SolutionNameMin: Cijk_Ailk_Bljk_SB_MT64x32x16_SE_EPS1_GRVW4_GSU1_LPB4_PGR1_PLR1_SNLL1_TT4_4_VW4_WG16_8_2_WGM8
    SolutionIndex: 471
    SolutionNameMin: Cijk_Ailk_Bljk_SB_MT64x32x16_SE_EPS1_GRVW4_GSU1_LPB4_PGR1_PLR1_SNLL1_TT4_4_VW4_WG16_8_2_WGM16
    SolutionIndex: 472
    SolutionNameMin: Cijk_Ailk_Bljk_SB_MT64x64x16_SE_EPS1_GRVW4_GSU1_LPB4_PGR1_PLR1_SNLL1_TT4_8_VW4_WG16_8_2_WGM16
    SolutionIndex: 473
    SolutionNameMin: Cijk_Ailk_Bljk_SB_MT64x32x32_SE_EPS1_GRVW4_GSU1_LPB4_PGR1_PLR1_SNLL1_TT4_4_VW4_WG16_8_2_WGM1
    SolutionIndex: 474
    SolutionNameMin: Cijk_Ailk_Bljk_SB_MT128x32x32_SE_EPS1_GRVW4_GSU1_LPB4_PGR1_PLR1_SNLL1_TT4_8_VW4_WG32_4_4_WGM1
    SolutionIndex: 475
    SolutionNameMin: Cijk_Ailk_Bljk_SB_MT32x32x32_SE_EPS1_GRVW4_GSU1_LPB4_PGR1_PLR1_SNLL1_TT4_4_VW4_WG8_8_4_WGM1
    SolutionIndex: 476
    SolutionNameMin: Cijk_Ailk_Bljk_SB_MT64x32x32_SE_EPS1_GRVW4_GSU1_LPB4_PGR1_PLR1_SNLL1_TT4_4_VW4_WG16_8_2_WGM8
    SolutionIndex: 477
    SolutionNameMin: Cijk_Ailk_Bljk_SB_MT32x32x32_SE_EPS0_GRVW4_GSU1_LPB4_PGR0_PLR1_SNLL0_TT4_4_VW4_WG8_8_4_WGM8
    SolutionIndex: 478
    SolutionNameMin: Cijk_Ailk_Bljk_SB_MT32x32x32_SE_EPS1_GRVW4_GSU1_LPB4_PGR1_PLR1_SNLL1_TT4_4_VW4_WG8_8_4_WGM8
    SolutionIndex: 479
    SolutionNameMin: Cijk_Ailk_Bljk_SB_MT64x32x32_SE_EPS1_GRVW4_GSU1_LPB4_PGR1_PLR1_SNLL1_TT8_4_VW4_WG8_8_4_WGM8
    SolutionIndex: 480
    SolutionNameMin: Cijk_Ailk_Bljk_SB_MT64x32x32_SE_EPS1_GRVW4_GSU1_LPB4_PGR1_PLR1_SNLL1_TT4_4_VW4_WG16_8_2_WGM16
    SolutionIndex: 481
    SolutionNameMin: Cijk_Ailk_Bljk_SB_MT32x32x32_SE_EPS1_GRVW4_GSU1_LPB4_PGR1_PLR1_SNLL1_TT4_4_VW4_WG8_8_4_WGM16
    SolutionIndex: 482
    SolutionNameMin: Cijk_Ailk_Bljk_SB_MT64x32x32_SE_EPS0_GRVW2_GSU4_LPB2_PGR0_PLR1_SNLL0_TT4_4_VW2_WG16_8_2_WGM1
    SolutionIndex: 483
    SolutionNameMin: Cijk_Ailk_Bljk_SB_MT64x32x32_SE_EPS0_GRVW2_GSU4_LPB2_PGR0_PLR1_SNLL0_TT4_4_VW2_WG16_8_2_WGM8
    SolutionIndex: 484
    SolutionNameMin: Cijk_Ailk_Bljk_SB_MT32x32x32_SE_EPS1_GRVW2_GSU4_LPB2_PGR1_PLR1_SNLL0_TT4_4_VW2_WG8_8_4_WGM8
    SolutionIndex: 485
    SolutionNameMin: Cijk_Ailk_Bljk_SB_MT32x32x32_SE_EPS1_GRVW2_GSU4_LPB2_PGR1_PLR1_SNLL0_TT4_4_VW2_WG8_8_4_WGM16
    SolutionIndex: 486
    SolutionNameMin: Cijk_Ailk_Bljk_SB_MT16x32x8_SE_EPS0_GRVW2_GSU1_LPB0_PGR0_PLR0_SNLL0_TT2_2_VW2_WG8_16_2_WGM1
    SolutionIndex: 487
    SolutionNameMin: Cijk_Ailk_Bljk_SB_MT32x32x8_SE_EPS0_GRVW2_GSU1_LPB0_PGR0_PLR1_SNLL0_TT2_2_VW2_WG16_16_1_WGM16
    SolutionIndex: 488
    SolutionNameMin: Cijk_Ailk_Bljk_SB_MT32x32x16_SE_EPS0_GRVW2_GSU1_LPB0_PGR0_PLR0_SNLL0_TT2_2_VW2_WG16_16_1_WGM16
    SolutionIndex: 489
    SolutionNameMin: Cijk_Ailk_Bljk_SB_MT32x32x16_SE_EPS0_GRVW2_GSU1_LPB0_PGR0_PLR1_SNLL0_TT2_2_VW2_WG16_16_1_WGM16
    SolutionIndex: 490
    SolutionNameMin: Cijk_Ailk_Bljk_SB_MT32x32x8_SE_EPS0_GRVW2_GSU1_LPB2_PGR0_PLR1_SNLL0_TT2_2_VW2_WG16_16_1_WGM16
    SolutionIndex: 491
    SolutionNameMin: Cijk_Ailk_Bljk_SB_MT16x32x16_SE_EPS0_GRVW2_GSU1_LPB2_PGR0_PLR0_SNLL0_TT2_2_VW2_WG8_16_2_WGM1
    SolutionIndex: 492
    SolutionNameMin: Cijk_Ailk_Bljk_SB_MT16x32x16_SE_EPS0_GRVW2_GSU1_LPB2_PGR0_PLR1_SNLL0_TT2_2_VW2_WG8_16_2_WGM1
    SolutionIndex: 493
    SolutionNameMin: Cijk_Ailk_Bljk_SB_MT32x32x16_SE_EPS1_GRVW2_GSU1_LPB2_PGR1_PLR1_SNLL1_TT4_2_VW2_WG8_16_2_WGM1
    SolutionIndex: 494
    SolutionNameMin: Cijk_Ailk_Bljk_SB_MT32x64x16_SE_EPS0_GRVW2_GSU1_LPB2_PGR0_PLR0_SNLL0_TT2_4_VW2_WG16_16_1_WGM16
    SolutionIndex: 495
    SolutionNameMin: Cijk_Ailk_Bljk_SB_MT16x16x32_SE_EPS0_GRVW2_GSU1_LPB2_PGR0_PLR1_SNLL0_TT2_2_VW2_WG8_8_4_WGM16
    SolutionIndex: 496
    SolutionNameMin: Cijk_Ailk_Bljk_SB_MT16x16x32_SE_EPS1_GRVW2_GSU1_LPB2_PGR1_PLR1_SNLL1_TT2_2_VW2_WG8_8_4_WGM16
    SolutionIndex: 497
    SolutionNameMin: Cijk_Ailk_Bljk_SB_MT32x16x32_SE_EPS1_GRVW2_GSU1_LPB2_PGR1_PLR1_SNLL1_TT4_2_VW2_WG8_8_4_WGM16
    SolutionIndex: 498
    SolutionNameMin: Cijk_Ailk_Bljk_SB_MT32x8x32_SE_EPS1_GRVW2_GSU1_LPB2_PGR1_PLR1_SNLL1_TT2_2_VW2_WG16_4_4_WGM16
    SolutionIndex: 499
    SolutionNameMin: Cijk_Ailk_Bljk_SB_MT32x16x32_SE_EPS1_GRVW2_GSU1_LPB2_PGR1_PLR1_SNLL1_TT2_4_VW2_WG16_4_4_WGM16
    SolutionIndex: 500
    SolutionNameMin: Cijk_Ailk_Bljk_SB_MT64x16x32_SE_EPS1_GRVW4_GSU1_LPB4_PGR1_PLR1_SNLL1_TT4_4_VW4_WG16_4_4_WGM1
    SolutionIndex: 501
    SolutionNameMin: Cijk_Ailk_Bljk_SB_MT128x32x32_SE_EPS1_GRVW4_GSU1_LPB4_PGR1_PLR1_SNLL1_TT4_4_VW4_WG32_8_2_WGM1
    SolutionIndex: 502
    SolutionNameMin: Cijk_Ailk_Bljk_SB_MT64x16x32_SE_EPS1_GRVW4_GSU1_LPB4_PGR1_PLR1_SNLL1_TT4_4_VW4_WG16_4_4_WGM8
    SolutionIndex: 503
    SolutionNameMin: Cijk_Ailk_Bljk_SB_MT64x16x32_SE_EPS1_GRVW4_GSU1_LPB4_PGR1_PLR1_SNLL1_TT4_4_VW4_WG16_4_4_WGM16
    SolutionIndex: 504
    SolutionNameMin: Cijk_Ailk_Bljk_SB_MT128x32x32_SE_EPS1_GRVW4_GSU1_LPB4_PGR1_PLR1_SNLL1_TT4_4_VW4_WG32_8_2_WGM16
    SolutionIndex: 505
    SolutionNameMin: Cijk_Ailk_Bljk_SB_MT64x64x16_SE_EPS1_FL0_GRVW4_GSU1_LPB0_PGR1_PLR1_TT4_4_USFGRO0_WG16_16_1_WGM8
    SolutionIndex: 506
    SolutionNameMin: Cijk_Ailk_Bljk_SB_MT64x64x16_SE_EPS1_FL1_GRVW4_GSU1_LPB0_PGR1_PLR1_TT4_4_USFGRO0_WG16_16_1_WGM8
    SolutionIndex: 507
    SolutionNameMin: Cijk_Ailk_Bljk_SB_MT96x64x8_SE_EPS1_FL1_GRVW2_GSU1_LPB0_PGR1_PLR0_TT6_4_USFGRO0_WG16_16_1_WGM1
    SolutionIndex: 508
    SolutionNameMin: Cijk_Ailk_Bljk_SB_MT96x64x8_SE_EPS1_FL1_GRVW2_GSU1_LPB0_PGR1_PLR0_TT6_4_USFGRO0_WG16_16_1_WGM8
    SolutionIndex: 509
    SolutionNameMin: Cijk_Ailk_Bljk_SB_MT96x64x8_SE_EPS1_FL1_GRVW2_GSU1_LPB0_PGR1_PLR1_TT6_4_USFGRO0_WG16_16_1_WGM1
    SolutionIndex: 510
    SolutionNameMin: Cijk_Ailk_Bljk_SB_MT96x64x8_SE_EPS1_FL1_GRVW2_GSU1_LPB0_PGR1_PLR1_TT6_4_USFGRO0_WG16_16_1_WGM8
    SolutionIndex: 511
    SolutionNameMin: Cijk_Ailk_Bljk_SB_MT64x96x16_SE_EPS1_FL0_GRVW2_GSU1_LPB0_PGR1_PLR1_TT4_6_USFGRO0_WG16_16_1_WGM1
    SolutionIndex: 512
    SolutionNameMin: Cijk_Ailk_Bljk_SB_MT64x96x8_SE_EPS1_FL1_GRVW4_GSU1_LPB0_PGR1_PLR1_TT4_6_USFGRO0_WG16_16_1_WGM8
    SolutionIndex: 513
    SolutionNameMin: Cijk_Ailk_Bljk_SB_MT128x64x8_SE_EPS1_FL0_GRVW1_GSU1_LPB0_PGR1_PLR1_TT8_4_USFGRO1_WG16_16_1_WGM8
    SolutionIndex: 514
    SolutionNameMin: Cijk_Ailk_Bljk_SB_MT128x64x8_SE_EPS1_FL0_GRVW2_GSU1_LPB0_PGR1_PLR0_TT8_4_USFGRO0_WG16_16_1_WGM8
    SolutionIndex: 515
    SolutionNameMin: Cijk_Ailk_Bljk_SB_MT128x64x8_SE_EPS1_FL0_GRVW2_GSU1_LPB0_PGR1_PLR1_TT8_4_USFGRO0_WG16_16_1_WGM8
    SolutionIndex: 516
    SolutionNameMin: Cijk_Ailk_Bljk_SB_MT128x64x8_SE_EPS1_FL0_GRVW4_GSU1_LPB0_PGR1_PLR0_TT8_4_USFGRO0_WG16_16_1_WGM8
    SolutionIndex: 517
    SolutionNameMin: Cijk_Ailk_Bljk_SB_MT128x64x8_SE_EPS1_FL0_GRVW4_GSU1_LPB0_PGR1_PLR1_TT8_4_USFGRO0_WG16_16_1_WGM1
    SolutionIndex: 518
    SolutionNameMin: Cijk_Ailk_Bljk_SB_MT128x64x8_SE_EPS1_FL0_GRVW4_GSU1_LPB0_PGR1_PLR1_TT8_4_USFGRO0_WG16_16_1_WGM8
    SolutionIndex: 519
    SolutionNameMin: Cijk_Ailk_Bljk_SB_MT128x64x16_SE_EPS1_FL0_GRVW4_GSU1_LPB0_PGR1_PLR1_TT8_4_USFGRO0_WG16_16_1_WGM1
    SolutionIndex: 520
    SolutionNameMin: Cijk_Ailk_Bljk_SB_MT128x64x8_SE_EPS1_FL1_GRVW2_GSU1_LPB0_PGR1_PLR0_TT8_4_USFGRO0_WG16_16_1_WGM8
    SolutionIndex: 521
    SolutionNameMin: Cijk_Ailk_Bljk_SB_MT128x64x8_SE_EPS1_FL1_GRVW2_GSU1_LPB0_PGR1_PLR1_TT8_4_USFGRO0_WG16_16_1_WGM8
    SolutionIndex: 522
    SolutionNameMin: Cijk_Ailk_Bljk_SB_MT128x64x8_SE_EPS1_FL1_GRVW4_GSU1_LPB0_PGR1_PLR0_TT8_4_USFGRO0_WG16_16_1_WGM1
    SolutionIndex: 523
    SolutionNameMin: Cijk_Ailk_Bljk_SB_MT128x64x8_SE_EPS1_FL1_GRVW4_GSU1_LPB0_PGR1_PLR0_TT8_4_USFGRO0_WG16_16_1_WGM8
    SolutionIndex: 524
    SolutionNameMin: Cijk_Ailk_Bljk_SB_MT128x64x8_SE_EPS1_FL1_GRVW4_GSU1_LPB0_PGR1_PLR1_TT8_4_USFGRO0_WG16_16_1_WGM1
    SolutionIndex: 525
    SolutionNameMin: Cijk_Ailk_Bljk_SB_MT128x64x8_SE_EPS1_FL1_GRVW4_GSU1_LPB0_PGR1_PLR1_TT8_4_USFGRO0_WG16_16_1_WGM8
    SolutionIndex: 526
    SolutionNameMin: Cijk_Ailk_Bljk_SB_MT128x64x16_SE_EPS1_FL1_GRVW4_GSU1_LPB0_PGR1_PLR1_TT8_4_USFGRO0_WG16_16_1_WGM8
    SolutionIndex: 527
    SolutionNameMin: Cijk_Ailk_Bljk_SB_MT128x128x8_SE_EPS1_FL0_GRVW1_GSU1_LPB0_PGR1_PLR1_TT8_8_USFGRO1_WG16_16_1_WGM8
    SolutionIndex: 528
    SolutionNameMin: Cijk_Ailk_Bljk_SB_MT128x128x8_SE_EPS1_FL0_GRVW2_GSU1_LPB0_PGR1_PLR0_TT8_8_USFGRO0_WG16_16_1_WGM8
    SolutionIndex: 529
    SolutionNameMin: Cijk_Ailk_Bljk_SB_MT128x128x8_SE_EPS1_FL0_GRVW2_GSU1_LPB0_PGR1_PLR1_TT8_8_USFGRO0_WG16_16_1_WGM8
    SolutionIndex: 530
    SolutionNameMin: Cijk_Ailk_Bljk_SB_MT128x128x8_SE_EPS1_FL0_GRVW4_GSU1_LPB0_PGR1_PLR0_TT8_8_USFGRO0_WG16_16_1_WGM1
    SolutionIndex: 531
    SolutionNameMin: Cijk_Ailk_Bljk_SB_MT128x128x8_SE_EPS1_FL0_GRVW4_GSU1_LPB0_PGR1_PLR0_TT8_8_USFGRO0_WG16_16_1_WGM8
    SolutionIndex: 532
    SolutionNameMin: Cijk_Ailk_Bljk_SB_MT128x128x8_SE_EPS1_FL0_GRVW4_GSU1_LPB0_PGR1_PLR1_TT8_8_USFGRO0_WG16_16_1_WGM1
    SolutionIndex: 533
    SolutionNameMin: Cijk_Ailk_Bljk_SB_MT128x128x8_SE_EPS1_FL0_GRVW4_GSU1_LPB0_PGR1_PLR1_TT8_8_USFGRO0_WG16_16_1_WGM8
    SolutionIndex: 534
    SolutionNameMin: Cijk_Ailk_Bljk_SB_MT128x128x16_SE_EPS1_FL0_GRVW4_GSU1_LPB0_PGR1_PLR1_TT8_8_USFGRO0_WG16_16_1_WGM1
    SolutionIndex: 535
    SolutionNameMin: Cijk_Ailk_Bljk_SB_MT128x128x8_SE_EPS1_FL1_GRVW4_GSU1_LPB0_PGR1_PLR0_TT8_8_USFGRO0_WG16_16_1_WGM8
    SolutionIndex: 536
    SolutionNameMin: Cijk_Ailk_Bljk_SB_MT128x128x8_SE_EPS1_FL1_GRVW4_GSU1_LPB0_PGR1_PLR1_TT8_8_USFGRO0_WG16_16_1_WGM8
    SolutionIndex: 537
    SolutionNameMin: Cijk_Ailk_Bljk_SB_MT32x32x8_SE_EPS0_FL0_GRVW1_GSU1_LPB0_PGR0_PLR0_TT2_2_USFGRO1_WG16_16_1_WGM1
    SolutionIndex: 538
    SolutionNameMin: Cijk_Ailk_Bljk_SB_MT32x32x32_SE_EPS1_FL0_GRVW2_GSU1_LPB2_PGR1_PLR1_TT4_2_USFGRO0_WG8_16_2_WGM1
    SolutionIndex: 539
    SolutionNameMin: Cijk_Ailk_Bljk_SB_MT32x32x32_SE_EPS1_FL1_GRVW2_GSU1_LPB2_PGR1_PLR1_TT4_2_USFGRO0_WG8_16_2_WGM1
    SolutionIndex: 540
    SolutionNameMin: Cijk_Ailk_Bljk_SB_MT32x16x32_SE_EPS1_FL1_GRVW2_GSU1_LPB2_PGR1_PLR1_TT2_2_USFGRO0_WG16_8_2_WGM8
    SolutionIndex: 541
    SolutionNameMin: Cijk_Ailk_Bljk_SB_MT32x32x32_SE_EPS1_FL0_GRVW2_GSU1_LPB2_PGR1_PLR1_TT2_4_USFGRO0_WG16_8_2_WGM1
    SolutionIndex: 542
    SolutionNameMin: Cijk_Ailk_Bljk_SB_MT32x32x16_SE_EPS1_FL0_GRVW4_GSU1_LPB2_PGR1_PLR1_TT2_4_USFGRO0_WG16_8_2_WGM8
    SolutionIndex: 543
    SolutionNameMin: Cijk_Ailk_Bljk_SB_MT64x32x16_SE_EPS1_FL0_GRVW4_GSU1_LPB4_PGR1_PLR1_TT4_4_USFGRO0_WG16_8_2_WGM8
    SolutionIndex: 544
    SolutionNameMin: Cijk_Ailk_Bljk_SB_MT64x32x32_SE_EPS1_FL0_GRVW4_GSU1_LPB4_PGR1_PLR1_TT4_4_USFGRO0_WG16_8_2_WGM8
    SolutionIndex: 545
    SolutionNameMin: Cijk_Ailk_Bljk_SB_MT64x32x32_SE_EPS1_FL1_GRVW2_GSU1_LPB2_PGR1_PLR1_TT4_4_USFGRO0_WG16_8_2_WGM8
    SolutionIndex: 546
    SolutionNameMin: Cijk_Ailk_Bljk_SB_MT64x32x16_SE_EPS1_FL1_GRVW4_GSU1_LPB4_PGR1_PLR1_TT4_4_USFGRO0_WG16_8_2_WGM8
    SolutionIndex: 547
    SolutionNameMin: Cijk_Ailk_Bljk_SB_MT64x32x32_SE_EPS1_FL1_GRVW4_GSU1_LPB4_PGR1_PLR1_TT4_4_USFGRO0_WG16_8_2_WGM8
    SolutionIndex: 548
    SolutionNameMin: Cijk_Ailk_Bljk_SB_MT8x32x32_SE_EPS1_FL0_GRVW4_GSU1_LPB2_PGR1_PLR1_TT2_2_USFGRO1_WG4_16_4_WGM1
    SolutionIndex: 549
    SolutionNameMin: Cijk_Ailk_Bljk_SB_MT16x32x32_SE_EPS1_FL0_GRVW1_GSU1_LPB2_PGR1_PLR1_TT4_2_USFGRO1_WG4_16_4_WGM1
    SolutionIndex: 550
    SolutionNameMin: Cijk_Ailk_Bljk_SB_MT16x32x32_SE_EPS1_FL0_GRVW1_GSU1_LPB2_PGR1_PLR1_TT4_2_USFGRO1_WG4_16_4_WGM8
    SolutionIndex: 551
    SolutionNameMin: Cijk_Ailk_Bljk_SB_MT16x32x32_SE_EPS1_FL1_GRVW2_GSU1_LPB2_PGR1_PLR1_TT4_2_USFGRO0_WG4_16_4_WGM8
    SolutionIndex: 552
    SolutionNameMin: Cijk_Ailk_Bljk_SB_MT16x32x32_SE_EPS1_FL1_GRVW4_GSU1_LPB2_PGR1_PLR1_TT4_2_USFGRO0_WG4_16_4_WGM8
    SolutionIndex: 553
    SolutionNameMin: Cijk_Ailk_Bljk_SB_MT16x64x32_SE_EPS1_FL0_GRVW4_GSU1_LPB2_PGR1_PLR0_TT4_4_USFGRO0_WG4_16_4_WGM8
    SolutionIndex: 554
    SolutionNameMin: Cijk_Ailk_Bljk_SB_MT32x8x32_SE_EPS1_FL0_GRVW2_GSU1_LPB2_PGR1_PLR1_TT2_2_USFGRO0_WG16_4_4_WGM8
    SolutionIndex: 555
    SolutionNameMin: Cijk_Ailk_Bljk_SB_MT32x16x32_SE_EPS1_FL0_GRVW1_GSU1_LPB2_PGR1_PLR0_TT2_4_USFGRO1_WG16_4_4_WGM8
    SolutionIndex: 556
    SolutionNameMin: Cijk_Ailk_Bljk_SB_MT32x16x32_SE_EPS1_FL0_GRVW1_GSU1_LPB2_PGR1_PLR1_TT2_4_USFGRO1_WG16_4_4_WGM8
    SolutionIndex: 557
    SolutionNameMin: Cijk_Ailk_Bljk_SB_MT32x16x32_SE_EPS1_FL0_GRVW2_GSU1_LPB2_PGR1_PLR0_TT2_4_USFGRO0_WG16_4_4_WGM8
    SolutionIndex: 558
    SolutionNameMin: Cijk_Ailk_Bljk_SB_MT64x16x16_SE_EPS1_FL0_GRVW4_GSU1_LPB4_PGR1_PLR1_TT4_4_USFGRO0_WG16_4_4_WGM8
    SolutionIndex: 559
    SolutionNameMin: Cijk_Ailk_Bljk_SB_MT64x64x8_SE_DTL0_EPS0_FL0_GRVW1_LPB0_PGR0_PLR1_TT4_4_USFGRO1_VW2_WG16_16_1_WGM1
    SolutionIndex: 560
    SolutionNameMin: Cijk_Ailk_Bljk_SB_MT64x64x8_SE_DTL0_EPS0_FL0_GRVW1_LPB0_PGR0_PLR0_TT4_4_USFGRO1_VW4_WG16_16_1_WGM1
    SolutionIndex: 561
    SolutionNameMin: Cijk_Ailk_Bljk_SB_MT64x64x16_SE_DTL0_EPS1_FL0_GRVW4_LPB0_PGR1_PLR1_TT4_4_USFGRO0_VW4_WG16_16_1_WGM1
    SolutionIndex: 562
    SolutionNameMin: Cijk_Ailk_Bljk_SB_MT64x64x16_SE_DTL0_EPS1_FL0_GRVW4_LPB0_PGR1_PLR1_TT4_4_USFGRO0_VW4_WG16_16_1_WGM8
    SolutionIndex: 563
    SolutionNameMin: Cijk_Ailk_Bljk_SB_MT64x64x8_SE_DTL0_EPS1_FL1_GRVW2_LPB0_PGR1_PLR1_TT4_4_USFGRO0_VW2_WG16_16_1_WGM1
    SolutionIndex: 564
    SolutionNameMin: Cijk_Ailk_Bljk_SB_MT64x64x16_SE_DTL0_EPS1_FL1_GRVW4_LPB0_PGR1_PLR1_TT4_4_USFGRO0_VW4_WG16_16_1_WGM1
    SolutionIndex: 565
    SolutionNameMin: Cijk_Ailk_Bljk_SB_MT96x64x16_SE_DTL0_EPS1_FL0_GRVW2_LPB0_PGR1_PLR1_TT6_4_USFGRO0_VW2_WG16_16_1_WGM8
    SolutionIndex: 566
    SolutionNameMin: Cijk_Ailk_Bljk_SB_MT96x64x8_SE_DTL0_EPS1_FL1_GRVW2_LPB0_PGR1_PLR1_TT6_4_USFGRO0_VW2_WG16_16_1_WGM8
    SolutionIndex: 567
    SolutionNameMin: Cijk_Ailk_Bljk_SB_MT128x64x8_SE_DTL0_EPS1_FL0_GRVW2_LPB0_PGR1_PLR1_TT8_4_USFGRO0_VW2_WG16_16_1_WGM8
    SolutionIndex: 568
    SolutionNameMin: Cijk_Ailk_Bljk_SB_MT128x64x8_SE_DTL0_EPS1_FL0_GRVW4_LPB0_PGR1_PLR1_TT8_4_USFGRO0_VW4_WG16_16_1_WGM1
    SolutionIndex: 569
    SolutionNameMin: Cijk_Ailk_Bljk_SB_MT128x64x8_SE_DTL0_EPS1_FL0_GRVW4_LPB0_PGR1_PLR1_TT8_4_USFGRO0_VW4_WG16_16_1_WGM8
    SolutionIndex: 570
    SolutionNameMin: Cijk_Ailk_Bljk_SB_MT128x64x16_SE_DTL0_EPS1_FL0_GRVW4_LPB0_PGR1_PLR1_TT8_4_USFGRO0_VW4_WG16_16_1_WGM1
    SolutionIndex: 571
    SolutionNameMin: Cijk_Ailk_Bljk_SB_MT128x64x8_SE_DTL0_EPS1_FL1_GRVW4_LPB0_PGR1_PLR1_TT8_4_USFGRO0_VW4_WG16_16_1_WGM1
    SolutionIndex: 572
    SolutionNameMin: Cijk_Ailk_Bljk_SB_MT128x64x8_SE_DTL0_EPS1_FL1_GRVW4_LPB0_PGR1_PLR1_TT8_4_USFGRO0_VW4_WG16_16_1_WGM8
    SolutionIndex: 573
    SolutionNameMin: Cijk_Ailk_Bljk_SB_MT32x32x8_SE_DTL0_EPS0_FL0_GRVW1_LPB0_PGR0_PLR0_TT2_2_USFGRO1_VW2_WG16_16_1_WGM8
    SolutionIndex: 575
    SolutionNameMin: Cijk_Ailk_Bljk_SB_MT32x64x16_SE_DTL0_EPS1_FL1_GRVW4_LPB2_PGR1_PLR1_TT2_4_USFGRO0_VW2_WG16_16_1_WGM8
    SolutionIndex: 576
    SolutionNameMin: Cijk_Ailk_Bljk_SB_MT64x64x16_SE_DTL0_EPS0_FL0_GRVW1_LPB2_PGR0_PLR1_TT4_4_USFGRO1_VW2_WG16_16_1_WGM1
    SolutionIndex: 577
    SolutionNameMin: Cijk_Ailk_Bljk_SB_MT64x64x16_SE_DTL0_EPS0_FL0_GRVW1_LPB4_PGR0_PLR1_TT4_4_USFGRO1_VW4_WG16_16_1_WGM1
    SolutionIndex: 578
    SolutionNameMin: Cijk_Ailk_Bljk_SB_MT64x64x32_SE_DTL0_EPS0_FL0_GRVW4_LPB4_PGR0_PLR1_TT4_4_USFGRO0_VW4_WG16_16_1_WGM8
    SolutionIndex: 579
    SolutionNameMin: Cijk_Ailk_Bljk_SB_MT64x64x16_SE_DTL0_EPS0_FL1_GRVW4_LPB4_PGR0_PLR1_TT4_4_USFGRO0_VW4_WG16_16_1_WGM1
    SolutionIndex: 581
    SolutionNameMin: Cijk_Ailk_Bljk_SB_MT64x32x16_SE_DTL0_EPS1_FL0_GRVW4_LPB4_PGR1_PLR1_TT4_4_USFGRO0_VW4_WG16_8_2_WGM1
    SolutionIndex: 582
    SolutionNameMin: Cijk_Ailk_Bljk_SB_MT64x32x16_SE_DTL0_EPS1_FL1_GRVW4_LPB4_PGR1_PLR1_TT4_4_USFGRO0_VW4_WG16_8_2_WGM8
    SolutionIndex: 583
    SolutionNameMin: Cijk_Ailk_Bljk_SB_MT8x32x32_SE_DTL0_EPS1_FL0_GRVW4_LPB2_PGR1_PLR1_TT2_2_USFGRO1_VW2_WG4_16_4_WGM1
    SolutionIndex: 584
    SolutionNameMin: Cijk_Ailk_Bljk_SB_MT32x8x32_SE_DTL0_EPS1_FL0_GRVW1_LPB2_PGR1_PLR1_TT2_2_USFGRO1_VW2_WG16_4_4_WGM1
    SolutionIndex: 585
    SolutionNameMin: Cijk_Ailk_Bljk_SB_MT32x16x32_SE_DTL0_EPS1_FL1_GRVW2_LPB2_PGR1_PLR1_TT2_4_USFGRO0_VW2_WG16_4_4_WGM1
    SolutionIndex: 586
    SolutionNameMin: Cijk_Ailk_Bljk_SB_MT64x16x32_SE_DTL0_EPS1_FL0_GRVW4_LPB4_PGR1_PLR1_TT4_4_USFGRO0_VW4_WG16_4_4_WGM1
    SolutionIndex: 587
    SolutionNameMin: Cijk_Ailk_Bljk_SB_MT64x64x8_SE_AMAS1_EPS0_FL0_GRVW1_GSU1_LPB0_PGR0_PLR0_TT4_4_USFGRO1_VW1_WG16_16_1_WGM8
    SolutionIndex: 588
    SolutionNameMin: Cijk_Ailk_Bljk_SB_MT64x64x8_SE_AMAS3_EPS1_FL1_GRVW4_GSU1_LPB0_PGR1_PLR1_TT4_4_USFGRO0_VW2_WG16_16_1_WGM8
    SolutionIndex: 589
    SolutionNameMin: Cijk_Ailk_Bljk_SB_MT128x64x8_SE_AMAS1_EPS1_FL0_GRVW1_GSU1_LPB0_PGR1_PLR1_TT8_4_USFGRO1_VW1_WG16_16_1_WGM8
    SolutionIndex: 590
    SolutionNameMin: Cijk_Ailk_Bljk_SB_MT128x64x8_SE_AMAS3_EPS1_FL0_GRVW2_GSU1_LPB0_PGR1_PLR1_TT8_4_USFGRO0_VW2_WG16_16_1_WGM1
    SolutionIndex: 591
    SolutionNameMin: Cijk_Ailk_Bljk_SB_MT32x32x8_SE_AMAS1_EPS0_FL0_GRVW1_GSU1_LPB0_PGR0_PLR0_TT2_2_USFGRO1_VW1_WG16_16_1_WGM8
    SolutionIndex: 593
    SolutionNameMin: Cijk_Ailk_Bljk_SB_MT32x32x8_SE_AMAS1_EPS0_FL0_GRVW1_GSU1_LPB1_PGR0_PLR0_TT2_2_USFGRO1_VW1_WG16_16_1_WGM8
    SolutionIndex: 595
    SolutionNameMin: Cijk_Ailk_Bljk_SB_MT32x64x8_SE_AMAS1_EPS1_FL0_GRVW1_GSU1_LPB0_PGR1_PLR0_TT2_4_USFGRO1_VW1_WG16_16_1_WGM1
    SolutionIndex: 598
    SolutionNameMin: Cijk_Ailk_Bljk_SB_MT16x32x16_SE_AMAS1_EPS0_FL0_GRVW2_GSU1_LPB0_PGR0_PLR1_TT4_2_USFGRO1_VW1_WG4_16_4_WGM1
    SolutionIndex: 599
    SolutionNameMin: Cijk_Ailk_Bljk_SB_MT64x16x32_SE_AMAS3_EPS1_FL1_GRVW4_GSU1_LPB4_PGR1_PLR1_TT4_4_USFGRO0_VW4_WG16_4_4_WGM1
    SolutionIndex: 600
    SolutionNameMin: Cijk_Ailk_Bljk_SB_MT64x64x16_SE_EPS1_FL0_GRVW4_GSU1_LPB0_PGR1_PLR1_TT4_4_USFGRO0_VW4_WG16_16_1_WGM1
    SolutionIndex: 601
    SolutionNameMin: Cijk_Ailk_Bljk_SB_MT64x64x16_SE_EPS1_FL0_GRVW4_GSU1_LPB0_PGR1_PLR1_TT4_4_USFGRO0_VW4_WG16_16_1_WGM8
    SolutionIndex: 602
    SolutionNameMin: Cijk_Ailk_Bljk_SB_MT64x64x32_SE_EPS1_FL0_GRVW4_GSU1_LPB0_PGR1_PLR1_TT4_4_USFGRO0_VW4_WG16_16_1_WGM8
    SolutionIndex: 603
    SolutionNameMin: Cijk_Ailk_Bljk_SB_MT64x64x16_SE_EPS1_FL1_GRVW4_GSU1_LPB0_PGR1_PLR1_TT4_4_USFGRO0_VW4_WG16_16_1_WGM1
    SolutionIndex: 604
    SolutionNameMin: Cijk_Ailk_Bljk_SB_MT64x64x16_SE_EPS1_FL1_GRVW4_GSU1_LPB0_PGR1_PLR1_TT4_4_USFGRO0_VW4_WG16_16_1_WGM8
    SolutionIndex: 605
    SolutionNameMin: Cijk_Ailk_Bljk_SB_MT64x96x8_SE_EPS1_FL1_GRVW4_GSU1_LPB0_PGR1_PLR0_TT4_6_USFGRO0_VW2_WG16_16_1_WGM8
    SolutionIndex: 606
    SolutionNameMin: Cijk_Ailk_Bljk_SB_MT64x96x8_SE_EPS1_FL1_GRVW4_GSU1_LPB0_PGR1_PLR1_TT4_6_USFGRO0_VW2_WG16_16_1_WGM1
    SolutionIndex: 607
    SolutionNameMin: Cijk_Ailk_Bljk_SB_MT64x96x8_SE_EPS1_FL1_GRVW4_GSU1_LPB0_PGR1_PLR1_TT4_6_USFGRO0_VW2_WG16_16_1_WGM8
    SolutionIndex: 608
    SolutionNameMin: Cijk_Ailk_Bljk_SB_MT128x64x8_SE_EPS1_FL0_GRVW4_GSU1_LPB0_PGR1_PLR0_TT8_4_USFGRO0_VW4_WG16_16_1_WGM1
    SolutionIndex: 609
    SolutionNameMin: Cijk_Ailk_Bljk_SB_MT128x64x8_SE_EPS1_FL0_GRVW4_GSU1_LPB0_PGR1_PLR0_TT8_4_USFGRO0_VW4_WG16_16_1_WGM8
    SolutionIndex: 610
    SolutionNameMin: Cijk_Ailk_Bljk_SB_MT128x64x8_SE_EPS1_FL0_GRVW4_GSU1_LPB0_PGR1_PLR1_TT8_4_USFGRO0_VW4_WG16_16_1_WGM1
    SolutionIndex: 611
    SolutionNameMin: Cijk_Ailk_Bljk_SB_MT128x64x8_SE_EPS1_FL0_GRVW4_GSU1_LPB0_PGR1_PLR1_TT8_4_USFGRO0_VW4_WG16_16_1_WGM8
    SolutionIndex: 612
    SolutionNameMin: Cijk_Ailk_Bljk_SB_MT128x64x16_SE_EPS1_FL0_GRVW4_GSU1_LPB0_PGR1_PLR1_TT8_4_USFGRO0_VW4_WG16_16_1_WGM1
    SolutionIndex: 613
    SolutionNameMin: Cijk_Ailk_Bljk_SB_MT128x64x8_SE_EPS1_FL1_GRVW2_GSU1_LPB0_PGR1_PLR1_TT8_4_USFGRO0_VW2_WG16_16_1_WGM8
    SolutionIndex: 614
    SolutionNameMin: Cijk_Ailk_Bljk_SB_MT128x64x8_SE_EPS1_FL1_GRVW4_GSU1_LPB0_PGR1_PLR0_TT8_4_USFGRO0_VW4_WG16_16_1_WGM1
    SolutionIndex: 615
    SolutionNameMin: Cijk_Ailk_Bljk_SB_MT128x64x8_SE_EPS1_FL1_GRVW4_GSU1_LPB0_PGR1_PLR0_TT8_4_USFGRO0_VW4_WG16_16_1_WGM8
    SolutionIndex: 616
    SolutionNameMin: Cijk_Ailk_Bljk_SB_MT128x64x8_SE_EPS1_FL1_GRVW4_GSU1_LPB0_PGR1_PLR1_TT8_4_USFGRO0_VW4_WG16_16_1_WGM1
    SolutionIndex: 617
    SolutionNameMin: Cijk_Ailk_Bljk_SB_MT128x64x8_SE_EPS1_FL1_GRVW4_GSU1_LPB0_PGR1_PLR1_TT8_4_USFGRO0_VW4_WG16_16_1_WGM8
    SolutionIndex: 618
    SolutionNameMin: Cijk_Ailk_Bljk_SB_MT64x16x16_SE_EPS1_FL0_GRVW4_GSU1_LPB4_PGR1_PLR1_TT4_4_USFGRO0_VW4_WG16_4_4_WGM1
    SolutionIndex: 619
    SolutionNameMin: Cijk_Ailk_Bljk_SB_MT64x16x32_SE_EPS1_FL0_GRVW4_GSU1_LPB4_PGR1_PLR1_TT4_4_USFGRO0_VW4_WG16_4_4_WGM8
    SolutionIndex: 620
    SolutionNameMin: Cijk_Ailk_Bljk_SB_MT64x16x32_SE_EPS1_FL1_GRVW4_GSU1_LPB4_PGR1_PLR1_TT4_4_USFGRO0_VW4_WG16_4_4_WGM8
    SolutionIndex: 621
    SolutionNameMin: Cijk_Ailk_Bljk_SB_MT64x64x8_SE_EPS1_FL0_GRVW1_GSU1_LPB4_PGR1_PLR1_TT4_4_USFGRO1_VW4_WG16_16_1_WGM1
    SolutionIndex: 622
    SolutionNameMin: Cijk_Ailk_Bljk_SB_MT64x64x8_SE_EPS1_FL0_GRVW1_GSU1_LPB4_PGR1_PLR1_TT4_4_USFGRO1_VW4_WG16_16_1_WGM8
    SolutionIndex: 623
    SolutionNameMin: Cijk_Ailk_Bljk_SB_MT64x64x16_SE_EPS0_FL0_GRVW1_GSU1_LPB4_PGR0_PLR1_TT4_4_USFGRO1_VW4_WG16_16_1_WGM8
    SolutionIndex: 624
    SolutionNameMin: Cijk_Ailk_Bljk_SB_MT64x64x16_SE_EPS1_FL0_GRVW4_GSU1_LPB0_PGR1_PLR1_TT4_4_USFGRO0_VW4_WG16_16_1_WGM1
    SolutionIndex: 625
    SolutionNameMin: Cijk_Ailk_Bljk_SB_MT64x64x16_SE_EPS1_FL0_GRVW4_GSU1_LPB0_PGR1_PLR1_TT4_4_USFGRO0_VW4_WG16_16_1_WGM8
    SolutionIndex: 626
    SolutionNameMin: Cijk_Ailk_Bljk_SB_MT64x64x16_SE_EPS0_FL0_GRVW4_GSU1_LPB4_PGR0_PLR1_TT4_4_USFGRO0_VW4_WG16_16_1_WGM1
    SolutionIndex: 627
    SolutionNameMin: Cijk_Ailk_Bljk_SB_MT64x64x16_SE_EPS1_FL0_GRVW4_GSU1_LPB4_PGR1_PLR1_TT4_4_USFGRO0_VW4_WG16_16_1_WGM8
    SolutionIndex: 629
    SolutionNameMin: Cijk_Ailk_Bljk_SB_MT64x64x16_SE_EPS1_FL1_GRVW4_GSU1_LPB0_PGR1_PLR1_TT4_4_USFGRO0_VW4_WG16_16_1_WGM1
    SolutionIndex: 630
    SolutionNameMin: Cijk_Ailk_Bljk_SB_MT64x64x16_SE_EPS1_FL1_GRVW4_GSU1_LPB0_PGR1_PLR1_TT4_4_USFGRO0_VW4_WG16_16_1_WGM8
    SolutionIndex: 634
    SolutionNameMin: Cijk_Ailk_Bljk_SB_MT64x128x8_SE_EPS1_FL0_GRVW4_GSU1_LPB0_PGR1_PLR1_TT4_8_USFGRO0_VW2_WG16_16_1_WGM1
    SolutionIndex: 635
    SolutionNameMin: Cijk_Ailk_Bljk_SB_MT128x64x8_SE_EPS1_FL0_GRVW2_GSU1_LPB0_PGR1_PLR1_TT8_4_USFGRO0_VW2_WG16_16_1_WGM1
    SolutionIndex: 637
    SolutionNameMin: Cijk_Ailk_Bljk_SB_MT128x64x8_SE_EPS1_FL0_GRVW4_GSU1_LPB0_PGR1_PLR0_TT8_4_USFGRO0_VW4_WG16_16_1_WGM1
    SolutionIndex: 638
    SolutionNameMin: Cijk_Ailk_Bljk_SB_MT128x64x8_SE_EPS1_FL0_GRVW4_GSU1_LPB0_PGR1_PLR1_TT8_4_USFGRO0_VW4_WG16_16_1_WGM1
    SolutionIndex: 639
    SolutionNameMin: Cijk_Ailk_Bljk_SB_MT128x64x8_SE_EPS1_FL0_GRVW4_GSU1_LPB0_PGR1_PLR1_TT8_4_USFGRO0_VW4_WG16_16_1_WGM8
    SolutionIndex: 640
    SolutionNameMin: Cijk_Ailk_Bljk_SB_MT128x64x8_SE_EPS1_FL0_GRVW4_GSU1_LPB4_PGR1_PLR0_TT8_4_USFGRO0_VW4_WG16_16_1_WGM1
    SolutionIndex: 641
    SolutionNameMin: Cijk_Ailk_Bljk_SB_MT128x64x8_SE_EPS1_FL0_GRVW4_GSU1_LPB4_PGR1_PLR1_TT8_4_USFGRO0_VW4_WG16_16_1_WGM1
    SolutionIndex: 643
    SolutionNameMin: Cijk_Ailk_Bljk_SB_MT128x64x8_SE_EPS1_FL1_GRVW2_GSU1_LPB0_PGR1_PLR1_TT8_4_USFGRO0_VW2_WG16_16_1_WGM1
    SolutionIndex: 644
    SolutionNameMin: Cijk_Ailk_Bljk_SB_MT128x64x8_SE_EPS1_FL1_GRVW2_GSU1_LPB0_PGR1_PLR1_TT8_4_USFGRO0_VW2_WG16_16_1_WGM8
    SolutionIndex: 645
    SolutionNameMin: Cijk_Ailk_Bljk_SB_MT128x64x8_SE_EPS1_FL1_GRVW4_GSU1_LPB0_PGR1_PLR1_TT8_4_USFGRO0_VW4_WG16_16_1_WGM1
    SolutionIndex: 646
    SolutionNameMin: Cijk_Ailk_Bljk_SB_MT128x64x8_SE_EPS1_FL1_GRVW4_GSU1_LPB0_PGR1_PLR1_TT8_4_USFGRO0_VW4_WG16_16_1_WGM8
    SolutionIndex: 648
    SolutionNameMin: Cijk_Ailk_Bljk_SB_MT128x128x8_SE_EPS1_FL0_GRVW1_GSU1_LPB0_PGR1_PLR1_TT8_8_USFGRO1_VW4_WG16_16_1_WGM8
    SolutionIndex: 649
    SolutionNameMin: Cijk_Ailk_Bljk_SB_MT128x128x8_SE_EPS1_FL0_GRVW2_GSU1_LPB0_PGR1_PLR1_TT8_8_USFGRO0_VW2_WG16_16_1_WGM8
    SolutionIndex: 650
    SolutionNameMin: Cijk_Ailk_Bljk_SB_MT128x128x8_SE_EPS1_FL1_GRVW2_GSU1_LPB0_PGR1_PLR0_TT8_8_USFGRO0_VW2_WG16_16_1_WGM1
    SolutionIndex: 651
    SolutionNameMin: Cijk_Ailk_Bljk_SB_MT128x128x8_SE_EPS1_FL1_GRVW4_GSU1_LPB0_PGR1_PLR1_TT8_8_USFGRO0_VW4_WG16_16_1_WGM8
    SolutionIndex: 652
    SolutionNameMin: Cijk_Ailk_Bljk_SB_MT64x32x8_SE_EPS1_FL0_GRVW4_GSU1_LPB4_PGR1_PLR0_TT4_4_USFGRO0_VW4_WG16_8_1_WGM8
    SolutionIndex: 653
    SolutionNameMin: Cijk_Ailk_Bljk_SB_MT64x32x8_SE_EPS1_FL1_GRVW4_GSU1_LPB4_PGR1_PLR0_TT4_4_USFGRO0_VW4_WG16_8_1_WGM1
    SolutionIndex: 654
    SolutionNameMin: Cijk_Ailk_Bljk_SB_MT64x32x8_SE_EPS0_FL1_GRVW4_GSU1_LPB4_PGR0_PLR1_TT4_4_USFGRO0_VW4_WG16_8_1_WGM1
    SolutionIndex: 655
    SolutionNameMin: Cijk_Ailk_Bljk_SB_MT64x16x8_SE_EPS1_FL0_GRVW2_GSU1_LPB2_PGR1_PLR1_TT4_2_USFGRO0_VW2_WG16_8_1_WGM1
    SolutionIndex: 656
    SolutionNameMin: Cijk_Ailk_Bljk_SB_MT64x64x8_SE_EPS1_FL0_GRVW4_GSU1_LPB0_PGR1_PLR0_TT4_8_USFGRO0_VW4_WG16_8_1_WGM8
    SolutionIndex: 657
    SolutionNameMin: Cijk_Ailk_Bljk_SB_MT64x64x8_SE_EPS1_FL1_GRVW2_GSU1_LPB0_PGR1_PLR0_TT4_8_USFGRO0_VW2_WG16_8_1_WGM8
    SolutionIndex: 659
    SolutionNameMin: Cijk_Ailk_Bljk_SB_MT128x32x8_SE_EPS0_FL0_GRVW1_GSU1_LPB4_PGR0_PLR1_TT8_4_USFGRO1_VW4_WG16_8_1_WGM1
    SolutionIndex: 662
    SolutionNameMin: Cijk_Ailk_Bljk_SB_MT96x64x16_SE_EPS1_FL0_GRVW2_GSU1_LPB0_PGR1_PLR1_TT6_4_USFGRO0_VW2_WG16_16_1_WGM1
    SolutionIndex: 663
    SolutionNameMin: Cijk_Ailk_Bljk_SB_MT96x64x8_SE_EPS1_FL1_GRVW2_GSU1_LPB0_PGR1_PLR1_TT6_4_USFGRO0_VW2_WG16_16_1_WGM1
    SolutionIndex: 664
    SolutionNameMin: Cijk_Ailk_Bljk_SB_MT96x64x8_SE_EPS1_FL1_GRVW2_GSU1_LPB0_PGR1_PLR1_TT6_4_USFGRO0_VW2_WG16_16_1_WGM8
    SolutionIndex: 665
    SolutionNameMin: Cijk_Ailk_Bljk_SB_MT64x96x8_SE_EPS1_FL1_GRVW2_GSU1_LPB0_PGR1_PLR1_TT4_6_USFGRO0_VW2_WG16_16_1_WGM8
    SolutionIndex: 667
    SolutionNameMin: Cijk_Ailk_Bljk_SB_MT64x32x16_SE_EPS1_FL0_GRVW4_GSU1_LPB4_PGR1_PLR1_TT4_4_USFGRO0_VW4_WG16_8_2_WGM1
    SolutionIndex: 668
    SolutionNameMin: Cijk_Ailk_Bljk_SB_MT64x32x16_SE_EPS1_FL1_GRVW4_GSU1_LPB4_PGR1_PLR1_TT4_4_USFGRO0_VW4_WG16_8_2_WGM1
    SolutionIndex: 669
    SolutionNameMin: Cijk_Ailk_Bljk_SB_MT8x32x32_SE_EPS1_FL0_GRVW1_GSU1_LPB2_PGR1_PLR1_TT2_2_USFGRO1_VW2_WG4_16_4_WGM1
    SolutionIndex: 671
    SolutionNameMin: Cijk_Ailk_Bljk_SB_MT8x32x32_SE_EPS1_FL0_GRVW4_GSU1_LPB2_PGR1_PLR1_TT2_2_USFGRO1_VW2_WG4_16_4_WGM1
    SolutionIndex: 672
    SolutionNameMin: Cijk_Ailk_Bljk_SB_MT8x32x32_SE_EPS1_FL0_GRVW4_GSU1_LPB2_PGR1_PLR1_TT2_2_USFGRO1_VW2_WG4_16_4_WGM8
    SolutionIndex: 673
    SolutionNameMin: Cijk_Ailk_Bljk_SB_MT16x32x32_SE_EPS1_FL0_GRVW1_GSU1_LPB2_PGR1_PLR1_TT4_2_USFGRO1_VW2_WG4_16_4_WGM1
    SolutionIndex: 675
    SolutionNameMin: Cijk_Ailk_Bljk_SB_MT16x32x32_SE_EPS1_FL1_GRVW4_GSU1_LPB2_PGR1_PLR1_TT4_2_USFGRO0_VW2_WG4_16_4_WGM1
    SolutionIndex: 676
    SolutionNameMin: Cijk_Ailk_Bljk_SB_MT16x64x16_SE_EPS1_FL0_GRVW2_GSU8_LPB2_PGR1_PLR1_TT4_4_USFGRO1_VW2_WG4_16_4_WGM1
    SolutionIndex: 677
    SolutionNameMin: Cijk_Ailk_Bljk_SB_MT32x8x32_SE_EPS1_FL0_GRVW2_GSU1_LPB2_PGR1_PLR1_TT2_2_USFGRO0_VW2_WG16_4_4_WGM1
    SolutionIndex: 678
    SolutionNameMin: Cijk_Ailk_Bljk_SB_MT32x8x32_SE_EPS1_FL0_GRVW2_GSU1_LPB2_PGR1_PLR1_TT2_2_USFGRO0_VW2_WG16_4_4_WGM8
    SolutionIndex: 679
    SolutionNameMin: Cijk_Ailk_Bljk_SB_MT32x8x32_SE_EPS1_FL1_GRVW2_GSU1_LPB2_PGR1_PLR1_TT2_2_USFGRO0_VW2_WG16_4_4_WGM1
    SolutionIndex: 680
    SolutionNameMin: Cijk_Ailk_Bljk_SB_MT32x16x32_SE_EPS1_FL0_GRVW2_GSU1_LPB2_PGR1_PLR1_TT2_4_USFGRO0_VW2_WG16_4_4_WGM1
    SolutionIndex: 681
    SolutionNameMin: Cijk_Ailk_Bljk_SB_MT32x16x32_SE_EPS1_FL1_GRVW2_GSU1_LPB2_PGR1_PLR1_TT2_4_USFGRO0_VW2_WG16_4_4_WGM1
    SolutionIndex: 682
    SolutionNameMin: Cijk_Ailk_Bljk_SB_MT64x16x16_SE_EPS1_FL0_GRVW1_GSU1_LPB2_PGR1_PLR1_TT4_4_USFGRO1_VW2_WG16_4_4_WGM8
    SolutionIndex: 683
    SolutionNameMin: Cijk_Ailk_Bljk_SB_MT64x16x16_SE_EPS1_FL0_GRVW4_GSU1_LPB4_PGR1_PLR1_TT4_4_USFGRO0_VW4_WG16_4_4_WGM8
    SolutionIndex: 684
    SolutionNameMin: Cijk_Ailk_Bljk_SB_MT64x16x32_SE_EPS1_FL0_GRVW4_GSU1_LPB4_PGR1_PLR1_TT4_4_USFGRO0_VW4_WG16_4_4_WGM1
    SolutionIndex: 685
    SolutionNameMin: Cijk_Ailk_Bljk_SB_MT64x16x32_SE_EPS1_FL1_GRVW4_GSU1_LPB4_PGR1_PLR1_TT4_4_USFGRO0_VW4_WG16_4_4_WGM1
    SolutionIndex: 686
    SolutionNameMin: Cijk_Ailk_Bljk_SB_MT64x16x32_SE_EPS1_FL1_GRVW4_GSU1_LPB4_PGR1_PLR1_TT4_4_USFGRO0_VW4_WG16_4_4_WGM8
    SolutionIndex: 687
    SolutionNameMin: Cijk_Ailk_Bljk_SB_MT32x16x32_SE_EPS1_FL1_GRVW2_NLCA1_PGR1_PLR1_TT2_4_USFGRO0_VW2_WGM1
    SolutionIndex: 688
    SolutionNameMin: Cijk_Ailk_Bljk_SB_MT32x16x32_SE_EPS1_FL1_GRVW2_NLCA1_PGR1_PLR1_TT2_4_USFGRO0_VW2_WGM8
    SolutionIndex: 689
    SolutionNameMin: Cijk_Ailk_Bljk_SB_MT64x16x32_SE_EPS1_FL1_GRVW4_NLCA1_PGR1_PLR1_TT4_4_USFGRO0_VW4_WGM8
    SolutionIndex: 690
    SolutionNameMin: Cijk_Ailk_Bljk_SB_MT128x64x8_SE_EPS1_FL0_GRVW4_NLCA1_PGR1_PLR0_TT8_4_USFGRO0_VW4_WGM8
    SolutionIndex: 691
    SolutionNameMin: Cijk_Ailk_Bljk_SB_MT128x64x8_SE_EPS1_FL0_GRVW4_NLCA1_PGR1_PLR1_TT8_4_USFGRO0_VW4_WGM1
    SolutionIndex: 692
    SolutionNameMin: Cijk_Ailk_Bljk_SB_MT128x64x16_SE_EPS1_FL0_GRVW4_NLCA1_PGR1_PLR1_TT8_4_USFGRO0_VW4_WGM1
    SolutionIndex: 693
    SolutionNameMin: Cijk_Ailk_Bljk_SB_MT128x64x8_SE_EPS1_FL1_GRVW4_NLCA1_PGR1_PLR0_TT8_4_USFGRO0_VW4_WGM8
    SolutionIndex: 694
    SolutionNameMin: Cijk_Ailk_Bljk_SB_MT128x64x8_SE_EPS1_FL1_GRVW4_NLCA1_PGR1_PLR1_TT8_4_USFGRO0_VW4_WGM8
    SolutionIndex: 695
    SolutionNameMin: Cijk_Ailk_Bljk_SB_MT64x64x16_SE_EPS1_FL1_GRVW4_NLCA1_PGR1_PLR1_TT4_4_USFGRO0_VW4_WGM1
    SolutionIndex: 696
    SolutionNameMin: Cijk_Ailk_Bljk_SB_MT128x64x8_SE_EPS1_FL1_GRVW2_NLCA1_PGR1_PLR0_TT8_4_USFGRO0_VW2_WGM8
    SolutionIndex: 697
    SolutionNameMin: Cijk_Ailk_Bljk_SB_MT128x64x8_SE_EPS1_FL1_GRVW4_NLCA1_PGR1_PLR1_TT8_4_USFGRO0_VW4_WGM1
    SolutionIndex: 722
    SolutionNameMin: Cijk_Ailk_Bljk_SB_MT128x64x16_SE_EPS1_FL0_GRVW4_GSU1_LPB0_PGR1_PLR1_TT8_4_USFGRO0_VW4_WG16_16_1_WGM1
    SolutionIndex: 723
    SolutionNameMin: Cijk_Ailk_Bljk_SB_MT128x64x16_SE_EPS1_FL1_GRVW4_GSU1_LPB0_PGR1_PLR1_TT8_4_USFGRO0_VW4_WG16_16_1_WGM8
    SolutionIndex: 724
    SolutionNameMin: Cijk_Ailk_Bljk_SB_MT16x32x32_SE_EPS1_FL1_GRVW4_GSU1_LPB2_PGR1_PLR1_TT4_2_USFGRO0_VW2_WG4_16_4_WGM8
    SolutionIndex: 725
    SolutionNameMin: Cijk_Ailk_Bljk_SB_MT64x64x8_SE_DTL0_EPS1_FL0_GRVW2_LPB0_PGR1_PLR1_TT4_4_USFGRO0_VW2_WG16_16_1_WGM8
    SolutionIndex: 726
    SolutionNameMin: Cijk_Ailk_Bljk_SB_MT64x64x16_SE_DTL0_EPS1_FL0_GRVW4_LPB0_PGR1_PLR1_TT4_4_USFGRO0_VW4_WG16_16_1_WGM1
    SolutionIndex: 727
    SolutionNameMin: Cijk_Ailk_Bljk_SB_MT64x64x16_SE_DTL0_EPS1_FL0_GRVW4_LPB0_PGR1_PLR1_TT4_4_USFGRO0_VW4_WG16_16_1_WGM8
    SolutionIndex: 728
    SolutionNameMin: Cijk_Ailk_Bljk_SB_MT64x64x8_SE_DTL0_EPS1_FL1_GRVW2_LPB0_PGR1_PLR1_TT4_4_USFGRO0_VW2_WG16_16_1_WGM8
    SolutionIndex: 729
    SolutionNameMin: Cijk_Ailk_Bljk_SB_MT64x64x16_SE_DTL0_EPS1_FL1_GRVW4_LPB0_PGR1_PLR1_TT4_4_USFGRO0_VW4_WG16_16_1_WGM1
    SolutionIndex: 730
    SolutionNameMin: Cijk_Ailk_Bljk_SB_MT64x64x16_SE_DTL0_EPS1_FL1_GRVW4_LPB0_PGR1_PLR1_TT4_4_USFGRO0_VW4_WG16_16_1_WGM8
    SolutionIndex: 731
    SolutionNameMin: Cijk_Ailk_Bljk_SB_MT64x64x32_SE_DTL0_EPS1_FL1_GRVW4_LPB0_PGR1_PLR1_TT4_4_USFGRO0_VW4_WG16_16_1_WGM8
    SolutionIndex: 732
    SolutionNameMin: Cijk_Ailk_Bljk_SB_MT96x64x16_SE_DTL0_EPS1_FL0_GRVW2_LPB0_PGR1_PLR1_TT6_4_USFGRO0_VW2_WG16_16_1_WGM1
    SolutionIndex: 733
    SolutionNameMin: Cijk_Ailk_Bljk_SB_MT96x64x8_SE_DTL0_EPS1_FL1_GRVW2_LPB0_PGR1_PLR1_TT6_4_USFGRO0_VW2_WG16_16_1_WGM1
    SolutionIndex: 735
    SolutionNameMin: Cijk_Ailk_Bljk_SB_MT96x64x16_SE_DTL0_EPS1_FL1_GRVW2_LPB0_PGR1_PLR1_TT6_4_USFGRO0_VW2_WG16_16_1_WGM1
    SolutionIndex: 736
    SolutionNameMin: Cijk_Ailk_Bljk_SB_MT96x64x16_SE_DTL0_EPS1_FL1_GRVW2_LPB0_PGR1_PLR1_TT6_4_USFGRO0_VW2_WG16_16_1_WGM8
    SolutionIndex: 738
    SolutionNameMin: Cijk_Ailk_Bljk_SB_MT64x96x8_SE_DTL0_EPS1_FL1_GRVW4_LPB0_PGR1_PLR0_TT4_6_USFGRO0_VW2_WG16_16_1_WGM8
    SolutionIndex: 739
    SolutionNameMin: Cijk_Ailk_Bljk_SB_MT64x96x8_SE_DTL0_EPS1_FL1_GRVW4_LPB0_PGR1_PLR1_TT4_6_USFGRO0_VW2_WG16_16_1_WGM1
    SolutionIndex: 740
    SolutionNameMin: Cijk_Ailk_Bljk_SB_MT64x96x8_SE_DTL0_EPS1_FL1_GRVW4_LPB0_PGR1_PLR1_TT4_6_USFGRO0_VW2_WG16_16_1_WGM8
    SolutionIndex: 744
    SolutionNameMin: Cijk_Ailk_Bljk_SB_MT128x64x8_SE_DTL0_EPS1_FL1_GRVW2_LPB0_PGR1_PLR0_TT8_4_USFGRO0_VW2_WG16_16_1_WGM1
    SolutionIndex: 746
    SolutionNameMin: Cijk_Ailk_Bljk_SB_MT128x64x8_SE_DTL0_EPS1_FL1_GRVW4_LPB0_PGR1_PLR0_TT8_4_USFGRO0_VW4_WG16_16_1_WGM8
    SolutionIndex: 747
    SolutionNameMin: Cijk_Ailk_Bljk_SB_MT128x64x8_SE_DTL0_EPS1_FL0_GRVW1_LPB0_PGR1_PLR1_TT8_4_USFGRO1_VW4_WG16_16_1_WGM8
    SolutionIndex: 748
    SolutionNameMin: Cijk_Ailk_Bljk_SB_MT128x64x8_SE_DTL0_EPS1_FL0_GRVW2_LPB0_PGR1_PLR1_TT8_4_USFGRO0_VW2_WG16_16_1_WGM1
    SolutionIndex: 750
    SolutionNameMin: Cijk_Ailk_Bljk_SB_MT128x64x8_SE_DTL0_EPS1_FL0_GRVW4_LPB0_PGR1_PLR1_TT8_4_USFGRO0_VW4_WG16_16_1_WGM1
    SolutionIndex: 752
    SolutionNameMin: Cijk_Ailk_Bljk_SB_MT128x64x16_SE_DTL0_EPS1_FL0_GRVW4_LPB0_PGR1_PLR1_TT8_4_USFGRO0_VW4_WG16_16_1_WGM1
    SolutionIndex: 753
    SolutionNameMin: Cijk_Ailk_Bljk_SB_MT128x64x16_SE_DTL0_EPS1_FL0_GRVW4_LPB0_PGR1_PLR1_TT8_4_USFGRO0_VW4_WG16_16_1_WGM8
    SolutionIndex: 754
    SolutionNameMin: Cijk_Ailk_Bljk_SB_MT128x64x8_SE_DTL0_EPS1_FL1_GRVW2_LPB0_PGR1_PLR1_TT8_4_USFGRO0_VW2_WG16_16_1_WGM1
    SolutionIndex: 756
    SolutionNameMin: Cijk_Ailk_Bljk_SB_MT128x64x8_SE_DTL0_EPS1_FL1_GRVW4_LPB0_PGR1_PLR1_TT8_4_USFGRO0_VW4_WG16_16_1_WGM1
    SolutionIndex: 757
    SolutionNameMin: Cijk_Ailk_Bljk_SB_MT128x64x8_SE_DTL0_EPS1_FL1_GRVW4_LPB0_PGR1_PLR1_TT8_4_USFGRO0_VW4_WG16_16_1_WGM8
    SolutionIndex: 758
    SolutionNameMin: Cijk_Ailk_Bljk_SB_MT128x64x16_SE_DTL0_EPS1_FL1_GRVW4_LPB0_PGR1_PLR1_TT8_4_USFGRO0_VW4_WG16_16_1_WGM1
    SolutionIndex: 759
    SolutionNameMin: Cijk_Ailk_Bljk_SB_MT128x64x16_SE_DTL0_EPS1_FL1_GRVW4_LPB0_PGR1_PLR1_TT8_4_USFGRO0_VW4_WG16_16_1_WGM8
    SolutionIndex: 760
    SolutionNameMin: Cijk_Ailk_Bljk_SB_MT128x128x16_SE_DTL0_EPS1_FL0_GRVW4_LPB0_PGR1_PLR0_TT8_8_USFGRO0_VW4_WG16_16_1_WGM1
    SolutionIndex: 762
    SolutionNameMin: Cijk_Ailk_Bljk_SB_MT128x128x16_SE_DTL0_EPS1_FL1_GRVW4_LPB0_PGR1_PLR0_TT8_8_USFGRO0_VW4_WG16_16_1_WGM1
    SolutionIndex: 763
    SolutionNameMin: Cijk_Ailk_Bljk_SB_MT128x128x16_SE_DTL0_EPS1_FL1_GRVW4_LPB0_PGR1_PLR0_TT8_8_USFGRO0_VW4_WG16_16_1_WGM8
    SolutionIndex: 765
    SolutionNameMin: Cijk_Ailk_Bljk_SB_MT128x128x8_SE_DTL0_EPS1_FL0_GRVW1_LPB0_PGR1_PLR1_TT8_8_USFGRO1_VW4_WG16_16_1_WGM8
    SolutionIndex: 767
    SolutionNameMin: Cijk_Ailk_Bljk_SB_MT128x128x16_SE_DTL0_EPS1_FL0_GRVW4_LPB0_PGR1_PLR1_TT8_8_USFGRO0_VW4_WG16_16_1_WGM8
    SolutionIndex: 772
    SolutionNameMin: Cijk_Ailk_Bljk_SB_MT64x32x8_SE_DTL0_EPS0_FL0_GRVW1_LPB2_PGR0_PLR1_TT4_2_USFGRO1_VW2_WG16_16_1_WGM8
    SolutionIndex: 773
    SolutionNameMin: Cijk_Ailk_Bljk_SB_MT64x32x16_SE_DTL0_EPS0_FL0_GRVW1_LPB2_PGR0_PLR1_TT4_2_USFGRO1_VW2_WG16_16_1_WGM1
    SolutionIndex: 775
    SolutionNameMin: Cijk_Ailk_Bljk_SB_MT64x32x8_SE_DTL0_EPS1_FL0_GRVW1_LPB2_PGR1_PLR1_TT4_2_USFGRO1_VW2_WG16_16_1_WGM1
    SolutionIndex: 782
    SolutionNameMin: Cijk_Ailk_Bljk_SB_MT32x64x32_SE_DTL0_EPS1_FL1_GRVW2_LPB2_PGR1_PLR1_TT4_4_USFGRO0_VW2_WG8_16_2_WGM8
    SolutionIndex: 783
    SolutionNameMin: Cijk_Ailk_Bljk_SB_MT32x64x32_SE_DTL0_EPS1_FL1_GRVW4_LPB4_PGR1_PLR1_TT4_4_USFGRO0_VW4_WG8_16_2_WGM8
    SolutionIndex: 785
    SolutionNameMin: Cijk_Ailk_Bljk_SB_MT64x32x16_SE_DTL0_EPS1_FL0_GRVW4_LPB4_PGR1_PLR1_TT4_4_USFGRO0_VW4_WG16_8_2_WGM8
    SolutionIndex: 789
    SolutionNameMin: Cijk_Ailk_Bljk_SB_MT64x32x32_SE_DTL0_EPS1_FL1_GRVW4_LPB4_PGR1_PLR1_TT4_4_USFGRO0_VW4_WG16_8_2_WGM8
    SolutionIndex: 820
    SolutionNameMin: Cijk_Ailk_Bljk_SB_MT64x16x8_SE_DTL0_EPS0_FL0_GRVW1_LPB0_PGR0_PLR1_TT4_2_USFGRO1_VW2_WG16_8_1_WGM1
    SolutionIndex: 822
    SolutionNameMin: Cijk_Ailk_Bljk_SB_MT64x16x8_SE_DTL0_EPS0_FL0_GRVW2_LPB0_PGR0_PLR1_TT4_2_USFGRO0_VW2_WG16_8_1_WGM1
    SolutionIndex: 825
    SolutionNameMin: Cijk_Ailk_Bljk_SB_MT64x16x8_SE_DTL0_EPS0_FL0_GRVW1_LPB2_PGR0_PLR1_TT4_2_USFGRO1_VW2_WG16_8_1_WGM1
    SolutionIndex: 831
    SolutionNameMin: Cijk_Ailk_Bljk_SB_MT32x32x8_SE_DTL0_EPS0_FL0_GRVW1_LPB0_PGR0_PLR1_TT2_4_USFGRO1_VW2_WG16_8_1_WGM1
    SolutionIndex: 836
    SolutionNameMin: Cijk_Ailk_Bljk_SB_MT32x32x16_SE_DTL0_EPS0_FL0_GRVW1_LPB2_PGR0_PLR1_TT4_2_USFGRO1_VW2_WG8_16_1_WGM1
- - - [704, 1024, 1, 128]
    - [102, 3019.46]
  - - [1024, 1024, 1, 3328]
    - [140, 8162.55]
  - - [4, 704, 1, 1280]
    - [43, 319.546]
  - - [4, 1856, 1, 3328]
    - [73, 550.514]
  - - [1856, 448, 1, 3328]
    - [125, 6813.05]
  - - [2944, 4288, 1, 1280]
    - [134, 8975.76]
  - - [2368, 64, 1, 3328]
    - [48, 5482.23]
  - - [1760, 32, 1, 1760]
    - [87, 3859.94]
  - - [2368, 5888, 1, 256]
    - [131, 8656.73]
  - - [5888, 1856, 1, 256]
    - [121, 7881.43]
  - - [64, 3584, 1, 1280]
    - [57, 4835.33]
  - - [512, 24000, 1, 1536]
    - [128, 8665.9]
  - - [128, 6784, 1, 3328]
    - [125, 7062.25]
  - - [5888, 1408, 1, 256]
    - [138, 8130.22]
  - - [5888, 1856, 1, 3328]
    - [128, 8840.75]
  - - [512, 4, 1, 512]
    - [13, 170.223]
  - - [35, 1500, 1, 2560]
    - [17, 2896.55]
  - - [1856, 4288, 1, 256]
    - [117, 8374.63]
  - - [1024, 5056, 1, 128]
    - [114, 3304.25]
  - - [5056, 5056, 1, 3328]
    - [128, 8905.43]
  - - [1408, 5888, 1, 1280]
    - [128, 9418.1]
  - - [2368, 448, 1, 128]
    - [102, 3074.97]
  - - [6144, 6000, 1, 2560]
    - [128, 9336.33]
  - - [2368, 6784, 1, 128]
    - [101, 4919.26]
  - - [1024, 3584, 1, 3328]
    - [119, 8071.07]
  - - [512, 48000, 1, 2048]
    - [128, 8763.06]
  - - [1408, 64, 1, 128]
    - [24, 805.47]
  - - [256, 4288, 1, 3328]
    - [150, 6331.86]
  - - [5888, 1408, 1, 1280]
    - [118, 9226.17]
  - - [704, 1856, 1, 3328]
    - [144, 6309.4]
  - - [1408, 4288, 1, 256]
    - [128, 8374.5]
  - - [1024, 2368, 1, 256]
    - [125, 7341.02]
  - - [64, 4, 1, 256]
    - [68, 13.0032]
  - - [1408, 1856, 1, 1280]
    - [135, 8772.95]
  - - [1408, 64, 1, 1280]
    - [81, 4049.98]
  - - [448, 1024, 1, 1280]
    - [144, 6071.16]
  - - [4096, 32, 1, 4096]
    - [78, 5491.72]
  - - [256, 1408, 1, 3328]
    - [130, 5351.39]
  - - [5056, 5056, 1, 1280]
    - [138, 9408.57]
  - - [448, 5056, 1, 256]
    - [143, 6680.44]
  - - [704, 1856, 1, 1280]
    - [120, 7503.93]
  - - [128, 5056, 1, 128]
    - [35, 2316.48]
  - - [2368, 128, 1, 256]
    - [120, 3660.12]
  - - [1856, 1408, 1, 128]
    - [107, 3885.87]
  - - [64, 5056, 1, 256]
    - [130, 3318.81]
  - - [6784, 256, 1, 3328]
    - [128, 7590.54]
  - - [1408, 3584, 1, 256]
    - [117, 8276.82]
  - - [4288, 448, 1, 256]
    - [130, 7139.69]
  - - [64, 704, 1, 128]
    - [31, 375.467]
  - - [1024, 1856, 1, 128]
    - [100, 2890.56]
  - - [4288, 2944, 1, 1280]
    - [134, 8981.35]
  - - [704, 5056, 1, 1280]
    - [120, 7684.62]
  - - [2368, 704, 1, 3328]
    - [135, 7070.04]
  - - [256, 5888, 1, 256]
    - [120, 7319.35]
  - - [1856, 4288, 1, 3328]
    - [118, 9238.59]
  - - [256, 2944, 1, 256]
    - [120, 6090.21]
  - - [5888, 1024, 1, 256]
    - [124, 8269.95]
  - - [448, 64, 1, 1280]
    - [77, 2493.22]
  - - [3072, 64, 1, 1024]
    - [60, 3149.67]
  - - [3584, 4, 1, 1280]
    - [162, 567.762]
  - - [2560, 16, 1, 2560]
    - [69, 2887.05]
  - - [2944, 64, 1, 256]
    - [60, 2565.66]
  - - [128, 4, 1, 1280]
    - [163, 78.7692]
  - - [1408, 2944, 1, 256]
    - [124, 8337.2]
  - - [256, 1856, 1, 1280]
    - [150, 6267.25]
  - - [6784, 5056, 1, 3328]
    - [134, 9423.9]
  - - [5056, 5056, 1, 256]
    - [121, 8758.23]
  - - [128, 256, 1, 256]
    - [76, 1205.26]
  - - [64, 1024, 1, 1280]
    - [87, 3566.58]
  - - [2944, 4, 1, 256]
    - [40, 319.349]
  - - [704, 5056, 1, 128]
    - [109, 4073.73]
  - - [4, 2368, 1, 1280]
    - [68, 496.892]
  - - [2368, 2944, 1, 1280]
    - [117, 9085.45]
  - - [448, 448, 1, 3328]
    - [95, 5428.66]
  - - [6784, 6784, 1, 1280]
    - [134, 8726.93]
  - - [1024, 256, 1, 3328]
    - [144, 5499.32]
  - - [1408, 4288, 1, 1280]
    - [118, 9094.32]
  - - [3584, 4288, 1, 1280]
    - [121, 8703.78]
  - - [512, 6000, 1, 2560]
    - [124, 8474.46]
  - - [2368, 704, 1, 1280]
    - [130, 7651.49]
  - - [5056, 4288, 1, 3328]
    - [138, 8545.25]
  - - [3584, 2368, 1, 3328]
    - [126, 8797.78]
  - - [5888, 6784, 1, 1280]
    - [124, 8785.08]
  - - [64, 704, 1, 1280]
    - [47, 2783.38]
  - - [4288, 256, 1, 256]
    - [120, 6162.68]
  - - [2944, 128, 1, 128]
    - [22, 1951.23]
  - - [6144, 32, 1, 2560]
    - [81, 4588.95]
  - - [6784, 448, 1, 1280]
    - [125, 8674.21]
  - - [2944, 5888, 1, 256]
    - [138, 8991.66]
  - - [64, 64, 1, 1280]
    - [98, 712.348]
  - - [4288, 2944, 1, 256]
    - [134, 8678.04]
  - - [5888, 704, 1, 1280]
    - [124, 8652.61]
  - - [5056, 4, 1, 3328]
    - [40, 650.672]
  - - [1856, 64, 1, 1280]
    - [57, 4471.87]
  - - [1760, 16, 1, 1760]
    - [97, 2592.13]
  - - [448, 5888, 1, 128]
    - [107, 3822.93]
  - - [5888, 64, 1, 3328]
    - [89, 6013.12]
  - - [2944, 256, 1, 3328]
    - [130, 7791.35]
  - - [1024, 64, 1, 128]
    - [31, 592.416]
  - - [5056, 2368, 1, 1280]
    - [117, 9260.43]
  - - [448, 3584, 1, 1280]
    - [138, 6771.24]
  - - [6784, 5888, 1, 256]
    - [132, 7933.29]
  - - [64, 1024, 1, 3328]
    - [81, 4782.98]
  - - [704, 128, 1, 1280]
    - [87, 3971.88]
  - - [4, 3584, 1, 128]
    - [156, 59.4238]
  - - [1408, 448, 1, 1280]
    - [130, 5902.07]
  - - [1024, 1408, 1, 256]
    - [125, 5272.84]
  - - [2368, 2368, 1, 3328]
    - [130, 8488.66]
  - - [1856, 6784, 1, 128]
    - [107, 4742.41]
  - - [5056, 704, 1, 3328]
    - [133, 7772.38]
  - - [1408, 1856, 1, 256]
    - [151, 5229.74]
  - - [1408, 704, 1, 3328]
    - [151, 6954.83]
  - - [2368, 5056, 1, 256]
    - [124, 8580.58]
  - - [1408, 256, 1, 1280]
    - [150, 4790.01]
  - - [3072, 128, 1, 1024]
    - [146, 4579.77]
  - - [3584, 2368, 1, 1280]
    - [117, 8675.03]
  - - [4288, 64, 1, 3328]
    - [96, 5550.01]
  - - [2368, 4, 1, 1280]
    - [162, 537.418]
  - - [704, 5888, 1, 256]
    - [118, 5305.78]
  - - [6784, 2944, 1, 128]
    - [114, 4344.11]
  - - [6784, 64, 1, 256]
    - [144, 4496.32]
  - - [2944, 256, 1, 256]
    - [130, 6553.6]
  - - [2944, 6784, 1, 3328]
    - [118, 8895.66]
  - - [128, 1, 1, 1408]
    - [98, 25.6]
  - - [704, 1408, 1, 3328]
    - [132, 7913.11]
  - - [3584, 704, 1, 3328]
    - [117, 7526.33]
  - - [2944, 256, 1, 128]
    - [101, 2830.66]
  - - [6784, 4, 1, 1280]
    - [158, 645.135]
  - - [1024, 64, 1, 1280]
    - [56, 3013.15]
  - - [8448, 4, 1, 2816]
    - [8, 984.668]
  - - [448, 4288, 1, 256]
    - [130, 7139.69]
  - - [64, 3584, 1, 3328]
    - [54, 5683.17]
  - - [704, 2368, 1, 1280]
    - [138, 7045.2]
  - - [1856, 2368, 1, 1280]
    - [135, 8327.8]
  - - [2368, 128, 1, 3328]
    - [71, 6082.55]
  - - [64, 193600, 1, 64]
    - [120, 6747.67]
  - - [1760, 128, 1, 1760]
    - [48, 5512.97]
  - - [448, 1408, 1, 256]
    - [130, 5591.44]
  - - [1856, 4288, 1, 1280]
    - [128, 8647.62]
  - - [64, 5056, 1, 3328]
    - [88, 6096.49]
  - - [512, 1500, 1, 2816]
    - [130, 7879.2]
  - - [1024, 448, 1, 128]
    - [102, 1844.23]
  - - [704, 4, 1, 1280]
    - [68, 341.333]
  - - [704, 256, 1, 128]
    - [102, 1001.24]
  - - [256, 193600, 1, 64]
    - [138, 8113.2]
  - - [704, 2944, 1, 128]
    - [109, 3747.03]
  - - [1408, 1024, 1, 1280]
    - [135, 7080.61]
  - - [704, 6784, 1, 256]
    - [153, 6630.37]
  - - [6784, 704, 1, 256]
    - [120, 8005.76]
  - - [5056, 1408, 1, 128]
    - [111, 4303.03]
  - - [2048, 7000, 1, 2048]
    - [128, 9269.1]
  - - [256, 3584, 1, 3328]
    - [122, 7334.38]
  - - [5056, 704, 1, 256]
    - [130, 7954.02]
  - - [128, 1408, 1, 128]
    - [25, 1242.92]
  - - [3584, 4288, 1, 3328]
    - [154, 7683.71]
  - - [5888, 1856, 1, 1280]
    - [118, 8831.24]
  - - [256, 1408, 1, 256]
    - [120, 4352.58]
  - - [5056, 64, 1, 1280]
    - [87, 5011.95]
  - - [1024, 704, 1, 256]
    - [120, 5710.07]
  - - [64, 256, 1, 128]
    - [26, 149.797]
  - - [2368, 3584, 1, 1280]
    - [128, 8609.58]
  - - [1024, 256, 1, 256]
    - [144, 3276.8]
  - - [1856, 4, 1, 1280]
    - [42, 497.004]
  - - [448, 448, 1, 256]
    - [130, 3117.73]
  - - [2944, 3584, 1, 3328]
    - [118, 8879.35]
  - - [7680, 32, 1, 2560]
    - [88, 5310.14]
  - - [128, 4288, 1, 128]
    - [28, 2116.1]
  - - [256, 256, 1, 3328]
    - [81, 4774.6]
  - - [128, 1024, 1, 3328]
    - [82, 5894.7]
  - - [4, 1408, 1, 3328]
    - [73, 552.574]
  - - [6784, 2944, 1, 256]
    - [136, 8271.08]
  - - [64, 1856, 1, 1280]
    - [87, 4167.86]
  - - [64, 1024, 1, 128]
    - [21, 589.088]
  - - [1024, 1500, 1, 2560]
    - [125, 8407.78]
  - - [1856, 2368, 1, 256]
    - [120, 8092.05]
  - - [3584, 256, 1, 128]
    - [103, 2607.47]
  - - [3584, 6784, 1, 3328]
    - [137, 8558.73]
  - - [256, 1024, 1, 256]
    - [130, 3901.68]
  - - [4, 6784, 1, 3328]
    - [68, 662.475]
  - - [1024, 5888, 1, 3328]
    - [128, 9161.66]
  - - [1024, 128, 1, 1280]
    - [85, 3942.02]
  - - [3072, 32, 1, 1024]
    - [62, 2840.39]
  - - [6144, 24000, 1, 2560]
    - [118, 7605.77]
  - - [448, 1024, 1, 256]
    - [120, 5062.09]
  - - [5056, 4288, 1, 1280]
    - [128, 9090.89]
  - - [5888, 64, 1, 256]
    - [130, 4449.68]
  - - [1856, 256, 1, 1280]
    - [144, 5834.36]
  - - [64, 5888, 1, 3328]
    - [82, 6152.34]
  - - [2368, 2368, 1, 1280]
    - [122, 8594.56]
  - - [2944, 5888, 1, 128]
    - [107, 4776.09]
  - - [704, 5888, 1, 1280]
    - [122, 8435.81]
  - - [2368, 3584, 1, 128]
    - [104, 4590.61]
  - - [1856, 5056, 1, 128]
    - [115, 4503.38]
  - - [4608, 1, 1, 1536]
    - [13, 226.855]
  - - [448, 256, 1, 3328]
    - [57, 5415.46]
  - - [2944, 6784, 1, 1280]
    - [141, 8385.01]
  - - [448, 1856, 1, 128]
    - [111, 2618.86]
  - - [128, 1024, 1, 128]
    - [20, 940.427]
  - - [7680, 4, 1, 2560]
    - [44, 985.004]
  - - [1024, 704, 1, 1280]
    - [130, 7204.46]
  - - [128, 5888, 1, 256]
    - [120, 6313.42]
  - - [1024, 5056, 1, 1280]
    - [125, 8979.66]
  - - [4288, 1024, 1, 256]
    - [117, 7198.19]
  - - [2944, 2368, 1, 128]
    - [102, 4624.47]
  - - [704, 704, 1, 3328]
    - [143, 5870.61]
  - - [704, 1408, 1, 1280]
    - [132, 7680.22]
  - - [5888, 448, 1, 1280]
    - [120, 7718.56]
  - - [3584, 256, 1, 3328]
    - [125, 7523.78]
  - - [704, 5888, 1, 3328]
    - [130, 8196.89]
  - - [704, 1856, 1, 128]
    - [108, 3388.33]
  - - [128, 3584, 1, 3328]
    - [82, 6626.4]
  - - [4, 4288, 1, 128]
    - [155, 159.548]
  - - [128, 704, 1, 1280]
    - [45, 4038.63]
  - - [3584, 2944, 1, 256]
    - [118, 7685.89]
  - - [1856, 128, 1, 3328]
    - [74, 6070.53]
  - - [1856, 2368, 1, 3328]
    - [135, 8460.52]
  - - [512, 6000, 1, 2816]
    - [138, 9019.45]
  - - [2944, 448, 1, 128]
    - [101, 3027.63]
  - - [64, 193600, 1, 256]
    - [144, 7080.22]
  - - [128, 2944, 1, 1280]
    - [120, 5397.77]
  - - [448, 2944, 1, 1280]
    - [130, 6996.87]
  - - [512, 24000, 1, 2048]
    - [138, 8832.57]
  - - [128, 256, 1, 3328]
    - [77, 3531.47]
  - - [1408, 5056, 1, 3328]
    - [133, 7969.84]
  - - [1856, 1856, 1, 3328]
    - [120, 8140.24]
  - - [3584, 128, 1, 256]
    - [130, 4860.95]
  - - [448, 1408, 1, 3328]
    - [120, 6353.65]
  - - [2368, 2368, 1, 256]
    - [134, 8369.27]
  - - [4288, 4288, 1, 1280]
    - [124, 8666.42]
  - - [64, 448, 1, 1280]
    - [77, 2591.82]
  - - [5888, 1024, 1, 1280]
    - [117, 8526.5]
  - - [704, 1024, 1, 256]
    - [130, 4971.7]
  - - [1024, 12544, 1, 256]
    - [168, 8611.8]
  - - [448, 4, 1, 256]
    - [73, 78.5534]
  - - [5888, 448, 1, 128]
    - [104, 3591.93]
  - - [512, 48000, 1, 2560]
    - [138, 9237.34]
  - - [8448, 16, 1, 2816]
    - [3, 3360.11]
  - - [704, 6784, 1, 3328]
    - [139, 7774.85]
  - - [5888, 5888, 1, 1280]
    - [125, 9238.15]
  - - [5056, 1024, 1, 1280]
    - [153, 8227.78]
  - - [448, 5888, 1, 3328]
    - [128, 7777.53]
  - - [3072, 2, 1, 1024]
    - [65, 376.283]
  - - [1024, 2944, 1, 1280]
    - [118, 8650.35]
  - - [5056, 5888, 1, 1280]
    - [128, 8861.5]
  - - [4288, 5888, 1, 128]
    - [108, 5048.91]
  - - [256, 3584, 1, 256]
    - [120, 6314.01]
  - - [256, 4, 1, 1280]
    - [164, 163.84]
  - - [1408, 3584, 1, 128]
    - [108, 4290.12]
  - - [256, 2944, 1, 3328]
    - [130, 7620.89]
  - - [448, 3584, 1, 128]
    - [108, 3353.8]
  - - [5888, 2944, 1, 1280]
    - [118, 9498.21]
  - - [4, 6784, 1, 1280]
    - [68, 623.816]
  - - [2368, 5888, 1, 128]
    - [107, 4840.19]
  - - [35, 8457, 1, 1760]
    - [14, 4059.78]
  - - [64, 2944, 1, 128]
    - [25, 1310.72]
  - - [2368, 4, 1, 256]
    - [159, 369.639]
  - - [3584, 5888, 1, 256]
    - [136, 7996.23]
  - - [2368, 1024, 1, 128]
    - [102, 3914.97]
  - - [2368, 704, 1, 128]
    - [102, 3658.87]
  - - [512, 32, 1, 512]
    - [91, 1127.5]
  - - [3584, 2368, 1, 128]
    - [102, 4462.38]
  - - [5056, 704, 1, 128]
    - [101, 4062.11]
  - - [448, 2368, 1, 128]
    - [102, 2828.97]
  - - [4, 5056, 1, 256]
    - [50, 425.768]
  - - [5056, 1408, 1, 3328]
    - [135, 8848.82]
  - - [1408, 704, 1, 256]
    - [130, 5394.46]
  - - [6784, 1024, 1, 3328]
    - [117, 9231.92]
  - - [6784, 2944, 1, 3328]
    - [128, 8714.74]
  - - [7680, 1, 1, 2560]
    - [64, 248.745]
  - - [1856, 1856, 1, 256]
    - [129, 7586.48]
  - - [64, 64, 1, 3328]
    - [99, 1363.15]
  - - [512, 1, 1, 512]
    - [13, 43.1158]
  - - [6784, 2368, 1, 1280]
    - [130, 8665.64]
  - - [4608, 2, 1, 1536]
    - [13, 452.55]
  - - [4288, 3584, 1, 256]
    - [138, 8936.6]
  - - [4288, 5888, 1, 1280]
    - [135, 8957.05]
  - - [4608, 4, 1, 1536]
    - [6, 846.637]
  - - [1024, 6000, 1, 1536]
    - [128, 8398.44]
  - - [8448, 32, 1, 2816]
    - [88, 5342.97]
  - - [448, 2944, 1, 3328]
    - [135, 7246.94]
  - - [4288, 1856, 1, 1280]
    - [118, 8902.76]
  - - [1856, 2944, 1, 3328]
    - [130, 8622.76]
  - - [256, 6784, 1, 3328]
    - [130, 8050.67]
  - - [512, 3000, 1, 1536]
    - [151, 7108.02]
  - - [64, 5888, 1, 256]
    - [143, 3567.64]
  - - [256, 5056, 1, 128]
    - [110, 3041.02]
  - - [5056, 1024, 1, 256]
    - [134, 8401.37]
  - - [704, 64, 1, 3328]
    - [93, 4298.92]
  - - [5056, 1856, 1, 3328]
    - [138, 8660.67]
  - - [4, 2944, 1, 3328]
    - [68, 618.537]
  - - [512, 1500, 1, 2048]
    - [150, 5481.12]
  - - [1024, 1, 1, 500000]
    - [4, 259.961]
  - - [256, 4, 1, 256]
    - [68, 50.4123]
  - - [6784, 128, 1, 3328]
    - [122, 6950.81]
  - - [4288, 1408, 1, 128]
    - [102, 4539.48]
  - - [1856, 5888, 1, 3328]
    - [128, 8712.83]
  - - [4288, 5056, 1, 256]
    - [134, 8997.05]
  - - [1408, 128, 1, 1280]
    - [57, 4599.02]
  - - [4096, 7000, 1, 4096]
    - [124, 8555.79]
  - - [5056, 256, 1, 3328]
    - [130, 8257.06]
  - - [704, 704, 1, 256]
    - [120, 5852.29]
  - - [1024, 3000, 1, 2560]
    - [117, 8258.74]
  - - [1024, 5888, 1, 1280]
    - [117, 8988.89]
  - - [6784, 2368, 1, 128]
    - [103, 4562.15]
  - - [4, 5056, 1, 1280]
    - [68, 600.341]
  - - [256, 64, 1, 1280]
    - [91, 1899.59]
  - - [128, 1856, 1, 1280]
    - [130, 5185.66]
  - - [1856, 1024, 1, 1280]
    - [135, 7875.85]
  - - [6784, 4288, 1, 1280]
    - [138, 8981.08]
  - - [1856, 1856, 1, 1280]
    - [119, 7794.61]
  - - [35, 1500, 1, 2048]
    - [19, 2192.5]
  - - [3072, 24000, 1, 1024]
    - [131, 8690.48]
  - - [1408, 5056, 1, 1280]
    - [130, 8427.77]
  - - [4, 2368, 1, 3328]
    - [73, 594.322]
  - - [5888, 1856, 1, 128]
    - [102, 4293.95]
  - - [448, 704, 1, 1280]
    - [125, 4136.29]
  - - [448, 6784, 1, 128]
    - [103, 3976.1]
  - - [1024, 448, 1, 3328]
    - [135, 6376.23]
  - - [2944, 128, 1, 256]
    - [120, 4466.16]
  - - [5056, 3584, 1, 128]
    - [108, 4997.08]
  - - [5888, 5888, 1, 3328]
    - [138, 8870.27]
  - - [6784, 1024, 1, 256]
    - [117, 8520.43]
  - - [2944, 2368, 1, 256]
    - [154, 6174.49]
  - - [256, 448, 1, 256]
    - [130, 1844.23]
  - - [5056, 5888, 1, 3328]
    - [119, 8076.55]
  - - [1856, 1024, 1, 256]
    - [130, 7188.82]
  - - [512, 48000, 1, 1536]
    - [141, 7282.1]
  - - [3584, 448, 1, 1280]
    - [120, 6869.0]
  - - [1024, 1024, 1, 1280]
    - [130, 8027.35]
  - - [448, 5888, 1, 256]
    - [120, 5765.74]
  - - [2048, 128, 1, 2048]
    - [78, 4834.91]
  - - [1408, 6784, 1, 3328]
    - [130, 8613.66]
  - - [448, 1024, 1, 128]
    - [101, 2315.47]
  - - [4288, 704, 1, 128]
    - [102, 4138.82]
  - - [128, 1856, 1, 128]
    - [37, 1397.46]
  - - [448, 2368, 1, 3328]
    - [120, 6786.38]
  - - [5056, 64, 1, 128]
    - [102, 1664.74]
  - - [5056, 2944, 1, 256]
    - [153, 7697.39]
  - - [6784, 5888, 1, 128]
    - [102, 5003.57]
  - - [1024, 700, 1, 512]
    - [130, 6036.21]
  - - [3072, 1, 1, 128]
    - [84, 70.2171]
  - - [1024, 4, 1, 256]
    - [42, 154.202]
  - - [2944, 704, 1, 128]
    - [108, 3696.9]
  - - [128, 6784, 1, 1280]
    - [120, 6731.41]
  - - [1408, 3584, 1, 3328]
    - [118, 9257.97]
  - - [2368, 6784, 1, 256]
    - [117, 8840.3]
  - - [5056, 1408, 1, 1280]
    - [118, 9240.74]
  - - [5056, 4288, 1, 128]
    - [113, 4309.08]
  - - [4, 704, 1, 256]
    - [68, 130.597]
  - - [4288, 2368, 1, 3328]
    - [131, 8755.23]
  - - [1408, 1856, 1, 128]
    - [101, 3918.65]
  - - [1408, 5888, 1, 3328]
    - [138, 8910.37]
  - - [1856, 256, 1, 256]
    - [120, 5631.24]
  - - [6784, 6784, 1, 256]
    - [128, 9298.66]
  - - [5888, 5056, 1, 128]
    - [103, 4811.26]
  - - [4288, 2368, 1, 128]
    - [102, 4749.0]
  - - [128, 5888, 1, 1280]
    - [129, 6393.76]
  - - [256, 4288, 1, 1280]
    - [120, 6887.69]
  - - [2368, 2944, 1, 256]
    - [134, 8314.72]
  - - [4, 1856, 1, 256]
    - [157, 266.93]
  - - [3584, 1856, 1, 1280]
    - [118, 8631.81]
  - - [6784, 6784, 1, 128]
    - [108, 5059.86]
  - - [256, 1856, 1, 128]
    - [101, 1858.72]
  - - [704, 64, 1, 1280]
    - [51, 2849.39]
  - - [5888, 5056, 1, 256]
    - [137, 8202.42]
  - - [8448, 48000, 1, 2816]
    - [128, 4281.84]
  - - [512, 6000, 1, 2048]
    - [120, 8047.79]
  - - [3584, 448, 1, 256]
    - [130, 6805.33]
  - - [448, 4288, 1, 128]
    - [108, 3500.73]
  - - [7680, 64, 1, 2560]
    - [63, 5957.8]
  - - [256, 6784, 1, 256]
    - [130, 7331.73]
  - - [1408, 4288, 1, 128]
    - [102, 4501.39]
  - - [2944, 704, 1, 3328]
    - [130, 8439.6]
  - - [128, 448, 1, 256]
    - [51, 1555.09]
  - - [2048, 32, 1, 2048]
    - [62, 3226.39]
  - - [3584, 3584, 1, 256]
    - [134, 8784.8]
  - - [448, 1408, 1, 128]
    - [101, 2535.82]
  - - [128, 256, 1, 1280]
    - [77, 2896.62]
  - - [3584, 5056, 1, 256]
    - [121, 8566.42]
  - - [6784, 128, 1, 256]
    - [120, 6053.87]
  - - [4288, 4, 1, 256]
    - [40, 428.8]
  - - [64, 1408, 1, 3328]
    - [45, 5025.01]
  - - [704, 448, 1, 256]
    - [144, 3409.64]
  - - [2944, 2368, 1, 1280]
    - [118, 9066.25]
  - - [448, 64, 1, 3328]
    - [93, 3528.86]
  - - [704, 6784, 1, 128]
    - [107, 4212.51]
  - - [3584, 4, 1, 3328]
    - [160, 658.253]
  - - [6784, 3584, 1, 256]
    - [128, 9061.74]
  - - [704, 448, 1, 128]
    - [107, 1552.7]
  - - [256, 128, 1, 128]
    - [32, 281.875]
  - - [704, 1408, 1, 128]
    - [107, 3026.66]
  - - [4, 448, 1, 128]
    - [156, 5.46127]
  - - [4288, 128, 1, 1280]
    - [87, 5471.54]
  - - [128, 1408, 1, 256]
    - [130, 2813.25]
  - - [4, 2944, 1, 256]
    - [50, 316.666]
  - - [64, 128, 1, 3328]
    - [98, 1872.46]
  - - [1856, 1408, 1, 256]
    - [120, 7735.79]
  - - [5056, 2368, 1, 128]
    - [102, 4830.09]
  - - [2944, 2944, 1, 3328]
    - [138, 8890.01]
  - - [5056, 6784, 1, 256]
    - [128, 9015.15]
  - - [1856, 3584, 1, 128]
    - [109, 4455.02]
  - - [5888, 4, 1, 1280]
    - [158, 641.963]
  - - [128, 2944, 1, 128]
    - [27, 2036.93]
  - - [35, 8457, 1, 2560]
    - [15, 3988.13]
  - - [3584, 6784, 1, 128]
    - [102, 4774.44]
  - - [128, 4288, 1, 256]
    - [120, 4851.75]
  - - [704, 448, 1, 3328]
    - [135, 4432.53]
  - - [2368, 6784, 1, 1280]
    - [118, 9161.38]
  - - [128, 128, 1, 3328]
    - [92, 2839.89]
  - - [5056, 1856, 1, 256]
    - [134, 8380.84]
  - - [256, 128, 1, 256]
    - [76, 1165.08]
  - - [1024, 3000, 1, 2816]
    - [135, 8714.17]
  - - [1024, 1856, 1, 256]
    - [125, 7014.69]
  - - [64, 1, 1, 1216]
    - [98, 11.7205]
  - - [4288, 64, 1, 128]
    - [29, 1669.55]
  - - [256, 448, 1, 3328]
    - [53, 5152.29]
  - - [1408, 6784, 1, 1280]
    - [138, 8735.12]
  - - [3584, 3584, 1, 1280]
    - [135, 9019.99]
  - - [7680, 24000, 1, 2560]
    - [138, 6940.14]
  - - [64, 2368, 1, 1280]
    - [48, 4432.97]
  - - [448, 2368, 1, 1280]
    - [123, 5352.82]
  - - [4608, 48000, 1, 1536]
    - [117, 8129.01]
  - - [5888, 5888, 1, 128]
    - [110, 4700.81]
  - - [64, 6784, 1, 3328]
    - [120, 6170.72]
  - - [2944, 256, 1, 1280]
    - [150, 6177.55]
  - - [2048, 16, 1, 2048]
    - [72, 2167.6]
  - - [256, 2368, 1, 128]
    - [101, 2037.67]
  - - [5056, 2368, 1, 3328]
    - [118, 9040.5]
  - - [2944, 4288, 1, 256]
    - [149, 7552.12]
  - - [1408, 3584, 1, 1280]
    - [125, 8808.66]
  - - [2368, 64, 1, 256]
    - [61, 2320.41]
  - - [1024, 128, 1, 128]
    - [21, 1075.46]
  - - [704, 128, 1, 3328]
    - [54, 4984.92]
  - - [5888, 4, 1, 128]
    - [155, 33.5558]
  - - [1856, 704, 1, 256]
    - [130, 7110.88]
  - - [1024, 1500, 1, 2816]
    - [125, 8499.78]
  - - [8448, 1, 1, 2816]
    - [8, 251.369]
  - - [1024, 4, 1, 3328]
    - [164, 540.932]
  - - [1024, 6000, 1, 2048]
    - [125, 8698.49]
  - - [512, 24000, 1, 2560]
    - [118, 8963.6]
  - - [6144, 3000, 1, 2560]
    - [141, 8761.87]
  - - [2368, 6784, 1, 3328]
    - [135, 8867.39]
  - - [1856, 1408, 1, 1280]
    - [122, 7908.43]
  - - [1856, 448, 1, 1280]
    - [135, 6543.91]
  - - [6784, 704, 1, 128]
    - [101, 4086.35]
  - - [4, 4, 1, 256]
    - [68, 0.752941]
  - - [128, 5888, 1, 128]
    - [25, 2582.15]
  - - [5056, 2944, 1, 128]
    - [105, 4579.07]
  - - [1408, 5888, 1, 256]
    - [117, 8810.67]
  - - [704, 2944, 1, 1280]
    - [132, 8420.8]
  - - [4288, 64, 1, 1280]
    - [57, 4906.05]
  - - [256, 64, 1, 256]
    - [59, 689.853]
  - - [1024, 1024, 1, 256]
    - [135, 5527.91]
  - - [704, 1856, 1, 256]
    - [119, 4452.82]
  - - [2560, 64, 1, 2560]
    - [48, 4562.99]
  - - [3584, 704, 1, 1280]
    - [125, 7898.67]
  - - [256, 128, 1, 1280]
    - [77, 2864.96]
  - - [5888, 2368, 1, 256]
    - [124, 8628.27]
  - - [256, 2368, 1, 1280]
    - [120, 6073.47]
  - - [2944, 6784, 1, 128]
    - [101, 4756.67]
  - - [3584, 448, 1, 3328]
    - [120, 7264.97]
  - - [1408, 4, 1, 256]
    - [161, 234.057]
  - - [704, 2368, 1, 3328]
    - [118, 7248.88]
  - - [2944, 448, 1, 256]
    - [125, 6365.79]
  - - [1856, 448, 1, 128]
    - [103, 2976.24]
  - - [4608, 6000, 1, 1536]
    - [138, 9469.32]
  - - [2368, 128, 1, 1280]
    - [87, 4773.29]
  - - [256, 5888, 1, 128]
    - [102, 3111.9]
  - - [64, 6784, 1, 256]
    - [120, 3755.04]
  - - [64, 5056, 1, 1280]
    - [81, 4935.5]
  - - [4, 6784, 1, 128]
    - [156, 111.042]
  - - [3025, 64, 64, 64]
    - [170, 6643.65]
  - - [2944, 2944, 1, 1280]
    - [118, 8869.45]
  - - [5056, 448, 1, 3328]
    - [151, 6706.1]
  - - [4, 3584, 1, 1280]
    - [68, 573.44]
  - - [1408, 128, 1, 128]
    - [20, 1293.09]
  - - [6784, 704, 1, 3328]
    - [135, 8368.23]
  - - [128, 64, 1, 1280]
    - [94, 1260.31]
  - - [2368, 256, 1, 1280]
    - [120, 6154.37]
  - - [4, 448, 1, 3328]
    - [73, 351.638]
  - - [5888, 4288, 1, 128]
    - [102, 4340.89]
  - - [4, 5888, 1, 256]
    - [50, 428.218]
  - - [1408, 2944, 1, 3328]
    - [117, 9400.75]
  - - [3584, 704, 1, 128]
    - [104, 3392.45]
  - - [64, 1024, 1, 256]
    - [51, 1762.31]
  - - [2368, 448, 1, 1280]
    - [144, 5972.48]
  - - [128, 3584, 1, 256]
    - [120, 5224.22]
  - - [704, 448, 1, 1280]
    - [120, 4566.76]
  - - [448, 5056, 1, 128]
    - [102, 3876.09]
  - - [6144, 4, 1, 2560]
    - [44, 948.651]
  - - [5056, 3584, 1, 256]
    - [134, 8162.46]
  - - [4288, 4288, 1, 256]
    - [141, 7653.24]
  - - [1408, 5056, 1, 128]
    - [108, 4554.24]
  - - [2944, 3584, 1, 128]
    - [114, 4146.9]
  - - [3584, 2368, 1, 256]
    - [135, 8194.95]
  - - [5888, 5056, 1, 1280]
    - [134, 9413.33]
  - - [128, 1024, 1, 1280]
    - [87, 4433.73]
  - - [8448, 24000, 1, 2816]
    - [128, 5227.02]
  - - [64, 704, 1, 256]
    - [51, 1441.79]
  - - [4288, 256, 1, 1280]
    - [150, 5687.7]
  - - [3584, 3584, 1, 3328]
    - [125, 9183.53]
  - - [704, 64, 1, 128]
    - [29, 402.735]
  - - [3072, 1500, 1, 128]
    - [124, 7394.98]
  - - [2048, 3136, 1, 512]
    - [166, 8447.2]
  - - [3025, 256, 64, 64]
    - [174, 8063.69]
  - - [5888, 6784, 1, 256]
    - [118, 9281.91]
  - - [4288, 2944, 1, 3328]
    - [118, 9153.77]
  - - [2944, 64, 1, 128]
    - [35, 1463.43]
  - - [1024, 128, 1, 3328]
    - [85, 5377.31]
  - - [1024, 16, 1, 500000]
    - [1, 3997.03]
  - - [4288, 128, 1, 3328]
    - [89, 6053.21]
  - - [7680, 128, 1, 2560]
    - [135, 7769.14]
  - - [256, 5056, 1, 1280]
    - [144, 7200.74]
  - - [1408, 256, 1, 128]
    - [112, 1671.64]
  - - [2944, 5888, 1, 3328]
    - [124, 8642.08]
  - - [6784, 5888, 1, 1280]
    - [138, 8871.05]
  - - [3072, 1, 1, 1024]
    - [84, 205.872]
  - - [704, 128, 1, 256]
    - [47, 1935.29]
  - - [5888, 4288, 1, 1280]
    - [125, 9176.6]
  - - [1024, 24000, 1, 2048]
    - [124, 8667.69]
  - - [448, 256, 1, 1280]
    - [57, 4327.85]
  - - [5888, 3584, 1, 128]
    - [102, 4669.35]
  - - [64, 4288, 1, 3328]
    - [82, 5374.94]
  - - [448, 4, 1, 1280]
    - [73, 289.616]
  - - [6784, 6784, 1, 3328]
    - [131, 8306.63]
  - - [5056, 4, 1, 1280]
    - [43, 607.099]
  - - [4, 5888, 1, 3328]
    - [68, 651.438]
  - - [256, 1408, 1, 1280]
    - [120, 5176.99]
  - - [3072, 16, 1, 1024]
    - [79, 2207.53]
  - - [704, 3584, 1, 128]
    - [112, 3653.41]
  - - [1024, 2, 1, 512]
    - [99, 156.038]
  - - [5888, 448, 1, 3328]
    - [120, 7896.75]
  - - [2368, 4288, 1, 1280]
    - [117, 8517.53]
  - - [4288, 2944, 1, 128]
    - [106, 4439.16]
  - - [256, 64, 1, 3328]
    - [92, 2704.66]
  - - [2944, 64, 1, 3328]
    - [57, 5647.05]
  - - [6784, 64, 1, 3328]
    - [130, 6434.51]
  - - [5056, 2944, 1, 3328]
    - [141, 8497.1]
  - - [448, 128, 1, 256]
    - [59, 1516.54]
  - - [2944, 3584, 1, 256]
    - [135, 8365.73]
  - - [1408, 1408, 1, 3328]
    - [118, 8440.32]
  - - [1856, 128, 1, 1280]
    - [120, 5242.83]
  - - [3584, 3584, 1, 128]
    - [102, 4385.84]
  - - [64, 3584, 1, 256]
    - [120, 3276.8]
  - - [1408, 4, 1, 3328]
    - [43, 605.404]
  - - [128, 2944, 1, 3328]
    - [88, 6295.65]
  - - [3584, 704, 1, 256]
    - [125, 7711.54]
  - - [2944, 448, 1, 3328]
    - [136, 6503.87]
  - - [1024, 2, 1, 500000]
    - [5, 521.703]
  - - [3584, 1408, 1, 3328]
    - [127, 8296.1]
  - - [704, 3584, 1, 1280]
    - [132, 7670.55]
  - - [1024, 1408, 1, 128]
    - [107, 2830.51]
  - - [1856, 6784, 1, 256]
    - [138, 8149.57]
  - - [4288, 448, 1, 3328]
    - [119, 7406.34]
  - - [6784, 4288, 1, 128]
    - [114, 4417.99]
  - - [6784, 704, 1, 1280]
    - [135, 8302.35]
  - - [6144, 1, 1, 2560]
    - [44, 243.327]
  - - [3584, 6784, 1, 256]
    - [117, 9036.49]
  - - [6144, 16, 1, 2560]
    - [51, 3266.59]
  - - [3584, 64, 1, 128]
    - [35, 1555.09]
  - - [5888, 1024, 1, 3328]
    - [125, 8887.98]
  - - [448, 64, 1, 128]
    - [21, 247.974]
  - - [704, 6784, 1, 1280]
    - [121, 7892.46]
  - - [4, 448, 1, 256]
    - [43, 70.7951]
  - - [5888, 128, 1, 256]
    - [119, 5714.99]
  - - [4096, 16, 1, 4096]
    - [65, 3251.4]
  - - [1856, 5056, 1, 3328]
    - [134, 8740.17]
  - - [4, 6784, 1, 256]
    - [157, 360.312]
  - - [1024, 3584, 1, 128]
    - [102, 3456.17]
  - - [64, 704, 1, 3328]
    - [70, 3817.37]
  - - [2368, 2944, 1, 128]
    - [108, 4605.37]
  - - [5056, 64, 1, 256]
    - [120, 3863.69]
  - - [512, 1500, 1, 1536]
    - [120, 6801.46]
  - - [512, 1, 1, 500000]
    - [9, 260.968]
  - - [5888, 2944, 1, 3328]
    - [124, 8501.78]
  - - [128, 3584, 1, 1280]
    - [125, 5938.54]
  - - [1024, 704, 1, 128]
    - [111, 2172.19]
  - - [1408, 2368, 1, 128]
    - [107, 4023.1]
  - - [5888, 2368, 1, 128]
    - [108, 4424.52]
  - - [128, 5056, 1, 3328]
    - [120, 6692.06]
  - - [3584, 6784, 1, 1280]
    - [118, 9488.54]
  - - [4288, 1856, 1, 256]
    - [128, 8287.42]
  - - [1856, 5888, 1, 256]
    - [139, 7707.73]
  - - [256, 256, 1, 256]
    - [86, 1613.19]
  - - [4288, 4288, 1, 3328]
    - [128, 8923.49]
  - - [1024, 1024, 1, 128]
    - [108, 2553.61]
  - - [4288, 1408, 1, 1280]
    - [128, 8930.37]
  - - [3584, 5056, 1, 128]
    - [112, 4495.05]
  - - [4, 1024, 1, 3328]
    - [68, 415.594]
  - - [4, 704, 1, 128]
    - [156, 13.8634]
  - - [4288, 2368, 1, 256]
    - [153, 7134.98]
  - - [2944, 5056, 1, 1280]
    - [125, 9118.51]
  - - [448, 6784, 1, 256]
    - [149, 5430.21]
  - - [64, 128, 1, 128]
    - [32, 82.957]
  - - [1856, 2368, 1, 128]
    - [108, 4422.65]
  - - [6784, 2368, 1, 3328]
    - [121, 8769.3]
  - - [1408, 6784, 1, 128]
    - [108, 4738.9]
  - - [256, 1024, 1, 1280]
    - [130, 5722.11]
  - - [704, 4, 1, 128]
    - [156, 8.56578]
  - - [1408, 4, 1, 128]
    - [156, 26.0439]
  - - [4288, 128, 1, 256]
    - [130, 4865.28]
  - - [4288, 1856, 1, 3328]
    - [117, 9249.94]
  - - [3584, 448, 1, 128]
    - [108, 3029.49]
  - - [64, 4288, 1, 128]
    - [25, 1535.28]
  - - [64, 448, 1, 3328]
    - [95, 3457.26]
  - - [448, 4, 1, 3328]
    - [73, 367.228]
  - - [256, 4, 1, 3328]
    - [164, 320.289]
  - - [4, 1408, 1, 1280]
    - [161, 343.939]
  - - [3584, 64, 1, 1280]
    - [49, 5190.97]
  - - [1408, 448, 1, 128]
    - [109, 2218.14]
  - - [3584, 1024, 1, 1280]
    - [131, 8253.01]
  - - [1856, 5056, 1, 256]
    - [149, 7552.45]
  - - [4, 3584, 1, 256]
    - [68, 325.356]
  - - [6784, 4288, 1, 3328]
    - [124, 8655.24]
  - - [4, 2944, 1, 1280]
    - [68, 547.721]
  - - [1024, 4288, 1, 256]
    - [125, 7788.73]
  - - [5888, 3584, 1, 3328]
    - [128, 9173.29]
  - - [1856, 4, 1, 256]
    - [159, 282.819]
  - - [4, 256, 1, 256]
    - [68, 49.6485]
  - - [5056, 3584, 1, 3328]
    - [134, 8457.43]
  - - [1408, 128, 1, 3328]
    - [88, 5714.42]
  - - [4, 64, 1, 1280]
    - [164, 42.6667]
  - - [2368, 1408, 1, 1280]
    - [125, 8224.82]
  - - [5056, 2944, 1, 1280]
    - [117, 9295.03]
  - - [8448, 6000, 1, 2816]
    - [121, 8037.87]
  - - [4, 4, 1, 128]
    - [156, 0.0433898]
  - - [3584, 256, 1, 256]
    - [120, 6116.69]
  - - [3584, 2944, 1, 1280]
    - [117, 8796.39]
  - - [1024, 6784, 1, 256]
    - [124, 8187.76]
  - - [4, 128, 1, 256]
    - [68, 30.3407]
  - - [6784, 448, 1, 256]
    - [120, 7862.2]
  - - [5124, 9124, 1, 2048]
    - [122, 8176.31]
  - - [2944, 5056, 1, 3328]
    - [117, 9328.24]
  - - [6784, 4, 1, 128]
    - [155, 204.8]
  - - [2944, 1408, 1, 128]
    - [106, 3838.1]
  - - [448, 128, 1, 3328]
    - [71, 4632.06]
  - - [64, 2944, 1, 3328]
    - [88, 5663.37]
  - - [5056, 6784, 1, 3328]
    - [124, 8420.07]
  - - [704, 2368, 1, 128]
    - [108, 3321.69]
  - - [3072, 1500, 1, 1024]
    - [125, 8221.67]
  - - [128, 2944, 1, 256]
    - [120, 4550.42]
  - - [128, 6784, 1, 128]
    - [25, 2767.66]
  - - [3584, 4288, 1, 256]
    - [124, 8808.54]
  - - [448, 1856, 1, 256]
    - [129, 5166.53]
  - - [1856, 6784, 1, 3328]
    - [121, 8339.66]
  - - [3584, 128, 1, 3328]
    - [130, 6791.47]
  - - [64, 1856, 1, 256]
    - [52, 2209.93]
  - - [64, 448, 1, 256]
    - [84, 1008.25]
  - - [5888, 4288, 1, 256]
    - [124, 8869.53]
  - - [128, 1500, 1, 1280]
    - [81, 4733.44]
  - - [5056, 1408, 1, 256]
    - [122, 7523.21]
  - - [35, 8457, 1, 4096]
    - [15, 4023.07]
  - - [64, 256, 1, 1280]
    - [76, 1941.81]
  - - [2944, 4, 1, 128]
    - [155, 95.6426]
  - - [3584, 1024, 1, 256]
    - [147, 6553.58]
  - - [512, 6000, 1, 1536]
    - [121, 7357.15]
  - - [256, 704, 1, 256]
    - [120, 2912.71]
  - - [5888, 5888, 1, 256]
    - [131, 8802.6]
  - - [4288, 1024, 1, 1280]
    - [124, 8248.73]
  - - [5888, 128, 1, 3328]
    - [74, 6848.49]
  - - [448, 6784, 1, 3328]
    - [120, 8343.68]
  - - [2944, 1408, 1, 1280]
    - [117, 9229.38]
  - - [3072, 6000, 1, 1024]
    - [138, 9014.91]
  - - [1024, 32, 1, 512]
    - [59, 1497.97]
  - - [2944, 1856, 1, 3328]
    - [134, 7176.38]
  - - [2368, 64, 1, 128]
    - [25, 1206.38]
  - - [256, 1024, 1, 128]
    - [102, 1178.18]
  - - [3584, 5888, 1, 1280]
    - [124, 9023.48]
  - - [64, 4, 1, 128]
    - [156, 0.989372]
  - - [6784, 1856, 1, 1280]
    - [118, 8964.41]
  - - [2944, 5056, 1, 256]
    - [124, 8860.02]
  - - [5888, 256, 1, 3328]
    - [135, 8308.56]
  - - [2944, 4288, 1, 128]
    - [103, 4507.51]
  - - [3584, 1408, 1, 256]
    - [118, 8234.61]
  - - [704, 3584, 1, 3328]
    - [130, 7377.16]
  - - [5056, 448, 1, 1280]
    - [119, 7145.37]
  - - [3584, 1856, 1, 3328]
    - [135, 8954.71]
  - - [64, 1408, 1, 128]
    - [32, 731.874]
  - - [4288, 6784, 1, 1280]
    - [124, 9166.45]
  - - [1024, 3000, 1, 2048]
    - [135, 7723.73]
  - - [1408, 704, 1, 1280]
    - [125, 7863.0]
  - - [2944, 1024, 1, 256]
    - [118, 5034.92]
  - - [256, 64, 1, 128]
    - [24, 150.657]
  - - [2368, 4288, 1, 3328]
    - [122, 8568.74]
  - - [4, 1408, 1, 256]
    - [68, 219.785]
  - - [1024, 1408, 1, 1280]
    - [150, 6761.03]
  - - [64, 64, 1, 256]
    - [50, 198.594]
  - - [704, 256, 1, 3328]
    - [120, 4291.52]
  - - [6784, 5056, 1, 256]
    - [119, 8544.92]
  - - [1856, 1856, 1, 128]
    - [107, 4034.83]
  - - [4288, 5888, 1, 256]
    - [138, 8997.95]
  - - [4, 704, 1, 3328]
    - [73, 452.3]
  - - [35, 8457, 1, 2048]
    - [16, 3375.27]
  - - [448, 2944, 1, 256]
    - [120, 6346.64]
  - - [4, 4288, 1, 3328]
    - [73, 630.878]
  - - [2944, 6784, 1, 256]
    - [147, 8002.82]
  - - [2944, 2944, 1, 128]
    - [102, 4661.31]
  - - [4, 4, 1, 1280]
    - [73, 3.04762]
  - - [1856, 3584, 1, 1280]
    - [117, 8677.56]
  - - [64, 2944, 1, 256]
    - [120, 2926.85]
  - - [3584, 1408, 1, 1280]
    - [131, 8238.8]
  - - [448, 256, 1, 128]
    - [32, 1042.62]
  - - [4288, 448, 1, 128]
    - [108, 3698.72]
  - - [5056, 256, 1, 1280]
    - [125, 7058.4]
  - - [1856, 1408, 1, 3328]
    - [122, 8348.25]
  - - [128, 128, 1, 128]
    - [32, 145.636]
  - - [1024, 4288, 1, 3328]
    - [118, 8042.51]
  - - [448, 2368, 1, 256]
    - [130, 5934.9]
  - - [1024, 4, 1, 128]
    - [156, 15.83]
  - - [64, 1408, 1, 1280]
    - [54, 3865.39]
  - - [64, 6784, 1, 1280]
    - [150, 5629.51]
  - - [5056, 448, 1, 256]
    - [120, 7637.81]
  - - [2944, 2368, 1, 3328]
    - [128, 9112.34]
  - - [704, 4288, 1, 3328]
    - [120, 7950.1]
  - - [1408, 128, 1, 256]
    - [120, 2898.07]
  - - [1024, 1856, 1, 1280]
    - [118, 8087.41]
  - - [6784, 1856, 1, 256]
    - [149, 7538.15]
  - - [512, 48000, 1, 2816]
    - [117, 9704.11]
  - - [512, 3000, 1, 2816]
    - [119, 7621.53]
  - - [128, 2368, 1, 3328]
    - [82, 6038.84]
  - - [1024, 5888, 1, 256]
    - [134, 8185.72]
  - - [64, 2944, 1, 1280]
    - [81, 4540.14]
  - - [6784, 1408, 1, 256]
    - [134, 8573.9]
  - - [5056, 64, 1, 3328]
    - [82, 6310.87]
  - - [128, 704, 1, 128]
    - [21, 696.518]
  - - [1408, 2368, 1, 256]
    - [120, 4994.96]
  - - [1408, 1408, 1, 256]
    - [117, 7552.24]
  - - [4, 64, 1, 128]
    - [155, 1.80441]
  - - [64, 128, 1, 1280]
    - [94, 1272.54]
  - - [1024, 8, 1, 500000]
    - [2, 2013.13]
  - - [4, 2368, 1, 128]
    - [156, 49.8526]
  - - [2368, 2368, 1, 128]
    - [107, 4483.7]
  - - [64, 5888, 1, 128]
    - [24, 1957.57]
  - - [5888, 4, 1, 3328]
    - [157, 638.698]
  - - [6784, 1408, 1, 128]
    - [102, 4715.51]
  - - [1408, 5056, 1, 256]
    - [134, 8557.57]
  - - [512, 50176, 1, 128]
    - [165, 8809.29]
  - - [5056, 128, 1, 3328]
    - [57, 6810.56]
  - - [128, 128, 1, 1280]
    - [91, 1899.59]
  - - [512, 2, 1, 512]
    - [11, 87.3813]
  - - [448, 704, 1, 256]
    - [130, 3765.87]
  - - [4288, 3584, 1, 128]
    - [115, 4563.67]
  - - [2944, 128, 1, 3328]
    - [57, 6507.35]
  - - [128, 5056, 1, 1280]
    - [120, 6557.75]
  - - [3584, 5056, 1, 1280]
    - [117, 9407.83]
  - - [256, 448, 1, 1280]
    - [81, 4096.0]
  - - [704, 704, 1, 128]
    - [107, 2374.21]
  - - [5056, 4, 1, 128]
    - [155, 125.42]
  - - [704, 256, 1, 1280]
    - [130, 4016.13]
  - - [64, 2368, 1, 3328]
    - [87, 5159.19]
  - - [1856, 1024, 1, 128]
    - [107, 3356.37]
  - - [1856, 64, 1, 128]
    - [24, 945.544]
  - - [4096, 64, 1, 4096]
    - [90, 6260.14]
  - - [1024, 24000, 1, 1536]
    - [134, 9368.4]
  - - [704, 4288, 1, 256]
    - [131, 7329.29]
  - - [5888, 2368, 1, 1280]
    - [120, 8624.61]
  - - [6784, 1856, 1, 3328]
    - [124, 9012.35]
  - - [64, 128, 1, 256]
    - [50, 374.491]
  - - [2368, 5888, 1, 1280]
    - [118, 9045.66]
  - - [5888, 256, 1, 1280]
    - [135, 7999.07]
  - - [4, 5888, 1, 1280]
    - [68, 615.739]
  - - [704, 128, 1, 128]
    - [24, 693.169]
  - - [1024, 4, 1, 1280]
    - [163, 372.364]
  - - [2368, 1856, 1, 3328]
    - [135, 8246.81]
  - - [2368, 128, 1, 128]
    - [25, 1963.43]
  - - [2944, 704, 1, 256]
    - [135, 7116.14]
  - - [5056, 128, 1, 128]
    - [28, 2519.39]
  - - [2368, 1024, 1, 3328]
    - [120, 7959.03]
  - - [35, 700, 1, 2048]
    - [16, 1766.76]
  - - [256, 704, 1, 3328]
    - [120, 4296.46]
  - - [704, 3584, 1, 256]
    - [119, 7441.51]
  - - [704, 2944, 1, 3328]
    - [136, 7195.71]
  - - [6784, 1024, 1, 128]
    - [107, 4509.08]
  - - [256, 448, 1, 128]
    - [32, 837.903]
  - - [448, 1024, 1, 3328]
    - [130, 6515.55]
  - - [2944, 1024, 1, 3328]
    - [125, 8751.53]
  - - [2944, 5056, 1, 128]
    - [102, 4799.63]
  - - [2368, 256, 1, 256]
    - [119, 4754.57]
  - - [1408, 6784, 1, 256]
    - [147, 7476.99]
  - - [6784, 1408, 1, 3328]
    - [125, 8968.47]
  - - [4288, 6784, 1, 128]
    - [100, 4455.64]
  - - [1408, 2944, 1, 128]
    - [112, 3862.69]
  - - [704, 64, 1, 256]
    - [51, 1441.79]
  - - [3072, 4, 1, 1024]
    - [69, 711.703]
  - - [256, 2368, 1, 3328]
    - [144, 5199.63]
  - - [6784, 2944, 1, 1280]
    - [128, 8914.35]
  - - [4288, 1856, 1, 128]
    - [108, 4683.2]
  - - [1856, 2944, 1, 128]
    - [102, 4589.24]
  - - [6784, 448, 1, 128]
    - [102, 3918.43]
  - - [64, 3584, 1, 128]
    - [33, 1468.01]
  - - [448, 5056, 1, 1280]
    - [125, 7561.3]
  - - [4288, 5056, 1, 1280]
    - [117, 9304.01]
  - - [2368, 1856, 1, 128]
    - [107, 4322.07]
  - - [128, 448, 1, 1280]
    - [87, 3336.38]
  - - [4288, 704, 1, 256]
    - [130, 7834.55]
  - - [256, 3584, 1, 128]
    - [103, 2500.86]
  - - [5888, 704, 1, 256]
    - [149, 7244.39]
  - - [3584, 1024, 1, 128]
    - [114, 3168.93]
  - - [256, 5888, 1, 3328]
    - [135, 7763.37]
  - - [1408, 4288, 1, 3328]
    - [117, 9273.7]
  - - [6784, 4288, 1, 256]
    - [125, 8825.1]
  - - [4288, 256, 1, 128]
    - [104, 2621.44]
  - - [448, 1856, 1, 3328]
    - [145, 5859.7]
  - - [5888, 256, 1, 256]
    - [135, 7124.74]
  - - [1024, 4, 1, 500000]
    - [0, 1030.1]
  - - [6784, 1024, 1, 1280]
    - [117, 9083.01]
  - - [5888, 1024, 1, 128]
    - [104, 4297.06]
  - - [1024, 128, 1, 256]
    - [120, 2086.72]
  - - [512, 16, 1, 500000]
    - [1, 3921.86]
  - - [128, 64, 1, 3328]
    - [91, 1969.87]
  - - [448, 64, 1, 256]
    - [76, 1092.27]
  - - [2368, 256, 1, 128]
    - [107, 2174.74]
  - - [6784, 3584, 1, 1280]
    - [117, 9558.72]
  - - [1024, 6784, 1, 1280]
    - [126, 8637.62]
  - - [2944, 64, 1, 1280]
    - [48, 4770.03]
  - - [1408, 2944, 1, 1280]
    - [117, 9238.37]
  - - [256, 1856, 1, 256]
    - [143, 4498.33]
  - - [1408, 2368, 1, 3328]
    - [125, 8344.87]
  - - [2944, 4, 1, 3328]
    - [160, 661.109]
  - - [128, 1408, 1, 3328]
    - [88, 5641.32]
  - - [2944, 1856, 1, 128]
    - [102, 4487.94]
  - - [256, 2944, 1, 128]
    - [112, 2233.08]
  - - [256, 6784, 1, 128]
    - [101, 3139.8]
  - - [2368, 4, 1, 128]
    - [156, 38.6612]
  - - [1408, 256, 1, 3328]
    - [152, 4927.57]
  - - [1856, 4, 1, 128]
    - [156, 42.2719]
  - - [1024, 16, 1, 512]
    - [68, 1115.51]
  - - [5056, 6784, 1, 128]
    - [103, 4963.35]
  - - [4288, 5056, 1, 128]
    - [101, 4927.99]
  - - [1856, 5888, 1, 128]
    - [108, 4865.05]
  - - [7680, 2, 1, 2560]
    - [44, 499.512]
  - - [3584, 1856, 1, 256]
    - [134, 7978.28]
  - - [4288, 3584, 1, 1280]
    - [134, 7852.16]
  - - [2368, 448, 1, 256]
    - [149, 5238.83]
  - - [4288, 256, 1, 3328]
    - [120, 6751.24]
  - - [1856, 704, 1, 128]
    - [102, 3525.46]
  - - [1408, 64, 1, 256]
    - [61, 1884.7]
  - - [64, 1856, 1, 128]
    - [38, 888.105]
  - - [4, 256, 1, 128]
    - [155, 7.28178]
  - - [512, 16, 1, 512]
    - [68, 663.656]
  - - [704, 5888, 1, 128]
    - [102, 4424.45]
  - - [6784, 3584, 1, 128]
    - [104, 3823.3]
  - - [1024, 64, 1, 256]
    - [46, 1379.71]
  - - [64, 2368, 1, 256]
    - [120, 2424.83]
  - - [5124, 1500, 1, 2048]
    - [138, 8391.74]
  - - [4288, 5056, 1, 3328]
    - [124, 9274.04]
  - - [4, 1856, 1, 1280]
    - [68, 453.374]
  - - [4288, 128, 1, 128]
    - [102, 2157.7]
  - - [512, 2, 1, 500000]
    - [12, 516.795]
  - - [1408, 1408, 1, 128]
    - [103, 3600.39]
  - - [7680, 16, 1, 2560]
    - [83, 3542.49]
  - - [1856, 128, 1, 128]
    - [35, 1532.7]
  - - [5056, 2368, 1, 256]
    - [147, 7683.97]
  - - [4288, 704, 1, 3328]
    - [120, 7642.86]
  - - [448, 3584, 1, 256]
    - [130, 6733.97]
  - - [2368, 64, 1, 1280]
    - [81, 3962.14]
  - - [2368, 1024, 1, 1280]
    - [132, 7989.54]
  - - [2944, 1408, 1, 3328]
    - [135, 8954.56]
  - - [6144, 1500, 1, 2560]
    - [153, 8169.97]
  - - [4224, 1, 1, 128]
    - [84, 76.8]
  - - [1024, 1408, 1, 3328]
    - [150, 6961.28]
  - - [2944, 5888, 1, 1280]
    - [131, 8797.43]
  - - [8448, 2, 1, 2816]
    - [6, 496.858]
  - - [1408, 4, 1, 1280]
    - [161, 471.791]
  - - [5888, 3584, 1, 256]
    - [138, 8246.2]
  - - [2368, 5056, 1, 128]
    - [101, 4906.8]
  - - [1408, 1856, 1, 3328]
    - [125, 9006.7]
  - - [4, 4, 1, 3328]
    - [73, 5.73793]
  - - [5888, 5056, 1, 3328]
    - [138, 8545.0]
  - - [7680, 6000, 1, 2560]
    - [131, 7995.9]
  - - [6784, 1408, 1, 1280]
    - [125, 8888.03]
  - - [4, 1024, 1, 1280]
    - [73, 302.009]
  - - [512, 3000, 1, 2560]
    - [125, 7809.33]
  - - [704, 2944, 1, 256]
    - [130, 4909.14]
  - - [4288, 64, 1, 256]
    - [130, 3264.62]
  - - [6784, 5888, 1, 3328]
    - [138, 9544.42]
  - - [2368, 4288, 1, 128]
    - [101, 4872.93]
  - - [64, 4288, 1, 1280]
    - [87, 4656.32]
  - - [6784, 64, 1, 1280]
    - [120, 6230.33]
  - - [3584, 128, 1, 128]
    - [28, 2315.47]
  - - [1024, 6784, 1, 128]
    - [102, 3758.84]
  - - [1024, 1500, 1, 1536]
    - [151, 6971.9]
  - - [1408, 64, 1, 3328]
    - [54, 5079.48]
  - - [6784, 4, 1, 256]
    - [40, 487.838]
  - - [1408, 1408, 1, 1280]
    - [153, 7423.21]
  - - [256, 2368, 1, 256]
    - [120, 4986.8]
  - - [3072, 3000, 1, 1024]
    - [122, 7843.91]
  - - [448, 4288, 1, 3328]
    - [121, 7204.69]
  - - [2368, 1408, 1, 256]
    - [153, 5897.86]
  - - [704, 2368, 1, 256]
    - [120, 7000.83]
  - - [1024, 24000, 1, 2560]
    - [147, 8562.21]
  - - [2944, 448, 1, 1280]
    - [135, 7155.83]
  - - [5888, 2368, 1, 3328]
    - [134, 9252.32]
  - - [1024, 256, 1, 128]
    - [116, 1255.78]
  - - [5124, 9124, 1, 1760]
    - [128, 9168.39]
  - - [448, 1408, 1, 1280]
    - [120, 6150.24]
  - - [448, 1856, 1, 1280]
    - [135, 6489.66]
  - - [4288, 448, 1, 1280]
    - [150, 6886.92]
  - - [5888, 704, 1, 3328]
    - [130, 8230.54]
  - - [4, 1856, 1, 128]
    - [156, 26.9964]
  - - [5056, 256, 1, 128]
    - [101, 3468.91]
  - - [1856, 256, 1, 128]
    - [102, 2534.06]
  - - [128, 2368, 1, 256]
    - [120, 3660.12]
  - - [704, 4, 1, 256]
    - [68, 134.496]
  - - [1024, 6784, 1, 3328]
    - [122, 8482.65]
  - - [1408, 5888, 1, 128]
    - [102, 4644.42]
  - - [4288, 4, 1, 128]
    - [155, 35.7799]
  - - [512, 3136, 1, 2048]
    - [167, 6386.59]
  - - [1408, 1024, 1, 256]
    - [120, 5440.72]
  - - [128, 64, 1, 256]
    - [50, 379.919]
  - - [8448, 1500, 1, 2816]
    - [117, 9155.82]
  - - [256, 704, 1, 128]
    - [102, 895.523]
  - - [2560, 7000, 1, 2560]
    - [129, 8565.56]
  - - [5888, 64, 1, 1280]
    - [144, 5007.73]
  - - [128, 4, 1, 3328]
    - [163, 165.11]
  - - [5056, 6784, 1, 1280]
    - [128, 9331.38]
  - - [1024, 448, 1, 1280]
    - [130, 6501.36]
  - - [704, 5056, 1, 3328]
    - [117, 8090.03]
  - - [128, 5056, 1, 256]
    - [130, 5537.27]
  - - [3584, 5056, 1, 3328]
    - [126, 8633.14]
  - - [1856, 4, 1, 3328]
    - [164, 582.714]
  - - [4, 2944, 1, 128]
    - [155, 114.192]
  - - [2368, 2944, 1, 3328]
    - [134, 8749.45]
  - - [448, 448, 1, 1280]
    - [58, 4694.83]
  - - [128, 4, 1, 128]
    - [155, 4.84734]
  - - [2368, 3584, 1, 256]
    - [134, 8418.49]
  - - [4608, 3000, 1, 1536]
    - [124, 9076.37]
  - - [1024, 256, 1, 1280]
    - [130, 5562.74]
  - - [5056, 3584, 1, 1280]
    - [124, 8364.99]
  - - [5124, 9124, 1, 4096]
    - [134, 8648.48]
  - - [7680, 48000, 1, 2560]
    - [128, 4098.16]
  - - [1856, 704, 1, 1280]
    - [120, 8140.94]
  - - [1856, 2944, 1, 1280]
    - [122, 8214.3]
  - - [4608, 1500, 1, 1536]
    - [130, 8424.43]
  - - [1024, 48000, 1, 2816]
    - [121, 8513.08]
  - - [5124, 9124, 1, 2560]
    - [138, 8641.14]
  - - [128, 1024, 1, 256]
    - [52, 2356.35]
  - - [2944, 1408, 1, 256]
    - [134, 8254.19]
  - - [4288, 1408, 1, 3328]
    - [128, 9138.39]
  - - [3584, 64, 1, 3328]
    - [41, 5629.52]
  - - [5888, 2944, 1, 128]
    - [102, 4119.23]
  - - [2944, 1024, 1, 128]
    - [104, 4002.86]
  - - [128, 1, 1, 1024]
    - [98, 19.9805]
  - - [5124, 700, 1, 2048]
    - [135, 7653.74]
  - - [4, 4288, 1, 1280]
    - [68, 587.649]
  - - [6784, 5056, 1, 128]
    - [107, 4855.75]
  - - [256, 1024, 1, 3328]
    - [130, 6116.18]
  - - [3584, 4, 1, 256]
    - [42, 395.476]
  - - [1856, 64, 1, 3328]
    - [57, 5732.5]
  - - [4, 128, 1, 3328]
    - [163, 162.589]
  - - [256, 12544, 1, 1024]
    - [167, 7628.82]
  - - [5888, 1408, 1, 3328]
    - [128, 9524.33]
  - - [448, 2944, 1, 128]
    - [102, 3163.81]
  - - [2368, 1856, 1, 256]
    - [130, 8167.26]
  - - [256, 5056, 1, 256]
    - [120, 7292.03]
  - - [5056, 5056, 1, 128]
    - [108, 5043.89]
  - - [448, 3584, 1, 3328]
    - [125, 6839.46]
  - - [4, 5056, 1, 3328]
    - [73, 639.786]
  - - [256, 256, 1, 128]
    - [32, 554.802]
  - - [5888, 256, 1, 128]
    - [104, 3562.37]
  - - [4, 5056, 1, 128]
    - [155, 149.807]
  - - [448, 256, 1, 256]
    - [51, 2121.4]
  - - [704, 4, 1, 3328]
    - [161, 455.819]
  - - [1408, 256, 1, 256]
    - [120, 4352.58]
  - - [3584, 1856, 1, 128]
    - [111, 3933.13]
  - - [4288, 4288, 1, 128]
    - [102, 4888.51]
  - - [1856, 1024, 1, 3328]
    - [138, 8242.54]
  - - [1856, 4288, 1, 128]
    - [107, 4647.3]
  - - [1024, 6000, 1, 2560]
    - [132, 8526.65]
  - - [1024, 5056, 1, 256]
    - [117, 7343.73]
  - - [5056, 5888, 1, 128]
    - [106, 4053.4]
  - - [2368, 1408, 1, 3328]
    - [120, 8466.1]
  - - [1024, 48000, 1, 1536]
    - [138, 9487.64]
  - - [5888, 448, 1, 256]
    - [151, 6081.44]
  - - [5888, 6784, 1, 128]
    - [103, 4820.17]
  - - [2368, 4, 1, 3328]
    - [162, 620.528]
  - - [6784, 5056, 1, 1280]
    - [147, 8525.4]
  - - [5056, 704, 1, 1280]
    - [117, 7932.96]
  - - [1024, 48000, 1, 2560]
    - [138, 8877.84]
  - - [4608, 32, 1, 1536]
    - [67, 3556.73]
  - - [1024, 2368, 1, 128]
    - [110, 2943.65]
  - - [128, 704, 1, 256]
    - [51, 2059.7]
  - - [2368, 448, 1, 3328]
    - [130, 5290.32]
  - - [128, 5888, 1, 3328]
    - [130, 7764.33]
  - - [448, 128, 1, 1280]
    - [81, 3373.18]
  - - [6784, 4, 1, 3328]
    - [40, 675.963]
  - - [4288, 4, 1, 1280]
    - [73, 564.675]
  - - [1024, 64, 1, 3328]
    - [87, 4293.38]
  - - [3072, 48000, 1, 1024]
    - [137, 7826.41]
  - - [256, 4, 1, 128]
    - [156, 4.83304]
  - - [1024, 5888, 1, 128]
    - [115, 3610.36]
  - - [3584, 5888, 1, 128]
    - [103, 4722.25]
  - - [5056, 5888, 1, 256]
    - [138, 9159.01]
  - - [2368, 1024, 1, 256]
    - [130, 7482.61]
  - - [2944, 1856, 1, 256]
    - [134, 8208.9]
  - - [1856, 6784, 1, 1280]
    - [130, 8205.33]
  - - [64, 5056, 1, 128]
    - [25, 2079.25]
  - - [64, 6784, 1, 128]
    - [25, 2437.48]
  - - [448, 704, 1, 128]
    - [101, 1506.35]
  - - [4, 1024, 1, 128]
    - [156, 17.2463]
  - - [1408, 448, 1, 256]
    - [120, 5545.35]
  - - [1408, 704, 1, 128]
    - [106, 2931.55]
  - - [64, 256, 1, 3328]
    - [92, 2816.42]
  - - [8448, 3000, 1, 2816]
    - [126, 8872.89]
  - - [6784, 448, 1, 3328]
    - [120, 7555.38]
  - - [5056, 1856, 1, 1280]
    - [118, 8652.26]
  - - [1408, 1024, 1, 3328]
    - [122, 7781.32]
  - - [2368, 256, 1, 3328]
    - [126, 5391.96]
  - - [7680, 1500, 1, 2560]
    - [124, 8919.62]
  - - [5888, 3584, 1, 1280]
    - [124, 9235.75]
  - - [1856, 3584, 1, 3328]
    - [135, 8348.73]
  - - [5888, 128, 1, 1280]
    - [120, 5928.51]
  - - [1024, 2944, 1, 256]
    - [151, 6630.17]
  - - [448, 6784, 1, 1280]
    - [132, 8332.35]
  - - [256, 3584, 1, 1280]
    - [122, 7140.09]
  - - [448, 128, 1, 128]
    - [24, 552.713]
  - - [704, 5056, 1, 256]
    - [130, 7959.58]
  - - [3584, 1024, 1, 3328]
    - [122, 8386.74]
  - - [2944, 1856, 1, 1280]
    - [138, 7670.19]
  - - [128, 256, 1, 128]
    - [39, 258.27]
  - - [5056, 256, 1, 256]
    - [130, 5736.67]
  - - [2944, 4288, 1, 3328]
    - [117, 8730.7]
  - - [2368, 3584, 1, 3328]
    - [119, 8437.61]
  - - [2944, 704, 1, 1280]
    - [130, 8342.43]
  - - [128, 4, 1, 256]
    - [50, 24.8242]
  - - [2944, 3584, 1, 1280]
    - [132, 8322.01]
  - - [1856, 5888, 1, 1280]
    - [117, 8911.81]
  - - [256, 256, 1, 1280]
    - [81, 3653.57]
  - - [4608, 24000, 1, 1536]
    - [131, 8930.96]
  - - [4288, 1408, 1, 256]
    - [118, 8338.35]
  - - [3584, 64, 1, 256]
    - [130, 3413.97]
  - - [64, 1856, 1, 3328]
    - [57, 5460.13]
  - - [256, 1408, 1, 128]
    - [101, 1423.99]
  - - [5888, 1408, 1, 128]
    - [112, 4177.78]
  - - [4288, 2368, 1, 1280]
    - [121, 8595.95]
  - - [4, 4288, 1, 256]
    - [157, 370.854]
  - - [256, 4288, 1, 128]
    - [102, 2907.89]
  - - [256, 128, 1, 3328]
    - [95, 3644.78]
  - - [512, 8, 1, 500000]
    - [7, 2025.79]
  - - [6784, 2368, 1, 256]
    - [120, 8470.31]
  - - [5888, 128, 1, 128]
    - [25, 2604.45]
  - - [1408, 448, 1, 3328]
    - [130, 6540.52]
  - - [1024, 24000, 1, 2816]
    - [147, 8363.93]
  - - [704, 1024, 1, 1280]
    - [130, 7277.18]
  - - [1856, 256, 1, 3328]
    - [120, 7039.04]
  - - [1856, 2944, 1, 256]
    - [129, 8151.49]
  - - [5056, 1024, 1, 128]
    - [103, 4422.72]
  - - [64, 5888, 1, 1280]
    - [81, 4854.52]
  - - [7680, 3000, 1, 2560]
    - [134, 8789.47]
  - - [4224, 1500, 1, 176]
    - [130, 7902.04]
  - - [5124, 700, 1, 2560]
    - [120, 8232.49]
  - - [6784, 256, 1, 128]
    - [101, 3548.82]
  - - [5888, 704, 1, 128]
    - [108, 3959.55]
  - - [6784, 64, 1, 128]
    - [36, 2150.72]
  - - [4, 448, 1, 1280]
    - [161, 267.963]
  - - [1024, 4288, 1, 1280]
    - [135, 8363.62]
  - - [2368, 5056, 1, 3328]
    - [134, 8581.75]
  - - [448, 4, 1, 128]
    - [155, 16.7673]
  - - [4, 256, 1, 3328]
    - [164, 201.888]
  - - [4288, 1024, 1, 3328]
    - [130, 8567.62]
  - - [6144, 48000, 1, 2560]
    - [138, 3751.58]
  - - [1024, 5056, 1, 3328]
    - [117, 9440.56]
  - - [1024, 1856, 1, 3328]
    - [138, 8244.26]
  - - [704, 704, 1, 1280]
    - [130, 5529.89]
  - - [128, 2368, 1, 1280]
    - [87, 5062.28]
  - - [3584, 4, 1, 128]
    - [156, 61.4949]
  - - [3584, 256, 1, 1280]
    - [154, 6260.14]
  - - [4, 128, 1, 128]
    - [155, 1.1587]
  - - [128, 4288, 1, 3328]
    - [66, 6186.05]
  - - [5124, 1500, 1, 2560]
    - [134, 8432.52]
  - - [3584, 128, 1, 1280]
    - [120, 6547.75]
  - - [4, 256, 1, 1280]
    - [73, 180.044]
  - - [128, 704, 1, 3328]
    - [45, 5177.71]
  - - [4288, 6784, 1, 256]
    - [118, 9005.24]
  - - [3584, 2944, 1, 3328]
    - [135, 8872.17]
  - - [128, 1856, 1, 256]
    - [120, 3690.38]
  - - [64, 4288, 1, 256]
    - [120, 3007.47]
  - - [4, 3584, 1, 3328]
    - [50, 639.89]
  - - [64, 4, 1, 3328]
    - [164, 98.6074]
  - - [4, 64, 1, 3328]
    - [164, 91.8069]
  - - [35, 700, 1, 2560]
    - [18, 2397.55]
  - - [5888, 2944, 1, 256]
    - [128, 9031.18]
  - - [4, 2368, 1, 256]
    - [68, 256.868]
  - - [1856, 64, 1, 256]
    - [52, 2222.86]
  - - [5056, 128, 1, 1280]
    - [120, 6557.75]
  - - [448, 4288, 1, 1280]
    - [144, 6891.56]
  - - [256, 4288, 1, 256]
    - [120, 6250.41]
  - - [1024, 4288, 1, 128]
    - [104, 3951.31]
  - - [4, 1024, 1, 256]
    - [68, 182.044]
  - - [5056, 4288, 1, 256]
    - [124, 8933.33]
  - - [1024, 448, 1, 256]
    - [130, 4573.23]
  - - [1024, 3584, 1, 256]
    - [125, 7447.08]
  - - [2944, 128, 1, 1280]
    - [130, 5417.17]
  - - [2560, 32, 1, 2560]
    - [67, 4076.89]
  - - [64, 256, 1, 256]
    - [84, 689.853]
  - - [1024, 4, 1, 512]
    - [76, 288.07]
  - - [128, 2368, 1, 128]
    - [30, 1809.58]
  - - [256, 704, 1, 1280]
    - [120, 4032.98]
  - - [64, 2368, 1, 128]
    - [21, 1165.78]
  - - [176, 1500, 1, 1408]
    - [48, 4922.03]
  - - [448, 5888, 1, 1280]
    - [130, 7550.11]
  - - [512, 3000, 1, 2048]
    - [152, 6562.34]
  - - [5056, 448, 1, 128]
    - [102, 3947.87]
  - - [4288, 704, 1, 1280]
    - [120, 8243.72]
  - - [3584, 2944, 1, 128]
    - [112, 4284.78]
  - - [6784, 256, 1, 1280]
    - [120, 7955.11]
  - - [256, 2944, 1, 1280]
    - [150, 6691.8]
  - - [2560, 128, 1, 2560]
    - [88, 5347.13]
  - - [2368, 5888, 1, 3328]
    - [125, 8918.97]
  - - [4, 64, 1, 256]
    - [73, 13.0032]
  - - [704, 1024, 1, 3328]
    - [150, 6648.02]
  - - [2368, 1856, 1, 1280]
    - [136, 8016.41]
  - - [448, 5056, 1, 3328]
    - [120, 8231.63]
  - - [128, 448, 1, 128]
    - [29, 441.108]
  - - [128, 6784, 1, 256]
    - [130, 5849.95]
  - - [512, 4, 1, 500000]
    - [10, 1027.04]
  - - [3584, 4288, 1, 128]
    - [106, 4260.8]
  - - [64, 448, 1, 128]
    - [29, 253.454]
  - - [1024, 6000, 1, 2816]
    - [134, 8886.04]
  - - [5888, 4288, 1, 3328]
    - [134, 8968.06]
  - - [2368, 704, 1, 256]
    - [150, 4663.14]
  - - [256, 1856, 1, 3328]
    - [122, 6480.53]
  - - [1856, 128, 1, 256]
    - [120, 3726.56]
  - - [6784, 128, 1, 128]
    - [23, 2823.91]
  - - [3584, 1408, 1, 128]
    - [106, 3666.68]
  - - [1856, 5056, 1, 1280]
    - [117, 8651.26]
  - - [2944, 1024, 1, 1280]
    - [128, 8765.11]
  - - [5056, 4, 1, 256]
    - [42, 428.588]
  - - [3584, 5888, 1, 3328]
    - [128, 9347.65]
  - - [2368, 4288, 1, 256]
    - [138, 8013.0]
  - - [1024, 2368, 1, 3328]
    - [125, 8119.19]
  - - [128, 3584, 1, 128]
    - [25, 2584.52]
  - - [704, 1408, 1, 256]
    - [130, 6792.17]
  - - [4096, 128, 1, 4096]
    - [152, 6624.74]
  - - [1024, 2944, 1, 128]
    - [104, 3771.27]
  - - [1024, 3584, 1, 1280]
    - [125, 8952.61]
  - - [4288, 5888, 1, 3328]
    - [138, 9047.95]
  - - [4288, 4, 1, 3328]
    - [43, 615.106]
  - - [4608, 16, 1, 1536]
    - [47, 2894.84]
  - - [5888, 64, 1, 128]
    - [34, 1827.06]
  - - [4, 5888, 1, 128]
    - [155, 179.444]
  - - [1024, 2944, 1, 3328]
    - [126, 8298.67]
  - - [2048, 64, 1, 2048]
    - [55, 4963.67]
  - - [6144, 2, 1, 2560]
    - [44, 477.78]
  - - [256, 6784, 1, 1280]
    - [118, 7491.84]
  - - [1856, 3584, 1, 256]
    - [130, 7580.5]
  - - [128, 448, 1, 3328]
    - [81, 4417.61]
  - - [6784, 1856, 1, 128]
    - [109, 4621.64]
  - - [1024, 1500, 1, 2048]
    - [130, 6284.4]
  - - [5056, 128, 1, 256]
    - [130, 5705.06]
  - - [512, 24000, 1, 2816]
    - [117, 8919.75]
  - - [256, 5888, 1, 1280]
    - [132, 7977.9]
  - - [4, 128, 1, 1280]
    - [73, 94.1609]
  - - [4288, 6784, 1, 3328]
    - [138, 9012.48]
  - - [6784, 128, 1, 1280]
    - [122, 6807.25]
  - - [64, 1408, 1, 256]
    - [51, 2045.09]
  - - [2368, 1408, 1, 128]
    - [102, 4340.63]
  - - [1856, 448, 1, 256]
    - [151, 3639.89]
  - - [1408, 1024, 1, 128]
    - [110, 3417.58]
  - - [128, 64, 1, 128]
    - [31, 68.6241]
  - - [6784, 3584, 1, 3328]
    - [128, 9425.53]
  - - [1760, 7000, 1, 1760]
    - [125, 8780.31]
  - - [1024, 704, 1, 3328]
    - [142, 5644.5]
  - - [64, 64, 1, 128]
    - [21, 38.1023]
  - - [2368, 5056, 1, 1280]
    - [139, 8462.31]
  - - [64, 4, 1, 1280]
    - [73, 46.5455]
  - - [1408, 2368, 1, 1280]
    - [125, 8234.98]
  - - [128, 1408, 1, 1280]
    - [87, 4491.56]
  - - [1024, 1, 1, 512]
    - [91, 81.92]
  - - [4, 1408, 1, 128]
    - [155, 56.32]
  - - [704, 4288, 1, 128]
    - [109, 3942.86]
  - - [128, 1856, 1, 3328]
    - [75, 6111.83]
  - - [2944, 2944, 1, 256]
    - [134, 8640.12]
  - - [2944, 4, 1, 1280]
    - [68, 554.165]
  - - [5888, 4, 1, 256]
    - [50, 435.644]
  - - [6784, 256, 1, 256]
    - [130, 7025.86]
  - - [256, 5056, 1, 3328]
    - [130, 8249.47]
  - - [128, 4288, 1, 1280]
    - [120, 5561.64]
  - - [5056, 1856, 1, 128]
    - [114, 3975.18]
  - - [1024, 3000, 1, 1536]
    - [135, 8544.44]
  - - [5056, 1024, 1, 3328]
    - [128, 9361.37]
  - - [128, 128, 1, 256]
    - [80, 699.051]
  - - [1760, 64, 1, 1760]
    - [48, 4956.16]
  - - [4288, 3584, 1, 3328]
    - [148, 7506.08]
  - - [448, 704, 1, 3328]
    - [120, 4697.56]
  - - [448, 448, 1, 128]
    - [37, 1249.52]
  - - [1024, 2368, 1, 1280]
    - [130, 7756.34]
  - - [1856, 704, 1, 3328]
    - [130, 8340.56]
  - - [512, 1500, 1, 2560]
    - [132, 6041.29]
  - - [5888, 6784, 1, 3328]
    - [128, 9199.28]
  - - [704, 4288, 1, 1280]
    - [122, 8341.96]
  - - [128, 50176, 1, 512]
    - [168, 7589.38]
  - - [704, 256, 1, 256]
    - [120, 2912.71]
  - - [1024, 48000, 1, 2048]
    - [125, 8947.32]
  - - [4288, 1024, 1, 128]
    - [101, 4291.65]
  - - [3136, 64, 128, 64]
    - [183, 8175.06]
  - - [784, 128, 128, 512]
    - [182, 8190.53]
  - - [784, 512, 256, 128]
    - [180, 8637.14]
  - - [3136, 256, 256, 64]
    - [180, 8663.08]
  - - [3136, 64, 128, 256]
    - [178, 8943.46]
  - - [3136, 64, 256, 64]
    - [183, 8267.12]
  - - [784, 512, 128, 128]
    - [180, 8564.25]
  - - [784, 128, 256, 512]
    - [184, 8377.06]
  - - [3136, 64, 256, 256]
    - [185, 9033.88]
  - - [3136, 256, 128, 64]
    - [180, 8624.46]
  - - [1024, 256, 1, 1024]
    - [206, 6331.03]
  - - [1024, 512, 1, 2048]
    - [205, 8100.04]
  - - [512, 200, 1, 512]
    - [214, 2861.83]
  - - [4096, 256, 1, 2048]
    - [197, 8812.72]
  - - [4096, 512, 1, 1024]
    - [207, 9068.77]
  - - [1024, 200, 1, 1024]
    - [206, 5110.02]
  - - [1024, 512, 1, 1024]
    - [199, 7785.25]
  - - [2048, 256, 1, 4096]
    - [209, 8438.71]
  - - [2048, 768, 1, 512]
    - [191, 8618.43]
  - - [512, 256, 1, 1024]
    - [211, 4834.93]
  - - [512, 768, 1, 2048]
    - [208, 6908.94]
  - - [2048, 256, 1, 1024]
    - [204, 7941.88]
  - - [1024, 256, 1, 2048]
    - [201, 6997.8]
  - - [2048, 200, 1, 512]
    - [204, 5649.66]
  - - [4096, 200, 1, 1024]
    - [202, 6678.83]
  - - [2048, 200, 1, 4096]
    - [210, 6706.59]
  - - [2048, 512, 1, 1024]
    - [207, 8548.9]
  - - [1024, 1024, 1, 512]
    - [202, 8046.63]
  - - [1024, 200, 1, 4096]
    - [201, 5884.26]
  - - [2048, 512, 1, 4096]
    - [212, 8995.84]
  - - [4096, 512, 1, 2048]
    - [207, 9298.08]
  - - [4096, 1024, 1, 2048]
    - [189, 9790.67]
  - - [2048, 1024, 1, 2048]
    - [190, 9278.8]
  - - [1024, 200, 1, 512]
    - [206, 4535.36]
  - - [1024, 1024, 1, 4096]
    - [197, 8967.29]
  - - [2048, 1024, 1, 4096]
    - [192, 9500.46]
  - - [4096, 200, 1, 2048]
    - [198, 7082.58]
  - - [2048, 200, 1, 1024]
    - [204, 6211.94]
  - - [1024, 768, 1, 512]
    - [205, 7401.71]
  - - [2048, 200, 1, 2048]
    - [204, 6561.8]
  - - [2048, 256, 1, 2048]
    - [205, 8224.13]
  - - [512, 768, 1, 512]
    - [203, 6469.36]
  - - [512, 200, 1, 1024]
    - [206, 3755.64]
  - - [4096, 1024, 1, 1024]
    - [189, 9605.85]
  - - [4096, 256, 1, 4096]
    - [212, 8961.29]
  - - [1024, 512, 1, 512]
    - [205, 7108.99]
  - - [512, 256, 1, 512]
    - [213, 4032.98]
  - - [1024, 256, 1, 4096]
    - [201, 7326.3]
  - - [1024, 200, 1, 2048]
    - [194, 5530.46]
  - - [2048, 1024, 1, 512]
    - [195, 8995.83]
  - - [1024, 1024, 1, 2048]
    - [202, 8830.11]
  - - [4096, 256, 1, 1024]
    - [202, 8581.7]
  - - [512, 768, 1, 1024]
    - [203, 6875.91]
  - - [1024, 512, 1, 4096]
    - [199, 8484.05]
  - - [1024, 256, 1, 512]
    - [196, 5667.98]
  - - [4096, 200, 1, 4096]
    - [209, 7018.59]
  - - [2048, 256, 1, 512]
    - [209, 7078.99]
  - - [512, 200, 1, 2048]
    - [214, 4283.4]
  - - [1024, 1024, 1, 1024]
    - [197, 8565.27]
  - - [2048, 512, 1, 2048]
    - [197, 8850.49]
  - - [4096, 1024, 1, 4096]
    - [190, 9843.18]
  - - [2048, 1024, 1, 1024]
    - [195, 9234.11]
  - - [4096, 384, 1, 2048]
    - [237, 8892.52]
  - - [4096, 192, 1, 2048]
    - [231, 8024.18]
  - - [1225, 192, 64, 384]
    - [220, 9373.83]
  - - [5329, 64, 64, 160]
    - [224, 9186.69]
  - - [1225, 64, 64, 384]
    - [219, 8735.76]
  - - [289, 128, 64, 1024]
    - [234, 7000.2]
  - - [4096, 320, 1, 1280]
    - [239, 8302.26]
  - - [4096, 384, 1, 1536]
    - [221, 9052.45]
  - - [4096, 192, 1, 1280]
    - [236, 7561.85]
  - - [289, 192, 64, 1024]
    - [230, 7346.99]
  - - [1225, 96, 64, 384]
    - [217, 8303.08]
  - - [4096, 320, 1, 2048]
    - [226, 8384.42]
  - - [4096, 256, 1, 1536]
    - [238, 8734.34]
  - - [4096, 384, 1, 1280]
    - [235, 9023.24]
  - - [4096, 448, 1, 1280]
    - [226, 8343.32]
  - - [289, 256, 64, 1024]
    - [229, 7535.46]
  - - [4096, 448, 1, 2048]
    - [226, 8572.31]
  - - [289, 384, 64, 1024]
    - [227, 7767.57]
  - - [1024, 3594, 1, 4096]
    - [246, 8661.42]
  - - [4096, 3103, 1, 1024]
    - [256, 9652.13]
  - - [4096, 3136, 1, 1024]
    - [240, 9723.05]
  - - [1024, 3141, 1, 4096]
    - [258, 8612.02]
  - - [64, 147, 432, 148]
    - [273, 6371.93]
  - - [4096, 3559, 1, 1024]
    - [245, 9906.25]
  - - [4096, 3368, 1, 1024]
    - [240, 9720.91]
  - - [1024, 3335, 1, 4096]
    - [264, 8990.19]
  - - [1024, 3510, 1, 4096]
    - [264, 9440.58]
  - - [4096, 3209, 1, 1024]
    - [245, 9632.66]
  - - [4096, 3322, 1, 1024]
    - [244, 9939.42]
  - - [1024, 3400, 1, 4096]
    - [263, 9155.99]
  - - [1024, 3995, 1, 4096]
    - [246, 9610.15]
  - - [1024, 3503, 1, 4096]
    - [264, 9446.47]
  - - [4096, 3594, 1, 1024]
    - [255, 9691.86]
  - - [4096, 3473, 1, 1024]
    - [244, 9698.8]
  - - [4096, 3522, 1, 1024]
    - [245, 9816.82]
  - - [1024, 3103, 1, 4096]
    - [242, 8490.95]
  - - [1024, 3214, 1, 4096]
    - [263, 8667.57]
  - - [4096, 3449, 1, 1024]
    - [255, 9795.61]
  - - [1024, 3136, 1, 4096]
    - [264, 8500.51]
  - - [1024, 3955, 1, 33708]
    - [244, 9634.84]
  - - [1024, 3780, 1, 4096]
    - [247, 9088.78]
  - - [1024, 3906, 1, 33708]
    - [245, 9515.36]
  - - [1024, 3386, 1, 4096]
    - [264, 9115.95]
  - - [4096, 3396, 1, 1024]
    - [255, 9665.5]
  - - [1024, 3183, 1, 4096]
    - [242, 8662.84]
  - - [1024, 3098, 1, 4096]
    - [258, 8490.12]
  - - [1024, 3548, 1, 4096]
    - [264, 9555.53]
  - - [1024, 3224, 1, 4096]
    - [257, 8760.78]
  - - [4096, 3469, 1, 1024]
    - [244, 9687.11]
  - - [1024, 3582, 1, 4096]
    - [261, 9690.9]
  - - [1024, 2977, 1, 4096]
    - [246, 9379.28]
  - - [1024, 3939, 1, 1024]
    - [243, 9172.01]
  - - [64, 123, 528, 123]
    - [291, 6346.07]
  - - [64, 12, 5040, 12]
    - [268, 1536.0]
  - - [4096, 3176, 1, 1024]
    - [256, 9712.1]
  - - [1024, 3559, 1, 4096]
    - [260, 9579.74]
  - - [1024, 3478, 1, 4096]
    - [264, 9373.75]
  - - [4096, 3343, 1, 1024]
    - [240, 9638.67]
  - - [4096, 3440, 1, 1024]
    - [240, 9853.86]
  - - [1024, 3996, 1, 33708]
    - [244, 9733.45]
  - - [1024, 4012, 1, 4096]
    - [245, 9636.89]
  - - [1024, 3322, 1, 4096]
    - [264, 8945.02]
  - - [1024, 3990, 1, 33708]
    - [244, 9720.21]
  - - [1024, 3314, 1, 4096]
    - [264, 8944.62]
  - - [4096, 3513, 1, 1024]
    - [244, 9794.85]
  - - [1024, 3562, 1, 4096]
    - [264, 9597.18]
  - - [1024, 3443, 1, 4096]
    - [264, 9279.42]
  - - [1024, 3554, 1, 4096]
    - [261, 9552.06]
  - - [1024, 3063, 1, 4096]
    - [246, 9622.48]
  - - [64, 111, 576, 112]
    - [291, 6274.55]
  - - [4096, 3460, 1, 1024]
    - [244, 9665.59]
  - - [1024, 3209, 1, 4096]
    - [243, 8708.29]
  - - [1024, 3147, 1, 4096]
    - [264, 8492.13]
  - - [4096, 3387, 1, 1024]
    - [241, 9761.24]
  - - [4096, 3436, 1, 1024]
    - [240, 9815.05]
  - - [1024, 3341, 1, 4096]
    - [263, 9004.97]
  - - [1024, 3516, 1, 4096]
    - [263, 9471.29]
  - - [4096, 3277, 1, 1024]
    - [244, 9807.02]
  - - [1024, 3454, 1, 4096]
    - [264, 9300.93]
  - - [1024, 3969, 1, 4096]
    - [244, 9539.72]
  - - [1024, 3999, 1, 4096]
    - [245, 9607.42]
  - - [1024, 4032, 1, 4096]
    - [246, 9693.37]
  - - [4096, 3541, 1, 1024]
    - [245, 9866.63]
  - - [4096, 3334, 1, 1024]
    - [256, 9614.31]
  - - [1024, 3365, 1, 4096]
    - [264, 9058.48]
  - - [1024, 3527, 1, 4096]
    - [264, 9510.21]
  - - [1024, 3190, 1, 4096]
    - [263, 8627.7]
  - - [4096, 3906, 1, 1024]
    - [241, 9817.68]
  - - [1024, 3593, 1, 4096]
    - [246, 8662.99]
  - - [1024, 3336, 1, 4096]
    - [264, 8991.03]
  - - [4096, 3504, 1, 1024]
    - [244, 9769.76]
  - - [4096, 3977, 1, 1024]
    - [245, 9742.52]
  - - [1024, 3906, 1, 4096]
    - [245, 9386.15]
  - - [4096, 3415, 1, 1024]
    - [255, 9802.6]
  - - [1024, 3295, 1, 4096]
    - [263, 8879.16]
  - - [4096, 3321, 1, 1024]
    - [245, 9931.33]
  - - [1024, 3072, 1, 4096]
    - [246, 9671.61]
  - - [1024, 3408, 1, 4096]
    - [263, 9182.73]
  - - [1024, 3522, 1, 4096]
    - [264, 9484.53]
  - - [4096, 3751, 1, 1024]
    - [245, 9778.76]
  - - [4096, 3378, 1, 1024]
    - [255, 9692.67]
  - - [64, 77, 816, 77]
    - [297, 4850.19]
  - - [1024, 3925, 1, 33708]
    - [244, 9560.78]
  - - [1024, 3990, 1, 1024]
    - [246, 9272.65]
  - - [1024, 3290, 1, 4096]
    - [257, 8905.51]
  - - [4096, 3500, 1, 1024]
    - [245, 9761.72]
  - - [4096, 3565, 1, 1024]
    - [244, 9919.27]
  - - [1024, 3484, 1, 4096]
    - [263, 9376.42]
  - - [4096, 3395, 1, 1024]
    - [256, 9788.06]
  - - [64, 92, 688, 92]
    - [283, 5606.0]
  - - [1024, 3681, 1, 1024]
    - [248, 8690.13]
  - - [64, 159, 400, 159]
    - [275, 6518.87]
  - - [1024, 3584, 1, 1024]
    - [263, 9365.27]
  - - [4096, 3093, 1, 1024]
    - [255, 9623.31]
  - - [1024, 4050, 1, 1024]
    - [247, 9354.04]
  - - [1024, 3301, 1, 4096]
    - [264, 8888.94]
  - - [1024, 3581, 1, 4096]
    - [263, 9673.72]
  - - [4096, 3374, 1, 1024]
    - [256, 9707.23]
  - - [1024, 3449, 1, 4096]
    - [264, 9270.8]
  - - [4096, 3215, 1, 1024]
    - [245, 9645.15]
  - - [4096, 3312, 1, 1024]
    - [245, 9888.62]
  - - [4096, 3479, 1, 1024]
    - [245, 9698.51]
  - - [4096, 3544, 1, 1024]
    - [245, 9874.99]
  - - [1024, 3263, 1, 4096]
    - [264, 8787.51]
  - - [4096, 3455, 1, 1024]
    - [255, 9845.19]
  - - [1024, 3379, 1, 4096]
    - [261, 9099.91]
  - - [1024, 3490, 1, 4096]
    - [264, 9397.39]
  - - [1024, 3368, 1, 4096]
    - [264, 9079.15]
  - - [4096, 3186, 1, 1024]
    - [240, 9750.07]
  - - [1024, 3428, 1, 4096]
    - [264, 9232.82]
  - - [64, 85, 752, 84]
    - [279, 5342.57]
  - - [4096, 3561, 1, 1024]
    - [245, 9913.92]
  - - [4096, 3418, 1, 1024]
    - [255, 9765.76]
  - - [1024, 3064, 1, 4096]
    - [246, 9621.58]
  - - [4096, 3259, 1, 1024]
    - [245, 9765.42]
  - - [4096, 3308, 1, 1024]
    - [244, 9900.36]
  - - [1024, 3533, 1, 4096]
    - [264, 9520.02]
  - - [1024, 3344, 1, 4096]
    - [264, 9014.45]
  - - [1024, 4030, 1, 1024]
    - [246, 9354.0]
  - - [4096, 3459, 1, 1024]
    - [245, 9656.1]
  - - [1024, 3572, 1, 4096]
    - [261, 9639.97]
  - - [1024, 3925, 1, 1024]
    - [257, 9173.64]
  - - [4096, 3435, 1, 1024]
    - [240, 9778.1]
  - - [1024, 3956, 1, 4096]
    - [247, 9498.46]
  - - [1024, 3463, 1, 4096]
    - [264, 9332.36]
  - - [4096, 3182, 1, 1024]
    - [255, 9826.74]
  - - [4096, 3976, 1, 1024]
    - [255, 9741.89]
  - - [1024, 3417, 1, 4096]
    - [264, 9208.87]
  - - [1024, 3528, 1, 4096]
    - [264, 9508.99]
  - - [4096, 3446, 1, 1024]
    - [255, 9816.87]
  - - [64, 122, 528, 123]
    - [291, 6325.88]
  - - [1024, 3543, 1, 4096]
    - [264, 9538.63]
  - - [4096, 3287, 1, 1024]
    - [244, 9845.94]
  - - [1024, 3499, 1, 4096]
    - [264, 9428.41]
  - - [1024, 3231, 1, 4096]
    - [257, 8769.81]
  - - [64, 17, 3632, 17]
    - [279, 1934.84]
  - - [4096, 3519, 1, 1024]
    - [244, 9804.28]
  - - [4096, 3552, 1, 1024]
    - [244, 9892.55]
  - - [1024, 3458, 1, 4096]
    - [264, 9312.18]
  - - [64, 93, 688, 92]
    - [283, 5660.12]
  - - [1024, 3374, 1, 4096]
    - [258, 9110.31]
  - - [1024, 3396, 1, 4096]
    - [264, 9145.69]
  - - [1024, 2967, 1, 4096]
    - [246, 9364.66]
  - - [64, 19, 3264, 19]
    - [283, 2142.37]
  - - [4096, 3482, 1, 1024]
    - [244, 9714.1]
  - - [64, 32, 1984, 32]
    - [294, 3619.81]
  - - [64, 102, 624, 99]
    - [285, 5515.23]
  - - [1024, 3226, 1, 4096]
    - [243, 8790.37]
  - - [4096, 3377, 1, 1024]
    - [241, 9683.98]
  - - [4096, 3426, 1, 1024]
    - [256, 9869.84]
  - - [4096, 2935, 1, 1024]
    - [256, 9762.01]
  - - [64, 133, 480, 133]
    - [295, 5891.22]
  - - [1024, 3439, 1, 4096]
    - [264, 9253.89]
  - - [4096, 3267, 1, 1024]
    - [244, 9783.8]
  - - [4096, 3499, 1, 1024]
    - [245, 9761.01]
  - - [4096, 3356, 1, 1024]
    - [256, 9679.34]
  - - [64, 232, 272, 232]
    - [299, 7180.93]
  - - [64, 162, 400, 159]
    - [259, 6444.53]
  - - [4096, 3939, 1, 1024]
    - [255, 9877.9]
  - - [1024, 3526, 1, 4096]
    - [264, 9508.0]
  - - [1024, 3859, 1, 33708]
    - [245, 9402.03]
  - - [1024, 3385, 1, 4096]
    - [263, 9107.18]
  - - [1024, 3496, 1, 4096]
    - [264, 9417.9]
  - - [4096, 3141, 1, 1024]
    - [256, 9682.44]
  - - [4096, 3510, 1, 1024]
    - [244, 9786.49]
  - - [1024, 3434, 1, 4096]
    - [264, 9246.6]
  - - [4096, 3969, 1, 1024]
    - [244, 9714.75]
  - - [1024, 3121, 1, 4096]
    - [242, 8464.22]
  - - [1024, 3232, 1, 4096]
    - [264, 8711.63]
  - - [1024, 4030, 1, 33708]
    - [245, 9816.21]
  - - [1024, 3780, 1, 33708]
    - [253, 9315.44]
  - - [1024, 3969, 1, 1024]
    - [242, 9248.44]
  - - [4096, 3527, 1, 1024]
    - [244, 9832.84]
  - - [4096, 3336, 1, 1024]
    - [241, 9623.25]
  - - [4096, 3290, 1, 1024]
    - [244, 9852.11]
  - - [64, 9, 6544, 9]
    - [284, 1068.14]
  - - [1024, 3469, 1, 4096]
    - [264, 9350.45]
  - - [4096, 3490, 1, 1024]
    - [244, 9737.46]
  - - [4096, 3064, 1, 1024]
    - [244, 9889.92]
  - - [4096, 3582, 1, 1024]
    - [245, 9961.28]
  - - [1024, 3956, 1, 1024]
    - [242, 9294.15]
  - - [4096, 3417, 1, 1024]
    - [240, 9811.56]
  - - [1024, 2736, 1, 4096]
    - [246, 8636.6]
  - - [64, 78, 816, 78]
    - [283, 4946.0]
  - - [1024, 3205, 1, 4096]
    - [258, 8657.11]
  - - [1024, 3143, 1, 4096]
    - [258, 8567.77]
  - - [1024, 4020, 1, 4096]
    - [246, 9664.52]
  - - [1024, 3318, 1, 4096]
    - [243, 8966.95]
  - - [4096, 3364, 1, 1024]
    - [256, 9697.08]
  - - [1024, 3353, 1, 4096]
    - [264, 9034.07]
  - - [1024, 3464, 1, 4096]
    - [264, 9325.95]
  - - [4096, 3205, 1, 1024]
    - [244, 9619.0]
  - - [4096, 3318, 1, 1024]
    - [245, 9932.56]
  - - [1024, 3402, 1, 4096]
    - [263, 9153.39]
  - - [4096, 3181, 1, 1024]
    - [255, 9789.05]
  - - [4096, 3550, 1, 1024]
    - [245, 9888.03]
  - - [4096, 3445, 1, 1024]
    - [255, 9752.55]
  - - [1024, 3138, 1, 4096]
    - [241, 8484.0]
  - - [64, 99, 624, 99]
    - [291, 5323.89]
  - - [4096, 3079, 1, 1024]
    - [241, 9562.16]
  - - [4096, 3144, 1, 1024]
    - [255, 9686.56]
  - - [4096, 3860, 1, 1024]
    - [256, 9733.32]
  - - [1024, 3515, 1, 4096]
    - [264, 9478.34]
  - - [4096, 3408, 1, 1024]
    - [241, 9764.86]
  - - [64, 101, 624, 102]
    - [291, 5482.69]
  - - [1024, 3181, 1, 4096]
    - [243, 8593.16]
  - - [4096, 3298, 1, 1024]
    - [245, 9867.62]
  - - [4096, 3585, 1, 1024]
    - [255, 9632.91]
  - - [1024, 3550, 1, 4096]
    - [264, 9564.36]
  - - [1024, 4020, 1, 1024]
    - [247, 9339.05]
  - - [4096, 3481, 1, 1024]
    - [245, 9713.9]
  - - [4096, 3530, 1, 1024]
    - [245, 9833.89]
  - - [4096, 3425, 1, 1024]
    - [241, 9675.56]
  - - [4096, 4026, 1, 1024]
    - [245, 9849.67]
  - - [1024, 3860, 1, 1024]
    - [258, 9073.49]
  - - [4096, 3975, 1, 1024]
    - [245, 9737.62]
  - - [1024, 3286, 1, 4096]
    - [242, 8884.14]
  - - [1024, 3176, 1, 4096]
    - [242, 8597.38]
  - - [1024, 3894, 1, 4096]
    - [246, 9359.03]
  - - [4096, 3355, 1, 1024]
    - [255, 9692.99]
  - - [4096, 3404, 1, 1024]
    - [255, 9786.02]
  - - [1024, 3501, 1, 4096]
    - [263, 9426.04]
  - - [4096, 3245, 1, 1024]
    - [245, 9723.47]
  - - [1024, 3431, 1, 4096]
    - [261, 9244.22]
  - - [1024, 4000, 1, 1024]
    - [257, 9343.93]
  - - [4096, 3509, 1, 1024]
    - [244, 9781.62]
  - - [4096, 3558, 1, 1024]
    - [245, 9905.05]
  - - [1024, 3535, 1, 4096]
    - [263, 9519.05]
  - - [1024, 3414, 1, 4096]
    - [261, 9197.95]
  - - [1024, 3445, 1, 4096]
    - [264, 9279.56]
  - - [1024, 3436, 1, 4096]
    - [264, 9259.6]
  - - [4096, 3472, 1, 1024]
    - [245, 9685.17]
  - - [1024, 3211, 1, 4096]
    - [243, 8708.31]
  - - [64, 7, 8192, 7]
    - [280, 802.816]
  - - [4096, 3383, 1, 1024]
    - [255, 9734.72]
  - - [4096, 3448, 1, 1024]
    - [256, 9828.44]
  - - [1024, 3343, 1, 4096]
    - [257, 9010.36]
  - - [1024, 3518, 1, 4096]
    - [264, 9467.92]
  - - [4096, 3289, 1, 1024]
    - [245, 9844.06]
  - - [1024, 3440, 1, 4096]
    - [260, 9269.42]
  - - [1024, 4032, 1, 33708]
    - [244, 9822.31]
  - - [4096, 3489, 1, 1024]
    - [244, 9741.93]
  - - [4096, 3346, 1, 1024]
    - [241, 9616.64]
  - - [1024, 3534, 1, 4096]
    - [263, 9524.19]
  - - [1024, 3079, 1, 4096]
    - [258, 8397.67]
  - - [1024, 3955, 1, 4096]
    - [245, 9492.15]
  - - [4096, 3236, 1, 1024]
    - [245, 9705.93]
  - - [1024, 3545, 1, 4096]
    - [263, 9551.87]
  - - [1024, 3144, 1, 4096]
    - [257, 8556.7]
  - - [4096, 3780, 1, 1024]
    - [244, 9847.5]
  - - [4096, 3163, 1, 1024]
    - [255, 9717.69]
  - - [4096, 3468, 1, 1024]
    - [245, 9686.39]
  - - [1024, 3539, 1, 4096]
    - [264, 9526.89]
  - - [1024, 3541, 1, 4096]
    - [264, 9532.76]
  - - [4096, 3363, 1, 1024]
    - [240, 9699.0]
  - - [1024, 3475, 1, 4096]
    - [264, 9357.0]
  - - [4096, 3110, 1, 1024]
    - [256, 9659.58]
  - - [1024, 3509, 1, 4096]
    - [263, 9450.49]
  - - [1024, 3413, 1, 4096]
    - [264, 9185.81]
  - - [1024, 3975, 1, 1024]
    - [242, 9315.42]
  - - [4096, 3549, 1, 1024]
    - [245, 9884.72]
  - - [4096, 3342, 1, 1024]
    - [255, 9644.27]
  - - [1024, 2985, 1, 4096]
    - [245, 9392.07]
  - - [1024, 3876, 1, 33708]
    - [244, 9442.22]
  - - [4096, 3280, 1, 1024]
    - [244, 9819.92]
  - - [4096, 3191, 1, 1024]
    - [256, 9862.08]
  - - [4096, 3512, 1, 1024]
    - [245, 9793.11]
  - - [1024, 3560, 1, 4096]
    - [261, 9555.45]
  - - [4096, 2499, 1, 1024]
    - [245, 9669.35]
  - - [1024, 3248, 1, 4096]
    - [242, 8811.84]
  - - [4096, 3423, 1, 1024]
    - [256, 9729.67]
  - - [64, 111, 576, 111]
    - [291, 5982.63]
  - - [4096, 3297, 1, 1024]
    - [244, 9865.19]
  - - [4096, 3154, 1, 1024]
    - [256, 9613.42]
  - - [1024, 3303, 1, 4096]
    - [243, 8951.79]
  - - [1024, 3222, 1, 4096]
    - [263, 8682.89]
  - - [1024, 3978, 1, 1024]
    - [247, 9234.93]
  - - [4096, 3529, 1, 1024]
    - [245, 9831.62]
  - - [4096, 3386, 1, 1024]
    - [255, 9755.67]
  - - [64, 134, 480, 134]
    - [270, 5990.53]
  - - [1024, 3451, 1, 4096]
    - [261, 9277.61]
  - - [4096, 3562, 1, 1024]
    - [245, 9908.82]
  - - [4096, 3276, 1, 1024]
    - [244, 9818.04]
  - - [64, 135, 480, 132]
    - [299, 6071.77]
  - - [1024, 3894, 1, 33708]
    - [244, 9487.79]
  - - [64, 134, 480, 132]
    - [298, 6091.65]
  - - [4096, 3540, 1, 1024]
    - [245, 9862.79]
  - - [1024, 3416, 1, 4096]
    - [263, 9206.17]
  - - [1024, 4005, 1, 33708]
    - [244, 9757.19]
  - - [1024, 3942, 1, 4096]
    - [247, 9455.75]
  - - [4096, 3403, 1, 1024]
    - [255, 9739.36]
  - - [4096, 3381, 1, 1024]
    - [256, 9760.04]
  - - [1024, 3492, 1, 4096]
    - [260, 9391.69]
  - - [4096, 3101, 1, 1024]
    - [256, 9625.92]
  - - [1024, 3430, 1, 4096]
    - [264, 9232.04]
  - - [1024, 3977, 1, 4096]
    - [247, 9562.9]
  - - [1024, 3640, 1, 4096]
    - [246, 8761.4]
  - - [4096, 3557, 1, 1024]
    - [245, 9905.42]
  - - [4096, 3414, 1, 1024]
    - [241, 9755.39]
  - - [1024, 3391, 1, 4096]
    - [264, 9142.56]
  - - [64, 134, 480, 135]
    - [273, 5922.05]
  - - [64, 16, 3840, 16]
    - [289, 2080.51]
  - - [1024, 3356, 1, 4096]
    - [264, 9050.99]
  - - [4096, 3320, 1, 1024]
    - [245, 9929.47]
  - - [4096, 2765, 1, 1024]
    - [245, 9750.18]
  - - [64, 162, 400, 162]
    - [262, 6515.19]
  - - [1024, 3411, 1, 4096]
    - [264, 9185.62]
  - - [1024, 3978, 1, 4096]
    - [244, 9562.67]
  - - [4096, 3487, 1, 1024]
    - [245, 9733.75]
  - - [4096, 3520, 1, 1024]
    - [244, 9813.85]
  - - [4096, 3942, 1, 1024]
    - [255, 9804.29]
  - - [4096, 3431, 1, 1024]
    - [240, 9818.96]
  - - [1024, 3271, 1, 4096]
    - [257, 8912.98]
  - - [4096, 4020, 1, 1024]
    - [244, 9831.32]
  - - [1024, 3481, 1, 4096]
    - [260, 9376.05]
  - - [1024, 3419, 1, 4096]
    - [263, 9208.58]
  - - [1024, 4059, 1, 4096]
    - [247, 9733.73]
  - - [4096, 3345, 1, 1024]
    - [256, 9651.33]
  - - [4096, 3394, 1, 1024]
    - [256, 9780.33]
  - - [1024, 3298, 1, 4096]
    - [263, 8889.53]
  - - [4096, 3235, 1, 1024]
    - [245, 9705.71]
  - - [1024, 3681, 1, 33708]
    - [252, 9146.12]
  - - [1024, 3840, 1, 4096]
    - [245, 9253.85]
  - - [1024, 3362, 1, 4096]
    - [264, 9059.71]
  - - [4096, 3467, 1, 1024]
    - [244, 9677.41]
  - - [1024, 3349, 1, 4096]
    - [264, 9033.97]
  - - [1024, 3460, 1, 4096]
    - [264, 9322.84]
  - - [4096, 3214, 1, 1024]
    - [245, 9644.36]
  - - [1024, 3398, 1, 4096]
    - [264, 9157.19]
  - - [4096, 3478, 1, 1024]
    - [244, 9706.56]
  - - [1024, 4050, 1, 33708]
    - [244, 9865.04]
  - - [1024, 3244, 1, 4096]
    - [260, 8744.43]
  - - [4096, 3341, 1, 1024]
    - [256, 9646.69]
  - - [4096, 3454, 1, 1024]
    - [241, 9880.46]
  - - [1024, 3166, 1, 4096]
    - [258, 8618.36]
  - - [1024, 3425, 1, 4096]
    - [264, 9225.22]
  - - [4096, 3295, 1, 1024]
    - [245, 9863.71]
  - - [4096, 3072, 1, 1024]
    - [244, 9970.99]
  - - [4096, 3822, 1, 1024]
    - [245, 9951.97]
  - - [1024, 3681, 1, 4096]
    - [246, 8856.84]
  - - [1024, 4050, 1, 4096]
    - [246, 9717.48]
  - - [4096, 3495, 1, 1024]
    - [244, 9741.04]
  - - [4096, 3560, 1, 1024]
    - [245, 9909.04]
  - - [1024, 3524, 1, 4096]
    - [263, 9503.1]
  - - [1024, 3942, 1, 33708]
    - [244, 9602.57]
  - - [1024, 3304, 1, 4096]
    - [243, 8928.66]
  - - [1024, 3387, 1, 4096]
    - [264, 9127.55]
  - - [1024, 3498, 1, 4096]
    - [263, 9423.29]
  - - [4096, 3458, 1, 1024]
    - [244, 9642.53]
  - - [4096, 2967, 1, 1024]
    - [244, 9626.61]
  - - [64, 8, 7280, 8]
    - [266, 1032.51]
  - - [4096, 3385, 1, 1024]
    - [240, 9735.67]
  - - [4096, 3434, 1, 1024]
    - [255, 9808.8]
  - - [1024, 3519, 1, 4096]
    - [264, 9484.73]
  - - [1024, 3511, 1, 4096]
    - [264, 9456.37]
  - - [1024, 3288, 1, 4096]
    - [263, 8863.95]
  - - [1024, 2918, 1, 4096]
    - [246, 9170.25]
  - - [4096, 3573, 1, 1024]
    - [245, 9945.75]
  - - [1024, 3822, 1, 33708]
    - [254, 9330.9]
  - - [64, 102, 624, 102]
    - [291, 5531.07]
  - - [4096, 3539, 1, 1024]
    - [245, 9855.29]
  - - [4096, 3332, 1, 1024]
    - [256, 9648.87]
  - - [4096, 3286, 1, 1024]
    - [245, 9846.32]
  - - [1024, 4026, 1, 4096]
    - [246, 9675.84]
  - - [1024, 3277, 1, 4096]
    - [260, 8836.11]
  - - [1024, 3471, 1, 4096]
    - [264, 9346.23]
  - - [4096, 3518, 1, 1024]
    - [245, 9804.1]
  - - [1024, 3393, 1, 4096]
    - [264, 9148.89]
  - - [4096, 3413, 1, 1024]
    - [241, 9785.07]
  - - [4096, 3303, 1, 1024]
    - [245, 9884.27]
  - - [1024, 3207, 1, 4096]
    - [242, 8714.59]
  - - [1024, 3894, 1, 1024]
    - [258, 9181.41]
  - - [1024, 3977, 1, 1024]
    - [258, 9240.8]
  - - [64, 135, 480, 133]
    - [273, 5923.3]
  - - [4096, 3535, 1, 1024]
    - [245, 9839.45]
  - - [4096, 3376, 1, 1024]
    - [240, 9711.92]
  - - [1024, 3355, 1, 4096]
    - [264, 9043.17]
  - - [64, 27, 2336, 27]
    - [292, 2929.8]
  - - [1024, 3466, 1, 4096]
    - [264, 9339.0]
  - - [4096, 3266, 1, 1024]
    - [245, 9789.19]
  - - [1024, 3404, 1, 4096]
    - [264, 9176.66]
  - - [1024, 3999, 1, 1024]
    - [257, 9391.81]
  - - [64, 148, 432, 143]
    - [270, 6182.82]
  - - [4096, 3498, 1, 1024]
    - [244, 9764.46]
  - - [1024, 4032, 1, 1024]
    - [242, 9401.93]
  - - [1024, 3410, 1, 4096]
    - [263, 9183.4]
  - - [4096, 3393, 1, 1024]
    - [256, 9695.39]
  - - [1024, 3140, 1, 4096]
    - [257, 8504.76]
  - - [1024, 3910, 1, 33708]
    - [244, 9525.96]
  - - [1024, 3334, 1, 4096]
    - [263, 8987.49]
  - - [4096, 3140, 1, 1024]
    - [256, 9660.61]
  - - [1024, 4005, 1, 4096]
    - [247, 9629.78]
  - - [1024, 3579, 1, 4096]
    - [263, 9661.35]
  - - [4096, 3372, 1, 1024]
    - [256, 9697.22]
  - - [1024, 3245, 1, 4096]
    - [257, 8847.66]
  - - [64, 38, 1680, 38]
    - [267, 3340.34]
  - - [4096, 3956, 1, 1024]
    - [256, 9911.05]
  - - [4096, 3213, 1, 1024]
    - [244, 9643.01]
  - - [1024, 3361, 1, 4096]
    - [264, 9062.14]
  - - [1024, 3536, 1, 4096]
    - [263, 9530.55]
  - - [1024, 3968, 1, 1024]
    - [258, 9377.82]
  - - [4096, 3477, 1, 1024]
    - [245, 9700.67]
  - - [4096, 3526, 1, 1024]
    - [245, 9824.31]
  - - [1024, 4005, 1, 1024]
    - [242, 9362.29]
  - - [1024, 3530, 1, 4096]
    - [261, 9487.07]
  - - [1024, 3944, 1, 4096]
    - [246, 9464.45]
  - - [4096, 3453, 1, 1024]
    - [255, 9826.67]
  - - [4096, 3184, 1, 1024]
    - [256, 9833.49]
  - - [4096, 3579, 1, 1024]
    - [245, 9962.45]
  - - [4096, 3351, 1, 1024]
    - [256, 9653.24]
  - - [4096, 3416, 1, 1024]
    - [240, 9810.3]
  - - [64, 100, 624, 100]
    - [291, 5408.45]
  - - [1024, 3822, 1, 4096]
    - [246, 9196.1]
  - - [1024, 3796, 1, 4096]
    - [246, 9131.86]
  - - [4096, 3257, 1, 1024]
    - [244, 9767.24]
  - - [4096, 3306, 1, 1024]
    - [244, 9893.25]
  - - [1024, 3505, 1, 4096]
    - [264, 9449.92]
  - - [1024, 3315, 1, 4096]
    - [257, 8979.67]
  - - [1024, 3486, 1, 4096]
    - [263, 9393.38]
  - - [4096, 3457, 1, 1024]
    - [244, 9653.09]
  - - [4096, 3870, 1, 1024]
    - [241, 9717.41]
  - - [1024, 3447, 1, 4096]
    - [264, 9273.04]
  - - [1024, 3558, 1, 4096]
    - [261, 9567.23]
  - - [4096, 3433, 1, 1024]
    - [241, 9759.16]
  - - [4096, 3180, 1, 1024]
    - [256, 9738.53]
  - - [1024, 3213, 1, 4096]
    - [242, 8692.15]
  - - [1024, 3900, 1, 4096]
    - [246, 9388.51]
  - - [4096, 3444, 1, 1024]
    - [255, 9869.63]
  - - [1024, 3504, 1, 4096]
    - [264, 9429.28]
  - - [4096, 4059, 1, 1024]
    - [245, 9920.69]
  - - [1024, 3442, 1, 4096]
    - [264, 9272.91]
  - - [4096, 3517, 1, 1024]
    - [244, 9808.09]
  - - [1024, 3566, 1, 4096]
    - [263, 9622.79]
  - - [4096, 3248, 1, 1024]
    - [244, 9730.23]
  - - [1024, 3547, 1, 4096]
    - [263, 9564.63]
  - - [64, 59, 1088, 59]
    - [282, 4611.66]
  - - [1024, 3340, 1, 4096]
    - [263, 8992.11]
  - - [4096, 3480, 1, 1024]
    - [245, 9710.07]
  - - [1024, 3968, 1, 4096]
    - [245, 9543.01]
  - - [4096, 3424, 1, 1024]
    - [241, 9808.56]
  - - [1024, 3906, 1, 1024]
    - [243, 9150.44]
  - - [4096, 3265, 1, 1024]
    - [244, 9786.75]
  - - [1024, 3384, 1, 4096]
    - [264, 9119.46]
  - - [1024, 3494, 1, 4096]
    - [261, 9415.42]
  - - [1024, 3236, 1, 4096]
    - [258, 8767.04]
  - - [4096, 3497, 1, 1024]
    - [245, 9750.76]
  - - [4096, 3354, 1, 1024]
    - [256, 9665.07]
  - - [4096, 3055, 1, 1024]
    - [245, 9883.99]
  - - [64, 11, 5456, 11]
    - [268, 1368.24]
  - - [4096, 3244, 1, 1024]
    - [244, 9719.92]
  - - [4096, 3139, 1, 1024]
    - [255, 9736.96]
  - - [4096, 3508, 1, 1024]
    - [244, 9771.56]
  - - [4096, 4050, 1, 1024]
    - [244, 9898.69]
  - - [1024, 3472, 1, 4096]
    - [263, 9353.73]
  - - [1024, 3861, 1, 1024]
    - [242, 9061.22]
  - - [1024, 3910, 1, 1024]
    - [246, 9043.44]
  - - [4096, 3371, 1, 1024]
    - [256, 9738.14]
  - - [64, 65, 992, 65]
    - [295, 4354.49]
  - - [1024, 3751, 1, 4096]
    - [245, 9018.64]
  - - [4096, 3325, 1, 1024]
    - [244, 9958.63]
  - - [1024, 3321, 1, 4096]
    - [264, 8952.45]
  - - [1024, 3944, 1, 1024]
    - [243, 9117.25]
  - - [4096, 3525, 1, 1024]
    - [245, 9822.04]
  - - [4096, 3382, 1, 1024]
    - [256, 9720.11]
  - - [64, 122, 528, 122]
    - [291, 6389.23]
  - - [1024, 3453, 1, 4096]
    - [261, 9304.93]
  - - [4096, 3564, 1, 1024]
    - [244, 9911.22]
  - - [4096, 3288, 1, 1024]
    - [244, 9841.07]
  - - [1024, 3925, 1, 4096]
    - [245, 9418.85]
  - - [1024, 3057, 1, 4096]
    - [246, 9590.41]
  - - [4096, 3488, 1, 1024]
    - [245, 9732.4]
  - - [4096, 3046, 1, 1024]
    - [245, 9850.62]
  - - [1024, 3189, 1, 4096]
    - [257, 8676.92]
  - - [4096, 3399, 1, 1024]
    - [241, 9672.99]
  - - [1024, 3383, 1, 4096]
    - [264, 9102.27]
  - - [1024, 3415, 1, 4096]
    - [264, 9216.27]
  - - [1024, 3388, 1, 4096]
    - [264, 9127.43]
  - - [1024, 3376, 1, 4096]
    - [261, 9090.43]
  - - [1024, 3473, 1, 4096]
    - [264, 9354.02]
  - - [4096, 3162, 1, 1024]
    - [240, 9694.73]
  - - [1024, 3448, 1, 4096]
    - [264, 9283.35]
  - - [4096, 3362, 1, 1024]
    - [256, 9673.23]
  - - [64, 228, 272, 228]
    - [249, 7039.03]
  - - [1024, 3262, 1, 4096]
    - [258, 8850.74]
  - - [1024, 3184, 1, 4096]
    - [243, 8625.27]
  - - [1024, 3378, 1, 4096]
    - [263, 9105.17]
  - - [4096, 3548, 1, 1024]
    - [244, 9877.73]
  - - [4096, 2977, 1, 1024]
    - [244, 9647.71]
  - - [64, 21, 2976, 21]
    - [279, 2364.71]
  - - [64, 112, 576, 111]
    - [278, 5973.58]
  - - [4096, 3443, 1, 1024]
    - [240, 9784.4]
  - - [1024, 3289, 1, 4096]
    - [264, 8873.94]
  - - [1024, 3483, 1, 4096]
    - [260, 9380.47]
  - - [4096, 3190, 1, 1024]
    - [256, 9850.86]
  - - [1024, 3421, 1, 4096]
    - [264, 9213.96]
  - - [1024, 3514, 1, 4096]
    - [263, 9458.13]
  - - [1024, 3532, 1, 4096]
    - [264, 9512.93]
  - - [1024, 3565, 1, 4096]
    - [263, 9630.5]
  - - [4096, 3422, 1, 1024]
    - [241, 9733.69]
  - - [4096, 3263, 1, 1024]
    - [245, 9776.84]
  - - [4096, 3296, 1, 1024]
    - [245, 9860.51]
  - - [4096, 3640, 1, 1024]
    - [255, 9782.2]
  - - [4096, 3463, 1, 1024]
    - [244, 9671.9]
  - - [4096, 3528, 1, 1024]
    - [245, 9829.88]
  - - [1024, 3351, 1, 4096]
    - [258, 9054.27]
  - - [1024, 3462, 1, 4096]
    - [264, 9327.75]
  - - [4096, 3226, 1, 1024]
    - [245, 9674.83]
  - - [4096, 3439, 1, 1024]
    - [240, 9823.08]
  - - [4096, 3121, 1, 1024]
    - [240, 9672.54]
  - - [1024, 4059, 1, 33708]
    - [244, 9885.62]
  - - [1024, 3311, 1, 4096]
    - [264, 8909.91]
  - - [1024, 3230, 1, 4096]
    - [264, 8705.8]
  - - [4096, 3353, 1, 1024]
    - [256, 9671.76]
  - - [4096, 3402, 1, 1024]
    - [241, 9726.94]
  - - [1024, 3427, 1, 4096]
    - [264, 9233.45]
  - - [1024, 3346, 1, 4096]
    - [264, 9015.67]
  - - [1024, 3126, 1, 4096]
    - [258, 8519.21]
  - - [1024, 3796, 1, 1024]
    - [242, 8916.65]
  - - [1024, 3990, 1, 4096]
    - [246, 9600.76]
  - - [1024, 3257, 1, 4096]
    - [242, 8790.32]
  - - [4096, 3996, 1, 1024]
    - [245, 9788.15]
  - - [64, 143, 432, 143]
    - [273, 6087.14]
  - - [1024, 3306, 1, 4096]
    - [257, 9035.59]
  - - [1024, 3389, 1, 4096]
    - [264, 9134.82]
  - - [1024, 3500, 1, 4096]
    - [264, 9443.23]
  - - [1024, 3999, 1, 33708]
    - [245, 9741.14]
  - - [4096, 3486, 1, 1024]
    - [245, 9719.57]
  - - [1024, 3438, 1, 4096]
    - [264, 9259.28]
  - - [4096, 3616, 1, 1024]
    - [255, 9739.67]
  - - [1024, 3955, 1, 1024]
    - [257, 9260.27]
  - - [4096, 3430, 1, 1024]
    - [256, 9819.85]
  - - [4096, 3271, 1, 1024]
    - [245, 9801.94]
  - - [1024, 3364, 1, 4096]
    - [257, 9144.53]
  - - [64, 54, 1184, 54]
    - [277, 4315.68]
  - - [1024, 3497, 1, 4096]
    - [264, 9429.32]
  - - [4096, 3503, 1, 1024]
    - [244, 9764.38]
  - - [4096, 3344, 1, 1024]
    - [241, 9614.06]
  - - [1024, 3457, 1, 4096]
    - [264, 9320.5]
  - - [4096, 3466, 1, 1024]
    - [244, 9677.71]
  - - [1024, 3976, 1, 33708]
    - [245, 9685.28]
  - - [1024, 3395, 1, 4096]
    - [263, 9146.29]
  - - [4096, 3361, 1, 1024]
    - [255, 9677.79]
  - - [1024, 3751, 1, 33708]
    - [253, 9234.59]
  - - [1024, 3822, 1, 1024]
    - [242, 8977.73]
  - - [4096, 3315, 1, 1024]
    - [245, 9922.44]
  - - [1024, 3163, 1, 4096]
    - [257, 8577.69]
  - - [4096, 3547, 1, 1024]
    - [245, 9882.82]
  - - [4096, 3340, 1, 1024]
    - [255, 9635.32]
  - - [1024, 3296, 1, 4096]
    - [264, 8874.56]
  - - [1024, 3468, 1, 4096]
    - [264, 9350.16]
  - - [4096, 3294, 1, 1024]
    - [244, 9856.77]
  - - [1024, 3406, 1, 4096]
    - [260, 9162.74]
  - - [1024, 3860, 1, 33708]
    - [244, 9403.46]
  - - [1024, 3584, 1, 4096]
    - [261, 9677.34]
  - - [4096, 3189, 1, 1024]
    - [256, 9820.59]
  - - [4096, 3494, 1, 1024]
    - [244, 9747.58]
  - - [64, 135, 480, 135]
    - [270, 5966.24]
  - - [1024, 3093, 1, 4096]
    - [258, 8445.96]
  - - [4096, 3421, 1, 1024]
    - [241, 9775.93]
  - - [1024, 3479, 1, 4096]
    - [264, 9376.44]
  - - [1024, 3433, 1, 4096]
    - [264, 9251.04]
  - - [4096, 3311, 1, 1024]
    - [244, 9901.43]
  - - [1024, 3381, 1, 4096]
    - [264, 9103.89]
  - - [1024, 3996, 1, 4096]
    - [245, 9609.46]
  - - [4096, 3384, 1, 1024]
    - [255, 9749.91]
  - - [1024, 3247, 1, 4096]
    - [243, 8872.49]
  - - [1024, 3169, 1, 4096]
    - [242, 8597.51]
  - - [1024, 3088, 1, 4096]
    - [258, 8409.97]
  - - [1024, 3363, 1, 4096]
    - [264, 9069.4]
  - - [1024, 3538, 1, 4096]
    - [263, 9529.58]
  - - [1024, 3996, 1, 1024]
    - [247, 9322.96]
  - - [4096, 3169, 1, 1024]
    - [241, 9821.3]
  - - [4096, 3538, 1, 1024]
    - [244, 9859.32]
  - - [4096, 3401, 1, 1024]
    - [241, 9754.4]
  - - [4096, 3581, 1, 1024]
    - [244, 9960.61]
  - - [1024, 3180, 1, 4096]
    - [242, 8634.95]
  - - [1024, 3870, 1, 1024]
    - [243, 9085.59]
  - - [4096, 3555, 1, 1024]
    - [244, 9905.64]
  - - [4096, 3412, 1, 1024]
    - [256, 9778.46]
  - - [4096, 3302, 1, 1024]
    - [244, 9888.61]
  - - [1024, 3561, 1, 4096]
    - [260, 9596.95]
  - - [1024, 3302, 1, 4096]
    - [264, 8900.77]
  - - [1024, 3976, 1, 4096]
    - [246, 9563.12]
  - - [4096, 3485, 1, 1024]
    - [244, 9722.47]
  - - [4096, 3534, 1, 1024]
    - [244, 9847.12]
  - - [1024, 3110, 1, 4096]
    - [257, 8458.46]
  - - [1024, 3401, 1, 4096]
    - [264, 9174.71]
  - - [4096, 3216, 1, 1024]
    - [244, 9645.39]
  - - [1024, 4020, 1, 33708]
    - [244, 9793.51]
  - - [1024, 3215, 1, 4096]
    - [264, 8677.41]
  - - [4096, 3566, 1, 1024]
    - [244, 9924.68]
  - - [1024, 3137, 1, 4096]
    - [242, 8546.97]
  - - [4096, 3359, 1, 1024]
    - [241, 9673.63]
  - - [4096, 3392, 1, 1024]
    - [256, 9757.41]
  - - [1024, 3506, 1, 4096]
    - [264, 9442.9]
  - - [4096, 3233, 1, 1024]
    - [244, 9698.6]
  - - [1024, 3444, 1, 4096]
    - [264, 9275.44]
  - - [1024, 3975, 1, 4096]
    - [245, 9556.77]
  - - [1024, 3870, 1, 33708]
    - [244, 9427.34]
  - - [4096, 3465, 1, 1024]
    - [245, 9674.91]
  - - [4096, 3968, 1, 1024]
    - [241, 9927.83]
  - - [1024, 3523, 1, 4096]
    - [264, 9494.05]
  - - [64, 10, 5952, 10]
    - [268, 1224.06]
  - - [4096, 3990, 1, 1024]
    - [244, 9771.17]
  - - [1024, 3549, 1, 4096]
    - [263, 9553.32]
  - - [1024, 3342, 1, 4096]
    - [264, 9007.21]
  - - [4096, 3476, 1, 1024]
    - [244, 9703.56]
  - - [64, 232, 272, 228]
    - [250, 7078.83]
  - - [1024, 3418, 1, 4096]
    - [264, 9212.99]
  - - [1024, 3859, 1, 1024]
    - [243, 9087.44]
  - - [4096, 3339, 1, 1024]
    - [256, 9593.9]
  - - [4096, 3452, 1, 1024]
    - [241, 9872.59]
  - - [4096, 3293, 1, 1024]
    - [244, 9842.55]
  - - [4096, 3840, 1, 1024]
    - [245, 10030.7]
  - - [1024, 3369, 1, 4096]
    - [242, 9099.62]
  - - [64, 193, 320, 193]
    - [272, 6425.7]
  - - [1024, 3544, 1, 4096]
    - [261, 9556.54]
  - - [4096, 3493, 1, 1024]
    - [245, 9743.24]
  - - [4096, 3350, 1, 1024]
    - [256, 9653.01]
  - - [64, 71, 896, 71]
    - [296, 4686.63]
  - - [4096, 3256, 1, 1024]
    - [244, 9763.68]
  - - [1024, 3870, 1, 4096]
    - [246, 9305.18]
  - - [4096, 4012, 1, 1024]
    - [245, 9817.25]
  - - [1024, 3280, 1, 4096]
    - [264, 8841.92]
  - - [4096, 3456, 1, 1024]
    - [240, 9874.33]
  - - [1024, 3555, 1, 4096]
    - [263, 9599.53]
  - - [4096, 3014, 1, 1024]
    - [244, 9762.18]
  - - [1024, 3474, 1, 4096]
    - [264, 9373.57]
  - - [4096, 3367, 1, 1024]
    - [240, 9694.54]
  - - [4096, 3432, 1, 1024]
    - [256, 9855.17]
  - - [64, 84, 752, 84]
    - [283, 5247.08]
  - - [4096, 3273, 1, 1024]
    - [245, 9801.77]
  - - [4096, 3130, 1, 1024]
    - [241, 9672.42]
  - - [1024, 2984, 1, 4096]
    - [246, 9403.6]
  - - [1024, 3995, 1, 1024]
    - [258, 9392.51]
  - - [1024, 3517, 1, 4096]
    - [264, 9481.29]
  - - [1024, 3455, 1, 4096]
    - [264, 9302.19]
  - - [1024, 3939, 1, 4096]
    - [246, 9469.79]
  - - [64, 49, 1296, 49]
    - [276, 3938.86]
  - - [64, 14, 4368, 14]
    - [268, 1802.37]
  - - [64, 25, 2512, 25]
    - [287, 2760.44]
  - - [4096, 3147, 1, 1024]
    - [256, 9712.93]
  - - [4096, 3516, 1, 1024]
    - [244, 9805.83]
  - - [1024, 3876, 1, 4096]
    - [246, 9320.46]
  - - [1024, 3191, 1, 4096]
    - [243, 8640.66]
  - - [4096, 3411, 1, 1024]
    - [255, 9737.27]
  - - [1024, 3337, 1, 4096]
    - [264, 8990.03]
  - - [1024, 3512, 1, 4096]
    - [264, 9459.55]
  - - [4096, 3301, 1, 1024]
    - [244, 9877.16]
  - - [1024, 3450, 1, 4096]
    - [263, 9283.01]
  - - [4096, 3533, 1, 1024]
    - [244, 9848.52]
  - - [4096, 3390, 1, 1024]
    - [256, 9764.51]
  - - [4096, 3231, 1, 1024]
    - [244, 9693.71]
  - - [1024, 2499, 1, 4096]
    - [263, 9304.71]
  - - [1024, 3186, 1, 4096]
    - [243, 8649.45]
  - - [1024, 3380, 1, 4096]
    - [264, 9101.67]
  - - [4096, 3496, 1, 1024]
    - [245, 9754.2]
  - - [1024, 3956, 1, 33708]
    - [244, 9636.67]
  - - [1024, 3976, 1, 1024]
    - [246, 9248.31]
  - - [4096, 2736, 1, 1024]
    - [244, 9651.81]
  - - [1024, 3291, 1, 4096]
    - [264, 8868.84]
  - - [1024, 3944, 1, 33708]
    - [245, 9606.9]
  - - [1024, 3485, 1, 4096]
    - [263, 9385.86]
  - - [4096, 3138, 1, 1024]
    - [241, 9672.05]
  - - [1024, 3423, 1, 4096]
    - [264, 9222.67]
  - - [1024, 3491, 1, 4096]
    - [264, 9404.92]
  - - [1024, 3860, 1, 4096]
    - [247, 9282.84]
  - - [4096, 3211, 1, 1024]
    - [244, 9640.32]
  - - [1024, 3221, 1, 4096]
    - [258, 8709.3]
  - - [1024, 2917, 1, 4096]
    - [246, 9177.01]
  - - [4096, 3475, 1, 1024]
    - [244, 9703.35]
  - - [4096, 3524, 1, 1024]
    - [244, 9816.13]
  - - [4096, 2985, 1, 1024]
    - [245, 9686.81]
  - - [1024, 3480, 1, 4096]
    - [264, 9380.1]
  - - [4096, 3222, 1, 1024]
    - [244, 9666.7]
  - - [4096, 3451, 1, 1024]
    - [240, 9877.81]
  - - [1024, 3969, 1, 33708]
    - [244, 9669.54]
  - - [1024, 3640, 1, 1024]
    - [251, 8565.58]
  - - [1024, 3297, 1, 4096]
    - [260, 8889.12]
  - - [4096, 3944, 1, 1024]
    - [241, 9902.75]
  - - [1024, 3216, 1, 4096]
    - [243, 8695.78]
  - - [1024, 3840, 1, 1024]
    - [257, 9045.95]
  - - [4096, 3349, 1, 1024]
    - [255, 9676.72]
  - - [4096, 3398, 1, 1024]
    - [241, 9775.74]
  - - [1024, 3154, 1, 4096]
    - [258, 8662.16]
  - - [1024, 3978, 1, 33708]
    - [245, 9689.06]
  - - [1024, 3348, 1, 4096]
    - [264, 9014.57]
  - - [4096, 3304, 1, 1024]
    - [245, 9886.7]
  - - [4096, 4030, 1, 1024]
    - [245, 9859.0]
  - - [1024, 4026, 1, 1024]
    - [242, 9326.54]
  - - [4096, 3471, 1, 1024]
    - [244, 9682.9]
  - - [1024, 3259, 1, 4096]
    - [258, 8792.09]
  - - [64, 132, 480, 132]
    - [298, 6027.76]
  - - [1024, 3308, 1, 4096]
    - [263, 8905.04]
  - - [4096, 3391, 1, 1024]
    - [256, 9765.25]
  - - [1024, 3312, 1, 4096]
    - [264, 8917.64]
  - - [1024, 3502, 1, 4096]
    - [264, 9435.52]
  - - [1024, 3968, 1, 33708]
    - [244, 9668.14]
  - - [1024, 3424, 1, 4096]
    - [260, 9215.89]
  - - [64, 13, 4672, 13]
    - [269, 1662.25]
  - - [4096, 4032, 1, 1024]
    - [255, 9877.72]
  - - [1024, 3900, 1, 1024]
    - [258, 9116.83]
  - - [4096, 3442, 1, 1024]
    - [255, 9773.08]
  - - [1024, 3366, 1, 4096]
    - [264, 9079.36]
  - - [4096, 3999, 1, 1024]
    - [244, 9786.36]
  - - [1024, 3477, 1, 4096]
    - [264, 9364.79]
  - - [1024, 2505, 1, 4096]
    - [264, 9303.93]
  - - [4096, 3515, 1, 1024]
    - [244, 9797.83]
  - - [1024, 3564, 1, 4096]
    - [260, 9632.76]
  - - [4096, 3057, 1, 1024]
    - [245, 9880.09]
  - - [1024, 3339, 1, 4096]
    - [243, 9029.76]
  - - [4096, 3262, 1, 1024]
    - [244, 9780.0]
  - - [1024, 4030, 1, 4096]
    - [247, 9681.9]
  - - [1024, 3265, 1, 4096]
    - [264, 8797.42]
  - - [1024, 3459, 1, 4096]
    - [264, 9312.96]
  - - [4096, 3462, 1, 1024]
    - [245, 9669.63]
  - - [64, 85, 752, 85]
    - [283, 5186.83]
  - - [1024, 3513, 1, 4096]
    - [261, 9469.05]
  - - [1024, 3397, 1, 4096]
    - [264, 9151.67]
  - - [4096, 3572, 1, 1024]
    - [244, 9945.6]
  - - [4096, 3389, 1, 1024]
    - [256, 9740.76]
  - - [4096, 3438, 1, 1024]
    - [256, 9822.37]
  - - [64, 102, 624, 100]
    - [291, 5486.9]
  - - [1024, 3640, 1, 33708]
    - [252, 9083.43]
  - - [1024, 3995, 1, 33708]
    - [245, 9731.89]
  - - [1024, 3165, 1, 4096]
    - [257, 8601.8]
  - - [4096, 3543, 1, 1024]
    - [245, 9868.53]
  - - [4096, 3352, 1, 1024]
    - [240, 9668.34]
  - - [1024, 3359, 1, 4096]
    - [261, 9050.23]
  - - [1024, 3470, 1, 4096]
    - [264, 9355.07]
  - - [64, 15, 4096, 15]
    - [268, 1945.33]
  - - [1024, 3392, 1, 4096]
    - [263, 9139.61]
  - - [64, 78, 816, 77]
    - [275, 4870.46]
  - - [4096, 3137, 1, 1024]
    - [240, 9600.12]
  - - [4096, 3506, 1, 1024]
    - [245, 9778.98]
  - - [1024, 3095, 1, 4096]
    - [257, 8381.14]
  - - [1024, 3859, 1, 4096]
    - [244, 9288.53]
  - - [4096, 3369, 1, 1024]
    - [256, 9697.63]
  - - [64, 45, 1424, 45]
    - [293, 3883.64]
  - - [1024, 3435, 1, 4096]
    - [264, 9264.52]
  - - [1024, 3354, 1, 4096]
    - [264, 9035.37]
  - - [1024, 3055, 1, 4096]
    - [245, 9597.35]
  - - [4096, 3523, 1, 1024]
    - [244, 9821.69]
  - - [4096, 3380, 1, 1024]
    - [240, 9721.29]
  - - [1024, 3233, 1, 4096]
    - [257, 8724.65]
  - - [4096, 3221, 1, 1024]
    - [244, 9660.94]
  - - [4096, 3270, 1, 1024]
    - [244, 9797.82]
  - - [4096, 3593, 1, 1024]
    - [255, 9679.21]
  - - [1024, 3358, 1, 4096]
    - [264, 9051.72]
  - - [1024, 3540, 1, 4096]
    - [264, 9533.49]
  - - [4096, 3502, 1, 1024]
    - [245, 9760.55]
  - - [4096, 2505, 1, 1024]
    - [245, 9680.42]
  - - [4096, 3397, 1, 1024]
    - [255, 9785.75]
  - - [1024, 3300, 1, 4096]
    - [258, 8907.75]
  - - [4096, 3095, 1, 1024]
    - [241, 9618.68]
  - - [1024, 3182, 1, 4096]
    - [257, 8606.06]
  - - [1024, 3299, 1, 4096]
    - [263, 8885.38]
  - - [1024, 3276, 1, 4096]
    - [258, 8872.65]
  - - [1024, 3360, 1, 4096]
    - [261, 9044.1]
  - - [4096, 3360, 1, 1024]
    - [256, 9681.29]
  - - [4096, 2918, 1, 1024]
    - [240, 9732.64]
  - - [1024, 3939, 1, 33708]
    - [244, 9595.86]
  - - [4096, 3314, 1, 1024]
    - [245, 9914.92]
  - - [1024, 3319, 1, 4096]
    - [264, 8956.27]
  - - [64, 35, 1808, 35]
    - [281, 3060.17]
  - - [1024, 3942, 1, 1024]
    - [257, 9211.73]
  - - [1024, 3465, 1, 4096]
    - [264, 9340.63]
  - - [4096, 3546, 1, 1024]
    - [245, 9875.31]
  - - [1024, 3403, 1, 4096]
    - [257, 9224.24]
  - - [1024, 3948, 1, 1024]
    - [243, 9245.53]
  - - [4096, 3441, 1, 1024]
    - [256, 9758.62]
  - - [1024, 3139, 1, 4096]
    - [257, 8582.74]
  - - [1024, 3563, 1, 4096]
    - [264, 9620.64]
  - - [1024, 3508, 1, 4096]
    - [261, 9449.26]
  - - [1024, 3975, 1, 33708]
    - [244, 9683.45]
  - - [1024, 3446, 1, 4096]
    - [263, 9289.41]
  - - [1024, 3529, 1, 4096]
    - [260, 9491.19]
  - - [64, 112, 576, 112]
    - [285, 6387.04]
  - - [4096, 3461, 1, 1024]
    - [245, 9663.23]
  - - [1024, 3574, 1, 4096]
    - [263, 9662.78]
  - - [1024, 3101, 1, 4096]
    - [258, 8468.24]
  - - [1024, 3927, 1, 1024]
    - [243, 9207.87]
  - - [4096, 3224, 1, 1024]
    - [245, 9665.51]
  - - [4096, 3437, 1, 1024]
    - [241, 9857.11]
  - - [4096, 3900, 1, 1024]
    - [256, 9826.15]
  - - [1024, 3495, 1, 4096]
    - [264, 9412.31]
  - - [1024, 3977, 1, 33708]
    - [244, 9687.77]
  - - [1024, 3328, 1, 4096]
    - [264, 8975.47]
  - - [4096, 3168, 1, 1024]
    - [240, 9754.77]
  - - [1024, 4026, 1, 33708]
    - [244, 9807.14]
  - - [1024, 3292, 1, 4096]
    - [257, 8901.73]
  - - [1024, 3294, 1, 4096]
    - [264, 8876.93]
  - - [4096, 3335, 1, 1024]
    - [241, 9616.13]
  - - [4096, 3400, 1, 1024]
    - [255, 9710.63]
  - - [1024, 3287, 1, 4096]
    - [242, 8907.97]
  - - [1024, 3910, 1, 4096]
    - [246, 9400.93]
  - - [1024, 3780, 1, 1024]
    - [257, 8863.19]
  - - [4096, 3098, 1, 1024]
    - [241, 9606.37]
  - - [1024, 3584, 1, 33708]
    - [264, 9775.23]
  - - [64, 29, 2176, 29]
    - [286, 3134.93]
  - - [1024, 3371, 1, 4096]
    - [242, 9117.71]
  - - [1024, 3546, 1, 4096]
    - [264, 9547.2]
  - - [1024, 4012, 1, 1024]
    - [246, 9353.63]
  - - [4096, 3505, 1, 1024]
    - [244, 9773.07]
  - - [4096, 3554, 1, 1024]
    - [244, 9895.49]
  - - [4096, 3063, 1, 1024]
    - [244, 9898.88]
  - - [1024, 3900, 1, 33708]
    - [245, 9502.83]
  - - [1024, 3345, 1, 4096]
    - [264, 9015.75]
  - - [1024, 3357, 1, 4096]
    - [264, 9041.13]
  - - [1024, 3282, 1, 4096]
    - [257, 8860.07]
  - - [4096, 3484, 1, 1024]
    - [245, 9721.23]
  - - [1024, 3557, 1, 4096]
    - [261, 9573.38]
  - - [1024, 3476, 1, 4096]
    - [264, 9361.62]
  - - [1024, 3751, 1, 1024]
    - [258, 8849.01]
  - - [4096, 3379, 1, 1024]
    - [241, 9741.39]
  - - [4096, 3428, 1, 1024]
    - [240, 9767.72]
  - - [4096, 3126, 1, 1024]
    - [255, 9701.8]
  - - [64, 41, 1552, 41]
    - [290, 3555.59]
  - - [1024, 3325, 1, 4096]
    - [242, 8962.31]
  - - [4096, 3501, 1, 1024]
    - [244, 9761.91]
  - - [4096, 3358, 1, 1024]
    - [240, 9680.32]
  - - [1024, 3441, 1, 4096]
    - [264, 9271.17]
  - - [1024, 3552, 1, 4096]
    - [260, 9565.32]
  - - [4096, 3232, 1, 1024]
    - [245, 9696.71]
  - - [64, 18, 3440, 18]
    - [265, 2059.23]
  - - [1024, 3412, 1, 4096]
    - [264, 9199.18]
  - - [1024, 3372, 1, 4096]
    - [261, 9083.39]
  - - [1024, 3585, 1, 4096]
    - [251, 8710.19]
  - - [4096, 3143, 1, 1024]
    - [256, 9692.02]
  - - [4096, 3464, 1, 1024]
    - [244, 9661.83]
  - - [1024, 3145, 1, 4096]
    - [243, 8526.23]
  - - [4096, 3375, 1, 1024]
    - [255, 9734.68]
  - - [4096, 2917, 1, 1024]
    - [240, 9714.47]
  - - [4096, 3978, 1, 1024]
    - [245, 9741.33]
  - - [1024, 2765, 1, 4096]
    - [246, 8706.65]
  - - [64, 148, 432, 148]
    - [271, 6372.07]
  - - [1024, 3452, 1, 4096]
    - [263, 9301.28]
  - - [4096, 3584, 1, 1024]
    - [245, 10005.6]
  - - [4096, 3545, 1, 1024]
    - [245, 9877.77]
  - - [1024, 3352, 1, 4096]
    - [264, 9035.09]
  - - [64, 159, 400, 160]
    - [273, 6952.01]
  - - [4096, 3292, 1, 1024]
    - [244, 9856.41]
  - - [1024, 3525, 1, 4096]
    - [264, 9501.4]
  - - [1024, 3266, 1, 4096]
    - [264, 8817.33]
  - - [1024, 3382, 1, 4096]
    - [263, 9101.44]
  - - [4096, 3492, 1, 1024]
    - [244, 9747.19]
  - - [4096, 3419, 1, 1024]
    - [256, 9745.78]
  - - [1024, 3796, 1, 33708]
    - [253, 9356.16]
  - - [1024, 3293, 1, 4096]
    - [260, 8868.3]
  - - [4096, 3796, 1, 1024]
    - [245, 9885.26]
  - - [1024, 3487, 1, 4096]
    - [261, 9391.24]
  - - [4096, 3166, 1, 1024]
    - [256, 9718.36]
  - - [64, 102, 624, 101]
    - [285, 5547.74]
  - - [1024, 3409, 1, 4096]
    - [264, 9187.78]
  - - [1024, 3520, 1, 4096]
    - [263, 9484.99]
  - - [1024, 3573, 1, 4096]
    - [264, 9652.61]
  - - [4096, 3366, 1, 1024]
    - [240, 9684.21]
  - - [4096, 3720, 1, 1024]
    - [256, 9703.24]
  - - [4096, 3207, 1, 1024]
    - [244, 9626.11]
  - - [4096, 3272, 1, 1024]
    - [244, 9795.41]
  - - [1024, 3390, 1, 4096]
    - [264, 9125.78]
  - - [4096, 3183, 1, 1024]
    - [256, 9825.77]
  - - [4096, 3536, 1, 1024]
    - [245, 9846.41]
  - - [4096, 3563, 1, 1024]
    - [245, 9913.7]
  - - [1024, 3482, 1, 4096]
    - [264, 9376.81]
  - - [4096, 3447, 1, 1024]
    - [255, 9874.99]
  - - [4096, 3955, 1, 1024]
    - [240, 9922.29]
  - - [4096, 4005, 1, 1024]
    - [245, 9803.33]
  - - [1024, 3493, 1, 4096]
    - [264, 9411.27]
  - - [4096, 3410, 1, 1024]
    - [240, 9788.24]
  - - [1024, 3422, 1, 4096]
    - [263, 9216.18]
  - - [1024, 3350, 1, 4096]
    - [258, 9067.92]
  - - [4096, 3300, 1, 1024]
    - [245, 9883.19]
  - - [4096, 3910, 1, 1024]
    - [255, 9800.02]
  - - [1024, 3489, 1, 4096]
    - [264, 9398.56]
  - - [4096, 3483, 1, 1024]
    - [244, 9715.86]
  - - [4096, 3532, 1, 1024]
    - [245, 9837.89]
  - - [64, 101, 624, 101]
    - [285, 5452.18]
  - - [4096, 3230, 1, 1024]
    - [245, 9683.5]
  - - [4096, 3427, 1, 1024]
    - [240, 9760.62]
  - - [1024, 3377, 1, 4096]
    - [264, 9101.07]
  - - [1024, 3488, 1, 4096]
    - [263, 9381.89]
  - - [1024, 3616, 1, 4096]
    - [246, 8709.23]
  - - [1024, 3426, 1, 4096]
    - [264, 9229.33]
  - - [4096, 3357, 1, 1024]
    - [256, 9668.4]
  - - [4096, 3406, 1, 1024]
    - [241, 9748.47]
  - - [1024, 3046, 1, 4096]
    - [246, 9590.33]
  - - [1024, 3272, 1, 4096]
    - [257, 8930.1]
  - - [1024, 3256, 1, 4096]
    - [242, 8828.06]
  - - [4096, 3247, 1, 1024]
    - [244, 9741.71]
  - - [4096, 3088, 1, 1024]
    - [256, 9588.97]
  - - [1024, 3531, 1, 4096]
    - [263, 9500.96]
  - - [64, 160, 400, 160]
    - [299, 7333.93]
  - - [4096, 3511, 1, 1024]
    - [245, 9789.28]
  - - [1024, 3720, 1, 33708]
    - [254, 9214.58]
  - - [1024, 3267, 1, 4096]
    - [257, 8830.94]
  - - [1024, 3270, 1, 4096]
    - [258, 8876.58]
  - - [1024, 3461, 1, 4096]
    - [263, 9327.45]
  - - [4096, 3474, 1, 1024]
    - [244, 9696.94]
  - - [4096, 2984, 1, 1024]
    - [245, 9673.98]
  - - [1024, 3399, 1, 4096]
    - [263, 9158.48]
  - - [4096, 3574, 1, 1024]
    - [244, 9942.2]
  - - [1024, 3876, 1, 1024]
    - [258, 9085.03]
  - - [4096, 3337, 1, 1024]
    - [241, 9611.33]
  - - [4096, 3450, 1, 1024]
    - [256, 9930.25]
  - - [1024, 3720, 1, 1024]
    - [242, 8755.39]
  - - [1024, 4059, 1, 1024]
    - [247, 9366.57]
  - - [4096, 3291, 1, 1024]
    - [244, 9856.23]
  - - [64, 93, 688, 93]
    - [288, 5497.01]
  - - [4096, 3995, 1, 1024]
    - [244, 9776.57]
  - - [64, 147, 432, 147]
    - [274, 6233.78]
  - - [4096, 3491, 1, 1024]
    - [244, 9742.84]
  - - [4096, 3348, 1, 1024]
    - [256, 9634.01]
  - - [4096, 3925, 1, 1024]
    - [255, 9848.44]
  - - [4096, 3894, 1, 1024]
    - [255, 9812.45]
  - - [1024, 3456, 1, 4096]
    - [264, 9317.81]
  - - [1024, 3394, 1, 4096]
    - [263, 9148.76]
  - - [64, 100, 624, 102]
    - [285, 5416.85]
  - - [4096, 3165, 1, 1024]
    - [255, 9743.25]
  - - [4096, 3470, 1, 1024]
    - [245, 9690.94]
  - - [1024, 3014, 1, 4096]
    - [246, 9486.16]
  - - [1024, 3375, 1, 4096]
    - [264, 9082.61]
  - - [4096, 3859, 1, 1024]
    - [255, 9738.77]
  - - [4096, 3365, 1, 1024]
    - [256, 9694.64]
  - - [1024, 3162, 1, 4096]
    - [257, 8550.21]
  - - [1024, 3840, 1, 33708]
    - [254, 9408.98]
  - - [1024, 3437, 1, 4096]
    - [264, 9270.39]
  - - [4096, 3319, 1, 1024]
    - [245, 9927.05]
  - - [1024, 3320, 1, 4096]
    - [264, 8962.19]
  - - [64, 23, 2720, 23]
    - [287, 2569.43]
  - - [4096, 3328, 1, 1024]
    - [244, 9997.31]
  - - [1024, 3235, 1, 4096]
    - [264, 8724.21]
  - - [4096, 3282, 1, 1024]
    - [245, 9827.03]
  - - [1024, 3367, 1, 4096]
    - [257, 9083.92]
  - - [1024, 3542, 1, 4096]
    - [264, 9533.0]
  - - [64, 177, 352, 177]
    - [250, 6817.81]
  - - [4096, 3145, 1, 1024]
    - [241, 9710.18]
  - - [4096, 3514, 1, 1024]
    - [244, 9792.96]
  - - [1024, 3432, 1, 4096]
    - [264, 9249.29]
  - - [4096, 3409, 1, 1024]
    - [240, 9721.5]
  - - [1024, 4012, 1, 33708]
    - [244, 9773.25]
  - - [4096, 3876, 1, 1024]
    - [241, 9745.55]
  - - [4096, 3299, 1, 1024]
    - [244, 9873.43]
  - - [1024, 3168, 1, 4096]
    - [257, 8597.03]
  - - [4096, 3681, 1, 1024]
    - [256, 9839.93]
  - - [4096, 3531, 1, 1024]
    - [245, 9847.66]
  - - [4096, 3388, 1, 1024]
    - [256, 9772.18]
  - - [1024, 3720, 1, 4096]
    - [245, 8951.5]
  - - [1024, 3332, 1, 4096]
    - [264, 8978.87]
  - - [1024, 3273, 1, 4096]
    - [258, 8982.39]
  - - [1024, 2935, 1, 4096]
    - [247, 9224.79]
  - - [1024, 3467, 1, 4096]
    - [261, 9329.23]
  - - [4096, 3542, 1, 1024]
    - [244, 9858.41]
  - - [1024, 3130, 1, 4096]
    - [243, 8526.56]
  - - [1024, 3405, 1, 4096]
    - [264, 9163.34]
  - - [1024, 3960, 1, 1024]
    - [242, 9280.26]
  - - [4096, 3405, 1, 1024]
    - [255, 9710.1]
  - - [512, 512, 1, 1024]
    - [441, 6670.86]
  - - [8, 500, 1, 512]
    - [337, 228.571]
  - - [512, 512, 1, 2000]
    - [474, 7629.34]
  - - [32, 512, 1, 512]
    - [334, 903.945]
  - - [100, 1024, 1, 2048]
    - [396, 3196.88]
  - - [8, 512, 1, 500]
    - [327, 237.037]
  - - [8, 500, 1, 1024]
    - [391, 289.266]
  - - [100, 2000, 1, 1024]
    - [430, 3368.42]
  - - [64, 1024, 1, 100]
    - [329, 941.609]
  - - [64, 1024, 1, 500]
    - [456, 2659.74]
  - - [64, 1024, 1, 1024]
    - [394, 2452.81]
  - - [128, 2000, 1, 100]
    - [450, 2560.0]
  - - [2, 500, 1, 2048]
    - [391, 72.1127]
  - - [16, 512, 1, 10]
    - [305, 18.2857]
  - - [64, 2000, 1, 1024]
    - [461, 2800.68]
  - - [100, 1024, 1, 1024]
    - [389, 3034.07]
  - - [8, 512, 1, 10]
    - [367, 9.14286]
  - - [16, 500, 1, 2048]
    - [391, 565.746]
  - - [10, 100, 1, 500]
    - [327, 58.4112]
  - - [16, 100, 1, 10]
    - [367, 3.57143]
  - - [500, 1024, 1, 512]
    - [457, 6514.51]
  - - [128, 1024, 1, 512]
    - [475, 4194.3]
  - - [512, 500, 1, 2000]
    - [433, 7347.88]
  - - [2, 100, 1, 2000]
    - [327, 20.8333]
  - - [500, 512, 1, 100]
    - [449, 2539.68]
  - - [100, 1024, 1, 500]
    - [475, 3216.08]
  - - [256, 100, 1, 2048]
    - [485, 1689.07]
  - - [2, 512, 1, 512]
    - [341, 50.4123]
  - - [128, 2000, 1, 512]
    - [461, 4641.36]
  - - [2, 100, 1, 10]
    - [305, 0.396825]
  - - [16, 2000, 1, 2048]
    - [349, 1266.15]
  - - [200, 100, 1, 100]
    - [495, 316.456]
  - - [256, 1024, 1, 100]
    - [451, 2685.9]
  - - [200, 500, 1, 1024]
    - [500, 3282.05]
  - - [500, 100, 1, 100]
    - [414, 631.313]
  - - [4, 100, 1, 10]
    - [312, 0.877193]
  - - [32, 100, 1, 512]
    - [391, 198.835]
  - - [100, 2000, 1, 512]
    - [461, 3832.34]
  - - [16, 1024, 1, 512]
    - [375, 794.376]
  - - [200, 512, 1, 100]
    - [493, 1306.12]
  - - [4, 1024, 1, 1024]
    - [334, 213.125]
  - - [512, 1024, 1, 512]
    - [458, 7049.25]
  - - [4, 512, 1, 10]
    - [366, 4.49123]
  - - [2, 2048, 1, 2000]
    - [327, 300.293]
  - - [64, 2048, 1, 10]
    - [487, 240.941]
  - - [128, 100, 1, 10]
    - [492, 27.5862]
  - - [4, 512, 1, 2048]
    - [327, 146.449]
  - - [64, 2048, 1, 500]
    - [467, 4015.69]
  - - [512, 512, 1, 512]
    - [422, 6123.07]
  - - [500, 500, 1, 2000]
    - [433, 7126.57]
  - - [10, 1024, 1, 2000]
    - [400, 807.571]
  - - [256, 100, 1, 100]
    - [412, 296.296]
  - - [32, 2000, 1, 2048]
    - [355, 2167.2]
  - - [64, 1024, 1, 2048]
    - [388, 2383.13]
  - - [200, 2048, 1, 512]
    - [463, 5263.94]
  - - [256, 500, 1, 10]
    - [445, 210.526]
  - - [16, 1024, 1, 100]
    - [325, 262.564]
  - - [32, 1024, 1, 1024]
    - [330, 1476.87]
  - - [512, 500, 1, 512]
    - [419, 5851.43]
  - - [128, 1024, 1, 2000]
    - [503, 5516.5]
  - - [8, 100, 1, 500]
    - [327, 46.2963]
  - - [100, 2000, 1, 2048]
    - [482, 3715.53]
  - - [10, 512, 1, 512]
    - [337, 292.571]
  - - [8, 500, 1, 10]
    - [366, 8.77193]
  - - [10, 2000, 1, 1024]
    - [380, 640.0]
  - - [16, 1024, 1, 10]
    - [365, 36.5714]
  - - [16, 512, 1, 2048]
    - [344, 585.797]
  - - [256, 512, 1, 10]
    - [410, 230.761]
  - - [2, 2000, 1, 100]
    - [372, 64.1026]
  - - [128, 512, 1, 2048]
    - [339, 3106.89]
  - - [128, 512, 1, 100]
    - [332, 952.558]
  - - [512, 2000, 1, 1024]
    - [429, 8065.97]
  - - [64, 500, 1, 2048]
    - [498, 1857.6]
  - - [64, 2000, 1, 2048]
    - [480, 3442.02]
  - - [64, 2048, 1, 512]
    - [481, 3315.66]
  - - [10, 2000, 1, 512]
    - [327, 785.276]
  - - [32, 2000, 1, 500]
    - [330, 2500.0]
  - - [64, 2000, 1, 10]
    - [318, 231.884]
  - - [500, 100, 1, 10]
    - [415, 88.0282]
  - - [128, 1024, 1, 500]
    - [466, 4096.0]
  - - [64, 100, 1, 2048]
    - [327, 587.24]
  - - [64, 100, 1, 10]
    - [486, 11.9403]
  - - [16, 512, 1, 500]
    - [337, 461.261]
  - - [32, 2000, 1, 1024]
    - [324, 1713.81]
  - - [200, 512, 1, 1024]
    - [503, 3244.36]
  - - [128, 2048, 1, 10]
    - [319, 455.111]
  - - [200, 100, 1, 2000]
    - [327, 1461.99]
  - - [2, 100, 1, 512]
    - [327, 12.4272]
  - - [64, 2048, 1, 100]
    - [493, 1689.07]
  - - [32, 512, 1, 100]
    - [326, 265.974]
  - - [16, 512, 1, 1024]
    - [391, 569.878]
  - - [4, 1024, 1, 512]
    - [381, 208.051]
  - - [64, 2000, 1, 100]
    - [493, 1649.48]
  - - [512, 2048, 1, 512]
    - [429, 7848.99]
  - - [2, 500, 1, 500]
    - [315, 53.4188]
  - - [32, 100, 1, 100]
    - [326, 57.1429]
  - - [100, 500, 1, 2000]
    - [330, 2783.96]
  - - [200, 2000, 1, 100]
    - [402, 2994.01]
  - - [10, 512, 1, 10]
    - [362, 11.0345]
  - - [100, 500, 1, 2048]
    - [502, 2361.62]
  - - [4, 2048, 1, 500]
    - [337, 379.259]
  - - [200, 500, 1, 100]
    - [463, 1288.66]
  - - [500, 500, 1, 500]
    - [419, 5425.35]
  - - [2, 100, 1, 1024]
    - [391, 16.2025]
  - - [128, 2048, 1, 512]
    - [477, 4699.5]
  - - [200, 2000, 1, 1024]
    - [427, 4620.94]
  - - [32, 512, 1, 1024]
    - [390, 1028.02]
  - - [100, 2048, 1, 500]
    - [451, 4142.39]
  - - [256, 100, 1, 1024]
    - [481, 1443.52]
  - - [16, 2000, 1, 500]
    - [376, 1428.57]
  - - [128, 100, 1, 100]
    - [326, 213.333]
  - - [500, 500, 1, 2048]
    - [423, 6639.0]
  - - [32, 512, 1, 10]
    - [359, 35.9298]
  - - [128, 100, 1, 1024]
    - [387, 791.498]
  - - [16, 500, 1, 2000]
    - [400, 694.444]
  - - [4, 2048, 1, 100]
    - [371, 129.62]
  - - [64, 500, 1, 500]
    - [313, 1333.33]
  - - [500, 1024, 1, 2048]
    - [432, 7031.76]
  - - [512, 2048, 1, 100]
    - [407, 5285.16]
  - - [128, 512, 1, 1024]
    - [499, 2519.1]
  - - [128, 512, 1, 2000]
    - [497, 3608.81]
  - - [128, 2000, 1, 2000]
    - [470, 7017.54]
  - - [2, 512, 1, 10]
    - [363, 2.03175]
  - - [10, 512, 1, 500]
    - [327, 293.578]
  - - [4, 1024, 1, 2000]
    - [347, 326.115]
  - - [256, 100, 1, 2000]
    - [484, 1767.96]
  - - [512, 2048, 1, 2000]
    - [429, 8674.52]
  - - [100, 100, 1, 10]
    - [491, 21.5517]
  - - [256, 500, 1, 1024]
    - [431, 4833.04]
  - - [128, 512, 1, 10]
    - [319, 132.129]
  - - [256, 100, 1, 500]
    - [478, 914.286]
  - - [64, 100, 1, 512]
    - [385, 369.009]
  - - [64, 512, 1, 500]
    - [327, 1600.0]
  - - [64, 2048, 1, 2000]
    - [481, 5925.5]
  - - [100, 2048, 1, 1024]
    - [439, 3260.5]
  - - [200, 2000, 1, 10]
    - [319, 595.238]
  - - [128, 1024, 1, 100]
    - [463, 1689.07]
  - - [16, 2000, 1, 100]
    - [326, 493.827]
  - - [8, 100, 1, 512]
    - [327, 49.7087]
  - - [500, 2048, 1, 1024]
    - [429, 7651.61]
  - - [500, 2000, 1, 10]
    - [417, 1008.06]
  - - [32, 100, 1, 500]
    - [391, 186.916]
  - - [256, 1024, 1, 2048]
    - [432, 6190.85]
  - - [32, 500, 1, 2048]
    - [327, 1083.6]
  - - [4, 2000, 1, 10]
    - [370, 17.5439]
  - - [128, 500, 1, 2000]
    - [387, 3516.48]
  - - [8, 1024, 1, 10]
    - [361, 17.9649]
  - - [2, 500, 1, 100]
    - [306, 16.0256]
  - - [10, 500, 1, 512]
    - [327, 290.909]
  - - [10, 2000, 1, 10]
    - [305, 38.4615]
  - - [500, 512, 1, 512]
    - [422, 5893.53]
  - - [32, 500, 1, 500]
    - [327, 892.857]
  - - [256, 500, 1, 2000]
    - [436, 6237.82]
  - - [100, 500, 1, 100]
    - [338, 726.744]
  - - [500, 2048, 1, 100]
    - [411, 4866.92]
  - - [10, 1024, 1, 512]
    - [327, 520.127]
  - - [2, 2048, 1, 512]
    - [337, 151.528]
  - - [256, 512, 1, 100]
    - [416, 1590.68]
  - - [10, 2048, 1, 100]
    - [327, 324.051]
  - - [8, 2048, 1, 100]
    - [382, 256.0]
  - - [512, 100, 1, 512]
    - [478, 2100.51]
  - - [4, 500, 1, 500]
    - [327, 115.741]
  - - [64, 100, 1, 1024]
    - [327, 450.11]
  - - [2, 2048, 1, 1024]
    - [384, 137.608]
  - - [2, 500, 1, 2000]
    - [353, 90.2527]
  - - [512, 1024, 1, 500]
    - [458, 6898.53]
  - - [128, 2000, 1, 500]
    - [463, 5161.29]
  - - [32, 512, 1, 2048]
    - [397, 1103.76]
  - - [10, 100, 1, 2000]
    - [327, 105.932]
  - - [4, 100, 1, 512]
    - [327, 24.6154]
  - - [2, 512, 1, 2048]
    - [391, 73.2246]
  - - [200, 512, 1, 2048]
    - [503, 3953.91]
  - - [200, 2000, 1, 2000]
    - [465, 6230.53]
  - - [100, 100, 1, 2000]
    - [327, 827.815]
  - - [500, 2048, 1, 2000]
    - [428, 8387.94]
  - - [64, 2048, 1, 2048]
    - [473, 3406.54]
  - - [16, 2000, 1, 1024]
    - [333, 1024.0]
  - - [512, 2048, 1, 1024]
    - [406, 8061.12]
  - - [10, 500, 1, 500]
    - [337, 284.091]
  - - [200, 1024, 1, 2048]
    - [501, 4886.19]
  - - [10, 2000, 1, 2000]
    - [327, 1449.28]
  - - [8, 2000, 1, 500]
    - [376, 719.424]
  - - [2, 100, 1, 2048]
    - [391, 19.845]
  - - [32, 100, 1, 2048]
    - [391, 323.794]
  - - [512, 512, 1, 10]
    - [448, 420.103]
  - - [512, 500, 1, 10]
    - [453, 376.471]
  - - [16, 100, 1, 1024]
    - [337, 129.62]
  - - [2, 500, 1, 10]
    - [301, 2.11864]
  - - [200, 512, 1, 10]
    - [303, 188.235]
  - - [512, 1024, 1, 100]
    - [403, 3877.87]
  - - [16, 2000, 1, 2000]
    - [327, 2222.22]
  - - [500, 500, 1, 1024]
    - [423, 6130.27]
  - - [500, 100, 1, 2048]
    - [478, 2949.31]
  - - [256, 1024, 1, 512]
    - [442, 5886.74]
  - - [256, 500, 1, 512]
    - [420, 4380.75]
  - - [16, 1024, 1, 2000]
    - [391, 1208.26]
  - - [200, 500, 1, 2048]
    - [503, 3855.42]
  - - [256, 2000, 1, 10]
    - [405, 727.273]
  - - [10, 2048, 1, 2048]
    - [358, 823.058]
  - - [512, 2000, 1, 100]
    - [407, 5120.0]
  - - [10, 1024, 1, 1024]
    - [334, 553.046]
  - - [512, 2000, 1, 2048]
    - [435, 7563.3]
  - - [500, 1024, 1, 500]
    - [459, 6570.84]
  - - [500, 100, 1, 512]
    - [478, 2038.22]
  - - [256, 2000, 1, 100]
    - [427, 3764.71]
  - - [512, 1024, 1, 2048]
    - [471, 7286.52]
  - - [32, 512, 1, 500]
    - [327, 898.246]
  - - [100, 2000, 1, 10]
    - [319, 333.333]
  - - [100, 500, 1, 512]
    - [497, 2176.87]
  - - [8, 2000, 1, 512]
    - [376, 602.353]
  - - [100, 2048, 1, 2048]
    - [483, 3694.77]
  - - [128, 1024, 1, 2048]
    - [502, 4168.25]
  - - [8, 500, 1, 2000]
    - [401, 352.113]
  - - [100, 2000, 1, 500]
    - [451, 4045.31]
  - - [100, 2048, 1, 100]
    - [451, 2081.3]
  - - [4, 100, 1, 1024]
    - [327, 33.0323]
  - - [500, 2048, 1, 2048]
    - [435, 7764.93]
  - - [2, 2000, 1, 2048]
    - [346, 166.234]
  - - [200, 2048, 1, 10]
    - [320, 609.524]
  - - [2, 500, 1, 1024]
    - [391, 75.2941]
  - - [100, 500, 1, 1024]
    - [387, 1975.31]
  - - [16, 2048, 1, 500]
    - [327, 1473.38]
  - - [100, 1024, 1, 10]
    - [487, 185.507]
  - - [8, 2048, 1, 1024]
    - [383, 543.304]
  - - [2, 2000, 1, 500]
    - [327, 179.856]
  - - [32, 100, 1, 1024]
    - [327, 267.712]
  - - [500, 2000, 1, 512]
    - [457, 7087.49]
  - - [64, 100, 1, 2000]
    - [337, 615.385]
  - - [100, 1024, 1, 2000]
    - [500, 4224.42]
  - - [64, 500, 1, 10]
    - [302, 63.4921]
  - - [32, 2048, 1, 100]
    - [323, 941.609]
  - - [64, 500, 1, 512]
    - [327, 1575.38]
  - - [10, 100, 1, 1024]
    - [337, 82.5806]
  - - [16, 512, 1, 100]
    - [326, 148.406]
  - - [4, 100, 1, 2000]
    - [400, 43.8597]
  - - [2, 512, 1, 1024]
    - [391, 74.052]
  - - [64, 512, 1, 1024]
    - [392, 1570.9]
  - - [10, 2048, 1, 500]
    - [327, 920.863]
  - - [4, 2000, 1, 2048]
    - [346, 326.115]
  - - [512, 100, 1, 2048]
    - [481, 3084.05]
  - - [32, 100, 1, 2000]
    - [327, 343.348]
  - - [256, 512, 1, 500]
    - [420, 4311.58]
  - - [100, 2000, 1, 100]
    - [451, 2016.13]
  - - [8, 2000, 1, 1024]
    - [340, 544.681]
  - - [4, 512, 1, 500]
    - [327, 118.519]
  - - [128, 1024, 1, 10]
    - [490, 244.537]
  - - [4, 500, 1, 1024]
    - [327, 144.633]
  - - [32, 2048, 1, 512]
    - [330, 2139.95]
  - - [32, 100, 1, 10]
    - [305, 7.01754]
  - - [100, 2048, 1, 10]
    - [494, 341.333]
  - - [512, 500, 1, 100]
    - [455, 2461.54]
  - - [128, 2000, 1, 1024]
    - [439, 4174.27]
  - - [200, 1024, 1, 500]
    - [451, 4295.3]
  - - [32, 2048, 1, 1024]
    - [354, 1667.72]
  - - [10, 1024, 1, 2048]
    - [345, 555.39]
  - - [8, 500, 1, 100]
    - [326, 71.4286]
  - - [32, 2048, 1, 500]
    - [330, 2528.4]
  - - [200, 100, 1, 1024]
    - [339, 1071.13]
  - - [16, 100, 1, 100]
    - [316, 28.5714]
  - - [8, 1024, 1, 2000]
    - [400, 654.313]
  - - [4, 512, 1, 100]
    - [326, 36.5714]
  - - [16, 500, 1, 100]
    - [326, 142.857]
  - - [8, 1024, 1, 2048]
    - [352, 441.506]
  - - [16, 1024, 1, 2048]
    - [353, 886.745]
  - - [10, 2048, 1, 1024]
    - [331, 639.376]
  - - [64, 512, 1, 100]
    - [326, 518.481]
  - - [2, 100, 1, 500]
    - [327, 9.61538]
  - - [2, 500, 1, 512]
    - [333, 48.1203]
  - - [256, 512, 1, 2000]
    - [436, 6450.39]
  - - [128, 500, 1, 1024]
    - [330, 2497.56]
  - - [10, 100, 1, 10]
    - [367, 2.23214]
  - - [8, 2048, 1, 2048]
    - [317, 643.298]
  - - [16, 2048, 1, 2048]
    - [357, 1337.9]
  - - [64, 1024, 1, 10]
    - [320, 132.129]
  - - [500, 100, 1, 500]
    - [478, 1940.99]
  - - [256, 1024, 1, 2000]
    - [474, 7629.34]
  - - [200, 512, 1, 500]
    - [463, 3232.32]
  - - [8, 2000, 1, 10]
    - [364, 32.2581]
  - - [64, 2000, 1, 512]
    - [462, 3225.2]
  - - [2, 512, 1, 100]
    - [306, 16.6234]
  - - [4, 2000, 1, 2000]
    - [327, 586.51]
  - - [200, 1024, 1, 100]
    - [451, 2133.33]
  - - [16, 100, 1, 500]
    - [391, 92.5926]
  - - [128, 100, 1, 500]
    - [387, 526.316]
  - - [500, 1024, 1, 1024]
    - [421, 7201.76]
  - - [200, 1024, 1, 1024]
    - [473, 4519.72]
  - - [8, 2048, 1, 512]
    - [337, 624.152]
  - - [200, 2000, 1, 500]
    - [427, 5186.72]
  - - [512, 100, 1, 1024]
    - [478, 2742.09]
  - - [16, 100, 1, 2000]
    - [337, 168.776]
  - - [500, 512, 1, 2000]
    - [474, 7289.29]
  - - [8, 2000, 1, 2048]
    - [348, 668.189]
  - - [256, 2048, 1, 100]
    - [409, 3924.31]
  - - [32, 2048, 1, 2000]
    - [341, 3882.46]
  - - [200, 500, 1, 512]
    - [466, 3368.42]
  - - [10, 512, 1, 100]
    - [326, 91.4286]
  - - [16, 2000, 1, 10]
    - [304, 61.5385]
  - - [8, 512, 1, 100]
    - [326, 72.1127]
  - - [256, 512, 1, 512]
    - [431, 4583.94]
  - - [500, 2000, 1, 1024]
    - [406, 7569.49]
  - - [512, 512, 1, 500]
    - [422, 5708.71]
  - - [256, 2048, 1, 1024]
    - [446, 5923.11]
  - - [8, 2048, 1, 2000]
    - [327, 1153.8]
  - - [100, 512, 1, 2048]
    - [393, 2383.13]
  - - [100, 1024, 1, 512]
    - [478, 3343.67]
  - - [128, 100, 1, 2000]
    - [496, 1084.75]
  - - [4, 2048, 1, 2048]
    - [345, 332.354]
  - - [2, 1024, 1, 2000]
    - [356, 161.006]
  - - [100, 512, 1, 512]
    - [330, 2184.53]
  - - [128, 1024, 1, 1024]
    - [473, 3847.99]
  - - [200, 2048, 1, 1024]
    - [408, 4547.16]
  - - [32, 1024, 1, 2000]
    - [337, 2416.52]
  - - [128, 500, 1, 100]
    - [332, 919.54]
  - - [200, 512, 1, 2000]
    - [500, 4238.41]
  - - [10, 2048, 1, 2000]
    - [337, 1454.55]
  - - [256, 1024, 1, 500]
    - [434, 5669.2]
  - - [100, 100, 1, 100]
    - [326, 171.233]
  - - [8, 512, 1, 1024]
    - [395, 286.496]
  - - [200, 1024, 1, 512]
    - [451, 4354.55]
  - - [256, 500, 1, 500]
    - [436, 4020.1]
  - - [200, 100, 1, 500]
    - [500, 702.247]
  - - [2, 1024, 1, 2048]
    - [346, 112.75]
  - - [256, 500, 1, 2048]
    - [436, 5041.23]
  - - [512, 2048, 1, 500]
    - [429, 7710.12]
  - - [512, 100, 1, 2000]
    - [478, 3099.27]
  - - [512, 500, 1, 1024]
    - [437, 6463.12]
  - - [16, 512, 1, 2000]
    - [353, 721.127]
  - - [64, 500, 1, 1024]
    - [392, 1528.36]
  - - [512, 2000, 1, 10]
    - [413, 1174.31]
  - - [256, 512, 1, 1024]
    - [431, 4978.4]
  - - [10, 512, 1, 1024]
    - [391, 370.26]
  - - [512, 100, 1, 100]
    - [414, 659.794]
  - - [8, 2000, 1, 100]
    - [326, 256.41]
  - - [128, 2048, 1, 1024]
    - [439, 4173.44]
  - - [2, 2000, 1, 2000]
    - [327, 250.627]
  - - [16, 2048, 1, 1024]
    - [374, 1045.96]
  - - [500, 512, 1, 500]
    - [419, 5517.24]
  - - [8, 100, 1, 1024]
    - [392, 64.0]
  - - [10, 100, 1, 100]
    - [316, 17.8571]
  - - [200, 500, 1, 500]
    - [466, 3140.7]
  - - [10, 500, 1, 2000]
    - [353, 444.84]
  - - [500, 100, 1, 2000]
    - [481, 2969.12]
  - - [100, 512, 1, 2000]
    - [393, 2776.57]
  - - [500, 1024, 1, 2000]
    - [472, 8020.05]
  - - [32, 2000, 1, 2000]
    - [333, 3827.75]
  - - [64, 1024, 1, 512]
    - [497, 2573.19]
  - - [64, 2000, 1, 2000]
    - [466, 5797.1]
  - - [32, 500, 1, 100]
    - [326, 266.667]
  - - [128, 2000, 1, 2048]
    - [482, 4547.95]
  - - [10, 100, 1, 2048]
    - [391, 98.4615]
  - - [32, 2048, 1, 2048]
    - [354, 2213.35]
  - - [64, 100, 1, 100]
    - [327, 96.3855]
  - - [2, 1024, 1, 100]
    - [377, 34.5946]
  - - [256, 1024, 1, 10]
    - [447, 425.558]
  - - [256, 1024, 1, 1024]
    - [440, 5482.75]
  - - [64, 500, 1, 2000]
    - [327, 2056.56]
  - - [512, 2000, 1, 512]
    - [425, 7550.23]
  - - [8, 512, 1, 512]
    - [334, 231.986]
  - - [8, 512, 1, 2048]
    - [327, 290.464]
  - - [100, 100, 1, 1024]
    - [497, 624.39]
  - - [2, 2048, 1, 10]
    - [370, 8.82759]
  - - [4, 2048, 1, 512]
    - [376, 312.076]
  - - [4, 2048, 1, 10]
    - [369, 17.9649]
  - - [8, 100, 1, 2000]
    - [346, 85.8369]
  - - [2, 1024, 1, 1024]
    - [343, 101.214]
  - - [16, 2048, 1, 100]
    - [327, 518.481]
  - - [16, 512, 1, 512]
    - [337, 455.903]
  - - [32, 500, 1, 512]
    - [334, 906.195]
  - - [500, 2000, 1, 2000]
    - [429, 8143.32]
  - - [500, 1024, 1, 10]
    - [410, 680.851]
  - - [32, 500, 1, 1024]
    - [386, 1008.87]
  - - [32, 500, 1, 10]
    - [322, 33.3333]
  - - [500, 500, 1, 10]
    - [451, 367.647]
  - - [4, 2000, 1, 500]
    - [337, 370.37]
  - - [10, 2000, 1, 500]
    - [327, 899.281]
  - - [32, 2000, 1, 512]
    - [339, 2089.8]
  - - [256, 500, 1, 100]
    - [452, 1495.33]
  - - [256, 2048, 1, 10]
    - [410, 789.59]
  - - [4, 1024, 1, 500]
    - [327, 222.609]
  - - [256, 512, 1, 2048]
    - [436, 5292.5]
  - - [2, 2000, 1, 1024]
    - [374, 137.265]
  - - [256, 100, 1, 512]
    - [478, 1085.03]
  - - [8, 1024, 1, 500]
    - [327, 441.379]
  - - [256, 2048, 1, 500]
    - [457, 7031.76]
  - - [256, 2048, 1, 2048]
    - [420, 6771.83]
  - - [2, 2000, 1, 512]
    - [381, 159.006]
  - - [256, 2000, 1, 512]
    - [424, 6527.49]
  - - [4, 1024, 1, 100]
    - [373, 70.137]
  - - [512, 1024, 1, 2000]
    - [458, 8295.7]
  - - [100, 500, 1, 500]
    - [330, 2016.13]
  - - [4, 2048, 1, 1024]
    - [378, 284.939]
  - - [2, 1024, 1, 500]
    - [327, 109.402]
  - - [64, 100, 1, 500]
    - [327, 296.296]
  - - [256, 2000, 1, 2000]
    - [435, 8152.87]
  - - [2, 512, 1, 500]
    - [333, 44.7552]
  - - [8, 2048, 1, 500]
    - [327, 736.691]
  - - [10, 1024, 1, 500]
    - [327, 547.009]
  - - [4, 2048, 1, 2000]
    - [337, 604.13]
  - - [200, 1024, 1, 2000]
    - [504, 5400.84]
  - - [128, 500, 1, 512]
    - [497, 2730.67]
  - - [10, 500, 1, 2048]
    - [391, 359.551]
  - - [256, 2048, 1, 2000]
    - [435, 8375.21]
  - - [8, 2000, 1, 2000]
    - [337, 1146.13]
  - - [100, 2048, 1, 512]
    - [460, 3936.1]
  - - [512, 500, 1, 2048]
    - [436, 6756.29]
  - - [200, 2048, 1, 100]
    - [427, 3180.12]
  - - [128, 512, 1, 512]
    - [330, 2872.81]
  - - [200, 2000, 1, 2048]
    - [476, 4818.82]
  - - [4, 2000, 1, 1024]
    - [374, 275.269]
  - - [64, 512, 1, 10]
    - [489, 69.4237]
  - - [32, 500, 1, 2000]
    - [356, 1246.11]
  - - [128, 2048, 1, 2000]
    - [469, 7233.55]
  - - [100, 100, 1, 2048]
    - [327, 790.123]
  - - [500, 2048, 1, 512]
    - [457, 7249.56]
  - - [200, 100, 1, 512]
    - [333, 748.538]
  - - [32, 2000, 1, 100]
    - [328, 930.233]
  - - [500, 512, 1, 2048]
    - [479, 6639.92]
  - - [500, 2000, 1, 500]
    - [459, 7078.14]
  - - [200, 100, 1, 2048]
    - [337, 1387.53]
  - - [2, 2048, 1, 100]
    - [371, 64.8101]
  - - [8, 100, 1, 10]
    - [312, 1.75439]
  - - [200, 2048, 1, 2048]
    - [476, 5021.92]
  - - [200, 2048, 1, 500]
    - [427, 5355.65]
  - - [100, 100, 1, 500]
    - [497, 416.667]
  - - [8, 2048, 1, 10]
    - [368, 34.7119]
  - - [100, 500, 1, 10]
    - [308, 93.2836]
  - - [200, 500, 1, 2000]
    - [500, 4152.82]
  - - [512, 2000, 1, 500]
    - [429, 7485.38]
  - - [10, 500, 1, 1024]
    - [395, 363.636]
  - - [256, 100, 1, 10]
    - [444, 41.0256]
  - - [500, 512, 1, 1024]
    - [423, 6362.72]
  - - [200, 2048, 1, 2000]
    - [465, 6320.99]
  - - [100, 1024, 1, 100]
    - [464, 1306.12]
  - - [500, 1024, 1, 100]
    - [403, 3699.42]
  - - [10, 512, 1, 2048]
    - [327, 361.08]
  - - [2, 1024, 1, 512]
    - [376, 105.703]
  - - [4, 500, 1, 2048]
    - [399, 143.417]
  - - [100, 512, 1, 100]
    - [332, 744.186]
  - - [16, 500, 1, 512]
    - [327, 453.097]
  - - [10, 1024, 1, 100]
    - [325, 166.234]
  - - [8, 1024, 1, 100]
    - [373, 140.274]
  - - [64, 2000, 1, 500]
    - [468, 3940.89]
  - - [64, 1024, 1, 2000]
    - [333, 3531.03]
  - - [10, 100, 1, 512]
    - [327, 61.5385]
  - - [4, 500, 1, 2000]
    - [353, 173.01]
  - - [512, 1024, 1, 10]
    - [404, 736.36]
  - - [128, 2048, 1, 2048]
    - [467, 4596.5]
  - - [4, 100, 1, 100]
    - [316, 7.14286]
  - - [32, 1024, 1, 512]
    - [376, 1519.68]
  - - [8, 512, 1, 2000]
    - [401, 356.794]
  - - [100, 100, 1, 512]
    - [341, 426.667]
  - - [2, 2048, 1, 2048]
    - [350, 170.778]
  - - [2, 512, 1, 2000]
    - [353, 90.7801]
  - - [16, 500, 1, 10]
    - [326, 18.1818]
  - - [10, 500, 1, 100]
    - [326, 88.0282]
  - - [4, 100, 1, 500]
    - [391, 23.5849]
  - - [512, 1024, 1, 1024]
    - [443, 7431.77]
  - - [64, 500, 1, 100]
    - [336, 506.329]
  - - [128, 2000, 1, 10]
    - [494, 432.432]
  - - [10, 2000, 1, 2048]
    - [357, 806.299]
  - - [2, 100, 1, 100]
    - [314, 3.125]
  - - [10, 512, 1, 2000]
    - [346, 462.094]
  - - [8, 500, 1, 500]
    - [327, 231.481]
  - - [4, 500, 1, 512]
    - [327, 118.519]
  - - [10, 500, 1, 10]
    - [321, 10.9649]
  - - [64, 512, 1, 2000]
    - [327, 2116.8]
  - - [500, 512, 1, 10]
    - [448, 395.062]
  - - [200, 512, 1, 512]
    - [466, 3449.26]
  - - [512, 500, 1, 500]
    - [422, 5536.33]
  - - [32, 512, 1, 2000]
    - [337, 1264.2]
  - - [128, 500, 1, 2048]
    - [393, 3006.24]
  - - [500, 2048, 1, 10]
    - [418, 1049.18]
  - - [512, 512, 1, 100]
    - [455, 2664.06]
  - - [200, 2000, 1, 512]
    - [463, 5192.7]
  - - [500, 500, 1, 512]
    - [419, 5673.76]
  - - [128, 2048, 1, 500]
    - [451, 5251.28]
  - - [4, 512, 1, 512]
    - [327, 123.653]
  - - [16, 2048, 1, 2000]
    - [343, 2294.68]
  - - [16, 500, 1, 1024]
    - [327, 562.637]
  - - [256, 2000, 1, 500]
    - [457, 6639.0]
  - - [10, 1024, 1, 10]
    - [307, 20.9836]
  - - [16, 500, 1, 500]
    - [327, 446.429]
  - - [10, 2048, 1, 512]
    - [325, 784.862]
  - - [200, 500, 1, 10]
    - [300, 176.056]
  - - [256, 2048, 1, 512]
    - [454, 6540.83]
  - - [256, 2000, 1, 2048]
    - [431, 6670.33]
  - - [500, 2048, 1, 500]
    - [459, 7264.47]
  - - [500, 100, 1, 1024]
    - [481, 2700.42]
  - - [16, 100, 1, 512]
    - [391, 96.6038]
  - - [64, 512, 1, 2048]
    - [392, 1868.29]
  - - [32, 1024, 1, 10]
    - [303, 69.4237]
  - - [16, 2048, 1, 512]
    - [376, 1226.4]
  - - [8, 1024, 1, 512]
    - [376, 416.102]
  - - [4, 1024, 1, 2048]
    - [398, 223.101]
  - - [100, 2048, 1, 2000]
    - [471, 5614.04]
  - - [256, 2000, 1, 1024]
    - [427, 5758.88]
  - - [64, 512, 1, 512]
    - [496, 1651.3]
  - - [200, 1024, 1, 10]
    - [310, 341.333]
  - - [128, 500, 1, 500]
    - [339, 2580.65]
  - - [100, 512, 1, 1024]
    - [330, 2041.62]
  - - [16, 1024, 1, 500]
    - [327, 867.797]
  - - [128, 100, 1, 2048]
    - [497, 1011.36]
  - - [100, 512, 1, 500]
    - [330, 2051.28]
  - - [8, 1024, 1, 1024]
    - [343, 424.525]
  - - [2, 2000, 1, 10]
    - [369, 8.47458]
  - - [4, 500, 1, 10]
    - [366, 4.46429]
  - - [500, 2000, 1, 2048]
    - [443, 7444.02]
  - - [4, 2000, 1, 100]
    - [379, 128.205]
  - - [512, 2000, 1, 2000]
    - [429, 8454.43]
  - - [128, 500, 1, 10]
    - [488, 117.647]
  - - [32, 1024, 1, 100]
    - [336, 512.0]
  - - [8, 500, 1, 2048]
    - [351, 286.835]
  - - [16, 1024, 1, 1024]
    - [315, 881.156]
  - - [200, 100, 1, 10]
    - [487, 40.3226]
  - - [512, 100, 1, 500]
    - [481, 1987.58]
  - - [512, 2048, 1, 2048]
    - [438, 8063.55]
  - - [16, 2000, 1, 512]
    - [337, 1204.71]
  - - [64, 2048, 1, 1024]
    - [335, 2853.27]
  - - [32, 2048, 1, 10]
    - [309, 130.032]
  - - [10, 2048, 1, 10]
    - [311, 39.3846]
  - - [4, 2000, 1, 512]
    - [327, 316.049]
  - - [4, 500, 1, 100]
    - [326, 35.7143]
  - - [8, 100, 1, 2048]
    - [346, 84.6281]
  - - [512, 2048, 1, 10]
    - [426, 1224.97]
  - - [512, 100, 1, 10]
    - [415, 90.1408]
  - - [4, 512, 1, 1024]
    - [327, 143.248]
  - - [16, 2048, 1, 10]
    - [360, 65.0159]
  - - [500, 2000, 1, 100]
    - [411, 4716.98]
  - - [32, 1024, 1, 2048]
    - [354, 1582.76]
  - - [100, 2000, 1, 2000]
    - [471, 5512.68]
  - - [128, 100, 1, 512]
    - [497, 561.096]
  - - [500, 500, 1, 100]
    - [451, 2460.63]
  - - [32, 2000, 1, 10]
    - [303, 119.403]
  - - [128, 2048, 1, 100]
    - [451, 2708.1]
  - - [10, 2000, 1, 100]
    - [326, 316.456]
  - - [2, 2048, 1, 500]
    - [337, 191.045]
  - - [32, 1024, 1, 500]
    - [337, 1563.36]
  - - [4, 1024, 1, 10]
    - [366, 9.14286]
  - - [100, 512, 1, 10]
    - [492, 96.9697]
  - - [8, 100, 1, 100]
    - [342, 14.2857]
  - - [128, 512, 1, 500]
    - [330, 2677.12]
  - - [16, 100, 1, 2048]
    - [353, 161.897]
  - - [2, 1024, 1, 10]
    - [366, 4.49123]
  - - [4, 100, 1, 2048]
    - [346, 41.7959]
  - - [4, 512, 1, 2000]
    - [346, 180.282]
  - - [4096, 64, 1, 2048]
    - [546, 7247.18]
  - - [1024, 10080, 1, 1024]
    - [534, 9833.37]
  - - [1024, 1131, 1, 1024]
    - [512, 7551.85]
  - - [36548, 1216, 1, 1024]
    - [524, 10351.5]
  - - [1024, 29, 1, 1024]
    - [556, 1696.91]
  - - [1024, 2592, 1, 1024]
    - [525, 8424.01]
  - - [1024, 1568, 1, 1024]
    - [536, 7511.76]
  - - [4096, 91, 1, 2048]
    - [505, 5599.81]
  - - [1024, 4445, 1, 1024]
    - [523, 9261.12]
  - - [1024, 6272, 1, 1024]
    - [518, 9439.51]
  - - [36548, 3584, 1, 1024]
    - [517, 10393.7]
  - - [1024, 1827, 1, 1024]
    - [536, 8714.32]
  - - [1024, 3220, 1, 1024]
    - [516, 8861.1]
  - - [1024, 1856, 1, 1024]
    - [533, 8826.95]
  - - [1024, 1760, 1, 1024]
    - [533, 8334.1]
  - - [1024, 1600, 1, 1024]
    - [533, 7614.97]
  - - [1024, 1, 1, 21]
    - [537, 0.0]
  - - [36548, 4235, 1, 1024]
    - [517, 10276.7]
  - - [1024, 49, 1, 1024]
    - [552, 2643.02]
  - - [1024, 1984, 1, 1024]
    - [536, 9449.42]
  - - [1024, 14720, 1, 1024]
    - [523, 10033.2]
  - - [1024, 1152, 1, 1024]
    - [506, 7523.44]
  - - [36548, 14976, 1, 1024]
    - [524, 10421.6]
  - - [36548, 1152, 1, 1024]
    - [524, 10258.0]
  - - [4096, 86, 1, 3072]
    - [505, 5308.75]
  - - [1024, 3392, 1, 1024]
    - [518, 9176.44]
  - - [1024, 1408, 1, 1024]
    - [518, 8958.73]
  - - [1024, 2080, 1, 1024]
    - [509, 8396.39]
  - - [1024, 1824, 1, 1024]
    - [527, 8671.61]
  - - [36548, 2432, 1, 1024]
    - [517, 10392.5]
  - - [4096, 29, 1, 2048]
    - [538, 4325.56]
  - - [1024, 1102, 1, 1024]
    - [512, 7204.08]
  - - [4096, 49, 1, 2048]
    - [544, 5609.19]
  - - [36548, 1827, 1, 1024]
    - [524, 10183.1]
  - - [4096, 25, 1, 2048]
    - [539, 3788.21]
  - - [1024, 10176, 1, 1024]
    - [534, 9941.08]
  - - [1024, 774, 1, 1024]
    - [519, 7079.57]
  - - [1024, 1952, 1, 1024]
    - [536, 9300.39]
  - - [4096, 128, 1, 2048]
    - [506, 8274.86]
  - - [1024, 17024, 1, 1024]
    - [516, 9960.62]
  - - [1024, 1472, 1, 1024]
    - [525, 9343.27]
  - - [36548, 4459, 1, 1024]
    - [517, 10358.0]
  - - [4096, 91, 1, 3072]
    - [511, 5509.29]
  - - [1024, 3712, 1, 1024]
    - [525, 9048.56]
  - - [4096, 64, 1, 3072]
    - [558, 7489.83]
  - - [4096, 29, 1, 3072]
    - [538, 4511.68]
  - - [4096, 128, 1, 3072]
    - [505, 8423.73]
  - - [36548, 12928, 1, 1024]
    - [524, 10426.0]
  - - [1024, 1632, 1, 1024]
    - [506, 7761.63]
  - - [1024, 1696, 1, 1024]
    - [531, 8107.19]
  - - [4096, 24, 1, 2048]
    - [538, 3663.15]
  - - [4096, 63, 1, 3072]
    - [547, 7175.27]
  - - [4096, 96, 1, 2048]
    - [506, 5866.18]
  - - [36548, 1764, 1, 1024]
    - [517, 10128.4]
  - - [4096, 32, 1, 2048]
    - [542, 4540.52]
  - - [1024, 35, 1, 1024]
    - [550, 1911.47]
  - - [1024, 1120, 1, 1024]
    - [505, 7289.03]
  - - [4096, 49, 1, 3072]
    - [544, 5751.52]
  - - [1024, 24, 1, 1024]
    - [550, 1391.92]
  - - [1024, 2944, 1, 1024]
    - [526, 9284.83]
  - - [36548, 14080, 1, 1024]
    - [517, 10441.3]
  - - [1024, 1, 1, 1024]
    - [537, 0.0]
  - - [1024, 1280, 1, 1024]
    - [505, 8244.36]
  - - [1024, 13440, 1, 1024]
    - [517, 9799.82]
  - - [1024, 1015, 1, 1024]
    - [525, 9187.75]
  - - [36548, 9120, 1, 1024]
    - [517, 10399.9]
  - - [36548, 1, 1, 1024]
    - [537, 0.0]
  - - [1024, 3008, 1, 1024]
    - [526, 9468.45]
  - - [1024, 2560, 1, 1024]
    - [523, 8879.21]
  - - [1024, 21, 1, 1024]
    - [549, 1234.31]
  - - [1024, 2208, 1, 1024]
    - [505, 8231.17]
  - - [1024, 96, 1, 1024]
    - [555, 3767.34]
  - - [4096, 86, 1, 2048]
    - [506, 5528.99]
  - - [4096, 96, 1, 3072]
    - [505, 6273.18]
  - - [1024, 1920, 1, 1024]
    - [535, 9118.09]
  - - [4096, 27, 1, 2048]
    - [538, 4073.6]
  - - [36548, 2496, 1, 1024]
    - [517, 10361.1]
  - - [1024, 1, 1, 14]
    - [537, 0.0]
  - - [1024, 91, 1, 1024]
    - [557, 3647.57]
  - - [1024, 2016, 1, 1024]
    - [533, 9560.14]
  - - [1024, 1184, 1, 1024]
    - [506, 7678.86]
  - - [4096, 1, 1, 2048]
    - [537, 0.0]
  - - [1024, 1664, 1, 1024]
    - [531, 7933.97]
  - - [1024, 11424, 1, 1024]
    - [523, 9777.81]
  - - [4096, 24, 1, 3072]
    - [541, 3813.0]
  - - [1024, 1216, 1, 1024]
    - [505, 7902.03]
  - - [36548, 3185, 1, 1024]
    - [517, 10336.6]
  - - [36548, 9216, 1, 1024]
    - [517, 10414.2]
  - - [1024, 3200, 1, 1024]
    - [523, 8846.91]
  - - [1024, 2656, 1, 1024]
    - [518, 8649.15]
  - - [1024, 2368, 1, 1024]
    - [518, 8873.06]
  - - [1024, 4459, 1, 1024]
    - [525, 9431.22]
  - - [1024, 3808, 1, 1024]
    - [525, 9263.62]
  - - [1024, 2336, 1, 1024]
    - [518, 8965.9]
  - - [4096, 27, 1, 3072]
    - [538, 4171.64]
  - - [1024, 2304, 1, 1024]
    - [515, 8601.28]
  - - [1024, 1560, 1, 1024]
    - [530, 7481.64]
  - - [4096, 35, 1, 3072]
    - [544, 4176.8]
  - - [1024, 2496, 1, 1024]
    - [521, 9092.76]
  - - [1024, 1504, 1, 1024]
    - [521, 9220.43]
  - - [4096, 50, 1, 2048]
    - [545, 5472.73]
  - - [1024, 3232, 1, 1024]
    - [518, 8961.84]
  - - [1024, 14, 1, 1024]
    - [549, 882.215]
  - - [36548, 1015, 1, 1024]
    - [517, 10140.8]
  - - [1024, 2000, 1, 1024]
    - [529, 9487.7]
  - - [36548, 243, 1, 1024]
    - [522, 9441.02]
  - - [36548, 32, 1, 1024]
    - [510, 4720.95]
  - - [1024, 25, 1, 1024]
    - [556, 1462.86]
  - - [1024, 13184, 1, 1024]
    - [520, 9866.18]
  - - [1024, 2688, 1, 1024]
    - [515, 8559.83]
  - - [1024, 27, 1, 1024]
    - [554, 1559.01]
  - - [36548, 950, 1, 1024]
    - [524, 10053.5]
  - - [1024, 1764, 1, 1024]
    - [531, 8347.01]
  - - [1024, 992, 1, 1024]
    - [518, 9035.72]
  - - [1024, 1376, 1, 1024]
    - [518, 8797.86]
  - - [1024, 950, 1, 1024]
    - [525, 8635.16]
  - - [36548, 774, 1, 1024]
    - [517, 9460.72]
  - - [36548, 25, 1, 1024]
    - [510, 3694.06]
  - - [1024, 4256, 1, 1024]
    - [518, 9172.06]
  - - [4096, 32, 1, 3072]
    - [539, 4886.57]
  - - [1024, 243, 1, 1024]
    - [543, 6594.31]
  - - [36548, 3712, 1, 1024]
    - [517, 10401.5]
  - - [1024, 50, 1, 1024]
    - [552, 2742.09]
  - - [1024, 3360, 1, 1024]
    - [514, 9017.27]
  - - [1024, 2048, 1, 1024]
    - [529, 9736.55]
  - - [1024, 2784, 1, 1024]
    - [525, 8835.5]
  - - [1024, 4992, 1, 1024]
    - [523, 9639.28]
  - - [36548, 1102, 1, 1024]
    - [524, 9858.94]
  - - [1024, 1536, 1, 1024]
    - [516, 9294.88]
  - - [1024, 2720, 1, 1024]
    - [521, 8617.78]
  - - [4096, 1, 1, 3072]
    - [537, 0.0]
  - - [1024, 2752, 1, 1024]
    - [525, 8902.07]
  - - [1024, 2816, 1, 1024]
    - [523, 8906.85]
  - - [1024, 2624, 1, 1024]
    - [525, 8494.31]
  - - [1024, 2144, 1, 1024]
    - [508, 8243.46]
  - - [36548, 1131, 1, 1024]
    - [524, 10104.5]
  - - [4096, 25, 1, 3072]
    - [539, 3959.88]
  - - [1024, 64, 1, 1024]
    - [552, 3410.0]
  - - [1024, 3296, 1, 1024]
    - [523, 9066.42]
  - - [36548, 4992, 1, 1024]
    - [517, 10395.5]
  - - [1024, 1344, 1, 1024]
    - [518, 8522.56]
  - - [36548, 2401, 1, 1024]
    - [517, 10250.2]
  - - [1024, 15744, 1, 1024]
    - [517, 10006.3]
  - - [1024, 15232, 1, 1024]
    - [516, 9912.11]
  - - [1024, 1888, 1, 1024]
    - [528, 8962.88]
  - - [1024, 1792, 1, 1024]
    - [532, 8556.72]
  - - [36548, 1073, 1, 1024]
    - [517, 10161.1]
  - - [4096, 50, 1, 3072]
    - [544, 5882.06]
  - - [36548, 15488, 1, 1024]
    - [524, 10437.0]
  - - [1024, 2464, 1, 1024]
    - [521, 8879.92]
  - - [1024, 2272, 1, 1024]
    - [518, 8720.25]
  - - [1024, 13, 1, 1024]
    - [548, 774.516]
  - - [1024, 2432, 1, 1024]
    - [523, 8491.43]
  - - [36548, 24, 1, 1024]
    - [510, 3564.31]
  - - [1024, 3936, 1, 1024]
    - [533, 9433.2]
  - - [36548, 13824, 1, 1024]
    - [517, 10439.7]
  - - [1024, 2401, 1, 1024]
    - [525, 8869.93]
  - - [1024, 32, 1, 1024]
    - [540, 1839.61]
  - - [1024, 2176, 1, 1024]
    - [509, 8544.45]
  - - [1024, 2240, 1, 1024]
    - [518, 8381.45]
  - - [1024, 1728, 1, 1024]
    - [506, 8212.23]
  - - [1024, 128, 1, 1024]
    - [553, 4660.34]
  - - [1024, 216, 1, 1024]
    - [543, 5777.87]
  - - [1024, 63, 1, 1024]
    - [551, 3329.65]
  - - [1024, 86, 1, 1024]
    - [557, 3533.6]
  - - [1024, 2528, 1, 1024]
    - [513, 8789.15]
  - - [1024, 2400, 1, 1024]
    - [518, 8939.3]
  - - [1024, 1440, 1, 1024]
    - [525, 9131.31]
  - - [1024, 2912, 1, 1024]
    - [518, 9139.93]
  - - [4096, 35, 1, 2048]
    - [544, 4059.75]
  - - [4096, 63, 1, 2048]
    - [546, 6946.4]
  - - [1024, 2880, 1, 1024]
    - [516, 9104.88]
  - - [1024, 4064, 1, 1024]
    - [535, 9715.1]
  - - [1024, 4655, 1, 1024]
    - [523, 9033.8]
  - - [1024, 1088, 1, 1024]
    - [507, 8144.31]
  - - [36548, 6272, 1, 1024]
    - [524, 10427.3]
  - - [1024, 1, 1, 13]
    - [537, 0.0]
  - - [768, 512, 1, 768]
    - [561, 5889.04]
  - - [768, 2048, 1, 3072]
    - [571, 9394.62]
  - - [768, 32, 1, 768]
    - [583, 1502.74]
  - - [64, 128, 96, 128]
    - [578, 4973.48]
  - - [3072, 1024, 1, 768]
    - [572, 9856.07]
  - - [768, 1024, 1, 3072]
    - [565, 8611.06]
  - - [768, 512, 1, 3072]
    - [564, 6430.79]
  - - [768, 64, 1, 768]
    - [585, 2621.44]
  - - [768, 4096, 1, 3072]
    - [570, 10030.4]
  - - [768, 2048, 1, 2]
    - [563, 381.763]
  - - [768, 2048, 1, 768]
    - [568, 9754.2]
  - - [768, 320, 1, 30522]
    - [581, 8529.4]
  - - [64, 64, 96, 64]
    - [575, 2496.61]
  - - [768, 640, 1, 30522]
    - [562, 8253.84]
  - - [768, 1280, 1, 30522]
    - [567, 9572.85]
  - - [768, 1280, 1, 768]
    - [571, 8713.93]
  - - [768, 640, 1, 768]
    - [561, 7293.03]
  - - [768, 32, 1, 2]
    - [573, 11.8154]
  - - [3072, 2048, 1, 768]
    - [568, 10019.6]
  - - [768, 4096, 1, 768]
    - [568, 9927.35]
  - - [3072, 4096, 1, 768]
    - [571, 10150.1]
  - - [64, 256, 192, 256]
    - [577, 7054.19]
  - - [768, 8, 1, 768]
    - [584, 340.939]
  - - [64, 128, 384, 128]
    - [576, 6765.01]
  - - [768, 1024, 1, 768]
    - [566, 8768.58]
  - - [768, 320, 1, 768]
    - [582, 6838.54]
  - - [64, 64, 768, 64]
    - [579, 5388.83]
  - - [768, 1024, 1, 2]
    - [559, 258.695]
  - - [768, 16, 1, 768]
    - [584, 819.2]
  - - [64, 256, 96, 256]
    - [577, 5893.64]
  - - [3072, 512, 1, 768]
    - [569, 9722.79]
  - - [768, 160, 1, 768]
    - [586, 5019.78]
  - - [768, 4096, 1, 2]
    - [560, 507.375]
  - - [1600, 512, 1, 1024]
    - [590, 7186.95]
  - - [1024, 512, 1, 64]
    - [588, 2557.5]
  - - [1024, 512, 1, 1]
    - [587, 71.2348]
  - - [2048, 512, 1, 1]
    - [589, 90.3945]
  - - [1024, 200, 1, 1]
    - [595, 40.0]
  - - [32, 200, 1, 1]
    - [591, 1.56863]
  - - [560, 200, 1, 1024]
    - [599, 4731.35]
  - - [1, 512, 1, 1]
    - [598, 0.130612]
  - - [64, 512, 1, 1]
    - [593, 7.58519]
  - - [1024, 8192, 1, 256]
    - [608, 9518.99]
  - - [1024, 22016, 1, 256]
    - [614, 9881.12]
  - - [256, 8976, 1, 4352]
    - [606, 9567.08]
  - - [512, 256, 1, 2048]
    - [619, 5917.89]
  - - [1024, 19968, 1, 256]
    - [614, 9882.37]
  - - [256, 8976, 1, 1536]
    - [604, 8437.35]
  - - [256, 8976, 1, 33536]
    - [604, 8441.89]
  - - [1024, 1792, 1, 256]
    - [604, 7756.97]
  - - [1024, 21504, 1, 256]
    - [614, 9893.9]
  - - [512, 215, 1, 2048]
    - [620, 4665.64]
  - - [1024, 7168, 1, 256]
    - [608, 9509.35]
  - - [256, 8976, 1, 15872]
    - [610, 8914.65]
  - - [1024, 19712, 1, 256]
    - [614, 9771.9]
  - - [256, 8976, 1, 5632]
    - [610, 8740.03]
  - - [1024, 14848, 1, 256]
    - [614, 9756.15]
  - - [1024, 28672, 1, 256]
    - [614, 9958.92]
  - - [256, 8976, 1, 9728]
    - [617, 8853.04]
  - - [1024, 17152, 1, 256]
    - [608, 9737.3]
  - - [256, 8976, 1, 11520]
    - [610, 8999.2]
  - - [256, 8976, 1, 8192]
    - [600, 7897.32]
  - - [1024, 3328, 1, 256]
    - [615, 8593.53]
  - - [256, 8976, 1, 7424]
    - [610, 8980.47]
  - - [1024, 18944, 1, 256]
    - [614, 9854.85]
  - - [1024, 10496, 1, 256]
    - [609, 9453.9]
  - - [256, 8976, 1, 5376]
    - [607, 9608.37]
  - - [256, 8976, 1, 6144]
    - [604, 7880.13]
  - - [1024, 40448, 1, 256]
    - [614, 10016.6]
  - - [256, 8976, 1, 22016]
    - [617, 8939.87]
  - - [256, 8976, 1, 4864]
    - [605, 9211.43]
  - - [256, 8976, 1, 12288]
    - [601, 8065.05]
  - - [1024, 9728, 1, 256]
    - [614, 9636.25]
  - - [256, 8976, 1, 2048]
    - [602, 7001.33]
  - - [1024, 10240, 1, 256]
    - [608, 9619.96]
  - - [256, 8976, 1, 2304]
    - [606, 9509.74]
  - - [1024, 7936, 1, 256]
    - [614, 9300.67]
  - - [768, 256, 1, 2048]
    - [618, 6267.95]
  - - [1024, 9984, 1, 256]
    - [614, 9477.28]
  - - [1024, 13312, 1, 256]
    - [614, 9758.56]
  - - [1024, 16128, 1, 256]
    - [608, 9721.9]
  - - [1024, 8960, 1, 256]
    - [609, 9398.25]
  - - [1024, 5120, 1, 256]
    - [615, 9315.5]
  - - [1024, 11264, 1, 256]
    - [608, 9664.8]
  - - [256, 8976, 1, 20480]
    - [616, 8279.87]
  - - [1024, 20992, 1, 256]
    - [608, 9878.87]
  - - [256, 8976, 1, 9472]
    - [610, 8990.96]
  - - [256, 8976, 1, 8448]
    - [610, 8983.52]
  - - [256, 8976, 1, 20992]
    - [611, 8942.11]
  - - [256, 8976, 1, 10496]
    - [611, 8989.71]
  - - [1024, 15104, 1, 256]
    - [609, 9676.01]
  - - [1024, 6400, 1, 256]
    - [617, 9145.89]
  - - [1024, 4096, 1, 256]
    - [610, 9124.25]
  - - [256, 8976, 1, 2560]
    - [604, 8566.11]
  - - [256, 8976, 1, 2816]
    - [606, 9496.84]
  - - [1024, 7680, 1, 256]
    - [614, 9460.84]
  - - [256, 8976, 1, 14336]
    - [611, 8226.8]
  - - [256, 8976, 1, 6656]
    - [611, 8771.42]
  - - [1024, 3072, 1, 256]
    - [611, 9076.94]
  - - [256, 8976, 1, 5888]
    - [607, 9546.3]
  - - [1024, 12288, 1, 256]
    - [608, 9690.81]
  - - [256, 8976, 1, 26112]
    - [613, 8699.83]
  - - [1024, 7424, 1, 256]
    - [615, 9256.84]
  - - [256, 8976, 1, 14848]
    - [616, 8885.79]
  - - [768, 215, 1, 2048]
    - [618, 5628.59]
  - - [1024, 2560, 1, 256]
    - [611, 8820.83]
  - - [256, 8976, 1, 19968]
    - [610, 8928.86]
  - - [256, 8976, 1, 9984]
    - [610, 8993.12]
  - - [1024, 4864, 1, 256]
    - [611, 8974.3]
  - - [1024, 33536, 1, 256]
    - [614, 9943.07]
  - - [256, 8976, 1, 15104]
    - [611, 8996.63]
  - - [1024, 2048, 1, 256]
    - [609, 8462.66]
  - - [256, 8976, 1, 8960]
    - [611, 8998.92]
  - - [1024, 6144, 1, 256]
    - [616, 9359.67]
  - - [1024, 14592, 1, 256]
    - [614, 9667.42]
  - - [256, 8976, 1, 19712]
    - [610, 9020.11]
  - - [1024, 11520, 1, 256]
    - [609, 9527.7]
  - - [1024, 5632, 1, 256]
    - [608, 9297.2]
  - - [256, 8976, 1, 11008]
    - [617, 8994.8]
  - - [256, 8976, 1, 17152]
    - [611, 9003.8]
  - - [256, 8976, 1, 3072]
    - [600, 8261.96]
  - - [1024, 3840, 1, 256]
    - [617, 8671.89]
  - - [1024, 14336, 1, 256]
    - [614, 9760.28]
  - - [1024, 20480, 1, 256]
    - [608, 9887.85]
  - - [1024, 23552, 1, 256]
    - [608, 9890.46]
  - - [256, 8976, 1, 7168]
    - [603, 8478.34]
  - - [1024, 13568, 1, 256]
    - [608, 9654.64]
  - - [1024, 4608, 1, 256]
    - [616, 9218.25]
  - - [256, 8976, 1, 10240]
    - [601, 8076.16]
  - - [1024, 8704, 1, 256]
    - [610, 9475.5]
  - - [1024, 11008, 1, 256]
    - [614, 9524.96]
  - - [1024, 8448, 1, 256]
    - [608, 9352.16]
  - - [256, 8976, 1, 44505]
    - [612, 8430.23]
  - - [6272, 256, 1, 528]
    - [664, 7389.94]
  - - [3136, 2048, 1, 1024]
    - [645, 9657.94]
  - - [6272, 112, 1, 512]
    - [643, 5931.09]
  - - [2048, 320, 1, 1280]
    - [663, 7772.99]
  - - [289, 256, 1, 1568]
    - [684, 3718.17]
  - - [50176, 128, 1, 256]
    - [646, 8908.58]
  - - [5329, 64, 1, 448]
    - [629, 4602.2]
  - - [289, 192, 1, 1344]
    - [681, 3452.59]
  - - [12544, 1024, 1, 256]
    - [646, 9742.64]
  - - [784, 64, 32, 192]
    - [622, 6844.61]
  - - [6272, 64, 1, 480]
    - [630, 5562.24]
  - - [196, 128, 1, 800]
    - [672, 1639.74]
  - - [64, 512, 1, 1344]
    - [671, 2313.04]
  - - [6272, 64, 1, 512]
    - [629, 5609.19]
  - - [6272, 160, 1, 528]
    - [630, 6149.7]
  - - [289, 160, 32, 768]
    - [657, 6637.82]
  - - [12544, 256, 1, 1024]
    - [664, 8790.46]
  - - [289, 224, 1, 1568]
    - [684, 3270.17]
  - - [5329, 64, 32, 160]
    - [637, 9091.04]
  - - [5329, 96, 1, 576]
    - [664, 5555.66]
  - - [3025, 64, 1, 363]
    - [682, 4392.3]
  - - [784, 32, 32, 192]
    - [653, 5633.8]
  - - [3136, 512, 1, 1024]
    - [649, 7553.14]
  - - [6272, 16, 1, 480]
    - [684, 3219.85]
  - - [1225, 64, 32, 288]
    - [644, 8240.58]
  - - [64, 256, 1, 1536]
    - [677, 1456.36]
  - - [289, 192, 32, 768]
    - [656, 7372.8]
  - - [2048, 448, 1, 1280]
    - [639, 8403.01]
  - - [3136, 2048, 1, 512]
    - [638, 9486.31]
  - - [289, 256, 1, 2016]
    - [684, 3876.08]
  - - [289, 384, 32, 1024]
    - [623, 7350.54]
  - - [1568, 32, 1, 832]
    - [673, 2717.87]
  - - [3136, 64, 32, 64]
    - [626, 7657.26]
  - - [289, 160, 1, 1120]
    - [680, 2826.9]
  - - [6272, 128, 1, 528]
    - [634, 6926.26]
  - - [21609, 32, 1, 288]
    - [635, 3698.9]
  - - [1225, 192, 1, 1728]
    - [668, 7309.81]
  - - [4096, 512, 1, 4096]
    - [651, 10272.1]
  - - [64, 256, 1, 1152]
    - [677, 1387.82]
  - - [6272, 96, 1, 480]
    - [665, 6371.56]
  - - [784, 96, 1, 800]
    - [685, 3330.27]
  - - [2048, 448, 1, 2048]
    - [639, 8622.65]
  - - [784, 96, 32, 192]
    - [654, 7092.36]
  - - [289, 224, 1, 1344]
    - [684, 3180.01]
  - - [1001, 512, 1, 4096]
    - [625, 8195.07]
  - - [2048, 192, 1, 1280]
    - [630, 6120.09]
  - - [1225, 64, 32, 256]
    - [635, 8076.62]
  - - [2048, 256, 1, 1536]
    - [625, 8137.7]
  - - [1225, 64, 1, 1200]
    - [684, 3552.87]
  - - [6272, 128, 1, 512]
    - [638, 6878.21]
  - - [729, 192, 1, 1600]
    - [683, 5016.77]
  - - [289, 192, 1, 896]
    - [681, 3091.87]
  - - [1568, 384, 1, 832]
    - [664, 6934.62]
  - - [784, 16, 32, 192]
    - [655, 3380.28]
  - - [1568, 256, 1, 832]
    - [629, 5980.86]
  - - [1568, 48, 1, 832]
    - [686, 3275.09]
  - - [1568, 192, 1, 832]
    - [624, 4441.11]
  - - [289, 192, 32, 1024]
    - [627, 6563.06]
  - - [6272, 32, 1, 528]
    - [668, 4998.67]
  - - [49, 128, 1, 1200]
    - [669, 550.175]
  - - [1225, 64, 32, 384]
    - [641, 8589.33]
  - - [289, 128, 1, 896]
    - [680, 2103.1]
  - - [1568, 160, 1, 832]
    - [668, 6995.05]
  - - [1001, 32, 1, 1024]
    - [677, 1744.72]
  - - [2048, 320, 1, 2048]
    - [662, 7118.04]
  - - [2048, 384, 1, 1536]
    - [625, 8184.01]
  - - [50176, 512, 1, 256]
    - [637, 9852.4]
  - - [289, 256, 1, 1792]
    - [686, 3809.75]
  - - [64, 448, 1, 1152]
    - [678, 2128.23]
  - - [5041, 96, 1, 576]
    - [663, 5279.3]
  - - [6272, 192, 1, 480]
    - [625, 7479.65]
  - - [784, 32, 32, 256]
    - [652, 5708.91]
  - - [1001, 32, 1, 2048]
    - [679, 2141.04]
  - - [289, 192, 1, 1120]
    - [675, 3277.77]
  - - [6272, 32, 1, 512]
    - [667, 4978.7]
  - - [289, 384, 1, 3456]
    - [684, 5904.14]
  - - [289, 384, 1, 2592]
    - [685, 5707.34]
  - - [12544, 1024, 1, 512]
    - [646, 10008.3]
  - - [12544, 256, 1, 512]
    - [664, 8628.08]
  - - [6272, 24, 1, 512]
    - [668, 3568.07]
  - - [5041, 192, 1, 720]
    - [639, 8424.42]
  - - [64, 320, 1, 1728]
    - [672, 1469.66]
  - - [784, 128, 32, 256]
    - [640, 8104.14]
  - - [289, 96, 1, 864]
    - [678, 1838.25]
  - - [1225, 32, 32, 192]
    - [659, 5949.72]
  - - [1568, 128, 1, 832]
    - [667, 5718.69]
  - - [289, 128, 32, 768]
    - [625, 7289.25]
  - - [196, 64, 1, 800]
    - [671, 915.62]
  - - [4096, 512, 1, 9216]
    - [648, 10351.4]
  - - [12544, 64, 1, 147]
    - [638, 5069.33]
  - - [784, 32, 1, 400]
    - [669, 1140.36]
  - - [6272, 160, 1, 512]
    - [629, 6140.08]
  - - [1225, 48, 32, 288]
    - [635, 5978.61]
  - - [64, 320, 1, 2880]
    - [676, 1920.0]
  - - [1225, 64, 32, 192]
    - [629, 7641.01]
  - - [1001, 32, 1, 1536]
    - [677, 2084.79]
  - - [784, 64, 32, 256]
    - [621, 6990.51]
  - - [64, 384, 1, 1152]
    - [678, 1862.6]
  - - [3136, 512, 1, 2048]
    - [650, 7764.3]
  - - [6272, 144, 1, 512]
    - [625, 5574.04]
  - - [1225, 192, 32, 384]
    - [639, 9373.83]
  - - [64, 192, 1, 1728]
    - [677, 1206.46]
  - - [8192, 320, 1, 1280]
    - [691, 9875.92]
  - - [8192, 320, 1, 2048]
    - [694, 9745.7]
  - - [8192, 384, 1, 1280]
    - [691, 10046.2]
  - - [8192, 192, 1, 1280]
    - [694, 9950.9]
  - - [8192, 192, 1, 2048]
    - [690, 9559.67]
  - - [8192, 384, 1, 2048]
    - [692, 9945.74]
  - - [8192, 448, 1, 2048]
    - [693, 9908.51]
  - - [1001, 64, 1, 1536]
    - [687, 3649.94]
  - - [8192, 448, 1, 1280]
    - [691, 9981.35]
  - - [1001, 64, 1, 2048]
    - [688, 3580.87]
  - - [1001, 128, 1, 2048]
    - [689, 5587.87]
  - - [3200, 1024, 1, 2048]
    - [697, 9131.95]
  - - [2048, 1024, 1, 256]
    - [696, 8452.0]
  - - [257, 1024, 1, 4096]
    - [695, 4225.21]
  - - [65, 6400, 1, 1024]
    - [722, 2839.89]
  - - [256, 6400, 1, 4096]
    - [723, 7361.66]
  - - [1024, 64, 1, 4096]
    - [724, 3787.18]
  - - [512, 540, 1, 2048]
    - [727, 4393.48]
  - - [512, 550, 1, 2048]
    - [727, 4439.01]
  - - [512, 560, 1, 2048]
    - [727, 4525.3]
  - - [512, 600, 1, 2048]
    - [727, 4857.52]
  - - [512, 644, 1, 512]
    - [727, 4587.52]
  - - [512, 644, 1, 2048]
    - [730, 5184.91]
  - - [512, 668, 1, 2048]
    - [727, 5312.87]
  - - [512, 714, 1, 512]
    - [727, 5075.13]
  - - [512, 714, 1, 2048]
    - [729, 5723.88]
  - - [512, 720, 1, 512]
    - [727, 5095.67]
  - - [512, 720, 1, 2048]
    - [729, 5779.05]
  - - [512, 722, 1, 2048]
    - [727, 5670.1]
  - - [512, 980, 1, 2048]
    - [731, 6825.22]
  - - [512, 1139, 1, 2048]
    - [735, 6181.82]
  - - [512, 1184, 1, 2048]
    - [732, 6360.22]
  - - [512, 3092, 1, 2048]
    - [727, 6981.48]
  - - [512, 3234, 1, 2048]
    - [730, 7392.52]
  - - [512, 3323, 1, 2048]
    - [730, 7417.45]
  - - [512, 3780, 1, 512]
    - [744, 8583.72]
  - - [512, 3840, 1, 512]
    - [744, 8732.07]
  - - [512, 3876, 1, 33708]
    - [762, 9890.06]
  - - [512, 3910, 1, 33708]
    - [765, 9985.2]
  - - [512, 3942, 1, 2048]
    - [767, 8383.68]
  - - [512, 3969, 1, 33708]
    - [763, 10124.8]
  - - [512, 3999, 1, 33708]
    - [760, 10200.9]
  - - [512, 4020, 1, 33708]
    - [760, 10249.4]
  - - [512, 4026, 1, 33708]
    - [765, 10282.0]
  - - [2048, 160, 1, 512]
    - [730, 4490.69]
  - - [2048, 174, 1, 512]
    - [730, 4781.24]
  - - [2048, 189, 1, 512]
    - [727, 5086.78]
  - - [2048, 198, 1, 512]
    - [730, 5545.35]
  - - [2048, 207, 1, 512]
    - [727, 5711.98]
  - - [2048, 208, 1, 512]
    - [728, 5751.68]
  - - [2048, 245, 1, 512]
    - [725, 6676.22]
  - - [2048, 246, 1, 512]
    - [728, 6788.15]
  - - [2048, 401, 1, 512]
    - [750, 6989.34]
  - - [2048, 439, 1, 512]
    - [748, 7551.26]
  - - [2048, 465, 1, 512]
    - [750, 7905.12]
  - - [2048, 468, 1, 512]
    - [750, 7945.82]
  - - [2048, 3314, 1, 512]
    - [750, 9758.99]
  - - [2048, 3364, 1, 512]
    - [757, 9335.72]
  - - [2048, 3523, 1, 512]
    - [750, 9733.7]
  - - [2048, 3608, 1, 512]
    - [756, 9371.93]
  - - [512, 443, 1, 2048]
    - [789, 6444.49]
  - - [512, 455, 1, 512]
    - [785, 5778.85]
  - - [512, 495, 1, 2048]
    - [783, 6462.22]
  - - [512, 511, 1, 2048]
    - [782, 6572.89]
  - - [512, 512, 1, 2048]
    - [785, 6657.63]
  - - [64, 10, 448, 10]
    - [822, 431.807]
  - - [64, 18, 648, 18]
    - [825, 1174.56]
  - - [64, 18, 1720, 18]
    - [825, 1714.71]
  - - [64, 19, 1632, 19]
    - [820, 1812.78]
  - - [64, 21, 1472, 21]
    - [820, 1997.39]
  - - [64, 23, 64, 23]
    - [820, 351.751]
  - - [64, 26, 56, 26]
    - [831, 388.267]
  - - [64, 27, 56, 26]
    - [772, 403.2]
  - - [64, 35, 904, 35]
    - [820, 2725.91]
  - - [64, 103, 16, 103]
    - [773, 1170.65]
  - - [64, 104, 16, 103]
    - [775, 1161.98]
  - - [64, 123, 16, 112]
    - [836, 1494.35]
  - - [64, 123, 16, 123]
    - [775, 1501.17]
  - - [512, 540, 1, 512]
    - [729, 3748.88]
  - - [512, 550, 1, 512]
    - [727, 3850.94]
  - - [512, 560, 1, 512]
    - [728, 3912.6]
  - - [512, 781, 1, 512]
    - [726, 5491.8]
  - - [512, 781, 1, 2048]
    - [730, 6118.78]
  - - [512, 848, 1, 2048]
    - [727, 6561.34]
  - - [512, 872, 1, 2048]
    - [727, 6512.52]
  - - [512, 936, 1, 512]
    - [727, 6457.02]
  - - [512, 936, 1, 2048]
    - [730, 6827.12]
  - - [512, 980, 1, 512]
    - [727, 6803.53]
  - - [512, 1186, 1, 2048]
    - [732, 6381.42]
  - - [512, 1232, 1, 512]
    - [733, 6585.67]
  - - [512, 1232, 1, 2048]
    - [732, 6588.36]
  - - [512, 1279, 1, 2048]
    - [732, 6798.1]
  - - [512, 1290, 1, 512]
    - [733, 6895.71]
  - - [512, 1290, 1, 2048]
    - [730, 6826.12]
  - - [512, 1327, 1, 2048]
    - [727, 6993.67]
  - - [512, 1331, 1, 2048]
    - [736, 6989.46]
  - - [512, 1341, 1, 2048]
    - [732, 7058.94]
  - - [512, 1350, 1, 512]
    - [739, 6966.43]
  - - [512, 1350, 1, 2048]
    - [727, 6991.2]
  - - [512, 1359, 1, 2048]
    - [727, 6906.82]
  - - [512, 1391, 1, 2048]
    - [727, 7028.57]
  - - [512, 1424, 1, 512]
    - [740, 7279.51]
  - - [512, 1424, 1, 2048]
    - [730, 7336.73]
  - - [512, 1458, 1, 512]
    - [740, 7249.73]
  - - [512, 1458, 1, 2048]
    - [727, 7125.39]
  - - [512, 1462, 1, 512]
    - [740, 7497.15]
  - - [512, 1462, 1, 2048]
    - [727, 7063.3]
  - - [512, 1467, 1, 2048]
    - [730, 7100.54]
  - - [512, 1472, 1, 2048]
    - [727, 7177.75]
  - - [512, 1520, 1, 512]
    - [740, 7501.11]
  - - [512, 1520, 1, 2048]
    - [727, 7059.87]
  - - [512, 1596, 1, 512]
    - [754, 6827.38]
  - - [512, 1596, 1, 2048]
    - [753, 7188.69]
  - - [512, 1599, 1, 512]
    - [754, 6822.4]
  - - [512, 1599, 1, 2048]
    - [752, 7297.5]
  - - [512, 1615, 1, 512]
    - [756, 7056.04]
  - - [512, 1615, 1, 2048]
    - [752, 7274.27]
  - - [512, 1680, 1, 512]
    - [750, 7281.78]
  - - [512, 1680, 1, 2048]
    - [759, 7515.39]
  - - [512, 1709, 1, 2048]
    - [758, 7621.71]
  - - [512, 1890, 1, 512]
    - [750, 8043.05]
  - - [512, 1902, 1, 2048]
    - [759, 7995.48]
  - - [512, 1917, 1, 512]
    - [748, 8074.07]
  - - [512, 1917, 1, 2048]
    - [759, 8192.53]
  - - [512, 2076, 1, 2048]
    - [740, 6525.31]
  - - [512, 2195, 1, 2048]
    - [730, 6579.08]
  - - [512, 2205, 1, 512]
    - [738, 7678.37]
  - - [512, 2205, 1, 2048]
    - [727, 6662.37]
  - - [512, 2387, 1, 512]
    - [730, 7549.92]
  - - [512, 2418, 1, 512]
    - [730, 7596.65]
  - - [512, 2418, 1, 2048]
    - [757, 7123.68]
  - - [512, 2496, 1, 512]
    - [730, 7925.28]
  - - [512, 2496, 1, 2048]
    - [747, 7056.85]
  - - [512, 2790, 1, 2048]
    - [746, 7419.17]
