library/src/blas3/Tensile/Logic/archive/vega20_Cijk_Ailk_Bjlk_SB.yaml
- {MinimumRequiredVersion: 4.6.0}
- vega20
- gfx906
- [Device 66a0, Device 66a1, Device 66a7, Device 66af, Vega 20]
    SolutionIndex: 0
    SolutionNameMin: Cijk_Ailk_Bjlk_SB_MT032x008x08_GRVW02_GSU01_SNLL0_TT02_02_VW02_WG16_04_01
    SolutionIndex: 1
    SolutionNameMin: Cijk_Ailk_Bjlk_SB_MT016x016x08_GRVW02_GSU01_SNLL0_TT02_02_VW02_WG08_08_01
    SolutionIndex: 2
    SolutionNameMin: Cijk_Ailk_Bjlk_SB_MT032x016x08_GRVW02_GSU01_SNLL0_TT04_02_VW02_WG08_08_01
    SolutionIndex: 3
    SolutionNameMin: Cijk_Ailk_Bjlk_SB_MT032x032x08_GRVW04_GSU01_SNLL0_TT04_04_VW04_WG08_08_01
    SolutionIndex: 4
    SolutionNameMin: Cijk_Ailk_Bjlk_SB_MT032x016x08_GRVW02_GSU01_SNLL0_TT02_02_VW02_WG16_08_01
    SolutionIndex: 5
    SolutionNameMin: Cijk_Ailk_Bjlk_SB_MT064x016x08_GRVW02_GSU01_SNLL0_TT04_02_VW02_WG16_08_01
    SolutionIndex: 6
    SolutionNameMin: Cijk_Ailk_Bjlk_SB_MT016x016x08_GRVW02_GSU01_SNLL0_TT02_02_VW02_WG08_08_01
    SolutionIndex: 7
    SolutionNameMin: Cijk_Ailk_Bjlk_SB_MT032x016x08_GRVW02_GSU01_SNLL0_TT04_02_VW02_WG08_08_01
    SolutionIndex: 8
    SolutionNameMin: Cijk_Ailk_Bjlk_SB_MT032x032x08_GRVW04_GSU01_SNLL0_TT04_04_VW04_WG08_08_01
    SolutionIndex: 9
    SolutionNameMin: Cijk_Ailk_Bjlk_SB_MT032x016x08_GRVW02_GSU01_SNLL0_TT02_02_VW02_WG16_08_01
    SolutionIndex: 10
    SolutionNameMin: Cijk_Ailk_Bjlk_SB_MT064x016x08_GRVW02_GSU01_SNLL0_TT04_02_VW02_WG16_08_01
    SolutionIndex: 11
    SolutionNameMin: Cijk_Ailk_Bjlk_SB_MT064x008x16_GRVW02_GSU01_SNLL0_TT02_02_VW02_WG32_04_01
    SolutionIndex: 12
    SolutionNameMin: Cijk_Ailk_Bjlk_SB_MT016x016x16_GRVW02_GSU01_SNLL0_TT02_02_VW02_WG08_08_01
    SolutionIndex: 13
    SolutionNameMin: Cijk_Ailk_Bjlk_SB_MT032x016x16_GRVW02_GSU01_SNLL0_TT04_02_VW02_WG08_08_01
    SolutionIndex: 14
    SolutionNameMin: Cijk_Ailk_Bjlk_SB_MT032x032x16_GRVW04_GSU01_SNLL0_TT04_04_VW04_WG08_08_01
    SolutionIndex: 15
    SolutionNameMin: Cijk_Ailk_Bjlk_SB_MT064x016x16_GRVW02_GSU01_SNLL0_TT04_02_VW02_WG16_08_01
    SolutionIndex: 16
    SolutionNameMin: Cijk_Ailk_Bjlk_SB_MT064x032x16_GRVW04_GSU01_SNLL0_TT04_04_VW04_WG16_08_01
    SolutionIndex: 17
    SolutionNameMin: Cijk_Ailk_Bjlk_SB_MT064x008x16_GRVW02_GSU01_SNLL0_TT02_02_VW02_WG32_04_01
    SolutionIndex: 18
    SolutionNameMin: Cijk_Ailk_Bjlk_SB_MT032x008x16_GRVW02_GSU01_SNLL0_TT02_02_VW02_WG16_04_01
    SolutionIndex: 19
    SolutionNameMin: Cijk_Ailk_Bjlk_SB_MT016x016x16_GRVW02_GSU01_SNLL0_TT02_02_VW02_WG08_08_01
    SolutionIndex: 20
    SolutionNameMin: Cijk_Ailk_Bjlk_SB_MT016x016x24_GRVW02_GSU01_SNLL0_TT02_02_VW02_WG08_08_01
    SolutionIndex: 21
    SolutionNameMin: Cijk_Ailk_Bjlk_SB_MT016x016x08_GRVW02_GSU02_SNLL0_TT02_02_VW02_WG08_08_02
    SolutionIndex: 22
    SolutionNameMin: Cijk_Ailk_Bjlk_SB_MT032x016x08_GRVW02_GSU02_SNLL0_TT04_02_VW02_WG08_08_02
    SolutionIndex: 23
    SolutionNameMin: Cijk_Ailk_Bjlk_SB_MT016x016x08_GRVW02_GSU04_SNLL0_TT02_02_VW02_WG08_08_02
    SolutionIndex: 24
    SolutionNameMin: Cijk_Ailk_Bjlk_SB_MT016x016x08_GRVW02_GSU08_SNLL0_TT02_02_VW02_WG08_08_02
    SolutionIndex: 25
    SolutionNameMin: Cijk_Ailk_Bjlk_SB_MT016x016x16_GRVW02_GSU02_SNLL0_TT02_02_VW02_WG08_08_02
    SolutionIndex: 26
    SolutionNameMin: Cijk_Ailk_Bjlk_SB_MT032x016x16_GRVW02_GSU02_SNLL0_TT04_02_VW02_WG08_08_02
    SolutionIndex: 27
    SolutionNameMin: Cijk_Ailk_Bjlk_SB_MT032x032x16_GRVW04_GSU02_SNLL0_TT04_04_VW04_WG08_08_02
    SolutionIndex: 28
    SolutionNameMin: Cijk_Ailk_Bjlk_SB_MT064x032x16_GRVW04_GSU02_SNLL0_TT08_04_VW04_WG08_08_02
    SolutionIndex: 29
    SolutionNameMin: Cijk_Ailk_Bjlk_SB_MT016x016x16_GRVW02_GSU02_SNLL0_TT02_02_VW02_WG08_08_04
    SolutionIndex: 30
    SolutionNameMin: Cijk_Ailk_Bjlk_SB_MT032x016x16_GRVW02_GSU02_SNLL0_TT04_02_VW02_WG08_08_04
    SolutionIndex: 31
    SolutionNameMin: Cijk_Ailk_Bjlk_SB_MT032x016x16_GRVW02_GSU02_SNLL0_TT02_02_VW02_WG16_08_02
    SolutionIndex: 32
    SolutionNameMin: Cijk_Ailk_Bjlk_SB_MT064x016x16_GRVW02_GSU02_SNLL0_TT04_02_VW02_WG16_08_02
    SolutionIndex: 33
    SolutionNameMin: Cijk_Ailk_Bjlk_SB_MT064x016x16_GRVW04_GSU02_SNLL0_TT04_04_VW04_WG16_04_04
    SolutionIndex: 34
    SolutionNameMin: Cijk_Ailk_Bjlk_SB_MT016x016x16_GRVW02_GSU02_SNLL0_TT02_02_VW02_WG08_08_02
    SolutionIndex: 35
    SolutionNameMin: Cijk_Ailk_Bjlk_SB_MT032x016x16_GRVW02_GSU02_SNLL0_TT04_02_VW02_WG08_08_02
    SolutionIndex: 36
    SolutionNameMin: Cijk_Ailk_Bjlk_SB_MT032x032x16_GRVW04_GSU02_SNLL0_TT04_04_VW04_WG08_08_02
    SolutionIndex: 37
    SolutionNameMin: Cijk_Ailk_Bjlk_SB_MT016x016x16_GRVW02_GSU02_SNLL0_TT02_02_VW02_WG08_08_04
    SolutionIndex: 38
    SolutionNameMin: Cijk_Ailk_Bjlk_SB_MT032x016x16_GRVW02_GSU02_SNLL0_TT04_02_VW02_WG08_08_04
    SolutionIndex: 39
    SolutionNameMin: Cijk_Ailk_Bjlk_SB_MT032x016x16_GRVW02_GSU02_SNLL0_TT02_02_VW02_WG16_08_02
    SolutionIndex: 40
    SolutionNameMin: Cijk_Ailk_Bjlk_SB_MT016x016x16_GRVW02_GSU04_SNLL0_TT02_02_VW02_WG08_08_04
    SolutionIndex: 41
    SolutionNameMin: Cijk_Ailk_Bjlk_SB_MT032x032x16_GRVW04_GSU04_SNLL0_TT04_04_VW04_WG08_08_02
    SolutionIndex: 42
    SolutionNameMin: Cijk_Ailk_Bjlk_SB_MT016x016x16_GRVW02_GSU04_SNLL0_TT02_02_VW02_WG08_08_04
    SolutionIndex: 43
    SolutionNameMin: Cijk_Ailk_Bjlk_SB_MT016x016x16_GRVW02_GSU08_SNLL0_TT02_02_VW02_WG08_08_04
    SolutionIndex: 44
    SolutionNameMin: Cijk_Ailk_Bjlk_SB_MT032x008x32_GRVW02_GSU02_SNLL0_TT02_02_VW02_WG16_04_04
    SolutionIndex: 45
    SolutionNameMin: Cijk_Ailk_Bjlk_SB_MT032x016x32_GRVW02_GSU02_SNLL0_TT04_02_VW02_WG08_08_02
    SolutionIndex: 46
    SolutionNameMin: Cijk_Ailk_Bjlk_SB_MT016x016x32_GRVW02_GSU02_SNLL0_TT02_02_VW02_WG08_08_04
    SolutionIndex: 47
    SolutionNameMin: Cijk_Ailk_Bjlk_SB_MT032x016x32_GRVW02_GSU02_SNLL0_TT04_02_VW02_WG08_08_04
    SolutionIndex: 48
    SolutionNameMin: Cijk_Ailk_Bjlk_SB_MT032x032x32_GRVW04_GSU02_SNLL0_TT04_04_VW04_WG08_08_04
    SolutionIndex: 49
    SolutionNameMin: Cijk_Ailk_Bjlk_SB_MT064x032x32_GRVW04_GSU02_SNLL0_TT08_04_VW04_WG08_08_04
    SolutionIndex: 50
    SolutionNameMin: Cijk_Ailk_Bjlk_SB_MT064x032x32_GRVW04_GSU02_SNLL0_TT04_04_VW04_WG16_08_02
    SolutionIndex: 51
    SolutionNameMin: Cijk_Ailk_Bjlk_SB_MT128x032x32_GRVW04_GSU02_SNLL0_TT08_08_VW04_WG16_04_04
    SolutionIndex: 52
    SolutionNameMin: Cijk_Ailk_Bjlk_SB_MT032x016x32_GRVW02_GSU02_SNLL0_TT04_02_VW02_WG08_08_02
    SolutionIndex: 53
    SolutionNameMin: Cijk_Ailk_Bjlk_SB_MT032x032x32_GRVW04_GSU02_SNLL0_TT04_04_VW04_WG08_08_02
    SolutionIndex: 54
    SolutionNameMin: Cijk_Ailk_Bjlk_SB_MT016x016x32_GRVW02_GSU02_SNLL0_TT02_02_VW02_WG08_08_04
    SolutionIndex: 55
    SolutionNameMin: Cijk_Ailk_Bjlk_SB_MT032x016x32_GRVW02_GSU02_SNLL0_TT04_02_VW02_WG08_08_04
    SolutionIndex: 56
    SolutionNameMin: Cijk_Ailk_Bjlk_SB_MT032x032x32_GRVW04_GSU02_SNLL0_TT04_04_VW04_WG08_08_04
    SolutionIndex: 57
    SolutionNameMin: Cijk_Ailk_Bjlk_SB_MT064x032x32_GRVW04_GSU02_SNLL0_TT08_04_VW04_WG08_08_04
    SolutionIndex: 58
    SolutionNameMin: Cijk_Ailk_Bjlk_SB_MT064x008x32_GRVW02_GSU04_SNLL0_TT04_02_VW02_WG16_04_04
    SolutionIndex: 59
    SolutionNameMin: Cijk_Ailk_Bjlk_SB_MT016x016x32_GRVW02_GSU04_SNLL0_TT02_02_VW02_WG08_08_04
    SolutionIndex: 60
    SolutionNameMin: Cijk_Ailk_Bjlk_SB_MT032x016x32_GRVW02_GSU04_SNLL0_TT04_02_VW02_WG08_08_04
    SolutionIndex: 61
    SolutionNameMin: Cijk_Ailk_Bjlk_SB_MT032x032x32_GRVW04_GSU04_SNLL0_TT04_04_VW04_WG08_08_04
    SolutionIndex: 62
    SolutionNameMin: Cijk_Ailk_Bjlk_SB_MT032x032x32_GRVW04_GSU04_SNLL0_TT04_04_VW04_WG08_08_04
    SolutionIndex: 63
    SolutionNameMin: Cijk_Ailk_Bjlk_SB_MT032x008x32_GRVW02_GSU08_SNLL0_TT02_02_VW02_WG16_04_04
    SolutionIndex: 64
    SolutionNameMin: Cijk_Ailk_Bjlk_SB_MT016x016x32_GRVW02_GSU08_SNLL0_TT02_02_VW02_WG08_08_04
    SolutionIndex: 65
    SolutionNameMin: Cijk_Ailk_Bjlk_SB_MT128x128x08_GRVW04_GSU01_SNLL0_TT08_08_VW04_WG16_16_01
    SolutionIndex: 66
    SolutionNameMin: Cijk_Ailk_Bjlk_SB_MT064x064x16_GRVW04_GSU01_SNLL0_TT04_04_VW04_WG16_16_01
    SolutionIndex: 67
    SolutionNameMin: Cijk_Ailk_Bjlk_SB_MT064x128x16_GRVW04_GSU01_SNLL0_TT04_08_VW04_WG16_16_01
    SolutionIndex: 68
    SolutionNameMin: Cijk_Ailk_Bjlk_SB_MT128x064x16_GRVW04_GSU01_SNLL0_TT08_04_VW04_WG16_16_01
    SolutionIndex: 69
    SolutionNameMin: Cijk_Ailk_Bjlk_SB_MT064x064x16_GRVW04_GSU01_SNLL0_TT04_04_VW04_WG16_16_01
    SolutionIndex: 70
    SolutionNameMin: Cijk_Ailk_Bjlk_SB_MT064x128x16_GRVW04_GSU01_SNLL0_TT04_08_VW04_WG16_16_01
    SolutionIndex: 71
    SolutionNameMin: Cijk_Ailk_Bjlk_SB_MT128x064x16_GRVW04_GSU01_SNLL0_TT08_04_VW04_WG16_16_01
    SolutionIndex: 72
    SolutionNameMin: Cijk_Ailk_Bjlk_SB_MT128x128x08_GRVW04_GSU01_SNLL1_TT08_08_VW04_WG16_16_01
    SolutionIndex: 73
    SolutionNameMin: Cijk_Ailk_Bjlk_SB_MT128x128x08_GRVW04_GSU01_SNLL1_TT08_08_VW04_WG16_16_01
    SolutionIndex: 74
    SolutionNameMin: Cijk_Ailk_Bjlk_SB_MT064x064x16_GRVW04_GSU01_SNLL1_TT04_04_VW04_WG16_16_01
    SolutionIndex: 75
    SolutionNameMin: Cijk_Ailk_Bjlk_SB_MT064x128x16_GRVW04_GSU01_SNLL1_TT04_08_VW04_WG16_16_01
    SolutionIndex: 76
    SolutionNameMin: Cijk_Ailk_Bjlk_SB_MT096x128x16_GRVW02_GSU01_SNLL1_TT06_08_VW02_WG16_16_01
    SolutionIndex: 77
    SolutionNameMin: Cijk_Ailk_Bjlk_SB_MT128x064x16_GRVW04_GSU01_SNLL1_TT08_04_VW04_WG16_16_01
    SolutionIndex: 78
    SolutionNameMin: Cijk_Ailk_Bjlk_SB_MT128x096x16_GRVW02_GSU01_SNLL1_TT08_06_VW02_WG16_16_01
    SolutionIndex: 79
    SolutionNameMin: Cijk_Ailk_Bjlk_SB_MT128x128x16_GRVW04_GSU01_SNLL1_TT08_08_VW04_WG16_16_01
    SolutionIndex: 80
    SolutionNameMin: Cijk_Ailk_Bjlk_SB_MT064x064x16_GRVW04_GSU01_SNLL1_TT04_04_VW04_WG16_16_01
    SolutionIndex: 81
    SolutionNameMin: Cijk_Ailk_Bjlk_SB_MT064x128x16_GRVW04_GSU01_SNLL1_TT04_08_VW04_WG16_16_01
    SolutionIndex: 82
    SolutionNameMin: Cijk_Ailk_Bjlk_SB_MT096x128x16_GRVW02_GSU01_SNLL1_TT06_08_VW02_WG16_16_01
    SolutionIndex: 83
    SolutionNameMin: Cijk_Ailk_Bjlk_SB_MT128x064x16_GRVW04_GSU01_SNLL1_TT08_04_VW04_WG16_16_01
    SolutionIndex: 84
    SolutionNameMin: Cijk_Ailk_Bjlk_SB_MT128x096x16_GRVW02_GSU01_SNLL1_TT08_06_VW02_WG16_16_01
    SolutionIndex: 85
    SolutionNameMin: Cijk_Ailk_Bjlk_SB_MT128x128x16_GRVW04_GSU01_SNLL1_TT08_08_VW04_WG16_16_01
    SolutionIndex: 86
    SolutionNameMin: Cijk_Ailk_Bjlk_SB_MT016x016x04_GRVW02_GSU01_SNLL0_TT02_02_VW02_WG08_08_01
    SolutionIndex: 87
    SolutionNameMin: Cijk_Ailk_Bjlk_SB_MT032x032x02_GRVW04_GSU01_SNLL0_TT04_04_VW04_WG08_08_01
    SolutionIndex: 88
    SolutionNameMin: Cijk_Ailk_Bjlk_SB_MT008x008x08_GRVW02_GSU01_SNLL1_TT02_02_VW02_WG04_04_04
    SolutionIndex: 89
    SolutionNameMin: Cijk_Ailk_Bjlk_SB_MT016x016x16_GRVW02_GSU01_SNLL1_TT02_02_VW02_WG08_08_04
    SolutionIndex: 90
    SolutionNameMin: Cijk_Ailk_Bjlk_SB_MT008x008x08_GRVW02_GSU02_SNLL0_TT02_02_VW02_WG04_04_04
    SolutionIndex: 91
    SolutionNameMin: Cijk_Ailk_Bjlk_SB_MT016x016x04_GRVW02_GSU04_SNLL0_TT02_02_VW02_WG08_08_01
    SolutionIndex: 92
    SolutionNameMin: Cijk_Ailk_Bjlk_SB_MT008x008x08_GRVW02_GSU04_SNLL0_TT02_02_VW02_WG04_04_04
    SolutionIndex: 93
    SolutionNameMin: Cijk_Ailk_Bjlk_SB_MT016x016x04_GRVW02_GSU08_SNLL0_TT02_02_VW02_WG08_08_01
    SolutionIndex: 94
    SolutionNameMin: Cijk_Ailk_Bjlk_SB_MT008x008x08_GRVW02_GSU08_SNLL0_TT02_02_VW02_WG04_04_04
    SolutionIndex: 95
    SolutionNameMin: Cijk_Ailk_Bjlk_SB_MT016x016x08_GRVW02_GSU16_SNLL0_TT02_02_VW02_WG08_08_02
    SolutionIndex: 96
    SolutionNameMin: Cijk_Ailk_Bjlk_SB_MT008x008x08_GRVW02_GSU16_SNLL0_TT02_02_VW02_WG04_04_04
    SolutionIndex: 97
    SolutionNameMin: Cijk_Ailk_Bjlk_SB_MT016x016x16_GRVW02_GSU16_SNLL0_TT02_02_VW02_WG08_08_04
    SolutionIndex: 98
    SolutionNameMin: Cijk_Ailk_Bjlk_SB_MT064x128x08_DTL0_GRVW01_GSU01_PGR1_PLR1_TT04_08_USFGRO01_VW02_WG16_16_01_WGM01
    SolutionIndex: 99
    SolutionNameMin: Cijk_Ailk_Bjlk_SB_MT064x064x08_DTL0_GRVW01_GSU01_PGR1_PLR1_TT04_08_USFGRO01_VW04_WG16_08_01_WGM01
    SolutionIndex: 100
    SolutionNameMin: Cijk_Ailk_Bjlk_SB_MT032x256x08_DTL1_GRVW01_GSU01_PGR0_PLR1_TT04_08_USFGRO01_VW04_WG08_32_01_WGM01
    SolutionIndex: 101
    SolutionNameMin: Cijk_Ailk_Bjlk_SB_MT032x256x08_DTL1_GRVW01_GSU01_PGR0_PLR1_TT04_08_USFGRO01_VW04_WG08_32_01_WGM08
    SolutionIndex: 102
    SolutionNameMin: Cijk_Ailk_Bjlk_SB_MT032x256x08_DTL1_GRVW01_GSU01_PGR0_PLR1_TT04_08_USFGRO01_VW04_WG08_32_01_WGM64
    SolutionIndex: 103
    SolutionNameMin: Cijk_Ailk_Bjlk_SB_MT064x064x16_DTL0_GRVW01_GSU01_PGR0_PLR1_TT04_08_USFGRO01_VW04_WG16_08_01_WGM01
    SolutionIndex: 104
    SolutionNameMin: Cijk_Ailk_Bjlk_SB_MT064x064x08_DTL0_GRVW04_GSU01_PGR1_PLR1_TT04_08_USFGRO0_VW04_WG16_08_01_WGM01
    SolutionIndex: 105
    SolutionNameMin: Cijk_Ailk_Bjlk_SB_MT064x128x16_DTL0_GRVW04_GSU01_PGR0_PLR1_TT08_04_USFGRO0_VW04_WG08_32_01_WGM01
    SolutionIndex: 106
    SolutionNameMin: Cijk_Ailk_Bjlk_SB_MT064x064x16_DTL0_GRVW04_GSU01_PGR1_PLR1_TT04_04_USFGRO0_VW04_WG16_16_01_WGM01
    SolutionIndex: 107
    SolutionNameMin: Cijk_Ailk_Bjlk_SB_MT064x128x16_DTL0_GRVW04_GSU01_PGR0_PLR1_TT04_08_USFGRO0_VW04_WG16_16_01_WGM01
    SolutionIndex: 108
    SolutionNameMin: Cijk_Ailk_Bjlk_SB_MT064x128x16_DTL0_GRVW04_GSU01_PGR0_PLR1_TT04_08_USFGRO0_VW04_WG16_16_01_WGM08
    SolutionIndex: 109
    SolutionNameMin: Cijk_Ailk_Bjlk_SB_MT64x64x8_SE_EPS1_GSU1_PGR1_PLR1_SNLL1_TT8_8_VW4_WG8_8_1_WGM8
    SolutionIndex: 110
    SolutionNameMin: Cijk_Ailk_Bjlk_SB_MT64x64x8_SE_EPS1_GSU1_PGR1_PLR1_SNLL1_TT8_8_VW4_WG8_8_1_WGM64
    SolutionIndex: 111
    SolutionNameMin: Cijk_Ailk_Bjlk_SB_MT64x64x16_SE_EPS1_GSU1_PGR1_PLR1_SNLL1_TT4_4_VW4_WG16_16_1_WGM1
    SolutionIndex: 112
    SolutionNameMin: Cijk_Ailk_Bjlk_SB_MT128x32x16_SE_EPS0_GSU1_PGR0_PLR1_SNLL0_TT8_4_VW4_WG16_8_1_WGM8
    SolutionIndex: 113
    SolutionNameMin: Cijk_Ailk_Bjlk_SB_MT64x64x16_SE_EPS0_GSU1_PGR0_PLR1_SNLL0_TT4_4_VW4_WG16_16_1_WGM8
    SolutionIndex: 114
    SolutionNameMin: Cijk_Ailk_Bjlk_SB_MT64x64x16_SE_EPS1_GSU1_PGR1_PLR1_SNLL1_TT4_4_VW4_WG16_16_1_WGM8
    SolutionIndex: 115
    SolutionNameMin: Cijk_Ailk_Bjlk_SB_MT64x64x16_SE_EPS0_GSU1_PGR0_PLR0_SNLL0_TT4_4_VW4_WG16_16_1_WGM64
    SolutionIndex: 116
    SolutionNameMin: Cijk_Ailk_Bjlk_SB_MT64x64x16_SE_EPS0_GSU1_PGR0_PLR1_SNLL0_TT4_4_VW4_WG16_16_1_WGM64
    SolutionIndex: 117
    SolutionNameMin: Cijk_Ailk_Bjlk_SB_MT64x64x16_SE_EPS1_GSU1_PGR1_PLR1_SNLL1_TT4_4_VW4_WG16_16_1_WGM64
    SolutionIndex: 118
    SolutionNameMin: Cijk_Ailk_Bjlk_SB_MT64x64x8_SE_EPS1_FL0_GRVW1_NLCA1_NLCB1_PGR1_PLR0_SNLL1_TT4_4_USFGRO1_VW1_WGM1
    SolutionIndex: 119
    SolutionNameMin: Cijk_Ailk_Bjlk_SB_MT64x64x8_SE_EPS0_FL0_GRVW1_NLCA1_NLCB1_PGR0_PLR1_SNLL0_TT4_4_USFGRO1_VW1_WGM1
    SolutionIndex: 120
    SolutionNameMin: Cijk_Ailk_Bjlk_SB_MT64x32x8_SE_EPS0_FL0_GRVW1_NLCA1_NLCB1_PGR0_PLR1_SNLL0_TT4_2_USFGRO1_VW1_WGM1
    SolutionIndex: 121
    SolutionNameMin: Cijk_Ailk_Bjlk_SB_MT64x128x8_SE_EPS1_FL0_GRVW1_NLCA1_NLCB1_PGR1_PLR0_SNLL1_TT4_8_USFGRO1_VW1_WGM1
    SolutionIndex: 122
    SolutionNameMin: Cijk_Ailk_Bjlk_SB_MT64x32x8_SE_EPS0_FL0_GRVW1_NLCA1_NLCB1_PGR0_PLR0_SNLL0_TT4_4_USFGRO1_VW1_WGM1
    SolutionIndex: 123
    SolutionNameMin: Cijk_Ailk_Bjlk_SB_MT64x32x8_SE_EPS0_FL0_GRVW1_NLCA1_NLCB1_PGR0_PLR1_SNLL0_TT4_4_USFGRO1_VW1_WGM1
    SolutionIndex: 124
    SolutionNameMin: Cijk_Ailk_Bjlk_SB_MT64x16x8_SE_EPS0_FL0_GRVW1_NLCA1_NLCB1_PGR0_PLR0_SNLL0_TT4_2_USFGRO1_VW1_WGM1
    SolutionIndex: 125
    SolutionNameMin: Cijk_Ailk_Bjlk_SB_MT64x16x8_SE_EPS0_FL0_GRVW1_NLCA1_NLCB1_PGR0_PLR1_SNLL0_TT4_2_USFGRO1_VW1_WGM1
    SolutionIndex: 126
    SolutionNameMin: Cijk_Ailk_Bjlk_SB_MT64x64x8_SE_EPS1_FL0_GRVW1_NLCA1_NLCB1_PGR1_PLR0_SNLL1_TT4_4_USFGRO1_VW1_WGM8
    SolutionIndex: 127
    SolutionNameMin: Cijk_Ailk_Bjlk_SB_MT64x128x8_SE_EPS1_FL0_GRVW1_NLCA1_NLCB1_PGR1_PLR0_SNLL1_TT4_8_USFGRO1_VW1_WGM8
    SolutionIndex: 128
    SolutionNameMin: Cijk_Ailk_Bjlk_SB_MT64x32x8_SE_EPS0_FL0_GRVW1_NLCA1_NLCB1_PGR0_PLR0_SNLL0_TT4_4_USFGRO1_VW1_WGM8
    SolutionIndex: 129
    SolutionNameMin: Cijk_Ailk_Bjlk_SB_MT64x32x8_SE_EPS0_FL0_GRVW1_NLCA1_NLCB1_PGR0_PLR1_SNLL0_TT4_4_USFGRO1_VW1_WGM8
    SolutionIndex: 130
    SolutionNameMin: Cijk_Ailk_Bjlk_SB_MT64x16x8_SE_EPS0_FL0_GRVW1_NLCA1_NLCB1_PGR0_PLR1_SNLL0_TT4_2_USFGRO1_VW1_WGM8
    SolutionIndex: 131
    SolutionNameMin: Cijk_Ailk_Bjlk_SB_MT64x64x16_SE_EPS0_FL0_GRVW1_NLCA1_NLCB1_PGR0_PLR0_SNLL0_TT4_4_USFGRO1_VW1_WGM1
    SolutionIndex: 132
    SolutionNameMin: Cijk_Ailk_Bjlk_SB_MT64x16x16_SE_EPS0_FL0_GRVW1_NLCA1_NLCB1_PGR0_PLR0_SNLL0_TT4_2_USFGRO1_VW1_WGM1
    SolutionIndex: 133
    SolutionNameMin: Cijk_Ailk_Bjlk_SB_MT64x16x16_SE_EPS0_FL0_GRVW1_NLCA1_NLCB1_PGR0_PLR1_SNLL0_TT4_2_USFGRO1_VW1_WGM1
    SolutionIndex: 134
    SolutionNameMin: Cijk_Ailk_Bjlk_SB_MT64x32x32_SE_EPS0_FL0_GRVW1_NLCA1_NLCB1_PGR0_PLR1_SNLL0_TT4_2_USFGRO1_VW1_WGM8
    SolutionIndex: 135
    SolutionNameMin: Cijk_Ailk_Bjlk_SB_MT64x32x8_SE_EPS0_FL0_GRVW1_NLCA1_NLCB1_PGR0_PLR0_SNLL0_TT4_4_USFGRO1_VW4_WGM1
    SolutionIndex: 136
    SolutionNameMin: Cijk_Ailk_Bjlk_SB_MT64x32x8_SE_EPS0_FL0_GRVW1_NLCA1_NLCB1_PGR0_PLR1_SNLL0_TT4_4_USFGRO1_VW4_WGM1
    SolutionIndex: 137
    SolutionNameMin: Cijk_Ailk_Bjlk_SB_MT64x32x8_SE_EPS0_FL0_GRVW1_NLCA1_NLCB1_PGR0_PLR0_SNLL0_TT4_4_USFGRO1_VW4_WGM8
    SolutionIndex: 138
    SolutionNameMin: Cijk_Ailk_Bjlk_SB_MT64x32x8_SE_EPS0_FL0_GRVW1_NLCA1_NLCB1_PGR0_PLR1_SNLL0_TT4_4_USFGRO1_VW4_WGM8
    SolutionIndex: 139
    SolutionNameMin: Cijk_Ailk_Bjlk_SB_MT64x64x8_SE_EPS1_FL0_GRVW4_NLCA1_NLCB1_PGR1_PLR1_SNLL1_TT8_4_USFGRO0_VW4_WGM1
    SolutionIndex: 140
    SolutionNameMin: Cijk_Ailk_Bjlk_SB_MT64x64x16_SE_EPS1_FL0_GRVW4_NLCA1_NLCB1_PGR1_PLR1_SNLL1_TT4_4_USFGRO0_VW4_WGM1
    SolutionIndex: 141
    SolutionNameMin: Cijk_Ailk_Bjlk_SB_MT64x64x16_SE_EPS1_FL1_GRVW4_NLCA1_NLCB1_PGR1_PLR1_SNLL1_TT4_4_USFGRO0_VW4_WGM1
    SolutionIndex: 142
    SolutionNameMin: Cijk_Ailk_Bjlk_SB_MT64x128x16_SE_EPS1_FL0_GRVW4_NLCA1_NLCB1_PGR1_PLR1_SNLL1_TT4_8_USFGRO0_VW4_WGM1
    SolutionIndex: 143
    SolutionNameMin: Cijk_Ailk_Bjlk_SB_MT128x64x16_SE_EPS1_FL0_GRVW4_NLCA1_NLCB1_PGR1_PLR1_SNLL1_TT8_4_USFGRO0_VW4_WGM1
    SolutionIndex: 144
    SolutionNameMin: Cijk_Ailk_Bjlk_SB_MT128x64x16_SE_EPS1_FL1_GRVW4_NLCA1_NLCB1_PGR1_PLR1_SNLL1_TT8_4_USFGRO0_VW4_WGM1
    SolutionIndex: 145
    SolutionNameMin: Cijk_Ailk_Bjlk_SB_MT128x128x16_SE_EPS1_FL0_GRVW4_NLCA1_NLCB1_PGR1_PLR1_SNLL1_TT8_8_USFGRO0_VW4_WGM1
    SolutionIndex: 146
    SolutionNameMin: Cijk_Ailk_Bjlk_SB_MT128x128x16_SE_EPS1_FL1_GRVW4_NLCA1_NLCB1_PGR1_PLR1_SNLL1_TT8_8_USFGRO0_VW4_WGM1
    SolutionIndex: 147
    SolutionNameMin: Cijk_Ailk_Bjlk_SB_MT64x64x16_SE_EPS1_FL0_GRVW4_NLCA1_NLCB1_PGR1_PLR1_SNLL1_TT4_4_USFGRO0_VW4_WGM8
    SolutionIndex: 148
    SolutionNameMin: Cijk_Ailk_Bjlk_SB_MT64x128x16_SE_EPS1_FL0_GRVW4_NLCA1_NLCB1_PGR1_PLR1_SNLL1_TT4_8_USFGRO0_VW4_WGM8
    SolutionIndex: 149
    SolutionNameMin: Cijk_Ailk_Bjlk_SB_MT64x128x16_SE_EPS1_FL1_GRVW4_NLCA1_NLCB1_PGR1_PLR1_SNLL1_TT4_8_USFGRO0_VW4_WGM8
    SolutionIndex: 150
    SolutionNameMin: Cijk_Ailk_Bjlk_SB_MT128x64x16_SE_EPS1_FL0_GRVW4_NLCA1_NLCB1_PGR1_PLR1_SNLL1_TT8_4_USFGRO0_VW4_WGM8
    SolutionIndex: 151
    SolutionNameMin: Cijk_Ailk_Bjlk_SB_MT128x64x16_SE_EPS1_FL1_GRVW4_NLCA1_NLCB1_PGR1_PLR1_SNLL1_TT8_4_USFGRO0_VW4_WGM8
    SolutionIndex: 152
    SolutionNameMin: Cijk_Ailk_Bjlk_SB_MT128x128x16_SE_EPS1_FL0_GRVW4_NLCA1_NLCB1_PGR1_PLR1_SNLL1_TT8_8_USFGRO0_VW4_WGM8
    SolutionIndex: 153
    SolutionNameMin: Cijk_Ailk_Bjlk_SB_MT128x128x16_SE_EPS1_FL1_GRVW4_NLCA1_NLCB1_PGR1_PLR1_SNLL1_TT8_8_USFGRO0_VW4_WGM8
    SolutionIndex: 154
    SolutionNameMin: Cijk_Ailk_Bjlk_SB_MT64x64x16_SE_EPS1_FL1_GRVW4_NLCA1_NLCB1_PGR1_PLR0_TT4_4_USFGRO0_VW4_WGM8
    SolutionIndex: 155
    SolutionNameMin: Cijk_Ailk_Bjlk_SB_MT64x128x8_SE_EPS1_FL0_GRVW2_NLCA1_NLCB1_PGR1_PLR1_TT4_8_USFGRO0_VW2_WGM8
    SolutionIndex: 156
    SolutionNameMin: Cijk_Ailk_Bjlk_SB_MT128x64x8_SE_EPS1_FL0_GRVW1_NLCA1_NLCB1_PGR1_PLR0_TT8_4_USFGRO1_VW4_WGM8
    SolutionIndex: 157
    SolutionNameMin: Cijk_Ailk_Bjlk_SB_MT128x64x8_SE_EPS1_FL1_GRVW2_NLCA1_NLCB1_PGR1_PLR1_TT8_4_USFGRO0_VW2_WGM8
    SolutionIndex: 158
    SolutionNameMin: Cijk_Ailk_Bjlk_SB_MT64x64x8_SE_DTL0_EPS0_FL0_GRVW1_PGR0_PLR1_TT4_4_USFGRO1_VW2_WG16_16_1_WGM1
    SolutionIndex: 159
    SolutionNameMin: Cijk_Ailk_Bjlk_SB_MT64x64x8_SE_DTL0_EPS0_FL0_GRVW1_PGR0_PLR1_TT4_4_USFGRO1_VW4_WG16_16_1_WGM1
    SolutionIndex: 160
    SolutionNameMin: Cijk_Ailk_Bjlk_SB_MT64x64x8_SE_DTL0_EPS1_FL0_GRVW1_PGR1_PLR1_TT4_4_USFGRO1_VW4_WG16_16_1_WGM1
    SolutionIndex: 161
    SolutionNameMin: Cijk_Ailk_Bjlk_SB_MT64x64x16_SE_DTL0_EPS1_FL0_GRVW1_PGR1_PLR1_TT4_4_USFGRO1_VW4_WG16_16_1_WGM1
    SolutionIndex: 162
    SolutionNameMin: Cijk_Ailk_Bjlk_SB_MT64x64x16_SE_DTL0_EPS1_FL0_GRVW4_PGR1_PLR1_TT4_4_USFGRO0_VW4_WG16_16_1_WGM1
    SolutionIndex: 163
    SolutionNameMin: Cijk_Ailk_Bjlk_SB_MT32x8x32_SE_DTL0_EPS1_FL0_GRVW1_PGR1_PLR0_TT2_2_USFGRO1_VW2_WG16_4_4_WGM1
    SolutionIndex: 164
    SolutionNameMin: Cijk_Ailk_Bjlk_SB_MT32x8x16_SE_DTL0_EPS1_FL1_GRVW2_PGR1_PLR0_TT2_2_USFGRO0_VW2_WG16_4_4_WGM1
    SolutionIndex: 165
    SolutionNameMin: Cijk_Ailk_Bjlk_SB_MT96x64x8_SE_DTL0_EPS1_FL1_GRVW2_PGR1_PLR1_TT6_4_USFGRO0_VW2_WG16_16_1_WGM1
    SolutionIndex: 166
    SolutionNameMin: Cijk_Ailk_Bjlk_SB_MT96x64x8_SE_DTL0_EPS1_FL1_GRVW2_PGR1_PLR1_TT6_4_USFGRO0_VW2_WG16_16_1_WGM8
    SolutionIndex: 167
    SolutionNameMin: Cijk_Ailk_Bjlk_SB_MT64x96x8_SE_DTL0_EPS1_FL1_GRVW2_PGR1_PLR1_TT4_6_USFGRO0_VW2_WG16_16_1_WGM1
    SolutionIndex: 168
    SolutionNameMin: Cijk_Ailk_Bjlk_SB_MT64x128x8_SE_DTL0_EPS1_FL0_GRVW1_PGR1_PLR0_TT4_8_USFGRO1_VW4_WG16_16_1_WGM1
    SolutionIndex: 169
    SolutionNameMin: Cijk_Ailk_Bjlk_SB_MT64x128x8_SE_DTL0_EPS1_FL0_GRVW2_PGR1_PLR1_TT4_8_USFGRO0_VW2_WG16_16_1_WGM1
    SolutionIndex: 170
    SolutionNameMin: Cijk_Ailk_Bjlk_SB_MT128x64x8_SE_DTL0_EPS1_FL1_GRVW2_PGR1_PLR1_TT8_4_USFGRO0_VW2_WG16_16_1_WGM1
    SolutionIndex: 171
    SolutionNameMin: Cijk_Ailk_Bjlk_SB_MT64x64x8_SE_AMAS3_EPS1_FL0_GRVW4_GSU1_PGR1_PLR1_TT4_4_USFGRO0_VW2_WG16_16_1_WGM1
    SolutionIndex: 172
    SolutionNameMin: Cijk_Ailk_Bjlk_SB_MT64x64x16_SE_AMAS3_EPS1_FL0_GRVW4_GSU1_PGR1_PLR1_TT4_4_USFGRO0_VW4_WG16_16_1_WGM8
    SolutionIndex: 173
    SolutionNameMin: Cijk_Ailk_Bjlk_SB_MT64x32x8_SE_AMAS3_EPS1_FL0_GRVW2_GSU1_PGR1_PLR1_TT4_4_USFGRO0_VW2_WG16_8_2_WGM8
    SolutionIndex: 174
    SolutionNameMin: Cijk_Ailk_Bjlk_SB_MT8x32x32_SE_AMAS3_EPS1_FL0_GRVW1_GSU1_PGR1_PLR1_TT2_2_USFGRO1_VW2_WG4_16_4_WGM1
    SolutionIndex: 175
    SolutionNameMin: Cijk_Ailk_Bjlk_SB_MT16x32x32_SE_AMAS1_EPS1_FL0_GRVW1_GSU1_PGR1_PLR1_TT4_2_USFGRO1_VW1_WG4_16_4_WGM8
    SolutionIndex: 176
    SolutionNameMin: Cijk_Ailk_Bjlk_SB_MT16x32x32_SE_AMAS3_EPS1_FL0_GRVW1_GSU1_PGR1_PLR1_TT4_2_USFGRO1_VW2_WG4_16_4_WGM8
    SolutionIndex: 177
    SolutionNameMin: Cijk_Ailk_Bjlk_SB_MT32x8x32_SE_AMAS1_EPS1_FL0_GRVW1_GSU1_PGR1_PLR1_TT2_2_USFGRO1_VW1_WG16_4_4_WGM8
    SolutionIndex: 178
    SolutionNameMin: Cijk_Ailk_Bjlk_SB_MT64x16x16_SE_AMAS3_EPS1_FL0_GRVW4_GSU1_PGR1_PLR0_TT4_4_USFGRO0_VW4_WG16_4_4_WGM1
    SolutionIndex: 179
    SolutionNameMin: Cijk_Ailk_Bjlk_SB_MT128x64x8_SE_AMAS3_EPS1_FL0_GRVW1_GSU1_PGR1_PLR1_TT8_4_USFGRO1_VW4_WG16_16_1_WGM8
    SolutionIndex: 180
    SolutionNameMin: Cijk_Ailk_Bjlk_SB_MT128x64x8_SE_AMAS3_EPS1_FL1_GRVW2_GSU1_PGR1_PLR0_TT8_4_USFGRO0_VW2_WG16_16_1_WGM8
    SolutionIndex: 181
    SolutionNameMin: Cijk_Ailk_Bjlk_SB_MT64x64x16_SE_EPS1_FL0_GRVW4_GSU1_PGR1_PLR0_TT4_4_USFGRO0_VW4_WG16_16_1_WGM8
    SolutionIndex: 182
    SolutionNameMin: Cijk_Ailk_Bjlk_SB_MT64x64x16_SE_EPS1_FL0_GRVW4_GSU1_PGR1_PLR1_TT4_4_USFGRO0_VW4_WG16_16_1_WGM1
    SolutionIndex: 183
    SolutionNameMin: Cijk_Ailk_Bjlk_SB_MT64x64x16_SE_EPS1_FL1_GRVW4_GSU1_PGR1_PLR1_TT4_4_USFGRO0_VW4_WG16_16_1_WGM1
    SolutionIndex: 184
    SolutionNameMin: Cijk_Ailk_Bjlk_SB_MT64x64x16_SE_EPS1_FL1_GRVW4_GSU1_PGR1_PLR1_TT4_4_USFGRO0_VW4_WG16_16_1_WGM8
    SolutionIndex: 185
    SolutionNameMin: Cijk_Ailk_Bjlk_SB_MT64x96x8_SE_EPS1_FL1_GRVW2_GSU1_PGR1_PLR0_TT4_6_USFGRO0_VW2_WG16_16_1_WGM1
    SolutionIndex: 186
    SolutionNameMin: Cijk_Ailk_Bjlk_SB_MT64x96x8_SE_EPS1_FL1_GRVW2_GSU1_PGR1_PLR1_TT4_6_USFGRO0_VW2_WG16_16_1_WGM1
    SolutionIndex: 187
    SolutionNameMin: Cijk_Ailk_Bjlk_SB_MT64x96x8_SE_EPS1_FL1_GRVW2_GSU1_PGR1_PLR1_TT4_6_USFGRO0_VW2_WG16_16_1_WGM8
    SolutionIndex: 188
    SolutionNameMin: Cijk_Ailk_Bjlk_SB_MT64x128x8_SE_EPS1_FL0_GRVW2_GSU1_PGR1_PLR1_TT4_8_USFGRO0_VW2_WG16_16_1_WGM1
    SolutionIndex: 189
    SolutionNameMin: Cijk_Ailk_Bjlk_SB_MT64x128x8_SE_EPS1_FL1_GRVW2_GSU1_PGR1_PLR1_TT4_8_USFGRO0_VW2_WG16_16_1_WGM1
    SolutionIndex: 190
    SolutionNameMin: Cijk_Ailk_Bjlk_SB_MT64x128x8_SE_EPS1_FL1_GRVW2_GSU1_PGR1_PLR1_TT4_8_USFGRO0_VW2_WG16_16_1_WGM8
    SolutionIndex: 191
    SolutionNameMin: Cijk_Ailk_Bjlk_SB_MT128x64x8_SE_EPS1_FL0_GRVW2_GSU1_PGR1_PLR1_TT8_4_USFGRO0_VW2_WG16_16_1_WGM1
    SolutionIndex: 192
    SolutionNameMin: Cijk_Ailk_Bjlk_SB_MT128x64x8_SE_EPS1_FL0_GRVW2_GSU1_PGR1_PLR1_TT8_4_USFGRO0_VW2_WG16_16_1_WGM8
    SolutionIndex: 193
    SolutionNameMin: Cijk_Ailk_Bjlk_SB_MT128x64x8_SE_EPS1_FL1_GRVW2_GSU1_PGR1_PLR1_TT8_4_USFGRO0_VW2_WG16_16_1_WGM1
    SolutionIndex: 194
    SolutionNameMin: Cijk_Ailk_Bjlk_SB_MT128x128x8_SE_EPS1_FL0_GRVW1_GSU1_PGR1_PLR1_TT8_8_USFGRO1_VW2_WG16_16_1_WGM1
    SolutionIndex: 195
    SolutionNameMin: Cijk_Ailk_Bjlk_SB_MT128x128x8_SE_EPS1_FL0_GRVW1_GSU1_PGR1_PLR0_TT8_8_USFGRO1_VW4_WG16_16_1_WGM8
    SolutionIndex: 196
    SolutionNameMin: Cijk_Ailk_Bjlk_SB_MT32x64x32_SE_EPS1_FL0_GRVW4_GSU1_PGR1_PLR1_TT4_4_USFGRO0_VW4_WG8_16_2_WGM1
    SolutionIndex: 197
    SolutionNameMin: Cijk_Ailk_Bjlk_SB_MT32x64x32_SE_EPS1_FL0_GRVW4_GSU1_PGR1_PLR1_TT4_4_USFGRO0_VW4_WG8_16_2_WGM8
    SolutionIndex: 198
    SolutionNameMin: Cijk_Ailk_Bjlk_SB_MT32x64x32_SE_EPS1_FL1_GRVW4_GSU1_PGR1_PLR1_TT4_4_USFGRO0_VW4_WG8_16_2_WGM1
    SolutionIndex: 199
    SolutionNameMin: Cijk_Ailk_Bjlk_SB_MT32x64x32_SE_EPS1_FL1_GRVW4_GSU1_PGR1_PLR1_TT4_4_USFGRO0_VW4_WG8_16_2_WGM8
    SolutionIndex: 200
    SolutionNameMin: Cijk_Ailk_Bjlk_SB_MT64x32x32_SE_EPS1_FL0_GRVW4_GSU1_PGR1_PLR1_TT4_4_USFGRO0_VW4_WG16_8_2_WGM8
    SolutionIndex: 201
    SolutionNameMin: Cijk_Ailk_Bjlk_SB_MT64x32x32_SE_EPS1_FL1_GRVW4_GSU1_PGR1_PLR1_TT4_4_USFGRO0_VW4_WG16_8_2_WGM8
    SolutionIndex: 202
    SolutionNameMin: Cijk_Ailk_Bjlk_SB_MT64x32x16_SE_AMAS1_GRVW1_TT4_4_USFGRO1_VW1_WG16_8_2_WGM8
    SolutionIndex: 203
    SolutionNameMin: Cijk_Ailk_Bjlk_SB_MT32x16x32_SE_AMAS3_GRVW2_TT4_2_USFGRO0_VW2_WG8_8_4_WGM8
    SolutionIndex: 204
    SolutionNameMin: Cijk_Ailk_Bjlk_SB_MT128x128x16_SE_AMAS3_GRVW1_TT8_8_USFGRO1_VW4_WG16_16_1_WGM1
    SolutionIndex: 205
    SolutionNameMin: Cijk_Ailk_Bjlk_SB_MT64x32x8_SE_AMAS1_GRVW1_TT4_2_USFGRO1_VW1_WG16_16_1_WGM8
    SolutionIndex: 206
    SolutionNameMin: Cijk_Ailk_Bjlk_SB_MT16x32x16_SE_AMAS3_GRVW1_TT2_4_USFGRO1_VW2_WG8_8_4_WGM1
    SolutionIndex: 207
    SolutionNameMin: Cijk_Ailk_Bjlk_SB_MT32x32x32_SE_AMAS3_GRVW2_TT4_4_USFGRO0_VW2_WG8_8_4_WGM1
    SolutionIndex: 208
    SolutionNameMin: Cijk_Ailk_Bjlk_SB_MT32x64x16_SE_AMAS3_GRVW2_TT4_4_USFGRO0_VW2_WG8_16_2_WGM1
    SolutionIndex: 209
    SolutionNameMin: Cijk_Ailk_Bjlk_SB_MT64x32x16_SE_AMAS3_GRVW1_TT4_4_USFGRO1_VW2_WG16_8_2_WGM8
    SolutionIndex: 210
    SolutionNameMin: Cijk_Ailk_Bjlk_SB_MT64x64x16_SE_AMAS3_GRVW4_TT4_4_USFGRO0_VW4_WG16_16_1_WGM8
    SolutionIndex: 211
    SolutionNameMin: Cijk_Ailk_Bjlk_SB_MT64x64x16_SE_AMAS1_GRVW1_TT4_4_USFGRO1_VW1_WG16_16_1_WGM1
    SolutionIndex: 212
    SolutionNameMin: Cijk_Ailk_Bjlk_SB_MT64x32x16_SE_AMAS3_GRVW1_TT4_4_USFGRO1_VW4_WG16_8_2_WGM8
    SolutionIndex: 213
    SolutionNameMin: Cijk_Ailk_Bjlk_SB_MT32x64x16_SE_AMAS3_GRVW2_TT4_4_USFGRO0_VW2_WG8_16_2_WGM8
    SolutionIndex: 214
    SolutionNameMin: Cijk_Ailk_Bjlk_SB_MT32x16x32_SE_AMAS3_GRVW2_TT4_2_USFGRO0_VW2_WG8_8_4_WGM1
    SolutionIndex: 215
    SolutionNameMin: Cijk_Ailk_Bjlk_SB_MT64x64x16_SE_AMAS3_GRVW4_TT4_4_USFGRO0_VW4_WG16_16_1_WGM8
    SolutionIndex: 216
    SolutionNameMin: Cijk_Ailk_Bjlk_SB_MT32x32x32_SE_AMAS3_GRVW1_TT4_4_USFGRO1_VW2_WG8_8_4_WGM1
    SolutionIndex: 217
    SolutionNameMin: Cijk_Ailk_Bjlk_SB_MT64x64x16_SE_AMAS3_GRVW1_TT4_4_USFGRO1_VW4_WG16_16_1_WGM1
    SolutionIndex: 218
    SolutionNameMin: Cijk_Ailk_Bjlk_SB_MT64x64x8_SE_AMAS3_GRVW4_TT4_4_USFGRO0_VW2_WG16_16_1_WGM1
    SolutionIndex: 219
    SolutionNameMin: Cijk_Ailk_Bjlk_SB_MT32x32x32_SE_AMAS3_GRVW4_TT4_4_USFGRO0_VW4_WG8_8_4_WGM1
    SolutionIndex: 220
    SolutionNameMin: Cijk_Ailk_Bjlk_SB_MT64x64x8_SE_AMAS3_GRVW2_TT4_4_USFGRO0_VW2_WG16_16_1_WGM1
    SolutionIndex: 221
    SolutionNameMin: Cijk_Ailk_Bjlk_SB_MT64x64x16_SE_AMAS3_GRVW4_TT4_4_USFGRO0_VW4_WG16_16_1_WGM1
    SolutionIndex: 222
    SolutionNameMin: Cijk_Ailk_Bjlk_SB_MT64x64x16_SE_AMAS3_GRVW1_TT4_4_USFGRO1_VW2_WG16_16_1_WGM1
    SolutionIndex: 223
    SolutionNameMin: Cijk_Ailk_Bjlk_SB_MT64x32x32_SE_AMAS3_GRVW4_TT4_4_USFGRO0_VW4_WG16_8_2_WGM1
    SolutionIndex: 224
    SolutionNameMin: Cijk_Ailk_Bjlk_SB_MT64x32x16_SE_AMAS3_GRVW2_TT4_4_USFGRO0_VW2_WG16_8_2_WGM1
    SolutionIndex: 225
    SolutionNameMin: Cijk_Ailk_Bjlk_SB_MT128x128x16_SE_AMAS3_GRVW2_TT8_8_USFGRO0_VW2_WG16_16_1_WGM8
    SolutionIndex: 226
    SolutionNameMin: Cijk_Ailk_Bjlk_SB_MT32x32x8_SE_AMAS3_GRVW4_TT4_2_USFGRO1_VW2_WG8_16_2_WGM8
    SolutionIndex: 227
    SolutionNameMin: Cijk_Ailk_Bjlk_SB_MT64x32x16_SE_AMAS3_GRVW1_TT4_4_USFGRO1_VW4_WG16_8_2_WGM1
    SolutionIndex: 228
    SolutionNameMin: Cijk_Ailk_Bjlk_SB_MT64x64x8_SE_AMAS3_GRVW4_TT4_4_USFGRO0_VW2_WG16_16_1_WGM8
    SolutionIndex: 229
    SolutionNameMin: Cijk_Ailk_Bjlk_SB_MT64x64x8_SE_AMAS3_GRVW1_TT4_4_USFGRO1_VW4_WG16_16_1_WGM8
    SolutionIndex: 230
    SolutionNameMin: Cijk_Ailk_Bjlk_SB_MT64x32x32_SE_AMAS3_GRVW4_TT4_4_USFGRO0_VW4_WG16_8_2_WGM1
    SolutionIndex: 231
    SolutionNameMin: Cijk_Ailk_Bjlk_SB_MT16x32x32_SE_AMAS3_GRVW1_TT2_4_USFGRO1_VW2_WG8_8_4_WGM8
    SolutionIndex: 232
    SolutionNameMin: Cijk_Ailk_Bjlk_SB_MT32x16x32_SE_AMAS1_GRVW1_TT4_2_USFGRO1_VW1_WG8_8_4_WGM8
    SolutionIndex: 233
    SolutionNameMin: Cijk_Ailk_Bjlk_SB_MT16x32x32_SE_AMAS3_GRVW2_TT2_4_USFGRO0_VW2_WG8_8_4_WGM1
    SolutionIndex: 234
    SolutionNameMin: Cijk_Ailk_Bjlk_SB_MT32x32x16_SE_AMAS3_GRVW2_TT4_4_USFGRO0_VW2_WG8_8_4_WGM1
    SolutionIndex: 235
    SolutionNameMin: Cijk_Ailk_Bjlk_SB_MT128x128x16_SE_AMAS3_GRVW1_TT8_8_USFGRO1_VW4_WG16_16_1_WGM8
    SolutionIndex: 236
    SolutionNameMin: Cijk_Ailk_Bjlk_SB_MT64x64x8_SE_AMAS3_GRVW1_TT4_4_USFGRO1_VW4_WG16_16_1_WGM1
    SolutionIndex: 237
    SolutionNameMin: Cijk_Ailk_Bjlk_SB_MT32x32x32_SE_AMAS3_GRVW2_TT4_4_USFGRO0_VW2_WG8_8_4_WGM8
    SolutionIndex: 238
    SolutionNameMin: Cijk_Ailk_Bjlk_SB_MT32x64x16_SE_AMAS3_GRVW1_TT4_4_USFGRO1_VW4_WG8_16_2_WGM8
    SolutionIndex: 239
    SolutionNameMin: Cijk_Ailk_Bjlk_SB_MT32x64x16_SE_AMAS3_GRVW2_TT4_4_USFGRO0_VW2_WG8_16_2_WGM1
    SolutionIndex: 240
    SolutionNameMin: Cijk_Ailk_Bjlk_SB_MT64x64x16_SE_AMAS3_GRVW2_TT4_4_USFGRO0_VW2_WG16_16_1_WGM8
    SolutionIndex: 241
    SolutionNameMin: Cijk_Ailk_Bjlk_SB_MT128x128x8_SE_AMAS3_GRVW1_TT8_8_USFGRO1_VW4_WG16_16_1_WGM1
    SolutionIndex: 242
    SolutionNameMin: Cijk_Ailk_Bjlk_SB_MT64x32x8_SE_AMAS3_GRVW1_TT4_4_USFGRO1_VW4_WG16_8_2_WGM1
    SolutionIndex: 243
    SolutionNameMin: Cijk_Ailk_Bjlk_SB_MT32x32x32_SE_AMAS3_GRVW1_TT4_4_USFGRO1_VW2_WG8_8_4_WGM8
    SolutionIndex: 244
    SolutionNameMin: Cijk_Ailk_Bjlk_SB_MT128x128x8_SE_AMAS3_GRVW1_TT8_8_USFGRO1_VW2_WG16_16_1_WGM8
    SolutionIndex: 245
    SolutionNameMin: Cijk_Ailk_Bjlk_SB_MT128x128x8_SE_AMAS3_GRVW1_TT8_8_USFGRO1_VW4_WG16_16_1_WGM8
    SolutionIndex: 246
    SolutionNameMin: Cijk_Ailk_Bjlk_SB_MT64x32x8_SE_AMAS1_GRVW1_TT4_2_USFGRO1_VW1_WG16_16_1_WGM1
    SolutionIndex: 247
    SolutionNameMin: Cijk_Ailk_Bjlk_SB_MT32x32x32_SE_AMAS3_GRVW4_TT4_4_USFGRO0_VW4_WG8_8_4_WGM8
    SolutionIndex: 248
    SolutionNameMin: Cijk_Ailk_Bjlk_SB_MT16x32x32_SE_AMAS1_GRVW1_TT2_4_USFGRO1_VW1_WG8_8_4_WGM8
    SolutionIndex: 249
    SolutionNameMin: Cijk_Ailk_Bjlk_SB_MT64x32x8_SE_AMAS3_GRVW1_TT4_2_USFGRO1_VW2_WG16_16_1_WGM1
    SolutionIndex: 250
    SolutionNameMin: Cijk_Ailk_Bjlk_SB_MT64x16x32_SE_AMAS3_GRVW1_TT4_2_USFGRO1_VW2_WG16_8_2_WGM8
    SolutionIndex: 251
    SolutionNameMin: Cijk_Ailk_Bjlk_SB_MT64x64x8_SE_AMAS3_GRVW2_TT4_4_USFGRO0_VW2_WG16_16_1_WGM1
    SolutionIndex: 252
    SolutionNameMin: Cijk_Ailk_Bjlk_SB_MT64x32x16_SE_AMAS3_GRVW2_TT4_4_USFGRO0_VW2_WG16_8_2_WGM1
    SolutionIndex: 253
    SolutionNameMin: Cijk_Ailk_Bjlk_SB_MT32x16x32_SE_AMAS1_GRVW1_TT4_2_USFGRO1_VW1_WG8_8_4_WGM1
    SolutionIndex: 254
    SolutionNameMin: Cijk_Ailk_Bjlk_SB_MT128x128x8_SE_AMAS3_GRVW1_TT8_8_USFGRO1_VW2_WG16_16_1_WGM1
    SolutionIndex: 255
    SolutionNameMin: Cijk_Ailk_Bjlk_SB_MT16x32x32_SE_AMAS1_GRVW1_TT2_4_USFGRO1_VW1_WG8_8_4_WGM1
    SolutionIndex: 256
    SolutionNameMin: Cijk_Ailk_Bjlk_SB_MT64x32x8_SE_AMAS3_GRVW4_TT4_2_USFGRO0_VW2_WG16_16_1_WGM1
    SolutionIndex: 257
    SolutionNameMin: Cijk_Ailk_Bjlk_SB_MT64x64x8_SE_AMAS3_GRVW1_TT4_4_USFGRO1_VW2_WG16_16_1_WGM1
    SolutionIndex: 258
    SolutionNameMin: Cijk_Ailk_Bjlk_SB_MT64x64x8_SE_AMAS3_GRVW4_TT4_4_USFGRO0_VW2_WG16_16_1_WGM8
    SolutionIndex: 259
    SolutionNameMin: Cijk_Ailk_Bjlk_SB_MT64x64x8_SE_AMAS3_GRVW4_TT4_4_USFGRO0_VW2_WG16_16_1_WGM1
    SolutionIndex: 260
    SolutionNameMin: Cijk_Ailk_Bjlk_SB_MT16x64x32_SE_AMAS3_GRVW2_TT2_4_USFGRO0_VW2_WG8_16_2_WGM1
    SolutionIndex: 261
    SolutionNameMin: Cijk_Ailk_Bjlk_SB_MT16x32x32_SE_AMAS3_GRVW2_TT2_4_USFGRO0_VW2_WG8_8_4_WGM8
    SolutionIndex: 262
    SolutionNameMin: Cijk_Ailk_Bjlk_SB_MT128x128x8_SE_AMAS3_GRVW4_TT8_8_USFGRO0_VW4_WG16_16_1_WGM1
    SolutionIndex: 263
    SolutionNameMin: Cijk_Ailk_Bjlk_SB_MT32x64x16_SE_AMAS3_GRVW2_TT4_4_USFGRO0_VW2_WG8_16_2_WGM8
    SolutionIndex: 264
    SolutionNameMin: Cijk_Ailk_Bjlk_SB_MT64x16x16_SE_AMAS3_GRVW1_TT4_2_USFGRO1_VW2_WG16_8_2_WGM1
    SolutionIndex: 265
    SolutionNameMin: Cijk_Ailk_Bjlk_SB_MT64x32x32_SE_AMAS3_GRVW4_TT4_4_USFGRO0_VW4_WG16_8_2_WGM8
    SolutionIndex: 266
    SolutionNameMin: Cijk_Ailk_Bjlk_SB_MT64x32x32_SE_AMAS3_GRVW2_TT4_4_USFGRO0_VW2_WG16_8_2_WGM1
    SolutionIndex: 267
    SolutionNameMin: Cijk_Ailk_Bjlk_SB_MT32x32x32_SE_AMAS3_GRVW4_TT4_4_USFGRO0_VW4_WG8_8_4_WGM1
    SolutionIndex: 268
    SolutionNameMin: Cijk_Ailk_Bjlk_SB_MT32x16x16_SE_AMAS3_GRVW2_TT4_2_USFGRO0_VW2_WG8_8_4_WGM1
    SolutionIndex: 269
    SolutionNameMin: Cijk_Ailk_Bjlk_SB_MT64x32x32_SE_AMAS3_GRVW4_TT4_4_USFGRO0_VW4_WG16_8_2_WGM8
    SolutionIndex: 270
    SolutionNameMin: Cijk_Ailk_Bjlk_SB_MT32x32x32_SE_AMAS3_GRVW2_TT4_4_USFGRO0_VW2_WG8_8_4_WGM1
    SolutionIndex: 271
    SolutionNameMin: Cijk_Ailk_Bjlk_SB_MT32x32x32_SE_AMAS3_GRVW1_TT4_4_USFGRO1_VW4_WG8_8_4_WGM1
    SolutionIndex: 272
    SolutionNameMin: Cijk_Ailk_Bjlk_SB_MT64x64x8_SE_AMAS1_GRVW1_TT4_4_USFGRO1_VW1_WG16_16_1_WGM1
    SolutionIndex: 273
    SolutionNameMin: Cijk_Ailk_Bjlk_SB_MT64x64x16_SE_AMAS3_GRVW2_TT4_4_USFGRO0_VW2_WG16_16_1_WGM1
    SolutionIndex: 274
    SolutionNameMin: Cijk_Ailk_Bjlk_SB_MT64x16x16_SE_AMAS3_GRVW2_TT4_2_USFGRO0_VW2_WG16_8_2_WGM8
    SolutionIndex: 275
    SolutionNameMin: Cijk_Ailk_Bjlk_SB_MT64x32x16_SE_AMAS3_GRVW2_TT4_4_USFGRO0_VW2_WG16_8_2_WGM8
    SolutionIndex: 276
    SolutionNameMin: Cijk_Ailk_Bjlk_SB_MT64x64x8_SE_AMAS3_GRVW1_TT4_4_USFGRO1_VW2_WG16_16_1_WGM8
    SolutionIndex: 277
    SolutionNameMin: Cijk_Ailk_Bjlk_SB_MT32x32x32_SE_AMAS3_GRVW2_TT4_4_USFGRO0_VW2_WG8_8_4_WGM8
    SolutionIndex: 278
    SolutionNameMin: Cijk_Ailk_Bjlk_SB_MT64x32x16_SE_AMAS3_GRVW2_TT4_4_USFGRO0_VW2_WG16_8_2_WGM8
    SolutionIndex: 279
    SolutionNameMin: Cijk_Ailk_Bjlk_SB_MT64x64x16_SE_AMAS3_GRVW4_TT4_4_USFGRO0_VW4_WG16_16_1_WGM1
    SolutionIndex: 280
    SolutionNameMin: Cijk_Ailk_Bjlk_SB_MT32x32x32_SE_AMAS3_GRVW4_TT4_4_USFGRO0_VW4_WG8_8_4_WGM8
    SolutionIndex: 281
    SolutionNameMin: Cijk_Ailk_Bjlk_SB_MT32x64x32_SE_AMAS3_GRVW2_TT4_4_USFGRO0_VW2_WG8_16_2_WGM1
    SolutionIndex: 282
    SolutionNameMin: Cijk_Ailk_Bjlk_SB_MT32x64x32_SE_AMAS3_GRVW4_TT4_4_USFGRO0_VW4_WG8_16_2_WGM1
    SolutionIndex: 283
    SolutionNameMin: Cijk_Ailk_Bjlk_SB_MT32x64x32_SE_AMAS3_GRVW2_TT4_8_USFGRO0_VW2_WG8_8_4_WGM1
    SolutionIndex: 284
    SolutionNameMin: Cijk_Ailk_Bjlk_SB_MT64x32x32_SE_AMAS3_GRVW2_TT8_4_USFGRO0_VW2_WG8_8_4_WGM1
    SolutionIndex: 285
    SolutionNameMin: Cijk_Ailk_Bjlk_SB_MT64x64x32_SE_AMAS3_GRVW2_TT8_4_USFGRO0_VW2_WG8_16_2_WGM8
    SolutionIndex: 286
    SolutionNameMin: Cijk_Ailk_Bjlk_SB_MT64x32x32_SE_AMAS3_GRVW2_TT8_4_USFGRO0_VW2_WG8_8_4_WGM8
    SolutionIndex: 287
    SolutionNameMin: Cijk_Ailk_Bjlk_SB_MT64x64x8_SE_DTL0_EPS1_FL0_GRVW1_PGR1_PLR0_TT4_4_USFGRO1_VW2_WG16_16_1_WGM8
    SolutionIndex: 288
    SolutionNameMin: Cijk_Ailk_Bjlk_SB_MT64x64x8_SE_DTL0_EPS0_FL0_GRVW1_PGR0_PLR1_TT4_4_USFGRO1_VW2_WG16_16_1_WGM1
    SolutionIndex: 289
    SolutionNameMin: Cijk_Ailk_Bjlk_SB_MT64x64x8_SE_DTL0_EPS1_FL0_GRVW1_PGR1_PLR1_TT4_4_USFGRO1_VW2_WG16_16_1_WGM1
    SolutionIndex: 290
    SolutionNameMin: Cijk_Ailk_Bjlk_SB_MT64x64x8_SE_DTL0_EPS1_FL0_GRVW1_PGR1_PLR1_TT4_4_USFGRO1_VW2_WG16_16_1_WGM8
    SolutionIndex: 291
    SolutionNameMin: Cijk_Ailk_Bjlk_SB_MT64x64x16_SE_DTL0_EPS0_FL0_GRVW1_PGR0_PLR1_TT4_4_USFGRO1_VW2_WG16_16_1_WGM1
    SolutionIndex: 292
    SolutionNameMin: Cijk_Ailk_Bjlk_SB_MT64x64x16_SE_DTL0_EPS0_FL0_GRVW1_PGR0_PLR1_TT4_4_USFGRO1_VW2_WG16_16_1_WGM8
    SolutionIndex: 293
    SolutionNameMin: Cijk_Ailk_Bjlk_SB_MT64x64x8_SE_DTL0_EPS1_FL0_GRVW1_PGR1_PLR0_TT4_4_USFGRO1_VW4_WG16_16_1_WGM1
    SolutionIndex: 294
    SolutionNameMin: Cijk_Ailk_Bjlk_SB_MT64x64x8_SE_DTL0_EPS0_FL0_GRVW1_PGR0_PLR0_TT4_4_USFGRO1_VW4_WG16_16_1_WGM8
    SolutionIndex: 295
    SolutionNameMin: Cijk_Ailk_Bjlk_SB_MT64x64x8_SE_DTL0_EPS1_FL0_GRVW1_PGR1_PLR0_TT4_4_USFGRO1_VW4_WG16_16_1_WGM8
    SolutionIndex: 296
    SolutionNameMin: Cijk_Ailk_Bjlk_SB_MT64x64x8_SE_DTL0_EPS0_FL0_GRVW1_PGR0_PLR1_TT4_4_USFGRO1_VW4_WG16_16_1_WGM1
    SolutionIndex: 297
    SolutionNameMin: Cijk_Ailk_Bjlk_SB_MT64x64x8_SE_DTL0_EPS1_FL0_GRVW1_PGR1_PLR1_TT4_4_USFGRO1_VW4_WG16_16_1_WGM8
    SolutionIndex: 298
    SolutionNameMin: Cijk_Ailk_Bjlk_SB_MT64x64x16_SE_DTL0_EPS0_FL0_GRVW1_PGR0_PLR1_TT4_4_USFGRO1_VW4_WG16_16_1_WGM1
    SolutionIndex: 299
    SolutionNameMin: Cijk_Ailk_Bjlk_SB_MT64x64x16_SE_DTL0_EPS1_FL0_GRVW1_PGR1_PLR1_TT4_4_USFGRO1_VW4_WG16_16_1_WGM1
    SolutionIndex: 300
    SolutionNameMin: Cijk_Ailk_Bjlk_SB_MT64x64x16_SE_DTL0_EPS0_FL0_GRVW1_PGR0_PLR1_TT4_4_USFGRO1_VW4_WG16_16_1_WGM8
    SolutionIndex: 301
    SolutionNameMin: Cijk_Ailk_Bjlk_SB_MT64x64x8_SE_DTL0_EPS1_FL0_GRVW2_PGR1_PLR1_TT4_4_USFGRO0_VW2_WG16_16_1_WGM8
    SolutionIndex: 302
    SolutionNameMin: Cijk_Ailk_Bjlk_SB_MT64x64x8_SE_DTL0_EPS1_FL0_GRVW4_PGR1_PLR1_TT4_4_USFGRO0_VW2_WG16_16_1_WGM1
    SolutionIndex: 303
    SolutionNameMin: Cijk_Ailk_Bjlk_SB_MT64x64x16_SE_DTL0_EPS1_FL0_GRVW4_PGR1_PLR1_TT4_4_USFGRO0_VW4_WG16_16_1_WGM1
    SolutionIndex: 304
    SolutionNameMin: Cijk_Ailk_Bjlk_SB_MT64x64x16_SE_DTL0_EPS1_FL0_GRVW4_PGR1_PLR1_TT4_4_USFGRO0_VW4_WG16_16_1_WGM8
    SolutionIndex: 305
    SolutionNameMin: Cijk_Ailk_Bjlk_SB_MT64x64x8_SE_DTL0_EPS1_FL1_GRVW2_PGR1_PLR1_TT4_4_USFGRO0_VW2_WG16_16_1_WGM8
    SolutionIndex: 306
    SolutionNameMin: Cijk_Ailk_Bjlk_SB_MT64x64x16_SE_DTL0_EPS1_FL1_GRVW4_PGR1_PLR1_TT4_4_USFGRO0_VW4_WG16_16_1_WGM8
    SolutionIndex: 307
    SolutionNameMin: Cijk_Ailk_Bjlk_SB_MT96x64x8_SE_DTL0_EPS1_FL0_GRVW1_PGR1_PLR1_TT6_4_USFGRO1_VW2_WG16_16_1_WGM1
    SolutionIndex: 308
    SolutionNameMin: Cijk_Ailk_Bjlk_SB_MT96x64x8_SE_DTL0_EPS1_FL0_GRVW1_PGR1_PLR1_TT6_4_USFGRO1_VW2_WG16_16_1_WGM8
    SolutionIndex: 309
    SolutionNameMin: Cijk_Ailk_Bjlk_SB_MT96x64x8_SE_DTL0_EPS1_FL1_GRVW2_PGR1_PLR1_TT6_4_USFGRO0_VW2_WG16_16_1_WGM1
    SolutionIndex: 310
    SolutionNameMin: Cijk_Ailk_Bjlk_SB_MT96x64x8_SE_DTL0_EPS1_FL1_GRVW2_PGR1_PLR1_TT6_4_USFGRO0_VW2_WG16_16_1_WGM8
    SolutionIndex: 311
    SolutionNameMin: Cijk_Ailk_Bjlk_SB_MT64x96x8_SE_DTL0_EPS1_FL0_GRVW1_PGR1_PLR1_TT4_6_USFGRO1_VW2_WG16_16_1_WGM8
    SolutionIndex: 312
    SolutionNameMin: Cijk_Ailk_Bjlk_SB_MT64x96x8_SE_DTL0_EPS1_FL1_GRVW2_PGR1_PLR1_TT4_6_USFGRO0_VW2_WG16_16_1_WGM1
    SolutionIndex: 313
    SolutionNameMin: Cijk_Ailk_Bjlk_SB_MT64x96x8_SE_DTL0_EPS1_FL1_GRVW2_PGR1_PLR1_TT4_6_USFGRO0_VW2_WG16_16_1_WGM8
    SolutionIndex: 314
    SolutionNameMin: Cijk_Ailk_Bjlk_SB_MT64x128x8_SE_DTL0_EPS1_FL0_GRVW1_PGR1_PLR0_TT4_8_USFGRO1_VW4_WG16_16_1_WGM1
    SolutionIndex: 315
    SolutionNameMin: Cijk_Ailk_Bjlk_SB_MT64x128x8_SE_DTL0_EPS1_FL0_GRVW1_PGR1_PLR0_TT4_8_USFGRO1_VW4_WG16_16_1_WGM8
    SolutionIndex: 316
    SolutionNameMin: Cijk_Ailk_Bjlk_SB_MT64x128x8_SE_DTL0_EPS1_FL0_GRVW2_PGR1_PLR0_TT4_8_USFGRO0_VW2_WG16_16_1_WGM1
    SolutionIndex: 317
    SolutionNameMin: Cijk_Ailk_Bjlk_SB_MT64x128x8_SE_DTL0_EPS1_FL0_GRVW2_PGR1_PLR1_TT4_8_USFGRO0_VW2_WG16_16_1_WGM1
    SolutionIndex: 318
    SolutionNameMin: Cijk_Ailk_Bjlk_SB_MT64x128x8_SE_DTL0_EPS1_FL0_GRVW2_PGR1_PLR1_TT4_8_USFGRO0_VW2_WG16_16_1_WGM8
    SolutionIndex: 319
    SolutionNameMin: Cijk_Ailk_Bjlk_SB_MT64x128x8_SE_DTL0_EPS1_FL1_GRVW2_PGR1_PLR1_TT4_8_USFGRO0_VW2_WG16_16_1_WGM1
    SolutionIndex: 320
    SolutionNameMin: Cijk_Ailk_Bjlk_SB_MT64x128x8_SE_DTL0_EPS1_FL1_GRVW2_PGR1_PLR1_TT4_8_USFGRO0_VW2_WG16_16_1_WGM8
    SolutionIndex: 321
    SolutionNameMin: Cijk_Ailk_Bjlk_SB_MT128x64x8_SE_DTL0_EPS1_FL0_GRVW1_PGR1_PLR0_TT8_4_USFGRO1_VW4_WG16_16_1_WGM1
    SolutionIndex: 322
    SolutionNameMin: Cijk_Ailk_Bjlk_SB_MT128x64x8_SE_DTL0_EPS1_FL0_GRVW1_PGR1_PLR0_TT8_4_USFGRO1_VW4_WG16_16_1_WGM8
    SolutionIndex: 323
    SolutionNameMin: Cijk_Ailk_Bjlk_SB_MT128x64x8_SE_DTL0_EPS1_FL0_GRVW1_PGR1_PLR1_TT8_4_USFGRO1_VW4_WG16_16_1_WGM8
    SolutionIndex: 324
    SolutionNameMin: Cijk_Ailk_Bjlk_SB_MT128x64x8_SE_DTL0_EPS1_FL0_GRVW2_PGR1_PLR0_TT8_4_USFGRO0_VW2_WG16_16_1_WGM1
    SolutionIndex: 325
    SolutionNameMin: Cijk_Ailk_Bjlk_SB_MT128x64x8_SE_DTL0_EPS1_FL1_GRVW2_PGR1_PLR1_TT8_4_USFGRO0_VW2_WG16_16_1_WGM8
    SolutionIndex: 326
    SolutionNameMin: Cijk_Ailk_Bjlk_SB_MT32x64x16_SE_DTL0_EPS0_FL0_GRVW1_PGR0_PLR1_TT2_4_USFGRO1_VW2_WG16_16_1_WGM1
    SolutionIndex: 327
    SolutionNameMin: Cijk_Ailk_Bjlk_SB_MT32x64x16_SE_DTL0_EPS0_FL0_GRVW1_PGR0_PLR1_TT2_4_USFGRO1_VW2_WG16_16_1_WGM8
    SolutionIndex: 328
    SolutionNameMin: Cijk_Ailk_Bjlk_SB_MT32x64x8_SE_DTL0_EPS1_FL0_GRVW4_PGR1_PLR1_TT2_4_USFGRO0_VW2_WG16_16_1_WGM8
    SolutionIndex: 329
    SolutionNameMin: Cijk_Ailk_Bjlk_SB_MT32x64x16_SE_DTL0_EPS1_FL0_GRVW1_PGR1_PLR1_TT4_4_USFGRO1_VW2_WG8_16_2_WGM1
    SolutionIndex: 330
    SolutionNameMin: Cijk_Ailk_Bjlk_SB_MT32x64x16_SE_DTL0_EPS1_FL0_GRVW1_PGR1_PLR1_TT4_4_USFGRO1_VW4_WG8_16_2_WGM1
    SolutionIndex: 331
    SolutionNameMin: Cijk_Ailk_Bjlk_SB_MT32x32x8_SE_DTL0_EPS1_FL0_GRVW4_PGR1_PLR1_TT2_4_USFGRO1_VW2_WG16_8_2_WGM1
    SolutionIndex: 332
    SolutionNameMin: Cijk_Ailk_Bjlk_SB_MT32x32x16_SE_DTL0_EPS1_FL1_GRVW4_PGR1_PLR1_TT2_4_USFGRO0_VW2_WG16_8_2_WGM1
    SolutionIndex: 333
    SolutionNameMin: Cijk_Ailk_Bjlk_SB_MT8x32x32_SE_DTL0_EPS1_FL0_GRVW1_PGR1_PLR1_TT2_2_USFGRO1_VW2_WG4_16_4_WGM1
    SolutionIndex: 334
    SolutionNameMin: Cijk_Ailk_Bjlk_SB_MT16x32x32_SE_DTL0_EPS1_FL1_GRVW2_PGR1_PLR1_TT4_2_USFGRO0_VW2_WG4_16_4_WGM1
    SolutionIndex: 335
    SolutionNameMin: Cijk_Ailk_Bjlk_SB_MT16x64x16_SE_DTL0_EPS1_FL0_GRVW4_PGR1_PLR1_TT4_4_USFGRO0_VW4_WG4_16_4_WGM8
    SolutionIndex: 336
    SolutionNameMin: Cijk_Ailk_Bjlk_SB_MT32x16x32_SE_DTL0_EPS1_FL0_GRVW1_PGR1_PLR1_TT2_4_USFGRO1_VW2_WG16_4_4_WGM1
    SolutionIndex: 337
    SolutionNameMin: Cijk_Ailk_Bjlk_SB_MT64x16x16_SE_DTL0_EPS1_FL0_GRVW4_PGR1_PLR1_TT4_4_USFGRO0_VW4_WG16_4_4_WGM1
    SolutionIndex: 338
    SolutionNameMin: Cijk_Ailk_Bjlk_SB_MT64x16x16_SE_DTL0_EPS1_FL0_GRVW4_PGR1_PLR1_TT4_4_USFGRO0_VW4_WG16_4_4_WGM8
    SolutionIndex: 339
    SolutionNameMin: Cijk_Ailk_Bjlk_SB_MT64x16x32_SE_DTL0_EPS1_FL1_GRVW2_PGR1_PLR1_TT4_4_USFGRO0_VW2_WG16_4_4_WGM1
    SolutionIndex: 340
    SolutionNameMin: Cijk_Ailk_Bjlk_SB_MT64x32x8_SE_DTL0_EPS0_FL0_GRVW1_PGR0_PLR1_TT4_4_USFGRO1_VW4_WG16_8_1_WGM1
    SolutionIndex: 341
    SolutionNameMin: Cijk_Ailk_Bjlk_SB_MT64x32x8_SE_DTL0_EPS0_FL0_GRVW1_PGR0_PLR1_TT4_4_USFGRO1_VW4_WG16_8_1_WGM8
    SolutionIndex: 342
    SolutionNameMin: Cijk_Ailk_Bjlk_SB_MT64x32x16_SE_DTL0_EPS0_FL0_GRVW2_PGR0_PLR1_TT4_4_USFGRO0_VW2_WG16_8_1_WGM8
    SolutionIndex: 343
    SolutionNameMin: Cijk_Ailk_Bjlk_SB_MT64x64x8_SE_DTL0_EPS1_FL0_GRVW1_PGR1_PLR0_TT4_8_USFGRO1_VW2_WG16_8_1_WGM1
    SolutionIndex: 344
    SolutionNameMin: Cijk_Ailk_Bjlk_SB_MT64x64x8_SE_DTL0_EPS1_FL0_GRVW1_PGR1_PLR0_TT4_8_USFGRO1_VW4_WG16_8_1_WGM1
    SolutionIndex: 345
    SolutionNameMin: Cijk_Ailk_Bjlk_SB_MT64x64x8_SE_DTL0_EPS1_FL0_GRVW1_PGR1_PLR0_TT4_8_USFGRO1_VW4_WG16_8_1_WGM8
    SolutionIndex: 346
    SolutionNameMin: Cijk_Ailk_Bjlk_SB_MT64x64x8_SE_DTL0_EPS1_FL0_GRVW4_PGR1_PLR0_TT4_8_USFGRO0_VW4_WG16_8_1_WGM1
    SolutionIndex: 347
    SolutionNameMin: Cijk_Ailk_Bjlk_SB_MT64x64x8_SE_DTL0_EPS1_FL0_GRVW4_PGR1_PLR0_TT4_8_USFGRO0_VW4_WG16_8_1_WGM8
    SolutionIndex: 348
    SolutionNameMin: Cijk_Ailk_Bjlk_SB_MT64x64x8_SE_DTL0_EPS1_FL1_GRVW4_PGR1_PLR0_TT4_8_USFGRO0_VW4_WG16_8_1_WGM8
    SolutionIndex: 349
    SolutionNameMin: Cijk_Ailk_Bjlk_SB_MT64x64x8_SE_DTL0_EPS1_FL1_GRVW4_PGR1_PLR1_TT4_8_USFGRO0_VW4_WG16_8_1_WGM8
    SolutionIndex: 350
    SolutionNameMin: Cijk_Ailk_Bjlk_SB_MT128x32x8_SE_DTL1_EPS0_FL0_GRVW1_PGR0_PLR1_TT8_4_USFGRO1_VW4_WG16_8_1_WGM8
    SolutionIndex: 351
    SolutionNameMin: Cijk_Ailk_Bjlk_SB_MT32x64x16_SE_DTL0_EPS0_FL0_GRVW2_PGR0_PLR1_TT4_4_USFGRO0_VW2_WG8_16_1_WGM8
    SolutionIndex: 352
    SolutionNameMin: Cijk_Ailk_Bjlk_SB_MT32x64x8_SE_DTL0_EPS1_FL1_GRVW2_PGR1_PLR1_TT4_4_USFGRO0_VW2_WG8_16_1_WGM1
    SolutionIndex: 353
    SolutionNameMin: Cijk_Ailk_Bjlk_SB_MT32x64x16_SE_DTL0_EPS0_FL1_GRVW2_PGR0_PLR1_TT4_4_USFGRO0_VW2_WG8_16_1_WGM1
    SolutionIndex: 354
    SolutionNameMin: Cijk_Ailk_Bjlk_SB_MT64x64x8_SE_DTL0_EPS1_FL0_GRVW4_PGR1_PLR0_TT8_4_USFGRO0_VW4_WG8_16_1_WGM1
    SolutionIndex: 355
    SolutionNameMin: Cijk_Ailk_Bjlk_SB_MT64x64x8_SE_DTL0_EPS1_FL0_GRVW4_PGR1_PLR0_TT8_4_USFGRO0_VW4_WG8_16_1_WGM8
    SolutionIndex: 356
    SolutionNameMin: Cijk_Ailk_Bjlk_SB_MT64x64x8_SE_DTL0_EPS1_FL1_GRVW4_PGR1_PLR0_TT8_4_USFGRO0_VW4_WG8_16_1_WGM1
    SolutionIndex: 357
    SolutionNameMin: Cijk_Ailk_Bjlk_SB_MT64x128x8_SE_DTL0_EPS1_FL1_GRVW4_PGR1_PLR0_TT8_8_USFGRO0_VW4_WG8_16_1_WGM8
    SolutionIndex: 358
    SolutionNameMin: Cijk_Ailk_Bjlk_SB_MT64x64x8_SE_DTL0_EPS1_FL0_GRVW1_PGR1_PLR0_TT4_4_USFGRO1_VW4_WG16_16_1_WGM1
    SolutionIndex: 359
    SolutionNameMin: Cijk_Ailk_Bjlk_SB_MT64x64x8_SE_DTL0_EPS1_FL0_GRVW1_PGR1_PLR0_TT4_4_USFGRO1_VW4_WG16_16_1_WGM8
    SolutionIndex: 360
    SolutionNameMin: Cijk_Ailk_Bjlk_SB_MT64x64x16_SE_DTL0_EPS0_FL0_GRVW1_PGR0_PLR1_TT4_4_USFGRO1_VW4_WG16_16_1_WGM1
    SolutionIndex: 361
    SolutionNameMin: Cijk_Ailk_Bjlk_SB_MT64x64x16_SE_DTL0_EPS1_FL0_GRVW1_PGR1_PLR1_TT4_4_USFGRO1_VW4_WG16_16_1_WGM8
    SolutionIndex: 362
    SolutionNameMin: Cijk_Ailk_Bjlk_SB_MT64x128x8_SE_DTL0_EPS1_FL0_GRVW1_PGR1_PLR1_TT4_8_USFGRO1_VW2_WG16_16_1_WGM8
    SolutionIndex: 363
    SolutionNameMin: Cijk_Ailk_Bjlk_SB_MT64x128x8_SE_DTL0_EPS1_FL0_GRVW1_PGR1_PLR0_TT4_8_USFGRO1_VW4_WG16_16_1_WGM1
    SolutionIndex: 364
    SolutionNameMin: Cijk_Ailk_Bjlk_SB_MT64x128x8_SE_DTL0_EPS1_FL0_GRVW1_PGR1_PLR0_TT4_8_USFGRO1_VW4_WG16_16_1_WGM8
    SolutionIndex: 365
    SolutionNameMin: Cijk_Ailk_Bjlk_SB_MT64x128x8_SE_DTL0_EPS1_FL1_GRVW2_PGR1_PLR0_TT4_8_USFGRO0_VW2_WG16_16_1_WGM8
    SolutionIndex: 366
    SolutionNameMin: Cijk_Ailk_Bjlk_SB_MT64x128x8_SE_DTL0_EPS1_FL1_GRVW2_PGR1_PLR1_TT4_8_USFGRO0_VW2_WG16_16_1_WGM1
    SolutionIndex: 367
    SolutionNameMin: Cijk_Ailk_Bjlk_SB_MT64x128x8_SE_DTL0_EPS1_FL1_GRVW2_PGR1_PLR1_TT4_8_USFGRO0_VW2_WG16_16_1_WGM8
    SolutionIndex: 368
    SolutionNameMin: Cijk_Ailk_Bjlk_SB_MT128x64x16_SE_DTL0_EPS0_FL0_GRVW1_PGR0_PLR1_TT8_4_USFGRO1_VW4_WG16_16_1_WGM1
    SolutionIndex: 369
    SolutionNameMin: Cijk_Ailk_Bjlk_SB_MT64x64x8_SE_DTL0_EPS1_FL0_GRVW4_PGR1_PLR0_TT4_8_USFGRO0_VW4_WG16_8_1_WGM1
    SolutionIndex: 370
    SolutionNameMin: Cijk_Ailk_Bjlk_SB_MT64x64x8_SE_DTL0_EPS1_FL0_GRVW4_PGR1_PLR0_TT4_8_USFGRO0_VW4_WG16_8_1_WGM8
    SolutionIndex: 371
    SolutionNameMin: Cijk_Ailk_Bjlk_SB_MT128x32x8_SE_DTL1_EPS0_FL0_GRVW1_PGR0_PLR1_TT8_4_USFGRO1_VW4_WG16_8_1_WGM8
    SolutionIndex: 372
    SolutionNameMin: Cijk_Ailk_Bjlk_SB_MT64x64x8_SE_DTL0_EPS1_FL0_GRVW4_PGR1_PLR0_TT8_4_USFGRO0_VW4_WG8_16_1_WGM1
    SolutionIndex: 373
    SolutionNameMin: Cijk_Ailk_Bjlk_SB_MT64x64x8_SE_DTL0_EPS1_FL1_GRVW4_PGR1_PLR0_TT8_4_USFGRO0_VW4_WG8_16_1_WGM1
    SolutionIndex: 374
    SolutionNameMin: Cijk_Ailk_Bjlk_SB_MT64x64x8_SE_EPS1_FL0_GRVW2_NLCA1_NLCB1_PGR1_PLR1_TT4_4_USFGRO0_VW2_WGM8
    SolutionIndex: 375
    SolutionNameMin: Cijk_Ailk_Bjlk_SB_MT96x64x8_SE_EPS1_FL1_GRVW2_NLCA1_NLCB1_PGR1_PLR1_TT6_4_USFGRO0_VW2_WGM8
    SolutionIndex: 376
    SolutionNameMin: Cijk_Ailk_Bjlk_SB_MT128x64x8_SE_EPS1_FL0_GRVW2_NLCA1_NLCB1_PGR1_PLR1_TT8_4_USFGRO0_VW2_WGM8
    SolutionIndex: 377
    SolutionNameMin: Cijk_Ailk_Bjlk_SB_MT128x64x8_SE_EPS1_FL1_GRVW2_NLCA1_NLCB1_PGR1_PLR0_TT8_4_USFGRO0_VW2_WGM8
    SolutionIndex: 378
    SolutionNameMin: Cijk_Ailk_Bjlk_SB_MT96x64x8_SE_AMAS3_DTL0_EPS1_GRVW2_GSU1_NLCA1_NLCB1_PBD1_PGR1_PLR1_TT6_4_USFGRO0_VW2_WG16_16_1_WGM8
    SolutionIndex: 379
    SolutionNameMin: Cijk_Ailk_Bjlk_SB_MT64x128x8_SE_AMAS3_DTL0_EPS1_GRVW4_GSU1_NLCA1_NLCB1_PBD1_PGR1_PLR1_TT4_8_USFGRO0_VW4_WG16_16_1_WGM1
    SolutionIndex: 380
    SolutionNameMin: Cijk_Ailk_Bjlk_SB_MT64x128x8_SE_AMAS3_DTL0_EPS1_GRVW4_GSU1_NLCA1_NLCB1_PBD1_PGR1_PLR1_TT4_8_USFGRO0_VW4_WG16_16_1_WGM8
    SolutionIndex: 381
    SolutionNameMin: Cijk_Ailk_Bjlk_SB_MT64x64x8_SE_AMAS3_DTL0_EPS1_GRVW1_GSU1_NLCA1_NLCB1_PBD0_PGR1_PLR0_TT4_4_USFGRO1_VW4_WG16_16_1_WGM1
    SolutionIndex: 382
    SolutionNameMin: Cijk_Ailk_Bjlk_SB_MT64x64x16_SE_AMAS3_DTL0_EPS0_GRVW1_GSU1_NLCA1_NLCB1_PBD0_PGR0_PLR1_TT4_4_USFGRO1_VW4_WG16_16_1_WGM1
    SolutionIndex: 383
    SolutionNameMin: Cijk_Ailk_Bjlk_SB_MT64x96x8_SE_AMAS1_DTL0_EPS1_GRVW1_GSU1_NLCA1_NLCB3_PBD1_PGR1_PLR1_TT4_6_USFGRO0_VW1_WG16_16_1_WGM8
    SolutionIndex: 384
    SolutionNameMin: Cijk_Ailk_Bjlk_SB_MT128x64x8_SE_AMAS1_DTL1_EPS1_GRVW1_GSU1_NLCA1_NLCB1_PBD1_PGR1_PLR0_TT8_8_USFGRO0_VW1_WG16_8_1_WGM1
    SolutionIndex: 385
    SolutionNameMin: Cijk_Ailk_Bjlk_SB_MT64x64x16_SE_EPS1_FL1_GRVW2_NLCA1_NLCB1_PGR1_PLR1_TT4_4_USFGRO0_VW2_WGM8
    SolutionIndex: 386
    SolutionNameMin: Cijk_Ailk_Bjlk_SB_MT64x128x8_SE_EPS1_FL1_GRVW2_NLCA1_NLCB1_PGR1_PLR1_TT4_8_USFGRO0_VW2_WGM1
    SolutionIndex: 387
    SolutionNameMin: Cijk_Ailk_Bjlk_SB_MT128x64x16_SE_EPS0_FL0_GRVW4_NLCA1_NLCB1_PGR0_PLR1_TT8_4_USFGRO0_VW4_WGM8
    SolutionIndex: 388
    SolutionNameMin: Cijk_Ailk_Bjlk_SB_MT128x128x8_SE_EPS1_FL0_GRVW1_NLCA1_NLCB1_PGR1_PLR1_TT8_8_USFGRO1_VW2_WGM1
    SolutionIndex: 389
    SolutionNameMin: Cijk_Ailk_Bjlk_SB_MT64x64x8_SE_DTL0_EPS1_FL1_GRVW4_PGR1_PLR0_TT4_4_USFGRO0_VW2_WG16_16_1_WGM1
    SolutionIndex: 390
    SolutionNameMin: Cijk_Ailk_Bjlk_SB_MT64x64x16_SE_DTL0_EPS1_FL0_GRVW1_PGR1_PLR1_TT4_4_USFGRO1_VW4_WG16_16_1_WGM1
    SolutionIndex: 391
    SolutionNameMin: Cijk_Ailk_Bjlk_SB_MT64x64x8_SE_DTL0_EPS1_FL0_GRVW4_PGR1_PLR1_TT4_4_USFGRO0_VW2_WG16_16_1_WGM8
    SolutionIndex: 392
    SolutionNameMin: Cijk_Ailk_Bjlk_SB_MT64x64x8_SE_DTL0_EPS1_FL1_GRVW2_PGR1_PLR1_TT4_4_USFGRO0_VW2_WG16_16_1_WGM1
    SolutionIndex: 393
    SolutionNameMin: Cijk_Ailk_Bjlk_SB_MT64x128x8_SE_DTL0_EPS1_FL0_GRVW2_PGR1_PLR1_TT4_8_USFGRO0_VW2_WG16_16_1_WGM8
    SolutionIndex: 394
    SolutionNameMin: Cijk_Ailk_Bjlk_SB_MT64x128x8_SE_DTL0_EPS1_FL1_GRVW2_PGR1_PLR1_TT4_8_USFGRO0_VW2_WG16_16_1_WGM8
    SolutionIndex: 395
    SolutionNameMin: Cijk_Ailk_Bjlk_SB_MT128x64x8_SE_DTL0_EPS1_FL0_GRVW2_PGR1_PLR1_TT8_4_USFGRO0_VW2_WG16_16_1_WGM1
    SolutionIndex: 396
    SolutionNameMin: Cijk_Ailk_Bjlk_SB_MT128x64x8_SE_DTL0_EPS1_FL0_GRVW2_PGR1_PLR1_TT8_4_USFGRO0_VW2_WG16_16_1_WGM8
    SolutionIndex: 397
    SolutionNameMin: Cijk_Ailk_Bjlk_SB_MT128x64x8_SE_DTL0_EPS1_FL1_GRVW2_PGR1_PLR1_TT8_4_USFGRO0_VW2_WG16_16_1_WGM1
    SolutionIndex: 398
    SolutionNameMin: Cijk_Ailk_Bjlk_SB_MT128x64x8_SE_DTL0_EPS1_FL1_GRVW2_PGR1_PLR1_TT8_4_USFGRO0_VW2_WG16_16_1_WGM8
    SolutionIndex: 399
    SolutionNameMin: Cijk_Ailk_Bjlk_SB_MT64x32x32_SE_DTL0_EPS0_FL0_GRVW1_PGR0_PLR1_TT4_2_USFGRO1_VW2_WG16_16_1_WGM8
    SolutionIndex: 400
    SolutionNameMin: Cijk_Ailk_Bjlk_SB_MT32x64x32_SE_DTL0_EPS1_FL0_GRVW4_PGR1_PLR1_TT4_4_USFGRO0_VW4_WG8_16_2_WGM1
    SolutionIndex: 401
    SolutionNameMin: Cijk_Ailk_Bjlk_SB_MT32x64x32_SE_DTL0_EPS1_FL1_GRVW4_PGR1_PLR1_TT4_4_USFGRO0_VW4_WG8_16_2_WGM1
    SolutionIndex: 402
    SolutionNameMin: Cijk_Ailk_Bjlk_SB_MT64x32x32_SE_DTL0_EPS1_FL0_GRVW4_PGR1_PLR1_TT4_4_USFGRO0_VW4_WG16_8_2_WGM1
    SolutionIndex: 403
    SolutionNameMin: Cijk_Ailk_Bjlk_SB_MT64x32x32_SE_DTL0_EPS1_FL0_GRVW4_PGR1_PLR1_TT4_4_USFGRO0_VW4_WG16_8_2_WGM8
    SolutionIndex: 404
    SolutionNameMin: Cijk_Ailk_Bjlk_SB_MT64x32x32_SE_DTL0_EPS1_FL1_GRVW4_PGR1_PLR1_TT4_4_USFGRO0_VW4_WG16_8_2_WGM1
    SolutionIndex: 405
    SolutionNameMin: Cijk_Ailk_Bjlk_SB_MT64x32x32_SE_DTL0_EPS1_FL1_GRVW4_PGR1_PLR1_TT4_4_USFGRO0_VW4_WG16_8_2_WGM8
    SolutionIndex: 406
    SolutionNameMin: Cijk_Ailk_Bjlk_SB_MT64x32x8_SE_DTL0_EPS0_FL0_GRVW1_PGR0_PLR0_TT4_4_USFGRO1_VW2_WG16_8_1_WGM1
    SolutionIndex: 407
    SolutionNameMin: Cijk_Ailk_Bjlk_SB_MT64x32x8_SE_DTL0_EPS0_FL0_GRVW1_PGR0_PLR1_TT4_4_USFGRO1_VW2_WG16_8_1_WGM1
    SolutionIndex: 408
    SolutionNameMin: Cijk_Ailk_Bjlk_SB_MT64x32x8_SE_DTL0_EPS0_FL0_GRVW1_PGR0_PLR1_TT4_4_USFGRO1_VW2_WG16_8_1_WGM8
    SolutionIndex: 409
    SolutionNameMin: Cijk_Ailk_Bjlk_SB_MT64x32x8_SE_DTL0_EPS0_FL0_GRVW1_PGR0_PLR1_TT4_4_USFGRO1_VW4_WG16_8_1_WGM1
    SolutionIndex: 410
    SolutionNameMin: Cijk_Ailk_Bjlk_SB_MT64x32x8_SE_DTL0_EPS0_FL1_GRVW2_PGR0_PLR1_TT4_4_USFGRO0_VW2_WG16_8_1_WGM8
    SolutionIndex: 411
    SolutionNameMin: Cijk_Ailk_Bjlk_SB_MT64x32x8_SE_DTL0_EPS1_FL0_GRVW2_PGR1_PLR1_TT4_4_USFGRO0_VW2_WG16_8_1_WGM1
    SolutionIndex: 412
    SolutionNameMin: Cijk_Ailk_Bjlk_SB_MT64x32x8_SE_DTL0_EPS1_FL0_GRVW2_PGR1_PLR1_TT4_4_USFGRO0_VW2_WG16_8_1_WGM8
    SolutionIndex: 413
    SolutionNameMin: Cijk_Ailk_Bjlk_SB_MT64x32x8_SE_DTL0_EPS1_FL1_GRVW2_PGR1_PLR1_TT4_4_USFGRO0_VW2_WG16_8_1_WGM1
    SolutionIndex: 414
    SolutionNameMin: Cijk_Ailk_Bjlk_SB_MT64x16x8_SE_DTL0_EPS0_FL0_GRVW1_PGR0_PLR0_TT4_2_USFGRO1_VW2_WG16_8_1_WGM1
    SolutionIndex: 415
    SolutionNameMin: Cijk_Ailk_Bjlk_SB_MT64x16x16_SE_DTL0_EPS0_FL0_GRVW1_PGR0_PLR0_TT4_2_USFGRO1_VW2_WG16_8_1_WGM8
    SolutionIndex: 416
    SolutionNameMin: Cijk_Ailk_Bjlk_SB_MT64x16x8_SE_DTL0_EPS0_FL0_GRVW1_PGR0_PLR1_TT4_2_USFGRO1_VW2_WG16_8_1_WGM1
    SolutionIndex: 417
    SolutionNameMin: Cijk_Ailk_Bjlk_SB_MT64x16x8_SE_DTL0_EPS0_FL0_GRVW1_PGR0_PLR1_TT4_2_USFGRO1_VW2_WG16_8_1_WGM8
    SolutionIndex: 418
    SolutionNameMin: Cijk_Ailk_Bjlk_SB_MT64x16x8_SE_DTL0_EPS0_FL0_GRVW2_PGR0_PLR1_TT4_2_USFGRO0_VW2_WG16_8_1_WGM1
    SolutionIndex: 419
    SolutionNameMin: Cijk_Ailk_Bjlk_SB_MT64x16x16_SE_DTL0_EPS0_FL0_GRVW2_PGR0_PLR1_TT4_2_USFGRO0_VW2_WG16_8_1_WGM1
    SolutionIndex: 420
    SolutionNameMin: Cijk_Ailk_Bjlk_SB_MT64x16x16_SE_DTL0_EPS0_FL0_GRVW2_PGR0_PLR1_TT4_2_USFGRO0_VW2_WG16_8_1_WGM8
    SolutionIndex: 421
    SolutionNameMin: Cijk_Ailk_Bjlk_SB_MT64x16x16_SE_DTL0_EPS0_FL1_GRVW2_PGR0_PLR1_TT4_2_USFGRO0_VW2_WG16_8_1_WGM1
    SolutionIndex: 422
    SolutionNameMin: Cijk_Ailk_Bjlk_SB_MT64x64x8_SE_DTL0_EPS1_FL0_GRVW4_PGR1_PLR0_TT4_8_USFGRO0_VW4_WG16_8_1_WGM1
    SolutionIndex: 423
    SolutionNameMin: Cijk_Ailk_Bjlk_SB_MT64x64x16_SE_DTL0_EPS0_FL0_GRVW1_PGR0_PLR1_TT4_4_USFGRO1_VW4_WG16_16_1_WGM1
    SolutionIndex: 424
    SolutionNameMin: Cijk_Ailk_Bjlk_SB_MT64x64x8_SE_DTL0_EPS1_FL0_GRVW1_PGR1_PLR0_TT4_4_USFGRO1_VW4_WG16_16_1_WGM1
    SolutionIndex: 425
    SolutionNameMin: Cijk_Ailk_Bjlk_SB_MT64x64x8_SE_DTL0_EPS1_FL0_GRVW1_PGR1_PLR0_TT4_4_USFGRO1_VW4_WG16_16_1_WGM8
    SolutionIndex: 426
    SolutionNameMin: Cijk_Ailk_Bjlk_SB_MT64x64x16_SE_DTL0_EPS0_FL0_GRVW1_PGR0_PLR1_TT4_4_USFGRO1_VW4_WG16_16_1_WGM8
    SolutionIndex: 427
    SolutionNameMin: Cijk_Ailk_Bjlk_SB_MT64x128x8_SE_DTL0_EPS1_FL0_GRVW1_PGR1_PLR0_TT4_8_USFGRO1_VW4_WG16_16_1_WGM1
    SolutionIndex: 428
    SolutionNameMin: Cijk_Ailk_Bjlk_SB_MT64x128x8_SE_DTL0_EPS1_FL0_GRVW1_PGR1_PLR0_TT4_8_USFGRO1_VW4_WG16_16_1_WGM8
    SolutionIndex: 429
    SolutionNameMin: Cijk_Ailk_Bjlk_SB_MT64x128x8_SE_DTL0_EPS1_FL0_GRVW2_PGR1_PLR1_TT4_8_USFGRO0_VW2_WG16_16_1_WGM1
    SolutionIndex: 430
    SolutionNameMin: Cijk_Ailk_Bjlk_SB_MT64x128x8_SE_DTL0_EPS1_FL0_GRVW2_PGR1_PLR1_TT4_8_USFGRO0_VW2_WG16_16_1_WGM8
    SolutionIndex: 431
    SolutionNameMin: Cijk_Ailk_Bjlk_SB_MT64x128x8_SE_DTL0_EPS1_FL1_GRVW2_PGR1_PLR1_TT4_8_USFGRO0_VW2_WG16_16_1_WGM1
    SolutionIndex: 432
    SolutionNameMin: Cijk_Ailk_Bjlk_SB_MT64x64x8_SE_DTL0_EPS1_FL0_GRVW4_PGR1_PLR0_TT4_8_USFGRO0_VW4_WG16_8_1_WGM1
    SolutionIndex: 433
    SolutionNameMin: Cijk_Ailk_Bjlk_SB_MT64x64x8_SE_DTL0_EPS1_FL1_GRVW4_PGR1_PLR0_TT4_8_USFGRO0_VW4_WG16_8_1_WGM1
    SolutionIndex: 434
    SolutionNameMin: Cijk_Ailk_Bjlk_SB_MT64x64x8_SE_DTL0_EPS1_FL1_GRVW4_PGR1_PLR0_TT4_8_USFGRO0_VW4_WG16_8_1_WGM8
    SolutionIndex: 435
    SolutionNameMin: Cijk_Ailk_Bjlk_SB_MT128x32x8_SE_DTL1_EPS0_FL0_GRVW1_PGR0_PLR1_TT8_4_USFGRO1_VW4_WG16_8_1_WGM8
    SolutionIndex: 436
    SolutionNameMin: Cijk_Ailk_Bjlk_SB_MT32x128x8_SE_DTL1_EPS0_FL0_GRVW1_PGR0_PLR1_TT4_8_USFGRO1_VW4_WG8_16_1_WGM1
    SolutionIndex: 437
    SolutionNameMin: Cijk_Ailk_Bjlk_SB_MT64x64x8_SE_DTL0_EPS1_FL0_GRVW2_PGR1_PLR0_TT8_4_USFGRO0_VW2_WG8_16_1_WGM8
    SolutionIndex: 438
    SolutionNameMin: Cijk_Ailk_Bjlk_SB_MT64x64x8_SE_DTL0_EPS1_FL0_GRVW4_PGR1_PLR0_TT8_4_USFGRO0_VW4_WG8_16_1_WGM8
    SolutionIndex: 439
    SolutionNameMin: Cijk_Ailk_Bjlk_SB_MT64x64x8_SE_EPS1_FL0_GRVW1_GSU1_PGR1_PLR0_TT4_4_USFGRO1_VW2_WG16_16_1_WGM8
    SolutionIndex: 440
    SolutionNameMin: Cijk_Ailk_Bjlk_SB_MT64x64x16_SE_EPS1_FL0_GRVW4_GSU1_PGR1_PLR1_TT4_4_USFGRO0_VW4_WG16_16_1_WGM1
    SolutionIndex: 441
    SolutionNameMin: Cijk_Ailk_Bjlk_SB_MT64x64x16_SE_EPS1_FL0_GRVW4_GSU1_PGR1_PLR1_TT4_4_USFGRO0_VW4_WG16_16_1_WGM8
    SolutionIndex: 442
    SolutionNameMin: Cijk_Ailk_Bjlk_SB_MT64x64x16_SE_EPS1_FL1_GRVW4_GSU1_PGR1_PLR1_TT4_4_USFGRO0_VW4_WG16_16_1_WGM8
    SolutionIndex: 443
    SolutionNameMin: Cijk_Ailk_Bjlk_SB_MT128x64x8_SE_EPS1_FL0_GRVW1_GSU1_PGR1_PLR0_TT8_4_USFGRO1_VW2_WG16_16_1_WGM1
    SolutionIndex: 444
    SolutionNameMin: Cijk_Ailk_Bjlk_SB_MT128x64x16_SE_EPS0_FL0_GRVW1_GSU1_PGR0_PLR0_TT8_4_USFGRO1_VW2_WG16_16_1_WGM1
    SolutionIndex: 445
    SolutionNameMin: Cijk_Ailk_Bjlk_SB_MT128x64x8_SE_EPS1_FL0_GRVW1_GSU1_PGR1_PLR0_TT8_4_USFGRO1_VW4_WG16_16_1_WGM1
    SolutionIndex: 446
    SolutionNameMin: Cijk_Ailk_Bjlk_SB_MT128x64x8_SE_EPS1_FL0_GRVW1_GSU1_PGR1_PLR0_TT8_4_USFGRO1_VW4_WG16_16_1_WGM8
    SolutionIndex: 447
    SolutionNameMin: Cijk_Ailk_Bjlk_SB_MT128x64x8_SE_EPS0_FL1_GRVW2_GSU1_PGR0_PLR0_TT8_4_USFGRO0_VW2_WG16_16_1_WGM1
    SolutionIndex: 448
    SolutionNameMin: Cijk_Ailk_Bjlk_SB_MT96x64x8_SE_EPS1_FL1_GRVW2_GSU1_PGR1_PLR1_TT6_4_USFGRO0_VW2_WG16_16_1_WGM8
    SolutionIndex: 449
    SolutionNameMin: Cijk_Ailk_Bjlk_SB_MT64x96x8_SE_EPS1_FL0_GRVW1_GSU1_PGR1_PLR1_TT4_6_USFGRO1_VW2_WG16_16_1_WGM1
    SolutionIndex: 450
    SolutionNameMin: Cijk_Ailk_Bjlk_SB_MT64x96x8_SE_EPS1_FL1_GRVW2_GSU1_PGR1_PLR1_TT4_6_USFGRO0_VW2_WG16_16_1_WGM8
    SolutionIndex: 451
    SolutionNameMin: Cijk_Ailk_Bjlk_SB_MT64x64x16_SE_FL0_GRVW4_NLCA1_NLCB1_PLR0_TT4_4_VW4_WG16_16_1_WGM8
    SolutionIndex: 452
    SolutionNameMin: Cijk_Ailk_Bjlk_SB_MT64x64x16_SE_FL0_GRVW4_NLCA1_NLCB1_PLR1_TT4_4_VW4_WG16_16_1_WGM8
    SolutionIndex: 453
    SolutionNameMin: Cijk_Ailk_Bjlk_SB_MT128x64x16_SE_FL0_GRVW4_NLCA1_NLCB1_PLR1_TT8_4_VW4_WG16_16_1_WGM1
    SolutionIndex: 454
    SolutionNameMin: Cijk_Ailk_Bjlk_SB_MT64x32x32_SE_FL0_GRVW4_NLCA1_NLCB1_PLR1_TT8_4_VW4_WG8_8_4_WGM16
    SolutionIndex: 455
    SolutionIndex: 456
    SolutionIndex: 457
    SolutionIndex: 458
    SolutionIndex: 459
    SolutionIndex: 460
    SolutionIndex: 461
    SolutionIndex: 462
    SolutionIndex: 463
    SolutionIndex: 464
    SolutionIndex: 465
    SolutionIndex: 466
    SolutionIndex: 467
    SolutionIndex: 468
    SolutionIndex: 469
    SolutionIndex: 470
    SolutionIndex: 471
    SolutionIndex: 472
    SolutionIndex: 473
    SolutionIndex: 474
    SolutionIndex: 475
    SolutionIndex: 476
    SolutionIndex: 477
    SolutionIndex: 478
    SolutionIndex: 479
    SolutionNameMin: Cijk_Ailk_Bjlk_SB_MT64x64x16_SE_GRVW4_GSU1_LRVW4_TT4_4_VW4_WG16_16_1_WGM8
    SolutionIndex: 480
    SolutionNameMin: Cijk_Ailk_Bjlk_SB_MT128x64x16_SE_GRVW4_GSU1_LRVW4_TT8_4_VW4_WG16_16_1_WGM1
    SolutionIndex: 481
    SolutionNameMin: Cijk_Ailk_Bjlk_SB_MT128x64x16_SE_GRVW4_GSU1_LRVW4_TT8_4_VW4_WG16_16_1_WGM8
    SolutionIndex: 482
    SolutionNameMin: Cijk_Ailk_Bjlk_SB_MT64x64x16_SE_GRVW4_GSU1_LRVW4_TT4_4_VW4_WG16_16_1_WGM1
    SolutionIndex: 483
    SolutionNameMin: Cijk_Ailk_Bjlk_SB_MT128x128x16_SE_GRVW4_GSU1_LRVW4_TT8_8_VW4_WG16_16_1_WGM8
    SolutionIndex: 484
    SolutionNameMin: Cijk_Ailk_Bjlk_SB_MT128x128x16_SE_GRVW4_GSU1_LRVW4_TT8_8_VW4_WG16_16_1_WGM1
- - - [1024, 128, 1, 128]
    - [4, 1028.02]
  - - [4, 704, 1, 1280]
    - [43, 363.355]
  - - [4, 1856, 1, 3328]
    - [43, 579.434]
  - - [1856, 448, 1, 3328]
    - [80, 6966.73]
  - - [2944, 4288, 1, 1280]
    - [75, 9057.88]
  - - [2368, 64, 1, 3328]
    - [36, 5837.56]
  - - [2368, 5888, 1, 256]
    - [80, 9111.06]
  - - [128, 64, 1, 256]
    - [42, 374.491]
  - - [5888, 1024, 1, 1280]
    - [85, 8570.44]
  - - [128, 6784, 1, 3328]
    - [48, 7703.86]
  - - [64, 4, 1, 256]
    - [94, 11.2219]
  - - [5888, 1856, 1, 3328]
    - [80, 9394.3]
  - - [5056, 704, 1, 256]
    - [83, 8026.89]
  - - [5888, 2944, 1, 3328]
    - [73, 7608.11]
  - - [1856, 4288, 1, 256]
    - [74, 8986.32]
  - - [1024, 5056, 1, 128]
    - [66, 3898.24]
  - - [5056, 5056, 1, 3328]
    - [74, 9536.75]
  - - [1408, 5888, 1, 1280]
    - [75, 9279.09]
  - - [2368, 448, 1, 128]
    - [67, 2474.32]
  - - [1024, 3584, 1, 3328]
    - [77, 9258.48]
  - - [4, 2944, 1, 1280]
    - [29, 611.74]
  - - [1408, 64, 1, 128]
    - [0, 858.21]
  - - [256, 4288, 1, 3328]
    - [80, 7615.98]
  - - [5888, 1408, 1, 1280]
    - [73, 9620.29]
  - - [704, 1856, 1, 3328]
    - [74, 9033.65]
  - - [4, 1408, 1, 128]
    - [87, 24.355]
  - - [1024, 2368, 1, 256]
    - [74, 7526.15]
  - - [1408, 1856, 1, 1280]
    - [77, 8324.09]
  - - [1408, 64, 1, 1280]
    - [48, 4681.14]
  - - [448, 1024, 1, 1280]
    - [74, 7112.43]
  - - [256, 1408, 1, 3328]
    - [80, 5825.41]
  - - [5056, 5056, 1, 1280]
    - [83, 9233.55]
  - - [448, 5056, 1, 256]
    - [75, 7003.17]
  - - [704, 1856, 1, 1280]
    - [74, 8877.28]
  - - [128, 5056, 1, 128]
    - [66, 2301.04]
  - - [2368, 128, 1, 256]
    - [74, 3848.94]
  - - [1856, 1408, 1, 128]
    - [69, 4202.21]
  - - [64, 5056, 1, 256]
    - [75, 3109.52]
  - - [6784, 256, 1, 3328]
    - [74, 6388.43]
  - - [6784, 4288, 1, 3328]
    - [85, 9114.57]
  - - [4288, 448, 1, 256]
    - [78, 5782.95]
  - - [64, 704, 1, 128]
    - [11, 379.419]
  - - [1856, 2368, 1, 3328]
    - [74, 9128.36]
  - - [4288, 2944, 1, 1280]
    - [80, 9182.23]
  - - [704, 5056, 1, 1280]
    - [74, 9071.47]
  - - [2368, 704, 1, 3328]
    - [80, 7731.33]
  - - [256, 5888, 1, 256]
    - [74, 7920.28]
  - - [1856, 4288, 1, 3328]
    - [80, 9329.97]
  - - [256, 2944, 1, 256]
    - [81, 5312.17]
  - - [5888, 1024, 1, 256]
    - [72, 6710.87]
  - - [448, 64, 1, 1280]
    - [47, 2814.43]
  - - [448, 5056, 1, 3328]
    - [74, 8255.43]
  - - [3584, 4, 1, 1280]
    - [23, 640.715]
  - - [2944, 64, 1, 256]
    - [22, 2621.44]
  - - [128, 4, 1, 1280]
    - [94, 86.2316]
  - - [1408, 2944, 1, 256]
    - [74, 8848.89]
  - - [256, 1856, 1, 1280]
    - [74, 7366.45]
  - - [6784, 5056, 1, 3328]
    - [85, 8332.06]
  - - [5056, 5056, 1, 256]
    - [80, 9171.64]
  - - [1408, 6784, 1, 128]
    - [66, 5079.09]
  - - [64, 1024, 1, 1280]
    - [38, 3679.21]
  - - [2944, 4, 1, 256]
    - [29, 369.443]
  - - [704, 5056, 1, 128]
    - [66, 4509.17]
  - - [4, 2368, 1, 1280]
    - [23, 569.744]
  - - [2368, 2944, 1, 1280]
    - [85, 7451.04]
  - - [128, 3584, 1, 1280]
    - [83, 6071.16]
  - - [6784, 6784, 1, 1280]
    - [80, 9535.64]
  - - [1408, 4288, 1, 1280]
    - [83, 8254.99]
  - - [3584, 4288, 1, 1280]
    - [85, 9651.09]
  - - [2368, 704, 1, 1280]
    - [80, 8291.3]
  - - [5056, 4288, 1, 3328]
    - [72, 9406.26]
  - - [3584, 2368, 1, 3328]
    - [80, 9350.22]
  - - [64, 704, 1, 1280]
    - [47, 3384.49]
  - - [4288, 256, 1, 256]
    - [80, 5593.52]
  - - [2944, 128, 1, 128]
    - [2, 2130.5]
  - - [6784, 448, 1, 1280]
    - [83, 8815.75]
  - - [1408, 2944, 1, 128]
    - [66, 4558.24]
  - - [4288, 2944, 1, 256]
    - [85, 7865.33]
  - - [5888, 704, 1, 1280]
    - [74, 9262.89]
  - - [1856, 64, 1, 1280]
    - [48, 4359.05]
  - - [448, 5888, 1, 128]
    - [69, 4000.49]
  - - [5888, 64, 1, 3328]
    - [49, 6603.29]
  - - [2944, 256, 1, 3328]
    - [74, 8423.53]
  - - [1024, 64, 1, 128]
    - [19, 582.542]
  - - [5056, 2368, 1, 1280]
    - [74, 9419.81]
  - - [448, 3584, 1, 1280]
    - [74, 7985.72]
  - - [6784, 5888, 1, 256]
    - [72, 9494.26]
  - - [704, 1024, 1, 128]
    - [66, 2813.25]
  - - [704, 128, 1, 1280]
    - [48, 4477.61]
  - - [5888, 2944, 1, 128]
    - [69, 4745.86]
  - - [4, 3584, 1, 128]
    - [86, 96.379]
  - - [1408, 448, 1, 1280]
    - [74, 6912.7]
  - - [1024, 1408, 1, 256]
    - [82, 5810.75]
  - - [2368, 2368, 1, 3328]
    - [83, 9088.61]
  - - [1856, 6784, 1, 128]
    - [69, 5168.22]
  - - [5056, 704, 1, 3328]
    - [75, 7464.8]
  - - [1408, 1856, 1, 256]
    - [80, 6727.59]
  - - [1408, 704, 1, 3328]
    - [80, 8379.43]
  - - [2368, 5056, 1, 256]
    - [80, 8664.01]
  - - [5888, 1856, 1, 256]
    - [85, 5809.92]
  - - [4288, 64, 1, 3328]
    - [62, 6583.84]
  - - [2368, 4, 1, 1280]
    - [95, 545.151]
  - - [704, 5888, 1, 256]
    - [80, 8813.61]
  - - [4288, 64, 1, 256]
    - [38, 3059.87]
  - - [6784, 64, 1, 256]
    - [80, 3490.86]
  - - [2944, 256, 1, 256]
    - [74, 6970.3]
  - - [2944, 6784, 1, 3328]
    - [74, 9475.69]
  - - [704, 1408, 1, 3328]
    - [74, 8154.08]
  - - [3584, 704, 1, 3328]
    - [74, 8994.97]
  - - [2944, 256, 1, 128]
    - [66, 2824.03]
  - - [6784, 4, 1, 1280]
    - [23, 625.614]
  - - [1024, 64, 1, 1280]
    - [35, 3307.81]
  - - [448, 4288, 1, 256]
    - [80, 6074.38]
  - - [64, 3584, 1, 3328]
    - [28, 6200.16]
  - - [704, 2368, 1, 1280]
    - [74, 8291.3]
  - - [448, 2944, 1, 128]
    - [66, 3221.77]
  - - [1856, 2368, 1, 1280]
    - [85, 6855.14]
  - - [2368, 128, 1, 3328]
    - [36, 6479.51]
  - - [2944, 128, 1, 256]
    - [74, 3828.13]
  - - [448, 1408, 1, 256]
    - [75, 4525.8]
  - - [1856, 4288, 1, 1280]
    - [73, 9160.22]
  - - [64, 5056, 1, 3328]
    - [56, 6819.2]
  - - [4, 704, 1, 256]
    - [40, 123.441]
  - - [1024, 448, 1, 128]
    - [69, 1989.17]
  - - [704, 4, 1, 1280]
    - [43, 381.831]
  - - [704, 256, 1, 128]
    - [66, 1109.07]
  - - [704, 2944, 1, 128]
    - [66, 4088.93]
  - - [1408, 1024, 1, 1280]
    - [80, 8191.98]
  - - [704, 6784, 1, 256]
    - [74, 6717.8]
  - - [6784, 704, 1, 256]
    - [80, 5429.12]
  - - [5056, 1408, 1, 128]
    - [66, 4954.4]
  - - [256, 3584, 1, 3328]
    - [74, 7890.86]
  - - [4, 5888, 1, 3328]
    - [91, 690.947]
  - - [128, 1408, 1, 128]
    - [13, 1393.04]
  - - [3584, 4288, 1, 3328]
    - [76, 8900.77]
  - - [5888, 1856, 1, 1280]
    - [77, 9345.75]
  - - [5056, 1024, 1, 3328]
    - [78, 7834.74]
  - - [5056, 64, 1, 1280]
    - [56, 5890.04]
  - - [1024, 704, 1, 256]
    - [74, 6007.47]
  - - [1024, 4288, 1, 128]
    - [68, 3496.99]
  - - [4288, 64, 1, 1280]
    - [53, 4726.49]
  - - [2368, 3584, 1, 1280]
    - [72, 8128.72]
  - - [2368, 6784, 1, 1280]
    - [72, 9478.62]
  - - [1024, 256, 1, 256]
    - [80, 4092.0]
  - - [1856, 4, 1, 1280]
    - [95, 509.803]
  - - [448, 448, 1, 256]
    - [80, 3001.18]
  - - [2944, 3584, 1, 3328]
    - [81, 9081.81]
  - - [128, 4288, 1, 128]
    - [1, 2323.23]
  - - [64, 448, 1, 256]
    - [44, 1066.87]
  - - [128, 1024, 1, 3328]
    - [57, 6392.26]
  - - [4, 1408, 1, 3328]
    - [40, 616.556]
  - - [6784, 2944, 1, 256]
    - [83, 8547.63]
  - - [64, 1856, 1, 1280]
    - [56, 4409.61]
  - - [64, 1024, 1, 128]
    - [0, 554.802]
  - - [4288, 2368, 1, 3328]
    - [76, 8779.98]
  - - [1856, 2368, 1, 256]
    - [83, 4976.64]
  - - [3584, 256, 1, 128]
    - [68, 2812.27]
  - - [3584, 6784, 1, 3328]
    - [78, 9278.12]
  - - [256, 1024, 1, 256]
    - [74, 4346.43]
  - - [4, 6784, 1, 3328]
    - [93, 681.266]
  - - [1024, 5888, 1, 3328]
    - [74, 9187.51]
  - - [1024, 128, 1, 1280]
    - [26, 3659.95]
  - - [4288, 128, 1, 1280]
    - [80, 6019.07]
  - - [5056, 4288, 1, 1280]
    - [72, 9343.86]
  - - [5888, 64, 1, 256]
    - [74, 4692.07]
  - - [1856, 256, 1, 1280]
    - [80, 4790.28]
  - - [64, 5888, 1, 3328]
    - [48, 6702.1]
  - - [2944, 5888, 1, 128]
    - [69, 5202.55]
  - - [704, 5888, 1, 1280]
    - [74, 9264.19]
  - - [2368, 3584, 1, 128]
    - [66, 5053.61]
  - - [6784, 5888, 1, 3328]
    - [72, 7926.7]
  - - [704, 1024, 1, 1280]
    - [73, 5402.5]
  - - [448, 256, 1, 3328]
    - [56, 6124.55]
  - - [448, 1856, 1, 128]
    - [67, 2885.86]
  - - [128, 1024, 1, 128]
    - [1, 1013.12]
  - - [2944, 4, 1, 128]
    - [86, 77.5374]
  - - [1024, 704, 1, 1280]
    - [74, 7365.48]
  - - [128, 5888, 1, 256]
    - [74, 6990.51]
  - - [1024, 5056, 1, 1280]
    - [79, 9421.9]
  - - [4288, 1024, 1, 256]
    - [81, 6269.93]
  - - [2944, 2368, 1, 128]
    - [66, 4918.08]
  - - [704, 704, 1, 3328]
    - [74, 7963.55]
  - - [704, 1408, 1, 1280]
    - [74, 8347.22]
  - - [5888, 448, 1, 1280]
    - [80, 5216.95]
  - - [3584, 256, 1, 3328]
    - [74, 7802.15]
  - - [704, 5888, 1, 3328]
    - [80, 8381.36]
  - - [704, 1856, 1, 128]
    - [66, 3598.28]
  - - [128, 3584, 1, 3328]
    - [36, 7161.01]
  - - [6784, 2368, 1, 1280]
    - [85, 9464.31]
  - - [4, 4288, 1, 128]
    - [86, 132.58]
  - - [128, 704, 1, 1280]
    - [48, 4463.75]
  - - [3584, 2944, 1, 256]
    - [85, 8201.14]
  - - [1856, 128, 1, 3328]
    - [27, 6575.4]
  - - [4, 64, 1, 1280]
    - [43, 43.5745]
  - - [4, 5056, 1, 3328]
    - [23, 675.215]
  - - [128, 2944, 1, 1280]
    - [27, 5916.89]
  - - [2368, 1024, 1, 3328]
    - [80, 8646.74]
  - - [128, 256, 1, 3328]
    - [61, 4130.75]
  - - [1408, 5056, 1, 3328]
    - [79, 9529.65]
  - - [1856, 1856, 1, 3328]
    - [78, 8114.89]
  - - [3584, 128, 1, 256]
    - [74, 5603.08]
  - - [448, 1408, 1, 3328]
    - [74, 7072.93]
  - - [2368, 2368, 1, 256]
    - [81, 7648.66]
  - - [4288, 4288, 1, 1280]
    - [76, 9244.01]
  - - [64, 448, 1, 1280]
    - [47, 2885.23]
  - - [1408, 4288, 1, 256]
    - [74, 8080.31]
  - - [448, 4, 1, 256]
    - [92, 84.3294]
  - - [5888, 448, 1, 128]
    - [69, 3540.7]
  - - [448, 4, 1, 1280]
    - [43, 322.157]
  - - [704, 6784, 1, 3328]
    - [73, 8613.48]
  - - [5888, 5888, 1, 1280]
    - [80, 9501.95]
  - - [5056, 1024, 1, 1280]
    - [83, 9110.01]
  - - [448, 5888, 1, 3328]
    - [74, 8586.33]
  - - [128, 4, 1, 128]
    - [86, 4.17959]
  - - [1024, 2944, 1, 1280]
    - [82, 7096.43]
  - - [5056, 5888, 1, 1280]
    - [73, 9693.41]
  - - [4288, 5888, 1, 128]
    - [66, 5406.36]
  - - [256, 3584, 1, 256]
    - [74, 6908.27]
  - - [1408, 3584, 1, 128]
    - [66, 4645.59]
  - - [256, 2944, 1, 3328]
    - [77, 6284.3]
  - - [448, 3584, 1, 128]
    - [69, 3675.27]
  - - [5888, 2944, 1, 1280]
    - [79, 9628.8]
  - - [4, 6784, 1, 1280]
    - [23, 688.076]
  - - [2368, 5888, 1, 128]
    - [66, 5273.86]
  - - [64, 2944, 1, 128]
    - [10, 1316.44]
  - - [3584, 5888, 1, 256]
    - [80, 9239.04]
  - - [2368, 704, 1, 128]
    - [69, 3537.55]
  - - [3584, 2944, 1, 1280]
    - [74, 9324.52]
  - - [3584, 2368, 1, 128]
    - [66, 4766.24]
  - - [5056, 704, 1, 128]
    - [66, 4487.85]
  - - [448, 2368, 1, 128]
    - [69, 2876.92]
  - - [5056, 1408, 1, 3328]
    - [85, 9515.87]
  - - [1408, 704, 1, 256]
    - [77, 6836.08]
  - - [6784, 1024, 1, 3328]
    - [72, 9309.55]
  - - [6784, 2944, 1, 3328]
    - [73, 9536.48]
  - - [2944, 5056, 1, 3328]
    - [74, 9526.15]
  - - [1856, 1856, 1, 256]
    - [74, 5239.14]
  - - [1024, 5888, 1, 128]
    - [66, 4006.18]
  - - [2048, 7133, 1, 2048]
    - [72, 9827.97]
  - - [256, 4, 1, 128]
    - [87, 4.28908]
  - - [4288, 5888, 1, 1280]
    - [82, 9202.73]
  - - [4288, 4288, 1, 256]
    - [77, 5521.08]
  - - [448, 2944, 1, 3328]
    - [80, 7724.43]
  - - [4288, 1856, 1, 1280]
    - [80, 8826.24]
  - - [1856, 2944, 1, 3328]
    - [74, 9194.8]
  - - [256, 6784, 1, 3328]
    - [74, 8740.23]
  - - [64, 5888, 1, 256]
    - [74, 4766.25]
  - - [256, 5056, 1, 128]
    - [66, 2937.5]
  - - [5056, 1024, 1, 256]
    - [85, 5467.81]
  - - [704, 64, 1, 3328]
    - [62, 4818.33]
  - - [5056, 1856, 1, 3328]
    - [79, 8861.59]
  - - [4, 2944, 1, 3328]
    - [29, 662.002]
  - - [4, 5056, 1, 256]
    - [89, 494.021]
  - - [1856, 1408, 1, 256]
    - [74, 8674.68]
  - - [3584, 4, 1, 128]
    - [86, 108.196]
  - - [448, 448, 1, 3328]
    - [48, 6457.3]
  - - [6784, 128, 1, 3328]
    - [41, 7256.61]
  - - [4288, 1408, 1, 128]
    - [69, 4791.66]
  - - [4288, 5056, 1, 256]
    - [74, 8560.74]
  - - [1408, 128, 1, 1280]
    - [56, 5085.69]
  - - [5056, 256, 1, 3328]
    - [77, 7284.13]
  - - [704, 704, 1, 256]
    - [74, 6171.09]
  - - [1024, 5888, 1, 1280]
    - [79, 8852.79]
  - - [6784, 2368, 1, 128]
    - [67, 4729.2]
  - - [4, 5056, 1, 1280]
    - [40, 669.946]
  - - [64, 128, 1, 256]
    - [42, 369.217]
  - - [128, 1856, 1, 1280]
    - [36, 5549.03]
  - - [5056, 3584, 1, 256]
    - [80, 7115.74]
  - - [1856, 1024, 1, 1280]
    - [72, 8196.4]
  - - [6784, 4288, 1, 1280]
    - [73, 9509.56]
  - - [1856, 1856, 1, 1280]
    - [75, 5791.89]
  - - [6784, 2944, 1, 128]
    - [66, 5317.02]
  - - [1408, 5056, 1, 1280]
    - [75, 8980.63]
  - - [4, 2368, 1, 3328]
    - [40, 592.534]
  - - [5888, 1856, 1, 128]
    - [65, 4600.1]
  - - [448, 704, 1, 1280]
    - [74, 2286.48]
  - - [2368, 1024, 1, 128]
    - [69, 3911.02]
  - - [1024, 448, 1, 3328]
    - [74, 7295.14]
  - - [1856, 704, 1, 1280]
    - [74, 8881.02]
  - - [5056, 3584, 1, 128]
    - [66, 4911.58]
  - - [5888, 5888, 1, 3328]
    - [82, 9243.8]
  - - [6784, 1024, 1, 256]
    - [85, 5475.31]
  - - [2944, 2368, 1, 256]
    - [80, 5670.67]
  - - [256, 448, 1, 256]
    - [31, 2293.76]
  - - [5056, 5888, 1, 3328]
    - [75, 7847.97]
  - - [1856, 1024, 1, 256]
    - [80, 7517.6]
  - - [448, 1408, 1, 1280]
    - [74, 6917.44]
  - - [3584, 448, 1, 1280]
    - [80, 7980.76]
  - - [1024, 1024, 1, 1280]
    - [77, 8384.42]
  - - [448, 5888, 1, 256]
    - [74, 7365.65]
  - - [704, 64, 1, 128]
    - [19, 358.655]
  - - [1408, 6784, 1, 3328]
    - [80, 9094.09]
  - - [448, 1024, 1, 128]
    - [69, 1772.95]
  - - [4288, 704, 1, 128]
    - [66, 4355.28]
  - - [128, 1856, 1, 128]
    - [5, 1610.63]
  - - [448, 2368, 1, 3328]
    - [80, 7366.37]
  - - [5056, 64, 1, 128]
    - [5, 2157.23]
  - - [5056, 2944, 1, 256]
    - [74, 9123.06]
  - - [6784, 5888, 1, 128]
    - [65, 5285.8]
  - - [704, 1024, 1, 256]
    - [80, 6667.25]
  - - [1024, 4, 1, 256]
    - [29, 187.246]
  - - [2368, 1856, 1, 256]
    - [80, 6777.84]
  - - [128, 6784, 1, 1280]
    - [77, 7052.61]
  - - [1408, 3584, 1, 3328]
    - [81, 9037.95]
  - - [2368, 6784, 1, 256]
    - [74, 9181.35]
  - - [5056, 1408, 1, 1280]
    - [79, 9421.9]
  - - [256, 256, 1, 128]
    - [11, 543.304]
  - - [5056, 4288, 1, 128]
    - [69, 5339.92]
  - - [1408, 1856, 1, 128]
    - [66, 4270.89]
  - - [1408, 5888, 1, 3328]
    - [78, 9034.79]
  - - [1856, 256, 1, 256]
    - [80, 5847.83]
  - - [6784, 6784, 1, 256]
    - [73, 9624.38]
  - - [64, 256, 1, 128]
    - [12, 146.449]
  - - [4288, 2368, 1, 128]
    - [65, 3896.94]
  - - [1856, 4288, 1, 128]
    - [66, 4337.07]
  - - [256, 4288, 1, 1280]
    - [74, 7499.42]
  - - [2368, 2944, 1, 256]
    - [79, 7703.18]
  - - [4, 1856, 1, 256]
    - [92, 263.964]
  - - [3584, 1856, 1, 1280]
    - [74, 9224.33]
  - - [6784, 6784, 1, 128]
    - [66, 5476.03]
  - - [256, 1856, 1, 128]
    - [69, 1858.72]
  - - [704, 64, 1, 1280]
    - [47, 3368.67]
  - - [5888, 5056, 1, 256]
    - [80, 5859.81]
  - - [3584, 448, 1, 256]
    - [80, 7298.33]
  - - [448, 4288, 1, 128]
    - [66, 3813.45]
  - - [2944, 4288, 1, 3328]
    - [75, 9149.63]
  - - [256, 6784, 1, 256]
    - [74, 7984.85]
  - - [1408, 4288, 1, 128]
    - [69, 4728.34]
  - - [2944, 704, 1, 3328]
    - [80, 7149.76]
  - - [128, 448, 1, 256]
    - [46, 1699.08]
  - - [512, 32, 1, 512]
    - [46, 1127.5]
  - - [3584, 3584, 1, 256]
    - [75, 8558.01]
  - - [448, 1408, 1, 128]
    - [66, 2504.35]
  - - [128, 256, 1, 1280]
    - [47, 3216.49]
  - - [3584, 5056, 1, 256]
    - [72, 5674.35]
  - - [6784, 128, 1, 256]
    - [74, 6216.39]
  - - [4288, 4, 1, 256]
    - [90, 435.606]
  - - [64, 1408, 1, 3328]
    - [48, 6185.91]
  - - [704, 448, 1, 256]
    - [80, 4004.98]
  - - [2944, 2368, 1, 1280]
    - [81, 8542.7]
  - - [448, 64, 1, 3328]
    - [61, 3835.23]
  - - [1408, 3584, 1, 256]
    - [74, 8714.53]
  - - [3584, 4, 1, 3328]
    - [29, 689.454]
  - - [6784, 3584, 1, 256]
    - [79, 9271.24]
  - - [256, 128, 1, 128]
    - [12, 283.399]
  - - [704, 1408, 1, 128]
    - [66, 3210.47]
  - - [4, 2368, 1, 256]
    - [92, 360.838]
  - - [2944, 448, 1, 128]
    - [66, 3344.31]
  - - [128, 1408, 1, 256]
    - [74, 3186.28]
  - - [4, 2944, 1, 256]
    - [90, 384.522]
  - - [64, 128, 1, 3328]
    - [43, 2103.62]
  - - [5056, 2368, 1, 128]
    - [66, 5219.66]
  - - [2944, 2944, 1, 3328]
    - [83, 9174.59]
  - - [5056, 6784, 1, 256]
    - [85, 8992.26]
  - - [1856, 3584, 1, 128]
    - [66, 4957.17]
  - - [128, 2944, 1, 128]
    - [4, 2241.38]
  - - [1024, 704, 1, 3328]
    - [84, 6545.01]
  - - [6784, 448, 1, 256]
    - [80, 5379.15]
  - - [3584, 6784, 1, 128]
    - [66, 5101.91]
  - - [128, 4288, 1, 256]
    - [74, 5211.76]
  - - [704, 448, 1, 3328]
    - [75, 4504.05]
  - - [1024, 1024, 1, 3328]
    - [77, 8009.67]
  - - [128, 128, 1, 3328]
    - [60, 3184.93]
  - - [5056, 1856, 1, 256]
    - [74, 9138.33]
  - - [256, 128, 1, 256]
    - [46, 1205.26]
  - - [1024, 1856, 1, 256]
    - [85, 6374.99]
  - - [4288, 64, 1, 128]
    - [2, 1695.33]
  - - [256, 448, 1, 3328]
    - [49, 5659.57]
  - - [1408, 6784, 1, 1280]
    - [74, 9349.1]
  - - [3584, 3584, 1, 1280]
    - [79, 9302.09]
  - - [64, 2368, 1, 1280]
    - [48, 4432.97]
  - - [448, 2368, 1, 1280]
    - [74, 7250.67]
  - - [5888, 5888, 1, 128]
    - [66, 4615.93]
  - - [64, 6784, 1, 3328]
    - [80, 6987.13]
  - - [2944, 256, 1, 1280]
    - [83, 6127.35]
  - - [5056, 5888, 1, 128]
    - [65, 5106.29]
  - - [256, 2368, 1, 128]
    - [66, 2141.13]
  - - [5056, 2368, 1, 3328]
    - [77, 9041.65]
  - - [2944, 4288, 1, 256]
    - [85, 8691.12]
  - - [1408, 3584, 1, 1280]
    - [74, 9069.9]
  - - [2368, 64, 1, 256]
    - [46, 2412.77]
  - - [64, 448, 1, 3328]
    - [61, 3739.04]
  - - [256, 256, 1, 3328]
    - [48, 5304.08]
  - - [5888, 4, 1, 128]
    - [87, 105.555]
  - - [1856, 704, 1, 256]
    - [74, 8025.33]
  - - [4, 4288, 1, 1280]
    - [21, 578.97]
  - - [1408, 448, 1, 3328]
    - [82, 5714.41]
  - - [1024, 4, 1, 3328]
    - [40, 608.549]
  - - [2368, 256, 1, 256]
    - [80, 5172.98]
  - - [2368, 6784, 1, 3328]
    - [80, 9456.51]
  - - [1856, 1408, 1, 1280]
    - [85, 7805.09]
  - - [1856, 448, 1, 1280]
    - [72, 6184.94]
  - - [6784, 704, 1, 128]
    - [66, 4597.77]
  - - [4, 4, 1, 256]
    - [43, 0.691892]
  - - [128, 5888, 1, 128]
    - [4, 2691.66]
  - - [1408, 5888, 1, 256]
    - [79, 7164.17]
  - - [704, 2944, 1, 1280]
    - [81, 8139.71]
  - - [1856, 2368, 1, 128]
    - [69, 4623.28]
  - - [4096, 7133, 1, 4096]
    - [73, 9939.97]
  - - [256, 64, 1, 256]
    - [37, 689.853]
  - - [1024, 1024, 1, 256]
    - [80, 7216.01]
  - - [704, 1856, 1, 256]
    - [80, 6364.07]
  - - [128, 4288, 1, 3328]
    - [36, 7200.49]
  - - [3584, 704, 1, 1280]
    - [83, 7971.98]
  - - [256, 128, 1, 1280]
    - [34, 2702.52]
  - - [2368, 4, 1, 256]
    - [29, 325.918]
  - - [256, 2368, 1, 1280]
    - [74, 6638.83]
  - - [2944, 6784, 1, 128]
    - [65, 5233.43]
  - - [3584, 448, 1, 3328]
    - [74, 8094.3]
  - - [1408, 4, 1, 256]
    - [92, 243.546]
  - - [704, 2368, 1, 3328]
    - [74, 8403.01]
  - - [2944, 448, 1, 256]
    - [74, 7022.49]
  - - [1856, 448, 1, 128]
    - [69, 2842.69]
  - - [2368, 128, 1, 1280]
    - [56, 5685.42]
  - - [256, 5888, 1, 128]
    - [71, 2178.61]
  - - [64, 6784, 1, 256]
    - [74, 5385.13]
  - - [64, 5056, 1, 1280]
    - [48, 5603.19]
  - - [4, 6784, 1, 128]
    - [86, 180.156]
  - - [2944, 2944, 1, 1280]
    - [83, 9129.29]
  - - [5888, 2368, 1, 256]
    - [85, 6961.59]
  - - [4, 3584, 1, 1280]
    - [29, 646.13]
  - - [1408, 128, 1, 128]
    - [15, 1172.19]
  - - [6784, 704, 1, 3328]
    - [80, 9084.52]
  - - [128, 64, 1, 1280]
    - [59, 1260.31]
  - - [2368, 256, 1, 1280]
    - [80, 6643.38]
  - - [4, 448, 1, 3328]
    - [43, 433.414]
  - - [5888, 4288, 1, 128]
    - [67, 4753.07]
  - - [4, 5888, 1, 256]
    - [29, 471.04]
  - - [1408, 2944, 1, 3328]
    - [83, 9207.0]
  - - [3584, 704, 1, 128]
    - [69, 3762.36]
  - - [64, 1024, 1, 256]
    - [47, 1807.89]
  - - [5056, 5056, 1, 128]
    - [70, 4830.06]
  - - [2368, 448, 1, 1280]
    - [74, 7263.06]
  - - [128, 3584, 1, 256]
    - [77, 4369.07]
  - - [704, 448, 1, 1280]
    - [75, 4205.23]
  - - [448, 5056, 1, 128]
    - [66, 3855.47]
  - - [256, 4, 1, 1280]
    - [97, 157.538]
  - - [128, 5056, 1, 256]
    - [80, 6108.96]
  - - [1408, 5056, 1, 128]
    - [69, 4836.58]
  - - [2944, 3584, 1, 128]
    - [69, 4532.09]
  - - [3584, 2368, 1, 256]
    - [74, 8951.24]
  - - [5888, 5056, 1, 1280]
    - [85, 9276.39]
  - - [2368, 5056, 1, 128]
    - [69, 5167.56]
  - - [64, 704, 1, 256]
    - [29, 1501.87]
  - - [4288, 256, 1, 1280]
    - [74, 7496.2]
  - - [3584, 3584, 1, 3328]
    - [75, 9301.67]
  - - [1024, 256, 1, 128]
    - [66, 1508.74]
  - - [4, 704, 1, 128]
    - [87, 12.0469]
  - - [5888, 6784, 1, 256]
    - [73, 9370.37]
  - - [4288, 2944, 1, 3328]
    - [77, 9148.99]
  - - [2944, 64, 1, 128]
    - [13, 1456.36]
  - - [1856, 64, 1, 256]
    - [39, 2209.93]
  - - [4288, 128, 1, 3328]
    - [33, 6471.85]
  - - [4288, 704, 1, 1280]
    - [80, 8934.51]
  - - [256, 5056, 1, 1280]
    - [74, 8439.03]
  - - [1408, 256, 1, 128]
    - [69, 1769.07]
  - - [2944, 5888, 1, 3328]
    - [74, 9447.94]
  - - [6784, 5888, 1, 1280]
    - [85, 9372.15]
  - - [704, 128, 1, 256]
    - [31, 2059.7]
  - - [5888, 4288, 1, 1280]
    - [77, 9244.22]
  - - [448, 256, 1, 1280]
    - [56, 4741.62]
  - - [5888, 3584, 1, 128]
    - [65, 4979.96]
  - - [1856, 1856, 1, 128]
    - [69, 4363.88]
  - - [5056, 4, 1, 1280]
    - [89, 629.541]
  - - [256, 1408, 1, 1280]
    - [80, 5588.34]
  - - [512, 16, 1, 512]
    - [40, 689.853]
  - - [704, 3584, 1, 128]
    - [69, 4069.57]
  - - [5888, 448, 1, 3328]
    - [85, 7925.84]
  - - [2368, 4288, 1, 1280]
    - [84, 8492.6]
  - - [4288, 2944, 1, 128]
    - [66, 5238.11]
  - - [1024, 6784, 1, 3328]
    - [80, 8578.08]
  - - [128, 2368, 1, 256]
    - [80, 3788.8]
  - - [6784, 64, 1, 3328]
    - [74, 7003.36]
  - - [5056, 2944, 1, 3328]
    - [77, 8575.35]
  - - [448, 128, 1, 256]
    - [29, 1714.96]
  - - [2944, 3584, 1, 256]
    - [74, 8994.16]
  - - [1408, 1408, 1, 3328]
    - [72, 8757.6]
  - - [1856, 128, 1, 1280]
    - [74, 5598.07]
  - - [3584, 3584, 1, 128]
    - [65, 4787.34]
  - - [64, 3584, 1, 256]
    - [80, 3545.91]
  - - [1408, 4, 1, 3328]
    - [24, 640.14]
  - - [128, 2944, 1, 3328]
    - [48, 7204.14]
  - - [3584, 704, 1, 256]
    - [74, 6239.59]
  - - [2944, 448, 1, 3328]
    - [80, 7726.61]
  - - [3584, 1408, 1, 3328]
    - [72, 9358.68]
  - - [704, 3584, 1, 1280]
    - [80, 8005.18]
  - - [2944, 6784, 1, 1280]
    - [72, 9487.63]
  - - [1856, 6784, 1, 256]
    - [74, 5684.46]
  - - [4288, 448, 1, 3328]
    - [80, 8410.28]
  - - [6784, 4288, 1, 128]
    - [70, 4785.48]
  - - [6784, 704, 1, 1280]
    - [74, 5578.95]
  - - [256, 4288, 1, 256]
    - [74, 6781.33]
  - - [3584, 64, 1, 128]
    - [13, 1473.9]
  - - [5888, 1024, 1, 3328]
    - [72, 8639.39]
  - - [448, 64, 1, 128]
    - [4, 259.182]
  - - [704, 6784, 1, 1280]
    - [80, 9027.15]
  - - [5888, 128, 1, 256]
    - [80, 6812.78]
  - - [2368, 448, 1, 3328]
    - [80, 7356.53]
  - - [1856, 5056, 1, 3328]
    - [79, 8871.46]
  - - [4, 6784, 1, 256]
    - [88, 469.379]
  - - [1024, 3584, 1, 128]
    - [66, 3427.92]
  - - [1024, 1408, 1, 128]
    - [69, 2934.95]
  - - [2368, 2944, 1, 128]
    - [69, 4887.92]
  - - [5056, 64, 1, 256]
    - [38, 3186.06]
  - - [4, 448, 1, 1280]
    - [43, 273.067]
  - - [5056, 2944, 1, 128]
    - [70, 4752.69]
  - - [5888, 5056, 1, 3328]
    - [84, 9124.67]
  - - [1024, 704, 1, 128]
    - [69, 2302.26]
  - - [1408, 2368, 1, 128]
    - [69, 3826.85]
  - - [5888, 2368, 1, 128]
    - [66, 4912.67]
  - - [128, 5056, 1, 3328]
    - [56, 7583.7]
  - - [3584, 6784, 1, 1280]
    - [83, 9313.4]
  - - [3072, 7435, 1, 1024]
    - [77, 9321.97]
  - - [1856, 5888, 1, 256]
    - [74, 5778.24]
  - - [256, 256, 1, 256]
    - [26, 1576.81]
  - - [256, 64, 1, 128]
    - [12, 173.605]
  - - [4288, 4288, 1, 3328]
    - [79, 8416.17]
  - - [4288, 1408, 1, 1280]
    - [85, 9301.87]
  - - [3584, 5056, 1, 128]
    - [71, 4344.84]
  - - [4, 1024, 1, 3328]
    - [40, 615.139]
  - - [4288, 2368, 1, 256]
    - [74, 9142.57]
  - - [2944, 5056, 1, 1280]
    - [74, 9399.59]
  - - [448, 6784, 1, 256]
    - [73, 5710.83]
  - - [64, 1024, 1, 3328]
    - [56, 4975.0]
  - - [6784, 2368, 1, 3328]
    - [83, 9207.53]
  - - [256, 1024, 1, 1280]
    - [80, 5983.32]
  - - [704, 4, 1, 128]
    - [86, 15.0187]
  - - [256, 4, 1, 256]
    - [43, 52.8516]
  - - [4288, 128, 1, 256]
    - [74, 5242.88]
  - - [4288, 1856, 1, 3328]
    - [85, 9353.96]
  - - [3584, 448, 1, 128]
    - [66, 3353.8]
  - - [256, 4, 1, 3328]
    - [97, 313.224]
  - - [4, 1408, 1, 1280]
    - [40, 509.107]
  - - [3584, 64, 1, 1280]
    - [28, 5198.32]
  - - [1408, 448, 1, 128]
    - [66, 2628.27]
  - - [3584, 1024, 1, 1280]
    - [80, 8534.91]
  - - [1856, 5056, 1, 256]
    - [72, 8184.39]
  - - [4, 3584, 1, 256]
    - [90, 395.476]
  - - [1024, 4288, 1, 256]
    - [75, 5966.42]
  - - [5888, 3584, 1, 3328]
    - [78, 9189.33]
  - - [4, 256, 1, 256]
    - [94, 41.4785]
  - - [5056, 3584, 1, 3328]
    - [79, 9431.82]
  - - [128, 5888, 1, 1280]
    - [74, 8192.0]
  - - [704, 448, 1, 128]
    - [66, 1510.86]
  - - [2368, 1408, 1, 1280]
    - [74, 8415.55]
  - - [5056, 2944, 1, 1280]
    - [85, 9294.67]
  - - [3584, 256, 1, 256]
    - [74, 6749.45]
  - - [128, 1856, 1, 3328]
    - [27, 6796.99]
  - - [1024, 6784, 1, 256]
    - [80, 8782.99]
  - - [4, 128, 1, 256]
    - [40, 27.3067]
  - - [64, 64, 1, 1280]
    - [59, 712.348]
  - - [6784, 4, 1, 128]
    - [87, 121.96]
  - - [2944, 1408, 1, 128]
    - [69, 4430.36]
  - - [448, 128, 1, 3328]
    - [56, 5097.24]
  - - [64, 2944, 1, 3328]
    - [56, 6362.1]
  - - [64, 4288, 1, 3328]
    - [56, 6564.91]
  - - [5056, 6784, 1, 3328]
    - [80, 8121.08]
  - - [128, 2944, 1, 256]
    - [74, 4692.07]
  - - [128, 6784, 1, 128]
    - [3, 2687.36]
  - - [3584, 4288, 1, 256]
    - [80, 9193.89]
  - - [448, 1856, 1, 256]
    - [80, 6231.29]
  - - [1856, 6784, 1, 3328]
    - [85, 9191.38]
  - - [3584, 128, 1, 3328]
    - [74, 7368.37]
  - - [64, 1856, 1, 256]
    - [25, 2184.53]
  - - [1024, 448, 1, 1280]
    - [80, 6977.22]
  - - [5888, 4288, 1, 256]
    - [80, 5780.4]
  - - [4, 448, 1, 128]
    - [87, 8.96]
  - - [5056, 1408, 1, 256]
    - [74, 5601.25]
  - - [64, 256, 1, 1280]
    - [40, 1927.53]
  - - [3584, 1024, 1, 256]
    - [85, 7542.74]
  - - [256, 704, 1, 256]
    - [74, 2957.52]
  - - [5888, 5888, 1, 256]
    - [85, 7344.04]
  - - [4288, 1024, 1, 1280]
    - [80, 8925.74]
  - - [5888, 128, 1, 3328]
    - [74, 8409.97]
  - - [448, 6784, 1, 3328]
    - [74, 8862.46]
  - - [2944, 1408, 1, 1280]
    - [85, 7478.83]
  - - [1024, 32, 1, 512]
    - [29, 1777.25]
  - - [2944, 1856, 1, 3328]
    - [74, 9153.33]
  - - [2368, 64, 1, 128]
    - [13, 1102.2]
  - - [2944, 2944, 1, 128]
    - [65, 4591.85]
  - - [4, 128, 1, 3328]
    - [95, 118.99]
  - - [3584, 5888, 1, 1280]
    - [74, 9222.39]
  - - [64, 4, 1, 128]
    - [86, 0.93516]
  - - [6784, 1856, 1, 1280]
    - [74, 9135.97]
  - - [2944, 5056, 1, 256]
    - [80, 8860.03]
  - - [2944, 5888, 1, 1280]
    - [73, 9643.53]
  - - [5888, 256, 1, 3328]
    - [80, 8799.43]
  - - [1856, 5888, 1, 3328]
    - [80, 9457.43]
  - - [3584, 1408, 1, 256]
    - [80, 8672.43]
  - - [704, 3584, 1, 3328]
    - [80, 8525.2]
  - - [5056, 448, 1, 1280]
    - [80, 8843.67]
  - - [3584, 1856, 1, 3328]
    - [72, 8881.43]
  - - [64, 1408, 1, 128]
    - [1, 747.042]
  - - [1408, 704, 1, 1280]
    - [74, 8342.83]
  - - [2944, 1024, 1, 256]
    - [85, 8079.48]
  - - [1024, 2368, 1, 128]
    - [69, 3347.48]
  - - [2368, 4288, 1, 3328]
    - [80, 9467.57]
  - - [4, 1408, 1, 256]
    - [92, 257.463]
  - - [1024, 1408, 1, 1280]
    - [80, 8241.74]
  - - [64, 64, 1, 256]
    - [40, 189.959]
  - - [704, 256, 1, 3328]
    - [74, 4519.18]
  - - [6784, 5056, 1, 256]
    - [73, 9133.68]
  - - [4, 4288, 1, 3328]
    - [24, 669.975]
  - - [448, 6784, 1, 128]
    - [66, 4481.82]
  - - [4, 704, 1, 3328]
    - [96, 522.971]
  - - [448, 2944, 1, 256]
    - [74, 7022.49]
  - - [2944, 6784, 1, 256]
    - [80, 9199.74]
  - - [2368, 2368, 1, 1280]
    - [85, 8646.74]
  - - [4, 4, 1, 1280]
    - [43, 3.01176]
  - - [1856, 3584, 1, 1280]
    - [72, 8805.35]
  - - [64, 2944, 1, 256]
    - [46, 2565.66]
  - - [3584, 1408, 1, 1280]
    - [85, 9273.02]
  - - [448, 256, 1, 128]
    - [1, 941.03]
  - - [4288, 448, 1, 128]
    - [67, 3215.1]
  - - [5056, 256, 1, 1280]
    - [80, 8790.03]
  - - [1856, 1408, 1, 3328]
    - [74, 9310.63]
  - - [128, 128, 1, 128]
    - [9, 155.115]
  - - [1024, 4288, 1, 3328]
    - [77, 8528.02]
  - - [448, 2368, 1, 256]
    - [81, 5097.24]
  - - [1024, 4, 1, 128]
    - [87, 10.2721]
  - - [5056, 448, 1, 256]
    - [80, 8236.68]
  - - [2944, 2368, 1, 3328]
    - [73, 9331.06]
  - - [704, 128, 1, 3328]
    - [48, 5969.2]
  - - [64, 64, 1, 3328]
    - [64, 1494.68]
  - - [1024, 1856, 1, 1280]
    - [79, 6356.33]
  - - [6784, 1856, 1, 256]
    - [80, 9068.53]
  - - [128, 2368, 1, 3328]
    - [56, 6714.12]
  - - [1024, 5888, 1, 256]
    - [80, 5501.5]
  - - [5056, 128, 1, 1280]
    - [36, 6455.54]
  - - [5056, 64, 1, 3328]
    - [41, 6703.71]
  - - [128, 704, 1, 128]
    - [2, 696.518]
  - - [1408, 2368, 1, 256]
    - [74, 8667.15]
  - - [1408, 1408, 1, 256]
    - [85, 7615.71]
  - - [4, 64, 1, 128]
    - [87, 0.98463]
  - - [64, 128, 1, 1280]
    - [59, 1379.71]
  - - [2368, 2368, 1, 128]
    - [69, 4582.16]
  - - [64, 5888, 1, 128]
    - [2, 2086.27]
  - - [5888, 4, 1, 3328]
    - [23, 667.414]
  - - [6784, 1408, 1, 128]
    - [70, 4516.24]
  - - [4288, 5888, 1, 256]
    - [85, 8497.33]
  - - [1408, 5056, 1, 256]
    - [74, 8867.36]
  - - [5056, 128, 1, 3328]
    - [56, 7678.88]
  - - [128, 128, 1, 1280]
    - [44, 2016.49]
  - - [448, 704, 1, 256]
    - [75, 3030.79]
  - - [4288, 3584, 1, 128]
    - [66, 5246.23]
  - - [2944, 128, 1, 3328]
    - [41, 6795.06]
  - - [128, 5056, 1, 1280]
    - [27, 6192.99]
  - - [3584, 5056, 1, 1280]
    - [79, 9499.07]
  - - [256, 448, 1, 1280]
    - [35, 4267.46]
  - - [704, 704, 1, 128]
    - [69, 2259.22]
  - - [5056, 4, 1, 128]
    - [87, 12.4313]
  - - [704, 256, 1, 1280]
    - [74, 4355.87]
  - - [64, 2368, 1, 3328]
    - [48, 6310.87]
  - - [1856, 1024, 1, 128]
    - [65, 4065.33]
  - - [1856, 64, 1, 128]
    - [4, 936.229]
  - - [64, 6784, 1, 1280]
    - [27, 5731.7]
  - - [704, 4288, 1, 256]
    - [80, 5218.8]
  - - [5888, 2368, 1, 1280]
    - [74, 9378.8]
  - - [128, 256, 1, 256]
    - [44, 1219.27]
  - - [256, 64, 1, 1280]
    - [46, 1820.44]
  - - [2368, 5888, 1, 1280]
    - [85, 9143.54]
  - - [5888, 256, 1, 1280]
    - [74, 8678.37]
  - - [4, 5888, 1, 1280]
    - [21, 668.142]
  - - [704, 128, 1, 128]
    - [9, 649.456]
  - - [1024, 4, 1, 1280]
    - [40, 478.365]
  - - [2368, 1856, 1, 3328]
    - [72, 8153.77]
  - - [2368, 128, 1, 128]
    - [7, 1858.11]
  - - [2944, 704, 1, 256]
    - [74, 8437.97]
  - - [5056, 128, 1, 128]
    - [3, 2689.53]
  - - [256, 704, 1, 3328]
    - [74, 4541.08]
  - - [704, 3584, 1, 256]
    - [75, 7770.97]
  - - [704, 2944, 1, 3328]
    - [80, 9166.38]
  - - [6784, 1024, 1, 128]
    - [65, 4362.21]
  - - [256, 448, 1, 128]
    - [12, 899.514]
  - - [448, 1024, 1, 3328]
    - [74, 7385.46]
  - - [2944, 1024, 1, 3328]
    - [77, 8779.71]
  - - [2944, 5056, 1, 128]
    - [69, 5103.01]
  - - [1408, 6784, 1, 256]
    - [80, 8346.79]
  - - [6784, 1408, 1, 3328]
    - [76, 8878.3]
  - - [4288, 6784, 1, 128]
    - [65, 5432.89]
  - - [704, 64, 1, 256]
    - [54, 1441.79]
  - - [5888, 4, 1, 1280]
    - [91, 636.541]
  - - [256, 2368, 1, 3328]
    - [74, 6804.7]
  - - [6784, 2944, 1, 1280]
    - [73, 9472.16]
  - - [4288, 1856, 1, 128]
    - [69, 4886.28]
  - - [1856, 2944, 1, 128]
    - [66, 4642.86]
  - - [6784, 448, 1, 128]
    - [66, 4369.07]
  - - [64, 3584, 1, 128]
    - [13, 1645.75]
  - - [448, 5056, 1, 1280]
    - [74, 8553.54]
  - - [2368, 1856, 1, 128]
    - [66, 4741.75]
  - - [128, 448, 1, 1280]
    - [56, 3744.91]
  - - [4288, 704, 1, 256]
    - [74, 8444.06]
  - - [256, 3584, 1, 128]
    - [66, 2454.86]
  - - [5888, 704, 1, 256]
    - [74, 8819.47]
  - - [3584, 1024, 1, 128]
    - [69, 4094.86]
  - - [256, 5888, 1, 3328]
    - [83, 8538.23]
  - - [1408, 4288, 1, 3328]
    - [85, 9212.47]
  - - [6784, 4288, 1, 256]
    - [73, 9163.02]
  - - [4288, 256, 1, 128]
    - [66, 3081.34]
  - - [5888, 256, 1, 256]
    - [74, 7680.65]
  - - [6784, 1024, 1, 1280]
    - [85, 9248.53]
  - - [5888, 1024, 1, 128]
    - [69, 4061.84]
  - - [1024, 128, 1, 256]
    - [80, 2317.29]
  - - [128, 64, 1, 3328]
    - [63, 2116.69]
  - - [448, 64, 1, 256]
    - [46, 1079.42]
  - - [2368, 256, 1, 128]
    - [67, 2229.73]
  - - [6784, 3584, 1, 1280]
    - [80, 9096.5]
  - - [1024, 6784, 1, 1280]
    - [78, 9112.8]
  - - [2944, 64, 1, 1280]
    - [36, 4982.9]
  - - [1408, 2944, 1, 1280]
    - [75, 9131.53]
  - - [256, 1856, 1, 256]
    - [83, 4432.76]
  - - [1408, 2368, 1, 3328]
    - [83, 8449.08]
  - - [2944, 4, 1, 3328]
    - [29, 673.84]
  - - [128, 1408, 1, 3328]
    - [48, 6582.37]
  - - [2944, 1856, 1, 128]
    - [66, 4827.44]
  - - [256, 2944, 1, 128]
    - [69, 2416.56]
  - - [256, 6784, 1, 128]
    - [69, 3118.66]
  - - [2368, 4, 1, 128]
    - [87, 22.6197]
  - - [1408, 256, 1, 3328]
    - [74, 3733.72]
  - - [1856, 4, 1, 128]
    - [86, 7.10009]
  - - [1024, 16, 1, 512]
    - [42, 1165.08]
  - - [5056, 6784, 1, 128]
    - [70, 4949.03]
  - - [4288, 5056, 1, 128]
    - [69, 4966.8]
  - - [1856, 5888, 1, 128]
    - [65, 4351.66]
  - - [2944, 5888, 1, 256]
    - [85, 8460.89]
  - - [3584, 1856, 1, 256]
    - [80, 8876.6]
  - - [4288, 3584, 1, 1280]
    - [73, 9603.6]
  - - [2368, 448, 1, 256]
    - [74, 6604.6]
  - - [4288, 256, 1, 3328]
    - [74, 7619.79]
  - - [1856, 704, 1, 128]
    - [66, 3629.51]
  - - [1408, 64, 1, 256]
    - [30, 2168.11]
  - - [64, 1856, 1, 128]
    - [6, 979.662]
  - - [4, 256, 1, 128]
    - [87, 5.13595]
  - - [704, 4288, 1, 3328]
    - [80, 9014.42]
  - - [704, 5888, 1, 128]
    - [67, 4221.67]
  - - [6784, 3584, 1, 128]
    - [65, 5360.63]
  - - [1024, 64, 1, 256]
    - [25, 1588.75]
  - - [64, 2368, 1, 256]
    - [80, 2552.45]
  - - [4288, 5056, 1, 3328]
    - [79, 8193.28]
  - - [4, 1856, 1, 1280]
    - [29, 499.092]
  - - [4288, 128, 1, 128]
    - [66, 2373.47]
  - - [1408, 1408, 1, 128]
    - [69, 3753.78]
  - - [1024, 128, 1, 3328]
    - [51, 5656.22]
  - - [1856, 128, 1, 128]
    - [2, 1617.48]
  - - [5056, 2368, 1, 256]
    - [85, 5553.31]
  - - [4288, 704, 1, 3328]
    - [73, 6961.96]
  - - [448, 3584, 1, 256]
    - [83, 5981.4]
  - - [64, 128, 1, 128]
    - [20, 74.8983]
  - - [2368, 64, 1, 1280]
    - [56, 5041.23]
  - - [2368, 1024, 1, 1280]
    - [81, 7740.87]
  - - [2944, 1408, 1, 3328]
    - [83, 9204.55]
  - - [1408, 448, 1, 256]
    - [80, 5954.3]
  - - [1024, 1408, 1, 3328]
    - [77, 8161.44]
  - - [2560, 7133, 1, 2560]
    - [72, 9636.59]
  - - [1408, 4, 1, 1280]
    - [24, 520.879]
  - - [5888, 3584, 1, 256]
    - [85, 9225.16]
  - - [128, 1024, 1, 1280]
    - [27, 4755.45]
  - - [1408, 1856, 1, 3328]
    - [77, 9130.77]
  - - [4, 4, 1, 3328]
    - [97, 6.93333]
  - - [6784, 1408, 1, 1280]
    - [74, 9346.81]
  - - [4, 1024, 1, 1280]
    - [24, 422.813]
  - - [704, 2944, 1, 256]
    - [80, 8331.96]
  - - [704, 4288, 1, 128]
    - [66, 4371.04]
  - - [2368, 4288, 1, 128]
    - [66, 3988.79]
  - - [64, 4288, 1, 1280]
    - [56, 5407.53]
  - - [6784, 64, 1, 1280]
    - [36, 5708.15]
  - - [3584, 128, 1, 128]
    - [2, 2463.1]
  - - [1024, 6784, 1, 128]
    - [67, 3862.02]
  - - [4, 1856, 1, 128]
    - [87, 30.5362]
  - - [1408, 64, 1, 3328]
    - [56, 6095.38]
  - - [6784, 4, 1, 256]
    - [89, 487.838]
  - - [1408, 1408, 1, 1280]
    - [85, 8640.53]
  - - [256, 2368, 1, 256]
    - [77, 4282.26]
  - - [448, 4288, 1, 3328]
    - [74, 8516.03]
  - - [2368, 1408, 1, 256]
    - [80, 8632.09]
  - - [5888, 5056, 1, 128]
    - [66, 5091.01]
  - - [704, 2368, 1, 256]
    - [80, 7664.7]
  - - [2944, 448, 1, 1280]
    - [80, 7618.25]
  - - [5888, 2368, 1, 3328]
    - [83, 9343.38]
  - - [64, 2944, 1, 1280]
    - [48, 5162.08]
  - - [448, 1856, 1, 1280]
    - [74, 7027.9]
  - - [4288, 448, 1, 1280]
    - [74, 5855.66]
  - - [5888, 704, 1, 3328]
    - [83, 9190.81]
  - - [5056, 256, 1, 128]
    - [69, 3235.84]
  - - [1856, 256, 1, 128]
    - [67, 1849.68]
  - - [5056, 128, 1, 256]
    - [80, 6108.96]
  - - [704, 4, 1, 256]
    - [40, 125.156]
  - - [1408, 5888, 1, 128]
    - [66, 5055.06]
  - - [4288, 4, 1, 128]
    - [86, 95.6209]
  - - [1408, 1024, 1, 256]
    - [74, 7370.18]
  - - [1024, 1856, 1, 128]
    - [66, 2966.7]
  - - [256, 704, 1, 128]
    - [68, 528.129]
  - - [256, 1024, 1, 128]
    - [66, 1171.59]
  - - [448, 1024, 1, 256]
    - [80, 5624.55]
  - - [128, 4, 1, 3328]
    - [97, 191.885]
  - - [5056, 6784, 1, 1280]
    - [74, 9543.97]
  - - [704, 5056, 1, 3328]
    - [81, 8790.25]
  - - [64, 1408, 1, 1280]
    - [48, 4505.6]
  - - [3584, 5056, 1, 3328]
    - [79, 9073.42]
  - - [1856, 4, 1, 3328]
    - [97, 612.775]
  - - [4, 2944, 1, 128]
    - [86, 71.9145]
  - - [2368, 2944, 1, 3328]
    - [72, 9314.58]
  - - [448, 448, 1, 1280]
    - [56, 5129.81]
  - - [2368, 3584, 1, 256]
    - [74, 8998.7]
  - - [5056, 3584, 1, 1280]
    - [75, 9345.07]
  - - [448, 4, 1, 3328]
    - [97, 487.237]
  - - [1856, 2944, 1, 1280]
    - [85, 8438.69]
  - - [3584, 2368, 1, 1280]
    - [80, 9298.8]
  - - [128, 1024, 1, 256]
    - [32, 2356.35]
  - - [2944, 1408, 1, 256]
    - [72, 5440.72]
  - - [4288, 1408, 1, 3328]
    - [72, 9385.99]
  - - [3584, 64, 1, 3328]
    - [28, 6310.87]
  - - [1408, 128, 1, 256]
    - [74, 2942.43]
  - - [2944, 1024, 1, 128]
    - [69, 3927.89]
  - - [4288, 5056, 1, 1280]
    - [76, 8328.48]
  - - [5888, 6784, 1, 1280]
    - [85, 9757.34]
  - - [6784, 5056, 1, 128]
    - [65, 5101.3]
  - - [256, 1024, 1, 3328]
    - [74, 6475.77]
  - - [3584, 4, 1, 256]
    - [90, 420.873]
  - - [1856, 64, 1, 3328]
    - [56, 6409.1]
  - - [64, 6784, 1, 128]
    - [4, 2387.22]
  - - [5888, 1408, 1, 3328]
    - [79, 9655.79]
  - - [5888, 64, 1, 1280]
    - [74, 5870.76]
  - - [256, 5056, 1, 256]
    - [77, 6108.96]
  - - [128, 3584, 1, 128]
    - [7, 2383.13]
  - - [448, 3584, 1, 3328]
    - [72, 7092.18]
  - - [704, 2368, 1, 128]
    - [66, 3740.98]
  - - [5888, 256, 1, 128]
    - [67, 2977.44]
  - - [4, 5056, 1, 128]
    - [86, 132.62]
  - - [448, 256, 1, 256]
    - [38, 2308.19]
  - - [704, 4, 1, 3328]
    - [43, 552.574]
  - - [1408, 256, 1, 256]
    - [74, 4577.12]
  - - [3584, 1856, 1, 128]
    - [66, 4571.76]
  - - [4288, 4288, 1, 128]
    - [69, 5284.55]
  - - [1856, 1024, 1, 3328]
    - [80, 6362.15]
  - - [128, 5888, 1, 3328]
    - [50, 7040.73]
  - - [1024, 5056, 1, 256]
    - [85, 7855.6]
  - - [2368, 1408, 1, 3328]
    - [80, 9205.56]
  - - [5888, 448, 1, 256]
    - [77, 5538.74]
  - - [5888, 6784, 1, 128]
    - [65, 4500.75]
  - - [2368, 4, 1, 3328]
    - [43, 642.798]
  - - [6784, 5056, 1, 1280]
    - [81, 9249.13]
  - - [5056, 704, 1, 1280]
    - [80, 8883.27]
  - - [1408, 256, 1, 1280]
    - [74, 5632.0]
  - - [4288, 6784, 1, 1280]
    - [80, 8843.21]
  - - [128, 704, 1, 256]
    - [38, 2045.09]
  - - [448, 128, 1, 1280]
    - [48, 3807.07]
  - - [6784, 4, 1, 3328]
    - [91, 684.571]
  - - [4288, 4, 1, 1280]
    - [40, 601.825]
  - - [1024, 64, 1, 3328]
    - [52, 3928.38]
  - - [1856, 4, 1, 256]
    - [90, 293.294]
  - - [64, 3584, 1, 1280]
    - [74, 5265.45]
  - - [6784, 1408, 1, 256]
    - [74, 9059.26]
  - - [3584, 5888, 1, 128]
    - [66, 5084.19]
  - - [5056, 5888, 1, 256]
    - [85, 8589.99]
  - - [2368, 1024, 1, 256]
    - [77, 4493.03]
  - - [2944, 1856, 1, 256]
    - [83, 5202.31]
  - - [1856, 6784, 1, 1280]
    - [81, 9071.38]
  - - [64, 5056, 1, 128]
    - [4, 2038.32]
  - - [5888, 64, 1, 128]
    - [3, 2016.49]
  - - [448, 704, 1, 128]
    - [67, 1173.55]
  - - [4, 1024, 1, 128]
    - [86, 8.79685]
  - - [4288, 3584, 1, 256]
    - [80, 9080.16]
  - - [1408, 704, 1, 128]
    - [66, 3165.61]
  - - [64, 256, 1, 3328]
    - [60, 3126.49]
  - - [5056, 1856, 1, 1280]
    - [77, 8857.45]
  - - [1408, 1024, 1, 3328]
    - [83, 8177.02]
  - - [2368, 256, 1, 3328]
    - [74, 6810.21]
  - - [5888, 3584, 1, 1280]
    - [72, 9535.45]
  - - [1856, 3584, 1, 3328]
    - [74, 9281.81]
  - - [5888, 128, 1, 1280]
    - [80, 8136.72]
  - - [1024, 2944, 1, 256]
    - [72, 7247.86]
  - - [448, 6784, 1, 1280]
    - [80, 7013.94]
  - - [256, 3584, 1, 1280]
    - [74, 7738.54]
  - - [448, 128, 1, 128]
    - [4, 495.948]
  - - [704, 5056, 1, 256]
    - [80, 8609.34]
  - - [3584, 1024, 1, 3328]
    - [73, 7765.63]
  - - [2944, 1856, 1, 1280]
    - [85, 7775.93]
  - - [128, 256, 1, 128]
    - [17, 296.208]
  - - [5056, 256, 1, 256]
    - [74, 7829.63]
  - - [2368, 3584, 1, 3328]
    - [73, 8895.98]
  - - [2944, 704, 1, 1280]
    - [83, 6855.73]
  - - [128, 4, 1, 256]
    - [92, 24.8242]
  - - [2944, 3584, 1, 1280]
    - [85, 9049.12]
  - - [1856, 5888, 1, 1280]
    - [80, 9431.96]
  - - [256, 256, 1, 1280]
    - [45, 3942.02]
  - - [5056, 448, 1, 3328]
    - [85, 4587.73]
  - - [4288, 1408, 1, 256]
    - [85, 5408.73]
  - - [3584, 64, 1, 256]
    - [54, 2496.61]
  - - [64, 1856, 1, 3328]
    - [27, 5896.68]
  - - [256, 1408, 1, 128]
    - [66, 1643.07]
  - - [5888, 1408, 1, 128]
    - [65, 4436.27]
  - - [4288, 2368, 1, 1280]
    - [74, 9432.94]
  - - [4, 4288, 1, 256]
    - [89, 442.632]
  - - [256, 4288, 1, 128]
    - [66, 2814.69]
  - - [256, 128, 1, 3328]
    - [55, 3951.16]
  - - [6784, 2368, 1, 256]
    - [74, 9169.89]
  - - [5888, 128, 1, 128]
    - [3, 3156.71]
  - - [4288, 1856, 1, 256]
    - [80, 5658.13]
  - - [1856, 256, 1, 3328]
    - [74, 7646.27]
  - - [1856, 2944, 1, 256]
    - [81, 6444.88]
  - - [5056, 1024, 1, 128]
    - [65, 4607.2]
  - - [64, 5888, 1, 1280]
    - [80, 5842.36]
  - - [1760, 7133, 1, 1760]
    - [73, 9097.74]
  - - [6784, 256, 1, 128]
    - [66, 3685.31]
  - - [5888, 704, 1, 128]
    - [65, 3656.13]
  - - [6784, 64, 1, 128]
    - [16, 2191.42]
  - - [1024, 4288, 1, 1280]
    - [80, 9199.22]
  - - [2368, 5056, 1, 3328]
    - [76, 9072.78]
  - - [448, 4, 1, 128]
    - [87, 5.32937]
  - - [4, 256, 1, 3328]
    - [97, 310.937]
  - - [4288, 1024, 1, 3328]
    - [78, 8660.23]
  - - [1024, 5056, 1, 3328]
    - [74, 8886.66]
  - - [1024, 1856, 1, 3328]
    - [79, 8426.14]
  - - [704, 704, 1, 1280]
    - [74, 7661.7]
  - - [128, 2368, 1, 1280]
    - [48, 5746.05]
  - - [1408, 128, 1, 3328]
    - [56, 6530.77]
  - - [3584, 256, 1, 1280]
    - [80, 7633.94]
  - - [4, 128, 1, 128]
    - [87, 1.97874]
  - - [704, 6784, 1, 128]
    - [69, 4589.49]
  - - [3584, 128, 1, 1280]
    - [74, 7078.14]
  - - [4, 256, 1, 1280]
    - [43, 178.087]
  - - [128, 704, 1, 3328]
    - [48, 5959.71]
  - - [4288, 6784, 1, 256]
    - [74, 9326.44]
  - - [3584, 2944, 1, 3328]
    - [76, 9114.06]
  - - [128, 1856, 1, 256]
    - [80, 3672.55]
  - - [64, 4288, 1, 256]
    - [74, 3457.41]
  - - [4, 3584, 1, 3328]
    - [23, 694.27]
  - - [64, 4, 1, 3328]
    - [43, 71.4738]
  - - [4, 64, 1, 3328]
    - [43, 91.8069]
  - - [5888, 2944, 1, 256]
    - [73, 7241.45]
  - - [2368, 6784, 1, 128]
    - [69, 5229.53]
  - - [448, 4288, 1, 1280]
    - [74, 8416.3]
  - - [448, 1856, 1, 3328]
    - [74, 7161.46]
  - - [4, 1024, 1, 256]
    - [40, 187.246]
  - - [5056, 4288, 1, 256]
    - [85, 8947.16]
  - - [1024, 448, 1, 256]
    - [80, 5318.86]
  - - [1024, 3584, 1, 256]
    - [75, 6151.94]
  - - [2944, 128, 1, 1280]
    - [56, 6053.53]
  - - [1856, 5056, 1, 128]
    - [66, 5091.32]
  - - [64, 256, 1, 256]
    - [29, 771.012]
  - - [1408, 4, 1, 128]
    - [86, 40.7758]
  - - [128, 2368, 1, 128]
    - [14, 1520.27]
  - - [256, 704, 1, 1280]
    - [74, 4329.71]
  - - [64, 2368, 1, 128]
    - [5, 1212.42]
  - - [6784, 6784, 1, 3328]
    - [85, 8310.57]
  - - [448, 5888, 1, 1280]
    - [80, 8502.23]
  - - [5056, 448, 1, 128]
    - [66, 4160.9]
  - - [3584, 2944, 1, 128]
    - [66, 4363.41]
  - - [6784, 256, 1, 1280]
    - [80, 8629.57]
  - - [256, 2944, 1, 1280]
    - [80, 7277.38]
  - - [64, 4288, 1, 128]
    - [5, 1821.96]
  - - [2368, 5888, 1, 3328]
    - [74, 9017.42]
  - - [4, 64, 1, 256]
    - [40, 16.0627]
  - - [704, 1024, 1, 3328]
    - [80, 8059.45]
  - - [2368, 1856, 1, 1280]
    - [80, 8813.14]
  - - [128, 448, 1, 128]
    - [1, 588.144]
  - - [128, 6784, 1, 256]
    - [80, 6538.18]
  - - [3584, 4288, 1, 128]
    - [66, 5025.36]
  - - [64, 448, 1, 128]
    - [18, 231.693]
  - - [5888, 4288, 1, 3328]
    - [74, 9515.78]
  - - [2368, 704, 1, 256]
    - [80, 7642.74]
  - - [256, 1856, 1, 3328]
    - [80, 6547.07]
  - - [1856, 128, 1, 256]
    - [74, 3782.18]
  - - [6784, 128, 1, 128]
    - [8, 2835.44]
  - - [3584, 1408, 1, 128]
    - [65, 3049.11]
  - - [1856, 5056, 1, 1280]
    - [81, 8863.2]
  - - [2944, 1024, 1, 1280]
    - [85, 8873.15]
  - - [5056, 4, 1, 256]
    - [21, 494.021]
  - - [3584, 5888, 1, 3328]
    - [73, 9585.15]
  - - [2368, 4288, 1, 256]
    - [85, 6418.95]
  - - [1024, 2368, 1, 3328]
    - [80, 8645.26]
  - - [64, 704, 1, 3328]
    - [62, 4399.83]
  - - [704, 1408, 1, 256]
    - [74, 7428.44]
  - - [6784, 1856, 1, 3328]
    - [85, 9163.56]
  - - [1024, 2944, 1, 128]
    - [69, 3551.88]
  - - [1024, 3584, 1, 1280]
    - [83, 9112.37]
  - - [4288, 5888, 1, 3328]
    - [73, 8523.95]
  - - [4288, 4, 1, 3328]
    - [40, 619.916]
  - - [256, 1408, 1, 256]
    - [74, 4505.6]
  - - [448, 2944, 1, 1280]
    - [74, 7612.77]
  - - [4, 5888, 1, 128]
    - [86, 174.464]
  - - [1024, 2944, 1, 3328]
    - [79, 9136.64]
  - - [3584, 6784, 1, 256]
    - [79, 7253.79]
  - - [256, 6784, 1, 1280]
    - [74, 8637.62]
  - - [1856, 3584, 1, 256]
    - [80, 8199.57]
  - - [128, 448, 1, 3328]
    - [61, 4799.82]
  - - [6784, 1856, 1, 128]
    - [66, 5185.52]
  - - [4, 448, 1, 256]
    - [40, 86.8848]
  - - [2944, 704, 1, 128]
    - [69, 3798.54]
  - - [256, 5888, 1, 1280]
    - [74, 8678.37]
  - - [4, 128, 1, 1280]
    - [43, 102.4]
  - - [4288, 6784, 1, 3328]
    - [79, 8209.3]
  - - [6784, 128, 1, 1280]
    - [56, 6562.89]
  - - [64, 1408, 1, 256]
    - [46, 2059.7]
  - - [7680, 5481, 1, 2560]
    - [85, 9426.69]
  - - [2368, 1408, 1, 128]
    - [66, 4532.4]
  - - [1856, 448, 1, 256]
    - [74, 6275.38]
  - - [1408, 1024, 1, 128]
    - [66, 3604.48]
  - - [128, 64, 1, 128]
    - [1, 87.3813]
  - - [6784, 3584, 1, 3328]
    - [81, 8991.82]
  - - [2944, 64, 1, 3328]
    - [50, 6043.26]
  - - [64, 64, 1, 128]
    - [6, 36.209]
  - - [2368, 5056, 1, 1280]
    - [80, 9438.38]
  - - [64, 4, 1, 1280]
    - [43, 40.1569]
  - - [1408, 2368, 1, 1280]
    - [76, 7738.06]
  - - [128, 1408, 1, 1280]
    - [48, 4937.64]
  - - [256, 64, 1, 3328]
    - [58, 2683.36]
  - - [2944, 4288, 1, 128]
    - [66, 5173.71]
  - - [2944, 2944, 1, 256]
    - [74, 8943.82]
  - - [2944, 4, 1, 1280]
    - [23, 617.757]
  - - [5888, 4, 1, 256]
    - [89, 483.118]
  - - [6784, 256, 1, 256]
    - [80, 7916.6]
  - - [256, 5056, 1, 3328]
    - [74, 8953.15]
  - - [128, 4288, 1, 1280]
    - [27, 6014.95]
  - - [5056, 1856, 1, 128]
    - [68, 4221.05]
  - - [5888, 1408, 1, 256]
    - [79, 9144.75]
  - - [128, 128, 1, 256]
    - [29, 759.838]
  - - [5056, 4, 1, 3328]
    - [89, 642.718]
  - - [4288, 3584, 1, 3328]
    - [75, 9299.95]
  - - [448, 704, 1, 3328]
    - [81, 4480.98]
  - - [448, 448, 1, 128]
    - [5, 1360.71]
  - - [1024, 2368, 1, 1280]
    - [74, 8570.19]
  - - [1856, 704, 1, 3328]
    - [74, 8448.16]
  - - [4, 2368, 1, 128]
    - [86, 64.4902]
  - - [5888, 6784, 1, 3328]
    - [81, 9447.02]
  - - [704, 4288, 1, 1280]
    - [83, 7476.77]
  - - [704, 256, 1, 256]
    - [74, 2957.52]
  - - [6784, 448, 1, 3328]
    - [77, 8886.12]
  - - [4288, 1024, 1, 128]
    - [65, 3864.39]
  - - [49, 512, 128, 2048]
    - [106, 7112.68]
  - - [196, 256, 256, 1024]
    - [102, 8302.6]
  - - [784, 512, 256, 128]
    - [100, 9061.26]
  - - [49, 2048, 128, 512]
    - [98, 6963.26]
  - - [784, 128, 128, 512]
    - [105, 8983.53]
  - - [3136, 256, 256, 64]
    - [103, 9051.28]
  - - [3136, 64, 128, 64]
    - [99, 8581.25]
  - - [49, 2048, 256, 512]
    - [98, 7049.54]
  - - [784, 128, 256, 512]
    - [107, 9102.89]
  - - [196, 256, 128, 1024]
    - [101, 8085.79]
  - - [3136, 64, 128, 256]
    - [104, 9381.29]
  - - [3136, 256, 128, 64]
    - [103, 8982.54]
  - - [784, 512, 128, 128]
    - [100, 8965.89]
  - - [3136, 64, 256, 256]
    - [104, 9566.33]
  - - [3136, 64, 256, 64]
    - [99, 8743.7]
  - - [196, 1024, 128, 256]
    - [102, 8119.33]
  - - [49, 512, 256, 2048]
    - [108, 7166.31]
  - - [196, 1024, 256, 256]
    - [102, 8210.56]
  - - [5329, 160, 64, 64]
    - [112, 8156.79]
  - - [1225, 384, 64, 192]
    - [110, 9162.25]
  - - [289, 1024, 64, 256]
    - [110, 8483.73]
  - - [64, 1536, 64, 384]
    - [117, 9323.55]
  - - [1225, 384, 64, 64]
    - [116, 8158.7]
  - - [1225, 384, 64, 96]
    - [110, 8540.6]
  - - [64, 1536, 64, 256]
    - [114, 9142.9]
  - - [289, 1024, 64, 384]
    - [109, 8725.56]
  - - [289, 1024, 64, 192]
    - [110, 8313.06]
  - - [289, 1024, 64, 128]
    - [114, 7989.41]
  - - [4096, 1024, 1, 2984]
    - [152, 9846.29]
  - - [1024, 4096, 1, 3437]
    - [153, 9915.7]
  - - [1024, 4096, 1, 3235]
    - [146, 9913.92]
  - - [4096, 1024, 1, 4032]
    - [152, 9925.96]
  - - [1024, 4096, 1, 3334]
    - [153, 9918.17]
  - - [4096, 1024, 1, 3288]
    - [153, 9854.57]
  - - [1024, 4096, 1, 3515]
    - [153, 9923.93]
  - - [4096, 1024, 1, 3437]
    - [153, 9869.53]
  - - [1024, 4096, 1, 3259]
    - [153, 9907.55]
  - - [1024, 4096, 1, 3384]
    - [145, 9921.11]
  - - [64, 92, 688, 92]
    - [123, 6137.79]
  - - [4096, 1024, 1, 3458]
    - [152, 9887.59]
  - - [1024, 4096, 1, 3412]
    - [152, 9930.46]
  - - [1024, 4096, 1, 3529]
    - [146, 9924.44]
  - - [1024, 4096, 1, 4032]
    - [153, 9963.38]
  - - [4096, 1024, 1, 3999]
    - [153, 9894.9]
  - - [1024, 4096, 1, 3079]
    - [146, 9894.48]
  - - [1024, 4096, 1, 3876]
    - [145, 9949.29]
  - - [1024, 4096, 1, 3450]
    - [153, 9915.55]
  - - [1024, 4096, 1, 3256]
    - [153, 9911.08]
  - - [4096, 1024, 1, 3403]
    - [152, 9858.83]
  - - [1024, 1024, 1, 3975]
    - [143, 8990.71]
  - - [1024, 4096, 1, 3359]
    - [153, 9914.9]
  - - [4096, 1024, 1, 3549]
    - [152, 9870.56]
  - - [4096, 1024, 1, 3176]
    - [153, 9855.82]
  - - [1024, 4096, 1, 3504]
    - [145, 9934.07]
  - - [4096, 1024, 1, 3314]
    - [152, 9873.8]
  - - [4096, 1024, 1, 3183]
    - [152, 9843.74]
  - - [1024, 4096, 1, 3209]
    - [146, 9904.87]
  - - [1024, 4096, 1, 3720]
    - [145, 9934.06]
  - - [1024, 4096, 1, 3859]
    - [145, 9952.43]
  - - [1024, 33708, 1, 4059]
    - [145, 10321.4]
  - - [1024, 4096, 1, 3968]
    - [145, 9955.86]
  - - [64, 123, 528, 123]
    - [118, 6916.11]
  - - [4096, 1024, 1, 3477]
    - [153, 9871.93]
  - - [4096, 1024, 1, 3233]
    - [153, 9862.25]
  - - [4096, 1024, 1, 3409]
    - [153, 9876.76]
  - - [4096, 1024, 1, 3564]
    - [153, 9870.39]
  - - [64, 102, 624, 100]
    - [118, 5773.06]
  - - [4096, 1024, 1, 3190]
    - [152, 9850.87]
  - - [64, 112, 576, 111]
    - [118, 6517.25]
  - - [1024, 4096, 1, 3288]
    - [152, 9911.8]
  - - [4096, 1024, 1, 3451]
    - [152, 9859.51]
  - - [1024, 4096, 1, 3348]
    - [145, 9915.37]
  - - [64, 102, 624, 102]
    - [118, 5783.6]
  - - [1024, 4096, 1, 3465]
    - [146, 9913.02]
  - - [1024, 33708, 1, 4032]
    - [145, 10340.3]
  - - [1024, 33708, 1, 3840]
    - [145, 10341.7]
  - - [4096, 1024, 1, 3391]
    - [153, 9861.67]
  - - [1024, 4096, 1, 3530]
    - [145, 9920.34]
  - - [4096, 1024, 1, 3209]
    - [152, 9846.9]
  - - [1024, 4096, 1, 3457]
    - [146, 9917.19]
  - - [1024, 4096, 1, 3386]
    - [145, 9917.55]
  - - [4096, 1024, 1, 3350]
    - [152, 9884.44]
  - - [1024, 4096, 1, 3184]
    - [153, 9925.88]
  - - [1024, 4096, 1, 3093]
    - [152, 9902.45]
  - - [64, 133, 480, 135]
    - [135, 6205.87]
  - - [1024, 4096, 1, 3400]
    - [145, 9917.0]
  - - [1024, 1024, 1, 4026]
    - [151, 9014.29]
  - - [1024, 4096, 1, 3214]
    - [145, 9895.84]
  - - [4096, 1024, 1, 3406]
    - [153, 9857.72]
  - - [1024, 4096, 1, 3565]
    - [152, 9919.27]
  - - [4096, 1024, 1, 3536]
    - [153, 9888.96]
  - - [1024, 4096, 1, 3183]
    - [152, 9907.45]
  - - [1024, 4096, 1, 3462]
    - [153, 9922.3]
  - - [4096, 1024, 1, 3130]
    - [146, 9845.94]
  - - [4096, 1024, 1, 3381]
    - [153, 9868.17]
  - - [4096, 1024, 1, 3298]
    - [152, 9870.44]
  - - [1024, 4096, 1, 3292]
    - [145, 9906.2]
  - - [4096, 1024, 1, 3289]
    - [152, 9856.45]
  - - [64, 160, 400, 159]
    - [138, 7427.74]
  - - [1024, 4096, 1, 3379]
    - [145, 9916.99]
  - - [1024, 4096, 1, 3990]
    - [146, 9947.27]
  - - [1024, 4096, 1, 3540]
    - [153, 9935.66]
  - - [4096, 1024, 1, 3412]
    - [153, 9867.46]
  - - [1024, 1024, 1, 3780]
    - [148, 9036.16]
  - - [1024, 4096, 1, 3555]
    - [152, 9927.27]
  - - [1024, 4096, 1, 3518]
    - [146, 9925.45]
  - - [4096, 1024, 1, 3189]
    - [152, 9861.14]
  - - [1024, 4096, 1, 3298]
    - [146, 9923.12]
  - - [1024, 4096, 1, 3393]
    - [153, 9929.18]
  - - [1024, 4096, 1, 3207]
    - [145, 9912.71]
  - - [64, 228, 272, 232]
    - [141, 7350.04]
  - - [64, 23, 2720, 23]
    - [122, 2640.15]
  - - [4096, 1024, 1, 3487]
    - [153, 9860.81]
  - - [1024, 1024, 1, 3822]
    - [151, 8993.86]
  - - [64, 77, 816, 77]
    - [123, 5273.09]
  - - [4096, 1024, 1, 3431]
    - [153, 9867.43]
  - - [4096, 1024, 1, 3378]
    - [152, 9888.04]
  - - [4096, 1024, 1, 3529]
    - [146, 9879.4]
  - - [4096, 1024, 1, 3460]
    - [153, 9877.15]
  - - [1024, 4096, 1, 3336]
    - [145, 9912.31]
  - - [1024, 4096, 1, 3501]
    - [146, 9914.3]
  - - [64, 159, 400, 159]
    - [136, 7016.41]
  - - [1024, 4096, 1, 3584]
    - [153, 9940.49]
  - - [64, 135, 480, 134]
    - [136, 6241.29]
  - - [64, 99, 624, 99]
    - [127, 5617.29]
  - - [4096, 1024, 1, 2499]
    - [152, 9813.47]
  - - [1024, 1024, 1, 3942]
    - [148, 9059.91]
  - - [4096, 1024, 1, 3352]
    - [152, 9867.02]
  - - [1024, 4096, 1, 3543]
    - [153, 9928.67]
  - - [1024, 4096, 1, 3476]
    - [152, 9931.48]
  - - [1024, 33708, 1, 3822]
    - [145, 10324.6]
  - - [1024, 4096, 1, 3436]
    - [145, 9917.18]
  - - [1024, 1024, 1, 3861]
    - [144, 8998.39]
  - - [1024, 1024, 1, 4000]
    - [149, 9058.2]
  - - [1024, 4096, 1, 3594]
    - [145, 9927.78]
  - - [4096, 1024, 1, 3514]
    - [153, 9872.2]
  - - [1024, 4096, 1, 3064]
    - [152, 9907.0]
  - - [4096, 1024, 1, 3371]
    - [145, 9857.64]
  - - [4096, 1024, 1, 3558]
    - [153, 9876.21]
  - - [4096, 1024, 1, 3517]
    - [152, 9866.35]
  - - [4096, 1024, 1, 3144]
    - [152, 9846.26]
  - - [1024, 4096, 1, 3312]
    - [145, 9932.75]
  - - [4096, 1024, 1, 3079]
    - [152, 9851.0]
  - - [1024, 4096, 1, 3415]
    - [145, 9919.37]
  - - [1024, 4096, 1, 3221]
    - [152, 9908.08]
  - - [1024, 4096, 1, 3978]
    - [146, 9944.31]
  - - [4096, 1024, 1, 3876]
    - [152, 9898.89]
  - - [1024, 4096, 1, 3528]
    - [145, 9919.5]
  - - [1024, 4096, 1, 3181]
    - [153, 9894.76]
  - - [4096, 1024, 1, 3445]
    - [152, 9878.44]
  - - [4096, 1024, 1, 3450]
    - [145, 9864.72]
  - - [4096, 1024, 1, 3377]
    - [152, 9879.59]
  - - [1024, 4096, 1, 3532]
    - [146, 9928.09]
  - - [1024, 33708, 1, 3944]
    - [145, 10329.6]
  - - [4096, 1024, 1, 3483]
    - [152, 9861.73]
  - - [1024, 4096, 1, 3358]
    - [145, 9903.59]
  - - [4096, 1024, 1, 3464]
    - [152, 9876.74]
  - - [4096, 1024, 1, 3282]
    - [145, 9859.13]
  - - [4096, 1024, 1, 3256]
    - [153, 9855.0]
  - - [1024, 4096, 1, 3057]
    - [152, 9910.65]
  - - [4096, 1024, 1, 3481]
    - [152, 9866.19]
  - - [4096, 1024, 1, 3340]
    - [152, 9862.15]
  - - [1024, 1024, 1, 3870]
    - [151, 9082.35]
  - - [1024, 4096, 1, 3273]
    - [145, 9916.19]
  - - [64, 65, 992, 65]
    - [136, 4682.91]
  - - [4096, 1024, 1, 3392]
    - [146, 9881.02]
  - - [4096, 1024, 1, 3337]
    - [152, 9864.4]
  - - [4096, 1024, 1, 3359]
    - [152, 9874.32]
  - - [4096, 1024, 1, 3498]
    - [153, 9864.25]
  - - [4096, 1024, 1, 3169]
    - [152, 9851.0]
  - - [1024, 33708, 1, 3859]
    - [146, 10332.5]
  - - [64, 19, 3264, 19]
    - [122, 2182.04]
  - - [1024, 4096, 1, 3103]
    - [145, 9898.8]
  - - [4096, 1024, 1, 3900]
    - [152, 9897.02]
  - - [1024, 4096, 1, 3442]
    - [152, 9938.87]
  - - [1024, 4096, 1, 3248]
    - [152, 9939.82]
  - - [1024, 4096, 1, 3351]
    - [153, 9923.13]
  - - [4096, 1024, 1, 3593]
    - [152, 9894.26]
  - - [1024, 4096, 1, 3780]
    - [152, 9941.86]
  - - [64, 133, 480, 133]
    - [136, 6180.69]
  - - [1024, 33708, 1, 3681]
    - [145, 10332.2]
  - - [4096, 1024, 1, 3374]
    - [146, 9859.26]
  - - [1024, 4096, 1, 3557]
    - [145, 9928.1]
  - - [4096, 1024, 1, 3906]
    - [152, 9906.97]
  - - [4096, 1024, 1, 3504]
    - [152, 9885.95]
  - - [1024, 4096, 1, 3270]
    - [152, 9916.27]
  - - [4096, 1024, 1, 3098]
    - [145, 9854.66]
  - - [64, 232, 272, 232]
    - [141, 7394.0]
  - - [4096, 1024, 1, 3216]
    - [153, 9876.47]
  - - [64, 148, 432, 148]
    - [138, 6663.75]
  - - [1024, 4096, 1, 3550]
    - [152, 9920.18]
  - - [4096, 1024, 1, 3449]
    - [146, 9870.47]
  - - [1024, 4096, 1, 3403]
    - [153, 9908.11]
  - - [1024, 4096, 1, 3523]
    - [152, 9932.61]
  - - [1024, 4096, 1, 3486]
    - [152, 9917.36]
  - - [1024, 4096, 1, 3564]
    - [152, 9923.34]
  - - [1024, 33708, 1, 4005]
    - [145, 10339.4]
  - - [4096, 1024, 1, 3296]
    - [152, 9879.68]
  - - [1024, 4096, 1, 3263]
    - [145, 9907.07]
  - - [64, 25, 2512, 25]
    - [122, 2848.07]
  - - [1024, 4096, 1, 3130]
    - [153, 9900.0]
  - - [1024, 4096, 1, 3295]
    - [153, 9895.35]
  - - [1024, 33708, 1, 3925]
    - [146, 10342.2]
  - - [1024, 4096, 1, 3378]
    - [145, 9921.27]
  - - [4096, 1024, 1, 3720]
    - [153, 9885.72]
  - - [4096, 1024, 1, 3399]
    - [152, 9880.55]
  - - [4096, 1024, 1, 3543]
    - [153, 9870.63]
  - - [64, 9, 6544, 9]
    - [125, 955.07]
  - - [4096, 1024, 1, 3497]
    - [152, 9868.33]
  - - [4096, 1024, 1, 3594]
    - [153, 9876.78]
  - - [1024, 4096, 1, 3144]
    - [153, 9901.86]
  - - [1024, 4096, 1, 3975]
    - [146, 9950.09]
  - - [4096, 1024, 1, 3205]
    - [153, 9855.97]
  - - [1024, 33708, 1, 3995]
    - [145, 10331.0]
  - - [1024, 4096, 1, 3392]
    - [145, 9935.68]
  - - [1024, 4096, 1, 3055]
    - [153, 9893.15]
  - - [1024, 4096, 1, 4026]
    - [153, 9940.12]
  - - [4096, 1024, 1, 3557]
    - [152, 9883.9]
  - - [4096, 1024, 1, 3515]
    - [152, 9871.84]
  - - [4096, 1024, 1, 3486]
    - [153, 9860.64]
  - - [4096, 1024, 1, 3457]
    - [153, 9885.27]
  - - [1024, 4096, 1, 3511]
    - [145, 9928.14]
  - - [4096, 1024, 1, 3138]
    - [152, 9853.96]
  - - [1024, 4096, 1, 3339]
    - [146, 9912.79]
  - - [1024, 4096, 1, 3939]
    - [146, 9952.16]
  - - [4096, 1024, 1, 3500]
    - [146, 9863.52]
  - - [4096, 1024, 1, 3395]
    - [153, 9883.72]
  - - [4096, 1024, 1, 3968]
    - [153, 9920.26]
  - - [4096, 1024, 1, 4020]
    - [153, 9912.71]
  - - [4096, 1024, 1, 3942]
    - [152, 9910.07]
  - - [1024, 1024, 1, 4032]
    - [142, 9024.64]
  - - [4096, 1024, 1, 3349]
    - [153, 9865.94]
  - - [1024, 4096, 1, 3322]
    - [146, 9908.33]
  - - [4096, 1024, 1, 3452]
    - [152, 9872.59]
  - - [1024, 4096, 1, 3417]
    - [152, 9912.54]
  - - [1024, 1024, 1, 4012]
    - [150, 9085.37]
  - - [1024, 4096, 1, 3526]
    - [146, 9920.26]
  - - [4096, 1024, 1, 3485]
    - [146, 9861.54]
  - - [1024, 1024, 1, 3681]
    - [150, 8991.36]
  - - [4096, 1024, 1, 3303]
    - [153, 9861.2]
  - - [4096, 1024, 1, 3344]
    - [153, 9892.34]
  - - [1024, 4096, 1, 3479]
    - [153, 9921.67]
  - - [4096, 1024, 1, 3300]
    - [152, 9868.54]
  - - [1024, 4096, 1, 3439]
    - [146, 9918.19]
  - - [4096, 1024, 1, 3280]
    - [153, 9875.19]
  - - [1024, 4096, 1, 3245]
    - [145, 9910.39]
  - - [1024, 4096, 1, 3328]
    - [145, 9941.5]
  - - [4096, 1024, 1, 3418]
    - [145, 9870.66]
  - - [1024, 4096, 1, 3493]
    - [153, 9938.35]
  - - [1024, 4096, 1, 3500]
    - [145, 9916.83]
  - - [1024, 4096, 1, 3166]
    - [145, 9898.02]
  - - [4096, 1024, 1, 3126]
    - [146, 9846.94]
  - - [1024, 4096, 1, 3277]
    - [153, 9898.56]
  - - [1024, 4096, 1, 3315]
    - [152, 9923.01]
  - - [1024, 1024, 1, 3927]
    - [143, 8987.61]
  - - [1024, 4096, 1, 3414]
    - [145, 9915.91]
  - - [4096, 1024, 1, 3531]
    - [152, 9871.82]
  - - [4096, 1024, 1, 3484]
    - [145, 9867.76]
  - - [1024, 4096, 1, 3180]
    - [152, 9903.99]
  - - [4096, 1024, 1, 3360]
    - [152, 9879.47]
  - - [1024, 33708, 1, 3990]
    - [145, 10334.9]
  - - [4096, 1024, 1, 3466]
    - [152, 9874.92]
  - - [1024, 4096, 1, 3428]
    - [145, 9915.92]
  - - [1024, 4096, 1, 3137]
    - [152, 9913.17]
  - - [4096, 1024, 1, 4059]
    - [152, 9901.76]
  - - [1024, 4096, 1, 3353]
    - [152, 9914.5]
  - - [1024, 4096, 1, 3942]
    - [152, 9944.4]
  - - [4096, 1024, 1, 3506]
    - [145, 9875.65]
  - - [1024, 1024, 1, 3894]
    - [143, 8946.45]
  - - [4096, 1024, 1, 3508]
    - [153, 9877.57]
  - - [64, 132, 480, 135]
    - [136, 6164.76]
  - - [4096, 1024, 1, 3956]
    - [145, 9907.73]
  - - [64, 7, 8192, 7]
    - [124, 812.978]
  - - [1024, 4096, 1, 3272]
    - [146, 9909.72]
  - - [1024, 4096, 1, 3443]
    - [153, 9929.73]
  - - [1024, 4096, 1, 3375]
    - [153, 9909.13]
  - - [1024, 4096, 1, 3525]
    - [153, 9929.17]
  - - [4096, 1024, 1, 3472]
    - [152, 9889.87]
  - - [1024, 4096, 1, 3520]
    - [145, 9947.69]
  - - [4096, 1024, 1, 3322]
    - [152, 9862.88]
  - - [4096, 1024, 1, 3387]
    - [152, 9861.52]
  - - [64, 8, 7280, 8]
    - [130, 1024.0]
  - - [1024, 33708, 1, 3939]
    - [145, 10339.8]
  - - [4096, 1024, 1, 3345]
    - [153, 9873.58]
  - - [4096, 1024, 1, 2967]
    - [152, 9839.11]
  - - [1024, 4096, 1, 3453]
    - [145, 9905.71]
  - - [1024, 4096, 1, 3640]
    - [152, 9933.95]
  - - [4096, 1024, 1, 3291]
    - [146, 9860.74]
  - - [1024, 4096, 1, 3350]
    - [153, 9917.93]
  - - [4096, 1024, 1, 3417]
    - [152, 9864.51]
  - - [64, 135, 480, 135]
    - [136, 6265.35]
  - - [1024, 4096, 1, 3467]
    - [146, 9906.85]
  - - [1024, 4096, 1, 3491]
    - [152, 9933.2]
  - - [1024, 4096, 1, 3822]
    - [152, 9938.65]
  - - [4096, 1024, 1, 3292]
    - [152, 9849.11]
  - - [1024, 4096, 1, 3231]
    - [145, 9905.72]
  - - [1024, 4096, 1, 3364]
    - [146, 9930.22]
  - - [1024, 4096, 1, 3995]
    - [146, 9943.66]
  - - [1024, 4096, 1, 3545]
    - [145, 9928.43]
  - - [1024, 1024, 1, 3876]
    - [143, 9002.94]
  - - [1024, 4096, 1, 3186]
    - [145, 9920.91]
  - - [4096, 1024, 1, 3432]
    - [152, 9875.19]
  - - [64, 84, 752, 85]
    - [123, 5704.41]
  - - [4096, 1024, 1, 3367]
    - [146, 9867.96]
  - - [4096, 1024, 1, 3503]
    - [153, 9870.91]
  - - [1024, 4096, 1, 3095]
    - [146, 9902.8]
  - - [4096, 1024, 1, 3465]
    - [153, 9872.07]
  - - [1024, 4096, 1, 3402]
    - [152, 9914.56]
  - - [4096, 1024, 1, 3140]
    - [152, 9847.85]
  - - [1024, 1024, 1, 4050]
    - [149, 9055.65]
  - - [4096, 1024, 1, 3424]
    - [146, 9894.52]
  - - [4096, 1024, 1, 3257]
    - [145, 9860.87]
  - - [4096, 1024, 1, 2917]
    - [152, 9845.81]
  - - [1024, 33708, 1, 3640]
    - [145, 10321.6]
  - - [1024, 4096, 1, 3456]
    - [145, 9950.25]
  - - [1024, 4096, 1, 3014]
    - [145, 9907.87]
  - - [4096, 1024, 1, 3372]
    - [153, 9868.27]
  - - [64, 132, 480, 132]
    - [136, 6121.52]
  - - [1024, 4096, 1, 3294]
    - [153, 9903.13]
  - - [4096, 1024, 1, 3446]
    - [153, 9871.59]
  - - [1024, 4096, 1, 3389]
    - [146, 9909.17]
  - - [4096, 1024, 1, 3259]
    - [152, 9860.66]
  - - [4096, 1024, 1, 3544]
    - [152, 9878.66]
  - - [4096, 1024, 1, 3479]
    - [153, 9873.87]
  - - [4096, 1024, 1, 3542]
    - [152, 9878.87]
  - - [4096, 1024, 1, 3321]
    - [145, 9861.03]
  - - [1024, 4096, 1, 3147]
    - [145, 9894.67]
  - - [1024, 4096, 1, 3944]
    - [145, 9950.41]
  - - [4096, 1024, 1, 3870]
    - [153, 9881.64]
  - - [1024, 4096, 1, 3308]
    - [145, 9907.16]
  - - [4096, 1024, 1, 3401]
    - [152, 9864.49]
  - - [1024, 4096, 1, 3395]
    - [145, 9928.93]
  - - [64, 99, 624, 102]
    - [121, 5651.26]
  - - [1024, 4096, 1, 3563]
    - [152, 9922.66]
  - - [1024, 33708, 1, 3870]
    - [145, 10325.3]
  - - [4096, 1024, 1, 3494]
    - [152, 9875.27]
  - - [1024, 4096, 1, 3271]
    - [145, 9912.99]
  - - [1024, 33708, 1, 3910]
    - [145, 10341.4]
  - - [1024, 4096, 1, 3287]
    - [153, 9924.77]
  - - [1024, 33708, 1, 3860]
    - [145, 10330.6]
  - - [64, 143, 432, 148]
    - [138, 6571.68]
  - - [1024, 1024, 1, 3584]
    - [150, 8975.21]
  - - [64, 162, 400, 162]
    - [140, 6822.16]
  - - [4096, 1024, 1, 3341]
    - [152, 9854.56]
  - - [1024, 4096, 1, 3136]
    - [145, 9926.76]
  - - [4096, 1024, 1, 3439]
    - [152, 9854.23]
  - - [64, 148, 432, 147]
    - [136, 6677.51]
  - - [1024, 4096, 1, 3751]
    - [152, 9938.38]
  - - [1024, 4096, 1, 3301]
    - [152, 9919.05]
  - - [4096, 1024, 1, 3468]
    - [153, 9859.73]
  - - [1024, 4096, 1, 3416]
    - [153, 9918.42]
  - - [4096, 1024, 1, 3163]
    - [152, 9854.55]
  - - [1024, 4096, 1, 3230]
    - [146, 9897.44]
  - - [1024, 4096, 1, 3581]
    - [146, 9915.38]
  - - [1024, 1024, 1, 3960]
    - [148, 9045.76]
  - - [4096, 1024, 1, 3463]
    - [153, 9884.64]
  - - [1024, 4096, 1, 3478]
    - [146, 9926.92]
  - - [4096, 1024, 1, 3262]
    - [152, 9852.12]
  - - [1024, 4096, 1, 3438]
    - [152, 9912.58]
  - - [1024, 4096, 1, 3244]
    - [145, 9900.41]
  - - [1024, 4096, 1, 3445]
    - [145, 9920.22]
  - - [4096, 1024, 1, 3328]
    - [152, 9887.97]
  - - [1024, 4096, 1, 3492]
    - [146, 9937.12]
  - - [4096, 1024, 1, 3211]
    - [146, 9847.85]
  - - [1024, 4096, 1, 3910]
    - [153, 9946.47]
  - - [1024, 4096, 1, 3314]
    - [145, 9932.5]
  - - [4096, 1024, 1, 3859]
    - [152, 9902.74]
  - - [4096, 1024, 1, 3383]
    - [152, 9875.1]
  - - [1024, 4096, 1, 3409]
    - [153, 9926.69]
  - - [1024, 4096, 1, 4020]
    - [145, 9941.7]
  - - [4096, 1024, 1, 3530]
    - [152, 9872.71]
  - - [4096, 1024, 1, 3411]
    - [153, 9874.92]
  - - [1024, 4096, 1, 3566]
    - [153, 9921.0]
  - - [4096, 1024, 1, 3493]
    - [145, 9875.64]
  - - [4096, 1024, 1, 3184]
    - [152, 9873.04]
  - - [1024, 4096, 1, 3431]
    - [146, 9910.93]
  - - [4096, 1024, 1, 3306]
    - [153, 9853.32]
  - - [1024, 4096, 1, 3352]
    - [153, 9913.22]
  - - [4096, 1024, 1, 3295]
    - [152, 9862.58]
  - - [64, 123, 528, 122]
    - [118, 6950.15]
  - - [1024, 4096, 1, 3517]
    - [146, 9919.96]
  - - [64, 102, 624, 101]
    - [126, 5791.39]
  - - [4096, 1024, 1, 3426]
    - [152, 9891.04]
  - - [4096, 1024, 1, 3385]
    - [152, 9868.31]
  - - [1024, 1024, 1, 3978]
    - [143, 9008.38]
  - - [4096, 1024, 1, 3572]
    - [145, 9884.71]
  - - [4096, 1024, 1, 3459]
    - [152, 9892.07]
  - - [1024, 4096, 1, 3374]
    - [153, 9908.42]
  - - [4096, 1024, 1, 3166]
    - [152, 9832.35]
  - - [4096, 1024, 1, 3093]
    - [153, 9841.15]
  - - [4096, 1024, 1, 3523]
    - [146, 9878.95]
  - - [4096, 1024, 1, 3413]
    - [146, 9880.71]
  - - [1024, 4096, 1, 3996]
    - [145, 9948.04]
  - - [1024, 4096, 1, 3452]
    - [153, 9915.87]
  - - [4096, 1024, 1, 3232]
    - [153, 9876.44]
  - - [4096, 1024, 1, 3400]
    - [145, 9867.05]
  - - [4096, 1024, 1, 3334]
    - [152, 9868.89]
  - - [1024, 4096, 1, 3345]
    - [145, 9920.5]
  - - [1024, 4096, 1, 3538]
    - [152, 9933.24]
  - - [1024, 4096, 1, 3466]
    - [152, 9920.75]
  - - [4096, 1024, 1, 3315]
    - [152, 9876.77]
  - - [4096, 1024, 1, 3214]
    - [153, 9847.83]
  - - [1024, 33708, 1, 3900]
    - [145, 10331.6]
  - - [64, 160, 400, 160]
    - [138, 7440.51]
  - - [1024, 4096, 1, 3367]
    - [152, 9926.22]
  - - [1024, 4096, 1, 2917]
    - [153, 9904.47]
  - - [1024, 1024, 1, 3995]
    - [144, 9000.23]
  - - [64, 132, 480, 134]
    - [136, 6146.78]
  - - [1024, 4096, 1, 3544]
    - [153, 9924.04]
  - - [4096, 1024, 1, 3414]
    - [153, 9867.8]
  - - [4096, 1024, 1, 3565]
    - [146, 9870.03]
  - - [1024, 4096, 1, 3512]
    - [152, 9919.74]
  - - [1024, 4096, 1, 3191]
    - [153, 9914.69]
  - - [64, 27, 2336, 27]
    - [120, 3054.61]
  - - [1024, 4096, 1, 3289]
    - [153, 9917.1]
  - - [4096, 1024, 1, 3290]
    - [152, 9858.31]
  - - [1024, 4096, 1, 3211]
    - [153, 9897.06]
  - - [1024, 33708, 1, 3969]
    - [146, 10336.0]
  - - [4096, 1024, 1, 3566]
    - [152, 9862.9]
  - - [64, 111, 576, 111]
    - [126, 6400.81]
  - - [1024, 4096, 1, 3459]
    - [152, 9922.93]
  - - [1024, 4096, 1, 3372]
    - [145, 9909.76]
  - - [4096, 1024, 1, 3339]
    - [152, 9859.2]
  - - [4096, 1024, 1, 3425]
    - [152, 9889.24]
  - - [4096, 1024, 1, 3388]
    - [152, 9871.57]
  - - [1024, 4096, 1, 3531]
    - [145, 9918.9]
  - - [4096, 1024, 1, 3286]
    - [153, 9868.32]
  - - [4096, 1024, 1, 3462]
    - [152, 9881.78]
  - - [1024, 4096, 1, 3388]
    - [145, 9904.59]
  - - [4096, 1024, 1, 3165]
    - [145, 9836.23]
  - - [4096, 1024, 1, 3304]
    - [152, 9857.45]
  - - [1024, 4096, 1, 2736]
    - [152, 9900.97]
  - - [4096, 1024, 1, 3397]
    - [152, 9872.0]
  - - [64, 38, 1680, 38]
    - [119, 3459.42]
  - - [1024, 4096, 1, 3311]
    - [153, 9908.22]
  - - [1024, 4096, 1, 3394]
    - [153, 9929.33]
  - - [4096, 1024, 1, 2736]
    - [152, 9833.78]
  - - [1024, 4096, 1, 3559]
    - [146, 9925.23]
  - - [4096, 1024, 1, 3180]
    - [152, 9837.95]
  - - [1024, 4096, 1, 3480]
    - [145, 9922.36]
  - - [4096, 1024, 1, 3318]
    - [152, 9867.77]
  - - [4096, 1024, 1, 3213]
    - [152, 9845.92]
  - - [1024, 4096, 1, 3286]
    - [152, 9912.04]
  - - [4096, 1024, 1, 3471]
    - [152, 9874.14]
  - - [1024, 4096, 1, 3381]
    - [153, 9922.86]
  - - [64, 100, 624, 100]
    - [127, 5705.14]
  - - [4096, 1024, 1, 3502]
    - [152, 9872.34]
  - - [64, 16, 3840, 16]
    - [133, 2091.57]
  - - [1024, 4096, 1, 3552]
    - [145, 9943.79]
  - - [4096, 1024, 1, 3519]
    - [153, 9869.85]
  - - [1024, 4096, 1, 3300]
    - [146, 9916.05]
  - - [1024, 4096, 1, 3419]
    - [145, 9913.96]
  - - [4096, 1024, 1, 4030]
    - [146, 9893.63]
  - - [4096, 1024, 1, 3976]
    - [153, 9898.25]
  - - [1024, 4096, 1, 3473]
    - [153, 9928.32]
  - - [1024, 1024, 1, 3977]
    - [150, 9009.23]
  - - [4096, 1024, 1, 3428]
    - [152, 9876.69]
  - - [1024, 4096, 1, 3433]
    - [146, 9923.82]
  - - [4096, 1024, 1, 3534]
    - [146, 9863.9]
  - - [4096, 1024, 1, 3461]
    - [152, 9873.02]
  - - [4096, 1024, 1, 3681]
    - [152, 9898.47]
  - - [4096, 1024, 1, 3495]
    - [153, 9875.98]
  - - [4096, 1024, 1, 3351]
    - [152, 9879.61]
  - - [1024, 4096, 1, 4059]
    - [145, 9948.51]
  - - [4096, 1024, 1, 3990]
    - [152, 9900.66]
  - - [1024, 4096, 1, 3325]
    - [146, 9903.2]
  - - [1024, 4096, 1, 3408]
    - [152, 9932.05]
  - - [64, 59, 1088, 59]
    - [126, 5343.67]
  - - [4096, 1024, 1, 3394]
    - [153, 9878.07]
  - - [1024, 4096, 1, 3573]
    - [153, 9935.2]
  - - [4096, 1024, 1, 3386]
    - [152, 9866.28]
  - - [4096, 1024, 1, 3540]
    - [152, 9882.23]
  - - [1024, 4096, 1, 3182]
    - [146, 9894.35]
  - - [1024, 4096, 1, 3430]
    - [145, 9915.14]
  - - [1024, 4096, 1, 3236]
    - [153, 9920.46]
  - - [4096, 1024, 1, 2977]
    - [152, 9847.98]
  - - [1024, 4096, 1, 3355]
    - [152, 9908.68]
  - - [4096, 1024, 1, 3139]
    - [152, 9850.61]
  - - [4096, 1024, 1, 3516]
    - [146, 9874.11]
  - - [4096, 1024, 1, 3368]
    - [146, 9872.54]
  - - [4096, 1024, 1, 3559]
    - [145, 9884.22]
  - - [64, 11, 5456, 11]
    - [133, 1382.57]
  - - [1024, 4096, 1, 3506]
    - [152, 9937.59]
  - - [1024, 4096, 1, 3145]
    - [145, 9905.01]
  - - [1024, 4096, 1, 3369]
    - [152, 9912.61]
  - - [64, 112, 576, 112]
    - [118, 6583.46]
  - - [4096, 1024, 1, 3522]
    - [152, 9889.37]
  - - [1024, 33708, 1, 3894]
    - [145, 10337.4]
  - - [64, 159, 400, 162]
    - [136, 7056.99]
  - - [4096, 1024, 1, 3336]
    - [152, 9867.57]
  - - [1024, 4096, 1, 3382]
    - [146, 9915.8]
  - - [4096, 1024, 1, 3533]
    - [152, 9878.46]
  - - [4096, 1024, 1, 4050]
    - [153, 9916.72]
  - - [4096, 1024, 1, 3480]
    - [146, 9869.22]
  - - [1024, 4096, 1, 3344]
    - [145, 9935.51]
  - - [64, 122, 528, 122]
    - [118, 6871.04]
  - - [1024, 4096, 1, 3509]
    - [146, 9925.7]
  - - [1024, 4096, 1, 3956]
    - [145, 9958.16]
  - - [4096, 1024, 1, 3616]
    - [152, 9904.53]
  - - [1024, 4096, 1, 3366]
    - [145, 9919.37]
  - - [4096, 1024, 1, 2935]
    - [145, 9833.13]
  - - [4096, 1024, 1, 3393]
    - [152, 9877.35]
  - - [4096, 1024, 1, 3547]
    - [146, 9865.0]
  - - [1024, 4096, 1, 3499]
    - [153, 9912.39]
  - - [4096, 1024, 1, 3357]
    - [152, 9855.18]
  - - [4096, 1024, 1, 3272]
    - [152, 9861.87]
  - - [4096, 1024, 1, 3207]
    - [152, 9847.68]
  - - [4096, 1024, 1, 3894]
    - [152, 9918.76]
  - - [1024, 4096, 1, 3444]
    - [152, 9932.61]
  - - [4096, 1024, 1, 3561]
    - [152, 9872.51]
  - - [4096, 1024, 1, 3376]
    - [152, 9885.49]
  - - [1024, 4096, 1, 3458]
    - [152, 9929.29]
  - - [4096, 1024, 1, 3231]
    - [146, 9846.98]
  - - [64, 228, 272, 228]
    - [147, 7302.59]
  - - [1024, 4096, 1, 3505]
    - [153, 9931.53]
  - - [4096, 1024, 1, 3277]
    - [152, 9857.1]
  - - [64, 21, 2976, 21]
    - [122, 2436.04]
  - - [1024, 4096, 1, 3391]
    - [152, 9911.15]
  - - [64, 32, 1984, 32]
    - [134, 3572.07]
  - - [1024, 4096, 1, 3536]
    - [153, 9946.8]
  - - [1024, 4096, 1, 3063]
    - [152, 9906.82]
  - - [1024, 1024, 1, 3925]
    - [144, 9011.35]
  - - [1024, 4096, 1, 3189]
    - [146, 9900.85]
  - - [1024, 4096, 1, 2505]
    - [152, 9854.75]
  - - [4096, 1024, 1, 3454]
    - [145, 9864.86]
  - - [1024, 4096, 1, 3405]
    - [153, 9906.23]
  - - [1024, 33708, 1, 4050]
    - [146, 10343.6]
  - - [4096, 1024, 1, 3520]
    - [152, 9886.93]
  - - [64, 93, 688, 93]
    - [129, 6222.76]
  - - [1024, 4096, 1, 3487]
    - [153, 9918.59]
  - - [1024, 4096, 1, 3558]
    - [153, 9930.89]
  - - [4096, 1024, 1, 3297]
    - [152, 9874.21]
  - - [1024, 1024, 1, 3840]
    - [148, 9075.32]
  - - [1024, 4096, 1, 3483]
    - [152, 9915.28]
  - - [1024, 1024, 1, 3956]
    - [151, 9009.93]
  - - [1024, 33708, 1, 3751]
    - [146, 10325.8]
  - - [4096, 1024, 1, 3380]
    - [152, 9888.37]
  - - [1024, 4096, 1, 3380]
    - [145, 9927.15]
  - - [1024, 4096, 1, 3396]
    - [153, 9931.86]
  - - [1024, 4096, 1, 3497]
    - [146, 9914.76]
  - - [1024, 4096, 1, 3502]
    - [153, 9921.42]
  - - [1024, 1024, 1, 3976]
    - [148, 9060.2]
  - - [1024, 4096, 1, 3138]
    - [146, 9908.56]
  - - [4096, 1024, 1, 3939]
    - [145, 9910.13]
  - - [1024, 4096, 1, 3303]
    - [146, 9916.54]
  - - [64, 111, 576, 112]
    - [126, 6495.09]
  - - [1024, 4096, 1, 3418]
    - [152, 9913.25]
  - - [1024, 4096, 1, 3224]
    - [146, 9903.95]
  - - [4096, 1024, 1, 3978]
    - [152, 9896.18]
  - - [1024, 4096, 1, 3472]
    - [145, 9937.38]
  - - [4096, 1024, 1, 3353]
    - [153, 9863.87]
  - - [4096, 1024, 1, 3362]
    - [152, 9870.96]
  - - [1024, 33708, 1, 3978]
    - [145, 10325.3]
  - - [64, 100, 624, 102]
    - [121, 5695.57]
  - - [1024, 4096, 1, 3432]
    - [153, 9915.46]
  - - [1024, 4096, 1, 3139]
    - [152, 9914.11]
  - - [1024, 4096, 1, 3341]
    - [153, 9912.0]
  - - [1024, 4096, 1, 3494]
    - [146, 9924.5]
  - - [1024, 4096, 1, 3969]
    - [145, 9952.18]
  - - [1024, 4096, 1, 3163]
    - [153, 9911.69]
  - - [1024, 1024, 1, 3955]
    - [143, 9097.76]
  - - [4096, 1024, 1, 3405]
    - [152, 9853.74]
  - - [1024, 1024, 1, 4030]
    - [143, 9083.76]
  - - [4096, 1024, 1, 3453]
    - [152, 9858.78]
  - - [1024, 4096, 1, 3411]
    - [153, 9926.44]
  - - [1024, 4096, 1, 3527]
    - [146, 9922.55]
  - - [4096, 1024, 1, 3474]
    - [152, 9878.39]
  - - [1024, 4096, 1, 3572]
    - [152, 9931.9]
  - - [4096, 1024, 1, 3293]
    - [152, 9848.16]
  - - [4096, 1024, 1, 3247]
    - [152, 9861.35]
  - - [64, 15, 4096, 15]
    - [133, 1955.65]
  - - [1024, 4096, 1, 3425]
    - [153, 9936.3]
  - - [1024, 4096, 1, 3354]
    - [145, 9917.45]
  - - [4096, 1024, 1, 3382]
    - [152, 9885.39]
  - - [4096, 1024, 1, 3236]
    - [152, 9860.5]
  - - [1024, 4096, 1, 3519]
    - [153, 9919.2]
  - - [4096, 1024, 1, 3354]
    - [152, 9854.65]
  - - [4096, 1024, 1, 3501]
    - [153, 9869.52]
  - - [1024, 1024, 1, 3906]
    - [151, 9104.89]
  - - [4096, 1024, 1, 3266]
    - [152, 9873.87]
  - - [64, 101, 624, 102]
    - [121, 5765.42]
  - - [1024, 4096, 1, 3368]
    - [152, 9909.67]
  - - [1024, 4096, 1, 4030]
    - [153, 9940.17]
  - - [1024, 4096, 1, 3533]
    - [146, 9916.54]
  - - [4096, 1024, 1, 3332]
    - [153, 9876.35]
  - - [4096, 1024, 1, 3584]
    - [152, 9896.5]
  - - [1024, 4096, 1, 3616]
    - [152, 9957.08]
  - - [4096, 1024, 1, 3265]
    - [152, 9877.68]
  - - [4096, 1024, 1, 3361]
    - [152, 9888.51]
  - - [4096, 1024, 1, 3467]
    - [152, 9863.3]
  - - [1024, 4096, 1, 3454]
    - [146, 9904.79]
  - - [1024, 4096, 1, 3101]
    - [153, 9893.02]
  - - [1024, 4096, 1, 3508]
    - [153, 9931.44]
  - - [4096, 1024, 1, 3267]
    - [152, 9864.38]
  - - [64, 54, 1184, 54]
    - [118, 4905.92]
  - - [4096, 1024, 1, 3419]
    - [152, 9872.46]
  - - [4096, 1024, 1, 3822]
    - [152, 9892.53]
  - - [1024, 4096, 1, 3266]
    - [152, 9918.48]
  - - [4096, 1024, 1, 3440]
    - [153, 9890.06]
  - - [1024, 4096, 1, 3361]
    - [152, 9930.87]
  - - [1024, 4096, 1, 3546]
    - [146, 9926.46]
  - - [4096, 1024, 1, 3473]
    - [152, 9888.96]
  - - [4096, 1024, 1, 3546]
    - [153, 9872.17]
  - - [1024, 4096, 1, 3088]
    - [146, 9917.93]
  - - [1024, 4096, 1, 3535]
    - [153, 9921.1]
  - - [1024, 4096, 1, 3447]
    - [153, 9920.53]
  - - [1024, 4096, 1, 3560]
    - [152, 9925.38]
  - - [1024, 4096, 1, 3422]
    - [146, 9922.11]
  - - [1024, 4096, 1, 3469]
    - [145, 9906.08]
  - - [4096, 1024, 1, 3488]
    - [152, 9903.16]
  - - [1024, 4096, 1, 3110]
    - [152, 9906.66]
  - - [1024, 4096, 1, 3265]
    - [153, 9916.59]
  - - [1024, 4096, 1, 3291]
    - [152, 9902.63]
  - - [1024, 4096, 1, 3390]
    - [153, 9907.12]
  - - [4096, 1024, 1, 3046]
    - [152, 9847.58]
  - - [1024, 4096, 1, 3539]
    - [153, 9933.39]
  - - [4096, 1024, 1, 3221]
    - [153, 9860.64]
  - - [4096, 1024, 1, 3433]
    - [152, 9872.64]
  - - [4096, 1024, 1, 3364]
    - [153, 9881.81]
  - - [4096, 1024, 1, 3470]
    - [152, 9858.46]
  - - [1024, 4096, 1, 3404]
    - [145, 9907.17]
  - - [1024, 33708, 1, 3968]
    - [146, 10350.2]
  - - [4096, 1024, 1, 3088]
    - [152, 9868.96]
  - - [1024, 4096, 1, 3247]
    - [152, 9900.92]
  - - [1024, 33708, 1, 3996]
    - [145, 10328.4]
  - - [4096, 1024, 1, 3482]
    - [153, 9866.89]
  - - [1024, 1024, 1, 3796]
    - [148, 9031.58]
  - - [4096, 1024, 1, 3995]
    - [153, 9896.68]
  - - [1024, 1024, 1, 3859]
    - [150, 9097.26]
  - - [1024, 4096, 1, 3280]
    - [146, 9933.95]
  - - [4096, 1024, 1, 3271]
    - [153, 9859.99]
  - - [64, 10, 5952, 10]
    - [133, 1220.92]
  - - [4096, 1024, 1, 3545]
    - [152, 9877.25]
  - - [4096, 1024, 1, 3476]
    - [145, 9882.47]
  - - [4096, 1024, 1, 3496]
    - [146, 9880.4]
  - - [4096, 1024, 1, 3191]
    - [146, 9858.6]
  - - [4096, 1024, 1, 3311]
    - [153, 9853.1]
  - - [1024, 4096, 1, 3302]
    - [153, 9919.22]
  - - [1024, 4096, 1, 3681]
    - [152, 9944.89]
  - - [4096, 1024, 1, 3582]
    - [145, 9869.67]
  - - [4096, 1024, 1, 3421]
    - [153, 9855.98]
  - - [4096, 1024, 1, 3560]
    - [146, 9884.38]
  - - [1024, 4096, 1, 3495]
    - [153, 9930.03]
  - - [4096, 1024, 1, 3186]
    - [152, 9870.49]
  - - [4096, 1024, 1, 3925]
    - [152, 9903.9]
  - - [64, 71, 896, 71]
    - [137, 5004.69]
  - - [1024, 4096, 1, 3435]
    - [153, 9916.48]
  - - [4096, 1024, 1, 3434]
    - [152, 9871.19]
  - - [1024, 33708, 1, 4012]
    - [145, 10332.4]
  - - [1024, 4096, 1, 3340]
    - [145, 9918.01]
  - - [1024, 1024, 1, 3860]
    - [143, 8999.26]
  - - [4096, 1024, 1, 3489]
    - [152, 9881.92]
  - - [1024, 4096, 1, 3162]
    - [153, 9906.18]
  - - [4096, 1024, 1, 3436]
    - [152, 9858.02]
  - - [1024, 1024, 1, 4005]
    - [149, 9042.96]
  - - [64, 84, 752, 84]
    - [122, 5629.83]
  - - [4096, 1024, 1, 3574]
    - [152, 9886.6]
  - - [4096, 1024, 1, 3469]
    - [145, 9856.16]
  - - [1024, 4096, 1, 3410]
    - [146, 9924.64]
  - - [1024, 4096, 1, 3216]
    - [145, 9930.57]
  - - [4096, 1024, 1, 3095]
    - [152, 9846.91]
  - - [1024, 1024, 1, 3990]
    - [151, 9088.94]
  - - [4096, 1024, 1, 3448]
    - [152, 9863.84]
  - - [1024, 4096, 1, 3176]
    - [153, 9913.91]
  - - [64, 49, 1296, 49]
    - [118, 4437.36]
  - - [4096, 1024, 1, 2918]
    - [152, 9830.83]
  - - [64, 14, 4368, 14]
    - [132, 1802.37]
  - - [1024, 4096, 1, 3424]
    - [152, 9933.95]
  - - [4096, 1024, 1, 3402]
    - [145, 9863.02]
  - - [4096, 1024, 1, 3145]
    - [146, 9856.46]
  - - [64, 134, 480, 134]
    - [138, 6183.95]
  - - [1024, 33708, 1, 3976]
    - [146, 10330.0]
  - - [4096, 1024, 1, 3518]
    - [145, 9855.97]
  - - [4096, 1024, 1, 3110]
    - [152, 9856.36]
  - - [4096, 1024, 1, 3325]
    - [152, 9852.26]
  - - [1024, 33708, 1, 3999]
    - [145, 10329.6]
  - - [4096, 1024, 1, 2985]
    - [152, 9837.2]
  - - [1024, 4096, 1, 3371]
    - [145, 9912.93]
  - - [4096, 1024, 1, 3342]
    - [152, 9863.06]
  - - [4096, 1024, 1, 3141]
    - [146, 9849.81]
  - - [4096, 1024, 1, 3532]
    - [146, 9866.2]
  - - [64, 78, 816, 78]
    - [123, 5316.78]
  - - [1024, 4096, 1, 3169]
    - [153, 9910.35]
  - - [1024, 4096, 1, 3514]
    - [152, 9917.9]
  - - [4096, 1024, 1, 3780]
    - [153, 9899.65]
  - - [1024, 4096, 1, 3098]
    - [145, 9901.52]
  - - [1024, 4096, 1, 3449]
    - [153, 9919.75]
  - - [1024, 4096, 1, 3222]
    - [145, 9917.56]
  - - [1024, 4096, 1, 3346]
    - [146, 9912.81]
  - - [4096, 1024, 1, 3064]
    - [153, 9848.69]
  - - [4096, 1024, 1, 3511]
    - [152, 9873.29]
  - - [4096, 1024, 1, 3384]
    - [152, 9870.88]
  - - [4096, 1024, 1, 3356]
    - [146, 9853.35]
  - - [1024, 4096, 1, 3796]
    - [145, 9940.56]
  - - [4096, 1024, 1, 3427]
    - [152, 9883.04]
  - - [4096, 1024, 1, 3390]
    - [152, 9863.69]
  - - [4096, 1024, 1, 3573]
    - [153, 9885.92]
  - - [4096, 1024, 1, 3456]
    - [146, 9890.51]
  - - [1024, 4096, 1, 3360]
    - [153, 9938.0]
  - - [1024, 33708, 1, 3977]
    - [146, 10327.1]
  - - [1024, 4096, 1, 2918]
    - [145, 9902.74]
  - - [4096, 1024, 1, 3975]
    - [152, 9905.17]
  - - [4096, 1024, 1, 3525]
    - [153, 9879.81]
  - - [4096, 1024, 1, 3398]
    - [145, 9873.81]
  - - [4096, 1024, 1, 3640]
    - [152, 9885.06]
  - - [1024, 1024, 1, 3999]
    - [144, 8995.32]
  - - [4096, 1024, 1, 3014]
    - [152, 9841.22]
  - - [1024, 4096, 1, 3446]
    - [145, 9917.11]
  - - [1024, 33708, 1, 3796]
    - [145, 10338.9]
  - - [4096, 1024, 1, 3101]
    - [145, 9827.24]
  - - [4096, 1024, 1, 3563]
    - [153, 9862.93]
  - - [4096, 1024, 1, 3539]
    - [145, 9889.44]
  - - [4096, 1024, 1, 3182]
    - [152, 9833.69]
  - - [1024, 4096, 1, 3468]
    - [146, 9912.95]
  - - [4096, 1024, 1, 3312]
    - [152, 9889.75]
  - - [4096, 1024, 1, 3215]
    - [152, 9853.78]
  - - [4096, 1024, 1, 3910]
    - [152, 9894.62]
  - - [1024, 33708, 1, 3780]
    - [146, 10331.9]
  - - [1024, 4096, 1, 3290]
    - [152, 9914.98]
  - - [1024, 4096, 1, 4012]
    - [152, 9942.55]
  - - [1024, 4096, 1, 3385]
    - [152, 9915.73]
  - - [1024, 33708, 1, 3975]
    - [145, 10330.0]
  - - [4096, 1024, 1, 3996]
    - [152, 9891.21]
  - - [4096, 1024, 1, 2765]
    - [153, 9800.28]
  - - [4096, 1024, 1, 3538]
    - [153, 9886.12]
  - - [4096, 1024, 1, 3415]
    - [153, 9874.5]
  - - [1024, 4096, 1, 3554]
    - [152, 9931.89]
  - - [4096, 1024, 1, 3513]
    - [146, 9874.15]
  - - [1024, 4096, 1, 3304]
    - [146, 9907.63]
  - - [4096, 1024, 1, 3294]
    - [152, 9851.15]
  - - [4096, 1024, 1, 3396]
    - [153, 9880.6]
  - - [1024, 4096, 1, 3213]
    - [146, 9891.02]
  - - [4096, 1024, 1, 3137]
    - [146, 9857.31]
  - - [4096, 1024, 1, 3552]
    - [152, 9904.12]
  - - [1024, 1024, 1, 4020]
    - [151, 9098.77]
  - - [64, 13, 4672, 13]
    - [133, 1693.44]
  - - [1024, 4096, 1, 3461]
    - [152, 9918.35]
  - - [4096, 1024, 1, 3263]
    - [145, 9843.79]
  - - [4096, 1024, 1, 3430]
    - [152, 9885.16]
  - - [4096, 1024, 1, 3389]
    - [152, 9859.13]
  - - [4096, 1024, 1, 3528]
    - [152, 9872.91]
  - - [1024, 4096, 1, 3463]
    - [153, 9929.51]
  - - [4096, 1024, 1, 3526]
    - [153, 9876.8]
  - - [4096, 1024, 1, 3154]
    - [152, 9858.15]
  - - [4096, 1024, 1, 3499]
    - [153, 9862.82]
  - - [1024, 1024, 1, 3939]
    - [151, 9107.31]
  - - [4096, 1024, 1, 3955]
    - [153, 9906.18]
  - - [1024, 4096, 1, 3297]
    - [146, 9925.24]
  - - [1024, 4096, 1, 3233]
    - [152, 9920.55]
  - - [1024, 4096, 1, 3226]
    - [152, 9911.25]
  - - [4096, 1024, 1, 3404]
    - [152, 9867.18]
  - - [4096, 1024, 1, 3355]
    - [152, 9862.56]
  - - [1024, 4096, 1, 3542]
    - [152, 9926.39]
  - - [4096, 1024, 1, 3181]
    - [153, 9831.76]
  - - [1024, 4096, 1, 3474]
    - [152, 9927.93]
  - - [4096, 1024, 1, 3319]
    - [152, 9870.18]
  - - [1024, 4096, 1, 3434]
    - [145, 9917.41]
  - - [1024, 4096, 1, 3860]
    - [152, 9945.22]
  - - [1024, 4096, 1, 3343]
    - [145, 9914.56]
  - - [64, 77, 816, 78]
    - [123, 5276.87]
  - - [1024, 4096, 1, 3488]
    - [152, 9945.71]
  - - [1024, 4096, 1, 3046]
    - [152, 9908.68]
  - - [1024, 4096, 1, 3141]
    - [153, 9909.08]
  - - [1024, 4096, 1, 3516]
    - [153, 9911.28]
  - - [4096, 1024, 1, 3147]
    - [152, 9840.37]
  - - [1024, 1024, 1, 4059]
    - [144, 9009.68]
  - - [1024, 1024, 1, 3944]
    - [144, 9006.07]
  - - [1024, 4096, 1, 3421]
    - [153, 9919.76]
  - - [4096, 1024, 1, 3944]
    - [146, 9899.43]
  - - [64, 45, 1424, 45]
    - [131, 4068.57]
  - - [1024, 4096, 1, 3574]
    - [146, 9930.09]
  - - [1024, 4096, 1, 3977]
    - [145, 9944.18]
  - - [1024, 1024, 1, 3968]
    - [150, 9045.12]
  - - [1024, 4096, 1, 2985]
    - [152, 9887.55]
  - - [64, 193, 320, 193]
    - [139, 6631.25]
  - - [1024, 4096, 1, 3427]
    - [153, 9933.31]
  - - [64, 12, 5040, 12]
    - [133, 1552.43]
  - - [1024, 4096, 1, 3482]
    - [153, 9942.12]
  - - [1024, 4096, 1, 3332]
    - [145, 9923.48]
  - - [1024, 1024, 1, 3720]
    - [149, 9039.46]
  - - [4096, 1024, 1, 3308]
    - [153, 9852.56]
  - - [1024, 4096, 1, 3513]
    - [153, 9919.89]
  - - [1024, 4096, 1, 3154]
    - [146, 9908.36]
  - - [1024, 4096, 1, 3955]
    - [153, 9949.91]
  - - [1024, 4096, 1, 2967]
    - [153, 9897.34]
  - - [1024, 33708, 1, 3942]
    - [145, 10336.0]
  - - [1024, 4096, 1, 3319]
    - [153, 9912.35]
  - - [4096, 1024, 1, 3860]
    - [152, 9909.19]
  - - [1024, 4096, 1, 3548]
    - [145, 9924.11]
  - - [4096, 1024, 1, 3977]
    - [153, 9891.34]
  - - [4096, 1024, 1, 3535]
    - [152, 9867.74]
  - - [1024, 4096, 1, 3541]
    - [153, 9923.06]
  - - [1024, 1024, 1, 3910]
    - [150, 9080.3]
  - - [1024, 33708, 1, 3584]
    - [145, 10332.9]
  - - [1024, 4096, 1, 3168]
    - [146, 9926.17]
  - - [1024, 4096, 1, 3448]
    - [153, 9922.32]
  - - [4096, 1024, 1, 3343]
    - [152, 9857.13]
  - - [64, 35, 1808, 35]
    - [135, 3175.34]
  - - [1024, 4096, 1, 3357]
    - [146, 9902.31]
  - - [64, 143, 432, 143]
    - [136, 6489.6]
  - - [4096, 1024, 1, 3510]
    - [152, 9867.3]
  - - [4096, 1024, 1, 3369]
    - [152, 9863.34]
  - - [64, 92, 688, 93]
    - [123, 6188.2]
  - - [4096, 1024, 1, 3379]
    - [152, 9870.02]
  - - [1024, 4096, 1, 3276]
    - [152, 9904.67]
  - - [1024, 4096, 1, 3363]
    - [152, 9925.03]
  - - [4096, 1024, 1, 3055]
    - [152, 9831.82]
  - - [1024, 4096, 1, 3524]
    - [145, 9923.69]
  - - [4096, 1024, 1, 3057]
    - [152, 9852.77]
  - - [1024, 33708, 1, 3720]
    - [146, 10327.0]
  - - [1024, 4096, 1, 3383]
    - [145, 9919.29]
  - - [1024, 4096, 1, 3522]
    - [146, 9932.46]
  - - [1024, 33708, 1, 3956]
    - [145, 10333.7]
  - - [1024, 4096, 1, 3481]
    - [145, 9921.98]
  - - [4096, 1024, 1, 3562]
    - [153, 9874.76]
  - - [4096, 1024, 1, 3299]
    - [152, 9872.87]
  - - [1024, 4096, 1, 3262]
    - [146, 9924.73]
  - - [1024, 4096, 1, 3840]
    - [145, 9961.74]
  - - [1024, 33708, 1, 4026]
    - [145, 10334.2]
  - - [4096, 1024, 1, 3168]
    - [146, 9878.35]
  - - [64, 101, 624, 101]
    - [126, 5734.62]
  - - [1024, 4096, 1, 3999]
    - [145, 9947.0]
  - - [1024, 4096, 1, 3549]
    - [145, 9923.2]
  - - [4096, 1024, 1, 3375]
    - [152, 9868.79]
  - - [1024, 4096, 1, 3496]
    - [153, 9928.57]
  - - [64, 29, 2176, 29]
    - [122, 3289.92]
  - - [1024, 4096, 1, 3190]
    - [153, 9897.51]
  - - [4096, 1024, 1, 3273]
    - [153, 9853.55]
  - - [1024, 4096, 1, 3406]
    - [152, 9906.94]
  - - [4096, 1024, 1, 4005]
    - [145, 9907.87]
  - - [4096, 1024, 1, 3555]
    - [152, 9878.86]
  - - [4096, 1024, 1, 2505]
    - [152, 9785.0]
  - - [1024, 4096, 1, 3460]
    - [152, 9930.14]
  - - [64, 17, 3632, 17]
    - [123, 1917.17]
  - - [1024, 4096, 1, 3579]
    - [146, 9920.84]
  - - [1024, 33708, 1, 4030]
    - [146, 10327.6]
  - - [1024, 4096, 1, 3510]
    - [146, 9931.21]
  - - [1024, 1024, 1, 3969]
    - [143, 9020.73]
  - - [1024, 4096, 1, 3282]
    - [153, 9919.95]
  - - [1024, 4096, 1, 3377]
    - [145, 9927.24]
  - - [1024, 4096, 1, 2935]
    - [153, 9903.38]
  - - [64, 41, 1552, 41]
    - [123, 3740.38]
  - - [1024, 4096, 1, 3498]
    - [145, 9914.91]
  - - [1024, 4096, 1, 3593]
    - [152, 9925.54]
  - - [1024, 1024, 1, 3948]
    - [151, 9008.93]
  - - [4096, 1024, 1, 3226]
    - [153, 9854.65]
  - - [1024, 4096, 1, 2499]
    - [152, 9904.72]
  - - [1024, 4096, 1, 3296]
    - [145, 9926.79]
  - - [1024, 4096, 1, 3455]
    - [152, 9917.42]
  - - [1024, 4096, 1, 3399]
    - [146, 9919.6]
  - - [1024, 4096, 1, 3205]
    - [145, 9917.64]
  - - [4096, 1024, 1, 4026]
    - [153, 9897.71]
  - - [1024, 4096, 1, 3484]
    - [145, 9915.43]
  - - [4096, 1024, 1, 3302]
    - [153, 9862.7]
  - - [1024, 4096, 1, 3485]
    - [153, 9912.9]
  - - [1024, 1024, 1, 3996]
    - [151, 9008.67]
  - - [1024, 4096, 1, 3126]
    - [146, 9910.06]
  - - [1024, 4096, 1, 4050]
    - [145, 9951.11]
  - - [4096, 1024, 1, 3235]
    - [146, 9870.64]
  - - [1024, 33708, 1, 3955]
    - [145, 10336.0]
  - - [1024, 4096, 1, 3342]
    - [145, 9903.75]
  - - [1024, 1024, 1, 3900]
    - [150, 9082.82]
  - - [1024, 4096, 1, 3397]
    - [153, 9922.6]
  - - [4096, 1024, 1, 3491]
    - [153, 9880.65]
  - - [1024, 4096, 1, 3503]
    - [145, 9923.18]
  - - [1024, 4096, 1, 3140]
    - [146, 9908.31]
  - - [4096, 1024, 1, 3121]
    - [152, 9860.22]
  - - [4096, 1024, 1, 3276]
    - [152, 9854.09]
  - - [1024, 4096, 1, 3321]
    - [153, 9917.76]
  - - [1024, 4096, 1, 3870]
    - [153, 9930.97]
  - - [4096, 1024, 1, 3475]
    - [152, 9877.48]
  - - [1024, 4096, 1, 2984]
    - [152, 9895.49]
  - - [4096, 1024, 1, 3363]
    - [146, 9873.34]
  - - [1024, 4096, 1, 3582]
    - [152, 9920.77]
  - - [4096, 1024, 1, 3509]
    - [152, 9886.76]
  - - [1024, 4096, 1, 3426]
    - [145, 9928.76]
  - - [4096, 1024, 1, 3136]
    - [152, 9872.51]
  - - [1024, 4096, 1, 3232]
    - [153, 9926.19]
  - - [4096, 1024, 1, 3103]
    - [152, 9838.93]
  - - [1024, 4096, 1, 3335]
    - [146, 9913.27]
  - - [1024, 4096, 1, 3900]
    - [145, 9937.91]
  - - [4096, 1024, 1, 3512]
    - [146, 9877.16]
  - - [4096, 1024, 1, 3222]
    - [152, 9859.67]
  - - [1024, 4096, 1, 3165]
    - [152, 9899.61]
  - - [4096, 1024, 1, 3408]
    - [152, 9899.58]
  - - [4096, 1024, 1, 3751]
    - [152, 9891.39]
  - - [1024, 4096, 1, 3318]
    - [145, 9913.32]
  - - [4096, 1024, 1, 3442]
    - [153, 9880.11]
  - - [1024, 4096, 1, 3413]
    - [152, 9921.8]
  - - [4096, 1024, 1, 3524]
    - [152, 9879.12]
  - - [1024, 4096, 1, 3976]
    - [153, 9945.47]
  - - [1024, 4096, 1, 3475]
    - [153, 9932.41]
  - - [1024, 4096, 1, 3534]
    - [145, 9911.39]
  - - [4096, 1024, 1, 3301]
    - [152, 9872.65]
  - - [4096, 1024, 1, 3248]
    - [152, 9878.12]
  - - [1024, 4096, 1, 2977]
    - [146, 9899.83]
  - - [4096, 1024, 1, 3346]
    - [152, 9875.97]
  - - [1024, 4096, 1, 3451]
    - [145, 9920.06]
  - - [1024, 4096, 1, 3257]
    - [146, 9904.92]
  - - [1024, 1024, 1, 3640]
    - [144, 8983.29]
  - - [1024, 4096, 1, 3356]
    - [145, 9904.38]
  - - [4096, 1024, 1, 3348]
    - [153, 9872.43]
  - - [4096, 1024, 1, 3335]
    - [152, 9865.72]
  - - [4096, 1024, 1, 3505]
    - [152, 9888.78]
  - - [1024, 4096, 1, 3490]
    - [145, 9937.9]
  - - [4096, 1024, 1, 3447]
    - [152, 9865.29]
  - - [1024, 4096, 1, 3267]
    - [153, 9919.22]
  - - [4096, 1024, 1, 3230]
    - [152, 9853.1]
  - - [4096, 1024, 1, 3455]
    - [152, 9862.34]
  - - [1024, 4096, 1, 3925]
    - [145, 9945.54]
  - - [1024, 4096, 1, 3362]
    - [146, 9921.53]
  - - [4096, 1024, 1, 3969]
    - [153, 9911.88]
  - - [4096, 1024, 1, 3527]
    - [152, 9882.77]
  - - [1024, 4096, 1, 3585]
    - [146, 9946.42]
  - - [4096, 1024, 1, 3063]
    - [152, 9853.93]
  - - [4096, 1024, 1, 3435]
    - [152, 9867.03]
  - - [4096, 1024, 1, 3366]
    - [153, 9863.92]
  - - [4096, 1024, 1, 3581]
    - [145, 9868.47]
  - - [1024, 33708, 1, 3906]
    - [145, 10339.2]
  - - [1024, 4096, 1, 3464]
    - [153, 9916.11]
  - - [1024, 4096, 1, 3440]
    - [152, 9945.15]
  - - [4096, 1024, 1, 3143]
    - [152, 9846.66]
  - - [1024, 4096, 1, 3349]
    - [146, 9912.73]
  - - [4096, 1024, 1, 3416]
    - [152, 9885.03]
  - - [4096, 1024, 1, 3365]
    - [152, 9875.9]
  - - [1024, 4096, 1, 3470]
    - [153, 9914.88]
  - - [4096, 1024, 1, 3287]
    - [152, 9860.59]
  - - [1024, 4096, 1, 3441]
    - [153, 9928.88]
  - - [4096, 1024, 1, 3224]
    - [152, 9857.73]
  - - [1024, 4096, 1, 3387]
    - [145, 9911.62]
  - - [1024, 4096, 1, 3547]
    - [145, 9920.26]
  - - [4096, 1024, 1, 3478]
    - [146, 9882.8]
  - - [4096, 1024, 1, 3548]
    - [153, 9869.35]
  - - [1024, 33708, 1, 4020]
    - [145, 10345.2]
  - - [4096, 1024, 1, 3320]
    - [152, 9863.64]
  - - [1024, 4096, 1, 3906]
    - [152, 9942.57]
  - - [4096, 1024, 1, 3796]
    - [152, 9899.03]
  - - [1024, 4096, 1, 3306]
    - [145, 9902.3]
  - - [1024, 4096, 1, 3401]
    - [153, 9913.85]
  - - [64, 147, 432, 147]
    - [136, 6626.5]
  - - [1024, 4096, 1, 3215]
    - [153, 9911.14]
  - - [4096, 1024, 1, 4012]
    - [153, 9898.1]
  - - [1024, 4096, 1, 2765]
    - [153, 9863.63]
  - - [4096, 1024, 1, 3554]
    - [146, 9883.42]
  - - [4096, 1024, 1, 3423]
    - [152, 9866.62]
  - - [1024, 1024, 1, 3751]
    - [150, 9006.26]
  - - [1024, 4096, 1, 3562]
    - [146, 9921.98]
  - - [1024, 4096, 1, 3489]
    - [145, 9936.68]
  - - [4096, 1024, 1, 3358]
    - [152, 9858.12]
  - - [4096, 1024, 1, 3270]
    - [153, 9850.74]
  - - [1024, 4096, 1, 3293]
    - [145, 9905.23]
  - - [1024, 4096, 1, 3376]
    - [145, 9934.88]
  - - [4096, 1024, 1, 3245]
    - [152, 9852.42]
  - - [4096, 1024, 1, 3541]
    - [152, 9887.12]
  - - [4096, 1024, 1, 3443]
    - [152, 9871.63]
  - - [4096, 1024, 1, 3438]
    - [153, 9863.76]
  - - [4096, 1024, 1, 3244]
    - [152, 9859.66]
  - - [1024, 4096, 1, 3365]
    - [152, 9922.0]
  - - [1024, 4096, 1, 3299]
    - [146, 9923.28]
  - - [4096, 1024, 1, 3840]
    - [152, 9914.65]
  - - [1024, 4096, 1, 3471]
    - [153, 9918.28]
  - - [1024, 4096, 1, 3398]
    - [145, 9918.89]
  - - [4096, 1024, 1, 3162]
    - [152, 9843.83]
  - - [1024, 4096, 1, 4005]
    - [146, 9947.77]
  - - [4096, 1024, 1, 3579]
    - [152, 9868.15]
  - - [64, 18, 3440, 18]
    - [128, 2059.23]
  - - [64, 177, 352, 177]
    - [147, 7315.3]
  - - [1024, 4096, 1, 3121]
    - [153, 9930.24]
  - - [4096, 1024, 1, 3441]
    - [152, 9883.18]
  - - [4096, 1024, 1, 3422]
    - [152, 9858.31]
  - - [4096, 1024, 1, 3444]
    - [152, 9886.93]
  - - [1024, 4096, 1, 3337]
    - [146, 9911.35]
  - - [4096, 1024, 1, 3550]
    - [145, 9871.77]
  - - [1024, 4096, 1, 3477]
    - [145, 9930.55]
  - - [4096, 1024, 1, 3490]
    - [152, 9878.35]
  - - [4096, 1024, 1, 3585]
    - [152, 9893.53]
  - - [1024, 4096, 1, 3143]
    - [145, 9901.09]
  - - [1024, 33708, 1, 3876]
    - [146, 10330.7]
  - - [1024, 4096, 1, 3320]
    - [153, 9913.08]
  - - [1024, 4096, 1, 3423]
    - [153, 9914.04]
  - - [1024, 4096, 1, 3894]
    - [145, 9944.37]
  - - [4096, 1024, 1, 3410]
    - [152, 9878.57]
  - - [1024, 4096, 1, 3561]
    - [145, 9926.58]
  - - [4096, 1024, 1, 3492]
    - [146, 9872.82]
  - - [64, 85, 752, 85]
    - [123, 5734.25]
  - - [36548, 1024, 1, 3712]
    - [155, 10367.5]
  - - [4096, 2048, 1, 128]
    - [156, 8743.83]
  - - [1024, 1024, 1, 3712]
    - [157, 9976.19]
  - - [1024, 1024, 1, 128]
    - [154, 5765.37]
  - - [4096, 3072, 1, 128]
    - [156, 8869.01]
  - - [768, 3072, 1, 4096]
    - [166, 10028.7]
  - - [64, 256, 192, 256]
    - [162, 8791.55]
  - - [768, 2, 1, 16]
    - [164, 4.95484]
  - - [768, 768, 1, 64]
    - [161, 3469.55]
  - - [768, 768, 1, 4096]
    - [167, 7475.0]
  - - [768, 30522, 1, 1280]
    - [170, 10296.9]
  - - [64, 128, 384, 128]
    - [162, 7660.83]
  - - [768, 30522, 1, 320]
    - [168, 10007.9]
  - - [768, 768, 1, 32]
    - [159, 2359.3]
  - - [3072, 768, 1, 4096]
    - [166, 10033.7]
  - - [768, 30522, 1, 640]
    - [169, 10206.7]
  - - [64, 64, 768, 64]
    - [160, 5494.72]
  - - [768, 768, 1, 640]
    - [167, 6721.64]
  - - [768, 768, 1, 16]
    - [158, 1203.72]
  - - [768, 768, 1, 1280]
    - [165, 7138.57]
  - - [768, 2, 1, 32]
    - [163, 11.8154]
  - - [2048, 2048, 1, 512]
    - [180, 9607.57]
  - - [512, 32, 1, 200]
    - [174, 422.268]
  - - [1024, 1, 1, 200]
    - [177, 24.6154]
  - - [1600, 1024, 1, 512]
    - [172, 8115.91]
  - - [560, 1024, 1, 200]
    - [171, 4810.74]
  - - [2048, 1, 1, 512]
    - [175, 80.9086]
  - - [512, 512, 1, 200]
    - [173, 4398.39]
  - - [100, 2048, 1, 512]
    - [178, 4443.12]
  - - [1024, 1024, 1, 200]
    - [179, 6990.51]
  - - [1024, 64, 1, 512]
    - [176, 2853.27]
  - - [1024, 256, 1, 18944]
    - [199, 9196.41]
  - - [256, 3328, 1, 8976]
    - [189, 8299.26]
  - - [1024, 256, 1, 4352]
    - [197, 8813.74]
  - - [256, 9728, 1, 8976]
    - [192, 9638.48]
  - - [1024, 256, 1, 3072]
    - [199, 8640.63]
  - - [768, 2048, 1, 256]
    - [191, 8662.93]
  - - [1024, 256, 1, 19968]
    - [196, 9220.86]
  - - [256, 12800, 1, 8976]
    - [186, 9418.42]
  - - [1024, 256, 1, 3328]
    - [200, 8682.48]
  - - [256, 10240, 1, 8976]
    - [193, 10137.7]
  - - [1024, 256, 1, 15104]
    - [198, 9167.03]
  - - [256, 10496, 1, 8976]
    - [186, 9858.38]
  - - [1024, 256, 1, 2816]
    - [201, 8575.71]
  - - [1024, 256, 1, 4608]
    - [196, 8861.21]
  - - [256, 11264, 1, 8976]
    - [183, 9627.69]
  - - [1024, 256, 1, 6400]
    - [196, 8985.23]
  - - [1024, 256, 1, 16128]
    - [196, 9170.26]
  - - [256, 44505, 1, 8976]
    - [190, 10331.8]
  - - [256, 6144, 1, 8976]
    - [193, 10395.0]
  - - [1024, 256, 1, 5120]
    - [198, 8881.53]
  - - [1024, 256, 1, 7936]
    - [201, 9023.14]
  - - [256, 3840, 1, 8976]
    - [188, 9541.28]
  - - [1024, 256, 1, 21248]
    - [196, 9209.72]
  - - [1024, 256, 1, 12032]
    - [198, 9156.17]
  - - [256, 8192, 1, 8976]
    - [195, 10374.4]
  - - [1024, 256, 1, 3584]
    - [197, 8712.2]
  - - [1024, 256, 1, 14336]
    - [198, 9162.51]
  - - [256, 7168, 1, 8976]
    - [184, 9554.86]
  - - [1024, 256, 1, 13568]
    - [196, 9165.04]
  - - [256, 4096, 1, 8976]
    - [188, 10146.6]
  - - [1024, 256, 1, 4096]
    - [197, 8783.88]
  - - [256, 2560, 1, 8976]
    - [187, 8381.56]
  - - [256, 20992, 1, 8976]
    - [186, 9989.86]
  - - [256, 4352, 1, 8976]
    - [187, 9634.92]
  - - [256, 33536, 1, 8976]
    - [186, 10218.1]
  - - [256, 3584, 1, 8976]
    - [188, 8924.5]
  - - [256, 26112, 1, 8976]
    - [187, 10272.3]
  - - [256, 14336, 1, 8976]
    - [191, 10217.3]
  - - [1024, 256, 1, 14848]
    - [198, 9185.19]
  - - [1024, 256, 1, 8448]
    - [199, 9025.89]
  - - [1024, 256, 1, 28672]
    - [196, 9256.4]
  - - [1024, 256, 1, 5632]
    - [196, 8932.69]
  - - [256, 22016, 1, 8976]
    - [191, 10151.9]
  - - [1024, 256, 1, 33536]
    - [196, 9243.07]
  - - [256, 5120, 1, 8976]
    - [182, 9418.05]
  - - [256, 11520, 1, 8976]
    - [189, 9701.0]
  - - [256, 19968, 1, 8976]
    - [187, 10228.0]
  - - [1024, 256, 1, 5376]
    - [198, 8892.52]
  - - [1024, 256, 1, 22016]
    - [196, 9244.24]
  - - [256, 8960, 1, 8976]
    - [187, 9841.31]
  - - [1024, 256, 1, 15872]
    - [196, 9223.15]
  - - [256, 17408, 1, 8976]
    - [191, 9785.77]
  - - [256, 5632, 1, 8976]
    - [191, 9564.22]
  - - [256, 32512, 1, 8976]
    - [190, 10357.9]
  - - [256, 11008, 1, 8976]
    - [183, 9445.13]
  - - [1024, 256, 1, 6144]
    - [198, 8955.81]
  - - [256, 4864, 1, 8976]
    - [183, 8979.35]
  - - [256, 15104, 1, 8976]
    - [186, 10007.0]
  - - [1024, 256, 1, 9984]
    - [196, 9110.43]
  - - [256, 1280, 1, 8976]
    - [182, 5944.34]
  - - [1024, 256, 1, 1024]
    - [198, 7005.1]
  - - [1024, 256, 1, 9728]
    - [198, 9066.19]
  - - [1024, 256, 1, 10496]
    - [196, 9118.05]
  - - [256, 11776, 1, 8976]
    - [193, 9911.64]
  - - [256, 12544, 1, 8976]
    - [186, 9235.25]
  - - [1024, 256, 1, 17152]
    - [196, 9152.21]
  - - [1024, 256, 1, 11520]
    - [198, 9146.77]
  - - [1024, 256, 1, 21504]
    - [198, 9207.42]
  - - [256, 17152, 1, 8976]
    - [185, 9654.71]
  - - [1024, 256, 1, 17408]
    - [196, 9181.17]
  - - [256, 15872, 1, 8976]
    - [194, 10086.4]
  - - [256, 18688, 1, 8976]
    - [187, 9612.47]
  - - [256, 5888, 1, 8976]
    - [191, 9988.33]
  - - [512, 2048, 1, 256]
    - [181, 7678.36]
  - - [1024, 256, 1, 7680]
    - [199, 9032.96]
  - - [1024, 256, 1, 1280]
    - [201, 7767.23]
  - - [256, 14848, 1, 8976]
    - [187, 9852.66]
  - - [256, 9984, 1, 8976]
    - [193, 9908.87]
  - - [256, 20480, 1, 8976]
    - [191, 10337.1]
  - - [1024, 256, 1, 8192]
    - [198, 9044.32]
  - - [1024, 256, 1, 19712]
    - [197, 9184.18]
  - - [256, 13568, 1, 8976]
    - [187, 9927.82]
  - - [256, 13312, 1, 8976]
    - [186, 9757.91]
  - - [256, 2816, 1, 8976]
    - [186, 9191.43]
  - - [1024, 256, 1, 2304]
    - [197, 8444.91]
  - - [256, 21248, 1, 8976]
    - [187, 10127.5]
  - - [256, 16128, 1, 8976]
    - [195, 10238.4]
  - - [256, 512, 36, 98]
    - [218, 7994.85]
  - - [64, 192, 36, 25088]
    - [285, 8613.89]
  - - [128, 128, 64, 25]
    - [217, 2540.15]
  - - [256, 256, 64, 56]
    - [218, 6924.56]
  - - [512, 486, 36, 800]
    - [225, 8994.84]
  - - [512, 512, 36, 1568]
    - [235, 9872.38]
  - - [64, 192, 64, 3200]
    - [279, 9295.89]
  - - [256, 384, 36, 4096]
    - [279, 9334.61]
  - - [128, 256, 64, 32]
    - [220, 4279.9]
  - - [64, 128, 64, 23104]
    - [285, 10103.1]
  - - [128, 256, 64, 9]
    - [211, 1709.63]
  - - [256, 512, 36, 784]
    - [221, 9520.73]
  - - [256, 324, 36, 32]
    - [257, 4473.38]
  - - [512, 512, 36, 33]
    - [229, 5925.17]
  - - [16, 32, 36, 5760]
    - [233, 1448.8]
  - - [192, 384, 64, 128]
    - [279, 8618.43]
  - - [512, 512, 64, 72]
    - [236, 8260.12]
  - - [128, 128, 64, 1600]
    - [210, 9008.38]
  - - [512, 512, 36, 128]
    - [279, 8871.62]
  - - [192, 384, 64, 2304]
    - [210, 9657.16]
  - - [384, 256, 64, 450]
    - [244, 9538.93]
  - - [3, 64, 36, 6272]
    - [233, 509.784]
  - - [3, 64, 64, 2888]
    - [261, 708.621]
  - - [384, 256, 64, 2304]
    - [244, 10287.5]
  - - [512, 512, 64, 144]
    - [279, 9226.7]
  - - [256, 256, 36, 6272]
    - [221, 9607.28]
  - - [80, 192, 64, 4608]
    - [280, 7347.93]
  - - [64, 64, 36, 3136]
    - [267, 5959.05]
  - - [256, 384, 64, 2304]
    - [244, 10283.4]
  - - [512, 512, 36, 66]
    - [229, 7618.08]
  - - [128, 256, 64, 800]
    - [254, 9611.15]
  - - [64, 128, 36, 30]
    - [212, 1242.61]
  - - [192, 256, 36, 512]
    - [279, 8657.97]
  - - [256, 512, 64, 200]
    - [279, 9153.87]
  - - [256, 512, 64, 25]
    - [257, 5349.88]
  - - [3, 64, 64, 46208]
    - [260, 808.562]
  - - [128, 256, 36, 1568]
    - [252, 8528.62]
  - - [64, 128, 64, 11552]
    - [285, 9997.0]
  - - [128, 192, 64, 946]
    - [279, 9198.38]
  - - [64, 192, 64, 12800]
    - [240, 9000.66]
  - - [224, 224, 64, 128]
    - [219, 6312.07]
  - - [128, 256, 64, 288]
    - [279, 8697.87]
  - - [64, 64, 64, 826]
    - [224, 6650.21]
  - - [256, 384, 64, 1152]
    - [254, 10106.8]
  - - [3, 64, 64, 92416]
    - [260, 812.031]
  - - [32, 32, 36, 43808]
    - [203, 2813.09]
  - - [160, 320, 64, 288]
    - [213, 8090.86]
  - - [1, 16, 36, 23040]
    - [248, 42.6667]
  - - [128, 256, 36, 128]
    - [228, 6049.48]
  - - [128, 128, 64, 3360]
    - [279, 9199.96]
  - - [128, 128, 64, 420]
    - [279, 8131.5]
  - - [64, 128, 64, 361]
    - [218, 6937.98]
  - - [512, 512, 36, 16]
    - [272, 3797.66]
  - - [384, 256, 36, 800]
    - [215, 9151.65]
  - - [192, 384, 36, 4096]
    - [215, 8867.57]
  - - [64, 64, 64, 1600]
    - [265, 7931.74]
  - - [256, 384, 64, 576]
    - [245, 9745.8]
  - - [512, 512, 64, 14]
    - [229, 3638.18]
  - - [512, 512, 36, 8]
    - [205, 2279.51]
  - - [512, 486, 64, 128]
    - [221, 8337.83]
  - - [1, 16, 64, 640]
    - [253, 49.9512]
  - - [64, 96, 64, 288]
    - [278, 5707.97]
  - - [96, 96, 36, 1568]
    - [247, 6866.75]
  - - [256, 256, 36, 128]
    - [251, 7703.82]
  - - [64, 128, 36, 53824]
    - [239, 6331.31]
  - - [256, 256, 36, 32]
    - [236, 4648.86]
  - - [192, 256, 64, 288]
    - [279, 8987.79]
  - - [256, 256, 36, 16]
    - [249, 2912.71]
  - - [128, 256, 36, 3200]
    - [252, 8680.27]
  - - [160, 320, 64, 512]
    - [213, 8449.44]
  - - [128, 160, 36, 512]
    - [224, 7214.97]
  - - [96, 96, 36, 2592]
    - [219, 7104.79]
  - - [64, 96, 64, 800]
    - [247, 7268.32]
  - - [147, 64, 36, 18816]
    - [263, 7116.26]
  - - [160, 320, 36, 512]
    - [219, 7874.82]
  - - [256, 512, 36, 4]
    - [256, 1034.78]
  - - [96, 128, 64, 946]
    - [239, 7901.07]
  - - [256, 324, 64, 1568]
    - [244, 8589.53]
  - - [128, 128, 64, 50]
    - [236, 4070.56]
  - - [35, 96, 36, 8960]
    - [230, 4207.3]
  - - [32, 64, 36, 43808]
    - [270, 4390.81]
  - - [160, 224, 36, 128]
    - [219, 5446.92]
  - - [64, 64, 64, 81]
    - [242, 2391.18]
  - - [256, 256, 36, 3200]
    - [210, 9559.55]
  - - [256, 256, 36, 210]
    - [221, 8414.61]
  - - [192, 384, 64, 576]
    - [279, 9468.75]
  - - [512, 512, 64, 800]
    - [254, 10096.4]
  - - [512, 24, 36, 800]
    - [207, 4761.77]
  - - [64, 64, 64, 13216]
    - [266, 8491.41]
  - - [192, 224, 64, 1152]
    - [224, 8769.06]
  - - [256, 256, 64, 1152]
    - [244, 9988.09]
  - - [512, 486, 64, 512]
    - [254, 9254.67]
  - - [128, 128, 36, 784]
    - [219, 7468.06]
  - - [256, 512, 64, 1600]
    - [241, 10232.5]
  - - [512, 512, 64, 9]
    - [236, 2599.78]
  - - [96, 128, 64, 288]
    - [247, 6599.43]
  - - [64, 96, 36, 512]
    - [247, 5073.75]
  - - [256, 512, 36, 1568]
    - [279, 9637.81]
  - - [128, 128, 64, 400]
    - [279, 8192.0]
  - - [128, 128, 64, 800]
    - [279, 8716.34]
  - - [96, 128, 36, 512]
    - [267, 6756.93]
  - - [16, 32, 36, 360]
    - [231, 754.036]
  - - [128, 256, 64, 3200]
    - [244, 10222.5]
  - - [96, 128, 64, 800]
    - [247, 7967.9]
  - - [256, 512, 64, 4]
    - [211, 1097.99]
  - - [256, 256, 64, 450]
    - [254, 9347.45]
  - - [64, 64, 64, 3200]
    - [265, 8518.08]
  - - [192, 224, 64, 128]
    - [227, 7035.17]
  - - [128, 128, 64, 288]
    - [279, 7751.28]
  - - [256, 256, 64, 72]
    - [236, 7489.83]
  - - [96, 208, 36, 512]
    - [247, 6939.11]
  - - [128, 256, 36, 3136]
    - [224, 8669.33]
  - - [64, 64, 36, 3520]
    - [219, 6007.47]
  - - [64, 128, 36, 1568]
    - [280, 6897.7]
  - - [160, 320, 64, 242]
    - [208, 7873.17]
  - - [192, 192, 36, 512]
    - [219, 7707.32]
  - - [512, 512, 36, 512]
    - [279, 9582.42]
  - - [1, 16, 64, 10240]
    - [232, 71.3511]
  - - [128, 128, 36, 512]
    - [219, 7149.38]
  - - [512, 512, 36, 256]
    - [210, 9384.4]
  - - [512, 512, 36, 1024]
    - [204, 9777.89]
  - - [96, 208, 64, 1152]
    - [280, 7850.9]
  - - [128, 192, 64, 3200]
    - [210, 9490.82]
  - - [256, 256, 36, 4096]
    - [215, 9585.46]
  - - [160, 160, 64, 288]
    - [247, 7299.8]
  - - [256, 256, 64, 896]
    - [244, 9850.33]
  - - [128, 256, 64, 242]
    - [279, 8391.38]
  - - [128, 128, 36, 440]
    - [224, 6274.72]
  - - [96, 128, 36, 1568]
    - [267, 7875.03]
  - - [192, 384, 36, 1024]
    - [215, 8715.72]
  - - [64, 96, 36, 10368]
    - [284, 7478.59]
  - - [128, 256, 64, 100]
    - [229, 7084.97]
  - - [112, 224, 36, 2048]
    - [223, 7555.92]
  - - [384, 256, 64, 1152]
    - [244, 10102.3]
  - - [192, 384, 36, 128]
    - [279, 7543.04]
  - - [128, 128, 36, 7040]
    - [252, 7600.6]
  - - [128, 256, 64, 1568]
    - [244, 10005.9]
  - - [128, 128, 36, 1568]
    - [237, 7848.3]
  - - [128, 256, 64, 72]
    - [259, 6553.6]
  - - [256, 256, 36, 12544]
    - [273, 9365.04]
  - - [256, 256, 36, 105]
    - [236, 7286.06]
  - - [128, 256, 36, 392]
    - [224, 7625.69]
  - - [64, 64, 64, 5408]
    - [265, 8882.67]
  - - [3, 64, 36, 25088]
    - [233, 528.942]
  - - [384, 256, 36, 1024]
    - [279, 9182.75]
  - - [35, 96, 36, 13440]
    - [286, 4110.29]
  - - [128, 256, 64, 1152]
    - [244, 9804.87]
  - - [256, 324, 64, 32]
    - [257, 5043.63]
  - - [160, 224, 64, 128]
    - [271, 6046.15]
  - - [192, 224, 36, 2592]
    - [269, 8878.68]
  - - [96, 96, 64, 1152]
    - [247, 8035.45]
  - - [32, 64, 36, 90]
    - [206, 964.465]
  - - [64, 128, 64, 2888]
    - [221, 9047.23]
  - - [256, 384, 36, 800]
    - [279, 9154.02]
  - - [512, 512, 64, 4]
    - [276, 1233.62]
  - - [192, 320, 36, 128]
    - [218, 7388.19]
  - - [64, 128, 36, 480]
    - [280, 5653.27]
  - - [192, 384, 64, 242]
    - [279, 9079.99]
  - - [256, 486, 64, 32]
    - [272, 5909.18]
  - - [147, 64, 64, 9702]
    - [281, 7319.69]
  - - [512, 512, 64, 64]
    - [217, 8179.02]
  - - [64, 192, 64, 3698]
    - [210, 9287.89]
  - - [73, 192, 64, 10439]
    - [239, 6668.02]
  - - [1, 16, 36, 1440]
    - [255, 33.4452]
  - - [128, 256, 36, 512]
    - [224, 7989.15]
  - - [512, 512, 64, 576]
    - [254, 9951.89]
  - - [64, 64, 36, 12544]
    - [270, 5872.77]
  - - [128, 128, 36, 880]
    - [267, 7597.26]
  - - [192, 224, 36, 128]
    - [227, 6451.2]
  - - [64, 64, 64, 800]
    - [265, 6916.73]
  - - [64, 128, 36, 12544]
    - [243, 6395.88]
  - - [64, 64, 36, 1568]
    - [219, 5536.66]
  - - [160, 160, 36, 512]
    - [219, 7345.26]
  - - [512, 24, 64, 512]
    - [209, 5242.88]
  - - [3, 64, 36, 3136]
    - [233, 475.352]
  - - [256, 256, 64, 9]
    - [257, 2106.51]
  - - [3, 64, 64, 11552]
    - [260, 785.127]
  - - [128, 256, 36, 12544]
    - [275, 8792.13]
  - - [128, 128, 36, 3136]
    - [237, 8098.46]
  - - [256, 512, 36, 3136]
    - [221, 9694.39]
  - - [64, 64, 36, 196]
    - [234, 2757.76]
  - - [144, 288, 36, 512]
    - [267, 7077.89]
  - - [256, 24, 64, 32]
    - [246, 1483.83]
  - - [384, 384, 36, 800]
    - [210, 9246.5]
  - - [512, 512, 64, 1600]
    - [254, 10277.3]
  - - [112, 224, 36, 512]
    - [224, 6744.78]
  - - [128, 128, 36, 49]
    - [229, 2716.29]
  - - [512, 512, 36, 4]
    - [256, 1156.52]
  - - [35, 96, 64, 4235]
    - [219, 4631.28]
  - - [192, 384, 64, 450]
    - [210, 9372.2]
  - - [256, 256, 36, 1024]
    - [279, 9346.64]
  - - [112, 224, 64, 1152]
    - [224, 7523.95]
  - - [256, 512, 64, 400]
    - [241, 9597.95]
  - - [149, 32, 36, 19072]
    - [286, 5811.8]
  - - [128, 256, 36, 6272]
    - [224, 8754.68]
  - - [128, 192, 36, 1568]
    - [247, 8195.1]
  - - [256, 256, 36, 512]
    - [279, 9074.22]
  - - [256, 256, 64, 112]
    - [279, 8305.55]
  - - [512, 512, 64, 18]
    - [272, 4324.02]
  - - [256, 256, 64, 18]
    - [236, 3547.81]
  - - [256, 256, 64, 1568]
    - [244, 10141.7]
  - - [64, 96, 36, 1568]
    - [265, 6805.66]
  - - [384, 256, 36, 4096]
    - [279, 9311.1]
  - - [256, 512, 64, 800]
    - [254, 9998.35]
  - - [256, 384, 36, 2048]
    - [279, 9285.34]
  - - [3, 64, 36, 200704]
    - [261, 547.375]
  - - [384, 384, 64, 2304]
    - [204, 9901.68]
  - - [160, 320, 64, 128]
    - [238, 7113.81]
  - - [512, 512, 36, 528]
    - [210, 9567.65]
  - - [160, 320, 36, 128]
    - [239, 6411.13]
  - - [96, 96, 64, 800]
    - [247, 7690.01]
  - - [256, 512, 36, 49]
    - [236, 6721.25]
  - - [384, 384, 64, 450]
    - [210, 9523.53]
  - - [3, 64, 64, 23104]
    - [260, 801.621]
  - - [256, 256, 64, 3200]
    - [244, 10300.4]
  - - [128, 192, 36, 512]
    - [224, 7499.75]
  - - [192, 192, 64, 288]
    - [279, 8774.24]
  - - [96, 208, 64, 242]
    - [239, 5901.99]
  - - [256, 16, 36, 3200]
    - [268, 3807.77]
  - - [512, 512, 64, 8]
    - [246, 2379.75]
  - - [64, 128, 64, 5776]
    - [221, 9332.74]
  - - [512, 512, 64, 288]
    - [210, 9521.99]
  - - [256, 16, 36, 32]
    - [264, 766.005]
  - - [128, 192, 64, 288]
    - [279, 8527.58]
  - - [32, 64, 64, 640]
    - [247, 4660.34]
  - - [64, 64, 36, 392]
    - [247, 3686.4]
  - - [384, 384, 36, 1024]
    - [215, 9282.48]
  - - [64, 64, 36, 11552]
    - [277, 5904.78]
  - - [96, 128, 36, 6272]
    - [267, 8350.99]
  - - [128, 256, 36, 16]
    - [249, 2144.81]
  - - [256, 256, 64, 288]
    - [279, 9140.13]
  - - [64, 64, 64, 1652]
    - [265, 7766.53]
  - - [256, 384, 36, 1024]
    - [215, 9203.27]
  - - [96, 128, 64, 3200]
    - [282, 8866.2]
  - - [256, 324, 36, 3200]
    - [223, 8194.25]
  - - [128, 192, 64, 800]
    - [279, 9198.03]
  - - [64, 128, 64, 10]
    - [222, 851.117]
  - - [96, 208, 64, 288]
    - [247, 6667.58]
  - - [64, 96, 36, 2592]
    - [230, 7216.88]
  - - [64, 128, 64, 160]
    - [258, 5190.97]
  - - [192, 384, 64, 512]
    - [210, 9446.04]
  - - [64, 64, 36, 6272]
    - [219, 6212.01]
  - - [512, 24, 36, 288]
    - [216, 3922.47]
  - - [128, 128, 64, 1568]
    - [210, 9037.86]
  - - [112, 224, 64, 242]
    - [278, 6399.26]
  - - [128, 256, 64, 1600]
    - [244, 10010.3]
  - - [32, 32, 64, 20000]
    - [214, 4378.41]
  - - [160, 192, 64, 288]
    - [239, 7803.63]
  - - [512, 24, 64, 128]
    - [202, 3733.8]
  - - [512, 512, 36, 32]
    - [236, 5935.34]
  - - [3, 64, 36, 100352]
    - [233, 542.783]
  - - [3, 64, 64, 1444]
    - [261, 674.159]
  - - [512, 512, 36, 3136]
    - [204, 9921.1]
  - - [128, 256, 64, 6400]
    - [262, 10349.3]
  - - [256, 256, 36, 2048]
    - [279, 9518.99]
  - - [128, 160, 64, 288]
    - [224, 7549.75]
  - - [256, 256, 64, 6400]
    - [244, 10392.6]
  - - [32, 64, 64, 20000]
    - [270, 6493.86]
  - - [256, 256, 36, 1680]
    - [221, 9513.29]
  - - [128, 128, 64, 210]
    - [279, 7094.1]
  - - [192, 384, 36, 2048]
    - [210, 8818.65]
  - - [256, 256, 64, 144]
    - [279, 8608.61]
  - - [384, 384, 36, 4096]
    - [215, 9356.94]
  - - [160, 320, 64, 1152]
    - [239, 8749.48]
  - - [384, 256, 36, 2048]
    - [279, 9279.63]
  - - [256, 512, 36, 392]
    - [279, 9252.14]
  - - [256, 512, 64, 50]
    - [236, 7511.29]
  - - [73, 192, 36, 23360]
    - [283, 5802.93]
  - - [3, 64, 36, 50176]
    - [233, 542.037]
  - - [384, 384, 36, 2048]
    - [210, 9325.8]
  - - [256, 384, 64, 450]
    - [254, 9528.66]
  - - [192, 320, 64, 128]
    - [215, 8399.81]
  - - [128, 256, 36, 32]
    - [229, 3276.8]
  - - [160, 192, 36, 512]
    - [267, 7752.34]
  - - [512, 512, 64, 256]
    - [221, 9473.64]
  - - [256, 512, 64, 32]
    - [257, 6391.32]
  - - [384, 384, 64, 576]
    - [210, 9614.79]
  - - [64, 64, 64, 648]
    - [265, 6282.15]
  - - [512, 486, 36, 288]
    - [279, 8624.93]
  - - [32, 64, 36, 1440]
    - [219, 3961.5]
  - - [144, 288, 64, 242]
    - [239, 6347.02]
  - - [384, 256, 64, 576]
    - [244, 9775.24]
  - - [512, 512, 36, 64]
    - [217, 7791.28]
  - - [448, 384, 64, 128]
    - [210, 9132.23]
  - - [64, 128, 64, 722]
    - [258, 8047.11]
  - - [144, 288, 64, 288]
    - [267, 6859.4]
  - - [512, 512, 64, 224]
    - [279, 9427.29]
  - - [112, 224, 64, 288]
    - [278, 6736.92]
  - - [384, 384, 64, 1152]
    - [204, 9820.46]
  - - [448, 384, 36, 128]
    - [279, 8761.31]
  - - [64, 64, 64, 100]
    - [227, 2708.1]
  - - [256, 486, 36, 128]
    - [251, 7640.04]
  - - [64, 96, 64, 4608]
    - [280, 8351.49]
  - - [16, 32, 64, 160]
    - [206, 736.36]
  - - [64, 192, 36, 6272]
    - [280, 8041.19]
  - - [64, 64, 64, 200]
    - [234, 3924.31]
  - - [256, 256, 36, 800]
    - [279, 9299.55]
  - - [64, 128, 36, 6272]
    - [277, 6816.36]
  - - [32, 64, 64, 40]
    - [226, 885.622]
  - - [256, 16, 64, 32]
    - [274, 1205.26]
  - - [192, 384, 36, 800]
    - [215, 8673.88]
  - - [128, 128, 36, 3200]
    - [247, 8538.89]
  - - [256, 256, 36, 256]
    - [221, 8454.36]
  - - [192, 384, 64, 1152]
    - [210, 9589.01]
  - - [128, 256, 64, 200]
    - [220, 8141.12]
  - - [64, 96, 64, 1152]
    - [247, 7620.88]
  - - [128, 128, 36, 392]
    - [224, 6175.51]
  - - [80, 192, 36, 10368]
    - [270, 6497.16]
  - - [224, 224, 36, 128]
    - [280, 5826.89]
  - - [512, 512, 64, 28]
    - [236, 5728.81]
  - - [256, 16, 64, 1568]
    - [250, 4637.2]
  - - [144, 288, 64, 1152]
    - [267, 7784.24]
  - - [256, 256, 64, 576]
    - [244, 9596.12]
  - - [64, 128, 36, 784]
    - [280, 6058.99]
  - - [256, 24, 36, 128]
    - [216, 2239.84]
  - - [256, 256, 64, 2304]
    - [244, 10225.7]
  - - [192, 384, 36, 512]
    - [279, 8549.03]
  - - [16, 32, 64, 2560]
    - [233, 2153.13]
  - - [256, 512, 36, 32]
    - [257, 5702.23]
  - - [512, 512, 64, 128]
    - [279, 9084.11]
  - - [128, 128, 64, 200]
    - [218, 6971.91]
  - - [512, 512, 64, 32]
    - [229, 6248.5]
  - - [128, 256, 36, 196]
    - [229, 6628.76]
  - - [8, 384, 64, 6600]
    - [260, 2733.89]
  - - [149, 32, 64, 8195]
    - [224, 6050.91]
  - - [35, 96, 64, 6160]
    - [267, 4689.35]
  - - [64, 64, 36, 1760]
    - [219, 5622.24]
  - - [196, 528, 32, 32]
    - [300, 4088.41]
  - - [5329, 64, 32, 80]
    - [293, 8331.14]
  - - [64, 2880, 1, 320]
    - [338, 4362.6]
  - - [49, 832, 32, 256]
    - [305, 5618.63]
  - - [196, 512, 32, 24]
    - [294, 3621.73]
  - - [289, 1120, 1, 160]
    - [290, 3302.86]
  - - [1225, 192, 32, 32]
    - [298, 6194.57]
  - - [64, 2048, 32, 384]
    - [318, 9541.54]
  - - [1001, 1536, 1, 32]
    - [292, 3575.67]
  - - [289, 1792, 1, 320]
    - [313, 5140.33]
  - - [1001, 1024, 1, 32]
    - [287, 2733.4]
  - - [196, 480, 32, 64]
    - [342, 5070.42]
  - - [64, 1728, 1, 320]
    - [339, 3205.57]
  - - [49, 832, 32, 160]
    - [343, 4988.82]
  - - [49, 832, 32, 384]
    - [305, 5901.95]
  - - [289, 896, 1, 192]
    - [329, 3452.59]
  - - [289, 1024, 32, 384]
    - [346, 8902.42]
  - - [784, 192, 32, 96]
    - [356, 7853.63]
  - - [50176, 256, 1, 128]
    - [322, 9041.83]
  - - [289, 1024, 32, 256]
    - [354, 8660.72]
  - - [289, 1024, 32, 192]
    - [344, 8433.35]
  - - [12544, 512, 1, 256]
    - [308, 9187.34]
  - - [1225, 1728, 1, 192]
    - [312, 7720.85]
  - - [196, 480, 32, 96]
    - [353, 5662.5]
  - - [196, 512, 32, 144]
    - [347, 6531.38]
  - - [784, 400, 1, 32]
    - [288, 1280.0]
  - - [289, 768, 32, 128]
    - [348, 7913.61]
  - - [5329, 576, 1, 96]
    - [297, 7563.46]
  - - [49, 1200, 1, 128]
    - [336, 1011.61]
  - - [64, 1536, 32, 256]
    - [349, 9159.54]
  - - [289, 2592, 1, 384]
    - [319, 6002.71]
  - - [196, 528, 32, 128]
    - [352, 5987.1]
  - - [64, 2048, 32, 448]
    - [318, 9669.87]
  - - [5329, 448, 1, 64]
    - [293, 6201.02]
  - - [784, 256, 32, 64]
    - [295, 7623.18]
  - - [784, 192, 32, 32]
    - [300, 5874.26]
  - - [21609, 288, 1, 32]
    - [311, 5296.5]
  - - [784, 256, 32, 32]
    - [291, 6235.46]
  - - [5041, 720, 1, 192]
    - [307, 8140.98]
  - - [289, 2016, 1, 256]
    - [304, 5404.05]
  - - [196, 512, 32, 128]
    - [345, 6366.82]
  - - [289, 768, 32, 160]
    - [347, 8253.88]
  - - [64, 1536, 32, 384]
    - [320, 9508.5]
  - - [64, 1280, 32, 320]
    - [320, 9070.73]
  - - [289, 896, 1, 128]
    - [330, 2917.68]
  - - [289, 3456, 1, 384]
    - [312, 7274.91]
  - - [196, 800, 1, 64]
    - [332, 1393.78]
  - - [64, 1280, 32, 384]
    - [317, 9225.01]
  - - [64, 1344, 1, 512]
    - [334, 3041.45]
  - - [1001, 4096, 1, 512]
    - [317, 9391.77]
  - - [1225, 192, 32, 64]
    - [293, 7729.29]
  - - [64, 1152, 1, 384]
    - [337, 2440.65]
  - - [729, 1600, 1, 192]
    - [303, 6827.71]
  - - [289, 1344, 1, 192]
    - [302, 4439.04]
  - - [784, 192, 32, 16]
    - [326, 3663.04]
  - - [3136, 1024, 1, 2048]
    - [310, 9071.77]
  - - [64, 1152, 1, 448]
    - [335, 2564.45]
  - - [49, 832, 32, 128]
    - [302, 4733.16]
  - - [784, 256, 32, 128]
    - [314, 8471.6]
  - - [49, 800, 1, 128]
    - [333, 633.535]
  - - [196, 512, 32, 32]
    - [300, 4354.26]
  - - [1225, 384, 32, 96]
    - [315, 8751.63]
  - - [5041, 576, 1, 96]
    - [299, 7067.63]
  - - [49, 832, 32, 48]
    - [328, 3316.72]
  - - [5329, 160, 32, 64]
    - [350, 8159.84]
  - - [1225, 288, 32, 48]
    - [340, 6673.65]
  - - [4096, 9216, 1, 512]
    - [324, 10116.9]
  - - [196, 480, 32, 192]
    - [351, 6388.46]
  - - [64, 1152, 1, 256]
    - [338, 1982.6]
  - - [3136, 1024, 1, 512]
    - [310, 8745.57]
  - - [49, 832, 32, 32]
    - [327, 2717.87]
  - - [784, 192, 32, 64]
    - [295, 7216.32]
  - - [289, 1024, 32, 128]
    - [316, 7970.5]
  - - [289, 768, 32, 192]
    - [355, 8327.27]
  - - [289, 1120, 1, 192]
    - [301, 3716.9]
  - - [196, 512, 32, 112]
    - [306, 6252.81]
  - - [1001, 2048, 1, 32]
    - [296, 4000.09]
  - - [1225, 288, 32, 64]
    - [350, 7208.04]
  - - [196, 600, 1, 64]
    - [331, 1093.95]
  - - [1225, 384, 32, 192]
    - [315, 9332.66]
  - - [50176, 256, 1, 512]
    - [323, 9833.54]
  - - [196, 512, 32, 160]
    - [348, 6614.34]
  - - [4096, 4096, 1, 512]
    - [321, 10032.2]
  - - [49, 832, 32, 192]
    - [302, 5244.53]
  - - [1225, 256, 32, 64]
    - [293, 7972.35]
  - - [64, 2048, 32, 320]
    - [318, 9404.27]
  - - [196, 480, 32, 16]
    - [341, 2724.49]
  - - [1225, 256, 32, 48]
    - [295, 7100.38]
  - - [64, 1280, 32, 448]
    - [317, 9344.41]
  - - [1225, 1200, 1, 64]
    - [289, 5157.89]
  - - [1225, 384, 32, 64]
    - [293, 8219.96]
  - - [12544, 512, 1, 1024]
    - [310, 9672.72]
  - - [64, 1280, 32, 192]
    - [306, 8525.01]
  - - [196, 512, 32, 64]
    - [293, 5489.34]
  - - [289, 1792, 1, 256]
    - [309, 4831.61]
  - - [196, 528, 32, 256]
    - [325, 6453.82]
  - - [64, 2048, 32, 192]
    - [314, 8955.81]
  - - [196, 528, 32, 160]
    - [351, 6161.15]
  - - [1225, 192, 32, 48]
    - [293, 7236.92]
  - - [64, 1728, 1, 192]
    - [337, 2480.57]
  - - [1001, 2048, 1, 64]
    - [361, 5714.42]
  - - [5329, 64, 128, 80]
    - [368, 8835.29]
  - - [64, 1280, 128, 448]
    - [366, 10020.5]
  - - [289, 768, 128, 128]
    - [369, 8542.71]
  - - [1225, 192, 128, 64]
    - [358, 8444.77]
  - - [1225, 288, 128, 48]
    - [371, 7244.66]
  - - [289, 768, 128, 192]
    - [373, 8794.49]
  - - [289, 768, 128, 160]
    - [370, 8705.33]
  - - [64, 2048, 128, 192]
    - [364, 9780.26]
  - - [64, 1280, 128, 384]
    - [367, 9950.9]
  - - [1225, 256, 128, 48]
    - [359, 8273.61]
  - - [1225, 192, 128, 48]
    - [359, 8140.32]
  - - [1225, 288, 128, 64]
    - [371, 7886.21]
  - - [64, 1280, 128, 320]
    - [363, 9894.56]
  - - [1225, 256, 128, 64]
    - [364, 8572.51]
  - - [1001, 2048, 1, 128]
    - [365, 7289.06]
  - - [1225, 192, 128, 32]
    - [360, 7104.57]
  - - [64, 1280, 128, 192]
    - [372, 9642.08]
  - - [1001, 1536, 1, 64]
    - [362, 5146.56]
  - - [2048, 2048, 1, 1024]
    - [376, 9940.21]
  - - [3200, 2048, 1, 1024]
    - [375, 9899.24]
  - - [4096, 4096, 1, 1024]
    - [377, 10222.2]
  - - [2048, 256, 1, 1024]
    - [374, 8452.0]
  - - [257, 4096, 1, 1024]
    - [375, 8353.5]
  - - [65, 1024, 1, 6400]
    - [385, 3556.98]
  - - [256, 4096, 1, 6400]
    - [386, 10132.4]
  - - [1024, 4096, 1, 64]
    - [387, 6918.44]
  - - [1024, 4096, 1, 6336]
    - [388, 10393.9]
  - - [512, 2048, 1, 2790]
    - [394, 9862.21]
  - - [512, 2048, 1, 3509]
    - [398, 9976.82]
  - - [512, 2048, 1, 3528]
    - [395, 9998.31]
  - - [2048, 512, 1, 3364]
    - [397, 9984.74]
  - - [2048, 512, 1, 3418]
    - [395, 9988.94]
  - - [2048, 512, 1, 3487]
    - [397, 10005.4]
  - - [2048, 512, 1, 4032]
    - [395, 10047.2]
  - - [512, 512, 1, 3977]
    - [403, 8746.2]
  - - [512, 512, 1, 4032]
    - [403, 8849.34]
  - - [64, 38, 840, 38]
    - [416, 3041.91]
  - - [64, 49, 648, 49]
    - [407, 3715.46]
  - - [512, 2048, 1, 2864]
    - [397, 9944.11]
  - - [512, 2048, 1, 3092]
    - [397, 9947.83]
  - - [512, 2048, 1, 3113]
    - [394, 9978.65]
  - - [512, 2048, 1, 3137]
    - [395, 9960.58]
  - - [512, 2048, 1, 3165]
    - [397, 9967.39]
  - - [512, 2048, 1, 3166]
    - [395, 9953.82]
  - - [512, 2048, 1, 3194]
    - [395, 9955.88]
  - - [512, 2048, 1, 3219]
    - [395, 9979.22]
  - - [512, 2048, 1, 3222]
    - [395, 9972.01]
  - - [512, 2048, 1, 3234]
    - [393, 9966.77]
  - - [512, 2048, 1, 3237]
    - [395, 9954.97]
  - - [512, 2048, 1, 3242]
    - [397, 9960.98]
  - - [512, 2048, 1, 3246]
    - [395, 9959.28]
  - - [512, 2048, 1, 3249]
    - [395, 9966.13]
  - - [512, 2048, 1, 3251]
    - [395, 9976.94]
  - - [512, 2048, 1, 3257]
    - [397, 9967.35]
  - - [512, 2048, 1, 3262]
    - [397, 9947.81]
  - - [512, 2048, 1, 3268]
    - [395, 9954.53]
  - - [512, 2048, 1, 3282]
    - [397, 9962.46]
  - - [512, 2048, 1, 3286]
    - [394, 9942.35]
  - - [512, 2048, 1, 3287]
    - [397, 9961.47]
  - - [512, 2048, 1, 3293]
    - [397, 9956.65]
  - - [512, 2048, 1, 3297]
    - [395, 9980.24]
  - - [512, 2048, 1, 3307]
    - [395, 9982.84]
  - - [512, 2048, 1, 3314]
    - [394, 9971.82]
  - - [512, 2048, 1, 3315]
    - [397, 9984.0]
  - - [512, 2048, 1, 3319]
    - [395, 9970.84]
  - - [512, 2048, 1, 3322]
    - [395, 9973.01]
  - - [512, 2048, 1, 3323]
    - [395, 9976.0]
  - - [512, 2048, 1, 3324]
    - [397, 9958.48]
  - - [512, 2048, 1, 3325]
    - [394, 9972.87]
  - - [512, 2048, 1, 3327]
    - [395, 9976.59]
  - - [512, 2048, 1, 3329]
    - [395, 9982.58]
  - - [512, 2048, 1, 3332]
    - [395, 9984.73]
  - - [512, 2048, 1, 3336]
    - [395, 9976.19]
  - - [512, 2048, 1, 3339]
    - [395, 9992.0]
  - - [512, 2048, 1, 3342]
    - [395, 9975.92]
  - - [512, 2048, 1, 3344]
    - [395, 9970.54]
  - - [512, 2048, 1, 3358]
    - [394, 9964.68]
  - - [512, 2048, 1, 3360]
    - [397, 9993.24]
  - - [512, 2048, 1, 3364]
    - [395, 9964.43]
  - - [512, 2048, 1, 3365]
    - [397, 9980.93]
  - - [512, 2048, 1, 3369]
    - [397, 9986.01]
  - - [512, 2048, 1, 3371]
    - [395, 9967.15]
  - - [512, 2048, 1, 3374]
    - [393, 9958.05]
  - - [512, 2048, 1, 3376]
    - [393, 9979.68]
  - - [512, 2048, 1, 3377]
    - [397, 9978.14]
  - - [512, 2048, 1, 3378]
    - [395, 9969.85]
  - - [512, 2048, 1, 3381]
    - [393, 9971.97]
  - - [512, 2048, 1, 3382]
    - [397, 9979.41]
  - - [512, 2048, 1, 3383]
    - [395, 9980.12]
  - - [512, 2048, 1, 3384]
    - [397, 10001.1]
  - - [512, 2048, 1, 3385]
    - [393, 9968.07]
  - - [512, 2048, 1, 3386]
    - [393, 9991.22]
  - - [512, 2048, 1, 3388]
    - [395, 9965.71]
  - - [512, 2048, 1, 3390]
    - [397, 9980.55]
  - - [512, 2048, 1, 3391]
    - [395, 9972.29]
  - - [512, 2048, 1, 3396]
    - [397, 9989.24]
  - - [512, 2048, 1, 3399]
    - [394, 9955.61]
  - - [512, 2048, 1, 3402]
    - [395, 9980.01]
  - - [512, 2048, 1, 3410]
    - [393, 9978.91]
  - - [512, 2048, 1, 3412]
    - [395, 9987.0]
  - - [512, 2048, 1, 3414]
    - [397, 9970.58]
  - - [512, 2048, 1, 3415]
    - [394, 9973.5]
  - - [512, 2048, 1, 3418]
    - [395, 9971.16]
  - - [512, 2048, 1, 3420]
    - [397, 9990.33]
  - - [512, 2048, 1, 3422]
    - [394, 9989.5]
  - - [512, 2048, 1, 3425]
    - [397, 9976.05]
  - - [512, 2048, 1, 3426]
    - [395, 9976.73]
  - - [512, 2048, 1, 3427]
    - [395, 9975.21]
  - - [512, 2048, 1, 3428]
    - [395, 9975.91]
  - - [512, 2048, 1, 3430]
    - [395, 9977.3]
  - - [512, 2048, 1, 3431]
    - [397, 9962.52]
  - - [512, 2048, 1, 3432]
    - [397, 10003.1]
  - - [512, 2048, 1, 3438]
    - [395, 9989.48]
  - - [512, 2048, 1, 3439]
    - [395, 9972.49]
  - - [512, 2048, 1, 3440]
    - [395, 10015.3]
  - - [512, 2048, 1, 3443]
    - [395, 9997.38]
  - - [512, 2048, 1, 3445]
    - [395, 9998.74]
  - - [512, 2048, 1, 3447]
    - [393, 9971.42]
  - - [512, 2048, 1, 3448]
    - [393, 9983.13]
  - - [512, 2048, 1, 3450]
    - [395, 9980.1]
  - - [512, 2048, 1, 3451]
    - [397, 9980.79]
  - - [512, 2048, 1, 3452]
    - [397, 9981.48]
  - - [512, 2048, 1, 3453]
    - [394, 9975.57]
  - - [512, 2048, 1, 3455]
    - [395, 9981.35]
  - - [512, 2048, 1, 3456]
    - [393, 10012.9]
  - - [512, 2048, 1, 3457]
    - [397, 9982.73]
  - - [512, 2048, 1, 3458]
    - [395, 10003.2]
  - - [512, 2048, 1, 3459]
    - [395, 9988.5]
  - - [512, 2048, 1, 3460]
    - [397, 9969.42]
  - - [512, 2048, 1, 3461]
    - [393, 9996.48]
  - - [512, 2048, 1, 3462]
    - [394, 9983.97]
  - - [512, 2048, 1, 3466]
    - [397, 9993.3]
  - - [512, 2048, 1, 3467]
    - [394, 9989.59]
  - - [512, 2048, 1, 3468]
    - [398, 9983.7]
  - - [512, 2048, 1, 3470]
    - [395, 9993.84]
  - - [512, 2048, 1, 3471]
    - [397, 9985.75]
  - - [512, 2048, 1, 3472]
    - [394, 10010.6]
  - - [512, 2048, 1, 3475]
    - [395, 9990.68]
  - - [512, 2048, 1, 3476]
    - [395, 9989.18]
  - - [512, 2048, 1, 3477]
    - [397, 9989.86]
  - - [512, 2048, 1, 3478]
    - [395, 9973.06]
  - - [512, 2048, 1, 3479]
    - [397, 9971.56]
  - - [512, 2048, 1, 3480]
    - [397, 9996.29]
  - - [512, 2048, 1, 3481]
    - [394, 9979.48]
  - - [512, 2048, 1, 3483]
    - [395, 9998.33]
  - - [512, 2048, 1, 3484]
    - [397, 10003.4]
  - - [512, 2048, 1, 3487]
    - [393, 9974.86]
  - - [512, 2048, 1, 3489]
    - [397, 9982.76]
  - - [512, 2048, 1, 3490]
    - [395, 9983.44]
  - - [512, 2048, 1, 3491]
    - [397, 9999.4]
  - - [512, 2048, 1, 3493]
    - [395, 9994.2]
  - - [512, 2048, 1, 3494]
    - [397, 9975.29]
  - - [512, 2048, 1, 3495]
    - [394, 9975.97]
  - - [512, 2048, 1, 3497]
    - [395, 9994.74]
  - - [512, 2048, 1, 3498]
    - [397, 10002.0]
  - - [512, 2048, 1, 3499]
    - [394, 10000.5]
  - - [512, 2048, 1, 3501]
    - [395, 9997.45]
  - - [512, 2048, 1, 3503]
    - [397, 9977.08]
  - - [512, 2048, 1, 3507]
    - [395, 9999.34]
  - - [512, 2048, 1, 3508]
    - [395, 9978.31]
  - - [512, 2048, 1, 3511]
    - [397, 9976.02]
  - - [512, 2048, 1, 3514]
    - [395, 9988.89]
  - - [512, 2048, 1, 3515]
    - [395, 9989.55]
  - - [512, 2048, 1, 3517]
    - [397, 9993.07]
  - - [512, 2048, 1, 3518]
    - [395, 9976.44]
  - - [512, 2048, 1, 3519]
    - [395, 9992.27]
  - - [512, 2048, 1, 3520]
    - [397, 10003.8]
  - - [512, 2048, 1, 3523]
    - [397, 9997.11]
  - - [512, 2048, 1, 3529]
    - [397, 9992.51]
  - - [512, 2048, 1, 3530]
    - [397, 9997.5]
  - - [512, 2048, 1, 3532]
    - [395, 10001.0]
  - - [512, 2048, 1, 3533]
    - [397, 9988.73]
  - - [512, 2048, 1, 3534]
    - [395, 10002.3]
  - - [512, 2048, 1, 3538]
    - [394, 9992.09]
  - - [512, 2048, 1, 3539]
    - [394, 9979.86]
  - - [512, 2048, 1, 3541]
    - [393, 9991.95]
  - - [512, 2048, 1, 3547]
    - [397, 9993.82]
  - - [512, 2048, 1, 3548]
    - [395, 9990.19]
  - - [512, 2048, 1, 3552]
    - [395, 9988.58]
  - - [512, 2048, 1, 3564]
    - [393, 9998.74]
  - - [512, 2048, 1, 3575]
    - [395, 9999.62]
  - - [512, 2048, 1, 3598]
    - [394, 9997.82]
  - - [512, 2048, 1, 3599]
    - [397, 9979.44]
  - - [512, 2048, 1, 3608]
    - [395, 10017.1]
  - - [512, 2048, 1, 3780]
    - [395, 9990.97]
  - - [512, 2048, 1, 3796]
    - [395, 10003.0]
  - - [512, 2048, 1, 3822]
    - [395, 10027.2]
  - - [512, 2048, 1, 3840]
    - [395, 10028.2]
  - - [512, 2048, 1, 3859]
    - [395, 10019.9]
  - - [512, 2048, 1, 3870]
    - [397, 10002.9]
  - - [512, 2048, 1, 3876]
    - [393, 10010.5]
  - - [512, 2048, 1, 3906]
    - [397, 10020.9]
  - - [512, 2048, 1, 3910]
    - [395, 10025.3]
  - - [512, 2048, 1, 3925]
    - [394, 10008.9]
  - - [512, 2048, 1, 3942]
    - [395, 10032.7]
  - - [512, 2048, 1, 3944]
    - [394, 10049.5]
  - - [512, 2048, 1, 3955]
    - [397, 10032.7]
  - - [512, 2048, 1, 3968]
    - [393, 10021.1]
  - - [512, 2048, 1, 3969]
    - [397, 10021.7]
  - - [512, 2048, 1, 3976]
    - [397, 10051.0]
  - - [512, 2048, 1, 3977]
    - [397, 10036.1]
  - - [512, 2048, 1, 3978]
    - [397, 10042.5]
  - - [512, 2048, 1, 3990]
    - [395, 10032.2]
  - - [512, 2048, 1, 3995]
    - [393, 10031.3]
  - - [512, 2048, 1, 3996]
    - [395, 10039.6]
  - - [512, 2048, 1, 3999]
    - [395, 10020.2]
  - - [512, 2048, 1, 4005]
    - [394, 10016.1]
  - - [512, 2048, 1, 4012]
    - [394, 10014.5]
  - - [512, 2048, 1, 4020]
    - [393, 10017.3]
  - - [512, 2048, 1, 4026]
    - [397, 10032.2]
  - - [512, 2048, 1, 4030]
    - [397, 10015.6]
  - - [512, 2048, 1, 4032]
    - [394, 10035.7]
  - - [512, 33708, 1, 3780]
    - [395, 10489.1]
  - - [512, 33708, 1, 3796]
    - [395, 10482.9]
  - - [512, 33708, 1, 3822]
    - [395, 10485.1]
  - - [512, 33708, 1, 3840]
    - [396, 10490.3]
  - - [512, 33708, 1, 3859]
    - [398, 10491.1]
  - - [512, 33708, 1, 3870]
    - [395, 10493.2]
  - - [512, 33708, 1, 3876]
    - [395, 10494.3]
  - - [512, 33708, 1, 3906]
    - [397, 10489.8]
  - - [512, 33708, 1, 3910]
    - [397, 10494.9]
  - - [512, 33708, 1, 3925]
    - [395, 10490.7]
  - - [512, 33708, 1, 3942]
    - [397, 10494.9]
  - - [512, 33708, 1, 3944]
    - [395, 10497.5]
  - - [512, 33708, 1, 3955]
    - [395, 10498.6]
  - - [512, 33708, 1, 3968]
    - [397, 10504.5]
  - - [512, 33708, 1, 3969]
    - [397, 10501.1]
  - - [512, 33708, 1, 3976]
    - [395, 10504.4]
  - - [512, 33708, 1, 3977]
    - [396, 10495.7]
  - - [512, 33708, 1, 3978]
    - [395, 10497.1]
  - - [512, 33708, 1, 3990]
    - [397, 10499.7]
  - - [512, 33708, 1, 3995]
    - [397, 10492.2]
  - - [512, 33708, 1, 3996]
    - [395, 10494.7]
  - - [512, 33708, 1, 3999]
    - [397, 10493.0]
  - - [512, 33708, 1, 4005]
    - [397, 10499.9]
  - - [512, 33708, 1, 4012]
    - [397, 10500.8]
  - - [512, 33708, 1, 4020]
    - [395, 10499.7]
  - - [512, 33708, 1, 4026]
    - [395, 10491.3]
  - - [512, 33708, 1, 4030]
    - [396, 10498.7]
  - - [512, 33708, 1, 4032]
    - [397, 10501.5]
  - - [2048, 512, 1, 2790]
    - [396, 9910.32]
  - - [2048, 512, 1, 2864]
    - [397, 9936.21]
  - - [2048, 512, 1, 3092]
    - [397, 9964.95]
  - - [2048, 512, 1, 3113]
    - [395, 9968.9]
  - - [2048, 512, 1, 3137]
    - [397, 9960.58]
  - - [2048, 512, 1, 3165]
    - [395, 9972.18]
  - - [2048, 512, 1, 3166]
    - [397, 9965.75]
  - - [2048, 512, 1, 3194]
    - [395, 9972.46]
  - - [2048, 512, 1, 3219]
    - [395, 9969.77]
  - - [2048, 512, 1, 3222]
    - [395, 9960.24]
  - - [2048, 512, 1, 3234]
    - [397, 9973.81]
  - - [2048, 512, 1, 3237]
    - [395, 9964.3]
  - - [2048, 512, 1, 3242]
    - [397, 9986.73]
  - - [2048, 512, 1, 3246]
    - [397, 9968.6]
  - - [2048, 512, 1, 3249]
    - [395, 9984.83]
  - - [2048, 512, 1, 3251]
    - [397, 9979.28]
  - - [2048, 512, 1, 3257]
    - [395, 9981.33]
  - - [2048, 512, 1, 3262]
    - [395, 9980.32]
  - - [2048, 512, 1, 3268]
    - [395, 9970.75]
  - - [2048, 512, 1, 3282]
    - [397, 9985.57]
  - - [2048, 512, 1, 3286]
    - [397, 9969.97]
  - - [2048, 512, 1, 3287]
    - [395, 9966.08]
  - - [2048, 512, 1, 3293]
    - [397, 9977.35]
  - - [2048, 512, 1, 3297]
    - [395, 9982.55]
  - - [2048, 512, 1, 3307]
    - [395, 9978.25]
  - - [2048, 512, 1, 3314]
    - [395, 9978.7]
  - - [2048, 512, 1, 3315]
    - [395, 9986.29]
  - - [2048, 512, 1, 3319]
    - [397, 9977.71]
  - - [2048, 512, 1, 3322]
    - [395, 9991.31]
  - - [2048, 512, 1, 3323]
    - [395, 9987.44]
  - - [2048, 512, 1, 3324]
    - [397, 9979.0]
  - - [2048, 512, 1, 3325]
    - [397, 9979.72]
  - - [2048, 512, 1, 3327]
    - [397, 9974.3]
  - - [2048, 512, 1, 3329]
    - [397, 9991.73]
  - - [2048, 512, 1, 3332]
    - [395, 9968.77]
  - - [2048, 512, 1, 3336]
    - [395, 10003.6]
  - - [2048, 512, 1, 3339]
    - [395, 9989.72]
  - - [2048, 512, 1, 3342]
    - [397, 9987.29]
  - - [2048, 512, 1, 3344]
    - [395, 10002.4]
  - - [2048, 512, 1, 3358]
    - [397, 9985.02]
  - - [2048, 512, 1, 3360]
    - [395, 9997.77]
  - - [2048, 512, 1, 3365]
    - [395, 9989.97]
  - - [2048, 512, 1, 3369]
    - [397, 9997.32]
  - - [2048, 512, 1, 3371]
    - [397, 9994.2]
  - - [2048, 512, 1, 3374]
    - [395, 9985.03]
  - - [2048, 512, 1, 3376]
    - [397, 9995.46]
  - - [2048, 512, 1, 3377]
    - [395, 9989.4]
  - - [2048, 512, 1, 3378]
    - [395, 10001.4]
  - - [2048, 512, 1, 3381]
    - [397, 9983.2]
  - - [2048, 512, 1, 3382]
    - [395, 9986.16]
  - - [2048, 512, 1, 3383]
    - [397, 9984.61]
  - - [2048, 512, 1, 3384]
    - [395, 10010.1]
  - - [2048, 512, 1, 3385]
    - [395, 9995.02]
  - - [2048, 512, 1, 3386]
    - [395, 9979.98]
  - - [2048, 512, 1, 3388]
    - [395, 9979.14]
  - - [2048, 512, 1, 3390]
    - [397, 9982.79]
  - - [2048, 512, 1, 3391]
    - [397, 9981.25]
  - - [2048, 512, 1, 3396]
    - [397, 9989.24]
  - - [2048, 512, 1, 3399]
    - [395, 9986.86]
  - - [2048, 512, 1, 3402]
    - [395, 9984.48]
  - - [2048, 512, 1, 3410]
    - [395, 9987.83]
  - - [2048, 512, 1, 3412]
    - [395, 9982.54]
  - - [2048, 512, 1, 3414]
    - [395, 9990.62]
  - - [2048, 512, 1, 3415]
    - [395, 9982.4]
  - - [2048, 512, 1, 3420]
    - [395, 9994.79]
  - - [2048, 512, 1, 3422]
    - [397, 9991.72]
  - - [2048, 512, 1, 3425]
    - [395, 9989.36]
  - - [2048, 512, 1, 3426]
    - [397, 9996.72]
  - - [2048, 512, 1, 3427]
    - [395, 9995.19]
  - - [2048, 512, 1, 3428]
    - [397, 9986.99]
  - - [2048, 512, 1, 3430]
    - [397, 9992.82]
  - - [2048, 512, 1, 3431]
    - [397, 9982.42]
  - - [2048, 512, 1, 3432]
    - [397, 10005.3]
  - - [2048, 512, 1, 3438]
    - [395, 9998.35]
  - - [2048, 512, 1, 3439]
    - [395, 9996.82]
  - - [2048, 512, 1, 3440]
    - [395, 10010.8]
  - - [2048, 512, 1, 3443]
    - [395, 9995.15]
  - - [2048, 512, 1, 3445]
    - [395, 9994.31]
  - - [2048, 512, 1, 3447]
    - [395, 9980.23]
  - - [2048, 512, 1, 3448]
    - [397, 10009.7]
  - - [2048, 512, 1, 3450]
    - [395, 9986.71]
  - - [2048, 512, 1, 3451]
    - [395, 9994.02]
  - - [2048, 512, 1, 3452]
    - [395, 9985.89]
  - - [2048, 512, 1, 3453]
    - [397, 9990.99]
  - - [2048, 512, 1, 3455]
    - [397, 9979.15]
  - - [2048, 512, 1, 3456]
    - [397, 10001.9]
  - - [2048, 512, 1, 3457]
    - [397, 9998.14]
  - - [2048, 512, 1, 3458]
    - [395, 9987.81]
  - - [2048, 512, 1, 3459]
    - [395, 9981.9]
  - - [2048, 512, 1, 3460]
    - [397, 9982.59]
  - - [2048, 512, 1, 3461]
    - [397, 9998.68]
  - - [2048, 512, 1, 3462]
    - [397, 9986.16]
  - - [2048, 512, 1, 3466]
    - [395, 10002.1]
  - - [2048, 512, 1, 3467]
    - [397, 9996.19]
  - - [2048, 512, 1, 3468]
    - [397, 9992.48]
  - - [2048, 512, 1, 3470]
    - [395, 9989.45]
  - - [2048, 512, 1, 3471]
    - [397, 9996.72]
  - - [2048, 512, 1, 3472]
    - [397, 9993.02]
  - - [2048, 512, 1, 3475]
    - [397, 9999.46]
  - - [2048, 512, 1, 3476]
    - [397, 9995.75]
  - - [2048, 512, 1, 3477]
    - [395, 9994.24]
  - - [2048, 512, 1, 3478]
    - [397, 9994.92]
  - - [2048, 512, 1, 3479]
    - [395, 9986.85]
  - - [2048, 512, 1, 3480]
    - [397, 10011.6]
  - - [2048, 512, 1, 3481]
    - [397, 9996.97]
  - - [2048, 512, 1, 3483]
    - [397, 10007.1]
  - - [2048, 512, 1, 3484]
    - [397, 9994.63]
  - - [2048, 512, 1, 3489]
    - [397, 10000.2]
  - - [2048, 512, 1, 3490]
    - [397, 9992.16]
  - - [2048, 512, 1, 3491]
    - [395, 9995.03]
  - - [2048, 512, 1, 3493]
    - [397, 9992.02]
  - - [2048, 512, 1, 3494]
    - [397, 9986.17]
  - - [2048, 512, 1, 3495]
    - [395, 9986.85]
  - - [2048, 512, 1, 3497]
    - [395, 9999.1]
  - - [2048, 512, 1, 3498]
    - [397, 9999.78]
  - - [2048, 512, 1, 3499]
    - [397, 10000.5]
  - - [2048, 512, 1, 3501]
    - [397, 9995.27]
  - - [2048, 512, 1, 3503]
    - [397, 9992.28]
  - - [2048, 512, 1, 3507]
    - [397, 9999.34]
  - - [2048, 512, 1, 3508]
    - [397, 9997.84]
  - - [2048, 512, 1, 3509]
    - [397, 10000.7]
  - - [2048, 512, 1, 3511]
    - [395, 9980.35]
  - - [2048, 512, 1, 3514]
    - [395, 10008.4]
  - - [2048, 512, 1, 3515]
    - [397, 9998.22]
  - - [2048, 512, 1, 3517]
    - [395, 10003.9]
  - - [2048, 512, 1, 3518]
    - [395, 9993.74]
  - - [2048, 512, 1, 3519]
    - [397, 10003.1]
  - - [2048, 512, 1, 3520]
    - [397, 10021.1]
  - - [2048, 512, 1, 3523]
    - [397, 9990.62]
  - - [2048, 512, 1, 3528]
    - [397, 10009.1]
  - - [2048, 512, 1, 3529]
    - [397, 10003.3]
  - - [2048, 512, 1, 3530]
    - [397, 10001.8]
  - - [2048, 512, 1, 3532]
    - [395, 9994.52]
  - - [2048, 512, 1, 3533]
    - [397, 9999.51]
  - - [2048, 512, 1, 3534]
    - [395, 9995.87]
  - - [2048, 512, 1, 3538]
    - [395, 10007.2]
  - - [2048, 512, 1, 3539]
    - [397, 9994.91]
  - - [2048, 512, 1, 3541]
    - [397, 10002.7]
  - - [2048, 512, 1, 3547]
    - [395, 10006.7]
  - - [2048, 512, 1, 3548]
    - [397, 10003.1]
  - - [2048, 512, 1, 3552]
    - [395, 10023.0]
  - - [2048, 512, 1, 3564]
    - [395, 10007.3]
  - - [2048, 512, 1, 3575]
    - [395, 9999.62]
  - - [2048, 512, 1, 3598]
    - [397, 10012.7]
  - - [2048, 512, 1, 3599]
    - [395, 9998.48]
  - - [2048, 512, 1, 3608]
    - [395, 10023.5]
  - - [2048, 512, 1, 3780]
    - [397, 10021.3]
  - - [2048, 512, 1, 3796]
    - [395, 10023.2]
  - - [2048, 512, 1, 3822]
    - [395, 10011.1]
  - - [2048, 512, 1, 3840]
    - [397, 10028.2]
  - - [2048, 512, 1, 3859]
    - [397, 10029.9]
  - - [2048, 512, 1, 3870]
    - [397, 10018.7]
  - - [2048, 512, 1, 3876]
    - [395, 10032.3]
  - - [2048, 512, 1, 3906]
    - [395, 10040.5]
  - - [2048, 512, 1, 3910]
    - [395, 10029.2]
  - - [2048, 512, 1, 3925]
    - [395, 10040.2]
  - - [2048, 512, 1, 3942]
    - [397, 10028.8]
  - - [2048, 512, 1, 3944]
    - [397, 10047.6]
  - - [2048, 512, 1, 3955]
    - [397, 10036.6]
  - - [2048, 512, 1, 3968]
    - [395, 10046.2]
  - - [2048, 512, 1, 3969]
    - [397, 10044.9]
  - - [2048, 512, 1, 3976]
    - [397, 10043.2]
  - - [2048, 512, 1, 3977]
    - [395, 10043.8]
  - - [2048, 512, 1, 3978]
    - [397, 10044.4]
  - - [2048, 512, 1, 3990]
    - [397, 10034.1]
  - - [2048, 512, 1, 3995]
    - [395, 10040.9]
  - - [2048, 512, 1, 3996]
    - [397, 10035.7]
  - - [2048, 512, 1, 3999]
    - [395, 10031.7]
  - - [2048, 512, 1, 4005]
    - [395, 10037.2]
  - - [2048, 512, 1, 4012]
    - [395, 10039.3]
  - - [2048, 512, 1, 4020]
    - [395, 10028.7]
  - - [2048, 512, 1, 4026]
    - [397, 10043.7]
  - - [2048, 512, 1, 4030]
    - [397, 10046.0]
  - - [512, 512, 1, 3780]
    - [405, 8679.96]
  - - [512, 512, 1, 3796]
    - [404, 8656.04]
  - - [512, 512, 1, 3822]
    - [405, 8691.14]
  - - [512, 512, 1, 3840]
    - [403, 8830.11]
  - - [512, 512, 1, 3859]
    - [401, 8661.08]
  - - [512, 512, 1, 3870]
    - [405, 8626.68]
  - - [512, 512, 1, 3876]
    - [404, 8759.23]
  - - [512, 512, 1, 3906]
    - [403, 8778.59]
  - - [512, 512, 1, 3910]
    - [403, 8793.61]
  - - [512, 512, 1, 3925]
    - [405, 8672.58]
  - - [512, 512, 1, 3927]
    - [402, 8659.48]
  - - [512, 512, 1, 3942]
    - [402, 8769.28]
  - - [512, 512, 1, 3944]
    - [401, 8732.23]
  - - [512, 512, 1, 3955]
    - [404, 8691.98]
  - - [512, 512, 1, 3968]
    - [400, 8845.13]
  - - [512, 512, 1, 3969]
    - [403, 8799.47]
  - - [512, 512, 1, 3976]
    - [404, 8755.75]
  - - [512, 512, 1, 3978]
    - [404, 8742.53]
  - - [512, 512, 1, 3990]
    - [405, 8670.05]
  - - [512, 512, 1, 3995]
    - [400, 8646.51]
  - - [512, 512, 1, 3996]
    - [403, 8654.39]
  - - [512, 512, 1, 3999]
    - [405, 8666.62]
  - - [512, 512, 1, 4005]
    - [405, 8760.74]
  - - [512, 512, 1, 4012]
    - [404, 8735.23]
  - - [512, 512, 1, 4020]
    - [405, 8746.84]
  - - [512, 512, 1, 4026]
    - [404, 8673.5]
  - - [512, 512, 1, 4030]
    - [405, 8665.03]
  - - [512, 512, 1, 4050]
    - [402, 8730.95]
  - - [512, 512, 1, 4059]
    - [405, 8653.57]
  - - [64, 12, 2520, 12]
    - [416, 1180.1]
  - - [64, 13, 2336, 13]
    - [421, 1224.14]
  - - [64, 14, 2184, 14]
    - [420, 1348.23]
  - - [64, 15, 2048, 15]
    - [419, 1445.65]
  - - [64, 16, 1920, 16]
    - [415, 1771.24]
  - - [64, 17, 1816, 17]
    - [414, 1608.66]
  - - [64, 18, 1720, 18]
    - [416, 1714.71]
  - - [64, 19, 1632, 19]
    - [417, 1805.83]
  - - [64, 21, 1488, 21]
    - [416, 2034.75]
  - - [64, 23, 1360, 23]
    - [416, 2239.5]
  - - [64, 25, 1256, 25]
    - [416, 2291.97]
  - - [64, 27, 1168, 27]
    - [418, 2398.51]
  - - [64, 29, 1088, 29]
    - [418, 2605.01]
  - - [64, 32, 992, 32]
    - [399, 2998.7]
  - - [64, 35, 904, 35]
    - [416, 2848.62]
  - - [64, 41, 776, 41]
    - [406, 3261.14]
  - - [64, 45, 712, 45]
    - [416, 3538.16]
  - - [64, 54, 592, 54]
    - [406, 4049.91]
  - - [64, 59, 544, 59]
    - [406, 4267.41]
  - - [64, 64, 496, 64]
    - [390, 4837.18]
  - - [64, 64, 496, 65]
    - [422, 5614.58]
  - - [64, 65, 496, 65]
    - [409, 4191.2]
  - - [64, 71, 448, 71]
    - [406, 4472.02]
  - - [64, 77, 408, 77]
    - [407, 4720.06]
  - - [64, 77, 408, 78]
    - [408, 4793.05]
  - - [64, 78, 408, 78]
    - [410, 4855.3]
  - - [64, 85, 376, 85]
    - [411, 5125.66]
  - - [64, 93, 344, 93]
    - [411, 5561.23]
  - - [64, 102, 312, 102]
    - [391, 5172.98]
  - - [64, 112, 288, 112]
    - [389, 5959.05]
  - - [64, 122, 264, 122]
    - [392, 5875.7]
  - - [64, 123, 264, 122]
    - [412, 5890.83]
  - - [64, 123, 264, 123]
    - [413, 6006.1]
  - - [64, 134, 240, 134]
    - [411, 5765.14]
  - - [64, 135, 240, 134]
    - [411, 5712.63]
  - - [64, 135, 240, 135]
    - [411, 5717.65]
  - - [49, 512, 64, 2048]
    - [437, 7581.0]
  - - [49, 2048, 64, 512]
    - [431, 7418.19]
  - - [64, 1280, 64, 192]
    - [434, 9341.43]
  - - [64, 1280, 64, 320]
    - [433, 9731.56]
  - - [64, 1280, 64, 384]
    - [438, 9780.73]
  - - [64, 1280, 64, 448]
    - [429, 9852.39]
  - - [64, 2048, 64, 192]
    - [427, 9518.99]
  - - [64, 2048, 64, 320]
    - [428, 9868.95]
  - - [64, 2048, 64, 384]
    - [429, 9895.63]
  - - [64, 2048, 64, 448]
    - [430, 9971.6]
  - - [196, 256, 64, 1024]
    - [430, 7586.6]
  - - [196, 1024, 64, 256]
    - [436, 7815.97]
  - - [289, 768, 64, 128]
    - [433, 8322.18]
  - - [289, 768, 64, 160]
    - [432, 8508.49]
  - - [289, 768, 64, 192]
    - [433, 8648.36]
  - - [784, 128, 64, 512]
    - [429, 9365.27]
  - - [784, 512, 64, 128]
    - [427, 9226.53]
  - - [1225, 192, 64, 32]
    - [426, 6865.59]
  - - [1225, 192, 64, 48]
    - [425, 7915.58]
  - - [1225, 192, 64, 64]
    - [425, 8282.15]
  - - [1225, 256, 64, 48]
    - [425, 8114.72]
  - - [1225, 256, 64, 64]
    - [425, 8384.5]
  - - [1225, 288, 64, 48]
    - [435, 7126.52]
  - - [1225, 288, 64, 64]
    - [435, 7712.79]
  - - [3136, 64, 64, 64]
    - [425, 8556.24]
  - - [3136, 64, 64, 256]
    - [433, 9796.04]
  - - [3136, 256, 64, 64]
    - [427, 9369.54]
  - - [5329, 64, 64, 80]
    - [424, 8717.09]
  - - [1024, 3072, 1, 512]
    - [440, 9355.32]
  - - [1024, 1024, 1, 6]
    - [446, 534.988]
  - - [1024, 30522, 1, 120]
    - [443, 10516.3]
  - - [3072, 1024, 1, 3072]
    - [441, 11003.5]
  - - [1024, 1024, 1, 80]
    - [479, 7182.03]
  - - [1024, 1024, 1, 20]
    - [447, 1515.28]
  - - [3072, 1024, 1, 2048]
    - [448, 10805.1]
  - - [3072, 1024, 1, 512]
    - [448, 9239.4]
  - - [64, 512, 16, 512]
    - [442, 6236.88]
  - - [1024, 1024, 1, 512]
    - [450, 8036.99]
  - - [1024, 30522, 1, 80]
    - [445, 9385.74]
  - - [1024, 1024, 1, 120]
    - [449, 4723.32]
  - - [1024, 3072, 1, 2048]
    - [441, 11072.6]
  - - [1024, 30522, 1, 20]
    - [444, 5392.43]
  - - [1024, 3072, 1, 3072]
    - [450, 11162.1]
  - - [512, 512, 1, 1]
    - [451, 64.0]
  - - [512, 512, 1, 512]
    - [454, 8604.0]
  - - [1024, 1024, 1, 1]
    - [452, 170.0]
  - - [1024, 1024, 1, 1024]
    - [453, 12382.0]
  - - [64, 512, 96, 512]
    - [455, 11068.0]
  - - [512, 64, 96, 512]
    - [456, 10807.0]
  - - [4096, 1024, 1, 3072]
    - [458, 11817.0]
  - - [1024, 1024, 1, 3072]
    - [459, 11495.0]
  - - [30528, 1024, 1, 3072]
    - [460, 12797.0]
  - - [1024, 4096, 1, 3072]
    - [458, 11824.0]
  - - [1024, 2, 1, 6]
    - [457, 2.0]
  - - [1024, 2, 1, 32]
    - [469, 12.0]
  - - [1024, 2, 1, 4]
    - [463, 2.0]
  - - [1024, 30528, 1, 4096]
    - [466, 13868.0]
  - - [1024, 1024, 1, 4096]
    - [480, 13664.3]
  - - [1024, 1024, 1, 32]
    - [479, 3919.91]
  - - [4096, 1024, 1, 4096]
    - [484, 14029.4]
  - - [1024, 4096, 1, 4096]
    - [483, 14031.3]
  - - [1024, 1024, 1, 2048]
    - [464, 13101.0]
  - - [4096, 1024, 1, 2048]
    - [460, 13708.0]
  - - [1024, 30528, 1, 2048]
    - [467, 13862.0]
  - - [1024, 1024, 1, 4]
    - [465, 603.0]
  - - [1024, 4096, 1, 2048]
    - [468, 13780.0]
  - - [128, 64, 512, 128]
    - [479, 9020.01]
  - - [64, 128, 512, 128]
    - [479, 10183.4]
  - - [512, 64, 64, 512]
    - [462, 11641.0]
  - - [64, 512, 64, 512]
    - [461, 12280.0]
  - - [1024, 7168, 6, 1024]
    - [472, 12404.9]
  - - [4096, 7168, 6, 1024]
    - [472, 12703.6]
  - - [1024, 7168, 6, 4096]
    - [470, 12572.1]
  - - [1024, 14, 6, 128]
    - [473, 1563.93]
  - - [1024, 14, 6, 1024]
    - [475, 3219.31]
  - - [1024, 7168, 12, 1024]
    - [471, 12700.4]
  - - [4096, 7168, 12, 1024]
    - [471, 12761.0]
  - - [1024, 7168, 12, 4096]
    - [471, 12865.2]
  - - [1024, 14, 12, 128]
    - [474, 2457.6]
  - - [1024, 14, 12, 1024]
    - [473, 4626.07]
  - - [128, 64, 1, 1048576]
    - [477, 852.609]
  - - [256, 256, 1, 1048576]
    - [476, 6085.59]
  - - [256, 128, 1, 1048576]
    - [478, 4254.5]
  - - [64, 128, 1312, 128]
    - [479, 11094.6]
  - - [128, 64, 1312, 128]
    - [480, 9917.33]
  - - [64, 128, 1280, 128]
    - [479, 11305.4]
  - - [128, 64, 1280, 128]
    - [481, 10112.8]
  - - [128, 64, 1024, 128]
    - [481, 9662.9]
  - - [64, 128, 1024, 128]
    - [482, 10859.0]
  - - [64, 512, 128, 512]
    - [482, 12644.2]
  - - [512, 64, 128, 512]
    - [480, 12102.6]
  - - [64, 512, 192, 512]
    - [479, 13005.6]
  - - [512, 64, 192, 512]
    - [481, 12340.0]
  - - [30528, 1024, 1, 4096]
    - [483, 14235.7]
  - - [1024, 1024, 1, 8]
    - [481, 1416.99]
  - - [1024, 4096, 1, 6144]
    - [484, 14174.8]
  - - [30528, 1024, 1, 6144]
    - [483, 14277.4]
  - - [4096, 1024, 1, 6144]
    - [484, 14119.5]
  - - [1024, 1024, 1, 12]
    - [479, 1872.46]
  - - [1024, 1024, 1, 6144]
    - [480, 13765.9]
  - - [4096, 1024, 1, 10496]
    - [483, 14250.4]
  - - [1024, 1024, 1, 10496]
    - [481, 13923.0]
  - - [1024, 4096, 1, 10496]
    - [483, 14223.1]
  - - [30528, 1024, 1, 10496]
    - [483, 14282.8]
  - - [1024, 1024, 1, 82]
    - [479, 6634.51]
  - - [30528, 1024, 1, 10240]
    - [483, 14300.9]
  - - [4096, 1024, 1, 10240]
    - [484, 14220.2]
  - - [1024, 1024, 1, 10240]
    - [481, 13937.5]
  - - [1024, 4096, 1, 10240]
    - [483, 14233.8]
  - - [4096, 1024, 1, 8192]
    - [484, 14183.2]
  - - [30528, 1024, 1, 8192]
    - [483, 14278.0]
  - - [1024, 1024, 1, 8192]
    - [481, 13887.0]
  - - [1024, 1024, 1, 64]
    - [479, 6765.01]
  - - [1024, 4096, 1, 8192]
    - [484, 14217.5]
- null
