library/src/blas3/Tensile/Logic/archive/vega20_Cijk_Alik_Bljk_SB.yaml
- {MinimumRequiredVersion: 4.6.0}
- vega20
- gfx906
- [Device 66a0, Device 66a1, Device 66a7, Device 66af, Vega 20]
    SolutionIndex: 0
    SolutionNameMin: Cijk_Alik_Bljk_SB_MT064x008x32_GRVW02_GSU32_SNLL0_TT04_02_VW02_WG16_04_04
    SolutionIndex: 1
    SolutionNameMin: Cijk_Alik_Bljk_SB_MT064x008x32_GRVW04_GSU32_SNLL0_TT04_04_VW04_WG16_02_08
    SolutionIndex: 2
    SolutionNameMin: Cijk_Alik_Bljk_SB_MT064x016x64_GRVW04_GSU32_SNLL0_TT04_04_VW04_WG16_04_04
    SolutionIndex: 3
    SolutionNameMin: Cijk_Alik_Bljk_SB_MT064x016x64_GRVW04_GSU32_SNLL0_TT04_04_VW04_WG16_04_04
    SolutionIndex: 4
    SolutionNameMin: Cijk_Alik_Bljk_SB_MT036x048x16_GRVW01_GSU02_SNLL0_TT03_03_VW01_WG12_16_01
    SolutionIndex: 5
    SolutionNameMin: Cijk_Alik_Bljk_SB_MT048x036x16_GRVW01_GSU08_SNLL0_TT06_03_VW01_WG08_12_02
    SolutionIndex: 6
    SolutionNameMin: Cijk_Alik_Bljk_SB_MT048x048x16_GRVW02_GSU08_SNLL0_TT06_04_VW02_WG08_12_02
    SolutionIndex: 7
    SolutionNameMin: Cijk_Alik_Bljk_SB_MT048x048x16_GRVW01_GSU08_SNLL0_TT03_03_VW01_WG16_16_01
    SolutionIndex: 8
    SolutionNameMin: Cijk_Alik_Bljk_SB_MT032x008x08_GRVW02_GSU01_SNLL0_TT02_02_VW02_WG16_04_01
    SolutionIndex: 9
    SolutionNameMin: Cijk_Alik_Bljk_SB_MT016x016x08_GRVW02_GSU01_SNLL0_TT02_02_VW02_WG08_08_01
    SolutionIndex: 10
    SolutionNameMin: Cijk_Alik_Bljk_SB_MT032x016x08_GRVW02_GSU01_SNLL0_TT04_02_VW02_WG08_08_01
    SolutionIndex: 11
    SolutionNameMin: Cijk_Alik_Bljk_SB_MT032x032x08_GRVW04_GSU01_SNLL0_TT04_04_VW04_WG08_08_01
    SolutionIndex: 12
    SolutionNameMin: Cijk_Alik_Bljk_SB_MT032x016x08_GRVW02_GSU01_SNLL0_TT02_02_VW02_WG16_08_01
    SolutionIndex: 13
    SolutionNameMin: Cijk_Alik_Bljk_SB_MT016x016x08_GRVW02_GSU01_SNLL0_TT02_02_VW02_WG08_08_01
    SolutionIndex: 14
    SolutionNameMin: Cijk_Alik_Bljk_SB_MT032x032x08_GRVW04_GSU01_SNLL0_TT04_04_VW04_WG08_08_01
    SolutionIndex: 15
    SolutionNameMin: Cijk_Alik_Bljk_SB_MT032x016x08_GRVW02_GSU01_SNLL0_TT02_02_VW02_WG16_08_01
    SolutionIndex: 16
    SolutionNameMin: Cijk_Alik_Bljk_SB_MT064x008x16_GRVW02_GSU01_SNLL0_TT02_02_VW02_WG32_04_01
    SolutionIndex: 17
    SolutionNameMin: Cijk_Alik_Bljk_SB_MT032x008x16_GRVW02_GSU01_SNLL0_TT02_02_VW02_WG16_04_01
    SolutionIndex: 18
    SolutionNameMin: Cijk_Alik_Bljk_SB_MT016x016x16_GRVW02_GSU01_SNLL0_TT02_02_VW02_WG08_08_01
    SolutionIndex: 19
    SolutionNameMin: Cijk_Alik_Bljk_SB_MT032x016x16_GRVW02_GSU01_SNLL0_TT04_02_VW02_WG08_08_01
    SolutionIndex: 20
    SolutionNameMin: Cijk_Alik_Bljk_SB_MT032x032x16_GRVW04_GSU01_SNLL0_TT04_04_VW04_WG08_08_01
    SolutionIndex: 21
    SolutionNameMin: Cijk_Alik_Bljk_SB_MT032x016x16_GRVW02_GSU01_SNLL0_TT02_02_VW02_WG16_08_01
    SolutionIndex: 22
    SolutionNameMin: Cijk_Alik_Bljk_SB_MT064x016x16_GRVW02_GSU01_SNLL0_TT04_02_VW02_WG16_08_01
    SolutionIndex: 23
    SolutionNameMin: Cijk_Alik_Bljk_SB_MT064x032x16_GRVW04_GSU01_SNLL0_TT04_04_VW04_WG16_08_01
    SolutionIndex: 24
    SolutionNameMin: Cijk_Alik_Bljk_SB_MT064x008x16_GRVW02_GSU01_SNLL0_TT02_02_VW02_WG32_04_01
    SolutionIndex: 25
    SolutionNameMin: Cijk_Alik_Bljk_SB_MT032x008x16_GRVW02_GSU01_SNLL0_TT02_02_VW02_WG16_04_01
    SolutionIndex: 26
    SolutionNameMin: Cijk_Alik_Bljk_SB_MT032x016x16_GRVW02_GSU01_SNLL0_TT02_02_VW02_WG16_08_01
    SolutionIndex: 27
    SolutionNameMin: Cijk_Alik_Bljk_SB_MT064x032x16_GRVW04_GSU01_SNLL0_TT04_04_VW04_WG16_08_01
    SolutionIndex: 28
    SolutionNameMin: Cijk_Alik_Bljk_SB_MT032x032x08_GRVW04_GSU02_SNLL0_TT04_04_VW04_WG08_08_04
    SolutionIndex: 29
    SolutionNameMin: Cijk_Alik_Bljk_SB_MT016x016x08_GRVW02_GSU08_SNLL0_TT02_02_VW02_WG08_08_02
    SolutionIndex: 30
    SolutionNameMin: Cijk_Alik_Bljk_SB_MT032x032x08_GRVW04_GSU08_SNLL0_TT04_04_VW04_WG08_08_04
    SolutionIndex: 31
    SolutionNameMin: Cijk_Alik_Bljk_SB_MT032x016x16_GRVW02_GSU02_SNLL0_TT04_02_VW02_WG08_08_02
    SolutionIndex: 32
    SolutionNameMin: Cijk_Alik_Bljk_SB_MT032x032x16_GRVW04_GSU02_SNLL0_TT04_04_VW04_WG08_08_02
    SolutionIndex: 33
    SolutionNameMin: Cijk_Alik_Bljk_SB_MT064x032x16_GRVW04_GSU02_SNLL0_TT08_04_VW04_WG08_08_02
    SolutionIndex: 34
    SolutionNameMin: Cijk_Alik_Bljk_SB_MT016x016x16_GRVW02_GSU02_SNLL0_TT02_02_VW02_WG08_08_04
    SolutionIndex: 35
    SolutionNameMin: Cijk_Alik_Bljk_SB_MT032x016x16_GRVW02_GSU02_SNLL0_TT04_02_VW02_WG08_08_04
    SolutionIndex: 36
    SolutionNameMin: Cijk_Alik_Bljk_SB_MT032x016x16_GRVW02_GSU02_SNLL0_TT02_02_VW02_WG16_08_02
    SolutionIndex: 37
    SolutionNameMin: Cijk_Alik_Bljk_SB_MT064x016x16_GRVW02_GSU02_SNLL0_TT04_02_VW02_WG16_08_02
    SolutionIndex: 38
    SolutionNameMin: Cijk_Alik_Bljk_SB_MT128x064x16_GRVW04_GSU02_SNLL0_TT08_08_VW04_WG16_08_02
    SolutionIndex: 39
    SolutionNameMin: Cijk_Alik_Bljk_SB_MT032x016x16_GRVW02_GSU02_SNLL0_TT04_02_VW02_WG08_08_02
    SolutionIndex: 40
    SolutionNameMin: Cijk_Alik_Bljk_SB_MT032x032x16_GRVW04_GSU02_SNLL0_TT04_04_VW04_WG08_08_02
    SolutionIndex: 41
    SolutionNameMin: Cijk_Alik_Bljk_SB_MT064x032x16_GRVW04_GSU02_SNLL0_TT08_04_VW04_WG08_08_02
    SolutionIndex: 42
    SolutionNameMin: Cijk_Alik_Bljk_SB_MT016x016x16_GRVW02_GSU02_SNLL0_TT02_02_VW02_WG08_08_04
    SolutionIndex: 43
    SolutionNameMin: Cijk_Alik_Bljk_SB_MT032x016x16_GRVW02_GSU02_SNLL0_TT04_02_VW02_WG08_08_04
    SolutionIndex: 44
    SolutionNameMin: Cijk_Alik_Bljk_SB_MT032x016x16_GRVW02_GSU02_SNLL0_TT02_02_VW02_WG16_08_02
    SolutionIndex: 45
    SolutionNameMin: Cijk_Alik_Bljk_SB_MT128x064x16_GRVW04_GSU02_SNLL0_TT08_08_VW04_WG16_08_02
    SolutionIndex: 46
    SolutionNameMin: Cijk_Alik_Bljk_SB_MT064x016x16_GRVW04_GSU04_SNLL0_TT04_04_VW04_WG16_04_04
    SolutionIndex: 47
    SolutionNameMin: Cijk_Alik_Bljk_SB_MT032x032x16_GRVW04_GSU04_SNLL0_TT04_04_VW04_WG08_08_02
    SolutionIndex: 48
    SolutionNameMin: Cijk_Alik_Bljk_SB_MT064x032x16_GRVW04_GSU04_SNLL0_TT08_04_VW04_WG08_08_02
    SolutionIndex: 49
    SolutionNameMin: Cijk_Alik_Bljk_SB_MT016x016x16_GRVW02_GSU04_SNLL0_TT02_02_VW02_WG08_08_04
    SolutionIndex: 50
    SolutionNameMin: Cijk_Alik_Bljk_SB_MT032x016x16_GRVW02_GSU04_SNLL0_TT04_02_VW02_WG08_08_04
    SolutionIndex: 51
    SolutionNameMin: Cijk_Alik_Bljk_SB_MT032x016x16_GRVW02_GSU04_SNLL0_TT02_02_VW02_WG16_08_02
    SolutionIndex: 52
    SolutionNameMin: Cijk_Alik_Bljk_SB_MT032x016x16_GRVW02_GSU04_SNLL0_TT04_02_VW02_WG08_08_02
    SolutionIndex: 53
    SolutionNameMin: Cijk_Alik_Bljk_SB_MT032x032x16_GRVW04_GSU04_SNLL0_TT04_04_VW04_WG08_08_02
    SolutionIndex: 54
    SolutionNameMin: Cijk_Alik_Bljk_SB_MT064x032x16_GRVW04_GSU04_SNLL0_TT08_04_VW04_WG08_08_02
    SolutionIndex: 55
    SolutionNameMin: Cijk_Alik_Bljk_SB_MT016x016x16_GRVW02_GSU04_SNLL0_TT02_02_VW02_WG08_08_04
    SolutionIndex: 56
    SolutionNameMin: Cijk_Alik_Bljk_SB_MT032x016x16_GRVW02_GSU04_SNLL0_TT04_02_VW02_WG08_08_04
    SolutionIndex: 57
    SolutionNameMin: Cijk_Alik_Bljk_SB_MT032x016x16_GRVW02_GSU04_SNLL0_TT02_02_VW02_WG16_08_02
    SolutionIndex: 58
    SolutionNameMin: Cijk_Alik_Bljk_SB_MT128x064x16_GRVW04_GSU04_SNLL0_TT08_08_VW04_WG16_08_02
    SolutionIndex: 59
    SolutionNameMin: Cijk_Alik_Bljk_SB_MT016x016x16_GRVW02_GSU08_SNLL0_TT02_02_VW02_WG08_08_04
    SolutionIndex: 60
    SolutionNameMin: Cijk_Alik_Bljk_SB_MT016x016x16_GRVW02_GSU08_SNLL0_TT02_02_VW02_WG08_08_04
    SolutionIndex: 61
    SolutionNameMin: Cijk_Alik_Bljk_SB_MT032x016x16_GRVW02_GSU08_SNLL0_TT02_02_VW02_WG16_08_02
    SolutionIndex: 62
    SolutionNameMin: Cijk_Alik_Bljk_SB_MT064x064x24_GRVW04_GSU02_SNLL0_TT08_08_VW04_WG08_08_02
    SolutionIndex: 63
    SolutionNameMin: Cijk_Alik_Bljk_SB_MT064x064x24_GRVW04_GSU02_SNLL0_TT08_08_VW04_WG08_08_02
    SolutionIndex: 64
    SolutionNameMin: Cijk_Alik_Bljk_SB_MT064x064x24_GRVW04_GSU04_SNLL0_TT08_08_VW04_WG08_08_02
    SolutionIndex: 65
    SolutionNameMin: Cijk_Alik_Bljk_SB_MT064x064x24_GRVW04_GSU04_SNLL0_TT08_08_VW04_WG08_08_02
    SolutionIndex: 66
    SolutionNameMin: Cijk_Alik_Bljk_SB_MT032x032x32_GRVW04_GSU02_SNLL0_TT04_04_VW04_WG08_08_02
    SolutionIndex: 67
    SolutionNameMin: Cijk_Alik_Bljk_SB_MT032x032x32_GRVW04_GSU02_SNLL0_TT04_04_VW04_WG08_08_04
    SolutionIndex: 68
    SolutionNameMin: Cijk_Alik_Bljk_SB_MT064x032x32_GRVW04_GSU02_SNLL0_TT08_04_VW04_WG08_08_04
    SolutionIndex: 69
    SolutionNameMin: Cijk_Alik_Bljk_SB_MT128x032x32_GRVW04_GSU02_SNLL0_TT08_04_VW04_WG16_08_02
    SolutionIndex: 70
    SolutionNameMin: Cijk_Alik_Bljk_SB_MT032x032x32_GRVW04_GSU02_SNLL0_TT04_04_VW04_WG08_08_04
    SolutionIndex: 71
    SolutionNameMin: Cijk_Alik_Bljk_SB_MT064x032x32_GRVW04_GSU02_SNLL0_TT08_04_VW04_WG08_08_04
    SolutionIndex: 72
    SolutionNameMin: Cijk_Alik_Bljk_SB_MT064x064x32_GRVW04_GSU02_SNLL0_TT08_08_VW04_WG08_08_04
    SolutionIndex: 73
    SolutionNameMin: Cijk_Alik_Bljk_SB_MT064x032x32_GRVW04_GSU02_SNLL0_TT04_04_VW04_WG16_08_02
    SolutionIndex: 74
    SolutionNameMin: Cijk_Alik_Bljk_SB_MT032x008x32_GRVW02_GSU04_SNLL0_TT02_02_VW02_WG16_04_04
    SolutionIndex: 75
    SolutionNameMin: Cijk_Alik_Bljk_SB_MT064x064x32_GRVW04_GSU04_SNLL0_TT08_08_VW04_WG08_08_02
    SolutionIndex: 76
    SolutionNameMin: Cijk_Alik_Bljk_SB_MT032x032x32_GRVW04_GSU04_SNLL0_TT04_04_VW04_WG08_08_04
    SolutionIndex: 77
    SolutionNameMin: Cijk_Alik_Bljk_SB_MT032x032x32_GRVW04_GSU04_SNLL0_TT04_04_VW04_WG08_08_04
    SolutionIndex: 78
    SolutionNameMin: Cijk_Alik_Bljk_SB_MT064x032x32_GRVW04_GSU04_SNLL0_TT08_04_VW04_WG08_08_04
    SolutionIndex: 79
    SolutionNameMin: Cijk_Alik_Bljk_SB_MT064x032x32_GRVW04_GSU04_SNLL0_TT04_04_VW04_WG16_08_02
    SolutionIndex: 80
    SolutionNameMin: Cijk_Alik_Bljk_SB_MT064x064x16_GRVW04_GSU01_SNLL0_TT04_04_VW04_WG16_16_01
    SolutionIndex: 81
    SolutionNameMin: Cijk_Alik_Bljk_SB_MT064x128x16_GRVW04_GSU01_SNLL0_TT04_08_VW04_WG16_16_01
    SolutionIndex: 82
    SolutionNameMin: Cijk_Alik_Bljk_SB_MT096x128x16_GRVW02_GSU01_SNLL0_TT06_08_VW02_WG16_16_01
    SolutionIndex: 83
    SolutionNameMin: Cijk_Alik_Bljk_SB_MT128x064x16_GRVW04_GSU01_SNLL0_TT08_04_VW04_WG16_16_01
    SolutionIndex: 84
    SolutionNameMin: Cijk_Alik_Bljk_SB_MT064x064x16_GRVW04_GSU01_SNLL0_TT04_04_VW04_WG16_16_01
    SolutionIndex: 85
    SolutionNameMin: Cijk_Alik_Bljk_SB_MT064x128x16_GRVW04_GSU01_SNLL0_TT04_08_VW04_WG16_16_01
    SolutionIndex: 86
    SolutionNameMin: Cijk_Alik_Bljk_SB_MT128x064x16_GRVW04_GSU01_SNLL0_TT08_04_VW04_WG16_16_01
    SolutionIndex: 87
    SolutionNameMin: Cijk_Alik_Bljk_SB_MT064x064x32_GRVW04_GSU01_SNLL0_TT04_04_VW04_WG16_16_01
    SolutionIndex: 88
    SolutionNameMin: Cijk_Alik_Bljk_SB_MT064x064x32_GRVW04_GSU01_SNLL0_TT04_04_VW04_WG16_16_01
    SolutionIndex: 89
    SolutionNameMin: Cijk_Alik_Bljk_SB_MT128x128x08_GRVW04_GSU01_SNLL1_TT08_08_VW04_WG16_16_01
    SolutionIndex: 90
    SolutionNameMin: Cijk_Alik_Bljk_SB_MT128x128x08_GRVW04_GSU01_SNLL1_TT08_08_VW04_WG16_16_01
    SolutionIndex: 91
    SolutionNameMin: Cijk_Alik_Bljk_SB_MT064x064x16_GRVW04_GSU01_SNLL1_TT04_04_VW04_WG16_16_01
    SolutionIndex: 92
    SolutionNameMin: Cijk_Alik_Bljk_SB_MT064x128x16_GRVW04_GSU01_SNLL1_TT04_08_VW04_WG16_16_01
    SolutionIndex: 93
    SolutionNameMin: Cijk_Alik_Bljk_SB_MT096x128x16_GRVW02_GSU01_SNLL1_TT06_08_VW02_WG16_16_01
    SolutionIndex: 94
    SolutionNameMin: Cijk_Alik_Bljk_SB_MT128x064x16_GRVW04_GSU01_SNLL1_TT08_04_VW04_WG16_16_01
    SolutionIndex: 95
    SolutionNameMin: Cijk_Alik_Bljk_SB_MT128x096x16_GRVW02_GSU01_SNLL1_TT08_06_VW02_WG16_16_01
    SolutionIndex: 96
    SolutionNameMin: Cijk_Alik_Bljk_SB_MT128x128x16_GRVW04_GSU01_SNLL1_TT08_08_VW04_WG16_16_01
    SolutionIndex: 97
    SolutionNameMin: Cijk_Alik_Bljk_SB_MT064x064x16_GRVW04_GSU01_SNLL1_TT04_04_VW04_WG16_16_01
    SolutionIndex: 98
    SolutionNameMin: Cijk_Alik_Bljk_SB_MT064x128x16_GRVW04_GSU01_SNLL1_TT04_08_VW04_WG16_16_01
    SolutionIndex: 99
    SolutionNameMin: Cijk_Alik_Bljk_SB_MT096x128x16_GRVW02_GSU01_SNLL1_TT06_08_VW02_WG16_16_01
    SolutionIndex: 100
    SolutionNameMin: Cijk_Alik_Bljk_SB_MT128x064x16_GRVW04_GSU01_SNLL1_TT08_04_VW04_WG16_16_01
    SolutionIndex: 101
    SolutionNameMin: Cijk_Alik_Bljk_SB_MT128x096x16_GRVW02_GSU01_SNLL1_TT08_06_VW02_WG16_16_01
    SolutionIndex: 102
    SolutionNameMin: Cijk_Alik_Bljk_SB_MT128x128x16_GRVW04_GSU01_SNLL1_TT08_08_VW04_WG16_16_01
    SolutionIndex: 103
    SolutionNameMin: Cijk_Alik_Bljk_SB_MT128x128x24_GRVW04_GSU01_SNLL1_TT08_08_VW04_WG16_16_01
    SolutionIndex: 104
    SolutionNameMin: Cijk_Alik_Bljk_SB_MT128x128x24_GRVW04_GSU01_SNLL1_TT08_08_VW04_WG16_16_01
    SolutionIndex: 105
    SolutionNameMin: Cijk_Alik_Bljk_SB_MT064x064x32_GRVW04_GSU01_SNLL1_TT04_04_VW04_WG16_16_01
    SolutionIndex: 106
    SolutionNameMin: Cijk_Alik_Bljk_SB_MT128x128x32_GRVW04_GSU01_SNLL1_TT08_08_VW04_WG16_16_01
    SolutionIndex: 107
    SolutionNameMin: Cijk_Alik_Bljk_SB_MT064x064x32_GRVW04_GSU01_SNLL1_TT04_04_VW04_WG16_16_01
    SolutionIndex: 108
    SolutionNameMin: Cijk_Alik_Bljk_SB_MT064x128x32_GRVW04_GSU01_SNLL1_TT04_08_VW04_WG16_16_01
    SolutionIndex: 109
    SolutionNameMin: Cijk_Alik_Bljk_SB_MT128x128x32_GRVW04_GSU01_SNLL1_TT08_08_VW04_WG16_16_01
    SolutionIndex: 110
    SolutionNameMin: Cijk_Alik_Bljk_SB_MT016x016x04_GRVW02_GSU01_SNLL0_TT02_02_VW02_WG08_08_01
    SolutionIndex: 111
    SolutionNameMin: Cijk_Alik_Bljk_SB_MT032x032x02_GRVW04_GSU01_SNLL0_TT04_04_VW04_WG08_08_01
    SolutionIndex: 112
    SolutionNameMin: Cijk_Alik_Bljk_SB_MT016x016x16_GRVW02_GSU01_SNLL1_TT02_02_VW02_WG08_08_04
    SolutionIndex: 113
    SolutionNameMin: Cijk_Alik_Bljk_SB_MT008x008x08_GRVW02_GSU02_SNLL0_TT02_02_VW02_WG04_04_04
    SolutionIndex: 114
    SolutionNameMin: Cijk_Alik_Bljk_SB_MT008x008x08_GRVW02_GSU04_SNLL0_TT02_02_VW02_WG04_04_04
    SolutionIndex: 115
    SolutionNameMin: Cijk_Alik_Bljk_SB_MT008x008x08_GRVW02_GSU08_SNLL0_TT02_02_VW02_WG04_04_04
    SolutionIndex: 116
    SolutionNameMin: Cijk_Alik_Bljk_SB_MT008x008x08_GRVW02_GSU16_SNLL0_TT02_02_VW02_WG04_04_04
    SolutionIndex: 117
    SolutionNameMin: Cijk_Alik_Bljk_SB_MT016x016x16_GRVW02_GSU16_SNLL0_TT02_02_VW02_WG08_08_04
    SolutionIndex: 118
    SolutionNameMin: Cijk_Alik_Bljk_SB_MT064x016x32_GRVW01_GSU08_LPA01_LPB01_PGR1_PLR1_TT04_04_USFGRO01_VW01_WG16_04_04_WGM01
    SolutionIndex: 119
    SolutionNameMin: Cijk_Alik_Bljk_SB_MT064x032x16_GRVW01_GSU01_LPA04_LPB04_PGR1_PLR1_TT04_04_USFGRO01_VW04_WG16_08_02_WGM01
    SolutionIndex: 120
    SolutionNameMin: Cijk_Alik_Bljk_SB_MT128x128x16_EPS1_GSU1_LPA0_LPB0_PGR1_SNLL1_TT8_8_VW2_WG16_16_1_WGM1
    SolutionIndex: 121
    SolutionNameMin: Cijk_Alik_Bljk_SB_MT64x32x16_EPS1_GSU3_LPA0_LPB0_PGR1_SNLL0_TT4_4_VW2_WG16_8_1_WGM1
    SolutionIndex: 122
    SolutionNameMin: Cijk_Alik_Bljk_SB_MT64x64x16_EPS1_GSU3_LPA0_LPB0_PGR1_SNLL0_TT4_4_VW2_WG16_16_1_WGM1
    SolutionIndex: 123
    SolutionNameMin: Cijk_Alik_Bljk_SB_MT128x128x16_EPS1_GSU3_LPA0_LPB0_PGR1_SNLL0_TT8_8_VW2_WG16_16_1_WGM1
    SolutionIndex: 124
    SolutionNameMin: Cijk_Alik_Bljk_SB_MT64x64x16_EPS1_GSU5_LPA0_LPB0_PGR1_SNLL0_TT4_4_VW2_WG16_16_1_WGM1
    SolutionIndex: 125
    SolutionNameMin: Cijk_Alik_Bljk_SB_MT128x128x16_EPS1_GSU5_LPA0_LPB0_PGR1_SNLL0_TT8_8_VW2_WG16_16_1_WGM1
    SolutionIndex: 126
    SolutionNameMin: Cijk_Alik_Bljk_SB_MT64x64x16_EPS1_GSU5_LPA0_LPB0_PGR1_SNLL0_TT4_4_VW2_WG16_16_1_WGM8
    SolutionIndex: 127
    SolutionNameMin: Cijk_Alik_Bljk_SB_MT64x64x16_EPS1_GSU3_LPA0_LPB0_PGR1_SNLL0_TT4_4_VW2_WG16_16_1_WGM64
    SolutionIndex: 128
    SolutionNameMin: Cijk_Alik_Bljk_SB_MT32x128x16_EPS1_GSU5_LPA0_LPB0_PGR1_SNLL0_TT4_4_VW2_WG8_32_1_WGM64
    SolutionIndex: 129
    SolutionNameMin: Cijk_Alik_Bljk_SB_MT64x64x16_EPS1_GSU5_LPA0_LPB0_PGR1_SNLL0_TT4_4_VW2_WG16_16_1_WGM64
    SolutionIndex: 130
    SolutionNameMin: Cijk_Alik_Bljk_SB_MT128x32x8_EPS1_GSU1_LPA0_LPB0_PGR1_SNLL1_TT4_4_VW4_WG32_8_1_WGM1
    SolutionIndex: 131
    SolutionNameMin: Cijk_Alik_Bljk_SB_MT128x128x16_EPS1_GSU1_LPA0_LPB0_PGR1_SNLL1_TT8_8_VW4_WG16_16_1_WGM1
    SolutionIndex: 132
    SolutionNameMin: Cijk_Alik_Bljk_SB_MT64x64x16_EPS1_GSU3_LPA0_LPB0_PGR1_SNLL0_TT4_4_VW4_WG16_16_1_WGM1
    SolutionIndex: 133
    SolutionNameMin: Cijk_Alik_Bljk_SB_MT128x128x16_EPS1_GSU1_LPA0_LPB0_PGR1_SNLL1_TT8_8_VW4_WG16_16_1_WGM8
    SolutionIndex: 134
    SolutionNameMin: Cijk_Alik_Bljk_SB_MT128x64x16_EPS0_GSU1_LPA0_LPB0_PGR0_SNLL0_TT4_8_VW4_WG32_8_1_WGM8
    SolutionIndex: 135
    SolutionNameMin: Cijk_Alik_Bljk_SB_MT64x32x16_EPS1_GSU1_LPA0_LPB0_PGR1_SNLL1_TT4_4_VW4_WG16_8_1_WGM64
    SolutionIndex: 136
    SolutionNameMin: Cijk_Alik_Bljk_SB_MT128x128x16_EPS1_GSU1_LPA0_LPB0_PGR1_SNLL1_TT8_8_VW4_WG16_16_1_WGM64
    SolutionIndex: 137
    SolutionNameMin: Cijk_Alik_Bljk_SB_MT128x64x16_EPS1_GSU1_LPA0_LPB0_PGR1_SNLL1_TT4_8_VW4_WG32_8_1_WGM64
    SolutionIndex: 138
    SolutionNameMin: Cijk_Alik_Bljk_SB_MT64x64x8_EPS1_GSU1_LPA2_LPB0_PGR1_SNLL1_TT4_8_VW2_WG16_8_1_WGM8
    SolutionIndex: 139
    SolutionNameMin: Cijk_Alik_Bljk_SB_MT64x32x16_EPS1_GSU3_LPA2_LPB0_PGR1_SNLL0_TT4_4_VW2_WG16_8_1_WGM1
    SolutionIndex: 140
    SolutionNameMin: Cijk_Alik_Bljk_SB_MT128x32x16_EPS1_GSU3_LPA2_LPB0_PGR1_SNLL0_TT4_4_VW2_WG32_8_1_WGM1
    SolutionIndex: 141
    SolutionNameMin: Cijk_Alik_Bljk_SB_MT64x64x16_EPS1_GSU5_LPA2_LPB0_PGR1_SNLL0_TT4_4_VW2_WG16_16_1_WGM1
    SolutionIndex: 142
    SolutionNameMin: Cijk_Alik_Bljk_SB_MT64x32x16_EPS0_GSU1_LPA2_LPB0_PGR0_SNLL0_TT4_4_VW2_WG16_8_1_WGM8
    SolutionIndex: 143
    SolutionNameMin: Cijk_Alik_Bljk_SB_MT64x64x16_EPS0_GSU1_LPA2_LPB0_PGR0_SNLL0_TT4_4_VW2_WG16_16_1_WGM8
    SolutionIndex: 144
    SolutionNameMin: Cijk_Alik_Bljk_SB_MT64x32x16_EPS1_GSU3_LPA2_LPB0_PGR1_SNLL0_TT4_4_VW2_WG16_8_1_WGM8
    SolutionIndex: 145
    SolutionNameMin: Cijk_Alik_Bljk_SB_MT64x64x16_EPS1_GSU5_LPA2_LPB0_PGR1_SNLL0_TT4_4_VW2_WG16_16_1_WGM8
    SolutionIndex: 146
    SolutionNameMin: Cijk_Alik_Bljk_SB_MT128x32x16_EPS1_GSU1_LPA2_LPB0_PGR1_SNLL1_TT4_4_VW2_WG32_8_1_WGM64
    SolutionIndex: 147
    SolutionNameMin: Cijk_Alik_Bljk_SB_MT64x32x16_EPS1_GSU5_LPA2_LPB0_PGR1_SNLL0_TT4_4_VW2_WG16_8_1_WGM64
    SolutionIndex: 148
    SolutionNameMin: Cijk_Alik_Bljk_SB_MT256x64x8_EPS1_GSU1_LPA4_LPB0_PGR1_SNLL1_TT8_8_VW4_WG32_8_1_WGM1
    SolutionIndex: 149
    SolutionNameMin: Cijk_Alik_Bljk_SB_MT128x128x8_EPS1_GSU1_LPA4_LPB0_PGR1_SNLL1_TT8_8_VW4_WG16_16_1_WGM8
    SolutionIndex: 150
    SolutionNameMin: Cijk_Alik_Bljk_SB_MT64x64x16_EPS1_GSU5_LPA4_LPB0_PGR1_SNLL0_TT4_4_VW4_WG16_16_1_WGM1
    SolutionIndex: 151
    SolutionNameMin: Cijk_Alik_Bljk_SB_MT64x64x16_EPS1_GSU1_LPA4_LPB0_PGR1_SNLL1_TT4_4_VW4_WG16_16_1_WGM8
    SolutionIndex: 152
    SolutionNameMin: Cijk_Alik_Bljk_SB_MT128x64x16_EPS1_GSU1_LPA4_LPB0_PGR1_SNLL1_TT8_4_VW4_WG16_16_1_WGM8
    SolutionIndex: 153
    SolutionNameMin: Cijk_Alik_Bljk_SB_MT128x64x16_EPS0_GSU1_LPA4_LPB0_PGR0_SNLL0_TT4_8_VW4_WG32_8_1_WGM8
    SolutionIndex: 154
    SolutionNameMin: Cijk_Alik_Bljk_SB_MT128x64x16_EPS1_GSU1_LPA4_LPB0_PGR1_SNLL1_TT4_8_VW4_WG32_8_1_WGM8
    SolutionIndex: 155
    SolutionNameMin: Cijk_Alik_Bljk_SB_MT64x64x16_EPS1_GSU1_LPA4_LPB0_PGR1_SNLL1_TT4_4_VW4_WG16_16_1_WGM64
    SolutionIndex: 156
    SolutionNameMin: Cijk_Alik_Bljk_SB_MT128x32x16_EPS0_GSU1_LPA4_LPB0_PGR0_SNLL0_TT4_4_VW4_WG32_8_1_WGM64
    SolutionIndex: 157
    SolutionNameMin: Cijk_Alik_Bljk_SB_MT64x32x16_EPS1_GSU5_LPA4_LPB0_PGR1_SNLL0_TT4_4_VW4_WG16_8_1_WGM64
    SolutionIndex: 158
    SolutionNameMin: Cijk_Alik_Bljk_SB_MT32x128x32_EPS1_GSU1_LPA4_LPB0_PGR1_SNLL1_TT4_4_VW4_WG8_32_1_WGM64
    SolutionIndex: 159
    SolutionNameMin: Cijk_Alik_Bljk_SB_MT128x64x8_EPS1_GSU1_LPA0_LPB2_PGR1_SNLL1_TT8_4_VW2_WG16_16_1_WGM8
    SolutionIndex: 160
    SolutionNameMin: Cijk_Alik_Bljk_SB_MT64x32x16_EPS1_GSU5_LPA0_LPB2_PGR1_SNLL0_TT4_4_VW2_WG16_8_1_WGM1
    SolutionIndex: 161
    SolutionNameMin: Cijk_Alik_Bljk_SB_MT64x64x16_EPS1_GSU5_LPA0_LPB2_PGR1_SNLL0_TT4_4_VW2_WG16_16_1_WGM1
    SolutionIndex: 162
    SolutionNameMin: Cijk_Alik_Bljk_SB_MT64x64x16_EPS1_GSU3_LPA0_LPB2_PGR1_SNLL0_TT4_4_VW2_WG16_16_1_WGM64
    SolutionIndex: 163
    SolutionNameMin: Cijk_Alik_Bljk_SB_MT64x32x16_EPS1_GSU5_LPA0_LPB2_PGR1_SNLL0_TT4_4_VW2_WG16_8_1_WGM64
    SolutionIndex: 164
    SolutionNameMin: Cijk_Alik_Bljk_SB_MT128x64x8_EPS1_GSU1_LPA0_LPB4_PGR1_SNLL1_TT4_8_VW4_WG32_8_1_WGM8
    SolutionIndex: 165
    SolutionNameMin: Cijk_Alik_Bljk_SB_MT64x32x16_EPS1_GSU1_LPA0_LPB4_PGR1_SNLL1_TT4_4_VW4_WG16_8_1_WGM1
    SolutionIndex: 166
    SolutionNameMin: Cijk_Alik_Bljk_SB_MT128x64x16_EPS0_GSU1_LPA0_LPB4_PGR0_SNLL0_TT8_4_VW4_WG16_16_1_WGM1
    SolutionIndex: 167
    SolutionNameMin: Cijk_Alik_Bljk_SB_MT64x32x16_EPS1_GSU5_LPA0_LPB4_PGR1_SNLL0_TT4_4_VW4_WG16_8_1_WGM1
    SolutionIndex: 168
    SolutionNameMin: Cijk_Alik_Bljk_SB_MT64x64x16_EPS1_GSU5_LPA0_LPB4_PGR1_SNLL0_TT4_4_VW4_WG16_16_1_WGM1
    SolutionIndex: 169
    SolutionNameMin: Cijk_Alik_Bljk_SB_MT64x128x16_EPS1_GSU1_LPA0_LPB4_PGR1_SNLL1_TT8_4_VW4_WG8_32_1_WGM8
    SolutionIndex: 170
    SolutionNameMin: Cijk_Alik_Bljk_SB_MT64x256x16_EPS1_GSU1_LPA0_LPB4_PGR1_SNLL1_TT8_8_VW4_WG8_32_1_WGM8
    SolutionIndex: 171
    SolutionNameMin: Cijk_Alik_Bljk_SB_MT64x128x16_EPS1_GSU1_LPA0_LPB4_PGR1_SNLL1_TT4_8_VW4_WG16_16_1_WGM8
    SolutionIndex: 172
    SolutionNameMin: Cijk_Alik_Bljk_SB_MT128x32x16_EPS0_GSU1_LPA0_LPB4_PGR0_SNLL0_TT4_4_VW4_WG32_8_1_WGM8
    SolutionIndex: 173
    SolutionNameMin: Cijk_Alik_Bljk_SB_MT64x32x16_EPS1_GSU5_LPA0_LPB4_PGR1_SNLL0_TT4_4_VW4_WG16_8_1_WGM8
    SolutionIndex: 174
    SolutionNameMin: Cijk_Alik_Bljk_SB_MT64x64x16_EPS1_GSU5_LPA0_LPB4_PGR1_SNLL0_TT4_4_VW4_WG16_16_1_WGM8
    SolutionIndex: 175
    SolutionNameMin: Cijk_Alik_Bljk_SB_MT64x32x16_EPS1_GSU1_LPA0_LPB4_PGR1_SNLL1_TT4_4_VW4_WG16_8_1_WGM64
    SolutionIndex: 176
    SolutionNameMin: Cijk_Alik_Bljk_SB_MT32x256x16_EPS1_GSU1_LPA0_LPB4_PGR1_SNLL1_TT4_8_VW4_WG8_32_1_WGM64
    SolutionIndex: 177
    SolutionNameMin: Cijk_Alik_Bljk_SB_MT64x128x16_EPS1_GSU1_LPA0_LPB4_PGR1_SNLL1_TT8_4_VW4_WG8_32_1_WGM64
    SolutionIndex: 178
    SolutionNameMin: Cijk_Alik_Bljk_SB_MT64x128x16_EPS1_GSU1_LPA0_LPB4_PGR1_SNLL1_TT4_8_VW4_WG16_16_1_WGM64
    SolutionIndex: 179
    SolutionNameMin: Cijk_Alik_Bljk_SB_MT128x64x16_EPS1_GSU1_LPA0_LPB4_PGR1_SNLL1_TT4_8_VW4_WG32_8_1_WGM64
    SolutionIndex: 180
    SolutionNameMin: Cijk_Alik_Bljk_SB_MT64x32x16_EPS1_GSU5_LPA0_LPB4_PGR1_SNLL0_TT4_4_VW4_WG16_8_1_WGM64
    SolutionIndex: 181
    SolutionNameMin: Cijk_Alik_Bljk_SB_MT32x128x32_EPS1_GSU5_LPA0_LPB4_PGR1_SNLL0_TT4_4_VW4_WG8_32_1_WGM8
    SolutionIndex: 182
    SolutionNameMin: Cijk_Alik_Bljk_SB_MT32x128x32_EPS1_GSU1_LPA0_LPB4_PGR1_SNLL1_TT4_4_VW4_WG8_32_1_WGM64
    SolutionIndex: 183
    SolutionNameMin: Cijk_Alik_Bljk_SB_MT128x32x8_EPS1_GSU1_LPA2_LPB2_PGR1_SNLL1_TT4_4_VW2_WG32_8_1_WGM64
    SolutionIndex: 184
    SolutionNameMin: Cijk_Alik_Bljk_SB_MT64x32x16_EPS1_GSU3_LPA2_LPB2_PGR1_SNLL0_TT4_4_VW2_WG16_8_1_WGM1
    SolutionIndex: 185
    SolutionNameMin: Cijk_Alik_Bljk_SB_MT32x128x16_EPS1_GSU3_LPA2_LPB2_PGR1_SNLL0_TT4_4_VW2_WG8_32_1_WGM1
    SolutionIndex: 186
    SolutionNameMin: Cijk_Alik_Bljk_SB_MT64x64x16_EPS1_GSU3_LPA2_LPB2_PGR1_SNLL0_TT4_4_VW2_WG16_16_1_WGM1
    SolutionIndex: 187
    SolutionNameMin: Cijk_Alik_Bljk_SB_MT64x128x16_EPS1_GSU3_LPA2_LPB2_PGR1_SNLL0_TT4_8_VW2_WG16_16_1_WGM1
    SolutionIndex: 188
    SolutionNameMin: Cijk_Alik_Bljk_SB_MT128x32x16_EPS1_GSU3_LPA2_LPB2_PGR1_SNLL0_TT4_4_VW2_WG32_8_1_WGM1
    SolutionIndex: 189
    SolutionNameMin: Cijk_Alik_Bljk_SB_MT64x32x16_EPS1_GSU5_LPA2_LPB2_PGR1_SNLL0_TT4_4_VW2_WG16_8_1_WGM1
    SolutionIndex: 190
    SolutionNameMin: Cijk_Alik_Bljk_SB_MT64x64x16_EPS0_GSU5_LPA2_LPB2_PGR0_SNLL0_TT4_4_VW2_WG16_16_1_WGM1
    SolutionIndex: 191
    SolutionNameMin: Cijk_Alik_Bljk_SB_MT64x64x16_EPS1_GSU5_LPA2_LPB2_PGR1_SNLL0_TT4_4_VW2_WG16_16_1_WGM1
    SolutionIndex: 192
    SolutionNameMin: Cijk_Alik_Bljk_SB_MT128x64x16_EPS1_GSU5_LPA2_LPB2_PGR1_SNLL0_TT8_4_VW2_WG16_16_1_WGM1
    SolutionIndex: 193
    SolutionNameMin: Cijk_Alik_Bljk_SB_MT128x64x16_EPS1_GSU5_LPA2_LPB2_PGR1_SNLL0_TT4_8_VW2_WG32_8_1_WGM1
    SolutionIndex: 194
    SolutionNameMin: Cijk_Alik_Bljk_SB_MT64x32x16_EPS1_GSU1_LPA2_LPB2_PGR1_SNLL1_TT4_4_VW2_WG16_8_1_WGM8
    SolutionIndex: 195
    SolutionNameMin: Cijk_Alik_Bljk_SB_MT64x64x16_EPS1_GSU1_LPA2_LPB2_PGR1_SNLL1_TT4_4_VW2_WG16_16_1_WGM8
    SolutionIndex: 196
    SolutionNameMin: Cijk_Alik_Bljk_SB_MT128x64x16_EPS1_GSU1_LPA2_LPB2_PGR1_SNLL1_TT8_4_VW2_WG16_16_1_WGM8
    SolutionIndex: 197
    SolutionNameMin: Cijk_Alik_Bljk_SB_MT64x128x16_EPS1_GSU3_LPA2_LPB2_PGR1_SNLL0_TT8_4_VW2_WG8_32_1_WGM8
    SolutionIndex: 198
    SolutionNameMin: Cijk_Alik_Bljk_SB_MT32x128x16_EPS1_GSU5_LPA2_LPB2_PGR1_SNLL0_TT4_4_VW2_WG8_32_1_WGM8
    SolutionIndex: 199
    SolutionNameMin: Cijk_Alik_Bljk_SB_MT64x128x16_EPS1_GSU5_LPA2_LPB2_PGR1_SNLL0_TT8_4_VW2_WG8_32_1_WGM8
    SolutionIndex: 200
    SolutionNameMin: Cijk_Alik_Bljk_SB_MT64x64x16_EPS1_GSU5_LPA2_LPB2_PGR1_SNLL0_TT4_4_VW2_WG16_16_1_WGM8
    SolutionIndex: 201
    SolutionNameMin: Cijk_Alik_Bljk_SB_MT64x128x16_EPS1_GSU5_LPA2_LPB2_PGR1_SNLL0_TT4_8_VW2_WG16_16_1_WGM8
    SolutionIndex: 202
    SolutionNameMin: Cijk_Alik_Bljk_SB_MT64x64x16_EPS1_GSU1_LPA2_LPB2_PGR1_SNLL1_TT4_4_VW2_WG16_16_1_WGM64
    SolutionIndex: 203
    SolutionNameMin: Cijk_Alik_Bljk_SB_MT64x128x16_EPS1_GSU1_LPA2_LPB2_PGR1_SNLL1_TT4_8_VW2_WG16_16_1_WGM64
    SolutionIndex: 204
    SolutionNameMin: Cijk_Alik_Bljk_SB_MT64x128x16_EPS1_GSU3_LPA2_LPB2_PGR1_SNLL0_TT4_8_VW2_WG16_16_1_WGM64
    SolutionIndex: 205
    SolutionNameMin: Cijk_Alik_Bljk_SB_MT128x64x16_EPS1_GSU3_LPA2_LPB2_PGR1_SNLL0_TT8_4_VW2_WG16_16_1_WGM64
    SolutionIndex: 206
    SolutionNameMin: Cijk_Alik_Bljk_SB_MT64x32x16_EPS1_GSU5_LPA2_LPB2_PGR1_SNLL0_TT4_4_VW2_WG16_8_1_WGM64
    SolutionIndex: 207
    SolutionNameMin: Cijk_Alik_Bljk_SB_MT64x64x16_EPS1_GSU5_LPA2_LPB2_PGR1_SNLL0_TT4_4_VW2_WG16_16_1_WGM64
    SolutionIndex: 208
    SolutionNameMin: Cijk_Alik_Bljk_SB_MT32x128x32_EPS1_GSU5_LPA2_LPB2_PGR1_SNLL0_TT4_4_VW2_WG8_32_1_WGM1
    SolutionIndex: 209
    SolutionNameMin: Cijk_Alik_Bljk_SB_MT64x128x32_EPS1_GSU1_LPA2_LPB2_PGR1_SNLL1_TT8_4_VW2_WG8_32_1_WGM8
    SolutionIndex: 210
    SolutionNameMin: Cijk_Alik_Bljk_SB_MT64x64x32_EPS1_GSU5_LPA2_LPB2_PGR1_SNLL0_TT4_4_VW2_WG16_16_1_WGM64
    SolutionIndex: 211
    SolutionNameMin: Cijk_Alik_Bljk_SB_MT128x32x8_EPS1_GSU1_LPA4_LPB4_PGR1_SNLL1_TT4_4_VW4_WG32_8_1_WGM8
    SolutionIndex: 212
    SolutionNameMin: Cijk_Alik_Bljk_SB_MT128x64x8_EPS1_GSU1_LPA4_LPB4_PGR1_SNLL1_TT4_8_VW4_WG32_8_1_WGM8
    SolutionIndex: 213
    SolutionNameMin: Cijk_Alik_Bljk_SB_MT64x32x16_EPS1_GSU1_LPA4_LPB4_PGR1_SNLL1_TT4_4_VW4_WG16_8_1_WGM1
    SolutionIndex: 214
    SolutionNameMin: Cijk_Alik_Bljk_SB_MT32x128x16_EPS1_GSU1_LPA4_LPB4_PGR1_SNLL1_TT4_4_VW4_WG8_32_1_WGM1
    SolutionIndex: 215
    SolutionNameMin: Cijk_Alik_Bljk_SB_MT64x64x16_EPS1_GSU1_LPA4_LPB4_PGR1_SNLL1_TT4_4_VW4_WG16_16_1_WGM1
    SolutionIndex: 216
    SolutionNameMin: Cijk_Alik_Bljk_SB_MT128x64x16_EPS1_GSU1_LPA4_LPB4_PGR1_SNLL1_TT8_4_VW4_WG16_16_1_WGM1
    SolutionIndex: 217
    SolutionNameMin: Cijk_Alik_Bljk_SB_MT128x32x16_EPS1_GSU1_LPA4_LPB4_PGR1_SNLL1_TT4_4_VW4_WG32_8_1_WGM1
    SolutionIndex: 218
    SolutionNameMin: Cijk_Alik_Bljk_SB_MT128x64x16_EPS1_GSU1_LPA4_LPB4_PGR1_SNLL1_TT4_8_VW4_WG32_8_1_WGM1
    SolutionIndex: 219
    SolutionNameMin: Cijk_Alik_Bljk_SB_MT256x32x16_EPS0_GSU1_LPA4_LPB4_PGR0_SNLL0_TT8_4_VW4_WG32_8_1_WGM1
    SolutionIndex: 220
    SolutionNameMin: Cijk_Alik_Bljk_SB_MT128x64x16_EPS1_GSU3_LPA4_LPB4_PGR1_SNLL0_TT8_4_VW4_WG16_16_1_WGM1
    SolutionIndex: 221
    SolutionNameMin: Cijk_Alik_Bljk_SB_MT64x32x16_EPS1_GSU5_LPA4_LPB4_PGR1_SNLL0_TT4_4_VW4_WG16_8_1_WGM1
    SolutionIndex: 222
    SolutionNameMin: Cijk_Alik_Bljk_SB_MT64x128x16_EPS1_GSU1_LPA4_LPB4_PGR1_SNLL1_TT8_4_VW4_WG8_32_1_WGM8
    SolutionIndex: 223
    SolutionNameMin: Cijk_Alik_Bljk_SB_MT64x64x16_EPS1_GSU1_LPA4_LPB4_PGR1_SNLL1_TT4_4_VW4_WG16_16_1_WGM8
    SolutionIndex: 224
    SolutionNameMin: Cijk_Alik_Bljk_SB_MT64x128x16_EPS1_GSU1_LPA4_LPB4_PGR1_SNLL1_TT4_8_VW4_WG16_16_1_WGM8
    SolutionIndex: 225
    SolutionNameMin: Cijk_Alik_Bljk_SB_MT128x64x16_EPS1_GSU1_LPA4_LPB4_PGR1_SNLL1_TT8_4_VW4_WG16_16_1_WGM8
    SolutionIndex: 226
    SolutionNameMin: Cijk_Alik_Bljk_SB_MT128x128x16_EPS1_GSU1_LPA4_LPB4_PGR1_SNLL1_TT8_8_VW4_WG16_16_1_WGM8
    SolutionIndex: 227
    SolutionNameMin: Cijk_Alik_Bljk_SB_MT128x32x16_EPS0_GSU1_LPA4_LPB4_PGR0_SNLL0_TT4_4_VW4_WG32_8_1_WGM8
    SolutionIndex: 228
    SolutionNameMin: Cijk_Alik_Bljk_SB_MT128x32x16_EPS1_GSU1_LPA4_LPB4_PGR1_SNLL1_TT4_4_VW4_WG32_8_1_WGM8
    SolutionIndex: 229
    SolutionNameMin: Cijk_Alik_Bljk_SB_MT128x64x16_EPS1_GSU1_LPA4_LPB4_PGR1_SNLL1_TT4_8_VW4_WG32_8_1_WGM8
    SolutionIndex: 230
    SolutionNameMin: Cijk_Alik_Bljk_SB_MT64x32x16_EPS1_GSU5_LPA4_LPB4_PGR1_SNLL0_TT4_4_VW4_WG16_8_1_WGM8
    SolutionIndex: 231
    SolutionNameMin: Cijk_Alik_Bljk_SB_MT64x32x16_EPS1_GSU1_LPA4_LPB4_PGR1_SNLL1_TT4_4_VW4_WG16_8_1_WGM64
    SolutionIndex: 232
    SolutionNameMin: Cijk_Alik_Bljk_SB_MT32x128x16_EPS1_GSU1_LPA4_LPB4_PGR1_SNLL1_TT4_4_VW4_WG8_32_1_WGM64
    SolutionIndex: 233
    SolutionNameMin: Cijk_Alik_Bljk_SB_MT64x128x16_EPS1_GSU1_LPA4_LPB4_PGR1_SNLL1_TT8_4_VW4_WG8_32_1_WGM64
    SolutionIndex: 234
    SolutionNameMin: Cijk_Alik_Bljk_SB_MT64x64x16_EPS1_GSU1_LPA4_LPB4_PGR1_SNLL1_TT4_4_VW4_WG16_16_1_WGM64
    SolutionIndex: 235
    SolutionNameMin: Cijk_Alik_Bljk_SB_MT64x128x16_EPS1_GSU1_LPA4_LPB4_PGR1_SNLL1_TT4_8_VW4_WG16_16_1_WGM64
    SolutionIndex: 236
    SolutionNameMin: Cijk_Alik_Bljk_SB_MT128x64x16_EPS1_GSU1_LPA4_LPB4_PGR1_SNLL1_TT8_4_VW4_WG16_16_1_WGM64
    SolutionIndex: 237
    SolutionNameMin: Cijk_Alik_Bljk_SB_MT128x128x16_EPS1_GSU1_LPA4_LPB4_PGR1_SNLL1_TT8_8_VW4_WG16_16_1_WGM64
    SolutionIndex: 238
    SolutionNameMin: Cijk_Alik_Bljk_SB_MT128x32x16_EPS1_GSU1_LPA4_LPB4_PGR1_SNLL1_TT4_4_VW4_WG32_8_1_WGM64
    SolutionIndex: 239
    SolutionNameMin: Cijk_Alik_Bljk_SB_MT128x64x16_EPS1_GSU1_LPA4_LPB4_PGR1_SNLL1_TT4_8_VW4_WG32_8_1_WGM64
    SolutionIndex: 240
    SolutionNameMin: Cijk_Alik_Bljk_SB_MT32x128x16_EPS1_GSU5_LPA4_LPB4_PGR1_SNLL0_TT4_4_VW4_WG8_32_1_WGM64
    SolutionIndex: 241
    SolutionNameMin: Cijk_Alik_Bljk_SB_MT32x128x32_EPS1_GSU1_LPA4_LPB4_PGR1_SNLL1_TT4_4_VW4_WG8_32_1_WGM1
    SolutionIndex: 242
    SolutionNameMin: Cijk_Alik_Bljk_SB_MT64x64x32_EPS1_GSU1_LPA4_LPB4_PGR1_SNLL1_TT4_4_VW4_WG16_16_1_WGM1
    SolutionIndex: 243
    SolutionNameMin: Cijk_Alik_Bljk_SB_MT32x128x32_EPS1_GSU5_LPA4_LPB4_PGR1_SNLL0_TT4_4_VW4_WG8_32_1_WGM1
    SolutionIndex: 244
    SolutionNameMin: Cijk_Alik_Bljk_SB_MT64x64x32_EPS1_GSU1_LPA4_LPB4_PGR1_SNLL1_TT4_4_VW4_WG16_16_1_WGM8
    SolutionIndex: 245
    SolutionNameMin: Cijk_Alik_Bljk_SB_MT64x128x32_EPS1_GSU1_LPA4_LPB4_PGR1_SNLL1_TT4_8_VW4_WG16_16_1_WGM8
    SolutionIndex: 246
    SolutionNameMin: Cijk_Alik_Bljk_SB_MT64x64x32_EPS1_GSU1_LPA4_LPB4_PGR1_SNLL1_TT4_4_VW4_WG16_16_1_WGM64
    SolutionIndex: 247
    SolutionNameMin: Cijk_Alik_Bljk_SB_MT64x128x32_EPS1_GSU1_LPA4_LPB4_PGR1_SNLL1_TT4_8_VW4_WG16_16_1_WGM64
    SolutionIndex: 248
    SolutionNameMin: Cijk_Alik_Bljk_SB_MT16x8x32_SE_EPS1_GSU1_PGR1_SNLL1_TT4_2_VW2_WG4_4_8_WGM8
    SolutionIndex: 249
    SolutionNameMin: Cijk_Alik_Bljk_SB_MT16x8x32_SE_EPS1_GSU1_PGR1_SNLL1_TT4_2_VW2_WG4_4_8_WGM16
    SolutionIndex: 250
    SolutionNameMin: Cijk_Alik_Bljk_SB_MT128x64x8_SE_EPS1_GSU1_PGR1_SNLL1_TT8_4_VW4_WG16_16_1_WGM1
    SolutionIndex: 251
    SolutionNameMin: Cijk_Alik_Bljk_SB_MT32x32x8_SE_EPS1_GSU1_PGR1_SNLL1_TT4_4_VW4_WG8_8_1_WGM1
    SolutionIndex: 252
    SolutionNameMin: Cijk_Alik_Bljk_SB_MT16x16x32_SE_EPS1_GSU1_PGR1_SNLL1_TT4_4_VW4_WG4_4_8_WGM1
    SolutionIndex: 253
    SolutionNameMin: Cijk_Alik_Bljk_SB_MT32x8x8_SE_EPS1_GSU1_PGR1_SNLL1_TT4_4_VW4_WG8_2_4_WGM8
    SolutionIndex: 254
    SolutionNameMin: Cijk_Alik_Bljk_SB_MT32x32x8_SE_EPS1_GSU1_PGR1_SNLL1_TT4_4_VW4_WG8_8_1_WGM8
    SolutionIndex: 255
    SolutionNameMin: Cijk_Alik_Bljk_SB_MT16x16x32_SE_EPS1_GSU8_PGR1_SNLL0_TT4_4_VW4_WG4_4_8_WGM8
    SolutionIndex: 256
    SolutionNameMin: Cijk_Alik_Bljk_SB_MT64x64x16_SE_EPS1_GSU1_PGR1_SNLL1_TT4_4_VW4_WG16_16_1_WGM16
    SolutionIndex: 257
    SolutionNameMin: Cijk_Alik_Bljk_SB_MT16x32x16_SE_EPS1_GSU1_PGR1_SNLL1_TT8_4_VW4_WG2_8_4_WGM64
    SolutionIndex: 258
    SolutionNameMin: Cijk_Alik_Bljk_SB_MT16x16x32_SE_EPS1_GSU1_PGR1_SNLL1_TT4_4_VW4_WG4_4_8_WGM64
    SolutionIndex: 259
    SolutionNameMin: Cijk_Alik_Bljk_SB_MT128x128x16_SE_EPS1_FL1_GRVW4_LPA0_LPB0_PGR1_PLR1_SNLL1_TT8_8_USFGRO0_VW2_WG16_16_1_WGM1
    SolutionIndex: 260
    SolutionNameMin: Cijk_Alik_Bljk_SB_MT128x128x16_SE_EPS1_FL0_GRVW4_LPA0_LPB0_PGR1_PLR1_SNLL1_TT8_8_USFGRO0_VW2_WG16_16_1_WGM8
    SolutionIndex: 261
    SolutionNameMin: Cijk_Alik_Bljk_SB_MT128x128x16_SE_EPS1_FL0_GRVW4_LPA0_LPB0_PGR1_PLR1_SNLL1_TT8_8_USFGRO1_VW2_WG16_16_1_WGM8
    SolutionIndex: 262
    SolutionNameMin: Cijk_Alik_Bljk_SB_MT128x128x16_SE_EPS1_FL1_GRVW4_LPA0_LPB0_PGR1_PLR1_SNLL1_TT8_8_USFGRO0_VW2_WG16_16_1_WGM8
    SolutionIndex: 263
    SolutionNameMin: Cijk_Alik_Bljk_SB_MT128x128x16_SE_EPS1_FL1_GRVW4_LPA0_LPB0_PGR1_PLR1_SNLL1_TT8_8_USFGRO1_VW2_WG16_16_1_WGM8
    SolutionIndex: 264
    SolutionNameMin: Cijk_Alik_Bljk_SB_MT128x128x16_SE_EPS1_FL0_GRVW4_LPA0_LPB0_PGR1_PLR1_SNLL1_TT8_8_USFGRO0_VW4_WG16_16_1_WGM1
    SolutionIndex: 265
    SolutionNameMin: Cijk_Alik_Bljk_SB_MT128x128x16_SE_EPS1_FL0_GRVW4_LPA0_LPB0_PGR1_PLR1_SNLL1_TT8_8_USFGRO1_VW4_WG16_16_1_WGM1
    SolutionIndex: 266
    SolutionNameMin: Cijk_Alik_Bljk_SB_MT128x128x16_SE_EPS1_FL1_GRVW4_LPA0_LPB0_PGR1_PLR1_SNLL1_TT8_8_USFGRO0_VW4_WG16_16_1_WGM1
    SolutionIndex: 267
    SolutionNameMin: Cijk_Alik_Bljk_SB_MT128x128x16_SE_EPS1_FL1_GRVW4_LPA0_LPB0_PGR1_PLR1_SNLL1_TT8_8_USFGRO1_VW4_WG16_16_1_WGM1
    SolutionIndex: 268
    SolutionNameMin: Cijk_Alik_Bljk_SB_MT128x128x16_SE_EPS1_FL0_GRVW4_LPA0_LPB0_PGR1_PLR1_SNLL1_TT8_8_USFGRO0_VW4_WG16_16_1_WGM8
    SolutionIndex: 269
    SolutionNameMin: Cijk_Alik_Bljk_SB_MT128x128x16_SE_EPS1_FL0_GRVW4_LPA0_LPB0_PGR1_PLR1_SNLL1_TT8_8_USFGRO1_VW4_WG16_16_1_WGM8
    SolutionIndex: 270
    SolutionNameMin: Cijk_Alik_Bljk_SB_MT128x128x16_SE_EPS1_FL1_GRVW4_LPA0_LPB0_PGR1_PLR1_SNLL1_TT8_8_USFGRO0_VW4_WG16_16_1_WGM8
    SolutionIndex: 271
    SolutionNameMin: Cijk_Alik_Bljk_SB_MT128x128x16_SE_EPS1_FL1_GRVW4_LPA0_LPB0_PGR1_PLR1_SNLL1_TT8_8_USFGRO1_VW4_WG16_16_1_WGM8
    SolutionIndex: 272
    SolutionNameMin: Cijk_Alik_Bljk_SB_MT64x128x16_SE_EPS1_FL0_GRVW2_LPA0_LPB4_PGR1_PLR1_SNLL1_TT4_8_USFGRO0_VW4_WG16_16_1_WGM1
    SolutionIndex: 273
    SolutionNameMin: Cijk_Alik_Bljk_SB_MT64x128x16_SE_EPS1_FL0_GRVW2_LPA0_LPB4_PGR1_PLR1_SNLL1_TT4_8_USFGRO1_VW4_WG16_16_1_WGM1
    SolutionIndex: 274
    SolutionNameMin: Cijk_Alik_Bljk_SB_MT64x128x16_SE_EPS1_FL1_GRVW2_LPA0_LPB4_PGR1_PLR1_SNLL1_TT4_8_USFGRO0_VW4_WG16_16_1_WGM1
    SolutionIndex: 275
    SolutionNameMin: Cijk_Alik_Bljk_SB_MT64x128x16_SE_EPS1_FL1_GRVW2_LPA0_LPB4_PGR1_PLR1_SNLL1_TT4_8_USFGRO1_VW4_WG16_16_1_WGM1
    SolutionIndex: 276
    SolutionNameMin: Cijk_Alik_Bljk_SB_MT64x128x16_SE_EPS1_FL1_GRVW4_LPA0_LPB2_PGR1_PLR1_SNLL1_TT4_8_USFGRO1_VW2_WG16_16_1_WGM1
    SolutionIndex: 277
    SolutionNameMin: Cijk_Alik_Bljk_SB_MT64x128x16_SE_EPS1_FL0_GRVW1_LPA2_LPB2_PGR1_PLR1_SNLL1_TT4_8_USFGRO1_VW2_WG16_16_1_WGM1
    SolutionIndex: 278
    SolutionNameMin: Cijk_Alik_Bljk_SB_MT64x128x16_SE_EPS1_FL0_GRVW1_LPA4_LPB4_PGR1_PLR1_SNLL1_TT4_8_USFGRO0_VW4_WG16_16_1_WGM1
    SolutionIndex: 279
    SolutionNameMin: Cijk_Alik_Bljk_SB_MT64x128x16_SE_EPS1_FL0_GRVW1_LPA4_LPB4_PGR1_PLR1_SNLL1_TT4_8_USFGRO1_VW4_WG16_16_1_WGM1
    SolutionIndex: 280
    SolutionNameMin: Cijk_Alik_Bljk_SB_MT64x128x16_SE_EPS1_FL0_GRVW2_LPA2_LPB2_PGR1_PLR1_SNLL1_TT4_8_USFGRO0_VW2_WG16_16_1_WGM1
    SolutionIndex: 281
    SolutionNameMin: Cijk_Alik_Bljk_SB_MT64x128x16_SE_EPS1_FL0_GRVW2_LPA2_LPB2_PGR1_PLR1_SNLL1_TT4_8_USFGRO1_VW2_WG16_16_1_WGM1
    SolutionIndex: 282
    SolutionNameMin: Cijk_Alik_Bljk_SB_MT64x128x16_SE_EPS1_FL1_GRVW2_LPA2_LPB2_PGR1_PLR1_SNLL1_TT4_8_USFGRO0_VW2_WG16_16_1_WGM1
    SolutionIndex: 283
    SolutionNameMin: Cijk_Alik_Bljk_SB_MT64x128x16_SE_EPS1_FL1_GRVW2_LPA2_LPB2_PGR1_PLR1_SNLL1_TT4_8_USFGRO1_VW2_WG16_16_1_WGM1
    SolutionIndex: 284
    SolutionNameMin: Cijk_Alik_Bljk_SB_MT64x128x16_SE_EPS1_FL0_GRVW2_LPA4_LPB4_PGR1_PLR1_SNLL1_TT4_8_USFGRO0_VW4_WG16_16_1_WGM1
    SolutionIndex: 285
    SolutionNameMin: Cijk_Alik_Bljk_SB_MT64x128x16_SE_EPS1_FL0_GRVW2_LPA4_LPB4_PGR1_PLR1_SNLL1_TT4_8_USFGRO1_VW4_WG16_16_1_WGM1
    SolutionIndex: 286
    SolutionNameMin: Cijk_Alik_Bljk_SB_MT64x128x16_SE_EPS1_FL1_GRVW2_LPA4_LPB4_PGR1_PLR1_SNLL1_TT4_8_USFGRO0_VW4_WG16_16_1_WGM1
    SolutionIndex: 287
    SolutionNameMin: Cijk_Alik_Bljk_SB_MT64x128x16_SE_EPS1_FL1_GRVW2_LPA4_LPB4_PGR1_PLR1_SNLL1_TT4_8_USFGRO1_VW4_WG16_16_1_WGM1
    SolutionIndex: 288
    SolutionNameMin: Cijk_Alik_Bljk_SB_MT128x64x16_SE_EPS1_FL0_GRVW2_LPA4_LPB4_PGR1_PLR1_SNLL1_TT8_4_USFGRO0_VW4_WG16_16_1_WGM1
    SolutionIndex: 289
    SolutionNameMin: Cijk_Alik_Bljk_SB_MT128x64x16_SE_EPS1_FL0_GRVW2_LPA4_LPB4_PGR1_PLR1_SNLL1_TT8_4_USFGRO1_VW4_WG16_16_1_WGM1
    SolutionIndex: 290
    SolutionNameMin: Cijk_Alik_Bljk_SB_MT128x64x16_SE_EPS1_FL1_GRVW2_LPA4_LPB4_PGR1_PLR1_SNLL1_TT8_4_USFGRO0_VW4_WG16_16_1_WGM1
    SolutionIndex: 291
    SolutionNameMin: Cijk_Alik_Bljk_SB_MT128x64x16_SE_EPS1_FL1_GRVW2_LPA4_LPB4_PGR1_PLR1_SNLL1_TT8_4_USFGRO1_VW4_WG16_16_1_WGM8
    SolutionIndex: 292
    SolutionNameMin: Cijk_Alik_Bljk_SB_MT64x128x16_SE_EPS1_FL0_GRVW4_LPA4_LPB4_PGR1_PLR1_SNLL1_TT4_8_USFGRO0_VW4_WG16_16_1_WGM1
    SolutionIndex: 293
    SolutionNameMin: Cijk_Alik_Bljk_SB_MT64x128x16_SE_EPS1_FL1_GRVW4_LPA4_LPB4_PGR1_PLR1_SNLL1_TT4_8_USFGRO1_VW4_WG16_16_1_WGM1
    SolutionIndex: 294
    SolutionNameMin: Cijk_Alik_Bljk_SB_MT32x32x16_SE_EPS0_FL1_GRVW4_LPA1_LPB0_PGR0_PLR1_SNLL0_TT2_4_USFGRO1_VW1_WG16_8_1_WGM8
    SolutionIndex: 295
    SolutionNameMin: Cijk_Alik_Bljk_SB_MT32x32x16_SE_EPS0_FL0_GRVW1_LPA1_LPB1_PGR0_PLR1_SNLL0_TT2_4_USFGRO1_VW1_WG16_8_1_WGM1
    SolutionIndex: 296
    SolutionNameMin: Cijk_Alik_Bljk_SB_MT32x32x16_SE_EPS0_FL0_GRVW1_LPA1_LPB1_PGR0_PLR1_SNLL0_TT2_4_USFGRO1_VW1_WG16_8_1_WGM8
    SolutionIndex: 297
    SolutionNameMin: Cijk_Alik_Bljk_SB_MT64x64x16_SE_EPS0_FL0_GRVW4_LPA1_LPB1_PGR0_PLR1_SNLL0_TT4_4_USFGRO1_VW1_WG16_16_1_WGM1
    SolutionIndex: 298
    SolutionNameMin: Cijk_Alik_Bljk_SB_MT64x64x16_SE_EPS0_FL1_GRVW4_LPA1_LPB1_PGR0_PLR1_SNLL0_TT4_4_USFGRO1_VW1_WG16_16_1_WGM1
    SolutionIndex: 299
    SolutionNameMin: Cijk_Alik_Bljk_SB_MT32x32x16_SE_EPS0_FL0_GRVW4_LPA1_LPB1_PGR0_PLR1_SNLL0_TT2_4_USFGRO1_VW1_WG16_8_1_WGM1
    SolutionIndex: 300
    SolutionNameMin: Cijk_Alik_Bljk_SB_MT32x32x16_SE_EPS0_FL1_GRVW4_LPA1_LPB1_PGR0_PLR1_SNLL0_TT2_4_USFGRO1_VW1_WG16_8_1_WGM1
    SolutionIndex: 301
    SolutionNameMin: Cijk_Alik_Bljk_SB_MT32x32x16_SE_EPS0_FL0_GRVW4_LPA1_LPB1_PGR0_PLR1_SNLL0_TT4_2_USFGRO1_VW1_WG8_16_1_WGM1
    SolutionIndex: 302
    SolutionNameMin: Cijk_Alik_Bljk_SB_MT32x32x16_SE_EPS0_FL1_GRVW4_LPA1_LPB1_PGR0_PLR1_SNLL0_TT4_2_USFGRO1_VW1_WG8_16_1_WGM1
    SolutionIndex: 303
    SolutionNameMin: Cijk_Alik_Bljk_SB_MT64x64x16_SE_EPS0_FL0_GRVW4_LPA1_LPB1_PGR0_PLR1_SNLL0_TT4_4_USFGRO1_VW1_WG16_16_1_WGM8
    SolutionIndex: 304
    SolutionNameMin: Cijk_Alik_Bljk_SB_MT64x64x16_SE_EPS0_FL1_GRVW4_LPA1_LPB1_PGR0_PLR1_SNLL0_TT4_4_USFGRO1_VW1_WG16_16_1_WGM8
    SolutionIndex: 305
    SolutionNameMin: Cijk_Alik_Bljk_SB_MT32x32x16_SE_EPS0_FL0_GRVW4_LPA1_LPB1_PGR0_PLR1_SNLL0_TT2_4_USFGRO1_VW1_WG16_8_1_WGM8
    SolutionIndex: 306
    SolutionNameMin: Cijk_Alik_Bljk_SB_MT32x32x16_SE_EPS0_FL1_GRVW4_LPA1_LPB1_PGR0_PLR1_SNLL0_TT2_4_USFGRO1_VW1_WG16_8_1_WGM8
    SolutionIndex: 307
    SolutionNameMin: Cijk_Alik_Bljk_SB_MT32x32x16_SE_EPS0_FL0_GRVW4_LPA1_LPB1_PGR0_PLR1_SNLL0_TT4_2_USFGRO1_VW1_WG8_16_1_WGM8
    SolutionIndex: 308
    SolutionNameMin: Cijk_Alik_Bljk_SB_MT32x32x32_SE_EPS0_FL0_GRVW4_LPA1_LPB1_PGR0_PLR1_SNLL0_TT2_4_USFGRO1_VW1_WG16_8_1_WGM1
    SolutionIndex: 309
    SolutionNameMin: Cijk_Alik_Bljk_SB_MT64x32x8_SE_EPS0_FL1_GRVW4_LPA4_LPB4_PGR0_PLR0_SNLL0_TT4_4_USFGRO1_VW4_WG16_8_1_WGM8
    SolutionIndex: 310
    SolutionNameMin: Cijk_Alik_Bljk_SB_MT64x32x16_SE_EPS0_FL0_GRVW4_LPA4_LPB4_PGR0_PLR1_SNLL0_TT4_4_USFGRO1_VW4_WG16_8_1_WGM1
    SolutionIndex: 311
    SolutionNameMin: Cijk_Alik_Bljk_SB_MT64x32x16_SE_EPS0_FL1_GRVW4_LPA4_LPB4_PGR0_PLR1_SNLL0_TT4_4_USFGRO1_VW4_WG16_8_1_WGM1
    SolutionIndex: 312
    SolutionNameMin: Cijk_Alik_Bljk_SB_MT32x64x16_SE_EPS0_FL1_GRVW4_LPA4_LPB4_PGR0_PLR1_SNLL0_TT4_4_USFGRO1_VW4_WG8_16_1_WGM1
    SolutionIndex: 313
    SolutionNameMin: Cijk_Alik_Bljk_SB_MT64x32x16_SE_EPS0_FL1_GRVW4_LPA4_LPB4_PGR0_PLR1_SNLL0_TT4_4_USFGRO1_VW4_WG16_8_1_WGM8
    SolutionIndex: 314
    SolutionNameMin: Cijk_Alik_Bljk_SB_MT96x64x16_SE_EPS1_FL1_GRVW4_GSU1_PGR1_PLR1_TT6_4_VW2_WG16_16_1_WGM8
    SolutionIndex: 315
    SolutionNameMin: Cijk_Alik_Bljk_SB_MT128x128x16_SE_EPS1_FL0_GRVW2_GSU1_PGR1_PLR1_TT8_8_VW4_WG16_16_1_WGM8
    SolutionIndex: 316
    SolutionNameMin: Cijk_Alik_Bljk_SB_MT128x128x16_SE_EPS1_FL0_GRVW4_GSU1_PGR1_PLR0_TT8_8_VW4_WG16_16_1_WGM8
    SolutionIndex: 317
    SolutionNameMin: Cijk_Alik_Bljk_SB_MT64x32x16_SE_EPS1_FL1_GRVW4_GSU1_PGR1_PLR1_TT4_4_VW2_WG16_8_2_WGM8
    SolutionIndex: 318
    SolutionNameMin: Cijk_Alik_Bljk_SB_MT64x64x16_SE_EPS0_FL0_GRVW4_LPA2_LPB2_PGR0_PLR0_TT4_4_USFGRO1_VW2_WG16_16_1_WGM1
    SolutionIndex: 319
    SolutionNameMin: Cijk_Alik_Bljk_SB_MT64x64x16_SE_EPS0_FL0_GRVW4_LPA4_LPB4_PGR0_PLR1_TT4_4_USFGRO1_VW4_WG16_16_1_WGM8
    SolutionIndex: 320
    SolutionNameMin: Cijk_Alik_Bljk_SB_MT64x64x16_SE_EPS1_FL1_GRVW4_LPA0_LPB0_PGR1_PLR1_TT4_4_USFGRO1_VW4_WG16_16_1_WGM8
    SolutionIndex: 321
    SolutionNameMin: Cijk_Alik_Bljk_SB_MT64x64x16_SE_EPS0_FL1_GRVW4_LPA4_LPB4_PGR0_PLR1_TT4_4_USFGRO1_VW4_WG16_16_1_WGM8
    SolutionIndex: 322
    SolutionNameMin: Cijk_Alik_Bljk_SB_MT64x32x16_SE_EPS1_FL1_GRVW4_LPA0_LPB0_PGR1_PLR1_TT4_4_USFGRO1_VW4_WG16_8_2_WGM1
    SolutionIndex: 323
    SolutionNameMin: Cijk_Alik_Bljk_SB_MT8x32x32_SE_EPS1_FL0_GRVW1_LPA0_LPB2_PGR1_PLR1_TT2_2_USFGRO1_VW2_WG4_16_4_WGM1
    SolutionIndex: 324
    SolutionNameMin: Cijk_Alik_Bljk_SB_MT8x32x32_SE_EPS1_FL0_GRVW4_LPA2_LPB2_PGR1_PLR1_TT2_2_USFGRO1_VW2_WG4_16_4_WGM1
    SolutionIndex: 325
    SolutionNameMin: Cijk_Alik_Bljk_SB_MT32x8x32_SE_EPS1_FL0_GRVW2_LPA2_LPB2_PGR1_PLR1_TT2_2_USFGRO1_VW2_WG16_4_4_WGM1
    SolutionIndex: 326
    SolutionNameMin: Cijk_Alik_Bljk_SB_MT32x8x16_SE_EPS1_FL1_GRVW2_LPA0_LPB0_PGR1_PLR1_TT2_2_USFGRO1_VW2_WG16_4_4_WGM1
    SolutionIndex: 327
    SolutionNameMin: Cijk_Alik_Bljk_SB_MT32x16x16_SE_EPS1_FL0_GRVW4_LPA0_LPB0_PGR1_PLR1_TT2_4_USFGRO1_VW2_WG16_4_4_WGM1
    SolutionIndex: 328
    SolutionNameMin: Cijk_Alik_Bljk_SB_MT96x64x8_SE_EPS1_FL1_GRVW4_LPA0_LPB0_PGR1_PLR1_TT6_4_USFGRO1_VW2_WG16_16_1_WGM8
    SolutionIndex: 329
    SolutionNameMin: Cijk_Alik_Bljk_SB_MT64x128x8_SE_EPS1_FL0_GRVW4_LPA0_LPB0_PGR1_PLR0_TT4_8_USFGRO1_VW4_WG16_16_1_WGM1
    SolutionIndex: 330
    SolutionNameMin: Cijk_Alik_Bljk_SB_MT64x128x8_SE_EPS1_FL0_GRVW4_LPA0_LPB0_PGR1_PLR1_TT4_8_USFGRO1_VW4_WG16_16_1_WGM1
    SolutionIndex: 331
    SolutionNameMin: Cijk_Alik_Bljk_SB_MT128x64x8_SE_EPS1_FL0_GRVW4_LPA0_LPB0_PGR1_PLR0_TT8_4_USFGRO1_VW4_WG16_16_1_WGM8
    SolutionIndex: 332
    SolutionNameMin: Cijk_Alik_Bljk_SB_MT128x128x16_SE_EPS1_FL0_GRVW4_LPA0_LPB0_PGR1_PLR1_TT8_8_USFGRO1_VW4_WG16_16_1_WGM1
    SolutionIndex: 333
    SolutionNameMin: Cijk_Alik_Bljk_SB_MT128x128x8_SE_EPS1_FL1_GRVW4_LPA0_LPB0_PGR1_PLR1_TT8_8_USFGRO1_VW4_WG16_16_1_WGM1
    SolutionIndex: 334
    SolutionNameMin: Cijk_Alik_Bljk_SB_MT128x64x8_SE_EPS1_FL1_GRVW4_GSU1_PGR1_PLR1_TT8_4_VW4_WG16_16_1_WGM1
    SolutionIndex: 335
    SolutionNameMin: Cijk_Alik_Bljk_SB_MT32x64x16_SE_EPS1_FL1_GRVW4_GSU1_PGR1_PLR1_TT4_4_VW4_WG8_16_2_WGM1
    SolutionIndex: 336
    SolutionNameMin: Cijk_Alik_Bljk_SB_MT64x64x16_SE_EPS1_FL0_GRVW2_GSU1_PGR1_PLR1_TT4_4_VW2_WG16_16_1_WGM1
    SolutionIndex: 337
    SolutionNameMin: Cijk_Alik_Bljk_SB_MT64x64x16_SE_EPS1_FL0_GRVW2_GSU1_PGR1_PLR1_TT4_4_VW4_WG16_16_1_WGM1
    SolutionIndex: 338
    SolutionNameMin: Cijk_Alik_Bljk_SB_MT64x64x16_SE_EPS1_FL0_GRVW4_GSU1_PGR1_PLR1_TT4_4_VW4_WG16_16_1_WGM8
    SolutionIndex: 339
    SolutionNameMin: Cijk_Alik_Bljk_SB_MT64x64x16_SE_EPS1_FL1_GRVW2_GSU1_PGR1_PLR1_TT4_4_VW4_WG16_16_1_WGM1
    SolutionIndex: 340
    SolutionNameMin: Cijk_Alik_Bljk_SB_MT64x64x16_SE_EPS1_FL1_GRVW4_GSU1_PGR1_PLR1_TT4_4_VW2_WG16_16_1_WGM8
    SolutionIndex: 341
    SolutionNameMin: Cijk_Alik_Bljk_SB_MT64x64x16_SE_EPS1_FL1_GRVW4_GSU1_PGR1_PLR1_TT4_4_VW4_WG16_16_1_WGM1
    SolutionIndex: 342
    SolutionNameMin: Cijk_Alik_Bljk_SB_MT64x64x16_SE_EPS0_FL1_GRVW4_GSU1_PGR0_PLR1_TT4_4_VW4_WG16_16_1_WGM8
    SolutionIndex: 343
    SolutionNameMin: Cijk_Alik_Bljk_SB_MT64x96x16_SE_EPS1_FL0_GRVW2_GSU1_PGR1_PLR1_TT4_6_VW2_WG16_16_1_WGM1
    SolutionIndex: 344
    SolutionNameMin: Cijk_Alik_Bljk_SB_MT64x96x16_SE_EPS1_FL0_GRVW2_GSU1_PGR1_PLR1_TT4_6_VW2_WG16_16_1_WGM8
    SolutionIndex: 345
    SolutionNameMin: Cijk_Alik_Bljk_SB_MT64x128x8_SE_EPS1_FL0_GRVW4_GSU1_PGR1_PLR0_TT4_8_VW4_WG16_16_1_WGM1
    SolutionIndex: 346
    SolutionNameMin: Cijk_Alik_Bljk_SB_MT64x128x16_SE_EPS1_FL0_GRVW4_GSU1_PGR1_PLR0_TT4_8_VW4_WG16_16_1_WGM8
    SolutionIndex: 347
    SolutionNameMin: Cijk_Alik_Bljk_SB_MT64x128x16_SE_EPS1_FL0_GRVW4_GSU1_PGR1_PLR1_TT4_8_VW4_WG16_16_1_WGM1
    SolutionIndex: 348
    SolutionNameMin: Cijk_Alik_Bljk_SB_MT64x128x16_SE_EPS1_FL0_GRVW4_GSU1_PGR1_PLR1_TT4_8_VW4_WG16_16_1_WGM8
    SolutionIndex: 349
    SolutionNameMin: Cijk_Alik_Bljk_SB_MT64x128x8_SE_EPS1_FL1_GRVW2_GSU1_PGR1_PLR1_TT4_8_VW4_WG16_16_1_WGM1
    SolutionIndex: 350
    SolutionNameMin: Cijk_Alik_Bljk_SB_MT64x128x16_SE_EPS1_FL1_GRVW4_GSU1_PGR1_PLR1_TT4_8_VW2_WG16_16_1_WGM8
    SolutionIndex: 351
    SolutionNameMin: Cijk_Alik_Bljk_SB_MT64x128x8_SE_EPS1_FL1_GRVW4_GSU1_PGR1_PLR0_TT4_8_VW4_WG16_16_1_WGM8
    SolutionIndex: 352
    SolutionNameMin: Cijk_Alik_Bljk_SB_MT64x128x16_SE_EPS1_FL1_GRVW4_GSU1_PGR1_PLR1_TT4_8_VW4_WG16_16_1_WGM1
    SolutionIndex: 353
    SolutionNameMin: Cijk_Alik_Bljk_SB_MT64x128x16_SE_EPS1_FL1_GRVW4_GSU1_PGR1_PLR1_TT4_8_VW4_WG16_16_1_WGM8
    SolutionIndex: 354
    SolutionNameMin: Cijk_Alik_Bljk_SB_MT128x64x8_SE_EPS1_FL0_GRVW2_GSU1_PGR1_PLR0_TT8_4_VW4_WG16_16_1_WGM1
    SolutionIndex: 355
    SolutionNameMin: Cijk_Alik_Bljk_SB_MT128x64x8_SE_EPS1_FL0_GRVW2_GSU1_PGR1_PLR0_TT8_4_VW4_WG16_16_1_WGM8
    SolutionIndex: 356
    SolutionNameMin: Cijk_Alik_Bljk_SB_MT128x64x8_SE_EPS1_FL0_GRVW4_GSU1_PGR1_PLR0_TT8_4_VW2_WG16_16_1_WGM8
    SolutionIndex: 357
    SolutionNameMin: Cijk_Alik_Bljk_SB_MT128x64x8_SE_EPS1_FL0_GRVW4_GSU1_PGR1_PLR0_TT8_4_VW4_WG16_16_1_WGM8
    SolutionIndex: 358
    SolutionNameMin: Cijk_Alik_Bljk_SB_MT128x64x16_SE_EPS1_FL0_GRVW4_GSU1_PGR1_PLR1_TT8_4_VW4_WG16_16_1_WGM1
    SolutionIndex: 359
    SolutionNameMin: Cijk_Alik_Bljk_SB_MT128x64x8_SE_EPS1_FL1_GRVW2_GSU1_PGR1_PLR0_TT8_4_VW4_WG16_16_1_WGM1
    SolutionIndex: 360
    SolutionNameMin: Cijk_Alik_Bljk_SB_MT128x64x8_SE_EPS1_FL1_GRVW2_GSU1_PGR1_PLR0_TT8_4_VW4_WG16_16_1_WGM8
    SolutionIndex: 361
    SolutionNameMin: Cijk_Alik_Bljk_SB_MT128x64x8_SE_EPS1_FL1_GRVW2_GSU1_PGR1_PLR1_TT8_4_VW4_WG16_16_1_WGM1
    SolutionIndex: 362
    SolutionNameMin: Cijk_Alik_Bljk_SB_MT128x64x8_SE_EPS1_FL1_GRVW4_GSU1_PGR1_PLR0_TT8_4_VW2_WG16_16_1_WGM1
    SolutionIndex: 363
    SolutionNameMin: Cijk_Alik_Bljk_SB_MT128x64x8_SE_EPS1_FL1_GRVW4_GSU1_PGR1_PLR0_TT8_4_VW2_WG16_16_1_WGM8
    SolutionIndex: 364
    SolutionNameMin: Cijk_Alik_Bljk_SB_MT128x64x8_SE_EPS1_FL1_GRVW4_GSU1_PGR1_PLR0_TT8_4_VW4_WG16_16_1_WGM8
    SolutionIndex: 365
    SolutionNameMin: Cijk_Alik_Bljk_SB_MT128x64x8_SE_EPS1_FL1_GRVW4_GSU1_PGR1_PLR1_TT8_4_VW4_WG16_16_1_WGM1
    SolutionIndex: 366
    SolutionNameMin: Cijk_Alik_Bljk_SB_MT128x128x16_SE_EPS1_FL0_GRVW2_GSU1_PGR1_PLR0_TT8_8_VW2_WG16_16_1_WGM1
    SolutionIndex: 367
    SolutionNameMin: Cijk_Alik_Bljk_SB_MT128x128x16_SE_EPS1_FL0_GRVW2_GSU1_PGR1_PLR0_TT8_8_VW2_WG16_16_1_WGM8
    SolutionIndex: 368
    SolutionNameMin: Cijk_Alik_Bljk_SB_MT128x128x16_SE_EPS1_FL0_GRVW2_GSU1_PGR1_PLR0_TT8_8_VW4_WG16_16_1_WGM1
    SolutionIndex: 369
    SolutionNameMin: Cijk_Alik_Bljk_SB_MT128x128x16_SE_EPS1_FL0_GRVW2_GSU1_PGR1_PLR1_TT8_8_VW4_WG16_16_1_WGM1
    SolutionIndex: 370
    SolutionNameMin: Cijk_Alik_Bljk_SB_MT128x128x16_SE_EPS1_FL0_GRVW2_GSU1_PGR1_PLR1_TT8_8_VW4_WG16_16_1_WGM8
    SolutionIndex: 371
    SolutionNameMin: Cijk_Alik_Bljk_SB_MT128x128x16_SE_EPS1_FL0_GRVW4_GSU1_PGR1_PLR1_TT8_8_VW2_WG16_16_1_WGM1
    SolutionIndex: 372
    SolutionNameMin: Cijk_Alik_Bljk_SB_MT128x128x16_SE_EPS1_FL0_GRVW4_GSU1_PGR1_PLR1_TT8_8_VW4_WG16_16_1_WGM1
    SolutionIndex: 373
    SolutionNameMin: Cijk_Alik_Bljk_SB_MT128x128x16_SE_EPS1_FL1_GRVW2_GSU1_PGR1_PLR0_TT8_8_VW2_WG16_16_1_WGM1
    SolutionIndex: 374
    SolutionNameMin: Cijk_Alik_Bljk_SB_MT128x128x16_SE_EPS1_FL1_GRVW2_GSU1_PGR1_PLR1_TT8_8_VW2_WG16_16_1_WGM1
    SolutionIndex: 375
    SolutionNameMin: Cijk_Alik_Bljk_SB_MT128x128x16_SE_EPS1_FL1_GRVW2_GSU1_PGR1_PLR0_TT8_8_VW4_WG16_16_1_WGM8
    SolutionIndex: 376
    SolutionNameMin: Cijk_Alik_Bljk_SB_MT128x128x16_SE_EPS1_FL1_GRVW2_GSU1_PGR1_PLR1_TT8_8_VW4_WG16_16_1_WGM1
    SolutionIndex: 377
    SolutionNameMin: Cijk_Alik_Bljk_SB_MT128x128x16_SE_EPS1_FL1_GRVW2_GSU1_PGR1_PLR1_TT8_8_VW4_WG16_16_1_WGM8
    SolutionIndex: 378
    SolutionNameMin: Cijk_Alik_Bljk_SB_MT128x128x16_SE_EPS1_FL1_GRVW4_GSU1_PGR1_PLR0_TT8_8_VW2_WG16_16_1_WGM1
    SolutionIndex: 379
    SolutionNameMin: Cijk_Alik_Bljk_SB_MT128x128x16_SE_EPS1_FL1_GRVW4_GSU1_PGR1_PLR0_TT8_8_VW4_WG16_16_1_WGM8
    SolutionIndex: 380
    SolutionNameMin: Cijk_Alik_Bljk_SB_MT128x128x16_SE_EPS1_FL1_GRVW4_GSU1_PGR1_PLR1_TT8_8_VW4_WG16_16_1_WGM1
    SolutionIndex: 381
    SolutionNameMin: Cijk_Alik_Bljk_SB_MT128x128x16_SE_EPS1_FL1_GRVW4_GSU1_PGR1_PLR1_TT8_8_VW4_WG16_16_1_WGM8
    SolutionIndex: 382
    SolutionNameMin: Cijk_Alik_Bljk_SB_MT32x64x16_SE_EPS1_FL0_GRVW4_GSU1_PGR1_PLR1_TT4_4_VW4_WG8_16_2_WGM1
    SolutionIndex: 383
    SolutionNameMin: Cijk_Alik_Bljk_SB_MT32x64x16_SE_EPS1_FL0_GRVW4_GSU1_PGR1_PLR1_TT4_4_VW4_WG8_16_2_WGM8
    SolutionIndex: 384
    SolutionNameMin: Cijk_Alik_Bljk_SB_MT64x32x16_SE_EPS1_FL0_GRVW4_GSU1_PGR1_PLR1_TT4_4_VW2_WG16_8_2_WGM8
    SolutionIndex: 385
    SolutionNameMin: Cijk_Alik_Bljk_SB_MT64x64x8_SE_EPS1_FL0_GRVW2_GSU1_LPA0_LPB0_PGR1_PLR1_TT4_4_WG16_16_1_WGM1
    SolutionIndex: 386
    SolutionNameMin: Cijk_Alik_Bljk_SB_MT64x64x8_SE_EPS1_FL0_GRVW2_GSU1_LPA0_LPB0_PGR1_PLR1_TT4_4_WG16_16_1_WGM8
    SolutionIndex: 387
    SolutionNameMin: Cijk_Alik_Bljk_SB_MT64x64x8_SE_EPS1_FL0_GRVW4_GSU1_LPA0_LPB0_PGR1_PLR1_TT4_4_WG16_16_1_WGM1
    SolutionIndex: 388
    SolutionNameMin: Cijk_Alik_Bljk_SB_MT64x64x8_SE_EPS1_FL0_GRVW4_GSU1_LPA0_LPB0_PGR1_PLR1_TT4_4_WG16_16_1_WGM8
    SolutionIndex: 389
    SolutionNameMin: Cijk_Alik_Bljk_SB_MT64x64x16_SE_EPS0_FL0_GRVW4_GSU1_LPA0_LPB0_PGR0_PLR1_TT4_4_WG16_16_1_WGM1
    SolutionIndex: 390
    SolutionNameMin: Cijk_Alik_Bljk_SB_MT64x64x16_SE_EPS1_FL0_GRVW4_GSU1_LPA0_LPB0_PGR1_PLR1_TT4_4_WG16_16_1_WGM1
    SolutionIndex: 391
    SolutionNameMin: Cijk_Alik_Bljk_SB_MT64x64x16_SE_EPS1_FL0_GRVW4_GSU1_LPA0_LPB0_PGR1_PLR1_TT4_4_WG16_16_1_WGM8
    SolutionIndex: 392
    SolutionNameMin: Cijk_Alik_Bljk_SB_MT64x64x8_SE_EPS1_FL1_GRVW2_GSU1_LPA0_LPB0_PGR1_PLR0_TT4_4_WG16_16_1_WGM1
    SolutionIndex: 393
    SolutionNameMin: Cijk_Alik_Bljk_SB_MT64x64x8_SE_EPS1_FL1_GRVW2_GSU1_LPA0_LPB0_PGR1_PLR1_TT4_4_WG16_16_1_WGM1
    SolutionIndex: 394
    SolutionNameMin: Cijk_Alik_Bljk_SB_MT64x64x16_SE_EPS1_FL1_GRVW4_GSU1_LPA0_LPB0_PGR1_PLR0_TT4_4_WG16_16_1_WGM1
    SolutionIndex: 395
    SolutionNameMin: Cijk_Alik_Bljk_SB_MT64x64x8_SE_EPS1_FL1_GRVW4_GSU1_LPA0_LPB0_PGR1_PLR1_TT4_4_WG16_16_1_WGM1
    SolutionIndex: 396
    SolutionNameMin: Cijk_Alik_Bljk_SB_MT64x64x8_SE_EPS1_FL1_GRVW4_GSU1_LPA0_LPB0_PGR1_PLR1_TT4_4_WG16_16_1_WGM8
    SolutionIndex: 397
    SolutionNameMin: Cijk_Alik_Bljk_SB_MT96x64x8_SE_EPS1_FL1_GRVW4_GSU1_LPA0_LPB0_PGR1_PLR1_TT6_4_WG16_16_1_WGM1
    SolutionIndex: 398
    SolutionNameMin: Cijk_Alik_Bljk_SB_MT96x64x8_SE_EPS1_FL1_GRVW4_GSU1_LPA0_LPB0_PGR1_PLR1_TT6_4_WG16_16_1_WGM8
    SolutionIndex: 399
    SolutionNameMin: Cijk_Alik_Bljk_SB_MT64x128x8_SE_EPS1_FL0_GRVW2_GSU1_LPA0_LPB0_PGR1_PLR1_TT4_8_WG16_16_1_WGM1
    SolutionIndex: 400
    SolutionNameMin: Cijk_Alik_Bljk_SB_MT64x128x8_SE_EPS1_FL0_GRVW4_GSU1_LPA0_LPB0_PGR1_PLR1_TT4_8_WG16_16_1_WGM1
    SolutionIndex: 401
    SolutionNameMin: Cijk_Alik_Bljk_SB_MT64x128x8_SE_EPS1_FL0_GRVW4_GSU1_LPA0_LPB0_PGR1_PLR1_TT4_8_WG16_16_1_WGM1
    SolutionIndex: 402
    SolutionNameMin: Cijk_Alik_Bljk_SB_MT64x128x8_SE_EPS1_FL0_GRVW4_GSU1_LPA0_LPB0_PGR1_PLR1_TT4_8_WG16_16_1_WGM8
    SolutionIndex: 403
    SolutionNameMin: Cijk_Alik_Bljk_SB_MT64x128x8_SE_EPS1_FL1_GRVW2_GSU1_LPA0_LPB0_PGR1_PLR1_TT4_8_WG16_16_1_WGM1
    SolutionIndex: 404
    SolutionNameMin: Cijk_Alik_Bljk_SB_MT128x64x8_SE_EPS1_FL0_GRVW4_GSU1_LPA0_LPB0_PGR1_PLR0_TT8_4_WG16_16_1_WGM8
    SolutionIndex: 405
    SolutionNameMin: Cijk_Alik_Bljk_SB_MT128x64x8_SE_EPS1_FL0_GRVW4_GSU1_LPA0_LPB0_PGR1_PLR1_TT8_4_WG16_16_1_WGM1
    SolutionIndex: 406
    SolutionNameMin: Cijk_Alik_Bljk_SB_MT128x64x8_SE_EPS0_FL1_GRVW4_GSU1_LPA0_LPB0_PGR0_PLR1_TT8_4_WG16_16_1_WGM8
    SolutionIndex: 407
    SolutionNameMin: Cijk_Alik_Bljk_SB_MT128x64x16_SE_EPS1_FL1_GRVW4_GSU1_LPA0_LPB0_PGR1_PLR1_TT8_4_WG16_16_1_WGM1
    SolutionIndex: 408
    SolutionNameMin: Cijk_Alik_Bljk_SB_MT128x128x8_SE_EPS1_FL1_GRVW4_GSU1_LPA0_LPB0_PGR1_PLR0_TT8_8_WG16_16_1_WGM8
    SolutionIndex: 409
    SolutionNameMin: Cijk_Alik_Bljk_SB_MT128x128x8_SE_EPS1_FL1_GRVW4_GSU1_LPA0_LPB0_PGR1_PLR1_TT8_8_WG16_16_1_WGM8
    SolutionIndex: 410
    SolutionNameMin: Cijk_Alik_Bljk_SB_MT64x64x16_SE_EPS1_FL1_GRVW4_GSU8_LPA0_LPB0_PGR1_PLR1_TT4_4_WG16_16_1_WGM8
    SolutionIndex: 411
    SolutionNameMin: Cijk_Alik_Bljk_SB_MT32x64x8_SE_EPS1_FL0_GRVW2_GSU1_LPA0_LPB0_PGR1_PLR1_TT4_4_WG8_16_2_WGM1
    SolutionIndex: 412
    SolutionNameMin: Cijk_Alik_Bljk_SB_MT32x64x8_SE_EPS1_FL0_GRVW4_GSU1_LPA0_LPB0_PGR1_PLR1_TT4_4_WG8_16_2_WGM1
    SolutionIndex: 413
    SolutionNameMin: Cijk_Alik_Bljk_SB_MT32x64x16_SE_EPS1_FL0_GRVW4_GSU1_LPA0_LPB0_PGR1_PLR1_TT4_4_WG8_16_2_WGM1
    SolutionIndex: 414
    SolutionNameMin: Cijk_Alik_Bljk_SB_MT32x64x8_SE_EPS1_FL1_GRVW2_GSU1_LPA0_LPB0_PGR1_PLR1_TT4_4_WG8_16_2_WGM8
    SolutionIndex: 415
    SolutionNameMin: Cijk_Alik_Bljk_SB_MT64x32x8_SE_EPS1_FL0_GRVW2_GSU1_LPA0_LPB0_PGR1_PLR1_TT4_4_WG16_8_2_WGM1
    SolutionIndex: 416
    SolutionNameMin: Cijk_Alik_Bljk_SB_MT64x32x8_SE_EPS1_FL0_GRVW2_GSU1_LPA0_LPB0_PGR1_PLR1_TT4_4_WG16_8_2_WGM8
    SolutionIndex: 417
    SolutionNameMin: Cijk_Alik_Bljk_SB_MT64x32x16_SE_EPS1_FL0_GRVW4_GSU8_LPA0_LPB0_PGR1_PLR1_TT4_4_WG16_8_2_WGM8
    SolutionIndex: 418
    SolutionNameMin: Cijk_Alik_Bljk_SB_MT64x32x8_SE_EPS1_FL0_GRVW4_GSU1_LPA0_LPB0_PGR1_PLR1_TT4_4_WG16_8_2_WGM1
    SolutionIndex: 419
    SolutionNameMin: Cijk_Alik_Bljk_SB_MT64x32x8_SE_EPS1_FL1_GRVW2_GSU1_LPA0_LPB0_PGR1_PLR1_TT4_4_WG16_8_2_WGM1
    SolutionIndex: 420
    SolutionNameMin: Cijk_Alik_Bljk_SB_MT64x32x8_SE_EPS1_FL1_GRVW2_GSU1_LPA0_LPB0_PGR1_PLR1_TT4_4_WG16_8_2_WGM8
    SolutionIndex: 421
    SolutionNameMin: Cijk_Alik_Bljk_SB_MT64x32x16_SE_EPS1_FL1_GRVW4_GSU8_LPA0_LPB0_PGR1_PLR1_TT4_4_WG16_8_2_WGM1
    SolutionIndex: 422
    SolutionNameMin: Cijk_Alik_Bljk_SB_MT64x32x16_SE_EPS1_FL1_GRVW4_GSU1_LPA0_LPB0_PGR1_PLR1_TT4_4_WG16_8_2_WGM1
    SolutionIndex: 423
    SolutionNameMin: Cijk_Alik_Bljk_SB_MT8x32x16_SE_EPS1_FL1_GRVW4_GSU1_LPA0_LPB0_PGR1_PLR1_TT2_2_WG4_16_4_WGM1
    SolutionIndex: 424
    SolutionNameMin: Cijk_Alik_Bljk_SB_MT8x32x16_SE_EPS1_FL1_GRVW4_GSU1_LPA0_LPB0_PGR1_PLR1_TT2_2_WG4_16_4_WGM8
    SolutionIndex: 425
    SolutionNameMin: Cijk_Alik_Bljk_SB_MT16x32x16_SE_EPS1_FL0_GRVW2_GSU1_LPA0_LPB0_PGR1_PLR1_TT4_2_WG4_16_4_WGM1
    SolutionIndex: 426
    SolutionNameMin: Cijk_Alik_Bljk_SB_MT16x32x16_SE_EPS1_FL0_GRVW4_GSU1_LPA0_LPB0_PGR1_PLR1_TT4_2_WG4_16_4_WGM1
    SolutionIndex: 427
    SolutionNameMin: Cijk_Alik_Bljk_SB_MT8x64x16_SE_EPS1_FL1_GRVW4_GSU1_LPA0_LPB0_PGR1_PLR1_TT2_4_WG4_16_4_WGM1
    SolutionIndex: 428
    SolutionNameMin: Cijk_Alik_Bljk_SB_MT16x64x16_SE_EPS1_FL0_GRVW4_GSU1_LPA0_LPB0_PGR1_PLR1_TT4_4_WG4_16_4_WGM1
    SolutionIndex: 429
    SolutionNameMin: Cijk_Alik_Bljk_SB_MT16x64x16_SE_EPS1_FL0_GRVW4_GSU1_LPA0_LPB0_PGR1_PLR1_TT4_4_WG4_16_4_WGM8
    SolutionIndex: 430
    SolutionNameMin: Cijk_Alik_Bljk_SB_MT16x64x16_SE_EPS1_FL0_GRVW4_GSU1_LPA0_LPB0_PGR1_PLR1_TT4_4_WG4_16_4_WGM1
    SolutionIndex: 431
    SolutionNameMin: Cijk_Alik_Bljk_SB_MT16x64x16_SE_EPS1_FL0_GRVW4_GSU1_LPA0_LPB0_PGR1_PLR1_TT4_4_WG4_16_4_WGM8
    SolutionIndex: 432
    SolutionNameMin: Cijk_Alik_Bljk_SB_MT16x64x16_SE_EPS1_FL0_GRVW4_GSU8_LPA0_LPB0_PGR1_PLR1_TT4_4_WG4_16_4_WGM1
    SolutionIndex: 433
    SolutionNameMin: Cijk_Alik_Bljk_SB_MT32x16x16_SE_EPS1_FL0_GRVW2_GSU1_LPA0_LPB0_PGR1_PLR1_TT2_4_WG16_4_4_WGM1
    SolutionIndex: 434
    SolutionNameMin: Cijk_Alik_Bljk_SB_MT32x16x16_SE_EPS1_FL0_GRVW2_GSU1_LPA0_LPB0_PGR1_PLR1_TT2_4_WG16_4_4_WGM8
    SolutionIndex: 435
    SolutionNameMin: Cijk_Alik_Bljk_SB_MT32x16x16_SE_EPS1_FL0_GRVW4_GSU1_LPA0_LPB0_PGR1_PLR1_TT2_4_WG16_4_4_WGM1
    SolutionIndex: 436
    SolutionNameMin: Cijk_Alik_Bljk_SB_MT32x16x16_SE_EPS1_FL1_GRVW4_GSU1_LPA0_LPB0_PGR1_PLR1_TT2_4_WG16_4_4_WGM8
    SolutionIndex: 437
    SolutionNameMin: Cijk_Alik_Bljk_SB_MT64x16x16_SE_EPS1_FL0_GRVW4_GSU1_LPA0_LPB0_PGR1_PLR1_TT4_4_WG16_4_4_WGM1
    SolutionIndex: 438
    SolutionNameMin: Cijk_Alik_Bljk_SB_MT64x16x16_SE_EPS1_FL0_GRVW4_GSU1_LPA0_LPB0_PGR1_PLR1_TT4_4_WG16_4_4_WGM8
    SolutionIndex: 439
    SolutionNameMin: Cijk_Alik_Bljk_SB_MT64x16x16_SE_EPS1_FL0_GRVW4_GSU8_LPA0_LPB0_PGR1_PLR1_TT4_4_WG16_4_4_WGM8
    SolutionIndex: 440
    SolutionNameMin: Cijk_Alik_Bljk_SB_MT64x16x16_SE_EPS1_FL0_GRVW4_GSU1_LPA0_LPB0_PGR1_PLR1_TT4_4_WG16_4_4_WGM1
    SolutionIndex: 441
    SolutionNameMin: Cijk_Alik_Bljk_SB_MT64x16x16_SE_EPS1_FL0_GRVW4_GSU1_LPA0_LPB0_PGR1_PLR1_TT4_4_WG16_4_4_WGM8
    SolutionIndex: 442
    SolutionNameMin: Cijk_Alik_Bljk_SB_MT64x64x16_SE_EPS1_FL0_GRVW2_GSU1_LPA4_LPB4_PGR1_PLR1_TT4_4_WG16_16_1_WGM1
    SolutionIndex: 443
    SolutionNameMin: Cijk_Alik_Bljk_SB_MT64x64x8_SE_EPS1_FL1_GRVW2_GSU1_LPA4_LPB4_PGR1_PLR0_TT4_4_WG16_16_1_WGM1
    SolutionIndex: 444
    SolutionNameMin: Cijk_Alik_Bljk_SB_MT64x32x32_SE_EPS1_FL1_GRVW4_GSU1_LPA2_LPB2_PGR1_PLR1_TT4_2_WG16_16_1_WGM8
    SolutionIndex: 445
    SolutionNameMin: Cijk_Alik_Bljk_SB_MT32x64x16_SE_EPS1_FL1_GRVW4_GSU1_LPA2_LPB2_PGR1_PLR1_TT2_4_WG16_16_1_WGM8
    SolutionIndex: 446
    SolutionNameMin: Cijk_Alik_Bljk_SB_MT64x128x16_SE_EPS1_FL0_GRVW4_GSU1_LPA2_LPB2_PGR1_PLR1_TT4_8_WG16_16_1_WGM1
    SolutionIndex: 447
    SolutionNameMin: Cijk_Alik_Bljk_SB_MT64x128x8_SE_EPS1_FL0_GRVW4_GSU1_LPA4_LPB0_PGR1_PLR1_TT4_8_WG16_16_1_WGM1
    SolutionIndex: 448
    SolutionNameMin: Cijk_Alik_Bljk_SB_MT128x64x16_SE_EPS1_FL0_GRVW4_GSU1_LPA2_LPB2_PGR1_PLR1_TT8_4_WG16_16_1_WGM8
    SolutionIndex: 449
    SolutionNameMin: Cijk_Alik_Bljk_SB_MT64x32x16_SE_EPS1_FL0_GRVW1_GSU1_LPA4_LPB4_PGR1_PLR1_TT4_4_WG16_8_1_WGM1
    SolutionIndex: 450
    SolutionNameMin: Cijk_Alik_Bljk_SB_MT64x32x16_SE_EPS1_FL0_GRVW1_GSU1_LPA4_LPB4_PGR1_PLR1_TT4_4_WG16_8_1_WGM8
    SolutionIndex: 451
    SolutionNameMin: Cijk_Alik_Bljk_SB_MT32x32x32_SE_EPS1_FL0_GRVW4_GSU1_LPA2_LPB2_PGR1_PLR1_TT2_4_WG16_8_1_WGM1
    SolutionIndex: 452
    SolutionNameMin: Cijk_Alik_Bljk_SB_MT8x32x32_SE_EPS1_FL0_GRVW2_GSU1_LPA0_LPB2_PGR1_PLR1_TT2_2_WG4_16_4_WGM8
    SolutionIndex: 453
    SolutionNameMin: Cijk_Alik_Bljk_SB_MT8x32x32_SE_EPS1_FL0_GRVW2_GSU1_LPA2_LPB2_PGR1_PLR1_TT2_2_WG4_16_4_WGM8
    SolutionIndex: 454
    SolutionNameMin: Cijk_Alik_Bljk_SB_MT8x32x32_SE_EPS1_FL0_GRVW2_GSU8_LPA2_LPB2_PGR1_PLR1_TT2_2_WG4_16_4_WGM1
    SolutionIndex: 455
    SolutionNameMin: Cijk_Alik_Bljk_SB_MT8x32x32_SE_EPS1_FL0_GRVW4_GSU1_LPA2_LPB2_PGR1_PLR1_TT2_2_WG4_16_4_WGM1
    SolutionIndex: 456
    SolutionNameMin: Cijk_Alik_Bljk_SB_MT8x32x32_SE_EPS1_FL0_GRVW4_GSU1_LPA2_LPB2_PGR1_PLR1_TT2_2_WG4_16_4_WGM8
    SolutionIndex: 457
    SolutionNameMin: Cijk_Alik_Bljk_SB_MT16x32x32_SE_EPS1_FL0_GRVW2_GSU8_LPA2_LPB2_PGR1_PLR0_TT4_2_WG4_16_4_WGM1
    SolutionIndex: 458
    SolutionNameMin: Cijk_Alik_Bljk_SB_MT32x8x32_SE_EPS1_FL0_GRVW1_GSU1_LPA2_LPB2_PGR1_PLR1_TT2_2_WG16_4_4_WGM1
    SolutionIndex: 459
    SolutionNameMin: Cijk_Alik_Bljk_SB_MT32x8x32_SE_EPS1_FL0_GRVW2_GSU1_LPA2_LPB2_PGR1_PLR1_TT2_2_WG16_4_4_WGM8
    SolutionIndex: 460
    SolutionNameMin: Cijk_Alik_Bljk_SB_MT32x8x32_SE_EPS1_FL0_GRVW4_GSU1_LPA2_LPB2_PGR1_PLR1_TT2_2_WG16_4_4_WGM1
    SolutionIndex: 461
    SolutionNameMin: Cijk_Alik_Bljk_SB_MT32x8x32_SE_EPS1_FL0_GRVW4_GSU1_LPA2_LPB2_PGR1_PLR1_TT2_2_WG16_4_4_WGM8
    SolutionIndex: 462
    SolutionNameMin: Cijk_Alik_Bljk_SB_MT32x16x32_SE_EPS1_FL0_GRVW1_GSU8_LPA2_LPB2_PGR1_PLR1_TT2_4_WG16_4_4_WGM1
    SolutionIndex: 463
    SolutionNameMin: Cijk_Alik_Bljk_SB_MT64x16x32_SE_EPS1_FL0_GRVW4_GSU8_LPA2_LPB2_PGR1_PLR1_TT4_4_WG16_4_4_WGM8
    SolutionIndex: 464
    SolutionNameMin: Cijk_Alik_Bljk_SB_MT64x16x32_SE_EPS1_FL1_GRVW4_GSU8_LPA2_LPB2_PGR1_PLR1_TT4_4_WG16_4_4_WGM1
    SolutionIndex: 465
    SolutionNameMin: Cijk_Alik_Bljk_SB_MT8x32x32_SE_EPS1_FL0_GRVW4_GSU4_LPA0_LPB2_PGR1_PLR1_TT2_2_WG4_16_4_WGM8
    SolutionIndex: 466
    SolutionNameMin: Cijk_Alik_Bljk_SB_MT64x32x16_SE_EPS1_FL0_GRVW4_LPA0_LPB0_PGR1_PLR1_TT4_4_USFGRO1_VW4_WG16_8_2_WGM8
    SolutionIndex: 467
    SolutionNameMin: Cijk_Alik_Bljk_SB_MT16x64x16_SE_EPS1_FL0_GRVW4_LPA0_LPB0_PGR1_PLR1_TT4_4_USFGRO1_VW4_WG4_16_4_WGM1
    SolutionIndex: 468
    SolutionNameMin: Cijk_Alik_Bljk_SB_MT16x64x16_SE_EPS1_FL0_GRVW4_LPA0_LPB0_PGR1_PLR1_TT4_4_USFGRO1_VW4_WG4_16_4_WGM8
    SolutionIndex: 469
    SolutionNameMin: Cijk_Alik_Bljk_SB_MT64x64x16_SE_EPS1_FL0_GRVW1_LPA4_LPB4_PGR1_PLR1_TT4_4_USFGRO1_VW4_WG16_16_1_WGM1
    SolutionIndex: 470
    SolutionNameMin: Cijk_Alik_Bljk_SB_MT64x64x16_SE_EPS1_FL0_GRVW4_LPA4_LPB4_PGR1_PLR1_TT4_4_USFGRO1_VW4_WG16_16_1_WGM1
    SolutionIndex: 471
    SolutionNameMin: Cijk_Alik_Bljk_SB_MT64x64x16_SE_EPS1_FL1_GRVW2_LPA2_LPB2_PGR1_PLR1_TT4_4_USFGRO1_VW2_WG16_16_1_WGM1
    SolutionIndex: 472
    SolutionNameMin: Cijk_Alik_Bljk_SB_MT64x64x16_SE_EPS1_FL1_GRVW2_LPA4_LPB4_PGR1_PLR1_TT4_4_USFGRO1_VW4_WG16_16_1_WGM8
    SolutionIndex: 473
    SolutionNameMin: Cijk_Alik_Bljk_SB_MT64x32x32_SE_EPS1_FL0_GRVW4_LPA2_LPB2_PGR1_PLR1_TT4_2_USFGRO1_VW2_WG16_16_1_WGM8
    SolutionIndex: 474
    SolutionNameMin: Cijk_Alik_Bljk_SB_MT64x32x32_SE_EPS1_FL1_GRVW4_LPA2_LPB2_PGR1_PLR1_TT4_2_USFGRO1_VW2_WG16_16_1_WGM8
    SolutionIndex: 475
    SolutionNameMin: Cijk_Alik_Bljk_SB_MT32x64x16_SE_EPS1_FL0_GRVW4_LPA2_LPB2_PGR1_PLR1_TT2_4_USFGRO1_VW2_WG16_16_1_WGM1
    SolutionIndex: 476
    SolutionNameMin: Cijk_Alik_Bljk_SB_MT32x64x16_SE_EPS1_FL1_GRVW4_LPA2_LPB2_PGR1_PLR1_TT2_4_USFGRO1_VW2_WG16_16_1_WGM8
    SolutionIndex: 477
    SolutionNameMin: Cijk_Alik_Bljk_SB_MT32x64x32_SE_EPS1_FL1_GRVW4_LPA2_LPB2_PGR1_PLR1_TT2_4_USFGRO1_VW2_WG16_16_1_WGM1
    SolutionIndex: 478
    SolutionNameMin: Cijk_Alik_Bljk_SB_MT32x64x32_SE_EPS1_FL1_GRVW4_LPA2_LPB2_PGR1_PLR1_TT2_4_USFGRO1_VW2_WG16_16_1_WGM8
    SolutionIndex: 479
    SolutionNameMin: Cijk_Alik_Bljk_SB_MT64x128x16_SE_EPS1_FL0_GRVW2_LPA4_LPB4_PGR1_PLR1_TT4_8_USFGRO1_VW4_WG16_16_1_WGM1
    SolutionIndex: 480
    SolutionNameMin: Cijk_Alik_Bljk_SB_MT64x128x16_SE_EPS1_FL1_GRVW2_LPA2_LPB2_PGR1_PLR0_TT4_8_USFGRO1_VW2_WG16_16_1_WGM8
    SolutionIndex: 481
    SolutionNameMin: Cijk_Alik_Bljk_SB_MT64x128x16_SE_EPS1_FL1_GRVW4_LPA2_LPB2_PGR1_PLR1_TT4_8_USFGRO1_VW2_WG16_16_1_WGM1
    SolutionIndex: 482
    SolutionNameMin: Cijk_Alik_Bljk_SB_MT128x64x16_SE_EPS0_FL0_GRVW1_LPA4_LPB4_PGR0_PLR1_TT8_4_USFGRO1_VW4_WG16_16_1_WGM1
    SolutionIndex: 483
    SolutionNameMin: Cijk_Alik_Bljk_SB_MT128x64x16_SE_EPS1_FL0_GRVW4_LPA2_LPB2_PGR1_PLR1_TT8_4_USFGRO1_VW2_WG16_16_1_WGM8
    SolutionIndex: 484
    SolutionNameMin: Cijk_Alik_Bljk_SB_MT128x64x16_SE_EPS0_FL0_GRVW4_LPA4_LPB4_PGR0_PLR1_TT8_4_USFGRO1_VW4_WG16_16_1_WGM1
    SolutionIndex: 485
    SolutionNameMin: Cijk_Alik_Bljk_SB_MT128x64x8_SE_EPS1_FL1_GRVW2_LPA4_LPB0_PGR1_PLR0_TT8_4_USFGRO1_VW4_WG16_16_1_WGM8
    SolutionIndex: 486
    SolutionNameMin: Cijk_Alik_Bljk_SB_MT128x64x16_SE_EPS1_FL1_GRVW2_LPA4_LPB4_PGR1_PLR1_TT8_4_USFGRO1_VW4_WG16_16_1_WGM1
    SolutionIndex: 487
    SolutionNameMin: Cijk_Alik_Bljk_SB_MT128x64x16_SE_EPS1_FL1_GRVW4_LPA2_LPB2_PGR1_PLR1_TT8_4_USFGRO1_VW2_WG16_16_1_WGM8
    SolutionIndex: 488
    SolutionNameMin: Cijk_Alik_Bljk_SB_MT128x64x16_SE_EPS1_FL1_GRVW4_LPA4_LPB4_PGR1_PLR1_TT8_4_USFGRO1_VW4_WG16_16_1_WGM1
    SolutionIndex: 489
    SolutionNameMin: Cijk_Alik_Bljk_SB_MT64x32x16_SE_EPS1_FL0_GRVW1_LPA4_LPB4_PGR1_PLR1_TT4_4_USFGRO1_VW4_WG16_8_1_WGM1
    SolutionIndex: 490
    SolutionNameMin: Cijk_Alik_Bljk_SB_MT32x32x32_SE_EPS0_FL0_GRVW2_LPA2_LPB2_PGR0_PLR0_TT2_4_USFGRO1_VW2_WG16_8_1_WGM8
    SolutionIndex: 491
    SolutionNameMin: Cijk_Alik_Bljk_SB_MT32x32x32_SE_EPS0_FL0_GRVW4_LPA2_LPB2_PGR0_PLR1_TT2_4_USFGRO1_VW2_WG16_8_1_WGM1
    SolutionIndex: 492
    SolutionNameMin: Cijk_Alik_Bljk_SB_MT32x32x32_SE_EPS1_FL0_GRVW4_LPA2_LPB2_PGR1_PLR1_TT2_4_USFGRO1_VW2_WG16_8_1_WGM1
    SolutionIndex: 493
    SolutionNameMin: Cijk_Alik_Bljk_SB_MT32x32x32_SE_EPS1_FL1_GRVW4_LPA2_LPB2_PGR1_PLR1_TT2_4_USFGRO1_VW2_WG16_8_1_WGM1
    SolutionIndex: 494
    SolutionNameMin: Cijk_Alik_Bljk_SB_MT32x64x16_SE_EPS1_FL0_GRVW2_LPA4_LPB4_PGR1_PLR1_TT4_4_USFGRO1_VW4_WG8_16_1_WGM1
    SolutionIndex: 495
    SolutionNameMin: Cijk_Alik_Bljk_SB_MT32x64x16_SE_EPS1_FL1_GRVW2_LPA2_LPB2_PGR1_PLR1_TT4_4_USFGRO1_VW2_WG8_16_1_WGM8
    SolutionIndex: 496
    SolutionNameMin: Cijk_Alik_Bljk_SB_MT32x32x32_SE_EPS1_FL0_GRVW4_LPA2_LPB2_PGR1_PLR1_TT4_2_USFGRO1_VW2_WG8_16_1_WGM1
    SolutionIndex: 497
    SolutionNameMin: Cijk_Alik_Bljk_SB_MT32x32x32_SE_EPS1_FL1_GRVW4_LPA2_LPB2_PGR1_PLR1_TT4_2_USFGRO1_VW2_WG8_16_1_WGM1
    SolutionIndex: 498
    SolutionNameMin: Cijk_Alik_Bljk_SB_MT64x64x32_SE_EPS1_FL0_GRVW1_LPA4_LPB4_PGR1_PLR1_TT4_4_USFGRO1_VW4_WG16_16_1_WGM8
    SolutionIndex: 499
    SolutionNameMin: Cijk_Alik_Bljk_SB_MT64x64x16_SE_EPS0_FL0_GRVW2_LPA4_LPB4_PGR0_PLR1_TT4_4_USFGRO1_VW4_WG16_16_1_WGM1
    SolutionIndex: 500
    SolutionNameMin: Cijk_Alik_Bljk_SB_MT64x64x16_SE_EPS1_FL0_GRVW2_LPA4_LPB4_PGR1_PLR1_TT4_4_USFGRO1_VW4_WG16_16_1_WGM1
    SolutionIndex: 501
    SolutionNameMin: Cijk_Alik_Bljk_SB_MT64x64x16_SE_EPS0_FL0_GRVW2_LPA4_LPB4_PGR0_PLR1_TT4_4_USFGRO1_VW4_WG16_16_1_WGM8
    SolutionIndex: 502
    SolutionNameMin: Cijk_Alik_Bljk_SB_MT64x64x16_SE_EPS1_FL0_GRVW2_LPA4_LPB4_PGR1_PLR1_TT4_4_USFGRO1_VW4_WG16_16_1_WGM8
    SolutionIndex: 503
    SolutionNameMin: Cijk_Alik_Bljk_SB_MT64x64x32_SE_EPS0_FL0_GRVW4_LPA2_LPB2_PGR0_PLR1_TT4_4_USFGRO1_VW2_WG16_16_1_WGM1
    SolutionIndex: 504
    SolutionNameMin: Cijk_Alik_Bljk_SB_MT64x64x16_SE_EPS0_FL1_GRVW2_LPA4_LPB4_PGR0_PLR1_TT4_4_USFGRO1_VW4_WG16_16_1_WGM1
    SolutionIndex: 505
    SolutionNameMin: Cijk_Alik_Bljk_SB_MT64x64x16_SE_EPS1_FL1_GRVW2_LPA4_LPB4_PGR1_PLR1_TT4_4_USFGRO1_VW4_WG16_16_1_WGM1
    SolutionIndex: 506
    SolutionNameMin: Cijk_Alik_Bljk_SB_MT64x64x16_SE_EPS0_FL1_GRVW2_LPA4_LPB4_PGR0_PLR1_TT4_4_USFGRO1_VW4_WG16_16_1_WGM8
    SolutionIndex: 507
    SolutionNameMin: Cijk_Alik_Bljk_SB_MT64x32x32_SE_EPS1_FL0_GRVW4_LPA2_LPB2_PGR1_PLR1_TT4_2_USFGRO1_VW2_WG16_16_1_WGM8
    SolutionIndex: 508
    SolutionNameMin: Cijk_Alik_Bljk_SB_MT64x128x8_SE_EPS1_FL0_GRVW2_LPA0_LPB0_PGR1_PLR1_TT4_8_USFGRO1_VW4_WG16_16_1_WGM8
    SolutionIndex: 509
    SolutionNameMin: Cijk_Alik_Bljk_SB_MT64x128x16_SE_EPS1_FL1_GRVW2_LPA4_LPB4_PGR1_PLR1_TT4_8_USFGRO1_VW4_WG16_16_1_WGM8
    SolutionIndex: 510
    SolutionNameMin: Cijk_Alik_Bljk_SB_MT64x128x16_SE_EPS1_FL1_GRVW4_LPA4_LPB4_PGR1_PLR1_TT4_8_USFGRO1_VW4_WG16_16_1_WGM1
    SolutionIndex: 511
    SolutionNameMin: Cijk_Alik_Bljk_SB_MT128x64x32_SE_EPS1_FL1_GRVW2_LPA4_LPB4_PGR1_PLR1_TT8_4_USFGRO1_VW4_WG16_16_1_WGM1
    SolutionIndex: 512
    SolutionNameMin: Cijk_Alik_Bljk_SB_MT64x32x16_SE_EPS1_FL0_GRVW1_LPA2_LPB2_PGR1_PLR1_TT4_4_USFGRO1_VW2_WG16_8_1_WGM1
    SolutionIndex: 513
    SolutionNameMin: Cijk_Alik_Bljk_SB_MT64x32x16_SE_EPS1_FL0_GRVW1_LPA4_LPB4_PGR1_PLR1_TT4_4_USFGRO1_VW4_WG16_8_1_WGM8
    SolutionIndex: 514
    SolutionNameMin: Cijk_Alik_Bljk_SB_MT64x32x32_SE_EPS0_FL0_GRVW2_LPA2_LPB2_PGR0_PLR1_TT4_4_USFGRO1_VW2_WG16_8_1_WGM1
    SolutionIndex: 515
    SolutionNameMin: Cijk_Alik_Bljk_SB_MT64x32x16_SE_EPS1_FL0_GRVW2_LPA4_LPB4_PGR1_PLR1_TT4_4_USFGRO1_VW4_WG16_8_1_WGM1
    SolutionIndex: 516
    SolutionNameMin: Cijk_Alik_Bljk_SB_MT64x32x16_SE_EPS1_FL0_GRVW2_LPA4_LPB4_PGR1_PLR1_TT4_4_USFGRO1_VW4_WG16_8_1_WGM8
    SolutionIndex: 517
    SolutionNameMin: Cijk_Alik_Bljk_SB_MT64x32x32_SE_EPS0_FL0_GRVW4_LPA2_LPB2_PGR0_PLR1_TT4_4_USFGRO1_VW2_WG16_8_1_WGM1
    SolutionIndex: 518
    SolutionNameMin: Cijk_Alik_Bljk_SB_MT64x32x16_SE_EPS1_FL0_GRVW4_LPA4_LPB4_PGR1_PLR1_TT4_4_USFGRO1_VW4_WG16_8_1_WGM1
    SolutionIndex: 519
    SolutionNameMin: Cijk_Alik_Bljk_SB_MT64x32x32_SE_EPS0_FL1_GRVW2_LPA2_LPB2_PGR0_PLR1_TT4_4_USFGRO1_VW2_WG16_8_1_WGM1
    SolutionIndex: 520
    SolutionNameMin: Cijk_Alik_Bljk_SB_MT64x32x32_SE_EPS0_FL1_GRVW2_LPA2_LPB2_PGR0_PLR1_TT4_4_USFGRO1_VW2_WG16_8_1_WGM8
    SolutionIndex: 521
    SolutionNameMin: Cijk_Alik_Bljk_SB_MT64x32x16_SE_EPS1_FL1_GRVW2_LPA4_LPB4_PGR1_PLR1_TT4_4_USFGRO1_VW4_WG16_8_1_WGM1
    SolutionIndex: 522
    SolutionNameMin: Cijk_Alik_Bljk_SB_MT64x32x16_SE_EPS1_FL1_GRVW2_LPA4_LPB4_PGR1_PLR1_TT4_4_USFGRO1_VW4_WG16_8_1_WGM8
    SolutionIndex: 523
    SolutionNameMin: Cijk_Alik_Bljk_SB_MT64x32x32_SE_EPS0_FL1_GRVW4_LPA2_LPB2_PGR0_PLR1_TT4_4_USFGRO1_VW2_WG16_8_1_WGM1
    SolutionIndex: 524
    SolutionNameMin: Cijk_Alik_Bljk_SB_MT64x32x32_SE_EPS0_FL1_GRVW4_LPA2_LPB2_PGR0_PLR1_TT4_4_USFGRO1_VW2_WG16_8_1_WGM8
    SolutionIndex: 525
    SolutionNameMin: Cijk_Alik_Bljk_SB_MT32x32x16_SE_EPS1_FL0_GRVW1_LPA2_LPB2_PGR1_PLR1_TT2_4_USFGRO1_VW2_WG16_8_1_WGM8
    SolutionIndex: 526
    SolutionNameMin: Cijk_Alik_Bljk_SB_MT32x32x32_SE_EPS0_FL0_GRVW1_LPA2_LPB2_PGR0_PLR1_TT2_4_USFGRO1_VW2_WG16_8_1_WGM8
    SolutionIndex: 527
    SolutionNameMin: Cijk_Alik_Bljk_SB_MT32x32x32_SE_EPS0_FL0_GRVW4_LPA2_LPB2_PGR0_PLR1_TT2_4_USFGRO1_VW2_WG16_8_1_WGM1
    SolutionIndex: 528
    SolutionNameMin: Cijk_Alik_Bljk_SB_MT32x32x32_SE_EPS1_FL0_GRVW4_LPA2_LPB2_PGR1_PLR1_TT2_4_USFGRO1_VW2_WG16_8_1_WGM1
    SolutionIndex: 529
    SolutionNameMin: Cijk_Alik_Bljk_SB_MT32x32x32_SE_EPS1_FL1_GRVW4_LPA2_LPB2_PGR1_PLR1_TT2_4_USFGRO1_VW2_WG16_8_1_WGM1
    SolutionIndex: 530
    SolutionNameMin: Cijk_Alik_Bljk_SB_MT32x64x16_SE_EPS1_FL0_GRVW1_LPA2_LPB2_PGR1_PLR1_TT4_4_USFGRO1_VW2_WG8_16_1_WGM8
    SolutionIndex: 531
    SolutionNameMin: Cijk_Alik_Bljk_SB_MT32x64x16_SE_EPS1_FL0_GRVW1_LPA4_LPB4_PGR1_PLR1_TT4_4_USFGRO1_VW4_WG8_16_1_WGM1
    SolutionIndex: 532
    SolutionNameMin: Cijk_Alik_Bljk_SB_MT32x64x16_SE_EPS1_FL0_GRVW1_LPA4_LPB4_PGR1_PLR1_TT4_4_USFGRO1_VW4_WG8_16_1_WGM8
    SolutionIndex: 533
    SolutionNameMin: Cijk_Alik_Bljk_SB_MT32x64x32_SE_EPS0_FL0_GRVW2_LPA2_LPB2_PGR0_PLR1_TT4_4_USFGRO1_VW2_WG8_16_1_WGM1
    SolutionIndex: 534
    SolutionNameMin: Cijk_Alik_Bljk_SB_MT32x64x16_SE_EPS1_FL0_GRVW2_LPA4_LPB4_PGR1_PLR1_TT4_4_USFGRO1_VW4_WG8_16_1_WGM1
    SolutionIndex: 535
    SolutionNameMin: Cijk_Alik_Bljk_SB_MT32x32x16_SE_EPS1_FL0_GRVW1_LPA2_LPB2_PGR1_PLR1_TT4_2_USFGRO1_VW2_WG8_16_1_WGM8
    SolutionIndex: 536
    SolutionNameMin: Cijk_Alik_Bljk_SB_MT32x32x32_SE_EPS0_FL0_GRVW1_LPA2_LPB2_PGR0_PLR1_TT4_2_USFGRO1_VW2_WG8_16_1_WGM1
    SolutionIndex: 537
    SolutionNameMin: Cijk_Alik_Bljk_SB_MT32x32x32_SE_EPS1_FL0_GRVW4_LPA2_LPB2_PGR1_PLR1_TT4_2_USFGRO1_VW2_WG8_16_1_WGM1
    SolutionIndex: 538
    SolutionNameMin: Cijk_Alik_Bljk_SB_MT128x64x16_SE_EPS0_FL1_GRVW2_GSU1_PGR0_PLR1_TT8_4_VW2_WG16_16_1_WGM1
    SolutionIndex: 539
    SolutionNameMin: Cijk_Alik_Bljk_SB_MT128x128x16_SE_EPS1_FL0_GRVW2_GSU1_PGR1_PLR1_TT8_8_VW2_WG16_16_1_WGM1
    SolutionIndex: 540
    SolutionNameMin: Cijk_Alik_Bljk_SB_MT64x32x16_SE_EPS1_FL1_GRVW4_GSU1_PGR1_PLR1_TT4_4_VW4_WG16_8_2_WGM8
    SolutionIndex: 542
    SolutionNameMin: Cijk_Alik_Bljk_SB_MT64x96x16_SE_EPS0_FL1_GRVW4_LPA0_LPB0_PGR0_PLR0_TT4_6_USFGRO1_VW2_WG16_16_1_WGM8
    SolutionIndex: 543
    SolutionNameMin: Cijk_Alik_Bljk_SB_MT64x128x8_SE_EPS1_FL0_GRVW2_LPA0_LPB0_PGR1_PLR0_TT4_8_USFGRO1_VW4_WG16_16_1_WGM8
    SolutionIndex: 544
    SolutionNameMin: Cijk_Alik_Bljk_SB_MT128x64x8_SE_EPS1_FL0_GRVW2_LPA0_LPB0_PGR1_PLR0_TT8_4_USFGRO1_VW4_WG16_16_1_WGM8
    SolutionIndex: 545
    SolutionNameMin: Cijk_Alik_Bljk_SB_MT128x64x8_SE_EPS1_FL1_GRVW2_LPA0_LPB0_PGR1_PLR0_TT8_4_USFGRO1_VW2_WG16_16_1_WGM8
    SolutionIndex: 546
    SolutionNameMin: Cijk_Alik_Bljk_SB_MT128x64x8_SE_EPS1_FL1_GRVW2_LPA0_LPB0_PGR1_PLR0_TT8_4_USFGRO1_VW4_WG16_16_1_WGM8
    SolutionIndex: 547
    SolutionNameMin: Cijk_Alik_Bljk_SB_MT128x64x16_SE_EPS1_FL0_GRVW4_LPA0_LPB0_PGR1_PLR1_TT8_4_USFGRO1_VW4_WG16_16_1_WGM1
    SolutionIndex: 548
    SolutionNameMin: Cijk_Alik_Bljk_SB_MT128x64x16_SE_EPS1_FL1_GRVW4_LPA0_LPB0_PGR1_PLR1_TT8_4_USFGRO1_VW4_WG16_16_1_WGM1
    SolutionIndex: 549
    SolutionNameMin: Cijk_Alik_Bljk_SB_MT128x64x16_SE_EPS1_FL1_GRVW4_LPA0_LPB0_PGR1_PLR1_TT8_4_USFGRO1_VW4_WG16_16_1_WGM8
    SolutionIndex: 550
    SolutionNameMin: Cijk_Alik_Bljk_SB_MT128x128x8_SE_EPS1_FL0_GRVW2_LPA0_LPB0_PGR1_PLR0_TT8_8_USFGRO1_VW4_WG16_16_1_WGM1
    SolutionIndex: 551
    SolutionNameMin: Cijk_Alik_Bljk_SB_MT128x128x8_SE_EPS1_FL0_GRVW4_LPA0_LPB0_PGR1_PLR0_TT8_8_USFGRO1_VW2_WG16_16_1_WGM1
    SolutionIndex: 552
    SolutionNameMin: Cijk_Alik_Bljk_SB_MT128x128x16_SE_EPS1_FL0_GRVW4_LPA0_LPB0_PGR1_PLR0_TT8_8_USFGRO1_VW2_WG16_16_1_WGM1
    SolutionIndex: 553
    SolutionNameMin: Cijk_Alik_Bljk_SB_MT128x128x16_SE_EPS1_FL0_GRVW4_LPA0_LPB0_PGR1_PLR0_TT8_8_USFGRO1_VW2_WG16_16_1_WGM8
    SolutionIndex: 554
    SolutionNameMin: Cijk_Alik_Bljk_SB_MT128x128x8_SE_EPS1_FL0_GRVW4_LPA0_LPB0_PGR1_PLR0_TT8_8_USFGRO1_VW4_WG16_16_1_WGM1
    SolutionIndex: 555
    SolutionNameMin: Cijk_Alik_Bljk_SB_MT128x128x16_SE_EPS1_FL0_GRVW4_LPA0_LPB0_PGR1_PLR0_TT8_8_USFGRO1_VW4_WG16_16_1_WGM1
    SolutionIndex: 556
    SolutionNameMin: Cijk_Alik_Bljk_SB_MT128x128x16_SE_EPS1_FL0_GRVW4_LPA0_LPB0_PGR1_PLR0_TT8_8_USFGRO1_VW4_WG16_16_1_WGM8
    SolutionIndex: 557
    SolutionNameMin: Cijk_Alik_Bljk_SB_MT128x128x8_SE_EPS1_FL1_GRVW2_LPA0_LPB0_PGR1_PLR0_TT8_8_USFGRO1_VW4_WG16_16_1_WGM1
    SolutionIndex: 558
    SolutionNameMin: Cijk_Alik_Bljk_SB_MT128x128x8_SE_EPS1_FL1_GRVW4_LPA0_LPB0_PGR1_PLR0_TT8_8_USFGRO1_VW2_WG16_16_1_WGM1
    SolutionIndex: 559
    SolutionNameMin: Cijk_Alik_Bljk_SB_MT128x128x16_SE_EPS1_FL1_GRVW4_LPA0_LPB0_PGR1_PLR0_TT8_8_USFGRO1_VW2_WG16_16_1_WGM1
    SolutionIndex: 560
    SolutionNameMin: Cijk_Alik_Bljk_SB_MT128x128x16_SE_EPS1_FL1_GRVW4_LPA0_LPB0_PGR1_PLR0_TT8_8_USFGRO1_VW2_WG16_16_1_WGM8
    SolutionIndex: 561
    SolutionNameMin: Cijk_Alik_Bljk_SB_MT128x128x8_SE_EPS1_FL1_GRVW4_LPA0_LPB0_PGR1_PLR0_TT8_8_USFGRO1_VW4_WG16_16_1_WGM1
    SolutionIndex: 562
    SolutionNameMin: Cijk_Alik_Bljk_SB_MT128x128x8_SE_EPS1_FL1_GRVW4_LPA0_LPB0_PGR1_PLR0_TT8_8_USFGRO1_VW4_WG16_16_1_WGM8
    SolutionIndex: 563
    SolutionNameMin: Cijk_Alik_Bljk_SB_MT128x128x16_SE_EPS1_FL1_GRVW4_LPA0_LPB0_PGR1_PLR0_TT8_8_USFGRO1_VW4_WG16_16_1_WGM1
    SolutionIndex: 564
    SolutionNameMin: Cijk_Alik_Bljk_SB_MT128x128x16_SE_EPS1_FL1_GRVW4_LPA0_LPB0_PGR1_PLR0_TT8_8_USFGRO1_VW4_WG16_16_1_WGM8
    SolutionIndex: 565
    SolutionNameMin: Cijk_Alik_Bljk_SB_MT128x128x8_SE_EPS1_FL0_GRVW2_LPA0_LPB0_PGR1_PLR1_TT8_8_USFGRO1_VW2_WG16_16_1_WGM1
    SolutionIndex: 566
    SolutionNameMin: Cijk_Alik_Bljk_SB_MT128x128x16_SE_EPS1_FL0_GRVW2_LPA0_LPB0_PGR1_PLR1_TT8_8_USFGRO1_VW2_WG16_16_1_WGM1
    SolutionIndex: 567
    SolutionNameMin: Cijk_Alik_Bljk_SB_MT128x128x8_SE_EPS1_FL0_GRVW2_LPA0_LPB0_PGR1_PLR1_TT8_8_USFGRO1_VW4_WG16_16_1_WGM1
    SolutionIndex: 568
    SolutionNameMin: Cijk_Alik_Bljk_SB_MT128x128x16_SE_EPS1_FL0_GRVW2_LPA0_LPB0_PGR1_PLR1_TT8_8_USFGRO1_VW4_WG16_16_1_WGM1
    SolutionIndex: 569
    SolutionNameMin: Cijk_Alik_Bljk_SB_MT128x128x16_SE_EPS1_FL0_GRVW2_LPA0_LPB0_PGR1_PLR1_TT8_8_USFGRO1_VW4_WG16_16_1_WGM8
    SolutionIndex: 570
    SolutionNameMin: Cijk_Alik_Bljk_SB_MT128x128x8_SE_EPS1_FL0_GRVW4_LPA0_LPB0_PGR1_PLR1_TT8_8_USFGRO1_VW2_WG16_16_1_WGM1
    SolutionIndex: 571
    SolutionNameMin: Cijk_Alik_Bljk_SB_MT128x128x8_SE_EPS1_FL0_GRVW4_LPA0_LPB0_PGR1_PLR1_TT8_8_USFGRO1_VW2_WG16_16_1_WGM8
    SolutionIndex: 572
    SolutionNameMin: Cijk_Alik_Bljk_SB_MT128x128x16_SE_EPS1_FL0_GRVW4_LPA0_LPB0_PGR1_PLR1_TT8_8_USFGRO1_VW2_WG16_16_1_WGM1
    SolutionIndex: 573
    SolutionNameMin: Cijk_Alik_Bljk_SB_MT128x128x16_SE_EPS1_FL0_GRVW4_LPA0_LPB0_PGR1_PLR1_TT8_8_USFGRO1_VW2_WG16_16_1_WGM8
    SolutionIndex: 574
    SolutionNameMin: Cijk_Alik_Bljk_SB_MT128x128x8_SE_EPS1_FL0_GRVW4_LPA0_LPB0_PGR1_PLR1_TT8_8_USFGRO1_VW4_WG16_16_1_WGM1
    SolutionIndex: 575
    SolutionNameMin: Cijk_Alik_Bljk_SB_MT128x128x8_SE_EPS1_FL0_GRVW4_LPA0_LPB0_PGR1_PLR1_TT8_8_USFGRO1_VW4_WG16_16_1_WGM8
    SolutionIndex: 576
    SolutionNameMin: Cijk_Alik_Bljk_SB_MT128x128x16_SE_EPS1_FL0_GRVW4_LPA0_LPB0_PGR1_PLR1_TT8_8_USFGRO1_VW4_WG16_16_1_WGM1
    SolutionIndex: 577
    SolutionNameMin: Cijk_Alik_Bljk_SB_MT128x128x16_SE_EPS1_FL0_GRVW4_LPA0_LPB0_PGR1_PLR1_TT8_8_USFGRO1_VW4_WG16_16_1_WGM8
    SolutionIndex: 578
    SolutionNameMin: Cijk_Alik_Bljk_SB_MT128x128x8_SE_EPS1_FL1_GRVW2_LPA0_LPB0_PGR1_PLR1_TT8_8_USFGRO1_VW2_WG16_16_1_WGM1
    SolutionIndex: 579
    SolutionNameMin: Cijk_Alik_Bljk_SB_MT128x128x16_SE_EPS1_FL1_GRVW2_LPA0_LPB0_PGR1_PLR1_TT8_8_USFGRO1_VW2_WG16_16_1_WGM1
    SolutionIndex: 580
    SolutionNameMin: Cijk_Alik_Bljk_SB_MT128x128x8_SE_EPS1_FL1_GRVW2_LPA0_LPB0_PGR1_PLR1_TT8_8_USFGRO1_VW4_WG16_16_1_WGM1
    SolutionIndex: 581
    SolutionNameMin: Cijk_Alik_Bljk_SB_MT128x128x16_SE_EPS1_FL1_GRVW2_LPA0_LPB0_PGR1_PLR1_TT8_8_USFGRO1_VW4_WG16_16_1_WGM1
    SolutionIndex: 582
    SolutionNameMin: Cijk_Alik_Bljk_SB_MT128x128x16_SE_EPS1_FL1_GRVW2_LPA0_LPB0_PGR1_PLR1_TT8_8_USFGRO1_VW4_WG16_16_1_WGM8
    SolutionIndex: 583
    SolutionNameMin: Cijk_Alik_Bljk_SB_MT128x128x8_SE_EPS1_FL1_GRVW4_LPA0_LPB0_PGR1_PLR1_TT8_8_USFGRO1_VW2_WG16_16_1_WGM1
    SolutionIndex: 584
    SolutionNameMin: Cijk_Alik_Bljk_SB_MT128x128x8_SE_EPS1_FL1_GRVW4_LPA0_LPB0_PGR1_PLR1_TT8_8_USFGRO1_VW2_WG16_16_1_WGM8
    SolutionIndex: 585
    SolutionNameMin: Cijk_Alik_Bljk_SB_MT128x128x16_SE_EPS1_FL1_GRVW4_LPA0_LPB0_PGR1_PLR1_TT8_8_USFGRO1_VW2_WG16_16_1_WGM8
    SolutionIndex: 586
    SolutionNameMin: Cijk_Alik_Bljk_SB_MT128x128x8_SE_EPS1_FL1_GRVW4_LPA0_LPB0_PGR1_PLR1_TT8_8_USFGRO1_VW4_WG16_16_1_WGM1
    SolutionIndex: 587
    SolutionNameMin: Cijk_Alik_Bljk_SB_MT128x128x8_SE_EPS1_FL1_GRVW4_LPA0_LPB0_PGR1_PLR1_TT8_8_USFGRO1_VW4_WG16_16_1_WGM8
    SolutionIndex: 588
    SolutionNameMin: Cijk_Alik_Bljk_SB_MT128x128x16_SE_EPS1_FL1_GRVW4_LPA0_LPB0_PGR1_PLR1_TT8_8_USFGRO1_VW4_WG16_16_1_WGM1
    SolutionIndex: 589
    SolutionNameMin: Cijk_Alik_Bljk_SB_MT128x128x16_SE_EPS1_FL1_GRVW4_LPA0_LPB0_PGR1_PLR1_TT8_8_USFGRO1_VW4_WG16_16_1_WGM8
    SolutionIndex: 599
    SolutionNameMin: Cijk_Alik_Bljk_SB_MT64x32x32_SE_EPS0_FL0_GRVW4_LPA2_LPB2_PGR0_PLR1_TT4_2_USFGRO1_VW2_WG16_16_1_WGM1
    SolutionIndex: 601
    SolutionNameMin: Cijk_Alik_Bljk_SB_MT32x64x32_SE_EPS0_FL0_GRVW4_LPA2_LPB2_PGR0_PLR1_TT2_4_USFGRO1_VW2_WG16_16_1_WGM1
    SolutionIndex: 604
    SolutionNameMin: Cijk_Alik_Bljk_SB_MT64x32x8_SE_EPS1_FL1_GRVW4_LPA2_LPB0_PGR1_PLR1_TT4_4_USFGRO1_VW2_WG16_8_1_WGM1
    SolutionIndex: 610
    SolutionNameMin: Cijk_Alik_Bljk_SB_MT64x16x8_SE_EPS1_FL0_GRVW1_LPA2_LPB0_PGR1_PLR1_TT4_2_USFGRO1_VW2_WG16_8_1_WGM1
    SolutionIndex: 615
    SolutionNameMin: Cijk_Alik_Bljk_SB_MT32x32x8_SE_EPS1_FL0_GRVW1_LPA0_LPB2_PGR1_PLR1_TT2_4_USFGRO1_VW2_WG16_8_1_WGM1
    SolutionIndex: 617
    SolutionNameMin: Cijk_Alik_Bljk_SB_MT32x32x8_SE_EPS1_FL1_GRVW4_LPA0_LPB2_PGR1_PLR1_TT2_4_USFGRO1_VW2_WG16_8_1_WGM1
    SolutionIndex: 619
    SolutionNameMin: Cijk_Alik_Bljk_SB_MT32x32x16_SE_EPS0_FL1_GRVW4_LPA2_LPB2_PGR0_PLR0_TT2_4_USFGRO1_VW2_WG16_8_1_WGM8
    SolutionIndex: 622
    SolutionNameMin: Cijk_Alik_Bljk_SB_MT32x32x16_SE_EPS0_FL0_GRVW2_LPA2_LPB2_PGR0_PLR1_TT2_4_USFGRO1_VW2_WG16_8_1_WGM8
    SolutionIndex: 623
    SolutionNameMin: Cijk_Alik_Bljk_SB_MT32x32x32_SE_EPS0_FL0_GRVW2_LPA2_LPB2_PGR0_PLR1_TT2_4_USFGRO1_VW2_WG16_8_1_WGM1
    SolutionIndex: 625
    SolutionNameMin: Cijk_Alik_Bljk_SB_MT32x32x16_SE_EPS0_FL0_GRVW4_LPA2_LPB2_PGR0_PLR1_TT2_4_USFGRO1_VW2_WG16_8_1_WGM8
    SolutionIndex: 626
    SolutionNameMin: Cijk_Alik_Bljk_SB_MT32x32x16_SE_EPS0_FL1_GRVW2_LPA2_LPB2_PGR0_PLR1_TT2_4_USFGRO1_VW2_WG16_8_1_WGM1
    SolutionIndex: 627
    SolutionNameMin: Cijk_Alik_Bljk_SB_MT32x32x16_SE_EPS0_FL1_GRVW2_LPA2_LPB2_PGR0_PLR1_TT2_4_USFGRO1_VW2_WG16_8_1_WGM8
    SolutionIndex: 630
    SolutionNameMin: Cijk_Alik_Bljk_SB_MT32x32x16_SE_EPS0_FL1_GRVW4_LPA2_LPB2_PGR0_PLR1_TT2_4_USFGRO1_VW2_WG16_8_1_WGM1
    SolutionIndex: 631
    SolutionNameMin: Cijk_Alik_Bljk_SB_MT32x32x16_SE_EPS0_FL1_GRVW4_LPA2_LPB2_PGR0_PLR1_TT2_4_USFGRO1_VW2_WG16_8_1_WGM8
    SolutionIndex: 632
    SolutionNameMin: Cijk_Alik_Bljk_SB_MT32x32x32_SE_EPS0_FL1_GRVW4_LPA2_LPB2_PGR0_PLR1_TT2_4_USFGRO1_VW2_WG16_8_1_WGM8
    SolutionIndex: 634
    SolutionNameMin: Cijk_Alik_Bljk_SB_MT32x32x8_SE_EPS1_FL1_GRVW2_LPA2_LPB2_PGR1_PLR1_TT2_4_USFGRO1_VW2_WG16_8_1_WGM8
    SolutionIndex: 635
    SolutionNameMin: Cijk_Alik_Bljk_SB_MT32x32x8_SE_EPS1_FL1_GRVW4_LPA2_LPB2_PGR1_PLR1_TT2_4_USFGRO1_VW2_WG16_8_1_WGM1
    SolutionIndex: 636
    SolutionNameMin: Cijk_Alik_Bljk_SB_MT32x32x8_SE_EPS1_FL1_GRVW4_LPA2_LPB2_PGR1_PLR1_TT2_4_USFGRO1_VW2_WG16_8_1_WGM8
    SolutionIndex: 637
    SolutionNameMin: Cijk_Alik_Bljk_SB_MT64x64x16_SE_EPS0_FL0_GRVW4_LPA0_LPB0_PGR0_PLR1_TT4_8_USFGRO1_VW2_WG16_8_1_WGM8
    SolutionIndex: 638
    SolutionNameMin: Cijk_Alik_Bljk_SB_MT32x64x16_SE_EPS0_FL1_GRVW2_LPA4_LPB4_PGR0_PLR0_TT4_4_USFGRO1_VW4_WG8_16_1_WGM1
    SolutionIndex: 642
    SolutionNameMin: Cijk_Alik_Bljk_SB_MT32x32x16_SE_EPS0_FL0_GRVW4_LPA0_LPB2_PGR0_PLR1_TT4_2_USFGRO1_VW2_WG8_16_1_WGM1
    SolutionIndex: 647
    SolutionNameMin: Cijk_Alik_Bljk_SB_MT32x32x16_SE_EPS0_FL0_GRVW4_LPA2_LPB2_PGR0_PLR1_TT4_2_USFGRO1_VW2_WG8_16_1_WGM8
    SolutionIndex: 648
    SolutionNameMin: Cijk_Alik_Bljk_SB_MT32x32x16_SE_EPS0_FL1_GRVW2_LPA2_LPB2_PGR0_PLR1_TT4_2_USFGRO1_VW2_WG8_16_1_WGM1
    SolutionIndex: 651
    SolutionNameMin: Cijk_Alik_Bljk_SB_MT32x32x8_SE_EPS1_FL1_GRVW2_LPA2_LPB2_PGR1_PLR1_TT4_2_USFGRO1_VW2_WG8_16_1_WGM1
    SolutionIndex: 654
    SolutionNameMin: Cijk_Alik_Bljk_SB_MT16x64x8_SE_EPS1_FL0_GRVW1_LPA2_LPB2_PGR1_PLR1_TT2_4_USFGRO1_VW2_WG8_16_1_WGM1
    SolutionIndex: 655
    SolutionNameMin: Cijk_Alik_Bljk_SB_MT16x64x8_SE_EPS1_FL0_GRVW4_LPA2_LPB2_PGR1_PLR1_TT2_4_USFGRO1_VW2_WG8_16_1_WGM1
    SolutionIndex: 707
    SolutionNameMin: Cijk_Alik_Bljk_SB_MT128x128x16_SE_GRVW4_GSU1_LRVW4_TT8_8_VW4_WG16_16_1_WGM1
    SolutionIndex: 708
    SolutionNameMin: Cijk_Alik_Bljk_SB_MT128x64x16_SE_GRVW4_GSU1_LRVW4_TT8_4_VW4_WG16_16_1_WGM1
    SolutionIndex: 710
    SolutionNameMin: Cijk_Alik_Bljk_SB_MT64x64x16_SE_GRVW4_GSU1_LRVW4_TT4_4_VW4_WG16_16_1_WGM1
    SolutionIndex: 712
    SolutionNameMin: Cijk_Alik_Bljk_SB_MT64x128x16_SE_GRVW4_GSU1_LRVW4_TT4_8_VW4_WG16_16_1_WGM1
    SolutionIndex: 713
    SolutionNameMin: Cijk_Alik_Bljk_SB_MT32x64x16_SE_GRVW4_GSU1_LRVW4_TT4_4_VW4_WG8_16_2_WGM1
    SolutionIndex: 716
    SolutionNameMin: Cijk_Alik_Bljk_SB_MT64x128x16_SE_GRVW4_GSU1_LRVW4_TT4_8_VW4_WG16_16_1_WGM8
    SolutionIndex: 718
    SolutionNameMin: Cijk_Alik_Bljk_SB_MT64x64x16_SE_GRVW4_GSU1_LRVW4_TT4_4_VW4_WG16_16_1_WGM8
    SolutionIndex: 719
    SolutionNameMin: Cijk_Alik_Bljk_SB_MT32x64x16_SE_GRVW4_GSU1_LRVW4_TT4_4_VW4_WG8_16_2_WGM8
    SolutionIndex: 720
    SolutionNameMin: Cijk_Alik_Bljk_SB_MT64x64x16_SE_GRVW4_GSU1_LRVW4_TT8_4_VW4_WG8_16_2_WGM8
    SolutionIndex: 724
    SolutionNameMin: Cijk_Alik_Bljk_SB_MT64x32x16_SE_GRVW4_GSU1_LRVW4_TT4_4_VW4_WG16_8_2_WGM8
    SolutionIndex: 728
    SolutionNameMin: Cijk_Alik_Bljk_SB_MT128x32x16_SE_GRVW4_GSU1_LRVW4_TT8_4_VW4_WG16_8_2_WGM8
    SolutionIndex: 730
    SolutionNameMin: Cijk_Alik_Bljk_SB_MT64x32x16_SE_GRVW4_GSU1_LRVW4_TT8_4_VW4_WG8_8_4_WGM8
    SolutionIndex: 734
    SolutionNameMin: Cijk_Alik_Bljk_SB_MT32x32x32_SE_GRVW4_GSU1_LRVW4_TT4_4_VW4_WG8_8_4_WGM1
- - - [1024, 128, 1, 128]
    - [12, 896.219]
  - - [4, 704, 1, 1280]
    - [49, 328.876]
  - - [4, 1856, 1, 3328]
    - [59, 501.361]
  - - [1856, 448, 1, 3328]
    - [104, 5677.91]
  - - [2944, 4288, 1, 1280]
    - [90, 8412.39]
  - - [2368, 64, 1, 3328]
    - [40, 4913.92]
  - - [1760, 32, 1, 1760]
    - [67, 3312.94]
  - - [2368, 5888, 1, 256]
    - [90, 6489.72]
  - - [5888, 1856, 1, 256]
    - [102, 7791.88]
  - - [128, 64, 1, 256]
    - [74, 369.217]
  - - [512, 24000, 1, 1536]
    - [96, 8827.37]
  - - [128, 6784, 1, 3328]
    - [96, 6536.99]
  - - [5888, 1408, 1, 256]
    - [109, 6129.61]
  - - [5888, 1856, 1, 3328]
    - [96, 7969.17]
  - - [5056, 704, 1, 256]
    - [96, 6723.82]
  - - [2048, 400, 1, 512]
    - [102, 4531.44]
  - - [5888, 2944, 1, 3328]
    - [102, 8608.04]
  - - [1856, 4288, 1, 256]
    - [102, 6297.54]
  - - [1024, 5056, 1, 128]
    - [80, 3595.37]
  - - [5056, 5056, 1, 3328]
    - [96, 8559.16]
  - - [1408, 5888, 1, 1280]
    - [91, 6797.06]
  - - [2368, 448, 1, 128]
    - [80, 2814.9]
  - - [2368, 6784, 1, 128]
    - [84, 4781.98]
  - - [1024, 3584, 1, 3328]
    - [92, 8402.44]
  - - [512, 48000, 1, 2048]
    - [96, 8162.23]
  - - [128, 448, 1, 1280]
    - [67, 2903.49]
  - - [256, 4288, 1, 3328]
    - [97, 6345.94]
  - - [5888, 1408, 1, 1280]
    - [96, 8959.45]
  - - [704, 1856, 1, 3328]
    - [91, 6955.27]
  - - [4, 1408, 1, 128]
    - [110, 60.0747]
  - - [1024, 2368, 1, 256]
    - [98, 5927.78]
  - - [64, 4, 1, 256]
    - [115, 13.2129]
  - - [1408, 1856, 1, 1280]
    - [94, 8051.58]
  - - [1408, 64, 1, 1280]
    - [70, 3400.45]
  - - [448, 1024, 1, 1280]
    - [98, 5729.92]
  - - [6144, 24000, 1, 2048]
    - [102, 7738.3]
  - - [4096, 32, 1, 4096]
    - [40, 2381.43]
  - - [256, 1408, 1, 3328]
    - [98, 4844.78]
  - - [5056, 5056, 1, 1280]
    - [102, 9090.1]
  - - [448, 5056, 1, 256]
    - [107, 4961.18]
  - - [704, 1856, 1, 1280]
    - [94, 6456.44]
  - - [128, 5056, 1, 128]
    - [23, 2251.02]
  - - [2368, 128, 1, 256]
    - [91, 3403.27]
  - - [1760, 6400, 1, 1760]
    - [90, 8959.7]
  - - [1856, 1408, 1, 128]
    - [83, 3493.06]
  - - [64, 5056, 1, 256]
    - [92, 2582.22]
  - - [6784, 256, 1, 3328]
    - [90, 7323.54]
  - - [6784, 4288, 1, 3328]
    - [92, 8542.09]
  - - [4288, 448, 1, 256]
    - [107, 5030.5]
  - - [64, 704, 1, 128]
    - [25, 375.467]
  - - [1856, 2368, 1, 3328]
    - [101, 6742.34]
  - - [4288, 2944, 1, 1280]
    - [102, 8578.17]
  - - [704, 5056, 1, 1280]
    - [98, 8014.45]
  - - [2368, 704, 1, 3328]
    - [97, 6544.31]
  - - [256, 5888, 1, 256]
    - [95, 5932.9]
  - - [1856, 4288, 1, 3328]
    - [101, 7410.72]
  - - [256, 2944, 1, 256]
    - [97, 5013.98]
  - - [5888, 1024, 1, 256]
    - [102, 8069.34]
  - - [448, 64, 1, 1280]
    - [77, 2057.18]
  - - [3072, 64, 1, 1024]
    - [57, 2145.42]
  - - [3584, 4, 1, 1280]
    - [49, 498.643]
  - - [16384, 3200, 1, 4096]
    - [89, 6621.43]
  - - [2944, 64, 1, 256]
    - [97, 2554.79]
  - - [128, 4, 1, 1280]
    - [59, 87.1489]
  - - [1408, 2944, 1, 256]
    - [96, 8029.35]
  - - [256, 1856, 1, 1280]
    - [91, 6170.6]
  - - [6784, 5056, 1, 3328]
    - [100, 7134.19]
  - - [5056, 5056, 1, 256]
    - [107, 6246.8]
  - - [1408, 6784, 1, 128]
    - [85, 4329.45]
  - - [64, 1024, 1, 1280]
    - [67, 3206.65]
  - - [2944, 4, 1, 256]
    - [115, 333.48]
  - - [704, 5056, 1, 128]
    - [80, 4085.42]
  - - [4, 2368, 1, 1280]
    - [116, 394.667]
  - - [2368, 2944, 1, 1280]
    - [96, 8633.95]
  - - [128, 3584, 1, 1280]
    - [97, 6046.15]
  - - [6784, 6784, 1, 1280]
    - [102, 8847.41]
  - - [1408, 4288, 1, 1280]
    - [102, 8236.69]
  - - [3584, 4288, 1, 1280]
    - [97, 7399.88]
  - - [2368, 704, 1, 1280]
    - [90, 6754.4]
  - - [5056, 4288, 1, 3328]
    - [96, 8569.53]
  - - [3584, 2368, 1, 3328]
    - [101, 7942.38]
  - - [64, 704, 1, 1280]
    - [70, 2363.59]
  - - [4288, 256, 1, 256]
    - [98, 4591.8]
  - - [2944, 128, 1, 128]
    - [23, 1878.29]
  - - [6144, 32, 1, 2560]
    - [68, 3334.1]
  - - [6784, 448, 1, 1280]
    - [100, 7939.2]
  - - [1408, 2944, 1, 128]
    - [84, 4096.51]
  - - [4288, 2944, 1, 256]
    - [90, 8141.13]
  - - [5888, 704, 1, 1280]
    - [91, 7516.13]
  - - [5056, 4, 1, 3328]
    - [34, 552.409]
  - - [1856, 64, 1, 1280]
    - [40, 3870.76]
  - - [1760, 16, 1, 1760]
    - [52, 2181.41]
  - - [448, 5888, 1, 128]
    - [85, 3371.0]
  - - [5888, 64, 1, 3328]
    - [65, 5319.38]
  - - [2944, 256, 1, 3328]
    - [97, 7122.3]
  - - [1024, 64, 1, 128]
    - [12, 595.782]
  - - [5056, 2368, 1, 1280]
    - [91, 7778.19]
  - - [448, 3584, 1, 1280]
    - [96, 6500.52]
  - - [6784, 5888, 1, 256]
    - [96, 8918.58]
  - - [704, 1024, 1, 128]
    - [80, 2627.41]
  - - [704, 128, 1, 1280]
    - [67, 3408.49]
  - - [4, 3584, 1, 128]
    - [110, 140.721]
  - - [1408, 448, 1, 1280]
    - [91, 5881.44]
  - - [1024, 1408, 1, 256]
    - [95, 5647.17]
  - - [2368, 2368, 1, 3328]
    - [89, 7688.73]
  - - [1856, 6784, 1, 128]
    - [80, 4705.85]
  - - [5056, 704, 1, 3328]
    - [100, 8198.88]
  - - [1408, 1856, 1, 256]
    - [102, 6339.95]
  - - [1408, 704, 1, 3328]
    - [94, 7599.55]
  - - [2368, 5056, 1, 256]
    - [102, 8242.75]
  - - [1408, 256, 1, 1280]
    - [97, 4879.16]
  - - [3072, 128, 1, 1024]
    - [66, 2525.42]
  - - [3584, 2368, 1, 1280]
    - [98, 8132.62]
  - - [4288, 64, 1, 3328]
    - [53, 5156.43]
  - - [2368, 4, 1, 1280]
    - [114, 482.65]
  - - [704, 5888, 1, 256]
    - [105, 5398.65]
  - - [6784, 2944, 1, 128]
    - [81, 4748.89]
  - - [2560, 1600, 1, 2560]
    - [92, 7354.9]
  - - [4288, 6784, 1, 3328]
    - [89, 7409.31]
  - - [2944, 256, 1, 256]
    - [97, 5077.32]
  - - [2944, 6784, 1, 3328]
    - [102, 8067.95]
  - - [704, 1408, 1, 3328]
    - [97, 7239.33]
  - - [6144, 5984, 1, 2048]
    - [96, 7175.97]
  - - [3584, 704, 1, 3328]
    - [102, 6642.76]
  - - [2944, 256, 1, 128]
    - [81, 2644.44]
  - - [6784, 4, 1, 1280]
    - [112, 402.387]
  - - [1024, 64, 1, 1280]
    - [67, 2601.93]
  - - [2048, 1600, 1, 512]
    - [94, 5592.4]
  - - [448, 4288, 1, 256]
    - [92, 6128.89]
  - - [64, 3584, 1, 3328]
    - [33, 5534.83]
  - - [1856, 4288, 1, 128]
    - [83, 4400.01]
  - - [704, 2368, 1, 1280]
    - [107, 5734.92]
  - - [1856, 2368, 1, 1280]
    - [105, 6482.3]
  - - [2368, 128, 1, 3328]
    - [78, 4717.22]
  - - [2944, 128, 1, 256]
    - [105, 3276.8]
  - - [448, 1408, 1, 256]
    - [97, 4852.18]
  - - [1856, 4288, 1, 1280]
    - [92, 8132.86]
  - - [64, 5056, 1, 3328]
    - [68, 5096.96]
  - - [4, 704, 1, 256]
    - [114, 128.731]
  - - [1024, 448, 1, 128]
    - [80, 1816.84]
  - - [704, 4, 1, 1280]
    - [115, 328.876]
  - - [704, 256, 1, 128]
    - [84, 876.469]
  - - [704, 2944, 1, 128]
    - [84, 3734.37]
  - - [1408, 1024, 1, 1280]
    - [92, 7224.75]
  - - [704, 6784, 1, 256]
    - [96, 7354.67]
  - - [6784, 704, 1, 256]
    - [92, 6012.18]
  - - [5056, 1408, 1, 128]
    - [85, 4311.18]
  - - [2048, 7000, 1, 2048]
    - [96, 7231.97]
  - - [256, 3584, 1, 3328]
    - [100, 7005.9]
  - - [4, 5888, 1, 3328]
    - [117, 534.512]
  - - [128, 1408, 1, 128]
    - [10, 1176.97]
  - - [3584, 4288, 1, 3328]
    - [102, 7134.9]
  - - [5888, 1856, 1, 1280]
    - [90, 8394.93]
  - - [256, 1408, 1, 256]
    - [91, 3977.36]
  - - [5056, 64, 1, 1280]
    - [91, 4257.68]
  - - [1024, 704, 1, 256]
    - [91, 5036.83]
  - - [448, 128, 1, 128]
    - [12, 533.433]
  - - [2368, 3584, 1, 1280]
    - [96, 8272.33]
  - - [2368, 6784, 1, 1280]
    - [89, 8288.14]
  - - [1856, 4, 1, 1280]
    - [29, 464.0]
  - - [448, 448, 1, 256]
    - [91, 3058.35]
  - - [2944, 3584, 1, 3328]
    - [96, 8557.53]
  - - [7680, 32, 1, 2560]
    - [68, 3728.93]
  - - [128, 4288, 1, 128]
    - [11, 2116.1]
  - - [256, 256, 1, 3328]
    - [67, 4050.96]
  - - [128, 1024, 1, 3328]
    - [40, 5139.11]
  - - [4, 1408, 1, 3328]
    - [59, 502.771]
  - - [6784, 2944, 1, 256]
    - [90, 8445.96]
  - - [64, 1856, 1, 1280]
    - [32, 3870.76]
  - - [6784, 64, 1, 128]
    - [80, 1877.52]
  - - [4288, 2368, 1, 3328]
    - [100, 8419.3]
  - - [1856, 2368, 1, 256]
    - [94, 6887.38]
  - - [3584, 256, 1, 128]
    - [84, 2496.61]
  - - [3584, 6784, 1, 3328]
    - [96, 7626.08]
  - - [256, 1024, 1, 256]
    - [97, 3095.43]
  - - [4, 6784, 1, 3328]
    - [59, 589.174]
  - - [1024, 5888, 1, 3328]
    - [96, 7794.25]
  - - [1024, 128, 1, 1280]
    - [69, 3130.08]
  - - [3072, 32, 1, 1024]
    - [56, 1675.49]
  - - [6144, 24000, 1, 2560]
    - [96, 7256.04]
  - - [5056, 4288, 1, 1280]
    - [94, 8348.93]
  - - [5888, 64, 1, 256]
    - [43, 2593.25]
  - - [6784, 1856, 1, 3328]
    - [90, 8087.28]
  - - [1408, 5056, 1, 1280]
    - [92, 7802.53]
  - - [1856, 256, 1, 1280]
    - [97, 6150.63]
  - - [64, 5888, 1, 3328]
    - [64, 5301.39]
  - - [2368, 2368, 1, 1280]
    - [94, 8233.33]
  - - [2944, 5888, 1, 128]
    - [87, 3745.41]
  - - [704, 5888, 1, 1280]
    - [92, 8244.94]
  - - [2368, 3584, 1, 128]
    - [84, 4523.33]
  - - [1856, 5056, 1, 128]
    - [81, 4497.98]
  - - [704, 1024, 1, 1280]
    - [105, 5479.49]
  - - [448, 256, 1, 3328]
    - [48, 5048.7]
  - - [448, 1856, 1, 128]
    - [81, 2936.82]
  - - [8192, 3200, 1, 2048]
    - [90, 6713.02]
  - - [128, 1024, 1, 128]
    - [26, 998.644]
  - - [2944, 4, 1, 128]
    - [110, 98.6471]
  - - [1024, 704, 1, 1280]
    - [97, 5896.9]
  - - [128, 5888, 1, 256]
    - [97, 5013.98]
  - - [1024, 5056, 1, 1280]
    - [96, 8857.71]
  - - [4288, 1024, 1, 256]
    - [102, 6195.29]
  - - [2944, 2368, 1, 128]
    - [80, 4442.13]
  - - [704, 704, 1, 3328]
    - [97, 6764.3]
  - - [704, 1408, 1, 1280]
    - [98, 7383.48]
  - - [5888, 448, 1, 1280]
    - [96, 7299.39]
  - - [3584, 256, 1, 3328]
    - [94, 7061.62]
  - - [704, 5888, 1, 3328]
    - [98, 8142.32]
  - - [704, 1856, 1, 128]
    - [84, 3139.04]
  - - [448, 448, 1, 3328]
    - [62, 5063.24]
  - - [4, 4288, 1, 128]
    - [111, 64.8775]
  - - [128, 704, 1, 1280]
    - [32, 3400.45]
  - - [3584, 2944, 1, 256]
    - [102, 7982.04]
  - - [3584, 4, 1, 128]
    - [110, 105.218]
  - - [1856, 128, 1, 3328]
    - [63, 5442.09]
  - - [4, 64, 1, 1280]
    - [116, 42.2268]
  - - [2944, 448, 1, 128]
    - [80, 2926.85]
  - - [128, 2944, 1, 1280]
    - [91, 5109.59]
  - - [64, 64, 1, 3328]
    - [59, 1252.89]
  - - [448, 2944, 1, 1280]
    - [100, 6684.37]
  - - [512, 24000, 1, 2048]
    - [96, 7938.93]
  - - [128, 256, 1, 3328]
    - [77, 3276.8]
  - - [1408, 5056, 1, 3328]
    - [102, 8959.11]
  - - [1856, 1856, 1, 3328]
    - [92, 8006.07]
  - - [3584, 128, 1, 256]
    - [97, 4292.42]
  - - [2560, 800, 1, 2560]
    - [92, 6262.38]
  - - [448, 1408, 1, 3328]
    - [107, 4997.25]
  - - [2368, 2368, 1, 256]
    - [109, 4978.84]
  - - [4288, 4288, 1, 1280]
    - [89, 8617.68]
  - - [64, 448, 1, 1280]
    - [35, 2057.18]
  - - [5888, 1024, 1, 1280]
    - [106, 6848.07]
  - - [1408, 4288, 1, 256]
    - [90, 7076.91]
  - - [448, 4, 1, 256]
    - [114, 84.3294]
  - - [5888, 448, 1, 128]
    - [84, 3493.81]
  - - [512, 48000, 1, 2560]
    - [102, 8960.03]
  - - [35, 8457, 1, 1760]
    - [4, 3934.68]
  - - [704, 6784, 1, 3328]
    - [89, 8180.78]
  - - [2560, 6400, 1, 2560]
    - [90, 7822.14]
  - - [5056, 1024, 1, 1280]
    - [92, 8357.28]
  - - [448, 5888, 1, 3328]
    - [96, 7505.18]
  - - [128, 4, 1, 128]
    - [110, 0.562251]
  - - [1024, 2944, 1, 1280]
    - [96, 8406.14]
  - - [5056, 5888, 1, 1280]
    - [96, 8819.66]
  - - [4288, 5888, 1, 128]
    - [81, 3522.22]
  - - [256, 3584, 1, 256]
    - [92, 5883.79]
  - - [1408, 3584, 1, 128]
    - [80, 4283.31]
  - - [256, 2944, 1, 3328]
    - [100, 5670.53]
  - - [448, 3584, 1, 128]
    - [84, 3171.62]
  - - [5888, 2944, 1, 1280]
    - [102, 8198.76]
  - - [4, 6784, 1, 1280]
    - [49, 553.796]
  - - [2368, 5888, 1, 128]
    - [80, 4787.22]
  - - [8448, 16, 1, 2816]
    - [39, 2452.53]
  - - [64, 2944, 1, 128]
    - [12, 1376.56]
  - - [2368, 4, 1, 256]
    - [34, 278.077]
  - - [3584, 5888, 1, 256]
    - [109, 6233.56]
  - - [2368, 1024, 1, 128]
    - [81, 3781.41]
  - - [2368, 704, 1, 128]
    - [81, 3198.22]
  - - [3584, 2944, 1, 1280]
    - [92, 8045.58]
  - - [3584, 2368, 1, 128]
    - [81, 4188.47]
  - - [5056, 704, 1, 128]
    - [84, 4019.11]
  - - [448, 2368, 1, 128]
    - [86, 2522.11]
  - - [5056, 1408, 1, 3328]
    - [94, 8349.83]
  - - [1408, 704, 1, 256]
    - [100, 4741.32]
  - - [6784, 1024, 1, 3328]
    - [102, 8769.4]
  - - [6784, 2944, 1, 3328]
    - [99, 7319.64]
  - - [2944, 5056, 1, 3328]
    - [89, 8889.66]
  - - [1856, 1856, 1, 256]
    - [92, 6309.74]
  - - [1024, 5888, 1, 128]
    - [83, 3759.5]
  - - [6784, 2368, 1, 1280]
    - [92, 8298.3]
  - - [256, 4, 1, 128]
    - [110, 7.00171]
  - - [4288, 5888, 1, 1280]
    - [96, 8365.18]
  - - [4288, 4288, 1, 256]
    - [96, 6513.68]
  - - [8448, 32, 1, 2816]
    - [67, 4257.64]
  - - [448, 2944, 1, 3328]
    - [100, 6875.52]
  - - [5888, 4, 1, 128]
    - [110, 163.84]
  - - [4288, 1856, 1, 1280]
    - [96, 8402.81]
  - - [1856, 2944, 1, 3328]
    - [96, 6612.11]
  - - [256, 6784, 1, 3328]
    - [97, 7358.6]
  - - [64, 5888, 1, 256]
    - [91, 3358.95]
  - - [256, 5056, 1, 128]
    - [84, 2489.11]
  - - [5056, 1024, 1, 256]
    - [102, 8077.77]
  - - [704, 64, 1, 3328]
    - [46, 3288.3]
  - - [5056, 1856, 1, 3328]
    - [100, 8171.03]
  - - [4, 2944, 1, 3328]
    - [59, 546.743]
  - - [4, 5056, 1, 256]
    - [34, 378.461]
  - - [1856, 1408, 1, 256]
    - [102, 6320.78]
  - - [8448, 12000, 1, 2816]
    - [100, 7365.77]
  - - [6784, 128, 1, 3328]
    - [97, 6366.47]
  - - [4288, 1408, 1, 128]
    - [80, 4451.6]
  - - [1856, 5888, 1, 3328]
    - [98, 8619.66]
  - - [4288, 5056, 1, 256]
    - [102, 7288.95]
  - - [1408, 128, 1, 1280]
    - [40, 4291.05]
  - - [4096, 800, 1, 1024]
    - [91, 5867.79]
  - - [5056, 256, 1, 3328]
    - [97, 7527.51]
  - - [704, 704, 1, 256]
    - [97, 4417.75]
  - - [1024, 5888, 1, 1280]
    - [102, 8674.47]
  - - [6784, 2368, 1, 128]
    - [80, 4723.98]
  - - [4, 5056, 1, 1280]
    - [49, 540.207]
  - - [256, 64, 1, 1280]
    - [51, 1515.28]
  - - [128, 1856, 1, 1280]
    - [91, 4574.11]
  - - [1856, 1024, 1, 1280]
    - [96, 7741.51]
  - - [6784, 4288, 1, 1280]
    - [102, 8521.19]
  - - [2560, 64, 1, 2560]
    - [33, 3504.6]
  - - [1856, 1856, 1, 1280]
    - [92, 7779.21]
  - - [4096, 400, 1, 1024]
    - [708, 7851.54]
  - - [3072, 24000, 1, 1024]
    - [102, 8663.35]
  - - [128, 4288, 1, 3328]
    - [48, 5674.13]
  - - [4, 2368, 1, 3328]
    - [59, 525.38]
  - - [5888, 1856, 1, 128]
    - [84, 4099.64]
  - - [448, 704, 1, 1280]
    - [97, 4309.37]
  - - [128, 5056, 1, 1280]
    - [40, 5068.36]
  - - [1024, 448, 1, 3328]
    - [100, 6077.72]
  - - [1856, 704, 1, 1280]
    - [107, 6257.39]
  - - [5056, 3584, 1, 128]
    - [81, 4598.42]
  - - [5888, 5888, 1, 3328]
    - [102, 8058.15]
  - - [6784, 1024, 1, 256]
    - [102, 5120.89]
  - - [2944, 2368, 1, 256]
    - [93, 6522.93]
  - - [256, 448, 1, 256]
    - [43, 1816.84]
  - - [5056, 5888, 1, 3328]
    - [95, 6722.31]
  - - [1856, 1024, 1, 256]
    - [102, 6632.21]
  - - [512, 48000, 1, 1536]
    - [96, 8555.91]
  - - [3584, 448, 1, 1280]
    - [91, 6566.99]
  - - [8448, 5984, 1, 2816]
    - [96, 8990.56]
  - - [448, 5888, 1, 256]
    - [96, 6220.37]
  - - [704, 64, 1, 128]
    - [9, 450.56]
  - - [1408, 6784, 1, 3328]
    - [89, 8478.58]
  - - [448, 1024, 1, 128]
    - [88, 1844.23]
  - - [4288, 704, 1, 128]
    - [84, 3895.16]
  - - [128, 1856, 1, 128]
    - [15, 1456.36]
  - - [448, 2368, 1, 3328]
    - [94, 5537.94]
  - - [5056, 64, 1, 128]
    - [80, 1648.84]
  - - [5056, 2944, 1, 256]
    - [96, 8230.77]
  - - [6784, 5888, 1, 128]
    - [80, 4873.09]
  - - [1024, 700, 1, 512]
    - [94, 4445.27]
  - - [704, 1024, 1, 256]
    - [92, 4707.89]
  - - [1024, 4, 1, 256]
    - [34, 174.763]
  - - [2944, 704, 1, 128]
    - [84, 3483.32]
  - - [128, 6784, 1, 1280]
    - [92, 6522.83]
  - - [1408, 3584, 1, 3328]
    - [96, 8673.49]
  - - [2368, 6784, 1, 256]
    - [92, 7941.66]
  - - [5056, 1408, 1, 1280]
    - [96, 8800.91]
  - - [256, 256, 1, 128]
    - [21, 551.882]
  - - [5056, 4288, 1, 128]
    - [88, 3793.54]
  - - [1408, 1856, 1, 128]
    - [80, 3067.64]
  - - [1408, 5888, 1, 3328]
    - [96, 9148.87]
  - - [1856, 256, 1, 256]
    - [92, 4319.42]
  - - [6784, 6784, 1, 256]
    - [92, 7668.43]
  - - [64, 256, 1, 128]
    - [26, 131.072]
  - - [4288, 2368, 1, 128]
    - [81, 4582.89]
  - - [256, 4288, 1, 1280]
    - [91, 6058.51]
  - - [2368, 2944, 1, 256]
    - [96, 8015.97]
  - - [4, 1856, 1, 256]
    - [112, 252.732]
  - - [3584, 1856, 1, 1280]
    - [92, 7760.14]
  - - [6784, 6784, 1, 128]
    - [81, 4970.04]
  - - [256, 1856, 1, 128]
    - [87, 1580.49]
  - - [704, 64, 1, 1280]
    - [76, 2556.37]
  - - [5888, 5056, 1, 256]
    - [96, 8216.57]
  - - [8448, 48000, 1, 2816]
    - [102, 4082.79]
  - - [3584, 448, 1, 256]
    - [96, 5518.82]
  - - [448, 4288, 1, 128]
    - [84, 3415.15]
  - - [7680, 64, 1, 2560]
    - [45, 5162.0]
  - - [256, 6784, 1, 256]
    - [96, 6272.52]
  - - [1408, 4288, 1, 128]
    - [84, 4343.53]
  - - [2944, 704, 1, 3328]
    - [91, 7679.61]
  - - [128, 448, 1, 256]
    - [31, 1422.49]
  - - [5056, 256, 1, 1280]
    - [98, 5052.29]
  - - [2560, 32, 1, 2560]
    - [54, 3105.97]
  - - [3584, 3584, 1, 256]
    - [102, 8260.47]
  - - [448, 1408, 1, 128]
    - [80, 2397.28]
  - - [128, 256, 1, 1280]
    - [35, 2340.57]
  - - [3584, 5056, 1, 256]
    - [102, 7347.46]
  - - [6784, 128, 1, 256]
    - [92, 5591.0]
  - - [4288, 4, 1, 256]
    - [34, 354.106]
  - - [704, 448, 1, 256]
    - [97, 3492.23]
  - - [2944, 2368, 1, 1280]
    - [104, 6661.61]
  - - [448, 64, 1, 3328]
    - [76, 3058.35]
  - - [1408, 3584, 1, 256]
    - [102, 7966.49]
  - - [3584, 4, 1, 3328]
    - [114, 605.459]
  - - [6784, 3584, 1, 256]
    - [92, 7525.31]
  - - [256, 128, 1, 128]
    - [24, 275.941]
  - - [704, 1408, 1, 128]
    - [81, 3109.75]
  - - [4, 2368, 1, 256]
    - [114, 283.275]
  - - [4288, 128, 1, 1280]
    - [97, 5132.55]
  - - [128, 1408, 1, 256]
    - [91, 2733.25]
  - - [4, 2944, 1, 256]
    - [112, 314.027]
  - - [64, 128, 1, 3328]
    - [61, 1514.61]
  - - [5056, 2368, 1, 128]
    - [85, 3449.07]
  - - [2944, 2944, 1, 3328]
    - [89, 8168.93]
  - - [5056, 6784, 1, 256]
    - [108, 5792.67]
  - - [1856, 3584, 1, 128]
    - [86, 4213.4]
  - - [128, 2944, 1, 128]
    - [10, 1970.36]
  - - [35, 8457, 1, 2560]
    - [5, 3525.05]
  - - [1024, 704, 1, 3328]
    - [91, 6784.89]
  - - [6784, 448, 1, 256]
    - [100, 6544.78]
  - - [3584, 6784, 1, 128]
    - [80, 4623.5]
  - - [128, 4288, 1, 256]
    - [94, 3606.5]
  - - [704, 448, 1, 3328]
    - [91, 4477.91]
  - - [128, 128, 1, 3328]
    - [76, 2177.55]
  - - [5056, 1856, 1, 256]
    - [109, 5608.62]
  - - [4608, 5984, 1, 1536]
    - [99, 7859.75]
  - - [256, 128, 1, 256]
    - [35, 998.644]
  - - [1760, 3200, 1, 1760]
    - [92, 8179.54]
  - - [1024, 1856, 1, 256]
    - [102, 6143.17]
  - - [4096, 1600, 1, 1024]
    - [718, 8558.92]
  - - [4288, 64, 1, 128]
    - [15, 1372.16]
  - - [256, 448, 1, 3328]
    - [54, 4795.0]
  - - [1408, 6784, 1, 1280]
    - [96, 8426.4]
  - - [3584, 3584, 1, 1280]
    - [96, 7556.46]
  - - [7680, 24000, 1, 2560]
    - [89, 5019.09]
  - - [64, 2368, 1, 1280]
    - [40, 4061.7]
  - - [448, 2368, 1, 1280]
    - [91, 5928.67]
  - - [4608, 48000, 1, 1536]
    - [96, 6937.3]
  - - [5888, 5888, 1, 128]
    - [81, 3743.9]
  - - [64, 6784, 1, 3328]
    - [91, 5988.62]
  - - [2944, 256, 1, 1280]
    - [97, 6717.87]
  - - [2048, 16, 1, 2048]
    - [49, 1210.48]
  - - [256, 2368, 1, 128]
    - [84, 1935.97]
  - - [5056, 2368, 1, 3328]
    - [102, 8875.53]
  - - [2944, 4288, 1, 256]
    - [96, 8063.14]
  - - [1408, 3584, 1, 1280]
    - [92, 8196.97]
  - - [2368, 64, 1, 256]
    - [91, 2365.69]
  - - [64, 448, 1, 3328]
    - [77, 3027.3]
  - - [704, 128, 1, 3328]
    - [48, 4452.09]
  - - [8192, 1600, 1, 2048]
    - [96, 7229.83]
  - - [1856, 704, 1, 256]
    - [98, 5545.35]
  - - [4, 4288, 1, 1280]
    - [49, 523.725]
  - - [1408, 448, 1, 3328]
    - [103, 4789.3]
  - - [1024, 4, 1, 3328]
    - [29, 504.123]
  - - [512, 24000, 1, 2560]
    - [102, 8903.52]
  - - [2368, 6784, 1, 3328]
    - [102, 8311.04]
  - - [1856, 1408, 1, 1280]
    - [92, 8160.01]
  - - [1856, 448, 1, 1280]
    - [94, 6242.97]
  - - [6784, 704, 1, 128]
    - [80, 4068.95]
  - - [4, 4, 1, 256]
    - [49, 0.742029]
  - - [128, 5888, 1, 128]
    - [80, 2327.92]
  - - [1408, 5888, 1, 256]
    - [91, 6986.81]
  - - [704, 2944, 1, 1280]
    - [92, 7904.93]
  - - [4288, 64, 1, 1280]
    - [67, 3828.17]
  - - [256, 64, 1, 256]
    - [42, 655.36]
  - - [704, 1856, 1, 256]
    - [100, 5444.27]
  - - [704, 6784, 1, 128]
    - [80, 4319.67]
  - - [3584, 704, 1, 1280]
    - [100, 7726.33]
  - - [256, 128, 1, 1280]
    - [35, 2184.53]
  - - [5888, 2368, 1, 256]
    - [102, 8192.59]
  - - [256, 2368, 1, 1280]
    - [97, 5675.44]
  - - [2944, 6784, 1, 128]
    - [85, 4248.25]
  - - [3584, 448, 1, 3328]
    - [96, 6560.67]
  - - [1408, 4, 1, 256]
    - [113, 176.69]
  - - [704, 2368, 1, 3328]
    - [97, 7085.21]
  - - [2944, 448, 1, 256]
    - [93, 3411.9]
  - - [1856, 448, 1, 128]
    - [81, 2748.72]
  - - [4288, 4, 1, 3328]
    - [49, 553.548]
  - - [2368, 128, 1, 1280]
    - [70, 4173.55]
  - - [256, 5888, 1, 128]
    - [85, 2860.88]
  - - [64, 6784, 1, 256]
    - [98, 3637.08]
  - - [64, 5056, 1, 1280]
    - [97, 4289.43]
  - - [4, 6784, 1, 128]
    - [110, 160.806]
  - - [2048, 3200, 1, 512]
    - [98, 6926.99]
  - - [2944, 2944, 1, 1280]
    - [90, 6267.75]
  - - [5056, 448, 1, 3328]
    - [91, 7400.26]
  - - [4, 3584, 1, 1280]
    - [49, 499.73]
  - - [1408, 128, 1, 128]
    - [26, 1037.26]
  - - [6784, 704, 1, 3328]
    - [97, 7633.85]
  - - [128, 64, 1, 1280]
    - [49, 1170.29]
  - - [2368, 256, 1, 1280]
    - [97, 5609.79]
  - - [4, 448, 1, 3328]
    - [116, 358.4]
  - - [5888, 4288, 1, 128]
    - [85, 4521.64]
  - - [4, 5888, 1, 256]
    - [49, 353.833]
  - - [1408, 2944, 1, 3328]
    - [90, 8951.31]
  - - [3584, 704, 1, 128]
    - [80, 3395.31]
  - - [4608, 12000, 1, 1536]
    - [89, 6609.89]
  - - [64, 1024, 1, 256]
    - [35, 1588.75]
  - - [5056, 5056, 1, 128]
    - [80, 4080.71]
  - - [2368, 448, 1, 1280]
    - [91, 5422.94]
  - - [128, 3584, 1, 256]
    - [97, 4705.15]
  - - [704, 448, 1, 1280]
    - [94, 3960.97]
  - - [8192, 800, 1, 2048]
    - [92, 6306.26]
  - - [448, 5056, 1, 128]
    - [84, 3709.46]
  - - [256, 4, 1, 1280]
    - [115, 163.84]
  - - [5056, 3584, 1, 256]
    - [89, 7008.24]
  - - [2368, 4, 1, 3328]
    - [49, 496.266]
  - - [1408, 5056, 1, 128]
    - [84, 4175.27]
  - - [2944, 3584, 1, 128]
    - [80, 4659.69]
  - - [3584, 2368, 1, 256]
    - [102, 5851.77]
  - - [128, 3584, 1, 3328]
    - [92, 6104.94]
  - - [128, 1024, 1, 1280]
    - [32, 3847.99]
  - - [8448, 24000, 1, 2816]
    - [102, 5128.54]
  - - [64, 704, 1, 256]
    - [35, 1253.73]
  - - [4288, 256, 1, 1280]
    - [91, 5625.76]
  - - [3584, 3584, 1, 3328]
    - [96, 8206.05]
  - - [4, 704, 1, 128]
    - [110, 29.4484]
  - - [5888, 6784, 1, 256]
    - [98, 8248.65]
  - - [4288, 2944, 1, 3328]
    - [96, 8657.02]
  - - [2944, 64, 1, 128]
    - [15, 1240.6]
  - - [1024, 128, 1, 3328]
    - [40, 4433.0]
  - - [1024, 16, 1, 500000]
    - [3, 2571.05]
  - - [4288, 128, 1, 3328]
    - [40, 5716.75]
  - - [7680, 128, 1, 2560]
    - [38, 5488.0]
  - - [256, 5056, 1, 1280]
    - [98, 6379.96]
  - - [1408, 256, 1, 128]
    - [84, 1633.73]
  - - [2944, 5888, 1, 3328]
    - [93, 7848.92]
  - - [6784, 5888, 1, 1280]
    - [102, 9047.62]
  - - [2048, 800, 1, 512]
    - [97, 4841.07]
  - - [704, 128, 1, 256]
    - [42, 1567.17]
  - - [5888, 4288, 1, 1280]
    - [96, 7982.83]
  - - [1024, 24000, 1, 2048]
    - [98, 5774.3]
  - - [448, 256, 1, 1280]
    - [32, 3707.09]
  - - [5888, 3584, 1, 128]
    - [85, 3804.4]
  - - [1024, 2944, 1, 128]
    - [80, 3308.26]
  - - [5056, 4, 1, 1280]
    - [112, 468.962]
  - - [256, 1408, 1, 1280]
    - [91, 4899.89]
  - - [3072, 16, 1, 1024]
    - [49, 1233.62]
  - - [704, 3584, 1, 128]
    - [80, 3919.43]
  - - [5888, 448, 1, 3328]
    - [109, 6095.61]
  - - [2368, 4288, 1, 1280]
    - [92, 8338.3]
  - - [4288, 2944, 1, 128]
    - [84, 3946.5]
  - - [1024, 6784, 1, 3328]
    - [98, 7494.28]
  - - [128, 2368, 1, 256]
    - [97, 2895.32]
  - - [6784, 64, 1, 3328]
    - [91, 5964.89]
  - - [5056, 2944, 1, 3328]
    - [102, 6605.53]
  - - [448, 128, 1, 256]
    - [35, 1339.42]
  - - [2944, 3584, 1, 256]
    - [98, 7165.56]
  - - [1408, 1408, 1, 3328]
    - [102, 8332.86]
  - - [1856, 128, 1, 1280]
    - [97, 4498.33]
  - - [3584, 3584, 1, 128]
    - [81, 4000.01]
  - - [64, 3584, 1, 256]
    - [107, 2383.13]
  - - [1408, 4, 1, 3328]
    - [59, 422.908]
  - - [128, 2944, 1, 3328]
    - [64, 5429.93]
  - - [3584, 704, 1, 256]
    - [97, 6153.99]
  - - [2944, 448, 1, 3328]
    - [97, 6507.72]
  - - [3584, 1408, 1, 3328]
    - [102, 8829.63]
  - - [704, 3584, 1, 1280]
    - [92, 7860.23]
  - - [2944, 6784, 1, 1280]
    - [102, 8894.5]
  - - [1856, 6784, 1, 256]
    - [102, 8115.09]
  - - [4288, 448, 1, 3328]
    - [94, 6397.25]
  - - [6784, 4288, 1, 128]
    - [80, 4109.44]
  - - [6784, 704, 1, 1280]
    - [90, 7999.04]
  - - [256, 4288, 1, 256]
    - [94, 4603.84]
  - - [3584, 6784, 1, 256]
    - [102, 7361.55]
  - - [6144, 12000, 1, 2048]
    - [101, 6311.66]
  - - [6144, 16, 1, 2560]
    - [50, 2240.55]
  - - [3584, 64, 1, 128]
    - [21, 1292.26]
  - - [5888, 1024, 1, 3328]
    - [89, 8394.49]
  - - [448, 64, 1, 128]
    - [12, 262.144]
  - - [704, 6784, 1, 1280]
    - [96, 7740.56]
  - - [4, 1024, 1, 1280]
    - [49, 378.821]
  - - [5888, 128, 1, 256]
    - [97, 5003.58]
  - - [4096, 16, 1, 4096]
    - [49, 1585.75]
  - - [1856, 5056, 1, 3328]
    - [90, 8522.82]
  - - [4, 6784, 1, 256]
    - [34, 387.657]
  - - [1024, 3584, 1, 128]
    - [84, 3031.51]
  - - [1024, 1408, 1, 128]
    - [86, 2600.75]
  - - [2368, 2944, 1, 128]
    - [83, 4340.16]
  - - [5056, 64, 1, 256]
    - [97, 3109.52]
  - - [4, 448, 1, 1280]
    - [116, 253.735]
  - - [5056, 2944, 1, 128]
    - [88, 3739.91]
  - - [5888, 5056, 1, 3328]
    - [102, 9016.38]
  - - [1024, 704, 1, 128]
    - [84, 2363.56]
  - - [5888, 2368, 1, 128]
    - [87, 3651.73]
  - - [128, 5056, 1, 3328]
    - [91, 6243.54]
  - - [3584, 6784, 1, 1280]
    - [89, 9080.57]
  - - [448, 4, 1, 1280]
    - [116, 242.983]
  - - [1856, 5888, 1, 256]
    - [102, 8182.02]
  - - [256, 256, 1, 256]
    - [35, 1542.02]
  - - [256, 64, 1, 128]
    - [16, 135.126]
  - - [4288, 4288, 1, 3328]
    - [102, 8674.54]
  - - [4288, 1408, 1, 1280]
    - [90, 7867.08]
  - - [3584, 5056, 1, 128]
    - [80, 4457.73]
  - - [4, 1024, 1, 3328]
    - [29, 440.294]
  - - [4288, 2368, 1, 256]
    - [109, 5699.47]
  - - [2944, 5056, 1, 1280]
    - [102, 8236.46]
  - - [448, 6784, 1, 256]
    - [92, 6620.52]
  - - [64, 128, 1, 128]
    - [17, 67.5629]
  - - [1856, 2368, 1, 128]
    - [84, 4233.6]
  - - [6784, 2368, 1, 3328]
    - [102, 8269.8]
  - - [256, 1024, 1, 1280]
    - [91, 4882.78]
  - - [704, 4, 1, 128]
    - [110, 19.011]
  - - [256, 4, 1, 256]
    - [49, 46.8114]
  - - [4288, 128, 1, 256]
    - [97, 4273.39]
  - - [4288, 1856, 1, 3328]
    - [92, 8195.71]
  - - [3584, 448, 1, 128]
    - [85, 2750.55]
  - - [2048, 1600, 1, 2048]
    - [107, 5753.49]
  - - [256, 4, 1, 3328]
    - [117, 297.878]
  - - [4, 1408, 1, 1280]
    - [115, 402.286]
  - - [3584, 64, 1, 1280]
    - [105, 4096.0]
  - - [1408, 448, 1, 128]
    - [80, 2498.15]
  - - [3584, 1024, 1, 1280]
    - [102, 7252.08]
  - - [1856, 5056, 1, 256]
    - [96, 7711.49]
  - - [4, 3584, 1, 256]
    - [112, 314.214]
  - - [4, 2944, 1, 1280]
    - [49, 483.118]
  - - [1024, 4288, 1, 256]
    - [101, 6544.42]
  - - [5888, 3584, 1, 3328]
    - [90, 8105.05]
  - - [1856, 4, 1, 256]
    - [49, 252.732]
  - - [4, 256, 1, 256]
    - [34, 48.1882]
  - - [5056, 3584, 1, 3328]
    - [95, 7354.7]
  - - [704, 448, 1, 128]
    - [88, 1233.81]
  - - [2368, 1408, 1, 1280]
    - [96, 6654.14]
  - - [5056, 2944, 1, 1280]
    - [102, 8505.62]
  - - [3584, 256, 1, 256]
    - [94, 4616.37]
  - - [1024, 6784, 1, 256]
    - [96, 7944.88]
  - - [4, 128, 1, 256]
    - [49, 29.2571]
  - - [64, 64, 1, 1280]
    - [60, 642.51]
  - - [5124, 9124, 1, 2048]
    - [102, 8019.3]
  - - [6784, 4, 1, 128]
    - [110, 192.967]
  - - [2944, 1408, 1, 128]
    - [80, 3827.03]
  - - [448, 128, 1, 3328]
    - [53, 4063.9]
  - - [3584, 1408, 1, 1280]
    - [102, 7180.73]
  - - [64, 4288, 1, 3328]
    - [48, 4786.74]
  - - [5056, 6784, 1, 3328]
    - [89, 7889.73]
  - - [128, 2944, 1, 256]
    - [92, 3599.59]
  - - [128, 6784, 1, 128]
    - [10, 2606.69]
  - - [3584, 4288, 1, 256]
    - [96, 7299.71]
  - - [448, 1856, 1, 256]
    - [92, 5206.97]
  - - [1856, 6784, 1, 3328]
    - [94, 8386.26]
  - - [3584, 128, 1, 3328]
    - [38, 5589.94]
  - - [64, 1856, 1, 256]
    - [31, 1949.28]
  - - [64, 448, 1, 256]
    - [36, 955.733]
  - - [5888, 4288, 1, 256]
    - [100, 7791.74]
  - - [4, 448, 1, 128]
    - [110, 8.74146]
  - - [5056, 1408, 1, 256]
    - [102, 5153.91]
  - - [35, 8457, 1, 2048]
    - [7, 3182.47]
  - - [64, 256, 1, 1280]
    - [56, 1713.36]
  - - [3584, 1024, 1, 256]
    - [92, 6528.08]
  - - [256, 704, 1, 256]
    - [91, 2720.36]
  - - [5888, 5888, 1, 256]
    - [100, 7992.16]
  - - [4288, 1024, 1, 1280]
    - [94, 7837.4]
  - - [5888, 128, 1, 3328]
    - [97, 7181.03]
  - - [448, 6784, 1, 3328]
    - [91, 7663.0]
  - - [2944, 1408, 1, 1280]
    - [100, 7903.04]
  - - [64, 128, 1, 1280]
    - [49, 1191.56]
  - - [2944, 1856, 1, 3328]
    - [90, 7844.31]
  - - [2368, 64, 1, 128]
    - [21, 997.873]
  - - [256, 1024, 1, 128]
    - [80, 1215.74]
  - - [3584, 5888, 1, 1280]
    - [89, 8958.84]
  - - [64, 4, 1, 128]
    - [111, 1.11608]
  - - [6784, 1856, 1, 1280]
    - [89, 6728.7]
  - - [2944, 5056, 1, 256]
    - [102, 8275.11]
  - - [4288, 4, 1, 128]
    - [110, 147.544]
  - - [5888, 256, 1, 3328]
    - [98, 7094.1]
  - - [2944, 4288, 1, 128]
    - [83, 4611.45]
  - - [3584, 1408, 1, 256]
    - [93, 6542.96]
  - - [704, 3584, 1, 3328]
    - [92, 8117.1]
  - - [4096, 3200, 1, 1024]
    - [707, 10099.4]
  - - [5056, 448, 1, 1280]
    - [105, 6096.1]
  - - [3584, 1856, 1, 3328]
    - [90, 8552.31]
  - - [4288, 6784, 1, 1280]
    - [96, 8212.36]
  - - [2560, 7000, 1, 2560]
    - [98, 7655.24]
  - - [1408, 704, 1, 1280]
    - [94, 5756.69]
  - - [2944, 1024, 1, 256]
    - [102, 6880.81]
  - - [6784, 64, 1, 256]
    - [97, 4438.86]
  - - [2368, 4288, 1, 3328]
    - [98, 8377.89]
  - - [4, 1408, 1, 256]
    - [114, 222.499]
  - - [1024, 1408, 1, 1280]
    - [92, 6339.28]
  - - [64, 64, 1, 256]
    - [49, 187.246]
  - - [704, 256, 1, 3328]
    - [91, 4046.04]
  - - [6784, 5056, 1, 256]
    - [102, 7972.07]
  - - [1856, 1856, 1, 128]
    - [86, 3716.51]
  - - [3584, 5056, 1, 3328]
    - [102, 8684.66]
  - - [448, 6784, 1, 128]
    - [84, 3828.95]
  - - [4, 704, 1, 3328]
    - [116, 393.106]
  - - [35, 8457, 1, 4096]
    - [6, 3173.14]
  - - [448, 2944, 1, 256]
    - [100, 5553.31]
  - - [4, 4288, 1, 3328]
    - [59, 573.111]
  - - [2944, 6784, 1, 256]
    - [96, 8565.96]
  - - [2944, 2944, 1, 128]
    - [80, 4540.73]
  - - [4, 4, 1, 1280]
    - [59, 3.04762]
  - - [1856, 3584, 1, 1280]
    - [96, 7306.26]
  - - [64, 2944, 1, 256]
    - [107, 2292.51]
  - - [448, 256, 1, 128]
    - [17, 797.83]
  - - [4288, 448, 1, 128]
    - [83, 3430.4]
  - - [4608, 24000, 1, 1536]
    - [101, 6820.14]
  - - [1856, 1408, 1, 3328]
    - [104, 6600.14]
  - - [128, 128, 1, 128]
    - [9, 161.817]
  - - [1024, 4288, 1, 3328]
    - [92, 7936.98]
  - - [448, 2368, 1, 256]
    - [100, 4526.35]
  - - [1024, 4, 1, 128]
    - [111, 16.8907]
  - - [64, 1408, 1, 1280]
    - [32, 3345.22]
  - - [64, 6784, 1, 1280]
    - [97, 5526.5]
  - - [5056, 448, 1, 256]
    - [91, 4216.55]
  - - [2944, 2368, 1, 3328]
    - [102, 7000.32]
  - - [704, 4288, 1, 3328]
    - [107, 6414.33]
  - - [1408, 128, 1, 256]
    - [91, 2720.36]
  - - [1024, 1856, 1, 1280]
    - [102, 7682.83]
  - - [2048, 6400, 1, 2048]
    - [98, 7418.12]
  - - [512, 48000, 1, 2816]
    - [102, 8884.67]
  - - [5124, 9124, 1, 2560]
    - [94, 6040.7]
  - - [128, 2368, 1, 3328]
    - [48, 5025.56]
  - - [1024, 5888, 1, 256]
    - [96, 7322.11]
  - - [64, 2944, 1, 1280]
    - [32, 4222.21]
  - - [5056, 64, 1, 3328]
    - [73, 4936.22]
  - - [128, 704, 1, 128]
    - [18, 683.314]
  - - [1408, 2368, 1, 256]
    - [97, 6404.12]
  - - [1408, 1408, 1, 256]
    - [102, 4537.83]
  - - [4, 64, 1, 128]
    - [110, 2.46747]
  - - [64, 1024, 1, 128]
    - [10, 532.272]
  - - [1024, 8, 1, 500000]
    - [0, 1684.98]
  - - [2368, 2368, 1, 128]
    - [81, 4334.23]
  - - [64, 5888, 1, 128]
    - [10, 2003.09]
  - - [5888, 4, 1, 3328]
    - [28, 339.018]
  - - [6784, 1408, 1, 128]
    - [84, 4431.13]
  - - [4288, 5888, 1, 256]
    - [102, 7800.78]
  - - [1408, 5056, 1, 256]
    - [96, 8153.28]
  - - [5056, 128, 1, 3328]
    - [53, 5829.83]
  - - [128, 128, 1, 1280]
    - [56, 1691.25]
  - - [448, 704, 1, 256]
    - [97, 3364.18]
  - - [4288, 3584, 1, 128]
    - [81, 2952.58]
  - - [2944, 128, 1, 3328]
    - [53, 5620.72]
  - - [64, 1408, 1, 3328]
    - [54, 4169.81]
  - - [3584, 5056, 1, 1280]
    - [99, 7780.66]
  - - [256, 448, 1, 1280]
    - [32, 3929.35]
  - - [704, 704, 1, 128]
    - [80, 2346.07]
  - - [5056, 4, 1, 128]
    - [110, 144.457]
  - - [704, 256, 1, 1280]
    - [100, 2283.12]
  - - [64, 2368, 1, 3328]
    - [32, 4921.59]
  - - [1856, 1024, 1, 128]
    - [81, 3459.47]
  - - [1856, 64, 1, 128]
    - [13, 918.137]
  - - [4096, 64, 1, 4096]
    - [58, 4000.52]
  - - [1024, 24000, 1, 1536]
    - [94, 8502.26]
  - - [704, 4288, 1, 256]
    - [98, 6003.73]
  - - [5888, 2368, 1, 1280]
    - [89, 8801.2]
  - - [128, 256, 1, 256]
    - [43, 1069.98]
  - - [64, 128, 1, 256]
    - [49, 374.491]
  - - [2368, 5888, 1, 1280]
    - [92, 8308.53]
  - - [5888, 256, 1, 1280]
    - [100, 7154.32]
  - - [1760, 128, 1, 1760]
    - [41, 5363.81]
  - - [4, 5888, 1, 1280]
    - [49, 542.204]
  - - [704, 128, 1, 128]
    - [21, 779.347]
  - - [1024, 4, 1, 1280]
    - [49, 392.431]
  - - [2368, 1856, 1, 3328]
    - [92, 7975.22]
  - - [2368, 128, 1, 128]
    - [14, 1584.86]
  - - [2944, 704, 1, 256]
    - [100, 4039.11]
  - - [5056, 128, 1, 128]
    - [80, 2575.79]
  - - [2368, 1024, 1, 3328]
    - [107, 6165.44]
  - - [256, 704, 1, 3328]
    - [91, 4028.64]
  - - [704, 3584, 1, 256]
    - [102, 6102.82]
  - - [704, 2944, 1, 3328]
    - [92, 8202.74]
  - - [6784, 1024, 1, 128]
    - [84, 4386.3]
  - - [256, 448, 1, 128]
    - [21, 834.095]
  - - [448, 1024, 1, 3328]
    - [108, 5412.38]
  - - [2944, 1024, 1, 3328]
    - [102, 6265.77]
  - - [2944, 5056, 1, 128]
    - [80, 4770.78]
  - - [2368, 256, 1, 256]
    - [97, 3975.13]
  - - [1408, 6784, 1, 256]
    - [96, 7986.92]
  - - [6784, 1408, 1, 3328]
    - [96, 8472.61]
  - - [4288, 6784, 1, 128]
    - [87, 3865.1]
  - - [704, 64, 1, 256]
    - [35, 1287.31]
  - - [5888, 4, 1, 1280]
    - [34, 509.922]
  - - [256, 2368, 1, 3328]
    - [97, 5837.55]
  - - [6784, 2944, 1, 1280]
    - [102, 8560.44]
  - - [4288, 1856, 1, 128]
    - [80, 4616.97]
  - - [1856, 2944, 1, 128]
    - [80, 4287.63]
  - - [6784, 448, 1, 128]
    - [84, 3893.33]
  - - [64, 3584, 1, 128]
    - [10, 1609.66]
  - - [448, 5056, 1, 1280]
    - [100, 7124.31]
  - - [2368, 1856, 1, 128]
    - [83, 4004.55]
  - - [64, 2944, 1, 3328]
    - [33, 5086.38]
  - - [4288, 704, 1, 256]
    - [98, 6176.47]
  - - [256, 3584, 1, 128]
    - [81, 2553.05]
  - - [5888, 704, 1, 256]
    - [97, 6781.41]
  - - [3584, 1024, 1, 128]
    - [84, 3660.85]
  - - [256, 5888, 1, 3328]
    - [100, 7772.03]
  - - [1408, 4288, 1, 3328]
    - [96, 8832.76]
  - - [6784, 4288, 1, 256]
    - [102, 8566.04]
  - - [4288, 256, 1, 128]
    - [82, 1953.69]
  - - [5888, 256, 1, 256]
    - [100, 3730.43]
  - - [6784, 1024, 1, 1280]
    - [96, 8578.29]
  - - [5888, 1024, 1, 128]
    - [81, 4092.86]
  - - [1024, 128, 1, 256]
    - [31, 1897.88]
  - - [512, 16, 1, 500000]
    - [2, 2363.69]
  - - [128, 64, 1, 3328]
    - [59, 1592.46]
  - - [448, 64, 1, 256]
    - [49, 976.068]
  - - [2368, 256, 1, 128]
    - [84, 2094.89]
  - - [6784, 3584, 1, 1280]
    - [96, 8570.06]
  - - [1024, 6784, 1, 1280]
    - [102, 8203.47]
  - - [2944, 64, 1, 1280]
    - [40, 4300.51]
  - - [1408, 2944, 1, 1280]
    - [92, 7349.54]
  - - [256, 1856, 1, 256]
    - [91, 4649.65]
  - - [2048, 800, 1, 2048]
    - [109, 4668.63]
  - - [1408, 2368, 1, 3328]
    - [100, 7537.64]
  - - [2944, 4, 1, 3328]
    - [49, 514.042]
  - - [128, 1408, 1, 3328]
    - [41, 4991.54]
  - - [2944, 1856, 1, 128]
    - [80, 4317.29]
  - - [256, 2944, 1, 128]
    - [80, 2258.17]
  - - [256, 6784, 1, 128]
    - [80, 3146.92]
  - - [2368, 4, 1, 128]
    - [111, 33.8286]
  - - [1408, 256, 1, 3328]
    - [91, 5077.75]
  - - [1856, 4, 1, 128]
    - [111, 21.4025]
  - - [5056, 6784, 1, 128]
    - [80, 4945.01]
  - - [4288, 5056, 1, 128]
    - [83, 4729.77]
  - - [1856, 5888, 1, 128]
    - [80, 4707.86]
  - - [2944, 5888, 1, 256]
    - [94, 8014.68]
  - - [3584, 1856, 1, 256]
    - [96, 7567.03]
  - - [4288, 3584, 1, 1280]
    - [89, 8726.33]
  - - [2368, 448, 1, 256]
    - [97, 4227.6]
  - - [4288, 256, 1, 3328]
    - [98, 5487.31]
  - - [1856, 704, 1, 128]
    - [84, 3124.96]
  - - [1408, 64, 1, 256]
    - [44, 1619.99]
  - - [64, 1856, 1, 128]
    - [8, 955.047]
  - - [4, 256, 1, 128]
    - [110, 10.7789]
  - - [2560, 16, 1, 2560]
    - [56, 2019.6]
  - - [704, 5888, 1, 128]
    - [85, 3976.16]
  - - [6784, 3584, 1, 128]
    - [84, 4018.81]
  - - [1024, 64, 1, 256]
    - [49, 1370.69]
  - - [64, 2368, 1, 256]
    - [91, 2255.66]
  - - [4288, 5056, 1, 3328]
    - [96, 8368.59]
  - - [4, 1856, 1, 1280]
    - [49, 392.026]
  - - [4288, 128, 1, 128]
    - [14, 2286.93]
  - - [1408, 1408, 1, 128]
    - [84, 3233.38]
  - - [7680, 16, 1, 2560]
    - [52, 2257.27]
  - - [1856, 128, 1, 128]
    - [14, 1532.7]
  - - [5056, 2368, 1, 256]
    - [96, 8167.19]
  - - [4288, 704, 1, 3328]
    - [102, 6411.06]
  - - [448, 3584, 1, 256]
    - [102, 5477.64]
  - - [2368, 64, 1, 1280]
    - [32, 3936.42]
  - - [2368, 1024, 1, 1280]
    - [98, 7688.72]
  - - [2944, 1408, 1, 3328]
    - [89, 7668.68]
  - - [1408, 448, 1, 256]
    - [91, 4863.88]
  - - [1024, 1408, 1, 3328]
    - [100, 7448.89]
  - - [2944, 5888, 1, 1280]
    - [90, 8208.47]
  - - [1408, 4, 1, 1280]
    - [29, 479.319]
  - - [5888, 3584, 1, 256]
    - [90, 8609.99]
  - - [2368, 5056, 1, 128]
    - [87, 3726.15]
  - - [1408, 1856, 1, 3328]
    - [91, 7829.38]
  - - [4, 4, 1, 3328]
    - [117, 4.29419]
  - - [6784, 1408, 1, 1280]
    - [91, 7690.7]
  - - [4096, 7000, 1, 4096]
    - [103, 6272.39]
  - - [704, 2944, 1, 256]
    - [92, 6095.81]
  - - [4288, 64, 1, 256]
    - [57, 2121.21]
  - - [6784, 5888, 1, 3328]
    - [96, 8955.5]
  - - [2368, 4288, 1, 128]
    - [80, 4699.55]
  - - [64, 4288, 1, 1280]
    - [70, 4013.63]
  - - [6784, 64, 1, 1280]
    - [91, 5418.73]
  - - [3584, 128, 1, 128]
    - [20, 2165.2]
  - - [1024, 6784, 1, 128]
    - [81, 3765.2]
  - - [4, 1856, 1, 128]
    - [111, 33.2728]
  - - [1408, 64, 1, 3328]
    - [53, 4489.41]
  - - [6784, 4, 1, 256]
    - [49, 400.162]
  - - [1408, 1408, 1, 1280]
    - [96, 8139.43]
  - - [16384, 400, 1, 4096]
    - [100, 6087.18]
  - - [256, 2368, 1, 256]
    - [91, 4766.25]
  - - [448, 4288, 1, 3328]
    - [98, 7576.98]
  - - [2368, 1408, 1, 256]
    - [94, 5284.43]
  - - [5888, 5056, 1, 128]
    - [81, 3643.5]
  - - [704, 2368, 1, 256]
    - [96, 5334.63]
  - - [1024, 24000, 1, 2560]
    - [104, 7437.96]
  - - [2944, 448, 1, 1280]
    - [105, 4937.43]
  - - [5888, 2368, 1, 3328]
    - [90, 8201.74]
  - - [5124, 9124, 1, 1760]
    - [97, 6763.96]
  - - [448, 1408, 1, 1280]
    - [91, 5881.44]
  - - [448, 1856, 1, 1280]
    - [98, 6225.46]
  - - [4288, 448, 1, 1280]
    - [100, 5626.27]
  - - [5888, 704, 1, 3328]
    - [94, 7873.52]
  - - [5056, 256, 1, 128]
    - [85, 2920.93]
  - - [1856, 256, 1, 128]
    - [87, 1995.32]
  - - [64, 1408, 1, 128]
    - [8, 758.838]
  - - [704, 4, 1, 256]
    - [49, 130.597]
  - - [1408, 5888, 1, 128]
    - [80, 4573.95]
  - - [7680, 12000, 1, 2560]
    - [96, 8747.03]
  - - [1408, 1024, 1, 256]
    - [93, 4609.13]
  - - [8192, 400, 1, 2048]
    - [105, 5283.15]
  - - [1024, 1856, 1, 128]
    - [80, 2686.28]
  - - [256, 704, 1, 128]
    - [80, 1004.73]
  - - [2560, 128, 1, 2560]
    - [58, 4259.04]
  - - [448, 1024, 1, 256]
    - [91, 4813.14]
  - - [128, 4, 1, 3328]
    - [116, 128.308]
  - - [5056, 6784, 1, 1280]
    - [99, 6579.75]
  - - [1408, 64, 1, 128]
    - [21, 819.2]
  - - [1024, 448, 1, 1280]
    - [100, 5703.21]
  - - [704, 5056, 1, 3328]
    - [92, 7574.39]
  - - [128, 5056, 1, 256]
    - [91, 5113.43]
  - - [64, 1024, 1, 3328]
    - [76, 3980.0]
  - - [1856, 4, 1, 3328]
    - [30, 433.153]
  - - [4, 2944, 1, 128]
    - [111, 46.5225]
  - - [2368, 2944, 1, 3328]
    - [90, 9002.03]
  - - [448, 448, 1, 1280]
    - [32, 3969.42]
  - - [2368, 3584, 1, 256]
    - [102, 7806.29]
  - - [5056, 3584, 1, 1280]
    - [89, 8971.46]
  - - [5124, 9124, 1, 4096]
    - [102, 7208.62]
  - - [7680, 48000, 1, 2560]
    - [96, 3835.81]
  - - [448, 4, 1, 3328]
    - [116, 409.6]
  - - [1856, 2944, 1, 1280]
    - [89, 7173.61]
  - - [1024, 48000, 1, 2816]
    - [96, 8976.16]
  - - [128, 1024, 1, 256]
    - [35, 1969.16]
  - - [2944, 1408, 1, 256]
    - [98, 4585.02]
  - - [4288, 1408, 1, 3328]
    - [92, 8237.17]
  - - [3584, 64, 1, 3328]
    - [38, 5183.06]
  - - [5888, 2944, 1, 128]
    - [87, 3674.46]
  - - [2944, 1024, 1, 128]
    - [84, 3834.22]
  - - [4288, 5056, 1, 1280]
    - [96, 8086.0]
  - - [5888, 6784, 1, 1280]
    - [90, 6941.22]
  - - [6784, 5056, 1, 128]
    - [81, 4860.05]
  - - [256, 1024, 1, 3328]
    - [105, 5156.12]
  - - [3584, 4, 1, 256]
    - [49, 332.429]
  - - [1760, 1600, 1, 1760]
    - [92, 6330.66]
  - - [1856, 64, 1, 3328]
    - [53, 4755.93]
  - - [4, 128, 1, 3328]
    - [116, 160.144]
  - - [5888, 1408, 1, 3328]
    - [90, 8722.64]
  - - [448, 2944, 1, 128]
    - [83, 2997.53]
  - - [2368, 1856, 1, 256]
    - [91, 6662.24]
  - - [256, 5056, 1, 256]
    - [93, 5256.19]
  - - [128, 3584, 1, 128]
    - [12, 2073.46]
  - - [448, 3584, 1, 3328]
    - [89, 6833.86]
  - - [4, 5056, 1, 3328]
    - [59, 581.423]
  - - [704, 2368, 1, 128]
    - [80, 3402.19]
  - - [5888, 256, 1, 128]
    - [85, 2977.44]
  - - [4, 5056, 1, 128]
    - [110, 65.1074]
  - - [448, 256, 1, 256]
    - [97, 1764.43]
  - - [704, 4, 1, 3328]
    - [49, 398.454]
  - - [1408, 256, 1, 256]
    - [92, 3463.76]
  - - [3584, 1856, 1, 128]
    - [88, 3228.09]
  - - [4288, 4288, 1, 128]
    - [84, 4853.83]
  - - [1856, 1024, 1, 3328]
    - [107, 5994.58]
  - - [128, 5888, 1, 3328]
    - [62, 6512.75]
  - - [1024, 5056, 1, 256]
    - [102, 7859.32]
  - - [5888, 5888, 1, 1280]
    - [102, 8131.34]
  - - [5056, 5888, 1, 128]
    - [81, 4920.61]
  - - [2368, 1408, 1, 3328]
    - [100, 7110.64]
  - - [1024, 48000, 1, 1536]
    - [100, 8590.72]
  - - [5888, 448, 1, 256]
    - [101, 3567.64]
  - - [2560, 3200, 1, 2560]
    - [91, 7638.21]
  - - [5888, 6784, 1, 128]
    - [81, 3910.82]
  - - [6144, 48000, 1, 2048]
    - [102, 3412.85]
  - - [6784, 5056, 1, 1280]
    - [93, 7890.12]
  - - [5056, 704, 1, 1280]
    - [97, 7664.96]
  - - [1024, 48000, 1, 2560]
    - [102, 8188.4]
  - - [4608, 32, 1, 1536]
    - [70, 2856.87]
  - - [1024, 2368, 1, 128]
    - [80, 3019.25]
  - - [128, 704, 1, 256]
    - [31, 1696.23]
  - - [2368, 448, 1, 3328]
    - [97, 5799.19]
  - - [128, 5888, 1, 1280]
    - [91, 6680.65]
  - - [16384, 800, 1, 4096]
    - [96, 6322.12]
  - - [448, 128, 1, 1280]
    - [70, 2849.39]
  - - [6784, 4, 1, 3328]
    - [49, 563.02]
  - - [5888, 5056, 1, 1280]
    - [96, 8631.23]
  - - [1024, 64, 1, 3328]
    - [71, 3481.86]
  - - [3072, 48000, 1, 1024]
    - [96, 9019.39]
  - - [64, 3584, 1, 1280]
    - [33, 4327.85]
  - - [6784, 1408, 1, 256]
    - [96, 6320.49]
  - - [3584, 5888, 1, 128]
    - [83, 4406.69]
  - - [5056, 5888, 1, 256]
    - [102, 8037.03]
  - - [2368, 1024, 1, 256]
    - [94, 4936.04]
  - - [2944, 1856, 1, 256]
    - [102, 7222.22]
  - - [1856, 6784, 1, 1280]
    - [92, 8251.71]
  - - [64, 5056, 1, 128]
    - [12, 1643.6]
  - - [64, 6784, 1, 128]
    - [10, 1929.67]
  - - [448, 704, 1, 128]
    - [82, 979.859]
  - - [4, 1024, 1, 128]
    - [110, 20.0416]
  - - [4288, 3584, 1, 256]
    - [96, 8444.04]
  - - [1408, 704, 1, 128]
    - [80, 3020.9]
  - - [64, 256, 1, 3328]
    - [76, 2227.37]
  - - [6784, 448, 1, 3328]
    - [102, 6573.01]
  - - [5056, 1856, 1, 1280]
    - [94, 7976.13]
  - - [1408, 1024, 1, 3328]
    - [92, 7470.23]
  - - [2368, 256, 1, 3328]
    - [97, 5394.27]
  - - [5888, 3584, 1, 1280]
    - [89, 9031.45]
  - - [1856, 3584, 1, 3328]
    - [104, 7272.5]
  - - [5888, 128, 1, 1280]
    - [97, 6684.38]
  - - [1024, 2944, 1, 256]
    - [102, 7414.99]
  - - [448, 6784, 1, 1280]
    - [98, 7923.68]
  - - [256, 3584, 1, 1280]
    - [94, 6901.77]
  - - [704, 5056, 1, 256]
    - [99, 5004.45]
  - - [3584, 1024, 1, 3328]
    - [91, 7894.53]
  - - [2944, 1856, 1, 1280]
    - [96, 7903.17]
  - - [128, 256, 1, 128]
    - [9, 325.645]
  - - [5056, 256, 1, 256]
    - [93, 3356.46]
  - - [2944, 4288, 1, 3328]
    - [102, 7813.83]
  - - [2368, 3584, 1, 3328]
    - [102, 8370.99]
  - - [2944, 704, 1, 1280]
    - [107, 5513.99]
  - - [128, 4, 1, 256]
    - [49, 25.2062]
  - - [2944, 3584, 1, 1280]
    - [96, 7738.73]
  - - [1856, 5888, 1, 1280]
    - [90, 8584.53]
  - - [256, 256, 1, 1280]
    - [70, 2962.08]
  - - [2048, 3200, 1, 2048]
    - [98, 6911.59]
  - - [4288, 1408, 1, 256]
    - [96, 7953.9]
  - - [3584, 64, 1, 256]
    - [97, 2780.32]
  - - [64, 1856, 1, 3328]
    - [32, 4911.94]
  - - [256, 1408, 1, 128]
    - [80, 1373.14]
  - - [5888, 1408, 1, 128]
    - [85, 4241.91]
  - - [4288, 2368, 1, 1280]
    - [94, 8012.6]
  - - [4, 4288, 1, 256]
    - [114, 301.574]
  - - [256, 4288, 1, 128]
    - [80, 2706.26]
  - - [2048, 128, 1, 2048]
    - [75, 2885.16]
  - - [256, 128, 1, 3328]
    - [77, 3170.11]
  - - [512, 8, 1, 500000]
    - [1, 1915.02]
  - - [6784, 2368, 1, 256]
    - [96, 8323.56]
  - - [5888, 128, 1, 128]
    - [84, 2465.98]
  - - [1024, 24000, 1, 2816]
    - [94, 8131.54]
  - - [7680, 5984, 1, 2560]
    - [98, 6040.67]
  - - [4288, 1856, 1, 256]
    - [109, 5818.43]
  - - [1856, 256, 1, 3328]
    - [91, 6531.93]
  - - [1856, 2944, 1, 256]
    - [96, 7312.82]
  - - [5056, 1024, 1, 128]
    - [86, 4102.9]
  - - [64, 5888, 1, 1280]
    - [91, 5058.15]
  - - [1760, 800, 1, 1760]
    - [94, 7279.9]
  - - [6784, 256, 1, 128]
    - [84, 3257.59]
  - - [5888, 704, 1, 128]
    - [80, 3813.83]
  - - [1408, 2368, 1, 128]
    - [81, 3561.17]
  - - [1024, 4288, 1, 1280]
    - [100, 7752.64]
  - - [2368, 5056, 1, 3328]
    - [103, 7711.81]
  - - [448, 4, 1, 128]
    - [110, 18.3795]
  - - [4, 256, 1, 3328]
    - [117, 269.61]
  - - [4288, 1024, 1, 3328]
    - [97, 7910.17]
  - - [6144, 48000, 1, 2560]
    - [96, 3540.99]
  - - [1024, 5056, 1, 3328]
    - [90, 8509.56]
  - - [1024, 1856, 1, 3328]
    - [96, 7907.83]
  - - [704, 704, 1, 1280]
    - [107, 5648.05]
  - - [128, 2368, 1, 1280]
    - [67, 4145.01]
  - - [1408, 128, 1, 3328]
    - [40, 4919.5]
  - - [3584, 256, 1, 1280]
    - [92, 5185.46]
  - - [4, 128, 1, 128]
    - [110, 2.97891]
  - - [5888, 64, 1, 1280]
    - [40, 4499.49]
  - - [3584, 128, 1, 1280]
    - [97, 5928.91]
  - - [4, 256, 1, 1280]
    - [115, 170.667]
  - - [128, 704, 1, 3328]
    - [40, 4379.27]
  - - [4288, 6784, 1, 256]
    - [90, 7180.99]
  - - [3584, 2944, 1, 3328]
    - [96, 8553.2]
  - - [128, 1856, 1, 256]
    - [97, 3207.67]
  - - [64, 4288, 1, 256]
    - [91, 2907.89]
  - - [4, 3584, 1, 3328]
    - [49, 560.505]
  - - [64, 4, 1, 3328]
    - [117, 67.4025]
  - - [4, 64, 1, 3328]
    - [117, 88.7467]
  - - [5888, 2944, 1, 256]
    - [96, 7255.67]
  - - [1856, 64, 1, 256]
    - [42, 1743.62]
  - - [5056, 128, 1, 1280]
    - [97, 6009.69]
  - - [448, 4288, 1, 1280]
    - [98, 6466.72]
  - - [448, 1856, 1, 3328]
    - [98, 6381.89]
  - - [1024, 4288, 1, 128]
    - [83, 3491.77]
  - - [4, 1024, 1, 256]
    - [115, 172.463]
  - - [5056, 4288, 1, 256]
    - [96, 8241.42]
  - - [1024, 448, 1, 256]
    - [100, 4218.41]
  - - [1024, 3584, 1, 256]
    - [96, 6513.59]
  - - [2944, 128, 1, 1280]
    - [40, 4710.38]
  - - [2048, 32, 1, 2048]
    - [55, 1779.13]
  - - [64, 256, 1, 256]
    - [49, 655.36]
  - - [1408, 4, 1, 128]
    - [111, 20.0249]
  - - [128, 2368, 1, 128]
    - [12, 1707.63]
  - - [256, 704, 1, 1280]
    - [91, 3735.21]
  - - [64, 2368, 1, 128]
    - [19, 1049.71]
  - - [6784, 6784, 1, 3328]
    - [96, 9277.84]
  - - [448, 5888, 1, 1280]
    - [102, 7319.65]
  - - [5056, 448, 1, 128]
    - [84, 3694.33]
  - - [4288, 704, 1, 1280]
    - [94, 7890.86]
  - - [3584, 2944, 1, 128]
    - [86, 4124.61]
  - - [6784, 256, 1, 1280]
    - [102, 7185.73]
  - - [256, 2944, 1, 1280]
    - [91, 6736.66]
  - - [64, 4288, 1, 128]
    - [10, 1614.31]
  - - [2368, 5888, 1, 3328]
    - [92, 8616.36]
  - - [4, 64, 1, 256]
    - [29, 11.3778]
  - - [704, 1024, 1, 3328]
    - [97, 6801.82]
  - - [2368, 1856, 1, 1280]
    - [94, 7853.47]
  - - [448, 5056, 1, 3328]
    - [97, 7452.94]
  - - [128, 448, 1, 128]
    - [12, 530.349]
  - - [128, 6784, 1, 256]
    - [92, 5557.45]
  - - [3584, 4288, 1, 128]
    - [83, 4462.63]
  - - [64, 448, 1, 128]
    - [12, 278.032]
  - - [5888, 4288, 1, 3328]
    - [89, 9153.45]
  - - [2368, 704, 1, 256]
    - [96, 5350.68]
  - - [256, 1856, 1, 3328]
    - [91, 6536.25]
  - - [1856, 128, 1, 256]
    - [105, 2847.26]
  - - [6784, 128, 1, 128]
    - [85, 2530.72]
  - - [3584, 1408, 1, 128]
    - [86, 3625.52]
  - - [1856, 5056, 1, 1280]
    - [92, 8123.29]
  - - [2944, 1024, 1, 1280]
    - [102, 8450.31]
  - - [5056, 4, 1, 256]
    - [115, 380.687]
  - - [3584, 5888, 1, 3328]
    - [94, 8567.89]
  - - [2368, 4288, 1, 256]
    - [98, 7857.97]
  - - [1024, 2368, 1, 3328]
    - [92, 6776.35]
  - - [64, 704, 1, 3328]
    - [47, 3503.42]
  - - [704, 1408, 1, 256]
    - [92, 6099.89]
  - - [4096, 128, 1, 4096]
    - [72, 4116.47]
  - - [1024, 3584, 1, 1280]
    - [102, 7231.55]
  - - [4288, 5888, 1, 3328]
    - [96, 8762.32]
  - - [4288, 4, 1, 1280]
    - [49, 492.697]
  - - [4608, 16, 1, 1536]
    - [50, 1892.48]
  - - [5888, 64, 1, 128]
    - [27, 1747.63]
  - - [4, 5888, 1, 128]
    - [111, 84.4915]
  - - [1024, 2944, 1, 3328]
    - [100, 6906.95]
  - - [6784, 1856, 1, 256]
    - [96, 6273.97]
  - - [2048, 64, 1, 2048]
    - [79, 2371.34]
  - - [256, 6784, 1, 1280]
    - [96, 7066.94]
  - - [1856, 3584, 1, 256]
    - [102, 7706.77]
  - - [128, 448, 1, 3328]
    - [47, 3995.83]
  - - [6784, 1856, 1, 128]
    - [84, 4458.99]
  - - [4, 448, 1, 256]
    - [49, 84.3294]
  - - [5056, 128, 1, 256]
    - [97, 4954.4]
  - - [512, 24000, 1, 2816]
    - [90, 8994.88]
  - - [256, 5888, 1, 1280]
    - [89, 6183.9]
  - - [4, 128, 1, 1280]
    - [116, 71.8597]
  - - [16384, 1600, 1, 4096]
    - [96, 6920.99]
  - - [6784, 128, 1, 1280]
    - [100, 6486.27]
  - - [64, 1408, 1, 256]
    - [37, 1647.76]
  - - [2368, 1408, 1, 128]
    - [84, 3937.0]
  - - [1856, 448, 1, 256]
    - [97, 4635.47]
  - - [1408, 1024, 1, 128]
    - [80, 3208.41]
  - - [128, 64, 1, 128]
    - [9, 70.092]
  - - [6784, 3584, 1, 3328]
    - [102, 8466.18]
  - - [1760, 7000, 1, 1760]
    - [100, 8149.11]
  - - [2944, 64, 1, 3328]
    - [33, 5017.99]
  - - [64, 64, 1, 128]
    - [9, 35.4249]
  - - [2368, 5056, 1, 1280]
    - [96, 8763.9]
  - - [64, 4, 1, 1280]
    - [117, 43.5745]
  - - [1408, 2368, 1, 1280]
    - [97, 7660.28]
  - - [128, 1408, 1, 1280]
    - [32, 4185.17]
  - - [256, 64, 1, 3328]
    - [57, 2071.65]
  - - [704, 4288, 1, 128]
    - [80, 4069.08]
  - - [128, 1856, 1, 3328]
    - [63, 5776.05]
  - - [2944, 2944, 1, 256]
    - [102, 7949.21]
  - - [2944, 4, 1, 1280]
    - [49, 483.118]
  - - [5888, 4, 1, 256]
    - [34, 396.665]
  - - [6784, 256, 1, 256]
    - [107, 4044.73]
  - - [256, 5056, 1, 3328]
    - [91, 7607.27]
  - - [128, 4288, 1, 1280]
    - [32, 4958.68]
  - - [5056, 1856, 1, 128]
    - [84, 4560.84]
  - - [5056, 1024, 1, 3328]
    - [96, 8634.08]
  - - [128, 128, 1, 256]
    - [34, 699.051]
  - - [1760, 64, 1, 1760]
    - [40, 4580.55]
  - - [4288, 3584, 1, 3328]
    - [102, 9143.66]
  - - [448, 704, 1, 3328]
    - [91, 4473.33]
  - - [448, 448, 1, 128]
    - [22, 1264.28]
  - - [1024, 2368, 1, 1280]
    - [100, 7452.41]
  - - [1856, 704, 1, 3328]
    - [91, 6103.24]
  - - [4, 2368, 1, 128]
    - [110, 95.919]
  - - [5888, 6784, 1, 3328]
    - [96, 9131.64]
  - - [704, 4288, 1, 1280]
    - [98, 7906.36]
  - - [704, 256, 1, 256]
    - [91, 2772.68]
  - - [1024, 48000, 1, 2048]
    - [95, 6513.35]
  - - [4288, 1024, 1, 128]
    - [80, 4291.67]
  - - [256, 64, 1, 3136]
    - [118, 3015.27]
  - - [256, 1024, 1, 196]
    - [119, 4225.35]
  - - [1024, 1024, 1, 3328]
    - [229, 8705.0]
  - - [2048, 200, 1, 3200]
    - [234, 6173.32]
  - - [1024, 200, 1, 13312]
    - [132, 5213.21]
  - - [1024, 256, 1, 1536]
    - [234, 5859.33]
  - - [4096, 256, 1, 12288]
    - [239, 8807.42]
  - - [64, 200, 1, 1024]
    - [206, 366.532]
  - - [32, 512, 1, 1024]
    - [161, 452.949]
  - - [2048, 256, 1, 3328]
    - [223, 7876.63]
  - - [4096, 512, 1, 32]
    - [227, 3975.64]
  - - [2048, 256, 1, 13312]
    - [204, 7837.71]
  - - [4096, 200, 1, 11264]
    - [239, 6902.66]
  - - [2048, 512, 1, 1024]
    - [233, 8100.04]
  - - [2048, 1024, 1, 1664]
    - [133, 9081.98]
  - - [1024, 1024, 1, 64]
    - [229, 4258.18]
  - - [512, 1024, 1, 1536]
    - [223, 7597.23]
  - - [1024, 256, 1, 15360]
    - [124, 6735.14]
  - - [1, 512, 1, 1024]
    - [174, 15.0657]
  - - [4096, 512, 1, 1408]
    - [136, 9024.42]
  - - [1024, 200, 1, 1408]
    - [234, 4460.99]
  - - [1024, 512, 1, 512]
    - [228, 6528.1]
  - - [4096, 256, 1, 15360]
    - [235, 8823.93]
  - - [2048, 512, 1, 640]
    - [225, 7989.15]
  - - [4096, 1024, 1, 1280]
    - [131, 9421.44]
  - - [1024, 200, 1, 6144]
    - [223, 4966.42]
  - - [1024, 1024, 1, 512]
    - [225, 7731.44]
  - - [128, 512, 1, 2048]
    - [141, 2190.24]
  - - [2048, 1024, 1, 640]
    - [131, 8581.7]
  - - [1024, 256, 1, 3328]
    - [223, 6192.61]
  - - [4096, 1024, 1, 13312]
    - [136, 9642.49]
  - - [2048, 256, 1, 2048]
    - [223, 7485.65]
  - - [2048, 1024, 1, 13312]
    - [136, 9352.16]
  - - [2048, 512, 1, 16640]
    - [224, 8839.07]
  - - [1024, 512, 1, 128]
    - [228, 4279.9]
  - - [2048, 1024, 1, 3584]
    - [131, 9264.62]
  - - [2048, 512, 1, 256]
    - [239, 6990.51]
  - - [512, 256, 1, 3200]
    - [186, 4154.42]
  - - [4096, 1024, 1, 1920]
    - [131, 9535.22]
  - - [4096, 200, 1, 2560]
    - [236, 6754.55]
  - - [1024, 256, 1, 16384]
    - [126, 6289.5]
  - - [1024, 1024, 1, 1152]
    - [229, 8407.29]
  - - [2048, 200, 1, 32]
    - [172, 1412.41]
  - - [512, 1024, 1, 2816]
    - [223, 7843.15]
  - - [4096, 256, 1, 14336]
    - [235, 8844.67]
  - - [1024, 200, 1, 4608]
    - [234, 4931.64]
  - - [1024, 200, 1, 16384]
    - [129, 5135.05]
  - - [64, 256, 1, 1024]
    - [207, 460.913]
  - - [1, 200, 1, 1024]
    - [189, 7.39884]
  - - [2048, 200, 1, 2080]
    - [234, 6033.77]
  - - [512, 256, 1, 1792]
    - [144, 3153.61]
  - - [2048, 200, 1, 1024]
    - [234, 5711.2]
  - - [4096, 1024, 1, 12288]
    - [131, 9658.13]
  - - [4096, 200, 1, 4096]
    - [225, 6834.45]
  - - [1024, 512, 1, 11264]
    - [192, 7686.36]
  - - [128, 512, 1, 1024]
    - [162, 1458.89]
  - - [32, 256, 1, 2048]
    - [180, 384.799]
  - - [1024, 200, 1, 1792]
    - [234, 4638.54]
  - - [1024, 1024, 1, 1792]
    - [229, 8550.46]
  - - [32, 256, 1, 512]
    - [213, 161.319]
  - - [512, 200, 1, 2816]
    - [139, 3353.0]
  - - [512, 200, 1, 3072]
    - [124, 3298.79]
  - - [1024, 1024, 1, 8192]
    - [170, 8369.0]
  - - [1024, 256, 1, 12288]
    - [127, 6475.61]
  - - [4096, 200, 1, 768]
    - [229, 6367.87]
  - - [1024, 512, 1, 16384]
    - [245, 7367.02]
  - - [4096, 256, 1, 1024]
    - [720, 6932.73]
  - - [1024, 512, 1, 256]
    - [228, 5537.03]
  - - [4096, 1024, 1, 8320]
    - [131, 9674.16]
  - - [4096, 256, 1, 9216]
    - [233, 8790.92]
  - - [1024, 512, 1, 1408]
    - [223, 7459.55]
  - - [1024, 512, 1, 5632]
    - [234, 7997.81]
  - - [4096, 200, 1, 256]
    - [239, 5371.8]
  - - [1024, 200, 1, 128]
    - [217, 1998.05]
  - - [256, 200, 1, 1024]
    - [186, 1195.91]
  - - [1024, 200, 1, 5120]
    - [234, 4957.34]
  - - [512, 1024, 1, 3072]
    - [247, 7103.97]
  - - [4096, 1024, 1, 15360]
    - [131, 9668.94]
  - - [1, 256, 1, 2048]
    - [173, 13.8262]
  - - [1024, 1024, 1, 4160]
    - [225, 8759.2]
  - - [1024, 256, 1, 256]
    - [232, 3728.27]
  - - [2048, 256, 1, 384]
    - [234, 6123.07]
  - - [512, 256, 1, 2560]
    - [188, 3809.54]
  - - [4096, 512, 1, 3072]
    - [136, 9215.09]
  - - [1024, 256, 1, 4160]
    - [223, 6293.39]
  - - [4096, 512, 1, 13312]
    - [133, 9367.22]
  - - [4096, 1024, 1, 3840]
    - [131, 9631.47]
  - - [4096, 200, 1, 640]
    - [229, 6206.06]
  - - [32, 200, 1, 2048]
    - [167, 303.407]
  - - [1024, 200, 1, 512]
    - [223, 3713.09]
  - - [1024, 1024, 1, 7168]
    - [226, 8475.64]
  - - [2048, 1024, 1, 3200]
    - [131, 9271.24]
  - - [512, 512, 1, 1536]
    - [234, 5832.17]
  - - [4096, 256, 1, 768]
    - [239, 8065.97]
  - - [2048, 256, 1, 6656]
    - [223, 8034.77]
  - - [1024, 256, 1, 896]
    - [223, 5467.44]
  - - [2048, 256, 1, 512]
    - [234, 6465.21]
  - - [2048, 200, 1, 3072]
    - [234, 6165.68]
  - - [128, 200, 1, 1024]
    - [191, 692.77]
  - - [4096, 512, 1, 3840]
    - [136, 9272.6]
  - - [1024, 200, 1, 3200]
    - [234, 4838.75]
  - - [4096, 512, 1, 5632]
    - [131, 9335.42]
  - - [4096, 512, 1, 64]
    - [166, 5275.85]
  - - [1024, 512, 1, 2816]
    - [223, 7816.58]
  - - [4096, 256, 1, 7680]
    - [229, 8795.4]
  - - [4096, 200, 1, 1024]
    - [728, 7009.2]
  - - [1024, 512, 1, 12288]
    - [193, 7624.57]
  - - [2048, 1024, 1, 512]
    - [136, 8436.06]
  - - [128, 256, 1, 2048]
    - [210, 1342.18]
  - - [2048, 200, 1, 1792]
    - [234, 6020.37]
  - - [1024, 1024, 1, 2816]
    - [225, 8670.4]
  - - [2048, 512, 1, 1536]
    - [236, 8466.22]
  - - [4096, 256, 1, 3072]
    - [233, 8631.37]
  - - [1024, 200, 1, 1536]
    - [215, 4577.6]
  - - [1024, 256, 1, 1024]
    - [719, 5202.24]
  - - [4096, 512, 1, 8192]
    - [136, 9325.54]
  - - [128, 1024, 1, 512]
    - [234, 2534.32]
  - - [4096, 512, 1, 2304]
    - [131, 9192.99]
  - - [2048, 256, 1, 5632]
    - [234, 7999.54]
  - - [1024, 256, 1, 5120]
    - [234, 6307.22]
  - - [1024, 512, 1, 6656]
    - [234, 8028.85]
  - - [4096, 512, 1, 2816]
    - [131, 9234.4]
  - - [4096, 200, 1, 2080]
    - [218, 6697.86]
  - - [1024, 200, 1, 2304]
    - [234, 4752.81]
  - - [2048, 200, 1, 13312]
    - [223, 6346.13]
  - - [64, 1024, 1, 1024]
    - [207, 1359.58]
  - - [4096, 256, 1, 3584]
    - [229, 8668.8]
  - - [2048, 1024, 1, 7680]
    - [131, 9365.78]
  - - [1024, 256, 1, 1664]
    - [223, 5907.47]
  - - [1, 512, 1, 2048]
    - [150, 23.4057]
  - - [512, 512, 1, 1024]
    - [223, 5360.13]
  - - [2048, 256, 1, 8192]
    - [195, 7665.21]
  - - [2048, 512, 1, 512]
    - [225, 7767.23]
  - - [4096, 512, 1, 1920]
    - [131, 9132.94]
  - - [4096, 200, 1, 12288]
    - [239, 6910.65]
  - - [2048, 512, 1, 1152]
    - [229, 8342.26]
  - - [1024, 256, 1, 2080]
    - [223, 6010.36]
  - - [4096, 1024, 1, 32]
    - [219, 4793.49]
  - - [4096, 512, 1, 16640]
    - [131, 9365.31]
  - - [2048, 200, 1, 9216]
    - [223, 6315.88]
  - - [2048, 200, 1, 2560]
    - [223, 6119.14]
  - - [2048, 1024, 1, 1024]
    - [131, 8628.59]
  - - [2048, 256, 1, 4608]
    - [223, 7951.29]
  - - [512, 200, 1, 768]
    - [175, 2132.41]
  - - [128, 256, 1, 512]
    - [175, 670.017]
  - - [4096, 512, 1, 1792]
    - [136, 9126.91]
  - - [4096, 1024, 1, 8192]
    - [131, 9591.27]
  - - [1024, 256, 1, 2816]
    - [234, 6119.01]
  - - [1024, 1024, 1, 13312]
    - [226, 8529.27]
  - - [2048, 1024, 1, 4160]
    - [131, 9305.57]
  - - [2048, 256, 1, 3584]
    - [223, 7903.13]
  - - [128, 200, 1, 2048]
    - [191, 1135.81]
  - - [4096, 512, 1, 10240]
    - [133, 9339.49]
  - - [4096, 512, 1, 512]
    - [131, 8446.68]
  - - [2048, 1024, 1, 6656]
    - [131, 9331.65]
  - - [1024, 512, 1, 640]
    - [223, 6775.94]
  - - [2048, 512, 1, 768]
    - [225, 8085.41]
  - - [2048, 200, 1, 1408]
    - [223, 5880.07]
  - - [4096, 200, 1, 2048]
    - [239, 6691.61]
  - - [1024, 1024, 1, 5632]
    - [225, 8749.53]
  - - [2048, 512, 1, 3584]
    - [229, 8704.13]
  - - [64, 512, 1, 512]
    - [165, 667.883]
  - - [64, 200, 1, 512]
    - [175, 251.288]
  - - [1024, 200, 1, 64]
    - [130, 1310.72]
  - - [512, 512, 1, 2304]
    - [223, 6078.7]
  - - [2048, 1024, 1, 14336]
    - [131, 9321.84]
  - - [4096, 512, 1, 11264]
    - [133, 9339.85]
  - - [4096, 512, 1, 128]
    - [218, 6566.43]
  - - [1024, 512, 1, 64]
    - [238, 2953.74]
  - - [4096, 512, 1, 768]
    - [131, 8738.13]
  - - [4096, 1024, 1, 11264]
    - [131, 9637.68]
  - - [1, 256, 1, 1024]
    - [221, 8.83234]
  - - [4096, 200, 1, 7680]
    - [218, 6889.47]
  - - [1024, 200, 1, 12288]
    - [190, 5237.64]
  - - [1024, 1024, 1, 1280]
    - [225, 8418.07]
  - - [4096, 1024, 1, 16640]
    - [131, 9674.91]
  - - [2048, 1024, 1, 5632]
    - [131, 9327.75]
  - - [1024, 200, 1, 15360]
    - [190, 5386.53]
  - - [1, 1024, 1, 1024]
    - [240, 27.2499]
  - - [2048, 256, 1, 16384]
    - [201, 7652.65]
  - - [4096, 512, 1, 12288]
    - [133, 9359.41]
  - - [2048, 200, 1, 896]
    - [234, 5628.86]
  - - [4096, 1024, 1, 5632]
    - [131, 9626.68]
  - - [2048, 256, 1, 32]
    - [227, 1889.33]
  - - [2048, 256, 1, 1280]
    - [223, 7390.84]
  - - [4096, 256, 1, 4096]
    - [225, 8694.27]
  - - [2048, 256, 1, 11264]
    - [223, 8113.85]
  - - [4096, 200, 1, 9216]
    - [225, 6890.98]
  - - [1024, 512, 1, 4096]
    - [718, 6445.01]
  - - [2048, 1024, 1, 10240]
    - [133, 9095.81]
  - - [4096, 1024, 1, 640]
    - [131, 9115.58]
  - - [128, 1024, 1, 2048]
    - [124, 3270.41]
  - - [4096, 200, 1, 3840]
    - [218, 6836.16]
  - - [1024, 1024, 1, 1920]
    - [229, 8562.72]
  - - [2048, 200, 1, 7168]
    - [234, 6296.13]
  - - [2048, 512, 1, 16384]
    - [125, 8632.41]
  - - [2048, 1024, 1, 12288]
    - [131, 9157.98]
  - - [4096, 1024, 1, 10240]
    - [131, 9658.74]
  - - [1024, 1024, 1, 8320]
    - [233, 8799.48]
  - - [1024, 256, 1, 9216]
    - [223, 6375.13]
  - - [4096, 256, 1, 1152]
    - [218, 8300.99]
  - - [512, 200, 1, 2560]
    - [184, 3088.41]
  - - [2048, 256, 1, 1920]
    - [223, 7714.84]
  - - [2048, 1024, 1, 4608]
    - [131, 9305.6]
  - - [512, 256, 1, 1024]
    - [231, 2887.64]
  - - [1024, 256, 1, 1920]
    - [215, 5913.02]
  - - [4096, 512, 1, 3584]
    - [131, 9275.59]
  - - [2048, 512, 1, 4160]
    - [236, 8733.93]
  - - [2048, 512, 1, 5632]
    - [239, 8758.88]
  - - [4096, 1024, 1, 4608]
    - [131, 9657.12]
  - - [4096, 1024, 1, 3328]
    - [131, 9621.35]
  - - [4096, 256, 1, 7168]
    - [225, 8769.95]
  - - [4096, 200, 1, 128]
    - [239, 4458.23]
  - - [2048, 200, 1, 5120]
    - [223, 6176.81]
  - - [1024, 1024, 1, 6656]
    - [225, 8780.35]
  - - [512, 1024, 1, 3200]
    - [234, 7886.99]
  - - [512, 200, 1, 2304]
    - [124, 2990.99]
  - - [2048, 1024, 1, 9216]
    - [136, 9325.36]
  - - [2048, 256, 1, 1536]
    - [234, 7551.63]
  - - [4096, 256, 1, 256]
    - [239, 6932.73]
  - - [2048, 512, 1, 1408]
    - [236, 8430.76]
  - - [1024, 256, 1, 384]
    - [228, 4462.03]
  - - [2048, 1024, 1, 2304]
    - [131, 9174.84]
  - - [4096, 512, 1, 6144]
    - [133, 9284.15]
  - - [1024, 200, 1, 14336]
    - [122, 5268.47]
  - - [1024, 512, 1, 2080]
    - [234, 7736.37]
  - - [2048, 512, 1, 2304]
    - [236, 8615.97]
  - - [4096, 512, 1, 15360]
    - [136, 9362.07]
  - - [1024, 256, 1, 32]
    - [156, 1028.02]
  - - [1024, 200, 1, 2816]
    - [234, 4780.48]
  - - [4096, 200, 1, 512]
    - [225, 6054.13]
  - - [4096, 1024, 1, 7168]
    - [136, 9468.39]
  - - [2048, 256, 1, 14336]
    - [197, 7865.42]
  - - [1024, 200, 1, 3072]
    - [234, 4804.1]
  - - [2048, 200, 1, 1280]
    - [234, 5846.21]
  - - [1024, 1024, 1, 2304]
    - [225, 8633.22]
  - - [4096, 1024, 1, 9216]
    - [131, 9640.93]
  - - [2048, 512, 1, 4608]
    - [236, 8743.2]
  - - [4096, 1024, 1, 7680]
    - [131, 9684.76]
  - - [4096, 256, 1, 6144]
    - [236, 8757.14]
  - - [4096, 256, 1, 896]
    - [229, 8258.83]
  - - [512, 256, 1, 1536]
    - [213, 3065.26]
  - - [1024, 256, 1, 512]
    - [223, 4752.75]
  - - [2048, 256, 1, 640]
    - [223, 6775.94]
  - - [256, 256, 1, 2048]
    - [160, 2248.96]
  - - [2048, 1024, 1, 8192]
    - [131, 9178.07]
  - - [4096, 200, 1, 16640]
    - [123, 7009.49]
  - - [256, 512, 1, 512]
    - [135, 2511.56]
  - - [2048, 512, 1, 384]
    - [236, 7467.6]
  - - [2048, 200, 1, 16384]
    - [204, 6327.21]
  - - [4096, 200, 1, 10240]
    - [229, 6892.64]
  - - [1024, 512, 1, 9216]
    - [178, 7529.99]
  - - [4096, 1024, 1, 64]
    - [153, 6260.16]
  - - [4096, 200, 1, 1920]
    - [239, 6710.17]
  - - [2048, 1024, 1, 1280]
    - [131, 8998.24]
  - - [1024, 200, 1, 3840]
    - [223, 4873.77]
  - - [256, 1024, 1, 512]
    - [234, 4766.25]
  - - [2048, 1024, 1, 3328]
    - [131, 9275.1]
  - - [1024, 256, 1, 16640]
    - [188, 6837.12]
  - - [4096, 512, 1, 14336]
    - [136, 9354.32]
  - - [1024, 1024, 1, 16640]
    - [233, 8832.27]
  - - [1024, 256, 1, 1152]
    - [234, 5642.56]
  - - [4096, 512, 1, 8320]
    - [136, 9327.86]
  - - [2048, 512, 1, 7680]
    - [239, 8793.86]
  - - [4096, 1024, 1, 6656]
    - [131, 9666.93]
  - - [1024, 512, 1, 3584]
    - [234, 7900.47]
  - - [1024, 1024, 1, 32]
    - [219, 2974.68]
  - - [512, 512, 1, 2816]
    - [215, 6155.75]
  - - [2048, 512, 1, 1664]
    - [239, 8496.45]
  - - [1024, 1024, 1, 14336]
    - [125, 8624.64]
  - - [2048, 200, 1, 2048]
    - [234, 6029.76]
  - - [1024, 1024, 1, 3584]
    - [225, 8702.52]
  - - [512, 200, 1, 1280]
    - [139, 2350.65]
  - - [4096, 256, 1, 6656]
    - [239, 8788.31]
  - - [4096, 256, 1, 4160]
    - [216, 8728.34]
  - - [128, 256, 1, 1024]
    - [198, 859.489]
  - - [512, 200, 1, 3200]
    - [139, 3376.75]
  - - [2048, 512, 1, 9216]
    - [222, 8806.3]
  - - [2048, 1024, 1, 256]
    - [218, 7713.66]
  - - [1024, 256, 1, 2304]
    - [234, 6015.73]
  - - [1024, 200, 1, 8192]
    - [234, 5021.92]
  - - [2048, 256, 1, 3072]
    - [151, 7514.99]
  - - [2048, 256, 1, 8320]
    - [223, 8063.58]
  - - [4096, 512, 1, 1024]
    - [710, 8795.38]
  - - [1024, 512, 1, 3200]
    - [223, 7866.29]
  - - [1024, 512, 1, 896]
    - [215, 7161.01]
  - - [2048, 512, 1, 1280]
    - [229, 8384.42]
  - - [4096, 200, 1, 64]
    - [138, 3260.5]
  - - [1024, 256, 1, 6144]
    - [244, 6143.62]
  - - [1024, 200, 1, 2560]
    - [223, 4762.79]
  - - [1024, 1024, 1, 5120]
    - [152, 8454.13]
  - - [2048, 512, 1, 6656]
    - [229, 8798.95]
  - - [4096, 1024, 1, 1536]
    - [131, 9503.27]
  - - [1024, 1024, 1, 128]
    - [154, 5825.42]
  - - [512, 1024, 1, 1792]
    - [223, 7701.02]
  - - [2048, 1024, 1, 32]
    - [134, 3938.31]
  - - [4096, 256, 1, 2816]
    - [218, 8652.1]
  - - [1024, 1024, 1, 15360]
    - [125, 8719.6]
  - - [1024, 256, 1, 5632]
    - [223, 6344.08]
  - - [1024, 1024, 1, 4096]
    - [226, 8187.76]
  - - [2048, 200, 1, 4160]
    - [234, 6222.38]
  - - [512, 256, 1, 768]
    - [165, 2771.57]
  - - [4096, 512, 1, 640]
    - [136, 8590.48]
  - - [2048, 512, 1, 8192]
    - [178, 8494.8]
  - - [1024, 512, 1, 768]
    - [223, 7049.25]
  - - [4096, 200, 1, 8320]
    - [218, 6908.6]
  - - [2048, 512, 1, 896]
    - [225, 8224.13]
  - - [4096, 200, 1, 7168]
    - [236, 6878.49]
  - - [2048, 512, 1, 13312]
    - [224, 8802.94]
  - - [64, 512, 1, 1024]
    - [128, 843.924]
  - - [2048, 200, 1, 3840]
    - [223, 6192.38]
  - - [1024, 1024, 1, 768]
    - [216, 8098.41]
  - - [4096, 512, 1, 16384]
    - [136, 9345.63]
  - - [4096, 256, 1, 2304]
    - [216, 8596.35]
  - - [1, 256, 1, 4096]
    - [221, 19.8293]
  - - [1024, 1024, 1, 11264]
    - [226, 8491.38]
  - - [2048, 200, 1, 16640]
    - [220, 6510.54]
  - - [1024, 256, 1, 3072]
    - [234, 6179.45]
  - - [4096, 1024, 1, 512]
    - [131, 9032.15]
  - - [2048, 256, 1, 2816]
    - [223, 7793.47]
  - - [32, 512, 1, 512]
    - [135, 318.716]
  - - [256, 512, 1, 2048]
    - [186, 3368.92]
  - - [1024, 512, 1, 384]
    - [234, 6198.48]
  - - [2048, 200, 1, 7680]
    - [223, 6307.6]
  - - [1024, 512, 1, 4608]
    - [234, 7953.38]
  - - [4096, 200, 1, 32]
    - [183, 2199.19]
  - - [4096, 200, 1, 3328]
    - [218, 6813.02]
  - - [1024, 200, 1, 1152]
    - [223, 4375.55]
  - - [1024, 1024, 1, 1408]
    - [225, 8457.81]
  - - [2048, 200, 1, 15360]
    - [199, 6333.0]
  - - [512, 1024, 1, 2048]
    - [209, 6280.66]
  - - [1024, 200, 1, 10240]
    - [223, 5030.59]
  - - [4096, 256, 1, 5632]
    - [236, 8765.12]
  - - [512, 512, 1, 3072]
    - [246, 5942.34]
  - - [2048, 256, 1, 1408]
    - [223, 7544.95]
  - - [2048, 256, 1, 6144]
    - [234, 7963.87]
  - - [4096, 256, 1, 3328]
    - [229, 8682.48]
  - - [1024, 200, 1, 1664]
    - [223, 4595.3]
  - - [2048, 1024, 1, 1152]
    - [131, 8942.55]
  - - [2048, 512, 1, 6144]
    - [224, 8729.61]
  - - [2048, 512, 1, 3200]
    - [225, 8696.46]
  - - [4096, 1024, 1, 2080]
    - [164, 9538.35]
  - - [4096, 1024, 1, 768]
    - [131, 9260.65]
  - - [4096, 1024, 1, 2560]
    - [131, 9567.17]
  - - [64, 200, 1, 2048]
    - [163, 583.061]
  - - [2048, 200, 1, 4608]
    - [234, 6243.18]
  - - [1024, 1024, 1, 6144]
    - [226, 8320.15]
  - - [4096, 256, 1, 1664]
    - [229, 8503.07]
  - - [2048, 200, 1, 384]
    - [234, 4939.9]
  - - [1, 200, 1, 2048]
    - [180, 11.2281]
  - - [4096, 256, 1, 1792]
    - [239, 8504.02]
  - - [2048, 1024, 1, 64]
    - [153, 5309.25]
  - - [4096, 1024, 1, 16384]
    - [120, 9428.51]
  - - [1024, 512, 1, 16640]
    - [234, 8122.45]
  - - [2048, 512, 1, 10240]
    - [224, 8766.11]
  - - [4096, 512, 1, 6656]
    - [131, 9351.65]
  - - [2048, 256, 1, 16640]
    - [223, 8135.17]
  - - [2048, 512, 1, 2816]
    - [225, 8660.22]
  - - [1024, 200, 1, 32]
    - [143, 780.191]
  - - [1, 512, 1, 4096]
    - [168, 34.7671]
  - - [256, 256, 1, 1024]
    - [175, 1489.98]
  - - [2048, 1024, 1, 128]
    - [148, 6605.2]
  - - [2048, 1024, 1, 2080]
    - [131, 9159.41]
  - - [2048, 1024, 1, 16640]
    - [131, 9371.55]
  - - [1024, 200, 1, 384]
    - [234, 3378.14]
  - - [4096, 256, 1, 384]
    - [179, 7369.2]
  - - [4096, 256, 1, 13312]
    - [233, 8776.38]
  - - [2048, 256, 1, 128]
    - [228, 4279.9]
  - - [512, 256, 1, 2304]
    - [140, 3584.88]
  - - [2048, 1024, 1, 3072]
    - [133, 9156.42]
  - - [1024, 1024, 1, 640]
    - [229, 7928.74]
  - - [256, 512, 1, 1024]
    - [234, 2843.6]
  - - [4096, 1024, 1, 1408]
    - [131, 9437.46]
  - - [4096, 200, 1, 5632]
    - [236, 6873.86]
  - - [4096, 1024, 1, 2048]
    - [131, 9437.0]
  - - [2048, 1024, 1, 2560]
    - [136, 9195.52]
  - - [4096, 1024, 1, 128]
    - [218, 7407.16]
  - - [1024, 200, 1, 3328]
    - [234, 4857.29]
  - - [2048, 200, 1, 1152]
    - [223, 5760.0]
  - - [1024, 200, 1, 9216]
    - [122, 5053.11]
  - - [4096, 256, 1, 512]
    - [216, 7617.35]
  - - [4096, 1024, 1, 14336]
    - [131, 9665.02]
  - - [1024, 1024, 1, 384]
    - [154, 7478.7]
  - - [2048, 200, 1, 512]
    - [223, 5150.18]
  - - [2048, 256, 1, 9216]
    - [202, 7717.61]
  - - [2048, 256, 1, 1792]
    - [223, 7655.84]
  - - [4096, 512, 1, 9216]
    - [133, 9331.12]
  - - [4096, 200, 1, 15360]
    - [123, 6958.04]
  - - [1024, 512, 1, 2048]
    - [222, 7067.81]
  - - [64, 256, 1, 2048]
    - [147, 723.156]
  - - [4096, 200, 1, 1792]
    - [225, 6699.55]
  - - [1, 200, 1, 4096]
    - [157, 15.5387]
  - - [2048, 1024, 1, 2048]
    - [136, 9071.83]
  - - [1024, 200, 1, 2080]
    - [215, 4679.09]
  - - [2048, 200, 1, 1536]
    - [234, 5939.82]
  - - [1024, 1024, 1, 3072]
    - [196, 8333.05]
  - - [512, 200, 1, 1792]
    - [121, 2679.63]
  - - [1024, 256, 1, 11264]
    - [124, 6470.88]
  - - [2048, 512, 1, 12288]
    - [171, 8729.14]
  - - [1024, 256, 1, 1792]
    - [234, 5931.34]
  - - [1024, 200, 1, 7168]
    - [234, 4970.23]
  - - [32, 256, 1, 1024]
    - [145, 237.234]
  - - [512, 256, 1, 3072]
    - [188, 3813.0]
  - - [1024, 1024, 1, 2080]
    - [225, 8600.31]
  - - [2048, 200, 1, 2304]
    - [234, 6093.22]
  - - [4096, 512, 1, 1536]
    - [131, 9074.9]
  - - [2048, 256, 1, 7168]
    - [234, 7895.16]
  - - [2048, 512, 1, 1792]
    - [236, 8531.82]
  - - [1024, 200, 1, 2048]
    - [223, 4685.33]
  - - [1024, 1024, 1, 4608]
    - [229, 8735.61]
  - - [4096, 256, 1, 8192]
    - [225, 8782.45]
  - - [512, 1024, 1, 1280]
    - [215, 7483.15]
  - - [2048, 1024, 1, 16384]
    - [125, 8878.86]
  - - [512, 512, 1, 1280]
    - [223, 5745.62]
  - - [1024, 200, 1, 1280]
    - [215, 4446.13]
  - - [2048, 256, 1, 3200]
    - [223, 7842.75]
  - - [2048, 512, 1, 15360]
    - [171, 8757.14]
  - - [1024, 512, 1, 3328]
    - [223, 7853.94]
  - - [1024, 512, 1, 4160]
    - [223, 7934.51]
  - - [4096, 200, 1, 6656]
    - [225, 6883.2]
  - - [4096, 1024, 1, 1024]
    - [131, 9229.34]
  - - [2048, 200, 1, 3328]
    - [234, 6182.64]
  - - [1024, 1024, 1, 256]
    - [154, 6932.73]
  - - [512, 200, 1, 512]
    - [175, 1910.67]
  - - [2048, 256, 1, 64]
    - [146, 2912.71]
  - - [1024, 256, 1, 2560]
    - [223, 6123.07]
  - - [2048, 512, 1, 11264]
    - [235, 8728.84]
  - - [32, 200, 1, 1024]
    - [230, 187.46]
  - - [32, 512, 1, 2048]
    - [174, 694.421]
  - - [2048, 256, 1, 2304]
    - [223, 7759.25]
  - - [2048, 256, 1, 12288]
    - [202, 7726.25]
  - - [4096, 200, 1, 8192]
    - [225, 6870.84]
  - - [1024, 512, 1, 7168]
    - [171, 7479.1]
  - - [1024, 512, 1, 1792]
    - [223, 7626.01]
  - - [4096, 1024, 1, 1664]
    - [131, 9503.44]
  - - [4096, 200, 1, 2816]
    - [218, 6775.34]
  - - [1024, 1024, 1, 896]
    - [225, 8229.89]
  - - [1024, 200, 1, 8320]
    - [186, 5173.48]
  - - [1024, 1024, 1, 12288]
    - [226, 8463.11]
  - - [1024, 256, 1, 8320]
    - [215, 6404.27]
  - - [1024, 200, 1, 1024]
    - [730, 5427.41]
  - - [1024, 200, 1, 16640]
    - [185, 5499.41]
  - - [4096, 256, 1, 5120]
    - [239, 8729.05]
  - - [1024, 256, 1, 3200]
    - [234, 6124.86]
  - - [512, 512, 1, 2560]
    - [234, 6109.69]
  - - [4096, 256, 1, 2048]
    - [239, 8510.95]
  - - [1024, 256, 1, 640]
    - [223, 5102.56]
  - - [2048, 256, 1, 5120]
    - [151, 7667.83]
  - - [2048, 256, 1, 7680]
    - [234, 8054.35]
  - - [4096, 512, 1, 384]
    - [229, 8190.67]
  - - [2048, 200, 1, 3584]
    - [223, 6166.02]
  - - [1024, 512, 1, 1536]
    - [223, 7517.8]
  - - [4096, 512, 1, 3328]
    - [131, 9259.35]
  - - [4096, 1024, 1, 256]
    - [131, 8341.69]
  - - [2048, 200, 1, 64]
    - [194, 2307.61]
  - - [2048, 200, 1, 4096]
    - [234, 6211.94]
  - - [1024, 1024, 1, 1536]
    - [225, 8484.05]
  - - [2048, 1024, 1, 7168]
    - [133, 9315.14]
  - - [1024, 256, 1, 3584]
    - [223, 6207.22]
  - - [4096, 256, 1, 32]
    - [227, 2892.62]
  - - [4096, 256, 1, 1280]
    - [236, 8392.8]
  - - [512, 512, 1, 3200]
    - [234, 6219.31]
  - - [2048, 1024, 1, 1536]
    - [133, 9052.45]
  - - [2048, 256, 1, 1024]
    - [223, 7192.8]
  - - [128, 200, 1, 512]
    - [213, 502.577]
  - - [4096, 512, 1, 7168]
    - [136, 9329.01]
  - - [1024, 512, 1, 1152]
    - [223, 7358.43]
  - - [64, 1024, 1, 2048]
    - [141, 2102.41]
  - - [2048, 512, 1, 3328]
    - [225, 8694.59]
  - - [4096, 1024, 1, 896]
    - [131, 9342.92]
  - - [1, 1024, 1, 2048]
    - [181, 40.8324]
  - - [4096, 200, 1, 3584]
    - [229, 6810.2]
  - - [4096, 1024, 1, 4096]
    - [131, 9347.46]
  - - [1024, 256, 1, 14336]
    - [124, 6625.7]
  - - [2048, 200, 1, 256]
    - [223, 4413.2]
  - - [4096, 256, 1, 16384]
    - [125, 8752.03]
  - - [4096, 256, 1, 1920]
    - [216, 8533.68]
  - - [32, 1024, 1, 512]
    - [214, 647.269]
  - - [1024, 256, 1, 7680]
    - [234, 6387.26]
  - - [2048, 256, 1, 1664]
    - [234, 7631.34]
  - - [512, 200, 1, 1536]
    - [139, 2576.78]
  - - [2048, 1024, 1, 6144]
    - [120, 9033.67]
  - - [512, 256, 1, 2816]
    - [186, 3977.36]
  - - [4096, 512, 1, 4160]
    - [133, 9288.92]
  - - [4096, 512, 1, 2080]
    - [212, 9150.18]
  - - [2048, 256, 1, 15360]
    - [197, 7963.87]
  - - [4096, 200, 1, 5120]
    - [236, 6861.52]
  - - [1024, 512, 1, 8192]
    - [222, 7473.15]
  - - [4096, 200, 1, 896]
    - [239, 6443.15]
  - - [2048, 512, 1, 8320]
    - [229, 8810.14]
  - - [1024, 1024, 1, 10240]
    - [237, 8436.6]
  - - [1024, 200, 1, 768]
    - [223, 4087.48]
  - - [2048, 200, 1, 640]
    - [234, 5416.2]
  - - [512, 200, 1, 2048]
    - [188, 2702.52]
  - - [1024, 1024, 1, 9216]
    - [226, 8498.98]
  - - [4096, 200, 1, 1408]
    - [236, 6613.72]
  - - [1024, 256, 1, 13312]
    - [124, 6643.44]
  - - [1024, 256, 1, 128]
    - [155, 2706.0]
  - - [2048, 200, 1, 5632]
    - [234, 6270.02]
  - - [64, 1024, 1, 512]
    - [213, 1310.72]
  - - [1024, 512, 1, 2560]
    - [234, 7731.44]
  - - [4096, 200, 1, 1280]
    - [216, 6566.73]
  - - [1024, 200, 1, 4096]
    - [724, 5937.58]
  - - [1024, 1024, 1, 2560]
    - [225, 8630.25]
  - - [2048, 512, 1, 64]
    - [229, 4152.78]
  - - [2048, 200, 1, 8192]
    - [223, 6234.11]
  - - [2048, 512, 1, 3072]
    - [233, 8614.75]
  - - [4096, 1024, 1, 5120]
    - [131, 9573.65]
  - - [4096, 256, 1, 640]
    - [218, 7913.78]
  - - [1024, 256, 1, 1280]
    - [223, 5706.54]
  - - [2048, 1024, 1, 1920]
    - [133, 9141.24]
  - - [2048, 256, 1, 4096]
    - [223, 7937.18]
  - - [2048, 1024, 1, 15360]
    - [136, 9351.86]
  - - [4096, 200, 1, 16384]
    - [125, 6975.11]
  - - [1, 1024, 1, 4096]
    - [243, 60.6815]
  - - [4096, 1024, 1, 2816]
    - [131, 9583.88]
  - - [4096, 200, 1, 1664]
    - [218, 6658.6]
  - - [4096, 512, 1, 256]
    - [149, 7731.44]
  - - [1024, 200, 1, 896]
    - [223, 4193.35]
  - - [2048, 200, 1, 6656]
    - [234, 6291.07]
  - - [2048, 1024, 1, 5120]
    - [133, 9270.47]
  - - [512, 1024, 1, 768]
    - [223, 7098.96]
  - - [2048, 512, 1, 14336]
    - [203, 8559.03]
  - - [2048, 200, 1, 8320]
    - [223, 6314.62]
  - - [4096, 256, 1, 3840]
    - [239, 8718.46]
  - - [2048, 1024, 1, 4096]
    - [120, 8973.28]
  - - [1024, 1024, 1, 3200]
    - [229, 8701.88]
  - - [1024, 256, 1, 4608]
    - [223, 6267.95]
  - - [4096, 512, 1, 4608]
    - [131, 9316.37]
  - - [2048, 512, 1, 2048]
    - [222, 8462.66]
  - - [4096, 512, 1, 1664]
    - [131, 9074.43]
  - - [4096, 256, 1, 4608]
    - [218, 8717.95]
  - - [1024, 512, 1, 32]
    - [211, 1807.89]
  - - [1024, 512, 1, 3840]
    - [223, 7936.24]
  - - [2048, 512, 1, 1920]
    - [239, 8548.17]
  - - [2048, 1024, 1, 896]
    - [131, 8843.41]
  - - [4096, 200, 1, 6144]
    - [239, 6864.66]
  - - [1024, 512, 1, 13312]
    - [192, 7763.09]
  - - [4096, 1024, 1, 4160]
    - [131, 9650.62]
  - - [2048, 200, 1, 2816]
    - [223, 6119.66]
  - - [1024, 1024, 1, 3840]
    - [218, 8709.4]
  - - [128, 1024, 1, 1024]
    - [241, 2577.15]
  - - [2048, 1024, 1, 11264]
    - [136, 9338.96]
  - - [2048, 1024, 1, 384]
    - [225, 8210.71]
  - - [1024, 256, 1, 2048]
    - [246, 5755.48]
  - - [2048, 1024, 1, 3840]
    - [133, 9288.86]
  - - [4096, 256, 1, 8320]
    - [239, 8812.28]
  - - [2048, 256, 1, 3840]
    - [215, 7856.95]
  - - [64, 256, 1, 512]
    - [213, 336.082]
  - - [4096, 512, 1, 1280]
    - [133, 8993.42]
  - - [512, 256, 1, 1280]
    - [165, 2995.93]
  - - [1024, 512, 1, 7680]
    - [223, 8041.49]
  - - [4096, 1024, 1, 1152]
    - [131, 9368.38]
  - - [256, 200, 1, 512]
    - [165, 992.97]
  - - [256, 1024, 1, 2048]
    - [242, 4759.49]
  - - [2048, 200, 1, 10240]
    - [234, 6328.93]
  - - [2048, 512, 1, 5120]
    - [235, 8732.46]
  - - [2048, 1024, 1, 1408]
    - [133, 9006.8]
  - - [512, 1024, 1, 512]
    - [223, 6528.1]
  - - [1024, 200, 1, 11264]
    - [190, 5194.72]
  - - [512, 1024, 1, 1024]
    - [176, 6337.0]
  - - [2048, 512, 1, 32]
    - [142, 2777.68]
  - - [4096, 256, 1, 2560]
    - [225, 8621.39]
  - - [4096, 256, 1, 64]
    - [159, 4194.3]
  - - [32, 1024, 1, 1024]
    - [160, 778.164]
  - - [2048, 200, 1, 768]
    - [234, 5507.23]
  - - [512, 512, 1, 2048]
    - [182, 5338.81]
  - - [2048, 512, 1, 2560]
    - [236, 8643.59]
  - - [512, 256, 1, 512]
    - [215, 2542.0]
  - - [1024, 200, 1, 7680]
    - [190, 5047.7]
  - - [4096, 512, 1, 896]
    - [131, 8856.75]
  - - [4096, 1024, 1, 3072]
    - [131, 9492.07]
  - - [4096, 200, 1, 13312]
    - [123, 6900.63]
  - - [2048, 512, 1, 7168]
    - [224, 8788.0]
  - - [2048, 1024, 1, 2816]
    - [136, 9229.78]
  - - [2048, 512, 1, 128]
    - [154, 5629.94]
  - - [1024, 256, 1, 8192]
    - [246, 6203.73]
  - - [4096, 1024, 1, 1792]
    - [131, 9510.32]
  - - [1024, 200, 1, 6656]
    - [215, 5002.75]
  - - [4096, 200, 1, 2304]
    - [236, 6754.35]
  - - [4096, 512, 1, 1152]
    - [131, 8974.44]
  - - [512, 200, 1, 1024]
    - [213, 2232.91]
  - - [1024, 256, 1, 3840]
    - [234, 6244.62]
  - - [512, 512, 1, 768]
    - [223, 5331.74]
  - - [2048, 512, 1, 4096]
    - [233, 8621.66]
  - - [2048, 256, 1, 2560]
    - [223, 7770.83]
  - - [2048, 256, 1, 4160]
    - [234, 7922.98]
  - - [1024, 256, 1, 64]
    - [130, 1705.0]
  - - [4096, 512, 1, 7680]
    - [131, 9364.47]
  - - [1024, 512, 1, 1664]
    - [234, 7594.14]
  - - [2048, 512, 1, 2080]
    - [225, 8570.57]
  - - [2048, 512, 1, 3840]
    - [236, 8729.04]
  - - [4096, 1024, 1, 384]
    - [131, 8764.76]
  - - [4096, 200, 1, 3072]
    - [225, 6772.29]
  - - [1024, 512, 1, 14336]
    - [193, 7680.87]
  - - [1024, 200, 1, 1920]
    - [215, 4636.98]
  - - [1024, 1024, 1, 1664]
    - [229, 8506.39]
  - - [512, 1024, 1, 2304]
    - [223, 7775.23]
  - - [2048, 1024, 1, 1792]
    - [131, 9123.36]
  - - [32, 200, 1, 512]
    - [231, 125.644]
  - - [4096, 256, 1, 11264]
    - [236, 8822.21]
  - - [4096, 256, 1, 1408]
    - [236, 8419.22]
  - - [1024, 256, 1, 7168]
    - [223, 6377.44]
  - - [2048, 256, 1, 1152]
    - [234, 7401.71]
  - - [256, 256, 1, 512]
    - [213, 1314.83]
  - - [1024, 512, 1, 1280]
    - [223, 7410.43]
  - - [512, 512, 1, 1792]
    - [215, 5931.34]
  - - [2048, 200, 1, 12288]
    - [197, 6242.15]
  - - [2048, 200, 1, 1664]
    - [234, 5953.65]
  - - [4096, 200, 1, 4608]
    - [229, 6853.44]
  - - [512, 1024, 1, 2560]
    - [223, 7778.03]
  - - [4096, 200, 1, 384]
    - [216, 5765.63]
  - - [128, 512, 1, 512]
    - [213, 1302.58]
  - - [1024, 200, 1, 256]
    - [217, 2861.83]
  - - [256, 1024, 1, 1024]
    - [158, 4522.16]
  - - [2048, 200, 1, 128]
    - [223, 3309.9]
  - - [2048, 200, 1, 11264]
    - [204, 6168.1]
  - - [1024, 512, 1, 1920]
    - [234, 7649.19]
  - - [4096, 256, 1, 1536]
    - [229, 8427.23]
  - - [4096, 1024, 1, 3584]
    - [131, 9617.9]
  - - [2048, 256, 1, 256]
    - [223, 5464.89]
  - - [2048, 1024, 1, 768]
    - [131, 8726.77]
  - - [4096, 256, 1, 10240]
    - [225, 8790.79]
  - - [2048, 256, 1, 10240]
    - [205, 7665.21]
  - - [4096, 200, 1, 14336]
    - [239, 6916.08]
  - - [1024, 512, 1, 5120]
    - [177, 7420.26]
  - - [1024, 512, 1, 8320]
    - [234, 8061.21]
  - - [256, 200, 1, 2048]
    - [189, 1916.26]
  - - [1024, 200, 1, 640]
    - [217, 3873.29]
  - - [1024, 512, 1, 10240]
    - [222, 7526.8]
  - - [1024, 200, 1, 4160]
    - [234, 4928.09]
  - - [1024, 200, 1, 5632]
    - [215, 4978.56]
  - - [1024, 1024, 1, 2048]
    - [170, 7937.18]
  - - [1024, 256, 1, 6656]
    - [234, 6373.58]
  - - [2048, 1024, 1, 8320]
    - [131, 9333.05]
  - - [1024, 256, 1, 10240]
    - [223, 6407.19]
  - - [2048, 256, 1, 2080]
    - [223, 7714.48]
  - - [4096, 256, 1, 128]
    - [137, 5765.37]
  - - [1024, 256, 1, 768]
    - [228, 5210.32]
  - - [2048, 256, 1, 896]
    - [234, 7267.36]
  - - [64, 512, 1, 2048]
    - [200, 1296.54]
  - - [4096, 512, 1, 2048]
    - [133, 9121.15]
  - - [512, 256, 1, 2048]
    - [186, 3283.21]
  - - [4096, 256, 1, 16640]
    - [218, 8839.78]
  - - [4096, 512, 1, 2560]
    - [136, 9222.05]
  - - [1024, 512, 1, 15360]
    - [187, 7865.56]
  - - [4096, 1024, 1, 2304]
    - [131, 9558.16]
  - - [4096, 200, 1, 1152]
    - [236, 6531.83]
  - - [2048, 200, 1, 6144]
    - [234, 6277.65]
  - - [1024, 1024, 1, 7680]
    - [229, 8799.24]
  - - [2048, 200, 1, 1920]
    - [234, 6030.92]
  - - [32, 1024, 1, 2048]
    - [208, 1174.88]
  - - [1024, 200, 1, 3584]
    - [215, 4880.34]
  - - [4096, 256, 1, 2080]
    - [222, 8557.12]
  - - [1024, 1024, 1, 16384]
    - [123, 8618.55]
  - - [1024, 256, 1, 1408]
    - [234, 5803.44]
  - - [1024, 256, 1, 4096]
    - [713, 5263.43]
  - - [2048, 200, 1, 14336]
    - [234, 6364.38]
  - - [4096, 512, 1, 5120]
    - [133, 9301.95]
  - - [1024, 512, 1, 6144]
    - [169, 7468.99]
  - - [1024, 512, 1, 2304]
    - [234, 7759.25]
  - - [4096, 200, 1, 4160]
    - [218, 6843.12]
  - - [4096, 200, 1, 1536]
    - [229, 6628.17]
  - - [4096, 1024, 1, 6144]
    - [131, 9592.98]
  - - [256, 64, 1, 1225]
    - [252, 1194.67]
  - - [2048, 320, 1, 64]
    - [254, 3449.26]
  - - [1024, 128, 1, 289]
    - [257, 2869.68]
  - - [384, 64, 1, 1225]
    - [249, 1511.33]
  - - [2048, 384, 1, 64]
    - [256, 3836.25]
  - - [64, 80, 1, 5329]
    - [255, 888.167]
  - - [1024, 384, 1, 289]
    - [251, 4291.52]
  - - [2048, 448, 1, 64]
    - [250, 3783.52]
  - - [768, 192, 1, 289]
    - [253, 2690.33]
  - - [288, 64, 1, 1225]
    - [248, 1142.67]
  - - [384, 96, 1, 1225]
    - [258, 1844.71]
  - - [1024, 3392, 1, 4096]
    - [284, 8502.92]
  - - [1024, 3301, 1, 4096]
    - [286, 8414.0]
  - - [1024, 3443, 1, 4096]
    - [273, 8536.49]
  - - [132, 134, 480, 64]
    - [310, 4149.17]
  - - [162, 162, 400, 64]
    - [298, 5539.63]
  - - [4096, 3548, 1, 1024]
    - [265, 9772.91]
  - - [4096, 2977, 1, 1024]
    - [266, 9574.33]
  - - [132, 135, 480, 64]
    - [310, 4167.41]
  - - [1024, 2985, 1, 4096]
    - [269, 9133.89]
  - - [33708, 3681, 1, 1024]
    - [266, 10033.7]
  - - [4096, 3443, 1, 1024]
    - [266, 9513.68]
  - - [11, 11, 5456, 64]
    - [307, 627.246]
  - - [1024, 3400, 1, 4096]
    - [712, 9519.76]
  - - [4096, 3995, 1, 1024]
    - [265, 9693.77]
  - - [4096, 3190, 1, 1024]
    - [265, 9474.74]
  - - [4096, 3594, 1, 1024]
    - [266, 9315.73]
  - - [159, 162, 400, 64]
    - [297, 5429.88]
  - - [1024, 3565, 1, 4096]
    - [281, 8532.7]
  - - [4096, 3422, 1, 1024]
    - [266, 9459.14]
  - - [1024, 3214, 1, 4096]
    - [286, 8064.82]
  - - [33708, 3584, 1, 1024]
    - [267, 10128.9]
  - - [33708, 3640, 1, 1024]
    - [264, 9919.12]
  - - [4096, 3263, 1, 1024]
    - [264, 9699.25]
  - - [4096, 3296, 1, 1024]
    - [264, 9780.7]
  - - [1024, 3557, 1, 4096]
    - [285, 8526.79]
  - - [4096, 3463, 1, 1024]
    - [264, 9578.03]
  - - [4096, 3528, 1, 1024]
    - [707, 9682.71]
  - - [14, 14, 4368, 64]
    - [295, 991.176]
  - - [4096, 3226, 1, 1024]
    - [264, 9587.09]
  - - [4096, 3439, 1, 1024]
    - [267, 9499.62]
  - - [1024, 3523, 1, 4096]
    - [287, 8393.48]
  - - [1024, 3098, 1, 4096]
    - [292, 7882.77]
  - - [4096, 3121, 1, 1024]
    - [264, 9296.13]
  - - [33708, 3894, 1, 1024]
    - [265, 9952.17]
  - - [1024, 3548, 1, 4096]
    - [271, 8432.35]
  - - [1024, 3451, 1, 4096]
    - [284, 8456.34]
  - - [4096, 3353, 1, 1024]
    - [266, 9288.98]
  - - [4096, 3402, 1, 1024]
    - [266, 9406.34]
  - - [4096, 3939, 1, 1024]
    - [264, 9549.49]
  - - [133, 133, 480, 64]
    - [310, 4124.21]
  - - [1024, 3559, 1, 4096]
    - [286, 8586.94]
  - - [1024, 2977, 1, 4096]
    - [269, 9084.49]
  - - [1024, 3478, 1, 4096]
    - [280, 8342.75]
  - - [134, 134, 480, 64]
    - [312, 4204.33]
  - - [1024, 3368, 1, 4096]
    - [286, 8277.33]
  - - [4096, 4012, 1, 1024]
    - [266, 9726.47]
  - - [4096, 3486, 1, 1024]
    - [264, 9639.61]
  - - [1024, 3479, 1, 4096]
    - [274, 8420.27]
  - - [1024, 3505, 1, 4096]
    - [286, 8310.56]
  - - [4096, 3381, 1, 1024]
    - [267, 9357.65]
  - - [4096, 3430, 1, 1024]
    - [264, 9482.26]
  - - [1024, 3554, 1, 4096]
    - [286, 8592.28]
  - - [4096, 3271, 1, 1024]
    - [264, 9715.31]
  - - [1024, 3063, 1, 4096]
    - [268, 9388.46]
  - - [1024, 3209, 1, 4096]
    - [286, 8212.64]
  - - [4096, 3503, 1, 1024]
    - [266, 9680.49]
  - - [4096, 3344, 1, 1024]
    - [707, 9213.88]
  - - [1024, 3147, 1, 4096]
    - [287, 8037.1]
  - - [1024, 3322, 1, 4096]
    - [285, 8356.22]
  - - [1024, 3341, 1, 4096]
    - [286, 8316.23]
  - - [1024, 3516, 1, 4096]
    - [268, 8397.02]
  - - [102, 101, 624, 64]
    - [298, 4709.49]
  - - [1024, 3454, 1, 4096]
    - [285, 8425.5]
  - - [4096, 3969, 1, 1024]
    - [266, 9640.05]
  - - [4096, 3466, 1, 1024]
    - [266, 9576.73]
  - - [1024, 3999, 1, 1024]
    - [269, 9207.05]
  - - [1024, 4032, 1, 1024]
    - [710, 9089.79]
  - - [1024, 3403, 1, 4096]
    - [284, 8357.87]
  - - [4096, 3361, 1, 1024]
    - [266, 9308.68]
  - - [1024, 3527, 1, 4096]
    - [285, 8512.09]
  - - [1024, 3822, 1, 4096]
    - [269, 8991.03]
  - - [4096, 3315, 1, 1024]
    - [264, 9834.86]
  - - [232, 232, 272, 64]
    - [297, 6481.52]
  - - [1024, 3336, 1, 4096]
    - [287, 8295.51]
  - - [228, 232, 272, 64]
    - [298, 6327.75]
  - - [4096, 3547, 1, 1024]
    - [264, 9781.46]
  - - [4096, 3340, 1, 1024]
    - [266, 9269.62]
  - - [1024, 3906, 1, 1024]
    - [270, 9018.28]
  - - [1024, 3295, 1, 4096]
    - [284, 8194.73]
  - - [4096, 3294, 1, 1024]
    - [267, 9762.06]
  - - [33708, 3968, 1, 1024]
    - [267, 10147.7]
  - - [1024, 3473, 1, 4096]
    - [273, 8318.58]
  - - [1024, 3072, 1, 4096]
    - [710, 8272.25]
  - - [4096, 3189, 1, 1024]
    - [264, 9470.16]
  - - [4096, 3494, 1, 1024]
    - [264, 9661.22]
  - - [1024, 3522, 1, 4096]
    - [287, 8459.13]
  - - [33708, 3944, 1, 1024]
    - [267, 10060.1]
  - - [135, 135, 480, 64]
    - [311, 4256.93]
  - - [4096, 3421, 1, 1024]
    - [264, 9456.88]
  - - [32, 32, 1984, 64]
    - [308, 3436.14]
  - - [4096, 3311, 1, 1024]
    - [264, 9810.78]
  - - [1024, 3990, 1, 1024]
    - [271, 9197.64]
  - - [1024, 3290, 1, 4096]
    - [284, 8229.53]
  - - [4096, 3565, 1, 1024]
    - [265, 9824.38]
  - - [1024, 3484, 1, 4096]
    - [274, 8575.28]
  - - [4096, 3384, 1, 1024]
    - [712, 8789.2]
  - - [1024, 3422, 1, 4096]
    - [284, 8484.02]
  - - [4096, 3681, 1, 1024]
    - [265, 9520.06]
  - - [1024, 3584, 1, 1024]
    - [707, 9137.56]
  - - [4096, 4050, 1, 1024]
    - [266, 9807.25]
  - - [1024, 3996, 1, 4096]
    - [267, 9181.6]
  - - [4096, 3169, 1, 1024]
    - [265, 9411.3]
  - - [4096, 3538, 1, 1024]
    - [265, 9765.89]
  - - [1024, 3495, 1, 4096]
    - [271, 8295.85]
  - - [4096, 3401, 1, 1024]
    - [264, 9402.58]
  - - [1024, 3560, 1, 4096]
    - [285, 8513.35]
  - - [133, 135, 480, 64]
    - [311, 4198.98]
  - - [1024, 3263, 1, 4096]
    - [286, 8172.13]
  - - [1024, 3870, 1, 4096]
    - [266, 8996.17]
  - - [4096, 3555, 1, 1024]
    - [267, 9811.78]
  - - [4096, 3412, 1, 1024]
    - [264, 9431.99]
  - - [101, 101, 624, 64]
    - [297, 4667.59]
  - - [1024, 3296, 1, 4096]
    - [285, 8350.51]
  - - [1024, 3379, 1, 4096]
    - [287, 8432.84]
  - - [4096, 3302, 1, 1024]
    - [264, 9796.29]
  - - [1024, 3490, 1, 4096]
    - [284, 8538.34]
  - - [1024, 3428, 1, 4096]
    - [285, 8531.57]
  - - [1024, 3976, 1, 4096]
    - [266, 9327.77]
  - - [4096, 3485, 1, 1024]
    - [264, 9628.72]
  - - [4096, 3534, 1, 1024]
    - [264, 9755.87]
  - - [1024, 3064, 1, 4096]
    - [270, 9196.88]
  - - [4096, 3216, 1, 1024]
    - [266, 9563.34]
  - - [1024, 3450, 1, 4096]
    - [293, 8519.19]
  - - [1024, 3533, 1, 4096]
    - [285, 8495.67]
  - - [1024, 4030, 1, 1024]
    - [270, 9304.58]
  - - [1024, 3311, 1, 4096]
    - [285, 8278.5]
  - - [1024, 3468, 1, 4096]
    - [276, 8564.45]
  - - [23, 23, 2720, 64]
    - [299, 2311.45]
  - - [4096, 3359, 1, 1024]
    - [266, 9309.05]
  - - [4096, 3392, 1, 1024]
    - [266, 9388.09]
  - - [1024, 3925, 1, 1024]
    - [268, 9006.62]
  - - [4096, 3233, 1, 1024]
    - [264, 9603.54]
  - - [4096, 3956, 1, 1024]
    - [265, 9581.84]
  - - [1024, 3463, 1, 4096]
    - [286, 8293.87]
  - - [1024, 3126, 1, 4096]
    - [285, 7978.03]
  - - [1024, 3363, 1, 4096]
    - [278, 8267.37]
  - - [4096, 3465, 1, 1024]
    - [264, 9590.64]
  - - [33708, 3996, 1, 1024]
    - [265, 9899.89]
  - - [1024, 3231, 1, 4096]
    - [286, 8231.58]
  - - [33708, 3978, 1, 1024]
    - [265, 9853.54]
  - - [4096, 3476, 1, 1024]
    - [264, 9616.52]
  - - [85, 85, 752, 64]
    - [295, 4240.55]
  - - [4096, 3339, 1, 1024]
    - [266, 9249.71]
  - - [4096, 3452, 1, 1024]
    - [264, 9534.03]
  - - [1024, 3396, 1, 4096]
    - [285, 8451.13]
  - - [4096, 3293, 1, 1024]
    - [266, 9775.12]
  - - [54, 54, 1184, 64]
    - [297, 4153.44]
  - - [1024, 3432, 1, 4096]
    - [279, 8345.43]
  - - [4096, 3493, 1, 1024]
    - [267, 9649.8]
  - - [4096, 3350, 1, 1024]
    - [266, 9273.81]
  - - [1024, 3079, 1, 4096]
    - [293, 7775.56]
  - - [1024, 3101, 1, 4096]
    - [293, 7847.75]
  - - [33708, 3939, 1, 1024]
    - [267, 10054.3]
  - - [4096, 3256, 1, 1024]
    - [266, 9681.73]
  - - [1024, 3439, 1, 4096]
    - [285, 8531.01]
  - - [1024, 3510, 1, 4096]
    - [284, 8422.21]
  - - [4096, 3900, 1, 1024]
    - [265, 9468.51]
  - - [1024, 3470, 1, 4096]
    - [286, 8507.67]
  - - [4096, 3456, 1, 1024]
    - [712, 9520.47]
  - - [4096, 3014, 1, 1024]
    - [265, 9666.05]
  - - [4096, 3367, 1, 1024]
    - [267, 9328.26]
  - - [4096, 3432, 1, 1024]
    - [264, 9480.78]
  - - [33708, 4026, 1, 1024]
    - [267, 9972.73]
  - - [4096, 3273, 1, 1024]
    - [264, 9716.85]
  - - [4096, 3130, 1, 1024]
    - [264, 9311.3]
  - - [1024, 3496, 1, 4096]
    - [275, 8434.55]
  - - [1024, 3995, 1, 4096]
    - [260, 9157.63]
  - - [1024, 3939, 1, 4096]
    - [268, 9059.76]
  - - [1024, 3121, 1, 4096]
    - [291, 7963.33]
  - - [1024, 3232, 1, 4096]
    - [286, 8060.99]
  - - [4096, 3147, 1, 1024]
    - [266, 9364.53]
  - - [4096, 3516, 1, 1024]
    - [264, 9708.74]
  - - [1024, 3969, 1, 1024]
    - [270, 9168.58]
  - - [1024, 3364, 1, 4096]
    - [274, 8363.55]
  - - [4096, 3411, 1, 1024]
    - [267, 9442.67]
  - - [147, 147, 432, 64]
    - [310, 4843.11]
  - - [4096, 3301, 1, 1024]
    - [266, 9783.36]
  - - [112, 111, 576, 64]
    - [297, 5627.37]
  - - [1024, 3513, 1, 4096]
    - [285, 8725.31]
  - - [1024, 3469, 1, 4096]
    - [265, 8183.01]
  - - [1024, 3095, 1, 4096]
    - [286, 7887.77]
  - - [4096, 3533, 1, 1024]
    - [265, 9755.17]
  - - [4096, 3390, 1, 1024]
    - [264, 9377.11]
  - - [4096, 3582, 1, 1024]
    - [264, 9874.86]
  - - [1024, 3956, 1, 1024]
    - [270, 9058.72]
  - - [4096, 3585, 1, 1024]
    - [266, 9289.65]
  - - [4096, 3231, 1, 1024]
    - [265, 9597.05]
  - - [1024, 3205, 1, 4096]
    - [284, 8073.15]
  - - [4096, 3496, 1, 1024]
    - [265, 9668.28]
  - - [1024, 3143, 1, 4096]
    - [284, 8031.58]
  - - [1024, 3318, 1, 4096]
    - [281, 8261.33]
  - - [1024, 3353, 1, 4096]
    - [285, 8414.82]
  - - [1024, 3464, 1, 4096]
    - [284, 8309.93]
  - - [4096, 2736, 1, 1024]
    - [708, 8779.31]
  - - [1024, 3402, 1, 4096]
    - [281, 8413.74]
  - - [4096, 3138, 1, 1024]
    - [266, 9341.99]
  - - [1024, 3860, 1, 4096]
    - [269, 9008.47]
  - - [148, 148, 432, 64]
    - [310, 4915.6]
  - - [1024, 3539, 1, 4096]
    - [281, 8449.26]
  - - [4096, 3211, 1, 1024]
    - [266, 9551.18]
  - - [1024, 3332, 1, 4096]
    - [274, 8295.01]
  - - [1024, 3466, 1, 4096]
    - [285, 8339.15]
  - - [4096, 3475, 1, 1024]
    - [264, 9612.23]
  - - [4096, 3524, 1, 1024]
    - [267, 9722.64]
  - - [4096, 2985, 1, 1024]
    - [267, 9591.23]
  - - [4096, 3222, 1, 1024]
    - [264, 9577.38]
  - - [4096, 3451, 1, 1024]
    - [266, 9541.32]
  - - [1024, 3181, 1, 4096]
    - [284, 8118.79]
  - - [1024, 3640, 1, 4096]
    - [269, 8617.01]
  - - [1024, 3375, 1, 4096]
    - [273, 8419.65]
  - - [1024, 3550, 1, 4096]
    - [286, 8512.73]
  - - [1024, 4020, 1, 1024]
    - [270, 9266.8]
  - - [1024, 3840, 1, 4096]
    - [710, 8582.42]
  - - [4096, 3349, 1, 1024]
    - [264, 9279.86]
  - - [4096, 3398, 1, 1024]
    - [265, 9402.22]
  - - [33708, 3976, 1, 1024]
    - [266, 9849.44]
  - - [1024, 2917, 1, 4096]
    - [271, 8936.77]
  - - [33708, 3910, 1, 1024]
    - [264, 9983.25]
  - - [4096, 3860, 1, 1024]
    - [265, 9377.48]
  - - [4096, 3304, 1, 1024]
    - [267, 9798.34]
  - - [1024, 3286, 1, 4096]
    - [272, 8167.31]
  - - [1024, 3460, 1, 4096]
    - [282, 8539.46]
  - - [1024, 4026, 1, 4096]
    - [268, 9305.58]
  - - [4096, 3471, 1, 1024]
    - [266, 9596.61]
  - - [193, 193, 320, 64]
    - [313, 4758.36]
  - - [1024, 3894, 1, 1024]
    - [268, 8979.5]
  - - [65, 65, 992, 64]
    - [309, 2565.39]
  - - [1024, 3506, 1, 4096]
    - [282, 8593.12]
  - - [35, 35, 1808, 64]
    - [303, 2129.62]
  - - [1024, 4000, 1, 1024]
    - [268, 9204.5]
  - - [1024, 3900, 1, 4096]
    - [264, 9050.26]
  - - [1024, 3445, 1, 4096]
    - [287, 8551.55]
  - - [4096, 3442, 1, 1024]
    - [265, 9504.9]
  - - [1024, 3358, 1, 4096]
    - [286, 8437.06]
  - - [13, 13, 4672, 64]
    - [296, 860.565]
  - - [1024, 3211, 1, 4096]
    - [290, 8085.15]
  - - [4096, 3515, 1, 1024]
    - [266, 9715.19]
  - - [1024, 3564, 1, 4096]
    - [272, 8760.27]
  - - [4096, 3057, 1, 1024]
    - [266, 9803.95]
  - - [1024, 3343, 1, 4096]
    - [284, 8363.7]
  - - [4096, 3262, 1, 1024]
    - [265, 9686.39]
  - - [1024, 3518, 1, 4096]
    - [284, 8454.95]
  - - [77, 77, 816, 64]
    - [302, 3505.84]
  - - [33708, 3876, 1, 1024]
    - [265, 9895.85]
  - - [4096, 3462, 1, 1024]
    - [266, 9570.21]
  - - [1024, 3265, 1, 4096]
    - [284, 8322.65]
  - - [4096, 3389, 1, 1024]
    - [265, 9382.76]
  - - [4096, 3438, 1, 1024]
    - [266, 9503.37]
  - - [1024, 3955, 1, 1024]
    - [268, 9064.35]
  - - [1024, 3545, 1, 4096]
    - [287, 8652.31]
  - - [1024, 3144, 1, 4096]
    - [287, 8060.45]
  - - [1024, 3417, 1, 4096]
    - [285, 8505.81]
  - - [4096, 3543, 1, 1024]
    - [264, 9775.57]
  - - [4096, 3352, 1, 1024]
    - [266, 9282.77]
  - - [33708, 3975, 1, 1024]
    - [267, 9849.39]
  - - [148, 147, 432, 64]
    - [310, 4876.05]
  - - [4096, 3137, 1, 1024]
    - [264, 9330.53]
  - - [4096, 3506, 1, 1024]
    - [267, 9682.66]
  - - [1024, 3975, 1, 1024]
    - [270, 9164.67]
  - - [1024, 3859, 1, 4096]
    - [268, 8983.74]
  - - [4096, 3369, 1, 1024]
    - [266, 9330.35]
  - - [1024, 3434, 1, 4096]
    - [284, 8486.88]
  - - [1024, 3292, 1, 4096]
    - [284, 8478.86]
  - - [4096, 3523, 1, 1024]
    - [264, 9734.73]
  - - [4096, 3380, 1, 1024]
    - [266, 9354.39]
  - - [1024, 3408, 1, 4096]
    - [287, 8440.93]
  - - [4096, 3221, 1, 1024]
    - [266, 9575.49]
  - - [4096, 3270, 1, 1024]
    - [266, 9717.85]
  - - [143, 143, 432, 64]
    - [311, 4643.35]
  - - [111, 111, 576, 64]
    - [303, 5474.94]
  - - [1024, 3303, 1, 4096]
    - [286, 8412.97]
  - - [4096, 3502, 1, 1024]
    - [266, 9679.77]
  - - [1024, 3222, 1, 4096]
    - [286, 8141.78]
  - - [4096, 2505, 1, 1024]
    - [264, 9594.85]
  - - [4096, 3397, 1, 1024]
    - [264, 9392.51]
  - - [4096, 3562, 1, 1024]
    - [264, 9827.48]
  - - [4096, 3095, 1, 1024]
    - [266, 9222.35]
  - - [1024, 3226, 1, 4096]
    - [282, 8026.93]
  - - [177, 177, 352, 64]
    - [298, 6406.86]
  - - [4096, 3360, 1, 1024]
    - [718, 9201.37]
  - - [1024, 3942, 1, 1024]
    - [270, 9061.49]
  - - [1024, 3298, 1, 4096]
    - [287, 8254.26]
  - - [1024, 3381, 1, 4096]
    - [286, 8508.71]
  - - [4096, 3314, 1, 1024]
    - [266, 9837.46]
  - - [1024, 3492, 1, 4096]
    - [274, 8583.29]
  - - [1024, 3430, 1, 4096]
    - [274, 8492.61]
  - - [4096, 3977, 1, 1024]
    - [266, 9656.35]
  - - [4096, 3546, 1, 1024]
    - [264, 9780.25]
  - - [4096, 3640, 1, 1024]
    - [264, 9415.41]
  - - [4096, 3441, 1, 1024]
    - [265, 9499.14]
  - - [33708, 4059, 1, 1024]
    - [267, 10051.8]
  - - [1024, 3978, 1, 1024]
    - [268, 9158.7]
  - - [1024, 3376, 1, 4096]
    - [286, 8415.34]
  - - [1024, 3482, 1, 4096]
    - [287, 8396.52]
  - - [1024, 3563, 1, 4096]
    - [270, 8424.08]
  - - [4096, 4020, 1, 1024]
    - [267, 9745.86]
  - - [1024, 3271, 1, 4096]
    - [285, 8289.58]
  - - [1024, 3291, 1, 4096]
    - [285, 8222.61]
  - - [1024, 3431, 1, 4096]
    - [280, 8464.3]
  - - [1024, 3481, 1, 4096]
    - [286, 8386.4]
  - - [84, 85, 752, 64]
    - [300, 4194.75]
  - - [4096, 3461, 1, 1024]
    - [264, 9579.57]
  - - [1024, 3574, 1, 4096]
    - [287, 8579.7]
  - - [1024, 4059, 1, 1024]
    - [268, 9330.44]
  - - [84, 84, 752, 64]
    - [307, 4141.36]
  - - [1024, 3421, 1, 4096]
    - [287, 8528.32]
  - - [4096, 3224, 1, 1024]
    - [707, 9588.19]
  - - [4096, 3437, 1, 1024]
    - [266, 9498.1]
  - - [45, 45, 1424, 64]
    - [297, 3314.48]
  - - [4096, 3840, 1, 1024]
    - [712, 9061.81]
  - - [4096, 3168, 1, 1024]
    - [712, 9525.95]
  - - [33708, 3990, 1, 1024]
    - [264, 9884.29]
  - - [1024, 3349, 1, 4096]
    - [286, 8421.3]
  - - [4096, 3335, 1, 1024]
    - [264, 9241.55]
  - - [4096, 3400, 1, 1024]
    - [707, 10024.6]
  - - [160, 159, 400, 64]
    - [312, 5708.84]
  - - [1024, 3398, 1, 4096]
    - [286, 8623.93]
  - - [1024, 3780, 1, 4096]
    - [266, 8756.68]
  - - [29, 29, 2176, 64]
    - [308, 2963.59]
  - - [4096, 3098, 1, 1024]
    - [264, 9229.72]
  - - [1024, 4012, 1, 4096]
    - [270, 9421.93]
  - - [4096, 3505, 1, 1024]
    - [266, 9687.55]
  - - [4096, 3554, 1, 1024]
    - [266, 9812.12]
  - - [4096, 3063, 1, 1024]
    - [266, 9825.0]
  - - [1024, 3503, 1, 4096]
    - [284, 8404.64]
  - - [1024, 3166, 1, 4096]
    - [287, 8084.83]
  - - [1024, 3425, 1, 4096]
    - [287, 8537.48]
  - - [1024, 3344, 1, 4096]
    - [707, 8759.5]
  - - [4096, 3484, 1, 1024]
    - [266, 9635.6]
  - - [1024, 3681, 1, 1024]
    - [269, 8457.08]
  - - [1024, 4050, 1, 1024]
    - [270, 9326.11]
  - - [4096, 3379, 1, 1024]
    - [264, 9356.06]
  - - [4096, 3428, 1, 1024]
    - [265, 9472.23]
  - - [12, 12, 5040, 64]
    - [302, 741.517]
  - - [27, 27, 2336, 64]
    - [308, 2757.8]
  - - [1024, 3304, 1, 4096]
    - [287, 8317.72]
  - - [1024, 3387, 1, 4096]
    - [285, 8460.05]
  - - [4096, 3126, 1, 1024]
    - [267, 9308.38]
  - - [1024, 3498, 1, 4096]
    - [284, 8485.45]
  - - [1024, 3436, 1, 4096]
    - [286, 8397.61]
  - - [4096, 3501, 1, 1024]
    - [264, 9681.09]
  - - [4096, 3358, 1, 1024]
    - [266, 9304.8]
  - - [4096, 3232, 1, 1024]
    - [264, 9607.1]
  - - [1024, 3585, 1, 4096]
    - [268, 8510.64]
  - - [4096, 3143, 1, 1024]
    - [267, 9355.81]
  - - [4096, 3464, 1, 1024]
    - [266, 9585.85]
  - - [1024, 3366, 1, 4096]
    - [274, 8275.13]
  - - [4096, 3375, 1, 1024]
    - [264, 9342.03]
  - - [4096, 2917, 1, 1024]
    - [264, 9372.74]
  - - [4096, 4026, 1, 1024]
    - [266, 9759.05]
  - - [49, 49, 1296, 64]
    - [304, 3709.92]
  - - [1024, 3277, 1, 4096]
    - [285, 8217.0]
  - - [1024, 3103, 1, 4096]
    - [286, 7872.57]
  - - [33708, 3995, 1, 1024]
    - [266, 9892.98]
  - - [1024, 3297, 1, 4096]
    - [285, 8185.72]
  - - [4096, 3545, 1, 1024]
    - [266, 9789.33]
  - - [1024, 3399, 1, 4096]
    - [285, 8377.08]
  - - [33708, 3796, 1, 1024]
    - [265, 10007.9]
  - - [4096, 3292, 1, 1024]
    - [266, 9767.18]
  - - [71, 71, 896, 64]
    - [299, 3006.15]
  - - [33708, 3859, 1, 1024]
    - [267, 9860.27]
  - - [4096, 3566, 1, 1024]
    - [266, 9834.37]
  - - [4096, 3894, 1, 1024]
    - [264, 9456.57]
  - - [4096, 3492, 1, 1024]
    - [264, 9653.14]
  - - [1024, 3977, 1, 1024]
    - [270, 9161.23]
  - - [1024, 3272, 1, 4096]
    - [287, 8256.99]
  - - [135, 134, 480, 64]
    - [310, 4238.29]
  - - [1024, 3355, 1, 4096]
    - [285, 8374.54]
  - - [4096, 3419, 1, 1024]
    - [267, 9455.34]
  - - [1024, 3404, 1, 4096]
    - [286, 8580.18]
  - - [4096, 3999, 1, 1024]
    - [266, 9701.68]
  - - [4096, 3166, 1, 1024]
    - [264, 9410.38]
  - - [33708, 3840, 1, 1024]
    - [267, 10132.8]
  - - [4096, 4032, 1, 1024]
    - [707, 10533.3]
  - - [1024, 3573, 1, 4096]
    - [285, 8603.3]
  - - [4096, 3366, 1, 1024]
    - [267, 9322.53]
  - - [1024, 3541, 1, 4096]
    - [287, 8405.8]
  - - [4096, 3207, 1, 1024]
    - [264, 9544.15]
  - - [4096, 3272, 1, 1024]
    - [266, 9716.63]
  - - [1024, 3334, 1, 4096]
    - [284, 8241.29]
  - - [228, 228, 272, 64]
    - [298, 6232.35]
  - - [4096, 3183, 1, 1024]
    - [266, 9452.34]
  - - [4096, 3536, 1, 1024]
    - [707, 9772.17]
  - - [1024, 4005, 1, 1024]
    - [269, 9225.73]
  - - [1024, 3245, 1, 4096]
    - [286, 8074.21]
  - - [4096, 3447, 1, 1024]
    - [265, 9525.74]
  - - [1024, 3183, 1, 4096]
    - [285, 8121.52]
  - - [1024, 3361, 1, 4096]
    - [287, 8285.76]
  - - [33708, 3870, 1, 1024]
    - [265, 9879.25]
  - - [1024, 3321, 1, 4096]
    - [286, 8408.57]
  - - [1024, 3968, 1, 1024]
    - [268, 9201.95]
  - - [1024, 3486, 1, 4096]
    - [282, 8258.79]
  - - [4096, 4005, 1, 1024]
    - [266, 9723.88]
  - - [4096, 3410, 1, 1024]
    - [267, 9440.4]
  - - [1024, 3944, 1, 1024]
    - [270, 9040.72]
  - - [4096, 3300, 1, 1024]
    - [265, 9789.8]
  - - [4096, 3579, 1, 1024]
    - [267, 9859.34]
  - - [4096, 3483, 1, 1024]
    - [267, 9624.21]
  - - [4096, 3532, 1, 1024]
    - [266, 9742.66]
  - - [1024, 3140, 1, 4096]
    - [286, 7899.55]
  - - [1024, 3372, 1, 4096]
    - [284, 8236.97]
  - - [1024, 3224, 1, 4096]
    - [716, 8693.17]
  - - [4096, 3230, 1, 1024]
    - [266, 9601.15]
  - - [4096, 3427, 1, 1024]
    - [266, 9466.47]
  - - [1024, 3796, 1, 1024]
    - [270, 8739.68]
  - - [143, 148, 432, 64]
    - [310, 4761.9]
  - - [1024, 3616, 1, 4096]
    - [269, 8445.79]
  - - [1024, 3315, 1, 4096]
    - [286, 8403.11]
  - - [1024, 3476, 1, 4096]
    - [284, 8523.58]
  - - [1024, 3509, 1, 4096]
    - [284, 8344.95]
  - - [4096, 3357, 1, 1024]
    - [266, 9300.06]
  - - [4096, 3406, 1, 1024]
    - [266, 9427.34]
  - - [1024, 3558, 1, 4096]
    - [285, 8525.68]
  - - [4096, 3593, 1, 1024]
    - [266, 9302.1]
  - - [4096, 3247, 1, 1024]
    - [266, 9648.4]
  - - [4096, 3088, 1, 1024]
    - [266, 9204.11]
  - - [1024, 3213, 1, 4096]
    - [284, 8054.21]
  - - [4096, 3511, 1, 1024]
    - [264, 9702.6]
  - - [122, 122, 528, 64]
    - [304, 6293.29]
  - - [1024, 3365, 1, 4096]
    - [281, 8413.52]
  - - [1024, 3504, 1, 4096]
    - [283, 8414.36]
  - - [1024, 3442, 1, 4096]
    - [286, 8683.9]
  - - [4096, 3474, 1, 1024]
    - [264, 9611.5]
  - - [4096, 2984, 1, 1024]
    - [265, 9592.72]
  - - [1024, 3876, 1, 4096]
    - [268, 9085.85]
  - - [4096, 3337, 1, 1024]
    - [266, 9246.12]
  - - [4096, 3450, 1, 1024]
    - [266, 9534.53]
  - - [1024, 3547, 1, 4096]
    - [286, 8386.63]
  - - [4096, 3291, 1, 1024]
    - [265, 9759.24]
  - - [1024, 3340, 1, 4096]
    - [285, 8237.87]
  - - [4096, 3491, 1, 1024]
    - [266, 9656.49]
  - - [4096, 3348, 1, 1024]
    - [266, 9279.05]
  - - [78, 78, 816, 64]
    - [305, 3590.99]
  - - [4096, 3968, 1, 1024]
    - [267, 9642.09]
  - - [4096, 3906, 1, 1024]
    - [267, 9485.27]
  - - [1024, 3477, 1, 4096]
    - [274, 8389.1]
  - - [1024, 3397, 1, 4096]
    - [284, 8556.78]
  - - [4096, 3165, 1, 1024]
    - [265, 9415.42]
  - - [4096, 3470, 1, 1024]
    - [264, 9598.4]
  - - [1024, 3526, 1, 4096]
    - [284, 8442.05]
  - - [112, 112, 576, 64]
    - [298, 5672.5]
  - - [4096, 3365, 1, 1024]
    - [264, 9321.73]
  - - [4096, 3319, 1, 1024]
    - [264, 9838.38]
  - - [1024, 3401, 1, 4096]
    - [286, 8460.76]
  - - [1024, 3294, 1, 4096]
    - [285, 8324.53]
  - - [159, 159, 400, 64]
    - [300, 5488.41]
  - - [1024, 3472, 1, 4096]
    - [279, 8289.67]
  - - [4096, 3328, 1, 1024]
    - [712, 8995.81]
  - - [1024, 3861, 1, 1024]
    - [270, 8917.53]
  - - [1024, 3910, 1, 1024]
    - [268, 9010.06]
  - - [1024, 3410, 1, 4096]
    - [286, 8519.53]
  - - [1024, 3395, 1, 4096]
    - [284, 8424.25]
  - - [4096, 3282, 1, 1024]
    - [264, 9743.57]
  - - [1024, 3751, 1, 1024]
    - [271, 8680.29]
  - - [4096, 3145, 1, 1024]
    - [266, 9353.27]
  - - [4096, 3514, 1, 1024]
    - [266, 9712.94]
  - - [4096, 3944, 1, 1024]
    - [266, 9563.82]
  - - [1024, 3515, 1, 4096]
    - [285, 8428.03]
  - - [4096, 3409, 1, 1024]
    - [265, 9428.67]
  - - [4096, 3564, 1, 1024]
    - [264, 9823.69]
  - - [4096, 3299, 1, 1024]
    - [266, 9792.93]
  - - [1024, 3057, 1, 4096]
    - [262, 9237.75]
  - - [4096, 3531, 1, 1024]
    - [264, 9745.54]
  - - [4096, 3388, 1, 1024]
    - [266, 9374.55]
  - - [1024, 3189, 1, 4096]
    - [286, 8084.5]
  - - [1024, 3300, 1, 4096]
    - [286, 8185.03]
  - - [1024, 3720, 1, 4096]
    - [265, 8755.01]
  - - [1024, 3383, 1, 4096]
    - [279, 8463.37]
  - - [1024, 3494, 1, 4096]
    - [286, 8676.47]
  - - [77, 78, 816, 64]
    - [301, 3548.16]
  - - [1024, 3448, 1, 4096]
    - [284, 8665.68]
  - - [4096, 3542, 1, 1024]
    - [264, 9771.78]
  - - [1024, 3488, 1, 4096]
    - [284, 8488.29]
  - - [4096, 3405, 1, 1024]
    - [266, 9426.06]
  - - [1024, 3262, 1, 4096]
    - [286, 8206.87]
  - - [33708, 4005, 1, 1024]
    - [267, 9928.06]
  - - [1024, 3594, 1, 4096]
    - [271, 8458.47]
  - - [4096, 3103, 1, 1024]
    - [267, 9243.04]
  - - [4096, 3136, 1, 1024]
    - [266, 9340.8]
  - - [1024, 3378, 1, 4096]
    - [287, 8432.35]
  - - [10, 10, 5952, 64]
    - [306, 523.253]
  - - [7, 7, 8192, 64]
    - [306, 260.443]
  - - [4096, 3559, 1, 1024]
    - [266, 9813.0]
  - - [4096, 3368, 1, 1024]
    - [267, 9328.56]
  - - [4096, 3209, 1, 1024]
    - [264, 9538.73]
  - - [4096, 3322, 1, 1024]
    - [266, 9839.48]
  - - [1024, 3483, 1, 4096]
    - [272, 8348.25]
  - - [4096, 3473, 1, 1024]
    - [265, 9605.69]
  - - [4096, 3522, 1, 1024]
    - [267, 9729.92]
  - - [1024, 3532, 1, 4096]
    - [285, 8474.22]
  - - [4096, 3449, 1, 1024]
    - [266, 9528.25]
  - - [1024, 3351, 1, 4096]
    - [287, 8311.13]
  - - [1024, 3462, 1, 4096]
    - [284, 8297.54]
  - - [4096, 3396, 1, 1024]
    - [266, 9400.15]
  - - [132, 132, 480, 64]
    - [311, 4089.74]
  - - [111, 112, 576, 64]
    - [297, 5529.6]
  - - [1024, 3416, 1, 4096]
    - [285, 8556.54]
  - - [4096, 3469, 1, 1024]
    - [267, 9598.67]
  - - [1024, 3582, 1, 4096]
    - [268, 8461.37]
  - - [1024, 3230, 1, 4096]
    - [285, 8188.84]
  - - [1024, 3489, 1, 4096]
    - [286, 8457.75]
  - - [1024, 3427, 1, 4096]
    - [286, 8566.49]
  - - [1024, 3346, 1, 4096]
    - [285, 8352.07]
  - - [33708, 3977, 1, 1024]
    - [267, 9868.4]
  - - [4096, 3796, 1, 1024]
    - [266, 9797.66]
  - - [4096, 3176, 1, 1024]
    - [266, 9435.29]
  - - [4096, 3990, 1, 1024]
    - [264, 9672.23]
  - - [1024, 3257, 1, 4096]
    - [287, 8225.07]
  - - [4096, 3343, 1, 1024]
    - [288, 9273.52]
  - - [4096, 3440, 1, 1024]
    - [264, 9501.38]
  - - [33708, 4030, 1, 1024]
    - [265, 9983.26]
  - - [1024, 3190, 1, 4096]
    - [286, 8192.01]
  - - [1024, 3389, 1, 4096]
    - [287, 8439.32]
  - - [1024, 3500, 1, 4096]
    - [285, 8556.02]
  - - [1024, 3471, 1, 4096]
    - [274, 8491.07]
  - - [1024, 3438, 1, 4096]
    - [287, 8567.85]
  - - [4096, 3513, 1, 1024]
    - [264, 9710.17]
  - - [1024, 3562, 1, 4096]
    - [279, 8608.84]
  - - [4096, 3616, 1, 1024]
    - [266, 9357.49]
  - - [4096, 3955, 1, 1024]
    - [265, 9589.61]
  - - [1024, 3441, 1, 4096]
    - [275, 8359.17]
  - - [1024, 3236, 1, 4096]
    - [289, 8022.5]
  - - [1024, 3524, 1, 4096]
    - [284, 8477.14]
  - - [4096, 3460, 1, 1024]
    - [264, 9581.86]
  - - [16, 16, 3840, 64]
    - [295, 1270.49]
  - - [92, 93, 688, 64]
    - [299, 4962.3]
  - - [1024, 3384, 1, 4096]
    - [707, 9516.63]
  - - [4096, 3387, 1, 1024]
    - [266, 9379.7]
  - - [4096, 3436, 1, 1024]
    - [264, 9491.83]
  - - [4096, 3277, 1, 1024]
    - [264, 9717.17]
  - - [1024, 3457, 1, 4096]
    - [284, 8279.12]
  - - [1024, 3999, 1, 4096]
    - [259, 9231.37]
  - - [1024, 4032, 1, 4096]
    - [710, 8875.32]
  - - [4096, 3541, 1, 1024]
    - [264, 9773.14]
  - - [4096, 3334, 1, 1024]
    - [264, 9242.69]
  - - [1024, 3393, 1, 4096]
    - [286, 8376.07]
  - - [17, 17, 3632, 64]
    - [307, 1425.67]
  - - [1024, 3411, 1, 4096]
    - [274, 8490.87]
  - - [1024, 3822, 1, 1024]
    - [271, 8773.34]
  - - [1024, 3593, 1, 4096]
    - [271, 8571.15]
  - - [33708, 3822, 1, 1024]
    - [265, 10056.7]
  - - [4096, 3504, 1, 1024]
    - [267, 9680.19]
  - - [1024, 3163, 1, 4096]
    - [286, 8014.33]
  - - [1024, 3357, 1, 4096]
    - [287, 8375.94]
  - - [1024, 3906, 1, 4096]
    - [268, 9108.12]
  - - [4096, 3415, 1, 1024]
    - [264, 9443.77]
  - - [1024, 3406, 1, 4096]
    - [287, 8451.54]
  - - [4096, 3321, 1, 1024]
    - [266, 9836.52]
  - - [4096, 3584, 1, 1024]
    - [707, 10624.5]
  - - [1024, 2736, 1, 4096]
    - [710, 8555.7]
  - - [1024, 3110, 1, 4096]
    - [287, 7889.19]
  - - [33708, 3999, 1, 1024]
    - [267, 9903.23]
  - - [1024, 3093, 1, 4096]
    - [285, 7919.25]
  - - [4096, 3378, 1, 1024]
    - [267, 9362.2]
  - - [1024, 3543, 1, 4096]
    - [281, 8438.06]
  - - [33708, 3925, 1, 1024]
    - [266, 10021.5]
  - - [1024, 3352, 1, 4096]
    - [287, 8333.72]
  - - [4096, 3780, 1, 1024]
    - [264, 9754.92]
  - - [1024, 3990, 1, 4096]
    - [261, 9250.92]
  - - [4096, 3500, 1, 1024]
    - [264, 9673.73]
  - - [4096, 3996, 1, 1024]
    - [265, 9694.4]
  - - [1024, 3247, 1, 4096]
    - [290, 8171.48]
  - - [4096, 3395, 1, 1024]
    - [266, 9391.94]
  - - [1024, 3169, 1, 4096]
    - [285, 7990.14]
  - - [1024, 3088, 1, 4096]
    - [285, 7890.26]
  - - [1024, 3584, 1, 4096]
    - [707, 10535.7]
  - - [4096, 3093, 1, 1024]
    - [266, 9224.78]
  - - [1024, 3538, 1, 4096]
    - [268, 8395.64]
  - - [1024, 3996, 1, 1024]
    - [269, 9208.23]
  - - [1024, 3581, 1, 4096]
    - [281, 8523.14]
  - - [4096, 3374, 1, 1024]
    - [266, 9342.71]
  - - [33708, 3751, 1, 1024]
    - [266, 9881.89]
  - - [59, 59, 1088, 64]
    - [303, 4515.44]
  - - [4096, 3215, 1, 1024]
    - [266, 9557.65]
  - - [4096, 3312, 1, 1024]
    - [264, 9834.3]
  - - [4096, 3581, 1, 1024]
    - [266, 9856.56]
  - - [4096, 3479, 1, 1024]
    - [266, 9620.25]
  - - [4096, 3544, 1, 1024]
    - [264, 9778.84]
  - - [1024, 3870, 1, 1024]
    - [269, 8935.16]
  - - [1024, 3374, 1, 4096]
    - [286, 8412.75]
  - - [1024, 2967, 1, 4096]
    - [269, 8982.87]
  - - [41, 41, 1552, 64]
    - [297, 2805.28]
  - - [4096, 3455, 1, 1024]
    - [264, 9538.79]
  - - [4096, 3942, 1, 1024]
    - [265, 9554.55]
  - - [1024, 3528, 1, 4096]
    - [707, 9262.77]
  - - [4096, 3186, 1, 1024]
    - [265, 9468.22]
  - - [1024, 3976, 1, 1024]
    - [269, 9166.98]
  - - [1024, 3511, 1, 4096]
    - [271, 8334.96]
  - - [4096, 3573, 1, 1024]
    - [264, 9855.23]
  - - [4096, 3561, 1, 1024]
    - [264, 9830.93]
  - - [4096, 3418, 1, 1024]
    - [265, 9450.58]
  - - [33708, 3906, 1, 1024]
    - [267, 9973.57]
  - - [4096, 3259, 1, 1024]
    - [264, 9685.16]
  - - [4096, 3308, 1, 1024]
    - [266, 9791.93]
  - - [1024, 3419, 1, 4096]
    - [286, 8514.43]
  - - [1024, 3215, 1, 4096]
    - [285, 8137.43]
  - - [1024, 4030, 1, 4096]
    - [267, 9290.66]
  - - [4096, 3459, 1, 1024]
    - [264, 9567.47]
  - - [1024, 3572, 1, 4096]
    - [284, 8501.33]
  - - [1024, 3137, 1, 4096]
    - [286, 7930.05]
  - - [1024, 3312, 1, 4096]
    - [287, 8378.5]
  - - [1024, 3925, 1, 4096]
    - [269, 9255.76]
  - - [1024, 3453, 1, 4096]
    - [286, 8630.66]
  - - [4096, 3435, 1, 1024]
    - [265, 9495.08]
  - - [1024, 3176, 1, 4096]
    - [286, 8087.13]
  - - [1024, 3444, 1, 4096]
    - [278, 8528.48]
  - - [4096, 3975, 1, 1024]
    - [267, 9645.24]
  - - [4096, 3182, 1, 1024]
    - [266, 9448.3]
  - - [1024, 3475, 1, 4096]
    - [285, 8404.77]
  - - [9, 9, 6544, 64]
    - [299, 425.754]
  - - [33708, 3955, 1, 1024]
    - [267, 10088.3]
  - - [4096, 3446, 1, 1024]
    - [266, 9519.96]
  - - [1024, 3138, 1, 4096]
    - [285, 8053.34]
  - - [1024, 3549, 1, 4096]
    - [271, 8426.32]
  - - [4096, 3287, 1, 1024]
    - [267, 9751.24]
  - - [1024, 3342, 1, 4096]
    - [284, 8319.91]
  - - [102, 102, 624, 64]
    - [298, 4747.42]
  - - [4096, 3519, 1, 1024]
    - [266, 9716.0]
  - - [4096, 3552, 1, 1024]
    - [264, 9806.59]
  - - [4096, 3859, 1, 1024]
    - [264, 9369.84]
  - - [33708, 3969, 1, 1024]
    - [264, 9830.29]
  - - [1024, 3369, 1, 4096]
    - [285, 8379.16]
  - - [4096, 3482, 1, 1024]
    - [264, 9631.6]
  - - [1024, 3306, 1, 4096]
    - [287, 8319.96]
  - - [1024, 3474, 1, 4096]
    - [286, 8498.8]
  - - [99, 99, 624, 64]
    - [297, 4492.8]
  - - [4096, 3377, 1, 1024]
    - [264, 9369.82]
  - - [4096, 3426, 1, 1024]
    - [264, 9467.2]
  - - [4096, 2935, 1, 1024]
    - [265, 9423.64]
  - - [4096, 3267, 1, 1024]
    - [264, 9697.94]
  - - [1024, 3299, 1, 4096]
    - [285, 8264.66]
  - - [1024, 3456, 1, 4096]
    - [707, 9530.99]
  - - [1024, 3280, 1, 4096]
    - [285, 8220.59]
  - - [1024, 3555, 1, 4096]
    - [284, 8656.17]
  - - [4096, 3499, 1, 1024]
    - [266, 9663.83]
  - - [4096, 3356, 1, 1024]
    - [266, 9296.8]
  - - [100, 102, 624, 64]
    - [298, 4671.41]
  - - [1024, 3412, 1, 4096]
    - [287, 8537.95]
  - - [1024, 2984, 1, 4096]
    - [270, 9193.07]
  - - [4096, 3141, 1, 1024]
    - [266, 9349.33]
  - - [4096, 3510, 1, 1024]
    - [264, 9701.88]
  - - [1024, 3995, 1, 1024]
    - [268, 9243.3]
  - - [1024, 3517, 1, 4096]
    - [286, 8569.21]
  - - [1024, 3455, 1, 4096]
    - [286, 8560.57]
  - - [1024, 3939, 1, 1024]
    - [269, 9030.84]
  - - [38, 38, 1680, 64]
    - [297, 2459.74]
  - - [1024, 3447, 1, 4096]
    - [284, 8609.92]
  - - [1024, 3969, 1, 4096]
    - [271, 9097.23]
  - - [4096, 3527, 1, 1024]
    - [266, 9743.73]
  - - [4096, 3336, 1, 1024]
    - [266, 9248.23]
  - - [1024, 3191, 1, 4096]
    - [284, 8104.86]
  - - [1024, 3302, 1, 4096]
    - [285, 8244.99]
  - - [1024, 3337, 1, 4096]
    - [287, 8254.15]
  - - [4096, 3290, 1, 1024]
    - [266, 9759.03]
  - - [1024, 3512, 1, 4096]
    - [275, 8640.96]
  - - [1024, 3433, 1, 4096]
    - [285, 8444.6]
  - - [4096, 3876, 1, 1024]
    - [265, 9420.28]
  - - [4096, 3490, 1, 1024]
    - [266, 9641.01]
  - - [4096, 3064, 1, 1024]
    - [266, 9820.39]
  - - [1024, 3508, 1, 4096]
    - [281, 8442.14]
  - - [1024, 3956, 1, 4096]
    - [266, 9128.09]
  - - [4096, 3417, 1, 1024]
    - [266, 9448.31]
  - - [1024, 3248, 1, 4096]
    - [285, 8006.06]
  - - [1024, 2499, 1, 4096]
    - [285, 8155.09]
  - - [1024, 3186, 1, 4096]
    - [285, 8092.94]
  - - [1024, 3180, 1, 4096]
    - [287, 8096.92]
  - - [4096, 3364, 1, 1024]
    - [266, 9317.98]
  - - [4096, 3976, 1, 1024]
    - [266, 9654.37]
  - - [4096, 3205, 1, 1024]
    - [267, 9538.74]
  - - [4096, 3318, 1, 1024]
    - [264, 9838.19]
  - - [1024, 3377, 1, 4096]
    - [287, 8445.54]
  - - [1024, 3485, 1, 4096]
    - [284, 8368.73]
  - - [4096, 3181, 1, 1024]
    - [267, 9458.19]
  - - [4096, 3550, 1, 1024]
    - [264, 9783.04]
  - - [1024, 3534, 1, 4096]
    - [273, 8684.89]
  - - [1024, 3860, 1, 1024]
    - [268, 8923.08]
  - - [160, 160, 400, 64]
    - [310, 5797.59]
  - - [4096, 3445, 1, 1024]
    - [266, 9511.18]
  - - [1024, 3391, 1, 4096]
    - [287, 8541.67]
  - - [1024, 3221, 1, 4096]
    - [285, 8055.4]
  - - [4096, 3079, 1, 1024]
    - [264, 9180.94]
  - - [4096, 3144, 1, 1024]
    - [266, 9351.35]
  - - [1024, 3270, 1, 4096]
    - [286, 8367.53]
  - - [1024, 3561, 1, 4096]
    - [286, 8426.19]
  - - [1024, 3480, 1, 4096]
    - [273, 8464.9]
  - - [4096, 3408, 1, 1024]
    - [266, 9419.94]
  - - [1024, 3418, 1, 4096]
    - [287, 8480.92]
  - - [4096, 3298, 1, 1024]
    - [267, 9788.3]
  - - [1024, 3640, 1, 1024]
    - [270, 8435.34]
  - - [1024, 3449, 1, 4096]
    - [285, 8590.77]
  - - [1024, 4020, 1, 4096]
    - [263, 9168.03]
  - - [4096, 3481, 1, 1024]
    - [264, 9627.81]
  - - [4096, 3530, 1, 1024]
    - [266, 9734.58]
  - - [1024, 3216, 1, 4096]
    - [287, 8014.22]
  - - [1024, 3840, 1, 1024]
    - [712, 8939.88]
  - - [1024, 3491, 1, 4096]
    - [273, 8410.49]
  - - [1024, 3154, 1, 4096]
    - [286, 8095.59]
  - - [4096, 3425, 1, 1024]
    - [266, 9474.43]
  - - [1024, 3348, 1, 4096]
    - [284, 8202.8]
  - - [1024, 3415, 1, 4096]
    - [285, 8597.58]
  - - [1024, 4026, 1, 1024]
    - [268, 9278.99]
  - - [1024, 3367, 1, 4096]
    - [287, 8335.44]
  - - [1024, 3259, 1, 4096]
    - [287, 8285.2]
  - - [1024, 3894, 1, 4096]
    - [270, 9040.34]
  - - [4096, 3355, 1, 1024]
    - [265, 9291.57]
  - - [4096, 3404, 1, 1024]
    - [266, 9410.37]
  - - [1024, 3308, 1, 4096]
    - [287, 8336.2]
  - - [4096, 3245, 1, 1024]
    - [265, 9641.37]
  - - [1024, 3502, 1, 4096]
    - [286, 8375.8]
  - - [33708, 4032, 1, 1024]
    - [265, 9988.1]
  - - [8, 8, 7280, 64]
    - [301, 339.778]
  - - [1024, 3424, 1, 4096]
    - [273, 8489.38]
  - - [4096, 3509, 1, 1024]
    - [265, 9702.19]
  - - [4096, 3558, 1, 1024]
    - [266, 9815.41]
  - - [1024, 3900, 1, 1024]
    - [269, 9013.95]
  - - [1024, 2505, 1, 4096]
    - [283, 8263.65]
  - - [4096, 3472, 1, 1024]
    - [264, 9609.51]
  - - [1024, 3386, 1, 4096]
    - [284, 8417.45]
  - - [4096, 3383, 1, 1024]
    - [266, 9364.67]
  - - [4096, 3448, 1, 1024]
    - [267, 9520.97]
  - - [4096, 4030, 1, 1024]
    - [267, 9771.46]
  - - [4096, 3289, 1, 1024]
    - [264, 9757.17]
  - - [1024, 3459, 1, 4096]
    - [286, 8422.02]
  - - [1024, 2918, 1, 4096]
    - [271, 9022.61]
  - - [4096, 3489, 1, 1024]
    - [264, 9641.8]
  - - [4096, 3346, 1, 1024]
    - [266, 9271.55]
  - - [4096, 3572, 1, 1024]
    - [266, 9829.72]
  - - [1024, 3955, 1, 4096]
    - [267, 9221.56]
  - - [4096, 3236, 1, 1024]
    - [264, 9620.62]
  - - [4096, 3163, 1, 1024]
    - [264, 9397.2]
  - - [4096, 3468, 1, 1024]
    - [264, 9601.48]
  - - [1024, 3165, 1, 4096]
    - [286, 7941.48]
  - - [1024, 3276, 1, 4096]
    - [286, 8244.86]
  - - [1024, 3359, 1, 4096]
    - [284, 8273.83]
  - - [4096, 3363, 1, 1024]
    - [266, 9315.7]
  - - [1024, 3385, 1, 4096]
    - [278, 8286.1]
  - - [1024, 3207, 1, 4096]
    - [287, 8143.92]
  - - [1024, 3458, 1, 4096]
    - [286, 8472.31]
  - - [21, 21, 2976, 64]
    - [301, 2083.2]
  - - [4096, 3110, 1, 1024]
    - [264, 9260.2]
  - - [4096, 3925, 1, 1024]
    - [267, 9526.56]
  - - [1024, 3975, 1, 4096]
    - [262, 9133.74]
  - - [4096, 3549, 1, 1024]
    - [266, 9793.67]
  - - [4096, 3342, 1, 1024]
    - [265, 9264.38]
  - - [1024, 3859, 1, 1024]
    - [268, 8933.37]
  - - [1024, 3497, 1, 4096]
    - [285, 8526.03]
  - - [4096, 3280, 1, 1024]
    - [266, 9733.22]
  - - [1024, 3435, 1, 4096]
    - [285, 8489.75]
  - - [1024, 3354, 1, 4096]
    - [285, 8248.73]
  - - [4096, 3191, 1, 1024]
    - [265, 9475.02]
  - - [4096, 3512, 1, 1024]
    - [264, 9701.27]
  - - [1024, 3055, 1, 4096]
    - [271, 9264.81]
  - - [4096, 2499, 1, 1024]
    - [266, 9573.96]
  - - [1024, 3233, 1, 4096]
    - [284, 8101.64]
  - - [4096, 3423, 1, 1024]
    - [267, 9463.4]
  - - [1024, 3319, 1, 4096]
    - [287, 8413.66]
  - - [4096, 3297, 1, 1024]
    - [264, 9782.56]
  - - [4096, 3154, 1, 1024]
    - [266, 9381.1]
  - - [1024, 3540, 1, 4096]
    - [287, 8507.43]
  - - [1024, 3289, 1, 4096]
    - [287, 8233.7]
  - - [4096, 3529, 1, 1024]
    - [266, 9741.05]
  - - [4096, 3386, 1, 1024]
    - [266, 9372.47]
  - - [4096, 3276, 1, 1024]
    - [264, 9713.66]
  - - [1024, 3244, 1, 4096]
    - [287, 8146.73]
  - - [1024, 3182, 1, 4096]
    - [284, 8115.02]
  - - [4096, 3540, 1, 1024]
    - [264, 9768.32]
  - - [1024, 3360, 1, 4096]
    - [716, 9031.08]
  - - [1024, 3942, 1, 4096]
    - [265, 9143.68]
  - - [4096, 3403, 1, 1024]
    - [267, 9412.08]
  - - [4096, 3101, 1, 1024]
    - [267, 9239.18]
  - - [4096, 2918, 1, 1024]
    - [266, 9373.65]
  - - [1024, 3465, 1, 4096]
    - [287, 8288.06]
  - - [33708, 3780, 1, 1024]
    - [266, 9971.81]
  - - [4096, 3557, 1, 1024]
    - [264, 9814.72]
  - - [4096, 3414, 1, 1024]
    - [264, 9436.53]
  - - [1024, 3948, 1, 1024]
    - [268, 9073.7]
  - - [4096, 3320, 1, 1024]
    - [266, 9834.67]
  - - [4096, 2765, 1, 1024]
    - [266, 9666.96]
  - - [1024, 3978, 1, 4096]
    - [261, 9109.5]
  - - [4096, 3487, 1, 1024]
    - [264, 9643.9]
  - - [4096, 3520, 1, 1024]
    - [707, 10349.3]
  - - [1024, 3139, 1, 4096]
    - [286, 7940.09]
  - - [1024, 3314, 1, 4096]
    - [284, 8293.91]
  - - [4096, 3431, 1, 1024]
    - [266, 9482.02]
  - - [123, 122, 528, 64]
    - [298, 6325.88]
  - - [1024, 3446, 1, 4096]
    - [280, 8468.24]
  - - [1024, 4059, 1, 4096]
    - [267, 9370.7]
  - - [99, 102, 624, 64]
    - [298, 4624.7]
  - - [4096, 3345, 1, 1024]
    - [264, 9271.22]
  - - [4096, 3394, 1, 1024]
    - [264, 9398.09]
  - - [1024, 3927, 1, 1024]
    - [269, 9041.28]
  - - [4096, 3235, 1, 1024]
    - [264, 9619.83]
  - - [1024, 3328, 1, 4096]
    - [707, 9301.77]
  - - [33708, 3956, 1, 1024]
    - [265, 10100.3]
  - - [4096, 3467, 1, 1024]
    - [266, 9586.56]
  - - [1024, 3287, 1, 4096]
    - [286, 8273.73]
  - - [4096, 3214, 1, 1024]
    - [267, 9557.39]
  - - [4096, 3910, 1, 1024]
    - [264, 9490.15]
  - - [1024, 3780, 1, 1024]
    - [271, 8705.9]
  - - [1024, 3371, 1, 4096]
    - [287, 8248.36]
  - - [4096, 3478, 1, 1024]
    - [267, 9619.52]
  - - [1024, 3546, 1, 4096]
    - [285, 8456.73]
  - - [1024, 4012, 1, 1024]
    - [268, 9253.24]
  - - [4096, 3341, 1, 1024]
    - [266, 9260.14]
  - - [4096, 3454, 1, 1024]
    - [264, 9533.52]
  - - [4096, 3295, 1, 1024]
    - [267, 9772.76]
  - - [1024, 3282, 1, 4096]
    - [272, 8112.75]
  - - [33708, 3720, 1, 1024]
    - [267, 9818.75]
  - - [1024, 3681, 1, 4096]
    - [269, 8639.18]
  - - [1024, 4050, 1, 4096]
    - [267, 9291.83]
  - - [4096, 3495, 1, 1024]
    - [266, 9660.42]
  - - [4096, 3560, 1, 1024]
    - [265, 9813.7]
  - - [4096, 3751, 1, 1024]
    - [264, 9684.85]
  - - [1024, 3414, 1, 4096]
    - [285, 8555.62]
  - - [33708, 3860, 1, 1024]
    - [264, 9856.58]
  - - [1024, 3325, 1, 4096]
    - [274, 8261.11]
  - - [4096, 3458, 1, 1024]
    - [264, 9570.76]
  - - [4096, 2967, 1, 1024]
    - [264, 9544.51]
  - - [1024, 3519, 1, 4096]
    - [287, 8413.0]
  - - [4096, 3385, 1, 1024]
    - [266, 9367.24]
  - - [4096, 3434, 1, 1024]
    - [264, 9488.31]
  - - [1024, 3552, 1, 4096]
    - [285, 8456.03]
  - - [4096, 3822, 1, 1024]
    - [265, 9849.74]
  - - [1024, 3544, 1, 4096]
    - [284, 8494.46]
  - - [4096, 3539, 1, 1024]
    - [266, 9762.99]
  - - [4096, 3332, 1, 1024]
    - [264, 9232.26]
  - - [1024, 3145, 1, 4096]
    - [284, 8098.26]
  - - [1024, 3535, 1, 4096]
    - [272, 8592.7]
  - - [1024, 3320, 1, 4096]
    - [285, 8419.45]
  - - [33708, 4012, 1, 1024]
    - [267, 9940.1]
  - - [4096, 3286, 1, 1024]
    - [266, 9747.72]
  - - [1024, 3514, 1, 4096]
    - [285, 8653.59]
  - - [93, 93, 688, 64]
    - [305, 5005.69]
  - - [1024, 2765, 1, 4096]
    - [271, 8636.62]
  - - [1024, 3452, 1, 4096]
    - [284, 8445.77]
  - - [4096, 3518, 1, 1024]
    - [264, 9722.46]
  - - [1024, 3529, 1, 4096]
    - [284, 8444.22]
  - - [4096, 3413, 1, 1024]
    - [264, 9436.25]
  - - [33708, 4050, 1, 1024]
    - [266, 10026.6]
  - - [1024, 3525, 1, 4096]
    - [277, 8488.89]
  - - [4096, 3303, 1, 1024]
    - [264, 9790.95]
  - - [1024, 3382, 1, 4096]
    - [285, 8483.53]
  - - [1024, 3390, 1, 4096]
    - [284, 8552.71]
  - - [1024, 3977, 1, 4096]
    - [266, 9053.43]
  - - [1024, 3184, 1, 4096]
    - [284, 8008.71]
  - - [4096, 3535, 1, 1024]
    - [266, 9760.69]
  - - [4096, 3376, 1, 1024]
    - [267, 9341.83]
  - - [4096, 3978, 1, 1024]
    - [267, 9642.7]
  - - [1024, 3136, 1, 4096]
    - [286, 8085.02]
  - - [1024, 3293, 1, 4096]
    - [284, 8300.39]
  - - [4096, 3266, 1, 1024]
    - [265, 9691.68]
  - - [1024, 3487, 1, 4096]
    - [284, 8383.52]
  - - [1024, 3409, 1, 4096]
    - [286, 8493.15]
  - - [4096, 3498, 1, 1024]
    - [265, 9672.28]
  - - [1024, 3520, 1, 4096]
    - [707, 9765.54]
  - - [1024, 3530, 1, 4096]
    - [268, 8409.77]
  - - [4096, 3393, 1, 1024]
    - [266, 9395.33]
  - - [4096, 3140, 1, 1024]
    - [266, 9338.4]
  - - [1024, 3536, 1, 4096]
    - [707, 9818.77]
  - - [1024, 3288, 1, 4096]
    - [287, 8229.24]
  - - [1024, 4005, 1, 4096]
    - [269, 9270.94]
  - - [1024, 3579, 1, 4096]
    - [273, 8844.4]
  - - [4096, 3372, 1, 1024]
    - [264, 9339.15]
  - - [1024, 3440, 1, 4096]
    - [284, 8466.59]
  - - [4096, 3213, 1, 1024]
    - [267, 9558.75]
  - - [123, 123, 528, 64]
    - [298, 6333.49]
  - - [100, 100, 624, 64]
    - [297, 4584.02]
  - - [1024, 3968, 1, 4096]
    - [265, 9237.5]
  - - [4096, 3477, 1, 1024]
    - [265, 9618.78]
  - - [4096, 3526, 1, 1024]
    - [264, 9735.84]
  - - [1024, 3493, 1, 4096]
    - [285, 8355.03]
  - - [1024, 3944, 1, 4096]
    - [260, 9065.29]
  - - [4096, 3453, 1, 1024]
    - [265, 9533.27]
  - - [1024, 3350, 1, 4096]
    - [287, 8448.54]
  - - [4096, 3184, 1, 1024]
    - [266, 9447.28]
  - - [1024, 3423, 1, 4096]
    - [285, 8465.28]
  - - [4096, 3351, 1, 1024]
    - [264, 9281.96]
  - - [4096, 3416, 1, 1024]
    - [264, 9446.54]
  - - [1024, 3796, 1, 4096]
    - [266, 8820.24]
  - - [4096, 3257, 1, 1024]
    - [264, 9671.54]
  - - [4096, 3306, 1, 1024]
    - [266, 9795.41]
  - - [33708, 4020, 1, 1024]
    - [266, 9961.75]
  - - [19, 19, 3264, 64]
    - [295, 1735.99]
  - - [1024, 3426, 1, 4096]
    - [284, 8518.51]
  - - [4096, 3457, 1, 1024]
    - [264, 9564.46]
  - - [1024, 2935, 1, 4096]
    - [269, 9067.69]
  - - [1024, 3046, 1, 4096]
    - [269, 9242.87]
  - - [4096, 3433, 1, 1024]
    - [266, 9495.55]
  - - [1024, 3256, 1, 4096]
    - [287, 8224.13]
  - - [1024, 3531, 1, 4096]
    - [284, 8524.09]
  - - [4096, 3180, 1, 1024]
    - [264, 9443.43]
  - - [1024, 3388, 1, 4096]
    - [286, 8352.72]
  - - [4096, 3444, 1, 1024]
    - [267, 9510.93]
  - - [1024, 3501, 1, 4096]
    - [274, 8461.02]
  - - [1024, 3266, 1, 4096]
    - [272, 8147.34]
  - - [1024, 3267, 1, 4096]
    - [287, 8391.39]
  - - [1024, 3461, 1, 4096]
    - [271, 8270.19]
  - - [4096, 3870, 1, 1024]
    - [266, 9399.59]
  - - [4096, 3517, 1, 1024]
    - [264, 9725.33]
  - - [1024, 3566, 1, 4096]
    - [287, 8669.66]
  - - [4096, 3574, 1, 1024]
    - [264, 9844.53]
  - - [1024, 3876, 1, 1024]
    - [269, 8961.64]
  - - [25, 25, 2512, 64]
    - [294, 2472.44]
  - - [4096, 3720, 1, 1024]
    - [264, 9612.39]
  - - [4096, 3248, 1, 1024]
    - [266, 9644.82]
  - - [4096, 4059, 1, 1024]
    - [264, 9826.32]
  - - [1024, 3380, 1, 4096]
    - [285, 8677.81]
  - - [4096, 3480, 1, 1024]
    - [266, 9626.06]
  - - [1024, 3335, 1, 4096]
    - [286, 8302.08]
  - - [1024, 3345, 1, 4096]
    - [286, 8323.03]
  - - [4096, 3391, 1, 1024]
    - [264, 9379.38]
  - - [4096, 3424, 1, 1024]
    - [266, 9466.67]
  - - [1024, 3394, 1, 4096]
    - [272, 8373.81]
  - - [4096, 3265, 1, 1024]
    - [266, 9700.79]
  - - [1024, 3014, 1, 4096]
    - [269, 9302.99]
  - - [4096, 3497, 1, 1024]
    - [264, 9668.5]
  - - [4096, 3354, 1, 1024]
    - [266, 9294.21]
  - - [4096, 3055, 1, 1024]
    - [265, 9780.78]
  - - [1024, 3499, 1, 4096]
    - [278, 8526.94]
  - - [1024, 3162, 1, 4096]
    - [286, 8058.92]
  - - [4096, 3244, 1, 1024]
    - [266, 9636.76]
  - - [1024, 3437, 1, 4096]
    - [285, 8583.31]
  - - [1024, 3356, 1, 4096]
    - [287, 8296.85]
  - - [4096, 3139, 1, 1024]
    - [266, 9338.6]
  - - [4096, 3508, 1, 1024]
    - [266, 9700.44]
  - - [1024, 3235, 1, 4096]
    - [284, 8314.49]
  - - [1024, 3910, 1, 4096]
    - [271, 9200.11]
  - - [4096, 3371, 1, 1024]
    - [264, 9336.87]
  - - [1024, 3751, 1, 4096]
    - [271, 8827.57]
  - - [4096, 3325, 1, 1024]
    - [264, 9845.58]
  - - [1024, 3413, 1, 4096]
    - [272, 8345.68]
  - - [1024, 3542, 1, 4096]
    - [284, 8521.61]
  - - [18, 18, 3440, 64]
    - [299, 1578.14]
  - - [101, 102, 624, 64]
    - [297, 4705.18]
  - - [33708, 3900, 1, 1024]
    - [264, 9950.95]
  - - [4096, 3525, 1, 1024]
    - [265, 9744.37]
  - - [4096, 3382, 1, 1024]
    - [265, 9358.93]
  - - [102, 100, 624, 64]
    - [298, 4671.41]
  - - [15, 15, 4096, 64]
    - [302, 1129.07]
  - - [1024, 3339, 1, 4096]
    - [273, 8326.27]
  - - [4096, 3288, 1, 1024]
    - [266, 9761.38]
  - - [92, 92, 688, 64]
    - [305, 4903.77]
  - - [1024, 3141, 1, 4096]
    - [284, 7975.54]
  - - [1024, 3168, 1, 4096]
    - [707, 8900.62]
  - - [4096, 3488, 1, 1024]
    - [266, 9646.67]
  - - [4096, 3046, 1, 1024]
    - [265, 9767.48]
  - - [1024, 3362, 1, 4096]
    - [287, 8458.05]
  - - [33708, 3942, 1, 1024]
    - [265, 10060.3]
  - - [4096, 3399, 1, 1024]
    - [266, 9406.47]
  - - [1024, 3720, 1, 1024]
    - [268, 8639.06]
  - - [4096, 3563, 1, 1024]
    - [264, 9836.45]
  - - [1024, 3273, 1, 4096]
    - [287, 8221.52]
  - - [4096, 3162, 1, 1024]
    - [266, 9400.09]
  - - [1024, 3467, 1, 4096]
    - [285, 8342.32]
  - - [1024, 3130, 1, 4096]
    - [286, 7933.78]
  - - [1024, 3405, 1, 4096]
    - [292, 8406.49]
  - - [4096, 3362, 1, 1024]
    - [264, 9311.94]
  - - [1024, 3960, 1, 1024]
    - [710, 8795.87]
  - - [2048, 128, 1, 4096]
    - [317, 5986.52]
  - - [1024, 3712, 1, 36548]
    - [315, 9456.15]
  - - [1024, 128, 1, 1024]
    - [734, 3813.0]
  - - [3072, 128, 1, 4096]
    - [314, 6145.5]
  - - [1024, 3712, 1, 1024]
    - [316, 8933.88]
  - - [256, 256, 192, 64]
    - [318, 8264.64]
  - - [768, 4096, 1, 768]
    - [330, 9642.08]
  - - [768, 64, 1, 768]
    - [327, 1850.43]
  - - [768, 1280, 1, 768]
    - [330, 8738.13]
  - - [30522, 320, 1, 768]
    - [331, 9733.59]
  - - [128, 128, 96, 64]
    - [321, 5470.83]
  - - [2, 16, 1, 768]
    - [324, 2.47742]
  - - [30522, 1280, 1, 768]
    - [329, 10127.9]
  - - [30522, 640, 1, 768]
    - [330, 9987.61]
  - - [2, 8, 1, 768]
    - [323, 0.96]
  - - [768, 4096, 1, 3072]
    - [332, 9479.41]
  - - [768, 32, 1, 768]
    - [326, 880.334]
  - - [2, 64, 1, 768]
    - [324, 9.99024]
  - - [256, 256, 96, 64]
    - [318, 7614.47]
  - - [64, 64, 768, 64]
    - [320, 5354.43]
  - - [30522, 160, 1, 768]
    - [328, 7740.11]
  - - [768, 320, 1, 768]
    - [322, 5423.67]
  - - [128, 128, 384, 64]
    - [319, 7179.98]
  - - [768, 16, 1, 768]
    - [325, 706.376]
  - - [3072, 4096, 1, 768]
    - [333, 9961.74]
  - - [2048, 512, 1, 100]
    - [334, 5180.71]
  - - [1024, 200, 1, 560]
    - [335, 4061.19]
  - - [256, 1280, 1, 1024]
    - [341, 4337.44]
  - - [256, 44505, 1, 1024]
    - [377, 8597.69]
  - - [10240, 8976, 1, 256]
    - [380, 9471.43]
  - - [256, 7168, 1, 1024]
    - [371, 6718.56]
  - - [8448, 8976, 1, 256]
    - [363, 9601.31]
  - - [18944, 8976, 1, 256]
    - [372, 9666.26]
  - - [256, 19200, 1, 1024]
    - [348, 7488.94]
  - - [5632, 8976, 1, 256]
    - [360, 9358.39]
  - - [256, 23552, 1, 1024]
    - [375, 7980.89]
  - - [256, 6656, 1, 1024]
    - [375, 6287.22]
  - - [256, 14336, 1, 1024]
    - [370, 7049.26]
  - - [256, 12544, 1, 1024]
    - [348, 6728.47]
  - - [2048, 684, 1, 768]
    - [365, 8479.18]
  - - [5376, 8976, 1, 256]
    - [360, 9519.51]
  - - [256, 5888, 1, 1024]
    - [380, 6012.4]
  - - [19968, 8976, 1, 256]
    - [372, 9684.67]
  - - [3840, 8976, 1, 256]
    - [357, 9461.89]
  - - [4608, 8976, 1, 256]
    - [357, 9305.82]
  - - [256, 684, 1, 1024]
    - [383, 3513.06]
  - - [256, 22016, 1, 1024]
    - [348, 7643.79]
  - - [256, 23296, 1, 1024]
    - [377, 8048.12]
  - - [4864, 8976, 1, 256]
    - [355, 9545.62]
  - - [256, 7424, 1, 1024]
    - [373, 6770.65]
  - - [18176, 8976, 1, 256]
    - [380, 9729.47]
  - - [256, 15104, 1, 1024]
    - [369, 7289.08]
  - - [8192, 8976, 1, 256]
    - [372, 9395.49]
  - - [256, 16128, 1, 1024]
    - [372, 7461.28]
  - - [13312, 8976, 1, 256]
    - [380, 9550.97]
  - - [256, 21504, 1, 1024]
    - [377, 7635.93]
  - - [6400, 8976, 1, 256]
    - [364, 9560.96]
  - - [256, 8960, 1, 1024]
    - [339, 6292.36]
  - - [1792, 8976, 1, 256]
    - [354, 9372.18]
  - - [13824, 8976, 1, 256]
    - [372, 9585.27]
  - - [11776, 8976, 1, 256]
    - [372, 9560.34]
  - - [256, 20992, 1, 1024]
    - [370, 7490.65]
  - - [20480, 8976, 1, 256]
    - [380, 9610.7]
  - - [5888, 8976, 1, 256]
    - [351, 9565.2]
  - - [256, 10496, 1, 1024]
    - [342, 6631.96]
  - - [21248, 8976, 1, 256]
    - [372, 9755.77]
  - - [5120, 8976, 1, 256]
    - [380, 9244.59]
  - - [7168, 8976, 1, 256]
    - [372, 9388.42]
  - - [2048, 1536, 1, 768]
    - [361, 9446.04]
  - - [256, 8192, 1, 1024]
    - [366, 6948.89]
  - - [4096, 8976, 1, 256]
    - [371, 9115.94]
  - - [3328, 8976, 1, 256]
    - [364, 9434.55]
  - - [1280, 8976, 1, 256]
    - [362, 9129.8]
  - - [2560, 8976, 1, 256]
    - [359, 9199.48]
  - - [3072, 8976, 1, 256]
    - [374, 8963.6]
  - - [256, 11776, 1, 1024]
    - [352, 6869.8]
  - - [18688, 8976, 1, 256]
    - [380, 9726.21]
  - - [15104, 8976, 1, 256]
    - [380, 9715.71]
  - - [23552, 8976, 1, 256]
    - [372, 9648.42]
  - - [6144, 8976, 1, 256]
    - [380, 9339.8]
  - - [12544, 8976, 1, 256]
    - [380, 9654.45]
  - - [256, 11264, 1, 1024]
    - [353, 6814.98]
  - - [2048, 114, 1, 512]
    - [384, 4583.5]
  - - [4352, 8976, 1, 256]
    - [364, 9471.4]
  - - [15360, 8976, 1, 256]
    - [380, 9583.77]
  - - [256, 31488, 1, 1024]
    - [379, 8438.01]
  - - [28672, 8976, 1, 256]
    - [372, 9688.85]
  - - [256, 18176, 1, 1024]
    - [348, 7405.09]
  - - [9728, 8976, 1, 256]
    - [380, 9524.15]
  - - [256, 2816, 1, 1024]
    - [344, 5405.66]
  - - [256, 18944, 1, 1024]
    - [348, 7503.41]
  - - [256, 3584, 1, 1024]
    - [347, 6107.15]
  - - [7936, 8976, 1, 256]
    - [360, 9608.31]
  - - [19712, 8976, 1, 256]
    - [380, 9736.25]
  - - [256, 14848, 1, 1024]
    - [353, 7163.42]
  - - [256, 8448, 1, 1024]
    - [353, 6372.56]
  - - [256, 6400, 1, 1024]
    - [367, 6395.71]
  - - [256, 6144, 1, 1024]
    - [378, 6490.22]
  - - [9472, 8976, 1, 256]
    - [357, 9609.92]
  - - [256, 9984, 1, 1024]
    - [340, 6484.75]
  - - [684, 8976, 1, 256]
    - [349, 8128.53]
  - - [20992, 8976, 1, 256]
    - [372, 9689.65]
  - - [2048, 684, 1, 512]
    - [356, 7241.78]
  - - [2048, 114, 1, 768]
    - [382, 4872.46]
  - - [8960, 8976, 1, 256]
    - [355, 9603.35]
  - - [2048, 1536, 1, 512]
    - [358, 8830.11]
  - - [256, 3328, 1, 1024]
    - [346, 5612.55]
  - - [33536, 8976, 1, 256]
    - [372, 9797.71]
  - - [2048, 8976, 1, 256]
    - [372, 8975.46]
  - - [10496, 8976, 1, 256]
    - [363, 9654.43]
  - - [256, 5376, 1, 1024]
    - [381, 5626.34]
  - - [256, 21248, 1, 1024]
    - [350, 7525.45]
  - - [256, 13312, 1, 1024]
    - [348, 6767.11]
  - - [16128, 8976, 1, 256]
    - [372, 9715.57]
  - - [2304, 8976, 1, 256]
    - [345, 9433.83]
  - - [256, 4864, 1, 1024]
    - [336, 5743.55]
  - - [17152, 8976, 1, 256]
    - [380, 9708.94]
  - - [15872, 8976, 1, 256]
    - [380, 9657.57]
  - - [9984, 8976, 1, 256]
    - [357, 9639.74]
  - - [256, 14592, 1, 1024]
    - [369, 7223.92]
  - - [256, 33536, 1, 1024]
    - [376, 8147.31]
  - - [11264, 8976, 1, 256]
    - [372, 9509.96]
  - - [31488, 8976, 1, 256]
    - [380, 9799.31]
  - - [256, 20480, 1, 1024]
    - [353, 7498.2]
  - - [44505, 8976, 1, 256]
    - [364, 9804.78]
  - - [13568, 8976, 1, 256]
    - [372, 9680.24]
  - - [256, 11520, 1, 1024]
    - [352, 6805.26]
  - - [256, 7936, 1, 1024]
    - [368, 6971.77]
  - - [2048, 256, 1, 768]
    - [338, 7129.13]
  - - [256, 4608, 1, 1024]
    - [337, 5462.91]
  - - [256, 2304, 1, 1024]
    - [343, 4842.69]
  - - [256, 2560, 1, 1024]
    - [344, 5309.25]
  - - [2816, 8976, 1, 256]
    - [355, 9409.56]
  - - [1728, 320, 1, 64]
    - [390, 3205.57]
  - - [1152, 128, 1, 784]
    - [430, 3498.96]
  - - [576, 96, 1, 5329]
    - [417, 3947.92]
  - - [864, 96, 1, 1225]
    - [437, 3009.67]
  - - [256, 128, 1, 784]
    - [427, 1536.49]
  - - [1440, 320, 1, 196]
    - [387, 4824.62]
  - - [192, 48, 1, 1225]
    - [455, 820.465]
  - - [2592, 384, 1, 289]
    - [403, 7353.01]
  - - [192, 80, 36, 10368]
    - [446, 5360.04]
  - - [896, 192, 1, 289]
    - [416, 3076.56]
  - - [768, 128, 1, 289]
    - [440, 2351.81]
  - - [64, 256, 1, 3136]
    - [462, 1809.16]
  - - [1280, 384, 1, 64]
    - [387, 3171.1]
  - - [512, 144, 1, 196]
    - [438, 1445.07]
  - - [1344, 192, 1, 289]
    - [422, 4376.52]
  - - [288, 64, 1, 21609]
    - [432, 3396.12]
  - - [400, 32, 1, 784]
    - [456, 922.353]
  - - [288, 32, 1, 21609]
    - [464, 2816.01]
  - - [1280, 448, 1, 64]
    - [390, 3253.56]
  - - [3456, 256, 1, 169]
    - [400, 5822.44]
  - - [2304, 256, 1, 196]
    - [398, 4931.98]
  - - [384, 192, 1, 1225]
    - [441, 2720.39]
  - - [832, 48, 1, 49]
    - [436, 344.518]
  - - [832, 192, 1, 49]
    - [419, 1099.36]
  - - [1280, 192, 1, 64]
    - [420, 2069.56]
  - - [192, 32, 1, 784]
    - [455, 459.627]
  - - [288, 48, 1, 1225]
    - [461, 1176.0]
  - - [512, 112, 1, 196]
    - [433, 1277.21]
  - - [224, 192, 36, 2592]
    - [448, 7369.56]
  - - [528, 32, 1, 196]
    - [424, 440.374]
  - - [192, 128, 36, 1568]
    - [447, 8245.76]
  - - [4032, 384, 1, 64]
    - [399, 5898.24]
  - - [576, 64, 1, 3136]
    - [439, 2671.11]
  - - [2048, 32, 1, 1001]
    - [441, 2323.0]
  - - [480, 64, 1, 196]
    - [426, 752.64]
  - - [512, 256, 1, 196]
    - [428, 2528.55]
  - - [864, 96, 1, 289]
    - [438, 1958.4]
  - - [896, 128, 1, 289]
    - [441, 2725.73]
  - - [192, 64, 1, 784]
    - [453, 898.675]
  - - [1200, 64, 1, 1225]
    - [440, 2780.14]
  - - [1296, 288, 1, 196]
    - [386, 3826.18]
  - - [576, 96, 1, 5041]
    - [421, 3795.58]
  - - [1024, 256, 1, 289]
    - [412, 4488.13]
  - - [1024, 2048, 1, 49]
    - [404, 5077.1]
  - - [192, 64, 36, 6272]
    - [442, 7514.98]
  - - [4096, 512, 1, 4096]
    - [409, 10276.0]
  - - [192, 32, 1, 1225]
    - [456, 556.686]
  - - [1024, 256, 1, 196]
    - [420, 3892.44]
  - - [1120, 192, 1, 289]
    - [411, 3752.81]
  - - [400, 48, 1, 196]
    - [433, 480.0]
  - - [1728, 224, 1, 1225]
    - [393, 5575.77]
  - - [800, 96, 1, 784]
    - [440, 2668.94]
  - - [1152, 384, 1, 64]
    - [396, 3077.34]
  - - [4608, 512, 1, 49]
    - [402, 4676.6]
  - - [1792, 256, 1, 289]
    - [396, 5345.94]
  - - [864, 128, 1, 784]
    - [440, 3816.2]
  - - [1728, 384, 1, 169]
    - [397, 5191.68]
  - - [480, 16, 1, 196]
    - [458, 241.231]
  - - [1568, 256, 1, 289]
    - [387, 4723.41]
  - - [1152, 448, 1, 64]
    - [393, 3356.72]
  - - [512, 64, 1, 196]
    - [425, 802.816]
  - - [1344, 224, 1, 289]
    - [387, 3519.63]
  - - [9216, 512, 1, 4096]
    - [407, 9146.02]
  - - [27, 32, 1, 22201]
    - [465, 264.356]
  - - [1152, 192, 1, 784]
    - [413, 4904.08]
  - - [1536, 256, 1, 64]
    - [385, 2578.47]
  - - [800, 128, 1, 196]
    - [440, 1991.11]
  - - [800, 64, 1, 196]
    - [435, 1150.83]
  - - [864, 208, 1, 196]
    - [414, 2684.72]
  - - [1440, 320, 1, 49]
    - [388, 2313.44]
  - - [512, 128, 1, 784]
    - [431, 2780.32]
  - - [720, 192, 1, 5041]
    - [410, 5410.46]
  - - [256, 64, 1, 784]
    - [459, 1163.5]
  - - [256, 48, 1, 1225]
    - [455, 1075.2]
  - - [576, 192, 1, 3136]
    - [410, 4833.01]
  - - [160, 64, 1, 5329]
    - [457, 1753.5]
  - - [3456, 384, 1, 289]
    - [405, 7341.75]
  - - [32, 32, 36, 43808]
    - [451, 1378.03]
  - - [1344, 512, 1, 64]
    - [386, 3822.93]
  - - [192, 16, 1, 784]
    - [456, 228.073]
  - - [3456, 384, 1, 169]
    - [401, 6675.02]
  - - [1152, 256, 1, 196]
    - [395, 3211.26]
  - - [1728, 192, 1, 1225]
    - [396, 4852.26]
  - - [2048, 512, 1, 49]
    - [406, 3471.64]
  - - [576, 96, 1, 1225]
    - [433, 2176.66]
  - - [512, 2048, 1, 49]
    - [391, 3845.83]
  - - [1728, 192, 1, 64]
    - [386, 2369.83]
  - - [832, 256, 1, 49]
    - [412, 1433.6]
  - - [512, 128, 1, 196]
    - [434, 1459.67]
  - - [1200, 128, 1, 49]
    - [429, 1069.09]
  - - [528, 256, 1, 196]
    - [418, 2069.76]
  - - [256, 512, 1, 784]
    - [440, 4538.89]
  - - [480, 192, 1, 196]
    - [440, 1792.0]
  - - [96, 64, 36, 2592]
    - [445, 4845.41]
  - - [96, 96, 36, 2592]
    - [450, 5111.53]
  - - [1024, 192, 1, 289]
    - [415, 3431.14]
  - - [1536, 384, 1, 64]
    - [392, 3166.84]
  - - [192, 96, 1, 784]
    - [425, 881.14]
  - - [2048, 192, 1, 64]
    - [389, 2330.17]
  - - [192, 64, 1, 1225]
    - [460, 1100.35]
  - - [512, 32, 1, 196]
    - [452, 477.867]
  - - [128, 96, 36, 1568]
    - [449, 6649.09]
  - - [528, 128, 1, 196]
    - [437, 1403.23]
  - - [128, 512, 1, 784]
    - [427, 2237.81]
  - - [128, 128, 36, 3136]
    - [443, 6538.77]
  - - [528, 160, 1, 196]
    - [441, 1642.67]
  - - [448, 64, 1, 5329]
    - [417, 3264.81]
  - - [1280, 320, 1, 64]
    - [387, 2776.95]
  - - [1792, 320, 1, 289]
    - [397, 5204.9]
  - - [2880, 320, 1, 64]
    - [394, 4336.94]
  - - [147, 64, 1, 12544]
    - [463, 2430.27]
  - - [4096, 512, 1, 1001]
    - [408, 9618.99]
  - - [1536, 32, 1, 1001]
    - [441, 1757.18]
  - - [512, 160, 1, 196]
    - [437, 1592.89]
  - - [768, 160, 1, 289]
    - [438, 2757.17]
  - - [1728, 384, 1, 49]
    - [396, 3102.49]
  - - [64, 32, 36, 43808]
    - [444, 2626.43]
  - - [64, 64, 1, 3136]
    - [454, 610.506]
  - - [256, 32, 1, 784]
    - [455, 612.837]
  - - [480, 96, 1, 196]
    - [433, 1055.1]
  - - [1024, 32, 1, 1001]
    - [423, 1188.43]
  - - [832, 160, 1, 49]
    - [438, 959.247]
  - - [512, 1024, 1, 196]
    - [388, 4978.7]
  - - [2048, 64, 1, 1001]
    - [467, 4385.13]
  - - [2048, 128, 1, 1001]
    - [466, 5764.63]
  - - [1536, 64, 1, 1001]
    - [468, 3162.03]
  - - [32, 32, 64, 40000]
    - [492, 2449.4]
  - - [224, 192, 36, 5184]
    - [487, 7500.12]
  - - [32, 32, 49, 115200]
    - [493, 1878.28]
  - - [384, 448, 49, 512]
    - [483, 8945.32]
  - - [192, 80, 36, 20736]
    - [481, 5412.26]
  - - [384, 448, 64, 256]
    - [484, 9230.33]
  - - [96, 64, 64, 18432]
    - [470, 5008.4]
  - - [224, 192, 64, 4608]
    - [487, 8684.53]
  - - [96, 96, 49, 3136]
    - [491, 5183.63]
  - - [224, 192, 64, 2304]
    - [483, 8722.76]
  - - [64, 32, 49, 57600]
    - [474, 3565.26]
  - - [384, 448, 36, 256]
    - [482, 8843.41]
  - - [96, 64, 36, 10368]
    - [476, 4997.46]
  - - [96, 64, 36, 20736]
    - [478, 5034.77]
  - - [192, 80, 49, 14400]
    - [474, 4892.22]
  - - [96, 64, 49, 6272]
    - [494, 5617.04]
  - - [64, 32, 49, 115200]
    - [473, 3572.57]
  - - [384, 448, 49, 256]
    - [485, 8858.66]
  - - [96, 96, 64, 2304]
    - [481, 5379.02]
  - - [96, 96, 49, 6272]
    - [490, 5235.76]
  - - [224, 192, 49, 6272]
    - [486, 7629.28]
  - - [96, 96, 36, 10368]
    - [489, 5281.04]
  - - [96, 64, 36, 5184]
    - [475, 4945.73]
  - - [384, 448, 64, 512]
    - [482, 9294.86]
  - - [224, 192, 49, 3136]
    - [486, 7513.4]
  - - [384, 448, 36, 512]
    - [488, 8961.38]
  - - [32, 32, 36, 175232]
    - [496, 1385.5]
  - - [224, 192, 36, 10368]
    - [487, 7565.73]
  - - [64, 32, 64, 40000]
    - [473, 4658.85]
  - - [96, 64, 64, 4608]
    - [472, 5461.6]
  - - [32, 32, 49, 57600]
    - [493, 1877.01]
  - - [192, 80, 36, 41472]
    - [480, 5123.59]
  - - [32, 32, 36, 87616]
    - [492, 1382.32]
  - - [192, 80, 49, 28800]
    - [473, 4901.95]
  - - [96, 64, 49, 28800]
    - [471, 4862.5]
  - - [96, 64, 36, 41472]
    - [477, 5002.26]
  - - [192, 80, 64, 9216]
    - [469, 5300.55]
  - - [96, 96, 36, 5184]
    - [489, 5246.24]
  - - [32, 32, 64, 80000]
    - [497, 2457.11]
  - - [96, 64, 64, 2304]
    - [495, 6225.74]
  - - [96, 64, 49, 3136]
    - [494, 5489.02]
  - - [64, 32, 36, 87616]
    - [473, 2636.29]
  - - [64, 32, 64, 80000]
    - [473, 4677.64]
  - - [96, 96, 64, 4608]
    - [479, 5119.63]
  - - [64, 32, 36, 175232]
    - [474, 2639.83]
  - - [64, 64, 11, 233600]
    - [528, 1694.16]
  - - [320, 256, 9, 19584]
    - [504, 7802.45]
  - - [256, 224, 9, 9792]
    - [519, 7100.97]
  - - [128, 128, 11, 3264]
    - [525, 4828.06]
  - - [256, 256, 9, 4896]
    - [517, 6163.1]
  - - [320, 256, 9, 4896]
    - [503, 7515.25]
  - - [224, 192, 9, 19584]
    - [511, 5761.25]
  - - [192, 192, 11, 3264]
    - [500, 6814.07]
  - - [64, 64, 11, 116800]
    - [537, 1692.18]
  - - [64, 64, 9, 172864]
    - [529, 1385.54]
  - - [192, 128, 11, 6528]
    - [521, 5057.19]
  - - [64, 64, 11, 58400]
    - [537, 1688.53]
  - - [192, 160, 9, 19584]
    - [513, 4940.68]
  - - [128, 128, 9, 9792]
    - [535, 4094.51]
  - - [128, 128, 11, 6528]
    - [535, 4780.97]
  - - [192, 192, 11, 6528]
    - [500, 6918.07]
  - - [160, 160, 9, 4896]
    - [526, 4545.61]
  - - [192, 192, 9, 4896]
    - [516, 6156.67]
  - - [256, 256, 11, 13056]
    - [506, 7526.25]
  - - [224, 192, 11, 6528]
    - [530, 7333.58]
  - - [192, 192, 9, 19584]
    - [531, 5859.95]
  - - [256, 224, 11, 13056]
    - [504, 6512.15]
  - - [224, 192, 11, 13056]
    - [533, 6429.18]
  - - [256, 256, 11, 3264]
    - [501, 7366.03]
  - - [192, 160, 11, 13056]
    - [513, 5994.41]
  - - [320, 256, 11, 6528]
    - [510, 8725.7]
  - - [192, 192, 9, 9792]
    - [513, 5843.92]
  - - [192, 160, 11, 6528]
    - [522, 6308.46]
  - - [224, 224, 9, 9792]
    - [523, 6268.31]
  - - [64, 64, 9, 86432]
    - [528, 1382.91]
  - - [224, 192, 11, 3264]
    - [531, 7336.37]
  - - [128, 128, 9, 19584]
    - [498, 3631.15]
  - - [224, 224, 11, 6528]
    - [520, 5718.39]
  - - [160, 160, 11, 13056]
    - [532, 5005.14]
  - - [160, 160, 9, 19584]
    - [527, 4564.74]
  - - [192, 128, 9, 19584]
    - [498, 5444.53]
  - - [192, 160, 9, 9792]
    - [515, 5209.54]
  - - [224, 224, 9, 19584]
    - [523, 5549.59]
  - - [192, 192, 11, 13056]
    - [505, 7053.75]
  - - [192, 128, 9, 4896]
    - [505, 5314.67]
  - - [320, 256, 9, 9792]
    - [499, 7770.2]
  - - [320, 256, 11, 13056]
    - [509, 8806.16]
  - - [64, 64, 9, 345728]
    - [537, 1386.57]
  - - [128, 128, 9, 4896]
    - [535, 4041.34]
  - - [256, 256, 9, 9792]
    - [520, 6138.47]
  - - [224, 224, 9, 4896]
    - [512, 6936.98]
  - - [320, 256, 11, 3264]
    - [508, 8630.45]
  - - [256, 256, 11, 6528]
    - [500, 7354.98]
  - - [224, 192, 9, 4896]
    - [532, 6747.03]
  - - [256, 224, 9, 19584]
    - [507, 5923.69]
  - - [192, 128, 11, 3264]
    - [518, 4952.72]
  - - [224, 224, 11, 13056]
    - [520, 5747.58]
  - - [224, 224, 11, 3264]
    - [523, 5738.78]
  - - [160, 160, 11, 3264]
    - [521, 5133.73]
  - - [256, 224, 11, 6528]
    - [514, 6509.68]
  - - [128, 128, 11, 13056]
    - [505, 4411.67]
  - - [192, 160, 9, 4896]
    - [534, 5118.14]
  - - [256, 224, 11, 3264]
    - [524, 6508.85]
  - - [160, 160, 9, 9792]
    - [536, 4552.22]
  - - [192, 160, 11, 3264]
    - [515, 6185.35]
  - - [256, 256, 9, 19584]
    - [504, 6147.61]
  - - [192, 128, 11, 13056]
    - [515, 5112.27]
  - - [224, 192, 9, 9792]
    - [502, 6657.91]
  - - [160, 160, 11, 6528]
    - [521, 5254.64]
  - - [256, 224, 9, 4896]
    - [514, 7023.59]
  - - [192, 128, 9, 9792]
    - [505, 5400.54]
  - - [1024, 6400, 1, 65]
    - [538, 5298.31]
  - - [4096, 6400, 1, 256]
    - [539, 9150.88]
  - - [4096, 64, 1, 1024]
    - [540, 5482.75]
  - - [512, 3381, 1, 2048]
    - [555, 7390.83]
  - - [512, 3388, 1, 2048]
    - [577, 7395.04]
  - - [512, 3414, 1, 2048]
    - [573, 7464.22]
  - - [512, 3443, 1, 2048]
    - [564, 7502.59]
  - - [512, 3503, 1, 2048]
    - [556, 7600.48]
  - - [512, 3520, 1, 2048]
    - [576, 7614.68]
  - - [512, 3796, 1, 512]
    - [562, 8172.62]
  - - [512, 3822, 1, 512]
    - [584, 8174.89]
  - - [512, 3859, 1, 512]
    - [562, 8346.65]
  - - [512, 3870, 1, 512]
    - [578, 8326.47]
  - - [512, 3876, 1, 512]
    - [574, 8258.05]
  - - [512, 4059, 1, 512]
    - [587, 8704.54]
  - - [2048, 3234, 1, 512]
    - [547, 8606.84]
  - - [2048, 3364, 1, 512]
    - [579, 8461.45]
  - - [2048, 3458, 1, 512]
    - [579, 8691.22]
  - - [2048, 3467, 1, 512]
    - [548, 8710.5]
  - - [33708, 3906, 1, 512]
    - [588, 9879.9]
  - - [33708, 3910, 1, 512]
    - [576, 9904.88]
  - - [33708, 4030, 1, 512]
    - [576, 9869.87]
  - - [18, 18, 648, 64]
    - [631, 733.457]
  - - [49, 49, 160, 64]
    - [604, 1449.66]
  - - [54, 54, 592, 64]
    - [601, 3041.89]
  - - [59, 59, 512, 64]
    - [599, 3346.99]
  - - [64, 64, 496, 64]
    - [637, 4369.07]
  - - [104, 104, 16, 64]
    - [610, 910.821]
  - - [135, 135, 32, 64]
    - [638, 2055.33]
  - - [512, 2790, 1, 2048]
    - [556, 6335.6]
  - - [512, 2864, 1, 2048]
    - [564, 6465.56]
  - - [512, 3092, 1, 2048]
    - [555, 6837.77]
  - - [512, 3113, 1, 2048]
    - [564, 6906.35]
  - - [512, 3137, 1, 2048]
    - [573, 6979.68]
  - - [512, 3165, 1, 2048]
    - [589, 6995.66]
  - - [512, 3166, 1, 2048]
    - [556, 7045.4]
  - - [512, 3194, 1, 2048]
    - [588, 7057.38]
  - - [512, 3219, 1, 2048]
    - [556, 7110.23]
  - - [512, 3222, 1, 2048]
    - [569, 7091.75]
  - - [512, 3234, 1, 2048]
    - [576, 7151.79]
  - - [512, 3237, 1, 2048]
    - [576, 7234.1]
  - - [512, 3242, 1, 2048]
    - [582, 7153.8]
  - - [512, 3246, 1, 2048]
    - [572, 7129.02]
  - - [512, 3249, 1, 2048]
    - [552, 7128.44]
  - - [512, 3251, 1, 2048]
    - [556, 7238.24]
  - - [512, 3257, 1, 2048]
    - [588, 7217.27]
  - - [512, 3262, 1, 2048]
    - [563, 7239.36]
  - - [512, 3268, 1, 2048]
    - [552, 7279.8]
  - - [512, 3282, 1, 2048]
    - [564, 7248.16]
  - - [512, 3286, 1, 2048]
    - [589, 7276.61]
  - - [512, 3287, 1, 2048]
    - [589, 7296.08]
  - - [512, 3293, 1, 2048]
    - [555, 7257.78]
  - - [512, 3297, 1, 2048]
    - [556, 7224.08]
  - - [512, 3307, 1, 2048]
    - [582, 7224.25]
  - - [512, 3314, 1, 2048]
    - [589, 7216.69]
  - - [512, 3315, 1, 2048]
    - [573, 7224.87]
  - - [512, 3319, 1, 2048]
    - [552, 7188.17]
  - - [512, 3322, 1, 2048]
    - [585, 7225.71]
  - - [512, 3323, 1, 2048]
    - [556, 7231.48]
  - - [512, 3324, 1, 2048]
    - [560, 7219.28]
  - - [512, 3325, 1, 2048]
    - [573, 7201.16]
  - - [512, 3327, 1, 2048]
    - [585, 7229.39]
  - - [512, 3329, 1, 2048]
    - [556, 7302.74]
  - - [512, 3332, 1, 2048]
    - [576, 7218.71]
  - - [512, 3336, 1, 2048]
    - [589, 7366.18]
  - - [512, 3339, 1, 2048]
    - [582, 7340.65]
  - - [512, 3342, 1, 2048]
    - [556, 7330.03]
  - - [512, 3344, 1, 2048]
    - [560, 7216.08]
  - - [512, 3358, 1, 2048]
    - [553, 7308.86]
  - - [512, 3360, 1, 2048]
    - [553, 7315.65]
  - - [512, 3364, 1, 2048]
    - [560, 7297.69]
  - - [512, 3365, 1, 2048]
    - [573, 7358.31]
  - - [512, 3369, 1, 2048]
    - [556, 7389.25]
  - - [512, 3371, 1, 2048]
    - [556, 7337.16]
  - - [512, 3374, 1, 2048]
    - [553, 7386.62]
  - - [512, 3376, 1, 2048]
    - [589, 7431.96]
  - - [512, 3377, 1, 2048]
    - [589, 7393.19]
  - - [512, 3378, 1, 2048]
    - [576, 7426.39]
  - - [512, 3382, 1, 2048]
    - [560, 7350.12]
  - - [512, 3383, 1, 2048]
    - [589, 7398.91]
  - - [512, 3384, 1, 2048]
    - [573, 7407.28]
  - - [512, 3385, 1, 2048]
    - [556, 7363.96]
  - - [512, 3386, 1, 2048]
    - [564, 7447.72]
  - - [512, 3390, 1, 2048]
    - [564, 7421.65]
  - - [512, 3391, 1, 2048]
    - [573, 7374.57]
  - - [512, 3396, 1, 2048]
    - [588, 7449.72]
  - - [512, 3399, 1, 2048]
    - [576, 7391.96]
  - - [512, 3402, 1, 2048]
    - [577, 7376.46]
  - - [512, 3410, 1, 2048]
    - [556, 7418.35]
  - - [512, 3412, 1, 2048]
    - [564, 7365.24]
  - - [512, 3415, 1, 2048]
    - [563, 7472.64]
  - - [512, 3418, 1, 2048]
    - [556, 7461.76]
  - - [512, 3420, 1, 2048]
    - [585, 7336.6]
  - - [512, 3422, 1, 2048]
    - [556, 7444.45]
  - - [512, 3425, 1, 2048]
    - [563, 7472.06]
  - - [512, 3426, 1, 2048]
    - [564, 7442.04]
  - - [512, 3427, 1, 2048]
    - [588, 7439.28]
  - - [512, 3428, 1, 2048]
    - [556, 7421.78]
  - - [512, 3430, 1, 2048]
    - [564, 7476.75]
  - - [512, 3431, 1, 2048]
    - [572, 7487.65]
  - - [512, 3432, 1, 2048]
    - [589, 7482.35]
  - - [512, 3438, 1, 2048]
    - [589, 7484.23]
  - - [512, 3439, 1, 2048]
    - [553, 7454.22]
  - - [512, 3440, 1, 2048]
    - [556, 7429.36]
  - - [512, 3445, 1, 2048]
    - [577, 7429.14]
  - - [512, 3447, 1, 2048]
    - [556, 7443.25]
  - - [512, 3448, 1, 2048]
    - [553, 7441.73]
  - - [512, 3450, 1, 2048]
    - [556, 7481.77]
  - - [512, 3451, 1, 2048]
    - [572, 7415.24]
  - - [512, 3452, 1, 2048]
    - [553, 7487.35]
  - - [512, 3453, 1, 2048]
    - [556, 7509.4]
  - - [512, 3455, 1, 2048]
    - [559, 7442.13]
  - - [512, 3456, 1, 2048]
    - [576, 7405.34]
  - - [512, 3457, 1, 2048]
    - [555, 7518.1]
  - - [512, 3458, 1, 2048]
    - [589, 7459.63]
  - - [512, 3459, 1, 2048]
    - [585, 7374.4]
  - - [512, 3460, 1, 2048]
    - [564, 7487.36]
  - - [512, 3461, 1, 2048]
    - [572, 7500.66]
  - - [512, 3462, 1, 2048]
    - [556, 7492.92]
  - - [512, 3466, 1, 2048]
    - [564, 7540.18]
  - - [512, 3467, 1, 2048]
    - [577, 7448.4]
  - - [512, 3468, 1, 2048]
    - [589, 7496.0]
  - - [512, 3470, 1, 2048]
    - [588, 7523.9]
  - - [512, 3471, 1, 2048]
    - [573, 7543.54]
  - - [512, 3472, 1, 2048]
    - [555, 7560.76]
  - - [512, 3475, 1, 2048]
    - [585, 7538.48]
  - - [512, 3476, 1, 2048]
    - [572, 7539.41]
  - - [512, 3477, 1, 2048]
    - [589, 7559.09]
  - - [512, 3478, 1, 2048]
    - [588, 7614.3]
  - - [512, 3479, 1, 2048]
    - [555, 7518.54]
  - - [512, 3480, 1, 2048]
    - [563, 7604.71]
  - - [512, 3481, 1, 2048]
    - [564, 7480.93]
  - - [512, 3483, 1, 2048]
    - [588, 7570.88]
  - - [512, 3484, 1, 2048]
    - [556, 7540.54]
  - - [512, 3487, 1, 2048]
    - [564, 7559.51]
  - - [512, 3489, 1, 2048]
    - [589, 7556.35]
  - - [512, 3490, 1, 2048]
    - [563, 7607.54]
  - - [512, 3491, 1, 2048]
    - [585, 7566.93]
  - - [512, 3493, 1, 2048]
    - [553, 7619.15]
  - - [512, 3494, 1, 2048]
    - [556, 7651.89]
  - - [512, 3495, 1, 2048]
    - [589, 7568.09]
  - - [512, 3497, 1, 2048]
    - [556, 7556.19]
  - - [512, 3498, 1, 2048]
    - [555, 7617.38]
  - - [512, 3499, 1, 2048]
    - [588, 7599.35]
  - - [512, 3501, 1, 2048]
    - [563, 7576.08]
  - - [512, 3507, 1, 2048]
    - [576, 7619.25]
  - - [512, 3508, 1, 2048]
    - [569, 7621.43]
  - - [512, 3509, 1, 2048]
    - [556, 7637.52]
  - - [512, 3511, 1, 2048]
    - [564, 7673.73]
  - - [512, 3514, 1, 2048]
    - [556, 7649.68]
  - - [512, 3515, 1, 2048]
    - [576, 7605.12]
  - - [512, 3517, 1, 2048]
    - [576, 7616.99]
  - - [512, 3518, 1, 2048]
    - [556, 7690.32]
  - - [512, 3519, 1, 2048]
    - [577, 7664.38]
  - - [512, 3523, 1, 2048]
    - [556, 7702.53]
  - - [512, 3528, 1, 2048]
    - [589, 7531.3]
  - - [512, 3529, 1, 2048]
    - [569, 7688.71]
  - - [512, 3530, 1, 2048]
    - [577, 7667.95]
  - - [512, 3532, 1, 2048]
    - [556, 7668.48]
  - - [512, 3533, 1, 2048]
    - [589, 7567.86]
  - - [512, 3534, 1, 2048]
    - [556, 7592.34]
  - - [512, 3538, 1, 2048]
    - [589, 7705.76]
  - - [512, 3539, 1, 2048]
    - [589, 7706.66]
  - - [512, 3541, 1, 2048]
    - [553, 7711.01]
  - - [512, 3547, 1, 2048]
    - [589, 7666.76]
  - - [512, 3548, 1, 2048]
    - [564, 7708.33]
  - - [512, 3552, 1, 2048]
    - [582, 7627.26]
  - - [512, 3564, 1, 2048]
    - [564, 7623.05]
  - - [512, 3575, 1, 2048]
    - [553, 7693.03]
  - - [512, 3598, 1, 2048]
    - [589, 7643.39]
  - - [512, 3599, 1, 2048]
    - [564, 7743.4]
  - - [512, 3608, 1, 2048]
    - [556, 7731.04]
  - - [512, 3780, 1, 512]
    - [580, 8116.84]
  - - [512, 3780, 1, 2048]
    - [556, 8083.74]
  - - [512, 3796, 1, 2048]
    - [553, 7990.19]
  - - [512, 3822, 1, 2048]
    - [589, 8056.56]
  - - [512, 3840, 1, 512]
    - [581, 8267.35]
  - - [512, 3840, 1, 2048]
    - [577, 8080.21]
  - - [512, 3859, 1, 2048]
    - [555, 8004.54]
  - - [512, 3870, 1, 2048]
    - [585, 8023.55]
  - - [512, 3876, 1, 2048]
    - [577, 8188.83]
  - - [512, 3906, 1, 512]
    - [568, 8289.62]
  - - [512, 3906, 1, 2048]
    - [560, 8181.0]
  - - [512, 3910, 1, 512]
    - [568, 8330.49]
  - - [512, 3910, 1, 2048]
    - [559, 8088.57]
  - - [512, 3925, 1, 512]
    - [588, 8378.79]
  - - [512, 3925, 1, 2048]
    - [588, 8094.05]
  - - [512, 3927, 1, 512]
    - [575, 8521.85]
  - - [512, 3942, 1, 512]
    - [571, 8415.08]
  - - [512, 3942, 1, 2048]
    - [589, 8243.23]
  - - [512, 3944, 1, 512]
    - [557, 8469.0]
  - - [512, 3944, 1, 2048]
    - [555, 8162.77]
  - - [512, 3955, 1, 512]
    - [576, 8388.18]
  - - [512, 3955, 1, 2048]
    - [588, 8198.48]
  - - [512, 3968, 1, 512]
    - [568, 8481.63]
  - - [512, 3968, 1, 2048]
    - [556, 8231.94]
  - - [512, 3969, 1, 512]
    - [570, 8489.31]
  - - [512, 3969, 1, 2048]
    - [559, 8148.88]
  - - [512, 3976, 1, 512]
    - [586, 8560.16]
  - - [512, 3976, 1, 2048]
    - [555, 8221.21]
  - - [512, 3977, 1, 512]
    - [567, 8473.23]
  - - [512, 3977, 1, 2048]
    - [563, 8185.83]
  - - [512, 3978, 1, 512]
    - [586, 8604.03]
  - - [512, 3978, 1, 2048]
    - [563, 8135.5]
  - - [512, 3990, 1, 512]
    - [561, 8579.02]
  - - [512, 3990, 1, 2048]
    - [555, 8237.16]
  - - [512, 3995, 1, 512]
    - [586, 8686.67]
  - - [512, 3995, 1, 2048]
    - [563, 8228.04]
  - - [512, 3996, 1, 512]
    - [586, 8547.06]
  - - [512, 3996, 1, 2048]
    - [555, 8171.04]
  - - [512, 3999, 1, 512]
    - [554, 8575.87]
  - - [512, 3999, 1, 2048]
    - [563, 8187.39]
  - - [512, 4005, 1, 512]
    - [574, 8622.59]
  - - [512, 4005, 1, 2048]
    - [563, 8278.56]
  - - [512, 4012, 1, 512]
    - [550, 8476.16]
  - - [512, 4012, 1, 2048]
    - [552, 8237.17]
  - - [512, 4020, 1, 512]
    - [584, 8581.59]
  - - [512, 4020, 1, 2048]
    - [588, 8345.1]
  - - [512, 4026, 1, 512]
    - [561, 8650.75]
  - - [512, 4026, 1, 2048]
    - [576, 8297.1]
  - - [512, 4030, 1, 512]
    - [574, 8670.72]
  - - [512, 4030, 1, 2048]
    - [564, 8230.29]
  - - [512, 4032, 1, 512]
    - [586, 8629.69]
  - - [512, 4032, 1, 2048]
    - [563, 8287.32]
  - - [512, 4050, 1, 512]
    - [554, 8736.7]
  - - [2048, 2790, 1, 512]
    - [548, 8682.12]
  - - [2048, 2864, 1, 512]
    - [565, 8857.72]
  - - [2048, 3092, 1, 512]
    - [548, 8249.03]
  - - [2048, 3113, 1, 512]
    - [547, 8294.92]
  - - [2048, 3137, 1, 512]
    - [548, 8391.28]
  - - [2048, 3165, 1, 512]
    - [548, 8450.66]
  - - [2048, 3166, 1, 512]
    - [548, 8431.0]
  - - [2048, 3194, 1, 512]
    - [547, 8509.02]
  - - [2048, 3219, 1, 512]
    - [547, 8586.1]
  - - [2048, 3222, 1, 512]
    - [547, 8583.62]
  - - [2048, 3237, 1, 512]
    - [548, 8634.11]
  - - [2048, 3242, 1, 512]
    - [548, 8617.63]
  - - [2048, 3246, 1, 512]
    - [547, 8612.54]
  - - [2048, 3249, 1, 512]
    - [548, 8624.0]
  - - [2048, 3251, 1, 512]
    - [548, 8639.8]
  - - [2048, 3257, 1, 512]
    - [548, 8645.23]
  - - [2048, 3262, 1, 512]
    - [547, 8660.26]
  - - [2048, 3268, 1, 512]
    - [547, 8725.67]
  - - [2048, 3282, 1, 512]
    - [547, 8736.36]
  - - [2048, 3286, 1, 512]
    - [548, 8732.82]
  - - [2048, 3287, 1, 512]
    - [548, 8742.57]
  - - [2048, 3293, 1, 512]
    - [547, 8742.56]
  - - [2048, 3297, 1, 512]
    - [547, 8739.02]
  - - [2048, 3307, 1, 512]
    - [548, 8772.62]
  - - [2048, 3314, 1, 512]
    - [548, 8809.02]
  - - [2048, 3315, 1, 512]
    - [548, 8783.18]
  - - [2048, 3319, 1, 512]
    - [547, 8806.23]
  - - [2048, 3322, 1, 512]
    - [548, 8830.28]
  - - [2048, 3323, 1, 512]
    - [548, 8779.53]
  - - [2048, 3324, 1, 512]
    - [548, 8801.68]
  - - [2048, 3325, 1, 512]
    - [547, 8806.11]
  - - [2048, 3327, 1, 512]
    - [547, 8818.53]
  - - [2048, 3329, 1, 512]
    - [581, 8540.59]
  - - [2048, 3332, 1, 512]
    - [548, 8395.46]
  - - [2048, 3336, 1, 512]
    - [548, 8392.63]
  - - [2048, 3339, 1, 512]
    - [579, 8393.74]
  - - [2048, 3342, 1, 512]
    - [581, 8527.21]
  - - [2048, 3344, 1, 512]
    - [579, 8422.46]
  - - [2048, 3358, 1, 512]
    - [547, 8447.98]
  - - [2048, 3360, 1, 512]
    - [581, 8579.82]
  - - [2048, 3365, 1, 512]
    - [547, 8438.06]
  - - [2048, 3369, 1, 512]
    - [548, 8461.04]
  - - [2048, 3371, 1, 512]
    - [547, 8451.49]
  - - [2048, 3374, 1, 512]
    - [579, 8471.97]
  - - [2048, 3376, 1, 512]
    - [566, 8496.53]
  - - [2048, 3377, 1, 512]
    - [579, 8486.01]
  - - [2048, 3378, 1, 512]
    - [579, 8495.03]
  - - [2048, 3381, 1, 512]
    - [581, 8606.61]
  - - [2048, 3382, 1, 512]
    - [566, 8518.17]
  - - [2048, 3383, 1, 512]
    - [579, 8523.96]
  - - [2048, 3384, 1, 512]
    - [566, 8524.84]
  - - [2048, 3385, 1, 512]
    - [566, 8529.0]
  - - [2048, 3386, 1, 512]
    - [566, 8511.89]
  - - [2048, 3388, 1, 512]
    - [579, 8536.56]
  - - [2048, 3390, 1, 512]
    - [579, 8521.94]
  - - [2048, 3391, 1, 512]
    - [566, 8534.28]
  - - [2048, 3396, 1, 512]
    - [579, 8541.94]
  - - [2048, 3399, 1, 512]
    - [579, 8556.05]
  - - [2048, 3402, 1, 512]
    - [547, 8543.92]
  - - [2048, 3410, 1, 512]
    - [547, 8557.45]
  - - [2048, 3412, 1, 512]
    - [547, 8557.55]
  - - [2048, 3414, 1, 512]
    - [548, 8574.05]
  - - [2048, 3415, 1, 512]
    - [579, 8588.08]
  - - [2048, 3418, 1, 512]
    - [566, 8574.24]
  - - [2048, 3420, 1, 512]
    - [548, 8590.77]
  - - [2048, 3422, 1, 512]
    - [548, 8592.5]
  - - [2048, 3425, 1, 512]
    - [547, 8598.38]
  - - [2048, 3426, 1, 512]
    - [547, 8599.25]
  - - [2048, 3427, 1, 512]
    - [547, 8598.46]
  - - [2048, 3428, 1, 512]
    - [579, 8619.12]
  - - [2048, 3430, 1, 512]
    - [579, 8605.99]
  - - [2048, 3431, 1, 512]
    - [581, 8700.1]
  - - [2048, 3432, 1, 512]
    - [547, 8615.96]
  - - [2048, 3438, 1, 512]
    - [566, 8604.65]
  - - [2048, 3439, 1, 512]
    - [579, 8638.49]
  - - [2048, 3440, 1, 512]
    - [566, 8632.73]
  - - [2048, 3443, 1, 512]
    - [579, 8650.2]
  - - [2048, 3445, 1, 512]
    - [568, 8695.23]
  - - [2048, 3447, 1, 512]
    - [581, 8695.25]
  - - [2048, 3448, 1, 512]
    - [579, 8649.5]
  - - [2048, 3450, 1, 512]
    - [579, 8646.24]
  - - [2048, 3451, 1, 512]
    - [579, 8668.64]
  - - [2048, 3452, 1, 512]
    - [581, 8733.07]
  - - [2048, 3453, 1, 512]
    - [548, 8638.89]
  - - [2048, 3455, 1, 512]
    - [566, 8663.74]
  - - [2048, 3456, 1, 512]
    - [547, 8699.54]
  - - [2048, 3457, 1, 512]
    - [548, 8698.71]
  - - [2048, 3459, 1, 512]
    - [566, 8667.14]
  - - [2048, 3460, 1, 512]
    - [548, 8699.58]
  - - [2048, 3461, 1, 512]
    - [548, 8695.42]
  - - [2048, 3462, 1, 512]
    - [548, 8684.62]
  - - [2048, 3466, 1, 512]
    - [547, 8697.98]
  - - [2048, 3468, 1, 512]
    - [548, 8711.34]
  - - [2048, 3470, 1, 512]
    - [548, 8716.36]
  - - [2048, 3471, 1, 512]
    - [547, 8690.56]
  - - [2048, 3472, 1, 512]
    - [548, 8704.7]
  - - [2048, 3475, 1, 512]
    - [547, 8712.23]
  - - [2048, 3476, 1, 512]
    - [566, 8706.41]
  - - [2048, 3477, 1, 512]
    - [579, 8744.0]
  - - [2048, 3478, 1, 512]
    - [579, 8729.77]
  - - [2048, 3479, 1, 512]
    - [547, 8720.59]
  - - [2048, 3480, 1, 512]
    - [548, 8728.1]
  - - [2048, 3481, 1, 512]
    - [548, 8745.67]
  - - [2048, 3483, 1, 512]
    - [548, 8718.94]
  - - [2048, 3484, 1, 512]
    - [547, 8748.18]
  - - [2048, 3487, 1, 512]
    - [566, 8750.68]
  - - [2048, 3489, 1, 512]
    - [579, 8745.65]
  - - [2048, 3490, 1, 512]
    - [547, 8749.83]
  - - [2048, 3491, 1, 512]
    - [547, 8743.98]
  - - [2048, 3493, 1, 512]
    - [579, 8740.64]
  - - [2048, 3494, 1, 512]
    - [547, 8773.29]
  - - [2048, 3495, 1, 512]
    - [566, 8759.02]
  - - [2048, 3497, 1, 512]
    - [547, 8753.99]
  - - [2048, 3498, 1, 512]
    - [579, 8769.89]
  - - [2048, 3499, 1, 512]
    - [566, 8777.43]
  - - [2048, 3501, 1, 512]
    - [579, 8764.0]
  - - [2048, 3503, 1, 512]
    - [579, 8802.63]
  - - [2048, 3507, 1, 512]
    - [548, 8789.09]
  - - [2048, 3508, 1, 512]
    - [579, 8793.28]
  - - [2048, 3509, 1, 512]
    - [579, 8772.3]
  - - [2048, 3511, 1, 512]
    - [579, 8826.12]
  - - [2048, 3514, 1, 512]
    - [566, 8821.82]
  - - [2048, 3515, 1, 512]
    - [566, 8797.37]
  - - [2048, 3517, 1, 512]
    - [566, 8788.95]
  - - [2048, 3518, 1, 512]
    - [579, 8803.19]
  - - [2048, 3519, 1, 512]
    - [566, 8793.94]
  - - [2048, 3520, 1, 512]
    - [547, 8860.64]
  - - [2048, 3523, 1, 512]
    - [548, 8837.64]
  - - [2048, 3528, 1, 512]
    - [547, 8843.41]
  - - [2048, 3529, 1, 512]
    - [548, 8844.23]
  - - [2048, 3530, 1, 512]
    - [548, 8858.59]
  - - [2048, 3532, 1, 512]
    - [579, 8882.32]
  - - [2048, 3533, 1, 512]
    - [548, 8862.72]
  - - [2048, 3534, 1, 512]
    - [566, 8848.3]
  - - [2048, 3538, 1, 512]
    - [579, 8860.01]
  - - [2048, 3539, 1, 512]
    - [548, 8848.99]
  - - [2048, 3541, 1, 512]
    - [579, 8874.3]
  - - [2048, 3547, 1, 512]
    - [566, 8882.54]
  - - [2048, 3548, 1, 512]
    - [547, 8859.66]
  - - [2048, 3552, 1, 512]
    - [548, 8903.57]
  - - [2048, 3564, 1, 512]
    - [548, 8891.14]
  - - [2048, 3575, 1, 512]
    - [579, 8932.18]
  - - [2048, 3598, 1, 512]
    - [565, 8472.82]
  - - [2048, 3599, 1, 512]
    - [567, 8469.09]
  - - [2048, 3608, 1, 512]
    - [586, 8499.42]
  - - [2048, 3780, 1, 512]
    - [558, 8844.2]
  - - [2048, 3796, 1, 512]
    - [570, 8864.23]
  - - [2048, 3822, 1, 512]
    - [551, 8928.13]
  - - [2048, 3840, 1, 512]
    - [580, 9016.78]
  - - [2048, 3859, 1, 512]
    - [583, 9000.12]
  - - [2048, 3870, 1, 512]
    - [558, 9041.87]
  - - [2048, 3876, 1, 512]
    - [586, 9063.96]
  - - [2048, 3906, 1, 512]
    - [558, 9103.26]
  - - [2048, 3910, 1, 512]
    - [570, 9125.56]
  - - [2048, 3925, 1, 512]
    - [551, 9142.66]
  - - [2048, 3942, 1, 512]
    - [583, 9192.06]
  - - [2048, 3944, 1, 512]
    - [565, 9186.92]
  - - [2048, 3955, 1, 512]
    - [578, 9215.82]
  - - [2048, 3968, 1, 512]
    - [580, 9295.69]
  - - [2048, 3969, 1, 512]
    - [574, 9256.67]
  - - [2048, 3976, 1, 512]
    - [574, 9264.75]
  - - [2048, 3977, 1, 512]
    - [586, 9283.59]
  - - [2048, 3978, 1, 512]
    - [574, 9274.36]
  - - [2048, 3990, 1, 512]
    - [578, 9285.82]
  - - [2048, 3995, 1, 512]
    - [551, 9282.62]
  - - [2048, 3996, 1, 512]
    - [583, 9304.74]
  - - [2048, 3999, 1, 512]
    - [574, 9295.21]
  - - [2048, 4005, 1, 512]
    - [570, 9335.65]
  - - [2048, 4012, 1, 512]
    - [586, 9345.31]
  - - [2048, 4020, 1, 512]
    - [558, 9344.02]
  - - [2048, 4026, 1, 512]
    - [565, 9374.59]
  - - [2048, 4030, 1, 512]
    - [583, 9383.91]
  - - [2048, 4032, 1, 512]
    - [551, 9365.27]
  - - [33708, 184, 1, 512]
    - [549, 7986.83]
  - - [33708, 189, 1, 512]
    - [545, 8220.4]
  - - [33708, 208, 1, 512]
    - [544, 7184.13]
  - - [33708, 246, 1, 512]
    - [547, 8180.96]
  - - [33708, 264, 1, 512]
    - [542, 7608.96]
  - - [33708, 465, 1, 512]
    - [543, 8387.55]
  - - [33708, 468, 1, 512]
    - [571, 8415.63]
  - - [33708, 493, 1, 512]
    - [585, 8788.26]
  - - [33708, 540, 1, 512]
    - [546, 8455.75]
  - - [33708, 550, 1, 512]
    - [546, 8623.61]
  - - [33708, 560, 1, 512]
    - [544, 8723.97]
  - - [33708, 644, 1, 512]
    - [546, 8533.84]
  - - [33708, 714, 1, 512]
    - [573, 8801.84]
  - - [33708, 720, 1, 512]
    - [585, 8862.13]
  - - [33708, 781, 1, 512]
    - [544, 8726.69]
  - - [33708, 936, 1, 512]
    - [549, 9001.63]
  - - [33708, 980, 1, 512]
    - [579, 9187.64]
  - - [33708, 1232, 1, 512]
    - [581, 9315.84]
  - - [33708, 1290, 1, 512]
    - [581, 9003.64]
  - - [33708, 1350, 1, 512]
    - [581, 9373.59]
  - - [33708, 1424, 1, 512]
    - [568, 9134.74]
  - - [33708, 1458, 1, 512]
    - [568, 9333.42]
  - - [33708, 1462, 1, 512]
    - [581, 9375.44]
  - - [33708, 1520, 1, 512]
    - [568, 9678.9]
  - - [33708, 1596, 1, 512]
    - [568, 9452.5]
  - - [33708, 1599, 1, 512]
    - [568, 9480.15]
  - - [33708, 1615, 1, 512]
    - [581, 9562.4]
  - - [33708, 1680, 1, 512]
    - [581, 9286.85]
  - - [33708, 1917, 1, 512]
    - [581, 9871.27]
  - - [33708, 2205, 1, 512]
    - [576, 9471.32]
  - - [33708, 2418, 1, 512]
    - [581, 9829.81]
  - - [33708, 2496, 1, 512]
    - [568, 9676.1]
  - - [33708, 3776, 1, 512]
    - [588, 9858.54]
  - - [33708, 3780, 1, 512]
    - [588, 9868.03]
  - - [33708, 3796, 1, 512]
    - [581, 9894.23]
  - - [33708, 3822, 1, 512]
    - [588, 9974.05]
  - - [33708, 3835, 1, 512]
    - [576, 10006.9]
  - - [33708, 3840, 1, 512]
    - [576, 10062.8]
  - - [33708, 3859, 1, 512]
    - [576, 9775.46]
  - - [33708, 3864, 1, 512]
    - [576, 9791.92]
  - - [33708, 3870, 1, 512]
    - [588, 9822.24]
  - - [33708, 3876, 1, 512]
    - [588, 9815.64]
  - - [33708, 3925, 1, 512]
    - [588, 9932.85]
  - - [33708, 3942, 1, 512]
    - [588, 9963.13]
  - - [33708, 3944, 1, 512]
    - [576, 9959.9]
  - - [33708, 3955, 1, 512]
    - [588, 10012.6]
  - - [33708, 3968, 1, 512]
    - [588, 10074.4]
  - - [33708, 3969, 1, 512]
    - [588, 9757.25]
  - - [33708, 3976, 1, 512]
    - [588, 9774.46]
  - - [33708, 3977, 1, 512]
    - [588, 9772.91]
  - - [33708, 3978, 1, 512]
    - [576, 9775.92]
  - - [33708, 3990, 1, 512]
    - [576, 9795.15]
  - - [33708, 3995, 1, 512]
    - [576, 9809.32]
  - - [33708, 3996, 1, 512]
    - [588, 9810.99]
  - - [33708, 3999, 1, 512]
    - [576, 9815.79]
  - - [33708, 4005, 1, 512]
    - [576, 9823.03]
  - - [33708, 4012, 1, 512]
    - [576, 9841.31]
  - - [33708, 4020, 1, 512]
    - [588, 9852.98]
  - - [33708, 4026, 1, 512]
    - [576, 9890.84]
  - - [33708, 4032, 1, 512]
    - [576, 9893.64]
  - - [7, 7, 736, 64]
    - [648, 131.142]
  - - [8, 8, 264, 64]
    - [642, 86.0943]
  - - [9, 9, 416, 64]
    - [527, 148.114]
  - - [10, 10, 448, 64]
    - [636, 194.783]
  - - [11, 11, 568, 64]
    - [630, 266.905]
  - - [12, 12, 480, 64]
    - [655, 288.0]
  - - [12, 12, 2520, 64]
    - [647, 618.985]
  - - [13, 13, 576, 64]
    - [654, 374.4]
  - - [13, 13, 2336, 64]
    - [625, 714.541]
  - - [14, 14, 704, 64]
    - [651, 479.944]
  - - [14, 14, 2184, 64]
    - [648, 807.668]
  - - [15, 15, 688, 64]
    - [634, 543.158]
  - - [15, 15, 2048, 64]
    - [619, 901.32]
  - - [16, 16, 712, 64]
    - [635, 633.99]
  - - [16, 16, 1920, 64]
    - [622, 1016.06]
  - - [17, 17, 688, 64]
    - [635, 691.59]
  - - [17, 17, 1816, 64]
    - [648, 1116.65]
  - - [18, 18, 1720, 64]
    - [626, 1224.79]
  - - [19, 19, 680, 64]
    - [617, 842.85]
  - - [19, 19, 1632, 64]
    - [626, 1331.42]
  - - [21, 21, 1472, 64]
    - [630, 1479.55]
  - - [21, 21, 1488, 64]
    - [625, 1487.16]
  - - [23, 23, 64, 64]
    - [615, 193.463]
  - - [23, 23, 1360, 64]
    - [623, 1663.45]
  - - [25, 25, 176, 64]
    - [527, 578.947]
  - - [25, 25, 1256, 64]
    - [627, 1830.9]
  - - [26, 26, 56, 64]
    - [632, 217.876]
  - - [26, 27, 56, 64]
    - [527, 226.256]
